{
  "$schema": "../../../schemas/vibe-module.schema.json",
  "lesson": {
    "id": "lesson-uk-C1-01",
    "moduleId": "mod-uk-C1-01",
    "languagePair": "l2-uk-en",
    "subject": "language",
    "owner": "curricula-opus",
    "visibility": "public",
    "language": "uk",
    "targetLevel": "C1",
    "phase": "C1.1",
    "moduleNumber": 1,
    "moduleType": "grammar",
    "pedagogy": "TTT",
    "immersionLevel": 0.95,
    "title": "B2 Review & Bridge to C1",
    "titleUk": null,
    "subtitle": "ÐŸÐ¾Ð²Ñ‚Ð¾Ñ€ÐµÐ½Ð½Ñ Ñ‚Ð° Ð¿ÐµÑ€ÐµÑ…Ñ–Ð´ Ð´Ð¾ Ð¿Ñ€Ð¾ÑÑƒÐ½ÑƒÑ‚Ð¾Ð³Ð¾ Ñ€Ñ–Ð²Ð½Ñ",
    "description": "Learner can select the correct passive voice form for each register",
    "objectives": [
      "Learner can select the correct passive voice form for each register",
      "Learner can transform sentences between active and passive voice",
      "Learner can identify and correct register mismatches in academic writing",
      "Learner can apply B2 phraseology in academic contexts"
    ],
    "objectivesUk": null,
    "grammarFocus": [
      "passive-voice-forms",
      "register-selection",
      "functional-styles"
    ],
    "tags": [
      "passive-voice",
      "register",
      "academic-style",
      "official-style",
      "B2-review"
    ],
    "totalDuration": 90,
    "transliterationMode": "none",
    "sections": [
      {
        "id": "section-1",
        "name": "B2 Review & Bridge to C1",
        "nameEn": null,
        "type": "content",
        "content": "> Ð›Ð°ÑÐºÐ°Ð²Ð¾ Ð¿Ñ€Ð¾ÑÐ¸Ð¼Ð¾ Ð´Ð¾ Ñ€Ñ–Ð²Ð½Ñ C1! Ð¦ÐµÐ¹ Ð¼Ð¾Ð´ÑƒÐ»ÑŒ â€” Ð²Ð°Ñˆ Ð¼Ñ–ÑÑ‚Ð¾Ðº Ð²Ñ–Ð´ Ð²Ð¿ÐµÐ²Ð½ÐµÐ½Ð¾Ð³Ð¾ Ð²Ð¾Ð»Ð¾Ð´Ñ–Ð½Ð½Ñ Ð´Ð¾ ÑÐ¿Ñ€Ð°Ð²Ð¶Ð½ÑŒÐ¾Ñ— Ð¼Ð°Ð¹ÑÑ‚ÐµÑ€Ð½Ð¾ÑÑ‚Ñ–.\n\n## Diagnostic: ÐŸÐµÑ€ÐµÐ²Ñ–Ñ€Ñ‚Ðµ ÑÐ²Ð¾Ñ— Ð·Ð½Ð°Ð½Ð½Ñ\n\nÐŸÐµÑ€Ñˆ Ð½Ñ–Ð¶ Ñ€ÑƒÑ…Ð°Ñ‚Ð¸ÑÑ Ð´Ð°Ð»Ñ–, Ð¿ÐµÑ€ÐµÐ²Ñ–Ñ€Ð¸Ð¼Ð¾, Ð½Ð°ÑÐºÑ–Ð»ÑŒÐºÐ¸ Ð³Ð»Ð¸Ð±Ð¾ÐºÐ¾ Ð²Ð¸ Ð·Ð°ÑÐ²Ð¾Ñ—Ð»Ð¸ Ð¼Ð°Ñ‚ÐµÑ€Ñ–Ð°Ð» Ñ€Ñ–Ð²Ð½Ñ B2. ÐÐ¸Ð¶Ñ‡Ðµ Ð½Ð°Ð²ÐµÐ´ÐµÐ½Ð¾ Ñ‡Ð¾Ñ‚Ð¸Ñ€Ð¸ Ñ€ÐµÑ‡ÐµÐ½Ð½Ñ Ð· Ð¿Ð°ÑÐ¸Ð²Ð½Ð¸Ð¼ ÑÑ‚Ð°Ð½Ð¾Ð¼. Ð’Ð°ÑˆÐµ Ð·Ð°Ð²Ð´Ð°Ð½Ð½Ñ â€” Ð²Ð¸Ð·Ð½Ð°Ñ‡Ð¸Ñ‚Ð¸, ÑÐºÐ° Ñ„Ð¾Ñ€Ð¼Ð° Ð¿Ð°ÑÐ¸Ð²Ð½Ð¾Ð³Ð¾ ÑÑ‚Ð°Ð½Ñƒ Ð²Ð¸ÐºÐ¾Ñ€Ð¸ÑÑ‚Ð°Ð½Ð° Ñ‚Ð° Ñ‡Ð¸ Ð²Ñ–Ð´Ð¿Ð¾Ð²Ñ–Ð´Ð°Ñ” Ð²Ð¾Ð½Ð° Ñ€ÐµÐ³Ñ–ÑÑ‚Ñ€Ñƒ Ñ‚ÐµÐºÑÑ‚Ñƒ.\n\n> [!observe]\n> **Ð ÐµÑ‡ÐµÐ½Ð½Ñ Ð:** Ð›Ð¸ÑÑ‚ **Ð±ÑƒÐ»Ð¾ Ð½Ð°Ð¿Ð¸ÑÐ°Ð½Ð¾** Ð²Ñ‡Ð¾Ñ€Ð° Ð²Ð²ÐµÑ‡ÐµÑ€Ñ–.\n> **Ð ÐµÑ‡ÐµÐ½Ð½Ñ Ð‘:** Ð”Ð¾ÐºÑƒÐ¼ÐµÐ½Ñ‚ **Ð½Ð°Ð¿Ð¸ÑÐ°Ð½Ð¸Ð¹** Ð´Ð¸Ñ€ÐµÐºÑ‚Ð¾Ñ€Ð¾Ð¼.\n> **Ð ÐµÑ‡ÐµÐ½Ð½Ñ Ð’:** Ð¦Ñ Ð¿Ñ€Ð¾Ð±Ð»ÐµÐ¼Ð° **Ñ€Ð¾Ð·Ð²'ÑÐ·ÑƒÑ”Ñ‚ÑŒÑÑ** Ð½Ð°ÑˆÐ¾ÑŽ ÐºÐ¾Ð¼Ð°Ð½Ð´Ð¾ÑŽ.\n> **Ð ÐµÑ‡ÐµÐ½Ð½Ñ Ð“:** ÐšÐ¾Ð½Ñ‚Ñ€Ð°ÐºÑ‚ **Ð¿Ñ–Ð´Ð¿Ð¸ÑÑƒÑ”Ñ‚ÑŒÑÑ** Ð¾Ð±Ð¾Ð¼Ð° ÑÑ‚Ð¾Ñ€Ð¾Ð½Ð°Ð¼Ð¸ Ñ‰Ð¾Ñ€Ð¾ÐºÑƒ.\n>\n> ðŸ”Ž Ð¯ÐºÑ– Ñ„Ð¾Ñ€Ð¼Ð¸ Ð¿Ð°ÑÐ¸Ð²Ð½Ð¾Ð³Ð¾ ÑÑ‚Ð°Ð½Ñƒ Ñ‚ÑƒÑ‚ Ð²Ð¸ÐºÐ¾Ñ€Ð¸ÑÑ‚Ð°Ð½Ð¾? Ð¯ÐºÐ° Ð· Ð½Ð¸Ñ… Ð½Ð°Ð¹Ð±Ñ–Ð»ÑŒÑˆ Ñ„Ð¾Ñ€Ð¼Ð°Ð»ÑŒÐ½Ð°?\n\n### Ð ÐµÐ³Ñ–ÑÑ‚Ñ€Ð¾Ð²Ð° Ð·Ð°Ð³Ð°Ð´ÐºÐ°\n\nÐ£ÑÐ²Ñ–Ñ‚ÑŒ: Ð²Ð¸ Ñ‡Ð¸Ñ‚Ð°Ñ”Ñ‚Ðµ Ð½Ð°ÑƒÐºÐ¾Ð²Ñƒ ÑÑ‚Ð°Ñ‚Ñ‚ÑŽ Ð¿Ñ€Ð¾ ÐºÐ»Ñ–Ð¼Ð°Ñ‚Ð¸Ñ‡Ð½Ñ– Ð·Ð¼Ñ–Ð½Ð¸. Ð Ð°Ð¿Ñ‚Ð¾Ð¼ Ð½Ð°Ñ‚Ñ€Ð°Ð¿Ð»ÑÑ”Ñ‚Ðµ Ð½Ð° Ñ‚Ð°ÐºÐµ Ñ€ÐµÑ‡ÐµÐ½Ð½Ñ:\n\n> *Â«Ð”Ð¾ÑÐ»Ñ–Ð´Ð¶ÐµÐ½Ð½Ñ Ð¿Ñ€Ð¾Ð²Ð¾Ð´Ð¸Ð»Ð¾ÑÑ ÐºÐ¾Ð¼Ð°Ð½Ð´Ð¾ÑŽ Ð²Ñ‡ÐµÐ½Ð¸Ñ…, Ñ– Ñ€ÐµÐ·ÑƒÐ»ÑŒÑ‚Ð°Ñ‚Ð¸ Ð²Ð¶Ðµ Ð¾Ð¿ÑƒÐ±Ð»Ñ–ÐºÑƒÐ²Ð°Ð»Ð¸.Â»*\n\nÐ©Ð¾ÑÑŒ Ð½Ðµ Ñ‚Ð°Ðº. Ð’Ñ–Ð´Ñ‡ÑƒÐ²Ð°Ñ”Ñ‚Ðµ? ÐŸÐµÑ€ÑˆÐ° Ñ‡Ð°ÑÑ‚Ð¸Ð½Ð° â€” Ñ„Ð¾Ñ€Ð¼Ð°Ð»ÑŒÐ½Ð¸Ð¹ Ð½Ð°ÑƒÐºÐ¾Ð²Ð¸Ð¹ ÑÑ‚Ð¸Ð»ÑŒ Ð· Ð¿Ð°ÑÐ¸Ð²Ð½Ð¸Ð¼ ÑÑ‚Ð°Ð½Ð¾Ð¼. Ð”Ñ€ÑƒÐ³Ð° â€” Ñ€Ð°Ð¿Ñ‚Ð¾Ð¼ Ð¿ÐµÑ€ÐµÑ…Ñ–Ð´ Ð´Ð¾ Ð°ÐºÑ‚Ð¸Ð²Ð½Ð¾Ð³Ð¾ ÑÑ‚Ð°Ð½Ñƒ Ð· Ð½ÐµÐ²Ð¸Ð·Ð½Ð°Ñ‡ÐµÐ½Ð¸Ð¼ ÑÑƒÐ±'Ñ”ÐºÑ‚Ð¾Ð¼. Ð¢Ð°ÐºÑ– Â«Ñ€ÐµÐ³Ñ–ÑÑ‚Ñ€Ð¾Ð²Ñ– ÑÑ‚Ñ€Ð¸Ð±ÐºÐ¸Â» â€” Ñ‚Ð¸Ð¿Ð¾Ð²Ð° Ð¿Ð¾Ð¼Ð¸Ð»ÐºÐ° Ð½Ð° ÑˆÐ»ÑÑ…Ñƒ Ð´Ð¾ C1.\n\n> ðŸ’¡ **ÐžÐ·Ð½Ð°ÐºÐ° Ð¼Ð°Ð¹ÑÑ‚ÐµÑ€Ð½Ð¾ÑÑ‚Ñ–**\n>\n> ÐÐ° Ñ€Ñ–Ð²Ð½Ñ– C1 Ð²Ð¸ Ð½Ðµ Ð¿Ñ€Ð¾ÑÑ‚Ð¾ Ð·Ð½Ð°Ñ”Ñ‚Ðµ Ð¿Ñ€Ð°Ð²Ð¸Ð»Ð° â€” Ð²Ð¸ Ð²Ñ–Ð´Ñ‡ÑƒÐ²Ð°Ñ”Ñ‚Ðµ, ÐºÐ¾Ð»Ð¸ Ñ‰Ð¾ÑÑŒ Â«Ð·Ð²ÑƒÑ‡Ð¸Ñ‚ÑŒ Ð½Ðµ Ñ‚Ð°ÐºÂ». Ð¦Ðµ Ð¼Ð¾Ð²Ð½Ð° Ñ–Ð½Ñ‚ÑƒÑ—Ñ†Ñ–Ñ, ÑÐºÑƒ Ð¼Ð¸ Ð±ÑƒÐ´ÐµÐ¼Ð¾ Ñ€Ð¾Ð·Ð²Ð¸Ð²Ð°Ñ‚Ð¸.\n\n### Ð¡Ð°Ð¼Ð¾Ð´Ñ–Ð°Ð³Ð½Ð¾ÑÑ‚Ð¸ÐºÐ°: Ñ‡Ð¾Ñ‚Ð¸Ñ€Ð¸ Ñ„Ð¾Ñ€Ð¼Ð¸ Ð¿Ð°ÑÐ¸Ð²Ð½Ð¾Ð³Ð¾ ÑÑ‚Ð°Ð½Ñƒ\n\nÐŸÐµÑ€Ñˆ Ð½Ñ–Ð¶ Ñ‡Ð¸Ñ‚Ð°Ñ‚Ð¸ Ð´Ð°Ð»Ñ–, ÑÐ¿Ñ€Ð¾Ð±ÑƒÐ¹Ñ‚Ðµ Ð·Ð°Ð¿Ð¾Ð²Ð½Ð¸Ñ‚Ð¸ Ñ†ÑŽ Ñ‚Ð°Ð±Ð»Ð¸Ñ†ÑŽ ÑÐ°Ð¼Ð¾ÑÑ‚Ñ–Ð¹Ð½Ð¾:\n\n| Ð¤Ð¾Ñ€Ð¼Ð° | ÐŸÑ€Ð¸ÐºÐ»Ð°Ð´ | Ð ÐµÐ³Ñ–ÑÑ‚Ñ€ |\n|-------|---------|---------|\n| -Ð½Ð¸Ð¹/-Ñ‚Ð¸Ð¹ + Ñ”/Ð±ÑƒÐ² | ? | ? |\n| -Ð½Ð¾/-Ñ‚Ð¾ | ? | ? |\n| -ÑÑ (Ñ‚ÐµÐ¿ÐµÑ€Ñ–ÑˆÐ½Ñ–Ð¹) | ? | ? |\n| -ÑÑ (Ð¼Ð¸Ð½ÑƒÐ»Ð¸Ð¹) | ? | ? |\n\nÐ¯ÐºÑ‰Ð¾ Ð²Ð¸ Ð·Ð°Ð¿Ð¾Ð²Ð½Ð¸Ð»Ð¸ Ð²ÑÐµ Ð¿Ñ€Ð°Ð²Ð¸Ð»ÑŒÐ½Ð¾ â€” Ð²Ð¸ Ð³Ð¾Ñ‚Ð¾Ð²Ñ– Ð´Ð¾ C1. Ð¯ÐºÑ‰Ð¾ Ð½Ñ– â€” Ñ†ÐµÐ¹ Ð¼Ð¾Ð´ÑƒÐ»ÑŒ ÑÐ°Ð¼Ðµ Ð´Ð»Ñ Ð²Ð°Ñ.\n\n## Analysis: Ð¡Ð¸ÑÑ‚ÐµÐ¼Ð°Ñ‚Ð¸Ð·Ð°Ñ†Ñ–Ñ Ð¿Ð°ÑÐ¸Ð²Ð½Ð¾Ð³Ð¾ ÑÑ‚Ð°Ð½Ñƒ\n\nÐ¢ÐµÐ¿ÐµÑ€ Ð¿Ñ€Ð¾Ð°Ð½Ð°Ð»Ñ–Ð·ÑƒÐ¹Ð¼Ð¾ Ð²Ñ–Ð´Ð¿Ð¾Ð²Ñ–Ð´Ñ– Ð½Ð° Ð´Ñ–Ð°Ð³Ð½Ð¾ÑÑ‚Ð¸Ñ‡Ð½Ðµ Ð·Ð°Ð²Ð´Ð°Ð½Ð½Ñ. Ð£ÐºÑ€Ð°Ñ—Ð½ÑÑŒÐºÐ° Ð¼Ð¾Ð²Ð° Ð¼Ð°Ñ” Ñ‡Ð¾Ñ‚Ð¸Ñ€Ð¸ Ð¾ÑÐ½Ð¾Ð²Ð½Ñ– ÑÐ¿Ð¾ÑÐ¾Ð±Ð¸ Ð²Ð¸Ñ€Ð°Ð¶ÐµÐ½Ð½Ñ Ð¿Ð°ÑÐ¸Ð²Ð½Ð¾Ð³Ð¾ ÑÑ‚Ð°Ð½Ñƒ, Ñ– ÐºÐ¾Ð¶ÐµÐ½ Ð· Ð½Ð¸Ñ… Ð¼Ð°Ñ” ÑÐ²Ð¾Ñ” Ð¼Ñ–ÑÑ†Ðµ Ð² ÑÐ¸ÑÑ‚ÐµÐ¼Ñ– Ñ€ÐµÐ³Ñ–ÑÑ‚Ñ€Ñ–Ð². Ð Ð¾Ð·ÑƒÐ¼Ñ–Ð½Ð½Ñ Ñ†Ð¸Ñ… Ñ„Ð¾Ñ€Ð¼ Ñ” ÐºÑ€Ð¸Ñ‚Ð¸Ñ‡Ð½Ð¾ Ð²Ð°Ð¶Ð»Ð¸Ð²Ð¸Ð¼ Ð´Ð»Ñ ÑƒÑÐ¿Ñ–ÑˆÐ½Ð¾Ñ— ÐºÐ¾Ð¼ÑƒÐ½Ñ–ÐºÐ°Ñ†Ñ–Ñ— Ð² Ð°ÐºÐ°Ð´ÐµÐ¼Ñ–Ñ‡Ð½Ð¾Ð¼Ñƒ ÑÐµÑ€ÐµÐ´Ð¾Ð²Ð¸Ñ‰Ñ–. ÐÐ° Ð²Ñ–Ð´Ð¼Ñ–Ð½Ñƒ Ð²Ñ–Ð´ Ð±Ð°Ð³Ð°Ñ‚ÑŒÐ¾Ñ… Ñ–Ð½ÑˆÐ¸Ñ… Ð¼Ð¾Ð², ÑƒÐºÑ€Ð°Ñ—Ð½ÑÑŒÐºÐ° Ð¿Ñ€Ð¾Ð¿Ð¾Ð½ÑƒÑ” Ð±Ð°Ð³Ð°Ñ‚Ð¸Ð¹ Ð²Ð¸Ð±Ñ–Ñ€ Ð¿Ð°ÑÐ¸Ð²Ð½Ð¸Ñ… ÐºÐ¾Ð½ÑÑ‚Ñ€ÑƒÐºÑ†Ñ–Ð¹, ÐºÐ¾Ð¶Ð½Ð° Ð· ÑÐºÐ¸Ñ… Ð½ÐµÑÐµ Ð¾ÑÐ¾Ð±Ð»Ð¸Ð²Ð¸Ð¹ ÑÑ‚Ð¸Ð»Ñ–ÑÑ‚Ð¸Ñ‡Ð½Ð¸Ð¹ Ð²Ñ–Ð´Ñ‚Ñ–Ð½Ð¾Ðº. ÐžÐ¿Ð°Ð½ÑƒÐ²Ð°Ð²ÑˆÐ¸ Ñ†Ñ– Ñ„Ð¾Ñ€Ð¼Ð¸, Ð²Ð¸ Ð·Ð¼Ð¾Ð¶ÐµÑ‚Ðµ Ð¿Ð¸ÑÐ°Ñ‚Ð¸ Ñ‚ÐµÐºÑÑ‚Ð¸ Ñ€Ñ–Ð·Ð½Ð¸Ñ… Ð¶Ð°Ð½Ñ€Ñ–Ð² â€” Ð²Ñ–Ð´ Ð½Ð°ÑƒÐºÐ¾Ð²Ð¸Ñ… ÑÑ‚Ð°Ñ‚ÐµÐ¹ Ð´Ð¾ Ð¾Ñ„Ñ–Ñ†Ñ–Ð¹Ð½Ð¸Ñ… Ð´Ð¾ÐºÑƒÐ¼ÐµÐ½Ñ‚Ñ–Ð² â€” Ð· Ð½Ð°Ð»ÐµÐ¶Ð½Ð¾ÑŽ Ñ‚Ð¾Ñ‡Ð½Ñ–ÑÑ‚ÑŽ Ñ‚Ð° ÐµÐ»ÐµÐ³Ð°Ð½Ñ‚Ð½Ñ–ÑÑ‚ÑŽ.\n\n### Ð¤Ð¾Ñ€Ð¼Ð° 1: Ð”Ñ–Ñ”Ð¿Ñ€Ð¸ÐºÐ¼ÐµÑ‚Ð½Ð¸ÐºÐ¾Ð²Ð¸Ð¹ Ð¿Ð°ÑÐ¸Ð² (-Ð½Ð¸Ð¹/-Ñ‚Ð¸Ð¹ + Ð±ÑƒÑ‚Ð¸)\n\n**Ð¡Ñ‚Ñ€ÑƒÐºÑ‚ÑƒÑ€Ð°:** Ð´Ñ–Ñ”Ð¿Ñ€Ð¸ÐºÐ¼ÐµÑ‚Ð½Ð¸Ðº + Ð´Ð¾Ð¿Ð¾Ð¼Ñ–Ð¶Ð½Ðµ Ð´Ñ–Ñ”ÑÐ»Ð¾Ð²Ð¾ Â«Ð±ÑƒÑ‚Ð¸Â»\n\n| Ð§Ð°Ñ | ÐŸÑ€Ð¸ÐºÐ»Ð°Ð´ | ÐŸÑ€Ð¸Ð¼Ñ–Ñ‚ÐºÐ° |\n|-----|---------|----------|\n| Ð¢ÐµÐ¿ÐµÑ€Ñ–ÑˆÐ½Ñ–Ð¹ | Ð”Ð¾ÐºÑƒÐ¼ÐµÐ½Ñ‚ **Ñ” Ð¿Ñ–Ð´Ð¿Ð¸ÑÐ°Ð½Ð¸Ð¹** | Ð Ñ–Ð´ÐºÐ¾ Ð²Ð¶Ð¸Ð²Ð°Ñ”Ñ‚ÑŒÑÑ |\n| ÐœÐ¸Ð½ÑƒÐ»Ð¸Ð¹ | Ð”Ð¾ÐºÑƒÐ¼ÐµÐ½Ñ‚ **Ð±ÑƒÐ² Ð¿Ñ–Ð´Ð¿Ð¸ÑÐ°Ð½Ð¸Ð¹** | Ð¡Ñ‚Ð°Ð½Ð´Ð°Ñ€Ñ‚Ð½Ð° Ñ„Ð¾Ñ€Ð¼Ð° |\n| ÐœÐ°Ð¹Ð±ÑƒÑ‚Ð½Ñ–Ð¹ | Ð”Ð¾ÐºÑƒÐ¼ÐµÐ½Ñ‚ **Ð±ÑƒÐ´Ðµ Ð¿Ñ–Ð´Ð¿Ð¸ÑÐ°Ð½Ð¸Ð¹** | ÐÐµÐ¹Ñ‚Ñ€Ð°Ð»ÑŒÐ½Ð¸Ð¹ Ñ€ÐµÐ³Ñ–ÑÑ‚Ñ€ |\n\n> ðŸ“œ **Ð†ÑÑ‚Ð¾Ñ€Ð¸Ñ‡Ð½Ð° Ð´Ð¾Ð²Ñ–Ð´ÐºÐ°**\n>\n> Ð¦Ñ Ñ„Ð¾Ñ€Ð¼Ð° â€” Ð½Ð°Ð¹ÑÑ‚Ð°Ñ€Ñ–ÑˆÐ° Ð² ÑƒÐºÑ€Ð°Ñ—Ð½ÑÑŒÐºÑ–Ð¹ Ð¼Ð¾Ð²Ñ–. Ð’Ð¾Ð½Ð° Ð¿Ð¾Ñ…Ð¾Ð´Ð¸Ñ‚ÑŒ Ð²Ñ–Ð´ Ð´Ð°Ð²Ð½ÑŒÐ¾ÑƒÐºÑ€Ð°Ñ—Ð½ÑÑŒÐºÐ¸Ñ… ÐºÐ¾Ð½ÑÑ‚Ñ€ÑƒÐºÑ†Ñ–Ð¹ Ñ– Ð½Ð°Ð¹Ð±Ð»Ð¸Ð¶Ñ‡Ð° Ð´Ð¾ Ñ–Ð½Ð´Ð¾Ñ”Ð²Ñ€Ð¾Ð¿ÐµÐ¹ÑÑŒÐºÐ¾Ð³Ð¾ Ð¿Ð°ÑÐ¸Ð²Ñƒ. Ð¡Ð°Ð¼Ðµ Ñ‚Ð¾Ð¼Ñƒ Ð²Ð¾Ð½Ð° Ð·Ð²ÑƒÑ‡Ð¸Ñ‚ÑŒ Ð½Ð°Ð¹Ð±Ñ–Ð»ÑŒÑˆ Â«ÐºÐ½Ð¸Ð¶Ð½Ð¾Â» Ñ– Ñ„Ð¾Ñ€Ð¼Ð°Ð»ÑŒÐ½Ð¾.\n\n**ÐŸÑ€Ð¸ÐºÐ»Ð°Ð´Ð¸ Ð² ÐºÐ¾Ð½Ñ‚ÐµÐºÑÑ‚Ñ–:**\n\n1. ÐœÐ¾Ð½Ð¾Ð³Ñ€Ð°Ñ„Ñ–Ñ **Ð±ÑƒÐ»Ð° Ð½Ð°Ð¿Ð¸ÑÐ°Ð½Ð°** Ð²Ð¸Ð´Ð°Ñ‚Ð½Ð¸Ð¼ Ð½Ð°ÑƒÐºÐ¾Ð²Ñ†ÐµÐ¼.\n2. Ð£ÑÑ– Ð´Ð¾ÐºÑƒÐ¼ÐµÐ½Ñ‚Ð¸ **Ð±ÑƒÐ´ÑƒÑ‚ÑŒ Ñ€Ð¾Ð·Ð³Ð»ÑÐ½ÑƒÑ‚Ñ–** ÐºÐ¾Ð¼Ñ–ÑÑ–Ñ”ÑŽ.\n3. Ð—Ð¼Ñ–Ð½Ð¸ **Ð±ÑƒÐ»Ð¸ Ð²Ð½ÐµÑÐµÐ½Ñ–** Ð´Ð¾ ÑÑ‚Ð°Ñ‚ÑƒÑ‚Ñƒ Ð¾Ñ€Ð³Ð°Ð½Ñ–Ð·Ð°Ñ†Ñ–Ñ—.\n\n### Ð¤Ð¾Ñ€Ð¼Ð° 2: Ð‘ÐµÐ·Ð¾ÑÐ¾Ð±Ð¾Ð²Ð¸Ð¹ Ð¿Ð°ÑÐ¸Ð² (-Ð½Ð¾/-Ñ‚Ð¾)\n\n**Ð¡Ñ‚Ñ€ÑƒÐºÑ‚ÑƒÑ€Ð°:** Ñ„Ð¾Ñ€Ð¼Ð° Ð½Ð° -Ð½Ð¾/-Ñ‚Ð¾ (+ Â«Ð±ÑƒÐ»Ð¾Â» Ð´Ð»Ñ Ð¼Ð¸Ð½ÑƒÐ»Ð¾Ð³Ð¾ Ñ‡Ð°ÑÑƒ)\n\n| Ð§Ð°Ñ | ÐŸÑ€Ð¸ÐºÐ»Ð°Ð´ | ÐŸÑ€Ð¸Ð¼Ñ–Ñ‚ÐºÐ° |\n|-----|---------|----------|\n| Ð¢ÐµÐ¿ÐµÑ€Ñ–ÑˆÐ½Ñ–Ð¹/Ð·Ð°Ð³Ð°Ð»ÑŒÐ½Ð¸Ð¹ | Ð¡Ñ‚Ð°Ñ‚Ñ‚ÑŽ **Ð½Ð°Ð¿Ð¸ÑÐ°Ð½Ð¾** | ÐÐ°Ð¹Ñ„Ð¾Ñ€Ð¼Ð°Ð»ÑŒÐ½Ñ–ÑˆÐ¸Ð¹ |\n| ÐœÐ¸Ð½ÑƒÐ»Ð¸Ð¹ | Ð¡Ñ‚Ð°Ñ‚Ñ‚ÑŽ **Ð±ÑƒÐ»Ð¾ Ð½Ð°Ð¿Ð¸ÑÐ°Ð½Ð¾** | ÐžÑ„Ñ–Ñ†Ñ–Ð¹Ð½Ñ– Ð´Ð¾ÐºÑƒÐ¼ÐµÐ½Ñ‚Ð¸ |\n\n> ðŸ” **Myth Buster: Â«Ð¤Ð¾Ñ€Ð¼Ð° Ð½Ð° -Ð½Ð¾/-Ñ‚Ð¾ â€” Ñ†Ðµ Ñ€ÑƒÑÐ¸Ð·Ð¼Â»**\n>\n> Ð¦Ðµ Ð¿Ð¾ÑˆÐ¸Ñ€ÐµÐ½Ðµ, Ð°Ð»Ðµ Ñ…Ð¸Ð±Ð½Ðµ Ð¿ÐµÑ€ÐµÐºÐ¾Ð½Ð°Ð½Ð½Ñ. ÐÐ°ÑÐ¿Ñ€Ð°Ð²Ð´Ñ– Ñ†Ñ Ñ„Ð¾Ñ€Ð¼Ð° â€” Ð°Ð²Ñ‚ÐµÐ½Ñ‚Ð¸Ñ‡Ð½Ð¸Ð¹ ÑƒÐºÑ€Ð°Ñ—Ð½ÑÑŒÐºÐ¸Ð¹ Ð³Ñ€Ð°Ð¼Ð°Ñ‚Ð¸Ñ‡Ð½Ð¸Ð¹ Ð·Ð°ÑÑ–Ð±, Ñ‰Ð¾ Ñ–ÑÐ½ÑƒÐ²Ð°Ð² Ñ‰Ðµ Ð² Ð´Ð°Ð²Ð½ÑŒÐ¾ÑƒÐºÑ€Ð°Ñ—Ð½ÑÑŒÐºÑ–Ð¹ Ð¼Ð¾Ð²Ñ–. Ð’Ð¾Ð½Ð° Ð²Ñ–Ð´ÑÑƒÑ‚Ð½Ñ Ð² Ñ€Ð¾ÑÑ–Ð¹ÑÑŒÐºÑ–Ð¹, Ð´Ðµ Ð·Ð°Ð¼Ñ–ÑÑ‚ÑŒ Ð½ÐµÑ— Ð²Ð¶Ð¸Ð²Ð°ÑŽÑ‚ÑŒ Â«Ð±Ñ‹Ð»Ð¾ Ð½Ð°Ð¿Ð¸ÑÐ°Ð½Ð¾Â» (Ð· Ð´Ñ–Ñ”Ð¿Ñ€Ð¸ÐºÐ¼ÐµÑ‚Ð½Ð¸ÐºÐ¾Ð¼). Ð¡Ð°Ð¼Ðµ Ñ‚Ð¾Ð¼Ñƒ Ñ„Ð¾Ñ€Ð¼Ð° Ð½Ð° -Ð½Ð¾/-Ñ‚Ð¾ â€” Ð¼Ð°Ñ€ÐºÐµÑ€ ÑÐ¿Ñ€Ð°Ð²Ð¶Ð½ÑŒÐ¾Ñ— ÑƒÐºÑ€Ð°Ñ—Ð½ÑÑŒÐºÐ¾Ñ— Ð¼Ð¾Ð²Ð¸!\n\n**Ð ÐµÐ³Ñ–ÑÑ‚Ñ€Ð¾Ð²Ð° Ñ†Ñ–Ð½Ð½Ñ–ÑÑ‚ÑŒ:**\n\nÐ¤Ð¾Ñ€Ð¼Ð° Ð½Ð° -Ð½Ð¾/-Ñ‚Ð¾ â€” Ð½Ð°Ð¹Ð²Ð¸Ñ‰Ð¸Ð¹ Ñ€Ñ–Ð²ÐµÐ½ÑŒ Ñ„Ð¾Ñ€Ð¼Ð°Ð»ÑŒÐ½Ð¾ÑÑ‚Ñ– Ð² ÑƒÐºÑ€Ð°Ñ—Ð½ÑÑŒÐºÑ–Ð¹ Ð¼Ð¾Ð²Ñ–. Ð‡Ñ— Ð¾Ð±Ð¾Ð²'ÑÐ·ÐºÐ¾Ð²Ð¾ Ð²Ð¶Ð¸Ð²Ð°ÑŽÑ‚ÑŒ Ñƒ:\n\n- Ð—Ð°ÐºÐ¾Ð½Ð°Ñ… Ñ– Ð¿Ñ–Ð´Ð·Ð°ÐºÐ¾Ð½Ð½Ð¸Ñ… Ð°ÐºÑ‚Ð°Ñ…: *Ð—Ð°ÐºÐ¾Ð½ **Ð¿Ñ€Ð¸Ð¹Ð½ÑÑ‚Ð¾** Ð’ÐµÑ€Ñ…Ð¾Ð²Ð½Ð¾ÑŽ Ð Ð°Ð´Ð¾ÑŽ.*\n- ÐÐ°ÑƒÐºÐ¾Ð²Ð¸Ñ… Ñ‚ÐµÐºÑÑ‚Ð°Ñ…: *Ð£ Ð´Ð¾ÑÐ»Ñ–Ð´Ð¶ÐµÐ½Ð½Ñ– **Ð²ÑÑ‚Ð°Ð½Ð¾Ð²Ð»ÐµÐ½Ð¾**, Ñ‰Ð¾...*\n- ÐžÑ„Ñ–Ñ†Ñ–Ð¹Ð½Ð¸Ñ… Ð´Ð¾ÐºÑƒÐ¼ÐµÐ½Ñ‚Ð°Ñ…: *ÐÐ°ÐºÐ°Ð· **Ð¿Ñ–Ð´Ð¿Ð¸ÑÐ°Ð½Ð¾** Ñ€ÐµÐºÑ‚Ð¾Ñ€Ð¾Ð¼.*\n\n**ÐŸÐ¾Ñ€Ñ–Ð²Ð½ÑÐ¹Ñ‚Ðµ Ñ€ÐµÐ³Ñ–ÑÑ‚Ñ€Ð¸:**\n\n| Ð Ð¾Ð·Ð¼Ð¾Ð²Ð½Ð¸Ð¹ | ÐžÑ„Ñ–Ñ†Ñ–Ð¹Ð½Ð¸Ð¹ |\n|-----------|-----------|\n| Ð›Ð¸ÑÑ‚ Ð½Ð°Ð¿Ð¸ÑÐ°Ð»Ð¸ Ð²Ñ‡Ð¾Ñ€Ð°. | Ð›Ð¸ÑÑ‚ **Ð±ÑƒÐ»Ð¾ Ð½Ð°Ð¿Ð¸ÑÐ°Ð½Ð¾** Ð²Ñ‡Ð¾Ñ€Ð°. |\n| Ð ÐµÐ·ÑƒÐ»ÑŒÑ‚Ð°Ñ‚Ð¸ Ð¾Ð³Ð¾Ð»Ð¾ÑÐ¸Ð»Ð¸. | Ð ÐµÐ·ÑƒÐ»ÑŒÑ‚Ð°Ñ‚Ð¸ **Ð¾Ð³Ð¾Ð»Ð¾ÑˆÐµÐ½Ð¾**. |\n| Ð—Ð°ÐºÐ¾Ð½ ÑƒÑ…Ð²Ð°Ð»Ð¸Ð»Ð¸. | Ð—Ð°ÐºÐ¾Ð½ **ÑƒÑ…Ð²Ð°Ð»ÐµÐ½Ð¾**. |\n\n### Ð¤Ð¾Ñ€Ð¼Ð° 3: Ð—Ð²Ð¾Ñ€Ð¾Ñ‚Ð½Ð¸Ð¹ Ð¿Ð°ÑÐ¸Ð² (-ÑÑ)\n\n**Ð¡Ñ‚Ñ€ÑƒÐºÑ‚ÑƒÑ€Ð°:** Ð´Ñ–Ñ”ÑÐ»Ð¾Ð²Ð¾ Ð· Ð¿Ð¾ÑÑ‚Ñ„Ñ–ÐºÑÐ¾Ð¼ -ÑÑ\n\n| Ð§Ð°Ñ | ÐŸÑ€Ð¸ÐºÐ»Ð°Ð´ | ÐŸÑ€Ð¸Ð¼Ñ–Ñ‚ÐºÐ° |\n|-----|---------|----------|\n| Ð¢ÐµÐ¿ÐµÑ€Ñ–ÑˆÐ½Ñ–Ð¹ | ÐŸÑ€Ð¾Ð±Ð»ÐµÐ¼Ð° **Ñ€Ð¾Ð·Ð²'ÑÐ·ÑƒÑ”Ñ‚ÑŒÑÑ** | ÐŸÑ€Ð¾Ñ†ÐµÑ Ñ‚Ñ€Ð¸Ð²Ð°Ñ” |\n| ÐœÐ¸Ð½ÑƒÐ»Ð¸Ð¹ | ÐŸÑ€Ð¾Ð±Ð»ÐµÐ¼Ð° **Ñ€Ð¾Ð·Ð²'ÑÐ·ÑƒÐ²Ð°Ð»Ð°ÑÑ** | ÐÐµÐ·Ð°Ð²ÐµÑ€ÑˆÐµÐ½Ð° Ð´Ñ–Ñ Ð² Ð¼Ð¸Ð½ÑƒÐ»Ð¾Ð¼Ñƒ |\n\n**Ð¡ÐµÐ¼Ð°Ð½Ñ‚Ð¸Ñ‡Ð½Ð° Ð¾ÑÐ¾Ð±Ð»Ð¸Ð²Ñ–ÑÑ‚ÑŒ:**\n\nÐ—Ð²Ð¾Ñ€Ð¾Ñ‚Ð½Ð¸Ð¹ Ð¿Ð°ÑÐ¸Ð² Ð¿Ñ–Ð´ÐºÑ€ÐµÑÐ»ÑŽÑ” **Ð¿Ñ€Ð¾Ñ†ÐµÑ**, Ð° Ð½Ðµ Ñ€ÐµÐ·ÑƒÐ»ÑŒÑ‚Ð°Ñ‚. ÐŸÐ¾Ñ€Ñ–Ð²Ð½ÑÐ¹Ñ‚Ðµ:\n\n- *Ð‘ÑƒÐ´Ð¸Ð½Ð¾Ðº **Ð±ÑƒÐ´ÑƒÑ”Ñ‚ÑŒÑÑ**.* â†’ ÐÐºÑ†ÐµÐ½Ñ‚ Ð½Ð° Ñ‚Ñ€Ð¸Ð²Ð°Ð»Ð¾Ð¼Ñƒ Ð¿Ñ€Ð¾Ñ†ÐµÑÑ–.\n- *Ð‘ÑƒÐ´Ð¸Ð½Ð¾Ðº **Ð·Ð±ÑƒÐ´Ð¾Ð²Ð°Ð½Ð¾**.* â†’ ÐÐºÑ†ÐµÐ½Ñ‚ Ð½Ð° Ð·Ð°Ð²ÐµÑ€ÑˆÐµÐ½Ð¾Ð¼Ñƒ Ñ€ÐµÐ·ÑƒÐ»ÑŒÑ‚Ð°Ñ‚Ñ–.\n\n> âš¡ **ÐŸÑ€Ð°ÐºÑ‚Ð¸Ñ‡Ð½Ð° Ð¿Ð¾Ñ€Ð°Ð´Ð°**\n>\n> Ð£ Ð½Ð°ÑƒÐºÐ¾Ð²Ð¾Ð¼Ñƒ ÑÑ‚Ð¸Ð»Ñ– Ð·Ð²Ð¾Ñ€Ð¾Ñ‚Ð½Ð¸Ð¹ Ð¿Ð°ÑÐ¸Ð² Ñ‡Ð°ÑÑ‚Ð¾ Ð²Ð¶Ð¸Ð²Ð°Ñ”Ñ‚ÑŒÑÑ Ð´Ð»Ñ Ð¾Ð¿Ð¸ÑÑƒ Ð¼ÐµÑ‚Ð¾Ð´Ð¾Ð»Ð¾Ð³Ñ–Ñ—: Â«Ð£ Ñ€Ð¾Ð±Ð¾Ñ‚Ñ– **Ð·Ð°ÑÑ‚Ð¾ÑÐ¾Ð²ÑƒÑ”Ñ‚ÑŒÑÑ** Ð¼ÐµÑ‚Ð¾Ð´ Ð¿Ð¾Ñ€Ñ–Ð²Ð½ÑÐ»ÑŒÐ½Ð¾Ð³Ð¾ Ð°Ð½Ð°Ð»Ñ–Ð·ÑƒÂ», Â«Ð”Ð°Ð½Ñ– **Ð¾Ð±Ñ€Ð¾Ð±Ð»ÑÑŽÑ‚ÑŒÑÑ** Ð·Ð° Ð´Ð¾Ð¿Ð¾Ð¼Ð¾Ð³Ð¾ÑŽ ÑÑ‚Ð°Ñ‚Ð¸ÑÑ‚Ð¸Ñ‡Ð½Ð¸Ñ… Ð¼ÐµÑ‚Ð¾Ð´Ñ–Ð²Â».\n\n### Ð¤Ð¾Ñ€Ð¼Ð° 4: Ð”Ñ–Ñ”Ð¿Ñ€Ð¸ÑÐ»Ñ–Ð²Ð½Ð¸ÐºÐ¾Ð²Ð¸Ð¹ Ð¿Ð°ÑÐ¸Ð² (Ñ€Ñ–Ð´ÐºÐ¾)\n\nÐ£ ÑÑƒÑ‡Ð°ÑÐ½Ñ–Ð¹ ÑƒÐºÑ€Ð°Ñ—Ð½ÑÑŒÐºÑ–Ð¹ Ð¼Ð¾Ð²Ñ– Ñ†Ñ Ñ„Ð¾Ñ€Ð¼Ð° Ð¼Ð°Ð¹Ð¶Ðµ Ð½Ðµ Ð²Ð¶Ð¸Ð²Ð°Ñ”Ñ‚ÑŒÑÑ, Ð°Ð»Ðµ Ð²Ð¸ Ð¼Ð¾Ð¶ÐµÑ‚Ðµ Ð·ÑƒÑÑ‚Ñ€Ñ–Ñ‚Ð¸ Ñ—Ñ— Ð² Ñ…ÑƒÐ´Ð¾Ð¶Ð½Ñ–Ð¹ Ð»Ñ–Ñ‚ÐµÑ€Ð°Ñ‚ÑƒÑ€Ñ– XIXâ€“XX ÑÑ‚Ð¾Ð»Ñ–Ñ‚ÑŒ:\n\n- *Ð‘ÑƒÐ²ÑˆÐ¸ Ð¿Ð¾ÐºÐ¸Ð½ÑƒÑ‚Ð¸Ð¹ ÑƒÑÑ–Ð¼Ð°, Ð²Ñ–Ð½ Ð·Ð°Ð»Ð¸ÑˆÐ¸Ð²ÑÑ ÑÐ°Ð¼.*\n\nÐ”Ð»Ñ C1 Ð²Ð°Ð¶Ð»Ð¸Ð²Ð¾ **Ñ€Ð¾Ð·Ð¿Ñ–Ð·Ð½Ð°Ð²Ð°Ñ‚Ð¸** Ñ†ÑŽ Ñ„Ð¾Ñ€Ð¼Ñƒ, Ð°Ð»Ðµ **Ð½Ðµ Ð²Ð¶Ð¸Ð²Ð°Ñ‚Ð¸** Ñ—Ñ— Ð² ÑÑƒÑ‡Ð°ÑÐ½Ð¸Ñ… Ñ‚ÐµÐºÑÑ‚Ð°Ñ…. Ð¦Ñ Ð°Ñ€Ñ…Ð°Ñ—Ñ‡Ð½Ð° ÐºÐ¾Ð½ÑÑ‚Ñ€ÑƒÐºÑ†Ñ–Ñ Ð·Ð±ÐµÑ€Ñ–Ð³Ð°Ñ”Ñ‚ÑŒÑÑ Ð² Ð¿Ð¾ÐµÐ·Ñ–Ñ— Ñ‚Ð° ÐºÐ»Ð°ÑÐ¸Ñ‡Ð½Ñ–Ð¹ Ð¿Ñ€Ð¾Ð·Ñ– ÑÐº ÑÑ‚Ð¸Ð»Ñ–ÑÑ‚Ð¸Ñ‡Ð½Ð¸Ð¹ Ð·Ð°ÑÑ–Ð± Ð´Ð»Ñ ÑÑ‚Ð²Ð¾Ñ€ÐµÐ½Ð½Ñ ÑƒÑ€Ð¾Ñ‡Ð¸ÑÑ‚Ð¾Ð³Ð¾ Ð°Ð±Ð¾ Ð´Ð°Ð²Ð½ÑŒÐ¾Ð³Ð¾ ÐºÐ¾Ð»Ð¾Ñ€Ð¸Ñ‚Ñƒ.\n\n### ÐŸÑ€Ð°ÐºÑ‚Ð¸Ñ‡Ð½Ðµ Ð·Ð°ÑÑ‚Ð¾ÑÑƒÐ²Ð°Ð½Ð½Ñ: Ð²Ð¸Ð±Ñ–Ñ€ Ñ„Ð¾Ñ€Ð¼Ð¸ Ð¿Ð°ÑÐ¸Ð²Ñƒ\n\nÐ’Ð¸Ð±Ñ–Ñ€ Ñ„Ð¾Ñ€Ð¼Ð¸ Ð¿Ð°ÑÐ¸Ð²Ð½Ð¾Ð³Ð¾ ÑÑ‚Ð°Ð½Ñƒ Ð·Ð°Ð»ÐµÐ¶Ð¸Ñ‚ÑŒ Ð²Ñ–Ð´ **ÐºÐ¾Ð½Ñ‚ÐµÐºÑÑ‚Ñƒ** Ñ‚Ð° **ÐºÐ¾Ð¼ÑƒÐ½Ñ–ÐºÐ°Ñ‚Ð¸Ð²Ð½Ð¾Ñ— Ð¼ÐµÑ‚Ð¸**. Ð Ð¾Ð·Ð³Ð»ÑÐ½ÑŒÐ¼Ð¾ Ñ‚Ð¸Ð¿Ð¾Ð²Ñ– ÑÐ¸Ñ‚ÑƒÐ°Ñ†Ñ–Ñ—:\n\n**1. ÐžÑ„Ñ–Ñ†Ñ–Ð¹Ð½Ð¸Ð¹ Ð´Ð¾ÐºÑƒÐ¼ÐµÐ½Ñ‚ (Ð·Ð°ÐºÐ¾Ð½, Ð½Ð°ÐºÐ°Ð·, Ð¿Ñ€Ð¾Ñ‚Ð¾ÐºÐ¾Ð»):**\nÐ’Ð¸ÐºÐ¾Ñ€Ð¸ÑÑ‚Ð¾Ð²ÑƒÐ¹Ñ‚Ðµ **Ð²Ð¸ÐºÐ»ÑŽÑ‡Ð½Ð¾** Ñ„Ð¾Ñ€Ð¼Ñƒ Ð½Ð° -Ð½Ð¾/-Ñ‚Ð¾.\n- âœ“ *Ð—Ð°ÐºÐ¾Ð½ **ÑƒÑ…Ð²Ð°Ð»ÐµÐ½Ð¾** Ð¿Ð°Ñ€Ð»Ð°Ð¼ÐµÐ½Ñ‚Ð¾Ð¼.*\n- âœ— *Ð—Ð°ÐºÐ¾Ð½ ÑƒÑ…Ð²Ð°Ð»Ð¸Ð»Ð¸* (Ð·Ð°Ð½Ð°Ð´Ñ‚Ð¾ Ð½ÐµÑ„Ð¾Ñ€Ð¼Ð°Ð»ÑŒÐ½Ð¾)\n\n**2. ÐÐ°ÑƒÐºÐ¾Ð²Ð° ÑÑ‚Ð°Ñ‚Ñ‚Ñ (Ð¾Ð¿Ð¸Ñ Ð¼ÐµÑ‚Ð¾Ð´Ð¾Ð»Ð¾Ð³Ñ–Ñ—):**\nÐŸÐ¾Ñ”Ð´Ð½ÑƒÐ¹Ñ‚Ðµ Ñ„Ð¾Ñ€Ð¼Ñƒ Ð½Ð° -Ð½Ð¾/-Ñ‚Ð¾ (Ñ€ÐµÐ·ÑƒÐ»ÑŒÑ‚Ð°Ñ‚Ð¸) Ñ‚Ð° Ð·Ð²Ð¾Ñ€Ð¾Ñ‚Ð½Ð¸Ð¹ Ð¿Ð°ÑÐ¸Ð² (Ð¿Ñ€Ð¾Ñ†ÐµÑÐ¸).\n- *Ð”Ð°Ð½Ñ– **Ð¾Ð±Ñ€Ð¾Ð±Ð»ÐµÐ½Ð¾** Ð·Ð° Ð´Ð¾Ð¿Ð¾Ð¼Ð¾Ð³Ð¾ÑŽ ÑÑ‚Ð°Ñ‚Ð¸ÑÑ‚Ð¸Ñ‡Ð½Ð¸Ñ… Ð¼ÐµÑ‚Ð¾Ð´Ñ–Ð².* (Ñ€ÐµÐ·ÑƒÐ»ÑŒÑ‚Ð°Ñ‚)\n- *Ð”Ð¾ÑÐ»Ñ–Ð´Ð¶ÐµÐ½Ð½Ñ **Ð¿Ñ€Ð¾Ð²Ð¾Ð´Ð¸Ñ‚ÑŒÑÑ** Ñ‰Ð¾Ñ€Ð¾ÐºÑƒ.* (Ð¿Ñ€Ð¾Ñ†ÐµÑ)\n\n**3. ÐŸÑƒÐ±Ð»Ñ–Ñ†Ð¸ÑÑ‚Ð¸ÐºÐ° (Ð½Ð¾Ð²Ð¸Ð½Ð½Ð° ÑÑ‚Ð°Ñ‚Ñ‚Ñ):**\nÐ‘Ð°Ð»Ð°Ð½ÑÑƒÐ¹Ñ‚Ðµ Ð¼Ñ–Ð¶ Ñ„Ð¾Ñ€Ð¼Ð°Ð»ÑŒÐ½Ñ–ÑÑ‚ÑŽ Ñ‚Ð° Ð´Ð¾ÑÑ‚ÑƒÐ¿Ð½Ñ–ÑÑ‚ÑŽ.\n- *Ð ÐµÑ„Ð¾Ñ€Ð¼Ñƒ **ÑÑ…Ð²Ð°Ð»ÐµÐ½Ð¾**: Ñ‰Ð¾ Ñ†Ðµ Ð¾Ð·Ð½Ð°Ñ‡Ð°Ñ” Ð´Ð»Ñ Ð³Ñ€Ð¾Ð¼Ð°Ð´ÑÐ½?*\n\n**4. Ð”Ñ–Ð»Ð¾Ð²Ðµ Ð»Ð¸ÑÑ‚ÑƒÐ²Ð°Ð½Ð½Ñ:**\nÐžÐ±Ð¸Ñ€Ð°Ð¹Ñ‚Ðµ Ñ„Ð¾Ñ€Ð¼Ñƒ Ð·Ð°Ð»ÐµÐ¶Ð½Ð¾ Ð²Ñ–Ð´ Ñ€Ñ–Ð²Ð½Ñ Ñ„Ð¾Ñ€Ð¼Ð°Ð»ÑŒÐ½Ð¾ÑÑ‚Ñ–.\n- Ð¤Ð¾Ñ€Ð¼Ð°Ð»ÑŒÐ½Ð¸Ð¹ Ð»Ð¸ÑÑ‚: *Ð’Ð°ÑˆÑƒ Ð·Ð°ÑÐ²Ñƒ **Ñ€Ð¾Ð·Ð³Ð»ÑÐ½ÑƒÑ‚Ð¾**.*\n- ÐÐ°Ð¿Ñ–Ð²Ñ„Ð¾Ñ€Ð¼Ð°Ð»ÑŒÐ½Ð¸Ð¹: *Ð—Ð°ÑÐ²Ñƒ Ñ€Ð¾Ð·Ð³Ð»ÑÐ½ÑƒÐ»Ð¸.*\n\n> ðŸ”— **ÐŸÐ¾Ñ€Ñ–Ð²Ð½ÑÐ½Ð½Ñ Ð· Ð°Ð½Ð³Ð»Ñ–Ð¹ÑÑŒÐºÐ¾ÑŽ**\n>\n> Ð’ Ð°Ð½Ð³Ð»Ñ–Ð¹ÑÑŒÐºÑ–Ð¹ Ð¼Ð¾Ð²Ñ– Ð¿Ð°ÑÐ¸Ð²Ð½Ð¸Ð¹ ÑÑ‚Ð°Ð½ ÑƒÐ½Ñ–Ð²ÐµÑ€ÑÐ°Ð»ÑŒÐ½Ð¸Ð¹ (was signed, is being processed), Ñ‚Ð¾Ð´Ñ– ÑÐº ÑƒÐºÑ€Ð°Ñ—Ð½ÑÑŒÐºÐ° Ð¼Ð°Ñ” Ñ‡Ð¾Ñ‚Ð¸Ñ€Ð¸ Ñ„Ð¾Ñ€Ð¼Ð¸ Ð· Ñ€Ñ–Ð·Ð½Ð¸Ð¼ **Ñ€ÐµÐ³Ñ–ÑÑ‚Ñ€Ð¾Ð¼**. Ð¦Ðµ Ð´Ð°Ñ” Ð²Ð°Ð¼ Ð³Ð½ÑƒÑ‡ÐºÑ–ÑÑ‚ÑŒ, Ð°Ð»Ðµ Ð²Ð¸Ð¼Ð°Ð³Ð°Ñ” Ñ€ÐµÑ‚ÐµÐ»ÑŒÐ½Ð¾Ð³Ð¾ Ð²Ð¸Ð±Ð¾Ñ€Ñƒ Ñ„Ð¾Ñ€Ð¼Ð¸ Ð´Ð»Ñ ÐºÐ¾Ð¶Ð½Ð¾Ñ— ÑÐ¸Ñ‚ÑƒÐ°Ñ†Ñ–Ñ—.\n\n### Ð”Ñ–Ð°Ð»Ð¾Ð³ 1: ÐÐ°ÑƒÐºÐ¾Ð²Ð° ÐºÐ¾Ð½Ñ„ÐµÑ€ÐµÐ½Ñ†Ñ–Ñ ðŸ—£ï¸\n\n**ÐŸÑ€Ð¾Ñ„ÐµÑÐ¾Ñ€ ÐœÐµÐ»ÑŒÐ½Ð¸Ðº:** ÐšÐ¾Ð»ÐµÐ³Ð¾, Ñ Ð¿Ñ€Ð¾Ñ‡Ð¸Ñ‚Ð°Ð² Ð²Ð°ÑˆÑƒ ÑÑ‚Ð°Ñ‚Ñ‚ÑŽ. Ð¦Ñ–ÐºÐ°Ð²Ðµ **Ð´Ð¾ÑÐ»Ñ–Ð´Ð¶ÐµÐ½Ð½Ñ**.\n\n**Ð”Ð¾Ñ†ÐµÐ½Ñ‚ ÐšÐ¾Ð²Ð°Ð»ÐµÐ½ÐºÐ¾:** Ð”ÑÐºÑƒÑŽ. Ð Ð¾Ð±Ð¾Ñ‚Ð° **Ð±ÑƒÐ»Ð° Ð²Ð¸ÐºÐ¾Ð½Ð°Ð½Ð°** ÑÐ¿Ñ–Ð»ÑŒÐ½Ð¾ Ð· ÐºÐ¾Ð»ÐµÐ³Ð°Ð¼Ð¸ Ð· Ð›ÑŒÐ²Ñ–Ð²ÑÑŒÐºÐ¾Ð³Ð¾ ÑƒÐ½Ñ–Ð²ÐµÑ€ÑÐ¸Ñ‚ÐµÑ‚Ñƒ.\n\n**ÐŸÑ€Ð¾Ñ„ÐµÑÐ¾Ñ€ ÐœÐµÐ»ÑŒÐ½Ð¸Ðº:** Ð ÑÐºÑƒ Ð¼ÐµÑ‚Ð¾Ð´Ð¾Ð»Ð¾Ð³Ñ–ÑŽ **Ð·Ð°ÑÑ‚Ð¾ÑÐ¾Ð²Ð°Ð½Ð¾**?\n\n**Ð”Ð¾Ñ†ÐµÐ½Ñ‚ ÐšÐ¾Ð²Ð°Ð»ÐµÐ½ÐºÐ¾:** **Ð‘ÑƒÐ»Ð¾ Ð²Ð¸ÐºÐ¾Ñ€Ð¸ÑÑ‚Ð°Ð½Ð¾** ÐºÐ¾Ð¼Ð¿Ð»ÐµÐºÑÐ½Ð¸Ð¹ Ð¿Ñ–Ð´Ñ…Ñ–Ð´: ÐºÑ–Ð»ÑŒÐºÑ–ÑÐ½Ð¸Ð¹ Ñ‚Ð° ÑÐºÑ–ÑÐ½Ð¸Ð¹ **Ð°Ð½Ð°Ð»Ñ–Ð·**. Ð”Ð°Ð½Ñ– **Ð¾Ð±Ñ€Ð¾Ð±Ð»ÑÐ»Ð¸ÑÑ** Ð¿Ñ€Ð¾Ñ‚ÑÐ³Ð¾Ð¼ Ñ€Ð¾ÐºÑƒ.\n\n**ÐŸÑ€Ð¾Ñ„ÐµÑÐ¾Ñ€ ÐœÐµÐ»ÑŒÐ½Ð¸Ðº:** Ð§ÑƒÐ´Ð¾Ð²Ð¾. ÐšÐ¾Ð»Ð¸ Ñ€ÐµÐ·ÑƒÐ»ÑŒÑ‚Ð°Ñ‚Ð¸ **Ð±ÑƒÐ´ÑƒÑ‚ÑŒ Ð¾Ð¿ÑƒÐ±Ð»Ñ–ÐºÐ¾Ð²Ð°Ð½Ñ–**?\n\n**Ð”Ð¾Ñ†ÐµÐ½Ñ‚ ÐšÐ¾Ð²Ð°Ð»ÐµÐ½ÐºÐ¾:** Ð¡Ñ‚Ð°Ñ‚Ñ‚ÑŽ Ð²Ð¶Ðµ **Ð¿Ð¾Ð´Ð°Ð½Ð¾** Ð´Ð¾ Ð¶ÑƒÑ€Ð½Ð°Ð»Ñƒ. ÐžÑ‡Ñ–ÐºÑƒÑ”Ð¼Ð¾ **Ñ€ÐµÑ†ÐµÐ½Ð·ÑƒÐ²Ð°Ð½Ð½Ñ**.\n\n> ðŸ’¡ **Ð—Ð²ÐµÑ€Ð½Ñ–Ñ‚ÑŒ ÑƒÐ²Ð°Ð³Ñƒ**\n>\n> Ð£ Ñ†ÑŒÐ¾Ð¼Ñƒ Ð´Ñ–Ð°Ð»Ð¾Ð·Ñ– Ð²Ð¶Ð¸Ñ‚Ð¾ Ñ‡Ð¾Ñ‚Ð¸Ñ€Ð¸ Ñ€Ñ–Ð·Ð½Ñ– Ñ„Ð¾Ñ€Ð¼Ð¸ Ð¿Ð°ÑÐ¸Ð²Ð½Ð¾Ð³Ð¾ ÑÑ‚Ð°Ð½Ñƒ. ÐšÐ¾Ð¶Ð½Ð° Ð· Ð½Ð¸Ñ… Ð´Ð¾Ñ€ÐµÑ‡Ð½Ð° Ð² Ð°ÐºÐ°Ð´ÐµÐ¼Ñ–Ñ‡Ð½Ð¾Ð¼Ñƒ ÐºÐ¾Ð½Ñ‚ÐµÐºÑÑ‚Ñ–. Ð¦Ðµ â€” Ð¼Ð¾Ð²Ð½Ð° **Ð¼Ð°Ð¹ÑÑ‚ÐµÑ€Ð½Ñ–ÑÑ‚ÑŒ** Ñ€Ñ–Ð²Ð½Ñ C1.\n\n## Deep Dive: ÐŸ'ÑÑ‚ÑŒ Ñ„ÑƒÐ½ÐºÑ†Ñ–Ð¾Ð½Ð°Ð»ÑŒÐ½Ð¸Ñ… ÑÑ‚Ð¸Ð»Ñ–Ð²\n\nÐÐ° Ñ€Ñ–Ð²Ð½Ñ– B2 Ð²Ð¸ Ð¾Ð·Ð½Ð°Ð¹Ð¾Ð¼Ð¸Ð»Ð¸ÑÑ Ð· Ð¿'ÑÑ‚ÑŒÐ¼Ð° Ñ„ÑƒÐ½ÐºÑ†Ñ–Ð¾Ð½Ð°Ð»ÑŒÐ½Ð¸Ð¼Ð¸ ÑÑ‚Ð¸Ð»ÑÐ¼Ð¸ ÑƒÐºÑ€Ð°Ñ—Ð½ÑÑŒÐºÐ¾Ñ— Ð¼Ð¾Ð²Ð¸. Ð¢ÐµÐ¿ÐµÑ€ Ñ‡Ð°Ñ Ð´Ð»Ñ **Ð¿Ð¾Ð³Ð»Ð¸Ð±Ð»ÐµÐ½Ð½Ñ** â€” Ð²Ð¸ Ð¼Ð°Ñ”Ñ‚Ðµ Ð½Ðµ Ð¿Ñ€Ð¾ÑÑ‚Ð¾ Ð·Ð½Ð°Ñ‚Ð¸ Ñ†Ñ– ÑÑ‚Ð¸Ð»Ñ–, Ð° Ð²Ñ–Ð»ÑŒÐ½Ð¾ **Ð¿ÐµÑ€ÐµÐ¼Ð¸ÐºÐ°Ñ‚Ð¸ÑÑ** Ð¼Ñ–Ð¶ Ð½Ð¸Ð¼Ð¸.\n\n### ÐžÐ³Ð»ÑÐ´ Ñ„ÑƒÐ½ÐºÑ†Ñ–Ð¾Ð½Ð°Ð»ÑŒÐ½Ð¸Ñ… ÑÑ‚Ð¸Ð»Ñ–Ð²\n\n| Ð¡Ñ‚Ð¸Ð»ÑŒ | Ð¡Ñ„ÐµÑ€Ð° | ÐšÐ»ÑŽÑ‡Ð¾Ð²Ñ– Ð¾Ð·Ð½Ð°ÐºÐ¸ | ÐŸÑ€Ð¸ÐºÐ»Ð°Ð´ Ð¿Ð°ÑÐ¸Ð²Ñƒ |\n|-------|-------|----------------|----------------|\n| ÐÐ°ÑƒÐºÐ¾Ð²Ð¸Ð¹ | ÐÐºÐ°Ð´ÐµÐ¼Ñ–Ñ, Ð´Ð¾ÑÐ»Ñ–Ð´Ð¶ÐµÐ½Ð½Ñ | ÐžÐ±'Ñ”ÐºÑ‚Ð¸Ð²Ð½Ñ–ÑÑ‚ÑŒ, Ñ‚ÐµÑ€Ð¼Ñ–Ð½Ð¾Ð»Ð¾Ð³Ñ–Ñ | *Ð‘ÑƒÐ»Ð¾ Ð²ÑÑ‚Ð°Ð½Ð¾Ð²Ð»ÐµÐ½Ð¾ ÐºÐ¾Ñ€ÐµÐ»ÑÑ†Ñ–ÑŽ* |\n| ÐžÑ„Ñ–Ñ†Ñ–Ð¹Ð½Ð¾-Ð´Ñ–Ð»Ð¾Ð²Ð¸Ð¹ | Ð”Ð¾ÐºÑƒÐ¼ÐµÐ½Ñ‚Ð¸, Ð·Ð°ÐºÐ¾Ð½Ð¸ | Ð¡Ñ‚Ð°Ð½Ð´Ð°Ñ€Ñ‚Ð¸Ð·Ð¾Ð²Ð°Ð½Ñ–ÑÑ‚ÑŒ, ÑŽÑ€Ð¸Ð´Ð¸Ñ‡Ð½Ð° Ñ‚Ð¾Ñ‡Ð½Ñ–ÑÑ‚ÑŒ | *Ð”Ð¾Ð³Ð¾Ð²Ñ–Ñ€ ÑƒÐºÐ»Ð°Ð´ÐµÐ½Ð¾* |\n| ÐŸÑƒÐ±Ð»Ñ–Ñ†Ð¸ÑÑ‚Ð¸Ñ‡Ð½Ð¸Ð¹ | Ð—ÐœÐ†, Ð¶ÑƒÑ€Ð½Ð°Ð»Ñ–ÑÑ‚Ð¸ÐºÐ° | ÐÐºÑ‚ÑƒÐ°Ð»ÑŒÐ½Ñ–ÑÑ‚ÑŒ, Ð¾Ð±Ñ€Ð°Ð·Ð½Ñ–ÑÑ‚ÑŒ | *Ð—Ð°ÐºÐ¾Ð½ Ð±ÑƒÐ»Ð¾ ÑƒÑ…Ð²Ð°Ð»ÐµÐ½Ð¾ Ð²Ñ‡Ð¾Ñ€Ð°* |\n| Ð¥ÑƒÐ´Ð¾Ð¶Ð½Ñ–Ð¹ | Ð›Ñ–Ñ‚ÐµÑ€Ð°Ñ‚ÑƒÑ€Ð° | Ð•ÐºÑÐ¿Ñ€ÐµÑÐ¸Ð²Ð½Ñ–ÑÑ‚ÑŒ, Ñ–Ð½Ð´Ð¸Ð²Ñ–Ð´ÑƒÐ°Ð»ÑŒÐ½Ñ–ÑÑ‚ÑŒ | *ÐŸÑ–ÑÐ½Ñ Ð±ÑƒÐ»Ð° ÑÐ¿Ñ–Ð²Ð°Ð½Ð°* (Ð°Ñ€Ñ…Ð°Ñ—Ñ‡Ð½Ð¾) |\n| Ð Ð¾Ð·Ð¼Ð¾Ð²Ð½Ð¸Ð¹ | ÐŸÐ¾Ð±ÑƒÑ‚, ÑÐ¿Ñ–Ð»ÐºÑƒÐ²Ð°Ð½Ð½Ñ | ÐÐµÐ²Ð¸Ð¼ÑƒÑˆÐµÐ½Ñ–ÑÑ‚ÑŒ, ÐµÐ¼Ð¾Ñ†Ñ–Ð¹Ð½Ñ–ÑÑ‚ÑŒ | Ð Ñ–Ð´ÐºÐ¾ Ð²Ð¶Ð¸Ð²Ð°Ñ”Ñ‚ÑŒÑÑ Ð¿Ð°ÑÐ¸Ð² |\n\n> ðŸŽ­ **ÐšÑƒÐ»ÑŒÑ‚ÑƒÑ€Ð½Ð¸Ð¹ ÐºÐ¾Ð½Ñ‚ÐµÐºÑÑ‚**\n>\n> Ð£ÐºÑ€Ð°Ñ—Ð½ÑÑŒÐºÐ° Ð¼Ð¾Ð²Ð° Ð¼Ð°Ñ” Ð½Ð°Ð´Ð·Ð²Ð¸Ñ‡Ð°Ð¹Ð½Ð¾ Ð±Ð°Ð³Ð°Ñ‚Ñƒ ÑÑ‚Ð¸Ð»Ñ–ÑÑ‚Ð¸Ñ‡Ð½Ñƒ ÑÐ¸ÑÑ‚ÐµÐ¼Ñƒ, Ñ‰Ð¾ Ñ„Ð¾Ñ€Ð¼ÑƒÐ²Ð°Ð»Ð°ÑÑ ÑÑ‚Ð¾Ð»Ñ–Ñ‚Ñ‚ÑÐ¼Ð¸. ÐŸÐ¾Ð¿Ñ€Ð¸ Ð²ÑÑ– Ð·Ð°Ð±Ð¾Ñ€Ð¾Ð½Ð¸ (Ð•Ð¼ÑÑŒÐºÐ¸Ð¹ ÑƒÐºÐ°Ð· 1876 Ñ€Ð¾ÐºÑƒ, Ð’Ð°Ð»ÑƒÑ—Ð²ÑÑŒÐºÐ¸Ð¹ Ñ†Ð¸Ñ€ÐºÑƒÐ»ÑÑ€ 1863 Ñ€Ð¾ÐºÑƒ), ÑƒÐºÑ€Ð°Ñ—Ð½ÑÑŒÐºÑ– Ð¿Ð¸ÑÑŒÐ¼ÐµÐ½Ð½Ð¸ÐºÐ¸ Ñ‚Ð° Ð½Ð°ÑƒÐºÐ¾Ð²Ñ†Ñ– Ð·Ð±ÐµÑ€ÐµÐ³Ð»Ð¸ Ð¹ Ñ€Ð¾Ð·Ð²Ð¸Ð½ÑƒÐ»Ð¸ Ð²ÑÑ– Ð¿'ÑÑ‚ÑŒ ÑÑ‚Ð¸Ð»Ñ–Ð².\n\n### ÐÐ°ÑƒÐºÐ¾Ð²Ð¸Ð¹ ÑÑ‚Ð¸Ð»ÑŒ: Ð³Ð»Ð¸Ð±ÑˆÐµ Ð·Ð°Ð½ÑƒÑ€ÐµÐ½Ð½Ñ\n\nÐ£ Ð½Ð°ÑƒÐºÐ¾Ð²Ð¾Ð¼Ñƒ ÑÑ‚Ð¸Ð»Ñ– **ÐºÐ¾Ð½ÑÐ¾Ð»Ñ–Ð´Ð°Ñ†Ñ–Ñ** Ð·Ð½Ð°Ð½ÑŒ Ð²Ñ–Ð´Ð±ÑƒÐ²Ð°Ñ”Ñ‚ÑŒÑÑ Ñ‡ÐµÑ€ÐµÐ· Ñ‡Ñ–Ñ‚ÐºÑƒ ÑÑ‚Ñ€ÑƒÐºÑ‚ÑƒÑ€Ñƒ. Ð Ð¾Ð·Ð³Ð»ÑÐ½ÑŒÐ¼Ð¾ Ñ‚Ð¸Ð¿Ð¾Ð²Ñ– ÐºÐ¾Ð½ÑÑ‚Ñ€ÑƒÐºÑ†Ñ–Ñ—:\n\n**Ð’ÑÑ‚ÑƒÐ¿Ð½Ñ– Ñ„Ð¾Ñ€Ð¼ÑƒÐ»Ð¸:**\n- *Ð£ ÑÑ‚Ð°Ñ‚Ñ‚Ñ– Ñ€Ð¾Ð·Ð³Ð»ÑÐ´Ð°Ñ”Ñ‚ÑŒÑÑ Ð¿Ð¸Ñ‚Ð°Ð½Ð½Ñ...*\n- *Ð”Ð¾ÑÐ»Ñ–Ð´Ð¶ÐµÐ½Ð½Ñ Ð¿Ñ€Ð¸ÑÐ²ÑÑ‡ÐµÐ½Ð¾ **Ð°Ð½Ð°Ð»Ñ–Ð·Ñƒ**...*\n- *ÐœÐµÑ‚Ð¾ÑŽ Ñ€Ð¾Ð±Ð¾Ñ‚Ð¸ Ñ” **ÑÐ¸ÑÑ‚ÐµÐ¼Ð°Ñ‚Ð¸Ð·Ð°Ñ†Ñ–Ñ**...*\n\n**Ð¤Ð¾Ñ€Ð¼ÑƒÐ»Ð¸ Ð´Ð»Ñ Ñ€ÐµÐ·ÑƒÐ»ÑŒÑ‚Ð°Ñ‚Ñ–Ð²:**\n- ***Ð’ÑÑ‚Ð°Ð½Ð¾Ð²Ð»ÐµÐ½Ð¾**, Ñ‰Ð¾ Ñ–ÑÐ½ÑƒÑ” Ð·Ð°Ð»ÐµÐ¶Ð½Ñ–ÑÑ‚ÑŒ Ð¼Ñ–Ð¶...*\n- ***Ð”Ð¾Ð²ÐµÐ´ÐµÐ½Ð¾** ÐµÑ„ÐµÐºÑ‚Ð¸Ð²Ð½Ñ–ÑÑ‚ÑŒ Ð¼ÐµÑ‚Ð¾Ð´Ñƒ...*\n- *ÐÐ° Ð¾ÑÐ½Ð¾Ð²Ñ– **Ð¾Ñ†Ñ–Ð½ÑŽÐ²Ð°Ð½Ð½Ñ** Ð´Ð°Ð½Ð¸Ñ… Ð·Ñ€Ð¾Ð±Ð»ÐµÐ½Ð¾ Ð²Ð¸ÑÐ½Ð¾Ð²Ð¾Ðº...*\n\n### Ð”Ñ–Ð°Ð»Ð¾Ð³ 2: Ð ÐµÐ´Ð°ÐºÑ†Ñ–Ð¹Ð½Ð° Ð½Ð°Ñ€Ð°Ð´Ð° ðŸ—£ï¸\n\n**Ð ÐµÐ´Ð°ÐºÑ‚Ð¾Ñ€:** ÐšÐ¾Ð»ÐµÐ³Ð¸, Ð¼Ð°Ñ”Ð¼Ð¾ **ÑƒÐ·Ð°Ð³Ð°Ð»ÑŒÐ½ÐµÐ½Ð½Ñ** Ñ€ÐµÐ·ÑƒÐ»ÑŒÑ‚Ð°Ñ‚Ñ–Ð² Ð¾Ð¿Ð¸Ñ‚ÑƒÐ²Ð°Ð½Ð½Ñ. ÐŸÐµÑ‚Ñ€Ðµ, Ñ‰Ð¾ Ð²Ð¸ÑÐ²Ð»ÐµÐ½Ð¾?\n\n**Ð–ÑƒÑ€Ð½Ð°Ð»Ñ–ÑÑ‚:** **Ð‘ÑƒÐ»Ð¾ Ð¾Ð¿Ð¸Ñ‚Ð°Ð½Ð¾** Ð¿Ð¾Ð½Ð°Ð´ Ñ‚Ð¸ÑÑÑ‡Ñƒ Ñ€ÐµÑÐ¿Ð¾Ð½Ð´ÐµÐ½Ñ‚Ñ–Ð². Ð‘Ñ–Ð»ÑŒÑˆÑ–ÑÑ‚ÑŒ Ð¿Ñ–Ð´Ñ‚Ñ€Ð¸Ð¼ÑƒÑ” Ñ€ÐµÑ„Ð¾Ñ€Ð¼Ñƒ.\n\n**Ð ÐµÐ´Ð°ÐºÑ‚Ð¾Ñ€:** Ð¯Ðº Ñ†Ðµ Ð¿Ð¾Ð´Ð°Ð¼Ð¾? Ð¯ÐºÐ¸Ð¹ ÑÑ‚Ð¸Ð»ÑŒ?\n\n**Ð–ÑƒÑ€Ð½Ð°Ð»Ñ–ÑÑ‚:** Ð”ÑƒÐ¼Ð°ÑŽ, Ð¿ÑƒÐ±Ð»Ñ–Ñ†Ð¸ÑÑ‚Ð¸Ñ‡Ð½Ð¸Ð¹. Ð—Ð°Ð³Ð¾Ð»Ð¾Ð²Ð¾Ðº: Â«Ð ÐµÑ„Ð¾Ñ€Ð¼Ñƒ Ð¿Ñ–Ð´Ñ‚Ñ€Ð¸Ð¼Ð°Ð½Ð¾: Ñ€ÐµÐ·ÑƒÐ»ÑŒÑ‚Ð°Ñ‚Ð¸ Ð²ÑÐµÑƒÐºÑ€Ð°Ñ—Ð½ÑÑŒÐºÐ¾Ð³Ð¾ Ð¾Ð¿Ð¸Ñ‚ÑƒÐ²Ð°Ð½Ð½ÑÂ».\n\n**Ð ÐµÐ´Ð°ÐºÑ‚Ð¾Ñ€:** Ð”Ð¾Ð±Ñ€Ðµ. Ð Ð´Ð»Ñ ÑÐ°Ð¹Ñ‚Ñƒ â€” Ñ€Ð¾Ð·Ð¼Ð¾Ð²Ð½Ñ–ÑˆÐ¸Ð¹ Ð²Ð°Ñ€Ñ–Ð°Ð½Ñ‚. Â«Ð£ÐºÑ€Ð°Ñ—Ð½Ñ†Ñ– ÑÐºÐ°Ð·Ð°Ð»Ð¸ Â«Ñ‚Ð°ÐºÂ» Ñ€ÐµÑ„Ð¾Ñ€Ð¼Ñ–Â».\n\n**Ð–ÑƒÑ€Ð½Ð°Ð»Ñ–ÑÑ‚:** Ð—Ñ€Ð¾Ð·ÑƒÐ¼Ñ–Ð»Ð¾. **ÐŸÐµÑ€ÐµÑ…Ñ–Ð´** Ð¼Ñ–Ð¶ ÑÑ‚Ð¸Ð»ÑÐ¼Ð¸ â€” Ñ†Ðµ **Ð²Ð´Ð¾ÑÐºÐ¾Ð½Ð°Ð»ÐµÐ½Ð½Ñ** Ð½Ð°ÑˆÐ¸Ñ… Ð½Ð°Ð²Ð¸Ñ‡Ð¾Ðº.\n\n### ÐžÑ„Ñ–Ñ†Ñ–Ð¹Ð½Ð¾-Ð´Ñ–Ð»Ð¾Ð²Ð¸Ð¹ ÑÑ‚Ð¸Ð»ÑŒ: Ñ„Ð¾Ñ€Ð¼Ð°Ð»ÑŒÐ½Ð° Ñ‚Ð¾Ñ‡Ð½Ñ–ÑÑ‚ÑŒ\n\nÐ’ Ð¾Ñ„Ñ–Ñ†Ñ–Ð¹Ð½Ð¸Ñ… Ð´Ð¾ÐºÑƒÐ¼ÐµÐ½Ñ‚Ð°Ñ… Ñ„Ð¾Ñ€Ð¼Ð° Ð½Ð° -Ð½Ð¾/-Ñ‚Ð¾ Ñ” Ð¾Ð±Ð¾Ð²'ÑÐ·ÐºÐ¾Ð²Ð¾ÑŽ:\n\n| ÐÐµÐ¿Ñ€Ð°Ð²Ð¸Ð»ÑŒÐ½Ð¾ | ÐŸÑ€Ð°Ð²Ð¸Ð»ÑŒÐ½Ð¾ |\n|-------------|-----------|\n| ÐœÐ¸ ÑƒÑ…Ð²Ð°Ð»Ð¸Ð»Ð¸ Ñ€Ñ–ÑˆÐµÐ½Ð½Ñ | Ð Ñ–ÑˆÐµÐ½Ð½Ñ **ÑƒÑ…Ð²Ð°Ð»ÐµÐ½Ð¾** |\n| Ð”Ð¸Ñ€ÐµÐºÑ‚Ð¾Ñ€ Ð¿Ñ–Ð´Ð¿Ð¸ÑÐ°Ð² Ð½Ð°ÐºÐ°Ð· | ÐÐ°ÐºÐ°Ð· **Ð¿Ñ–Ð´Ð¿Ð¸ÑÐ°Ð½Ð¾** Ð´Ð¸Ñ€ÐµÐºÑ‚Ð¾Ñ€Ð¾Ð¼ |\n| ÐšÐ¾Ð¼Ñ–ÑÑ–Ñ Ñ€Ð¾Ð·Ð³Ð»ÑÐ½ÑƒÐ»Ð° Ð·Ð°ÑÐ²Ñƒ | Ð—Ð°ÑÐ²Ñƒ **Ñ€Ð¾Ð·Ð³Ð»ÑÐ½ÑƒÑ‚Ð¾** ÐºÐ¾Ð¼Ñ–ÑÑ–Ñ”ÑŽ |\n\n> ðŸŒ **Ð ÐµÐ°Ð»ÑŒÐ½Ð¸Ð¹ ÑÐ²Ñ–Ñ‚**\n>\n> ÐšÐ¾Ð»Ð¸ Ð²Ð¸ Ð¾Ñ‚Ñ€Ð¸Ð¼ÑƒÑ”Ñ‚Ðµ Ð¾Ñ„Ñ–Ñ†Ñ–Ð¹Ð½Ð¸Ð¹ Ð´Ð¾ÐºÑƒÐ¼ÐµÐ½Ñ‚ Ð· Ð£ÐºÑ€Ð°Ñ—Ð½Ð¸ â€” Ð²Ñ–Ð·Ñƒ, ÑÐµÑ€Ñ‚Ð¸Ñ„Ñ–ÐºÐ°Ñ‚, Ð´Ð¸Ð¿Ð»Ð¾Ð¼ â€” Ð·Ð²ÐµÑ€Ð½Ñ–Ñ‚ÑŒ ÑƒÐ²Ð°Ð³Ñƒ Ð½Ð° Ñ„Ð¾Ñ€Ð¼Ð¸ Ð´Ñ–Ñ”ÑÐ»Ñ–Ð². Ð¢Ð°Ð¼ Ð·Ð°Ð²Ð¶Ð´Ð¸ Ð±ÑƒÐ´Ðµ Â«Ð²Ð¸Ð´Ð°Ð½Ð¾Â», Â«Ð·Ð°Ñ‚Ð²ÐµÑ€Ð´Ð¶ÐµÐ½Ð¾Â», Â«Ð¿Ñ–Ð´Ð¿Ð¸ÑÐ°Ð½Ð¾Â». Ð¦Ðµ Ð½Ðµ ÐºÐ°Ð½Ñ†ÐµÐ»ÑÑ€Ð¸Ñ‚, Ð° Ð½Ð¾Ñ€Ð¼Ð° Ð¾Ñ„Ñ–Ñ†Ñ–Ð¹Ð½Ð¾Ð³Ð¾ ÑÑ‚Ð¸Ð»ÑŽ.\n\n### ÐŸÑƒÐ±Ð»Ñ–Ñ†Ð¸ÑÑ‚Ð¸Ñ‡Ð½Ð¸Ð¹ ÑÑ‚Ð¸Ð»ÑŒ: Ð±Ð°Ð»Ð°Ð½Ñ\n\nÐ–ÑƒÑ€Ð½Ð°Ð»Ñ–ÑÑ‚Ð¸ÐºÐ° Ð²Ð¸Ð¼Ð°Ð³Ð°Ñ” Ð±Ð°Ð»Ð°Ð½ÑÑƒ Ð¼Ñ–Ð¶ Ð´Ð¾ÑÑ‚ÑƒÐ¿Ð½Ñ–ÑÑ‚ÑŽ Ñ‚Ð° Ð°Ð²Ñ‚Ð¾Ñ€Ð¸Ñ‚ÐµÑ‚Ð½Ñ–ÑÑ‚ÑŽ:\n\n**Ð—Ð°Ð³Ð¾Ð»Ð¾Ð²ÐºÐ¸ (ÐºÐ¾Ñ€Ð¾Ñ‚ÐºÐ¾, Ð°ÐºÑ‚Ð¸Ð²Ð½Ð¾):**\n- *ÐŸÐ°Ñ€Ð»Ð°Ð¼ÐµÐ½Ñ‚ ÑƒÑ…Ð²Ð°Ð»Ð¸Ð² Ð·Ð°ÐºÐ¾Ð½*\n- *ÐÐ°ÑƒÐºÐ¾Ð²Ñ†Ñ– Ð²Ñ–Ð´ÐºÑ€Ð¸Ð»Ð¸ Ð½Ð¾Ð²Ð¸Ð¹ Ð²Ð¸Ð´*\n\n**Ð¢ÐµÐºÑÑ‚ ÑÑ‚Ð°Ñ‚Ñ‚Ñ– (Ñ„Ð¾Ñ€Ð¼Ð°Ð»ÑŒÐ½Ñ–ÑˆÐµ, Ð¿Ð°ÑÐ¸Ð²):**\n- *Ð—Ð°ÐºÐ¾Ð½Ð¾Ð¿Ñ€Ð¾Ñ”ÐºÑ‚ **Ð±ÑƒÐ»Ð¾ Ñ€Ð¾Ð·Ð³Ð»ÑÐ½ÑƒÑ‚Ð¾** Ñƒ Ð´Ñ€ÑƒÐ³Ð¾Ð¼Ñƒ Ñ‡Ð¸Ñ‚Ð°Ð½Ð½Ñ–...*\n- *Ð’Ñ–Ð´ÐºÑ€Ð¸Ñ‚Ñ‚Ñ **Ð±ÑƒÐ»Ð¾ Ð·Ñ€Ð¾Ð±Ð»ÐµÐ½Ð¾** ÐºÐ¾Ð¼Ð°Ð½Ð´Ð¾ÑŽ ÑƒÐºÑ€Ð°Ñ—Ð½ÑÑŒÐºÐ¸Ñ… Ð±Ñ–Ð¾Ð»Ð¾Ð³Ñ–Ð²...*\n\n### Ð”Ñ–Ð°Ð»Ð¾Ð³ 3: Ð®Ñ€Ð¸Ð´Ð¸Ñ‡Ð½Ð° ÐºÐ¾Ð½ÑÑƒÐ»ÑŒÑ‚Ð°Ñ†Ñ–Ñ ðŸ—£ï¸\n\n**ÐšÐ»Ñ–Ñ”Ð½Ñ‚:** ÐœÐµÐ½Ñ– Ð¿Ð¾Ñ‚Ñ€Ñ–Ð±Ð½Ð° **ÐºÐ¾Ð½ÑÐ¾Ð»Ñ–Ð´Ð°Ñ†Ñ–Ñ** Ð²ÑÑ–Ñ… Ð´Ð¾ÐºÑƒÐ¼ÐµÐ½Ñ‚Ñ–Ð² Ð´Ð»Ñ ÑÑƒÐ´Ñƒ.\n\n**Ð®Ñ€Ð¸ÑÑ‚:** Ð—Ð²Ñ–ÑÐ½Ð¾. Ð—Ð°ÑÐ²Ñƒ Ð²Ð¶Ðµ **Ð¿Ð¾Ð´Ð°Ð½Ð¾**?\n\n**ÐšÐ»Ñ–Ñ”Ð½Ñ‚:** Ð¢Ð°Ðº, Ð¼Ð¸Ð½ÑƒÐ»Ð¾Ð³Ð¾ Ñ‚Ð¸Ð¶Ð½Ñ.\n\n**Ð®Ñ€Ð¸ÑÑ‚:** Ð”Ð¾Ð±Ñ€Ðµ. Ð Ð´Ð¾ÐºÐ°Ð·Ð¸? Ð‡Ñ… **Ð·Ñ–Ð±Ñ€Ð°Ð½Ð¾** Ñ– **ÑÐ¸ÑÑ‚ÐµÐ¼Ð°Ñ‚Ð¸Ð·Ð¾Ð²Ð°Ð½Ð¾**?\n\n**ÐšÐ»Ñ–Ñ”Ð½Ñ‚:** Ð¦Ðµ ÑÐ°Ð¼Ðµ Ñ‚Ðµ, Ð· Ñ‡Ð¸Ð¼ Ð¼ÐµÐ½Ñ– Ð¿Ð¾Ñ‚Ñ€Ñ–Ð±Ð½Ð° Ð´Ð¾Ð¿Ð¾Ð¼Ð¾Ð³Ð°.\n\n**Ð®Ñ€Ð¸ÑÑ‚:** Ð—Ñ€Ð¾Ð·ÑƒÐ¼Ñ–Ð»Ð¾. ÐŸÐ¾Ñ‡Ð½ÐµÐ¼Ð¾ Ð· **Ð°Ð½Ð°Ð»Ñ–Ð·Ñƒ** Ð½Ð°ÑÐ²Ð½Ð¸Ñ… Ð¼Ð°Ñ‚ÐµÑ€Ñ–Ð°Ð»Ñ–Ð². **Ð Ð¾Ð·ÑˆÐ¸Ñ€ÐµÐ½Ð½Ñ** Ð´Ð¾ÐºÐ°Ð·Ð¾Ð²Ð¾Ñ— Ð±Ð°Ð·Ð¸ â€” Ð½Ð°Ñˆ Ð¿Ñ€Ñ–Ð¾Ñ€Ð¸Ñ‚ÐµÑ‚.\n\n### Ð¤Ñ€Ð°Ð·ÐµÐ¾Ð»Ð¾Ð³Ñ–Ñ Ð² Ð°ÐºÐ°Ð´ÐµÐ¼Ñ–Ñ‡Ð½Ð¾Ð¼Ñƒ ÐºÐ¾Ð½Ñ‚ÐµÐºÑÑ‚Ñ–\n\nÐÐ° Ñ€Ñ–Ð²Ð½Ñ– B2 Ð²Ð¸ Ð²Ð¸Ð²Ñ‡Ð°Ð»Ð¸ ÑƒÐºÑ€Ð°Ñ—Ð½ÑÑŒÐºÑ– Ð¿Ñ€Ð¸ÐºÐ°Ð·ÐºÐ¸ Ñ‚Ð° Ñ–Ð´Ñ–Ð¾Ð¼Ð¸. Ð¢ÐµÐ¿ÐµÑ€ Ñ€Ð¾Ð·Ð³Ð»ÑÐ½ÐµÐ¼Ð¾, ÑÐº **Ð·Ð°ÑÑ‚Ð¾ÑÑƒÐ²Ð°Ð½Ð½Ñ** Ñ„Ñ€Ð°Ð·ÐµÐ¾Ð»Ð¾Ð³Ñ–Ñ— Ð²Ñ–Ð´Ñ€Ñ–Ð·Ð½ÑÑ”Ñ‚ÑŒÑÑ Ð·Ð°Ð»ÐµÐ¶Ð½Ð¾ Ð²Ñ–Ð´ Ñ€ÐµÐ³Ñ–ÑÑ‚Ñ€Ñƒ:\n\n| ÐŸÑ€Ð¸ÐºÐ°Ð·ÐºÐ° | Ð Ð¾Ð·Ð¼Ð¾Ð²Ð½Ð¸Ð¹ ÐºÐ¾Ð½Ñ‚ÐµÐºÑÑ‚ | ÐÐºÐ°Ð´ÐµÐ¼Ñ–Ñ‡Ð½Ð¸Ð¹ ÐºÐ¾Ð½Ñ‚ÐµÐºÑÑ‚ |\n|----------|-------------------|---------------------|\n| Ð‘ÐµÐ· Ñ‚Ñ€ÑƒÐ´Ð° Ð½ÐµÐ¼Ð° Ð¿Ð»Ð¾Ð´Ð° | ÐŸÑ€ÑÐ¼Ð¾: Â«Ð‘ÐµÐ· Ñ‚Ñ€ÑƒÐ´Ð° Ð½ÐµÐ¼Ð° Ð¿Ð»Ð¾Ð´Ð° â€” Ñ‚Ñ€ÐµÐ±Ð° Ð¿Ñ€Ð°Ñ†ÑŽÐ²Ð°Ñ‚Ð¸!Â» | ÐžÐ¿Ð¾ÑÐµÑ€ÐµÐ´ÐºÐ¾Ð²Ð°Ð½Ð¾: Â«Ð¯Ðº Ð²Ñ–Ð´Ð¾Ð¼Ð¾, Ñ€ÐµÐ·ÑƒÐ»ÑŒÑ‚Ð°Ñ‚ Ð¿Ð¾Ñ‚Ñ€ÐµÐ±ÑƒÑ” Ð·ÑƒÑÐ¸Ð»ÑŒ...Â» |\n| Ð¥Ñ‚Ð¾ Ð¿Ð¸Ñ‚Ð°Ñ”, Ñ‚Ð¾Ð¹ Ð½Ðµ Ð±Ð»ÑƒÐ´Ð¸Ñ‚ÑŒ | Â«ÐÐµ ÑÐ¾Ñ€Ð¾Ð¼ÑÑ Ð¿Ð¸Ñ‚Ð°Ñ‚Ð¸!Â» | Â«Ð•Ð²Ñ€Ð¸ÑÑ‚Ð¸Ñ‡Ð½Ð¸Ð¹ Ð¼ÐµÑ‚Ð¾Ð´ Ð¿ÐµÑ€ÐµÐ´Ð±Ð°Ñ‡Ð°Ñ” Ð¿Ð¾ÑÑ‚Ñ–Ð¹Ð½Ðµ **ÑƒÐ·Ð°Ð³Ð°Ð»ÑŒÐ½ÐµÐ½Ð½Ñ** Ð¿Ð¸Ñ‚Ð°Ð½ÑŒ...Â» |\n\n> ðŸ”— **Ð—Ð²'ÑÐ·Ð¾Ðº Ð· Ð°Ð½Ð³Ð»Ñ–Ð¹ÑÑŒÐºÐ¾ÑŽ**\n>\n> Ð’ Ð°Ð½Ð³Ð»Ñ–Ð¹ÑÑŒÐºÑ–Ð¹ Ð°ÐºÐ°Ð´ÐµÐ¼Ñ–Ñ‡Ð½Ñ–Ð¹ Ð¿Ñ€Ð¾Ð·Ñ– Ñ‚Ð°ÐºÐ¾Ð¶ ÑƒÐ½Ð¸ÐºÐ°ÑŽÑ‚ÑŒ Ð¿Ñ€ÑÐ¼Ð¸Ñ… Ñ–Ð´Ñ–Ð¾Ð¼. ÐŸÐ¾Ñ€Ñ–Ð²Ð½ÑÐ¹Ñ‚Ðµ: *\"It's a piece of cake\"* (Ñ€Ð¾Ð·Ð¼Ð¾Ð²Ð½Ð°) â†’ *\"The task presents minimal difficulty\"* (Ð°ÐºÐ°Ð´ÐµÐ¼Ñ–Ñ‡Ð½Ð°). Ð¢Ðµ ÑÐ°Ð¼Ðµ Ð¿Ñ€Ð°Ð²Ð¸Ð»Ð¾ Ð´Ñ–Ñ” Ð² ÑƒÐºÑ€Ð°Ñ—Ð½ÑÑŒÐºÑ–Ð¹.\n\n### Ð”Ñ–Ð°Ð»Ð¾Ð³ 4: Ð—Ð°Ñ…Ð¸ÑÑ‚ Ð´Ð¸ÑÐµÑ€Ñ‚Ð°Ñ†Ñ–Ñ— ðŸ—£ï¸\n\n**Ð“Ð¾Ð»Ð¾Ð²Ð° Ñ€Ð°Ð´Ð¸:** Ð¨Ð°Ð½Ð¾Ð²Ð½Ð¸Ð¹ Ð·Ð´Ð¾Ð±ÑƒÐ²Ð°Ñ‡Ñƒ, Ð¿Ñ€Ð¾ÑˆÑƒ Ñ€Ð¾Ð·Ð¿Ð¾Ñ‡Ð°Ñ‚Ð¸.\n\n**Ð—Ð´Ð¾Ð±ÑƒÐ²Ð°Ñ‡:** Ð”ÑÐºÑƒÑŽ. Ð”Ð¸ÑÐµÑ€Ñ‚Ð°Ñ†Ñ–ÑŽ Ð¿Ñ€Ð¸ÑÐ²ÑÑ‡ÐµÐ½Ð¾ **Ð¿Ð¾Ð³Ð»Ð¸Ð±Ð»ÐµÐ½Ð½ÑŽ** Ñ€Ð¾Ð·ÑƒÐ¼Ñ–Ð½Ð½Ñ ÐºÐ¾Ð³Ð½Ñ–Ñ‚Ð¸Ð²Ð½Ð¸Ñ… Ð¿Ñ€Ð¾Ñ†ÐµÑÑ–Ð². **ÐÐ½Ð°Ð»Ñ–Ð·** Ð»Ñ–Ñ‚ÐµÑ€Ð°Ñ‚ÑƒÑ€Ð¸ **Ð±ÑƒÐ»Ð¾ Ð¿Ñ€Ð¾Ð²ÐµÐ´ÐµÐ½Ð¾** Ð½Ð° Ð¼Ð°Ñ‚ÐµÑ€Ñ–Ð°Ð»Ñ– Ð¿Ð¾Ð½Ð°Ð´ Ð´Ð²Ð¾Ñ…ÑÐ¾Ñ‚ Ð´Ð¶ÐµÑ€ÐµÐ».\n\n**ÐžÐ¿Ð¾Ð½ÐµÐ½Ñ‚:** Ð¯ÐºÑƒ Ð¼ÐµÑ‚Ð¾Ð´Ð¾Ð»Ð¾Ð³Ñ–ÑŽ **Ð·Ð°ÑÑ‚Ð¾ÑÐ¾Ð²Ð°Ð½Ð¾**?\n\n**Ð—Ð´Ð¾Ð±ÑƒÐ²Ð°Ñ‡:** **Ð‘ÑƒÐ»Ð¾ Ð²Ð¸ÐºÐ¾Ñ€Ð¸ÑÑ‚Ð°Ð½Ð¾** ÐºÐ¾Ð¼Ð¿Ð»ÐµÐºÑ Ð¼ÐµÑ‚Ð¾Ð´Ñ–Ð²: ÑÐ¿Ð¾ÑÑ‚ÐµÑ€ÐµÐ¶ÐµÐ½Ð½Ñ, ÐµÐºÑÐ¿ÐµÑ€Ð¸Ð¼ÐµÐ½Ñ‚, **Ð¾Ñ†Ñ–Ð½ÑŽÐ²Ð°Ð½Ð½Ñ** Ñ€ÐµÐ·ÑƒÐ»ÑŒÑ‚Ð°Ñ‚Ñ–Ð² Ð·Ð° Ð´Ð¾Ð¿Ð¾Ð¼Ð¾Ð³Ð¾ÑŽ ÑÑ‚Ð°Ñ‚Ð¸ÑÑ‚Ð¸Ñ‡Ð½Ð¸Ñ… Ð¼ÐµÑ‚Ð¾Ð´Ñ–Ð².\n\n**ÐžÐ¿Ð¾Ð½ÐµÐ½Ñ‚:** Ð§Ð¸ Ñ” **Ð¾Ð±Ð¼ÐµÐ¶ÐµÐ½Ð½Ñ** Ð´Ð¾ÑÐ»Ñ–Ð´Ð¶ÐµÐ½Ð½Ñ?\n\n**Ð—Ð´Ð¾Ð±ÑƒÐ²Ð°Ñ‡:** Ð¢Ð°Ðº. **Ð—Ð°ÐºÑ€Ñ–Ð¿Ð»ÐµÐ½Ð½Ñ** Ñ€ÐµÐ·ÑƒÐ»ÑŒÑ‚Ð°Ñ‚Ñ–Ð² Ð¿Ð¾Ñ‚Ñ€ÐµÐ±ÑƒÑ” Ð´Ð¾Ð´Ð°Ñ‚ÐºÐ¾Ð²Ð¸Ñ… Ð´Ð¾ÑÐ»Ñ–Ð´Ð¶ÐµÐ½ÑŒ Ð½Ð° ÑˆÐ¸Ñ€ÑˆÑ–Ð¹ Ð²Ð¸Ð±Ñ–Ñ€Ñ†Ñ–.\n\n### Ð¡Ð¸Ð½Ñ‚ÐµÐ·: Ñ€ÐµÐ³Ñ–ÑÑ‚Ñ€Ð¾Ð²Ð° Ð³Ð½ÑƒÑ‡ÐºÑ–ÑÑ‚ÑŒ\n\n**Ð”Ð¾ÑÐºÐ¾Ð½Ð°Ð»Ñ–ÑÑ‚ÑŒ** Ñ€Ñ–Ð²Ð½Ñ C1 Ð¿Ð¾Ð»ÑÐ³Ð°Ñ” Ñƒ Ð·Ð´Ð°Ñ‚Ð½Ð¾ÑÑ‚Ñ– Ñ‚Ñ€Ð°Ð½ÑÑ„Ð¾Ñ€Ð¼ÑƒÐ²Ð°Ñ‚Ð¸ Ð¾Ð´Ð½Ñƒ Ð´ÑƒÐ¼ÐºÑƒ Ð² Ñ€Ñ–Ð·Ð½Ñ– Ñ€ÐµÐ³Ñ–ÑÑ‚Ñ€Ð¸:\n\n**Ð†Ð´ÐµÑ:** *Ñ€ÐµÐ·ÑƒÐ»ÑŒÑ‚Ð°Ñ‚Ð¸ Ð¾Ð¿ÑƒÐ±Ð»Ñ–ÐºÑƒÐ²Ð°Ð»Ð¸*\n\n| Ð ÐµÐ³Ñ–ÑÑ‚Ñ€ | Ð¢Ñ€Ð°Ð½ÑÑ„Ð¾Ñ€Ð¼Ð°Ñ†Ñ–Ñ |\n|---------|---------------|\n| Ð Ð¾Ð·Ð¼Ð¾Ð²Ð½Ð¸Ð¹ | Ð ÐµÐ·ÑƒÐ»ÑŒÑ‚Ð°Ñ‚Ð¸ Ð²Ð¶Ðµ Ð¾Ð¿ÑƒÐ±Ð»Ñ–ÐºÑƒÐ²Ð°Ð»Ð¸. |\n| ÐŸÑƒÐ±Ð»Ñ–Ñ†Ð¸ÑÑ‚Ð¸Ñ‡Ð½Ð¸Ð¹ | Ð ÐµÐ·ÑƒÐ»ÑŒÑ‚Ð°Ñ‚Ð¸ Ð´Ð¾ÑÐ»Ñ–Ð´Ð¶ÐµÐ½Ð½Ñ Ð±ÑƒÐ»Ð¾ Ð¾Ð¿ÑƒÐ±Ð»Ñ–ÐºÐ¾Ð²Ð°Ð½Ð¾. |\n| ÐÐ°ÑƒÐºÐ¾Ð²Ð¸Ð¹ | ÐÐ° Ð¾ÑÐ½Ð¾Ð²Ñ– Ð¿Ñ€Ð¾Ð²ÐµÐ´ÐµÐ½Ð¾Ð³Ð¾ Ð°Ð½Ð°Ð»Ñ–Ð·Ñƒ Ñ€ÐµÐ·ÑƒÐ»ÑŒÑ‚Ð°Ñ‚Ð¸ Ð±ÑƒÐ»Ð¾ ÑÐ¸ÑÑ‚ÐµÐ¼Ð°Ñ‚Ð¸Ð·Ð¾Ð²Ð°Ð½Ð¾ Ñ‚Ð° Ð¾Ð¿ÑƒÐ±Ð»Ñ–ÐºÐ¾Ð²Ð°Ð½Ð¾. |\n| ÐžÑ„Ñ–Ñ†Ñ–Ð¹Ð½Ð¸Ð¹ | Ð ÐµÐ·ÑƒÐ»ÑŒÑ‚Ð°Ñ‚Ð¸ Ð½Ð°ÑƒÐºÐ¾Ð²Ð¾Ð³Ð¾ Ð´Ð¾ÑÐ»Ñ–Ð´Ð¶ÐµÐ½Ð½Ñ Ð¾Ð¿Ñ€Ð¸Ð»ÑŽÐ´Ð½ÐµÐ½Ð¾ Ð² ÑƒÑÑ‚Ð°Ð½Ð¾Ð²Ð»ÐµÐ½Ð¾Ð¼Ñƒ Ð¿Ð¾Ñ€ÑÐ´ÐºÑƒ. |\n\n> ðŸ“œ **Ð†ÑÑ‚Ð¾Ñ€Ð¸Ñ‡Ð½Ð° Ð¿ÐµÑ€ÑÐ¿ÐµÐºÑ‚Ð¸Ð²Ð°**\n>\n> ÐŸÑ–Ð´ Ñ‡Ð°Ñ Â«Ð Ð¾Ð·ÑÑ‚Ñ€Ñ–Ð»ÑÐ½Ð¾Ð³Ð¾ Ð²Ñ–Ð´Ñ€Ð¾Ð´Ð¶ÐµÐ½Ð½ÑÂ» (1920â€“1930-Ñ‚Ñ– Ñ€Ð¾ÐºÐ¸) ÑƒÐºÑ€Ð°Ñ—Ð½ÑÑŒÐºÑ– Ð½Ð°ÑƒÐºÐ¾Ð²Ñ†Ñ– ÑÑ‚Ð²Ð¾Ñ€Ð¸Ð»Ð¸ Ð¿Ð¾Ñ‚ÑƒÐ¶Ð½Ñƒ Ð°ÐºÐ°Ð´ÐµÐ¼Ñ–Ñ‡Ð½Ñƒ Ñ‚Ñ€Ð°Ð´Ð¸Ñ†Ñ–ÑŽ. Ð†Ð¼ÐµÐ½Ð° ÑÐº ÐÐ³Ð°Ñ‚Ð°Ð½Ð³ÐµÐ» ÐšÑ€Ð¸Ð¼ÑÑŒÐºÐ¸Ð¹, ÐœÐ¸Ñ…Ð°Ð¹Ð»Ð¾ Ð“Ñ€ÑƒÑˆÐµÐ²ÑÑŒÐºÐ¸Ð¹, ÐœÐ¸ÐºÐ¾Ð»Ð° Ð—ÐµÑ€Ð¾Ð² â€” Ñ†Ðµ Ð½Ðµ Ð»Ð¸ÑˆÐµ Ñ–ÑÑ‚Ð¾Ñ€Ñ–Ñ, Ð° Ð¹ Ð·Ñ€Ð°Ð·ÐºÐ¸ **Ð¼Ð°Ð¹ÑÑ‚ÐµÑ€Ð½Ð¾ÑÑ‚Ñ–** Ð½Ð°ÑƒÐºÐ¾Ð²Ð¾Ð³Ð¾ ÑÑ‚Ð¸Ð»ÑŽ, ÑÐºÑ– Ð¼Ð¸ Ð¿Ñ€Ð¾Ð´Ð¾Ð²Ð¶ÑƒÑ”Ð¼Ð¾ Ð²Ð¸Ð²Ñ‡Ð°Ñ‚Ð¸ ÑÑŒÐ¾Ð³Ð¾Ð´Ð½Ñ–.\n\n### Ð”Ñ–Ð°Ð»Ð¾Ð³ 5: ÐœÑ–Ð¶Ð½Ð°Ñ€Ð¾Ð´Ð½Ð° ÐºÐ¾Ð½Ñ„ÐµÑ€ÐµÐ½Ñ†Ñ–Ñ ðŸ—£ï¸\n\n**ÐœÐ¾Ð´ÐµÑ€Ð°Ñ‚Ð¾Ñ€:** Ð”ÑÐºÑƒÑŽ Ð·Ð° Ð´Ð¾Ð¿Ð¾Ð²Ñ–Ð´ÑŒ. Ð§Ð¸ Ñ” Ð·Ð°Ð¿Ð¸Ñ‚Ð°Ð½Ð½Ñ Ð· Ð°ÑƒÐ´Ð¸Ñ‚Ð¾Ñ€Ñ–Ñ—?\n\n**Ð£Ñ‡Ð°ÑÐ½Ð¸Ðº 1:** Ð§Ð¸ Ð¿Ñ€Ð¾Ð²Ð¾Ð´Ð¸Ð»Ð°ÑÑ **Ñ–Ð½Ñ‚ÐµÐ³Ñ€Ð°Ñ†Ñ–Ñ** Ð²Ð°ÑˆÐ¸Ñ… Ð´Ð°Ð½Ð¸Ñ… Ð· Ð¿Ð¾Ð¿ÐµÑ€ÐµÐ´Ð½Ñ–Ð¼Ð¸ Ð´Ð¾ÑÐ»Ñ–Ð´Ð¶ÐµÐ½Ð½ÑÐ¼Ð¸?\n\n**Ð”Ð¾Ð¿Ð¾Ð²Ñ–Ð´Ð°Ñ‡:** Ð¢Ð°Ðº. **Ð¡Ð¸Ð½Ñ‚ÐµÐ·** Ñ€ÐµÐ·ÑƒÐ»ÑŒÑ‚Ð°Ñ‚Ñ–Ð² **Ð±ÑƒÐ»Ð¾ Ð·Ð´Ñ–Ð¹ÑÐ½ÐµÐ½Ð¾** Ð½Ð° Ð¾ÑÐ½Ð¾Ð²Ñ– Ð¼ÐµÑ‚Ð°Ð°Ð½Ð°Ð»Ñ–Ð·Ñƒ Ð´Ð²Ð°Ð´Ñ†ÑÑ‚Ð¸ Ð¿ÑƒÐ±Ð»Ñ–ÐºÐ°Ñ†Ñ–Ð¹.\n\n**Ð£Ñ‡Ð°ÑÐ½Ð¸Ðº 2:** Ð ÑÐºÐµ Ð¿Ñ€Ð°ÐºÑ‚Ð¸Ñ‡Ð½Ðµ **Ð·Ð°ÑÑ‚Ð¾ÑÑƒÐ²Ð°Ð½Ð½Ñ** Ð²Ð°ÑˆÐ¸Ñ… Ð²Ð¸ÑÐ½Ð¾Ð²ÐºÑ–Ð²?\n\n**Ð”Ð¾Ð¿Ð¾Ð²Ñ–Ð´Ð°Ñ‡:** ÐÐ°ÑˆÑ– Ñ€ÐµÐºÐ¾Ð¼ÐµÐ½Ð´Ð°Ñ†Ñ–Ñ— Ð²Ð¶Ðµ **Ð²Ð¿Ñ€Ð¾Ð²Ð°Ð´Ð¶ÐµÐ½Ð¾** Ñƒ Ñ‚Ñ€ÑŒÐ¾Ñ… ÑƒÐ½Ñ–Ð²ÐµÑ€ÑÐ¸Ñ‚ÐµÑ‚Ð°Ñ…. **ÐžÐ¿Ð°Ð½ÑƒÐ²Ð°Ð½Ð½Ñ** Ð½Ð¾Ð²Ð¾Ñ— Ð¼ÐµÑ‚Ð¾Ð´Ð¸ÐºÐ¸ Ñ‚Ñ€Ð¸Ð²Ð°Ñ”.\n\n**ÐœÐ¾Ð´ÐµÑ€Ð°Ñ‚Ð¾Ñ€:** Ð”ÑÐºÑƒÑŽ. **ÐŸÐ¾Ð²Ñ‚Ð¾Ñ€ÐµÐ½Ð½Ñ** Ñ‚Ð° **Ð·Ð°ÐºÑ€Ñ–Ð¿Ð»ÐµÐ½Ð½Ñ** Ð¼Ð°Ñ‚ÐµÑ€Ñ–Ð°Ð»Ñƒ â€” ÐºÐ»ÑŽÑ‡ Ð´Ð¾ **Ð²Ð´Ð¾ÑÐºÐ¾Ð½Ð°Ð»ÐµÐ½Ð½Ñ**.\n\n## Practice: Ð¢Ñ€Ð°Ð½ÑÑ„Ð¾Ñ€Ð¼Ð°Ñ†Ñ–Ð¹Ð½Ñ– Ð²Ð¿Ñ€Ð°Ð²Ð¸\n\nÐŸÐµÑ€ÐµÐ´ Ñ‚Ð¸Ð¼ ÑÐº Ð¿ÐµÑ€ÐµÐ¹Ñ‚Ð¸ Ð´Ð¾ Ð¾ÑÐ½Ð¾Ð²Ð½Ð¸Ñ… Ð²Ð¿Ñ€Ð°Ð², Ð²Ð¸ÐºÐ¾Ð½Ð°Ð¹Ñ‚Ðµ Ñ†Ñ– Ð¿Ñ–Ð´Ð³Ð¾Ñ‚Ð¾Ð²Ñ‡Ñ– Ð·Ð°Ð²Ð´Ð°Ð½Ð½Ñ Ð´Ð»Ñ **Ð·Ð°ÐºÑ€Ñ–Ð¿Ð»ÐµÐ½Ð½Ñ** Ð¼Ð°Ñ‚ÐµÑ€Ñ–Ð°Ð»Ñƒ.\n\n### Ð’Ð¿Ñ€Ð°Ð²Ð° 1: Ð’Ð¸Ð·Ð½Ð°Ñ‡Ñ‚Ðµ Ñ„Ð¾Ñ€Ð¼Ñƒ Ð¿Ð°ÑÐ¸Ð²Ñƒ\n\nÐŸÑ€Ð¾Ñ‡Ð¸Ñ‚Ð°Ð¹Ñ‚Ðµ Ñ€ÐµÑ‡ÐµÐ½Ð½Ñ Ñ‚Ð° Ð²Ð¸Ð·Ð½Ð°Ñ‡Ñ‚Ðµ, ÑÐºÐ° Ñ„Ð¾Ñ€Ð¼Ð° Ð¿Ð°ÑÐ¸Ð²Ð½Ð¾Ð³Ð¾ ÑÑ‚Ð°Ð½Ñƒ Ð²Ð¸ÐºÐ¾Ñ€Ð¸ÑÑ‚Ð°Ð½Ð°:\n\n1. Ð Ð¾Ð±Ð¾Ñ‚Ñƒ **Ð·Ð°Ð²ÐµÑ€ÑˆÐµÐ½Ð¾** Ð²Ñ‡Ð°ÑÐ½Ð¾.\n   > [!answer]\n   > Ð‘ÐµÐ·Ð¾ÑÐ¾Ð±Ð¾Ð²Ð¸Ð¹ Ð¿Ð°ÑÐ¸Ð² (-Ð½Ð¾/-Ñ‚Ð¾)\n\n2. Ð”Ð¾ÑÐ»Ñ–Ð´Ð¶ÐµÐ½Ð½Ñ **Ð¿Ñ€Ð¾Ð²Ð¾Ð´Ð¸Ñ‚ÑŒÑÑ** Ñ‰Ð¾Ñ€Ð¾ÐºÑƒ.\n   > [!answer]\n   > Ð—Ð²Ð¾Ñ€Ð¾Ñ‚Ð½Ð¸Ð¹ Ð¿Ð°ÑÐ¸Ð² (-ÑÑ)\n\n3. Ð¡Ñ‚Ð°Ñ‚Ñ‚Ñ **Ð±ÑƒÐ»Ð° Ð¾Ð¿ÑƒÐ±Ð»Ñ–ÐºÐ¾Ð²Ð°Ð½Ð°** Ð² Ð¼Ð¸Ð½ÑƒÐ»Ð¾Ð¼Ñƒ Ñ€Ð¾Ñ†Ñ–.\n   > [!answer]\n   > Ð”Ñ–Ñ”Ð¿Ñ€Ð¸ÐºÐ¼ÐµÑ‚Ð½Ð¸ÐºÐ¾Ð²Ð¸Ð¹ Ð¿Ð°ÑÐ¸Ð²\n\n4. Ð ÐµÐ·ÑƒÐ»ÑŒÑ‚Ð°Ñ‚Ð¸ **Ð¾Ð³Ð¾Ð»Ð¾ÑˆÑƒÑŽÑ‚ÑŒÑÑ** Ð½Ð° ÐºÐ¾Ð½Ñ„ÐµÑ€ÐµÐ½Ñ†Ñ–Ñ—.\n   > [!answer]\n   > Ð—Ð²Ð¾Ñ€Ð¾Ñ‚Ð½Ð¸Ð¹ Ð¿Ð°ÑÐ¸Ð² (-ÑÑ)\n\n### Ð’Ð¿Ñ€Ð°Ð²Ð° 2: Ð¢Ñ€Ð°Ð½ÑÑ„Ð¾Ñ€Ð¼ÑƒÐ¹Ñ‚Ðµ Ð² Ð¾Ñ„Ñ–Ñ†Ñ–Ð¹Ð½Ð¸Ð¹ ÑÑ‚Ð¸Ð»ÑŒ\n\nÐŸÐµÑ€ÐµÐ¿Ð¸ÑˆÑ–Ñ‚ÑŒ Ñ€ÐµÑ‡ÐµÐ½Ð½Ñ, Ð²Ð¸ÐºÐ¾Ñ€Ð¸ÑÑ‚Ð¾Ð²ÑƒÑŽÑ‡Ð¸ Ñ„Ð¾Ñ€Ð¼Ñƒ Ð½Ð° -Ð½Ð¾/-Ñ‚Ð¾:\n\n1. ÐšÐ¾Ð¼Ñ–ÑÑ–Ñ Ñ€Ð¾Ð·Ð³Ð»ÑÐ½ÑƒÐ»Ð° Ð²ÑÑ– Ð·Ð°ÑÐ²Ð¸.\n   > [!answer]\n   > Ð£ÑÑ– Ð·Ð°ÑÐ²Ð¸ Ñ€Ð¾Ð·Ð³Ð»ÑÐ½ÑƒÑ‚Ð¾ ÐºÐ¾Ð¼Ñ–ÑÑ–Ñ”ÑŽ.\n\n2. Ð ÐµÐ´Ð°ÐºÑ‚Ð¾Ñ€ Ð²Ð¸Ð¿Ñ€Ð°Ð²Ð¸Ð² Ð¿Ð¾Ð¼Ð¸Ð»ÐºÐ¸ Ð² Ñ‚ÐµÐºÑÑ‚Ñ–.\n   > [!answer]\n   > ÐŸÐ¾Ð¼Ð¸Ð»ÐºÐ¸ Ð² Ñ‚ÐµÐºÑÑ‚Ñ– Ð²Ð¸Ð¿Ñ€Ð°Ð²Ð»ÐµÐ½Ð¾ Ñ€ÐµÐ´Ð°ÐºÑ‚Ð¾Ñ€Ð¾Ð¼.\n\n3. Ð£Ñ€ÑÐ´ Ð¿Ñ€Ð¸Ð¹Ð½ÑÐ² Ð½Ð¾Ð²Ñ– Ð·Ð°ÐºÐ¾Ð½Ð¸.\n   > [!answer]\n   > ÐÐ¾Ð²Ñ– Ð·Ð°ÐºÐ¾Ð½Ð¸ Ð¿Ñ€Ð¸Ð¹Ð½ÑÑ‚Ð¾ ÑƒÑ€ÑÐ´Ð¾Ð¼.\n\n4. ÐÐ°ÑƒÐºÐ¾Ð²Ñ†Ñ– Ð¿Ñ€Ð¾Ð²ÐµÐ»Ð¸ ÐµÐºÑÐ¿ÐµÑ€Ð¸Ð¼ÐµÐ½Ñ‚.\n   > [!answer]\n   > Ð•ÐºÑÐ¿ÐµÑ€Ð¸Ð¼ÐµÐ½Ñ‚ Ð¿Ñ€Ð¾Ð²ÐµÐ´ÐµÐ½Ð¾ Ð½Ð°ÑƒÐºÐ¾Ð²Ñ†ÑÐ¼Ð¸.\n\n### Ð’Ð¿Ñ€Ð°Ð²Ð° 3: Ð’Ð¸Ð±ÐµÑ€Ñ–Ñ‚ÑŒ Ð´Ð¾Ñ€ÐµÑ‡Ð½Ð¸Ð¹ Ñ€ÐµÐ³Ñ–ÑÑ‚Ñ€\n\nÐ¯ÐºÐ¸Ð¹ Ð²Ð°Ñ€Ñ–Ð°Ð½Ñ‚ Ð½Ð°Ð¹ÐºÑ€Ð°Ñ‰Ðµ Ð¿Ñ–Ð´Ñ…Ð¾Ð´Ð¸Ñ‚ÑŒ Ð´Ð»Ñ Ð½Ð°ÑƒÐºÐ¾Ð²Ð¾Ñ— ÑÑ‚Ð°Ñ‚Ñ‚Ñ–?\n\n1. Ð°) ÐœÐ¸ Ð´Ð¾ÑÐ»Ñ–Ð´Ð¸Ð»Ð¸ Ð¿Ñ€Ð¾Ð±Ð»ÐµÐ¼Ñƒ.\n   Ð±) ÐŸÑ€Ð¾Ð±Ð»ÐµÐ¼Ñƒ Ð±ÑƒÐ»Ð¾ Ð´Ð¾ÑÐ»Ñ–Ð´Ð¶ÐµÐ½Ð¾.\n   Ð²) ÐŸÑ€Ð¾Ð±Ð»ÐµÐ¼Ð° Ð´Ð¾ÑÐ»Ñ–Ð´Ð¶ÑƒÐ²Ð°Ð»Ð°ÑÑ.\n   > [!answer]\n   > Ð±) ÐŸÑ€Ð¾Ð±Ð»ÐµÐ¼Ñƒ Ð±ÑƒÐ»Ð¾ Ð´Ð¾ÑÐ»Ñ–Ð´Ð¶ÐµÐ½Ð¾ â€” Ð½Ð°Ð¹Ñ„Ð¾Ñ€Ð¼Ð°Ð»ÑŒÐ½Ñ–ÑˆÐ¸Ð¹ Ð²Ð°Ñ€Ñ–Ð°Ð½Ñ‚ Ð´Ð»Ñ Ð½Ð°ÑƒÐºÐ¾Ð²Ð¾Ð³Ð¾ ÑÑ‚Ð¸Ð»ÑŽ.\n\n2. Ð°) Ð”Ð°Ð½Ñ– Ð¾Ð±Ñ€Ð¾Ð±Ð¸Ð»Ð¸.\n   Ð±) Ð”Ð°Ð½Ñ– Ð±ÑƒÐ»Ð¾ Ð¾Ð±Ñ€Ð¾Ð±Ð»ÐµÐ½Ð¾.\n   Ð²) Ð”Ð°Ð½Ñ– Ð¾Ð±Ñ€Ð¾Ð±Ð»ÑÑŽÑ‚ÑŒÑÑ.\n   > [!answer]\n   > Ð±) Ð”Ð°Ð½Ñ– Ð±ÑƒÐ»Ð¾ Ð¾Ð±Ñ€Ð¾Ð±Ð»ÐµÐ½Ð¾ â€” Ð·Ð°Ð²ÐµÑ€ÑˆÐµÐ½Ð° Ð´Ñ–Ñ Ð² Ð¾Ñ„Ñ–Ñ†Ñ–Ð¹Ð½Ð¾Ð¼Ñƒ ÑÑ‚Ð¸Ð»Ñ–.\n\n### Ð’Ð¿Ñ€Ð°Ð²Ð° 4: Ð—Ð½Ð°Ð¹Ð´Ñ–Ñ‚ÑŒ Ð½ÐµÐ²Ñ–Ð´Ð¿Ð¾Ð²Ñ–Ð´Ð½Ñ–ÑÑ‚ÑŒ Ñ€ÐµÐ³Ñ–ÑÑ‚Ñ€Ñƒ\n\nÐ£ ÐºÐ¾Ð¶Ð½Ð¾Ð¼Ñƒ Ñ€ÐµÑ‡ÐµÐ½Ð½Ñ– Ð·Ð½Ð°Ð¹Ð´Ñ–Ñ‚ÑŒ ÑÐ»Ð¾Ð²Ð¾ Ñ‡Ð¸ ÐºÐ¾Ð½ÑÑ‚Ñ€ÑƒÐºÑ†Ñ–ÑŽ, Ñ‰Ð¾ Ð½Ðµ Ð²Ñ–Ð´Ð¿Ð¾Ð²Ñ–Ð´Ð°Ñ” Ð½Ð°ÑƒÐºÐ¾Ð²Ð¾Ð¼Ñƒ ÑÑ‚Ð¸Ð»ÑŽ:\n\n1. *Â«Ð£ Ð´Ð¾ÑÐ»Ñ–Ð´Ð¶ÐµÐ½Ð½Ñ– Ð±ÑƒÐ»Ð¾ Ð²ÑÑ‚Ð°Ð½Ð¾Ð²Ð»ÐµÐ½Ð¾, Ñ‰Ð¾ Ñ€ÐµÐ·ÑƒÐ»ÑŒÑ‚Ð°Ñ‚Ð¸ ÐºÐ»Ð°ÑÐ½Ñ–.Â»*\n   > [!answer]\n   > Â«ÐºÐ»Ð°ÑÐ½Ñ–Â» â€” Ñ€Ð¾Ð·Ð¼Ð¾Ð²Ð½Ðµ ÑÐ»Ð¾Ð²Ð¾. ÐšÑ€Ð°Ñ‰Ðµ: Â«Ñ€ÐµÐ·ÑƒÐ»ÑŒÑ‚Ð°Ñ‚Ð¸ Ñ” Ð·Ð½Ð°Ñ‡ÑƒÑ‰Ð¸Ð¼Ð¸Â» Ð°Ð±Ð¾ Â«Ñ€ÐµÐ·ÑƒÐ»ÑŒÑ‚Ð°Ñ‚Ð¸ ÑÐ²Ñ–Ð´Ñ‡Ð°Ñ‚ÑŒ Ð¿Ñ€Ð¾...Â».\n\n2. *Â«ÐœÐµÑ‚Ð¾Ð´ Ð·Ð°ÑÑ‚Ð¾ÑÐ¾Ð²Ð°Ð½Ð¾ Ð´Ð»Ñ Ð°Ð½Ð°Ð»Ñ–Ð·Ñƒ, Ñ– Ð²Ñ–Ð½ Ñ€ÐµÐ°Ð»ÑŒÐ½Ð¾ Ð´Ð¾Ð¿Ð¾Ð¼Ñ–Ð³.Â»*\n   > [!answer]\n   > Â«Ñ€ÐµÐ°Ð»ÑŒÐ½Ð¾ Ð´Ð¾Ð¿Ð¾Ð¼Ñ–Ð³Â» â€” Ñ€Ð¾Ð·Ð¼Ð¾Ð²Ð½Ð° ÐºÐ¾Ð½ÑÑ‚Ñ€ÑƒÐºÑ†Ñ–Ñ. ÐšÑ€Ð°Ñ‰Ðµ: Â«Ð²Ð¸ÑÐ²Ð¸Ð²ÑÑ ÐµÑ„ÐµÐºÑ‚Ð¸Ð²Ð½Ð¸Ð¼Â».\n\n### Ð§ÐµÐº-Ð»Ð¸ÑÑ‚ ÑÐ°Ð¼Ð¾Ð¾Ñ†Ñ–Ð½ÑŽÐ²Ð°Ð½Ð½Ñ\n\nÐžÑ†Ñ–Ð½Ñ–Ñ‚ÑŒ ÑÐ²Ñ–Ð¹ Ñ€Ñ–Ð²ÐµÐ½ÑŒ Ð³Ð¾Ñ‚Ð¾Ð²Ð½Ð¾ÑÑ‚Ñ– Ð´Ð¾ C1:\n\n- [ ] Ð¯ Ð¼Ð¾Ð¶Ñƒ Ð²Ð¸Ð·Ð½Ð°Ñ‡Ð¸Ñ‚Ð¸ Ñ‡Ð¾Ñ‚Ð¸Ñ€Ð¸ Ñ„Ð¾Ñ€Ð¼Ð¸ Ð¿Ð°ÑÐ¸Ð²Ð½Ð¾Ð³Ð¾ ÑÑ‚Ð°Ð½Ñƒ\n- [ ] Ð¯ Ñ€Ð¾Ð·ÑƒÐ¼Ñ–ÑŽ Ñ€Ñ–Ð·Ð½Ð¸Ñ†ÑŽ Ð¼Ñ–Ð¶ -Ð½Ð¾/-Ñ‚Ð¾ Ñ‚Ð° -Ð½Ð¸Ð¹/-Ñ‚Ð¸Ð¹\n- [ ] Ð¯ Ð²Ð¼Ñ–ÑŽ Ñ‚Ñ€Ð°Ð½ÑÑ„Ð¾Ñ€Ð¼ÑƒÐ²Ð°Ñ‚Ð¸ Ð°ÐºÑ‚Ð¸Ð²Ð½Ñ– Ñ€ÐµÑ‡ÐµÐ½Ð½Ñ Ð² Ð¿Ð°ÑÐ¸Ð²Ð½Ñ–\n- [ ] Ð¯ Ð²Ñ–Ð´Ñ‡ÑƒÐ²Ð°ÑŽ Ñ€ÐµÐ³Ñ–ÑÑ‚Ñ€Ð¾Ð²Ñ– Ð½ÐµÐ²Ñ–Ð´Ð¿Ð¾Ð²Ñ–Ð´Ð½Ð¾ÑÑ‚Ñ–\n- [ ] Ð¯ Ð¼Ð¾Ð¶Ñƒ Ð²Ð¸ÐºÐ¾Ñ€Ð¸ÑÑ‚Ð¾Ð²ÑƒÐ²Ð°Ñ‚Ð¸ Ð¿Ð°ÑÐ¸Ð² Ñƒ Ð½Ð°ÑƒÐºÐ¾Ð²Ð¾Ð¼Ñƒ ÑÑ‚Ð¸Ð»Ñ–\n\n> âš¡ **Ð©Ð¾ Ð´Ð°Ð»Ñ–?**\n>\n> Ð¯ÐºÑ‰Ð¾ Ð²Ð¸ Ð²Ð¿ÐµÐ²Ð½ÐµÐ½Ð¾ Ð²Ñ–Ð´Ð¿Ð¾Ð²Ñ–Ð»Ð¸ Â«Ñ‚Ð°ÐºÂ» Ð½Ð° Ð²ÑÑ– Ð¿ÑƒÐ½ÐºÑ‚Ð¸ â€” Ð²Ð¸ Ð³Ð¾Ñ‚Ð¾Ð²Ñ– Ð´Ð¾ Ð½Ð°ÑÑ‚ÑƒÐ¿Ð½Ð¸Ñ… Ð¼Ð¾Ð´ÑƒÐ»Ñ–Ð² C1, Ð´Ðµ Ð¼Ð¸ Ð·Ð¾ÑÐµÑ€ÐµÐ´Ð¸Ð¼Ð¾ÑÑ Ð½Ð° **Ð°ÐºÐ°Ð´ÐµÐ¼Ñ–Ñ‡Ð½Ð¾Ð¼Ñƒ** Ð¿Ð¸ÑÑŒÐ¼Ñ–. Ð¯ÐºÑ‰Ð¾ Ð½Ñ– â€” Ð¿Ð¾Ð²ÐµÑ€Ð½Ñ–Ñ‚ÑŒÑÑ Ð´Ð¾ **Ð°Ð½Ð°Ð»Ñ–Ð·Ñƒ** Ñ‚Ð° Ð¾Ð¿Ñ€Ð°Ñ†ÑŽÐ¹Ñ‚Ðµ Ð¼Ð°Ñ‚ÐµÑ€Ñ–Ð°Ð» Ñ‰Ðµ Ñ€Ð°Ð·. **ÐŸÐ¾Ð²Ñ‚Ð¾Ñ€ÐµÐ½Ð½Ñ** â€” Ð¼Ð°Ñ‚Ð¸ **Ð¾Ð¿Ð°Ð½ÑƒÐ²Ð°Ð½Ð½Ñ**!\n\n---"
      },
      {
        "id": "section-2",
        "name": "Summary",
        "nameEn": null,
        "type": "summary",
        "content": "Ð£ Ñ†ÑŒÐ¾Ð¼Ñƒ Ð¼Ð¾Ð´ÑƒÐ»Ñ– Ð¼Ð¸ Ð·Ð´Ñ–Ð¹ÑÐ½Ð¸Ð»Ð¸ **Ð¿Ð¾Ð²Ñ‚Ð¾Ñ€ÐµÐ½Ð½Ñ** Ñ‚Ð° **ÑÐ¸ÑÑ‚ÐµÐ¼Ð°Ñ‚Ð¸Ð·Ð°Ñ†Ñ–ÑŽ** ÐºÐ»ÑŽÑ‡Ð¾Ð²Ð¸Ñ… Ð½Ð°Ð²Ð¸Ñ‡Ð¾Ðº Ñ€Ñ–Ð²Ð½Ñ B2, Ð³Ð¾Ñ‚ÑƒÑŽÑ‡Ð¸ Ð²Ð°Ñ Ð´Ð¾ **Ð¿ÐµÑ€ÐµÑ…Ð¾Ð´Ñƒ** Ð½Ð° **Ð¿Ñ€Ð¾ÑÑƒÐ½ÑƒÑ‚Ð¸Ð¹** Ñ€Ñ–Ð²ÐµÐ½ÑŒ C1.\n\n**Ð“Ñ€Ð°Ð¼Ð°Ñ‚Ð¸ÐºÐ°:**\n1. Ð§Ð¾Ñ‚Ð¸Ñ€Ð¸ Ñ„Ð¾Ñ€Ð¼Ð¸ Ð¿Ð°ÑÐ¸Ð²Ð½Ð¾Ð³Ð¾ ÑÑ‚Ð°Ð½Ñƒ: Ð´Ñ–Ñ”Ð¿Ñ€Ð¸ÐºÐ¼ÐµÑ‚Ð½Ð¸ÐºÐ¾Ð²Ð¸Ð¹ (-Ð½Ð¸Ð¹/-Ñ‚Ð¸Ð¹), Ð±ÐµÐ·Ð¾ÑÐ¾Ð±Ð¾Ð²Ð¸Ð¹ (-Ð½Ð¾/-Ñ‚Ð¾), Ð·Ð²Ð¾Ñ€Ð¾Ñ‚Ð½Ð¸Ð¹ (-ÑÑ), Ð°Ñ€Ñ…Ð°Ñ—Ñ‡Ð½Ð¸Ð¹ (Ð´Ñ–Ñ”Ð¿Ñ€Ð¸ÑÐ»Ñ–Ð²Ð½Ð¸ÐºÐ¾Ð²Ð¸Ð¹).\n2. Ð¤Ð¾Ñ€Ð¼Ð° Ð½Ð° -Ð½Ð¾/-Ñ‚Ð¾ â€” Ð½Ð°Ð¹Ñ„Ð¾Ñ€Ð¼Ð°Ð»ÑŒÐ½Ñ–ÑˆÐ°, Ð¾Ð±Ð¾Ð²'ÑÐ·ÐºÐ¾Ð²Ð° Ð² **Ð¾Ñ„Ñ–Ñ†Ñ–Ð¹Ð½Ð¾-Ð´Ñ–Ð»Ð¾Ð²Ð¾Ð¼Ñƒ** Ñ‚Ð° **Ð½Ð°ÑƒÐºÐ¾Ð²Ð¾Ð¼Ñƒ** ÑÑ‚Ð¸Ð»ÑÑ….\n3. **ÐšÐ¾Ð½ÑÐ¾Ð»Ñ–Ð´Ð°Ñ†Ñ–Ñ** Ð·Ð½Ð°Ð½ÑŒ Ð¿Ñ€Ð¾ Ñ€ÐµÐ³Ñ–ÑÑ‚Ñ€Ð¾Ð²Ñƒ Ð´Ð¾Ñ€ÐµÑ‡Ð½Ñ–ÑÑ‚ÑŒ Ð¿Ð°ÑÐ¸Ð²Ð½Ð¸Ñ… ÐºÐ¾Ð½ÑÑ‚Ñ€ÑƒÐºÑ†Ñ–Ð¹.\n\n**Ð¡Ñ‚Ð¸Ð»Ñ–ÑÑ‚Ð¸ÐºÐ°:**\n4. ÐŸ'ÑÑ‚ÑŒ Ñ„ÑƒÐ½ÐºÑ†Ñ–Ð¾Ð½Ð°Ð»ÑŒÐ½Ð¸Ñ… ÑÑ‚Ð¸Ð»Ñ–Ð² ÑƒÐºÑ€Ð°Ñ—Ð½ÑÑŒÐºÐ¾Ñ— Ð¼Ð¾Ð²Ð¸ Ñ‚Ð° Ñ—Ñ…Ð½Ñ– Ð¾ÑÐ¾Ð±Ð»Ð¸Ð²Ð¾ÑÑ‚Ñ–.\n5. **Ð†Ð½Ñ‚ÐµÐ³Ñ€Ð°Ñ†Ñ–Ñ** Ð¿Ð°ÑÐ¸Ð²Ð½Ð¾Ð³Ð¾ ÑÑ‚Ð°Ð½Ñƒ Ð² Ñ€Ñ–Ð·Ð½Ñ– Ñ€ÐµÐ³Ñ–ÑÑ‚Ñ€Ð¸ Ð·Ð°Ð»ÐµÐ¶Ð½Ð¾ Ð²Ñ–Ð´ ÐºÐ¾Ð¼ÑƒÐ½Ñ–ÐºÐ°Ñ‚Ð¸Ð²Ð½Ð¾Ñ— Ð¼ÐµÑ‚Ð¸.\n6. **Ð¡Ð¸Ð½Ñ‚ÐµÐ·** Ñ„Ð¾Ñ€Ð¼Ð°Ð»ÑŒÐ½Ð¸Ñ… Ñ‚Ð° Ð½ÐµÑ„Ð¾Ñ€Ð¼Ð°Ð»ÑŒÐ½Ð¸Ñ… ÐµÐ»ÐµÐ¼ÐµÐ½Ñ‚Ñ–Ð² Ñƒ Ð¿ÑƒÐ±Ð»Ñ–Ñ†Ð¸ÑÑ‚Ð¸Ñ†Ñ–.\n\n**ÐŸÑ€Ð°ÐºÑ‚Ð¸Ñ‡Ð½Ñ– Ð½Ð°Ð²Ð¸Ñ‡ÐºÐ¸:**\n7. **Ð—Ð°ÑÑ‚Ð¾ÑÑƒÐ²Ð°Ð½Ð½Ñ** Ñ‚Ñ€Ð°Ð½ÑÑ„Ð¾Ñ€Ð¼Ð°Ñ†Ñ–Ð¹Ð½Ð¸Ñ… Ð½Ð°Ð²Ð¸Ñ‡Ð¾Ðº: Ð°ÐºÑ‚Ð¸Ð²Ð½Ð¸Ð¹ â†’ Ð¿Ð°ÑÐ¸Ð²Ð½Ð¸Ð¹ ÑÑ‚Ð°Ð½.\n8. **ÐžÑ†Ñ–Ð½ÑŽÐ²Ð°Ð½Ð½Ñ** Ñ€ÐµÐ³Ñ–ÑÑ‚Ñ€Ð¾Ð²Ð¾Ñ— Ð´Ð¾Ñ€ÐµÑ‡Ð½Ð¾ÑÑ‚Ñ– Ð¼Ð¾Ð²Ð½Ð¸Ñ… Ð·Ð°ÑÐ¾Ð±Ñ–Ð².\n9. **ÐÐ½Ð°Ð»Ñ–Ð·** Ñ€ÐµÐ³Ñ–ÑÑ‚Ñ€Ð¾Ð²Ð¸Ñ… Ð½ÐµÐ²Ñ–Ð´Ð¿Ð¾Ð²Ñ–Ð´Ð½Ð¾ÑÑ‚ÐµÐ¹ Ñƒ Ñ‚ÐµÐºÑÑ‚Ð°Ñ….\n\n> [!tip] ðŸŒŸ **ÐšÐ»ÑŽÑ‡ Ð´Ð¾ Ð¼Ð°Ð¹ÑÑ‚ÐµÑ€Ð½Ð¾ÑÑ‚Ñ–**\n>\n> **Ð”Ð¾ÑÐºÐ¾Ð½Ð°Ð»Ñ–ÑÑ‚ÑŒ** Ñ€Ñ–Ð²Ð½Ñ C1 â€” Ñ†Ðµ Ð½Ðµ Ð»Ð¸ÑˆÐµ Ð·Ð½Ð°Ð½Ð½Ñ Ð¿Ñ€Ð°Ð²Ð¸Ð», Ð° Ð¹ Ð¼Ð¾Ð²Ð½Ð° Ñ–Ð½Ñ‚ÑƒÑ—Ñ†Ñ–Ñ. **ÐŸÐ¾Ð³Ð»Ð¸Ð±Ð»ÐµÐ½Ð½Ñ** Ñ†Ñ–Ñ”Ñ— Ñ–Ð½Ñ‚ÑƒÑ—Ñ†Ñ–Ñ— Ð²Ñ–Ð´Ð±ÑƒÐ²Ð°Ñ”Ñ‚ÑŒÑÑ Ñ‡ÐµÑ€ÐµÐ· Ð¿Ð¾ÑÑ‚Ñ–Ð¹Ð½Ñƒ Ð¿Ñ€Ð°ÐºÑ‚Ð¸ÐºÑƒ: Ñ‡Ð¸Ñ‚Ð°Ð¹Ñ‚Ðµ **Ð°ÐºÐ°Ð´ÐµÐ¼Ñ–Ñ‡Ð½Ñ–** Ñ‚ÐµÐºÑÑ‚Ð¸, ÑÐ»ÑƒÑ…Ð°Ð¹Ñ‚Ðµ Ð½Ð°ÑƒÐºÐ¾Ð²Ñ– Ð´Ð¾Ð¿Ð¾Ð²Ñ–Ð´Ñ–, Ð°Ð½Ð°Ð»Ñ–Ð·ÑƒÐ¹Ñ‚Ðµ **Ñ„Ð°Ñ…Ð¾Ð²Ñƒ** Ð»Ñ–Ñ‚ÐµÑ€Ð°Ñ‚ÑƒÑ€Ñƒ. **ÐžÐ¿Ð°Ð½ÑƒÐ²Ð°Ð½Ð½Ñ** Ð½Ð¾Ð²Ð¾Ð³Ð¾ Ñ€Ñ–Ð²Ð½Ñ â€” Ñ†Ðµ **Ð²Ð´Ð¾ÑÐºÐ¾Ð½Ð°Ð»ÐµÐ½Ð½Ñ**, Ñ‰Ð¾ Ð½Ñ–ÐºÐ¾Ð»Ð¸ Ð½Ðµ Ð·Ð°ÐºÑ–Ð½Ñ‡ÑƒÑ”Ñ‚ÑŒÑÑ.\n\n---"
      },
      {
        "id": "section-3",
        "name": "Activities",
        "nameEn": null,
        "type": "activities",
        "content": "## quiz: Ð¤Ð¾Ñ€Ð¼Ð¸ Ð¿Ð°ÑÐ¸Ð²Ð½Ð¾Ð³Ð¾ ÑÑ‚Ð°Ð½Ñƒ\n\n> Ð’Ð¸Ð±ÐµÑ€Ñ–Ñ‚ÑŒ Ð¿Ñ€Ð°Ð²Ð¸Ð»ÑŒÐ½Ñƒ Ð²Ñ–Ð´Ð¿Ð¾Ð²Ñ–Ð´ÑŒ.\n\n1. Ð¯ÐºÐ° Ñ„Ð¾Ñ€Ð¼Ð° Ð¿Ð°ÑÐ¸Ð²Ð½Ð¾Ð³Ð¾ ÑÑ‚Ð°Ð½Ñƒ Ñ” Ð½Ð°Ð¹Ñ„Ð¾Ñ€Ð¼Ð°Ð»ÑŒÐ½Ñ–ÑˆÐ¾ÑŽ Ð² ÑƒÐºÑ€Ð°Ñ—Ð½ÑÑŒÐºÑ–Ð¹ Ð¼Ð¾Ð²Ñ–?\n   - [ ] Ð”Ñ–Ñ”Ð¿Ñ€Ð¸ÐºÐ¼ÐµÑ‚Ð½Ð¸ÐºÐ¾Ð²Ð¸Ð¹ Ð¿Ð°ÑÐ¸Ð² (-Ð½Ð¸Ð¹/-Ñ‚Ð¸Ð¹)\n   - [x] Ð‘ÐµÐ·Ð¾ÑÐ¾Ð±Ð¾Ð²Ð¸Ð¹ Ð¿Ð°ÑÐ¸Ð² (-Ð½Ð¾/-Ñ‚Ð¾)\n   - [ ] Ð—Ð²Ð¾Ñ€Ð¾Ñ‚Ð½Ð¸Ð¹ Ð¿Ð°ÑÐ¸Ð² (-ÑÑ)\n   - [ ] ÐÐºÑ‚Ð¸Ð²Ð½Ð¸Ð¹ ÑÑ‚Ð°Ð½ Ð· Ð½ÐµÐ²Ð¸Ð·Ð½Ð°Ñ‡ÐµÐ½Ð¸Ð¼ ÑÑƒÐ±'Ñ”ÐºÑ‚Ð¾Ð¼\n   > Ð¤Ð¾Ñ€Ð¼Ð° Ð½Ð° -Ð½Ð¾/-Ñ‚Ð¾ Ð¾Ð±Ð¾Ð²'ÑÐ·ÐºÐ¾Ð²Ð° Ð² Ð¾Ñ„Ñ–Ñ†Ñ–Ð¹Ð½Ð¸Ñ… Ð´Ð¾ÐºÑƒÐ¼ÐµÐ½Ñ‚Ð°Ñ… Ñ‚Ð° Ð½Ð°ÑƒÐºÐ¾Ð²Ð¸Ñ… Ñ‚ÐµÐºÑÑ‚Ð°Ñ….\n\n2. Ð£ ÑÐºÐ¾Ð¼Ñƒ Ñ€ÐµÑ‡ÐµÐ½Ð½Ñ– Ð²Ð¸ÐºÐ¾Ñ€Ð¸ÑÑ‚Ð°Ð½Ð¾ Ð·Ð²Ð¾Ñ€Ð¾Ñ‚Ð½Ð¸Ð¹ Ð¿Ð°ÑÐ¸Ð²?\n   - [ ] Ð”Ð¾ÐºÑƒÐ¼ÐµÐ½Ñ‚ Ð±ÑƒÐ»Ð¾ Ð¿Ñ–Ð´Ð¿Ð¸ÑÐ°Ð½Ð¾ Ð´Ð¸Ñ€ÐµÐºÑ‚Ð¾Ñ€Ð¾Ð¼.\n   - [ ] Ð¡Ñ‚Ð°Ñ‚Ñ‚Ñ Ð±ÑƒÐ»Ð° Ð¾Ð¿ÑƒÐ±Ð»Ñ–ÐºÐ¾Ð²Ð°Ð½Ð° Ð²Ñ‡Ð¾Ñ€Ð°.\n   - [x] ÐŸÑ€Ð¾Ð±Ð»ÐµÐ¼Ð° Ñ€Ð¾Ð·Ð²'ÑÐ·ÑƒÑ”Ñ‚ÑŒÑÑ Ð½Ð°ÑˆÐ¾ÑŽ ÐºÐ¾Ð¼Ð°Ð½Ð´Ð¾ÑŽ.\n   - [ ] Ð ÐµÐ·ÑƒÐ»ÑŒÑ‚Ð°Ñ‚Ð¸ Ð¾Ð³Ð¾Ð»Ð¾ÑˆÐµÐ½Ð¾ Ð½Ð° ÐºÐ¾Ð½Ñ„ÐµÑ€ÐµÐ½Ñ†Ñ–Ñ—.\n   > Ð—Ð²Ð¾Ñ€Ð¾Ñ‚Ð½Ð¸Ð¹ Ð¿Ð°ÑÐ¸Ð² ÑƒÑ‚Ð²Ð¾Ñ€ÑŽÑ”Ñ‚ÑŒÑÑ Ð·Ð° Ð´Ð¾Ð¿Ð¾Ð¼Ð¾Ð³Ð¾ÑŽ Ð¿Ð¾ÑÑ‚Ñ„Ñ–ÐºÑÐ° -ÑÑ.\n\n3. Ð¯ÐºÐ¸Ð¹ ÑÑ‚Ð¸Ð»ÑŒ Ð½Ð°Ð¹Ñ‡Ð°ÑÑ‚Ñ–ÑˆÐµ Ð²Ð¸ÐºÐ¾Ñ€Ð¸ÑÑ‚Ð¾Ð²ÑƒÑ” Ð¿Ð°ÑÐ¸Ð²Ð½Ð¸Ð¹ ÑÑ‚Ð°Ð½?\n   - [ ] Ð Ð¾Ð·Ð¼Ð¾Ð²Ð½Ð¸Ð¹\n   - [ ] Ð¥ÑƒÐ´Ð¾Ð¶Ð½Ñ–Ð¹\n   - [x] ÐÐ°ÑƒÐºÐ¾Ð²Ð¸Ð¹\n   - [ ] Ð•Ð¿Ñ–ÑÑ‚Ð¾Ð»ÑÑ€Ð½Ð¸Ð¹\n   > ÐÐ°ÑƒÐºÐ¾Ð²Ð¸Ð¹ ÑÑ‚Ð¸Ð»ÑŒ Ð²Ð¸Ð¼Ð°Ð³Ð°Ñ” Ð¾Ð±'Ñ”ÐºÑ‚Ð¸Ð²Ð½Ð¾ÑÑ‚Ñ–, ÑÐºÑƒ Ð·Ð°Ð±ÐµÐ·Ð¿ÐµÑ‡ÑƒÑ” Ð¿Ð°ÑÐ¸Ð².\n\n4. Ð¯ÐºÐµ Ñ€ÐµÑ‡ÐµÐ½Ð½Ñ ÐÐ• Ñ” Ð¿Ñ€Ð¸ÐºÐ»Ð°Ð´Ð¾Ð¼ Ð¿Ð°ÑÐ¸Ð²Ð½Ð¾Ð³Ð¾ ÑÑ‚Ð°Ð½Ñƒ?\n   - [ ] Ð—Ð°ÐºÐ¾Ð½ ÑƒÑ…Ð²Ð°Ð»ÐµÐ½Ð¾ Ð¿Ð°Ñ€Ð»Ð°Ð¼ÐµÐ½Ñ‚Ð¾Ð¼.\n   - [x] ÐÐ°ÑƒÐºÐ¾Ð²Ñ†Ñ– Ð¿Ñ€Ð¾Ð²ÐµÐ»Ð¸ Ð´Ð¾ÑÐ»Ñ–Ð´Ð¶ÐµÐ½Ð½Ñ.\n   - [ ] Ð ÐµÐ·ÑƒÐ»ÑŒÑ‚Ð°Ñ‚Ð¸ Ð¾Ð¿Ñ€Ð¸Ð»ÑŽÐ´Ð½ÑŽÑŽÑ‚ÑŒÑÑ Ñ‰Ð¾Ð¼Ñ–ÑÑÑ†Ñ.\n   - [ ] Ð—Ð²Ñ–Ñ‚ Ð±ÑƒÐ² Ð¿Ð¾Ð´Ð°Ð½Ð¸Ð¹ Ð²Ñ‡Ð°ÑÐ½Ð¾.\n   > Ð¦Ðµ Ð°ÐºÑ‚Ð¸Ð²Ð½Ð¸Ð¹ ÑÑ‚Ð°Ð½: Ð¿Ñ–Ð´Ð¼ÐµÑ‚ (Ð½Ð°ÑƒÐºÐ¾Ð²Ñ†Ñ–) Ð²Ð¸ÐºÐ¾Ð½ÑƒÑ” Ð´Ñ–ÑŽ.\n\n5. ÐšÐ¾Ð»Ð¸ Ð²Ð¸ÐºÐ¾Ñ€Ð¸ÑÑ‚Ð¾Ð²ÑƒÑ”Ñ‚ÑŒÑÑ Ñ„Ð¾Ñ€Ð¼Ð° Â«Ð±ÑƒÐ»Ð¾Â» Ð· -Ð½Ð¾/-Ñ‚Ð¾?\n   - [ ] Ð”Ð»Ñ Ð¿Ñ–Ð´ÑÐ¸Ð»ÐµÐ½Ð½Ñ Ð¾Ñ„Ñ–Ñ†Ñ–Ð¹Ð½Ð¾ÑÑ‚Ñ–\n   - [ ] Ð”Ð»Ñ Ð²Ð¸Ñ€Ð°Ð¶ÐµÐ½Ð½Ñ Ñ‚ÐµÐ¿ÐµÑ€Ñ–ÑˆÐ½ÑŒÐ¾Ð³Ð¾ Ñ‡Ð°ÑÑƒ\n   - [x] Ð”Ð»Ñ Ð²Ð¸Ñ€Ð°Ð¶ÐµÐ½Ð½Ñ Ð¼Ð¸Ð½ÑƒÐ»Ð¾Ð³Ð¾ Ñ‡Ð°ÑÑƒ\n   - [ ] ÐÑ–ÐºÐ¾Ð»Ð¸ â€” Ñ†Ðµ Ð¿Ð¾Ð¼Ð¸Ð»ÐºÐ°\n   > Â«Ð‘ÑƒÐ»Ð¾ Ð½Ð°Ð¿Ð¸ÑÐ°Ð½Ð¾Â» = Ð¼Ð¸Ð½ÑƒÐ»Ð¸Ð¹ Ñ‡Ð°Ñ, Â«Ð½Ð°Ð¿Ð¸ÑÐ°Ð½Ð¾Â» = Ñ‚ÐµÐ¿ÐµÑ€Ñ–ÑˆÐ½Ñ–Ð¹/Ð·Ð°Ð³Ð°Ð»ÑŒÐ½Ð¸Ð¹.\n\n6. Ð¯ÐºÐ° Ñ„Ð¾Ñ€Ð¼Ð° Ð¿Ð°ÑÐ¸Ð²Ñƒ Ð¿Ñ–Ð´ÐºÑ€ÐµÑÐ»ÑŽÑ” Ð¿Ñ€Ð¾Ñ†ÐµÑ, Ð° Ð½Ðµ Ñ€ÐµÐ·ÑƒÐ»ÑŒÑ‚Ð°Ñ‚?\n   - [ ] Ð‘ÐµÐ·Ð¾ÑÐ¾Ð±Ð¾Ð²Ð¸Ð¹ Ð¿Ð°ÑÐ¸Ð² (-Ð½Ð¾/-Ñ‚Ð¾)\n   - [ ] Ð”Ñ–Ñ”Ð¿Ñ€Ð¸ÐºÐ¼ÐµÑ‚Ð½Ð¸ÐºÐ¾Ð²Ð¸Ð¹ Ð¿Ð°ÑÐ¸Ð² (-Ð½Ð¸Ð¹/-Ñ‚Ð¸Ð¹)\n   - [x] Ð—Ð²Ð¾Ñ€Ð¾Ñ‚Ð½Ð¸Ð¹ Ð¿Ð°ÑÐ¸Ð² (-ÑÑ)\n   - [ ] Ð£ÑÑ– Ñ„Ð¾Ñ€Ð¼Ð¸ Ð¾Ð´Ð½Ð°ÐºÐ¾Ð²Ð¾\n   > Â«Ð‘ÑƒÐ´Ð¸Ð½Ð¾Ðº Ð±ÑƒÐ´ÑƒÑ”Ñ‚ÑŒÑÑÂ» â€” Ð¿Ñ€Ð¾Ñ†ÐµÑ Ñ‚Ñ€Ð¸Ð²Ð°Ñ”; Â«Ð±ÑƒÐ´Ð¸Ð½Ð¾Ðº Ð·Ð±ÑƒÐ´Ð¾Ð²Ð°Ð½Ð¾Â» â€” Ñ€ÐµÐ·ÑƒÐ»ÑŒÑ‚Ð°Ñ‚.\n\n7. Ð¯ÐºÐµ ÑÐ»Ð¾Ð²Ð¾ Ñ” Ð¼Ð°Ñ€ÐºÐµÑ€Ð¾Ð¼ Ð¾Ñ„Ñ–Ñ†Ñ–Ð¹Ð½Ð¾-Ð´Ñ–Ð»Ð¾Ð²Ð¾Ð³Ð¾ ÑÑ‚Ð¸Ð»ÑŽ?\n   - [ ] ÐšÐ»Ð°ÑÐ½Ð¸Ð¹\n   - [x] ÐžÐ¿Ñ€Ð¸Ð»ÑŽÐ´Ð½ÐµÐ½Ð¾\n   - [ ] Ð ÐµÐ°Ð»ÑŒÐ½Ð¾\n   - [ ] ÐŸÑ€Ð¸ÐºÐ¾Ð»ÑŒÐ½Ð¸Ð¹\n   > Â«ÐžÐ¿Ñ€Ð¸Ð»ÑŽÐ´Ð½ÐµÐ½Ð¾Â» â€” Ñ‚Ð¸Ð¿Ð¾Ð²Ð° Ð¾Ñ„Ñ–Ñ†Ñ–Ð¹Ð½Ð° ÐºÐ¾Ð½ÑÑ‚Ñ€ÑƒÐºÑ†Ñ–Ñ.\n\n8. Ð©Ð¾ Ð¾Ð·Ð½Ð°Ñ‡Ð°Ñ” Â«Ñ€ÐµÐ³Ñ–ÑÑ‚Ñ€Ð¾Ð²Ð° Ð½ÐµÐ²Ñ–Ð´Ð¿Ð¾Ð²Ñ–Ð´Ð½Ñ–ÑÑ‚ÑŒÂ»?\n   - [ ] Ð“Ñ€Ð°Ð¼Ð°Ñ‚Ð¸Ñ‡Ð½Ð° Ð¿Ð¾Ð¼Ð¸Ð»ÐºÐ°\n   - [x] Ð—Ð¼Ñ–ÑˆÑƒÐ²Ð°Ð½Ð½Ñ ÑÑ‚Ð¸Ð»Ñ–Ð² Ð² Ð¾Ð´Ð½Ð¾Ð¼Ñƒ Ñ‚ÐµÐºÑÑ‚Ñ–\n   - [ ] ÐžÑ€Ñ„Ð¾Ð³Ñ€Ð°Ñ„Ñ–Ñ‡Ð½Ð° Ð¿Ð¾Ð¼Ð¸Ð»ÐºÐ°\n   - [ ] ÐÐµÐ¿Ñ€Ð°Ð²Ð¸Ð»ÑŒÐ½Ð¸Ð¹ Ð¿Ð¾Ñ€ÑÐ´Ð¾Ðº ÑÐ»Ñ–Ð²\n   > ÐÐ°Ð¿Ñ€Ð¸ÐºÐ»Ð°Ð´, Ñ€Ð¾Ð·Ð¼Ð¾Ð²Ð½Ðµ ÑÐ»Ð¾Ð²Ð¾ Ð² Ð½Ð°ÑƒÐºÐ¾Ð²Ð¾Ð¼Ñƒ Ñ‚ÐµÐºÑÑ‚Ñ–.\n\n9. Ð£ ÑÐºÐ¾Ð¼Ñƒ ÑÑ‚Ð¸Ð»Ñ– Ð¿Ð°ÑÐ¸Ð²Ð½Ð¸Ð¹ ÑÑ‚Ð°Ð½ Ð²Ð¶Ð¸Ð²Ð°Ñ”Ñ‚ÑŒÑÑ Ð½Ð°Ð¹Ñ€Ñ–Ð´ÑˆÐµ?\n   - [ ] ÐÐ°ÑƒÐºÐ¾Ð²Ð¾Ð¼Ñƒ\n   - [ ] ÐžÑ„Ñ–Ñ†Ñ–Ð¹Ð½Ð¾-Ð´Ñ–Ð»Ð¾Ð²Ð¾Ð¼Ñƒ\n   - [ ] ÐŸÑƒÐ±Ð»Ñ–Ñ†Ð¸ÑÑ‚Ð¸Ñ‡Ð½Ð¾Ð¼Ñƒ\n   - [x] Ð Ð¾Ð·Ð¼Ð¾Ð²Ð½Ð¾Ð¼Ñƒ\n   > Ð£ Ñ€Ð¾Ð·Ð¼Ð¾Ð²Ð½Ñ–Ð¹ Ð¼Ð¾Ð²Ñ– Ð¿ÐµÑ€ÐµÐ²Ð°Ð¶Ð°Ñ” Ð°ÐºÑ‚Ð¸Ð²Ð½Ð¸Ð¹ ÑÑ‚Ð°Ð½.\n\n10. Ð¯ÐºÐ° Ñ…Ð°Ñ€Ð°ÐºÑ‚ÐµÑ€Ð¸ÑÑ‚Ð¸ÐºÐ° ÐÐ• Ñ” Ð¾Ð·Ð½Ð°ÐºÐ¾ÑŽ Ð½Ð°ÑƒÐºÐ¾Ð²Ð¾Ð³Ð¾ ÑÑ‚Ð¸Ð»ÑŽ?\n    - [ ] ÐžÐ±'Ñ”ÐºÑ‚Ð¸Ð²Ð½Ñ–ÑÑ‚ÑŒ\n    - [ ] Ð¢ÐµÑ€Ð¼Ñ–Ð½Ð¾Ð»Ð¾Ð³Ñ–Ñ‡Ð½Ñ–ÑÑ‚ÑŒ\n    - [x] Ð•Ð¼Ð¾Ñ†Ñ–Ð¹Ð½Ñ–ÑÑ‚ÑŒ\n    - [ ] Ð¢Ð¾Ñ‡Ð½Ñ–ÑÑ‚ÑŒ\n    > Ð•Ð¼Ð¾Ñ†Ñ–Ð¹Ð½Ñ–ÑÑ‚ÑŒ Ñ…Ð°Ñ€Ð°ÐºÑ‚ÐµÑ€Ð½Ð° Ð´Ð»Ñ Ñ€Ð¾Ð·Ð¼Ð¾Ð²Ð½Ð¾Ð³Ð¾ Ñ‚Ð° Ñ…ÑƒÐ´Ð¾Ð¶Ð½ÑŒÐ¾Ð³Ð¾ ÑÑ‚Ð¸Ð»Ñ–Ð².\n\n11. Ð©Ð¾ Ð¾Ð·Ð½Ð°Ñ‡Ð°Ñ” Â«ÐºÐ¾Ð½ÑÐ¾Ð»Ñ–Ð´Ð°Ñ†Ñ–Ñ Ð·Ð½Ð°Ð½ÑŒÂ»?\n    - [ ] Ð—Ð°Ð±ÑƒÐ²Ð°Ð½Ð½Ñ Ñ–Ð½Ñ„Ð¾Ñ€Ð¼Ð°Ñ†Ñ–Ñ—\n    - [x] ÐžÐ±'Ñ”Ð´Ð½Ð°Ð½Ð½Ñ Ñ‚Ð° Ð·Ð°ÐºÑ€Ñ–Ð¿Ð»ÐµÐ½Ð½Ñ Ð·Ð½Ð°Ð½ÑŒ\n    - [ ] ÐžÑ‚Ñ€Ð¸Ð¼Ð°Ð½Ð½Ñ Ð½Ð¾Ð²Ð¸Ñ… Ð·Ð½Ð°Ð½ÑŒ\n    - [ ] ÐŸÐµÑ€ÐµÐ²Ñ–Ñ€ÐºÐ° Ð·Ð½Ð°Ð½ÑŒ\n    > ÐšÐ¾Ð½ÑÐ¾Ð»Ñ–Ð´Ð°Ñ†Ñ–Ñ â€” Ñ†Ðµ ÑÐ¸ÑÑ‚ÐµÐ¼Ð°Ñ‚Ð¸Ð·Ð°Ñ†Ñ–Ñ Ñ‚Ð° Ð·Ð°ÐºÑ€Ñ–Ð¿Ð»ÐµÐ½Ð½Ñ.\n\n12. Ð¯ÐºÐµ Ð´Ñ–Ñ”ÑÐ»Ð¾Ð²Ð¾ Ð½Ð°Ð¹ÐºÑ€Ð°Ñ‰Ðµ Ð¿Ñ–Ð´Ñ…Ð¾Ð´Ð¸Ñ‚ÑŒ Ð´Ð»Ñ Ð¾Ð¿Ð¸ÑÑƒ Ð¼ÐµÑ‚Ð¾Ð´Ð¾Ð»Ð¾Ð³Ñ–Ñ— Ð² Ð½Ð°ÑƒÐºÐ¾Ð²Ñ–Ð¹ ÑÑ‚Ð°Ñ‚Ñ‚Ñ–?\n    - [ ] Ð—Ñ€Ð¾Ð±Ð¸Ð»Ð¸\n    - [x] Ð—Ð°ÑÑ‚Ð¾ÑÐ¾Ð²Ð°Ð½Ð¾\n    - [ ] Ð’Ð¸ÐºÐ¾Ñ€Ð¸ÑÑ‚Ð°Ð»Ð¸\n    - [ ] Ð Ð¾Ð±Ð¸Ð»Ð¸\n    > Â«Ð—Ð°ÑÑ‚Ð¾ÑÐ¾Ð²Ð°Ð½Ð¾Â» â€” Ñ„Ð¾Ñ€Ð¼Ð°Ð»ÑŒÐ½Ð° Ð¿Ð°ÑÐ¸Ð²Ð½Ð° ÐºÐ¾Ð½ÑÑ‚Ñ€ÑƒÐºÑ†Ñ–Ñ.\n\n13. Ð©Ð¾ Ð¾Ð·Ð½Ð°Ñ‡Ð°Ñ” Ñ‚ÐµÑ€Ð¼Ñ–Ð½ Â«Ð¿Ð¾Ð³Ð»Ð¸Ð±Ð»ÐµÐ½Ð½ÑÂ» Ð² ÐºÐ¾Ð½Ñ‚ÐµÐºÑÑ‚Ñ– Ð½Ð°Ð²Ñ‡Ð°Ð½Ð½Ñ?\n    - [ ] ÐŸÐ¾Ð²ÐµÑ€Ñ…Ð½ÐµÐ²Ðµ Ð²Ð¸Ð²Ñ‡ÐµÐ½Ð½Ñ\n    - [ ] Ð—Ð°Ð±ÑƒÐ²Ð°Ð½Ð½Ñ Ð¼Ð°Ñ‚ÐµÑ€Ñ–Ð°Ð»Ñƒ\n    - [x] Ð‘Ñ–Ð»ÑŒÑˆ Ð´ÐµÑ‚Ð°Ð»ÑŒÐ½Ðµ Ð²Ð¸Ð²Ñ‡ÐµÐ½Ð½Ñ\n    - [ ] ÐŸÐ¾Ñ‡Ð°Ñ‚Ð¾Ðº Ð²Ð¸Ð²Ñ‡ÐµÐ½Ð½Ñ\n    > ÐŸÐ¾Ð³Ð»Ð¸Ð±Ð»ÐµÐ½Ð½Ñ â€” Ñ†Ðµ Ð¿ÐµÑ€ÐµÑ…Ñ–Ð´ Ð´Ð¾ Ð³Ð»Ð¸Ð±ÑˆÐ¾Ð³Ð¾ Ñ€Ð¾Ð·ÑƒÐ¼Ñ–Ð½Ð½Ñ.\n\n14. Ð¯ÐºÐ° Ñ„Ð¾Ñ€Ð¼Ð° Ð¿Ñ€Ð°Ð²Ð¸Ð»ÑŒÐ½Ð° Ð´Ð»Ñ Ð¾Ñ„Ñ–Ñ†Ñ–Ð¹Ð½Ð¾Ð³Ð¾ Ð´Ð¾ÐºÑƒÐ¼ÐµÐ½Ñ‚Ð°?\n    - [ ] Ð”Ð¸Ñ€ÐµÐºÑ‚Ð¾Ñ€ Ð¿Ñ–Ð´Ð¿Ð¸ÑÐ°Ð² Ð½Ð°ÐºÐ°Ð·.\n    - [ ] Ð”Ð¸Ñ€ÐµÐºÑ‚Ð¾Ñ€ Ð¿Ñ–Ð´Ð¿Ð¸ÑÑƒÐ²Ð°Ð² Ð½Ð°ÐºÐ°Ð·.\n    - [x] ÐÐ°ÐºÐ°Ð· Ð¿Ñ–Ð´Ð¿Ð¸ÑÐ°Ð½Ð¾ Ð´Ð¸Ñ€ÐµÐºÑ‚Ð¾Ñ€Ð¾Ð¼.\n    - [ ] ÐÐ°ÐºÐ°Ð· Ð¿Ñ–Ð´Ð¿Ð¸ÑÑƒÑ”Ñ‚ÑŒÑÑ Ð´Ð¸Ñ€ÐµÐºÑ‚Ð¾Ñ€Ð¾Ð¼.\n    > Ð¤Ð¾Ñ€Ð¼Ð° Ð½Ð° -Ð½Ð¾/-Ñ‚Ð¾ Ð¾Ð±Ð¾Ð²'ÑÐ·ÐºÐ¾Ð²Ð° Ð´Ð»Ñ Ð¾Ñ„Ñ–Ñ†Ñ–Ð¹Ð½Ð¸Ñ… Ð´Ð¾ÐºÑƒÐ¼ÐµÐ½Ñ‚Ñ–Ð².\n\n15. Ð©Ð¾ Ñ‚Ð°ÐºÐµ Â«ÑÐ¸ÑÑ‚ÐµÐ¼Ð°Ñ‚Ð¸Ð·Ð°Ñ†Ñ–ÑÂ»?\n    - [ ] Ð¥Ð°Ð¾Ñ‚Ð¸Ñ‡Ð½Ðµ Ð½Ð°ÐºÐ¾Ð¿Ð¸Ñ‡ÐµÐ½Ð½Ñ\n    - [x] ÐŸÑ€Ð¸Ð²ÐµÐ´ÐµÐ½Ð½Ñ Ð´Ð¾ ÑÐ¸ÑÑ‚ÐµÐ¼Ð¸, Ð²Ð¿Ð¾Ñ€ÑÐ´ÐºÑƒÐ²Ð°Ð½Ð½Ñ\n    - [ ] Ð’Ð¸Ð¿Ð°Ð´ÐºÐ¾Ð²Ð¸Ð¹ Ð²Ð¸Ð±Ñ–Ñ€\n    - [ ] Ð—Ð½Ð¸Ñ‰ÐµÐ½Ð½Ñ Ñ–Ð½Ñ„Ð¾Ñ€Ð¼Ð°Ñ†Ñ–Ñ—\n    > Ð¡Ð¸ÑÑ‚ÐµÐ¼Ð°Ñ‚Ð¸Ð·Ð°Ñ†Ñ–Ñ = Ð²Ð¿Ð¾Ñ€ÑÐ´ÐºÑƒÐ²Ð°Ð½Ð½Ñ Ð·Ð° Ð¿ÐµÐ²Ð½Ð¾ÑŽ ÑÐ¸ÑÑ‚ÐµÐ¼Ð¾ÑŽ.\n\n16. Ð¯ÐºÐµ Ñ€ÐµÑ‡ÐµÐ½Ð½Ñ Ñ” Ð¿Ñ€Ð¸ÐºÐ»Ð°Ð´Ð¾Ð¼ Ð¿ÑƒÐ±Ð»Ñ–Ñ†Ð¸ÑÑ‚Ð¸Ñ‡Ð½Ð¾Ð³Ð¾ ÑÑ‚Ð¸Ð»ÑŽ?\n    - [ ] ÐÐ°ÐºÐ°Ð· â„– 123 Ð²Ñ–Ð´ 01.01.2024.\n    - [ ] ÐœÐ°Ð¼Ð¾, Ñ Ð²Ð¶Ðµ Ð¿Ð¾Ñ—Ð².\n    - [x] Ð—Ð°ÐºÐ¾Ð½ Ð±ÑƒÐ»Ð¾ ÑƒÑ…Ð²Ð°Ð»ÐµÐ½Ð¾ Ð¿Ñ–ÑÐ»Ñ Ñ‚Ñ€Ð¸Ð²Ð°Ð»Ð¸Ñ… Ð´ÐµÐ±Ð°Ñ‚Ñ–Ð².\n    - [ ] Â«Ðž, Ð´ÑƒÐ¼Ð¸ Ð¼Ð¾Ñ—, Ð´ÑƒÐ¼Ð¸ Ð¼Ð¾Ñ—...Â»\n    > ÐŸÑƒÐ±Ð»Ñ–Ñ†Ð¸ÑÑ‚Ð¸ÐºÐ° Ð¿Ð¾Ñ”Ð´Ð½ÑƒÑ” Ñ–Ð½Ñ„Ð¾Ñ€Ð¼Ð°Ñ‚Ð¸Ð²Ð½Ñ–ÑÑ‚ÑŒ Ñ‚Ð° Ð´Ð¾ÑÑ‚ÑƒÐ¿Ð½Ñ–ÑÑ‚ÑŒ.\n\n17. Ð©Ð¾ Ð¾Ð·Ð½Ð°Ñ‡Ð°Ñ” Â«Ð¿ÐµÑ€ÐµÑ…Ñ–Ð´ Ð´Ð¾ C1Â»?\n    - [ ] ÐŸÐ¾Ð²ÐµÑ€Ð½ÐµÐ½Ð½Ñ Ð½Ð° Ð¿Ð¾Ñ‡Ð°Ñ‚ÐºÐ¾Ð²Ð¸Ð¹ Ñ€Ñ–Ð²ÐµÐ½ÑŒ\n    - [ ] Ð—Ð°Ð»Ð¸ÑˆÐµÐ½Ð½Ñ Ð½Ð° B2\n    - [x] ÐŸÑ€Ð¾ÑÑƒÐ²Ð°Ð½Ð½Ñ Ð´Ð¾ Ð¿Ñ€Ð¾ÑÑƒÐ½ÑƒÑ‚Ð¾Ð³Ð¾ Ñ€Ñ–Ð²Ð½Ñ\n    - [ ] ÐŸÑ€Ð¾Ð¿ÑƒÑÐº Ð½Ð°Ð²Ñ‡Ð°Ð»ÑŒÐ½Ð¾Ð³Ð¾ Ð¼Ð°Ñ‚ÐµÑ€Ñ–Ð°Ð»Ñƒ\n    > ÐŸÐµÑ€ÐµÑ…Ñ–Ð´ â€” Ñ†Ðµ Ð¿Ñ€Ð¾Ð³Ñ€ÐµÑ Ð´Ð¾ Ð²Ð¸Ñ‰Ð¾Ð³Ð¾ Ñ€Ñ–Ð²Ð½Ñ.\n\n18. Ð¯ÐºÐ° Ð¾Ð·Ð½Ð°ÐºÐ° ÐÐ• Ñ…Ð°Ñ€Ð°ÐºÑ‚ÐµÑ€Ð½Ð° Ð´Ð»Ñ Ð¾Ñ„Ñ–Ñ†Ñ–Ð¹Ð½Ð¾-Ð´Ñ–Ð»Ð¾Ð²Ð¾Ð³Ð¾ ÑÑ‚Ð¸Ð»ÑŽ?\n    - [ ] Ð¡Ñ‚Ð°Ð½Ð´Ð°Ñ€Ñ‚Ð¸Ð·Ð¾Ð²Ð°Ð½Ñ–ÑÑ‚ÑŒ\n    - [ ] Ð®Ñ€Ð¸Ð´Ð¸Ñ‡Ð½Ð° Ñ‚Ð¾Ñ‡Ð½Ñ–ÑÑ‚ÑŒ\n    - [x] Ð†Ð½Ð´Ð¸Ð²Ñ–Ð´ÑƒÐ°Ð»ÑŒÐ½Ñ–ÑÑ‚ÑŒ Ð°Ð²Ñ‚Ð¾Ñ€Ð°\n    - [ ] Ð¤Ð¾Ñ€Ð¼Ð°Ð»ÑŒÐ½Ñ–ÑÑ‚ÑŒ\n    > Ð†Ð½Ð´Ð¸Ð²Ñ–Ð´ÑƒÐ°Ð»ÑŒÐ½Ñ–ÑÑ‚ÑŒ Ñ…Ð°Ñ€Ð°ÐºÑ‚ÐµÑ€Ð½Ð° Ð´Ð»Ñ Ñ…ÑƒÐ´Ð¾Ð¶Ð½ÑŒÐ¾Ð³Ð¾ ÑÑ‚Ð¸Ð»ÑŽ.\n\n---\n\n## match-up: Ð¢ÐµÑ€Ð¼Ñ–Ð½Ð¸ Ñ‚Ð° Ð²Ð¸Ð·Ð½Ð°Ñ‡ÐµÐ½Ð½Ñ\n\n> ÐŸÐ¾Ñ”Ð´Ð½Ð°Ð¹Ñ‚Ðµ Ñ‚ÐµÑ€Ð¼Ñ–Ð½Ð¸ Ð· Ñ—Ñ…Ð½Ñ–Ð¼Ð¸ Ð²Ð¸Ð·Ð½Ð°Ñ‡ÐµÐ½Ð½ÑÐ¼Ð¸.\n\n| Left | Right |\n|------|-------|\n| Ð¿Ð¾Ð²Ñ‚Ð¾Ñ€ÐµÐ½Ð½Ñ | review, revision |\n| ÑƒÐ·Ð°Ð³Ð°Ð»ÑŒÐ½ÐµÐ½Ð½Ñ | generalization |\n| ÑÐ¸ÑÑ‚ÐµÐ¼Ð°Ñ‚Ð¸Ð·Ð°Ñ†Ñ–Ñ | bringing into a system |\n| ÐºÐ¾Ð½ÑÐ¾Ð»Ñ–Ð´Ð°Ñ†Ñ–Ñ | consolidation, unification |\n| Ð¿ÐµÑ€ÐµÑ…Ñ–Ð´ | transition |\n| Ð¿Ñ€Ð¾ÑÑƒÐ½ÑƒÑ‚Ð¸Ð¹ | advanced |\n| Ð°ÐºÐ°Ð´ÐµÐ¼Ñ–Ñ‡Ð½Ð¸Ð¹ | academic |\n| Ñ„Ð°Ñ…Ð¾Ð²Ð¸Ð¹ | professional, expert |\n| Ð´Ð¾ÑÐºÐ¾Ð½Ð°Ð»Ñ–ÑÑ‚ÑŒ | perfection |\n| Ð¼Ð°Ð¹ÑÑ‚ÐµÑ€Ð½Ñ–ÑÑ‚ÑŒ | mastery |\n| Ð¾Ð¿Ð°Ð½ÑƒÐ²Ð°Ð½Ð½Ñ | mastering, acquisition |\n| Ð²Ð´Ð¾ÑÐºÐ¾Ð½Ð°Ð»ÐµÐ½Ð½Ñ | improvement |\n| Ð¿Ð¾Ð³Ð»Ð¸Ð±Ð»ÐµÐ½Ð½Ñ | deepening |\n| Ñ€Ð¾Ð·ÑˆÐ¸Ñ€ÐµÐ½Ð½Ñ | expansion |\n| Ð·Ð°ÐºÑ€Ñ–Ð¿Ð»ÐµÐ½Ð½Ñ | reinforcement |\n| Ð·Ð°ÑÑ‚Ð¾ÑÑƒÐ²Ð°Ð½Ð½Ñ | application |\n| Ñ–Ð½Ñ‚ÐµÐ³Ñ€Ð°Ñ†Ñ–Ñ | integration |\n| ÑÐ¸Ð½Ñ‚ÐµÐ· | synthesis |\n\n---\n\n## group-sort: Ð¤Ð¾Ñ€Ð¼Ð¸ Ð¿Ð°ÑÐ¸Ð²Ð½Ð¾Ð³Ð¾ ÑÑ‚Ð°Ð½Ñƒ\n\n> Ð Ð¾Ð·Ð¿Ð¾Ð´Ñ–Ð»Ñ–Ñ‚ÑŒ Ð¿Ñ€Ð¸ÐºÐ»Ð°Ð´Ð¸ Ð·Ð° Ñ„Ð¾Ñ€Ð¼Ð°Ð¼Ð¸ Ð¿Ð°ÑÐ¸Ð²Ð½Ð¾Ð³Ð¾ ÑÑ‚Ð°Ð½Ñƒ.\n\n### Ð‘ÐµÐ·Ð¾ÑÐ¾Ð±Ð¾Ð²Ð¸Ð¹ Ð¿Ð°ÑÐ¸Ð² (-Ð½Ð¾/-Ñ‚Ð¾)\n- Ð¡Ñ‚Ð°Ñ‚Ñ‚ÑŽ Ð½Ð°Ð¿Ð¸ÑÐ°Ð½Ð¾\n- Ð—Ð°ÐºÐ¾Ð½ ÑƒÑ…Ð²Ð°Ð»ÐµÐ½Ð¾\n- Ð ÐµÐ·ÑƒÐ»ÑŒÑ‚Ð°Ñ‚Ð¸ Ð¾Ð¿Ñ€Ð¸Ð»ÑŽÐ´Ð½ÐµÐ½Ð¾\n- Ð”Ð¾Ð³Ð¾Ð²Ñ–Ñ€ Ð¿Ñ–Ð´Ð¿Ð¸ÑÐ°Ð½Ð¾\n- Ð”Ð¾ÑÐ»Ñ–Ð´Ð¶ÐµÐ½Ð½Ñ Ð¿Ñ€Ð¾Ð²ÐµÐ´ÐµÐ½Ð¾\n- Ð Ñ–ÑˆÐµÐ½Ð½Ñ Ð¿Ñ€Ð¸Ð¹Ð½ÑÑ‚Ð¾\n\n### Ð”Ñ–Ñ”Ð¿Ñ€Ð¸ÐºÐ¼ÐµÑ‚Ð½Ð¸ÐºÐ¾Ð²Ð¸Ð¹ Ð¿Ð°ÑÐ¸Ð² (-Ð½Ð¸Ð¹/-Ñ‚Ð¸Ð¹)\n- Ð”Ð¾ÐºÑƒÐ¼ÐµÐ½Ñ‚ Ð±ÑƒÐ² Ð¿Ñ–Ð´Ð¿Ð¸ÑÐ°Ð½Ð¸Ð¹\n- Ð¡Ñ‚Ð°Ñ‚Ñ‚Ñ Ð±ÑƒÐ»Ð° Ð¾Ð¿ÑƒÐ±Ð»Ñ–ÐºÐ¾Ð²Ð°Ð½Ð°\n- ÐšÐ½Ð¸Ð³Ð° Ð±ÑƒÐ´Ðµ Ð½Ð°Ð´Ñ€ÑƒÐºÐ¾Ð²Ð°Ð½Ð°\n- Ð›Ð¸ÑÑ‚ Ð±ÑƒÐ² Ð½Ð°Ð¿Ð¸ÑÐ°Ð½Ð¸Ð¹\n- Ð ÐµÐ·ÑƒÐ»ÑŒÑ‚Ð°Ñ‚Ð¸ Ð±ÑƒÐ»Ð¸ Ð¾Ð³Ð¾Ð»Ð¾ÑˆÐµÐ½Ñ–\n- Ð Ð¾Ð±Ð¾Ñ‚Ð° Ð±ÑƒÐ»Ð° Ð²Ð¸ÐºÐ¾Ð½Ð°Ð½Ð°\n\n### Ð—Ð²Ð¾Ñ€Ð¾Ñ‚Ð½Ð¸Ð¹ Ð¿Ð°ÑÐ¸Ð² (-ÑÑ)\n- ÐŸÑ€Ð¾Ð±Ð»ÐµÐ¼Ð° Ñ€Ð¾Ð·Ð²'ÑÐ·ÑƒÑ”Ñ‚ÑŒÑÑ\n- Ð”Ð°Ð½Ñ– Ð¾Ð±Ñ€Ð¾Ð±Ð»ÑÑŽÑ‚ÑŒÑÑ\n- ÐŸÐ¸Ñ‚Ð°Ð½Ð½Ñ Ñ€Ð¾Ð·Ð³Ð»ÑÐ´Ð°Ñ”Ñ‚ÑŒÑÑ\n- ÐœÐµÑ‚Ð¾Ð´ Ð·Ð°ÑÑ‚Ð¾ÑÐ¾Ð²ÑƒÑ”Ñ‚ÑŒÑÑ\n- Ð ÐµÐ·ÑƒÐ»ÑŒÑ‚Ð°Ñ‚Ð¸ Ð°Ð½Ð°Ð»Ñ–Ð·ÑƒÑŽÑ‚ÑŒÑÑ\n- Ð—Ð²Ñ–Ñ‚ Ð³Ð¾Ñ‚ÑƒÑ”Ñ‚ÑŒÑÑ\n\n---\n\n## fill-in: Ð¢Ñ€Ð°Ð½ÑÑ„Ð¾Ñ€Ð¼Ð°Ñ†Ñ–Ñ Ñƒ Ð¿Ð°ÑÐ¸Ð²Ð½Ð¸Ð¹ ÑÑ‚Ð°Ð½\n\n> ÐŸÐ¾ÑÑ‚Ð°Ð²Ñ‚Ðµ Ð´Ñ–Ñ”ÑÐ»Ð¾Ð²Ð¾ Ð² Ð¿Ñ€Ð°Ð²Ð¸Ð»ÑŒÐ½Ñƒ Ñ„Ð¾Ñ€Ð¼Ñƒ Ð¿Ð°ÑÐ¸Ð²Ð½Ð¾Ð³Ð¾ ÑÑ‚Ð°Ð½Ñƒ (-Ð½Ð¾/-Ñ‚Ð¾).\n\n1. Ð¦ÑŽ ÑÑ‚Ð°Ñ‚Ñ‚ÑŽ ___ (Ð½Ð°Ð¿Ð¸ÑÐ°Ñ‚Ð¸) Ð²Ñ–Ð´Ð¾Ð¼Ð¸Ð¼ Ð½Ð°ÑƒÐºÐ¾Ð²Ñ†ÐµÐ¼.\n   > [!answer] Ð½Ð°Ð¿Ð¸ÑÐ°Ð½Ð¾\n   > [!options] Ð½Ð°Ð¿Ð¸ÑÐ°Ð½Ð¾ | Ð½Ð°Ð¿Ð¸ÑÐ°Ð½Ð¸Ð¹ | Ð½Ð°Ð¿Ð¸ÑÐ°Ð² | Ð¿Ð¸ÑˆÐµÑ‚ÑŒÑÑ\n\n2. Ð”Ð¾ÑÐ»Ñ–Ð´Ð¶ÐµÐ½Ð½Ñ ___ (Ð¿Ñ€Ð¾Ð²ÐµÑÑ‚Ð¸) Ð¿Ñ€Ð¾Ñ‚ÑÐ³Ð¾Ð¼ Ñ€Ð¾ÐºÑƒ.\n   > [!answer] Ð¿Ñ€Ð¾Ð²ÐµÐ´ÐµÐ½Ð¾\n   > [!options] Ð¿Ñ€Ð¾Ð²ÐµÐ´ÐµÐ½Ð¾ | Ð¿Ñ€Ð¾Ð²ÐµÐ´ÐµÐ½Ð¸Ð¹ | Ð¿Ñ€Ð¾Ð²ÐµÐ»Ð¸ | Ð¿Ñ€Ð¾Ð²Ð¾Ð´Ð¸Ñ‚ÑŒÑÑ\n\n3. Ð£ÑÑ– Ð´Ð¾ÐºÑƒÐ¼ÐµÐ½Ñ‚Ð¸ ___ (Ð¿ÐµÑ€ÐµÐ²Ñ–Ñ€Ð¸Ñ‚Ð¸) ÐºÐ¾Ð¼Ñ–ÑÑ–Ñ”ÑŽ.\n   > [!answer] Ð¿ÐµÑ€ÐµÐ²Ñ–Ñ€ÐµÐ½Ð¾\n   > [!options] Ð¿ÐµÑ€ÐµÐ²Ñ–Ñ€ÐµÐ½Ð¾ | Ð¿ÐµÑ€ÐµÐ²Ñ–Ñ€ÐµÐ½Ð¸Ð¹ | Ð¿ÐµÑ€ÐµÐ²Ñ–Ñ€Ð¸Ð»Ð¸ | Ð¿ÐµÑ€ÐµÐ²Ñ–Ñ€ÑÑ”Ñ‚ÑŒÑÑ\n\n4. Ð ÐµÐ·ÑƒÐ»ÑŒÑ‚Ð°Ñ‚Ð¸ ___ (Ð¾Ð³Ð¾Ð»Ð¾ÑÐ¸Ñ‚Ð¸) Ð½Ð° ÐºÐ¾Ð½Ñ„ÐµÑ€ÐµÐ½Ñ†Ñ–Ñ—.\n   > [!answer] Ð¾Ð³Ð¾Ð»Ð¾ÑˆÐµÐ½Ð¾\n   > [!options] Ð¾Ð³Ð¾Ð»Ð¾ÑˆÐµÐ½Ð¾ | Ð¾Ð³Ð¾Ð»Ð¾ÑˆÐµÐ½Ð¸Ð¹ | Ð¾Ð³Ð¾Ð»Ð¾ÑÐ¸Ð»Ð¸ | Ð¾Ð³Ð¾Ð»Ð¾ÑˆÑƒÑ”Ñ‚ÑŒÑÑ\n\n5. ÐÐ¾Ð²Ñ– Ð¿Ñ€Ð°Ð²Ð¸Ð»Ð° ___ (Ð·Ð°Ð¿Ñ€Ð¾Ð²Ð°Ð´Ð¸Ñ‚Ð¸) Ð· Ð½Ð°ÑÑ‚ÑƒÐ¿Ð½Ð¾Ð³Ð¾ Ð¼Ñ–ÑÑÑ†Ñ.\n   > [!answer] Ð·Ð°Ð¿Ñ€Ð¾Ð²Ð°Ð´Ð¶ÐµÐ½Ð¾\n   > [!options] Ð·Ð°Ð¿Ñ€Ð¾Ð²Ð°Ð´Ð¶ÐµÐ½Ð¾ | Ð·Ð°Ð¿Ñ€Ð¾Ð²Ð°Ð´Ð¶ÐµÐ½Ð¸Ð¹ | Ð·Ð°Ð¿Ñ€Ð¾Ð²Ð°Ð´Ð¸Ð»Ð¸ | Ð·Ð°Ð¿Ñ€Ð¾Ð²Ð°Ð´Ð¶ÑƒÑ”Ñ‚ÑŒÑÑ\n\n6. Ð—Ð°ÑÐ²Ñƒ ___ (Ð¿Ð¾Ð´Ð°Ñ‚Ð¸) Ð²Ñ‡Ð°ÑÐ½Ð¾.\n   > [!answer] Ð¿Ð¾Ð´Ð°Ð½Ð¾\n   > [!options] Ð¿Ð¾Ð´Ð°Ð½Ð¾ | Ð¿Ð¾Ð´Ð°Ð½Ð¸Ð¹ | Ð¿Ð¾Ð´Ð°Ð»Ð¸ | Ð¿Ð¾Ð´Ð°Ñ”Ñ‚ÑŒÑÑ\n\n7. Ð•ÐºÑÐ¿ÐµÑ€Ð¸Ð¼ÐµÐ½Ñ‚ ___ (Ð¿Ð¾Ð²Ñ‚Ð¾Ñ€Ð¸Ñ‚Ð¸) Ñ‚Ñ€Ð¸Ñ‡Ñ–.\n   > [!answer] Ð¿Ð¾Ð²Ñ‚Ð¾Ñ€ÐµÐ½Ð¾\n   > [!options] Ð¿Ð¾Ð²Ñ‚Ð¾Ñ€ÐµÐ½Ð¾ | Ð¿Ð¾Ð²Ñ‚Ð¾Ñ€ÐµÐ½Ð¸Ð¹ | Ð¿Ð¾Ð²Ñ‚Ð¾Ñ€Ð¸Ð»Ð¸ | Ð¿Ð¾Ð²Ñ‚Ð¾Ñ€ÑŽÑ”Ñ‚ÑŒÑÑ\n\n8. Ð’ÑÑ– Ð¿Ð¾Ð¼Ð¸Ð»ÐºÐ¸ ___ (Ð²Ð¸Ð¿Ñ€Ð°Ð²Ð¸Ñ‚Ð¸) Ñ€ÐµÐ´Ð°ÐºÑ‚Ð¾Ñ€Ð¾Ð¼.\n   > [!answer] Ð²Ð¸Ð¿Ñ€Ð°Ð²Ð»ÐµÐ½Ð¾\n   > [!options] Ð²Ð¸Ð¿Ñ€Ð°Ð²Ð»ÐµÐ½Ð¾ | Ð²Ð¸Ð¿Ñ€Ð°Ð²Ð»ÐµÐ½Ð¸Ð¹ | Ð²Ð¸Ð¿Ñ€Ð°Ð²Ð¸Ð»Ð¸ | Ð²Ð¸Ð¿Ñ€Ð°Ð²Ð»ÑÑ”Ñ‚ÑŒÑÑ\n\n9. ÐÐ°ÐºÐ°Ð· ___ (Ð¿Ñ–Ð´Ð¿Ð¸ÑÐ°Ñ‚Ð¸) Ñ€ÐµÐºÑ‚Ð¾Ñ€Ð¾Ð¼.\n   > [!answer] Ð¿Ñ–Ð´Ð¿Ð¸ÑÐ°Ð½Ð¾\n   > [!options] Ð¿Ñ–Ð´Ð¿Ð¸ÑÐ°Ð½Ð¾ | Ð¿Ñ–Ð´Ð¿Ð¸ÑÐ°Ð½Ð¸Ð¹ | Ð¿Ñ–Ð´Ð¿Ð¸ÑÐ°Ð»Ð¸ | Ð¿Ñ–Ð´Ð¿Ð¸ÑÑƒÑ”Ñ‚ÑŒÑÑ\n\n10. Ð—Ð°ÐºÐ¾Ð½ ___ (Ð¿Ñ€Ð¸Ð¹Ð½ÑÑ‚Ð¸) Ð¿Ð°Ñ€Ð»Ð°Ð¼ÐµÐ½Ñ‚Ð¾Ð¼.\n    > [!answer] Ð¿Ñ€Ð¸Ð¹Ð½ÑÑ‚Ð¾\n    > [!options] Ð¿Ñ€Ð¸Ð¹Ð½ÑÑ‚Ð¾ | Ð¿Ñ€Ð¸Ð¹Ð½ÑÑ‚Ð¸Ð¹ | Ð¿Ñ€Ð¸Ð¹Ð½ÑÐ»Ð¸ | Ð¿Ñ€Ð¸Ð¹Ð¼Ð°Ñ”Ñ‚ÑŒÑÑ\n\n11. Ð Ñ–ÑˆÐµÐ½Ð½Ñ ___ (ÑƒÑ…Ð²Ð°Ð»Ð¸Ñ‚Ð¸) Ð¾Ð´Ð½Ð¾Ð³Ð¾Ð»Ð¾ÑÐ½Ð¾.\n    > [!answer] ÑƒÑ…Ð²Ð°Ð»ÐµÐ½Ð¾\n    > [!options] ÑƒÑ…Ð²Ð°Ð»ÐµÐ½Ð¾ | ÑƒÑ…Ð²Ð°Ð»ÐµÐ½Ð¸Ð¹ | ÑƒÑ…Ð²Ð°Ð»Ð¸Ð»Ð¸ | ÑƒÑ…Ð²Ð°Ð»ÑŽÑ”Ñ‚ÑŒÑÑ\n\n12. Ð—Ð²Ñ–Ñ‚ ___ (Ð·Ð°Ð²ÐµÑ€ÑˆÐ¸Ñ‚Ð¸) Ð²Ñ‡Ð¾Ñ€Ð°.\n    > [!answer] Ð·Ð°Ð²ÐµÑ€ÑˆÐµÐ½Ð¾\n    > [!options] Ð·Ð°Ð²ÐµÑ€ÑˆÐµÐ½Ð¾ | Ð·Ð°Ð²ÐµÑ€ÑˆÐµÐ½Ð¸Ð¹ | Ð·Ð°Ð²ÐµÑ€ÑˆÐ¸Ð»Ð¸ | Ð·Ð°Ð²ÐµÑ€ÑˆÑƒÑ”Ñ‚ÑŒÑÑ\n\n13. Ð£ÑÑ– Ð´Ð°Ð½Ñ– ___ (Ð¾Ð±Ñ€Ð¾Ð±Ð¸Ñ‚Ð¸) Ð·Ð° Ð´Ð¾Ð¿Ð¾Ð¼Ð¾Ð³Ð¾ÑŽ ÐºÐ¾Ð¼Ð¿'ÑŽÑ‚ÐµÑ€Ð°.\n    > [!answer] Ð¾Ð±Ñ€Ð¾Ð±Ð»ÐµÐ½Ð¾\n    > [!options] Ð¾Ð±Ñ€Ð¾Ð±Ð»ÐµÐ½Ð¾ | Ð¾Ð±Ñ€Ð¾Ð±Ð»ÐµÐ½Ð¸Ð¹ | Ð¾Ð±Ñ€Ð¾Ð±Ð¸Ð»Ð¸ | Ð¾Ð±Ñ€Ð¾Ð±Ð»ÑÑ”Ñ‚ÑŒÑÑ\n\n14. Ð¦ÐµÐ¹ Ð¼ÐµÑ‚Ð¾Ð´ ___ (Ð·Ð°ÑÑ‚Ð¾ÑÑƒÐ²Ð°Ñ‚Ð¸) Ð²Ð¿ÐµÑ€ÑˆÐµ.\n    > [!answer] Ð·Ð°ÑÑ‚Ð¾ÑÐ¾Ð²Ð°Ð½Ð¾\n    > [!options] Ð·Ð°ÑÑ‚Ð¾ÑÐ¾Ð²Ð°Ð½Ð¾ | Ð·Ð°ÑÑ‚Ð¾ÑÐ¾Ð²Ð°Ð½Ð¸Ð¹ | Ð·Ð°ÑÑ‚Ð¾ÑÑƒÐ²Ð°Ð»Ð¸ | Ð·Ð°ÑÑ‚Ð¾ÑÐ¾Ð²ÑƒÑ”Ñ‚ÑŒÑÑ\n\n15. Ð¢ÐµÐ¾Ñ€Ñ–ÑŽ ___ (Ð¿Ñ–Ð´Ñ‚Ð²ÐµÑ€Ð´Ð¸Ñ‚Ð¸) ÐµÐºÑÐ¿ÐµÑ€Ð¸Ð¼ÐµÐ½Ñ‚Ð°Ð»ÑŒÐ½Ð¾.\n    > [!answer] Ð¿Ñ–Ð´Ñ‚Ð²ÐµÑ€Ð´Ð¶ÐµÐ½Ð¾\n    > [!options] Ð¿Ñ–Ð´Ñ‚Ð²ÐµÑ€Ð´Ð¶ÐµÐ½Ð¾ | Ð¿Ñ–Ð´Ñ‚Ð²ÐµÑ€Ð´Ð¶ÐµÐ½Ð¸Ð¹ | Ð¿Ñ–Ð´Ñ‚Ð²ÐµÑ€Ð´Ð¸Ð»Ð¸ | Ð¿Ñ–Ð´Ñ‚Ð²ÐµÑ€Ð´Ð¶ÑƒÑ”Ñ‚ÑŒÑÑ\n\n16. Ð¡Ñ‚Ð°Ñ‚Ñ‚ÑŽ ___ (Ð¾Ð¿ÑƒÐ±Ð»Ñ–ÐºÑƒÐ²Ð°Ñ‚Ð¸) Ð² Ð½Ð°ÑƒÐºÐ¾Ð²Ð¾Ð¼Ñƒ Ð¶ÑƒÑ€Ð½Ð°Ð»Ñ–.\n    > [!answer] Ð¾Ð¿ÑƒÐ±Ð»Ñ–ÐºÐ¾Ð²Ð°Ð½Ð¾\n    > [!options] Ð¾Ð¿ÑƒÐ±Ð»Ñ–ÐºÐ¾Ð²Ð°Ð½Ð¾ | Ð¾Ð¿ÑƒÐ±Ð»Ñ–ÐºÐ¾Ð²Ð°Ð½Ð¸Ð¹ | Ð¾Ð¿ÑƒÐ±Ð»Ñ–ÐºÑƒÐ²Ð°Ð»Ð¸ | Ð¿ÑƒÐ±Ð»Ñ–ÐºÑƒÑ”Ñ‚ÑŒÑÑ\n\n17. Ð“Ñ–Ð¿Ð¾Ñ‚ÐµÐ·Ñƒ ___ (Ð²Ð¸ÑÑƒÐ½ÑƒÑ‚Ð¸) Ñ‰Ðµ Ð² Ð¼Ð¸Ð½ÑƒÐ»Ð¾Ð¼Ñƒ ÑÑ‚Ð¾Ð»Ñ–Ñ‚Ñ‚Ñ–.\n    > [!answer] Ð²Ð¸ÑÑƒÐ½ÑƒÑ‚Ð¾\n    > [!options] Ð²Ð¸ÑÑƒÐ½ÑƒÑ‚Ð¾ | Ð²Ð¸ÑÑƒÐ½ÑƒÑ‚Ð¸Ð¹ | Ð²Ð¸ÑÑƒÐ½ÑƒÐ»Ð¸ | Ð²Ð¸ÑÑƒÐ²Ð°Ñ”Ñ‚ÑŒÑÑ\n\n18. ÐšÐ¾Ð½Ñ„ÐµÑ€ÐµÐ½Ñ†Ñ–ÑŽ ___ (Ð¿Ñ€Ð¾Ð²ÐµÑÑ‚Ð¸) Ñƒ ÐšÐ¸Ñ”Ð²Ñ–.\n    > [!answer] Ð¿Ñ€Ð¾Ð²ÐµÐ´ÐµÐ½Ð¾\n    > [!options] Ð¿Ñ€Ð¾Ð²ÐµÐ´ÐµÐ½Ð¾ | Ð¿Ñ€Ð¾Ð²ÐµÐ´ÐµÐ½Ð¸Ð¹ | Ð¿Ñ€Ð¾Ð²ÐµÐ»Ð¸ | Ð¿Ñ€Ð¾Ð²Ð¾Ð´Ð¸Ñ‚ÑŒÑÑ\n\n---\n\n## fill-in: Ð’Ð¸Ð±Ñ–Ñ€ Ñ€ÐµÐ³Ñ–ÑÑ‚Ñ€Ñƒ\n\n> Ð’Ð¸Ð±ÐµÑ€Ñ–Ñ‚ÑŒ Ñ„Ð¾Ñ€Ð¼Ñƒ, ÑÐºÐ° Ð½Ð°Ð¹ÐºÑ€Ð°Ñ‰Ðµ Ð¿Ñ–Ð´Ñ…Ð¾Ð´Ð¸Ñ‚ÑŒ Ð´Ð»Ñ Ð½Ð°ÑƒÐºÐ¾Ð²Ð¾Ð³Ð¾ ÑÑ‚Ð¸Ð»ÑŽ.\n\n1. ÐœÐµÑ‚Ð¾Ð´ ___ Ð´Ð»Ñ Ð°Ð½Ð°Ð»Ñ–Ð·Ñƒ Ð´Ð°Ð½Ð¸Ñ….\n   > [!answer] Ð·Ð°ÑÑ‚Ð¾ÑÐ¾Ð²Ð°Ð½Ð¾\n   > [!options] Ð²Ð¸ÐºÐ¾Ñ€Ð¸ÑÑ‚Ð°Ð»Ð¸ | Ð·Ð°ÑÑ‚Ð¾ÑÐ¾Ð²Ð°Ð½Ð¾ | Ñ€Ð¾Ð±Ð¸Ð»Ð¸ | Ð²Ð·ÑÐ»Ð¸\n\n2. Ð ÐµÐ·ÑƒÐ»ÑŒÑ‚Ð°Ñ‚Ð¸ ___ Ð² Ñ‚Ð°Ð±Ð»Ð¸Ñ†Ñ– Ð½Ð¸Ð¶Ñ‡Ðµ.\n   > [!answer] Ð¿Ñ€ÐµÐ´ÑÑ‚Ð°Ð²Ð»ÐµÐ½Ð¾\n   > [!options] Ð¿Ð¾ÐºÐ°Ð·Ð°Ð»Ð¸ | Ð¿Ñ€ÐµÐ´ÑÑ‚Ð°Ð²Ð»ÐµÐ½Ð¾ | Ð´Ð°Ð»Ð¸ | Ð²Ð¸ÐºÐ»Ð°Ð»Ð¸\n\n3. Ð”Ð¾ÑÐ»Ñ–Ð´Ð¶ÐµÐ½Ð½Ñ ___ Ð¿Ð¸Ñ‚Ð°Ð½Ð½ÑŽ Ð¼Ð¾Ð²Ð½Ð¾Ñ— Ð¿Ð¾Ð»Ñ–Ñ‚Ð¸ÐºÐ¸.\n   > [!answer] Ð¿Ñ€Ð¸ÑÐ²ÑÑ‡ÐµÐ½Ð¾\n   > [!options] Ð¿Ñ€Ð¸ÑÐ²ÑÑ‡ÐµÐ½Ð¾ | Ð¿Ñ€Ð¸ÑÐ²ÑÑ‚Ð¸Ð»Ð¸ | Ð·Ñ€Ð¾Ð±Ð¸Ð»Ð¸ | Ð¿Ð¸ÑÐ°Ð»Ð¸\n\n4. ___, Ñ‰Ð¾ Ñ–ÑÐ½ÑƒÑ” ÐºÐ¾Ñ€ÐµÐ»ÑÑ†Ñ–Ñ Ð¼Ñ–Ð¶ Ð·Ð¼Ñ–Ð½Ð½Ð¸Ð¼Ð¸.\n   > [!answer] Ð’ÑÑ‚Ð°Ð½Ð¾Ð²Ð»ÐµÐ½Ð¾\n   > [!options] ÐœÐ¸ Ð·'ÑÑÑƒÐ²Ð°Ð»Ð¸ | Ð’ÑÑ‚Ð°Ð½Ð¾Ð²Ð»ÐµÐ½Ð¾ | Ð—Ñ€Ð¾Ð±Ð¸Ð»Ð¸ | Ð”Ñ–Ð·Ð½Ð°Ð»Ð¸ÑÑ\n\n5. Ð“Ñ–Ð¿Ð¾Ñ‚ÐµÐ·Ñƒ ___ ÐµÐºÑÐ¿ÐµÑ€Ð¸Ð¼ÐµÐ½Ñ‚Ð°Ð»ÑŒÐ½Ð¸Ð¼ ÑˆÐ»ÑÑ…Ð¾Ð¼.\n   > [!answer] Ð¿Ñ–Ð´Ñ‚Ð²ÐµÑ€Ð´Ð¶ÐµÐ½Ð¾\n   > [!options] Ð¿Ñ–Ð´Ñ‚Ð²ÐµÑ€Ð´Ð¸Ð»Ð¸ | Ð¿Ñ–Ð´Ñ‚Ð²ÐµÑ€Ð´Ð¶ÐµÐ½Ð¾ | Ð´Ð¾Ð²ÐµÐ»Ð¸ | Ð¿Ð¾ÐºÐ°Ð·Ð°Ð»Ð¸\n\n6. Ð£ÑÑ– Ð´Ð¶ÐµÑ€ÐµÐ»Ð° ___ Ð² Ð±Ñ–Ð±Ð»Ñ–Ð¾Ð³Ñ€Ð°Ñ„Ñ–Ñ—.\n   > [!answer] Ð½Ð°Ð²ÐµÐ´ÐµÐ½Ð¾\n   > [!options] Ð´Ð°Ð»Ð¸ | Ð½Ð°Ð²ÐµÐ´ÐµÐ½Ð¾ | Ð½Ð°Ð¿Ð¸ÑÐ°Ð»Ð¸ | Ð¿Ð¾ÐºÐ»Ð°Ð´Ð°Ð»Ð¸\n\n7. ÐÐ° Ð¾ÑÐ½Ð¾Ð²Ñ– Ð°Ð½Ð°Ð»Ñ–Ð·Ñƒ ___ Ð²Ð¸ÑÐ½Ð¾Ð²Ð¾Ðº.\n   > [!answer] Ð·Ñ€Ð¾Ð±Ð»ÐµÐ½Ð¾\n   > [!options] Ð·Ñ€Ð¾Ð±Ð¸Ð»Ð¸ | Ð·Ñ€Ð¾Ð±Ð»ÐµÐ½Ð¾ | Ð¼Ð°Ð»Ð¸ | Ð²Ð¸Ð²ÐµÐ»Ð¸\n\n8. ÐŸÑ€Ð¾Ð±Ð»ÐµÐ¼Ñƒ ___ Ð· Ñ€Ñ–Ð·Ð½Ð¸Ñ… Ð¿ÐµÑ€ÑÐ¿ÐµÐºÑ‚Ð¸Ð².\n   > [!answer] Ñ€Ð¾Ð·Ð³Ð»ÑÐ½ÑƒÑ‚Ð¾\n   > [!options] Ð¿Ð¾Ð´Ð¸Ð²Ð¸Ð»Ð¸ÑÑŒ | Ñ€Ð¾Ð·Ð³Ð»ÑÐ½ÑƒÑ‚Ð¾ | Ð±Ð°Ñ‡Ð¸Ð»Ð¸ | Ð°Ð½Ð°Ð»Ñ–Ð·ÑƒÐ²Ð°Ð»Ð¸\n\n9. Ð”Ð°Ð½Ñ– ___ Ð¼ÐµÑ‚Ð¾Ð´Ð¾Ð¼ ÐºÐ¾Ñ€ÐµÐ»ÑÑ†Ñ–Ð¹Ð½Ð¾Ð³Ð¾ Ð°Ð½Ð°Ð»Ñ–Ð·Ñƒ.\n   > [!answer] Ð¾Ð±Ñ€Ð¾Ð±Ð»ÐµÐ½Ð¾\n   > [!options] Ð¾Ð±Ñ€Ð¾Ð±Ð»ÐµÐ½Ð¾ | Ð¾Ð±Ñ€Ð¾Ð±Ð¸Ð»Ð¸ | Ñ€Ð°Ñ…ÑƒÐ²Ð°Ð»Ð¸ | Ñ€Ð¾Ð±Ð¸Ð»Ð¸\n\n10. ÐžÑÐ½Ð¾Ð²Ð½Ñ– Ð¿Ð¾Ð½ÑÑ‚Ñ‚Ñ ___ Ñƒ Ð²ÑÑ‚ÑƒÐ¿Ñ–.\n    > [!answer] Ð²Ð¸Ð·Ð½Ð°Ñ‡ÐµÐ½Ð¾\n    > [!options] ÑÐºÐ°Ð·Ð°Ð»Ð¸ | Ð²Ð¸Ð·Ð½Ð°Ñ‡ÐµÐ½Ð¾ | Ð½Ð°Ð¿Ð¸ÑÐ°Ð»Ð¸ | Ð´Ð°Ð»Ð¸\n\n11. Ð•ÐºÑÐ¿ÐµÑ€Ð¸Ð¼ÐµÐ½Ñ‚ ___ Ñƒ ÐºÐ¾Ð½Ñ‚Ñ€Ð¾Ð»ÑŒÐ¾Ð²Ð°Ð½Ð¸Ñ… ÑƒÐ¼Ð¾Ð²Ð°Ñ….\n    > [!answer] Ð¿Ñ€Ð¾Ð²ÐµÐ´ÐµÐ½Ð¾\n    > [!options] Ð·Ñ€Ð¾Ð±Ð¸Ð»Ð¸ | Ð¿Ñ€Ð¾Ð²ÐµÐ´ÐµÐ½Ð¾ | Ð¼Ð°Ð»Ð¸ | Ñ€Ð¾Ð±Ð¸Ð»Ð¸\n\n12. Ð•Ñ„ÐµÐºÑ‚Ð¸Ð²Ð½Ñ–ÑÑ‚ÑŒ Ð¼ÐµÑ‚Ð¾Ð´Ñƒ ___ Ð½Ð° Ð¿Ñ€Ð°ÐºÑ‚Ð¸Ñ†Ñ–.\n    > [!answer] Ð´Ð¾Ð²ÐµÐ´ÐµÐ½Ð¾\n    > [!options] Ð¿Ð¾ÐºÐ°Ð·Ð°Ð»Ð¸ | Ð´Ð¾Ð²ÐµÐ´ÐµÐ½Ð¾ | Ð±Ð°Ñ‡Ð¸Ð»Ð¸ | Ð¼Ð°Ð»Ð¸\n\n13. Ð£ ÑÑ‚Ð°Ñ‚Ñ‚Ñ– ___ Ð½Ð¾Ð²Ñƒ Ñ‚ÐµÐ¾Ñ€Ñ–ÑŽ.\n    > [!answer] Ð·Ð°Ð¿Ñ€Ð¾Ð¿Ð¾Ð½Ð¾Ð²Ð°Ð½Ð¾\n    > [!options] Ð¿Ñ€Ð¸Ð´ÑƒÐ¼Ð°Ð»Ð¸ | Ð·Ð°Ð¿Ñ€Ð¾Ð¿Ð¾Ð½Ð¾Ð²Ð°Ð½Ð¾ | Ð´Ð°Ð»Ð¸ | Ð¿Ð¸ÑÐ°Ð»Ð¸\n\n14. Ð£ÑÑ– Ð°ÑÐ¿ÐµÐºÑ‚Ð¸ Ð¿Ñ€Ð¾Ð±Ð»ÐµÐ¼Ð¸ ___ Ð´ÐµÑ‚Ð°Ð»ÑŒÐ½Ð¾.\n    > [!answer] Ð¿Ñ€Ð¾Ð°Ð½Ð°Ð»Ñ–Ð·Ð¾Ð²Ð°Ð½Ð¾\n    > [!options] Ð¿Ð¾Ð´Ð¸Ð²Ð¸Ð»Ð¸ÑÑŒ | Ð¿Ñ€Ð¾Ð°Ð½Ð°Ð»Ñ–Ð·Ð¾Ð²Ð°Ð½Ð¾ | Ð±Ð°Ñ‡Ð¸Ð»Ð¸ | Ð¼Ð°Ð»Ð¸\n\n15. ÐœÐ°Ñ‚ÐµÑ€Ñ–Ð°Ð» ___ Ð·Ð° Ñ…Ñ€Ð¾Ð½Ð¾Ð»Ð¾Ð³Ñ–Ñ‡Ð½Ð¸Ð¼ Ð¿Ñ€Ð¸Ð½Ñ†Ð¸Ð¿Ð¾Ð¼.\n    > [!answer] ÑÐ¸ÑÑ‚ÐµÐ¼Ð°Ñ‚Ð¸Ð·Ð¾Ð²Ð°Ð½Ð¾\n    > [!options] Ð¿Ð¾ÐºÐ»Ð°Ð»Ð¸ | ÑÐ¸ÑÑ‚ÐµÐ¼Ð°Ñ‚Ð¸Ð·Ð¾Ð²Ð°Ð½Ð¾ | Ð·Ñ€Ð¾Ð±Ð¸Ð»Ð¸ | Ð¼Ð°Ð»Ð¸\n\n16. Ð ÐµÐ·ÑƒÐ»ÑŒÑ‚Ð°Ñ‚Ð¸ ___ Ð½Ð° Ð¼Ñ–Ð¶Ð½Ð°Ñ€Ð¾Ð´Ð½Ñ–Ð¹ ÐºÐ¾Ð½Ñ„ÐµÑ€ÐµÐ½Ñ†Ñ–Ñ—.\n    > [!answer] Ð¿Ñ€ÐµÐ´ÑÑ‚Ð°Ð²Ð»ÐµÐ½Ð¾\n    > [!options] Ð¿Ð¾ÐºÐ°Ð·Ð°Ð»Ð¸ | Ð¿Ñ€ÐµÐ´ÑÑ‚Ð°Ð²Ð»ÐµÐ½Ð¾ | Ð´Ð°Ð»Ð¸ | Ð¼Ð°Ð»Ð¸\n\n17. Ð£ Ñ€Ð¾Ð±Ð¾Ñ‚Ñ– ___ Ð½Ð¾Ð²Ñ– Ð¿Ñ–Ð´Ñ…Ð¾Ð´Ð¸.\n    > [!answer] Ñ€Ð¾Ð·Ñ€Ð¾Ð±Ð»ÐµÐ½Ð¾\n    > [!options] Ð¿Ñ€Ð¸Ð´ÑƒÐ¼Ð°Ð»Ð¸ | Ñ€Ð¾Ð·Ñ€Ð¾Ð±Ð»ÐµÐ½Ð¾ | Ð·Ñ€Ð¾Ð±Ð¸Ð»Ð¸ | Ð¼Ð°Ð»Ð¸\n\n18. Ð’Ð¸ÑÐ½Ð¾Ð²ÐºÐ¸ ___ Ð½Ð° Ð¾ÑÐ½Ð¾Ð²Ñ– ÐµÐ¼Ð¿Ñ–Ñ€Ð¸Ñ‡Ð½Ð¸Ñ… Ð´Ð°Ð½Ð¸Ñ….\n    > [!answer] ÑÑ„Ð¾Ñ€Ð¼ÑƒÐ»ÑŒÐ¾Ð²Ð°Ð½Ð¾\n    > [!options] Ð½Ð°Ð¿Ð¸ÑÐ°Ð»Ð¸ | ÑÑ„Ð¾Ñ€Ð¼ÑƒÐ»ÑŒÐ¾Ð²Ð°Ð½Ð¾ | Ð¿Ñ€Ð¸Ð´ÑƒÐ¼Ð°Ð»Ð¸ | Ð¼Ð°Ð»Ð¸\n\n---\n\n## error-correction: Ð ÐµÐ³Ñ–ÑÑ‚Ñ€Ð¾Ð²Ñ– Ð¿Ð¾Ð¼Ð¸Ð»ÐºÐ¸ Ñƒ Ð½Ð°ÑƒÐºÐ¾Ð²Ð¾Ð¼Ñƒ ÑÑ‚Ð¸Ð»Ñ–\n\n> Ð—Ð½Ð°Ð¹Ð´Ñ–Ñ‚ÑŒ Ð¿Ð¾Ð¼Ð¸Ð»ÐºÑƒ Ð² ÐºÐ¾Ð¶Ð½Ð¾Ð¼Ñƒ Ñ€ÐµÑ‡ÐµÐ½Ð½Ñ– Ñ‚Ð° Ð²Ð¸Ð¿Ñ€Ð°Ð²Ñ‚Ðµ Ñ—Ñ—.\n\n1. Ð£ Ð´Ð¾ÑÐ»Ñ–Ð´Ð¶ÐµÐ½Ð½Ñ– Ð±ÑƒÐ»Ð¾ Ð²ÑÑ‚Ð°Ð½Ð¾Ð²Ð»ÐµÐ½Ð¾, Ñ‰Ð¾ Ñ€ÐµÐ·ÑƒÐ»ÑŒÑ‚Ð°Ñ‚Ð¸ **ÐºÐ»Ð°ÑÐ½Ñ–**.\n   > [!error] ÐºÐ»Ð°ÑÐ½Ñ–\n   > [!answer] Ð·Ð½Ð°Ñ‡ÑƒÑ‰Ñ–\n   > [!options] ÐºÐ»Ð°ÑÐ½Ñ– | Ð·Ð½Ð°Ñ‡ÑƒÑ‰Ñ– | ÐºÑ€ÑƒÑ‚Ñ– | Ñ„Ð°Ð¹Ð½Ñ–\n   > [!explanation] Â«ÐšÐ»Ð°ÑÐ½Ñ–Â» â€” Ñ€Ð¾Ð·Ð¼Ð¾Ð²Ð½Ðµ ÑÐ»Ð¾Ð²Ð¾. Ð£ Ð½Ð°ÑƒÐºÐ¾Ð²Ð¾Ð¼Ñƒ ÑÑ‚Ð¸Ð»Ñ– Ð²Ð¸ÐºÐ¾Ñ€Ð¸ÑÑ‚Ð¾Ð²ÑƒÐ¹Ñ‚Ðµ Â«Ð·Ð½Ð°Ñ‡ÑƒÑ‰Ñ–Â», Â«Ð²Ð°Ð³Ð¾Ð¼Ñ–Â».\n\n2. ÐœÐµÑ‚Ð¾Ð´ **Ð·Ð°ÑÑ‚Ð¾ÑÑƒÐ²Ð°Ð»Ð¸ Ð¼Ð¸** Ð´Ð»Ñ Ð°Ð½Ð°Ð»Ñ–Ð·Ñƒ Ð´Ð°Ð½Ð¸Ñ….\n   > [!error] Ð·Ð°ÑÑ‚Ð¾ÑÑƒÐ²Ð°Ð»Ð¸ Ð¼Ð¸\n   > [!answer] Ð±ÑƒÐ»Ð¾ Ð·Ð°ÑÑ‚Ð¾ÑÐ¾Ð²Ð°Ð½Ð¾\n   > [!options] Ð·Ð°ÑÑ‚Ð¾ÑÑƒÐ²Ð°Ð»Ð¸ Ð¼Ð¸ | Ð±ÑƒÐ»Ð¾ Ð·Ð°ÑÑ‚Ð¾ÑÐ¾Ð²Ð°Ð½Ð¾ | Ð¼Ð¸ Ð·Ð°ÑÑ‚Ð¾ÑÑƒÐ²Ð°Ð»Ð¸ | Ð·Ð°ÑÑ‚Ð¾ÑÐ¾Ð²ÑƒÑ”Ð¼Ð¾\n   > [!explanation] Ð£ Ð½Ð°ÑƒÐºÐ¾Ð²Ð¾Ð¼Ñƒ ÑÑ‚Ð¸Ð»Ñ– ÑƒÐ½Ð¸ÐºÐ°Ð¹Ñ‚Ðµ Ð¾ÑÐ¾Ð±Ð¾Ð²Ð¸Ñ… Ð·Ð°Ð¹Ð¼ÐµÐ½Ð½Ð¸ÐºÑ–Ð²; Ð²Ð¸ÐºÐ¾Ñ€Ð¸ÑÑ‚Ð¾Ð²ÑƒÐ¹Ñ‚Ðµ Ð¿Ð°ÑÐ¸Ð².\n\n3. Ð”Ð¾ÑÐ»Ñ–Ð´Ð¶ÐµÐ½Ð½Ñ **Ñ€ÐµÐ°Ð»ÑŒÐ½Ð¾ Ð²Ð°Ð¶Ð»Ð¸Ð²Ðµ** Ð´Ð»Ñ Ð½Ð°ÑƒÐºÐ¸.\n   > [!error] Ñ€ÐµÐ°Ð»ÑŒÐ½Ð¾ Ð²Ð°Ð¶Ð»Ð¸Ð²Ðµ\n   > [!answer] Ð¼Ð°Ñ” Ð·Ð½Ð°Ñ‡Ð½Ñƒ Ð½Ð°ÑƒÐºÐ¾Ð²Ñƒ Ñ†Ñ–Ð½Ð½Ñ–ÑÑ‚ÑŒ\n   > [!options] Ñ€ÐµÐ°Ð»ÑŒÐ½Ð¾ Ð²Ð°Ð¶Ð»Ð¸Ð²Ðµ | Ð¼Ð°Ñ” Ð·Ð½Ð°Ñ‡Ð½Ñƒ Ð½Ð°ÑƒÐºÐ¾Ð²Ñƒ Ñ†Ñ–Ð½Ð½Ñ–ÑÑ‚ÑŒ | Ð´ÑƒÐ¶Ðµ ÐºÐ»Ð°ÑÐ½Ðµ | ÐºÑ€ÑƒÑ‚Ðµ\n   > [!explanation] Â«Ð ÐµÐ°Ð»ÑŒÐ½Ð¾Â» â€” Ñ€Ð¾Ð·Ð¼Ð¾Ð²Ð½Ð¸Ð¹ Ð¿Ñ–Ð´ÑÐ¸Ð»ÑŽÐ²Ð°Ñ‡. Ð—Ð°Ð¼Ñ–Ð½Ñ–Ñ‚ÑŒ Ð½Ð° Ñ„Ð¾Ñ€Ð¼Ð°Ð»ÑŒÐ½Ð¸Ð¹ Ð²Ð¸Ñ€Ð°Ð·.\n\n4. Ð ÐµÐ·ÑƒÐ»ÑŒÑ‚Ð°Ñ‚Ð¸ **Ð¿Ð¾ÐºÐ°Ð·Ð°Ð»Ð¸, Ñ‰Ð¾ Ð²Ð¾Ð½Ð¾ Ð¿Ñ€Ð°Ñ†ÑŽÑ”**.\n   > [!error] Ð¿Ð¾ÐºÐ°Ð·Ð°Ð»Ð¸, Ñ‰Ð¾ Ð²Ð¾Ð½Ð¾ Ð¿Ñ€Ð°Ñ†ÑŽÑ”\n   > [!answer] ÑÐ²Ñ–Ð´Ñ‡Ð°Ñ‚ÑŒ Ð¿Ñ€Ð¾ ÐµÑ„ÐµÐºÑ‚Ð¸Ð²Ð½Ñ–ÑÑ‚ÑŒ Ð¼ÐµÑ‚Ð¾Ð´Ñƒ\n   > [!options] Ð¿Ð¾ÐºÐ°Ð·Ð°Ð»Ð¸, Ñ‰Ð¾ Ð²Ð¾Ð½Ð¾ Ð¿Ñ€Ð°Ñ†ÑŽÑ” | ÑÐ²Ñ–Ð´Ñ‡Ð°Ñ‚ÑŒ Ð¿Ñ€Ð¾ ÐµÑ„ÐµÐºÑ‚Ð¸Ð²Ð½Ñ–ÑÑ‚ÑŒ Ð¼ÐµÑ‚Ð¾Ð´Ñƒ | ÐºÐ»Ð°ÑÐ½Ñ– | Ñ„Ð°Ð¹Ð½Ñ–\n   > [!explanation] Ð£Ð½Ð¸ÐºÐ°Ð¹Ñ‚Ðµ Ð½ÐµÐ²Ð¸Ð·Ð½Ð°Ñ‡ÐµÐ½Ð¸Ñ… Ð·Ð°Ð¹Ð¼ÐµÐ½Ð½Ð¸ÐºÑ–Ð²; Ñ„Ð¾Ñ€Ð¼ÑƒÐ»ÑŽÐ¹Ñ‚Ðµ ÐºÐ¾Ð½ÐºÑ€ÐµÑ‚Ð½Ð¾.\n\n5. **ÐœÐ¸ Ð´ÑƒÐ¼Ð°Ñ”Ð¼Ð¾**, Ñ‰Ð¾ Ð³Ñ–Ð¿Ð¾Ñ‚ÐµÐ·Ð° Ð¿Ñ€Ð°Ð²Ð¸Ð»ÑŒÐ½Ð°.\n   > [!error] ÐœÐ¸ Ð´ÑƒÐ¼Ð°Ñ”Ð¼Ð¾\n   > [!answer] Ð„ Ð¿Ñ–Ð´ÑÑ‚Ð°Ð²Ð¸ Ð²Ð²Ð°Ð¶Ð°Ñ‚Ð¸\n   > [!options] ÐœÐ¸ Ð´ÑƒÐ¼Ð°Ñ”Ð¼Ð¾ | Ð„ Ð¿Ñ–Ð´ÑÑ‚Ð°Ð²Ð¸ Ð²Ð²Ð°Ð¶Ð°Ñ‚Ð¸ | ÐÐ°Ð¼ Ð·Ð´Ð°Ñ”Ñ‚ÑŒÑÑ | Ð’Ð²Ð°Ð¶Ð°Ñ”Ð¼Ð¾\n   > [!explanation] Ð£Ð½Ð¸ÐºÐ°Ð¹Ñ‚Ðµ ÑÑƒÐ±'Ñ”ÐºÑ‚Ð¸Ð²Ð½Ð¸Ñ… Ñ„Ð¾Ñ€Ð¼ÑƒÐ»ÑŽÐ²Ð°Ð½ÑŒ; Ð²Ð¸ÐºÐ¾Ñ€Ð¸ÑÑ‚Ð¾Ð²ÑƒÐ¹Ñ‚Ðµ Ð±ÐµÐ·Ð¾ÑÐ¾Ð±Ð¾Ð²Ñ–.\n\n6. Ð•ÐºÑÐ¿ÐµÑ€Ð¸Ð¼ÐµÐ½Ñ‚ **Ð¿Ñ€Ð¾Ð²ÐµÐ»Ð¸ Ð´ÐµÑÑŒ Ñ‚Ð¸Ð¶Ð´ÐµÐ½ÑŒ Ð½Ð°Ð·Ð°Ð´**.\n   > [!error] Ð´ÐµÑÑŒ Ñ‚Ð¸Ð¶Ð´ÐµÐ½ÑŒ Ð½Ð°Ð·Ð°Ð´\n   > [!answer] Ð¿Ñ€Ð¾Ñ‚ÑÐ³Ð¾Ð¼ Ð¿Ð¾Ð¿ÐµÑ€ÐµÐ´Ð½ÑŒÐ¾Ð³Ð¾ Ñ‚Ð¸Ð¶Ð½Ñ\n   > [!options] Ð´ÐµÑÑŒ Ñ‚Ð¸Ð¶Ð´ÐµÐ½ÑŒ Ð½Ð°Ð·Ð°Ð´ | Ð¿Ñ€Ð¾Ñ‚ÑÐ³Ð¾Ð¼ Ð¿Ð¾Ð¿ÐµÑ€ÐµÐ´Ð½ÑŒÐ¾Ð³Ð¾ Ñ‚Ð¸Ð¶Ð½Ñ | ÑÐºÐ¾ÑÑŒ Ð½ÐµÑ‰Ð¾Ð´Ð°Ð²Ð½Ð¾ | Ð´Ð½ÑÐ¼Ð¸\n   > [!explanation] Â«Ð”ÐµÑÑŒÂ» â€” Ñ€Ð¾Ð·Ð¼Ð¾Ð²Ð½Ðµ. Ð£ Ð½Ð°ÑƒÐºÐ¾Ð²Ð¾Ð¼Ñƒ ÑÑ‚Ð¸Ð»Ñ– Ð²ÐºÐ°Ð·ÑƒÐ¹Ñ‚Ðµ Ñ‚Ð¾Ñ‡Ð½Ñ– Ñ‡Ð°ÑÐ¾Ð²Ñ– Ñ€Ð°Ð¼ÐºÐ¸.\n\n7. Ð”Ð°Ð½Ñ– **ÐºÐ»ÑŒÐ¾Ð²Ð¾ Ð¿Ñ–Ð´Ñ‚Ð²ÐµÑ€Ð´Ð¸Ð»Ð¸** Ð½Ð°ÑˆÑƒ Ñ‚ÐµÐ¾Ñ€Ñ–ÑŽ.\n   > [!error] ÐºÐ»ÑŒÐ¾Ð²Ð¾ Ð¿Ñ–Ð´Ñ‚Ð²ÐµÑ€Ð´Ð¸Ð»Ð¸\n   > [!answer] Ð¿ÐµÑ€ÐµÐºÐ¾Ð½Ð»Ð¸Ð²Ð¾ Ð¿Ñ–Ð´Ñ‚Ð²ÐµÑ€Ð´Ð¶ÑƒÑŽÑ‚ÑŒ\n   > [!options] ÐºÐ»ÑŒÐ¾Ð²Ð¾ Ð¿Ñ–Ð´Ñ‚Ð²ÐµÑ€Ð´Ð¸Ð»Ð¸ | Ð¿ÐµÑ€ÐµÐºÐ¾Ð½Ð»Ð¸Ð²Ð¾ Ð¿Ñ–Ð´Ñ‚Ð²ÐµÑ€Ð´Ð¶ÑƒÑŽÑ‚ÑŒ | ÐºÐ»Ð°ÑÐ½Ð¾ Ð´Ð¾Ð²ÐµÐ»Ð¸ | Ñ€ÐµÐ°Ð»ÑŒÐ½Ð¾ Ð¿Ð¾ÐºÐ°Ð·Ð°Ð»Ð¸\n   > [!explanation] Â«ÐšÐ»ÑŒÐ¾Ð²Ð¾Â» â€” ÑÐ»ÐµÐ½Ð³. Ð’Ð¸ÐºÐ¾Ñ€Ð¸ÑÑ‚Ð¾Ð²ÑƒÐ¹Ñ‚Ðµ Â«Ð¿ÐµÑ€ÐµÐºÐ¾Ð½Ð»Ð¸Ð²Ð¾Â», Â«Ð±ÐµÐ·Ð·Ð°Ð¿ÐµÑ€ÐµÑ‡Ð½Ð¾Â».\n\n8. Ð£ ÑÑ‚Ð°Ñ‚Ñ‚Ñ– **Ð½Ñ–Ñ‡Ð¾Ð³Ð¾ Ð½Ð¾Ð²Ð¾Ð³Ð¾, Ð°Ð»Ðµ Ð¾Ðº**.\n   > [!error] Ð½Ñ–Ñ‡Ð¾Ð³Ð¾ Ð½Ð¾Ð²Ð¾Ð³Ð¾, Ð°Ð»Ðµ Ð¾Ðº\n   > [!answer] Ð¿Ñ–Ð´Ñ‚Ð²ÐµÑ€Ð´Ð¶ÐµÐ½Ð¾ Ñ€Ð°Ð½Ñ–ÑˆÐµ Ð²Ñ–Ð´Ð¾Ð¼Ñ– Ñ€ÐµÐ·ÑƒÐ»ÑŒÑ‚Ð°Ñ‚Ð¸\n   > [!options] Ð½Ñ–Ñ‡Ð¾Ð³Ð¾ Ð½Ð¾Ð²Ð¾Ð³Ð¾, Ð°Ð»Ðµ Ð¾Ðº | Ð¿Ñ–Ð´Ñ‚Ð²ÐµÑ€Ð´Ð¶ÐµÐ½Ð¾ Ñ€Ð°Ð½Ñ–ÑˆÐµ Ð²Ñ–Ð´Ð¾Ð¼Ñ– Ñ€ÐµÐ·ÑƒÐ»ÑŒÑ‚Ð°Ñ‚Ð¸ | Ð²ÑÐµ ÑÑ‚Ð°Ñ€Ðµ | Ð½Ð¾Ñ€Ð¼Ð°Ð»ÑŒÐ½Ð¾\n   > [!explanation] Ð Ð¾Ð·Ð¼Ð¾Ð²Ð½Ð° Ð¾Ñ†Ñ–Ð½ÐºÐ° Ð½ÐµÐ¿Ñ€Ð¸Ð¿ÑƒÑÑ‚Ð¸Ð¼Ð°. Ð¤Ð¾Ñ€Ð¼ÑƒÐ»ÑŽÐ¹Ñ‚Ðµ Ð½ÐµÐ¹Ñ‚Ñ€Ð°Ð»ÑŒÐ½Ð¾.\n\n9. ÐŸÑ€Ð¾Ð±Ð»ÐµÐ¼Ñƒ Ð´Ð¾ÑÐ»Ñ–Ð´Ð¶ÑƒÐ²Ð°Ð»Ð¸, Ñ– **Ð²ÑÐµ Ð²Ð¸Ð¹ÑˆÐ»Ð¾ Ð´Ð¾Ð±Ñ€Ðµ**.\n   > [!error] Ð²ÑÐµ Ð²Ð¸Ð¹ÑˆÐ»Ð¾ Ð´Ð¾Ð±Ñ€Ðµ\n   > [!answer] Ð¾Ñ‚Ñ€Ð¸Ð¼Ð°Ð½Ð¾ Ð¾Ñ‡Ñ–ÐºÑƒÐ²Ð°Ð½Ñ– Ñ€ÐµÐ·ÑƒÐ»ÑŒÑ‚Ð°Ñ‚Ð¸\n   > [!options] Ð²ÑÐµ Ð²Ð¸Ð¹ÑˆÐ»Ð¾ Ð´Ð¾Ð±Ñ€Ðµ | Ð¾Ñ‚Ñ€Ð¸Ð¼Ð°Ð½Ð¾ Ð¾Ñ‡Ñ–ÐºÑƒÐ²Ð°Ð½Ñ– Ñ€ÐµÐ·ÑƒÐ»ÑŒÑ‚Ð°Ñ‚Ð¸ | ÐºÐ»Ð°ÑÐ½Ð¾ Ð²Ð¸Ð¹ÑˆÐ»Ð¾ | Ð½Ð¾Ñ€Ð¼\n   > [!explanation] Â«Ð”Ð¾Ð±Ñ€Ðµ Ð²Ð¸Ð¹ÑˆÐ»Ð¾Â» â€” Ñ€Ð¾Ð·Ð¼Ð¾Ð²Ð½Ðµ. ÐšÐ¾Ð½ÐºÑ€ÐµÑ‚Ð¸Ð·ÑƒÐ¹Ñ‚Ðµ Ñ€ÐµÐ·ÑƒÐ»ÑŒÑ‚Ð°Ñ‚.\n\n10. **Ð¢Ð¸Ð¿Ñƒ**, Ñ†Ðµ Ð´Ð¾ÑÐ»Ñ–Ð´Ð¶ÐµÐ½Ð½Ñ Ð²Ð°Ð¶Ð»Ð¸Ð²Ðµ.\n    > [!error] Ð¢Ð¸Ð¿Ñƒ\n    > [!answer] Ð‘ÐµÐ·Ð¿ÐµÑ€ÐµÑ‡Ð½Ð¾\n    > [!options] Ð¢Ð¸Ð¿Ñƒ | Ð‘ÐµÐ·Ð¿ÐµÑ€ÐµÑ‡Ð½Ð¾ | ÐÑƒ | ÐžÑ‚\n    > [!explanation] Â«Ð¢Ð¸Ð¿ÑƒÂ» â€” ÑÐ»ÐµÐ½Ð³Ð¾Ð²Ðµ ÑÐ»Ð¾Ð²Ð¾-Ð¿Ð°Ñ€Ð°Ð·Ð¸Ñ‚. Ð’Ð¸Ð´Ð°Ð»Ñ–Ñ‚ÑŒ Ð°Ð±Ð¾ Ð·Ð°Ð¼Ñ–Ð½Ñ–Ñ‚ÑŒ.\n\n11. Ð’Ð¸ÐºÐ¾Ñ€Ð¸ÑÑ‚Ð°Ð½Ð¾ **Ð½Ð¾Ñ€Ð¼Ð°Ð»ÑŒÐ½Ð¸Ð¹** Ð¼ÐµÑ‚Ð¾Ð´.\n    > [!error] Ð½Ð¾Ñ€Ð¼Ð°Ð»ÑŒÐ½Ð¸Ð¹\n    > [!answer] ÑÑ‚Ð°Ð½Ð´Ð°Ñ€Ñ‚Ð½Ð¸Ð¹\n    > [!options] Ð½Ð¾Ñ€Ð¼Ð°Ð»ÑŒÐ½Ð¸Ð¹ | ÑÑ‚Ð°Ð½Ð´Ð°Ñ€Ñ‚Ð½Ð¸Ð¹ | Ð·Ð²Ð¸Ñ‡Ð°Ð¹Ð½Ð¸Ð¹ | Ñ‚Ð°ÐºÐ¸Ð¹ ÑÐ¾Ð±Ñ–\n    > [!explanation] Â«ÐÐ¾Ñ€Ð¼Ð°Ð»ÑŒÐ½Ð¸Ð¹Â» Ð·Ð°Ð½Ð°Ð´Ñ‚Ð¾ Ñ€Ð¾Ð·Ð¼Ð¾Ð²Ð½Ðµ. Ð’Ð¶Ð¸Ð²Ð°Ð¹Ñ‚Ðµ Â«ÑÑ‚Ð°Ð½Ð´Ð°Ñ€Ñ‚Ð½Ð¸Ð¹Â», Â«Ð·Ð°Ð³Ð°Ð»ÑŒÐ½Ð¾Ð¿Ñ€Ð¸Ð¹Ð½ÑÑ‚Ð¸Ð¹Â».\n\n12. Ð ÐµÐ·ÑƒÐ»ÑŒÑ‚Ð°Ñ‚Ð¸ Ð¾Ð¿ÑƒÐ±Ð»Ñ–ÐºÐ¾Ð²Ð°Ð½Ð¾ Ð² Ð¶ÑƒÑ€Ð½Ð°Ð»Ñ–.\n    > [!error] none\n    > [!answer] âœ“\n    > [!explanation] Ð ÐµÑ‡ÐµÐ½Ð½Ñ ÐºÐ¾Ñ€ÐµÐºÑ‚Ð½Ðµ â€” Ñ„Ð¾Ñ€Ð¼Ð° Ð½Ð° -Ð½Ð¾/-Ñ‚Ð¾ Ð´Ð¾Ñ€ÐµÑ‡Ð½Ð° Ð´Ð»Ñ Ð½Ð°ÑƒÐºÐ¾Ð²Ð¾Ð³Ð¾ ÑÑ‚Ð¸Ð»ÑŽ.\n\n13. **ÐÑƒ, Ð·Ð°Ð³Ð°Ð»Ð¾Ð¼**, Ð´Ð¾ÑÐ»Ñ–Ð´Ð¶ÐµÐ½Ð½Ñ Ð²Ð´Ð°Ð»Ðµ.\n    > [!error] ÐÑƒ, Ð·Ð°Ð³Ð°Ð»Ð¾Ð¼\n    > [!answer] Ð—Ð°Ð³Ð°Ð»Ð¾Ð¼\n    > [!options] ÐÑƒ, Ð·Ð°Ð³Ð°Ð»Ð¾Ð¼ | Ð—Ð°Ð³Ð°Ð»Ð¾Ð¼ | ÐÑƒ | ÐÑƒ Ñ‚Ð¸Ð¿Ñƒ\n    > [!explanation] Â«ÐÑƒÂ» â€” ÑƒÑÐ½Ðµ ÑÐ»Ð¾Ð²Ð¾-Ð¿Ð°Ñ€Ð°Ð·Ð¸Ñ‚. Ð’Ð¸Ð´Ð°Ð»Ñ–Ñ‚ÑŒ Ð¹Ð¾Ð³Ð¾.\n\n14. ÐœÐµÑ‚Ð¾Ð´ **Ñ‚Ð¸Ð¿Ñƒ ÐµÑ„ÐµÐºÑ‚Ð¸Ð²Ð½Ð¸Ð¹**.\n    > [!error] Ñ‚Ð¸Ð¿Ñƒ ÐµÑ„ÐµÐºÑ‚Ð¸Ð²Ð½Ð¸Ð¹\n    > [!answer] Ñ” ÐµÑ„ÐµÐºÑ‚Ð¸Ð²Ð½Ð¸Ð¼\n    > [!options] Ñ‚Ð¸Ð¿Ñƒ ÐµÑ„ÐµÐºÑ‚Ð¸Ð²Ð½Ð¸Ð¹ | Ñ” ÐµÑ„ÐµÐºÑ‚Ð¸Ð²Ð½Ð¸Ð¼ | Ñ‚Ð¸Ð¿Ñƒ Ð¿Ñ€Ð°Ñ†ÑŽÑ” | Ð½Ð¾Ñ€Ð¼\n    > [!explanation] Ð’Ð¸Ð´Ð°Ð»Ñ–Ñ‚ÑŒ Â«Ñ‚Ð¸Ð¿ÑƒÂ»; Ñ„Ð¾Ñ€Ð¼ÑƒÐ»ÑŽÐ¹Ñ‚Ðµ Ñ‡Ñ–Ñ‚ÐºÐ¾.\n\n15. **Ð¯ Ð´ÑƒÐ¼Ð°ÑŽ**, Ñ‰Ð¾ Ñ†Ðµ Ð²Ð°Ð¶Ð»Ð¸Ð²Ð¾.\n    > [!error] Ð¯ Ð´ÑƒÐ¼Ð°ÑŽ\n    > [!answer] Ð’Ð°Ñ€Ñ‚Ð¾ Ð·Ð°Ð·Ð½Ð°Ñ‡Ð¸Ñ‚Ð¸\n    > [!options] Ð¯ Ð´ÑƒÐ¼Ð°ÑŽ | Ð’Ð°Ñ€Ñ‚Ð¾ Ð·Ð°Ð·Ð½Ð°Ñ‡Ð¸Ñ‚Ð¸ | ÐœÐµÐ½Ñ– Ð·Ð´Ð°Ñ”Ñ‚ÑŒÑÑ | Ð¯ Ð²Ð²Ð°Ð¶Ð°ÑŽ\n    > [!explanation] Ð£Ð½Ð¸ÐºÐ°Ð¹Ñ‚Ðµ Â«Ð¯Â» Ð² Ð½Ð°ÑƒÐºÐ¾Ð²Ð¾Ð¼Ñƒ ÑÑ‚Ð¸Ð»Ñ–; Ð²Ð¸ÐºÐ¾Ñ€Ð¸ÑÑ‚Ð¾Ð²ÑƒÐ¹Ñ‚Ðµ Ð±ÐµÐ·Ð¾ÑÐ¾Ð±Ð¾Ð²Ñ– ÐºÐ¾Ð½ÑÑ‚Ñ€ÑƒÐºÑ†Ñ–Ñ—.\n\n16. Ð”Ð¾ÑÐ»Ñ–Ð´Ð¶ÐµÐ½Ð½Ñ Ð¿Ñ€Ð¾Ð²ÐµÐ´ÐµÐ½Ð¾ ÑÐºÑ–ÑÐ½Ð¾.\n    > [!error] none\n    > [!answer] âœ“\n    > [!explanation] Ð ÐµÑ‡ÐµÐ½Ð½Ñ ÐºÐ¾Ñ€ÐµÐºÑ‚Ð½Ðµ â€” Ð°Ð´Ð²ÐµÑ€Ð± Â«ÑÐºÑ–ÑÐ½Ð¾Â» Ð´Ð¾Ñ€ÐµÑ‡Ð½Ð¸Ð¹ Ñƒ Ñ†ÑŒÐ¾Ð¼Ñƒ ÐºÐ¾Ð½Ñ‚ÐµÐºÑÑ‚Ñ–.\n\n17. Ð ÐµÐ·ÑƒÐ»ÑŒÑ‚Ð°Ñ‚Ð¸ **ÑÑƒÐ¿ÐµÑ€ Ð²Ð°Ð¶Ð»Ð¸Ð²Ñ–** Ð´Ð»Ñ Ð³Ð°Ð»ÑƒÐ·Ñ–.\n    > [!error] ÑÑƒÐ¿ÐµÑ€ Ð²Ð°Ð¶Ð»Ð¸Ð²Ñ–\n    > [!answer] Ð¼Ð°ÑŽÑ‚ÑŒ ÑÑƒÑ‚Ñ‚Ñ”Ð²Ðµ Ð·Ð½Ð°Ñ‡ÐµÐ½Ð½Ñ\n    > [!options] ÑÑƒÐ¿ÐµÑ€ Ð²Ð°Ð¶Ð»Ð¸Ð²Ñ– | Ð¼Ð°ÑŽÑ‚ÑŒ ÑÑƒÑ‚Ñ‚Ñ”Ð²Ðµ Ð·Ð½Ð°Ñ‡ÐµÐ½Ð½Ñ | Ð´ÑƒÐ¶Ðµ ÐºÑ€ÑƒÑ‚Ñ– | Ð´Ð¸ÐºÐ¾ Ð²Ð°Ð¶Ð»Ð¸Ð²Ñ–\n    > [!explanation] Â«Ð¡ÑƒÐ¿ÐµÑ€Â» â€” Ñ€Ð¾Ð·Ð¼Ð¾Ð²Ð½Ð¸Ð¹ Ð¿Ñ–Ð´ÑÐ¸Ð»ÑŽÐ²Ð°Ñ‡. Ð—Ð°Ð¼Ñ–Ð½Ñ–Ñ‚ÑŒ Ð½Ð° Ñ„Ð¾Ñ€Ð¼Ð°Ð»ÑŒÐ½Ð¸Ð¹ Ð²Ð¸Ñ€Ð°Ð·.\n\n18. Ð¡Ñ‚Ð°Ñ‚Ð¸ÑÑ‚Ð¸Ñ‡Ð½Ð¸Ð¹ Ð°Ð½Ð°Ð»Ñ–Ð· **Ð¿Ð¾ÐºÐ°Ð·Ð°Ð² Ð½Ð¾Ñ€Ð¼ Ñ€ÐµÐ·ÑƒÐ»ÑŒÑ‚Ð°Ñ‚Ð¸**.\n    > [!error] Ð½Ð¾Ñ€Ð¼ Ñ€ÐµÐ·ÑƒÐ»ÑŒÑ‚Ð°Ñ‚Ð¸\n    > [!answer] Ð²Ð°Ð»Ñ–Ð´Ð½Ñ– Ñ€ÐµÐ·ÑƒÐ»ÑŒÑ‚Ð°Ñ‚Ð¸\n    > [!options] Ð½Ð¾Ñ€Ð¼ Ñ€ÐµÐ·ÑƒÐ»ÑŒÑ‚Ð°Ñ‚Ð¸ | Ð²Ð°Ð»Ñ–Ð´Ð½Ñ– Ñ€ÐµÐ·ÑƒÐ»ÑŒÑ‚Ð°Ñ‚Ð¸ | Ð¾Ðº Ñ€ÐµÐ·ÑƒÐ»ÑŒÑ‚Ð°Ñ‚Ð¸ | Ð½Ð¾Ñ€Ð¼Ð°Ð»ÑŒÐ½Ñ–\n    > [!explanation] Â«ÐÐ¾Ñ€Ð¼Â» â€” ÑÐ»ÐµÐ½Ð³. Ð’Ð¸ÐºÐ¾Ñ€Ð¸ÑÑ‚Ð¾Ð²ÑƒÐ¹Ñ‚Ðµ Â«Ð²Ð°Ð»Ñ–Ð´Ð½Ñ–Â», Â«ÑÑ‚Ð°Ñ‚Ð¸ÑÑ‚Ð¸Ñ‡Ð½Ð¾ Ð·Ð½Ð°Ñ‡ÑƒÑ‰Ñ–Â».\n\n---\n\n## error-correction: ÐŸÐ°ÑÐ¸Ð²Ð½Ð¸Ð¹ ÑÑ‚Ð°Ð½ â€” Ð¿Ð¾Ð¼Ð¸Ð»ÐºÐ¸ Ñ„Ð¾Ñ€Ð¼ÑƒÐ²Ð°Ð½Ð½Ñ\n\n> Ð—Ð½Ð°Ð¹Ð´Ñ–Ñ‚ÑŒ Ð³Ñ€Ð°Ð¼Ð°Ñ‚Ð¸Ñ‡Ð½Ñƒ Ð¿Ð¾Ð¼Ð¸Ð»ÐºÑƒ Ñƒ Ñ„Ð¾Ñ€Ð¼ÑƒÐ²Ð°Ð½Ð½Ñ– Ð¿Ð°ÑÐ¸Ð²Ð½Ð¾Ð³Ð¾ ÑÑ‚Ð°Ð½Ñƒ.\n\n1. Ð”Ð¾ÐºÑƒÐ¼ÐµÐ½Ñ‚ Ð±ÑƒÐ»Ð¾ **Ð¿Ñ–Ð´Ð¿Ð¸ÑÐ°Ð½Ð¸Ð¹** Ð´Ð¸Ñ€ÐµÐºÑ‚Ð¾Ñ€Ð¾Ð¼.\n   > [!error] Ð¿Ñ–Ð´Ð¿Ð¸ÑÐ°Ð½Ð¸Ð¹\n   > [!answer] Ð¿Ñ–Ð´Ð¿Ð¸ÑÐ°Ð½Ð¾\n   > [!options] Ð¿Ñ–Ð´Ð¿Ð¸ÑÐ°Ð½Ð¸Ð¹ | Ð¿Ñ–Ð´Ð¿Ð¸ÑÐ°Ð½Ð¾ | Ð¿Ñ–Ð´Ð¿Ð¸ÑÐ°Ñ‚Ð¸ | Ð¿Ñ–Ð´Ð¿Ð¸ÑÑƒÑ”\n   > [!explanation] ÐŸÑ–ÑÐ»Ñ Â«Ð±ÑƒÐ»Ð¾Â» Ð²Ð¸ÐºÐ¾Ñ€Ð¸ÑÑ‚Ð¾Ð²ÑƒÐ¹Ñ‚Ðµ Ñ„Ð¾Ñ€Ð¼Ñƒ Ð½Ð° -Ð½Ð¾/-Ñ‚Ð¾: Â«Ð±ÑƒÐ»Ð¾ Ð¿Ñ–Ð´Ð¿Ð¸ÑÐ°Ð½Ð¾Â».\n\n2. Ð ÐµÐ·ÑƒÐ»ÑŒÑ‚Ð°Ñ‚Ð¸ **Ð¾Ð³Ð¾Ð»Ð¾ÑˆÑƒÐ²Ð°Ð½Ð¾** Ð½Ð° ÐºÐ¾Ð½Ñ„ÐµÑ€ÐµÐ½Ñ†Ñ–Ñ—.\n   > [!error] Ð¾Ð³Ð¾Ð»Ð¾ÑˆÑƒÐ²Ð°Ð½Ð¾\n   > [!answer] Ð¾Ð³Ð¾Ð»Ð¾ÑˆÐµÐ½Ð¾\n   > [!options] Ð¾Ð³Ð¾Ð»Ð¾ÑˆÑƒÐ²Ð°Ð½Ð¾ | Ð¾Ð³Ð¾Ð»Ð¾ÑˆÐµÐ½Ð¾ | Ð¾Ð³Ð¾Ð»Ð¾ÑˆÑƒÑŽÑ‚ÑŒÑÑ | Ð¾Ð³Ð¾Ð»Ð¾ÑˆÑƒÐ²Ð°Ð»Ð¸\n   > [!explanation] ÐÐµÐ¿Ñ€Ð°Ð²Ð¸Ð»ÑŒÐ½Ð° Ñ„Ð¾Ñ€Ð¼Ð°. ÐŸÑ€Ð°Ð²Ð¸Ð»ÑŒÐ½Ð¾: Â«Ð¾Ð³Ð¾Ð»Ð¾ÑˆÐµÐ½Ð¾Â» (Ð²Ñ–Ð´ Â«Ð¾Ð³Ð¾Ð»Ð¾ÑÐ¸Ñ‚Ð¸Â»).\n\n3. Ð¡Ñ‚Ð°Ñ‚Ñ‚ÑŽ **Ð½Ð°Ð¿Ð¸ÑÐ°Ð½Ð¸Ð¹** Ð¿Ñ€Ð¾Ñ„ÐµÑÐ¾Ñ€Ð¾Ð¼.\n   > [!error] Ð½Ð°Ð¿Ð¸ÑÐ°Ð½Ð¸Ð¹\n   > [!answer] Ð½Ð°Ð¿Ð¸ÑÐ°Ð½Ð¾\n   > [!options] Ð½Ð°Ð¿Ð¸ÑÐ°Ð½Ð¸Ð¹ | Ð½Ð°Ð¿Ð¸ÑÐ°Ð½Ð¾ | Ð½Ð°Ð¿Ð¸ÑÐ°Ñ‚Ð¸ | Ð¿Ð¸ÑˆÐµÑ‚ÑŒÑÑ\n   > [!explanation] ÐŸÑ–ÑÐ»Ñ Â«ÑÑ‚Ð°Ñ‚Ñ‚ÑŽÂ» (Ð·Ð½Ð°Ñ…Ñ–Ð´Ð½Ð¸Ð¹ Ð²Ñ–Ð´Ð¼Ñ–Ð½Ð¾Ðº) Ð¿Ð¾Ñ‚Ñ€Ñ–Ð±Ð½Ð¾ Â«Ð½Ð°Ð¿Ð¸ÑÐ°Ð½Ð¾Â».\n\n4. Ð—Ð°ÐºÐ¾Ð½ **ÑƒÑ…Ð²Ð°Ð»ÐµÐ½Ð¾Ð³Ð¾** Ð¿Ð°Ñ€Ð»Ð°Ð¼ÐµÐ½Ñ‚Ð¾Ð¼.\n   > [!error] ÑƒÑ…Ð²Ð°Ð»ÐµÐ½Ð¾Ð³Ð¾\n   > [!answer] ÑƒÑ…Ð²Ð°Ð»ÐµÐ½Ð¾\n   > [!options] ÑƒÑ…Ð²Ð°Ð»ÐµÐ½Ð¾Ð³Ð¾ | ÑƒÑ…Ð²Ð°Ð»ÐµÐ½Ð¾ | ÑƒÑ…Ð²Ð°Ð»ÐµÐ½Ð¸Ð¹ | ÑƒÑ…Ð²Ð°Ð»ÑŽÑ”Ñ‚ÑŒÑÑ\n   > [!explanation] ÐÐµÐ¿Ñ€Ð°Ð²Ð¸Ð»ÑŒÐ½Ð¸Ð¹ Ð²Ñ–Ð´Ð¼Ñ–Ð½Ð¾Ðº. ÐŸÑ€Ð°Ð²Ð¸Ð»ÑŒÐ½Ð¾: Â«ÑƒÑ…Ð²Ð°Ð»ÐµÐ½Ð¾Â».\n\n5. Ð”Ð¾ÑÐ»Ñ–Ð´Ð¶ÐµÐ½Ð½Ñ **Ð¿Ñ€Ð¾Ð²ÐµÐ´ÐµÐ½Ð¸Ð¹** ÑƒÑÐ¿Ñ–ÑˆÐ½Ð¾.\n   > [!error] Ð¿Ñ€Ð¾Ð²ÐµÐ´ÐµÐ½Ð¸Ð¹\n   > [!answer] Ð¿Ñ€Ð¾Ð²ÐµÐ´ÐµÐ½Ð¾\n   > [!options] Ð¿Ñ€Ð¾Ð²ÐµÐ´ÐµÐ½Ð¸Ð¹ | Ð¿Ñ€Ð¾Ð²ÐµÐ´ÐµÐ½Ð¾ | Ð¿Ñ€Ð¾Ð²Ð¾Ð´Ð¸Ñ‚ÑŒÑÑ | Ð¿Ñ€Ð¾Ð²ÐµÐ»Ð¸\n   > [!explanation] Â«Ð”Ð¾ÑÐ»Ñ–Ð´Ð¶ÐµÐ½Ð½ÑÂ» â€” ÑÐµÑ€ÐµÐ´Ð½Ñ–Ð¹ Ñ€Ñ–Ð´; Ñ„Ð¾Ñ€Ð¼Ð° Ð½Ð° -Ð½Ð¾/-Ñ‚Ð¾ Ñ” Ð±ÐµÐ·Ð¾ÑÐ¾Ð±Ð¾Ð²Ð¾ÑŽ.\n\n6. ÐœÐµÑ‚Ð¾Ð´ Ð±ÑƒÐ»Ð¾ Ð·Ð°ÑÑ‚Ð¾ÑÐ¾Ð²Ð°Ð½Ð¾ ÑƒÑÐ¿Ñ–ÑˆÐ½Ð¾.\n   > [!error] none\n   > [!answer] âœ“\n   > [!explanation] Ð ÐµÑ‡ÐµÐ½Ð½Ñ ÐºÐ¾Ñ€ÐµÐºÑ‚Ð½Ðµ â€” Â«Ð±ÑƒÐ»Ð¾ Ð·Ð°ÑÑ‚Ð¾ÑÐ¾Ð²Ð°Ð½Ð¾Â» Ð¿Ñ€Ð°Ð²Ð¸Ð»ÑŒÐ½Ð° Ñ„Ð¾Ñ€Ð¼Ð° Ð¼Ð¸Ð½ÑƒÐ»Ð¾Ð³Ð¾ Ñ‡Ð°ÑÑƒ.\n\n7. ÐŸÑ€Ð¾Ð±Ð»ÐµÐ¼Ð° **Ñ€Ð¾Ð·Ð²'ÑÐ·ÑƒÑŽÑ‚ÑŒÑÑ** ÐºÐ¾Ð¼Ð°Ð½Ð´Ð¾ÑŽ.\n   > [!error] Ñ€Ð¾Ð·Ð²'ÑÐ·ÑƒÑŽÑ‚ÑŒÑÑ\n   > [!answer] Ñ€Ð¾Ð·Ð²'ÑÐ·ÑƒÑ”Ñ‚ÑŒÑÑ\n   > [!options] Ñ€Ð¾Ð·Ð²'ÑÐ·ÑƒÑŽÑ‚ÑŒÑÑ | Ñ€Ð¾Ð·Ð²'ÑÐ·ÑƒÑ”Ñ‚ÑŒÑÑ | Ñ€Ð¾Ð·Ð²'ÑÐ·Ð°Ð½Ð¾ | Ñ€Ð¾Ð·Ð²'ÑÐ·ÑƒÐ²Ð°Ð»Ð¸\n   > [!explanation] Â«ÐŸÑ€Ð¾Ð±Ð»ÐµÐ¼Ð°Â» â€” Ð¾Ð´Ð½Ð¸Ð½Ð°, Ñ‚Ð¾Ð¼Ñƒ Ð´Ñ–Ñ”ÑÐ»Ð¾Ð²Ð¾ Ñ‚Ð°ÐºÐ¾Ð¶ Ð² Ð¾Ð´Ð½Ð¸Ð½Ñ–.\n\n8. Ð£ÑÑ– Ð´Ð¾ÐºÑƒÐ¼ÐµÐ½Ñ‚Ð¸ **Ð¿ÐµÑ€ÐµÐ²Ñ–Ñ€ÐµÐ½Ð¾Ð³Ð¾** ÐºÐ¾Ð¼Ñ–ÑÑ–Ñ”ÑŽ.\n   > [!error] Ð¿ÐµÑ€ÐµÐ²Ñ–Ñ€ÐµÐ½Ð¾Ð³Ð¾\n   > [!answer] Ð¿ÐµÑ€ÐµÐ²Ñ–Ñ€ÐµÐ½Ð¾\n   > [!options] Ð¿ÐµÑ€ÐµÐ²Ñ–Ñ€ÐµÐ½Ð¾Ð³Ð¾ | Ð¿ÐµÑ€ÐµÐ²Ñ–Ñ€ÐµÐ½Ð¾ | Ð¿ÐµÑ€ÐµÐ²Ñ–Ñ€ÐµÐ½Ð¸Ð¹ | Ð¿ÐµÑ€ÐµÐ²Ñ–Ñ€ÑÑŽÑ‚ÑŒÑÑ\n   > [!explanation] ÐÐµÐ¿Ñ€Ð°Ð²Ð¸Ð»ÑŒÐ½Ð¸Ð¹ Ð²Ñ–Ð´Ð¼Ñ–Ð½Ð¾Ðº. ÐŸÑ€Ð°Ð²Ð¸Ð»ÑŒÐ½Ð¾: Â«Ð¿ÐµÑ€ÐµÐ²Ñ–Ñ€ÐµÐ½Ð¾Â».\n\n9. Ð—Ð²Ñ–Ñ‚ **Ð³Ð¾Ñ‚ÑƒÐ²Ð°Ñ‚Ð¸ÑÑ** Ð´Ð¾ Ð¿ÑƒÐ±Ð»Ñ–ÐºÐ°Ñ†Ñ–Ñ—.\n   > [!error] Ð³Ð¾Ñ‚ÑƒÐ²Ð°Ñ‚Ð¸ÑÑ\n   > [!answer] Ð³Ð¾Ñ‚ÑƒÑ”Ñ‚ÑŒÑÑ\n   > [!options] Ð³Ð¾Ñ‚ÑƒÐ²Ð°Ñ‚Ð¸ÑÑ | Ð³Ð¾Ñ‚ÑƒÑ”Ñ‚ÑŒÑÑ | Ð³Ð¾Ñ‚Ð¾Ð²Ð°Ð½Ð¾ | Ð³Ð¾Ñ‚ÑƒÐ²Ð°Ð»Ð¸\n   > [!explanation] ÐŸÐ¾Ñ‚Ñ€Ñ–Ð±Ð½Ð° Ð¾ÑÐ¾Ð±Ð¾Ð²Ð° Ñ„Ð¾Ñ€Ð¼Ð° Ð´Ñ–Ñ”ÑÐ»Ð¾Ð²Ð°, Ð½Ðµ Ñ–Ð½Ñ„Ñ–Ð½Ñ–Ñ‚Ð¸Ð².\n\n10. Ð ÐµÐ·ÑƒÐ»ÑŒÑ‚Ð°Ñ‚Ð¸ Ð±ÑƒÐ»Ð¾ Ð¿Ñ€Ð¾Ð°Ð½Ð°Ð»Ñ–Ð·Ð¾Ð²Ð°Ð½Ð¾ Ð´ÐµÑ‚Ð°Ð»ÑŒÐ½Ð¾.\n    > [!error] none\n    > [!answer] âœ“\n    > [!explanation] Ð ÐµÑ‡ÐµÐ½Ð½Ñ ÐºÐ¾Ñ€ÐµÐºÑ‚Ð½Ðµ â€” Â«Ð±ÑƒÐ»Ð¾ Ð¿Ñ€Ð¾Ð°Ð½Ð°Ð»Ñ–Ð·Ð¾Ð²Ð°Ð½Ð¾Â» Ð¿Ñ€Ð°Ð²Ð¸Ð»ÑŒÐ½Ð° Ñ„Ð¾Ñ€Ð¼Ð°.\n\n11. ÐšÐ½Ð¸Ð³Ñƒ **Ð½Ð°Ð´Ñ€ÑƒÐºÐ¾Ð²ÑƒÐ²Ð°Ñ‚Ð¸Ð¼Ðµ** Ð²Ð¸Ð´Ð°Ð²Ð½Ð¸Ñ†Ñ‚Ð²Ð¾.\n    > [!error] Ð½Ð°Ð´Ñ€ÑƒÐºÐ¾Ð²ÑƒÐ²Ð°Ñ‚Ð¸Ð¼Ðµ\n    > [!answer] Ð±ÑƒÐ´Ðµ Ð½Ð°Ð´Ñ€ÑƒÐºÐ¾Ð²Ð°Ð½Ð¾\n    > [!options] Ð½Ð°Ð´Ñ€ÑƒÐºÐ¾Ð²ÑƒÐ²Ð°Ñ‚Ð¸Ð¼Ðµ | Ð±ÑƒÐ´Ðµ Ð½Ð°Ð´Ñ€ÑƒÐºÐ¾Ð²Ð°Ð½Ð¾ | Ð½Ð°Ð´Ñ€ÑƒÐºÑƒÑ” | Ð´Ñ€ÑƒÐºÑƒÐ²Ð°Ñ‚Ð¸Ð¼Ðµ\n    > [!explanation] Ð”Ð»Ñ Ð¿Ð°ÑÐ¸Ð²Ñƒ Ð¼Ð°Ð¹Ð±ÑƒÑ‚Ð½ÑŒÐ¾Ð³Ð¾ Ñ‡Ð°ÑÑƒ: Â«Ð±ÑƒÐ´Ðµ Ð½Ð°Ð´Ñ€ÑƒÐºÐ¾Ð²Ð°Ð½Ð¾Â».\n\n12. Ð—Ð°ÑÐ²Ñƒ **Ð¿Ð¾Ð´Ð°Ð²Ð°Ð»Ð¾ÑÑ** Ð²Ñ‡Ð°ÑÐ½Ð¾.\n    > [!error] Ð¿Ð¾Ð´Ð°Ð²Ð°Ð»Ð¾ÑÑ\n    > [!answer] Ð¿Ð¾Ð´Ð°Ð½Ð¾\n    > [!options] Ð¿Ð¾Ð´Ð°Ð²Ð°Ð»Ð¾ÑÑ | Ð¿Ð¾Ð´Ð°Ð½Ð¾ | Ð¿Ð¾Ð´Ð°Ð²Ð°Ð»Ð¸ | Ð¿Ð¾Ð´Ð°Ñ”Ñ‚ÑŒÑÑ\n    > [!explanation] Â«Ð—Ð°ÑÐ²ÑƒÂ» â€” Ð¶Ñ–Ð½. Ñ€Ñ–Ð´, Ð·Ð½Ð°Ñ…. Ð²Ñ–Ð´Ð¼Ñ–Ð½Ð¾Ðº; Ð¿Ñ€Ð°Ð²Ð¸Ð»ÑŒÐ½Ð¾ Â«Ð¿Ð¾Ð´Ð°Ð½Ð¾Â».\n\n13. Ð¡Ñ‚Ð°Ñ‚Ñ‚Ñ Ð±ÑƒÐ»Ð° Ð¾Ð¿ÑƒÐ±Ð»Ñ–ÐºÐ¾Ð²Ð°Ð½Ð° Ð²Ñ‡Ð¾Ñ€Ð°.\n    > [!error] none\n    > [!answer] âœ“\n    > [!explanation] Ð ÐµÑ‡ÐµÐ½Ð½Ñ ÐºÐ¾Ñ€ÐµÐºÑ‚Ð½Ðµ â€” Ð´Ñ–Ñ”Ð¿Ñ€Ð¸ÐºÐ¼ÐµÑ‚Ð½Ð¸ÐºÐ¾Ð²Ð¸Ð¹ Ð¿Ð°ÑÐ¸Ð² Ð¿Ñ€Ð°Ð²Ð¸Ð»ÑŒÐ½Ð¸Ð¹.\n\n14. Ð Ñ–ÑˆÐµÐ½Ð½Ñ **ÑƒÑ…Ð²Ð°Ð»ÑŽÐ²Ð°Ð»Ð¸ÑÑ** Ð¾Ð´Ð½Ð¾Ð³Ð¾Ð»Ð¾ÑÐ½Ð¾.\n    > [!error] ÑƒÑ…Ð²Ð°Ð»ÑŽÐ²Ð°Ð»Ð¸ÑÑ\n    > [!answer] ÑƒÑ…Ð²Ð°Ð»ÐµÐ½Ð¾\n    > [!options] ÑƒÑ…Ð²Ð°Ð»ÑŽÐ²Ð°Ð»Ð¸ÑÑ | ÑƒÑ…Ð²Ð°Ð»ÐµÐ½Ð¾ | ÑƒÑ…Ð²Ð°Ð»ÑŽÐ²Ð°Ð»Ð¸ | ÑƒÑ…Ð²Ð°Ð»ÑŽÑŽÑ‚ÑŒÑÑ\n    > [!explanation] Â«Ð Ñ–ÑˆÐµÐ½Ð½ÑÂ» â€” ÑÐµÑ€ÐµÐ´Ð½Ñ–Ð¹ Ñ€Ñ–Ð´ (Ð¾Ð´Ð½Ð¸Ð½Ð°); Ñ„Ð¾Ñ€Ð¼Ð° Â«ÑƒÑ…Ð²Ð°Ð»ÐµÐ½Ð¾Â» Ð´Ð¾Ñ€ÐµÑ‡Ð½Ñ–ÑˆÐ°.\n\n15. Ð•ÐºÑÐ¿ÐµÑ€Ð¸Ð¼ÐµÐ½Ñ‚ **Ð¿Ð¾Ð²Ñ‚Ð¾Ñ€ÑŽÐ²Ð°Ð½Ð¾Ð³Ð¾** Ñ‚Ñ€Ð¸Ñ‡Ñ–.\n    > [!error] Ð¿Ð¾Ð²Ñ‚Ð¾Ñ€ÑŽÐ²Ð°Ð½Ð¾Ð³Ð¾\n    > [!answer] Ð¿Ð¾Ð²Ñ‚Ð¾Ñ€ÐµÐ½Ð¾\n    > [!options] Ð¿Ð¾Ð²Ñ‚Ð¾Ñ€ÑŽÐ²Ð°Ð½Ð¾Ð³Ð¾ | Ð¿Ð¾Ð²Ñ‚Ð¾Ñ€ÐµÐ½Ð¾ | Ð¿Ð¾Ð²Ñ‚Ð¾Ñ€ÑŽÐ²Ð°Ð»Ð¸ | Ð¿Ð¾Ð²Ñ‚Ð¾Ñ€ÑŽÑ”Ñ‚ÑŒÑÑ\n    > [!explanation] ÐÐµÐ¿Ñ€Ð°Ð²Ð¸Ð»ÑŒÐ½Ð° Ñ„Ð¾Ñ€Ð¼Ð°. ÐŸÑ€Ð°Ð²Ð¸Ð»ÑŒÐ½Ð¾: Â«Ð¿Ð¾Ð²Ñ‚Ð¾Ñ€ÐµÐ½Ð¾Â».\n\n16. Ð¢ÐµÐ¾Ñ€Ñ–ÑŽ Ð¿Ñ–Ð´Ñ‚Ð²ÐµÑ€Ð´Ð¶ÐµÐ½Ð¾ ÐµÐºÑÐ¿ÐµÑ€Ð¸Ð¼ÐµÐ½Ñ‚Ð°Ð»ÑŒÐ½Ð¾.\n    > [!error] none\n    > [!answer] âœ“\n    > [!explanation] Ð ÐµÑ‡ÐµÐ½Ð½Ñ ÐºÐ¾Ñ€ÐµÐºÑ‚Ð½Ðµ â€” Ñ„Ð¾Ñ€Ð¼Ð° Ð½Ð° -Ð½Ð¾/-Ñ‚Ð¾ Ð¿Ñ€Ð°Ð²Ð¸Ð»ÑŒÐ½Ð°.\n\n17. Ð”Ð°Ð½Ñ– **Ð¾Ð±Ñ€Ð¾Ð±Ð»ÑÑŽÑ‚ÑŒÑÑ** ÐºÐ¾Ð¼Ð¿'ÑŽÑ‚ÐµÑ€Ð¾Ð¼ Ð²Ð¶Ðµ **Ð¾Ð±Ñ€Ð¾Ð±Ð»ÐµÐ½Ð¾Ð³Ð¾**.\n    > [!error] Ð¾Ð±Ñ€Ð¾Ð±Ð»ÐµÐ½Ð¾Ð³Ð¾\n    > [!answer] Ð¾Ð±Ñ€Ð¾Ð±Ð»ÐµÐ½Ð¾\n    > [!options] Ð¾Ð±Ñ€Ð¾Ð±Ð»ÐµÐ½Ð¾Ð³Ð¾ | Ð¾Ð±Ñ€Ð¾Ð±Ð»ÐµÐ½Ð¾ | Ð¾Ð±Ñ€Ð¾Ð±Ð¸Ð»Ð¸ | Ð¾Ð±Ñ€Ð¾Ð±Ð»ÑÐ»Ð¸\n    > [!explanation] Ð”Ñ€ÑƒÐ³Ñƒ Ñ‡Ð°ÑÑ‚Ð¸Ð½Ñƒ Ð¿Ð¾Ñ‚Ñ€Ñ–Ð±Ð½Ð¾ Ð¿ÐµÑ€ÐµÑ„Ð¾Ñ€Ð¼ÑƒÐ»ÑŽÐ²Ð°Ñ‚Ð¸.\n\n18. Ð“Ñ–Ð¿Ð¾Ñ‚ÐµÐ·Ñƒ **Ð²Ð¸ÑÑƒÐ½ÐµÐ½Ð¸Ð¹** Ð½Ð°ÑƒÐºÐ¾Ð²Ñ†ÑÐ¼Ð¸.\n    > [!error] Ð²Ð¸ÑÑƒÐ½ÐµÐ½Ð¸Ð¹\n    > [!answer] Ð²Ð¸ÑÑƒÐ½ÑƒÑ‚Ð¾\n    > [!options] Ð²Ð¸ÑÑƒÐ½ÐµÐ½Ð¸Ð¹ | Ð²Ð¸ÑÑƒÐ½ÑƒÑ‚Ð¾ | Ð²Ð¸ÑÑƒÐ²Ð°Ð»Ð¸ | Ð²Ð¸ÑÑƒÐ²Ð°Ñ”Ñ‚ÑŒÑÑ\n    > [!explanation] Â«Ð“Ñ–Ð¿Ð¾Ñ‚ÐµÐ·ÑƒÂ» â€” Ð¶Ñ–Ð½. Ñ€Ñ–Ð´; Ð¿Ñ€Ð°Ð²Ð¸Ð»ÑŒÐ½Ð° Ñ„Ð¾Ñ€Ð¼Ð° Â«Ð²Ð¸ÑÑƒÐ½ÑƒÑ‚Ð¾Â».\n\n---\n\n## error-correction: Ð¡Ñ‚Ð¸Ð»Ñ–ÑÑ‚Ð¸Ñ‡Ð½Ñ– Ð½ÐµÐ²Ñ–Ð´Ð¿Ð¾Ð²Ñ–Ð´Ð½Ð¾ÑÑ‚Ñ–\n\n> Ð’Ð¸Ð·Ð½Ð°Ñ‡Ñ‚Ðµ ÑÐ»Ð¾Ð²Ð¾, Ñ‰Ð¾ Ð½Ðµ Ð²Ñ–Ð´Ð¿Ð¾Ð²Ñ–Ð´Ð°Ñ” ÑÑ‚Ð¸Ð»ÑŽ Ñ€ÐµÑ‡ÐµÐ½Ð½Ñ.\n\n1. Ð£ Ñ…Ð¾Ð´Ñ– Ð´Ð¾ÑÐ»Ñ–Ð´Ð¶ÐµÐ½Ð½Ñ **Ð²Ð¸ÑÐ²Ð¸Ð»Ð¾ÑÑ**, Ñ‰Ð¾ Ñ€ÐµÐ·ÑƒÐ»ÑŒÑ‚Ð°Ñ‚Ð¸ Ñ” **ÐºÐ»Ð°ÑÐ½Ð¸Ð¼Ð¸**.\n   > [!error] ÐºÐ»Ð°ÑÐ½Ð¸Ð¼Ð¸\n   > [!answer] Ð·Ð½Ð°Ñ‡ÑƒÑ‰Ð¸Ð¼Ð¸\n   > [!options] ÐºÐ»Ð°ÑÐ½Ð¸Ð¼Ð¸ | Ð·Ð½Ð°Ñ‡ÑƒÑ‰Ð¸Ð¼Ð¸ | ÐºÑ€ÑƒÑ‚Ð¸Ð¼Ð¸ | Ñ„Ð°Ð¹Ð½Ð¸Ð¼Ð¸\n   > [!explanation] Â«ÐšÐ»Ð°ÑÐ½Ð¸Ð¼Ð¸Â» â€” Ñ€Ð¾Ð·Ð¼Ð¾Ð²Ð½Ðµ ÑÐ»Ð¾Ð²Ð¾ Ð² Ð½Ð°ÑƒÐºÐ¾Ð²Ð¾Ð¼Ñƒ ÐºÐ¾Ð½Ñ‚ÐµÐºÑÑ‚Ñ–.\n\n2. ÐšÐ¾Ð½ÑÐ¾Ð»Ñ–Ð´Ð°Ñ†Ñ–ÑŽ Ð·Ð½Ð°Ð½ÑŒ Ð¿Ñ€Ð¾Ð²ÐµÐ´ÐµÐ½Ð¾ **Ð½Ð¾Ñ€Ð¼Ð°Ð»ÑŒÐ½Ð¾**.\n   > [!error] Ð½Ð¾Ñ€Ð¼Ð°Ð»ÑŒÐ½Ð¾\n   > [!answer] ÑƒÑÐ¿Ñ–ÑˆÐ½Ð¾\n   > [!options] Ð½Ð¾Ñ€Ð¼Ð°Ð»ÑŒÐ½Ð¾ | ÑƒÑÐ¿Ñ–ÑˆÐ½Ð¾ | Ð¾Ðº | Ð½Ð¾Ñ€Ð¼\n   > [!explanation] Â«ÐÐ¾Ñ€Ð¼Ð°Ð»ÑŒÐ½Ð¾Â» Ð·Ð°Ð½Ð°Ð´Ñ‚Ð¾ Ð½ÐµÐ²Ð¸Ð·Ð½Ð°Ñ‡ÐµÐ½Ðµ Ð´Ð»Ñ Ð½Ð°ÑƒÐºÐ¾Ð²Ð¾Ð³Ð¾ ÑÑ‚Ð¸Ð»ÑŽ.\n\n3. Ð¡Ð¸ÑÑ‚ÐµÐ¼Ð°Ñ‚Ð¸Ð·Ð°Ñ†Ñ–ÑŽ Ð¼Ð°Ñ‚ÐµÑ€Ñ–Ð°Ð»Ñƒ Ð·Ð´Ñ–Ð¹ÑÐ½ÐµÐ½Ð¾ **Ð² Ñ†Ñ–Ð»Ð¾Ð¼Ñƒ**.\n   > [!error] none\n   > [!answer] âœ“\n   > [!explanation] Ð ÐµÑ‡ÐµÐ½Ð½Ñ ÐºÐ¾Ñ€ÐµÐºÑ‚Ð½Ðµ â€” Â«Ð² Ñ†Ñ–Ð»Ð¾Ð¼ÑƒÂ» Ð¿Ñ€Ð¸Ð¹Ð½ÑÑ‚Ð½Ðµ Ð² Ð½Ð°ÑƒÐºÐ¾Ð²Ð¾Ð¼Ñƒ ÑÑ‚Ð¸Ð»Ñ–.\n\n4. ÐŸÐµÑ€ÐµÑ…Ñ–Ð´ Ð´Ð¾ Ð½Ð¾Ð²Ð¾Ð³Ð¾ Ñ€Ñ–Ð²Ð½Ñ Ð²Ñ–Ð´Ð±ÑƒÐ²ÑÑ **Ñ‚Ð¸Ð¿Ñƒ** ÑƒÑÐ¿Ñ–ÑˆÐ½Ð¾.\n   > [!error] Ñ‚Ð¸Ð¿Ñƒ\n   > [!answer] (Ð²Ð¸Ð´Ð°Ð»Ð¸Ñ‚Ð¸)\n   > [!options] Ñ‚Ð¸Ð¿Ñƒ | (Ð²Ð¸Ð´Ð°Ð»Ð¸Ñ‚Ð¸) | ÑÐºÐ¾ÑÑŒ | Ð½Ñƒ\n   > [!explanation] Â«Ð¢Ð¸Ð¿ÑƒÂ» â€” ÑÐ»ÐµÐ½Ð³Ð¾Ð²Ðµ ÑÐ»Ð¾Ð²Ð¾-Ð¿Ð°Ñ€Ð°Ð·Ð¸Ñ‚, Ñ‰Ð¾ Ð¿Ð¾Ñ€ÑƒÑˆÑƒÑ” ÑÑ‚Ð¸Ð»ÑŒ.\n\n5. ÐÐºÐ°Ð´ÐµÐ¼Ñ–Ñ‡Ð½Ð¸Ð¹ Ñ‚ÐµÐºÑÑ‚ **Ð¿Ñ€Ð¸ÐºÐ¾Ð»ÑŒÐ½Ð¾** Ð½Ð°Ð¿Ð¸ÑÐ°Ð½Ð¸Ð¹.\n   > [!error] Ð¿Ñ€Ð¸ÐºÐ¾Ð»ÑŒÐ½Ð¾\n   > [!answer] ÑÐºÑ–ÑÐ½Ð¾\n   > [!options] Ð¿Ñ€Ð¸ÐºÐ¾Ð»ÑŒÐ½Ð¾ | ÑÐºÑ–ÑÐ½Ð¾ | ÐºÐ»ÑŒÐ¾Ð²Ð¾ | ÐºÑ€ÑƒÑ‚Ð¾\n   > [!explanation] Â«ÐŸÑ€Ð¸ÐºÐ¾Ð»ÑŒÐ½Ð¾Â» â€” ÑÐ»ÐµÐ½Ð³, Ð½ÐµÐ¿Ñ€Ð¸Ð¹Ð½ÑÑ‚Ð½Ð¸Ð¹ Ñƒ Ñ„Ð¾Ñ€Ð¼Ð°Ð»ÑŒÐ½Ð¾Ð¼Ñƒ ÐºÐ¾Ð½Ñ‚ÐµÐºÑÑ‚Ñ–.\n\n6. Ð¤Ð°Ñ…Ð¾Ð²Ð¸Ð¹ Ð°Ð½Ð°Ð»Ñ–Ð· Ð¿Ñ€Ð¾Ð²ÐµÐ´ÐµÐ½Ð¾ Ñ€ÐµÑ‚ÐµÐ»ÑŒÐ½Ð¾.\n   > [!error] none\n   > [!answer] âœ“\n   > [!explanation] Ð ÐµÑ‡ÐµÐ½Ð½Ñ ÐºÐ¾Ñ€ÐµÐºÑ‚Ð½Ðµ â€” Ð»ÐµÐºÑÐ¸ÐºÐ° Ñ‚Ð° ÐºÐ¾Ð½ÑÑ‚Ñ€ÑƒÐºÑ†Ñ–Ñ— Ð¿Ð¾Ð²Ð½Ñ–ÑÑ‚ÑŽ Ð²Ñ–Ð´Ð¿Ð¾Ð²Ñ–Ð´Ð°ÑŽÑ‚ÑŒ Ð°ÐºÐ°Ð´ÐµÐ¼Ñ–Ñ‡Ð½Ð¸Ð¼ Ð²Ð¸Ð¼Ð¾Ð³Ð°Ð¼.\n\n7. Ð”Ð¾ÑÐºÐ¾Ð½Ð°Ð»Ñ–ÑÑ‚ÑŒ Ð¼ÐµÑ‚Ð¾Ð´Ñƒ **Ñ€ÐµÐ°Ð»ÑŒÐ½Ð¾** Ð²Ñ€Ð°Ð¶Ð°Ñ”.\n   > [!error] Ñ€ÐµÐ°Ð»ÑŒÐ½Ð¾\n   > [!answer] ÑÐ¿Ñ€Ð°Ð²Ð´Ñ–\n   > [!options] Ñ€ÐµÐ°Ð»ÑŒÐ½Ð¾ | ÑÐ¿Ñ€Ð°Ð²Ð´Ñ– | Ñ‚Ð¸Ð¿Ñƒ | Ð½Ñƒ\n   > [!explanation] Â«Ð ÐµÐ°Ð»ÑŒÐ½Ð¾Â» â€” Ñ€Ð¾Ð·Ð¼Ð¾Ð²Ð½Ð¸Ð¹ Ð¿Ñ–Ð´ÑÐ¸Ð»ÑŽÐ²Ð°Ñ‡; ÐºÑ€Ð°Ñ‰Ðµ Â«ÑÐ¿Ñ€Ð°Ð²Ð´Ñ–Â», Â«Ð´Ñ–Ð¹ÑÐ½Ð¾Â».\n\n8. ÐœÐ°Ð¹ÑÑ‚ÐµÑ€Ð½Ñ–ÑÑ‚ÑŒ Ð´Ð¾ÑÐ»Ñ–Ð´Ð½Ð¸ÐºÐ° Ð¿Ñ€Ð¾ÑÐ²Ð¸Ð»Ð°ÑÑ **Ð¿Ð¾ Ð¿Ð¾Ð²Ð½Ñ–Ð¹**.\n   > [!error] Ð¿Ð¾ Ð¿Ð¾Ð²Ð½Ñ–Ð¹\n   > [!answer] Ð¿Ð¾Ð²Ð½Ð¾ÑŽ Ð¼Ñ–Ñ€Ð¾ÑŽ\n   > [!options] Ð¿Ð¾ Ð¿Ð¾Ð²Ð½Ñ–Ð¹ | Ð¿Ð¾Ð²Ð½Ð¾ÑŽ Ð¼Ñ–Ñ€Ð¾ÑŽ | Ð½Ð° Ð²ÑÑŽ | Ð¼Ð°ÐºÑÐ¸Ð¼Ð°Ð»ÑŒÐ½Ð¾\n   > [!explanation] Â«ÐŸÐ¾ Ð¿Ð¾Ð²Ð½Ñ–Ð¹Â» â€” Ñ€Ð¾Ð·Ð¼Ð¾Ð²Ð½Ð¸Ð¹ Ñ„Ñ€Ð°Ð·ÐµÐ¾Ð»Ð¾Ð³Ñ–Ð·Ð¼.\n\n9. ÐžÐ¿Ð°Ð½ÑƒÐ²Ð°Ð½Ð½Ñ Ð½Ð¾Ð²Ð¸Ñ… Ð¼ÐµÑ‚Ð¾Ð´Ñ–Ð² Ð²Ñ–Ð´Ð±ÑƒÐ»Ð¾ÑÑ ÐµÑ„ÐµÐºÑ‚Ð¸Ð²Ð½Ð¾.\n   > [!error] none\n   > [!answer] âœ“\n   > [!explanation] Ð ÐµÑ‡ÐµÐ½Ð½Ñ ÐºÐ¾Ñ€ÐµÐºÑ‚Ð½Ðµ â€” Ñ„Ð¾Ñ€Ð¼Ð°Ð»ÑŒÐ½Ð¸Ð¹ Ð°ÐºÐ°Ð´ÐµÐ¼Ñ–Ñ‡Ð½Ð¸Ð¹ ÑÑ‚Ð¸Ð»ÑŒ.\n\n10. Ð’Ð´Ð¾ÑÐºÐ¾Ð½Ð°Ð»ÐµÐ½Ð½Ñ ÑÐ¸ÑÑ‚ÐµÐ¼Ð¸ Ð¿Ñ€Ð¾Ð²ÐµÐ´ÐµÐ½Ð¾ **ÑÐºÐ¾ÑÑŒ Ñ‚Ð°Ðº**.\n    > [!error] ÑÐºÐ¾ÑÑŒ Ñ‚Ð°Ðº\n    > [!answer] Ð½Ð°Ð»ÐµÐ¶Ð½Ð¸Ð¼ Ñ‡Ð¸Ð½Ð¾Ð¼\n    > [!options] ÑÐºÐ¾ÑÑŒ Ñ‚Ð°Ðº | Ð½Ð°Ð»ÐµÐ¶Ð½Ð¸Ð¼ Ñ‡Ð¸Ð½Ð¾Ð¼ | Ð½Ñƒ Ð½Ð¾Ñ€Ð¼ | Ñ‚Ð¸Ð¿Ñƒ Ð¾Ðº\n    > [!explanation] Â«Ð¯ÐºÐ¾ÑÑŒ Ñ‚Ð°ÐºÂ» â€” Ð½ÐµÐ²Ð¸Ð·Ð½Ð°Ñ‡ÐµÐ½Ð¸Ð¹ Ñ€Ð¾Ð·Ð¼Ð¾Ð²Ð½Ð¸Ð¹ Ð²Ð¸Ñ€Ð°Ð·.\n\n11. ÐŸÐ¾Ð³Ð»Ð¸Ð±Ð»ÐµÐ½Ð½Ñ Ð·Ð½Ð°Ð½ÑŒ Ð²Ñ–Ð´Ð±ÑƒÐ»Ð¾ÑÑ **ÑÑƒÐ¿ÐµÑ€ ÑˆÐ²Ð¸Ð´ÐºÐ¾**.\n    > [!error] ÑÑƒÐ¿ÐµÑ€ ÑˆÐ²Ð¸Ð´ÐºÐ¾\n    > [!answer] Ð´ÑƒÐ¶Ðµ ÑˆÐ²Ð¸Ð´ÐºÐ¾\n    > [!options] ÑÑƒÐ¿ÐµÑ€ ÑˆÐ²Ð¸Ð´ÐºÐ¾ | Ð´ÑƒÐ¶Ðµ ÑˆÐ²Ð¸Ð´ÐºÐ¾ | Ð¼ÐµÐ³Ð° ÑˆÐ²Ð¸Ð´ÐºÐ¾ | ÐµÐºÑÑ‚Ñ€Ð° ÑˆÐ²Ð¸Ð´ÐºÐ¾\n    > [!explanation] Â«Ð¡ÑƒÐ¿ÐµÑ€Â» â€” Ñ€Ð¾Ð·Ð¼Ð¾Ð²Ð½Ð¸Ð¹ Ð¿Ñ€ÐµÑ„Ñ–ÐºÑ; ÐºÑ€Ð°Ñ‰Ðµ Â«Ð´ÑƒÐ¶ÐµÂ», Â«Ð½Ð°Ð´Ð·Ð²Ð¸Ñ‡Ð°Ð¹Ð½Ð¾Â».\n\n12. Ð Ð¾Ð·ÑˆÐ¸Ñ€ÐµÐ½Ð½Ñ Ð²Ð¸Ð±Ñ–Ñ€ÐºÐ¸ Ð¿Ñ€Ð¾Ð²ÐµÐ´ÐµÐ½Ð¾ ÐºÐ¾Ñ€ÐµÐºÑ‚Ð½Ð¾.\n    > [!error] none\n    > [!answer] âœ“\n    > [!explanation] Ð ÐµÑ‡ÐµÐ½Ð½Ñ ÐºÐ¾Ñ€ÐµÐºÑ‚Ð½Ðµ â€” Ñ‚ÐµÑ€Ð¼Ñ–Ð½Ð¸ Ñ‚Ð° ÑÐ¸Ð½Ñ‚Ð°ÐºÑÐ¸Ñ Ð²Ñ–Ð´Ð¿Ð¾Ð²Ñ–Ð´Ð°ÑŽÑ‚ÑŒ ÑÑ‚Ð°Ð½Ð´Ð°Ñ€Ñ‚Ð°Ð¼ Ð½Ð°ÑƒÐºÐ¾Ð²Ð¾Ð³Ð¾ Ð´Ð¸ÑÐºÑƒÑ€ÑÑƒ.\n\n13. Ð—Ð°ÐºÑ€Ñ–Ð¿Ð»ÐµÐ½Ð½Ñ Ð¼Ð°Ñ‚ÐµÑ€Ñ–Ð°Ð»Ñƒ **Ð² Ð¿Ñ€Ð¸Ð½Ñ†Ð¸Ð¿Ñ–** ÑƒÑÐ¿Ñ–ÑˆÐ½Ðµ.\n    > [!error] Ð² Ð¿Ñ€Ð¸Ð½Ñ†Ð¸Ð¿Ñ–\n    > [!answer] Ð·Ð°Ð³Ð°Ð»Ð¾Ð¼\n    > [!options] Ð² Ð¿Ñ€Ð¸Ð½Ñ†Ð¸Ð¿Ñ– | Ð·Ð°Ð³Ð°Ð»Ð¾Ð¼ | Ñ‚Ð¸Ð¿Ñƒ | Ð½Ñƒ\n    > [!explanation] Â«Ð’ Ð¿Ñ€Ð¸Ð½Ñ†Ð¸Ð¿Ñ–Â» ÑÑ‚Ð²Ð¾Ñ€ÑŽÑ” Ð½ÐµÐ²Ð¸Ð·Ð½Ð°Ñ‡ÐµÐ½Ñ–ÑÑ‚ÑŒ; Â«Ð·Ð°Ð³Ð°Ð»Ð¾Ð¼Â» Ñ„Ð¾Ñ€Ð¼Ð°Ð»ÑŒÐ½Ñ–ÑˆÐµ.\n\n14. Ð—Ð°ÑÑ‚Ð¾ÑÑƒÐ²Ð°Ð½Ð½Ñ Ð¼ÐµÑ‚Ð¾Ð´Ñƒ **Ð¿Ñ€ÑÐ¼ ÐµÑ„ÐµÐºÑ‚Ð¸Ð²Ð½Ðµ**.\n    > [!error] Ð¿Ñ€ÑÐ¼\n    > [!answer] Ð½Ð°Ð´Ð·Ð²Ð¸Ñ‡Ð°Ð¹Ð½Ð¾\n    > [!options] Ð¿Ñ€ÑÐ¼ | Ð½Ð°Ð´Ð·Ð²Ð¸Ñ‡Ð°Ð¹Ð½Ð¾ | Ñ€ÐµÐ°Ð»ÑŒÐ½Ð¾ | Ñ‚Ð¸Ð¿Ñƒ\n    > [!explanation] Â«ÐŸÑ€ÑÐ¼Â» â€” Ñ€Ð¾Ð·Ð¼Ð¾Ð²Ð½Ðµ; ÐºÑ€Ð°Ñ‰Ðµ Â«Ð½Ð°Ð´Ð·Ð²Ð¸Ñ‡Ð°Ð¹Ð½Ð¾Â», Â«Ð¾ÑÐ¾Ð±Ð»Ð¸Ð²Ð¾Â».\n\n15. Ð†Ð½Ñ‚ÐµÐ³Ñ€Ð°Ñ†Ñ–Ñ ÑÐ¸ÑÑ‚ÐµÐ¼ Ð·Ð´Ñ–Ð¹ÑÐ½ÐµÐ½Ð° Ð¿Ñ€Ð¾Ñ„ÐµÑÑ–Ð¹Ð½Ð¾.\n    > [!error] none\n    > [!answer] âœ“\n    > [!explanation] Ð ÐµÑ‡ÐµÐ½Ð½Ñ ÐºÐ¾Ñ€ÐµÐºÑ‚Ð½Ðµ â€” Ñ„Ð¾Ñ€Ð¼Ð°Ð»ÑŒÐ½Ð¸Ð¹ Ð½Ð°ÑƒÐºÐ¾Ð²Ð¸Ð¹ ÑÑ‚Ð¸Ð»ÑŒ.\n\n16. Ð¡Ð¸Ð½Ñ‚ÐµÐ· Ñ€ÐµÐ·ÑƒÐ»ÑŒÑ‚Ð°Ñ‚Ñ–Ð² **Ð½Ð¾Ñ€Ð¼** Ð²Ñ–Ð´Ð±ÑƒÐ²ÑÑ.\n    > [!error] Ð½Ð¾Ñ€Ð¼\n    > [!answer] Ð²Ð´Ð°Ð»Ð¾\n    > [!options] Ð½Ð¾Ñ€Ð¼ | Ð²Ð´Ð°Ð»Ð¾ | Ð¾Ðº | Ð½Ð¾Ñ€Ð¼Ð°Ð»ÑŒÐ½Ð¾\n    > [!explanation] Â«ÐÐ¾Ñ€Ð¼Â» â€” ÑÐ»ÐµÐ½Ð³Ð¾Ð²Ðµ ÑÐºÐ¾Ñ€Ð¾Ñ‡ÐµÐ½Ð½Ñ.\n\n17. ÐÐ½Ð°Ð»Ñ–Ð· Ð´Ð°Ð½Ð¸Ñ… **Ð² Ñ†Ñ–Ð»Ð¾Ð¼Ñƒ Ð¾Ðº**.\n    > [!error] Ð¾Ðº\n    > [!answer] Ð·Ð°Ð´Ð¾Ð²Ñ–Ð»ÑŒÐ½Ð¸Ð¹\n    > [!options] Ð¾Ðº | Ð·Ð°Ð´Ð¾Ð²Ñ–Ð»ÑŒÐ½Ð¸Ð¹ | Ð½Ð¾Ñ€Ð¼ | Ð½Ð¾Ñ€Ð¼Ð°Ð»ÑŒÐ½Ð¸Ð¹\n    > [!explanation] Â«ÐžÐºÂ» â€” Ð°Ð½Ð³Ð»Ñ–Ñ†Ð¸Ð·Ð¼-ÑÐ»ÐµÐ½Ð³; Ð²Ð¸ÐºÐ¾Ñ€Ð¸ÑÑ‚Ð¾Ð²ÑƒÐ¹Ñ‚Ðµ Â«Ð·Ð°Ð´Ð¾Ð²Ñ–Ð»ÑŒÐ½Ð¸Ð¹Â».\n\n18. ÐžÑ†Ñ–Ð½ÑŽÐ²Ð°Ð½Ð½Ñ Ñ€ÐµÐ·ÑƒÐ»ÑŒÑ‚Ð°Ñ‚Ñ–Ð² Ð¿Ñ€Ð¾Ð²ÐµÐ´ÐµÐ½Ð¾ Ð¾Ð±'Ñ”ÐºÑ‚Ð¸Ð²Ð½Ð¾.\n    > [!error] none\n    > [!answer] âœ“\n    > [!explanation] Ð ÐµÑ‡ÐµÐ½Ð½Ñ ÐºÐ¾Ñ€ÐµÐºÑ‚Ð½Ðµ â€” Ñ„Ð¾Ñ€Ð¼Ð°Ð»ÑŒÐ½Ð¸Ð¹ ÑÑ‚Ð¸Ð»ÑŒ Ð´Ð¾Ñ‚Ñ€Ð¸Ð¼Ð°Ð½Ð¾, Ñ€ÐµÐ³Ñ–ÑÑ‚Ñ€Ð¾Ð²Ð¸Ñ… Ð¿Ð¾Ñ€ÑƒÑˆÐµÐ½ÑŒ Ð½ÐµÐ¼Ð°Ñ”.\n\n---\n\n## cloze: ÐÐ°ÑƒÐºÐ¾Ð²Ð¸Ð¹ Ð°Ð±Ð·Ð°Ñ†\n\n> Ð—Ð°Ð¿Ð¾Ð²Ð½Ñ–Ñ‚ÑŒ Ð¿Ñ€Ð¾Ð¿ÑƒÑÐºÐ¸, Ð¾Ð±Ð¸Ñ€Ð°ÑŽÑ‡Ð¸ Ð¿Ñ€Ð°Ð²Ð¸Ð»ÑŒÐ½Ñƒ Ñ„Ð¾Ñ€Ð¼Ñƒ.\n\nÐ£ Ð´Ð¾ÑÐ»Ñ–Ð´Ð¶ÐµÐ½Ð½Ñ– [___:1] Ð¿Ð¸Ñ‚Ð°Ð½Ð½Ñ Ð¼Ð¾Ð²Ð½Ð¾Ñ— Ð¿Ð¾Ð»Ñ–Ñ‚Ð¸ÐºÐ¸ Ð² Ð£ÐºÑ€Ð°Ñ—Ð½Ñ–. ÐœÐµÑ‚Ð¾ÑŽ Ñ€Ð¾Ð±Ð¾Ñ‚Ð¸ Ñ” [___:2] Ð½Ð°ÑÐ²Ð½Ð¸Ñ… Ð¿Ñ–Ð´Ñ…Ð¾Ð´Ñ–Ð² Ð´Ð¾ Ð²Ð¸Ð²Ñ‡ÐµÐ½Ð½Ñ Ñ†Ñ–Ñ”Ñ— Ð¿Ñ€Ð¾Ð±Ð»ÐµÐ¼Ð¸. [___:3], Ñ‰Ð¾ Ñ–ÑÐ½ÑƒÑ” Ð·Ð°Ð»ÐµÐ¶Ð½Ñ–ÑÑ‚ÑŒ Ð¼Ñ–Ð¶ Ð¼Ð¾Ð²Ð½Ð¾ÑŽ Ð¿Ð¾Ð»Ñ–Ñ‚Ð¸ÐºÐ¾ÑŽ Ñ‚Ð° Ð½Ð°Ñ†Ñ–Ð¾Ð½Ð°Ð»ÑŒÐ½Ð¾ÑŽ Ñ–Ð´ÐµÐ½Ñ‚Ð¸Ñ‡Ð½Ñ–ÑÑ‚ÑŽ. Ð”Ð°Ð½Ñ– [___:4] Ð¼ÐµÑ‚Ð¾Ð´Ð¾Ð¼ ÐºÐ¾Ð½Ñ‚ÐµÐ½Ñ‚-Ð°Ð½Ð°Ð»Ñ–Ð·Ñƒ. ÐÐ° Ð¾ÑÐ½Ð¾Ð²Ñ– [___:5] Ð·Ñ€Ð¾Ð±Ð»ÐµÐ½Ð¾ Ð²Ð¸ÑÐ½Ð¾Ð²Ð¾Ðº Ð¿Ñ€Ð¾ Ð½ÐµÐ¾Ð±Ñ…Ñ–Ð´Ð½Ñ–ÑÑ‚ÑŒ [___:6] Ð¼Ð¾Ð²Ð½Ð¸Ñ… Ð¿Ñ€Ð°Ð² Ð³Ñ€Ð¾Ð¼Ð°Ð´ÑÐ½. Ð ÐµÐ·ÑƒÐ»ÑŒÑ‚Ð°Ñ‚Ð¸ Ð´Ð¾ÑÐ»Ñ–Ð´Ð¶ÐµÐ½Ð½Ñ [___:7] Ð½Ð° Ð¼Ñ–Ð¶Ð½Ð°Ñ€Ð¾Ð´Ð½Ñ–Ð¹ ÐºÐ¾Ð½Ñ„ÐµÑ€ÐµÐ½Ñ†Ñ–Ñ—. [___:8] Ð¿Ð¾Ð´Ð°Ð»ÑŒÑˆÐ¸Ñ… Ð´Ð¾ÑÐ»Ñ–Ð´Ð¶ÐµÐ½ÑŒ Ñƒ Ñ†Ñ–Ð¹ Ð³Ð°Ð»ÑƒÐ·Ñ– Ð¿Ð¾Ñ‚Ñ€ÐµÐ±ÑƒÑ” Ð´Ð¾Ð´Ð°Ñ‚ÐºÐ¾Ð²Ð¾Ð³Ð¾ Ñ„Ñ–Ð½Ð°Ð½ÑÑƒÐ²Ð°Ð½Ð½Ñ. Ð£ ÑÑ‚Ð°Ñ‚Ñ‚Ñ– [___:9] Ð½Ð¾Ð²Ñ– Ð¿Ñ–Ð´Ñ…Ð¾Ð´Ð¸ Ð´Ð¾ [___:10] Ð¼Ð¾Ð²Ð½Ð¾Ð³Ð¾ Ð·Ð°ÐºÐ¾Ð½Ð¾Ð´Ð°Ð²ÑÑ‚Ð²Ð°.\n\n1. Ñ€Ð¾Ð·Ð³Ð»ÑÐ´Ð°Ñ”Ñ‚ÑŒÑÑ | Ñ€Ð¾Ð·Ð³Ð»ÑÐ´Ð°ÑŽÑ‚ÑŒ | Ñ€Ð¾Ð·Ð³Ð»ÑÐ´Ð°Ñ”\n   > [!answer] Ñ€Ð¾Ð·Ð³Ð»ÑÐ´Ð°Ñ”Ñ‚ÑŒÑÑ\n\n2. ÑÐ¸ÑÑ‚ÐµÐ¼Ð°Ñ‚Ð¸Ð·Ð°Ñ†Ñ–Ñ | ÑÐ¸ÑÑ‚ÐµÐ¼Ð°Ñ‚Ð¸Ð·ÑƒÐ²Ð°Ð»Ð¸ | ÑÐ¸ÑÑ‚ÐµÐ¼Ð°Ñ‚Ð¸Ð·ÑƒÑ”\n   > [!answer] ÑÐ¸ÑÑ‚ÐµÐ¼Ð°Ñ‚Ð¸Ð·Ð°Ñ†Ñ–Ñ\n\n3. Ð’ÑÑ‚Ð°Ð½Ð¾Ð²Ð»ÐµÐ½Ð¾ | Ð’ÑÑ‚Ð°Ð½Ð¾Ð²Ð¸Ð»Ð¸ | Ð’ÑÑ‚Ð°Ð½Ð¾Ð²Ð»ÑŽÑ”\n   > [!answer] Ð’ÑÑ‚Ð°Ð½Ð¾Ð²Ð»ÐµÐ½Ð¾\n\n4. Ð¾Ð±Ñ€Ð¾Ð±Ð»ÐµÐ½Ð¾ | Ð¾Ð±Ñ€Ð¾Ð±Ð¸Ð»Ð¸ | Ð¾Ð±Ñ€Ð¾Ð±Ð»ÑÑ”\n   > [!answer] Ð¾Ð±Ñ€Ð¾Ð±Ð»ÐµÐ½Ð¾\n\n5. Ð°Ð½Ð°Ð»Ñ–Ð·Ñƒ | Ð°Ð½Ð°Ð»Ñ–Ð·ÑƒÐ²Ð°Ð»Ð¸ | Ð°Ð½Ð°Ð»Ñ–Ð·ÑƒÑ”\n   > [!answer] Ð°Ð½Ð°Ð»Ñ–Ð·Ñƒ\n\n6. Ð·Ð°ÐºÑ€Ñ–Ð¿Ð»ÐµÐ½Ð½Ñ | Ð·Ð°ÐºÑ€Ñ–Ð¿Ð¸Ð»Ð¸ | Ð·Ð°ÐºÑ€Ñ–Ð¿Ð»ÑŽÑ”\n   > [!answer] Ð·Ð°ÐºÑ€Ñ–Ð¿Ð»ÐµÐ½Ð½Ñ\n\n7. Ð¿Ñ€ÐµÐ´ÑÑ‚Ð°Ð²Ð»ÐµÐ½Ð¾ | Ð¿Ñ€ÐµÐ´ÑÑ‚Ð°Ð²Ð¸Ð»Ð¸ | Ð¿Ñ€ÐµÐ´ÑÑ‚Ð°Ð²Ð»ÑÑ”\n   > [!answer] Ð¿Ñ€ÐµÐ´ÑÑ‚Ð°Ð²Ð»ÐµÐ½Ð¾\n\n8. Ð Ð¾Ð·ÑˆÐ¸Ñ€ÐµÐ½Ð½Ñ | Ð Ð¾Ð·ÑˆÐ¸Ñ€Ð¸Ð»Ð¸ | Ð Ð¾Ð·ÑˆÐ¸Ñ€ÑŽÑ”\n   > [!answer] Ð Ð¾Ð·ÑˆÐ¸Ñ€ÐµÐ½Ð½Ñ\n\n9. Ð·Ð°Ð¿Ñ€Ð¾Ð¿Ð¾Ð½Ð¾Ð²Ð°Ð½Ð¾ | Ð·Ð°Ð¿Ñ€Ð¾Ð¿Ð¾Ð½ÑƒÐ²Ð°Ð»Ð¸ | Ð¿Ñ€Ð¾Ð¿Ð¾Ð½ÑƒÑ”\n   > [!answer] Ð·Ð°Ð¿Ñ€Ð¾Ð¿Ð¾Ð½Ð¾Ð²Ð°Ð½Ð¾\n\n10. Ð²Ð´Ð¾ÑÐºÐ¾Ð½Ð°Ð»ÐµÐ½Ð½Ñ | Ð²Ð´Ð¾ÑÐºÐ¾Ð½Ð°Ð»Ð¸Ð»Ð¸ | Ð²Ð´Ð¾ÑÐºÐ¾Ð½Ð°Ð»ÑŽÑ”\n    > [!answer] Ð²Ð´Ð¾ÑÐºÐ¾Ð½Ð°Ð»ÐµÐ½Ð½Ñ\n\n---\n\n## cloze: ÐžÑ„Ñ–Ñ†Ñ–Ð¹Ð½Ð¸Ð¹ Ð´Ð¾ÐºÑƒÐ¼ÐµÐ½Ñ‚\n\n> Ð—Ð°Ð¿Ð¾Ð²Ð½Ñ–Ñ‚ÑŒ Ð¿Ñ€Ð¾Ð¿ÑƒÑÐºÐ¸ Ñƒ Ð¾Ñ„Ñ–Ñ†Ñ–Ð¹Ð½Ð¾Ð¼Ñƒ Ð´Ð¾ÐºÑƒÐ¼ÐµÐ½Ñ‚Ñ–.\n\nÐÐÐšÐÐ—\n\nÐŸÑ€Ð¾ Ð·Ð°Ñ‚Ð²ÐµÑ€Ð´Ð¶ÐµÐ½Ð½Ñ Ð¿Ð»Ð°Ð½Ñƒ Ñ€Ð¾Ð±Ð¾Ñ‚Ð¸\n\nÐ£ Ð·Ð²'ÑÐ·ÐºÑƒ Ð· Ð½ÐµÐ¾Ð±Ñ…Ñ–Ð´Ð½Ñ–ÑÑ‚ÑŽ [___:1] Ð´Ñ–ÑÐ»ÑŒÐ½Ð¾ÑÑ‚Ñ– Ð²Ñ–Ð´Ð´Ñ–Ð»Ñƒ ÐÐÐšÐÐ—Ð£Ð®:\n\n1. ÐŸÐ»Ð°Ð½ Ñ€Ð¾Ð±Ð¾Ñ‚Ð¸ Ð½Ð° 2024 Ñ€Ñ–Ðº [___:2].\n2. ÐšÐ¾Ð½Ñ‚Ñ€Ð¾Ð»ÑŒ Ð·Ð° Ð²Ð¸ÐºÐ¾Ð½Ð°Ð½Ð½ÑÐ¼ [___:3] Ð½Ð° Ð·Ð°ÑÑ‚ÑƒÐ¿Ð½Ð¸ÐºÐ° Ð´Ð¸Ñ€ÐµÐºÑ‚Ð¾Ñ€Ð°.\n3. Ð¢ÐµÑ€Ð¼Ñ–Ð½Ð¸ Ð²Ð¸ÐºÐ¾Ð½Ð°Ð½Ð½Ñ [___:4] Ð´Ð¾ 31 Ð³Ñ€ÑƒÐ´Ð½Ñ 2024 Ñ€Ð¾ÐºÑƒ.\n4. Ð—Ð²Ñ–Ñ‚ Ð¿Ñ€Ð¾ Ð²Ð¸ÐºÐ¾Ð½Ð°Ð½Ð½Ñ [___:5] Ñ‰Ð¾ÐºÐ²Ð°Ñ€Ñ‚Ð°Ð»ÑŒÐ½Ð¾.\n5. [___:6] Ð´Ð¾ Ð¿Ð»Ð°Ð½Ñƒ Ð²Ð½Ð¾ÑÐ¸Ñ‚Ð¸ Ð·Ð° Ð¿Ð¾Ð³Ð¾Ð´Ð¶ÐµÐ½Ð½ÑÐ¼ Ð· ÐºÐµÑ€Ñ–Ð²Ð½Ð¸Ñ†Ñ‚Ð²Ð¾Ð¼.\n6. ÐÐ°ÐºÐ°Ð· [___:7] Ð´Ð¾ Ð²Ñ–Ð´Ð¾Ð¼Ð° Ð²ÑÑ–Ñ… Ð¿Ñ€Ð°Ñ†Ñ–Ð²Ð½Ð¸ÐºÑ–Ð².\n\nÐ”Ð¸Ñ€ÐµÐºÑ‚Ð¾Ñ€                                                    ÐŸÐµÑ‚Ñ€ÐµÐ½ÐºÐ¾ Ð†.Ðœ.\n\nÐÐ°ÐºÐ°Ð· [___:8] 01 ÑÑ–Ñ‡Ð½Ñ 2024 Ñ€Ð¾ÐºÑƒ.\n\n1. ÐºÐ¾Ð½ÑÐ¾Ð»Ñ–Ð´Ð°Ñ†Ñ–Ñ— | ÐºÐ¾Ð½ÑÐ¾Ð»Ñ–Ð´ÑƒÐ²Ð°Ð»Ð¸ | ÐºÐ¾Ð½ÑÐ¾Ð»Ñ–Ð´ÑƒÑ”\n   > [!answer] ÐºÐ¾Ð½ÑÐ¾Ð»Ñ–Ð´Ð°Ñ†Ñ–Ñ—\n\n2. Ð·Ð°Ñ‚Ð²ÐµÑ€Ð´Ð¶ÐµÐ½Ð¾ | Ð·Ð°Ñ‚Ð²ÐµÑ€Ð´Ð¸Ð»Ð¸ | Ð·Ð°Ñ‚Ð²ÐµÑ€Ð´Ð¶ÑƒÑ”\n   > [!answer] Ð·Ð°Ñ‚Ð²ÐµÑ€Ð´Ð¶ÐµÐ½Ð¾\n\n3. Ð¿Ð¾ÐºÐ»Ð°Ð´ÐµÐ½Ð¾ | Ð¿Ð¾ÐºÐ»Ð°Ð»Ð¸ | Ð¿Ð¾ÐºÐ»Ð°Ð´Ð°Ñ”\n   > [!answer] Ð¿Ð¾ÐºÐ»Ð°Ð´ÐµÐ½Ð¾\n\n4. Ð²ÑÑ‚Ð°Ð½Ð¾Ð²Ð»ÐµÐ½Ð¾ | Ð²ÑÑ‚Ð°Ð½Ð¾Ð²Ð¸Ð»Ð¸ | Ð²ÑÑ‚Ð°Ð½Ð¾Ð²Ð»ÑŽÑ”\n   > [!answer] Ð²ÑÑ‚Ð°Ð½Ð¾Ð²Ð»ÐµÐ½Ð¾\n\n5. Ð¿Ð¾Ð´Ð°Ð²Ð°Ñ‚Ð¸ | Ð¿Ð¾Ð´Ð°Ð½Ð¾ | Ð¿Ð¾Ð´Ð°Ð»Ð¸\n   > [!answer] Ð¿Ð¾Ð´Ð°Ð²Ð°Ñ‚Ð¸\n\n6. Ð—Ð¼Ñ–Ð½Ð¸ | Ð—Ð¼Ñ–Ð½ÐµÐ½Ð¾ | Ð—Ð¼Ñ–Ð½ÑŽÑŽÑ‚ÑŒ\n   > [!answer] Ð—Ð¼Ñ–Ð½Ð¸\n\n7. Ð´Ð¾Ð²ÐµÑÑ‚Ð¸ | Ð´Ð¾Ð²ÐµÐ´ÐµÐ½Ð¾ | Ð´Ð¾Ð²Ð¾Ð´ÑÑ‚ÑŒ\n   > [!answer] Ð´Ð¾Ð²ÐµÑÑ‚Ð¸\n\n8. Ð¿Ñ–Ð´Ð¿Ð¸ÑÐ°Ð½Ð¾ | Ð¿Ñ–Ð´Ð¿Ð¸ÑÐ°Ð»Ð¸ | Ð¿Ñ–Ð´Ð¿Ð¸ÑÑƒÑ”\n   > [!answer] Ð¿Ñ–Ð´Ð¿Ð¸ÑÐ°Ð½Ð¾\n\n---\n\n## cloze: ÐÐºÐ°Ð´ÐµÐ¼Ñ–Ñ‡Ð½Ð° Ð°Ð½Ð¾Ñ‚Ð°Ñ†Ñ–Ñ\n\n> Ð—Ð°Ð¿Ð¾Ð²Ð½Ñ–Ñ‚ÑŒ Ð°Ð½Ð¾Ñ‚Ð°Ñ†Ñ–ÑŽ Ð½Ð°ÑƒÐºÐ¾Ð²Ð¾Ñ— ÑÑ‚Ð°Ñ‚Ñ‚Ñ–.\n\n**ÐÐ½Ð¾Ñ‚Ð°Ñ†Ñ–Ñ**\n\nÐ”Ð¾ÑÐ»Ñ–Ð´Ð¶ÐµÐ½Ð½Ñ [___:1] Ð°ÐºÑ‚ÑƒÐ°Ð»ÑŒÐ½Ñ–Ð¹ Ð¿Ñ€Ð¾Ð±Ð»ÐµÐ¼Ñ– [___:2] Ð¼Ð¾Ð²Ð½Ð¸Ñ… Ð½Ð°Ð²Ð¸Ñ‡Ð¾Ðº Ð½Ð° Ñ€Ñ–Ð²Ð½Ñ– C1. ÐœÐµÑ‚Ð¾ÑŽ Ñ€Ð¾Ð±Ð¾Ñ‚Ð¸ Ñ” [___:3] ÐµÑ„ÐµÐºÑ‚Ð¸Ð²Ð½Ð¸Ñ… Ð¼ÐµÑ‚Ð¾Ð´Ñ–Ð² Ð½Ð°Ð²Ñ‡Ð°Ð½Ð½Ñ. Ð£ ÑÑ‚Ð°Ñ‚Ñ‚Ñ– [___:4] Ñ€ÐµÐ·ÑƒÐ»ÑŒÑ‚Ð°Ñ‚Ð¸ ÐµÐºÑÐ¿ÐµÑ€Ð¸Ð¼ÐµÐ½Ñ‚Ñƒ, Ñ‰Ð¾ [___:5] Ð¿Ñ€Ð¾Ñ‚ÑÐ³Ð¾Ð¼ Ñ€Ð¾ÐºÑƒ. [___:6], Ñ‰Ð¾ ÐºÐ¾Ð¼Ð¿Ð»ÐµÐºÑÐ½Ð¸Ð¹ Ð¿Ñ–Ð´Ñ…Ñ–Ð´ ÑÐ¿Ñ€Ð¸ÑÑ” [___:7] Ð°ÐºÐ°Ð´ÐµÐ¼Ñ–Ñ‡Ð½Ð¸Ñ… ÐºÐ¾Ð¼Ð¿ÐµÑ‚ÐµÐ½Ñ†Ñ–Ð¹. ÐÐ° Ð¾ÑÐ½Ð¾Ð²Ñ– [___:8] [___:9] Ñ€ÐµÐºÐ¾Ð¼ÐµÐ½Ð´Ð°Ñ†Ñ–Ñ— Ð´Ð»Ñ Ð²Ð¸ÐºÐ»Ð°Ð´Ð°Ñ‡Ñ–Ð². ÐŸÑ€Ð°ÐºÑ‚Ð¸Ñ‡Ð½Ðµ [___:10] Ñ€ÐµÐ·ÑƒÐ»ÑŒÑ‚Ð°Ñ‚Ñ–Ð² Ð¼Ð¾Ð¶Ð»Ð¸Ð²Ðµ Ñƒ Ð²Ð¸Ñ‰Ð¸Ñ… Ð½Ð°Ð²Ñ‡Ð°Ð»ÑŒÐ½Ð¸Ñ… Ð·Ð°ÐºÐ»Ð°Ð´Ð°Ñ….\n\n*ÐšÐ»ÑŽÑ‡Ð¾Ð²Ñ– ÑÐ»Ð¾Ð²Ð°: [___:11], Ð¿Ð¾Ð³Ð»Ð¸Ð±Ð»ÐµÐ½Ð½Ñ, Ð¿ÐµÑ€ÐµÑ…Ñ–Ð´, Ð°ÐºÐ°Ð´ÐµÐ¼Ñ–Ñ‡Ð½Ð¸Ð¹ Ñ€Ñ–Ð²ÐµÐ½ÑŒ.*\n\n1. Ð¿Ñ€Ð¸ÑÐ²ÑÑ‡ÐµÐ½Ð¾ | Ð¿Ñ€Ð¸ÑÐ²ÑÑ‚Ð¸Ð»Ð¸ | Ð¿Ñ€Ð¸ÑÐ²ÑÑ‡ÑƒÑ”\n   > [!answer] Ð¿Ñ€Ð¸ÑÐ²ÑÑ‡ÐµÐ½Ð¾\n\n2. Ð¾Ð¿Ð°Ð½ÑƒÐ²Ð°Ð½Ð½Ñ | Ð¾Ð¿Ð°Ð½ÑƒÐ²Ð°Ð»Ð¸ | Ð¾Ð¿Ð°Ð½Ð¾Ð²ÑƒÑ”\n   > [!answer] Ð¾Ð¿Ð°Ð½ÑƒÐ²Ð°Ð½Ð½Ñ\n\n3. Ð°Ð½Ð°Ð»Ñ–Ð· | Ð°Ð½Ð°Ð»Ñ–Ð·ÑƒÐ²Ð°Ð»Ð¸ | Ð°Ð½Ð°Ð»Ñ–Ð·ÑƒÑ”\n   > [!answer] Ð°Ð½Ð°Ð»Ñ–Ð·\n\n4. Ð¿Ñ€ÐµÐ´ÑÑ‚Ð°Ð²Ð»ÐµÐ½Ð¾ | Ð¿Ñ€ÐµÐ´ÑÑ‚Ð°Ð²Ð¸Ð»Ð¸ | Ð¿Ñ€ÐµÐ´ÑÑ‚Ð°Ð²Ð»ÑÑ”\n   > [!answer] Ð¿Ñ€ÐµÐ´ÑÑ‚Ð°Ð²Ð»ÐµÐ½Ð¾\n\n5. Ð¿Ñ€Ð¾Ð²Ð¾Ð´Ð¸Ð»Ð¾ÑÑ | Ð¿Ñ€Ð¾Ð²ÐµÐ»Ð¸ | Ð¿Ñ€Ð¾Ð²Ð¾Ð´ÑÑ‚ÑŒ\n   > [!answer] Ð¿Ñ€Ð¾Ð²Ð¾Ð´Ð¸Ð»Ð¾ÑÑ\n\n6. Ð’ÑÑ‚Ð°Ð½Ð¾Ð²Ð»ÐµÐ½Ð¾ | Ð’ÑÑ‚Ð°Ð½Ð¾Ð²Ð¸Ð»Ð¸ | Ð’ÑÑ‚Ð°Ð½Ð¾Ð²Ð»ÑŽÑŽÑ‚ÑŒ\n   > [!answer] Ð’ÑÑ‚Ð°Ð½Ð¾Ð²Ð»ÐµÐ½Ð¾\n\n7. Ð²Ð´Ð¾ÑÐºÐ¾Ð½Ð°Ð»ÐµÐ½Ð½ÑŽ | Ð²Ð´Ð¾ÑÐºÐ¾Ð½Ð°Ð»Ð¸Ð»Ð¸ | Ð²Ð´Ð¾ÑÐºÐ¾Ð½Ð°Ð»ÑŽÑ”\n   > [!answer] Ð²Ð´Ð¾ÑÐºÐ¾Ð½Ð°Ð»ÐµÐ½Ð½ÑŽ\n\n8. Ð¾Ñ†Ñ–Ð½ÑŽÐ²Ð°Ð½Ð½Ñ | Ð¾Ñ†Ñ–Ð½ÑŽÐ²Ð°Ð»Ð¸ | Ð¾Ñ†Ñ–Ð½ÑŽÑ”\n   > [!answer] Ð¾Ñ†Ñ–Ð½ÑŽÐ²Ð°Ð½Ð½Ñ\n\n9. ÑÑ„Ð¾Ñ€Ð¼ÑƒÐ»ÑŒÐ¾Ð²Ð°Ð½Ð¾ | ÑÑ„Ð¾Ñ€Ð¼ÑƒÐ»ÑŽÐ²Ð°Ð»Ð¸ | Ñ„Ð¾Ñ€Ð¼ÑƒÐ»ÑŽÑ”\n   > [!answer] ÑÑ„Ð¾Ñ€Ð¼ÑƒÐ»ÑŒÐ¾Ð²Ð°Ð½Ð¾\n\n10. Ð·Ð°ÑÑ‚Ð¾ÑÑƒÐ²Ð°Ð½Ð½Ñ | Ð·Ð°ÑÑ‚Ð¾ÑÑƒÐ²Ð°Ð»Ð¸ | Ð·Ð°ÑÑ‚Ð¾ÑÐ¾Ð²ÑƒÑ”\n    > [!answer] Ð·Ð°ÑÑ‚Ð¾ÑÑƒÐ²Ð°Ð½Ð½Ñ\n\n11. ÐºÐ¾Ð½ÑÐ¾Ð»Ñ–Ð´Ð°Ñ†Ñ–Ñ | ÐºÐ¾Ð½ÑÐ¾Ð»Ñ–Ð´ÑƒÐ²Ð°Ð»Ð¸ | ÐºÐ¾Ð½ÑÐ¾Ð»Ñ–Ð´ÑƒÑ”\n    > [!answer] ÐºÐ¾Ð½ÑÐ¾Ð»Ñ–Ð´Ð°Ñ†Ñ–Ñ\n\n---\n\n## unjumble: ÐÐ°ÑƒÐºÐ¾Ð²Ñ– Ñ€ÐµÑ‡ÐµÐ½Ð½Ñ\n\n> Ð Ð¾Ð·Ñ‚Ð°ÑˆÑƒÐ¹Ñ‚Ðµ ÑÐ»Ð¾Ð²Ð° Ñƒ Ð¿Ñ€Ð°Ð²Ð¸Ð»ÑŒÐ½Ð¾Ð¼Ñƒ Ð¿Ð¾Ñ€ÑÐ´ÐºÑƒ.\n\n1. Ð±ÑƒÐ»Ð¾ / Ð´Ð¾ÑÐ»Ñ–Ð´Ð¶ÐµÐ½Ð½Ñ / ÑƒÑÐ¿Ñ–ÑˆÐ½Ð¾ / Ð¿Ñ€Ð¾Ð²ÐµÐ´ÐµÐ½Ð¾\n   > [!answer] Ð”Ð¾ÑÐ»Ñ–Ð´Ð¶ÐµÐ½Ð½Ñ Ð±ÑƒÐ»Ð¾ Ð¿Ñ€Ð¾Ð²ÐµÐ´ÐµÐ½Ð¾ ÑƒÑÐ¿Ñ–ÑˆÐ½Ð¾\n   > (The research was conducted successfully.) [4 words]\n\n2. Ñ€ÐµÐ·ÑƒÐ»ÑŒÑ‚Ð°Ñ‚Ð¸ / Ð¾Ð¿ÑƒÐ±Ð»Ñ–ÐºÐ¾Ð²Ð°Ð½Ð¾ / Ð² / Ð¶ÑƒÑ€Ð½Ð°Ð»Ñ– / Ð½Ð°ÑƒÐºÐ¾Ð²Ð¾Ð¼Ñƒ\n   > [!answer] Ð ÐµÐ·ÑƒÐ»ÑŒÑ‚Ð°Ñ‚Ð¸ Ð¾Ð¿ÑƒÐ±Ð»Ñ–ÐºÐ¾Ð²Ð°Ð½Ð¾ Ð² Ð½Ð°ÑƒÐºÐ¾Ð²Ð¾Ð¼Ñƒ Ð¶ÑƒÑ€Ð½Ð°Ð»Ñ–\n   > (The results were published in a scientific journal.) [5 words]\n\n3. Ð¼ÐµÑ‚Ð¾Ð´Ð¾Ð»Ð¾Ð³Ñ–ÑŽ / Ð±ÑƒÐ»Ð¾ / Ð·Ð°ÑÑ‚Ð¾ÑÐ¾Ð²Ð°Ð½Ð¾ / Ð½Ð¾Ð²Ñƒ\n   > [!answer] Ð‘ÑƒÐ»Ð¾ Ð·Ð°ÑÑ‚Ð¾ÑÐ¾Ð²Ð°Ð½Ð¾ Ð½Ð¾Ð²Ñƒ Ð¼ÐµÑ‚Ð¾Ð´Ð¾Ð»Ð¾Ð³Ñ–ÑŽ\n   > (A new methodology was applied.) [4 words]\n\n4. ÑÑ‚Ð°Ñ‚Ñ‚Ñ– / Ñƒ / Ñ€Ð¾Ð·Ð³Ð»ÑÐ´Ð°Ñ”Ñ‚ÑŒÑÑ / Ð¿Ñ€Ð¾Ð±Ð»ÐµÐ¼Ð° / Ð²Ð°Ð¶Ð»Ð¸Ð²Ð°\n   > [!answer] Ð£ ÑÑ‚Ð°Ñ‚Ñ‚Ñ– Ñ€Ð¾Ð·Ð³Ð»ÑÐ´Ð°Ñ”Ñ‚ÑŒÑÑ Ð²Ð°Ð¶Ð»Ð¸Ð²Ð° Ð¿Ñ€Ð¾Ð±Ð»ÐµÐ¼Ð°\n   > (An important problem is examined in the article.) [5 words]\n\n5. Ð´Ð°Ð½Ð¸Ñ… / Ð½Ð° / Ð¿Ñ€Ð¾Ð²ÐµÐ´ÐµÐ½Ð¾ / Ð¾ÑÐ½Ð¾Ð²Ñ– / Ð°Ð½Ð°Ð»Ñ–Ð·\n   > [!answer] ÐÐ° Ð¾ÑÐ½Ð¾Ð²Ñ– Ð´Ð°Ð½Ð¸Ñ… Ð¿Ñ€Ð¾Ð²ÐµÐ´ÐµÐ½Ð¾ Ð°Ð½Ð°Ð»Ñ–Ð·\n   > (Analysis was conducted based on the data.) [5 words]\n\n6. Ð²ÑÑ‚Ð°Ð½Ð¾Ð²Ð»ÐµÐ½Ð¾ / Ñ‰Ð¾ / Ð·Ð°Ð»ÐµÐ¶Ð½Ñ–ÑÑ‚ÑŒ / Ñ–ÑÐ½ÑƒÑ” / Ð±ÑƒÐ»Ð¾\n   > [!answer] Ð‘ÑƒÐ»Ð¾ Ð²ÑÑ‚Ð°Ð½Ð¾Ð²Ð»ÐµÐ½Ð¾, Ñ‰Ð¾ Ñ–ÑÐ½ÑƒÑ” Ð·Ð°Ð»ÐµÐ¶Ð½Ñ–ÑÑ‚ÑŒ\n   > (It was established that a correlation exists.) [5 words]\n\n7. ÑÐ¸ÑÑ‚ÐµÐ¼Ð°Ñ‚Ð¸Ð·Ð°Ñ†Ñ–ÑŽ / Ð·Ð´Ñ–Ð¹ÑÐ½ÐµÐ½Ð¾ / Ð¼Ð°Ñ‚ÐµÑ€Ñ–Ð°Ð»Ñƒ / Ð¿Ð¾Ð²Ð½Ñƒ\n   > [!answer] Ð—Ð´Ñ–Ð¹ÑÐ½ÐµÐ½Ð¾ Ð¿Ð¾Ð²Ð½Ñƒ ÑÐ¸ÑÑ‚ÐµÐ¼Ð°Ñ‚Ð¸Ð·Ð°Ñ†Ñ–ÑŽ Ð¼Ð°Ñ‚ÐµÑ€Ñ–Ð°Ð»Ñƒ\n   > (A complete systematization of the material was carried out.) [4 words]\n\n8. Ð¼ÐµÑ‚Ð¾Ð´ / ÐµÑ„ÐµÐºÑ‚Ð¸Ð²Ð½Ð¸Ð¼ / Ð²Ð¸ÑÐ²Ð¸Ð²ÑÑ / Ð·Ð°Ð¿Ñ€Ð¾Ð¿Ð¾Ð½Ð¾Ð²Ð°Ð½Ð¸Ð¹\n   > [!answer] Ð—Ð°Ð¿Ñ€Ð¾Ð¿Ð¾Ð½Ð¾Ð²Ð°Ð½Ð¸Ð¹ Ð¼ÐµÑ‚Ð¾Ð´ Ð²Ð¸ÑÐ²Ð¸Ð²ÑÑ ÐµÑ„ÐµÐºÑ‚Ð¸Ð²Ð½Ð¸Ð¼\n   > (The proposed method proved to be effective.) [4 words]\n\n9. ÐºÐ¾Ð½ÑÐ¾Ð»Ñ–Ð´Ð°Ñ†Ñ–Ñ / Ð·Ð½Ð°Ð½ÑŒ / Ð´Ð»Ñ / Ð²Ð°Ð¶Ð»Ð¸Ð²Ð° / Ð¿Ñ€Ð¾ÑÑƒÐ½ÑƒÑ‚Ð¾Ð³Ð¾ / Ñ€Ñ–Ð²Ð½Ñ\n   > [!answer] ÐšÐ¾Ð½ÑÐ¾Ð»Ñ–Ð´Ð°Ñ†Ñ–Ñ Ð·Ð½Ð°Ð½ÑŒ Ð²Ð°Ð¶Ð»Ð¸Ð²Ð° Ð´Ð»Ñ Ð¿Ñ€Ð¾ÑÑƒÐ½ÑƒÑ‚Ð¾Ð³Ð¾ Ñ€Ñ–Ð²Ð½Ñ\n   > (Consolidation of knowledge is important for the advanced level.) [6 words]\n\n10. Ð¿Ð¾Ð³Ð»Ð¸Ð±Ð»ÐµÐ½Ð½Ñ / ÑÐ¿Ñ€Ð¸ÑÑ” / Ð¿Ñ€Ð°ÐºÑ‚Ð¸ÐºÐ° / Ñ€Ð¾Ð·ÑƒÐ¼Ñ–Ð½Ð½Ñ / Ð¿Ð¾ÑÑ‚Ñ–Ð¹Ð½Ð°\n    > [!answer] ÐŸÐ¾ÑÑ‚Ñ–Ð¹Ð½Ð° Ð¿Ñ€Ð°ÐºÑ‚Ð¸ÐºÐ° ÑÐ¿Ñ€Ð¸ÑÑ” Ð¿Ð¾Ð³Ð»Ð¸Ð±Ð»ÐµÐ½Ð½ÑŽ Ñ€Ð¾Ð·ÑƒÐ¼Ñ–Ð½Ð½Ñ\n    > (Constant practice contributes to deepening understanding.) [5 words]\n\n11. Ð¿ÐµÑ€ÐµÑ…Ñ–Ð´ / Ñ€Ñ–Ð²Ð½Ñ / Ð¿Ð¾Ñ‚Ñ€ÐµÐ±ÑƒÑ” / Ð´Ð¾ / Ð½Ð°ÑÑ‚ÑƒÐ¿Ð½Ð¾Ð³Ð¾ / Ð¿Ñ–Ð´Ð³Ð¾Ñ‚Ð¾Ð²ÐºÐ¸\n    > [!answer] ÐŸÐµÑ€ÐµÑ…Ñ–Ð´ Ð´Ð¾ Ð½Ð°ÑÑ‚ÑƒÐ¿Ð½Ð¾Ð³Ð¾ Ñ€Ñ–Ð²Ð½Ñ Ð¿Ð¾Ñ‚Ñ€ÐµÐ±ÑƒÑ” Ð¿Ñ–Ð´Ð³Ð¾Ñ‚Ð¾Ð²ÐºÐ¸\n    > (Transition to the next level requires preparation.) [5 words]\n\n12. Ð°ÐºÐ°Ð´ÐµÐ¼Ñ–Ñ‡Ð½Ð¸Ð¹ / Ð²Ð¸Ð¼Ð°Ð³Ð°Ñ” / ÑÑ‚Ð¸Ð»ÑŒ / Ñ‚Ð¾Ñ‡Ð½Ð¾ÑÑ‚Ñ– / Ð»ÐµÐºÑÐ¸Ñ‡Ð½Ð¾Ñ—\n    > [!answer] ÐÐºÐ°Ð´ÐµÐ¼Ñ–Ñ‡Ð½Ð¸Ð¹ ÑÑ‚Ð¸Ð»ÑŒ Ð²Ð¸Ð¼Ð°Ð³Ð°Ñ” Ð»ÐµÐºÑÐ¸Ñ‡Ð½Ð¾Ñ— Ñ‚Ð¾Ñ‡Ð½Ð¾ÑÑ‚Ñ–\n    > (Academic style requires lexical precision.) [4 words]\n\n13. Ð±ÑƒÐ»Ð¾ / Ð·Ð°ÐºÑ€Ñ–Ð¿Ð»ÐµÐ½Ð½Ñ / Ð¿Ñ€Ð¾Ð²ÐµÐ´ÐµÐ½Ð¾ / Ð¼Ð°Ñ‚ÐµÑ€Ñ–Ð°Ð»Ñƒ / ÐµÑ„ÐµÐºÑ‚Ð¸Ð²Ð½Ð¾\n    > [!answer] Ð—Ð°ÐºÑ€Ñ–Ð¿Ð»ÐµÐ½Ð½Ñ Ð¼Ð°Ñ‚ÐµÑ€Ñ–Ð°Ð»Ñƒ Ð±ÑƒÐ»Ð¾ Ð¿Ñ€Ð¾Ð²ÐµÐ´ÐµÐ½Ð¾ ÐµÑ„ÐµÐºÑ‚Ð¸Ð²Ð½Ð¾\n    > (Reinforcement of the material was conducted effectively.) [5 words]\n\n14. Ð·Ð°ÑÑ‚Ð¾ÑÑƒÐ²Ð°Ð½Ð½Ñ / Ð¿Ð¾ÐºÐ°Ð·Ð°Ð»Ð¾ / Ð¼ÐµÑ‚Ð¾Ð´Ñƒ / Ð½Ð¾Ð²Ð¾Ð³Ð¾ / Ñ€ÐµÐ·ÑƒÐ»ÑŒÑ‚Ð°Ñ‚Ð¸ / Ñ…Ð¾Ñ€Ð¾ÑˆÑ–\n    > [!answer] Ð—Ð°ÑÑ‚Ð¾ÑÑƒÐ²Ð°Ð½Ð½Ñ Ð½Ð¾Ð²Ð¾Ð³Ð¾ Ð¼ÐµÑ‚Ð¾Ð´Ñƒ Ð¿Ð¾ÐºÐ°Ð·Ð°Ð»Ð¾ Ñ…Ð¾Ñ€Ð¾ÑˆÑ– Ñ€ÐµÐ·ÑƒÐ»ÑŒÑ‚Ð°Ñ‚Ð¸\n    > (Application of the new method showed good results.) [6 words]\n\n15. Ñ–Ð½Ñ‚ÐµÐ³Ñ€Ð°Ñ†Ñ–Ñ / Ð´Ð°Ð½Ð¸Ñ… / Ð·Ð°Ð²ÐµÑ€ÑˆÐµÐ½Ð° / ÑƒÑÐ¿Ñ–ÑˆÐ½Ð¾ / Ð±ÑƒÐ»Ð°\n    > [!answer] Ð†Ð½Ñ‚ÐµÐ³Ñ€Ð°Ñ†Ñ–Ñ Ð´Ð°Ð½Ð¸Ñ… Ð±ÑƒÐ»Ð° ÑƒÑÐ¿Ñ–ÑˆÐ½Ð¾ Ð·Ð°Ð²ÐµÑ€ÑˆÐµÐ½Ð°\n    > (Data integration was successfully completed.) [5 words]\n\n16. ÑÐ¸Ð½Ñ‚ÐµÐ· / Ñ€ÐµÐ·ÑƒÐ»ÑŒÑ‚Ð°Ñ‚Ñ–Ð² / Ð½Ð° / Ð·Ð´Ñ–Ð¹ÑÐ½ÐµÐ½Ð¾ / Ð¾ÑÐ½Ð¾Ð²Ñ– / Ð°Ð½Ð°Ð»Ñ–Ð·Ñƒ\n    > [!answer] Ð¡Ð¸Ð½Ñ‚ÐµÐ· Ñ€ÐµÐ·ÑƒÐ»ÑŒÑ‚Ð°Ñ‚Ñ–Ð² Ð·Ð´Ñ–Ð¹ÑÐ½ÐµÐ½Ð¾ Ð½Ð° Ð¾ÑÐ½Ð¾Ð²Ñ– Ð°Ð½Ð°Ð»Ñ–Ð·Ñƒ\n    > (Synthesis of results was carried out based on the analysis.) [6 words]\n\n17. Ð¾Ñ†Ñ–Ð½ÑŽÐ²Ð°Ð½Ð½Ñ / Ð¾Ð±'Ñ”ÐºÑ‚Ð¸Ð²Ð½Ðµ / Ð¿Ñ€Ð¾Ð²ÐµÐ´ÐµÐ½Ð¾ / Ð±ÑƒÐ»Ð¾ / Ñ€ÐµÐ·ÑƒÐ»ÑŒÑ‚Ð°Ñ‚Ñ–Ð²\n    > [!answer] Ð‘ÑƒÐ»Ð¾ Ð¿Ñ€Ð¾Ð²ÐµÐ´ÐµÐ½Ð¾ Ð¾Ð±'Ñ”ÐºÑ‚Ð¸Ð²Ð½Ðµ Ð¾Ñ†Ñ–Ð½ÑŽÐ²Ð°Ð½Ð½Ñ Ñ€ÐµÐ·ÑƒÐ»ÑŒÑ‚Ð°Ñ‚Ñ–Ð²\n    > (An objective assessment of the results was conducted.) [5 words]\n\n18. ÐºÐ¾Ð¼Ð¿ÐµÑ‚ÐµÐ½Ñ†Ñ–Ð¹ / Ð´Ð»Ñ / Ñ€Ð¾Ð·ÑˆÐ¸Ñ€ÐµÐ½Ð½Ñ / Ð½ÐµÐ¾Ð±Ñ…Ñ–Ð´Ð½Ð° / Ð¿Ñ€Ð°ÐºÑ‚Ð¸ÐºÐ° / Ð¿Ð¾ÑÑ‚Ñ–Ð¹Ð½Ð°\n    > [!answer] Ð”Ð»Ñ Ñ€Ð¾Ð·ÑˆÐ¸Ñ€ÐµÐ½Ð½Ñ ÐºÐ¾Ð¼Ð¿ÐµÑ‚ÐµÐ½Ñ†Ñ–Ð¹ Ð½ÐµÐ¾Ð±Ñ…Ñ–Ð´Ð½Ð° Ð¿Ð¾ÑÑ‚Ñ–Ð¹Ð½Ð° Ð¿Ñ€Ð°ÐºÑ‚Ð¸ÐºÐ°\n    > (Constant practice is necessary for expanding competencies.) [5 words]\n\n---\n\n## unjumble: ÐžÑ„Ñ–Ñ†Ñ–Ð¹Ð½Ñ– Ñ„Ð¾Ñ€Ð¼ÑƒÐ»ÑŽÐ²Ð°Ð½Ð½Ñ\n\n> Ð Ð¾Ð·Ñ‚Ð°ÑˆÑƒÐ¹Ñ‚Ðµ ÑÐ»Ð¾Ð²Ð° Ñƒ Ð¿Ñ€Ð°Ð²Ð¸Ð»ÑŒÐ½Ð¾Ð¼Ñƒ Ð¿Ð¾Ñ€ÑÐ´ÐºÑƒ Ð´Ð»Ñ Ð¾Ñ„Ñ–Ñ†Ñ–Ð¹Ð½Ð¾Ð³Ð¾ Ð´Ð¾ÐºÑƒÐ¼ÐµÐ½Ñ‚Ð°.\n\n1. Ñ€Ñ–ÑˆÐµÐ½Ð½Ñ / ÑƒÑ…Ð²Ð°Ð»ÐµÐ½Ð¾ / Ð¾Ð´Ð½Ð¾Ð³Ð¾Ð»Ð¾ÑÐ½Ð¾ / Ð±ÑƒÐ»Ð¾\n   > [!answer] Ð Ñ–ÑˆÐµÐ½Ð½Ñ Ð±ÑƒÐ»Ð¾ ÑƒÑ…Ð²Ð°Ð»ÐµÐ½Ð¾ Ð¾Ð´Ð½Ð¾Ð³Ð¾Ð»Ð¾ÑÐ½Ð¾\n   > (The decision was adopted unanimously.) [4 words]\n\n2. Ð´Ð¸Ñ€ÐµÐºÑ‚Ð¾Ñ€Ð¾Ð¼ / Ð½Ð°ÐºÐ°Ð· / Ð¿Ñ–Ð´Ð¿Ð¸ÑÐ°Ð½Ð¾\n   > [!answer] ÐÐ°ÐºÐ°Ð· Ð¿Ñ–Ð´Ð¿Ð¸ÑÐ°Ð½Ð¾ Ð´Ð¸Ñ€ÐµÐºÑ‚Ð¾Ñ€Ð¾Ð¼\n   > (The order was signed by the director.) [3 words]\n\n3. Ð·Ð°ÑÐ²Ñƒ / Ñ€Ð¾Ð·Ð³Ð»ÑÐ½ÑƒÑ‚Ð¾ / ÐºÐ¾Ð¼Ñ–ÑÑ–Ñ”ÑŽ / Ð±ÑƒÐ»Ð¾\n   > [!answer] Ð—Ð°ÑÐ²Ñƒ Ð±ÑƒÐ»Ð¾ Ñ€Ð¾Ð·Ð³Ð»ÑÐ½ÑƒÑ‚Ð¾ ÐºÐ¾Ð¼Ñ–ÑÑ–Ñ”ÑŽ\n   > (The application was reviewed by the commission.) [4 words]\n\n4. Ð´Ð¾ÐºÑƒÐ¼ÐµÐ½Ñ‚Ð¸ / Ñ‚ÐµÑ€Ð¼Ñ–Ð½Ð¾Ð²Ð¾ / Ð¿Ð¾Ð´Ð°Ð½Ð¾ / ÑƒÑÑ–\n   > [!answer] Ð£ÑÑ– Ð´Ð¾ÐºÑƒÐ¼ÐµÐ½Ñ‚Ð¸ Ð¿Ð¾Ð´Ð°Ð½Ð¾ Ñ‚ÐµÑ€Ð¼Ñ–Ð½Ð¾Ð²Ð¾\n   > (All documents were submitted urgently.) [4 words]\n\n5. Ð·Ð°Ñ‚Ð²ÐµÑ€Ð´Ð¶ÐµÐ½Ð¾ / Ð¿Ð»Ð°Ð½ / Ñ€Ð¾Ð±Ð¾Ñ‚Ð¸ / Ñ€Ñ–Ñ‡Ð½Ð¸Ð¹\n   > [!answer] Ð—Ð°Ñ‚Ð²ÐµÑ€Ð´Ð¶ÐµÐ½Ð¾ Ñ€Ñ–Ñ‡Ð½Ð¸Ð¹ Ð¿Ð»Ð°Ð½ Ñ€Ð¾Ð±Ð¾Ñ‚Ð¸\n   > (The annual work plan was approved.) [4 words]\n\n6. Ð¿Ð¾ÐºÐ»Ð°Ð´ÐµÐ½Ð¾ / ÐºÐ¾Ð½Ñ‚Ñ€Ð¾Ð»ÑŒ / Ð½Ð° / Ð·Ð°ÑÑ‚ÑƒÐ¿Ð½Ð¸ÐºÐ°\n   > [!answer] ÐšÐ¾Ð½Ñ‚Ñ€Ð¾Ð»ÑŒ Ð¿Ð¾ÐºÐ»Ð°Ð´ÐµÐ½Ð¾ Ð½Ð° Ð·Ð°ÑÑ‚ÑƒÐ¿Ð½Ð¸ÐºÐ°\n   > (Control was assigned to the deputy.) [4 words]\n\n7. Ð²ÑÑ‚Ð°Ð½Ð¾Ð²Ð»ÐµÐ½Ð¾ / Ð²Ð¸ÐºÐ¾Ð½Ð°Ð½Ð½Ñ / Ñ‚ÐµÑ€Ð¼Ñ–Ð½Ð¸\n   > [!answer] Ð¢ÐµÑ€Ð¼Ñ–Ð½Ð¸ Ð²Ð¸ÐºÐ¾Ð½Ð°Ð½Ð½Ñ Ð²ÑÑ‚Ð°Ð½Ð¾Ð²Ð»ÐµÐ½Ð¾\n   > (Deadlines for completion were set.) [3 words]\n\n8. Ð·Ð²Ñ–Ñ‚ / Ð¿Ð¾Ð´Ð°Ñ‚Ð¸ / Ð½ÐµÐ¾Ð±Ñ…Ñ–Ð´Ð½Ð¾ / Ð´Ð¾ / ÐºÑ–Ð½Ñ†Ñ / Ð¼Ñ–ÑÑÑ†Ñ\n   > [!answer] Ð—Ð²Ñ–Ñ‚ Ð½ÐµÐ¾Ð±Ñ…Ñ–Ð´Ð½Ð¾ Ð¿Ð¾Ð´Ð°Ñ‚Ð¸ Ð´Ð¾ ÐºÑ–Ð½Ñ†Ñ Ð¼Ñ–ÑÑÑ†Ñ\n   > (The report must be submitted by the end of the month.) [6 words]\n\n9. Ð¿Ñ€Ð¾Ñ‚Ð¾ÐºÐ¾Ð» / Ð·Ð°ÑÑ–Ð´Ð°Ð½Ð½Ñ / Ð¿Ñ–Ð´Ð¿Ð¸ÑÐ°Ð½Ð¾ / ÑƒÑÑ–Ð¼Ð° / ÑƒÑ‡Ð°ÑÐ½Ð¸ÐºÐ°Ð¼Ð¸\n   > [!answer] ÐŸÑ€Ð¾Ñ‚Ð¾ÐºÐ¾Ð» Ð·Ð°ÑÑ–Ð´Ð°Ð½Ð½Ñ Ð¿Ñ–Ð´Ð¿Ð¸ÑÐ°Ð½Ð¾ ÑƒÑÑ–Ð¼Ð° ÑƒÑ‡Ð°ÑÐ½Ð¸ÐºÐ°Ð¼Ð¸\n   > (The meeting minutes were signed by all participants.) [5 words]\n\n10. Ð·Ð°Ð¿Ñ€Ð¾Ð²Ð°Ð´Ð¶ÐµÐ½Ð¾ / Ð½Ð¾Ð²Ñ– / Ð¿Ñ€Ð°Ð²Ð¸Ð»Ð° / Ñ€Ð¾Ð±Ð¾Ñ‚Ð¸\n    > [!answer] Ð—Ð°Ð¿Ñ€Ð¾Ð²Ð°Ð´Ð¶ÐµÐ½Ð¾ Ð½Ð¾Ð²Ñ– Ð¿Ñ€Ð°Ð²Ð¸Ð»Ð° Ñ€Ð¾Ð±Ð¾Ñ‚Ð¸\n    > (New work rules were introduced.) [4 words]\n\n11. Ð²Ð¸ÐºÐ¾Ð½Ð°Ð½Ð¾ / Ð·Ð°Ð²Ð´Ð°Ð½Ð½Ñ / Ð²Ñ‡Ð°ÑÐ½Ð¾ / Ð±ÑƒÐ»Ð¾\n    > [!answer] Ð—Ð°Ð²Ð´Ð°Ð½Ð½Ñ Ð±ÑƒÐ»Ð¾ Ð²Ð¸ÐºÐ¾Ð½Ð°Ð½Ð¾ Ð²Ñ‡Ð°ÑÐ½Ð¾\n    > (The task was completed on time.) [4 words]\n\n12. Ð¿Ñ€Ð¸Ð·Ð½Ð°Ñ‡ÐµÐ½Ð¾ / Ð²Ñ–Ð´Ð¿Ð¾Ð²Ñ–Ð´Ð°Ð»ÑŒÐ½Ð¾Ð³Ð¾ / Ð·Ð° / Ð¿Ñ€Ð¾Ñ”ÐºÑ‚\n    > [!answer] ÐŸÑ€Ð¸Ð·Ð½Ð°Ñ‡ÐµÐ½Ð¾ Ð²Ñ–Ð´Ð¿Ð¾Ð²Ñ–Ð´Ð°Ð»ÑŒÐ½Ð¾Ð³Ð¾ Ð·Ð° Ð¿Ñ€Ð¾Ñ”ÐºÑ‚\n    > (A person responsible for the project was appointed.) [4 words]\n\n13. Ð¿ÐµÑ€ÐµÐ²Ñ–Ñ€ÐºÑƒ / Ð¿Ñ€Ð¾Ð²ÐµÐ´ÐµÐ½Ð¾ / Ð´Ð¾ÐºÑƒÐ¼ÐµÐ½Ñ‚Ñ–Ð²\n    > [!answer] ÐŸÑ€Ð¾Ð²ÐµÐ´ÐµÐ½Ð¾ Ð¿ÐµÑ€ÐµÐ²Ñ–Ñ€ÐºÑƒ Ð´Ð¾ÐºÑƒÐ¼ÐµÐ½Ñ‚Ñ–Ð²\n    > (Document verification was conducted.) [3 words]\n\n14. ÑÑ…Ð²Ð°Ð»ÐµÐ½Ð¾ / Ð¿Ñ€Ð¾Ð¿Ð¾Ð·Ð¸Ñ†Ñ–ÑŽ / Ð±Ñ–Ð»ÑŒÑˆÑ–ÑÑ‚ÑŽ / Ð³Ð¾Ð»Ð¾ÑÑ–Ð²\n    > [!answer] ÐŸÑ€Ð¾Ð¿Ð¾Ð·Ð¸Ñ†Ñ–ÑŽ ÑÑ…Ð²Ð°Ð»ÐµÐ½Ð¾ Ð±Ñ–Ð»ÑŒÑˆÑ–ÑÑ‚ÑŽ Ð³Ð¾Ð»Ð¾ÑÑ–Ð²\n    > (The proposal was approved by a majority vote.) [4 words]\n\n15. Ð²Ð½ÐµÑÐµÐ½Ð¾ / Ð·Ð¼Ñ–Ð½Ð¸ / Ð´Ð¾ / ÑÑ‚Ð°Ñ‚ÑƒÑ‚Ñƒ\n    > [!answer] Ð—Ð¼Ñ–Ð½Ð¸ Ð²Ð½ÐµÑÐµÐ½Ð¾ Ð´Ð¾ ÑÑ‚Ð°Ñ‚ÑƒÑ‚Ñƒ\n    > (Changes were made to the charter.) [4 words]\n\n16. Ð¾Ð³Ð¾Ð»Ð¾ÑˆÐµÐ½Ð¾ / ÐºÐ¾Ð½ÐºÑƒÑ€Ñ / Ð½Ð° / Ð¿Ð¾ÑÐ°Ð´Ñƒ\n    > [!answer] ÐžÐ³Ð¾Ð»Ð¾ÑˆÐµÐ½Ð¾ ÐºÐ¾Ð½ÐºÑƒÑ€Ñ Ð½Ð° Ð¿Ð¾ÑÐ°Ð´Ñƒ\n    > (A competition for the position was announced.) [4 words]\n\n17. Ð·Ð°Ð²ÐµÑ€ÑˆÐµÐ½Ð¾ / Ð±ÑƒÐ´Ñ–Ð²Ð½Ð¸Ñ†Ñ‚Ð²Ð¾ / Ð¾Ð±'Ñ”ÐºÑ‚Ð°\n    > [!answer] Ð‘ÑƒÐ´Ñ–Ð²Ð½Ð¸Ñ†Ñ‚Ð²Ð¾ Ð¾Ð±'Ñ”ÐºÑ‚Ð° Ð·Ð°Ð²ÐµÑ€ÑˆÐµÐ½Ð¾\n    > (Construction of the facility was completed.) [3 words]\n\n18. Ð½Ð°Ð´Ð°Ð½Ð¾ / Ð´Ð¾Ð·Ð²Ñ–Ð» / Ð½Ð° / Ð¿Ñ€Ð¾Ð²ÐµÐ´ÐµÐ½Ð½Ñ / Ð·Ð°Ñ…Ð¾Ð´Ñƒ\n    > [!answer] ÐÐ°Ð´Ð°Ð½Ð¾ Ð´Ð¾Ð·Ð²Ñ–Ð» Ð½Ð° Ð¿Ñ€Ð¾Ð²ÐµÐ´ÐµÐ½Ð½Ñ Ð·Ð°Ñ…Ð¾Ð´Ñƒ\n    > (Permission to hold the event was granted.) [5 words]\n\n---\n\n## translate: ÐÐ°ÑƒÐºÐ¾Ð²Ð¸Ð¹ ÑÑ‚Ð¸Ð»ÑŒ\n\n> ÐžÐ±ÐµÑ€Ñ–Ñ‚ÑŒ Ð¿Ñ€Ð°Ð²Ð¸Ð»ÑŒÐ½Ð¸Ð¹ Ð¿ÐµÑ€ÐµÐºÐ»Ð°Ð´ Ð´Ð»Ñ Ð½Ð°ÑƒÐºÐ¾Ð²Ð¾Ð³Ð¾ Ñ‚ÐµÐºÑÑ‚Ñƒ.\n\n1. The research was conducted successfully.\n   - [ ] ÐœÐ¸ Ð¿Ñ€Ð¾Ð²ÐµÐ»Ð¸ Ð´Ð¾ÑÐ»Ñ–Ð´Ð¶ÐµÐ½Ð½Ñ Ð´Ð¾Ð±Ñ€Ðµ.\n   - [x] Ð”Ð¾ÑÐ»Ñ–Ð´Ð¶ÐµÐ½Ð½Ñ Ð¿Ñ€Ð¾Ð²ÐµÐ´ÐµÐ½Ð¾ ÑƒÑÐ¿Ñ–ÑˆÐ½Ð¾.\n   - [ ] Ð”Ð¾ÑÐ»Ñ–Ð´Ð¶ÐµÐ½Ð½Ñ Ð·Ñ€Ð¾Ð±Ð¸Ð»Ð¸ Ð½Ð¾Ñ€Ð¼.\n   - [ ] ÐœÐ¸ Ð·Ñ€Ð¾Ð±Ð¸Ð»Ð¸ Ð´Ð¾ÑÐ»Ñ–Ð´Ð¶ÐµÐ½Ð½Ñ.\n   > ÐŸÐ°ÑÐ¸Ð²Ð½Ð° Ñ„Ð¾Ñ€Ð¼Ð° Ð½Ð° -Ð½Ð¾/-Ñ‚Ð¾ Ñ” ÑÑ‚Ð°Ð½Ð´Ð°Ñ€Ñ‚Ð¾Ð¼ Ð´Ð»Ñ Ð½Ð°ÑƒÐºÐ¾Ð²Ð¾Ð³Ð¾ ÑÑ‚Ð¸Ð»ÑŽ.\n\n2. It was established that a correlation exists.\n   - [ ] ÐœÐ¸ Ð·'ÑÑÑƒÐ²Ð°Ð»Ð¸, Ñ‰Ð¾ Ñ” Ð·Ð²'ÑÐ·Ð¾Ðº.\n   - [x] Ð’ÑÑ‚Ð°Ð½Ð¾Ð²Ð»ÐµÐ½Ð¾, Ñ‰Ð¾ Ñ–ÑÐ½ÑƒÑ” Ð·Ð°Ð»ÐµÐ¶Ð½Ñ–ÑÑ‚ÑŒ.\n   - [ ] Ð’Ð¸ÑÐ²Ð¸Ð»Ð¾ÑÑ, Ñ‰Ð¾ Ñ” Ð·Ð²'ÑÐ·Ð¾Ðº.\n   - [ ] ÐœÐ¸ Ð¿Ð¾Ð±Ð°Ñ‡Ð¸Ð»Ð¸ Ð·Ð²'ÑÐ·Ð¾Ðº.\n   > Ð‘ÐµÐ·Ð¾ÑÐ¾Ð±Ð¾Ð²Ð° ÐºÐ¾Ð½ÑÑ‚Ñ€ÑƒÐºÑ†Ñ–Ñ Â«Ð²ÑÑ‚Ð°Ð½Ð¾Ð²Ð»ÐµÐ½Ð¾Â» Ñ„Ð¾Ñ€Ð¼Ð°Ð»ÑŒÐ½Ð° Ñ‚Ð° Ð¾Ð±'Ñ”ÐºÑ‚Ð¸Ð²Ð½Ð°.\n\n3. The methodology was applied for analysis.\n   - [ ] ÐœÐµÑ‚Ð¾Ð´Ð¾Ð»Ð¾Ð³Ñ–ÑŽ Ð²Ð¸ÐºÐ¾Ñ€Ð¸ÑÑ‚Ð°Ð»Ð¸ Ð´Ð»Ñ Ð°Ð½Ð°Ð»Ñ–Ð·Ñƒ.\n   - [x] ÐœÐµÑ‚Ð¾Ð´Ð¾Ð»Ð¾Ð³Ñ–ÑŽ Ð·Ð°ÑÑ‚Ð¾ÑÐ¾Ð²Ð°Ð½Ð¾ Ð´Ð»Ñ Ð°Ð½Ð°Ð»Ñ–Ð·Ñƒ.\n   - [ ] ÐœÐ¸ Ð²Ð¸ÐºÐ¾Ñ€Ð¸ÑÑ‚Ð°Ð»Ð¸ Ð¼ÐµÑ‚Ð¾Ð´Ð¾Ð»Ð¾Ð³Ñ–ÑŽ.\n   - [ ] ÐœÐµÑ‚Ð¾Ð´Ð¾Ð»Ð¾Ð³Ñ–Ñ Ð±ÑƒÐ»Ð° Ð²Ð¸ÐºÐ¾Ñ€Ð¸ÑÑ‚Ð¾Ð²ÑƒÐ²Ð°Ñ‚Ð¸ÑÑ.\n   > Ð¤Ð¾Ñ€Ð¼Ð° Â«Ð·Ð°ÑÑ‚Ð¾ÑÐ¾Ð²Ð°Ð½Ð¾Â» â€” Ð½Ð°Ð¹Ñ„Ð¾Ñ€Ð¼Ð°Ð»ÑŒÐ½Ñ–ÑˆÐ° Ð´Ð»Ñ Ð½Ð°ÑƒÐºÐ¾Ð²Ð¾Ð³Ð¾ ÑÑ‚Ð¸Ð»ÑŽ.\n\n4. The results have been published.\n   - [ ] Ð ÐµÐ·ÑƒÐ»ÑŒÑ‚Ð°Ñ‚Ð¸ Ð¾Ð¿ÑƒÐ±Ð»Ñ–ÐºÑƒÐ²Ð°Ð»Ð¸.\n   - [x] Ð ÐµÐ·ÑƒÐ»ÑŒÑ‚Ð°Ñ‚Ð¸ Ð¾Ð¿ÑƒÐ±Ð»Ñ–ÐºÐ¾Ð²Ð°Ð½Ð¾.\n   - [ ] ÐœÐ¸ Ð¾Ð¿ÑƒÐ±Ð»Ñ–ÐºÑƒÐ²Ð°Ð»Ð¸ Ñ€ÐµÐ·ÑƒÐ»ÑŒÑ‚Ð°Ñ‚Ð¸.\n   - [ ] Ð ÐµÐ·ÑƒÐ»ÑŒÑ‚Ð°Ñ‚Ð¸ Ñ” Ð¾Ð¿ÑƒÐ±Ð»Ñ–ÐºÐ¾Ð²Ð°Ð½Ð¸Ð¼Ð¸.\n   > Ð¤Ð¾Ñ€Ð¼Ð° Ð½Ð° -Ð½Ð¾/-Ñ‚Ð¾ Ð½Ð°Ð¹ÐºÑ€Ð°Ñ‰Ðµ Ð¿Ñ–Ð´Ñ…Ð¾Ð´Ð¸Ñ‚ÑŒ Ð´Ð»Ñ Ð½Ð°ÑƒÐºÐ¾Ð²Ð¾Ð³Ð¾ ÑÑ‚Ð¸Ð»ÑŽ.\n\n5. A new approach is proposed in the article.\n   - [ ] Ð£ ÑÑ‚Ð°Ñ‚Ñ‚Ñ– Ð¼Ð¸ Ð¿Ñ€Ð¾Ð¿Ð¾Ð½ÑƒÑ”Ð¼Ð¾ Ð½Ð¾Ð²Ð¸Ð¹ Ð¿Ñ–Ð´Ñ…Ñ–Ð´.\n   - [x] Ð£ ÑÑ‚Ð°Ñ‚Ñ‚Ñ– Ð·Ð°Ð¿Ñ€Ð¾Ð¿Ð¾Ð½Ð¾Ð²Ð°Ð½Ð¾ Ð½Ð¾Ð²Ð¸Ð¹ Ð¿Ñ–Ð´Ñ…Ñ–Ð´.\n   - [ ] Ð¡Ñ‚Ð°Ñ‚Ñ‚Ñ Ð¿Ñ€Ð¾Ð¿Ð¾Ð½ÑƒÑ” Ð½Ð¾Ð²Ð¸Ð¹ Ð¿Ñ–Ð´Ñ…Ñ–Ð´.\n   - [ ] ÐÐ¾Ð²Ð¸Ð¹ Ð¿Ñ–Ð´Ñ…Ñ–Ð´ Ñ” Ð·Ð°Ð¿Ñ€Ð¾Ð¿Ð¾Ð½Ð¾Ð²Ð°Ð½Ð¸Ð¹.\n   > Ð‘ÐµÐ·Ð¾ÑÐ¾Ð±Ð¾Ð²Ð° Ð¿Ð°ÑÐ¸Ð²Ð½Ð° ÐºÐ¾Ð½ÑÑ‚Ñ€ÑƒÐºÑ†Ñ–Ñ ÑƒÐ½Ð¸ÐºÐ°Ñ” ÑÑƒÐ±'Ñ”ÐºÑ‚Ð¸Ð²Ð½Ð¾ÑÑ‚Ñ–.\n\n6. The problem is being solved by the team.\n   - [ ] ÐšÐ¾Ð¼Ð°Ð½Ð´Ð° Ð²Ð¸Ñ€Ñ–ÑˆÑƒÑ” Ð¿Ñ€Ð¾Ð±Ð»ÐµÐ¼Ñƒ.\n   - [x] ÐŸÑ€Ð¾Ð±Ð»ÐµÐ¼Ð° Ñ€Ð¾Ð·Ð²'ÑÐ·ÑƒÑ”Ñ‚ÑŒÑÑ ÐºÐ¾Ð¼Ð°Ð½Ð´Ð¾ÑŽ.\n   - [ ] ÐœÐ¸ Ð²Ð¸Ñ€Ñ–ÑˆÑƒÑ”Ð¼Ð¾ Ð¿Ñ€Ð¾Ð±Ð»ÐµÐ¼Ñƒ.\n   - [ ] ÐŸÑ€Ð¾Ð±Ð»ÐµÐ¼Ñƒ Ð²Ð¸Ñ€Ñ–ÑˆÑƒÑŽÑ‚ÑŒ.\n   > Ð—Ð²Ð¾Ñ€Ð¾Ñ‚Ð½Ð¸Ð¹ Ð¿Ð°ÑÐ¸Ð² Ð¿Ñ–Ð´ÐºÑ€ÐµÑÐ»ÑŽÑ” Ð¿Ñ€Ð¾Ñ†ÐµÑ.\n\n7. The data were processed using statistical methods.\n   - [ ] Ð”Ð°Ð½Ñ– Ð¾Ð±Ñ€Ð¾Ð±Ð¸Ð»Ð¸ ÑÑ‚Ð°Ñ‚Ð¸ÑÑ‚Ð¸ÐºÐ¾ÑŽ.\n   - [x] Ð”Ð°Ð½Ñ– Ð¾Ð±Ñ€Ð¾Ð±Ð»ÐµÐ½Ð¾ ÑÑ‚Ð°Ñ‚Ð¸ÑÑ‚Ð¸Ñ‡Ð½Ð¸Ð¼Ð¸ Ð¼ÐµÑ‚Ð¾Ð´Ð°Ð¼Ð¸.\n   - [ ] ÐœÐ¸ Ð¾Ð±Ñ€Ð¾Ð±Ð¸Ð»Ð¸ Ð´Ð°Ð½Ñ– ÑÑ‚Ð°Ñ‚Ð¸ÑÑ‚Ð¸ÐºÐ¾ÑŽ.\n   - [ ] Ð¡Ñ‚Ð°Ñ‚Ð¸ÑÑ‚Ð¸ÐºÑƒ Ð²Ð¸ÐºÐ¾Ñ€Ð¸ÑÑ‚Ð°Ð»Ð¸ Ð´Ð»Ñ Ð´Ð°Ð½Ð¸Ñ….\n   > Ð¤Ð¾Ñ€Ð¼Ð° Â«Ð¾Ð±Ñ€Ð¾Ð±Ð»ÐµÐ½Ð¾Â» Ð½Ð°Ð¹Ñ„Ð¾Ñ€Ð¼Ð°Ð»ÑŒÐ½Ñ–ÑˆÐ°.\n\n8. A conclusion was drawn based on the analysis.\n   - [ ] ÐœÐ¸ Ð·Ñ€Ð¾Ð±Ð¸Ð»Ð¸ Ð²Ð¸ÑÐ½Ð¾Ð²Ð¾Ðº Ð½Ð° Ð¾ÑÐ½Ð¾Ð²Ñ– Ð°Ð½Ð°Ð»Ñ–Ð·Ñƒ.\n   - [x] ÐÐ° Ð¾ÑÐ½Ð¾Ð²Ñ– Ð°Ð½Ð°Ð»Ñ–Ð·Ñƒ Ð·Ñ€Ð¾Ð±Ð»ÐµÐ½Ð¾ Ð²Ð¸ÑÐ½Ð¾Ð²Ð¾Ðº.\n   - [ ] ÐÐ½Ð°Ð»Ñ–Ð· Ð¿Ð¾ÐºÐ°Ð·Ð°Ð² Ð²Ð¸ÑÐ½Ð¾Ð²Ð¾Ðº.\n   - [ ] Ð’Ð¸ÑÐ½Ð¾Ð²Ð¾Ðº Ð±ÑƒÐ² Ð·Ñ€Ð¾Ð±Ð»ÐµÐ½Ð¸Ð¹.\n   > ÐŸÐ¾Ñ€ÑÐ´Ð¾Ðº ÑÐ»Ñ–Ð² Ð· Ð¿Ñ€Ð¸Ð¹Ð¼ÐµÐ½Ð½Ð¸ÐºÐ¾Ð²Ð¾ÑŽ Ð³Ñ€ÑƒÐ¿Ð¾ÑŽ Ð½Ð° Ð¿Ð¾Ñ‡Ð°Ñ‚ÐºÑƒ Ñ‚Ð¸Ð¿Ð¾Ð²Ð¸Ð¹ Ð´Ð»Ñ Ð½Ð°ÑƒÐºÐ¾Ð²Ð¾Ð³Ð¾ ÑÑ‚Ð¸Ð»ÑŽ.\n\n9. The hypothesis was confirmed experimentally.\n   - [ ] Ð•ÐºÑÐ¿ÐµÑ€Ð¸Ð¼ÐµÐ½Ñ‚ Ð¿Ñ–Ð´Ñ‚Ð²ÐµÑ€Ð´Ð¸Ð² Ð³Ñ–Ð¿Ð¾Ñ‚ÐµÐ·Ñƒ.\n   - [x] Ð“Ñ–Ð¿Ð¾Ñ‚ÐµÐ·Ñƒ Ð¿Ñ–Ð´Ñ‚Ð²ÐµÑ€Ð´Ð¶ÐµÐ½Ð¾ ÐµÐºÑÐ¿ÐµÑ€Ð¸Ð¼ÐµÐ½Ñ‚Ð°Ð»ÑŒÐ½Ð¾.\n   - [ ] ÐœÐ¸ Ð¿Ñ–Ð´Ñ‚Ð²ÐµÑ€Ð´Ð¸Ð»Ð¸ Ð³Ñ–Ð¿Ð¾Ñ‚ÐµÐ·Ñƒ.\n   - [ ] Ð“Ñ–Ð¿Ð¾Ñ‚ÐµÐ·Ð° Ð±ÑƒÐ»Ð° Ð¿Ñ–Ð´Ñ‚Ð²ÐµÑ€Ð´Ð¶ÐµÐ½Ð¾ÑŽ.\n   > Ð¤Ð¾Ñ€Ð¼Ð° Ð½Ð° -Ð½Ð¾/-Ñ‚Ð¾ Ð· Ð¿Ñ€Ð¸ÑÐ»Ñ–Ð²Ð½Ð¸ÐºÐ¾Ð¼ â€” ÑÑ‚Ð°Ð½Ð´Ð°Ñ€Ñ‚ Ð½Ð°ÑƒÐºÐ¾Ð²Ð¾Ð³Ð¾ ÑÑ‚Ð¸Ð»ÑŽ.\n\n10. The document was signed by the director.\n    - [ ] Ð”Ð¸Ñ€ÐµÐºÑ‚Ð¾Ñ€ Ð¿Ñ–Ð´Ð¿Ð¸ÑÐ°Ð² Ð´Ð¾ÐºÑƒÐ¼ÐµÐ½Ñ‚.\n    - [x] Ð”Ð¾ÐºÑƒÐ¼ÐµÐ½Ñ‚ Ð¿Ñ–Ð´Ð¿Ð¸ÑÐ°Ð½Ð¾ Ð´Ð¸Ñ€ÐµÐºÑ‚Ð¾Ñ€Ð¾Ð¼.\n    - [ ] Ð”Ð¾ÐºÑƒÐ¼ÐµÐ½Ñ‚ Ð¿Ñ–Ð´Ð¿Ð¸ÑÐ°Ð»Ð¸.\n    - [ ] Ð”Ð¾ÐºÑƒÐ¼ÐµÐ½Ñ‚ Ð±ÑƒÐ² Ð¿Ñ–Ð´Ð¿Ð¸ÑÐ°Ð½Ð¸Ð¹.\n    > Ð”Ð»Ñ Ð¾Ñ„Ñ–Ñ†Ñ–Ð¹Ð½Ð¸Ñ… Ð´Ð¾ÐºÑƒÐ¼ÐµÐ½Ñ‚Ñ–Ð² Ñ„Ð¾Ñ€Ð¼Ð° Ð½Ð° -Ð½Ð¾/-Ñ‚Ð¾ Ð¾Ð±Ð¾Ð²'ÑÐ·ÐºÐ¾Ð²Ð°.\n\n11. Consolidation of knowledge is essential.\n    - [ ] Ð¢Ñ€ÐµÐ±Ð° ÐºÐ¾Ð½ÑÐ¾Ð»Ñ–Ð´ÑƒÐ²Ð°Ñ‚Ð¸ Ð·Ð½Ð°Ð½Ð½Ñ.\n    - [x] ÐšÐ¾Ð½ÑÐ¾Ð»Ñ–Ð´Ð°Ñ†Ñ–Ñ Ð·Ð½Ð°Ð½ÑŒ Ñ” Ð½ÐµÐ¾Ð±Ñ…Ñ–Ð´Ð½Ð¾ÑŽ.\n    - [ ] Ð—Ð½Ð°Ð½Ð½Ñ Ñ‚Ñ€ÐµÐ±Ð° Ð¾Ð±'Ñ”Ð´Ð½Ð°Ñ‚Ð¸.\n    - [ ] Ð’Ð°Ð¶Ð»Ð¸Ð²Ð¾ Ð·Ð°ÐºÑ€Ñ–Ð¿Ð¸Ñ‚Ð¸ Ð·Ð½Ð°Ð½Ð½Ñ.\n    > ÐÐ¾Ð¼Ñ–Ð½Ð°Ð»Ñ–Ð·Ð°Ñ†Ñ–Ñ (Â«ÐºÐ¾Ð½ÑÐ¾Ð»Ñ–Ð´Ð°Ñ†Ñ–ÑÂ») Ñ‚Ð¸Ð¿Ð¾Ð²Ð° Ð´Ð»Ñ Ð½Ð°ÑƒÐºÐ¾Ð²Ð¾Ð³Ð¾ ÑÑ‚Ð¸Ð»ÑŽ.\n\n12. The transition to the advanced level requires preparation.\n    - [ ] Ð©Ð¾Ð± Ð¿ÐµÑ€ÐµÐ¹Ñ‚Ð¸ Ð½Ð° Ð²Ð¸Ñ‰Ð¸Ð¹ Ñ€Ñ–Ð²ÐµÐ½ÑŒ, Ñ‚Ñ€ÐµÐ±Ð° Ð³Ð¾Ñ‚ÑƒÐ²Ð°Ñ‚Ð¸ÑÑ.\n    - [x] ÐŸÐµÑ€ÐµÑ…Ñ–Ð´ Ð´Ð¾ Ð¿Ñ€Ð¾ÑÑƒÐ½ÑƒÑ‚Ð¾Ð³Ð¾ Ñ€Ñ–Ð²Ð½Ñ Ð¿Ð¾Ñ‚Ñ€ÐµÐ±ÑƒÑ” Ð¿Ñ–Ð´Ð³Ð¾Ñ‚Ð¾Ð²ÐºÐ¸.\n    - [ ] Ð”Ð»Ñ Ð¿ÐµÑ€ÐµÑ…Ð¾Ð´Ñƒ Ð¿Ð¾Ñ‚Ñ€Ñ–Ð±Ð½Ð° Ð¿Ñ–Ð´Ð³Ð¾Ñ‚Ð¾Ð²ÐºÐ°.\n    - [ ] Ð“Ð¾Ñ‚ÑƒÐ¹Ñ‚ÐµÑÑ Ð´Ð¾ Ð¿ÐµÑ€ÐµÑ…Ð¾Ð´Ñƒ.\n    > ÐÐ¾Ð¼Ñ–Ð½Ð°Ð»Ñ–Ð·Ð°Ñ†Ñ–Ñ Ñ‚Ð° Ñ„Ð¾Ñ€Ð¼Ð°Ð»ÑŒÐ½Ñ– Ñ–Ð¼ÐµÐ½Ð½Ð¸ÐºÐ¸ Ñ…Ð°Ñ€Ð°ÐºÑ‚ÐµÑ€Ð½Ñ– Ð´Ð»Ñ Ð°ÐºÐ°Ð´ÐµÐ¼Ñ–Ñ‡Ð½Ð¾Ð³Ð¾ ÑÑ‚Ð¸Ð»ÑŽ.\n\n13. The analysis was conducted thoroughly.\n    - [ ] ÐœÐ¸ Ñ€ÐµÑ‚ÐµÐ»ÑŒÐ½Ð¾ Ð¿Ñ€Ð¾Ð°Ð½Ð°Ð»Ñ–Ð·ÑƒÐ²Ð°Ð»Ð¸.\n    - [x] ÐÐ½Ð°Ð»Ñ–Ð· Ð¿Ñ€Ð¾Ð²ÐµÐ´ÐµÐ½Ð¾ Ñ€ÐµÑ‚ÐµÐ»ÑŒÐ½Ð¾.\n    - [ ] ÐÐ½Ð°Ð»Ñ–Ð· Ð±ÑƒÐ² Ñ€ÐµÑ‚ÐµÐ»ÑŒÐ½Ð¸Ð¹.\n    - [ ] Ð ÐµÑ‚ÐµÐ»ÑŒÐ½Ð¾ Ð·Ñ€Ð¾Ð±Ð¸Ð»Ð¸ Ð°Ð½Ð°Ð»Ñ–Ð·.\n    > Ð¤Ð¾Ñ€Ð¼Ð° Ð½Ð° -Ð½Ð¾/-Ñ‚Ð¾ Ð· Ð¿Ñ€Ð¸ÑÐ»Ñ–Ð²Ð½Ð¸ÐºÐ¾Ð¼ â€” ÑÑ‚Ð°Ð½Ð´Ð°Ñ€Ñ‚.\n\n14. The method proved to be effective.\n    - [ ] ÐœÐµÑ‚Ð¾Ð´ ÐºÐ»Ð°ÑÐ½Ð¸Ð¹.\n    - [x] ÐœÐµÑ‚Ð¾Ð´ Ð²Ð¸ÑÐ²Ð¸Ð²ÑÑ ÐµÑ„ÐµÐºÑ‚Ð¸Ð²Ð½Ð¸Ð¼.\n    - [ ] ÐœÐµÑ‚Ð¾Ð´ ÑÐ¿Ñ€Ð°Ñ†ÑŽÐ²Ð°Ð².\n    - [ ] ÐœÐµÑ‚Ð¾Ð´ Ð½Ð¾Ñ€Ð¼.\n    > Â«Ð’Ð¸ÑÐ²Ð¸Ð²ÑÑ ÐµÑ„ÐµÐºÑ‚Ð¸Ð²Ð½Ð¸Ð¼Â» â€” Ñ„Ð¾Ñ€Ð¼Ð°Ð»ÑŒÐ½Ð° ÐºÐ¾Ð½ÑÑ‚Ñ€ÑƒÐºÑ†Ñ–Ñ.\n\n15. Improvement of skills is ongoing.\n    - [ ] ÐÐ°Ð²Ð¸Ñ‡ÐºÐ¸ Ð¿Ð¾ÐºÑ€Ð°Ñ‰ÑƒÑŽÑ‚ÑŒÑÑ.\n    - [x] Ð’Ð´Ð¾ÑÐºÐ¾Ð½Ð°Ð»ÐµÐ½Ð½Ñ Ð½Ð°Ð²Ð¸Ñ‡Ð¾Ðº Ñ‚Ñ€Ð¸Ð²Ð°Ñ”.\n    - [ ] ÐœÐ¸ Ð²Ð´Ð¾ÑÐºÐ¾Ð½Ð°Ð»ÑŽÑ”Ð¼Ð¾ Ð½Ð°Ð²Ð¸Ñ‡ÐºÐ¸.\n    - [ ] ÐÐ°Ð²Ð¸Ñ‡ÐºÐ¸ ÑÑ‚Ð°ÑŽÑ‚ÑŒ ÐºÑ€Ð°Ñ‰Ð¸Ð¼Ð¸.\n    > ÐÐ¾Ð¼Ñ–Ð½Ð°Ð»Ñ–Ð·Ð°Ñ†Ñ–Ñ Â«Ð²Ð´Ð¾ÑÐºÐ¾Ð½Ð°Ð»ÐµÐ½Ð½ÑÂ» Ñ„Ð¾Ñ€Ð¼Ð°Ð»ÑŒÐ½Ñ–ÑˆÐ°.\n\n16. The assessment was conducted objectively.\n    - [ ] ÐœÐ¸ Ð¾Ð±'Ñ”ÐºÑ‚Ð¸Ð²Ð½Ð¾ Ð¾Ñ†Ñ–Ð½Ð¸Ð»Ð¸.\n    - [x] ÐžÑ†Ñ–Ð½ÑŽÐ²Ð°Ð½Ð½Ñ Ð¿Ñ€Ð¾Ð²ÐµÐ´ÐµÐ½Ð¾ Ð¾Ð±'Ñ”ÐºÑ‚Ð¸Ð²Ð½Ð¾.\n    - [ ] ÐžÐ±'Ñ”ÐºÑ‚Ð¸Ð²Ð½Ð¾ Ð¾Ñ†Ñ–Ð½Ð¸Ð»Ð¸.\n    - [ ] ÐžÑ†Ñ–Ð½ÐºÐ° Ð±ÑƒÐ»Ð° Ð¾Ð±'Ñ”ÐºÑ‚Ð¸Ð²Ð½Ð¾ÑŽ.\n    > Ð¤Ð¾Ñ€Ð¼Ð° Ð½Ð° -Ð½Ð¾/-Ñ‚Ð¾ Ð· Ð¿Ñ€Ð¸ÑÐ»Ñ–Ð²Ð½Ð¸ÐºÐ¾Ð¼ â€” ÑÑ‚Ð°Ð½Ð´Ð°Ñ€Ñ‚.\n\n17. Integration of systems has been completed.\n    - [ ] Ð¡Ð¸ÑÑ‚ÐµÐ¼Ð¸ Ñ–Ð½Ñ‚ÐµÐ³Ñ€ÑƒÐ²Ð°Ð»Ð¸.\n    - [x] Ð†Ð½Ñ‚ÐµÐ³Ñ€Ð°Ñ†Ñ–ÑŽ ÑÐ¸ÑÑ‚ÐµÐ¼ Ð·Ð°Ð²ÐµÑ€ÑˆÐµÐ½Ð¾.\n    - [ ] ÐœÐ¸ Ñ–Ð½Ñ‚ÐµÐ³Ñ€ÑƒÐ²Ð°Ð»Ð¸ ÑÐ¸ÑÑ‚ÐµÐ¼Ð¸.\n    - [ ] Ð¡Ð¸ÑÑ‚ÐµÐ¼Ð¸ Ñ” Ñ–Ð½Ñ‚ÐµÐ³Ñ€Ð¾Ð²Ð°Ð½Ð¸Ð¼Ð¸.\n    > ÐÐ¾Ð¼Ñ–Ð½Ð°Ð»Ñ–Ð·Ð°Ñ†Ñ–Ñ + Ñ„Ð¾Ñ€Ð¼Ð° Ð½Ð° -Ð½Ð¾/-Ñ‚Ð¾ â€” Ñ„Ð¾Ñ€Ð¼Ð°Ð»ÑŒÐ½Ð¸Ð¹ ÑÑ‚Ð¸Ð»ÑŒ.\n\n18. Synthesis of results was performed.\n    - [ ] Ð ÐµÐ·ÑƒÐ»ÑŒÑ‚Ð°Ñ‚Ð¸ ÑÐ¸Ð½Ñ‚ÐµÐ·ÑƒÐ²Ð°Ð»Ð¸.\n    - [x] Ð¡Ð¸Ð½Ñ‚ÐµÐ· Ñ€ÐµÐ·ÑƒÐ»ÑŒÑ‚Ð°Ñ‚Ñ–Ð² Ð·Ð´Ñ–Ð¹ÑÐ½ÐµÐ½Ð¾.\n    - [ ] ÐœÐ¸ Ð¿Ñ€Ð¾Ð²ÐµÐ»Ð¸ ÑÐ¸Ð½Ñ‚ÐµÐ·.\n    - [ ] Ð ÐµÐ·ÑƒÐ»ÑŒÑ‚Ð°Ñ‚Ð¸ Ð±ÑƒÐ»Ð¾ ÑÐ¸Ð½Ñ‚ÐµÐ·Ð¾Ð²Ð°Ð½Ð¾.\n    > Â«Ð—Ð´Ñ–Ð¹ÑÐ½ÐµÐ½Ð¾Â» â€” Ñ„Ð¾Ñ€Ð¼Ð°Ð»ÑŒÐ½Ð¸Ð¹ ÑÐ¸Ð½Ð¾Ð½Ñ–Ð¼ Ð´Ð¾ Â«Ð·Ñ€Ð¾Ð±Ð»ÐµÐ½Ð¾Â».\n\n---\n\n## translate: ÐžÑ„Ñ–Ñ†Ñ–Ð¹Ð½Ð¸Ð¹ ÑÑ‚Ð¸Ð»ÑŒ\n\n> ÐžÐ±ÐµÑ€Ñ–Ñ‚ÑŒ Ð¿Ñ€Ð°Ð²Ð¸Ð»ÑŒÐ½Ð¸Ð¹ Ð¿ÐµÑ€ÐµÐºÐ»Ð°Ð´ Ð´Ð»Ñ Ð¾Ñ„Ñ–Ñ†Ñ–Ð¹Ð½Ð¾Ð³Ð¾ Ð´Ð¾ÐºÑƒÐ¼ÐµÐ½Ñ‚Ð°.\n\n1. The decision was adopted unanimously.\n   - [ ] Ð£ÑÑ– Ð¿Ñ€Ð¾Ð³Ð¾Ð»Ð¾ÑÑƒÐ²Ð°Ð»Ð¸ Ð·Ð° Ñ€Ñ–ÑˆÐµÐ½Ð½Ñ.\n   - [x] Ð Ñ–ÑˆÐµÐ½Ð½Ñ ÑƒÑ…Ð²Ð°Ð»ÐµÐ½Ð¾ Ð¾Ð´Ð½Ð¾Ð³Ð¾Ð»Ð¾ÑÐ½Ð¾.\n   - [ ] Ð Ñ–ÑˆÐµÐ½Ð½Ñ Ð¿Ñ€Ð¸Ð¹Ð½ÑÐ»Ð¸ Ð¾Ð´Ð½Ð¾Ð³Ð¾Ð»Ð¾ÑÐ½Ð¾.\n   - [ ] Ð£ÑÑ– Ð¿Ð¾Ð³Ð¾Ð´Ð¸Ð»Ð¸ÑÑ.\n   > Ð¤Ð¾Ñ€Ð¼Ð° Ð½Ð° -Ð½Ð¾/-Ñ‚Ð¾ Ð¾Ð±Ð¾Ð²'ÑÐ·ÐºÐ¾Ð²Ð° Ð´Ð»Ñ Ð¾Ñ„Ñ–Ñ†Ñ–Ð¹Ð½Ð¸Ñ… Ð´Ð¾ÐºÑƒÐ¼ÐµÐ½Ñ‚Ñ–Ð².\n\n2. The order was signed by the director.\n   - [ ] Ð”Ð¸Ñ€ÐµÐºÑ‚Ð¾Ñ€ Ð¿Ñ–Ð´Ð¿Ð¸ÑÐ°Ð² Ð½Ð°ÐºÐ°Ð·.\n   - [x] ÐÐ°ÐºÐ°Ð· Ð¿Ñ–Ð´Ð¿Ð¸ÑÐ°Ð½Ð¾ Ð´Ð¸Ñ€ÐµÐºÑ‚Ð¾Ñ€Ð¾Ð¼.\n   - [ ] ÐÐ°ÐºÐ°Ð· Ð¿Ñ–Ð´Ð¿Ð¸ÑÐ°Ð»Ð¸.\n   - [ ] Ð”Ð¸Ñ€ÐµÐºÑ‚Ð¾Ñ€ Ð¿Ð¾ÑÑ‚Ð°Ð²Ð¸Ð² Ð¿Ñ–Ð´Ð¿Ð¸Ñ.\n   > ÐŸÐ°ÑÐ¸Ð²Ð½Ð° Ñ„Ð¾Ñ€Ð¼Ð° Ð· Ð¾Ñ€ÑƒÐ´Ð½Ð¸Ð¼ Ð²Ñ–Ð´Ð¼Ñ–Ð½ÐºÐ¾Ð¼ Ð°Ð³ÐµÐ½ÑÐ° â€” ÑÑ‚Ð°Ð½Ð´Ð°Ñ€Ñ‚.\n\n3. The application was reviewed by the commission.\n   - [ ] ÐšÐ¾Ð¼Ñ–ÑÑ–Ñ Ñ€Ð¾Ð·Ð³Ð»ÑÐ½ÑƒÐ»Ð° Ð·Ð°ÑÐ²Ñƒ.\n   - [x] Ð—Ð°ÑÐ²Ñƒ Ñ€Ð¾Ð·Ð³Ð»ÑÐ½ÑƒÑ‚Ð¾ ÐºÐ¾Ð¼Ñ–ÑÑ–Ñ”ÑŽ.\n   - [ ] Ð—Ð°ÑÐ²Ñƒ Ð¿Ð¾Ð´Ð¸Ð²Ð¸Ð»Ð¸ÑÑ.\n   - [ ] ÐšÐ¾Ð¼Ñ–ÑÑ–Ñ Ð¿ÐµÑ€ÐµÐ²Ñ–Ñ€Ð¸Ð»Ð° Ð·Ð°ÑÐ²Ñƒ.\n   > ÐŸÐ°ÑÐ¸Ð²Ð½Ð° Ñ„Ð¾Ñ€Ð¼Ð° Ð½Ð° -Ð½Ð¾/-Ñ‚Ð¾ Ð· Ð²Ð¸ÐºÐ¾Ð½Ð°Ð²Ñ†ÐµÐ¼ Ð´Ñ–Ñ— Ð² Ð¾Ñ€ÑƒÐ´Ð½Ð¾Ð¼Ñƒ Ð²Ñ–Ð´Ð¼Ñ–Ð½ÐºÑƒ â€” ÑÑ‚Ð°Ð½Ð´Ð°Ñ€Ñ‚ Ð¾Ñ„Ñ–Ñ†Ñ–Ð¹Ð½Ð¾Ð³Ð¾ ÑÑ‚Ð¸Ð»ÑŽ.\n\n4. All documents have been submitted.\n   - [ ] ÐœÐ¸ Ð¿Ð¾Ð´Ð°Ð»Ð¸ Ð²ÑÑ– Ð´Ð¾ÐºÑƒÐ¼ÐµÐ½Ñ‚Ð¸.\n   - [x] Ð£ÑÑ– Ð´Ð¾ÐºÑƒÐ¼ÐµÐ½Ñ‚Ð¸ Ð¿Ð¾Ð´Ð°Ð½Ð¾.\n   - [ ] Ð”Ð¾ÐºÑƒÐ¼ÐµÐ½Ñ‚Ð¸ Ð·Ð´Ð°Ð»Ð¸.\n   - [ ] Ð”Ð¾ÐºÑƒÐ¼ÐµÐ½Ñ‚Ð¸ Ñ” Ð¿Ð¾Ð´Ð°Ð½Ñ–.\n   > Ð‘ÐµÐ·Ð¾ÑÐ¾Ð±Ð¾Ð²Ð° Ð¿Ð°ÑÐ¸Ð²Ð½Ð° Ñ„Ð¾Ñ€Ð¼Ð° ÑÑ‚Ð°Ð½Ð´Ð°Ñ€Ñ‚Ð½Ð° Ð´Ð»Ñ Ð¾Ñ„Ñ–Ñ†Ñ–Ð¹Ð½Ð¾Ð³Ð¾ ÑÑ‚Ð¸Ð»ÑŽ.\n\n5. The annual work plan was approved.\n   - [ ] Ð—Ð°Ñ‚Ð²ÐµÑ€Ð´Ð¸Ð»Ð¸ Ñ€Ñ–Ñ‡Ð½Ð¸Ð¹ Ð¿Ð»Ð°Ð½ Ñ€Ð¾Ð±Ð¾Ñ‚Ð¸.\n   - [x] Ð Ñ–Ñ‡Ð½Ð¸Ð¹ Ð¿Ð»Ð°Ð½ Ñ€Ð¾Ð±Ð¾Ñ‚Ð¸ Ð·Ð°Ñ‚Ð²ÐµÑ€Ð´Ð¶ÐµÐ½Ð¾.\n   - [ ] ÐŸÐ»Ð°Ð½ Ñ€Ð¾Ð±Ð¾Ñ‚Ð¸ ÑÑ…Ð²Ð°Ð»Ð¸Ð»Ð¸.\n   - [ ] ÐœÐ¸ Ð·Ð°Ñ‚Ð²ÐµÑ€Ð´Ð¸Ð»Ð¸ Ð¿Ð»Ð°Ð½.\n   > Ð¤Ð¾Ñ€Ð¼Ð° Ð½Ð° -Ð½Ð¾/-Ñ‚Ð¾ Ð¾Ð±Ð¾Ð²'ÑÐ·ÐºÐ¾Ð²Ð°.\n\n6. Control was assigned to the deputy.\n   - [ ] Ð—Ð°ÑÑ‚ÑƒÐ¿Ð½Ð¸Ðº Ð±ÑƒÐ´Ðµ ÐºÐ¾Ð½Ñ‚Ñ€Ð¾Ð»ÑŽÐ²Ð°Ñ‚Ð¸.\n   - [x] ÐšÐ¾Ð½Ñ‚Ñ€Ð¾Ð»ÑŒ Ð¿Ð¾ÐºÐ»Ð°Ð´ÐµÐ½Ð¾ Ð½Ð° Ð·Ð°ÑÑ‚ÑƒÐ¿Ð½Ð¸ÐºÐ°.\n   - [ ] Ð—Ð°ÑÑ‚ÑƒÐ¿Ð½Ð¸ÐºÑƒ Ð´Ð°Ð»Ð¸ ÐºÐ¾Ð½Ñ‚Ñ€Ð¾Ð»ÑŒ.\n   - [ ] ÐšÐ¾Ð½Ñ‚Ñ€Ð¾Ð»ÑŽÐ²Ð°Ñ‚Ð¸ Ð±ÑƒÐ´Ðµ Ð·Ð°ÑÑ‚ÑƒÐ¿Ð½Ð¸Ðº.\n   > Â«ÐŸÐ¾ÐºÐ»Ð°Ð´ÐµÐ½Ð¾ Ð½Ð° + Ð·Ð½Ð°Ñ…Ñ–Ð´Ð½Ð¸Ð¹ Ð²Ñ–Ð´Ð¼Ñ–Ð½Ð¾ÐºÂ» â€” Ð¾Ñ„Ñ–Ñ†Ñ–Ð¹Ð½Ð° Ñ„Ð¾Ñ€Ð¼ÑƒÐ»Ð°.\n\n7. Deadlines were established.\n   - [ ] Ð¢ÐµÑ€Ð¼Ñ–Ð½Ð¸ Ð²ÑÑ‚Ð°Ð½Ð¾Ð²Ð¸Ð»Ð¸.\n   - [x] Ð¢ÐµÑ€Ð¼Ñ–Ð½Ð¸ Ð²ÑÑ‚Ð°Ð½Ð¾Ð²Ð»ÐµÐ½Ð¾.\n   - [ ] ÐœÐ¸ Ð²Ð¸Ð·Ð½Ð°Ñ‡Ð¸Ð»Ð¸ Ñ‚ÐµÑ€Ð¼Ñ–Ð½Ð¸.\n   - [ ] Ð¢ÐµÑ€Ð¼Ñ–Ð½Ð¸ Ñ” Ð²ÑÑ‚Ð°Ð½Ð¾Ð²Ð»ÐµÐ½Ð¸Ð¼Ð¸.\n   > ÐšÐ¾Ñ€Ð¾Ñ‚ÐºÐ° Ð±ÐµÐ·Ð¾ÑÐ¾Ð±Ð¾Ð²Ð° Ñ„Ð¾Ñ€Ð¼Ð° Ñ‚Ð¸Ð¿Ð¾Ð²Ð° Ð´Ð»Ñ Ð¾Ñ„Ñ–Ñ†Ñ–Ð¹Ð½Ð¾Ð³Ð¾ ÑÑ‚Ð¸Ð»ÑŽ.\n\n8. The report must be submitted monthly.\n   - [ ] Ð—Ð²Ñ–Ñ‚ Ñ‚Ñ€ÐµÐ±Ð° Ð¿Ð¾Ð´Ð°Ð²Ð°Ñ‚Ð¸ Ñ‰Ð¾Ð¼Ñ–ÑÑÑ†Ñ.\n   - [x] Ð—Ð²Ñ–Ñ‚ Ð¿Ð¾Ð´Ð°Ð²Ð°Ñ‚Ð¸ Ñ‰Ð¾Ð¼Ñ–ÑÑÑ†Ñ.\n   - [ ] ÐŸÐ¾Ð´Ð°Ð²Ð°Ð¹Ñ‚Ðµ Ð·Ð²Ñ–Ñ‚ Ñ‰Ð¾Ð¼Ñ–ÑÑÑ†Ñ.\n   - [ ] ÐœÐ¸ Ð±ÑƒÐ´ÐµÐ¼Ð¾ Ð¿Ð¾Ð´Ð°Ð²Ð°Ñ‚Ð¸ Ð·Ð²Ñ–Ñ‚.\n   > Ð†Ð½Ñ„Ñ–Ð½Ñ–Ñ‚Ð¸Ð²Ð½Ð° ÐºÐ¾Ð½ÑÑ‚Ñ€ÑƒÐºÑ†Ñ–Ñ Ñ‚Ð¸Ð¿Ð¾Ð²Ð° Ð´Ð»Ñ Ð¿Ñ€Ð¸Ð¿Ð¸ÑÑ–Ð².\n\n9. Changes were made to the charter.\n   - [ ] ÐœÐ¸ Ð²Ð½ÐµÑÐ»Ð¸ Ð·Ð¼Ñ–Ð½Ð¸ Ð´Ð¾ ÑÑ‚Ð°Ñ‚ÑƒÑ‚Ñƒ.\n   - [x] Ð”Ð¾ ÑÑ‚Ð°Ñ‚ÑƒÑ‚Ñƒ Ð²Ð½ÐµÑÐµÐ½Ð¾ Ð·Ð¼Ñ–Ð½Ð¸.\n   - [ ] Ð¡Ñ‚Ð°Ñ‚ÑƒÑ‚ Ð·Ð¼Ñ–Ð½Ð¸Ð»Ð¸.\n   - [ ] Ð—Ð¼Ñ–Ð½Ð¸ Ð·Ñ€Ð¾Ð±Ð¸Ð»Ð¸ Ð² ÑÑ‚Ð°Ñ‚ÑƒÑ‚Ñ–.\n   > ÐŸÑ€Ð¸Ð¹Ð¼ÐµÐ½Ð½Ð¸ÐºÐ¾Ð²Ð° ÐºÐ¾Ð½ÑÑ‚Ñ€ÑƒÐºÑ†Ñ–Ñ Ð½Ð° Ð¿Ð¾Ñ‡Ð°Ñ‚ÐºÑƒ + Ñ„Ð¾Ñ€Ð¼Ð° Ð½Ð° -Ð½Ð¾/-Ñ‚Ð¾.\n\n10. A competition for the position was announced.\n    - [ ] ÐžÐ³Ð¾Ð»Ð¾ÑÐ¸Ð»Ð¸ ÐºÐ¾Ð½ÐºÑƒÑ€Ñ Ð½Ð° Ð¿Ð¾ÑÐ°Ð´Ñƒ.\n    - [x] ÐžÐ³Ð¾Ð»Ð¾ÑˆÐµÐ½Ð¾ ÐºÐ¾Ð½ÐºÑƒÑ€Ñ Ð½Ð° Ð¿Ð¾ÑÐ°Ð´Ñƒ.\n    - [ ] ÐšÐ¾Ð½ÐºÑƒÑ€Ñ Ð±ÑƒÐ´Ðµ Ð½Ð° Ð¿Ð¾ÑÐ°Ð´Ñƒ.\n    - [ ] ÐœÐ¸ Ð¾Ð³Ð¾Ð»Ð¾ÑˆÑƒÑ”Ð¼Ð¾ ÐºÐ¾Ð½ÐºÑƒÑ€Ñ.\n    > Ð‘ÐµÐ·Ð¾ÑÐ¾Ð±Ð¾Ð²Ð° Ð¿Ð°ÑÐ¸Ð²Ð½Ð° Ñ„Ð¾Ñ€Ð¼Ð° ÑÑ‚Ð°Ð½Ð´Ð°Ñ€Ñ‚Ð½Ð°.\n\n11. Permission was granted.\n    - [ ] Ð”Ð¾Ð·Ð²Ñ–Ð» Ð´Ð°Ð»Ð¸.\n    - [x] Ð”Ð¾Ð·Ð²Ñ–Ð» Ð½Ð°Ð´Ð°Ð½Ð¾.\n    - [ ] ÐœÐ¸ Ð½Ð°Ð´Ð°Ð»Ð¸ Ð´Ð¾Ð·Ð²Ñ–Ð».\n    - [ ] Ð„ Ð´Ð¾Ð·Ð²Ñ–Ð».\n    > Â«ÐÐ°Ð´Ð°Ð½Ð¾Â» â€” Ñ„Ð¾Ñ€Ð¼Ð°Ð»ÑŒÐ½Ð¸Ð¹ Ð²Ð°Ñ€Ñ–Ð°Ð½Ñ‚ Â«Ð´Ð°Ð»Ð¸Â».\n\n12. Construction was completed.\n    - [ ] Ð‘ÑƒÐ´Ñ–Ð²Ð½Ð¸Ñ†Ñ‚Ð²Ð¾ Ð·Ð°ÐºÑ–Ð½Ñ‡Ð¸Ð»Ð¸.\n    - [x] Ð‘ÑƒÐ´Ñ–Ð²Ð½Ð¸Ñ†Ñ‚Ð²Ð¾ Ð·Ð°Ð²ÐµÑ€ÑˆÐµÐ½Ð¾.\n    - [ ] ÐœÐ¸ Ð¿Ð¾Ð±ÑƒÐ´ÑƒÐ²Ð°Ð»Ð¸.\n    - [ ] Ð‘ÑƒÐ´Ñ–Ð²Ð»Ñ Ð³Ð¾Ñ‚Ð¾Ð²Ð°.\n    > Â«Ð—Ð°Ð²ÐµÑ€ÑˆÐµÐ½Ð¾Â» â€” Ñ„Ð¾Ñ€Ð¼Ð°Ð»ÑŒÐ½Ð¸Ð¹ Ð²Ð°Ñ€Ñ–Ð°Ð½Ñ‚.\n\n13. The meeting minutes were signed by all participants.\n    - [ ] Ð£ÑÑ– Ð¿Ñ–Ð´Ð¿Ð¸ÑÐ°Ð»Ð¸ Ð¿Ñ€Ð¾Ñ‚Ð¾ÐºÐ¾Ð».\n    - [x] ÐŸÑ€Ð¾Ñ‚Ð¾ÐºÐ¾Ð» Ð¿Ñ–Ð´Ð¿Ð¸ÑÐ°Ð½Ð¾ Ð²ÑÑ–Ð¼Ð° ÑƒÑ‡Ð°ÑÐ½Ð¸ÐºÐ°Ð¼Ð¸.\n    - [ ] Ð£Ñ‡Ð°ÑÐ½Ð¸ÐºÐ¸ Ð¿Ð¾ÑÑ‚Ð°Ð²Ð¸Ð»Ð¸ Ð¿Ñ–Ð´Ð¿Ð¸ÑÐ¸.\n    - [ ] ÐŸÑ€Ð¾Ñ‚Ð¾ÐºÐ¾Ð» Ñ” Ð¿Ñ–Ð´Ð¿Ð¸ÑÐ°Ð½Ð¸Ð¹.\n    > Ð‘ÐµÐ·Ð¾ÑÐ¾Ð±Ð¾Ð²Ð¸Ð¹ Ð¿Ð°ÑÐ¸Ð² Ð· Ð°Ð³ÐµÐ½ÑÐ¾Ð¼ Ð² Ð¾Ñ€ÑƒÐ´Ð½Ð¾Ð¼Ñƒ Ð²Ñ–Ð´Ð¼Ñ–Ð½ÐºÑƒ â€” Ñ‚Ð¸Ð¿Ð¾Ð²Ð° ÐºÐ¾Ð½ÑÑ‚Ñ€ÑƒÐºÑ†Ñ–Ñ Ð´Ð»Ñ Ð¿Ñ€Ð¾Ñ‚Ð¾ÐºÐ¾Ð»Ñ–Ð² Ñ– Ð½Ð°ÐºÐ°Ð·Ñ–Ð².\n\n14. New regulations were introduced.\n    - [ ] Ð—Ð°Ð¿Ñ€Ð¾Ð²Ð°Ð´Ð¸Ð»Ð¸ Ð½Ð¾Ð²Ñ– Ð¿Ñ€Ð°Ð²Ð¸Ð»Ð°.\n    - [x] Ð—Ð°Ð¿Ñ€Ð¾Ð²Ð°Ð´Ð¶ÐµÐ½Ð¾ Ð½Ð¾Ð²Ñ– Ð¿Ñ€Ð°Ð²Ð¸Ð»Ð°.\n    - [ ] ÐœÐ¸ Ð²Ð²ÐµÐ»Ð¸ Ð½Ð¾Ð²Ñ– Ð¿Ñ€Ð°Ð²Ð¸Ð»Ð°.\n    - [ ] ÐÐ¾Ð²Ñ– Ð¿Ñ€Ð°Ð²Ð¸Ð»Ð° Ð¿Ð¾Ñ‡Ð°Ð»Ð¸ Ð´Ñ–ÑÑ‚Ð¸.\n    > Ð‘ÐµÐ·Ð¾ÑÐ¾Ð±Ð¾Ð²Ð° Ð¿Ð°ÑÐ¸Ð²Ð½Ð° Ñ„Ð¾Ñ€Ð¼Ð° ÑÑ‚Ð°Ð½Ð´Ð°Ñ€Ñ‚Ð½Ð°.\n\n15. The task was completed on time.\n    - [ ] Ð—Ð°Ð²Ð´Ð°Ð½Ð½Ñ Ð·Ñ€Ð¾Ð±Ð¸Ð»Ð¸ Ð²Ñ‡Ð°ÑÐ½Ð¾.\n    - [x] Ð—Ð°Ð²Ð´Ð°Ð½Ð½Ñ Ð²Ð¸ÐºÐ¾Ð½Ð°Ð½Ð¾ Ð²Ñ‡Ð°ÑÐ½Ð¾.\n    - [ ] ÐœÐ¸ Ð·Ð°ÐºÑ–Ð½Ñ‡Ð¸Ð»Ð¸ Ð·Ð°Ð²Ð´Ð°Ð½Ð½Ñ.\n    - [ ] Ð—Ð°Ð²Ð´Ð°Ð½Ð½Ñ Ð³Ð¾Ñ‚Ð¾Ð²Ðµ.\n    > Â«Ð’Ð¸ÐºÐ¾Ð½Ð°Ð½Ð¾Â» â€” Ñ„Ð¾Ñ€Ð¼Ð°Ð»ÑŒÐ½Ð¸Ð¹ Ð²Ð°Ñ€Ñ–Ð°Ð½Ñ‚.\n\n16. A responsible person was appointed.\n    - [ ] ÐŸÑ€Ð¸Ð·Ð½Ð°Ñ‡Ð¸Ð»Ð¸ Ð²Ñ–Ð´Ð¿Ð¾Ð²Ñ–Ð´Ð°Ð»ÑŒÐ½Ð¾Ð³Ð¾.\n    - [x] ÐŸÑ€Ð¸Ð·Ð½Ð°Ñ‡ÐµÐ½Ð¾ Ð²Ñ–Ð´Ð¿Ð¾Ð²Ñ–Ð´Ð°Ð»ÑŒÐ½Ð¾Ð³Ð¾.\n    - [ ] ÐœÐ¸ Ð¿Ñ€Ð¸Ð·Ð½Ð°Ñ‡Ð¸Ð»Ð¸ ÐºÐ¾Ð³Ð¾ÑÑŒ.\n    - [ ] Ð„ Ð²Ñ–Ð´Ð¿Ð¾Ð²Ñ–Ð´Ð°Ð»ÑŒÐ½Ð¸Ð¹.\n    > Ð‘ÐµÐ·Ð¾ÑÐ¾Ð±Ð¾Ð²Ð° Ñ„Ð¾Ñ€Ð¼Ð° Ñ‚Ð¸Ð¿Ð¾Ð²Ð° Ð´Ð»Ñ Ð½Ð°ÐºÐ°Ð·Ñ–Ð².\n\n17. Document verification was conducted.\n    - [ ] ÐœÐ¸ Ð¿ÐµÑ€ÐµÐ²Ñ–Ñ€Ð¸Ð»Ð¸ Ð´Ð¾ÐºÑƒÐ¼ÐµÐ½Ñ‚Ð¸.\n    - [x] ÐŸÑ€Ð¾Ð²ÐµÐ´ÐµÐ½Ð¾ Ð¿ÐµÑ€ÐµÐ²Ñ–Ñ€ÐºÑƒ Ð´Ð¾ÐºÑƒÐ¼ÐµÐ½Ñ‚Ñ–Ð².\n    - [ ] Ð”Ð¾ÐºÑƒÐ¼ÐµÐ½Ñ‚Ð¸ Ð¿ÐµÑ€ÐµÐ²Ñ–Ñ€Ð¸Ð»Ð¸.\n    - [ ] Ð”Ð¾ÐºÑƒÐ¼ÐµÐ½Ñ‚Ð¸ Ð¿ÐµÑ€ÐµÐ²Ñ–Ñ€ÐµÐ½Ð¾.\n    > ÐžÐ±Ð¸Ð´Ð²Ð° Ð²Ð°Ñ€Ñ–Ð°Ð½Ñ‚Ð¸ Â«Ð¿Ñ€Ð¾Ð²ÐµÐ´ÐµÐ½Ð¾ Ð¿ÐµÑ€ÐµÐ²Ñ–Ñ€ÐºÑƒÂ» Ñ‚Ð° Â«Ð¿ÐµÑ€ÐµÐ²Ñ–Ñ€ÐµÐ½Ð¾Â» Ð¿Ñ€Ð°Ð²Ð¸Ð»ÑŒÐ½Ñ–.\n\n18. The proposal was approved by the majority.\n    - [ ] Ð‘Ñ–Ð»ÑŒÑˆÑ–ÑÑ‚ÑŒ ÑÑ…Ð²Ð°Ð»Ð¸Ð»Ð° Ð¿Ñ€Ð¾Ð¿Ð¾Ð·Ð¸Ñ†Ñ–ÑŽ.\n    - [x] ÐŸÑ€Ð¾Ð¿Ð¾Ð·Ð¸Ñ†Ñ–ÑŽ ÑÑ…Ð²Ð°Ð»ÐµÐ½Ð¾ Ð±Ñ–Ð»ÑŒÑˆÑ–ÑÑ‚ÑŽ.\n    - [ ] ÐŸÑ€Ð¾Ð¿Ð¾Ð·Ð¸Ñ†Ñ–ÑŽ Ð¿Ñ–Ð´Ñ‚Ñ€Ð¸Ð¼Ð°Ð»Ð¸.\n    - [ ] Ð‘Ñ–Ð»ÑŒÑˆÑ–ÑÑ‚ÑŒ Ð¿Ñ–Ð´Ñ‚Ñ€Ð¸Ð¼Ð°Ð»Ð°.\n    > ÐšÐ¾Ð½ÑÑ‚Ñ€ÑƒÐºÑ†Ñ–Ñ Â«ÑÑ…Ð²Ð°Ð»ÐµÐ½Ð¾ + Ð¾Ñ€ÑƒÐ´Ð½Ð¸Ð¹ Ð²Ñ–Ð´Ð¼Ñ–Ð½Ð¾ÐºÂ» Ñ” Ð½Ð¾Ñ€Ð¼Ð¾ÑŽ Ð´Ð»Ñ Ñ€Ñ–ÑˆÐµÐ½ÑŒ Ñ– Ð¿Ñ€Ð¾Ñ‚Ð¾ÐºÐ¾Ð»Ñ–Ð².\n\n---\n\n## select: ÐŸÑ€Ð°Ð²Ð¸Ð»ÑŒÐ½Ñ– Ñ„Ð¾Ñ€Ð¼Ð¸ Ð¿Ð°ÑÐ¸Ð²Ñƒ\n\n> ÐžÐ±ÐµÑ€Ñ–Ñ‚ÑŒ Ð£Ð¡Ð† Ð¿Ñ€Ð°Ð²Ð¸Ð»ÑŒÐ½Ñ– Ð²Ð°Ñ€Ñ–Ð°Ð½Ñ‚Ð¸ Ð´Ð»Ñ Ð¾Ñ„Ñ–Ñ†Ñ–Ð¹Ð½Ð¾Ð³Ð¾ Ð´Ð¾ÐºÑƒÐ¼ÐµÐ½Ñ‚Ð°.\n\n1. Ð¯ÐºÑ– Ñ„Ð¾Ñ€Ð¼Ð¸ Ñ” Ð¿Ñ€Ð°Ð²Ð¸Ð»ÑŒÐ½Ð¸Ð¼Ð¸ Ð´Ð»Ñ Ð¾Ñ„Ñ–Ñ†Ñ–Ð¹Ð½Ð¾Ð³Ð¾ ÑÑ‚Ð¸Ð»ÑŽ?\n   - [x] Ð Ñ–ÑˆÐµÐ½Ð½Ñ ÑƒÑ…Ð²Ð°Ð»ÐµÐ½Ð¾\n   - [ ] Ð Ñ–ÑˆÐµÐ½Ð½Ñ ÑƒÑ…Ð²Ð°Ð»Ð¸Ð»Ð¸\n   - [x] Ð Ñ–ÑˆÐµÐ½Ð½Ñ Ð±ÑƒÐ»Ð¾ ÑƒÑ…Ð²Ð°Ð»ÐµÐ½Ð¾\n   - [ ] ÐœÐ¸ ÑƒÑ…Ð²Ð°Ð»Ð¸Ð»Ð¸ Ñ€Ñ–ÑˆÐµÐ½Ð½Ñ\n   > Ð¤Ð¾Ñ€Ð¼Ð¸ Ð½Ð° -Ð½Ð¾/-Ñ‚Ð¾ (Ñ– Ð· Â«Ð±ÑƒÐ»Ð¾Â» Ð´Ð»Ñ Ð¼Ð¸Ð½ÑƒÐ»Ð¾Ð³Ð¾ Ñ‡Ð°ÑÑƒ) Ð¾Ð±Ð¾Ð²'ÑÐ·ÐºÐ¾Ð²Ñ– Ð² Ð¾Ñ„Ñ–Ñ†Ñ–Ð¹Ð½Ð¸Ñ… Ð´Ð¾ÐºÑƒÐ¼ÐµÐ½Ñ‚Ð°Ñ….\n\n2. Ð¯ÐºÑ– Ñ€ÐµÑ‡ÐµÐ½Ð½Ñ Ð²Ñ–Ð´Ð¿Ð¾Ð²Ñ–Ð´Ð°ÑŽÑ‚ÑŒ Ð½Ð°ÑƒÐºÐ¾Ð²Ð¾Ð¼Ñƒ ÑÑ‚Ð¸Ð»ÑŽ?\n   - [x] Ð”Ð¾ÑÐ»Ñ–Ð´Ð¶ÐµÐ½Ð½Ñ Ð¿Ñ€Ð¾Ð²ÐµÐ´ÐµÐ½Ð¾ ÑƒÑÐ¿Ñ–ÑˆÐ½Ð¾\n   - [ ] ÐœÐ¸ Ð¿Ñ€Ð¾Ð²ÐµÐ»Ð¸ Ð´Ð¾ÑÐ»Ñ–Ð´Ð¶ÐµÐ½Ð½Ñ Ð´Ð¾Ð±Ñ€Ðµ\n   - [x] Ð’ÑÑ‚Ð°Ð½Ð¾Ð²Ð»ÐµÐ½Ð¾, Ñ‰Ð¾ Ñ–ÑÐ½ÑƒÑ” Ð·Ð°Ð»ÐµÐ¶Ð½Ñ–ÑÑ‚ÑŒ\n   - [ ] ÐœÐ¸ Ð·'ÑÑÑƒÐ²Ð°Ð»Ð¸, Ñ‰Ð¾ Ñ” Ð·Ð²'ÑÐ·Ð¾Ðº\n   > Ð‘ÐµÐ·Ð¾ÑÐ¾Ð±Ð¾Ð²Ñ– Ð¿Ð°ÑÐ¸Ð²Ð½Ñ– ÐºÐ¾Ð½ÑÑ‚Ñ€ÑƒÐºÑ†Ñ–Ñ— ÑƒÐ½Ð¸ÐºÐ°ÑŽÑ‚ÑŒ ÑÑƒÐ±'Ñ”ÐºÑ‚Ð¸Ð²Ð½Ð¾ÑÑ‚Ñ–.\n\n3. Ð¯ÐºÑ– ÑÐ»Ð¾Ð²Ð° Ñ” Ñ‚ÐµÑ€Ð¼Ñ–Ð½Ð°Ð¼Ð¸ Ð°ÐºÐ°Ð´ÐµÐ¼Ñ–Ñ‡Ð½Ð¾Ð³Ð¾ Ð´Ð¸ÑÐºÑƒÑ€ÑÑƒ?\n   - [x] ÐºÐ¾Ð½ÑÐ¾Ð»Ñ–Ð´Ð°Ñ†Ñ–Ñ\n   - [x] ÑÐ¸ÑÑ‚ÐµÐ¼Ð°Ñ‚Ð¸Ð·Ð°Ñ†Ñ–Ñ\n   - [ ] ÐºÑ€ÑƒÑ‚Ð¾\n   - [x] ÑƒÐ·Ð°Ð³Ð°Ð»ÑŒÐ½ÐµÐ½Ð½Ñ\n   > Â«ÐšÑ€ÑƒÑ‚Ð¾Â» â€” Ñ€Ð¾Ð·Ð¼Ð¾Ð²Ð½Ðµ ÑÐ»Ð¾Ð²Ð¾, Ñ–Ð½ÑˆÑ– â€” Ð°ÐºÐ°Ð´ÐµÐ¼Ñ–Ñ‡Ð½Ñ– Ñ‚ÐµÑ€Ð¼Ñ–Ð½Ð¸.\n\n4. Ð¯ÐºÑ– ÐºÐ¾Ð½ÑÑ‚Ñ€ÑƒÐºÑ†Ñ–Ñ— Ð¿Ñ€Ð¸Ð¹Ð½ÑÑ‚Ð½Ñ– Ð´Ð»Ñ Ð½Ð°ÑƒÐºÐ¾Ð²Ð¾Ñ— ÑÑ‚Ð°Ñ‚Ñ‚Ñ–?\n   - [x] Ð‘ÑƒÐ»Ð¾ Ð·Ð°ÑÑ‚Ð¾ÑÐ¾Ð²Ð°Ð½Ð¾ Ð¼ÐµÑ‚Ð¾Ð´\n   - [ ] ÐœÐ¸ Ð²Ð¸ÐºÐ¾Ñ€Ð¸ÑÑ‚Ð°Ð»Ð¸ Ð¼ÐµÑ‚Ð¾Ð´\n   - [x] ÐœÐµÑ‚Ð¾Ð´ Ð±ÑƒÐ»Ð¾ Ð·Ð°ÑÑ‚Ð¾ÑÐ¾Ð²Ð°Ð½Ð¾\n   - [ ] ÐœÐµÑ‚Ð¾Ð´ Ð²Ð¸ÐºÐ¾Ñ€Ð¸ÑÑ‚Ð°Ð»Ð¸ Ð¼Ð¸\n   > ÐŸÐ°ÑÐ¸Ð²Ð½Ñ– ÐºÐ¾Ð½ÑÑ‚Ñ€ÑƒÐºÑ†Ñ–Ñ— Ð¿ÐµÑ€ÐµÐ²Ð°Ð¶Ð°ÑŽÑ‚ÑŒ Ñƒ Ð½Ð°ÑƒÐºÐ¾Ð²Ð¾Ð¼Ñƒ ÑÑ‚Ð¸Ð»Ñ–.\n\n5. Ð¯ÐºÑ– ÑÐ»Ð¾Ð²Ð° Ð¾Ð·Ð½Ð°Ñ‡Ð°ÑŽÑ‚ÑŒ Ð¿ÐµÑ€ÐµÑ…Ñ–Ð´ Ð´Ð¾ Ð²Ð¸Ñ‰Ð¾Ð³Ð¾ Ñ€Ñ–Ð²Ð½Ñ?\n   - [x] Ð¿Ð¾Ð³Ð»Ð¸Ð±Ð»ÐµÐ½Ð½Ñ\n   - [x] Ð²Ð´Ð¾ÑÐºÐ¾Ð½Ð°Ð»ÐµÐ½Ð½Ñ\n   - [ ] Ð¿Ð¾Ð³Ñ–Ñ€ÑˆÐµÐ½Ð½Ñ\n   - [x] Ð¿Ñ€Ð¾ÑÑƒÐ²Ð°Ð½Ð½Ñ\n   > Â«ÐŸÐ¾Ð³Ñ–Ñ€ÑˆÐµÐ½Ð½ÑÂ» Ð¾Ð·Ð½Ð°Ñ‡Ð°Ñ” Ð·Ð²Ð¾Ñ€Ð¾Ñ‚Ð½Ð¸Ð¹ Ð¿Ñ€Ð¾Ñ†ÐµÑ.\n\n6. Ð¯ÐºÑ– Ñ…Ð°Ñ€Ð°ÐºÑ‚ÐµÑ€Ð¸ÑÑ‚Ð¸ÐºÐ¸ Ð²Ð»Ð°ÑÑ‚Ð¸Ð²Ñ– Ð½Ð°ÑƒÐºÐ¾Ð²Ð¾Ð¼Ñƒ ÑÑ‚Ð¸Ð»ÑŽ?\n   - [x] Ð¾Ð±'Ñ”ÐºÑ‚Ð¸Ð²Ð½Ñ–ÑÑ‚ÑŒ\n   - [ ] ÐµÐ¼Ð¾Ñ†Ñ–Ð¹Ð½Ñ–ÑÑ‚ÑŒ\n   - [x] Ñ‚ÐµÑ€Ð¼Ñ–Ð½Ð¾Ð»Ð¾Ð³Ñ–Ñ‡Ð½Ñ–ÑÑ‚ÑŒ\n   - [x] Ñ‚Ð¾Ñ‡Ð½Ñ–ÑÑ‚ÑŒ\n   > Ð•Ð¼Ð¾Ñ†Ñ–Ð¹Ð½Ñ–ÑÑ‚ÑŒ Ñ…Ð°Ñ€Ð°ÐºÑ‚ÐµÑ€Ð½Ð° Ð´Ð»Ñ Ñ…ÑƒÐ´Ð¾Ð¶Ð½ÑŒÐ¾Ð³Ð¾ Ñ‚Ð° Ñ€Ð¾Ð·Ð¼Ð¾Ð²Ð½Ð¾Ð³Ð¾ ÑÑ‚Ð¸Ð»Ñ–Ð².\n\n7. Ð¯ÐºÑ– Ñ„Ð¾Ñ€Ð¼Ð¸ Ð´Ñ–Ñ”ÑÐ»Ð¾Ð²Ð° Â«Ð¿Ñ€Ð¾Ð²Ð¾Ð´Ð¸Ñ‚Ð¸Â» Ð¿Ñ€Ð°Ð²Ð¸Ð»ÑŒÐ½Ñ– Ð´Ð»Ñ Ñ„Ð¾Ñ€Ð¼Ð¸ Ð½Ð° -Ð½Ð¾/-Ñ‚Ð¾?\n   - [x] Ð¿Ñ€Ð¾Ð²ÐµÐ´ÐµÐ½Ð¾\n   - [ ] Ð¿Ñ€Ð¾Ð²Ð¾Ð´Ð¶ÐµÐ½Ð¾\n   - [ ] Ð¿Ñ€Ð¾Ð²Ð¾Ð´Ð¸Ð»Ð¾ÑÑ\n   - [ ] Ð¿Ñ€Ð¾Ð²Ð°Ð´ÐµÐ½Ð¾\n   > Â«ÐŸÑ€Ð¾Ð²ÐµÐ´ÐµÐ½Ð¾Â» â€” Ñ”Ð´Ð¸Ð½Ð° Ð¿Ñ€Ð°Ð²Ð¸Ð»ÑŒÐ½Ð° Ñ„Ð¾Ñ€Ð¼Ð° Ð²Ñ–Ð´ Â«Ð¿Ñ€Ð¾Ð²ÐµÑÑ‚Ð¸Â».\n\n8. Ð¯ÐºÑ– ÑÐ»Ð¾Ð²Ð° Ð· Ð¼Ð¾Ð´ÑƒÐ»Ñ Ð¾Ð·Ð½Ð°Ñ‡Ð°ÑŽÑ‚ÑŒ Ð¿Ð¾ÐºÑ€Ð°Ñ‰ÐµÐ½Ð½Ñ?\n   - [x] Ð²Ð´Ð¾ÑÐºÐ¾Ð½Ð°Ð»ÐµÐ½Ð½Ñ\n   - [x] Ñ€Ð¾Ð·ÑˆÐ¸Ñ€ÐµÐ½Ð½Ñ\n   - [ ] Ð·Ð²ÑƒÐ¶ÐµÐ½Ð½Ñ\n   - [x] Ð¿Ð¾Ð³Ð»Ð¸Ð±Ð»ÐµÐ½Ð½Ñ\n   > Â«Ð—Ð²ÑƒÐ¶ÐµÐ½Ð½ÑÂ» Ð¾Ð·Ð½Ð°Ñ‡Ð°Ñ” Ð·Ð¼ÐµÐ½ÑˆÐµÐ½Ð½Ñ, Ð° Ð½Ðµ Ð¿Ð¾ÐºÑ€Ð°Ñ‰ÐµÐ½Ð½Ñ.\n\n9. Ð¯ÐºÑ– Ñ„Ð¾Ñ€Ð¼Ð¸ Ð¿Ð°ÑÐ¸Ð²Ñƒ Ð¿Ñ–Ð´ÐºÑ€ÐµÑÐ»ÑŽÑŽÑ‚ÑŒ Ð¿Ñ€Ð¾Ñ†ÐµÑ?\n   - [ ] Ð½Ð°Ð¿Ð¸ÑÐ°Ð½Ð¾\n   - [x] Ð¿Ð¸ÑˆÐµÑ‚ÑŒÑÑ\n   - [x] Ñ€Ð¾Ð·Ð³Ð»ÑÐ´Ð°Ñ”Ñ‚ÑŒÑÑ\n   - [ ] Ñ€Ð¾Ð·Ð³Ð»ÑÐ½ÑƒÑ‚Ð¾\n   > Ð—Ð²Ð¾Ñ€Ð¾Ñ‚Ð½Ð¸Ð¹ Ð¿Ð°ÑÐ¸Ð² (-ÑÑ) Ð¿Ñ–Ð´ÐºÑ€ÐµÑÐ»ÑŽÑ” Ð¿Ñ€Ð¾Ñ†ÐµÑ, -Ð½Ð¾/-Ñ‚Ð¾ â€” Ñ€ÐµÐ·ÑƒÐ»ÑŒÑ‚Ð°Ñ‚.\n\n10. Ð¯ÐºÑ– ÑÑ‚Ð¸Ð»Ñ– Ð°ÐºÑ‚Ð¸Ð²Ð½Ð¾ Ð²Ð¸ÐºÐ¾Ñ€Ð¸ÑÑ‚Ð¾Ð²ÑƒÑŽÑ‚ÑŒ Ð¿Ð°ÑÐ¸Ð²Ð½Ð¸Ð¹ ÑÑ‚Ð°Ð½?\n    - [x] Ð½Ð°ÑƒÐºÐ¾Ð²Ð¸Ð¹\n    - [x] Ð¾Ñ„Ñ–Ñ†Ñ–Ð¹Ð½Ð¾-Ð´Ñ–Ð»Ð¾Ð²Ð¸Ð¹\n    - [ ] Ñ€Ð¾Ð·Ð¼Ð¾Ð²Ð½Ð¸Ð¹\n    - [x] Ð¿ÑƒÐ±Ð»Ñ–Ñ†Ð¸ÑÑ‚Ð¸Ñ‡Ð½Ð¸Ð¹\n    > Ð£ Ñ€Ð¾Ð·Ð¼Ð¾Ð²Ð½Ð¾Ð¼Ñƒ ÑÑ‚Ð¸Ð»Ñ– Ð¿ÐµÑ€ÐµÐ²Ð°Ð¶Ð°Ñ” Ð°ÐºÑ‚Ð¸Ð²Ð½Ð¸Ð¹ ÑÑ‚Ð°Ð½.\n\n---\n\n## dialogue-reorder: Ð—Ð°Ñ…Ð¸ÑÑ‚ Ð¿Ñ€Ð¾Ñ”ÐºÑ‚Ñƒ\n\n> Ð Ð¾Ð·Ñ‚Ð°ÑˆÑƒÐ¹Ñ‚Ðµ Ñ€ÐµÐ¿Ð»Ñ–ÐºÐ¸ Ð² Ð¿Ñ€Ð°Ð²Ð¸Ð»ÑŒÐ½Ð¾Ð¼Ñƒ Ð¿Ð¾Ñ€ÑÐ´ÐºÑƒ.\n\n- Ð: Ð¨Ð°Ð½Ð¾Ð²Ð½Ð° ÐºÐ¾Ð¼Ñ–ÑÑ–Ñ”, Ð´Ð¾Ð·Ð²Ð¾Ð»ÑŒÑ‚Ðµ Ð¿Ñ€ÐµÐ´ÑÑ‚Ð°Ð²Ð¸Ñ‚Ð¸ Ñ€ÐµÐ·ÑƒÐ»ÑŒÑ‚Ð°Ñ‚Ð¸ Ð¼Ð¾Ð³Ð¾ Ð´Ð¾ÑÐ»Ñ–Ð´Ð¶ÐµÐ½Ð½Ñ.\n- Ð‘: Ð‘ÑƒÐ´ÑŒ Ð»Ð°ÑÐºÐ°, Ñ€Ð¾Ð·Ð¿Ð¾Ñ‡Ð¸Ð½Ð°Ð¹Ñ‚Ðµ.\n- Ð: ÐŸÑ€Ð¾Ñ”ÐºÑ‚ Ð¿Ñ€Ð¸ÑÐ²ÑÑ‡ÐµÐ½Ð¾ Ð°Ð½Ð°Ð»Ñ–Ð·Ñƒ Ð¼Ð¾Ð²Ð½Ð¾Ñ— Ð¿Ð¾Ð»Ñ–Ñ‚Ð¸ÐºÐ¸ Ð² Ð£ÐºÑ€Ð°Ñ—Ð½Ñ–.\n- Ð‘: Ð¯ÐºÑƒ Ð¼ÐµÑ‚Ð¾Ð´Ð¾Ð»Ð¾Ð³Ñ–ÑŽ Ð·Ð°ÑÑ‚Ð¾ÑÐ¾Ð²Ð°Ð½Ð¾?\n- Ð: Ð‘ÑƒÐ»Ð¾ Ð²Ð¸ÐºÐ¾Ñ€Ð¸ÑÑ‚Ð°Ð½Ð¾ ÐºÐ¾Ð¼Ð¿Ð»ÐµÐºÑÐ½Ð¸Ð¹ Ð¿Ñ–Ð´Ñ…Ñ–Ð´: ÐºÑ–Ð»ÑŒÐºÑ–ÑÐ½Ð¸Ð¹ Ñ‚Ð° ÑÐºÑ–ÑÐ½Ð¸Ð¹ Ð°Ð½Ð°Ð»Ñ–Ð·.\n- Ð‘: Ð¯ÐºÑ– Ð¾ÑÐ½Ð¾Ð²Ð½Ñ– Ð²Ð¸ÑÐ½Ð¾Ð²ÐºÐ¸?\n- Ð: Ð’ÑÑ‚Ð°Ð½Ð¾Ð²Ð»ÐµÐ½Ð¾, Ñ‰Ð¾ Ð¼Ð¾Ð²Ð½Ð° Ð¿Ð¾Ð»Ñ–Ñ‚Ð¸ÐºÐ° Ð²Ð¿Ð»Ð¸Ð²Ð°Ñ” Ð½Ð° Ð½Ð°Ñ†Ñ–Ð¾Ð½Ð°Ð»ÑŒÐ½Ñƒ Ñ–Ð´ÐµÐ½Ñ‚Ð¸Ñ‡Ð½Ñ–ÑÑ‚ÑŒ.\n- Ð‘: Ð§Ð¸ Ñ” Ð¾Ð±Ð¼ÐµÐ¶ÐµÐ½Ð½Ñ Ð´Ð¾ÑÐ»Ñ–Ð´Ð¶ÐµÐ½Ð½Ñ?\n- Ð: Ð¢Ð°Ðº, Ð¿Ð¾Ñ‚Ñ€ÐµÐ±ÑƒÑ” Ð¿Ð¾Ð³Ð»Ð¸Ð±Ð»ÐµÐ½Ð½Ñ Ð½Ð° ÑˆÐ¸Ñ€ÑˆÑ–Ð¹ Ð²Ð¸Ð±Ñ–Ñ€Ñ†Ñ–.\n- Ð‘: Ð”ÑÐºÑƒÑ”Ð¼Ð¾. ÐŸÑ€Ð¾Ñ”ÐºÑ‚ Ñ€ÐµÐºÐ¾Ð¼ÐµÐ½Ð´Ð¾Ð²Ð°Ð½Ð¾ Ð´Ð¾ Ð·Ð°Ñ…Ð¸ÑÑ‚Ñƒ.\n\n---"
      },
      {
        "id": "section-4",
        "name": "Ð¡Ð»Ð¾Ð²Ð½Ð¸Ðº",
        "nameEn": null,
        "type": "vocabulary",
        "content": "| Ð¡Ð»Ð¾Ð²Ð¾ | ÐŸÐµÑ€ÐµÐºÐ»Ð°Ð´ | ÐŸÑ€Ð¸Ð¼Ñ–Ñ‚ÐºÐ¸ |\n|-------|----------|----------|\n| Ð¿Ð¾Ð²Ñ‚Ð¾Ñ€ÐµÐ½Ð½Ñ | review, revision | Ñ–Ð¼., n |\n| ÑƒÐ·Ð°Ð³Ð°Ð»ÑŒÐ½ÐµÐ½Ð½Ñ | generalization | Ñ–Ð¼., n |\n| ÑÐ¸ÑÑ‚ÐµÐ¼Ð°Ñ‚Ð¸Ð·Ð°Ñ†Ñ–Ñ | systematization | Ñ–Ð¼., f |\n| ÐºÐ¾Ð½ÑÐ¾Ð»Ñ–Ð´Ð°Ñ†Ñ–Ñ | consolidation | Ñ–Ð¼., f |\n| Ð¿ÐµÑ€ÐµÑ…Ñ–Ð´ | transition | Ñ–Ð¼., m |\n| Ð¿Ñ€Ð¾ÑÑƒÐ½ÑƒÑ‚Ð¸Ð¹ | advanced | Ð¿Ñ€Ð¸ÐºÐ¼. |\n| Ð°ÐºÐ°Ð´ÐµÐ¼Ñ–Ñ‡Ð½Ð¸Ð¹ | academic | Ð¿Ñ€Ð¸ÐºÐ¼. |\n| Ñ„Ð°Ñ…Ð¾Ð²Ð¸Ð¹ | professional, expert | Ð¿Ñ€Ð¸ÐºÐ¼. |\n| Ð´Ð¾ÑÐºÐ¾Ð½Ð°Ð»Ñ–ÑÑ‚ÑŒ | perfection | Ñ–Ð¼., f |\n| Ð¼Ð°Ð¹ÑÑ‚ÐµÑ€Ð½Ñ–ÑÑ‚ÑŒ | mastery | Ñ–Ð¼., f |\n| Ð¾Ð¿Ð°Ð½ÑƒÐ²Ð°Ð½Ð½Ñ | mastering | Ñ–Ð¼., n |\n| Ð²Ð´Ð¾ÑÐºÐ¾Ð½Ð°Ð»ÐµÐ½Ð½Ñ | improvement | Ñ–Ð¼., n |\n| Ð¿Ð¾Ð³Ð»Ð¸Ð±Ð»ÐµÐ½Ð½Ñ | deepening | Ñ–Ð¼., n |\n| Ñ€Ð¾Ð·ÑˆÐ¸Ñ€ÐµÐ½Ð½Ñ | expansion | Ñ–Ð¼., n |\n| Ð·Ð°ÐºÑ€Ñ–Ð¿Ð»ÐµÐ½Ð½Ñ | consolidation, reinforcement | Ñ–Ð¼., n |\n| Ð·Ð°ÑÑ‚Ð¾ÑÑƒÐ²Ð°Ð½Ð½Ñ | application | Ñ–Ð¼., n |\n| Ñ–Ð½Ñ‚ÐµÐ³Ñ€Ð°Ñ†Ñ–Ñ | integration | Ñ–Ð¼., f |\n| ÑÐ¸Ð½Ñ‚ÐµÐ· | synthesis | Ñ–Ð¼., m |\n| Ð°Ð½Ð°Ð»Ñ–Ð· | analysis | Ñ–Ð¼., m |\n| Ð¾Ñ†Ñ–Ð½ÑŽÐ²Ð°Ð½Ð½Ñ | assessment, evaluation | Ñ–Ð¼., n |\n| Ñ€ÐµÐ³Ñ–ÑÑ‚Ñ€ | register (style level) | Ñ–Ð¼., m |\n| Ñ„Ð¾Ñ€Ð¼ÑƒÐ»ÑŽÐ²Ð°Ð½Ð½Ñ | formulation, wording | Ñ–Ð¼., n |\n| ÑÑ‚Ð°Ð½Ð´Ð°Ñ€Ñ‚Ð¸Ð·Ð°Ñ†Ñ–Ñ | standardization | Ñ–Ð¼., f |\n| Ð²Ð¿Ñ€Ð¾Ð²Ð°Ð´Ð¶ÐµÐ½Ð½Ñ | implementation | Ñ–Ð¼., n |\n| Ð¿ÑƒÐ±Ð»Ñ–Ñ†Ð¸ÑÑ‚Ð¸ÐºÐ° | journalism | Ñ–Ð¼., f |\n| ÐºÐ¾Ð°Ð»Ñ–Ñ†Ñ–Ñ | coalition | Ñ–Ð¼., f |"
      }
    ],
    "rawMarkdown": "---\nmodule: c1-01\ntitle: \"B2 Review & Bridge to C1\"\nsubtitle: \"ÐŸÐ¾Ð²Ñ‚Ð¾Ñ€ÐµÐ½Ð½Ñ Ñ‚Ð° Ð¿ÐµÑ€ÐµÑ…Ñ–Ð´ Ð´Ð¾ Ð¿Ñ€Ð¾ÑÑƒÐ½ÑƒÑ‚Ð¾Ð³Ð¾ Ñ€Ñ–Ð²Ð½Ñ\"\nversion: \"1.0\"\nphase: \"C1.1\"\npedagogy: \"TTT\"\nduration: 90\ntransliteration: none\ntags:\n  - passive-voice\n  - register\n  - academic-style\n  - official-style\n  - B2-review\ngrammar:\n  - passive-voice-forms\n  - register-selection\n  - functional-styles\nobjectives:\n  - \"Learner can select the correct passive voice form for each register\"\n  - \"Learner can transform sentences between active and passive voice\"\n  - \"Learner can identify and correct register mismatches in academic writing\"\n  - \"Learner can apply B2 phraseology in academic contexts\"\nvocabulary_count: 20\n---\n\n# B2 Review & Bridge to C1\n\n> Ð›Ð°ÑÐºÐ°Ð²Ð¾ Ð¿Ñ€Ð¾ÑÐ¸Ð¼Ð¾ Ð´Ð¾ Ñ€Ñ–Ð²Ð½Ñ C1! Ð¦ÐµÐ¹ Ð¼Ð¾Ð´ÑƒÐ»ÑŒ â€” Ð²Ð°Ñˆ Ð¼Ñ–ÑÑ‚Ð¾Ðº Ð²Ñ–Ð´ Ð²Ð¿ÐµÐ²Ð½ÐµÐ½Ð¾Ð³Ð¾ Ð²Ð¾Ð»Ð¾Ð´Ñ–Ð½Ð½Ñ Ð´Ð¾ ÑÐ¿Ñ€Ð°Ð²Ð¶Ð½ÑŒÐ¾Ñ— Ð¼Ð°Ð¹ÑÑ‚ÐµÑ€Ð½Ð¾ÑÑ‚Ñ–.\n\n## Diagnostic: ÐŸÐµÑ€ÐµÐ²Ñ–Ñ€Ñ‚Ðµ ÑÐ²Ð¾Ñ— Ð·Ð½Ð°Ð½Ð½Ñ\n\nÐŸÐµÑ€Ñˆ Ð½Ñ–Ð¶ Ñ€ÑƒÑ…Ð°Ñ‚Ð¸ÑÑ Ð´Ð°Ð»Ñ–, Ð¿ÐµÑ€ÐµÐ²Ñ–Ñ€Ð¸Ð¼Ð¾, Ð½Ð°ÑÐºÑ–Ð»ÑŒÐºÐ¸ Ð³Ð»Ð¸Ð±Ð¾ÐºÐ¾ Ð²Ð¸ Ð·Ð°ÑÐ²Ð¾Ñ—Ð»Ð¸ Ð¼Ð°Ñ‚ÐµÑ€Ñ–Ð°Ð» Ñ€Ñ–Ð²Ð½Ñ B2. ÐÐ¸Ð¶Ñ‡Ðµ Ð½Ð°Ð²ÐµÐ´ÐµÐ½Ð¾ Ñ‡Ð¾Ñ‚Ð¸Ñ€Ð¸ Ñ€ÐµÑ‡ÐµÐ½Ð½Ñ Ð· Ð¿Ð°ÑÐ¸Ð²Ð½Ð¸Ð¼ ÑÑ‚Ð°Ð½Ð¾Ð¼. Ð’Ð°ÑˆÐµ Ð·Ð°Ð²Ð´Ð°Ð½Ð½Ñ â€” Ð²Ð¸Ð·Ð½Ð°Ñ‡Ð¸Ñ‚Ð¸, ÑÐºÐ° Ñ„Ð¾Ñ€Ð¼Ð° Ð¿Ð°ÑÐ¸Ð²Ð½Ð¾Ð³Ð¾ ÑÑ‚Ð°Ð½Ñƒ Ð²Ð¸ÐºÐ¾Ñ€Ð¸ÑÑ‚Ð°Ð½Ð° Ñ‚Ð° Ñ‡Ð¸ Ð²Ñ–Ð´Ð¿Ð¾Ð²Ñ–Ð´Ð°Ñ” Ð²Ð¾Ð½Ð° Ñ€ÐµÐ³Ñ–ÑÑ‚Ñ€Ñƒ Ñ‚ÐµÐºÑÑ‚Ñƒ.\n\n> [!observe]\n> **Ð ÐµÑ‡ÐµÐ½Ð½Ñ Ð:** Ð›Ð¸ÑÑ‚ **Ð±ÑƒÐ»Ð¾ Ð½Ð°Ð¿Ð¸ÑÐ°Ð½Ð¾** Ð²Ñ‡Ð¾Ñ€Ð° Ð²Ð²ÐµÑ‡ÐµÑ€Ñ–.\n> **Ð ÐµÑ‡ÐµÐ½Ð½Ñ Ð‘:** Ð”Ð¾ÐºÑƒÐ¼ÐµÐ½Ñ‚ **Ð½Ð°Ð¿Ð¸ÑÐ°Ð½Ð¸Ð¹** Ð´Ð¸Ñ€ÐµÐºÑ‚Ð¾Ñ€Ð¾Ð¼.\n> **Ð ÐµÑ‡ÐµÐ½Ð½Ñ Ð’:** Ð¦Ñ Ð¿Ñ€Ð¾Ð±Ð»ÐµÐ¼Ð° **Ñ€Ð¾Ð·Ð²'ÑÐ·ÑƒÑ”Ñ‚ÑŒÑÑ** Ð½Ð°ÑˆÐ¾ÑŽ ÐºÐ¾Ð¼Ð°Ð½Ð´Ð¾ÑŽ.\n> **Ð ÐµÑ‡ÐµÐ½Ð½Ñ Ð“:** ÐšÐ¾Ð½Ñ‚Ñ€Ð°ÐºÑ‚ **Ð¿Ñ–Ð´Ð¿Ð¸ÑÑƒÑ”Ñ‚ÑŒÑÑ** Ð¾Ð±Ð¾Ð¼Ð° ÑÑ‚Ð¾Ñ€Ð¾Ð½Ð°Ð¼Ð¸ Ñ‰Ð¾Ñ€Ð¾ÐºÑƒ.\n>\n> ðŸ”Ž Ð¯ÐºÑ– Ñ„Ð¾Ñ€Ð¼Ð¸ Ð¿Ð°ÑÐ¸Ð²Ð½Ð¾Ð³Ð¾ ÑÑ‚Ð°Ð½Ñƒ Ñ‚ÑƒÑ‚ Ð²Ð¸ÐºÐ¾Ñ€Ð¸ÑÑ‚Ð°Ð½Ð¾? Ð¯ÐºÐ° Ð· Ð½Ð¸Ñ… Ð½Ð°Ð¹Ð±Ñ–Ð»ÑŒÑˆ Ñ„Ð¾Ñ€Ð¼Ð°Ð»ÑŒÐ½Ð°?\n\n### Ð ÐµÐ³Ñ–ÑÑ‚Ñ€Ð¾Ð²Ð° Ð·Ð°Ð³Ð°Ð´ÐºÐ°\n\nÐ£ÑÐ²Ñ–Ñ‚ÑŒ: Ð²Ð¸ Ñ‡Ð¸Ñ‚Ð°Ñ”Ñ‚Ðµ Ð½Ð°ÑƒÐºÐ¾Ð²Ñƒ ÑÑ‚Ð°Ñ‚Ñ‚ÑŽ Ð¿Ñ€Ð¾ ÐºÐ»Ñ–Ð¼Ð°Ñ‚Ð¸Ñ‡Ð½Ñ– Ð·Ð¼Ñ–Ð½Ð¸. Ð Ð°Ð¿Ñ‚Ð¾Ð¼ Ð½Ð°Ñ‚Ñ€Ð°Ð¿Ð»ÑÑ”Ñ‚Ðµ Ð½Ð° Ñ‚Ð°ÐºÐµ Ñ€ÐµÑ‡ÐµÐ½Ð½Ñ:\n\n> *Â«Ð”Ð¾ÑÐ»Ñ–Ð´Ð¶ÐµÐ½Ð½Ñ Ð¿Ñ€Ð¾Ð²Ð¾Ð´Ð¸Ð»Ð¾ÑÑ ÐºÐ¾Ð¼Ð°Ð½Ð´Ð¾ÑŽ Ð²Ñ‡ÐµÐ½Ð¸Ñ…, Ñ– Ñ€ÐµÐ·ÑƒÐ»ÑŒÑ‚Ð°Ñ‚Ð¸ Ð²Ð¶Ðµ Ð¾Ð¿ÑƒÐ±Ð»Ñ–ÐºÑƒÐ²Ð°Ð»Ð¸.Â»*\n\nÐ©Ð¾ÑÑŒ Ð½Ðµ Ñ‚Ð°Ðº. Ð’Ñ–Ð´Ñ‡ÑƒÐ²Ð°Ñ”Ñ‚Ðµ? ÐŸÐµÑ€ÑˆÐ° Ñ‡Ð°ÑÑ‚Ð¸Ð½Ð° â€” Ñ„Ð¾Ñ€Ð¼Ð°Ð»ÑŒÐ½Ð¸Ð¹ Ð½Ð°ÑƒÐºÐ¾Ð²Ð¸Ð¹ ÑÑ‚Ð¸Ð»ÑŒ Ð· Ð¿Ð°ÑÐ¸Ð²Ð½Ð¸Ð¼ ÑÑ‚Ð°Ð½Ð¾Ð¼. Ð”Ñ€ÑƒÐ³Ð° â€” Ñ€Ð°Ð¿Ñ‚Ð¾Ð¼ Ð¿ÐµÑ€ÐµÑ…Ñ–Ð´ Ð´Ð¾ Ð°ÐºÑ‚Ð¸Ð²Ð½Ð¾Ð³Ð¾ ÑÑ‚Ð°Ð½Ñƒ Ð· Ð½ÐµÐ²Ð¸Ð·Ð½Ð°Ñ‡ÐµÐ½Ð¸Ð¼ ÑÑƒÐ±'Ñ”ÐºÑ‚Ð¾Ð¼. Ð¢Ð°ÐºÑ– Â«Ñ€ÐµÐ³Ñ–ÑÑ‚Ñ€Ð¾Ð²Ñ– ÑÑ‚Ñ€Ð¸Ð±ÐºÐ¸Â» â€” Ñ‚Ð¸Ð¿Ð¾Ð²Ð° Ð¿Ð¾Ð¼Ð¸Ð»ÐºÐ° Ð½Ð° ÑˆÐ»ÑÑ…Ñƒ Ð´Ð¾ C1.\n\n> ðŸ’¡ **ÐžÐ·Ð½Ð°ÐºÐ° Ð¼Ð°Ð¹ÑÑ‚ÐµÑ€Ð½Ð¾ÑÑ‚Ñ–**\n>\n> ÐÐ° Ñ€Ñ–Ð²Ð½Ñ– C1 Ð²Ð¸ Ð½Ðµ Ð¿Ñ€Ð¾ÑÑ‚Ð¾ Ð·Ð½Ð°Ñ”Ñ‚Ðµ Ð¿Ñ€Ð°Ð²Ð¸Ð»Ð° â€” Ð²Ð¸ Ð²Ñ–Ð´Ñ‡ÑƒÐ²Ð°Ñ”Ñ‚Ðµ, ÐºÐ¾Ð»Ð¸ Ñ‰Ð¾ÑÑŒ Â«Ð·Ð²ÑƒÑ‡Ð¸Ñ‚ÑŒ Ð½Ðµ Ñ‚Ð°ÐºÂ». Ð¦Ðµ Ð¼Ð¾Ð²Ð½Ð° Ñ–Ð½Ñ‚ÑƒÑ—Ñ†Ñ–Ñ, ÑÐºÑƒ Ð¼Ð¸ Ð±ÑƒÐ´ÐµÐ¼Ð¾ Ñ€Ð¾Ð·Ð²Ð¸Ð²Ð°Ñ‚Ð¸.\n\n### Ð¡Ð°Ð¼Ð¾Ð´Ñ–Ð°Ð³Ð½Ð¾ÑÑ‚Ð¸ÐºÐ°: Ñ‡Ð¾Ñ‚Ð¸Ñ€Ð¸ Ñ„Ð¾Ñ€Ð¼Ð¸ Ð¿Ð°ÑÐ¸Ð²Ð½Ð¾Ð³Ð¾ ÑÑ‚Ð°Ð½Ñƒ\n\nÐŸÐµÑ€Ñˆ Ð½Ñ–Ð¶ Ñ‡Ð¸Ñ‚Ð°Ñ‚Ð¸ Ð´Ð°Ð»Ñ–, ÑÐ¿Ñ€Ð¾Ð±ÑƒÐ¹Ñ‚Ðµ Ð·Ð°Ð¿Ð¾Ð²Ð½Ð¸Ñ‚Ð¸ Ñ†ÑŽ Ñ‚Ð°Ð±Ð»Ð¸Ñ†ÑŽ ÑÐ°Ð¼Ð¾ÑÑ‚Ñ–Ð¹Ð½Ð¾:\n\n| Ð¤Ð¾Ñ€Ð¼Ð° | ÐŸÑ€Ð¸ÐºÐ»Ð°Ð´ | Ð ÐµÐ³Ñ–ÑÑ‚Ñ€ |\n|-------|---------|---------|\n| -Ð½Ð¸Ð¹/-Ñ‚Ð¸Ð¹ + Ñ”/Ð±ÑƒÐ² | ? | ? |\n| -Ð½Ð¾/-Ñ‚Ð¾ | ? | ? |\n| -ÑÑ (Ñ‚ÐµÐ¿ÐµÑ€Ñ–ÑˆÐ½Ñ–Ð¹) | ? | ? |\n| -ÑÑ (Ð¼Ð¸Ð½ÑƒÐ»Ð¸Ð¹) | ? | ? |\n\nÐ¯ÐºÑ‰Ð¾ Ð²Ð¸ Ð·Ð°Ð¿Ð¾Ð²Ð½Ð¸Ð»Ð¸ Ð²ÑÐµ Ð¿Ñ€Ð°Ð²Ð¸Ð»ÑŒÐ½Ð¾ â€” Ð²Ð¸ Ð³Ð¾Ñ‚Ð¾Ð²Ñ– Ð´Ð¾ C1. Ð¯ÐºÑ‰Ð¾ Ð½Ñ– â€” Ñ†ÐµÐ¹ Ð¼Ð¾Ð´ÑƒÐ»ÑŒ ÑÐ°Ð¼Ðµ Ð´Ð»Ñ Ð²Ð°Ñ.\n\n## Analysis: Ð¡Ð¸ÑÑ‚ÐµÐ¼Ð°Ñ‚Ð¸Ð·Ð°Ñ†Ñ–Ñ Ð¿Ð°ÑÐ¸Ð²Ð½Ð¾Ð³Ð¾ ÑÑ‚Ð°Ð½Ñƒ\n\nÐ¢ÐµÐ¿ÐµÑ€ Ð¿Ñ€Ð¾Ð°Ð½Ð°Ð»Ñ–Ð·ÑƒÐ¹Ð¼Ð¾ Ð²Ñ–Ð´Ð¿Ð¾Ð²Ñ–Ð´Ñ– Ð½Ð° Ð´Ñ–Ð°Ð³Ð½Ð¾ÑÑ‚Ð¸Ñ‡Ð½Ðµ Ð·Ð°Ð²Ð´Ð°Ð½Ð½Ñ. Ð£ÐºÑ€Ð°Ñ—Ð½ÑÑŒÐºÐ° Ð¼Ð¾Ð²Ð° Ð¼Ð°Ñ” Ñ‡Ð¾Ñ‚Ð¸Ñ€Ð¸ Ð¾ÑÐ½Ð¾Ð²Ð½Ñ– ÑÐ¿Ð¾ÑÐ¾Ð±Ð¸ Ð²Ð¸Ñ€Ð°Ð¶ÐµÐ½Ð½Ñ Ð¿Ð°ÑÐ¸Ð²Ð½Ð¾Ð³Ð¾ ÑÑ‚Ð°Ð½Ñƒ, Ñ– ÐºÐ¾Ð¶ÐµÐ½ Ð· Ð½Ð¸Ñ… Ð¼Ð°Ñ” ÑÐ²Ð¾Ñ” Ð¼Ñ–ÑÑ†Ðµ Ð² ÑÐ¸ÑÑ‚ÐµÐ¼Ñ– Ñ€ÐµÐ³Ñ–ÑÑ‚Ñ€Ñ–Ð². Ð Ð¾Ð·ÑƒÐ¼Ñ–Ð½Ð½Ñ Ñ†Ð¸Ñ… Ñ„Ð¾Ñ€Ð¼ Ñ” ÐºÑ€Ð¸Ñ‚Ð¸Ñ‡Ð½Ð¾ Ð²Ð°Ð¶Ð»Ð¸Ð²Ð¸Ð¼ Ð´Ð»Ñ ÑƒÑÐ¿Ñ–ÑˆÐ½Ð¾Ñ— ÐºÐ¾Ð¼ÑƒÐ½Ñ–ÐºÐ°Ñ†Ñ–Ñ— Ð² Ð°ÐºÐ°Ð´ÐµÐ¼Ñ–Ñ‡Ð½Ð¾Ð¼Ñƒ ÑÐµÑ€ÐµÐ´Ð¾Ð²Ð¸Ñ‰Ñ–. ÐÐ° Ð²Ñ–Ð´Ð¼Ñ–Ð½Ñƒ Ð²Ñ–Ð´ Ð±Ð°Ð³Ð°Ñ‚ÑŒÐ¾Ñ… Ñ–Ð½ÑˆÐ¸Ñ… Ð¼Ð¾Ð², ÑƒÐºÑ€Ð°Ñ—Ð½ÑÑŒÐºÐ° Ð¿Ñ€Ð¾Ð¿Ð¾Ð½ÑƒÑ” Ð±Ð°Ð³Ð°Ñ‚Ð¸Ð¹ Ð²Ð¸Ð±Ñ–Ñ€ Ð¿Ð°ÑÐ¸Ð²Ð½Ð¸Ñ… ÐºÐ¾Ð½ÑÑ‚Ñ€ÑƒÐºÑ†Ñ–Ð¹, ÐºÐ¾Ð¶Ð½Ð° Ð· ÑÐºÐ¸Ñ… Ð½ÐµÑÐµ Ð¾ÑÐ¾Ð±Ð»Ð¸Ð²Ð¸Ð¹ ÑÑ‚Ð¸Ð»Ñ–ÑÑ‚Ð¸Ñ‡Ð½Ð¸Ð¹ Ð²Ñ–Ð´Ñ‚Ñ–Ð½Ð¾Ðº. ÐžÐ¿Ð°Ð½ÑƒÐ²Ð°Ð²ÑˆÐ¸ Ñ†Ñ– Ñ„Ð¾Ñ€Ð¼Ð¸, Ð²Ð¸ Ð·Ð¼Ð¾Ð¶ÐµÑ‚Ðµ Ð¿Ð¸ÑÐ°Ñ‚Ð¸ Ñ‚ÐµÐºÑÑ‚Ð¸ Ñ€Ñ–Ð·Ð½Ð¸Ñ… Ð¶Ð°Ð½Ñ€Ñ–Ð² â€” Ð²Ñ–Ð´ Ð½Ð°ÑƒÐºÐ¾Ð²Ð¸Ñ… ÑÑ‚Ð°Ñ‚ÐµÐ¹ Ð´Ð¾ Ð¾Ñ„Ñ–Ñ†Ñ–Ð¹Ð½Ð¸Ñ… Ð´Ð¾ÐºÑƒÐ¼ÐµÐ½Ñ‚Ñ–Ð² â€” Ð· Ð½Ð°Ð»ÐµÐ¶Ð½Ð¾ÑŽ Ñ‚Ð¾Ñ‡Ð½Ñ–ÑÑ‚ÑŽ Ñ‚Ð° ÐµÐ»ÐµÐ³Ð°Ð½Ñ‚Ð½Ñ–ÑÑ‚ÑŽ.\n\n### Ð¤Ð¾Ñ€Ð¼Ð° 1: Ð”Ñ–Ñ”Ð¿Ñ€Ð¸ÐºÐ¼ÐµÑ‚Ð½Ð¸ÐºÐ¾Ð²Ð¸Ð¹ Ð¿Ð°ÑÐ¸Ð² (-Ð½Ð¸Ð¹/-Ñ‚Ð¸Ð¹ + Ð±ÑƒÑ‚Ð¸)\n\n**Ð¡Ñ‚Ñ€ÑƒÐºÑ‚ÑƒÑ€Ð°:** Ð´Ñ–Ñ”Ð¿Ñ€Ð¸ÐºÐ¼ÐµÑ‚Ð½Ð¸Ðº + Ð´Ð¾Ð¿Ð¾Ð¼Ñ–Ð¶Ð½Ðµ Ð´Ñ–Ñ”ÑÐ»Ð¾Ð²Ð¾ Â«Ð±ÑƒÑ‚Ð¸Â»\n\n| Ð§Ð°Ñ | ÐŸÑ€Ð¸ÐºÐ»Ð°Ð´ | ÐŸÑ€Ð¸Ð¼Ñ–Ñ‚ÐºÐ° |\n|-----|---------|----------|\n| Ð¢ÐµÐ¿ÐµÑ€Ñ–ÑˆÐ½Ñ–Ð¹ | Ð”Ð¾ÐºÑƒÐ¼ÐµÐ½Ñ‚ **Ñ” Ð¿Ñ–Ð´Ð¿Ð¸ÑÐ°Ð½Ð¸Ð¹** | Ð Ñ–Ð´ÐºÐ¾ Ð²Ð¶Ð¸Ð²Ð°Ñ”Ñ‚ÑŒÑÑ |\n| ÐœÐ¸Ð½ÑƒÐ»Ð¸Ð¹ | Ð”Ð¾ÐºÑƒÐ¼ÐµÐ½Ñ‚ **Ð±ÑƒÐ² Ð¿Ñ–Ð´Ð¿Ð¸ÑÐ°Ð½Ð¸Ð¹** | Ð¡Ñ‚Ð°Ð½Ð´Ð°Ñ€Ñ‚Ð½Ð° Ñ„Ð¾Ñ€Ð¼Ð° |\n| ÐœÐ°Ð¹Ð±ÑƒÑ‚Ð½Ñ–Ð¹ | Ð”Ð¾ÐºÑƒÐ¼ÐµÐ½Ñ‚ **Ð±ÑƒÐ´Ðµ Ð¿Ñ–Ð´Ð¿Ð¸ÑÐ°Ð½Ð¸Ð¹** | ÐÐµÐ¹Ñ‚Ñ€Ð°Ð»ÑŒÐ½Ð¸Ð¹ Ñ€ÐµÐ³Ñ–ÑÑ‚Ñ€ |\n\n> ðŸ“œ **Ð†ÑÑ‚Ð¾Ñ€Ð¸Ñ‡Ð½Ð° Ð´Ð¾Ð²Ñ–Ð´ÐºÐ°**\n>\n> Ð¦Ñ Ñ„Ð¾Ñ€Ð¼Ð° â€” Ð½Ð°Ð¹ÑÑ‚Ð°Ñ€Ñ–ÑˆÐ° Ð² ÑƒÐºÑ€Ð°Ñ—Ð½ÑÑŒÐºÑ–Ð¹ Ð¼Ð¾Ð²Ñ–. Ð’Ð¾Ð½Ð° Ð¿Ð¾Ñ…Ð¾Ð´Ð¸Ñ‚ÑŒ Ð²Ñ–Ð´ Ð´Ð°Ð²Ð½ÑŒÐ¾ÑƒÐºÑ€Ð°Ñ—Ð½ÑÑŒÐºÐ¸Ñ… ÐºÐ¾Ð½ÑÑ‚Ñ€ÑƒÐºÑ†Ñ–Ð¹ Ñ– Ð½Ð°Ð¹Ð±Ð»Ð¸Ð¶Ñ‡Ð° Ð´Ð¾ Ñ–Ð½Ð´Ð¾Ñ”Ð²Ñ€Ð¾Ð¿ÐµÐ¹ÑÑŒÐºÐ¾Ð³Ð¾ Ð¿Ð°ÑÐ¸Ð²Ñƒ. Ð¡Ð°Ð¼Ðµ Ñ‚Ð¾Ð¼Ñƒ Ð²Ð¾Ð½Ð° Ð·Ð²ÑƒÑ‡Ð¸Ñ‚ÑŒ Ð½Ð°Ð¹Ð±Ñ–Ð»ÑŒÑˆ Â«ÐºÐ½Ð¸Ð¶Ð½Ð¾Â» Ñ– Ñ„Ð¾Ñ€Ð¼Ð°Ð»ÑŒÐ½Ð¾.\n\n**ÐŸÑ€Ð¸ÐºÐ»Ð°Ð´Ð¸ Ð² ÐºÐ¾Ð½Ñ‚ÐµÐºÑÑ‚Ñ–:**\n\n1. ÐœÐ¾Ð½Ð¾Ð³Ñ€Ð°Ñ„Ñ–Ñ **Ð±ÑƒÐ»Ð° Ð½Ð°Ð¿Ð¸ÑÐ°Ð½Ð°** Ð²Ð¸Ð´Ð°Ñ‚Ð½Ð¸Ð¼ Ð½Ð°ÑƒÐºÐ¾Ð²Ñ†ÐµÐ¼.\n2. Ð£ÑÑ– Ð´Ð¾ÐºÑƒÐ¼ÐµÐ½Ñ‚Ð¸ **Ð±ÑƒÐ´ÑƒÑ‚ÑŒ Ñ€Ð¾Ð·Ð³Ð»ÑÐ½ÑƒÑ‚Ñ–** ÐºÐ¾Ð¼Ñ–ÑÑ–Ñ”ÑŽ.\n3. Ð—Ð¼Ñ–Ð½Ð¸ **Ð±ÑƒÐ»Ð¸ Ð²Ð½ÐµÑÐµÐ½Ñ–** Ð´Ð¾ ÑÑ‚Ð°Ñ‚ÑƒÑ‚Ñƒ Ð¾Ñ€Ð³Ð°Ð½Ñ–Ð·Ð°Ñ†Ñ–Ñ—.\n\n### Ð¤Ð¾Ñ€Ð¼Ð° 2: Ð‘ÐµÐ·Ð¾ÑÐ¾Ð±Ð¾Ð²Ð¸Ð¹ Ð¿Ð°ÑÐ¸Ð² (-Ð½Ð¾/-Ñ‚Ð¾)\n\n**Ð¡Ñ‚Ñ€ÑƒÐºÑ‚ÑƒÑ€Ð°:** Ñ„Ð¾Ñ€Ð¼Ð° Ð½Ð° -Ð½Ð¾/-Ñ‚Ð¾ (+ Â«Ð±ÑƒÐ»Ð¾Â» Ð´Ð»Ñ Ð¼Ð¸Ð½ÑƒÐ»Ð¾Ð³Ð¾ Ñ‡Ð°ÑÑƒ)\n\n| Ð§Ð°Ñ | ÐŸÑ€Ð¸ÐºÐ»Ð°Ð´ | ÐŸÑ€Ð¸Ð¼Ñ–Ñ‚ÐºÐ° |\n|-----|---------|----------|\n| Ð¢ÐµÐ¿ÐµÑ€Ñ–ÑˆÐ½Ñ–Ð¹/Ð·Ð°Ð³Ð°Ð»ÑŒÐ½Ð¸Ð¹ | Ð¡Ñ‚Ð°Ñ‚Ñ‚ÑŽ **Ð½Ð°Ð¿Ð¸ÑÐ°Ð½Ð¾** | ÐÐ°Ð¹Ñ„Ð¾Ñ€Ð¼Ð°Ð»ÑŒÐ½Ñ–ÑˆÐ¸Ð¹ |\n| ÐœÐ¸Ð½ÑƒÐ»Ð¸Ð¹ | Ð¡Ñ‚Ð°Ñ‚Ñ‚ÑŽ **Ð±ÑƒÐ»Ð¾ Ð½Ð°Ð¿Ð¸ÑÐ°Ð½Ð¾** | ÐžÑ„Ñ–Ñ†Ñ–Ð¹Ð½Ñ– Ð´Ð¾ÐºÑƒÐ¼ÐµÐ½Ñ‚Ð¸ |\n\n> ðŸ” **Myth Buster: Â«Ð¤Ð¾Ñ€Ð¼Ð° Ð½Ð° -Ð½Ð¾/-Ñ‚Ð¾ â€” Ñ†Ðµ Ñ€ÑƒÑÐ¸Ð·Ð¼Â»**\n>\n> Ð¦Ðµ Ð¿Ð¾ÑˆÐ¸Ñ€ÐµÐ½Ðµ, Ð°Ð»Ðµ Ñ…Ð¸Ð±Ð½Ðµ Ð¿ÐµÑ€ÐµÐºÐ¾Ð½Ð°Ð½Ð½Ñ. ÐÐ°ÑÐ¿Ñ€Ð°Ð²Ð´Ñ– Ñ†Ñ Ñ„Ð¾Ñ€Ð¼Ð° â€” Ð°Ð²Ñ‚ÐµÐ½Ñ‚Ð¸Ñ‡Ð½Ð¸Ð¹ ÑƒÐºÑ€Ð°Ñ—Ð½ÑÑŒÐºÐ¸Ð¹ Ð³Ñ€Ð°Ð¼Ð°Ñ‚Ð¸Ñ‡Ð½Ð¸Ð¹ Ð·Ð°ÑÑ–Ð±, Ñ‰Ð¾ Ñ–ÑÐ½ÑƒÐ²Ð°Ð² Ñ‰Ðµ Ð² Ð´Ð°Ð²Ð½ÑŒÐ¾ÑƒÐºÑ€Ð°Ñ—Ð½ÑÑŒÐºÑ–Ð¹ Ð¼Ð¾Ð²Ñ–. Ð’Ð¾Ð½Ð° Ð²Ñ–Ð´ÑÑƒÑ‚Ð½Ñ Ð² Ñ€Ð¾ÑÑ–Ð¹ÑÑŒÐºÑ–Ð¹, Ð´Ðµ Ð·Ð°Ð¼Ñ–ÑÑ‚ÑŒ Ð½ÐµÑ— Ð²Ð¶Ð¸Ð²Ð°ÑŽÑ‚ÑŒ Â«Ð±Ñ‹Ð»Ð¾ Ð½Ð°Ð¿Ð¸ÑÐ°Ð½Ð¾Â» (Ð· Ð´Ñ–Ñ”Ð¿Ñ€Ð¸ÐºÐ¼ÐµÑ‚Ð½Ð¸ÐºÐ¾Ð¼). Ð¡Ð°Ð¼Ðµ Ñ‚Ð¾Ð¼Ñƒ Ñ„Ð¾Ñ€Ð¼Ð° Ð½Ð° -Ð½Ð¾/-Ñ‚Ð¾ â€” Ð¼Ð°Ñ€ÐºÐµÑ€ ÑÐ¿Ñ€Ð°Ð²Ð¶Ð½ÑŒÐ¾Ñ— ÑƒÐºÑ€Ð°Ñ—Ð½ÑÑŒÐºÐ¾Ñ— Ð¼Ð¾Ð²Ð¸!\n\n**Ð ÐµÐ³Ñ–ÑÑ‚Ñ€Ð¾Ð²Ð° Ñ†Ñ–Ð½Ð½Ñ–ÑÑ‚ÑŒ:**\n\nÐ¤Ð¾Ñ€Ð¼Ð° Ð½Ð° -Ð½Ð¾/-Ñ‚Ð¾ â€” Ð½Ð°Ð¹Ð²Ð¸Ñ‰Ð¸Ð¹ Ñ€Ñ–Ð²ÐµÐ½ÑŒ Ñ„Ð¾Ñ€Ð¼Ð°Ð»ÑŒÐ½Ð¾ÑÑ‚Ñ– Ð² ÑƒÐºÑ€Ð°Ñ—Ð½ÑÑŒÐºÑ–Ð¹ Ð¼Ð¾Ð²Ñ–. Ð‡Ñ— Ð¾Ð±Ð¾Ð²'ÑÐ·ÐºÐ¾Ð²Ð¾ Ð²Ð¶Ð¸Ð²Ð°ÑŽÑ‚ÑŒ Ñƒ:\n\n- Ð—Ð°ÐºÐ¾Ð½Ð°Ñ… Ñ– Ð¿Ñ–Ð´Ð·Ð°ÐºÐ¾Ð½Ð½Ð¸Ñ… Ð°ÐºÑ‚Ð°Ñ…: *Ð—Ð°ÐºÐ¾Ð½ **Ð¿Ñ€Ð¸Ð¹Ð½ÑÑ‚Ð¾** Ð’ÐµÑ€Ñ…Ð¾Ð²Ð½Ð¾ÑŽ Ð Ð°Ð´Ð¾ÑŽ.*\n- ÐÐ°ÑƒÐºÐ¾Ð²Ð¸Ñ… Ñ‚ÐµÐºÑÑ‚Ð°Ñ…: *Ð£ Ð´Ð¾ÑÐ»Ñ–Ð´Ð¶ÐµÐ½Ð½Ñ– **Ð²ÑÑ‚Ð°Ð½Ð¾Ð²Ð»ÐµÐ½Ð¾**, Ñ‰Ð¾...*\n- ÐžÑ„Ñ–Ñ†Ñ–Ð¹Ð½Ð¸Ñ… Ð´Ð¾ÐºÑƒÐ¼ÐµÐ½Ñ‚Ð°Ñ…: *ÐÐ°ÐºÐ°Ð· **Ð¿Ñ–Ð´Ð¿Ð¸ÑÐ°Ð½Ð¾** Ñ€ÐµÐºÑ‚Ð¾Ñ€Ð¾Ð¼.*\n\n**ÐŸÐ¾Ñ€Ñ–Ð²Ð½ÑÐ¹Ñ‚Ðµ Ñ€ÐµÐ³Ñ–ÑÑ‚Ñ€Ð¸:**\n\n| Ð Ð¾Ð·Ð¼Ð¾Ð²Ð½Ð¸Ð¹ | ÐžÑ„Ñ–Ñ†Ñ–Ð¹Ð½Ð¸Ð¹ |\n|-----------|-----------|\n| Ð›Ð¸ÑÑ‚ Ð½Ð°Ð¿Ð¸ÑÐ°Ð»Ð¸ Ð²Ñ‡Ð¾Ñ€Ð°. | Ð›Ð¸ÑÑ‚ **Ð±ÑƒÐ»Ð¾ Ð½Ð°Ð¿Ð¸ÑÐ°Ð½Ð¾** Ð²Ñ‡Ð¾Ñ€Ð°. |\n| Ð ÐµÐ·ÑƒÐ»ÑŒÑ‚Ð°Ñ‚Ð¸ Ð¾Ð³Ð¾Ð»Ð¾ÑÐ¸Ð»Ð¸. | Ð ÐµÐ·ÑƒÐ»ÑŒÑ‚Ð°Ñ‚Ð¸ **Ð¾Ð³Ð¾Ð»Ð¾ÑˆÐµÐ½Ð¾**. |\n| Ð—Ð°ÐºÐ¾Ð½ ÑƒÑ…Ð²Ð°Ð»Ð¸Ð»Ð¸. | Ð—Ð°ÐºÐ¾Ð½ **ÑƒÑ…Ð²Ð°Ð»ÐµÐ½Ð¾**. |\n\n### Ð¤Ð¾Ñ€Ð¼Ð° 3: Ð—Ð²Ð¾Ñ€Ð¾Ñ‚Ð½Ð¸Ð¹ Ð¿Ð°ÑÐ¸Ð² (-ÑÑ)\n\n**Ð¡Ñ‚Ñ€ÑƒÐºÑ‚ÑƒÑ€Ð°:** Ð´Ñ–Ñ”ÑÐ»Ð¾Ð²Ð¾ Ð· Ð¿Ð¾ÑÑ‚Ñ„Ñ–ÐºÑÐ¾Ð¼ -ÑÑ\n\n| Ð§Ð°Ñ | ÐŸÑ€Ð¸ÐºÐ»Ð°Ð´ | ÐŸÑ€Ð¸Ð¼Ñ–Ñ‚ÐºÐ° |\n|-----|---------|----------|\n| Ð¢ÐµÐ¿ÐµÑ€Ñ–ÑˆÐ½Ñ–Ð¹ | ÐŸÑ€Ð¾Ð±Ð»ÐµÐ¼Ð° **Ñ€Ð¾Ð·Ð²'ÑÐ·ÑƒÑ”Ñ‚ÑŒÑÑ** | ÐŸÑ€Ð¾Ñ†ÐµÑ Ñ‚Ñ€Ð¸Ð²Ð°Ñ” |\n| ÐœÐ¸Ð½ÑƒÐ»Ð¸Ð¹ | ÐŸÑ€Ð¾Ð±Ð»ÐµÐ¼Ð° **Ñ€Ð¾Ð·Ð²'ÑÐ·ÑƒÐ²Ð°Ð»Ð°ÑÑ** | ÐÐµÐ·Ð°Ð²ÐµÑ€ÑˆÐµÐ½Ð° Ð´Ñ–Ñ Ð² Ð¼Ð¸Ð½ÑƒÐ»Ð¾Ð¼Ñƒ |\n\n**Ð¡ÐµÐ¼Ð°Ð½Ñ‚Ð¸Ñ‡Ð½Ð° Ð¾ÑÐ¾Ð±Ð»Ð¸Ð²Ñ–ÑÑ‚ÑŒ:**\n\nÐ—Ð²Ð¾Ñ€Ð¾Ñ‚Ð½Ð¸Ð¹ Ð¿Ð°ÑÐ¸Ð² Ð¿Ñ–Ð´ÐºÑ€ÐµÑÐ»ÑŽÑ” **Ð¿Ñ€Ð¾Ñ†ÐµÑ**, Ð° Ð½Ðµ Ñ€ÐµÐ·ÑƒÐ»ÑŒÑ‚Ð°Ñ‚. ÐŸÐ¾Ñ€Ñ–Ð²Ð½ÑÐ¹Ñ‚Ðµ:\n\n- *Ð‘ÑƒÐ´Ð¸Ð½Ð¾Ðº **Ð±ÑƒÐ´ÑƒÑ”Ñ‚ÑŒÑÑ**.* â†’ ÐÐºÑ†ÐµÐ½Ñ‚ Ð½Ð° Ñ‚Ñ€Ð¸Ð²Ð°Ð»Ð¾Ð¼Ñƒ Ð¿Ñ€Ð¾Ñ†ÐµÑÑ–.\n- *Ð‘ÑƒÐ´Ð¸Ð½Ð¾Ðº **Ð·Ð±ÑƒÐ´Ð¾Ð²Ð°Ð½Ð¾**.* â†’ ÐÐºÑ†ÐµÐ½Ñ‚ Ð½Ð° Ð·Ð°Ð²ÐµÑ€ÑˆÐµÐ½Ð¾Ð¼Ñƒ Ñ€ÐµÐ·ÑƒÐ»ÑŒÑ‚Ð°Ñ‚Ñ–.\n\n> âš¡ **ÐŸÑ€Ð°ÐºÑ‚Ð¸Ñ‡Ð½Ð° Ð¿Ð¾Ñ€Ð°Ð´Ð°**\n>\n> Ð£ Ð½Ð°ÑƒÐºÐ¾Ð²Ð¾Ð¼Ñƒ ÑÑ‚Ð¸Ð»Ñ– Ð·Ð²Ð¾Ñ€Ð¾Ñ‚Ð½Ð¸Ð¹ Ð¿Ð°ÑÐ¸Ð² Ñ‡Ð°ÑÑ‚Ð¾ Ð²Ð¶Ð¸Ð²Ð°Ñ”Ñ‚ÑŒÑÑ Ð´Ð»Ñ Ð¾Ð¿Ð¸ÑÑƒ Ð¼ÐµÑ‚Ð¾Ð´Ð¾Ð»Ð¾Ð³Ñ–Ñ—: Â«Ð£ Ñ€Ð¾Ð±Ð¾Ñ‚Ñ– **Ð·Ð°ÑÑ‚Ð¾ÑÐ¾Ð²ÑƒÑ”Ñ‚ÑŒÑÑ** Ð¼ÐµÑ‚Ð¾Ð´ Ð¿Ð¾Ñ€Ñ–Ð²Ð½ÑÐ»ÑŒÐ½Ð¾Ð³Ð¾ Ð°Ð½Ð°Ð»Ñ–Ð·ÑƒÂ», Â«Ð”Ð°Ð½Ñ– **Ð¾Ð±Ñ€Ð¾Ð±Ð»ÑÑŽÑ‚ÑŒÑÑ** Ð·Ð° Ð´Ð¾Ð¿Ð¾Ð¼Ð¾Ð³Ð¾ÑŽ ÑÑ‚Ð°Ñ‚Ð¸ÑÑ‚Ð¸Ñ‡Ð½Ð¸Ñ… Ð¼ÐµÑ‚Ð¾Ð´Ñ–Ð²Â».\n\n### Ð¤Ð¾Ñ€Ð¼Ð° 4: Ð”Ñ–Ñ”Ð¿Ñ€Ð¸ÑÐ»Ñ–Ð²Ð½Ð¸ÐºÐ¾Ð²Ð¸Ð¹ Ð¿Ð°ÑÐ¸Ð² (Ñ€Ñ–Ð´ÐºÐ¾)\n\nÐ£ ÑÑƒÑ‡Ð°ÑÐ½Ñ–Ð¹ ÑƒÐºÑ€Ð°Ñ—Ð½ÑÑŒÐºÑ–Ð¹ Ð¼Ð¾Ð²Ñ– Ñ†Ñ Ñ„Ð¾Ñ€Ð¼Ð° Ð¼Ð°Ð¹Ð¶Ðµ Ð½Ðµ Ð²Ð¶Ð¸Ð²Ð°Ñ”Ñ‚ÑŒÑÑ, Ð°Ð»Ðµ Ð²Ð¸ Ð¼Ð¾Ð¶ÐµÑ‚Ðµ Ð·ÑƒÑÑ‚Ñ€Ñ–Ñ‚Ð¸ Ñ—Ñ— Ð² Ñ…ÑƒÐ´Ð¾Ð¶Ð½Ñ–Ð¹ Ð»Ñ–Ñ‚ÐµÑ€Ð°Ñ‚ÑƒÑ€Ñ– XIXâ€“XX ÑÑ‚Ð¾Ð»Ñ–Ñ‚ÑŒ:\n\n- *Ð‘ÑƒÐ²ÑˆÐ¸ Ð¿Ð¾ÐºÐ¸Ð½ÑƒÑ‚Ð¸Ð¹ ÑƒÑÑ–Ð¼Ð°, Ð²Ñ–Ð½ Ð·Ð°Ð»Ð¸ÑˆÐ¸Ð²ÑÑ ÑÐ°Ð¼.*\n\nÐ”Ð»Ñ C1 Ð²Ð°Ð¶Ð»Ð¸Ð²Ð¾ **Ñ€Ð¾Ð·Ð¿Ñ–Ð·Ð½Ð°Ð²Ð°Ñ‚Ð¸** Ñ†ÑŽ Ñ„Ð¾Ñ€Ð¼Ñƒ, Ð°Ð»Ðµ **Ð½Ðµ Ð²Ð¶Ð¸Ð²Ð°Ñ‚Ð¸** Ñ—Ñ— Ð² ÑÑƒÑ‡Ð°ÑÐ½Ð¸Ñ… Ñ‚ÐµÐºÑÑ‚Ð°Ñ…. Ð¦Ñ Ð°Ñ€Ñ…Ð°Ñ—Ñ‡Ð½Ð° ÐºÐ¾Ð½ÑÑ‚Ñ€ÑƒÐºÑ†Ñ–Ñ Ð·Ð±ÐµÑ€Ñ–Ð³Ð°Ñ”Ñ‚ÑŒÑÑ Ð² Ð¿Ð¾ÐµÐ·Ñ–Ñ— Ñ‚Ð° ÐºÐ»Ð°ÑÐ¸Ñ‡Ð½Ñ–Ð¹ Ð¿Ñ€Ð¾Ð·Ñ– ÑÐº ÑÑ‚Ð¸Ð»Ñ–ÑÑ‚Ð¸Ñ‡Ð½Ð¸Ð¹ Ð·Ð°ÑÑ–Ð± Ð´Ð»Ñ ÑÑ‚Ð²Ð¾Ñ€ÐµÐ½Ð½Ñ ÑƒÑ€Ð¾Ñ‡Ð¸ÑÑ‚Ð¾Ð³Ð¾ Ð°Ð±Ð¾ Ð´Ð°Ð²Ð½ÑŒÐ¾Ð³Ð¾ ÐºÐ¾Ð»Ð¾Ñ€Ð¸Ñ‚Ñƒ.\n\n### ÐŸÑ€Ð°ÐºÑ‚Ð¸Ñ‡Ð½Ðµ Ð·Ð°ÑÑ‚Ð¾ÑÑƒÐ²Ð°Ð½Ð½Ñ: Ð²Ð¸Ð±Ñ–Ñ€ Ñ„Ð¾Ñ€Ð¼Ð¸ Ð¿Ð°ÑÐ¸Ð²Ñƒ\n\nÐ’Ð¸Ð±Ñ–Ñ€ Ñ„Ð¾Ñ€Ð¼Ð¸ Ð¿Ð°ÑÐ¸Ð²Ð½Ð¾Ð³Ð¾ ÑÑ‚Ð°Ð½Ñƒ Ð·Ð°Ð»ÐµÐ¶Ð¸Ñ‚ÑŒ Ð²Ñ–Ð´ **ÐºÐ¾Ð½Ñ‚ÐµÐºÑÑ‚Ñƒ** Ñ‚Ð° **ÐºÐ¾Ð¼ÑƒÐ½Ñ–ÐºÐ°Ñ‚Ð¸Ð²Ð½Ð¾Ñ— Ð¼ÐµÑ‚Ð¸**. Ð Ð¾Ð·Ð³Ð»ÑÐ½ÑŒÐ¼Ð¾ Ñ‚Ð¸Ð¿Ð¾Ð²Ñ– ÑÐ¸Ñ‚ÑƒÐ°Ñ†Ñ–Ñ—:\n\n**1. ÐžÑ„Ñ–Ñ†Ñ–Ð¹Ð½Ð¸Ð¹ Ð´Ð¾ÐºÑƒÐ¼ÐµÐ½Ñ‚ (Ð·Ð°ÐºÐ¾Ð½, Ð½Ð°ÐºÐ°Ð·, Ð¿Ñ€Ð¾Ñ‚Ð¾ÐºÐ¾Ð»):**\nÐ’Ð¸ÐºÐ¾Ñ€Ð¸ÑÑ‚Ð¾Ð²ÑƒÐ¹Ñ‚Ðµ **Ð²Ð¸ÐºÐ»ÑŽÑ‡Ð½Ð¾** Ñ„Ð¾Ñ€Ð¼Ñƒ Ð½Ð° -Ð½Ð¾/-Ñ‚Ð¾.\n- âœ“ *Ð—Ð°ÐºÐ¾Ð½ **ÑƒÑ…Ð²Ð°Ð»ÐµÐ½Ð¾** Ð¿Ð°Ñ€Ð»Ð°Ð¼ÐµÐ½Ñ‚Ð¾Ð¼.*\n- âœ— *Ð—Ð°ÐºÐ¾Ð½ ÑƒÑ…Ð²Ð°Ð»Ð¸Ð»Ð¸* (Ð·Ð°Ð½Ð°Ð´Ñ‚Ð¾ Ð½ÐµÑ„Ð¾Ñ€Ð¼Ð°Ð»ÑŒÐ½Ð¾)\n\n**2. ÐÐ°ÑƒÐºÐ¾Ð²Ð° ÑÑ‚Ð°Ñ‚Ñ‚Ñ (Ð¾Ð¿Ð¸Ñ Ð¼ÐµÑ‚Ð¾Ð´Ð¾Ð»Ð¾Ð³Ñ–Ñ—):**\nÐŸÐ¾Ñ”Ð´Ð½ÑƒÐ¹Ñ‚Ðµ Ñ„Ð¾Ñ€Ð¼Ñƒ Ð½Ð° -Ð½Ð¾/-Ñ‚Ð¾ (Ñ€ÐµÐ·ÑƒÐ»ÑŒÑ‚Ð°Ñ‚Ð¸) Ñ‚Ð° Ð·Ð²Ð¾Ñ€Ð¾Ñ‚Ð½Ð¸Ð¹ Ð¿Ð°ÑÐ¸Ð² (Ð¿Ñ€Ð¾Ñ†ÐµÑÐ¸).\n- *Ð”Ð°Ð½Ñ– **Ð¾Ð±Ñ€Ð¾Ð±Ð»ÐµÐ½Ð¾** Ð·Ð° Ð´Ð¾Ð¿Ð¾Ð¼Ð¾Ð³Ð¾ÑŽ ÑÑ‚Ð°Ñ‚Ð¸ÑÑ‚Ð¸Ñ‡Ð½Ð¸Ñ… Ð¼ÐµÑ‚Ð¾Ð´Ñ–Ð².* (Ñ€ÐµÐ·ÑƒÐ»ÑŒÑ‚Ð°Ñ‚)\n- *Ð”Ð¾ÑÐ»Ñ–Ð´Ð¶ÐµÐ½Ð½Ñ **Ð¿Ñ€Ð¾Ð²Ð¾Ð´Ð¸Ñ‚ÑŒÑÑ** Ñ‰Ð¾Ñ€Ð¾ÐºÑƒ.* (Ð¿Ñ€Ð¾Ñ†ÐµÑ)\n\n**3. ÐŸÑƒÐ±Ð»Ñ–Ñ†Ð¸ÑÑ‚Ð¸ÐºÐ° (Ð½Ð¾Ð²Ð¸Ð½Ð½Ð° ÑÑ‚Ð°Ñ‚Ñ‚Ñ):**\nÐ‘Ð°Ð»Ð°Ð½ÑÑƒÐ¹Ñ‚Ðµ Ð¼Ñ–Ð¶ Ñ„Ð¾Ñ€Ð¼Ð°Ð»ÑŒÐ½Ñ–ÑÑ‚ÑŽ Ñ‚Ð° Ð´Ð¾ÑÑ‚ÑƒÐ¿Ð½Ñ–ÑÑ‚ÑŽ.\n- *Ð ÐµÑ„Ð¾Ñ€Ð¼Ñƒ **ÑÑ…Ð²Ð°Ð»ÐµÐ½Ð¾**: Ñ‰Ð¾ Ñ†Ðµ Ð¾Ð·Ð½Ð°Ñ‡Ð°Ñ” Ð´Ð»Ñ Ð³Ñ€Ð¾Ð¼Ð°Ð´ÑÐ½?*\n\n**4. Ð”Ñ–Ð»Ð¾Ð²Ðµ Ð»Ð¸ÑÑ‚ÑƒÐ²Ð°Ð½Ð½Ñ:**\nÐžÐ±Ð¸Ñ€Ð°Ð¹Ñ‚Ðµ Ñ„Ð¾Ñ€Ð¼Ñƒ Ð·Ð°Ð»ÐµÐ¶Ð½Ð¾ Ð²Ñ–Ð´ Ñ€Ñ–Ð²Ð½Ñ Ñ„Ð¾Ñ€Ð¼Ð°Ð»ÑŒÐ½Ð¾ÑÑ‚Ñ–.\n- Ð¤Ð¾Ñ€Ð¼Ð°Ð»ÑŒÐ½Ð¸Ð¹ Ð»Ð¸ÑÑ‚: *Ð’Ð°ÑˆÑƒ Ð·Ð°ÑÐ²Ñƒ **Ñ€Ð¾Ð·Ð³Ð»ÑÐ½ÑƒÑ‚Ð¾**.*\n- ÐÐ°Ð¿Ñ–Ð²Ñ„Ð¾Ñ€Ð¼Ð°Ð»ÑŒÐ½Ð¸Ð¹: *Ð—Ð°ÑÐ²Ñƒ Ñ€Ð¾Ð·Ð³Ð»ÑÐ½ÑƒÐ»Ð¸.*\n\n> ðŸ”— **ÐŸÐ¾Ñ€Ñ–Ð²Ð½ÑÐ½Ð½Ñ Ð· Ð°Ð½Ð³Ð»Ñ–Ð¹ÑÑŒÐºÐ¾ÑŽ**\n>\n> Ð’ Ð°Ð½Ð³Ð»Ñ–Ð¹ÑÑŒÐºÑ–Ð¹ Ð¼Ð¾Ð²Ñ– Ð¿Ð°ÑÐ¸Ð²Ð½Ð¸Ð¹ ÑÑ‚Ð°Ð½ ÑƒÐ½Ñ–Ð²ÐµÑ€ÑÐ°Ð»ÑŒÐ½Ð¸Ð¹ (was signed, is being processed), Ñ‚Ð¾Ð´Ñ– ÑÐº ÑƒÐºÑ€Ð°Ñ—Ð½ÑÑŒÐºÐ° Ð¼Ð°Ñ” Ñ‡Ð¾Ñ‚Ð¸Ñ€Ð¸ Ñ„Ð¾Ñ€Ð¼Ð¸ Ð· Ñ€Ñ–Ð·Ð½Ð¸Ð¼ **Ñ€ÐµÐ³Ñ–ÑÑ‚Ñ€Ð¾Ð¼**. Ð¦Ðµ Ð´Ð°Ñ” Ð²Ð°Ð¼ Ð³Ð½ÑƒÑ‡ÐºÑ–ÑÑ‚ÑŒ, Ð°Ð»Ðµ Ð²Ð¸Ð¼Ð°Ð³Ð°Ñ” Ñ€ÐµÑ‚ÐµÐ»ÑŒÐ½Ð¾Ð³Ð¾ Ð²Ð¸Ð±Ð¾Ñ€Ñƒ Ñ„Ð¾Ñ€Ð¼Ð¸ Ð´Ð»Ñ ÐºÐ¾Ð¶Ð½Ð¾Ñ— ÑÐ¸Ñ‚ÑƒÐ°Ñ†Ñ–Ñ—.\n\n### Ð”Ñ–Ð°Ð»Ð¾Ð³ 1: ÐÐ°ÑƒÐºÐ¾Ð²Ð° ÐºÐ¾Ð½Ñ„ÐµÑ€ÐµÐ½Ñ†Ñ–Ñ ðŸ—£ï¸\n\n**ÐŸÑ€Ð¾Ñ„ÐµÑÐ¾Ñ€ ÐœÐµÐ»ÑŒÐ½Ð¸Ðº:** ÐšÐ¾Ð»ÐµÐ³Ð¾, Ñ Ð¿Ñ€Ð¾Ñ‡Ð¸Ñ‚Ð°Ð² Ð²Ð°ÑˆÑƒ ÑÑ‚Ð°Ñ‚Ñ‚ÑŽ. Ð¦Ñ–ÐºÐ°Ð²Ðµ **Ð´Ð¾ÑÐ»Ñ–Ð´Ð¶ÐµÐ½Ð½Ñ**.\n\n**Ð”Ð¾Ñ†ÐµÐ½Ñ‚ ÐšÐ¾Ð²Ð°Ð»ÐµÐ½ÐºÐ¾:** Ð”ÑÐºÑƒÑŽ. Ð Ð¾Ð±Ð¾Ñ‚Ð° **Ð±ÑƒÐ»Ð° Ð²Ð¸ÐºÐ¾Ð½Ð°Ð½Ð°** ÑÐ¿Ñ–Ð»ÑŒÐ½Ð¾ Ð· ÐºÐ¾Ð»ÐµÐ³Ð°Ð¼Ð¸ Ð· Ð›ÑŒÐ²Ñ–Ð²ÑÑŒÐºÐ¾Ð³Ð¾ ÑƒÐ½Ñ–Ð²ÐµÑ€ÑÐ¸Ñ‚ÐµÑ‚Ñƒ.\n\n**ÐŸÑ€Ð¾Ñ„ÐµÑÐ¾Ñ€ ÐœÐµÐ»ÑŒÐ½Ð¸Ðº:** Ð ÑÐºÑƒ Ð¼ÐµÑ‚Ð¾Ð´Ð¾Ð»Ð¾Ð³Ñ–ÑŽ **Ð·Ð°ÑÑ‚Ð¾ÑÐ¾Ð²Ð°Ð½Ð¾**?\n\n**Ð”Ð¾Ñ†ÐµÐ½Ñ‚ ÐšÐ¾Ð²Ð°Ð»ÐµÐ½ÐºÐ¾:** **Ð‘ÑƒÐ»Ð¾ Ð²Ð¸ÐºÐ¾Ñ€Ð¸ÑÑ‚Ð°Ð½Ð¾** ÐºÐ¾Ð¼Ð¿Ð»ÐµÐºÑÐ½Ð¸Ð¹ Ð¿Ñ–Ð´Ñ…Ñ–Ð´: ÐºÑ–Ð»ÑŒÐºÑ–ÑÐ½Ð¸Ð¹ Ñ‚Ð° ÑÐºÑ–ÑÐ½Ð¸Ð¹ **Ð°Ð½Ð°Ð»Ñ–Ð·**. Ð”Ð°Ð½Ñ– **Ð¾Ð±Ñ€Ð¾Ð±Ð»ÑÐ»Ð¸ÑÑ** Ð¿Ñ€Ð¾Ñ‚ÑÐ³Ð¾Ð¼ Ñ€Ð¾ÐºÑƒ.\n\n**ÐŸÑ€Ð¾Ñ„ÐµÑÐ¾Ñ€ ÐœÐµÐ»ÑŒÐ½Ð¸Ðº:** Ð§ÑƒÐ´Ð¾Ð²Ð¾. ÐšÐ¾Ð»Ð¸ Ñ€ÐµÐ·ÑƒÐ»ÑŒÑ‚Ð°Ñ‚Ð¸ **Ð±ÑƒÐ´ÑƒÑ‚ÑŒ Ð¾Ð¿ÑƒÐ±Ð»Ñ–ÐºÐ¾Ð²Ð°Ð½Ñ–**?\n\n**Ð”Ð¾Ñ†ÐµÐ½Ñ‚ ÐšÐ¾Ð²Ð°Ð»ÐµÐ½ÐºÐ¾:** Ð¡Ñ‚Ð°Ñ‚Ñ‚ÑŽ Ð²Ð¶Ðµ **Ð¿Ð¾Ð´Ð°Ð½Ð¾** Ð´Ð¾ Ð¶ÑƒÑ€Ð½Ð°Ð»Ñƒ. ÐžÑ‡Ñ–ÐºÑƒÑ”Ð¼Ð¾ **Ñ€ÐµÑ†ÐµÐ½Ð·ÑƒÐ²Ð°Ð½Ð½Ñ**.\n\n> ðŸ’¡ **Ð—Ð²ÐµÑ€Ð½Ñ–Ñ‚ÑŒ ÑƒÐ²Ð°Ð³Ñƒ**\n>\n> Ð£ Ñ†ÑŒÐ¾Ð¼Ñƒ Ð´Ñ–Ð°Ð»Ð¾Ð·Ñ– Ð²Ð¶Ð¸Ñ‚Ð¾ Ñ‡Ð¾Ñ‚Ð¸Ñ€Ð¸ Ñ€Ñ–Ð·Ð½Ñ– Ñ„Ð¾Ñ€Ð¼Ð¸ Ð¿Ð°ÑÐ¸Ð²Ð½Ð¾Ð³Ð¾ ÑÑ‚Ð°Ð½Ñƒ. ÐšÐ¾Ð¶Ð½Ð° Ð· Ð½Ð¸Ñ… Ð´Ð¾Ñ€ÐµÑ‡Ð½Ð° Ð² Ð°ÐºÐ°Ð´ÐµÐ¼Ñ–Ñ‡Ð½Ð¾Ð¼Ñƒ ÐºÐ¾Ð½Ñ‚ÐµÐºÑÑ‚Ñ–. Ð¦Ðµ â€” Ð¼Ð¾Ð²Ð½Ð° **Ð¼Ð°Ð¹ÑÑ‚ÐµÑ€Ð½Ñ–ÑÑ‚ÑŒ** Ñ€Ñ–Ð²Ð½Ñ C1.\n\n## Deep Dive: ÐŸ'ÑÑ‚ÑŒ Ñ„ÑƒÐ½ÐºÑ†Ñ–Ð¾Ð½Ð°Ð»ÑŒÐ½Ð¸Ñ… ÑÑ‚Ð¸Ð»Ñ–Ð²\n\nÐÐ° Ñ€Ñ–Ð²Ð½Ñ– B2 Ð²Ð¸ Ð¾Ð·Ð½Ð°Ð¹Ð¾Ð¼Ð¸Ð»Ð¸ÑÑ Ð· Ð¿'ÑÑ‚ÑŒÐ¼Ð° Ñ„ÑƒÐ½ÐºÑ†Ñ–Ð¾Ð½Ð°Ð»ÑŒÐ½Ð¸Ð¼Ð¸ ÑÑ‚Ð¸Ð»ÑÐ¼Ð¸ ÑƒÐºÑ€Ð°Ñ—Ð½ÑÑŒÐºÐ¾Ñ— Ð¼Ð¾Ð²Ð¸. Ð¢ÐµÐ¿ÐµÑ€ Ñ‡Ð°Ñ Ð´Ð»Ñ **Ð¿Ð¾Ð³Ð»Ð¸Ð±Ð»ÐµÐ½Ð½Ñ** â€” Ð²Ð¸ Ð¼Ð°Ñ”Ñ‚Ðµ Ð½Ðµ Ð¿Ñ€Ð¾ÑÑ‚Ð¾ Ð·Ð½Ð°Ñ‚Ð¸ Ñ†Ñ– ÑÑ‚Ð¸Ð»Ñ–, Ð° Ð²Ñ–Ð»ÑŒÐ½Ð¾ **Ð¿ÐµÑ€ÐµÐ¼Ð¸ÐºÐ°Ñ‚Ð¸ÑÑ** Ð¼Ñ–Ð¶ Ð½Ð¸Ð¼Ð¸.\n\n### ÐžÐ³Ð»ÑÐ´ Ñ„ÑƒÐ½ÐºÑ†Ñ–Ð¾Ð½Ð°Ð»ÑŒÐ½Ð¸Ñ… ÑÑ‚Ð¸Ð»Ñ–Ð²\n\n| Ð¡Ñ‚Ð¸Ð»ÑŒ | Ð¡Ñ„ÐµÑ€Ð° | ÐšÐ»ÑŽÑ‡Ð¾Ð²Ñ– Ð¾Ð·Ð½Ð°ÐºÐ¸ | ÐŸÑ€Ð¸ÐºÐ»Ð°Ð´ Ð¿Ð°ÑÐ¸Ð²Ñƒ |\n|-------|-------|----------------|----------------|\n| ÐÐ°ÑƒÐºÐ¾Ð²Ð¸Ð¹ | ÐÐºÐ°Ð´ÐµÐ¼Ñ–Ñ, Ð´Ð¾ÑÐ»Ñ–Ð´Ð¶ÐµÐ½Ð½Ñ | ÐžÐ±'Ñ”ÐºÑ‚Ð¸Ð²Ð½Ñ–ÑÑ‚ÑŒ, Ñ‚ÐµÑ€Ð¼Ñ–Ð½Ð¾Ð»Ð¾Ð³Ñ–Ñ | *Ð‘ÑƒÐ»Ð¾ Ð²ÑÑ‚Ð°Ð½Ð¾Ð²Ð»ÐµÐ½Ð¾ ÐºÐ¾Ñ€ÐµÐ»ÑÑ†Ñ–ÑŽ* |\n| ÐžÑ„Ñ–Ñ†Ñ–Ð¹Ð½Ð¾-Ð´Ñ–Ð»Ð¾Ð²Ð¸Ð¹ | Ð”Ð¾ÐºÑƒÐ¼ÐµÐ½Ñ‚Ð¸, Ð·Ð°ÐºÐ¾Ð½Ð¸ | Ð¡Ñ‚Ð°Ð½Ð´Ð°Ñ€Ñ‚Ð¸Ð·Ð¾Ð²Ð°Ð½Ñ–ÑÑ‚ÑŒ, ÑŽÑ€Ð¸Ð´Ð¸Ñ‡Ð½Ð° Ñ‚Ð¾Ñ‡Ð½Ñ–ÑÑ‚ÑŒ | *Ð”Ð¾Ð³Ð¾Ð²Ñ–Ñ€ ÑƒÐºÐ»Ð°Ð´ÐµÐ½Ð¾* |\n| ÐŸÑƒÐ±Ð»Ñ–Ñ†Ð¸ÑÑ‚Ð¸Ñ‡Ð½Ð¸Ð¹ | Ð—ÐœÐ†, Ð¶ÑƒÑ€Ð½Ð°Ð»Ñ–ÑÑ‚Ð¸ÐºÐ° | ÐÐºÑ‚ÑƒÐ°Ð»ÑŒÐ½Ñ–ÑÑ‚ÑŒ, Ð¾Ð±Ñ€Ð°Ð·Ð½Ñ–ÑÑ‚ÑŒ | *Ð—Ð°ÐºÐ¾Ð½ Ð±ÑƒÐ»Ð¾ ÑƒÑ…Ð²Ð°Ð»ÐµÐ½Ð¾ Ð²Ñ‡Ð¾Ñ€Ð°* |\n| Ð¥ÑƒÐ´Ð¾Ð¶Ð½Ñ–Ð¹ | Ð›Ñ–Ñ‚ÐµÑ€Ð°Ñ‚ÑƒÑ€Ð° | Ð•ÐºÑÐ¿Ñ€ÐµÑÐ¸Ð²Ð½Ñ–ÑÑ‚ÑŒ, Ñ–Ð½Ð´Ð¸Ð²Ñ–Ð´ÑƒÐ°Ð»ÑŒÐ½Ñ–ÑÑ‚ÑŒ | *ÐŸÑ–ÑÐ½Ñ Ð±ÑƒÐ»Ð° ÑÐ¿Ñ–Ð²Ð°Ð½Ð°* (Ð°Ñ€Ñ…Ð°Ñ—Ñ‡Ð½Ð¾) |\n| Ð Ð¾Ð·Ð¼Ð¾Ð²Ð½Ð¸Ð¹ | ÐŸÐ¾Ð±ÑƒÑ‚, ÑÐ¿Ñ–Ð»ÐºÑƒÐ²Ð°Ð½Ð½Ñ | ÐÐµÐ²Ð¸Ð¼ÑƒÑˆÐµÐ½Ñ–ÑÑ‚ÑŒ, ÐµÐ¼Ð¾Ñ†Ñ–Ð¹Ð½Ñ–ÑÑ‚ÑŒ | Ð Ñ–Ð´ÐºÐ¾ Ð²Ð¶Ð¸Ð²Ð°Ñ”Ñ‚ÑŒÑÑ Ð¿Ð°ÑÐ¸Ð² |\n\n> ðŸŽ­ **ÐšÑƒÐ»ÑŒÑ‚ÑƒÑ€Ð½Ð¸Ð¹ ÐºÐ¾Ð½Ñ‚ÐµÐºÑÑ‚**\n>\n> Ð£ÐºÑ€Ð°Ñ—Ð½ÑÑŒÐºÐ° Ð¼Ð¾Ð²Ð° Ð¼Ð°Ñ” Ð½Ð°Ð´Ð·Ð²Ð¸Ñ‡Ð°Ð¹Ð½Ð¾ Ð±Ð°Ð³Ð°Ñ‚Ñƒ ÑÑ‚Ð¸Ð»Ñ–ÑÑ‚Ð¸Ñ‡Ð½Ñƒ ÑÐ¸ÑÑ‚ÐµÐ¼Ñƒ, Ñ‰Ð¾ Ñ„Ð¾Ñ€Ð¼ÑƒÐ²Ð°Ð»Ð°ÑÑ ÑÑ‚Ð¾Ð»Ñ–Ñ‚Ñ‚ÑÐ¼Ð¸. ÐŸÐ¾Ð¿Ñ€Ð¸ Ð²ÑÑ– Ð·Ð°Ð±Ð¾Ñ€Ð¾Ð½Ð¸ (Ð•Ð¼ÑÑŒÐºÐ¸Ð¹ ÑƒÐºÐ°Ð· 1876 Ñ€Ð¾ÐºÑƒ, Ð’Ð°Ð»ÑƒÑ—Ð²ÑÑŒÐºÐ¸Ð¹ Ñ†Ð¸Ñ€ÐºÑƒÐ»ÑÑ€ 1863 Ñ€Ð¾ÐºÑƒ), ÑƒÐºÑ€Ð°Ñ—Ð½ÑÑŒÐºÑ– Ð¿Ð¸ÑÑŒÐ¼ÐµÐ½Ð½Ð¸ÐºÐ¸ Ñ‚Ð° Ð½Ð°ÑƒÐºÐ¾Ð²Ñ†Ñ– Ð·Ð±ÐµÑ€ÐµÐ³Ð»Ð¸ Ð¹ Ñ€Ð¾Ð·Ð²Ð¸Ð½ÑƒÐ»Ð¸ Ð²ÑÑ– Ð¿'ÑÑ‚ÑŒ ÑÑ‚Ð¸Ð»Ñ–Ð².\n\n### ÐÐ°ÑƒÐºÐ¾Ð²Ð¸Ð¹ ÑÑ‚Ð¸Ð»ÑŒ: Ð³Ð»Ð¸Ð±ÑˆÐµ Ð·Ð°Ð½ÑƒÑ€ÐµÐ½Ð½Ñ\n\nÐ£ Ð½Ð°ÑƒÐºÐ¾Ð²Ð¾Ð¼Ñƒ ÑÑ‚Ð¸Ð»Ñ– **ÐºÐ¾Ð½ÑÐ¾Ð»Ñ–Ð´Ð°Ñ†Ñ–Ñ** Ð·Ð½Ð°Ð½ÑŒ Ð²Ñ–Ð´Ð±ÑƒÐ²Ð°Ñ”Ñ‚ÑŒÑÑ Ñ‡ÐµÑ€ÐµÐ· Ñ‡Ñ–Ñ‚ÐºÑƒ ÑÑ‚Ñ€ÑƒÐºÑ‚ÑƒÑ€Ñƒ. Ð Ð¾Ð·Ð³Ð»ÑÐ½ÑŒÐ¼Ð¾ Ñ‚Ð¸Ð¿Ð¾Ð²Ñ– ÐºÐ¾Ð½ÑÑ‚Ñ€ÑƒÐºÑ†Ñ–Ñ—:\n\n**Ð’ÑÑ‚ÑƒÐ¿Ð½Ñ– Ñ„Ð¾Ñ€Ð¼ÑƒÐ»Ð¸:**\n- *Ð£ ÑÑ‚Ð°Ñ‚Ñ‚Ñ– Ñ€Ð¾Ð·Ð³Ð»ÑÐ´Ð°Ñ”Ñ‚ÑŒÑÑ Ð¿Ð¸Ñ‚Ð°Ð½Ð½Ñ...*\n- *Ð”Ð¾ÑÐ»Ñ–Ð´Ð¶ÐµÐ½Ð½Ñ Ð¿Ñ€Ð¸ÑÐ²ÑÑ‡ÐµÐ½Ð¾ **Ð°Ð½Ð°Ð»Ñ–Ð·Ñƒ**...*\n- *ÐœÐµÑ‚Ð¾ÑŽ Ñ€Ð¾Ð±Ð¾Ñ‚Ð¸ Ñ” **ÑÐ¸ÑÑ‚ÐµÐ¼Ð°Ñ‚Ð¸Ð·Ð°Ñ†Ñ–Ñ**...*\n\n**Ð¤Ð¾Ñ€Ð¼ÑƒÐ»Ð¸ Ð´Ð»Ñ Ñ€ÐµÐ·ÑƒÐ»ÑŒÑ‚Ð°Ñ‚Ñ–Ð²:**\n- ***Ð’ÑÑ‚Ð°Ð½Ð¾Ð²Ð»ÐµÐ½Ð¾**, Ñ‰Ð¾ Ñ–ÑÐ½ÑƒÑ” Ð·Ð°Ð»ÐµÐ¶Ð½Ñ–ÑÑ‚ÑŒ Ð¼Ñ–Ð¶...*\n- ***Ð”Ð¾Ð²ÐµÐ´ÐµÐ½Ð¾** ÐµÑ„ÐµÐºÑ‚Ð¸Ð²Ð½Ñ–ÑÑ‚ÑŒ Ð¼ÐµÑ‚Ð¾Ð´Ñƒ...*\n- *ÐÐ° Ð¾ÑÐ½Ð¾Ð²Ñ– **Ð¾Ñ†Ñ–Ð½ÑŽÐ²Ð°Ð½Ð½Ñ** Ð´Ð°Ð½Ð¸Ñ… Ð·Ñ€Ð¾Ð±Ð»ÐµÐ½Ð¾ Ð²Ð¸ÑÐ½Ð¾Ð²Ð¾Ðº...*\n\n### Ð”Ñ–Ð°Ð»Ð¾Ð³ 2: Ð ÐµÐ´Ð°ÐºÑ†Ñ–Ð¹Ð½Ð° Ð½Ð°Ñ€Ð°Ð´Ð° ðŸ—£ï¸\n\n**Ð ÐµÐ´Ð°ÐºÑ‚Ð¾Ñ€:** ÐšÐ¾Ð»ÐµÐ³Ð¸, Ð¼Ð°Ñ”Ð¼Ð¾ **ÑƒÐ·Ð°Ð³Ð°Ð»ÑŒÐ½ÐµÐ½Ð½Ñ** Ñ€ÐµÐ·ÑƒÐ»ÑŒÑ‚Ð°Ñ‚Ñ–Ð² Ð¾Ð¿Ð¸Ñ‚ÑƒÐ²Ð°Ð½Ð½Ñ. ÐŸÐµÑ‚Ñ€Ðµ, Ñ‰Ð¾ Ð²Ð¸ÑÐ²Ð»ÐµÐ½Ð¾?\n\n**Ð–ÑƒÑ€Ð½Ð°Ð»Ñ–ÑÑ‚:** **Ð‘ÑƒÐ»Ð¾ Ð¾Ð¿Ð¸Ñ‚Ð°Ð½Ð¾** Ð¿Ð¾Ð½Ð°Ð´ Ñ‚Ð¸ÑÑÑ‡Ñƒ Ñ€ÐµÑÐ¿Ð¾Ð½Ð´ÐµÐ½Ñ‚Ñ–Ð². Ð‘Ñ–Ð»ÑŒÑˆÑ–ÑÑ‚ÑŒ Ð¿Ñ–Ð´Ñ‚Ñ€Ð¸Ð¼ÑƒÑ” Ñ€ÐµÑ„Ð¾Ñ€Ð¼Ñƒ.\n\n**Ð ÐµÐ´Ð°ÐºÑ‚Ð¾Ñ€:** Ð¯Ðº Ñ†Ðµ Ð¿Ð¾Ð´Ð°Ð¼Ð¾? Ð¯ÐºÐ¸Ð¹ ÑÑ‚Ð¸Ð»ÑŒ?\n\n**Ð–ÑƒÑ€Ð½Ð°Ð»Ñ–ÑÑ‚:** Ð”ÑƒÐ¼Ð°ÑŽ, Ð¿ÑƒÐ±Ð»Ñ–Ñ†Ð¸ÑÑ‚Ð¸Ñ‡Ð½Ð¸Ð¹. Ð—Ð°Ð³Ð¾Ð»Ð¾Ð²Ð¾Ðº: Â«Ð ÐµÑ„Ð¾Ñ€Ð¼Ñƒ Ð¿Ñ–Ð´Ñ‚Ñ€Ð¸Ð¼Ð°Ð½Ð¾: Ñ€ÐµÐ·ÑƒÐ»ÑŒÑ‚Ð°Ñ‚Ð¸ Ð²ÑÐµÑƒÐºÑ€Ð°Ñ—Ð½ÑÑŒÐºÐ¾Ð³Ð¾ Ð¾Ð¿Ð¸Ñ‚ÑƒÐ²Ð°Ð½Ð½ÑÂ».\n\n**Ð ÐµÐ´Ð°ÐºÑ‚Ð¾Ñ€:** Ð”Ð¾Ð±Ñ€Ðµ. Ð Ð´Ð»Ñ ÑÐ°Ð¹Ñ‚Ñƒ â€” Ñ€Ð¾Ð·Ð¼Ð¾Ð²Ð½Ñ–ÑˆÐ¸Ð¹ Ð²Ð°Ñ€Ñ–Ð°Ð½Ñ‚. Â«Ð£ÐºÑ€Ð°Ñ—Ð½Ñ†Ñ– ÑÐºÐ°Ð·Ð°Ð»Ð¸ Â«Ñ‚Ð°ÐºÂ» Ñ€ÐµÑ„Ð¾Ñ€Ð¼Ñ–Â».\n\n**Ð–ÑƒÑ€Ð½Ð°Ð»Ñ–ÑÑ‚:** Ð—Ñ€Ð¾Ð·ÑƒÐ¼Ñ–Ð»Ð¾. **ÐŸÐµÑ€ÐµÑ…Ñ–Ð´** Ð¼Ñ–Ð¶ ÑÑ‚Ð¸Ð»ÑÐ¼Ð¸ â€” Ñ†Ðµ **Ð²Ð´Ð¾ÑÐºÐ¾Ð½Ð°Ð»ÐµÐ½Ð½Ñ** Ð½Ð°ÑˆÐ¸Ñ… Ð½Ð°Ð²Ð¸Ñ‡Ð¾Ðº.\n\n### ÐžÑ„Ñ–Ñ†Ñ–Ð¹Ð½Ð¾-Ð´Ñ–Ð»Ð¾Ð²Ð¸Ð¹ ÑÑ‚Ð¸Ð»ÑŒ: Ñ„Ð¾Ñ€Ð¼Ð°Ð»ÑŒÐ½Ð° Ñ‚Ð¾Ñ‡Ð½Ñ–ÑÑ‚ÑŒ\n\nÐ’ Ð¾Ñ„Ñ–Ñ†Ñ–Ð¹Ð½Ð¸Ñ… Ð´Ð¾ÐºÑƒÐ¼ÐµÐ½Ñ‚Ð°Ñ… Ñ„Ð¾Ñ€Ð¼Ð° Ð½Ð° -Ð½Ð¾/-Ñ‚Ð¾ Ñ” Ð¾Ð±Ð¾Ð²'ÑÐ·ÐºÐ¾Ð²Ð¾ÑŽ:\n\n| ÐÐµÐ¿Ñ€Ð°Ð²Ð¸Ð»ÑŒÐ½Ð¾ | ÐŸÑ€Ð°Ð²Ð¸Ð»ÑŒÐ½Ð¾ |\n|-------------|-----------|\n| ÐœÐ¸ ÑƒÑ…Ð²Ð°Ð»Ð¸Ð»Ð¸ Ñ€Ñ–ÑˆÐµÐ½Ð½Ñ | Ð Ñ–ÑˆÐµÐ½Ð½Ñ **ÑƒÑ…Ð²Ð°Ð»ÐµÐ½Ð¾** |\n| Ð”Ð¸Ñ€ÐµÐºÑ‚Ð¾Ñ€ Ð¿Ñ–Ð´Ð¿Ð¸ÑÐ°Ð² Ð½Ð°ÐºÐ°Ð· | ÐÐ°ÐºÐ°Ð· **Ð¿Ñ–Ð´Ð¿Ð¸ÑÐ°Ð½Ð¾** Ð´Ð¸Ñ€ÐµÐºÑ‚Ð¾Ñ€Ð¾Ð¼ |\n| ÐšÐ¾Ð¼Ñ–ÑÑ–Ñ Ñ€Ð¾Ð·Ð³Ð»ÑÐ½ÑƒÐ»Ð° Ð·Ð°ÑÐ²Ñƒ | Ð—Ð°ÑÐ²Ñƒ **Ñ€Ð¾Ð·Ð³Ð»ÑÐ½ÑƒÑ‚Ð¾** ÐºÐ¾Ð¼Ñ–ÑÑ–Ñ”ÑŽ |\n\n> ðŸŒ **Ð ÐµÐ°Ð»ÑŒÐ½Ð¸Ð¹ ÑÐ²Ñ–Ñ‚**\n>\n> ÐšÐ¾Ð»Ð¸ Ð²Ð¸ Ð¾Ñ‚Ñ€Ð¸Ð¼ÑƒÑ”Ñ‚Ðµ Ð¾Ñ„Ñ–Ñ†Ñ–Ð¹Ð½Ð¸Ð¹ Ð´Ð¾ÐºÑƒÐ¼ÐµÐ½Ñ‚ Ð· Ð£ÐºÑ€Ð°Ñ—Ð½Ð¸ â€” Ð²Ñ–Ð·Ñƒ, ÑÐµÑ€Ñ‚Ð¸Ñ„Ñ–ÐºÐ°Ñ‚, Ð´Ð¸Ð¿Ð»Ð¾Ð¼ â€” Ð·Ð²ÐµÑ€Ð½Ñ–Ñ‚ÑŒ ÑƒÐ²Ð°Ð³Ñƒ Ð½Ð° Ñ„Ð¾Ñ€Ð¼Ð¸ Ð´Ñ–Ñ”ÑÐ»Ñ–Ð². Ð¢Ð°Ð¼ Ð·Ð°Ð²Ð¶Ð´Ð¸ Ð±ÑƒÐ´Ðµ Â«Ð²Ð¸Ð´Ð°Ð½Ð¾Â», Â«Ð·Ð°Ñ‚Ð²ÐµÑ€Ð´Ð¶ÐµÐ½Ð¾Â», Â«Ð¿Ñ–Ð´Ð¿Ð¸ÑÐ°Ð½Ð¾Â». Ð¦Ðµ Ð½Ðµ ÐºÐ°Ð½Ñ†ÐµÐ»ÑÑ€Ð¸Ñ‚, Ð° Ð½Ð¾Ñ€Ð¼Ð° Ð¾Ñ„Ñ–Ñ†Ñ–Ð¹Ð½Ð¾Ð³Ð¾ ÑÑ‚Ð¸Ð»ÑŽ.\n\n### ÐŸÑƒÐ±Ð»Ñ–Ñ†Ð¸ÑÑ‚Ð¸Ñ‡Ð½Ð¸Ð¹ ÑÑ‚Ð¸Ð»ÑŒ: Ð±Ð°Ð»Ð°Ð½Ñ\n\nÐ–ÑƒÑ€Ð½Ð°Ð»Ñ–ÑÑ‚Ð¸ÐºÐ° Ð²Ð¸Ð¼Ð°Ð³Ð°Ñ” Ð±Ð°Ð»Ð°Ð½ÑÑƒ Ð¼Ñ–Ð¶ Ð´Ð¾ÑÑ‚ÑƒÐ¿Ð½Ñ–ÑÑ‚ÑŽ Ñ‚Ð° Ð°Ð²Ñ‚Ð¾Ñ€Ð¸Ñ‚ÐµÑ‚Ð½Ñ–ÑÑ‚ÑŽ:\n\n**Ð—Ð°Ð³Ð¾Ð»Ð¾Ð²ÐºÐ¸ (ÐºÐ¾Ñ€Ð¾Ñ‚ÐºÐ¾, Ð°ÐºÑ‚Ð¸Ð²Ð½Ð¾):**\n- *ÐŸÐ°Ñ€Ð»Ð°Ð¼ÐµÐ½Ñ‚ ÑƒÑ…Ð²Ð°Ð»Ð¸Ð² Ð·Ð°ÐºÐ¾Ð½*\n- *ÐÐ°ÑƒÐºÐ¾Ð²Ñ†Ñ– Ð²Ñ–Ð´ÐºÑ€Ð¸Ð»Ð¸ Ð½Ð¾Ð²Ð¸Ð¹ Ð²Ð¸Ð´*\n\n**Ð¢ÐµÐºÑÑ‚ ÑÑ‚Ð°Ñ‚Ñ‚Ñ– (Ñ„Ð¾Ñ€Ð¼Ð°Ð»ÑŒÐ½Ñ–ÑˆÐµ, Ð¿Ð°ÑÐ¸Ð²):**\n- *Ð—Ð°ÐºÐ¾Ð½Ð¾Ð¿Ñ€Ð¾Ñ”ÐºÑ‚ **Ð±ÑƒÐ»Ð¾ Ñ€Ð¾Ð·Ð³Ð»ÑÐ½ÑƒÑ‚Ð¾** Ñƒ Ð´Ñ€ÑƒÐ³Ð¾Ð¼Ñƒ Ñ‡Ð¸Ñ‚Ð°Ð½Ð½Ñ–...*\n- *Ð’Ñ–Ð´ÐºÑ€Ð¸Ñ‚Ñ‚Ñ **Ð±ÑƒÐ»Ð¾ Ð·Ñ€Ð¾Ð±Ð»ÐµÐ½Ð¾** ÐºÐ¾Ð¼Ð°Ð½Ð´Ð¾ÑŽ ÑƒÐºÑ€Ð°Ñ—Ð½ÑÑŒÐºÐ¸Ñ… Ð±Ñ–Ð¾Ð»Ð¾Ð³Ñ–Ð²...*\n\n### Ð”Ñ–Ð°Ð»Ð¾Ð³ 3: Ð®Ñ€Ð¸Ð´Ð¸Ñ‡Ð½Ð° ÐºÐ¾Ð½ÑÑƒÐ»ÑŒÑ‚Ð°Ñ†Ñ–Ñ ðŸ—£ï¸\n\n**ÐšÐ»Ñ–Ñ”Ð½Ñ‚:** ÐœÐµÐ½Ñ– Ð¿Ð¾Ñ‚Ñ€Ñ–Ð±Ð½Ð° **ÐºÐ¾Ð½ÑÐ¾Ð»Ñ–Ð´Ð°Ñ†Ñ–Ñ** Ð²ÑÑ–Ñ… Ð´Ð¾ÐºÑƒÐ¼ÐµÐ½Ñ‚Ñ–Ð² Ð´Ð»Ñ ÑÑƒÐ´Ñƒ.\n\n**Ð®Ñ€Ð¸ÑÑ‚:** Ð—Ð²Ñ–ÑÐ½Ð¾. Ð—Ð°ÑÐ²Ñƒ Ð²Ð¶Ðµ **Ð¿Ð¾Ð´Ð°Ð½Ð¾**?\n\n**ÐšÐ»Ñ–Ñ”Ð½Ñ‚:** Ð¢Ð°Ðº, Ð¼Ð¸Ð½ÑƒÐ»Ð¾Ð³Ð¾ Ñ‚Ð¸Ð¶Ð½Ñ.\n\n**Ð®Ñ€Ð¸ÑÑ‚:** Ð”Ð¾Ð±Ñ€Ðµ. Ð Ð´Ð¾ÐºÐ°Ð·Ð¸? Ð‡Ñ… **Ð·Ñ–Ð±Ñ€Ð°Ð½Ð¾** Ñ– **ÑÐ¸ÑÑ‚ÐµÐ¼Ð°Ñ‚Ð¸Ð·Ð¾Ð²Ð°Ð½Ð¾**?\n\n**ÐšÐ»Ñ–Ñ”Ð½Ñ‚:** Ð¦Ðµ ÑÐ°Ð¼Ðµ Ñ‚Ðµ, Ð· Ñ‡Ð¸Ð¼ Ð¼ÐµÐ½Ñ– Ð¿Ð¾Ñ‚Ñ€Ñ–Ð±Ð½Ð° Ð´Ð¾Ð¿Ð¾Ð¼Ð¾Ð³Ð°.\n\n**Ð®Ñ€Ð¸ÑÑ‚:** Ð—Ñ€Ð¾Ð·ÑƒÐ¼Ñ–Ð»Ð¾. ÐŸÐ¾Ñ‡Ð½ÐµÐ¼Ð¾ Ð· **Ð°Ð½Ð°Ð»Ñ–Ð·Ñƒ** Ð½Ð°ÑÐ²Ð½Ð¸Ñ… Ð¼Ð°Ñ‚ÐµÑ€Ñ–Ð°Ð»Ñ–Ð². **Ð Ð¾Ð·ÑˆÐ¸Ñ€ÐµÐ½Ð½Ñ** Ð´Ð¾ÐºÐ°Ð·Ð¾Ð²Ð¾Ñ— Ð±Ð°Ð·Ð¸ â€” Ð½Ð°Ñˆ Ð¿Ñ€Ñ–Ð¾Ñ€Ð¸Ñ‚ÐµÑ‚.\n\n### Ð¤Ñ€Ð°Ð·ÐµÐ¾Ð»Ð¾Ð³Ñ–Ñ Ð² Ð°ÐºÐ°Ð´ÐµÐ¼Ñ–Ñ‡Ð½Ð¾Ð¼Ñƒ ÐºÐ¾Ð½Ñ‚ÐµÐºÑÑ‚Ñ–\n\nÐÐ° Ñ€Ñ–Ð²Ð½Ñ– B2 Ð²Ð¸ Ð²Ð¸Ð²Ñ‡Ð°Ð»Ð¸ ÑƒÐºÑ€Ð°Ñ—Ð½ÑÑŒÐºÑ– Ð¿Ñ€Ð¸ÐºÐ°Ð·ÐºÐ¸ Ñ‚Ð° Ñ–Ð´Ñ–Ð¾Ð¼Ð¸. Ð¢ÐµÐ¿ÐµÑ€ Ñ€Ð¾Ð·Ð³Ð»ÑÐ½ÐµÐ¼Ð¾, ÑÐº **Ð·Ð°ÑÑ‚Ð¾ÑÑƒÐ²Ð°Ð½Ð½Ñ** Ñ„Ñ€Ð°Ð·ÐµÐ¾Ð»Ð¾Ð³Ñ–Ñ— Ð²Ñ–Ð´Ñ€Ñ–Ð·Ð½ÑÑ”Ñ‚ÑŒÑÑ Ð·Ð°Ð»ÐµÐ¶Ð½Ð¾ Ð²Ñ–Ð´ Ñ€ÐµÐ³Ñ–ÑÑ‚Ñ€Ñƒ:\n\n| ÐŸÑ€Ð¸ÐºÐ°Ð·ÐºÐ° | Ð Ð¾Ð·Ð¼Ð¾Ð²Ð½Ð¸Ð¹ ÐºÐ¾Ð½Ñ‚ÐµÐºÑÑ‚ | ÐÐºÐ°Ð´ÐµÐ¼Ñ–Ñ‡Ð½Ð¸Ð¹ ÐºÐ¾Ð½Ñ‚ÐµÐºÑÑ‚ |\n|----------|-------------------|---------------------|\n| Ð‘ÐµÐ· Ñ‚Ñ€ÑƒÐ´Ð° Ð½ÐµÐ¼Ð° Ð¿Ð»Ð¾Ð´Ð° | ÐŸÑ€ÑÐ¼Ð¾: Â«Ð‘ÐµÐ· Ñ‚Ñ€ÑƒÐ´Ð° Ð½ÐµÐ¼Ð° Ð¿Ð»Ð¾Ð´Ð° â€” Ñ‚Ñ€ÐµÐ±Ð° Ð¿Ñ€Ð°Ñ†ÑŽÐ²Ð°Ñ‚Ð¸!Â» | ÐžÐ¿Ð¾ÑÐµÑ€ÐµÐ´ÐºÐ¾Ð²Ð°Ð½Ð¾: Â«Ð¯Ðº Ð²Ñ–Ð´Ð¾Ð¼Ð¾, Ñ€ÐµÐ·ÑƒÐ»ÑŒÑ‚Ð°Ñ‚ Ð¿Ð¾Ñ‚Ñ€ÐµÐ±ÑƒÑ” Ð·ÑƒÑÐ¸Ð»ÑŒ...Â» |\n| Ð¥Ñ‚Ð¾ Ð¿Ð¸Ñ‚Ð°Ñ”, Ñ‚Ð¾Ð¹ Ð½Ðµ Ð±Ð»ÑƒÐ´Ð¸Ñ‚ÑŒ | Â«ÐÐµ ÑÐ¾Ñ€Ð¾Ð¼ÑÑ Ð¿Ð¸Ñ‚Ð°Ñ‚Ð¸!Â» | Â«Ð•Ð²Ñ€Ð¸ÑÑ‚Ð¸Ñ‡Ð½Ð¸Ð¹ Ð¼ÐµÑ‚Ð¾Ð´ Ð¿ÐµÑ€ÐµÐ´Ð±Ð°Ñ‡Ð°Ñ” Ð¿Ð¾ÑÑ‚Ñ–Ð¹Ð½Ðµ **ÑƒÐ·Ð°Ð³Ð°Ð»ÑŒÐ½ÐµÐ½Ð½Ñ** Ð¿Ð¸Ñ‚Ð°Ð½ÑŒ...Â» |\n\n> ðŸ”— **Ð—Ð²'ÑÐ·Ð¾Ðº Ð· Ð°Ð½Ð³Ð»Ñ–Ð¹ÑÑŒÐºÐ¾ÑŽ**\n>\n> Ð’ Ð°Ð½Ð³Ð»Ñ–Ð¹ÑÑŒÐºÑ–Ð¹ Ð°ÐºÐ°Ð´ÐµÐ¼Ñ–Ñ‡Ð½Ñ–Ð¹ Ð¿Ñ€Ð¾Ð·Ñ– Ñ‚Ð°ÐºÐ¾Ð¶ ÑƒÐ½Ð¸ÐºÐ°ÑŽÑ‚ÑŒ Ð¿Ñ€ÑÐ¼Ð¸Ñ… Ñ–Ð´Ñ–Ð¾Ð¼. ÐŸÐ¾Ñ€Ñ–Ð²Ð½ÑÐ¹Ñ‚Ðµ: *\"It's a piece of cake\"* (Ñ€Ð¾Ð·Ð¼Ð¾Ð²Ð½Ð°) â†’ *\"The task presents minimal difficulty\"* (Ð°ÐºÐ°Ð´ÐµÐ¼Ñ–Ñ‡Ð½Ð°). Ð¢Ðµ ÑÐ°Ð¼Ðµ Ð¿Ñ€Ð°Ð²Ð¸Ð»Ð¾ Ð´Ñ–Ñ” Ð² ÑƒÐºÑ€Ð°Ñ—Ð½ÑÑŒÐºÑ–Ð¹.\n\n### Ð”Ñ–Ð°Ð»Ð¾Ð³ 4: Ð—Ð°Ñ…Ð¸ÑÑ‚ Ð´Ð¸ÑÐµÑ€Ñ‚Ð°Ñ†Ñ–Ñ— ðŸ—£ï¸\n\n**Ð“Ð¾Ð»Ð¾Ð²Ð° Ñ€Ð°Ð´Ð¸:** Ð¨Ð°Ð½Ð¾Ð²Ð½Ð¸Ð¹ Ð·Ð´Ð¾Ð±ÑƒÐ²Ð°Ñ‡Ñƒ, Ð¿Ñ€Ð¾ÑˆÑƒ Ñ€Ð¾Ð·Ð¿Ð¾Ñ‡Ð°Ñ‚Ð¸.\n\n**Ð—Ð´Ð¾Ð±ÑƒÐ²Ð°Ñ‡:** Ð”ÑÐºÑƒÑŽ. Ð”Ð¸ÑÐµÑ€Ñ‚Ð°Ñ†Ñ–ÑŽ Ð¿Ñ€Ð¸ÑÐ²ÑÑ‡ÐµÐ½Ð¾ **Ð¿Ð¾Ð³Ð»Ð¸Ð±Ð»ÐµÐ½Ð½ÑŽ** Ñ€Ð¾Ð·ÑƒÐ¼Ñ–Ð½Ð½Ñ ÐºÐ¾Ð³Ð½Ñ–Ñ‚Ð¸Ð²Ð½Ð¸Ñ… Ð¿Ñ€Ð¾Ñ†ÐµÑÑ–Ð². **ÐÐ½Ð°Ð»Ñ–Ð·** Ð»Ñ–Ñ‚ÐµÑ€Ð°Ñ‚ÑƒÑ€Ð¸ **Ð±ÑƒÐ»Ð¾ Ð¿Ñ€Ð¾Ð²ÐµÐ´ÐµÐ½Ð¾** Ð½Ð° Ð¼Ð°Ñ‚ÐµÑ€Ñ–Ð°Ð»Ñ– Ð¿Ð¾Ð½Ð°Ð´ Ð´Ð²Ð¾Ñ…ÑÐ¾Ñ‚ Ð´Ð¶ÐµÑ€ÐµÐ».\n\n**ÐžÐ¿Ð¾Ð½ÐµÐ½Ñ‚:** Ð¯ÐºÑƒ Ð¼ÐµÑ‚Ð¾Ð´Ð¾Ð»Ð¾Ð³Ñ–ÑŽ **Ð·Ð°ÑÑ‚Ð¾ÑÐ¾Ð²Ð°Ð½Ð¾**?\n\n**Ð—Ð´Ð¾Ð±ÑƒÐ²Ð°Ñ‡:** **Ð‘ÑƒÐ»Ð¾ Ð²Ð¸ÐºÐ¾Ñ€Ð¸ÑÑ‚Ð°Ð½Ð¾** ÐºÐ¾Ð¼Ð¿Ð»ÐµÐºÑ Ð¼ÐµÑ‚Ð¾Ð´Ñ–Ð²: ÑÐ¿Ð¾ÑÑ‚ÐµÑ€ÐµÐ¶ÐµÐ½Ð½Ñ, ÐµÐºÑÐ¿ÐµÑ€Ð¸Ð¼ÐµÐ½Ñ‚, **Ð¾Ñ†Ñ–Ð½ÑŽÐ²Ð°Ð½Ð½Ñ** Ñ€ÐµÐ·ÑƒÐ»ÑŒÑ‚Ð°Ñ‚Ñ–Ð² Ð·Ð° Ð´Ð¾Ð¿Ð¾Ð¼Ð¾Ð³Ð¾ÑŽ ÑÑ‚Ð°Ñ‚Ð¸ÑÑ‚Ð¸Ñ‡Ð½Ð¸Ñ… Ð¼ÐµÑ‚Ð¾Ð´Ñ–Ð².\n\n**ÐžÐ¿Ð¾Ð½ÐµÐ½Ñ‚:** Ð§Ð¸ Ñ” **Ð¾Ð±Ð¼ÐµÐ¶ÐµÐ½Ð½Ñ** Ð´Ð¾ÑÐ»Ñ–Ð´Ð¶ÐµÐ½Ð½Ñ?\n\n**Ð—Ð´Ð¾Ð±ÑƒÐ²Ð°Ñ‡:** Ð¢Ð°Ðº. **Ð—Ð°ÐºÑ€Ñ–Ð¿Ð»ÐµÐ½Ð½Ñ** Ñ€ÐµÐ·ÑƒÐ»ÑŒÑ‚Ð°Ñ‚Ñ–Ð² Ð¿Ð¾Ñ‚Ñ€ÐµÐ±ÑƒÑ” Ð´Ð¾Ð´Ð°Ñ‚ÐºÐ¾Ð²Ð¸Ñ… Ð´Ð¾ÑÐ»Ñ–Ð´Ð¶ÐµÐ½ÑŒ Ð½Ð° ÑˆÐ¸Ñ€ÑˆÑ–Ð¹ Ð²Ð¸Ð±Ñ–Ñ€Ñ†Ñ–.\n\n### Ð¡Ð¸Ð½Ñ‚ÐµÐ·: Ñ€ÐµÐ³Ñ–ÑÑ‚Ñ€Ð¾Ð²Ð° Ð³Ð½ÑƒÑ‡ÐºÑ–ÑÑ‚ÑŒ\n\n**Ð”Ð¾ÑÐºÐ¾Ð½Ð°Ð»Ñ–ÑÑ‚ÑŒ** Ñ€Ñ–Ð²Ð½Ñ C1 Ð¿Ð¾Ð»ÑÐ³Ð°Ñ” Ñƒ Ð·Ð´Ð°Ñ‚Ð½Ð¾ÑÑ‚Ñ– Ñ‚Ñ€Ð°Ð½ÑÑ„Ð¾Ñ€Ð¼ÑƒÐ²Ð°Ñ‚Ð¸ Ð¾Ð´Ð½Ñƒ Ð´ÑƒÐ¼ÐºÑƒ Ð² Ñ€Ñ–Ð·Ð½Ñ– Ñ€ÐµÐ³Ñ–ÑÑ‚Ñ€Ð¸:\n\n**Ð†Ð´ÐµÑ:** *Ñ€ÐµÐ·ÑƒÐ»ÑŒÑ‚Ð°Ñ‚Ð¸ Ð¾Ð¿ÑƒÐ±Ð»Ñ–ÐºÑƒÐ²Ð°Ð»Ð¸*\n\n| Ð ÐµÐ³Ñ–ÑÑ‚Ñ€ | Ð¢Ñ€Ð°Ð½ÑÑ„Ð¾Ñ€Ð¼Ð°Ñ†Ñ–Ñ |\n|---------|---------------|\n| Ð Ð¾Ð·Ð¼Ð¾Ð²Ð½Ð¸Ð¹ | Ð ÐµÐ·ÑƒÐ»ÑŒÑ‚Ð°Ñ‚Ð¸ Ð²Ð¶Ðµ Ð¾Ð¿ÑƒÐ±Ð»Ñ–ÐºÑƒÐ²Ð°Ð»Ð¸. |\n| ÐŸÑƒÐ±Ð»Ñ–Ñ†Ð¸ÑÑ‚Ð¸Ñ‡Ð½Ð¸Ð¹ | Ð ÐµÐ·ÑƒÐ»ÑŒÑ‚Ð°Ñ‚Ð¸ Ð´Ð¾ÑÐ»Ñ–Ð´Ð¶ÐµÐ½Ð½Ñ Ð±ÑƒÐ»Ð¾ Ð¾Ð¿ÑƒÐ±Ð»Ñ–ÐºÐ¾Ð²Ð°Ð½Ð¾. |\n| ÐÐ°ÑƒÐºÐ¾Ð²Ð¸Ð¹ | ÐÐ° Ð¾ÑÐ½Ð¾Ð²Ñ– Ð¿Ñ€Ð¾Ð²ÐµÐ´ÐµÐ½Ð¾Ð³Ð¾ Ð°Ð½Ð°Ð»Ñ–Ð·Ñƒ Ñ€ÐµÐ·ÑƒÐ»ÑŒÑ‚Ð°Ñ‚Ð¸ Ð±ÑƒÐ»Ð¾ ÑÐ¸ÑÑ‚ÐµÐ¼Ð°Ñ‚Ð¸Ð·Ð¾Ð²Ð°Ð½Ð¾ Ñ‚Ð° Ð¾Ð¿ÑƒÐ±Ð»Ñ–ÐºÐ¾Ð²Ð°Ð½Ð¾. |\n| ÐžÑ„Ñ–Ñ†Ñ–Ð¹Ð½Ð¸Ð¹ | Ð ÐµÐ·ÑƒÐ»ÑŒÑ‚Ð°Ñ‚Ð¸ Ð½Ð°ÑƒÐºÐ¾Ð²Ð¾Ð³Ð¾ Ð´Ð¾ÑÐ»Ñ–Ð´Ð¶ÐµÐ½Ð½Ñ Ð¾Ð¿Ñ€Ð¸Ð»ÑŽÐ´Ð½ÐµÐ½Ð¾ Ð² ÑƒÑÑ‚Ð°Ð½Ð¾Ð²Ð»ÐµÐ½Ð¾Ð¼Ñƒ Ð¿Ð¾Ñ€ÑÐ´ÐºÑƒ. |\n\n> ðŸ“œ **Ð†ÑÑ‚Ð¾Ñ€Ð¸Ñ‡Ð½Ð° Ð¿ÐµÑ€ÑÐ¿ÐµÐºÑ‚Ð¸Ð²Ð°**\n>\n> ÐŸÑ–Ð´ Ñ‡Ð°Ñ Â«Ð Ð¾Ð·ÑÑ‚Ñ€Ñ–Ð»ÑÐ½Ð¾Ð³Ð¾ Ð²Ñ–Ð´Ñ€Ð¾Ð´Ð¶ÐµÐ½Ð½ÑÂ» (1920â€“1930-Ñ‚Ñ– Ñ€Ð¾ÐºÐ¸) ÑƒÐºÑ€Ð°Ñ—Ð½ÑÑŒÐºÑ– Ð½Ð°ÑƒÐºÐ¾Ð²Ñ†Ñ– ÑÑ‚Ð²Ð¾Ñ€Ð¸Ð»Ð¸ Ð¿Ð¾Ñ‚ÑƒÐ¶Ð½Ñƒ Ð°ÐºÐ°Ð´ÐµÐ¼Ñ–Ñ‡Ð½Ñƒ Ñ‚Ñ€Ð°Ð´Ð¸Ñ†Ñ–ÑŽ. Ð†Ð¼ÐµÐ½Ð° ÑÐº ÐÐ³Ð°Ñ‚Ð°Ð½Ð³ÐµÐ» ÐšÑ€Ð¸Ð¼ÑÑŒÐºÐ¸Ð¹, ÐœÐ¸Ñ…Ð°Ð¹Ð»Ð¾ Ð“Ñ€ÑƒÑˆÐµÐ²ÑÑŒÐºÐ¸Ð¹, ÐœÐ¸ÐºÐ¾Ð»Ð° Ð—ÐµÑ€Ð¾Ð² â€” Ñ†Ðµ Ð½Ðµ Ð»Ð¸ÑˆÐµ Ñ–ÑÑ‚Ð¾Ñ€Ñ–Ñ, Ð° Ð¹ Ð·Ñ€Ð°Ð·ÐºÐ¸ **Ð¼Ð°Ð¹ÑÑ‚ÐµÑ€Ð½Ð¾ÑÑ‚Ñ–** Ð½Ð°ÑƒÐºÐ¾Ð²Ð¾Ð³Ð¾ ÑÑ‚Ð¸Ð»ÑŽ, ÑÐºÑ– Ð¼Ð¸ Ð¿Ñ€Ð¾Ð´Ð¾Ð²Ð¶ÑƒÑ”Ð¼Ð¾ Ð²Ð¸Ð²Ñ‡Ð°Ñ‚Ð¸ ÑÑŒÐ¾Ð³Ð¾Ð´Ð½Ñ–.\n\n### Ð”Ñ–Ð°Ð»Ð¾Ð³ 5: ÐœÑ–Ð¶Ð½Ð°Ñ€Ð¾Ð´Ð½Ð° ÐºÐ¾Ð½Ñ„ÐµÑ€ÐµÐ½Ñ†Ñ–Ñ ðŸ—£ï¸\n\n**ÐœÐ¾Ð´ÐµÑ€Ð°Ñ‚Ð¾Ñ€:** Ð”ÑÐºÑƒÑŽ Ð·Ð° Ð´Ð¾Ð¿Ð¾Ð²Ñ–Ð´ÑŒ. Ð§Ð¸ Ñ” Ð·Ð°Ð¿Ð¸Ñ‚Ð°Ð½Ð½Ñ Ð· Ð°ÑƒÐ´Ð¸Ñ‚Ð¾Ñ€Ñ–Ñ—?\n\n**Ð£Ñ‡Ð°ÑÐ½Ð¸Ðº 1:** Ð§Ð¸ Ð¿Ñ€Ð¾Ð²Ð¾Ð´Ð¸Ð»Ð°ÑÑ **Ñ–Ð½Ñ‚ÐµÐ³Ñ€Ð°Ñ†Ñ–Ñ** Ð²Ð°ÑˆÐ¸Ñ… Ð´Ð°Ð½Ð¸Ñ… Ð· Ð¿Ð¾Ð¿ÐµÑ€ÐµÐ´Ð½Ñ–Ð¼Ð¸ Ð´Ð¾ÑÐ»Ñ–Ð´Ð¶ÐµÐ½Ð½ÑÐ¼Ð¸?\n\n**Ð”Ð¾Ð¿Ð¾Ð²Ñ–Ð´Ð°Ñ‡:** Ð¢Ð°Ðº. **Ð¡Ð¸Ð½Ñ‚ÐµÐ·** Ñ€ÐµÐ·ÑƒÐ»ÑŒÑ‚Ð°Ñ‚Ñ–Ð² **Ð±ÑƒÐ»Ð¾ Ð·Ð´Ñ–Ð¹ÑÐ½ÐµÐ½Ð¾** Ð½Ð° Ð¾ÑÐ½Ð¾Ð²Ñ– Ð¼ÐµÑ‚Ð°Ð°Ð½Ð°Ð»Ñ–Ð·Ñƒ Ð´Ð²Ð°Ð´Ñ†ÑÑ‚Ð¸ Ð¿ÑƒÐ±Ð»Ñ–ÐºÐ°Ñ†Ñ–Ð¹.\n\n**Ð£Ñ‡Ð°ÑÐ½Ð¸Ðº 2:** Ð ÑÐºÐµ Ð¿Ñ€Ð°ÐºÑ‚Ð¸Ñ‡Ð½Ðµ **Ð·Ð°ÑÑ‚Ð¾ÑÑƒÐ²Ð°Ð½Ð½Ñ** Ð²Ð°ÑˆÐ¸Ñ… Ð²Ð¸ÑÐ½Ð¾Ð²ÐºÑ–Ð²?\n\n**Ð”Ð¾Ð¿Ð¾Ð²Ñ–Ð´Ð°Ñ‡:** ÐÐ°ÑˆÑ– Ñ€ÐµÐºÐ¾Ð¼ÐµÐ½Ð´Ð°Ñ†Ñ–Ñ— Ð²Ð¶Ðµ **Ð²Ð¿Ñ€Ð¾Ð²Ð°Ð´Ð¶ÐµÐ½Ð¾** Ñƒ Ñ‚Ñ€ÑŒÐ¾Ñ… ÑƒÐ½Ñ–Ð²ÐµÑ€ÑÐ¸Ñ‚ÐµÑ‚Ð°Ñ…. **ÐžÐ¿Ð°Ð½ÑƒÐ²Ð°Ð½Ð½Ñ** Ð½Ð¾Ð²Ð¾Ñ— Ð¼ÐµÑ‚Ð¾Ð´Ð¸ÐºÐ¸ Ñ‚Ñ€Ð¸Ð²Ð°Ñ”.\n\n**ÐœÐ¾Ð´ÐµÑ€Ð°Ñ‚Ð¾Ñ€:** Ð”ÑÐºÑƒÑŽ. **ÐŸÐ¾Ð²Ñ‚Ð¾Ñ€ÐµÐ½Ð½Ñ** Ñ‚Ð° **Ð·Ð°ÐºÑ€Ñ–Ð¿Ð»ÐµÐ½Ð½Ñ** Ð¼Ð°Ñ‚ÐµÑ€Ñ–Ð°Ð»Ñƒ â€” ÐºÐ»ÑŽÑ‡ Ð´Ð¾ **Ð²Ð´Ð¾ÑÐºÐ¾Ð½Ð°Ð»ÐµÐ½Ð½Ñ**.\n\n## Practice: Ð¢Ñ€Ð°Ð½ÑÑ„Ð¾Ñ€Ð¼Ð°Ñ†Ñ–Ð¹Ð½Ñ– Ð²Ð¿Ñ€Ð°Ð²Ð¸\n\nÐŸÐµÑ€ÐµÐ´ Ñ‚Ð¸Ð¼ ÑÐº Ð¿ÐµÑ€ÐµÐ¹Ñ‚Ð¸ Ð´Ð¾ Ð¾ÑÐ½Ð¾Ð²Ð½Ð¸Ñ… Ð²Ð¿Ñ€Ð°Ð², Ð²Ð¸ÐºÐ¾Ð½Ð°Ð¹Ñ‚Ðµ Ñ†Ñ– Ð¿Ñ–Ð´Ð³Ð¾Ñ‚Ð¾Ð²Ñ‡Ñ– Ð·Ð°Ð²Ð´Ð°Ð½Ð½Ñ Ð´Ð»Ñ **Ð·Ð°ÐºÑ€Ñ–Ð¿Ð»ÐµÐ½Ð½Ñ** Ð¼Ð°Ñ‚ÐµÑ€Ñ–Ð°Ð»Ñƒ.\n\n### Ð’Ð¿Ñ€Ð°Ð²Ð° 1: Ð’Ð¸Ð·Ð½Ð°Ñ‡Ñ‚Ðµ Ñ„Ð¾Ñ€Ð¼Ñƒ Ð¿Ð°ÑÐ¸Ð²Ñƒ\n\nÐŸÑ€Ð¾Ñ‡Ð¸Ñ‚Ð°Ð¹Ñ‚Ðµ Ñ€ÐµÑ‡ÐµÐ½Ð½Ñ Ñ‚Ð° Ð²Ð¸Ð·Ð½Ð°Ñ‡Ñ‚Ðµ, ÑÐºÐ° Ñ„Ð¾Ñ€Ð¼Ð° Ð¿Ð°ÑÐ¸Ð²Ð½Ð¾Ð³Ð¾ ÑÑ‚Ð°Ð½Ñƒ Ð²Ð¸ÐºÐ¾Ñ€Ð¸ÑÑ‚Ð°Ð½Ð°:\n\n1. Ð Ð¾Ð±Ð¾Ñ‚Ñƒ **Ð·Ð°Ð²ÐµÑ€ÑˆÐµÐ½Ð¾** Ð²Ñ‡Ð°ÑÐ½Ð¾.\n   > [!answer]\n   > Ð‘ÐµÐ·Ð¾ÑÐ¾Ð±Ð¾Ð²Ð¸Ð¹ Ð¿Ð°ÑÐ¸Ð² (-Ð½Ð¾/-Ñ‚Ð¾)\n\n2. Ð”Ð¾ÑÐ»Ñ–Ð´Ð¶ÐµÐ½Ð½Ñ **Ð¿Ñ€Ð¾Ð²Ð¾Ð´Ð¸Ñ‚ÑŒÑÑ** Ñ‰Ð¾Ñ€Ð¾ÐºÑƒ.\n   > [!answer]\n   > Ð—Ð²Ð¾Ñ€Ð¾Ñ‚Ð½Ð¸Ð¹ Ð¿Ð°ÑÐ¸Ð² (-ÑÑ)\n\n3. Ð¡Ñ‚Ð°Ñ‚Ñ‚Ñ **Ð±ÑƒÐ»Ð° Ð¾Ð¿ÑƒÐ±Ð»Ñ–ÐºÐ¾Ð²Ð°Ð½Ð°** Ð² Ð¼Ð¸Ð½ÑƒÐ»Ð¾Ð¼Ñƒ Ñ€Ð¾Ñ†Ñ–.\n   > [!answer]\n   > Ð”Ñ–Ñ”Ð¿Ñ€Ð¸ÐºÐ¼ÐµÑ‚Ð½Ð¸ÐºÐ¾Ð²Ð¸Ð¹ Ð¿Ð°ÑÐ¸Ð²\n\n4. Ð ÐµÐ·ÑƒÐ»ÑŒÑ‚Ð°Ñ‚Ð¸ **Ð¾Ð³Ð¾Ð»Ð¾ÑˆÑƒÑŽÑ‚ÑŒÑÑ** Ð½Ð° ÐºÐ¾Ð½Ñ„ÐµÑ€ÐµÐ½Ñ†Ñ–Ñ—.\n   > [!answer]\n   > Ð—Ð²Ð¾Ñ€Ð¾Ñ‚Ð½Ð¸Ð¹ Ð¿Ð°ÑÐ¸Ð² (-ÑÑ)\n\n### Ð’Ð¿Ñ€Ð°Ð²Ð° 2: Ð¢Ñ€Ð°Ð½ÑÑ„Ð¾Ñ€Ð¼ÑƒÐ¹Ñ‚Ðµ Ð² Ð¾Ñ„Ñ–Ñ†Ñ–Ð¹Ð½Ð¸Ð¹ ÑÑ‚Ð¸Ð»ÑŒ\n\nÐŸÐµÑ€ÐµÐ¿Ð¸ÑˆÑ–Ñ‚ÑŒ Ñ€ÐµÑ‡ÐµÐ½Ð½Ñ, Ð²Ð¸ÐºÐ¾Ñ€Ð¸ÑÑ‚Ð¾Ð²ÑƒÑŽÑ‡Ð¸ Ñ„Ð¾Ñ€Ð¼Ñƒ Ð½Ð° -Ð½Ð¾/-Ñ‚Ð¾:\n\n1. ÐšÐ¾Ð¼Ñ–ÑÑ–Ñ Ñ€Ð¾Ð·Ð³Ð»ÑÐ½ÑƒÐ»Ð° Ð²ÑÑ– Ð·Ð°ÑÐ²Ð¸.\n   > [!answer]\n   > Ð£ÑÑ– Ð·Ð°ÑÐ²Ð¸ Ñ€Ð¾Ð·Ð³Ð»ÑÐ½ÑƒÑ‚Ð¾ ÐºÐ¾Ð¼Ñ–ÑÑ–Ñ”ÑŽ.\n\n2. Ð ÐµÐ´Ð°ÐºÑ‚Ð¾Ñ€ Ð²Ð¸Ð¿Ñ€Ð°Ð²Ð¸Ð² Ð¿Ð¾Ð¼Ð¸Ð»ÐºÐ¸ Ð² Ñ‚ÐµÐºÑÑ‚Ñ–.\n   > [!answer]\n   > ÐŸÐ¾Ð¼Ð¸Ð»ÐºÐ¸ Ð² Ñ‚ÐµÐºÑÑ‚Ñ– Ð²Ð¸Ð¿Ñ€Ð°Ð²Ð»ÐµÐ½Ð¾ Ñ€ÐµÐ´Ð°ÐºÑ‚Ð¾Ñ€Ð¾Ð¼.\n\n3. Ð£Ñ€ÑÐ´ Ð¿Ñ€Ð¸Ð¹Ð½ÑÐ² Ð½Ð¾Ð²Ñ– Ð·Ð°ÐºÐ¾Ð½Ð¸.\n   > [!answer]\n   > ÐÐ¾Ð²Ñ– Ð·Ð°ÐºÐ¾Ð½Ð¸ Ð¿Ñ€Ð¸Ð¹Ð½ÑÑ‚Ð¾ ÑƒÑ€ÑÐ´Ð¾Ð¼.\n\n4. ÐÐ°ÑƒÐºÐ¾Ð²Ñ†Ñ– Ð¿Ñ€Ð¾Ð²ÐµÐ»Ð¸ ÐµÐºÑÐ¿ÐµÑ€Ð¸Ð¼ÐµÐ½Ñ‚.\n   > [!answer]\n   > Ð•ÐºÑÐ¿ÐµÑ€Ð¸Ð¼ÐµÐ½Ñ‚ Ð¿Ñ€Ð¾Ð²ÐµÐ´ÐµÐ½Ð¾ Ð½Ð°ÑƒÐºÐ¾Ð²Ñ†ÑÐ¼Ð¸.\n\n### Ð’Ð¿Ñ€Ð°Ð²Ð° 3: Ð’Ð¸Ð±ÐµÑ€Ñ–Ñ‚ÑŒ Ð´Ð¾Ñ€ÐµÑ‡Ð½Ð¸Ð¹ Ñ€ÐµÐ³Ñ–ÑÑ‚Ñ€\n\nÐ¯ÐºÐ¸Ð¹ Ð²Ð°Ñ€Ñ–Ð°Ð½Ñ‚ Ð½Ð°Ð¹ÐºÑ€Ð°Ñ‰Ðµ Ð¿Ñ–Ð´Ñ…Ð¾Ð´Ð¸Ñ‚ÑŒ Ð´Ð»Ñ Ð½Ð°ÑƒÐºÐ¾Ð²Ð¾Ñ— ÑÑ‚Ð°Ñ‚Ñ‚Ñ–?\n\n1. Ð°) ÐœÐ¸ Ð´Ð¾ÑÐ»Ñ–Ð´Ð¸Ð»Ð¸ Ð¿Ñ€Ð¾Ð±Ð»ÐµÐ¼Ñƒ.\n   Ð±) ÐŸÑ€Ð¾Ð±Ð»ÐµÐ¼Ñƒ Ð±ÑƒÐ»Ð¾ Ð´Ð¾ÑÐ»Ñ–Ð´Ð¶ÐµÐ½Ð¾.\n   Ð²) ÐŸÑ€Ð¾Ð±Ð»ÐµÐ¼Ð° Ð´Ð¾ÑÐ»Ñ–Ð´Ð¶ÑƒÐ²Ð°Ð»Ð°ÑÑ.\n   > [!answer]\n   > Ð±) ÐŸÑ€Ð¾Ð±Ð»ÐµÐ¼Ñƒ Ð±ÑƒÐ»Ð¾ Ð´Ð¾ÑÐ»Ñ–Ð´Ð¶ÐµÐ½Ð¾ â€” Ð½Ð°Ð¹Ñ„Ð¾Ñ€Ð¼Ð°Ð»ÑŒÐ½Ñ–ÑˆÐ¸Ð¹ Ð²Ð°Ñ€Ñ–Ð°Ð½Ñ‚ Ð´Ð»Ñ Ð½Ð°ÑƒÐºÐ¾Ð²Ð¾Ð³Ð¾ ÑÑ‚Ð¸Ð»ÑŽ.\n\n2. Ð°) Ð”Ð°Ð½Ñ– Ð¾Ð±Ñ€Ð¾Ð±Ð¸Ð»Ð¸.\n   Ð±) Ð”Ð°Ð½Ñ– Ð±ÑƒÐ»Ð¾ Ð¾Ð±Ñ€Ð¾Ð±Ð»ÐµÐ½Ð¾.\n   Ð²) Ð”Ð°Ð½Ñ– Ð¾Ð±Ñ€Ð¾Ð±Ð»ÑÑŽÑ‚ÑŒÑÑ.\n   > [!answer]\n   > Ð±) Ð”Ð°Ð½Ñ– Ð±ÑƒÐ»Ð¾ Ð¾Ð±Ñ€Ð¾Ð±Ð»ÐµÐ½Ð¾ â€” Ð·Ð°Ð²ÐµÑ€ÑˆÐµÐ½Ð° Ð´Ñ–Ñ Ð² Ð¾Ñ„Ñ–Ñ†Ñ–Ð¹Ð½Ð¾Ð¼Ñƒ ÑÑ‚Ð¸Ð»Ñ–.\n\n### Ð’Ð¿Ñ€Ð°Ð²Ð° 4: Ð—Ð½Ð°Ð¹Ð´Ñ–Ñ‚ÑŒ Ð½ÐµÐ²Ñ–Ð´Ð¿Ð¾Ð²Ñ–Ð´Ð½Ñ–ÑÑ‚ÑŒ Ñ€ÐµÐ³Ñ–ÑÑ‚Ñ€Ñƒ\n\nÐ£ ÐºÐ¾Ð¶Ð½Ð¾Ð¼Ñƒ Ñ€ÐµÑ‡ÐµÐ½Ð½Ñ– Ð·Ð½Ð°Ð¹Ð´Ñ–Ñ‚ÑŒ ÑÐ»Ð¾Ð²Ð¾ Ñ‡Ð¸ ÐºÐ¾Ð½ÑÑ‚Ñ€ÑƒÐºÑ†Ñ–ÑŽ, Ñ‰Ð¾ Ð½Ðµ Ð²Ñ–Ð´Ð¿Ð¾Ð²Ñ–Ð´Ð°Ñ” Ð½Ð°ÑƒÐºÐ¾Ð²Ð¾Ð¼Ñƒ ÑÑ‚Ð¸Ð»ÑŽ:\n\n1. *Â«Ð£ Ð´Ð¾ÑÐ»Ñ–Ð´Ð¶ÐµÐ½Ð½Ñ– Ð±ÑƒÐ»Ð¾ Ð²ÑÑ‚Ð°Ð½Ð¾Ð²Ð»ÐµÐ½Ð¾, Ñ‰Ð¾ Ñ€ÐµÐ·ÑƒÐ»ÑŒÑ‚Ð°Ñ‚Ð¸ ÐºÐ»Ð°ÑÐ½Ñ–.Â»*\n   > [!answer]\n   > Â«ÐºÐ»Ð°ÑÐ½Ñ–Â» â€” Ñ€Ð¾Ð·Ð¼Ð¾Ð²Ð½Ðµ ÑÐ»Ð¾Ð²Ð¾. ÐšÑ€Ð°Ñ‰Ðµ: Â«Ñ€ÐµÐ·ÑƒÐ»ÑŒÑ‚Ð°Ñ‚Ð¸ Ñ” Ð·Ð½Ð°Ñ‡ÑƒÑ‰Ð¸Ð¼Ð¸Â» Ð°Ð±Ð¾ Â«Ñ€ÐµÐ·ÑƒÐ»ÑŒÑ‚Ð°Ñ‚Ð¸ ÑÐ²Ñ–Ð´Ñ‡Ð°Ñ‚ÑŒ Ð¿Ñ€Ð¾...Â».\n\n2. *Â«ÐœÐµÑ‚Ð¾Ð´ Ð·Ð°ÑÑ‚Ð¾ÑÐ¾Ð²Ð°Ð½Ð¾ Ð´Ð»Ñ Ð°Ð½Ð°Ð»Ñ–Ð·Ñƒ, Ñ– Ð²Ñ–Ð½ Ñ€ÐµÐ°Ð»ÑŒÐ½Ð¾ Ð´Ð¾Ð¿Ð¾Ð¼Ñ–Ð³.Â»*\n   > [!answer]\n   > Â«Ñ€ÐµÐ°Ð»ÑŒÐ½Ð¾ Ð´Ð¾Ð¿Ð¾Ð¼Ñ–Ð³Â» â€” Ñ€Ð¾Ð·Ð¼Ð¾Ð²Ð½Ð° ÐºÐ¾Ð½ÑÑ‚Ñ€ÑƒÐºÑ†Ñ–Ñ. ÐšÑ€Ð°Ñ‰Ðµ: Â«Ð²Ð¸ÑÐ²Ð¸Ð²ÑÑ ÐµÑ„ÐµÐºÑ‚Ð¸Ð²Ð½Ð¸Ð¼Â».\n\n### Ð§ÐµÐº-Ð»Ð¸ÑÑ‚ ÑÐ°Ð¼Ð¾Ð¾Ñ†Ñ–Ð½ÑŽÐ²Ð°Ð½Ð½Ñ\n\nÐžÑ†Ñ–Ð½Ñ–Ñ‚ÑŒ ÑÐ²Ñ–Ð¹ Ñ€Ñ–Ð²ÐµÐ½ÑŒ Ð³Ð¾Ñ‚Ð¾Ð²Ð½Ð¾ÑÑ‚Ñ– Ð´Ð¾ C1:\n\n- [ ] Ð¯ Ð¼Ð¾Ð¶Ñƒ Ð²Ð¸Ð·Ð½Ð°Ñ‡Ð¸Ñ‚Ð¸ Ñ‡Ð¾Ñ‚Ð¸Ñ€Ð¸ Ñ„Ð¾Ñ€Ð¼Ð¸ Ð¿Ð°ÑÐ¸Ð²Ð½Ð¾Ð³Ð¾ ÑÑ‚Ð°Ð½Ñƒ\n- [ ] Ð¯ Ñ€Ð¾Ð·ÑƒÐ¼Ñ–ÑŽ Ñ€Ñ–Ð·Ð½Ð¸Ñ†ÑŽ Ð¼Ñ–Ð¶ -Ð½Ð¾/-Ñ‚Ð¾ Ñ‚Ð° -Ð½Ð¸Ð¹/-Ñ‚Ð¸Ð¹\n- [ ] Ð¯ Ð²Ð¼Ñ–ÑŽ Ñ‚Ñ€Ð°Ð½ÑÑ„Ð¾Ñ€Ð¼ÑƒÐ²Ð°Ñ‚Ð¸ Ð°ÐºÑ‚Ð¸Ð²Ð½Ñ– Ñ€ÐµÑ‡ÐµÐ½Ð½Ñ Ð² Ð¿Ð°ÑÐ¸Ð²Ð½Ñ–\n- [ ] Ð¯ Ð²Ñ–Ð´Ñ‡ÑƒÐ²Ð°ÑŽ Ñ€ÐµÐ³Ñ–ÑÑ‚Ñ€Ð¾Ð²Ñ– Ð½ÐµÐ²Ñ–Ð´Ð¿Ð¾Ð²Ñ–Ð´Ð½Ð¾ÑÑ‚Ñ–\n- [ ] Ð¯ Ð¼Ð¾Ð¶Ñƒ Ð²Ð¸ÐºÐ¾Ñ€Ð¸ÑÑ‚Ð¾Ð²ÑƒÐ²Ð°Ñ‚Ð¸ Ð¿Ð°ÑÐ¸Ð² Ñƒ Ð½Ð°ÑƒÐºÐ¾Ð²Ð¾Ð¼Ñƒ ÑÑ‚Ð¸Ð»Ñ–\n\n> âš¡ **Ð©Ð¾ Ð´Ð°Ð»Ñ–?**\n>\n> Ð¯ÐºÑ‰Ð¾ Ð²Ð¸ Ð²Ð¿ÐµÐ²Ð½ÐµÐ½Ð¾ Ð²Ñ–Ð´Ð¿Ð¾Ð²Ñ–Ð»Ð¸ Â«Ñ‚Ð°ÐºÂ» Ð½Ð° Ð²ÑÑ– Ð¿ÑƒÐ½ÐºÑ‚Ð¸ â€” Ð²Ð¸ Ð³Ð¾Ñ‚Ð¾Ð²Ñ– Ð´Ð¾ Ð½Ð°ÑÑ‚ÑƒÐ¿Ð½Ð¸Ñ… Ð¼Ð¾Ð´ÑƒÐ»Ñ–Ð² C1, Ð´Ðµ Ð¼Ð¸ Ð·Ð¾ÑÐµÑ€ÐµÐ´Ð¸Ð¼Ð¾ÑÑ Ð½Ð° **Ð°ÐºÐ°Ð´ÐµÐ¼Ñ–Ñ‡Ð½Ð¾Ð¼Ñƒ** Ð¿Ð¸ÑÑŒÐ¼Ñ–. Ð¯ÐºÑ‰Ð¾ Ð½Ñ– â€” Ð¿Ð¾Ð²ÐµÑ€Ð½Ñ–Ñ‚ÑŒÑÑ Ð´Ð¾ **Ð°Ð½Ð°Ð»Ñ–Ð·Ñƒ** Ñ‚Ð° Ð¾Ð¿Ñ€Ð°Ñ†ÑŽÐ¹Ñ‚Ðµ Ð¼Ð°Ñ‚ÐµÑ€Ñ–Ð°Ð» Ñ‰Ðµ Ñ€Ð°Ð·. **ÐŸÐ¾Ð²Ñ‚Ð¾Ñ€ÐµÐ½Ð½Ñ** â€” Ð¼Ð°Ñ‚Ð¸ **Ð¾Ð¿Ð°Ð½ÑƒÐ²Ð°Ð½Ð½Ñ**!\n\n---\n\n# Summary\n\nÐ£ Ñ†ÑŒÐ¾Ð¼Ñƒ Ð¼Ð¾Ð´ÑƒÐ»Ñ– Ð¼Ð¸ Ð·Ð´Ñ–Ð¹ÑÐ½Ð¸Ð»Ð¸ **Ð¿Ð¾Ð²Ñ‚Ð¾Ñ€ÐµÐ½Ð½Ñ** Ñ‚Ð° **ÑÐ¸ÑÑ‚ÐµÐ¼Ð°Ñ‚Ð¸Ð·Ð°Ñ†Ñ–ÑŽ** ÐºÐ»ÑŽÑ‡Ð¾Ð²Ð¸Ñ… Ð½Ð°Ð²Ð¸Ñ‡Ð¾Ðº Ñ€Ñ–Ð²Ð½Ñ B2, Ð³Ð¾Ñ‚ÑƒÑŽÑ‡Ð¸ Ð²Ð°Ñ Ð´Ð¾ **Ð¿ÐµÑ€ÐµÑ…Ð¾Ð´Ñƒ** Ð½Ð° **Ð¿Ñ€Ð¾ÑÑƒÐ½ÑƒÑ‚Ð¸Ð¹** Ñ€Ñ–Ð²ÐµÐ½ÑŒ C1.\n\n**Ð“Ñ€Ð°Ð¼Ð°Ñ‚Ð¸ÐºÐ°:**\n1. Ð§Ð¾Ñ‚Ð¸Ñ€Ð¸ Ñ„Ð¾Ñ€Ð¼Ð¸ Ð¿Ð°ÑÐ¸Ð²Ð½Ð¾Ð³Ð¾ ÑÑ‚Ð°Ð½Ñƒ: Ð´Ñ–Ñ”Ð¿Ñ€Ð¸ÐºÐ¼ÐµÑ‚Ð½Ð¸ÐºÐ¾Ð²Ð¸Ð¹ (-Ð½Ð¸Ð¹/-Ñ‚Ð¸Ð¹), Ð±ÐµÐ·Ð¾ÑÐ¾Ð±Ð¾Ð²Ð¸Ð¹ (-Ð½Ð¾/-Ñ‚Ð¾), Ð·Ð²Ð¾Ñ€Ð¾Ñ‚Ð½Ð¸Ð¹ (-ÑÑ), Ð°Ñ€Ñ…Ð°Ñ—Ñ‡Ð½Ð¸Ð¹ (Ð´Ñ–Ñ”Ð¿Ñ€Ð¸ÑÐ»Ñ–Ð²Ð½Ð¸ÐºÐ¾Ð²Ð¸Ð¹).\n2. Ð¤Ð¾Ñ€Ð¼Ð° Ð½Ð° -Ð½Ð¾/-Ñ‚Ð¾ â€” Ð½Ð°Ð¹Ñ„Ð¾Ñ€Ð¼Ð°Ð»ÑŒÐ½Ñ–ÑˆÐ°, Ð¾Ð±Ð¾Ð²'ÑÐ·ÐºÐ¾Ð²Ð° Ð² **Ð¾Ñ„Ñ–Ñ†Ñ–Ð¹Ð½Ð¾-Ð´Ñ–Ð»Ð¾Ð²Ð¾Ð¼Ñƒ** Ñ‚Ð° **Ð½Ð°ÑƒÐºÐ¾Ð²Ð¾Ð¼Ñƒ** ÑÑ‚Ð¸Ð»ÑÑ….\n3. **ÐšÐ¾Ð½ÑÐ¾Ð»Ñ–Ð´Ð°Ñ†Ñ–Ñ** Ð·Ð½Ð°Ð½ÑŒ Ð¿Ñ€Ð¾ Ñ€ÐµÐ³Ñ–ÑÑ‚Ñ€Ð¾Ð²Ñƒ Ð´Ð¾Ñ€ÐµÑ‡Ð½Ñ–ÑÑ‚ÑŒ Ð¿Ð°ÑÐ¸Ð²Ð½Ð¸Ñ… ÐºÐ¾Ð½ÑÑ‚Ñ€ÑƒÐºÑ†Ñ–Ð¹.\n\n**Ð¡Ñ‚Ð¸Ð»Ñ–ÑÑ‚Ð¸ÐºÐ°:**\n4. ÐŸ'ÑÑ‚ÑŒ Ñ„ÑƒÐ½ÐºÑ†Ñ–Ð¾Ð½Ð°Ð»ÑŒÐ½Ð¸Ñ… ÑÑ‚Ð¸Ð»Ñ–Ð² ÑƒÐºÑ€Ð°Ñ—Ð½ÑÑŒÐºÐ¾Ñ— Ð¼Ð¾Ð²Ð¸ Ñ‚Ð° Ñ—Ñ…Ð½Ñ– Ð¾ÑÐ¾Ð±Ð»Ð¸Ð²Ð¾ÑÑ‚Ñ–.\n5. **Ð†Ð½Ñ‚ÐµÐ³Ñ€Ð°Ñ†Ñ–Ñ** Ð¿Ð°ÑÐ¸Ð²Ð½Ð¾Ð³Ð¾ ÑÑ‚Ð°Ð½Ñƒ Ð² Ñ€Ñ–Ð·Ð½Ñ– Ñ€ÐµÐ³Ñ–ÑÑ‚Ñ€Ð¸ Ð·Ð°Ð»ÐµÐ¶Ð½Ð¾ Ð²Ñ–Ð´ ÐºÐ¾Ð¼ÑƒÐ½Ñ–ÐºÐ°Ñ‚Ð¸Ð²Ð½Ð¾Ñ— Ð¼ÐµÑ‚Ð¸.\n6. **Ð¡Ð¸Ð½Ñ‚ÐµÐ·** Ñ„Ð¾Ñ€Ð¼Ð°Ð»ÑŒÐ½Ð¸Ñ… Ñ‚Ð° Ð½ÐµÑ„Ð¾Ñ€Ð¼Ð°Ð»ÑŒÐ½Ð¸Ñ… ÐµÐ»ÐµÐ¼ÐµÐ½Ñ‚Ñ–Ð² Ñƒ Ð¿ÑƒÐ±Ð»Ñ–Ñ†Ð¸ÑÑ‚Ð¸Ñ†Ñ–.\n\n**ÐŸÑ€Ð°ÐºÑ‚Ð¸Ñ‡Ð½Ñ– Ð½Ð°Ð²Ð¸Ñ‡ÐºÐ¸:**\n7. **Ð—Ð°ÑÑ‚Ð¾ÑÑƒÐ²Ð°Ð½Ð½Ñ** Ñ‚Ñ€Ð°Ð½ÑÑ„Ð¾Ñ€Ð¼Ð°Ñ†Ñ–Ð¹Ð½Ð¸Ñ… Ð½Ð°Ð²Ð¸Ñ‡Ð¾Ðº: Ð°ÐºÑ‚Ð¸Ð²Ð½Ð¸Ð¹ â†’ Ð¿Ð°ÑÐ¸Ð²Ð½Ð¸Ð¹ ÑÑ‚Ð°Ð½.\n8. **ÐžÑ†Ñ–Ð½ÑŽÐ²Ð°Ð½Ð½Ñ** Ñ€ÐµÐ³Ñ–ÑÑ‚Ñ€Ð¾Ð²Ð¾Ñ— Ð´Ð¾Ñ€ÐµÑ‡Ð½Ð¾ÑÑ‚Ñ– Ð¼Ð¾Ð²Ð½Ð¸Ñ… Ð·Ð°ÑÐ¾Ð±Ñ–Ð².\n9. **ÐÐ½Ð°Ð»Ñ–Ð·** Ñ€ÐµÐ³Ñ–ÑÑ‚Ñ€Ð¾Ð²Ð¸Ñ… Ð½ÐµÐ²Ñ–Ð´Ð¿Ð¾Ð²Ñ–Ð´Ð½Ð¾ÑÑ‚ÐµÐ¹ Ñƒ Ñ‚ÐµÐºÑÑ‚Ð°Ñ….\n\n> [!tip] ðŸŒŸ **ÐšÐ»ÑŽÑ‡ Ð´Ð¾ Ð¼Ð°Ð¹ÑÑ‚ÐµÑ€Ð½Ð¾ÑÑ‚Ñ–**\n>\n> **Ð”Ð¾ÑÐºÐ¾Ð½Ð°Ð»Ñ–ÑÑ‚ÑŒ** Ñ€Ñ–Ð²Ð½Ñ C1 â€” Ñ†Ðµ Ð½Ðµ Ð»Ð¸ÑˆÐµ Ð·Ð½Ð°Ð½Ð½Ñ Ð¿Ñ€Ð°Ð²Ð¸Ð», Ð° Ð¹ Ð¼Ð¾Ð²Ð½Ð° Ñ–Ð½Ñ‚ÑƒÑ—Ñ†Ñ–Ñ. **ÐŸÐ¾Ð³Ð»Ð¸Ð±Ð»ÐµÐ½Ð½Ñ** Ñ†Ñ–Ñ”Ñ— Ñ–Ð½Ñ‚ÑƒÑ—Ñ†Ñ–Ñ— Ð²Ñ–Ð´Ð±ÑƒÐ²Ð°Ñ”Ñ‚ÑŒÑÑ Ñ‡ÐµÑ€ÐµÐ· Ð¿Ð¾ÑÑ‚Ñ–Ð¹Ð½Ñƒ Ð¿Ñ€Ð°ÐºÑ‚Ð¸ÐºÑƒ: Ñ‡Ð¸Ñ‚Ð°Ð¹Ñ‚Ðµ **Ð°ÐºÐ°Ð´ÐµÐ¼Ñ–Ñ‡Ð½Ñ–** Ñ‚ÐµÐºÑÑ‚Ð¸, ÑÐ»ÑƒÑ…Ð°Ð¹Ñ‚Ðµ Ð½Ð°ÑƒÐºÐ¾Ð²Ñ– Ð´Ð¾Ð¿Ð¾Ð²Ñ–Ð´Ñ–, Ð°Ð½Ð°Ð»Ñ–Ð·ÑƒÐ¹Ñ‚Ðµ **Ñ„Ð°Ñ…Ð¾Ð²Ñƒ** Ð»Ñ–Ñ‚ÐµÑ€Ð°Ñ‚ÑƒÑ€Ñƒ. **ÐžÐ¿Ð°Ð½ÑƒÐ²Ð°Ð½Ð½Ñ** Ð½Ð¾Ð²Ð¾Ð³Ð¾ Ñ€Ñ–Ð²Ð½Ñ â€” Ñ†Ðµ **Ð²Ð´Ð¾ÑÐºÐ¾Ð½Ð°Ð»ÐµÐ½Ð½Ñ**, Ñ‰Ð¾ Ð½Ñ–ÐºÐ¾Ð»Ð¸ Ð½Ðµ Ð·Ð°ÐºÑ–Ð½Ñ‡ÑƒÑ”Ñ‚ÑŒÑÑ.\n\n---\n\n# Activities\n\n## quiz: Ð¤Ð¾Ñ€Ð¼Ð¸ Ð¿Ð°ÑÐ¸Ð²Ð½Ð¾Ð³Ð¾ ÑÑ‚Ð°Ð½Ñƒ\n\n> Ð’Ð¸Ð±ÐµÑ€Ñ–Ñ‚ÑŒ Ð¿Ñ€Ð°Ð²Ð¸Ð»ÑŒÐ½Ñƒ Ð²Ñ–Ð´Ð¿Ð¾Ð²Ñ–Ð´ÑŒ.\n\n1. Ð¯ÐºÐ° Ñ„Ð¾Ñ€Ð¼Ð° Ð¿Ð°ÑÐ¸Ð²Ð½Ð¾Ð³Ð¾ ÑÑ‚Ð°Ð½Ñƒ Ñ” Ð½Ð°Ð¹Ñ„Ð¾Ñ€Ð¼Ð°Ð»ÑŒÐ½Ñ–ÑˆÐ¾ÑŽ Ð² ÑƒÐºÑ€Ð°Ñ—Ð½ÑÑŒÐºÑ–Ð¹ Ð¼Ð¾Ð²Ñ–?\n   - [ ] Ð”Ñ–Ñ”Ð¿Ñ€Ð¸ÐºÐ¼ÐµÑ‚Ð½Ð¸ÐºÐ¾Ð²Ð¸Ð¹ Ð¿Ð°ÑÐ¸Ð² (-Ð½Ð¸Ð¹/-Ñ‚Ð¸Ð¹)\n   - [x] Ð‘ÐµÐ·Ð¾ÑÐ¾Ð±Ð¾Ð²Ð¸Ð¹ Ð¿Ð°ÑÐ¸Ð² (-Ð½Ð¾/-Ñ‚Ð¾)\n   - [ ] Ð—Ð²Ð¾Ñ€Ð¾Ñ‚Ð½Ð¸Ð¹ Ð¿Ð°ÑÐ¸Ð² (-ÑÑ)\n   - [ ] ÐÐºÑ‚Ð¸Ð²Ð½Ð¸Ð¹ ÑÑ‚Ð°Ð½ Ð· Ð½ÐµÐ²Ð¸Ð·Ð½Ð°Ñ‡ÐµÐ½Ð¸Ð¼ ÑÑƒÐ±'Ñ”ÐºÑ‚Ð¾Ð¼\n   > Ð¤Ð¾Ñ€Ð¼Ð° Ð½Ð° -Ð½Ð¾/-Ñ‚Ð¾ Ð¾Ð±Ð¾Ð²'ÑÐ·ÐºÐ¾Ð²Ð° Ð² Ð¾Ñ„Ñ–Ñ†Ñ–Ð¹Ð½Ð¸Ñ… Ð´Ð¾ÐºÑƒÐ¼ÐµÐ½Ñ‚Ð°Ñ… Ñ‚Ð° Ð½Ð°ÑƒÐºÐ¾Ð²Ð¸Ñ… Ñ‚ÐµÐºÑÑ‚Ð°Ñ….\n\n2. Ð£ ÑÐºÐ¾Ð¼Ñƒ Ñ€ÐµÑ‡ÐµÐ½Ð½Ñ– Ð²Ð¸ÐºÐ¾Ñ€Ð¸ÑÑ‚Ð°Ð½Ð¾ Ð·Ð²Ð¾Ñ€Ð¾Ñ‚Ð½Ð¸Ð¹ Ð¿Ð°ÑÐ¸Ð²?\n   - [ ] Ð”Ð¾ÐºÑƒÐ¼ÐµÐ½Ñ‚ Ð±ÑƒÐ»Ð¾ Ð¿Ñ–Ð´Ð¿Ð¸ÑÐ°Ð½Ð¾ Ð´Ð¸Ñ€ÐµÐºÑ‚Ð¾Ñ€Ð¾Ð¼.\n   - [ ] Ð¡Ñ‚Ð°Ñ‚Ñ‚Ñ Ð±ÑƒÐ»Ð° Ð¾Ð¿ÑƒÐ±Ð»Ñ–ÐºÐ¾Ð²Ð°Ð½Ð° Ð²Ñ‡Ð¾Ñ€Ð°.\n   - [x] ÐŸÑ€Ð¾Ð±Ð»ÐµÐ¼Ð° Ñ€Ð¾Ð·Ð²'ÑÐ·ÑƒÑ”Ñ‚ÑŒÑÑ Ð½Ð°ÑˆÐ¾ÑŽ ÐºÐ¾Ð¼Ð°Ð½Ð´Ð¾ÑŽ.\n   - [ ] Ð ÐµÐ·ÑƒÐ»ÑŒÑ‚Ð°Ñ‚Ð¸ Ð¾Ð³Ð¾Ð»Ð¾ÑˆÐµÐ½Ð¾ Ð½Ð° ÐºÐ¾Ð½Ñ„ÐµÑ€ÐµÐ½Ñ†Ñ–Ñ—.\n   > Ð—Ð²Ð¾Ñ€Ð¾Ñ‚Ð½Ð¸Ð¹ Ð¿Ð°ÑÐ¸Ð² ÑƒÑ‚Ð²Ð¾Ñ€ÑŽÑ”Ñ‚ÑŒÑÑ Ð·Ð° Ð´Ð¾Ð¿Ð¾Ð¼Ð¾Ð³Ð¾ÑŽ Ð¿Ð¾ÑÑ‚Ñ„Ñ–ÐºÑÐ° -ÑÑ.\n\n3. Ð¯ÐºÐ¸Ð¹ ÑÑ‚Ð¸Ð»ÑŒ Ð½Ð°Ð¹Ñ‡Ð°ÑÑ‚Ñ–ÑˆÐµ Ð²Ð¸ÐºÐ¾Ñ€Ð¸ÑÑ‚Ð¾Ð²ÑƒÑ” Ð¿Ð°ÑÐ¸Ð²Ð½Ð¸Ð¹ ÑÑ‚Ð°Ð½?\n   - [ ] Ð Ð¾Ð·Ð¼Ð¾Ð²Ð½Ð¸Ð¹\n   - [ ] Ð¥ÑƒÐ´Ð¾Ð¶Ð½Ñ–Ð¹\n   - [x] ÐÐ°ÑƒÐºÐ¾Ð²Ð¸Ð¹\n   - [ ] Ð•Ð¿Ñ–ÑÑ‚Ð¾Ð»ÑÑ€Ð½Ð¸Ð¹\n   > ÐÐ°ÑƒÐºÐ¾Ð²Ð¸Ð¹ ÑÑ‚Ð¸Ð»ÑŒ Ð²Ð¸Ð¼Ð°Ð³Ð°Ñ” Ð¾Ð±'Ñ”ÐºÑ‚Ð¸Ð²Ð½Ð¾ÑÑ‚Ñ–, ÑÐºÑƒ Ð·Ð°Ð±ÐµÐ·Ð¿ÐµÑ‡ÑƒÑ” Ð¿Ð°ÑÐ¸Ð².\n\n4. Ð¯ÐºÐµ Ñ€ÐµÑ‡ÐµÐ½Ð½Ñ ÐÐ• Ñ” Ð¿Ñ€Ð¸ÐºÐ»Ð°Ð´Ð¾Ð¼ Ð¿Ð°ÑÐ¸Ð²Ð½Ð¾Ð³Ð¾ ÑÑ‚Ð°Ð½Ñƒ?\n   - [ ] Ð—Ð°ÐºÐ¾Ð½ ÑƒÑ…Ð²Ð°Ð»ÐµÐ½Ð¾ Ð¿Ð°Ñ€Ð»Ð°Ð¼ÐµÐ½Ñ‚Ð¾Ð¼.\n   - [x] ÐÐ°ÑƒÐºÐ¾Ð²Ñ†Ñ– Ð¿Ñ€Ð¾Ð²ÐµÐ»Ð¸ Ð´Ð¾ÑÐ»Ñ–Ð´Ð¶ÐµÐ½Ð½Ñ.\n   - [ ] Ð ÐµÐ·ÑƒÐ»ÑŒÑ‚Ð°Ñ‚Ð¸ Ð¾Ð¿Ñ€Ð¸Ð»ÑŽÐ´Ð½ÑŽÑŽÑ‚ÑŒÑÑ Ñ‰Ð¾Ð¼Ñ–ÑÑÑ†Ñ.\n   - [ ] Ð—Ð²Ñ–Ñ‚ Ð±ÑƒÐ² Ð¿Ð¾Ð´Ð°Ð½Ð¸Ð¹ Ð²Ñ‡Ð°ÑÐ½Ð¾.\n   > Ð¦Ðµ Ð°ÐºÑ‚Ð¸Ð²Ð½Ð¸Ð¹ ÑÑ‚Ð°Ð½: Ð¿Ñ–Ð´Ð¼ÐµÑ‚ (Ð½Ð°ÑƒÐºÐ¾Ð²Ñ†Ñ–) Ð²Ð¸ÐºÐ¾Ð½ÑƒÑ” Ð´Ñ–ÑŽ.\n\n5. ÐšÐ¾Ð»Ð¸ Ð²Ð¸ÐºÐ¾Ñ€Ð¸ÑÑ‚Ð¾Ð²ÑƒÑ”Ñ‚ÑŒÑÑ Ñ„Ð¾Ñ€Ð¼Ð° Â«Ð±ÑƒÐ»Ð¾Â» Ð· -Ð½Ð¾/-Ñ‚Ð¾?\n   - [ ] Ð”Ð»Ñ Ð¿Ñ–Ð´ÑÐ¸Ð»ÐµÐ½Ð½Ñ Ð¾Ñ„Ñ–Ñ†Ñ–Ð¹Ð½Ð¾ÑÑ‚Ñ–\n   - [ ] Ð”Ð»Ñ Ð²Ð¸Ñ€Ð°Ð¶ÐµÐ½Ð½Ñ Ñ‚ÐµÐ¿ÐµÑ€Ñ–ÑˆÐ½ÑŒÐ¾Ð³Ð¾ Ñ‡Ð°ÑÑƒ\n   - [x] Ð”Ð»Ñ Ð²Ð¸Ñ€Ð°Ð¶ÐµÐ½Ð½Ñ Ð¼Ð¸Ð½ÑƒÐ»Ð¾Ð³Ð¾ Ñ‡Ð°ÑÑƒ\n   - [ ] ÐÑ–ÐºÐ¾Ð»Ð¸ â€” Ñ†Ðµ Ð¿Ð¾Ð¼Ð¸Ð»ÐºÐ°\n   > Â«Ð‘ÑƒÐ»Ð¾ Ð½Ð°Ð¿Ð¸ÑÐ°Ð½Ð¾Â» = Ð¼Ð¸Ð½ÑƒÐ»Ð¸Ð¹ Ñ‡Ð°Ñ, Â«Ð½Ð°Ð¿Ð¸ÑÐ°Ð½Ð¾Â» = Ñ‚ÐµÐ¿ÐµÑ€Ñ–ÑˆÐ½Ñ–Ð¹/Ð·Ð°Ð³Ð°Ð»ÑŒÐ½Ð¸Ð¹.\n\n6. Ð¯ÐºÐ° Ñ„Ð¾Ñ€Ð¼Ð° Ð¿Ð°ÑÐ¸Ð²Ñƒ Ð¿Ñ–Ð´ÐºÑ€ÐµÑÐ»ÑŽÑ” Ð¿Ñ€Ð¾Ñ†ÐµÑ, Ð° Ð½Ðµ Ñ€ÐµÐ·ÑƒÐ»ÑŒÑ‚Ð°Ñ‚?\n   - [ ] Ð‘ÐµÐ·Ð¾ÑÐ¾Ð±Ð¾Ð²Ð¸Ð¹ Ð¿Ð°ÑÐ¸Ð² (-Ð½Ð¾/-Ñ‚Ð¾)\n   - [ ] Ð”Ñ–Ñ”Ð¿Ñ€Ð¸ÐºÐ¼ÐµÑ‚Ð½Ð¸ÐºÐ¾Ð²Ð¸Ð¹ Ð¿Ð°ÑÐ¸Ð² (-Ð½Ð¸Ð¹/-Ñ‚Ð¸Ð¹)\n   - [x] Ð—Ð²Ð¾Ñ€Ð¾Ñ‚Ð½Ð¸Ð¹ Ð¿Ð°ÑÐ¸Ð² (-ÑÑ)\n   - [ ] Ð£ÑÑ– Ñ„Ð¾Ñ€Ð¼Ð¸ Ð¾Ð´Ð½Ð°ÐºÐ¾Ð²Ð¾\n   > Â«Ð‘ÑƒÐ´Ð¸Ð½Ð¾Ðº Ð±ÑƒÐ´ÑƒÑ”Ñ‚ÑŒÑÑÂ» â€” Ð¿Ñ€Ð¾Ñ†ÐµÑ Ñ‚Ñ€Ð¸Ð²Ð°Ñ”; Â«Ð±ÑƒÐ´Ð¸Ð½Ð¾Ðº Ð·Ð±ÑƒÐ´Ð¾Ð²Ð°Ð½Ð¾Â» â€” Ñ€ÐµÐ·ÑƒÐ»ÑŒÑ‚Ð°Ñ‚.\n\n7. Ð¯ÐºÐµ ÑÐ»Ð¾Ð²Ð¾ Ñ” Ð¼Ð°Ñ€ÐºÐµÑ€Ð¾Ð¼ Ð¾Ñ„Ñ–Ñ†Ñ–Ð¹Ð½Ð¾-Ð´Ñ–Ð»Ð¾Ð²Ð¾Ð³Ð¾ ÑÑ‚Ð¸Ð»ÑŽ?\n   - [ ] ÐšÐ»Ð°ÑÐ½Ð¸Ð¹\n   - [x] ÐžÐ¿Ñ€Ð¸Ð»ÑŽÐ´Ð½ÐµÐ½Ð¾\n   - [ ] Ð ÐµÐ°Ð»ÑŒÐ½Ð¾\n   - [ ] ÐŸÑ€Ð¸ÐºÐ¾Ð»ÑŒÐ½Ð¸Ð¹\n   > Â«ÐžÐ¿Ñ€Ð¸Ð»ÑŽÐ´Ð½ÐµÐ½Ð¾Â» â€” Ñ‚Ð¸Ð¿Ð¾Ð²Ð° Ð¾Ñ„Ñ–Ñ†Ñ–Ð¹Ð½Ð° ÐºÐ¾Ð½ÑÑ‚Ñ€ÑƒÐºÑ†Ñ–Ñ.\n\n8. Ð©Ð¾ Ð¾Ð·Ð½Ð°Ñ‡Ð°Ñ” Â«Ñ€ÐµÐ³Ñ–ÑÑ‚Ñ€Ð¾Ð²Ð° Ð½ÐµÐ²Ñ–Ð´Ð¿Ð¾Ð²Ñ–Ð´Ð½Ñ–ÑÑ‚ÑŒÂ»?\n   - [ ] Ð“Ñ€Ð°Ð¼Ð°Ñ‚Ð¸Ñ‡Ð½Ð° Ð¿Ð¾Ð¼Ð¸Ð»ÐºÐ°\n   - [x] Ð—Ð¼Ñ–ÑˆÑƒÐ²Ð°Ð½Ð½Ñ ÑÑ‚Ð¸Ð»Ñ–Ð² Ð² Ð¾Ð´Ð½Ð¾Ð¼Ñƒ Ñ‚ÐµÐºÑÑ‚Ñ–\n   - [ ] ÐžÑ€Ñ„Ð¾Ð³Ñ€Ð°Ñ„Ñ–Ñ‡Ð½Ð° Ð¿Ð¾Ð¼Ð¸Ð»ÐºÐ°\n   - [ ] ÐÐµÐ¿Ñ€Ð°Ð²Ð¸Ð»ÑŒÐ½Ð¸Ð¹ Ð¿Ð¾Ñ€ÑÐ´Ð¾Ðº ÑÐ»Ñ–Ð²\n   > ÐÐ°Ð¿Ñ€Ð¸ÐºÐ»Ð°Ð´, Ñ€Ð¾Ð·Ð¼Ð¾Ð²Ð½Ðµ ÑÐ»Ð¾Ð²Ð¾ Ð² Ð½Ð°ÑƒÐºÐ¾Ð²Ð¾Ð¼Ñƒ Ñ‚ÐµÐºÑÑ‚Ñ–.\n\n9. Ð£ ÑÐºÐ¾Ð¼Ñƒ ÑÑ‚Ð¸Ð»Ñ– Ð¿Ð°ÑÐ¸Ð²Ð½Ð¸Ð¹ ÑÑ‚Ð°Ð½ Ð²Ð¶Ð¸Ð²Ð°Ñ”Ñ‚ÑŒÑÑ Ð½Ð°Ð¹Ñ€Ñ–Ð´ÑˆÐµ?\n   - [ ] ÐÐ°ÑƒÐºÐ¾Ð²Ð¾Ð¼Ñƒ\n   - [ ] ÐžÑ„Ñ–Ñ†Ñ–Ð¹Ð½Ð¾-Ð´Ñ–Ð»Ð¾Ð²Ð¾Ð¼Ñƒ\n   - [ ] ÐŸÑƒÐ±Ð»Ñ–Ñ†Ð¸ÑÑ‚Ð¸Ñ‡Ð½Ð¾Ð¼Ñƒ\n   - [x] Ð Ð¾Ð·Ð¼Ð¾Ð²Ð½Ð¾Ð¼Ñƒ\n   > Ð£ Ñ€Ð¾Ð·Ð¼Ð¾Ð²Ð½Ñ–Ð¹ Ð¼Ð¾Ð²Ñ– Ð¿ÐµÑ€ÐµÐ²Ð°Ð¶Ð°Ñ” Ð°ÐºÑ‚Ð¸Ð²Ð½Ð¸Ð¹ ÑÑ‚Ð°Ð½.\n\n10. Ð¯ÐºÐ° Ñ…Ð°Ñ€Ð°ÐºÑ‚ÐµÑ€Ð¸ÑÑ‚Ð¸ÐºÐ° ÐÐ• Ñ” Ð¾Ð·Ð½Ð°ÐºÐ¾ÑŽ Ð½Ð°ÑƒÐºÐ¾Ð²Ð¾Ð³Ð¾ ÑÑ‚Ð¸Ð»ÑŽ?\n    - [ ] ÐžÐ±'Ñ”ÐºÑ‚Ð¸Ð²Ð½Ñ–ÑÑ‚ÑŒ\n    - [ ] Ð¢ÐµÑ€Ð¼Ñ–Ð½Ð¾Ð»Ð¾Ð³Ñ–Ñ‡Ð½Ñ–ÑÑ‚ÑŒ\n    - [x] Ð•Ð¼Ð¾Ñ†Ñ–Ð¹Ð½Ñ–ÑÑ‚ÑŒ\n    - [ ] Ð¢Ð¾Ñ‡Ð½Ñ–ÑÑ‚ÑŒ\n    > Ð•Ð¼Ð¾Ñ†Ñ–Ð¹Ð½Ñ–ÑÑ‚ÑŒ Ñ…Ð°Ñ€Ð°ÐºÑ‚ÐµÑ€Ð½Ð° Ð´Ð»Ñ Ñ€Ð¾Ð·Ð¼Ð¾Ð²Ð½Ð¾Ð³Ð¾ Ñ‚Ð° Ñ…ÑƒÐ´Ð¾Ð¶Ð½ÑŒÐ¾Ð³Ð¾ ÑÑ‚Ð¸Ð»Ñ–Ð².\n\n11. Ð©Ð¾ Ð¾Ð·Ð½Ð°Ñ‡Ð°Ñ” Â«ÐºÐ¾Ð½ÑÐ¾Ð»Ñ–Ð´Ð°Ñ†Ñ–Ñ Ð·Ð½Ð°Ð½ÑŒÂ»?\n    - [ ] Ð—Ð°Ð±ÑƒÐ²Ð°Ð½Ð½Ñ Ñ–Ð½Ñ„Ð¾Ñ€Ð¼Ð°Ñ†Ñ–Ñ—\n    - [x] ÐžÐ±'Ñ”Ð´Ð½Ð°Ð½Ð½Ñ Ñ‚Ð° Ð·Ð°ÐºÑ€Ñ–Ð¿Ð»ÐµÐ½Ð½Ñ Ð·Ð½Ð°Ð½ÑŒ\n    - [ ] ÐžÑ‚Ñ€Ð¸Ð¼Ð°Ð½Ð½Ñ Ð½Ð¾Ð²Ð¸Ñ… Ð·Ð½Ð°Ð½ÑŒ\n    - [ ] ÐŸÐµÑ€ÐµÐ²Ñ–Ñ€ÐºÐ° Ð·Ð½Ð°Ð½ÑŒ\n    > ÐšÐ¾Ð½ÑÐ¾Ð»Ñ–Ð´Ð°Ñ†Ñ–Ñ â€” Ñ†Ðµ ÑÐ¸ÑÑ‚ÐµÐ¼Ð°Ñ‚Ð¸Ð·Ð°Ñ†Ñ–Ñ Ñ‚Ð° Ð·Ð°ÐºÑ€Ñ–Ð¿Ð»ÐµÐ½Ð½Ñ.\n\n12. Ð¯ÐºÐµ Ð´Ñ–Ñ”ÑÐ»Ð¾Ð²Ð¾ Ð½Ð°Ð¹ÐºÑ€Ð°Ñ‰Ðµ Ð¿Ñ–Ð´Ñ…Ð¾Ð´Ð¸Ñ‚ÑŒ Ð´Ð»Ñ Ð¾Ð¿Ð¸ÑÑƒ Ð¼ÐµÑ‚Ð¾Ð´Ð¾Ð»Ð¾Ð³Ñ–Ñ— Ð² Ð½Ð°ÑƒÐºÐ¾Ð²Ñ–Ð¹ ÑÑ‚Ð°Ñ‚Ñ‚Ñ–?\n    - [ ] Ð—Ñ€Ð¾Ð±Ð¸Ð»Ð¸\n    - [x] Ð—Ð°ÑÑ‚Ð¾ÑÐ¾Ð²Ð°Ð½Ð¾\n    - [ ] Ð’Ð¸ÐºÐ¾Ñ€Ð¸ÑÑ‚Ð°Ð»Ð¸\n    - [ ] Ð Ð¾Ð±Ð¸Ð»Ð¸\n    > Â«Ð—Ð°ÑÑ‚Ð¾ÑÐ¾Ð²Ð°Ð½Ð¾Â» â€” Ñ„Ð¾Ñ€Ð¼Ð°Ð»ÑŒÐ½Ð° Ð¿Ð°ÑÐ¸Ð²Ð½Ð° ÐºÐ¾Ð½ÑÑ‚Ñ€ÑƒÐºÑ†Ñ–Ñ.\n\n13. Ð©Ð¾ Ð¾Ð·Ð½Ð°Ñ‡Ð°Ñ” Ñ‚ÐµÑ€Ð¼Ñ–Ð½ Â«Ð¿Ð¾Ð³Ð»Ð¸Ð±Ð»ÐµÐ½Ð½ÑÂ» Ð² ÐºÐ¾Ð½Ñ‚ÐµÐºÑÑ‚Ñ– Ð½Ð°Ð²Ñ‡Ð°Ð½Ð½Ñ?\n    - [ ] ÐŸÐ¾Ð²ÐµÑ€Ñ…Ð½ÐµÐ²Ðµ Ð²Ð¸Ð²Ñ‡ÐµÐ½Ð½Ñ\n    - [ ] Ð—Ð°Ð±ÑƒÐ²Ð°Ð½Ð½Ñ Ð¼Ð°Ñ‚ÐµÑ€Ñ–Ð°Ð»Ñƒ\n    - [x] Ð‘Ñ–Ð»ÑŒÑˆ Ð´ÐµÑ‚Ð°Ð»ÑŒÐ½Ðµ Ð²Ð¸Ð²Ñ‡ÐµÐ½Ð½Ñ\n    - [ ] ÐŸÐ¾Ñ‡Ð°Ñ‚Ð¾Ðº Ð²Ð¸Ð²Ñ‡ÐµÐ½Ð½Ñ\n    > ÐŸÐ¾Ð³Ð»Ð¸Ð±Ð»ÐµÐ½Ð½Ñ â€” Ñ†Ðµ Ð¿ÐµÑ€ÐµÑ…Ñ–Ð´ Ð´Ð¾ Ð³Ð»Ð¸Ð±ÑˆÐ¾Ð³Ð¾ Ñ€Ð¾Ð·ÑƒÐ¼Ñ–Ð½Ð½Ñ.\n\n14. Ð¯ÐºÐ° Ñ„Ð¾Ñ€Ð¼Ð° Ð¿Ñ€Ð°Ð²Ð¸Ð»ÑŒÐ½Ð° Ð´Ð»Ñ Ð¾Ñ„Ñ–Ñ†Ñ–Ð¹Ð½Ð¾Ð³Ð¾ Ð´Ð¾ÐºÑƒÐ¼ÐµÐ½Ñ‚Ð°?\n    - [ ] Ð”Ð¸Ñ€ÐµÐºÑ‚Ð¾Ñ€ Ð¿Ñ–Ð´Ð¿Ð¸ÑÐ°Ð² Ð½Ð°ÐºÐ°Ð·.\n    - [ ] Ð”Ð¸Ñ€ÐµÐºÑ‚Ð¾Ñ€ Ð¿Ñ–Ð´Ð¿Ð¸ÑÑƒÐ²Ð°Ð² Ð½Ð°ÐºÐ°Ð·.\n    - [x] ÐÐ°ÐºÐ°Ð· Ð¿Ñ–Ð´Ð¿Ð¸ÑÐ°Ð½Ð¾ Ð´Ð¸Ñ€ÐµÐºÑ‚Ð¾Ñ€Ð¾Ð¼.\n    - [ ] ÐÐ°ÐºÐ°Ð· Ð¿Ñ–Ð´Ð¿Ð¸ÑÑƒÑ”Ñ‚ÑŒÑÑ Ð´Ð¸Ñ€ÐµÐºÑ‚Ð¾Ñ€Ð¾Ð¼.\n    > Ð¤Ð¾Ñ€Ð¼Ð° Ð½Ð° -Ð½Ð¾/-Ñ‚Ð¾ Ð¾Ð±Ð¾Ð²'ÑÐ·ÐºÐ¾Ð²Ð° Ð´Ð»Ñ Ð¾Ñ„Ñ–Ñ†Ñ–Ð¹Ð½Ð¸Ñ… Ð´Ð¾ÐºÑƒÐ¼ÐµÐ½Ñ‚Ñ–Ð².\n\n15. Ð©Ð¾ Ñ‚Ð°ÐºÐµ Â«ÑÐ¸ÑÑ‚ÐµÐ¼Ð°Ñ‚Ð¸Ð·Ð°Ñ†Ñ–ÑÂ»?\n    - [ ] Ð¥Ð°Ð¾Ñ‚Ð¸Ñ‡Ð½Ðµ Ð½Ð°ÐºÐ¾Ð¿Ð¸Ñ‡ÐµÐ½Ð½Ñ\n    - [x] ÐŸÑ€Ð¸Ð²ÐµÐ´ÐµÐ½Ð½Ñ Ð´Ð¾ ÑÐ¸ÑÑ‚ÐµÐ¼Ð¸, Ð²Ð¿Ð¾Ñ€ÑÐ´ÐºÑƒÐ²Ð°Ð½Ð½Ñ\n    - [ ] Ð’Ð¸Ð¿Ð°Ð´ÐºÐ¾Ð²Ð¸Ð¹ Ð²Ð¸Ð±Ñ–Ñ€\n    - [ ] Ð—Ð½Ð¸Ñ‰ÐµÐ½Ð½Ñ Ñ–Ð½Ñ„Ð¾Ñ€Ð¼Ð°Ñ†Ñ–Ñ—\n    > Ð¡Ð¸ÑÑ‚ÐµÐ¼Ð°Ñ‚Ð¸Ð·Ð°Ñ†Ñ–Ñ = Ð²Ð¿Ð¾Ñ€ÑÐ´ÐºÑƒÐ²Ð°Ð½Ð½Ñ Ð·Ð° Ð¿ÐµÐ²Ð½Ð¾ÑŽ ÑÐ¸ÑÑ‚ÐµÐ¼Ð¾ÑŽ.\n\n16. Ð¯ÐºÐµ Ñ€ÐµÑ‡ÐµÐ½Ð½Ñ Ñ” Ð¿Ñ€Ð¸ÐºÐ»Ð°Ð´Ð¾Ð¼ Ð¿ÑƒÐ±Ð»Ñ–Ñ†Ð¸ÑÑ‚Ð¸Ñ‡Ð½Ð¾Ð³Ð¾ ÑÑ‚Ð¸Ð»ÑŽ?\n    - [ ] ÐÐ°ÐºÐ°Ð· â„– 123 Ð²Ñ–Ð´ 01.01.2024.\n    - [ ] ÐœÐ°Ð¼Ð¾, Ñ Ð²Ð¶Ðµ Ð¿Ð¾Ñ—Ð².\n    - [x] Ð—Ð°ÐºÐ¾Ð½ Ð±ÑƒÐ»Ð¾ ÑƒÑ…Ð²Ð°Ð»ÐµÐ½Ð¾ Ð¿Ñ–ÑÐ»Ñ Ñ‚Ñ€Ð¸Ð²Ð°Ð»Ð¸Ñ… Ð´ÐµÐ±Ð°Ñ‚Ñ–Ð².\n    - [ ] Â«Ðž, Ð´ÑƒÐ¼Ð¸ Ð¼Ð¾Ñ—, Ð´ÑƒÐ¼Ð¸ Ð¼Ð¾Ñ—...Â»\n    > ÐŸÑƒÐ±Ð»Ñ–Ñ†Ð¸ÑÑ‚Ð¸ÐºÐ° Ð¿Ð¾Ñ”Ð´Ð½ÑƒÑ” Ñ–Ð½Ñ„Ð¾Ñ€Ð¼Ð°Ñ‚Ð¸Ð²Ð½Ñ–ÑÑ‚ÑŒ Ñ‚Ð° Ð´Ð¾ÑÑ‚ÑƒÐ¿Ð½Ñ–ÑÑ‚ÑŒ.\n\n17. Ð©Ð¾ Ð¾Ð·Ð½Ð°Ñ‡Ð°Ñ” Â«Ð¿ÐµÑ€ÐµÑ…Ñ–Ð´ Ð´Ð¾ C1Â»?\n    - [ ] ÐŸÐ¾Ð²ÐµÑ€Ð½ÐµÐ½Ð½Ñ Ð½Ð° Ð¿Ð¾Ñ‡Ð°Ñ‚ÐºÐ¾Ð²Ð¸Ð¹ Ñ€Ñ–Ð²ÐµÐ½ÑŒ\n    - [ ] Ð—Ð°Ð»Ð¸ÑˆÐµÐ½Ð½Ñ Ð½Ð° B2\n    - [x] ÐŸÑ€Ð¾ÑÑƒÐ²Ð°Ð½Ð½Ñ Ð´Ð¾ Ð¿Ñ€Ð¾ÑÑƒÐ½ÑƒÑ‚Ð¾Ð³Ð¾ Ñ€Ñ–Ð²Ð½Ñ\n    - [ ] ÐŸÑ€Ð¾Ð¿ÑƒÑÐº Ð½Ð°Ð²Ñ‡Ð°Ð»ÑŒÐ½Ð¾Ð³Ð¾ Ð¼Ð°Ñ‚ÐµÑ€Ñ–Ð°Ð»Ñƒ\n    > ÐŸÐµÑ€ÐµÑ…Ñ–Ð´ â€” Ñ†Ðµ Ð¿Ñ€Ð¾Ð³Ñ€ÐµÑ Ð´Ð¾ Ð²Ð¸Ñ‰Ð¾Ð³Ð¾ Ñ€Ñ–Ð²Ð½Ñ.\n\n18. Ð¯ÐºÐ° Ð¾Ð·Ð½Ð°ÐºÐ° ÐÐ• Ñ…Ð°Ñ€Ð°ÐºÑ‚ÐµÑ€Ð½Ð° Ð´Ð»Ñ Ð¾Ñ„Ñ–Ñ†Ñ–Ð¹Ð½Ð¾-Ð´Ñ–Ð»Ð¾Ð²Ð¾Ð³Ð¾ ÑÑ‚Ð¸Ð»ÑŽ?\n    - [ ] Ð¡Ñ‚Ð°Ð½Ð´Ð°Ñ€Ñ‚Ð¸Ð·Ð¾Ð²Ð°Ð½Ñ–ÑÑ‚ÑŒ\n    - [ ] Ð®Ñ€Ð¸Ð´Ð¸Ñ‡Ð½Ð° Ñ‚Ð¾Ñ‡Ð½Ñ–ÑÑ‚ÑŒ\n    - [x] Ð†Ð½Ð´Ð¸Ð²Ñ–Ð´ÑƒÐ°Ð»ÑŒÐ½Ñ–ÑÑ‚ÑŒ Ð°Ð²Ñ‚Ð¾Ñ€Ð°\n    - [ ] Ð¤Ð¾Ñ€Ð¼Ð°Ð»ÑŒÐ½Ñ–ÑÑ‚ÑŒ\n    > Ð†Ð½Ð´Ð¸Ð²Ñ–Ð´ÑƒÐ°Ð»ÑŒÐ½Ñ–ÑÑ‚ÑŒ Ñ…Ð°Ñ€Ð°ÐºÑ‚ÐµÑ€Ð½Ð° Ð´Ð»Ñ Ñ…ÑƒÐ´Ð¾Ð¶Ð½ÑŒÐ¾Ð³Ð¾ ÑÑ‚Ð¸Ð»ÑŽ.\n\n---\n\n## match-up: Ð¢ÐµÑ€Ð¼Ñ–Ð½Ð¸ Ñ‚Ð° Ð²Ð¸Ð·Ð½Ð°Ñ‡ÐµÐ½Ð½Ñ\n\n> ÐŸÐ¾Ñ”Ð´Ð½Ð°Ð¹Ñ‚Ðµ Ñ‚ÐµÑ€Ð¼Ñ–Ð½Ð¸ Ð· Ñ—Ñ…Ð½Ñ–Ð¼Ð¸ Ð²Ð¸Ð·Ð½Ð°Ñ‡ÐµÐ½Ð½ÑÐ¼Ð¸.\n\n| Left | Right |\n|------|-------|\n| Ð¿Ð¾Ð²Ñ‚Ð¾Ñ€ÐµÐ½Ð½Ñ | review, revision |\n| ÑƒÐ·Ð°Ð³Ð°Ð»ÑŒÐ½ÐµÐ½Ð½Ñ | generalization |\n| ÑÐ¸ÑÑ‚ÐµÐ¼Ð°Ñ‚Ð¸Ð·Ð°Ñ†Ñ–Ñ | bringing into a system |\n| ÐºÐ¾Ð½ÑÐ¾Ð»Ñ–Ð´Ð°Ñ†Ñ–Ñ | consolidation, unification |\n| Ð¿ÐµÑ€ÐµÑ…Ñ–Ð´ | transition |\n| Ð¿Ñ€Ð¾ÑÑƒÐ½ÑƒÑ‚Ð¸Ð¹ | advanced |\n| Ð°ÐºÐ°Ð´ÐµÐ¼Ñ–Ñ‡Ð½Ð¸Ð¹ | academic |\n| Ñ„Ð°Ñ…Ð¾Ð²Ð¸Ð¹ | professional, expert |\n| Ð´Ð¾ÑÐºÐ¾Ð½Ð°Ð»Ñ–ÑÑ‚ÑŒ | perfection |\n| Ð¼Ð°Ð¹ÑÑ‚ÐµÑ€Ð½Ñ–ÑÑ‚ÑŒ | mastery |\n| Ð¾Ð¿Ð°Ð½ÑƒÐ²Ð°Ð½Ð½Ñ | mastering, acquisition |\n| Ð²Ð´Ð¾ÑÐºÐ¾Ð½Ð°Ð»ÐµÐ½Ð½Ñ | improvement |\n| Ð¿Ð¾Ð³Ð»Ð¸Ð±Ð»ÐµÐ½Ð½Ñ | deepening |\n| Ñ€Ð¾Ð·ÑˆÐ¸Ñ€ÐµÐ½Ð½Ñ | expansion |\n| Ð·Ð°ÐºÑ€Ñ–Ð¿Ð»ÐµÐ½Ð½Ñ | reinforcement |\n| Ð·Ð°ÑÑ‚Ð¾ÑÑƒÐ²Ð°Ð½Ð½Ñ | application |\n| Ñ–Ð½Ñ‚ÐµÐ³Ñ€Ð°Ñ†Ñ–Ñ | integration |\n| ÑÐ¸Ð½Ñ‚ÐµÐ· | synthesis |\n\n---\n\n## group-sort: Ð¤Ð¾Ñ€Ð¼Ð¸ Ð¿Ð°ÑÐ¸Ð²Ð½Ð¾Ð³Ð¾ ÑÑ‚Ð°Ð½Ñƒ\n\n> Ð Ð¾Ð·Ð¿Ð¾Ð´Ñ–Ð»Ñ–Ñ‚ÑŒ Ð¿Ñ€Ð¸ÐºÐ»Ð°Ð´Ð¸ Ð·Ð° Ñ„Ð¾Ñ€Ð¼Ð°Ð¼Ð¸ Ð¿Ð°ÑÐ¸Ð²Ð½Ð¾Ð³Ð¾ ÑÑ‚Ð°Ð½Ñƒ.\n\n### Ð‘ÐµÐ·Ð¾ÑÐ¾Ð±Ð¾Ð²Ð¸Ð¹ Ð¿Ð°ÑÐ¸Ð² (-Ð½Ð¾/-Ñ‚Ð¾)\n- Ð¡Ñ‚Ð°Ñ‚Ñ‚ÑŽ Ð½Ð°Ð¿Ð¸ÑÐ°Ð½Ð¾\n- Ð—Ð°ÐºÐ¾Ð½ ÑƒÑ…Ð²Ð°Ð»ÐµÐ½Ð¾\n- Ð ÐµÐ·ÑƒÐ»ÑŒÑ‚Ð°Ñ‚Ð¸ Ð¾Ð¿Ñ€Ð¸Ð»ÑŽÐ´Ð½ÐµÐ½Ð¾\n- Ð”Ð¾Ð³Ð¾Ð²Ñ–Ñ€ Ð¿Ñ–Ð´Ð¿Ð¸ÑÐ°Ð½Ð¾\n- Ð”Ð¾ÑÐ»Ñ–Ð´Ð¶ÐµÐ½Ð½Ñ Ð¿Ñ€Ð¾Ð²ÐµÐ´ÐµÐ½Ð¾\n- Ð Ñ–ÑˆÐµÐ½Ð½Ñ Ð¿Ñ€Ð¸Ð¹Ð½ÑÑ‚Ð¾\n\n### Ð”Ñ–Ñ”Ð¿Ñ€Ð¸ÐºÐ¼ÐµÑ‚Ð½Ð¸ÐºÐ¾Ð²Ð¸Ð¹ Ð¿Ð°ÑÐ¸Ð² (-Ð½Ð¸Ð¹/-Ñ‚Ð¸Ð¹)\n- Ð”Ð¾ÐºÑƒÐ¼ÐµÐ½Ñ‚ Ð±ÑƒÐ² Ð¿Ñ–Ð´Ð¿Ð¸ÑÐ°Ð½Ð¸Ð¹\n- Ð¡Ñ‚Ð°Ñ‚Ñ‚Ñ Ð±ÑƒÐ»Ð° Ð¾Ð¿ÑƒÐ±Ð»Ñ–ÐºÐ¾Ð²Ð°Ð½Ð°\n- ÐšÐ½Ð¸Ð³Ð° Ð±ÑƒÐ´Ðµ Ð½Ð°Ð´Ñ€ÑƒÐºÐ¾Ð²Ð°Ð½Ð°\n- Ð›Ð¸ÑÑ‚ Ð±ÑƒÐ² Ð½Ð°Ð¿Ð¸ÑÐ°Ð½Ð¸Ð¹\n- Ð ÐµÐ·ÑƒÐ»ÑŒÑ‚Ð°Ñ‚Ð¸ Ð±ÑƒÐ»Ð¸ Ð¾Ð³Ð¾Ð»Ð¾ÑˆÐµÐ½Ñ–\n- Ð Ð¾Ð±Ð¾Ñ‚Ð° Ð±ÑƒÐ»Ð° Ð²Ð¸ÐºÐ¾Ð½Ð°Ð½Ð°\n\n### Ð—Ð²Ð¾Ñ€Ð¾Ñ‚Ð½Ð¸Ð¹ Ð¿Ð°ÑÐ¸Ð² (-ÑÑ)\n- ÐŸÑ€Ð¾Ð±Ð»ÐµÐ¼Ð° Ñ€Ð¾Ð·Ð²'ÑÐ·ÑƒÑ”Ñ‚ÑŒÑÑ\n- Ð”Ð°Ð½Ñ– Ð¾Ð±Ñ€Ð¾Ð±Ð»ÑÑŽÑ‚ÑŒÑÑ\n- ÐŸÐ¸Ñ‚Ð°Ð½Ð½Ñ Ñ€Ð¾Ð·Ð³Ð»ÑÐ´Ð°Ñ”Ñ‚ÑŒÑÑ\n- ÐœÐµÑ‚Ð¾Ð´ Ð·Ð°ÑÑ‚Ð¾ÑÐ¾Ð²ÑƒÑ”Ñ‚ÑŒÑÑ\n- Ð ÐµÐ·ÑƒÐ»ÑŒÑ‚Ð°Ñ‚Ð¸ Ð°Ð½Ð°Ð»Ñ–Ð·ÑƒÑŽÑ‚ÑŒÑÑ\n- Ð—Ð²Ñ–Ñ‚ Ð³Ð¾Ñ‚ÑƒÑ”Ñ‚ÑŒÑÑ\n\n---\n\n## fill-in: Ð¢Ñ€Ð°Ð½ÑÑ„Ð¾Ñ€Ð¼Ð°Ñ†Ñ–Ñ Ñƒ Ð¿Ð°ÑÐ¸Ð²Ð½Ð¸Ð¹ ÑÑ‚Ð°Ð½\n\n> ÐŸÐ¾ÑÑ‚Ð°Ð²Ñ‚Ðµ Ð´Ñ–Ñ”ÑÐ»Ð¾Ð²Ð¾ Ð² Ð¿Ñ€Ð°Ð²Ð¸Ð»ÑŒÐ½Ñƒ Ñ„Ð¾Ñ€Ð¼Ñƒ Ð¿Ð°ÑÐ¸Ð²Ð½Ð¾Ð³Ð¾ ÑÑ‚Ð°Ð½Ñƒ (-Ð½Ð¾/-Ñ‚Ð¾).\n\n1. Ð¦ÑŽ ÑÑ‚Ð°Ñ‚Ñ‚ÑŽ ___ (Ð½Ð°Ð¿Ð¸ÑÐ°Ñ‚Ð¸) Ð²Ñ–Ð´Ð¾Ð¼Ð¸Ð¼ Ð½Ð°ÑƒÐºÐ¾Ð²Ñ†ÐµÐ¼.\n   > [!answer] Ð½Ð°Ð¿Ð¸ÑÐ°Ð½Ð¾\n   > [!options] Ð½Ð°Ð¿Ð¸ÑÐ°Ð½Ð¾ | Ð½Ð°Ð¿Ð¸ÑÐ°Ð½Ð¸Ð¹ | Ð½Ð°Ð¿Ð¸ÑÐ°Ð² | Ð¿Ð¸ÑˆÐµÑ‚ÑŒÑÑ\n\n2. Ð”Ð¾ÑÐ»Ñ–Ð´Ð¶ÐµÐ½Ð½Ñ ___ (Ð¿Ñ€Ð¾Ð²ÐµÑÑ‚Ð¸) Ð¿Ñ€Ð¾Ñ‚ÑÐ³Ð¾Ð¼ Ñ€Ð¾ÐºÑƒ.\n   > [!answer] Ð¿Ñ€Ð¾Ð²ÐµÐ´ÐµÐ½Ð¾\n   > [!options] Ð¿Ñ€Ð¾Ð²ÐµÐ´ÐµÐ½Ð¾ | Ð¿Ñ€Ð¾Ð²ÐµÐ´ÐµÐ½Ð¸Ð¹ | Ð¿Ñ€Ð¾Ð²ÐµÐ»Ð¸ | Ð¿Ñ€Ð¾Ð²Ð¾Ð´Ð¸Ñ‚ÑŒÑÑ\n\n3. Ð£ÑÑ– Ð´Ð¾ÐºÑƒÐ¼ÐµÐ½Ñ‚Ð¸ ___ (Ð¿ÐµÑ€ÐµÐ²Ñ–Ñ€Ð¸Ñ‚Ð¸) ÐºÐ¾Ð¼Ñ–ÑÑ–Ñ”ÑŽ.\n   > [!answer] Ð¿ÐµÑ€ÐµÐ²Ñ–Ñ€ÐµÐ½Ð¾\n   > [!options] Ð¿ÐµÑ€ÐµÐ²Ñ–Ñ€ÐµÐ½Ð¾ | Ð¿ÐµÑ€ÐµÐ²Ñ–Ñ€ÐµÐ½Ð¸Ð¹ | Ð¿ÐµÑ€ÐµÐ²Ñ–Ñ€Ð¸Ð»Ð¸ | Ð¿ÐµÑ€ÐµÐ²Ñ–Ñ€ÑÑ”Ñ‚ÑŒÑÑ\n\n4. Ð ÐµÐ·ÑƒÐ»ÑŒÑ‚Ð°Ñ‚Ð¸ ___ (Ð¾Ð³Ð¾Ð»Ð¾ÑÐ¸Ñ‚Ð¸) Ð½Ð° ÐºÐ¾Ð½Ñ„ÐµÑ€ÐµÐ½Ñ†Ñ–Ñ—.\n   > [!answer] Ð¾Ð³Ð¾Ð»Ð¾ÑˆÐµÐ½Ð¾\n   > [!options] Ð¾Ð³Ð¾Ð»Ð¾ÑˆÐµÐ½Ð¾ | Ð¾Ð³Ð¾Ð»Ð¾ÑˆÐµÐ½Ð¸Ð¹ | Ð¾Ð³Ð¾Ð»Ð¾ÑÐ¸Ð»Ð¸ | Ð¾Ð³Ð¾Ð»Ð¾ÑˆÑƒÑ”Ñ‚ÑŒÑÑ\n\n5. ÐÐ¾Ð²Ñ– Ð¿Ñ€Ð°Ð²Ð¸Ð»Ð° ___ (Ð·Ð°Ð¿Ñ€Ð¾Ð²Ð°Ð´Ð¸Ñ‚Ð¸) Ð· Ð½Ð°ÑÑ‚ÑƒÐ¿Ð½Ð¾Ð³Ð¾ Ð¼Ñ–ÑÑÑ†Ñ.\n   > [!answer] Ð·Ð°Ð¿Ñ€Ð¾Ð²Ð°Ð´Ð¶ÐµÐ½Ð¾\n   > [!options] Ð·Ð°Ð¿Ñ€Ð¾Ð²Ð°Ð´Ð¶ÐµÐ½Ð¾ | Ð·Ð°Ð¿Ñ€Ð¾Ð²Ð°Ð´Ð¶ÐµÐ½Ð¸Ð¹ | Ð·Ð°Ð¿Ñ€Ð¾Ð²Ð°Ð´Ð¸Ð»Ð¸ | Ð·Ð°Ð¿Ñ€Ð¾Ð²Ð°Ð´Ð¶ÑƒÑ”Ñ‚ÑŒÑÑ\n\n6. Ð—Ð°ÑÐ²Ñƒ ___ (Ð¿Ð¾Ð´Ð°Ñ‚Ð¸) Ð²Ñ‡Ð°ÑÐ½Ð¾.\n   > [!answer] Ð¿Ð¾Ð´Ð°Ð½Ð¾\n   > [!options] Ð¿Ð¾Ð´Ð°Ð½Ð¾ | Ð¿Ð¾Ð´Ð°Ð½Ð¸Ð¹ | Ð¿Ð¾Ð´Ð°Ð»Ð¸ | Ð¿Ð¾Ð´Ð°Ñ”Ñ‚ÑŒÑÑ\n\n7. Ð•ÐºÑÐ¿ÐµÑ€Ð¸Ð¼ÐµÐ½Ñ‚ ___ (Ð¿Ð¾Ð²Ñ‚Ð¾Ñ€Ð¸Ñ‚Ð¸) Ñ‚Ñ€Ð¸Ñ‡Ñ–.\n   > [!answer] Ð¿Ð¾Ð²Ñ‚Ð¾Ñ€ÐµÐ½Ð¾\n   > [!options] Ð¿Ð¾Ð²Ñ‚Ð¾Ñ€ÐµÐ½Ð¾ | Ð¿Ð¾Ð²Ñ‚Ð¾Ñ€ÐµÐ½Ð¸Ð¹ | Ð¿Ð¾Ð²Ñ‚Ð¾Ñ€Ð¸Ð»Ð¸ | Ð¿Ð¾Ð²Ñ‚Ð¾Ñ€ÑŽÑ”Ñ‚ÑŒÑÑ\n\n8. Ð’ÑÑ– Ð¿Ð¾Ð¼Ð¸Ð»ÐºÐ¸ ___ (Ð²Ð¸Ð¿Ñ€Ð°Ð²Ð¸Ñ‚Ð¸) Ñ€ÐµÐ´Ð°ÐºÑ‚Ð¾Ñ€Ð¾Ð¼.\n   > [!answer] Ð²Ð¸Ð¿Ñ€Ð°Ð²Ð»ÐµÐ½Ð¾\n   > [!options] Ð²Ð¸Ð¿Ñ€Ð°Ð²Ð»ÐµÐ½Ð¾ | Ð²Ð¸Ð¿Ñ€Ð°Ð²Ð»ÐµÐ½Ð¸Ð¹ | Ð²Ð¸Ð¿Ñ€Ð°Ð²Ð¸Ð»Ð¸ | Ð²Ð¸Ð¿Ñ€Ð°Ð²Ð»ÑÑ”Ñ‚ÑŒÑÑ\n\n9. ÐÐ°ÐºÐ°Ð· ___ (Ð¿Ñ–Ð´Ð¿Ð¸ÑÐ°Ñ‚Ð¸) Ñ€ÐµÐºÑ‚Ð¾Ñ€Ð¾Ð¼.\n   > [!answer] Ð¿Ñ–Ð´Ð¿Ð¸ÑÐ°Ð½Ð¾\n   > [!options] Ð¿Ñ–Ð´Ð¿Ð¸ÑÐ°Ð½Ð¾ | Ð¿Ñ–Ð´Ð¿Ð¸ÑÐ°Ð½Ð¸Ð¹ | Ð¿Ñ–Ð´Ð¿Ð¸ÑÐ°Ð»Ð¸ | Ð¿Ñ–Ð´Ð¿Ð¸ÑÑƒÑ”Ñ‚ÑŒÑÑ\n\n10. Ð—Ð°ÐºÐ¾Ð½ ___ (Ð¿Ñ€Ð¸Ð¹Ð½ÑÑ‚Ð¸) Ð¿Ð°Ñ€Ð»Ð°Ð¼ÐµÐ½Ñ‚Ð¾Ð¼.\n    > [!answer] Ð¿Ñ€Ð¸Ð¹Ð½ÑÑ‚Ð¾\n    > [!options] Ð¿Ñ€Ð¸Ð¹Ð½ÑÑ‚Ð¾ | Ð¿Ñ€Ð¸Ð¹Ð½ÑÑ‚Ð¸Ð¹ | Ð¿Ñ€Ð¸Ð¹Ð½ÑÐ»Ð¸ | Ð¿Ñ€Ð¸Ð¹Ð¼Ð°Ñ”Ñ‚ÑŒÑÑ\n\n11. Ð Ñ–ÑˆÐµÐ½Ð½Ñ ___ (ÑƒÑ…Ð²Ð°Ð»Ð¸Ñ‚Ð¸) Ð¾Ð´Ð½Ð¾Ð³Ð¾Ð»Ð¾ÑÐ½Ð¾.\n    > [!answer] ÑƒÑ…Ð²Ð°Ð»ÐµÐ½Ð¾\n    > [!options] ÑƒÑ…Ð²Ð°Ð»ÐµÐ½Ð¾ | ÑƒÑ…Ð²Ð°Ð»ÐµÐ½Ð¸Ð¹ | ÑƒÑ…Ð²Ð°Ð»Ð¸Ð»Ð¸ | ÑƒÑ…Ð²Ð°Ð»ÑŽÑ”Ñ‚ÑŒÑÑ\n\n12. Ð—Ð²Ñ–Ñ‚ ___ (Ð·Ð°Ð²ÐµÑ€ÑˆÐ¸Ñ‚Ð¸) Ð²Ñ‡Ð¾Ñ€Ð°.\n    > [!answer] Ð·Ð°Ð²ÐµÑ€ÑˆÐµÐ½Ð¾\n    > [!options] Ð·Ð°Ð²ÐµÑ€ÑˆÐµÐ½Ð¾ | Ð·Ð°Ð²ÐµÑ€ÑˆÐµÐ½Ð¸Ð¹ | Ð·Ð°Ð²ÐµÑ€ÑˆÐ¸Ð»Ð¸ | Ð·Ð°Ð²ÐµÑ€ÑˆÑƒÑ”Ñ‚ÑŒÑÑ\n\n13. Ð£ÑÑ– Ð´Ð°Ð½Ñ– ___ (Ð¾Ð±Ñ€Ð¾Ð±Ð¸Ñ‚Ð¸) Ð·Ð° Ð´Ð¾Ð¿Ð¾Ð¼Ð¾Ð³Ð¾ÑŽ ÐºÐ¾Ð¼Ð¿'ÑŽÑ‚ÐµÑ€Ð°.\n    > [!answer] Ð¾Ð±Ñ€Ð¾Ð±Ð»ÐµÐ½Ð¾\n    > [!options] Ð¾Ð±Ñ€Ð¾Ð±Ð»ÐµÐ½Ð¾ | Ð¾Ð±Ñ€Ð¾Ð±Ð»ÐµÐ½Ð¸Ð¹ | Ð¾Ð±Ñ€Ð¾Ð±Ð¸Ð»Ð¸ | Ð¾Ð±Ñ€Ð¾Ð±Ð»ÑÑ”Ñ‚ÑŒÑÑ\n\n14. Ð¦ÐµÐ¹ Ð¼ÐµÑ‚Ð¾Ð´ ___ (Ð·Ð°ÑÑ‚Ð¾ÑÑƒÐ²Ð°Ñ‚Ð¸) Ð²Ð¿ÐµÑ€ÑˆÐµ.\n    > [!answer] Ð·Ð°ÑÑ‚Ð¾ÑÐ¾Ð²Ð°Ð½Ð¾\n    > [!options] Ð·Ð°ÑÑ‚Ð¾ÑÐ¾Ð²Ð°Ð½Ð¾ | Ð·Ð°ÑÑ‚Ð¾ÑÐ¾Ð²Ð°Ð½Ð¸Ð¹ | Ð·Ð°ÑÑ‚Ð¾ÑÑƒÐ²Ð°Ð»Ð¸ | Ð·Ð°ÑÑ‚Ð¾ÑÐ¾Ð²ÑƒÑ”Ñ‚ÑŒÑÑ\n\n15. Ð¢ÐµÐ¾Ñ€Ñ–ÑŽ ___ (Ð¿Ñ–Ð´Ñ‚Ð²ÐµÑ€Ð´Ð¸Ñ‚Ð¸) ÐµÐºÑÐ¿ÐµÑ€Ð¸Ð¼ÐµÐ½Ñ‚Ð°Ð»ÑŒÐ½Ð¾.\n    > [!answer] Ð¿Ñ–Ð´Ñ‚Ð²ÐµÑ€Ð´Ð¶ÐµÐ½Ð¾\n    > [!options] Ð¿Ñ–Ð´Ñ‚Ð²ÐµÑ€Ð´Ð¶ÐµÐ½Ð¾ | Ð¿Ñ–Ð´Ñ‚Ð²ÐµÑ€Ð´Ð¶ÐµÐ½Ð¸Ð¹ | Ð¿Ñ–Ð´Ñ‚Ð²ÐµÑ€Ð´Ð¸Ð»Ð¸ | Ð¿Ñ–Ð´Ñ‚Ð²ÐµÑ€Ð´Ð¶ÑƒÑ”Ñ‚ÑŒÑÑ\n\n16. Ð¡Ñ‚Ð°Ñ‚Ñ‚ÑŽ ___ (Ð¾Ð¿ÑƒÐ±Ð»Ñ–ÐºÑƒÐ²Ð°Ñ‚Ð¸) Ð² Ð½Ð°ÑƒÐºÐ¾Ð²Ð¾Ð¼Ñƒ Ð¶ÑƒÑ€Ð½Ð°Ð»Ñ–.\n    > [!answer] Ð¾Ð¿ÑƒÐ±Ð»Ñ–ÐºÐ¾Ð²Ð°Ð½Ð¾\n    > [!options] Ð¾Ð¿ÑƒÐ±Ð»Ñ–ÐºÐ¾Ð²Ð°Ð½Ð¾ | Ð¾Ð¿ÑƒÐ±Ð»Ñ–ÐºÐ¾Ð²Ð°Ð½Ð¸Ð¹ | Ð¾Ð¿ÑƒÐ±Ð»Ñ–ÐºÑƒÐ²Ð°Ð»Ð¸ | Ð¿ÑƒÐ±Ð»Ñ–ÐºÑƒÑ”Ñ‚ÑŒÑÑ\n\n17. Ð“Ñ–Ð¿Ð¾Ñ‚ÐµÐ·Ñƒ ___ (Ð²Ð¸ÑÑƒÐ½ÑƒÑ‚Ð¸) Ñ‰Ðµ Ð² Ð¼Ð¸Ð½ÑƒÐ»Ð¾Ð¼Ñƒ ÑÑ‚Ð¾Ð»Ñ–Ñ‚Ñ‚Ñ–.\n    > [!answer] Ð²Ð¸ÑÑƒÐ½ÑƒÑ‚Ð¾\n    > [!options] Ð²Ð¸ÑÑƒÐ½ÑƒÑ‚Ð¾ | Ð²Ð¸ÑÑƒÐ½ÑƒÑ‚Ð¸Ð¹ | Ð²Ð¸ÑÑƒÐ½ÑƒÐ»Ð¸ | Ð²Ð¸ÑÑƒÐ²Ð°Ñ”Ñ‚ÑŒÑÑ\n\n18. ÐšÐ¾Ð½Ñ„ÐµÑ€ÐµÐ½Ñ†Ñ–ÑŽ ___ (Ð¿Ñ€Ð¾Ð²ÐµÑÑ‚Ð¸) Ñƒ ÐšÐ¸Ñ”Ð²Ñ–.\n    > [!answer] Ð¿Ñ€Ð¾Ð²ÐµÐ´ÐµÐ½Ð¾\n    > [!options] Ð¿Ñ€Ð¾Ð²ÐµÐ´ÐµÐ½Ð¾ | Ð¿Ñ€Ð¾Ð²ÐµÐ´ÐµÐ½Ð¸Ð¹ | Ð¿Ñ€Ð¾Ð²ÐµÐ»Ð¸ | Ð¿Ñ€Ð¾Ð²Ð¾Ð´Ð¸Ñ‚ÑŒÑÑ\n\n---\n\n## fill-in: Ð’Ð¸Ð±Ñ–Ñ€ Ñ€ÐµÐ³Ñ–ÑÑ‚Ñ€Ñƒ\n\n> Ð’Ð¸Ð±ÐµÑ€Ñ–Ñ‚ÑŒ Ñ„Ð¾Ñ€Ð¼Ñƒ, ÑÐºÐ° Ð½Ð°Ð¹ÐºÑ€Ð°Ñ‰Ðµ Ð¿Ñ–Ð´Ñ…Ð¾Ð´Ð¸Ñ‚ÑŒ Ð´Ð»Ñ Ð½Ð°ÑƒÐºÐ¾Ð²Ð¾Ð³Ð¾ ÑÑ‚Ð¸Ð»ÑŽ.\n\n1. ÐœÐµÑ‚Ð¾Ð´ ___ Ð´Ð»Ñ Ð°Ð½Ð°Ð»Ñ–Ð·Ñƒ Ð´Ð°Ð½Ð¸Ñ….\n   > [!answer] Ð·Ð°ÑÑ‚Ð¾ÑÐ¾Ð²Ð°Ð½Ð¾\n   > [!options] Ð²Ð¸ÐºÐ¾Ñ€Ð¸ÑÑ‚Ð°Ð»Ð¸ | Ð·Ð°ÑÑ‚Ð¾ÑÐ¾Ð²Ð°Ð½Ð¾ | Ñ€Ð¾Ð±Ð¸Ð»Ð¸ | Ð²Ð·ÑÐ»Ð¸\n\n2. Ð ÐµÐ·ÑƒÐ»ÑŒÑ‚Ð°Ñ‚Ð¸ ___ Ð² Ñ‚Ð°Ð±Ð»Ð¸Ñ†Ñ– Ð½Ð¸Ð¶Ñ‡Ðµ.\n   > [!answer] Ð¿Ñ€ÐµÐ´ÑÑ‚Ð°Ð²Ð»ÐµÐ½Ð¾\n   > [!options] Ð¿Ð¾ÐºÐ°Ð·Ð°Ð»Ð¸ | Ð¿Ñ€ÐµÐ´ÑÑ‚Ð°Ð²Ð»ÐµÐ½Ð¾ | Ð´Ð°Ð»Ð¸ | Ð²Ð¸ÐºÐ»Ð°Ð»Ð¸\n\n3. Ð”Ð¾ÑÐ»Ñ–Ð´Ð¶ÐµÐ½Ð½Ñ ___ Ð¿Ð¸Ñ‚Ð°Ð½Ð½ÑŽ Ð¼Ð¾Ð²Ð½Ð¾Ñ— Ð¿Ð¾Ð»Ñ–Ñ‚Ð¸ÐºÐ¸.\n   > [!answer] Ð¿Ñ€Ð¸ÑÐ²ÑÑ‡ÐµÐ½Ð¾\n   > [!options] Ð¿Ñ€Ð¸ÑÐ²ÑÑ‡ÐµÐ½Ð¾ | Ð¿Ñ€Ð¸ÑÐ²ÑÑ‚Ð¸Ð»Ð¸ | Ð·Ñ€Ð¾Ð±Ð¸Ð»Ð¸ | Ð¿Ð¸ÑÐ°Ð»Ð¸\n\n4. ___, Ñ‰Ð¾ Ñ–ÑÐ½ÑƒÑ” ÐºÐ¾Ñ€ÐµÐ»ÑÑ†Ñ–Ñ Ð¼Ñ–Ð¶ Ð·Ð¼Ñ–Ð½Ð½Ð¸Ð¼Ð¸.\n   > [!answer] Ð’ÑÑ‚Ð°Ð½Ð¾Ð²Ð»ÐµÐ½Ð¾\n   > [!options] ÐœÐ¸ Ð·'ÑÑÑƒÐ²Ð°Ð»Ð¸ | Ð’ÑÑ‚Ð°Ð½Ð¾Ð²Ð»ÐµÐ½Ð¾ | Ð—Ñ€Ð¾Ð±Ð¸Ð»Ð¸ | Ð”Ñ–Ð·Ð½Ð°Ð»Ð¸ÑÑ\n\n5. Ð“Ñ–Ð¿Ð¾Ñ‚ÐµÐ·Ñƒ ___ ÐµÐºÑÐ¿ÐµÑ€Ð¸Ð¼ÐµÐ½Ñ‚Ð°Ð»ÑŒÐ½Ð¸Ð¼ ÑˆÐ»ÑÑ…Ð¾Ð¼.\n   > [!answer] Ð¿Ñ–Ð´Ñ‚Ð²ÐµÑ€Ð´Ð¶ÐµÐ½Ð¾\n   > [!options] Ð¿Ñ–Ð´Ñ‚Ð²ÐµÑ€Ð´Ð¸Ð»Ð¸ | Ð¿Ñ–Ð´Ñ‚Ð²ÐµÑ€Ð´Ð¶ÐµÐ½Ð¾ | Ð´Ð¾Ð²ÐµÐ»Ð¸ | Ð¿Ð¾ÐºÐ°Ð·Ð°Ð»Ð¸\n\n6. Ð£ÑÑ– Ð´Ð¶ÐµÑ€ÐµÐ»Ð° ___ Ð² Ð±Ñ–Ð±Ð»Ñ–Ð¾Ð³Ñ€Ð°Ñ„Ñ–Ñ—.\n   > [!answer] Ð½Ð°Ð²ÐµÐ´ÐµÐ½Ð¾\n   > [!options] Ð´Ð°Ð»Ð¸ | Ð½Ð°Ð²ÐµÐ´ÐµÐ½Ð¾ | Ð½Ð°Ð¿Ð¸ÑÐ°Ð»Ð¸ | Ð¿Ð¾ÐºÐ»Ð°Ð´Ð°Ð»Ð¸\n\n7. ÐÐ° Ð¾ÑÐ½Ð¾Ð²Ñ– Ð°Ð½Ð°Ð»Ñ–Ð·Ñƒ ___ Ð²Ð¸ÑÐ½Ð¾Ð²Ð¾Ðº.\n   > [!answer] Ð·Ñ€Ð¾Ð±Ð»ÐµÐ½Ð¾\n   > [!options] Ð·Ñ€Ð¾Ð±Ð¸Ð»Ð¸ | Ð·Ñ€Ð¾Ð±Ð»ÐµÐ½Ð¾ | Ð¼Ð°Ð»Ð¸ | Ð²Ð¸Ð²ÐµÐ»Ð¸\n\n8. ÐŸÑ€Ð¾Ð±Ð»ÐµÐ¼Ñƒ ___ Ð· Ñ€Ñ–Ð·Ð½Ð¸Ñ… Ð¿ÐµÑ€ÑÐ¿ÐµÐºÑ‚Ð¸Ð².\n   > [!answer] Ñ€Ð¾Ð·Ð³Ð»ÑÐ½ÑƒÑ‚Ð¾\n   > [!options] Ð¿Ð¾Ð´Ð¸Ð²Ð¸Ð»Ð¸ÑÑŒ | Ñ€Ð¾Ð·Ð³Ð»ÑÐ½ÑƒÑ‚Ð¾ | Ð±Ð°Ñ‡Ð¸Ð»Ð¸ | Ð°Ð½Ð°Ð»Ñ–Ð·ÑƒÐ²Ð°Ð»Ð¸\n\n9. Ð”Ð°Ð½Ñ– ___ Ð¼ÐµÑ‚Ð¾Ð´Ð¾Ð¼ ÐºÐ¾Ñ€ÐµÐ»ÑÑ†Ñ–Ð¹Ð½Ð¾Ð³Ð¾ Ð°Ð½Ð°Ð»Ñ–Ð·Ñƒ.\n   > [!answer] Ð¾Ð±Ñ€Ð¾Ð±Ð»ÐµÐ½Ð¾\n   > [!options] Ð¾Ð±Ñ€Ð¾Ð±Ð»ÐµÐ½Ð¾ | Ð¾Ð±Ñ€Ð¾Ð±Ð¸Ð»Ð¸ | Ñ€Ð°Ñ…ÑƒÐ²Ð°Ð»Ð¸ | Ñ€Ð¾Ð±Ð¸Ð»Ð¸\n\n10. ÐžÑÐ½Ð¾Ð²Ð½Ñ– Ð¿Ð¾Ð½ÑÑ‚Ñ‚Ñ ___ Ñƒ Ð²ÑÑ‚ÑƒÐ¿Ñ–.\n    > [!answer] Ð²Ð¸Ð·Ð½Ð°Ñ‡ÐµÐ½Ð¾\n    > [!options] ÑÐºÐ°Ð·Ð°Ð»Ð¸ | Ð²Ð¸Ð·Ð½Ð°Ñ‡ÐµÐ½Ð¾ | Ð½Ð°Ð¿Ð¸ÑÐ°Ð»Ð¸ | Ð´Ð°Ð»Ð¸\n\n11. Ð•ÐºÑÐ¿ÐµÑ€Ð¸Ð¼ÐµÐ½Ñ‚ ___ Ñƒ ÐºÐ¾Ð½Ñ‚Ñ€Ð¾Ð»ÑŒÐ¾Ð²Ð°Ð½Ð¸Ñ… ÑƒÐ¼Ð¾Ð²Ð°Ñ….\n    > [!answer] Ð¿Ñ€Ð¾Ð²ÐµÐ´ÐµÐ½Ð¾\n    > [!options] Ð·Ñ€Ð¾Ð±Ð¸Ð»Ð¸ | Ð¿Ñ€Ð¾Ð²ÐµÐ´ÐµÐ½Ð¾ | Ð¼Ð°Ð»Ð¸ | Ñ€Ð¾Ð±Ð¸Ð»Ð¸\n\n12. Ð•Ñ„ÐµÐºÑ‚Ð¸Ð²Ð½Ñ–ÑÑ‚ÑŒ Ð¼ÐµÑ‚Ð¾Ð´Ñƒ ___ Ð½Ð° Ð¿Ñ€Ð°ÐºÑ‚Ð¸Ñ†Ñ–.\n    > [!answer] Ð´Ð¾Ð²ÐµÐ´ÐµÐ½Ð¾\n    > [!options] Ð¿Ð¾ÐºÐ°Ð·Ð°Ð»Ð¸ | Ð´Ð¾Ð²ÐµÐ´ÐµÐ½Ð¾ | Ð±Ð°Ñ‡Ð¸Ð»Ð¸ | Ð¼Ð°Ð»Ð¸\n\n13. Ð£ ÑÑ‚Ð°Ñ‚Ñ‚Ñ– ___ Ð½Ð¾Ð²Ñƒ Ñ‚ÐµÐ¾Ñ€Ñ–ÑŽ.\n    > [!answer] Ð·Ð°Ð¿Ñ€Ð¾Ð¿Ð¾Ð½Ð¾Ð²Ð°Ð½Ð¾\n    > [!options] Ð¿Ñ€Ð¸Ð´ÑƒÐ¼Ð°Ð»Ð¸ | Ð·Ð°Ð¿Ñ€Ð¾Ð¿Ð¾Ð½Ð¾Ð²Ð°Ð½Ð¾ | Ð´Ð°Ð»Ð¸ | Ð¿Ð¸ÑÐ°Ð»Ð¸\n\n14. Ð£ÑÑ– Ð°ÑÐ¿ÐµÐºÑ‚Ð¸ Ð¿Ñ€Ð¾Ð±Ð»ÐµÐ¼Ð¸ ___ Ð´ÐµÑ‚Ð°Ð»ÑŒÐ½Ð¾.\n    > [!answer] Ð¿Ñ€Ð¾Ð°Ð½Ð°Ð»Ñ–Ð·Ð¾Ð²Ð°Ð½Ð¾\n    > [!options] Ð¿Ð¾Ð´Ð¸Ð²Ð¸Ð»Ð¸ÑÑŒ | Ð¿Ñ€Ð¾Ð°Ð½Ð°Ð»Ñ–Ð·Ð¾Ð²Ð°Ð½Ð¾ | Ð±Ð°Ñ‡Ð¸Ð»Ð¸ | Ð¼Ð°Ð»Ð¸\n\n15. ÐœÐ°Ñ‚ÐµÑ€Ñ–Ð°Ð» ___ Ð·Ð° Ñ…Ñ€Ð¾Ð½Ð¾Ð»Ð¾Ð³Ñ–Ñ‡Ð½Ð¸Ð¼ Ð¿Ñ€Ð¸Ð½Ñ†Ð¸Ð¿Ð¾Ð¼.\n    > [!answer] ÑÐ¸ÑÑ‚ÐµÐ¼Ð°Ñ‚Ð¸Ð·Ð¾Ð²Ð°Ð½Ð¾\n    > [!options] Ð¿Ð¾ÐºÐ»Ð°Ð»Ð¸ | ÑÐ¸ÑÑ‚ÐµÐ¼Ð°Ñ‚Ð¸Ð·Ð¾Ð²Ð°Ð½Ð¾ | Ð·Ñ€Ð¾Ð±Ð¸Ð»Ð¸ | Ð¼Ð°Ð»Ð¸\n\n16. Ð ÐµÐ·ÑƒÐ»ÑŒÑ‚Ð°Ñ‚Ð¸ ___ Ð½Ð° Ð¼Ñ–Ð¶Ð½Ð°Ñ€Ð¾Ð´Ð½Ñ–Ð¹ ÐºÐ¾Ð½Ñ„ÐµÑ€ÐµÐ½Ñ†Ñ–Ñ—.\n    > [!answer] Ð¿Ñ€ÐµÐ´ÑÑ‚Ð°Ð²Ð»ÐµÐ½Ð¾\n    > [!options] Ð¿Ð¾ÐºÐ°Ð·Ð°Ð»Ð¸ | Ð¿Ñ€ÐµÐ´ÑÑ‚Ð°Ð²Ð»ÐµÐ½Ð¾ | Ð´Ð°Ð»Ð¸ | Ð¼Ð°Ð»Ð¸\n\n17. Ð£ Ñ€Ð¾Ð±Ð¾Ñ‚Ñ– ___ Ð½Ð¾Ð²Ñ– Ð¿Ñ–Ð´Ñ…Ð¾Ð´Ð¸.\n    > [!answer] Ñ€Ð¾Ð·Ñ€Ð¾Ð±Ð»ÐµÐ½Ð¾\n    > [!options] Ð¿Ñ€Ð¸Ð´ÑƒÐ¼Ð°Ð»Ð¸ | Ñ€Ð¾Ð·Ñ€Ð¾Ð±Ð»ÐµÐ½Ð¾ | Ð·Ñ€Ð¾Ð±Ð¸Ð»Ð¸ | Ð¼Ð°Ð»Ð¸\n\n18. Ð’Ð¸ÑÐ½Ð¾Ð²ÐºÐ¸ ___ Ð½Ð° Ð¾ÑÐ½Ð¾Ð²Ñ– ÐµÐ¼Ð¿Ñ–Ñ€Ð¸Ñ‡Ð½Ð¸Ñ… Ð´Ð°Ð½Ð¸Ñ….\n    > [!answer] ÑÑ„Ð¾Ñ€Ð¼ÑƒÐ»ÑŒÐ¾Ð²Ð°Ð½Ð¾\n    > [!options] Ð½Ð°Ð¿Ð¸ÑÐ°Ð»Ð¸ | ÑÑ„Ð¾Ñ€Ð¼ÑƒÐ»ÑŒÐ¾Ð²Ð°Ð½Ð¾ | Ð¿Ñ€Ð¸Ð´ÑƒÐ¼Ð°Ð»Ð¸ | Ð¼Ð°Ð»Ð¸\n\n---\n\n## error-correction: Ð ÐµÐ³Ñ–ÑÑ‚Ñ€Ð¾Ð²Ñ– Ð¿Ð¾Ð¼Ð¸Ð»ÐºÐ¸ Ñƒ Ð½Ð°ÑƒÐºÐ¾Ð²Ð¾Ð¼Ñƒ ÑÑ‚Ð¸Ð»Ñ–\n\n> Ð—Ð½Ð°Ð¹Ð´Ñ–Ñ‚ÑŒ Ð¿Ð¾Ð¼Ð¸Ð»ÐºÑƒ Ð² ÐºÐ¾Ð¶Ð½Ð¾Ð¼Ñƒ Ñ€ÐµÑ‡ÐµÐ½Ð½Ñ– Ñ‚Ð° Ð²Ð¸Ð¿Ñ€Ð°Ð²Ñ‚Ðµ Ñ—Ñ—.\n\n1. Ð£ Ð´Ð¾ÑÐ»Ñ–Ð´Ð¶ÐµÐ½Ð½Ñ– Ð±ÑƒÐ»Ð¾ Ð²ÑÑ‚Ð°Ð½Ð¾Ð²Ð»ÐµÐ½Ð¾, Ñ‰Ð¾ Ñ€ÐµÐ·ÑƒÐ»ÑŒÑ‚Ð°Ñ‚Ð¸ **ÐºÐ»Ð°ÑÐ½Ñ–**.\n   > [!error] ÐºÐ»Ð°ÑÐ½Ñ–\n   > [!answer] Ð·Ð½Ð°Ñ‡ÑƒÑ‰Ñ–\n   > [!options] ÐºÐ»Ð°ÑÐ½Ñ– | Ð·Ð½Ð°Ñ‡ÑƒÑ‰Ñ– | ÐºÑ€ÑƒÑ‚Ñ– | Ñ„Ð°Ð¹Ð½Ñ–\n   > [!explanation] Â«ÐšÐ»Ð°ÑÐ½Ñ–Â» â€” Ñ€Ð¾Ð·Ð¼Ð¾Ð²Ð½Ðµ ÑÐ»Ð¾Ð²Ð¾. Ð£ Ð½Ð°ÑƒÐºÐ¾Ð²Ð¾Ð¼Ñƒ ÑÑ‚Ð¸Ð»Ñ– Ð²Ð¸ÐºÐ¾Ñ€Ð¸ÑÑ‚Ð¾Ð²ÑƒÐ¹Ñ‚Ðµ Â«Ð·Ð½Ð°Ñ‡ÑƒÑ‰Ñ–Â», Â«Ð²Ð°Ð³Ð¾Ð¼Ñ–Â».\n\n2. ÐœÐµÑ‚Ð¾Ð´ **Ð·Ð°ÑÑ‚Ð¾ÑÑƒÐ²Ð°Ð»Ð¸ Ð¼Ð¸** Ð´Ð»Ñ Ð°Ð½Ð°Ð»Ñ–Ð·Ñƒ Ð´Ð°Ð½Ð¸Ñ….\n   > [!error] Ð·Ð°ÑÑ‚Ð¾ÑÑƒÐ²Ð°Ð»Ð¸ Ð¼Ð¸\n   > [!answer] Ð±ÑƒÐ»Ð¾ Ð·Ð°ÑÑ‚Ð¾ÑÐ¾Ð²Ð°Ð½Ð¾\n   > [!options] Ð·Ð°ÑÑ‚Ð¾ÑÑƒÐ²Ð°Ð»Ð¸ Ð¼Ð¸ | Ð±ÑƒÐ»Ð¾ Ð·Ð°ÑÑ‚Ð¾ÑÐ¾Ð²Ð°Ð½Ð¾ | Ð¼Ð¸ Ð·Ð°ÑÑ‚Ð¾ÑÑƒÐ²Ð°Ð»Ð¸ | Ð·Ð°ÑÑ‚Ð¾ÑÐ¾Ð²ÑƒÑ”Ð¼Ð¾\n   > [!explanation] Ð£ Ð½Ð°ÑƒÐºÐ¾Ð²Ð¾Ð¼Ñƒ ÑÑ‚Ð¸Ð»Ñ– ÑƒÐ½Ð¸ÐºÐ°Ð¹Ñ‚Ðµ Ð¾ÑÐ¾Ð±Ð¾Ð²Ð¸Ñ… Ð·Ð°Ð¹Ð¼ÐµÐ½Ð½Ð¸ÐºÑ–Ð²; Ð²Ð¸ÐºÐ¾Ñ€Ð¸ÑÑ‚Ð¾Ð²ÑƒÐ¹Ñ‚Ðµ Ð¿Ð°ÑÐ¸Ð².\n\n3. Ð”Ð¾ÑÐ»Ñ–Ð´Ð¶ÐµÐ½Ð½Ñ **Ñ€ÐµÐ°Ð»ÑŒÐ½Ð¾ Ð²Ð°Ð¶Ð»Ð¸Ð²Ðµ** Ð´Ð»Ñ Ð½Ð°ÑƒÐºÐ¸.\n   > [!error] Ñ€ÐµÐ°Ð»ÑŒÐ½Ð¾ Ð²Ð°Ð¶Ð»Ð¸Ð²Ðµ\n   > [!answer] Ð¼Ð°Ñ” Ð·Ð½Ð°Ñ‡Ð½Ñƒ Ð½Ð°ÑƒÐºÐ¾Ð²Ñƒ Ñ†Ñ–Ð½Ð½Ñ–ÑÑ‚ÑŒ\n   > [!options] Ñ€ÐµÐ°Ð»ÑŒÐ½Ð¾ Ð²Ð°Ð¶Ð»Ð¸Ð²Ðµ | Ð¼Ð°Ñ” Ð·Ð½Ð°Ñ‡Ð½Ñƒ Ð½Ð°ÑƒÐºÐ¾Ð²Ñƒ Ñ†Ñ–Ð½Ð½Ñ–ÑÑ‚ÑŒ | Ð´ÑƒÐ¶Ðµ ÐºÐ»Ð°ÑÐ½Ðµ | ÐºÑ€ÑƒÑ‚Ðµ\n   > [!explanation] Â«Ð ÐµÐ°Ð»ÑŒÐ½Ð¾Â» â€” Ñ€Ð¾Ð·Ð¼Ð¾Ð²Ð½Ð¸Ð¹ Ð¿Ñ–Ð´ÑÐ¸Ð»ÑŽÐ²Ð°Ñ‡. Ð—Ð°Ð¼Ñ–Ð½Ñ–Ñ‚ÑŒ Ð½Ð° Ñ„Ð¾Ñ€Ð¼Ð°Ð»ÑŒÐ½Ð¸Ð¹ Ð²Ð¸Ñ€Ð°Ð·.\n\n4. Ð ÐµÐ·ÑƒÐ»ÑŒÑ‚Ð°Ñ‚Ð¸ **Ð¿Ð¾ÐºÐ°Ð·Ð°Ð»Ð¸, Ñ‰Ð¾ Ð²Ð¾Ð½Ð¾ Ð¿Ñ€Ð°Ñ†ÑŽÑ”**.\n   > [!error] Ð¿Ð¾ÐºÐ°Ð·Ð°Ð»Ð¸, Ñ‰Ð¾ Ð²Ð¾Ð½Ð¾ Ð¿Ñ€Ð°Ñ†ÑŽÑ”\n   > [!answer] ÑÐ²Ñ–Ð´Ñ‡Ð°Ñ‚ÑŒ Ð¿Ñ€Ð¾ ÐµÑ„ÐµÐºÑ‚Ð¸Ð²Ð½Ñ–ÑÑ‚ÑŒ Ð¼ÐµÑ‚Ð¾Ð´Ñƒ\n   > [!options] Ð¿Ð¾ÐºÐ°Ð·Ð°Ð»Ð¸, Ñ‰Ð¾ Ð²Ð¾Ð½Ð¾ Ð¿Ñ€Ð°Ñ†ÑŽÑ” | ÑÐ²Ñ–Ð´Ñ‡Ð°Ñ‚ÑŒ Ð¿Ñ€Ð¾ ÐµÑ„ÐµÐºÑ‚Ð¸Ð²Ð½Ñ–ÑÑ‚ÑŒ Ð¼ÐµÑ‚Ð¾Ð´Ñƒ | ÐºÐ»Ð°ÑÐ½Ñ– | Ñ„Ð°Ð¹Ð½Ñ–\n   > [!explanation] Ð£Ð½Ð¸ÐºÐ°Ð¹Ñ‚Ðµ Ð½ÐµÐ²Ð¸Ð·Ð½Ð°Ñ‡ÐµÐ½Ð¸Ñ… Ð·Ð°Ð¹Ð¼ÐµÐ½Ð½Ð¸ÐºÑ–Ð²; Ñ„Ð¾Ñ€Ð¼ÑƒÐ»ÑŽÐ¹Ñ‚Ðµ ÐºÐ¾Ð½ÐºÑ€ÐµÑ‚Ð½Ð¾.\n\n5. **ÐœÐ¸ Ð´ÑƒÐ¼Ð°Ñ”Ð¼Ð¾**, Ñ‰Ð¾ Ð³Ñ–Ð¿Ð¾Ñ‚ÐµÐ·Ð° Ð¿Ñ€Ð°Ð²Ð¸Ð»ÑŒÐ½Ð°.\n   > [!error] ÐœÐ¸ Ð´ÑƒÐ¼Ð°Ñ”Ð¼Ð¾\n   > [!answer] Ð„ Ð¿Ñ–Ð´ÑÑ‚Ð°Ð²Ð¸ Ð²Ð²Ð°Ð¶Ð°Ñ‚Ð¸\n   > [!options] ÐœÐ¸ Ð´ÑƒÐ¼Ð°Ñ”Ð¼Ð¾ | Ð„ Ð¿Ñ–Ð´ÑÑ‚Ð°Ð²Ð¸ Ð²Ð²Ð°Ð¶Ð°Ñ‚Ð¸ | ÐÐ°Ð¼ Ð·Ð´Ð°Ñ”Ñ‚ÑŒÑÑ | Ð’Ð²Ð°Ð¶Ð°Ñ”Ð¼Ð¾\n   > [!explanation] Ð£Ð½Ð¸ÐºÐ°Ð¹Ñ‚Ðµ ÑÑƒÐ±'Ñ”ÐºÑ‚Ð¸Ð²Ð½Ð¸Ñ… Ñ„Ð¾Ñ€Ð¼ÑƒÐ»ÑŽÐ²Ð°Ð½ÑŒ; Ð²Ð¸ÐºÐ¾Ñ€Ð¸ÑÑ‚Ð¾Ð²ÑƒÐ¹Ñ‚Ðµ Ð±ÐµÐ·Ð¾ÑÐ¾Ð±Ð¾Ð²Ñ–.\n\n6. Ð•ÐºÑÐ¿ÐµÑ€Ð¸Ð¼ÐµÐ½Ñ‚ **Ð¿Ñ€Ð¾Ð²ÐµÐ»Ð¸ Ð´ÐµÑÑŒ Ñ‚Ð¸Ð¶Ð´ÐµÐ½ÑŒ Ð½Ð°Ð·Ð°Ð´**.\n   > [!error] Ð´ÐµÑÑŒ Ñ‚Ð¸Ð¶Ð´ÐµÐ½ÑŒ Ð½Ð°Ð·Ð°Ð´\n   > [!answer] Ð¿Ñ€Ð¾Ñ‚ÑÐ³Ð¾Ð¼ Ð¿Ð¾Ð¿ÐµÑ€ÐµÐ´Ð½ÑŒÐ¾Ð³Ð¾ Ñ‚Ð¸Ð¶Ð½Ñ\n   > [!options] Ð´ÐµÑÑŒ Ñ‚Ð¸Ð¶Ð´ÐµÐ½ÑŒ Ð½Ð°Ð·Ð°Ð´ | Ð¿Ñ€Ð¾Ñ‚ÑÐ³Ð¾Ð¼ Ð¿Ð¾Ð¿ÐµÑ€ÐµÐ´Ð½ÑŒÐ¾Ð³Ð¾ Ñ‚Ð¸Ð¶Ð½Ñ | ÑÐºÐ¾ÑÑŒ Ð½ÐµÑ‰Ð¾Ð´Ð°Ð²Ð½Ð¾ | Ð´Ð½ÑÐ¼Ð¸\n   > [!explanation] Â«Ð”ÐµÑÑŒÂ» â€” Ñ€Ð¾Ð·Ð¼Ð¾Ð²Ð½Ðµ. Ð£ Ð½Ð°ÑƒÐºÐ¾Ð²Ð¾Ð¼Ñƒ ÑÑ‚Ð¸Ð»Ñ– Ð²ÐºÐ°Ð·ÑƒÐ¹Ñ‚Ðµ Ñ‚Ð¾Ñ‡Ð½Ñ– Ñ‡Ð°ÑÐ¾Ð²Ñ– Ñ€Ð°Ð¼ÐºÐ¸.\n\n7. Ð”Ð°Ð½Ñ– **ÐºÐ»ÑŒÐ¾Ð²Ð¾ Ð¿Ñ–Ð´Ñ‚Ð²ÐµÑ€Ð´Ð¸Ð»Ð¸** Ð½Ð°ÑˆÑƒ Ñ‚ÐµÐ¾Ñ€Ñ–ÑŽ.\n   > [!error] ÐºÐ»ÑŒÐ¾Ð²Ð¾ Ð¿Ñ–Ð´Ñ‚Ð²ÐµÑ€Ð´Ð¸Ð»Ð¸\n   > [!answer] Ð¿ÐµÑ€ÐµÐºÐ¾Ð½Ð»Ð¸Ð²Ð¾ Ð¿Ñ–Ð´Ñ‚Ð²ÐµÑ€Ð´Ð¶ÑƒÑŽÑ‚ÑŒ\n   > [!options] ÐºÐ»ÑŒÐ¾Ð²Ð¾ Ð¿Ñ–Ð´Ñ‚Ð²ÐµÑ€Ð´Ð¸Ð»Ð¸ | Ð¿ÐµÑ€ÐµÐºÐ¾Ð½Ð»Ð¸Ð²Ð¾ Ð¿Ñ–Ð´Ñ‚Ð²ÐµÑ€Ð´Ð¶ÑƒÑŽÑ‚ÑŒ | ÐºÐ»Ð°ÑÐ½Ð¾ Ð´Ð¾Ð²ÐµÐ»Ð¸ | Ñ€ÐµÐ°Ð»ÑŒÐ½Ð¾ Ð¿Ð¾ÐºÐ°Ð·Ð°Ð»Ð¸\n   > [!explanation] Â«ÐšÐ»ÑŒÐ¾Ð²Ð¾Â» â€” ÑÐ»ÐµÐ½Ð³. Ð’Ð¸ÐºÐ¾Ñ€Ð¸ÑÑ‚Ð¾Ð²ÑƒÐ¹Ñ‚Ðµ Â«Ð¿ÐµÑ€ÐµÐºÐ¾Ð½Ð»Ð¸Ð²Ð¾Â», Â«Ð±ÐµÐ·Ð·Ð°Ð¿ÐµÑ€ÐµÑ‡Ð½Ð¾Â».\n\n8. Ð£ ÑÑ‚Ð°Ñ‚Ñ‚Ñ– **Ð½Ñ–Ñ‡Ð¾Ð³Ð¾ Ð½Ð¾Ð²Ð¾Ð³Ð¾, Ð°Ð»Ðµ Ð¾Ðº**.\n   > [!error] Ð½Ñ–Ñ‡Ð¾Ð³Ð¾ Ð½Ð¾Ð²Ð¾Ð³Ð¾, Ð°Ð»Ðµ Ð¾Ðº\n   > [!answer] Ð¿Ñ–Ð´Ñ‚Ð²ÐµÑ€Ð´Ð¶ÐµÐ½Ð¾ Ñ€Ð°Ð½Ñ–ÑˆÐµ Ð²Ñ–Ð´Ð¾Ð¼Ñ– Ñ€ÐµÐ·ÑƒÐ»ÑŒÑ‚Ð°Ñ‚Ð¸\n   > [!options] Ð½Ñ–Ñ‡Ð¾Ð³Ð¾ Ð½Ð¾Ð²Ð¾Ð³Ð¾, Ð°Ð»Ðµ Ð¾Ðº | Ð¿Ñ–Ð´Ñ‚Ð²ÐµÑ€Ð´Ð¶ÐµÐ½Ð¾ Ñ€Ð°Ð½Ñ–ÑˆÐµ Ð²Ñ–Ð´Ð¾Ð¼Ñ– Ñ€ÐµÐ·ÑƒÐ»ÑŒÑ‚Ð°Ñ‚Ð¸ | Ð²ÑÐµ ÑÑ‚Ð°Ñ€Ðµ | Ð½Ð¾Ñ€Ð¼Ð°Ð»ÑŒÐ½Ð¾\n   > [!explanation] Ð Ð¾Ð·Ð¼Ð¾Ð²Ð½Ð° Ð¾Ñ†Ñ–Ð½ÐºÐ° Ð½ÐµÐ¿Ñ€Ð¸Ð¿ÑƒÑÑ‚Ð¸Ð¼Ð°. Ð¤Ð¾Ñ€Ð¼ÑƒÐ»ÑŽÐ¹Ñ‚Ðµ Ð½ÐµÐ¹Ñ‚Ñ€Ð°Ð»ÑŒÐ½Ð¾.\n\n9. ÐŸÑ€Ð¾Ð±Ð»ÐµÐ¼Ñƒ Ð´Ð¾ÑÐ»Ñ–Ð´Ð¶ÑƒÐ²Ð°Ð»Ð¸, Ñ– **Ð²ÑÐµ Ð²Ð¸Ð¹ÑˆÐ»Ð¾ Ð´Ð¾Ð±Ñ€Ðµ**.\n   > [!error] Ð²ÑÐµ Ð²Ð¸Ð¹ÑˆÐ»Ð¾ Ð´Ð¾Ð±Ñ€Ðµ\n   > [!answer] Ð¾Ñ‚Ñ€Ð¸Ð¼Ð°Ð½Ð¾ Ð¾Ñ‡Ñ–ÐºÑƒÐ²Ð°Ð½Ñ– Ñ€ÐµÐ·ÑƒÐ»ÑŒÑ‚Ð°Ñ‚Ð¸\n   > [!options] Ð²ÑÐµ Ð²Ð¸Ð¹ÑˆÐ»Ð¾ Ð´Ð¾Ð±Ñ€Ðµ | Ð¾Ñ‚Ñ€Ð¸Ð¼Ð°Ð½Ð¾ Ð¾Ñ‡Ñ–ÐºÑƒÐ²Ð°Ð½Ñ– Ñ€ÐµÐ·ÑƒÐ»ÑŒÑ‚Ð°Ñ‚Ð¸ | ÐºÐ»Ð°ÑÐ½Ð¾ Ð²Ð¸Ð¹ÑˆÐ»Ð¾ | Ð½Ð¾Ñ€Ð¼\n   > [!explanation] Â«Ð”Ð¾Ð±Ñ€Ðµ Ð²Ð¸Ð¹ÑˆÐ»Ð¾Â» â€” Ñ€Ð¾Ð·Ð¼Ð¾Ð²Ð½Ðµ. ÐšÐ¾Ð½ÐºÑ€ÐµÑ‚Ð¸Ð·ÑƒÐ¹Ñ‚Ðµ Ñ€ÐµÐ·ÑƒÐ»ÑŒÑ‚Ð°Ñ‚.\n\n10. **Ð¢Ð¸Ð¿Ñƒ**, Ñ†Ðµ Ð´Ð¾ÑÐ»Ñ–Ð´Ð¶ÐµÐ½Ð½Ñ Ð²Ð°Ð¶Ð»Ð¸Ð²Ðµ.\n    > [!error] Ð¢Ð¸Ð¿Ñƒ\n    > [!answer] Ð‘ÐµÐ·Ð¿ÐµÑ€ÐµÑ‡Ð½Ð¾\n    > [!options] Ð¢Ð¸Ð¿Ñƒ | Ð‘ÐµÐ·Ð¿ÐµÑ€ÐµÑ‡Ð½Ð¾ | ÐÑƒ | ÐžÑ‚\n    > [!explanation] Â«Ð¢Ð¸Ð¿ÑƒÂ» â€” ÑÐ»ÐµÐ½Ð³Ð¾Ð²Ðµ ÑÐ»Ð¾Ð²Ð¾-Ð¿Ð°Ñ€Ð°Ð·Ð¸Ñ‚. Ð’Ð¸Ð´Ð°Ð»Ñ–Ñ‚ÑŒ Ð°Ð±Ð¾ Ð·Ð°Ð¼Ñ–Ð½Ñ–Ñ‚ÑŒ.\n\n11. Ð’Ð¸ÐºÐ¾Ñ€Ð¸ÑÑ‚Ð°Ð½Ð¾ **Ð½Ð¾Ñ€Ð¼Ð°Ð»ÑŒÐ½Ð¸Ð¹** Ð¼ÐµÑ‚Ð¾Ð´.\n    > [!error] Ð½Ð¾Ñ€Ð¼Ð°Ð»ÑŒÐ½Ð¸Ð¹\n    > [!answer] ÑÑ‚Ð°Ð½Ð´Ð°Ñ€Ñ‚Ð½Ð¸Ð¹\n    > [!options] Ð½Ð¾Ñ€Ð¼Ð°Ð»ÑŒÐ½Ð¸Ð¹ | ÑÑ‚Ð°Ð½Ð´Ð°Ñ€Ñ‚Ð½Ð¸Ð¹ | Ð·Ð²Ð¸Ñ‡Ð°Ð¹Ð½Ð¸Ð¹ | Ñ‚Ð°ÐºÐ¸Ð¹ ÑÐ¾Ð±Ñ–\n    > [!explanation] Â«ÐÐ¾Ñ€Ð¼Ð°Ð»ÑŒÐ½Ð¸Ð¹Â» Ð·Ð°Ð½Ð°Ð´Ñ‚Ð¾ Ñ€Ð¾Ð·Ð¼Ð¾Ð²Ð½Ðµ. Ð’Ð¶Ð¸Ð²Ð°Ð¹Ñ‚Ðµ Â«ÑÑ‚Ð°Ð½Ð´Ð°Ñ€Ñ‚Ð½Ð¸Ð¹Â», Â«Ð·Ð°Ð³Ð°Ð»ÑŒÐ½Ð¾Ð¿Ñ€Ð¸Ð¹Ð½ÑÑ‚Ð¸Ð¹Â».\n\n12. Ð ÐµÐ·ÑƒÐ»ÑŒÑ‚Ð°Ñ‚Ð¸ Ð¾Ð¿ÑƒÐ±Ð»Ñ–ÐºÐ¾Ð²Ð°Ð½Ð¾ Ð² Ð¶ÑƒÑ€Ð½Ð°Ð»Ñ–.\n    > [!error] none\n    > [!answer] âœ“\n    > [!explanation] Ð ÐµÑ‡ÐµÐ½Ð½Ñ ÐºÐ¾Ñ€ÐµÐºÑ‚Ð½Ðµ â€” Ñ„Ð¾Ñ€Ð¼Ð° Ð½Ð° -Ð½Ð¾/-Ñ‚Ð¾ Ð´Ð¾Ñ€ÐµÑ‡Ð½Ð° Ð´Ð»Ñ Ð½Ð°ÑƒÐºÐ¾Ð²Ð¾Ð³Ð¾ ÑÑ‚Ð¸Ð»ÑŽ.\n\n13. **ÐÑƒ, Ð·Ð°Ð³Ð°Ð»Ð¾Ð¼**, Ð´Ð¾ÑÐ»Ñ–Ð´Ð¶ÐµÐ½Ð½Ñ Ð²Ð´Ð°Ð»Ðµ.\n    > [!error] ÐÑƒ, Ð·Ð°Ð³Ð°Ð»Ð¾Ð¼\n    > [!answer] Ð—Ð°Ð³Ð°Ð»Ð¾Ð¼\n    > [!options] ÐÑƒ, Ð·Ð°Ð³Ð°Ð»Ð¾Ð¼ | Ð—Ð°Ð³Ð°Ð»Ð¾Ð¼ | ÐÑƒ | ÐÑƒ Ñ‚Ð¸Ð¿Ñƒ\n    > [!explanation] Â«ÐÑƒÂ» â€” ÑƒÑÐ½Ðµ ÑÐ»Ð¾Ð²Ð¾-Ð¿Ð°Ñ€Ð°Ð·Ð¸Ñ‚. Ð’Ð¸Ð´Ð°Ð»Ñ–Ñ‚ÑŒ Ð¹Ð¾Ð³Ð¾.\n\n14. ÐœÐµÑ‚Ð¾Ð´ **Ñ‚Ð¸Ð¿Ñƒ ÐµÑ„ÐµÐºÑ‚Ð¸Ð²Ð½Ð¸Ð¹**.\n    > [!error] Ñ‚Ð¸Ð¿Ñƒ ÐµÑ„ÐµÐºÑ‚Ð¸Ð²Ð½Ð¸Ð¹\n    > [!answer] Ñ” ÐµÑ„ÐµÐºÑ‚Ð¸Ð²Ð½Ð¸Ð¼\n    > [!options] Ñ‚Ð¸Ð¿Ñƒ ÐµÑ„ÐµÐºÑ‚Ð¸Ð²Ð½Ð¸Ð¹ | Ñ” ÐµÑ„ÐµÐºÑ‚Ð¸Ð²Ð½Ð¸Ð¼ | Ñ‚Ð¸Ð¿Ñƒ Ð¿Ñ€Ð°Ñ†ÑŽÑ” | Ð½Ð¾Ñ€Ð¼\n    > [!explanation] Ð’Ð¸Ð´Ð°Ð»Ñ–Ñ‚ÑŒ Â«Ñ‚Ð¸Ð¿ÑƒÂ»; Ñ„Ð¾Ñ€Ð¼ÑƒÐ»ÑŽÐ¹Ñ‚Ðµ Ñ‡Ñ–Ñ‚ÐºÐ¾.\n\n15. **Ð¯ Ð´ÑƒÐ¼Ð°ÑŽ**, Ñ‰Ð¾ Ñ†Ðµ Ð²Ð°Ð¶Ð»Ð¸Ð²Ð¾.\n    > [!error] Ð¯ Ð´ÑƒÐ¼Ð°ÑŽ\n    > [!answer] Ð’Ð°Ñ€Ñ‚Ð¾ Ð·Ð°Ð·Ð½Ð°Ñ‡Ð¸Ñ‚Ð¸\n    > [!options] Ð¯ Ð´ÑƒÐ¼Ð°ÑŽ | Ð’Ð°Ñ€Ñ‚Ð¾ Ð·Ð°Ð·Ð½Ð°Ñ‡Ð¸Ñ‚Ð¸ | ÐœÐµÐ½Ñ– Ð·Ð´Ð°Ñ”Ñ‚ÑŒÑÑ | Ð¯ Ð²Ð²Ð°Ð¶Ð°ÑŽ\n    > [!explanation] Ð£Ð½Ð¸ÐºÐ°Ð¹Ñ‚Ðµ Â«Ð¯Â» Ð² Ð½Ð°ÑƒÐºÐ¾Ð²Ð¾Ð¼Ñƒ ÑÑ‚Ð¸Ð»Ñ–; Ð²Ð¸ÐºÐ¾Ñ€Ð¸ÑÑ‚Ð¾Ð²ÑƒÐ¹Ñ‚Ðµ Ð±ÐµÐ·Ð¾ÑÐ¾Ð±Ð¾Ð²Ñ– ÐºÐ¾Ð½ÑÑ‚Ñ€ÑƒÐºÑ†Ñ–Ñ—.\n\n16. Ð”Ð¾ÑÐ»Ñ–Ð´Ð¶ÐµÐ½Ð½Ñ Ð¿Ñ€Ð¾Ð²ÐµÐ´ÐµÐ½Ð¾ ÑÐºÑ–ÑÐ½Ð¾.\n    > [!error] none\n    > [!answer] âœ“\n    > [!explanation] Ð ÐµÑ‡ÐµÐ½Ð½Ñ ÐºÐ¾Ñ€ÐµÐºÑ‚Ð½Ðµ â€” Ð°Ð´Ð²ÐµÑ€Ð± Â«ÑÐºÑ–ÑÐ½Ð¾Â» Ð´Ð¾Ñ€ÐµÑ‡Ð½Ð¸Ð¹ Ñƒ Ñ†ÑŒÐ¾Ð¼Ñƒ ÐºÐ¾Ð½Ñ‚ÐµÐºÑÑ‚Ñ–.\n\n17. Ð ÐµÐ·ÑƒÐ»ÑŒÑ‚Ð°Ñ‚Ð¸ **ÑÑƒÐ¿ÐµÑ€ Ð²Ð°Ð¶Ð»Ð¸Ð²Ñ–** Ð´Ð»Ñ Ð³Ð°Ð»ÑƒÐ·Ñ–.\n    > [!error] ÑÑƒÐ¿ÐµÑ€ Ð²Ð°Ð¶Ð»Ð¸Ð²Ñ–\n    > [!answer] Ð¼Ð°ÑŽÑ‚ÑŒ ÑÑƒÑ‚Ñ‚Ñ”Ð²Ðµ Ð·Ð½Ð°Ñ‡ÐµÐ½Ð½Ñ\n    > [!options] ÑÑƒÐ¿ÐµÑ€ Ð²Ð°Ð¶Ð»Ð¸Ð²Ñ– | Ð¼Ð°ÑŽÑ‚ÑŒ ÑÑƒÑ‚Ñ‚Ñ”Ð²Ðµ Ð·Ð½Ð°Ñ‡ÐµÐ½Ð½Ñ | Ð´ÑƒÐ¶Ðµ ÐºÑ€ÑƒÑ‚Ñ– | Ð´Ð¸ÐºÐ¾ Ð²Ð°Ð¶Ð»Ð¸Ð²Ñ–\n    > [!explanation] Â«Ð¡ÑƒÐ¿ÐµÑ€Â» â€” Ñ€Ð¾Ð·Ð¼Ð¾Ð²Ð½Ð¸Ð¹ Ð¿Ñ–Ð´ÑÐ¸Ð»ÑŽÐ²Ð°Ñ‡. Ð—Ð°Ð¼Ñ–Ð½Ñ–Ñ‚ÑŒ Ð½Ð° Ñ„Ð¾Ñ€Ð¼Ð°Ð»ÑŒÐ½Ð¸Ð¹ Ð²Ð¸Ñ€Ð°Ð·.\n\n18. Ð¡Ñ‚Ð°Ñ‚Ð¸ÑÑ‚Ð¸Ñ‡Ð½Ð¸Ð¹ Ð°Ð½Ð°Ð»Ñ–Ð· **Ð¿Ð¾ÐºÐ°Ð·Ð°Ð² Ð½Ð¾Ñ€Ð¼ Ñ€ÐµÐ·ÑƒÐ»ÑŒÑ‚Ð°Ñ‚Ð¸**.\n    > [!error] Ð½Ð¾Ñ€Ð¼ Ñ€ÐµÐ·ÑƒÐ»ÑŒÑ‚Ð°Ñ‚Ð¸\n    > [!answer] Ð²Ð°Ð»Ñ–Ð´Ð½Ñ– Ñ€ÐµÐ·ÑƒÐ»ÑŒÑ‚Ð°Ñ‚Ð¸\n    > [!options] Ð½Ð¾Ñ€Ð¼ Ñ€ÐµÐ·ÑƒÐ»ÑŒÑ‚Ð°Ñ‚Ð¸ | Ð²Ð°Ð»Ñ–Ð´Ð½Ñ– Ñ€ÐµÐ·ÑƒÐ»ÑŒÑ‚Ð°Ñ‚Ð¸ | Ð¾Ðº Ñ€ÐµÐ·ÑƒÐ»ÑŒÑ‚Ð°Ñ‚Ð¸ | Ð½Ð¾Ñ€Ð¼Ð°Ð»ÑŒÐ½Ñ–\n    > [!explanation] Â«ÐÐ¾Ñ€Ð¼Â» â€” ÑÐ»ÐµÐ½Ð³. Ð’Ð¸ÐºÐ¾Ñ€Ð¸ÑÑ‚Ð¾Ð²ÑƒÐ¹Ñ‚Ðµ Â«Ð²Ð°Ð»Ñ–Ð´Ð½Ñ–Â», Â«ÑÑ‚Ð°Ñ‚Ð¸ÑÑ‚Ð¸Ñ‡Ð½Ð¾ Ð·Ð½Ð°Ñ‡ÑƒÑ‰Ñ–Â».\n\n---\n\n## error-correction: ÐŸÐ°ÑÐ¸Ð²Ð½Ð¸Ð¹ ÑÑ‚Ð°Ð½ â€” Ð¿Ð¾Ð¼Ð¸Ð»ÐºÐ¸ Ñ„Ð¾Ñ€Ð¼ÑƒÐ²Ð°Ð½Ð½Ñ\n\n> Ð—Ð½Ð°Ð¹Ð´Ñ–Ñ‚ÑŒ Ð³Ñ€Ð°Ð¼Ð°Ñ‚Ð¸Ñ‡Ð½Ñƒ Ð¿Ð¾Ð¼Ð¸Ð»ÐºÑƒ Ñƒ Ñ„Ð¾Ñ€Ð¼ÑƒÐ²Ð°Ð½Ð½Ñ– Ð¿Ð°ÑÐ¸Ð²Ð½Ð¾Ð³Ð¾ ÑÑ‚Ð°Ð½Ñƒ.\n\n1. Ð”Ð¾ÐºÑƒÐ¼ÐµÐ½Ñ‚ Ð±ÑƒÐ»Ð¾ **Ð¿Ñ–Ð´Ð¿Ð¸ÑÐ°Ð½Ð¸Ð¹** Ð´Ð¸Ñ€ÐµÐºÑ‚Ð¾Ñ€Ð¾Ð¼.\n   > [!error] Ð¿Ñ–Ð´Ð¿Ð¸ÑÐ°Ð½Ð¸Ð¹\n   > [!answer] Ð¿Ñ–Ð´Ð¿Ð¸ÑÐ°Ð½Ð¾\n   > [!options] Ð¿Ñ–Ð´Ð¿Ð¸ÑÐ°Ð½Ð¸Ð¹ | Ð¿Ñ–Ð´Ð¿Ð¸ÑÐ°Ð½Ð¾ | Ð¿Ñ–Ð´Ð¿Ð¸ÑÐ°Ñ‚Ð¸ | Ð¿Ñ–Ð´Ð¿Ð¸ÑÑƒÑ”\n   > [!explanation] ÐŸÑ–ÑÐ»Ñ Â«Ð±ÑƒÐ»Ð¾Â» Ð²Ð¸ÐºÐ¾Ñ€Ð¸ÑÑ‚Ð¾Ð²ÑƒÐ¹Ñ‚Ðµ Ñ„Ð¾Ñ€Ð¼Ñƒ Ð½Ð° -Ð½Ð¾/-Ñ‚Ð¾: Â«Ð±ÑƒÐ»Ð¾ Ð¿Ñ–Ð´Ð¿Ð¸ÑÐ°Ð½Ð¾Â».\n\n2. Ð ÐµÐ·ÑƒÐ»ÑŒÑ‚Ð°Ñ‚Ð¸ **Ð¾Ð³Ð¾Ð»Ð¾ÑˆÑƒÐ²Ð°Ð½Ð¾** Ð½Ð° ÐºÐ¾Ð½Ñ„ÐµÑ€ÐµÐ½Ñ†Ñ–Ñ—.\n   > [!error] Ð¾Ð³Ð¾Ð»Ð¾ÑˆÑƒÐ²Ð°Ð½Ð¾\n   > [!answer] Ð¾Ð³Ð¾Ð»Ð¾ÑˆÐµÐ½Ð¾\n   > [!options] Ð¾Ð³Ð¾Ð»Ð¾ÑˆÑƒÐ²Ð°Ð½Ð¾ | Ð¾Ð³Ð¾Ð»Ð¾ÑˆÐµÐ½Ð¾ | Ð¾Ð³Ð¾Ð»Ð¾ÑˆÑƒÑŽÑ‚ÑŒÑÑ | Ð¾Ð³Ð¾Ð»Ð¾ÑˆÑƒÐ²Ð°Ð»Ð¸\n   > [!explanation] ÐÐµÐ¿Ñ€Ð°Ð²Ð¸Ð»ÑŒÐ½Ð° Ñ„Ð¾Ñ€Ð¼Ð°. ÐŸÑ€Ð°Ð²Ð¸Ð»ÑŒÐ½Ð¾: Â«Ð¾Ð³Ð¾Ð»Ð¾ÑˆÐµÐ½Ð¾Â» (Ð²Ñ–Ð´ Â«Ð¾Ð³Ð¾Ð»Ð¾ÑÐ¸Ñ‚Ð¸Â»).\n\n3. Ð¡Ñ‚Ð°Ñ‚Ñ‚ÑŽ **Ð½Ð°Ð¿Ð¸ÑÐ°Ð½Ð¸Ð¹** Ð¿Ñ€Ð¾Ñ„ÐµÑÐ¾Ñ€Ð¾Ð¼.\n   > [!error] Ð½Ð°Ð¿Ð¸ÑÐ°Ð½Ð¸Ð¹\n   > [!answer] Ð½Ð°Ð¿Ð¸ÑÐ°Ð½Ð¾\n   > [!options] Ð½Ð°Ð¿Ð¸ÑÐ°Ð½Ð¸Ð¹ | Ð½Ð°Ð¿Ð¸ÑÐ°Ð½Ð¾ | Ð½Ð°Ð¿Ð¸ÑÐ°Ñ‚Ð¸ | Ð¿Ð¸ÑˆÐµÑ‚ÑŒÑÑ\n   > [!explanation] ÐŸÑ–ÑÐ»Ñ Â«ÑÑ‚Ð°Ñ‚Ñ‚ÑŽÂ» (Ð·Ð½Ð°Ñ…Ñ–Ð´Ð½Ð¸Ð¹ Ð²Ñ–Ð´Ð¼Ñ–Ð½Ð¾Ðº) Ð¿Ð¾Ñ‚Ñ€Ñ–Ð±Ð½Ð¾ Â«Ð½Ð°Ð¿Ð¸ÑÐ°Ð½Ð¾Â».\n\n4. Ð—Ð°ÐºÐ¾Ð½ **ÑƒÑ…Ð²Ð°Ð»ÐµÐ½Ð¾Ð³Ð¾** Ð¿Ð°Ñ€Ð»Ð°Ð¼ÐµÐ½Ñ‚Ð¾Ð¼.\n   > [!error] ÑƒÑ…Ð²Ð°Ð»ÐµÐ½Ð¾Ð³Ð¾\n   > [!answer] ÑƒÑ…Ð²Ð°Ð»ÐµÐ½Ð¾\n   > [!options] ÑƒÑ…Ð²Ð°Ð»ÐµÐ½Ð¾Ð³Ð¾ | ÑƒÑ…Ð²Ð°Ð»ÐµÐ½Ð¾ | ÑƒÑ…Ð²Ð°Ð»ÐµÐ½Ð¸Ð¹ | ÑƒÑ…Ð²Ð°Ð»ÑŽÑ”Ñ‚ÑŒÑÑ\n   > [!explanation] ÐÐµÐ¿Ñ€Ð°Ð²Ð¸Ð»ÑŒÐ½Ð¸Ð¹ Ð²Ñ–Ð´Ð¼Ñ–Ð½Ð¾Ðº. ÐŸÑ€Ð°Ð²Ð¸Ð»ÑŒÐ½Ð¾: Â«ÑƒÑ…Ð²Ð°Ð»ÐµÐ½Ð¾Â».\n\n5. Ð”Ð¾ÑÐ»Ñ–Ð´Ð¶ÐµÐ½Ð½Ñ **Ð¿Ñ€Ð¾Ð²ÐµÐ´ÐµÐ½Ð¸Ð¹** ÑƒÑÐ¿Ñ–ÑˆÐ½Ð¾.\n   > [!error] Ð¿Ñ€Ð¾Ð²ÐµÐ´ÐµÐ½Ð¸Ð¹\n   > [!answer] Ð¿Ñ€Ð¾Ð²ÐµÐ´ÐµÐ½Ð¾\n   > [!options] Ð¿Ñ€Ð¾Ð²ÐµÐ´ÐµÐ½Ð¸Ð¹ | Ð¿Ñ€Ð¾Ð²ÐµÐ´ÐµÐ½Ð¾ | Ð¿Ñ€Ð¾Ð²Ð¾Ð´Ð¸Ñ‚ÑŒÑÑ | Ð¿Ñ€Ð¾Ð²ÐµÐ»Ð¸\n   > [!explanation] Â«Ð”Ð¾ÑÐ»Ñ–Ð´Ð¶ÐµÐ½Ð½ÑÂ» â€” ÑÐµÑ€ÐµÐ´Ð½Ñ–Ð¹ Ñ€Ñ–Ð´; Ñ„Ð¾Ñ€Ð¼Ð° Ð½Ð° -Ð½Ð¾/-Ñ‚Ð¾ Ñ” Ð±ÐµÐ·Ð¾ÑÐ¾Ð±Ð¾Ð²Ð¾ÑŽ.\n\n6. ÐœÐµÑ‚Ð¾Ð´ Ð±ÑƒÐ»Ð¾ Ð·Ð°ÑÑ‚Ð¾ÑÐ¾Ð²Ð°Ð½Ð¾ ÑƒÑÐ¿Ñ–ÑˆÐ½Ð¾.\n   > [!error] none\n   > [!answer] âœ“\n   > [!explanation] Ð ÐµÑ‡ÐµÐ½Ð½Ñ ÐºÐ¾Ñ€ÐµÐºÑ‚Ð½Ðµ â€” Â«Ð±ÑƒÐ»Ð¾ Ð·Ð°ÑÑ‚Ð¾ÑÐ¾Ð²Ð°Ð½Ð¾Â» Ð¿Ñ€Ð°Ð²Ð¸Ð»ÑŒÐ½Ð° Ñ„Ð¾Ñ€Ð¼Ð° Ð¼Ð¸Ð½ÑƒÐ»Ð¾Ð³Ð¾ Ñ‡Ð°ÑÑƒ.\n\n7. ÐŸÑ€Ð¾Ð±Ð»ÐµÐ¼Ð° **Ñ€Ð¾Ð·Ð²'ÑÐ·ÑƒÑŽÑ‚ÑŒÑÑ** ÐºÐ¾Ð¼Ð°Ð½Ð´Ð¾ÑŽ.\n   > [!error] Ñ€Ð¾Ð·Ð²'ÑÐ·ÑƒÑŽÑ‚ÑŒÑÑ\n   > [!answer] Ñ€Ð¾Ð·Ð²'ÑÐ·ÑƒÑ”Ñ‚ÑŒÑÑ\n   > [!options] Ñ€Ð¾Ð·Ð²'ÑÐ·ÑƒÑŽÑ‚ÑŒÑÑ | Ñ€Ð¾Ð·Ð²'ÑÐ·ÑƒÑ”Ñ‚ÑŒÑÑ | Ñ€Ð¾Ð·Ð²'ÑÐ·Ð°Ð½Ð¾ | Ñ€Ð¾Ð·Ð²'ÑÐ·ÑƒÐ²Ð°Ð»Ð¸\n   > [!explanation] Â«ÐŸÑ€Ð¾Ð±Ð»ÐµÐ¼Ð°Â» â€” Ð¾Ð´Ð½Ð¸Ð½Ð°, Ñ‚Ð¾Ð¼Ñƒ Ð´Ñ–Ñ”ÑÐ»Ð¾Ð²Ð¾ Ñ‚Ð°ÐºÐ¾Ð¶ Ð² Ð¾Ð´Ð½Ð¸Ð½Ñ–.\n\n8. Ð£ÑÑ– Ð´Ð¾ÐºÑƒÐ¼ÐµÐ½Ñ‚Ð¸ **Ð¿ÐµÑ€ÐµÐ²Ñ–Ñ€ÐµÐ½Ð¾Ð³Ð¾** ÐºÐ¾Ð¼Ñ–ÑÑ–Ñ”ÑŽ.\n   > [!error] Ð¿ÐµÑ€ÐµÐ²Ñ–Ñ€ÐµÐ½Ð¾Ð³Ð¾\n   > [!answer] Ð¿ÐµÑ€ÐµÐ²Ñ–Ñ€ÐµÐ½Ð¾\n   > [!options] Ð¿ÐµÑ€ÐµÐ²Ñ–Ñ€ÐµÐ½Ð¾Ð³Ð¾ | Ð¿ÐµÑ€ÐµÐ²Ñ–Ñ€ÐµÐ½Ð¾ | Ð¿ÐµÑ€ÐµÐ²Ñ–Ñ€ÐµÐ½Ð¸Ð¹ | Ð¿ÐµÑ€ÐµÐ²Ñ–Ñ€ÑÑŽÑ‚ÑŒÑÑ\n   > [!explanation] ÐÐµÐ¿Ñ€Ð°Ð²Ð¸Ð»ÑŒÐ½Ð¸Ð¹ Ð²Ñ–Ð´Ð¼Ñ–Ð½Ð¾Ðº. ÐŸÑ€Ð°Ð²Ð¸Ð»ÑŒÐ½Ð¾: Â«Ð¿ÐµÑ€ÐµÐ²Ñ–Ñ€ÐµÐ½Ð¾Â».\n\n9. Ð—Ð²Ñ–Ñ‚ **Ð³Ð¾Ñ‚ÑƒÐ²Ð°Ñ‚Ð¸ÑÑ** Ð´Ð¾ Ð¿ÑƒÐ±Ð»Ñ–ÐºÐ°Ñ†Ñ–Ñ—.\n   > [!error] Ð³Ð¾Ñ‚ÑƒÐ²Ð°Ñ‚Ð¸ÑÑ\n   > [!answer] Ð³Ð¾Ñ‚ÑƒÑ”Ñ‚ÑŒÑÑ\n   > [!options] Ð³Ð¾Ñ‚ÑƒÐ²Ð°Ñ‚Ð¸ÑÑ | Ð³Ð¾Ñ‚ÑƒÑ”Ñ‚ÑŒÑÑ | Ð³Ð¾Ñ‚Ð¾Ð²Ð°Ð½Ð¾ | Ð³Ð¾Ñ‚ÑƒÐ²Ð°Ð»Ð¸\n   > [!explanation] ÐŸÐ¾Ñ‚Ñ€Ñ–Ð±Ð½Ð° Ð¾ÑÐ¾Ð±Ð¾Ð²Ð° Ñ„Ð¾Ñ€Ð¼Ð° Ð´Ñ–Ñ”ÑÐ»Ð¾Ð²Ð°, Ð½Ðµ Ñ–Ð½Ñ„Ñ–Ð½Ñ–Ñ‚Ð¸Ð².\n\n10. Ð ÐµÐ·ÑƒÐ»ÑŒÑ‚Ð°Ñ‚Ð¸ Ð±ÑƒÐ»Ð¾ Ð¿Ñ€Ð¾Ð°Ð½Ð°Ð»Ñ–Ð·Ð¾Ð²Ð°Ð½Ð¾ Ð´ÐµÑ‚Ð°Ð»ÑŒÐ½Ð¾.\n    > [!error] none\n    > [!answer] âœ“\n    > [!explanation] Ð ÐµÑ‡ÐµÐ½Ð½Ñ ÐºÐ¾Ñ€ÐµÐºÑ‚Ð½Ðµ â€” Â«Ð±ÑƒÐ»Ð¾ Ð¿Ñ€Ð¾Ð°Ð½Ð°Ð»Ñ–Ð·Ð¾Ð²Ð°Ð½Ð¾Â» Ð¿Ñ€Ð°Ð²Ð¸Ð»ÑŒÐ½Ð° Ñ„Ð¾Ñ€Ð¼Ð°.\n\n11. ÐšÐ½Ð¸Ð³Ñƒ **Ð½Ð°Ð´Ñ€ÑƒÐºÐ¾Ð²ÑƒÐ²Ð°Ñ‚Ð¸Ð¼Ðµ** Ð²Ð¸Ð´Ð°Ð²Ð½Ð¸Ñ†Ñ‚Ð²Ð¾.\n    > [!error] Ð½Ð°Ð´Ñ€ÑƒÐºÐ¾Ð²ÑƒÐ²Ð°Ñ‚Ð¸Ð¼Ðµ\n    > [!answer] Ð±ÑƒÐ´Ðµ Ð½Ð°Ð´Ñ€ÑƒÐºÐ¾Ð²Ð°Ð½Ð¾\n    > [!options] Ð½Ð°Ð´Ñ€ÑƒÐºÐ¾Ð²ÑƒÐ²Ð°Ñ‚Ð¸Ð¼Ðµ | Ð±ÑƒÐ´Ðµ Ð½Ð°Ð´Ñ€ÑƒÐºÐ¾Ð²Ð°Ð½Ð¾ | Ð½Ð°Ð´Ñ€ÑƒÐºÑƒÑ” | Ð´Ñ€ÑƒÐºÑƒÐ²Ð°Ñ‚Ð¸Ð¼Ðµ\n    > [!explanation] Ð”Ð»Ñ Ð¿Ð°ÑÐ¸Ð²Ñƒ Ð¼Ð°Ð¹Ð±ÑƒÑ‚Ð½ÑŒÐ¾Ð³Ð¾ Ñ‡Ð°ÑÑƒ: Â«Ð±ÑƒÐ´Ðµ Ð½Ð°Ð´Ñ€ÑƒÐºÐ¾Ð²Ð°Ð½Ð¾Â».\n\n12. Ð—Ð°ÑÐ²Ñƒ **Ð¿Ð¾Ð´Ð°Ð²Ð°Ð»Ð¾ÑÑ** Ð²Ñ‡Ð°ÑÐ½Ð¾.\n    > [!error] Ð¿Ð¾Ð´Ð°Ð²Ð°Ð»Ð¾ÑÑ\n    > [!answer] Ð¿Ð¾Ð´Ð°Ð½Ð¾\n    > [!options] Ð¿Ð¾Ð´Ð°Ð²Ð°Ð»Ð¾ÑÑ | Ð¿Ð¾Ð´Ð°Ð½Ð¾ | Ð¿Ð¾Ð´Ð°Ð²Ð°Ð»Ð¸ | Ð¿Ð¾Ð´Ð°Ñ”Ñ‚ÑŒÑÑ\n    > [!explanation] Â«Ð—Ð°ÑÐ²ÑƒÂ» â€” Ð¶Ñ–Ð½. Ñ€Ñ–Ð´, Ð·Ð½Ð°Ñ…. Ð²Ñ–Ð´Ð¼Ñ–Ð½Ð¾Ðº; Ð¿Ñ€Ð°Ð²Ð¸Ð»ÑŒÐ½Ð¾ Â«Ð¿Ð¾Ð´Ð°Ð½Ð¾Â».\n\n13. Ð¡Ñ‚Ð°Ñ‚Ñ‚Ñ Ð±ÑƒÐ»Ð° Ð¾Ð¿ÑƒÐ±Ð»Ñ–ÐºÐ¾Ð²Ð°Ð½Ð° Ð²Ñ‡Ð¾Ñ€Ð°.\n    > [!error] none\n    > [!answer] âœ“\n    > [!explanation] Ð ÐµÑ‡ÐµÐ½Ð½Ñ ÐºÐ¾Ñ€ÐµÐºÑ‚Ð½Ðµ â€” Ð´Ñ–Ñ”Ð¿Ñ€Ð¸ÐºÐ¼ÐµÑ‚Ð½Ð¸ÐºÐ¾Ð²Ð¸Ð¹ Ð¿Ð°ÑÐ¸Ð² Ð¿Ñ€Ð°Ð²Ð¸Ð»ÑŒÐ½Ð¸Ð¹.\n\n14. Ð Ñ–ÑˆÐµÐ½Ð½Ñ **ÑƒÑ…Ð²Ð°Ð»ÑŽÐ²Ð°Ð»Ð¸ÑÑ** Ð¾Ð´Ð½Ð¾Ð³Ð¾Ð»Ð¾ÑÐ½Ð¾.\n    > [!error] ÑƒÑ…Ð²Ð°Ð»ÑŽÐ²Ð°Ð»Ð¸ÑÑ\n    > [!answer] ÑƒÑ…Ð²Ð°Ð»ÐµÐ½Ð¾\n    > [!options] ÑƒÑ…Ð²Ð°Ð»ÑŽÐ²Ð°Ð»Ð¸ÑÑ | ÑƒÑ…Ð²Ð°Ð»ÐµÐ½Ð¾ | ÑƒÑ…Ð²Ð°Ð»ÑŽÐ²Ð°Ð»Ð¸ | ÑƒÑ…Ð²Ð°Ð»ÑŽÑŽÑ‚ÑŒÑÑ\n    > [!explanation] Â«Ð Ñ–ÑˆÐµÐ½Ð½ÑÂ» â€” ÑÐµÑ€ÐµÐ´Ð½Ñ–Ð¹ Ñ€Ñ–Ð´ (Ð¾Ð´Ð½Ð¸Ð½Ð°); Ñ„Ð¾Ñ€Ð¼Ð° Â«ÑƒÑ…Ð²Ð°Ð»ÐµÐ½Ð¾Â» Ð´Ð¾Ñ€ÐµÑ‡Ð½Ñ–ÑˆÐ°.\n\n15. Ð•ÐºÑÐ¿ÐµÑ€Ð¸Ð¼ÐµÐ½Ñ‚ **Ð¿Ð¾Ð²Ñ‚Ð¾Ñ€ÑŽÐ²Ð°Ð½Ð¾Ð³Ð¾** Ñ‚Ñ€Ð¸Ñ‡Ñ–.\n    > [!error] Ð¿Ð¾Ð²Ñ‚Ð¾Ñ€ÑŽÐ²Ð°Ð½Ð¾Ð³Ð¾\n    > [!answer] Ð¿Ð¾Ð²Ñ‚Ð¾Ñ€ÐµÐ½Ð¾\n    > [!options] Ð¿Ð¾Ð²Ñ‚Ð¾Ñ€ÑŽÐ²Ð°Ð½Ð¾Ð³Ð¾ | Ð¿Ð¾Ð²Ñ‚Ð¾Ñ€ÐµÐ½Ð¾ | Ð¿Ð¾Ð²Ñ‚Ð¾Ñ€ÑŽÐ²Ð°Ð»Ð¸ | Ð¿Ð¾Ð²Ñ‚Ð¾Ñ€ÑŽÑ”Ñ‚ÑŒÑÑ\n    > [!explanation] ÐÐµÐ¿Ñ€Ð°Ð²Ð¸Ð»ÑŒÐ½Ð° Ñ„Ð¾Ñ€Ð¼Ð°. ÐŸÑ€Ð°Ð²Ð¸Ð»ÑŒÐ½Ð¾: Â«Ð¿Ð¾Ð²Ñ‚Ð¾Ñ€ÐµÐ½Ð¾Â».\n\n16. Ð¢ÐµÐ¾Ñ€Ñ–ÑŽ Ð¿Ñ–Ð´Ñ‚Ð²ÐµÑ€Ð´Ð¶ÐµÐ½Ð¾ ÐµÐºÑÐ¿ÐµÑ€Ð¸Ð¼ÐµÐ½Ñ‚Ð°Ð»ÑŒÐ½Ð¾.\n    > [!error] none\n    > [!answer] âœ“\n    > [!explanation] Ð ÐµÑ‡ÐµÐ½Ð½Ñ ÐºÐ¾Ñ€ÐµÐºÑ‚Ð½Ðµ â€” Ñ„Ð¾Ñ€Ð¼Ð° Ð½Ð° -Ð½Ð¾/-Ñ‚Ð¾ Ð¿Ñ€Ð°Ð²Ð¸Ð»ÑŒÐ½Ð°.\n\n17. Ð”Ð°Ð½Ñ– **Ð¾Ð±Ñ€Ð¾Ð±Ð»ÑÑŽÑ‚ÑŒÑÑ** ÐºÐ¾Ð¼Ð¿'ÑŽÑ‚ÐµÑ€Ð¾Ð¼ Ð²Ð¶Ðµ **Ð¾Ð±Ñ€Ð¾Ð±Ð»ÐµÐ½Ð¾Ð³Ð¾**.\n    > [!error] Ð¾Ð±Ñ€Ð¾Ð±Ð»ÐµÐ½Ð¾Ð³Ð¾\n    > [!answer] Ð¾Ð±Ñ€Ð¾Ð±Ð»ÐµÐ½Ð¾\n    > [!options] Ð¾Ð±Ñ€Ð¾Ð±Ð»ÐµÐ½Ð¾Ð³Ð¾ | Ð¾Ð±Ñ€Ð¾Ð±Ð»ÐµÐ½Ð¾ | Ð¾Ð±Ñ€Ð¾Ð±Ð¸Ð»Ð¸ | Ð¾Ð±Ñ€Ð¾Ð±Ð»ÑÐ»Ð¸\n    > [!explanation] Ð”Ñ€ÑƒÐ³Ñƒ Ñ‡Ð°ÑÑ‚Ð¸Ð½Ñƒ Ð¿Ð¾Ñ‚Ñ€Ñ–Ð±Ð½Ð¾ Ð¿ÐµÑ€ÐµÑ„Ð¾Ñ€Ð¼ÑƒÐ»ÑŽÐ²Ð°Ñ‚Ð¸.\n\n18. Ð“Ñ–Ð¿Ð¾Ñ‚ÐµÐ·Ñƒ **Ð²Ð¸ÑÑƒÐ½ÐµÐ½Ð¸Ð¹** Ð½Ð°ÑƒÐºÐ¾Ð²Ñ†ÑÐ¼Ð¸.\n    > [!error] Ð²Ð¸ÑÑƒÐ½ÐµÐ½Ð¸Ð¹\n    > [!answer] Ð²Ð¸ÑÑƒÐ½ÑƒÑ‚Ð¾\n    > [!options] Ð²Ð¸ÑÑƒÐ½ÐµÐ½Ð¸Ð¹ | Ð²Ð¸ÑÑƒÐ½ÑƒÑ‚Ð¾ | Ð²Ð¸ÑÑƒÐ²Ð°Ð»Ð¸ | Ð²Ð¸ÑÑƒÐ²Ð°Ñ”Ñ‚ÑŒÑÑ\n    > [!explanation] Â«Ð“Ñ–Ð¿Ð¾Ñ‚ÐµÐ·ÑƒÂ» â€” Ð¶Ñ–Ð½. Ñ€Ñ–Ð´; Ð¿Ñ€Ð°Ð²Ð¸Ð»ÑŒÐ½Ð° Ñ„Ð¾Ñ€Ð¼Ð° Â«Ð²Ð¸ÑÑƒÐ½ÑƒÑ‚Ð¾Â».\n\n---\n\n## error-correction: Ð¡Ñ‚Ð¸Ð»Ñ–ÑÑ‚Ð¸Ñ‡Ð½Ñ– Ð½ÐµÐ²Ñ–Ð´Ð¿Ð¾Ð²Ñ–Ð´Ð½Ð¾ÑÑ‚Ñ–\n\n> Ð’Ð¸Ð·Ð½Ð°Ñ‡Ñ‚Ðµ ÑÐ»Ð¾Ð²Ð¾, Ñ‰Ð¾ Ð½Ðµ Ð²Ñ–Ð´Ð¿Ð¾Ð²Ñ–Ð´Ð°Ñ” ÑÑ‚Ð¸Ð»ÑŽ Ñ€ÐµÑ‡ÐµÐ½Ð½Ñ.\n\n1. Ð£ Ñ…Ð¾Ð´Ñ– Ð´Ð¾ÑÐ»Ñ–Ð´Ð¶ÐµÐ½Ð½Ñ **Ð²Ð¸ÑÐ²Ð¸Ð»Ð¾ÑÑ**, Ñ‰Ð¾ Ñ€ÐµÐ·ÑƒÐ»ÑŒÑ‚Ð°Ñ‚Ð¸ Ñ” **ÐºÐ»Ð°ÑÐ½Ð¸Ð¼Ð¸**.\n   > [!error] ÐºÐ»Ð°ÑÐ½Ð¸Ð¼Ð¸\n   > [!answer] Ð·Ð½Ð°Ñ‡ÑƒÑ‰Ð¸Ð¼Ð¸\n   > [!options] ÐºÐ»Ð°ÑÐ½Ð¸Ð¼Ð¸ | Ð·Ð½Ð°Ñ‡ÑƒÑ‰Ð¸Ð¼Ð¸ | ÐºÑ€ÑƒÑ‚Ð¸Ð¼Ð¸ | Ñ„Ð°Ð¹Ð½Ð¸Ð¼Ð¸\n   > [!explanation] Â«ÐšÐ»Ð°ÑÐ½Ð¸Ð¼Ð¸Â» â€” Ñ€Ð¾Ð·Ð¼Ð¾Ð²Ð½Ðµ ÑÐ»Ð¾Ð²Ð¾ Ð² Ð½Ð°ÑƒÐºÐ¾Ð²Ð¾Ð¼Ñƒ ÐºÐ¾Ð½Ñ‚ÐµÐºÑÑ‚Ñ–.\n\n2. ÐšÐ¾Ð½ÑÐ¾Ð»Ñ–Ð´Ð°Ñ†Ñ–ÑŽ Ð·Ð½Ð°Ð½ÑŒ Ð¿Ñ€Ð¾Ð²ÐµÐ´ÐµÐ½Ð¾ **Ð½Ð¾Ñ€Ð¼Ð°Ð»ÑŒÐ½Ð¾**.\n   > [!error] Ð½Ð¾Ñ€Ð¼Ð°Ð»ÑŒÐ½Ð¾\n   > [!answer] ÑƒÑÐ¿Ñ–ÑˆÐ½Ð¾\n   > [!options] Ð½Ð¾Ñ€Ð¼Ð°Ð»ÑŒÐ½Ð¾ | ÑƒÑÐ¿Ñ–ÑˆÐ½Ð¾ | Ð¾Ðº | Ð½Ð¾Ñ€Ð¼\n   > [!explanation] Â«ÐÐ¾Ñ€Ð¼Ð°Ð»ÑŒÐ½Ð¾Â» Ð·Ð°Ð½Ð°Ð´Ñ‚Ð¾ Ð½ÐµÐ²Ð¸Ð·Ð½Ð°Ñ‡ÐµÐ½Ðµ Ð´Ð»Ñ Ð½Ð°ÑƒÐºÐ¾Ð²Ð¾Ð³Ð¾ ÑÑ‚Ð¸Ð»ÑŽ.\n\n3. Ð¡Ð¸ÑÑ‚ÐµÐ¼Ð°Ñ‚Ð¸Ð·Ð°Ñ†Ñ–ÑŽ Ð¼Ð°Ñ‚ÐµÑ€Ñ–Ð°Ð»Ñƒ Ð·Ð´Ñ–Ð¹ÑÐ½ÐµÐ½Ð¾ **Ð² Ñ†Ñ–Ð»Ð¾Ð¼Ñƒ**.\n   > [!error] none\n   > [!answer] âœ“\n   > [!explanation] Ð ÐµÑ‡ÐµÐ½Ð½Ñ ÐºÐ¾Ñ€ÐµÐºÑ‚Ð½Ðµ â€” Â«Ð² Ñ†Ñ–Ð»Ð¾Ð¼ÑƒÂ» Ð¿Ñ€Ð¸Ð¹Ð½ÑÑ‚Ð½Ðµ Ð² Ð½Ð°ÑƒÐºÐ¾Ð²Ð¾Ð¼Ñƒ ÑÑ‚Ð¸Ð»Ñ–.\n\n4. ÐŸÐµÑ€ÐµÑ…Ñ–Ð´ Ð´Ð¾ Ð½Ð¾Ð²Ð¾Ð³Ð¾ Ñ€Ñ–Ð²Ð½Ñ Ð²Ñ–Ð´Ð±ÑƒÐ²ÑÑ **Ñ‚Ð¸Ð¿Ñƒ** ÑƒÑÐ¿Ñ–ÑˆÐ½Ð¾.\n   > [!error] Ñ‚Ð¸Ð¿Ñƒ\n   > [!answer] (Ð²Ð¸Ð´Ð°Ð»Ð¸Ñ‚Ð¸)\n   > [!options] Ñ‚Ð¸Ð¿Ñƒ | (Ð²Ð¸Ð´Ð°Ð»Ð¸Ñ‚Ð¸) | ÑÐºÐ¾ÑÑŒ | Ð½Ñƒ\n   > [!explanation] Â«Ð¢Ð¸Ð¿ÑƒÂ» â€” ÑÐ»ÐµÐ½Ð³Ð¾Ð²Ðµ ÑÐ»Ð¾Ð²Ð¾-Ð¿Ð°Ñ€Ð°Ð·Ð¸Ñ‚, Ñ‰Ð¾ Ð¿Ð¾Ñ€ÑƒÑˆÑƒÑ” ÑÑ‚Ð¸Ð»ÑŒ.\n\n5. ÐÐºÐ°Ð´ÐµÐ¼Ñ–Ñ‡Ð½Ð¸Ð¹ Ñ‚ÐµÐºÑÑ‚ **Ð¿Ñ€Ð¸ÐºÐ¾Ð»ÑŒÐ½Ð¾** Ð½Ð°Ð¿Ð¸ÑÐ°Ð½Ð¸Ð¹.\n   > [!error] Ð¿Ñ€Ð¸ÐºÐ¾Ð»ÑŒÐ½Ð¾\n   > [!answer] ÑÐºÑ–ÑÐ½Ð¾\n   > [!options] Ð¿Ñ€Ð¸ÐºÐ¾Ð»ÑŒÐ½Ð¾ | ÑÐºÑ–ÑÐ½Ð¾ | ÐºÐ»ÑŒÐ¾Ð²Ð¾ | ÐºÑ€ÑƒÑ‚Ð¾\n   > [!explanation] Â«ÐŸÑ€Ð¸ÐºÐ¾Ð»ÑŒÐ½Ð¾Â» â€” ÑÐ»ÐµÐ½Ð³, Ð½ÐµÐ¿Ñ€Ð¸Ð¹Ð½ÑÑ‚Ð½Ð¸Ð¹ Ñƒ Ñ„Ð¾Ñ€Ð¼Ð°Ð»ÑŒÐ½Ð¾Ð¼Ñƒ ÐºÐ¾Ð½Ñ‚ÐµÐºÑÑ‚Ñ–.\n\n6. Ð¤Ð°Ñ…Ð¾Ð²Ð¸Ð¹ Ð°Ð½Ð°Ð»Ñ–Ð· Ð¿Ñ€Ð¾Ð²ÐµÐ´ÐµÐ½Ð¾ Ñ€ÐµÑ‚ÐµÐ»ÑŒÐ½Ð¾.\n   > [!error] none\n   > [!answer] âœ“\n   > [!explanation] Ð ÐµÑ‡ÐµÐ½Ð½Ñ ÐºÐ¾Ñ€ÐµÐºÑ‚Ð½Ðµ â€” Ð»ÐµÐºÑÐ¸ÐºÐ° Ñ‚Ð° ÐºÐ¾Ð½ÑÑ‚Ñ€ÑƒÐºÑ†Ñ–Ñ— Ð¿Ð¾Ð²Ð½Ñ–ÑÑ‚ÑŽ Ð²Ñ–Ð´Ð¿Ð¾Ð²Ñ–Ð´Ð°ÑŽÑ‚ÑŒ Ð°ÐºÐ°Ð´ÐµÐ¼Ñ–Ñ‡Ð½Ð¸Ð¼ Ð²Ð¸Ð¼Ð¾Ð³Ð°Ð¼.\n\n7. Ð”Ð¾ÑÐºÐ¾Ð½Ð°Ð»Ñ–ÑÑ‚ÑŒ Ð¼ÐµÑ‚Ð¾Ð´Ñƒ **Ñ€ÐµÐ°Ð»ÑŒÐ½Ð¾** Ð²Ñ€Ð°Ð¶Ð°Ñ”.\n   > [!error] Ñ€ÐµÐ°Ð»ÑŒÐ½Ð¾\n   > [!answer] ÑÐ¿Ñ€Ð°Ð²Ð´Ñ–\n   > [!options] Ñ€ÐµÐ°Ð»ÑŒÐ½Ð¾ | ÑÐ¿Ñ€Ð°Ð²Ð´Ñ– | Ñ‚Ð¸Ð¿Ñƒ | Ð½Ñƒ\n   > [!explanation] Â«Ð ÐµÐ°Ð»ÑŒÐ½Ð¾Â» â€” Ñ€Ð¾Ð·Ð¼Ð¾Ð²Ð½Ð¸Ð¹ Ð¿Ñ–Ð´ÑÐ¸Ð»ÑŽÐ²Ð°Ñ‡; ÐºÑ€Ð°Ñ‰Ðµ Â«ÑÐ¿Ñ€Ð°Ð²Ð´Ñ–Â», Â«Ð´Ñ–Ð¹ÑÐ½Ð¾Â».\n\n8. ÐœÐ°Ð¹ÑÑ‚ÐµÑ€Ð½Ñ–ÑÑ‚ÑŒ Ð´Ð¾ÑÐ»Ñ–Ð´Ð½Ð¸ÐºÐ° Ð¿Ñ€Ð¾ÑÐ²Ð¸Ð»Ð°ÑÑ **Ð¿Ð¾ Ð¿Ð¾Ð²Ð½Ñ–Ð¹**.\n   > [!error] Ð¿Ð¾ Ð¿Ð¾Ð²Ð½Ñ–Ð¹\n   > [!answer] Ð¿Ð¾Ð²Ð½Ð¾ÑŽ Ð¼Ñ–Ñ€Ð¾ÑŽ\n   > [!options] Ð¿Ð¾ Ð¿Ð¾Ð²Ð½Ñ–Ð¹ | Ð¿Ð¾Ð²Ð½Ð¾ÑŽ Ð¼Ñ–Ñ€Ð¾ÑŽ | Ð½Ð° Ð²ÑÑŽ | Ð¼Ð°ÐºÑÐ¸Ð¼Ð°Ð»ÑŒÐ½Ð¾\n   > [!explanation] Â«ÐŸÐ¾ Ð¿Ð¾Ð²Ð½Ñ–Ð¹Â» â€” Ñ€Ð¾Ð·Ð¼Ð¾Ð²Ð½Ð¸Ð¹ Ñ„Ñ€Ð°Ð·ÐµÐ¾Ð»Ð¾Ð³Ñ–Ð·Ð¼.\n\n9. ÐžÐ¿Ð°Ð½ÑƒÐ²Ð°Ð½Ð½Ñ Ð½Ð¾Ð²Ð¸Ñ… Ð¼ÐµÑ‚Ð¾Ð´Ñ–Ð² Ð²Ñ–Ð´Ð±ÑƒÐ»Ð¾ÑÑ ÐµÑ„ÐµÐºÑ‚Ð¸Ð²Ð½Ð¾.\n   > [!error] none\n   > [!answer] âœ“\n   > [!explanation] Ð ÐµÑ‡ÐµÐ½Ð½Ñ ÐºÐ¾Ñ€ÐµÐºÑ‚Ð½Ðµ â€” Ñ„Ð¾Ñ€Ð¼Ð°Ð»ÑŒÐ½Ð¸Ð¹ Ð°ÐºÐ°Ð´ÐµÐ¼Ñ–Ñ‡Ð½Ð¸Ð¹ ÑÑ‚Ð¸Ð»ÑŒ.\n\n10. Ð’Ð´Ð¾ÑÐºÐ¾Ð½Ð°Ð»ÐµÐ½Ð½Ñ ÑÐ¸ÑÑ‚ÐµÐ¼Ð¸ Ð¿Ñ€Ð¾Ð²ÐµÐ´ÐµÐ½Ð¾ **ÑÐºÐ¾ÑÑŒ Ñ‚Ð°Ðº**.\n    > [!error] ÑÐºÐ¾ÑÑŒ Ñ‚Ð°Ðº\n    > [!answer] Ð½Ð°Ð»ÐµÐ¶Ð½Ð¸Ð¼ Ñ‡Ð¸Ð½Ð¾Ð¼\n    > [!options] ÑÐºÐ¾ÑÑŒ Ñ‚Ð°Ðº | Ð½Ð°Ð»ÐµÐ¶Ð½Ð¸Ð¼ Ñ‡Ð¸Ð½Ð¾Ð¼ | Ð½Ñƒ Ð½Ð¾Ñ€Ð¼ | Ñ‚Ð¸Ð¿Ñƒ Ð¾Ðº\n    > [!explanation] Â«Ð¯ÐºÐ¾ÑÑŒ Ñ‚Ð°ÐºÂ» â€” Ð½ÐµÐ²Ð¸Ð·Ð½Ð°Ñ‡ÐµÐ½Ð¸Ð¹ Ñ€Ð¾Ð·Ð¼Ð¾Ð²Ð½Ð¸Ð¹ Ð²Ð¸Ñ€Ð°Ð·.\n\n11. ÐŸÐ¾Ð³Ð»Ð¸Ð±Ð»ÐµÐ½Ð½Ñ Ð·Ð½Ð°Ð½ÑŒ Ð²Ñ–Ð´Ð±ÑƒÐ»Ð¾ÑÑ **ÑÑƒÐ¿ÐµÑ€ ÑˆÐ²Ð¸Ð´ÐºÐ¾**.\n    > [!error] ÑÑƒÐ¿ÐµÑ€ ÑˆÐ²Ð¸Ð´ÐºÐ¾\n    > [!answer] Ð´ÑƒÐ¶Ðµ ÑˆÐ²Ð¸Ð´ÐºÐ¾\n    > [!options] ÑÑƒÐ¿ÐµÑ€ ÑˆÐ²Ð¸Ð´ÐºÐ¾ | Ð´ÑƒÐ¶Ðµ ÑˆÐ²Ð¸Ð´ÐºÐ¾ | Ð¼ÐµÐ³Ð° ÑˆÐ²Ð¸Ð´ÐºÐ¾ | ÐµÐºÑÑ‚Ñ€Ð° ÑˆÐ²Ð¸Ð´ÐºÐ¾\n    > [!explanation] Â«Ð¡ÑƒÐ¿ÐµÑ€Â» â€” Ñ€Ð¾Ð·Ð¼Ð¾Ð²Ð½Ð¸Ð¹ Ð¿Ñ€ÐµÑ„Ñ–ÐºÑ; ÐºÑ€Ð°Ñ‰Ðµ Â«Ð´ÑƒÐ¶ÐµÂ», Â«Ð½Ð°Ð´Ð·Ð²Ð¸Ñ‡Ð°Ð¹Ð½Ð¾Â».\n\n12. Ð Ð¾Ð·ÑˆÐ¸Ñ€ÐµÐ½Ð½Ñ Ð²Ð¸Ð±Ñ–Ñ€ÐºÐ¸ Ð¿Ñ€Ð¾Ð²ÐµÐ´ÐµÐ½Ð¾ ÐºÐ¾Ñ€ÐµÐºÑ‚Ð½Ð¾.\n    > [!error] none\n    > [!answer] âœ“\n    > [!explanation] Ð ÐµÑ‡ÐµÐ½Ð½Ñ ÐºÐ¾Ñ€ÐµÐºÑ‚Ð½Ðµ â€” Ñ‚ÐµÑ€Ð¼Ñ–Ð½Ð¸ Ñ‚Ð° ÑÐ¸Ð½Ñ‚Ð°ÐºÑÐ¸Ñ Ð²Ñ–Ð´Ð¿Ð¾Ð²Ñ–Ð´Ð°ÑŽÑ‚ÑŒ ÑÑ‚Ð°Ð½Ð´Ð°Ñ€Ñ‚Ð°Ð¼ Ð½Ð°ÑƒÐºÐ¾Ð²Ð¾Ð³Ð¾ Ð´Ð¸ÑÐºÑƒÑ€ÑÑƒ.\n\n13. Ð—Ð°ÐºÑ€Ñ–Ð¿Ð»ÐµÐ½Ð½Ñ Ð¼Ð°Ñ‚ÐµÑ€Ñ–Ð°Ð»Ñƒ **Ð² Ð¿Ñ€Ð¸Ð½Ñ†Ð¸Ð¿Ñ–** ÑƒÑÐ¿Ñ–ÑˆÐ½Ðµ.\n    > [!error] Ð² Ð¿Ñ€Ð¸Ð½Ñ†Ð¸Ð¿Ñ–\n    > [!answer] Ð·Ð°Ð³Ð°Ð»Ð¾Ð¼\n    > [!options] Ð² Ð¿Ñ€Ð¸Ð½Ñ†Ð¸Ð¿Ñ– | Ð·Ð°Ð³Ð°Ð»Ð¾Ð¼ | Ñ‚Ð¸Ð¿Ñƒ | Ð½Ñƒ\n    > [!explanation] Â«Ð’ Ð¿Ñ€Ð¸Ð½Ñ†Ð¸Ð¿Ñ–Â» ÑÑ‚Ð²Ð¾Ñ€ÑŽÑ” Ð½ÐµÐ²Ð¸Ð·Ð½Ð°Ñ‡ÐµÐ½Ñ–ÑÑ‚ÑŒ; Â«Ð·Ð°Ð³Ð°Ð»Ð¾Ð¼Â» Ñ„Ð¾Ñ€Ð¼Ð°Ð»ÑŒÐ½Ñ–ÑˆÐµ.\n\n14. Ð—Ð°ÑÑ‚Ð¾ÑÑƒÐ²Ð°Ð½Ð½Ñ Ð¼ÐµÑ‚Ð¾Ð´Ñƒ **Ð¿Ñ€ÑÐ¼ ÐµÑ„ÐµÐºÑ‚Ð¸Ð²Ð½Ðµ**.\n    > [!error] Ð¿Ñ€ÑÐ¼\n    > [!answer] Ð½Ð°Ð´Ð·Ð²Ð¸Ñ‡Ð°Ð¹Ð½Ð¾\n    > [!options] Ð¿Ñ€ÑÐ¼ | Ð½Ð°Ð´Ð·Ð²Ð¸Ñ‡Ð°Ð¹Ð½Ð¾ | Ñ€ÐµÐ°Ð»ÑŒÐ½Ð¾ | Ñ‚Ð¸Ð¿Ñƒ\n    > [!explanation] Â«ÐŸÑ€ÑÐ¼Â» â€” Ñ€Ð¾Ð·Ð¼Ð¾Ð²Ð½Ðµ; ÐºÑ€Ð°Ñ‰Ðµ Â«Ð½Ð°Ð´Ð·Ð²Ð¸Ñ‡Ð°Ð¹Ð½Ð¾Â», Â«Ð¾ÑÐ¾Ð±Ð»Ð¸Ð²Ð¾Â».\n\n15. Ð†Ð½Ñ‚ÐµÐ³Ñ€Ð°Ñ†Ñ–Ñ ÑÐ¸ÑÑ‚ÐµÐ¼ Ð·Ð´Ñ–Ð¹ÑÐ½ÐµÐ½Ð° Ð¿Ñ€Ð¾Ñ„ÐµÑÑ–Ð¹Ð½Ð¾.\n    > [!error] none\n    > [!answer] âœ“\n    > [!explanation] Ð ÐµÑ‡ÐµÐ½Ð½Ñ ÐºÐ¾Ñ€ÐµÐºÑ‚Ð½Ðµ â€” Ñ„Ð¾Ñ€Ð¼Ð°Ð»ÑŒÐ½Ð¸Ð¹ Ð½Ð°ÑƒÐºÐ¾Ð²Ð¸Ð¹ ÑÑ‚Ð¸Ð»ÑŒ.\n\n16. Ð¡Ð¸Ð½Ñ‚ÐµÐ· Ñ€ÐµÐ·ÑƒÐ»ÑŒÑ‚Ð°Ñ‚Ñ–Ð² **Ð½Ð¾Ñ€Ð¼** Ð²Ñ–Ð´Ð±ÑƒÐ²ÑÑ.\n    > [!error] Ð½Ð¾Ñ€Ð¼\n    > [!answer] Ð²Ð´Ð°Ð»Ð¾\n    > [!options] Ð½Ð¾Ñ€Ð¼ | Ð²Ð´Ð°Ð»Ð¾ | Ð¾Ðº | Ð½Ð¾Ñ€Ð¼Ð°Ð»ÑŒÐ½Ð¾\n    > [!explanation] Â«ÐÐ¾Ñ€Ð¼Â» â€” ÑÐ»ÐµÐ½Ð³Ð¾Ð²Ðµ ÑÐºÐ¾Ñ€Ð¾Ñ‡ÐµÐ½Ð½Ñ.\n\n17. ÐÐ½Ð°Ð»Ñ–Ð· Ð´Ð°Ð½Ð¸Ñ… **Ð² Ñ†Ñ–Ð»Ð¾Ð¼Ñƒ Ð¾Ðº**.\n    > [!error] Ð¾Ðº\n    > [!answer] Ð·Ð°Ð´Ð¾Ð²Ñ–Ð»ÑŒÐ½Ð¸Ð¹\n    > [!options] Ð¾Ðº | Ð·Ð°Ð´Ð¾Ð²Ñ–Ð»ÑŒÐ½Ð¸Ð¹ | Ð½Ð¾Ñ€Ð¼ | Ð½Ð¾Ñ€Ð¼Ð°Ð»ÑŒÐ½Ð¸Ð¹\n    > [!explanation] Â«ÐžÐºÂ» â€” Ð°Ð½Ð³Ð»Ñ–Ñ†Ð¸Ð·Ð¼-ÑÐ»ÐµÐ½Ð³; Ð²Ð¸ÐºÐ¾Ñ€Ð¸ÑÑ‚Ð¾Ð²ÑƒÐ¹Ñ‚Ðµ Â«Ð·Ð°Ð´Ð¾Ð²Ñ–Ð»ÑŒÐ½Ð¸Ð¹Â».\n\n18. ÐžÑ†Ñ–Ð½ÑŽÐ²Ð°Ð½Ð½Ñ Ñ€ÐµÐ·ÑƒÐ»ÑŒÑ‚Ð°Ñ‚Ñ–Ð² Ð¿Ñ€Ð¾Ð²ÐµÐ´ÐµÐ½Ð¾ Ð¾Ð±'Ñ”ÐºÑ‚Ð¸Ð²Ð½Ð¾.\n    > [!error] none\n    > [!answer] âœ“\n    > [!explanation] Ð ÐµÑ‡ÐµÐ½Ð½Ñ ÐºÐ¾Ñ€ÐµÐºÑ‚Ð½Ðµ â€” Ñ„Ð¾Ñ€Ð¼Ð°Ð»ÑŒÐ½Ð¸Ð¹ ÑÑ‚Ð¸Ð»ÑŒ Ð´Ð¾Ñ‚Ñ€Ð¸Ð¼Ð°Ð½Ð¾, Ñ€ÐµÐ³Ñ–ÑÑ‚Ñ€Ð¾Ð²Ð¸Ñ… Ð¿Ð¾Ñ€ÑƒÑˆÐµÐ½ÑŒ Ð½ÐµÐ¼Ð°Ñ”.\n\n---\n\n## cloze: ÐÐ°ÑƒÐºÐ¾Ð²Ð¸Ð¹ Ð°Ð±Ð·Ð°Ñ†\n\n> Ð—Ð°Ð¿Ð¾Ð²Ð½Ñ–Ñ‚ÑŒ Ð¿Ñ€Ð¾Ð¿ÑƒÑÐºÐ¸, Ð¾Ð±Ð¸Ñ€Ð°ÑŽÑ‡Ð¸ Ð¿Ñ€Ð°Ð²Ð¸Ð»ÑŒÐ½Ñƒ Ñ„Ð¾Ñ€Ð¼Ñƒ.\n\nÐ£ Ð´Ð¾ÑÐ»Ñ–Ð´Ð¶ÐµÐ½Ð½Ñ– [___:1] Ð¿Ð¸Ñ‚Ð°Ð½Ð½Ñ Ð¼Ð¾Ð²Ð½Ð¾Ñ— Ð¿Ð¾Ð»Ñ–Ñ‚Ð¸ÐºÐ¸ Ð² Ð£ÐºÑ€Ð°Ñ—Ð½Ñ–. ÐœÐµÑ‚Ð¾ÑŽ Ñ€Ð¾Ð±Ð¾Ñ‚Ð¸ Ñ” [___:2] Ð½Ð°ÑÐ²Ð½Ð¸Ñ… Ð¿Ñ–Ð´Ñ…Ð¾Ð´Ñ–Ð² Ð´Ð¾ Ð²Ð¸Ð²Ñ‡ÐµÐ½Ð½Ñ Ñ†Ñ–Ñ”Ñ— Ð¿Ñ€Ð¾Ð±Ð»ÐµÐ¼Ð¸. [___:3], Ñ‰Ð¾ Ñ–ÑÐ½ÑƒÑ” Ð·Ð°Ð»ÐµÐ¶Ð½Ñ–ÑÑ‚ÑŒ Ð¼Ñ–Ð¶ Ð¼Ð¾Ð²Ð½Ð¾ÑŽ Ð¿Ð¾Ð»Ñ–Ñ‚Ð¸ÐºÐ¾ÑŽ Ñ‚Ð° Ð½Ð°Ñ†Ñ–Ð¾Ð½Ð°Ð»ÑŒÐ½Ð¾ÑŽ Ñ–Ð´ÐµÐ½Ñ‚Ð¸Ñ‡Ð½Ñ–ÑÑ‚ÑŽ. Ð”Ð°Ð½Ñ– [___:4] Ð¼ÐµÑ‚Ð¾Ð´Ð¾Ð¼ ÐºÐ¾Ð½Ñ‚ÐµÐ½Ñ‚-Ð°Ð½Ð°Ð»Ñ–Ð·Ñƒ. ÐÐ° Ð¾ÑÐ½Ð¾Ð²Ñ– [___:5] Ð·Ñ€Ð¾Ð±Ð»ÐµÐ½Ð¾ Ð²Ð¸ÑÐ½Ð¾Ð²Ð¾Ðº Ð¿Ñ€Ð¾ Ð½ÐµÐ¾Ð±Ñ…Ñ–Ð´Ð½Ñ–ÑÑ‚ÑŒ [___:6] Ð¼Ð¾Ð²Ð½Ð¸Ñ… Ð¿Ñ€Ð°Ð² Ð³Ñ€Ð¾Ð¼Ð°Ð´ÑÐ½. Ð ÐµÐ·ÑƒÐ»ÑŒÑ‚Ð°Ñ‚Ð¸ Ð´Ð¾ÑÐ»Ñ–Ð´Ð¶ÐµÐ½Ð½Ñ [___:7] Ð½Ð° Ð¼Ñ–Ð¶Ð½Ð°Ñ€Ð¾Ð´Ð½Ñ–Ð¹ ÐºÐ¾Ð½Ñ„ÐµÑ€ÐµÐ½Ñ†Ñ–Ñ—. [___:8] Ð¿Ð¾Ð´Ð°Ð»ÑŒÑˆÐ¸Ñ… Ð´Ð¾ÑÐ»Ñ–Ð´Ð¶ÐµÐ½ÑŒ Ñƒ Ñ†Ñ–Ð¹ Ð³Ð°Ð»ÑƒÐ·Ñ– Ð¿Ð¾Ñ‚Ñ€ÐµÐ±ÑƒÑ” Ð´Ð¾Ð´Ð°Ñ‚ÐºÐ¾Ð²Ð¾Ð³Ð¾ Ñ„Ñ–Ð½Ð°Ð½ÑÑƒÐ²Ð°Ð½Ð½Ñ. Ð£ ÑÑ‚Ð°Ñ‚Ñ‚Ñ– [___:9] Ð½Ð¾Ð²Ñ– Ð¿Ñ–Ð´Ñ…Ð¾Ð´Ð¸ Ð´Ð¾ [___:10] Ð¼Ð¾Ð²Ð½Ð¾Ð³Ð¾ Ð·Ð°ÐºÐ¾Ð½Ð¾Ð´Ð°Ð²ÑÑ‚Ð²Ð°.\n\n1. Ñ€Ð¾Ð·Ð³Ð»ÑÐ´Ð°Ñ”Ñ‚ÑŒÑÑ | Ñ€Ð¾Ð·Ð³Ð»ÑÐ´Ð°ÑŽÑ‚ÑŒ | Ñ€Ð¾Ð·Ð³Ð»ÑÐ´Ð°Ñ”\n   > [!answer] Ñ€Ð¾Ð·Ð³Ð»ÑÐ´Ð°Ñ”Ñ‚ÑŒÑÑ\n\n2. ÑÐ¸ÑÑ‚ÐµÐ¼Ð°Ñ‚Ð¸Ð·Ð°Ñ†Ñ–Ñ | ÑÐ¸ÑÑ‚ÐµÐ¼Ð°Ñ‚Ð¸Ð·ÑƒÐ²Ð°Ð»Ð¸ | ÑÐ¸ÑÑ‚ÐµÐ¼Ð°Ñ‚Ð¸Ð·ÑƒÑ”\n   > [!answer] ÑÐ¸ÑÑ‚ÐµÐ¼Ð°Ñ‚Ð¸Ð·Ð°Ñ†Ñ–Ñ\n\n3. Ð’ÑÑ‚Ð°Ð½Ð¾Ð²Ð»ÐµÐ½Ð¾ | Ð’ÑÑ‚Ð°Ð½Ð¾Ð²Ð¸Ð»Ð¸ | Ð’ÑÑ‚Ð°Ð½Ð¾Ð²Ð»ÑŽÑ”\n   > [!answer] Ð’ÑÑ‚Ð°Ð½Ð¾Ð²Ð»ÐµÐ½Ð¾\n\n4. Ð¾Ð±Ñ€Ð¾Ð±Ð»ÐµÐ½Ð¾ | Ð¾Ð±Ñ€Ð¾Ð±Ð¸Ð»Ð¸ | Ð¾Ð±Ñ€Ð¾Ð±Ð»ÑÑ”\n   > [!answer] Ð¾Ð±Ñ€Ð¾Ð±Ð»ÐµÐ½Ð¾\n\n5. Ð°Ð½Ð°Ð»Ñ–Ð·Ñƒ | Ð°Ð½Ð°Ð»Ñ–Ð·ÑƒÐ²Ð°Ð»Ð¸ | Ð°Ð½Ð°Ð»Ñ–Ð·ÑƒÑ”\n   > [!answer] Ð°Ð½Ð°Ð»Ñ–Ð·Ñƒ\n\n6. Ð·Ð°ÐºÑ€Ñ–Ð¿Ð»ÐµÐ½Ð½Ñ | Ð·Ð°ÐºÑ€Ñ–Ð¿Ð¸Ð»Ð¸ | Ð·Ð°ÐºÑ€Ñ–Ð¿Ð»ÑŽÑ”\n   > [!answer] Ð·Ð°ÐºÑ€Ñ–Ð¿Ð»ÐµÐ½Ð½Ñ\n\n7. Ð¿Ñ€ÐµÐ´ÑÑ‚Ð°Ð²Ð»ÐµÐ½Ð¾ | Ð¿Ñ€ÐµÐ´ÑÑ‚Ð°Ð²Ð¸Ð»Ð¸ | Ð¿Ñ€ÐµÐ´ÑÑ‚Ð°Ð²Ð»ÑÑ”\n   > [!answer] Ð¿Ñ€ÐµÐ´ÑÑ‚Ð°Ð²Ð»ÐµÐ½Ð¾\n\n8. Ð Ð¾Ð·ÑˆÐ¸Ñ€ÐµÐ½Ð½Ñ | Ð Ð¾Ð·ÑˆÐ¸Ñ€Ð¸Ð»Ð¸ | Ð Ð¾Ð·ÑˆÐ¸Ñ€ÑŽÑ”\n   > [!answer] Ð Ð¾Ð·ÑˆÐ¸Ñ€ÐµÐ½Ð½Ñ\n\n9. Ð·Ð°Ð¿Ñ€Ð¾Ð¿Ð¾Ð½Ð¾Ð²Ð°Ð½Ð¾ | Ð·Ð°Ð¿Ñ€Ð¾Ð¿Ð¾Ð½ÑƒÐ²Ð°Ð»Ð¸ | Ð¿Ñ€Ð¾Ð¿Ð¾Ð½ÑƒÑ”\n   > [!answer] Ð·Ð°Ð¿Ñ€Ð¾Ð¿Ð¾Ð½Ð¾Ð²Ð°Ð½Ð¾\n\n10. Ð²Ð´Ð¾ÑÐºÐ¾Ð½Ð°Ð»ÐµÐ½Ð½Ñ | Ð²Ð´Ð¾ÑÐºÐ¾Ð½Ð°Ð»Ð¸Ð»Ð¸ | Ð²Ð´Ð¾ÑÐºÐ¾Ð½Ð°Ð»ÑŽÑ”\n    > [!answer] Ð²Ð´Ð¾ÑÐºÐ¾Ð½Ð°Ð»ÐµÐ½Ð½Ñ\n\n---\n\n## cloze: ÐžÑ„Ñ–Ñ†Ñ–Ð¹Ð½Ð¸Ð¹ Ð´Ð¾ÐºÑƒÐ¼ÐµÐ½Ñ‚\n\n> Ð—Ð°Ð¿Ð¾Ð²Ð½Ñ–Ñ‚ÑŒ Ð¿Ñ€Ð¾Ð¿ÑƒÑÐºÐ¸ Ñƒ Ð¾Ñ„Ñ–Ñ†Ñ–Ð¹Ð½Ð¾Ð¼Ñƒ Ð´Ð¾ÐºÑƒÐ¼ÐµÐ½Ñ‚Ñ–.\n\nÐÐÐšÐÐ—\n\nÐŸÑ€Ð¾ Ð·Ð°Ñ‚Ð²ÐµÑ€Ð´Ð¶ÐµÐ½Ð½Ñ Ð¿Ð»Ð°Ð½Ñƒ Ñ€Ð¾Ð±Ð¾Ñ‚Ð¸\n\nÐ£ Ð·Ð²'ÑÐ·ÐºÑƒ Ð· Ð½ÐµÐ¾Ð±Ñ…Ñ–Ð´Ð½Ñ–ÑÑ‚ÑŽ [___:1] Ð´Ñ–ÑÐ»ÑŒÐ½Ð¾ÑÑ‚Ñ– Ð²Ñ–Ð´Ð´Ñ–Ð»Ñƒ ÐÐÐšÐÐ—Ð£Ð®:\n\n1. ÐŸÐ»Ð°Ð½ Ñ€Ð¾Ð±Ð¾Ñ‚Ð¸ Ð½Ð° 2024 Ñ€Ñ–Ðº [___:2].\n2. ÐšÐ¾Ð½Ñ‚Ñ€Ð¾Ð»ÑŒ Ð·Ð° Ð²Ð¸ÐºÐ¾Ð½Ð°Ð½Ð½ÑÐ¼ [___:3] Ð½Ð° Ð·Ð°ÑÑ‚ÑƒÐ¿Ð½Ð¸ÐºÐ° Ð´Ð¸Ñ€ÐµÐºÑ‚Ð¾Ñ€Ð°.\n3. Ð¢ÐµÑ€Ð¼Ñ–Ð½Ð¸ Ð²Ð¸ÐºÐ¾Ð½Ð°Ð½Ð½Ñ [___:4] Ð´Ð¾ 31 Ð³Ñ€ÑƒÐ´Ð½Ñ 2024 Ñ€Ð¾ÐºÑƒ.\n4. Ð—Ð²Ñ–Ñ‚ Ð¿Ñ€Ð¾ Ð²Ð¸ÐºÐ¾Ð½Ð°Ð½Ð½Ñ [___:5] Ñ‰Ð¾ÐºÐ²Ð°Ñ€Ñ‚Ð°Ð»ÑŒÐ½Ð¾.\n5. [___:6] Ð´Ð¾ Ð¿Ð»Ð°Ð½Ñƒ Ð²Ð½Ð¾ÑÐ¸Ñ‚Ð¸ Ð·Ð° Ð¿Ð¾Ð³Ð¾Ð´Ð¶ÐµÐ½Ð½ÑÐ¼ Ð· ÐºÐµÑ€Ñ–Ð²Ð½Ð¸Ñ†Ñ‚Ð²Ð¾Ð¼.\n6. ÐÐ°ÐºÐ°Ð· [___:7] Ð´Ð¾ Ð²Ñ–Ð´Ð¾Ð¼Ð° Ð²ÑÑ–Ñ… Ð¿Ñ€Ð°Ñ†Ñ–Ð²Ð½Ð¸ÐºÑ–Ð².\n\nÐ”Ð¸Ñ€ÐµÐºÑ‚Ð¾Ñ€                                                    ÐŸÐµÑ‚Ñ€ÐµÐ½ÐºÐ¾ Ð†.Ðœ.\n\nÐÐ°ÐºÐ°Ð· [___:8] 01 ÑÑ–Ñ‡Ð½Ñ 2024 Ñ€Ð¾ÐºÑƒ.\n\n1. ÐºÐ¾Ð½ÑÐ¾Ð»Ñ–Ð´Ð°Ñ†Ñ–Ñ— | ÐºÐ¾Ð½ÑÐ¾Ð»Ñ–Ð´ÑƒÐ²Ð°Ð»Ð¸ | ÐºÐ¾Ð½ÑÐ¾Ð»Ñ–Ð´ÑƒÑ”\n   > [!answer] ÐºÐ¾Ð½ÑÐ¾Ð»Ñ–Ð´Ð°Ñ†Ñ–Ñ—\n\n2. Ð·Ð°Ñ‚Ð²ÐµÑ€Ð´Ð¶ÐµÐ½Ð¾ | Ð·Ð°Ñ‚Ð²ÐµÑ€Ð´Ð¸Ð»Ð¸ | Ð·Ð°Ñ‚Ð²ÐµÑ€Ð´Ð¶ÑƒÑ”\n   > [!answer] Ð·Ð°Ñ‚Ð²ÐµÑ€Ð´Ð¶ÐµÐ½Ð¾\n\n3. Ð¿Ð¾ÐºÐ»Ð°Ð´ÐµÐ½Ð¾ | Ð¿Ð¾ÐºÐ»Ð°Ð»Ð¸ | Ð¿Ð¾ÐºÐ»Ð°Ð´Ð°Ñ”\n   > [!answer] Ð¿Ð¾ÐºÐ»Ð°Ð´ÐµÐ½Ð¾\n\n4. Ð²ÑÑ‚Ð°Ð½Ð¾Ð²Ð»ÐµÐ½Ð¾ | Ð²ÑÑ‚Ð°Ð½Ð¾Ð²Ð¸Ð»Ð¸ | Ð²ÑÑ‚Ð°Ð½Ð¾Ð²Ð»ÑŽÑ”\n   > [!answer] Ð²ÑÑ‚Ð°Ð½Ð¾Ð²Ð»ÐµÐ½Ð¾\n\n5. Ð¿Ð¾Ð´Ð°Ð²Ð°Ñ‚Ð¸ | Ð¿Ð¾Ð´Ð°Ð½Ð¾ | Ð¿Ð¾Ð´Ð°Ð»Ð¸\n   > [!answer] Ð¿Ð¾Ð´Ð°Ð²Ð°Ñ‚Ð¸\n\n6. Ð—Ð¼Ñ–Ð½Ð¸ | Ð—Ð¼Ñ–Ð½ÐµÐ½Ð¾ | Ð—Ð¼Ñ–Ð½ÑŽÑŽÑ‚ÑŒ\n   > [!answer] Ð—Ð¼Ñ–Ð½Ð¸\n\n7. Ð´Ð¾Ð²ÐµÑÑ‚Ð¸ | Ð´Ð¾Ð²ÐµÐ´ÐµÐ½Ð¾ | Ð´Ð¾Ð²Ð¾Ð´ÑÑ‚ÑŒ\n   > [!answer] Ð´Ð¾Ð²ÐµÑÑ‚Ð¸\n\n8. Ð¿Ñ–Ð´Ð¿Ð¸ÑÐ°Ð½Ð¾ | Ð¿Ñ–Ð´Ð¿Ð¸ÑÐ°Ð»Ð¸ | Ð¿Ñ–Ð´Ð¿Ð¸ÑÑƒÑ”\n   > [!answer] Ð¿Ñ–Ð´Ð¿Ð¸ÑÐ°Ð½Ð¾\n\n---\n\n## cloze: ÐÐºÐ°Ð´ÐµÐ¼Ñ–Ñ‡Ð½Ð° Ð°Ð½Ð¾Ñ‚Ð°Ñ†Ñ–Ñ\n\n> Ð—Ð°Ð¿Ð¾Ð²Ð½Ñ–Ñ‚ÑŒ Ð°Ð½Ð¾Ñ‚Ð°Ñ†Ñ–ÑŽ Ð½Ð°ÑƒÐºÐ¾Ð²Ð¾Ñ— ÑÑ‚Ð°Ñ‚Ñ‚Ñ–.\n\n**ÐÐ½Ð¾Ñ‚Ð°Ñ†Ñ–Ñ**\n\nÐ”Ð¾ÑÐ»Ñ–Ð´Ð¶ÐµÐ½Ð½Ñ [___:1] Ð°ÐºÑ‚ÑƒÐ°Ð»ÑŒÐ½Ñ–Ð¹ Ð¿Ñ€Ð¾Ð±Ð»ÐµÐ¼Ñ– [___:2] Ð¼Ð¾Ð²Ð½Ð¸Ñ… Ð½Ð°Ð²Ð¸Ñ‡Ð¾Ðº Ð½Ð° Ñ€Ñ–Ð²Ð½Ñ– C1. ÐœÐµÑ‚Ð¾ÑŽ Ñ€Ð¾Ð±Ð¾Ñ‚Ð¸ Ñ” [___:3] ÐµÑ„ÐµÐºÑ‚Ð¸Ð²Ð½Ð¸Ñ… Ð¼ÐµÑ‚Ð¾Ð´Ñ–Ð² Ð½Ð°Ð²Ñ‡Ð°Ð½Ð½Ñ. Ð£ ÑÑ‚Ð°Ñ‚Ñ‚Ñ– [___:4] Ñ€ÐµÐ·ÑƒÐ»ÑŒÑ‚Ð°Ñ‚Ð¸ ÐµÐºÑÐ¿ÐµÑ€Ð¸Ð¼ÐµÐ½Ñ‚Ñƒ, Ñ‰Ð¾ [___:5] Ð¿Ñ€Ð¾Ñ‚ÑÐ³Ð¾Ð¼ Ñ€Ð¾ÐºÑƒ. [___:6], Ñ‰Ð¾ ÐºÐ¾Ð¼Ð¿Ð»ÐµÐºÑÐ½Ð¸Ð¹ Ð¿Ñ–Ð´Ñ…Ñ–Ð´ ÑÐ¿Ñ€Ð¸ÑÑ” [___:7] Ð°ÐºÐ°Ð´ÐµÐ¼Ñ–Ñ‡Ð½Ð¸Ñ… ÐºÐ¾Ð¼Ð¿ÐµÑ‚ÐµÐ½Ñ†Ñ–Ð¹. ÐÐ° Ð¾ÑÐ½Ð¾Ð²Ñ– [___:8] [___:9] Ñ€ÐµÐºÐ¾Ð¼ÐµÐ½Ð´Ð°Ñ†Ñ–Ñ— Ð´Ð»Ñ Ð²Ð¸ÐºÐ»Ð°Ð´Ð°Ñ‡Ñ–Ð². ÐŸÑ€Ð°ÐºÑ‚Ð¸Ñ‡Ð½Ðµ [___:10] Ñ€ÐµÐ·ÑƒÐ»ÑŒÑ‚Ð°Ñ‚Ñ–Ð² Ð¼Ð¾Ð¶Ð»Ð¸Ð²Ðµ Ñƒ Ð²Ð¸Ñ‰Ð¸Ñ… Ð½Ð°Ð²Ñ‡Ð°Ð»ÑŒÐ½Ð¸Ñ… Ð·Ð°ÐºÐ»Ð°Ð´Ð°Ñ….\n\n*ÐšÐ»ÑŽÑ‡Ð¾Ð²Ñ– ÑÐ»Ð¾Ð²Ð°: [___:11], Ð¿Ð¾Ð³Ð»Ð¸Ð±Ð»ÐµÐ½Ð½Ñ, Ð¿ÐµÑ€ÐµÑ…Ñ–Ð´, Ð°ÐºÐ°Ð´ÐµÐ¼Ñ–Ñ‡Ð½Ð¸Ð¹ Ñ€Ñ–Ð²ÐµÐ½ÑŒ.*\n\n1. Ð¿Ñ€Ð¸ÑÐ²ÑÑ‡ÐµÐ½Ð¾ | Ð¿Ñ€Ð¸ÑÐ²ÑÑ‚Ð¸Ð»Ð¸ | Ð¿Ñ€Ð¸ÑÐ²ÑÑ‡ÑƒÑ”\n   > [!answer] Ð¿Ñ€Ð¸ÑÐ²ÑÑ‡ÐµÐ½Ð¾\n\n2. Ð¾Ð¿Ð°Ð½ÑƒÐ²Ð°Ð½Ð½Ñ | Ð¾Ð¿Ð°Ð½ÑƒÐ²Ð°Ð»Ð¸ | Ð¾Ð¿Ð°Ð½Ð¾Ð²ÑƒÑ”\n   > [!answer] Ð¾Ð¿Ð°Ð½ÑƒÐ²Ð°Ð½Ð½Ñ\n\n3. Ð°Ð½Ð°Ð»Ñ–Ð· | Ð°Ð½Ð°Ð»Ñ–Ð·ÑƒÐ²Ð°Ð»Ð¸ | Ð°Ð½Ð°Ð»Ñ–Ð·ÑƒÑ”\n   > [!answer] Ð°Ð½Ð°Ð»Ñ–Ð·\n\n4. Ð¿Ñ€ÐµÐ´ÑÑ‚Ð°Ð²Ð»ÐµÐ½Ð¾ | Ð¿Ñ€ÐµÐ´ÑÑ‚Ð°Ð²Ð¸Ð»Ð¸ | Ð¿Ñ€ÐµÐ´ÑÑ‚Ð°Ð²Ð»ÑÑ”\n   > [!answer] Ð¿Ñ€ÐµÐ´ÑÑ‚Ð°Ð²Ð»ÐµÐ½Ð¾\n\n5. Ð¿Ñ€Ð¾Ð²Ð¾Ð´Ð¸Ð»Ð¾ÑÑ | Ð¿Ñ€Ð¾Ð²ÐµÐ»Ð¸ | Ð¿Ñ€Ð¾Ð²Ð¾Ð´ÑÑ‚ÑŒ\n   > [!answer] Ð¿Ñ€Ð¾Ð²Ð¾Ð´Ð¸Ð»Ð¾ÑÑ\n\n6. Ð’ÑÑ‚Ð°Ð½Ð¾Ð²Ð»ÐµÐ½Ð¾ | Ð’ÑÑ‚Ð°Ð½Ð¾Ð²Ð¸Ð»Ð¸ | Ð’ÑÑ‚Ð°Ð½Ð¾Ð²Ð»ÑŽÑŽÑ‚ÑŒ\n   > [!answer] Ð’ÑÑ‚Ð°Ð½Ð¾Ð²Ð»ÐµÐ½Ð¾\n\n7. Ð²Ð´Ð¾ÑÐºÐ¾Ð½Ð°Ð»ÐµÐ½Ð½ÑŽ | Ð²Ð´Ð¾ÑÐºÐ¾Ð½Ð°Ð»Ð¸Ð»Ð¸ | Ð²Ð´Ð¾ÑÐºÐ¾Ð½Ð°Ð»ÑŽÑ”\n   > [!answer] Ð²Ð´Ð¾ÑÐºÐ¾Ð½Ð°Ð»ÐµÐ½Ð½ÑŽ\n\n8. Ð¾Ñ†Ñ–Ð½ÑŽÐ²Ð°Ð½Ð½Ñ | Ð¾Ñ†Ñ–Ð½ÑŽÐ²Ð°Ð»Ð¸ | Ð¾Ñ†Ñ–Ð½ÑŽÑ”\n   > [!answer] Ð¾Ñ†Ñ–Ð½ÑŽÐ²Ð°Ð½Ð½Ñ\n\n9. ÑÑ„Ð¾Ñ€Ð¼ÑƒÐ»ÑŒÐ¾Ð²Ð°Ð½Ð¾ | ÑÑ„Ð¾Ñ€Ð¼ÑƒÐ»ÑŽÐ²Ð°Ð»Ð¸ | Ñ„Ð¾Ñ€Ð¼ÑƒÐ»ÑŽÑ”\n   > [!answer] ÑÑ„Ð¾Ñ€Ð¼ÑƒÐ»ÑŒÐ¾Ð²Ð°Ð½Ð¾\n\n10. Ð·Ð°ÑÑ‚Ð¾ÑÑƒÐ²Ð°Ð½Ð½Ñ | Ð·Ð°ÑÑ‚Ð¾ÑÑƒÐ²Ð°Ð»Ð¸ | Ð·Ð°ÑÑ‚Ð¾ÑÐ¾Ð²ÑƒÑ”\n    > [!answer] Ð·Ð°ÑÑ‚Ð¾ÑÑƒÐ²Ð°Ð½Ð½Ñ\n\n11. ÐºÐ¾Ð½ÑÐ¾Ð»Ñ–Ð´Ð°Ñ†Ñ–Ñ | ÐºÐ¾Ð½ÑÐ¾Ð»Ñ–Ð´ÑƒÐ²Ð°Ð»Ð¸ | ÐºÐ¾Ð½ÑÐ¾Ð»Ñ–Ð´ÑƒÑ”\n    > [!answer] ÐºÐ¾Ð½ÑÐ¾Ð»Ñ–Ð´Ð°Ñ†Ñ–Ñ\n\n---\n\n## unjumble: ÐÐ°ÑƒÐºÐ¾Ð²Ñ– Ñ€ÐµÑ‡ÐµÐ½Ð½Ñ\n\n> Ð Ð¾Ð·Ñ‚Ð°ÑˆÑƒÐ¹Ñ‚Ðµ ÑÐ»Ð¾Ð²Ð° Ñƒ Ð¿Ñ€Ð°Ð²Ð¸Ð»ÑŒÐ½Ð¾Ð¼Ñƒ Ð¿Ð¾Ñ€ÑÐ´ÐºÑƒ.\n\n1. Ð±ÑƒÐ»Ð¾ / Ð´Ð¾ÑÐ»Ñ–Ð´Ð¶ÐµÐ½Ð½Ñ / ÑƒÑÐ¿Ñ–ÑˆÐ½Ð¾ / Ð¿Ñ€Ð¾Ð²ÐµÐ´ÐµÐ½Ð¾\n   > [!answer] Ð”Ð¾ÑÐ»Ñ–Ð´Ð¶ÐµÐ½Ð½Ñ Ð±ÑƒÐ»Ð¾ Ð¿Ñ€Ð¾Ð²ÐµÐ´ÐµÐ½Ð¾ ÑƒÑÐ¿Ñ–ÑˆÐ½Ð¾\n   > (The research was conducted successfully.) [4 words]\n\n2. Ñ€ÐµÐ·ÑƒÐ»ÑŒÑ‚Ð°Ñ‚Ð¸ / Ð¾Ð¿ÑƒÐ±Ð»Ñ–ÐºÐ¾Ð²Ð°Ð½Ð¾ / Ð² / Ð¶ÑƒÑ€Ð½Ð°Ð»Ñ– / Ð½Ð°ÑƒÐºÐ¾Ð²Ð¾Ð¼Ñƒ\n   > [!answer] Ð ÐµÐ·ÑƒÐ»ÑŒÑ‚Ð°Ñ‚Ð¸ Ð¾Ð¿ÑƒÐ±Ð»Ñ–ÐºÐ¾Ð²Ð°Ð½Ð¾ Ð² Ð½Ð°ÑƒÐºÐ¾Ð²Ð¾Ð¼Ñƒ Ð¶ÑƒÑ€Ð½Ð°Ð»Ñ–\n   > (The results were published in a scientific journal.) [5 words]\n\n3. Ð¼ÐµÑ‚Ð¾Ð´Ð¾Ð»Ð¾Ð³Ñ–ÑŽ / Ð±ÑƒÐ»Ð¾ / Ð·Ð°ÑÑ‚Ð¾ÑÐ¾Ð²Ð°Ð½Ð¾ / Ð½Ð¾Ð²Ñƒ\n   > [!answer] Ð‘ÑƒÐ»Ð¾ Ð·Ð°ÑÑ‚Ð¾ÑÐ¾Ð²Ð°Ð½Ð¾ Ð½Ð¾Ð²Ñƒ Ð¼ÐµÑ‚Ð¾Ð´Ð¾Ð»Ð¾Ð³Ñ–ÑŽ\n   > (A new methodology was applied.) [4 words]\n\n4. ÑÑ‚Ð°Ñ‚Ñ‚Ñ– / Ñƒ / Ñ€Ð¾Ð·Ð³Ð»ÑÐ´Ð°Ñ”Ñ‚ÑŒÑÑ / Ð¿Ñ€Ð¾Ð±Ð»ÐµÐ¼Ð° / Ð²Ð°Ð¶Ð»Ð¸Ð²Ð°\n   > [!answer] Ð£ ÑÑ‚Ð°Ñ‚Ñ‚Ñ– Ñ€Ð¾Ð·Ð³Ð»ÑÐ´Ð°Ñ”Ñ‚ÑŒÑÑ Ð²Ð°Ð¶Ð»Ð¸Ð²Ð° Ð¿Ñ€Ð¾Ð±Ð»ÐµÐ¼Ð°\n   > (An important problem is examined in the article.) [5 words]\n\n5. Ð´Ð°Ð½Ð¸Ñ… / Ð½Ð° / Ð¿Ñ€Ð¾Ð²ÐµÐ´ÐµÐ½Ð¾ / Ð¾ÑÐ½Ð¾Ð²Ñ– / Ð°Ð½Ð°Ð»Ñ–Ð·\n   > [!answer] ÐÐ° Ð¾ÑÐ½Ð¾Ð²Ñ– Ð´Ð°Ð½Ð¸Ñ… Ð¿Ñ€Ð¾Ð²ÐµÐ´ÐµÐ½Ð¾ Ð°Ð½Ð°Ð»Ñ–Ð·\n   > (Analysis was conducted based on the data.) [5 words]\n\n6. Ð²ÑÑ‚Ð°Ð½Ð¾Ð²Ð»ÐµÐ½Ð¾ / Ñ‰Ð¾ / Ð·Ð°Ð»ÐµÐ¶Ð½Ñ–ÑÑ‚ÑŒ / Ñ–ÑÐ½ÑƒÑ” / Ð±ÑƒÐ»Ð¾\n   > [!answer] Ð‘ÑƒÐ»Ð¾ Ð²ÑÑ‚Ð°Ð½Ð¾Ð²Ð»ÐµÐ½Ð¾, Ñ‰Ð¾ Ñ–ÑÐ½ÑƒÑ” Ð·Ð°Ð»ÐµÐ¶Ð½Ñ–ÑÑ‚ÑŒ\n   > (It was established that a correlation exists.) [5 words]\n\n7. ÑÐ¸ÑÑ‚ÐµÐ¼Ð°Ñ‚Ð¸Ð·Ð°Ñ†Ñ–ÑŽ / Ð·Ð´Ñ–Ð¹ÑÐ½ÐµÐ½Ð¾ / Ð¼Ð°Ñ‚ÐµÑ€Ñ–Ð°Ð»Ñƒ / Ð¿Ð¾Ð²Ð½Ñƒ\n   > [!answer] Ð—Ð´Ñ–Ð¹ÑÐ½ÐµÐ½Ð¾ Ð¿Ð¾Ð²Ð½Ñƒ ÑÐ¸ÑÑ‚ÐµÐ¼Ð°Ñ‚Ð¸Ð·Ð°Ñ†Ñ–ÑŽ Ð¼Ð°Ñ‚ÐµÑ€Ñ–Ð°Ð»Ñƒ\n   > (A complete systematization of the material was carried out.) [4 words]\n\n8. Ð¼ÐµÑ‚Ð¾Ð´ / ÐµÑ„ÐµÐºÑ‚Ð¸Ð²Ð½Ð¸Ð¼ / Ð²Ð¸ÑÐ²Ð¸Ð²ÑÑ / Ð·Ð°Ð¿Ñ€Ð¾Ð¿Ð¾Ð½Ð¾Ð²Ð°Ð½Ð¸Ð¹\n   > [!answer] Ð—Ð°Ð¿Ñ€Ð¾Ð¿Ð¾Ð½Ð¾Ð²Ð°Ð½Ð¸Ð¹ Ð¼ÐµÑ‚Ð¾Ð´ Ð²Ð¸ÑÐ²Ð¸Ð²ÑÑ ÐµÑ„ÐµÐºÑ‚Ð¸Ð²Ð½Ð¸Ð¼\n   > (The proposed method proved to be effective.) [4 words]\n\n9. ÐºÐ¾Ð½ÑÐ¾Ð»Ñ–Ð´Ð°Ñ†Ñ–Ñ / Ð·Ð½Ð°Ð½ÑŒ / Ð´Ð»Ñ / Ð²Ð°Ð¶Ð»Ð¸Ð²Ð° / Ð¿Ñ€Ð¾ÑÑƒÐ½ÑƒÑ‚Ð¾Ð³Ð¾ / Ñ€Ñ–Ð²Ð½Ñ\n   > [!answer] ÐšÐ¾Ð½ÑÐ¾Ð»Ñ–Ð´Ð°Ñ†Ñ–Ñ Ð·Ð½Ð°Ð½ÑŒ Ð²Ð°Ð¶Ð»Ð¸Ð²Ð° Ð´Ð»Ñ Ð¿Ñ€Ð¾ÑÑƒÐ½ÑƒÑ‚Ð¾Ð³Ð¾ Ñ€Ñ–Ð²Ð½Ñ\n   > (Consolidation of knowledge is important for the advanced level.) [6 words]\n\n10. Ð¿Ð¾Ð³Ð»Ð¸Ð±Ð»ÐµÐ½Ð½Ñ / ÑÐ¿Ñ€Ð¸ÑÑ” / Ð¿Ñ€Ð°ÐºÑ‚Ð¸ÐºÐ° / Ñ€Ð¾Ð·ÑƒÐ¼Ñ–Ð½Ð½Ñ / Ð¿Ð¾ÑÑ‚Ñ–Ð¹Ð½Ð°\n    > [!answer] ÐŸÐ¾ÑÑ‚Ñ–Ð¹Ð½Ð° Ð¿Ñ€Ð°ÐºÑ‚Ð¸ÐºÐ° ÑÐ¿Ñ€Ð¸ÑÑ” Ð¿Ð¾Ð³Ð»Ð¸Ð±Ð»ÐµÐ½Ð½ÑŽ Ñ€Ð¾Ð·ÑƒÐ¼Ñ–Ð½Ð½Ñ\n    > (Constant practice contributes to deepening understanding.) [5 words]\n\n11. Ð¿ÐµÑ€ÐµÑ…Ñ–Ð´ / Ñ€Ñ–Ð²Ð½Ñ / Ð¿Ð¾Ñ‚Ñ€ÐµÐ±ÑƒÑ” / Ð´Ð¾ / Ð½Ð°ÑÑ‚ÑƒÐ¿Ð½Ð¾Ð³Ð¾ / Ð¿Ñ–Ð´Ð³Ð¾Ñ‚Ð¾Ð²ÐºÐ¸\n    > [!answer] ÐŸÐµÑ€ÐµÑ…Ñ–Ð´ Ð´Ð¾ Ð½Ð°ÑÑ‚ÑƒÐ¿Ð½Ð¾Ð³Ð¾ Ñ€Ñ–Ð²Ð½Ñ Ð¿Ð¾Ñ‚Ñ€ÐµÐ±ÑƒÑ” Ð¿Ñ–Ð´Ð³Ð¾Ñ‚Ð¾Ð²ÐºÐ¸\n    > (Transition to the next level requires preparation.) [5 words]\n\n12. Ð°ÐºÐ°Ð´ÐµÐ¼Ñ–Ñ‡Ð½Ð¸Ð¹ / Ð²Ð¸Ð¼Ð°Ð³Ð°Ñ” / ÑÑ‚Ð¸Ð»ÑŒ / Ñ‚Ð¾Ñ‡Ð½Ð¾ÑÑ‚Ñ– / Ð»ÐµÐºÑÐ¸Ñ‡Ð½Ð¾Ñ—\n    > [!answer] ÐÐºÐ°Ð´ÐµÐ¼Ñ–Ñ‡Ð½Ð¸Ð¹ ÑÑ‚Ð¸Ð»ÑŒ Ð²Ð¸Ð¼Ð°Ð³Ð°Ñ” Ð»ÐµÐºÑÐ¸Ñ‡Ð½Ð¾Ñ— Ñ‚Ð¾Ñ‡Ð½Ð¾ÑÑ‚Ñ–\n    > (Academic style requires lexical precision.) [4 words]\n\n13. Ð±ÑƒÐ»Ð¾ / Ð·Ð°ÐºÑ€Ñ–Ð¿Ð»ÐµÐ½Ð½Ñ / Ð¿Ñ€Ð¾Ð²ÐµÐ´ÐµÐ½Ð¾ / Ð¼Ð°Ñ‚ÐµÑ€Ñ–Ð°Ð»Ñƒ / ÐµÑ„ÐµÐºÑ‚Ð¸Ð²Ð½Ð¾\n    > [!answer] Ð—Ð°ÐºÑ€Ñ–Ð¿Ð»ÐµÐ½Ð½Ñ Ð¼Ð°Ñ‚ÐµÑ€Ñ–Ð°Ð»Ñƒ Ð±ÑƒÐ»Ð¾ Ð¿Ñ€Ð¾Ð²ÐµÐ´ÐµÐ½Ð¾ ÐµÑ„ÐµÐºÑ‚Ð¸Ð²Ð½Ð¾\n    > (Reinforcement of the material was conducted effectively.) [5 words]\n\n14. Ð·Ð°ÑÑ‚Ð¾ÑÑƒÐ²Ð°Ð½Ð½Ñ / Ð¿Ð¾ÐºÐ°Ð·Ð°Ð»Ð¾ / Ð¼ÐµÑ‚Ð¾Ð´Ñƒ / Ð½Ð¾Ð²Ð¾Ð³Ð¾ / Ñ€ÐµÐ·ÑƒÐ»ÑŒÑ‚Ð°Ñ‚Ð¸ / Ñ…Ð¾Ñ€Ð¾ÑˆÑ–\n    > [!answer] Ð—Ð°ÑÑ‚Ð¾ÑÑƒÐ²Ð°Ð½Ð½Ñ Ð½Ð¾Ð²Ð¾Ð³Ð¾ Ð¼ÐµÑ‚Ð¾Ð´Ñƒ Ð¿Ð¾ÐºÐ°Ð·Ð°Ð»Ð¾ Ñ…Ð¾Ñ€Ð¾ÑˆÑ– Ñ€ÐµÐ·ÑƒÐ»ÑŒÑ‚Ð°Ñ‚Ð¸\n    > (Application of the new method showed good results.) [6 words]\n\n15. Ñ–Ð½Ñ‚ÐµÐ³Ñ€Ð°Ñ†Ñ–Ñ / Ð´Ð°Ð½Ð¸Ñ… / Ð·Ð°Ð²ÐµÑ€ÑˆÐµÐ½Ð° / ÑƒÑÐ¿Ñ–ÑˆÐ½Ð¾ / Ð±ÑƒÐ»Ð°\n    > [!answer] Ð†Ð½Ñ‚ÐµÐ³Ñ€Ð°Ñ†Ñ–Ñ Ð´Ð°Ð½Ð¸Ñ… Ð±ÑƒÐ»Ð° ÑƒÑÐ¿Ñ–ÑˆÐ½Ð¾ Ð·Ð°Ð²ÐµÑ€ÑˆÐµÐ½Ð°\n    > (Data integration was successfully completed.) [5 words]\n\n16. ÑÐ¸Ð½Ñ‚ÐµÐ· / Ñ€ÐµÐ·ÑƒÐ»ÑŒÑ‚Ð°Ñ‚Ñ–Ð² / Ð½Ð° / Ð·Ð´Ñ–Ð¹ÑÐ½ÐµÐ½Ð¾ / Ð¾ÑÐ½Ð¾Ð²Ñ– / Ð°Ð½Ð°Ð»Ñ–Ð·Ñƒ\n    > [!answer] Ð¡Ð¸Ð½Ñ‚ÐµÐ· Ñ€ÐµÐ·ÑƒÐ»ÑŒÑ‚Ð°Ñ‚Ñ–Ð² Ð·Ð´Ñ–Ð¹ÑÐ½ÐµÐ½Ð¾ Ð½Ð° Ð¾ÑÐ½Ð¾Ð²Ñ– Ð°Ð½Ð°Ð»Ñ–Ð·Ñƒ\n    > (Synthesis of results was carried out based on the analysis.) [6 words]\n\n17. Ð¾Ñ†Ñ–Ð½ÑŽÐ²Ð°Ð½Ð½Ñ / Ð¾Ð±'Ñ”ÐºÑ‚Ð¸Ð²Ð½Ðµ / Ð¿Ñ€Ð¾Ð²ÐµÐ´ÐµÐ½Ð¾ / Ð±ÑƒÐ»Ð¾ / Ñ€ÐµÐ·ÑƒÐ»ÑŒÑ‚Ð°Ñ‚Ñ–Ð²\n    > [!answer] Ð‘ÑƒÐ»Ð¾ Ð¿Ñ€Ð¾Ð²ÐµÐ´ÐµÐ½Ð¾ Ð¾Ð±'Ñ”ÐºÑ‚Ð¸Ð²Ð½Ðµ Ð¾Ñ†Ñ–Ð½ÑŽÐ²Ð°Ð½Ð½Ñ Ñ€ÐµÐ·ÑƒÐ»ÑŒÑ‚Ð°Ñ‚Ñ–Ð²\n    > (An objective assessment of the results was conducted.) [5 words]\n\n18. ÐºÐ¾Ð¼Ð¿ÐµÑ‚ÐµÐ½Ñ†Ñ–Ð¹ / Ð´Ð»Ñ / Ñ€Ð¾Ð·ÑˆÐ¸Ñ€ÐµÐ½Ð½Ñ / Ð½ÐµÐ¾Ð±Ñ…Ñ–Ð´Ð½Ð° / Ð¿Ñ€Ð°ÐºÑ‚Ð¸ÐºÐ° / Ð¿Ð¾ÑÑ‚Ñ–Ð¹Ð½Ð°\n    > [!answer] Ð”Ð»Ñ Ñ€Ð¾Ð·ÑˆÐ¸Ñ€ÐµÐ½Ð½Ñ ÐºÐ¾Ð¼Ð¿ÐµÑ‚ÐµÐ½Ñ†Ñ–Ð¹ Ð½ÐµÐ¾Ð±Ñ…Ñ–Ð´Ð½Ð° Ð¿Ð¾ÑÑ‚Ñ–Ð¹Ð½Ð° Ð¿Ñ€Ð°ÐºÑ‚Ð¸ÐºÐ°\n    > (Constant practice is necessary for expanding competencies.) [5 words]\n\n---\n\n## unjumble: ÐžÑ„Ñ–Ñ†Ñ–Ð¹Ð½Ñ– Ñ„Ð¾Ñ€Ð¼ÑƒÐ»ÑŽÐ²Ð°Ð½Ð½Ñ\n\n> Ð Ð¾Ð·Ñ‚Ð°ÑˆÑƒÐ¹Ñ‚Ðµ ÑÐ»Ð¾Ð²Ð° Ñƒ Ð¿Ñ€Ð°Ð²Ð¸Ð»ÑŒÐ½Ð¾Ð¼Ñƒ Ð¿Ð¾Ñ€ÑÐ´ÐºÑƒ Ð´Ð»Ñ Ð¾Ñ„Ñ–Ñ†Ñ–Ð¹Ð½Ð¾Ð³Ð¾ Ð´Ð¾ÐºÑƒÐ¼ÐµÐ½Ñ‚Ð°.\n\n1. Ñ€Ñ–ÑˆÐµÐ½Ð½Ñ / ÑƒÑ…Ð²Ð°Ð»ÐµÐ½Ð¾ / Ð¾Ð´Ð½Ð¾Ð³Ð¾Ð»Ð¾ÑÐ½Ð¾ / Ð±ÑƒÐ»Ð¾\n   > [!answer] Ð Ñ–ÑˆÐµÐ½Ð½Ñ Ð±ÑƒÐ»Ð¾ ÑƒÑ…Ð²Ð°Ð»ÐµÐ½Ð¾ Ð¾Ð´Ð½Ð¾Ð³Ð¾Ð»Ð¾ÑÐ½Ð¾\n   > (The decision was adopted unanimously.) [4 words]\n\n2. Ð´Ð¸Ñ€ÐµÐºÑ‚Ð¾Ñ€Ð¾Ð¼ / Ð½Ð°ÐºÐ°Ð· / Ð¿Ñ–Ð´Ð¿Ð¸ÑÐ°Ð½Ð¾\n   > [!answer] ÐÐ°ÐºÐ°Ð· Ð¿Ñ–Ð´Ð¿Ð¸ÑÐ°Ð½Ð¾ Ð´Ð¸Ñ€ÐµÐºÑ‚Ð¾Ñ€Ð¾Ð¼\n   > (The order was signed by the director.) [3 words]\n\n3. Ð·Ð°ÑÐ²Ñƒ / Ñ€Ð¾Ð·Ð³Ð»ÑÐ½ÑƒÑ‚Ð¾ / ÐºÐ¾Ð¼Ñ–ÑÑ–Ñ”ÑŽ / Ð±ÑƒÐ»Ð¾\n   > [!answer] Ð—Ð°ÑÐ²Ñƒ Ð±ÑƒÐ»Ð¾ Ñ€Ð¾Ð·Ð³Ð»ÑÐ½ÑƒÑ‚Ð¾ ÐºÐ¾Ð¼Ñ–ÑÑ–Ñ”ÑŽ\n   > (The application was reviewed by the commission.) [4 words]\n\n4. Ð´Ð¾ÐºÑƒÐ¼ÐµÐ½Ñ‚Ð¸ / Ñ‚ÐµÑ€Ð¼Ñ–Ð½Ð¾Ð²Ð¾ / Ð¿Ð¾Ð´Ð°Ð½Ð¾ / ÑƒÑÑ–\n   > [!answer] Ð£ÑÑ– Ð´Ð¾ÐºÑƒÐ¼ÐµÐ½Ñ‚Ð¸ Ð¿Ð¾Ð´Ð°Ð½Ð¾ Ñ‚ÐµÑ€Ð¼Ñ–Ð½Ð¾Ð²Ð¾\n   > (All documents were submitted urgently.) [4 words]\n\n5. Ð·Ð°Ñ‚Ð²ÐµÑ€Ð´Ð¶ÐµÐ½Ð¾ / Ð¿Ð»Ð°Ð½ / Ñ€Ð¾Ð±Ð¾Ñ‚Ð¸ / Ñ€Ñ–Ñ‡Ð½Ð¸Ð¹\n   > [!answer] Ð—Ð°Ñ‚Ð²ÐµÑ€Ð´Ð¶ÐµÐ½Ð¾ Ñ€Ñ–Ñ‡Ð½Ð¸Ð¹ Ð¿Ð»Ð°Ð½ Ñ€Ð¾Ð±Ð¾Ñ‚Ð¸\n   > (The annual work plan was approved.) [4 words]\n\n6. Ð¿Ð¾ÐºÐ»Ð°Ð´ÐµÐ½Ð¾ / ÐºÐ¾Ð½Ñ‚Ñ€Ð¾Ð»ÑŒ / Ð½Ð° / Ð·Ð°ÑÑ‚ÑƒÐ¿Ð½Ð¸ÐºÐ°\n   > [!answer] ÐšÐ¾Ð½Ñ‚Ñ€Ð¾Ð»ÑŒ Ð¿Ð¾ÐºÐ»Ð°Ð´ÐµÐ½Ð¾ Ð½Ð° Ð·Ð°ÑÑ‚ÑƒÐ¿Ð½Ð¸ÐºÐ°\n   > (Control was assigned to the deputy.) [4 words]\n\n7. Ð²ÑÑ‚Ð°Ð½Ð¾Ð²Ð»ÐµÐ½Ð¾ / Ð²Ð¸ÐºÐ¾Ð½Ð°Ð½Ð½Ñ / Ñ‚ÐµÑ€Ð¼Ñ–Ð½Ð¸\n   > [!answer] Ð¢ÐµÑ€Ð¼Ñ–Ð½Ð¸ Ð²Ð¸ÐºÐ¾Ð½Ð°Ð½Ð½Ñ Ð²ÑÑ‚Ð°Ð½Ð¾Ð²Ð»ÐµÐ½Ð¾\n   > (Deadlines for completion were set.) [3 words]\n\n8. Ð·Ð²Ñ–Ñ‚ / Ð¿Ð¾Ð´Ð°Ñ‚Ð¸ / Ð½ÐµÐ¾Ð±Ñ…Ñ–Ð´Ð½Ð¾ / Ð´Ð¾ / ÐºÑ–Ð½Ñ†Ñ / Ð¼Ñ–ÑÑÑ†Ñ\n   > [!answer] Ð—Ð²Ñ–Ñ‚ Ð½ÐµÐ¾Ð±Ñ…Ñ–Ð´Ð½Ð¾ Ð¿Ð¾Ð´Ð°Ñ‚Ð¸ Ð´Ð¾ ÐºÑ–Ð½Ñ†Ñ Ð¼Ñ–ÑÑÑ†Ñ\n   > (The report must be submitted by the end of the month.) [6 words]\n\n9. Ð¿Ñ€Ð¾Ñ‚Ð¾ÐºÐ¾Ð» / Ð·Ð°ÑÑ–Ð´Ð°Ð½Ð½Ñ / Ð¿Ñ–Ð´Ð¿Ð¸ÑÐ°Ð½Ð¾ / ÑƒÑÑ–Ð¼Ð° / ÑƒÑ‡Ð°ÑÐ½Ð¸ÐºÐ°Ð¼Ð¸\n   > [!answer] ÐŸÑ€Ð¾Ñ‚Ð¾ÐºÐ¾Ð» Ð·Ð°ÑÑ–Ð´Ð°Ð½Ð½Ñ Ð¿Ñ–Ð´Ð¿Ð¸ÑÐ°Ð½Ð¾ ÑƒÑÑ–Ð¼Ð° ÑƒÑ‡Ð°ÑÐ½Ð¸ÐºÐ°Ð¼Ð¸\n   > (The meeting minutes were signed by all participants.) [5 words]\n\n10. Ð·Ð°Ð¿Ñ€Ð¾Ð²Ð°Ð´Ð¶ÐµÐ½Ð¾ / Ð½Ð¾Ð²Ñ– / Ð¿Ñ€Ð°Ð²Ð¸Ð»Ð° / Ñ€Ð¾Ð±Ð¾Ñ‚Ð¸\n    > [!answer] Ð—Ð°Ð¿Ñ€Ð¾Ð²Ð°Ð´Ð¶ÐµÐ½Ð¾ Ð½Ð¾Ð²Ñ– Ð¿Ñ€Ð°Ð²Ð¸Ð»Ð° Ñ€Ð¾Ð±Ð¾Ñ‚Ð¸\n    > (New work rules were introduced.) [4 words]\n\n11. Ð²Ð¸ÐºÐ¾Ð½Ð°Ð½Ð¾ / Ð·Ð°Ð²Ð´Ð°Ð½Ð½Ñ / Ð²Ñ‡Ð°ÑÐ½Ð¾ / Ð±ÑƒÐ»Ð¾\n    > [!answer] Ð—Ð°Ð²Ð´Ð°Ð½Ð½Ñ Ð±ÑƒÐ»Ð¾ Ð²Ð¸ÐºÐ¾Ð½Ð°Ð½Ð¾ Ð²Ñ‡Ð°ÑÐ½Ð¾\n    > (The task was completed on time.) [4 words]\n\n12. Ð¿Ñ€Ð¸Ð·Ð½Ð°Ñ‡ÐµÐ½Ð¾ / Ð²Ñ–Ð´Ð¿Ð¾Ð²Ñ–Ð´Ð°Ð»ÑŒÐ½Ð¾Ð³Ð¾ / Ð·Ð° / Ð¿Ñ€Ð¾Ñ”ÐºÑ‚\n    > [!answer] ÐŸÑ€Ð¸Ð·Ð½Ð°Ñ‡ÐµÐ½Ð¾ Ð²Ñ–Ð´Ð¿Ð¾Ð²Ñ–Ð´Ð°Ð»ÑŒÐ½Ð¾Ð³Ð¾ Ð·Ð° Ð¿Ñ€Ð¾Ñ”ÐºÑ‚\n    > (A person responsible for the project was appointed.) [4 words]\n\n13. Ð¿ÐµÑ€ÐµÐ²Ñ–Ñ€ÐºÑƒ / Ð¿Ñ€Ð¾Ð²ÐµÐ´ÐµÐ½Ð¾ / Ð´Ð¾ÐºÑƒÐ¼ÐµÐ½Ñ‚Ñ–Ð²\n    > [!answer] ÐŸÑ€Ð¾Ð²ÐµÐ´ÐµÐ½Ð¾ Ð¿ÐµÑ€ÐµÐ²Ñ–Ñ€ÐºÑƒ Ð´Ð¾ÐºÑƒÐ¼ÐµÐ½Ñ‚Ñ–Ð²\n    > (Document verification was conducted.) [3 words]\n\n14. ÑÑ…Ð²Ð°Ð»ÐµÐ½Ð¾ / Ð¿Ñ€Ð¾Ð¿Ð¾Ð·Ð¸Ñ†Ñ–ÑŽ / Ð±Ñ–Ð»ÑŒÑˆÑ–ÑÑ‚ÑŽ / Ð³Ð¾Ð»Ð¾ÑÑ–Ð²\n    > [!answer] ÐŸÑ€Ð¾Ð¿Ð¾Ð·Ð¸Ñ†Ñ–ÑŽ ÑÑ…Ð²Ð°Ð»ÐµÐ½Ð¾ Ð±Ñ–Ð»ÑŒÑˆÑ–ÑÑ‚ÑŽ Ð³Ð¾Ð»Ð¾ÑÑ–Ð²\n    > (The proposal was approved by a majority vote.) [4 words]\n\n15. Ð²Ð½ÐµÑÐµÐ½Ð¾ / Ð·Ð¼Ñ–Ð½Ð¸ / Ð´Ð¾ / ÑÑ‚Ð°Ñ‚ÑƒÑ‚Ñƒ\n    > [!answer] Ð—Ð¼Ñ–Ð½Ð¸ Ð²Ð½ÐµÑÐµÐ½Ð¾ Ð´Ð¾ ÑÑ‚Ð°Ñ‚ÑƒÑ‚Ñƒ\n    > (Changes were made to the charter.) [4 words]\n\n16. Ð¾Ð³Ð¾Ð»Ð¾ÑˆÐµÐ½Ð¾ / ÐºÐ¾Ð½ÐºÑƒÑ€Ñ / Ð½Ð° / Ð¿Ð¾ÑÐ°Ð´Ñƒ\n    > [!answer] ÐžÐ³Ð¾Ð»Ð¾ÑˆÐµÐ½Ð¾ ÐºÐ¾Ð½ÐºÑƒÑ€Ñ Ð½Ð° Ð¿Ð¾ÑÐ°Ð´Ñƒ\n    > (A competition for the position was announced.) [4 words]\n\n17. Ð·Ð°Ð²ÐµÑ€ÑˆÐµÐ½Ð¾ / Ð±ÑƒÐ´Ñ–Ð²Ð½Ð¸Ñ†Ñ‚Ð²Ð¾ / Ð¾Ð±'Ñ”ÐºÑ‚Ð°\n    > [!answer] Ð‘ÑƒÐ´Ñ–Ð²Ð½Ð¸Ñ†Ñ‚Ð²Ð¾ Ð¾Ð±'Ñ”ÐºÑ‚Ð° Ð·Ð°Ð²ÐµÑ€ÑˆÐµÐ½Ð¾\n    > (Construction of the facility was completed.) [3 words]\n\n18. Ð½Ð°Ð´Ð°Ð½Ð¾ / Ð´Ð¾Ð·Ð²Ñ–Ð» / Ð½Ð° / Ð¿Ñ€Ð¾Ð²ÐµÐ´ÐµÐ½Ð½Ñ / Ð·Ð°Ñ…Ð¾Ð´Ñƒ\n    > [!answer] ÐÐ°Ð´Ð°Ð½Ð¾ Ð´Ð¾Ð·Ð²Ñ–Ð» Ð½Ð° Ð¿Ñ€Ð¾Ð²ÐµÐ´ÐµÐ½Ð½Ñ Ð·Ð°Ñ…Ð¾Ð´Ñƒ\n    > (Permission to hold the event was granted.) [5 words]\n\n---\n\n## translate: ÐÐ°ÑƒÐºÐ¾Ð²Ð¸Ð¹ ÑÑ‚Ð¸Ð»ÑŒ\n\n> ÐžÐ±ÐµÑ€Ñ–Ñ‚ÑŒ Ð¿Ñ€Ð°Ð²Ð¸Ð»ÑŒÐ½Ð¸Ð¹ Ð¿ÐµÑ€ÐµÐºÐ»Ð°Ð´ Ð´Ð»Ñ Ð½Ð°ÑƒÐºÐ¾Ð²Ð¾Ð³Ð¾ Ñ‚ÐµÐºÑÑ‚Ñƒ.\n\n1. The research was conducted successfully.\n   - [ ] ÐœÐ¸ Ð¿Ñ€Ð¾Ð²ÐµÐ»Ð¸ Ð´Ð¾ÑÐ»Ñ–Ð´Ð¶ÐµÐ½Ð½Ñ Ð´Ð¾Ð±Ñ€Ðµ.\n   - [x] Ð”Ð¾ÑÐ»Ñ–Ð´Ð¶ÐµÐ½Ð½Ñ Ð¿Ñ€Ð¾Ð²ÐµÐ´ÐµÐ½Ð¾ ÑƒÑÐ¿Ñ–ÑˆÐ½Ð¾.\n   - [ ] Ð”Ð¾ÑÐ»Ñ–Ð´Ð¶ÐµÐ½Ð½Ñ Ð·Ñ€Ð¾Ð±Ð¸Ð»Ð¸ Ð½Ð¾Ñ€Ð¼.\n   - [ ] ÐœÐ¸ Ð·Ñ€Ð¾Ð±Ð¸Ð»Ð¸ Ð´Ð¾ÑÐ»Ñ–Ð´Ð¶ÐµÐ½Ð½Ñ.\n   > ÐŸÐ°ÑÐ¸Ð²Ð½Ð° Ñ„Ð¾Ñ€Ð¼Ð° Ð½Ð° -Ð½Ð¾/-Ñ‚Ð¾ Ñ” ÑÑ‚Ð°Ð½Ð´Ð°Ñ€Ñ‚Ð¾Ð¼ Ð´Ð»Ñ Ð½Ð°ÑƒÐºÐ¾Ð²Ð¾Ð³Ð¾ ÑÑ‚Ð¸Ð»ÑŽ.\n\n2. It was established that a correlation exists.\n   - [ ] ÐœÐ¸ Ð·'ÑÑÑƒÐ²Ð°Ð»Ð¸, Ñ‰Ð¾ Ñ” Ð·Ð²'ÑÐ·Ð¾Ðº.\n   - [x] Ð’ÑÑ‚Ð°Ð½Ð¾Ð²Ð»ÐµÐ½Ð¾, Ñ‰Ð¾ Ñ–ÑÐ½ÑƒÑ” Ð·Ð°Ð»ÐµÐ¶Ð½Ñ–ÑÑ‚ÑŒ.\n   - [ ] Ð’Ð¸ÑÐ²Ð¸Ð»Ð¾ÑÑ, Ñ‰Ð¾ Ñ” Ð·Ð²'ÑÐ·Ð¾Ðº.\n   - [ ] ÐœÐ¸ Ð¿Ð¾Ð±Ð°Ñ‡Ð¸Ð»Ð¸ Ð·Ð²'ÑÐ·Ð¾Ðº.\n   > Ð‘ÐµÐ·Ð¾ÑÐ¾Ð±Ð¾Ð²Ð° ÐºÐ¾Ð½ÑÑ‚Ñ€ÑƒÐºÑ†Ñ–Ñ Â«Ð²ÑÑ‚Ð°Ð½Ð¾Ð²Ð»ÐµÐ½Ð¾Â» Ñ„Ð¾Ñ€Ð¼Ð°Ð»ÑŒÐ½Ð° Ñ‚Ð° Ð¾Ð±'Ñ”ÐºÑ‚Ð¸Ð²Ð½Ð°.\n\n3. The methodology was applied for analysis.\n   - [ ] ÐœÐµÑ‚Ð¾Ð´Ð¾Ð»Ð¾Ð³Ñ–ÑŽ Ð²Ð¸ÐºÐ¾Ñ€Ð¸ÑÑ‚Ð°Ð»Ð¸ Ð´Ð»Ñ Ð°Ð½Ð°Ð»Ñ–Ð·Ñƒ.\n   - [x] ÐœÐµÑ‚Ð¾Ð´Ð¾Ð»Ð¾Ð³Ñ–ÑŽ Ð·Ð°ÑÑ‚Ð¾ÑÐ¾Ð²Ð°Ð½Ð¾ Ð´Ð»Ñ Ð°Ð½Ð°Ð»Ñ–Ð·Ñƒ.\n   - [ ] ÐœÐ¸ Ð²Ð¸ÐºÐ¾Ñ€Ð¸ÑÑ‚Ð°Ð»Ð¸ Ð¼ÐµÑ‚Ð¾Ð´Ð¾Ð»Ð¾Ð³Ñ–ÑŽ.\n   - [ ] ÐœÐµÑ‚Ð¾Ð´Ð¾Ð»Ð¾Ð³Ñ–Ñ Ð±ÑƒÐ»Ð° Ð²Ð¸ÐºÐ¾Ñ€Ð¸ÑÑ‚Ð¾Ð²ÑƒÐ²Ð°Ñ‚Ð¸ÑÑ.\n   > Ð¤Ð¾Ñ€Ð¼Ð° Â«Ð·Ð°ÑÑ‚Ð¾ÑÐ¾Ð²Ð°Ð½Ð¾Â» â€” Ð½Ð°Ð¹Ñ„Ð¾Ñ€Ð¼Ð°Ð»ÑŒÐ½Ñ–ÑˆÐ° Ð´Ð»Ñ Ð½Ð°ÑƒÐºÐ¾Ð²Ð¾Ð³Ð¾ ÑÑ‚Ð¸Ð»ÑŽ.\n\n4. The results have been published.\n   - [ ] Ð ÐµÐ·ÑƒÐ»ÑŒÑ‚Ð°Ñ‚Ð¸ Ð¾Ð¿ÑƒÐ±Ð»Ñ–ÐºÑƒÐ²Ð°Ð»Ð¸.\n   - [x] Ð ÐµÐ·ÑƒÐ»ÑŒÑ‚Ð°Ñ‚Ð¸ Ð¾Ð¿ÑƒÐ±Ð»Ñ–ÐºÐ¾Ð²Ð°Ð½Ð¾.\n   - [ ] ÐœÐ¸ Ð¾Ð¿ÑƒÐ±Ð»Ñ–ÐºÑƒÐ²Ð°Ð»Ð¸ Ñ€ÐµÐ·ÑƒÐ»ÑŒÑ‚Ð°Ñ‚Ð¸.\n   - [ ] Ð ÐµÐ·ÑƒÐ»ÑŒÑ‚Ð°Ñ‚Ð¸ Ñ” Ð¾Ð¿ÑƒÐ±Ð»Ñ–ÐºÐ¾Ð²Ð°Ð½Ð¸Ð¼Ð¸.\n   > Ð¤Ð¾Ñ€Ð¼Ð° Ð½Ð° -Ð½Ð¾/-Ñ‚Ð¾ Ð½Ð°Ð¹ÐºÑ€Ð°Ñ‰Ðµ Ð¿Ñ–Ð´Ñ…Ð¾Ð´Ð¸Ñ‚ÑŒ Ð´Ð»Ñ Ð½Ð°ÑƒÐºÐ¾Ð²Ð¾Ð³Ð¾ ÑÑ‚Ð¸Ð»ÑŽ.\n\n5. A new approach is proposed in the article.\n   - [ ] Ð£ ÑÑ‚Ð°Ñ‚Ñ‚Ñ– Ð¼Ð¸ Ð¿Ñ€Ð¾Ð¿Ð¾Ð½ÑƒÑ”Ð¼Ð¾ Ð½Ð¾Ð²Ð¸Ð¹ Ð¿Ñ–Ð´Ñ…Ñ–Ð´.\n   - [x] Ð£ ÑÑ‚Ð°Ñ‚Ñ‚Ñ– Ð·Ð°Ð¿Ñ€Ð¾Ð¿Ð¾Ð½Ð¾Ð²Ð°Ð½Ð¾ Ð½Ð¾Ð²Ð¸Ð¹ Ð¿Ñ–Ð´Ñ…Ñ–Ð´.\n   - [ ] Ð¡Ñ‚Ð°Ñ‚Ñ‚Ñ Ð¿Ñ€Ð¾Ð¿Ð¾Ð½ÑƒÑ” Ð½Ð¾Ð²Ð¸Ð¹ Ð¿Ñ–Ð´Ñ…Ñ–Ð´.\n   - [ ] ÐÐ¾Ð²Ð¸Ð¹ Ð¿Ñ–Ð´Ñ…Ñ–Ð´ Ñ” Ð·Ð°Ð¿Ñ€Ð¾Ð¿Ð¾Ð½Ð¾Ð²Ð°Ð½Ð¸Ð¹.\n   > Ð‘ÐµÐ·Ð¾ÑÐ¾Ð±Ð¾Ð²Ð° Ð¿Ð°ÑÐ¸Ð²Ð½Ð° ÐºÐ¾Ð½ÑÑ‚Ñ€ÑƒÐºÑ†Ñ–Ñ ÑƒÐ½Ð¸ÐºÐ°Ñ” ÑÑƒÐ±'Ñ”ÐºÑ‚Ð¸Ð²Ð½Ð¾ÑÑ‚Ñ–.\n\n6. The problem is being solved by the team.\n   - [ ] ÐšÐ¾Ð¼Ð°Ð½Ð´Ð° Ð²Ð¸Ñ€Ñ–ÑˆÑƒÑ” Ð¿Ñ€Ð¾Ð±Ð»ÐµÐ¼Ñƒ.\n   - [x] ÐŸÑ€Ð¾Ð±Ð»ÐµÐ¼Ð° Ñ€Ð¾Ð·Ð²'ÑÐ·ÑƒÑ”Ñ‚ÑŒÑÑ ÐºÐ¾Ð¼Ð°Ð½Ð´Ð¾ÑŽ.\n   - [ ] ÐœÐ¸ Ð²Ð¸Ñ€Ñ–ÑˆÑƒÑ”Ð¼Ð¾ Ð¿Ñ€Ð¾Ð±Ð»ÐµÐ¼Ñƒ.\n   - [ ] ÐŸÑ€Ð¾Ð±Ð»ÐµÐ¼Ñƒ Ð²Ð¸Ñ€Ñ–ÑˆÑƒÑŽÑ‚ÑŒ.\n   > Ð—Ð²Ð¾Ñ€Ð¾Ñ‚Ð½Ð¸Ð¹ Ð¿Ð°ÑÐ¸Ð² Ð¿Ñ–Ð´ÐºÑ€ÐµÑÐ»ÑŽÑ” Ð¿Ñ€Ð¾Ñ†ÐµÑ.\n\n7. The data were processed using statistical methods.\n   - [ ] Ð”Ð°Ð½Ñ– Ð¾Ð±Ñ€Ð¾Ð±Ð¸Ð»Ð¸ ÑÑ‚Ð°Ñ‚Ð¸ÑÑ‚Ð¸ÐºÐ¾ÑŽ.\n   - [x] Ð”Ð°Ð½Ñ– Ð¾Ð±Ñ€Ð¾Ð±Ð»ÐµÐ½Ð¾ ÑÑ‚Ð°Ñ‚Ð¸ÑÑ‚Ð¸Ñ‡Ð½Ð¸Ð¼Ð¸ Ð¼ÐµÑ‚Ð¾Ð´Ð°Ð¼Ð¸.\n   - [ ] ÐœÐ¸ Ð¾Ð±Ñ€Ð¾Ð±Ð¸Ð»Ð¸ Ð´Ð°Ð½Ñ– ÑÑ‚Ð°Ñ‚Ð¸ÑÑ‚Ð¸ÐºÐ¾ÑŽ.\n   - [ ] Ð¡Ñ‚Ð°Ñ‚Ð¸ÑÑ‚Ð¸ÐºÑƒ Ð²Ð¸ÐºÐ¾Ñ€Ð¸ÑÑ‚Ð°Ð»Ð¸ Ð´Ð»Ñ Ð´Ð°Ð½Ð¸Ñ….\n   > Ð¤Ð¾Ñ€Ð¼Ð° Â«Ð¾Ð±Ñ€Ð¾Ð±Ð»ÐµÐ½Ð¾Â» Ð½Ð°Ð¹Ñ„Ð¾Ñ€Ð¼Ð°Ð»ÑŒÐ½Ñ–ÑˆÐ°.\n\n8. A conclusion was drawn based on the analysis.\n   - [ ] ÐœÐ¸ Ð·Ñ€Ð¾Ð±Ð¸Ð»Ð¸ Ð²Ð¸ÑÐ½Ð¾Ð²Ð¾Ðº Ð½Ð° Ð¾ÑÐ½Ð¾Ð²Ñ– Ð°Ð½Ð°Ð»Ñ–Ð·Ñƒ.\n   - [x] ÐÐ° Ð¾ÑÐ½Ð¾Ð²Ñ– Ð°Ð½Ð°Ð»Ñ–Ð·Ñƒ Ð·Ñ€Ð¾Ð±Ð»ÐµÐ½Ð¾ Ð²Ð¸ÑÐ½Ð¾Ð²Ð¾Ðº.\n   - [ ] ÐÐ½Ð°Ð»Ñ–Ð· Ð¿Ð¾ÐºÐ°Ð·Ð°Ð² Ð²Ð¸ÑÐ½Ð¾Ð²Ð¾Ðº.\n   - [ ] Ð’Ð¸ÑÐ½Ð¾Ð²Ð¾Ðº Ð±ÑƒÐ² Ð·Ñ€Ð¾Ð±Ð»ÐµÐ½Ð¸Ð¹.\n   > ÐŸÐ¾Ñ€ÑÐ´Ð¾Ðº ÑÐ»Ñ–Ð² Ð· Ð¿Ñ€Ð¸Ð¹Ð¼ÐµÐ½Ð½Ð¸ÐºÐ¾Ð²Ð¾ÑŽ Ð³Ñ€ÑƒÐ¿Ð¾ÑŽ Ð½Ð° Ð¿Ð¾Ñ‡Ð°Ñ‚ÐºÑƒ Ñ‚Ð¸Ð¿Ð¾Ð²Ð¸Ð¹ Ð´Ð»Ñ Ð½Ð°ÑƒÐºÐ¾Ð²Ð¾Ð³Ð¾ ÑÑ‚Ð¸Ð»ÑŽ.\n\n9. The hypothesis was confirmed experimentally.\n   - [ ] Ð•ÐºÑÐ¿ÐµÑ€Ð¸Ð¼ÐµÐ½Ñ‚ Ð¿Ñ–Ð´Ñ‚Ð²ÐµÑ€Ð´Ð¸Ð² Ð³Ñ–Ð¿Ð¾Ñ‚ÐµÐ·Ñƒ.\n   - [x] Ð“Ñ–Ð¿Ð¾Ñ‚ÐµÐ·Ñƒ Ð¿Ñ–Ð´Ñ‚Ð²ÐµÑ€Ð´Ð¶ÐµÐ½Ð¾ ÐµÐºÑÐ¿ÐµÑ€Ð¸Ð¼ÐµÐ½Ñ‚Ð°Ð»ÑŒÐ½Ð¾.\n   - [ ] ÐœÐ¸ Ð¿Ñ–Ð´Ñ‚Ð²ÐµÑ€Ð´Ð¸Ð»Ð¸ Ð³Ñ–Ð¿Ð¾Ñ‚ÐµÐ·Ñƒ.\n   - [ ] Ð“Ñ–Ð¿Ð¾Ñ‚ÐµÐ·Ð° Ð±ÑƒÐ»Ð° Ð¿Ñ–Ð´Ñ‚Ð²ÐµÑ€Ð´Ð¶ÐµÐ½Ð¾ÑŽ.\n   > Ð¤Ð¾Ñ€Ð¼Ð° Ð½Ð° -Ð½Ð¾/-Ñ‚Ð¾ Ð· Ð¿Ñ€Ð¸ÑÐ»Ñ–Ð²Ð½Ð¸ÐºÐ¾Ð¼ â€” ÑÑ‚Ð°Ð½Ð´Ð°Ñ€Ñ‚ Ð½Ð°ÑƒÐºÐ¾Ð²Ð¾Ð³Ð¾ ÑÑ‚Ð¸Ð»ÑŽ.\n\n10. The document was signed by the director.\n    - [ ] Ð”Ð¸Ñ€ÐµÐºÑ‚Ð¾Ñ€ Ð¿Ñ–Ð´Ð¿Ð¸ÑÐ°Ð² Ð´Ð¾ÐºÑƒÐ¼ÐµÐ½Ñ‚.\n    - [x] Ð”Ð¾ÐºÑƒÐ¼ÐµÐ½Ñ‚ Ð¿Ñ–Ð´Ð¿Ð¸ÑÐ°Ð½Ð¾ Ð´Ð¸Ñ€ÐµÐºÑ‚Ð¾Ñ€Ð¾Ð¼.\n    - [ ] Ð”Ð¾ÐºÑƒÐ¼ÐµÐ½Ñ‚ Ð¿Ñ–Ð´Ð¿Ð¸ÑÐ°Ð»Ð¸.\n    - [ ] Ð”Ð¾ÐºÑƒÐ¼ÐµÐ½Ñ‚ Ð±ÑƒÐ² Ð¿Ñ–Ð´Ð¿Ð¸ÑÐ°Ð½Ð¸Ð¹.\n    > Ð”Ð»Ñ Ð¾Ñ„Ñ–Ñ†Ñ–Ð¹Ð½Ð¸Ñ… Ð´Ð¾ÐºÑƒÐ¼ÐµÐ½Ñ‚Ñ–Ð² Ñ„Ð¾Ñ€Ð¼Ð° Ð½Ð° -Ð½Ð¾/-Ñ‚Ð¾ Ð¾Ð±Ð¾Ð²'ÑÐ·ÐºÐ¾Ð²Ð°.\n\n11. Consolidation of knowledge is essential.\n    - [ ] Ð¢Ñ€ÐµÐ±Ð° ÐºÐ¾Ð½ÑÐ¾Ð»Ñ–Ð´ÑƒÐ²Ð°Ñ‚Ð¸ Ð·Ð½Ð°Ð½Ð½Ñ.\n    - [x] ÐšÐ¾Ð½ÑÐ¾Ð»Ñ–Ð´Ð°Ñ†Ñ–Ñ Ð·Ð½Ð°Ð½ÑŒ Ñ” Ð½ÐµÐ¾Ð±Ñ…Ñ–Ð´Ð½Ð¾ÑŽ.\n    - [ ] Ð—Ð½Ð°Ð½Ð½Ñ Ñ‚Ñ€ÐµÐ±Ð° Ð¾Ð±'Ñ”Ð´Ð½Ð°Ñ‚Ð¸.\n    - [ ] Ð’Ð°Ð¶Ð»Ð¸Ð²Ð¾ Ð·Ð°ÐºÑ€Ñ–Ð¿Ð¸Ñ‚Ð¸ Ð·Ð½Ð°Ð½Ð½Ñ.\n    > ÐÐ¾Ð¼Ñ–Ð½Ð°Ð»Ñ–Ð·Ð°Ñ†Ñ–Ñ (Â«ÐºÐ¾Ð½ÑÐ¾Ð»Ñ–Ð´Ð°Ñ†Ñ–ÑÂ») Ñ‚Ð¸Ð¿Ð¾Ð²Ð° Ð´Ð»Ñ Ð½Ð°ÑƒÐºÐ¾Ð²Ð¾Ð³Ð¾ ÑÑ‚Ð¸Ð»ÑŽ.\n\n12. The transition to the advanced level requires preparation.\n    - [ ] Ð©Ð¾Ð± Ð¿ÐµÑ€ÐµÐ¹Ñ‚Ð¸ Ð½Ð° Ð²Ð¸Ñ‰Ð¸Ð¹ Ñ€Ñ–Ð²ÐµÐ½ÑŒ, Ñ‚Ñ€ÐµÐ±Ð° Ð³Ð¾Ñ‚ÑƒÐ²Ð°Ñ‚Ð¸ÑÑ.\n    - [x] ÐŸÐµÑ€ÐµÑ…Ñ–Ð´ Ð´Ð¾ Ð¿Ñ€Ð¾ÑÑƒÐ½ÑƒÑ‚Ð¾Ð³Ð¾ Ñ€Ñ–Ð²Ð½Ñ Ð¿Ð¾Ñ‚Ñ€ÐµÐ±ÑƒÑ” Ð¿Ñ–Ð´Ð³Ð¾Ñ‚Ð¾Ð²ÐºÐ¸.\n    - [ ] Ð”Ð»Ñ Ð¿ÐµÑ€ÐµÑ…Ð¾Ð´Ñƒ Ð¿Ð¾Ñ‚Ñ€Ñ–Ð±Ð½Ð° Ð¿Ñ–Ð´Ð³Ð¾Ñ‚Ð¾Ð²ÐºÐ°.\n    - [ ] Ð“Ð¾Ñ‚ÑƒÐ¹Ñ‚ÐµÑÑ Ð´Ð¾ Ð¿ÐµÑ€ÐµÑ…Ð¾Ð´Ñƒ.\n    > ÐÐ¾Ð¼Ñ–Ð½Ð°Ð»Ñ–Ð·Ð°Ñ†Ñ–Ñ Ñ‚Ð° Ñ„Ð¾Ñ€Ð¼Ð°Ð»ÑŒÐ½Ñ– Ñ–Ð¼ÐµÐ½Ð½Ð¸ÐºÐ¸ Ñ…Ð°Ñ€Ð°ÐºÑ‚ÐµÑ€Ð½Ñ– Ð´Ð»Ñ Ð°ÐºÐ°Ð´ÐµÐ¼Ñ–Ñ‡Ð½Ð¾Ð³Ð¾ ÑÑ‚Ð¸Ð»ÑŽ.\n\n13. The analysis was conducted thoroughly.\n    - [ ] ÐœÐ¸ Ñ€ÐµÑ‚ÐµÐ»ÑŒÐ½Ð¾ Ð¿Ñ€Ð¾Ð°Ð½Ð°Ð»Ñ–Ð·ÑƒÐ²Ð°Ð»Ð¸.\n    - [x] ÐÐ½Ð°Ð»Ñ–Ð· Ð¿Ñ€Ð¾Ð²ÐµÐ´ÐµÐ½Ð¾ Ñ€ÐµÑ‚ÐµÐ»ÑŒÐ½Ð¾.\n    - [ ] ÐÐ½Ð°Ð»Ñ–Ð· Ð±ÑƒÐ² Ñ€ÐµÑ‚ÐµÐ»ÑŒÐ½Ð¸Ð¹.\n    - [ ] Ð ÐµÑ‚ÐµÐ»ÑŒÐ½Ð¾ Ð·Ñ€Ð¾Ð±Ð¸Ð»Ð¸ Ð°Ð½Ð°Ð»Ñ–Ð·.\n    > Ð¤Ð¾Ñ€Ð¼Ð° Ð½Ð° -Ð½Ð¾/-Ñ‚Ð¾ Ð· Ð¿Ñ€Ð¸ÑÐ»Ñ–Ð²Ð½Ð¸ÐºÐ¾Ð¼ â€” ÑÑ‚Ð°Ð½Ð´Ð°Ñ€Ñ‚.\n\n14. The method proved to be effective.\n    - [ ] ÐœÐµÑ‚Ð¾Ð´ ÐºÐ»Ð°ÑÐ½Ð¸Ð¹.\n    - [x] ÐœÐµÑ‚Ð¾Ð´ Ð²Ð¸ÑÐ²Ð¸Ð²ÑÑ ÐµÑ„ÐµÐºÑ‚Ð¸Ð²Ð½Ð¸Ð¼.\n    - [ ] ÐœÐµÑ‚Ð¾Ð´ ÑÐ¿Ñ€Ð°Ñ†ÑŽÐ²Ð°Ð².\n    - [ ] ÐœÐµÑ‚Ð¾Ð´ Ð½Ð¾Ñ€Ð¼.\n    > Â«Ð’Ð¸ÑÐ²Ð¸Ð²ÑÑ ÐµÑ„ÐµÐºÑ‚Ð¸Ð²Ð½Ð¸Ð¼Â» â€” Ñ„Ð¾Ñ€Ð¼Ð°Ð»ÑŒÐ½Ð° ÐºÐ¾Ð½ÑÑ‚Ñ€ÑƒÐºÑ†Ñ–Ñ.\n\n15. Improvement of skills is ongoing.\n    - [ ] ÐÐ°Ð²Ð¸Ñ‡ÐºÐ¸ Ð¿Ð¾ÐºÑ€Ð°Ñ‰ÑƒÑŽÑ‚ÑŒÑÑ.\n    - [x] Ð’Ð´Ð¾ÑÐºÐ¾Ð½Ð°Ð»ÐµÐ½Ð½Ñ Ð½Ð°Ð²Ð¸Ñ‡Ð¾Ðº Ñ‚Ñ€Ð¸Ð²Ð°Ñ”.\n    - [ ] ÐœÐ¸ Ð²Ð´Ð¾ÑÐºÐ¾Ð½Ð°Ð»ÑŽÑ”Ð¼Ð¾ Ð½Ð°Ð²Ð¸Ñ‡ÐºÐ¸.\n    - [ ] ÐÐ°Ð²Ð¸Ñ‡ÐºÐ¸ ÑÑ‚Ð°ÑŽÑ‚ÑŒ ÐºÑ€Ð°Ñ‰Ð¸Ð¼Ð¸.\n    > ÐÐ¾Ð¼Ñ–Ð½Ð°Ð»Ñ–Ð·Ð°Ñ†Ñ–Ñ Â«Ð²Ð´Ð¾ÑÐºÐ¾Ð½Ð°Ð»ÐµÐ½Ð½ÑÂ» Ñ„Ð¾Ñ€Ð¼Ð°Ð»ÑŒÐ½Ñ–ÑˆÐ°.\n\n16. The assessment was conducted objectively.\n    - [ ] ÐœÐ¸ Ð¾Ð±'Ñ”ÐºÑ‚Ð¸Ð²Ð½Ð¾ Ð¾Ñ†Ñ–Ð½Ð¸Ð»Ð¸.\n    - [x] ÐžÑ†Ñ–Ð½ÑŽÐ²Ð°Ð½Ð½Ñ Ð¿Ñ€Ð¾Ð²ÐµÐ´ÐµÐ½Ð¾ Ð¾Ð±'Ñ”ÐºÑ‚Ð¸Ð²Ð½Ð¾.\n    - [ ] ÐžÐ±'Ñ”ÐºÑ‚Ð¸Ð²Ð½Ð¾ Ð¾Ñ†Ñ–Ð½Ð¸Ð»Ð¸.\n    - [ ] ÐžÑ†Ñ–Ð½ÐºÐ° Ð±ÑƒÐ»Ð° Ð¾Ð±'Ñ”ÐºÑ‚Ð¸Ð²Ð½Ð¾ÑŽ.\n    > Ð¤Ð¾Ñ€Ð¼Ð° Ð½Ð° -Ð½Ð¾/-Ñ‚Ð¾ Ð· Ð¿Ñ€Ð¸ÑÐ»Ñ–Ð²Ð½Ð¸ÐºÐ¾Ð¼ â€” ÑÑ‚Ð°Ð½Ð´Ð°Ñ€Ñ‚.\n\n17. Integration of systems has been completed.\n    - [ ] Ð¡Ð¸ÑÑ‚ÐµÐ¼Ð¸ Ñ–Ð½Ñ‚ÐµÐ³Ñ€ÑƒÐ²Ð°Ð»Ð¸.\n    - [x] Ð†Ð½Ñ‚ÐµÐ³Ñ€Ð°Ñ†Ñ–ÑŽ ÑÐ¸ÑÑ‚ÐµÐ¼ Ð·Ð°Ð²ÐµÑ€ÑˆÐµÐ½Ð¾.\n    - [ ] ÐœÐ¸ Ñ–Ð½Ñ‚ÐµÐ³Ñ€ÑƒÐ²Ð°Ð»Ð¸ ÑÐ¸ÑÑ‚ÐµÐ¼Ð¸.\n    - [ ] Ð¡Ð¸ÑÑ‚ÐµÐ¼Ð¸ Ñ” Ñ–Ð½Ñ‚ÐµÐ³Ñ€Ð¾Ð²Ð°Ð½Ð¸Ð¼Ð¸.\n    > ÐÐ¾Ð¼Ñ–Ð½Ð°Ð»Ñ–Ð·Ð°Ñ†Ñ–Ñ + Ñ„Ð¾Ñ€Ð¼Ð° Ð½Ð° -Ð½Ð¾/-Ñ‚Ð¾ â€” Ñ„Ð¾Ñ€Ð¼Ð°Ð»ÑŒÐ½Ð¸Ð¹ ÑÑ‚Ð¸Ð»ÑŒ.\n\n18. Synthesis of results was performed.\n    - [ ] Ð ÐµÐ·ÑƒÐ»ÑŒÑ‚Ð°Ñ‚Ð¸ ÑÐ¸Ð½Ñ‚ÐµÐ·ÑƒÐ²Ð°Ð»Ð¸.\n    - [x] Ð¡Ð¸Ð½Ñ‚ÐµÐ· Ñ€ÐµÐ·ÑƒÐ»ÑŒÑ‚Ð°Ñ‚Ñ–Ð² Ð·Ð´Ñ–Ð¹ÑÐ½ÐµÐ½Ð¾.\n    - [ ] ÐœÐ¸ Ð¿Ñ€Ð¾Ð²ÐµÐ»Ð¸ ÑÐ¸Ð½Ñ‚ÐµÐ·.\n    - [ ] Ð ÐµÐ·ÑƒÐ»ÑŒÑ‚Ð°Ñ‚Ð¸ Ð±ÑƒÐ»Ð¾ ÑÐ¸Ð½Ñ‚ÐµÐ·Ð¾Ð²Ð°Ð½Ð¾.\n    > Â«Ð—Ð´Ñ–Ð¹ÑÐ½ÐµÐ½Ð¾Â» â€” Ñ„Ð¾Ñ€Ð¼Ð°Ð»ÑŒÐ½Ð¸Ð¹ ÑÐ¸Ð½Ð¾Ð½Ñ–Ð¼ Ð´Ð¾ Â«Ð·Ñ€Ð¾Ð±Ð»ÐµÐ½Ð¾Â».\n\n---\n\n## translate: ÐžÑ„Ñ–Ñ†Ñ–Ð¹Ð½Ð¸Ð¹ ÑÑ‚Ð¸Ð»ÑŒ\n\n> ÐžÐ±ÐµÑ€Ñ–Ñ‚ÑŒ Ð¿Ñ€Ð°Ð²Ð¸Ð»ÑŒÐ½Ð¸Ð¹ Ð¿ÐµÑ€ÐµÐºÐ»Ð°Ð´ Ð´Ð»Ñ Ð¾Ñ„Ñ–Ñ†Ñ–Ð¹Ð½Ð¾Ð³Ð¾ Ð´Ð¾ÐºÑƒÐ¼ÐµÐ½Ñ‚Ð°.\n\n1. The decision was adopted unanimously.\n   - [ ] Ð£ÑÑ– Ð¿Ñ€Ð¾Ð³Ð¾Ð»Ð¾ÑÑƒÐ²Ð°Ð»Ð¸ Ð·Ð° Ñ€Ñ–ÑˆÐµÐ½Ð½Ñ.\n   - [x] Ð Ñ–ÑˆÐµÐ½Ð½Ñ ÑƒÑ…Ð²Ð°Ð»ÐµÐ½Ð¾ Ð¾Ð´Ð½Ð¾Ð³Ð¾Ð»Ð¾ÑÐ½Ð¾.\n   - [ ] Ð Ñ–ÑˆÐµÐ½Ð½Ñ Ð¿Ñ€Ð¸Ð¹Ð½ÑÐ»Ð¸ Ð¾Ð´Ð½Ð¾Ð³Ð¾Ð»Ð¾ÑÐ½Ð¾.\n   - [ ] Ð£ÑÑ– Ð¿Ð¾Ð³Ð¾Ð´Ð¸Ð»Ð¸ÑÑ.\n   > Ð¤Ð¾Ñ€Ð¼Ð° Ð½Ð° -Ð½Ð¾/-Ñ‚Ð¾ Ð¾Ð±Ð¾Ð²'ÑÐ·ÐºÐ¾Ð²Ð° Ð´Ð»Ñ Ð¾Ñ„Ñ–Ñ†Ñ–Ð¹Ð½Ð¸Ñ… Ð´Ð¾ÐºÑƒÐ¼ÐµÐ½Ñ‚Ñ–Ð².\n\n2. The order was signed by the director.\n   - [ ] Ð”Ð¸Ñ€ÐµÐºÑ‚Ð¾Ñ€ Ð¿Ñ–Ð´Ð¿Ð¸ÑÐ°Ð² Ð½Ð°ÐºÐ°Ð·.\n   - [x] ÐÐ°ÐºÐ°Ð· Ð¿Ñ–Ð´Ð¿Ð¸ÑÐ°Ð½Ð¾ Ð´Ð¸Ñ€ÐµÐºÑ‚Ð¾Ñ€Ð¾Ð¼.\n   - [ ] ÐÐ°ÐºÐ°Ð· Ð¿Ñ–Ð´Ð¿Ð¸ÑÐ°Ð»Ð¸.\n   - [ ] Ð”Ð¸Ñ€ÐµÐºÑ‚Ð¾Ñ€ Ð¿Ð¾ÑÑ‚Ð°Ð²Ð¸Ð² Ð¿Ñ–Ð´Ð¿Ð¸Ñ.\n   > ÐŸÐ°ÑÐ¸Ð²Ð½Ð° Ñ„Ð¾Ñ€Ð¼Ð° Ð· Ð¾Ñ€ÑƒÐ´Ð½Ð¸Ð¼ Ð²Ñ–Ð´Ð¼Ñ–Ð½ÐºÐ¾Ð¼ Ð°Ð³ÐµÐ½ÑÐ° â€” ÑÑ‚Ð°Ð½Ð´Ð°Ñ€Ñ‚.\n\n3. The application was reviewed by the commission.\n   - [ ] ÐšÐ¾Ð¼Ñ–ÑÑ–Ñ Ñ€Ð¾Ð·Ð³Ð»ÑÐ½ÑƒÐ»Ð° Ð·Ð°ÑÐ²Ñƒ.\n   - [x] Ð—Ð°ÑÐ²Ñƒ Ñ€Ð¾Ð·Ð³Ð»ÑÐ½ÑƒÑ‚Ð¾ ÐºÐ¾Ð¼Ñ–ÑÑ–Ñ”ÑŽ.\n   - [ ] Ð—Ð°ÑÐ²Ñƒ Ð¿Ð¾Ð´Ð¸Ð²Ð¸Ð»Ð¸ÑÑ.\n   - [ ] ÐšÐ¾Ð¼Ñ–ÑÑ–Ñ Ð¿ÐµÑ€ÐµÐ²Ñ–Ñ€Ð¸Ð»Ð° Ð·Ð°ÑÐ²Ñƒ.\n   > ÐŸÐ°ÑÐ¸Ð²Ð½Ð° Ñ„Ð¾Ñ€Ð¼Ð° Ð½Ð° -Ð½Ð¾/-Ñ‚Ð¾ Ð· Ð²Ð¸ÐºÐ¾Ð½Ð°Ð²Ñ†ÐµÐ¼ Ð´Ñ–Ñ— Ð² Ð¾Ñ€ÑƒÐ´Ð½Ð¾Ð¼Ñƒ Ð²Ñ–Ð´Ð¼Ñ–Ð½ÐºÑƒ â€” ÑÑ‚Ð°Ð½Ð´Ð°Ñ€Ñ‚ Ð¾Ñ„Ñ–Ñ†Ñ–Ð¹Ð½Ð¾Ð³Ð¾ ÑÑ‚Ð¸Ð»ÑŽ.\n\n4. All documents have been submitted.\n   - [ ] ÐœÐ¸ Ð¿Ð¾Ð´Ð°Ð»Ð¸ Ð²ÑÑ– Ð´Ð¾ÐºÑƒÐ¼ÐµÐ½Ñ‚Ð¸.\n   - [x] Ð£ÑÑ– Ð´Ð¾ÐºÑƒÐ¼ÐµÐ½Ñ‚Ð¸ Ð¿Ð¾Ð´Ð°Ð½Ð¾.\n   - [ ] Ð”Ð¾ÐºÑƒÐ¼ÐµÐ½Ñ‚Ð¸ Ð·Ð´Ð°Ð»Ð¸.\n   - [ ] Ð”Ð¾ÐºÑƒÐ¼ÐµÐ½Ñ‚Ð¸ Ñ” Ð¿Ð¾Ð´Ð°Ð½Ñ–.\n   > Ð‘ÐµÐ·Ð¾ÑÐ¾Ð±Ð¾Ð²Ð° Ð¿Ð°ÑÐ¸Ð²Ð½Ð° Ñ„Ð¾Ñ€Ð¼Ð° ÑÑ‚Ð°Ð½Ð´Ð°Ñ€Ñ‚Ð½Ð° Ð´Ð»Ñ Ð¾Ñ„Ñ–Ñ†Ñ–Ð¹Ð½Ð¾Ð³Ð¾ ÑÑ‚Ð¸Ð»ÑŽ.\n\n5. The annual work plan was approved.\n   - [ ] Ð—Ð°Ñ‚Ð²ÐµÑ€Ð´Ð¸Ð»Ð¸ Ñ€Ñ–Ñ‡Ð½Ð¸Ð¹ Ð¿Ð»Ð°Ð½ Ñ€Ð¾Ð±Ð¾Ñ‚Ð¸.\n   - [x] Ð Ñ–Ñ‡Ð½Ð¸Ð¹ Ð¿Ð»Ð°Ð½ Ñ€Ð¾Ð±Ð¾Ñ‚Ð¸ Ð·Ð°Ñ‚Ð²ÐµÑ€Ð´Ð¶ÐµÐ½Ð¾.\n   - [ ] ÐŸÐ»Ð°Ð½ Ñ€Ð¾Ð±Ð¾Ñ‚Ð¸ ÑÑ…Ð²Ð°Ð»Ð¸Ð»Ð¸.\n   - [ ] ÐœÐ¸ Ð·Ð°Ñ‚Ð²ÐµÑ€Ð´Ð¸Ð»Ð¸ Ð¿Ð»Ð°Ð½.\n   > Ð¤Ð¾Ñ€Ð¼Ð° Ð½Ð° -Ð½Ð¾/-Ñ‚Ð¾ Ð¾Ð±Ð¾Ð²'ÑÐ·ÐºÐ¾Ð²Ð°.\n\n6. Control was assigned to the deputy.\n   - [ ] Ð—Ð°ÑÑ‚ÑƒÐ¿Ð½Ð¸Ðº Ð±ÑƒÐ´Ðµ ÐºÐ¾Ð½Ñ‚Ñ€Ð¾Ð»ÑŽÐ²Ð°Ñ‚Ð¸.\n   - [x] ÐšÐ¾Ð½Ñ‚Ñ€Ð¾Ð»ÑŒ Ð¿Ð¾ÐºÐ»Ð°Ð´ÐµÐ½Ð¾ Ð½Ð° Ð·Ð°ÑÑ‚ÑƒÐ¿Ð½Ð¸ÐºÐ°.\n   - [ ] Ð—Ð°ÑÑ‚ÑƒÐ¿Ð½Ð¸ÐºÑƒ Ð´Ð°Ð»Ð¸ ÐºÐ¾Ð½Ñ‚Ñ€Ð¾Ð»ÑŒ.\n   - [ ] ÐšÐ¾Ð½Ñ‚Ñ€Ð¾Ð»ÑŽÐ²Ð°Ñ‚Ð¸ Ð±ÑƒÐ´Ðµ Ð·Ð°ÑÑ‚ÑƒÐ¿Ð½Ð¸Ðº.\n   > Â«ÐŸÐ¾ÐºÐ»Ð°Ð´ÐµÐ½Ð¾ Ð½Ð° + Ð·Ð½Ð°Ñ…Ñ–Ð´Ð½Ð¸Ð¹ Ð²Ñ–Ð´Ð¼Ñ–Ð½Ð¾ÐºÂ» â€” Ð¾Ñ„Ñ–Ñ†Ñ–Ð¹Ð½Ð° Ñ„Ð¾Ñ€Ð¼ÑƒÐ»Ð°.\n\n7. Deadlines were established.\n   - [ ] Ð¢ÐµÑ€Ð¼Ñ–Ð½Ð¸ Ð²ÑÑ‚Ð°Ð½Ð¾Ð²Ð¸Ð»Ð¸.\n   - [x] Ð¢ÐµÑ€Ð¼Ñ–Ð½Ð¸ Ð²ÑÑ‚Ð°Ð½Ð¾Ð²Ð»ÐµÐ½Ð¾.\n   - [ ] ÐœÐ¸ Ð²Ð¸Ð·Ð½Ð°Ñ‡Ð¸Ð»Ð¸ Ñ‚ÐµÑ€Ð¼Ñ–Ð½Ð¸.\n   - [ ] Ð¢ÐµÑ€Ð¼Ñ–Ð½Ð¸ Ñ” Ð²ÑÑ‚Ð°Ð½Ð¾Ð²Ð»ÐµÐ½Ð¸Ð¼Ð¸.\n   > ÐšÐ¾Ñ€Ð¾Ñ‚ÐºÐ° Ð±ÐµÐ·Ð¾ÑÐ¾Ð±Ð¾Ð²Ð° Ñ„Ð¾Ñ€Ð¼Ð° Ñ‚Ð¸Ð¿Ð¾Ð²Ð° Ð´Ð»Ñ Ð¾Ñ„Ñ–Ñ†Ñ–Ð¹Ð½Ð¾Ð³Ð¾ ÑÑ‚Ð¸Ð»ÑŽ.\n\n8. The report must be submitted monthly.\n   - [ ] Ð—Ð²Ñ–Ñ‚ Ñ‚Ñ€ÐµÐ±Ð° Ð¿Ð¾Ð´Ð°Ð²Ð°Ñ‚Ð¸ Ñ‰Ð¾Ð¼Ñ–ÑÑÑ†Ñ.\n   - [x] Ð—Ð²Ñ–Ñ‚ Ð¿Ð¾Ð´Ð°Ð²Ð°Ñ‚Ð¸ Ñ‰Ð¾Ð¼Ñ–ÑÑÑ†Ñ.\n   - [ ] ÐŸÐ¾Ð´Ð°Ð²Ð°Ð¹Ñ‚Ðµ Ð·Ð²Ñ–Ñ‚ Ñ‰Ð¾Ð¼Ñ–ÑÑÑ†Ñ.\n   - [ ] ÐœÐ¸ Ð±ÑƒÐ´ÐµÐ¼Ð¾ Ð¿Ð¾Ð´Ð°Ð²Ð°Ñ‚Ð¸ Ð·Ð²Ñ–Ñ‚.\n   > Ð†Ð½Ñ„Ñ–Ð½Ñ–Ñ‚Ð¸Ð²Ð½Ð° ÐºÐ¾Ð½ÑÑ‚Ñ€ÑƒÐºÑ†Ñ–Ñ Ñ‚Ð¸Ð¿Ð¾Ð²Ð° Ð´Ð»Ñ Ð¿Ñ€Ð¸Ð¿Ð¸ÑÑ–Ð².\n\n9. Changes were made to the charter.\n   - [ ] ÐœÐ¸ Ð²Ð½ÐµÑÐ»Ð¸ Ð·Ð¼Ñ–Ð½Ð¸ Ð´Ð¾ ÑÑ‚Ð°Ñ‚ÑƒÑ‚Ñƒ.\n   - [x] Ð”Ð¾ ÑÑ‚Ð°Ñ‚ÑƒÑ‚Ñƒ Ð²Ð½ÐµÑÐµÐ½Ð¾ Ð·Ð¼Ñ–Ð½Ð¸.\n   - [ ] Ð¡Ñ‚Ð°Ñ‚ÑƒÑ‚ Ð·Ð¼Ñ–Ð½Ð¸Ð»Ð¸.\n   - [ ] Ð—Ð¼Ñ–Ð½Ð¸ Ð·Ñ€Ð¾Ð±Ð¸Ð»Ð¸ Ð² ÑÑ‚Ð°Ñ‚ÑƒÑ‚Ñ–.\n   > ÐŸÑ€Ð¸Ð¹Ð¼ÐµÐ½Ð½Ð¸ÐºÐ¾Ð²Ð° ÐºÐ¾Ð½ÑÑ‚Ñ€ÑƒÐºÑ†Ñ–Ñ Ð½Ð° Ð¿Ð¾Ñ‡Ð°Ñ‚ÐºÑƒ + Ñ„Ð¾Ñ€Ð¼Ð° Ð½Ð° -Ð½Ð¾/-Ñ‚Ð¾.\n\n10. A competition for the position was announced.\n    - [ ] ÐžÐ³Ð¾Ð»Ð¾ÑÐ¸Ð»Ð¸ ÐºÐ¾Ð½ÐºÑƒÑ€Ñ Ð½Ð° Ð¿Ð¾ÑÐ°Ð´Ñƒ.\n    - [x] ÐžÐ³Ð¾Ð»Ð¾ÑˆÐµÐ½Ð¾ ÐºÐ¾Ð½ÐºÑƒÑ€Ñ Ð½Ð° Ð¿Ð¾ÑÐ°Ð´Ñƒ.\n    - [ ] ÐšÐ¾Ð½ÐºÑƒÑ€Ñ Ð±ÑƒÐ´Ðµ Ð½Ð° Ð¿Ð¾ÑÐ°Ð´Ñƒ.\n    - [ ] ÐœÐ¸ Ð¾Ð³Ð¾Ð»Ð¾ÑˆÑƒÑ”Ð¼Ð¾ ÐºÐ¾Ð½ÐºÑƒÑ€Ñ.\n    > Ð‘ÐµÐ·Ð¾ÑÐ¾Ð±Ð¾Ð²Ð° Ð¿Ð°ÑÐ¸Ð²Ð½Ð° Ñ„Ð¾Ñ€Ð¼Ð° ÑÑ‚Ð°Ð½Ð´Ð°Ñ€Ñ‚Ð½Ð°.\n\n11. Permission was granted.\n    - [ ] Ð”Ð¾Ð·Ð²Ñ–Ð» Ð´Ð°Ð»Ð¸.\n    - [x] Ð”Ð¾Ð·Ð²Ñ–Ð» Ð½Ð°Ð´Ð°Ð½Ð¾.\n    - [ ] ÐœÐ¸ Ð½Ð°Ð´Ð°Ð»Ð¸ Ð´Ð¾Ð·Ð²Ñ–Ð».\n    - [ ] Ð„ Ð´Ð¾Ð·Ð²Ñ–Ð».\n    > Â«ÐÐ°Ð´Ð°Ð½Ð¾Â» â€” Ñ„Ð¾Ñ€Ð¼Ð°Ð»ÑŒÐ½Ð¸Ð¹ Ð²Ð°Ñ€Ñ–Ð°Ð½Ñ‚ Â«Ð´Ð°Ð»Ð¸Â».\n\n12. Construction was completed.\n    - [ ] Ð‘ÑƒÐ´Ñ–Ð²Ð½Ð¸Ñ†Ñ‚Ð²Ð¾ Ð·Ð°ÐºÑ–Ð½Ñ‡Ð¸Ð»Ð¸.\n    - [x] Ð‘ÑƒÐ´Ñ–Ð²Ð½Ð¸Ñ†Ñ‚Ð²Ð¾ Ð·Ð°Ð²ÐµÑ€ÑˆÐµÐ½Ð¾.\n    - [ ] ÐœÐ¸ Ð¿Ð¾Ð±ÑƒÐ´ÑƒÐ²Ð°Ð»Ð¸.\n    - [ ] Ð‘ÑƒÐ´Ñ–Ð²Ð»Ñ Ð³Ð¾Ñ‚Ð¾Ð²Ð°.\n    > Â«Ð—Ð°Ð²ÐµÑ€ÑˆÐµÐ½Ð¾Â» â€” Ñ„Ð¾Ñ€Ð¼Ð°Ð»ÑŒÐ½Ð¸Ð¹ Ð²Ð°Ñ€Ñ–Ð°Ð½Ñ‚.\n\n13. The meeting minutes were signed by all participants.\n    - [ ] Ð£ÑÑ– Ð¿Ñ–Ð´Ð¿Ð¸ÑÐ°Ð»Ð¸ Ð¿Ñ€Ð¾Ñ‚Ð¾ÐºÐ¾Ð».\n    - [x] ÐŸÑ€Ð¾Ñ‚Ð¾ÐºÐ¾Ð» Ð¿Ñ–Ð´Ð¿Ð¸ÑÐ°Ð½Ð¾ Ð²ÑÑ–Ð¼Ð° ÑƒÑ‡Ð°ÑÐ½Ð¸ÐºÐ°Ð¼Ð¸.\n    - [ ] Ð£Ñ‡Ð°ÑÐ½Ð¸ÐºÐ¸ Ð¿Ð¾ÑÑ‚Ð°Ð²Ð¸Ð»Ð¸ Ð¿Ñ–Ð´Ð¿Ð¸ÑÐ¸.\n    - [ ] ÐŸÑ€Ð¾Ñ‚Ð¾ÐºÐ¾Ð» Ñ” Ð¿Ñ–Ð´Ð¿Ð¸ÑÐ°Ð½Ð¸Ð¹.\n    > Ð‘ÐµÐ·Ð¾ÑÐ¾Ð±Ð¾Ð²Ð¸Ð¹ Ð¿Ð°ÑÐ¸Ð² Ð· Ð°Ð³ÐµÐ½ÑÐ¾Ð¼ Ð² Ð¾Ñ€ÑƒÐ´Ð½Ð¾Ð¼Ñƒ Ð²Ñ–Ð´Ð¼Ñ–Ð½ÐºÑƒ â€” Ñ‚Ð¸Ð¿Ð¾Ð²Ð° ÐºÐ¾Ð½ÑÑ‚Ñ€ÑƒÐºÑ†Ñ–Ñ Ð´Ð»Ñ Ð¿Ñ€Ð¾Ñ‚Ð¾ÐºÐ¾Ð»Ñ–Ð² Ñ– Ð½Ð°ÐºÐ°Ð·Ñ–Ð².\n\n14. New regulations were introduced.\n    - [ ] Ð—Ð°Ð¿Ñ€Ð¾Ð²Ð°Ð´Ð¸Ð»Ð¸ Ð½Ð¾Ð²Ñ– Ð¿Ñ€Ð°Ð²Ð¸Ð»Ð°.\n    - [x] Ð—Ð°Ð¿Ñ€Ð¾Ð²Ð°Ð´Ð¶ÐµÐ½Ð¾ Ð½Ð¾Ð²Ñ– Ð¿Ñ€Ð°Ð²Ð¸Ð»Ð°.\n    - [ ] ÐœÐ¸ Ð²Ð²ÐµÐ»Ð¸ Ð½Ð¾Ð²Ñ– Ð¿Ñ€Ð°Ð²Ð¸Ð»Ð°.\n    - [ ] ÐÐ¾Ð²Ñ– Ð¿Ñ€Ð°Ð²Ð¸Ð»Ð° Ð¿Ð¾Ñ‡Ð°Ð»Ð¸ Ð´Ñ–ÑÑ‚Ð¸.\n    > Ð‘ÐµÐ·Ð¾ÑÐ¾Ð±Ð¾Ð²Ð° Ð¿Ð°ÑÐ¸Ð²Ð½Ð° Ñ„Ð¾Ñ€Ð¼Ð° ÑÑ‚Ð°Ð½Ð´Ð°Ñ€Ñ‚Ð½Ð°.\n\n15. The task was completed on time.\n    - [ ] Ð—Ð°Ð²Ð´Ð°Ð½Ð½Ñ Ð·Ñ€Ð¾Ð±Ð¸Ð»Ð¸ Ð²Ñ‡Ð°ÑÐ½Ð¾.\n    - [x] Ð—Ð°Ð²Ð´Ð°Ð½Ð½Ñ Ð²Ð¸ÐºÐ¾Ð½Ð°Ð½Ð¾ Ð²Ñ‡Ð°ÑÐ½Ð¾.\n    - [ ] ÐœÐ¸ Ð·Ð°ÐºÑ–Ð½Ñ‡Ð¸Ð»Ð¸ Ð·Ð°Ð²Ð´Ð°Ð½Ð½Ñ.\n    - [ ] Ð—Ð°Ð²Ð´Ð°Ð½Ð½Ñ Ð³Ð¾Ñ‚Ð¾Ð²Ðµ.\n    > Â«Ð’Ð¸ÐºÐ¾Ð½Ð°Ð½Ð¾Â» â€” Ñ„Ð¾Ñ€Ð¼Ð°Ð»ÑŒÐ½Ð¸Ð¹ Ð²Ð°Ñ€Ñ–Ð°Ð½Ñ‚.\n\n16. A responsible person was appointed.\n    - [ ] ÐŸÑ€Ð¸Ð·Ð½Ð°Ñ‡Ð¸Ð»Ð¸ Ð²Ñ–Ð´Ð¿Ð¾Ð²Ñ–Ð´Ð°Ð»ÑŒÐ½Ð¾Ð³Ð¾.\n    - [x] ÐŸÑ€Ð¸Ð·Ð½Ð°Ñ‡ÐµÐ½Ð¾ Ð²Ñ–Ð´Ð¿Ð¾Ð²Ñ–Ð´Ð°Ð»ÑŒÐ½Ð¾Ð³Ð¾.\n    - [ ] ÐœÐ¸ Ð¿Ñ€Ð¸Ð·Ð½Ð°Ñ‡Ð¸Ð»Ð¸ ÐºÐ¾Ð³Ð¾ÑÑŒ.\n    - [ ] Ð„ Ð²Ñ–Ð´Ð¿Ð¾Ð²Ñ–Ð´Ð°Ð»ÑŒÐ½Ð¸Ð¹.\n    > Ð‘ÐµÐ·Ð¾ÑÐ¾Ð±Ð¾Ð²Ð° Ñ„Ð¾Ñ€Ð¼Ð° Ñ‚Ð¸Ð¿Ð¾Ð²Ð° Ð´Ð»Ñ Ð½Ð°ÐºÐ°Ð·Ñ–Ð².\n\n17. Document verification was conducted.\n    - [ ] ÐœÐ¸ Ð¿ÐµÑ€ÐµÐ²Ñ–Ñ€Ð¸Ð»Ð¸ Ð´Ð¾ÐºÑƒÐ¼ÐµÐ½Ñ‚Ð¸.\n    - [x] ÐŸÑ€Ð¾Ð²ÐµÐ´ÐµÐ½Ð¾ Ð¿ÐµÑ€ÐµÐ²Ñ–Ñ€ÐºÑƒ Ð´Ð¾ÐºÑƒÐ¼ÐµÐ½Ñ‚Ñ–Ð².\n    - [ ] Ð”Ð¾ÐºÑƒÐ¼ÐµÐ½Ñ‚Ð¸ Ð¿ÐµÑ€ÐµÐ²Ñ–Ñ€Ð¸Ð»Ð¸.\n    - [ ] Ð”Ð¾ÐºÑƒÐ¼ÐµÐ½Ñ‚Ð¸ Ð¿ÐµÑ€ÐµÐ²Ñ–Ñ€ÐµÐ½Ð¾.\n    > ÐžÐ±Ð¸Ð´Ð²Ð° Ð²Ð°Ñ€Ñ–Ð°Ð½Ñ‚Ð¸ Â«Ð¿Ñ€Ð¾Ð²ÐµÐ´ÐµÐ½Ð¾ Ð¿ÐµÑ€ÐµÐ²Ñ–Ñ€ÐºÑƒÂ» Ñ‚Ð° Â«Ð¿ÐµÑ€ÐµÐ²Ñ–Ñ€ÐµÐ½Ð¾Â» Ð¿Ñ€Ð°Ð²Ð¸Ð»ÑŒÐ½Ñ–.\n\n18. The proposal was approved by the majority.\n    - [ ] Ð‘Ñ–Ð»ÑŒÑˆÑ–ÑÑ‚ÑŒ ÑÑ…Ð²Ð°Ð»Ð¸Ð»Ð° Ð¿Ñ€Ð¾Ð¿Ð¾Ð·Ð¸Ñ†Ñ–ÑŽ.\n    - [x] ÐŸÑ€Ð¾Ð¿Ð¾Ð·Ð¸Ñ†Ñ–ÑŽ ÑÑ…Ð²Ð°Ð»ÐµÐ½Ð¾ Ð±Ñ–Ð»ÑŒÑˆÑ–ÑÑ‚ÑŽ.\n    - [ ] ÐŸÑ€Ð¾Ð¿Ð¾Ð·Ð¸Ñ†Ñ–ÑŽ Ð¿Ñ–Ð´Ñ‚Ñ€Ð¸Ð¼Ð°Ð»Ð¸.\n    - [ ] Ð‘Ñ–Ð»ÑŒÑˆÑ–ÑÑ‚ÑŒ Ð¿Ñ–Ð´Ñ‚Ñ€Ð¸Ð¼Ð°Ð»Ð°.\n    > ÐšÐ¾Ð½ÑÑ‚Ñ€ÑƒÐºÑ†Ñ–Ñ Â«ÑÑ…Ð²Ð°Ð»ÐµÐ½Ð¾ + Ð¾Ñ€ÑƒÐ´Ð½Ð¸Ð¹ Ð²Ñ–Ð´Ð¼Ñ–Ð½Ð¾ÐºÂ» Ñ” Ð½Ð¾Ñ€Ð¼Ð¾ÑŽ Ð´Ð»Ñ Ñ€Ñ–ÑˆÐµÐ½ÑŒ Ñ– Ð¿Ñ€Ð¾Ñ‚Ð¾ÐºÐ¾Ð»Ñ–Ð².\n\n---\n\n## select: ÐŸÑ€Ð°Ð²Ð¸Ð»ÑŒÐ½Ñ– Ñ„Ð¾Ñ€Ð¼Ð¸ Ð¿Ð°ÑÐ¸Ð²Ñƒ\n\n> ÐžÐ±ÐµÑ€Ñ–Ñ‚ÑŒ Ð£Ð¡Ð† Ð¿Ñ€Ð°Ð²Ð¸Ð»ÑŒÐ½Ñ– Ð²Ð°Ñ€Ñ–Ð°Ð½Ñ‚Ð¸ Ð´Ð»Ñ Ð¾Ñ„Ñ–Ñ†Ñ–Ð¹Ð½Ð¾Ð³Ð¾ Ð´Ð¾ÐºÑƒÐ¼ÐµÐ½Ñ‚Ð°.\n\n1. Ð¯ÐºÑ– Ñ„Ð¾Ñ€Ð¼Ð¸ Ñ” Ð¿Ñ€Ð°Ð²Ð¸Ð»ÑŒÐ½Ð¸Ð¼Ð¸ Ð´Ð»Ñ Ð¾Ñ„Ñ–Ñ†Ñ–Ð¹Ð½Ð¾Ð³Ð¾ ÑÑ‚Ð¸Ð»ÑŽ?\n   - [x] Ð Ñ–ÑˆÐµÐ½Ð½Ñ ÑƒÑ…Ð²Ð°Ð»ÐµÐ½Ð¾\n   - [ ] Ð Ñ–ÑˆÐµÐ½Ð½Ñ ÑƒÑ…Ð²Ð°Ð»Ð¸Ð»Ð¸\n   - [x] Ð Ñ–ÑˆÐµÐ½Ð½Ñ Ð±ÑƒÐ»Ð¾ ÑƒÑ…Ð²Ð°Ð»ÐµÐ½Ð¾\n   - [ ] ÐœÐ¸ ÑƒÑ…Ð²Ð°Ð»Ð¸Ð»Ð¸ Ñ€Ñ–ÑˆÐµÐ½Ð½Ñ\n   > Ð¤Ð¾Ñ€Ð¼Ð¸ Ð½Ð° -Ð½Ð¾/-Ñ‚Ð¾ (Ñ– Ð· Â«Ð±ÑƒÐ»Ð¾Â» Ð´Ð»Ñ Ð¼Ð¸Ð½ÑƒÐ»Ð¾Ð³Ð¾ Ñ‡Ð°ÑÑƒ) Ð¾Ð±Ð¾Ð²'ÑÐ·ÐºÐ¾Ð²Ñ– Ð² Ð¾Ñ„Ñ–Ñ†Ñ–Ð¹Ð½Ð¸Ñ… Ð´Ð¾ÐºÑƒÐ¼ÐµÐ½Ñ‚Ð°Ñ….\n\n2. Ð¯ÐºÑ– Ñ€ÐµÑ‡ÐµÐ½Ð½Ñ Ð²Ñ–Ð´Ð¿Ð¾Ð²Ñ–Ð´Ð°ÑŽÑ‚ÑŒ Ð½Ð°ÑƒÐºÐ¾Ð²Ð¾Ð¼Ñƒ ÑÑ‚Ð¸Ð»ÑŽ?\n   - [x] Ð”Ð¾ÑÐ»Ñ–Ð´Ð¶ÐµÐ½Ð½Ñ Ð¿Ñ€Ð¾Ð²ÐµÐ´ÐµÐ½Ð¾ ÑƒÑÐ¿Ñ–ÑˆÐ½Ð¾\n   - [ ] ÐœÐ¸ Ð¿Ñ€Ð¾Ð²ÐµÐ»Ð¸ Ð´Ð¾ÑÐ»Ñ–Ð´Ð¶ÐµÐ½Ð½Ñ Ð´Ð¾Ð±Ñ€Ðµ\n   - [x] Ð’ÑÑ‚Ð°Ð½Ð¾Ð²Ð»ÐµÐ½Ð¾, Ñ‰Ð¾ Ñ–ÑÐ½ÑƒÑ” Ð·Ð°Ð»ÐµÐ¶Ð½Ñ–ÑÑ‚ÑŒ\n   - [ ] ÐœÐ¸ Ð·'ÑÑÑƒÐ²Ð°Ð»Ð¸, Ñ‰Ð¾ Ñ” Ð·Ð²'ÑÐ·Ð¾Ðº\n   > Ð‘ÐµÐ·Ð¾ÑÐ¾Ð±Ð¾Ð²Ñ– Ð¿Ð°ÑÐ¸Ð²Ð½Ñ– ÐºÐ¾Ð½ÑÑ‚Ñ€ÑƒÐºÑ†Ñ–Ñ— ÑƒÐ½Ð¸ÐºÐ°ÑŽÑ‚ÑŒ ÑÑƒÐ±'Ñ”ÐºÑ‚Ð¸Ð²Ð½Ð¾ÑÑ‚Ñ–.\n\n3. Ð¯ÐºÑ– ÑÐ»Ð¾Ð²Ð° Ñ” Ñ‚ÐµÑ€Ð¼Ñ–Ð½Ð°Ð¼Ð¸ Ð°ÐºÐ°Ð´ÐµÐ¼Ñ–Ñ‡Ð½Ð¾Ð³Ð¾ Ð´Ð¸ÑÐºÑƒÑ€ÑÑƒ?\n   - [x] ÐºÐ¾Ð½ÑÐ¾Ð»Ñ–Ð´Ð°Ñ†Ñ–Ñ\n   - [x] ÑÐ¸ÑÑ‚ÐµÐ¼Ð°Ñ‚Ð¸Ð·Ð°Ñ†Ñ–Ñ\n   - [ ] ÐºÑ€ÑƒÑ‚Ð¾\n   - [x] ÑƒÐ·Ð°Ð³Ð°Ð»ÑŒÐ½ÐµÐ½Ð½Ñ\n   > Â«ÐšÑ€ÑƒÑ‚Ð¾Â» â€” Ñ€Ð¾Ð·Ð¼Ð¾Ð²Ð½Ðµ ÑÐ»Ð¾Ð²Ð¾, Ñ–Ð½ÑˆÑ– â€” Ð°ÐºÐ°Ð´ÐµÐ¼Ñ–Ñ‡Ð½Ñ– Ñ‚ÐµÑ€Ð¼Ñ–Ð½Ð¸.\n\n4. Ð¯ÐºÑ– ÐºÐ¾Ð½ÑÑ‚Ñ€ÑƒÐºÑ†Ñ–Ñ— Ð¿Ñ€Ð¸Ð¹Ð½ÑÑ‚Ð½Ñ– Ð´Ð»Ñ Ð½Ð°ÑƒÐºÐ¾Ð²Ð¾Ñ— ÑÑ‚Ð°Ñ‚Ñ‚Ñ–?\n   - [x] Ð‘ÑƒÐ»Ð¾ Ð·Ð°ÑÑ‚Ð¾ÑÐ¾Ð²Ð°Ð½Ð¾ Ð¼ÐµÑ‚Ð¾Ð´\n   - [ ] ÐœÐ¸ Ð²Ð¸ÐºÐ¾Ñ€Ð¸ÑÑ‚Ð°Ð»Ð¸ Ð¼ÐµÑ‚Ð¾Ð´\n   - [x] ÐœÐµÑ‚Ð¾Ð´ Ð±ÑƒÐ»Ð¾ Ð·Ð°ÑÑ‚Ð¾ÑÐ¾Ð²Ð°Ð½Ð¾\n   - [ ] ÐœÐµÑ‚Ð¾Ð´ Ð²Ð¸ÐºÐ¾Ñ€Ð¸ÑÑ‚Ð°Ð»Ð¸ Ð¼Ð¸\n   > ÐŸÐ°ÑÐ¸Ð²Ð½Ñ– ÐºÐ¾Ð½ÑÑ‚Ñ€ÑƒÐºÑ†Ñ–Ñ— Ð¿ÐµÑ€ÐµÐ²Ð°Ð¶Ð°ÑŽÑ‚ÑŒ Ñƒ Ð½Ð°ÑƒÐºÐ¾Ð²Ð¾Ð¼Ñƒ ÑÑ‚Ð¸Ð»Ñ–.\n\n5. Ð¯ÐºÑ– ÑÐ»Ð¾Ð²Ð° Ð¾Ð·Ð½Ð°Ñ‡Ð°ÑŽÑ‚ÑŒ Ð¿ÐµÑ€ÐµÑ…Ñ–Ð´ Ð´Ð¾ Ð²Ð¸Ñ‰Ð¾Ð³Ð¾ Ñ€Ñ–Ð²Ð½Ñ?\n   - [x] Ð¿Ð¾Ð³Ð»Ð¸Ð±Ð»ÐµÐ½Ð½Ñ\n   - [x] Ð²Ð´Ð¾ÑÐºÐ¾Ð½Ð°Ð»ÐµÐ½Ð½Ñ\n   - [ ] Ð¿Ð¾Ð³Ñ–Ñ€ÑˆÐµÐ½Ð½Ñ\n   - [x] Ð¿Ñ€Ð¾ÑÑƒÐ²Ð°Ð½Ð½Ñ\n   > Â«ÐŸÐ¾Ð³Ñ–Ñ€ÑˆÐµÐ½Ð½ÑÂ» Ð¾Ð·Ð½Ð°Ñ‡Ð°Ñ” Ð·Ð²Ð¾Ñ€Ð¾Ñ‚Ð½Ð¸Ð¹ Ð¿Ñ€Ð¾Ñ†ÐµÑ.\n\n6. Ð¯ÐºÑ– Ñ…Ð°Ñ€Ð°ÐºÑ‚ÐµÑ€Ð¸ÑÑ‚Ð¸ÐºÐ¸ Ð²Ð»Ð°ÑÑ‚Ð¸Ð²Ñ– Ð½Ð°ÑƒÐºÐ¾Ð²Ð¾Ð¼Ñƒ ÑÑ‚Ð¸Ð»ÑŽ?\n   - [x] Ð¾Ð±'Ñ”ÐºÑ‚Ð¸Ð²Ð½Ñ–ÑÑ‚ÑŒ\n   - [ ] ÐµÐ¼Ð¾Ñ†Ñ–Ð¹Ð½Ñ–ÑÑ‚ÑŒ\n   - [x] Ñ‚ÐµÑ€Ð¼Ñ–Ð½Ð¾Ð»Ð¾Ð³Ñ–Ñ‡Ð½Ñ–ÑÑ‚ÑŒ\n   - [x] Ñ‚Ð¾Ñ‡Ð½Ñ–ÑÑ‚ÑŒ\n   > Ð•Ð¼Ð¾Ñ†Ñ–Ð¹Ð½Ñ–ÑÑ‚ÑŒ Ñ…Ð°Ñ€Ð°ÐºÑ‚ÐµÑ€Ð½Ð° Ð´Ð»Ñ Ñ…ÑƒÐ´Ð¾Ð¶Ð½ÑŒÐ¾Ð³Ð¾ Ñ‚Ð° Ñ€Ð¾Ð·Ð¼Ð¾Ð²Ð½Ð¾Ð³Ð¾ ÑÑ‚Ð¸Ð»Ñ–Ð².\n\n7. Ð¯ÐºÑ– Ñ„Ð¾Ñ€Ð¼Ð¸ Ð´Ñ–Ñ”ÑÐ»Ð¾Ð²Ð° Â«Ð¿Ñ€Ð¾Ð²Ð¾Ð´Ð¸Ñ‚Ð¸Â» Ð¿Ñ€Ð°Ð²Ð¸Ð»ÑŒÐ½Ñ– Ð´Ð»Ñ Ñ„Ð¾Ñ€Ð¼Ð¸ Ð½Ð° -Ð½Ð¾/-Ñ‚Ð¾?\n   - [x] Ð¿Ñ€Ð¾Ð²ÐµÐ´ÐµÐ½Ð¾\n   - [ ] Ð¿Ñ€Ð¾Ð²Ð¾Ð´Ð¶ÐµÐ½Ð¾\n   - [ ] Ð¿Ñ€Ð¾Ð²Ð¾Ð´Ð¸Ð»Ð¾ÑÑ\n   - [ ] Ð¿Ñ€Ð¾Ð²Ð°Ð´ÐµÐ½Ð¾\n   > Â«ÐŸÑ€Ð¾Ð²ÐµÐ´ÐµÐ½Ð¾Â» â€” Ñ”Ð´Ð¸Ð½Ð° Ð¿Ñ€Ð°Ð²Ð¸Ð»ÑŒÐ½Ð° Ñ„Ð¾Ñ€Ð¼Ð° Ð²Ñ–Ð´ Â«Ð¿Ñ€Ð¾Ð²ÐµÑÑ‚Ð¸Â».\n\n8. Ð¯ÐºÑ– ÑÐ»Ð¾Ð²Ð° Ð· Ð¼Ð¾Ð´ÑƒÐ»Ñ Ð¾Ð·Ð½Ð°Ñ‡Ð°ÑŽÑ‚ÑŒ Ð¿Ð¾ÐºÑ€Ð°Ñ‰ÐµÐ½Ð½Ñ?\n   - [x] Ð²Ð´Ð¾ÑÐºÐ¾Ð½Ð°Ð»ÐµÐ½Ð½Ñ\n   - [x] Ñ€Ð¾Ð·ÑˆÐ¸Ñ€ÐµÐ½Ð½Ñ\n   - [ ] Ð·Ð²ÑƒÐ¶ÐµÐ½Ð½Ñ\n   - [x] Ð¿Ð¾Ð³Ð»Ð¸Ð±Ð»ÐµÐ½Ð½Ñ\n   > Â«Ð—Ð²ÑƒÐ¶ÐµÐ½Ð½ÑÂ» Ð¾Ð·Ð½Ð°Ñ‡Ð°Ñ” Ð·Ð¼ÐµÐ½ÑˆÐµÐ½Ð½Ñ, Ð° Ð½Ðµ Ð¿Ð¾ÐºÑ€Ð°Ñ‰ÐµÐ½Ð½Ñ.\n\n9. Ð¯ÐºÑ– Ñ„Ð¾Ñ€Ð¼Ð¸ Ð¿Ð°ÑÐ¸Ð²Ñƒ Ð¿Ñ–Ð´ÐºÑ€ÐµÑÐ»ÑŽÑŽÑ‚ÑŒ Ð¿Ñ€Ð¾Ñ†ÐµÑ?\n   - [ ] Ð½Ð°Ð¿Ð¸ÑÐ°Ð½Ð¾\n   - [x] Ð¿Ð¸ÑˆÐµÑ‚ÑŒÑÑ\n   - [x] Ñ€Ð¾Ð·Ð³Ð»ÑÐ´Ð°Ñ”Ñ‚ÑŒÑÑ\n   - [ ] Ñ€Ð¾Ð·Ð³Ð»ÑÐ½ÑƒÑ‚Ð¾\n   > Ð—Ð²Ð¾Ñ€Ð¾Ñ‚Ð½Ð¸Ð¹ Ð¿Ð°ÑÐ¸Ð² (-ÑÑ) Ð¿Ñ–Ð´ÐºÑ€ÐµÑÐ»ÑŽÑ” Ð¿Ñ€Ð¾Ñ†ÐµÑ, -Ð½Ð¾/-Ñ‚Ð¾ â€” Ñ€ÐµÐ·ÑƒÐ»ÑŒÑ‚Ð°Ñ‚.\n\n10. Ð¯ÐºÑ– ÑÑ‚Ð¸Ð»Ñ– Ð°ÐºÑ‚Ð¸Ð²Ð½Ð¾ Ð²Ð¸ÐºÐ¾Ñ€Ð¸ÑÑ‚Ð¾Ð²ÑƒÑŽÑ‚ÑŒ Ð¿Ð°ÑÐ¸Ð²Ð½Ð¸Ð¹ ÑÑ‚Ð°Ð½?\n    - [x] Ð½Ð°ÑƒÐºÐ¾Ð²Ð¸Ð¹\n    - [x] Ð¾Ñ„Ñ–Ñ†Ñ–Ð¹Ð½Ð¾-Ð´Ñ–Ð»Ð¾Ð²Ð¸Ð¹\n    - [ ] Ñ€Ð¾Ð·Ð¼Ð¾Ð²Ð½Ð¸Ð¹\n    - [x] Ð¿ÑƒÐ±Ð»Ñ–Ñ†Ð¸ÑÑ‚Ð¸Ñ‡Ð½Ð¸Ð¹\n    > Ð£ Ñ€Ð¾Ð·Ð¼Ð¾Ð²Ð½Ð¾Ð¼Ñƒ ÑÑ‚Ð¸Ð»Ñ– Ð¿ÐµÑ€ÐµÐ²Ð°Ð¶Ð°Ñ” Ð°ÐºÑ‚Ð¸Ð²Ð½Ð¸Ð¹ ÑÑ‚Ð°Ð½.\n\n---\n\n## dialogue-reorder: Ð—Ð°Ñ…Ð¸ÑÑ‚ Ð¿Ñ€Ð¾Ñ”ÐºÑ‚Ñƒ\n\n> Ð Ð¾Ð·Ñ‚Ð°ÑˆÑƒÐ¹Ñ‚Ðµ Ñ€ÐµÐ¿Ð»Ñ–ÐºÐ¸ Ð² Ð¿Ñ€Ð°Ð²Ð¸Ð»ÑŒÐ½Ð¾Ð¼Ñƒ Ð¿Ð¾Ñ€ÑÐ´ÐºÑƒ.\n\n- Ð: Ð¨Ð°Ð½Ð¾Ð²Ð½Ð° ÐºÐ¾Ð¼Ñ–ÑÑ–Ñ”, Ð´Ð¾Ð·Ð²Ð¾Ð»ÑŒÑ‚Ðµ Ð¿Ñ€ÐµÐ´ÑÑ‚Ð°Ð²Ð¸Ñ‚Ð¸ Ñ€ÐµÐ·ÑƒÐ»ÑŒÑ‚Ð°Ñ‚Ð¸ Ð¼Ð¾Ð³Ð¾ Ð´Ð¾ÑÐ»Ñ–Ð´Ð¶ÐµÐ½Ð½Ñ.\n- Ð‘: Ð‘ÑƒÐ´ÑŒ Ð»Ð°ÑÐºÐ°, Ñ€Ð¾Ð·Ð¿Ð¾Ñ‡Ð¸Ð½Ð°Ð¹Ñ‚Ðµ.\n- Ð: ÐŸÑ€Ð¾Ñ”ÐºÑ‚ Ð¿Ñ€Ð¸ÑÐ²ÑÑ‡ÐµÐ½Ð¾ Ð°Ð½Ð°Ð»Ñ–Ð·Ñƒ Ð¼Ð¾Ð²Ð½Ð¾Ñ— Ð¿Ð¾Ð»Ñ–Ñ‚Ð¸ÐºÐ¸ Ð² Ð£ÐºÑ€Ð°Ñ—Ð½Ñ–.\n- Ð‘: Ð¯ÐºÑƒ Ð¼ÐµÑ‚Ð¾Ð´Ð¾Ð»Ð¾Ð³Ñ–ÑŽ Ð·Ð°ÑÑ‚Ð¾ÑÐ¾Ð²Ð°Ð½Ð¾?\n- Ð: Ð‘ÑƒÐ»Ð¾ Ð²Ð¸ÐºÐ¾Ñ€Ð¸ÑÑ‚Ð°Ð½Ð¾ ÐºÐ¾Ð¼Ð¿Ð»ÐµÐºÑÐ½Ð¸Ð¹ Ð¿Ñ–Ð´Ñ…Ñ–Ð´: ÐºÑ–Ð»ÑŒÐºÑ–ÑÐ½Ð¸Ð¹ Ñ‚Ð° ÑÐºÑ–ÑÐ½Ð¸Ð¹ Ð°Ð½Ð°Ð»Ñ–Ð·.\n- Ð‘: Ð¯ÐºÑ– Ð¾ÑÐ½Ð¾Ð²Ð½Ñ– Ð²Ð¸ÑÐ½Ð¾Ð²ÐºÐ¸?\n- Ð: Ð’ÑÑ‚Ð°Ð½Ð¾Ð²Ð»ÐµÐ½Ð¾, Ñ‰Ð¾ Ð¼Ð¾Ð²Ð½Ð° Ð¿Ð¾Ð»Ñ–Ñ‚Ð¸ÐºÐ° Ð²Ð¿Ð»Ð¸Ð²Ð°Ñ” Ð½Ð° Ð½Ð°Ñ†Ñ–Ð¾Ð½Ð°Ð»ÑŒÐ½Ñƒ Ñ–Ð´ÐµÐ½Ñ‚Ð¸Ñ‡Ð½Ñ–ÑÑ‚ÑŒ.\n- Ð‘: Ð§Ð¸ Ñ” Ð¾Ð±Ð¼ÐµÐ¶ÐµÐ½Ð½Ñ Ð´Ð¾ÑÐ»Ñ–Ð´Ð¶ÐµÐ½Ð½Ñ?\n- Ð: Ð¢Ð°Ðº, Ð¿Ð¾Ñ‚Ñ€ÐµÐ±ÑƒÑ” Ð¿Ð¾Ð³Ð»Ð¸Ð±Ð»ÐµÐ½Ð½Ñ Ð½Ð° ÑˆÐ¸Ñ€ÑˆÑ–Ð¹ Ð²Ð¸Ð±Ñ–Ñ€Ñ†Ñ–.\n- Ð‘: Ð”ÑÐºÑƒÑ”Ð¼Ð¾. ÐŸÑ€Ð¾Ñ”ÐºÑ‚ Ñ€ÐµÐºÐ¾Ð¼ÐµÐ½Ð´Ð¾Ð²Ð°Ð½Ð¾ Ð´Ð¾ Ð·Ð°Ñ…Ð¸ÑÑ‚Ñƒ.\n\n---\n\n# Ð¡Ð»Ð¾Ð²Ð½Ð¸Ðº\n\n| Ð¡Ð»Ð¾Ð²Ð¾ | ÐŸÐµÑ€ÐµÐºÐ»Ð°Ð´ | ÐŸÑ€Ð¸Ð¼Ñ–Ñ‚ÐºÐ¸ |\n|-------|----------|----------|\n| Ð¿Ð¾Ð²Ñ‚Ð¾Ñ€ÐµÐ½Ð½Ñ | review, revision | Ñ–Ð¼., n |\n| ÑƒÐ·Ð°Ð³Ð°Ð»ÑŒÐ½ÐµÐ½Ð½Ñ | generalization | Ñ–Ð¼., n |\n| ÑÐ¸ÑÑ‚ÐµÐ¼Ð°Ñ‚Ð¸Ð·Ð°Ñ†Ñ–Ñ | systematization | Ñ–Ð¼., f |\n| ÐºÐ¾Ð½ÑÐ¾Ð»Ñ–Ð´Ð°Ñ†Ñ–Ñ | consolidation | Ñ–Ð¼., f |\n| Ð¿ÐµÑ€ÐµÑ…Ñ–Ð´ | transition | Ñ–Ð¼., m |\n| Ð¿Ñ€Ð¾ÑÑƒÐ½ÑƒÑ‚Ð¸Ð¹ | advanced | Ð¿Ñ€Ð¸ÐºÐ¼. |\n| Ð°ÐºÐ°Ð´ÐµÐ¼Ñ–Ñ‡Ð½Ð¸Ð¹ | academic | Ð¿Ñ€Ð¸ÐºÐ¼. |\n| Ñ„Ð°Ñ…Ð¾Ð²Ð¸Ð¹ | professional, expert | Ð¿Ñ€Ð¸ÐºÐ¼. |\n| Ð´Ð¾ÑÐºÐ¾Ð½Ð°Ð»Ñ–ÑÑ‚ÑŒ | perfection | Ñ–Ð¼., f |\n| Ð¼Ð°Ð¹ÑÑ‚ÐµÑ€Ð½Ñ–ÑÑ‚ÑŒ | mastery | Ñ–Ð¼., f |\n| Ð¾Ð¿Ð°Ð½ÑƒÐ²Ð°Ð½Ð½Ñ | mastering | Ñ–Ð¼., n |\n| Ð²Ð´Ð¾ÑÐºÐ¾Ð½Ð°Ð»ÐµÐ½Ð½Ñ | improvement | Ñ–Ð¼., n |\n| Ð¿Ð¾Ð³Ð»Ð¸Ð±Ð»ÐµÐ½Ð½Ñ | deepening | Ñ–Ð¼., n |\n| Ñ€Ð¾Ð·ÑˆÐ¸Ñ€ÐµÐ½Ð½Ñ | expansion | Ñ–Ð¼., n |\n| Ð·Ð°ÐºÑ€Ñ–Ð¿Ð»ÐµÐ½Ð½Ñ | consolidation, reinforcement | Ñ–Ð¼., n |\n| Ð·Ð°ÑÑ‚Ð¾ÑÑƒÐ²Ð°Ð½Ð½Ñ | application | Ñ–Ð¼., n |\n| Ñ–Ð½Ñ‚ÐµÐ³Ñ€Ð°Ñ†Ñ–Ñ | integration | Ñ–Ð¼., f |\n| ÑÐ¸Ð½Ñ‚ÐµÐ· | synthesis | Ñ–Ð¼., m |\n| Ð°Ð½Ð°Ð»Ñ–Ð· | analysis | Ñ–Ð¼., m |\n| Ð¾Ñ†Ñ–Ð½ÑŽÐ²Ð°Ð½Ð½Ñ | assessment, evaluation | Ñ–Ð¼., n |\n| Ñ€ÐµÐ³Ñ–ÑÑ‚Ñ€ | register (style level) | Ñ–Ð¼., m |\n| Ñ„Ð¾Ñ€Ð¼ÑƒÐ»ÑŽÐ²Ð°Ð½Ð½Ñ | formulation, wording | Ñ–Ð¼., n |\n| ÑÑ‚Ð°Ð½Ð´Ð°Ñ€Ñ‚Ð¸Ð·Ð°Ñ†Ñ–Ñ | standardization | Ñ–Ð¼., f |\n| Ð²Ð¿Ñ€Ð¾Ð²Ð°Ð´Ð¶ÐµÐ½Ð½Ñ | implementation | Ñ–Ð¼., n |\n| Ð¿ÑƒÐ±Ð»Ñ–Ñ†Ð¸ÑÑ‚Ð¸ÐºÐ° | journalism | Ñ–Ð¼., f |\n| ÐºÐ¾Ð°Ð»Ñ–Ñ†Ñ–Ñ | coalition | Ñ–Ð¼., f |\n",
    "createdAt": "2025-12-22T00:08:35.775746Z",
    "modifiedAt": "2025-12-22T00:08:35.775746Z",
    "version": 2
  },
  "activities": [],
  "vocabulary": {
    "moduleId": "mod-uk-C1-01",
    "level": "C1",
    "phase": "C1.1",
    "wordCount": 26,
    "newWordCount": 26,
    "reviewWordCount": 0,
    "transliterationMode": "none",
    "words": [
      {
        "id": "vocab-1",
        "uk": "Ð¿Ð¾Ð²Ñ‚Ð¾Ñ€ÐµÐ½Ð½Ñ",
        "ipa": "review, revision",
        "en": "Ñ–Ð¼., n",
        "pos": "",
        "gender": null,
        "note": ""
      },
      {
        "id": "vocab-2",
        "uk": "ÑƒÐ·Ð°Ð³Ð°Ð»ÑŒÐ½ÐµÐ½Ð½Ñ",
        "ipa": "generalization",
        "en": "Ñ–Ð¼., n",
        "pos": "",
        "gender": null,
        "note": ""
      },
      {
        "id": "vocab-3",
        "uk": "ÑÐ¸ÑÑ‚ÐµÐ¼Ð°Ñ‚Ð¸Ð·Ð°Ñ†Ñ–Ñ",
        "ipa": "systematization",
        "en": "Ñ–Ð¼., f",
        "pos": "",
        "gender": null,
        "note": ""
      },
      {
        "id": "vocab-4",
        "uk": "ÐºÐ¾Ð½ÑÐ¾Ð»Ñ–Ð´Ð°Ñ†Ñ–Ñ",
        "ipa": "consolidation",
        "en": "Ñ–Ð¼., f",
        "pos": "",
        "gender": null,
        "note": ""
      },
      {
        "id": "vocab-5",
        "uk": "Ð¿ÐµÑ€ÐµÑ…Ñ–Ð´",
        "ipa": "transition",
        "en": "Ñ–Ð¼., m",
        "pos": "",
        "gender": null,
        "note": ""
      },
      {
        "id": "vocab-6",
        "uk": "Ð¿Ñ€Ð¾ÑÑƒÐ½ÑƒÑ‚Ð¸Ð¹",
        "ipa": "advanced",
        "en": "Ð¿Ñ€Ð¸ÐºÐ¼.",
        "pos": "",
        "gender": null,
        "note": ""
      },
      {
        "id": "vocab-7",
        "uk": "Ð°ÐºÐ°Ð´ÐµÐ¼Ñ–Ñ‡Ð½Ð¸Ð¹",
        "ipa": "academic",
        "en": "Ð¿Ñ€Ð¸ÐºÐ¼.",
        "pos": "",
        "gender": null,
        "note": ""
      },
      {
        "id": "vocab-8",
        "uk": "Ñ„Ð°Ñ…Ð¾Ð²Ð¸Ð¹",
        "ipa": "professional, expert",
        "en": "Ð¿Ñ€Ð¸ÐºÐ¼.",
        "pos": "",
        "gender": null,
        "note": ""
      },
      {
        "id": "vocab-9",
        "uk": "Ð´Ð¾ÑÐºÐ¾Ð½Ð°Ð»Ñ–ÑÑ‚ÑŒ",
        "ipa": "perfection",
        "en": "Ñ–Ð¼., f",
        "pos": "",
        "gender": null,
        "note": ""
      },
      {
        "id": "vocab-10",
        "uk": "Ð¼Ð°Ð¹ÑÑ‚ÐµÑ€Ð½Ñ–ÑÑ‚ÑŒ",
        "ipa": "mastery",
        "en": "Ñ–Ð¼., f",
        "pos": "",
        "gender": null,
        "note": ""
      },
      {
        "id": "vocab-11",
        "uk": "Ð¾Ð¿Ð°Ð½ÑƒÐ²Ð°Ð½Ð½Ñ",
        "ipa": "mastering",
        "en": "Ñ–Ð¼., n",
        "pos": "",
        "gender": null,
        "note": ""
      },
      {
        "id": "vocab-12",
        "uk": "Ð²Ð´Ð¾ÑÐºÐ¾Ð½Ð°Ð»ÐµÐ½Ð½Ñ",
        "ipa": "improvement",
        "en": "Ñ–Ð¼., n",
        "pos": "",
        "gender": null,
        "note": ""
      },
      {
        "id": "vocab-13",
        "uk": "Ð¿Ð¾Ð³Ð»Ð¸Ð±Ð»ÐµÐ½Ð½Ñ",
        "ipa": "deepening",
        "en": "Ñ–Ð¼., n",
        "pos": "",
        "gender": null,
        "note": ""
      },
      {
        "id": "vocab-14",
        "uk": "Ñ€Ð¾Ð·ÑˆÐ¸Ñ€ÐµÐ½Ð½Ñ",
        "ipa": "expansion",
        "en": "Ñ–Ð¼., n",
        "pos": "",
        "gender": null,
        "note": ""
      },
      {
        "id": "vocab-15",
        "uk": "Ð·Ð°ÐºÑ€Ñ–Ð¿Ð»ÐµÐ½Ð½Ñ",
        "ipa": "consolidation, reinforcement",
        "en": "Ñ–Ð¼., n",
        "pos": "",
        "gender": null,
        "note": ""
      },
      {
        "id": "vocab-16",
        "uk": "Ð·Ð°ÑÑ‚Ð¾ÑÑƒÐ²Ð°Ð½Ð½Ñ",
        "ipa": "application",
        "en": "Ñ–Ð¼., n",
        "pos": "",
        "gender": null,
        "note": ""
      },
      {
        "id": "vocab-17",
        "uk": "Ñ–Ð½Ñ‚ÐµÐ³Ñ€Ð°Ñ†Ñ–Ñ",
        "ipa": "integration",
        "en": "Ñ–Ð¼., f",
        "pos": "",
        "gender": null,
        "note": ""
      },
      {
        "id": "vocab-18",
        "uk": "ÑÐ¸Ð½Ñ‚ÐµÐ·",
        "ipa": "synthesis",
        "en": "Ñ–Ð¼., m",
        "pos": "",
        "gender": null,
        "note": ""
      },
      {
        "id": "vocab-19",
        "uk": "Ð°Ð½Ð°Ð»Ñ–Ð·",
        "ipa": "analysis",
        "en": "Ñ–Ð¼., m",
        "pos": "",
        "gender": null,
        "note": ""
      },
      {
        "id": "vocab-20",
        "uk": "Ð¾Ñ†Ñ–Ð½ÑŽÐ²Ð°Ð½Ð½Ñ",
        "ipa": "assessment, evaluation",
        "en": "Ñ–Ð¼., n",
        "pos": "",
        "gender": null,
        "note": ""
      },
      {
        "id": "vocab-21",
        "uk": "Ñ€ÐµÐ³Ñ–ÑÑ‚Ñ€",
        "ipa": "register (style level)",
        "en": "Ñ–Ð¼., m",
        "pos": "",
        "gender": null,
        "note": ""
      },
      {
        "id": "vocab-22",
        "uk": "Ñ„Ð¾Ñ€Ð¼ÑƒÐ»ÑŽÐ²Ð°Ð½Ð½Ñ",
        "ipa": "formulation, wording",
        "en": "Ñ–Ð¼., n",
        "pos": "",
        "gender": null,
        "note": ""
      },
      {
        "id": "vocab-23",
        "uk": "ÑÑ‚Ð°Ð½Ð´Ð°Ñ€Ñ‚Ð¸Ð·Ð°Ñ†Ñ–Ñ",
        "ipa": "standardization",
        "en": "Ñ–Ð¼., f",
        "pos": "",
        "gender": null,
        "note": ""
      },
      {
        "id": "vocab-24",
        "uk": "Ð²Ð¿Ñ€Ð¾Ð²Ð°Ð´Ð¶ÐµÐ½Ð½Ñ",
        "ipa": "implementation",
        "en": "Ñ–Ð¼., n",
        "pos": "",
        "gender": null,
        "note": ""
      },
      {
        "id": "vocab-25",
        "uk": "Ð¿ÑƒÐ±Ð»Ñ–Ñ†Ð¸ÑÑ‚Ð¸ÐºÐ°",
        "ipa": "journalism",
        "en": "Ñ–Ð¼., f",
        "pos": "",
        "gender": null,
        "note": ""
      },
      {
        "id": "vocab-26",
        "uk": "ÐºÐ¾Ð°Ð»Ñ–Ñ†Ñ–Ñ",
        "ipa": "coalition",
        "en": "Ñ–Ð¼., f",
        "pos": "",
        "gender": null,
        "note": ""
      }
    ],
    "reviewWords": []
  }
}