{
  "$schema": "../../../schemas/vibe-module.schema.json",
  "lesson": {
    "id": "lesson-uk-B2-01",
    "moduleId": "mod-uk-B2-01",
    "languagePair": "l2-uk-en",
    "subject": "language",
    "owner": "curricula-opus",
    "visibility": "public",
    "language": "uk",
    "targetLevel": "B2",
    "phase": "B2",
    "moduleNumber": 1,
    "moduleType": "grammar",
    "pedagogy": "TTT",
    "immersionLevel": 0.85,
    "title": "ÐŸÐ°ÑÐ¸Ð²Ð½Ð¸Ð¹ ÑÑ‚Ð°Ð½: ÐŸÐ¾Ð²Ð½Ð° ÑÐ¸ÑÑ‚ÐµÐ¼Ð°",
    "titleUk": null,
    "subtitle": "Mastering All 4 Ukrainian Passive Forms",
    "description": "Learner can identify all 4 Ukrainian passive constructions",
    "objectives": [
      "Learner can identify all 4 Ukrainian passive constructions",
      "Learner can choose the appropriate passive form for different registers",
      "Learner can transform active sentences into passive using all 4 methods"
    ],
    "objectivesUk": null,
    "grammarFocus": [
      "passive-participle",
      "impersonal-passive",
      "reflexive-passive",
      "3pl-passive"
    ],
    "tags": [
      "grammar",
      "passive",
      "register",
      "voice"
    ],
    "totalDuration": 90,
    "transliterationMode": "none",
    "sections": [
      {
        "id": "section-1",
        "name": "Ð’ÑÑ‚ÑƒÐ¿",
        "nameEn": null,
        "type": "intro",
        "content": "You've mastered how Ukrainian expresses action â€” who does what. But what happens when the performer is unknown, unimportant, or when the focus shifts to the result? This is where **passive voice** enters â€” one of the most elegant systems in Ukrainian grammar.\n\n> ðŸ’¡ **Did You Know**\n>\n> Ukrainian has not one, not two, but FOUR distinct passive constructions â€” more than English, German, or French. Each form signals a different register and emphasis. Mastering them is the key to sounding truly fluent.\n\nUnlike English, where passive is formed one way (\"was written\"), Ukrainian has an entire system where each form carries additional meaning about context, style, and emphasis. Understanding when to use each form separates textbook Ukrainian from native-like fluency.\n\nThe passive voice serves multiple communicative functions across all languages. First, it shifts focus from the performer to the recipient of the action. Second, it allows speakers to hide or de-emphasize the agent when desired. Third, it creates stylistic variety in written and spoken discourse. Ukrainian takes these functions further by encoding register information directly into the passive form itself â€” a feature that makes mastering this system essential for advanced proficiency.\n\n---\n\n## Ð”Ñ–Ð°Ð³Ð½Ð¾ÑÑ‚Ð¸ÐºÐ°\n\nRead these four sentences. They all mean approximately the same thing â€” \"The book was written.\" But why do Ukrainians use different constructions?\n\n> [!observe]\n>\n> 1. **ÐšÐ½Ð¸Ð³Ð° Ð½Ð°Ð¿Ð¸ÑÐ°Ð½Ð° Ð°Ð²Ñ‚Ð¾Ñ€Ð¾Ð¼.** (literary style)\n> 2. **ÐšÐ½Ð¸Ð³Ñƒ Ð½Ð°Ð¿Ð¸ÑÐ°Ð½Ð¾.** (official document)\n> 3. **ÐšÐ½Ð¸Ð³Ð° Ð¿Ð¸ÑˆÐµÑ‚ÑŒÑÑ ÑˆÐ²Ð¸Ð´ÐºÐ¾.** (process)\n> 4. **ÐšÐ½Ð¸Ð³Ñƒ Ð½Ð°Ð¿Ð¸ÑÐ°Ð»Ð¸.** (colloquial speech)\n>\n> Notice: different endings, different word order, different cases. This isn't random â€” it's a system.\n\nBefore we explain the rules, try to identify patterns. What differences do you notice in verb forms? In word order? In the case of \"ÐºÐ½Ð¸Ð³Ð°/ÐºÐ½Ð¸Ð³Ñƒ\"?\n\n---\n\n## ÐÐ½Ð°Ð»Ñ–Ð·\n\n### The Four Passive Forms: Overview\n\nUkrainian has four ways to express passive meaning. Each has its place in communication:\n\n| Form | Construction | Example | Register |\n|------|-------------|---------|----------|\n| Participial | noun + -Ð½Ð¸Ð¹/-Ñ‚Ð¸Ð¹ | ÐšÐ½Ð¸Ð³Ð° **Ð½Ð°Ð¿Ð¸ÑÐ°Ð½Ð°** | Literary, formal |\n| Impersonal | accusative + -Ð½Ð¾/-Ñ‚Ð¾ | ÐšÐ½Ð¸Ð³Ñƒ **Ð½Ð°Ð¿Ð¸ÑÐ°Ð½Ð¾** | Official/bureaucratic |\n| Reflexive | verb + -ÑÑ | ÐšÐ½Ð¸Ð³Ð° **Ð¿Ð¸ÑˆÐµÑ‚ÑŒÑÑ** | Scientific, process |\n| 3rd person plural | 3rd pl. without subject | ÐšÐ½Ð¸Ð³Ñƒ **Ð½Ð°Ð¿Ð¸ÑÐ°Ð»Ð¸** | Colloquial |\n\n> ðŸŽ­ **Cultural Insight**\n>\n> The choice of passive form is a signal. When an official says \"Ð Ñ–ÑˆÐµÐ½Ð½Ñ Ð¿Ñ€Ð¸Ð¹Ð½ÑÑ‚Ð¾\" instead of \"ÐœÐ¸ Ð¿Ñ€Ð¸Ð¹Ð½ÑÐ»Ð¸ Ñ€Ñ–ÑˆÐµÐ½Ð½Ñ,\" they consciously distance themselves from responsibility. Language doesn't just describe reality â€” it constructs it.\n\n> ðŸ”— **Language Link**\n>\n> English uses passive primarily for focus shift (\"The book was written by X\"). Ukrainian uses passive for BOTH focus AND register signaling. Choosing -Ð½Ð¾/-Ñ‚Ð¾ instantly marks your text as official, while 3rd person plural marks it as colloquial.\n\n---\n\n### 1. Participial Form (-Ð½Ð¸Ð¹/-Ñ‚Ð¸Ð¹)\n\nThis form is closest to English passive. It's formed from the past passive participle.\n\n**Formation:**\nThe participle is formed from the infinitive stem + **-Ð½Ð¸Ð¹** or **-Ñ‚Ð¸Ð¹**:\n- Ð½Ð°Ð¿Ð¸ÑÐ°-Ñ‚Ð¸ â†’ Ð½Ð°Ð¿Ð¸Ñ**Ð°Ð½Ð¸Ð¹** (written)\n- Ð·Ñ€Ð¾Ð±Ð¸-Ñ‚Ð¸ â†’ Ð·Ñ€Ð¾Ð±Ð»**ÐµÐ½Ð¸Ð¹** (made/done)\n- Ð·Ð°ÐºÑ€Ð¸-Ñ‚Ð¸ â†’ Ð·Ð°ÐºÑ€Ð¸**Ñ‚Ð¸Ð¹** (closed)\n- Ð²Ñ–Ð´ÐºÑ€Ð¸-Ñ‚Ð¸ â†’ Ð²Ñ–Ð´ÐºÑ€Ð¸**Ñ‚Ð¸Ð¹** (opened)\n\n**Key grammatical point:** The participle agrees with the noun in gender, number, and case, just like an adjective:\n\n| Gender | Example | Translation |\n|--------|---------|-------------|\n| Masculine | Ð›Ð¸ÑÑ‚ **Ð½Ð°Ð¿Ð¸ÑÐ°Ð½Ð¸Ð¹** | The letter is written |\n| Feminine | ÐšÐ½Ð¸Ð³Ð° **Ð½Ð°Ð¿Ð¸ÑÐ°Ð½Ð°** | The book is written |\n| Neuter | Ð¡Ð»Ð¾Ð²Ð¾ **Ð½Ð°Ð¿Ð¸ÑÐ°Ð½Ðµ** | The word is written |\n| Plural | Ð›Ð¸ÑÑ‚Ð¸ **Ð½Ð°Ð¿Ð¸ÑÐ°Ð½Ñ–** | The letters are written |\n\n**Tense formation with \"Ð±ÑƒÑ‚Ð¸\":**\nUnlike the impersonal form, participial passive can express all tenses:\n- Past: ÐšÐ½Ð¸Ð³Ð° **Ð±ÑƒÐ»Ð° Ð½Ð°Ð¿Ð¸ÑÐ°Ð½Ð°** Ð°Ð²Ñ‚Ð¾Ñ€Ð¾Ð¼. (The book was written by the author.)\n- Present: ÐšÐ½Ð¸Ð³Ð° **Ñ” Ð½Ð°Ð¿Ð¸ÑÐ°Ð½Ð°** (rare, bookish style)\n- Future: ÐšÐ½Ð¸Ð³Ð° **Ð±ÑƒÐ´Ðµ Ð½Ð°Ð¿Ð¸ÑÐ°Ð½Ð°** Ð·Ð°Ð²Ñ‚Ñ€Ð°. (The book will be written tomorrow.)\n\n**Agent expression:** The agent (performer) is expressed in the **instrumental case**:\n- ÐšÐ½Ð¸Ð³Ð° Ð½Ð°Ð¿Ð¸ÑÐ°Ð½Ð° **Ð°Ð²Ñ‚Ð¾Ñ€Ð¾Ð¼**. (The book was written by the author.)\n- Ð‘ÑƒÐ´Ð¸Ð½Ð¾Ðº Ð¿Ð¾Ð±ÑƒÐ´Ð¾Ð²Ð°Ð½Ð¸Ð¹ **Ð°Ñ€Ñ…Ñ–Ñ‚ÐµÐºÑ‚Ð¾Ñ€Ð¾Ð¼**. (The building was built by the architect.)\n\n> ðŸŒ **Real World**\n>\n> In news broadcasts, you'll often hear: \"Ð‘ÑƒÐ´Ð¸Ð½Ð¾Ðº **Ð¿Ð¾Ð±ÑƒÐ´Ð¾Ð²Ð°Ð½Ð¸Ð¹** Ñƒ 2010 Ñ€Ð¾Ñ†Ñ–.\" Television and press prefer this form because it sounds neutral and professional.\n\n**Common verbs that form participial passives:**\n\nThe following verbs frequently appear in literary and journalistic texts:\n\n| Infinitive | Participle | Example |\n|------------|------------|---------|\n| Ð½Ð°Ð¿Ð¸ÑÐ°Ñ‚Ð¸ | Ð½Ð°Ð¿Ð¸ÑÐ°Ð½Ð¸Ð¹ | Ð Ð¾Ð¼Ð°Ð½ Ð½Ð°Ð¿Ð¸ÑÐ°Ð½Ð¸Ð¹ |\n| Ð¿Ñ€Ð¾Ñ‡Ð¸Ñ‚Ð°Ñ‚Ð¸ | Ð¿Ñ€Ð¾Ñ‡Ð¸Ñ‚Ð°Ð½Ð¸Ð¹ | ÐšÐ½Ð¸Ð³Ð° Ð¿Ñ€Ð¾Ñ‡Ð¸Ñ‚Ð°Ð½Ð° |\n| Ð·Ñ€Ð¾Ð±Ð¸Ñ‚Ð¸ | Ð·Ñ€Ð¾Ð±Ð»ÐµÐ½Ð¸Ð¹ | Ð Ð¾Ð±Ð¾Ñ‚Ð° Ð·Ñ€Ð¾Ð±Ð»ÐµÐ½Ð° |\n| Ð¿Ð¾Ð±ÑƒÐ´ÑƒÐ²Ð°Ñ‚Ð¸ | Ð¿Ð¾Ð±ÑƒÐ´Ð¾Ð²Ð°Ð½Ð¸Ð¹ | Ð”Ñ–Ð¼ Ð¿Ð¾Ð±ÑƒÐ´Ð¾Ð²Ð°Ð½Ð¸Ð¹ |\n| Ð²Ñ–Ð´Ð¿Ñ€Ð°Ð²Ð¸Ñ‚Ð¸ | Ð²Ñ–Ð´Ð¿Ñ€Ð°Ð²Ð»ÐµÐ½Ð¸Ð¹ | Ð›Ð¸ÑÑ‚ Ð²Ñ–Ð´Ð¿Ñ€Ð°Ð²Ð»ÐµÐ½Ð¸Ð¹ |\n| Ð¾Ñ‚Ñ€Ð¸Ð¼Ð°Ñ‚Ð¸ | Ð¾Ñ‚Ñ€Ð¸Ð¼Ð°Ð½Ð¸Ð¹ | Ð’Ñ–Ð´Ð¿Ð¾Ð²Ñ–Ð´ÑŒ Ð¾Ñ‚Ñ€Ð¸Ð¼Ð°Ð½Ð° |\n\n---\n\n### 2. Impersonal Form (-Ð½Ð¾/-Ñ‚Ð¾)\n\nThis is a uniquely Ukrainian construction that doesn't exist in many languages. It signals official, bureaucratic style.\n\n**Formation:**\nFrom the participle â†’ short neuter form:\n- Ð½Ð°Ð¿Ð¸ÑÐ°Ð½Ð¸Ð¹ â†’ Ð½Ð°Ð¿Ð¸Ñ**Ð°Ð½Ð¾**\n- Ð·Ñ€Ð¾Ð±Ð»ÐµÐ½Ð¸Ð¹ â†’ Ð·Ñ€Ð¾Ð±Ð»**ÐµÐ½Ð¾**\n- Ð·Ð°ÐºÑ€Ð¸Ñ‚Ð¸Ð¹ â†’ Ð·Ð°ÐºÑ€Ð¸**Ñ‚Ð¾**\n\n**Critical grammatical features:**\n1. **Does not change** (always neuter singular form)\n2. **Object in accusative case**: **ÐšÐ½Ð¸Ð³Ñƒ** Ð½Ð°Ð¿Ð¸ÑÐ°Ð½Ð¾ (NOT ~~ÐšÐ½Ð¸Ð³Ð° Ð½Ð°Ð¿Ð¸ÑÐ°Ð½Ð¾~~)\n3. **Agent is not expressed** (impersonal by nature)\n4. **Signals official register**\n\nThis is perhaps the most important distinction from the participial form: with -Ð½Ð¾/-Ñ‚Ð¾, the logical object takes the ACCUSATIVE case, not nominative.\n\n**Typical contexts:**\n- **Ð—Ð°ÑÑ–Ð´Ð°Ð½Ð½Ñ Ð¾Ð³Ð¾Ð»Ð¾ÑˆÐµÐ½Ð¾ Ð·Ð°ÐºÑ€Ð¸Ñ‚Ð¸Ð¼.** (The meeting is declared closed.)\n- **Ð Ñ–ÑˆÐµÐ½Ð½Ñ Ð¿Ñ€Ð¸Ð¹Ð½ÑÑ‚Ð¾.** (The decision has been made.)\n- **Ð Ð¾Ð±Ð¾Ñ‚Ñƒ Ð·Ð°Ð²ÐµÑ€ÑˆÐµÐ½Ð¾.** (The work has been completed.)\n- **ÐÐ°ÐºÐ°Ð· Ð²Ð¸Ð´Ð°Ð½Ð¾.** (The order has been issued.)\n\n> ðŸ’¡ **Did You Know**\n>\n> The -Ð½Ð¾/-Ñ‚Ð¾ form is bureaucracy's favorite weapon. It hides the performer: \"Ð’Ð°Ñ Ð·Ð²Ñ–Ð»ÑŒÐ½ÐµÐ½Ð¾\" (You are fired) sounds like a natural disaster, not a decision made by a specific person. This is the grammar of power.\n\n**Historical development:**\n\nThe -Ð½Ð¾/-Ñ‚Ð¾ construction emerged from the neuter form of past passive participles. Over centuries, it developed into a distinct grammatical category â€” an impersonal passive that became the signature of official Ukrainian. Today, it remains one of the most distinctive features of the Ukrainian language, setting it apart from Russian, Polish, and other Slavic languages. Government documents, legal texts, and formal announcements almost exclusively use this form.\n\n---\n\n### 3. Reflexive Form (-ÑÑ)\n\nThis form emphasizes the **process**, not the result. It's common in scientific and technical styles.\n\n**Formation:**\nThird person verb + **-ÑÑ/-ÑÑŒ**:\n- Ð‘ÑƒÐ´Ð¸Ð½Ð¾Ðº Ð±ÑƒÐ´ÑƒÑ”**Ñ‚ÑŒÑÑ**. (The building is being built.)\n- ÐšÐ½Ð¸Ð³Ð° Ñ‡Ð¸Ñ‚Ð°Ñ”**Ñ‚ÑŒÑÑ** Ð»ÐµÐ³ÐºÐ¾. (The book reads easily.)\n\n**Key grammatical features:**\n1. **Emphasizes ongoing process**, not completed result\n2. **Agent CAN be expressed** with instrumental case\n3. **Common in scientific style** for impersonal descriptions\n\n**Examples with analysis:**\n- **Ð•ÐºÑÐ¿ÐµÑ€Ð¸Ð¼ÐµÐ½Ñ‚ Ð¿Ñ€Ð¾Ð²Ð¾Ð´Ð¸Ñ‚ÑŒÑÑ** Ð² Ð»Ð°Ð±Ð¾Ñ€Ð°Ñ‚Ð¾Ñ€Ñ–Ñ—. (The experiment is being conducted in the lab.) â€” Focus on ongoing process\n- **Ð¦Ñ Ð¿Ñ€Ð¾Ð±Ð»ÐµÐ¼Ð° Ð²Ð¸Ð²Ñ‡Ð°Ñ”Ñ‚ÑŒÑÑ** Ð½Ð°ÑƒÐºÐ¾Ð²Ñ†ÑÐ¼Ð¸. (This problem is being studied by scientists.) â€” Agent in instrumental\n- **Ð—Ð°ÐºÐ¾Ð½ Ð·Ð°ÑÑ‚Ð¾ÑÐ¾Ð²ÑƒÑ”Ñ‚ÑŒÑÑ** Ð´Ð¾ Ð²ÑÑ–Ñ… Ð³Ñ€Ð¾Ð¼Ð°Ð´ÑÐ½. (The law applies to all citizens.) â€” General ongoing state\n\n> ðŸŽ¬ **Pop Culture Moment**\n>\n> In detective films, you'll often hear: \"Ð¡Ð¿Ñ€Ð°Ð²Ð° Ñ€Ð¾Ð·ÑÐ»Ñ–Ð´ÑƒÑ”Ñ‚ÑŒÑÑ.\" (The case is being investigated.) The detective genre loves this form â€” it creates tension because the process continues, the result is unknown.\n\n---\n\n### 4. Third Person Plural (Colloquial Passive)\n\nThe simplest and most colloquial form. Uses third person plural without an expressed subject.\n\n**Formation:**\nThird person plural without \"Ð²Ð¾Ð½Ð¸\" (they):\n- **ÐœÐµÐ½Ñ– ÑÐºÐ°Ð·Ð°Ð»Ð¸.** (I was told. / They told me.)\n- **Ð™Ð¾Ð¼Ñƒ Ð´Ð°Ð»Ð¸ Ð²Ñ–Ð´Ð¿Ð¾Ð²Ñ–Ð´ÑŒ.** (He was given an answer.)\n\n**Key grammatical features:**\n1. **Most colloquial passive form**\n2. **Implies unspecified \"they\"**\n3. **Recipient often in dative case**\n\n**Examples with case analysis:**\n- Ð£ Ð¼Ð°Ð³Ð°Ð·Ð¸Ð½Ñ– **Ð¼ÐµÐ½Ðµ Ð·Ð°Ð¿Ð¸Ñ‚Ð°Ð»Ð¸** Ð¿Ñ€Ð¾ Ð·Ð½Ð¸Ð¶ÐºÑƒ. â€” Ð¼ÐµÐ½Ðµ = Ð·Ð½Ð°Ñ…Ñ–Ð´Ð½Ð¸Ð¹ Ð²Ñ–Ð´Ð¼Ñ–Ð½Ð¾Ðº\n- ÐŸÐ¾ Ñ‚ÐµÐ»ÐµÑ„Ð¾Ð½Ñƒ **Ð½Ð°Ð¼ Ð¿Ð¾Ð²Ñ–Ð´Ð¾Ð¼Ð¸Ð»Ð¸** Ð½Ð¾Ð²Ð¸Ð½Ñƒ. â€” Ð½Ð°Ð¼ = Ð´Ð°Ð²Ð°Ð»ÑŒÐ½Ð¸Ð¹ Ð²Ñ–Ð´Ð¼Ñ–Ð½Ð¾Ðº\n- **Ð™Ð¾Ð¼Ñƒ Ð¿Ð¾Ð¾Ð±Ñ–Ñ†ÑÐ»Ð¸** Ð¿Ñ–Ð´Ð²Ð¸Ñ‰ÐµÐ½Ð½Ñ. â€” Ð¹Ð¾Ð¼Ñƒ = Ð´Ð°Ð²Ð°Ð»ÑŒÐ½Ð¸Ð¹ Ð²Ñ–Ð´Ð¼Ñ–Ð½Ð¾Ðº\n\n> ðŸŒ **Real World**\n>\n> When Ukrainians tell stories about their day, they say: \"ÐœÐµÐ½Ñ– Ð·Ð°Ñ‚ÐµÐ»ÐµÑ„Ð¾Ð½ÑƒÐ²Ð°Ð»Ð¸\", \"ÐœÐµÐ½Ðµ Ð·Ð°Ð¿Ñ€Ð¾ÑÐ¸Ð»Ð¸\", \"ÐÐ°Ð¼ ÑÐºÐ°Ð·Ð°Ð»Ð¸\". This sounds natural and relaxed â€” unlike the bookish forms.\n\n---\n\n## ÐŸÐ¾Ð³Ð»Ð¸Ð±Ð»ÐµÐ½Ð½Ñ\n\n### Choosing the Right Form by Context\n\nWhich form to choose? It depends on register and emphasis:\n\n| Context | Best Form | Example | Why |\n|---------|-----------|---------|-----|\n| Legal document | -Ð½Ð¾/-Ñ‚Ð¾ | Ð Ñ–ÑˆÐµÐ½Ð½Ñ Ð¿Ñ€Ð¸Ð¹Ð½ÑÑ‚Ð¾. | Official, impersonal |\n| Scientific paper | -ÑÑ | Ð•ÐºÑÐ¿ÐµÑ€Ð¸Ð¼ÐµÐ½Ñ‚ Ð¿Ñ€Ð¾Ð²Ð¾Ð´Ð¸Ñ‚ÑŒÑÑ. | Process focus |\n| News article | -Ð½Ð¸Ð¹/-Ñ‚Ð¸Ð¹ | Ð‘ÑƒÐ´Ð¸Ð½Ð¾Ðº Ð¿Ð¾Ð±ÑƒÐ´Ð¾Ð²Ð°Ð½Ð¸Ð¹. | Neutral, professional |\n| Literary fiction | -Ð½Ð¸Ð¹/-Ñ‚Ð¸Ð¹ | Ð†ÑÑ‚Ð¾Ñ€Ñ–Ñ Ñ€Ð¾Ð·ÐºÐ°Ð·Ð°Ð½Ð°. | Elegant, literary |\n| Conversation | 3rd pl. | ÐœÐµÐ½Ñ– ÑÐºÐ°Ð·Ð°Ð»Ð¸. | Natural, relaxed |\n\n### Transformation Practice: Active â†’ Passive\n\nCompare active and passive versions:\n\n**Active sentence:**\nÐÐ²Ñ‚Ð¾Ñ€ Ð½Ð°Ð¿Ð¸ÑÐ°Ð² ÐºÐ½Ð¸Ð³Ñƒ. (The author wrote the book.)\n\n**Four passive transformations:**\n\n1. **ÐšÐ½Ð¸Ð³Ð° Ð½Ð°Ð¿Ð¸ÑÐ°Ð½Ð° Ð°Ð²Ñ‚Ð¾Ñ€Ð¾Ð¼.** (participial â€” literary)\n2. **ÐšÐ½Ð¸Ð³Ñƒ Ð½Ð°Ð¿Ð¸ÑÐ°Ð½Ð¾.** (impersonal â€” official)\n3. **ÐšÐ½Ð¸Ð³Ð° Ð¿Ð¸ÑˆÐµÑ‚ÑŒÑÑ Ð°Ð²Ñ‚Ð¾Ñ€Ð¾Ð¼.** (reflexive â€” processual, but unusual for completed action)\n4. **ÐšÐ½Ð¸Ð³Ñƒ Ð½Ð°Ð¿Ð¸ÑÐ°Ð»Ð¸.** (3rd pl. â€” colloquial)\n\nNote that option 3 sounds unusual because -ÑÑ typically implies ongoing process, not completed action. You would more naturally say \"ÐšÐ½Ð¸Ð³Ð° Ð±ÑƒÐ»Ð° Ð½Ð°Ð¿Ð¸ÑÐ°Ð½Ð°\" or use the -Ð½Ð¾ form for a completed action.\n\n---\n\n### ÐœÑ–Ð½Ñ–-Ð´Ñ–Ð°Ð»Ð¾Ð³Ð¸\n\n**Ð”Ñ–Ð°Ð»Ð¾Ð³ 1: Ð’ Ð¾Ñ„Ñ–ÑÑ–**\n\nâ€” Ð©Ð¾ Ð· Ð½Ð°ÑˆÐ¸Ð¼ Ð¿Ñ€Ð¾ÐµÐºÑ‚Ð¾Ð¼?\nâ€” **ÐŸÑ€Ð¾ÐµÐºÑ‚ Ð·Ð°Ñ‚Ð²ÐµÑ€Ð´Ð¶ÐµÐ½Ð¾** Ð¼Ð¸Ð½ÑƒÐ»Ð¾Ð³Ð¾ Ñ‚Ð¸Ð¶Ð½Ñ.\nâ€” Ð Ð±ÑŽÐ´Ð¶ÐµÑ‚?\nâ€” **Ð‘ÑŽÐ´Ð¶ÐµÑ‚ Ñ‰Ðµ Ñ€Ð¾Ð·Ð³Ð»ÑÐ´Ð°Ñ”Ñ‚ÑŒÑÑ**.\nâ€” ÐšÐ¾Ð»Ð¸ Ð±ÑƒÐ´Ðµ Ñ€Ñ–ÑˆÐµÐ½Ð½Ñ?\nâ€” **ÐÐ°Ð¼ Ð¾Ð±Ñ–Ñ†ÑÐ»Ð¸** Ð²Ñ–Ð´Ð¿Ð¾Ð²Ñ–Ð´ÑŒ Ð´Ð¾ Ð¿'ÑÑ‚Ð½Ð¸Ñ†Ñ–.\n\n**Ð”Ñ–Ð°Ð»Ð¾Ð³ 2: Ð Ð¾Ð·Ð¼Ð¾Ð²Ð° Ð´Ñ€ÑƒÐ·Ñ–Ð²**\n\nâ€” Ð§ÑƒÐ² Ð½Ð¾Ð²Ð¸Ð½Ñƒ Ð¿Ñ€Ð¾ ÐœÐ°Ñ€ÐºÐ°?\nâ€” Ð¢Ð°Ðº, **Ð¹Ð¾Ð¼Ñƒ Ð·Ð°Ð¿Ñ€Ð¾Ð¿Ð¾Ð½ÑƒÐ²Ð°Ð»Ð¸** Ñ€Ð¾Ð±Ð¾Ñ‚Ñƒ Ð² ÐÑ–Ð¼ÐµÑ‡Ñ‡Ð¸Ð½Ñ–!\nâ€” Ð¡ÐµÑ€Ð¹Ð¾Ð·Ð½Ð¾? Ð ÐºÐ²Ð°Ñ€Ñ‚Ð¸Ñ€Ð°?\nâ€” **ÐšÐ²Ð°Ñ€Ñ‚Ð¸Ñ€Ñƒ Ð²Ð¶Ðµ Ð¿Ñ€Ð¾Ð´Ð°Ð½Ð¾**.\nâ€” Ð¨Ð²Ð¸Ð´ÐºÐ¾ Ð²Ñ–Ð½ ÑƒÑÐµ Ð²Ð¸Ñ€Ñ–ÑˆÐ¸Ð².\n\n**Ð”Ñ–Ð°Ð»Ð¾Ð³ 3: ÐÐ°ÑƒÐºÐ¾Ð²Ð¸Ð¹ ÑÐµÐ¼Ñ–Ð½Ð°Ñ€**\n\nâ€” Ð¯Ðº Ð¿Ñ€Ð¾ÑÑƒÐ²Ð°Ñ”Ñ‚ÑŒÑÑ Ð²Ð°ÑˆÐµ Ð´Ð¾ÑÐ»Ñ–Ð´Ð¶ÐµÐ½Ð½Ñ?\nâ€” **Ð”Ð°Ð½Ñ– Ð·Ð±Ð¸Ñ€Ð°ÑŽÑ‚ÑŒÑÑ** Ð²Ð¶Ðµ Ñ‚Ñ€Ð¸ Ð¼Ñ–ÑÑÑ†Ñ–.\nâ€” Ð Ð°Ð½Ð°Ð»Ñ–Ð·?\nâ€” **ÐŸÐµÑ€ÑˆÑ– Ñ€ÐµÐ·ÑƒÐ»ÑŒÑ‚Ð°Ñ‚Ð¸ Ð¾Ñ‚Ñ€Ð¸Ð¼Ð°Ð½Ð¾** Ð¼Ð¸Ð½ÑƒÐ»Ð¾Ð³Ð¾ Ñ‚Ð¸Ð¶Ð½Ñ.\nâ€” ÐšÐ¾Ð»Ð¸ **Ð±ÑƒÐ´Ðµ Ð¾Ð¿ÑƒÐ±Ð»Ñ–ÐºÐ¾Ð²Ð°Ð½Ð¾** ÑÑ‚Ð°Ñ‚Ñ‚ÑŽ?\nâ€” Ð¡Ð¿Ð¾Ð´Ñ–Ð²Ð°ÑŽÑÑŒ, Ð´Ð¾ ÐºÑ–Ð½Ñ†Ñ Ñ€Ð¾ÐºÑƒ.\n\n**Ð”Ñ–Ð°Ð»Ð¾Ð³ 4: ÐÐ¾Ð²Ð¸Ð½Ð¸**\n\nâ€” Ð©Ð¾ ÑÑ‚Ð°Ð»Ð¾ÑÑ Ð² Ð¿Ð°Ñ€Ð»Ð°Ð¼ÐµÐ½Ñ‚Ñ–?\nâ€” **Ð—Ð°ÐºÐ¾Ð½ Ð¿Ñ€Ð¸Ð¹Ð½ÑÑ‚Ð¾** 226 Ð³Ð¾Ð»Ð¾ÑÐ°Ð¼Ð¸.\nâ€” Ð Ð¿Ñ€ÐµÐ·Ð¸Ð´ÐµÐ½Ñ‚?\nâ€” **Ð—Ð°ÐºÐ¾Ð½ Ñ‰Ðµ Ð½Ðµ Ð¿Ñ–Ð´Ð¿Ð¸ÑÐ°Ð½Ð¾**.\nâ€” ÐšÐ¾Ð»Ð¸ **Ð±ÑƒÐ´Ðµ Ð¿Ñ–Ð´Ð¿Ð¸ÑÐ°Ð½Ð¾**?\nâ€” **ÐžÑ‡Ñ–ÐºÑƒÑ”Ñ‚ÑŒÑÑ**, Ñ‰Ð¾ Ð½Ð° Ð½Ð°ÑÑ‚ÑƒÐ¿Ð½Ð¾Ð¼Ñƒ Ñ‚Ð¸Ð¶Ð½Ñ–.\n\n---\n\n## ÐŸÑ€Ð°ÐºÑ‚Ð¸ÐºÐ°\n\n### Ð’Ð¿Ñ€Ð°Ð²Ð° 1: Ð’Ð¸Ð·Ð½Ð°Ñ‡ÐµÐ½Ð½Ñ Ñ„Ð¾Ñ€Ð¼Ð¸\n\nIdentify which passive form is used in each sentence:\n\n1. Ð Ñ–ÑˆÐµÐ½Ð½Ñ Ð¿Ñ€Ð¸Ð¹Ð½ÑÑ‚Ð¾ Ð¾Ð´Ð½Ð¾Ð³Ð¾Ð»Ð¾ÑÐ½Ð¾.\n2. Ð¦ÐµÐ¹ Ð¼ÐµÑ‚Ð¾Ð´ Ð²Ð¸ÐºÐ¾Ñ€Ð¸ÑÑ‚Ð¾Ð²ÑƒÑ”Ñ‚ÑŒÑÑ Ð² Ð¼ÐµÐ´Ð¸Ñ†Ð¸Ð½Ñ–.\n3. ÐœÐµÐ½Ñ– Ð¿Ð¾Ñ€Ð°Ð´Ð¸Ð»Ð¸ Ð·Ð²ÐµÑ€Ð½ÑƒÑ‚Ð¸ÑÑ Ð´Ð¾ Ð»Ñ–ÐºÐ°Ñ€Ñ.\n4. Ð›Ð¸ÑÑ‚ Ð±ÑƒÐ² Ð½Ð°Ð¿Ð¸ÑÐ°Ð½Ð¸Ð¹ ÑƒÑ‡Ð¾Ñ€Ð°.\n\n**Answers:**\n1. Impersonal (-Ð½Ð¾)\n2. Reflexive (-ÑÑ)\n3. Third person plural\n4. Participial (-Ð½Ð¸Ð¹)\n\n### Ð’Ð¿Ñ€Ð°Ð²Ð° 2: Ð¢Ñ€Ð°Ð½ÑÑ„Ð¾Ñ€Ð¼Ð°Ñ†Ñ–Ñ\n\nTransform active sentences to passive using the indicated form:\n\n1. Ð¡Ñ‚ÑƒÐ´ÐµÐ½Ñ‚Ð¸ Ð½Ð°Ð¿Ð¸ÑÐ°Ð»Ð¸ ÐµÑÐµ. â†’ (-Ð½Ð¾/-Ñ‚Ð¾)\n2. Ð’Ñ‡ÐµÐ½Ð¸Ð¹ Ð²Ñ–Ð´ÐºÑ€Ð¸Ð² Ð½Ð¾Ð²Ð¸Ð¹ ÐµÐ»ÐµÐ¼ÐµÐ½Ñ‚. â†’ (-ÑÑ)\n3. Ð”Ð¸Ñ€ÐµÐºÑ‚Ð¾Ñ€ Ð¿Ñ–Ð´Ð¿Ð¸ÑÐ°Ð² Ð´Ð¾ÐºÑƒÐ¼ÐµÐ½Ñ‚. â†’ (-Ð½Ð¸Ð¹/-Ñ‚Ð¸Ð¹)\n4. ÐšÐ¾Ð»ÐµÐ³Ð¸ Ð·Ð°Ð¿Ñ€Ð¾ÑÐ¸Ð»Ð¸ Ð¼ÐµÐ½Ðµ Ð½Ð° Ð²ÐµÑ‡Ñ–Ñ€ÐºÑƒ. â†’ (3rd pl.)\n\n**Answers:**\n1. Ð•ÑÐµ Ð½Ð°Ð¿Ð¸ÑÐ°Ð½Ð¾.\n2. ÐÐ¾Ð²Ð¸Ð¹ ÐµÐ»ÐµÐ¼ÐµÐ½Ñ‚ Ð²Ñ–Ð´ÐºÑ€Ð¸Ð²Ð°Ñ”Ñ‚ÑŒÑÑ Ð²Ñ‡ÐµÐ½Ð¸Ð¼. (or: Ð±ÑƒÐ² Ð²Ñ–Ð´ÐºÑ€Ð¸Ñ‚Ð¸Ð¹)\n3. Ð”Ð¾ÐºÑƒÐ¼ÐµÐ½Ñ‚ Ð¿Ñ–Ð´Ð¿Ð¸ÑÐ°Ð½Ð¸Ð¹ Ð´Ð¸Ñ€ÐµÐºÑ‚Ð¾Ñ€Ð¾Ð¼.\n4. ÐœÐµÐ½Ðµ Ð·Ð°Ð¿Ñ€Ð¾ÑÐ¸Ð»Ð¸ Ð½Ð° Ð²ÐµÑ‡Ñ–Ñ€ÐºÑƒ.\n\n> ðŸŽ¯ **Fun Fact**\n>\n> Historically, the -Ð½Ð¾/-Ñ‚Ð¾ form developed from the neuter participle. That's why it doesn't change â€” it's a \"frozen\" form that became an independent construction.\n\n---"
      },
      {
        "id": "section-2",
        "name": "ÐŸÑ–Ð´ÑÑƒÐ¼Ð¾Ðº",
        "nameEn": null,
        "type": "summary",
        "content": "In this module, you mastered the complete Ukrainian passive voice system.\n\n**The Four Passive Forms:**\n\n| Form | Example | Register | Key Feature |\n|------|---------|----------|-------------|\n| Participial | ÐšÐ½Ð¸Ð³Ð° **Ð½Ð°Ð¿Ð¸ÑÐ°Ð½Ð°** | Literary | Agrees with noun |\n| Impersonal | ÐšÐ½Ð¸Ð³Ñƒ **Ð½Ð°Ð¿Ð¸ÑÐ°Ð½Ð¾** | Official | Object in accusative |\n| Reflexive | ÐšÐ½Ð¸Ð³Ð° **Ð¿Ð¸ÑˆÐµÑ‚ÑŒÑÑ** | Scientific | Process emphasis |\n| 3rd pl. | ÐšÐ½Ð¸Ð³Ñƒ **Ð½Ð°Ð¿Ð¸ÑÐ°Ð»Ð¸** | Colloquial | Implied \"they\" |\n\n**Key Rules:**\n1. Participles agree with the noun in gender, number, and case\n2. Impersonal -Ð½Ð¾/-Ñ‚Ð¾ never changes; object takes accusative\n3. Reflexive form emphasizes process, not result\n4. Third person plural is the most colloquial form\n\n**Form Selection Guide:**\n- Official document â†’ -Ð½Ð¾/-Ñ‚Ð¾\n- Scientific article â†’ -ÑÑ\n- Literary text â†’ -Ð½Ð¸Ð¹/-Ñ‚Ð¸Ð¹\n- Conversation â†’ 3rd person plural\n\n---"
      },
      {
        "id": "section-3",
        "name": "Ð’Ð¿Ñ€Ð°Ð²Ð¸",
        "nameEn": null,
        "type": "activities",
        "content": "## quiz: Ð’Ð¸Ð·Ð½Ð°Ñ‡ÐµÐ½Ð½Ñ Ð¿Ð°ÑÐ¸Ð²Ð½Ð¸Ñ… Ñ„Ð¾Ñ€Ð¼\n> ÐžÐ±ÐµÑ€Ñ–Ñ‚ÑŒ Ð¿Ñ€Ð°Ð²Ð¸Ð»ÑŒÐ½Ñƒ Ð²Ñ–Ð´Ð¿Ð¾Ð²Ñ–Ð´ÑŒ.\n\n1. Ð¯ÐºÐ° Ð¿Ð°ÑÐ¸Ð²Ð½Ð° Ñ„Ð¾Ñ€Ð¼Ð° Ñƒ Ñ€ÐµÑ‡ÐµÐ½Ð½Ñ– \"Ð”Ð¾ÐºÑƒÐ¼ÐµÐ½Ñ‚ Ð¿Ñ–Ð´Ð¿Ð¸ÑÐ°Ð½Ð¾ Ð´Ð¸Ñ€ÐµÐºÑ‚Ð¾Ñ€Ð¾Ð¼\"?\n   - [ ] Ð”Ñ–Ñ”Ð¿Ñ€Ð¸ÐºÐ¼ÐµÑ‚Ð½Ð¸ÐºÐ¾Ð²Ð° (-Ð½Ð¸Ð¹/-Ñ‚Ð¸Ð¹)\n   - [x] Ð‘ÐµÐ·Ð¾ÑÐ¾Ð±Ð¾Ð²Ð° (-Ð½Ð¾/-Ñ‚Ð¾)\n   - [ ] Ð—Ð²Ð¾Ñ€Ð¾Ñ‚Ð½Ð° (-ÑÑ)\n   - [ ] Ð¢Ñ€ÐµÑ‚Ñ Ð¾ÑÐ¾Ð±Ð° Ð¼Ð½Ð¾Ð¶Ð¸Ð½Ð¸\n   > Ð—Ð°ÐºÑ–Ð½Ñ‡ÐµÐ½Ð½Ñ -Ð½Ð¾ Ð²ÐºÐ°Ð·ÑƒÑ” Ð½Ð° Ð±ÐµÐ·Ð¾ÑÐ¾Ð±Ð¾Ð²Ñƒ Ñ„Ð¾Ñ€Ð¼Ñƒ.\n\n2. Ð¯ÐºÐ° Ñ„Ð¾Ñ€Ð¼Ð° Ð½Ð°Ð¹Ñ€Ð¾Ð·Ð¼Ð¾Ð²Ð½Ñ–ÑˆÐ°?\n   - [ ] ÐšÐ½Ð¸Ð³Ð° Ð½Ð°Ð¿Ð¸ÑÐ°Ð½Ð°.\n   - [ ] ÐšÐ½Ð¸Ð³Ñƒ Ð½Ð°Ð¿Ð¸ÑÐ°Ð½Ð¾.\n   - [ ] ÐšÐ½Ð¸Ð³Ð° Ð¿Ð¸ÑˆÐµÑ‚ÑŒÑÑ.\n   - [x] ÐšÐ½Ð¸Ð³Ñƒ Ð½Ð°Ð¿Ð¸ÑÐ°Ð»Ð¸.\n   > Ð¢Ñ€ÐµÑ‚Ñ Ð¾ÑÐ¾Ð±Ð° Ð¼Ð½Ð¾Ð¶Ð¸Ð½Ð¸ â€” Ð½Ð°Ð¹Ñ€Ð¾Ð·Ð¼Ð¾Ð²Ð½Ñ–ÑˆÐ° Ñ„Ð¾Ñ€Ð¼Ð° Ð¿Ð°ÑÐ¸Ð²Ñƒ.\n\n3. Ð¯ÐºÐ¸Ð¹ Ñ€ÐµÑ”ÑÑ‚Ñ€ ÑÐ¸Ð³Ð½Ð°Ð»Ñ–Ð·ÑƒÑ” Ñ„Ð¾Ñ€Ð¼Ð° \"Ð Ñ–ÑˆÐµÐ½Ð½Ñ Ð¿Ñ€Ð¸Ð¹Ð½ÑÑ‚Ð¾\"?\n   - [ ] Ð›Ñ–Ñ‚ÐµÑ€Ð°Ñ‚ÑƒÑ€Ð½Ð¸Ð¹\n   - [ ] ÐÐ°ÑƒÐºÐ¾Ð²Ð¸Ð¹\n   - [x] ÐžÑ„Ñ–Ñ†Ñ–Ð¹Ð½Ð¾-Ð´Ñ–Ð»Ð¾Ð²Ð¸Ð¹\n   - [ ] Ð Ð¾Ð·Ð¼Ð¾Ð²Ð½Ð¸Ð¹\n   > Ð¤Ð¾Ñ€Ð¼Ð° -Ð½Ð¾/-Ñ‚Ð¾ â€” Ð¼Ð°Ñ€ÐºÐµÑ€ Ð¾Ñ„Ñ–Ñ†Ñ–Ð¹Ð½Ð¾Ð³Ð¾ ÑÑ‚Ð¸Ð»ÑŽ.\n\n4. Ð¯ÐºÐ° Ñ„Ð¾Ñ€Ð¼Ð° Ð²Ð¸ÐºÐ¾Ñ€Ð¸ÑÑ‚Ð¾Ð²ÑƒÑ”Ñ‚ÑŒÑÑ Ð´Ð»Ñ Ð¾Ð¿Ð¸ÑÑƒ Ð¿Ñ€Ð¾Ñ†ÐµÑÑƒ?\n   - [ ] Ð”Ñ–Ñ”Ð¿Ñ€Ð¸ÐºÐ¼ÐµÑ‚Ð½Ð¸ÐºÐ¾Ð²Ð°\n   - [ ] Ð‘ÐµÐ·Ð¾ÑÐ¾Ð±Ð¾Ð²Ð°\n   - [x] Ð—Ð²Ð¾Ñ€Ð¾Ñ‚Ð½Ð° (-ÑÑ)\n   - [ ] Ð¢Ñ€ÐµÑ‚Ñ Ð¾ÑÐ¾Ð±Ð° Ð¼Ð½Ð¾Ð¶Ð¸Ð½Ð¸\n   > Ð—Ð²Ð¾Ñ€Ð¾Ñ‚Ð½Ð° Ñ„Ð¾Ñ€Ð¼Ð° Ð½Ð°Ð³Ð¾Ð»Ð¾ÑˆÑƒÑ” Ð½Ð° Ð¿Ñ€Ð¾Ñ†ÐµÑÑ–.\n\n5. \"ÐœÐµÐ½Ðµ Ð·Ð°Ð¿Ð¸Ñ‚Ð°Ð»Ð¸ Ð¿Ñ€Ð¾ Ñ†Ðµ\" â€” ÑÐºÐ° Ñ„Ð¾Ñ€Ð¼Ð°?\n   - [ ] Ð”Ñ–Ñ”Ð¿Ñ€Ð¸ÐºÐ¼ÐµÑ‚Ð½Ð¸ÐºÐ¾Ð²Ð°\n   - [ ] Ð‘ÐµÐ·Ð¾ÑÐ¾Ð±Ð¾Ð²Ð°\n   - [ ] Ð—Ð²Ð¾Ñ€Ð¾Ñ‚Ð½Ð°\n   - [x] Ð¢Ñ€ÐµÑ‚Ñ Ð¾ÑÐ¾Ð±Ð° Ð¼Ð½Ð¾Ð¶Ð¸Ð½Ð¸\n   > ÐÐµÐ¼Ð°Ñ” Ð²Ð¸Ñ€Ð°Ð¶ÐµÐ½Ð¾Ð³Ð¾ ÑÑƒÐ±'Ñ”ÐºÑ‚Ð°, Ð´Ñ–Ñ”ÑÐ»Ð¾Ð²Ð¾ Ð² 3-Ð¹ Ð¾ÑÐ¾Ð±Ñ– Ð¼Ð½Ð¾Ð¶Ð¸Ð½Ð¸.\n\n6. Ð¯ÐºÐ° Ñ„Ð¾Ñ€Ð¼Ð° Ð¿Ð¾Ñ‚Ñ€ÐµÐ±ÑƒÑ” Ð·Ð½Ð°Ñ…Ñ–Ð´Ð½Ð¾Ð³Ð¾ Ð²Ñ–Ð´Ð¼Ñ–Ð½ÐºÐ° Ð¾Ð±'Ñ”ÐºÑ‚Ð°?\n   - [ ] Ð”Ñ–Ñ”Ð¿Ñ€Ð¸ÐºÐ¼ÐµÑ‚Ð½Ð¸ÐºÐ¾Ð²Ð°\n   - [x] Ð‘ÐµÐ·Ð¾ÑÐ¾Ð±Ð¾Ð²Ð° (-Ð½Ð¾/-Ñ‚Ð¾)\n   - [ ] Ð—Ð²Ð¾Ñ€Ð¾Ñ‚Ð½Ð°\n   - [ ] Ð¢Ñ€ÐµÑ‚Ñ Ð¾ÑÐ¾Ð±Ð° Ð¼Ð½Ð¾Ð¶Ð¸Ð½Ð¸\n   > ÐšÐ½Ð¸Ð³Ñƒ Ð½Ð°Ð¿Ð¸ÑÐ°Ð½Ð¾ (Ð·Ð½Ð°Ñ…Ñ–Ð´Ð½Ð¸Ð¹), Ð½Ðµ ~~ÐšÐ½Ð¸Ð³Ð° Ð½Ð°Ð¿Ð¸ÑÐ°Ð½Ð¾~~.\n\n7. Ð£ Ð½Ð°ÑƒÐºÐ¾Ð²Ð¾Ð¼Ñƒ ÑÑ‚Ð¸Ð»Ñ– Ð½Ð°Ð¹Ñ‡Ð°ÑÑ‚Ñ–ÑˆÐµ Ð²Ð¸ÐºÐ¾Ñ€Ð¸ÑÑ‚Ð¾Ð²ÑƒÑŽÑ‚ÑŒ:\n   - [ ] Ð¢Ñ€ÐµÑ‚ÑŽ Ð¾ÑÐ¾Ð±Ñƒ Ð¼Ð½Ð¾Ð¶Ð¸Ð½Ð¸\n   - [ ] Ð‘ÐµÐ·Ð¾ÑÐ¾Ð±Ð¾Ð²Ñƒ Ñ„Ð¾Ñ€Ð¼Ñƒ\n   - [x] Ð—Ð²Ð¾Ñ€Ð¾Ñ‚Ð½Ñƒ Ñ„Ð¾Ñ€Ð¼Ñƒ (-ÑÑ)\n   - [ ] ÐÐºÑ‚Ð¸Ð²Ð½Ð¸Ð¹ ÑÑ‚Ð°Ð½\n   > ÐÐ°ÑƒÐºÐ° Ð²Ñ–Ð´Ð´Ð°Ñ” Ð¿ÐµÑ€ÐµÐ²Ð°Ð³Ñƒ Ñ„Ð¾Ñ€Ð¼Ñ– \"Ð´Ð¾ÑÐ»Ñ–Ð´Ð¶ÑƒÑ”Ñ‚ÑŒÑÑ\", \"Ð²Ð¸Ð²Ñ‡Ð°Ñ”Ñ‚ÑŒÑÑ\".\n\n8. Ð¯ÐºÐµ Ñ€ÐµÑ‡ÐµÐ½Ð½Ñ Ð² Ð¾Ñ„Ñ–Ñ†Ñ–Ð¹Ð½Ð¾-Ð´Ñ–Ð»Ð¾Ð²Ð¾Ð¼Ñƒ ÑÑ‚Ð¸Ð»Ñ–?\n   - [ ] Ð—Ð°ÐºÐ¾Ð½ Ð¿Ñ€Ð¸Ð¹Ð½ÑÐ»Ð¸ Ð²Ñ‡Ð¾Ñ€Ð°.\n   - [x] Ð—Ð°ÐºÐ¾Ð½ Ð¿Ñ€Ð¸Ð¹Ð½ÑÑ‚Ð¾ Ð²Ñ‡Ð¾Ñ€Ð°.\n   - [ ] Ð—Ð°ÐºÐ¾Ð½ Ð±ÑƒÐ² Ð¿Ñ€Ð¸Ð¹Ð½ÑÑ‚Ð¸Ð¹ Ð²Ñ‡Ð¾Ñ€Ð°.\n   - [ ] Ð—Ð°ÐºÐ¾Ð½ Ð¿Ñ€Ð¸Ð¹Ð¼Ð°Ñ”Ñ‚ÑŒÑÑ Ð²Ñ‡Ð¾Ñ€Ð°.\n   > Ð¤Ð¾Ñ€Ð¼Ð° -Ð½Ð¾ â€” Ð¼Ð°Ñ€ÐºÐµÑ€ Ð¾Ñ„Ñ–Ñ†Ñ–Ð¹Ð½Ð¾Ð³Ð¾ Ð´Ð¾ÐºÑƒÐ¼ÐµÐ½Ñ‚Ð°.\n\n9. Ð”Ñ–Ñ”Ð¿Ñ€Ð¸ÐºÐ¼ÐµÑ‚Ð½Ð¸Ðº \"Ð½Ð°Ð¿Ð¸ÑÐ°Ð½Ð¸Ð¹\" ÑƒÐ·Ð³Ð¾Ð´Ð¶ÑƒÑ”Ñ‚ÑŒÑÑ Ð·:\n   - [x] Ð†Ð¼ÐµÐ½Ð½Ð¸ÐºÐ¾Ð¼ Ñƒ Ñ€Ð¾Ð´Ñ–, Ñ‡Ð¸ÑÐ»Ñ– Ð¹ Ð²Ñ–Ð´Ð¼Ñ–Ð½ÐºÑƒ\n   - [ ] Ð¢Ñ–Ð»ÑŒÐºÐ¸ Ð² Ñ€Ð¾Ð´Ñ–\n   - [ ] Ð¢Ñ–Ð»ÑŒÐºÐ¸ Ð² Ñ‡Ð¸ÑÐ»Ñ–\n   - [ ] ÐÐµ ÑƒÐ·Ð³Ð¾Ð´Ð¶ÑƒÑ”Ñ‚ÑŒÑÑ\n   > ÐŸÐ¾Ð²Ð½Ðµ ÑƒÐ·Ð³Ð¾Ð´Ð¶ÐµÐ½Ð½Ñ: Ð½Ð°Ð¿Ð¸ÑÐ°Ð½Ð¸Ð¹ Ð»Ð¸ÑÑ‚, Ð½Ð°Ð¿Ð¸ÑÐ°Ð½Ð° ÐºÐ½Ð¸Ð³Ð°, Ð½Ð°Ð¿Ð¸ÑÐ°Ð½Ðµ ÑÐ»Ð¾Ð²Ð¾.\n\n10. Ð¯ÐºÐ° Ñ„Ð¾Ñ€Ð¼Ð° Ð¿Ñ€Ð¸Ñ…Ð¾Ð²ÑƒÑ” Ð°Ð³ÐµÐ½Ñ‚Ð° (Ð²Ð¸ÐºÐ¾Ð½Ð°Ð²Ñ†Ñ Ð´Ñ–Ñ—)?\n    - [ ] Ð¢Ñ–Ð»ÑŒÐºÐ¸ Ð´Ñ–Ñ”Ð¿Ñ€Ð¸ÐºÐ¼ÐµÑ‚Ð½Ð¸ÐºÐ¾Ð²Ð°\n    - [ ] Ð¢Ñ–Ð»ÑŒÐºÐ¸ Ð·Ð²Ð¾Ñ€Ð¾Ñ‚Ð½Ð°\n    - [ ] Ð¢Ñ–Ð»ÑŒÐºÐ¸ Ñ‚Ñ€ÐµÑ‚Ñ Ð¾ÑÐ¾Ð±Ð° Ð¼Ð½Ð¾Ð¶Ð¸Ð½Ð¸\n    - [x] Ð’ÑÑ– Ñ‡Ð¾Ñ‚Ð¸Ñ€Ð¸ Ñ„Ð¾Ñ€Ð¼Ð¸ Ð¼Ð¾Ð¶ÑƒÑ‚ÑŒ\n    > Ð£ÑÑ– Ð¿Ð°ÑÐ¸Ð²Ð½Ñ– Ñ„Ð¾Ñ€Ð¼Ð¸ Ð¼Ð¾Ð¶ÑƒÑ‚ÑŒ Ð½Ðµ Ð²Ð¸Ñ€Ð°Ð¶Ð°Ñ‚Ð¸ Ð°Ð³ÐµÐ½Ñ‚Ð°.\n\n11. \"Ð•ÐºÑÐ¿ÐµÑ€Ð¸Ð¼ÐµÐ½Ñ‚ Ð¿Ñ€Ð¾Ð²Ð¾Ð´Ð¸Ñ‚ÑŒÑÑ Ð² Ð»Ð°Ð±Ð¾Ñ€Ð°Ñ‚Ð¾Ñ€Ñ–Ñ—\" â€” Ð°Ð³ÐµÐ½Ñ‚:\n    - [x] ÐÐµ Ð²Ð¸Ñ€Ð°Ð¶ÐµÐ½Ð¸Ð¹\n    - [ ] Ð’Ð¸Ñ€Ð°Ð¶ÐµÐ½Ð¸Ð¹ Ð·Ð½Ð°Ñ…Ñ–Ð´Ð½Ð¸Ð¼\n    - [ ] Ð’Ð¸Ñ€Ð°Ð¶ÐµÐ½Ð¸Ð¹ Ð´Ð°Ð²Ð°Ð»ÑŒÐ½Ð¸Ð¼\n    - [ ] Ð’Ð¸Ñ€Ð°Ð¶ÐµÐ½Ð¸Ð¹ Ñ€Ð¾Ð´Ð¾Ð²Ð¸Ð¼\n    > ÐÐ³ÐµÐ½Ñ‚ Ð¾Ð¿ÑƒÑ‰ÐµÐ½Ð¸Ð¹, Ñ„Ð¾Ñ€Ð¼Ð° Ð·Ð²Ð¾Ñ€Ð¾Ñ‚Ð½Ð°.\n\n12. Ð¯ÐºÐ° Ñ„Ð¾Ñ€Ð¼Ð° Ð· Ñ‡Ð°ÑÐ¾Ð²Ð¸Ð¼Ð¸ Ñ„Ð¾Ñ€Ð¼Ð°Ð¼Ð¸ \"Ð±ÑƒÑ‚Ð¸\"?\n    - [x] Ð”Ñ–Ñ”Ð¿Ñ€Ð¸ÐºÐ¼ÐµÑ‚Ð½Ð¸ÐºÐ¾Ð²Ð° (Ð±ÑƒÐ´Ðµ Ð½Ð°Ð¿Ð¸ÑÐ°Ð½Ð¸Ð¹)\n    - [ ] Ð‘ÐµÐ·Ð¾ÑÐ¾Ð±Ð¾Ð²Ð°\n    - [ ] Ð—Ð²Ð¾Ñ€Ð¾Ñ‚Ð½Ð°\n    - [ ] Ð¢Ñ€ÐµÑ‚Ñ Ð¾ÑÐ¾Ð±Ð° Ð¼Ð½Ð¾Ð¶Ð¸Ð½Ð¸\n    > ÐšÐ½Ð¸Ð³Ð° Ð±ÑƒÐ»Ð°/Ð±ÑƒÐ´Ðµ Ð½Ð°Ð¿Ð¸ÑÐ°Ð½Ð° â€” Ð´Ñ–Ñ”Ð¿Ñ€Ð¸ÐºÐ¼ÐµÑ‚Ð½Ð¸Ðº + Ð±ÑƒÑ‚Ð¸.\n\n13. \"Ð™Ð¾Ð¼Ñƒ Ð¿Ð¾Ð¾Ð±Ñ–Ñ†ÑÐ»Ð¸ Ð¿Ñ–Ð´Ð²Ð¸Ñ‰ÐµÐ½Ð½Ñ\" â€” Ð¾Ð±'Ñ”ÐºÑ‚ Ñƒ:\n    - [ ] Ð—Ð½Ð°Ñ…Ñ–Ð´Ð½Ð¾Ð¼Ñƒ Ð²Ñ–Ð´Ð¼Ñ–Ð½ÐºÑƒ\n    - [x] Ð”Ð°Ð²Ð°Ð»ÑŒÐ½Ð¾Ð¼Ñƒ Ð²Ñ–Ð´Ð¼Ñ–Ð½ÐºÑƒ\n    - [ ] ÐžÑ€ÑƒÐ´Ð½Ð¾Ð¼Ñƒ Ð²Ñ–Ð´Ð¼Ñ–Ð½ÐºÑƒ\n    - [ ] Ð Ð¾Ð´Ð¾Ð²Ð¾Ð¼Ñƒ Ð²Ñ–Ð´Ð¼Ñ–Ð½ÐºÑƒ\n    > Ð™Ð¾Ð¼Ñƒ â€” Ð´Ð°Ð²Ð°Ð»ÑŒÐ½Ð¸Ð¹, Ð¾Ñ‚Ñ€Ð¸Ð¼ÑƒÐ²Ð°Ñ‡ Ð´Ñ–Ñ—.\n\n14. Ð¯ÐºÐ¸Ð¹ Ð²Ð°Ñ€Ñ–Ð°Ð½Ñ‚ Ð½ÐµÐ¿Ñ€Ð°Ð²Ð¸Ð»ÑŒÐ½Ð¸Ð¹?\n    - [ ] ÐšÐ½Ð¸Ð³Ð° Ð½Ð°Ð¿Ð¸ÑÐ°Ð½Ð°.\n    - [x] ÐšÐ½Ð¸Ð³Ð° Ð½Ð°Ð¿Ð¸ÑÐ°Ð½Ð¾.\n    - [ ] ÐšÐ½Ð¸Ð³Ñƒ Ð½Ð°Ð¿Ð¸ÑÐ°Ð½Ð¾.\n    - [ ] ÐšÐ½Ð¸Ð³Ñƒ Ð½Ð°Ð¿Ð¸ÑÐ°Ð»Ð¸.\n    > Ð‘ÐµÐ·Ð¾ÑÐ¾Ð±Ð¾Ð²Ð° Ñ„Ð¾Ñ€Ð¼Ð° Ð²Ð¸Ð¼Ð°Ð³Ð°Ñ” Ð·Ð½Ð°Ñ…Ñ–Ð´Ð½Ð¾Ð³Ð¾: ÐºÐ½Ð¸Ð³Ð£ Ð½Ð°Ð¿Ð¸ÑÐ°Ð½Ð¾.\n\n15. Ð£ Ñ…ÑƒÐ´Ð¾Ð¶Ð½Ñ–Ð¹ Ð»Ñ–Ñ‚ÐµÑ€Ð°Ñ‚ÑƒÑ€Ñ– Ð½Ð°Ð¹Ñ‡Ð°ÑÑ‚Ñ–ÑˆÐµ:\n    - [x] Ð”Ñ–Ñ”Ð¿Ñ€Ð¸ÐºÐ¼ÐµÑ‚Ð½Ð¸ÐºÐ¾Ð²Ð° Ñ„Ð¾Ñ€Ð¼Ð°\n    - [ ] Ð‘ÐµÐ·Ð¾ÑÐ¾Ð±Ð¾Ð²Ð° Ñ„Ð¾Ñ€Ð¼Ð°\n    - [ ] Ð—Ð²Ð¾Ñ€Ð¾Ñ‚Ð½Ð° Ñ„Ð¾Ñ€Ð¼Ð°\n    - [ ] Ð¢Ñ€ÐµÑ‚Ñ Ð¾ÑÐ¾Ð±Ð° Ð¼Ð½Ð¾Ð¶Ð¸Ð½Ð¸\n    > Ð›Ñ–Ñ‚ÐµÑ€Ð°Ñ‚ÑƒÑ€Ð½Ð¸Ð¹ ÑÑ‚Ð¸Ð»ÑŒ Ð²Ñ–Ð´Ð´Ð°Ñ” Ð¿ÐµÑ€ÐµÐ²Ð°Ð³Ñƒ Ð´Ñ–Ñ”Ð¿Ñ€Ð¸ÐºÐ¼ÐµÑ‚Ð½Ð¸ÐºÐ°Ð¼.\n\n16. ÐÐ³ÐµÐ½Ñ‚ Ñƒ Ð´Ñ–Ñ”Ð¿Ñ€Ð¸ÐºÐ¼ÐµÑ‚Ð½Ð¸ÐºÐ¾Ð²Ñ–Ð¹ Ñ„Ð¾Ñ€Ð¼Ñ– Ð²Ð¸Ñ€Ð°Ð¶Ð°Ñ”Ñ‚ÑŒÑÑ:\n    - [ ] Ð—Ð½Ð°Ñ…Ñ–Ð´Ð½Ð¸Ð¼ Ð²Ñ–Ð´Ð¼Ñ–Ð½ÐºÐ¾Ð¼\n    - [ ] Ð”Ð°Ð²Ð°Ð»ÑŒÐ½Ð¸Ð¼ Ð²Ñ–Ð´Ð¼Ñ–Ð½ÐºÐ¾Ð¼\n    - [x] ÐžÑ€ÑƒÐ´Ð½Ð¸Ð¼ Ð²Ñ–Ð´Ð¼Ñ–Ð½ÐºÐ¾Ð¼\n    - [ ] Ð Ð¾Ð´Ð¾Ð²Ð¸Ð¼ Ð²Ñ–Ð´Ð¼Ñ–Ð½ÐºÐ¾Ð¼\n    > ÐšÐ½Ð¸Ð³Ð° Ð½Ð°Ð¿Ð¸ÑÐ°Ð½Ð° Ð°Ð²Ñ‚Ð¾Ñ€ÐžÐœ (Ð¾Ñ€ÑƒÐ´Ð½Ð¸Ð¹).\n\n## match-up: Ð¤Ð¾Ñ€Ð¼Ð° â†’ Ð ÐµÑ”ÑÑ‚Ñ€\n> Ð—'Ñ”Ð´Ð½Ð°Ð¹Ñ‚Ðµ Ñ„Ð¾Ñ€Ð¼Ñƒ Ð· Ñ‚Ð¸Ð¿Ð¾Ð²Ð¸Ð¼ Ñ€ÐµÑ”ÑÑ‚Ñ€Ð¾Ð¼.\n\n| Ð¤Ð¾Ñ€Ð¼Ð° | Ð ÐµÑ”ÑÑ‚Ñ€ |\n|-------|--------|\n| ÐšÐ½Ð¸Ð³Ð° Ð½Ð°Ð¿Ð¸ÑÐ°Ð½Ð° Ð°Ð²Ñ‚Ð¾Ñ€Ð¾Ð¼. | Ð»Ñ–Ñ‚ÐµÑ€Ð°Ñ‚ÑƒÑ€Ð½Ð¸Ð¹ |\n| ÐšÐ½Ð¸Ð³Ñƒ Ð½Ð°Ð¿Ð¸ÑÐ°Ð½Ð¾. | Ð¾Ñ„Ñ–Ñ†Ñ–Ð¹Ð½Ð¾-Ð´Ñ–Ð»Ð¾Ð²Ð¸Ð¹ |\n| ÐšÐ½Ð¸Ð³Ð° Ð¿Ð¸ÑˆÐµÑ‚ÑŒÑÑ. | Ð½Ð°ÑƒÐºÐ¾Ð²Ð¸Ð¹ |\n| ÐšÐ½Ð¸Ð³Ñƒ Ð½Ð°Ð¿Ð¸ÑÐ°Ð»Ð¸. | Ñ€Ð¾Ð·Ð¼Ð¾Ð²Ð½Ð¸Ð¹ |\n| Ð Ñ–ÑˆÐµÐ½Ð½Ñ Ð¿Ñ€Ð¸Ð¹Ð½ÑÑ‚Ð¾. | Ð±ÑŽÑ€Ð¾ÐºÑ€Ð°Ñ‚Ð¸Ñ‡Ð½Ð¸Ð¹ |\n| ÐŸÑ€Ð¾Ð±Ð»ÐµÐ¼Ð° Ð²Ð¸Ð²Ñ‡Ð°Ñ”Ñ‚ÑŒÑÑ. | Ð°ÐºÐ°Ð´ÐµÐ¼Ñ–Ñ‡Ð½Ð¸Ð¹ |\n| ÐœÐµÐ½Ñ– ÑÐºÐ°Ð·Ð°Ð»Ð¸. | Ð¿Ð¾Ð²ÑÑÐºÐ´ÐµÐ½Ð½Ð¸Ð¹ |\n| Ð›Ð¸ÑÑ‚ Ð±ÑƒÐ² Ð²Ñ–Ð´Ð¿Ñ€Ð°Ð²Ð»ÐµÐ½Ð¸Ð¹. | Ñ„Ð¾Ñ€Ð¼Ð°Ð»ÑŒÐ½Ð¸Ð¹ |\n| Ð—Ð°ÐºÐ¾Ð½ Ð·Ð°ÑÑ‚Ð¾ÑÐ¾Ð²ÑƒÑ”Ñ‚ÑŒÑÑ. | ÑŽÑ€Ð¸Ð´Ð¸Ñ‡Ð½Ð¸Ð¹ |\n| ÐÐ°Ð¼ Ð¿Ð¾Ð²Ñ–Ð´Ð¾Ð¼Ð¸Ð»Ð¸. | Ð½ÐµÑ„Ð¾Ñ€Ð¼Ð°Ð»ÑŒÐ½Ð¸Ð¹ |\n| Ð”Ð¾ÐºÑƒÐ¼ÐµÐ½Ñ‚ Ð¿Ñ–Ð´Ð¿Ð¸ÑÐ°Ð½Ð¾. | ÐºÐ°Ð½Ñ†ÐµÐ»ÑÑ€ÑÑŒÐºÐ¸Ð¹ |\n| Ð•ÐºÑÐ¿ÐµÑ€Ð¸Ð¼ÐµÐ½Ñ‚ Ð¿Ñ€Ð¾Ð²Ð¾Ð´Ð¸Ñ‚ÑŒÑÑ. | Ñ‚ÐµÑ…Ð½Ñ–Ñ‡Ð½Ð¸Ð¹ |\n| Ð™Ð¾Ð¼Ñƒ Ð¿Ð¾Ð¾Ð±Ñ–Ñ†ÑÐ»Ð¸. | Ð¿Ð¾Ð±ÑƒÑ‚Ð¾Ð²Ð¸Ð¹ |\n| Ð¡Ñ‚Ð°Ñ‚Ñ‚ÑŽ Ð¾Ð¿ÑƒÐ±Ð»Ñ–ÐºÐ¾Ð²Ð°Ð½Ð¾. | Ð¼ÐµÐ´Ñ–Ð¹Ð½Ð¸Ð¹ |\n| Ð”Ð°Ð½Ñ– Ð·Ð±Ð¸Ñ€Ð°ÑŽÑ‚ÑŒÑÑ. | Ð´Ð¾ÑÐ»Ñ–Ð´Ð½Ð¸Ñ†ÑŒÐºÐ¸Ð¹ |\n| ÐœÐµÐ½Ðµ Ð·Ð°Ð¿Ð¸Ñ‚Ð°Ð»Ð¸. | Ñ‰Ð¾Ð´ÐµÐ½Ð½Ð¸Ð¹ |\n\n## fill-in: ÐžÐ±ÐµÑ€Ñ–Ñ‚ÑŒ Ð¿Ñ€Ð°Ð²Ð¸Ð»ÑŒÐ½Ñƒ Ñ„Ð¾Ñ€Ð¼Ñƒ\n> Ð—Ð°Ð¿Ð¾Ð²Ð½Ñ–Ñ‚ÑŒ Ð¿Ñ€Ð¾Ð¿ÑƒÑÐºÐ¸ Ð²Ñ–Ð´Ð¿Ð¾Ð²Ñ–Ð´Ð½Ð¾ÑŽ Ð¿Ð°ÑÐ¸Ð²Ð½Ð¾ÑŽ Ñ„Ð¾Ñ€Ð¼Ð¾ÑŽ.\n\n1. Ð£ Ð´Ð¾ÐºÑƒÐ¼ÐµÐ½Ñ‚Ñ– Ð·Ð°Ð·Ð½Ð°Ñ‡ÐµÐ½Ð¾: \"ÐÐ°ÐºÐ°Ð· ___ Ð´Ð¸Ñ€ÐµÐºÑ‚Ð¾Ñ€Ð¾Ð¼.\"\n   > [!answer] Ð¿Ñ–Ð´Ð¿Ð¸ÑÐ°Ð½Ð¾\n   > [!options] Ð¿Ñ–Ð´Ð¿Ð¸ÑÐ°Ð½Ð¾ | Ð¿Ñ–Ð´Ð¿Ð¸ÑÐ°Ð½Ð¸Ð¹ | Ð¿Ñ–Ð´Ð¿Ð¸ÑÑƒÑ”Ñ‚ÑŒÑÑ | Ð¿Ñ–Ð´Ð¿Ð¸ÑÐ°Ð»Ð¸\n\n2. Ð¦Ñ Ð¿Ñ€Ð¾Ð±Ð»ÐµÐ¼Ð° ___ Ð²Ð¶Ðµ Ð±Ð°Ð³Ð°Ñ‚Ð¾ Ñ€Ð¾ÐºÑ–Ð².\n   > [!answer] Ð²Ð¸Ð²Ñ‡Ð°Ñ”Ñ‚ÑŒÑÑ\n   > [!options] Ð²Ð¸Ð²Ñ‡Ð°Ñ”Ñ‚ÑŒÑÑ | Ð²Ð¸Ð²Ñ‡ÐµÐ½Ð¾ | Ð²Ð¸Ð²Ñ‡ÐµÐ½Ð° | Ð²Ð¸Ð²Ñ‡Ð°Ð»Ð¸\n\n3. Ð’Ñ‡Ð¾Ñ€Ð° ___ Ð¿Ñ€Ð¾ Ð·Ð¼Ñ–Ð½Ñƒ Ñ€Ð¾Ð·ÐºÐ»Ð°Ð´Ñƒ.\n   > [!answer] Ð¿Ð¾Ð²Ñ–Ð´Ð¾Ð¼Ð¸Ð»Ð¸\n   > [!options] Ð¿Ð¾Ð²Ñ–Ð´Ð¾Ð¼Ð¸Ð»Ð¸ | Ð¿Ð¾Ð²Ñ–Ð´Ð¾Ð¼Ð»ÐµÐ½Ð¾ | Ð¿Ð¾Ð²Ñ–Ð´Ð¾Ð¼Ð»ÑÑ”Ñ‚ÑŒÑÑ | Ð¿Ð¾Ð²Ñ–Ð´Ð¾Ð¼Ð»ÐµÐ½Ð¸Ð¹\n\n4. Ð‘ÑƒÐ´Ð¸Ð½Ð¾Ðº ___ Ñƒ Ð¼Ð¸Ð½ÑƒÐ»Ð¾Ð¼Ñƒ ÑÑ‚Ð¾Ð»Ñ–Ñ‚Ñ‚Ñ–.\n   > [!answer] Ð¿Ð¾Ð±ÑƒÐ´Ð¾Ð²Ð°Ð½Ð¸Ð¹\n   > [!options] Ð¿Ð¾Ð±ÑƒÐ´Ð¾Ð²Ð°Ð½Ð¸Ð¹ | Ð¿Ð¾Ð±ÑƒÐ´Ð¾Ð²Ð°Ð½Ð¾ | Ð±ÑƒÐ´ÑƒÑ”Ñ‚ÑŒÑÑ | Ð¿Ð¾Ð±ÑƒÐ´ÑƒÐ²Ð°Ð»Ð¸\n\n5. Ð Ñ–ÑˆÐµÐ½Ð½Ñ Ñ‰Ðµ Ð½Ðµ ___.\n   > [!answer] Ð¿Ñ€Ð¸Ð¹Ð½ÑÑ‚Ð¾\n   > [!options] Ð¿Ñ€Ð¸Ð¹Ð½ÑÑ‚Ð¾ | Ð¿Ñ€Ð¸Ð¹Ð½ÑÑ‚Ð¸Ð¹ | Ð¿Ñ€Ð¸Ð¹Ð¼Ð°Ñ”Ñ‚ÑŒÑÑ | Ð¿Ñ€Ð¸Ð¹Ð½ÑÐ»Ð¸\n\n6. Ð•ÐºÑÐ¿ÐµÑ€Ð¸Ð¼ÐµÐ½Ñ‚ ___ Ñƒ Ð»Ð°Ð±Ð¾Ñ€Ð°Ñ‚Ð¾Ñ€Ñ–Ñ— Ñ‰Ð¾Ð´Ð½Ñ.\n   > [!answer] Ð¿Ñ€Ð¾Ð²Ð¾Ð´Ð¸Ñ‚ÑŒÑÑ\n   > [!options] Ð¿Ñ€Ð¾Ð²Ð¾Ð´Ð¸Ñ‚ÑŒÑÑ | Ð¿Ñ€Ð¾Ð²ÐµÐ´ÐµÐ½Ð¾ | Ð¿Ñ€Ð¾Ð²ÐµÐ´ÐµÐ½Ð¸Ð¹ | Ð¿Ñ€Ð¾Ð²Ð¾Ð´Ð¸Ð»Ð¸\n\n7. ___ Ð·Ð°Ð¿Ñ€Ð¾ÑÐ¸Ð»Ð¸ Ð½Ð° ÐºÐ¾Ð½Ñ„ÐµÑ€ÐµÐ½Ñ†Ñ–ÑŽ.\n   > [!answer] ÐœÐµÐ½Ðµ\n   > [!options] ÐœÐµÐ½Ðµ | ÐœÐµÐ½Ñ– | ÐœÐ½Ð¾ÑŽ | Ð¯\n\n8. Ð¡Ñ‚Ð°Ñ‚Ñ‚Ñ ___ Ð² Ð¶ÑƒÑ€Ð½Ð°Ð»Ñ– Ð¼Ð¸Ð½ÑƒÐ»Ð¾Ð³Ð¾ Ð¼Ñ–ÑÑÑ†Ñ.\n   > [!answer] Ð¾Ð¿ÑƒÐ±Ð»Ñ–ÐºÐ¾Ð²Ð°Ð½Ð°\n   > [!options] Ð¾Ð¿ÑƒÐ±Ð»Ñ–ÐºÐ¾Ð²Ð°Ð½Ð° | Ð¾Ð¿ÑƒÐ±Ð»Ñ–ÐºÐ¾Ð²Ð°Ð½Ð¾ | Ð¿ÑƒÐ±Ð»Ñ–ÐºÑƒÑ”Ñ‚ÑŒÑÑ | Ð¾Ð¿ÑƒÐ±Ð»Ñ–ÐºÑƒÐ²Ð°Ð»Ð¸\n\n9. Ð Ð¾Ð±Ð¾Ñ‚Ñƒ ___ Ð²Ñ‡Ð°ÑÐ½Ð¾.\n   > [!answer] Ð·Ð°Ð²ÐµÑ€ÑˆÐµÐ½Ð¾\n   > [!options] Ð·Ð°Ð²ÐµÑ€ÑˆÐµÐ½Ð¾ | Ð·Ð°Ð²ÐµÑ€ÑˆÐµÐ½Ð° | Ð·Ð°Ð²ÐµÑ€ÑˆÑƒÑ”Ñ‚ÑŒÑÑ | Ð·Ð°Ð²ÐµÑ€ÑˆÐ¸Ð»Ð¸\n\n10. Ð¦ÐµÐ¹ Ð¼ÐµÑ‚Ð¾Ð´ ___ Ñƒ Ð¼ÐµÐ´Ð¸Ñ†Ð¸Ð½Ñ–.\n    > [!answer] Ð²Ð¸ÐºÐ¾Ñ€Ð¸ÑÑ‚Ð¾Ð²ÑƒÑ”Ñ‚ÑŒÑÑ\n    > [!options] Ð²Ð¸ÐºÐ¾Ñ€Ð¸ÑÑ‚Ð¾Ð²ÑƒÑ”Ñ‚ÑŒÑÑ | Ð²Ð¸ÐºÐ¾Ñ€Ð¸ÑÑ‚Ð°Ð½Ð¾ | Ð²Ð¸ÐºÐ¾Ñ€Ð¸ÑÑ‚Ð°Ð½Ð¸Ð¹ | Ð²Ð¸ÐºÐ¾Ñ€Ð¸ÑÑ‚Ð°Ð»Ð¸\n\n11. Ð—Ð°ÐºÐ¾Ð½ ___ Ð´Ð¾ Ð²ÑÑ–Ñ… Ð³Ñ€Ð¾Ð¼Ð°Ð´ÑÐ½.\n    > [!answer] Ð·Ð°ÑÑ‚Ð¾ÑÐ¾Ð²ÑƒÑ”Ñ‚ÑŒÑÑ\n    > [!options] Ð·Ð°ÑÑ‚Ð¾ÑÐ¾Ð²ÑƒÑ”Ñ‚ÑŒÑÑ | Ð·Ð°ÑÑ‚Ð¾ÑÐ¾Ð²Ð°Ð½Ð¾ | Ð·Ð°ÑÑ‚Ð¾ÑÐ¾Ð²Ð°Ð½Ð¸Ð¹ | Ð·Ð°ÑÑ‚Ð¾ÑÑƒÐ²Ð°Ð»Ð¸\n\n12. ___ Ð¿Ð¾Ð¾Ð±Ñ–Ñ†ÑÐ»Ð¸ Ð²Ñ–Ð´Ð¿Ð¾Ð²Ñ–Ð´ÑŒ Ð·Ð°Ð²Ñ‚Ñ€Ð°.\n    > [!answer] ÐÐ°Ð¼\n    > [!options] ÐÐ°Ð¼ | ÐÐ°Ñ | ÐÐ°Ð¼Ð¸ | ÐœÐ¸\n\n13. Ð”Ð¾ÐºÑƒÐ¼ÐµÐ½Ñ‚Ð¸ ___ Ð½Ð° Ñ€Ð¾Ð·Ð³Ð»ÑÐ´.\n    > [!answer] Ð¿Ð¾Ð´Ð°Ð½Ð¾\n    > [!options] Ð¿Ð¾Ð´Ð°Ð½Ð¾ | Ð¿Ð¾Ð´Ð°Ð½Ñ– | Ð¿Ð¾Ð´Ð°ÑŽÑ‚ÑŒÑÑ | Ð¿Ð¾Ð´Ð°Ð»Ð¸\n\n14. Ð¦Ñ ÐºÐ½Ð¸Ð³Ð° ___ Ð½Ð° Ð´Ð²Ð°Ð´Ñ†ÑÑ‚ÑŒ Ð¼Ð¾Ð².\n    > [!answer] Ð¿ÐµÑ€ÐµÐºÐ»Ð°Ð´ÐµÐ½Ð°\n    > [!options] Ð¿ÐµÑ€ÐµÐºÐ»Ð°Ð´ÐµÐ½Ð° | Ð¿ÐµÑ€ÐµÐºÐ»Ð°Ð´ÐµÐ½Ð¾ | Ð¿ÐµÑ€ÐµÐºÐ»Ð°Ð´Ð°Ñ”Ñ‚ÑŒÑÑ | Ð¿ÐµÑ€ÐµÐºÐ»Ð°Ð»Ð¸\n\n15. Ð—Ð°ÑÑ–Ð´Ð°Ð½Ð½Ñ ___ Ð·Ð°ÐºÑ€Ð¸Ñ‚Ð¸Ð¼.\n    > [!answer] Ð¾Ð³Ð¾Ð»Ð¾ÑˆÐµÐ½Ð¾\n    > [!options] Ð¾Ð³Ð¾Ð»Ð¾ÑˆÐµÐ½Ð¾ | Ð¾Ð³Ð¾Ð»Ð¾ÑˆÐµÐ½Ðµ | Ð¾Ð³Ð¾Ð»Ð¾ÑˆÑƒÑ”Ñ‚ÑŒÑÑ | Ð¾Ð³Ð¾Ð»Ð¾ÑÐ¸Ð»Ð¸\n\n16. ÐŸÑ€Ð¾ÐµÐºÑ‚ ___ Ð½Ð°ÑÑ‚ÑƒÐ¿Ð½Ð¾Ð³Ð¾ Ñ€Ð¾ÐºÑƒ.\n    > [!answer] Ð±ÑƒÐ´Ðµ Ð·Ð°Ð²ÐµÑ€ÑˆÐµÐ½Ð¸Ð¹\n    > [!options] Ð±ÑƒÐ´Ðµ Ð·Ð°Ð²ÐµÑ€ÑˆÐµÐ½Ð¸Ð¹ | Ð·Ð°Ð²ÐµÑ€ÑˆÐµÐ½Ð¾ | Ð·Ð°Ð²ÐµÑ€ÑˆÑƒÑ”Ñ‚ÑŒÑÑ | Ð·Ð°Ð²ÐµÑ€ÑˆÐ°Ñ‚ÑŒ\n\n## true-false: ÐŸÑ€Ð°Ð²Ð¸Ð»Ð° Ð¿Ð°ÑÐ¸Ð²Ð½Ð¾Ð³Ð¾ ÑÑ‚Ð°Ð½Ñƒ\n> Ð’Ð¸Ð·Ð½Ð°Ñ‡Ñ‚Ðµ, Ñ‡Ð¸ Ñ‚Ð²ÐµÑ€Ð´Ð¶ÐµÐ½Ð½Ñ Ð¿Ñ€Ð°Ð²Ð¸Ð»ÑŒÐ½Ðµ.\n\n- [x] Ð£ÐºÑ€Ð°Ñ—Ð½ÑÑŒÐºÐ° Ð¼Ð¾Ð²Ð° Ð¼Ð°Ñ” Ñ‡Ð¾Ñ‚Ð¸Ñ€Ð¸ Ð¿Ð°ÑÐ¸Ð²Ð½Ñ– ÐºÐ¾Ð½ÑÑ‚Ñ€ÑƒÐºÑ†Ñ–Ñ—.\n  > ÐŸÑ€Ð°Ð²Ð¸Ð»ÑŒÐ½Ð¾! Ð”Ñ–Ñ”Ð¿Ñ€Ð¸ÐºÐ¼ÐµÑ‚Ð½Ð¸ÐºÐ¾Ð²Ð°, Ð±ÐµÐ·Ð¾ÑÐ¾Ð±Ð¾Ð²Ð°, Ð·Ð²Ð¾Ñ€Ð¾Ñ‚Ð½Ð° Ñ– Ñ‚Ñ€ÐµÑ‚Ñ Ð¾ÑÐ¾Ð±Ð° Ð¼Ð½Ð¾Ð¶Ð¸Ð½Ð¸.\n\n- [ ] Ð¤Ð¾Ñ€Ð¼Ð° -Ð½Ð¾/-Ñ‚Ð¾ ÑƒÐ·Ð³Ð¾Ð´Ð¶ÑƒÑ”Ñ‚ÑŒÑÑ Ð· Ñ–Ð¼ÐµÐ½Ð½Ð¸ÐºÐ¾Ð¼ Ñƒ Ñ€Ð¾Ð´Ñ–.\n  > ÐÐµÐ¿Ñ€Ð°Ð²Ð¸Ð»ÑŒÐ½Ð¾! Ð¦Ñ Ñ„Ð¾Ñ€Ð¼Ð° Ð½ÐµÐ·Ð¼Ñ–Ð½Ð½Ð° (Ð·Ð°Ð²Ð¶Ð´Ð¸ ÑÐµÑ€ÐµÐ´Ð½Ñ–Ð¹ Ñ€Ñ–Ð´).\n\n- [x] Ð£ Ð±ÐµÐ·Ð¾ÑÐ¾Ð±Ð¾Ð²Ñ–Ð¹ Ñ„Ð¾Ñ€Ð¼Ñ– Ð¾Ð±'Ñ”ÐºÑ‚ ÑÑ‚Ð¾Ñ—Ñ‚ÑŒ Ñƒ Ð·Ð½Ð°Ñ…Ñ–Ð´Ð½Ð¾Ð¼Ñƒ Ð²Ñ–Ð´Ð¼Ñ–Ð½ÐºÑƒ.\n  > ÐŸÑ€Ð°Ð²Ð¸Ð»ÑŒÐ½Ð¾! ÐšÐ½Ð¸Ð³Ñƒ Ð½Ð°Ð¿Ð¸ÑÐ°Ð½Ð¾ (Ð½Ðµ ~~ÐšÐ½Ð¸Ð³Ð° Ð½Ð°Ð¿Ð¸ÑÐ°Ð½Ð¾~~).\n\n- [ ] Ð—Ð²Ð¾Ñ€Ð¾Ñ‚Ð½Ð° Ñ„Ð¾Ñ€Ð¼Ð° (-ÑÑ) Ð½Ð°Ð¹Ñ‡Ð°ÑÑ‚Ñ–ÑˆÐµ Ð²Ð¶Ð¸Ð²Ð°Ñ”Ñ‚ÑŒÑÑ Ð² Ñ€Ð¾Ð·Ð¼Ð¾Ð²Ð½Ñ–Ð¹ Ð¼Ð¾Ð²Ñ–.\n  > ÐÐµÐ¿Ñ€Ð°Ð²Ð¸Ð»ÑŒÐ½Ð¾! Ð’Ð¾Ð½Ð° Ñ…Ð°Ñ€Ð°ÐºÑ‚ÐµÑ€Ð½Ð° Ð´Ð»Ñ Ð½Ð°ÑƒÐºÐ¾Ð²Ð¾Ð³Ð¾ ÑÑ‚Ð¸Ð»ÑŽ.\n\n- [x] Ð¢Ñ€ÐµÑ‚Ñ Ð¾ÑÐ¾Ð±Ð° Ð¼Ð½Ð¾Ð¶Ð¸Ð½Ð¸ â€” Ð½Ð°Ð¹Ñ€Ð¾Ð·Ð¼Ð¾Ð²Ð½Ñ–ÑˆÐ° Ð¿Ð°ÑÐ¸Ð²Ð½Ð° Ñ„Ð¾Ñ€Ð¼Ð°.\n  > ÐŸÑ€Ð°Ð²Ð¸Ð»ÑŒÐ½Ð¾! \"ÐœÐµÐ½Ñ– ÑÐºÐ°Ð·Ð°Ð»Ð¸\" Ð·Ð²ÑƒÑ‡Ð¸Ñ‚ÑŒ Ð¿Ñ€Ð¸Ñ€Ð¾Ð´Ð½Ð¾ Ð² Ð¿Ð¾Ð²ÑÑÐºÐ´ÐµÐ½Ð½Ð¾Ð¼Ñƒ ÑÐ¿Ñ–Ð»ÐºÑƒÐ²Ð°Ð½Ð½Ñ–.\n\n- [x] Ð”Ñ–Ñ”Ð¿Ñ€Ð¸ÐºÐ¼ÐµÑ‚Ð½Ð¸Ðº ÑƒÐ·Ð³Ð¾Ð´Ð¶ÑƒÑ”Ñ‚ÑŒÑÑ Ð· Ñ–Ð¼ÐµÐ½Ð½Ð¸ÐºÐ¾Ð¼ Ñƒ Ñ€Ð¾Ð´Ñ–, Ñ‡Ð¸ÑÐ»Ñ– Ð¹ Ð²Ñ–Ð´Ð¼Ñ–Ð½ÐºÑƒ.\n  > ÐŸÑ€Ð°Ð²Ð¸Ð»ÑŒÐ½Ð¾! ÐÐ°Ð¿Ð¸ÑÐ°Ð½Ð¸Ð¹ Ð»Ð¸ÑÑ‚, Ð½Ð°Ð¿Ð¸ÑÐ°Ð½Ð° ÐºÐ½Ð¸Ð³Ð°, Ð½Ð°Ð¿Ð¸ÑÐ°Ð½Ñ– Ð»Ð¸ÑÑ‚Ð¸.\n\n- [ ] Ð’ ÑƒÐºÑ€Ð°Ñ—Ð½ÑÑŒÐºÑ–Ð¹ Ð¼Ð¾Ð²Ñ– Ð°Ð³ÐµÐ½Ñ‚ Ð·Ð°Ð²Ð¶Ð´Ð¸ Ð²Ð¸Ñ€Ð°Ð¶Ð°Ñ”Ñ‚ÑŒÑÑ.\n  > ÐÐµÐ¿Ñ€Ð°Ð²Ð¸Ð»ÑŒÐ½Ð¾! ÐÐ³ÐµÐ½Ñ‚ Ñ‡Ð°ÑÑ‚Ð¾ Ð¾Ð¿ÑƒÑÐºÐ°Ñ”Ñ‚ÑŒÑÑ, Ð¾ÑÐ¾Ð±Ð»Ð¸Ð²Ð¾ Ð² Ð±ÐµÐ·Ð¾ÑÐ¾Ð±Ð¾Ð²Ñ–Ð¹ Ñ„Ð¾Ñ€Ð¼Ñ–.\n\n- [x] Ð¤Ð¾Ñ€Ð¼Ð° \"Ð Ñ–ÑˆÐµÐ½Ð½Ñ Ð¿Ñ€Ð¸Ð¹Ð½ÑÑ‚Ð¾\" ÑÐ¸Ð³Ð½Ð°Ð»Ñ–Ð·ÑƒÑ” Ð¾Ñ„Ñ–Ñ†Ñ–Ð¹Ð½Ð¸Ð¹ Ñ€ÐµÑ”ÑÑ‚Ñ€.\n  > ÐŸÑ€Ð°Ð²Ð¸Ð»ÑŒÐ½Ð¾! -Ð½Ð¾/-Ñ‚Ð¾ â€” Ð¼Ð°Ñ€ÐºÐµÑ€ Ð¾Ñ„Ñ–Ñ†Ñ–Ð¹Ð½Ð¾-Ð´Ñ–Ð»Ð¾Ð²Ð¾Ð³Ð¾ ÑÑ‚Ð¸Ð»ÑŽ.\n\n- [ ] Ð—Ð²Ð¾Ñ€Ð¾Ñ‚Ð½Ð° Ñ„Ð¾Ñ€Ð¼Ð° Ð½Ðµ Ð¼Ð¾Ð¶Ðµ Ð²Ð¸Ñ€Ð°Ð¶Ð°Ñ‚Ð¸ Ð°Ð³ÐµÐ½Ñ‚Ð°.\n  > ÐÐµÐ¿Ñ€Ð°Ð²Ð¸Ð»ÑŒÐ½Ð¾! ÐÐ³ÐµÐ½Ñ‚ Ð¼Ð¾Ð¶Ðµ Ð±ÑƒÑ‚Ð¸ Ð² Ð¾Ñ€ÑƒÐ´Ð½Ð¾Ð¼Ñƒ: \"Ð²Ð¸Ð²Ñ‡Ð°Ñ”Ñ‚ÑŒÑÑ Ð²Ñ‡ÐµÐ½Ð¸Ð¼Ð¸\".\n\n- [x] \"ÐšÐ½Ð¸Ð³Ð° Ð±ÑƒÐ´Ðµ Ð½Ð°Ð¿Ð¸ÑÐ°Ð½Ð°\" â€” Ñ†Ðµ Ð¼Ð°Ð¹Ð±ÑƒÑ‚Ð½Ñ–Ð¹ Ñ‡Ð°Ñ Ð¿Ð°ÑÐ¸Ð²Ñƒ.\n  > ÐŸÑ€Ð°Ð²Ð¸Ð»ÑŒÐ½Ð¾! Ð‘ÑƒÑ‚Ð¸ + Ð´Ñ–Ñ”Ð¿Ñ€Ð¸ÐºÐ¼ÐµÑ‚Ð½Ð¸Ðº ÑƒÑ‚Ð²Ð¾Ñ€ÑŽÑ” Ñ‡Ð°ÑÐ¾Ð²Ñ– Ñ„Ð¾Ñ€Ð¼Ð¸.\n\n- [ ] Ð£ÑÑ– Ñ‡Ð¾Ñ‚Ð¸Ñ€Ð¸ Ñ„Ð¾Ñ€Ð¼Ð¸ Ð²Ð·Ð°Ñ”Ð¼Ð¾Ð·Ð°Ð¼Ñ–Ð½Ð½Ñ– Ð² Ð±ÑƒÐ´ÑŒ-ÑÐºÐ¾Ð¼Ñƒ ÐºÐ¾Ð½Ñ‚ÐµÐºÑÑ‚Ñ–.\n  > ÐÐµÐ¿Ñ€Ð°Ð²Ð¸Ð»ÑŒÐ½Ð¾! ÐšÐ¾Ð¶Ð½Ð° Ñ„Ð¾Ñ€Ð¼Ð° Ð¼Ð°Ñ” ÑÐ²Ñ–Ð¹ Ñ€ÐµÑ”ÑÑ‚Ñ€ Ñ– ÑÑ‚Ð¸Ð»Ñ–ÑÑ‚Ð¸Ñ‡Ð½Ðµ Ð·Ð°Ð±Ð°Ñ€Ð²Ð»ÐµÐ½Ð½Ñ.\n\n- [x] Ð£ Ð´Ð°Ð²Ð°Ð»ÑŒÐ½Ð¾Ð¼Ñƒ Ð²Ñ–Ð´Ð¼Ñ–Ð½ÐºÑƒ Ð¼Ð¾Ð¶Ðµ ÑÑ‚Ð¾ÑÑ‚Ð¸ Ð¾Ñ‚Ñ€Ð¸Ð¼ÑƒÐ²Ð°Ñ‡ Ð´Ñ–Ñ—.\n  > ÐŸÑ€Ð°Ð²Ð¸Ð»ÑŒÐ½Ð¾! \"Ð™Ð¾Ð¼Ñƒ ÑÐºÐ°Ð·Ð°Ð»Ð¸\" â€” Ð¹Ð¾Ð¼Ñƒ Ð² Ð´Ð°Ð²Ð°Ð»ÑŒÐ½Ð¾Ð¼Ñƒ.\n\n- [ ] Ð¤Ð¾Ñ€Ð¼Ð° -Ð½Ð¾/-Ñ‚Ð¾ Ð²Ð¶Ð¸Ð²Ð°Ñ”Ñ‚ÑŒÑÑ Ð² Ñ…ÑƒÐ´Ð¾Ð¶Ð½Ñ–Ð¹ Ð»Ñ–Ñ‚ÐµÑ€Ð°Ñ‚ÑƒÑ€Ñ– Ñ‡Ð°ÑÑ‚Ñ–ÑˆÐµ Ð·Ð° Ñ–Ð½ÑˆÑ–.\n  > ÐÐµÐ¿Ñ€Ð°Ð²Ð¸Ð»ÑŒÐ½Ð¾! Ð£ Ð»Ñ–Ñ‚ÐµÑ€Ð°Ñ‚ÑƒÑ€Ñ– Ð¿ÐµÑ€ÐµÐ²Ð°Ð¶Ð°Ñ” Ð´Ñ–Ñ”Ð¿Ñ€Ð¸ÐºÐ¼ÐµÑ‚Ð½Ð¸ÐºÐ¾Ð²Ð° Ñ„Ð¾Ñ€Ð¼Ð°.\n\n- [x] Ð’Ð¸Ð±Ñ–Ñ€ Ð¿Ð°ÑÐ¸Ð²Ð½Ð¾Ñ— Ñ„Ð¾Ñ€Ð¼Ð¸ Ð·Ð°Ð»ÐµÐ¶Ð¸Ñ‚ÑŒ Ð²Ñ–Ð´ Ñ€ÐµÑ”ÑÑ‚Ñ€Ñƒ Ð¼Ð¾Ð²Ð»ÐµÐ½Ð½Ñ.\n  > ÐŸÑ€Ð°Ð²Ð¸Ð»ÑŒÐ½Ð¾! Ð¦Ðµ ÐºÐ»ÑŽÑ‡Ð¾Ð²Ð¸Ð¹ Ð¿Ñ€Ð¸Ð½Ñ†Ð¸Ð¿ ÑƒÐºÑ€Ð°Ñ—Ð½ÑÑŒÐºÐ¾Ñ— Ð¿Ð°ÑÐ¸Ð²Ð½Ð¾Ñ— ÑÐ¸ÑÑ‚ÐµÐ¼Ð¸.\n\n- [ ] \"ÐšÐ½Ð¸Ð³Ð° Ð¿Ð¸ÑˆÐµÑ‚ÑŒÑÑ\" Ð¾Ð·Ð½Ð°Ñ‡Ð°Ñ” Ð·Ð°Ð²ÐµÑ€ÑˆÐµÐ½Ñƒ Ð´Ñ–ÑŽ.\n  > ÐÐµÐ¿Ñ€Ð°Ð²Ð¸Ð»ÑŒÐ½Ð¾! Ð—Ð²Ð¾Ñ€Ð¾Ñ‚Ð½Ð° Ñ„Ð¾Ñ€Ð¼Ð° Ð½Ð°Ð³Ð¾Ð»Ð¾ÑˆÑƒÑ” Ð½Ð° Ð¿Ñ€Ð¾Ñ†ÐµÑÑ–, Ñ‰Ð¾ Ñ‚Ñ€Ð¸Ð²Ð°Ñ”.\n\n- [x] Ð’ Ð¾Ñ„Ñ–Ñ†Ñ–Ð¹Ð½Ð¸Ñ… Ð´Ð¾ÐºÑƒÐ¼ÐµÐ½Ñ‚Ð°Ñ… Ð¿ÐµÑ€ÐµÐ²Ð°Ð¶Ð°Ñ” Ñ„Ð¾Ñ€Ð¼Ð° -Ð½Ð¾/-Ñ‚Ð¾.\n  > ÐŸÑ€Ð°Ð²Ð¸Ð»ÑŒÐ½Ð¾! \"ÐÐ°ÐºÐ°Ð· Ð²Ð¸Ð´Ð°Ð½Ð¾\", \"Ð Ñ–ÑˆÐµÐ½Ð½Ñ Ð¿Ñ€Ð¸Ð¹Ð½ÑÑ‚Ð¾\" â€” ÐºÐ°Ð½Ñ†ÐµÐ»ÑÑ€ÑÑŒÐºÐ¸Ð¹ ÑÑ‚Ð¸Ð»ÑŒ.\n\n## group-sort: ÐšÐ»Ð°ÑÐ¸Ñ„Ñ–ÐºÐ°Ñ†Ñ–Ñ Ð·Ð° Ñ„Ð¾Ñ€Ð¼Ð¾ÑŽ\n> Ð Ð¾Ð·Ð¿Ð¾Ð´Ñ–Ð»Ñ–Ñ‚ÑŒ Ñ€ÐµÑ‡ÐµÐ½Ð½Ñ Ð·Ð° Ñ‚Ð¸Ð¿Ð¾Ð¼ Ð¿Ð°ÑÐ¸Ð²Ð½Ð¾Ñ— Ñ„Ð¾Ñ€Ð¼Ð¸.\n\n### Ð”Ñ–Ñ”Ð¿Ñ€Ð¸ÐºÐ¼ÐµÑ‚Ð½Ð¸ÐºÐ¾Ð²Ð° (-Ð½Ð¸Ð¹/-Ñ‚Ð¸Ð¹)\n- ÐšÐ½Ð¸Ð³Ð° Ð½Ð°Ð¿Ð¸ÑÐ°Ð½Ð° Ð°Ð²Ñ‚Ð¾Ñ€Ð¾Ð¼.\n- Ð›Ð¸ÑÑ‚ Ð±ÑƒÐ² Ð²Ñ–Ð´Ð¿Ñ€Ð°Ð²Ð»ÐµÐ½Ð¸Ð¹ Ð²Ñ‡Ð¾Ñ€Ð°.\n- Ð‘ÑƒÐ´Ð¸Ð½Ð¾Ðº Ð¿Ð¾Ð±ÑƒÐ´Ð¾Ð²Ð°Ð½Ð¸Ð¹ Ñƒ 2020 Ñ€Ð¾Ñ†Ñ–.\n- Ð”Ð¾ÐºÑƒÐ¼ÐµÐ½Ñ‚ Ð¿Ñ–Ð´Ð¿Ð¸ÑÐ°Ð½Ð¸Ð¹ Ð´Ð¸Ñ€ÐµÐºÑ‚Ð¾Ñ€Ð¾Ð¼.\n\n### Ð‘ÐµÐ·Ð¾ÑÐ¾Ð±Ð¾Ð²Ð° (-Ð½Ð¾/-Ñ‚Ð¾)\n- Ð Ñ–ÑˆÐµÐ½Ð½Ñ Ð¿Ñ€Ð¸Ð¹Ð½ÑÑ‚Ð¾ Ð¾Ð´Ð½Ð¾Ð³Ð¾Ð»Ð¾ÑÐ½Ð¾.\n- Ð Ð¾Ð±Ð¾Ñ‚Ñƒ Ð·Ð°Ð²ÐµÑ€ÑˆÐµÐ½Ð¾ Ð²Ñ‡Ð°ÑÐ½Ð¾.\n- ÐÐ°ÐºÐ°Ð· Ð²Ð¸Ð´Ð°Ð½Ð¾ Ð´Ð¸Ñ€ÐµÐºÑ‚Ð¾Ñ€Ð¾Ð¼.\n- Ð—Ð°ÑÑ–Ð´Ð°Ð½Ð½Ñ Ð¾Ð³Ð¾Ð»Ð¾ÑˆÐµÐ½Ð¾ Ð·Ð°ÐºÑ€Ð¸Ñ‚Ð¸Ð¼.\n\n### Ð—Ð²Ð¾Ñ€Ð¾Ñ‚Ð½Ð° (-ÑÑ)\n- ÐŸÑ€Ð¾Ð±Ð»ÐµÐ¼Ð° Ð²Ð¸Ð²Ñ‡Ð°Ñ”Ñ‚ÑŒÑÑ Ð½Ð°ÑƒÐºÐ¾Ð²Ñ†ÑÐ¼Ð¸.\n- Ð•ÐºÑÐ¿ÐµÑ€Ð¸Ð¼ÐµÐ½Ñ‚ Ð¿Ñ€Ð¾Ð²Ð¾Ð´Ð¸Ñ‚ÑŒÑÑ Ñ‰Ð¾Ð´Ð½Ñ.\n- Ð—Ð°ÐºÐ¾Ð½ Ð·Ð°ÑÑ‚Ð¾ÑÐ¾Ð²ÑƒÑ”Ñ‚ÑŒÑÑ Ð´Ð¾ Ð²ÑÑ–Ñ….\n- Ð”Ð°Ð½Ñ– Ð·Ð±Ð¸Ñ€Ð°ÑŽÑ‚ÑŒÑÑ Ð°Ð²Ñ‚Ð¾Ð¼Ð°Ñ‚Ð¸Ñ‡Ð½Ð¾.\n\n### Ð¢Ñ€ÐµÑ‚Ñ Ð¾ÑÐ¾Ð±Ð° Ð¼Ð½Ð¾Ð¶Ð¸Ð½Ð¸\n- ÐœÐµÐ½Ñ– ÑÐºÐ°Ð·Ð°Ð»Ð¸ Ð¿Ñ€Ð¾ Ñ†Ðµ Ð²Ñ‡Ð¾Ñ€Ð°.\n- Ð™Ð¾Ð¼Ñƒ Ð¿Ð¾Ð¾Ð±Ñ–Ñ†ÑÐ»Ð¸ Ð¿Ñ–Ð´Ð²Ð¸Ñ‰ÐµÐ½Ð½Ñ.\n- ÐÐ°Ñ Ð·Ð°Ð¿Ñ€Ð¾ÑÐ¸Ð»Ð¸ Ð½Ð° Ð²ÐµÑ‡Ñ–Ñ€ÐºÑƒ.\n- Ð‡Ð¹ Ð¿Ð¾Ð´Ð°Ñ€ÑƒÐ²Ð°Ð»Ð¸ ÐºÐ²Ñ–Ñ‚Ð¸.\n\n## unjumble: ÐŸÐ¾Ð±ÑƒÐ´ÑƒÐ¹Ñ‚Ðµ Ð¿Ð°ÑÐ¸Ð²Ð½Ñ– Ñ€ÐµÑ‡ÐµÐ½Ð½Ñ\n> Ð Ð¾Ð·ÑÑ‚Ð°Ð²Ñ‚Ðµ ÑÐ»Ð¾Ð²Ð° Ñƒ Ð¿Ñ€Ð°Ð²Ð¸Ð»ÑŒÐ½Ð¾Ð¼Ñƒ Ð¿Ð¾Ñ€ÑÐ´ÐºÑƒ.\n\n1. Ð½Ð°Ð¿Ð¸ÑÐ°Ð½Ð¾ / ÐšÐ½Ð¸Ð³Ñƒ / Ð¼Ð¸Ð½ÑƒÐ»Ð¾Ð¼Ñƒ / Ñ€Ð¾Ñ†Ñ– / Ñƒ\n   > [!answer] ÐšÐ½Ð¸Ð³Ñƒ Ð½Ð°Ð¿Ð¸ÑÐ°Ð½Ð¾ Ñƒ Ð¼Ð¸Ð½ÑƒÐ»Ð¾Ð¼Ñƒ Ñ€Ð¾Ñ†Ñ–\n\n2. Ð¿Ñ€Ð¾Ð²Ð¾Ð´Ð¸Ñ‚ÑŒÑÑ / Ð»Ð°Ð±Ð¾Ñ€Ð°Ñ‚Ð¾Ñ€Ñ–Ñ— / Ð•ÐºÑÐ¿ÐµÑ€Ð¸Ð¼ÐµÐ½Ñ‚ / Ñƒ / Ñ‰Ð¾Ð´Ð½Ñ\n   > [!answer] Ð•ÐºÑÐ¿ÐµÑ€Ð¸Ð¼ÐµÐ½Ñ‚ Ð¿Ñ€Ð¾Ð²Ð¾Ð´Ð¸Ñ‚ÑŒÑÑ Ñƒ Ð»Ð°Ð±Ð¾Ñ€Ð°Ñ‚Ð¾Ñ€Ñ–Ñ— Ñ‰Ð¾Ð´Ð½Ñ\n\n3. Ð¼ÐµÐ½Ðµ / ÐºÐ¾Ð½Ñ„ÐµÑ€ÐµÐ½Ñ†Ñ–ÑŽ / Ð½Ð° / Ð’Ñ‡Ð¾Ñ€Ð° / Ð·Ð°Ð¿Ñ€Ð¾ÑÐ¸Ð»Ð¸\n   > [!answer] Ð’Ñ‡Ð¾Ñ€Ð° Ð¼ÐµÐ½Ðµ Ð·Ð°Ð¿Ñ€Ð¾ÑÐ¸Ð»Ð¸ Ð½Ð° ÐºÐ¾Ð½Ñ„ÐµÑ€ÐµÐ½Ñ†Ñ–ÑŽ\n\n4. Ð¿Ñ–Ð´Ð¿Ð¸ÑÐ°Ð½Ð¸Ð¹ / Ð´Ð¸Ñ€ÐµÐºÑ‚Ð¾Ñ€Ð¾Ð¼ / Ð±ÑƒÐ² / Ð”Ð¾ÐºÑƒÐ¼ÐµÐ½Ñ‚ / ÑƒÑ‡Ð¾Ñ€Ð°\n   > [!answer] Ð”Ð¾ÐºÑƒÐ¼ÐµÐ½Ñ‚ Ð±ÑƒÐ² Ð¿Ñ–Ð´Ð¿Ð¸ÑÐ°Ð½Ð¸Ð¹ Ð´Ð¸Ñ€ÐµÐºÑ‚Ð¾Ñ€Ð¾Ð¼ ÑƒÑ‡Ð¾Ñ€Ð°\n\n5. Ð¿Ñ€Ð¸Ð¹Ð½ÑÑ‚Ð¾ / Ð¾Ð´Ð½Ð¾Ð³Ð¾Ð»Ð¾ÑÐ½Ð¾ / Ð Ñ–ÑˆÐµÐ½Ð½Ñ / ÐºÐ¾Ð¼Ñ–ÑÑ–Ñ”ÑŽ / Ð±ÑƒÐ»Ð¾\n   > [!answer] Ð Ñ–ÑˆÐµÐ½Ð½Ñ Ð±ÑƒÐ»Ð¾ Ð¿Ñ€Ð¸Ð¹Ð½ÑÑ‚Ð¾ ÐºÐ¾Ð¼Ñ–ÑÑ–Ñ”ÑŽ Ð¾Ð´Ð½Ð¾Ð³Ð¾Ð»Ð¾ÑÐ½Ð¾\n\n6. Ð½Ð°ÑƒÐºÐ¾Ð²Ñ†ÑÐ¼Ð¸ / Ð²Ð¸Ð²Ñ‡Ð°Ñ”Ñ‚ÑŒÑÑ / Ð¦Ñ / Ñ€Ð¾ÐºÐ°Ð¼Ð¸ / Ð¿Ñ€Ð¾Ð±Ð»ÐµÐ¼Ð° / Ð±Ð°Ð³Ð°Ñ‚Ð¾\n   > [!answer] Ð¦Ñ Ð¿Ñ€Ð¾Ð±Ð»ÐµÐ¼Ð° Ð²Ð¸Ð²Ñ‡Ð°Ñ”Ñ‚ÑŒÑÑ Ð½Ð°ÑƒÐºÐ¾Ð²Ñ†ÑÐ¼Ð¸ Ð±Ð°Ð³Ð°Ñ‚Ð¾ Ñ€Ð¾ÐºÐ°Ð¼Ð¸\n\n7. Ð¿Ð¾Ð¾Ð±Ñ–Ñ†ÑÐ»Ð¸ / Ð¿Ñ–Ð´Ð²Ð¸Ñ‰ÐµÐ½Ð½Ñ / Ð™Ð¾Ð¼Ñƒ / Ð½Ð°ÑÑ‚ÑƒÐ¿Ð½Ð¾Ð³Ð¾ / Ð¼Ñ–ÑÑÑ†Ñ\n   > [!answer] Ð™Ð¾Ð¼Ñƒ Ð¿Ð¾Ð¾Ð±Ñ–Ñ†ÑÐ»Ð¸ Ð¿Ñ–Ð´Ð²Ð¸Ñ‰ÐµÐ½Ð½Ñ Ð½Ð°ÑÑ‚ÑƒÐ¿Ð½Ð¾Ð³Ð¾ Ð¼Ñ–ÑÑÑ†Ñ\n\n8. Ð·Ð°Ð²ÐµÑ€ÑˆÐµÐ½Ð¾ / Ð‘ÑƒÐ´Ñ–Ð²Ð½Ð¸Ñ†Ñ‚Ð²Ð¾ / Ð²Ñ‡Ð°ÑÐ½Ð¾ / Ð±ÑƒÐ´Ðµ / Ñ€Ð¾ÐºÑƒ / Ð½Ð°ÑÑ‚ÑƒÐ¿Ð½Ð¾Ð³Ð¾\n   > [!answer] Ð‘ÑƒÐ´Ñ–Ð²Ð½Ð¸Ñ†Ñ‚Ð²Ð¾ Ð±ÑƒÐ´Ðµ Ð·Ð°Ð²ÐµÑ€ÑˆÐµÐ½Ð¾ Ð²Ñ‡Ð°ÑÐ½Ð¾ Ð½Ð°ÑÑ‚ÑƒÐ¿Ð½Ð¾Ð³Ð¾ Ñ€Ð¾ÐºÑƒ\n\n9. Ð¿Ð¾Ð²Ñ–Ð´Ð¾Ð¼Ð¸Ð»Ð¸ / Ð·Ð¼Ñ–Ð½Ð¸ / ÐÐ°Ð¼ / Ð¿Ñ€Ð¾ / Ñƒ / Ñ€Ð¾Ð·ÐºÐ»Ð°Ð´Ñ–\n   > [!answer] ÐÐ°Ð¼ Ð¿Ð¾Ð²Ñ–Ð´Ð¾Ð¼Ð¸Ð»Ð¸ Ð¿Ñ€Ð¾ Ð·Ð¼Ñ–Ð½Ð¸ Ñƒ Ñ€Ð¾Ð·ÐºÐ»Ð°Ð´Ñ–\n\n10. Ð·Ð°ÑÑ‚Ð¾ÑÐ¾Ð²ÑƒÑ”Ñ‚ÑŒÑÑ / Ð´Ð¾ / Ð—Ð°ÐºÐ¾Ð½ / ÑƒÑÑ–Ñ… / Ð³Ñ€Ð¾Ð¼Ð°Ð´ÑÐ½ / ÐºÑ€Ð°Ñ—Ð½Ð¸\n    > [!answer] Ð—Ð°ÐºÐ¾Ð½ Ð·Ð°ÑÑ‚Ð¾ÑÐ¾Ð²ÑƒÑ”Ñ‚ÑŒÑÑ Ð´Ð¾ ÑƒÑÑ–Ñ… Ð³Ñ€Ð¾Ð¼Ð°Ð´ÑÐ½ ÐºÑ€Ð°Ñ—Ð½Ð¸\n\n11. Ð¾Ð¿ÑƒÐ±Ð»Ñ–ÐºÐ¾Ð²Ð°Ð½Ð° / Ð¡Ñ‚Ð°Ñ‚Ñ‚Ñ / Ð¶ÑƒÑ€Ð½Ð°Ð»Ñ– / Ð±ÑƒÐ»Ð° / Ð½Ð°ÑƒÐºÐ¾Ð²Ð¾Ð¼Ñƒ / Ñƒ\n    > [!answer] Ð¡Ñ‚Ð°Ñ‚Ñ‚Ñ Ð±ÑƒÐ»Ð° Ð¾Ð¿ÑƒÐ±Ð»Ñ–ÐºÐ¾Ð²Ð°Ð½Ð° Ñƒ Ð½Ð°ÑƒÐºÐ¾Ð²Ð¾Ð¼Ñƒ Ð¶ÑƒÑ€Ð½Ð°Ð»Ñ–\n\n12. Ð¿Ð¾Ð±ÑƒÐ´Ð¾Ð²Ð°Ð½Ð¾ / Ñƒ / Ð¦ÐµÐ¹ / ÑÑ‚Ð¾Ð»Ñ–Ñ‚Ñ‚Ñ– / Ð±ÑƒÐ´Ð¸Ð½Ð¾Ðº / Ð¼Ð¸Ð½ÑƒÐ»Ð¾Ð¼Ñƒ\n    > [!answer] Ð¦ÐµÐ¹ Ð±ÑƒÐ´Ð¸Ð½Ð¾Ðº Ð¿Ð¾Ð±ÑƒÐ´Ð¾Ð²Ð°Ð½Ð¾ Ñƒ Ð¼Ð¸Ð½ÑƒÐ»Ð¾Ð¼Ñƒ ÑÑ‚Ð¾Ð»Ñ–Ñ‚Ñ‚Ñ–\n\n13. Ð·Ð°Ð¿Ð¸Ñ‚Ð°Ð»Ð¸ / Ð¼Ð°Ð³Ð°Ð·Ð¸Ð½Ñ– / Ð¿Ñ€Ð¾ / ÐœÐµÐ½Ðµ / Ð·Ð½Ð¸Ð¶ÐºÑƒ / Ñƒ\n    > [!answer] ÐœÐµÐ½Ðµ Ð·Ð°Ð¿Ð¸Ñ‚Ð°Ð»Ð¸ Ð¿Ñ€Ð¾ Ð·Ð½Ð¸Ð¶ÐºÑƒ Ñƒ Ð¼Ð°Ð³Ð°Ð·Ð¸Ð½Ñ–\n\n14. Ð²Ð¸ÐºÐ¾Ð½ÑƒÑŽÑ‚ÑŒÑÑ / Ð—Ð°Ð²Ð´Ð°Ð½Ð½Ñ / Ð¿Ñ€Ð°Ñ†Ñ–Ð²Ð½Ð¸ÐºÐ°Ð¼Ð¸ / Ñ€ÐµÐ³ÑƒÐ»ÑÑ€Ð½Ð¾ / Ð½Ð°ÑˆÐ¸Ð¼Ð¸\n    > [!answer] Ð—Ð°Ð²Ð´Ð°Ð½Ð½Ñ Ð²Ð¸ÐºÐ¾Ð½ÑƒÑŽÑ‚ÑŒÑÑ Ð½Ð°ÑˆÐ¸Ð¼Ð¸ Ð¿Ñ€Ð°Ñ†Ñ–Ð²Ð½Ð¸ÐºÐ°Ð¼Ð¸ Ñ€ÐµÐ³ÑƒÐ»ÑÑ€Ð½Ð¾\n\n15. Ð¾Ð³Ð¾Ð»Ð¾ÑˆÐµÐ½Ð¾ / Ð·Ð°ÐºÑ€Ð¸Ñ‚Ð¸Ð¼ / Ð±ÑƒÐ»Ð¾ / Ð—Ð°ÑÑ–Ð´Ð°Ð½Ð½Ñ / Ð¾ / Ð³Ð¾Ð´Ð¸Ð½Ñ– / Ð¿'ÑÑ‚Ñ–Ð¹\n    > [!answer] Ð—Ð°ÑÑ–Ð´Ð°Ð½Ð½Ñ Ð±ÑƒÐ»Ð¾ Ð¾Ð³Ð¾Ð»Ð¾ÑˆÐµÐ½Ð¾ Ð·Ð°ÐºÑ€Ð¸Ñ‚Ð¸Ð¼ Ð¾ Ð¿'ÑÑ‚Ñ–Ð¹ Ð³Ð¾Ð´Ð¸Ð½Ñ–\n\n16. Ð¿ÐµÑ€ÐµÐºÐ»Ð°Ð´ÐµÐ½Ð¾ / Ð¼Ð¾Ð²Ð¸ / Ð¦ÑŽ / Ð´Ð²Ð°Ð´Ñ†ÑÑ‚ÑŒ / ÐºÐ½Ð¸Ð³Ñƒ / Ð½Ð°\n    > [!answer] Ð¦ÑŽ ÐºÐ½Ð¸Ð³Ñƒ Ð¿ÐµÑ€ÐµÐºÐ»Ð°Ð´ÐµÐ½Ð¾ Ð½Ð° Ð´Ð²Ð°Ð´Ñ†ÑÑ‚ÑŒ Ð¼Ð¾Ð²Ð¸\n\n## error-correction: Ð’Ð¸Ð¿Ñ€Ð°Ð²Ñ‚Ðµ Ð¿Ð¾Ð¼Ð¸Ð»ÐºÐ¸\n> Ð£ ÐºÐ¾Ð¶Ð½Ð¾Ð¼Ñƒ Ñ€ÐµÑ‡ÐµÐ½Ð½Ñ– Ñ” ÐžÐ”ÐÐ Ð¿Ð¾Ð¼Ð¸Ð»ÐºÐ°. Ð—Ð½Ð°Ð¹Ð´Ñ–Ñ‚ÑŒ Ñ– Ð²Ð¸Ð¿Ñ€Ð°Ð²Ñ‚Ðµ Ñ—Ñ—.\n\n1. ÐšÐ½Ð¸Ð³Ð° Ð½Ð°Ð¿Ð¸ÑÐ°Ð½Ð¾ Ð°Ð²Ñ‚Ð¾Ñ€Ð¾Ð¼ Ð¼Ð¸Ð½ÑƒÐ»Ð¾Ð³Ð¾ Ñ€Ð¾ÐºÑƒ.\n   > [!error] Ð½Ð°Ð¿Ð¸ÑÐ°Ð½Ð¾\n   > [!answer] Ð½Ð°Ð¿Ð¸ÑÐ°Ð½Ð°\n   > [!options] Ð½Ð°Ð¿Ð¸ÑÐ°Ð½Ð¾ | Ð½Ð°Ð¿Ð¸ÑÐ°Ð½Ð° | Ð½Ð°Ð¿Ð¸ÑÐ°Ð½Ð¸Ð¹ | Ð½Ð°Ð¿Ð¸ÑÐ°Ð½Ñ–\n   > [!explanation] Participial form agrees with noun: ÐºÐ½Ð¸Ð³Ð° (f.) â†’ Ð½Ð°Ð¿Ð¸ÑÐ°Ð½Ð°.\n\n2. Ð Ñ–ÑˆÐµÐ½Ð½Ñ Ð¿Ñ€Ð¸Ð¹Ð½ÑÑ‚Ð¸Ð¹ Ð¾Ð´Ð½Ð¾Ð³Ð¾Ð»Ð¾ÑÐ½Ð¾.\n   > [!error] Ð¿Ñ€Ð¸Ð¹Ð½ÑÑ‚Ð¸Ð¹\n   > [!answer] Ð¿Ñ€Ð¸Ð¹Ð½ÑÑ‚Ð¾\n   > [!options] Ð¿Ñ€Ð¸Ð¹Ð½ÑÑ‚Ð¸Ð¹ | Ð¿Ñ€Ð¸Ð¹Ð½ÑÑ‚Ð¾ | Ð¿Ñ€Ð¸Ð¹Ð½ÑÑ‚Ð° | Ð¿Ñ€Ð¸Ð¹Ð½ÑÑ‚Ðµ\n   > [!explanation] Impersonal form doesn't change: Ñ€Ñ–ÑˆÐµÐ½Ð½Ñ Ð¿Ñ€Ð¸Ð¹Ð½ÑÑ‚Ð¾ (not Ð¿Ñ€Ð¸Ð¹Ð½ÑÑ‚Ð¸Ð¹).\n\n3. Ð•ÐºÑÐ¿ÐµÑ€Ð¸Ð¼ÐµÐ½Ñ‚ Ð¿Ñ€Ð¾Ð²Ð¾Ð´ÑÑ‚ÑŒ Ñƒ Ð»Ð°Ð±Ð¾Ñ€Ð°Ñ‚Ð¾Ñ€Ñ–Ñ— Ð²Ñ‡ÐµÐ½Ð¸Ð¼Ð¸.\n   > [!error] Ð¿Ñ€Ð¾Ð²Ð¾Ð´ÑÑ‚ÑŒ\n   > [!answer] Ð¿Ñ€Ð¾Ð²Ð¾Ð´Ð¸Ñ‚ÑŒÑÑ\n   > [!options] Ð¿Ñ€Ð¾Ð²Ð¾Ð´ÑÑ‚ÑŒ | Ð¿Ñ€Ð¾Ð²Ð¾Ð´Ð¸Ñ‚ÑŒÑÑ | Ð¿Ñ€Ð¾Ð²Ð¾Ð´Ð¸Ð»Ð¸ | Ð¿Ñ€Ð¾Ð²ÐµÐ´ÐµÐ½Ð¾\n   > [!explanation] Reflexive form for passive with agent: Ð¿Ñ€Ð¾Ð²Ð¾Ð´Ð¸Ñ‚ÑŒÑÑ Ð²Ñ‡ÐµÐ½Ð¸Ð¼Ð¸.\n\n4. ÐœÐµÐ½Ðµ ÑÐºÐ°Ð·Ð°Ð»Ð¸ Ð¿Ñ€Ð¾ Ð·Ð±Ð¾Ñ€Ð¸ Ð·Ð°Ð²Ñ‚Ñ€Ð°.\n   > [!error] ÐœÐµÐ½Ðµ\n   > [!answer] ÐœÐµÐ½Ñ–\n   > [!options] ÐœÐµÐ½Ðµ | ÐœÐµÐ½Ñ– | ÐœÐ½Ð¾ÑŽ | Ð¯\n   > [!explanation] After \"ÑÐºÐ°Ð·Ð°Ð»Ð¸\" the recipient takes dative: Ð¼ÐµÐ½Ñ– ÑÐºÐ°Ð·Ð°Ð»Ð¸.\n\n5. Ð”Ð¾ÐºÑƒÐ¼ÐµÐ½Ñ‚ Ð±ÑƒÐ»Ð° Ð¿Ñ–Ð´Ð¿Ð¸ÑÐ°Ð½Ð° Ð´Ð¸Ñ€ÐµÐºÑ‚Ð¾Ñ€Ð¾Ð¼.\n   > [!error] Ð±ÑƒÐ»Ð°\n   > [!answer] Ð±ÑƒÐ²\n   > [!options] Ð±ÑƒÐ»Ð° | Ð±ÑƒÐ² | Ð±ÑƒÐ»Ð¾ | Ð±ÑƒÐ»Ð¸\n   > [!explanation] Ð”Ð¾ÐºÑƒÐ¼ÐµÐ½Ñ‚ is masculine, so Ð±ÑƒÐ² (not Ð±ÑƒÐ»Ð°).\n\n6. Ð Ð¾Ð±Ð¾Ñ‚Ñƒ Ð·Ð°Ð²ÐµÑ€ÑˆÐµÐ½Ð° Ð²Ñ‡Ð°ÑÐ½Ð¾.\n   > [!error] Ð·Ð°Ð²ÐµÑ€ÑˆÐµÐ½Ð°\n   > [!answer] Ð·Ð°Ð²ÐµÑ€ÑˆÐµÐ½Ð¾\n   > [!options] Ð·Ð°Ð²ÐµÑ€ÑˆÐµÐ½Ð° | Ð·Ð°Ð²ÐµÑ€ÑˆÐµÐ½Ð¾ | Ð·Ð°Ð²ÐµÑ€ÑˆÐµÐ½Ð¸Ð¹ | Ð·Ð°Ð²ÐµÑ€ÑˆÑƒÑŽÑ‚ÑŒ\n   > [!explanation] With accusative object (Ñ€Ð¾Ð±Ð¾Ñ‚Ñƒ), use -Ð½Ð¾/-Ñ‚Ð¾: Ñ€Ð¾Ð±Ð¾Ñ‚Ñƒ Ð·Ð°Ð²ÐµÑ€ÑˆÐµÐ½Ð¾.\n\n7. Ð¦Ñ Ð¿Ñ€Ð¾Ð±Ð»ÐµÐ¼Ð° Ð²Ð¸Ð²Ñ‡Ð°ÑŽÑ‚ÑŒ Ð½Ð°ÑƒÐºÐ¾Ð²Ñ†ÑÐ¼Ð¸.\n   > [!error] Ð²Ð¸Ð²Ñ‡Ð°ÑŽÑ‚ÑŒ\n   > [!answer] Ð²Ð¸Ð²Ñ‡Ð°Ñ”Ñ‚ÑŒÑÑ\n   > [!options] Ð²Ð¸Ð²Ñ‡Ð°ÑŽÑ‚ÑŒ | Ð²Ð¸Ð²Ñ‡Ð°Ñ”Ñ‚ÑŒÑÑ | Ð²Ð¸Ð²Ñ‡ÐµÐ½Ð¾ | Ð²Ð¸Ð²Ñ‡ÐµÐ½Ð°\n   > [!explanation] Reflexive form with agent: Ð²Ð¸Ð²Ñ‡Ð°Ñ”Ñ‚ÑŒÑÑ Ð½Ð°ÑƒÐºÐ¾Ð²Ñ†ÑÐ¼Ð¸.\n\n8. Ð™Ð¾Ð¼Ñƒ Ð¿Ð¾Ð¾Ð±Ñ–Ñ†ÑÑ‚Ð¸ Ð¿Ñ–Ð´Ð²Ð¸Ñ‰ÐµÐ½Ð½Ñ.\n   > [!error] Ð¿Ð¾Ð¾Ð±Ñ–Ñ†ÑÑ‚Ð¸\n   > [!answer] Ð¿Ð¾Ð¾Ð±Ñ–Ñ†ÑÐ»Ð¸\n   > [!options] Ð¿Ð¾Ð¾Ð±Ñ–Ñ†ÑÑ‚Ð¸ | Ð¿Ð¾Ð¾Ð±Ñ–Ñ†ÑÐ»Ð¸ | Ð¿Ð¾Ð¾Ð±Ñ–Ñ†ÑÐ² | Ð¾Ð±Ñ–Ñ†ÑÐ½Ð¾\n   > [!explanation] Third person plural: Ð¹Ð¾Ð¼Ñƒ Ð¿Ð¾Ð¾Ð±Ñ–Ñ†ÑÐ»Ð¸ (past tense).\n\n9. Ð¡Ñ‚Ð°Ñ‚Ñ‚Ñ Ð¾Ð¿ÑƒÐ±Ð»Ñ–ÐºÐ¾Ð²Ð°Ð½Ð¾ Ð² Ð¶ÑƒÑ€Ð½Ð°Ð»Ñ–.\n   > [!error] Ð¾Ð¿ÑƒÐ±Ð»Ñ–ÐºÐ¾Ð²Ð°Ð½Ð¾\n   > [!answer] Ð¾Ð¿ÑƒÐ±Ð»Ñ–ÐºÐ¾Ð²Ð°Ð½Ð°\n   > [!options] Ð¾Ð¿ÑƒÐ±Ð»Ñ–ÐºÐ¾Ð²Ð°Ð½Ð¾ | Ð¾Ð¿ÑƒÐ±Ð»Ñ–ÐºÐ¾Ð²Ð°Ð½Ð° | Ð¾Ð¿ÑƒÐ±Ð»Ñ–ÐºÐ¾Ð²Ð°Ð½Ð¸Ð¹ | Ð¿ÑƒÐ±Ð»Ñ–ÐºÑƒÑ”Ñ‚ÑŒÑÑ\n   > [!explanation] Ð¡Ñ‚Ð°Ñ‚Ñ‚Ñ (f.) takes participial form: ÑÑ‚Ð°Ñ‚Ñ‚Ñ Ð¾Ð¿ÑƒÐ±Ð»Ñ–ÐºÐ¾Ð²Ð°Ð½Ð°.\n\n10. ÐÐ°Ñ Ð·Ð°Ð¿Ñ€Ð¾ÑÐ¸Ð»Ð¸ Ð½Ð° Ð²ÐµÑ‡Ñ–Ñ€ÐºÑƒ. (Ð±ÐµÐ· Ð¿Ð¾Ð¼Ð¸Ð»ÐºÐ¸)\n    > [!error] none\n    > [!answer] âœ“\n    > [!options] ÐÐ°Ñ | ÐÐ°Ð¼ | ÐÐ°Ð¼Ð¸ | âœ“\n    > [!explanation] Ð ÐµÑ‡ÐµÐ½Ð½Ñ Ð¿Ñ€Ð°Ð²Ð¸Ð»ÑŒÐ½Ðµ: Ð½Ð°Ñ Ñƒ Ð·Ð½Ð°Ñ…Ñ–Ð´Ð½Ð¾Ð¼Ñƒ Ð²Ñ–Ð´Ð¼Ñ–Ð½ÐºÑƒ Ð¿Ñ–ÑÐ»Ñ Ð·Ð°Ð¿Ñ€Ð¾ÑÐ¸Ð»Ð¸.\n\n11. Ð—Ð°ÐºÐ¾Ð½ Ð·Ð°ÑÑ‚Ð¾ÑÐ¾Ð²ÑƒÑŽÑ‚ÑŒ Ð´Ð¾ Ð²ÑÑ–Ñ… Ð³Ñ€Ð¾Ð¼Ð°Ð´ÑÐ½.\n    > [!error] Ð·Ð°ÑÑ‚Ð¾ÑÐ¾Ð²ÑƒÑŽÑ‚ÑŒ\n    > [!answer] Ð·Ð°ÑÑ‚Ð¾ÑÐ¾Ð²ÑƒÑ”Ñ‚ÑŒÑÑ\n    > [!options] Ð·Ð°ÑÑ‚Ð¾ÑÐ¾Ð²ÑƒÑŽÑ‚ÑŒ | Ð·Ð°ÑÑ‚Ð¾ÑÐ¾Ð²ÑƒÑ”Ñ‚ÑŒÑÑ | Ð·Ð°ÑÑ‚Ð¾ÑÐ¾Ð²Ð°Ð½Ð¾ | Ð·Ð°ÑÑ‚Ð¾ÑÐ¾Ð²Ð°Ð½Ð¸Ð¹\n    > [!explanation] For passive, use reflexive form: Ð·Ð°ÐºÐ¾Ð½ Ð·Ð°ÑÑ‚Ð¾ÑÐ¾Ð²ÑƒÑ”Ñ‚ÑŒÑÑ.\n\n12. ÐšÐ½Ð¸Ð³Ñƒ Ð½Ð°Ð¿Ð¸ÑÐ°Ð½Ð¸Ð¹ Ð²Ñ–Ð´Ð¾Ð¼Ð¸Ð¼ Ð°Ð²Ñ‚Ð¾Ñ€Ð¾Ð¼.\n    > [!error] Ð½Ð°Ð¿Ð¸ÑÐ°Ð½Ð¸Ð¹\n    > [!answer] Ð½Ð°Ð¿Ð¸ÑÐ°Ð½Ð°\n    > [!options] Ð½Ð°Ð¿Ð¸ÑÐ°Ð½Ð¸Ð¹ | Ð½Ð°Ð¿Ð¸ÑÐ°Ð½Ð° | Ð½Ð°Ð¿Ð¸ÑÐ°Ð½Ð¾ | Ð½Ð°Ð¿Ð¸ÑÐ°Ð»Ð¸\n    > [!explanation] If object in nominative (ÐºÐ½Ð¸Ð³Ð°), participle agrees: ÐºÐ½Ð¸Ð³Ð° Ð½Ð°Ð¿Ð¸ÑÐ°Ð½Ð°.\n\n13. Ð Ñ–ÑˆÐµÐ½Ð½Ñ Ð±ÑƒÐ»Ð¾ Ð¿Ñ€Ð¸Ð¹Ð½ÑÑ‚Ñ– ÐºÐ¾Ð¼Ñ–ÑÑ–Ñ”ÑŽ.\n    > [!error] Ð¿Ñ€Ð¸Ð¹Ð½ÑÑ‚Ñ–\n    > [!answer] Ð¿Ñ€Ð¸Ð¹Ð½ÑÑ‚Ð¾\n    > [!options] Ð¿Ñ€Ð¸Ð¹Ð½ÑÑ‚Ñ– | Ð¿Ñ€Ð¸Ð¹Ð½ÑÑ‚Ð¾ | Ð¿Ñ€Ð¸Ð¹Ð½ÑÑ‚Ðµ | Ð¿Ñ€Ð¸Ð¹Ð½ÑÑ‚Ð¸Ð¹\n    > [!explanation] Ð Ñ–ÑˆÐµÐ½Ð½Ñ is singular, so Ð¿Ñ€Ð¸Ð¹Ð½ÑÑ‚Ð¾ (or Ð¿Ñ€Ð¸Ð¹Ð½ÑÑ‚Ðµ), not Ð¿Ñ€Ð¸Ð¹Ð½ÑÑ‚Ñ–.\n\n14. Ð”Ð°Ð½Ñ– Ð·Ð±Ð¸Ñ€Ð°Ñ”Ñ‚ÑŒÑÑ Ð°Ð²Ñ‚Ð¾Ð¼Ð°Ñ‚Ð¸Ñ‡Ð½Ð¾.\n    > [!error] Ð·Ð±Ð¸Ñ€Ð°Ñ”Ñ‚ÑŒÑÑ\n    > [!answer] Ð·Ð±Ð¸Ñ€Ð°ÑŽÑ‚ÑŒÑÑ\n    > [!options] Ð·Ð±Ð¸Ñ€Ð°Ñ”Ñ‚ÑŒÑÑ | Ð·Ð±Ð¸Ñ€Ð°ÑŽÑ‚ÑŒÑÑ | Ð·Ñ–Ð±Ñ€Ð°Ð½Ð¾ | Ð·Ñ–Ð±Ñ€Ð°Ð½Ñ–\n    > [!explanation] Ð”Ð°Ð½Ñ– is plural, so verb in plural: Ð´Ð°Ð½Ñ– Ð·Ð±Ð¸Ñ€Ð°ÑŽÑ‚ÑŒÑÑ.\n\n15. Ð‡Ð¹ Ð¿Ð¾Ð´Ð°Ñ€Ð¾Ð²Ð°Ð½Ð¾ ÐºÐ²Ñ–Ñ‚Ð¸ Ð½Ð° Ð´ÐµÐ½ÑŒ Ð½Ð°Ñ€Ð¾Ð´Ð¶ÐµÐ½Ð½Ñ.\n    > [!error] Ð¿Ð¾Ð´Ð°Ñ€Ð¾Ð²Ð°Ð½Ð¾\n    > [!answer] Ð¿Ð¾Ð´Ð°Ñ€ÑƒÐ²Ð°Ð»Ð¸\n    > [!options] Ð¿Ð¾Ð´Ð°Ñ€Ð¾Ð²Ð°Ð½Ð¾ | Ð¿Ð¾Ð´Ð°Ñ€ÑƒÐ²Ð°Ð»Ð¸ | Ð¿Ð¾Ð´Ð°Ñ€Ð¾Ð²Ð°Ð½Ð° | Ð´Ð°Ñ€ÑƒÑ”Ñ‚ÑŒÑÑ\n    > [!explanation] With dative (Ñ—Ð¹), use 3rd person plural: Ñ—Ð¹ Ð¿Ð¾Ð´Ð°Ñ€ÑƒÐ²Ð°Ð»Ð¸.\n\n16. Ð—Ð°ÑÑ–Ð´Ð°Ð½Ð½Ñ Ð¾Ð³Ð¾Ð»Ð¾ÑˆÐµÐ½Ð¸Ð¹ Ð·Ð°ÐºÑ€Ð¸Ñ‚Ð¸Ð¼.\n    > [!error] Ð¾Ð³Ð¾Ð»Ð¾ÑˆÐµÐ½Ð¸Ð¹\n    > [!answer] Ð¾Ð³Ð¾Ð»Ð¾ÑˆÐµÐ½Ð¾\n    > [!options] Ð¾Ð³Ð¾Ð»Ð¾ÑˆÐµÐ½Ð¸Ð¹ | Ð¾Ð³Ð¾Ð»Ð¾ÑˆÐµÐ½Ð¾ | Ð¾Ð³Ð¾Ð»Ð¾ÑˆÐµÐ½Ð° | Ð¾Ð³Ð¾Ð»Ð¾ÑˆÑƒÑŽÑ‚ÑŒ\n    > [!explanation] Impersonal form: Ð·Ð°ÑÑ–Ð´Ð°Ð½Ð½Ñ Ð¾Ð³Ð¾Ð»Ð¾ÑˆÐµÐ½Ð¾ Ð·Ð°ÐºÑ€Ð¸Ñ‚Ð¸Ð¼.\n\n## cloze: ÐžÑ„Ñ–Ñ†Ñ–Ð¹Ð½Ð¸Ð¹ Ð´Ð¾ÐºÑƒÐ¼ÐµÐ½Ñ‚\n> Ð—Ð°Ð¿Ð¾Ð²Ð½Ñ–Ñ‚ÑŒ Ð¿Ñ€Ð¾Ð¿ÑƒÑÐºÐ¸ Ñƒ Ð´Ð¾ÐºÑƒÐ¼ÐµÐ½Ñ‚Ñ–.\n\nÐÐÐšÐÐ— â„– 45. ÐŸÑ€Ð¾ Ð¿Ñ€Ð¸Ð·Ð½Ð°Ñ‡ÐµÐ½Ð½Ñ Ð½Ð° Ð¿Ð¾ÑÐ°Ð´Ñƒ. ÐÐ° Ð¿Ñ–Ð´ÑÑ‚Ð°Ð²Ñ– Ð·Ð°ÑÐ²Ð¸ Ð³Ñ€Ð¾Ð¼Ð°Ð´ÑÐ½Ð¸Ð½Ð° ÐŸÐµÑ‚Ñ€ÐµÐ½ÐºÐ° Ð†.Ð’. Ñ‚Ð° Ñ€Ñ–ÑˆÐµÐ½Ð½Ñ ÐºÐ¾Ð¼Ñ–ÑÑ–Ñ— Ð²Ñ–Ð´ 15 Ð³Ñ€ÑƒÐ´Ð½Ñ 2024 Ñ€Ð¾ÐºÑƒ. ÐÐÐšÐÐ—Ð£Ð®: ÐŸÐµÑ‚Ñ€ÐµÐ½ÐºÐ° Ð†Ð²Ð°Ð½Ð° Ð’Ð°ÑÐ¸Ð»ÑŒÐ¾Ð²Ð¸Ñ‡Ð° [___:1] Ð½Ð° Ð¿Ð¾ÑÐ°Ð´Ñƒ ÑÑ‚Ð°Ñ€ÑˆÐ¾Ð³Ð¾ ÑÐ¿ÐµÑ†Ñ–Ð°Ð»Ñ–ÑÑ‚Ð°. ÐžÐºÐ»Ð°Ð´ [___:2] Ñƒ Ñ€Ð¾Ð·Ð¼Ñ–Ñ€Ñ– 25 000 Ð³Ñ€Ð¸Ð²ÐµÐ½ÑŒ. Ð’Ñ–Ð´Ð´Ñ–Ð»Ñƒ ÐºÐ°Ð´Ñ€Ñ–Ð² [___:3] Ð¾Ñ„Ð¾Ñ€Ð¼Ð»ÐµÐ½Ð½Ñ Ð´Ð¾ÐºÑƒÐ¼ÐµÐ½Ñ‚Ñ–Ð². ÐšÐ¾Ð½Ñ‚Ñ€Ð¾Ð»ÑŒ Ð·Ð° Ð²Ð¸ÐºÐ¾Ð½Ð°Ð½Ð½ÑÐ¼ Ð½Ð°ÐºÐ°Ð·Ñƒ [___:4] Ð½Ð° Ð·Ð°ÑÑ‚ÑƒÐ¿Ð½Ð¸ÐºÐ° Ð´Ð¸Ñ€ÐµÐºÑ‚Ð¾Ñ€Ð°. ÐÐ°ÐºÐ°Ð· [___:5] Ð´Ð¾ Ð²Ñ–Ð´Ð¾Ð¼Ð° Ð²ÑÑ–Ñ… Ð¿Ñ–Ð´Ñ€Ð¾Ð·Ð´Ñ–Ð»Ñ–Ð². ÐšÐ¾Ð¿Ñ–ÑŽ Ð½Ð°ÐºÐ°Ð·Ñƒ [___:6] Ð´Ð¾ Ð¾ÑÐ¾Ð±Ð¾Ð²Ð¾Ñ— ÑÐ¿Ñ€Ð°Ð²Ð¸.\n\n1. Ð¿Ñ€Ð¸Ð·Ð½Ð°Ñ‡ÐµÐ½Ð¾ | Ð¿Ñ€Ð¸Ð·Ð½Ð°Ñ‡ÐµÐ½Ð¸Ð¹ | Ð¿Ñ€Ð¸Ð·Ð½Ð°Ñ‡Ð°ÑŽÑ‚ÑŒ | Ð¿Ñ€Ð¸Ð·Ð½Ð°Ñ‡Ð¸Ñ‚Ð¸\n   > [!answer] Ð¿Ñ€Ð¸Ð·Ð½Ð°Ñ‡ÐµÐ½Ð¾\n\n2. Ð²ÑÑ‚Ð°Ð½Ð¾Ð²Ð»ÐµÐ½Ð¾ | Ð²ÑÑ‚Ð°Ð½Ð¾Ð²Ð»ÐµÐ½Ð¸Ð¹ | Ð²ÑÑ‚Ð°Ð½Ð¾Ð²Ð»ÑŽÑ”Ñ‚ÑŒÑÑ | Ð²ÑÑ‚Ð°Ð½Ð¾Ð²Ð¸Ð»Ð¸\n   > [!answer] Ð²ÑÑ‚Ð°Ð½Ð¾Ð²Ð»ÐµÐ½Ð¾\n\n3. Ð·Ð°Ð±ÐµÐ·Ð¿ÐµÑ‡Ð¸Ñ‚Ð¸ | Ð·Ð°Ð±ÐµÐ·Ð¿ÐµÑ‡ÐµÐ½Ð¾ | Ð·Ð°Ð±ÐµÐ·Ð¿ÐµÑ‡ÑƒÑ”Ñ‚ÑŒÑÑ | Ð·Ð°Ð±ÐµÐ·Ð¿ÐµÑ‡Ð¸Ð»Ð¸\n   > [!answer] Ð·Ð°Ð±ÐµÐ·Ð¿ÐµÑ‡Ð¸Ñ‚Ð¸\n\n4. Ð¿Ð¾ÐºÐ»Ð°Ð´ÐµÐ½Ð¾ | Ð¿Ð¾ÐºÐ»Ð°Ð´ÐµÐ½Ð¸Ð¹ | Ð¿Ð¾ÐºÐ»Ð°Ð´Ð°Ñ”Ñ‚ÑŒÑÑ | Ð¿Ð¾ÐºÐ»Ð°Ð»Ð¸\n   > [!answer] Ð¿Ð¾ÐºÐ»Ð°Ð´ÐµÐ½Ð¾\n\n5. Ð´Ð¾Ð²ÐµÑÑ‚Ð¸ | Ð´Ð¾Ð²ÐµÐ´ÐµÐ½Ð¾ | Ð´Ð¾Ð²Ð¾Ð´Ð¸Ñ‚ÑŒÑÑ | Ð´Ð¾Ð²ÐµÐ»Ð¸\n   > [!answer] Ð´Ð¾Ð²ÐµÑÑ‚Ð¸\n\n6. Ð´Ð¾Ð»ÑƒÑ‡ÐµÐ½Ð¾ | Ð´Ð¾Ð»ÑƒÑ‡ÐµÐ½Ð¸Ð¹ | Ð´Ð¾Ð»ÑƒÑ‡Ð°Ñ”Ñ‚ÑŒÑÑ | Ð´Ð¾Ð»ÑƒÑ‡Ð¸Ð»Ð¸\n   > [!answer] Ð´Ð¾Ð»ÑƒÑ‡ÐµÐ½Ð¾\n\n## mark-the-words: ÐŸÐ°ÑÐ¸Ð²Ð½Ñ– ÐºÐ¾Ð½ÑÑ‚Ñ€ÑƒÐºÑ†Ñ–Ñ—\n> ÐšÐ»Ð°Ñ†Ð½Ñ–Ñ‚ÑŒ ÑƒÑÑ– Ð¿Ð°ÑÐ¸Ð²Ð½Ñ– Ð´Ñ–Ñ”ÑÐ»Ñ–Ð²Ð½Ñ– Ñ„Ð¾Ñ€Ð¼Ð¸.\n\nÐ£ Ð·Ð²Ñ–Ñ‚Ñ– [Ð·Ð°Ð·Ð½Ð°Ñ‡ÐµÐ½Ð¾], Ñ‰Ð¾ Ð¿Ñ€Ð¾ÐµÐºÑ‚ [Ð±ÑƒÐ² Ð·Ð°Ð²ÐµÑ€ÑˆÐµÐ½Ð¸Ð¹] Ð²Ñ‡Ð°ÑÐ½Ð¾. Ð£ÑÑ– Ð·Ð°Ð²Ð´Ð°Ð½Ð½Ñ [Ð²Ð¸ÐºÐ¾Ð½Ð°Ð½Ð¾], Ð´Ð°Ð½Ñ– [Ð¿Ñ€Ð¾Ð°Ð½Ð°Ð»Ñ–Ð·Ð¾Ð²Ð°Ð½Ð¾] Ñ– Ñ€ÐµÐ·ÑƒÐ»ÑŒÑ‚Ð°Ñ‚Ð¸ [Ð¾Ð¿ÑƒÐ±Ð»Ñ–ÐºÐ¾Ð²Ð°Ð½Ð¾] Ð² Ð¶ÑƒÑ€Ð½Ð°Ð»Ñ–. Ð”Ð¾ÑÐ»Ñ–Ð´Ð¶ÐµÐ½Ð½Ñ [Ð¿Ñ€Ð¾Ð²Ð¾Ð´Ð¸Ð»Ð¾ÑÑ] Ð¿Ñ€Ð¾Ñ‚ÑÐ³Ð¾Ð¼ Ð´Ð²Ð¾Ñ… Ñ€Ð¾ÐºÑ–Ð², Ñ– Ð½Ð¾Ð²Ñ– Ð¼ÐµÑ‚Ð¾Ð´Ð¸ [Ñ€Ð¾Ð·Ñ€Ð¾Ð±Ð»ÐµÐ½Ð¾] ÐºÐ¾Ð¼Ð°Ð½Ð´Ð¾ÑŽ. [Ð‘ÑƒÐ»Ð¾ Ð²ÑÑ‚Ð°Ð½Ð¾Ð²Ð»ÐµÐ½Ð¾], Ñ‰Ð¾ ÐµÑ„ÐµÐºÑ‚Ð¸Ð²Ð½Ñ–ÑÑ‚ÑŒ [Ð¿Ñ–Ð´Ð²Ð¸Ñ‰Ð¸Ð»Ð°ÑÑ] Ð½Ð° 30%.\n\n> 8 passive forms: Ð·Ð°Ð·Ð½Ð°Ñ‡ÐµÐ½Ð¾, Ð±ÑƒÐ² Ð·Ð°Ð²ÐµÑ€ÑˆÐµÐ½Ð¸Ð¹, Ð²Ð¸ÐºÐ¾Ð½Ð°Ð½Ð¾, Ð¿Ñ€Ð¾Ð°Ð½Ð°Ð»Ñ–Ð·Ð¾Ð²Ð°Ð½Ð¾, Ð¾Ð¿ÑƒÐ±Ð»Ñ–ÐºÐ¾Ð²Ð°Ð½Ð¾, Ð¿Ñ€Ð¾Ð²Ð¾Ð´Ð¸Ð»Ð¾ÑÑ, Ñ€Ð¾Ð·Ñ€Ð¾Ð±Ð»ÐµÐ½Ð¾, Ð‘ÑƒÐ»Ð¾ Ð²ÑÑ‚Ð°Ð½Ð¾Ð²Ð»ÐµÐ½Ð¾\n\n## dialogue-reorder: Ð Ð¾Ð·Ð¼Ð¾Ð²Ð° Ð² Ð¾Ñ„Ñ–ÑÑ–\n> Ð Ð¾Ð·ÑÑ‚Ð°Ð²Ñ‚Ðµ Ñ€ÐµÐ¿Ð»Ñ–ÐºÐ¸ Ð´Ñ–Ð°Ð»Ð¾Ð³Ñƒ Ñƒ Ð¿Ñ€Ð°Ð²Ð¸Ð»ÑŒÐ½Ð¾Ð¼Ñƒ Ð¿Ð¾Ñ€ÑÐ´ÐºÑƒ.\n\n- Ð: Ð”Ð¾Ð±Ñ€Ð¸Ð¹ Ð´ÐµÐ½ÑŒ! Ð©Ð¾ Ð½Ð¾Ð²Ð¾Ð³Ð¾ Ð· Ð½Ð°ÑˆÐ¸Ð¼ Ð¿Ñ€Ð¾ÐµÐºÑ‚Ð¾Ð¼?\n- Ð‘: Ð”Ð¾Ð±Ñ€Ð¸Ð¹ Ð´ÐµÐ½ÑŒ! ÐŸÑ€Ð¾ÐµÐºÑ‚ Ð·Ð°Ñ‚Ð²ÐµÑ€Ð´Ð¶ÐµÐ½Ð¾ Ð¼Ð¸Ð½ÑƒÐ»Ð¾Ð³Ð¾ Ñ‚Ð¸Ð¶Ð½Ñ.\n- Ð: Ð§ÑƒÐ´Ð¾Ð²Ð¾! Ð Ñ‰Ð¾ Ð· Ð±ÑŽÐ´Ð¶ÐµÑ‚Ð¾Ð¼?\n- Ð‘: Ð‘ÑŽÐ´Ð¶ÐµÑ‚ Ñ‰Ðµ Ñ€Ð¾Ð·Ð³Ð»ÑÐ´Ð°Ñ”Ñ‚ÑŒÑÑ Ñ„Ñ–Ð½Ð°Ð½ÑÐ¾Ð²Ð¸Ð¼ Ð²Ñ–Ð´Ð´Ñ–Ð»Ð¾Ð¼.\n- Ð: Ð—Ñ€Ð¾Ð·ÑƒÐ¼Ñ–Ð»Ð¾. ÐšÐ¾Ð»Ð¸ Ð¾Ñ‡Ñ–ÐºÑƒÑ”Ñ‚ÑŒÑÑ Ð¾ÑÑ‚Ð°Ñ‚Ð¾Ñ‡Ð½Ðµ Ñ€Ñ–ÑˆÐµÐ½Ð½Ñ?\n- Ð‘: ÐÐ°Ð¼ Ð¿Ð¾Ð¾Ð±Ñ–Ñ†ÑÐ»Ð¸ Ð²Ñ–Ð´Ð¿Ð¾Ð²Ñ–Ð´ÑŒ Ð´Ð¾ ÐºÑ–Ð½Ñ†Ñ Ð¼Ñ–ÑÑÑ†Ñ.\n- Ð: Ð”Ð¾Ð±Ñ€Ðµ. Ð Ð´Ð¾ÐºÑƒÐ¼ÐµÐ½Ñ‚Ð¸ Ð²Ð¶Ðµ Ð¿Ñ–Ð´Ð³Ð¾Ñ‚Ð¾Ð²Ð»ÐµÐ½Ð¾?\n- Ð‘: Ð¢Ð°Ðº, ÑƒÑÑ– Ð´Ð¾ÐºÑƒÐ¼ÐµÐ½Ñ‚Ð¸ Ð¿Ñ–Ð´Ð¿Ð¸ÑÐ°Ð½Ð¾ Ñ– Ð½Ð°Ð´Ñ–ÑÐ»Ð°Ð½Ð¾.\n\n## select: ÐžÐ±ÐµÑ€Ñ–Ñ‚ÑŒ Ð¿Ñ€Ð°Ð²Ð¸Ð»ÑŒÐ½Ñ– Ð²Ð°Ñ€Ñ–Ð°Ð½Ñ‚Ð¸\n> ÐžÐ±ÐµÑ€Ñ–Ñ‚ÑŒ Ð£Ð¡Ð† Ð¿Ñ€Ð°Ð²Ð¸Ð»ÑŒÐ½Ñ– Ð²Ð°Ñ€Ñ–Ð°Ð½Ñ‚Ð¸.\n\n1. Ð¯ÐºÑ– Ñ„Ð¾Ñ€Ð¼Ð¸ Ñ” Ð¿Ð°ÑÐ¸Ð²Ð½Ð¸Ð¼Ð¸?\n   - [x] ÐšÐ½Ð¸Ð³Ð° Ð½Ð°Ð¿Ð¸ÑÐ°Ð½Ð° Ð°Ð²Ñ‚Ð¾Ñ€Ð¾Ð¼.\n   - [x] ÐšÐ½Ð¸Ð³Ñƒ Ð½Ð°Ð¿Ð¸ÑÐ°Ð½Ð¾.\n   - [x] ÐšÐ½Ð¸Ð³Ñƒ Ð½Ð°Ð¿Ð¸ÑÐ°Ð»Ð¸.\n   - [ ] ÐÐ²Ñ‚Ð¾Ñ€ Ð½Ð°Ð¿Ð¸ÑÐ°Ð² ÐºÐ½Ð¸Ð³Ñƒ.\n   > Three are passive, the last one is active.\n\n2. Ð¯ÐºÑ– Ñ€ÐµÑ‡ÐµÐ½Ð½Ñ Ð² Ð¾Ñ„Ñ–Ñ†Ñ–Ð¹Ð½Ð¾-Ð´Ñ–Ð»Ð¾Ð²Ð¾Ð¼Ñƒ ÑÑ‚Ð¸Ð»Ñ–?\n   - [x] Ð Ñ–ÑˆÐµÐ½Ð½Ñ Ð¿Ñ€Ð¸Ð¹Ð½ÑÑ‚Ð¾.\n   - [ ] ÐœÐµÐ½Ñ– ÑÐºÐ°Ð·Ð°Ð»Ð¸ Ð¿Ñ€Ð¾ Ñ€Ñ–ÑˆÐµÐ½Ð½Ñ.\n   - [x] ÐÐ°ÐºÐ°Ð· Ð²Ð¸Ð´Ð°Ð½Ð¾ Ð´Ð¸Ñ€ÐµÐºÑ‚Ð¾Ñ€Ð¾Ð¼.\n   - [ ] Ð”Ð¸Ñ€ÐµÐºÑ‚Ð¾Ñ€ Ð²Ð¸Ð´Ð°Ð² Ð½Ð°ÐºÐ°Ð·.\n   > The -Ð½Ð¾/-Ñ‚Ð¾ form characterizes official style.\n\n3. Ð¯ÐºÑ– Ñ„Ð¾Ñ€Ð¼Ð¸ Ð½Ð°Ð³Ð¾Ð»Ð¾ÑˆÑƒÑŽÑ‚ÑŒ Ð½Ð° Ð¿Ñ€Ð¾Ñ†ÐµÑÑ–?\n   - [ ] ÐšÐ½Ð¸Ð³Ð° Ð½Ð°Ð¿Ð¸ÑÐ°Ð½Ð°.\n   - [ ] ÐšÐ½Ð¸Ð³Ñƒ Ð½Ð°Ð¿Ð¸ÑÐ°Ð½Ð¾.\n   - [x] ÐšÐ½Ð¸Ð³Ð° Ð¿Ð¸ÑˆÐµÑ‚ÑŒÑÑ.\n   - [x] Ð”Ð¾ÑÐ»Ñ–Ð´Ð¶ÐµÐ½Ð½Ñ Ð¿Ñ€Ð¾Ð²Ð¾Ð´Ð¸Ñ‚ÑŒÑÑ.\n   > Reflexive form (-ÑÑ) emphasizes process.\n\n4. Ð¯ÐºÑ– Ñ€ÐµÑ‡ÐµÐ½Ð½Ñ Ð¿Ñ€Ð°Ð²Ð¸Ð»ÑŒÐ½Ñ–?\n   - [x] ÐšÐ½Ð¸Ð³Ñƒ Ð½Ð°Ð¿Ð¸ÑÐ°Ð½Ð¾.\n   - [ ] ÐšÐ½Ð¸Ð³Ð° Ð½Ð°Ð¿Ð¸ÑÐ°Ð½Ð¾.\n   - [x] ÐšÐ½Ð¸Ð³Ð° Ð½Ð°Ð¿Ð¸ÑÐ°Ð½Ð°.\n   - [ ] ÐšÐ½Ð¸Ð³Ð¸ Ð½Ð°Ð¿Ð¸ÑÐ°Ð½Ð¾ Ð°Ð²Ñ‚Ð¾Ñ€Ð¾Ð¼.\n   > Impersonal form requires accusative case.\n\n5. Ð’ ÑÐºÐ¸Ñ… Ñ€ÐµÑ‡ÐµÐ½Ð½ÑÑ… Ð²Ð¸Ñ€Ð°Ð¶ÐµÐ½Ð¾ Ð°Ð³ÐµÐ½Ñ‚Ð°?\n   - [x] ÐšÐ½Ð¸Ð³Ð° Ð½Ð°Ð¿Ð¸ÑÐ°Ð½Ð° Ð°Ð²Ñ‚Ð¾Ñ€Ð¾Ð¼.\n   - [ ] ÐšÐ½Ð¸Ð³Ñƒ Ð½Ð°Ð¿Ð¸ÑÐ°Ð½Ð¾.\n   - [x] ÐŸÑ€Ð¾Ð±Ð»ÐµÐ¼Ð° Ð²Ð¸Ð²Ñ‡Ð°Ñ”Ñ‚ÑŒÑÑ Ð½Ð°ÑƒÐºÐ¾Ð²Ñ†ÑÐ¼Ð¸.\n   - [ ] ÐœÐµÐ½Ñ– ÑÐºÐ°Ð·Ð°Ð»Ð¸.\n   > Agent in instrumental: Ð°Ð²Ñ‚Ð¾Ñ€Ð¾Ð¼, Ð½Ð°ÑƒÐºÐ¾Ð²Ñ†ÑÐ¼Ð¸.\n\n6. Ð¯ÐºÑ– Ñ„Ð¾Ñ€Ð¼Ð¸ Ñ…Ð°Ñ€Ð°ÐºÑ‚ÐµÑ€Ð½Ñ– Ð´Ð»Ñ Ð½Ð°ÑƒÐºÐ¾Ð²Ð¾Ð³Ð¾ ÑÑ‚Ð¸Ð»ÑŽ?\n   - [ ] ÐœÐµÐ½Ñ– ÑÐºÐ°Ð·Ð°Ð»Ð¸.\n   - [x] Ð”Ð¾ÑÐ»Ñ–Ð´Ð¶ÑƒÑ”Ñ‚ÑŒÑÑ.\n   - [x] ÐŸÑ€Ð¾Ð²Ð¾Ð´Ð¸Ñ‚ÑŒÑÑ.\n   - [ ] Ð¡ÐºÐ°Ð·Ð°Ð½Ð¾.\n   > Reflexive form is typical for science.\n\n7. Ð¯ÐºÑ– Ð´Ñ–Ñ”Ð¿Ñ€Ð¸ÐºÐ¼ÐµÑ‚Ð½Ð¸ÐºÐ¸ ÑƒÐ·Ð³Ð¾Ð´Ð¶ÐµÐ½Ñ– Ð¿Ñ€Ð°Ð²Ð¸Ð»ÑŒÐ½Ð¾?\n   - [x] Ð›Ð¸ÑÑ‚ Ð½Ð°Ð¿Ð¸ÑÐ°Ð½Ð¸Ð¹.\n   - [x] ÐšÐ½Ð¸Ð³Ð° Ð½Ð°Ð¿Ð¸ÑÐ°Ð½Ð°.\n   - [ ] Ð¡Ð»Ð¾Ð²Ð¾ Ð½Ð°Ð¿Ð¸ÑÐ°Ð½Ð¸Ð¹.\n   - [x] Ð”Ð¾ÐºÑƒÐ¼ÐµÐ½Ñ‚Ð¸ Ð½Ð°Ð¿Ð¸ÑÐ°Ð½Ñ–.\n   > Ð¡Ð»Ð¾Ð²Ð¾ is neuter, so Ð½Ð°Ð¿Ð¸ÑÐ°Ð½Ðµ.\n\n8. Ð¯ÐºÑ– Ñ€ÐµÑ‡ÐµÐ½Ð½Ñ Ð² Ñ€Ð¾Ð·Ð¼Ð¾Ð²Ð½Ð¾Ð¼Ñƒ ÑÑ‚Ð¸Ð»Ñ–?\n   - [ ] Ð Ñ–ÑˆÐµÐ½Ð½Ñ Ð¿Ñ€Ð¸Ð¹Ð½ÑÑ‚Ð¾.\n   - [x] ÐœÐµÐ½Ñ– ÑÐºÐ°Ð·Ð°Ð»Ð¸.\n   - [x] Ð™Ð¾Ð¼Ñƒ Ð¿Ð¾Ð¾Ð±Ñ–Ñ†ÑÐ»Ð¸.\n   - [ ] Ð”Ð¾ÐºÑƒÐ¼ÐµÐ½Ñ‚ Ð¿Ñ–Ð´Ð¿Ð¸ÑÐ°Ð½Ð¾.\n   > Third person plural is colloquial style.\n\n## translate: ÐŸÐµÑ€ÐµÐºÐ»Ð°Ð´ Ð½Ð° ÑƒÐºÑ€Ð°Ñ—Ð½ÑÑŒÐºÑƒ\n> ÐžÐ±ÐµÑ€Ñ–Ñ‚ÑŒ Ð¿Ñ€Ð°Ð²Ð¸Ð»ÑŒÐ½Ð¸Ð¹ Ð¿ÐµÑ€ÐµÐºÐ»Ð°Ð´.\n\n1. The decision has been made.\n   - [ ] Ð Ñ–ÑˆÐµÐ½Ð½Ñ Ð·Ñ€Ð¾Ð±Ð¸Ð»Ð¸.\n   - [x] Ð Ñ–ÑˆÐµÐ½Ð½Ñ Ð¿Ñ€Ð¸Ð¹Ð½ÑÑ‚Ð¾.\n   - [ ] Ð Ñ–ÑˆÐµÐ½Ð½Ñ Ð¿Ñ€Ð¸Ð¹Ð¼Ð°Ñ”Ñ‚ÑŒÑÑ.\n   - [ ] Ð Ñ–ÑˆÐµÐ½Ð½Ñ Ð¿Ñ€Ð¸Ð¹Ð½ÑÐ»Ð¸.\n   > Official context â†’ impersonal form -Ð½Ð¾.\n\n2. I was told about the meeting.\n   - [ ] ÐœÐµÐ½Ðµ ÑÐºÐ°Ð·Ð°Ð»Ð¸ Ð¿Ñ€Ð¾ Ð·Ð±Ð¾Ñ€Ð¸.\n   - [x] ÐœÐµÐ½Ñ– ÑÐºÐ°Ð·Ð°Ð»Ð¸ Ð¿Ñ€Ð¾ Ð·Ð±Ð¾Ñ€Ð¸.\n   - [ ] ÐœÐ½Ð¾ÑŽ ÑÐºÐ°Ð·Ð°Ð½Ð¾ Ð¿Ñ€Ð¾ Ð·Ð±Ð¾Ñ€Ð¸.\n   - [ ] Ð¯ ÑÐºÐ°Ð·Ð°Ð² Ð¿Ñ€Ð¾ Ð·Ð±Ð¾Ñ€Ð¸.\n   > Recipient of information in dative: Ð¼ÐµÐ½Ñ– ÑÐºÐ°Ð·Ð°Ð»Ð¸.\n\n3. The book was written by a famous author.\n   - [x] ÐšÐ½Ð¸Ð³Ð° Ð½Ð°Ð¿Ð¸ÑÐ°Ð½Ð° Ð²Ñ–Ð´Ð¾Ð¼Ð¸Ð¼ Ð°Ð²Ñ‚Ð¾Ñ€Ð¾Ð¼.\n   - [ ] ÐšÐ½Ð¸Ð³Ñƒ Ð½Ð°Ð¿Ð¸ÑÐ°Ð½Ð¾ Ð²Ñ–Ð´Ð¾Ð¼Ð¸Ð¼ Ð°Ð²Ñ‚Ð¾Ñ€Ð¾Ð¼.\n   - [ ] ÐšÐ½Ð¸Ð³Ð° Ð¿Ð¸ÑˆÐµÑ‚ÑŒÑÑ Ð²Ñ–Ð´Ð¾Ð¼Ð¸Ð¼ Ð°Ð²Ñ‚Ð¾Ñ€Ð¾Ð¼.\n   - [ ] ÐšÐ½Ð¸Ð³Ñƒ Ð½Ð°Ð¿Ð¸ÑÐ°Ð»Ð¸ Ð²Ñ–Ð´Ð¾Ð¼Ð¸Ð¼ Ð°Ð²Ñ‚Ð¾Ñ€Ð¾Ð¼.\n   > Participial form with agent in instrumental.\n\n4. The experiment is being conducted.\n   - [ ] Ð•ÐºÑÐ¿ÐµÑ€Ð¸Ð¼ÐµÐ½Ñ‚ Ð¿Ñ€Ð¾Ð²ÐµÐ´ÐµÐ½Ð¾.\n   - [x] Ð•ÐºÑÐ¿ÐµÑ€Ð¸Ð¼ÐµÐ½Ñ‚ Ð¿Ñ€Ð¾Ð²Ð¾Ð´Ð¸Ñ‚ÑŒÑÑ.\n   - [ ] Ð•ÐºÑÐ¿ÐµÑ€Ð¸Ð¼ÐµÐ½Ñ‚ Ð¿Ñ€Ð¾Ð²ÐµÐ´ÐµÐ½Ð¸Ð¹.\n   - [ ] Ð•ÐºÑÐ¿ÐµÑ€Ð¸Ð¼ÐµÐ½Ñ‚ Ð¿Ñ€Ð¾Ð²ÐµÐ»Ð¸.\n   > Ongoing process â†’ reflexive form.\n\n5. He was promised a promotion.\n   - [ ] Ð’Ñ–Ð½ Ð¿Ð¾Ð¾Ð±Ñ–Ñ†ÑÐ² Ð¿Ñ–Ð´Ð²Ð¸Ñ‰ÐµÐ½Ð½Ñ.\n   - [ ] Ð™Ð¾Ð³Ð¾ Ð¿Ð¾Ð¾Ð±Ñ–Ñ†ÑÐ»Ð¸ Ð¿Ñ–Ð´Ð²Ð¸Ñ‰ÐµÐ½Ð½Ñ.\n   - [x] Ð™Ð¾Ð¼Ñƒ Ð¿Ð¾Ð¾Ð±Ñ–Ñ†ÑÐ»Ð¸ Ð¿Ñ–Ð´Ð²Ð¸Ñ‰ÐµÐ½Ð½Ñ.\n   - [ ] Ð™Ð¾Ð¼Ñƒ Ð¿Ð¾Ð¾Ð±Ñ–Ñ†ÑÐ½Ð¾ Ð¿Ñ–Ð´Ð²Ð¸Ñ‰ÐµÐ½Ð½Ñ.\n   > Recipient in dative + 3rd person plural.\n\n6. The law applies to all citizens.\n   - [ ] Ð—Ð°ÐºÐ¾Ð½ Ð·Ð°ÑÑ‚Ð¾ÑÐ¾Ð²Ð°Ð½Ð¾ Ð´Ð¾ Ð²ÑÑ–Ñ… Ð³Ñ€Ð¾Ð¼Ð°Ð´ÑÐ½.\n   - [x] Ð—Ð°ÐºÐ¾Ð½ Ð·Ð°ÑÑ‚Ð¾ÑÐ¾Ð²ÑƒÑ”Ñ‚ÑŒÑÑ Ð´Ð¾ Ð²ÑÑ–Ñ… Ð³Ñ€Ð¾Ð¼Ð°Ð´ÑÐ½.\n   - [ ] Ð—Ð°ÐºÐ¾Ð½ Ð·Ð°ÑÑ‚Ð¾ÑÑƒÐ²Ð°Ð»Ð¸ Ð´Ð¾ Ð²ÑÑ–Ñ… Ð³Ñ€Ð¾Ð¼Ð°Ð´ÑÐ½.\n   - [ ] Ð—Ð°ÐºÐ¾Ð½ Ð·Ð°ÑÑ‚Ð¾ÑÐ¾Ð²Ð°Ð½Ð¸Ð¹ Ð´Ð¾ Ð²ÑÑ–Ñ… Ð³Ñ€Ð¾Ð¼Ð°Ð´ÑÐ½.\n   > General ongoing process â†’ reflexive form.\n\n7. The document was signed yesterday.\n   - [x] Ð”Ð¾ÐºÑƒÐ¼ÐµÐ½Ñ‚ Ð¿Ñ–Ð´Ð¿Ð¸ÑÐ°Ð½Ð¾ Ð²Ñ‡Ð¾Ñ€Ð°.\n   - [ ] Ð”Ð¾ÐºÑƒÐ¼ÐµÐ½Ñ‚ Ð¿Ñ–Ð´Ð¿Ð¸ÑÐ°Ð²ÑÑ Ð²Ñ‡Ð¾Ñ€Ð°.\n   - [ ] Ð”Ð¾ÐºÑƒÐ¼ÐµÐ½Ñ‚ Ð¿Ñ–Ð´Ð¿Ð¸ÑÐ°Ð»Ð¸ Ð²Ñ‡Ð¾Ñ€Ð°.\n   - [ ] Ð”Ð¾ÐºÑƒÐ¼ÐµÐ½Ñ‚ Ð¿Ñ–Ð´Ð¿Ð¸ÑÐ°Ð½Ð¸Ð¹ Ð²Ñ‡Ð¾Ñ€Ð°.\n   > Official context â†’ impersonal form.\n\n8. The problem is being studied by scientists.\n   - [ ] ÐŸÑ€Ð¾Ð±Ð»ÐµÐ¼Ñƒ Ð²Ð¸Ð²Ñ‡ÐµÐ½Ð¾ Ð½Ð°ÑƒÐºÐ¾Ð²Ñ†ÑÐ¼Ð¸.\n   - [x] ÐŸÑ€Ð¾Ð±Ð»ÐµÐ¼Ð° Ð²Ð¸Ð²Ñ‡Ð°Ñ”Ñ‚ÑŒÑÑ Ð½Ð°ÑƒÐºÐ¾Ð²Ñ†ÑÐ¼Ð¸.\n   - [ ] ÐŸÑ€Ð¾Ð±Ð»ÐµÐ¼Ñƒ Ð²Ð¸Ð²Ñ‡Ð°ÑŽÑ‚ÑŒ Ð½Ð°ÑƒÐºÐ¾Ð²Ñ†Ñ–.\n   - [ ] ÐŸÑ€Ð¾Ð±Ð»ÐµÐ¼Ð° Ð²Ð¸Ð²Ñ‡ÐµÐ½Ð° Ð½Ð°ÑƒÐºÐ¾Ð²Ñ†ÑÐ¼Ð¸.\n   > Process + agent â†’ reflexive form with instrumental.\n\n9. We were invited to the party.\n   - [x] ÐÐ°Ñ Ð·Ð°Ð¿Ñ€Ð¾ÑÐ¸Ð»Ð¸ Ð½Ð° Ð²ÐµÑ‡Ñ–Ñ€ÐºÑƒ.\n   - [ ] ÐÐ°Ð¼ Ð·Ð°Ð¿Ñ€Ð¾ÑÐ¸Ð»Ð¸ Ð½Ð° Ð²ÐµÑ‡Ñ–Ñ€ÐºÑƒ.\n   - [ ] ÐÐ°Ð¼Ð¸ Ð·Ð°Ð¿Ñ€Ð¾ÑˆÐµÐ½Ð¾ Ð½Ð° Ð²ÐµÑ‡Ñ–Ñ€ÐºÑƒ.\n   - [ ] ÐœÐ¸ Ð·Ð°Ð¿Ñ€Ð¾ÑˆÐµÐ½Ñ– Ð½Ð° Ð²ÐµÑ‡Ñ–Ñ€ÐºÑƒ.\n   > Colloquial style â†’ 3rd person plural.\n\n10. The meeting is declared closed.\n    - [x] Ð—Ð°ÑÑ–Ð´Ð°Ð½Ð½Ñ Ð¾Ð³Ð¾Ð»Ð¾ÑˆÐµÐ½Ð¾ Ð·Ð°ÐºÑ€Ð¸Ñ‚Ð¸Ð¼.\n    - [ ] Ð—Ð°ÑÑ–Ð´Ð°Ð½Ð½Ñ Ð¾Ð³Ð¾Ð»Ð¾ÑˆÑƒÑ”Ñ‚ÑŒÑÑ Ð·Ð°ÐºÑ€Ð¸Ñ‚Ð¸Ð¼.\n    - [ ] Ð—Ð°ÑÑ–Ð´Ð°Ð½Ð½Ñ Ð¾Ð³Ð¾Ð»Ð¾ÑÐ¸Ð»Ð¸ Ð·Ð°ÐºÑ€Ð¸Ñ‚Ð¸Ð¼.\n    - [ ] Ð—Ð°ÑÑ–Ð´Ð°Ð½Ð½Ñ Ð¾Ð³Ð¾Ð»Ð¾ÑˆÐµÐ½Ðµ Ð·Ð°ÐºÑ€Ð¸Ñ‚Ð¸Ð¼.\n    > Official formula â†’ impersonal form.\n\n11. The data is being collected automatically.\n    - [ ] Ð”Ð°Ð½Ñ– Ð·Ñ–Ð±Ñ€Ð°Ð½Ð¾ Ð°Ð²Ñ‚Ð¾Ð¼Ð°Ñ‚Ð¸Ñ‡Ð½Ð¾.\n    - [x] Ð”Ð°Ð½Ñ– Ð·Ð±Ð¸Ñ€Ð°ÑŽÑ‚ÑŒÑÑ Ð°Ð²Ñ‚Ð¾Ð¼Ð°Ñ‚Ð¸Ñ‡Ð½Ð¾.\n    - [ ] Ð”Ð°Ð½Ñ– Ð·Ñ–Ð±Ñ€Ð°Ð½Ñ– Ð°Ð²Ñ‚Ð¾Ð¼Ð°Ñ‚Ð¸Ñ‡Ð½Ð¾.\n    - [ ] Ð”Ð°Ð½Ñ– Ð·Ð±Ð¸Ñ€Ð°Ð»Ð¸ Ð°Ð²Ñ‚Ð¾Ð¼Ð°Ñ‚Ð¸Ñ‡Ð½Ð¾.\n    > Process â†’ reflexive form.\n\n12. The order has been issued.\n    - [x] ÐÐ°ÐºÐ°Ð· Ð²Ð¸Ð´Ð°Ð½Ð¾.\n    - [ ] ÐÐ°ÐºÐ°Ð· Ð²Ð¸Ð´Ð°Ð½Ð¸Ð¹.\n    - [ ] ÐÐ°ÐºÐ°Ð· Ð²Ð¸Ð´Ð°Ñ”Ñ‚ÑŒÑÑ.\n    - [ ] ÐÐ°ÐºÐ°Ð· Ð²Ð¸Ð´Ð°Ð»Ð¸.\n    > Official document â†’ impersonal form.\n\n13. The building was constructed in 2020.\n    - [ ] Ð‘ÑƒÐ´Ð¸Ð½Ð¾Ðº Ð±ÑƒÐ´ÑƒÑ”Ñ‚ÑŒÑÑ Ñƒ 2020 Ñ€Ð¾Ñ†Ñ–.\n    - [x] Ð‘ÑƒÐ´Ð¸Ð½Ð¾Ðº Ð¿Ð¾Ð±ÑƒÐ´Ð¾Ð²Ð°Ð½Ð¸Ð¹ Ñƒ 2020 Ñ€Ð¾Ñ†Ñ–.\n    - [ ] Ð‘ÑƒÐ´Ð¸Ð½Ð¾Ðº Ð¿Ð¾Ð±ÑƒÐ´Ð¾Ð²Ð°Ð½Ð¾ Ñƒ 2020 Ñ€Ð¾Ñ†Ñ–.\n    - [ ] Ð‘ÑƒÐ´Ð¸Ð½Ð¾Ðº Ð¿Ð¾Ð±ÑƒÐ´ÑƒÐ²Ð°Ð»Ð¸ Ñƒ 2020 Ñ€Ð¾Ñ†Ñ–.\n    > Literary style â†’ participial form.\n\n14. I was asked about the discount.\n    - [x] ÐœÐµÐ½Ðµ Ð·Ð°Ð¿Ð¸Ñ‚Ð°Ð»Ð¸ Ð¿Ñ€Ð¾ Ð·Ð½Ð¸Ð¶ÐºÑƒ.\n    - [ ] ÐœÐµÐ½Ñ– Ð·Ð°Ð¿Ð¸Ñ‚Ð°Ð»Ð¸ Ð¿Ñ€Ð¾ Ð·Ð½Ð¸Ð¶ÐºÑƒ.\n    - [ ] ÐœÐ½Ð¾ÑŽ Ð·Ð°Ð¿Ð¸Ñ‚Ð°Ð½Ð¾ Ð¿Ñ€Ð¾ Ð·Ð½Ð¸Ð¶ÐºÑƒ.\n    - [ ] Ð¯ Ð·Ð°Ð¿Ð¸Ñ‚Ð°Ð² Ð¿Ñ€Ð¾ Ð·Ð½Ð¸Ð¶ÐºÑƒ.\n    > Ð Ð¾Ð·Ð¼Ð¾Ð²Ð½Ð¸Ð¹ ÑÑ‚Ð¸Ð»ÑŒ â†’ Ñ‚Ñ€ÐµÑ‚Ñ Ð¾ÑÐ¾Ð±Ð° Ð¼Ð½Ð¾Ð¶Ð¸Ð½Ð¸, Ð¼ÐµÐ½Ðµ Ñƒ Ð·Ð½Ð°Ñ…Ñ–Ð´Ð½Ð¾Ð¼Ñƒ.\n\n15. The article will be published next month.\n    - [ ] Ð¡Ñ‚Ð°Ñ‚Ñ‚ÑŽ Ð¿ÑƒÐ±Ð»Ñ–ÐºÑƒÐ²Ð°Ñ‚Ð¸Ð¼ÑƒÑ‚ÑŒ Ð½Ð°ÑÑ‚ÑƒÐ¿Ð½Ð¾Ð³Ð¾ Ð¼Ñ–ÑÑÑ†Ñ.\n    - [x] Ð¡Ñ‚Ð°Ñ‚Ñ‚ÑŽ Ð±ÑƒÐ´Ðµ Ð¾Ð¿ÑƒÐ±Ð»Ñ–ÐºÐ¾Ð²Ð°Ð½Ð¾ Ð½Ð°ÑÑ‚ÑƒÐ¿Ð½Ð¾Ð³Ð¾ Ð¼Ñ–ÑÑÑ†Ñ.\n    - [ ] Ð¡Ñ‚Ð°Ñ‚Ñ‚Ñ Ð¿ÑƒÐ±Ð»Ñ–ÐºÑƒÑ”Ñ‚ÑŒÑÑ Ð½Ð°ÑÑ‚ÑƒÐ¿Ð½Ð¾Ð³Ð¾ Ð¼Ñ–ÑÑÑ†Ñ.\n    - [ ] Ð¡Ñ‚Ð°Ñ‚Ñ‚ÑŽ Ð¾Ð¿ÑƒÐ±Ð»Ñ–ÐºÑƒÐ²Ð°Ð»Ð¸ Ð½Ð°ÑÑ‚ÑƒÐ¿Ð½Ð¾Ð³Ð¾ Ð¼Ñ–ÑÑÑ†Ñ.\n    > Future passive â†’ Ð±ÑƒÐ´Ðµ + -Ð½Ð¾.\n\n16. The work has been completed on time.\n    - [x] Ð Ð¾Ð±Ð¾Ñ‚Ñƒ Ð·Ð°Ð²ÐµÑ€ÑˆÐµÐ½Ð¾ Ð²Ñ‡Ð°ÑÐ½Ð¾.\n    - [ ] Ð Ð¾Ð±Ð¾Ñ‚Ð° Ð·Ð°Ð²ÐµÑ€ÑˆÐµÐ½Ð° Ð²Ñ‡Ð°ÑÐ½Ð¾.\n    - [ ] Ð Ð¾Ð±Ð¾Ñ‚Ñƒ Ð·Ð°Ð²ÐµÑ€ÑˆÐ¸Ð»Ð¸ Ð²Ñ‡Ð°ÑÐ½Ð¾.\n    - [ ] Ð Ð¾Ð±Ð¾Ñ‚Ð° Ð·Ð°Ð²ÐµÑ€ÑˆÑƒÑ”Ñ‚ÑŒÑÑ Ð²Ñ‡Ð°ÑÐ½Ð¾.\n    > Official result â†’ impersonal form.\n\n## quiz: Ð’Ñ–Ð´Ð¼Ñ–Ð½ÐºÐ¸ Ð² Ð¿Ð°ÑÐ¸Ð²Ð½Ð¸Ñ… ÐºÐ¾Ð½ÑÑ‚Ñ€ÑƒÐºÑ†Ñ–ÑÑ…\n> ÐžÐ±ÐµÑ€Ñ–Ñ‚ÑŒ Ð¿Ñ€Ð°Ð²Ð¸Ð»ÑŒÐ½Ð¸Ð¹ Ð²Ñ–Ð´Ð¼Ñ–Ð½Ð¾Ðº.\n\n1. Ð£ Ð´Ñ–Ñ”Ð¿Ñ€Ð¸ÐºÐ¼ÐµÑ‚Ð½Ð¸ÐºÐ¾Ð²Ñ–Ð¹ Ñ„Ð¾Ñ€Ð¼Ñ– Ð°Ð³ÐµÐ½Ñ‚ Ð²Ð¸Ñ€Ð°Ð¶Ð°Ñ”Ñ‚ÑŒÑÑ Ð²:\n   - [ ] Ð·Ð½Ð°Ñ…Ñ–Ð´Ð½Ð¾Ð¼Ñƒ Ð²Ñ–Ð´Ð¼Ñ–Ð½ÐºÑƒ\n   - [ ] Ð´Ð°Ð²Ð°Ð»ÑŒÐ½Ð¾Ð¼Ñƒ Ð²Ñ–Ð´Ð¼Ñ–Ð½ÐºÑƒ\n   - [x] Ð¾Ñ€ÑƒÐ´Ð½Ð¾Ð¼Ñƒ Ð²Ñ–Ð´Ð¼Ñ–Ð½ÐºÑƒ\n   - [ ] Ñ€Ð¾Ð´Ð¾Ð²Ð¾Ð¼Ñƒ Ð²Ñ–Ð´Ð¼Ñ–Ð½ÐºÑƒ\n   > ÐšÐ½Ð¸Ð³Ð° Ð½Ð°Ð¿Ð¸ÑÐ°Ð½Ð° Ð°Ð²Ñ‚Ð¾Ñ€ÐžÐœ â€” Ð¾Ñ€ÑƒÐ´Ð½Ð¸Ð¹.\n\n2. Ð£ Ð±ÐµÐ·Ð¾ÑÐ¾Ð±Ð¾Ð²Ñ–Ð¹ Ñ„Ð¾Ñ€Ð¼Ñ– Ð¾Ð±'Ñ”ÐºÑ‚ ÑÑ‚Ð¾Ñ—Ñ‚ÑŒ Ñƒ:\n   - [x] Ð·Ð½Ð°Ñ…Ñ–Ð´Ð½Ð¾Ð¼Ñƒ Ð²Ñ–Ð´Ð¼Ñ–Ð½ÐºÑƒ\n   - [ ] Ð½Ð°Ð·Ð¸Ð²Ð½Ð¾Ð¼Ñƒ Ð²Ñ–Ð´Ð¼Ñ–Ð½ÐºÑƒ\n   - [ ] Ð¾Ñ€ÑƒÐ´Ð½Ð¾Ð¼Ñƒ Ð²Ñ–Ð´Ð¼Ñ–Ð½ÐºÑƒ\n   - [ ] Ð´Ð°Ð²Ð°Ð»ÑŒÐ½Ð¾Ð¼Ñƒ Ð²Ñ–Ð´Ð¼Ñ–Ð½ÐºÑƒ\n   > ÐšÐ½Ð¸Ð³Ð£ Ð½Ð°Ð¿Ð¸ÑÐ°Ð½Ð¾ â€” Ð·Ð½Ð°Ñ…Ñ–Ð´Ð½Ð¸Ð¹.\n\n3. Ð£ Ñ‚Ñ€ÐµÑ‚Ñ–Ð¹ Ð¾ÑÐ¾Ð±Ñ– Ð¼Ð½Ð¾Ð¶Ð¸Ð½Ð¸ Ð¾Ñ‚Ñ€Ð¸Ð¼ÑƒÐ²Ð°Ñ‡ Ð´Ñ–Ñ—:\n   - [ ] Ñƒ Ð·Ð½Ð°Ñ…Ñ–Ð´Ð½Ð¾Ð¼Ñƒ Ð²Ñ–Ð´Ð¼Ñ–Ð½ÐºÑƒ\n   - [x] Ñƒ Ð´Ð°Ð²Ð°Ð»ÑŒÐ½Ð¾Ð¼Ñƒ Ð²Ñ–Ð´Ð¼Ñ–Ð½ÐºÑƒ\n   - [ ] Ð² Ð¾Ñ€ÑƒÐ´Ð½Ð¾Ð¼Ñƒ Ð²Ñ–Ð´Ð¼Ñ–Ð½ÐºÑƒ\n   - [ ] Ñƒ Ñ€Ð¾Ð´Ð¾Ð²Ð¾Ð¼Ñƒ Ð²Ñ–Ð´Ð¼Ñ–Ð½ÐºÑƒ\n   > Ð™Ð¾Ð¼Ð£ ÑÐºÐ°Ð·Ð°Ð»Ð¸ â€” Ð´Ð°Ð²Ð°Ð»ÑŒÐ½Ð¸Ð¹.\n\n4. \"ÐŸÑ€Ð¾Ð±Ð»ÐµÐ¼Ð° Ð²Ð¸Ð²Ñ‡Ð°Ñ”Ñ‚ÑŒÑÑ Ð½Ð°ÑƒÐºÐ¾Ð²Ñ†ÑÐ¼Ð¸\" â€” Ð°Ð³ÐµÐ½Ñ‚ Ñƒ:\n   - [ ] Ð·Ð½Ð°Ñ…Ñ–Ð´Ð½Ð¾Ð¼Ñƒ Ð²Ñ–Ð´Ð¼Ñ–Ð½ÐºÑƒ\n   - [ ] Ð´Ð°Ð²Ð°Ð»ÑŒÐ½Ð¾Ð¼Ñƒ Ð²Ñ–Ð´Ð¼Ñ–Ð½ÐºÑƒ\n   - [x] Ð¾Ñ€ÑƒÐ´Ð½Ð¾Ð¼Ñƒ Ð²Ñ–Ð´Ð¼Ñ–Ð½ÐºÑƒ\n   - [ ] Ñ€Ð¾Ð´Ð¾Ð²Ð¾Ð¼Ñƒ Ð²Ñ–Ð´Ð¼Ñ–Ð½ÐºÑƒ\n   > ÐÐ°ÑƒÐºÐ¾Ð²Ñ†Ð¯ÐœÐ˜ â€” Ð¾Ñ€ÑƒÐ´Ð½Ð¸Ð¹.\n\n5. \"ÐœÐµÐ½Ðµ Ð·Ð°Ð¿Ñ€Ð¾ÑÐ¸Ð»Ð¸\" â€” Ð¾Ð±'Ñ”ÐºÑ‚ Ñƒ:\n   - [x] Ð·Ð½Ð°Ñ…Ñ–Ð´Ð½Ð¾Ð¼Ñƒ Ð²Ñ–Ð´Ð¼Ñ–Ð½ÐºÑƒ\n   - [ ] Ð´Ð°Ð²Ð°Ð»ÑŒÐ½Ð¾Ð¼Ñƒ Ð²Ñ–Ð´Ð¼Ñ–Ð½ÐºÑƒ\n   - [ ] Ð¾Ñ€ÑƒÐ´Ð½Ð¾Ð¼Ñƒ Ð²Ñ–Ð´Ð¼Ñ–Ð½ÐºÑƒ\n   - [ ] Ð½Ð°Ð·Ð¸Ð²Ð½Ð¾Ð¼Ñƒ Ð²Ñ–Ð´Ð¼Ñ–Ð½ÐºÑƒ\n   > ÐœÐµÐ½Ð• â€” Ð·Ð½Ð°Ñ…Ñ–Ð´Ð½Ð¸Ð¹ (ÐºÐ¾Ð³Ð¾?).\n\n6. \"ÐÐ°Ð¼ Ð¿Ð¾Ð¾Ð±Ñ–Ñ†ÑÐ»Ð¸\" â€” Ð¾Ñ‚Ñ€Ð¸Ð¼ÑƒÐ²Ð°Ñ‡ Ñƒ:\n   - [ ] Ð·Ð½Ð°Ñ…Ñ–Ð´Ð½Ð¾Ð¼Ñƒ Ð²Ñ–Ð´Ð¼Ñ–Ð½ÐºÑƒ\n   - [x] Ð´Ð°Ð²Ð°Ð»ÑŒÐ½Ð¾Ð¼Ñƒ Ð²Ñ–Ð´Ð¼Ñ–Ð½ÐºÑƒ\n   - [ ] Ð¾Ñ€ÑƒÐ´Ð½Ð¾Ð¼Ñƒ Ð²Ñ–Ð´Ð¼Ñ–Ð½ÐºÑƒ\n   - [ ] Ð½Ð°Ð·Ð¸Ð²Ð½Ð¾Ð¼Ñƒ Ð²Ñ–Ð´Ð¼Ñ–Ð½ÐºÑƒ\n   > ÐÐ°Ðœ â€” Ð´Ð°Ð²Ð°Ð»ÑŒÐ½Ð¸Ð¹ (ÐºÐ¾Ð¼Ñƒ?).\n\n7. \"Ð”Ð¾ÐºÑƒÐ¼ÐµÐ½Ñ‚ Ð¿Ñ–Ð´Ð¿Ð¸ÑÐ°Ð½Ð¸Ð¹ Ð´Ð¸Ñ€ÐµÐºÑ‚Ð¾Ñ€Ð¾Ð¼\" â€” Ð°Ð³ÐµÐ½Ñ‚:\n   - [ ] Ð²Ñ–Ð´ÑÑƒÑ‚Ð½Ñ–Ð¹\n   - [ ] Ñƒ Ð·Ð½Ð°Ñ…Ñ–Ð´Ð½Ð¾Ð¼Ñƒ Ð²Ñ–Ð´Ð¼Ñ–Ð½ÐºÑƒ\n   - [x] Ð² Ð¾Ñ€ÑƒÐ´Ð½Ð¾Ð¼Ñƒ Ð²Ñ–Ð´Ð¼Ñ–Ð½ÐºÑƒ\n   - [ ] Ñƒ Ð´Ð°Ð²Ð°Ð»ÑŒÐ½Ð¾Ð¼Ñƒ Ð²Ñ–Ð´Ð¼Ñ–Ð½ÐºÑƒ\n   > Ð”Ð¸Ñ€ÐµÐºÑ‚Ð¾Ñ€ÐžÐœ â€” Ð¾Ñ€ÑƒÐ´Ð½Ð¸Ð¹.\n\n8. \"Ð Ð¾Ð±Ð¾Ñ‚Ñƒ Ð·Ð°Ð²ÐµÑ€ÑˆÐµÐ½Ð¾\" â€” Ð¾Ð±'Ñ”ÐºÑ‚ Ñƒ:\n   - [x] Ð·Ð½Ð°Ñ…Ñ–Ð´Ð½Ð¾Ð¼Ñƒ Ð²Ñ–Ð´Ð¼Ñ–Ð½ÐºÑƒ\n   - [ ] Ð½Ð°Ð·Ð¸Ð²Ð½Ð¾Ð¼Ñƒ Ð²Ñ–Ð´Ð¼Ñ–Ð½ÐºÑƒ\n   - [ ] Ð¾Ñ€ÑƒÐ´Ð½Ð¾Ð¼Ñƒ Ð²Ñ–Ð´Ð¼Ñ–Ð½ÐºÑƒ\n   - [ ] Ñ€Ð¾Ð´Ð¾Ð²Ð¾Ð¼Ñƒ Ð²Ñ–Ð´Ð¼Ñ–Ð½ÐºÑƒ\n   > Ð Ð¾Ð±Ð¾Ñ‚Ð£ â€” Ð·Ð½Ð°Ñ…Ñ–Ð´Ð½Ð¸Ð¹.\n\n9. Ð¯ÐºÐ° Ñ„Ð¾Ñ€Ð¼Ð° ÐÐ• Ð¼Ð¾Ð¶Ðµ Ð²Ð¸Ñ€Ð°Ð¶Ð°Ñ‚Ð¸ Ð°Ð³ÐµÐ½Ñ‚Ð°?\n   - [ ] Ð”Ñ–Ñ”Ð¿Ñ€Ð¸ÐºÐ¼ÐµÑ‚Ð½Ð¸ÐºÐ¾Ð²Ð°\n   - [ ] Ð—Ð²Ð¾Ñ€Ð¾Ñ‚Ð½Ð°\n   - [x] Ð‘ÐµÐ·Ð¾ÑÐ¾Ð±Ð¾Ð²Ð° (-Ð½Ð¾/-Ñ‚Ð¾)\n   - [ ] Ð’ÑÑ– Ð¼Ð¾Ð¶ÑƒÑ‚ÑŒ Ð²Ð¸Ñ€Ð°Ð¶Ð°Ñ‚Ð¸\n   > -Ð½Ð¾/-Ñ‚Ð¾ Ð½Ðµ Ð²Ð¸Ñ€Ð°Ð¶Ð°Ñ” Ð°Ð³ÐµÐ½Ñ‚Ð° Ð·Ð° ÑÐ²Ð¾Ñ”ÑŽ Ð¿Ñ€Ð¸Ñ€Ð¾Ð´Ð¾ÑŽ.\n\n10. \"Ð—Ð°ÐºÐ¾Ð½ Ð·Ð°ÑÑ‚Ð¾ÑÐ¾Ð²ÑƒÑ”Ñ‚ÑŒÑÑ ÑÑƒÐ´Ð°Ð¼Ð¸\" â€” ÑÑƒÐ´Ð¸ Ð²:\n    - [ ] Ð·Ð½Ð°Ñ…Ñ–Ð´Ð½Ð¾Ð¼Ñƒ Ð²Ñ–Ð´Ð¼Ñ–Ð½ÐºÑƒ\n    - [ ] Ð´Ð°Ð²Ð°Ð»ÑŒÐ½Ð¾Ð¼Ñƒ Ð²Ñ–Ð´Ð¼Ñ–Ð½ÐºÑƒ\n    - [x] Ð¾Ñ€ÑƒÐ´Ð½Ð¾Ð¼Ñƒ Ð²Ñ–Ð´Ð¼Ñ–Ð½ÐºÑƒ\n    - [ ] Ñ€Ð¾Ð´Ð¾Ð²Ð¾Ð¼Ñƒ Ð²Ñ–Ð´Ð¼Ñ–Ð½ÐºÑƒ\n    > Ð¡ÑƒÐ´ÐÐœÐ˜ â€” Ð¾Ñ€ÑƒÐ´Ð½Ð¸Ð¹.\n\n11. \"Ð‡Ð¹ Ð¿Ð¾Ð´Ð°Ñ€ÑƒÐ²Ð°Ð»Ð¸\" â€” Ð¾Ñ‚Ñ€Ð¸Ð¼ÑƒÐ²Ð°Ñ‡ Ñƒ:\n    - [ ] Ð·Ð½Ð°Ñ…Ñ–Ð´Ð½Ð¾Ð¼Ñƒ Ð²Ñ–Ð´Ð¼Ñ–Ð½ÐºÑƒ\n    - [x] Ð´Ð°Ð²Ð°Ð»ÑŒÐ½Ð¾Ð¼Ñƒ Ð²Ñ–Ð´Ð¼Ñ–Ð½ÐºÑƒ\n    - [ ] Ð¾Ñ€ÑƒÐ´Ð½Ð¾Ð¼Ñƒ Ð²Ñ–Ð´Ð¼Ñ–Ð½ÐºÑƒ\n    - [ ] Ð½Ð°Ð·Ð¸Ð²Ð½Ð¾Ð¼Ñƒ Ð²Ñ–Ð´Ð¼Ñ–Ð½ÐºÑƒ\n    > Ð‡Ð™ â€” Ð´Ð°Ð²Ð°Ð»ÑŒÐ½Ð¸Ð¹.\n\n12. Ð£ ÑÐºÑ–Ð¹ Ñ„Ð¾Ñ€Ð¼Ñ– Ð¾Ð±'Ñ”ÐºÑ‚ Ñƒ Ð½Ð°Ð·Ð¸Ð²Ð½Ð¾Ð¼Ñƒ Ð²Ñ–Ð´Ð¼Ñ–Ð½ÐºÑƒ?\n    - [x] Ð”Ñ–Ñ”Ð¿Ñ€Ð¸ÐºÐ¼ÐµÑ‚Ð½Ð¸ÐºÐ¾Ð²Ð°\n    - [ ] Ð‘ÐµÐ·Ð¾ÑÐ¾Ð±Ð¾Ð²Ð°\n    - [ ] Ð¢Ñ€ÐµÑ‚Ñ Ð¾ÑÐ¾Ð±Ð° Ð¼Ð½Ð¾Ð¶Ð¸Ð½Ð¸\n    - [ ] Ð–Ð¾Ð´Ð½Ñ–Ð¹\n    > ÐšÐ½Ð¸Ð³Ð Ð½Ð°Ð¿Ð¸ÑÐ°Ð½Ð° â€” ÐºÐ½Ð¸Ð³Ð° Ð² Ð½Ð°Ð·Ð¸Ð²Ð½Ð¾Ð¼Ñƒ.\n\n13. \"Ð•ÐºÑÐ¿ÐµÑ€Ð¸Ð¼ÐµÐ½Ñ‚ Ð¿Ñ€Ð¾Ð²Ð¾Ð´Ð¸Ñ‚ÑŒÑÑ\" â€” ÐµÐºÑÐ¿ÐµÑ€Ð¸Ð¼ÐµÐ½Ñ‚ Ñƒ:\n    - [x] Ð½Ð°Ð·Ð¸Ð²Ð½Ð¾Ð¼Ñƒ Ð²Ñ–Ð´Ð¼Ñ–Ð½ÐºÑƒ\n    - [ ] Ð·Ð½Ð°Ñ…Ñ–Ð´Ð½Ð¾Ð¼Ñƒ Ð²Ñ–Ð´Ð¼Ñ–Ð½ÐºÑƒ\n    - [ ] Ð¾Ñ€ÑƒÐ´Ð½Ð¾Ð¼Ñƒ Ð²Ñ–Ð´Ð¼Ñ–Ð½ÐºÑƒ\n    - [ ] Ð´Ð°Ð²Ð°Ð»ÑŒÐ½Ð¾Ð¼Ñƒ Ð²Ñ–Ð´Ð¼Ñ–Ð½ÐºÑƒ\n    > Ð•ÐºÑÐ¿ÐµÑ€Ð¸Ð¼ÐµÐ½Ñ‚Ã˜ â€” Ð½Ð°Ð·Ð¸Ð²Ð½Ð¸Ð¹ (Ñ…Ñ‚Ð¾/Ñ‰Ð¾).\n\n14. \"Ð¡Ñ‚Ð°Ñ‚Ñ‚ÑŽ Ð±ÑƒÐ´Ðµ Ð¾Ð¿ÑƒÐ±Ð»Ñ–ÐºÐ¾Ð²Ð°Ð½Ð¾\" â€” ÑÑ‚Ð°Ñ‚Ñ‚Ñ Ð²:\n    - [x] Ð·Ð½Ð°Ñ…Ñ–Ð´Ð½Ð¾Ð¼Ñƒ Ð²Ñ–Ð´Ð¼Ñ–Ð½ÐºÑƒ\n    - [ ] Ð½Ð°Ð·Ð¸Ð²Ð½Ð¾Ð¼Ñƒ Ð²Ñ–Ð´Ð¼Ñ–Ð½ÐºÑƒ\n    - [ ] Ð¾Ñ€ÑƒÐ´Ð½Ð¾Ð¼Ñƒ Ð²Ñ–Ð´Ð¼Ñ–Ð½ÐºÑƒ\n    - [ ] Ð´Ð°Ð²Ð°Ð»ÑŒÐ½Ð¾Ð¼Ñƒ Ð²Ñ–Ð´Ð¼Ñ–Ð½ÐºÑƒ\n    > Ð¡Ñ‚Ð°Ñ‚Ñ‚Ð® â€” Ð·Ð½Ð°Ñ…Ñ–Ð´Ð½Ð¸Ð¹ (Ñ‰Ð¾?).\n\n15. Ð¯ÐºÐ° Ñ„Ð¾Ñ€Ð¼Ð° Ð²Ð¶Ð¸Ð²Ð°Ñ”Ñ‚ÑŒÑÑ Ð· Ð´Ð°Ð²Ð°Ð»ÑŒÐ½Ð¸Ð¼ Ð¾Ñ‚Ñ€Ð¸Ð¼ÑƒÐ²Ð°Ñ‡Ð°?\n    - [ ] Ð”Ñ–Ñ”Ð¿Ñ€Ð¸ÐºÐ¼ÐµÑ‚Ð½Ð¸ÐºÐ¾Ð²Ð°\n    - [ ] Ð‘ÐµÐ·Ð¾ÑÐ¾Ð±Ð¾Ð²Ð°\n    - [ ] Ð—Ð²Ð¾Ñ€Ð¾Ñ‚Ð½Ð°\n    - [x] Ð¢Ñ€ÐµÑ‚Ñ Ð¾ÑÐ¾Ð±Ð° Ð¼Ð½Ð¾Ð¶Ð¸Ð½Ð¸\n    > Ð™Ð¾Ð¼Ñƒ ÑÐºÐ°Ð·Ð°Ð»Ð¸, Ð¼ÐµÐ½Ñ– Ð´Ð°Ð»Ð¸.\n\n16. \"Ð‘ÑƒÐ´Ð¸Ð½Ð¾Ðº Ð¿Ð¾Ð±ÑƒÐ´Ð¾Ð²Ð°Ð½Ð¸Ð¹ Ñ€Ð¾Ð±Ñ–Ñ‚Ð½Ð¸ÐºÐ°Ð¼Ð¸\" â€” Ð´Ð²Ð° Ð²Ñ–Ð´Ð¼Ñ–Ð½ÐºÐ¸:\n    - [x] Ð½Ð°Ð·Ð¸Ð²Ð½Ð¸Ð¹ + Ð¾Ñ€ÑƒÐ´Ð½Ð¸Ð¹\n    - [ ] Ð·Ð½Ð°Ñ…Ñ–Ð´Ð½Ð¸Ð¹ + Ð¾Ñ€ÑƒÐ´Ð½Ð¸Ð¹\n    - [ ] Ð½Ð°Ð·Ð¸Ð²Ð½Ð¸Ð¹ + Ð´Ð°Ð²Ð°Ð»ÑŒÐ½Ð¸Ð¹\n    - [ ] Ð·Ð½Ð°Ñ…Ñ–Ð´Ð½Ð¸Ð¹ + Ð´Ð°Ð²Ð°Ð»ÑŒÐ½Ð¸Ð¹\n    > Ð‘ÑƒÐ´Ð¸Ð½Ð¾ÐºÃ˜ (Ð½Ð°Ð·Ð¸Ð².) + Ñ€Ð¾Ð±Ñ–Ñ‚Ð½Ð¸ÐºÐÐœÐ˜ (Ð¾Ñ€ÑƒÐ´.).\n\n## fill-in: Ð¢Ñ€Ð°Ð½ÑÑ„Ð¾Ñ€Ð¼Ð°Ñ†Ñ–Ñ Ð¿Ð°ÑÐ¸Ð²Ñƒ\n> ÐŸÐµÑ€ÐµÑ‚Ð²Ð¾Ñ€Ñ–Ñ‚ÑŒ Ð°ÐºÑ‚Ð¸Ð²Ð½Ñ– Ñ€ÐµÑ‡ÐµÐ½Ð½Ñ Ð½Ð° Ð¿Ð°ÑÐ¸Ð²Ð½Ñ–.\n\n1. Ð”Ð¸Ñ€ÐµÐºÑ‚Ð¾Ñ€ Ð¿Ñ–Ð´Ð¿Ð¸ÑÐ°Ð² Ð´Ð¾ÐºÑƒÐ¼ÐµÐ½Ñ‚. â†’ Ð”Ð¾ÐºÑƒÐ¼ÐµÐ½Ñ‚ ___ Ð´Ð¸Ñ€ÐµÐºÑ‚Ð¾Ñ€Ð¾Ð¼.\n   > [!answer] Ð¿Ñ–Ð´Ð¿Ð¸ÑÐ°Ð½Ð¸Ð¹\n   > [!options] Ð¿Ñ–Ð´Ð¿Ð¸ÑÐ°Ð½Ð¸Ð¹ | Ð¿Ñ–Ð´Ð¿Ð¸ÑÐ°Ð½Ð¾ | Ð¿Ñ–Ð´Ð¿Ð¸ÑÑƒÑ”Ñ‚ÑŒÑÑ | Ð¿Ñ–Ð´Ð¿Ð¸ÑÐ°Ð»Ð¸\n\n2. Ð¡Ñ‚ÑƒÐ´ÐµÐ½Ñ‚Ð¸ Ð²Ð¸ÐºÐ¾Ð½Ð°Ð»Ð¸ Ð·Ð°Ð²Ð´Ð°Ð½Ð½Ñ. â†’ Ð—Ð°Ð²Ð´Ð°Ð½Ð½Ñ ___.\n   > [!answer] Ð²Ð¸ÐºÐ¾Ð½Ð°Ð½Ð¾\n   > [!options] Ð²Ð¸ÐºÐ¾Ð½Ð°Ð½Ð¾ | Ð²Ð¸ÐºÐ¾Ð½Ð°Ð½Ñ– | Ð²Ð¸ÐºÐ¾Ð½ÑƒÑŽÑ‚ÑŒÑÑ | Ð²Ð¸ÐºÐ¾Ð½Ð°Ð»Ð¸\n\n3. ÐÐ°ÑƒÐºÐ¾Ð²Ñ†Ñ– Ð´Ð¾ÑÐ»Ñ–Ð´Ð¶ÑƒÑŽÑ‚ÑŒ Ð¿Ñ€Ð¾Ð±Ð»ÐµÐ¼Ñƒ. â†’ ÐŸÑ€Ð¾Ð±Ð»ÐµÐ¼Ð° ___ Ð½Ð°ÑƒÐºÐ¾Ð²Ñ†ÑÐ¼Ð¸.\n   > [!answer] Ð´Ð¾ÑÐ»Ñ–Ð´Ð¶ÑƒÑ”Ñ‚ÑŒÑÑ\n   > [!options] Ð´Ð¾ÑÐ»Ñ–Ð´Ð¶ÑƒÑ”Ñ‚ÑŒÑÑ | Ð´Ð¾ÑÐ»Ñ–Ð´Ð¶ÐµÐ½Ð¾ | Ð´Ð¾ÑÐ»Ñ–Ð´Ð¶ÐµÐ½Ð° | Ð´Ð¾ÑÐ»Ñ–Ð´Ð¸Ð»Ð¸\n\n4. Ð¥Ñ‚Ð¾ÑÑŒ Ð¿Ð¾Ð²Ñ–Ð´Ð¾Ð¼Ð¸Ð² Ð¼ÐµÐ½Ðµ Ð¿Ñ€Ð¾ Ð·Ð±Ð¾Ñ€Ð¸. â†’ ___ Ð¿Ð¾Ð²Ñ–Ð´Ð¾Ð¼Ð¸Ð»Ð¸ Ð¿Ñ€Ð¾ Ð·Ð±Ð¾Ñ€Ð¸.\n   > [!answer] ÐœÐµÐ½Ðµ\n   > [!options] ÐœÐµÐ½Ðµ | ÐœÐµÐ½Ñ– | ÐœÐ½Ð¾ÑŽ | Ð¯\n\n5. ÐÐ²Ñ‚Ð¾Ñ€ Ð½Ð°Ð¿Ð¸ÑÐ°Ð² Ñ€Ð¾Ð¼Ð°Ð½. â†’ Ð Ð¾Ð¼Ð°Ð½ ___ Ð°Ð²Ñ‚Ð¾Ñ€Ð¾Ð¼.\n   > [!answer] Ð½Ð°Ð¿Ð¸ÑÐ°Ð½Ð¸Ð¹\n   > [!options] Ð½Ð°Ð¿Ð¸ÑÐ°Ð½Ð¸Ð¹ | Ð½Ð°Ð¿Ð¸ÑÐ°Ð½Ð¾ | Ð¿Ð¸ÑˆÐµÑ‚ÑŒÑÑ | Ð½Ð°Ð¿Ð¸ÑÐ°Ð»Ð¸\n\n6. ÐšÐ¾Ð¼Ñ–ÑÑ–Ñ Ð¿Ñ€Ð¸Ð¹Ð½ÑÐ»Ð° Ñ€Ñ–ÑˆÐµÐ½Ð½Ñ. â†’ Ð Ñ–ÑˆÐµÐ½Ð½Ñ ___.\n   > [!answer] Ð¿Ñ€Ð¸Ð¹Ð½ÑÑ‚Ð¾\n   > [!options] Ð¿Ñ€Ð¸Ð¹Ð½ÑÑ‚Ð¾ | Ð¿Ñ€Ð¸Ð¹Ð½ÑÑ‚Ðµ | Ð¿Ñ€Ð¸Ð¹Ð¼Ð°Ñ”Ñ‚ÑŒÑÑ | Ð¿Ñ€Ð¸Ð¹Ð½ÑÐ»Ð¸\n\n7. Ð’Ñ‡ÐµÐ½Ñ– Ð²Ð¸Ð²Ñ‡Ð°ÑŽÑ‚ÑŒ ÑÐ²Ð¸Ñ‰Ðµ. â†’ Ð¯Ð²Ð¸Ñ‰Ðµ ___ Ð²Ñ‡ÐµÐ½Ð¸Ð¼Ð¸.\n   > [!answer] Ð²Ð¸Ð²Ñ‡Ð°Ñ”Ñ‚ÑŒÑÑ\n   > [!options] Ð²Ð¸Ð²Ñ‡Ð°Ñ”Ñ‚ÑŒÑÑ | Ð²Ð¸Ð²Ñ‡ÐµÐ½Ð¾ | Ð²Ð¸Ð²Ñ‡ÐµÐ½Ðµ | Ð²Ð¸Ð²Ñ‡Ð°Ð»Ð¸\n\n8. Ð¥Ñ‚Ð¾ÑÑŒ Ð¿Ð¾Ð¾Ð±Ñ–Ñ†ÑÐ² Ð¹Ð¾Ð¼Ñƒ Ð¿Ñ–Ð´Ð²Ð¸Ñ‰ÐµÐ½Ð½Ñ. â†’ ___ Ð¿Ð¾Ð¾Ð±Ñ–Ñ†ÑÐ»Ð¸ Ð¿Ñ–Ð´Ð²Ð¸Ñ‰ÐµÐ½Ð½Ñ.\n   > [!answer] Ð™Ð¾Ð¼Ñƒ\n   > [!options] Ð™Ð¾Ð¼Ñƒ | Ð™Ð¾Ð³Ð¾ | ÐÐ¸Ð¼ | Ð’Ñ–Ð½\n\n9. Ð‘ÑƒÐ´Ñ–Ð²ÐµÐ»ÑŒÐ½Ð¸ÐºÐ¸ Ð·Ð±ÑƒÐ´ÑƒÐ²Ð°Ð»Ð¸ Ð¼Ñ–ÑÑ‚. â†’ ÐœÑ–ÑÑ‚ ___ Ñƒ Ð¼Ð¸Ð½ÑƒÐ»Ð¾Ð¼Ñƒ Ñ€Ð¾Ñ†Ñ–.\n   > [!answer] Ð·Ð±ÑƒÐ´Ð¾Ð²Ð°Ð½Ð¸Ð¹\n   > [!options] Ð·Ð±ÑƒÐ´Ð¾Ð²Ð°Ð½Ð¸Ð¹ | Ð·Ð±ÑƒÐ´Ð¾Ð²Ð°Ð½Ð¾ | Ð±ÑƒÐ´ÑƒÑ”Ñ‚ÑŒÑÑ | Ð·Ð±ÑƒÐ´ÑƒÐ²Ð°Ð»Ð¸\n\n10. Ð’Ð¸Ð´Ð°Ð²Ð½Ð¸Ñ†Ñ‚Ð²Ð¾ Ð¾Ð¿ÑƒÐ±Ð»Ñ–ÐºÑƒÐ²Ð°Ð»Ð¾ ÐºÐ½Ð¸Ð³Ñƒ. â†’ ÐšÐ½Ð¸Ð³Ñƒ ___.\n    > [!answer] Ð¾Ð¿ÑƒÐ±Ð»Ñ–ÐºÐ¾Ð²Ð°Ð½Ð¾\n    > [!options] Ð¾Ð¿ÑƒÐ±Ð»Ñ–ÐºÐ¾Ð²Ð°Ð½Ð¾ | Ð¾Ð¿ÑƒÐ±Ð»Ñ–ÐºÐ¾Ð²Ð°Ð½Ð° | Ð¿ÑƒÐ±Ð»Ñ–ÐºÑƒÑ”Ñ‚ÑŒÑÑ | Ð¾Ð¿ÑƒÐ±Ð»Ñ–ÐºÑƒÐ²Ð°Ð»Ð¸\n\n11. Ð¥Ñ‚Ð¾ÑÑŒ Ð·Ð°Ð¿Ñ€Ð¾ÑÐ¸Ð² Ð½Ð°Ñ Ð½Ð° Ð²ÐµÑ‡Ñ–Ñ€ÐºÑƒ. â†’ ___ Ð·Ð°Ð¿Ñ€Ð¾ÑÐ¸Ð»Ð¸ Ð½Ð° Ð²ÐµÑ‡Ñ–Ñ€ÐºÑƒ.\n    > [!answer] ÐÐ°Ñ\n    > [!options] ÐÐ°Ñ | ÐÐ°Ð¼ | ÐÐ°Ð¼Ð¸ | ÐœÐ¸\n\n12. ÐŸÑ€Ð°Ñ†Ñ–Ð²Ð½Ð¸ÐºÐ¸ Ð²Ð¸ÐºÐ¾Ð½ÑƒÑŽÑ‚ÑŒ Ð·Ð°Ð²Ð´Ð°Ð½Ð½Ñ. â†’ Ð—Ð°Ð²Ð´Ð°Ð½Ð½Ñ ___ Ð¿Ñ€Ð°Ñ†Ñ–Ð²Ð½Ð¸ÐºÐ°Ð¼Ð¸.\n    > [!answer] Ð²Ð¸ÐºÐ¾Ð½ÑƒÑŽÑ‚ÑŒÑÑ\n    > [!options] Ð²Ð¸ÐºÐ¾Ð½ÑƒÑŽÑ‚ÑŒÑÑ | Ð²Ð¸ÐºÐ¾Ð½Ð°Ð½Ð¾ | Ð²Ð¸ÐºÐ¾Ð½Ð°Ð½Ñ– | Ð²Ð¸ÐºÐ¾Ð½Ð°Ð»Ð¸\n\n13. Ð ÐµÐ¶Ð¸ÑÐµÑ€ Ð·Ð½ÑÐ² Ñ„Ñ–Ð»ÑŒÐ¼. â†’ Ð¤Ñ–Ð»ÑŒÐ¼ ___ Ñ€ÐµÐ¶Ð¸ÑÐµÑ€Ð¾Ð¼.\n    > [!answer] Ð·Ð½ÑÑ‚Ð¸Ð¹\n    > [!options] Ð·Ð½ÑÑ‚Ð¸Ð¹ | Ð·Ð½ÑÑ‚Ð¾ | Ð·Ð½Ñ–Ð¼Ð°Ñ”Ñ‚ÑŒÑÑ | Ð·Ð½ÑÐ»Ð¸\n\n14. ÐŸÐ°Ñ€Ð»Ð°Ð¼ÐµÐ½Ñ‚ ÑƒÑ…Ð²Ð°Ð»Ð¸Ð² Ð·Ð°ÐºÐ¾Ð½. â†’ Ð—Ð°ÐºÐ¾Ð½ ___.\n    > [!answer] ÑƒÑ…Ð²Ð°Ð»ÐµÐ½Ð¾\n    > [!options] ÑƒÑ…Ð²Ð°Ð»ÐµÐ½Ð¾ | ÑƒÑ…Ð²Ð°Ð»ÐµÐ½Ð¸Ð¹ | ÑƒÑ…Ð²Ð°Ð»ÑŽÑ”Ñ‚ÑŒÑÑ | ÑƒÑ…Ð²Ð°Ð»Ð¸Ð»Ð¸\n\n15. Ð¥Ñ‚Ð¾ÑÑŒ ÑÐºÐ°Ð·Ð°Ð² Ñ—Ð¹ Ð¿Ñ€Ð°Ð²Ð´Ñƒ. â†’ ___ ÑÐºÐ°Ð·Ð°Ð»Ð¸ Ð¿Ñ€Ð°Ð²Ð´Ñƒ.\n    > [!answer] Ð‡Ð¹\n    > [!options] Ð‡Ð¹ | Ð‡Ñ— | ÐÐµÑŽ | Ð’Ð¾Ð½Ð°\n\n16. ÐÑ€Ñ…Ñ–Ñ‚ÐµÐºÑ‚Ð¾Ñ€ ÑÐ¿Ñ€Ð¾ÐµÐºÑ‚ÑƒÐ²Ð°Ð² Ð±ÑƒÐ´Ð¸Ð½Ð¾Ðº. â†’ Ð‘ÑƒÐ´Ð¸Ð½Ð¾Ðº ___ Ð°Ñ€Ñ…Ñ–Ñ‚ÐµÐºÑ‚Ð¾Ñ€Ð¾Ð¼.\n    > [!answer] ÑÐ¿Ñ€Ð¾ÐµÐºÑ‚Ð¾Ð²Ð°Ð½Ð¸Ð¹\n    > [!options] ÑÐ¿Ñ€Ð¾ÐµÐºÑ‚Ð¾Ð²Ð°Ð½Ð¸Ð¹ | ÑÐ¿Ñ€Ð¾ÐµÐºÑ‚Ð¾Ð²Ð°Ð½Ð¾ | Ð¿Ñ€Ð¾ÐµÐºÑ‚ÑƒÑ”Ñ‚ÑŒÑÑ | ÑÐ¿Ñ€Ð¾ÐµÐºÑ‚ÑƒÐ²Ð°Ð»Ð¸\n\n---"
      },
      {
        "id": "section-4",
        "name": "Ð¡Ð»Ð¾Ð²Ð½Ð¸Ðº",
        "nameEn": null,
        "type": "vocabulary",
        "content": "| Ð¡Ð»Ð¾Ð²Ð¾ | ÐŸÐµÑ€ÐµÐºÐ»Ð°Ð´ | ÐŸÑ€Ð¸Ð¼Ñ–Ñ‚ÐºÐ¸ |\n|-------|----------|----------|\n| Ð¿Ð°ÑÐ¸Ð²Ð½Ð¸Ð¹ ÑÑ‚Ð°Ð½ | passive voice | grammatical term |\n| Ð°ÐºÑ‚Ð¸Ð²Ð½Ð¸Ð¹ ÑÑ‚Ð°Ð½ | active voice | opposite of passive |\n| Ð´Ñ–Ð¹ÑÐ½Ð¸Ð¹ | active (voice) | synonym of \"Ð°ÐºÑ‚Ð¸Ð²Ð½Ð¸Ð¹\" |\n| Ð´Ñ–Ñ”Ð¿Ñ€Ð¸ÐºÐ¼ÐµÑ‚Ð½Ð¸Ðº | participle | verbal adjective form |\n| Ñ„Ð¾Ñ€Ð¼Ð° | form | grammatical form |\n| ÐºÐ¾Ð½ÑÑ‚Ñ€ÑƒÐºÑ†Ñ–Ñ | construction | syntactic structure |\n| Ð°Ð³ÐµÐ½Ñ‚ | agent | performer of action |\n| Ð²Ð¸ÐºÐ¾Ð½Ð°Ð²ÐµÑ†ÑŒ | performer | the one who performs |\n| Ð´Ñ–Ñ | action | what happens |\n| Ð¾Ð±'Ñ”ÐºÑ‚ | object | recipient of action |\n| ÑÑƒÐ±'Ñ”ÐºÑ‚ | subject | performer of action |\n| Ñ‚Ñ€Ð°Ð½ÑÑ„Ð¾Ñ€Ð¼Ð°Ñ†Ñ–Ñ | transformation | conversion |\n| ÐµÐºÐ²Ñ–Ð²Ð°Ð»ÐµÐ½Ñ‚ | equivalent | corresponding form |\n| Ñ„ÑƒÐ½ÐºÑ†Ñ–Ñ | function | purpose |\n| ÑÑ‚Ð¸Ð»ÑŒ | style | manner of expression |\n| Ñ€ÐµÑ”ÑÑ‚Ñ€ | register | formality level |\n| Ð¾Ñ„Ñ–Ñ†Ñ–Ð¹Ð½Ð¸Ð¹ | official | formal |\n| Ñ€Ð¾Ð·Ð¼Ð¾Ð²Ð½Ð¸Ð¹ | colloquial | informal |\n| Ð½Ð°ÑƒÐºÐ¾Ð²Ð¸Ð¹ | scientific | academic |\n| Ñ…ÑƒÐ´Ð¾Ð¶Ð½Ñ–Ð¹ | literary | artistic |\n| ÐºÐ½Ð¸Ð¶Ð½Ð¸Ð¹ | bookish | literary |\n| ÑƒÑÐ½Ð¸Ð¹ | oral | spoken |\n| Ð¿Ð¸ÑÑŒÐ¼Ð¾Ð²Ð¸Ð¹ | written | written form |\n| Ð½ÐµÐ¹Ñ‚Ñ€Ð°Ð»ÑŒÐ½Ð¸Ð¹ | neutral | without stylistic coloring |\n| ÑƒÐ·Ð³Ð¾Ð´Ð¶ÐµÐ½Ð½Ñ | agreement | grammatical agreement |"
      }
    ],
    "rawMarkdown": "---\nmodule: b2-01\ntitle: \"ÐŸÐ°ÑÐ¸Ð²Ð½Ð¸Ð¹ ÑÑ‚Ð°Ð½: ÐŸÐ¾Ð²Ð½Ð° ÑÐ¸ÑÑ‚ÐµÐ¼Ð°\"\nsubtitle: \"Mastering All 4 Ukrainian Passive Forms\"\nversion: \"1.0\"\nphase: \"B2\"\npedagogy: \"TTT\"\nduration: 90\ntransliteration: none\ntags: [\"grammar\", \"passive\", \"register\", \"voice\"]\ngrammar: [\"passive-participle\", \"impersonal-passive\", \"reflexive-passive\", \"3pl-passive\"]\nobjectives:\n  - \"Learner can identify all 4 Ukrainian passive constructions\"\n  - \"Learner can choose the appropriate passive form for different registers\"\n  - \"Learner can transform active sentences into passive using all 4 methods\"\nvocabulary_count: 25\n---\n\n# Ð’ÑÑ‚ÑƒÐ¿\n\nYou've mastered how Ukrainian expresses action â€” who does what. But what happens when the performer is unknown, unimportant, or when the focus shifts to the result? This is where **passive voice** enters â€” one of the most elegant systems in Ukrainian grammar.\n\n> ðŸ’¡ **Did You Know**\n>\n> Ukrainian has not one, not two, but FOUR distinct passive constructions â€” more than English, German, or French. Each form signals a different register and emphasis. Mastering them is the key to sounding truly fluent.\n\nUnlike English, where passive is formed one way (\"was written\"), Ukrainian has an entire system where each form carries additional meaning about context, style, and emphasis. Understanding when to use each form separates textbook Ukrainian from native-like fluency.\n\nThe passive voice serves multiple communicative functions across all languages. First, it shifts focus from the performer to the recipient of the action. Second, it allows speakers to hide or de-emphasize the agent when desired. Third, it creates stylistic variety in written and spoken discourse. Ukrainian takes these functions further by encoding register information directly into the passive form itself â€” a feature that makes mastering this system essential for advanced proficiency.\n\n---\n\n## Ð”Ñ–Ð°Ð³Ð½Ð¾ÑÑ‚Ð¸ÐºÐ°\n\nRead these four sentences. They all mean approximately the same thing â€” \"The book was written.\" But why do Ukrainians use different constructions?\n\n> [!observe]\n>\n> 1. **ÐšÐ½Ð¸Ð³Ð° Ð½Ð°Ð¿Ð¸ÑÐ°Ð½Ð° Ð°Ð²Ñ‚Ð¾Ñ€Ð¾Ð¼.** (literary style)\n> 2. **ÐšÐ½Ð¸Ð³Ñƒ Ð½Ð°Ð¿Ð¸ÑÐ°Ð½Ð¾.** (official document)\n> 3. **ÐšÐ½Ð¸Ð³Ð° Ð¿Ð¸ÑˆÐµÑ‚ÑŒÑÑ ÑˆÐ²Ð¸Ð´ÐºÐ¾.** (process)\n> 4. **ÐšÐ½Ð¸Ð³Ñƒ Ð½Ð°Ð¿Ð¸ÑÐ°Ð»Ð¸.** (colloquial speech)\n>\n> Notice: different endings, different word order, different cases. This isn't random â€” it's a system.\n\nBefore we explain the rules, try to identify patterns. What differences do you notice in verb forms? In word order? In the case of \"ÐºÐ½Ð¸Ð³Ð°/ÐºÐ½Ð¸Ð³Ñƒ\"?\n\n---\n\n## ÐÐ½Ð°Ð»Ñ–Ð·\n\n### The Four Passive Forms: Overview\n\nUkrainian has four ways to express passive meaning. Each has its place in communication:\n\n| Form | Construction | Example | Register |\n|------|-------------|---------|----------|\n| Participial | noun + -Ð½Ð¸Ð¹/-Ñ‚Ð¸Ð¹ | ÐšÐ½Ð¸Ð³Ð° **Ð½Ð°Ð¿Ð¸ÑÐ°Ð½Ð°** | Literary, formal |\n| Impersonal | accusative + -Ð½Ð¾/-Ñ‚Ð¾ | ÐšÐ½Ð¸Ð³Ñƒ **Ð½Ð°Ð¿Ð¸ÑÐ°Ð½Ð¾** | Official/bureaucratic |\n| Reflexive | verb + -ÑÑ | ÐšÐ½Ð¸Ð³Ð° **Ð¿Ð¸ÑˆÐµÑ‚ÑŒÑÑ** | Scientific, process |\n| 3rd person plural | 3rd pl. without subject | ÐšÐ½Ð¸Ð³Ñƒ **Ð½Ð°Ð¿Ð¸ÑÐ°Ð»Ð¸** | Colloquial |\n\n> ðŸŽ­ **Cultural Insight**\n>\n> The choice of passive form is a signal. When an official says \"Ð Ñ–ÑˆÐµÐ½Ð½Ñ Ð¿Ñ€Ð¸Ð¹Ð½ÑÑ‚Ð¾\" instead of \"ÐœÐ¸ Ð¿Ñ€Ð¸Ð¹Ð½ÑÐ»Ð¸ Ñ€Ñ–ÑˆÐµÐ½Ð½Ñ,\" they consciously distance themselves from responsibility. Language doesn't just describe reality â€” it constructs it.\n\n> ðŸ”— **Language Link**\n>\n> English uses passive primarily for focus shift (\"The book was written by X\"). Ukrainian uses passive for BOTH focus AND register signaling. Choosing -Ð½Ð¾/-Ñ‚Ð¾ instantly marks your text as official, while 3rd person plural marks it as colloquial.\n\n---\n\n### 1. Participial Form (-Ð½Ð¸Ð¹/-Ñ‚Ð¸Ð¹)\n\nThis form is closest to English passive. It's formed from the past passive participle.\n\n**Formation:**\nThe participle is formed from the infinitive stem + **-Ð½Ð¸Ð¹** or **-Ñ‚Ð¸Ð¹**:\n- Ð½Ð°Ð¿Ð¸ÑÐ°-Ñ‚Ð¸ â†’ Ð½Ð°Ð¿Ð¸Ñ**Ð°Ð½Ð¸Ð¹** (written)\n- Ð·Ñ€Ð¾Ð±Ð¸-Ñ‚Ð¸ â†’ Ð·Ñ€Ð¾Ð±Ð»**ÐµÐ½Ð¸Ð¹** (made/done)\n- Ð·Ð°ÐºÑ€Ð¸-Ñ‚Ð¸ â†’ Ð·Ð°ÐºÑ€Ð¸**Ñ‚Ð¸Ð¹** (closed)\n- Ð²Ñ–Ð´ÐºÑ€Ð¸-Ñ‚Ð¸ â†’ Ð²Ñ–Ð´ÐºÑ€Ð¸**Ñ‚Ð¸Ð¹** (opened)\n\n**Key grammatical point:** The participle agrees with the noun in gender, number, and case, just like an adjective:\n\n| Gender | Example | Translation |\n|--------|---------|-------------|\n| Masculine | Ð›Ð¸ÑÑ‚ **Ð½Ð°Ð¿Ð¸ÑÐ°Ð½Ð¸Ð¹** | The letter is written |\n| Feminine | ÐšÐ½Ð¸Ð³Ð° **Ð½Ð°Ð¿Ð¸ÑÐ°Ð½Ð°** | The book is written |\n| Neuter | Ð¡Ð»Ð¾Ð²Ð¾ **Ð½Ð°Ð¿Ð¸ÑÐ°Ð½Ðµ** | The word is written |\n| Plural | Ð›Ð¸ÑÑ‚Ð¸ **Ð½Ð°Ð¿Ð¸ÑÐ°Ð½Ñ–** | The letters are written |\n\n**Tense formation with \"Ð±ÑƒÑ‚Ð¸\":**\nUnlike the impersonal form, participial passive can express all tenses:\n- Past: ÐšÐ½Ð¸Ð³Ð° **Ð±ÑƒÐ»Ð° Ð½Ð°Ð¿Ð¸ÑÐ°Ð½Ð°** Ð°Ð²Ñ‚Ð¾Ñ€Ð¾Ð¼. (The book was written by the author.)\n- Present: ÐšÐ½Ð¸Ð³Ð° **Ñ” Ð½Ð°Ð¿Ð¸ÑÐ°Ð½Ð°** (rare, bookish style)\n- Future: ÐšÐ½Ð¸Ð³Ð° **Ð±ÑƒÐ´Ðµ Ð½Ð°Ð¿Ð¸ÑÐ°Ð½Ð°** Ð·Ð°Ð²Ñ‚Ñ€Ð°. (The book will be written tomorrow.)\n\n**Agent expression:** The agent (performer) is expressed in the **instrumental case**:\n- ÐšÐ½Ð¸Ð³Ð° Ð½Ð°Ð¿Ð¸ÑÐ°Ð½Ð° **Ð°Ð²Ñ‚Ð¾Ñ€Ð¾Ð¼**. (The book was written by the author.)\n- Ð‘ÑƒÐ´Ð¸Ð½Ð¾Ðº Ð¿Ð¾Ð±ÑƒÐ´Ð¾Ð²Ð°Ð½Ð¸Ð¹ **Ð°Ñ€Ñ…Ñ–Ñ‚ÐµÐºÑ‚Ð¾Ñ€Ð¾Ð¼**. (The building was built by the architect.)\n\n> ðŸŒ **Real World**\n>\n> In news broadcasts, you'll often hear: \"Ð‘ÑƒÐ´Ð¸Ð½Ð¾Ðº **Ð¿Ð¾Ð±ÑƒÐ´Ð¾Ð²Ð°Ð½Ð¸Ð¹** Ñƒ 2010 Ñ€Ð¾Ñ†Ñ–.\" Television and press prefer this form because it sounds neutral and professional.\n\n**Common verbs that form participial passives:**\n\nThe following verbs frequently appear in literary and journalistic texts:\n\n| Infinitive | Participle | Example |\n|------------|------------|---------|\n| Ð½Ð°Ð¿Ð¸ÑÐ°Ñ‚Ð¸ | Ð½Ð°Ð¿Ð¸ÑÐ°Ð½Ð¸Ð¹ | Ð Ð¾Ð¼Ð°Ð½ Ð½Ð°Ð¿Ð¸ÑÐ°Ð½Ð¸Ð¹ |\n| Ð¿Ñ€Ð¾Ñ‡Ð¸Ñ‚Ð°Ñ‚Ð¸ | Ð¿Ñ€Ð¾Ñ‡Ð¸Ñ‚Ð°Ð½Ð¸Ð¹ | ÐšÐ½Ð¸Ð³Ð° Ð¿Ñ€Ð¾Ñ‡Ð¸Ñ‚Ð°Ð½Ð° |\n| Ð·Ñ€Ð¾Ð±Ð¸Ñ‚Ð¸ | Ð·Ñ€Ð¾Ð±Ð»ÐµÐ½Ð¸Ð¹ | Ð Ð¾Ð±Ð¾Ñ‚Ð° Ð·Ñ€Ð¾Ð±Ð»ÐµÐ½Ð° |\n| Ð¿Ð¾Ð±ÑƒÐ´ÑƒÐ²Ð°Ñ‚Ð¸ | Ð¿Ð¾Ð±ÑƒÐ´Ð¾Ð²Ð°Ð½Ð¸Ð¹ | Ð”Ñ–Ð¼ Ð¿Ð¾Ð±ÑƒÐ´Ð¾Ð²Ð°Ð½Ð¸Ð¹ |\n| Ð²Ñ–Ð´Ð¿Ñ€Ð°Ð²Ð¸Ñ‚Ð¸ | Ð²Ñ–Ð´Ð¿Ñ€Ð°Ð²Ð»ÐµÐ½Ð¸Ð¹ | Ð›Ð¸ÑÑ‚ Ð²Ñ–Ð´Ð¿Ñ€Ð°Ð²Ð»ÐµÐ½Ð¸Ð¹ |\n| Ð¾Ñ‚Ñ€Ð¸Ð¼Ð°Ñ‚Ð¸ | Ð¾Ñ‚Ñ€Ð¸Ð¼Ð°Ð½Ð¸Ð¹ | Ð’Ñ–Ð´Ð¿Ð¾Ð²Ñ–Ð´ÑŒ Ð¾Ñ‚Ñ€Ð¸Ð¼Ð°Ð½Ð° |\n\n---\n\n### 2. Impersonal Form (-Ð½Ð¾/-Ñ‚Ð¾)\n\nThis is a uniquely Ukrainian construction that doesn't exist in many languages. It signals official, bureaucratic style.\n\n**Formation:**\nFrom the participle â†’ short neuter form:\n- Ð½Ð°Ð¿Ð¸ÑÐ°Ð½Ð¸Ð¹ â†’ Ð½Ð°Ð¿Ð¸Ñ**Ð°Ð½Ð¾**\n- Ð·Ñ€Ð¾Ð±Ð»ÐµÐ½Ð¸Ð¹ â†’ Ð·Ñ€Ð¾Ð±Ð»**ÐµÐ½Ð¾**\n- Ð·Ð°ÐºÑ€Ð¸Ñ‚Ð¸Ð¹ â†’ Ð·Ð°ÐºÑ€Ð¸**Ñ‚Ð¾**\n\n**Critical grammatical features:**\n1. **Does not change** (always neuter singular form)\n2. **Object in accusative case**: **ÐšÐ½Ð¸Ð³Ñƒ** Ð½Ð°Ð¿Ð¸ÑÐ°Ð½Ð¾ (NOT ~~ÐšÐ½Ð¸Ð³Ð° Ð½Ð°Ð¿Ð¸ÑÐ°Ð½Ð¾~~)\n3. **Agent is not expressed** (impersonal by nature)\n4. **Signals official register**\n\nThis is perhaps the most important distinction from the participial form: with -Ð½Ð¾/-Ñ‚Ð¾, the logical object takes the ACCUSATIVE case, not nominative.\n\n**Typical contexts:**\n- **Ð—Ð°ÑÑ–Ð´Ð°Ð½Ð½Ñ Ð¾Ð³Ð¾Ð»Ð¾ÑˆÐµÐ½Ð¾ Ð·Ð°ÐºÑ€Ð¸Ñ‚Ð¸Ð¼.** (The meeting is declared closed.)\n- **Ð Ñ–ÑˆÐµÐ½Ð½Ñ Ð¿Ñ€Ð¸Ð¹Ð½ÑÑ‚Ð¾.** (The decision has been made.)\n- **Ð Ð¾Ð±Ð¾Ñ‚Ñƒ Ð·Ð°Ð²ÐµÑ€ÑˆÐµÐ½Ð¾.** (The work has been completed.)\n- **ÐÐ°ÐºÐ°Ð· Ð²Ð¸Ð´Ð°Ð½Ð¾.** (The order has been issued.)\n\n> ðŸ’¡ **Did You Know**\n>\n> The -Ð½Ð¾/-Ñ‚Ð¾ form is bureaucracy's favorite weapon. It hides the performer: \"Ð’Ð°Ñ Ð·Ð²Ñ–Ð»ÑŒÐ½ÐµÐ½Ð¾\" (You are fired) sounds like a natural disaster, not a decision made by a specific person. This is the grammar of power.\n\n**Historical development:**\n\nThe -Ð½Ð¾/-Ñ‚Ð¾ construction emerged from the neuter form of past passive participles. Over centuries, it developed into a distinct grammatical category â€” an impersonal passive that became the signature of official Ukrainian. Today, it remains one of the most distinctive features of the Ukrainian language, setting it apart from Russian, Polish, and other Slavic languages. Government documents, legal texts, and formal announcements almost exclusively use this form.\n\n---\n\n### 3. Reflexive Form (-ÑÑ)\n\nThis form emphasizes the **process**, not the result. It's common in scientific and technical styles.\n\n**Formation:**\nThird person verb + **-ÑÑ/-ÑÑŒ**:\n- Ð‘ÑƒÐ´Ð¸Ð½Ð¾Ðº Ð±ÑƒÐ´ÑƒÑ”**Ñ‚ÑŒÑÑ**. (The building is being built.)\n- ÐšÐ½Ð¸Ð³Ð° Ñ‡Ð¸Ñ‚Ð°Ñ”**Ñ‚ÑŒÑÑ** Ð»ÐµÐ³ÐºÐ¾. (The book reads easily.)\n\n**Key grammatical features:**\n1. **Emphasizes ongoing process**, not completed result\n2. **Agent CAN be expressed** with instrumental case\n3. **Common in scientific style** for impersonal descriptions\n\n**Examples with analysis:**\n- **Ð•ÐºÑÐ¿ÐµÑ€Ð¸Ð¼ÐµÐ½Ñ‚ Ð¿Ñ€Ð¾Ð²Ð¾Ð´Ð¸Ñ‚ÑŒÑÑ** Ð² Ð»Ð°Ð±Ð¾Ñ€Ð°Ñ‚Ð¾Ñ€Ñ–Ñ—. (The experiment is being conducted in the lab.) â€” Focus on ongoing process\n- **Ð¦Ñ Ð¿Ñ€Ð¾Ð±Ð»ÐµÐ¼Ð° Ð²Ð¸Ð²Ñ‡Ð°Ñ”Ñ‚ÑŒÑÑ** Ð½Ð°ÑƒÐºÐ¾Ð²Ñ†ÑÐ¼Ð¸. (This problem is being studied by scientists.) â€” Agent in instrumental\n- **Ð—Ð°ÐºÐ¾Ð½ Ð·Ð°ÑÑ‚Ð¾ÑÐ¾Ð²ÑƒÑ”Ñ‚ÑŒÑÑ** Ð´Ð¾ Ð²ÑÑ–Ñ… Ð³Ñ€Ð¾Ð¼Ð°Ð´ÑÐ½. (The law applies to all citizens.) â€” General ongoing state\n\n> ðŸŽ¬ **Pop Culture Moment**\n>\n> In detective films, you'll often hear: \"Ð¡Ð¿Ñ€Ð°Ð²Ð° Ñ€Ð¾Ð·ÑÐ»Ñ–Ð´ÑƒÑ”Ñ‚ÑŒÑÑ.\" (The case is being investigated.) The detective genre loves this form â€” it creates tension because the process continues, the result is unknown.\n\n---\n\n### 4. Third Person Plural (Colloquial Passive)\n\nThe simplest and most colloquial form. Uses third person plural without an expressed subject.\n\n**Formation:**\nThird person plural without \"Ð²Ð¾Ð½Ð¸\" (they):\n- **ÐœÐµÐ½Ñ– ÑÐºÐ°Ð·Ð°Ð»Ð¸.** (I was told. / They told me.)\n- **Ð™Ð¾Ð¼Ñƒ Ð´Ð°Ð»Ð¸ Ð²Ñ–Ð´Ð¿Ð¾Ð²Ñ–Ð´ÑŒ.** (He was given an answer.)\n\n**Key grammatical features:**\n1. **Most colloquial passive form**\n2. **Implies unspecified \"they\"**\n3. **Recipient often in dative case**\n\n**Examples with case analysis:**\n- Ð£ Ð¼Ð°Ð³Ð°Ð·Ð¸Ð½Ñ– **Ð¼ÐµÐ½Ðµ Ð·Ð°Ð¿Ð¸Ñ‚Ð°Ð»Ð¸** Ð¿Ñ€Ð¾ Ð·Ð½Ð¸Ð¶ÐºÑƒ. â€” Ð¼ÐµÐ½Ðµ = Ð·Ð½Ð°Ñ…Ñ–Ð´Ð½Ð¸Ð¹ Ð²Ñ–Ð´Ð¼Ñ–Ð½Ð¾Ðº\n- ÐŸÐ¾ Ñ‚ÐµÐ»ÐµÑ„Ð¾Ð½Ñƒ **Ð½Ð°Ð¼ Ð¿Ð¾Ð²Ñ–Ð´Ð¾Ð¼Ð¸Ð»Ð¸** Ð½Ð¾Ð²Ð¸Ð½Ñƒ. â€” Ð½Ð°Ð¼ = Ð´Ð°Ð²Ð°Ð»ÑŒÐ½Ð¸Ð¹ Ð²Ñ–Ð´Ð¼Ñ–Ð½Ð¾Ðº\n- **Ð™Ð¾Ð¼Ñƒ Ð¿Ð¾Ð¾Ð±Ñ–Ñ†ÑÐ»Ð¸** Ð¿Ñ–Ð´Ð²Ð¸Ñ‰ÐµÐ½Ð½Ñ. â€” Ð¹Ð¾Ð¼Ñƒ = Ð´Ð°Ð²Ð°Ð»ÑŒÐ½Ð¸Ð¹ Ð²Ñ–Ð´Ð¼Ñ–Ð½Ð¾Ðº\n\n> ðŸŒ **Real World**\n>\n> When Ukrainians tell stories about their day, they say: \"ÐœÐµÐ½Ñ– Ð·Ð°Ñ‚ÐµÐ»ÐµÑ„Ð¾Ð½ÑƒÐ²Ð°Ð»Ð¸\", \"ÐœÐµÐ½Ðµ Ð·Ð°Ð¿Ñ€Ð¾ÑÐ¸Ð»Ð¸\", \"ÐÐ°Ð¼ ÑÐºÐ°Ð·Ð°Ð»Ð¸\". This sounds natural and relaxed â€” unlike the bookish forms.\n\n---\n\n## ÐŸÐ¾Ð³Ð»Ð¸Ð±Ð»ÐµÐ½Ð½Ñ\n\n### Choosing the Right Form by Context\n\nWhich form to choose? It depends on register and emphasis:\n\n| Context | Best Form | Example | Why |\n|---------|-----------|---------|-----|\n| Legal document | -Ð½Ð¾/-Ñ‚Ð¾ | Ð Ñ–ÑˆÐµÐ½Ð½Ñ Ð¿Ñ€Ð¸Ð¹Ð½ÑÑ‚Ð¾. | Official, impersonal |\n| Scientific paper | -ÑÑ | Ð•ÐºÑÐ¿ÐµÑ€Ð¸Ð¼ÐµÐ½Ñ‚ Ð¿Ñ€Ð¾Ð²Ð¾Ð´Ð¸Ñ‚ÑŒÑÑ. | Process focus |\n| News article | -Ð½Ð¸Ð¹/-Ñ‚Ð¸Ð¹ | Ð‘ÑƒÐ´Ð¸Ð½Ð¾Ðº Ð¿Ð¾Ð±ÑƒÐ´Ð¾Ð²Ð°Ð½Ð¸Ð¹. | Neutral, professional |\n| Literary fiction | -Ð½Ð¸Ð¹/-Ñ‚Ð¸Ð¹ | Ð†ÑÑ‚Ð¾Ñ€Ñ–Ñ Ñ€Ð¾Ð·ÐºÐ°Ð·Ð°Ð½Ð°. | Elegant, literary |\n| Conversation | 3rd pl. | ÐœÐµÐ½Ñ– ÑÐºÐ°Ð·Ð°Ð»Ð¸. | Natural, relaxed |\n\n### Transformation Practice: Active â†’ Passive\n\nCompare active and passive versions:\n\n**Active sentence:**\nÐÐ²Ñ‚Ð¾Ñ€ Ð½Ð°Ð¿Ð¸ÑÐ°Ð² ÐºÐ½Ð¸Ð³Ñƒ. (The author wrote the book.)\n\n**Four passive transformations:**\n\n1. **ÐšÐ½Ð¸Ð³Ð° Ð½Ð°Ð¿Ð¸ÑÐ°Ð½Ð° Ð°Ð²Ñ‚Ð¾Ñ€Ð¾Ð¼.** (participial â€” literary)\n2. **ÐšÐ½Ð¸Ð³Ñƒ Ð½Ð°Ð¿Ð¸ÑÐ°Ð½Ð¾.** (impersonal â€” official)\n3. **ÐšÐ½Ð¸Ð³Ð° Ð¿Ð¸ÑˆÐµÑ‚ÑŒÑÑ Ð°Ð²Ñ‚Ð¾Ñ€Ð¾Ð¼.** (reflexive â€” processual, but unusual for completed action)\n4. **ÐšÐ½Ð¸Ð³Ñƒ Ð½Ð°Ð¿Ð¸ÑÐ°Ð»Ð¸.** (3rd pl. â€” colloquial)\n\nNote that option 3 sounds unusual because -ÑÑ typically implies ongoing process, not completed action. You would more naturally say \"ÐšÐ½Ð¸Ð³Ð° Ð±ÑƒÐ»Ð° Ð½Ð°Ð¿Ð¸ÑÐ°Ð½Ð°\" or use the -Ð½Ð¾ form for a completed action.\n\n---\n\n### ÐœÑ–Ð½Ñ–-Ð´Ñ–Ð°Ð»Ð¾Ð³Ð¸\n\n**Ð”Ñ–Ð°Ð»Ð¾Ð³ 1: Ð’ Ð¾Ñ„Ñ–ÑÑ–**\n\nâ€” Ð©Ð¾ Ð· Ð½Ð°ÑˆÐ¸Ð¼ Ð¿Ñ€Ð¾ÐµÐºÑ‚Ð¾Ð¼?\nâ€” **ÐŸÑ€Ð¾ÐµÐºÑ‚ Ð·Ð°Ñ‚Ð²ÐµÑ€Ð´Ð¶ÐµÐ½Ð¾** Ð¼Ð¸Ð½ÑƒÐ»Ð¾Ð³Ð¾ Ñ‚Ð¸Ð¶Ð½Ñ.\nâ€” Ð Ð±ÑŽÐ´Ð¶ÐµÑ‚?\nâ€” **Ð‘ÑŽÐ´Ð¶ÐµÑ‚ Ñ‰Ðµ Ñ€Ð¾Ð·Ð³Ð»ÑÐ´Ð°Ñ”Ñ‚ÑŒÑÑ**.\nâ€” ÐšÐ¾Ð»Ð¸ Ð±ÑƒÐ´Ðµ Ñ€Ñ–ÑˆÐµÐ½Ð½Ñ?\nâ€” **ÐÐ°Ð¼ Ð¾Ð±Ñ–Ñ†ÑÐ»Ð¸** Ð²Ñ–Ð´Ð¿Ð¾Ð²Ñ–Ð´ÑŒ Ð´Ð¾ Ð¿'ÑÑ‚Ð½Ð¸Ñ†Ñ–.\n\n**Ð”Ñ–Ð°Ð»Ð¾Ð³ 2: Ð Ð¾Ð·Ð¼Ð¾Ð²Ð° Ð´Ñ€ÑƒÐ·Ñ–Ð²**\n\nâ€” Ð§ÑƒÐ² Ð½Ð¾Ð²Ð¸Ð½Ñƒ Ð¿Ñ€Ð¾ ÐœÐ°Ñ€ÐºÐ°?\nâ€” Ð¢Ð°Ðº, **Ð¹Ð¾Ð¼Ñƒ Ð·Ð°Ð¿Ñ€Ð¾Ð¿Ð¾Ð½ÑƒÐ²Ð°Ð»Ð¸** Ñ€Ð¾Ð±Ð¾Ñ‚Ñƒ Ð² ÐÑ–Ð¼ÐµÑ‡Ñ‡Ð¸Ð½Ñ–!\nâ€” Ð¡ÐµÑ€Ð¹Ð¾Ð·Ð½Ð¾? Ð ÐºÐ²Ð°Ñ€Ñ‚Ð¸Ñ€Ð°?\nâ€” **ÐšÐ²Ð°Ñ€Ñ‚Ð¸Ñ€Ñƒ Ð²Ð¶Ðµ Ð¿Ñ€Ð¾Ð´Ð°Ð½Ð¾**.\nâ€” Ð¨Ð²Ð¸Ð´ÐºÐ¾ Ð²Ñ–Ð½ ÑƒÑÐµ Ð²Ð¸Ñ€Ñ–ÑˆÐ¸Ð².\n\n**Ð”Ñ–Ð°Ð»Ð¾Ð³ 3: ÐÐ°ÑƒÐºÐ¾Ð²Ð¸Ð¹ ÑÐµÐ¼Ñ–Ð½Ð°Ñ€**\n\nâ€” Ð¯Ðº Ð¿Ñ€Ð¾ÑÑƒÐ²Ð°Ñ”Ñ‚ÑŒÑÑ Ð²Ð°ÑˆÐµ Ð´Ð¾ÑÐ»Ñ–Ð´Ð¶ÐµÐ½Ð½Ñ?\nâ€” **Ð”Ð°Ð½Ñ– Ð·Ð±Ð¸Ñ€Ð°ÑŽÑ‚ÑŒÑÑ** Ð²Ð¶Ðµ Ñ‚Ñ€Ð¸ Ð¼Ñ–ÑÑÑ†Ñ–.\nâ€” Ð Ð°Ð½Ð°Ð»Ñ–Ð·?\nâ€” **ÐŸÐµÑ€ÑˆÑ– Ñ€ÐµÐ·ÑƒÐ»ÑŒÑ‚Ð°Ñ‚Ð¸ Ð¾Ñ‚Ñ€Ð¸Ð¼Ð°Ð½Ð¾** Ð¼Ð¸Ð½ÑƒÐ»Ð¾Ð³Ð¾ Ñ‚Ð¸Ð¶Ð½Ñ.\nâ€” ÐšÐ¾Ð»Ð¸ **Ð±ÑƒÐ´Ðµ Ð¾Ð¿ÑƒÐ±Ð»Ñ–ÐºÐ¾Ð²Ð°Ð½Ð¾** ÑÑ‚Ð°Ñ‚Ñ‚ÑŽ?\nâ€” Ð¡Ð¿Ð¾Ð´Ñ–Ð²Ð°ÑŽÑÑŒ, Ð´Ð¾ ÐºÑ–Ð½Ñ†Ñ Ñ€Ð¾ÐºÑƒ.\n\n**Ð”Ñ–Ð°Ð»Ð¾Ð³ 4: ÐÐ¾Ð²Ð¸Ð½Ð¸**\n\nâ€” Ð©Ð¾ ÑÑ‚Ð°Ð»Ð¾ÑÑ Ð² Ð¿Ð°Ñ€Ð»Ð°Ð¼ÐµÐ½Ñ‚Ñ–?\nâ€” **Ð—Ð°ÐºÐ¾Ð½ Ð¿Ñ€Ð¸Ð¹Ð½ÑÑ‚Ð¾** 226 Ð³Ð¾Ð»Ð¾ÑÐ°Ð¼Ð¸.\nâ€” Ð Ð¿Ñ€ÐµÐ·Ð¸Ð´ÐµÐ½Ñ‚?\nâ€” **Ð—Ð°ÐºÐ¾Ð½ Ñ‰Ðµ Ð½Ðµ Ð¿Ñ–Ð´Ð¿Ð¸ÑÐ°Ð½Ð¾**.\nâ€” ÐšÐ¾Ð»Ð¸ **Ð±ÑƒÐ´Ðµ Ð¿Ñ–Ð´Ð¿Ð¸ÑÐ°Ð½Ð¾**?\nâ€” **ÐžÑ‡Ñ–ÐºÑƒÑ”Ñ‚ÑŒÑÑ**, Ñ‰Ð¾ Ð½Ð° Ð½Ð°ÑÑ‚ÑƒÐ¿Ð½Ð¾Ð¼Ñƒ Ñ‚Ð¸Ð¶Ð½Ñ–.\n\n---\n\n## ÐŸÑ€Ð°ÐºÑ‚Ð¸ÐºÐ°\n\n### Ð’Ð¿Ñ€Ð°Ð²Ð° 1: Ð’Ð¸Ð·Ð½Ð°Ñ‡ÐµÐ½Ð½Ñ Ñ„Ð¾Ñ€Ð¼Ð¸\n\nIdentify which passive form is used in each sentence:\n\n1. Ð Ñ–ÑˆÐµÐ½Ð½Ñ Ð¿Ñ€Ð¸Ð¹Ð½ÑÑ‚Ð¾ Ð¾Ð´Ð½Ð¾Ð³Ð¾Ð»Ð¾ÑÐ½Ð¾.\n2. Ð¦ÐµÐ¹ Ð¼ÐµÑ‚Ð¾Ð´ Ð²Ð¸ÐºÐ¾Ñ€Ð¸ÑÑ‚Ð¾Ð²ÑƒÑ”Ñ‚ÑŒÑÑ Ð² Ð¼ÐµÐ´Ð¸Ñ†Ð¸Ð½Ñ–.\n3. ÐœÐµÐ½Ñ– Ð¿Ð¾Ñ€Ð°Ð´Ð¸Ð»Ð¸ Ð·Ð²ÐµÑ€Ð½ÑƒÑ‚Ð¸ÑÑ Ð´Ð¾ Ð»Ñ–ÐºÐ°Ñ€Ñ.\n4. Ð›Ð¸ÑÑ‚ Ð±ÑƒÐ² Ð½Ð°Ð¿Ð¸ÑÐ°Ð½Ð¸Ð¹ ÑƒÑ‡Ð¾Ñ€Ð°.\n\n**Answers:**\n1. Impersonal (-Ð½Ð¾)\n2. Reflexive (-ÑÑ)\n3. Third person plural\n4. Participial (-Ð½Ð¸Ð¹)\n\n### Ð’Ð¿Ñ€Ð°Ð²Ð° 2: Ð¢Ñ€Ð°Ð½ÑÑ„Ð¾Ñ€Ð¼Ð°Ñ†Ñ–Ñ\n\nTransform active sentences to passive using the indicated form:\n\n1. Ð¡Ñ‚ÑƒÐ´ÐµÐ½Ñ‚Ð¸ Ð½Ð°Ð¿Ð¸ÑÐ°Ð»Ð¸ ÐµÑÐµ. â†’ (-Ð½Ð¾/-Ñ‚Ð¾)\n2. Ð’Ñ‡ÐµÐ½Ð¸Ð¹ Ð²Ñ–Ð´ÐºÑ€Ð¸Ð² Ð½Ð¾Ð²Ð¸Ð¹ ÐµÐ»ÐµÐ¼ÐµÐ½Ñ‚. â†’ (-ÑÑ)\n3. Ð”Ð¸Ñ€ÐµÐºÑ‚Ð¾Ñ€ Ð¿Ñ–Ð´Ð¿Ð¸ÑÐ°Ð² Ð´Ð¾ÐºÑƒÐ¼ÐµÐ½Ñ‚. â†’ (-Ð½Ð¸Ð¹/-Ñ‚Ð¸Ð¹)\n4. ÐšÐ¾Ð»ÐµÐ³Ð¸ Ð·Ð°Ð¿Ñ€Ð¾ÑÐ¸Ð»Ð¸ Ð¼ÐµÐ½Ðµ Ð½Ð° Ð²ÐµÑ‡Ñ–Ñ€ÐºÑƒ. â†’ (3rd pl.)\n\n**Answers:**\n1. Ð•ÑÐµ Ð½Ð°Ð¿Ð¸ÑÐ°Ð½Ð¾.\n2. ÐÐ¾Ð²Ð¸Ð¹ ÐµÐ»ÐµÐ¼ÐµÐ½Ñ‚ Ð²Ñ–Ð´ÐºÑ€Ð¸Ð²Ð°Ñ”Ñ‚ÑŒÑÑ Ð²Ñ‡ÐµÐ½Ð¸Ð¼. (or: Ð±ÑƒÐ² Ð²Ñ–Ð´ÐºÑ€Ð¸Ñ‚Ð¸Ð¹)\n3. Ð”Ð¾ÐºÑƒÐ¼ÐµÐ½Ñ‚ Ð¿Ñ–Ð´Ð¿Ð¸ÑÐ°Ð½Ð¸Ð¹ Ð´Ð¸Ñ€ÐµÐºÑ‚Ð¾Ñ€Ð¾Ð¼.\n4. ÐœÐµÐ½Ðµ Ð·Ð°Ð¿Ñ€Ð¾ÑÐ¸Ð»Ð¸ Ð½Ð° Ð²ÐµÑ‡Ñ–Ñ€ÐºÑƒ.\n\n> ðŸŽ¯ **Fun Fact**\n>\n> Historically, the -Ð½Ð¾/-Ñ‚Ð¾ form developed from the neuter participle. That's why it doesn't change â€” it's a \"frozen\" form that became an independent construction.\n\n---\n\n# ÐŸÑ–Ð´ÑÑƒÐ¼Ð¾Ðº\n\nIn this module, you mastered the complete Ukrainian passive voice system.\n\n**The Four Passive Forms:**\n\n| Form | Example | Register | Key Feature |\n|------|---------|----------|-------------|\n| Participial | ÐšÐ½Ð¸Ð³Ð° **Ð½Ð°Ð¿Ð¸ÑÐ°Ð½Ð°** | Literary | Agrees with noun |\n| Impersonal | ÐšÐ½Ð¸Ð³Ñƒ **Ð½Ð°Ð¿Ð¸ÑÐ°Ð½Ð¾** | Official | Object in accusative |\n| Reflexive | ÐšÐ½Ð¸Ð³Ð° **Ð¿Ð¸ÑˆÐµÑ‚ÑŒÑÑ** | Scientific | Process emphasis |\n| 3rd pl. | ÐšÐ½Ð¸Ð³Ñƒ **Ð½Ð°Ð¿Ð¸ÑÐ°Ð»Ð¸** | Colloquial | Implied \"they\" |\n\n**Key Rules:**\n1. Participles agree with the noun in gender, number, and case\n2. Impersonal -Ð½Ð¾/-Ñ‚Ð¾ never changes; object takes accusative\n3. Reflexive form emphasizes process, not result\n4. Third person plural is the most colloquial form\n\n**Form Selection Guide:**\n- Official document â†’ -Ð½Ð¾/-Ñ‚Ð¾\n- Scientific article â†’ -ÑÑ\n- Literary text â†’ -Ð½Ð¸Ð¹/-Ñ‚Ð¸Ð¹\n- Conversation â†’ 3rd person plural\n\n---\n\n# Ð’Ð¿Ñ€Ð°Ð²Ð¸\n\n## quiz: Ð’Ð¸Ð·Ð½Ð°Ñ‡ÐµÐ½Ð½Ñ Ð¿Ð°ÑÐ¸Ð²Ð½Ð¸Ñ… Ñ„Ð¾Ñ€Ð¼\n> ÐžÐ±ÐµÑ€Ñ–Ñ‚ÑŒ Ð¿Ñ€Ð°Ð²Ð¸Ð»ÑŒÐ½Ñƒ Ð²Ñ–Ð´Ð¿Ð¾Ð²Ñ–Ð´ÑŒ.\n\n1. Ð¯ÐºÐ° Ð¿Ð°ÑÐ¸Ð²Ð½Ð° Ñ„Ð¾Ñ€Ð¼Ð° Ñƒ Ñ€ÐµÑ‡ÐµÐ½Ð½Ñ– \"Ð”Ð¾ÐºÑƒÐ¼ÐµÐ½Ñ‚ Ð¿Ñ–Ð´Ð¿Ð¸ÑÐ°Ð½Ð¾ Ð´Ð¸Ñ€ÐµÐºÑ‚Ð¾Ñ€Ð¾Ð¼\"?\n   - [ ] Ð”Ñ–Ñ”Ð¿Ñ€Ð¸ÐºÐ¼ÐµÑ‚Ð½Ð¸ÐºÐ¾Ð²Ð° (-Ð½Ð¸Ð¹/-Ñ‚Ð¸Ð¹)\n   - [x] Ð‘ÐµÐ·Ð¾ÑÐ¾Ð±Ð¾Ð²Ð° (-Ð½Ð¾/-Ñ‚Ð¾)\n   - [ ] Ð—Ð²Ð¾Ñ€Ð¾Ñ‚Ð½Ð° (-ÑÑ)\n   - [ ] Ð¢Ñ€ÐµÑ‚Ñ Ð¾ÑÐ¾Ð±Ð° Ð¼Ð½Ð¾Ð¶Ð¸Ð½Ð¸\n   > Ð—Ð°ÐºÑ–Ð½Ñ‡ÐµÐ½Ð½Ñ -Ð½Ð¾ Ð²ÐºÐ°Ð·ÑƒÑ” Ð½Ð° Ð±ÐµÐ·Ð¾ÑÐ¾Ð±Ð¾Ð²Ñƒ Ñ„Ð¾Ñ€Ð¼Ñƒ.\n\n2. Ð¯ÐºÐ° Ñ„Ð¾Ñ€Ð¼Ð° Ð½Ð°Ð¹Ñ€Ð¾Ð·Ð¼Ð¾Ð²Ð½Ñ–ÑˆÐ°?\n   - [ ] ÐšÐ½Ð¸Ð³Ð° Ð½Ð°Ð¿Ð¸ÑÐ°Ð½Ð°.\n   - [ ] ÐšÐ½Ð¸Ð³Ñƒ Ð½Ð°Ð¿Ð¸ÑÐ°Ð½Ð¾.\n   - [ ] ÐšÐ½Ð¸Ð³Ð° Ð¿Ð¸ÑˆÐµÑ‚ÑŒÑÑ.\n   - [x] ÐšÐ½Ð¸Ð³Ñƒ Ð½Ð°Ð¿Ð¸ÑÐ°Ð»Ð¸.\n   > Ð¢Ñ€ÐµÑ‚Ñ Ð¾ÑÐ¾Ð±Ð° Ð¼Ð½Ð¾Ð¶Ð¸Ð½Ð¸ â€” Ð½Ð°Ð¹Ñ€Ð¾Ð·Ð¼Ð¾Ð²Ð½Ñ–ÑˆÐ° Ñ„Ð¾Ñ€Ð¼Ð° Ð¿Ð°ÑÐ¸Ð²Ñƒ.\n\n3. Ð¯ÐºÐ¸Ð¹ Ñ€ÐµÑ”ÑÑ‚Ñ€ ÑÐ¸Ð³Ð½Ð°Ð»Ñ–Ð·ÑƒÑ” Ñ„Ð¾Ñ€Ð¼Ð° \"Ð Ñ–ÑˆÐµÐ½Ð½Ñ Ð¿Ñ€Ð¸Ð¹Ð½ÑÑ‚Ð¾\"?\n   - [ ] Ð›Ñ–Ñ‚ÐµÑ€Ð°Ñ‚ÑƒÑ€Ð½Ð¸Ð¹\n   - [ ] ÐÐ°ÑƒÐºÐ¾Ð²Ð¸Ð¹\n   - [x] ÐžÑ„Ñ–Ñ†Ñ–Ð¹Ð½Ð¾-Ð´Ñ–Ð»Ð¾Ð²Ð¸Ð¹\n   - [ ] Ð Ð¾Ð·Ð¼Ð¾Ð²Ð½Ð¸Ð¹\n   > Ð¤Ð¾Ñ€Ð¼Ð° -Ð½Ð¾/-Ñ‚Ð¾ â€” Ð¼Ð°Ñ€ÐºÐµÑ€ Ð¾Ñ„Ñ–Ñ†Ñ–Ð¹Ð½Ð¾Ð³Ð¾ ÑÑ‚Ð¸Ð»ÑŽ.\n\n4. Ð¯ÐºÐ° Ñ„Ð¾Ñ€Ð¼Ð° Ð²Ð¸ÐºÐ¾Ñ€Ð¸ÑÑ‚Ð¾Ð²ÑƒÑ”Ñ‚ÑŒÑÑ Ð´Ð»Ñ Ð¾Ð¿Ð¸ÑÑƒ Ð¿Ñ€Ð¾Ñ†ÐµÑÑƒ?\n   - [ ] Ð”Ñ–Ñ”Ð¿Ñ€Ð¸ÐºÐ¼ÐµÑ‚Ð½Ð¸ÐºÐ¾Ð²Ð°\n   - [ ] Ð‘ÐµÐ·Ð¾ÑÐ¾Ð±Ð¾Ð²Ð°\n   - [x] Ð—Ð²Ð¾Ñ€Ð¾Ñ‚Ð½Ð° (-ÑÑ)\n   - [ ] Ð¢Ñ€ÐµÑ‚Ñ Ð¾ÑÐ¾Ð±Ð° Ð¼Ð½Ð¾Ð¶Ð¸Ð½Ð¸\n   > Ð—Ð²Ð¾Ñ€Ð¾Ñ‚Ð½Ð° Ñ„Ð¾Ñ€Ð¼Ð° Ð½Ð°Ð³Ð¾Ð»Ð¾ÑˆÑƒÑ” Ð½Ð° Ð¿Ñ€Ð¾Ñ†ÐµÑÑ–.\n\n5. \"ÐœÐµÐ½Ðµ Ð·Ð°Ð¿Ð¸Ñ‚Ð°Ð»Ð¸ Ð¿Ñ€Ð¾ Ñ†Ðµ\" â€” ÑÐºÐ° Ñ„Ð¾Ñ€Ð¼Ð°?\n   - [ ] Ð”Ñ–Ñ”Ð¿Ñ€Ð¸ÐºÐ¼ÐµÑ‚Ð½Ð¸ÐºÐ¾Ð²Ð°\n   - [ ] Ð‘ÐµÐ·Ð¾ÑÐ¾Ð±Ð¾Ð²Ð°\n   - [ ] Ð—Ð²Ð¾Ñ€Ð¾Ñ‚Ð½Ð°\n   - [x] Ð¢Ñ€ÐµÑ‚Ñ Ð¾ÑÐ¾Ð±Ð° Ð¼Ð½Ð¾Ð¶Ð¸Ð½Ð¸\n   > ÐÐµÐ¼Ð°Ñ” Ð²Ð¸Ñ€Ð°Ð¶ÐµÐ½Ð¾Ð³Ð¾ ÑÑƒÐ±'Ñ”ÐºÑ‚Ð°, Ð´Ñ–Ñ”ÑÐ»Ð¾Ð²Ð¾ Ð² 3-Ð¹ Ð¾ÑÐ¾Ð±Ñ– Ð¼Ð½Ð¾Ð¶Ð¸Ð½Ð¸.\n\n6. Ð¯ÐºÐ° Ñ„Ð¾Ñ€Ð¼Ð° Ð¿Ð¾Ñ‚Ñ€ÐµÐ±ÑƒÑ” Ð·Ð½Ð°Ñ…Ñ–Ð´Ð½Ð¾Ð³Ð¾ Ð²Ñ–Ð´Ð¼Ñ–Ð½ÐºÐ° Ð¾Ð±'Ñ”ÐºÑ‚Ð°?\n   - [ ] Ð”Ñ–Ñ”Ð¿Ñ€Ð¸ÐºÐ¼ÐµÑ‚Ð½Ð¸ÐºÐ¾Ð²Ð°\n   - [x] Ð‘ÐµÐ·Ð¾ÑÐ¾Ð±Ð¾Ð²Ð° (-Ð½Ð¾/-Ñ‚Ð¾)\n   - [ ] Ð—Ð²Ð¾Ñ€Ð¾Ñ‚Ð½Ð°\n   - [ ] Ð¢Ñ€ÐµÑ‚Ñ Ð¾ÑÐ¾Ð±Ð° Ð¼Ð½Ð¾Ð¶Ð¸Ð½Ð¸\n   > ÐšÐ½Ð¸Ð³Ñƒ Ð½Ð°Ð¿Ð¸ÑÐ°Ð½Ð¾ (Ð·Ð½Ð°Ñ…Ñ–Ð´Ð½Ð¸Ð¹), Ð½Ðµ ~~ÐšÐ½Ð¸Ð³Ð° Ð½Ð°Ð¿Ð¸ÑÐ°Ð½Ð¾~~.\n\n7. Ð£ Ð½Ð°ÑƒÐºÐ¾Ð²Ð¾Ð¼Ñƒ ÑÑ‚Ð¸Ð»Ñ– Ð½Ð°Ð¹Ñ‡Ð°ÑÑ‚Ñ–ÑˆÐµ Ð²Ð¸ÐºÐ¾Ñ€Ð¸ÑÑ‚Ð¾Ð²ÑƒÑŽÑ‚ÑŒ:\n   - [ ] Ð¢Ñ€ÐµÑ‚ÑŽ Ð¾ÑÐ¾Ð±Ñƒ Ð¼Ð½Ð¾Ð¶Ð¸Ð½Ð¸\n   - [ ] Ð‘ÐµÐ·Ð¾ÑÐ¾Ð±Ð¾Ð²Ñƒ Ñ„Ð¾Ñ€Ð¼Ñƒ\n   - [x] Ð—Ð²Ð¾Ñ€Ð¾Ñ‚Ð½Ñƒ Ñ„Ð¾Ñ€Ð¼Ñƒ (-ÑÑ)\n   - [ ] ÐÐºÑ‚Ð¸Ð²Ð½Ð¸Ð¹ ÑÑ‚Ð°Ð½\n   > ÐÐ°ÑƒÐºÐ° Ð²Ñ–Ð´Ð´Ð°Ñ” Ð¿ÐµÑ€ÐµÐ²Ð°Ð³Ñƒ Ñ„Ð¾Ñ€Ð¼Ñ– \"Ð´Ð¾ÑÐ»Ñ–Ð´Ð¶ÑƒÑ”Ñ‚ÑŒÑÑ\", \"Ð²Ð¸Ð²Ñ‡Ð°Ñ”Ñ‚ÑŒÑÑ\".\n\n8. Ð¯ÐºÐµ Ñ€ÐµÑ‡ÐµÐ½Ð½Ñ Ð² Ð¾Ñ„Ñ–Ñ†Ñ–Ð¹Ð½Ð¾-Ð´Ñ–Ð»Ð¾Ð²Ð¾Ð¼Ñƒ ÑÑ‚Ð¸Ð»Ñ–?\n   - [ ] Ð—Ð°ÐºÐ¾Ð½ Ð¿Ñ€Ð¸Ð¹Ð½ÑÐ»Ð¸ Ð²Ñ‡Ð¾Ñ€Ð°.\n   - [x] Ð—Ð°ÐºÐ¾Ð½ Ð¿Ñ€Ð¸Ð¹Ð½ÑÑ‚Ð¾ Ð²Ñ‡Ð¾Ñ€Ð°.\n   - [ ] Ð—Ð°ÐºÐ¾Ð½ Ð±ÑƒÐ² Ð¿Ñ€Ð¸Ð¹Ð½ÑÑ‚Ð¸Ð¹ Ð²Ñ‡Ð¾Ñ€Ð°.\n   - [ ] Ð—Ð°ÐºÐ¾Ð½ Ð¿Ñ€Ð¸Ð¹Ð¼Ð°Ñ”Ñ‚ÑŒÑÑ Ð²Ñ‡Ð¾Ñ€Ð°.\n   > Ð¤Ð¾Ñ€Ð¼Ð° -Ð½Ð¾ â€” Ð¼Ð°Ñ€ÐºÐµÑ€ Ð¾Ñ„Ñ–Ñ†Ñ–Ð¹Ð½Ð¾Ð³Ð¾ Ð´Ð¾ÐºÑƒÐ¼ÐµÐ½Ñ‚Ð°.\n\n9. Ð”Ñ–Ñ”Ð¿Ñ€Ð¸ÐºÐ¼ÐµÑ‚Ð½Ð¸Ðº \"Ð½Ð°Ð¿Ð¸ÑÐ°Ð½Ð¸Ð¹\" ÑƒÐ·Ð³Ð¾Ð´Ð¶ÑƒÑ”Ñ‚ÑŒÑÑ Ð·:\n   - [x] Ð†Ð¼ÐµÐ½Ð½Ð¸ÐºÐ¾Ð¼ Ñƒ Ñ€Ð¾Ð´Ñ–, Ñ‡Ð¸ÑÐ»Ñ– Ð¹ Ð²Ñ–Ð´Ð¼Ñ–Ð½ÐºÑƒ\n   - [ ] Ð¢Ñ–Ð»ÑŒÐºÐ¸ Ð² Ñ€Ð¾Ð´Ñ–\n   - [ ] Ð¢Ñ–Ð»ÑŒÐºÐ¸ Ð² Ñ‡Ð¸ÑÐ»Ñ–\n   - [ ] ÐÐµ ÑƒÐ·Ð³Ð¾Ð´Ð¶ÑƒÑ”Ñ‚ÑŒÑÑ\n   > ÐŸÐ¾Ð²Ð½Ðµ ÑƒÐ·Ð³Ð¾Ð´Ð¶ÐµÐ½Ð½Ñ: Ð½Ð°Ð¿Ð¸ÑÐ°Ð½Ð¸Ð¹ Ð»Ð¸ÑÑ‚, Ð½Ð°Ð¿Ð¸ÑÐ°Ð½Ð° ÐºÐ½Ð¸Ð³Ð°, Ð½Ð°Ð¿Ð¸ÑÐ°Ð½Ðµ ÑÐ»Ð¾Ð²Ð¾.\n\n10. Ð¯ÐºÐ° Ñ„Ð¾Ñ€Ð¼Ð° Ð¿Ñ€Ð¸Ñ…Ð¾Ð²ÑƒÑ” Ð°Ð³ÐµÐ½Ñ‚Ð° (Ð²Ð¸ÐºÐ¾Ð½Ð°Ð²Ñ†Ñ Ð´Ñ–Ñ—)?\n    - [ ] Ð¢Ñ–Ð»ÑŒÐºÐ¸ Ð´Ñ–Ñ”Ð¿Ñ€Ð¸ÐºÐ¼ÐµÑ‚Ð½Ð¸ÐºÐ¾Ð²Ð°\n    - [ ] Ð¢Ñ–Ð»ÑŒÐºÐ¸ Ð·Ð²Ð¾Ñ€Ð¾Ñ‚Ð½Ð°\n    - [ ] Ð¢Ñ–Ð»ÑŒÐºÐ¸ Ñ‚Ñ€ÐµÑ‚Ñ Ð¾ÑÐ¾Ð±Ð° Ð¼Ð½Ð¾Ð¶Ð¸Ð½Ð¸\n    - [x] Ð’ÑÑ– Ñ‡Ð¾Ñ‚Ð¸Ñ€Ð¸ Ñ„Ð¾Ñ€Ð¼Ð¸ Ð¼Ð¾Ð¶ÑƒÑ‚ÑŒ\n    > Ð£ÑÑ– Ð¿Ð°ÑÐ¸Ð²Ð½Ñ– Ñ„Ð¾Ñ€Ð¼Ð¸ Ð¼Ð¾Ð¶ÑƒÑ‚ÑŒ Ð½Ðµ Ð²Ð¸Ñ€Ð°Ð¶Ð°Ñ‚Ð¸ Ð°Ð³ÐµÐ½Ñ‚Ð°.\n\n11. \"Ð•ÐºÑÐ¿ÐµÑ€Ð¸Ð¼ÐµÐ½Ñ‚ Ð¿Ñ€Ð¾Ð²Ð¾Ð´Ð¸Ñ‚ÑŒÑÑ Ð² Ð»Ð°Ð±Ð¾Ñ€Ð°Ñ‚Ð¾Ñ€Ñ–Ñ—\" â€” Ð°Ð³ÐµÐ½Ñ‚:\n    - [x] ÐÐµ Ð²Ð¸Ñ€Ð°Ð¶ÐµÐ½Ð¸Ð¹\n    - [ ] Ð’Ð¸Ñ€Ð°Ð¶ÐµÐ½Ð¸Ð¹ Ð·Ð½Ð°Ñ…Ñ–Ð´Ð½Ð¸Ð¼\n    - [ ] Ð’Ð¸Ñ€Ð°Ð¶ÐµÐ½Ð¸Ð¹ Ð´Ð°Ð²Ð°Ð»ÑŒÐ½Ð¸Ð¼\n    - [ ] Ð’Ð¸Ñ€Ð°Ð¶ÐµÐ½Ð¸Ð¹ Ñ€Ð¾Ð´Ð¾Ð²Ð¸Ð¼\n    > ÐÐ³ÐµÐ½Ñ‚ Ð¾Ð¿ÑƒÑ‰ÐµÐ½Ð¸Ð¹, Ñ„Ð¾Ñ€Ð¼Ð° Ð·Ð²Ð¾Ñ€Ð¾Ñ‚Ð½Ð°.\n\n12. Ð¯ÐºÐ° Ñ„Ð¾Ñ€Ð¼Ð° Ð· Ñ‡Ð°ÑÐ¾Ð²Ð¸Ð¼Ð¸ Ñ„Ð¾Ñ€Ð¼Ð°Ð¼Ð¸ \"Ð±ÑƒÑ‚Ð¸\"?\n    - [x] Ð”Ñ–Ñ”Ð¿Ñ€Ð¸ÐºÐ¼ÐµÑ‚Ð½Ð¸ÐºÐ¾Ð²Ð° (Ð±ÑƒÐ´Ðµ Ð½Ð°Ð¿Ð¸ÑÐ°Ð½Ð¸Ð¹)\n    - [ ] Ð‘ÐµÐ·Ð¾ÑÐ¾Ð±Ð¾Ð²Ð°\n    - [ ] Ð—Ð²Ð¾Ñ€Ð¾Ñ‚Ð½Ð°\n    - [ ] Ð¢Ñ€ÐµÑ‚Ñ Ð¾ÑÐ¾Ð±Ð° Ð¼Ð½Ð¾Ð¶Ð¸Ð½Ð¸\n    > ÐšÐ½Ð¸Ð³Ð° Ð±ÑƒÐ»Ð°/Ð±ÑƒÐ´Ðµ Ð½Ð°Ð¿Ð¸ÑÐ°Ð½Ð° â€” Ð´Ñ–Ñ”Ð¿Ñ€Ð¸ÐºÐ¼ÐµÑ‚Ð½Ð¸Ðº + Ð±ÑƒÑ‚Ð¸.\n\n13. \"Ð™Ð¾Ð¼Ñƒ Ð¿Ð¾Ð¾Ð±Ñ–Ñ†ÑÐ»Ð¸ Ð¿Ñ–Ð´Ð²Ð¸Ñ‰ÐµÐ½Ð½Ñ\" â€” Ð¾Ð±'Ñ”ÐºÑ‚ Ñƒ:\n    - [ ] Ð—Ð½Ð°Ñ…Ñ–Ð´Ð½Ð¾Ð¼Ñƒ Ð²Ñ–Ð´Ð¼Ñ–Ð½ÐºÑƒ\n    - [x] Ð”Ð°Ð²Ð°Ð»ÑŒÐ½Ð¾Ð¼Ñƒ Ð²Ñ–Ð´Ð¼Ñ–Ð½ÐºÑƒ\n    - [ ] ÐžÑ€ÑƒÐ´Ð½Ð¾Ð¼Ñƒ Ð²Ñ–Ð´Ð¼Ñ–Ð½ÐºÑƒ\n    - [ ] Ð Ð¾Ð´Ð¾Ð²Ð¾Ð¼Ñƒ Ð²Ñ–Ð´Ð¼Ñ–Ð½ÐºÑƒ\n    > Ð™Ð¾Ð¼Ñƒ â€” Ð´Ð°Ð²Ð°Ð»ÑŒÐ½Ð¸Ð¹, Ð¾Ñ‚Ñ€Ð¸Ð¼ÑƒÐ²Ð°Ñ‡ Ð´Ñ–Ñ—.\n\n14. Ð¯ÐºÐ¸Ð¹ Ð²Ð°Ñ€Ñ–Ð°Ð½Ñ‚ Ð½ÐµÐ¿Ñ€Ð°Ð²Ð¸Ð»ÑŒÐ½Ð¸Ð¹?\n    - [ ] ÐšÐ½Ð¸Ð³Ð° Ð½Ð°Ð¿Ð¸ÑÐ°Ð½Ð°.\n    - [x] ÐšÐ½Ð¸Ð³Ð° Ð½Ð°Ð¿Ð¸ÑÐ°Ð½Ð¾.\n    - [ ] ÐšÐ½Ð¸Ð³Ñƒ Ð½Ð°Ð¿Ð¸ÑÐ°Ð½Ð¾.\n    - [ ] ÐšÐ½Ð¸Ð³Ñƒ Ð½Ð°Ð¿Ð¸ÑÐ°Ð»Ð¸.\n    > Ð‘ÐµÐ·Ð¾ÑÐ¾Ð±Ð¾Ð²Ð° Ñ„Ð¾Ñ€Ð¼Ð° Ð²Ð¸Ð¼Ð°Ð³Ð°Ñ” Ð·Ð½Ð°Ñ…Ñ–Ð´Ð½Ð¾Ð³Ð¾: ÐºÐ½Ð¸Ð³Ð£ Ð½Ð°Ð¿Ð¸ÑÐ°Ð½Ð¾.\n\n15. Ð£ Ñ…ÑƒÐ´Ð¾Ð¶Ð½Ñ–Ð¹ Ð»Ñ–Ñ‚ÐµÑ€Ð°Ñ‚ÑƒÑ€Ñ– Ð½Ð°Ð¹Ñ‡Ð°ÑÑ‚Ñ–ÑˆÐµ:\n    - [x] Ð”Ñ–Ñ”Ð¿Ñ€Ð¸ÐºÐ¼ÐµÑ‚Ð½Ð¸ÐºÐ¾Ð²Ð° Ñ„Ð¾Ñ€Ð¼Ð°\n    - [ ] Ð‘ÐµÐ·Ð¾ÑÐ¾Ð±Ð¾Ð²Ð° Ñ„Ð¾Ñ€Ð¼Ð°\n    - [ ] Ð—Ð²Ð¾Ñ€Ð¾Ñ‚Ð½Ð° Ñ„Ð¾Ñ€Ð¼Ð°\n    - [ ] Ð¢Ñ€ÐµÑ‚Ñ Ð¾ÑÐ¾Ð±Ð° Ð¼Ð½Ð¾Ð¶Ð¸Ð½Ð¸\n    > Ð›Ñ–Ñ‚ÐµÑ€Ð°Ñ‚ÑƒÑ€Ð½Ð¸Ð¹ ÑÑ‚Ð¸Ð»ÑŒ Ð²Ñ–Ð´Ð´Ð°Ñ” Ð¿ÐµÑ€ÐµÐ²Ð°Ð³Ñƒ Ð´Ñ–Ñ”Ð¿Ñ€Ð¸ÐºÐ¼ÐµÑ‚Ð½Ð¸ÐºÐ°Ð¼.\n\n16. ÐÐ³ÐµÐ½Ñ‚ Ñƒ Ð´Ñ–Ñ”Ð¿Ñ€Ð¸ÐºÐ¼ÐµÑ‚Ð½Ð¸ÐºÐ¾Ð²Ñ–Ð¹ Ñ„Ð¾Ñ€Ð¼Ñ– Ð²Ð¸Ñ€Ð°Ð¶Ð°Ñ”Ñ‚ÑŒÑÑ:\n    - [ ] Ð—Ð½Ð°Ñ…Ñ–Ð´Ð½Ð¸Ð¼ Ð²Ñ–Ð´Ð¼Ñ–Ð½ÐºÐ¾Ð¼\n    - [ ] Ð”Ð°Ð²Ð°Ð»ÑŒÐ½Ð¸Ð¼ Ð²Ñ–Ð´Ð¼Ñ–Ð½ÐºÐ¾Ð¼\n    - [x] ÐžÑ€ÑƒÐ´Ð½Ð¸Ð¼ Ð²Ñ–Ð´Ð¼Ñ–Ð½ÐºÐ¾Ð¼\n    - [ ] Ð Ð¾Ð´Ð¾Ð²Ð¸Ð¼ Ð²Ñ–Ð´Ð¼Ñ–Ð½ÐºÐ¾Ð¼\n    > ÐšÐ½Ð¸Ð³Ð° Ð½Ð°Ð¿Ð¸ÑÐ°Ð½Ð° Ð°Ð²Ñ‚Ð¾Ñ€ÐžÐœ (Ð¾Ñ€ÑƒÐ´Ð½Ð¸Ð¹).\n\n## match-up: Ð¤Ð¾Ñ€Ð¼Ð° â†’ Ð ÐµÑ”ÑÑ‚Ñ€\n> Ð—'Ñ”Ð´Ð½Ð°Ð¹Ñ‚Ðµ Ñ„Ð¾Ñ€Ð¼Ñƒ Ð· Ñ‚Ð¸Ð¿Ð¾Ð²Ð¸Ð¼ Ñ€ÐµÑ”ÑÑ‚Ñ€Ð¾Ð¼.\n\n| Ð¤Ð¾Ñ€Ð¼Ð° | Ð ÐµÑ”ÑÑ‚Ñ€ |\n|-------|--------|\n| ÐšÐ½Ð¸Ð³Ð° Ð½Ð°Ð¿Ð¸ÑÐ°Ð½Ð° Ð°Ð²Ñ‚Ð¾Ñ€Ð¾Ð¼. | Ð»Ñ–Ñ‚ÐµÑ€Ð°Ñ‚ÑƒÑ€Ð½Ð¸Ð¹ |\n| ÐšÐ½Ð¸Ð³Ñƒ Ð½Ð°Ð¿Ð¸ÑÐ°Ð½Ð¾. | Ð¾Ñ„Ñ–Ñ†Ñ–Ð¹Ð½Ð¾-Ð´Ñ–Ð»Ð¾Ð²Ð¸Ð¹ |\n| ÐšÐ½Ð¸Ð³Ð° Ð¿Ð¸ÑˆÐµÑ‚ÑŒÑÑ. | Ð½Ð°ÑƒÐºÐ¾Ð²Ð¸Ð¹ |\n| ÐšÐ½Ð¸Ð³Ñƒ Ð½Ð°Ð¿Ð¸ÑÐ°Ð»Ð¸. | Ñ€Ð¾Ð·Ð¼Ð¾Ð²Ð½Ð¸Ð¹ |\n| Ð Ñ–ÑˆÐµÐ½Ð½Ñ Ð¿Ñ€Ð¸Ð¹Ð½ÑÑ‚Ð¾. | Ð±ÑŽÑ€Ð¾ÐºÑ€Ð°Ñ‚Ð¸Ñ‡Ð½Ð¸Ð¹ |\n| ÐŸÑ€Ð¾Ð±Ð»ÐµÐ¼Ð° Ð²Ð¸Ð²Ñ‡Ð°Ñ”Ñ‚ÑŒÑÑ. | Ð°ÐºÐ°Ð´ÐµÐ¼Ñ–Ñ‡Ð½Ð¸Ð¹ |\n| ÐœÐµÐ½Ñ– ÑÐºÐ°Ð·Ð°Ð»Ð¸. | Ð¿Ð¾Ð²ÑÑÐºÐ´ÐµÐ½Ð½Ð¸Ð¹ |\n| Ð›Ð¸ÑÑ‚ Ð±ÑƒÐ² Ð²Ñ–Ð´Ð¿Ñ€Ð°Ð²Ð»ÐµÐ½Ð¸Ð¹. | Ñ„Ð¾Ñ€Ð¼Ð°Ð»ÑŒÐ½Ð¸Ð¹ |\n| Ð—Ð°ÐºÐ¾Ð½ Ð·Ð°ÑÑ‚Ð¾ÑÐ¾Ð²ÑƒÑ”Ñ‚ÑŒÑÑ. | ÑŽÑ€Ð¸Ð´Ð¸Ñ‡Ð½Ð¸Ð¹ |\n| ÐÐ°Ð¼ Ð¿Ð¾Ð²Ñ–Ð´Ð¾Ð¼Ð¸Ð»Ð¸. | Ð½ÐµÑ„Ð¾Ñ€Ð¼Ð°Ð»ÑŒÐ½Ð¸Ð¹ |\n| Ð”Ð¾ÐºÑƒÐ¼ÐµÐ½Ñ‚ Ð¿Ñ–Ð´Ð¿Ð¸ÑÐ°Ð½Ð¾. | ÐºÐ°Ð½Ñ†ÐµÐ»ÑÑ€ÑÑŒÐºÐ¸Ð¹ |\n| Ð•ÐºÑÐ¿ÐµÑ€Ð¸Ð¼ÐµÐ½Ñ‚ Ð¿Ñ€Ð¾Ð²Ð¾Ð´Ð¸Ñ‚ÑŒÑÑ. | Ñ‚ÐµÑ…Ð½Ñ–Ñ‡Ð½Ð¸Ð¹ |\n| Ð™Ð¾Ð¼Ñƒ Ð¿Ð¾Ð¾Ð±Ñ–Ñ†ÑÐ»Ð¸. | Ð¿Ð¾Ð±ÑƒÑ‚Ð¾Ð²Ð¸Ð¹ |\n| Ð¡Ñ‚Ð°Ñ‚Ñ‚ÑŽ Ð¾Ð¿ÑƒÐ±Ð»Ñ–ÐºÐ¾Ð²Ð°Ð½Ð¾. | Ð¼ÐµÐ´Ñ–Ð¹Ð½Ð¸Ð¹ |\n| Ð”Ð°Ð½Ñ– Ð·Ð±Ð¸Ñ€Ð°ÑŽÑ‚ÑŒÑÑ. | Ð´Ð¾ÑÐ»Ñ–Ð´Ð½Ð¸Ñ†ÑŒÐºÐ¸Ð¹ |\n| ÐœÐµÐ½Ðµ Ð·Ð°Ð¿Ð¸Ñ‚Ð°Ð»Ð¸. | Ñ‰Ð¾Ð´ÐµÐ½Ð½Ð¸Ð¹ |\n\n## fill-in: ÐžÐ±ÐµÑ€Ñ–Ñ‚ÑŒ Ð¿Ñ€Ð°Ð²Ð¸Ð»ÑŒÐ½Ñƒ Ñ„Ð¾Ñ€Ð¼Ñƒ\n> Ð—Ð°Ð¿Ð¾Ð²Ð½Ñ–Ñ‚ÑŒ Ð¿Ñ€Ð¾Ð¿ÑƒÑÐºÐ¸ Ð²Ñ–Ð´Ð¿Ð¾Ð²Ñ–Ð´Ð½Ð¾ÑŽ Ð¿Ð°ÑÐ¸Ð²Ð½Ð¾ÑŽ Ñ„Ð¾Ñ€Ð¼Ð¾ÑŽ.\n\n1. Ð£ Ð´Ð¾ÐºÑƒÐ¼ÐµÐ½Ñ‚Ñ– Ð·Ð°Ð·Ð½Ð°Ñ‡ÐµÐ½Ð¾: \"ÐÐ°ÐºÐ°Ð· ___ Ð´Ð¸Ñ€ÐµÐºÑ‚Ð¾Ñ€Ð¾Ð¼.\"\n   > [!answer] Ð¿Ñ–Ð´Ð¿Ð¸ÑÐ°Ð½Ð¾\n   > [!options] Ð¿Ñ–Ð´Ð¿Ð¸ÑÐ°Ð½Ð¾ | Ð¿Ñ–Ð´Ð¿Ð¸ÑÐ°Ð½Ð¸Ð¹ | Ð¿Ñ–Ð´Ð¿Ð¸ÑÑƒÑ”Ñ‚ÑŒÑÑ | Ð¿Ñ–Ð´Ð¿Ð¸ÑÐ°Ð»Ð¸\n\n2. Ð¦Ñ Ð¿Ñ€Ð¾Ð±Ð»ÐµÐ¼Ð° ___ Ð²Ð¶Ðµ Ð±Ð°Ð³Ð°Ñ‚Ð¾ Ñ€Ð¾ÐºÑ–Ð².\n   > [!answer] Ð²Ð¸Ð²Ñ‡Ð°Ñ”Ñ‚ÑŒÑÑ\n   > [!options] Ð²Ð¸Ð²Ñ‡Ð°Ñ”Ñ‚ÑŒÑÑ | Ð²Ð¸Ð²Ñ‡ÐµÐ½Ð¾ | Ð²Ð¸Ð²Ñ‡ÐµÐ½Ð° | Ð²Ð¸Ð²Ñ‡Ð°Ð»Ð¸\n\n3. Ð’Ñ‡Ð¾Ñ€Ð° ___ Ð¿Ñ€Ð¾ Ð·Ð¼Ñ–Ð½Ñƒ Ñ€Ð¾Ð·ÐºÐ»Ð°Ð´Ñƒ.\n   > [!answer] Ð¿Ð¾Ð²Ñ–Ð´Ð¾Ð¼Ð¸Ð»Ð¸\n   > [!options] Ð¿Ð¾Ð²Ñ–Ð´Ð¾Ð¼Ð¸Ð»Ð¸ | Ð¿Ð¾Ð²Ñ–Ð´Ð¾Ð¼Ð»ÐµÐ½Ð¾ | Ð¿Ð¾Ð²Ñ–Ð´Ð¾Ð¼Ð»ÑÑ”Ñ‚ÑŒÑÑ | Ð¿Ð¾Ð²Ñ–Ð´Ð¾Ð¼Ð»ÐµÐ½Ð¸Ð¹\n\n4. Ð‘ÑƒÐ´Ð¸Ð½Ð¾Ðº ___ Ñƒ Ð¼Ð¸Ð½ÑƒÐ»Ð¾Ð¼Ñƒ ÑÑ‚Ð¾Ð»Ñ–Ñ‚Ñ‚Ñ–.\n   > [!answer] Ð¿Ð¾Ð±ÑƒÐ´Ð¾Ð²Ð°Ð½Ð¸Ð¹\n   > [!options] Ð¿Ð¾Ð±ÑƒÐ´Ð¾Ð²Ð°Ð½Ð¸Ð¹ | Ð¿Ð¾Ð±ÑƒÐ´Ð¾Ð²Ð°Ð½Ð¾ | Ð±ÑƒÐ´ÑƒÑ”Ñ‚ÑŒÑÑ | Ð¿Ð¾Ð±ÑƒÐ´ÑƒÐ²Ð°Ð»Ð¸\n\n5. Ð Ñ–ÑˆÐµÐ½Ð½Ñ Ñ‰Ðµ Ð½Ðµ ___.\n   > [!answer] Ð¿Ñ€Ð¸Ð¹Ð½ÑÑ‚Ð¾\n   > [!options] Ð¿Ñ€Ð¸Ð¹Ð½ÑÑ‚Ð¾ | Ð¿Ñ€Ð¸Ð¹Ð½ÑÑ‚Ð¸Ð¹ | Ð¿Ñ€Ð¸Ð¹Ð¼Ð°Ñ”Ñ‚ÑŒÑÑ | Ð¿Ñ€Ð¸Ð¹Ð½ÑÐ»Ð¸\n\n6. Ð•ÐºÑÐ¿ÐµÑ€Ð¸Ð¼ÐµÐ½Ñ‚ ___ Ñƒ Ð»Ð°Ð±Ð¾Ñ€Ð°Ñ‚Ð¾Ñ€Ñ–Ñ— Ñ‰Ð¾Ð´Ð½Ñ.\n   > [!answer] Ð¿Ñ€Ð¾Ð²Ð¾Ð´Ð¸Ñ‚ÑŒÑÑ\n   > [!options] Ð¿Ñ€Ð¾Ð²Ð¾Ð´Ð¸Ñ‚ÑŒÑÑ | Ð¿Ñ€Ð¾Ð²ÐµÐ´ÐµÐ½Ð¾ | Ð¿Ñ€Ð¾Ð²ÐµÐ´ÐµÐ½Ð¸Ð¹ | Ð¿Ñ€Ð¾Ð²Ð¾Ð´Ð¸Ð»Ð¸\n\n7. ___ Ð·Ð°Ð¿Ñ€Ð¾ÑÐ¸Ð»Ð¸ Ð½Ð° ÐºÐ¾Ð½Ñ„ÐµÑ€ÐµÐ½Ñ†Ñ–ÑŽ.\n   > [!answer] ÐœÐµÐ½Ðµ\n   > [!options] ÐœÐµÐ½Ðµ | ÐœÐµÐ½Ñ– | ÐœÐ½Ð¾ÑŽ | Ð¯\n\n8. Ð¡Ñ‚Ð°Ñ‚Ñ‚Ñ ___ Ð² Ð¶ÑƒÑ€Ð½Ð°Ð»Ñ– Ð¼Ð¸Ð½ÑƒÐ»Ð¾Ð³Ð¾ Ð¼Ñ–ÑÑÑ†Ñ.\n   > [!answer] Ð¾Ð¿ÑƒÐ±Ð»Ñ–ÐºÐ¾Ð²Ð°Ð½Ð°\n   > [!options] Ð¾Ð¿ÑƒÐ±Ð»Ñ–ÐºÐ¾Ð²Ð°Ð½Ð° | Ð¾Ð¿ÑƒÐ±Ð»Ñ–ÐºÐ¾Ð²Ð°Ð½Ð¾ | Ð¿ÑƒÐ±Ð»Ñ–ÐºÑƒÑ”Ñ‚ÑŒÑÑ | Ð¾Ð¿ÑƒÐ±Ð»Ñ–ÐºÑƒÐ²Ð°Ð»Ð¸\n\n9. Ð Ð¾Ð±Ð¾Ñ‚Ñƒ ___ Ð²Ñ‡Ð°ÑÐ½Ð¾.\n   > [!answer] Ð·Ð°Ð²ÐµÑ€ÑˆÐµÐ½Ð¾\n   > [!options] Ð·Ð°Ð²ÐµÑ€ÑˆÐµÐ½Ð¾ | Ð·Ð°Ð²ÐµÑ€ÑˆÐµÐ½Ð° | Ð·Ð°Ð²ÐµÑ€ÑˆÑƒÑ”Ñ‚ÑŒÑÑ | Ð·Ð°Ð²ÐµÑ€ÑˆÐ¸Ð»Ð¸\n\n10. Ð¦ÐµÐ¹ Ð¼ÐµÑ‚Ð¾Ð´ ___ Ñƒ Ð¼ÐµÐ´Ð¸Ñ†Ð¸Ð½Ñ–.\n    > [!answer] Ð²Ð¸ÐºÐ¾Ñ€Ð¸ÑÑ‚Ð¾Ð²ÑƒÑ”Ñ‚ÑŒÑÑ\n    > [!options] Ð²Ð¸ÐºÐ¾Ñ€Ð¸ÑÑ‚Ð¾Ð²ÑƒÑ”Ñ‚ÑŒÑÑ | Ð²Ð¸ÐºÐ¾Ñ€Ð¸ÑÑ‚Ð°Ð½Ð¾ | Ð²Ð¸ÐºÐ¾Ñ€Ð¸ÑÑ‚Ð°Ð½Ð¸Ð¹ | Ð²Ð¸ÐºÐ¾Ñ€Ð¸ÑÑ‚Ð°Ð»Ð¸\n\n11. Ð—Ð°ÐºÐ¾Ð½ ___ Ð´Ð¾ Ð²ÑÑ–Ñ… Ð³Ñ€Ð¾Ð¼Ð°Ð´ÑÐ½.\n    > [!answer] Ð·Ð°ÑÑ‚Ð¾ÑÐ¾Ð²ÑƒÑ”Ñ‚ÑŒÑÑ\n    > [!options] Ð·Ð°ÑÑ‚Ð¾ÑÐ¾Ð²ÑƒÑ”Ñ‚ÑŒÑÑ | Ð·Ð°ÑÑ‚Ð¾ÑÐ¾Ð²Ð°Ð½Ð¾ | Ð·Ð°ÑÑ‚Ð¾ÑÐ¾Ð²Ð°Ð½Ð¸Ð¹ | Ð·Ð°ÑÑ‚Ð¾ÑÑƒÐ²Ð°Ð»Ð¸\n\n12. ___ Ð¿Ð¾Ð¾Ð±Ñ–Ñ†ÑÐ»Ð¸ Ð²Ñ–Ð´Ð¿Ð¾Ð²Ñ–Ð´ÑŒ Ð·Ð°Ð²Ñ‚Ñ€Ð°.\n    > [!answer] ÐÐ°Ð¼\n    > [!options] ÐÐ°Ð¼ | ÐÐ°Ñ | ÐÐ°Ð¼Ð¸ | ÐœÐ¸\n\n13. Ð”Ð¾ÐºÑƒÐ¼ÐµÐ½Ñ‚Ð¸ ___ Ð½Ð° Ñ€Ð¾Ð·Ð³Ð»ÑÐ´.\n    > [!answer] Ð¿Ð¾Ð´Ð°Ð½Ð¾\n    > [!options] Ð¿Ð¾Ð´Ð°Ð½Ð¾ | Ð¿Ð¾Ð´Ð°Ð½Ñ– | Ð¿Ð¾Ð´Ð°ÑŽÑ‚ÑŒÑÑ | Ð¿Ð¾Ð´Ð°Ð»Ð¸\n\n14. Ð¦Ñ ÐºÐ½Ð¸Ð³Ð° ___ Ð½Ð° Ð´Ð²Ð°Ð´Ñ†ÑÑ‚ÑŒ Ð¼Ð¾Ð².\n    > [!answer] Ð¿ÐµÑ€ÐµÐºÐ»Ð°Ð´ÐµÐ½Ð°\n    > [!options] Ð¿ÐµÑ€ÐµÐºÐ»Ð°Ð´ÐµÐ½Ð° | Ð¿ÐµÑ€ÐµÐºÐ»Ð°Ð´ÐµÐ½Ð¾ | Ð¿ÐµÑ€ÐµÐºÐ»Ð°Ð´Ð°Ñ”Ñ‚ÑŒÑÑ | Ð¿ÐµÑ€ÐµÐºÐ»Ð°Ð»Ð¸\n\n15. Ð—Ð°ÑÑ–Ð´Ð°Ð½Ð½Ñ ___ Ð·Ð°ÐºÑ€Ð¸Ñ‚Ð¸Ð¼.\n    > [!answer] Ð¾Ð³Ð¾Ð»Ð¾ÑˆÐµÐ½Ð¾\n    > [!options] Ð¾Ð³Ð¾Ð»Ð¾ÑˆÐµÐ½Ð¾ | Ð¾Ð³Ð¾Ð»Ð¾ÑˆÐµÐ½Ðµ | Ð¾Ð³Ð¾Ð»Ð¾ÑˆÑƒÑ”Ñ‚ÑŒÑÑ | Ð¾Ð³Ð¾Ð»Ð¾ÑÐ¸Ð»Ð¸\n\n16. ÐŸÑ€Ð¾ÐµÐºÑ‚ ___ Ð½Ð°ÑÑ‚ÑƒÐ¿Ð½Ð¾Ð³Ð¾ Ñ€Ð¾ÐºÑƒ.\n    > [!answer] Ð±ÑƒÐ´Ðµ Ð·Ð°Ð²ÐµÑ€ÑˆÐµÐ½Ð¸Ð¹\n    > [!options] Ð±ÑƒÐ´Ðµ Ð·Ð°Ð²ÐµÑ€ÑˆÐµÐ½Ð¸Ð¹ | Ð·Ð°Ð²ÐµÑ€ÑˆÐµÐ½Ð¾ | Ð·Ð°Ð²ÐµÑ€ÑˆÑƒÑ”Ñ‚ÑŒÑÑ | Ð·Ð°Ð²ÐµÑ€ÑˆÐ°Ñ‚ÑŒ\n\n## true-false: ÐŸÑ€Ð°Ð²Ð¸Ð»Ð° Ð¿Ð°ÑÐ¸Ð²Ð½Ð¾Ð³Ð¾ ÑÑ‚Ð°Ð½Ñƒ\n> Ð’Ð¸Ð·Ð½Ð°Ñ‡Ñ‚Ðµ, Ñ‡Ð¸ Ñ‚Ð²ÐµÑ€Ð´Ð¶ÐµÐ½Ð½Ñ Ð¿Ñ€Ð°Ð²Ð¸Ð»ÑŒÐ½Ðµ.\n\n- [x] Ð£ÐºÑ€Ð°Ñ—Ð½ÑÑŒÐºÐ° Ð¼Ð¾Ð²Ð° Ð¼Ð°Ñ” Ñ‡Ð¾Ñ‚Ð¸Ñ€Ð¸ Ð¿Ð°ÑÐ¸Ð²Ð½Ñ– ÐºÐ¾Ð½ÑÑ‚Ñ€ÑƒÐºÑ†Ñ–Ñ—.\n  > ÐŸÑ€Ð°Ð²Ð¸Ð»ÑŒÐ½Ð¾! Ð”Ñ–Ñ”Ð¿Ñ€Ð¸ÐºÐ¼ÐµÑ‚Ð½Ð¸ÐºÐ¾Ð²Ð°, Ð±ÐµÐ·Ð¾ÑÐ¾Ð±Ð¾Ð²Ð°, Ð·Ð²Ð¾Ñ€Ð¾Ñ‚Ð½Ð° Ñ– Ñ‚Ñ€ÐµÑ‚Ñ Ð¾ÑÐ¾Ð±Ð° Ð¼Ð½Ð¾Ð¶Ð¸Ð½Ð¸.\n\n- [ ] Ð¤Ð¾Ñ€Ð¼Ð° -Ð½Ð¾/-Ñ‚Ð¾ ÑƒÐ·Ð³Ð¾Ð´Ð¶ÑƒÑ”Ñ‚ÑŒÑÑ Ð· Ñ–Ð¼ÐµÐ½Ð½Ð¸ÐºÐ¾Ð¼ Ñƒ Ñ€Ð¾Ð´Ñ–.\n  > ÐÐµÐ¿Ñ€Ð°Ð²Ð¸Ð»ÑŒÐ½Ð¾! Ð¦Ñ Ñ„Ð¾Ñ€Ð¼Ð° Ð½ÐµÐ·Ð¼Ñ–Ð½Ð½Ð° (Ð·Ð°Ð²Ð¶Ð´Ð¸ ÑÐµÑ€ÐµÐ´Ð½Ñ–Ð¹ Ñ€Ñ–Ð´).\n\n- [x] Ð£ Ð±ÐµÐ·Ð¾ÑÐ¾Ð±Ð¾Ð²Ñ–Ð¹ Ñ„Ð¾Ñ€Ð¼Ñ– Ð¾Ð±'Ñ”ÐºÑ‚ ÑÑ‚Ð¾Ñ—Ñ‚ÑŒ Ñƒ Ð·Ð½Ð°Ñ…Ñ–Ð´Ð½Ð¾Ð¼Ñƒ Ð²Ñ–Ð´Ð¼Ñ–Ð½ÐºÑƒ.\n  > ÐŸÑ€Ð°Ð²Ð¸Ð»ÑŒÐ½Ð¾! ÐšÐ½Ð¸Ð³Ñƒ Ð½Ð°Ð¿Ð¸ÑÐ°Ð½Ð¾ (Ð½Ðµ ~~ÐšÐ½Ð¸Ð³Ð° Ð½Ð°Ð¿Ð¸ÑÐ°Ð½Ð¾~~).\n\n- [ ] Ð—Ð²Ð¾Ñ€Ð¾Ñ‚Ð½Ð° Ñ„Ð¾Ñ€Ð¼Ð° (-ÑÑ) Ð½Ð°Ð¹Ñ‡Ð°ÑÑ‚Ñ–ÑˆÐµ Ð²Ð¶Ð¸Ð²Ð°Ñ”Ñ‚ÑŒÑÑ Ð² Ñ€Ð¾Ð·Ð¼Ð¾Ð²Ð½Ñ–Ð¹ Ð¼Ð¾Ð²Ñ–.\n  > ÐÐµÐ¿Ñ€Ð°Ð²Ð¸Ð»ÑŒÐ½Ð¾! Ð’Ð¾Ð½Ð° Ñ…Ð°Ñ€Ð°ÐºÑ‚ÐµÑ€Ð½Ð° Ð´Ð»Ñ Ð½Ð°ÑƒÐºÐ¾Ð²Ð¾Ð³Ð¾ ÑÑ‚Ð¸Ð»ÑŽ.\n\n- [x] Ð¢Ñ€ÐµÑ‚Ñ Ð¾ÑÐ¾Ð±Ð° Ð¼Ð½Ð¾Ð¶Ð¸Ð½Ð¸ â€” Ð½Ð°Ð¹Ñ€Ð¾Ð·Ð¼Ð¾Ð²Ð½Ñ–ÑˆÐ° Ð¿Ð°ÑÐ¸Ð²Ð½Ð° Ñ„Ð¾Ñ€Ð¼Ð°.\n  > ÐŸÑ€Ð°Ð²Ð¸Ð»ÑŒÐ½Ð¾! \"ÐœÐµÐ½Ñ– ÑÐºÐ°Ð·Ð°Ð»Ð¸\" Ð·Ð²ÑƒÑ‡Ð¸Ñ‚ÑŒ Ð¿Ñ€Ð¸Ñ€Ð¾Ð´Ð½Ð¾ Ð² Ð¿Ð¾Ð²ÑÑÐºÐ´ÐµÐ½Ð½Ð¾Ð¼Ñƒ ÑÐ¿Ñ–Ð»ÐºÑƒÐ²Ð°Ð½Ð½Ñ–.\n\n- [x] Ð”Ñ–Ñ”Ð¿Ñ€Ð¸ÐºÐ¼ÐµÑ‚Ð½Ð¸Ðº ÑƒÐ·Ð³Ð¾Ð´Ð¶ÑƒÑ”Ñ‚ÑŒÑÑ Ð· Ñ–Ð¼ÐµÐ½Ð½Ð¸ÐºÐ¾Ð¼ Ñƒ Ñ€Ð¾Ð´Ñ–, Ñ‡Ð¸ÑÐ»Ñ– Ð¹ Ð²Ñ–Ð´Ð¼Ñ–Ð½ÐºÑƒ.\n  > ÐŸÑ€Ð°Ð²Ð¸Ð»ÑŒÐ½Ð¾! ÐÐ°Ð¿Ð¸ÑÐ°Ð½Ð¸Ð¹ Ð»Ð¸ÑÑ‚, Ð½Ð°Ð¿Ð¸ÑÐ°Ð½Ð° ÐºÐ½Ð¸Ð³Ð°, Ð½Ð°Ð¿Ð¸ÑÐ°Ð½Ñ– Ð»Ð¸ÑÑ‚Ð¸.\n\n- [ ] Ð’ ÑƒÐºÑ€Ð°Ñ—Ð½ÑÑŒÐºÑ–Ð¹ Ð¼Ð¾Ð²Ñ– Ð°Ð³ÐµÐ½Ñ‚ Ð·Ð°Ð²Ð¶Ð´Ð¸ Ð²Ð¸Ñ€Ð°Ð¶Ð°Ñ”Ñ‚ÑŒÑÑ.\n  > ÐÐµÐ¿Ñ€Ð°Ð²Ð¸Ð»ÑŒÐ½Ð¾! ÐÐ³ÐµÐ½Ñ‚ Ñ‡Ð°ÑÑ‚Ð¾ Ð¾Ð¿ÑƒÑÐºÐ°Ñ”Ñ‚ÑŒÑÑ, Ð¾ÑÐ¾Ð±Ð»Ð¸Ð²Ð¾ Ð² Ð±ÐµÐ·Ð¾ÑÐ¾Ð±Ð¾Ð²Ñ–Ð¹ Ñ„Ð¾Ñ€Ð¼Ñ–.\n\n- [x] Ð¤Ð¾Ñ€Ð¼Ð° \"Ð Ñ–ÑˆÐµÐ½Ð½Ñ Ð¿Ñ€Ð¸Ð¹Ð½ÑÑ‚Ð¾\" ÑÐ¸Ð³Ð½Ð°Ð»Ñ–Ð·ÑƒÑ” Ð¾Ñ„Ñ–Ñ†Ñ–Ð¹Ð½Ð¸Ð¹ Ñ€ÐµÑ”ÑÑ‚Ñ€.\n  > ÐŸÑ€Ð°Ð²Ð¸Ð»ÑŒÐ½Ð¾! -Ð½Ð¾/-Ñ‚Ð¾ â€” Ð¼Ð°Ñ€ÐºÐµÑ€ Ð¾Ñ„Ñ–Ñ†Ñ–Ð¹Ð½Ð¾-Ð´Ñ–Ð»Ð¾Ð²Ð¾Ð³Ð¾ ÑÑ‚Ð¸Ð»ÑŽ.\n\n- [ ] Ð—Ð²Ð¾Ñ€Ð¾Ñ‚Ð½Ð° Ñ„Ð¾Ñ€Ð¼Ð° Ð½Ðµ Ð¼Ð¾Ð¶Ðµ Ð²Ð¸Ñ€Ð°Ð¶Ð°Ñ‚Ð¸ Ð°Ð³ÐµÐ½Ñ‚Ð°.\n  > ÐÐµÐ¿Ñ€Ð°Ð²Ð¸Ð»ÑŒÐ½Ð¾! ÐÐ³ÐµÐ½Ñ‚ Ð¼Ð¾Ð¶Ðµ Ð±ÑƒÑ‚Ð¸ Ð² Ð¾Ñ€ÑƒÐ´Ð½Ð¾Ð¼Ñƒ: \"Ð²Ð¸Ð²Ñ‡Ð°Ñ”Ñ‚ÑŒÑÑ Ð²Ñ‡ÐµÐ½Ð¸Ð¼Ð¸\".\n\n- [x] \"ÐšÐ½Ð¸Ð³Ð° Ð±ÑƒÐ´Ðµ Ð½Ð°Ð¿Ð¸ÑÐ°Ð½Ð°\" â€” Ñ†Ðµ Ð¼Ð°Ð¹Ð±ÑƒÑ‚Ð½Ñ–Ð¹ Ñ‡Ð°Ñ Ð¿Ð°ÑÐ¸Ð²Ñƒ.\n  > ÐŸÑ€Ð°Ð²Ð¸Ð»ÑŒÐ½Ð¾! Ð‘ÑƒÑ‚Ð¸ + Ð´Ñ–Ñ”Ð¿Ñ€Ð¸ÐºÐ¼ÐµÑ‚Ð½Ð¸Ðº ÑƒÑ‚Ð²Ð¾Ñ€ÑŽÑ” Ñ‡Ð°ÑÐ¾Ð²Ñ– Ñ„Ð¾Ñ€Ð¼Ð¸.\n\n- [ ] Ð£ÑÑ– Ñ‡Ð¾Ñ‚Ð¸Ñ€Ð¸ Ñ„Ð¾Ñ€Ð¼Ð¸ Ð²Ð·Ð°Ñ”Ð¼Ð¾Ð·Ð°Ð¼Ñ–Ð½Ð½Ñ– Ð² Ð±ÑƒÐ´ÑŒ-ÑÐºÐ¾Ð¼Ñƒ ÐºÐ¾Ð½Ñ‚ÐµÐºÑÑ‚Ñ–.\n  > ÐÐµÐ¿Ñ€Ð°Ð²Ð¸Ð»ÑŒÐ½Ð¾! ÐšÐ¾Ð¶Ð½Ð° Ñ„Ð¾Ñ€Ð¼Ð° Ð¼Ð°Ñ” ÑÐ²Ñ–Ð¹ Ñ€ÐµÑ”ÑÑ‚Ñ€ Ñ– ÑÑ‚Ð¸Ð»Ñ–ÑÑ‚Ð¸Ñ‡Ð½Ðµ Ð·Ð°Ð±Ð°Ñ€Ð²Ð»ÐµÐ½Ð½Ñ.\n\n- [x] Ð£ Ð´Ð°Ð²Ð°Ð»ÑŒÐ½Ð¾Ð¼Ñƒ Ð²Ñ–Ð´Ð¼Ñ–Ð½ÐºÑƒ Ð¼Ð¾Ð¶Ðµ ÑÑ‚Ð¾ÑÑ‚Ð¸ Ð¾Ñ‚Ñ€Ð¸Ð¼ÑƒÐ²Ð°Ñ‡ Ð´Ñ–Ñ—.\n  > ÐŸÑ€Ð°Ð²Ð¸Ð»ÑŒÐ½Ð¾! \"Ð™Ð¾Ð¼Ñƒ ÑÐºÐ°Ð·Ð°Ð»Ð¸\" â€” Ð¹Ð¾Ð¼Ñƒ Ð² Ð´Ð°Ð²Ð°Ð»ÑŒÐ½Ð¾Ð¼Ñƒ.\n\n- [ ] Ð¤Ð¾Ñ€Ð¼Ð° -Ð½Ð¾/-Ñ‚Ð¾ Ð²Ð¶Ð¸Ð²Ð°Ñ”Ñ‚ÑŒÑÑ Ð² Ñ…ÑƒÐ´Ð¾Ð¶Ð½Ñ–Ð¹ Ð»Ñ–Ñ‚ÐµÑ€Ð°Ñ‚ÑƒÑ€Ñ– Ñ‡Ð°ÑÑ‚Ñ–ÑˆÐµ Ð·Ð° Ñ–Ð½ÑˆÑ–.\n  > ÐÐµÐ¿Ñ€Ð°Ð²Ð¸Ð»ÑŒÐ½Ð¾! Ð£ Ð»Ñ–Ñ‚ÐµÑ€Ð°Ñ‚ÑƒÑ€Ñ– Ð¿ÐµÑ€ÐµÐ²Ð°Ð¶Ð°Ñ” Ð´Ñ–Ñ”Ð¿Ñ€Ð¸ÐºÐ¼ÐµÑ‚Ð½Ð¸ÐºÐ¾Ð²Ð° Ñ„Ð¾Ñ€Ð¼Ð°.\n\n- [x] Ð’Ð¸Ð±Ñ–Ñ€ Ð¿Ð°ÑÐ¸Ð²Ð½Ð¾Ñ— Ñ„Ð¾Ñ€Ð¼Ð¸ Ð·Ð°Ð»ÐµÐ¶Ð¸Ñ‚ÑŒ Ð²Ñ–Ð´ Ñ€ÐµÑ”ÑÑ‚Ñ€Ñƒ Ð¼Ð¾Ð²Ð»ÐµÐ½Ð½Ñ.\n  > ÐŸÑ€Ð°Ð²Ð¸Ð»ÑŒÐ½Ð¾! Ð¦Ðµ ÐºÐ»ÑŽÑ‡Ð¾Ð²Ð¸Ð¹ Ð¿Ñ€Ð¸Ð½Ñ†Ð¸Ð¿ ÑƒÐºÑ€Ð°Ñ—Ð½ÑÑŒÐºÐ¾Ñ— Ð¿Ð°ÑÐ¸Ð²Ð½Ð¾Ñ— ÑÐ¸ÑÑ‚ÐµÐ¼Ð¸.\n\n- [ ] \"ÐšÐ½Ð¸Ð³Ð° Ð¿Ð¸ÑˆÐµÑ‚ÑŒÑÑ\" Ð¾Ð·Ð½Ð°Ñ‡Ð°Ñ” Ð·Ð°Ð²ÐµÑ€ÑˆÐµÐ½Ñƒ Ð´Ñ–ÑŽ.\n  > ÐÐµÐ¿Ñ€Ð°Ð²Ð¸Ð»ÑŒÐ½Ð¾! Ð—Ð²Ð¾Ñ€Ð¾Ñ‚Ð½Ð° Ñ„Ð¾Ñ€Ð¼Ð° Ð½Ð°Ð³Ð¾Ð»Ð¾ÑˆÑƒÑ” Ð½Ð° Ð¿Ñ€Ð¾Ñ†ÐµÑÑ–, Ñ‰Ð¾ Ñ‚Ñ€Ð¸Ð²Ð°Ñ”.\n\n- [x] Ð’ Ð¾Ñ„Ñ–Ñ†Ñ–Ð¹Ð½Ð¸Ñ… Ð´Ð¾ÐºÑƒÐ¼ÐµÐ½Ñ‚Ð°Ñ… Ð¿ÐµÑ€ÐµÐ²Ð°Ð¶Ð°Ñ” Ñ„Ð¾Ñ€Ð¼Ð° -Ð½Ð¾/-Ñ‚Ð¾.\n  > ÐŸÑ€Ð°Ð²Ð¸Ð»ÑŒÐ½Ð¾! \"ÐÐ°ÐºÐ°Ð· Ð²Ð¸Ð´Ð°Ð½Ð¾\", \"Ð Ñ–ÑˆÐµÐ½Ð½Ñ Ð¿Ñ€Ð¸Ð¹Ð½ÑÑ‚Ð¾\" â€” ÐºÐ°Ð½Ñ†ÐµÐ»ÑÑ€ÑÑŒÐºÐ¸Ð¹ ÑÑ‚Ð¸Ð»ÑŒ.\n\n## group-sort: ÐšÐ»Ð°ÑÐ¸Ñ„Ñ–ÐºÐ°Ñ†Ñ–Ñ Ð·Ð° Ñ„Ð¾Ñ€Ð¼Ð¾ÑŽ\n> Ð Ð¾Ð·Ð¿Ð¾Ð´Ñ–Ð»Ñ–Ñ‚ÑŒ Ñ€ÐµÑ‡ÐµÐ½Ð½Ñ Ð·Ð° Ñ‚Ð¸Ð¿Ð¾Ð¼ Ð¿Ð°ÑÐ¸Ð²Ð½Ð¾Ñ— Ñ„Ð¾Ñ€Ð¼Ð¸.\n\n### Ð”Ñ–Ñ”Ð¿Ñ€Ð¸ÐºÐ¼ÐµÑ‚Ð½Ð¸ÐºÐ¾Ð²Ð° (-Ð½Ð¸Ð¹/-Ñ‚Ð¸Ð¹)\n- ÐšÐ½Ð¸Ð³Ð° Ð½Ð°Ð¿Ð¸ÑÐ°Ð½Ð° Ð°Ð²Ñ‚Ð¾Ñ€Ð¾Ð¼.\n- Ð›Ð¸ÑÑ‚ Ð±ÑƒÐ² Ð²Ñ–Ð´Ð¿Ñ€Ð°Ð²Ð»ÐµÐ½Ð¸Ð¹ Ð²Ñ‡Ð¾Ñ€Ð°.\n- Ð‘ÑƒÐ´Ð¸Ð½Ð¾Ðº Ð¿Ð¾Ð±ÑƒÐ´Ð¾Ð²Ð°Ð½Ð¸Ð¹ Ñƒ 2020 Ñ€Ð¾Ñ†Ñ–.\n- Ð”Ð¾ÐºÑƒÐ¼ÐµÐ½Ñ‚ Ð¿Ñ–Ð´Ð¿Ð¸ÑÐ°Ð½Ð¸Ð¹ Ð´Ð¸Ñ€ÐµÐºÑ‚Ð¾Ñ€Ð¾Ð¼.\n\n### Ð‘ÐµÐ·Ð¾ÑÐ¾Ð±Ð¾Ð²Ð° (-Ð½Ð¾/-Ñ‚Ð¾)\n- Ð Ñ–ÑˆÐµÐ½Ð½Ñ Ð¿Ñ€Ð¸Ð¹Ð½ÑÑ‚Ð¾ Ð¾Ð´Ð½Ð¾Ð³Ð¾Ð»Ð¾ÑÐ½Ð¾.\n- Ð Ð¾Ð±Ð¾Ñ‚Ñƒ Ð·Ð°Ð²ÐµÑ€ÑˆÐµÐ½Ð¾ Ð²Ñ‡Ð°ÑÐ½Ð¾.\n- ÐÐ°ÐºÐ°Ð· Ð²Ð¸Ð´Ð°Ð½Ð¾ Ð´Ð¸Ñ€ÐµÐºÑ‚Ð¾Ñ€Ð¾Ð¼.\n- Ð—Ð°ÑÑ–Ð´Ð°Ð½Ð½Ñ Ð¾Ð³Ð¾Ð»Ð¾ÑˆÐµÐ½Ð¾ Ð·Ð°ÐºÑ€Ð¸Ñ‚Ð¸Ð¼.\n\n### Ð—Ð²Ð¾Ñ€Ð¾Ñ‚Ð½Ð° (-ÑÑ)\n- ÐŸÑ€Ð¾Ð±Ð»ÐµÐ¼Ð° Ð²Ð¸Ð²Ñ‡Ð°Ñ”Ñ‚ÑŒÑÑ Ð½Ð°ÑƒÐºÐ¾Ð²Ñ†ÑÐ¼Ð¸.\n- Ð•ÐºÑÐ¿ÐµÑ€Ð¸Ð¼ÐµÐ½Ñ‚ Ð¿Ñ€Ð¾Ð²Ð¾Ð´Ð¸Ñ‚ÑŒÑÑ Ñ‰Ð¾Ð´Ð½Ñ.\n- Ð—Ð°ÐºÐ¾Ð½ Ð·Ð°ÑÑ‚Ð¾ÑÐ¾Ð²ÑƒÑ”Ñ‚ÑŒÑÑ Ð´Ð¾ Ð²ÑÑ–Ñ….\n- Ð”Ð°Ð½Ñ– Ð·Ð±Ð¸Ñ€Ð°ÑŽÑ‚ÑŒÑÑ Ð°Ð²Ñ‚Ð¾Ð¼Ð°Ñ‚Ð¸Ñ‡Ð½Ð¾.\n\n### Ð¢Ñ€ÐµÑ‚Ñ Ð¾ÑÐ¾Ð±Ð° Ð¼Ð½Ð¾Ð¶Ð¸Ð½Ð¸\n- ÐœÐµÐ½Ñ– ÑÐºÐ°Ð·Ð°Ð»Ð¸ Ð¿Ñ€Ð¾ Ñ†Ðµ Ð²Ñ‡Ð¾Ñ€Ð°.\n- Ð™Ð¾Ð¼Ñƒ Ð¿Ð¾Ð¾Ð±Ñ–Ñ†ÑÐ»Ð¸ Ð¿Ñ–Ð´Ð²Ð¸Ñ‰ÐµÐ½Ð½Ñ.\n- ÐÐ°Ñ Ð·Ð°Ð¿Ñ€Ð¾ÑÐ¸Ð»Ð¸ Ð½Ð° Ð²ÐµÑ‡Ñ–Ñ€ÐºÑƒ.\n- Ð‡Ð¹ Ð¿Ð¾Ð´Ð°Ñ€ÑƒÐ²Ð°Ð»Ð¸ ÐºÐ²Ñ–Ñ‚Ð¸.\n\n## unjumble: ÐŸÐ¾Ð±ÑƒÐ´ÑƒÐ¹Ñ‚Ðµ Ð¿Ð°ÑÐ¸Ð²Ð½Ñ– Ñ€ÐµÑ‡ÐµÐ½Ð½Ñ\n> Ð Ð¾Ð·ÑÑ‚Ð°Ð²Ñ‚Ðµ ÑÐ»Ð¾Ð²Ð° Ñƒ Ð¿Ñ€Ð°Ð²Ð¸Ð»ÑŒÐ½Ð¾Ð¼Ñƒ Ð¿Ð¾Ñ€ÑÐ´ÐºÑƒ.\n\n1. Ð½Ð°Ð¿Ð¸ÑÐ°Ð½Ð¾ / ÐšÐ½Ð¸Ð³Ñƒ / Ð¼Ð¸Ð½ÑƒÐ»Ð¾Ð¼Ñƒ / Ñ€Ð¾Ñ†Ñ– / Ñƒ\n   > [!answer] ÐšÐ½Ð¸Ð³Ñƒ Ð½Ð°Ð¿Ð¸ÑÐ°Ð½Ð¾ Ñƒ Ð¼Ð¸Ð½ÑƒÐ»Ð¾Ð¼Ñƒ Ñ€Ð¾Ñ†Ñ–\n\n2. Ð¿Ñ€Ð¾Ð²Ð¾Ð´Ð¸Ñ‚ÑŒÑÑ / Ð»Ð°Ð±Ð¾Ñ€Ð°Ñ‚Ð¾Ñ€Ñ–Ñ— / Ð•ÐºÑÐ¿ÐµÑ€Ð¸Ð¼ÐµÐ½Ñ‚ / Ñƒ / Ñ‰Ð¾Ð´Ð½Ñ\n   > [!answer] Ð•ÐºÑÐ¿ÐµÑ€Ð¸Ð¼ÐµÐ½Ñ‚ Ð¿Ñ€Ð¾Ð²Ð¾Ð´Ð¸Ñ‚ÑŒÑÑ Ñƒ Ð»Ð°Ð±Ð¾Ñ€Ð°Ñ‚Ð¾Ñ€Ñ–Ñ— Ñ‰Ð¾Ð´Ð½Ñ\n\n3. Ð¼ÐµÐ½Ðµ / ÐºÐ¾Ð½Ñ„ÐµÑ€ÐµÐ½Ñ†Ñ–ÑŽ / Ð½Ð° / Ð’Ñ‡Ð¾Ñ€Ð° / Ð·Ð°Ð¿Ñ€Ð¾ÑÐ¸Ð»Ð¸\n   > [!answer] Ð’Ñ‡Ð¾Ñ€Ð° Ð¼ÐµÐ½Ðµ Ð·Ð°Ð¿Ñ€Ð¾ÑÐ¸Ð»Ð¸ Ð½Ð° ÐºÐ¾Ð½Ñ„ÐµÑ€ÐµÐ½Ñ†Ñ–ÑŽ\n\n4. Ð¿Ñ–Ð´Ð¿Ð¸ÑÐ°Ð½Ð¸Ð¹ / Ð´Ð¸Ñ€ÐµÐºÑ‚Ð¾Ñ€Ð¾Ð¼ / Ð±ÑƒÐ² / Ð”Ð¾ÐºÑƒÐ¼ÐµÐ½Ñ‚ / ÑƒÑ‡Ð¾Ñ€Ð°\n   > [!answer] Ð”Ð¾ÐºÑƒÐ¼ÐµÐ½Ñ‚ Ð±ÑƒÐ² Ð¿Ñ–Ð´Ð¿Ð¸ÑÐ°Ð½Ð¸Ð¹ Ð´Ð¸Ñ€ÐµÐºÑ‚Ð¾Ñ€Ð¾Ð¼ ÑƒÑ‡Ð¾Ñ€Ð°\n\n5. Ð¿Ñ€Ð¸Ð¹Ð½ÑÑ‚Ð¾ / Ð¾Ð´Ð½Ð¾Ð³Ð¾Ð»Ð¾ÑÐ½Ð¾ / Ð Ñ–ÑˆÐµÐ½Ð½Ñ / ÐºÐ¾Ð¼Ñ–ÑÑ–Ñ”ÑŽ / Ð±ÑƒÐ»Ð¾\n   > [!answer] Ð Ñ–ÑˆÐµÐ½Ð½Ñ Ð±ÑƒÐ»Ð¾ Ð¿Ñ€Ð¸Ð¹Ð½ÑÑ‚Ð¾ ÐºÐ¾Ð¼Ñ–ÑÑ–Ñ”ÑŽ Ð¾Ð´Ð½Ð¾Ð³Ð¾Ð»Ð¾ÑÐ½Ð¾\n\n6. Ð½Ð°ÑƒÐºÐ¾Ð²Ñ†ÑÐ¼Ð¸ / Ð²Ð¸Ð²Ñ‡Ð°Ñ”Ñ‚ÑŒÑÑ / Ð¦Ñ / Ñ€Ð¾ÐºÐ°Ð¼Ð¸ / Ð¿Ñ€Ð¾Ð±Ð»ÐµÐ¼Ð° / Ð±Ð°Ð³Ð°Ñ‚Ð¾\n   > [!answer] Ð¦Ñ Ð¿Ñ€Ð¾Ð±Ð»ÐµÐ¼Ð° Ð²Ð¸Ð²Ñ‡Ð°Ñ”Ñ‚ÑŒÑÑ Ð½Ð°ÑƒÐºÐ¾Ð²Ñ†ÑÐ¼Ð¸ Ð±Ð°Ð³Ð°Ñ‚Ð¾ Ñ€Ð¾ÐºÐ°Ð¼Ð¸\n\n7. Ð¿Ð¾Ð¾Ð±Ñ–Ñ†ÑÐ»Ð¸ / Ð¿Ñ–Ð´Ð²Ð¸Ñ‰ÐµÐ½Ð½Ñ / Ð™Ð¾Ð¼Ñƒ / Ð½Ð°ÑÑ‚ÑƒÐ¿Ð½Ð¾Ð³Ð¾ / Ð¼Ñ–ÑÑÑ†Ñ\n   > [!answer] Ð™Ð¾Ð¼Ñƒ Ð¿Ð¾Ð¾Ð±Ñ–Ñ†ÑÐ»Ð¸ Ð¿Ñ–Ð´Ð²Ð¸Ñ‰ÐµÐ½Ð½Ñ Ð½Ð°ÑÑ‚ÑƒÐ¿Ð½Ð¾Ð³Ð¾ Ð¼Ñ–ÑÑÑ†Ñ\n\n8. Ð·Ð°Ð²ÐµÑ€ÑˆÐµÐ½Ð¾ / Ð‘ÑƒÐ´Ñ–Ð²Ð½Ð¸Ñ†Ñ‚Ð²Ð¾ / Ð²Ñ‡Ð°ÑÐ½Ð¾ / Ð±ÑƒÐ´Ðµ / Ñ€Ð¾ÐºÑƒ / Ð½Ð°ÑÑ‚ÑƒÐ¿Ð½Ð¾Ð³Ð¾\n   > [!answer] Ð‘ÑƒÐ´Ñ–Ð²Ð½Ð¸Ñ†Ñ‚Ð²Ð¾ Ð±ÑƒÐ´Ðµ Ð·Ð°Ð²ÐµÑ€ÑˆÐµÐ½Ð¾ Ð²Ñ‡Ð°ÑÐ½Ð¾ Ð½Ð°ÑÑ‚ÑƒÐ¿Ð½Ð¾Ð³Ð¾ Ñ€Ð¾ÐºÑƒ\n\n9. Ð¿Ð¾Ð²Ñ–Ð´Ð¾Ð¼Ð¸Ð»Ð¸ / Ð·Ð¼Ñ–Ð½Ð¸ / ÐÐ°Ð¼ / Ð¿Ñ€Ð¾ / Ñƒ / Ñ€Ð¾Ð·ÐºÐ»Ð°Ð´Ñ–\n   > [!answer] ÐÐ°Ð¼ Ð¿Ð¾Ð²Ñ–Ð´Ð¾Ð¼Ð¸Ð»Ð¸ Ð¿Ñ€Ð¾ Ð·Ð¼Ñ–Ð½Ð¸ Ñƒ Ñ€Ð¾Ð·ÐºÐ»Ð°Ð´Ñ–\n\n10. Ð·Ð°ÑÑ‚Ð¾ÑÐ¾Ð²ÑƒÑ”Ñ‚ÑŒÑÑ / Ð´Ð¾ / Ð—Ð°ÐºÐ¾Ð½ / ÑƒÑÑ–Ñ… / Ð³Ñ€Ð¾Ð¼Ð°Ð´ÑÐ½ / ÐºÑ€Ð°Ñ—Ð½Ð¸\n    > [!answer] Ð—Ð°ÐºÐ¾Ð½ Ð·Ð°ÑÑ‚Ð¾ÑÐ¾Ð²ÑƒÑ”Ñ‚ÑŒÑÑ Ð´Ð¾ ÑƒÑÑ–Ñ… Ð³Ñ€Ð¾Ð¼Ð°Ð´ÑÐ½ ÐºÑ€Ð°Ñ—Ð½Ð¸\n\n11. Ð¾Ð¿ÑƒÐ±Ð»Ñ–ÐºÐ¾Ð²Ð°Ð½Ð° / Ð¡Ñ‚Ð°Ñ‚Ñ‚Ñ / Ð¶ÑƒÑ€Ð½Ð°Ð»Ñ– / Ð±ÑƒÐ»Ð° / Ð½Ð°ÑƒÐºÐ¾Ð²Ð¾Ð¼Ñƒ / Ñƒ\n    > [!answer] Ð¡Ñ‚Ð°Ñ‚Ñ‚Ñ Ð±ÑƒÐ»Ð° Ð¾Ð¿ÑƒÐ±Ð»Ñ–ÐºÐ¾Ð²Ð°Ð½Ð° Ñƒ Ð½Ð°ÑƒÐºÐ¾Ð²Ð¾Ð¼Ñƒ Ð¶ÑƒÑ€Ð½Ð°Ð»Ñ–\n\n12. Ð¿Ð¾Ð±ÑƒÐ´Ð¾Ð²Ð°Ð½Ð¾ / Ñƒ / Ð¦ÐµÐ¹ / ÑÑ‚Ð¾Ð»Ñ–Ñ‚Ñ‚Ñ– / Ð±ÑƒÐ´Ð¸Ð½Ð¾Ðº / Ð¼Ð¸Ð½ÑƒÐ»Ð¾Ð¼Ñƒ\n    > [!answer] Ð¦ÐµÐ¹ Ð±ÑƒÐ´Ð¸Ð½Ð¾Ðº Ð¿Ð¾Ð±ÑƒÐ´Ð¾Ð²Ð°Ð½Ð¾ Ñƒ Ð¼Ð¸Ð½ÑƒÐ»Ð¾Ð¼Ñƒ ÑÑ‚Ð¾Ð»Ñ–Ñ‚Ñ‚Ñ–\n\n13. Ð·Ð°Ð¿Ð¸Ñ‚Ð°Ð»Ð¸ / Ð¼Ð°Ð³Ð°Ð·Ð¸Ð½Ñ– / Ð¿Ñ€Ð¾ / ÐœÐµÐ½Ðµ / Ð·Ð½Ð¸Ð¶ÐºÑƒ / Ñƒ\n    > [!answer] ÐœÐµÐ½Ðµ Ð·Ð°Ð¿Ð¸Ñ‚Ð°Ð»Ð¸ Ð¿Ñ€Ð¾ Ð·Ð½Ð¸Ð¶ÐºÑƒ Ñƒ Ð¼Ð°Ð³Ð°Ð·Ð¸Ð½Ñ–\n\n14. Ð²Ð¸ÐºÐ¾Ð½ÑƒÑŽÑ‚ÑŒÑÑ / Ð—Ð°Ð²Ð´Ð°Ð½Ð½Ñ / Ð¿Ñ€Ð°Ñ†Ñ–Ð²Ð½Ð¸ÐºÐ°Ð¼Ð¸ / Ñ€ÐµÐ³ÑƒÐ»ÑÑ€Ð½Ð¾ / Ð½Ð°ÑˆÐ¸Ð¼Ð¸\n    > [!answer] Ð—Ð°Ð²Ð´Ð°Ð½Ð½Ñ Ð²Ð¸ÐºÐ¾Ð½ÑƒÑŽÑ‚ÑŒÑÑ Ð½Ð°ÑˆÐ¸Ð¼Ð¸ Ð¿Ñ€Ð°Ñ†Ñ–Ð²Ð½Ð¸ÐºÐ°Ð¼Ð¸ Ñ€ÐµÐ³ÑƒÐ»ÑÑ€Ð½Ð¾\n\n15. Ð¾Ð³Ð¾Ð»Ð¾ÑˆÐµÐ½Ð¾ / Ð·Ð°ÐºÑ€Ð¸Ñ‚Ð¸Ð¼ / Ð±ÑƒÐ»Ð¾ / Ð—Ð°ÑÑ–Ð´Ð°Ð½Ð½Ñ / Ð¾ / Ð³Ð¾Ð´Ð¸Ð½Ñ– / Ð¿'ÑÑ‚Ñ–Ð¹\n    > [!answer] Ð—Ð°ÑÑ–Ð´Ð°Ð½Ð½Ñ Ð±ÑƒÐ»Ð¾ Ð¾Ð³Ð¾Ð»Ð¾ÑˆÐµÐ½Ð¾ Ð·Ð°ÐºÑ€Ð¸Ñ‚Ð¸Ð¼ Ð¾ Ð¿'ÑÑ‚Ñ–Ð¹ Ð³Ð¾Ð´Ð¸Ð½Ñ–\n\n16. Ð¿ÐµÑ€ÐµÐºÐ»Ð°Ð´ÐµÐ½Ð¾ / Ð¼Ð¾Ð²Ð¸ / Ð¦ÑŽ / Ð´Ð²Ð°Ð´Ñ†ÑÑ‚ÑŒ / ÐºÐ½Ð¸Ð³Ñƒ / Ð½Ð°\n    > [!answer] Ð¦ÑŽ ÐºÐ½Ð¸Ð³Ñƒ Ð¿ÐµÑ€ÐµÐºÐ»Ð°Ð´ÐµÐ½Ð¾ Ð½Ð° Ð´Ð²Ð°Ð´Ñ†ÑÑ‚ÑŒ Ð¼Ð¾Ð²Ð¸\n\n## error-correction: Ð’Ð¸Ð¿Ñ€Ð°Ð²Ñ‚Ðµ Ð¿Ð¾Ð¼Ð¸Ð»ÐºÐ¸\n> Ð£ ÐºÐ¾Ð¶Ð½Ð¾Ð¼Ñƒ Ñ€ÐµÑ‡ÐµÐ½Ð½Ñ– Ñ” ÐžÐ”ÐÐ Ð¿Ð¾Ð¼Ð¸Ð»ÐºÐ°. Ð—Ð½Ð°Ð¹Ð´Ñ–Ñ‚ÑŒ Ñ– Ð²Ð¸Ð¿Ñ€Ð°Ð²Ñ‚Ðµ Ñ—Ñ—.\n\n1. ÐšÐ½Ð¸Ð³Ð° Ð½Ð°Ð¿Ð¸ÑÐ°Ð½Ð¾ Ð°Ð²Ñ‚Ð¾Ñ€Ð¾Ð¼ Ð¼Ð¸Ð½ÑƒÐ»Ð¾Ð³Ð¾ Ñ€Ð¾ÐºÑƒ.\n   > [!error] Ð½Ð°Ð¿Ð¸ÑÐ°Ð½Ð¾\n   > [!answer] Ð½Ð°Ð¿Ð¸ÑÐ°Ð½Ð°\n   > [!options] Ð½Ð°Ð¿Ð¸ÑÐ°Ð½Ð¾ | Ð½Ð°Ð¿Ð¸ÑÐ°Ð½Ð° | Ð½Ð°Ð¿Ð¸ÑÐ°Ð½Ð¸Ð¹ | Ð½Ð°Ð¿Ð¸ÑÐ°Ð½Ñ–\n   > [!explanation] Participial form agrees with noun: ÐºÐ½Ð¸Ð³Ð° (f.) â†’ Ð½Ð°Ð¿Ð¸ÑÐ°Ð½Ð°.\n\n2. Ð Ñ–ÑˆÐµÐ½Ð½Ñ Ð¿Ñ€Ð¸Ð¹Ð½ÑÑ‚Ð¸Ð¹ Ð¾Ð´Ð½Ð¾Ð³Ð¾Ð»Ð¾ÑÐ½Ð¾.\n   > [!error] Ð¿Ñ€Ð¸Ð¹Ð½ÑÑ‚Ð¸Ð¹\n   > [!answer] Ð¿Ñ€Ð¸Ð¹Ð½ÑÑ‚Ð¾\n   > [!options] Ð¿Ñ€Ð¸Ð¹Ð½ÑÑ‚Ð¸Ð¹ | Ð¿Ñ€Ð¸Ð¹Ð½ÑÑ‚Ð¾ | Ð¿Ñ€Ð¸Ð¹Ð½ÑÑ‚Ð° | Ð¿Ñ€Ð¸Ð¹Ð½ÑÑ‚Ðµ\n   > [!explanation] Impersonal form doesn't change: Ñ€Ñ–ÑˆÐµÐ½Ð½Ñ Ð¿Ñ€Ð¸Ð¹Ð½ÑÑ‚Ð¾ (not Ð¿Ñ€Ð¸Ð¹Ð½ÑÑ‚Ð¸Ð¹).\n\n3. Ð•ÐºÑÐ¿ÐµÑ€Ð¸Ð¼ÐµÐ½Ñ‚ Ð¿Ñ€Ð¾Ð²Ð¾Ð´ÑÑ‚ÑŒ Ñƒ Ð»Ð°Ð±Ð¾Ñ€Ð°Ñ‚Ð¾Ñ€Ñ–Ñ— Ð²Ñ‡ÐµÐ½Ð¸Ð¼Ð¸.\n   > [!error] Ð¿Ñ€Ð¾Ð²Ð¾Ð´ÑÑ‚ÑŒ\n   > [!answer] Ð¿Ñ€Ð¾Ð²Ð¾Ð´Ð¸Ñ‚ÑŒÑÑ\n   > [!options] Ð¿Ñ€Ð¾Ð²Ð¾Ð´ÑÑ‚ÑŒ | Ð¿Ñ€Ð¾Ð²Ð¾Ð´Ð¸Ñ‚ÑŒÑÑ | Ð¿Ñ€Ð¾Ð²Ð¾Ð´Ð¸Ð»Ð¸ | Ð¿Ñ€Ð¾Ð²ÐµÐ´ÐµÐ½Ð¾\n   > [!explanation] Reflexive form for passive with agent: Ð¿Ñ€Ð¾Ð²Ð¾Ð´Ð¸Ñ‚ÑŒÑÑ Ð²Ñ‡ÐµÐ½Ð¸Ð¼Ð¸.\n\n4. ÐœÐµÐ½Ðµ ÑÐºÐ°Ð·Ð°Ð»Ð¸ Ð¿Ñ€Ð¾ Ð·Ð±Ð¾Ñ€Ð¸ Ð·Ð°Ð²Ñ‚Ñ€Ð°.\n   > [!error] ÐœÐµÐ½Ðµ\n   > [!answer] ÐœÐµÐ½Ñ–\n   > [!options] ÐœÐµÐ½Ðµ | ÐœÐµÐ½Ñ– | ÐœÐ½Ð¾ÑŽ | Ð¯\n   > [!explanation] After \"ÑÐºÐ°Ð·Ð°Ð»Ð¸\" the recipient takes dative: Ð¼ÐµÐ½Ñ– ÑÐºÐ°Ð·Ð°Ð»Ð¸.\n\n5. Ð”Ð¾ÐºÑƒÐ¼ÐµÐ½Ñ‚ Ð±ÑƒÐ»Ð° Ð¿Ñ–Ð´Ð¿Ð¸ÑÐ°Ð½Ð° Ð´Ð¸Ñ€ÐµÐºÑ‚Ð¾Ñ€Ð¾Ð¼.\n   > [!error] Ð±ÑƒÐ»Ð°\n   > [!answer] Ð±ÑƒÐ²\n   > [!options] Ð±ÑƒÐ»Ð° | Ð±ÑƒÐ² | Ð±ÑƒÐ»Ð¾ | Ð±ÑƒÐ»Ð¸\n   > [!explanation] Ð”Ð¾ÐºÑƒÐ¼ÐµÐ½Ñ‚ is masculine, so Ð±ÑƒÐ² (not Ð±ÑƒÐ»Ð°).\n\n6. Ð Ð¾Ð±Ð¾Ñ‚Ñƒ Ð·Ð°Ð²ÐµÑ€ÑˆÐµÐ½Ð° Ð²Ñ‡Ð°ÑÐ½Ð¾.\n   > [!error] Ð·Ð°Ð²ÐµÑ€ÑˆÐµÐ½Ð°\n   > [!answer] Ð·Ð°Ð²ÐµÑ€ÑˆÐµÐ½Ð¾\n   > [!options] Ð·Ð°Ð²ÐµÑ€ÑˆÐµÐ½Ð° | Ð·Ð°Ð²ÐµÑ€ÑˆÐµÐ½Ð¾ | Ð·Ð°Ð²ÐµÑ€ÑˆÐµÐ½Ð¸Ð¹ | Ð·Ð°Ð²ÐµÑ€ÑˆÑƒÑŽÑ‚ÑŒ\n   > [!explanation] With accusative object (Ñ€Ð¾Ð±Ð¾Ñ‚Ñƒ), use -Ð½Ð¾/-Ñ‚Ð¾: Ñ€Ð¾Ð±Ð¾Ñ‚Ñƒ Ð·Ð°Ð²ÐµÑ€ÑˆÐµÐ½Ð¾.\n\n7. Ð¦Ñ Ð¿Ñ€Ð¾Ð±Ð»ÐµÐ¼Ð° Ð²Ð¸Ð²Ñ‡Ð°ÑŽÑ‚ÑŒ Ð½Ð°ÑƒÐºÐ¾Ð²Ñ†ÑÐ¼Ð¸.\n   > [!error] Ð²Ð¸Ð²Ñ‡Ð°ÑŽÑ‚ÑŒ\n   > [!answer] Ð²Ð¸Ð²Ñ‡Ð°Ñ”Ñ‚ÑŒÑÑ\n   > [!options] Ð²Ð¸Ð²Ñ‡Ð°ÑŽÑ‚ÑŒ | Ð²Ð¸Ð²Ñ‡Ð°Ñ”Ñ‚ÑŒÑÑ | Ð²Ð¸Ð²Ñ‡ÐµÐ½Ð¾ | Ð²Ð¸Ð²Ñ‡ÐµÐ½Ð°\n   > [!explanation] Reflexive form with agent: Ð²Ð¸Ð²Ñ‡Ð°Ñ”Ñ‚ÑŒÑÑ Ð½Ð°ÑƒÐºÐ¾Ð²Ñ†ÑÐ¼Ð¸.\n\n8. Ð™Ð¾Ð¼Ñƒ Ð¿Ð¾Ð¾Ð±Ñ–Ñ†ÑÑ‚Ð¸ Ð¿Ñ–Ð´Ð²Ð¸Ñ‰ÐµÐ½Ð½Ñ.\n   > [!error] Ð¿Ð¾Ð¾Ð±Ñ–Ñ†ÑÑ‚Ð¸\n   > [!answer] Ð¿Ð¾Ð¾Ð±Ñ–Ñ†ÑÐ»Ð¸\n   > [!options] Ð¿Ð¾Ð¾Ð±Ñ–Ñ†ÑÑ‚Ð¸ | Ð¿Ð¾Ð¾Ð±Ñ–Ñ†ÑÐ»Ð¸ | Ð¿Ð¾Ð¾Ð±Ñ–Ñ†ÑÐ² | Ð¾Ð±Ñ–Ñ†ÑÐ½Ð¾\n   > [!explanation] Third person plural: Ð¹Ð¾Ð¼Ñƒ Ð¿Ð¾Ð¾Ð±Ñ–Ñ†ÑÐ»Ð¸ (past tense).\n\n9. Ð¡Ñ‚Ð°Ñ‚Ñ‚Ñ Ð¾Ð¿ÑƒÐ±Ð»Ñ–ÐºÐ¾Ð²Ð°Ð½Ð¾ Ð² Ð¶ÑƒÑ€Ð½Ð°Ð»Ñ–.\n   > [!error] Ð¾Ð¿ÑƒÐ±Ð»Ñ–ÐºÐ¾Ð²Ð°Ð½Ð¾\n   > [!answer] Ð¾Ð¿ÑƒÐ±Ð»Ñ–ÐºÐ¾Ð²Ð°Ð½Ð°\n   > [!options] Ð¾Ð¿ÑƒÐ±Ð»Ñ–ÐºÐ¾Ð²Ð°Ð½Ð¾ | Ð¾Ð¿ÑƒÐ±Ð»Ñ–ÐºÐ¾Ð²Ð°Ð½Ð° | Ð¾Ð¿ÑƒÐ±Ð»Ñ–ÐºÐ¾Ð²Ð°Ð½Ð¸Ð¹ | Ð¿ÑƒÐ±Ð»Ñ–ÐºÑƒÑ”Ñ‚ÑŒÑÑ\n   > [!explanation] Ð¡Ñ‚Ð°Ñ‚Ñ‚Ñ (f.) takes participial form: ÑÑ‚Ð°Ñ‚Ñ‚Ñ Ð¾Ð¿ÑƒÐ±Ð»Ñ–ÐºÐ¾Ð²Ð°Ð½Ð°.\n\n10. ÐÐ°Ñ Ð·Ð°Ð¿Ñ€Ð¾ÑÐ¸Ð»Ð¸ Ð½Ð° Ð²ÐµÑ‡Ñ–Ñ€ÐºÑƒ. (Ð±ÐµÐ· Ð¿Ð¾Ð¼Ð¸Ð»ÐºÐ¸)\n    > [!error] none\n    > [!answer] âœ“\n    > [!options] ÐÐ°Ñ | ÐÐ°Ð¼ | ÐÐ°Ð¼Ð¸ | âœ“\n    > [!explanation] Ð ÐµÑ‡ÐµÐ½Ð½Ñ Ð¿Ñ€Ð°Ð²Ð¸Ð»ÑŒÐ½Ðµ: Ð½Ð°Ñ Ñƒ Ð·Ð½Ð°Ñ…Ñ–Ð´Ð½Ð¾Ð¼Ñƒ Ð²Ñ–Ð´Ð¼Ñ–Ð½ÐºÑƒ Ð¿Ñ–ÑÐ»Ñ Ð·Ð°Ð¿Ñ€Ð¾ÑÐ¸Ð»Ð¸.\n\n11. Ð—Ð°ÐºÐ¾Ð½ Ð·Ð°ÑÑ‚Ð¾ÑÐ¾Ð²ÑƒÑŽÑ‚ÑŒ Ð´Ð¾ Ð²ÑÑ–Ñ… Ð³Ñ€Ð¾Ð¼Ð°Ð´ÑÐ½.\n    > [!error] Ð·Ð°ÑÑ‚Ð¾ÑÐ¾Ð²ÑƒÑŽÑ‚ÑŒ\n    > [!answer] Ð·Ð°ÑÑ‚Ð¾ÑÐ¾Ð²ÑƒÑ”Ñ‚ÑŒÑÑ\n    > [!options] Ð·Ð°ÑÑ‚Ð¾ÑÐ¾Ð²ÑƒÑŽÑ‚ÑŒ | Ð·Ð°ÑÑ‚Ð¾ÑÐ¾Ð²ÑƒÑ”Ñ‚ÑŒÑÑ | Ð·Ð°ÑÑ‚Ð¾ÑÐ¾Ð²Ð°Ð½Ð¾ | Ð·Ð°ÑÑ‚Ð¾ÑÐ¾Ð²Ð°Ð½Ð¸Ð¹\n    > [!explanation] For passive, use reflexive form: Ð·Ð°ÐºÐ¾Ð½ Ð·Ð°ÑÑ‚Ð¾ÑÐ¾Ð²ÑƒÑ”Ñ‚ÑŒÑÑ.\n\n12. ÐšÐ½Ð¸Ð³Ñƒ Ð½Ð°Ð¿Ð¸ÑÐ°Ð½Ð¸Ð¹ Ð²Ñ–Ð´Ð¾Ð¼Ð¸Ð¼ Ð°Ð²Ñ‚Ð¾Ñ€Ð¾Ð¼.\n    > [!error] Ð½Ð°Ð¿Ð¸ÑÐ°Ð½Ð¸Ð¹\n    > [!answer] Ð½Ð°Ð¿Ð¸ÑÐ°Ð½Ð°\n    > [!options] Ð½Ð°Ð¿Ð¸ÑÐ°Ð½Ð¸Ð¹ | Ð½Ð°Ð¿Ð¸ÑÐ°Ð½Ð° | Ð½Ð°Ð¿Ð¸ÑÐ°Ð½Ð¾ | Ð½Ð°Ð¿Ð¸ÑÐ°Ð»Ð¸\n    > [!explanation] If object in nominative (ÐºÐ½Ð¸Ð³Ð°), participle agrees: ÐºÐ½Ð¸Ð³Ð° Ð½Ð°Ð¿Ð¸ÑÐ°Ð½Ð°.\n\n13. Ð Ñ–ÑˆÐµÐ½Ð½Ñ Ð±ÑƒÐ»Ð¾ Ð¿Ñ€Ð¸Ð¹Ð½ÑÑ‚Ñ– ÐºÐ¾Ð¼Ñ–ÑÑ–Ñ”ÑŽ.\n    > [!error] Ð¿Ñ€Ð¸Ð¹Ð½ÑÑ‚Ñ–\n    > [!answer] Ð¿Ñ€Ð¸Ð¹Ð½ÑÑ‚Ð¾\n    > [!options] Ð¿Ñ€Ð¸Ð¹Ð½ÑÑ‚Ñ– | Ð¿Ñ€Ð¸Ð¹Ð½ÑÑ‚Ð¾ | Ð¿Ñ€Ð¸Ð¹Ð½ÑÑ‚Ðµ | Ð¿Ñ€Ð¸Ð¹Ð½ÑÑ‚Ð¸Ð¹\n    > [!explanation] Ð Ñ–ÑˆÐµÐ½Ð½Ñ is singular, so Ð¿Ñ€Ð¸Ð¹Ð½ÑÑ‚Ð¾ (or Ð¿Ñ€Ð¸Ð¹Ð½ÑÑ‚Ðµ), not Ð¿Ñ€Ð¸Ð¹Ð½ÑÑ‚Ñ–.\n\n14. Ð”Ð°Ð½Ñ– Ð·Ð±Ð¸Ñ€Ð°Ñ”Ñ‚ÑŒÑÑ Ð°Ð²Ñ‚Ð¾Ð¼Ð°Ñ‚Ð¸Ñ‡Ð½Ð¾.\n    > [!error] Ð·Ð±Ð¸Ñ€Ð°Ñ”Ñ‚ÑŒÑÑ\n    > [!answer] Ð·Ð±Ð¸Ñ€Ð°ÑŽÑ‚ÑŒÑÑ\n    > [!options] Ð·Ð±Ð¸Ñ€Ð°Ñ”Ñ‚ÑŒÑÑ | Ð·Ð±Ð¸Ñ€Ð°ÑŽÑ‚ÑŒÑÑ | Ð·Ñ–Ð±Ñ€Ð°Ð½Ð¾ | Ð·Ñ–Ð±Ñ€Ð°Ð½Ñ–\n    > [!explanation] Ð”Ð°Ð½Ñ– is plural, so verb in plural: Ð´Ð°Ð½Ñ– Ð·Ð±Ð¸Ñ€Ð°ÑŽÑ‚ÑŒÑÑ.\n\n15. Ð‡Ð¹ Ð¿Ð¾Ð´Ð°Ñ€Ð¾Ð²Ð°Ð½Ð¾ ÐºÐ²Ñ–Ñ‚Ð¸ Ð½Ð° Ð´ÐµÐ½ÑŒ Ð½Ð°Ñ€Ð¾Ð´Ð¶ÐµÐ½Ð½Ñ.\n    > [!error] Ð¿Ð¾Ð´Ð°Ñ€Ð¾Ð²Ð°Ð½Ð¾\n    > [!answer] Ð¿Ð¾Ð´Ð°Ñ€ÑƒÐ²Ð°Ð»Ð¸\n    > [!options] Ð¿Ð¾Ð´Ð°Ñ€Ð¾Ð²Ð°Ð½Ð¾ | Ð¿Ð¾Ð´Ð°Ñ€ÑƒÐ²Ð°Ð»Ð¸ | Ð¿Ð¾Ð´Ð°Ñ€Ð¾Ð²Ð°Ð½Ð° | Ð´Ð°Ñ€ÑƒÑ”Ñ‚ÑŒÑÑ\n    > [!explanation] With dative (Ñ—Ð¹), use 3rd person plural: Ñ—Ð¹ Ð¿Ð¾Ð´Ð°Ñ€ÑƒÐ²Ð°Ð»Ð¸.\n\n16. Ð—Ð°ÑÑ–Ð´Ð°Ð½Ð½Ñ Ð¾Ð³Ð¾Ð»Ð¾ÑˆÐµÐ½Ð¸Ð¹ Ð·Ð°ÐºÑ€Ð¸Ñ‚Ð¸Ð¼.\n    > [!error] Ð¾Ð³Ð¾Ð»Ð¾ÑˆÐµÐ½Ð¸Ð¹\n    > [!answer] Ð¾Ð³Ð¾Ð»Ð¾ÑˆÐµÐ½Ð¾\n    > [!options] Ð¾Ð³Ð¾Ð»Ð¾ÑˆÐµÐ½Ð¸Ð¹ | Ð¾Ð³Ð¾Ð»Ð¾ÑˆÐµÐ½Ð¾ | Ð¾Ð³Ð¾Ð»Ð¾ÑˆÐµÐ½Ð° | Ð¾Ð³Ð¾Ð»Ð¾ÑˆÑƒÑŽÑ‚ÑŒ\n    > [!explanation] Impersonal form: Ð·Ð°ÑÑ–Ð´Ð°Ð½Ð½Ñ Ð¾Ð³Ð¾Ð»Ð¾ÑˆÐµÐ½Ð¾ Ð·Ð°ÐºÑ€Ð¸Ñ‚Ð¸Ð¼.\n\n## cloze: ÐžÑ„Ñ–Ñ†Ñ–Ð¹Ð½Ð¸Ð¹ Ð´Ð¾ÐºÑƒÐ¼ÐµÐ½Ñ‚\n> Ð—Ð°Ð¿Ð¾Ð²Ð½Ñ–Ñ‚ÑŒ Ð¿Ñ€Ð¾Ð¿ÑƒÑÐºÐ¸ Ñƒ Ð´Ð¾ÐºÑƒÐ¼ÐµÐ½Ñ‚Ñ–.\n\nÐÐÐšÐÐ— â„– 45. ÐŸÑ€Ð¾ Ð¿Ñ€Ð¸Ð·Ð½Ð°Ñ‡ÐµÐ½Ð½Ñ Ð½Ð° Ð¿Ð¾ÑÐ°Ð´Ñƒ. ÐÐ° Ð¿Ñ–Ð´ÑÑ‚Ð°Ð²Ñ– Ð·Ð°ÑÐ²Ð¸ Ð³Ñ€Ð¾Ð¼Ð°Ð´ÑÐ½Ð¸Ð½Ð° ÐŸÐµÑ‚Ñ€ÐµÐ½ÐºÐ° Ð†.Ð’. Ñ‚Ð° Ñ€Ñ–ÑˆÐµÐ½Ð½Ñ ÐºÐ¾Ð¼Ñ–ÑÑ–Ñ— Ð²Ñ–Ð´ 15 Ð³Ñ€ÑƒÐ´Ð½Ñ 2024 Ñ€Ð¾ÐºÑƒ. ÐÐÐšÐÐ—Ð£Ð®: ÐŸÐµÑ‚Ñ€ÐµÐ½ÐºÐ° Ð†Ð²Ð°Ð½Ð° Ð’Ð°ÑÐ¸Ð»ÑŒÐ¾Ð²Ð¸Ñ‡Ð° [___:1] Ð½Ð° Ð¿Ð¾ÑÐ°Ð´Ñƒ ÑÑ‚Ð°Ñ€ÑˆÐ¾Ð³Ð¾ ÑÐ¿ÐµÑ†Ñ–Ð°Ð»Ñ–ÑÑ‚Ð°. ÐžÐºÐ»Ð°Ð´ [___:2] Ñƒ Ñ€Ð¾Ð·Ð¼Ñ–Ñ€Ñ– 25 000 Ð³Ñ€Ð¸Ð²ÐµÐ½ÑŒ. Ð’Ñ–Ð´Ð´Ñ–Ð»Ñƒ ÐºÐ°Ð´Ñ€Ñ–Ð² [___:3] Ð¾Ñ„Ð¾Ñ€Ð¼Ð»ÐµÐ½Ð½Ñ Ð´Ð¾ÐºÑƒÐ¼ÐµÐ½Ñ‚Ñ–Ð². ÐšÐ¾Ð½Ñ‚Ñ€Ð¾Ð»ÑŒ Ð·Ð° Ð²Ð¸ÐºÐ¾Ð½Ð°Ð½Ð½ÑÐ¼ Ð½Ð°ÐºÐ°Ð·Ñƒ [___:4] Ð½Ð° Ð·Ð°ÑÑ‚ÑƒÐ¿Ð½Ð¸ÐºÐ° Ð´Ð¸Ñ€ÐµÐºÑ‚Ð¾Ñ€Ð°. ÐÐ°ÐºÐ°Ð· [___:5] Ð´Ð¾ Ð²Ñ–Ð´Ð¾Ð¼Ð° Ð²ÑÑ–Ñ… Ð¿Ñ–Ð´Ñ€Ð¾Ð·Ð´Ñ–Ð»Ñ–Ð². ÐšÐ¾Ð¿Ñ–ÑŽ Ð½Ð°ÐºÐ°Ð·Ñƒ [___:6] Ð´Ð¾ Ð¾ÑÐ¾Ð±Ð¾Ð²Ð¾Ñ— ÑÐ¿Ñ€Ð°Ð²Ð¸.\n\n1. Ð¿Ñ€Ð¸Ð·Ð½Ð°Ñ‡ÐµÐ½Ð¾ | Ð¿Ñ€Ð¸Ð·Ð½Ð°Ñ‡ÐµÐ½Ð¸Ð¹ | Ð¿Ñ€Ð¸Ð·Ð½Ð°Ñ‡Ð°ÑŽÑ‚ÑŒ | Ð¿Ñ€Ð¸Ð·Ð½Ð°Ñ‡Ð¸Ñ‚Ð¸\n   > [!answer] Ð¿Ñ€Ð¸Ð·Ð½Ð°Ñ‡ÐµÐ½Ð¾\n\n2. Ð²ÑÑ‚Ð°Ð½Ð¾Ð²Ð»ÐµÐ½Ð¾ | Ð²ÑÑ‚Ð°Ð½Ð¾Ð²Ð»ÐµÐ½Ð¸Ð¹ | Ð²ÑÑ‚Ð°Ð½Ð¾Ð²Ð»ÑŽÑ”Ñ‚ÑŒÑÑ | Ð²ÑÑ‚Ð°Ð½Ð¾Ð²Ð¸Ð»Ð¸\n   > [!answer] Ð²ÑÑ‚Ð°Ð½Ð¾Ð²Ð»ÐµÐ½Ð¾\n\n3. Ð·Ð°Ð±ÐµÐ·Ð¿ÐµÑ‡Ð¸Ñ‚Ð¸ | Ð·Ð°Ð±ÐµÐ·Ð¿ÐµÑ‡ÐµÐ½Ð¾ | Ð·Ð°Ð±ÐµÐ·Ð¿ÐµÑ‡ÑƒÑ”Ñ‚ÑŒÑÑ | Ð·Ð°Ð±ÐµÐ·Ð¿ÐµÑ‡Ð¸Ð»Ð¸\n   > [!answer] Ð·Ð°Ð±ÐµÐ·Ð¿ÐµÑ‡Ð¸Ñ‚Ð¸\n\n4. Ð¿Ð¾ÐºÐ»Ð°Ð´ÐµÐ½Ð¾ | Ð¿Ð¾ÐºÐ»Ð°Ð´ÐµÐ½Ð¸Ð¹ | Ð¿Ð¾ÐºÐ»Ð°Ð´Ð°Ñ”Ñ‚ÑŒÑÑ | Ð¿Ð¾ÐºÐ»Ð°Ð»Ð¸\n   > [!answer] Ð¿Ð¾ÐºÐ»Ð°Ð´ÐµÐ½Ð¾\n\n5. Ð´Ð¾Ð²ÐµÑÑ‚Ð¸ | Ð´Ð¾Ð²ÐµÐ´ÐµÐ½Ð¾ | Ð´Ð¾Ð²Ð¾Ð´Ð¸Ñ‚ÑŒÑÑ | Ð´Ð¾Ð²ÐµÐ»Ð¸\n   > [!answer] Ð´Ð¾Ð²ÐµÑÑ‚Ð¸\n\n6. Ð´Ð¾Ð»ÑƒÑ‡ÐµÐ½Ð¾ | Ð´Ð¾Ð»ÑƒÑ‡ÐµÐ½Ð¸Ð¹ | Ð´Ð¾Ð»ÑƒÑ‡Ð°Ñ”Ñ‚ÑŒÑÑ | Ð´Ð¾Ð»ÑƒÑ‡Ð¸Ð»Ð¸\n   > [!answer] Ð´Ð¾Ð»ÑƒÑ‡ÐµÐ½Ð¾\n\n## mark-the-words: ÐŸÐ°ÑÐ¸Ð²Ð½Ñ– ÐºÐ¾Ð½ÑÑ‚Ñ€ÑƒÐºÑ†Ñ–Ñ—\n> ÐšÐ»Ð°Ñ†Ð½Ñ–Ñ‚ÑŒ ÑƒÑÑ– Ð¿Ð°ÑÐ¸Ð²Ð½Ñ– Ð´Ñ–Ñ”ÑÐ»Ñ–Ð²Ð½Ñ– Ñ„Ð¾Ñ€Ð¼Ð¸.\n\nÐ£ Ð·Ð²Ñ–Ñ‚Ñ– [Ð·Ð°Ð·Ð½Ð°Ñ‡ÐµÐ½Ð¾], Ñ‰Ð¾ Ð¿Ñ€Ð¾ÐµÐºÑ‚ [Ð±ÑƒÐ² Ð·Ð°Ð²ÐµÑ€ÑˆÐµÐ½Ð¸Ð¹] Ð²Ñ‡Ð°ÑÐ½Ð¾. Ð£ÑÑ– Ð·Ð°Ð²Ð´Ð°Ð½Ð½Ñ [Ð²Ð¸ÐºÐ¾Ð½Ð°Ð½Ð¾], Ð´Ð°Ð½Ñ– [Ð¿Ñ€Ð¾Ð°Ð½Ð°Ð»Ñ–Ð·Ð¾Ð²Ð°Ð½Ð¾] Ñ– Ñ€ÐµÐ·ÑƒÐ»ÑŒÑ‚Ð°Ñ‚Ð¸ [Ð¾Ð¿ÑƒÐ±Ð»Ñ–ÐºÐ¾Ð²Ð°Ð½Ð¾] Ð² Ð¶ÑƒÑ€Ð½Ð°Ð»Ñ–. Ð”Ð¾ÑÐ»Ñ–Ð´Ð¶ÐµÐ½Ð½Ñ [Ð¿Ñ€Ð¾Ð²Ð¾Ð´Ð¸Ð»Ð¾ÑÑ] Ð¿Ñ€Ð¾Ñ‚ÑÐ³Ð¾Ð¼ Ð´Ð²Ð¾Ñ… Ñ€Ð¾ÐºÑ–Ð², Ñ– Ð½Ð¾Ð²Ñ– Ð¼ÐµÑ‚Ð¾Ð´Ð¸ [Ñ€Ð¾Ð·Ñ€Ð¾Ð±Ð»ÐµÐ½Ð¾] ÐºÐ¾Ð¼Ð°Ð½Ð´Ð¾ÑŽ. [Ð‘ÑƒÐ»Ð¾ Ð²ÑÑ‚Ð°Ð½Ð¾Ð²Ð»ÐµÐ½Ð¾], Ñ‰Ð¾ ÐµÑ„ÐµÐºÑ‚Ð¸Ð²Ð½Ñ–ÑÑ‚ÑŒ [Ð¿Ñ–Ð´Ð²Ð¸Ñ‰Ð¸Ð»Ð°ÑÑ] Ð½Ð° 30%.\n\n> 8 passive forms: Ð·Ð°Ð·Ð½Ð°Ñ‡ÐµÐ½Ð¾, Ð±ÑƒÐ² Ð·Ð°Ð²ÐµÑ€ÑˆÐµÐ½Ð¸Ð¹, Ð²Ð¸ÐºÐ¾Ð½Ð°Ð½Ð¾, Ð¿Ñ€Ð¾Ð°Ð½Ð°Ð»Ñ–Ð·Ð¾Ð²Ð°Ð½Ð¾, Ð¾Ð¿ÑƒÐ±Ð»Ñ–ÐºÐ¾Ð²Ð°Ð½Ð¾, Ð¿Ñ€Ð¾Ð²Ð¾Ð´Ð¸Ð»Ð¾ÑÑ, Ñ€Ð¾Ð·Ñ€Ð¾Ð±Ð»ÐµÐ½Ð¾, Ð‘ÑƒÐ»Ð¾ Ð²ÑÑ‚Ð°Ð½Ð¾Ð²Ð»ÐµÐ½Ð¾\n\n## dialogue-reorder: Ð Ð¾Ð·Ð¼Ð¾Ð²Ð° Ð² Ð¾Ñ„Ñ–ÑÑ–\n> Ð Ð¾Ð·ÑÑ‚Ð°Ð²Ñ‚Ðµ Ñ€ÐµÐ¿Ð»Ñ–ÐºÐ¸ Ð´Ñ–Ð°Ð»Ð¾Ð³Ñƒ Ñƒ Ð¿Ñ€Ð°Ð²Ð¸Ð»ÑŒÐ½Ð¾Ð¼Ñƒ Ð¿Ð¾Ñ€ÑÐ´ÐºÑƒ.\n\n- Ð: Ð”Ð¾Ð±Ñ€Ð¸Ð¹ Ð´ÐµÐ½ÑŒ! Ð©Ð¾ Ð½Ð¾Ð²Ð¾Ð³Ð¾ Ð· Ð½Ð°ÑˆÐ¸Ð¼ Ð¿Ñ€Ð¾ÐµÐºÑ‚Ð¾Ð¼?\n- Ð‘: Ð”Ð¾Ð±Ñ€Ð¸Ð¹ Ð´ÐµÐ½ÑŒ! ÐŸÑ€Ð¾ÐµÐºÑ‚ Ð·Ð°Ñ‚Ð²ÐµÑ€Ð´Ð¶ÐµÐ½Ð¾ Ð¼Ð¸Ð½ÑƒÐ»Ð¾Ð³Ð¾ Ñ‚Ð¸Ð¶Ð½Ñ.\n- Ð: Ð§ÑƒÐ´Ð¾Ð²Ð¾! Ð Ñ‰Ð¾ Ð· Ð±ÑŽÐ´Ð¶ÐµÑ‚Ð¾Ð¼?\n- Ð‘: Ð‘ÑŽÐ´Ð¶ÐµÑ‚ Ñ‰Ðµ Ñ€Ð¾Ð·Ð³Ð»ÑÐ´Ð°Ñ”Ñ‚ÑŒÑÑ Ñ„Ñ–Ð½Ð°Ð½ÑÐ¾Ð²Ð¸Ð¼ Ð²Ñ–Ð´Ð´Ñ–Ð»Ð¾Ð¼.\n- Ð: Ð—Ñ€Ð¾Ð·ÑƒÐ¼Ñ–Ð»Ð¾. ÐšÐ¾Ð»Ð¸ Ð¾Ñ‡Ñ–ÐºÑƒÑ”Ñ‚ÑŒÑÑ Ð¾ÑÑ‚Ð°Ñ‚Ð¾Ñ‡Ð½Ðµ Ñ€Ñ–ÑˆÐµÐ½Ð½Ñ?\n- Ð‘: ÐÐ°Ð¼ Ð¿Ð¾Ð¾Ð±Ñ–Ñ†ÑÐ»Ð¸ Ð²Ñ–Ð´Ð¿Ð¾Ð²Ñ–Ð´ÑŒ Ð´Ð¾ ÐºÑ–Ð½Ñ†Ñ Ð¼Ñ–ÑÑÑ†Ñ.\n- Ð: Ð”Ð¾Ð±Ñ€Ðµ. Ð Ð´Ð¾ÐºÑƒÐ¼ÐµÐ½Ñ‚Ð¸ Ð²Ð¶Ðµ Ð¿Ñ–Ð´Ð³Ð¾Ñ‚Ð¾Ð²Ð»ÐµÐ½Ð¾?\n- Ð‘: Ð¢Ð°Ðº, ÑƒÑÑ– Ð´Ð¾ÐºÑƒÐ¼ÐµÐ½Ñ‚Ð¸ Ð¿Ñ–Ð´Ð¿Ð¸ÑÐ°Ð½Ð¾ Ñ– Ð½Ð°Ð´Ñ–ÑÐ»Ð°Ð½Ð¾.\n\n## select: ÐžÐ±ÐµÑ€Ñ–Ñ‚ÑŒ Ð¿Ñ€Ð°Ð²Ð¸Ð»ÑŒÐ½Ñ– Ð²Ð°Ñ€Ñ–Ð°Ð½Ñ‚Ð¸\n> ÐžÐ±ÐµÑ€Ñ–Ñ‚ÑŒ Ð£Ð¡Ð† Ð¿Ñ€Ð°Ð²Ð¸Ð»ÑŒÐ½Ñ– Ð²Ð°Ñ€Ñ–Ð°Ð½Ñ‚Ð¸.\n\n1. Ð¯ÐºÑ– Ñ„Ð¾Ñ€Ð¼Ð¸ Ñ” Ð¿Ð°ÑÐ¸Ð²Ð½Ð¸Ð¼Ð¸?\n   - [x] ÐšÐ½Ð¸Ð³Ð° Ð½Ð°Ð¿Ð¸ÑÐ°Ð½Ð° Ð°Ð²Ñ‚Ð¾Ñ€Ð¾Ð¼.\n   - [x] ÐšÐ½Ð¸Ð³Ñƒ Ð½Ð°Ð¿Ð¸ÑÐ°Ð½Ð¾.\n   - [x] ÐšÐ½Ð¸Ð³Ñƒ Ð½Ð°Ð¿Ð¸ÑÐ°Ð»Ð¸.\n   - [ ] ÐÐ²Ñ‚Ð¾Ñ€ Ð½Ð°Ð¿Ð¸ÑÐ°Ð² ÐºÐ½Ð¸Ð³Ñƒ.\n   > Three are passive, the last one is active.\n\n2. Ð¯ÐºÑ– Ñ€ÐµÑ‡ÐµÐ½Ð½Ñ Ð² Ð¾Ñ„Ñ–Ñ†Ñ–Ð¹Ð½Ð¾-Ð´Ñ–Ð»Ð¾Ð²Ð¾Ð¼Ñƒ ÑÑ‚Ð¸Ð»Ñ–?\n   - [x] Ð Ñ–ÑˆÐµÐ½Ð½Ñ Ð¿Ñ€Ð¸Ð¹Ð½ÑÑ‚Ð¾.\n   - [ ] ÐœÐµÐ½Ñ– ÑÐºÐ°Ð·Ð°Ð»Ð¸ Ð¿Ñ€Ð¾ Ñ€Ñ–ÑˆÐµÐ½Ð½Ñ.\n   - [x] ÐÐ°ÐºÐ°Ð· Ð²Ð¸Ð´Ð°Ð½Ð¾ Ð´Ð¸Ñ€ÐµÐºÑ‚Ð¾Ñ€Ð¾Ð¼.\n   - [ ] Ð”Ð¸Ñ€ÐµÐºÑ‚Ð¾Ñ€ Ð²Ð¸Ð´Ð°Ð² Ð½Ð°ÐºÐ°Ð·.\n   > The -Ð½Ð¾/-Ñ‚Ð¾ form characterizes official style.\n\n3. Ð¯ÐºÑ– Ñ„Ð¾Ñ€Ð¼Ð¸ Ð½Ð°Ð³Ð¾Ð»Ð¾ÑˆÑƒÑŽÑ‚ÑŒ Ð½Ð° Ð¿Ñ€Ð¾Ñ†ÐµÑÑ–?\n   - [ ] ÐšÐ½Ð¸Ð³Ð° Ð½Ð°Ð¿Ð¸ÑÐ°Ð½Ð°.\n   - [ ] ÐšÐ½Ð¸Ð³Ñƒ Ð½Ð°Ð¿Ð¸ÑÐ°Ð½Ð¾.\n   - [x] ÐšÐ½Ð¸Ð³Ð° Ð¿Ð¸ÑˆÐµÑ‚ÑŒÑÑ.\n   - [x] Ð”Ð¾ÑÐ»Ñ–Ð´Ð¶ÐµÐ½Ð½Ñ Ð¿Ñ€Ð¾Ð²Ð¾Ð´Ð¸Ñ‚ÑŒÑÑ.\n   > Reflexive form (-ÑÑ) emphasizes process.\n\n4. Ð¯ÐºÑ– Ñ€ÐµÑ‡ÐµÐ½Ð½Ñ Ð¿Ñ€Ð°Ð²Ð¸Ð»ÑŒÐ½Ñ–?\n   - [x] ÐšÐ½Ð¸Ð³Ñƒ Ð½Ð°Ð¿Ð¸ÑÐ°Ð½Ð¾.\n   - [ ] ÐšÐ½Ð¸Ð³Ð° Ð½Ð°Ð¿Ð¸ÑÐ°Ð½Ð¾.\n   - [x] ÐšÐ½Ð¸Ð³Ð° Ð½Ð°Ð¿Ð¸ÑÐ°Ð½Ð°.\n   - [ ] ÐšÐ½Ð¸Ð³Ð¸ Ð½Ð°Ð¿Ð¸ÑÐ°Ð½Ð¾ Ð°Ð²Ñ‚Ð¾Ñ€Ð¾Ð¼.\n   > Impersonal form requires accusative case.\n\n5. Ð’ ÑÐºÐ¸Ñ… Ñ€ÐµÑ‡ÐµÐ½Ð½ÑÑ… Ð²Ð¸Ñ€Ð°Ð¶ÐµÐ½Ð¾ Ð°Ð³ÐµÐ½Ñ‚Ð°?\n   - [x] ÐšÐ½Ð¸Ð³Ð° Ð½Ð°Ð¿Ð¸ÑÐ°Ð½Ð° Ð°Ð²Ñ‚Ð¾Ñ€Ð¾Ð¼.\n   - [ ] ÐšÐ½Ð¸Ð³Ñƒ Ð½Ð°Ð¿Ð¸ÑÐ°Ð½Ð¾.\n   - [x] ÐŸÑ€Ð¾Ð±Ð»ÐµÐ¼Ð° Ð²Ð¸Ð²Ñ‡Ð°Ñ”Ñ‚ÑŒÑÑ Ð½Ð°ÑƒÐºÐ¾Ð²Ñ†ÑÐ¼Ð¸.\n   - [ ] ÐœÐµÐ½Ñ– ÑÐºÐ°Ð·Ð°Ð»Ð¸.\n   > Agent in instrumental: Ð°Ð²Ñ‚Ð¾Ñ€Ð¾Ð¼, Ð½Ð°ÑƒÐºÐ¾Ð²Ñ†ÑÐ¼Ð¸.\n\n6. Ð¯ÐºÑ– Ñ„Ð¾Ñ€Ð¼Ð¸ Ñ…Ð°Ñ€Ð°ÐºÑ‚ÐµÑ€Ð½Ñ– Ð´Ð»Ñ Ð½Ð°ÑƒÐºÐ¾Ð²Ð¾Ð³Ð¾ ÑÑ‚Ð¸Ð»ÑŽ?\n   - [ ] ÐœÐµÐ½Ñ– ÑÐºÐ°Ð·Ð°Ð»Ð¸.\n   - [x] Ð”Ð¾ÑÐ»Ñ–Ð´Ð¶ÑƒÑ”Ñ‚ÑŒÑÑ.\n   - [x] ÐŸÑ€Ð¾Ð²Ð¾Ð´Ð¸Ñ‚ÑŒÑÑ.\n   - [ ] Ð¡ÐºÐ°Ð·Ð°Ð½Ð¾.\n   > Reflexive form is typical for science.\n\n7. Ð¯ÐºÑ– Ð´Ñ–Ñ”Ð¿Ñ€Ð¸ÐºÐ¼ÐµÑ‚Ð½Ð¸ÐºÐ¸ ÑƒÐ·Ð³Ð¾Ð´Ð¶ÐµÐ½Ñ– Ð¿Ñ€Ð°Ð²Ð¸Ð»ÑŒÐ½Ð¾?\n   - [x] Ð›Ð¸ÑÑ‚ Ð½Ð°Ð¿Ð¸ÑÐ°Ð½Ð¸Ð¹.\n   - [x] ÐšÐ½Ð¸Ð³Ð° Ð½Ð°Ð¿Ð¸ÑÐ°Ð½Ð°.\n   - [ ] Ð¡Ð»Ð¾Ð²Ð¾ Ð½Ð°Ð¿Ð¸ÑÐ°Ð½Ð¸Ð¹.\n   - [x] Ð”Ð¾ÐºÑƒÐ¼ÐµÐ½Ñ‚Ð¸ Ð½Ð°Ð¿Ð¸ÑÐ°Ð½Ñ–.\n   > Ð¡Ð»Ð¾Ð²Ð¾ is neuter, so Ð½Ð°Ð¿Ð¸ÑÐ°Ð½Ðµ.\n\n8. Ð¯ÐºÑ– Ñ€ÐµÑ‡ÐµÐ½Ð½Ñ Ð² Ñ€Ð¾Ð·Ð¼Ð¾Ð²Ð½Ð¾Ð¼Ñƒ ÑÑ‚Ð¸Ð»Ñ–?\n   - [ ] Ð Ñ–ÑˆÐµÐ½Ð½Ñ Ð¿Ñ€Ð¸Ð¹Ð½ÑÑ‚Ð¾.\n   - [x] ÐœÐµÐ½Ñ– ÑÐºÐ°Ð·Ð°Ð»Ð¸.\n   - [x] Ð™Ð¾Ð¼Ñƒ Ð¿Ð¾Ð¾Ð±Ñ–Ñ†ÑÐ»Ð¸.\n   - [ ] Ð”Ð¾ÐºÑƒÐ¼ÐµÐ½Ñ‚ Ð¿Ñ–Ð´Ð¿Ð¸ÑÐ°Ð½Ð¾.\n   > Third person plural is colloquial style.\n\n## translate: ÐŸÐµÑ€ÐµÐºÐ»Ð°Ð´ Ð½Ð° ÑƒÐºÑ€Ð°Ñ—Ð½ÑÑŒÐºÑƒ\n> ÐžÐ±ÐµÑ€Ñ–Ñ‚ÑŒ Ð¿Ñ€Ð°Ð²Ð¸Ð»ÑŒÐ½Ð¸Ð¹ Ð¿ÐµÑ€ÐµÐºÐ»Ð°Ð´.\n\n1. The decision has been made.\n   - [ ] Ð Ñ–ÑˆÐµÐ½Ð½Ñ Ð·Ñ€Ð¾Ð±Ð¸Ð»Ð¸.\n   - [x] Ð Ñ–ÑˆÐµÐ½Ð½Ñ Ð¿Ñ€Ð¸Ð¹Ð½ÑÑ‚Ð¾.\n   - [ ] Ð Ñ–ÑˆÐµÐ½Ð½Ñ Ð¿Ñ€Ð¸Ð¹Ð¼Ð°Ñ”Ñ‚ÑŒÑÑ.\n   - [ ] Ð Ñ–ÑˆÐµÐ½Ð½Ñ Ð¿Ñ€Ð¸Ð¹Ð½ÑÐ»Ð¸.\n   > Official context â†’ impersonal form -Ð½Ð¾.\n\n2. I was told about the meeting.\n   - [ ] ÐœÐµÐ½Ðµ ÑÐºÐ°Ð·Ð°Ð»Ð¸ Ð¿Ñ€Ð¾ Ð·Ð±Ð¾Ñ€Ð¸.\n   - [x] ÐœÐµÐ½Ñ– ÑÐºÐ°Ð·Ð°Ð»Ð¸ Ð¿Ñ€Ð¾ Ð·Ð±Ð¾Ñ€Ð¸.\n   - [ ] ÐœÐ½Ð¾ÑŽ ÑÐºÐ°Ð·Ð°Ð½Ð¾ Ð¿Ñ€Ð¾ Ð·Ð±Ð¾Ñ€Ð¸.\n   - [ ] Ð¯ ÑÐºÐ°Ð·Ð°Ð² Ð¿Ñ€Ð¾ Ð·Ð±Ð¾Ñ€Ð¸.\n   > Recipient of information in dative: Ð¼ÐµÐ½Ñ– ÑÐºÐ°Ð·Ð°Ð»Ð¸.\n\n3. The book was written by a famous author.\n   - [x] ÐšÐ½Ð¸Ð³Ð° Ð½Ð°Ð¿Ð¸ÑÐ°Ð½Ð° Ð²Ñ–Ð´Ð¾Ð¼Ð¸Ð¼ Ð°Ð²Ñ‚Ð¾Ñ€Ð¾Ð¼.\n   - [ ] ÐšÐ½Ð¸Ð³Ñƒ Ð½Ð°Ð¿Ð¸ÑÐ°Ð½Ð¾ Ð²Ñ–Ð´Ð¾Ð¼Ð¸Ð¼ Ð°Ð²Ñ‚Ð¾Ñ€Ð¾Ð¼.\n   - [ ] ÐšÐ½Ð¸Ð³Ð° Ð¿Ð¸ÑˆÐµÑ‚ÑŒÑÑ Ð²Ñ–Ð´Ð¾Ð¼Ð¸Ð¼ Ð°Ð²Ñ‚Ð¾Ñ€Ð¾Ð¼.\n   - [ ] ÐšÐ½Ð¸Ð³Ñƒ Ð½Ð°Ð¿Ð¸ÑÐ°Ð»Ð¸ Ð²Ñ–Ð´Ð¾Ð¼Ð¸Ð¼ Ð°Ð²Ñ‚Ð¾Ñ€Ð¾Ð¼.\n   > Participial form with agent in instrumental.\n\n4. The experiment is being conducted.\n   - [ ] Ð•ÐºÑÐ¿ÐµÑ€Ð¸Ð¼ÐµÐ½Ñ‚ Ð¿Ñ€Ð¾Ð²ÐµÐ´ÐµÐ½Ð¾.\n   - [x] Ð•ÐºÑÐ¿ÐµÑ€Ð¸Ð¼ÐµÐ½Ñ‚ Ð¿Ñ€Ð¾Ð²Ð¾Ð´Ð¸Ñ‚ÑŒÑÑ.\n   - [ ] Ð•ÐºÑÐ¿ÐµÑ€Ð¸Ð¼ÐµÐ½Ñ‚ Ð¿Ñ€Ð¾Ð²ÐµÐ´ÐµÐ½Ð¸Ð¹.\n   - [ ] Ð•ÐºÑÐ¿ÐµÑ€Ð¸Ð¼ÐµÐ½Ñ‚ Ð¿Ñ€Ð¾Ð²ÐµÐ»Ð¸.\n   > Ongoing process â†’ reflexive form.\n\n5. He was promised a promotion.\n   - [ ] Ð’Ñ–Ð½ Ð¿Ð¾Ð¾Ð±Ñ–Ñ†ÑÐ² Ð¿Ñ–Ð´Ð²Ð¸Ñ‰ÐµÐ½Ð½Ñ.\n   - [ ] Ð™Ð¾Ð³Ð¾ Ð¿Ð¾Ð¾Ð±Ñ–Ñ†ÑÐ»Ð¸ Ð¿Ñ–Ð´Ð²Ð¸Ñ‰ÐµÐ½Ð½Ñ.\n   - [x] Ð™Ð¾Ð¼Ñƒ Ð¿Ð¾Ð¾Ð±Ñ–Ñ†ÑÐ»Ð¸ Ð¿Ñ–Ð´Ð²Ð¸Ñ‰ÐµÐ½Ð½Ñ.\n   - [ ] Ð™Ð¾Ð¼Ñƒ Ð¿Ð¾Ð¾Ð±Ñ–Ñ†ÑÐ½Ð¾ Ð¿Ñ–Ð´Ð²Ð¸Ñ‰ÐµÐ½Ð½Ñ.\n   > Recipient in dative + 3rd person plural.\n\n6. The law applies to all citizens.\n   - [ ] Ð—Ð°ÐºÐ¾Ð½ Ð·Ð°ÑÑ‚Ð¾ÑÐ¾Ð²Ð°Ð½Ð¾ Ð´Ð¾ Ð²ÑÑ–Ñ… Ð³Ñ€Ð¾Ð¼Ð°Ð´ÑÐ½.\n   - [x] Ð—Ð°ÐºÐ¾Ð½ Ð·Ð°ÑÑ‚Ð¾ÑÐ¾Ð²ÑƒÑ”Ñ‚ÑŒÑÑ Ð´Ð¾ Ð²ÑÑ–Ñ… Ð³Ñ€Ð¾Ð¼Ð°Ð´ÑÐ½.\n   - [ ] Ð—Ð°ÐºÐ¾Ð½ Ð·Ð°ÑÑ‚Ð¾ÑÑƒÐ²Ð°Ð»Ð¸ Ð´Ð¾ Ð²ÑÑ–Ñ… Ð³Ñ€Ð¾Ð¼Ð°Ð´ÑÐ½.\n   - [ ] Ð—Ð°ÐºÐ¾Ð½ Ð·Ð°ÑÑ‚Ð¾ÑÐ¾Ð²Ð°Ð½Ð¸Ð¹ Ð´Ð¾ Ð²ÑÑ–Ñ… Ð³Ñ€Ð¾Ð¼Ð°Ð´ÑÐ½.\n   > General ongoing process â†’ reflexive form.\n\n7. The document was signed yesterday.\n   - [x] Ð”Ð¾ÐºÑƒÐ¼ÐµÐ½Ñ‚ Ð¿Ñ–Ð´Ð¿Ð¸ÑÐ°Ð½Ð¾ Ð²Ñ‡Ð¾Ñ€Ð°.\n   - [ ] Ð”Ð¾ÐºÑƒÐ¼ÐµÐ½Ñ‚ Ð¿Ñ–Ð´Ð¿Ð¸ÑÐ°Ð²ÑÑ Ð²Ñ‡Ð¾Ñ€Ð°.\n   - [ ] Ð”Ð¾ÐºÑƒÐ¼ÐµÐ½Ñ‚ Ð¿Ñ–Ð´Ð¿Ð¸ÑÐ°Ð»Ð¸ Ð²Ñ‡Ð¾Ñ€Ð°.\n   - [ ] Ð”Ð¾ÐºÑƒÐ¼ÐµÐ½Ñ‚ Ð¿Ñ–Ð´Ð¿Ð¸ÑÐ°Ð½Ð¸Ð¹ Ð²Ñ‡Ð¾Ñ€Ð°.\n   > Official context â†’ impersonal form.\n\n8. The problem is being studied by scientists.\n   - [ ] ÐŸÑ€Ð¾Ð±Ð»ÐµÐ¼Ñƒ Ð²Ð¸Ð²Ñ‡ÐµÐ½Ð¾ Ð½Ð°ÑƒÐºÐ¾Ð²Ñ†ÑÐ¼Ð¸.\n   - [x] ÐŸÑ€Ð¾Ð±Ð»ÐµÐ¼Ð° Ð²Ð¸Ð²Ñ‡Ð°Ñ”Ñ‚ÑŒÑÑ Ð½Ð°ÑƒÐºÐ¾Ð²Ñ†ÑÐ¼Ð¸.\n   - [ ] ÐŸÑ€Ð¾Ð±Ð»ÐµÐ¼Ñƒ Ð²Ð¸Ð²Ñ‡Ð°ÑŽÑ‚ÑŒ Ð½Ð°ÑƒÐºÐ¾Ð²Ñ†Ñ–.\n   - [ ] ÐŸÑ€Ð¾Ð±Ð»ÐµÐ¼Ð° Ð²Ð¸Ð²Ñ‡ÐµÐ½Ð° Ð½Ð°ÑƒÐºÐ¾Ð²Ñ†ÑÐ¼Ð¸.\n   > Process + agent â†’ reflexive form with instrumental.\n\n9. We were invited to the party.\n   - [x] ÐÐ°Ñ Ð·Ð°Ð¿Ñ€Ð¾ÑÐ¸Ð»Ð¸ Ð½Ð° Ð²ÐµÑ‡Ñ–Ñ€ÐºÑƒ.\n   - [ ] ÐÐ°Ð¼ Ð·Ð°Ð¿Ñ€Ð¾ÑÐ¸Ð»Ð¸ Ð½Ð° Ð²ÐµÑ‡Ñ–Ñ€ÐºÑƒ.\n   - [ ] ÐÐ°Ð¼Ð¸ Ð·Ð°Ð¿Ñ€Ð¾ÑˆÐµÐ½Ð¾ Ð½Ð° Ð²ÐµÑ‡Ñ–Ñ€ÐºÑƒ.\n   - [ ] ÐœÐ¸ Ð·Ð°Ð¿Ñ€Ð¾ÑˆÐµÐ½Ñ– Ð½Ð° Ð²ÐµÑ‡Ñ–Ñ€ÐºÑƒ.\n   > Colloquial style â†’ 3rd person plural.\n\n10. The meeting is declared closed.\n    - [x] Ð—Ð°ÑÑ–Ð´Ð°Ð½Ð½Ñ Ð¾Ð³Ð¾Ð»Ð¾ÑˆÐµÐ½Ð¾ Ð·Ð°ÐºÑ€Ð¸Ñ‚Ð¸Ð¼.\n    - [ ] Ð—Ð°ÑÑ–Ð´Ð°Ð½Ð½Ñ Ð¾Ð³Ð¾Ð»Ð¾ÑˆÑƒÑ”Ñ‚ÑŒÑÑ Ð·Ð°ÐºÑ€Ð¸Ñ‚Ð¸Ð¼.\n    - [ ] Ð—Ð°ÑÑ–Ð´Ð°Ð½Ð½Ñ Ð¾Ð³Ð¾Ð»Ð¾ÑÐ¸Ð»Ð¸ Ð·Ð°ÐºÑ€Ð¸Ñ‚Ð¸Ð¼.\n    - [ ] Ð—Ð°ÑÑ–Ð´Ð°Ð½Ð½Ñ Ð¾Ð³Ð¾Ð»Ð¾ÑˆÐµÐ½Ðµ Ð·Ð°ÐºÑ€Ð¸Ñ‚Ð¸Ð¼.\n    > Official formula â†’ impersonal form.\n\n11. The data is being collected automatically.\n    - [ ] Ð”Ð°Ð½Ñ– Ð·Ñ–Ð±Ñ€Ð°Ð½Ð¾ Ð°Ð²Ñ‚Ð¾Ð¼Ð°Ñ‚Ð¸Ñ‡Ð½Ð¾.\n    - [x] Ð”Ð°Ð½Ñ– Ð·Ð±Ð¸Ñ€Ð°ÑŽÑ‚ÑŒÑÑ Ð°Ð²Ñ‚Ð¾Ð¼Ð°Ñ‚Ð¸Ñ‡Ð½Ð¾.\n    - [ ] Ð”Ð°Ð½Ñ– Ð·Ñ–Ð±Ñ€Ð°Ð½Ñ– Ð°Ð²Ñ‚Ð¾Ð¼Ð°Ñ‚Ð¸Ñ‡Ð½Ð¾.\n    - [ ] Ð”Ð°Ð½Ñ– Ð·Ð±Ð¸Ñ€Ð°Ð»Ð¸ Ð°Ð²Ñ‚Ð¾Ð¼Ð°Ñ‚Ð¸Ñ‡Ð½Ð¾.\n    > Process â†’ reflexive form.\n\n12. The order has been issued.\n    - [x] ÐÐ°ÐºÐ°Ð· Ð²Ð¸Ð´Ð°Ð½Ð¾.\n    - [ ] ÐÐ°ÐºÐ°Ð· Ð²Ð¸Ð´Ð°Ð½Ð¸Ð¹.\n    - [ ] ÐÐ°ÐºÐ°Ð· Ð²Ð¸Ð´Ð°Ñ”Ñ‚ÑŒÑÑ.\n    - [ ] ÐÐ°ÐºÐ°Ð· Ð²Ð¸Ð´Ð°Ð»Ð¸.\n    > Official document â†’ impersonal form.\n\n13. The building was constructed in 2020.\n    - [ ] Ð‘ÑƒÐ´Ð¸Ð½Ð¾Ðº Ð±ÑƒÐ´ÑƒÑ”Ñ‚ÑŒÑÑ Ñƒ 2020 Ñ€Ð¾Ñ†Ñ–.\n    - [x] Ð‘ÑƒÐ´Ð¸Ð½Ð¾Ðº Ð¿Ð¾Ð±ÑƒÐ´Ð¾Ð²Ð°Ð½Ð¸Ð¹ Ñƒ 2020 Ñ€Ð¾Ñ†Ñ–.\n    - [ ] Ð‘ÑƒÐ´Ð¸Ð½Ð¾Ðº Ð¿Ð¾Ð±ÑƒÐ´Ð¾Ð²Ð°Ð½Ð¾ Ñƒ 2020 Ñ€Ð¾Ñ†Ñ–.\n    - [ ] Ð‘ÑƒÐ´Ð¸Ð½Ð¾Ðº Ð¿Ð¾Ð±ÑƒÐ´ÑƒÐ²Ð°Ð»Ð¸ Ñƒ 2020 Ñ€Ð¾Ñ†Ñ–.\n    > Literary style â†’ participial form.\n\n14. I was asked about the discount.\n    - [x] ÐœÐµÐ½Ðµ Ð·Ð°Ð¿Ð¸Ñ‚Ð°Ð»Ð¸ Ð¿Ñ€Ð¾ Ð·Ð½Ð¸Ð¶ÐºÑƒ.\n    - [ ] ÐœÐµÐ½Ñ– Ð·Ð°Ð¿Ð¸Ñ‚Ð°Ð»Ð¸ Ð¿Ñ€Ð¾ Ð·Ð½Ð¸Ð¶ÐºÑƒ.\n    - [ ] ÐœÐ½Ð¾ÑŽ Ð·Ð°Ð¿Ð¸Ñ‚Ð°Ð½Ð¾ Ð¿Ñ€Ð¾ Ð·Ð½Ð¸Ð¶ÐºÑƒ.\n    - [ ] Ð¯ Ð·Ð°Ð¿Ð¸Ñ‚Ð°Ð² Ð¿Ñ€Ð¾ Ð·Ð½Ð¸Ð¶ÐºÑƒ.\n    > Ð Ð¾Ð·Ð¼Ð¾Ð²Ð½Ð¸Ð¹ ÑÑ‚Ð¸Ð»ÑŒ â†’ Ñ‚Ñ€ÐµÑ‚Ñ Ð¾ÑÐ¾Ð±Ð° Ð¼Ð½Ð¾Ð¶Ð¸Ð½Ð¸, Ð¼ÐµÐ½Ðµ Ñƒ Ð·Ð½Ð°Ñ…Ñ–Ð´Ð½Ð¾Ð¼Ñƒ.\n\n15. The article will be published next month.\n    - [ ] Ð¡Ñ‚Ð°Ñ‚Ñ‚ÑŽ Ð¿ÑƒÐ±Ð»Ñ–ÐºÑƒÐ²Ð°Ñ‚Ð¸Ð¼ÑƒÑ‚ÑŒ Ð½Ð°ÑÑ‚ÑƒÐ¿Ð½Ð¾Ð³Ð¾ Ð¼Ñ–ÑÑÑ†Ñ.\n    - [x] Ð¡Ñ‚Ð°Ñ‚Ñ‚ÑŽ Ð±ÑƒÐ´Ðµ Ð¾Ð¿ÑƒÐ±Ð»Ñ–ÐºÐ¾Ð²Ð°Ð½Ð¾ Ð½Ð°ÑÑ‚ÑƒÐ¿Ð½Ð¾Ð³Ð¾ Ð¼Ñ–ÑÑÑ†Ñ.\n    - [ ] Ð¡Ñ‚Ð°Ñ‚Ñ‚Ñ Ð¿ÑƒÐ±Ð»Ñ–ÐºÑƒÑ”Ñ‚ÑŒÑÑ Ð½Ð°ÑÑ‚ÑƒÐ¿Ð½Ð¾Ð³Ð¾ Ð¼Ñ–ÑÑÑ†Ñ.\n    - [ ] Ð¡Ñ‚Ð°Ñ‚Ñ‚ÑŽ Ð¾Ð¿ÑƒÐ±Ð»Ñ–ÐºÑƒÐ²Ð°Ð»Ð¸ Ð½Ð°ÑÑ‚ÑƒÐ¿Ð½Ð¾Ð³Ð¾ Ð¼Ñ–ÑÑÑ†Ñ.\n    > Future passive â†’ Ð±ÑƒÐ´Ðµ + -Ð½Ð¾.\n\n16. The work has been completed on time.\n    - [x] Ð Ð¾Ð±Ð¾Ñ‚Ñƒ Ð·Ð°Ð²ÐµÑ€ÑˆÐµÐ½Ð¾ Ð²Ñ‡Ð°ÑÐ½Ð¾.\n    - [ ] Ð Ð¾Ð±Ð¾Ñ‚Ð° Ð·Ð°Ð²ÐµÑ€ÑˆÐµÐ½Ð° Ð²Ñ‡Ð°ÑÐ½Ð¾.\n    - [ ] Ð Ð¾Ð±Ð¾Ñ‚Ñƒ Ð·Ð°Ð²ÐµÑ€ÑˆÐ¸Ð»Ð¸ Ð²Ñ‡Ð°ÑÐ½Ð¾.\n    - [ ] Ð Ð¾Ð±Ð¾Ñ‚Ð° Ð·Ð°Ð²ÐµÑ€ÑˆÑƒÑ”Ñ‚ÑŒÑÑ Ð²Ñ‡Ð°ÑÐ½Ð¾.\n    > Official result â†’ impersonal form.\n\n## quiz: Ð’Ñ–Ð´Ð¼Ñ–Ð½ÐºÐ¸ Ð² Ð¿Ð°ÑÐ¸Ð²Ð½Ð¸Ñ… ÐºÐ¾Ð½ÑÑ‚Ñ€ÑƒÐºÑ†Ñ–ÑÑ…\n> ÐžÐ±ÐµÑ€Ñ–Ñ‚ÑŒ Ð¿Ñ€Ð°Ð²Ð¸Ð»ÑŒÐ½Ð¸Ð¹ Ð²Ñ–Ð´Ð¼Ñ–Ð½Ð¾Ðº.\n\n1. Ð£ Ð´Ñ–Ñ”Ð¿Ñ€Ð¸ÐºÐ¼ÐµÑ‚Ð½Ð¸ÐºÐ¾Ð²Ñ–Ð¹ Ñ„Ð¾Ñ€Ð¼Ñ– Ð°Ð³ÐµÐ½Ñ‚ Ð²Ð¸Ñ€Ð°Ð¶Ð°Ñ”Ñ‚ÑŒÑÑ Ð²:\n   - [ ] Ð·Ð½Ð°Ñ…Ñ–Ð´Ð½Ð¾Ð¼Ñƒ Ð²Ñ–Ð´Ð¼Ñ–Ð½ÐºÑƒ\n   - [ ] Ð´Ð°Ð²Ð°Ð»ÑŒÐ½Ð¾Ð¼Ñƒ Ð²Ñ–Ð´Ð¼Ñ–Ð½ÐºÑƒ\n   - [x] Ð¾Ñ€ÑƒÐ´Ð½Ð¾Ð¼Ñƒ Ð²Ñ–Ð´Ð¼Ñ–Ð½ÐºÑƒ\n   - [ ] Ñ€Ð¾Ð´Ð¾Ð²Ð¾Ð¼Ñƒ Ð²Ñ–Ð´Ð¼Ñ–Ð½ÐºÑƒ\n   > ÐšÐ½Ð¸Ð³Ð° Ð½Ð°Ð¿Ð¸ÑÐ°Ð½Ð° Ð°Ð²Ñ‚Ð¾Ñ€ÐžÐœ â€” Ð¾Ñ€ÑƒÐ´Ð½Ð¸Ð¹.\n\n2. Ð£ Ð±ÐµÐ·Ð¾ÑÐ¾Ð±Ð¾Ð²Ñ–Ð¹ Ñ„Ð¾Ñ€Ð¼Ñ– Ð¾Ð±'Ñ”ÐºÑ‚ ÑÑ‚Ð¾Ñ—Ñ‚ÑŒ Ñƒ:\n   - [x] Ð·Ð½Ð°Ñ…Ñ–Ð´Ð½Ð¾Ð¼Ñƒ Ð²Ñ–Ð´Ð¼Ñ–Ð½ÐºÑƒ\n   - [ ] Ð½Ð°Ð·Ð¸Ð²Ð½Ð¾Ð¼Ñƒ Ð²Ñ–Ð´Ð¼Ñ–Ð½ÐºÑƒ\n   - [ ] Ð¾Ñ€ÑƒÐ´Ð½Ð¾Ð¼Ñƒ Ð²Ñ–Ð´Ð¼Ñ–Ð½ÐºÑƒ\n   - [ ] Ð´Ð°Ð²Ð°Ð»ÑŒÐ½Ð¾Ð¼Ñƒ Ð²Ñ–Ð´Ð¼Ñ–Ð½ÐºÑƒ\n   > ÐšÐ½Ð¸Ð³Ð£ Ð½Ð°Ð¿Ð¸ÑÐ°Ð½Ð¾ â€” Ð·Ð½Ð°Ñ…Ñ–Ð´Ð½Ð¸Ð¹.\n\n3. Ð£ Ñ‚Ñ€ÐµÑ‚Ñ–Ð¹ Ð¾ÑÐ¾Ð±Ñ– Ð¼Ð½Ð¾Ð¶Ð¸Ð½Ð¸ Ð¾Ñ‚Ñ€Ð¸Ð¼ÑƒÐ²Ð°Ñ‡ Ð´Ñ–Ñ—:\n   - [ ] Ñƒ Ð·Ð½Ð°Ñ…Ñ–Ð´Ð½Ð¾Ð¼Ñƒ Ð²Ñ–Ð´Ð¼Ñ–Ð½ÐºÑƒ\n   - [x] Ñƒ Ð´Ð°Ð²Ð°Ð»ÑŒÐ½Ð¾Ð¼Ñƒ Ð²Ñ–Ð´Ð¼Ñ–Ð½ÐºÑƒ\n   - [ ] Ð² Ð¾Ñ€ÑƒÐ´Ð½Ð¾Ð¼Ñƒ Ð²Ñ–Ð´Ð¼Ñ–Ð½ÐºÑƒ\n   - [ ] Ñƒ Ñ€Ð¾Ð´Ð¾Ð²Ð¾Ð¼Ñƒ Ð²Ñ–Ð´Ð¼Ñ–Ð½ÐºÑƒ\n   > Ð™Ð¾Ð¼Ð£ ÑÐºÐ°Ð·Ð°Ð»Ð¸ â€” Ð´Ð°Ð²Ð°Ð»ÑŒÐ½Ð¸Ð¹.\n\n4. \"ÐŸÑ€Ð¾Ð±Ð»ÐµÐ¼Ð° Ð²Ð¸Ð²Ñ‡Ð°Ñ”Ñ‚ÑŒÑÑ Ð½Ð°ÑƒÐºÐ¾Ð²Ñ†ÑÐ¼Ð¸\" â€” Ð°Ð³ÐµÐ½Ñ‚ Ñƒ:\n   - [ ] Ð·Ð½Ð°Ñ…Ñ–Ð´Ð½Ð¾Ð¼Ñƒ Ð²Ñ–Ð´Ð¼Ñ–Ð½ÐºÑƒ\n   - [ ] Ð´Ð°Ð²Ð°Ð»ÑŒÐ½Ð¾Ð¼Ñƒ Ð²Ñ–Ð´Ð¼Ñ–Ð½ÐºÑƒ\n   - [x] Ð¾Ñ€ÑƒÐ´Ð½Ð¾Ð¼Ñƒ Ð²Ñ–Ð´Ð¼Ñ–Ð½ÐºÑƒ\n   - [ ] Ñ€Ð¾Ð´Ð¾Ð²Ð¾Ð¼Ñƒ Ð²Ñ–Ð´Ð¼Ñ–Ð½ÐºÑƒ\n   > ÐÐ°ÑƒÐºÐ¾Ð²Ñ†Ð¯ÐœÐ˜ â€” Ð¾Ñ€ÑƒÐ´Ð½Ð¸Ð¹.\n\n5. \"ÐœÐµÐ½Ðµ Ð·Ð°Ð¿Ñ€Ð¾ÑÐ¸Ð»Ð¸\" â€” Ð¾Ð±'Ñ”ÐºÑ‚ Ñƒ:\n   - [x] Ð·Ð½Ð°Ñ…Ñ–Ð´Ð½Ð¾Ð¼Ñƒ Ð²Ñ–Ð´Ð¼Ñ–Ð½ÐºÑƒ\n   - [ ] Ð´Ð°Ð²Ð°Ð»ÑŒÐ½Ð¾Ð¼Ñƒ Ð²Ñ–Ð´Ð¼Ñ–Ð½ÐºÑƒ\n   - [ ] Ð¾Ñ€ÑƒÐ´Ð½Ð¾Ð¼Ñƒ Ð²Ñ–Ð´Ð¼Ñ–Ð½ÐºÑƒ\n   - [ ] Ð½Ð°Ð·Ð¸Ð²Ð½Ð¾Ð¼Ñƒ Ð²Ñ–Ð´Ð¼Ñ–Ð½ÐºÑƒ\n   > ÐœÐµÐ½Ð• â€” Ð·Ð½Ð°Ñ…Ñ–Ð´Ð½Ð¸Ð¹ (ÐºÐ¾Ð³Ð¾?).\n\n6. \"ÐÐ°Ð¼ Ð¿Ð¾Ð¾Ð±Ñ–Ñ†ÑÐ»Ð¸\" â€” Ð¾Ñ‚Ñ€Ð¸Ð¼ÑƒÐ²Ð°Ñ‡ Ñƒ:\n   - [ ] Ð·Ð½Ð°Ñ…Ñ–Ð´Ð½Ð¾Ð¼Ñƒ Ð²Ñ–Ð´Ð¼Ñ–Ð½ÐºÑƒ\n   - [x] Ð´Ð°Ð²Ð°Ð»ÑŒÐ½Ð¾Ð¼Ñƒ Ð²Ñ–Ð´Ð¼Ñ–Ð½ÐºÑƒ\n   - [ ] Ð¾Ñ€ÑƒÐ´Ð½Ð¾Ð¼Ñƒ Ð²Ñ–Ð´Ð¼Ñ–Ð½ÐºÑƒ\n   - [ ] Ð½Ð°Ð·Ð¸Ð²Ð½Ð¾Ð¼Ñƒ Ð²Ñ–Ð´Ð¼Ñ–Ð½ÐºÑƒ\n   > ÐÐ°Ðœ â€” Ð´Ð°Ð²Ð°Ð»ÑŒÐ½Ð¸Ð¹ (ÐºÐ¾Ð¼Ñƒ?).\n\n7. \"Ð”Ð¾ÐºÑƒÐ¼ÐµÐ½Ñ‚ Ð¿Ñ–Ð´Ð¿Ð¸ÑÐ°Ð½Ð¸Ð¹ Ð´Ð¸Ñ€ÐµÐºÑ‚Ð¾Ñ€Ð¾Ð¼\" â€” Ð°Ð³ÐµÐ½Ñ‚:\n   - [ ] Ð²Ñ–Ð´ÑÑƒÑ‚Ð½Ñ–Ð¹\n   - [ ] Ñƒ Ð·Ð½Ð°Ñ…Ñ–Ð´Ð½Ð¾Ð¼Ñƒ Ð²Ñ–Ð´Ð¼Ñ–Ð½ÐºÑƒ\n   - [x] Ð² Ð¾Ñ€ÑƒÐ´Ð½Ð¾Ð¼Ñƒ Ð²Ñ–Ð´Ð¼Ñ–Ð½ÐºÑƒ\n   - [ ] Ñƒ Ð´Ð°Ð²Ð°Ð»ÑŒÐ½Ð¾Ð¼Ñƒ Ð²Ñ–Ð´Ð¼Ñ–Ð½ÐºÑƒ\n   > Ð”Ð¸Ñ€ÐµÐºÑ‚Ð¾Ñ€ÐžÐœ â€” Ð¾Ñ€ÑƒÐ´Ð½Ð¸Ð¹.\n\n8. \"Ð Ð¾Ð±Ð¾Ñ‚Ñƒ Ð·Ð°Ð²ÐµÑ€ÑˆÐµÐ½Ð¾\" â€” Ð¾Ð±'Ñ”ÐºÑ‚ Ñƒ:\n   - [x] Ð·Ð½Ð°Ñ…Ñ–Ð´Ð½Ð¾Ð¼Ñƒ Ð²Ñ–Ð´Ð¼Ñ–Ð½ÐºÑƒ\n   - [ ] Ð½Ð°Ð·Ð¸Ð²Ð½Ð¾Ð¼Ñƒ Ð²Ñ–Ð´Ð¼Ñ–Ð½ÐºÑƒ\n   - [ ] Ð¾Ñ€ÑƒÐ´Ð½Ð¾Ð¼Ñƒ Ð²Ñ–Ð´Ð¼Ñ–Ð½ÐºÑƒ\n   - [ ] Ñ€Ð¾Ð´Ð¾Ð²Ð¾Ð¼Ñƒ Ð²Ñ–Ð´Ð¼Ñ–Ð½ÐºÑƒ\n   > Ð Ð¾Ð±Ð¾Ñ‚Ð£ â€” Ð·Ð½Ð°Ñ…Ñ–Ð´Ð½Ð¸Ð¹.\n\n9. Ð¯ÐºÐ° Ñ„Ð¾Ñ€Ð¼Ð° ÐÐ• Ð¼Ð¾Ð¶Ðµ Ð²Ð¸Ñ€Ð°Ð¶Ð°Ñ‚Ð¸ Ð°Ð³ÐµÐ½Ñ‚Ð°?\n   - [ ] Ð”Ñ–Ñ”Ð¿Ñ€Ð¸ÐºÐ¼ÐµÑ‚Ð½Ð¸ÐºÐ¾Ð²Ð°\n   - [ ] Ð—Ð²Ð¾Ñ€Ð¾Ñ‚Ð½Ð°\n   - [x] Ð‘ÐµÐ·Ð¾ÑÐ¾Ð±Ð¾Ð²Ð° (-Ð½Ð¾/-Ñ‚Ð¾)\n   - [ ] Ð’ÑÑ– Ð¼Ð¾Ð¶ÑƒÑ‚ÑŒ Ð²Ð¸Ñ€Ð°Ð¶Ð°Ñ‚Ð¸\n   > -Ð½Ð¾/-Ñ‚Ð¾ Ð½Ðµ Ð²Ð¸Ñ€Ð°Ð¶Ð°Ñ” Ð°Ð³ÐµÐ½Ñ‚Ð° Ð·Ð° ÑÐ²Ð¾Ñ”ÑŽ Ð¿Ñ€Ð¸Ñ€Ð¾Ð´Ð¾ÑŽ.\n\n10. \"Ð—Ð°ÐºÐ¾Ð½ Ð·Ð°ÑÑ‚Ð¾ÑÐ¾Ð²ÑƒÑ”Ñ‚ÑŒÑÑ ÑÑƒÐ´Ð°Ð¼Ð¸\" â€” ÑÑƒÐ´Ð¸ Ð²:\n    - [ ] Ð·Ð½Ð°Ñ…Ñ–Ð´Ð½Ð¾Ð¼Ñƒ Ð²Ñ–Ð´Ð¼Ñ–Ð½ÐºÑƒ\n    - [ ] Ð´Ð°Ð²Ð°Ð»ÑŒÐ½Ð¾Ð¼Ñƒ Ð²Ñ–Ð´Ð¼Ñ–Ð½ÐºÑƒ\n    - [x] Ð¾Ñ€ÑƒÐ´Ð½Ð¾Ð¼Ñƒ Ð²Ñ–Ð´Ð¼Ñ–Ð½ÐºÑƒ\n    - [ ] Ñ€Ð¾Ð´Ð¾Ð²Ð¾Ð¼Ñƒ Ð²Ñ–Ð´Ð¼Ñ–Ð½ÐºÑƒ\n    > Ð¡ÑƒÐ´ÐÐœÐ˜ â€” Ð¾Ñ€ÑƒÐ´Ð½Ð¸Ð¹.\n\n11. \"Ð‡Ð¹ Ð¿Ð¾Ð´Ð°Ñ€ÑƒÐ²Ð°Ð»Ð¸\" â€” Ð¾Ñ‚Ñ€Ð¸Ð¼ÑƒÐ²Ð°Ñ‡ Ñƒ:\n    - [ ] Ð·Ð½Ð°Ñ…Ñ–Ð´Ð½Ð¾Ð¼Ñƒ Ð²Ñ–Ð´Ð¼Ñ–Ð½ÐºÑƒ\n    - [x] Ð´Ð°Ð²Ð°Ð»ÑŒÐ½Ð¾Ð¼Ñƒ Ð²Ñ–Ð´Ð¼Ñ–Ð½ÐºÑƒ\n    - [ ] Ð¾Ñ€ÑƒÐ´Ð½Ð¾Ð¼Ñƒ Ð²Ñ–Ð´Ð¼Ñ–Ð½ÐºÑƒ\n    - [ ] Ð½Ð°Ð·Ð¸Ð²Ð½Ð¾Ð¼Ñƒ Ð²Ñ–Ð´Ð¼Ñ–Ð½ÐºÑƒ\n    > Ð‡Ð™ â€” Ð´Ð°Ð²Ð°Ð»ÑŒÐ½Ð¸Ð¹.\n\n12. Ð£ ÑÐºÑ–Ð¹ Ñ„Ð¾Ñ€Ð¼Ñ– Ð¾Ð±'Ñ”ÐºÑ‚ Ñƒ Ð½Ð°Ð·Ð¸Ð²Ð½Ð¾Ð¼Ñƒ Ð²Ñ–Ð´Ð¼Ñ–Ð½ÐºÑƒ?\n    - [x] Ð”Ñ–Ñ”Ð¿Ñ€Ð¸ÐºÐ¼ÐµÑ‚Ð½Ð¸ÐºÐ¾Ð²Ð°\n    - [ ] Ð‘ÐµÐ·Ð¾ÑÐ¾Ð±Ð¾Ð²Ð°\n    - [ ] Ð¢Ñ€ÐµÑ‚Ñ Ð¾ÑÐ¾Ð±Ð° Ð¼Ð½Ð¾Ð¶Ð¸Ð½Ð¸\n    - [ ] Ð–Ð¾Ð´Ð½Ñ–Ð¹\n    > ÐšÐ½Ð¸Ð³Ð Ð½Ð°Ð¿Ð¸ÑÐ°Ð½Ð° â€” ÐºÐ½Ð¸Ð³Ð° Ð² Ð½Ð°Ð·Ð¸Ð²Ð½Ð¾Ð¼Ñƒ.\n\n13. \"Ð•ÐºÑÐ¿ÐµÑ€Ð¸Ð¼ÐµÐ½Ñ‚ Ð¿Ñ€Ð¾Ð²Ð¾Ð´Ð¸Ñ‚ÑŒÑÑ\" â€” ÐµÐºÑÐ¿ÐµÑ€Ð¸Ð¼ÐµÐ½Ñ‚ Ñƒ:\n    - [x] Ð½Ð°Ð·Ð¸Ð²Ð½Ð¾Ð¼Ñƒ Ð²Ñ–Ð´Ð¼Ñ–Ð½ÐºÑƒ\n    - [ ] Ð·Ð½Ð°Ñ…Ñ–Ð´Ð½Ð¾Ð¼Ñƒ Ð²Ñ–Ð´Ð¼Ñ–Ð½ÐºÑƒ\n    - [ ] Ð¾Ñ€ÑƒÐ´Ð½Ð¾Ð¼Ñƒ Ð²Ñ–Ð´Ð¼Ñ–Ð½ÐºÑƒ\n    - [ ] Ð´Ð°Ð²Ð°Ð»ÑŒÐ½Ð¾Ð¼Ñƒ Ð²Ñ–Ð´Ð¼Ñ–Ð½ÐºÑƒ\n    > Ð•ÐºÑÐ¿ÐµÑ€Ð¸Ð¼ÐµÐ½Ñ‚Ã˜ â€” Ð½Ð°Ð·Ð¸Ð²Ð½Ð¸Ð¹ (Ñ…Ñ‚Ð¾/Ñ‰Ð¾).\n\n14. \"Ð¡Ñ‚Ð°Ñ‚Ñ‚ÑŽ Ð±ÑƒÐ´Ðµ Ð¾Ð¿ÑƒÐ±Ð»Ñ–ÐºÐ¾Ð²Ð°Ð½Ð¾\" â€” ÑÑ‚Ð°Ñ‚Ñ‚Ñ Ð²:\n    - [x] Ð·Ð½Ð°Ñ…Ñ–Ð´Ð½Ð¾Ð¼Ñƒ Ð²Ñ–Ð´Ð¼Ñ–Ð½ÐºÑƒ\n    - [ ] Ð½Ð°Ð·Ð¸Ð²Ð½Ð¾Ð¼Ñƒ Ð²Ñ–Ð´Ð¼Ñ–Ð½ÐºÑƒ\n    - [ ] Ð¾Ñ€ÑƒÐ´Ð½Ð¾Ð¼Ñƒ Ð²Ñ–Ð´Ð¼Ñ–Ð½ÐºÑƒ\n    - [ ] Ð´Ð°Ð²Ð°Ð»ÑŒÐ½Ð¾Ð¼Ñƒ Ð²Ñ–Ð´Ð¼Ñ–Ð½ÐºÑƒ\n    > Ð¡Ñ‚Ð°Ñ‚Ñ‚Ð® â€” Ð·Ð½Ð°Ñ…Ñ–Ð´Ð½Ð¸Ð¹ (Ñ‰Ð¾?).\n\n15. Ð¯ÐºÐ° Ñ„Ð¾Ñ€Ð¼Ð° Ð²Ð¶Ð¸Ð²Ð°Ñ”Ñ‚ÑŒÑÑ Ð· Ð´Ð°Ð²Ð°Ð»ÑŒÐ½Ð¸Ð¼ Ð¾Ñ‚Ñ€Ð¸Ð¼ÑƒÐ²Ð°Ñ‡Ð°?\n    - [ ] Ð”Ñ–Ñ”Ð¿Ñ€Ð¸ÐºÐ¼ÐµÑ‚Ð½Ð¸ÐºÐ¾Ð²Ð°\n    - [ ] Ð‘ÐµÐ·Ð¾ÑÐ¾Ð±Ð¾Ð²Ð°\n    - [ ] Ð—Ð²Ð¾Ñ€Ð¾Ñ‚Ð½Ð°\n    - [x] Ð¢Ñ€ÐµÑ‚Ñ Ð¾ÑÐ¾Ð±Ð° Ð¼Ð½Ð¾Ð¶Ð¸Ð½Ð¸\n    > Ð™Ð¾Ð¼Ñƒ ÑÐºÐ°Ð·Ð°Ð»Ð¸, Ð¼ÐµÐ½Ñ– Ð´Ð°Ð»Ð¸.\n\n16. \"Ð‘ÑƒÐ´Ð¸Ð½Ð¾Ðº Ð¿Ð¾Ð±ÑƒÐ´Ð¾Ð²Ð°Ð½Ð¸Ð¹ Ñ€Ð¾Ð±Ñ–Ñ‚Ð½Ð¸ÐºÐ°Ð¼Ð¸\" â€” Ð´Ð²Ð° Ð²Ñ–Ð´Ð¼Ñ–Ð½ÐºÐ¸:\n    - [x] Ð½Ð°Ð·Ð¸Ð²Ð½Ð¸Ð¹ + Ð¾Ñ€ÑƒÐ´Ð½Ð¸Ð¹\n    - [ ] Ð·Ð½Ð°Ñ…Ñ–Ð´Ð½Ð¸Ð¹ + Ð¾Ñ€ÑƒÐ´Ð½Ð¸Ð¹\n    - [ ] Ð½Ð°Ð·Ð¸Ð²Ð½Ð¸Ð¹ + Ð´Ð°Ð²Ð°Ð»ÑŒÐ½Ð¸Ð¹\n    - [ ] Ð·Ð½Ð°Ñ…Ñ–Ð´Ð½Ð¸Ð¹ + Ð´Ð°Ð²Ð°Ð»ÑŒÐ½Ð¸Ð¹\n    > Ð‘ÑƒÐ´Ð¸Ð½Ð¾ÐºÃ˜ (Ð½Ð°Ð·Ð¸Ð².) + Ñ€Ð¾Ð±Ñ–Ñ‚Ð½Ð¸ÐºÐÐœÐ˜ (Ð¾Ñ€ÑƒÐ´.).\n\n## fill-in: Ð¢Ñ€Ð°Ð½ÑÑ„Ð¾Ñ€Ð¼Ð°Ñ†Ñ–Ñ Ð¿Ð°ÑÐ¸Ð²Ñƒ\n> ÐŸÐµÑ€ÐµÑ‚Ð²Ð¾Ñ€Ñ–Ñ‚ÑŒ Ð°ÐºÑ‚Ð¸Ð²Ð½Ñ– Ñ€ÐµÑ‡ÐµÐ½Ð½Ñ Ð½Ð° Ð¿Ð°ÑÐ¸Ð²Ð½Ñ–.\n\n1. Ð”Ð¸Ñ€ÐµÐºÑ‚Ð¾Ñ€ Ð¿Ñ–Ð´Ð¿Ð¸ÑÐ°Ð² Ð´Ð¾ÐºÑƒÐ¼ÐµÐ½Ñ‚. â†’ Ð”Ð¾ÐºÑƒÐ¼ÐµÐ½Ñ‚ ___ Ð´Ð¸Ñ€ÐµÐºÑ‚Ð¾Ñ€Ð¾Ð¼.\n   > [!answer] Ð¿Ñ–Ð´Ð¿Ð¸ÑÐ°Ð½Ð¸Ð¹\n   > [!options] Ð¿Ñ–Ð´Ð¿Ð¸ÑÐ°Ð½Ð¸Ð¹ | Ð¿Ñ–Ð´Ð¿Ð¸ÑÐ°Ð½Ð¾ | Ð¿Ñ–Ð´Ð¿Ð¸ÑÑƒÑ”Ñ‚ÑŒÑÑ | Ð¿Ñ–Ð´Ð¿Ð¸ÑÐ°Ð»Ð¸\n\n2. Ð¡Ñ‚ÑƒÐ´ÐµÐ½Ñ‚Ð¸ Ð²Ð¸ÐºÐ¾Ð½Ð°Ð»Ð¸ Ð·Ð°Ð²Ð´Ð°Ð½Ð½Ñ. â†’ Ð—Ð°Ð²Ð´Ð°Ð½Ð½Ñ ___.\n   > [!answer] Ð²Ð¸ÐºÐ¾Ð½Ð°Ð½Ð¾\n   > [!options] Ð²Ð¸ÐºÐ¾Ð½Ð°Ð½Ð¾ | Ð²Ð¸ÐºÐ¾Ð½Ð°Ð½Ñ– | Ð²Ð¸ÐºÐ¾Ð½ÑƒÑŽÑ‚ÑŒÑÑ | Ð²Ð¸ÐºÐ¾Ð½Ð°Ð»Ð¸\n\n3. ÐÐ°ÑƒÐºÐ¾Ð²Ñ†Ñ– Ð´Ð¾ÑÐ»Ñ–Ð´Ð¶ÑƒÑŽÑ‚ÑŒ Ð¿Ñ€Ð¾Ð±Ð»ÐµÐ¼Ñƒ. â†’ ÐŸÑ€Ð¾Ð±Ð»ÐµÐ¼Ð° ___ Ð½Ð°ÑƒÐºÐ¾Ð²Ñ†ÑÐ¼Ð¸.\n   > [!answer] Ð´Ð¾ÑÐ»Ñ–Ð´Ð¶ÑƒÑ”Ñ‚ÑŒÑÑ\n   > [!options] Ð´Ð¾ÑÐ»Ñ–Ð´Ð¶ÑƒÑ”Ñ‚ÑŒÑÑ | Ð´Ð¾ÑÐ»Ñ–Ð´Ð¶ÐµÐ½Ð¾ | Ð´Ð¾ÑÐ»Ñ–Ð´Ð¶ÐµÐ½Ð° | Ð´Ð¾ÑÐ»Ñ–Ð´Ð¸Ð»Ð¸\n\n4. Ð¥Ñ‚Ð¾ÑÑŒ Ð¿Ð¾Ð²Ñ–Ð´Ð¾Ð¼Ð¸Ð² Ð¼ÐµÐ½Ðµ Ð¿Ñ€Ð¾ Ð·Ð±Ð¾Ñ€Ð¸. â†’ ___ Ð¿Ð¾Ð²Ñ–Ð´Ð¾Ð¼Ð¸Ð»Ð¸ Ð¿Ñ€Ð¾ Ð·Ð±Ð¾Ñ€Ð¸.\n   > [!answer] ÐœÐµÐ½Ðµ\n   > [!options] ÐœÐµÐ½Ðµ | ÐœÐµÐ½Ñ– | ÐœÐ½Ð¾ÑŽ | Ð¯\n\n5. ÐÐ²Ñ‚Ð¾Ñ€ Ð½Ð°Ð¿Ð¸ÑÐ°Ð² Ñ€Ð¾Ð¼Ð°Ð½. â†’ Ð Ð¾Ð¼Ð°Ð½ ___ Ð°Ð²Ñ‚Ð¾Ñ€Ð¾Ð¼.\n   > [!answer] Ð½Ð°Ð¿Ð¸ÑÐ°Ð½Ð¸Ð¹\n   > [!options] Ð½Ð°Ð¿Ð¸ÑÐ°Ð½Ð¸Ð¹ | Ð½Ð°Ð¿Ð¸ÑÐ°Ð½Ð¾ | Ð¿Ð¸ÑˆÐµÑ‚ÑŒÑÑ | Ð½Ð°Ð¿Ð¸ÑÐ°Ð»Ð¸\n\n6. ÐšÐ¾Ð¼Ñ–ÑÑ–Ñ Ð¿Ñ€Ð¸Ð¹Ð½ÑÐ»Ð° Ñ€Ñ–ÑˆÐµÐ½Ð½Ñ. â†’ Ð Ñ–ÑˆÐµÐ½Ð½Ñ ___.\n   > [!answer] Ð¿Ñ€Ð¸Ð¹Ð½ÑÑ‚Ð¾\n   > [!options] Ð¿Ñ€Ð¸Ð¹Ð½ÑÑ‚Ð¾ | Ð¿Ñ€Ð¸Ð¹Ð½ÑÑ‚Ðµ | Ð¿Ñ€Ð¸Ð¹Ð¼Ð°Ñ”Ñ‚ÑŒÑÑ | Ð¿Ñ€Ð¸Ð¹Ð½ÑÐ»Ð¸\n\n7. Ð’Ñ‡ÐµÐ½Ñ– Ð²Ð¸Ð²Ñ‡Ð°ÑŽÑ‚ÑŒ ÑÐ²Ð¸Ñ‰Ðµ. â†’ Ð¯Ð²Ð¸Ñ‰Ðµ ___ Ð²Ñ‡ÐµÐ½Ð¸Ð¼Ð¸.\n   > [!answer] Ð²Ð¸Ð²Ñ‡Ð°Ñ”Ñ‚ÑŒÑÑ\n   > [!options] Ð²Ð¸Ð²Ñ‡Ð°Ñ”Ñ‚ÑŒÑÑ | Ð²Ð¸Ð²Ñ‡ÐµÐ½Ð¾ | Ð²Ð¸Ð²Ñ‡ÐµÐ½Ðµ | Ð²Ð¸Ð²Ñ‡Ð°Ð»Ð¸\n\n8. Ð¥Ñ‚Ð¾ÑÑŒ Ð¿Ð¾Ð¾Ð±Ñ–Ñ†ÑÐ² Ð¹Ð¾Ð¼Ñƒ Ð¿Ñ–Ð´Ð²Ð¸Ñ‰ÐµÐ½Ð½Ñ. â†’ ___ Ð¿Ð¾Ð¾Ð±Ñ–Ñ†ÑÐ»Ð¸ Ð¿Ñ–Ð´Ð²Ð¸Ñ‰ÐµÐ½Ð½Ñ.\n   > [!answer] Ð™Ð¾Ð¼Ñƒ\n   > [!options] Ð™Ð¾Ð¼Ñƒ | Ð™Ð¾Ð³Ð¾ | ÐÐ¸Ð¼ | Ð’Ñ–Ð½\n\n9. Ð‘ÑƒÐ´Ñ–Ð²ÐµÐ»ÑŒÐ½Ð¸ÐºÐ¸ Ð·Ð±ÑƒÐ´ÑƒÐ²Ð°Ð»Ð¸ Ð¼Ñ–ÑÑ‚. â†’ ÐœÑ–ÑÑ‚ ___ Ñƒ Ð¼Ð¸Ð½ÑƒÐ»Ð¾Ð¼Ñƒ Ñ€Ð¾Ñ†Ñ–.\n   > [!answer] Ð·Ð±ÑƒÐ´Ð¾Ð²Ð°Ð½Ð¸Ð¹\n   > [!options] Ð·Ð±ÑƒÐ´Ð¾Ð²Ð°Ð½Ð¸Ð¹ | Ð·Ð±ÑƒÐ´Ð¾Ð²Ð°Ð½Ð¾ | Ð±ÑƒÐ´ÑƒÑ”Ñ‚ÑŒÑÑ | Ð·Ð±ÑƒÐ´ÑƒÐ²Ð°Ð»Ð¸\n\n10. Ð’Ð¸Ð´Ð°Ð²Ð½Ð¸Ñ†Ñ‚Ð²Ð¾ Ð¾Ð¿ÑƒÐ±Ð»Ñ–ÐºÑƒÐ²Ð°Ð»Ð¾ ÐºÐ½Ð¸Ð³Ñƒ. â†’ ÐšÐ½Ð¸Ð³Ñƒ ___.\n    > [!answer] Ð¾Ð¿ÑƒÐ±Ð»Ñ–ÐºÐ¾Ð²Ð°Ð½Ð¾\n    > [!options] Ð¾Ð¿ÑƒÐ±Ð»Ñ–ÐºÐ¾Ð²Ð°Ð½Ð¾ | Ð¾Ð¿ÑƒÐ±Ð»Ñ–ÐºÐ¾Ð²Ð°Ð½Ð° | Ð¿ÑƒÐ±Ð»Ñ–ÐºÑƒÑ”Ñ‚ÑŒÑÑ | Ð¾Ð¿ÑƒÐ±Ð»Ñ–ÐºÑƒÐ²Ð°Ð»Ð¸\n\n11. Ð¥Ñ‚Ð¾ÑÑŒ Ð·Ð°Ð¿Ñ€Ð¾ÑÐ¸Ð² Ð½Ð°Ñ Ð½Ð° Ð²ÐµÑ‡Ñ–Ñ€ÐºÑƒ. â†’ ___ Ð·Ð°Ð¿Ñ€Ð¾ÑÐ¸Ð»Ð¸ Ð½Ð° Ð²ÐµÑ‡Ñ–Ñ€ÐºÑƒ.\n    > [!answer] ÐÐ°Ñ\n    > [!options] ÐÐ°Ñ | ÐÐ°Ð¼ | ÐÐ°Ð¼Ð¸ | ÐœÐ¸\n\n12. ÐŸÑ€Ð°Ñ†Ñ–Ð²Ð½Ð¸ÐºÐ¸ Ð²Ð¸ÐºÐ¾Ð½ÑƒÑŽÑ‚ÑŒ Ð·Ð°Ð²Ð´Ð°Ð½Ð½Ñ. â†’ Ð—Ð°Ð²Ð´Ð°Ð½Ð½Ñ ___ Ð¿Ñ€Ð°Ñ†Ñ–Ð²Ð½Ð¸ÐºÐ°Ð¼Ð¸.\n    > [!answer] Ð²Ð¸ÐºÐ¾Ð½ÑƒÑŽÑ‚ÑŒÑÑ\n    > [!options] Ð²Ð¸ÐºÐ¾Ð½ÑƒÑŽÑ‚ÑŒÑÑ | Ð²Ð¸ÐºÐ¾Ð½Ð°Ð½Ð¾ | Ð²Ð¸ÐºÐ¾Ð½Ð°Ð½Ñ– | Ð²Ð¸ÐºÐ¾Ð½Ð°Ð»Ð¸\n\n13. Ð ÐµÐ¶Ð¸ÑÐµÑ€ Ð·Ð½ÑÐ² Ñ„Ñ–Ð»ÑŒÐ¼. â†’ Ð¤Ñ–Ð»ÑŒÐ¼ ___ Ñ€ÐµÐ¶Ð¸ÑÐµÑ€Ð¾Ð¼.\n    > [!answer] Ð·Ð½ÑÑ‚Ð¸Ð¹\n    > [!options] Ð·Ð½ÑÑ‚Ð¸Ð¹ | Ð·Ð½ÑÑ‚Ð¾ | Ð·Ð½Ñ–Ð¼Ð°Ñ”Ñ‚ÑŒÑÑ | Ð·Ð½ÑÐ»Ð¸\n\n14. ÐŸÐ°Ñ€Ð»Ð°Ð¼ÐµÐ½Ñ‚ ÑƒÑ…Ð²Ð°Ð»Ð¸Ð² Ð·Ð°ÐºÐ¾Ð½. â†’ Ð—Ð°ÐºÐ¾Ð½ ___.\n    > [!answer] ÑƒÑ…Ð²Ð°Ð»ÐµÐ½Ð¾\n    > [!options] ÑƒÑ…Ð²Ð°Ð»ÐµÐ½Ð¾ | ÑƒÑ…Ð²Ð°Ð»ÐµÐ½Ð¸Ð¹ | ÑƒÑ…Ð²Ð°Ð»ÑŽÑ”Ñ‚ÑŒÑÑ | ÑƒÑ…Ð²Ð°Ð»Ð¸Ð»Ð¸\n\n15. Ð¥Ñ‚Ð¾ÑÑŒ ÑÐºÐ°Ð·Ð°Ð² Ñ—Ð¹ Ð¿Ñ€Ð°Ð²Ð´Ñƒ. â†’ ___ ÑÐºÐ°Ð·Ð°Ð»Ð¸ Ð¿Ñ€Ð°Ð²Ð´Ñƒ.\n    > [!answer] Ð‡Ð¹\n    > [!options] Ð‡Ð¹ | Ð‡Ñ— | ÐÐµÑŽ | Ð’Ð¾Ð½Ð°\n\n16. ÐÑ€Ñ…Ñ–Ñ‚ÐµÐºÑ‚Ð¾Ñ€ ÑÐ¿Ñ€Ð¾ÐµÐºÑ‚ÑƒÐ²Ð°Ð² Ð±ÑƒÐ´Ð¸Ð½Ð¾Ðº. â†’ Ð‘ÑƒÐ´Ð¸Ð½Ð¾Ðº ___ Ð°Ñ€Ñ…Ñ–Ñ‚ÐµÐºÑ‚Ð¾Ñ€Ð¾Ð¼.\n    > [!answer] ÑÐ¿Ñ€Ð¾ÐµÐºÑ‚Ð¾Ð²Ð°Ð½Ð¸Ð¹\n    > [!options] ÑÐ¿Ñ€Ð¾ÐµÐºÑ‚Ð¾Ð²Ð°Ð½Ð¸Ð¹ | ÑÐ¿Ñ€Ð¾ÐµÐºÑ‚Ð¾Ð²Ð°Ð½Ð¾ | Ð¿Ñ€Ð¾ÐµÐºÑ‚ÑƒÑ”Ñ‚ÑŒÑÑ | ÑÐ¿Ñ€Ð¾ÐµÐºÑ‚ÑƒÐ²Ð°Ð»Ð¸\n\n---\n\n# Ð¡Ð»Ð¾Ð²Ð½Ð¸Ðº\n\n| Ð¡Ð»Ð¾Ð²Ð¾ | ÐŸÐµÑ€ÐµÐºÐ»Ð°Ð´ | ÐŸÑ€Ð¸Ð¼Ñ–Ñ‚ÐºÐ¸ |\n|-------|----------|----------|\n| Ð¿Ð°ÑÐ¸Ð²Ð½Ð¸Ð¹ ÑÑ‚Ð°Ð½ | passive voice | grammatical term |\n| Ð°ÐºÑ‚Ð¸Ð²Ð½Ð¸Ð¹ ÑÑ‚Ð°Ð½ | active voice | opposite of passive |\n| Ð´Ñ–Ð¹ÑÐ½Ð¸Ð¹ | active (voice) | synonym of \"Ð°ÐºÑ‚Ð¸Ð²Ð½Ð¸Ð¹\" |\n| Ð´Ñ–Ñ”Ð¿Ñ€Ð¸ÐºÐ¼ÐµÑ‚Ð½Ð¸Ðº | participle | verbal adjective form |\n| Ñ„Ð¾Ñ€Ð¼Ð° | form | grammatical form |\n| ÐºÐ¾Ð½ÑÑ‚Ñ€ÑƒÐºÑ†Ñ–Ñ | construction | syntactic structure |\n| Ð°Ð³ÐµÐ½Ñ‚ | agent | performer of action |\n| Ð²Ð¸ÐºÐ¾Ð½Ð°Ð²ÐµÑ†ÑŒ | performer | the one who performs |\n| Ð´Ñ–Ñ | action | what happens |\n| Ð¾Ð±'Ñ”ÐºÑ‚ | object | recipient of action |\n| ÑÑƒÐ±'Ñ”ÐºÑ‚ | subject | performer of action |\n| Ñ‚Ñ€Ð°Ð½ÑÑ„Ð¾Ñ€Ð¼Ð°Ñ†Ñ–Ñ | transformation | conversion |\n| ÐµÐºÐ²Ñ–Ð²Ð°Ð»ÐµÐ½Ñ‚ | equivalent | corresponding form |\n| Ñ„ÑƒÐ½ÐºÑ†Ñ–Ñ | function | purpose |\n| ÑÑ‚Ð¸Ð»ÑŒ | style | manner of expression |\n| Ñ€ÐµÑ”ÑÑ‚Ñ€ | register | formality level |\n| Ð¾Ñ„Ñ–Ñ†Ñ–Ð¹Ð½Ð¸Ð¹ | official | formal |\n| Ñ€Ð¾Ð·Ð¼Ð¾Ð²Ð½Ð¸Ð¹ | colloquial | informal |\n| Ð½Ð°ÑƒÐºÐ¾Ð²Ð¸Ð¹ | scientific | academic |\n| Ñ…ÑƒÐ´Ð¾Ð¶Ð½Ñ–Ð¹ | literary | artistic |\n| ÐºÐ½Ð¸Ð¶Ð½Ð¸Ð¹ | bookish | literary |\n| ÑƒÑÐ½Ð¸Ð¹ | oral | spoken |\n| Ð¿Ð¸ÑÑŒÐ¼Ð¾Ð²Ð¸Ð¹ | written | written form |\n| Ð½ÐµÐ¹Ñ‚Ñ€Ð°Ð»ÑŒÐ½Ð¸Ð¹ | neutral | without stylistic coloring |\n| ÑƒÐ·Ð³Ð¾Ð´Ð¶ÐµÐ½Ð½Ñ | agreement | grammatical agreement |\n",
    "createdAt": "2025-12-22T00:08:35.772138Z",
    "modifiedAt": "2025-12-22T00:08:35.772138Z",
    "version": 2
  },
  "activities": [],
  "vocabulary": {
    "moduleId": "mod-uk-B2-01",
    "level": "B2",
    "phase": "B2",
    "wordCount": 25,
    "newWordCount": 25,
    "reviewWordCount": 0,
    "transliterationMode": "none",
    "words": [
      {
        "id": "vocab-1",
        "uk": "Ð¿Ð°ÑÐ¸Ð²Ð½Ð¸Ð¹ ÑÑ‚Ð°Ð½",
        "ipa": "passive voice",
        "en": "grammatical term",
        "pos": "",
        "gender": null,
        "note": ""
      },
      {
        "id": "vocab-2",
        "uk": "Ð°ÐºÑ‚Ð¸Ð²Ð½Ð¸Ð¹ ÑÑ‚Ð°Ð½",
        "ipa": "active voice",
        "en": "opposite of passive",
        "pos": "",
        "gender": null,
        "note": ""
      },
      {
        "id": "vocab-3",
        "uk": "Ð´Ñ–Ð¹ÑÐ½Ð¸Ð¹",
        "ipa": "active (voice)",
        "en": "synonym of \"Ð°ÐºÑ‚Ð¸Ð²Ð½Ð¸Ð¹\"",
        "pos": "",
        "gender": null,
        "note": ""
      },
      {
        "id": "vocab-4",
        "uk": "Ð´Ñ–Ñ”Ð¿Ñ€Ð¸ÐºÐ¼ÐµÑ‚Ð½Ð¸Ðº",
        "ipa": "participle",
        "en": "verbal adjective form",
        "pos": "",
        "gender": null,
        "note": ""
      },
      {
        "id": "vocab-5",
        "uk": "Ñ„Ð¾Ñ€Ð¼Ð°",
        "ipa": "form",
        "en": "grammatical form",
        "pos": "",
        "gender": null,
        "note": ""
      },
      {
        "id": "vocab-6",
        "uk": "ÐºÐ¾Ð½ÑÑ‚Ñ€ÑƒÐºÑ†Ñ–Ñ",
        "ipa": "construction",
        "en": "syntactic structure",
        "pos": "",
        "gender": null,
        "note": ""
      },
      {
        "id": "vocab-7",
        "uk": "Ð°Ð³ÐµÐ½Ñ‚",
        "ipa": "agent",
        "en": "performer of action",
        "pos": "",
        "gender": null,
        "note": ""
      },
      {
        "id": "vocab-8",
        "uk": "Ð²Ð¸ÐºÐ¾Ð½Ð°Ð²ÐµÑ†ÑŒ",
        "ipa": "performer",
        "en": "the one who performs",
        "pos": "",
        "gender": null,
        "note": ""
      },
      {
        "id": "vocab-9",
        "uk": "Ð´Ñ–Ñ",
        "ipa": "action",
        "en": "what happens",
        "pos": "",
        "gender": null,
        "note": ""
      },
      {
        "id": "vocab-10",
        "uk": "Ð¾Ð±'Ñ”ÐºÑ‚",
        "ipa": "object",
        "en": "recipient of action",
        "pos": "",
        "gender": null,
        "note": ""
      },
      {
        "id": "vocab-11",
        "uk": "ÑÑƒÐ±'Ñ”ÐºÑ‚",
        "ipa": "subject",
        "en": "performer of action",
        "pos": "",
        "gender": null,
        "note": ""
      },
      {
        "id": "vocab-12",
        "uk": "Ñ‚Ñ€Ð°Ð½ÑÑ„Ð¾Ñ€Ð¼Ð°Ñ†Ñ–Ñ",
        "ipa": "transformation",
        "en": "conversion",
        "pos": "",
        "gender": null,
        "note": ""
      },
      {
        "id": "vocab-13",
        "uk": "ÐµÐºÐ²Ñ–Ð²Ð°Ð»ÐµÐ½Ñ‚",
        "ipa": "equivalent",
        "en": "corresponding form",
        "pos": "",
        "gender": null,
        "note": ""
      },
      {
        "id": "vocab-14",
        "uk": "Ñ„ÑƒÐ½ÐºÑ†Ñ–Ñ",
        "ipa": "function",
        "en": "purpose",
        "pos": "",
        "gender": null,
        "note": ""
      },
      {
        "id": "vocab-15",
        "uk": "ÑÑ‚Ð¸Ð»ÑŒ",
        "ipa": "style",
        "en": "manner of expression",
        "pos": "",
        "gender": null,
        "note": ""
      },
      {
        "id": "vocab-16",
        "uk": "Ñ€ÐµÑ”ÑÑ‚Ñ€",
        "ipa": "register",
        "en": "formality level",
        "pos": "",
        "gender": null,
        "note": ""
      },
      {
        "id": "vocab-17",
        "uk": "Ð¾Ñ„Ñ–Ñ†Ñ–Ð¹Ð½Ð¸Ð¹",
        "ipa": "official",
        "en": "formal",
        "pos": "",
        "gender": null,
        "note": ""
      },
      {
        "id": "vocab-18",
        "uk": "Ñ€Ð¾Ð·Ð¼Ð¾Ð²Ð½Ð¸Ð¹",
        "ipa": "colloquial",
        "en": "informal",
        "pos": "",
        "gender": null,
        "note": ""
      },
      {
        "id": "vocab-19",
        "uk": "Ð½Ð°ÑƒÐºÐ¾Ð²Ð¸Ð¹",
        "ipa": "scientific",
        "en": "academic",
        "pos": "",
        "gender": null,
        "note": ""
      },
      {
        "id": "vocab-20",
        "uk": "Ñ…ÑƒÐ´Ð¾Ð¶Ð½Ñ–Ð¹",
        "ipa": "literary",
        "en": "artistic",
        "pos": "",
        "gender": null,
        "note": ""
      },
      {
        "id": "vocab-21",
        "uk": "ÐºÐ½Ð¸Ð¶Ð½Ð¸Ð¹",
        "ipa": "bookish",
        "en": "literary",
        "pos": "",
        "gender": null,
        "note": ""
      },
      {
        "id": "vocab-22",
        "uk": "ÑƒÑÐ½Ð¸Ð¹",
        "ipa": "oral",
        "en": "spoken",
        "pos": "",
        "gender": null,
        "note": ""
      },
      {
        "id": "vocab-23",
        "uk": "Ð¿Ð¸ÑÑŒÐ¼Ð¾Ð²Ð¸Ð¹",
        "ipa": "written",
        "en": "written form",
        "pos": "",
        "gender": null,
        "note": ""
      },
      {
        "id": "vocab-24",
        "uk": "Ð½ÐµÐ¹Ñ‚Ñ€Ð°Ð»ÑŒÐ½Ð¸Ð¹",
        "ipa": "neutral",
        "en": "without stylistic coloring",
        "pos": "",
        "gender": null,
        "note": ""
      },
      {
        "id": "vocab-25",
        "uk": "ÑƒÐ·Ð³Ð¾Ð´Ð¶ÐµÐ½Ð½Ñ",
        "ipa": "agreement",
        "en": "grammatical agreement",
        "pos": "",
        "gender": null,
        "note": ""
      }
    ],
    "reviewWords": []
  }
}