{
  "$schema": "../../../schemas/vibe-module.schema.json",
  "lesson": {
    "id": "lesson-uk-B2-180",
    "moduleId": "mod-uk-B2-180",
    "languagePair": "l2-uk-en",
    "subject": "language",
    "owner": "curricula-opus",
    "visibility": "public",
    "language": "uk",
    "targetLevel": "B2",
    "phase": "B2.2",
    "moduleNumber": 180,
    "title": "Idioms: Nature",
    "subtitle": "Ğ¤Ñ€Ğ°Ğ·ĞµĞ¾Ğ»Ğ¾Ğ³Ñ–Ğ·Ğ¼Ğ¸: ĞŸÑ€Ğ¸Ñ€Ğ¾Ğ´Ğ°",
    "description": "Ğ’Ğ¸Ğ²Ñ‡Ğ¸Ñ‚Ğ¸ Ñ–Ğ´Ñ–Ğ¾Ğ¼Ğ¸ Ğ· Ğ²Ğ¾Ğ´Ğ¾Ñ, ĞºĞ°Ğ¼ĞµĞ½ĞµĞ¼, Ğ´ĞµÑ€ĞµĞ²Ğ¾Ğ¼",
    "objectives": [
      "Ğ’Ğ¸Ğ²Ñ‡Ğ¸Ñ‚Ğ¸ Ñ–Ğ´Ñ–Ğ¾Ğ¼Ğ¸ Ğ· Ğ²Ğ¾Ğ´Ğ¾Ñ, ĞºĞ°Ğ¼ĞµĞ½ĞµĞ¼, Ğ´ĞµÑ€ĞµĞ²Ğ¾Ğ¼",
      "Ğ Ğ¾Ğ·ÑƒĞ¼Ñ–Ñ‚Ğ¸ Ğ¿Ñ€Ğ¸Ñ€Ğ¾Ğ´Ğ½Ñ– Ğ¼ĞµÑ‚Ğ°Ñ„Ğ¾Ñ€Ğ¸ Ñ‚Ğ° Ñ—Ñ…Ğ½Ñ” Ğ¿Ğ¾Ñ…Ğ¾Ğ´Ğ¶ĞµĞ½Ğ½Ñ",
      "Ğ’Ğ¸ĞºĞ¾Ñ€Ğ¸ÑÑ‚Ğ¾Ğ²ÑƒĞ²Ğ°Ñ‚Ğ¸ Ñ„Ñ€Ğ°Ğ·ĞµĞ¾Ğ»Ğ¾Ğ³Ñ–Ğ·Ğ¼Ğ¸ Ğ² Ğ¼Ğ¾Ğ²Ğ»ĞµĞ½Ğ½Ñ–",
      "ĞŸĞ¾Ñ€Ñ–Ğ²Ğ½ÑÑ‚Ğ¸ Ğ· Ğ°Ğ½Ğ³Ğ»Ñ–Ğ¹ÑÑŒĞºĞ¸Ğ¼Ğ¸ Ñ–Ğ´Ñ–Ğ¾Ğ¼Ğ°Ğ¼Ğ¸"
    ],
    "grammarFocus": [],
    "tags": [
      "phraseology",
      "idioms",
      "nature",
      "water",
      "stone",
      "tree",
      "weather"
    ],
    "totalDuration": 45,
    "transliterationMode": "none",
    "phases": [],
    "createdAt": "2025-12-01T22:58:37.257Z",
    "modifiedAt": "2025-12-01T22:58:37.257Z",
    "version": 1,
    "immersiveSections": [
      {
        "id": "section-intro",
        "type": "intro",
        "title": "Introduction",
        "content": "Ğ£ĞºÑ€Ğ°Ñ—Ğ½Ğ° â€” ĞºÑ€Ğ°Ñ—Ğ½Ğ° Ğ²ĞµĞ»Ğ¸ĞºĞ¸Ñ… Ñ€Ñ–Ñ‡Ğ¾Ğº, Ñ€Ğ¾Ğ´ÑÑ‡Ğ¸Ñ… Ñ‡Ğ¾Ñ€Ğ½Ğ¾Ğ·ĞµĞ¼Ñ–Ğ² Ñ‚Ğ° Ğ½ĞµĞ¾Ğ·Ğ¾Ñ€Ğ¸Ñ… ÑÑ‚ĞµĞ¿Ñ–Ğ². Ğ”Ğ½Ñ–Ğ¿Ñ€Ğ¾, Ğ”Ğ½Ñ–ÑÑ‚ĞµÑ€, Ğ”ÑƒĞ½Ğ°Ğ¹, ĞŸÑ–Ğ²Ğ´ĞµĞ½Ğ½Ğ¸Ğ¹ Ğ‘ÑƒĞ³ â€” Ñ†Ñ– Ğ²Ğ¾Ğ´Ğ½Ñ– Ğ°Ñ€Ñ‚ĞµÑ€Ñ–Ñ— Ñ„Ğ¾Ñ€Ğ¼ÑƒĞ²Ğ°Ğ»Ğ¸ Ñ–ÑÑ‚Ğ¾Ñ€Ñ–Ñ Ğ½Ğ°Ñ€Ğ¾Ğ´Ñƒ Ğ¿Ñ€Ğ¾Ñ‚ÑĞ³Ğ¾Ğ¼ Ñ‚Ğ¸ÑÑÑ‡Ğ¾Ğ»Ñ–Ñ‚ÑŒ. ĞĞµ Ğ´Ğ¸Ğ²Ğ½Ğ¾, Ñ‰Ğ¾ ÑƒĞºÑ€Ğ°Ñ—Ğ½ÑÑŒĞºĞ° Ğ¼Ğ¾Ğ²Ğ° Ğ½Ğ°ÑĞ¸Ñ‡ĞµĞ½Ğ° Ğ¾Ğ±Ñ€Ğ°Ğ·Ğ°Ğ¼Ğ¸ Ğ¿Ñ€Ğ¸Ñ€Ğ¾Ğ´Ğ¸: Ğ²Ğ¾Ğ´Ğ° ÑĞ¸Ğ¼Ğ²Ğ¾Ğ»Ñ–Ğ·ÑƒÑ” Ñ‡Ğ°Ñ Ñ– Ğ¾Ñ‡Ğ¸Ñ‰ĞµĞ½Ğ½Ñ, ĞºĞ°Ğ¼Ñ–Ğ½ÑŒ â€” ÑÑ‚Ñ–Ğ¹ĞºÑ–ÑÑ‚ÑŒ Ñ– Ğ¿ĞµÑ€ĞµÑˆĞºĞ¾Ğ´Ğ¸, Ğ° Ğ´ĞµÑ€ĞµĞ²Ğ¾ â€” Ğ¶Ğ¸Ñ‚Ñ‚Ñ Ñ– Ñ€Ğ¾Ğ´Ğ¸Ğ½Ñƒ. ĞšĞ¾Ğ»Ğ¸ ĞºĞ°Ğ¶ĞµĞ¼Ğ¾ Â«Ğ±Ğ°Ğ³Ğ°Ñ‚Ğ¾ Ğ²Ğ¾Ğ´Ğ¸ ÑƒÑ‚ĞµĞºĞ»Ğ¾Â», Ğ¼Ğ°Ñ”Ğ¼Ğ¾ Ğ½Ğ° ÑƒĞ²Ğ°Ğ·Ñ– Ğ¼Ğ¸Ğ½ÑƒĞ»Ğ¸Ğ¹ Ñ‡Ğ°Ñ. ĞšĞ¾Ğ»Ğ¸ Ğ³Ğ¾Ğ²Ğ¾Ñ€Ğ¸Ğ¼Ğ¾ Â«Ğ¿ÑƒÑÑ‚Ğ¸Ğ² ĞºĞ¾Ñ€Ñ–Ğ½Ğ½ÑÂ» â€” Ğ¹Ğ´ĞµÑ‚ÑŒÑÑ Ğ¿Ñ€Ğ¾ ÑƒĞºĞ¾Ñ€Ñ–Ğ½ĞµĞ½Ğ½Ñ Ğ½Ğ° Ğ½Ğ¾Ğ²Ğ¾Ğ¼Ñƒ Ğ¼Ñ–ÑÑ†Ñ–. ĞŸÑ€Ğ¸Ñ€Ğ¾Ğ´Ğ° â€” Ñ†Ğµ Ğ½Ğµ Ğ¿Ñ€Ğ¾ÑÑ‚Ğ¾ Ñ„Ğ¾Ğ½ ÑƒĞºÑ€Ğ°Ñ—Ğ½ÑÑŒĞºĞ¾Ğ³Ğ¾ Ğ¶Ğ¸Ñ‚Ñ‚Ñ, Ğ° ÑĞ°Ğ¼Ğ° Ñ‚ĞºĞ°Ğ½Ğ¸Ğ½Ğ° Ğ½Ğ°ÑˆĞ¾Ñ— Ğ¼Ğ¾Ğ²Ğ¸.\n\nĞ¦Ñ Ğ·Ğ²'ÑĞ·Ğ¾Ğº Ñ–Ğ· Ğ¿Ñ€Ğ¸Ñ€Ğ¾Ğ´Ğ¾Ñ Ğ³Ğ»Ğ¸Ğ±Ğ¾ĞºĞ¾ Ğ²ĞºĞ¾Ñ€ĞµĞ½ĞµĞ½Ğ¸Ğ¹ Ğ² ÑĞ»Ğ¾Ğ²'ÑĞ½ÑÑŒĞºÑ–Ğ¹ ĞºÑƒĞ»ÑŒÑ‚ÑƒÑ€Ñ–. Ğ”Ğ¾ Ğ¿Ñ€Ğ¸Ğ¹Ğ½ÑÑ‚Ñ‚Ñ Ñ…Ñ€Ğ¸ÑÑ‚Ğ¸ÑĞ½ÑÑ‚Ğ²Ğ° Ğ½Ğ°ÑˆÑ– Ğ¿Ñ€ĞµĞ´ĞºĞ¸ ÑĞ¿Ğ¾Ğ²Ñ–Ğ´ÑƒĞ²Ğ°Ğ»Ğ¸ ÑĞ·Ğ¸Ñ‡Ğ½Ğ¸Ñ†Ñ‚Ğ²Ğ¾ â€” Ğ²Ğ¾Ğ½Ğ¸ Ğ¿Ğ¾ĞºĞ»Ğ¾Ğ½ÑĞ»Ğ¸ÑÑ ÑĞ¸Ğ»Ğ°Ğ¼ Ğ¿Ñ€Ğ¸Ñ€Ğ¾Ğ´Ğ¸. Ğ Ñ–Ñ‡ĞºĞ° Ğ±ÑƒĞ»Ğ° Ğ±Ğ¾Ğ¶ĞµÑÑ‚Ğ²Ğ¾Ğ¼, Ğ´ĞµÑ€ĞµĞ²Ğ¾ â€” ÑĞ²ÑÑ‰ĞµĞ½Ğ½Ğ¸Ğ¼, ĞºĞ°Ğ¼Ñ–Ğ½ÑŒ â€” Ğ¼Ñ–ÑÑ†ĞµĞ¼ Ğ¶ĞµÑ€Ñ‚Ğ²Ğ¾Ğ¿Ñ€Ğ¸Ğ½Ğ¾ÑˆĞµĞ½ÑŒ. Ğ¦Ñ– Ğ²Ñ–Ñ€ÑƒĞ²Ğ°Ğ½Ğ½Ñ Ğ·Ğ°Ğ»Ğ¸ÑˆĞ¸Ğ»Ğ¸ ÑĞ»Ñ–Ğ´ Ñƒ Ğ¼Ğ¾Ğ²Ñ–: **Â«Ñ‚Ğ¸Ñ…Ğ° Ğ²Ğ¾Ğ´Ğ°Â»** â€” Ñ†Ğµ Ğ½Ğµ Ğ¿Ñ€Ğ¾ÑÑ‚Ğ¾ Ñ„Ñ–Ğ·Ğ¸Ñ‡Ğ½Ğ¸Ğ¹ Ğ¾Ğ¿Ğ¸Ñ, Ğ° Ğ¼ĞµÑ‚Ğ°Ñ„Ğ¾Ñ€Ğ° Ğ¿Ñ€Ğ¸Ñ…Ğ¾Ğ²Ğ°Ğ½Ğ¾Ñ— ÑĞ¸Ğ»Ğ¸. ĞŸÑ€Ğ¸ÑĞ»Ñ–Ğ²'Ñ Â«Ğ¢Ğ¸Ñ…Ğ° Ğ²Ğ¾Ğ´Ğ° Ğ³Ñ€ĞµĞ±Ğ»Ñ Ñ€Ğ²ĞµÂ» Ğ¿Ğ¾Ğ¿ĞµÑ€ĞµĞ´Ğ¶Ğ°Ñ”: Ğ·Ğ° ÑĞ¿Ğ¾ĞºÑ–Ğ¹Ğ½Ğ¾Ñ Ğ¿Ğ¾Ğ²ĞµÑ€Ñ…Ğ½ĞµÑ Ğ¼Ğ¾Ğ¶Ğµ Ñ…Ğ¾Ğ²Ğ°Ñ‚Ğ¸ÑÑ Ñ€ÑƒĞ¹Ğ½Ñ–Ğ²Ğ½Ğ° Ğ¼Ñ–Ñ†ÑŒ.\n\n**Ğ’Ğ¾Ğ´Ğ°** Ğ² ÑƒĞºÑ€Ğ°Ñ—Ğ½ÑÑŒĞºÑ–Ğ¹ Ñ„Ñ€Ğ°Ğ·ĞµĞ¾Ğ»Ğ¾Ğ³Ñ–Ñ— Ğ¼Ğ°Ñ” Ğ±Ğ°Ğ³Ğ°Ñ‚Ğ¾ ÑĞ¸Ğ¼Ğ²Ğ¾Ğ»Ñ–Ñ‡Ğ½Ğ¸Ñ… Ğ·Ğ½Ğ°Ñ‡ĞµĞ½ÑŒ. Ğ§Ğ¸ÑÑ‚Ğ° Ğ²Ğ¾Ğ´Ğ° â€” Ñ†Ğµ Ğ¿Ñ€Ğ°Ğ²Ğ´Ğ°, Ğ¼ÑƒÑ‚Ğ½Ğ° â€” Ğ±Ñ€ĞµÑ…Ğ½Ñ Ñ– Ñ…Ğ°Ğ¾Ñ. ĞšĞ¾Ğ»Ğ¸ ĞºĞ¾Ğ³Ğ¾ÑÑŒ Â«Ğ²Ğ¸Ğ²Ğ¾Ğ´ÑÑ‚ÑŒ Ğ½Ğ° Ñ‡Ğ¸ÑÑ‚Ñƒ Ğ²Ğ¾Ğ´ÑƒÂ», Ñ†Ğµ Ğ¾Ğ·Ğ½Ğ°Ñ‡Ğ°Ñ” Ğ²Ğ¸ĞºÑ€Ğ¸Ñ‚Ñ‚Ñ Ğ¾Ğ±Ğ¼Ğ°Ğ½Ñƒ. Ğ¦ĞµĞ¹ Ğ¾Ğ±Ñ€Ğ°Ğ· Ğ»Ğ¾Ğ³Ñ–Ñ‡Ğ½Ğ¸Ğ¹: Ñƒ ĞºĞ°Ğ»Ğ°Ğ¼ÑƒÑ‚Ğ½Ñ–Ğ¹ Ğ²Ğ¾Ğ´Ñ– Ğ½Ñ–Ñ‡Ğ¾Ğ³Ğ¾ Ğ½Ğµ Ğ²Ğ¸Ğ´Ğ½Ğ¾, Ğ° Ğ² Ñ‡Ğ¸ÑÑ‚Ñ–Ğ¹ â€” Ğ²ÑĞµ ÑĞº Ğ½Ğ° Ğ´Ğ¾Ğ»Ğ¾Ğ½Ñ–. Ğ—Ğ²Ñ–Ğ´ÑĞ¸ Ğ¶ Ñ– Ğ²Ğ¸Ñ€Ğ°Ğ· Â«ĞºĞ°Ğ»Ğ°Ğ¼ÑƒÑ‚Ğ¸Ñ‚Ğ¸ Ğ²Ğ¾Ğ´ÑƒÂ» â€” Ğ½Ğ°Ğ²Ğ¼Ğ¸ÑĞ½Ğ¾ ÑÑ‚Ğ²Ğ¾Ñ€ÑĞ²Ğ°Ñ‚Ğ¸ Ğ¿Ğ»ÑƒÑ‚Ğ°Ğ½Ğ¸Ğ½Ñƒ.\n\nĞ Ğ¾ÑÑŒ **ĞºĞ°Ğ¼Ñ–Ğ½ÑŒ** â€” ÑĞ¸Ğ¼Ğ²Ğ¾Ğ» Ğ°Ğ¼Ğ±Ñ–Ğ²Ğ°Ğ»ĞµĞ½Ñ‚Ğ½Ğ¸Ğ¹. Ğ— Ğ¾Ğ´Ğ½Ğ¾Ğ³Ğ¾ Ğ±Ğ¾ĞºÑƒ, Ñ†Ğµ ÑÑ‚Ñ–Ğ¹ĞºÑ–ÑÑ‚ÑŒ Ñ– Ğ½Ğ°Ğ´Ñ–Ğ¹Ğ½Ñ–ÑÑ‚ÑŒ (Â«Ñ‚Ğ²ĞµÑ€Ğ´Ğ¸Ğ¹ ÑĞº ĞºĞ°Ğ¼Ñ–Ğ½ÑŒÂ»). Ğ— Ñ–Ğ½ÑˆĞ¾Ğ³Ğ¾ â€” Ñ…Ğ¾Ğ»Ğ¾Ğ´Ğ½Ñ–ÑÑ‚ÑŒ Ñ– Ğ±ĞµĞ·Ğ´ÑƒÑˆĞ½Ñ–ÑÑ‚ÑŒ (Â«ĞºĞ°Ğ¼'ÑĞ½Ğµ ÑĞµÑ€Ñ†ĞµÂ»). ĞĞ»Ğµ Ğ½Ğ°Ğ¹Ñ†Ñ–ĞºĞ°Ğ²Ñ–ÑˆĞ¸Ğ¹ Ğ¾Ğ±Ñ€Ğ°Ğ· â€” **Â«ĞºĞ°Ğ¼Ñ–Ğ½ÑŒ Ğ·Ğ° Ğ¿Ğ°Ğ·ÑƒÑ…Ğ¾ÑÂ»**: Ğ¿Ñ€Ğ¸Ñ…Ğ¾Ğ²Ğ°Ğ½Ğ° Ğ²Ğ¾Ñ€Ğ¾Ğ¶Ñ–ÑÑ‚ÑŒ, ÑĞºÑƒ Ğ»ÑĞ´Ğ¸Ğ½Ğ° Ñ…Ğ¾Ğ²Ğ°Ñ” Ğ¿Ñ–Ğ´ Ğ¾Ğ´ÑĞ³Ğ¾Ğ¼, Ğ³Ğ¾Ñ‚ÑƒÑÑ‡Ğ¸ÑÑŒ Ğ´Ğ¾ Ğ¿Ğ¾Ğ¼ÑÑ‚Ğ¸. Ğ¦ĞµĞ¹ Ğ²Ğ¸Ñ€Ğ°Ğ· Ğ¼Ğ°Ñ” Ğ´Ğ°Ğ²Ğ½Ñ” Ğ¿Ğ¾Ñ…Ğ¾Ğ´Ğ¶ĞµĞ½Ğ½Ñ â€” ÑĞµĞ»ÑĞ½Ğ¸ ÑĞ¿Ñ€Ğ°Ğ²Ğ´Ñ– Ğ½Ğ¾ÑĞ¸Ğ»Ğ¸ ĞºĞ°Ğ¼ĞµĞ½Ñ– Ğ·Ğ° Ğ¿Ğ°Ğ·ÑƒÑ…Ğ¾Ñ Ğ´Ğ»Ñ ÑĞ°Ğ¼Ğ¾Ğ·Ğ°Ñ…Ğ¸ÑÑ‚Ñƒ Ñ‡Ğ¸ Ğ½Ğ°Ğ¿Ğ°Ğ´Ñƒ.\n\n> **Ğ§Ğ¸ Ğ·Ğ½Ğ°Ğ»Ğ¸ Ğ²Ğ¸?**\n>\n> Ğ’Ğ¸Ñ€Ğ°Ğ· **Â«Ğ¿Ñ–Ğ´ Ğ»ĞµĞ¶Ğ°Ñ‡Ğ¸Ğ¹ ĞºĞ°Ğ¼Ñ–Ğ½ÑŒ Ğ²Ğ¾Ğ´Ğ° Ğ½Ğµ Ñ‚ĞµÑ‡ĞµÂ»** Ğ¼Ğ°Ñ” Ğ´ÑƒĞ¶Ğµ Ğ´Ğ°Ğ²Ğ½Ñ” Ğ¿Ğ¾Ñ…Ğ¾Ğ´Ğ¶ĞµĞ½Ğ½Ñ. Ğ£ Ğ³Ñ–Ñ€ÑÑŒĞºĞ¸Ñ… Ñ€Ñ–Ñ‡ĞºĞ°Ñ… ĞºĞ°Ğ¼ĞµĞ½Ñ–, Ñ‰Ğ¾ Ğ»ĞµĞ¶Ğ°Ñ‚ÑŒ Ğ½ĞµÑ€ÑƒÑ…Ğ¾Ğ¼Ğ¾, Ğ· Ñ‡Ğ°ÑĞ¾Ğ¼ Ğ¾Ğ±Ñ€Ğ¾ÑÑ‚Ğ°ÑÑ‚ÑŒ Ğ¼ÑƒĞ»Ğ¾Ğ¼ Ñ– Ğ¼Ğ¾Ñ…Ğ¾Ğ¼ â€” Ğ²Ğ¾Ğ´Ğ° Ğ¾Ğ±Ñ‚Ñ–ĞºĞ°Ñ” Ñ—Ñ… ÑÑ‚Ğ¾Ñ€Ğ¾Ğ½Ğ¾Ñ. Ğ›Ğ¸ÑˆĞµ ĞºĞ°Ğ¼ĞµĞ½Ñ–, Ñ‰Ğ¾ Ñ€ÑƒÑ…Ğ°ÑÑ‚ÑŒÑÑ, Ğ¾Ğ¼Ğ¸Ğ²Ğ°ÑÑ‚ÑŒÑÑ ÑĞ²Ñ–Ğ¶Ğ¾Ñ Ğ²Ğ¾Ğ´Ğ¾Ñ. ĞœĞµÑ‚Ğ°Ñ„Ğ¾Ñ€Ğ° Ğ½Ğ°Ğ²Ñ‡Ğ°Ñ”: Ğ±ĞµĞ· Ğ´Ñ–Ñ— Ğ½ĞµĞ¼Ğ°Ñ” Ğ¿Ñ€Ğ¾Ğ³Ñ€ĞµÑÑƒ. Ğ¦Ñ–ĞºĞ°Ğ²Ğ¾, Ñ‰Ğ¾ Ğ² Ğ°Ğ½Ğ³Ğ»Ñ–Ğ¹ÑÑŒĞºÑ–Ğ¹ Ñ” ÑÑ…Ğ¾Ğ¶Ğ¸Ğ¹ Ğ¾Ğ±Ñ€Ğ°Ğ·: Â«A rolling stone gathers no mossÂ» (ĞšĞ°Ğ¼Ñ–Ğ½ÑŒ, Ñ‰Ğ¾ ĞºĞ¾Ñ‚Ğ¸Ñ‚ÑŒÑÑ, Ğ¼Ğ¾Ñ…Ğ¾Ğ¼ Ğ½Ğµ Ğ¾Ğ±Ñ€Ğ¾ÑÑ‚Ğ°Ñ”), Ğ°Ğ»Ğµ Ğ· Ğ¿Ñ€Ğ¾Ñ‚Ğ¸Ğ»ĞµĞ¶Ğ½Ğ¸Ğ¼ Ğ·Ğ½Ğ°Ñ‡ĞµĞ½Ğ½ÑĞ¼ â€” Ñ‚Ğ°Ğ¼ Ñ†Ğµ Ğ¿Ñ€Ğ¾ Ğ½ĞµĞ¿Ğ¾ÑÑ‚Ñ–Ğ¹Ğ½Ñ–ÑÑ‚ÑŒ!\n\n**Ğ”ĞµÑ€ĞµĞ²Ğ¾** â€” Ñ†Ğµ Ğ¶Ğ¸Ñ‚Ñ‚Ñ Ñ– Ñ€Ğ¾Ğ´Ğ¸Ğ½Ğ°. Â«Ğ Ğ¾Ğ´Ğ¾Ğ²Ğµ Ğ´ĞµÑ€ĞµĞ²Ğ¾Â» (Ğ³ĞµĞ½ĞµĞ°Ğ»Ğ¾Ğ³Ñ–Ñ) â€” ÑƒĞ½Ñ–Ğ²ĞµÑ€ÑĞ°Ğ»ÑŒĞ½Ğ¸Ğ¹ Ğ¾Ğ±Ñ€Ğ°Ğ·, Ğ°Ğ»Ğµ Ğ² ÑƒĞºÑ€Ğ°Ñ—Ğ½ÑÑŒĞºÑ–Ğ¹ Ñ” Ğ¹ ÑƒĞ½Ñ–ĞºĞ°Ğ»ÑŒĞ½Ñ– Ğ²Ğ¸Ñ€Ğ°Ğ·Ğ¸. Â«ĞŸÑƒÑÑ‚Ğ¸Ñ‚Ğ¸ ĞºĞ¾Ñ€Ñ–Ğ½Ğ½ÑÂ» Ğ¾Ğ·Ğ½Ğ°Ñ‡Ğ°Ñ” Ğ³Ğ»Ğ¸Ğ±Ğ¾ĞºĞ¾ ÑƒĞºĞ¾Ñ€ĞµĞ½Ğ¸Ñ‚Ğ¸ÑÑ Ğ½Ğ° Ğ½Ğ¾Ğ²Ğ¾Ğ¼Ñƒ Ğ¼Ñ–ÑÑ†Ñ– â€” Ğ²Ğ°Ğ¶Ğ»Ğ¸Ğ²Ğ° ĞºĞ¾Ğ½Ñ†ĞµĞ¿Ñ†Ñ–Ñ Ğ´Ğ»Ñ Ğ½Ğ°Ñ€Ğ¾Ğ´Ñƒ, Ñ‰Ğ¾ Ğ¿ĞµÑ€ĞµĞ¶Ğ¸Ğ² Ñ‡Ğ¸ÑĞ»ĞµĞ½Ğ½Ñ– Ğ¼Ñ–Ğ³Ñ€Ğ°Ñ†Ñ–Ñ—. Ğ **Â«Ğ·Ğ°Ğ±Ğ»ÑƒĞºĞ°Ñ‚Ğ¸ Ğ² Ñ‚Ñ€ÑŒĞ¾Ñ… ÑĞ¾ÑĞ½Ğ°Ñ…Â»** â€” Ñ†Ğµ Ğ¿Ñ€Ğ¾ Ğ½ĞµĞ·Ğ´Ğ°Ñ‚Ğ½Ñ–ÑÑ‚ÑŒ Ğ²Ğ¸Ñ€Ñ–ÑˆĞ¸Ñ‚Ğ¸ Ğ¿Ñ€Ğ¾ÑÑ‚Ñƒ Ğ¿Ñ€Ğ¾Ğ±Ğ»ĞµĞ¼Ñƒ. Ğ§Ğ¾Ğ¼Ñƒ ÑĞ°Ğ¼Ğµ Ñ‚Ñ€Ğ¸ ÑĞ¾ÑĞ½Ğ¸? Ğ‘Ğ¾ Ñ†Ğµ ÑĞ¼Ñ–ÑˆĞ½Ğ¾ Ğ¼Ğ°Ğ»Ğ¾ â€” Ğ·Ğ°Ğ±Ğ»ÑƒĞºĞ°Ñ‚Ğ¸ ÑĞµÑ€ĞµĞ´ Ñ‚Ñ€ÑŒĞ¾Ñ… Ğ´ĞµÑ€ĞµĞ² Ğ¼Ğ¾Ğ¶Ğµ Ğ»Ğ¸ÑˆĞµ Ğ¿Ğ¾Ğ²Ğ½Ğ¸Ğ¹ Ğ½ĞµĞ²Ğ´Ğ°Ñ…Ğ°.\n\n> **ĞœÑ–Ñ„ vs Ğ¤Ğ°ĞºÑ‚**\n>\n> ğŸš« **ĞœÑ–Ñ„:** Â«Ğ‘ÑƒÑ€Ñ Ğ² ÑĞºĞ»ÑĞ½Ñ†Ñ– Ğ²Ğ¾Ğ´Ğ¸Â» â€” Ğ°Ğ½Ğ³Ğ»Ñ–Ğ¹ÑÑŒĞºĞ° Ñ–Ğ´Ñ–Ğ¾Ğ¼Ğ°.\n>\n> âœ… **Ğ¤Ğ°ĞºÑ‚:** Ğ¦ĞµĞ¹ Ğ²Ğ¸Ñ€Ğ°Ğ· Ğ¼Ğ°Ñ” Ğ»Ğ°Ñ‚Ğ¸Ğ½ÑÑŒĞºĞµ Ğ¿Ğ¾Ñ…Ğ¾Ğ´Ğ¶ĞµĞ½Ğ½Ñ â€” Â«excitare fluctus in simpuloÂ» (Ğ·Ğ±ÑƒĞ´Ğ¶ÑƒĞ²Ğ°Ñ‚Ğ¸ Ñ…Ğ²Ğ¸Ğ»Ñ– Ğ² Ñ‡ĞµÑ€Ğ¿Ğ°ĞºÑƒ), ÑĞºĞµ Ğ²Ğ¶Ğ¸Ğ²Ğ°Ğ² Ğ¦Ğ¸Ñ†ĞµÑ€Ğ¾Ğ½! ĞĞ½Ğ³Ğ»Ñ–Ğ¹ÑÑŒĞºĞ° Ğ²ĞµÑ€ÑÑ–Ñ Â«storm in a teacupÂ» Ñ‚Ğ° ÑƒĞºÑ€Ğ°Ñ—Ğ½ÑÑŒĞºĞ° Â«Ğ±ÑƒÑ€Ñ Ğ² ÑĞºĞ»ÑĞ½Ñ†Ñ– Ğ²Ğ¾Ğ´Ğ¸Â» â€” Ğ¿Ğ°Ñ€Ğ°Ğ»ĞµĞ»ÑŒĞ½Ñ– Ğ·Ğ°Ğ¿Ğ¾Ğ·Ğ¸Ñ‡ĞµĞ½Ğ½Ñ Ğ· ĞºĞ»Ğ°ÑĞ¸Ñ‡Ğ½Ğ¾Ñ— Ñ‚Ñ€Ğ°Ğ´Ğ¸Ñ†Ñ–Ñ—. Ğ£ÑÑ– Ğ²Ğ¾Ğ½Ğ¸ Ğ¾Ğ·Ğ½Ğ°Ñ‡Ğ°ÑÑ‚ÑŒ Ğ¿ĞµÑ€ĞµĞ±Ñ–Ğ»ÑŒÑˆĞµĞ½Ğ½Ñ Ğ½ĞµĞ·Ğ½Ğ°Ñ‡Ğ½Ğ¾Ñ— Ğ¿Ñ€Ğ¾Ğ±Ğ»ĞµĞ¼Ğ¸.\n\nĞŸÑ€Ğ¸Ñ€Ğ¾Ğ´Ğ½Ñ– Ğ¼ĞµÑ‚Ğ°Ñ„Ğ¾Ñ€Ğ¸ Ğ¾ÑĞ¾Ğ±Ğ»Ğ¸Ğ²Ğ¾ Ğ±Ğ°Ğ³Ğ°Ñ‚Ñ– Ğ² ÑƒĞºÑ€Ğ°Ñ—Ğ½ÑÑŒĞºĞ¸Ñ… Ğ¿Ñ€Ğ¸ÑĞ»Ñ–Ğ²'ÑÑ…. **Â«Ğ©Ğ¾ Ğ¿Ğ¾ÑÑ–Ñ”Ñˆ, Ñ‚Ğµ Ğ¹ Ğ¿Ğ¾Ğ¶Ğ½ĞµÑˆÂ»** â€” Ñ†Ğµ Ğ½Ğµ Ğ»Ğ¸ÑˆĞµ Ğ°Ğ³Ñ€Ğ°Ñ€Ğ½Ğ° Ğ¼ÑƒĞ´Ñ€Ñ–ÑÑ‚ÑŒ, Ğ° Ğ¹ Ğ¼Ğ¾Ñ€Ğ°Ğ»ÑŒĞ½Ğ¸Ğ¹ Ğ·Ğ°ĞºĞ¾Ğ½ Ğ¿Ñ€Ğ¸Ñ‡Ğ¸Ğ½Ğ¸ Ñ‚Ğ° Ğ½Ğ°ÑĞ»Ñ–Ğ´ĞºÑƒ. Â«Ğ¥Ñ‚Ğ¾ ÑÑ–Ñ” Ğ²Ñ–Ñ‚ĞµÑ€, Ñ‚Ğ¾Ğ¹ Ğ¿Ğ¾Ğ¶Ğ½Ğµ Ğ±ÑƒÑ€ÑÂ» â€” Ñ‰Ğµ Ğ³Ğ»Ğ¸Ğ±ÑˆĞ° Ğ²ĞµÑ€ÑÑ–Ñ: Ñ…Ñ‚Ğ¾ Ğ¿Ğ¾Ñ‡Ğ¸Ğ½Ğ°Ñ” ĞºĞ¾Ğ½Ñ„Ğ»Ñ–ĞºÑ‚, Ğ¾Ñ‚Ñ€Ğ¸Ğ¼Ğ°Ñ” ĞºĞ°Ñ‚Ğ°ÑÑ‚Ñ€Ğ¾Ñ„Ñƒ. Ğ¦Ñ– Ğ¾Ğ±Ñ€Ğ°Ğ·Ğ¸ Ğ±Ğ»Ğ¸Ğ·ÑŒĞºÑ– ĞºĞ¾Ğ¶Ğ½Ğ¾Ğ¼Ñƒ ÑƒĞºÑ€Ğ°Ñ—Ğ½Ñ†Ñ, Ğ±Ğ¾ ÑÑ–Ğ»ÑŒÑÑŒĞºĞµ Ğ³Ğ¾ÑĞ¿Ğ¾Ğ´Ğ°Ñ€ÑÑ‚Ğ²Ğ¾ ÑÑ‚Ğ¾Ğ»Ñ–Ñ‚Ñ‚ÑĞ¼Ğ¸ Ğ±ÑƒĞ»Ğ¾ Ğ¾ÑĞ½Ğ¾Ğ²Ğ¾Ñ Ğ¶Ğ¸Ñ‚Ñ‚Ñ.\n\n---",
        "titleUk": "Ğ’ÑÑ‚ÑƒĞ¿"
      },
      {
        "id": "section-Ğ·Ğ¼Ñ–ÑÑ‚-ÑƒÑ€Ğ¾ĞºÑƒ",
        "type": "content",
        "title": "Ğ—Ğ¼Ñ–ÑÑ‚ ÑƒÑ€Ğ¾ĞºÑƒ",
        "content": "## Ğ Ğ¾Ğ·Ğ¼Ğ¸Ğ½ĞºĞ°\n\n### ĞŸÑ€Ğ¸Ñ€Ğ¾Ğ´Ğ° ÑĞº Ğ¼ĞµÑ‚Ğ°Ñ„Ğ¾Ñ€Ğ°\n\nĞ£ĞºÑ€Ğ°Ñ—Ğ½Ñ†Ñ– Ñ‡Ğ°ÑÑ‚Ğ¾ Ğ²Ğ¸ĞºĞ¾Ñ€Ğ¸ÑÑ‚Ğ¾Ğ²ÑƒÑÑ‚ÑŒ Ğ¿Ñ€Ğ¸Ñ€Ğ¾Ğ´Ñƒ Ğ´Ğ»Ñ Ğ¾Ğ¿Ğ¸ÑÑƒ Ğ¶Ğ¸Ñ‚Ñ‚Ñ:\n- **Ğ’Ğ¾Ğ´Ğ°** â€” Ğ¿Ğ»Ğ¸Ğ½ Ñ‡Ğ°ÑÑƒ, Ğ¿Ñ€Ğ°Ğ²Ğ´Ğ°/Ğ±Ñ€ĞµÑ…Ğ½Ñ, Ğ¿ĞµÑ€ĞµÑˆĞºĞ¾Ğ´Ğ¸\n- **ĞšĞ°Ğ¼Ñ–Ğ½ÑŒ** â€” ÑÑ‚Ñ–Ğ¹ĞºÑ–ÑÑ‚ÑŒ, Ñ…Ğ¾Ğ»Ğ¾Ğ´Ğ½Ñ–ÑÑ‚ÑŒ, Ğ¿ĞµÑ€ĞµÑˆĞºĞ¾Ğ´Ğ¸\n- **Ğ”ĞµÑ€ĞµĞ²Ğ¾** â€” Ğ¶Ğ¸Ñ‚Ñ‚Ñ, Ñ€Ğ¾Ğ´Ğ¸Ğ½Ğ°, Ğ·Ñ€Ğ¾ÑÑ‚Ğ°Ğ½Ğ½Ñ\n- **ĞŸĞ¾Ğ³Ğ¾Ğ´Ğ°** â€” Ğ½Ğ°ÑÑ‚Ñ€Ñ–Ğ¹, Ğ½ĞµÑĞ¿Ğ¾Ğ´Ñ–Ğ²Ğ°Ğ½ĞºĞ¸, Ğ¿Ñ€Ğ¾Ğ±Ğ»ĞµĞ¼Ğ¸\n\n**ĞĞ±Ğ³Ğ¾Ğ²Ğ¾Ñ€ĞµĞ½Ğ½Ñ:** Ğ¯ĞºÑ– Ğ¿Ñ€Ğ¸Ñ€Ğ¾Ğ´Ğ½Ñ– Ğ¾Ğ±Ñ€Ğ°Ğ·Ğ¸ Ğ²Ğ¸ĞºĞ¾Ñ€Ğ¸ÑÑ‚Ğ¾Ğ²ÑƒÑ” Ğ²Ğ°ÑˆĞ° Ñ€Ñ–Ğ´Ğ½Ğ° Ğ¼Ğ¾Ğ²Ğ°? Ğ§Ğ¸ Ñ” ÑĞ¿Ñ–Ğ»ÑŒĞ½Ñ– Ğ¼ĞµÑ‚Ğ°Ñ„Ğ¾Ñ€Ğ¸ Ğ· ÑƒĞºÑ€Ğ°Ñ—Ğ½ÑÑŒĞºĞ¾Ñ?\n\n---\n\n## ĞŸÑ€ĞµĞ·ĞµĞ½Ñ‚Ğ°Ñ†Ñ–Ñ\n\n### Ğ’Ğ¾Ğ´Ğ° â€” Ñ‡Ğ°Ñ, Ğ¿Ñ€Ğ°Ğ²Ğ´Ğ°, Ğ´Ğ¾Ğ»Ñ\n\n#### ĞŸĞ»Ğ¸Ğ½ Ñ‡Ğ°ÑÑƒ Ñ‚Ğ° Ğ²Ğ¸ĞºÑ€Ğ¸Ñ‚Ñ‚Ñ\n\n| Ğ†Ğ´Ñ–Ğ¾Ğ¼Ğ° | Ğ—Ğ½Ğ°Ñ‡ĞµĞ½Ğ½Ñ | ĞĞ½Ğ³Ğ»Ñ–Ğ¹ÑÑŒĞºĞ¸Ğ¹ Ğ²Ñ–Ğ´Ğ¿Ğ¾Ğ²Ñ–Ğ´Ğ½Ğ¸Ğº |\n|--------|----------|------------------------|\n| Ğ±Ğ°Ğ³Ğ°Ñ‚Ğ¾ Ğ²Ğ¾Ğ´Ğ¸ ÑƒÑ‚ĞµĞºĞ»Ğ¾ | Ğ¼Ğ¸Ğ½ÑƒĞ»Ğ¾ Ğ±Ğ°Ğ³Ğ°Ñ‚Ğ¾ Ñ‡Ğ°ÑÑƒ | much water has flowed under the bridge |\n| Ğ²Ğ¸Ğ²ĞµÑÑ‚Ğ¸ Ğ½Ğ° Ñ‡Ğ¸ÑÑ‚Ñƒ Ğ²Ğ¾Ğ´Ñƒ | Ğ²Ğ¸ĞºÑ€Ğ¸Ñ‚Ğ¸ Ğ¿Ñ€Ğ°Ğ²Ğ´Ñƒ, Ğ¾Ğ±Ğ¼Ğ°Ğ½ | â€” |\n| Ğ²Ğ¸Ñ…Ğ¾Ğ´Ğ¸Ñ‚Ğ¸ ÑÑƒÑ…Ğ¸Ğ¼ Ğ· Ğ²Ğ¾Ğ´Ğ¸ | ÑƒĞ½Ğ¸ĞºĞ°Ñ‚Ğ¸ Ğ¿Ğ¾ĞºĞ°Ñ€Ğ°Ğ½Ğ½Ñ | get off scot-free |\n| ĞºĞ°Ğ»Ğ°Ğ¼ÑƒÑ‚Ğ¸Ñ‚Ğ¸ Ğ²Ğ¾Ğ´Ñƒ | Ğ½Ğ°Ğ²Ğ¼Ğ¸ÑĞ½Ğ¾ ÑÑ‚Ğ²Ğ¾Ñ€ÑĞ²Ğ°Ñ‚Ğ¸ Ğ¿Ğ»ÑƒÑ‚Ğ°Ğ½Ğ¸Ğ½Ñƒ | muddy the waters |\n| Ğ»Ğ¸Ñ‚Ğ¸ Ğ²Ğ¾Ğ´Ñƒ | Ğ³Ğ¾Ğ²Ğ¾Ñ€Ğ¸Ñ‚Ğ¸ Ğ¿ÑƒÑÑ‚Ğµ, Ğ±ĞµĞ· Ğ·Ğ¼Ñ–ÑÑ‚Ñƒ | â€” |\n\n**Ğ•Ñ‚Ğ¸Ğ¼Ğ¾Ğ»Ğ¾Ğ³Ñ–Ñ:**\n- **Â«Ğ’Ğ¸Ğ²ĞµÑÑ‚Ğ¸ Ğ½Ğ° Ñ‡Ğ¸ÑÑ‚Ñƒ Ğ²Ğ¾Ğ´ÑƒÂ»** â€” Ñƒ ĞºĞ°Ğ»Ğ°Ğ¼ÑƒÑ‚Ğ½Ñ–Ğ¹ Ğ²Ğ¾Ğ´Ñ– Ğ½Ñ–Ñ‡Ğ¾Ğ³Ğ¾ Ğ½Ğµ Ğ²Ğ¸Ğ´Ğ½Ğ¾. ĞšĞ¾Ğ»Ğ¸ Ğ²Ğ¾Ğ´Ñƒ Ğ¾Ñ‡Ğ¸Ñ‰Ğ°ÑÑ‚ÑŒ, Ğ¿Ñ€Ğ°Ğ²Ğ´Ğ° ÑÑ‚Ğ°Ñ” Ğ²Ğ¸Ğ´Ğ¸Ğ¼Ğ¾Ñ.\n- **Â«Ğ’Ğ¸Ñ…Ğ¾Ğ´Ğ¸Ñ‚Ğ¸ ÑÑƒÑ…Ğ¸Ğ¼ Ğ· Ğ²Ğ¾Ğ´Ğ¸Â»** â€” Ñ†ĞµĞ¹ Ğ²Ğ¸Ñ€Ğ°Ğ· Ğ¼Ğ°Ñ” ÑÑƒĞ´Ğ¾Ğ²Ğµ Ğ¿Ğ¾Ñ…Ğ¾Ğ´Ğ¶ĞµĞ½Ğ½Ñ. Ğ£ ÑĞµÑ€ĞµĞ´Ğ½ÑŒĞ¾Ğ²Ñ–Ñ‡Ñ‡Ñ– Ñ–ÑĞ½ÑƒĞ²Ğ°Ğ»Ğ¾ Â«Ğ²Ğ¸Ğ¿Ñ€Ğ¾Ğ±ÑƒĞ²Ğ°Ğ½Ğ½Ñ Ğ²Ğ¾Ğ´Ğ¾ÑÂ»: Ğ¿Ñ–Ğ´Ğ¾Ğ·Ñ€ÑĞ²Ğ°Ğ½Ğ¾Ğ³Ğ¾ ĞºĞ¸Ğ´Ğ°Ğ»Ğ¸ Ğ² Ñ€Ñ–Ñ‡ĞºÑƒ, Ñ– ÑĞºÑ‰Ğ¾ Ğ²Ñ–Ğ½ Ğ²Ğ¸Ğ¿Ğ»Ğ¸Ğ²Ğ°Ğ² â€” Ğ²Ğ²Ğ°Ğ¶Ğ°Ğ²ÑÑ Ğ²Ğ¸Ğ½Ğ½Ğ¸Ğ¼ (Ğ±Ğ¾ Â«Ñ‡Ğ¸ÑÑ‚Ğ° Ğ²Ğ¾Ğ´Ğ° Ğ¹Ğ¾Ğ³Ğ¾ Ğ²Ñ–Ğ´ĞºĞ¸Ğ½ÑƒĞ»Ğ°Â»). ĞŸĞ°Ñ€Ğ°Ğ´Ğ¾ĞºÑĞ°Ğ»ÑŒĞ½Ğ¾, Ğ²Ğ¸Ğ¹Ñ‚Ğ¸ ÑÑƒÑ…Ğ¸Ğ¼ Ğ¾Ğ·Ğ½Ğ°Ñ‡Ğ°Ğ»Ğ¾ â€” ÑƒĞ½Ğ¸ĞºĞ½ÑƒÑ‚Ğ¸ Ğ¿Ğ¾ĞºĞ°Ñ€Ğ°Ğ½Ğ½Ñ.\n\n**ĞŸÑ€Ğ¸ĞºĞ»Ğ°Ğ´Ğ¸:**\n1. Â«ĞœĞ¸ Ğ¿Ğ¾Ğ·Ğ½Ğ°Ğ¹Ğ¾Ğ¼Ğ¸Ğ»Ğ¸ÑÑ Ñƒ 2005-Ğ¼Ñƒ. Ğ— Ñ‚Ğ¾Ğ³Ğ¾ Ñ‡Ğ°ÑÑƒ Ğ±Ğ°Ğ³Ğ°Ñ‚Ğ¾ Ğ²Ğ¾Ğ´Ğ¸ ÑƒÑ‚ĞµĞºĞ»Ğ¾ â€” Ğ¾Ğ±Ğ¾Ñ” Ğ¾Ğ´Ñ€ÑƒĞ¶ĞµĞ½Ñ–, Ğ¼Ğ°Ñ”Ğ¼Ğ¾ Ğ´Ñ–Ñ‚ĞµĞ¹.Â»\n2. Â«Ğ–ÑƒÑ€Ğ½Ğ°Ğ»Ñ–ÑÑ‚Ğ¸ Ğ½Ğ°Ñ€ĞµÑˆÑ‚Ñ– Ğ²Ğ¸Ğ²ĞµĞ»Ğ¸ Ğ¹Ğ¾Ğ³Ğ¾ Ğ½Ğ° Ñ‡Ğ¸ÑÑ‚Ñƒ Ğ²Ğ¾Ğ´Ñƒ â€” Ğ²Ğ¸ÑĞ²Ğ¸Ğ»Ğ¾ÑÑ, Ğ³Ñ€Ğ¾ÑˆÑ– Ğ²Ñ–Ğ½ ĞºÑ€Ğ°Ğ² Ñ€Ğ¾ĞºĞ°Ğ¼Ğ¸.Â»\n3. Â«Ğ¦ĞµĞ¹ Ğ¿Ğ¾Ğ»Ñ–Ñ‚Ğ¸Ğº Ğ·Ğ°Ğ²Ğ¶Ğ´Ğ¸ Ğ²Ğ¸Ñ…Ğ¾Ğ´Ğ¸Ñ‚ÑŒ ÑÑƒÑ…Ğ¸Ğ¼ Ğ· Ğ²Ğ¾Ğ´Ğ¸ â€” ÑĞºÑ–Ğ»ÑŒĞºĞ¸ ÑĞºĞ°Ğ½Ğ´Ğ°Ğ»Ñ–Ğ², Ğ° Ğ¹Ğ¾Ğ¼Ñƒ Ğ½Ñ–Ñ‡Ğ¾Ğ³Ğ¾!Â»\n\n#### Ğ¥Ğ°Ñ€Ğ°ĞºÑ‚ĞµÑ€ Ñ‚Ğ° ÑÑ‚Ğ°Ğ½\n\n| Ğ†Ğ´Ñ–Ğ¾Ğ¼Ğ° | Ğ—Ğ½Ğ°Ñ‡ĞµĞ½Ğ½Ñ | ĞĞ½Ğ³Ğ»Ñ–Ğ¹ÑÑŒĞºĞ¸Ğ¹ Ğ²Ñ–Ğ´Ğ¿Ğ¾Ğ²Ñ–Ğ´Ğ½Ğ¸Ğº |\n|--------|----------|---------|\n| Ñ‚Ğ¸Ñ…Ğ° Ğ²Ğ¾Ğ´Ğ° | ÑĞ¿Ğ¾ĞºÑ–Ğ¹Ğ½Ğ° Ğ·Ğ¾Ğ²Ğ½Ñ–, Ğ°Ğ»Ğµ Ğ¿Ğ¾Ñ‚ÑƒĞ¶Ğ½Ğ° Ğ»ÑĞ´Ğ¸Ğ½Ğ° | still waters run deep |\n| ÑĞº Ğ²Ğ¾Ğ´Ğ° ĞºÑ€Ñ–Ğ·ÑŒ Ğ¿Ğ°Ğ»ÑŒÑ†Ñ– | ÑˆĞ²Ğ¸Ğ´ĞºĞ¾ Ğ·Ğ½Ğ¸ĞºĞ°Ñ” | slip through one's fingers |\n| Ğ½Ğ¾ÑĞ¸Ñ‚Ğ¸ Ğ²Ğ¾Ğ´Ñƒ Ğ² Ñ€ĞµÑˆĞµÑ‚Ñ– | Ğ¼Ğ°Ñ€Ğ½Ğ° Ğ¿Ñ€Ğ°Ñ†Ñ | â€” |\n| Ğ½Ğ°Ğ±Ñ€Ğ°Ñ‚Ğ¸ Ğ² Ñ€Ğ¾Ñ‚ Ğ²Ğ¾Ğ´Ğ¸ | Ğ·Ğ°Ğ¼Ğ¾Ğ²ĞºĞ½ÑƒÑ‚Ğ¸ | â€” |\n| ÑĞº Ñƒ Ğ²Ğ¾Ğ´Ñƒ ĞºĞ°Ğ½ÑƒÑ‚Ğ¸ | Ğ·Ğ½Ğ¸ĞºĞ½ÑƒÑ‚Ğ¸ Ğ±ĞµĞ·ÑĞ»Ñ–Ğ´Ğ½Ğ¾ | vanish into thin air |\n\n**ĞšÑƒĞ»ÑŒÑ‚ÑƒÑ€Ğ½Ğ¸Ğ¹ ĞºĞ¾Ğ½Ñ‚ĞµĞºÑÑ‚:**\nÂ«Ğ¢Ğ¸Ñ…Ğ° Ğ²Ğ¾Ğ´Ğ° Ğ³Ñ€ĞµĞ±Ğ»Ñ Ñ€Ğ²ĞµÂ» â€” Ğ¾Ğ´Ğ½Ğµ Ğ· Ğ½Ğ°Ğ¹Ğ³Ğ»Ğ¸Ğ±ÑˆĞ¸Ñ… ÑƒĞºÑ€Ğ°Ñ—Ğ½ÑÑŒĞºĞ¸Ñ… Ğ¿Ñ€Ğ¸ÑĞ»Ñ–Ğ²'Ñ—Ğ². Ğ’Ğ¾Ğ½Ğ¾ Ğ·Ğ°ÑÑ‚ĞµÑ€Ñ–Ğ³Ğ°Ñ”: Ğ½Ğµ Ğ²Ğ°Ñ€Ñ‚Ğ¾ Ğ½ĞµĞ´Ğ¾Ğ¾Ñ†Ñ–Ğ½ÑĞ²Ğ°Ñ‚Ğ¸ ÑĞ¿Ğ¾ĞºÑ–Ğ¹Ğ½Ğ¸Ñ… Ğ»ÑĞ´ĞµĞ¹. ĞŸÑ–Ğ´ Ñ‚Ğ¸Ñ…Ğ¾Ñ Ğ¿Ğ¾Ğ²ĞµÑ€Ñ…Ğ½ĞµÑ Ğ¼Ğ¾Ğ¶Ğµ Ñ…Ğ¾Ğ²Ğ°Ñ‚Ğ¸ÑÑ Ğ²ĞµĞ»Ğ¸ĞºĞ° ÑĞ¸Ğ»Ğ°.\n\n**ĞŸÑ€Ğ¸ĞºĞ»Ğ°Ğ´Ğ¸:**\n1. Â«Ğ“Ñ€Ğ¾ÑˆÑ– Ğ¹Ğ´ÑƒÑ‚ÑŒ ÑĞº Ğ²Ğ¾Ğ´Ğ° ĞºÑ€Ñ–Ğ·ÑŒ Ğ¿Ğ°Ğ»ÑŒÑ†Ñ– â€” Ğ½Ğµ Ğ²ÑÑ‚Ğ¸Ğ³Ğ°Ñ Ğ·Ğ°Ñ€Ğ¾Ğ±Ğ»ÑÑ‚Ğ¸.Â»\n2. Â«Ğ’Ñ–Ğ½ Ğ½Ğ°Ğ±Ñ€Ğ°Ğ² Ñƒ Ñ€Ğ¾Ñ‚ Ğ²Ğ¾Ğ´Ğ¸ Ñ– Ğ½Ñ–ĞºĞ¾Ğ¼Ñƒ Ğ½Ğµ Ñ€Ğ¾Ğ·ĞºĞ°Ğ·Ğ°Ğ² Ğ¿Ñ€Ğ¾ Ğ¿Ğ¾Ğ±Ğ°Ñ‡ĞµĞ½Ğµ.Â»\n3. Â«ĞŸÑ–ÑĞ»Ñ Ñ‚Ğ¾Ğ³Ğ¾ Ğ´Ğ·Ğ²Ñ–Ğ½ĞºĞ° Ğ²Ñ–Ğ½ ÑĞº Ñƒ Ğ²Ğ¾Ğ´Ñƒ ĞºĞ°Ğ½ÑƒĞ² â€” Ğ½Ñ–Ñ…Ñ‚Ğ¾ Ğ½Ğµ Ğ¼Ñ–Ğ³ Ğ¹Ğ¾Ğ³Ğ¾ Ğ·Ğ½Ğ°Ğ¹Ñ‚Ğ¸.Â»\n\n> **Ğ§Ğ¸ Ğ·Ğ½Ğ°Ğ»Ğ¸ Ğ²Ğ¸?**\n>\n> Ğ’Ğ¸Ñ€Ğ°Ğ· **Â«Ğ½Ğ¾ÑĞ¸Ñ‚Ğ¸ Ğ²Ğ¾Ğ´Ñƒ Ğ² Ñ€ĞµÑˆĞµÑ‚Ñ–Â»** â€” Ñ†Ğµ Ğ¾Ğ±Ñ€Ğ°Ğ· ÑÑ–Ğ·Ñ–Ñ„Ğ¾Ğ²Ğ¾Ñ— Ğ¿Ñ€Ğ°Ñ†Ñ–. Ğ ĞµÑˆĞµÑ‚Ğ¾ (ÑĞ¸Ñ‚Ğ¾) Ğ¿Ñ€Ğ¸Ğ·Ğ½Ğ°Ñ‡ĞµĞ½Ğµ Ğ´Ğ»Ñ Ğ¿Ñ€Ğ¾ÑÑ–ÑĞ²Ğ°Ğ½Ğ½Ñ, Ñ‚Ğ¾Ğ¼Ñƒ Ğ²Ğ¾Ğ´Ğ° Ğ²Ğ¸Ñ‚Ñ–ĞºĞ°Ñ” Ğ¼Ğ¸Ñ‚Ñ‚Ñ”Ğ²Ğ¾. Ğ¦ĞµĞ¹ Ğ²Ğ¸Ñ€Ğ°Ğ· Ğ¼Ğ°Ñ” Ğ°Ğ½Ğ°Ğ»Ğ¾Ğ³Ğ¸ Ğ² Ğ±Ğ°Ğ³Ğ°Ñ‚ÑŒĞ¾Ñ… ĞºÑƒĞ»ÑŒÑ‚ÑƒÑ€Ğ°Ñ…: Ğ³Ñ€ĞµÑ†ÑŒĞºĞ¾Ğ¼Ñƒ Ğ¼Ñ–Ñ„Ñ– Ğ¿Ñ€Ğ¾ Ğ”Ğ°Ğ½Ğ°Ñ—Ğ´, Ğ·Ğ°ÑÑƒĞ´Ğ¶ĞµĞ½Ğ¸Ñ… Ğ²Ñ–Ñ‡Ğ½Ğ¾ Ğ½Ğ¾ÑĞ¸Ñ‚Ğ¸ Ğ²Ğ¾Ğ´Ñƒ Ğ² Ğ´Ñ–Ñ€Ğ°Ğ²Ğ¸Ñ… Ğ¿Ğ¾ÑÑƒĞ´Ğ¸Ğ½Ğ°Ñ…. Ğ’ ÑƒĞºÑ€Ğ°Ñ—Ğ½ÑÑŒĞºÑ–Ğ¹ Ğ²ĞµÑ€ÑÑ–Ñ— Ğ°ĞºÑ†ĞµĞ½Ñ‚ Ğ½Ğ° Ğ±ĞµĞ·Ğ³Ğ»ÑƒĞ·Ğ´Ğ¾ÑÑ‚Ñ– ÑĞ°Ğ¼Ğ¾Ğ³Ğ¾ Ğ·Ğ°Ğ½ÑÑ‚Ñ‚Ñ.\n\n---\n\n### ĞšĞ°Ğ¼Ñ–Ğ½ÑŒ â€” ÑÑ‚Ñ–Ğ¹ĞºÑ–ÑÑ‚ÑŒ, Ñ…Ğ¾Ğ»Ğ¾Ğ´Ğ½Ñ–ÑÑ‚ÑŒ, Ğ¿ĞµÑ€ĞµÑˆĞºĞ¾Ğ´Ğ¸\n\n#### Ğ¢Ğ²ĞµÑ€Ğ´Ñ–ÑÑ‚ÑŒ Ñ‚Ğ° ĞµĞ¼Ğ¾Ñ†Ñ–Ñ—\n\n| Ğ†Ğ´Ñ–Ğ¾Ğ¼Ğ° | Ğ—Ğ½Ğ°Ñ‡ĞµĞ½Ğ½Ñ | ĞĞ½Ğ³Ğ»Ñ–Ğ¹ÑÑŒĞºĞ¸Ğ¹ Ğ²Ñ–Ğ´Ğ¿Ğ¾Ğ²Ñ–Ğ´Ğ½Ğ¸Ğº |\n|--------|----------|------------------------|\n| ĞºĞ°Ğ¼Ñ–Ğ½ÑŒ Ğ½Ğ° ÑĞµÑ€Ñ†Ñ– | Ñ‚Ñ€Ğ¸Ğ²Ğ¾Ğ³Ğ°, Ğ¿Ñ€Ğ¾Ğ²Ğ¸Ğ½Ğ° | weight on one's heart |\n| ĞºĞ°Ğ¼Ñ–Ğ½ÑŒ Ğ· ÑĞµÑ€Ñ†Ñ Ğ²Ğ¿Ğ°Ğ² | Ğ¿Ğ¾Ğ»ĞµĞ³ÑˆĞµĞ½Ğ½Ñ | weight off one's shoulders |\n| ĞºĞ°Ğ¼'ÑĞ½Ğµ ÑĞµÑ€Ñ†Ğµ | Ğ±ĞµĞ·Ğ´ÑƒÑˆĞ½Ğ¸Ğ¹, Ğ±ĞµĞ· ĞµĞ¼Ğ¾Ñ†Ñ–Ğ¹ | heart of stone |\n| Ñ‚Ğ²ĞµÑ€Ğ´Ğ¸Ğ¹ ÑĞº ĞºĞ°Ğ¼Ñ–Ğ½ÑŒ | Ğ½ĞµĞ·Ğ»Ğ°Ğ¼Ğ½Ğ¸Ğ¹, ÑÑ‚Ñ–Ğ¹ĞºĞ¸Ğ¹ | hard as a rock |\n| ĞºĞ¸Ğ´Ğ°Ñ‚Ğ¸ ĞºĞ°Ğ¼Ñ–Ğ½Ğ½Ñ | ĞºÑ€Ğ¸Ñ‚Ğ¸ĞºÑƒĞ²Ğ°Ñ‚Ğ¸ | cast stones |\n\n**ĞšÑƒĞ»ÑŒÑ‚ÑƒÑ€Ğ½Ğ¸Ğ¹ ĞºĞ¾Ğ½Ñ‚ĞµĞºÑÑ‚:**\nÂ«ĞšĞ¸Ğ´Ğ°Ñ‚Ğ¸ ĞºĞ°Ğ¼Ñ–Ğ½Ğ½ÑÂ» Ğ¼Ğ°Ñ” Ğ±Ñ–Ğ±Ğ»Ñ–Ğ¹Ğ½Ğµ Ğ¿Ğ¾Ñ…Ğ¾Ğ´Ğ¶ĞµĞ½Ğ½Ñ â€” Ñ–ÑÑ‚Ğ¾Ñ€Ñ–Ñ Ğ¿Ñ€Ğ¾ Ğ¶Ñ–Ğ½ĞºÑƒ, ÑĞºÑƒ Ñ…Ğ¾Ñ‚Ñ–Ğ»Ğ¸ Ğ·Ğ°ĞºĞ¸Ğ´Ğ°Ñ‚Ğ¸ ĞºĞ°Ğ¼Ñ–Ğ½Ğ½ÑĞ¼, Ñ– ÑĞ»Ğ¾Ğ²Ğ° Ğ†ÑÑƒÑĞ°: Â«Ğ¥Ñ‚Ğ¾ Ğ±ĞµĞ· Ğ³Ñ€Ñ–Ñ…Ğ°, Ğ½ĞµÑ…Ğ°Ğ¹ Ğ¿ĞµÑ€ÑˆĞ¸Ğ¹ ĞºĞ¸Ğ½Ğµ ĞºĞ°Ğ¼Ñ–Ğ½ÑŒÂ». Ğ¢Ğ¾Ğ¼Ñƒ Ñ†ĞµĞ¹ Ğ²Ğ¸Ñ€Ğ°Ğ· Ñ‡Ğ°ÑÑ‚Ğ¾ Ğ²Ğ¶Ğ¸Ğ²Ğ°Ñ”Ñ‚ÑŒÑÑ Ğ· Ñ–Ñ€Ğ¾Ğ½Ñ–Ñ”Ñ Ñ‰Ğ¾Ğ´Ğ¾ Ñ‚Ğ¸Ñ…, Ñ…Ñ‚Ğ¾ ÑĞ°Ğ¼ Ğ½ĞµĞ±ĞµĞ·Ğ´Ğ¾Ğ³Ğ°Ğ½Ğ½Ğ¸Ğ¹.\n\n**ĞŸÑ€Ğ¸ĞºĞ»Ğ°Ğ´Ğ¸:**\n1. Â«ĞšĞ°Ğ¼Ñ–Ğ½ÑŒ Ğ· ÑĞµÑ€Ñ†Ñ Ğ²Ğ¿Ğ°Ğ² â€” Ğ´Ğ¾Ğ½ÑŒĞºĞ° Ğ½Ğ°Ñ€ĞµÑˆÑ‚Ñ– Ğ½Ğ°Ğ¿Ğ¸ÑĞ°Ğ»Ğ°, Ñ‰Ğ¾ Ğ² Ğ±ĞµĞ·Ğ¿ĞµÑ†Ñ–.Â»\n2. Â«Ğ£ Ğ½ÑŒĞ¾Ğ³Ğ¾ ĞºĞ°Ğ¼'ÑĞ½Ğµ ÑĞµÑ€Ñ†Ğµ â€” Ğ±Ğ°Ñ‡Ğ¸Ğ², ÑĞº Ğ±Ğ°Ğ±ÑƒÑÑ Ğ²Ğ¿Ğ°Ğ»Ğ°, Ñ– Ğ¿Ñ€Ğ¾Ğ¹ÑˆĞ¾Ğ² Ğ¿Ğ¾Ğ²Ğ·.Â»\n3. Â«Ğ›ĞµĞ³ĞºĞ¾ ĞºĞ¸Ğ´Ğ°Ñ‚Ğ¸ ĞºĞ°Ğ¼Ñ–Ğ½Ğ½Ñ Ğ² Ñ‡ÑƒĞ¶Ğ¸Ğ¹ Ğ³Ğ¾Ñ€Ğ¾Ğ´, Ğ¿Ğ¾ĞºĞ¸ ÑĞ²Ñ–Ğ¹ â€” Ñƒ Ğ±ÑƒÑ€'ÑĞ½Ğ°Ñ….Â»\n\n#### Ğ”Ñ–Ñ Ñ‚Ğ° Ğ½Ğ°ÑĞ»Ñ–Ğ´ĞºĞ¸\n\n| Ğ†Ğ´Ñ–Ğ¾Ğ¼Ğ° | Ğ—Ğ½Ğ°Ñ‡ĞµĞ½Ğ½Ñ | ĞŸÑ€Ğ¸ĞºĞ»Ğ°Ğ´ |\n|--------|----------|---------|\n| Ğ¿Ñ–Ğ´ Ğ»ĞµĞ¶Ğ°Ñ‡Ğ¸Ğ¹ ĞºĞ°Ğ¼Ñ–Ğ½ÑŒ Ğ²Ğ¾Ğ´Ğ° Ğ½Ğµ Ñ‚ĞµÑ‡Ğµ | Ğ±ĞµĞ· Ğ´Ñ–Ñ— Ğ½ĞµĞ¼Ğ°Ñ” Ñ€ĞµĞ·ÑƒĞ»ÑŒÑ‚Ğ°Ñ‚Ñƒ | Ğ”Ñ–Ğ¹! ĞŸÑ–Ğ´ Ğ»ĞµĞ¶Ğ°Ñ‡Ğ¸Ğ¹ ĞºĞ°Ğ¼Ñ–Ğ½ÑŒ Ğ²Ğ¾Ğ´Ğ° Ğ½Ğµ Ñ‚ĞµÑ‡Ğµ. |\n| ĞºĞ°Ğ¼Ñ–Ğ½ÑŒ ÑĞ¿Ğ¾Ñ‚Ğ¸ĞºĞ°Ğ½Ğ½Ñ | Ğ³Ğ¾Ğ»Ğ¾Ğ²Ğ½Ğ° Ğ¿ĞµÑ€ĞµÑˆĞºĞ¾Ğ´Ğ° | ĞœĞ¾Ğ²Ğ° ÑÑ‚Ğ°Ğ»Ğ° ĞºĞ°Ğ¼ĞµĞ½ĞµĞ¼ ÑĞ¿Ğ¾Ñ‚Ğ¸ĞºĞ°Ğ½Ğ½Ñ. |\n| ĞºĞ°Ğ¼Ñ–Ğ½ÑŒ Ğ·Ğ° Ğ¿Ğ°Ğ·ÑƒÑ…Ğ¾Ñ | Ğ¿Ñ€Ğ¸Ñ…Ğ¾Ğ²Ğ°Ğ½Ğ° Ğ²Ğ¾Ñ€Ğ¾Ğ¶Ñ–ÑÑ‚ÑŒ | Ğ’Ñ–Ğ½ Ñ‚Ñ€Ğ¸Ğ¼Ğ°Ñ” ĞºĞ°Ğ¼Ñ–Ğ½ÑŒ Ğ·Ğ° Ğ¿Ğ°Ğ·ÑƒÑ…Ğ¾Ñ. |\n| ĞºĞ°Ğ¼ĞµĞ½ĞµĞ¼ Ğ²Ğ¿Ğ°ÑÑ‚Ğ¸ | Ñ€Ñ–Ğ·ĞºĞ¾ Ğ²Ğ¿Ğ°ÑÑ‚Ğ¸ | Ğ¦Ñ–Ğ½Ğ¸ ĞºĞ°Ğ¼ĞµĞ½ĞµĞ¼ Ğ²Ğ¿Ğ°Ğ»Ğ¸. |\n| Ğ½Ğµ Ğ·Ğ°Ğ»Ğ¸ÑˆĞ¸Ñ‚Ğ¸ ĞºĞ°Ğ¼ĞµĞ½Ñ Ğ½Ğ° ĞºĞ°Ğ¼ĞµĞ½Ñ– | Ğ¿Ğ¾Ğ²Ğ½Ñ–ÑÑ‚Ñ Ğ·Ğ½Ğ¸Ñ‰Ğ¸Ñ‚Ğ¸ | ĞšÑ€Ğ¸Ñ‚Ğ¸ĞºĞ¸ Ğ½Ğµ Ğ·Ğ°Ğ»Ğ¸ÑˆĞ¸Ğ»Ğ¸ ĞºĞ°Ğ¼ĞµĞ½Ñ Ğ½Ğ° ĞºĞ°Ğ¼ĞµĞ½Ñ–. |\n\n**ĞŸĞ¾Ñ…Ğ¾Ğ´Ğ¶ĞµĞ½Ğ½Ñ Â«ĞºĞ°Ğ¼Ñ–Ğ½ÑŒ Ğ·Ğ° Ğ¿Ğ°Ğ·ÑƒÑ…Ğ¾ÑÂ»:**\nĞ£ Ğ´Ğ°Ğ²Ğ½Ğ¸Ğ½Ñƒ ÑĞµĞ»ÑĞ½Ğ¸ ÑĞ¿Ñ€Ğ°Ğ²Ğ´Ñ– Ğ½Ğ¾ÑĞ¸Ğ»Ğ¸ ĞºĞ°Ğ¼ĞµĞ½Ñ– Ğ·Ğ° Ğ¿Ğ°Ğ·ÑƒÑ…Ğ¾Ñ (Ğ¿Ñ–Ğ´ Ğ²ĞµÑ€Ñ…Ğ½Ñ–Ğ¼ Ğ¾Ğ´ÑĞ³Ğ¾Ğ¼) Ğ´Ğ»Ñ ÑĞ°Ğ¼Ğ¾Ğ·Ğ°Ñ…Ğ¸ÑÑ‚Ñƒ. Ğ¯ĞºÑ‰Ğ¾ Ñ…Ñ‚Ğ¾ÑÑŒ Ñ…Ğ¾Ğ²Ğ°Ñ” ĞºĞ°Ğ¼Ñ–Ğ½ÑŒ â€” Ğ·Ğ½Ğ°Ñ‡Ğ¸Ñ‚ÑŒ, Ğ³Ğ¾Ñ‚ÑƒÑ”Ñ‚ÑŒÑÑ Ğ´Ğ¾ Ğ½Ğ°Ğ¿Ğ°Ğ´Ñƒ, Ñ…Ğ¾Ñ‡ Ğ·Ğ¾Ğ²Ğ½Ñ– Ğ¿Ğ¾Ğ²Ğ¾Ğ´Ğ¸Ñ‚ÑŒÑÑ Ğ¼Ğ¸Ñ€Ğ½Ğ¾.\n\n**ĞŸÑ€Ğ¸ĞºĞ»Ğ°Ğ´Ğ¸:**\n1. Â«Ğ Ñ–Ğ²ĞµĞ½ÑŒ Ğ±ĞµĞ·Ñ€Ğ¾Ğ±Ñ–Ñ‚Ñ‚Ñ ĞºĞ°Ğ¼ĞµĞ½ĞµĞ¼ Ğ²Ğ¿Ğ°Ğ² Ğ¿Ñ–ÑĞ»Ñ Ğ²Ñ–Ğ´ĞºÑ€Ğ¸Ñ‚Ñ‚Ñ Ğ½Ğ¾Ğ²Ğ¾Ğ³Ğ¾ Ğ·Ğ°Ğ²Ğ¾Ğ´Ñƒ.Â»\n2. Â«ĞĞµ Ğ·Ğ°Ğ»Ğ¸ÑˆĞ¸Ğ»Ğ¸ ĞºĞ°Ğ¼ĞµĞ½Ñ Ğ½Ğ° ĞºĞ°Ğ¼ĞµĞ½Ñ– Ğ²Ñ–Ğ´ Ğ¹Ğ¾Ğ³Ğ¾ Ñ‚ĞµĞ¾Ñ€Ñ–Ñ— â€” ĞºĞ¾Ğ¶ĞµĞ½ Ğ°Ñ€Ğ³ÑƒĞ¼ĞµĞ½Ñ‚ ÑĞ¿Ñ€Ğ¾ÑÑ‚ÑƒĞ²Ğ°Ğ»Ğ¸.Â»\n3. Â«Ğ’Ğ¾Ğ½Ğ° ÑƒÑĞ¼Ñ–Ñ…Ğ°Ñ”Ñ‚ÑŒÑÑ, Ğ°Ğ»Ğµ Ñ Ğ·Ğ½Ğ°Ñ â€” Ñ‚Ñ€Ğ¸Ğ¼Ğ°Ñ” ĞºĞ°Ğ¼Ñ–Ğ½ÑŒ Ğ·Ğ° Ğ¿Ğ°Ğ·ÑƒÑ…Ğ¾Ñ Ğ¿Ñ–ÑĞ»Ñ Ñ‚Ñ–Ñ”Ñ— ÑĞ²Ğ°Ñ€ĞºĞ¸.Â»\n\n> **ĞŸÑ€Ğ¸ÑĞ»Ñ–Ğ²'Ñ Ğ¿Ñ€Ğ¾ ĞºĞ°Ñ€Ğ¼Ñƒ:**\n>\n> **Â«Ğ¥Ñ‚Ğ¾ ÑÑ–Ñ” Ğ²Ñ–Ñ‚ĞµÑ€, Ñ‚Ğ¾Ğ¹ Ğ¿Ğ¾Ğ¶Ğ½Ğµ Ğ±ÑƒÑ€ÑÂ»** â€” Ñ†Ğµ Ğ¿Ñ€Ğ¾ Ğ½Ğ°ÑĞ»Ñ–Ğ´ĞºĞ¸ Ğ²Ğ»Ğ°ÑĞ½Ğ¸Ñ… Ğ´Ñ–Ğ¹. Ğ’Ñ–Ñ‚ĞµÑ€ Ğ¿Ğ¾ÑÑ–ÑÑ‚Ğ¸ Ğ½ĞµĞ¼Ğ¾Ğ¶Ğ»Ğ¸Ğ²Ğ¾, Ğ°Ğ»Ğµ Ğ¼ĞµÑ‚Ğ°Ñ„Ğ¾Ñ€Ğ° ÑÑĞ½Ğ°: Ñ…Ñ‚Ğ¾ Ğ¿Ğ¾Ñ‡Ğ¸Ğ½Ğ°Ñ” ĞºĞ¾Ğ½Ñ„Ğ»Ñ–ĞºÑ‚ Ñ‡Ğ¸ Ğ¿Ñ€Ğ¾Ğ±Ğ»ĞµĞ¼Ğ¸, Ğ¾Ñ‚Ñ€Ğ¸Ğ¼Ğ°Ñ” Ñ—Ñ… Ñƒ Ğ¿Ğ¾Ğ¼Ğ½Ğ¾Ğ¶ĞµĞ½Ğ¾Ğ¼Ñƒ Ğ²Ğ¸Ğ³Ğ»ÑĞ´Ñ–. ĞœĞ°Ñ” Ğ±Ñ–Ğ±Ğ»Ñ–Ğ¹Ğ½Ğµ Ğ¿Ğ¾Ñ…Ğ¾Ğ´Ğ¶ĞµĞ½Ğ½Ñ (ĞšĞ½Ğ¸Ğ³Ğ° ĞÑÑ–Ñ—).\n\n---\n\n### Ğ”ĞµÑ€ĞµĞ²Ğ¾ Ñ‚Ğ° Ñ€Ğ¾ÑĞ»Ğ¸Ğ½Ğ¸ â€” Ğ¶Ğ¸Ñ‚Ñ‚Ñ, Ğ·Ñ€Ğ¾ÑÑ‚Ğ°Ğ½Ğ½Ñ, ĞºĞ°Ñ€Ğ¼Ğ°\n\n#### ĞšĞ¾Ñ€Ñ–Ğ½Ğ½Ñ Ñ‚Ğ° Ğ·Ñ€Ğ¾ÑÑ‚Ğ°Ğ½Ğ½Ñ\n\n| Ğ†Ğ´Ñ–Ğ¾Ğ¼Ğ° | Ğ—Ğ½Ğ°Ñ‡ĞµĞ½Ğ½Ñ | ĞĞ½Ğ³Ğ»Ñ–Ğ¹ÑÑŒĞºĞ¸Ğ¹ Ğ²Ñ–Ğ´Ğ¿Ğ¾Ğ²Ñ–Ğ´Ğ½Ğ¸Ğº |\n|--------|----------|------------------------|\n| Ğ¿ÑƒÑÑ‚Ğ¸Ñ‚Ğ¸ ĞºĞ¾Ñ€Ñ–Ğ½Ğ½Ñ | Ğ¾ÑĞµĞ»Ğ¸Ñ‚Ğ¸ÑÑ, ÑƒĞºĞ¾Ñ€ĞµĞ½Ğ¸Ñ‚Ğ¸ÑÑ | put down roots |\n| Ñ€Ğ¾ÑÑ‚Ğ¸ ÑĞº Ğ³Ñ€Ğ¸Ğ±Ğ¸ Ğ¿Ñ–ÑĞ»Ñ Ğ´Ğ¾Ñ‰Ñƒ | ÑˆĞ²Ğ¸Ğ´ĞºĞ¾ Ğ·'ÑĞ²Ğ»ÑÑ‚Ğ¸ÑÑ | spring up like mushrooms |\n| Ñ€Ğ¾Ğ´Ğ¾Ğ²Ğµ Ğ´ĞµÑ€ĞµĞ²Ğ¾ | Ğ³ĞµĞ½ĞµĞ°Ğ»Ğ¾Ğ³Ñ–Ñ | family tree |\n| Ğ· ĞºĞ¾Ñ€Ñ–Ğ½Ğ½ÑĞ¼ Ğ²Ğ¸Ñ€Ğ²Ğ°Ñ‚Ğ¸ | Ğ¿Ğ¾Ğ²Ğ½Ñ–ÑÑ‚Ñ Ğ·Ğ½Ğ¸Ñ‰Ğ¸Ñ‚Ğ¸ | root out |\n| Ğ·Ğ°Ğ±Ğ»ÑƒĞºĞ°Ñ‚Ğ¸ Ğ² Ñ‚Ñ€ÑŒĞ¾Ñ… ÑĞ¾ÑĞ½Ğ°Ñ… | Ğ·Ğ°Ğ¿Ğ»ÑƒÑ‚Ğ°Ñ‚Ğ¸ÑÑ Ğ² Ğ¿Ñ€Ğ¾ÑÑ‚Ğ¾Ğ¼Ñƒ | â€” |\n\n**Ğ•Ñ‚Ğ¸Ğ¼Ğ¾Ğ»Ğ¾Ğ³Ñ–Ñ:**\n- **Â«ĞŸÑƒÑÑ‚Ğ¸Ñ‚Ğ¸ ĞºĞ¾Ñ€Ñ–Ğ½Ğ½ÑÂ»** â€” Ğ¾Ğ±Ñ€Ğ°Ğ· Ñ–Ğ· ÑÑ–Ğ»ÑŒÑÑŒĞºĞ¾Ğ³Ğ¾ Ğ³Ğ¾ÑĞ¿Ğ¾Ğ´Ğ°Ñ€ÑÑ‚Ğ²Ğ°. ĞšĞ¾Ğ»Ğ¸ Ñ€Ğ¾ÑĞ»Ğ¸Ğ½Ğ° Ğ¿ÑƒÑĞºĞ°Ñ” Ğ³Ğ»Ğ¸Ğ±Ğ¾ĞºĞµ ĞºĞ¾Ñ€Ñ–Ğ½Ğ½Ñ, Ñ—Ñ— Ğ²Ğ°Ğ¶ĞºĞ¾ Ğ¿ĞµÑ€ĞµÑĞ°Ğ´Ğ¸Ñ‚Ğ¸. Ğ¢Ğ°Ğº ÑĞ°Ğ¼Ğ¾ Ğ»ÑĞ´Ğ¸Ğ½Ğ°, Ñ‰Ğ¾ Â«Ğ¿ÑƒÑÑ‚Ğ¸Ğ»Ğ° ĞºĞ¾Ñ€Ñ–Ğ½Ğ½ÑÂ», Ğ¼Ñ–Ñ†Ğ½Ğ¾ Ğ¿Ñ€Ğ¸Ğ²'ÑĞ·Ğ°Ğ½Ğ° Ğ´Ğ¾ Ğ¼Ñ–ÑÑ†Ñ.\n- **Â«Ğ—Ğ°Ğ±Ğ»ÑƒĞºĞ°Ñ‚Ğ¸ Ğ² Ñ‚Ñ€ÑŒĞ¾Ñ… ÑĞ¾ÑĞ½Ğ°Ñ…Â»** â€” ÑƒĞ½Ñ–ĞºĞ°Ğ»ÑŒĞ½Ğ¸Ğ¹ ÑƒĞºÑ€Ğ°Ñ—Ğ½ÑÑŒĞºĞ¸Ğ¹ Ğ²Ğ¸Ñ€Ğ°Ğ·. Ğ¢Ñ€Ğ¸ Ğ´ĞµÑ€ĞµĞ²Ğ° â€” Ñ†Ğµ Ğ·Ğ°Ğ½Ğ°Ğ´Ñ‚Ğ¾ Ğ¼Ğ°Ğ»Ğ¾ Ğ´Ğ»Ñ ÑĞ¿Ñ€Ğ°Ğ²Ğ¶Ğ½ÑŒĞ¾Ğ³Ğ¾ Ğ»Ñ–ÑÑƒ, Ñ‚Ğ¾Ğ¼Ñƒ Ğ·Ğ°Ğ±Ğ»ÑƒĞºĞ°Ñ‚Ğ¸ Ñ‚Ğ°Ğ¼ Ğ¼Ğ¾Ğ¶Ğµ Ğ»Ğ¸ÑˆĞµ Ğ°Ğ±ÑĞ¾Ğ»ÑÑ‚Ğ½Ğ¸Ğ¹ Ğ´ÑƒÑ€ĞµĞ½ÑŒ.\n\n**ĞŸÑ€Ğ¸ĞºĞ»Ğ°Ğ´Ğ¸:**\n1. Â«Ğ•Ğ¼Ñ–Ğ³Ñ€Ğ°Ğ½Ñ‚Ğ¸ Ğ· Ğ£ĞºÑ€Ğ°Ñ—Ğ½Ğ¸ Ğ¿ÑƒÑÑ‚Ğ¸Ğ»Ğ¸ ĞºĞ¾Ñ€Ñ–Ğ½Ğ½Ñ Ğ² ĞšĞ°Ğ½Ğ°Ğ´Ñ– Ñ‰Ğµ ÑÑ‚Ğ¾ Ñ€Ğ¾ĞºÑ–Ğ² Ñ‚Ğ¾Ğ¼Ñƒ.Â»\n2. Â«ĞšĞ°Ğ²'ÑÑ€Ğ½Ñ– Ñ€Ğ¾ÑÑ‚ÑƒÑ‚ÑŒ ÑĞº Ğ³Ñ€Ğ¸Ğ±Ğ¸ Ğ¿Ñ–ÑĞ»Ñ Ğ´Ğ¾Ñ‰Ñƒ â€” Ğ½Ğ° ĞºĞ¾Ğ¶Ğ½Ğ¾Ğ¼Ñƒ Ñ€Ğ¾Ğ·Ñ– Ğ½Ğ¾Ğ²Ğ°!Â»\n3. Â«Ğ¯Ğº Ñ‚Ğ¸ Ğ¼Ğ¾Ğ¶ĞµÑˆ Ğ·Ğ°Ğ±Ğ»ÑƒĞºĞ°Ñ‚Ğ¸ Ğ² Ñ†ÑŒĞ¾Ğ¼Ñƒ Ğ·Ğ°Ğ²Ğ´Ğ°Ğ½Ğ½Ñ–? Ğ¢ÑƒÑ‚ ÑƒÑĞµ Ğ¿Ñ€Ğ¾ÑÑ‚Ğ¾ â€” Ğ½Ğµ Ğ±Ğ»ÑƒĞºĞ°Ğ¹ Ñƒ Ñ‚Ñ€ÑŒĞ¾Ñ… ÑĞ¾ÑĞ½Ğ°Ñ…!Â»\n\n#### Ğ’Ñ€Ğ¾Ğ¶Ğ°Ğ¹ Ñ‚Ğ° ĞºĞ°Ñ€Ğ¼Ğ°\n\n| Ğ†Ğ´Ñ–Ğ¾Ğ¼Ğ° | Ğ—Ğ½Ğ°Ñ‡ĞµĞ½Ğ½Ñ | ĞĞ½Ğ³Ğ»Ñ–Ğ¹ÑÑŒĞºĞ¸Ğ¹ Ğ²Ñ–Ğ´Ğ¿Ğ¾Ğ²Ñ–Ğ´Ğ½Ğ¸Ğº |\n|--------|----------|---------|\n| Ñ‰Ğ¾ Ğ¿Ğ¾ÑÑ–Ñ”Ñˆ, Ñ‚Ğµ Ğ¹ Ğ¿Ğ¾Ğ¶Ğ½ĞµÑˆ | ĞºĞ°Ñ€Ğ¼Ğ°, Ğ½Ğ°ÑĞ»Ñ–Ğ´ĞºĞ¸ Ğ´Ñ–Ğ¹ | as you sow, so shall you reap |\n| Ğ·Ğ±Ğ¸Ñ€Ğ°Ñ‚Ğ¸ Ğ¿Ğ»Ğ¾Ğ´Ğ¸ | Ğ¾Ñ‚Ñ€Ğ¸Ğ¼ÑƒĞ²Ğ°Ñ‚Ğ¸ Ñ€ĞµĞ·ÑƒĞ»ÑŒÑ‚Ğ°Ñ‚ Ğ¿Ñ€Ğ°Ñ†Ñ– | reap the fruits |\n| Ñ‡ĞµÑ€ĞµĞ· Ñ‚ĞµÑ€Ğ½Ğ¸ Ğ´Ğ¾ Ğ·Ñ–Ñ€Ğ¾Ğº | Ñ‡ĞµÑ€ĞµĞ· Ñ‚Ñ€ÑƒĞ´Ğ½Ğ¾Ñ‰Ñ– Ğ´Ğ¾ ÑƒÑĞ¿Ñ–Ñ…Ñƒ | per aspera ad astra |\n| ÑĞ±Ğ»ÑƒĞºĞ¾ Ğ²Ñ–Ğ´ ÑĞ±Ğ»ÑƒĞ½Ñ– Ğ½ĞµĞ´Ğ°Ğ»ĞµĞºĞ¾ Ğ¿Ğ°Ğ´Ğ°Ñ” | ÑÑ…Ğ¾Ğ¶Ğ¸Ğ¹ Ğ½Ğ° Ğ±Ğ°Ñ‚ÑŒĞºÑ–Ğ² | the apple doesn't fall far from the tree |\n\n**ĞšÑƒĞ»ÑŒÑ‚ÑƒÑ€Ğ½Ğ¸Ğ¹ ĞºĞ¾Ğ½Ñ‚ĞµĞºÑÑ‚:**\nÂ«Ğ§ĞµÑ€ĞµĞ· Ñ‚ĞµÑ€Ğ½Ğ¸ Ğ´Ğ¾ Ğ·Ñ–Ñ€Ğ¾ĞºÂ» â€” Ğ»Ğ°Ñ‚Ğ¸Ğ½ÑÑŒĞºĞ¸Ğ¹ Ğ²Ğ¸ÑĞ»Ñ–Ğ², ÑĞºĞ¸Ğ¹ ÑÑ‚Ğ°Ğ² Ğ´ĞµĞ²Ñ–Ğ·Ğ¾Ğ¼ Ğ±Ğ°Ğ³Ğ°Ñ‚ÑŒĞ¾Ñ… ĞºĞ¾ÑĞ¼Ñ–Ñ‡Ğ½Ğ¸Ñ… Ğ°Ğ³ĞµĞ½Ñ†Ñ–Ğ¹ (Ñƒ Ñ‚.Ñ‡. NASA). Ğ’ ÑƒĞºÑ€Ğ°Ñ—Ğ½ÑÑŒĞºÑ–Ğ¹ ĞºÑƒĞ»ÑŒÑ‚ÑƒÑ€Ñ– Ğ²Ñ–Ğ½ Ğ½Ğ°Ğ±ÑƒĞ² Ğ³Ğ»Ğ¸Ğ±Ğ¾ĞºĞ¾Ğ³Ğ¾ Ğ·Ğ½Ğ°Ñ‡ĞµĞ½Ğ½Ñ Ğ¿Ñ–Ğ´ Ñ‡Ğ°Ñ Ğ±Ğ¾Ñ€Ğ¾Ñ‚ÑŒĞ±Ğ¸ Ğ·Ğ° Ğ½ĞµĞ·Ğ°Ğ»ĞµĞ¶Ğ½Ñ–ÑÑ‚ÑŒ â€” ÑˆĞ»ÑÑ… Ğ´Ğ¾ ÑĞ²Ğ¾Ğ±Ğ¾Ğ´Ğ¸ Ğ·Ğ°Ğ²Ğ¶Ğ´Ğ¸ Ñ‚ĞµÑ€Ğ½Ğ¸ÑÑ‚Ğ¸Ğ¹.\n\n**ĞŸÑ€Ğ¸ĞºĞ»Ğ°Ğ´Ğ¸:**\n1. Â«Ğ©Ğ¾ Ğ¿Ğ¾ÑÑ–Ñ”Ñˆ, Ñ‚Ğµ Ğ¹ Ğ¿Ğ¾Ğ¶Ğ½ĞµÑˆ â€” Ñ€Ğ¾ĞºĞ°Ğ¼Ğ¸ Ğ±Ñ€ĞµÑ…Ğ°Ğ², Ñ‚ĞµĞ¿ĞµÑ€ Ğ½Ñ–Ñ…Ñ‚Ğ¾ Ğ½Ğµ Ğ²Ñ–Ñ€Ğ¸Ñ‚ÑŒ.Â»\n2. Â«Ğ’Ğ¾Ğ½Ğ° Ğ½Ğ°Ñ€ĞµÑˆÑ‚Ñ– Ğ·Ğ±Ğ¸Ñ€Ğ°Ñ” Ğ¿Ğ»Ğ¾Ğ´Ğ¸ ÑĞ²Ğ¾Ñ”Ñ— Ğ¿Ñ€Ğ°Ñ†Ñ– â€” ĞºĞ¾Ğ¼Ğ¿Ğ°Ğ½Ñ–Ñ Ğ¿Ñ€Ğ¸Ğ½Ğ¾ÑĞ¸Ñ‚ÑŒ Ğ¿Ñ€Ğ¸Ğ±ÑƒÑ‚Ğ¾Ğº.Â»\n3. Â«Ğ¡Ğ¸Ğ½ Ñ‚Ğ°ĞºĞ¸Ğ¹ Ğ¶Ğµ ÑƒĞ¿ĞµÑ€Ñ‚Ğ¸Ğ¹, ÑĞº Ğ±Ğ°Ñ‚ÑŒĞºĞ¾. Ğ¯Ğ±Ğ»ÑƒĞºĞ¾ Ğ²Ñ–Ğ´ ÑĞ±Ğ»ÑƒĞ½Ñ– Ğ½ĞµĞ´Ğ°Ğ»ĞµĞºĞ¾ Ğ¿Ğ°Ğ´Ğ°Ñ”!Â»\n\n---\n\n### ĞŸĞ¾Ğ³Ğ¾Ğ´Ğ° â€” Ğ½Ğ°ÑÑ‚Ñ€Ñ–Ğ¹, Ğ½ĞµÑĞ¿Ğ¾Ğ´Ñ–Ğ²Ğ°Ğ½ĞºĞ¸, Ğ¿Ñ€Ğ¾Ğ±Ğ»ĞµĞ¼Ğ¸\n\n| Ğ†Ğ´Ñ–Ğ¾Ğ¼Ğ° | Ğ—Ğ½Ğ°Ñ‡ĞµĞ½Ğ½Ñ | ĞĞ½Ğ³Ğ»Ñ–Ğ¹ÑÑŒĞºĞ¸Ğ¹ Ğ²Ñ–Ğ´Ğ¿Ğ¾Ğ²Ñ–Ğ´Ğ½Ğ¸Ğº |\n|--------|----------|------------------------|\n| Ğ±ÑƒÑ€Ñ Ğ² ÑĞºĞ»ÑĞ½Ñ†Ñ– Ğ²Ğ¾Ğ´Ğ¸ | Ğ¿ĞµÑ€ĞµĞ±Ñ–Ğ»ÑŒÑˆĞµĞ½Ğ½Ñ Ğ´Ñ€Ñ–Ğ±Ğ½Ğ¸Ñ†Ñ– | storm in a teacup |\n| Ñ‡ĞµĞºĞ°Ñ‚Ğ¸ Ğ±Ñ–Ğ»Ñ Ğ¼Ğ¾Ñ€Ñ Ğ¿Ğ¾Ğ³Ğ¾Ğ´Ğ¸ | Ğ¼Ğ°Ñ€Ğ½Ğ¾ Ñ‡ĞµĞºĞ°Ñ‚Ğ¸, Ğ½Ñ–Ñ‡Ğ¾Ğ³Ğ¾ Ğ½Ğµ Ñ€Ğ¾Ğ±Ğ»ÑÑ‡Ğ¸ | wait and see (ÑĞ»Ğ°Ğ±ÑˆĞµ) |\n| Ğ¿Ñ–ÑĞ»Ñ Ğ´Ğ¾Ñ‰Ñƒ Ğ² Ñ‡ĞµÑ‚Ğ²ĞµÑ€ | Ğ½Ñ–ĞºĞ¾Ğ»Ğ¸ | when pigs fly |\n| ÑĞ¾Ğ½Ñ†Ğµ Ğ²Ğ¸Ğ¹ÑˆĞ»Ğ¾ | Ğ½Ğ°ÑÑ‚Ñ€Ñ–Ğ¹ Ğ¿Ğ¾ĞºÑ€Ğ°Ñ‰Ğ¸Ğ²ÑÑ | the sun came out |\n| Ñ…Ğ¼Ğ°Ñ€Ğ¸ Ğ·Ğ±Ğ¸Ñ€Ğ°ÑÑ‚ÑŒÑÑ | Ğ¿Ñ€Ğ¾Ğ±Ğ»ĞµĞ¼Ğ¸ Ğ½Ğ°Ğ±Ğ»Ğ¸Ğ¶Ğ°ÑÑ‚ÑŒÑÑ | storm clouds gathering |\n\n**ĞŸĞ¾Ñ…Ğ¾Ğ´Ğ¶ĞµĞ½Ğ½Ñ Â«Ğ¿Ñ–ÑĞ»Ñ Ğ´Ğ¾Ñ‰Ñƒ Ğ² Ñ‡ĞµÑ‚Ğ²ĞµÑ€Â»:**\nĞ¦Ğµ Ğ¾Ğ´Ğ¸Ğ½ Ñ–Ğ· Ğ½Ğ°Ğ¹Ğ·Ğ°Ğ³Ğ°Ğ´ĞºĞ¾Ğ²Ñ–ÑˆĞ¸Ñ… Ğ²Ğ¸Ñ€Ğ°Ğ·Ñ–Ğ². Ğ§Ğ¾Ğ¼Ñƒ Ñ‡ĞµÑ‚Ğ²ĞµÑ€? Ğ„ ĞºÑ–Ğ»ÑŒĞºĞ° Ğ²ĞµÑ€ÑÑ–Ğ¹:\n1. Ğ§ĞµÑ‚Ğ²ĞµÑ€ â€” Ğ´ĞµĞ½ÑŒ Ğ±Ğ¾Ğ³Ğ°-Ğ³Ñ€Ğ¾Ğ¼Ğ¾Ğ²ĞµÑ€Ğ¶Ñ†Ñ (ĞŸĞµÑ€ÑƒĞ½Ğ°), Ñ– Ğ´Ğ¾Ñ‰ Ñƒ Ñ†ĞµĞ¹ Ğ´ĞµĞ½ÑŒ Ğ²Ğ²Ğ°Ğ¶Ğ°Ğ²ÑÑ Ğ¾ÑĞ¾Ğ±Ğ»Ğ¸Ğ²Ğ¸Ğ¼.\n2. Ğ¦ĞµÑ€ĞºĞ¾Ğ²Ğ½Ğ¸Ğ¹ Ñ‚Ğ¸Ğ¶Ğ´ĞµĞ½ÑŒ Ğ¿Ğ¾Ñ‡Ğ¸Ğ½Ğ°Ğ²ÑÑ Ğ² Ğ½ĞµĞ´Ñ–Ğ»Ñ, Ñ– Ñ‡ĞµÑ‚Ğ²ĞµÑ€ Ğ±ÑƒĞ² Â«ÑĞµÑ€ĞµĞ´Ğ¸Ğ½Ğ¾ÑÂ» â€” Ğ½Ñ–Ñ‡Ğ¸Ğ¼ Ğ¾ÑĞ¾Ğ±Ğ»Ğ¸Ğ²Ğ¸Ğ¼.\n3. ĞŸÑ€Ğ¾ÑÑ‚Ğ¾ Ğ°Ğ±ÑÑƒÑ€Ğ´Ğ½Ğ° Ğ´Ğ°Ñ‚Ğ° â€” Â«Ğ¿Ñ–ÑĞ»Ñ Ğ´Ğ¾Ñ‰Ñƒ Ğ² Ñ‡ĞµÑ‚Ğ²ĞµÑ€Â» Ğ·Ğ²ÑƒÑ‡Ğ¸Ñ‚ÑŒ Ğ±ĞµĞ·Ğ³Ğ»ÑƒĞ·Ğ´Ğ¾, ÑĞº Ñ– Ğ¾Ğ±Ñ–Ñ†ÑĞ½ĞºĞ°.\n\n**ĞŸÑ€Ğ¸ĞºĞ»Ğ°Ğ´Ğ¸:**\n1. Â«Ğ¢Ğ° Ñ†Ğµ Ğ±ÑƒÑ€Ñ Ğ² ÑĞºĞ»ÑĞ½Ñ†Ñ– Ğ²Ğ¾Ğ´Ğ¸ â€” Ğ²Ñ–Ğ½ Ğ¿Ñ€Ğ¾ÑÑ‚Ğ¾ Ğ½ĞµĞ¿Ñ€Ğ°Ğ²Ğ¸Ğ»ÑŒĞ½Ğ¾ Ğ·Ñ€Ğ¾Ğ·ÑƒĞ¼Ñ–Ğ² SMS!Â»\n2. Â«Ğ—Ğ°Ğ¼Ñ–ÑÑ‚ÑŒ Ñ‡ĞµĞºĞ°Ñ‚Ğ¸ Ğ±Ñ–Ğ»Ñ Ğ¼Ğ¾Ñ€Ñ Ğ¿Ğ¾Ğ³Ğ¾Ğ´Ğ¸, Ğ²Ñ–Ğ·ÑŒĞ¼Ğ¸ Ñ‚ĞµĞ»ĞµÑ„Ğ¾Ğ½ Ñ– Ğ¿Ğ¾Ğ´Ğ·Ğ²Ğ¾Ğ½Ğ¸ Ñ—Ğ¹.Â»\n3. Â«Ğ’Ñ–Ğ½ Ğ¿Ğ¾Ğ²ĞµÑ€Ğ½Ğµ Ğ±Ğ¾Ñ€Ğ³? Ğ¥Ğ°! ĞŸÑ–ÑĞ»Ñ Ğ´Ğ¾Ñ‰Ñƒ Ğ² Ñ‡ĞµÑ‚Ğ²ĞµÑ€!Â»\n\n---\n\n### Ğ†Ğ½ÑˆÑ– Ğ¿Ñ€Ğ¸Ñ€Ğ¾Ğ´Ğ½Ñ– Ñ–Ğ´Ñ–Ğ¾Ğ¼Ğ¸\n\n| Ğ†Ğ´Ñ–Ğ¾Ğ¼Ğ° | Ğ—Ğ½Ğ°Ñ‡ĞµĞ½Ğ½Ñ | ĞĞ½Ğ³Ğ»Ñ–Ğ¹ÑÑŒĞºĞ¸Ğ¹ Ğ²Ñ–Ğ´Ğ¿Ğ¾Ğ²Ñ–Ğ´Ğ½Ğ¸Ğº |\n|--------|----------|---------|\n| Ğ¼Ğ¾Ñ€Ğµ Ğ¿Ğ¾ ĞºĞ¾Ğ»Ñ–Ğ½Ğ° | Ğ½Ñ–Ñ‡Ğ¾Ğ³Ğ¾ Ğ½Ğµ ÑÑ‚Ñ€Ğ°ÑˆĞ½Ğ¾ (Ñ‡Ğ°ÑÑ‚Ğ¾ Ğ¿Ñ€Ğ¾ Ğ¿'ÑĞ½Ğ¸Ñ…) | â€” |\n| ĞºÑ€Ğ°Ğ¿Ğ»Ñ Ğ² Ğ¼Ğ¾Ñ€Ñ– | Ğ´ÑƒĞ¶Ğµ Ğ¼Ğ°Ğ»Ğ¾ Ğ² Ğ¿Ğ¾Ñ€Ñ–Ğ²Ğ½ÑĞ½Ğ½Ñ– | a drop in the ocean |\n| Ğ½Ğ° ĞºÑ€Ğ°Ğ¹ ÑĞ²Ñ–Ñ‚Ñƒ | Ğ´ÑƒĞ¶Ğµ Ğ´Ğ°Ğ»ĞµĞºĞ¾ | to the ends of the earth |\n| Ğ·Ğ¾Ğ»Ğ¾Ñ‚Ñ– Ğ³Ğ¾Ñ€Ğ¸ | Ğ²ĞµĞ»Ğ¸ĞºÑ– Ğ½ĞµÑ€ĞµĞ°Ğ»ÑŒĞ½Ñ– Ğ¾Ğ±Ñ–Ñ†ÑĞ½ĞºĞ¸ | promise the moon |\n| ÑĞº ÑĞ½Ñ–Ğ³ Ğ½Ğ° Ğ³Ğ¾Ğ»Ğ¾Ğ²Ñƒ | Ğ½ĞµÑĞ¿Ğ¾Ğ´Ñ–Ğ²Ğ°Ğ½Ğ¾ | out of the blue |\n\n**ĞšÑƒĞ»ÑŒÑ‚ÑƒÑ€Ğ½Ğ¸Ğ¹ ĞºĞ¾Ğ½Ñ‚ĞµĞºÑÑ‚:**\nÂ«ĞœĞ¾Ñ€Ğµ Ğ¿Ğ¾ ĞºĞ¾Ğ»Ñ–Ğ½Ğ°Â» Ñ‡Ğ°ÑÑ‚Ğ¾ Ğ²Ğ¶Ğ¸Ğ²Ğ°Ñ”Ñ‚ÑŒÑÑ Ğ² ĞºĞ¾Ğ½Ñ‚ĞµĞºÑÑ‚Ñ– Ğ°Ğ»ĞºĞ¾Ğ³Ğ¾Ğ»ÑŒĞ½Ğ¾Ğ³Ğ¾ ÑĞ¿'ÑĞ½Ñ–Ğ½Ğ½Ñ â€” ĞºĞ¾Ğ»Ğ¸ Ğ»ÑĞ´Ğ¸Ğ½Ğ° Ğ²Ñ‚Ñ€Ğ°Ñ‡Ğ°Ñ” Ğ²Ñ–Ğ´Ñ‡ÑƒÑ‚Ñ‚Ñ Ğ½ĞµĞ±ĞµĞ·Ğ¿ĞµĞºĞ¸. ĞĞ»Ğµ Ñ‚Ğ°ĞºĞ¾Ğ¶ Ğ¼Ğ¾Ğ¶Ğµ Ğ¾Ğ¿Ğ¸ÑÑƒĞ²Ğ°Ñ‚Ğ¸ ÑĞ¼Ñ–Ğ»Ğ¸Ğ²Ñƒ Ğ»ÑĞ´Ğ¸Ğ½Ñƒ, ÑĞºĞ° Ğ½Ñ–Ñ‡Ğ¾Ğ³Ğ¾ Ğ½Ğµ Ğ±Ğ¾Ñ—Ñ‚ÑŒÑÑ.\n\n**ĞŸÑ€Ğ¸ĞºĞ»Ğ°Ğ´Ğ¸:**\n1. Â«ĞŸ'ÑĞ½Ğ¾Ğ¼Ñƒ Ğ¼Ğ¾Ñ€Ğµ Ğ¿Ğ¾ ĞºĞ¾Ğ»Ñ–Ğ½Ğ° â€” Ğ¾ÑÑŒ Ñ– Ğ¿Ğ¾Ğ»Ñ–Ğ· Ğ½Ğ° Ğ´Ğ°Ñ….Â»\n2. Â«Ğ¦Ñ Ğ´Ğ¾Ğ¿Ğ¾Ğ¼Ğ¾Ğ³Ğ° â€” ĞºÑ€Ğ°Ğ¿Ğ»Ñ Ğ² Ğ¼Ğ¾Ñ€Ñ–. ĞŸĞ¾Ñ‚Ñ€Ñ–Ğ±Ğ½Ğ¾ Ğ² Ğ´ĞµÑÑÑ‚ÑŒ Ñ€Ğ°Ğ·Ñ–Ğ² Ğ±Ñ–Ğ»ÑŒÑˆĞµ.Â»\n3. Â«Ğ’Ñ–Ğ½ Ğ¿Ñ€Ğ¸Ñ—Ñ…Ğ°Ğ² ÑĞº ÑĞ½Ñ–Ğ³ Ğ½Ğ° Ğ³Ğ¾Ğ»Ğ¾Ğ²Ñƒ â€” Ğ±ĞµĞ· Ğ´Ğ·Ğ²Ñ–Ğ½ĞºĞ°, Ğ±ĞµĞ· Ğ¿Ğ¾Ğ¿ĞµÑ€ĞµĞ´Ğ¶ĞµĞ½Ğ½Ñ!Â»\n\n---\n\n## ĞŸÑ€Ğ°ĞºÑ‚Ğ¸ĞºĞ°\n\n### Ğ”Ğ¾Ğ¿Ğ¾Ğ²Ğ½Ñ–Ñ‚ÑŒ Ñ–Ğ´Ñ–Ğ¾Ğ¼Ñƒ\n\n1. Ğ‘Ğ°Ğ³Ğ°Ñ‚Ğ¾ Ğ²Ğ¾Ğ´Ğ¸ ___.\n   > [!answer] **ÑƒÑ‚ĞµĞºĞ»Ğ¾**\n2. ĞšĞ°Ğ¼Ñ–Ğ½ÑŒ Ğ· ___ Ğ²Ğ¿Ğ°Ğ².\n   > [!answer] **ÑĞµÑ€Ñ†Ñ**\n3. Ğ’Ñ–Ğ½ Ğ²Ğ¸Ğ¹ÑˆĞ¾Ğ² ÑÑƒÑ…Ğ¸Ğ¼ Ğ· ___.\n   > [!answer] **Ğ²Ğ¾Ğ´Ğ¸**\n4. Ğ Ğ¾ÑÑ‚ÑƒÑ‚ÑŒ ÑĞº Ğ³Ñ€Ğ¸Ğ±Ğ¸ Ğ¿Ñ–ÑĞ»Ñ ___.\n   > [!answer] **Ğ´Ğ¾Ñ‰Ñƒ**\n5. Ğ‘ÑƒÑ€Ñ Ğ² ÑĞºĞ»ÑĞ½Ñ†Ñ– ___.\n   > [!answer] **Ğ²Ğ¾Ğ´Ğ¸**\n6. Ğ©Ğ¾ Ğ¿Ğ¾ÑÑ–Ñ”Ñˆ, Ñ‚Ğµ Ğ¹ ___.\n   > [!answer] **Ğ¿Ğ¾Ğ¶Ğ½ĞµÑˆ**\n7. Ğ—Ğ°Ğ±Ğ»ÑƒĞºĞ°Ğ² Ñƒ Ñ‚Ñ€ÑŒĞ¾Ñ… ___.\n   > [!answer] **ÑĞ¾ÑĞ½Ğ°Ñ…**\n### Ğ’Ğ¸Ğ±ĞµÑ€Ñ–Ñ‚ÑŒ Ğ¿Ñ€Ğ°Ğ²Ğ¸Ğ»ÑŒĞ½Ñƒ Ñ–Ğ´Ñ–Ğ¾Ğ¼Ñƒ\n\n1. ĞœĞ¸Ğ½ÑƒĞ»Ğ¾ Ğ±Ğ°Ğ³Ğ°Ñ‚Ğ¾ Ñ‡Ğ°ÑÑƒ.\n   > [!answer] **Ğ±Ğ°Ğ³Ğ°Ñ‚Ğ¾ Ğ²Ğ¾Ğ´Ğ¸ ÑƒÑ‚ĞµĞºĞ»Ğ¾**\n2. Ğ’Ñ–Ğ½ ÑƒĞ½Ğ¸ĞºĞ½ÑƒĞ² Ğ¿Ğ¾ĞºĞ°Ñ€Ğ°Ğ½Ğ½Ñ.\n   > [!answer] **Ğ²Ğ¸Ğ¹ÑˆĞ¾Ğ² ÑÑƒÑ…Ğ¸Ğ¼ Ğ· Ğ²Ğ¾Ğ´Ğ¸**\n3. Ğ¦Ğµ Ğ´Ñ€Ñ–Ğ±Ğ½Ğ¸Ñ†Ñ, ÑĞºÑƒ Ğ¿ĞµÑ€ĞµĞ±Ñ–Ğ»ÑŒÑˆÑƒÑÑ‚ÑŒ.\n   > [!answer] **Ğ±ÑƒÑ€Ñ Ğ² ÑĞºĞ»ÑĞ½Ñ†Ñ– Ğ²Ğ¾Ğ´Ğ¸**\n4. Ğ¢Ñ€ĞµĞ±Ğ° Ğ´Ñ–ÑÑ‚Ğ¸, Ğ° Ğ½Ğµ Ñ‡ĞµĞºĞ°Ñ‚Ğ¸.\n   > [!answer] **Ğ¿Ñ–Ğ´ Ğ»ĞµĞ¶Ğ°Ñ‡Ğ¸Ğ¹ ĞºĞ°Ğ¼Ñ–Ğ½ÑŒ Ğ²Ğ¾Ğ´Ğ° Ğ½Ğµ Ñ‚ĞµÑ‡Ğµ**\n5. Ğ’Ñ–Ğ½ Ğ½Ñ–Ñ‡Ğ¾Ğ³Ğ¾ Ğ½Ğµ Ğ±Ğ¾Ñ—Ñ‚ÑŒÑÑ.\n   > [!answer] **Ğ¼Ğ¾Ñ€Ğµ Ğ¿Ğ¾ ĞºĞ¾Ğ»Ñ–Ğ½Ğ°**\n6. Ğ¦Ğµ Ğ´ÑƒĞ¶Ğµ Ğ¼Ğ°Ğ»Ğ¾ Ğ² Ğ¿Ğ¾Ñ€Ñ–Ğ²Ğ½ÑĞ½Ğ½Ñ– Ğ· Ğ¿Ğ¾Ñ‚Ñ€ĞµĞ±Ğ¾Ñ.\n   > [!answer] **ĞºÑ€Ğ°Ğ¿Ğ»Ñ Ğ² Ğ¼Ğ¾Ñ€Ñ–**\n### ĞŸĞµÑ€ĞµĞºĞ»Ğ°Ğ´Ñ–Ñ‚ÑŒ\n\n1. Still waters run deep.\n   > [!answer] **Ğ¢Ğ¸Ñ…Ğ° Ğ²Ğ¾Ğ´Ğ° Ğ³Ñ€ĞµĞ±Ğ»Ñ Ñ€Ğ²Ğµ.**\n2. As you sow, so shall you reap.\n   > [!answer] **Ğ©Ğ¾ Ğ¿Ğ¾ÑÑ–Ñ”Ñˆ, Ñ‚Ğµ Ğ¹ Ğ¿Ğ¾Ğ¶Ğ½ĞµÑˆ.**\n3. It's a drop in the ocean.\n   > [!answer] **Ğ¦Ğµ ĞºÑ€Ğ°Ğ¿Ğ»Ñ Ğ² Ğ¼Ğ¾Ñ€Ñ–.**\n4. He cast the first stone.\n   > [!answer] **Ğ’Ñ–Ğ½ ĞºĞ¸Ğ½ÑƒĞ² Ğ¿ĞµÑ€ÑˆĞ¸Ğ¹ ĞºĞ°Ğ¼Ñ–Ğ½ÑŒ.**\n5. They put down roots in a new city.\n   > [!answer] **Ğ’Ğ¾Ğ½Ğ¸ Ğ¿ÑƒÑÑ‚Ğ¸Ğ»Ğ¸ ĞºĞ¾Ñ€Ñ–Ğ½Ğ½Ñ Ğ² Ğ½Ğ¾Ğ²Ğ¾Ğ¼Ñƒ Ğ¼Ñ–ÑÑ‚Ñ–.**\n---\n\n## ĞŸÑ€Ğ¾Ğ´ÑƒĞºÑ†Ñ–Ñ\n\n### ĞĞ¿Ğ¸ÑˆÑ–Ñ‚ÑŒ ÑĞ¸Ñ‚ÑƒĞ°Ñ†Ñ–Ñ—\n\nĞ’Ğ¸ĞºĞ¾Ñ€Ğ¸ÑÑ‚Ğ°Ğ¹Ñ‚Ğµ Ğ¿Ñ€Ğ¸Ñ€Ğ¾Ğ´Ğ½Ñ– Ñ–Ğ´Ñ–Ğ¾Ğ¼Ğ¸, Ñ‰Ğ¾Ğ± Ğ¾Ğ¿Ğ¸ÑĞ°Ñ‚Ğ¸:\n1. Ğ›ÑĞ´Ğ¸Ğ½Ñƒ, ÑĞºĞ° ÑƒĞ½Ğ¸ĞºĞ°Ñ” Ğ²Ñ–Ğ´Ğ¿Ğ¾Ğ²Ñ–Ğ´Ğ°Ğ»ÑŒĞ½Ğ¾ÑÑ‚Ñ–\n   > [!answer] *Ğ²Ğ¸Ñ…Ğ¾Ğ´Ğ¸Ñ‚ÑŒ ÑÑƒÑ…Ğ¸Ğ¼ Ğ· Ğ²Ğ¾Ğ´Ğ¸*\n2. Ğ¡Ğ¸Ñ‚ÑƒĞ°Ñ†Ñ–Ñ, ĞºĞ¾Ğ»Ğ¸ Ñ‚Ñ€ĞµĞ±Ğ° Ğ´Ñ–ÑÑ‚Ğ¸\n   > [!answer] *Ğ¿Ñ–Ğ´ Ğ»ĞµĞ¶Ğ°Ñ‡Ğ¸Ğ¹ ĞºĞ°Ğ¼Ñ–Ğ½ÑŒ Ğ²Ğ¾Ğ´Ğ° Ğ½Ğµ Ñ‚ĞµÑ‡Ğµ*\n3. Ğ©Ğ¾ÑÑŒ, Ñ‰Ğ¾ Ğ²Ğ¸Ğ½Ğ¸ĞºĞ»Ğ¾ Ğ½ĞµÑĞ¿Ğ¾Ğ´Ñ–Ğ²Ğ°Ğ½Ğ¾\n   > [!answer] *ÑĞº ÑĞ½Ñ–Ğ³ Ğ½Ğ° Ğ³Ğ¾Ğ»Ğ¾Ğ²Ñƒ*\n4. ĞšĞ¾Ğ³Ğ¾ÑÑŒ, Ñ…Ñ‚Ğ¾ ÑƒĞºĞ¾Ñ€ĞµĞ½Ğ¸Ğ²ÑÑ Ğ½Ğ° Ğ½Ğ¾Ğ²Ğ¾Ğ¼Ñƒ Ğ¼Ñ–ÑÑ†Ñ–\n   > [!answer] *Ğ¿ÑƒÑÑ‚Ğ¸Ğ² ĞºĞ¾Ñ€Ñ–Ğ½Ğ½Ñ*\n5. Ğ”Ñ€Ñ–Ğ±Ğ½Ñƒ Ğ¿Ñ€Ğ¾Ğ±Ğ»ĞµĞ¼Ñƒ, ÑĞºÑƒ Ğ¿ĞµÑ€ĞµĞ±Ñ–Ğ»ÑŒÑˆÑƒÑÑ‚ÑŒ\n   > [!answer] *Ğ±ÑƒÑ€Ñ Ğ² ÑĞºĞ»ÑĞ½Ñ†Ñ– Ğ²Ğ¾Ğ´Ğ¸*\n\n### Ğ”Ñ–Ğ°Ğ»Ğ¾Ğ³\n\nĞ¡Ñ‚Ğ²Ğ¾Ñ€Ñ–Ñ‚ÑŒ Ğ´Ñ–Ğ°Ğ»Ğ¾Ğ³ (6-8 Ñ€ĞµĞ¿Ğ»Ñ–Ğº) Ğ¼Ñ–Ğ¶ Ğ´Ñ€ÑƒĞ·ÑĞ¼Ğ¸, Ñ‰Ğ¾ Ğ¾Ğ±Ğ³Ğ¾Ğ²Ğ¾Ñ€ÑÑÑ‚ÑŒ ÑĞ¿Ñ–Ğ»ÑŒĞ½Ğ¾Ğ³Ğ¾ Ğ·Ğ½Ğ°Ğ¹Ğ¾Ğ¼Ğ¾Ğ³Ğ¾. Ğ’Ğ¸ĞºĞ¾Ñ€Ğ¸ÑÑ‚Ğ°Ğ¹Ñ‚Ğµ 4-5 Ñ–Ğ´Ñ–Ğ¾Ğ¼ Ğ· Ñ†ÑŒĞ¾Ğ³Ğ¾ ÑƒÑ€Ğ¾ĞºÑƒ.\n\n**ĞŸÑ€Ğ¸ĞºĞ»Ğ°Ğ´ Ğ¿Ğ¾Ñ‡Ğ°Ñ‚ĞºÑƒ:**\nâ€” Ğ§ÑƒĞ² Ğ¿Ñ€Ğ¾ ĞĞ»ĞµĞ³Ğ°? Ğ’Ñ–Ğ½ Ğ¿ĞµÑ€ĞµÑ—Ñ…Ğ°Ğ² Ğ´Ğ¾ ĞŸÑ€Ğ°Ğ³Ğ¸!\nâ€” Ğ¡ĞµÑ€Ğ¹Ğ¾Ğ·Ğ½Ğ¾? Ğ¦Ğµ ÑĞº ÑĞ½Ñ–Ğ³ Ğ½Ğ° Ğ³Ğ¾Ğ»Ğ¾Ğ²Ñƒ...\n\n---\n\n\n---\n\n\n---"
      },
      {
        "id": "section-summary",
        "type": "summary",
        "title": "Summary",
        "content": "## Ğ’Ğ¾Ğ´Ğ°\n\n| Ğ†Ğ´Ñ–Ğ¾Ğ¼Ğ° | Ğ—Ğ½Ğ°Ñ‡ĞµĞ½Ğ½Ñ | Ğ¡Ğ¸Ğ¼Ğ²Ğ¾Ğ»Ñ–ĞºĞ° |\n|--------|----------|-----------|\n| Ğ±Ğ°Ğ³Ğ°Ñ‚Ğ¾ Ğ²Ğ¾Ğ´Ğ¸ ÑƒÑ‚ĞµĞºĞ»Ğ¾ | Ğ¼Ğ¸Ğ½ÑƒĞ»Ğ¾ Ñ‡Ğ°ÑÑƒ | Ñ‡Ğ°Ñ ÑĞº Ğ¿Ğ¾Ñ‚Ñ–Ğº |\n| Ğ²Ğ¸Ğ¹Ñ‚Ğ¸ ÑÑƒÑ…Ğ¸Ğ¼ Ğ· Ğ²Ğ¾Ğ´Ğ¸ | ÑƒĞ½Ğ¸ĞºĞ½ÑƒÑ‚Ğ¸ Ğ¿Ğ¾ĞºĞ°Ñ€Ğ°Ğ½Ğ½Ñ | Ñ‡Ğ¸ÑÑ‚Ğ¾Ñ‚Ğ°/Ğ²Ğ¸Ğ¿Ñ€Ğ¾Ğ±ÑƒĞ²Ğ°Ğ½Ğ½Ñ |\n| Ğ²Ğ¸Ğ²ĞµÑÑ‚Ğ¸ Ğ½Ğ° Ñ‡Ğ¸ÑÑ‚Ñƒ Ğ²Ğ¾Ğ´Ñƒ | Ğ²Ğ¸ĞºÑ€Ğ¸Ñ‚Ğ¸ | Ğ¿Ñ€Ğ¾Ğ·Ğ¾Ñ€Ñ–ÑÑ‚ÑŒ = Ğ¿Ñ€Ğ°Ğ²Ğ´Ğ° |\n| Ñ‚Ğ¸Ñ…Ğ° Ğ²Ğ¾Ğ´Ğ° | ÑĞ¿Ğ¾ĞºÑ–Ğ¹Ğ½Ğ¸Ğ¹, Ğ°Ğ»Ğµ ÑĞ¸Ğ»ÑŒĞ½Ğ¸Ğ¹ | Ğ¿Ñ€Ğ¸Ñ…Ğ¾Ğ²Ğ°Ğ½Ğ° ÑĞ¸Ğ»Ğ° |\n\n## ĞšĞ°Ğ¼Ñ–Ğ½ÑŒ\n\n| Ğ†Ğ´Ñ–Ğ¾Ğ¼Ğ° | Ğ—Ğ½Ğ°Ñ‡ĞµĞ½Ğ½Ñ | Ğ¡Ğ¸Ğ¼Ğ²Ğ¾Ğ»Ñ–ĞºĞ° |\n|--------|----------|-----------|\n| ĞºĞ°Ğ¼Ñ–Ğ½ÑŒ Ğ½Ğ°/Ğ· ÑĞµÑ€Ñ†Ñ | Ñ‚Ñ€Ğ¸Ğ²Ğ¾Ğ³Ğ°/Ğ¿Ğ¾Ğ»ĞµĞ³ÑˆĞµĞ½Ğ½Ñ | Ğ²Ğ°Ğ³Ğ° |\n| Ğ¿Ñ–Ğ´ Ğ»ĞµĞ¶Ğ°Ñ‡Ğ¸Ğ¹ ĞºĞ°Ğ¼Ñ–Ğ½ÑŒ | Ñ‚Ñ€ĞµĞ±Ğ° Ğ´Ñ–ÑÑ‚Ğ¸ | Ğ½ĞµÑ€ÑƒÑ…Ğ¾Ğ¼Ñ–ÑÑ‚ÑŒ = Ğ·Ğ°ÑÑ‚Ñ–Ğ¹ |\n| ĞºĞ°Ğ¼Ñ–Ğ½ÑŒ Ğ·Ğ° Ğ¿Ğ°Ğ·ÑƒÑ…Ğ¾Ñ | Ğ¿Ñ€Ğ¸Ñ…Ğ¾Ğ²Ğ°Ğ½Ğ° Ğ²Ğ¾Ñ€Ğ¾Ğ¶Ñ–ÑÑ‚ÑŒ | Ğ·Ğ±Ñ€Ğ¾Ñ |\n\n## Ğ Ğ¾ÑĞ»Ğ¸Ğ½Ğ¸\n\n| Ğ†Ğ´Ñ–Ğ¾Ğ¼Ğ° | Ğ—Ğ½Ğ°Ñ‡ĞµĞ½Ğ½Ñ | Ğ¡Ğ¸Ğ¼Ğ²Ğ¾Ğ»Ñ–ĞºĞ° |\n|--------|----------|-----------|\n| Ğ¿ÑƒÑÑ‚Ğ¸Ñ‚Ğ¸ ĞºĞ¾Ñ€Ñ–Ğ½Ğ½Ñ | Ğ¾ÑĞµĞ»Ğ¸Ñ‚Ğ¸ÑÑ | ÑÑ‚Ğ°Ğ±Ñ–Ğ»ÑŒĞ½Ñ–ÑÑ‚ÑŒ |\n| Ñ‰Ğ¾ Ğ¿Ğ¾ÑÑ–Ñ”Ñˆ | ĞºĞ°Ñ€Ğ¼Ğ° | Ğ¿Ñ€Ğ¸Ñ‡Ğ¸Ğ½Ğ°-Ğ½Ğ°ÑĞ»Ñ–Ğ´Ğ¾Ğº |\n| ÑĞº Ğ³Ñ€Ğ¸Ğ±Ğ¸ Ğ¿Ñ–ÑĞ»Ñ Ğ´Ğ¾Ñ‰Ñƒ | ÑˆĞ²Ğ¸Ğ´ĞºĞ¾ Ğ·'ÑĞ²Ğ»ÑÑ‚Ğ¸ÑÑ | Ğ·Ñ€Ğ¾ÑÑ‚Ğ°Ğ½Ğ½Ñ |\n\n## ĞŸĞ¾Ğ³Ğ¾Ğ´Ğ°\n\n| Ğ†Ğ´Ñ–Ğ¾Ğ¼Ğ° | Ğ—Ğ½Ğ°Ñ‡ĞµĞ½Ğ½Ñ | Ğ¡Ğ¸Ğ¼Ğ²Ğ¾Ğ»Ñ–ĞºĞ° |\n|--------|----------|-----------|\n| Ğ±ÑƒÑ€Ñ Ğ² ÑĞºĞ»ÑĞ½Ñ†Ñ– | Ğ¿ĞµÑ€ĞµĞ±Ñ–Ğ»ÑŒÑˆĞµĞ½Ğ½Ñ | Ğ¼Ğ°ÑÑˆÑ‚Ğ°Ğ± |\n| Ğ¿Ñ–ÑĞ»Ñ Ğ´Ğ¾Ñ‰Ñƒ Ğ² Ñ‡ĞµÑ‚Ğ²ĞµÑ€ | Ğ½Ñ–ĞºĞ¾Ğ»Ğ¸ | Ğ°Ğ±ÑÑƒÑ€Ğ´ |\n| Ñ…Ğ¼Ğ°Ñ€Ğ¸ Ğ·Ğ±Ğ¸Ñ€Ğ°ÑÑ‚ÑŒÑÑ | Ğ¿Ñ€Ğ¾Ğ±Ğ»ĞµĞ¼Ğ¸ | Ğ¿ĞµÑ€ĞµĞ´Ñ‡ÑƒÑ‚Ñ‚Ñ |\n\n> **Ğ“Ğ¾Ğ»Ğ¾Ğ²Ğ½Ğµ**\n>\n> - **Ğ’Ğ¾Ğ´Ğ°** = Ñ‡Ğ°Ñ, Ğ¿Ñ€Ğ°Ğ²Ğ´Ğ°, Ğ¾Ñ‡Ğ¸Ñ‰ĞµĞ½Ğ½Ñ (Ñ‡Ğ¸ÑÑ‚Ğ° Ğ²Ğ¾Ğ´Ğ° = Ğ¿Ñ€Ğ°Ğ²Ğ´Ğ°, Ğ¼ÑƒÑ‚Ğ½Ğ° = Ğ±Ñ€ĞµÑ…Ğ½Ñ)\n> - **ĞšĞ°Ğ¼Ñ–Ğ½ÑŒ** = ÑÑ‚Ñ–Ğ¹ĞºÑ–ÑÑ‚ÑŒ, Ğ¿ĞµÑ€ĞµÑˆĞºĞ¾Ğ´Ğ°, Ñ…Ğ¾Ğ»Ğ¾Ğ´Ğ½Ñ–ÑÑ‚ÑŒ\n> - **Ğ Ğ¾ÑĞ»Ğ¸Ğ½Ğ¸** = Ğ¶Ğ¸Ñ‚Ñ‚Ñ, Ñ€Ğ¾Ğ´Ğ¸Ğ½Ğ°, ĞºĞ°Ñ€Ğ¼Ğ° (Ñ‰Ğ¾ Ğ¿Ğ¾ÑÑ–Ñ”Ñˆ, Ñ‚Ğµ Ğ¹ Ğ¿Ğ¾Ğ¶Ğ½ĞµÑˆ)\n> - **ĞŸĞ¾Ğ³Ğ¾Ğ´Ğ°** = Ğ½ĞµÑĞ¿Ğ¾Ğ´Ñ–Ğ²Ğ°Ğ½ĞºĞ¸, Ğ½Ğ°ÑÑ‚Ñ€Ñ–Ğ¹, Ğ¿Ñ€Ğ¾Ğ±Ğ»ĞµĞ¼Ğ¸\n> - Ğ‘Ğ°Ğ³Ğ°Ñ‚Ğ¾ Ğ¿Ñ€Ğ¸Ñ€Ğ¾Ğ´Ğ½Ğ¸Ñ… Ñ–Ğ´Ñ–Ğ¾Ğ¼ Ğ¼Ğ°ÑÑ‚ÑŒ Ğ³Ğ»Ğ¸Ğ±Ğ¾ĞºĞµ ÑĞ·Ğ¸Ñ‡Ğ½Ğ¸Ñ†ÑŒĞºĞµ Ñ‚Ğ° Ğ±Ñ–Ğ±Ğ»Ñ–Ğ¹Ğ½Ğµ ĞºĞ¾Ñ€Ñ–Ğ½Ğ½Ñ\n> - Ğ£ĞºÑ€Ğ°Ñ—Ğ½ÑÑŒĞºÑ– Ñ‚Ğ° Ğ°Ğ½Ğ³Ğ»Ñ–Ğ¹ÑÑŒĞºÑ– Ğ¿Ñ€Ğ¸Ñ€Ğ¾Ğ´Ğ½Ñ– Ğ¼ĞµÑ‚Ğ°Ñ„Ğ¾Ñ€Ğ¸ Ñ‡Ğ°ÑÑ‚Ğ¾ Ğ¿Ğ°Ñ€Ğ°Ğ»ĞµĞ»ÑŒĞ½Ñ–, Ğ°Ğ»Ğµ Ğ· Ñ€Ñ–Ğ·Ğ½Ğ¸Ğ¼Ğ¸ Ğ¾Ğ±Ñ€Ğ°Ğ·Ğ°Ğ¼Ğ¸",
        "titleUk": "ĞŸÑ–Ğ´ÑÑƒĞ¼Ğ¾Ğº"
      }
    ],
    "rawMarkdown": "---\nmodule: 180\ntitle: \"Idioms: Nature\"\nsubtitle: \"Ğ¤Ñ€Ğ°Ğ·ĞµĞ¾Ğ»Ğ¾Ğ³Ñ–Ğ·Ğ¼Ğ¸: ĞŸÑ€Ğ¸Ñ€Ğ¾Ğ´Ğ°\"\nlevel: B2\nphase: B2.2\nduration: 45\ntransliteration: none\ntags: [phraseology, idioms, nature, water, stone, tree, weather]\nobjectives:\n  - Ğ’Ğ¸Ğ²Ñ‡Ğ¸Ñ‚Ğ¸ Ñ–Ğ´Ñ–Ğ¾Ğ¼Ğ¸ Ğ· Ğ²Ğ¾Ğ´Ğ¾Ñ, ĞºĞ°Ğ¼ĞµĞ½ĞµĞ¼, Ğ´ĞµÑ€ĞµĞ²Ğ¾Ğ¼\n  - Ğ Ğ¾Ğ·ÑƒĞ¼Ñ–Ñ‚Ğ¸ Ğ¿Ñ€Ğ¸Ñ€Ğ¾Ğ´Ğ½Ñ– Ğ¼ĞµÑ‚Ğ°Ñ„Ğ¾Ñ€Ğ¸ Ñ‚Ğ° Ñ—Ñ…Ğ½Ñ” Ğ¿Ğ¾Ñ…Ğ¾Ğ´Ğ¶ĞµĞ½Ğ½Ñ\n  - Ğ’Ğ¸ĞºĞ¾Ñ€Ğ¸ÑÑ‚Ğ¾Ğ²ÑƒĞ²Ğ°Ñ‚Ğ¸ Ñ„Ñ€Ğ°Ğ·ĞµĞ¾Ğ»Ğ¾Ğ³Ñ–Ğ·Ğ¼Ğ¸ Ğ² Ğ¼Ğ¾Ğ²Ğ»ĞµĞ½Ğ½Ñ–\n  - ĞŸĞ¾Ñ€Ñ–Ğ²Ğ½ÑÑ‚Ğ¸ Ğ· Ğ°Ğ½Ğ³Ğ»Ñ–Ğ¹ÑÑŒĞºĞ¸Ğ¼Ğ¸ Ñ–Ğ´Ñ–Ğ¾Ğ¼Ğ°Ğ¼Ğ¸\n---\n\n# Ğ’ÑÑ‚ÑƒĞ¿\n\nĞ£ĞºÑ€Ğ°Ñ—Ğ½Ğ° â€” ĞºÑ€Ğ°Ñ—Ğ½Ğ° Ğ²ĞµĞ»Ğ¸ĞºĞ¸Ñ… Ñ€Ñ–Ñ‡Ğ¾Ğº, Ñ€Ğ¾Ğ´ÑÑ‡Ğ¸Ñ… Ñ‡Ğ¾Ñ€Ğ½Ğ¾Ğ·ĞµĞ¼Ñ–Ğ² Ñ‚Ğ° Ğ½ĞµĞ¾Ğ·Ğ¾Ñ€Ğ¸Ñ… ÑÑ‚ĞµĞ¿Ñ–Ğ². Ğ”Ğ½Ñ–Ğ¿Ñ€Ğ¾, Ğ”Ğ½Ñ–ÑÑ‚ĞµÑ€, Ğ”ÑƒĞ½Ğ°Ğ¹, ĞŸÑ–Ğ²Ğ´ĞµĞ½Ğ½Ğ¸Ğ¹ Ğ‘ÑƒĞ³ â€” Ñ†Ñ– Ğ²Ğ¾Ğ´Ğ½Ñ– Ğ°Ñ€Ñ‚ĞµÑ€Ñ–Ñ— Ñ„Ğ¾Ñ€Ğ¼ÑƒĞ²Ğ°Ğ»Ğ¸ Ñ–ÑÑ‚Ğ¾Ñ€Ñ–Ñ Ğ½Ğ°Ñ€Ğ¾Ğ´Ñƒ Ğ¿Ñ€Ğ¾Ñ‚ÑĞ³Ğ¾Ğ¼ Ñ‚Ğ¸ÑÑÑ‡Ğ¾Ğ»Ñ–Ñ‚ÑŒ. ĞĞµ Ğ´Ğ¸Ğ²Ğ½Ğ¾, Ñ‰Ğ¾ ÑƒĞºÑ€Ğ°Ñ—Ğ½ÑÑŒĞºĞ° Ğ¼Ğ¾Ğ²Ğ° Ğ½Ğ°ÑĞ¸Ñ‡ĞµĞ½Ğ° Ğ¾Ğ±Ñ€Ğ°Ğ·Ğ°Ğ¼Ğ¸ Ğ¿Ñ€Ğ¸Ñ€Ğ¾Ğ´Ğ¸: Ğ²Ğ¾Ğ´Ğ° ÑĞ¸Ğ¼Ğ²Ğ¾Ğ»Ñ–Ğ·ÑƒÑ” Ñ‡Ğ°Ñ Ñ– Ğ¾Ñ‡Ğ¸Ñ‰ĞµĞ½Ğ½Ñ, ĞºĞ°Ğ¼Ñ–Ğ½ÑŒ â€” ÑÑ‚Ñ–Ğ¹ĞºÑ–ÑÑ‚ÑŒ Ñ– Ğ¿ĞµÑ€ĞµÑˆĞºĞ¾Ğ´Ğ¸, Ğ° Ğ´ĞµÑ€ĞµĞ²Ğ¾ â€” Ğ¶Ğ¸Ñ‚Ñ‚Ñ Ñ– Ñ€Ğ¾Ğ´Ğ¸Ğ½Ñƒ. ĞšĞ¾Ğ»Ğ¸ ĞºĞ°Ğ¶ĞµĞ¼Ğ¾ Â«Ğ±Ğ°Ğ³Ğ°Ñ‚Ğ¾ Ğ²Ğ¾Ğ´Ğ¸ ÑƒÑ‚ĞµĞºĞ»Ğ¾Â», Ğ¼Ğ°Ñ”Ğ¼Ğ¾ Ğ½Ğ° ÑƒĞ²Ğ°Ğ·Ñ– Ğ¼Ğ¸Ğ½ÑƒĞ»Ğ¸Ğ¹ Ñ‡Ğ°Ñ. ĞšĞ¾Ğ»Ğ¸ Ğ³Ğ¾Ğ²Ğ¾Ñ€Ğ¸Ğ¼Ğ¾ Â«Ğ¿ÑƒÑÑ‚Ğ¸Ğ² ĞºĞ¾Ñ€Ñ–Ğ½Ğ½ÑÂ» â€” Ğ¹Ğ´ĞµÑ‚ÑŒÑÑ Ğ¿Ñ€Ğ¾ ÑƒĞºĞ¾Ñ€Ñ–Ğ½ĞµĞ½Ğ½Ñ Ğ½Ğ° Ğ½Ğ¾Ğ²Ğ¾Ğ¼Ñƒ Ğ¼Ñ–ÑÑ†Ñ–. ĞŸÑ€Ğ¸Ñ€Ğ¾Ğ´Ğ° â€” Ñ†Ğµ Ğ½Ğµ Ğ¿Ñ€Ğ¾ÑÑ‚Ğ¾ Ñ„Ğ¾Ğ½ ÑƒĞºÑ€Ğ°Ñ—Ğ½ÑÑŒĞºĞ¾Ğ³Ğ¾ Ğ¶Ğ¸Ñ‚Ñ‚Ñ, Ğ° ÑĞ°Ğ¼Ğ° Ñ‚ĞºĞ°Ğ½Ğ¸Ğ½Ğ° Ğ½Ğ°ÑˆĞ¾Ñ— Ğ¼Ğ¾Ğ²Ğ¸.\n\nĞ¦Ñ Ğ·Ğ²'ÑĞ·Ğ¾Ğº Ñ–Ğ· Ğ¿Ñ€Ğ¸Ñ€Ğ¾Ğ´Ğ¾Ñ Ğ³Ğ»Ğ¸Ğ±Ğ¾ĞºĞ¾ Ğ²ĞºĞ¾Ñ€ĞµĞ½ĞµĞ½Ğ¸Ğ¹ Ğ² ÑĞ»Ğ¾Ğ²'ÑĞ½ÑÑŒĞºÑ–Ğ¹ ĞºÑƒĞ»ÑŒÑ‚ÑƒÑ€Ñ–. Ğ”Ğ¾ Ğ¿Ñ€Ğ¸Ğ¹Ğ½ÑÑ‚Ñ‚Ñ Ñ…Ñ€Ğ¸ÑÑ‚Ğ¸ÑĞ½ÑÑ‚Ğ²Ğ° Ğ½Ğ°ÑˆÑ– Ğ¿Ñ€ĞµĞ´ĞºĞ¸ ÑĞ¿Ğ¾Ğ²Ñ–Ğ´ÑƒĞ²Ğ°Ğ»Ğ¸ ÑĞ·Ğ¸Ñ‡Ğ½Ğ¸Ñ†Ñ‚Ğ²Ğ¾ â€” Ğ²Ğ¾Ğ½Ğ¸ Ğ¿Ğ¾ĞºĞ»Ğ¾Ğ½ÑĞ»Ğ¸ÑÑ ÑĞ¸Ğ»Ğ°Ğ¼ Ğ¿Ñ€Ğ¸Ñ€Ğ¾Ğ´Ğ¸. Ğ Ñ–Ñ‡ĞºĞ° Ğ±ÑƒĞ»Ğ° Ğ±Ğ¾Ğ¶ĞµÑÑ‚Ğ²Ğ¾Ğ¼, Ğ´ĞµÑ€ĞµĞ²Ğ¾ â€” ÑĞ²ÑÑ‰ĞµĞ½Ğ½Ğ¸Ğ¼, ĞºĞ°Ğ¼Ñ–Ğ½ÑŒ â€” Ğ¼Ñ–ÑÑ†ĞµĞ¼ Ğ¶ĞµÑ€Ñ‚Ğ²Ğ¾Ğ¿Ñ€Ğ¸Ğ½Ğ¾ÑˆĞµĞ½ÑŒ. Ğ¦Ñ– Ğ²Ñ–Ñ€ÑƒĞ²Ğ°Ğ½Ğ½Ñ Ğ·Ğ°Ğ»Ğ¸ÑˆĞ¸Ğ»Ğ¸ ÑĞ»Ñ–Ğ´ Ñƒ Ğ¼Ğ¾Ğ²Ñ–: **Â«Ñ‚Ğ¸Ñ…Ğ° Ğ²Ğ¾Ğ´Ğ°Â»** â€” Ñ†Ğµ Ğ½Ğµ Ğ¿Ñ€Ğ¾ÑÑ‚Ğ¾ Ñ„Ñ–Ğ·Ğ¸Ñ‡Ğ½Ğ¸Ğ¹ Ğ¾Ğ¿Ğ¸Ñ, Ğ° Ğ¼ĞµÑ‚Ğ°Ñ„Ğ¾Ñ€Ğ° Ğ¿Ñ€Ğ¸Ñ…Ğ¾Ğ²Ğ°Ğ½Ğ¾Ñ— ÑĞ¸Ğ»Ğ¸. ĞŸÑ€Ğ¸ÑĞ»Ñ–Ğ²'Ñ Â«Ğ¢Ğ¸Ñ…Ğ° Ğ²Ğ¾Ğ´Ğ° Ğ³Ñ€ĞµĞ±Ğ»Ñ Ñ€Ğ²ĞµÂ» Ğ¿Ğ¾Ğ¿ĞµÑ€ĞµĞ´Ğ¶Ğ°Ñ”: Ğ·Ğ° ÑĞ¿Ğ¾ĞºÑ–Ğ¹Ğ½Ğ¾Ñ Ğ¿Ğ¾Ğ²ĞµÑ€Ñ…Ğ½ĞµÑ Ğ¼Ğ¾Ğ¶Ğµ Ñ…Ğ¾Ğ²Ğ°Ñ‚Ğ¸ÑÑ Ñ€ÑƒĞ¹Ğ½Ñ–Ğ²Ğ½Ğ° Ğ¼Ñ–Ñ†ÑŒ.\n\n**Ğ’Ğ¾Ğ´Ğ°** Ğ² ÑƒĞºÑ€Ğ°Ñ—Ğ½ÑÑŒĞºÑ–Ğ¹ Ñ„Ñ€Ğ°Ğ·ĞµĞ¾Ğ»Ğ¾Ğ³Ñ–Ñ— Ğ¼Ğ°Ñ” Ğ±Ğ°Ğ³Ğ°Ñ‚Ğ¾ ÑĞ¸Ğ¼Ğ²Ğ¾Ğ»Ñ–Ñ‡Ğ½Ğ¸Ñ… Ğ·Ğ½Ğ°Ñ‡ĞµĞ½ÑŒ. Ğ§Ğ¸ÑÑ‚Ğ° Ğ²Ğ¾Ğ´Ğ° â€” Ñ†Ğµ Ğ¿Ñ€Ğ°Ğ²Ğ´Ğ°, Ğ¼ÑƒÑ‚Ğ½Ğ° â€” Ğ±Ñ€ĞµÑ…Ğ½Ñ Ñ– Ñ…Ğ°Ğ¾Ñ. ĞšĞ¾Ğ»Ğ¸ ĞºĞ¾Ğ³Ğ¾ÑÑŒ Â«Ğ²Ğ¸Ğ²Ğ¾Ğ´ÑÑ‚ÑŒ Ğ½Ğ° Ñ‡Ğ¸ÑÑ‚Ñƒ Ğ²Ğ¾Ğ´ÑƒÂ», Ñ†Ğµ Ğ¾Ğ·Ğ½Ğ°Ñ‡Ğ°Ñ” Ğ²Ğ¸ĞºÑ€Ğ¸Ñ‚Ñ‚Ñ Ğ¾Ğ±Ğ¼Ğ°Ğ½Ñƒ. Ğ¦ĞµĞ¹ Ğ¾Ğ±Ñ€Ğ°Ğ· Ğ»Ğ¾Ğ³Ñ–Ñ‡Ğ½Ğ¸Ğ¹: Ñƒ ĞºĞ°Ğ»Ğ°Ğ¼ÑƒÑ‚Ğ½Ñ–Ğ¹ Ğ²Ğ¾Ğ´Ñ– Ğ½Ñ–Ñ‡Ğ¾Ğ³Ğ¾ Ğ½Ğµ Ğ²Ğ¸Ğ´Ğ½Ğ¾, Ğ° Ğ² Ñ‡Ğ¸ÑÑ‚Ñ–Ğ¹ â€” Ğ²ÑĞµ ÑĞº Ğ½Ğ° Ğ´Ğ¾Ğ»Ğ¾Ğ½Ñ–. Ğ—Ğ²Ñ–Ğ´ÑĞ¸ Ğ¶ Ñ– Ğ²Ğ¸Ñ€Ğ°Ğ· Â«ĞºĞ°Ğ»Ğ°Ğ¼ÑƒÑ‚Ğ¸Ñ‚Ğ¸ Ğ²Ğ¾Ğ´ÑƒÂ» â€” Ğ½Ğ°Ğ²Ğ¼Ğ¸ÑĞ½Ğ¾ ÑÑ‚Ğ²Ğ¾Ñ€ÑĞ²Ğ°Ñ‚Ğ¸ Ğ¿Ğ»ÑƒÑ‚Ğ°Ğ½Ğ¸Ğ½Ñƒ.\n\nĞ Ğ¾ÑÑŒ **ĞºĞ°Ğ¼Ñ–Ğ½ÑŒ** â€” ÑĞ¸Ğ¼Ğ²Ğ¾Ğ» Ğ°Ğ¼Ğ±Ñ–Ğ²Ğ°Ğ»ĞµĞ½Ñ‚Ğ½Ğ¸Ğ¹. Ğ— Ğ¾Ğ´Ğ½Ğ¾Ğ³Ğ¾ Ğ±Ğ¾ĞºÑƒ, Ñ†Ğµ ÑÑ‚Ñ–Ğ¹ĞºÑ–ÑÑ‚ÑŒ Ñ– Ğ½Ğ°Ğ´Ñ–Ğ¹Ğ½Ñ–ÑÑ‚ÑŒ (Â«Ñ‚Ğ²ĞµÑ€Ğ´Ğ¸Ğ¹ ÑĞº ĞºĞ°Ğ¼Ñ–Ğ½ÑŒÂ»). Ğ— Ñ–Ğ½ÑˆĞ¾Ğ³Ğ¾ â€” Ñ…Ğ¾Ğ»Ğ¾Ğ´Ğ½Ñ–ÑÑ‚ÑŒ Ñ– Ğ±ĞµĞ·Ğ´ÑƒÑˆĞ½Ñ–ÑÑ‚ÑŒ (Â«ĞºĞ°Ğ¼'ÑĞ½Ğµ ÑĞµÑ€Ñ†ĞµÂ»). ĞĞ»Ğµ Ğ½Ğ°Ğ¹Ñ†Ñ–ĞºĞ°Ğ²Ñ–ÑˆĞ¸Ğ¹ Ğ¾Ğ±Ñ€Ğ°Ğ· â€” **Â«ĞºĞ°Ğ¼Ñ–Ğ½ÑŒ Ğ·Ğ° Ğ¿Ğ°Ğ·ÑƒÑ…Ğ¾ÑÂ»**: Ğ¿Ñ€Ğ¸Ñ…Ğ¾Ğ²Ğ°Ğ½Ğ° Ğ²Ğ¾Ñ€Ğ¾Ğ¶Ñ–ÑÑ‚ÑŒ, ÑĞºÑƒ Ğ»ÑĞ´Ğ¸Ğ½Ğ° Ñ…Ğ¾Ğ²Ğ°Ñ” Ğ¿Ñ–Ğ´ Ğ¾Ğ´ÑĞ³Ğ¾Ğ¼, Ğ³Ğ¾Ñ‚ÑƒÑÑ‡Ğ¸ÑÑŒ Ğ´Ğ¾ Ğ¿Ğ¾Ğ¼ÑÑ‚Ğ¸. Ğ¦ĞµĞ¹ Ğ²Ğ¸Ñ€Ğ°Ğ· Ğ¼Ğ°Ñ” Ğ´Ğ°Ğ²Ğ½Ñ” Ğ¿Ğ¾Ñ…Ğ¾Ğ´Ğ¶ĞµĞ½Ğ½Ñ â€” ÑĞµĞ»ÑĞ½Ğ¸ ÑĞ¿Ñ€Ğ°Ğ²Ğ´Ñ– Ğ½Ğ¾ÑĞ¸Ğ»Ğ¸ ĞºĞ°Ğ¼ĞµĞ½Ñ– Ğ·Ğ° Ğ¿Ğ°Ğ·ÑƒÑ…Ğ¾Ñ Ğ´Ğ»Ñ ÑĞ°Ğ¼Ğ¾Ğ·Ğ°Ñ…Ğ¸ÑÑ‚Ñƒ Ñ‡Ğ¸ Ğ½Ğ°Ğ¿Ğ°Ğ´Ñƒ.\n\n> **Ğ§Ğ¸ Ğ·Ğ½Ğ°Ğ»Ğ¸ Ğ²Ğ¸?**\n>\n> Ğ’Ğ¸Ñ€Ğ°Ğ· **Â«Ğ¿Ñ–Ğ´ Ğ»ĞµĞ¶Ğ°Ñ‡Ğ¸Ğ¹ ĞºĞ°Ğ¼Ñ–Ğ½ÑŒ Ğ²Ğ¾Ğ´Ğ° Ğ½Ğµ Ñ‚ĞµÑ‡ĞµÂ»** Ğ¼Ğ°Ñ” Ğ´ÑƒĞ¶Ğµ Ğ´Ğ°Ğ²Ğ½Ñ” Ğ¿Ğ¾Ñ…Ğ¾Ğ´Ğ¶ĞµĞ½Ğ½Ñ. Ğ£ Ğ³Ñ–Ñ€ÑÑŒĞºĞ¸Ñ… Ñ€Ñ–Ñ‡ĞºĞ°Ñ… ĞºĞ°Ğ¼ĞµĞ½Ñ–, Ñ‰Ğ¾ Ğ»ĞµĞ¶Ğ°Ñ‚ÑŒ Ğ½ĞµÑ€ÑƒÑ…Ğ¾Ğ¼Ğ¾, Ğ· Ñ‡Ğ°ÑĞ¾Ğ¼ Ğ¾Ğ±Ñ€Ğ¾ÑÑ‚Ğ°ÑÑ‚ÑŒ Ğ¼ÑƒĞ»Ğ¾Ğ¼ Ñ– Ğ¼Ğ¾Ñ…Ğ¾Ğ¼ â€” Ğ²Ğ¾Ğ´Ğ° Ğ¾Ğ±Ñ‚Ñ–ĞºĞ°Ñ” Ñ—Ñ… ÑÑ‚Ğ¾Ñ€Ğ¾Ğ½Ğ¾Ñ. Ğ›Ğ¸ÑˆĞµ ĞºĞ°Ğ¼ĞµĞ½Ñ–, Ñ‰Ğ¾ Ñ€ÑƒÑ…Ğ°ÑÑ‚ÑŒÑÑ, Ğ¾Ğ¼Ğ¸Ğ²Ğ°ÑÑ‚ÑŒÑÑ ÑĞ²Ñ–Ğ¶Ğ¾Ñ Ğ²Ğ¾Ğ´Ğ¾Ñ. ĞœĞµÑ‚Ğ°Ñ„Ğ¾Ñ€Ğ° Ğ½Ğ°Ğ²Ñ‡Ğ°Ñ”: Ğ±ĞµĞ· Ğ´Ñ–Ñ— Ğ½ĞµĞ¼Ğ°Ñ” Ğ¿Ñ€Ğ¾Ğ³Ñ€ĞµÑÑƒ. Ğ¦Ñ–ĞºĞ°Ğ²Ğ¾, Ñ‰Ğ¾ Ğ² Ğ°Ğ½Ğ³Ğ»Ñ–Ğ¹ÑÑŒĞºÑ–Ğ¹ Ñ” ÑÑ…Ğ¾Ğ¶Ğ¸Ğ¹ Ğ¾Ğ±Ñ€Ğ°Ğ·: Â«A rolling stone gathers no mossÂ» (ĞšĞ°Ğ¼Ñ–Ğ½ÑŒ, Ñ‰Ğ¾ ĞºĞ¾Ñ‚Ğ¸Ñ‚ÑŒÑÑ, Ğ¼Ğ¾Ñ…Ğ¾Ğ¼ Ğ½Ğµ Ğ¾Ğ±Ñ€Ğ¾ÑÑ‚Ğ°Ñ”), Ğ°Ğ»Ğµ Ğ· Ğ¿Ñ€Ğ¾Ñ‚Ğ¸Ğ»ĞµĞ¶Ğ½Ğ¸Ğ¼ Ğ·Ğ½Ğ°Ñ‡ĞµĞ½Ğ½ÑĞ¼ â€” Ñ‚Ğ°Ğ¼ Ñ†Ğµ Ğ¿Ñ€Ğ¾ Ğ½ĞµĞ¿Ğ¾ÑÑ‚Ñ–Ğ¹Ğ½Ñ–ÑÑ‚ÑŒ!\n\n**Ğ”ĞµÑ€ĞµĞ²Ğ¾** â€” Ñ†Ğµ Ğ¶Ğ¸Ñ‚Ñ‚Ñ Ñ– Ñ€Ğ¾Ğ´Ğ¸Ğ½Ğ°. Â«Ğ Ğ¾Ğ´Ğ¾Ğ²Ğµ Ğ´ĞµÑ€ĞµĞ²Ğ¾Â» (Ğ³ĞµĞ½ĞµĞ°Ğ»Ğ¾Ğ³Ñ–Ñ) â€” ÑƒĞ½Ñ–Ğ²ĞµÑ€ÑĞ°Ğ»ÑŒĞ½Ğ¸Ğ¹ Ğ¾Ğ±Ñ€Ğ°Ğ·, Ğ°Ğ»Ğµ Ğ² ÑƒĞºÑ€Ğ°Ñ—Ğ½ÑÑŒĞºÑ–Ğ¹ Ñ” Ğ¹ ÑƒĞ½Ñ–ĞºĞ°Ğ»ÑŒĞ½Ñ– Ğ²Ğ¸Ñ€Ğ°Ğ·Ğ¸. Â«ĞŸÑƒÑÑ‚Ğ¸Ñ‚Ğ¸ ĞºĞ¾Ñ€Ñ–Ğ½Ğ½ÑÂ» Ğ¾Ğ·Ğ½Ğ°Ñ‡Ğ°Ñ” Ğ³Ğ»Ğ¸Ğ±Ğ¾ĞºĞ¾ ÑƒĞºĞ¾Ñ€ĞµĞ½Ğ¸Ñ‚Ğ¸ÑÑ Ğ½Ğ° Ğ½Ğ¾Ğ²Ğ¾Ğ¼Ñƒ Ğ¼Ñ–ÑÑ†Ñ– â€” Ğ²Ğ°Ğ¶Ğ»Ğ¸Ğ²Ğ° ĞºĞ¾Ğ½Ñ†ĞµĞ¿Ñ†Ñ–Ñ Ğ´Ğ»Ñ Ğ½Ğ°Ñ€Ğ¾Ğ´Ñƒ, Ñ‰Ğ¾ Ğ¿ĞµÑ€ĞµĞ¶Ğ¸Ğ² Ñ‡Ğ¸ÑĞ»ĞµĞ½Ğ½Ñ– Ğ¼Ñ–Ğ³Ñ€Ğ°Ñ†Ñ–Ñ—. Ğ **Â«Ğ·Ğ°Ğ±Ğ»ÑƒĞºĞ°Ñ‚Ğ¸ Ğ² Ñ‚Ñ€ÑŒĞ¾Ñ… ÑĞ¾ÑĞ½Ğ°Ñ…Â»** â€” Ñ†Ğµ Ğ¿Ñ€Ğ¾ Ğ½ĞµĞ·Ğ´Ğ°Ñ‚Ğ½Ñ–ÑÑ‚ÑŒ Ğ²Ğ¸Ñ€Ñ–ÑˆĞ¸Ñ‚Ğ¸ Ğ¿Ñ€Ğ¾ÑÑ‚Ñƒ Ğ¿Ñ€Ğ¾Ğ±Ğ»ĞµĞ¼Ñƒ. Ğ§Ğ¾Ğ¼Ñƒ ÑĞ°Ğ¼Ğµ Ñ‚Ñ€Ğ¸ ÑĞ¾ÑĞ½Ğ¸? Ğ‘Ğ¾ Ñ†Ğµ ÑĞ¼Ñ–ÑˆĞ½Ğ¾ Ğ¼Ğ°Ğ»Ğ¾ â€” Ğ·Ğ°Ğ±Ğ»ÑƒĞºĞ°Ñ‚Ğ¸ ÑĞµÑ€ĞµĞ´ Ñ‚Ñ€ÑŒĞ¾Ñ… Ğ´ĞµÑ€ĞµĞ² Ğ¼Ğ¾Ğ¶Ğµ Ğ»Ğ¸ÑˆĞµ Ğ¿Ğ¾Ğ²Ğ½Ğ¸Ğ¹ Ğ½ĞµĞ²Ğ´Ğ°Ñ…Ğ°.\n\n> **ĞœÑ–Ñ„ vs Ğ¤Ğ°ĞºÑ‚**\n>\n> ğŸš« **ĞœÑ–Ñ„:** Â«Ğ‘ÑƒÑ€Ñ Ğ² ÑĞºĞ»ÑĞ½Ñ†Ñ– Ğ²Ğ¾Ğ´Ğ¸Â» â€” Ğ°Ğ½Ğ³Ğ»Ñ–Ğ¹ÑÑŒĞºĞ° Ñ–Ğ´Ñ–Ğ¾Ğ¼Ğ°.\n>\n> âœ… **Ğ¤Ğ°ĞºÑ‚:** Ğ¦ĞµĞ¹ Ğ²Ğ¸Ñ€Ğ°Ğ· Ğ¼Ğ°Ñ” Ğ»Ğ°Ñ‚Ğ¸Ğ½ÑÑŒĞºĞµ Ğ¿Ğ¾Ñ…Ğ¾Ğ´Ğ¶ĞµĞ½Ğ½Ñ â€” Â«excitare fluctus in simpuloÂ» (Ğ·Ğ±ÑƒĞ´Ğ¶ÑƒĞ²Ğ°Ñ‚Ğ¸ Ñ…Ğ²Ğ¸Ğ»Ñ– Ğ² Ñ‡ĞµÑ€Ğ¿Ğ°ĞºÑƒ), ÑĞºĞµ Ğ²Ğ¶Ğ¸Ğ²Ğ°Ğ² Ğ¦Ğ¸Ñ†ĞµÑ€Ğ¾Ğ½! ĞĞ½Ğ³Ğ»Ñ–Ğ¹ÑÑŒĞºĞ° Ğ²ĞµÑ€ÑÑ–Ñ Â«storm in a teacupÂ» Ñ‚Ğ° ÑƒĞºÑ€Ğ°Ñ—Ğ½ÑÑŒĞºĞ° Â«Ğ±ÑƒÑ€Ñ Ğ² ÑĞºĞ»ÑĞ½Ñ†Ñ– Ğ²Ğ¾Ğ´Ğ¸Â» â€” Ğ¿Ğ°Ñ€Ğ°Ğ»ĞµĞ»ÑŒĞ½Ñ– Ğ·Ğ°Ğ¿Ğ¾Ğ·Ğ¸Ñ‡ĞµĞ½Ğ½Ñ Ğ· ĞºĞ»Ğ°ÑĞ¸Ñ‡Ğ½Ğ¾Ñ— Ñ‚Ñ€Ğ°Ğ´Ğ¸Ñ†Ñ–Ñ—. Ğ£ÑÑ– Ğ²Ğ¾Ğ½Ğ¸ Ğ¾Ğ·Ğ½Ğ°Ñ‡Ğ°ÑÑ‚ÑŒ Ğ¿ĞµÑ€ĞµĞ±Ñ–Ğ»ÑŒÑˆĞµĞ½Ğ½Ñ Ğ½ĞµĞ·Ğ½Ğ°Ñ‡Ğ½Ğ¾Ñ— Ğ¿Ñ€Ğ¾Ğ±Ğ»ĞµĞ¼Ğ¸.\n\nĞŸÑ€Ğ¸Ñ€Ğ¾Ğ´Ğ½Ñ– Ğ¼ĞµÑ‚Ğ°Ñ„Ğ¾Ñ€Ğ¸ Ğ¾ÑĞ¾Ğ±Ğ»Ğ¸Ğ²Ğ¾ Ğ±Ğ°Ğ³Ğ°Ñ‚Ñ– Ğ² ÑƒĞºÑ€Ğ°Ñ—Ğ½ÑÑŒĞºĞ¸Ñ… Ğ¿Ñ€Ğ¸ÑĞ»Ñ–Ğ²'ÑÑ…. **Â«Ğ©Ğ¾ Ğ¿Ğ¾ÑÑ–Ñ”Ñˆ, Ñ‚Ğµ Ğ¹ Ğ¿Ğ¾Ğ¶Ğ½ĞµÑˆÂ»** â€” Ñ†Ğµ Ğ½Ğµ Ğ»Ğ¸ÑˆĞµ Ğ°Ğ³Ñ€Ğ°Ñ€Ğ½Ğ° Ğ¼ÑƒĞ´Ñ€Ñ–ÑÑ‚ÑŒ, Ğ° Ğ¹ Ğ¼Ğ¾Ñ€Ğ°Ğ»ÑŒĞ½Ğ¸Ğ¹ Ğ·Ğ°ĞºĞ¾Ğ½ Ğ¿Ñ€Ğ¸Ñ‡Ğ¸Ğ½Ğ¸ Ñ‚Ğ° Ğ½Ğ°ÑĞ»Ñ–Ğ´ĞºÑƒ. Â«Ğ¥Ñ‚Ğ¾ ÑÑ–Ñ” Ğ²Ñ–Ñ‚ĞµÑ€, Ñ‚Ğ¾Ğ¹ Ğ¿Ğ¾Ğ¶Ğ½Ğµ Ğ±ÑƒÑ€ÑÂ» â€” Ñ‰Ğµ Ğ³Ğ»Ğ¸Ğ±ÑˆĞ° Ğ²ĞµÑ€ÑÑ–Ñ: Ñ…Ñ‚Ğ¾ Ğ¿Ğ¾Ñ‡Ğ¸Ğ½Ğ°Ñ” ĞºĞ¾Ğ½Ñ„Ğ»Ñ–ĞºÑ‚, Ğ¾Ñ‚Ñ€Ğ¸Ğ¼Ğ°Ñ” ĞºĞ°Ñ‚Ğ°ÑÑ‚Ñ€Ğ¾Ñ„Ñƒ. Ğ¦Ñ– Ğ¾Ğ±Ñ€Ğ°Ğ·Ğ¸ Ğ±Ğ»Ğ¸Ğ·ÑŒĞºÑ– ĞºĞ¾Ğ¶Ğ½Ğ¾Ğ¼Ñƒ ÑƒĞºÑ€Ğ°Ñ—Ğ½Ñ†Ñ, Ğ±Ğ¾ ÑÑ–Ğ»ÑŒÑÑŒĞºĞµ Ğ³Ğ¾ÑĞ¿Ğ¾Ğ´Ğ°Ñ€ÑÑ‚Ğ²Ğ¾ ÑÑ‚Ğ¾Ğ»Ñ–Ñ‚Ñ‚ÑĞ¼Ğ¸ Ğ±ÑƒĞ»Ğ¾ Ğ¾ÑĞ½Ğ¾Ğ²Ğ¾Ñ Ğ¶Ğ¸Ñ‚Ñ‚Ñ.\n\n---\n\n# Ğ—Ğ¼Ñ–ÑÑ‚ ÑƒÑ€Ğ¾ĞºÑƒ\n\n## Ğ Ğ¾Ğ·Ğ¼Ğ¸Ğ½ĞºĞ°\n\n### ĞŸÑ€Ğ¸Ñ€Ğ¾Ğ´Ğ° ÑĞº Ğ¼ĞµÑ‚Ğ°Ñ„Ğ¾Ñ€Ğ°\n\nĞ£ĞºÑ€Ğ°Ñ—Ğ½Ñ†Ñ– Ñ‡Ğ°ÑÑ‚Ğ¾ Ğ²Ğ¸ĞºĞ¾Ñ€Ğ¸ÑÑ‚Ğ¾Ğ²ÑƒÑÑ‚ÑŒ Ğ¿Ñ€Ğ¸Ñ€Ğ¾Ğ´Ñƒ Ğ´Ğ»Ñ Ğ¾Ğ¿Ğ¸ÑÑƒ Ğ¶Ğ¸Ñ‚Ñ‚Ñ:\n- **Ğ’Ğ¾Ğ´Ğ°** â€” Ğ¿Ğ»Ğ¸Ğ½ Ñ‡Ğ°ÑÑƒ, Ğ¿Ñ€Ğ°Ğ²Ğ´Ğ°/Ğ±Ñ€ĞµÑ…Ğ½Ñ, Ğ¿ĞµÑ€ĞµÑˆĞºĞ¾Ğ´Ğ¸\n- **ĞšĞ°Ğ¼Ñ–Ğ½ÑŒ** â€” ÑÑ‚Ñ–Ğ¹ĞºÑ–ÑÑ‚ÑŒ, Ñ…Ğ¾Ğ»Ğ¾Ğ´Ğ½Ñ–ÑÑ‚ÑŒ, Ğ¿ĞµÑ€ĞµÑˆĞºĞ¾Ğ´Ğ¸\n- **Ğ”ĞµÑ€ĞµĞ²Ğ¾** â€” Ğ¶Ğ¸Ñ‚Ñ‚Ñ, Ñ€Ğ¾Ğ´Ğ¸Ğ½Ğ°, Ğ·Ñ€Ğ¾ÑÑ‚Ğ°Ğ½Ğ½Ñ\n- **ĞŸĞ¾Ğ³Ğ¾Ğ´Ğ°** â€” Ğ½Ğ°ÑÑ‚Ñ€Ñ–Ğ¹, Ğ½ĞµÑĞ¿Ğ¾Ğ´Ñ–Ğ²Ğ°Ğ½ĞºĞ¸, Ğ¿Ñ€Ğ¾Ğ±Ğ»ĞµĞ¼Ğ¸\n\n**ĞĞ±Ğ³Ğ¾Ğ²Ğ¾Ñ€ĞµĞ½Ğ½Ñ:** Ğ¯ĞºÑ– Ğ¿Ñ€Ğ¸Ñ€Ğ¾Ğ´Ğ½Ñ– Ğ¾Ğ±Ñ€Ğ°Ğ·Ğ¸ Ğ²Ğ¸ĞºĞ¾Ñ€Ğ¸ÑÑ‚Ğ¾Ğ²ÑƒÑ” Ğ²Ğ°ÑˆĞ° Ñ€Ñ–Ğ´Ğ½Ğ° Ğ¼Ğ¾Ğ²Ğ°? Ğ§Ğ¸ Ñ” ÑĞ¿Ñ–Ğ»ÑŒĞ½Ñ– Ğ¼ĞµÑ‚Ğ°Ñ„Ğ¾Ñ€Ğ¸ Ğ· ÑƒĞºÑ€Ğ°Ñ—Ğ½ÑÑŒĞºĞ¾Ñ?\n\n---\n\n## ĞŸÑ€ĞµĞ·ĞµĞ½Ñ‚Ğ°Ñ†Ñ–Ñ\n\n### Ğ’Ğ¾Ğ´Ğ° â€” Ñ‡Ğ°Ñ, Ğ¿Ñ€Ğ°Ğ²Ğ´Ğ°, Ğ´Ğ¾Ğ»Ñ\n\n#### ĞŸĞ»Ğ¸Ğ½ Ñ‡Ğ°ÑÑƒ Ñ‚Ğ° Ğ²Ğ¸ĞºÑ€Ğ¸Ñ‚Ñ‚Ñ\n\n| Ğ†Ğ´Ñ–Ğ¾Ğ¼Ğ° | Ğ—Ğ½Ğ°Ñ‡ĞµĞ½Ğ½Ñ | ĞĞ½Ğ³Ğ»Ñ–Ğ¹ÑÑŒĞºĞ¸Ğ¹ Ğ²Ñ–Ğ´Ğ¿Ğ¾Ğ²Ñ–Ğ´Ğ½Ğ¸Ğº |\n|--------|----------|------------------------|\n| Ğ±Ğ°Ğ³Ğ°Ñ‚Ğ¾ Ğ²Ğ¾Ğ´Ğ¸ ÑƒÑ‚ĞµĞºĞ»Ğ¾ | Ğ¼Ğ¸Ğ½ÑƒĞ»Ğ¾ Ğ±Ğ°Ğ³Ğ°Ñ‚Ğ¾ Ñ‡Ğ°ÑÑƒ | much water has flowed under the bridge |\n| Ğ²Ğ¸Ğ²ĞµÑÑ‚Ğ¸ Ğ½Ğ° Ñ‡Ğ¸ÑÑ‚Ñƒ Ğ²Ğ¾Ğ´Ñƒ | Ğ²Ğ¸ĞºÑ€Ğ¸Ñ‚Ğ¸ Ğ¿Ñ€Ğ°Ğ²Ğ´Ñƒ, Ğ¾Ğ±Ğ¼Ğ°Ğ½ | â€” |\n| Ğ²Ğ¸Ñ…Ğ¾Ğ´Ğ¸Ñ‚Ğ¸ ÑÑƒÑ…Ğ¸Ğ¼ Ğ· Ğ²Ğ¾Ğ´Ğ¸ | ÑƒĞ½Ğ¸ĞºĞ°Ñ‚Ğ¸ Ğ¿Ğ¾ĞºĞ°Ñ€Ğ°Ğ½Ğ½Ñ | get off scot-free |\n| ĞºĞ°Ğ»Ğ°Ğ¼ÑƒÑ‚Ğ¸Ñ‚Ğ¸ Ğ²Ğ¾Ğ´Ñƒ | Ğ½Ğ°Ğ²Ğ¼Ğ¸ÑĞ½Ğ¾ ÑÑ‚Ğ²Ğ¾Ñ€ÑĞ²Ğ°Ñ‚Ğ¸ Ğ¿Ğ»ÑƒÑ‚Ğ°Ğ½Ğ¸Ğ½Ñƒ | muddy the waters |\n| Ğ»Ğ¸Ñ‚Ğ¸ Ğ²Ğ¾Ğ´Ñƒ | Ğ³Ğ¾Ğ²Ğ¾Ñ€Ğ¸Ñ‚Ğ¸ Ğ¿ÑƒÑÑ‚Ğµ, Ğ±ĞµĞ· Ğ·Ğ¼Ñ–ÑÑ‚Ñƒ | â€” |\n\n**Ğ•Ñ‚Ğ¸Ğ¼Ğ¾Ğ»Ğ¾Ğ³Ñ–Ñ:**\n- **Â«Ğ’Ğ¸Ğ²ĞµÑÑ‚Ğ¸ Ğ½Ğ° Ñ‡Ğ¸ÑÑ‚Ñƒ Ğ²Ğ¾Ğ´ÑƒÂ»** â€” Ñƒ ĞºĞ°Ğ»Ğ°Ğ¼ÑƒÑ‚Ğ½Ñ–Ğ¹ Ğ²Ğ¾Ğ´Ñ– Ğ½Ñ–Ñ‡Ğ¾Ğ³Ğ¾ Ğ½Ğµ Ğ²Ğ¸Ğ´Ğ½Ğ¾. ĞšĞ¾Ğ»Ğ¸ Ğ²Ğ¾Ğ´Ñƒ Ğ¾Ñ‡Ğ¸Ñ‰Ğ°ÑÑ‚ÑŒ, Ğ¿Ñ€Ğ°Ğ²Ğ´Ğ° ÑÑ‚Ğ°Ñ” Ğ²Ğ¸Ğ´Ğ¸Ğ¼Ğ¾Ñ.\n- **Â«Ğ’Ğ¸Ñ…Ğ¾Ğ´Ğ¸Ñ‚Ğ¸ ÑÑƒÑ…Ğ¸Ğ¼ Ğ· Ğ²Ğ¾Ğ´Ğ¸Â»** â€” Ñ†ĞµĞ¹ Ğ²Ğ¸Ñ€Ğ°Ğ· Ğ¼Ğ°Ñ” ÑÑƒĞ´Ğ¾Ğ²Ğµ Ğ¿Ğ¾Ñ…Ğ¾Ğ´Ğ¶ĞµĞ½Ğ½Ñ. Ğ£ ÑĞµÑ€ĞµĞ´Ğ½ÑŒĞ¾Ğ²Ñ–Ñ‡Ñ‡Ñ– Ñ–ÑĞ½ÑƒĞ²Ğ°Ğ»Ğ¾ Â«Ğ²Ğ¸Ğ¿Ñ€Ğ¾Ğ±ÑƒĞ²Ğ°Ğ½Ğ½Ñ Ğ²Ğ¾Ğ´Ğ¾ÑÂ»: Ğ¿Ñ–Ğ´Ğ¾Ğ·Ñ€ÑĞ²Ğ°Ğ½Ğ¾Ğ³Ğ¾ ĞºĞ¸Ğ´Ğ°Ğ»Ğ¸ Ğ² Ñ€Ñ–Ñ‡ĞºÑƒ, Ñ– ÑĞºÑ‰Ğ¾ Ğ²Ñ–Ğ½ Ğ²Ğ¸Ğ¿Ğ»Ğ¸Ğ²Ğ°Ğ² â€” Ğ²Ğ²Ğ°Ğ¶Ğ°Ğ²ÑÑ Ğ²Ğ¸Ğ½Ğ½Ğ¸Ğ¼ (Ğ±Ğ¾ Â«Ñ‡Ğ¸ÑÑ‚Ğ° Ğ²Ğ¾Ğ´Ğ° Ğ¹Ğ¾Ğ³Ğ¾ Ğ²Ñ–Ğ´ĞºĞ¸Ğ½ÑƒĞ»Ğ°Â»). ĞŸĞ°Ñ€Ğ°Ğ´Ğ¾ĞºÑĞ°Ğ»ÑŒĞ½Ğ¾, Ğ²Ğ¸Ğ¹Ñ‚Ğ¸ ÑÑƒÑ…Ğ¸Ğ¼ Ğ¾Ğ·Ğ½Ğ°Ñ‡Ğ°Ğ»Ğ¾ â€” ÑƒĞ½Ğ¸ĞºĞ½ÑƒÑ‚Ğ¸ Ğ¿Ğ¾ĞºĞ°Ñ€Ğ°Ğ½Ğ½Ñ.\n\n**ĞŸÑ€Ğ¸ĞºĞ»Ğ°Ğ´Ğ¸:**\n1. Â«ĞœĞ¸ Ğ¿Ğ¾Ğ·Ğ½Ğ°Ğ¹Ğ¾Ğ¼Ğ¸Ğ»Ğ¸ÑÑ Ñƒ 2005-Ğ¼Ñƒ. Ğ— Ñ‚Ğ¾Ğ³Ğ¾ Ñ‡Ğ°ÑÑƒ Ğ±Ğ°Ğ³Ğ°Ñ‚Ğ¾ Ğ²Ğ¾Ğ´Ğ¸ ÑƒÑ‚ĞµĞºĞ»Ğ¾ â€” Ğ¾Ğ±Ğ¾Ñ” Ğ¾Ğ´Ñ€ÑƒĞ¶ĞµĞ½Ñ–, Ğ¼Ğ°Ñ”Ğ¼Ğ¾ Ğ´Ñ–Ñ‚ĞµĞ¹.Â»\n2. Â«Ğ–ÑƒÑ€Ğ½Ğ°Ğ»Ñ–ÑÑ‚Ğ¸ Ğ½Ğ°Ñ€ĞµÑˆÑ‚Ñ– Ğ²Ğ¸Ğ²ĞµĞ»Ğ¸ Ğ¹Ğ¾Ğ³Ğ¾ Ğ½Ğ° Ñ‡Ğ¸ÑÑ‚Ñƒ Ğ²Ğ¾Ğ´Ñƒ â€” Ğ²Ğ¸ÑĞ²Ğ¸Ğ»Ğ¾ÑÑ, Ğ³Ñ€Ğ¾ÑˆÑ– Ğ²Ñ–Ğ½ ĞºÑ€Ğ°Ğ² Ñ€Ğ¾ĞºĞ°Ğ¼Ğ¸.Â»\n3. Â«Ğ¦ĞµĞ¹ Ğ¿Ğ¾Ğ»Ñ–Ñ‚Ğ¸Ğº Ğ·Ğ°Ğ²Ğ¶Ğ´Ğ¸ Ğ²Ğ¸Ñ…Ğ¾Ğ´Ğ¸Ñ‚ÑŒ ÑÑƒÑ…Ğ¸Ğ¼ Ğ· Ğ²Ğ¾Ğ´Ğ¸ â€” ÑĞºÑ–Ğ»ÑŒĞºĞ¸ ÑĞºĞ°Ğ½Ğ´Ğ°Ğ»Ñ–Ğ², Ğ° Ğ¹Ğ¾Ğ¼Ñƒ Ğ½Ñ–Ñ‡Ğ¾Ğ³Ğ¾!Â»\n\n#### Ğ¥Ğ°Ñ€Ğ°ĞºÑ‚ĞµÑ€ Ñ‚Ğ° ÑÑ‚Ğ°Ğ½\n\n| Ğ†Ğ´Ñ–Ğ¾Ğ¼Ğ° | Ğ—Ğ½Ğ°Ñ‡ĞµĞ½Ğ½Ñ | ĞĞ½Ğ³Ğ»Ñ–Ğ¹ÑÑŒĞºĞ¸Ğ¹ Ğ²Ñ–Ğ´Ğ¿Ğ¾Ğ²Ñ–Ğ´Ğ½Ğ¸Ğº |\n|--------|----------|---------|\n| Ñ‚Ğ¸Ñ…Ğ° Ğ²Ğ¾Ğ´Ğ° | ÑĞ¿Ğ¾ĞºÑ–Ğ¹Ğ½Ğ° Ğ·Ğ¾Ğ²Ğ½Ñ–, Ğ°Ğ»Ğµ Ğ¿Ğ¾Ñ‚ÑƒĞ¶Ğ½Ğ° Ğ»ÑĞ´Ğ¸Ğ½Ğ° | still waters run deep |\n| ÑĞº Ğ²Ğ¾Ğ´Ğ° ĞºÑ€Ñ–Ğ·ÑŒ Ğ¿Ğ°Ğ»ÑŒÑ†Ñ– | ÑˆĞ²Ğ¸Ğ´ĞºĞ¾ Ğ·Ğ½Ğ¸ĞºĞ°Ñ” | slip through one's fingers |\n| Ğ½Ğ¾ÑĞ¸Ñ‚Ğ¸ Ğ²Ğ¾Ğ´Ñƒ Ğ² Ñ€ĞµÑˆĞµÑ‚Ñ– | Ğ¼Ğ°Ñ€Ğ½Ğ° Ğ¿Ñ€Ğ°Ñ†Ñ | â€” |\n| Ğ½Ğ°Ğ±Ñ€Ğ°Ñ‚Ğ¸ Ğ² Ñ€Ğ¾Ñ‚ Ğ²Ğ¾Ğ´Ğ¸ | Ğ·Ğ°Ğ¼Ğ¾Ğ²ĞºĞ½ÑƒÑ‚Ğ¸ | â€” |\n| ÑĞº Ñƒ Ğ²Ğ¾Ğ´Ñƒ ĞºĞ°Ğ½ÑƒÑ‚Ğ¸ | Ğ·Ğ½Ğ¸ĞºĞ½ÑƒÑ‚Ğ¸ Ğ±ĞµĞ·ÑĞ»Ñ–Ğ´Ğ½Ğ¾ | vanish into thin air |\n\n**ĞšÑƒĞ»ÑŒÑ‚ÑƒÑ€Ğ½Ğ¸Ğ¹ ĞºĞ¾Ğ½Ñ‚ĞµĞºÑÑ‚:**\nÂ«Ğ¢Ğ¸Ñ…Ğ° Ğ²Ğ¾Ğ´Ğ° Ğ³Ñ€ĞµĞ±Ğ»Ñ Ñ€Ğ²ĞµÂ» â€” Ğ¾Ğ´Ğ½Ğµ Ğ· Ğ½Ğ°Ğ¹Ğ³Ğ»Ğ¸Ğ±ÑˆĞ¸Ñ… ÑƒĞºÑ€Ğ°Ñ—Ğ½ÑÑŒĞºĞ¸Ñ… Ğ¿Ñ€Ğ¸ÑĞ»Ñ–Ğ²'Ñ—Ğ². Ğ’Ğ¾Ğ½Ğ¾ Ğ·Ğ°ÑÑ‚ĞµÑ€Ñ–Ğ³Ğ°Ñ”: Ğ½Ğµ Ğ²Ğ°Ñ€Ñ‚Ğ¾ Ğ½ĞµĞ´Ğ¾Ğ¾Ñ†Ñ–Ğ½ÑĞ²Ğ°Ñ‚Ğ¸ ÑĞ¿Ğ¾ĞºÑ–Ğ¹Ğ½Ğ¸Ñ… Ğ»ÑĞ´ĞµĞ¹. ĞŸÑ–Ğ´ Ñ‚Ğ¸Ñ…Ğ¾Ñ Ğ¿Ğ¾Ğ²ĞµÑ€Ñ…Ğ½ĞµÑ Ğ¼Ğ¾Ğ¶Ğµ Ñ…Ğ¾Ğ²Ğ°Ñ‚Ğ¸ÑÑ Ğ²ĞµĞ»Ğ¸ĞºĞ° ÑĞ¸Ğ»Ğ°.\n\n**ĞŸÑ€Ğ¸ĞºĞ»Ğ°Ğ´Ğ¸:**\n1. Â«Ğ“Ñ€Ğ¾ÑˆÑ– Ğ¹Ğ´ÑƒÑ‚ÑŒ ÑĞº Ğ²Ğ¾Ğ´Ğ° ĞºÑ€Ñ–Ğ·ÑŒ Ğ¿Ğ°Ğ»ÑŒÑ†Ñ– â€” Ğ½Ğµ Ğ²ÑÑ‚Ğ¸Ğ³Ğ°Ñ Ğ·Ğ°Ñ€Ğ¾Ğ±Ğ»ÑÑ‚Ğ¸.Â»\n2. Â«Ğ’Ñ–Ğ½ Ğ½Ğ°Ğ±Ñ€Ğ°Ğ² Ñƒ Ñ€Ğ¾Ñ‚ Ğ²Ğ¾Ğ´Ğ¸ Ñ– Ğ½Ñ–ĞºĞ¾Ğ¼Ñƒ Ğ½Ğµ Ñ€Ğ¾Ğ·ĞºĞ°Ğ·Ğ°Ğ² Ğ¿Ñ€Ğ¾ Ğ¿Ğ¾Ğ±Ğ°Ñ‡ĞµĞ½Ğµ.Â»\n3. Â«ĞŸÑ–ÑĞ»Ñ Ñ‚Ğ¾Ğ³Ğ¾ Ğ´Ğ·Ğ²Ñ–Ğ½ĞºĞ° Ğ²Ñ–Ğ½ ÑĞº Ñƒ Ğ²Ğ¾Ğ´Ñƒ ĞºĞ°Ğ½ÑƒĞ² â€” Ğ½Ñ–Ñ…Ñ‚Ğ¾ Ğ½Ğµ Ğ¼Ñ–Ğ³ Ğ¹Ğ¾Ğ³Ğ¾ Ğ·Ğ½Ğ°Ğ¹Ñ‚Ğ¸.Â»\n\n> **Ğ§Ğ¸ Ğ·Ğ½Ğ°Ğ»Ğ¸ Ğ²Ğ¸?**\n>\n> Ğ’Ğ¸Ñ€Ğ°Ğ· **Â«Ğ½Ğ¾ÑĞ¸Ñ‚Ğ¸ Ğ²Ğ¾Ğ´Ñƒ Ğ² Ñ€ĞµÑˆĞµÑ‚Ñ–Â»** â€” Ñ†Ğµ Ğ¾Ğ±Ñ€Ğ°Ğ· ÑÑ–Ğ·Ñ–Ñ„Ğ¾Ğ²Ğ¾Ñ— Ğ¿Ñ€Ğ°Ñ†Ñ–. Ğ ĞµÑˆĞµÑ‚Ğ¾ (ÑĞ¸Ñ‚Ğ¾) Ğ¿Ñ€Ğ¸Ğ·Ğ½Ğ°Ñ‡ĞµĞ½Ğµ Ğ´Ğ»Ñ Ğ¿Ñ€Ğ¾ÑÑ–ÑĞ²Ğ°Ğ½Ğ½Ñ, Ñ‚Ğ¾Ğ¼Ñƒ Ğ²Ğ¾Ğ´Ğ° Ğ²Ğ¸Ñ‚Ñ–ĞºĞ°Ñ” Ğ¼Ğ¸Ñ‚Ñ‚Ñ”Ğ²Ğ¾. Ğ¦ĞµĞ¹ Ğ²Ğ¸Ñ€Ğ°Ğ· Ğ¼Ğ°Ñ” Ğ°Ğ½Ğ°Ğ»Ğ¾Ğ³Ğ¸ Ğ² Ğ±Ğ°Ğ³Ğ°Ñ‚ÑŒĞ¾Ñ… ĞºÑƒĞ»ÑŒÑ‚ÑƒÑ€Ğ°Ñ…: Ğ³Ñ€ĞµÑ†ÑŒĞºĞ¾Ğ¼Ñƒ Ğ¼Ñ–Ñ„Ñ– Ğ¿Ñ€Ğ¾ Ğ”Ğ°Ğ½Ğ°Ñ—Ğ´, Ğ·Ğ°ÑÑƒĞ´Ğ¶ĞµĞ½Ğ¸Ñ… Ğ²Ñ–Ñ‡Ğ½Ğ¾ Ğ½Ğ¾ÑĞ¸Ñ‚Ğ¸ Ğ²Ğ¾Ğ´Ñƒ Ğ² Ğ´Ñ–Ñ€Ğ°Ğ²Ğ¸Ñ… Ğ¿Ğ¾ÑÑƒĞ´Ğ¸Ğ½Ğ°Ñ…. Ğ’ ÑƒĞºÑ€Ğ°Ñ—Ğ½ÑÑŒĞºÑ–Ğ¹ Ğ²ĞµÑ€ÑÑ–Ñ— Ğ°ĞºÑ†ĞµĞ½Ñ‚ Ğ½Ğ° Ğ±ĞµĞ·Ğ³Ğ»ÑƒĞ·Ğ´Ğ¾ÑÑ‚Ñ– ÑĞ°Ğ¼Ğ¾Ğ³Ğ¾ Ğ·Ğ°Ğ½ÑÑ‚Ñ‚Ñ.\n\n---\n\n### ĞšĞ°Ğ¼Ñ–Ğ½ÑŒ â€” ÑÑ‚Ñ–Ğ¹ĞºÑ–ÑÑ‚ÑŒ, Ñ…Ğ¾Ğ»Ğ¾Ğ´Ğ½Ñ–ÑÑ‚ÑŒ, Ğ¿ĞµÑ€ĞµÑˆĞºĞ¾Ğ´Ğ¸\n\n#### Ğ¢Ğ²ĞµÑ€Ğ´Ñ–ÑÑ‚ÑŒ Ñ‚Ğ° ĞµĞ¼Ğ¾Ñ†Ñ–Ñ—\n\n| Ğ†Ğ´Ñ–Ğ¾Ğ¼Ğ° | Ğ—Ğ½Ğ°Ñ‡ĞµĞ½Ğ½Ñ | ĞĞ½Ğ³Ğ»Ñ–Ğ¹ÑÑŒĞºĞ¸Ğ¹ Ğ²Ñ–Ğ´Ğ¿Ğ¾Ğ²Ñ–Ğ´Ğ½Ğ¸Ğº |\n|--------|----------|------------------------|\n| ĞºĞ°Ğ¼Ñ–Ğ½ÑŒ Ğ½Ğ° ÑĞµÑ€Ñ†Ñ– | Ñ‚Ñ€Ğ¸Ğ²Ğ¾Ğ³Ğ°, Ğ¿Ñ€Ğ¾Ğ²Ğ¸Ğ½Ğ° | weight on one's heart |\n| ĞºĞ°Ğ¼Ñ–Ğ½ÑŒ Ğ· ÑĞµÑ€Ñ†Ñ Ğ²Ğ¿Ğ°Ğ² | Ğ¿Ğ¾Ğ»ĞµĞ³ÑˆĞµĞ½Ğ½Ñ | weight off one's shoulders |\n| ĞºĞ°Ğ¼'ÑĞ½Ğµ ÑĞµÑ€Ñ†Ğµ | Ğ±ĞµĞ·Ğ´ÑƒÑˆĞ½Ğ¸Ğ¹, Ğ±ĞµĞ· ĞµĞ¼Ğ¾Ñ†Ñ–Ğ¹ | heart of stone |\n| Ñ‚Ğ²ĞµÑ€Ğ´Ğ¸Ğ¹ ÑĞº ĞºĞ°Ğ¼Ñ–Ğ½ÑŒ | Ğ½ĞµĞ·Ğ»Ğ°Ğ¼Ğ½Ğ¸Ğ¹, ÑÑ‚Ñ–Ğ¹ĞºĞ¸Ğ¹ | hard as a rock |\n| ĞºĞ¸Ğ´Ğ°Ñ‚Ğ¸ ĞºĞ°Ğ¼Ñ–Ğ½Ğ½Ñ | ĞºÑ€Ğ¸Ñ‚Ğ¸ĞºÑƒĞ²Ğ°Ñ‚Ğ¸ | cast stones |\n\n**ĞšÑƒĞ»ÑŒÑ‚ÑƒÑ€Ğ½Ğ¸Ğ¹ ĞºĞ¾Ğ½Ñ‚ĞµĞºÑÑ‚:**\nÂ«ĞšĞ¸Ğ´Ğ°Ñ‚Ğ¸ ĞºĞ°Ğ¼Ñ–Ğ½Ğ½ÑÂ» Ğ¼Ğ°Ñ” Ğ±Ñ–Ğ±Ğ»Ñ–Ğ¹Ğ½Ğµ Ğ¿Ğ¾Ñ…Ğ¾Ğ´Ğ¶ĞµĞ½Ğ½Ñ â€” Ñ–ÑÑ‚Ğ¾Ñ€Ñ–Ñ Ğ¿Ñ€Ğ¾ Ğ¶Ñ–Ğ½ĞºÑƒ, ÑĞºÑƒ Ñ…Ğ¾Ñ‚Ñ–Ğ»Ğ¸ Ğ·Ğ°ĞºĞ¸Ğ´Ğ°Ñ‚Ğ¸ ĞºĞ°Ğ¼Ñ–Ğ½Ğ½ÑĞ¼, Ñ– ÑĞ»Ğ¾Ğ²Ğ° Ğ†ÑÑƒÑĞ°: Â«Ğ¥Ñ‚Ğ¾ Ğ±ĞµĞ· Ğ³Ñ€Ñ–Ñ…Ğ°, Ğ½ĞµÑ…Ğ°Ğ¹ Ğ¿ĞµÑ€ÑˆĞ¸Ğ¹ ĞºĞ¸Ğ½Ğµ ĞºĞ°Ğ¼Ñ–Ğ½ÑŒÂ». Ğ¢Ğ¾Ğ¼Ñƒ Ñ†ĞµĞ¹ Ğ²Ğ¸Ñ€Ğ°Ğ· Ñ‡Ğ°ÑÑ‚Ğ¾ Ğ²Ğ¶Ğ¸Ğ²Ğ°Ñ”Ñ‚ÑŒÑÑ Ğ· Ñ–Ñ€Ğ¾Ğ½Ñ–Ñ”Ñ Ñ‰Ğ¾Ğ´Ğ¾ Ñ‚Ğ¸Ñ…, Ñ…Ñ‚Ğ¾ ÑĞ°Ğ¼ Ğ½ĞµĞ±ĞµĞ·Ğ´Ğ¾Ğ³Ğ°Ğ½Ğ½Ğ¸Ğ¹.\n\n**ĞŸÑ€Ğ¸ĞºĞ»Ğ°Ğ´Ğ¸:**\n1. Â«ĞšĞ°Ğ¼Ñ–Ğ½ÑŒ Ğ· ÑĞµÑ€Ñ†Ñ Ğ²Ğ¿Ğ°Ğ² â€” Ğ´Ğ¾Ğ½ÑŒĞºĞ° Ğ½Ğ°Ñ€ĞµÑˆÑ‚Ñ– Ğ½Ğ°Ğ¿Ğ¸ÑĞ°Ğ»Ğ°, Ñ‰Ğ¾ Ğ² Ğ±ĞµĞ·Ğ¿ĞµÑ†Ñ–.Â»\n2. Â«Ğ£ Ğ½ÑŒĞ¾Ğ³Ğ¾ ĞºĞ°Ğ¼'ÑĞ½Ğµ ÑĞµÑ€Ñ†Ğµ â€” Ğ±Ğ°Ñ‡Ğ¸Ğ², ÑĞº Ğ±Ğ°Ğ±ÑƒÑÑ Ğ²Ğ¿Ğ°Ğ»Ğ°, Ñ– Ğ¿Ñ€Ğ¾Ğ¹ÑˆĞ¾Ğ² Ğ¿Ğ¾Ğ²Ğ·.Â»\n3. Â«Ğ›ĞµĞ³ĞºĞ¾ ĞºĞ¸Ğ´Ğ°Ñ‚Ğ¸ ĞºĞ°Ğ¼Ñ–Ğ½Ğ½Ñ Ğ² Ñ‡ÑƒĞ¶Ğ¸Ğ¹ Ğ³Ğ¾Ñ€Ğ¾Ğ´, Ğ¿Ğ¾ĞºĞ¸ ÑĞ²Ñ–Ğ¹ â€” Ñƒ Ğ±ÑƒÑ€'ÑĞ½Ğ°Ñ….Â»\n\n#### Ğ”Ñ–Ñ Ñ‚Ğ° Ğ½Ğ°ÑĞ»Ñ–Ğ´ĞºĞ¸\n\n| Ğ†Ğ´Ñ–Ğ¾Ğ¼Ğ° | Ğ—Ğ½Ğ°Ñ‡ĞµĞ½Ğ½Ñ | ĞŸÑ€Ğ¸ĞºĞ»Ğ°Ğ´ |\n|--------|----------|---------|\n| Ğ¿Ñ–Ğ´ Ğ»ĞµĞ¶Ğ°Ñ‡Ğ¸Ğ¹ ĞºĞ°Ğ¼Ñ–Ğ½ÑŒ Ğ²Ğ¾Ğ´Ğ° Ğ½Ğµ Ñ‚ĞµÑ‡Ğµ | Ğ±ĞµĞ· Ğ´Ñ–Ñ— Ğ½ĞµĞ¼Ğ°Ñ” Ñ€ĞµĞ·ÑƒĞ»ÑŒÑ‚Ğ°Ñ‚Ñƒ | Ğ”Ñ–Ğ¹! ĞŸÑ–Ğ´ Ğ»ĞµĞ¶Ğ°Ñ‡Ğ¸Ğ¹ ĞºĞ°Ğ¼Ñ–Ğ½ÑŒ Ğ²Ğ¾Ğ´Ğ° Ğ½Ğµ Ñ‚ĞµÑ‡Ğµ. |\n| ĞºĞ°Ğ¼Ñ–Ğ½ÑŒ ÑĞ¿Ğ¾Ñ‚Ğ¸ĞºĞ°Ğ½Ğ½Ñ | Ğ³Ğ¾Ğ»Ğ¾Ğ²Ğ½Ğ° Ğ¿ĞµÑ€ĞµÑˆĞºĞ¾Ğ´Ğ° | ĞœĞ¾Ğ²Ğ° ÑÑ‚Ğ°Ğ»Ğ° ĞºĞ°Ğ¼ĞµĞ½ĞµĞ¼ ÑĞ¿Ğ¾Ñ‚Ğ¸ĞºĞ°Ğ½Ğ½Ñ. |\n| ĞºĞ°Ğ¼Ñ–Ğ½ÑŒ Ğ·Ğ° Ğ¿Ğ°Ğ·ÑƒÑ…Ğ¾Ñ | Ğ¿Ñ€Ğ¸Ñ…Ğ¾Ğ²Ğ°Ğ½Ğ° Ğ²Ğ¾Ñ€Ğ¾Ğ¶Ñ–ÑÑ‚ÑŒ | Ğ’Ñ–Ğ½ Ñ‚Ñ€Ğ¸Ğ¼Ğ°Ñ” ĞºĞ°Ğ¼Ñ–Ğ½ÑŒ Ğ·Ğ° Ğ¿Ğ°Ğ·ÑƒÑ…Ğ¾Ñ. |\n| ĞºĞ°Ğ¼ĞµĞ½ĞµĞ¼ Ğ²Ğ¿Ğ°ÑÑ‚Ğ¸ | Ñ€Ñ–Ğ·ĞºĞ¾ Ğ²Ğ¿Ğ°ÑÑ‚Ğ¸ | Ğ¦Ñ–Ğ½Ğ¸ ĞºĞ°Ğ¼ĞµĞ½ĞµĞ¼ Ğ²Ğ¿Ğ°Ğ»Ğ¸. |\n| Ğ½Ğµ Ğ·Ğ°Ğ»Ğ¸ÑˆĞ¸Ñ‚Ğ¸ ĞºĞ°Ğ¼ĞµĞ½Ñ Ğ½Ğ° ĞºĞ°Ğ¼ĞµĞ½Ñ– | Ğ¿Ğ¾Ğ²Ğ½Ñ–ÑÑ‚Ñ Ğ·Ğ½Ğ¸Ñ‰Ğ¸Ñ‚Ğ¸ | ĞšÑ€Ğ¸Ñ‚Ğ¸ĞºĞ¸ Ğ½Ğµ Ğ·Ğ°Ğ»Ğ¸ÑˆĞ¸Ğ»Ğ¸ ĞºĞ°Ğ¼ĞµĞ½Ñ Ğ½Ğ° ĞºĞ°Ğ¼ĞµĞ½Ñ–. |\n\n**ĞŸĞ¾Ñ…Ğ¾Ğ´Ğ¶ĞµĞ½Ğ½Ñ Â«ĞºĞ°Ğ¼Ñ–Ğ½ÑŒ Ğ·Ğ° Ğ¿Ğ°Ğ·ÑƒÑ…Ğ¾ÑÂ»:**\nĞ£ Ğ´Ğ°Ğ²Ğ½Ğ¸Ğ½Ñƒ ÑĞµĞ»ÑĞ½Ğ¸ ÑĞ¿Ñ€Ğ°Ğ²Ğ´Ñ– Ğ½Ğ¾ÑĞ¸Ğ»Ğ¸ ĞºĞ°Ğ¼ĞµĞ½Ñ– Ğ·Ğ° Ğ¿Ğ°Ğ·ÑƒÑ…Ğ¾Ñ (Ğ¿Ñ–Ğ´ Ğ²ĞµÑ€Ñ…Ğ½Ñ–Ğ¼ Ğ¾Ğ´ÑĞ³Ğ¾Ğ¼) Ğ´Ğ»Ñ ÑĞ°Ğ¼Ğ¾Ğ·Ğ°Ñ…Ğ¸ÑÑ‚Ñƒ. Ğ¯ĞºÑ‰Ğ¾ Ñ…Ñ‚Ğ¾ÑÑŒ Ñ…Ğ¾Ğ²Ğ°Ñ” ĞºĞ°Ğ¼Ñ–Ğ½ÑŒ â€” Ğ·Ğ½Ğ°Ñ‡Ğ¸Ñ‚ÑŒ, Ğ³Ğ¾Ñ‚ÑƒÑ”Ñ‚ÑŒÑÑ Ğ´Ğ¾ Ğ½Ğ°Ğ¿Ğ°Ğ´Ñƒ, Ñ…Ğ¾Ñ‡ Ğ·Ğ¾Ğ²Ğ½Ñ– Ğ¿Ğ¾Ğ²Ğ¾Ğ´Ğ¸Ñ‚ÑŒÑÑ Ğ¼Ğ¸Ñ€Ğ½Ğ¾.\n\n**ĞŸÑ€Ğ¸ĞºĞ»Ğ°Ğ´Ğ¸:**\n1. Â«Ğ Ñ–Ğ²ĞµĞ½ÑŒ Ğ±ĞµĞ·Ñ€Ğ¾Ğ±Ñ–Ñ‚Ñ‚Ñ ĞºĞ°Ğ¼ĞµĞ½ĞµĞ¼ Ğ²Ğ¿Ğ°Ğ² Ğ¿Ñ–ÑĞ»Ñ Ğ²Ñ–Ğ´ĞºÑ€Ğ¸Ñ‚Ñ‚Ñ Ğ½Ğ¾Ğ²Ğ¾Ğ³Ğ¾ Ğ·Ğ°Ğ²Ğ¾Ğ´Ñƒ.Â»\n2. Â«ĞĞµ Ğ·Ğ°Ğ»Ğ¸ÑˆĞ¸Ğ»Ğ¸ ĞºĞ°Ğ¼ĞµĞ½Ñ Ğ½Ğ° ĞºĞ°Ğ¼ĞµĞ½Ñ– Ğ²Ñ–Ğ´ Ğ¹Ğ¾Ğ³Ğ¾ Ñ‚ĞµĞ¾Ñ€Ñ–Ñ— â€” ĞºĞ¾Ğ¶ĞµĞ½ Ğ°Ñ€Ğ³ÑƒĞ¼ĞµĞ½Ñ‚ ÑĞ¿Ñ€Ğ¾ÑÑ‚ÑƒĞ²Ğ°Ğ»Ğ¸.Â»\n3. Â«Ğ’Ğ¾Ğ½Ğ° ÑƒÑĞ¼Ñ–Ñ…Ğ°Ñ”Ñ‚ÑŒÑÑ, Ğ°Ğ»Ğµ Ñ Ğ·Ğ½Ğ°Ñ â€” Ñ‚Ñ€Ğ¸Ğ¼Ğ°Ñ” ĞºĞ°Ğ¼Ñ–Ğ½ÑŒ Ğ·Ğ° Ğ¿Ğ°Ğ·ÑƒÑ…Ğ¾Ñ Ğ¿Ñ–ÑĞ»Ñ Ñ‚Ñ–Ñ”Ñ— ÑĞ²Ğ°Ñ€ĞºĞ¸.Â»\n\n> **ĞŸÑ€Ğ¸ÑĞ»Ñ–Ğ²'Ñ Ğ¿Ñ€Ğ¾ ĞºĞ°Ñ€Ğ¼Ñƒ:**\n>\n> **Â«Ğ¥Ñ‚Ğ¾ ÑÑ–Ñ” Ğ²Ñ–Ñ‚ĞµÑ€, Ñ‚Ğ¾Ğ¹ Ğ¿Ğ¾Ğ¶Ğ½Ğµ Ğ±ÑƒÑ€ÑÂ»** â€” Ñ†Ğµ Ğ¿Ñ€Ğ¾ Ğ½Ğ°ÑĞ»Ñ–Ğ´ĞºĞ¸ Ğ²Ğ»Ğ°ÑĞ½Ğ¸Ñ… Ğ´Ñ–Ğ¹. Ğ’Ñ–Ñ‚ĞµÑ€ Ğ¿Ğ¾ÑÑ–ÑÑ‚Ğ¸ Ğ½ĞµĞ¼Ğ¾Ğ¶Ğ»Ğ¸Ğ²Ğ¾, Ğ°Ğ»Ğµ Ğ¼ĞµÑ‚Ğ°Ñ„Ğ¾Ñ€Ğ° ÑÑĞ½Ğ°: Ñ…Ñ‚Ğ¾ Ğ¿Ğ¾Ñ‡Ğ¸Ğ½Ğ°Ñ” ĞºĞ¾Ğ½Ñ„Ğ»Ñ–ĞºÑ‚ Ñ‡Ğ¸ Ğ¿Ñ€Ğ¾Ğ±Ğ»ĞµĞ¼Ğ¸, Ğ¾Ñ‚Ñ€Ğ¸Ğ¼Ğ°Ñ” Ñ—Ñ… Ñƒ Ğ¿Ğ¾Ğ¼Ğ½Ğ¾Ğ¶ĞµĞ½Ğ¾Ğ¼Ñƒ Ğ²Ğ¸Ğ³Ğ»ÑĞ´Ñ–. ĞœĞ°Ñ” Ğ±Ñ–Ğ±Ğ»Ñ–Ğ¹Ğ½Ğµ Ğ¿Ğ¾Ñ…Ğ¾Ğ´Ğ¶ĞµĞ½Ğ½Ñ (ĞšĞ½Ğ¸Ğ³Ğ° ĞÑÑ–Ñ—).\n\n---\n\n### Ğ”ĞµÑ€ĞµĞ²Ğ¾ Ñ‚Ğ° Ñ€Ğ¾ÑĞ»Ğ¸Ğ½Ğ¸ â€” Ğ¶Ğ¸Ñ‚Ñ‚Ñ, Ğ·Ñ€Ğ¾ÑÑ‚Ğ°Ğ½Ğ½Ñ, ĞºĞ°Ñ€Ğ¼Ğ°\n\n#### ĞšĞ¾Ñ€Ñ–Ğ½Ğ½Ñ Ñ‚Ğ° Ğ·Ñ€Ğ¾ÑÑ‚Ğ°Ğ½Ğ½Ñ\n\n| Ğ†Ğ´Ñ–Ğ¾Ğ¼Ğ° | Ğ—Ğ½Ğ°Ñ‡ĞµĞ½Ğ½Ñ | ĞĞ½Ğ³Ğ»Ñ–Ğ¹ÑÑŒĞºĞ¸Ğ¹ Ğ²Ñ–Ğ´Ğ¿Ğ¾Ğ²Ñ–Ğ´Ğ½Ğ¸Ğº |\n|--------|----------|------------------------|\n| Ğ¿ÑƒÑÑ‚Ğ¸Ñ‚Ğ¸ ĞºĞ¾Ñ€Ñ–Ğ½Ğ½Ñ | Ğ¾ÑĞµĞ»Ğ¸Ñ‚Ğ¸ÑÑ, ÑƒĞºĞ¾Ñ€ĞµĞ½Ğ¸Ñ‚Ğ¸ÑÑ | put down roots |\n| Ñ€Ğ¾ÑÑ‚Ğ¸ ÑĞº Ğ³Ñ€Ğ¸Ğ±Ğ¸ Ğ¿Ñ–ÑĞ»Ñ Ğ´Ğ¾Ñ‰Ñƒ | ÑˆĞ²Ğ¸Ğ´ĞºĞ¾ Ğ·'ÑĞ²Ğ»ÑÑ‚Ğ¸ÑÑ | spring up like mushrooms |\n| Ñ€Ğ¾Ğ´Ğ¾Ğ²Ğµ Ğ´ĞµÑ€ĞµĞ²Ğ¾ | Ğ³ĞµĞ½ĞµĞ°Ğ»Ğ¾Ğ³Ñ–Ñ | family tree |\n| Ğ· ĞºĞ¾Ñ€Ñ–Ğ½Ğ½ÑĞ¼ Ğ²Ğ¸Ñ€Ğ²Ğ°Ñ‚Ğ¸ | Ğ¿Ğ¾Ğ²Ğ½Ñ–ÑÑ‚Ñ Ğ·Ğ½Ğ¸Ñ‰Ğ¸Ñ‚Ğ¸ | root out |\n| Ğ·Ğ°Ğ±Ğ»ÑƒĞºĞ°Ñ‚Ğ¸ Ğ² Ñ‚Ñ€ÑŒĞ¾Ñ… ÑĞ¾ÑĞ½Ğ°Ñ… | Ğ·Ğ°Ğ¿Ğ»ÑƒÑ‚Ğ°Ñ‚Ğ¸ÑÑ Ğ² Ğ¿Ñ€Ğ¾ÑÑ‚Ğ¾Ğ¼Ñƒ | â€” |\n\n**Ğ•Ñ‚Ğ¸Ğ¼Ğ¾Ğ»Ğ¾Ğ³Ñ–Ñ:**\n- **Â«ĞŸÑƒÑÑ‚Ğ¸Ñ‚Ğ¸ ĞºĞ¾Ñ€Ñ–Ğ½Ğ½ÑÂ»** â€” Ğ¾Ğ±Ñ€Ğ°Ğ· Ñ–Ğ· ÑÑ–Ğ»ÑŒÑÑŒĞºĞ¾Ğ³Ğ¾ Ğ³Ğ¾ÑĞ¿Ğ¾Ğ´Ğ°Ñ€ÑÑ‚Ğ²Ğ°. ĞšĞ¾Ğ»Ğ¸ Ñ€Ğ¾ÑĞ»Ğ¸Ğ½Ğ° Ğ¿ÑƒÑĞºĞ°Ñ” Ğ³Ğ»Ğ¸Ğ±Ğ¾ĞºĞµ ĞºĞ¾Ñ€Ñ–Ğ½Ğ½Ñ, Ñ—Ñ— Ğ²Ğ°Ğ¶ĞºĞ¾ Ğ¿ĞµÑ€ĞµÑĞ°Ğ´Ğ¸Ñ‚Ğ¸. Ğ¢Ğ°Ğº ÑĞ°Ğ¼Ğ¾ Ğ»ÑĞ´Ğ¸Ğ½Ğ°, Ñ‰Ğ¾ Â«Ğ¿ÑƒÑÑ‚Ğ¸Ğ»Ğ° ĞºĞ¾Ñ€Ñ–Ğ½Ğ½ÑÂ», Ğ¼Ñ–Ñ†Ğ½Ğ¾ Ğ¿Ñ€Ğ¸Ğ²'ÑĞ·Ğ°Ğ½Ğ° Ğ´Ğ¾ Ğ¼Ñ–ÑÑ†Ñ.\n- **Â«Ğ—Ğ°Ğ±Ğ»ÑƒĞºĞ°Ñ‚Ğ¸ Ğ² Ñ‚Ñ€ÑŒĞ¾Ñ… ÑĞ¾ÑĞ½Ğ°Ñ…Â»** â€” ÑƒĞ½Ñ–ĞºĞ°Ğ»ÑŒĞ½Ğ¸Ğ¹ ÑƒĞºÑ€Ğ°Ñ—Ğ½ÑÑŒĞºĞ¸Ğ¹ Ğ²Ğ¸Ñ€Ğ°Ğ·. Ğ¢Ñ€Ğ¸ Ğ´ĞµÑ€ĞµĞ²Ğ° â€” Ñ†Ğµ Ğ·Ğ°Ğ½Ğ°Ğ´Ñ‚Ğ¾ Ğ¼Ğ°Ğ»Ğ¾ Ğ´Ğ»Ñ ÑĞ¿Ñ€Ğ°Ğ²Ğ¶Ğ½ÑŒĞ¾Ğ³Ğ¾ Ğ»Ñ–ÑÑƒ, Ñ‚Ğ¾Ğ¼Ñƒ Ğ·Ğ°Ğ±Ğ»ÑƒĞºĞ°Ñ‚Ğ¸ Ñ‚Ğ°Ğ¼ Ğ¼Ğ¾Ğ¶Ğµ Ğ»Ğ¸ÑˆĞµ Ğ°Ğ±ÑĞ¾Ğ»ÑÑ‚Ğ½Ğ¸Ğ¹ Ğ´ÑƒÑ€ĞµĞ½ÑŒ.\n\n**ĞŸÑ€Ğ¸ĞºĞ»Ğ°Ğ´Ğ¸:**\n1. Â«Ğ•Ğ¼Ñ–Ğ³Ñ€Ğ°Ğ½Ñ‚Ğ¸ Ğ· Ğ£ĞºÑ€Ğ°Ñ—Ğ½Ğ¸ Ğ¿ÑƒÑÑ‚Ğ¸Ğ»Ğ¸ ĞºĞ¾Ñ€Ñ–Ğ½Ğ½Ñ Ğ² ĞšĞ°Ğ½Ğ°Ğ´Ñ– Ñ‰Ğµ ÑÑ‚Ğ¾ Ñ€Ğ¾ĞºÑ–Ğ² Ñ‚Ğ¾Ğ¼Ñƒ.Â»\n2. Â«ĞšĞ°Ğ²'ÑÑ€Ğ½Ñ– Ñ€Ğ¾ÑÑ‚ÑƒÑ‚ÑŒ ÑĞº Ğ³Ñ€Ğ¸Ğ±Ğ¸ Ğ¿Ñ–ÑĞ»Ñ Ğ´Ğ¾Ñ‰Ñƒ â€” Ğ½Ğ° ĞºĞ¾Ğ¶Ğ½Ğ¾Ğ¼Ñƒ Ñ€Ğ¾Ğ·Ñ– Ğ½Ğ¾Ğ²Ğ°!Â»\n3. Â«Ğ¯Ğº Ñ‚Ğ¸ Ğ¼Ğ¾Ğ¶ĞµÑˆ Ğ·Ğ°Ğ±Ğ»ÑƒĞºĞ°Ñ‚Ğ¸ Ğ² Ñ†ÑŒĞ¾Ğ¼Ñƒ Ğ·Ğ°Ğ²Ğ´Ğ°Ğ½Ğ½Ñ–? Ğ¢ÑƒÑ‚ ÑƒÑĞµ Ğ¿Ñ€Ğ¾ÑÑ‚Ğ¾ â€” Ğ½Ğµ Ğ±Ğ»ÑƒĞºĞ°Ğ¹ Ñƒ Ñ‚Ñ€ÑŒĞ¾Ñ… ÑĞ¾ÑĞ½Ğ°Ñ…!Â»\n\n#### Ğ’Ñ€Ğ¾Ğ¶Ğ°Ğ¹ Ñ‚Ğ° ĞºĞ°Ñ€Ğ¼Ğ°\n\n| Ğ†Ğ´Ñ–Ğ¾Ğ¼Ğ° | Ğ—Ğ½Ğ°Ñ‡ĞµĞ½Ğ½Ñ | ĞĞ½Ğ³Ğ»Ñ–Ğ¹ÑÑŒĞºĞ¸Ğ¹ Ğ²Ñ–Ğ´Ğ¿Ğ¾Ğ²Ñ–Ğ´Ğ½Ğ¸Ğº |\n|--------|----------|---------|\n| Ñ‰Ğ¾ Ğ¿Ğ¾ÑÑ–Ñ”Ñˆ, Ñ‚Ğµ Ğ¹ Ğ¿Ğ¾Ğ¶Ğ½ĞµÑˆ | ĞºĞ°Ñ€Ğ¼Ğ°, Ğ½Ğ°ÑĞ»Ñ–Ğ´ĞºĞ¸ Ğ´Ñ–Ğ¹ | as you sow, so shall you reap |\n| Ğ·Ğ±Ğ¸Ñ€Ğ°Ñ‚Ğ¸ Ğ¿Ğ»Ğ¾Ğ´Ğ¸ | Ğ¾Ñ‚Ñ€Ğ¸Ğ¼ÑƒĞ²Ğ°Ñ‚Ğ¸ Ñ€ĞµĞ·ÑƒĞ»ÑŒÑ‚Ğ°Ñ‚ Ğ¿Ñ€Ğ°Ñ†Ñ– | reap the fruits |\n| Ñ‡ĞµÑ€ĞµĞ· Ñ‚ĞµÑ€Ğ½Ğ¸ Ğ´Ğ¾ Ğ·Ñ–Ñ€Ğ¾Ğº | Ñ‡ĞµÑ€ĞµĞ· Ñ‚Ñ€ÑƒĞ´Ğ½Ğ¾Ñ‰Ñ– Ğ´Ğ¾ ÑƒÑĞ¿Ñ–Ñ…Ñƒ | per aspera ad astra |\n| ÑĞ±Ğ»ÑƒĞºĞ¾ Ğ²Ñ–Ğ´ ÑĞ±Ğ»ÑƒĞ½Ñ– Ğ½ĞµĞ´Ğ°Ğ»ĞµĞºĞ¾ Ğ¿Ğ°Ğ´Ğ°Ñ” | ÑÑ…Ğ¾Ğ¶Ğ¸Ğ¹ Ğ½Ğ° Ğ±Ğ°Ñ‚ÑŒĞºÑ–Ğ² | the apple doesn't fall far from the tree |\n\n**ĞšÑƒĞ»ÑŒÑ‚ÑƒÑ€Ğ½Ğ¸Ğ¹ ĞºĞ¾Ğ½Ñ‚ĞµĞºÑÑ‚:**\nÂ«Ğ§ĞµÑ€ĞµĞ· Ñ‚ĞµÑ€Ğ½Ğ¸ Ğ´Ğ¾ Ğ·Ñ–Ñ€Ğ¾ĞºÂ» â€” Ğ»Ğ°Ñ‚Ğ¸Ğ½ÑÑŒĞºĞ¸Ğ¹ Ğ²Ğ¸ÑĞ»Ñ–Ğ², ÑĞºĞ¸Ğ¹ ÑÑ‚Ğ°Ğ² Ğ´ĞµĞ²Ñ–Ğ·Ğ¾Ğ¼ Ğ±Ğ°Ğ³Ğ°Ñ‚ÑŒĞ¾Ñ… ĞºĞ¾ÑĞ¼Ñ–Ñ‡Ğ½Ğ¸Ñ… Ğ°Ğ³ĞµĞ½Ñ†Ñ–Ğ¹ (Ñƒ Ñ‚.Ñ‡. NASA). Ğ’ ÑƒĞºÑ€Ğ°Ñ—Ğ½ÑÑŒĞºÑ–Ğ¹ ĞºÑƒĞ»ÑŒÑ‚ÑƒÑ€Ñ– Ğ²Ñ–Ğ½ Ğ½Ğ°Ğ±ÑƒĞ² Ğ³Ğ»Ğ¸Ğ±Ğ¾ĞºĞ¾Ğ³Ğ¾ Ğ·Ğ½Ğ°Ñ‡ĞµĞ½Ğ½Ñ Ğ¿Ñ–Ğ´ Ñ‡Ğ°Ñ Ğ±Ğ¾Ñ€Ğ¾Ñ‚ÑŒĞ±Ğ¸ Ğ·Ğ° Ğ½ĞµĞ·Ğ°Ğ»ĞµĞ¶Ğ½Ñ–ÑÑ‚ÑŒ â€” ÑˆĞ»ÑÑ… Ğ´Ğ¾ ÑĞ²Ğ¾Ğ±Ğ¾Ğ´Ğ¸ Ğ·Ğ°Ğ²Ğ¶Ğ´Ğ¸ Ñ‚ĞµÑ€Ğ½Ğ¸ÑÑ‚Ğ¸Ğ¹.\n\n**ĞŸÑ€Ğ¸ĞºĞ»Ğ°Ğ´Ğ¸:**\n1. Â«Ğ©Ğ¾ Ğ¿Ğ¾ÑÑ–Ñ”Ñˆ, Ñ‚Ğµ Ğ¹ Ğ¿Ğ¾Ğ¶Ğ½ĞµÑˆ â€” Ñ€Ğ¾ĞºĞ°Ğ¼Ğ¸ Ğ±Ñ€ĞµÑ…Ğ°Ğ², Ñ‚ĞµĞ¿ĞµÑ€ Ğ½Ñ–Ñ…Ñ‚Ğ¾ Ğ½Ğµ Ğ²Ñ–Ñ€Ğ¸Ñ‚ÑŒ.Â»\n2. Â«Ğ’Ğ¾Ğ½Ğ° Ğ½Ğ°Ñ€ĞµÑˆÑ‚Ñ– Ğ·Ğ±Ğ¸Ñ€Ğ°Ñ” Ğ¿Ğ»Ğ¾Ğ´Ğ¸ ÑĞ²Ğ¾Ñ”Ñ— Ğ¿Ñ€Ğ°Ñ†Ñ– â€” ĞºĞ¾Ğ¼Ğ¿Ğ°Ğ½Ñ–Ñ Ğ¿Ñ€Ğ¸Ğ½Ğ¾ÑĞ¸Ñ‚ÑŒ Ğ¿Ñ€Ğ¸Ğ±ÑƒÑ‚Ğ¾Ğº.Â»\n3. Â«Ğ¡Ğ¸Ğ½ Ñ‚Ğ°ĞºĞ¸Ğ¹ Ğ¶Ğµ ÑƒĞ¿ĞµÑ€Ñ‚Ğ¸Ğ¹, ÑĞº Ğ±Ğ°Ñ‚ÑŒĞºĞ¾. Ğ¯Ğ±Ğ»ÑƒĞºĞ¾ Ğ²Ñ–Ğ´ ÑĞ±Ğ»ÑƒĞ½Ñ– Ğ½ĞµĞ´Ğ°Ğ»ĞµĞºĞ¾ Ğ¿Ğ°Ğ´Ğ°Ñ”!Â»\n\n---\n\n### ĞŸĞ¾Ğ³Ğ¾Ğ´Ğ° â€” Ğ½Ğ°ÑÑ‚Ñ€Ñ–Ğ¹, Ğ½ĞµÑĞ¿Ğ¾Ğ´Ñ–Ğ²Ğ°Ğ½ĞºĞ¸, Ğ¿Ñ€Ğ¾Ğ±Ğ»ĞµĞ¼Ğ¸\n\n| Ğ†Ğ´Ñ–Ğ¾Ğ¼Ğ° | Ğ—Ğ½Ğ°Ñ‡ĞµĞ½Ğ½Ñ | ĞĞ½Ğ³Ğ»Ñ–Ğ¹ÑÑŒĞºĞ¸Ğ¹ Ğ²Ñ–Ğ´Ğ¿Ğ¾Ğ²Ñ–Ğ´Ğ½Ğ¸Ğº |\n|--------|----------|------------------------|\n| Ğ±ÑƒÑ€Ñ Ğ² ÑĞºĞ»ÑĞ½Ñ†Ñ– Ğ²Ğ¾Ğ´Ğ¸ | Ğ¿ĞµÑ€ĞµĞ±Ñ–Ğ»ÑŒÑˆĞµĞ½Ğ½Ñ Ğ´Ñ€Ñ–Ğ±Ğ½Ğ¸Ñ†Ñ– | storm in a teacup |\n| Ñ‡ĞµĞºĞ°Ñ‚Ğ¸ Ğ±Ñ–Ğ»Ñ Ğ¼Ğ¾Ñ€Ñ Ğ¿Ğ¾Ğ³Ğ¾Ğ´Ğ¸ | Ğ¼Ğ°Ñ€Ğ½Ğ¾ Ñ‡ĞµĞºĞ°Ñ‚Ğ¸, Ğ½Ñ–Ñ‡Ğ¾Ğ³Ğ¾ Ğ½Ğµ Ñ€Ğ¾Ğ±Ğ»ÑÑ‡Ğ¸ | wait and see (ÑĞ»Ğ°Ğ±ÑˆĞµ) |\n| Ğ¿Ñ–ÑĞ»Ñ Ğ´Ğ¾Ñ‰Ñƒ Ğ² Ñ‡ĞµÑ‚Ğ²ĞµÑ€ | Ğ½Ñ–ĞºĞ¾Ğ»Ğ¸ | when pigs fly |\n| ÑĞ¾Ğ½Ñ†Ğµ Ğ²Ğ¸Ğ¹ÑˆĞ»Ğ¾ | Ğ½Ğ°ÑÑ‚Ñ€Ñ–Ğ¹ Ğ¿Ğ¾ĞºÑ€Ğ°Ñ‰Ğ¸Ğ²ÑÑ | the sun came out |\n| Ñ…Ğ¼Ğ°Ñ€Ğ¸ Ğ·Ğ±Ğ¸Ñ€Ğ°ÑÑ‚ÑŒÑÑ | Ğ¿Ñ€Ğ¾Ğ±Ğ»ĞµĞ¼Ğ¸ Ğ½Ğ°Ğ±Ğ»Ğ¸Ğ¶Ğ°ÑÑ‚ÑŒÑÑ | storm clouds gathering |\n\n**ĞŸĞ¾Ñ…Ğ¾Ğ´Ğ¶ĞµĞ½Ğ½Ñ Â«Ğ¿Ñ–ÑĞ»Ñ Ğ´Ğ¾Ñ‰Ñƒ Ğ² Ñ‡ĞµÑ‚Ğ²ĞµÑ€Â»:**\nĞ¦Ğµ Ğ¾Ğ´Ğ¸Ğ½ Ñ–Ğ· Ğ½Ğ°Ğ¹Ğ·Ğ°Ğ³Ğ°Ğ´ĞºĞ¾Ğ²Ñ–ÑˆĞ¸Ñ… Ğ²Ğ¸Ñ€Ğ°Ğ·Ñ–Ğ². Ğ§Ğ¾Ğ¼Ñƒ Ñ‡ĞµÑ‚Ğ²ĞµÑ€? Ğ„ ĞºÑ–Ğ»ÑŒĞºĞ° Ğ²ĞµÑ€ÑÑ–Ğ¹:\n1. Ğ§ĞµÑ‚Ğ²ĞµÑ€ â€” Ğ´ĞµĞ½ÑŒ Ğ±Ğ¾Ğ³Ğ°-Ğ³Ñ€Ğ¾Ğ¼Ğ¾Ğ²ĞµÑ€Ğ¶Ñ†Ñ (ĞŸĞµÑ€ÑƒĞ½Ğ°), Ñ– Ğ´Ğ¾Ñ‰ Ñƒ Ñ†ĞµĞ¹ Ğ´ĞµĞ½ÑŒ Ğ²Ğ²Ğ°Ğ¶Ğ°Ğ²ÑÑ Ğ¾ÑĞ¾Ğ±Ğ»Ğ¸Ğ²Ğ¸Ğ¼.\n2. Ğ¦ĞµÑ€ĞºĞ¾Ğ²Ğ½Ğ¸Ğ¹ Ñ‚Ğ¸Ğ¶Ğ´ĞµĞ½ÑŒ Ğ¿Ğ¾Ñ‡Ğ¸Ğ½Ğ°Ğ²ÑÑ Ğ² Ğ½ĞµĞ´Ñ–Ğ»Ñ, Ñ– Ñ‡ĞµÑ‚Ğ²ĞµÑ€ Ğ±ÑƒĞ² Â«ÑĞµÑ€ĞµĞ´Ğ¸Ğ½Ğ¾ÑÂ» â€” Ğ½Ñ–Ñ‡Ğ¸Ğ¼ Ğ¾ÑĞ¾Ğ±Ğ»Ğ¸Ğ²Ğ¸Ğ¼.\n3. ĞŸÑ€Ğ¾ÑÑ‚Ğ¾ Ğ°Ğ±ÑÑƒÑ€Ğ´Ğ½Ğ° Ğ´Ğ°Ñ‚Ğ° â€” Â«Ğ¿Ñ–ÑĞ»Ñ Ğ´Ğ¾Ñ‰Ñƒ Ğ² Ñ‡ĞµÑ‚Ğ²ĞµÑ€Â» Ğ·Ğ²ÑƒÑ‡Ğ¸Ñ‚ÑŒ Ğ±ĞµĞ·Ğ³Ğ»ÑƒĞ·Ğ´Ğ¾, ÑĞº Ñ– Ğ¾Ğ±Ñ–Ñ†ÑĞ½ĞºĞ°.\n\n**ĞŸÑ€Ğ¸ĞºĞ»Ğ°Ğ´Ğ¸:**\n1. Â«Ğ¢Ğ° Ñ†Ğµ Ğ±ÑƒÑ€Ñ Ğ² ÑĞºĞ»ÑĞ½Ñ†Ñ– Ğ²Ğ¾Ğ´Ğ¸ â€” Ğ²Ñ–Ğ½ Ğ¿Ñ€Ğ¾ÑÑ‚Ğ¾ Ğ½ĞµĞ¿Ñ€Ğ°Ğ²Ğ¸Ğ»ÑŒĞ½Ğ¾ Ğ·Ñ€Ğ¾Ğ·ÑƒĞ¼Ñ–Ğ² SMS!Â»\n2. Â«Ğ—Ğ°Ğ¼Ñ–ÑÑ‚ÑŒ Ñ‡ĞµĞºĞ°Ñ‚Ğ¸ Ğ±Ñ–Ğ»Ñ Ğ¼Ğ¾Ñ€Ñ Ğ¿Ğ¾Ğ³Ğ¾Ğ´Ğ¸, Ğ²Ñ–Ğ·ÑŒĞ¼Ğ¸ Ñ‚ĞµĞ»ĞµÑ„Ğ¾Ğ½ Ñ– Ğ¿Ğ¾Ğ´Ğ·Ğ²Ğ¾Ğ½Ğ¸ Ñ—Ğ¹.Â»\n3. Â«Ğ’Ñ–Ğ½ Ğ¿Ğ¾Ğ²ĞµÑ€Ğ½Ğµ Ğ±Ğ¾Ñ€Ğ³? Ğ¥Ğ°! ĞŸÑ–ÑĞ»Ñ Ğ´Ğ¾Ñ‰Ñƒ Ğ² Ñ‡ĞµÑ‚Ğ²ĞµÑ€!Â»\n\n---\n\n### Ğ†Ğ½ÑˆÑ– Ğ¿Ñ€Ğ¸Ñ€Ğ¾Ğ´Ğ½Ñ– Ñ–Ğ´Ñ–Ğ¾Ğ¼Ğ¸\n\n| Ğ†Ğ´Ñ–Ğ¾Ğ¼Ğ° | Ğ—Ğ½Ğ°Ñ‡ĞµĞ½Ğ½Ñ | ĞĞ½Ğ³Ğ»Ñ–Ğ¹ÑÑŒĞºĞ¸Ğ¹ Ğ²Ñ–Ğ´Ğ¿Ğ¾Ğ²Ñ–Ğ´Ğ½Ğ¸Ğº |\n|--------|----------|---------|\n| Ğ¼Ğ¾Ñ€Ğµ Ğ¿Ğ¾ ĞºĞ¾Ğ»Ñ–Ğ½Ğ° | Ğ½Ñ–Ñ‡Ğ¾Ğ³Ğ¾ Ğ½Ğµ ÑÑ‚Ñ€Ğ°ÑˆĞ½Ğ¾ (Ñ‡Ğ°ÑÑ‚Ğ¾ Ğ¿Ñ€Ğ¾ Ğ¿'ÑĞ½Ğ¸Ñ…) | â€” |\n| ĞºÑ€Ğ°Ğ¿Ğ»Ñ Ğ² Ğ¼Ğ¾Ñ€Ñ– | Ğ´ÑƒĞ¶Ğµ Ğ¼Ğ°Ğ»Ğ¾ Ğ² Ğ¿Ğ¾Ñ€Ñ–Ğ²Ğ½ÑĞ½Ğ½Ñ– | a drop in the ocean |\n| Ğ½Ğ° ĞºÑ€Ğ°Ğ¹ ÑĞ²Ñ–Ñ‚Ñƒ | Ğ´ÑƒĞ¶Ğµ Ğ´Ğ°Ğ»ĞµĞºĞ¾ | to the ends of the earth |\n| Ğ·Ğ¾Ğ»Ğ¾Ñ‚Ñ– Ğ³Ğ¾Ñ€Ğ¸ | Ğ²ĞµĞ»Ğ¸ĞºÑ– Ğ½ĞµÑ€ĞµĞ°Ğ»ÑŒĞ½Ñ– Ğ¾Ğ±Ñ–Ñ†ÑĞ½ĞºĞ¸ | promise the moon |\n| ÑĞº ÑĞ½Ñ–Ğ³ Ğ½Ğ° Ğ³Ğ¾Ğ»Ğ¾Ğ²Ñƒ | Ğ½ĞµÑĞ¿Ğ¾Ğ´Ñ–Ğ²Ğ°Ğ½Ğ¾ | out of the blue |\n\n**ĞšÑƒĞ»ÑŒÑ‚ÑƒÑ€Ğ½Ğ¸Ğ¹ ĞºĞ¾Ğ½Ñ‚ĞµĞºÑÑ‚:**\nÂ«ĞœĞ¾Ñ€Ğµ Ğ¿Ğ¾ ĞºĞ¾Ğ»Ñ–Ğ½Ğ°Â» Ñ‡Ğ°ÑÑ‚Ğ¾ Ğ²Ğ¶Ğ¸Ğ²Ğ°Ñ”Ñ‚ÑŒÑÑ Ğ² ĞºĞ¾Ğ½Ñ‚ĞµĞºÑÑ‚Ñ– Ğ°Ğ»ĞºĞ¾Ğ³Ğ¾Ğ»ÑŒĞ½Ğ¾Ğ³Ğ¾ ÑĞ¿'ÑĞ½Ñ–Ğ½Ğ½Ñ â€” ĞºĞ¾Ğ»Ğ¸ Ğ»ÑĞ´Ğ¸Ğ½Ğ° Ğ²Ñ‚Ñ€Ğ°Ñ‡Ğ°Ñ” Ğ²Ñ–Ğ´Ñ‡ÑƒÑ‚Ñ‚Ñ Ğ½ĞµĞ±ĞµĞ·Ğ¿ĞµĞºĞ¸. ĞĞ»Ğµ Ñ‚Ğ°ĞºĞ¾Ğ¶ Ğ¼Ğ¾Ğ¶Ğµ Ğ¾Ğ¿Ğ¸ÑÑƒĞ²Ğ°Ñ‚Ğ¸ ÑĞ¼Ñ–Ğ»Ğ¸Ğ²Ñƒ Ğ»ÑĞ´Ğ¸Ğ½Ñƒ, ÑĞºĞ° Ğ½Ñ–Ñ‡Ğ¾Ğ³Ğ¾ Ğ½Ğµ Ğ±Ğ¾Ñ—Ñ‚ÑŒÑÑ.\n\n**ĞŸÑ€Ğ¸ĞºĞ»Ğ°Ğ´Ğ¸:**\n1. Â«ĞŸ'ÑĞ½Ğ¾Ğ¼Ñƒ Ğ¼Ğ¾Ñ€Ğµ Ğ¿Ğ¾ ĞºĞ¾Ğ»Ñ–Ğ½Ğ° â€” Ğ¾ÑÑŒ Ñ– Ğ¿Ğ¾Ğ»Ñ–Ğ· Ğ½Ğ° Ğ´Ğ°Ñ….Â»\n2. Â«Ğ¦Ñ Ğ´Ğ¾Ğ¿Ğ¾Ğ¼Ğ¾Ğ³Ğ° â€” ĞºÑ€Ğ°Ğ¿Ğ»Ñ Ğ² Ğ¼Ğ¾Ñ€Ñ–. ĞŸĞ¾Ñ‚Ñ€Ñ–Ğ±Ğ½Ğ¾ Ğ² Ğ´ĞµÑÑÑ‚ÑŒ Ñ€Ğ°Ğ·Ñ–Ğ² Ğ±Ñ–Ğ»ÑŒÑˆĞµ.Â»\n3. Â«Ğ’Ñ–Ğ½ Ğ¿Ñ€Ğ¸Ñ—Ñ…Ğ°Ğ² ÑĞº ÑĞ½Ñ–Ğ³ Ğ½Ğ° Ğ³Ğ¾Ğ»Ğ¾Ğ²Ñƒ â€” Ğ±ĞµĞ· Ğ´Ğ·Ğ²Ñ–Ğ½ĞºĞ°, Ğ±ĞµĞ· Ğ¿Ğ¾Ğ¿ĞµÑ€ĞµĞ´Ğ¶ĞµĞ½Ğ½Ñ!Â»\n\n---\n\n## ĞŸÑ€Ğ°ĞºÑ‚Ğ¸ĞºĞ°\n\n### Ğ”Ğ¾Ğ¿Ğ¾Ğ²Ğ½Ñ–Ñ‚ÑŒ Ñ–Ğ´Ñ–Ğ¾Ğ¼Ñƒ\n\n1. Ğ‘Ğ°Ğ³Ğ°Ñ‚Ğ¾ Ğ²Ğ¾Ğ´Ğ¸ ___.\n   > [!answer] **ÑƒÑ‚ĞµĞºĞ»Ğ¾**\n2. ĞšĞ°Ğ¼Ñ–Ğ½ÑŒ Ğ· ___ Ğ²Ğ¿Ğ°Ğ².\n   > [!answer] **ÑĞµÑ€Ñ†Ñ**\n3. Ğ’Ñ–Ğ½ Ğ²Ğ¸Ğ¹ÑˆĞ¾Ğ² ÑÑƒÑ…Ğ¸Ğ¼ Ğ· ___.\n   > [!answer] **Ğ²Ğ¾Ğ´Ğ¸**\n4. Ğ Ğ¾ÑÑ‚ÑƒÑ‚ÑŒ ÑĞº Ğ³Ñ€Ğ¸Ğ±Ğ¸ Ğ¿Ñ–ÑĞ»Ñ ___.\n   > [!answer] **Ğ´Ğ¾Ñ‰Ñƒ**\n5. Ğ‘ÑƒÑ€Ñ Ğ² ÑĞºĞ»ÑĞ½Ñ†Ñ– ___.\n   > [!answer] **Ğ²Ğ¾Ğ´Ğ¸**\n6. Ğ©Ğ¾ Ğ¿Ğ¾ÑÑ–Ñ”Ñˆ, Ñ‚Ğµ Ğ¹ ___.\n   > [!answer] **Ğ¿Ğ¾Ğ¶Ğ½ĞµÑˆ**\n7. Ğ—Ğ°Ğ±Ğ»ÑƒĞºĞ°Ğ² Ñƒ Ñ‚Ñ€ÑŒĞ¾Ñ… ___.\n   > [!answer] **ÑĞ¾ÑĞ½Ğ°Ñ…**\n### Ğ’Ğ¸Ğ±ĞµÑ€Ñ–Ñ‚ÑŒ Ğ¿Ñ€Ğ°Ğ²Ğ¸Ğ»ÑŒĞ½Ñƒ Ñ–Ğ´Ñ–Ğ¾Ğ¼Ñƒ\n\n1. ĞœĞ¸Ğ½ÑƒĞ»Ğ¾ Ğ±Ğ°Ğ³Ğ°Ñ‚Ğ¾ Ñ‡Ğ°ÑÑƒ.\n   > [!answer] **Ğ±Ğ°Ğ³Ğ°Ñ‚Ğ¾ Ğ²Ğ¾Ğ´Ğ¸ ÑƒÑ‚ĞµĞºĞ»Ğ¾**\n2. Ğ’Ñ–Ğ½ ÑƒĞ½Ğ¸ĞºĞ½ÑƒĞ² Ğ¿Ğ¾ĞºĞ°Ñ€Ğ°Ğ½Ğ½Ñ.\n   > [!answer] **Ğ²Ğ¸Ğ¹ÑˆĞ¾Ğ² ÑÑƒÑ…Ğ¸Ğ¼ Ğ· Ğ²Ğ¾Ğ´Ğ¸**\n3. Ğ¦Ğµ Ğ´Ñ€Ñ–Ğ±Ğ½Ğ¸Ñ†Ñ, ÑĞºÑƒ Ğ¿ĞµÑ€ĞµĞ±Ñ–Ğ»ÑŒÑˆÑƒÑÑ‚ÑŒ.\n   > [!answer] **Ğ±ÑƒÑ€Ñ Ğ² ÑĞºĞ»ÑĞ½Ñ†Ñ– Ğ²Ğ¾Ğ´Ğ¸**\n4. Ğ¢Ñ€ĞµĞ±Ğ° Ğ´Ñ–ÑÑ‚Ğ¸, Ğ° Ğ½Ğµ Ñ‡ĞµĞºĞ°Ñ‚Ğ¸.\n   > [!answer] **Ğ¿Ñ–Ğ´ Ğ»ĞµĞ¶Ğ°Ñ‡Ğ¸Ğ¹ ĞºĞ°Ğ¼Ñ–Ğ½ÑŒ Ğ²Ğ¾Ğ´Ğ° Ğ½Ğµ Ñ‚ĞµÑ‡Ğµ**\n5. Ğ’Ñ–Ğ½ Ğ½Ñ–Ñ‡Ğ¾Ğ³Ğ¾ Ğ½Ğµ Ğ±Ğ¾Ñ—Ñ‚ÑŒÑÑ.\n   > [!answer] **Ğ¼Ğ¾Ñ€Ğµ Ğ¿Ğ¾ ĞºĞ¾Ğ»Ñ–Ğ½Ğ°**\n6. Ğ¦Ğµ Ğ´ÑƒĞ¶Ğµ Ğ¼Ğ°Ğ»Ğ¾ Ğ² Ğ¿Ğ¾Ñ€Ñ–Ğ²Ğ½ÑĞ½Ğ½Ñ– Ğ· Ğ¿Ğ¾Ñ‚Ñ€ĞµĞ±Ğ¾Ñ.\n   > [!answer] **ĞºÑ€Ğ°Ğ¿Ğ»Ñ Ğ² Ğ¼Ğ¾Ñ€Ñ–**\n### ĞŸĞµÑ€ĞµĞºĞ»Ğ°Ğ´Ñ–Ñ‚ÑŒ\n\n1. Still waters run deep.\n   > [!answer] **Ğ¢Ğ¸Ñ…Ğ° Ğ²Ğ¾Ğ´Ğ° Ğ³Ñ€ĞµĞ±Ğ»Ñ Ñ€Ğ²Ğµ.**\n2. As you sow, so shall you reap.\n   > [!answer] **Ğ©Ğ¾ Ğ¿Ğ¾ÑÑ–Ñ”Ñˆ, Ñ‚Ğµ Ğ¹ Ğ¿Ğ¾Ğ¶Ğ½ĞµÑˆ.**\n3. It's a drop in the ocean.\n   > [!answer] **Ğ¦Ğµ ĞºÑ€Ğ°Ğ¿Ğ»Ñ Ğ² Ğ¼Ğ¾Ñ€Ñ–.**\n4. He cast the first stone.\n   > [!answer] **Ğ’Ñ–Ğ½ ĞºĞ¸Ğ½ÑƒĞ² Ğ¿ĞµÑ€ÑˆĞ¸Ğ¹ ĞºĞ°Ğ¼Ñ–Ğ½ÑŒ.**\n5. They put down roots in a new city.\n   > [!answer] **Ğ’Ğ¾Ğ½Ğ¸ Ğ¿ÑƒÑÑ‚Ğ¸Ğ»Ğ¸ ĞºĞ¾Ñ€Ñ–Ğ½Ğ½Ñ Ğ² Ğ½Ğ¾Ğ²Ğ¾Ğ¼Ñƒ Ğ¼Ñ–ÑÑ‚Ñ–.**\n---\n\n## ĞŸÑ€Ğ¾Ğ´ÑƒĞºÑ†Ñ–Ñ\n\n### ĞĞ¿Ğ¸ÑˆÑ–Ñ‚ÑŒ ÑĞ¸Ñ‚ÑƒĞ°Ñ†Ñ–Ñ—\n\nĞ’Ğ¸ĞºĞ¾Ñ€Ğ¸ÑÑ‚Ğ°Ğ¹Ñ‚Ğµ Ğ¿Ñ€Ğ¸Ñ€Ğ¾Ğ´Ğ½Ñ– Ñ–Ğ´Ñ–Ğ¾Ğ¼Ğ¸, Ñ‰Ğ¾Ğ± Ğ¾Ğ¿Ğ¸ÑĞ°Ñ‚Ğ¸:\n1. Ğ›ÑĞ´Ğ¸Ğ½Ñƒ, ÑĞºĞ° ÑƒĞ½Ğ¸ĞºĞ°Ñ” Ğ²Ñ–Ğ´Ğ¿Ğ¾Ğ²Ñ–Ğ´Ğ°Ğ»ÑŒĞ½Ğ¾ÑÑ‚Ñ–\n   > [!answer] *Ğ²Ğ¸Ñ…Ğ¾Ğ´Ğ¸Ñ‚ÑŒ ÑÑƒÑ…Ğ¸Ğ¼ Ğ· Ğ²Ğ¾Ğ´Ğ¸*\n2. Ğ¡Ğ¸Ñ‚ÑƒĞ°Ñ†Ñ–Ñ, ĞºĞ¾Ğ»Ğ¸ Ñ‚Ñ€ĞµĞ±Ğ° Ğ´Ñ–ÑÑ‚Ğ¸\n   > [!answer] *Ğ¿Ñ–Ğ´ Ğ»ĞµĞ¶Ğ°Ñ‡Ğ¸Ğ¹ ĞºĞ°Ğ¼Ñ–Ğ½ÑŒ Ğ²Ğ¾Ğ´Ğ° Ğ½Ğµ Ñ‚ĞµÑ‡Ğµ*\n3. Ğ©Ğ¾ÑÑŒ, Ñ‰Ğ¾ Ğ²Ğ¸Ğ½Ğ¸ĞºĞ»Ğ¾ Ğ½ĞµÑĞ¿Ğ¾Ğ´Ñ–Ğ²Ğ°Ğ½Ğ¾\n   > [!answer] *ÑĞº ÑĞ½Ñ–Ğ³ Ğ½Ğ° Ğ³Ğ¾Ğ»Ğ¾Ğ²Ñƒ*\n4. ĞšĞ¾Ğ³Ğ¾ÑÑŒ, Ñ…Ñ‚Ğ¾ ÑƒĞºĞ¾Ñ€ĞµĞ½Ğ¸Ğ²ÑÑ Ğ½Ğ° Ğ½Ğ¾Ğ²Ğ¾Ğ¼Ñƒ Ğ¼Ñ–ÑÑ†Ñ–\n   > [!answer] *Ğ¿ÑƒÑÑ‚Ğ¸Ğ² ĞºĞ¾Ñ€Ñ–Ğ½Ğ½Ñ*\n5. Ğ”Ñ€Ñ–Ğ±Ğ½Ñƒ Ğ¿Ñ€Ğ¾Ğ±Ğ»ĞµĞ¼Ñƒ, ÑĞºÑƒ Ğ¿ĞµÑ€ĞµĞ±Ñ–Ğ»ÑŒÑˆÑƒÑÑ‚ÑŒ\n   > [!answer] *Ğ±ÑƒÑ€Ñ Ğ² ÑĞºĞ»ÑĞ½Ñ†Ñ– Ğ²Ğ¾Ğ´Ğ¸*\n\n### Ğ”Ñ–Ğ°Ğ»Ğ¾Ğ³\n\nĞ¡Ñ‚Ğ²Ğ¾Ñ€Ñ–Ñ‚ÑŒ Ğ´Ñ–Ğ°Ğ»Ğ¾Ğ³ (6-8 Ñ€ĞµĞ¿Ğ»Ñ–Ğº) Ğ¼Ñ–Ğ¶ Ğ´Ñ€ÑƒĞ·ÑĞ¼Ğ¸, Ñ‰Ğ¾ Ğ¾Ğ±Ğ³Ğ¾Ğ²Ğ¾Ñ€ÑÑÑ‚ÑŒ ÑĞ¿Ñ–Ğ»ÑŒĞ½Ğ¾Ğ³Ğ¾ Ğ·Ğ½Ğ°Ğ¹Ğ¾Ğ¼Ğ¾Ğ³Ğ¾. Ğ’Ğ¸ĞºĞ¾Ñ€Ğ¸ÑÑ‚Ğ°Ğ¹Ñ‚Ğµ 4-5 Ñ–Ğ´Ñ–Ğ¾Ğ¼ Ğ· Ñ†ÑŒĞ¾Ğ³Ğ¾ ÑƒÑ€Ğ¾ĞºÑƒ.\n\n**ĞŸÑ€Ğ¸ĞºĞ»Ğ°Ğ´ Ğ¿Ğ¾Ñ‡Ğ°Ñ‚ĞºÑƒ:**\nâ€” Ğ§ÑƒĞ² Ğ¿Ñ€Ğ¾ ĞĞ»ĞµĞ³Ğ°? Ğ’Ñ–Ğ½ Ğ¿ĞµÑ€ĞµÑ—Ñ…Ğ°Ğ² Ğ´Ğ¾ ĞŸÑ€Ğ°Ğ³Ğ¸!\nâ€” Ğ¡ĞµÑ€Ğ¹Ğ¾Ğ·Ğ½Ğ¾? Ğ¦Ğµ ÑĞº ÑĞ½Ñ–Ğ³ Ğ½Ğ° Ğ³Ğ¾Ğ»Ğ¾Ğ²Ñƒ...\n\n---\n\n# Ğ’Ğ¿Ñ€Ğ°Ğ²Ğ¸\n\n## quiz: Ğ†Ğ´Ñ–Ğ¾Ğ¼Ğ¸: ĞŸÑ€Ğ¸Ñ€Ğ¾Ğ´Ğ°\n\n> Ğ’Ğ¸Ğ±ĞµÑ€Ñ–Ñ‚ÑŒ Ğ¿Ñ€Ğ°Ğ²Ğ¸Ğ»ÑŒĞ½Ñƒ Ğ²Ñ–Ğ´Ğ¿Ğ¾Ğ²Ñ–Ğ´ÑŒ.\n\n1. Â«Ğ‘Ğ°Ğ³Ğ°Ñ‚Ğ¾ Ğ²Ğ¾Ğ´Ğ¸ ÑƒÑ‚ĞµĞºĞ»Ğ¾Â» Ğ¾Ğ·Ğ½Ğ°Ñ‡Ğ°Ñ”:\n   - [x] Ğ¼Ğ¸Ğ½ÑƒĞ»Ğ¾ Ğ±Ğ°Ğ³Ğ°Ñ‚Ğ¾ Ñ‡Ğ°ÑÑƒ\n   - [ ] Ğ±ÑƒĞ»Ğ° Ğ¿Ğ¾Ğ²Ñ–Ğ½ÑŒ\n   > Much time has passed â€” Ñ‡Ğ°ÑĞ¾Ğ²Ğ° Ğ¼ĞµÑ‚Ğ°Ñ„Ğ¾Ñ€Ğ°.\n\n2. Â«ĞŸÑ–Ğ´ Ğ»ĞµĞ¶Ğ°Ñ‡Ğ¸Ğ¹ ĞºĞ°Ğ¼Ñ–Ğ½ÑŒ Ğ²Ğ¾Ğ´Ğ° Ğ½Ğµ Ñ‚ĞµÑ‡ĞµÂ» Ğ¾Ğ·Ğ½Ğ°Ñ‡Ğ°Ñ”:\n   - [x] Ñ‚Ñ€ĞµĞ±Ğ° Ğ´Ñ–ÑÑ‚Ğ¸ Ğ´Ğ»Ñ Ğ´Ğ¾ÑÑĞ³Ğ½ĞµĞ½Ğ½Ñ Ñ€ĞµĞ·ÑƒĞ»ÑŒÑ‚Ğ°Ñ‚Ñƒ\n   - [ ] ĞºĞ°Ğ¼Ñ–Ğ½ÑŒ Ğ½Ğµ Ñ€ÑƒÑ…Ğ°Ñ”Ñ‚ÑŒÑÑ Ğ¿Ñ–Ğ´ Ğ²Ğ¾Ğ´Ğ¾Ñ\n   > Nothing ventured, nothing gained.\n\n3. Â«Ğ‘ÑƒÑ€Ñ Ğ² ÑĞºĞ»ÑĞ½Ñ†Ñ– Ğ²Ğ¾Ğ´Ğ¸Â» Ğ¾Ğ·Ğ½Ğ°Ñ‡Ğ°Ñ”:\n   - [x] Ğ¿ĞµÑ€ĞµĞ±Ñ–Ğ»ÑŒÑˆĞµĞ½Ğ½Ñ Ğ½ĞµĞ·Ğ½Ğ°Ñ‡Ğ½Ğ¾Ñ— Ğ¿Ñ€Ğ¾Ğ±Ğ»ĞµĞ¼Ğ¸\n   - [ ] Ğ¿Ğ¾Ğ³Ğ°Ğ½Ğ° Ğ¿Ğ¾Ğ³Ğ¾Ğ´Ğ° Ğ² Ğ±ÑƒĞ´Ğ¸Ğ½ĞºÑƒ\n   > Storm in a teacup â€” Ğ»Ğ°Ñ‚Ğ¸Ğ½ÑÑŒĞºĞ¾Ğ³Ğ¾ Ğ¿Ğ¾Ñ…Ğ¾Ğ´Ğ¶ĞµĞ½Ğ½Ñ!\n\n4. Â«Ğ’Ğ¸Ğ¹Ñ‚Ğ¸ ÑÑƒÑ…Ğ¸Ğ¼ Ğ· Ğ²Ğ¾Ğ´Ğ¸Â» Ğ¾Ğ·Ğ½Ğ°Ñ‡Ğ°Ñ”:\n   - [x] ÑƒĞ½Ğ¸ĞºĞ½ÑƒÑ‚Ğ¸ Ğ¿Ğ¾ĞºĞ°Ñ€Ğ°Ğ½Ğ½Ñ\n   - [ ] Ğ½Ğµ Ğ¿Ñ€Ğ¾Ğ¼Ğ¾ĞºĞ½ÑƒÑ‚Ğ¸\n   > Get off scot-free.\n\n5. Â«ĞšÑ€Ğ°Ğ¿Ğ»Ñ Ğ² Ğ¼Ğ¾Ñ€Ñ–Â» Ğ¾Ğ·Ğ½Ğ°Ñ‡Ğ°Ñ”:\n   - [x] Ğ´ÑƒĞ¶Ğµ Ğ¼Ğ°Ğ»Ğ¾ Ğ² Ğ¿Ğ¾Ñ€Ñ–Ğ²Ğ½ÑĞ½Ğ½Ñ–\n   - [ ] Ğ´ÑƒĞ¶Ğµ Ğ±Ğ°Ğ³Ğ°Ñ‚Ğ¾\n   > A drop in the ocean.\n\n6. **[Ğ†Ğ½Ñ‚ĞµĞ³Ñ€Ğ°Ñ†Ñ–Ñ: Ğ¿Ğ°ÑĞ¸Ğ²]** Â«Ğ—Ğ»Ğ¾Ñ‡Ğ¸Ğ½Ñ†Ñ ___ Ğ½Ğ° Ñ‡Ğ¸ÑÑ‚Ñƒ Ğ²Ğ¾Ğ´Ñƒ.Â»\n   - [x] Ğ²Ğ¸Ğ²ĞµĞ´ĞµĞ½Ğ¾\n   - [ ] Ğ²Ğ¸Ğ²ĞµĞ»Ğ¸\n   - [ ] Ğ²Ğ¸Ğ²Ğ¾Ğ´Ğ¸Ñ‚ÑŒÑÑ\n   > ĞÑ„Ñ–Ñ†Ñ–Ğ¹Ğ½Ğ¸Ğ¹ ÑÑ‚Ğ¸Ğ»ÑŒ â†’ -Ğ½Ğ¾/-Ñ‚Ğ¾ Ñ„Ğ¾Ñ€Ğ¼Ğ°.\n\n7. **[Ğ†Ğ½Ñ‚ĞµĞ³Ñ€Ğ°Ñ†Ñ–Ñ: Ñ€ĞµĞ³Ñ–ÑÑ‚Ñ€]** Ğ Ğ¾Ğ·Ğ¼Ğ¾Ğ²Ğ°: Â«Ğ™Ğ¾Ğ³Ğ¾ Ğ½Ğ°Ñ€ĞµÑˆÑ‚Ñ– ___ Ğ½Ğ° Ñ‡Ğ¸ÑÑ‚Ñƒ Ğ²Ğ¾Ğ´Ñƒ.Â»\n   - [ ] Ğ²Ğ¸Ğ²ĞµĞ´ĞµĞ½Ğ¾\n   - [x] Ğ²Ğ¸Ğ²ĞµĞ»Ğ¸\n   - [ ] Ğ²Ğ¸Ğ²Ğ¾Ğ´ÑÑ‚ÑŒ\n   > Ğ Ğ¾Ğ·Ğ¼Ğ¾Ğ²Ğ½Ğ¸Ğ¹ ÑÑ‚Ğ¸Ğ»ÑŒ â†’ 3-Ñ Ğ¾ÑĞ¾Ğ±Ğ° Ğ¼Ğ½.\n\n8. Â«ĞŸÑ–ÑĞ»Ñ Ğ´Ğ¾Ñ‰Ñƒ Ğ² Ñ‡ĞµÑ‚Ğ²ĞµÑ€Â» Ğ¾Ğ·Ğ½Ğ°Ñ‡Ğ°Ñ”:\n   - [x] Ğ½Ñ–ĞºĞ¾Ğ»Ğ¸\n   - [ ] Ñƒ Ñ‡ĞµÑ‚Ğ²ĞµÑ€\n   > When pigs fly â€” Ğ°Ğ±ÑÑƒÑ€Ğ´Ğ½Ğ° Ğ´Ğ°Ñ‚Ğ° = Ğ½Ñ–ĞºĞ¾Ğ»Ğ¸.\n\n9. Â«Ğ—Ğ°Ğ±Ğ»ÑƒĞºĞ°Ñ‚Ğ¸ Ğ² Ñ‚Ñ€ÑŒĞ¾Ñ… ÑĞ¾ÑĞ½Ğ°Ñ…Â» Ğ¾Ğ·Ğ½Ğ°Ñ‡Ğ°Ñ”:\n   - [x] Ğ·Ğ°Ğ¿Ğ»ÑƒÑ‚Ğ°Ñ‚Ğ¸ÑÑ Ğ² Ğ¿Ñ€Ğ¾ÑÑ‚Ğ¾Ğ¼Ñƒ\n   - [ ] Ğ·Ğ°Ğ³ÑƒĞ±Ğ¸Ñ‚Ğ¸ÑÑ Ğ² Ğ»Ñ–ÑÑ–\n   > Ğ¢Ñ€Ğ¸ Ğ´ĞµÑ€ĞµĞ²Ğ° â€” Ğ·Ğ°Ğ½Ğ°Ğ´Ñ‚Ğ¾ Ğ¼Ğ°Ğ»Ğ¾ Ğ´Ğ»Ñ ÑĞ¿Ñ€Ğ°Ğ²Ğ¶Ğ½ÑŒĞ¾Ğ³Ğ¾ Ğ»Ñ–ÑÑƒ!\n\n10. Â«ĞšĞ°Ğ¼Ñ–Ğ½ÑŒ Ğ·Ğ° Ğ¿Ğ°Ğ·ÑƒÑ…Ğ¾ÑÂ» Ğ¾Ğ·Ğ½Ğ°Ñ‡Ğ°Ñ”:\n    - [x] Ğ¿Ñ€Ğ¸Ñ…Ğ¾Ğ²Ğ°Ğ½Ğ° Ğ²Ğ¾Ñ€Ğ¾Ğ¶Ñ–ÑÑ‚ÑŒ\n    - [ ] ĞºĞ°Ğ¼Ñ–Ğ½ÑŒ Ğ² Ğ¾Ğ´ÑĞ·Ñ–\n    > Ğ¡ĞµĞ»ÑĞ½Ğ¸ ÑĞ¿Ñ€Ğ°Ğ²Ğ´Ñ– Ğ½Ğ¾ÑĞ¸Ğ»Ğ¸ ĞºĞ°Ğ¼ĞµĞ½Ñ– Ğ´Ğ»Ñ ÑĞ°Ğ¼Ğ¾Ğ·Ğ°Ñ…Ğ¸ÑÑ‚Ñƒ.\n\n---\n\n# Ğ¡Ğ»Ğ¾Ğ²Ğ½Ğ¸Ğº\n\n| Ğ†Ğ´Ñ–Ğ¾Ğ¼Ğ° | Ğ’Ğ¸Ğ¼Ğ¾Ğ²Ğ° | Ğ—Ğ½Ğ°Ñ‡ĞµĞ½Ğ½Ñ | ĞŸÑ€Ğ¸Ğ¼Ñ–Ñ‚ĞºĞ¸ |\n|--------|--------|----------|----------|\n| Ğ±Ğ°Ğ³Ğ°Ñ‚Ğ¾ Ğ²Ğ¾Ğ´Ğ¸ ÑƒÑ‚ĞµĞºĞ»Ğ¾ | /bÉ‘ËˆÉ¦É‘tÉ” wÉ”ËˆdÉª utÉ›kËˆlÉ”/ | Ğ¼Ğ¸Ğ½ÑƒĞ»Ğ¾ Ñ‡Ğ°ÑÑƒ | water under the bridge |\n| Ğ²Ğ¸Ğ¹Ñ‚Ğ¸ ÑÑƒÑ…Ğ¸Ğ¼ Ğ· Ğ²Ğ¾Ğ´Ğ¸ | /ËˆwÉªjtÉª suËˆxÉªm z wÉ”ËˆdÉª/ | ÑƒĞ½Ğ¸ĞºĞ½ÑƒÑ‚Ğ¸ Ğ¿Ğ¾ĞºĞ°Ñ€Ğ°Ğ½Ğ½Ñ | scot-free |\n| ĞºĞ°Ğ¼Ñ–Ğ½ÑŒ Ğ½Ğ° ÑĞµÑ€Ñ†Ñ– | /ËˆkÉ‘mÊ²inÊ² nÉ‘ ËˆsÉ›rtÍ¡sÊ²i/ | Ñ‚Ñ€Ğ¸Ğ²Ğ¾Ğ³Ğ°, Ğ¿Ñ€Ğ¾Ğ²Ğ¸Ğ½Ğ° | weight on heart |\n| Ğ¿Ñ–Ğ´ Ğ»ĞµĞ¶Ğ°Ñ‡Ğ¸Ğ¹ ĞºĞ°Ğ¼Ñ–Ğ½ÑŒ | /pÊ²id lÉ›ËˆÊ’É‘tÊƒÉªj ËˆkÉ‘mÊ²inÊ²/ | Ñ‚Ñ€ĞµĞ±Ğ° Ğ´Ñ–ÑÑ‚Ğ¸ | ÑƒĞ½Ñ–ĞºĞ°Ğ»ÑŒĞ½Ğµ |\n| Ğ¿ÑƒÑÑ‚Ğ¸Ñ‚Ğ¸ ĞºĞ¾Ñ€Ñ–Ğ½Ğ½Ñ | /pusËˆtÉªtÉª kÉ”ËˆrÊ²inÊ²ËÉ‘/ | ÑƒĞºĞ¾Ñ€ĞµĞ½Ğ¸Ñ‚Ğ¸ÑÑ | put down roots |\n| Ñ‰Ğ¾ Ğ¿Ğ¾ÑÑ–Ñ”Ñˆ | /ÊƒtÍ¡ÊƒÉ” pÉ”ËˆsÊ²ijÉ›Êƒ/ | ĞºĞ°Ñ€Ğ¼Ğ° | as you sow |\n| Ğ±ÑƒÑ€Ñ Ğ² ÑĞºĞ»ÑĞ½Ñ†Ñ– | /ËˆburÊ²É‘ w ËˆsklÊ²antÍ¡sÊ²i/ | Ğ¿ĞµÑ€ĞµĞ±Ñ–Ğ»ÑŒÑˆĞµĞ½Ğ½Ñ | storm in teacup |\n| ĞºÑ€Ğ°Ğ¿Ğ»Ñ Ğ² Ğ¼Ğ¾Ñ€Ñ– | /ËˆkrÉ‘plÊ²É‘ w ËˆmÉ”rÊ²i/ | Ğ´ÑƒĞ¶Ğµ Ğ¼Ğ°Ğ»Ğ¾ | drop in ocean |\n| Ğ¿Ñ–ÑĞ»Ñ Ğ´Ğ¾Ñ‰Ñƒ Ğ² Ñ‡ĞµÑ‚Ğ²ĞµÑ€ | /ËˆpÊ²islÊ²É‘ dÉ”ÊƒËˆtÍ¡Êƒu w tÍ¡ÊƒÉ›tËˆwÉ›r/ | Ğ½Ñ–ĞºĞ¾Ğ»Ğ¸ | when pigs fly |\n| Ñ‚Ğ¸Ñ…Ğ° Ğ²Ğ¾Ğ´Ğ° | /ËˆtÉªxÉ‘ wÉ”ËˆdÉ‘/ | ÑĞ¿Ğ¾ĞºÑ–Ğ¹Ğ½Ğ¸Ğ¹ Ğ·Ğ¾Ğ²Ğ½Ñ– | still waters |\n\n---\n\n# ĞŸÑ–Ğ´ÑÑƒĞ¼Ğ¾Ğº\n\n## Ğ’Ğ¾Ğ´Ğ°\n\n| Ğ†Ğ´Ñ–Ğ¾Ğ¼Ğ° | Ğ—Ğ½Ğ°Ñ‡ĞµĞ½Ğ½Ñ | Ğ¡Ğ¸Ğ¼Ğ²Ğ¾Ğ»Ñ–ĞºĞ° |\n|--------|----------|-----------|\n| Ğ±Ğ°Ğ³Ğ°Ñ‚Ğ¾ Ğ²Ğ¾Ğ´Ğ¸ ÑƒÑ‚ĞµĞºĞ»Ğ¾ | Ğ¼Ğ¸Ğ½ÑƒĞ»Ğ¾ Ñ‡Ğ°ÑÑƒ | Ñ‡Ğ°Ñ ÑĞº Ğ¿Ğ¾Ñ‚Ñ–Ğº |\n| Ğ²Ğ¸Ğ¹Ñ‚Ğ¸ ÑÑƒÑ…Ğ¸Ğ¼ Ğ· Ğ²Ğ¾Ğ´Ğ¸ | ÑƒĞ½Ğ¸ĞºĞ½ÑƒÑ‚Ğ¸ Ğ¿Ğ¾ĞºĞ°Ñ€Ğ°Ğ½Ğ½Ñ | Ñ‡Ğ¸ÑÑ‚Ğ¾Ñ‚Ğ°/Ğ²Ğ¸Ğ¿Ñ€Ğ¾Ğ±ÑƒĞ²Ğ°Ğ½Ğ½Ñ |\n| Ğ²Ğ¸Ğ²ĞµÑÑ‚Ğ¸ Ğ½Ğ° Ñ‡Ğ¸ÑÑ‚Ñƒ Ğ²Ğ¾Ğ´Ñƒ | Ğ²Ğ¸ĞºÑ€Ğ¸Ñ‚Ğ¸ | Ğ¿Ñ€Ğ¾Ğ·Ğ¾Ñ€Ñ–ÑÑ‚ÑŒ = Ğ¿Ñ€Ğ°Ğ²Ğ´Ğ° |\n| Ñ‚Ğ¸Ñ…Ğ° Ğ²Ğ¾Ğ´Ğ° | ÑĞ¿Ğ¾ĞºÑ–Ğ¹Ğ½Ğ¸Ğ¹, Ğ°Ğ»Ğµ ÑĞ¸Ğ»ÑŒĞ½Ğ¸Ğ¹ | Ğ¿Ñ€Ğ¸Ñ…Ğ¾Ğ²Ğ°Ğ½Ğ° ÑĞ¸Ğ»Ğ° |\n\n## ĞšĞ°Ğ¼Ñ–Ğ½ÑŒ\n\n| Ğ†Ğ´Ñ–Ğ¾Ğ¼Ğ° | Ğ—Ğ½Ğ°Ñ‡ĞµĞ½Ğ½Ñ | Ğ¡Ğ¸Ğ¼Ğ²Ğ¾Ğ»Ñ–ĞºĞ° |\n|--------|----------|-----------|\n| ĞºĞ°Ğ¼Ñ–Ğ½ÑŒ Ğ½Ğ°/Ğ· ÑĞµÑ€Ñ†Ñ | Ñ‚Ñ€Ğ¸Ğ²Ğ¾Ğ³Ğ°/Ğ¿Ğ¾Ğ»ĞµĞ³ÑˆĞµĞ½Ğ½Ñ | Ğ²Ğ°Ğ³Ğ° |\n| Ğ¿Ñ–Ğ´ Ğ»ĞµĞ¶Ğ°Ñ‡Ğ¸Ğ¹ ĞºĞ°Ğ¼Ñ–Ğ½ÑŒ | Ñ‚Ñ€ĞµĞ±Ğ° Ğ´Ñ–ÑÑ‚Ğ¸ | Ğ½ĞµÑ€ÑƒÑ…Ğ¾Ğ¼Ñ–ÑÑ‚ÑŒ = Ğ·Ğ°ÑÑ‚Ñ–Ğ¹ |\n| ĞºĞ°Ğ¼Ñ–Ğ½ÑŒ Ğ·Ğ° Ğ¿Ğ°Ğ·ÑƒÑ…Ğ¾Ñ | Ğ¿Ñ€Ğ¸Ñ…Ğ¾Ğ²Ğ°Ğ½Ğ° Ğ²Ğ¾Ñ€Ğ¾Ğ¶Ñ–ÑÑ‚ÑŒ | Ğ·Ğ±Ñ€Ğ¾Ñ |\n\n## Ğ Ğ¾ÑĞ»Ğ¸Ğ½Ğ¸\n\n| Ğ†Ğ´Ñ–Ğ¾Ğ¼Ğ° | Ğ—Ğ½Ğ°Ñ‡ĞµĞ½Ğ½Ñ | Ğ¡Ğ¸Ğ¼Ğ²Ğ¾Ğ»Ñ–ĞºĞ° |\n|--------|----------|-----------|\n| Ğ¿ÑƒÑÑ‚Ğ¸Ñ‚Ğ¸ ĞºĞ¾Ñ€Ñ–Ğ½Ğ½Ñ | Ğ¾ÑĞµĞ»Ğ¸Ñ‚Ğ¸ÑÑ | ÑÑ‚Ğ°Ğ±Ñ–Ğ»ÑŒĞ½Ñ–ÑÑ‚ÑŒ |\n| Ñ‰Ğ¾ Ğ¿Ğ¾ÑÑ–Ñ”Ñˆ | ĞºĞ°Ñ€Ğ¼Ğ° | Ğ¿Ñ€Ğ¸Ñ‡Ğ¸Ğ½Ğ°-Ğ½Ğ°ÑĞ»Ñ–Ğ´Ğ¾Ğº |\n| ÑĞº Ğ³Ñ€Ğ¸Ğ±Ğ¸ Ğ¿Ñ–ÑĞ»Ñ Ğ´Ğ¾Ñ‰Ñƒ | ÑˆĞ²Ğ¸Ğ´ĞºĞ¾ Ğ·'ÑĞ²Ğ»ÑÑ‚Ğ¸ÑÑ | Ğ·Ñ€Ğ¾ÑÑ‚Ğ°Ğ½Ğ½Ñ |\n\n## ĞŸĞ¾Ğ³Ğ¾Ğ´Ğ°\n\n| Ğ†Ğ´Ñ–Ğ¾Ğ¼Ğ° | Ğ—Ğ½Ğ°Ñ‡ĞµĞ½Ğ½Ñ | Ğ¡Ğ¸Ğ¼Ğ²Ğ¾Ğ»Ñ–ĞºĞ° |\n|--------|----------|-----------|\n| Ğ±ÑƒÑ€Ñ Ğ² ÑĞºĞ»ÑĞ½Ñ†Ñ– | Ğ¿ĞµÑ€ĞµĞ±Ñ–Ğ»ÑŒÑˆĞµĞ½Ğ½Ñ | Ğ¼Ğ°ÑÑˆÑ‚Ğ°Ğ± |\n| Ğ¿Ñ–ÑĞ»Ñ Ğ´Ğ¾Ñ‰Ñƒ Ğ² Ñ‡ĞµÑ‚Ğ²ĞµÑ€ | Ğ½Ñ–ĞºĞ¾Ğ»Ğ¸ | Ğ°Ğ±ÑÑƒÑ€Ğ´ |\n| Ñ…Ğ¼Ğ°Ñ€Ğ¸ Ğ·Ğ±Ğ¸Ñ€Ğ°ÑÑ‚ÑŒÑÑ | Ğ¿Ñ€Ğ¾Ğ±Ğ»ĞµĞ¼Ğ¸ | Ğ¿ĞµÑ€ĞµĞ´Ñ‡ÑƒÑ‚Ñ‚Ñ |\n\n> **Ğ“Ğ¾Ğ»Ğ¾Ğ²Ğ½Ğµ**\n>\n> - **Ğ’Ğ¾Ğ´Ğ°** = Ñ‡Ğ°Ñ, Ğ¿Ñ€Ğ°Ğ²Ğ´Ğ°, Ğ¾Ñ‡Ğ¸Ñ‰ĞµĞ½Ğ½Ñ (Ñ‡Ğ¸ÑÑ‚Ğ° Ğ²Ğ¾Ğ´Ğ° = Ğ¿Ñ€Ğ°Ğ²Ğ´Ğ°, Ğ¼ÑƒÑ‚Ğ½Ğ° = Ğ±Ñ€ĞµÑ…Ğ½Ñ)\n> - **ĞšĞ°Ğ¼Ñ–Ğ½ÑŒ** = ÑÑ‚Ñ–Ğ¹ĞºÑ–ÑÑ‚ÑŒ, Ğ¿ĞµÑ€ĞµÑˆĞºĞ¾Ğ´Ğ°, Ñ…Ğ¾Ğ»Ğ¾Ğ´Ğ½Ñ–ÑÑ‚ÑŒ\n> - **Ğ Ğ¾ÑĞ»Ğ¸Ğ½Ğ¸** = Ğ¶Ğ¸Ñ‚Ñ‚Ñ, Ñ€Ğ¾Ğ´Ğ¸Ğ½Ğ°, ĞºĞ°Ñ€Ğ¼Ğ° (Ñ‰Ğ¾ Ğ¿Ğ¾ÑÑ–Ñ”Ñˆ, Ñ‚Ğµ Ğ¹ Ğ¿Ğ¾Ğ¶Ğ½ĞµÑˆ)\n> - **ĞŸĞ¾Ğ³Ğ¾Ğ´Ğ°** = Ğ½ĞµÑĞ¿Ğ¾Ğ´Ñ–Ğ²Ğ°Ğ½ĞºĞ¸, Ğ½Ğ°ÑÑ‚Ñ€Ñ–Ğ¹, Ğ¿Ñ€Ğ¾Ğ±Ğ»ĞµĞ¼Ğ¸\n> - Ğ‘Ğ°Ğ³Ğ°Ñ‚Ğ¾ Ğ¿Ñ€Ğ¸Ñ€Ğ¾Ğ´Ğ½Ğ¸Ñ… Ñ–Ğ´Ñ–Ğ¾Ğ¼ Ğ¼Ğ°ÑÑ‚ÑŒ Ğ³Ğ»Ğ¸Ğ±Ğ¾ĞºĞµ ÑĞ·Ğ¸Ñ‡Ğ½Ğ¸Ñ†ÑŒĞºĞµ Ñ‚Ğ° Ğ±Ñ–Ğ±Ğ»Ñ–Ğ¹Ğ½Ğµ ĞºĞ¾Ñ€Ñ–Ğ½Ğ½Ñ\n> - Ğ£ĞºÑ€Ğ°Ñ—Ğ½ÑÑŒĞºÑ– Ñ‚Ğ° Ğ°Ğ½Ğ³Ğ»Ñ–Ğ¹ÑÑŒĞºÑ– Ğ¿Ñ€Ğ¸Ñ€Ğ¾Ğ´Ğ½Ñ– Ğ¼ĞµÑ‚Ğ°Ñ„Ğ¾Ñ€Ğ¸ Ñ‡Ğ°ÑÑ‚Ğ¾ Ğ¿Ğ°Ñ€Ğ°Ğ»ĞµĞ»ÑŒĞ½Ñ–, Ğ°Ğ»Ğµ Ğ· Ñ€Ñ–Ğ·Ğ½Ğ¸Ğ¼Ğ¸ Ğ¾Ğ±Ñ€Ğ°Ğ·Ğ°Ğ¼Ğ¸\n"
  },
  "activities": [
    {
      "id": "act-b2-180-quiz",
      "type": "quiz",
      "title": "Ğ†Ğ´Ñ–Ğ¾Ğ¼Ğ¸: ĞŸÑ€Ğ¸Ñ€Ğ¾Ğ´Ğ°",
      "description": "Ğ’Ğ¸Ğ±ĞµÑ€Ñ–Ñ‚ÑŒ Ğ¿Ñ€Ğ°Ğ²Ğ¸Ğ»ÑŒĞ½Ñƒ Ğ²Ñ–Ğ´Ğ¿Ğ¾Ğ²Ñ–Ğ´ÑŒ.",
      "content": {
        "type": "quiz",
        "questions": [
          {
            "question": "Â«Ğ‘Ğ°Ğ³Ğ°Ñ‚Ğ¾ Ğ²Ğ¾Ğ´Ğ¸ ÑƒÑ‚ĞµĞºĞ»Ğ¾Â» Ğ¾Ğ·Ğ½Ğ°Ñ‡Ğ°Ñ”:",
            "options": [
              "Ğ¼Ğ¸Ğ½ÑƒĞ»Ğ¾ Ğ±Ğ°Ğ³Ğ°Ñ‚Ğ¾ Ñ‡Ğ°ÑÑƒ",
              "Ğ±ÑƒĞ»Ğ° Ğ¿Ğ¾Ğ²Ñ–Ğ½ÑŒ"
            ],
            "correctIndex": 0,
            "explanation": "Much time has passed â€” Ñ‡Ğ°ÑĞ¾Ğ²Ğ° Ğ¼ĞµÑ‚Ğ°Ñ„Ğ¾Ñ€Ğ°."
          },
          {
            "question": "Â«ĞŸÑ–Ğ´ Ğ»ĞµĞ¶Ğ°Ñ‡Ğ¸Ğ¹ ĞºĞ°Ğ¼Ñ–Ğ½ÑŒ Ğ²Ğ¾Ğ´Ğ° Ğ½Ğµ Ñ‚ĞµÑ‡ĞµÂ» Ğ¾Ğ·Ğ½Ğ°Ñ‡Ğ°Ñ”:",
            "options": [
              "Ñ‚Ñ€ĞµĞ±Ğ° Ğ´Ñ–ÑÑ‚Ğ¸ Ğ´Ğ»Ñ Ğ´Ğ¾ÑÑĞ³Ğ½ĞµĞ½Ğ½Ñ Ñ€ĞµĞ·ÑƒĞ»ÑŒÑ‚Ğ°Ñ‚Ñƒ",
              "ĞºĞ°Ğ¼Ñ–Ğ½ÑŒ Ğ½Ğµ Ñ€ÑƒÑ…Ğ°Ñ”Ñ‚ÑŒÑÑ Ğ¿Ñ–Ğ´ Ğ²Ğ¾Ğ´Ğ¾Ñ"
            ],
            "correctIndex": 0,
            "explanation": "Nothing ventured, nothing gained."
          },
          {
            "question": "Â«Ğ‘ÑƒÑ€Ñ Ğ² ÑĞºĞ»ÑĞ½Ñ†Ñ– Ğ²Ğ¾Ğ´Ğ¸Â» Ğ¾Ğ·Ğ½Ğ°Ñ‡Ğ°Ñ”:",
            "options": [
              "Ğ¿ĞµÑ€ĞµĞ±Ñ–Ğ»ÑŒÑˆĞµĞ½Ğ½Ñ Ğ½ĞµĞ·Ğ½Ğ°Ñ‡Ğ½Ğ¾Ñ— Ğ¿Ñ€Ğ¾Ğ±Ğ»ĞµĞ¼Ğ¸",
              "Ğ¿Ğ¾Ğ³Ğ°Ğ½Ğ° Ğ¿Ğ¾Ğ³Ğ¾Ğ´Ğ° Ğ² Ğ±ÑƒĞ´Ğ¸Ğ½ĞºÑƒ"
            ],
            "correctIndex": 0,
            "explanation": "Storm in a teacup â€” Ğ»Ğ°Ñ‚Ğ¸Ğ½ÑÑŒĞºĞ¾Ğ³Ğ¾ Ğ¿Ğ¾Ñ…Ğ¾Ğ´Ğ¶ĞµĞ½Ğ½Ñ!"
          },
          {
            "question": "Â«Ğ’Ğ¸Ğ¹Ñ‚Ğ¸ ÑÑƒÑ…Ğ¸Ğ¼ Ğ· Ğ²Ğ¾Ğ´Ğ¸Â» Ğ¾Ğ·Ğ½Ğ°Ñ‡Ğ°Ñ”:",
            "options": [
              "ÑƒĞ½Ğ¸ĞºĞ½ÑƒÑ‚Ğ¸ Ğ¿Ğ¾ĞºĞ°Ñ€Ğ°Ğ½Ğ½Ñ",
              "Ğ½Ğµ Ğ¿Ñ€Ğ¾Ğ¼Ğ¾ĞºĞ½ÑƒÑ‚Ğ¸"
            ],
            "correctIndex": 0,
            "explanation": "Get off scot-free."
          },
          {
            "question": "Â«ĞšÑ€Ğ°Ğ¿Ğ»Ñ Ğ² Ğ¼Ğ¾Ñ€Ñ–Â» Ğ¾Ğ·Ğ½Ğ°Ñ‡Ğ°Ñ”:",
            "options": [
              "Ğ´ÑƒĞ¶Ğµ Ğ¼Ğ°Ğ»Ğ¾ Ğ² Ğ¿Ğ¾Ñ€Ñ–Ğ²Ğ½ÑĞ½Ğ½Ñ–",
              "Ğ´ÑƒĞ¶Ğµ Ğ±Ğ°Ğ³Ğ°Ñ‚Ğ¾"
            ],
            "correctIndex": 0,
            "explanation": "A drop in the ocean."
          },
          {
            "question": "**[Ğ†Ğ½Ñ‚ĞµĞ³Ñ€Ğ°Ñ†Ñ–Ñ: Ğ¿Ğ°ÑĞ¸Ğ²]** Â«Ğ—Ğ»Ğ¾Ñ‡Ğ¸Ğ½Ñ†Ñ ___ Ğ½Ğ° Ñ‡Ğ¸ÑÑ‚Ñƒ Ğ²Ğ¾Ğ´Ñƒ.Â»",
            "options": [
              "Ğ²Ğ¸Ğ²ĞµĞ´ĞµĞ½Ğ¾",
              "Ğ²Ğ¸Ğ²ĞµĞ»Ğ¸",
              "Ğ²Ğ¸Ğ²Ğ¾Ğ´Ğ¸Ñ‚ÑŒÑÑ"
            ],
            "correctIndex": 0,
            "explanation": "ĞÑ„Ñ–Ñ†Ñ–Ğ¹Ğ½Ğ¸Ğ¹ ÑÑ‚Ğ¸Ğ»ÑŒ â†’ -Ğ½Ğ¾/-Ñ‚Ğ¾ Ñ„Ğ¾Ñ€Ğ¼Ğ°."
          },
          {
            "question": "**[Ğ†Ğ½Ñ‚ĞµĞ³Ñ€Ğ°Ñ†Ñ–Ñ: Ñ€ĞµĞ³Ñ–ÑÑ‚Ñ€]** Ğ Ğ¾Ğ·Ğ¼Ğ¾Ğ²Ğ°: Â«Ğ™Ğ¾Ğ³Ğ¾ Ğ½Ğ°Ñ€ĞµÑˆÑ‚Ñ– ___ Ğ½Ğ° Ñ‡Ğ¸ÑÑ‚Ñƒ Ğ²Ğ¾Ğ´Ñƒ.Â»",
            "options": [
              "Ğ²Ğ¸Ğ²ĞµĞ´ĞµĞ½Ğ¾",
              "Ğ²Ğ¸Ğ²ĞµĞ»Ğ¸",
              "Ğ²Ğ¸Ğ²Ğ¾Ğ´ÑÑ‚ÑŒ"
            ],
            "correctIndex": 1,
            "explanation": "Ğ Ğ¾Ğ·Ğ¼Ğ¾Ğ²Ğ½Ğ¸Ğ¹ ÑÑ‚Ğ¸Ğ»ÑŒ â†’ 3-Ñ Ğ¾ÑĞ¾Ğ±Ğ° Ğ¼Ğ½."
          },
          {
            "question": "Â«ĞŸÑ–ÑĞ»Ñ Ğ´Ğ¾Ñ‰Ñƒ Ğ² Ñ‡ĞµÑ‚Ğ²ĞµÑ€Â» Ğ¾Ğ·Ğ½Ğ°Ñ‡Ğ°Ñ”:",
            "options": [
              "Ğ½Ñ–ĞºĞ¾Ğ»Ğ¸",
              "Ñƒ Ñ‡ĞµÑ‚Ğ²ĞµÑ€"
            ],
            "correctIndex": 0,
            "explanation": "When pigs fly â€” Ğ°Ğ±ÑÑƒÑ€Ğ´Ğ½Ğ° Ğ´Ğ°Ñ‚Ğ° = Ğ½Ñ–ĞºĞ¾Ğ»Ğ¸."
          },
          {
            "question": "Â«Ğ—Ğ°Ğ±Ğ»ÑƒĞºĞ°Ñ‚Ğ¸ Ğ² Ñ‚Ñ€ÑŒĞ¾Ñ… ÑĞ¾ÑĞ½Ğ°Ñ…Â» Ğ¾Ğ·Ğ½Ğ°Ñ‡Ğ°Ñ”:",
            "options": [
              "Ğ·Ğ°Ğ¿Ğ»ÑƒÑ‚Ğ°Ñ‚Ğ¸ÑÑ Ğ² Ğ¿Ñ€Ğ¾ÑÑ‚Ğ¾Ğ¼Ñƒ",
              "Ğ·Ğ°Ğ³ÑƒĞ±Ğ¸Ñ‚Ğ¸ÑÑ Ğ² Ğ»Ñ–ÑÑ–"
            ],
            "correctIndex": 0,
            "explanation": "Ğ¢Ñ€Ğ¸ Ğ´ĞµÑ€ĞµĞ²Ğ° â€” Ğ·Ğ°Ğ½Ğ°Ğ´Ñ‚Ğ¾ Ğ¼Ğ°Ğ»Ğ¾ Ğ´Ğ»Ñ ÑĞ¿Ñ€Ğ°Ğ²Ğ¶Ğ½ÑŒĞ¾Ğ³Ğ¾ Ğ»Ñ–ÑÑƒ!"
          },
          {
            "question": "Â«ĞšĞ°Ğ¼Ñ–Ğ½ÑŒ Ğ·Ğ° Ğ¿Ğ°Ğ·ÑƒÑ…Ğ¾ÑÂ» Ğ¾Ğ·Ğ½Ğ°Ñ‡Ğ°Ñ”:",
            "options": [
              "Ğ¿Ñ€Ğ¸Ñ…Ğ¾Ğ²Ğ°Ğ½Ğ° Ğ²Ğ¾Ñ€Ğ¾Ğ¶Ñ–ÑÑ‚ÑŒ",
              "ĞºĞ°Ğ¼Ñ–Ğ½ÑŒ Ğ² Ğ¾Ğ´ÑĞ·Ñ–"
            ],
            "correctIndex": 0,
            "explanation": "Ğ¡ĞµĞ»ÑĞ½Ğ¸ ÑĞ¿Ñ€Ğ°Ğ²Ğ´Ñ– Ğ½Ğ¾ÑĞ¸Ğ»Ğ¸ ĞºĞ°Ğ¼ĞµĞ½Ñ– Ğ´Ğ»Ñ ÑĞ°Ğ¼Ğ¾Ğ·Ğ°Ñ…Ğ¸ÑÑ‚Ñƒ."
          }
        ],
        "shuffleQuestions": true,
        "shuffleOptions": true,
        "showCorrectAnswers": true
      },
      "subject": "language",
      "owner": "curricula-opus",
      "visibility": "public",
      "language": "uk",
      "difficultyLevel": "B2",
      "duration": 5,
      "tags": [],
      "createdAt": "2025-12-01T22:58:37.257Z",
      "modifiedAt": "2025-12-01T22:58:37.257Z"
    }
  ],
  "vocabulary": {
    "moduleId": "mod-uk-B2-180",
    "level": "B2",
    "phase": "B2.2",
    "wordCount": 10,
    "transliterationMode": "none",
    "words": [
      {
        "id": "v-bahato-vody-uteklo-180-0",
        "uk": "Ğ±Ğ°Ğ³Ğ°Ñ‚Ğ¾ Ğ²Ğ¾Ğ´Ğ¸ ÑƒÑ‚ĞµĞºĞ»Ğ¾",
        "en": "Ğ¼Ğ¸Ğ½ÑƒĞ»Ğ¾ Ñ‡Ğ°ÑÑƒ",
        "pos": "water under the bridge",
        "ipa": "/bÉ‘ËˆÉ¦É‘tÉ” wÉ”ËˆdÉª utÉ›kËˆlÉ”/"
      },
      {
        "id": "v-vyyty-sukhym-z-vody-180-1",
        "uk": "Ğ²Ğ¸Ğ¹Ñ‚Ğ¸ ÑÑƒÑ…Ğ¸Ğ¼ Ğ· Ğ²Ğ¾Ğ´Ğ¸",
        "en": "ÑƒĞ½Ğ¸ĞºĞ½ÑƒÑ‚Ğ¸ Ğ¿Ğ¾ĞºĞ°Ñ€Ğ°Ğ½Ğ½Ñ",
        "pos": "scot-free",
        "ipa": "/ËˆwÉªjtÉª suËˆxÉªm z wÉ”ËˆdÉª/"
      },
      {
        "id": "v-kaminÑŒ-na-sertsi-180-2",
        "uk": "ĞºĞ°Ğ¼Ñ–Ğ½ÑŒ Ğ½Ğ° ÑĞµÑ€Ñ†Ñ–",
        "en": "Ñ‚Ñ€Ğ¸Ğ²Ğ¾Ğ³Ğ°, Ğ¿Ñ€Ğ¾Ğ²Ğ¸Ğ½Ğ°",
        "pos": "weight on heart",
        "ipa": "/ËˆkÉ‘mÊ²inÊ² nÉ‘ ËˆsÉ›rtÍ¡sÊ²i/"
      },
      {
        "id": "v-pid-lezhachyy-kaminÑŒ-180-3",
        "uk": "Ğ¿Ñ–Ğ´ Ğ»ĞµĞ¶Ğ°Ñ‡Ğ¸Ğ¹ ĞºĞ°Ğ¼Ñ–Ğ½ÑŒ",
        "en": "Ñ‚Ñ€ĞµĞ±Ğ° Ğ´Ñ–ÑÑ‚Ğ¸",
        "pos": "ÑƒĞ½Ñ–ĞºĞ°Ğ»ÑŒĞ½Ğµ",
        "ipa": "/pÊ²id lÉ›ËˆÊ’É‘tÊƒÉªj ËˆkÉ‘mÊ²inÊ²/"
      },
      {
        "id": "v-pustyty-korinnya-180-4",
        "uk": "Ğ¿ÑƒÑÑ‚Ğ¸Ñ‚Ğ¸ ĞºĞ¾Ñ€Ñ–Ğ½Ğ½Ñ",
        "en": "ÑƒĞºĞ¾Ñ€ĞµĞ½Ğ¸Ñ‚Ğ¸ÑÑ",
        "pos": "put down roots",
        "ipa": "/pusËˆtÉªtÉª kÉ”ËˆrÊ²inÊ²ËÉ‘/"
      },
      {
        "id": "v-shcho-posiyesh-180-5",
        "uk": "Ñ‰Ğ¾ Ğ¿Ğ¾ÑÑ–Ñ”Ñˆ",
        "en": "ĞºĞ°Ñ€Ğ¼Ğ°",
        "pos": "as you sow",
        "ipa": "/ÊƒtÍ¡ÊƒÉ” pÉ”ËˆsÊ²ijÉ›Êƒ/"
      },
      {
        "id": "v-burya-v-sklyantsi-180-6",
        "uk": "Ğ±ÑƒÑ€Ñ Ğ² ÑĞºĞ»ÑĞ½Ñ†Ñ–",
        "en": "Ğ¿ĞµÑ€ĞµĞ±Ñ–Ğ»ÑŒÑˆĞµĞ½Ğ½Ñ",
        "pos": "storm in teacup",
        "ipa": "/ËˆburÊ²É‘ w ËˆsklÊ²antÍ¡sÊ²i/"
      },
      {
        "id": "v-kraplya-v-mori-180-7",
        "uk": "ĞºÑ€Ğ°Ğ¿Ğ»Ñ Ğ² Ğ¼Ğ¾Ñ€Ñ–",
        "en": "Ğ´ÑƒĞ¶Ğµ Ğ¼Ğ°Ğ»Ğ¾",
        "pos": "drop in ocean",
        "ipa": "/ËˆkrÉ‘plÊ²É‘ w ËˆmÉ”rÊ²i/"
      },
      {
        "id": "v-pislya-doshchu-v-chetver-180-8",
        "uk": "Ğ¿Ñ–ÑĞ»Ñ Ğ´Ğ¾Ñ‰Ñƒ Ğ² Ñ‡ĞµÑ‚Ğ²ĞµÑ€",
        "en": "Ğ½Ñ–ĞºĞ¾Ğ»Ğ¸",
        "pos": "when pigs fly",
        "ipa": "/ËˆpÊ²islÊ²É‘ dÉ”ÊƒËˆtÍ¡Êƒu w tÍ¡ÊƒÉ›tËˆwÉ›r/"
      },
      {
        "id": "v-tykha-voda-180-9",
        "uk": "Ñ‚Ğ¸Ñ…Ğ° Ğ²Ğ¾Ğ´Ğ°",
        "en": "ÑĞ¿Ğ¾ĞºÑ–Ğ¹Ğ½Ğ¸Ğ¹ Ğ·Ğ¾Ğ²Ğ½Ñ–",
        "pos": "still waters",
        "ipa": "/ËˆtÉªxÉ‘ wÉ”ËˆdÉ‘/"
      }
    ]
  }
}