{
  "$schema": "../../../schemas/vibe-module.schema.json",
  "lesson": {
    "id": "lesson-uk-B2-105",
    "moduleId": "mod-uk-B2-105",
    "languagePair": "l2-uk-en",
    "subject": "language",
    "owner": "curricula-opus",
    "visibility": "public",
    "language": "uk",
    "targetLevel": "B2",
    "phase": "B2.1",
    "moduleNumber": 105,
    "moduleType": "history",
    "pedagogy": "CBI",
    "immersionLevel": 0.85,
    "title": "УНР і ЗУНР: Мрія про Соборність",
    "titleUk": null,
    "subtitle": null,
    "description": "Зрозуміти етапи Української революції 1917–1921 років",
    "objectives": [
      "Зрозуміти етапи Української революції 1917–1921 років",
      "Вивчити зміст Чотирьох Універсалів",
      "Дізнатися про Акт Злуки та його значення",
      "Проаналізувати причини поразки визвольних змагань"
    ],
    "objectivesUk": null,
    "grammarFocus": [
      "Political Vocabulary",
      "Passive Voice (Revision)"
    ],
    "tags": [
      "history",
      "revolution",
      "independence"
    ],
    "totalDuration": "45 min",
    "transliterationMode": "none",
    "sections": [
      {
        "id": "section-1",
        "name": "УНР і ЗУНР: Мрія про Соборність",
        "nameEn": null,
        "type": "content",
        "content": "## 1917: Весна народів\n\nКоли в березні 1917 року в Петрограді впала Російська імперія, в Києві почалося національне відродження. Українська інтелігенція створила **Центральну Раду** — революційний парламент. Її очолив видатний історик **Михайло Грушевський**.\n\nЦе був час неймовірної ейфорії. На Софійській площі збиралися стотисячні мітинги під синьо-жовтими прапорами. Люди, які століттями були \"малоросами\", раптом відчули себе українцями. Скрізь відкривалися українські школи, гімназії, газети.\n\n> [!tip]\n> **Михайло Грушевський**\n>\n> Автор 10-томної \"Історії України-Руси\", який науково довів, що українці — це окремий народ з тисячолітньою історією, а не \"відгалуження\" росіян. Він став духовним батьком УНР.\n\n## Чотири Універсали: шлях до свободи\n\nЦентральна Рада видавала закони, які називалися **Універсалами** (як за часів козацьких гетьманів).\n1.  **I Універсал** (червень 1917): Проголошення **автономії** України. \"Однині самі будемо творити наше життя\".\n2.  **II Універсал** (липень 1917): Компроміс з Тимчасовим урядом Росії.\n3.  **III Універсал** (листопад 1917): Створення **Української Народної Республіки (УНР)**. Але все ще у федерації з Росією.\n4.  **IV Універсал** (22 січня 1918): Проголошення **повної незалежності** УНР. У відповідь на більшовицьку агресію Україна остаточно розірвала зв'язки з імперією.\n\n> [!quote]\n> \"Однині Українська Народна Республіка стає самостійною, ні від кого незалежною, вільною, суверенною державою українського народу.\"\n> *— З тексту IV Універсалу*\n\n## Крути: бій за майбутнє\n\nАле незалежність треба було захищати. Більшовицька Росія (червоні) почала війну проти УНР. Київ захищали невеличкі загони добровольців.\n29 січня 1918 року на станції **Крути** відбувся бій між 4-тисячною більшовицькою армією Муравйова і загоном із 400 київських студентів та гімназистів.\n\nЦе були діти, які ніколи не тримали зброї. Але вони затримали ворога на 4 дні. Цей час дозволив уряду УНР підписати мирний договір у Бересті й отримати міжнародне визнання. Крути стали символом жертовності української молоді. Їх часто називають \"українськими спартанцями\".\n\nКоли більшовики, захопивши полонених студентів, вели їх на розстріл, хлопці почали співати гімн \"Ще не вмерла Україна\".\n\n> [!narrative]\n> **Останній спів**\n>\n> Це була ніч після бою. 27 студентів і гімназистів потрапили в полон. Їх катували, а потім повели босоніж по снігу на розстріл. Більшовицький командир насміхався з них.\n> І раптом один із полонених, 19-річний Григорій Піпський, уродженець Галичини, почав співати \"Ще не вмерла України...\". Спочатку тихо, тремтячим від холоду голосом. Але за мить його підтримали інші.\n> 27 юних голосів злилися в один потужний хор. Вони співали в обличчя смерті. Це так налякало катів, що вони почали стріляти безладно.\n> Студенти впали, але їхня пісня залишилася в історії назавжди. Тіла героїв пізніше перепоховали на Аскольдовій могилі в Києві. На їхньому похороні голова Центральної Ради Михайло Грушевський плакав і казав: \"Ці діти врятували честь нації\".\n\n> [!interactive]\n> **Який твій вибір?**\n>\n> Уявіть, що зараз 1917 рік. Ви — студент Київського університету. На вулицях революція.\n> *   Ви можете записатися в **Вільне Козацтво** і взяти до рук гвинтівку.\n> *   Ви можете поїхати в **Просвіту** в село, щоб навчати селян читати і розповідати про Україну.\n> *   Ви можете працювати в **Секретаріаті** (уряді), пишучи нові закони.\n> Що б ви обрали? Кожен вибір важливий. Революцію роблять не тільки солдати, а й вчителі та чиновники.\n\n## Гетьманат і Директорія\n\nУ 1918 році до влади прийшов гетьман **Павло Скоропадський**. За підтримки Німеччини він відновив порядок, стабільність і почав українізацію. Відкрилися університети, Академія наук, національна бібліотека. Але його правління було недовгим.\n\nВосени 1918 року проти гетьмана повстала **Директорія** на чолі з Володимиром Винниченком та Симоном Петлюрою. Влада знову змінилася. Україна палала у вогні війни всіх проти всіх: червоні, білі, поляки, махновці, німці...\n\n> [!note]\n> **Симон Петлюра**\n>\n> Головний отаман військ УНР. Його ім'я стало символом боротьби за незалежність. Російська пропаганда демонізувала його (\"петлюрівці\" стало лайливим словом для патріотів), але для українців він — національний герой.\n\n> [!language]\n> **Мова держави**\n>\n> Слово \"Універсал\" походить від латинського *universalis* (загальний). Це слово використовували українські гетьмани у 17 столітті для своїх наказів. Називаючи закони \"Універсалами\", Грушевський підкреслював, що УНР є спадкоємицею Гетьманщини. Це був акт відновлення історичної справедливості.\n\n## Культурний фронт: Гроші, Тризуб і Щедрик\n\nУкраїнська революція була не тільки політичною, а й культурною. Уряд розумів: держава повинна мати свої символи.\nВидатний графік **Георгій Нарбут** створив дизайн українських грошей — гривень, поштових марок та державного герба. Він поєднав стиль бароко з модернізмом. Його \"Абетка\" досі вважається шедевром книжкової графіки.\n\n> [!tip]\n> **Чи знаєте ви?**\n>\n> Назва валюти \"гривня\" походить від слова \"грива\". У часи Київської Русі (11 століття) гривнею називали срібну прикрасу, яку носили на шиї (на \"загривку\"). Пізніше це стало назвою вагової одиниці срібла, а згодом — грошової одиниці. Відродження назви \"гривня\" у 1918 році (і знову у 1996) було символом повернення до витоків.\n\nА композитор **Микола Леонтович** подарував світові \"Щедрик\". У 1919 році за наказом Петлюри Українська республіканська капела вирушила в турне Європою та Америкою. Це була \"культурна дипломатія\": показати світові, що українці — це нація з високою культурою. Саме тоді \"Щедрик\" вперше пролунав у Карнегі-холі в Нью-Йорку, ставши згодом відомим як *Carol of the Bells*.\n\n> [!note]\n> **Міф про \"сільську культуру\"**\n>\n> Російська пропаганда століттями нав'язувала думку, що українська культура — це лише \"шаровари і вареники\". Революція 1917 року спростувала це. Український авангард, театр Леся Курбаса, графіка Нарбута стояли на рівні світових шедеврів.\n\n## Символи держави: Тризуб і Прапор\n\nУ 1918 році Центральна Рада затвердила **Тризуб** як державний герб УНР. Це не був новий символ. Це був герб князя Володимира Великого, який хрестив Русь у 988 році.\nОбрання Тризуба мало глибокий сенс: воно показувало, що УНР — це не \"нова держава\", а продовження Київської Русі. Україна повертала собі свою спадщину, яку намагалася вкрасти Росія.\n\n> [!tip]\n> **Таємниця Тризуба**\n>\n> Вчені досі сперечаються, що означає Тризуб. Це сокіл, який падає на здобич? Це якір? Це слово \"ВОЛЯ\" (зашифроване в лініях)? Найімовірніше, це родинний знак князів Рюриковичів. Але для нас сьогодні — це символ свободи. Коли в СРСР за цей знак людей відправляли в табори, він став святинею для патріотів.\n\nТакож у 1918 році сталася знакова подія в Криму. 29 квітня весь Чорноморський флот у Севастополі підняв українські прапори. Адмірал Саблін оголосив: \"Флот належить Українській Народній Республіці\". Це спростовує міф про те, що \"Крим завжди був російським\". Крим був і є частиною українського державного простору.\n\n## Махновщина: Третя сила\n\nОкрім УНР і більшовиків, була ще одна сила — селянська армія **Нестора Махна**. Його столицею було місто Гуляйполе. Махно був анархістом: він не визнавав ніякої держави — ні української, ні російської. Його гаслом було \"Свобода або смерть\".\nМахновці були геніями тактики. Вони винайшли **тачанку** — кулемет на возі з кіньми, що став прообразом мобільної війни.\n\nТрагедія Махна в тому, що він ситуативно допомагав більшовикам проти білих (Денікіна), вірячи в \"ліву ідею\". Але як тільки більшовики перемогли, вони знищили махновців. Це урок історії: хто йде на компроміс із ворогом, гине.\n\n## Холодний Яр: Фортеця волі\n\nКоли армія УНР відступила, боротьба не припинилася. У лісах Центральної України (Чигиринщина) повстала Холодноярська республіка. Це була \"держава в державі\".\nОтамани Холодного Яру (брати Чучупаки) тримали оборону проти величезної Червоної армії аж до 1922 року. Їхній чорний прапор мав напис: **\"Воля України або смерть\"**.\n\nХолодний Яр став легендою. Радянська влада десятиліттями забороняла навіть згадувати про нього. Роман Юрія Горліс-Горського \"Холодний Яр\", написаний учасником подій, став \"біблією\" для наступних поколінь борців за волю, зокрема для воїнів УПА.\n\n## Зимові походи: Лицарі абсурду\n\nУ 1919–1920 роках регулярна армія УНР опинилася без території. Але вона не склала зброї. Відбулися два легендарні рейди тилами ворога, відомі як **Перший і Другий Зимові походи**.\nВійсько під командуванням Михайла Омеляновича-Павленка пройшло 2500 км по тилах білих і червоних, знищуючи гарнізони і піднімаючи повстання.\n\nЦе був \"лицарський вчинок\" — боротьба, коли надії вже майже не було. Другий Зимовий похід у листопаді 1921 року став останньою сторінкою регулярної війни. 359 полонених козаків під містечком Базар були розстріляні більшовиками, відмовившись перейти на службу до ворога. Всі вони померли зі словами \"Слава Україні!\".\n\n## Акт Злуки: об'єднання земель\n\nТим часом на заході, після розпаду Австро-Угорщини (див. модуль 104), постала **Західноукраїнська Народна Республіка (ЗУНР)**. Її лідери розуміли: вижити можна тільки разом з Великою Україною.\n\n**22 січня 1919 року** на Софійській площі в Києві відбулася історична подія — проголошення **Акту Злуки** (об'єднання) УНР і ЗУНР. Дві частини України, розділені століттями між різними імперіями, злилися в єдину соборну державу.\n\n> [!quote]\n> \"Однині воєдино зливаються століттями одірвані одна від одної частини єдиної України — Західноукраїнська Народна Республіка (Галичина, Буковина, Угорська Русь) і Наддніпрянська Велика Україна.\"\n\nХоча фактично збудувати єдину державу тоді не вдалося (через війну), цей день став символом єдності. Сьогодні 22 січня ми святкуємо День Соборності. У 1990 році мільйони українців взялися за руки, утворивши \"живий ланцюг\" від Києва до Львова.\n\n## Трагедія \"Трикутника смерті\"\n\n1919 рік став найстрашнішим. Армія УНР опинилася в оточенні. З півночі й сходу наступали більшовики (червоні), з півдня — білогвардійці (Денікін), із заходу — поляки. До того ж почалася епідемія тифу.\nВійсько тануло на очах. Це називали \"Трикутником смерті\". Європа мовчала, не надаючи допомоги. Світ не хотів бачити незалежної України, вважаючи її \"внутрішньою справою Росії\".\nАнтанта (Франція, Англія) підтримувала білогвардійців, бо хотіла відновлення \"єдиної і неділимої\" Росії (але без більшовиків). Це була фатальна помилка Заходу. Знищивши УНР, вони відкрили шлях більшовизму в Європу.\n\nТиф косив ряди армії страшніше за кулемети. У деяких частинах хворіло 90% особового складу. Ліків не було. Блокада Антанти не пропускала навіть медикаменти. Це був справжній гуманітарний геноцид.\n\n## Еміграція: Збереження Держави\n\nУ 1921 році більшовики остаточно окупували Україну. Уряд УНР був змушений покинути рідну землю. Але він не здався і не підписав капітуляцію.\nПочалася довга епоха **Державного Центру УНР в екзилі** (у вигнанні). Уряд переїжджав з Варшави до Парижа, потім до Мюнхена.\n\nВони зберегли:\n1.  **Державну печатку**.\n2.  **Прапор**.\n3.  **Клейноди** (символи влади).\n4.  **Архів**.\n\nАле головне — вони зберегли **правову безперервність**. Вони говорили світові: \"Окупація — це тимчасово. Законна влада України існує\".\nЦе тривало 70 років. І ось, 22 серпня 1992 року, останній Президент УНР в екзилі **Микола Плав'юк** приїхав до вільного Києва. На урочистому засіданні Верховної Ради він передав клейноди першому президенту незалежної України Леоніду Кравчуку.\nВін сказав: \"Ваша Екселленціє! Я передаю вам повноваження Державного Центру УНР. Україна 1991 року є законною спадкоємицею Української Народної Республіки\".\nТак замкнулося коло історії.\n\n> [!warning]\n> **Міф про \"один народ\"**\n>\n> Росія любить стверджувати, що \"Ленін створив Україну\". Це цинічна брехня. УНР виникла з волі народу ще до приходу більшовиків до влади в Україні. Більшовики знищили УНР військовою силою, а потім створили \"радянську Україну\" як маріонетку, щоб контролювати ці землі. Незалежність 1991 року — це не \"подарунок\", а відновлення справедливості."
      },
      {
        "id": "section-2",
        "name": "Підсумок",
        "nameEn": null,
        "type": "summary",
        "content": "1.  **Державність:** У 1917–1921 роках українці вперше за століття створили власну державу.\n2.  **Соборність:** Акт Злуки довів, що українці Сходу і Заходу — єдиний народ.\n3.  **Героїзм:** Бій під Крутами став прикладом самопожертви заради волі.\n4.  **Урок:** Втрата державності призвела до Голодомору і репресій. Без своєї держави нація лишається беззахисною.\n\n> [!resources]\n> **Дізнайтеся більше**\n>\n> *   **Фільм «Крути 1918»** — художній фільм про бій студентського куреня.\n> *   **Фільм «Таємний щоденник Симона Петлюри»** — про останні роки отамана в Парижі.\n> *   [Історична правда](https://istpravda.com.ua) — архів документів і статей про революцію.\n> *   **Музей становлення української нації** (Київ) — тут можна побачити воскові фігури Грушевського, Скоропадського, Петлюри."
      },
      {
        "id": "section-3",
        "name": "Словник",
        "nameEn": null,
        "type": "vocabulary",
        "content": "| Слово | Вимова | Значення |\n|---|---|---|\n| **універсал** | universal | закон, указ Центральної Ради |\n| **рада** | rada | council, тут: парламент |\n| **злука** | zluka | unification, об'єднання земель |\n| **держава** | state | state, країна з урядом |\n| **уряд** | government | government, орган виконавчої влади |\n| **незалежність** | independence | самостійність держави |\n| **автономія** | autonomy | самоврядування у складі іншої держави |\n| **більшовики** | bolsheviks | російські комуністи (червоні) |\n| **гетьман** | hetman | керівник держави (Скоропадський) |\n| **директорія** | directory | уряд УНР після гетьмана |\n| **отаман** | otaman | військовий командир |\n| **соборність** | sobornist | єдність усіх українських земель |\n| **тризуб** | tryzub | герб України |\n| **прапор** | flag | стяг, знамено |\n| **гімн** | anthem | головна пісня держави |\n| **республіка** | republic | форма державного правління |\n| **декларація** | declaration | проголошення принципів |\n| **еміграція** | emigration | виїзд за кордон |\n| **тиф** | typhus | інфекційна хвороба |\n| **окупація** | occupation | захоплення території військом |\n| **дипломатія** | diplomacy | міжнародні відносини |\n| **визнання** | recognition | згода інших держав вважати країну незалежною |\n| **парламент** | parliament | законодавчий орган |\n| **конституція** | constitution | основний закон |\n| **більшість** | majority | більша частина людей |\n| **меншість** | minority | менша частина людей |\n| **студент** | student | учень університету |\n| **гімназист** | gymnasium student | учень середньої школи (гімназії) |\n| **жертва** | victim/sacrifice | той, хто постраждав або віддав життя |\n| **пам'ять** | memory | здатність пам'ятати |\n| **надія** | hope | сподівання на краще |\n| **воля** | will/freedom | свобода |\n| **боротьба** | struggle | активна дія проти чогось |\n| **перемога** | victory | успішне завершення війни |\n| **поразка** | defeat | невдача у війні |"
      }
    ],
    "rawMarkdown": "---\nid: 105-unr-zunr\ntitle: \"УНР і ЗУНР: Мрія про Соборність\"\ndescription: \"Українська Революція 1917–1921 років. Створення УНР, Акт Злуки та трагічна боротьба за державність.\"\nslug: \"unr-zunr\"\nfocus: \"history\"\npedagogy: \"CBI\"\nduration: \"45 min\"\ntransliteration: none\nvocabulary_count: 35\ntags:\n  - \"history\"\n  - \"revolution\"\n  - \"independence\"\ngrammar:\n  - \"Political Vocabulary\"\n  - \"Passive Voice (Revision)\"\nobjectives:\n  - \"Зрозуміти етапи Української революції 1917–1921 років\"\n  - \"Вивчити зміст Чотирьох Універсалів\"\n  - \"Дізнатися про Акт Злуки та його значення\"\n  - \"Проаналізувати причини поразки визвольних змагань\"\n---\n\n# УНР і ЗУНР: Мрія про Соборність\n\n## 1917: Весна народів\n\nКоли в березні 1917 року в Петрограді впала Російська імперія, в Києві почалося національне відродження. Українська інтелігенція створила **Центральну Раду** — революційний парламент. Її очолив видатний історик **Михайло Грушевський**.\n\nЦе був час неймовірної ейфорії. На Софійській площі збиралися стотисячні мітинги під синьо-жовтими прапорами. Люди, які століттями були \"малоросами\", раптом відчули себе українцями. Скрізь відкривалися українські школи, гімназії, газети.\n\n> [!tip]\n> **Михайло Грушевський**\n>\n> Автор 10-томної \"Історії України-Руси\", який науково довів, що українці — це окремий народ з тисячолітньою історією, а не \"відгалуження\" росіян. Він став духовним батьком УНР.\n\n## Чотири Універсали: шлях до свободи\n\nЦентральна Рада видавала закони, які називалися **Універсалами** (як за часів козацьких гетьманів).\n1.  **I Універсал** (червень 1917): Проголошення **автономії** України. \"Однині самі будемо творити наше життя\".\n2.  **II Універсал** (липень 1917): Компроміс з Тимчасовим урядом Росії.\n3.  **III Універсал** (листопад 1917): Створення **Української Народної Республіки (УНР)**. Але все ще у федерації з Росією.\n4.  **IV Універсал** (22 січня 1918): Проголошення **повної незалежності** УНР. У відповідь на більшовицьку агресію Україна остаточно розірвала зв'язки з імперією.\n\n> [!quote]\n> \"Однині Українська Народна Республіка стає самостійною, ні від кого незалежною, вільною, суверенною державою українського народу.\"\n> *— З тексту IV Універсалу*\n\n## Крути: бій за майбутнє\n\nАле незалежність треба було захищати. Більшовицька Росія (червоні) почала війну проти УНР. Київ захищали невеличкі загони добровольців.\n29 січня 1918 року на станції **Крути** відбувся бій між 4-тисячною більшовицькою армією Муравйова і загоном із 400 київських студентів та гімназистів.\n\nЦе були діти, які ніколи не тримали зброї. Але вони затримали ворога на 4 дні. Цей час дозволив уряду УНР підписати мирний договір у Бересті й отримати міжнародне визнання. Крути стали символом жертовності української молоді. Їх часто називають \"українськими спартанцями\".\n\nКоли більшовики, захопивши полонених студентів, вели їх на розстріл, хлопці почали співати гімн \"Ще не вмерла Україна\".\n\n> [!narrative]\n> **Останній спів**\n>\n> Це була ніч після бою. 27 студентів і гімназистів потрапили в полон. Їх катували, а потім повели босоніж по снігу на розстріл. Більшовицький командир насміхався з них.\n> І раптом один із полонених, 19-річний Григорій Піпський, уродженець Галичини, почав співати \"Ще не вмерла України...\". Спочатку тихо, тремтячим від холоду голосом. Але за мить його підтримали інші.\n> 27 юних голосів злилися в один потужний хор. Вони співали в обличчя смерті. Це так налякало катів, що вони почали стріляти безладно.\n> Студенти впали, але їхня пісня залишилася в історії назавжди. Тіла героїв пізніше перепоховали на Аскольдовій могилі в Києві. На їхньому похороні голова Центральної Ради Михайло Грушевський плакав і казав: \"Ці діти врятували честь нації\".\n\n> [!interactive]\n> **Який твій вибір?**\n>\n> Уявіть, що зараз 1917 рік. Ви — студент Київського університету. На вулицях революція.\n> *   Ви можете записатися в **Вільне Козацтво** і взяти до рук гвинтівку.\n> *   Ви можете поїхати в **Просвіту** в село, щоб навчати селян читати і розповідати про Україну.\n> *   Ви можете працювати в **Секретаріаті** (уряді), пишучи нові закони.\n> Що б ви обрали? Кожен вибір важливий. Революцію роблять не тільки солдати, а й вчителі та чиновники.\n\n## Гетьманат і Директорія\n\nУ 1918 році до влади прийшов гетьман **Павло Скоропадський**. За підтримки Німеччини він відновив порядок, стабільність і почав українізацію. Відкрилися університети, Академія наук, національна бібліотека. Але його правління було недовгим.\n\nВосени 1918 року проти гетьмана повстала **Директорія** на чолі з Володимиром Винниченком та Симоном Петлюрою. Влада знову змінилася. Україна палала у вогні війни всіх проти всіх: червоні, білі, поляки, махновці, німці...\n\n> [!note]\n> **Симон Петлюра**\n>\n> Головний отаман військ УНР. Його ім'я стало символом боротьби за незалежність. Російська пропаганда демонізувала його (\"петлюрівці\" стало лайливим словом для патріотів), але для українців він — національний герой.\n\n> [!language]\n> **Мова держави**\n>\n> Слово \"Універсал\" походить від латинського *universalis* (загальний). Це слово використовували українські гетьмани у 17 столітті для своїх наказів. Називаючи закони \"Універсалами\", Грушевський підкреслював, що УНР є спадкоємицею Гетьманщини. Це був акт відновлення історичної справедливості.\n\n## Культурний фронт: Гроші, Тризуб і Щедрик\n\nУкраїнська революція була не тільки політичною, а й культурною. Уряд розумів: держава повинна мати свої символи.\nВидатний графік **Георгій Нарбут** створив дизайн українських грошей — гривень, поштових марок та державного герба. Він поєднав стиль бароко з модернізмом. Його \"Абетка\" досі вважається шедевром книжкової графіки.\n\n> [!tip]\n> **Чи знаєте ви?**\n>\n> Назва валюти \"гривня\" походить від слова \"грива\". У часи Київської Русі (11 століття) гривнею називали срібну прикрасу, яку носили на шиї (на \"загривку\"). Пізніше це стало назвою вагової одиниці срібла, а згодом — грошової одиниці. Відродження назви \"гривня\" у 1918 році (і знову у 1996) було символом повернення до витоків.\n\nА композитор **Микола Леонтович** подарував світові \"Щедрик\". У 1919 році за наказом Петлюри Українська республіканська капела вирушила в турне Європою та Америкою. Це була \"культурна дипломатія\": показати світові, що українці — це нація з високою культурою. Саме тоді \"Щедрик\" вперше пролунав у Карнегі-холі в Нью-Йорку, ставши згодом відомим як *Carol of the Bells*.\n\n> [!note]\n> **Міф про \"сільську культуру\"**\n>\n> Російська пропаганда століттями нав'язувала думку, що українська культура — це лише \"шаровари і вареники\". Революція 1917 року спростувала це. Український авангард, театр Леся Курбаса, графіка Нарбута стояли на рівні світових шедеврів.\n\n## Символи держави: Тризуб і Прапор\n\nУ 1918 році Центральна Рада затвердила **Тризуб** як державний герб УНР. Це не був новий символ. Це був герб князя Володимира Великого, який хрестив Русь у 988 році.\nОбрання Тризуба мало глибокий сенс: воно показувало, що УНР — це не \"нова держава\", а продовження Київської Русі. Україна повертала собі свою спадщину, яку намагалася вкрасти Росія.\n\n> [!tip]\n> **Таємниця Тризуба**\n>\n> Вчені досі сперечаються, що означає Тризуб. Це сокіл, який падає на здобич? Це якір? Це слово \"ВОЛЯ\" (зашифроване в лініях)? Найімовірніше, це родинний знак князів Рюриковичів. Але для нас сьогодні — це символ свободи. Коли в СРСР за цей знак людей відправляли в табори, він став святинею для патріотів.\n\nТакож у 1918 році сталася знакова подія в Криму. 29 квітня весь Чорноморський флот у Севастополі підняв українські прапори. Адмірал Саблін оголосив: \"Флот належить Українській Народній Республіці\". Це спростовує міф про те, що \"Крим завжди був російським\". Крим був і є частиною українського державного простору.\n\n## Махновщина: Третя сила\n\nОкрім УНР і більшовиків, була ще одна сила — селянська армія **Нестора Махна**. Його столицею було місто Гуляйполе. Махно був анархістом: він не визнавав ніякої держави — ні української, ні російської. Його гаслом було \"Свобода або смерть\".\nМахновці були геніями тактики. Вони винайшли **тачанку** — кулемет на возі з кіньми, що став прообразом мобільної війни.\n\nТрагедія Махна в тому, що він ситуативно допомагав більшовикам проти білих (Денікіна), вірячи в \"ліву ідею\". Але як тільки більшовики перемогли, вони знищили махновців. Це урок історії: хто йде на компроміс із ворогом, гине.\n\n## Холодний Яр: Фортеця волі\n\nКоли армія УНР відступила, боротьба не припинилася. У лісах Центральної України (Чигиринщина) повстала Холодноярська республіка. Це була \"держава в державі\".\nОтамани Холодного Яру (брати Чучупаки) тримали оборону проти величезної Червоної армії аж до 1922 року. Їхній чорний прапор мав напис: **\"Воля України або смерть\"**.\n\nХолодний Яр став легендою. Радянська влада десятиліттями забороняла навіть згадувати про нього. Роман Юрія Горліс-Горського \"Холодний Яр\", написаний учасником подій, став \"біблією\" для наступних поколінь борців за волю, зокрема для воїнів УПА.\n\n## Зимові походи: Лицарі абсурду\n\nУ 1919–1920 роках регулярна армія УНР опинилася без території. Але вона не склала зброї. Відбулися два легендарні рейди тилами ворога, відомі як **Перший і Другий Зимові походи**.\nВійсько під командуванням Михайла Омеляновича-Павленка пройшло 2500 км по тилах білих і червоних, знищуючи гарнізони і піднімаючи повстання.\n\nЦе був \"лицарський вчинок\" — боротьба, коли надії вже майже не було. Другий Зимовий похід у листопаді 1921 року став останньою сторінкою регулярної війни. 359 полонених козаків під містечком Базар були розстріляні більшовиками, відмовившись перейти на службу до ворога. Всі вони померли зі словами \"Слава Україні!\".\n\n## Акт Злуки: об'єднання земель\n\nТим часом на заході, після розпаду Австро-Угорщини (див. модуль 104), постала **Західноукраїнська Народна Республіка (ЗУНР)**. Її лідери розуміли: вижити можна тільки разом з Великою Україною.\n\n**22 січня 1919 року** на Софійській площі в Києві відбулася історична подія — проголошення **Акту Злуки** (об'єднання) УНР і ЗУНР. Дві частини України, розділені століттями між різними імперіями, злилися в єдину соборну державу.\n\n> [!quote]\n> \"Однині воєдино зливаються століттями одірвані одна від одної частини єдиної України — Західноукраїнська Народна Республіка (Галичина, Буковина, Угорська Русь) і Наддніпрянська Велика Україна.\"\n\nХоча фактично збудувати єдину державу тоді не вдалося (через війну), цей день став символом єдності. Сьогодні 22 січня ми святкуємо День Соборності. У 1990 році мільйони українців взялися за руки, утворивши \"живий ланцюг\" від Києва до Львова.\n\n## Трагедія \"Трикутника смерті\"\n\n1919 рік став найстрашнішим. Армія УНР опинилася в оточенні. З півночі й сходу наступали більшовики (червоні), з півдня — білогвардійці (Денікін), із заходу — поляки. До того ж почалася епідемія тифу.\nВійсько тануло на очах. Це називали \"Трикутником смерті\". Європа мовчала, не надаючи допомоги. Світ не хотів бачити незалежної України, вважаючи її \"внутрішньою справою Росії\".\nАнтанта (Франція, Англія) підтримувала білогвардійців, бо хотіла відновлення \"єдиної і неділимої\" Росії (але без більшовиків). Це була фатальна помилка Заходу. Знищивши УНР, вони відкрили шлях більшовизму в Європу.\n\nТиф косив ряди армії страшніше за кулемети. У деяких частинах хворіло 90% особового складу. Ліків не було. Блокада Антанти не пропускала навіть медикаменти. Це був справжній гуманітарний геноцид.\n\n## Еміграція: Збереження Держави\n\nУ 1921 році більшовики остаточно окупували Україну. Уряд УНР був змушений покинути рідну землю. Але він не здався і не підписав капітуляцію.\nПочалася довга епоха **Державного Центру УНР в екзилі** (у вигнанні). Уряд переїжджав з Варшави до Парижа, потім до Мюнхена.\n\nВони зберегли:\n1.  **Державну печатку**.\n2.  **Прапор**.\n3.  **Клейноди** (символи влади).\n4.  **Архів**.\n\nАле головне — вони зберегли **правову безперервність**. Вони говорили світові: \"Окупація — це тимчасово. Законна влада України існує\".\nЦе тривало 70 років. І ось, 22 серпня 1992 року, останній Президент УНР в екзилі **Микола Плав'юк** приїхав до вільного Києва. На урочистому засіданні Верховної Ради він передав клейноди першому президенту незалежної України Леоніду Кравчуку.\nВін сказав: \"Ваша Екселленціє! Я передаю вам повноваження Державного Центру УНР. Україна 1991 року є законною спадкоємицею Української Народної Республіки\".\nТак замкнулося коло історії.\n\n> [!warning]\n> **Міф про \"один народ\"**\n>\n> Росія любить стверджувати, що \"Ленін створив Україну\". Це цинічна брехня. УНР виникла з волі народу ще до приходу більшовиків до влади в Україні. Більшовики знищили УНР військовою силою, а потім створили \"радянську Україну\" як маріонетку, щоб контролювати ці землі. Незалежність 1991 року — це не \"подарунок\", а відновлення справедливості.\n\n# Підсумок\n\n1.  **Державність:** У 1917–1921 роках українці вперше за століття створили власну державу.\n2.  **Соборність:** Акт Злуки довів, що українці Сходу і Заходу — єдиний народ.\n3.  **Героїзм:** Бій під Крутами став прикладом самопожертви заради волі.\n4.  **Урок:** Втрата державності призвела до Голодомору і репресій. Без своєї держави нація лишається беззахисною.\n\n> [!resources]\n> **Дізнайтеся більше**\n>\n> *   **Фільм «Крути 1918»** — художній фільм про бій студентського куреня.\n> *   **Фільм «Таємний щоденник Симона Петлюри»** — про останні роки отамана в Парижі.\n> *   [Історична правда](https://istpravda.com.ua) — архів документів і статей про революцію.\n> *   **Музей становлення української нації** (Київ) — тут можна побачити воскові фігури Грушевського, Скоропадського, Петлюри.\n\n# Словник\n\n| Слово | Вимова | Значення |\n|---|---|---|\n| **універсал** | universal | закон, указ Центральної Ради |\n| **рада** | rada | council, тут: парламент |\n| **злука** | zluka | unification, об'єднання земель |\n| **держава** | state | state, країна з урядом |\n| **уряд** | government | government, орган виконавчої влади |\n| **незалежність** | independence | самостійність держави |\n| **автономія** | autonomy | самоврядування у складі іншої держави |\n| **більшовики** | bolsheviks | російські комуністи (червоні) |\n| **гетьман** | hetman | керівник держави (Скоропадський) |\n| **директорія** | directory | уряд УНР після гетьмана |\n| **отаман** | otaman | військовий командир |\n| **соборність** | sobornist | єдність усіх українських земель |\n| **тризуб** | tryzub | герб України |\n| **прапор** | flag | стяг, знамено |\n| **гімн** | anthem | головна пісня держави |\n| **республіка** | republic | форма державного правління |\n| **декларація** | declaration | проголошення принципів |\n| **еміграція** | emigration | виїзд за кордон |\n| **тиф** | typhus | інфекційна хвороба |\n| **окупація** | occupation | захоплення території військом |\n| **дипломатія** | diplomacy | міжнародні відносини |\n| **визнання** | recognition | згода інших держав вважати країну незалежною |\n| **парламент** | parliament | законодавчий орган |\n| **конституція** | constitution | основний закон |\n| **більшість** | majority | більша частина людей |\n| **меншість** | minority | менша частина людей |\n| **студент** | student | учень університету |\n| **гімназист** | gymnasium student | учень середньої школи (гімназії) |\n| **жертва** | victim/sacrifice | той, хто постраждав або віддав життя |\n| **пам'ять** | memory | здатність пам'ятати |\n| **надія** | hope | сподівання на краще |\n| **воля** | will/freedom | свобода |\n| **боротьба** | struggle | активна дія проти чогось |\n| **перемога** | victory | успішне завершення війни |\n| **поразка** | defeat | невдача у війні |\n",
    "createdAt": "2025-12-30T21:33:33.104031Z",
    "modifiedAt": "2025-12-30T21:33:33.104031Z",
    "version": 2
  },
  "activities": [],
  "vocabulary": {
    "moduleId": "mod-uk-B2-105",
    "level": "B2",
    "phase": "B2.1",
    "wordCount": 35,
    "newWordCount": 35,
    "reviewWordCount": 0,
    "transliterationMode": "none",
    "words": [
      {
        "id": "vocab-1",
        "uk": "**універсал**",
        "ipa": "universal",
        "en": "закон, указ Центральної Ради",
        "pos": "",
        "gender": null,
        "note": ""
      },
      {
        "id": "vocab-2",
        "uk": "**рада**",
        "ipa": "rada",
        "en": "council, тут: парламент",
        "pos": "",
        "gender": null,
        "note": ""
      },
      {
        "id": "vocab-3",
        "uk": "**злука**",
        "ipa": "zluka",
        "en": "unification, об'єднання земель",
        "pos": "",
        "gender": null,
        "note": ""
      },
      {
        "id": "vocab-4",
        "uk": "**держава**",
        "ipa": "state",
        "en": "state, країна з урядом",
        "pos": "",
        "gender": null,
        "note": ""
      },
      {
        "id": "vocab-5",
        "uk": "**уряд**",
        "ipa": "government",
        "en": "government, орган виконавчої влади",
        "pos": "",
        "gender": null,
        "note": ""
      },
      {
        "id": "vocab-6",
        "uk": "**незалежність**",
        "ipa": "independence",
        "en": "самостійність держави",
        "pos": "",
        "gender": null,
        "note": ""
      },
      {
        "id": "vocab-7",
        "uk": "**автономія**",
        "ipa": "autonomy",
        "en": "самоврядування у складі іншої держави",
        "pos": "",
        "gender": null,
        "note": ""
      },
      {
        "id": "vocab-8",
        "uk": "**більшовики**",
        "ipa": "bolsheviks",
        "en": "російські комуністи (червоні)",
        "pos": "",
        "gender": null,
        "note": ""
      },
      {
        "id": "vocab-9",
        "uk": "**гетьман**",
        "ipa": "hetman",
        "en": "керівник держави (Скоропадський)",
        "pos": "",
        "gender": null,
        "note": ""
      },
      {
        "id": "vocab-10",
        "uk": "**директорія**",
        "ipa": "directory",
        "en": "уряд УНР після гетьмана",
        "pos": "",
        "gender": null,
        "note": ""
      },
      {
        "id": "vocab-11",
        "uk": "**отаман**",
        "ipa": "otaman",
        "en": "військовий командир",
        "pos": "",
        "gender": null,
        "note": ""
      },
      {
        "id": "vocab-12",
        "uk": "**соборність**",
        "ipa": "sobornist",
        "en": "єдність усіх українських земель",
        "pos": "",
        "gender": null,
        "note": ""
      },
      {
        "id": "vocab-13",
        "uk": "**тризуб**",
        "ipa": "tryzub",
        "en": "герб України",
        "pos": "",
        "gender": null,
        "note": ""
      },
      {
        "id": "vocab-14",
        "uk": "**прапор**",
        "ipa": "flag",
        "en": "стяг, знамено",
        "pos": "",
        "gender": null,
        "note": ""
      },
      {
        "id": "vocab-15",
        "uk": "**гімн**",
        "ipa": "anthem",
        "en": "головна пісня держави",
        "pos": "",
        "gender": null,
        "note": ""
      },
      {
        "id": "vocab-16",
        "uk": "**республіка**",
        "ipa": "republic",
        "en": "форма державного правління",
        "pos": "",
        "gender": null,
        "note": ""
      },
      {
        "id": "vocab-17",
        "uk": "**декларація**",
        "ipa": "declaration",
        "en": "проголошення принципів",
        "pos": "",
        "gender": null,
        "note": ""
      },
      {
        "id": "vocab-18",
        "uk": "**еміграція**",
        "ipa": "emigration",
        "en": "виїзд за кордон",
        "pos": "",
        "gender": null,
        "note": ""
      },
      {
        "id": "vocab-19",
        "uk": "**тиф**",
        "ipa": "typhus",
        "en": "інфекційна хвороба",
        "pos": "",
        "gender": null,
        "note": ""
      },
      {
        "id": "vocab-20",
        "uk": "**окупація**",
        "ipa": "occupation",
        "en": "захоплення території військом",
        "pos": "",
        "gender": null,
        "note": ""
      },
      {
        "id": "vocab-21",
        "uk": "**дипломатія**",
        "ipa": "diplomacy",
        "en": "міжнародні відносини",
        "pos": "",
        "gender": null,
        "note": ""
      },
      {
        "id": "vocab-22",
        "uk": "**визнання**",
        "ipa": "recognition",
        "en": "згода інших держав вважати країну незалежною",
        "pos": "",
        "gender": null,
        "note": ""
      },
      {
        "id": "vocab-23",
        "uk": "**парламент**",
        "ipa": "parliament",
        "en": "законодавчий орган",
        "pos": "",
        "gender": null,
        "note": ""
      },
      {
        "id": "vocab-24",
        "uk": "**конституція**",
        "ipa": "constitution",
        "en": "основний закон",
        "pos": "",
        "gender": null,
        "note": ""
      },
      {
        "id": "vocab-25",
        "uk": "**більшість**",
        "ipa": "majority",
        "en": "більша частина людей",
        "pos": "",
        "gender": null,
        "note": ""
      },
      {
        "id": "vocab-26",
        "uk": "**меншість**",
        "ipa": "minority",
        "en": "менша частина людей",
        "pos": "",
        "gender": null,
        "note": ""
      },
      {
        "id": "vocab-27",
        "uk": "**студент**",
        "ipa": "student",
        "en": "учень університету",
        "pos": "",
        "gender": null,
        "note": ""
      },
      {
        "id": "vocab-28",
        "uk": "**гімназист**",
        "ipa": "gymnasium student",
        "en": "учень середньої школи (гімназії)",
        "pos": "",
        "gender": null,
        "note": ""
      },
      {
        "id": "vocab-29",
        "uk": "**жертва**",
        "ipa": "victim/sacrifice",
        "en": "той, хто постраждав або віддав життя",
        "pos": "",
        "gender": null,
        "note": ""
      },
      {
        "id": "vocab-30",
        "uk": "**пам'ять**",
        "ipa": "memory",
        "en": "здатність пам'ятати",
        "pos": "",
        "gender": null,
        "note": ""
      },
      {
        "id": "vocab-31",
        "uk": "**надія**",
        "ipa": "hope",
        "en": "сподівання на краще",
        "pos": "",
        "gender": null,
        "note": ""
      },
      {
        "id": "vocab-32",
        "uk": "**воля**",
        "ipa": "will/freedom",
        "en": "свобода",
        "pos": "",
        "gender": null,
        "note": ""
      },
      {
        "id": "vocab-33",
        "uk": "**боротьба**",
        "ipa": "struggle",
        "en": "активна дія проти чогось",
        "pos": "",
        "gender": null,
        "note": ""
      },
      {
        "id": "vocab-34",
        "uk": "**перемога**",
        "ipa": "victory",
        "en": "успішне завершення війни",
        "pos": "",
        "gender": null,
        "note": ""
      },
      {
        "id": "vocab-35",
        "uk": "**поразка**",
        "ipa": "defeat",
        "en": "невдача у війні",
        "pos": "",
        "gender": null,
        "note": ""
      }
    ],
    "reviewWords": []
  }
}