{
  "$schema": "../../../schemas/vibe-module.schema.json",
  "lesson": {
    "id": "lesson-uk-B1-47",
    "moduleId": "mod-uk-B1-47",
    "languagePair": "l2-uk-en",
    "subject": "language",
    "owner": "curricula-opus",
    "visibility": "public",
    "language": "uk",
    "targetLevel": "B1",
    "phase": "B1.4 Advanced Grammar",
    "moduleNumber": 47,
    "moduleType": "grammar",
    "pedagogy": "TTT",
    "immersionLevel": 0.6,
    "title": "ÐŸÐ°ÑÐ¸Ð²Ð½Ñ– ÐºÐ¾Ð½ÑÑ‚Ñ€ÑƒÐºÑ†Ñ–Ñ—: Ð¿Ð¾Ð²Ð½Ð° ÑÐ¸ÑÑ‚ÐµÐ¼Ð°",
    "titleUk": null,
    "subtitle": "Passive Constructions - Complete System",
    "description": "Ð£Ñ‡ÐµÐ½ÑŒ Ð¼Ð¾Ð¶Ðµ Ñ€Ð¾Ð·Ñ€Ñ–Ð·Ð½ÑÑ‚Ð¸ Ñ‚Ñ€Ð¸ Ñ‚Ð¸Ð¿Ð¸ Ð¿Ð°ÑÐ¸Ð²Ð½Ð¸Ñ… ÐºÐ¾Ð½ÑÑ‚Ñ€ÑƒÐºÑ†Ñ–Ð¹",
    "objectives": [
      "Ð£Ñ‡ÐµÐ½ÑŒ Ð¼Ð¾Ð¶Ðµ Ñ€Ð¾Ð·Ñ€Ñ–Ð·Ð½ÑÑ‚Ð¸ Ñ‚Ñ€Ð¸ Ñ‚Ð¸Ð¿Ð¸ Ð¿Ð°ÑÐ¸Ð²Ð½Ð¸Ñ… ÐºÐ¾Ð½ÑÑ‚Ñ€ÑƒÐºÑ†Ñ–Ð¹",
      "Ð£Ñ‡ÐµÐ½ÑŒ Ð¼Ð¾Ð¶Ðµ Ñ‚Ñ€Ð°Ð½ÑÑ„Ð¾Ñ€Ð¼ÑƒÐ²Ð°Ñ‚Ð¸ Ð°ÐºÑ‚Ð¸Ð²Ð½Ñ– Ñ€ÐµÑ‡ÐµÐ½Ð½Ñ Ð² Ð¿Ð°ÑÐ¸Ð²Ð½Ñ–",
      "Ð£Ñ‡ÐµÐ½ÑŒ Ñ€Ð¾Ð·ÑƒÐ¼Ñ–Ñ” ÑÑ‚Ð¸Ð»Ñ–ÑÑ‚Ð¸Ñ‡Ð½Ñ– Ð²Ñ–Ð´Ñ‚Ñ–Ð½ÐºÐ¸ ÐºÐ¾Ð¶Ð½Ð¾Ð³Ð¾ Ñ‚Ð¸Ð¿Ñƒ Ð¿Ð°ÑÐ¸Ð²Ñƒ"
    ],
    "objectivesUk": null,
    "grammarFocus": [
      "Ð¢Ñ€Ð¸ Ñ‚Ð¸Ð¿Ð¸ Ð¿Ð°ÑÐ¸Ð²Ð½Ð¸Ñ… ÐºÐ¾Ð½ÑÑ‚Ñ€ÑƒÐºÑ†Ñ–Ð¹",
      "ÐŸÐ°ÑÐ¸Ð² Ð· Ð´Ñ–Ñ”Ð¿Ñ€Ð¸ÐºÐ¼ÐµÑ‚Ð½Ð¸ÐºÐ¾Ð¼",
      "ÐŸÐ°ÑÐ¸Ð² Ð· ÐºÐ¾Ñ€Ð¾Ñ‚ÐºÐ¾ÑŽ Ñ„Ð¾Ñ€Ð¼Ð¾ÑŽ",
      "Ð—Ð²Ð¾Ñ€Ð¾Ñ‚Ð½Ð¸Ð¹ Ð¿Ð°ÑÐ¸Ð² (-ÑÑ)"
    ],
    "tags": [
      "grammar",
      "passive",
      "voice",
      "constructions"
    ],
    "totalDuration": 90,
    "transliterationMode": "none",
    "sections": [
      {
        "id": "section-1",
        "name": "ÐŸÐ°ÑÐ¸Ð²Ð½Ñ– ÐºÐ¾Ð½ÑÑ‚Ñ€ÑƒÐºÑ†Ñ–Ñ—: Ð¿Ð¾Ð²Ð½Ð° ÑÐ¸ÑÑ‚ÐµÐ¼Ð°",
        "nameEn": null,
        "type": "content",
        "content": "> ðŸŽ¯ **Ð§Ð¾Ð¼Ñƒ Ñ†Ðµ Ð²Ð°Ð¶Ð»Ð¸Ð²Ð¾?**\n>\n> Ð£ÐºÑ€Ð°Ñ—Ð½ÑÑŒÐºÐ° Ð¼Ð¾Ð²Ð° Ð¼Ð°Ñ” Ñ‚Ñ€Ð¸ ÑÐ¿Ð¾ÑÐ¾Ð±Ð¸ Ð²Ð¸Ñ€Ð°Ð·Ð¸Ñ‚Ð¸ Ð¿Ð°ÑÐ¸Ð²Ð½Ð¸Ð¹ ÑÑ‚Ð°Ð½ â€” Ñ– ÐºÐ¾Ð¶ÐµÐ½ Ð¼Ð°Ñ” ÑÐ²Ð¾Ñ” Ð¼Ñ–ÑÑ†Ðµ. ÐŸÐ¾Ð²Ð½Ð¸Ð¹ Ð¿Ð°ÑÐ¸Ð² Ð· Ð´Ñ–Ñ”Ð¿Ñ€Ð¸ÐºÐ¼ÐµÑ‚Ð½Ð¸ÐºÐ¾Ð¼ Ð·Ð²ÑƒÑ‡Ð¸Ñ‚ÑŒ Ð¾Ñ„Ñ–Ñ†Ñ–Ð¹Ð½Ð¾, ÐºÐ¾Ñ€Ð¾Ñ‚ÐºÐ¸Ð¹ Ð¿Ð°ÑÐ¸Ð² Ð¿Ñ–Ð´ÐºÑ€ÐµÑÐ»ÑŽÑ” Ñ€ÐµÐ·ÑƒÐ»ÑŒÑ‚Ð°Ñ‚, Ð° Ð·Ð²Ð¾Ñ€Ð¾Ñ‚Ð½Ð¸Ð¹ Ð¿Ð°ÑÐ¸Ð² (-ÑÑ) Ñ‚Ð¸Ð¿Ð¾Ð²Ð¸Ð¹ Ð´Ð»Ñ Ñ€Ð¾Ð·Ð¼Ð¾Ð²Ð½Ð¾Ñ— Ð¼Ð¾Ð²Ð¸ Ñ‚Ð° Ð¾Ð¿Ð¸ÑÑƒ Ð¿Ñ€Ð¾Ñ†ÐµÑÑ–Ð². Ð’Ð¾Ð»Ð¾Ð´Ñ–Ð½Ð½Ñ Ð²ÑÑ–Ð¼Ð° Ñ‚Ñ€ÑŒÐ¾Ð¼Ð° Ñ‚Ð¸Ð¿Ð°Ð¼Ð¸ Ñ€Ð¾Ð±Ð¸Ñ‚ÑŒ Ð²Ð°ÑˆÑƒ ÑƒÐºÑ€Ð°Ñ—Ð½ÑÑŒÐºÑƒ Ð³Ð½ÑƒÑ‡ÐºÐ¾ÑŽ Ñ‚Ð° Ð¿Ñ€Ð¸Ñ€Ð¾Ð´Ð½Ð¾ÑŽ.\n\n---\n\n## Ð¢ÐµÑÑ‚\n\nÐŸÑ€Ð¾Ñ‡Ð¸Ñ‚Ð°Ð¹Ñ‚Ðµ Ñ‚Ñ€Ð¸ Ñ€ÐµÑ‡ÐµÐ½Ð½Ñ Ð¿Ñ€Ð¾ Ñ‚Ñƒ ÑÐ°Ð¼Ñƒ Ð¿Ð¾Ð´Ñ–ÑŽ Ñ‚Ð° Ð¿Ð¾Ð´ÑƒÐ¼Ð°Ð¹Ñ‚Ðµ Ð¿Ñ€Ð¾ Ð²Ñ–Ð´Ð¼Ñ–Ð½Ð½Ð¾ÑÑ‚Ñ–:\n\n1. **ÐšÐ½Ð¸Ð³Ð° Ð½Ð°Ð¿Ð¸ÑÐ°Ð½Ð° Ð¿Ð¸ÑÑŒÐ¼ÐµÐ½Ð½Ð¸ÐºÐ¾Ð¼.** (Ð¿Ð¾Ð²Ð½Ð¸Ð¹ Ð¿Ð°ÑÐ¸Ð²)\n2. **ÐšÐ½Ð¸Ð³Ñƒ Ð½Ð°Ð¿Ð¸ÑÐ°Ð½Ð¾.** (ÐºÐ¾Ñ€Ð¾Ñ‚ÐºÐ¸Ð¹ Ð¿Ð°ÑÐ¸Ð²)\n3. **ÐšÐ½Ð¸Ð³Ð° Ð¿Ð¸ÑˆÐµÑ‚ÑŒÑÑ ÑˆÐ²Ð¸Ð´ÐºÐ¾.** (Ð·Ð²Ð¾Ñ€Ð¾Ñ‚Ð½Ð¸Ð¹ Ð¿Ð°ÑÐ¸Ð²)\n\nÐ’ÑÑ– Ñ‚Ñ€Ð¸ Ñ€ÐµÑ‡ÐµÐ½Ð½Ñ Ð¿Ð°ÑÐ¸Ð²Ð½Ñ–, Ð°Ð»Ðµ:\n- **ÐŸÐµÑ€ÑˆÐµ** Ð½Ð°Ð·Ð¸Ð²Ð°Ñ” Ð°Ð²Ñ‚Ð¾Ñ€Ð° Ñ– Ð¿Ñ–Ð´ÐºÑ€ÐµÑÐ»ÑŽÑ” Ð·Ð°Ð²ÐµÑ€ÑˆÐµÐ½Ñƒ Ð´Ñ–ÑŽ.\n- **Ð”Ñ€ÑƒÐ³Ðµ** Ñ„Ð¾ÐºÑƒÑÑƒÑ”Ñ‚ÑŒÑÑ Ð½Ð° Ñ€ÐµÐ·ÑƒÐ»ÑŒÑ‚Ð°Ñ‚Ñ–, Ð½Ðµ Ð½Ð°Ð·Ð¸Ð²Ð°ÑŽÑ‡Ð¸ Ð°Ð²Ñ‚Ð¾Ñ€Ð°.\n- **Ð¢Ñ€ÐµÑ‚Ñ”** Ð¾Ð¿Ð¸ÑÑƒÑ” Ð¿Ñ€Ð¾Ñ†ÐµÑ, ÑÐºÐ¸Ð¹ Ñ‚Ñ€Ð¸Ð²Ð°Ñ”.\n\nÐ©Ðµ Ð¾Ð´Ð½Ð° Ñ‚Ñ€Ñ–Ð¹ÐºÐ°:\n\n1. **Ð¦Ñ Ñ€Ð¾Ð±Ð¾Ñ‚Ð° Ð±ÑƒÐ»Ð° Ð²Ð¸ÐºÐ¾Ð½Ð°Ð½Ð° Ð²Ñ‡Ð¾Ñ€Ð°.** (Ñ„Ð°ÐºÑ‚ + Ñ‡Ð°Ñ)\n2. **Ð Ñ–ÑˆÐµÐ½Ð½Ñ Ð¿Ñ€Ð¸Ð¹Ð½ÑÑ‚Ð¾.** (Ñ€ÐµÐ·ÑƒÐ»ÑŒÑ‚Ð°Ñ‚, Ð¾Ñ„Ñ–Ñ†Ñ–Ð¹Ð½Ð¾)\n3. **Ð‘ÑƒÐ´Ð¸Ð½Ð¾Ðº Ð±ÑƒÐ´ÑƒÑ”Ñ‚ÑŒÑÑ.** (Ð¿Ñ€Ð¾Ñ†ÐµÑ)\n\nÐ¯ÐºÐ° ÐºÐ¾Ð½ÑÑ‚Ñ€ÑƒÐºÑ†Ñ–Ñ Ð¿Ñ–Ð´Ñ…Ð¾Ð´Ð¸Ñ‚ÑŒ Ð´Ð»Ñ Ð½Ð¾Ð²Ð¸Ð½? Ð”Ð»Ñ Ñ€Ð¾Ð·Ð¼Ð¾Ð²Ð¸? Ð”Ð»Ñ Ð´Ð¾ÐºÑƒÐ¼ÐµÐ½Ñ‚Ð°?\n\n> ðŸ’¡ **Ð¦Ñ–ÐºÐ°Ð²Ð¾ Ð·Ð½Ð°Ñ‚Ð¸**\n>\n> Ð—Ð²Ð¾Ñ€Ð¾Ñ‚Ð½Ð¸Ð¹ Ð¿Ð°ÑÐ¸Ð² Ð· Ñ‡Ð°ÑÑ‚ÐºÐ¾ÑŽ -ÑÑ Ñ–ÑÑ‚Ð¾Ñ€Ð¸Ñ‡Ð½Ð¾ Ð¿Ð¾Ñ…Ð¾Ð´Ð¸Ñ‚ÑŒ Ð²Ñ–Ð´ Ð·Ð²Ð¾Ñ€Ð¾Ñ‚Ð½Ð¾Ð³Ð¾ Ð·Ð°Ð¹Ð¼ÐµÐ½Ð½Ð¸ÐºÐ° Â«ÑÐµÐ±ÐµÂ». Ð¢Ð¾Ð¼Ñƒ Â«Ð±ÑƒÐ´ÑƒÑ”Ñ‚ÑŒÑÑÂ» Ð±ÑƒÐºÐ²Ð°Ð»ÑŒÐ½Ð¾ Ð¾Ð·Ð½Ð°Ñ‡Ð°Ñ” Â«Ð±ÑƒÐ´ÑƒÑ” ÑÐµÐ±ÐµÂ», Ñ…Ð¾Ñ‡Ð° ÑÑƒÑ‡Ð°ÑÐ½Ðµ Ð·Ð½Ð°Ñ‡ÐµÐ½Ð½Ñ â€” Â«Ñ” Ð² Ð¿Ñ€Ð¾Ñ†ÐµÑÑ– Ð±ÑƒÐ´Ñ–Ð²Ð½Ð¸Ñ†Ñ‚Ð²Ð°Â».\n\n---\n\n## ÐŸÐ¾ÑÑÐ½ÐµÐ½Ð½Ñ\n\n### Ð¢Ñ€Ð¸ Ñ‚Ð¸Ð¿Ð¸ Ð¿Ð°ÑÐ¸Ð²Ð½Ð¸Ñ… ÐºÐ¾Ð½ÑÑ‚Ñ€ÑƒÐºÑ†Ñ–Ð¹\n\nÐ£ÐºÑ€Ð°Ñ—Ð½ÑÑŒÐºÐ° Ð¼Ð¾Ð²Ð° Ð²Ð¸ÐºÐ¾Ñ€Ð¸ÑÑ‚Ð¾Ð²ÑƒÑ” Ñ‚Ñ€Ð¸ Ð¾ÑÐ½Ð¾Ð²Ð½Ñ– ÑÐ¿Ð¾ÑÐ¾Ð±Ð¸ Ð²Ð¸Ñ€Ð°Ð¶ÐµÐ½Ð½Ñ Ð¿Ð°ÑÐ¸Ð²Ð½Ð¾Ð³Ð¾ ÑÑ‚Ð°Ð½Ñƒ:\n\n| Ð¢Ð¸Ð¿ | Ð¡Ñ‚Ñ€ÑƒÐºÑ‚ÑƒÑ€Ð° | ÐŸÑ€Ð¸ÐºÐ»Ð°Ð´ | Ð¡Ñ‚Ð¸Ð»ÑŒ |\n|-----|-----------|---------|-------|\n| ÐŸÐ¾Ð²Ð½Ð¸Ð¹ Ð¿Ð°ÑÐ¸Ð² | Ð¿Ñ–Ð´Ð¼ÐµÑ‚ + Ð´Ñ–Ñ”Ð¿Ñ€Ð¸ÐºÐ¼ÐµÑ‚Ð½Ð¸Ðº + Ð²Ð¸ÐºÐ¾Ð½Ð°Ð²ÐµÑ†ÑŒ | ÐšÐ½Ð¸Ð³Ð° Ð½Ð°Ð¿Ð¸ÑÐ°Ð½Ð° Ð°Ð²Ñ‚Ð¾Ñ€Ð¾Ð¼. | ÐžÑ„Ñ–Ñ†Ñ–Ð¹Ð½Ð¸Ð¹, Ð¿Ð¸ÑÑŒÐ¼Ð¾Ð²Ð¸Ð¹ |\n| ÐšÐ¾Ñ€Ð¾Ñ‚ÐºÐ¸Ð¹ Ð¿Ð°ÑÐ¸Ð² | Ð´Ð¾Ð´Ð°Ñ‚Ð¾Ðº + -Ð½Ð¾/-Ñ‚Ð¾ | ÐšÐ½Ð¸Ð³Ñƒ Ð½Ð°Ð¿Ð¸ÑÐ°Ð½Ð¾. | ÐžÑ„Ñ–Ñ†Ñ–Ð¹Ð½Ð¸Ð¹, Ð½Ð¾Ð²Ð¸Ð½Ð¸ |\n| Ð—Ð²Ð¾Ñ€Ð¾Ñ‚Ð½Ð¸Ð¹ Ð¿Ð°ÑÐ¸Ð² | Ð¿Ñ–Ð´Ð¼ÐµÑ‚ + Ð´Ñ–Ñ”ÑÐ»Ð¾Ð²Ð¾-ÑÑ | ÐšÐ½Ð¸Ð³Ð° Ð¿Ð¸ÑˆÐµÑ‚ÑŒÑÑ. | Ð Ð¾Ð·Ð¼Ð¾Ð²Ð½Ð¸Ð¹, Ð¿Ñ€Ð¾Ñ†ÐµÑ |\n\n### Ð¢Ð¸Ð¿ 1: ÐŸÐ¾Ð²Ð½Ð¸Ð¹ Ð¿Ð°ÑÐ¸Ð² Ð· Ð´Ñ–Ñ”Ð¿Ñ€Ð¸ÐºÐ¼ÐµÑ‚Ð½Ð¸ÐºÐ¾Ð¼\n\n**Ð¡Ñ‚Ñ€ÑƒÐºÑ‚ÑƒÑ€Ð°:** ÐŸÑ–Ð´Ð¼ÐµÑ‚ (Ð.Ð².) + Ð¿Ð°ÑÐ¸Ð²Ð½Ð¸Ð¹ Ð´Ñ–Ñ”Ð¿Ñ€Ð¸ÐºÐ¼ÐµÑ‚Ð½Ð¸Ðº + Ð²Ð¸ÐºÐ¾Ð½Ð°Ð²ÐµÑ†ÑŒ (ÐžÑ€.Ð².)\n\n| ÐÐºÑ‚Ð¸Ð²Ð½Ðµ Ñ€ÐµÑ‡ÐµÐ½Ð½Ñ | ÐŸÐ°ÑÐ¸Ð²Ð½Ðµ Ñ€ÐµÑ‡ÐµÐ½Ð½Ñ |\n|-----------------|-----------------|\n| ÐÐ²Ñ‚Ð¾Ñ€ Ð½Ð°Ð¿Ð¸ÑÐ°Ð² ÐºÐ½Ð¸Ð³Ñƒ. | ÐšÐ½Ð¸Ð³Ð° Ð½Ð°Ð¿Ð¸ÑÐ°Ð½Ð° Ð°Ð²Ñ‚Ð¾Ñ€Ð¾Ð¼. |\n| Ð¡Ñ‚ÑƒÐ´ÐµÐ½Ñ‚Ð¸ Ð²Ð¸ÐºÐ¾Ð½Ð°Ð»Ð¸ Ñ€Ð¾Ð±Ð¾Ñ‚Ñƒ. | Ð Ð¾Ð±Ð¾Ñ‚Ð° Ð²Ð¸ÐºÐ¾Ð½Ð°Ð½Ð° ÑÑ‚ÑƒÐ´ÐµÐ½Ñ‚Ð°Ð¼Ð¸. |\n| ÐšÐ¾Ð¼Ñ–ÑÑ–Ñ Ð¿Ñ€Ð¸Ð¹Ð½ÑÐ»Ð° Ñ€Ñ–ÑˆÐµÐ½Ð½Ñ. | Ð Ñ–ÑˆÐµÐ½Ð½Ñ Ð¿Ñ€Ð¸Ð¹Ð½ÑÑ‚Ðµ ÐºÐ¾Ð¼Ñ–ÑÑ–Ñ”ÑŽ. |\n\n**Ð£Ð·Ð³Ð¾Ð´Ð¶ÐµÐ½Ð½Ñ Ð´Ñ–Ñ”Ð¿Ñ€Ð¸ÐºÐ¼ÐµÑ‚Ð½Ð¸ÐºÐ°:**\n\n| Ð Ñ–Ð´ | ÐžÐ´Ð½Ð¸Ð½Ð° | ÐœÐ½Ð¾Ð¶Ð¸Ð½Ð° |\n|-----|--------|---------|\n| Ð§Ð¾Ð»Ð¾Ð²Ñ–Ñ‡Ð¸Ð¹ | Ð½Ð°Ð¿Ð¸ÑÐ°Ð½Ð¸Ð¹ | Ð½Ð°Ð¿Ð¸ÑÐ°Ð½Ñ– |\n| Ð–Ñ–Ð½Ð¾Ñ‡Ð¸Ð¹ | Ð½Ð°Ð¿Ð¸ÑÐ°Ð½Ð° | Ð½Ð°Ð¿Ð¸ÑÐ°Ð½Ñ– |\n| Ð¡ÐµÑ€ÐµÐ´Ð½Ñ–Ð¹ | Ð½Ð°Ð¿Ð¸ÑÐ°Ð½Ðµ | Ð½Ð°Ð¿Ð¸ÑÐ°Ð½Ñ– |\n\n**ÐšÐ¾Ð»Ð¸ Ð²Ð¸ÐºÐ¾Ñ€Ð¸ÑÑ‚Ð¾Ð²ÑƒÑ”Ñ‚ÑŒÑÑ:**\n- ÐšÐ¾Ð»Ð¸ Ð²Ð°Ð¶Ð»Ð¸Ð²Ð¾ Ð½Ð°Ð·Ð²Ð°Ñ‚Ð¸ Ð²Ð¸ÐºÐ¾Ð½Ð°Ð²Ñ†Ñ\n- Ð’ Ð¾Ñ„Ñ–Ñ†Ñ–Ð¹Ð½Ð¸Ñ… Ñ‚Ð° Ð°ÐºÐ°Ð´ÐµÐ¼Ñ–Ñ‡Ð½Ð¸Ñ… Ñ‚ÐµÐºÑÑ‚Ð°Ñ…\n- ÐšÐ¾Ð»Ð¸ Ð¿Ñ–Ð´ÐºÑ€ÐµÑÐ»ÑŽÑ”Ñ‚ÑŒÑÑ Ð·Ð°Ð²ÐµÑ€ÑˆÐµÐ½Ñ–ÑÑ‚ÑŒ Ð´Ñ–Ñ—\n\n> ðŸŒ **Ð£ Ñ€ÐµÐ°Ð»ÑŒÐ½Ð¾Ð¼Ñƒ Ð¶Ð¸Ñ‚Ñ‚Ñ–**\n>\n> Â«ÐšÐ¾Ð½ÑÑ‚Ð¸Ñ‚ÑƒÑ†Ñ–Ñ Ð£ÐºÑ€Ð°Ñ—Ð½Ð¸ Ð¿Ñ€Ð¸Ð¹Ð½ÑÑ‚Ð° Ð’ÐµÑ€Ñ…Ð¾Ð²Ð½Ð¾ÑŽ Ð Ð°Ð´Ð¾ÑŽ 28 Ñ‡ÐµÑ€Ð²Ð½Ñ 1996 Ñ€Ð¾ÐºÑƒ.Â» â€” Ñ‚Ð¸Ð¿Ð¾Ð²Ð¸Ð¹ Ð¿Ñ€Ð¸ÐºÐ»Ð°Ð´ Ð¿Ð¾Ð²Ð½Ð¾Ð³Ð¾ Ð¿Ð°ÑÐ¸Ð²Ñƒ Ð² Ñ–ÑÑ‚Ð¾Ñ€Ð¸Ñ‡Ð½Ð¸Ñ… Ñ‚Ð° ÑŽÑ€Ð¸Ð´Ð¸Ñ‡Ð½Ð¸Ñ… Ñ‚ÐµÐºÑÑ‚Ð°Ñ….\n\n### Ð¢Ð¸Ð¿ 2: ÐšÐ¾Ñ€Ð¾Ñ‚ÐºÐ¸Ð¹ Ð¿Ð°ÑÐ¸Ð² (-Ð½Ð¾/-Ñ‚Ð¾)\n\n**Ð¡Ñ‚Ñ€ÑƒÐºÑ‚ÑƒÑ€Ð°:** Ð”Ð¾Ð´Ð°Ñ‚Ð¾Ðº (Ð—Ð½.Ð².) + ÐºÐ¾Ñ€Ð¾Ñ‚ÐºÐ° Ñ„Ð¾Ñ€Ð¼Ð° (-Ð½Ð¾/-Ñ‚Ð¾)\n\n| ÐÐºÑ‚Ð¸Ð²Ð½Ðµ Ñ€ÐµÑ‡ÐµÐ½Ð½Ñ | ÐšÐ¾Ñ€Ð¾Ñ‚ÐºÐ¸Ð¹ Ð¿Ð°ÑÐ¸Ð² |\n|-----------------|----------------|\n| Ð¥Ñ‚Ð¾ÑÑŒ Ð½Ð°Ð¿Ð¸ÑÐ°Ð² Ð»Ð¸ÑÑ‚Ð°. | Ð›Ð¸ÑÑ‚Ð° Ð½Ð°Ð¿Ð¸ÑÐ°Ð½Ð¾. |\n| Ð¥Ñ‚Ð¾ÑÑŒ Ð¿Ñ€Ð¸Ð¹Ð½ÑÐ² Ñ€Ñ–ÑˆÐµÐ½Ð½Ñ. | Ð Ñ–ÑˆÐµÐ½Ð½Ñ Ð¿Ñ€Ð¸Ð¹Ð½ÑÑ‚Ð¾. |\n| Ð¥Ñ‚Ð¾ÑÑŒ Ð²Ð¸ÐºÐ¾Ð½Ð°Ð² Ñ€Ð¾Ð±Ð¾Ñ‚Ñƒ. | Ð Ð¾Ð±Ð¾Ñ‚Ñƒ Ð²Ð¸ÐºÐ¾Ð½Ð°Ð½Ð¾. |\n\n**ÐšÐ»ÑŽÑ‡Ð¾Ð²Ñ– Ð¾ÑÐ¾Ð±Ð»Ð¸Ð²Ð¾ÑÑ‚Ñ–:**\n- Ð¤Ð¾Ñ€Ð¼Ð° Ð½Ðµ Ð·Ð¼Ñ–Ð½ÑŽÑ”Ñ‚ÑŒÑÑ (Ð·Ð°Ð²Ð¶Ð´Ð¸ -Ð¾)\n- Ð”Ð¾Ð´Ð°Ñ‚Ð¾Ðº Ñƒ Ð·Ð½Ð°Ñ…Ñ–Ð´Ð½Ð¾Ð¼Ñƒ Ð²Ñ–Ð´Ð¼Ñ–Ð½ÐºÑƒ\n- Ð’Ð¸ÐºÐ¾Ð½Ð°Ð²ÐµÑ†ÑŒ Ð·Ð°Ð·Ð²Ð¸Ñ‡Ð°Ð¹ Ð½Ðµ Ð½Ð°Ð·Ð¸Ð²Ð°Ñ”Ñ‚ÑŒÑÑ\n\n**ÐšÐ¾Ð»Ð¸ Ð²Ð¸ÐºÐ¾Ñ€Ð¸ÑÑ‚Ð¾Ð²ÑƒÑ”Ñ‚ÑŒÑÑ:**\n- Ð’ Ð¾Ñ„Ñ–Ñ†Ñ–Ð¹Ð½Ð¸Ñ… Ð´Ð¾ÐºÑƒÐ¼ÐµÐ½Ñ‚Ð°Ñ… Ñ‚Ð° Ð¿Ñ€Ð¾Ñ‚Ð¾ÐºÐ¾Ð»Ð°Ñ…\n- Ð£ Ð½Ð¾Ð²Ð¸Ð½Ð°Ñ… Ñ‚Ð° Ð¶ÑƒÑ€Ð½Ð°Ð»Ñ–ÑÑ‚Ð¸Ñ†Ñ–\n- ÐšÐ¾Ð»Ð¸ Ð²Ð¸ÐºÐ¾Ð½Ð°Ð²ÐµÑ†ÑŒ Ð½ÐµÐ²Ñ–Ð´Ð¾Ð¼Ð¸Ð¹ Ð°Ð±Ð¾ Ð½ÐµÐ²Ð°Ð¶Ð»Ð¸Ð²Ð¸Ð¹\n\n> ðŸŽ¬ **ÐšÑƒÐ»ÑŒÑ‚ÑƒÑ€Ð½Ð¸Ð¹ Ð¼Ð¾Ð¼ÐµÐ½Ñ‚**\n>\n> Ð£ Ñ„Ñ–Ð»ÑŒÐ¼Ñ– Â«Ð’Ð¾Ð³Ð½ÐµÐ¼ Ñ– Ð¼ÐµÑ‡ÐµÐ¼Â» Ð·Ð° Ñ€Ð¾Ð¼Ð°Ð½Ð¾Ð¼ Ð“ÐµÐ½Ñ€Ð¸ÐºÐ° Ð¡ÐµÐ½ÐºÐµÐ²Ð¸Ñ‡Ð° Ñ‡ÑƒÑ‚Ð¸ Ð±Ð°Ð³Ð°Ñ‚Ð¾ Ð¿Ð°ÑÐ¸Ð²Ð½Ð¸Ñ… ÐºÐ¾Ð½ÑÑ‚Ñ€ÑƒÐºÑ†Ñ–Ð¹ Ñƒ ÑÑ†ÐµÐ½Ð°Ñ… ÐºÐ¾Ð·Ð°Ñ†ÑŒÐºÐ¸Ñ… Ñ€Ð°Ð´: Â«Ð Ñ–ÑˆÐµÐ½Ð¾ Ð²Ð¸ÑÑ‚ÑƒÐ¿Ð°Ñ‚Ð¸!Â», Â«ÐÐ°ÐºÐ°Ð·Ð°Ð½Ð¾ Ñ‡ÐµÐºÐ°Ñ‚Ð¸!Â» â€” Ñ†Ðµ Ð½Ð°Ð´Ð°Ñ” Ð¼Ð¾Ð²Ñ– ÑƒÑ€Ð¾Ñ‡Ð¸ÑÑ‚Ð¾Ð³Ð¾, Ñ–ÑÑ‚Ð¾Ñ€Ð¸Ñ‡Ð½Ð¾Ð³Ð¾ Ð·Ð²ÑƒÑ‡Ð°Ð½Ð½Ñ.\n\n### Ð¢Ð¸Ð¿ 3: Ð—Ð²Ð¾Ñ€Ð¾Ñ‚Ð½Ð¸Ð¹ Ð¿Ð°ÑÐ¸Ð² (-ÑÑ)\n\n**Ð¡Ñ‚Ñ€ÑƒÐºÑ‚ÑƒÑ€Ð°:** ÐŸÑ–Ð´Ð¼ÐµÑ‚ (Ð.Ð².) + Ð´Ñ–Ñ”ÑÐ»Ð¾Ð²Ð¾ Ð· Ñ‡Ð°ÑÑ‚ÐºÐ¾ÑŽ -ÑÑ\n\n| ÐÐºÑ‚Ð¸Ð²Ð½Ðµ Ñ€ÐµÑ‡ÐµÐ½Ð½Ñ | Ð—Ð²Ð¾Ñ€Ð¾Ñ‚Ð½Ð¸Ð¹ Ð¿Ð°ÑÐ¸Ð² |\n|-----------------|-----------------|\n| Ð Ð¾Ð±Ñ–Ñ‚Ð½Ð¸ÐºÐ¸ Ð±ÑƒÐ´ÑƒÑŽÑ‚ÑŒ Ð±ÑƒÐ´Ð¸Ð½Ð¾Ðº. | Ð‘ÑƒÐ´Ð¸Ð½Ð¾Ðº Ð±ÑƒÐ´ÑƒÑ”Ñ‚ÑŒÑÑ. |\n| ÐŸÐµÐºÐ°Ñ€Ñ– Ð¿ÐµÑ‡ÑƒÑ‚ÑŒ Ñ…Ð»Ñ–Ð±. | Ð¥Ð»Ñ–Ð± Ð¿ÐµÑ‡ÐµÑ‚ÑŒÑÑ. |\n| Ð£Ñ‡ÐµÐ½Ñ– Ð´Ð¾ÑÐ»Ñ–Ð´Ð¶ÑƒÑŽÑ‚ÑŒ Ð¿Ñ€Ð¾Ð±Ð»ÐµÐ¼Ñƒ. | ÐŸÑ€Ð¾Ð±Ð»ÐµÐ¼Ð° Ð´Ð¾ÑÐ»Ñ–Ð´Ð¶ÑƒÑ”Ñ‚ÑŒÑÑ. |\n\n**ÐšÐ»ÑŽÑ‡Ð¾Ð²Ñ– Ð¾ÑÐ¾Ð±Ð»Ð¸Ð²Ð¾ÑÑ‚Ñ–:**\n- ÐŸÑ–Ð´ÐºÑ€ÐµÑÐ»ÑŽÑ” Ð¿Ñ€Ð¾Ñ†ÐµÑ, Ð° Ð½Ðµ Ñ€ÐµÐ·ÑƒÐ»ÑŒÑ‚Ð°Ñ‚\n- Ð§Ð°ÑÑ‚Ð¾ Ð²Ð¶Ð¸Ð²Ð°Ñ”Ñ‚ÑŒÑÑ Ð² Ñ‚ÐµÐ¿ÐµÑ€Ñ–ÑˆÐ½ÑŒÐ¾Ð¼Ñƒ Ñ‡Ð°ÑÑ–\n- ÐœÐ¾Ð¶Ðµ Ð²Ð¸Ñ€Ð°Ð¶Ð°Ñ‚Ð¸ Ð·Ð°Ð³Ð°Ð»ÑŒÐ½Ðµ Ñ‚Ð²ÐµÑ€Ð´Ð¶ÐµÐ½Ð½Ñ\n\n**ÐšÐ¾Ð»Ð¸ Ð²Ð¸ÐºÐ¾Ñ€Ð¸ÑÑ‚Ð¾Ð²ÑƒÑ”Ñ‚ÑŒÑÑ:**\n- Ð”Ð»Ñ Ð¾Ð¿Ð¸ÑÑƒ Ð¿Ñ€Ð¾Ñ†ÐµÑÑ–Ð², Ñ‰Ð¾ Ñ‚Ñ€Ð¸Ð²Ð°ÑŽÑ‚ÑŒ\n- Ð£ Ñ‚ÐµÑ…Ð½Ñ–Ñ‡Ð½Ð¸Ñ… Ñ–Ð½ÑÑ‚Ñ€ÑƒÐºÑ†Ñ–ÑÑ…\n- Ð£ Ð·Ð°Ð³Ð°Ð»ÑŒÐ½Ð¸Ñ… Ñ‚Ð²ÐµÑ€Ð´Ð¶ÐµÐ½Ð½ÑÑ… Ð¿Ñ€Ð¾ Ð·Ð²Ð¸Ñ‡Ð°Ð¹Ð½Ñ– Ð´Ñ–Ñ—\n\n> ðŸŒ **Ð£ Ñ€ÐµÐ°Ð»ÑŒÐ½Ð¾Ð¼Ñƒ Ð¶Ð¸Ñ‚Ñ‚Ñ–**\n>\n> ÐÐ° ÐµÑ‚Ð¸ÐºÐµÑ‚ÐºÐ°Ñ… Ð¿Ñ€Ð¾Ð´ÑƒÐºÑ‚Ñ–Ð² Ñ‡Ð°ÑÑ‚Ð¾ Ñ‡Ð¸Ñ‚Ð°Ñ”Ð¼Ð¾: Â«Ð—Ð±ÐµÑ€Ñ–Ð³Ð°Ñ”Ñ‚ÑŒÑÑ Ð¿Ñ€Ð¸ Ñ‚ÐµÐ¼Ð¿ÐµÑ€Ð°Ñ‚ÑƒÑ€Ñ–...Â», Â«Ð’Ð¶Ð¸Ð²Ð°Ñ”Ñ‚ÑŒÑÑ Ð¿ÐµÑ€ÐµÐ´ Ñ—Ð¶ÐµÑŽÂ», Â«Ð’Ð¸Ð³Ð¾Ñ‚Ð¾Ð²Ð»ÑÑ”Ñ‚ÑŒÑÑ Ð² Ð£ÐºÑ€Ð°Ñ—Ð½Ñ–Â». Ð¦Ðµ Ñ‚Ð¸Ð¿Ð¾Ð²Ñ– Ð¿Ñ€Ð¸ÐºÐ»Ð°Ð´Ð¸ Ð·Ð²Ð¾Ñ€Ð¾Ñ‚Ð½Ð¾Ð³Ð¾ Ð¿Ð°ÑÐ¸Ð²Ñƒ.\n\n### ÐŸÐ¾Ñ€Ñ–Ð²Ð½ÑÐ½Ð½Ñ Ñ‚Ñ€ÑŒÐ¾Ñ… Ñ‚Ð¸Ð¿Ñ–Ð²\n\nÐŸÐ¾Ñ€Ñ–Ð²Ð½ÑÐ¹Ð¼Ð¾ Ñ‚Ñ€Ð¸ ÑÐ¿Ð¾ÑÐ¾Ð±Ð¸ ÑÐºÐ°Ð·Ð°Ñ‚Ð¸ Ð¾Ð´Ð½Ðµ Ð¹ Ñ‚Ðµ ÑÐ°Ð¼Ðµ:\n\n| Ð¡Ð¸Ñ‚ÑƒÐ°Ñ†Ñ–Ñ | ÐŸÐ¾Ð²Ð½Ð¸Ð¹ Ð¿Ð°ÑÐ¸Ð² | ÐšÐ¾Ñ€Ð¾Ñ‚ÐºÐ¸Ð¹ Ð¿Ð°ÑÐ¸Ð² | Ð—Ð²Ð¾Ñ€Ð¾Ñ‚Ð½Ð¸Ð¹ Ð¿Ð°ÑÐ¸Ð² |\n|----------|--------------|----------------|-----------------|\n| ÐŸÑ€Ð¾ ÐºÐ½Ð¸Ð³Ñƒ | ÐšÐ½Ð¸Ð³Ð° Ð½Ð°Ð¿Ð¸ÑÐ°Ð½Ð° Ð¿Ð¸ÑÑŒÐ¼ÐµÐ½Ð½Ð¸ÐºÐ¾Ð¼. | ÐšÐ½Ð¸Ð³Ñƒ Ð½Ð°Ð¿Ð¸ÑÐ°Ð½Ð¾. | ÐšÐ½Ð¸Ð³Ð° Ð¿Ð¸ÑˆÐµÑ‚ÑŒÑÑ ÑˆÐ²Ð¸Ð´ÐºÐ¾. |\n| ÐŸÑ€Ð¾ Ñ€Ñ–ÑˆÐµÐ½Ð½Ñ | Ð Ñ–ÑˆÐµÐ½Ð½Ñ Ð¿Ñ€Ð¸Ð¹Ð½ÑÑ‚Ðµ ÐºÐ¾Ð¼Ñ–ÑÑ–Ñ”ÑŽ. | Ð Ñ–ÑˆÐµÐ½Ð½Ñ Ð¿Ñ€Ð¸Ð¹Ð½ÑÑ‚Ð¾. | Ð Ñ–ÑˆÐµÐ½Ð½Ñ Ð¿Ñ€Ð¸Ð¹Ð¼Ð°Ñ”Ñ‚ÑŒÑÑ Ð·Ð°Ñ€Ð°Ð·. |\n| ÐŸÑ€Ð¾ Ñ€Ð¾Ð±Ð¾Ñ‚Ñƒ | Ð Ð¾Ð±Ð¾Ñ‚Ð° Ð²Ð¸ÐºÐ¾Ð½Ð°Ð½Ð° ÑÑ‚ÑƒÐ´ÐµÐ½Ñ‚Ð°Ð¼Ð¸. | Ð Ð¾Ð±Ð¾Ñ‚Ñƒ Ð²Ð¸ÐºÐ¾Ð½Ð°Ð½Ð¾. | Ð Ð¾Ð±Ð¾Ñ‚Ð° Ð²Ð¸ÐºÐ¾Ð½ÑƒÑ”Ñ‚ÑŒÑÑ Ñ‰Ð¾Ð´Ð½Ñ. |\n\n**Ð¡Ñ‚Ð¸Ð»Ñ–ÑÑ‚Ð¸Ñ‡Ð½Ñ– Ð²Ñ–Ð´Ñ‚Ñ–Ð½ÐºÐ¸:**\n\n| Ð¢Ð¸Ð¿ | ÐÐºÑ†ÐµÐ½Ñ‚ | Ð§Ð°Ñ | Ð¡Ñ‚Ð¸Ð»ÑŒ |\n|-----|--------|-----|-------|\n| ÐŸÐ¾Ð²Ð½Ð¸Ð¹ | Ð’Ð¸ÐºÐ¾Ð½Ð°Ð²ÐµÑ†ÑŒ + Ñ€ÐµÐ·ÑƒÐ»ÑŒÑ‚Ð°Ñ‚ | ÐœÐ¸Ð½ÑƒÐ»Ð¸Ð¹ | ÐžÑ„Ñ–Ñ†Ñ–Ð¹Ð½Ð¸Ð¹ |\n| ÐšÐ¾Ñ€Ð¾Ñ‚ÐºÐ¸Ð¹ | Ð ÐµÐ·ÑƒÐ»ÑŒÑ‚Ð°Ñ‚ | ÐœÐ¸Ð½ÑƒÐ»Ð¸Ð¹ | ÐžÑ„Ñ–Ñ†Ñ–Ð¹Ð½Ð¸Ð¹, Ð¾Ð±'Ñ”ÐºÑ‚Ð¸Ð²Ð½Ð¸Ð¹ |\n| Ð—Ð²Ð¾Ñ€Ð¾Ñ‚Ð½Ð¸Ð¹ | ÐŸÑ€Ð¾Ñ†ÐµÑ | Ð¢ÐµÐ¿ÐµÑ€Ñ–ÑˆÐ½Ñ–Ð¹ | ÐÐµÐ¹Ñ‚Ñ€Ð°Ð»ÑŒÐ½Ð¸Ð¹, Ñ€Ð¾Ð·Ð¼Ð¾Ð²Ð½Ð¸Ð¹ |\n\n### Ð§Ð°ÑÐ¾Ð²Ñ– Ñ„Ð¾Ñ€Ð¼Ð¸ Ð¿Ð°ÑÐ¸Ð²Ð½Ð¸Ñ… ÐºÐ¾Ð½ÑÑ‚Ñ€ÑƒÐºÑ†Ñ–Ð¹\n\n**ÐŸÐ¾Ð²Ð½Ð¸Ð¹ Ð¿Ð°ÑÐ¸Ð²:**\n\n| Ð§Ð°Ñ | Ð¡Ñ‚Ñ€ÑƒÐºÑ‚ÑƒÑ€Ð° | ÐŸÑ€Ð¸ÐºÐ»Ð°Ð´ |\n|-----|-----------|---------|\n| Ð¢ÐµÐ¿ÐµÑ€Ñ–ÑˆÐ½Ñ–Ð¹ | Ð¿Ñ–Ð´Ð¼ÐµÑ‚ + Ð´Ñ–Ñ”Ð¿Ñ€Ð¸ÐºÐ¼ÐµÑ‚Ð½Ð¸Ðº | ÐšÐ½Ð¸Ð³Ð° Ð½Ð°Ð¿Ð¸ÑÐ°Ð½Ð°. |\n| ÐœÐ¸Ð½ÑƒÐ»Ð¸Ð¹ | Ð¿Ñ–Ð´Ð¼ÐµÑ‚ + Ð±ÑƒÐ²/Ð±ÑƒÐ»Ð°/Ð±ÑƒÐ»Ð¾ + Ð´Ñ–Ñ”Ð¿Ñ€Ð¸ÐºÐ¼ÐµÑ‚Ð½Ð¸Ðº | ÐšÐ½Ð¸Ð³Ð° Ð±ÑƒÐ»Ð° Ð½Ð°Ð¿Ð¸ÑÐ°Ð½Ð°. |\n| ÐœÐ°Ð¹Ð±ÑƒÑ‚Ð½Ñ–Ð¹ | Ð¿Ñ–Ð´Ð¼ÐµÑ‚ + Ð±ÑƒÐ´Ðµ + Ð´Ñ–Ñ”Ð¿Ñ€Ð¸ÐºÐ¼ÐµÑ‚Ð½Ð¸Ðº | ÐšÐ½Ð¸Ð³Ð° Ð±ÑƒÐ´Ðµ Ð½Ð°Ð¿Ð¸ÑÐ°Ð½Ð°. |\n\n**ÐšÐ¾Ñ€Ð¾Ñ‚ÐºÐ¸Ð¹ Ð¿Ð°ÑÐ¸Ð²:**\n\n| Ð§Ð°Ñ | Ð¡Ñ‚Ñ€ÑƒÐºÑ‚ÑƒÑ€Ð° | ÐŸÑ€Ð¸ÐºÐ»Ð°Ð´ |\n|-----|-----------|---------|\n| ÐœÐ¸Ð½ÑƒÐ»Ð¸Ð¹ (Ð·Ð°Ð²ÐµÑ€ÑˆÐµÐ½Ð¾) | Ð´Ð¾Ð´Ð°Ñ‚Ð¾Ðº + -Ð½Ð¾/-Ñ‚Ð¾ | ÐšÐ½Ð¸Ð³Ñƒ Ð½Ð°Ð¿Ð¸ÑÐ°Ð½Ð¾. |\n| ÐœÐ¸Ð½ÑƒÐ»Ð¸Ð¹ (Ð· Â«Ð±ÑƒÐ»Ð¾Â») | Ð´Ð¾Ð´Ð°Ñ‚Ð¾Ðº + Ð±ÑƒÐ»Ð¾ + -Ð½Ð¾/-Ñ‚Ð¾ | ÐšÐ½Ð¸Ð³Ñƒ Ð±ÑƒÐ»Ð¾ Ð½Ð°Ð¿Ð¸ÑÐ°Ð½Ð¾. |\n| ÐœÐ°Ð¹Ð±ÑƒÑ‚Ð½Ñ–Ð¹ | Ð´Ð¾Ð´Ð°Ñ‚Ð¾Ðº + Ð±ÑƒÐ´Ðµ + -Ð½Ð¾/-Ñ‚Ð¾ | ÐšÐ½Ð¸Ð³Ñƒ Ð±ÑƒÐ´Ðµ Ð½Ð°Ð¿Ð¸ÑÐ°Ð½Ð¾. |\n\n**Ð—Ð²Ð¾Ñ€Ð¾Ñ‚Ð½Ð¸Ð¹ Ð¿Ð°ÑÐ¸Ð²:**\n\n| Ð§Ð°Ñ | Ð¡Ñ‚Ñ€ÑƒÐºÑ‚ÑƒÑ€Ð° | ÐŸÑ€Ð¸ÐºÐ»Ð°Ð´ |\n|-----|-----------|---------|\n| Ð¢ÐµÐ¿ÐµÑ€Ñ–ÑˆÐ½Ñ–Ð¹ | Ð¿Ñ–Ð´Ð¼ÐµÑ‚ + Ð´Ñ–Ñ”ÑÐ»Ð¾Ð²Ð¾-ÑÑ | ÐšÐ½Ð¸Ð³Ð° Ð¿Ð¸ÑˆÐµÑ‚ÑŒÑÑ. |\n| ÐœÐ¸Ð½ÑƒÐ»Ð¸Ð¹ | Ð¿Ñ–Ð´Ð¼ÐµÑ‚ + Ð´Ñ–Ñ”ÑÐ»Ð¾Ð²Ð¾-ÑÑ (Ð¼Ð¸Ð½.) | ÐšÐ½Ð¸Ð³Ð° Ð¿Ð¸ÑÐ°Ð»Ð°ÑÑ. |\n| ÐœÐ°Ð¹Ð±ÑƒÑ‚Ð½Ñ–Ð¹ | Ð¿Ñ–Ð´Ð¼ÐµÑ‚ + Ð±ÑƒÐ´Ðµ + Ñ–Ð½Ñ„.-ÑÑ | ÐšÐ½Ð¸Ð³Ð° Ð±ÑƒÐ´Ðµ Ð¿Ð¸ÑÐ°Ñ‚Ð¸ÑÑ. |\n\n> ðŸ’¡ **ÐšÐ¾Ñ€Ð¸ÑÐ½Ð° Ð¿Ð¾Ñ€Ð°Ð´Ð°**\n>\n> Ð¯ÐºÑ‰Ð¾ Ð²Ð¸ Ð½Ðµ Ð²Ð¿ÐµÐ²Ð½ÐµÐ½Ñ–, ÑÐºÐ¸Ð¹ Ñ‚Ð¸Ð¿ Ð¿Ð°ÑÐ¸Ð²Ñƒ Ð¾Ð±Ñ€Ð°Ñ‚Ð¸:\n> - ÐŸÐ¾Ñ‚Ñ€Ñ–Ð±Ð½Ð¾ Ð½Ð°Ð·Ð²Ð°Ñ‚Ð¸ Ð²Ð¸ÐºÐ¾Ð½Ð°Ð²Ñ†Ñ? â†’ ÐŸÐ¾Ð²Ð½Ð¸Ð¹ Ð¿Ð°ÑÐ¸Ð²\n> - ÐÐºÑ†ÐµÐ½Ñ‚ Ð½Ð° Ñ€ÐµÐ·ÑƒÐ»ÑŒÑ‚Ð°Ñ‚Ñ–, Ð±ÐµÐ· Ð²Ð¸ÐºÐ¾Ð½Ð°Ð²Ñ†Ñ? â†’ ÐšÐ¾Ñ€Ð¾Ñ‚ÐºÐ¸Ð¹ Ð¿Ð°ÑÐ¸Ð²\n> - ÐžÐ¿Ð¸ÑÑƒÑ”Ñ‚Ðµ Ð¿Ñ€Ð¾Ñ†ÐµÑ? â†’ Ð—Ð²Ð¾Ñ€Ð¾Ñ‚Ð½Ð¸Ð¹ Ð¿Ð°ÑÐ¸Ð²\n\n---\n\n## ÐŸÑ€Ð°ÐºÑ‚Ð¸ÐºÐ°\n\n### Ð¯Ðº Ð¾Ð±Ñ€Ð°Ñ‚Ð¸ Ñ‚Ð¸Ð¿ Ð¿Ð°ÑÐ¸Ð²Ñƒ?\n\n**ÐÐ»Ð³Ð¾Ñ€Ð¸Ñ‚Ð¼ Ð²Ð¸Ð±Ð¾Ñ€Ñƒ:**\n\n1. **Ð§Ð¸ Ð¿Ð¾Ñ‚Ñ€Ñ–Ð±Ð½Ð¾ Ð½Ð°Ð·Ð²Ð°Ñ‚Ð¸ Ð²Ð¸ÐºÐ¾Ð½Ð°Ð²Ñ†Ñ?**\n   - Ð¢Ð°Ðº â†’ ÐŸÐ¾Ð²Ð½Ð¸Ð¹ Ð¿Ð°ÑÐ¸Ð²: Ð›Ð¸ÑÑ‚ Ð½Ð°Ð¿Ð¸ÑÐ°Ð½Ð¸Ð¹ ÑÐµÐºÑ€ÐµÑ‚Ð°Ñ€ÐµÐ¼.\n   - ÐÑ– â†’ ÐŸÐµÑ€ÐµÐ¹Ð´Ñ–Ñ‚ÑŒ Ð´Ð¾ Ð¿Ð¸Ñ‚Ð°Ð½Ð½Ñ 2.\n\n2. **Ð©Ð¾ Ð²Ð°Ð¶Ð»Ð¸Ð²Ñ–ÑˆÐµ â€” Ñ€ÐµÐ·ÑƒÐ»ÑŒÑ‚Ð°Ñ‚ Ñ‡Ð¸ Ð¿Ñ€Ð¾Ñ†ÐµÑ?**\n   - Ð ÐµÐ·ÑƒÐ»ÑŒÑ‚Ð°Ñ‚ â†’ ÐšÐ¾Ñ€Ð¾Ñ‚ÐºÐ¸Ð¹ Ð¿Ð°ÑÐ¸Ð²: Ð›Ð¸ÑÑ‚Ð° Ð½Ð°Ð¿Ð¸ÑÐ°Ð½Ð¾.\n   - ÐŸÑ€Ð¾Ñ†ÐµÑ â†’ Ð—Ð²Ð¾Ñ€Ð¾Ñ‚Ð½Ð¸Ð¹ Ð¿Ð°ÑÐ¸Ð²: Ð›Ð¸ÑÑ‚Ð¸ Ð¿Ð¸ÑˆÑƒÑ‚ÑŒÑÑ Ñ‰Ð¾Ð´Ð½Ñ.\n\n3. **Ð¯ÐºÐ¸Ð¹ ÑÑ‚Ð¸Ð»ÑŒ Ñ‚ÐµÐºÑÑ‚Ñƒ?**\n   - ÐžÑ„Ñ–Ñ†Ñ–Ð¹Ð½Ð¸Ð¹ â†’ ÐšÐ¾Ñ€Ð¾Ñ‚ÐºÐ¸Ð¹ Ð°Ð±Ð¾ Ð¿Ð¾Ð²Ð½Ð¸Ð¹ Ð¿Ð°ÑÐ¸Ð²\n   - Ð Ð¾Ð·Ð¼Ð¾Ð²Ð½Ð¸Ð¹ â†’ Ð—Ð²Ð¾Ñ€Ð¾Ñ‚Ð½Ð¸Ð¹ Ð¿Ð°ÑÐ¸Ð² Ð°Ð±Ð¾ Ð°ÐºÑ‚Ð¸Ð²Ð½Ð¸Ð¹ ÑÑ‚Ð°Ð½\n\n### Ð¢Ñ€Ð°Ð½ÑÑ„Ð¾Ñ€Ð¼Ð°Ñ†Ñ–Ñ Ð°ÐºÑ‚Ð¸Ð²Ð½Ð¸Ñ… Ñ€ÐµÑ‡ÐµÐ½ÑŒ\n\n**ÐšÑ€Ð¾Ðº 1: Ð’Ð¸Ð·Ð½Ð°Ñ‡Ñ‚Ðµ Ð´Ð¾Ð´Ð°Ñ‚Ð¾Ðº Ð°ÐºÑ‚Ð¸Ð²Ð½Ð¾Ð³Ð¾ Ñ€ÐµÑ‡ÐµÐ½Ð½Ñ**\n- Ð¡Ñ‚ÑƒÐ´ÐµÐ½Ñ‚Ð¸ Ð²Ð¸ÐºÐ¾Ð½Ð°Ð»Ð¸ **Ñ€Ð¾Ð±Ð¾Ñ‚Ñƒ**.\n\n**ÐšÑ€Ð¾Ðº 2: Ð—Ñ€Ð¾Ð±Ñ–Ñ‚ÑŒ Ð´Ð¾Ð´Ð°Ñ‚Ð¾Ðº Ð¿Ñ–Ð´Ð¼ÐµÑ‚Ð¾Ð¼**\n- **Ð Ð¾Ð±Ð¾Ñ‚Ð°** Ð²Ð¸ÐºÐ¾Ð½Ð°Ð½Ð° ÑÑ‚ÑƒÐ´ÐµÐ½Ñ‚Ð°Ð¼Ð¸. (Ð¿Ð¾Ð²Ð½Ð¸Ð¹ Ð¿Ð°ÑÐ¸Ð²)\n- **Ð Ð¾Ð±Ð¾Ñ‚Ñƒ** Ð²Ð¸ÐºÐ¾Ð½Ð°Ð½Ð¾. (ÐºÐ¾Ñ€Ð¾Ñ‚ÐºÐ¸Ð¹ Ð¿Ð°ÑÐ¸Ð² â€” Ð·Ð½Ð°Ñ…Ñ–Ð´Ð½Ð¸Ð¹!)\n\n**ÐšÑ€Ð¾Ðº 3: Ð£Ð·Ð³Ð¾Ð´ÑŒÑ‚Ðµ Ñ„Ð¾Ñ€Ð¼Ñƒ**\n- Ð Ð¾Ð±Ð¾Ñ‚Ð° (Ð¶.Ñ€.) â†’ Ð²Ð¸ÐºÐ¾Ð½Ð°Ð½Ð° (Ð¶.Ñ€.)\n- Ð Ð¾Ð±Ð¾Ñ‚Ñƒ â†’ Ð²Ð¸ÐºÐ¾Ð½Ð°Ð½Ð¾ (Ð½ÐµÐ·Ð¼Ñ–Ð½Ð½Ð° Ñ„Ð¾Ñ€Ð¼Ð°)\n\n### Ð¢Ð¸Ð¿Ð¾Ð²Ñ– Ð¿Ð¾Ð¼Ð¸Ð»ÐºÐ¸ Ñ‚Ð° ÑÐº Ñ—Ñ… ÑƒÐ½Ð¸ÐºÐ½ÑƒÑ‚Ð¸\n\n**ÐŸÐ¾Ð¼Ð¸Ð»ÐºÐ° 1: ÐŸÐ»ÑƒÑ‚Ð°Ð½Ð¸Ð½Ð° Ñƒ Ð²Ñ–Ð´Ð¼Ñ–Ð½ÐºÐ°Ñ…**\n\nâŒ ÐÐµÐ¿Ñ€Ð°Ð²Ð¸Ð»ÑŒÐ½Ð¾: ÐšÐ½Ð¸Ð³Ð° Ð½Ð°Ð¿Ð¸ÑÐ°Ð½Ð¾ Ð²Ñ‡Ð¾Ñ€Ð°.\nâœ… ÐŸÑ€Ð°Ð²Ð¸Ð»ÑŒÐ½Ð¾: ÐšÐ½Ð¸Ð³Ñƒ Ð½Ð°Ð¿Ð¸ÑÐ°Ð½Ð¾ Ð²Ñ‡Ð¾Ñ€Ð°. / ÐšÐ½Ð¸Ð³Ð° Ð½Ð°Ð¿Ð¸ÑÐ°Ð½Ð° Ð²Ñ‡Ð¾Ñ€Ð°.\n\n**Ð§Ð¾Ð¼Ñƒ?** ÐšÐ¾Ñ€Ð¾Ñ‚ÐºÐ¸Ð¹ Ð¿Ð°ÑÐ¸Ð² Ð²Ð¸Ð¼Ð°Ð³Ð°Ñ” Ð·Ð½Ð°Ñ…Ñ–Ð´Ð½Ð¾Ð³Ð¾ Ð²Ñ–Ð´Ð¼Ñ–Ð½ÐºÑƒ, Ð¿Ð¾Ð²Ð½Ð¸Ð¹ â€” Ð½Ð°Ð·Ð¸Ð²Ð½Ð¾Ð³Ð¾.\n\n**ÐŸÐ¾Ð¼Ð¸Ð»ÐºÐ° 2: ÐÐµÐ¿Ñ€Ð°Ð²Ð¸Ð»ÑŒÐ½Ðµ ÑƒÐ·Ð³Ð¾Ð´Ð¶ÐµÐ½Ð½Ñ**\n\nâŒ ÐÐµÐ¿Ñ€Ð°Ð²Ð¸Ð»ÑŒÐ½Ð¾: Ð Ñ–ÑˆÐµÐ½Ð½Ñ Ð¿Ñ€Ð¸Ð¹Ð½ÑÑ‚Ð¸Ð¹ ÐºÐ¾Ð¼Ñ–ÑÑ–Ñ”ÑŽ.\nâœ… ÐŸÑ€Ð°Ð²Ð¸Ð»ÑŒÐ½Ð¾: Ð Ñ–ÑˆÐµÐ½Ð½Ñ Ð¿Ñ€Ð¸Ð¹Ð½ÑÑ‚Ðµ ÐºÐ¾Ð¼Ñ–ÑÑ–Ñ”ÑŽ.\n\n**Ð§Ð¾Ð¼Ñƒ?** Â«Ð Ñ–ÑˆÐµÐ½Ð½ÑÂ» â€” ÑÐµÑ€ÐµÐ´Ð½ÑŒÐ¾Ð³Ð¾ Ñ€Ð¾Ð´Ñƒ, Ñ‚Ð¾Ð¼Ñƒ Ð´Ñ–Ñ”Ð¿Ñ€Ð¸ÐºÐ¼ÐµÑ‚Ð½Ð¸Ðº â€” Â«Ð¿Ñ€Ð¸Ð¹Ð½ÑÑ‚ÐµÂ».\n\n**ÐŸÐ¾Ð¼Ð¸Ð»ÐºÐ° 3: Ð—Ð²Ð¾Ñ€Ð¾Ñ‚Ð½Ð¸Ð¹ Ð¿Ð°ÑÐ¸Ð² Ð· Ð²Ð¸ÐºÐ¾Ð½Ð°Ð²Ñ†ÐµÐ¼**\n\nâŒ ÐÐµÐ¿Ñ€Ð°Ð²Ð¸Ð»ÑŒÐ½Ð¾: Ð‘ÑƒÐ´Ð¸Ð½Ð¾Ðº Ð±ÑƒÐ´ÑƒÑ”Ñ‚ÑŒÑÑ Ñ€Ð¾Ð±Ñ–Ñ‚Ð½Ð¸ÐºÐ°Ð¼Ð¸.\nâœ… ÐŸÑ€Ð°Ð²Ð¸Ð»ÑŒÐ½Ð¾: Ð‘ÑƒÐ´Ð¸Ð½Ð¾Ðº Ð±ÑƒÐ´ÑƒÑ”Ñ‚ÑŒÑÑ. / Ð‘ÑƒÐ´Ð¸Ð½Ð¾Ðº Ð±ÑƒÐ´ÑƒÑ”Ñ‚ÑŒÑÑ (Ñ€Ð¾Ð±Ñ–Ñ‚Ð½Ð¸ÐºÐ°Ð¼Ð¸ â€” Ñ€Ñ–Ð´ÐºÐ¾).\n\n**Ð§Ð¾Ð¼Ñƒ?** Ð—Ð²Ð¾Ñ€Ð¾Ñ‚Ð½Ð¸Ð¹ Ð¿Ð°ÑÐ¸Ð² Ð·Ð°Ð·Ð²Ð¸Ñ‡Ð°Ð¹ Ð½Ðµ Ð¿Ð¾Ñ‚Ñ€ÐµÐ±ÑƒÑ” Ð²ÐºÐ°Ð·Ñ–Ð²ÐºÐ¸ Ð½Ð° Ð²Ð¸ÐºÐ¾Ð½Ð°Ð²Ñ†Ñ.\n\n**ÐŸÐ¾Ð¼Ð¸Ð»ÐºÐ° 4: ÐŸÐ»ÑƒÑ‚Ð°Ð½Ð¸Ð½Ð° Ð¼Ñ–Ð¶ Ð¿Ñ€Ð¾Ñ†ÐµÑÐ¾Ð¼ Ñ– Ñ€ÐµÐ·ÑƒÐ»ÑŒÑ‚Ð°Ñ‚Ð¾Ð¼**\n\nâŒ ÐÐµÐ¿Ñ€Ð°Ð²Ð¸Ð»ÑŒÐ½Ð¾: ÐšÐ¾Ð½Ñ‚Ñ€Ð°ÐºÑ‚ Ð¿Ñ–Ð´Ð¿Ð¸ÑÑƒÑ”Ñ‚ÑŒÑÑ Ð²Ñ‡Ð¾Ñ€Ð°.\nâœ… ÐŸÑ€Ð°Ð²Ð¸Ð»ÑŒÐ½Ð¾: ÐšÐ¾Ð½Ñ‚Ñ€Ð°ÐºÑ‚ Ð¿Ñ–Ð´Ð¿Ð¸ÑÐ°Ð½Ð¾ Ð²Ñ‡Ð¾Ñ€Ð°. / ÐšÐ¾Ð½Ñ‚Ñ€Ð°ÐºÑ‚ Ð±ÑƒÐ² Ð¿Ñ–Ð´Ð¿Ð¸ÑÐ°Ð½Ð¸Ð¹ Ð²Ñ‡Ð¾Ñ€Ð°.\n\n**Ð§Ð¾Ð¼Ñƒ?** Ð—Ð²Ð¾Ñ€Ð¾Ñ‚Ð½Ð¸Ð¹ Ð¿Ð°ÑÐ¸Ð² Ð¾Ð¿Ð¸ÑÑƒÑ” Ð¿Ñ€Ð¾Ñ†ÐµÑ, Ð½Ðµ Ð·Ð°Ð²ÐµÑ€ÑˆÐµÐ½Ñƒ Ð´Ñ–ÑŽ.\n\n> ðŸŽ¯ **Ð—Ð°Ð¿Ð°Ð¼'ÑÑ‚Ð°Ð¹Ñ‚Ðµ**\n>\n> Ð—Ð²Ð¾Ñ€Ð¾Ñ‚Ð½Ð¸Ð¹ Ð¿Ð°ÑÐ¸Ð² â‰  Ð·Ð°Ð²ÐµÑ€ÑˆÐµÐ½Ð° Ð´Ñ–Ñ. Ð¯ÐºÑ‰Ð¾ Ð´Ñ–Ñ Ð·Ð°Ð²ÐµÑ€ÑˆÐµÐ½Ð°, Ð²Ð¸ÐºÐ¾Ñ€Ð¸ÑÑ‚Ð¾Ð²ÑƒÐ¹Ñ‚Ðµ Ð¿Ð¾Ð²Ð½Ð¸Ð¹ Ð°Ð±Ð¾ ÐºÐ¾Ñ€Ð¾Ñ‚ÐºÐ¸Ð¹ Ð¿Ð°ÑÐ¸Ð².\n\n---\n\n## Ð”Ñ–Ð°Ð»Ð¾Ð³Ð¸\n\n### Ð”Ñ–Ð°Ð»Ð¾Ð³ 1: ÐÐ° Ð¿Ñ€ÐµÑ-ÐºÐ¾Ð½Ñ„ÐµÑ€ÐµÐ½Ñ†Ñ–Ñ—\n\n**Ð–ÑƒÑ€Ð½Ð°Ð»Ñ–ÑÑ‚:** ÐšÐ¾Ð»Ð¸ Ð±ÑƒÐ»Ð¾ Ð¿Ñ–Ð´Ð¿Ð¸ÑÐ°Ð½Ð¾ ÑƒÐ³Ð¾Ð´Ñƒ?\n\n**ÐŸÑ€ÐµÑ-ÑÐµÐºÑ€ÐµÑ‚Ð°Ñ€:** Ð£Ð³Ð¾Ð´Ñƒ Ð¿Ñ–Ð´Ð¿Ð¸ÑÐ°Ð½Ð¾ ÑÑŒÐ¾Ð³Ð¾Ð´Ð½Ñ– Ð²Ñ€Ð°Ð½Ñ†Ñ–. Ð”Ð¾ÐºÑƒÐ¼ÐµÐ½Ñ‚ Ð±ÑƒÐ² Ð¿Ñ–Ð´Ð³Ð¾Ñ‚Ð¾Ð²Ð»ÐµÐ½Ð¸Ð¹ Ð¿Ñ€Ð¾Ñ‚ÑÐ³Ð¾Ð¼ Ð¼Ñ–ÑÑÑ†Ñ.\n\n**Ð–ÑƒÑ€Ð½Ð°Ð»Ñ–ÑÑ‚:** ÐšÐ¸Ð¼ Ð±ÑƒÐ»Ð° Ð¿Ñ–Ð´Ð¿Ð¸ÑÐ°Ð½Ð° ÑƒÐ³Ð¾Ð´Ð°?\n\n**ÐŸÑ€ÐµÑ-ÑÐµÐºÑ€ÐµÑ‚Ð°Ñ€:** Ð£Ð³Ð¾Ð´Ð° Ð¿Ñ–Ð´Ð¿Ð¸ÑÐ°Ð½Ð° Ð¼Ñ–Ð½Ñ–ÑÑ‚Ñ€Ð°Ð¼Ð¸ Ð¾Ð±Ð¾Ñ… ÐºÑ€Ð°Ñ—Ð½. Ð—Ð°Ñ€Ð°Ð· Ð³Ð¾Ñ‚ÑƒÑŽÑ‚ÑŒÑÑ Ð´Ð¾Ð´Ð°Ñ‚ÐºÐ¾Ð²Ñ– Ð¿Ñ€Ð¾Ñ‚Ð¾ÐºÐ¾Ð»Ð¸.\n\n**Ð–ÑƒÑ€Ð½Ð°Ð»Ñ–ÑÑ‚:** ÐšÐ¾Ð»Ð¸ Ð±ÑƒÐ´Ðµ Ð¾Ð¿Ñ€Ð¸Ð»ÑŽÐ´Ð½ÐµÐ½Ð¾ Ð¿Ð¾Ð²Ð½Ð¸Ð¹ Ñ‚ÐµÐºÑÑ‚?\n\n**ÐŸÑ€ÐµÑ-ÑÐµÐºÑ€ÐµÑ‚Ð°Ñ€:** Ð¢ÐµÐºÑÑ‚ Ð±ÑƒÐ´Ðµ Ð¾Ð¿ÑƒÐ±Ð»Ñ–ÐºÐ¾Ð²Ð°Ð½Ð¾ Ð·Ð°Ð²Ñ‚Ñ€Ð°. ÐŸÐµÑ€ÐµÐºÐ»Ð°Ð´Ð¸ Ð³Ð¾Ñ‚ÑƒÑŽÑ‚ÑŒÑÑ Ð·Ð°Ñ€Ð°Ð·.\n\n### Ð”Ñ–Ð°Ð»Ð¾Ð³ 2: ÐÐ° Ð±ÑƒÐ´Ñ–Ð²Ð½Ð¸Ñ†Ñ‚Ð²Ñ–\n\n**Ð†Ð½Ð¶ÐµÐ½ÐµÑ€:** Ð¯Ðº Ð¿Ñ€Ð¾ÑÑƒÐ²Ð°Ñ”Ñ‚ÑŒÑÑ Ð±ÑƒÐ´Ñ–Ð²Ð½Ð¸Ñ†Ñ‚Ð²Ð¾?\n\n**ÐŸÑ€Ð¾Ñ€Ð°Ð±:** Ð¤ÑƒÐ½Ð´Ð°Ð¼ÐµÐ½Ñ‚ ÑƒÐ¶Ðµ Ð·Ð°Ð»Ð¸Ñ‚Ð¾. ÐŸÐµÑ€ÑˆÐ¸Ð¹ Ð¿Ð¾Ð²ÐµÑ€Ñ… Ð±ÑƒÐ´ÑƒÑ”Ñ‚ÑŒÑÑ Ð·Ð°Ñ€Ð°Ð·.\n\n**Ð†Ð½Ð¶ÐµÐ½ÐµÑ€:** Ð ÐºÐ¾Ð¼ÑƒÐ½Ñ–ÐºÐ°Ñ†Ñ–Ñ—?\n\n**ÐŸÑ€Ð¾Ñ€Ð°Ð±:** Ð•Ð»ÐµÐºÑ‚Ñ€Ð¸ÐºÑƒ Ð¿Ñ€Ð¾Ð²ÐµÐ´ÐµÐ½Ð¾, Ð²Ð¾Ð´Ð° Ð¿Ñ–Ð´ÐºÐ»ÑŽÑ‡Ð°Ñ”Ñ‚ÑŒÑÑ ÑÑŒÐ¾Ð³Ð¾Ð´Ð½Ñ–. Ð¢Ñ€ÑƒÐ±Ð¸ Ð¿Ñ€Ð¾ÐºÐ»Ð°Ð´Ð°ÑŽÑ‚ÑŒÑÑ Ð¿Ð°Ñ€Ð°Ð»ÐµÐ»ÑŒÐ½Ð¾.\n\n**Ð†Ð½Ð¶ÐµÐ½ÐµÑ€:** ÐšÐ¾Ð»Ð¸ Ð±ÑƒÐ´Ðµ Ð·Ð°Ð²ÐµÑ€ÑˆÐµÐ½Ð¾ Ð¿ÐµÑ€ÑˆÐ¸Ð¹ ÐµÑ‚Ð°Ð¿?\n\n**ÐŸÑ€Ð¾Ñ€Ð°Ð±:** Ð—Ð° Ð¿Ð»Ð°Ð½Ð¾Ð¼ Ð¿ÐµÑ€ÑˆÐ¸Ð¹ ÐµÑ‚Ð°Ð¿ Ð±ÑƒÐ´Ðµ Ð·Ð°Ð²ÐµÑ€ÑˆÐµÐ½Ð¾ Ð´Ð¾ ÐºÑ–Ð½Ñ†Ñ Ð¼Ñ–ÑÑÑ†Ñ.\n\n### Ð”Ñ–Ð°Ð»Ð¾Ð³ 3: Ð’ ÑƒÐ½Ñ–Ð²ÐµÑ€ÑÐ¸Ñ‚ÐµÑ‚Ñ–\n\n**Ð¡Ñ‚ÑƒÐ´ÐµÐ½Ñ‚:** Ð”Ðµ Ð¿ÑƒÐ±Ð»Ñ–ÐºÑƒÑŽÑ‚ÑŒÑÑ Ñ€ÐµÐ·ÑƒÐ»ÑŒÑ‚Ð°Ñ‚Ð¸ Ñ–ÑÐ¿Ð¸Ñ‚Ñ–Ð²?\n\n**Ð¡ÐµÐºÑ€ÐµÑ‚Ð°Ñ€:** Ð ÐµÐ·ÑƒÐ»ÑŒÑ‚Ð°Ñ‚Ð¸ Ð¿ÑƒÐ±Ð»Ñ–ÐºÑƒÑŽÑ‚ÑŒÑÑ Ð½Ð° ÑÐ°Ð¹Ñ‚Ñ– Ñ„Ð°ÐºÑƒÐ»ÑŒÑ‚ÐµÑ‚Ñƒ. ÐžÑ†Ñ–Ð½ÐºÐ¸ Ð²Ð¸ÑÑ‚Ð°Ð²Ð»ÑÑŽÑ‚ÑŒÑÑ Ð¿Ñ€Ð¾Ñ‚ÑÐ³Ð¾Ð¼ Ñ‚Ð¸Ð¶Ð½Ñ.\n\n**Ð¡Ñ‚ÑƒÐ´ÐµÐ½Ñ‚:** Ð ÑÐµÑ€Ñ‚Ð¸Ñ„Ñ–ÐºÐ°Ñ‚Ð¸ ÐºÐ¾Ð»Ð¸ Ð²Ð¸Ð´Ð°ÑŽÑ‚ÑŒÑÑ?\n\n**Ð¡ÐµÐºÑ€ÐµÑ‚Ð°Ñ€:** Ð¡ÐµÑ€Ñ‚Ð¸Ñ„Ñ–ÐºÐ°Ñ‚Ð¸ Ð²Ð¸Ð´Ð°ÑŽÑ‚ÑŒÑÑ Ð¿Ñ–ÑÐ»Ñ Ð·Ð°Ð²ÐµÑ€ÑˆÐµÐ½Ð½Ñ ÐºÑƒÑ€ÑÑƒ. Ð’Ð°Ð¼ Ð±ÑƒÐ´Ðµ Ð½Ð°Ð´Ñ–ÑÐ»Ð°Ð½Ð¾ Ð¿Ð¾Ð²Ñ–Ð´Ð¾Ð¼Ð»ÐµÐ½Ð½Ñ.\n\n**Ð¡Ñ‚ÑƒÐ´ÐµÐ½Ñ‚:** Ð”ÑÐºÑƒÑŽ! Ð Ñ€Ð¾Ð·ÐºÐ»Ð°Ð´ ÑƒÐ¶Ðµ ÑÐºÐ»Ð°Ð´ÐµÐ½Ð¾?\n\n**Ð¡ÐµÐºÑ€ÐµÑ‚Ð°Ñ€:** Ð¢Ð°Ðº, Ñ€Ð¾Ð·ÐºÐ»Ð°Ð´ Ð½Ð° Ð½Ð°ÑÑ‚ÑƒÐ¿Ð½Ð¸Ð¹ ÑÐµÐ¼ÐµÑÑ‚Ñ€ ÑÐºÐ»Ð°Ð´ÐµÐ½Ð¾ Ñ‚Ð° Ð·Ð°Ñ‚Ð²ÐµÑ€Ð´Ð¶ÐµÐ½Ð¾ Ð´ÐµÐºÐ°Ð½Ð¾Ð¼.\n\n### Ð”Ñ–Ð°Ð»Ð¾Ð³ 4: Ð£ Ñ€ÐµÑÑ‚Ð¾Ñ€Ð°Ð½Ñ–\n\n**ÐžÑ„Ñ–Ñ†Ñ–Ð°Ð½Ñ‚:** ÐÐ°Ñˆ Ñ…Ð»Ñ–Ð± Ð²Ð¸Ð¿Ñ–ÐºÐ°Ñ”Ñ‚ÑŒÑÑ Ñ‰Ð¾Ñ€Ð°Ð½ÐºÑƒ. Ð¡Ð¾ÑƒÑÐ¸ Ð³Ð¾Ñ‚ÑƒÑŽÑ‚ÑŒÑÑ Ð· ÑÐ²Ñ–Ð¶Ð¸Ñ… Ñ–Ð½Ð³Ñ€ÐµÐ´Ñ–Ñ”Ð½Ñ‚Ñ–Ð².\n\n**Ð“Ñ–ÑÑ‚ÑŒ:** Ð Ñ†Ñ ÑÑ‚Ñ€Ð°Ð²Ð° ÑÐº Ð³Ð¾Ñ‚ÑƒÑ”Ñ‚ÑŒÑÑ?\n\n**ÐžÑ„Ñ–Ñ†Ñ–Ð°Ð½Ñ‚:** Ð Ð¸Ð±Ð° Ð·Ð°Ð¿Ñ–ÐºÐ°Ñ”Ñ‚ÑŒÑÑ Ð² Ð´ÑƒÑ…Ð¾Ð²Ñ†Ñ– Ð· Ñ‚Ñ€Ð°Ð²Ð°Ð¼Ð¸. ÐžÐ²Ð¾Ñ‡Ñ– Ñ‚ÑƒÑˆÐºÑƒÑŽÑ‚ÑŒÑÑ Ð² Ð¾Ð»Ð¸Ð²ÐºÐ¾Ð²Ñ–Ð¹ Ð¾Ð»Ñ–Ñ—.\n\n**Ð“Ñ–ÑÑ‚ÑŒ:** Ð§ÑƒÐ´Ð¾Ð²Ð¾. Ð Ð²Ð¸Ð½Ð¾ Ð¾Ñ…Ð¾Ð»Ð¾Ð´Ð¶ÐµÐ½Ðµ?\n\n**ÐžÑ„Ñ–Ñ†Ñ–Ð°Ð½Ñ‚:** Ð¢Ð°Ðº, Ð±Ñ–Ð»Ðµ Ð²Ð¸Ð½Ð¾ Ð¾Ñ…Ð¾Ð»Ð¾Ð´Ð¶ÐµÐ½Ð¾ Ð´Ð¾ Ð¾Ð¿Ñ‚Ð¸Ð¼Ð°Ð»ÑŒÐ½Ð¾Ñ— Ñ‚ÐµÐ¼Ð¿ÐµÑ€Ð°Ñ‚ÑƒÑ€Ð¸. Ð™Ð¾Ð³Ð¾ Ð¿Ð¾Ð´Ð°Ð´ÑƒÑ‚ÑŒ Ñ€Ð°Ð·Ð¾Ð¼ Ñ–Ð· ÑÑ‚Ñ€Ð°Ð²Ð¾ÑŽ.\n\n### Ð”Ñ–Ð°Ð»Ð¾Ð³ 5: Ð£ Ð²Ð¸Ð´Ð°Ð²Ð½Ð¸Ñ†Ñ‚Ð²Ñ–\n\n**Ð ÐµÐ´Ð°ÐºÑ‚Ð¾Ñ€:** ÐÐ° ÑÐºÐ¾Ð¼Ñƒ ÐµÑ‚Ð°Ð¿Ñ– Ñ€ÑƒÐºÐ¾Ð¿Ð¸Ñ?\n\n**ÐšÐ¾Ñ€ÐµÐºÑ‚Ð¾Ñ€:** Ð¢ÐµÐºÑÑ‚ Ð²Ð¸Ñ‡Ð¸Ñ‚Ð°Ð½Ð¾, Ð¿Ð¾Ð¼Ð¸Ð»ÐºÐ¸ Ð²Ð¸Ð¿Ñ€Ð°Ð²Ð»ÐµÐ½Ð¾. Ð—Ð°Ñ€Ð°Ð· Ð²ÐµÑ€ÑÑ‚Ð°Ñ”Ñ‚ÑŒÑÑ Ð¼Ð°ÐºÐµÑ‚.\n\n**Ð ÐµÐ´Ð°ÐºÑ‚Ð¾Ñ€:** Ð Ñ–Ð»ÑŽÑÑ‚Ñ€Ð°Ñ†Ñ–Ñ—?\n\n**ÐšÐ¾Ñ€ÐµÐºÑ‚Ð¾Ñ€:** Ð†Ð»ÑŽÑÑ‚Ñ€Ð°Ñ†Ñ–Ñ— Ð·Ð°Ð¼Ð¾Ð²Ð»ÐµÐ½Ð¾, Ð°Ð»Ðµ Ñ‰Ðµ Ð½Ðµ Ð³Ð¾Ñ‚Ð¾Ð²Ñ–. Ð’Ð¾Ð½Ð¸ Ð¼Ð°Ð»ÑŽÑŽÑ‚ÑŒÑÑ Ñ…ÑƒÐ´Ð¾Ð¶Ð½Ð¸ÐºÐ¾Ð¼.\n\n**Ð ÐµÐ´Ð°ÐºÑ‚Ð¾Ñ€:** ÐšÐ¾Ð»Ð¸ ÐºÐ½Ð¸Ð³Ð° Ð±ÑƒÐ´Ðµ Ð½Ð°Ð´Ñ€ÑƒÐºÐ¾Ð²Ð°Ð½Ð°?\n\n**ÐšÐ¾Ñ€ÐµÐºÑ‚Ð¾Ñ€:** ÐšÐ½Ð¸Ð³Ð° Ð±ÑƒÐ´Ðµ Ð½Ð°Ð´Ñ€ÑƒÐºÐ¾Ð²Ð°Ð½Ð° Ð·Ð° Ð´Ð²Ð° Ñ‚Ð¸Ð¶Ð½Ñ–. ÐžÐ±ÐºÐ»Ð°Ð´Ð¸Ð½ÐºÑƒ Ð·Ð°Ñ‚Ð²ÐµÑ€Ð´Ð¶ÐµÐ½Ð¾ Ð²Ñ‡Ð¾Ñ€Ð°.\n\n> ðŸŽ¯ **Ð—Ð²ÐµÑ€Ð½Ñ–Ñ‚ÑŒ ÑƒÐ²Ð°Ð³Ñƒ**\n>\n> Ð£ Ð´Ñ–Ð°Ð»Ð¾Ð³Ð°Ñ… Ð·Ð¼Ñ–ÑˆÑƒÑŽÑ‚ÑŒÑÑ Ð²ÑÑ– Ñ‚Ñ€Ð¸ Ñ‚Ð¸Ð¿Ð¸ Ð¿Ð°ÑÐ¸Ð²Ñƒ Ð·Ð°Ð»ÐµÐ¶Ð½Ð¾ Ð²Ñ–Ð´ ÐºÐ¾Ð½Ñ‚ÐµÐºÑÑ‚Ñƒ: Ñ€ÐµÐ·ÑƒÐ»ÑŒÑ‚Ð°Ñ‚ (ÐºÐ¾Ñ€Ð¾Ñ‚ÐºÐ¸Ð¹ Ð¿Ð°ÑÐ¸Ð²), Ð¿Ñ€Ð¾Ñ†ÐµÑ (Ð·Ð²Ð¾Ñ€Ð¾Ñ‚Ð½Ð¸Ð¹ Ð¿Ð°ÑÐ¸Ð²), Ñ–Ð· Ð²Ð¸ÐºÐ¾Ð½Ð°Ð²Ñ†ÐµÐ¼ (Ð¿Ð¾Ð²Ð½Ð¸Ð¹ Ð¿Ð°ÑÐ¸Ð²).\n\n---\n\n> [!resources] Ð—Ð¾Ð²Ð½Ñ–ÑˆÐ½Ñ– Ñ€ÐµÑÑƒÑ€ÑÐ¸\n>\n> **Ð”Ð¾Ð´Ð°Ñ‚ÐºÐ¾Ð²Ñ– Ð¼Ð°Ñ‚ÐµÑ€Ñ–Ð°Ð»Ð¸:**\n> - ðŸ“– [ÐŸÐ°ÑÐ¸Ð²Ð½Ð¸Ð¹ ÑÑ‚Ð°Ð½ Ð´Ñ–Ñ”ÑÐ»Ð¾Ð²Ð°](https://uk.wikipedia.org/wiki/ÐŸÐ°ÑÐ¸Ð²Ð½Ð¸Ð¹_ÑÑ‚Ð°Ð½) â€” Ð’Ñ–ÐºÑ–Ð¿ÐµÐ´Ñ–Ñ\n> - ðŸ“º [ÐŸÐ°ÑÐ¸Ð²Ð½Ñ– ÐºÐ¾Ð½ÑÑ‚Ñ€ÑƒÐºÑ†Ñ–Ñ—](https://www.youtube.com/results?search_query=Ð¿Ð°ÑÐ¸Ð²Ð½Ñ–+ÐºÐ¾Ð½ÑÑ‚Ñ€ÑƒÐºÑ†Ñ–Ñ—+ÑƒÐºÑ€Ð°Ñ—Ð½ÑÑŒÐºÐ°) â€” Ð²Ñ–Ð´ÐµÐ¾ ÑƒÑ€Ð¾ÐºÐ¸\n> - ðŸŽ§ [Ukrainian Lessons Podcast](https://www.ukrainianlessons.com/) â€” Ð¿Ð¾Ð´ÐºÐ°ÑÑ‚ Ð´Ð»Ñ Ð²Ð¸Ð²Ñ‡ÐµÐ½Ð½Ñ ÑƒÐºÑ€Ð°Ñ—Ð½ÑÑŒÐºÐ¾Ñ—\n\n---"
      },
      {
        "id": "section-2",
        "name": "Ð’Ð¿Ñ€Ð°Ð²Ð¸",
        "nameEn": null,
        "type": "activities",
        "content": "## quiz: Ð Ð¾Ð·ÑƒÐ¼Ñ–Ð½Ð½Ñ Ð¿Ð°ÑÐ¸Ð²Ð½Ð¸Ñ… ÐºÐ¾Ð½ÑÑ‚Ñ€ÑƒÐºÑ†Ñ–Ð¹\n> ÐžÐ±ÐµÑ€Ñ–Ñ‚ÑŒ Ð¿Ñ€Ð°Ð²Ð¸Ð»ÑŒÐ½Ñƒ Ð²Ñ–Ð´Ð¿Ð¾Ð²Ñ–Ð´ÑŒ, Ð°Ð½Ð°Ð»Ñ–Ð·ÑƒÑŽÑ‡Ð¸ Ð¾ÑÐ¾Ð±Ð»Ð¸Ð²Ð¾ÑÑ‚Ñ– Ñ€Ñ–Ð·Ð½Ð¸Ñ… Ñ‚Ð¸Ð¿Ñ–Ð² Ð¿Ð°ÑÐ¸Ð²Ð½Ð¸Ñ… ÐºÐ¾Ð½ÑÑ‚Ñ€ÑƒÐºÑ†Ñ–Ð¹.\n\n1. Ð¯ÐºÐµ Ñ€ÐµÑ‡ÐµÐ½Ð½Ñ Ð²Ð¸ÐºÐ¾Ñ€Ð¸ÑÑ‚Ð¾Ð²ÑƒÑ” Ð·Ð²Ð¾Ñ€Ð¾Ñ‚Ð½Ð¸Ð¹ Ð¿Ð°ÑÐ¸Ð², Ñ‰Ð¾ Ð¿Ñ–Ð´ÐºÑ€ÐµÑÐ»ÑŽÑ” Ð¿Ñ€Ð¾Ñ†ÐµÑ, ÑÐºÐ¸Ð¹ Ñ‚Ñ€Ð¸Ð²Ð°Ñ” Ð² Ð¼Ð¾Ð¼ÐµÐ½Ñ‚ Ð¼Ð¾Ð²Ð»ÐµÐ½Ð½Ñ?\n   - [ ] ÐšÐ½Ð¸Ð³Ñƒ Ð½Ð°Ð¿Ð¸ÑÐ°Ð½Ð¾ Ð¼Ð¸Ð½ÑƒÐ»Ð¾Ð³Ð¾ Ñ€Ð¾ÐºÑƒ Ð²Ñ–Ð´Ð¾Ð¼Ð¸Ð¼ Ð¿Ð¸ÑÑŒÐ¼ÐµÐ½Ð½Ð¸ÐºÐ¾Ð¼\n   - [ ] ÐšÐ½Ð¸Ð³Ð° Ð½Ð°Ð¿Ð¸ÑÐ°Ð½Ð° Ð²Ñ–Ð´Ð¾Ð¼Ð¸Ð¼ ÑƒÐºÑ€Ð°Ñ—Ð½ÑÑŒÐºÐ¸Ð¼ Ð¿Ð¸ÑÑŒÐ¼ÐµÐ½Ð½Ð¸ÐºÐ¾Ð¼\n   - [x] ÐšÐ½Ð¸Ð³Ð° Ð¿Ð¸ÑˆÐµÑ‚ÑŒÑÑ Ð²Ð¶Ðµ Ñ‚Ñ€ÐµÑ‚Ñ–Ð¹ Ñ€Ñ–Ðº Ð¿Ð¾ÑÐ¿Ñ–Ð»ÑŒ\n   - [ ] ÐšÐ½Ð¸Ð³Ð° Ð±ÑƒÐ»Ð° Ð½Ð°Ð¿Ð¸ÑÐ°Ð½Ð° Ñ‰Ðµ Ð² Ð¼Ð¸Ð½ÑƒÐ»Ð¾Ð¼Ñƒ ÑÑ‚Ð¾Ð»Ñ–Ñ‚Ñ‚Ñ–\n   > Ð—Ð²Ð¾Ñ€Ð¾Ñ‚Ð½Ð¸Ð¹ Ð¿Ð°ÑÐ¸Ð² Â«Ð¿Ð¸ÑˆÐµÑ‚ÑŒÑÑÂ» Ð¾Ð¿Ð¸ÑÑƒÑ” Ð¿Ñ€Ð¾Ñ†ÐµÑ, Ñ‰Ð¾ Ñ‚Ñ€Ð¸Ð²Ð°Ñ”.\n\n2. Ð¯ÐºÐ° ÐºÐ¾Ð½ÑÑ‚Ñ€ÑƒÐºÑ†Ñ–Ñ Ð½Ð°Ð¹ÐºÑ€Ð°Ñ‰Ðµ Ð¿Ñ–Ð´Ñ…Ð¾Ð´Ð¸Ñ‚ÑŒ Ð´Ð»Ñ Ð¾Ñ„Ñ–Ñ†Ñ–Ð¹Ð½Ð¾Ð³Ð¾ Ð¾Ð³Ð¾Ð»Ð¾ÑˆÐµÐ½Ð½Ñ Ñ€ÐµÐ·ÑƒÐ»ÑŒÑ‚Ð°Ñ‚Ñ–Ð² Ð±ÐµÐ· Ð²ÐºÐ°Ð·Ñ–Ð²ÐºÐ¸ Ð½Ð° Ð²Ð¸ÐºÐ¾Ð½Ð°Ð²Ñ†Ñ?\n   - [ ] Ð ÐµÐ·ÑƒÐ»ÑŒÑ‚Ð°Ñ‚Ð¸ Ð¾Ð³Ð¾Ð»Ð¾ÑÐ¸Ð»Ð¸ Ñ‡Ð»ÐµÐ½Ð¸ Ð¶ÑƒÑ€Ñ– ÐºÐ¾Ð½ÐºÑƒÑ€ÑÑƒ\n   - [x] Ð ÐµÐ·ÑƒÐ»ÑŒÑ‚Ð°Ñ‚Ð¸ Ð¾Ð³Ð¾Ð»Ð¾ÑˆÐµÐ½Ð¾ Ð¾Ñ„Ñ–Ñ†Ñ–Ð¹Ð½Ð¾ Ð½Ð° Ñ†ÐµÑ€ÐµÐ¼Ð¾Ð½Ñ–Ñ— Ð½Ð°Ð³Ð¾Ñ€Ð¾Ð´Ð¶ÐµÐ½Ð½Ñ\n   - [ ] Ð ÐµÐ·ÑƒÐ»ÑŒÑ‚Ð°Ñ‚Ð¸ Ð¾Ð³Ð¾Ð»Ð¾ÑˆÑƒÑŽÑ‚ÑŒÑÑ Ñ‰Ð¾Ñ€Ð¾ÐºÑƒ Ð² Ñ†ÐµÐ¹ Ñ‡Ð°Ñ\n   - [ ] Ð ÐµÐ·ÑƒÐ»ÑŒÑ‚Ð°Ñ‚Ð¸ Ð±ÑƒÐ»Ð¸ Ð¾Ð³Ð¾Ð»Ð¾ÑˆÐµÐ½Ñ– Ð³Ð¾Ð»Ð¾Ð²Ð¾ÑŽ ÐºÐ¾Ð¼Ñ–ÑÑ–Ñ—\n   > ÐšÐ¾Ñ€Ð¾Ñ‚ÐºÐ¸Ð¹ Ð¿Ð°ÑÐ¸Ð² Â«Ð¾Ð³Ð¾Ð»Ð¾ÑˆÐµÐ½Ð¾Â» â€” Ñ‚Ð¸Ð¿Ð¾Ð²Ð¸Ð¹ Ð´Ð»Ñ Ð¾Ñ„Ñ–Ñ†Ñ–Ð¹Ð½Ð¸Ñ… Ð¿Ð¾Ð²Ñ–Ð´Ð¾Ð¼Ð»ÐµÐ½ÑŒ.\n\n3. Ð¯ÐºÐµ Ñ€ÐµÑ‡ÐµÐ½Ð½Ñ Ð´ÐµÐ¼Ð¾Ð½ÑÑ‚Ñ€ÑƒÑ” Ð¿Ñ€Ð°Ð²Ð¸Ð»ÑŒÐ½Ðµ Ð²Ð¸ÐºÐ¾Ñ€Ð¸ÑÑ‚Ð°Ð½Ð½Ñ Ð¿Ð¾Ð²Ð½Ð¾Ð³Ð¾ Ð¿Ð°ÑÐ¸Ð²Ñƒ Ð· Ð²Ð¸ÐºÐ¾Ð½Ð°Ð²Ñ†ÐµÐ¼ Ð´Ñ–Ñ— Ð² Ð¾Ñ€ÑƒÐ´Ð½Ð¾Ð¼Ñƒ Ð²Ñ–Ð´Ð¼Ñ–Ð½ÐºÑƒ?\n   - [x] ÐšÐ°Ñ€Ñ‚Ð¸Ð½Ð° Ð½Ð°Ð¼Ð°Ð»ÑŒÐ¾Ð²Ð°Ð½Ð° Ð²Ñ–Ð´Ð¾Ð¼Ð¸Ð¼ ÑƒÐºÑ€Ð°Ñ—Ð½ÑÑŒÐºÐ¸Ð¼ Ñ…ÑƒÐ´Ð¾Ð¶Ð½Ð¸ÐºÐ¾Ð¼\n   - [ ] ÐšÐ°Ñ€Ñ‚Ð¸Ð½Ñƒ Ð½Ð°Ð¼Ð°Ð»ÑŒÐ¾Ð²Ð°Ð½Ð¾ Ð² Ð¼Ð¸Ð½ÑƒÐ»Ð¾Ð¼Ñƒ ÑÑ‚Ð¾Ð»Ñ–Ñ‚Ñ‚Ñ–\n   - [ ] ÐšÐ°Ñ€Ñ‚Ð¸Ð½Ð° Ð¼Ð°Ð»ÑŽÑ”Ñ‚ÑŒÑÑ Ñ‚Ð°Ð»Ð°Ð½Ð¾Ð²Ð¸Ñ‚Ð¸Ð¼ Ñ…ÑƒÐ´Ð¾Ð¶Ð½Ð¸ÐºÐ¾Ð¼ Ð·Ð°Ñ€Ð°Ð·\n   - [ ] ÐšÐ°Ñ€Ñ‚Ð¸Ð½Ð¸ Ð¼Ð°Ð»ÑŽÐ²Ð°Ñ‚Ð¸ Ñ…ÑƒÐ´Ð¾Ð¶Ð½Ð¸ÐºÐ¾Ð¼ Ð¿Ñ€Ð°Ð²Ð¸Ð»ÑŒÐ½Ð¾\n   > ÐŸÐ¾Ð²Ð½Ð¸Ð¹ Ð¿Ð°ÑÐ¸Ð²: Ð¿Ñ–Ð´Ð¼ÐµÑ‚ + Ð´Ñ–Ñ”Ð¿Ñ€Ð¸ÐºÐ¼ÐµÑ‚Ð½Ð¸Ðº + Ð²Ð¸ÐºÐ¾Ð½Ð°Ð²ÐµÑ†ÑŒ Ð² Ð¾Ñ€ÑƒÐ´Ð½Ð¾Ð¼Ñƒ Ð²Ñ–Ð´Ð¼Ñ–Ð½ÐºÑƒ.\n\n4. Ð§Ð¸Ð¼ Ð¿Ñ€Ð¸Ð½Ñ†Ð¸Ð¿Ð¾Ð²Ð¾ Ð²Ñ–Ð´Ñ€Ñ–Ð·Ð½ÑÑ”Ñ‚ÑŒÑÑ Ð·Ð²Ð¾Ñ€Ð¾Ñ‚Ð½Ð¸Ð¹ Ð¿Ð°ÑÐ¸Ð² Ð²Ñ–Ð´ Ð¿Ð¾Ð²Ð½Ð¾Ð³Ð¾ Ð¿Ð°ÑÐ¸Ð²Ñƒ Ð² ÑÑƒÑ‡Ð°ÑÐ½Ñ–Ð¹ ÑƒÐºÑ€Ð°Ñ—Ð½ÑÑŒÐºÑ–Ð¹ Ð¼Ð¾Ð²Ñ–?\n   - [ ] Ð—Ð²Ð¾Ñ€Ð¾Ñ‚Ð½Ð¸Ð¹ Ð¿Ð°ÑÐ¸Ð² Ð·Ð°Ð²Ð¶Ð´Ð¸ Ð²Ð¸Ð¼Ð°Ð³Ð°Ñ” Ð²ÐºÐ°Ð·Ñ–Ð²ÐºÐ¸ Ð½Ð° Ð²Ð¸ÐºÐ¾Ð½Ð°Ð²Ñ†Ñ\n   - [ ] Ð—Ð²Ð¾Ñ€Ð¾Ñ‚Ð½Ð¸Ð¹ Ð¿Ð°ÑÐ¸Ð² Ð²Ð¸ÐºÐ¾Ñ€Ð¸ÑÑ‚Ð¾Ð²ÑƒÑ”Ñ‚ÑŒÑÑ Ñ‚Ñ–Ð»ÑŒÐºÐ¸ Ð² Ð¼Ð¸Ð½ÑƒÐ»Ð¾Ð¼Ñƒ Ñ‡Ð°ÑÑ–\n   - [x] Ð—Ð²Ð¾Ñ€Ð¾Ñ‚Ð½Ð¸Ð¹ Ð¿Ð°ÑÐ¸Ð² Ð¿Ñ–Ð´ÐºÑ€ÐµÑÐ»ÑŽÑ” Ð¿Ñ€Ð¾Ñ†ÐµÑ, Ð° Ð½Ðµ Ð·Ð°Ð²ÐµÑ€ÑˆÐµÐ½Ð¸Ð¹ Ñ€ÐµÐ·ÑƒÐ»ÑŒÑ‚Ð°Ñ‚\n   - [ ] Ð—Ð²Ð¾Ñ€Ð¾Ñ‚Ð½Ð¸Ð¹ Ð¿Ð°ÑÐ¸Ð² Ð½Ðµ Ð¼Ð¾Ð¶Ðµ Ð²Ð¶Ð¸Ð²Ð°Ñ‚Ð¸ÑÑ Ð· Ð½ÐµÐ¶Ð¸Ð²Ð¸Ð¼Ð¸ Ð¿Ñ–Ð´Ð¼ÐµÑ‚Ð°Ð¼Ð¸\n   > Ð”Ñ–Ñ”ÑÐ»Ð¾Ð²Ð° Ð· -ÑÑ Ð¾Ð¿Ð¸ÑÑƒÑŽÑ‚ÑŒ Ð¿Ñ€Ð¾Ñ†ÐµÑ: Â«Ð±ÑƒÐ´ÑƒÑ”Ñ‚ÑŒÑÑÂ» (Ð¿Ñ€Ð¾Ñ†ÐµÑ) vs Â«Ð·Ð±ÑƒÐ´Ð¾Ð²Ð°Ð½Ð¾Â» (Ñ€ÐµÐ·ÑƒÐ»ÑŒÑ‚Ð°Ñ‚).\n\n5. Ð¯ÐºÐµ Ñ€ÐµÑ‡ÐµÐ½Ð½Ñ Ð³Ñ€Ð°Ð¼Ð°Ñ‚Ð¸Ñ‡Ð½Ð¾ Ð½ÐµÐ¿Ñ€Ð°Ð²Ð¸Ð»ÑŒÐ½Ðµ Ñ‡ÐµÑ€ÐµÐ· Ð½ÐµÐ²Ñ–Ð´Ð¿Ð¾Ð²Ñ–Ð´Ð½Ñ–ÑÑ‚ÑŒ Ð¼Ñ–Ð¶ Ñ‚Ð¸Ð¿Ð¾Ð¼ Ð¿Ð°ÑÐ¸Ð²Ñƒ Ñ‚Ð° Ñ‡Ð°ÑÐ¾Ð²Ð¸Ð¼ ÐºÐ¾Ð½Ñ‚ÐµÐºÑÑ‚Ð¾Ð¼?\n   - [ ] Ð”Ð¾ÐºÑƒÐ¼ÐµÐ½Ñ‚ Ð¿Ñ–Ð´Ð¿Ð¸ÑÐ°Ð½Ð¾ Ð¾Ð±Ð¾Ð¼Ð° ÑÑ‚Ð¾Ñ€Ð¾Ð½Ð°Ð¼Ð¸ Ð²Ñ‡Ð¾Ñ€Ð° Ð²Ð²ÐµÑ‡ÐµÑ€Ñ–\n   - [x] ÐšÐ¾Ð½Ñ‚Ñ€Ð°ÐºÑ‚ Ð¿Ñ–Ð´Ð¿Ð¸ÑÑƒÑ”Ñ‚ÑŒÑÑ Ð¼Ð¸Ð½ÑƒÐ»Ð¾Ð³Ð¾ Ñ‚Ð¸Ð¶Ð½Ñ Ð´Ð¸Ñ€ÐµÐºÑ‚Ð¾Ñ€Ð¾Ð¼ ÐºÐ¾Ð¼Ð¿Ð°Ð½Ñ–Ñ—\n   - [ ] Ð£Ð³Ð¾Ð´Ð° Ð¿Ñ–Ð´Ð¿Ð¸ÑÐ°Ð½Ð° Ð¼Ñ–Ð½Ñ–ÑÑ‚Ñ€Ð°Ð¼Ð¸ Ð·Ð°ÐºÐ¾Ñ€Ð´Ð¾Ð½Ð½Ð¸Ñ… ÑÐ¿Ñ€Ð°Ð²\n   - [ ] Ð”Ð¾Ð³Ð¾Ð²Ð¾Ñ€Ð¸ Ð¿Ñ–Ð´Ð¿Ð¸ÑÑƒÑŽÑ‚ÑŒÑÑ ÐµÐ»ÐµÐºÑ‚Ñ€Ð¾Ð½Ð½Ð¸Ð¼ Ð¿Ñ–Ð´Ð¿Ð¸ÑÐ¾Ð¼ Ñ‰Ð¾Ð´Ð½Ñ\n   > Â«ÐŸÑ–Ð´Ð¿Ð¸ÑÑƒÑ”Ñ‚ÑŒÑÑÂ» â€” Ð¿Ñ€Ð¾Ñ†ÐµÑ, Â«Ð¼Ð¸Ð½ÑƒÐ»Ð¾Ð³Ð¾ Ñ‚Ð¸Ð¶Ð½ÑÂ» â€” Ð·Ð°Ð²ÐµÑ€ÑˆÐµÐ½Ð° Ð´Ñ–Ñ; Ð½ÐµÑÑƒÐ¼Ñ–ÑÐ½Ñ–.\n\n6. Ð¯ÐºÐ° Ñ„Ð¾Ñ€Ð¼Ð° Ð¿Ñ€Ð°Ð²Ð¸Ð»ÑŒÐ½Ð° Ð´Ð»Ñ Ð²Ð¸Ñ€Ð°Ð¶ÐµÐ½Ð½Ñ Ð·Ð°Ð²ÐµÑ€ÑˆÐµÐ½Ð¾Ñ— Ð´Ñ–Ñ— Ð² Ð¼Ð¸Ð½ÑƒÐ»Ð¾Ð¼Ñƒ Ð±ÐµÐ· Ð²ÐºÐ°Ð·Ñ–Ð²ÐºÐ¸ Ð½Ð° Ð²Ð¸ÐºÐ¾Ð½Ð°Ð²Ñ†Ñ?\n   - [ ] Ð‘ÑƒÐ´Ð¸Ð½Ð¾Ðº Ð±ÑƒÐ´ÑƒÐ²Ð°Ð²ÑÑ Ð¿Ñ€Ð¾Ñ‚ÑÐ³Ð¾Ð¼ Ñ‚Ñ€ÑŒÐ¾Ñ… Ñ€Ð¾ÐºÑ–Ð²\n   - [ ] Ð‘ÑƒÐ´Ð¸Ð½Ð¾Ðº Ð±ÑƒÐ´ÑƒÑ”Ñ‚ÑŒÑÑ Ð²Ð¶Ðµ Ð´Ð¾Ð²Ð³Ð¸Ð¹ Ñ‡Ð°Ñ\n   - [x] Ð‘ÑƒÐ´Ð¸Ð½Ð¾Ðº Ð·Ð±ÑƒÐ´Ð¾Ð²Ð°Ð½Ð¾ Ð¼Ð¸Ð½ÑƒÐ»Ð¾Ð³Ð¾ Ñ€Ð¾ÐºÑƒ ÑƒÑÐ¿Ñ–ÑˆÐ½Ð¾\n   - [ ] Ð‘ÑƒÐ´Ð¸Ð½Ð¾Ðº Ð±ÑƒÐ´Ð¾Ð²Ð°Ð½Ð¸Ð¹ Ð¿Ñ€Ð¾Ñ‚ÑÐ³Ð¾Ð¼ Ð±Ð°Ð³Ð°Ñ‚ÑŒÐ¾Ñ… Ñ€Ð¾ÐºÑ–Ð²\n   > ÐšÐ¾Ñ€Ð¾Ñ‚ÐºÐ¸Ð¹ Ð¿Ð°ÑÐ¸Ð² Â«Ð·Ð±ÑƒÐ´Ð¾Ð²Ð°Ð½Ð¾Â» Ð¿Ñ–Ð´ÐºÑ€ÐµÑÐ»ÑŽÑ” Ð·Ð°Ð²ÐµÑ€ÑˆÐµÐ½Ð¸Ð¹ Ñ€ÐµÐ·ÑƒÐ»ÑŒÑ‚Ð°Ñ‚.\n\n7. Ð¯ÐºÐµ Ñ€ÐµÑ‡ÐµÐ½Ð½Ñ Ð¿Ñ€Ð°Ð²Ð¸Ð»ÑŒÐ½Ð¾ Ð²Ð¸ÐºÐ¾Ñ€Ð¸ÑÑ‚Ð¾Ð²ÑƒÑ” Ð·Ð²Ð¾Ñ€Ð¾Ñ‚Ð½Ð¸Ð¹ Ð¿Ð°ÑÐ¸Ð² Ð´Ð»Ñ Ð¾Ð¿Ð¸ÑÑƒ Ñ€ÐµÐ³ÑƒÐ»ÑÑ€Ð½Ð¾Ð³Ð¾ Ð¿Ñ€Ð¾Ñ†ÐµÑÑƒ Ð² Ñ‰Ð¾Ð´ÐµÐ½Ð½Ð¾Ð¼Ñƒ Ð¶Ð¸Ñ‚Ñ‚Ñ–?\n   - [ ] Ð¥Ð»Ñ–Ð± Ð²Ð¸Ð¿ÐµÑ‡ÐµÐ½Ð¾ ÐºÐ¾Ð¶Ð½Ð¾Ð³Ð¾ Ñ€Ð°Ð½ÐºÑƒ Ð² Ð¿ÐµÐºÐ°Ñ€Ð½Ñ–\n   - [x] Ð¥Ð»Ñ–Ð± Ð²Ð¸Ð¿Ñ–ÐºÐ°Ñ”Ñ‚ÑŒÑÑ Ñ‰Ð¾Ñ€Ð°Ð½ÐºÑƒ Ð¾ Ð¿'ÑÑ‚Ñ–Ð¹ Ð³Ð¾Ð´Ð¸Ð½Ñ–\n   - [ ] Ð¥Ð»Ñ–Ð± Ð²Ð¸Ð¿ÐµÑ‡ÐµÐ½Ð¸Ð¹ Ð¿ÐµÐºÐ°Ñ€ÐµÐ¼ Ñ‰Ð¾Ñ€Ð°Ð½ÐºÑƒ Ð²Ñ‡Ð°ÑÐ½Ð¾\n   - [ ] Ð¥Ð»Ñ–Ð± Ð²Ð¸Ð¿Ñ–ÐºÐ°Ð½Ð¾ Ð¿Ñ€Ð¾Ñ‚ÑÐ³Ð¾Ð¼ Ð±Ð°Ð³Ð°Ñ‚ÑŒÐ¾Ñ… ÑÑ‚Ð¾Ð»Ñ–Ñ‚ÑŒ\n   > Â«Ð’Ð¸Ð¿Ñ–ÐºÐ°Ñ”Ñ‚ÑŒÑÑ Ñ‰Ð¾Ñ€Ð°Ð½ÐºÑƒÂ» â€” Ñ€ÐµÐ³ÑƒÐ»ÑÑ€Ð½Ð¸Ð¹ Ð¿Ñ€Ð¾Ñ†ÐµÑ, Ð·Ð²Ð¾Ñ€Ð¾Ñ‚Ð½Ð¸Ð¹ Ð¿Ð°ÑÐ¸Ð².\n\n8. Ð¯ÐºÐ° Ñ‚Ñ€Ð°Ð½ÑÑ„Ð¾Ñ€Ð¼Ð°Ñ†Ñ–Ñ Ð°ÐºÑ‚Ð¸Ð²Ð½Ð¾Ð³Ð¾ Ñ€ÐµÑ‡ÐµÐ½Ð½Ñ Â«Ð¡Ñ‚ÑƒÐ´ÐµÐ½Ñ‚Ð¸ Ð½Ð°Ð¿Ð¸ÑÐ°Ð»Ð¸ ÐµÑÐµÂ» Ð² Ð¿Ð°ÑÐ¸Ð²Ð½Ðµ Ñ” Ð³Ñ€Ð°Ð¼Ð°Ñ‚Ð¸Ñ‡Ð½Ð¾ Ð¿Ñ€Ð°Ð²Ð¸Ð»ÑŒÐ½Ð¾ÑŽ?\n   - [ ] Ð¡Ñ‚ÑƒÐ´ÐµÐ½Ñ‚Ð¸ Ð½Ð°Ð¿Ð¸ÑÐ°Ð»Ð¸ ÐµÑÐµ â†’ Ð•ÑÐµ Ð½Ð°Ð¿Ð¸ÑÐ°Ð»Ð¾ÑÑ ÑÑ‚ÑƒÐ´ÐµÐ½Ñ‚Ð°Ð¼Ð¸\n   - [x] Ð¡Ñ‚ÑƒÐ´ÐµÐ½Ñ‚Ð¸ Ð½Ð°Ð¿Ð¸ÑÐ°Ð»Ð¸ ÐµÑÐµ â†’ Ð•ÑÐµ Ð½Ð°Ð¿Ð¸ÑÐ°Ð½Ðµ ÑÑ‚ÑƒÐ´ÐµÐ½Ñ‚Ð°Ð¼Ð¸\n   - [ ] Ð¡Ñ‚ÑƒÐ´ÐµÐ½Ñ‚Ð¸ Ð½Ð°Ð¿Ð¸ÑÐ°Ð»Ð¸ ÐµÑÐµ â†’ Ð•ÑÐµ Ð½Ð°Ð¿Ð¸ÑÐ°Ð»Ð¸ÑÑŒ ÑÑ‚ÑƒÐ´ÐµÐ½Ñ‚Ð°Ð¼Ð¸\n   - [ ] Ð¡Ñ‚ÑƒÐ´ÐµÐ½Ñ‚Ð¸ Ð½Ð°Ð¿Ð¸ÑÐ°Ð»Ð¸ ÐµÑÐµ â†’ Ð•ÑÐµ Ð½Ð°Ð¿Ð¸ÑÐ°Ð½Ð¸Ð¹ ÑÑ‚ÑƒÐ´ÐµÐ½Ñ‚Ð°Ð¼Ð¸\n   > ÐŸÐ¾Ð²Ð½Ð¸Ð¹ Ð¿Ð°ÑÐ¸Ð²: Â«ÐµÑÐµÂ» (Ñ.Ñ€.) â†’ Â«Ð½Ð°Ð¿Ð¸ÑÐ°Ð½ÐµÂ» (Ñ.Ñ€.) + Ð¾Ñ€ÑƒÐ´Ð½Ð¸Ð¹ Ð²Ñ–Ð´Ð¼Ñ–Ð½Ð¾Ðº.\n\n## match-up: ÐÐºÑ‚Ð¸Ð²Ð½Ð¸Ð¹ Ñ– Ð¿Ð°ÑÐ¸Ð²Ð½Ð¸Ð¹ ÑÑ‚Ð°Ð½\n> ÐŸÐ¾Ñ”Ð´Ð½Ð°Ð¹Ñ‚Ðµ Ð°ÐºÑ‚Ð¸Ð²Ð½Ðµ Ñ€ÐµÑ‡ÐµÐ½Ð½Ñ Ð· Ð¿Ñ€Ð°Ð²Ð¸Ð»ÑŒÐ½Ð¾ÑŽ Ð¿Ð°ÑÐ¸Ð²Ð½Ð¾ÑŽ Ñ„Ð¾Ñ€Ð¼Ð¾ÑŽ.\n\n| ÐÐºÑ‚Ð¸Ð²Ð½Ðµ Ñ€ÐµÑ‡ÐµÐ½Ð½Ñ | ÐŸÐ°ÑÐ¸Ð²Ð½Ðµ Ñ€ÐµÑ‡ÐµÐ½Ð½Ñ |\n|-----------------|-----------------|\n| ÐÐ²Ñ‚Ð¾Ñ€ Ð½Ð°Ð¿Ð¸ÑÐ°Ð² Ñ€Ð¾Ð¼Ð°Ð½. | Ð Ð¾Ð¼Ð°Ð½ Ð½Ð°Ð¿Ð¸ÑÐ°Ð½Ð¸Ð¹ Ð°Ð²Ñ‚Ð¾Ñ€Ð¾Ð¼. |\n| ÐšÐ¾Ð¼Ñ–ÑÑ–Ñ Ð¿Ñ€Ð¸Ð¹Ð½ÑÐ»Ð° Ñ€Ñ–ÑˆÐµÐ½Ð½Ñ. | Ð Ñ–ÑˆÐµÐ½Ð½Ñ Ð¿Ñ€Ð¸Ð¹Ð½ÑÑ‚Ðµ ÐºÐ¾Ð¼Ñ–ÑÑ–Ñ”ÑŽ. |\n| Ð¥Ñ‚Ð¾ÑÑŒ Ð²Ñ–Ð´ÐºÑ€Ð¸Ð² Ð´Ð²ÐµÑ€Ñ–. | Ð”Ð²ÐµÑ€Ñ– Ð²Ñ–Ð´ÐºÑ€Ð¸Ñ‚Ð¾. |\n| Ð Ð¾Ð±Ñ–Ñ‚Ð½Ð¸ÐºÐ¸ Ð±ÑƒÐ´ÑƒÑŽÑ‚ÑŒ Ð¼Ñ–ÑÑ‚. | ÐœÑ–ÑÑ‚ Ð±ÑƒÐ´ÑƒÑ”Ñ‚ÑŒÑÑ. |\n| ÐŸÐµÐºÐ°Ñ€ Ð²Ð¸Ð¿Ñ–ÐºÐ°Ñ” Ñ…Ð»Ñ–Ð±. | Ð¥Ð»Ñ–Ð± Ð²Ð¸Ð¿Ñ–ÐºÐ°Ñ”Ñ‚ÑŒÑÑ. |\n| Ð”Ð¸Ñ€ÐµÐºÑ‚Ð¾Ñ€ Ð¿Ñ–Ð´Ð¿Ð¸ÑÐ°Ð² ÐºÐ¾Ð½Ñ‚Ñ€Ð°ÐºÑ‚. | ÐšÐ¾Ð½Ñ‚Ñ€Ð°ÐºÑ‚ Ð¿Ñ–Ð´Ð¿Ð¸ÑÐ°Ð½Ð¸Ð¹ Ð´Ð¸Ñ€ÐµÐºÑ‚Ð¾Ñ€Ð¾Ð¼. |\n| Ð¥Ñ‚Ð¾ÑÑŒ Ð²Ð¸ÐºÐ¾Ð½Ð°Ð² Ñ€Ð¾Ð±Ð¾Ñ‚Ñƒ. | Ð Ð¾Ð±Ð¾Ñ‚Ñƒ Ð²Ð¸ÐºÐ¾Ð½Ð°Ð½Ð¾. |\n| Ð’Ñ‡ÐµÐ½Ñ– Ð´Ð¾ÑÐ»Ñ–Ð´Ð¶ÑƒÑŽÑ‚ÑŒ Ð¿Ñ€Ð¾Ð±Ð»ÐµÐ¼Ñƒ. | ÐŸÑ€Ð¾Ð±Ð»ÐµÐ¼Ð° Ð´Ð¾ÑÐ»Ñ–Ð´Ð¶ÑƒÑ”Ñ‚ÑŒÑÑ. |\n| Ð¥ÑƒÐ´Ð¾Ð¶Ð½Ð¸Ðº Ð½Ð°Ð¼Ð°Ð»ÑŽÐ²Ð°Ð² ÐºÐ°Ñ€Ñ‚Ð¸Ð½Ñƒ. | ÐšÐ°Ñ€Ñ‚Ð¸Ð½Ð° Ð½Ð°Ð¼Ð°Ð»ÑŒÐ¾Ð²Ð°Ð½Ð° Ñ…ÑƒÐ´Ð¾Ð¶Ð½Ð¸ÐºÐ¾Ð¼. |\n| Ð¥Ñ‚Ð¾ÑÑŒ Ð½Ð°Ð´Ñ–ÑÐ»Ð°Ð² Ð»Ð¸ÑÑ‚Ð°. | Ð›Ð¸ÑÑ‚Ð° Ð½Ð°Ð´Ñ–ÑÐ»Ð°Ð½Ð¾. |\n| Ð¡Ñ‚ÑƒÐ´ÐµÐ½Ñ‚Ð¸ Ð³Ð¾Ñ‚ÑƒÑŽÑ‚ÑŒ Ð¿Ñ€Ð¾ÐµÐºÑ‚. | ÐŸÑ€Ð¾ÐµÐºÑ‚ Ð³Ð¾Ñ‚ÑƒÑ”Ñ‚ÑŒÑÑ. |\n| Ð–ÑƒÑ€Ñ– Ð²Ð¸Ð·Ð½Ð°Ñ‡Ð¸Ð»Ð¾ Ð¿ÐµÑ€ÐµÐ¼Ð¾Ð¶Ñ†Ñ. | ÐŸÐµÑ€ÐµÐ¼Ð¾Ð¶Ñ†Ñ Ð²Ð¸Ð·Ð½Ð°Ñ‡ÐµÐ½Ð¾. |\n\n## fill-in: Ð’Ð¸Ð±ÐµÑ€Ñ–Ñ‚ÑŒ Ð¿Ñ€Ð°Ð²Ð¸Ð»ÑŒÐ½Ñƒ Ñ„Ð¾Ñ€Ð¼Ñƒ\n> Ð—Ð°Ð¿Ð¾Ð²Ð½Ñ–Ñ‚ÑŒ Ð¿Ñ€Ð¾Ð¿ÑƒÑÐºÐ¸ Ð¿Ñ€Ð°Ð²Ð¸Ð»ÑŒÐ½Ð¾ÑŽ Ð¿Ð°ÑÐ¸Ð²Ð½Ð¾ÑŽ ÐºÐ¾Ð½ÑÑ‚Ñ€ÑƒÐºÑ†Ñ–Ñ”ÑŽ.\n\n1. ÐšÐ½Ð¸Ð³Ð° ___ Ð²Ñ–Ð´Ð¾Ð¼Ð¸Ð¼ Ð¿Ð¸ÑÑŒÐ¼ÐµÐ½Ð½Ð¸ÐºÐ¾Ð¼ Ð¼Ð¸Ð½ÑƒÐ»Ð¾Ð³Ð¾ ÑÑ‚Ð¾Ð»Ñ–Ñ‚Ñ‚Ñ. (Ð½Ð°Ð¿Ð¸ÑÐ°Ð½Ð° / Ð½Ð°Ð¿Ð¸ÑÐ°Ð½Ð¾ / Ð¿Ð¸ÑˆÐµÑ‚ÑŒÑÑ)\n   > [!answer] Ð½Ð°Ð¿Ð¸ÑÐ°Ð½Ð°\n   > [!options] Ð½Ð°Ð¿Ð¸ÑÐ°Ð½Ð° | Ð½Ð°Ð¿Ð¸ÑÐ°Ð½Ð¾ | Ð¿Ð¸ÑˆÐµÑ‚ÑŒÑÑ | Ð¿Ð¸ÑÐ°Ð»Ð°ÑÑ\n\n2. Ð Ñ–ÑˆÐµÐ½Ð½Ñ ___ Ð¾Ð´Ð½Ð¾Ð³Ð¾Ð»Ð¾ÑÐ½Ð¾ Ð½Ð° Ð·Ð°ÑÑ–Ð´Ð°Ð½Ð½Ñ– ÐºÐ¾Ð¼Ñ–ÑÑ–Ñ—. (Ð¿Ñ€Ð¸Ð¹Ð½ÑÑ‚Ð¾ / Ð¿Ñ€Ð¸Ð¹Ð½ÑÑ‚Ðµ / Ð¿Ñ€Ð¸Ð¹Ð¼Ð°Ñ”Ñ‚ÑŒÑÑ)\n   > [!answer] Ð¿Ñ€Ð¸Ð¹Ð½ÑÑ‚Ð¾\n   > [!options] Ð¿Ñ€Ð¸Ð¹Ð½ÑÑ‚Ð¾ | Ð¿Ñ€Ð¸Ð¹Ð½ÑÑ‚Ðµ | Ð¿Ñ€Ð¸Ð¹Ð¼Ð°Ñ”Ñ‚ÑŒÑÑ | Ð¿Ñ€Ð¸Ð¹Ð½ÑÑ‚Ð¸Ð¹\n\n3. Ð¥Ð»Ñ–Ð± ___ Ñ‰Ð¾Ñ€Ð°Ð½ÐºÑƒ Ð¾ Ð¿'ÑÑ‚Ñ–Ð¹ Ð³Ð¾Ð´Ð¸Ð½Ñ–. (Ð²Ð¸Ð¿ÐµÑ‡ÐµÐ½Ð¾ / Ð²Ð¸Ð¿ÐµÑ‡ÐµÐ½Ð¸Ð¹ / Ð²Ð¸Ð¿Ñ–ÐºÐ°Ñ”Ñ‚ÑŒÑÑ)\n   > [!answer] Ð²Ð¸Ð¿Ñ–ÐºÐ°Ñ”Ñ‚ÑŒÑÑ\n   > [!options] Ð²Ð¸Ð¿Ñ–ÐºÐ°Ñ”Ñ‚ÑŒÑÑ | Ð²Ð¸Ð¿ÐµÑ‡ÐµÐ½Ð¾ | Ð²Ð¸Ð¿ÐµÑ‡ÐµÐ½Ð¸Ð¹ | Ð²Ð¸Ð¿ÐµÑ‡ÐµÐ½Ð°\n\n4. Ð”Ð¾ÐºÑƒÐ¼ÐµÐ½Ñ‚Ð¸ ___ ÑÐµÐºÑ€ÐµÑ‚Ð°Ñ€ÐµÐ¼ Ñ– Ð½Ð°Ð´Ñ–ÑÐ»Ð°Ð½Ñ– Ð´Ð¸Ñ€ÐµÐºÑ‚Ð¾Ñ€Ñƒ. (Ð¿Ñ–Ð´Ð³Ð¾Ñ‚Ð¾Ð²Ð»ÐµÐ½Ð¾ / Ð¿Ñ–Ð´Ð³Ð¾Ñ‚Ð¾Ð²Ð»ÐµÐ½Ñ– / Ð³Ð¾Ñ‚ÑƒÑŽÑ‚ÑŒÑÑ)\n   > [!answer] Ð¿Ñ–Ð´Ð³Ð¾Ñ‚Ð¾Ð²Ð»ÐµÐ½Ñ–\n   > [!options] Ð¿Ñ–Ð´Ð³Ð¾Ñ‚Ð¾Ð²Ð»ÐµÐ½Ñ– | Ð¿Ñ–Ð´Ð³Ð¾Ñ‚Ð¾Ð²Ð»ÐµÐ½Ð¾ | Ð³Ð¾Ñ‚ÑƒÑŽÑ‚ÑŒÑÑ | Ð³Ð¾Ñ‚ÑƒÐ²Ð°Ð»Ð¸ÑÑ\n\n5. Ð—Ð°Ñ€Ð°Ð· ___ Ð½Ð¾Ð²Ð¸Ð¹ Ð¼Ñ–ÑÑ‚ Ñ‡ÐµÑ€ÐµÐ· Ñ€Ñ–Ñ‡ÐºÑƒ. (Ð·Ð±ÑƒÐ´Ð¾Ð²Ð°Ð½Ð¾ / Ð·Ð±ÑƒÐ´Ð¾Ð²Ð°Ð½Ð¸Ð¹ / Ð±ÑƒÐ´ÑƒÑ”Ñ‚ÑŒÑÑ)\n   > [!answer] Ð±ÑƒÐ´ÑƒÑ”Ñ‚ÑŒÑÑ\n   > [!options] Ð±ÑƒÐ´ÑƒÑ”Ñ‚ÑŒÑÑ | Ð·Ð±ÑƒÐ´Ð¾Ð²Ð°Ð½Ð¾ | Ð·Ð±ÑƒÐ´Ð¾Ð²Ð°Ð½Ð¸Ð¹ | Ð±ÑƒÐ´ÑƒÐ²Ð°Ð²ÑÑ\n\n6. Ð£ÑÑ– ÐºÐ²Ð¸Ñ‚ÐºÐ¸ ___ Ñ‰Ðµ Ð¼Ð¸Ð½ÑƒÐ»Ð¾Ð³Ð¾ Ñ‚Ð¸Ð¶Ð½Ñ. (Ð¿Ñ€Ð¾Ð´Ð°Ð½Ð¾ / Ð¿Ñ€Ð¾Ð´Ð°Ð½Ñ– / Ð¿Ñ€Ð¾Ð´Ð°ÑŽÑ‚ÑŒÑÑ)\n   > [!answer] Ð¿Ñ€Ð¾Ð´Ð°Ð½Ð¾\n   > [!options] Ð¿Ñ€Ð¾Ð´Ð°Ð½Ð¾ | Ð¿Ñ€Ð¾Ð´Ð°Ð½Ñ– | Ð¿Ñ€Ð¾Ð´Ð°ÑŽÑ‚ÑŒÑÑ | Ð¿Ñ€Ð¾Ð´Ð°Ð²Ð°Ð»Ð¸ÑÑ\n\n7. Ð¦Ñ ÑÑ‚Ñ€Ð°Ð²Ð° ___ Ð· ÑÐ²Ñ–Ð¶Ð¸Ñ… Ð¼Ñ–ÑÑ†ÐµÐ²Ð¸Ñ… Ñ–Ð½Ð³Ñ€ÐµÐ´Ñ–Ñ”Ð½Ñ‚Ñ–Ð². (Ð¿Ñ€Ð¸Ð³Ð¾Ñ‚Ð¾Ð²Ð»ÐµÐ½Ð¾ / Ð¿Ñ€Ð¸Ð³Ð¾Ñ‚Ð¾Ð²Ð»ÐµÐ½Ð° / Ð³Ð¾Ñ‚ÑƒÑ”Ñ‚ÑŒÑÑ)\n   > [!answer] Ð³Ð¾Ñ‚ÑƒÑ”Ñ‚ÑŒÑÑ\n   > [!options] Ð³Ð¾Ñ‚ÑƒÑ”Ñ‚ÑŒÑÑ | Ð¿Ñ€Ð¸Ð³Ð¾Ñ‚Ð¾Ð²Ð»ÐµÐ½Ð¾ | Ð¿Ñ€Ð¸Ð³Ð¾Ñ‚Ð¾Ð²Ð»ÐµÐ½Ð° | Ð³Ð¾Ñ‚ÑƒÐ²Ð°Ð»Ð°ÑÑ\n\n8. Ð—Ð²Ñ–Ñ‚ ___ Ð°Ð½Ð°Ð»Ñ–Ñ‚Ð¸ÐºÐ°Ð¼Ð¸ Ñ‚Ð° Ð¿Ð¾Ð´Ð°Ð½Ð¾ ÐºÐµÑ€Ñ–Ð²Ð½Ð¸Ñ†Ñ‚Ð²Ñƒ. (Ð¿Ñ–Ð´Ð³Ð¾Ñ‚Ð¾Ð²Ð»ÐµÐ½Ð¾ / Ð¿Ñ–Ð´Ð³Ð¾Ñ‚Ð¾Ð²Ð»ÐµÐ½Ð¸Ð¹ / Ð³Ð¾Ñ‚ÑƒÑ”Ñ‚ÑŒÑÑ)\n   > [!answer] Ð¿Ñ–Ð´Ð³Ð¾Ñ‚Ð¾Ð²Ð»ÐµÐ½Ð¸Ð¹\n   > [!options] Ð¿Ñ–Ð´Ð³Ð¾Ñ‚Ð¾Ð²Ð»ÐµÐ½Ð¸Ð¹ | Ð¿Ñ–Ð´Ð³Ð¾Ñ‚Ð¾Ð²Ð»ÐµÐ½Ð¾ | Ð³Ð¾Ñ‚ÑƒÑ”Ñ‚ÑŒÑÑ | Ð³Ð¾Ñ‚ÑƒÐ²Ð°Ð²ÑÑ\n\n## true-false: ÐŸÑ€Ð°Ð²Ð¸Ð»Ð° Ð¿Ð°ÑÐ¸Ð²Ð½Ð¸Ñ… ÐºÐ¾Ð½ÑÑ‚Ñ€ÑƒÐºÑ†Ñ–Ð¹\n> Ð’Ð¸Ð·Ð½Ð°Ñ‡Ñ‚Ðµ, Ñ‡Ð¸ Ð¿Ñ€Ð°Ð²Ð¸Ð»ÑŒÐ½Ðµ ÐºÐ¾Ð¶Ð½Ðµ Ñ‚Ð²ÐµÑ€Ð´Ð¶ÐµÐ½Ð½Ñ.\n\n- [x] ÐŸÐ¾Ð²Ð½Ð¸Ð¹ Ð¿Ð°ÑÐ¸Ð² Ð²Ð¸Ð¼Ð°Ð³Ð°Ñ” ÑƒÐ·Ð³Ð¾Ð´Ð¶ÐµÐ½Ð½Ñ Ð´Ñ–Ñ”Ð¿Ñ€Ð¸ÐºÐ¼ÐµÑ‚Ð½Ð¸ÐºÐ° Ð· Ð¿Ñ–Ð´Ð¼ÐµÑ‚Ð¾Ð¼ Ñƒ Ñ€Ð¾Ð´Ñ– Ñ‚Ð° Ñ‡Ð¸ÑÐ»Ñ–.\n  > ÐŸÑ€Ð°Ð²Ð¸Ð»ÑŒÐ½Ð¾! ÐšÐ½Ð¸Ð³Ð° Ð½Ð°Ð¿Ð¸ÑÐ°Ð½Ð°, Ð»Ð¸ÑÑ‚ Ð½Ð°Ð¿Ð¸ÑÐ°Ð½Ð¸Ð¹, Ñ€ÐµÑ‡ÐµÐ½Ð½Ñ Ð½Ð°Ð¿Ð¸ÑÐ°Ð½Ðµ.\n\n- [ ] Ð—Ð²Ð¾Ñ€Ð¾Ñ‚Ð½Ð¸Ð¹ Ð¿Ð°ÑÐ¸Ð² Ð· -ÑÑ Ð·Ð°Ð²Ð¶Ð´Ð¸ Ð²ÐºÐ°Ð·ÑƒÑ” Ð½Ð° Ð²Ð¸ÐºÐ¾Ð½Ð°Ð²Ñ†Ñ Ð´Ñ–Ñ— Ð² Ð¾Ñ€ÑƒÐ´Ð½Ð¾Ð¼Ñƒ Ð²Ñ–Ð´Ð¼Ñ–Ð½ÐºÑƒ.\n  > ÐÐµÐ¿Ñ€Ð°Ð²Ð¸Ð»ÑŒÐ½Ð¾! Ð—Ð²Ð¾Ñ€Ð¾Ñ‚Ð½Ð¸Ð¹ Ð¿Ð°ÑÐ¸Ð² Ð·Ð°Ð·Ð²Ð¸Ñ‡Ð°Ð¹ Ð½Ðµ Ð¿Ð¾Ñ‚Ñ€ÐµÐ±ÑƒÑ” Ð²ÐºÐ°Ð·Ñ–Ð²ÐºÐ¸ Ð½Ð° Ð²Ð¸ÐºÐ¾Ð½Ð°Ð²Ñ†Ñ.\n\n- [x] ÐšÐ¾Ñ€Ð¾Ñ‚ÐºÐ¸Ð¹ Ð¿Ð°ÑÐ¸Ð² (-Ð½Ð¾/-Ñ‚Ð¾) Ð²Ð¸Ð¼Ð°Ð³Ð°Ñ” Ð´Ð¾Ð´Ð°Ñ‚ÐºÐ° Ñƒ Ð·Ð½Ð°Ñ…Ñ–Ð´Ð½Ð¾Ð¼Ñƒ Ð²Ñ–Ð´Ð¼Ñ–Ð½ÐºÑƒ.\n  > ÐŸÑ€Ð°Ð²Ð¸Ð»ÑŒÐ½Ð¾! Â«ÐšÐ½Ð¸Ð³Ñƒ Ð½Ð°Ð¿Ð¸ÑÐ°Ð½Ð¾Â», Â«Ð›Ð¸ÑÑ‚Ð° Ð²Ñ–Ð´Ð¿Ñ€Ð°Ð²Ð»ÐµÐ½Ð¾Â».\n\n- [ ] Ð—Ð²Ð¾Ñ€Ð¾Ñ‚Ð½Ð¸Ð¹ Ð¿Ð°ÑÐ¸Ð² Ð¼Ð¾Ð¶Ð½Ð° Ð²Ð¸ÐºÐ¾Ñ€Ð¸ÑÑ‚Ð¾Ð²ÑƒÐ²Ð°Ñ‚Ð¸ Ð´Ð»Ñ Ð¾Ð¿Ð¸ÑÑƒ Ð·Ð°Ð²ÐµÑ€ÑˆÐµÐ½Ð¸Ñ… Ð´Ñ–Ð¹ Ñƒ Ð¼Ð¸Ð½ÑƒÐ»Ð¾Ð¼Ñƒ.\n  > ÐÐµÐ¿Ñ€Ð°Ð²Ð¸Ð»ÑŒÐ½Ð¾! Ð—Ð²Ð¾Ñ€Ð¾Ñ‚Ð½Ð¸Ð¹ Ð¿Ð°ÑÐ¸Ð² Ð¿Ñ–Ð´ÐºÑ€ÐµÑÐ»ÑŽÑ” Ð¿Ñ€Ð¾Ñ†ÐµÑ, Ð½Ðµ Ð·Ð°Ð²ÐµÑ€ÑˆÐµÐ½Ñ–ÑÑ‚ÑŒ.\n\n- [x] Ð”Ð»Ñ Ð²Ð¸Ñ€Ð°Ð¶ÐµÐ½Ð½Ñ Ð¼Ð°Ð¹Ð±ÑƒÑ‚Ð½ÑŒÐ¾Ð³Ð¾ Ñ‡Ð°ÑÑƒ Ð² ÐºÐ¾Ñ€Ð¾Ñ‚ÐºÐ¾Ð¼Ñƒ Ð¿Ð°ÑÐ¸Ð²Ñ– Ð²Ð¸ÐºÐ¾Ñ€Ð¸ÑÑ‚Ð¾Ð²ÑƒÑ”Ñ‚ÑŒÑÑ Â«Ð±ÑƒÐ´ÐµÂ».\n  > ÐŸÑ€Ð°Ð²Ð¸Ð»ÑŒÐ½Ð¾! Â«Ð Ñ–ÑˆÐµÐ½Ð½Ñ Ð±ÑƒÐ´Ðµ Ð¿Ñ€Ð¸Ð¹Ð½ÑÑ‚Ð¾ Ð·Ð°Ð²Ñ‚Ñ€Ð°.Â»\n\n- [ ] Â«Ð‘ÑƒÐ´Ð¸Ð½Ð¾Ðº Ð±ÑƒÐ´ÑƒÑ”Ñ‚ÑŒÑÑ Ñ€Ð¾Ð±Ñ–Ñ‚Ð½Ð¸ÐºÐ°Ð¼Ð¸Â» â€” Ñ‚Ð¸Ð¿Ð¾Ð²Ð° ÐºÐ¾Ð½ÑÑ‚Ñ€ÑƒÐºÑ†Ñ–Ñ Ð·Ð²Ð¾Ñ€Ð¾Ñ‚Ð½Ð¾Ð³Ð¾ Ð¿Ð°ÑÐ¸Ð²Ñƒ.\n  > ÐÐµÐ¿Ñ€Ð°Ð²Ð¸Ð»ÑŒÐ½Ð¾! Ð—Ð²Ð¾Ñ€Ð¾Ñ‚Ð½Ð¸Ð¹ Ð¿Ð°ÑÐ¸Ð² Ñ€Ñ–Ð´ÐºÐ¾ Ð²Ð¸ÐºÐ¾Ñ€Ð¸ÑÑ‚Ð¾Ð²ÑƒÑ”Ñ‚ÑŒÑÑ Ð· Ð²Ð¸ÐºÐ¾Ð½Ð°Ð²Ñ†ÐµÐ¼.\n\n- [x] ÐŸÐ¾Ð²Ð½Ð¸Ð¹ Ð¿Ð°ÑÐ¸Ð² Ð½Ð°Ð¹ÐºÑ€Ð°Ñ‰Ðµ Ð¿Ñ–Ð´Ñ…Ð¾Ð´Ð¸Ñ‚ÑŒ, ÐºÐ¾Ð»Ð¸ Ð¿Ð¾Ñ‚Ñ€Ñ–Ð±Ð½Ð¾ Ð¿Ñ–Ð´ÐºÑ€ÐµÑÐ»Ð¸Ñ‚Ð¸ Ð²Ð¸ÐºÐ¾Ð½Ð°Ð²Ñ†Ñ Ð´Ñ–Ñ—.\n  > ÐŸÑ€Ð°Ð²Ð¸Ð»ÑŒÐ½Ð¾! Â«ÐšÐ½Ð¸Ð³Ð° Ð½Ð°Ð¿Ð¸ÑÐ°Ð½Ð° Ð¿Ð¸ÑÑŒÐ¼ÐµÐ½Ð½Ð¸ÐºÐ¾Ð¼Â» â€” Ð°ÐºÑ†ÐµÐ½Ñ‚ Ð½Ð° Ð°Ð²Ñ‚Ð¾Ñ€Ñ–.\n\n- [ ] Ð£ÑÑ– Ñ‚Ñ€Ð¸ Ñ‚Ð¸Ð¿Ð¸ Ð¿Ð°ÑÐ¸Ð²Ñƒ Ð¼Ð¾Ð¶ÑƒÑ‚ÑŒ Ð²Ð·Ð°Ñ”Ð¼Ð¾Ð·Ð°Ð¼Ñ–Ð½Ð½Ð¾ Ð²Ð¸ÐºÐ¾Ñ€Ð¸ÑÑ‚Ð¾Ð²ÑƒÐ²Ð°Ñ‚Ð¸ÑÑ Ð² Ð±ÑƒÐ´ÑŒ-ÑÐºÐ¾Ð¼Ñƒ ÐºÐ¾Ð½Ñ‚ÐµÐºÑÑ‚Ñ–.\n  > ÐÐµÐ¿Ñ€Ð°Ð²Ð¸Ð»ÑŒÐ½Ð¾! ÐšÐ¾Ð¶ÐµÐ½ Ñ‚Ð¸Ð¿ Ð¼Ð°Ñ” ÑÐ²Ð¾ÑŽ ÑÑ‚Ð¸Ð»Ñ–ÑÑ‚Ð¸Ñ‡Ð½Ñƒ Ñ„ÑƒÐ½ÐºÑ†Ñ–ÑŽ.\n\n## group-sort: Ð¢Ð¸Ð¿ Ð¿Ð°ÑÐ¸Ð²Ð½Ð¾Ñ— ÐºÐ¾Ð½ÑÑ‚Ñ€ÑƒÐºÑ†Ñ–Ñ—\n> Ð Ð¾Ð·Ð¿Ð¾Ð´Ñ–Ð»Ñ–Ñ‚ÑŒ Ñ€ÐµÑ‡ÐµÐ½Ð½Ñ Ð·Ð° Ñ‚Ð¸Ð¿Ð¾Ð¼ Ð¿Ð°ÑÐ¸Ð²Ð½Ð¾Ñ— ÐºÐ¾Ð½ÑÑ‚Ñ€ÑƒÐºÑ†Ñ–Ñ—.\n\n### ÐŸÐ¾Ð²Ð½Ð¸Ð¹ Ð¿Ð°ÑÐ¸Ð² (Ð· Ð´Ñ–Ñ”Ð¿Ñ€Ð¸ÐºÐ¼ÐµÑ‚Ð½Ð¸ÐºÐ¾Ð¼)\n- ÐšÐ½Ð¸Ð³Ð° Ð½Ð°Ð¿Ð¸ÑÐ°Ð½Ð° Ð²Ñ–Ð´Ð¾Ð¼Ð¸Ð¼ Ð°Ð²Ñ‚Ð¾Ñ€Ð¾Ð¼.\n- ÐšÐ°Ñ€Ñ‚Ð¸Ð½Ð° Ð½Ð°Ð¼Ð°Ð»ÑŒÐ¾Ð²Ð°Ð½Ð° Ñ…ÑƒÐ´Ð¾Ð¶Ð½Ð¸ÐºÐ¾Ð¼.\n- Ð Ð¾Ð±Ð¾Ñ‚Ð° Ð²Ð¸ÐºÐ¾Ð½Ð°Ð½Ð° ÑÑ‚ÑƒÐ´ÐµÐ½Ñ‚Ð°Ð¼Ð¸.\n- Ð£Ð³Ð¾Ð´Ð° Ð¿Ñ–Ð´Ð¿Ð¸ÑÐ°Ð½Ð° Ð¼Ñ–Ð½Ñ–ÑÑ‚Ñ€Ð°Ð¼Ð¸.\n- ÐŸÑ€Ð¾ÐµÐºÑ‚ ÑÑ…Ð²Ð°Ð»ÐµÐ½Ð¸Ð¹ ÐºÐ¾Ð¼Ñ–ÑÑ–Ñ”ÑŽ.\n- Ð¡Ñ‚Ð°Ñ‚Ñ‚Ñ Ð¾Ð¿ÑƒÐ±Ð»Ñ–ÐºÐ¾Ð²Ð°Ð½Ð° Ñ€ÐµÐ´Ð°ÐºÑ†Ñ–Ñ”ÑŽ.\n- Ð—Ð°Ð²Ð´Ð°Ð½Ð½Ñ Ð²Ð¸ÐºÐ¾Ð½Ð°Ð½Ðµ ÑƒÑ‡Ð½ÑÐ¼Ð¸.\n\n### ÐšÐ¾Ñ€Ð¾Ñ‚ÐºÐ¸Ð¹ Ð¿Ð°ÑÐ¸Ð² (-Ð½Ð¾/-Ñ‚Ð¾)\n- Ð Ñ–ÑˆÐµÐ½Ð½Ñ Ð¿Ñ€Ð¸Ð¹Ð½ÑÑ‚Ð¾ Ð¾Ð´Ð½Ð¾Ð³Ð¾Ð»Ð¾ÑÐ½Ð¾.\n- Ð”Ð¾ÐºÑƒÐ¼ÐµÐ½Ñ‚Ð¸ Ð¿Ñ–Ð´Ð³Ð¾Ñ‚Ð¾Ð²Ð»ÐµÐ½Ð¾ Ð²Ñ‡Ð°ÑÐ½Ð¾.\n- ÐœÐµÐ½Ñ– Ð±ÑƒÐ»Ð¾ ÑÐºÐ°Ð·Ð°Ð½Ð¾ Ñ‡ÐµÐºÐ°Ñ‚Ð¸.\n- Ð ÐµÐ·ÑƒÐ»ÑŒÑ‚Ð°Ñ‚Ð¸ Ð¾Ð³Ð¾Ð»Ð¾ÑˆÐµÐ½Ð¾ Ð¾Ñ„Ñ–Ñ†Ñ–Ð¹Ð½Ð¾.\n- ÐšÐ¾Ð½Ñ‚Ñ€Ð°ÐºÑ‚ Ð¿Ñ–Ð´Ð¿Ð¸ÑÐ°Ð½Ð¾ Ð²Ñ‡Ð¾Ñ€Ð°.\n- Ð—Ð°Ñ…Ð¾Ð´Ð¸ Ð·Ð°Ð¿Ð»Ð°Ð½Ð¾Ð²Ð°Ð½Ð¾ Ð½Ð° Ð²ÐµÑÐ½Ñƒ.\n- ÐŸÑ€Ð¾Ð±Ð»ÐµÐ¼Ñƒ Ð²Ð¸Ñ€Ñ–ÑˆÐµÐ½Ð¾ ÑƒÑÐ¿Ñ–ÑˆÐ½Ð¾.\n\n### Ð—Ð²Ð¾Ñ€Ð¾Ñ‚Ð½Ð¸Ð¹ Ð¿Ð°ÑÐ¸Ð² (-ÑÑ)\n- Ð¥Ð»Ñ–Ð± Ð²Ð¸Ð¿Ñ–ÐºÐ°Ñ”Ñ‚ÑŒÑÑ Ñ‰Ð¾Ñ€Ð°Ð½ÐºÑƒ.\n- Ð‘ÑƒÐ´Ð¸Ð½Ð¾Ðº Ð±ÑƒÐ´ÑƒÑ”Ñ‚ÑŒÑÑ ÑˆÐ²Ð¸Ð´ÐºÐ¾.\n- ÐŸÑ€Ð¾Ð±Ð»ÐµÐ¼Ð° Ð²Ð¸Ñ€Ñ–ÑˆÑƒÑ”Ñ‚ÑŒÑÑ Ð·Ð°Ñ€Ð°Ð·.\n- Ð”Ð¾ÐºÑƒÐ¼ÐµÐ½Ñ‚Ð¸ Ð³Ð¾Ñ‚ÑƒÑŽÑ‚ÑŒÑÑ ÑÐµÐºÑ€ÐµÑ‚Ð°Ñ€ÐµÐ¼.\n- Ð†ÑÐ¿Ð¸Ñ‚Ð¸ Ð¿Ñ€Ð¾Ð²Ð¾Ð´ÑÑ‚ÑŒÑÑ Ñ‰Ð¾Ñ€Ð¾ÐºÑƒ.\n- Ð¡Ñ‚Ð°Ñ‚Ñ‚Ñ– Ð¿ÑƒÐ±Ð»Ñ–ÐºÑƒÑŽÑ‚ÑŒÑÑ Ñ‰Ð¾Ñ‚Ð¸Ð¶Ð½Ñ.\n- Ð Ñ–ÑˆÐµÐ½Ð½Ñ Ð¿Ñ€Ð¸Ð¹Ð¼Ð°ÑŽÑ‚ÑŒÑÑ ÐºÐ¾Ð»ÐµÐºÑ‚Ð¸Ð²Ð½Ð¾.\n\n## unjumble: ÐŸÐ¾Ð±ÑƒÐ´ÑƒÐ¹Ñ‚Ðµ Ð¿Ð°ÑÐ¸Ð²Ð½Ðµ Ñ€ÐµÑ‡ÐµÐ½Ð½Ñ\n> Ð Ð¾Ð·Ñ‚Ð°ÑˆÑƒÐ¹Ñ‚Ðµ ÑÐ»Ð¾Ð²Ð° Ð² Ð¿Ñ€Ð°Ð²Ð¸Ð»ÑŒÐ½Ð¾Ð¼Ñƒ Ð¿Ð¾Ñ€ÑÐ´ÐºÑƒ, Ñ‰Ð¾Ð± ÑƒÑ‚Ð²Ð¾Ñ€Ð¸Ñ‚Ð¸ Ð¿Ð°ÑÐ¸Ð²Ð½Ðµ Ñ€ÐµÑ‡ÐµÐ½Ð½Ñ.\n\n1. Ð½Ð°Ð¿Ð¸ÑÐ°Ð½Ð° / Ð°Ð²Ñ‚Ð¾Ñ€Ð¾Ð¼ / Ð²Ñ–Ð´Ð¾Ð¼Ð¸Ð¼ / ÐºÐ½Ð¸Ð³Ð° / ÑƒÐºÑ€Ð°Ñ—Ð½ÑÑŒÐºÐ¸Ð¼ / Ñ†Ñ / Ð¼Ð¸Ð½ÑƒÐ»Ð¾Ð³Ð¾ / Ñ€Ð¾ÐºÑƒ / Ñ‚Ð° / Ð¿ÐµÑ€ÐµÐºÐ»Ð°Ð´ÐµÐ½Ð° / Ð±Ð°Ð³Ð°Ñ‚ÑŒÐ¼Ð° / Ð¼Ð¾Ð²Ð°Ð¼Ð¸\n   > [!answer] Ð¦Ñ ÐºÐ½Ð¸Ð³Ð° Ð½Ð°Ð¿Ð¸ÑÐ°Ð½Ð° Ð²Ñ–Ð´Ð¾Ð¼Ð¸Ð¼ ÑƒÐºÑ€Ð°Ñ—Ð½ÑÑŒÐºÐ¸Ð¼ Ð°Ð²Ñ‚Ð¾Ñ€Ð¾Ð¼ Ð¼Ð¸Ð½ÑƒÐ»Ð¾Ð³Ð¾ Ñ€Ð¾ÐºÑƒ Ñ‚Ð° Ð¿ÐµÑ€ÐµÐºÐ»Ð°Ð´ÐµÐ½Ð° Ð±Ð°Ð³Ð°Ñ‚ÑŒÐ¼Ð° Ð¼Ð¾Ð²Ð°Ð¼Ð¸.\n\n2. Ð¿Ñ€Ð¸Ð¹Ð½ÑÑ‚Ð¾ / ÐºÐ¾Ð¼Ñ–ÑÑ–Ñ”ÑŽ / Ð¾Ð´Ð½Ð¾Ð³Ð¾Ð»Ð¾ÑÐ½Ð¾ / Ñ€Ñ–ÑˆÐµÐ½Ð½Ñ / Ð¿Ñ–ÑÐ»Ñ / Ð¾Ð±Ð³Ð¾Ð²Ð¾Ñ€ÐµÐ½Ð½Ñ / Ñ‚Ñ€Ð¸Ð²Ð°Ð»Ð¾Ð³Ð¾ / Ð±ÑƒÐ»Ð¾ / ÑƒÑÑ–Ñ… / Ð¼Ð¾Ð¶Ð»Ð¸Ð²Ð¸Ñ… / Ð²Ð°Ñ€Ñ–Ð°Ð½Ñ‚Ñ–Ð²\n   > [!answer] Ð Ñ–ÑˆÐµÐ½Ð½Ñ Ð±ÑƒÐ»Ð¾ Ð¿Ñ€Ð¸Ð¹Ð½ÑÑ‚Ð¾ ÐºÐ¾Ð¼Ñ–ÑÑ–Ñ”ÑŽ Ð¾Ð´Ð½Ð¾Ð³Ð¾Ð»Ð¾ÑÐ½Ð¾ Ð¿Ñ–ÑÐ»Ñ Ñ‚Ñ€Ð¸Ð²Ð°Ð»Ð¾Ð³Ð¾ Ð¾Ð±Ð³Ð¾Ð²Ð¾Ñ€ÐµÐ½Ð½Ñ ÑƒÑÑ–Ñ… Ð¼Ð¾Ð¶Ð»Ð¸Ð²Ð¸Ñ… Ð²Ð°Ñ€Ñ–Ð°Ð½Ñ‚Ñ–Ð².\n\n3. Ð±ÑƒÐ´ÑƒÑ”Ñ‚ÑŒÑÑ / Ð½Ð¾Ð²Ð¸Ð¹ / ÑˆÐ²Ð¸Ð´ÐºÐ¾ / ÑÑ‚Ð°Ð´Ñ–Ð¾Ð½ / Ð´ÑƒÐ¶Ðµ / Ð·Ð°Ñ€Ð°Ð· / Ñƒ / Ð½Ð°ÑˆÐ¾Ð¼Ñƒ / Ð¼Ñ–ÑÑ‚Ñ– / Ð´Ð»Ñ / Ð¾Ð»Ñ–Ð¼Ð¿Ñ–Ð¹ÑÑŒÐºÐ¸Ñ… / Ð·Ð¼Ð°Ð³Ð°Ð½ÑŒ\n   > [!answer] ÐÐ¾Ð²Ð¸Ð¹ ÑÑ‚Ð°Ð´Ñ–Ð¾Ð½ Ð·Ð°Ñ€Ð°Ð· Ð±ÑƒÐ´ÑƒÑ”Ñ‚ÑŒÑÑ Ð´ÑƒÐ¶Ðµ ÑˆÐ²Ð¸Ð´ÐºÐ¾ Ñƒ Ð½Ð°ÑˆÐ¾Ð¼Ñƒ Ð¼Ñ–ÑÑ‚Ñ– Ð´Ð»Ñ Ð¾Ð»Ñ–Ð¼Ð¿Ñ–Ð¹ÑÑŒÐºÐ¸Ñ… Ð·Ð¼Ð°Ð³Ð°Ð½ÑŒ.\n\n4. Ð¿Ñ–Ð´Ð³Ð¾Ñ‚Ð¾Ð²Ð»ÐµÐ½Ð¾ / Ð´Ð¾ÐºÑƒÐ¼ÐµÐ½Ñ‚Ð¸ / Ð±ÑƒÐ»Ð¸ / Ñ‚Ð° / ÑÐµÐºÑ€ÐµÑ‚Ð°Ñ€ÐµÐ¼ / Ð½Ð°Ð´Ñ–ÑÐ»Ð°Ð½Ð¾ / Ð¿Ð°Ñ€Ñ‚Ð½ÐµÑ€Ð°Ð¼ / ÑƒÑÑ– / Ð´Ð¾ / ÐºÑ–Ð½Ñ†Ñ / Ñ€Ð¾Ð±Ð¾Ñ‡Ð¾Ð³Ð¾ / Ð´Ð½Ñ\n   > [!answer] Ð£ÑÑ– Ð´Ð¾ÐºÑƒÐ¼ÐµÐ½Ñ‚Ð¸ Ð±ÑƒÐ»Ð¸ Ð¿Ñ–Ð´Ð³Ð¾Ñ‚Ð¾Ð²Ð»ÐµÐ½Ð¾ ÑÐµÐºÑ€ÐµÑ‚Ð°Ñ€ÐµÐ¼ Ñ‚Ð° Ð½Ð°Ð´Ñ–ÑÐ»Ð°Ð½Ð¾ Ð¿Ð°Ñ€Ñ‚Ð½ÐµÑ€Ð°Ð¼ Ð´Ð¾ ÐºÑ–Ð½Ñ†Ñ Ñ€Ð¾Ð±Ð¾Ñ‡Ð¾Ð³Ð¾ Ð´Ð½Ñ.\n\n5. Ð²Ð¸Ð¿Ñ–ÐºÐ°Ñ”Ñ‚ÑŒÑÑ / Ñ…Ð»Ñ–Ð± / Ð¿ÐµÐºÐ°Ñ€Ð½Ñ– / Ð¾ / Ñ‰Ð¾Ñ€Ð°Ð½ÐºÑƒ / Ð² / Ð¿'ÑÑ‚Ñ–Ð¹ / Ñ†Ñ–Ð¹ / Ð³Ð¾Ð´Ð¸Ð½Ñ– / Ð·Ð° / Ñ‚Ñ€Ð°Ð´Ð¸Ñ†Ñ–Ð¹Ð½Ð¸Ð¼ / ÑƒÐºÑ€Ð°Ñ—Ð½ÑÑŒÐºÐ¸Ð¼ / Ñ€ÐµÑ†ÐµÐ¿Ñ‚Ð¾Ð¼\n   > [!answer] Ð¥Ð»Ñ–Ð± Ð²Ð¸Ð¿Ñ–ÐºÐ°Ñ”Ñ‚ÑŒÑÑ Ð² Ñ†Ñ–Ð¹ Ð¿ÐµÐºÐ°Ñ€Ð½Ñ– Ñ‰Ð¾Ñ€Ð°Ð½ÐºÑƒ Ð¾ Ð¿'ÑÑ‚Ñ–Ð¹ Ð³Ð¾Ð´Ð¸Ð½Ñ– Ð·Ð° Ñ‚Ñ€Ð°Ð´Ð¸Ñ†Ñ–Ð¹Ð½Ð¸Ð¼ ÑƒÐºÑ€Ð°Ñ—Ð½ÑÑŒÐºÐ¸Ð¼ Ñ€ÐµÑ†ÐµÐ¿Ñ‚Ð¾Ð¼.\n\n6. Ð¿ÐµÑ€ÐµÐ²Ñ–Ñ€ÑÑ”Ñ‚ÑŒÑÑ / Ñ‚ÐµÐºÑÑ‚ / Ñ€ÐµÐ´Ð°ÐºÑ‚Ð¾Ñ€Ð¾Ð¼ / ÑƒÐ²Ð°Ð¶Ð½Ð¾ / Ñ‚Ð° / ÐºÐ¾Ñ€ÐµÐºÑ‚Ð¾Ñ€Ð¾Ð¼ / Ñ€ÐµÑ‚ÐµÐ»ÑŒÐ½Ð¾ / Ð·Ð°Ñ€Ð°Ð· / Ð¿ÐµÑ€ÐµÐ´ / Ð¿ÑƒÐ±Ð»Ñ–ÐºÐ°Ñ†Ñ–Ñ”ÑŽ / Ð² / Ð¶ÑƒÑ€Ð½Ð°Ð»Ñ–\n   > [!answer] Ð¢ÐµÐºÑÑ‚ Ð·Ð°Ñ€Ð°Ð· ÑƒÐ²Ð°Ð¶Ð½Ð¾ Ð¿ÐµÑ€ÐµÐ²Ñ–Ñ€ÑÑ”Ñ‚ÑŒÑÑ Ñ€ÐµÐ´Ð°ÐºÑ‚Ð¾Ñ€Ð¾Ð¼ Ñ‚Ð° Ñ€ÐµÑ‚ÐµÐ»ÑŒÐ½Ð¾ ÐºÐ¾Ñ€ÐµÐºÑ‚Ð¾Ñ€Ð¾Ð¼ Ð¿ÐµÑ€ÐµÐ´ Ð¿ÑƒÐ±Ð»Ñ–ÐºÐ°Ñ†Ñ–Ñ”ÑŽ Ð² Ð¶ÑƒÑ€Ð½Ð°Ð»Ñ–.\n\n## error-correction: Ð’Ð¸Ð¿Ñ€Ð°Ð²Ñ‚Ðµ Ð¿Ð¾Ð¼Ð¸Ð»ÐºÐ¸\n> ÐšÐ¾Ð¶Ð½Ðµ Ñ€ÐµÑ‡ÐµÐ½Ð½Ñ Ð¼Ñ–ÑÑ‚Ð¸Ñ‚ÑŒ Ð¾Ð´Ð½Ñƒ Ð¿Ð¾Ð¼Ð¸Ð»ÐºÑƒ. Ð—Ð½Ð°Ð¹Ð´Ñ–Ñ‚ÑŒ Ñ– Ð²Ð¸Ð¿Ñ€Ð°Ð²Ñ‚Ðµ Ñ—Ñ—.\n\n1. ÐšÐ½Ð¸Ð³Ð° Ð½Ð°Ð¿Ð¸ÑÐ°Ð½Ð¸Ð¹ Ð²Ñ–Ð´Ð¾Ð¼Ð¸Ð¼ ÑƒÐºÑ€Ð°Ñ—Ð½ÑÑŒÐºÐ¸Ð¼ Ð¿Ð¸ÑÑŒÐ¼ÐµÐ½Ð½Ð¸ÐºÐ¾Ð¼.\n   > [!error] Ð½Ð°Ð¿Ð¸ÑÐ°Ð½Ð¸Ð¹\n   > [!answer] Ð½Ð°Ð¿Ð¸ÑÐ°Ð½Ð°\n   > [!options] Ð½Ð°Ð¿Ð¸ÑÐ°Ð½Ð¸Ð¹ | Ð½Ð°Ð¿Ð¸ÑÐ°Ð½Ð° | Ð½Ð°Ð¿Ð¸ÑÐ°Ð½Ðµ | Ð½Ð°Ð¿Ð¸ÑÐ°Ð½Ñ–\n   > [!explanation] Â«ÐšÐ½Ð¸Ð³Ð°Â» â€” Ð¶Ñ–Ð½Ð¾Ñ‡Ð¾Ð³Ð¾ Ñ€Ð¾Ð´Ñƒ, Ñ‚Ð¾Ð¼Ñƒ Ð´Ñ–Ñ”Ð¿Ñ€Ð¸ÐºÐ¼ÐµÑ‚Ð½Ð¸Ðº Â«Ð½Ð°Ð¿Ð¸ÑÐ°Ð½Ð°Â».\n\n2. Ð Ñ–ÑˆÐµÐ½Ð½Ñ Ð¿Ñ€Ð¸Ð¹Ð½ÑÑ‚Ð° ÐºÐ¾Ð¼Ñ–ÑÑ–Ñ”ÑŽ Ð¾Ð´Ð½Ð¾Ð³Ð¾Ð»Ð¾ÑÐ½Ð¾ Ð²Ñ‡Ð¾Ñ€Ð°.\n   > [!error] Ð¿Ñ€Ð¸Ð¹Ð½ÑÑ‚Ð°\n   > [!answer] Ð¿Ñ€Ð¸Ð¹Ð½ÑÑ‚Ðµ\n   > [!options] Ð¿Ñ€Ð¸Ð¹Ð½ÑÑ‚Ð° | Ð¿Ñ€Ð¸Ð¹Ð½ÑÑ‚Ðµ | Ð¿Ñ€Ð¸Ð¹Ð½ÑÑ‚Ð¸Ð¹ | Ð¿Ñ€Ð¸Ð¹Ð½ÑÑ‚Ñ–\n   > [!explanation] Â«Ð Ñ–ÑˆÐµÐ½Ð½ÑÂ» â€” ÑÐµÑ€ÐµÐ´Ð½ÑŒÐ¾Ð³Ð¾ Ñ€Ð¾Ð´Ñƒ, Ñ‚Ð¾Ð¼Ñƒ Ð´Ñ–Ñ”Ð¿Ñ€Ð¸ÐºÐ¼ÐµÑ‚Ð½Ð¸Ðº Â«Ð¿Ñ€Ð¸Ð¹Ð½ÑÑ‚ÐµÂ».\n\n3. ÐšÐ¾Ð½Ñ‚Ñ€Ð°ÐºÑ‚ Ð¿Ñ–Ð´Ð¿Ð¸ÑÑƒÑ”Ñ‚ÑŒÑÑ Ð²Ñ‡Ð¾Ñ€Ð° Ð´Ð¸Ñ€ÐµÐºÑ‚Ð¾Ñ€Ð¾Ð¼ ÐºÐ¾Ð¼Ð¿Ð°Ð½Ñ–Ñ—.\n   > [!error] Ð¿Ñ–Ð´Ð¿Ð¸ÑÑƒÑ”Ñ‚ÑŒÑÑ\n   > [!answer] Ð¿Ñ–Ð´Ð¿Ð¸ÑÐ°Ð½Ð¾\n   > [!options] Ð¿Ñ–Ð´Ð¿Ð¸ÑÑƒÑ”Ñ‚ÑŒÑÑ | Ð¿Ñ–Ð´Ð¿Ð¸ÑÐ°Ð½Ð¾ | Ð¿Ñ–Ð´Ð¿Ð¸ÑÐ°Ð½Ð¸Ð¹ | Ð¿Ñ–Ð´Ð¿Ð¸ÑÑƒÐ²Ð°Ð²ÑÑ\n   > [!explanation] Â«Ð’Ñ‡Ð¾Ñ€Ð°Â» â€” Ð·Ð°Ð²ÐµÑ€ÑˆÐµÐ½Ð° Ð´Ñ–Ñ, Ñ‚Ð¾Ð¼Ñƒ ÐºÐ¾Ñ€Ð¾Ñ‚ÐºÐ¸Ð¹ Ð¿Ð°ÑÐ¸Ð² Â«Ð¿Ñ–Ð´Ð¿Ð¸ÑÐ°Ð½Ð¾Â».\n\n4. Ð”Ð¾ÐºÑƒÐ¼ÐµÐ½Ñ‚ Ð¿Ñ–Ð´Ð³Ð¾Ñ‚Ð¾Ð²Ð»ÐµÐ½Ð¾ ÑŽÑ€Ð¸ÑÑ‚Ð¾Ð¼ Ñ‚Ð° Ð½Ð°Ð´Ñ–ÑÐ»Ð°Ð½Ñ– Ð¿Ð°Ñ€Ñ‚Ð½ÐµÑ€Ð°Ð¼.\n   > [!error] Ð½Ð°Ð´Ñ–ÑÐ»Ð°Ð½Ñ–\n   > [!answer] Ð½Ð°Ð´Ñ–ÑÐ»Ð°Ð½Ð¾\n   > [!options] Ð½Ð°Ð´Ñ–ÑÐ»Ð°Ð½Ñ– | Ð½Ð°Ð´Ñ–ÑÐ»Ð°Ð½Ð¾ | Ð½Ð°Ð´Ñ–ÑÐ»Ð°Ð½Ð¸Ð¹ | Ð½Ð°Ð´Ñ–ÑÐ»Ð°Ð½Ð°\n   > [!explanation] ÐžÐ±Ð¸Ð´Ð²Ñ– Ñ„Ð¾Ñ€Ð¼Ð¸ Ð¼Ð°ÑŽÑ‚ÑŒ Ð±ÑƒÑ‚Ð¸ ÐºÐ¾Ñ€Ð¾Ñ‚ÐºÐ¸Ð¼Ð¸: Â«Ð¿Ñ–Ð´Ð³Ð¾Ñ‚Ð¾Ð²Ð»ÐµÐ½Ð¾Â» Ñ‚Ð° Â«Ð½Ð°Ð´Ñ–ÑÐ»Ð°Ð½Ð¾Â».\n\n5. Ð‘ÑƒÐ´Ð¸Ð½Ð¾Ðº Ð±ÑƒÐ´ÑƒÐ²Ð°Ð²ÑÑ Ð·Ð°Ñ€Ð°Ð· Ð´ÑƒÐ¶Ðµ ÑˆÐ²Ð¸Ð´ÐºÐ¾ Ñ€Ð¾Ð±Ñ–Ñ‚Ð½Ð¸ÐºÐ°Ð¼Ð¸.\n   > [!error] Ð±ÑƒÐ´ÑƒÐ²Ð°Ð²ÑÑ\n   > [!answer] Ð±ÑƒÐ´ÑƒÑ”Ñ‚ÑŒÑÑ\n   > [!options] Ð±ÑƒÐ´ÑƒÐ²Ð°Ð²ÑÑ | Ð±ÑƒÐ´ÑƒÑ”Ñ‚ÑŒÑÑ | Ð·Ð±ÑƒÐ´Ð¾Ð²Ð°Ð½Ð¾ | Ð·Ð±ÑƒÐ´Ð¾Ð²Ð°Ð½Ð¸Ð¹\n   > [!explanation] Â«Ð—Ð°Ñ€Ð°Ð·Â» â€” Ñ‚ÐµÐ¿ÐµÑ€Ñ–ÑˆÐ½Ñ–Ð¹ Ñ‡Ð°Ñ, Ñ‚Ð¾Ð¼Ñƒ Â«Ð±ÑƒÐ´ÑƒÑ”Ñ‚ÑŒÑÑÂ».\n\n6. Ð ÐµÐ·ÑƒÐ»ÑŒÑ‚Ð°Ñ‚Ð¸ Ð±ÑƒÐ»Ð¾ Ð¾Ð³Ð¾Ð»Ð¾ÑˆÐµÐ½Ð¾ ÐºÐ¾Ð¼Ñ–ÑÑ–Ñ Ð½Ð° Ñ†ÐµÑ€ÐµÐ¼Ð¾Ð½Ñ–Ñ—.\n   > [!error] ÐºÐ¾Ð¼Ñ–ÑÑ–Ñ\n   > [!answer] ÐºÐ¾Ð¼Ñ–ÑÑ–Ñ”ÑŽ\n   > [!options] ÐºÐ¾Ð¼Ñ–ÑÑ–Ñ | ÐºÐ¾Ð¼Ñ–ÑÑ–Ñ”ÑŽ | ÐºÐ¾Ð¼Ñ–ÑÑ–Ñ— | ÐºÐ¾Ð¼Ñ–ÑÑ–ÑŽ\n   > [!explanation] Ð’Ð¸ÐºÐ¾Ð½Ð°Ð²ÐµÑ†ÑŒ ÑÑ‚Ð¾Ñ—Ñ‚ÑŒ Ð² Ð¾Ñ€ÑƒÐ´Ð½Ð¾Ð¼Ñƒ Ð²Ñ–Ð´Ð¼Ñ–Ð½ÐºÑƒ: Â«ÐºÐ¾Ð¼Ñ–ÑÑ–Ñ”ÑŽÂ».\n\n## cloze: ÐÐ¾Ð²Ð¸Ð½Ð½Ð° ÑÑ‚Ð°Ñ‚Ñ‚Ñ\n> Ð—Ð°Ð¿Ð¾Ð²Ð½Ñ–Ñ‚ÑŒ Ð¿Ñ€Ð¾Ð¿ÑƒÑÐºÐ¸ Ð¿Ñ€Ð°Ð²Ð¸Ð»ÑŒÐ½Ð¸Ð¼Ð¸ Ð¿Ð°ÑÐ¸Ð²Ð½Ð¸Ð¼Ð¸ Ñ„Ð¾Ñ€Ð¼Ð°Ð¼Ð¸.\n\nÐÐžÐ’Ð Ð¨ÐšÐžÐ›Ð Ð’Ð†Ð”ÐšÐ Ð˜Ð¢Ð Ð’ ÐšÐ˜Ð„Ð’Ð†\n\nÐ¡Ø«Ð³Ð¾Ð´Ð½Ñ– [___:1] Ð½Ð¾Ð²Ñƒ ÑˆÐºÐ¾Ð»Ñƒ Ð½Ð° ÑÑ‚Ð¾ ÐºÐ»Ð°ÑÑ–Ð² Ñƒ Ð¡Ð¾Ð»Ð¾Ð¼'ÑÐ½ÑÑŒÐºÐ¾Ð¼Ñƒ Ñ€Ð°Ð¹Ð¾Ð½Ñ– ÑÑ‚Ð¾Ð»Ð¸Ñ†Ñ–. Ð‘ÑƒÐ´Ñ–Ð²Ð»Ñ [___:2] Ð·Ð° Ð½Ð°Ð¹ÑÑƒÑ‡Ð°ÑÐ½Ñ–ÑˆÐ¸Ð¼Ð¸ ÑÑ‚Ð°Ð½Ð´Ð°Ñ€Ñ‚Ð°Ð¼Ð¸ Ð¿Ñ€Ð¾Ñ‚ÑÐ³Ð¾Ð¼ Ð´Ð²Ð¾Ñ… Ñ€Ð¾ÐºÑ–Ð². ÐŸÑ€Ð¾ÐµÐºÑ‚ [___:3] Ð¼Ñ–Ð¶Ð½Ð°Ñ€Ð¾Ð´Ð½Ð¾ÑŽ Ð°Ñ€Ñ…Ñ–Ñ‚ÐµÐºÑ‚ÑƒÑ€Ð½Ð¾ÑŽ ÑÑ‚ÑƒÐ´Ñ–Ñ”ÑŽ.\n\nÐÐ° Ñ†ÐµÑ€ÐµÐ¼Ð¾Ð½Ñ–Ñ— Ð²Ñ–Ð´ÐºÑ€Ð¸Ñ‚Ñ‚Ñ [___:4], Ñ‰Ð¾ ÑˆÐºÐ¾Ð»Ð° [___:5] ÑÑƒÑ‡Ð°ÑÐ½Ð¸Ð¼ Ð¾Ð±Ð»Ð°Ð´Ð½Ð°Ð½Ð½ÑÐ¼. ÐšÐ¾Ð¼Ð¿'ÑŽÑ‚ÐµÑ€Ð½Ñ– ÐºÐ»Ð°ÑÐ¸ [___:6] Ð·Ð° Ð¾ÑÑ‚Ð°Ð½Ð½Ñ–Ð¼ ÑÐ»Ð¾Ð²Ð¾Ð¼ Ñ‚ÐµÑ…Ð½Ñ–ÐºÐ¸. Ð¡Ð¿Ð¾Ñ€Ñ‚Ð¸Ð²Ð½Ð¸Ð¹ Ð·Ð°Ð» [___:7] Ð´Ð»Ñ Ñ€Ñ–Ð·Ð½Ð¸Ñ… Ð²Ð¸Ð´Ñ–Ð² ÑÐ¿Ð¾Ñ€Ñ‚Ñƒ.\n\nÐ—Ð° ÑÐ»Ð¾Ð²Ð°Ð¼Ð¸ Ð´Ð¸Ñ€ÐµÐºÑ‚Ð¾Ñ€Ð°, Ð½Ð°Ð²Ñ‡Ð°Ð½Ð½Ñ [___:8] Ð·Ð° Ñ–Ð½Ð½Ð¾Ð²Ð°Ñ†Ñ–Ð¹Ð½Ð¸Ð¼Ð¸ Ð¼ÐµÑ‚Ð¾Ð´Ð¸ÐºÐ°Ð¼Ð¸. ÐŸÑ–Ð´Ñ€ÑƒÑ‡Ð½Ð¸ÐºÐ¸ [___:9] ÑÐ¿ÐµÑ†Ñ–Ð°Ð»ÑŒÐ½Ð¾ Ð´Ð»Ñ Ñ†Ñ–Ñ”Ñ— ÑˆÐºÐ¾Ð»Ð¸. Ð£Ñ‡Ð¸Ñ‚ÐµÐ»Ñ– [___:10] Ð¿Ñ–ÑÐ»Ñ Ñ€ÐµÑ‚ÐµÐ»ÑŒÐ½Ð¾Ð³Ð¾ ÐºÐ¾Ð½ÐºÑƒÑ€ÑÐ½Ð¾Ð³Ð¾ Ð²Ñ–Ð´Ð±Ð¾Ñ€Ñƒ.\n\nÐ‘Ð°Ñ‚ÑŒÐºÐ¸, Ð´Ñ–Ñ‚Ð¸ ÑÐºÐ¸Ñ… [___:11] Ð´Ð¾ ÑˆÐºÐ¾Ð»Ð¸, Ð²Ð¸ÑÐ»Ð¾Ð²Ð¸Ð»Ð¸ Ð·Ð°Ð´Ð¾Ð²Ð¾Ð»ÐµÐ½Ð½Ñ. Â«ÐœÐ¸ Ñ€Ð°Ð´Ñ–, Ñ‰Ð¾ Ñ‚Ð°ÐºÐ° ÑˆÐºÐ¾Ð»Ð° [___:12] Ñƒ Ð½Ð°ÑˆÐ¾Ð¼Ñƒ Ñ€Ð°Ð¹Ð¾Ð½Ñ–Â», â€” [___:13] Ð¾Ð´Ð½Ñ–Ñ”ÑŽ Ð· Ð¼Ð°Ñ‚ÐµÑ€Ñ–Ð².\n\nÐÐ°ÑÑ‚ÑƒÐ¿Ð½Ð¾Ð³Ð¾ Ñ€Ð¾ÐºÑƒ [___:14] Ñ‰Ðµ Ñ‚Ñ€Ð¸ ÑˆÐºÐ¾Ð»Ð¸ Ð² Ñ–Ð½ÑˆÐ¸Ñ… Ñ€Ð°Ð¹Ð¾Ð½Ð°Ñ… Ð¼Ñ–ÑÑ‚Ð°.\n\n1. Ð²Ñ–Ð´ÐºÑ€Ð¸Ñ‚Ð¾ | Ð²Ñ–Ð´ÐºÑ€Ð¸Ð²Ð°Ñ”Ñ‚ÑŒÑÑ | Ð²Ñ–Ð´ÐºÑ€Ð¸Ñ‚Ð°\n   > [!answer] Ð²Ñ–Ð´ÐºÑ€Ð¸Ñ‚Ð¾\n\n2. Ð±ÑƒÐ´ÑƒÐ²Ð°Ð»Ð°ÑÑ | Ð·Ð±ÑƒÐ´Ð¾Ð²Ð°Ð½Ð¾ | Ð·Ð±ÑƒÐ´Ð¾Ð²Ð°Ð½Ð°\n   > [!answer] Ð·Ð±ÑƒÐ´Ð¾Ð²Ð°Ð½Ð°\n\n3. Ñ€Ð¾Ð·Ñ€Ð¾Ð±Ð»ÐµÐ½Ð¸Ð¹ | Ñ€Ð¾Ð·Ñ€Ð¾Ð±Ð»ÐµÐ½Ð¾ | Ñ€Ð¾Ð·Ñ€Ð¾Ð±Ð»ÑÑ”Ñ‚ÑŒÑÑ\n   > [!answer] Ñ€Ð¾Ð·Ñ€Ð¾Ð±Ð»ÐµÐ½Ð¸Ð¹\n\n4. Ð¿Ð¾Ð²Ñ–Ð´Ð¾Ð¼Ð»ÐµÐ½Ð¾ | Ð¿Ð¾Ð²Ñ–Ð´Ð¾Ð¼Ð»ÑÑ”Ñ‚ÑŒÑÑ | Ð¿Ð¾Ð²Ñ–Ð´Ð¾Ð¼Ð»ÐµÐ½Ð¸Ð¹\n   > [!answer] Ð¿Ð¾Ð²Ñ–Ð´Ð¾Ð¼Ð»ÐµÐ½Ð¾\n\n5. Ð¾Ð±Ð»Ð°Ð´Ð½Ð°Ð½Ð° | Ð¾Ð±Ð»Ð°Ð´Ð½Ð°Ð½Ð¾ | Ð¾Ð±Ð»Ð°Ð´Ð½ÑƒÑ”Ñ‚ÑŒÑÑ\n   > [!answer] Ð¾Ð±Ð»Ð°Ð´Ð½Ð°Ð½Ð°\n\n6. Ð¾ÑÐ½Ð°Ñ‰ÐµÐ½Ñ– | Ð¾ÑÐ½Ð°Ñ‰ÐµÐ½Ð¾ | Ð¾ÑÐ½Ð°Ñ‰ÑƒÑŽÑ‚ÑŒÑÑ\n   > [!answer] Ð¾ÑÐ½Ð°Ñ‰ÐµÐ½Ñ–\n\n7. Ð¿Ñ€Ð¸ÑÑ‚Ð¾ÑÐ¾Ð²Ð°Ð½Ð¸Ð¹ | Ð¿Ñ€Ð¸ÑÑ‚Ð¾ÑÐ¾Ð²Ð°Ð½Ð¾ | Ð¿Ñ€Ð¸ÑÑ‚Ð¾ÑÐ¾Ð²ÑƒÑ”Ñ‚ÑŒÑÑ\n   > [!answer] Ð¿Ñ€Ð¸ÑÑ‚Ð¾ÑÐ¾Ð²Ð°Ð½Ð¸Ð¹\n\n8. Ð¿Ñ€Ð¾Ð²Ð¾Ð´Ð¸Ñ‚ÑŒÑÑ | Ð¿Ñ€Ð¾Ð²ÐµÐ´ÐµÐ½Ð¾ | Ð¿Ñ€Ð¾Ð²ÐµÐ´ÐµÐ½Ðµ\n   > [!answer] Ð¿Ñ€Ð¾Ð²Ð¾Ð´Ð¸Ñ‚ÑŒÑÑ\n\n9. Ð½Ð°Ð¿Ð¸ÑÐ°Ð½Ð¾ | Ð½Ð°Ð¿Ð¸ÑÐ°Ð½Ñ– | Ð¿Ð¸ÑˆÑƒÑ‚ÑŒÑÑ\n   > [!answer] Ð½Ð°Ð¿Ð¸ÑÐ°Ð½Ð¾\n\n10. Ð²Ñ–Ð´Ñ–Ð±Ñ€Ð°Ð½Ð¾ | Ð²Ñ–Ð´Ñ–Ð±Ñ€Ð°Ð½Ñ– | Ð²Ñ–Ð´Ð±Ð¸Ñ€Ð°ÑŽÑ‚ÑŒÑÑ\n    > [!answer] Ð²Ñ–Ð´Ñ–Ð±Ñ€Ð°Ð½Ð¾\n\n11. Ð·Ð°Ñ€Ð°Ñ…Ð¾Ð²Ð°Ð½Ð¾ | Ð·Ð°Ñ€Ð°Ñ…Ð¾Ð²Ð°Ð½Ñ– | Ð·Ð°Ñ€Ð°Ñ…Ð¾Ð²ÑƒÑŽÑ‚ÑŒÑÑ\n    > [!answer] Ð·Ð°Ñ€Ð°Ñ…Ð¾Ð²Ð°Ð½Ð¾\n\n12. Ð·Ð±ÑƒÐ´Ð¾Ð²Ð°Ð½Ð¾ | Ð·Ð±ÑƒÐ´Ð¾Ð²Ð°Ð½Ð° | Ð±ÑƒÐ´ÑƒÑ”Ñ‚ÑŒÑÑ\n    > [!answer] Ð·Ð±ÑƒÐ´Ð¾Ð²Ð°Ð½Ð¾\n\n13. ÑÐºÐ°Ð·Ð°Ð½Ð¾ | ÑÐºÐ°Ð·Ð°Ð»Ð° | Ð³Ð¾Ð²Ð¾Ñ€Ð¸Ñ‚ÑŒÑÑ\n    > [!answer] ÑÐºÐ°Ð·Ð°Ð½Ð¾\n\n14. Ð·Ð°Ð¿Ð»Ð°Ð½Ð¾Ð²Ð°Ð½Ð¾ | Ð·Ð°Ð¿Ð»Ð°Ð½Ð¾Ð²Ð°Ð½Ñ– | Ð¿Ð»Ð°Ð½ÑƒÑ”Ñ‚ÑŒÑÑ\n    > [!answer] Ð·Ð°Ð¿Ð»Ð°Ð½Ð¾Ð²Ð°Ð½Ð¾\n\n## mark-the-words: Ð—Ð½Ð°Ð¹Ð´Ñ–Ñ‚ÑŒ Ð¿Ð°ÑÐ¸Ð²Ð½Ñ– ÐºÐ¾Ð½ÑÑ‚Ñ€ÑƒÐºÑ†Ñ–Ñ—\n> ÐŸÐ¾Ð·Ð½Ð°Ñ‡Ñ‚Ðµ Ð²ÑÑ– Ð¿Ð°ÑÐ¸Ð²Ð½Ñ– Ð´Ñ–Ñ”ÑÐ»Ð¾Ð²Ð° Ñ‚Ð° Ð´Ñ–Ñ”Ð¿Ñ€Ð¸ÐºÐ¼ÐµÑ‚Ð½Ð¸ÐºÐ¸ Ð² Ñ‚ÐµÐºÑÑ‚Ñ–.\n\nÐ’Ñ‡Ð¾Ñ€Ð° [Ð±ÑƒÐ»Ð¾ Ð¾Ð³Ð¾Ð»Ð¾ÑˆÐµÐ½Ð¾] Ñ€ÐµÐ·ÑƒÐ»ÑŒÑ‚Ð°Ñ‚Ð¸ ÐºÐ¾Ð½ÐºÑƒÑ€ÑÑƒ. ÐŸÐµÑ€ÐµÐ¼Ð¾Ð¶Ñ†Ñ– [Ð²Ð¸Ð·Ð½Ð°Ñ‡ÐµÐ½Ñ–] Ð¶ÑƒÑ€Ñ– Ð¿Ñ–ÑÐ»Ñ Ñ‚Ñ€Ð¸Ð²Ð°Ð»Ð¾Ð³Ð¾ Ð¾Ð±Ð³Ð¾Ð²Ð¾Ñ€ÐµÐ½Ð½Ñ. ÐÐ°Ð³Ð¾Ñ€Ð¾Ð´Ð¸ [Ð²Ñ€ÑƒÑ‡ÐµÐ½Ñ–] Ð½Ð° ÑƒÑ€Ð¾Ñ‡Ð¸ÑÑ‚Ñ–Ð¹ Ñ†ÐµÑ€ÐµÐ¼Ð¾Ð½Ñ–Ñ—. Ð—Ð°Ñ€Ð°Ð· [Ð³Ð¾Ñ‚ÑƒÑŽÑ‚ÑŒÑÑ] ÑÐµÑ€Ñ‚Ð¸Ñ„Ñ–ÐºÐ°Ñ‚Ð¸ Ð´Ð»Ñ Ð²ÑÑ–Ñ… ÑƒÑ‡Ð°ÑÐ½Ð¸ÐºÑ–Ð². ÐžÑ€Ð³Ð°Ð½Ñ–Ð·Ð°Ñ‚Ð¾Ñ€Ð°Ð¼Ð¸ [Ð·Ð°Ð¿Ð»Ð°Ð½Ð¾Ð²Ð°Ð½Ð¾] Ð¿Ñ€Ð¾Ð²ÐµÑÑ‚Ð¸ Ð½Ð°ÑÑ‚ÑƒÐ¿Ð½Ð¸Ð¹ ÐºÐ¾Ð½ÐºÑƒÑ€Ñ Ñ‡ÐµÑ€ÐµÐ· Ñ€Ñ–Ðº. Ð—Ð°ÑÐ²ÐºÐ¸ [Ð¿Ñ€Ð¸Ð¹Ð¼Ð°ÑŽÑ‚ÑŒÑÑ] Ð²Ð¶Ðµ Ð· Ð½Ð°ÑÑ‚ÑƒÐ¿Ð½Ð¾Ð³Ð¾ Ð¼Ñ–ÑÑÑ†Ñ.\n\n> 6 Ð¿Ð°ÑÐ¸Ð²Ð½Ð¸Ñ… Ñ„Ð¾Ñ€Ð¼: Ð±ÑƒÐ»Ð¾ Ð¾Ð³Ð¾Ð»Ð¾ÑˆÐµÐ½Ð¾, Ð²Ð¸Ð·Ð½Ð°Ñ‡ÐµÐ½Ñ–, Ð²Ñ€ÑƒÑ‡ÐµÐ½Ñ–, Ð³Ð¾Ñ‚ÑƒÑŽÑ‚ÑŒÑÑ, Ð·Ð°Ð¿Ð»Ð°Ð½Ð¾Ð²Ð°Ð½Ð¾, Ð¿Ñ€Ð¸Ð¹Ð¼Ð°ÑŽÑ‚ÑŒÑÑ.\n\n## dialogue-reorder: Ð Ð¾Ð·Ð¼Ð¾Ð²Ð° Ð² Ð¾Ñ„Ñ–ÑÑ–\n> Ð Ð¾Ð·Ñ‚Ð°ÑˆÑƒÐ¹Ñ‚Ðµ Ñ€ÐµÐ¿Ð»Ñ–ÐºÐ¸ Ð´Ñ–Ð°Ð»Ð¾Ð³Ñƒ Ð² Ð¿Ñ€Ð°Ð²Ð¸Ð»ÑŒÐ½Ð¾Ð¼Ñƒ Ð¿Ð¾Ñ€ÑÐ´ÐºÑƒ.\n\n- Ð: Ð”Ð¾Ð±Ñ€Ð¸Ð¹ Ð´ÐµÐ½ÑŒ! ÐÐ° ÑÐºÐ¾Ð¼Ñƒ ÐµÑ‚Ð°Ð¿Ñ– Ð½Ð°Ñˆ Ð¿Ñ€Ð¾ÐµÐºÑ‚?\n- Ð‘: ÐŸÐµÑ€ÑˆÐ° Ñ‡Ð°ÑÑ‚Ð¸Ð½Ð° Ð²Ð¶Ðµ Ð·Ð°Ð²ÐµÑ€ÑˆÐµÐ½Ð°, Ð´Ð¾ÐºÑƒÐ¼ÐµÐ½Ñ‚Ð¸ Ð¿Ñ–Ð´Ð³Ð¾Ñ‚Ð¾Ð²Ð»ÐµÐ½Ð¾.\n- Ð: Ð Ñ‰Ð¾ Ð·Ð°Ñ€Ð°Ð· Ñ€Ð¾Ð±Ð¸Ñ‚ÑŒÑÑ?\n- Ð‘: Ð—Ð°Ñ€Ð°Ð· Ð³Ð¾Ñ‚ÑƒÑ”Ñ‚ÑŒÑÑ Ð¿Ñ€ÐµÐ·ÐµÐ½Ñ‚Ð°Ñ†Ñ–Ñ, ÑÐ»Ð°Ð¹Ð´Ð¸ Ñ€Ð¾Ð·Ñ€Ð¾Ð±Ð»ÑÑŽÑ‚ÑŒÑÑ Ð´Ð¸Ð·Ð°Ð¹Ð½ÐµÑ€Ð¾Ð¼.\n- Ð: ÐšÐ¾Ð»Ð¸ Ð²ÑÐµ Ð±ÑƒÐ´Ðµ Ð³Ð¾Ñ‚Ð¾Ð²Ðµ?\n- Ð‘: ÐŸÑ€ÐµÐ·ÐµÐ½Ñ‚Ð°Ñ†Ñ–ÑŽ Ð±ÑƒÐ´Ðµ Ð·Ð°Ð²ÐµÑ€ÑˆÐµÐ½Ð¾ Ð´Ð¾ Ð¿'ÑÑ‚Ð½Ð¸Ñ†Ñ–, Ð¼Ð°Ñ‚ÐµÑ€Ñ–Ð°Ð»Ð¸ Ð±ÑƒÐ´ÑƒÑ‚ÑŒ Ð½Ð°Ð´Ñ–ÑÐ»Ð°Ð½Ð¾ Ð¿Ð°Ñ€Ñ‚Ð½ÐµÑ€Ð°Ð¼.\n- Ð: Ð§ÑƒÐ´Ð¾Ð²Ð¾. Ð¥Ñ‚Ð¾ Ð¿Ñ€Ð¾Ð²Ð¾Ð´Ð¸Ñ‚Ð¸Ð¼Ðµ Ð·ÑƒÑÑ‚Ñ€Ñ–Ñ‡?\n- Ð‘: Ð—ÑƒÑÑ‚Ñ€Ñ–Ñ‡ Ð±ÑƒÐ´Ðµ Ð¿Ñ€Ð¾Ð²ÐµÐ´ÐµÐ½Ð° ÐºÐµÑ€Ñ–Ð²Ð½Ð¸ÐºÐ¾Ð¼ Ð²Ñ–Ð´Ð´Ñ–Ð»Ñƒ, Ð²ÑÐµ Ð¾Ñ€Ð³Ð°Ð½Ñ–Ð·Ð¾Ð²Ð°Ð½Ð¾.\n\n## select: ÐŸÑ€Ð°Ð²Ð¸Ð»ÑŒÐ½Ñ– Ð¿Ð°ÑÐ¸Ð²Ð½Ñ– ÐºÐ¾Ð½ÑÑ‚Ñ€ÑƒÐºÑ†Ñ–Ñ—\n> ÐžÐ±ÐµÑ€Ñ–Ñ‚ÑŒ ÑƒÑÑ– Ð³Ñ€Ð°Ð¼Ð°Ñ‚Ð¸Ñ‡Ð½Ð¾ Ð¿Ñ€Ð°Ð²Ð¸Ð»ÑŒÐ½Ñ– Ð²Ð°Ñ€Ñ–Ð°Ð½Ñ‚Ð¸.\n\n1. Ð¯Ðº Ð¿Ñ€Ð°Ð²Ð¸Ð»ÑŒÐ½Ð¾ ÑÐºÐ°Ð·Ð°Ñ‚Ð¸, Ñ‰Ð¾ Ñ…Ñ‚Ð¾ÑÑŒ Ð·Ð°Ð²ÐµÑ€ÑˆÐ¸Ð² Ñ€Ð¾Ð±Ð¾Ñ‚Ñƒ (Ð°ÐºÑ†ÐµÐ½Ñ‚ Ð½Ð° Ñ€ÐµÐ·ÑƒÐ»ÑŒÑ‚Ð°Ñ‚Ñ–)?\n   - [x] Ð Ð¾Ð±Ð¾Ñ‚Ñƒ Ð²Ð¸ÐºÐ¾Ð½Ð°Ð½Ð¾.\n   - [ ] Ð Ð¾Ð±Ð¾Ñ‚Ð° Ð²Ð¸ÐºÐ¾Ð½ÑƒÑ”Ñ‚ÑŒÑÑ.\n   - [x] Ð Ð¾Ð±Ð¾Ñ‚Ð° Ð²Ð¸ÐºÐ¾Ð½Ð°Ð½Ð°.\n   - [ ] Ð Ð¾Ð±Ð¾Ñ‚Ð° Ð²Ð¸ÐºÐ¾Ð½Ð°Ð»Ð°ÑÑŒ.\n   > ÐšÐ¾Ñ€Ð¾Ñ‚ÐºÐ¸Ð¹ Ð¿Ð°ÑÐ¸Ð² Â«Ð²Ð¸ÐºÐ¾Ð½Ð°Ð½Ð¾Â» Ñ– Ð¿Ð¾Ð²Ð½Ð¸Ð¹ Â«Ð²Ð¸ÐºÐ¾Ð½Ð°Ð½Ð°Â» â€” Ð¾Ð±Ð¸Ð´Ð²Ð° Ð¿Ñ–Ð´ÐºÑ€ÐµÑÐ»ÑŽÑŽÑ‚ÑŒ Ñ€ÐµÐ·ÑƒÐ»ÑŒÑ‚Ð°Ñ‚.\n\n2. Ð¯ÐºÑ– Ñ€ÐµÑ‡ÐµÐ½Ð½Ñ Ð¿Ñ€Ð°Ð²Ð¸Ð»ÑŒÐ½Ð¾ Ð¾Ð¿Ð¸ÑÑƒÑŽÑ‚ÑŒ Ð¿Ñ€Ð¾Ñ†ÐµÑ, Ñ‰Ð¾ Ñ‚Ñ€Ð¸Ð²Ð°Ñ”?\n   - [ ] Ð‘ÑƒÐ´Ð¸Ð½Ð¾Ðº Ð·Ð±ÑƒÐ´Ð¾Ð²Ð°Ð½Ð¾.\n   - [x] Ð‘ÑƒÐ´Ð¸Ð½Ð¾Ðº Ð±ÑƒÐ´ÑƒÑ”Ñ‚ÑŒÑÑ.\n   - [ ] Ð‘ÑƒÐ´Ð¸Ð½Ð¾Ðº Ð·Ð±ÑƒÐ´Ð¾Ð²Ð°Ð½Ð¸Ð¹.\n   - [x] ÐœÑ–ÑÑ‚ Ñ€ÐµÐ¼Ð¾Ð½Ñ‚ÑƒÑ”Ñ‚ÑŒÑÑ.\n   > Ð—Ð²Ð¾Ñ€Ð¾Ñ‚Ð½Ð¸Ð¹ Ð¿Ð°ÑÐ¸Ð² Â«Ð±ÑƒÐ´ÑƒÑ”Ñ‚ÑŒÑÑÂ», Â«Ñ€ÐµÐ¼Ð¾Ð½Ñ‚ÑƒÑ”Ñ‚ÑŒÑÑÂ» Ð¾Ð¿Ð¸ÑÑƒÑ” Ð¿Ñ€Ð¾Ñ†ÐµÑ.\n\n3. Ð¯ÐºÑ– ÐºÐ¾Ð½ÑÑ‚Ñ€ÑƒÐºÑ†Ñ–Ñ— Ð¿Ñ€Ð°Ð²Ð¸Ð»ÑŒÐ½Ñ– Ð´Ð»Ñ Ð¾Ñ„Ñ–Ñ†Ñ–Ð¹Ð½Ð¾Ð³Ð¾ Ð´Ð¾ÐºÑƒÐ¼ÐµÐ½Ñ‚Ð°?\n   - [x] Ð Ñ–ÑˆÐµÐ½Ð½Ñ Ð¿Ñ€Ð¸Ð¹Ð½ÑÑ‚Ð¾ Ð¾Ð´Ð½Ð¾Ð³Ð¾Ð»Ð¾ÑÐ½Ð¾.\n   - [x] Ð Ñ–ÑˆÐµÐ½Ð½Ñ Ð¿Ñ€Ð¸Ð¹Ð½ÑÑ‚Ðµ ÐºÐ¾Ð¼Ñ–ÑÑ–Ñ”ÑŽ.\n   - [ ] Ð Ñ–ÑˆÐµÐ½Ð½Ñ Ð¿Ñ€Ð¸Ð¹Ð¼Ð°Ñ”Ñ‚ÑŒÑÑ Ð²Ñ‡Ð¾Ñ€Ð°.\n   - [x] Ð‘ÑƒÐ»Ð¾ ÑƒÑ…Ð²Ð°Ð»ÐµÐ½Ð¾ Ð½Ð¾Ð²Ð¸Ð¹ Ð·Ð°ÐºÐ¾Ð½.\n   > ÐšÐ¾Ñ€Ð¾Ñ‚ÐºÐ¸Ð¹ Ñ– Ð¿Ð¾Ð²Ð½Ð¸Ð¹ Ð¿Ð°ÑÐ¸Ð² Ñ‚Ð¸Ð¿Ð¾Ð²Ñ– Ð´Ð»Ñ Ð¾Ñ„Ñ–Ñ†Ñ–Ð¹Ð½Ð¾Ð³Ð¾ ÑÑ‚Ð¸Ð»ÑŽ.\n\n4. Ð¯ÐºÑ– Ñ€ÐµÑ‡ÐµÐ½Ð½Ñ Ð¿Ñ€Ð°Ð²Ð¸Ð»ÑŒÐ½Ð¾ Ð¿ÐµÑ€ÐµÐ´Ð°ÑŽÑ‚ÑŒ Ð·Ð°Ð²ÐµÑ€ÑˆÐµÐ½Ñƒ Ð´Ñ–ÑŽ Ð· Ð²Ð¸ÐºÐ¾Ð½Ð°Ð²Ñ†ÐµÐ¼?\n   - [x] ÐšÐ½Ð¸Ð³Ð° Ð½Ð°Ð¿Ð¸ÑÐ°Ð½Ð° Ð²Ñ–Ð´Ð¾Ð¼Ð¸Ð¼ Ð°Ð²Ñ‚Ð¾Ñ€Ð¾Ð¼.\n   - [ ] ÐšÐ½Ð¸Ð³Ñƒ Ð½Ð°Ð¿Ð¸ÑÐ°Ð½Ð¾ Ð°Ð²Ñ‚Ð¾Ñ€Ð¾Ð¼ Ð²Ñ–Ð´Ð¾Ð¼Ð¸Ð¹.\n   - [x] ÐšÐ°Ñ€Ñ‚Ð¸Ð½Ð° Ð½Ð°Ð¼Ð°Ð»ÑŒÐ¾Ð²Ð°Ð½Ð° Ñ…ÑƒÐ´Ð¾Ð¶Ð½Ð¸ÐºÐ¾Ð¼.\n   - [ ] ÐšÐ°Ñ€Ñ‚Ð¸Ð½Ñƒ Ð½Ð°Ð¼Ð°Ð»ÑŒÐ¾Ð²Ð°Ð½Ð¾ Ñ…ÑƒÐ´Ð¾Ð¶Ð½Ð¸Ðº.\n   > ÐŸÐ¾Ð²Ð½Ð¸Ð¹ Ð¿Ð°ÑÐ¸Ð²: Ð¿Ñ–Ð´Ð¼ÐµÑ‚ + Ð´Ñ–Ñ”Ð¿Ñ€Ð¸ÐºÐ¼ÐµÑ‚Ð½Ð¸Ðº + Ð²Ð¸ÐºÐ¾Ð½Ð°Ð²ÐµÑ†ÑŒ Ð² Ð¾Ñ€ÑƒÐ´Ð½Ð¾Ð¼Ñƒ Ð²Ñ–Ð´Ð¼Ñ–Ð½ÐºÑƒ.\n\n5. Ð¯ÐºÑ– Ñ€ÐµÑ‡ÐµÐ½Ð½Ñ Ð³Ñ€Ð°Ð¼Ð°Ñ‚Ð¸Ñ‡Ð½Ð¾ Ð¿Ñ€Ð°Ð²Ð¸Ð»ÑŒÐ½Ñ– Ð´Ð»Ñ Ð¾Ð¿Ð¸ÑÑƒ Ñ€ÐµÐ³ÑƒÐ»ÑÑ€Ð½Ð¾Ñ— Ð´Ñ–Ñ—?\n   - [x] Ð¥Ð»Ñ–Ð± Ð²Ð¸Ð¿Ñ–ÐºÐ°Ñ”Ñ‚ÑŒÑÑ Ñ‰Ð¾Ñ€Ð°Ð½ÐºÑƒ Ð² Ð¿ÐµÐºÐ°Ñ€Ð½Ñ–.\n   - [ ] Ð¥Ð»Ñ–Ð± Ð²Ð¸Ð¿ÐµÑ‡ÐµÐ½Ð¾ Ñ‰Ð¾Ñ€Ð°Ð½ÐºÑƒ Ð² Ð¿ÐµÐºÐ°Ñ€Ð½Ñ–.\n   - [x] Ð“Ð°Ð·ÐµÑ‚Ð¸ Ð´Ñ€ÑƒÐºÑƒÑŽÑ‚ÑŒÑÑ Ñ‰Ð¾Ð´Ð½Ñ Ð¾ ÑˆÐ¾ÑÑ‚Ñ–Ð¹.\n   - [ ] Ð“Ð°Ð·ÐµÑ‚Ð¸ Ð½Ð°Ð´Ñ€ÑƒÐºÐ¾Ð²Ð°Ð½Ð¾ Ñ‰Ð¾Ð´Ð½Ñ Ð¾ ÑˆÐ¾ÑÑ‚Ñ–Ð¹.\n   > Ð—Ð²Ð¾Ñ€Ð¾Ñ‚Ð½Ð¸Ð¹ Ð¿Ð°ÑÐ¸Ð² Ð´Ð»Ñ Ñ€ÐµÐ³ÑƒÐ»ÑÑ€Ð½Ð¸Ñ… Ð¿Ñ€Ð¾Ñ†ÐµÑÑ–Ð²: Â«Ð²Ð¸Ð¿Ñ–ÐºÐ°Ñ”Ñ‚ÑŒÑÑÂ», Â«Ð´Ñ€ÑƒÐºÑƒÑŽÑ‚ÑŒÑÑÂ».\n\n6. Ð¯ÐºÑ– ÐºÐ¾Ð½ÑÑ‚Ñ€ÑƒÐºÑ†Ñ–Ñ— Ð· Ð´Ð°Ð²Ð°Ð»ÑŒÐ½Ð¸Ð¼ Ð²Ñ–Ð´Ð¼Ñ–Ð½ÐºÐ¾Ð¼ Ð¿Ñ€Ð°Ð²Ð¸Ð»ÑŒÐ½Ñ–?\n   - [x] ÐœÐµÐ½Ñ– Ð±ÑƒÐ»Ð¾ ÑÐºÐ°Ð·Ð°Ð½Ð¾ Ñ‡ÐµÐºÐ°Ñ‚Ð¸.\n   - [x] ÐÐ°Ð¼ Ð´Ð¾Ñ€ÑƒÑ‡ÐµÐ½Ð¾ Ñ†Ðµ Ð·Ð°Ð²Ð´Ð°Ð½Ð½Ñ.\n   - [ ] ÐœÐµÐ½Ðµ Ð±ÑƒÐ»Ð¾ ÑÐºÐ°Ð·Ð°Ð½Ð¾ Ñ‡ÐµÐºÐ°Ñ‚Ð¸.\n   - [ ] ÐÐ°Ñ Ð´Ð¾Ñ€ÑƒÑ‡ÐµÐ½Ð¾ Ñ†Ðµ Ð·Ð°Ð²Ð´Ð°Ð½Ð½Ñ.\n   > Ð”Ð°Ð²Ð°Ð»ÑŒÐ½Ð¸Ð¹ Ð²Ñ–Ð´Ð¼Ñ–Ð½Ð¾Ðº (Ð¼ÐµÐ½Ñ–, Ð½Ð°Ð¼) + ÐºÐ¾Ñ€Ð¾Ñ‚ÐºÐ¸Ð¹ Ð¿Ð°ÑÐ¸Ð².\n\n## translate: ÐŸÐµÑ€ÐµÐºÐ»Ð°Ð´Ñ–Ñ‚ÑŒ ÑƒÐºÑ€Ð°Ñ—Ð½ÑÑŒÐºÐ¾ÑŽ\n> ÐžÐ±ÐµÑ€Ñ–Ñ‚ÑŒ Ð¿Ñ€Ð°Ð²Ð¸Ð»ÑŒÐ½Ð¸Ð¹ Ð¿ÐµÑ€ÐµÐºÐ»Ð°Ð´ Ñ–Ð· Ð²Ð¸ÐºÐ¾Ñ€Ð¸ÑÑ‚Ð°Ð½Ð½ÑÐ¼ Ð¿Ð°ÑÐ¸Ð²Ð½Ð¾Ñ— ÐºÐ¾Ð½ÑÑ‚Ñ€ÑƒÐºÑ†Ñ–Ñ—.\n\n1. The book was written by a famous author.\n   - [x] ÐšÐ½Ð¸Ð³Ð° Ð½Ð°Ð¿Ð¸ÑÐ°Ð½Ð° Ð²Ñ–Ð´Ð¾Ð¼Ð¸Ð¼ Ð°Ð²Ñ‚Ð¾Ñ€Ð¾Ð¼.\n   - [ ] ÐšÐ½Ð¸Ð³Ñƒ Ð½Ð°Ð¿Ð¸ÑÐ°Ð½Ð¾ Ð°Ð²Ñ‚Ð¾Ñ€Ð¾Ð¼ Ð²Ñ–Ð´Ð¾Ð¼Ð¸Ð¹.\n   - [ ] ÐšÐ½Ð¸Ð³Ð° Ð¿Ð¸ÑˆÐµÑ‚ÑŒÑÑ Ð²Ñ–Ð´Ð¾Ð¼Ð¸Ð¼ Ð°Ð²Ñ‚Ð¾Ñ€Ð¾Ð¼.\n   - [ ] ÐšÐ½Ð¸Ð³Ð¸ Ð½Ð°Ð¿Ð¸ÑÐ°Ð½Ñ– Ð°Ð²Ñ‚Ð¾Ñ€Ð¾Ð¼ Ð²Ñ–Ð´Ð¾Ð¼Ð¾Ð¼Ñƒ.\n   > ÐŸÐ¾Ð²Ð½Ð¸Ð¹ Ð¿Ð°ÑÐ¸Ð² Ð· Ð²Ð¸ÐºÐ¾Ð½Ð°Ð²Ñ†ÐµÐ¼: Â«ÐšÐ½Ð¸Ð³Ð° Ð½Ð°Ð¿Ð¸ÑÐ°Ð½Ð° Ð°Ð²Ñ‚Ð¾Ñ€Ð¾Ð¼Â».\n\n2. A decision has been made.\n   - [ ] Ð Ñ–ÑˆÐµÐ½Ð½Ñ Ð¿Ñ€Ð¸Ð¹Ð¼Ð°Ñ”Ñ‚ÑŒÑÑ.\n   - [x] Ð Ñ–ÑˆÐµÐ½Ð½Ñ Ð¿Ñ€Ð¸Ð¹Ð½ÑÑ‚Ð¾.\n   - [ ] Ð Ñ–ÑˆÐµÐ½Ð½Ñ Ð¿Ñ€Ð¸Ð¹Ð½ÑÑ‚Ð¸Ð¹.\n   - [ ] Ð Ñ–ÑˆÐµÐ½Ð½Ñ Ð¿Ñ€Ð¸Ð¹Ð¼Ð°Ð»Ð¾ÑÑ.\n   > ÐšÐ¾Ñ€Ð¾Ñ‚ÐºÐ¸Ð¹ Ð¿Ð°ÑÐ¸Ð² Ð´Ð»Ñ Ñ€ÐµÐ·ÑƒÐ»ÑŒÑ‚Ð°Ñ‚Ñƒ: Â«Ð Ñ–ÑˆÐµÐ½Ð½Ñ Ð¿Ñ€Ð¸Ð¹Ð½ÑÑ‚Ð¾Â».\n\n3. Bread is baked every morning.\n   - [ ] Ð¥Ð»Ñ–Ð± Ð²Ð¸Ð¿ÐµÑ‡ÐµÐ½Ð¾ Ñ‰Ð¾Ñ€Ð°Ð½ÐºÑƒ.\n   - [ ] Ð¥Ð»Ñ–Ð± Ð²Ð¸Ð¿ÐµÑ‡ÐµÐ½Ð¸Ð¹ Ñ‰Ð¾Ñ€Ð°Ð½ÐºÑƒ.\n   - [x] Ð¥Ð»Ñ–Ð± Ð²Ð¸Ð¿Ñ–ÐºÐ°Ñ”Ñ‚ÑŒÑÑ Ñ‰Ð¾Ñ€Ð°Ð½ÐºÑƒ.\n   - [ ] Ð¥Ð»Ñ–Ð±Ð° Ð²Ð¸Ð¿Ñ–ÐºÐ°Ð½Ð¾ Ñ‰Ð¾Ñ€Ð°Ð½ÐºÑƒ.\n   > Ð—Ð²Ð¾Ñ€Ð¾Ñ‚Ð½Ð¸Ð¹ Ð¿Ð°ÑÐ¸Ð² Ð´Ð»Ñ Ñ€ÐµÐ³ÑƒÐ»ÑÑ€Ð½Ð¾Ð³Ð¾ Ð¿Ñ€Ð¾Ñ†ÐµÑÑƒ: Â«Ð¥Ð»Ñ–Ð± Ð²Ð¸Ð¿Ñ–ÐºÐ°Ñ”Ñ‚ÑŒÑÑÂ».\n\n4. The documents were prepared by the secretary.\n   - [ ] Ð”Ð¾ÐºÑƒÐ¼ÐµÐ½Ñ‚Ð¸ Ð³Ð¾Ñ‚ÑƒÑŽÑ‚ÑŒÑÑ ÑÐµÐºÑ€ÐµÑ‚Ð°Ñ€ÐµÐ¼.\n   - [x] Ð”Ð¾ÐºÑƒÐ¼ÐµÐ½Ñ‚Ð¸ Ð¿Ñ–Ð´Ð³Ð¾Ñ‚Ð¾Ð²Ð»ÐµÐ½Ñ– ÑÐµÐºÑ€ÐµÑ‚Ð°Ñ€ÐµÐ¼.\n   - [ ] Ð”Ð¾ÐºÑƒÐ¼ÐµÐ½Ñ‚Ñ–Ð² Ð¿Ñ–Ð´Ð³Ð¾Ñ‚Ð¾Ð²Ð»ÐµÐ½Ð¾ ÑÐµÐºÑ€ÐµÑ‚Ð°Ñ€ÐµÐ¼.\n   - [ ] Ð”Ð¾ÐºÑƒÐ¼ÐµÐ½Ñ‚Ð¸ Ð¿Ñ–Ð´Ð³Ð¾Ñ‚Ð¾Ð²Ð»ÐµÐ½Ð¸Ð¹ ÑÐµÐºÑ€ÐµÑ‚Ð°Ñ€ÐºÐ¾ÑŽ.\n   > ÐŸÐ¾Ð²Ð½Ð¸Ð¹ Ð¿Ð°ÑÐ¸Ð²: Â«Ð”Ð¾ÐºÑƒÐ¼ÐµÐ½Ñ‚Ð¸ Ð¿Ñ–Ð´Ð³Ð¾Ñ‚Ð¾Ð²Ð»ÐµÐ½Ñ– ÑÐµÐºÑ€ÐµÑ‚Ð°Ñ€ÐµÐ¼Â».\n\n5. The problem is being solved now.\n   - [ ] ÐŸÑ€Ð¾Ð±Ð»ÐµÐ¼Ñƒ Ð²Ð¸Ñ€Ñ–ÑˆÐµÐ½Ð¾ Ð·Ð°Ñ€Ð°Ð·.\n   - [ ] ÐŸÑ€Ð¾Ð±Ð»ÐµÐ¼Ð° Ð²Ð¸Ñ€Ñ–ÑˆÐµÐ½Ð° Ð·Ð°Ñ€Ð°Ð·.\n   - [x] ÐŸÑ€Ð¾Ð±Ð»ÐµÐ¼Ð° Ð²Ð¸Ñ€Ñ–ÑˆÑƒÑ”Ñ‚ÑŒÑÑ Ð·Ð°Ñ€Ð°Ð·.\n   - [ ] ÐŸÑ€Ð¾Ð±Ð»ÐµÐ¼Ð¸ Ð²Ð¸Ñ€Ñ–ÑˆÑƒÑŽÑ‚ÑŒÑÑ Ð·Ð°Ñ€Ð°Ð·.\n   > Ð—Ð²Ð¾Ñ€Ð¾Ñ‚Ð½Ð¸Ð¹ Ð¿Ð°ÑÐ¸Ð² Ð´Ð»Ñ Ð¿Ñ€Ð¾Ñ†ÐµÑÑƒ: Â«ÐŸÑ€Ð¾Ð±Ð»ÐµÐ¼Ð° Ð²Ð¸Ñ€Ñ–ÑˆÑƒÑ”Ñ‚ÑŒÑÑÂ».\n\n6. I was told to wait.\n   - [ ] Ð¯ ÑÐºÐ°Ð·Ð°Ð½Ð¸Ð¹ Ñ‡ÐµÐºÐ°Ñ‚Ð¸.\n   - [x] ÐœÐµÐ½Ñ– Ð±ÑƒÐ»Ð¾ ÑÐºÐ°Ð·Ð°Ð½Ð¾ Ñ‡ÐµÐºÐ°Ñ‚Ð¸.\n   - [ ] ÐœÐµÐ½Ðµ ÑÐºÐ°Ð·Ð°Ð½Ð¾ Ñ‡ÐµÐºÐ°Ñ‚Ð¸.\n   - [ ] ÐœÐ½Ð¾ÑŽ ÑÐºÐ°Ð·Ð°Ð½Ð¾ Ñ‡ÐµÐºÐ°Ñ‚Ð¸.\n   > Ð”Ð°Ð²Ð°Ð»ÑŒÐ½Ð¸Ð¹ Ð²Ñ–Ð´Ð¼Ñ–Ð½Ð¾Ðº + ÐºÐ¾Ñ€Ð¾Ñ‚ÐºÐ¸Ð¹ Ð¿Ð°ÑÐ¸Ð²: Â«ÐœÐµÐ½Ñ– Ð±ÑƒÐ»Ð¾ ÑÐºÐ°Ð·Ð°Ð½Ð¾Â».\n\n---"
      },
      {
        "id": "section-3",
        "name": "ÐŸÑ–Ð´ÑÑƒÐ¼Ð¾Ðº",
        "nameEn": null,
        "type": "summary",
        "content": "**Ð©Ð¾ Ð²Ð¸ Ð½Ð°Ð²Ñ‡Ð¸Ð»Ð¸ÑÑ:**\n\n1. Ð£ÐºÑ€Ð°Ñ—Ð½ÑÑŒÐºÐ° Ð¼Ð°Ñ” Ñ‚Ñ€Ð¸ Ñ‚Ð¸Ð¿Ð¸ Ð¿Ð°ÑÐ¸Ð²Ð½Ð¸Ñ… ÐºÐ¾Ð½ÑÑ‚Ñ€ÑƒÐºÑ†Ñ–Ð¹: Ð¿Ð¾Ð²Ð½Ð¸Ð¹ Ð¿Ð°ÑÐ¸Ð² (Ð· Ð´Ñ–Ñ”Ð¿Ñ€Ð¸ÐºÐ¼ÐµÑ‚Ð½Ð¸ÐºÐ¾Ð¼), ÐºÐ¾Ñ€Ð¾Ñ‚ÐºÐ¸Ð¹ Ð¿Ð°ÑÐ¸Ð² (-Ð½Ð¾/-Ñ‚Ð¾) Ñ‚Ð° Ð·Ð²Ð¾Ñ€Ð¾Ñ‚Ð½Ð¸Ð¹ Ð¿Ð°ÑÐ¸Ð² (-ÑÑ).\n2. ÐŸÐ¾Ð²Ð½Ð¸Ð¹ Ð¿Ð°ÑÐ¸Ð² Ð²Ð¸ÐºÐ¾Ñ€Ð¸ÑÑ‚Ð¾Ð²ÑƒÑ”Ñ‚ÑŒÑÑ, ÐºÐ¾Ð»Ð¸ Ð¿Ð¾Ñ‚Ñ€Ñ–Ð±Ð½Ð¾ Ð½Ð°Ð·Ð²Ð°Ñ‚Ð¸ Ð²Ð¸ÐºÐ¾Ð½Ð°Ð²Ñ†Ñ: Â«ÐšÐ½Ð¸Ð³Ð° Ð½Ð°Ð¿Ð¸ÑÐ°Ð½Ð° Ð°Ð²Ñ‚Ð¾Ñ€Ð¾Ð¼Â».\n3. ÐšÐ¾Ñ€Ð¾Ñ‚ÐºÐ¸Ð¹ Ð¿Ð°ÑÐ¸Ð² Ð¿Ñ–Ð´ÐºÑ€ÐµÑÐ»ÑŽÑ” Ñ€ÐµÐ·ÑƒÐ»ÑŒÑ‚Ð°Ñ‚ Ð±ÐµÐ· Ð²Ð¸ÐºÐ¾Ð½Ð°Ð²Ñ†Ñ: Â«ÐšÐ½Ð¸Ð³Ñƒ Ð½Ð°Ð¿Ð¸ÑÐ°Ð½Ð¾Â».\n4. Ð—Ð²Ð¾Ñ€Ð¾Ñ‚Ð½Ð¸Ð¹ Ð¿Ð°ÑÐ¸Ð² Ð¾Ð¿Ð¸ÑÑƒÑ” Ð¿Ñ€Ð¾Ñ†ÐµÑ: Â«ÐšÐ½Ð¸Ð³Ð° Ð¿Ð¸ÑˆÐµÑ‚ÑŒÑÑ ÑˆÐ²Ð¸Ð´ÐºÐ¾Â».\n5. ÐšÐ¾Ð¶ÐµÐ½ Ñ‚Ð¸Ð¿ Ð¼Ð°Ñ” ÑÐ²Ñ–Ð¹ ÑÑ‚Ð¸Ð»Ñ–ÑÑ‚Ð¸Ñ‡Ð½Ð¸Ð¹ Ð²Ñ–Ð´Ñ‚Ñ–Ð½Ð¾Ðº Ñ– ÑÑ„ÐµÑ€Ñƒ Ð²Ð¶Ð¸Ð²Ð°Ð½Ð½Ñ.\n\n**ÐžÑÐ½Ð¾Ð²Ð½Ðµ Ð¿Ñ€Ð°Ð²Ð¸Ð»Ð¾:**\n\n> ÐžÐ±Ð¸Ñ€Ð°Ð¹Ñ‚Ðµ Ñ‚Ð¸Ð¿ Ð¿Ð°ÑÐ¸Ð²Ñƒ Ð·Ð°Ð»ÐµÐ¶Ð½Ð¾ Ð²Ñ–Ð´ Ñ‚Ð¾Ð³Ð¾, Ñ‰Ð¾ Ð²Ð°Ð¶Ð»Ð¸Ð²Ñ–ÑˆÐµ: Ð²Ð¸ÐºÐ¾Ð½Ð°Ð²ÐµÑ†ÑŒ (Ð¿Ð¾Ð²Ð½Ð¸Ð¹ Ð¿Ð°ÑÐ¸Ð²), Ñ€ÐµÐ·ÑƒÐ»ÑŒÑ‚Ð°Ñ‚ (ÐºÐ¾Ñ€Ð¾Ñ‚ÐºÐ¸Ð¹ Ð¿Ð°ÑÐ¸Ð²) Ñ‡Ð¸ Ð¿Ñ€Ð¾Ñ†ÐµÑ (Ð·Ð²Ð¾Ñ€Ð¾Ñ‚Ð½Ð¸Ð¹ Ð¿Ð°ÑÐ¸Ð²).\n\n**Ð”Ð°Ð»Ñ–:**\n\nÐ£ Ð½Ð°ÑÑ‚ÑƒÐ¿Ð½Ð¾Ð¼Ñƒ Ð¼Ð¾Ð´ÑƒÐ»Ñ– Ð¼Ð¸ Ñ€Ð¾Ð·Ð³Ð»ÑÐ½ÐµÐ¼Ð¾ Ð´ÐµÐ¼Ñ–Ð½ÑƒÑ‚Ð¸Ð²Ð¸ (Ð¿ÐµÑÑ‚Ð»Ð¸Ð²Ñ– Ñ„Ð¾Ñ€Ð¼Ð¸) â€” Ð²Ð°Ð¶Ð»Ð¸Ð²Ð¸Ð¹ ÐµÐ»ÐµÐ¼ÐµÐ½Ñ‚ ÑƒÐºÑ€Ð°Ñ—Ð½ÑÑŒÐºÐ¾Ñ— Ð¼Ð¾Ð²Ð¸, ÑÐºÐ¸Ð¹ Ð²Ð¸Ñ€Ð°Ð¶Ð°Ñ” Ð½Ñ–Ð¶Ð½Ñ–ÑÑ‚ÑŒ, Ñ–Ñ€Ð¾Ð½Ñ–ÑŽ Ð°Ð±Ð¾ Ð²Ð²Ñ–Ñ‡Ð»Ð¸Ð²Ñ–ÑÑ‚ÑŒ.\n\n> âœ… **Ð¡Ð°Ð¼Ð¾Ð¿ÐµÑ€ÐµÐ²Ñ–Ñ€ÐºÐ°**\n>\n> Ð§Ð¸ Ð¼Ð¾Ð¶ÐµÑ‚Ðµ Ð²Ð¸:\n> - [ ] Ð Ð¾Ð·Ñ€Ñ–Ð·Ð½Ð¸Ñ‚Ð¸ Ñ‚Ñ€Ð¸ Ñ‚Ð¸Ð¿Ð¸ Ð¿Ð°ÑÐ¸Ð²Ð½Ð¸Ñ… ÐºÐ¾Ð½ÑÑ‚Ñ€ÑƒÐºÑ†Ñ–Ð¹?\n> - [ ] Ð¢Ñ€Ð°Ð½ÑÑ„Ð¾Ñ€Ð¼ÑƒÐ²Ð°Ñ‚Ð¸ Ð°ÐºÑ‚Ð¸Ð²Ð½Ðµ Ñ€ÐµÑ‡ÐµÐ½Ð½Ñ Ð² ÑƒÑÑ– Ñ‚Ñ€Ð¸ Ñ‚Ð¸Ð¿Ð¸ Ð¿Ð°ÑÐ¸Ð²Ñƒ?\n> - [ ] ÐžÐ±Ñ€Ð°Ñ‚Ð¸ Ð¿Ñ€Ð°Ð²Ð¸Ð»ÑŒÐ½Ð¸Ð¹ Ñ‚Ð¸Ð¿ Ð¿Ð°ÑÐ¸Ð²Ñƒ Ð·Ð°Ð»ÐµÐ¶Ð½Ð¾ Ð²Ñ–Ð´ ÐºÐ¾Ð½Ñ‚ÐµÐºÑÑ‚Ñƒ?\n> - [ ] Ð’Ð¸ÐºÐ¾Ñ€Ð¸ÑÑ‚Ð¾Ð²ÑƒÐ²Ð°Ñ‚Ð¸ Ð¿Ð°ÑÐ¸Ð² Ñƒ Ñ€Ñ–Ð·Ð½Ð¸Ñ… Ñ‡Ð°ÑÐ¾Ð²Ð¸Ñ… Ñ„Ð¾Ñ€Ð¼Ð°Ñ…?\n>\n> Ð¯ÐºÑ‰Ð¾ Ñ‚Ð°Ðº â€” Ð²Ð¸ Ð³Ð¾Ñ‚Ð¾Ð²Ñ– Ð´Ð¾ Ð¼Ð¾Ð´ÑƒÐ»Ñ Ð¿Ñ€Ð¾ Ð´ÐµÐ¼Ñ–Ð½ÑƒÑ‚Ð¸Ð²Ð¸!\n\n---"
      },
      {
        "id": "section-4",
        "name": "Ð¡Ð»Ð¾Ð²Ð½Ð¸Ðº",
        "nameEn": null,
        "type": "vocabulary",
        "content": "| Ð¡Ð»Ð¾Ð²Ð¾ | ÐŸÐµÑ€ÐµÐºÐ»Ð°Ð´ | ÐŸÑ€Ð¸Ð¼Ñ–Ñ‚ÐºÐ¸ |\n|-------|----------|----------|\n| **Ð°Ð²Ñ‚Ð¾Ñ€** | author | Ñ‚Ð¾Ð¹, Ñ…Ñ‚Ð¾ ÑÑ‚Ð²Ð¾Ñ€Ð¸Ð² Ñ‚Ð²Ñ–Ñ€ |\n| **Ð²Ð¸ÐºÐ¾Ð½Ð°Ð²ÐµÑ†ÑŒ** | performer, executor | Ñ‚Ð¾Ð¹, Ñ…Ñ‚Ð¾ Ð²Ð¸ÐºÐ¾Ð½ÑƒÑ” Ð´Ñ–ÑŽ |\n| **Ñ‚Ð²Ð¾Ñ€ÐµÑ†ÑŒ** | creator | Ñ‚Ð¾Ð¹, Ñ…Ñ‚Ð¾ ÑÑ‚Ð²Ð¾Ñ€ÑŽÑ” |\n| **Ð·Ð°ÑÐ½Ð¾Ð²Ð½Ð¸Ðº** | founder | Ñ‚Ð¾Ð¹, Ñ…Ñ‚Ð¾ Ð·Ð°ÑÐ½ÑƒÐ²Ð°Ð² |\n| **Ñ–Ð½Ñ–Ñ†Ñ–Ð°Ñ‚Ð¾Ñ€** | initiator | Ñ‚Ð¾Ð¹, Ñ…Ñ‚Ð¾ Ñ–Ð½Ñ–Ñ†Ñ–ÑŽÑ” |\n| **Ð¾Ñ€Ð³Ð°Ð½Ñ–Ð·Ð°Ñ‚Ð¾Ñ€** | organizer | Ñ‚Ð¾Ð¹, Ñ…Ñ‚Ð¾ Ð¾Ñ€Ð³Ð°Ð½Ñ–Ð·Ð¾Ð²ÑƒÑ” |\n| **Ð²Ñ–Ð´Ð¿Ð¾Ð²Ñ–Ð´Ð°Ð»ÑŒÐ½Ð¸Ð¹** | responsible | Ñ‚Ð¾Ð¹, Ñ…Ñ‚Ð¾ Ð½ÐµÑÐµ Ð²Ñ–Ð´Ð¿Ð¾Ð²Ñ–Ð´Ð°Ð»ÑŒÐ½Ñ–ÑÑ‚ÑŒ |\n| **Ð¿Ñ€Ð¸Ñ‡ÐµÑ‚Ð½Ð¸Ð¹** | involved | Ñ‚Ð¾Ð¹, Ñ…Ñ‚Ð¾ Ð¼Ð°Ñ” Ð²Ñ–Ð´Ð½Ð¾ÑˆÐµÐ½Ð½Ñ |\n| **Ð·Ð°Ð»ÑƒÑ‡ÐµÐ½Ð¸Ð¹** | engaged, involved | Ñ‚Ð¾Ð¹, ÐºÐ¾Ð³Ð¾ Ð·Ð°Ð»ÑƒÑ‡Ð¸Ð»Ð¸ |\n| **Ð·Ð°Ð´Ñ–ÑÐ½Ð¸Ð¹** | employed, involved | Ñ‚Ð¾Ð¹, ÐºÐ¾Ð³Ð¾ Ð·Ð°Ð´Ñ–ÑÐ»Ð¸ |\n| **ÑƒÑ€Ð°Ð¶ÐµÐ½Ð¸Ð¹** | affected, struck | Ñ‚Ð¾Ð¹, ÐºÐ¾Ð³Ð¾ Ð²Ñ€Ð°Ð·Ð¸Ð»Ð¾ |\n| **Ð²Ñ€Ð°Ð¶ÐµÐ½Ð¸Ð¹** | impressed, amazed | Ñ‚Ð¾Ð¹, Ñ…Ñ‚Ð¾ Ð¿Ñ–Ð´ Ð²Ñ€Ð°Ð¶ÐµÐ½Ð½ÑÐ¼ |\n| **Ð·Ð²Ð¾Ñ€ÑƒÑˆÐµÐ½Ð¸Ð¹** | touched, moved | Ñ‚Ð¾Ð¹, ÐºÐ¾Ð³Ð¾ Ð·Ð²Ð¾Ñ€ÑƒÑˆÐ¸Ð»Ð¾ |\n| **Ð·Ð´Ð¸Ð²Ð¾Ð²Ð°Ð½Ð¸Ð¹** | surprised | Ñ‚Ð¾Ð¹, Ñ…Ñ‚Ð¾ Ð·Ð´Ð¸Ð²ÑƒÐ²Ð°Ð²ÑÑ |\n| **Ñ€Ð¾Ð·Ñ‡Ð°Ñ€Ð¾Ð²Ð°Ð½Ð¸Ð¹** | disappointed | Ñ‚Ð¾Ð¹, Ñ…Ñ‚Ð¾ Ñ€Ð¾Ð·Ñ‡Ð°Ñ€ÑƒÐ²Ð°Ð²ÑÑ |\n| **Ð·Ð°Ð´Ð¾Ð²Ð¾Ð»ÐµÐ½Ð¸Ð¹** | satisfied | Ñ‚Ð¾Ð¹, Ñ…Ñ‚Ð¾ Ð·Ð°Ð´Ð¾Ð²Ð¾Ð»ÐµÐ½Ð¸Ð¹ |\n| **ÑÑ‚ÑƒÑ€Ð±Ð¾Ð²Ð°Ð½Ð¸Ð¹** | worried, concerned | Ñ‚Ð¾Ð¹, Ñ…Ñ‚Ð¾ Ñ‚ÑƒÑ€Ð±ÑƒÑ”Ñ‚ÑŒÑÑ |\n| **Ð¿ÐµÑ€ÐµÐºÐ¾Ð½Ð°Ð½Ð¸Ð¹** | convinced | Ñ‚Ð¾Ð¹, ÐºÐ¾Ð³Ð¾ Ð¿ÐµÑ€ÐµÐºÐ¾Ð½Ð°Ð»Ð¸ |\n| **Ð·Ð¼ÑƒÑˆÐµÐ½Ð¸Ð¹** | forced, compelled | Ñ‚Ð¾Ð¹, ÐºÐ¾Ð³Ð¾ Ð·Ð¼ÑƒÑÐ¸Ð»Ð¸ |\n| **Ð·Ð¾Ð±Ð¾Ð²'ÑÐ·Ð°Ð½Ð¸Ð¹** | obliged | Ñ‚Ð¾Ð¹, Ñ…Ñ‚Ð¾ Ð¼Ð°Ñ” Ð¾Ð±Ð¾Ð²'ÑÐ·Ð¾Ðº |\n| **Ð¿Ð°ÑÐ¸Ð²Ð½Ð¸Ð¹ ÑÑ‚Ð°Ð½** | passive voice | Ð³Ñ€Ð°Ð¼Ð°Ñ‚Ð¸Ñ‡Ð½Ð° ÐºÐ°Ñ‚ÐµÐ³Ð¾Ñ€Ñ–Ñ |\n| **Ð°ÐºÑ‚Ð¸Ð²Ð½Ð¸Ð¹ ÑÑ‚Ð°Ð½** | active voice | Ð³Ñ€Ð°Ð¼Ð°Ñ‚Ð¸Ñ‡Ð½Ð° ÐºÐ°Ñ‚ÐµÐ³Ð¾Ñ€Ñ–Ñ |\n| **Ð·Ð²Ð¾Ñ€Ð¾Ñ‚Ð½Ð¸Ð¹ Ð¿Ð°ÑÐ¸Ð²** | reflexive passive | ÐºÐ¾Ð½ÑÑ‚Ñ€ÑƒÐºÑ†Ñ–Ñ Ð· -ÑÑ |\n| **Ð²Ð¸ÐºÐ¾Ð½Ð°Ð²ÐµÑ†ÑŒ Ð´Ñ–Ñ—** | agent | Ñ‚Ð¾Ð¹, Ñ…Ñ‚Ð¾ Ð²Ð¸ÐºÐ¾Ð½ÑƒÑ” Ð´Ñ–ÑŽ |\n| **Ð¾Ñ€ÑƒÐ´Ð½Ð¸Ð¹ Ð²Ñ–Ð´Ð¼Ñ–Ð½Ð¾Ðº** | instrumental case | Ð´Ð»Ñ Ð²Ð¸ÐºÐ¾Ð½Ð°Ð²Ñ†Ñ |\n| **Ñ‚Ñ€Ð°Ð½ÑÑ„Ð¾Ñ€Ð¼Ð°Ñ†Ñ–Ñ** | transformation | Ð·Ð¼Ñ–Ð½Ð° ÑÑ‚Ñ€ÑƒÐºÑ‚ÑƒÑ€Ð¸ Ñ€ÐµÑ‡ÐµÐ½Ð½Ñ |\n| **ÑƒÐ·Ð³Ð¾Ð´Ð¶ÐµÐ½Ð½Ñ** | agreement | Ð³Ñ€Ð°Ð¼Ð°Ñ‚Ð¸Ñ‡Ð½Ðµ ÑƒÐ·Ð³Ð¾Ð´Ð¶ÐµÐ½Ð½Ñ |\n| **Ð´Ð¾Ð´Ð°Ñ‚Ð¾Ðº** | object | Ð³Ñ€Ð°Ð¼Ð°Ñ‚Ð¸Ñ‡Ð½Ð¸Ð¹ Ñ‚ÐµÑ€Ð¼Ñ–Ð½ |\n| **Ð¿Ñ–Ð´Ð¼ÐµÑ‚** | subject | Ð³Ñ€Ð°Ð¼Ð°Ñ‚Ð¸Ñ‡Ð½Ð¸Ð¹ Ñ‚ÐµÑ€Ð¼Ñ–Ð½ |\n| **Ð¿Ñ€Ð¸ÑÑƒÐ´Ð¾Ðº** | predicate | Ð³Ñ€Ð°Ð¼Ð°Ñ‚Ð¸Ñ‡Ð½Ð¸Ð¹ Ñ‚ÐµÑ€Ð¼Ñ–Ð½ |\n| **Ð´Ñ–Ñ”Ð¿Ñ€Ð¸ÐºÐ¼ÐµÑ‚Ð½Ð¸Ðº** | participle | Ð´Ñ–Ñ”ÑÐ»Ñ–Ð²Ð½Ð° Ñ„Ð¾Ñ€Ð¼Ð° |\n| **Ð¿Ð¾Ð²Ð½Ð¸Ð¹ Ð¿Ð°ÑÐ¸Ð²** | full passive | Ð· Ð´Ñ–Ñ”Ð¿Ñ€Ð¸ÐºÐ¼ÐµÑ‚Ð½Ð¸ÐºÐ¾Ð¼ |\n| **ÐºÐ¾Ñ€Ð¾Ñ‚ÐºÐ¸Ð¹ Ð¿Ð°ÑÐ¸Ð²** | short passive | -Ð½Ð¾/-Ñ‚Ð¾ Ñ„Ð¾Ñ€Ð¼Ð° |\n| **Ñ€ÐµÐ·ÑƒÐ»ÑŒÑ‚Ð°Ñ‚** | result | Ð¿Ñ–Ð´ÐºÑ€ÐµÑÐ»ÑŽÑ”Ñ‚ÑŒÑÑ ÐºÐ¾Ñ€Ð¾Ñ‚ÐºÐ¸Ð¼ Ð¿Ð°ÑÐ¸Ð²Ð¾Ð¼ |\n| **Ð¿Ñ€Ð¾Ñ†ÐµÑ** | process | Ð¿Ñ–Ð´ÐºÑ€ÐµÑÐ»ÑŽÑ”Ñ‚ÑŒÑÑ Ð·Ð²Ð¾Ñ€Ð¾Ñ‚Ð½Ð¸Ð¼ Ð¿Ð°ÑÐ¸Ð²Ð¾Ð¼ |"
      }
    ],
    "rawMarkdown": "---\nmodule: b1-47\ntitle: \"ÐŸÐ°ÑÐ¸Ð²Ð½Ñ– ÐºÐ¾Ð½ÑÑ‚Ñ€ÑƒÐºÑ†Ñ–Ñ—: Ð¿Ð¾Ð²Ð½Ð° ÑÐ¸ÑÑ‚ÐµÐ¼Ð°\"\nsubtitle: \"Passive Constructions - Complete System\"\nversion: \"1.0\"\nphase: \"B1.4 Advanced Grammar\"\npedagogy: \"TTT\"\nduration: 90\ntransliteration: none\ntags:\n  - grammar\n  - passive\n  - voice\n  - constructions\ngrammar:\n  - \"Ð¢Ñ€Ð¸ Ñ‚Ð¸Ð¿Ð¸ Ð¿Ð°ÑÐ¸Ð²Ð½Ð¸Ñ… ÐºÐ¾Ð½ÑÑ‚Ñ€ÑƒÐºÑ†Ñ–Ð¹\"\n  - \"ÐŸÐ°ÑÐ¸Ð² Ð· Ð´Ñ–Ñ”Ð¿Ñ€Ð¸ÐºÐ¼ÐµÑ‚Ð½Ð¸ÐºÐ¾Ð¼\"\n  - \"ÐŸÐ°ÑÐ¸Ð² Ð· ÐºÐ¾Ñ€Ð¾Ñ‚ÐºÐ¾ÑŽ Ñ„Ð¾Ñ€Ð¼Ð¾ÑŽ\"\n  - \"Ð—Ð²Ð¾Ñ€Ð¾Ñ‚Ð½Ð¸Ð¹ Ð¿Ð°ÑÐ¸Ð² (-ÑÑ)\"\nobjectives:\n  - \"Ð£Ñ‡ÐµÐ½ÑŒ Ð¼Ð¾Ð¶Ðµ Ñ€Ð¾Ð·Ñ€Ñ–Ð·Ð½ÑÑ‚Ð¸ Ñ‚Ñ€Ð¸ Ñ‚Ð¸Ð¿Ð¸ Ð¿Ð°ÑÐ¸Ð²Ð½Ð¸Ñ… ÐºÐ¾Ð½ÑÑ‚Ñ€ÑƒÐºÑ†Ñ–Ð¹\"\n  - \"Ð£Ñ‡ÐµÐ½ÑŒ Ð¼Ð¾Ð¶Ðµ Ñ‚Ñ€Ð°Ð½ÑÑ„Ð¾Ñ€Ð¼ÑƒÐ²Ð°Ñ‚Ð¸ Ð°ÐºÑ‚Ð¸Ð²Ð½Ñ– Ñ€ÐµÑ‡ÐµÐ½Ð½Ñ Ð² Ð¿Ð°ÑÐ¸Ð²Ð½Ñ–\"\n  - \"Ð£Ñ‡ÐµÐ½ÑŒ Ñ€Ð¾Ð·ÑƒÐ¼Ñ–Ñ” ÑÑ‚Ð¸Ð»Ñ–ÑÑ‚Ð¸Ñ‡Ð½Ñ– Ð²Ñ–Ð´Ñ‚Ñ–Ð½ÐºÐ¸ ÐºÐ¾Ð¶Ð½Ð¾Ð³Ð¾ Ñ‚Ð¸Ð¿Ñƒ Ð¿Ð°ÑÐ¸Ð²Ñƒ\"\nvocabulary_count: 25\n---\n\n# ÐŸÐ°ÑÐ¸Ð²Ð½Ñ– ÐºÐ¾Ð½ÑÑ‚Ñ€ÑƒÐºÑ†Ñ–Ñ—: Ð¿Ð¾Ð²Ð½Ð° ÑÐ¸ÑÑ‚ÐµÐ¼Ð°\n\n> ðŸŽ¯ **Ð§Ð¾Ð¼Ñƒ Ñ†Ðµ Ð²Ð°Ð¶Ð»Ð¸Ð²Ð¾?**\n>\n> Ð£ÐºÑ€Ð°Ñ—Ð½ÑÑŒÐºÐ° Ð¼Ð¾Ð²Ð° Ð¼Ð°Ñ” Ñ‚Ñ€Ð¸ ÑÐ¿Ð¾ÑÐ¾Ð±Ð¸ Ð²Ð¸Ñ€Ð°Ð·Ð¸Ñ‚Ð¸ Ð¿Ð°ÑÐ¸Ð²Ð½Ð¸Ð¹ ÑÑ‚Ð°Ð½ â€” Ñ– ÐºÐ¾Ð¶ÐµÐ½ Ð¼Ð°Ñ” ÑÐ²Ð¾Ñ” Ð¼Ñ–ÑÑ†Ðµ. ÐŸÐ¾Ð²Ð½Ð¸Ð¹ Ð¿Ð°ÑÐ¸Ð² Ð· Ð´Ñ–Ñ”Ð¿Ñ€Ð¸ÐºÐ¼ÐµÑ‚Ð½Ð¸ÐºÐ¾Ð¼ Ð·Ð²ÑƒÑ‡Ð¸Ñ‚ÑŒ Ð¾Ñ„Ñ–Ñ†Ñ–Ð¹Ð½Ð¾, ÐºÐ¾Ñ€Ð¾Ñ‚ÐºÐ¸Ð¹ Ð¿Ð°ÑÐ¸Ð² Ð¿Ñ–Ð´ÐºÑ€ÐµÑÐ»ÑŽÑ” Ñ€ÐµÐ·ÑƒÐ»ÑŒÑ‚Ð°Ñ‚, Ð° Ð·Ð²Ð¾Ñ€Ð¾Ñ‚Ð½Ð¸Ð¹ Ð¿Ð°ÑÐ¸Ð² (-ÑÑ) Ñ‚Ð¸Ð¿Ð¾Ð²Ð¸Ð¹ Ð´Ð»Ñ Ñ€Ð¾Ð·Ð¼Ð¾Ð²Ð½Ð¾Ñ— Ð¼Ð¾Ð²Ð¸ Ñ‚Ð° Ð¾Ð¿Ð¸ÑÑƒ Ð¿Ñ€Ð¾Ñ†ÐµÑÑ–Ð². Ð’Ð¾Ð»Ð¾Ð´Ñ–Ð½Ð½Ñ Ð²ÑÑ–Ð¼Ð° Ñ‚Ñ€ÑŒÐ¾Ð¼Ð° Ñ‚Ð¸Ð¿Ð°Ð¼Ð¸ Ñ€Ð¾Ð±Ð¸Ñ‚ÑŒ Ð²Ð°ÑˆÑƒ ÑƒÐºÑ€Ð°Ñ—Ð½ÑÑŒÐºÑƒ Ð³Ð½ÑƒÑ‡ÐºÐ¾ÑŽ Ñ‚Ð° Ð¿Ñ€Ð¸Ñ€Ð¾Ð´Ð½Ð¾ÑŽ.\n\n---\n\n## Ð¢ÐµÑÑ‚\n\nÐŸÑ€Ð¾Ñ‡Ð¸Ñ‚Ð°Ð¹Ñ‚Ðµ Ñ‚Ñ€Ð¸ Ñ€ÐµÑ‡ÐµÐ½Ð½Ñ Ð¿Ñ€Ð¾ Ñ‚Ñƒ ÑÐ°Ð¼Ñƒ Ð¿Ð¾Ð´Ñ–ÑŽ Ñ‚Ð° Ð¿Ð¾Ð´ÑƒÐ¼Ð°Ð¹Ñ‚Ðµ Ð¿Ñ€Ð¾ Ð²Ñ–Ð´Ð¼Ñ–Ð½Ð½Ð¾ÑÑ‚Ñ–:\n\n1. **ÐšÐ½Ð¸Ð³Ð° Ð½Ð°Ð¿Ð¸ÑÐ°Ð½Ð° Ð¿Ð¸ÑÑŒÐ¼ÐµÐ½Ð½Ð¸ÐºÐ¾Ð¼.** (Ð¿Ð¾Ð²Ð½Ð¸Ð¹ Ð¿Ð°ÑÐ¸Ð²)\n2. **ÐšÐ½Ð¸Ð³Ñƒ Ð½Ð°Ð¿Ð¸ÑÐ°Ð½Ð¾.** (ÐºÐ¾Ñ€Ð¾Ñ‚ÐºÐ¸Ð¹ Ð¿Ð°ÑÐ¸Ð²)\n3. **ÐšÐ½Ð¸Ð³Ð° Ð¿Ð¸ÑˆÐµÑ‚ÑŒÑÑ ÑˆÐ²Ð¸Ð´ÐºÐ¾.** (Ð·Ð²Ð¾Ñ€Ð¾Ñ‚Ð½Ð¸Ð¹ Ð¿Ð°ÑÐ¸Ð²)\n\nÐ’ÑÑ– Ñ‚Ñ€Ð¸ Ñ€ÐµÑ‡ÐµÐ½Ð½Ñ Ð¿Ð°ÑÐ¸Ð²Ð½Ñ–, Ð°Ð»Ðµ:\n- **ÐŸÐµÑ€ÑˆÐµ** Ð½Ð°Ð·Ð¸Ð²Ð°Ñ” Ð°Ð²Ñ‚Ð¾Ñ€Ð° Ñ– Ð¿Ñ–Ð´ÐºÑ€ÐµÑÐ»ÑŽÑ” Ð·Ð°Ð²ÐµÑ€ÑˆÐµÐ½Ñƒ Ð´Ñ–ÑŽ.\n- **Ð”Ñ€ÑƒÐ³Ðµ** Ñ„Ð¾ÐºÑƒÑÑƒÑ”Ñ‚ÑŒÑÑ Ð½Ð° Ñ€ÐµÐ·ÑƒÐ»ÑŒÑ‚Ð°Ñ‚Ñ–, Ð½Ðµ Ð½Ð°Ð·Ð¸Ð²Ð°ÑŽÑ‡Ð¸ Ð°Ð²Ñ‚Ð¾Ñ€Ð°.\n- **Ð¢Ñ€ÐµÑ‚Ñ”** Ð¾Ð¿Ð¸ÑÑƒÑ” Ð¿Ñ€Ð¾Ñ†ÐµÑ, ÑÐºÐ¸Ð¹ Ñ‚Ñ€Ð¸Ð²Ð°Ñ”.\n\nÐ©Ðµ Ð¾Ð´Ð½Ð° Ñ‚Ñ€Ñ–Ð¹ÐºÐ°:\n\n1. **Ð¦Ñ Ñ€Ð¾Ð±Ð¾Ñ‚Ð° Ð±ÑƒÐ»Ð° Ð²Ð¸ÐºÐ¾Ð½Ð°Ð½Ð° Ð²Ñ‡Ð¾Ñ€Ð°.** (Ñ„Ð°ÐºÑ‚ + Ñ‡Ð°Ñ)\n2. **Ð Ñ–ÑˆÐµÐ½Ð½Ñ Ð¿Ñ€Ð¸Ð¹Ð½ÑÑ‚Ð¾.** (Ñ€ÐµÐ·ÑƒÐ»ÑŒÑ‚Ð°Ñ‚, Ð¾Ñ„Ñ–Ñ†Ñ–Ð¹Ð½Ð¾)\n3. **Ð‘ÑƒÐ´Ð¸Ð½Ð¾Ðº Ð±ÑƒÐ´ÑƒÑ”Ñ‚ÑŒÑÑ.** (Ð¿Ñ€Ð¾Ñ†ÐµÑ)\n\nÐ¯ÐºÐ° ÐºÐ¾Ð½ÑÑ‚Ñ€ÑƒÐºÑ†Ñ–Ñ Ð¿Ñ–Ð´Ñ…Ð¾Ð´Ð¸Ñ‚ÑŒ Ð´Ð»Ñ Ð½Ð¾Ð²Ð¸Ð½? Ð”Ð»Ñ Ñ€Ð¾Ð·Ð¼Ð¾Ð²Ð¸? Ð”Ð»Ñ Ð´Ð¾ÐºÑƒÐ¼ÐµÐ½Ñ‚Ð°?\n\n> ðŸ’¡ **Ð¦Ñ–ÐºÐ°Ð²Ð¾ Ð·Ð½Ð°Ñ‚Ð¸**\n>\n> Ð—Ð²Ð¾Ñ€Ð¾Ñ‚Ð½Ð¸Ð¹ Ð¿Ð°ÑÐ¸Ð² Ð· Ñ‡Ð°ÑÑ‚ÐºÐ¾ÑŽ -ÑÑ Ñ–ÑÑ‚Ð¾Ñ€Ð¸Ñ‡Ð½Ð¾ Ð¿Ð¾Ñ…Ð¾Ð´Ð¸Ñ‚ÑŒ Ð²Ñ–Ð´ Ð·Ð²Ð¾Ñ€Ð¾Ñ‚Ð½Ð¾Ð³Ð¾ Ð·Ð°Ð¹Ð¼ÐµÐ½Ð½Ð¸ÐºÐ° Â«ÑÐµÐ±ÐµÂ». Ð¢Ð¾Ð¼Ñƒ Â«Ð±ÑƒÐ´ÑƒÑ”Ñ‚ÑŒÑÑÂ» Ð±ÑƒÐºÐ²Ð°Ð»ÑŒÐ½Ð¾ Ð¾Ð·Ð½Ð°Ñ‡Ð°Ñ” Â«Ð±ÑƒÐ´ÑƒÑ” ÑÐµÐ±ÐµÂ», Ñ…Ð¾Ñ‡Ð° ÑÑƒÑ‡Ð°ÑÐ½Ðµ Ð·Ð½Ð°Ñ‡ÐµÐ½Ð½Ñ â€” Â«Ñ” Ð² Ð¿Ñ€Ð¾Ñ†ÐµÑÑ– Ð±ÑƒÐ´Ñ–Ð²Ð½Ð¸Ñ†Ñ‚Ð²Ð°Â».\n\n---\n\n## ÐŸÐ¾ÑÑÐ½ÐµÐ½Ð½Ñ\n\n### Ð¢Ñ€Ð¸ Ñ‚Ð¸Ð¿Ð¸ Ð¿Ð°ÑÐ¸Ð²Ð½Ð¸Ñ… ÐºÐ¾Ð½ÑÑ‚Ñ€ÑƒÐºÑ†Ñ–Ð¹\n\nÐ£ÐºÑ€Ð°Ñ—Ð½ÑÑŒÐºÐ° Ð¼Ð¾Ð²Ð° Ð²Ð¸ÐºÐ¾Ñ€Ð¸ÑÑ‚Ð¾Ð²ÑƒÑ” Ñ‚Ñ€Ð¸ Ð¾ÑÐ½Ð¾Ð²Ð½Ñ– ÑÐ¿Ð¾ÑÐ¾Ð±Ð¸ Ð²Ð¸Ñ€Ð°Ð¶ÐµÐ½Ð½Ñ Ð¿Ð°ÑÐ¸Ð²Ð½Ð¾Ð³Ð¾ ÑÑ‚Ð°Ð½Ñƒ:\n\n| Ð¢Ð¸Ð¿ | Ð¡Ñ‚Ñ€ÑƒÐºÑ‚ÑƒÑ€Ð° | ÐŸÑ€Ð¸ÐºÐ»Ð°Ð´ | Ð¡Ñ‚Ð¸Ð»ÑŒ |\n|-----|-----------|---------|-------|\n| ÐŸÐ¾Ð²Ð½Ð¸Ð¹ Ð¿Ð°ÑÐ¸Ð² | Ð¿Ñ–Ð´Ð¼ÐµÑ‚ + Ð´Ñ–Ñ”Ð¿Ñ€Ð¸ÐºÐ¼ÐµÑ‚Ð½Ð¸Ðº + Ð²Ð¸ÐºÐ¾Ð½Ð°Ð²ÐµÑ†ÑŒ | ÐšÐ½Ð¸Ð³Ð° Ð½Ð°Ð¿Ð¸ÑÐ°Ð½Ð° Ð°Ð²Ñ‚Ð¾Ñ€Ð¾Ð¼. | ÐžÑ„Ñ–Ñ†Ñ–Ð¹Ð½Ð¸Ð¹, Ð¿Ð¸ÑÑŒÐ¼Ð¾Ð²Ð¸Ð¹ |\n| ÐšÐ¾Ñ€Ð¾Ñ‚ÐºÐ¸Ð¹ Ð¿Ð°ÑÐ¸Ð² | Ð´Ð¾Ð´Ð°Ñ‚Ð¾Ðº + -Ð½Ð¾/-Ñ‚Ð¾ | ÐšÐ½Ð¸Ð³Ñƒ Ð½Ð°Ð¿Ð¸ÑÐ°Ð½Ð¾. | ÐžÑ„Ñ–Ñ†Ñ–Ð¹Ð½Ð¸Ð¹, Ð½Ð¾Ð²Ð¸Ð½Ð¸ |\n| Ð—Ð²Ð¾Ñ€Ð¾Ñ‚Ð½Ð¸Ð¹ Ð¿Ð°ÑÐ¸Ð² | Ð¿Ñ–Ð´Ð¼ÐµÑ‚ + Ð´Ñ–Ñ”ÑÐ»Ð¾Ð²Ð¾-ÑÑ | ÐšÐ½Ð¸Ð³Ð° Ð¿Ð¸ÑˆÐµÑ‚ÑŒÑÑ. | Ð Ð¾Ð·Ð¼Ð¾Ð²Ð½Ð¸Ð¹, Ð¿Ñ€Ð¾Ñ†ÐµÑ |\n\n### Ð¢Ð¸Ð¿ 1: ÐŸÐ¾Ð²Ð½Ð¸Ð¹ Ð¿Ð°ÑÐ¸Ð² Ð· Ð´Ñ–Ñ”Ð¿Ñ€Ð¸ÐºÐ¼ÐµÑ‚Ð½Ð¸ÐºÐ¾Ð¼\n\n**Ð¡Ñ‚Ñ€ÑƒÐºÑ‚ÑƒÑ€Ð°:** ÐŸÑ–Ð´Ð¼ÐµÑ‚ (Ð.Ð².) + Ð¿Ð°ÑÐ¸Ð²Ð½Ð¸Ð¹ Ð´Ñ–Ñ”Ð¿Ñ€Ð¸ÐºÐ¼ÐµÑ‚Ð½Ð¸Ðº + Ð²Ð¸ÐºÐ¾Ð½Ð°Ð²ÐµÑ†ÑŒ (ÐžÑ€.Ð².)\n\n| ÐÐºÑ‚Ð¸Ð²Ð½Ðµ Ñ€ÐµÑ‡ÐµÐ½Ð½Ñ | ÐŸÐ°ÑÐ¸Ð²Ð½Ðµ Ñ€ÐµÑ‡ÐµÐ½Ð½Ñ |\n|-----------------|-----------------|\n| ÐÐ²Ñ‚Ð¾Ñ€ Ð½Ð°Ð¿Ð¸ÑÐ°Ð² ÐºÐ½Ð¸Ð³Ñƒ. | ÐšÐ½Ð¸Ð³Ð° Ð½Ð°Ð¿Ð¸ÑÐ°Ð½Ð° Ð°Ð²Ñ‚Ð¾Ñ€Ð¾Ð¼. |\n| Ð¡Ñ‚ÑƒÐ´ÐµÐ½Ñ‚Ð¸ Ð²Ð¸ÐºÐ¾Ð½Ð°Ð»Ð¸ Ñ€Ð¾Ð±Ð¾Ñ‚Ñƒ. | Ð Ð¾Ð±Ð¾Ñ‚Ð° Ð²Ð¸ÐºÐ¾Ð½Ð°Ð½Ð° ÑÑ‚ÑƒÐ´ÐµÐ½Ñ‚Ð°Ð¼Ð¸. |\n| ÐšÐ¾Ð¼Ñ–ÑÑ–Ñ Ð¿Ñ€Ð¸Ð¹Ð½ÑÐ»Ð° Ñ€Ñ–ÑˆÐµÐ½Ð½Ñ. | Ð Ñ–ÑˆÐµÐ½Ð½Ñ Ð¿Ñ€Ð¸Ð¹Ð½ÑÑ‚Ðµ ÐºÐ¾Ð¼Ñ–ÑÑ–Ñ”ÑŽ. |\n\n**Ð£Ð·Ð³Ð¾Ð´Ð¶ÐµÐ½Ð½Ñ Ð´Ñ–Ñ”Ð¿Ñ€Ð¸ÐºÐ¼ÐµÑ‚Ð½Ð¸ÐºÐ°:**\n\n| Ð Ñ–Ð´ | ÐžÐ´Ð½Ð¸Ð½Ð° | ÐœÐ½Ð¾Ð¶Ð¸Ð½Ð° |\n|-----|--------|---------|\n| Ð§Ð¾Ð»Ð¾Ð²Ñ–Ñ‡Ð¸Ð¹ | Ð½Ð°Ð¿Ð¸ÑÐ°Ð½Ð¸Ð¹ | Ð½Ð°Ð¿Ð¸ÑÐ°Ð½Ñ– |\n| Ð–Ñ–Ð½Ð¾Ñ‡Ð¸Ð¹ | Ð½Ð°Ð¿Ð¸ÑÐ°Ð½Ð° | Ð½Ð°Ð¿Ð¸ÑÐ°Ð½Ñ– |\n| Ð¡ÐµÑ€ÐµÐ´Ð½Ñ–Ð¹ | Ð½Ð°Ð¿Ð¸ÑÐ°Ð½Ðµ | Ð½Ð°Ð¿Ð¸ÑÐ°Ð½Ñ– |\n\n**ÐšÐ¾Ð»Ð¸ Ð²Ð¸ÐºÐ¾Ñ€Ð¸ÑÑ‚Ð¾Ð²ÑƒÑ”Ñ‚ÑŒÑÑ:**\n- ÐšÐ¾Ð»Ð¸ Ð²Ð°Ð¶Ð»Ð¸Ð²Ð¾ Ð½Ð°Ð·Ð²Ð°Ñ‚Ð¸ Ð²Ð¸ÐºÐ¾Ð½Ð°Ð²Ñ†Ñ\n- Ð’ Ð¾Ñ„Ñ–Ñ†Ñ–Ð¹Ð½Ð¸Ñ… Ñ‚Ð° Ð°ÐºÐ°Ð´ÐµÐ¼Ñ–Ñ‡Ð½Ð¸Ñ… Ñ‚ÐµÐºÑÑ‚Ð°Ñ…\n- ÐšÐ¾Ð»Ð¸ Ð¿Ñ–Ð´ÐºÑ€ÐµÑÐ»ÑŽÑ”Ñ‚ÑŒÑÑ Ð·Ð°Ð²ÐµÑ€ÑˆÐµÐ½Ñ–ÑÑ‚ÑŒ Ð´Ñ–Ñ—\n\n> ðŸŒ **Ð£ Ñ€ÐµÐ°Ð»ÑŒÐ½Ð¾Ð¼Ñƒ Ð¶Ð¸Ñ‚Ñ‚Ñ–**\n>\n> Â«ÐšÐ¾Ð½ÑÑ‚Ð¸Ñ‚ÑƒÑ†Ñ–Ñ Ð£ÐºÑ€Ð°Ñ—Ð½Ð¸ Ð¿Ñ€Ð¸Ð¹Ð½ÑÑ‚Ð° Ð’ÐµÑ€Ñ…Ð¾Ð²Ð½Ð¾ÑŽ Ð Ð°Ð´Ð¾ÑŽ 28 Ñ‡ÐµÑ€Ð²Ð½Ñ 1996 Ñ€Ð¾ÐºÑƒ.Â» â€” Ñ‚Ð¸Ð¿Ð¾Ð²Ð¸Ð¹ Ð¿Ñ€Ð¸ÐºÐ»Ð°Ð´ Ð¿Ð¾Ð²Ð½Ð¾Ð³Ð¾ Ð¿Ð°ÑÐ¸Ð²Ñƒ Ð² Ñ–ÑÑ‚Ð¾Ñ€Ð¸Ñ‡Ð½Ð¸Ñ… Ñ‚Ð° ÑŽÑ€Ð¸Ð´Ð¸Ñ‡Ð½Ð¸Ñ… Ñ‚ÐµÐºÑÑ‚Ð°Ñ….\n\n### Ð¢Ð¸Ð¿ 2: ÐšÐ¾Ñ€Ð¾Ñ‚ÐºÐ¸Ð¹ Ð¿Ð°ÑÐ¸Ð² (-Ð½Ð¾/-Ñ‚Ð¾)\n\n**Ð¡Ñ‚Ñ€ÑƒÐºÑ‚ÑƒÑ€Ð°:** Ð”Ð¾Ð´Ð°Ñ‚Ð¾Ðº (Ð—Ð½.Ð².) + ÐºÐ¾Ñ€Ð¾Ñ‚ÐºÐ° Ñ„Ð¾Ñ€Ð¼Ð° (-Ð½Ð¾/-Ñ‚Ð¾)\n\n| ÐÐºÑ‚Ð¸Ð²Ð½Ðµ Ñ€ÐµÑ‡ÐµÐ½Ð½Ñ | ÐšÐ¾Ñ€Ð¾Ñ‚ÐºÐ¸Ð¹ Ð¿Ð°ÑÐ¸Ð² |\n|-----------------|----------------|\n| Ð¥Ñ‚Ð¾ÑÑŒ Ð½Ð°Ð¿Ð¸ÑÐ°Ð² Ð»Ð¸ÑÑ‚Ð°. | Ð›Ð¸ÑÑ‚Ð° Ð½Ð°Ð¿Ð¸ÑÐ°Ð½Ð¾. |\n| Ð¥Ñ‚Ð¾ÑÑŒ Ð¿Ñ€Ð¸Ð¹Ð½ÑÐ² Ñ€Ñ–ÑˆÐµÐ½Ð½Ñ. | Ð Ñ–ÑˆÐµÐ½Ð½Ñ Ð¿Ñ€Ð¸Ð¹Ð½ÑÑ‚Ð¾. |\n| Ð¥Ñ‚Ð¾ÑÑŒ Ð²Ð¸ÐºÐ¾Ð½Ð°Ð² Ñ€Ð¾Ð±Ð¾Ñ‚Ñƒ. | Ð Ð¾Ð±Ð¾Ñ‚Ñƒ Ð²Ð¸ÐºÐ¾Ð½Ð°Ð½Ð¾. |\n\n**ÐšÐ»ÑŽÑ‡Ð¾Ð²Ñ– Ð¾ÑÐ¾Ð±Ð»Ð¸Ð²Ð¾ÑÑ‚Ñ–:**\n- Ð¤Ð¾Ñ€Ð¼Ð° Ð½Ðµ Ð·Ð¼Ñ–Ð½ÑŽÑ”Ñ‚ÑŒÑÑ (Ð·Ð°Ð²Ð¶Ð´Ð¸ -Ð¾)\n- Ð”Ð¾Ð´Ð°Ñ‚Ð¾Ðº Ñƒ Ð·Ð½Ð°Ñ…Ñ–Ð´Ð½Ð¾Ð¼Ñƒ Ð²Ñ–Ð´Ð¼Ñ–Ð½ÐºÑƒ\n- Ð’Ð¸ÐºÐ¾Ð½Ð°Ð²ÐµÑ†ÑŒ Ð·Ð°Ð·Ð²Ð¸Ñ‡Ð°Ð¹ Ð½Ðµ Ð½Ð°Ð·Ð¸Ð²Ð°Ñ”Ñ‚ÑŒÑÑ\n\n**ÐšÐ¾Ð»Ð¸ Ð²Ð¸ÐºÐ¾Ñ€Ð¸ÑÑ‚Ð¾Ð²ÑƒÑ”Ñ‚ÑŒÑÑ:**\n- Ð’ Ð¾Ñ„Ñ–Ñ†Ñ–Ð¹Ð½Ð¸Ñ… Ð´Ð¾ÐºÑƒÐ¼ÐµÐ½Ñ‚Ð°Ñ… Ñ‚Ð° Ð¿Ñ€Ð¾Ñ‚Ð¾ÐºÐ¾Ð»Ð°Ñ…\n- Ð£ Ð½Ð¾Ð²Ð¸Ð½Ð°Ñ… Ñ‚Ð° Ð¶ÑƒÑ€Ð½Ð°Ð»Ñ–ÑÑ‚Ð¸Ñ†Ñ–\n- ÐšÐ¾Ð»Ð¸ Ð²Ð¸ÐºÐ¾Ð½Ð°Ð²ÐµÑ†ÑŒ Ð½ÐµÐ²Ñ–Ð´Ð¾Ð¼Ð¸Ð¹ Ð°Ð±Ð¾ Ð½ÐµÐ²Ð°Ð¶Ð»Ð¸Ð²Ð¸Ð¹\n\n> ðŸŽ¬ **ÐšÑƒÐ»ÑŒÑ‚ÑƒÑ€Ð½Ð¸Ð¹ Ð¼Ð¾Ð¼ÐµÐ½Ñ‚**\n>\n> Ð£ Ñ„Ñ–Ð»ÑŒÐ¼Ñ– Â«Ð’Ð¾Ð³Ð½ÐµÐ¼ Ñ– Ð¼ÐµÑ‡ÐµÐ¼Â» Ð·Ð° Ñ€Ð¾Ð¼Ð°Ð½Ð¾Ð¼ Ð“ÐµÐ½Ñ€Ð¸ÐºÐ° Ð¡ÐµÐ½ÐºÐµÐ²Ð¸Ñ‡Ð° Ñ‡ÑƒÑ‚Ð¸ Ð±Ð°Ð³Ð°Ñ‚Ð¾ Ð¿Ð°ÑÐ¸Ð²Ð½Ð¸Ñ… ÐºÐ¾Ð½ÑÑ‚Ñ€ÑƒÐºÑ†Ñ–Ð¹ Ñƒ ÑÑ†ÐµÐ½Ð°Ñ… ÐºÐ¾Ð·Ð°Ñ†ÑŒÐºÐ¸Ñ… Ñ€Ð°Ð´: Â«Ð Ñ–ÑˆÐµÐ½Ð¾ Ð²Ð¸ÑÑ‚ÑƒÐ¿Ð°Ñ‚Ð¸!Â», Â«ÐÐ°ÐºÐ°Ð·Ð°Ð½Ð¾ Ñ‡ÐµÐºÐ°Ñ‚Ð¸!Â» â€” Ñ†Ðµ Ð½Ð°Ð´Ð°Ñ” Ð¼Ð¾Ð²Ñ– ÑƒÑ€Ð¾Ñ‡Ð¸ÑÑ‚Ð¾Ð³Ð¾, Ñ–ÑÑ‚Ð¾Ñ€Ð¸Ñ‡Ð½Ð¾Ð³Ð¾ Ð·Ð²ÑƒÑ‡Ð°Ð½Ð½Ñ.\n\n### Ð¢Ð¸Ð¿ 3: Ð—Ð²Ð¾Ñ€Ð¾Ñ‚Ð½Ð¸Ð¹ Ð¿Ð°ÑÐ¸Ð² (-ÑÑ)\n\n**Ð¡Ñ‚Ñ€ÑƒÐºÑ‚ÑƒÑ€Ð°:** ÐŸÑ–Ð´Ð¼ÐµÑ‚ (Ð.Ð².) + Ð´Ñ–Ñ”ÑÐ»Ð¾Ð²Ð¾ Ð· Ñ‡Ð°ÑÑ‚ÐºÐ¾ÑŽ -ÑÑ\n\n| ÐÐºÑ‚Ð¸Ð²Ð½Ðµ Ñ€ÐµÑ‡ÐµÐ½Ð½Ñ | Ð—Ð²Ð¾Ñ€Ð¾Ñ‚Ð½Ð¸Ð¹ Ð¿Ð°ÑÐ¸Ð² |\n|-----------------|-----------------|\n| Ð Ð¾Ð±Ñ–Ñ‚Ð½Ð¸ÐºÐ¸ Ð±ÑƒÐ´ÑƒÑŽÑ‚ÑŒ Ð±ÑƒÐ´Ð¸Ð½Ð¾Ðº. | Ð‘ÑƒÐ´Ð¸Ð½Ð¾Ðº Ð±ÑƒÐ´ÑƒÑ”Ñ‚ÑŒÑÑ. |\n| ÐŸÐµÐºÐ°Ñ€Ñ– Ð¿ÐµÑ‡ÑƒÑ‚ÑŒ Ñ…Ð»Ñ–Ð±. | Ð¥Ð»Ñ–Ð± Ð¿ÐµÑ‡ÐµÑ‚ÑŒÑÑ. |\n| Ð£Ñ‡ÐµÐ½Ñ– Ð´Ð¾ÑÐ»Ñ–Ð´Ð¶ÑƒÑŽÑ‚ÑŒ Ð¿Ñ€Ð¾Ð±Ð»ÐµÐ¼Ñƒ. | ÐŸÑ€Ð¾Ð±Ð»ÐµÐ¼Ð° Ð´Ð¾ÑÐ»Ñ–Ð´Ð¶ÑƒÑ”Ñ‚ÑŒÑÑ. |\n\n**ÐšÐ»ÑŽÑ‡Ð¾Ð²Ñ– Ð¾ÑÐ¾Ð±Ð»Ð¸Ð²Ð¾ÑÑ‚Ñ–:**\n- ÐŸÑ–Ð´ÐºÑ€ÐµÑÐ»ÑŽÑ” Ð¿Ñ€Ð¾Ñ†ÐµÑ, Ð° Ð½Ðµ Ñ€ÐµÐ·ÑƒÐ»ÑŒÑ‚Ð°Ñ‚\n- Ð§Ð°ÑÑ‚Ð¾ Ð²Ð¶Ð¸Ð²Ð°Ñ”Ñ‚ÑŒÑÑ Ð² Ñ‚ÐµÐ¿ÐµÑ€Ñ–ÑˆÐ½ÑŒÐ¾Ð¼Ñƒ Ñ‡Ð°ÑÑ–\n- ÐœÐ¾Ð¶Ðµ Ð²Ð¸Ñ€Ð°Ð¶Ð°Ñ‚Ð¸ Ð·Ð°Ð³Ð°Ð»ÑŒÐ½Ðµ Ñ‚Ð²ÐµÑ€Ð´Ð¶ÐµÐ½Ð½Ñ\n\n**ÐšÐ¾Ð»Ð¸ Ð²Ð¸ÐºÐ¾Ñ€Ð¸ÑÑ‚Ð¾Ð²ÑƒÑ”Ñ‚ÑŒÑÑ:**\n- Ð”Ð»Ñ Ð¾Ð¿Ð¸ÑÑƒ Ð¿Ñ€Ð¾Ñ†ÐµÑÑ–Ð², Ñ‰Ð¾ Ñ‚Ñ€Ð¸Ð²Ð°ÑŽÑ‚ÑŒ\n- Ð£ Ñ‚ÐµÑ…Ð½Ñ–Ñ‡Ð½Ð¸Ñ… Ñ–Ð½ÑÑ‚Ñ€ÑƒÐºÑ†Ñ–ÑÑ…\n- Ð£ Ð·Ð°Ð³Ð°Ð»ÑŒÐ½Ð¸Ñ… Ñ‚Ð²ÐµÑ€Ð´Ð¶ÐµÐ½Ð½ÑÑ… Ð¿Ñ€Ð¾ Ð·Ð²Ð¸Ñ‡Ð°Ð¹Ð½Ñ– Ð´Ñ–Ñ—\n\n> ðŸŒ **Ð£ Ñ€ÐµÐ°Ð»ÑŒÐ½Ð¾Ð¼Ñƒ Ð¶Ð¸Ñ‚Ñ‚Ñ–**\n>\n> ÐÐ° ÐµÑ‚Ð¸ÐºÐµÑ‚ÐºÐ°Ñ… Ð¿Ñ€Ð¾Ð´ÑƒÐºÑ‚Ñ–Ð² Ñ‡Ð°ÑÑ‚Ð¾ Ñ‡Ð¸Ñ‚Ð°Ñ”Ð¼Ð¾: Â«Ð—Ð±ÐµÑ€Ñ–Ð³Ð°Ñ”Ñ‚ÑŒÑÑ Ð¿Ñ€Ð¸ Ñ‚ÐµÐ¼Ð¿ÐµÑ€Ð°Ñ‚ÑƒÑ€Ñ–...Â», Â«Ð’Ð¶Ð¸Ð²Ð°Ñ”Ñ‚ÑŒÑÑ Ð¿ÐµÑ€ÐµÐ´ Ñ—Ð¶ÐµÑŽÂ», Â«Ð’Ð¸Ð³Ð¾Ñ‚Ð¾Ð²Ð»ÑÑ”Ñ‚ÑŒÑÑ Ð² Ð£ÐºÑ€Ð°Ñ—Ð½Ñ–Â». Ð¦Ðµ Ñ‚Ð¸Ð¿Ð¾Ð²Ñ– Ð¿Ñ€Ð¸ÐºÐ»Ð°Ð´Ð¸ Ð·Ð²Ð¾Ñ€Ð¾Ñ‚Ð½Ð¾Ð³Ð¾ Ð¿Ð°ÑÐ¸Ð²Ñƒ.\n\n### ÐŸÐ¾Ñ€Ñ–Ð²Ð½ÑÐ½Ð½Ñ Ñ‚Ñ€ÑŒÐ¾Ñ… Ñ‚Ð¸Ð¿Ñ–Ð²\n\nÐŸÐ¾Ñ€Ñ–Ð²Ð½ÑÐ¹Ð¼Ð¾ Ñ‚Ñ€Ð¸ ÑÐ¿Ð¾ÑÐ¾Ð±Ð¸ ÑÐºÐ°Ð·Ð°Ñ‚Ð¸ Ð¾Ð´Ð½Ðµ Ð¹ Ñ‚Ðµ ÑÐ°Ð¼Ðµ:\n\n| Ð¡Ð¸Ñ‚ÑƒÐ°Ñ†Ñ–Ñ | ÐŸÐ¾Ð²Ð½Ð¸Ð¹ Ð¿Ð°ÑÐ¸Ð² | ÐšÐ¾Ñ€Ð¾Ñ‚ÐºÐ¸Ð¹ Ð¿Ð°ÑÐ¸Ð² | Ð—Ð²Ð¾Ñ€Ð¾Ñ‚Ð½Ð¸Ð¹ Ð¿Ð°ÑÐ¸Ð² |\n|----------|--------------|----------------|-----------------|\n| ÐŸÑ€Ð¾ ÐºÐ½Ð¸Ð³Ñƒ | ÐšÐ½Ð¸Ð³Ð° Ð½Ð°Ð¿Ð¸ÑÐ°Ð½Ð° Ð¿Ð¸ÑÑŒÐ¼ÐµÐ½Ð½Ð¸ÐºÐ¾Ð¼. | ÐšÐ½Ð¸Ð³Ñƒ Ð½Ð°Ð¿Ð¸ÑÐ°Ð½Ð¾. | ÐšÐ½Ð¸Ð³Ð° Ð¿Ð¸ÑˆÐµÑ‚ÑŒÑÑ ÑˆÐ²Ð¸Ð´ÐºÐ¾. |\n| ÐŸÑ€Ð¾ Ñ€Ñ–ÑˆÐµÐ½Ð½Ñ | Ð Ñ–ÑˆÐµÐ½Ð½Ñ Ð¿Ñ€Ð¸Ð¹Ð½ÑÑ‚Ðµ ÐºÐ¾Ð¼Ñ–ÑÑ–Ñ”ÑŽ. | Ð Ñ–ÑˆÐµÐ½Ð½Ñ Ð¿Ñ€Ð¸Ð¹Ð½ÑÑ‚Ð¾. | Ð Ñ–ÑˆÐµÐ½Ð½Ñ Ð¿Ñ€Ð¸Ð¹Ð¼Ð°Ñ”Ñ‚ÑŒÑÑ Ð·Ð°Ñ€Ð°Ð·. |\n| ÐŸÑ€Ð¾ Ñ€Ð¾Ð±Ð¾Ñ‚Ñƒ | Ð Ð¾Ð±Ð¾Ñ‚Ð° Ð²Ð¸ÐºÐ¾Ð½Ð°Ð½Ð° ÑÑ‚ÑƒÐ´ÐµÐ½Ñ‚Ð°Ð¼Ð¸. | Ð Ð¾Ð±Ð¾Ñ‚Ñƒ Ð²Ð¸ÐºÐ¾Ð½Ð°Ð½Ð¾. | Ð Ð¾Ð±Ð¾Ñ‚Ð° Ð²Ð¸ÐºÐ¾Ð½ÑƒÑ”Ñ‚ÑŒÑÑ Ñ‰Ð¾Ð´Ð½Ñ. |\n\n**Ð¡Ñ‚Ð¸Ð»Ñ–ÑÑ‚Ð¸Ñ‡Ð½Ñ– Ð²Ñ–Ð´Ñ‚Ñ–Ð½ÐºÐ¸:**\n\n| Ð¢Ð¸Ð¿ | ÐÐºÑ†ÐµÐ½Ñ‚ | Ð§Ð°Ñ | Ð¡Ñ‚Ð¸Ð»ÑŒ |\n|-----|--------|-----|-------|\n| ÐŸÐ¾Ð²Ð½Ð¸Ð¹ | Ð’Ð¸ÐºÐ¾Ð½Ð°Ð²ÐµÑ†ÑŒ + Ñ€ÐµÐ·ÑƒÐ»ÑŒÑ‚Ð°Ñ‚ | ÐœÐ¸Ð½ÑƒÐ»Ð¸Ð¹ | ÐžÑ„Ñ–Ñ†Ñ–Ð¹Ð½Ð¸Ð¹ |\n| ÐšÐ¾Ñ€Ð¾Ñ‚ÐºÐ¸Ð¹ | Ð ÐµÐ·ÑƒÐ»ÑŒÑ‚Ð°Ñ‚ | ÐœÐ¸Ð½ÑƒÐ»Ð¸Ð¹ | ÐžÑ„Ñ–Ñ†Ñ–Ð¹Ð½Ð¸Ð¹, Ð¾Ð±'Ñ”ÐºÑ‚Ð¸Ð²Ð½Ð¸Ð¹ |\n| Ð—Ð²Ð¾Ñ€Ð¾Ñ‚Ð½Ð¸Ð¹ | ÐŸÑ€Ð¾Ñ†ÐµÑ | Ð¢ÐµÐ¿ÐµÑ€Ñ–ÑˆÐ½Ñ–Ð¹ | ÐÐµÐ¹Ñ‚Ñ€Ð°Ð»ÑŒÐ½Ð¸Ð¹, Ñ€Ð¾Ð·Ð¼Ð¾Ð²Ð½Ð¸Ð¹ |\n\n### Ð§Ð°ÑÐ¾Ð²Ñ– Ñ„Ð¾Ñ€Ð¼Ð¸ Ð¿Ð°ÑÐ¸Ð²Ð½Ð¸Ñ… ÐºÐ¾Ð½ÑÑ‚Ñ€ÑƒÐºÑ†Ñ–Ð¹\n\n**ÐŸÐ¾Ð²Ð½Ð¸Ð¹ Ð¿Ð°ÑÐ¸Ð²:**\n\n| Ð§Ð°Ñ | Ð¡Ñ‚Ñ€ÑƒÐºÑ‚ÑƒÑ€Ð° | ÐŸÑ€Ð¸ÐºÐ»Ð°Ð´ |\n|-----|-----------|---------|\n| Ð¢ÐµÐ¿ÐµÑ€Ñ–ÑˆÐ½Ñ–Ð¹ | Ð¿Ñ–Ð´Ð¼ÐµÑ‚ + Ð´Ñ–Ñ”Ð¿Ñ€Ð¸ÐºÐ¼ÐµÑ‚Ð½Ð¸Ðº | ÐšÐ½Ð¸Ð³Ð° Ð½Ð°Ð¿Ð¸ÑÐ°Ð½Ð°. |\n| ÐœÐ¸Ð½ÑƒÐ»Ð¸Ð¹ | Ð¿Ñ–Ð´Ð¼ÐµÑ‚ + Ð±ÑƒÐ²/Ð±ÑƒÐ»Ð°/Ð±ÑƒÐ»Ð¾ + Ð´Ñ–Ñ”Ð¿Ñ€Ð¸ÐºÐ¼ÐµÑ‚Ð½Ð¸Ðº | ÐšÐ½Ð¸Ð³Ð° Ð±ÑƒÐ»Ð° Ð½Ð°Ð¿Ð¸ÑÐ°Ð½Ð°. |\n| ÐœÐ°Ð¹Ð±ÑƒÑ‚Ð½Ñ–Ð¹ | Ð¿Ñ–Ð´Ð¼ÐµÑ‚ + Ð±ÑƒÐ´Ðµ + Ð´Ñ–Ñ”Ð¿Ñ€Ð¸ÐºÐ¼ÐµÑ‚Ð½Ð¸Ðº | ÐšÐ½Ð¸Ð³Ð° Ð±ÑƒÐ´Ðµ Ð½Ð°Ð¿Ð¸ÑÐ°Ð½Ð°. |\n\n**ÐšÐ¾Ñ€Ð¾Ñ‚ÐºÐ¸Ð¹ Ð¿Ð°ÑÐ¸Ð²:**\n\n| Ð§Ð°Ñ | Ð¡Ñ‚Ñ€ÑƒÐºÑ‚ÑƒÑ€Ð° | ÐŸÑ€Ð¸ÐºÐ»Ð°Ð´ |\n|-----|-----------|---------|\n| ÐœÐ¸Ð½ÑƒÐ»Ð¸Ð¹ (Ð·Ð°Ð²ÐµÑ€ÑˆÐµÐ½Ð¾) | Ð´Ð¾Ð´Ð°Ñ‚Ð¾Ðº + -Ð½Ð¾/-Ñ‚Ð¾ | ÐšÐ½Ð¸Ð³Ñƒ Ð½Ð°Ð¿Ð¸ÑÐ°Ð½Ð¾. |\n| ÐœÐ¸Ð½ÑƒÐ»Ð¸Ð¹ (Ð· Â«Ð±ÑƒÐ»Ð¾Â») | Ð´Ð¾Ð´Ð°Ñ‚Ð¾Ðº + Ð±ÑƒÐ»Ð¾ + -Ð½Ð¾/-Ñ‚Ð¾ | ÐšÐ½Ð¸Ð³Ñƒ Ð±ÑƒÐ»Ð¾ Ð½Ð°Ð¿Ð¸ÑÐ°Ð½Ð¾. |\n| ÐœÐ°Ð¹Ð±ÑƒÑ‚Ð½Ñ–Ð¹ | Ð´Ð¾Ð´Ð°Ñ‚Ð¾Ðº + Ð±ÑƒÐ´Ðµ + -Ð½Ð¾/-Ñ‚Ð¾ | ÐšÐ½Ð¸Ð³Ñƒ Ð±ÑƒÐ´Ðµ Ð½Ð°Ð¿Ð¸ÑÐ°Ð½Ð¾. |\n\n**Ð—Ð²Ð¾Ñ€Ð¾Ñ‚Ð½Ð¸Ð¹ Ð¿Ð°ÑÐ¸Ð²:**\n\n| Ð§Ð°Ñ | Ð¡Ñ‚Ñ€ÑƒÐºÑ‚ÑƒÑ€Ð° | ÐŸÑ€Ð¸ÐºÐ»Ð°Ð´ |\n|-----|-----------|---------|\n| Ð¢ÐµÐ¿ÐµÑ€Ñ–ÑˆÐ½Ñ–Ð¹ | Ð¿Ñ–Ð´Ð¼ÐµÑ‚ + Ð´Ñ–Ñ”ÑÐ»Ð¾Ð²Ð¾-ÑÑ | ÐšÐ½Ð¸Ð³Ð° Ð¿Ð¸ÑˆÐµÑ‚ÑŒÑÑ. |\n| ÐœÐ¸Ð½ÑƒÐ»Ð¸Ð¹ | Ð¿Ñ–Ð´Ð¼ÐµÑ‚ + Ð´Ñ–Ñ”ÑÐ»Ð¾Ð²Ð¾-ÑÑ (Ð¼Ð¸Ð½.) | ÐšÐ½Ð¸Ð³Ð° Ð¿Ð¸ÑÐ°Ð»Ð°ÑÑ. |\n| ÐœÐ°Ð¹Ð±ÑƒÑ‚Ð½Ñ–Ð¹ | Ð¿Ñ–Ð´Ð¼ÐµÑ‚ + Ð±ÑƒÐ´Ðµ + Ñ–Ð½Ñ„.-ÑÑ | ÐšÐ½Ð¸Ð³Ð° Ð±ÑƒÐ´Ðµ Ð¿Ð¸ÑÐ°Ñ‚Ð¸ÑÑ. |\n\n> ðŸ’¡ **ÐšÐ¾Ñ€Ð¸ÑÐ½Ð° Ð¿Ð¾Ñ€Ð°Ð´Ð°**\n>\n> Ð¯ÐºÑ‰Ð¾ Ð²Ð¸ Ð½Ðµ Ð²Ð¿ÐµÐ²Ð½ÐµÐ½Ñ–, ÑÐºÐ¸Ð¹ Ñ‚Ð¸Ð¿ Ð¿Ð°ÑÐ¸Ð²Ñƒ Ð¾Ð±Ñ€Ð°Ñ‚Ð¸:\n> - ÐŸÐ¾Ñ‚Ñ€Ñ–Ð±Ð½Ð¾ Ð½Ð°Ð·Ð²Ð°Ñ‚Ð¸ Ð²Ð¸ÐºÐ¾Ð½Ð°Ð²Ñ†Ñ? â†’ ÐŸÐ¾Ð²Ð½Ð¸Ð¹ Ð¿Ð°ÑÐ¸Ð²\n> - ÐÐºÑ†ÐµÐ½Ñ‚ Ð½Ð° Ñ€ÐµÐ·ÑƒÐ»ÑŒÑ‚Ð°Ñ‚Ñ–, Ð±ÐµÐ· Ð²Ð¸ÐºÐ¾Ð½Ð°Ð²Ñ†Ñ? â†’ ÐšÐ¾Ñ€Ð¾Ñ‚ÐºÐ¸Ð¹ Ð¿Ð°ÑÐ¸Ð²\n> - ÐžÐ¿Ð¸ÑÑƒÑ”Ñ‚Ðµ Ð¿Ñ€Ð¾Ñ†ÐµÑ? â†’ Ð—Ð²Ð¾Ñ€Ð¾Ñ‚Ð½Ð¸Ð¹ Ð¿Ð°ÑÐ¸Ð²\n\n---\n\n## ÐŸÑ€Ð°ÐºÑ‚Ð¸ÐºÐ°\n\n### Ð¯Ðº Ð¾Ð±Ñ€Ð°Ñ‚Ð¸ Ñ‚Ð¸Ð¿ Ð¿Ð°ÑÐ¸Ð²Ñƒ?\n\n**ÐÐ»Ð³Ð¾Ñ€Ð¸Ñ‚Ð¼ Ð²Ð¸Ð±Ð¾Ñ€Ñƒ:**\n\n1. **Ð§Ð¸ Ð¿Ð¾Ñ‚Ñ€Ñ–Ð±Ð½Ð¾ Ð½Ð°Ð·Ð²Ð°Ñ‚Ð¸ Ð²Ð¸ÐºÐ¾Ð½Ð°Ð²Ñ†Ñ?**\n   - Ð¢Ð°Ðº â†’ ÐŸÐ¾Ð²Ð½Ð¸Ð¹ Ð¿Ð°ÑÐ¸Ð²: Ð›Ð¸ÑÑ‚ Ð½Ð°Ð¿Ð¸ÑÐ°Ð½Ð¸Ð¹ ÑÐµÐºÑ€ÐµÑ‚Ð°Ñ€ÐµÐ¼.\n   - ÐÑ– â†’ ÐŸÐµÑ€ÐµÐ¹Ð´Ñ–Ñ‚ÑŒ Ð´Ð¾ Ð¿Ð¸Ñ‚Ð°Ð½Ð½Ñ 2.\n\n2. **Ð©Ð¾ Ð²Ð°Ð¶Ð»Ð¸Ð²Ñ–ÑˆÐµ â€” Ñ€ÐµÐ·ÑƒÐ»ÑŒÑ‚Ð°Ñ‚ Ñ‡Ð¸ Ð¿Ñ€Ð¾Ñ†ÐµÑ?**\n   - Ð ÐµÐ·ÑƒÐ»ÑŒÑ‚Ð°Ñ‚ â†’ ÐšÐ¾Ñ€Ð¾Ñ‚ÐºÐ¸Ð¹ Ð¿Ð°ÑÐ¸Ð²: Ð›Ð¸ÑÑ‚Ð° Ð½Ð°Ð¿Ð¸ÑÐ°Ð½Ð¾.\n   - ÐŸÑ€Ð¾Ñ†ÐµÑ â†’ Ð—Ð²Ð¾Ñ€Ð¾Ñ‚Ð½Ð¸Ð¹ Ð¿Ð°ÑÐ¸Ð²: Ð›Ð¸ÑÑ‚Ð¸ Ð¿Ð¸ÑˆÑƒÑ‚ÑŒÑÑ Ñ‰Ð¾Ð´Ð½Ñ.\n\n3. **Ð¯ÐºÐ¸Ð¹ ÑÑ‚Ð¸Ð»ÑŒ Ñ‚ÐµÐºÑÑ‚Ñƒ?**\n   - ÐžÑ„Ñ–Ñ†Ñ–Ð¹Ð½Ð¸Ð¹ â†’ ÐšÐ¾Ñ€Ð¾Ñ‚ÐºÐ¸Ð¹ Ð°Ð±Ð¾ Ð¿Ð¾Ð²Ð½Ð¸Ð¹ Ð¿Ð°ÑÐ¸Ð²\n   - Ð Ð¾Ð·Ð¼Ð¾Ð²Ð½Ð¸Ð¹ â†’ Ð—Ð²Ð¾Ñ€Ð¾Ñ‚Ð½Ð¸Ð¹ Ð¿Ð°ÑÐ¸Ð² Ð°Ð±Ð¾ Ð°ÐºÑ‚Ð¸Ð²Ð½Ð¸Ð¹ ÑÑ‚Ð°Ð½\n\n### Ð¢Ñ€Ð°Ð½ÑÑ„Ð¾Ñ€Ð¼Ð°Ñ†Ñ–Ñ Ð°ÐºÑ‚Ð¸Ð²Ð½Ð¸Ñ… Ñ€ÐµÑ‡ÐµÐ½ÑŒ\n\n**ÐšÑ€Ð¾Ðº 1: Ð’Ð¸Ð·Ð½Ð°Ñ‡Ñ‚Ðµ Ð´Ð¾Ð´Ð°Ñ‚Ð¾Ðº Ð°ÐºÑ‚Ð¸Ð²Ð½Ð¾Ð³Ð¾ Ñ€ÐµÑ‡ÐµÐ½Ð½Ñ**\n- Ð¡Ñ‚ÑƒÐ´ÐµÐ½Ñ‚Ð¸ Ð²Ð¸ÐºÐ¾Ð½Ð°Ð»Ð¸ **Ñ€Ð¾Ð±Ð¾Ñ‚Ñƒ**.\n\n**ÐšÑ€Ð¾Ðº 2: Ð—Ñ€Ð¾Ð±Ñ–Ñ‚ÑŒ Ð´Ð¾Ð´Ð°Ñ‚Ð¾Ðº Ð¿Ñ–Ð´Ð¼ÐµÑ‚Ð¾Ð¼**\n- **Ð Ð¾Ð±Ð¾Ñ‚Ð°** Ð²Ð¸ÐºÐ¾Ð½Ð°Ð½Ð° ÑÑ‚ÑƒÐ´ÐµÐ½Ñ‚Ð°Ð¼Ð¸. (Ð¿Ð¾Ð²Ð½Ð¸Ð¹ Ð¿Ð°ÑÐ¸Ð²)\n- **Ð Ð¾Ð±Ð¾Ñ‚Ñƒ** Ð²Ð¸ÐºÐ¾Ð½Ð°Ð½Ð¾. (ÐºÐ¾Ñ€Ð¾Ñ‚ÐºÐ¸Ð¹ Ð¿Ð°ÑÐ¸Ð² â€” Ð·Ð½Ð°Ñ…Ñ–Ð´Ð½Ð¸Ð¹!)\n\n**ÐšÑ€Ð¾Ðº 3: Ð£Ð·Ð³Ð¾Ð´ÑŒÑ‚Ðµ Ñ„Ð¾Ñ€Ð¼Ñƒ**\n- Ð Ð¾Ð±Ð¾Ñ‚Ð° (Ð¶.Ñ€.) â†’ Ð²Ð¸ÐºÐ¾Ð½Ð°Ð½Ð° (Ð¶.Ñ€.)\n- Ð Ð¾Ð±Ð¾Ñ‚Ñƒ â†’ Ð²Ð¸ÐºÐ¾Ð½Ð°Ð½Ð¾ (Ð½ÐµÐ·Ð¼Ñ–Ð½Ð½Ð° Ñ„Ð¾Ñ€Ð¼Ð°)\n\n### Ð¢Ð¸Ð¿Ð¾Ð²Ñ– Ð¿Ð¾Ð¼Ð¸Ð»ÐºÐ¸ Ñ‚Ð° ÑÐº Ñ—Ñ… ÑƒÐ½Ð¸ÐºÐ½ÑƒÑ‚Ð¸\n\n**ÐŸÐ¾Ð¼Ð¸Ð»ÐºÐ° 1: ÐŸÐ»ÑƒÑ‚Ð°Ð½Ð¸Ð½Ð° Ñƒ Ð²Ñ–Ð´Ð¼Ñ–Ð½ÐºÐ°Ñ…**\n\nâŒ ÐÐµÐ¿Ñ€Ð°Ð²Ð¸Ð»ÑŒÐ½Ð¾: ÐšÐ½Ð¸Ð³Ð° Ð½Ð°Ð¿Ð¸ÑÐ°Ð½Ð¾ Ð²Ñ‡Ð¾Ñ€Ð°.\nâœ… ÐŸÑ€Ð°Ð²Ð¸Ð»ÑŒÐ½Ð¾: ÐšÐ½Ð¸Ð³Ñƒ Ð½Ð°Ð¿Ð¸ÑÐ°Ð½Ð¾ Ð²Ñ‡Ð¾Ñ€Ð°. / ÐšÐ½Ð¸Ð³Ð° Ð½Ð°Ð¿Ð¸ÑÐ°Ð½Ð° Ð²Ñ‡Ð¾Ñ€Ð°.\n\n**Ð§Ð¾Ð¼Ñƒ?** ÐšÐ¾Ñ€Ð¾Ñ‚ÐºÐ¸Ð¹ Ð¿Ð°ÑÐ¸Ð² Ð²Ð¸Ð¼Ð°Ð³Ð°Ñ” Ð·Ð½Ð°Ñ…Ñ–Ð´Ð½Ð¾Ð³Ð¾ Ð²Ñ–Ð´Ð¼Ñ–Ð½ÐºÑƒ, Ð¿Ð¾Ð²Ð½Ð¸Ð¹ â€” Ð½Ð°Ð·Ð¸Ð²Ð½Ð¾Ð³Ð¾.\n\n**ÐŸÐ¾Ð¼Ð¸Ð»ÐºÐ° 2: ÐÐµÐ¿Ñ€Ð°Ð²Ð¸Ð»ÑŒÐ½Ðµ ÑƒÐ·Ð³Ð¾Ð´Ð¶ÐµÐ½Ð½Ñ**\n\nâŒ ÐÐµÐ¿Ñ€Ð°Ð²Ð¸Ð»ÑŒÐ½Ð¾: Ð Ñ–ÑˆÐµÐ½Ð½Ñ Ð¿Ñ€Ð¸Ð¹Ð½ÑÑ‚Ð¸Ð¹ ÐºÐ¾Ð¼Ñ–ÑÑ–Ñ”ÑŽ.\nâœ… ÐŸÑ€Ð°Ð²Ð¸Ð»ÑŒÐ½Ð¾: Ð Ñ–ÑˆÐµÐ½Ð½Ñ Ð¿Ñ€Ð¸Ð¹Ð½ÑÑ‚Ðµ ÐºÐ¾Ð¼Ñ–ÑÑ–Ñ”ÑŽ.\n\n**Ð§Ð¾Ð¼Ñƒ?** Â«Ð Ñ–ÑˆÐµÐ½Ð½ÑÂ» â€” ÑÐµÑ€ÐµÐ´Ð½ÑŒÐ¾Ð³Ð¾ Ñ€Ð¾Ð´Ñƒ, Ñ‚Ð¾Ð¼Ñƒ Ð´Ñ–Ñ”Ð¿Ñ€Ð¸ÐºÐ¼ÐµÑ‚Ð½Ð¸Ðº â€” Â«Ð¿Ñ€Ð¸Ð¹Ð½ÑÑ‚ÐµÂ».\n\n**ÐŸÐ¾Ð¼Ð¸Ð»ÐºÐ° 3: Ð—Ð²Ð¾Ñ€Ð¾Ñ‚Ð½Ð¸Ð¹ Ð¿Ð°ÑÐ¸Ð² Ð· Ð²Ð¸ÐºÐ¾Ð½Ð°Ð²Ñ†ÐµÐ¼**\n\nâŒ ÐÐµÐ¿Ñ€Ð°Ð²Ð¸Ð»ÑŒÐ½Ð¾: Ð‘ÑƒÐ´Ð¸Ð½Ð¾Ðº Ð±ÑƒÐ´ÑƒÑ”Ñ‚ÑŒÑÑ Ñ€Ð¾Ð±Ñ–Ñ‚Ð½Ð¸ÐºÐ°Ð¼Ð¸.\nâœ… ÐŸÑ€Ð°Ð²Ð¸Ð»ÑŒÐ½Ð¾: Ð‘ÑƒÐ´Ð¸Ð½Ð¾Ðº Ð±ÑƒÐ´ÑƒÑ”Ñ‚ÑŒÑÑ. / Ð‘ÑƒÐ´Ð¸Ð½Ð¾Ðº Ð±ÑƒÐ´ÑƒÑ”Ñ‚ÑŒÑÑ (Ñ€Ð¾Ð±Ñ–Ñ‚Ð½Ð¸ÐºÐ°Ð¼Ð¸ â€” Ñ€Ñ–Ð´ÐºÐ¾).\n\n**Ð§Ð¾Ð¼Ñƒ?** Ð—Ð²Ð¾Ñ€Ð¾Ñ‚Ð½Ð¸Ð¹ Ð¿Ð°ÑÐ¸Ð² Ð·Ð°Ð·Ð²Ð¸Ñ‡Ð°Ð¹ Ð½Ðµ Ð¿Ð¾Ñ‚Ñ€ÐµÐ±ÑƒÑ” Ð²ÐºÐ°Ð·Ñ–Ð²ÐºÐ¸ Ð½Ð° Ð²Ð¸ÐºÐ¾Ð½Ð°Ð²Ñ†Ñ.\n\n**ÐŸÐ¾Ð¼Ð¸Ð»ÐºÐ° 4: ÐŸÐ»ÑƒÑ‚Ð°Ð½Ð¸Ð½Ð° Ð¼Ñ–Ð¶ Ð¿Ñ€Ð¾Ñ†ÐµÑÐ¾Ð¼ Ñ– Ñ€ÐµÐ·ÑƒÐ»ÑŒÑ‚Ð°Ñ‚Ð¾Ð¼**\n\nâŒ ÐÐµÐ¿Ñ€Ð°Ð²Ð¸Ð»ÑŒÐ½Ð¾: ÐšÐ¾Ð½Ñ‚Ñ€Ð°ÐºÑ‚ Ð¿Ñ–Ð´Ð¿Ð¸ÑÑƒÑ”Ñ‚ÑŒÑÑ Ð²Ñ‡Ð¾Ñ€Ð°.\nâœ… ÐŸÑ€Ð°Ð²Ð¸Ð»ÑŒÐ½Ð¾: ÐšÐ¾Ð½Ñ‚Ñ€Ð°ÐºÑ‚ Ð¿Ñ–Ð´Ð¿Ð¸ÑÐ°Ð½Ð¾ Ð²Ñ‡Ð¾Ñ€Ð°. / ÐšÐ¾Ð½Ñ‚Ñ€Ð°ÐºÑ‚ Ð±ÑƒÐ² Ð¿Ñ–Ð´Ð¿Ð¸ÑÐ°Ð½Ð¸Ð¹ Ð²Ñ‡Ð¾Ñ€Ð°.\n\n**Ð§Ð¾Ð¼Ñƒ?** Ð—Ð²Ð¾Ñ€Ð¾Ñ‚Ð½Ð¸Ð¹ Ð¿Ð°ÑÐ¸Ð² Ð¾Ð¿Ð¸ÑÑƒÑ” Ð¿Ñ€Ð¾Ñ†ÐµÑ, Ð½Ðµ Ð·Ð°Ð²ÐµÑ€ÑˆÐµÐ½Ñƒ Ð´Ñ–ÑŽ.\n\n> ðŸŽ¯ **Ð—Ð°Ð¿Ð°Ð¼'ÑÑ‚Ð°Ð¹Ñ‚Ðµ**\n>\n> Ð—Ð²Ð¾Ñ€Ð¾Ñ‚Ð½Ð¸Ð¹ Ð¿Ð°ÑÐ¸Ð² â‰  Ð·Ð°Ð²ÐµÑ€ÑˆÐµÐ½Ð° Ð´Ñ–Ñ. Ð¯ÐºÑ‰Ð¾ Ð´Ñ–Ñ Ð·Ð°Ð²ÐµÑ€ÑˆÐµÐ½Ð°, Ð²Ð¸ÐºÐ¾Ñ€Ð¸ÑÑ‚Ð¾Ð²ÑƒÐ¹Ñ‚Ðµ Ð¿Ð¾Ð²Ð½Ð¸Ð¹ Ð°Ð±Ð¾ ÐºÐ¾Ñ€Ð¾Ñ‚ÐºÐ¸Ð¹ Ð¿Ð°ÑÐ¸Ð².\n\n---\n\n## Ð”Ñ–Ð°Ð»Ð¾Ð³Ð¸\n\n### Ð”Ñ–Ð°Ð»Ð¾Ð³ 1: ÐÐ° Ð¿Ñ€ÐµÑ-ÐºÐ¾Ð½Ñ„ÐµÑ€ÐµÐ½Ñ†Ñ–Ñ—\n\n**Ð–ÑƒÑ€Ð½Ð°Ð»Ñ–ÑÑ‚:** ÐšÐ¾Ð»Ð¸ Ð±ÑƒÐ»Ð¾ Ð¿Ñ–Ð´Ð¿Ð¸ÑÐ°Ð½Ð¾ ÑƒÐ³Ð¾Ð´Ñƒ?\n\n**ÐŸÑ€ÐµÑ-ÑÐµÐºÑ€ÐµÑ‚Ð°Ñ€:** Ð£Ð³Ð¾Ð´Ñƒ Ð¿Ñ–Ð´Ð¿Ð¸ÑÐ°Ð½Ð¾ ÑÑŒÐ¾Ð³Ð¾Ð´Ð½Ñ– Ð²Ñ€Ð°Ð½Ñ†Ñ–. Ð”Ð¾ÐºÑƒÐ¼ÐµÐ½Ñ‚ Ð±ÑƒÐ² Ð¿Ñ–Ð´Ð³Ð¾Ñ‚Ð¾Ð²Ð»ÐµÐ½Ð¸Ð¹ Ð¿Ñ€Ð¾Ñ‚ÑÐ³Ð¾Ð¼ Ð¼Ñ–ÑÑÑ†Ñ.\n\n**Ð–ÑƒÑ€Ð½Ð°Ð»Ñ–ÑÑ‚:** ÐšÐ¸Ð¼ Ð±ÑƒÐ»Ð° Ð¿Ñ–Ð´Ð¿Ð¸ÑÐ°Ð½Ð° ÑƒÐ³Ð¾Ð´Ð°?\n\n**ÐŸÑ€ÐµÑ-ÑÐµÐºÑ€ÐµÑ‚Ð°Ñ€:** Ð£Ð³Ð¾Ð´Ð° Ð¿Ñ–Ð´Ð¿Ð¸ÑÐ°Ð½Ð° Ð¼Ñ–Ð½Ñ–ÑÑ‚Ñ€Ð°Ð¼Ð¸ Ð¾Ð±Ð¾Ñ… ÐºÑ€Ð°Ñ—Ð½. Ð—Ð°Ñ€Ð°Ð· Ð³Ð¾Ñ‚ÑƒÑŽÑ‚ÑŒÑÑ Ð´Ð¾Ð´Ð°Ñ‚ÐºÐ¾Ð²Ñ– Ð¿Ñ€Ð¾Ñ‚Ð¾ÐºÐ¾Ð»Ð¸.\n\n**Ð–ÑƒÑ€Ð½Ð°Ð»Ñ–ÑÑ‚:** ÐšÐ¾Ð»Ð¸ Ð±ÑƒÐ´Ðµ Ð¾Ð¿Ñ€Ð¸Ð»ÑŽÐ´Ð½ÐµÐ½Ð¾ Ð¿Ð¾Ð²Ð½Ð¸Ð¹ Ñ‚ÐµÐºÑÑ‚?\n\n**ÐŸÑ€ÐµÑ-ÑÐµÐºÑ€ÐµÑ‚Ð°Ñ€:** Ð¢ÐµÐºÑÑ‚ Ð±ÑƒÐ´Ðµ Ð¾Ð¿ÑƒÐ±Ð»Ñ–ÐºÐ¾Ð²Ð°Ð½Ð¾ Ð·Ð°Ð²Ñ‚Ñ€Ð°. ÐŸÐµÑ€ÐµÐºÐ»Ð°Ð´Ð¸ Ð³Ð¾Ñ‚ÑƒÑŽÑ‚ÑŒÑÑ Ð·Ð°Ñ€Ð°Ð·.\n\n### Ð”Ñ–Ð°Ð»Ð¾Ð³ 2: ÐÐ° Ð±ÑƒÐ´Ñ–Ð²Ð½Ð¸Ñ†Ñ‚Ð²Ñ–\n\n**Ð†Ð½Ð¶ÐµÐ½ÐµÑ€:** Ð¯Ðº Ð¿Ñ€Ð¾ÑÑƒÐ²Ð°Ñ”Ñ‚ÑŒÑÑ Ð±ÑƒÐ´Ñ–Ð²Ð½Ð¸Ñ†Ñ‚Ð²Ð¾?\n\n**ÐŸÑ€Ð¾Ñ€Ð°Ð±:** Ð¤ÑƒÐ½Ð´Ð°Ð¼ÐµÐ½Ñ‚ ÑƒÐ¶Ðµ Ð·Ð°Ð»Ð¸Ñ‚Ð¾. ÐŸÐµÑ€ÑˆÐ¸Ð¹ Ð¿Ð¾Ð²ÐµÑ€Ñ… Ð±ÑƒÐ´ÑƒÑ”Ñ‚ÑŒÑÑ Ð·Ð°Ñ€Ð°Ð·.\n\n**Ð†Ð½Ð¶ÐµÐ½ÐµÑ€:** Ð ÐºÐ¾Ð¼ÑƒÐ½Ñ–ÐºÐ°Ñ†Ñ–Ñ—?\n\n**ÐŸÑ€Ð¾Ñ€Ð°Ð±:** Ð•Ð»ÐµÐºÑ‚Ñ€Ð¸ÐºÑƒ Ð¿Ñ€Ð¾Ð²ÐµÐ´ÐµÐ½Ð¾, Ð²Ð¾Ð´Ð° Ð¿Ñ–Ð´ÐºÐ»ÑŽÑ‡Ð°Ñ”Ñ‚ÑŒÑÑ ÑÑŒÐ¾Ð³Ð¾Ð´Ð½Ñ–. Ð¢Ñ€ÑƒÐ±Ð¸ Ð¿Ñ€Ð¾ÐºÐ»Ð°Ð´Ð°ÑŽÑ‚ÑŒÑÑ Ð¿Ð°Ñ€Ð°Ð»ÐµÐ»ÑŒÐ½Ð¾.\n\n**Ð†Ð½Ð¶ÐµÐ½ÐµÑ€:** ÐšÐ¾Ð»Ð¸ Ð±ÑƒÐ´Ðµ Ð·Ð°Ð²ÐµÑ€ÑˆÐµÐ½Ð¾ Ð¿ÐµÑ€ÑˆÐ¸Ð¹ ÐµÑ‚Ð°Ð¿?\n\n**ÐŸÑ€Ð¾Ñ€Ð°Ð±:** Ð—Ð° Ð¿Ð»Ð°Ð½Ð¾Ð¼ Ð¿ÐµÑ€ÑˆÐ¸Ð¹ ÐµÑ‚Ð°Ð¿ Ð±ÑƒÐ´Ðµ Ð·Ð°Ð²ÐµÑ€ÑˆÐµÐ½Ð¾ Ð´Ð¾ ÐºÑ–Ð½Ñ†Ñ Ð¼Ñ–ÑÑÑ†Ñ.\n\n### Ð”Ñ–Ð°Ð»Ð¾Ð³ 3: Ð’ ÑƒÐ½Ñ–Ð²ÐµÑ€ÑÐ¸Ñ‚ÐµÑ‚Ñ–\n\n**Ð¡Ñ‚ÑƒÐ´ÐµÐ½Ñ‚:** Ð”Ðµ Ð¿ÑƒÐ±Ð»Ñ–ÐºÑƒÑŽÑ‚ÑŒÑÑ Ñ€ÐµÐ·ÑƒÐ»ÑŒÑ‚Ð°Ñ‚Ð¸ Ñ–ÑÐ¿Ð¸Ñ‚Ñ–Ð²?\n\n**Ð¡ÐµÐºÑ€ÐµÑ‚Ð°Ñ€:** Ð ÐµÐ·ÑƒÐ»ÑŒÑ‚Ð°Ñ‚Ð¸ Ð¿ÑƒÐ±Ð»Ñ–ÐºÑƒÑŽÑ‚ÑŒÑÑ Ð½Ð° ÑÐ°Ð¹Ñ‚Ñ– Ñ„Ð°ÐºÑƒÐ»ÑŒÑ‚ÐµÑ‚Ñƒ. ÐžÑ†Ñ–Ð½ÐºÐ¸ Ð²Ð¸ÑÑ‚Ð°Ð²Ð»ÑÑŽÑ‚ÑŒÑÑ Ð¿Ñ€Ð¾Ñ‚ÑÐ³Ð¾Ð¼ Ñ‚Ð¸Ð¶Ð½Ñ.\n\n**Ð¡Ñ‚ÑƒÐ´ÐµÐ½Ñ‚:** Ð ÑÐµÑ€Ñ‚Ð¸Ñ„Ñ–ÐºÐ°Ñ‚Ð¸ ÐºÐ¾Ð»Ð¸ Ð²Ð¸Ð´Ð°ÑŽÑ‚ÑŒÑÑ?\n\n**Ð¡ÐµÐºÑ€ÐµÑ‚Ð°Ñ€:** Ð¡ÐµÑ€Ñ‚Ð¸Ñ„Ñ–ÐºÐ°Ñ‚Ð¸ Ð²Ð¸Ð´Ð°ÑŽÑ‚ÑŒÑÑ Ð¿Ñ–ÑÐ»Ñ Ð·Ð°Ð²ÐµÑ€ÑˆÐµÐ½Ð½Ñ ÐºÑƒÑ€ÑÑƒ. Ð’Ð°Ð¼ Ð±ÑƒÐ´Ðµ Ð½Ð°Ð´Ñ–ÑÐ»Ð°Ð½Ð¾ Ð¿Ð¾Ð²Ñ–Ð´Ð¾Ð¼Ð»ÐµÐ½Ð½Ñ.\n\n**Ð¡Ñ‚ÑƒÐ´ÐµÐ½Ñ‚:** Ð”ÑÐºÑƒÑŽ! Ð Ñ€Ð¾Ð·ÐºÐ»Ð°Ð´ ÑƒÐ¶Ðµ ÑÐºÐ»Ð°Ð´ÐµÐ½Ð¾?\n\n**Ð¡ÐµÐºÑ€ÐµÑ‚Ð°Ñ€:** Ð¢Ð°Ðº, Ñ€Ð¾Ð·ÐºÐ»Ð°Ð´ Ð½Ð° Ð½Ð°ÑÑ‚ÑƒÐ¿Ð½Ð¸Ð¹ ÑÐµÐ¼ÐµÑÑ‚Ñ€ ÑÐºÐ»Ð°Ð´ÐµÐ½Ð¾ Ñ‚Ð° Ð·Ð°Ñ‚Ð²ÐµÑ€Ð´Ð¶ÐµÐ½Ð¾ Ð´ÐµÐºÐ°Ð½Ð¾Ð¼.\n\n### Ð”Ñ–Ð°Ð»Ð¾Ð³ 4: Ð£ Ñ€ÐµÑÑ‚Ð¾Ñ€Ð°Ð½Ñ–\n\n**ÐžÑ„Ñ–Ñ†Ñ–Ð°Ð½Ñ‚:** ÐÐ°Ñˆ Ñ…Ð»Ñ–Ð± Ð²Ð¸Ð¿Ñ–ÐºÐ°Ñ”Ñ‚ÑŒÑÑ Ñ‰Ð¾Ñ€Ð°Ð½ÐºÑƒ. Ð¡Ð¾ÑƒÑÐ¸ Ð³Ð¾Ñ‚ÑƒÑŽÑ‚ÑŒÑÑ Ð· ÑÐ²Ñ–Ð¶Ð¸Ñ… Ñ–Ð½Ð³Ñ€ÐµÐ´Ñ–Ñ”Ð½Ñ‚Ñ–Ð².\n\n**Ð“Ñ–ÑÑ‚ÑŒ:** Ð Ñ†Ñ ÑÑ‚Ñ€Ð°Ð²Ð° ÑÐº Ð³Ð¾Ñ‚ÑƒÑ”Ñ‚ÑŒÑÑ?\n\n**ÐžÑ„Ñ–Ñ†Ñ–Ð°Ð½Ñ‚:** Ð Ð¸Ð±Ð° Ð·Ð°Ð¿Ñ–ÐºÐ°Ñ”Ñ‚ÑŒÑÑ Ð² Ð´ÑƒÑ…Ð¾Ð²Ñ†Ñ– Ð· Ñ‚Ñ€Ð°Ð²Ð°Ð¼Ð¸. ÐžÐ²Ð¾Ñ‡Ñ– Ñ‚ÑƒÑˆÐºÑƒÑŽÑ‚ÑŒÑÑ Ð² Ð¾Ð»Ð¸Ð²ÐºÐ¾Ð²Ñ–Ð¹ Ð¾Ð»Ñ–Ñ—.\n\n**Ð“Ñ–ÑÑ‚ÑŒ:** Ð§ÑƒÐ´Ð¾Ð²Ð¾. Ð Ð²Ð¸Ð½Ð¾ Ð¾Ñ…Ð¾Ð»Ð¾Ð´Ð¶ÐµÐ½Ðµ?\n\n**ÐžÑ„Ñ–Ñ†Ñ–Ð°Ð½Ñ‚:** Ð¢Ð°Ðº, Ð±Ñ–Ð»Ðµ Ð²Ð¸Ð½Ð¾ Ð¾Ñ…Ð¾Ð»Ð¾Ð´Ð¶ÐµÐ½Ð¾ Ð´Ð¾ Ð¾Ð¿Ñ‚Ð¸Ð¼Ð°Ð»ÑŒÐ½Ð¾Ñ— Ñ‚ÐµÐ¼Ð¿ÐµÑ€Ð°Ñ‚ÑƒÑ€Ð¸. Ð™Ð¾Ð³Ð¾ Ð¿Ð¾Ð´Ð°Ð´ÑƒÑ‚ÑŒ Ñ€Ð°Ð·Ð¾Ð¼ Ñ–Ð· ÑÑ‚Ñ€Ð°Ð²Ð¾ÑŽ.\n\n### Ð”Ñ–Ð°Ð»Ð¾Ð³ 5: Ð£ Ð²Ð¸Ð´Ð°Ð²Ð½Ð¸Ñ†Ñ‚Ð²Ñ–\n\n**Ð ÐµÐ´Ð°ÐºÑ‚Ð¾Ñ€:** ÐÐ° ÑÐºÐ¾Ð¼Ñƒ ÐµÑ‚Ð°Ð¿Ñ– Ñ€ÑƒÐºÐ¾Ð¿Ð¸Ñ?\n\n**ÐšÐ¾Ñ€ÐµÐºÑ‚Ð¾Ñ€:** Ð¢ÐµÐºÑÑ‚ Ð²Ð¸Ñ‡Ð¸Ñ‚Ð°Ð½Ð¾, Ð¿Ð¾Ð¼Ð¸Ð»ÐºÐ¸ Ð²Ð¸Ð¿Ñ€Ð°Ð²Ð»ÐµÐ½Ð¾. Ð—Ð°Ñ€Ð°Ð· Ð²ÐµÑ€ÑÑ‚Ð°Ñ”Ñ‚ÑŒÑÑ Ð¼Ð°ÐºÐµÑ‚.\n\n**Ð ÐµÐ´Ð°ÐºÑ‚Ð¾Ñ€:** Ð Ñ–Ð»ÑŽÑÑ‚Ñ€Ð°Ñ†Ñ–Ñ—?\n\n**ÐšÐ¾Ñ€ÐµÐºÑ‚Ð¾Ñ€:** Ð†Ð»ÑŽÑÑ‚Ñ€Ð°Ñ†Ñ–Ñ— Ð·Ð°Ð¼Ð¾Ð²Ð»ÐµÐ½Ð¾, Ð°Ð»Ðµ Ñ‰Ðµ Ð½Ðµ Ð³Ð¾Ñ‚Ð¾Ð²Ñ–. Ð’Ð¾Ð½Ð¸ Ð¼Ð°Ð»ÑŽÑŽÑ‚ÑŒÑÑ Ñ…ÑƒÐ´Ð¾Ð¶Ð½Ð¸ÐºÐ¾Ð¼.\n\n**Ð ÐµÐ´Ð°ÐºÑ‚Ð¾Ñ€:** ÐšÐ¾Ð»Ð¸ ÐºÐ½Ð¸Ð³Ð° Ð±ÑƒÐ´Ðµ Ð½Ð°Ð´Ñ€ÑƒÐºÐ¾Ð²Ð°Ð½Ð°?\n\n**ÐšÐ¾Ñ€ÐµÐºÑ‚Ð¾Ñ€:** ÐšÐ½Ð¸Ð³Ð° Ð±ÑƒÐ´Ðµ Ð½Ð°Ð´Ñ€ÑƒÐºÐ¾Ð²Ð°Ð½Ð° Ð·Ð° Ð´Ð²Ð° Ñ‚Ð¸Ð¶Ð½Ñ–. ÐžÐ±ÐºÐ»Ð°Ð´Ð¸Ð½ÐºÑƒ Ð·Ð°Ñ‚Ð²ÐµÑ€Ð´Ð¶ÐµÐ½Ð¾ Ð²Ñ‡Ð¾Ñ€Ð°.\n\n> ðŸŽ¯ **Ð—Ð²ÐµÑ€Ð½Ñ–Ñ‚ÑŒ ÑƒÐ²Ð°Ð³Ñƒ**\n>\n> Ð£ Ð´Ñ–Ð°Ð»Ð¾Ð³Ð°Ñ… Ð·Ð¼Ñ–ÑˆÑƒÑŽÑ‚ÑŒÑÑ Ð²ÑÑ– Ñ‚Ñ€Ð¸ Ñ‚Ð¸Ð¿Ð¸ Ð¿Ð°ÑÐ¸Ð²Ñƒ Ð·Ð°Ð»ÐµÐ¶Ð½Ð¾ Ð²Ñ–Ð´ ÐºÐ¾Ð½Ñ‚ÐµÐºÑÑ‚Ñƒ: Ñ€ÐµÐ·ÑƒÐ»ÑŒÑ‚Ð°Ñ‚ (ÐºÐ¾Ñ€Ð¾Ñ‚ÐºÐ¸Ð¹ Ð¿Ð°ÑÐ¸Ð²), Ð¿Ñ€Ð¾Ñ†ÐµÑ (Ð·Ð²Ð¾Ñ€Ð¾Ñ‚Ð½Ð¸Ð¹ Ð¿Ð°ÑÐ¸Ð²), Ñ–Ð· Ð²Ð¸ÐºÐ¾Ð½Ð°Ð²Ñ†ÐµÐ¼ (Ð¿Ð¾Ð²Ð½Ð¸Ð¹ Ð¿Ð°ÑÐ¸Ð²).\n\n---\n\n> [!resources] Ð—Ð¾Ð²Ð½Ñ–ÑˆÐ½Ñ– Ñ€ÐµÑÑƒÑ€ÑÐ¸\n>\n> **Ð”Ð¾Ð´Ð°Ñ‚ÐºÐ¾Ð²Ñ– Ð¼Ð°Ñ‚ÐµÑ€Ñ–Ð°Ð»Ð¸:**\n> - ðŸ“– [ÐŸÐ°ÑÐ¸Ð²Ð½Ð¸Ð¹ ÑÑ‚Ð°Ð½ Ð´Ñ–Ñ”ÑÐ»Ð¾Ð²Ð°](https://uk.wikipedia.org/wiki/ÐŸÐ°ÑÐ¸Ð²Ð½Ð¸Ð¹_ÑÑ‚Ð°Ð½) â€” Ð’Ñ–ÐºÑ–Ð¿ÐµÐ´Ñ–Ñ\n> - ðŸ“º [ÐŸÐ°ÑÐ¸Ð²Ð½Ñ– ÐºÐ¾Ð½ÑÑ‚Ñ€ÑƒÐºÑ†Ñ–Ñ—](https://www.youtube.com/results?search_query=Ð¿Ð°ÑÐ¸Ð²Ð½Ñ–+ÐºÐ¾Ð½ÑÑ‚Ñ€ÑƒÐºÑ†Ñ–Ñ—+ÑƒÐºÑ€Ð°Ñ—Ð½ÑÑŒÐºÐ°) â€” Ð²Ñ–Ð´ÐµÐ¾ ÑƒÑ€Ð¾ÐºÐ¸\n> - ðŸŽ§ [Ukrainian Lessons Podcast](https://www.ukrainianlessons.com/) â€” Ð¿Ð¾Ð´ÐºÐ°ÑÑ‚ Ð´Ð»Ñ Ð²Ð¸Ð²Ñ‡ÐµÐ½Ð½Ñ ÑƒÐºÑ€Ð°Ñ—Ð½ÑÑŒÐºÐ¾Ñ—\n\n---\n\n# Ð’Ð¿Ñ€Ð°Ð²Ð¸\n\n## quiz: Ð Ð¾Ð·ÑƒÐ¼Ñ–Ð½Ð½Ñ Ð¿Ð°ÑÐ¸Ð²Ð½Ð¸Ñ… ÐºÐ¾Ð½ÑÑ‚Ñ€ÑƒÐºÑ†Ñ–Ð¹\n> ÐžÐ±ÐµÑ€Ñ–Ñ‚ÑŒ Ð¿Ñ€Ð°Ð²Ð¸Ð»ÑŒÐ½Ñƒ Ð²Ñ–Ð´Ð¿Ð¾Ð²Ñ–Ð´ÑŒ, Ð°Ð½Ð°Ð»Ñ–Ð·ÑƒÑŽÑ‡Ð¸ Ð¾ÑÐ¾Ð±Ð»Ð¸Ð²Ð¾ÑÑ‚Ñ– Ñ€Ñ–Ð·Ð½Ð¸Ñ… Ñ‚Ð¸Ð¿Ñ–Ð² Ð¿Ð°ÑÐ¸Ð²Ð½Ð¸Ñ… ÐºÐ¾Ð½ÑÑ‚Ñ€ÑƒÐºÑ†Ñ–Ð¹.\n\n1. Ð¯ÐºÐµ Ñ€ÐµÑ‡ÐµÐ½Ð½Ñ Ð²Ð¸ÐºÐ¾Ñ€Ð¸ÑÑ‚Ð¾Ð²ÑƒÑ” Ð·Ð²Ð¾Ñ€Ð¾Ñ‚Ð½Ð¸Ð¹ Ð¿Ð°ÑÐ¸Ð², Ñ‰Ð¾ Ð¿Ñ–Ð´ÐºÑ€ÐµÑÐ»ÑŽÑ” Ð¿Ñ€Ð¾Ñ†ÐµÑ, ÑÐºÐ¸Ð¹ Ñ‚Ñ€Ð¸Ð²Ð°Ñ” Ð² Ð¼Ð¾Ð¼ÐµÐ½Ñ‚ Ð¼Ð¾Ð²Ð»ÐµÐ½Ð½Ñ?\n   - [ ] ÐšÐ½Ð¸Ð³Ñƒ Ð½Ð°Ð¿Ð¸ÑÐ°Ð½Ð¾ Ð¼Ð¸Ð½ÑƒÐ»Ð¾Ð³Ð¾ Ñ€Ð¾ÐºÑƒ Ð²Ñ–Ð´Ð¾Ð¼Ð¸Ð¼ Ð¿Ð¸ÑÑŒÐ¼ÐµÐ½Ð½Ð¸ÐºÐ¾Ð¼\n   - [ ] ÐšÐ½Ð¸Ð³Ð° Ð½Ð°Ð¿Ð¸ÑÐ°Ð½Ð° Ð²Ñ–Ð´Ð¾Ð¼Ð¸Ð¼ ÑƒÐºÑ€Ð°Ñ—Ð½ÑÑŒÐºÐ¸Ð¼ Ð¿Ð¸ÑÑŒÐ¼ÐµÐ½Ð½Ð¸ÐºÐ¾Ð¼\n   - [x] ÐšÐ½Ð¸Ð³Ð° Ð¿Ð¸ÑˆÐµÑ‚ÑŒÑÑ Ð²Ð¶Ðµ Ñ‚Ñ€ÐµÑ‚Ñ–Ð¹ Ñ€Ñ–Ðº Ð¿Ð¾ÑÐ¿Ñ–Ð»ÑŒ\n   - [ ] ÐšÐ½Ð¸Ð³Ð° Ð±ÑƒÐ»Ð° Ð½Ð°Ð¿Ð¸ÑÐ°Ð½Ð° Ñ‰Ðµ Ð² Ð¼Ð¸Ð½ÑƒÐ»Ð¾Ð¼Ñƒ ÑÑ‚Ð¾Ð»Ñ–Ñ‚Ñ‚Ñ–\n   > Ð—Ð²Ð¾Ñ€Ð¾Ñ‚Ð½Ð¸Ð¹ Ð¿Ð°ÑÐ¸Ð² Â«Ð¿Ð¸ÑˆÐµÑ‚ÑŒÑÑÂ» Ð¾Ð¿Ð¸ÑÑƒÑ” Ð¿Ñ€Ð¾Ñ†ÐµÑ, Ñ‰Ð¾ Ñ‚Ñ€Ð¸Ð²Ð°Ñ”.\n\n2. Ð¯ÐºÐ° ÐºÐ¾Ð½ÑÑ‚Ñ€ÑƒÐºÑ†Ñ–Ñ Ð½Ð°Ð¹ÐºÑ€Ð°Ñ‰Ðµ Ð¿Ñ–Ð´Ñ…Ð¾Ð´Ð¸Ñ‚ÑŒ Ð´Ð»Ñ Ð¾Ñ„Ñ–Ñ†Ñ–Ð¹Ð½Ð¾Ð³Ð¾ Ð¾Ð³Ð¾Ð»Ð¾ÑˆÐµÐ½Ð½Ñ Ñ€ÐµÐ·ÑƒÐ»ÑŒÑ‚Ð°Ñ‚Ñ–Ð² Ð±ÐµÐ· Ð²ÐºÐ°Ð·Ñ–Ð²ÐºÐ¸ Ð½Ð° Ð²Ð¸ÐºÐ¾Ð½Ð°Ð²Ñ†Ñ?\n   - [ ] Ð ÐµÐ·ÑƒÐ»ÑŒÑ‚Ð°Ñ‚Ð¸ Ð¾Ð³Ð¾Ð»Ð¾ÑÐ¸Ð»Ð¸ Ñ‡Ð»ÐµÐ½Ð¸ Ð¶ÑƒÑ€Ñ– ÐºÐ¾Ð½ÐºÑƒÑ€ÑÑƒ\n   - [x] Ð ÐµÐ·ÑƒÐ»ÑŒÑ‚Ð°Ñ‚Ð¸ Ð¾Ð³Ð¾Ð»Ð¾ÑˆÐµÐ½Ð¾ Ð¾Ñ„Ñ–Ñ†Ñ–Ð¹Ð½Ð¾ Ð½Ð° Ñ†ÐµÑ€ÐµÐ¼Ð¾Ð½Ñ–Ñ— Ð½Ð°Ð³Ð¾Ñ€Ð¾Ð´Ð¶ÐµÐ½Ð½Ñ\n   - [ ] Ð ÐµÐ·ÑƒÐ»ÑŒÑ‚Ð°Ñ‚Ð¸ Ð¾Ð³Ð¾Ð»Ð¾ÑˆÑƒÑŽÑ‚ÑŒÑÑ Ñ‰Ð¾Ñ€Ð¾ÐºÑƒ Ð² Ñ†ÐµÐ¹ Ñ‡Ð°Ñ\n   - [ ] Ð ÐµÐ·ÑƒÐ»ÑŒÑ‚Ð°Ñ‚Ð¸ Ð±ÑƒÐ»Ð¸ Ð¾Ð³Ð¾Ð»Ð¾ÑˆÐµÐ½Ñ– Ð³Ð¾Ð»Ð¾Ð²Ð¾ÑŽ ÐºÐ¾Ð¼Ñ–ÑÑ–Ñ—\n   > ÐšÐ¾Ñ€Ð¾Ñ‚ÐºÐ¸Ð¹ Ð¿Ð°ÑÐ¸Ð² Â«Ð¾Ð³Ð¾Ð»Ð¾ÑˆÐµÐ½Ð¾Â» â€” Ñ‚Ð¸Ð¿Ð¾Ð²Ð¸Ð¹ Ð´Ð»Ñ Ð¾Ñ„Ñ–Ñ†Ñ–Ð¹Ð½Ð¸Ñ… Ð¿Ð¾Ð²Ñ–Ð´Ð¾Ð¼Ð»ÐµÐ½ÑŒ.\n\n3. Ð¯ÐºÐµ Ñ€ÐµÑ‡ÐµÐ½Ð½Ñ Ð´ÐµÐ¼Ð¾Ð½ÑÑ‚Ñ€ÑƒÑ” Ð¿Ñ€Ð°Ð²Ð¸Ð»ÑŒÐ½Ðµ Ð²Ð¸ÐºÐ¾Ñ€Ð¸ÑÑ‚Ð°Ð½Ð½Ñ Ð¿Ð¾Ð²Ð½Ð¾Ð³Ð¾ Ð¿Ð°ÑÐ¸Ð²Ñƒ Ð· Ð²Ð¸ÐºÐ¾Ð½Ð°Ð²Ñ†ÐµÐ¼ Ð´Ñ–Ñ— Ð² Ð¾Ñ€ÑƒÐ´Ð½Ð¾Ð¼Ñƒ Ð²Ñ–Ð´Ð¼Ñ–Ð½ÐºÑƒ?\n   - [x] ÐšÐ°Ñ€Ñ‚Ð¸Ð½Ð° Ð½Ð°Ð¼Ð°Ð»ÑŒÐ¾Ð²Ð°Ð½Ð° Ð²Ñ–Ð´Ð¾Ð¼Ð¸Ð¼ ÑƒÐºÑ€Ð°Ñ—Ð½ÑÑŒÐºÐ¸Ð¼ Ñ…ÑƒÐ´Ð¾Ð¶Ð½Ð¸ÐºÐ¾Ð¼\n   - [ ] ÐšÐ°Ñ€Ñ‚Ð¸Ð½Ñƒ Ð½Ð°Ð¼Ð°Ð»ÑŒÐ¾Ð²Ð°Ð½Ð¾ Ð² Ð¼Ð¸Ð½ÑƒÐ»Ð¾Ð¼Ñƒ ÑÑ‚Ð¾Ð»Ñ–Ñ‚Ñ‚Ñ–\n   - [ ] ÐšÐ°Ñ€Ñ‚Ð¸Ð½Ð° Ð¼Ð°Ð»ÑŽÑ”Ñ‚ÑŒÑÑ Ñ‚Ð°Ð»Ð°Ð½Ð¾Ð²Ð¸Ñ‚Ð¸Ð¼ Ñ…ÑƒÐ´Ð¾Ð¶Ð½Ð¸ÐºÐ¾Ð¼ Ð·Ð°Ñ€Ð°Ð·\n   - [ ] ÐšÐ°Ñ€Ñ‚Ð¸Ð½Ð¸ Ð¼Ð°Ð»ÑŽÐ²Ð°Ñ‚Ð¸ Ñ…ÑƒÐ´Ð¾Ð¶Ð½Ð¸ÐºÐ¾Ð¼ Ð¿Ñ€Ð°Ð²Ð¸Ð»ÑŒÐ½Ð¾\n   > ÐŸÐ¾Ð²Ð½Ð¸Ð¹ Ð¿Ð°ÑÐ¸Ð²: Ð¿Ñ–Ð´Ð¼ÐµÑ‚ + Ð´Ñ–Ñ”Ð¿Ñ€Ð¸ÐºÐ¼ÐµÑ‚Ð½Ð¸Ðº + Ð²Ð¸ÐºÐ¾Ð½Ð°Ð²ÐµÑ†ÑŒ Ð² Ð¾Ñ€ÑƒÐ´Ð½Ð¾Ð¼Ñƒ Ð²Ñ–Ð´Ð¼Ñ–Ð½ÐºÑƒ.\n\n4. Ð§Ð¸Ð¼ Ð¿Ñ€Ð¸Ð½Ñ†Ð¸Ð¿Ð¾Ð²Ð¾ Ð²Ñ–Ð´Ñ€Ñ–Ð·Ð½ÑÑ”Ñ‚ÑŒÑÑ Ð·Ð²Ð¾Ñ€Ð¾Ñ‚Ð½Ð¸Ð¹ Ð¿Ð°ÑÐ¸Ð² Ð²Ñ–Ð´ Ð¿Ð¾Ð²Ð½Ð¾Ð³Ð¾ Ð¿Ð°ÑÐ¸Ð²Ñƒ Ð² ÑÑƒÑ‡Ð°ÑÐ½Ñ–Ð¹ ÑƒÐºÑ€Ð°Ñ—Ð½ÑÑŒÐºÑ–Ð¹ Ð¼Ð¾Ð²Ñ–?\n   - [ ] Ð—Ð²Ð¾Ñ€Ð¾Ñ‚Ð½Ð¸Ð¹ Ð¿Ð°ÑÐ¸Ð² Ð·Ð°Ð²Ð¶Ð´Ð¸ Ð²Ð¸Ð¼Ð°Ð³Ð°Ñ” Ð²ÐºÐ°Ð·Ñ–Ð²ÐºÐ¸ Ð½Ð° Ð²Ð¸ÐºÐ¾Ð½Ð°Ð²Ñ†Ñ\n   - [ ] Ð—Ð²Ð¾Ñ€Ð¾Ñ‚Ð½Ð¸Ð¹ Ð¿Ð°ÑÐ¸Ð² Ð²Ð¸ÐºÐ¾Ñ€Ð¸ÑÑ‚Ð¾Ð²ÑƒÑ”Ñ‚ÑŒÑÑ Ñ‚Ñ–Ð»ÑŒÐºÐ¸ Ð² Ð¼Ð¸Ð½ÑƒÐ»Ð¾Ð¼Ñƒ Ñ‡Ð°ÑÑ–\n   - [x] Ð—Ð²Ð¾Ñ€Ð¾Ñ‚Ð½Ð¸Ð¹ Ð¿Ð°ÑÐ¸Ð² Ð¿Ñ–Ð´ÐºÑ€ÐµÑÐ»ÑŽÑ” Ð¿Ñ€Ð¾Ñ†ÐµÑ, Ð° Ð½Ðµ Ð·Ð°Ð²ÐµÑ€ÑˆÐµÐ½Ð¸Ð¹ Ñ€ÐµÐ·ÑƒÐ»ÑŒÑ‚Ð°Ñ‚\n   - [ ] Ð—Ð²Ð¾Ñ€Ð¾Ñ‚Ð½Ð¸Ð¹ Ð¿Ð°ÑÐ¸Ð² Ð½Ðµ Ð¼Ð¾Ð¶Ðµ Ð²Ð¶Ð¸Ð²Ð°Ñ‚Ð¸ÑÑ Ð· Ð½ÐµÐ¶Ð¸Ð²Ð¸Ð¼Ð¸ Ð¿Ñ–Ð´Ð¼ÐµÑ‚Ð°Ð¼Ð¸\n   > Ð”Ñ–Ñ”ÑÐ»Ð¾Ð²Ð° Ð· -ÑÑ Ð¾Ð¿Ð¸ÑÑƒÑŽÑ‚ÑŒ Ð¿Ñ€Ð¾Ñ†ÐµÑ: Â«Ð±ÑƒÐ´ÑƒÑ”Ñ‚ÑŒÑÑÂ» (Ð¿Ñ€Ð¾Ñ†ÐµÑ) vs Â«Ð·Ð±ÑƒÐ´Ð¾Ð²Ð°Ð½Ð¾Â» (Ñ€ÐµÐ·ÑƒÐ»ÑŒÑ‚Ð°Ñ‚).\n\n5. Ð¯ÐºÐµ Ñ€ÐµÑ‡ÐµÐ½Ð½Ñ Ð³Ñ€Ð°Ð¼Ð°Ñ‚Ð¸Ñ‡Ð½Ð¾ Ð½ÐµÐ¿Ñ€Ð°Ð²Ð¸Ð»ÑŒÐ½Ðµ Ñ‡ÐµÑ€ÐµÐ· Ð½ÐµÐ²Ñ–Ð´Ð¿Ð¾Ð²Ñ–Ð´Ð½Ñ–ÑÑ‚ÑŒ Ð¼Ñ–Ð¶ Ñ‚Ð¸Ð¿Ð¾Ð¼ Ð¿Ð°ÑÐ¸Ð²Ñƒ Ñ‚Ð° Ñ‡Ð°ÑÐ¾Ð²Ð¸Ð¼ ÐºÐ¾Ð½Ñ‚ÐµÐºÑÑ‚Ð¾Ð¼?\n   - [ ] Ð”Ð¾ÐºÑƒÐ¼ÐµÐ½Ñ‚ Ð¿Ñ–Ð´Ð¿Ð¸ÑÐ°Ð½Ð¾ Ð¾Ð±Ð¾Ð¼Ð° ÑÑ‚Ð¾Ñ€Ð¾Ð½Ð°Ð¼Ð¸ Ð²Ñ‡Ð¾Ñ€Ð° Ð²Ð²ÐµÑ‡ÐµÑ€Ñ–\n   - [x] ÐšÐ¾Ð½Ñ‚Ñ€Ð°ÐºÑ‚ Ð¿Ñ–Ð´Ð¿Ð¸ÑÑƒÑ”Ñ‚ÑŒÑÑ Ð¼Ð¸Ð½ÑƒÐ»Ð¾Ð³Ð¾ Ñ‚Ð¸Ð¶Ð½Ñ Ð´Ð¸Ñ€ÐµÐºÑ‚Ð¾Ñ€Ð¾Ð¼ ÐºÐ¾Ð¼Ð¿Ð°Ð½Ñ–Ñ—\n   - [ ] Ð£Ð³Ð¾Ð´Ð° Ð¿Ñ–Ð´Ð¿Ð¸ÑÐ°Ð½Ð° Ð¼Ñ–Ð½Ñ–ÑÑ‚Ñ€Ð°Ð¼Ð¸ Ð·Ð°ÐºÐ¾Ñ€Ð´Ð¾Ð½Ð½Ð¸Ñ… ÑÐ¿Ñ€Ð°Ð²\n   - [ ] Ð”Ð¾Ð³Ð¾Ð²Ð¾Ñ€Ð¸ Ð¿Ñ–Ð´Ð¿Ð¸ÑÑƒÑŽÑ‚ÑŒÑÑ ÐµÐ»ÐµÐºÑ‚Ñ€Ð¾Ð½Ð½Ð¸Ð¼ Ð¿Ñ–Ð´Ð¿Ð¸ÑÐ¾Ð¼ Ñ‰Ð¾Ð´Ð½Ñ\n   > Â«ÐŸÑ–Ð´Ð¿Ð¸ÑÑƒÑ”Ñ‚ÑŒÑÑÂ» â€” Ð¿Ñ€Ð¾Ñ†ÐµÑ, Â«Ð¼Ð¸Ð½ÑƒÐ»Ð¾Ð³Ð¾ Ñ‚Ð¸Ð¶Ð½ÑÂ» â€” Ð·Ð°Ð²ÐµÑ€ÑˆÐµÐ½Ð° Ð´Ñ–Ñ; Ð½ÐµÑÑƒÐ¼Ñ–ÑÐ½Ñ–.\n\n6. Ð¯ÐºÐ° Ñ„Ð¾Ñ€Ð¼Ð° Ð¿Ñ€Ð°Ð²Ð¸Ð»ÑŒÐ½Ð° Ð´Ð»Ñ Ð²Ð¸Ñ€Ð°Ð¶ÐµÐ½Ð½Ñ Ð·Ð°Ð²ÐµÑ€ÑˆÐµÐ½Ð¾Ñ— Ð´Ñ–Ñ— Ð² Ð¼Ð¸Ð½ÑƒÐ»Ð¾Ð¼Ñƒ Ð±ÐµÐ· Ð²ÐºÐ°Ð·Ñ–Ð²ÐºÐ¸ Ð½Ð° Ð²Ð¸ÐºÐ¾Ð½Ð°Ð²Ñ†Ñ?\n   - [ ] Ð‘ÑƒÐ´Ð¸Ð½Ð¾Ðº Ð±ÑƒÐ´ÑƒÐ²Ð°Ð²ÑÑ Ð¿Ñ€Ð¾Ñ‚ÑÐ³Ð¾Ð¼ Ñ‚Ñ€ÑŒÐ¾Ñ… Ñ€Ð¾ÐºÑ–Ð²\n   - [ ] Ð‘ÑƒÐ´Ð¸Ð½Ð¾Ðº Ð±ÑƒÐ´ÑƒÑ”Ñ‚ÑŒÑÑ Ð²Ð¶Ðµ Ð´Ð¾Ð²Ð³Ð¸Ð¹ Ñ‡Ð°Ñ\n   - [x] Ð‘ÑƒÐ´Ð¸Ð½Ð¾Ðº Ð·Ð±ÑƒÐ´Ð¾Ð²Ð°Ð½Ð¾ Ð¼Ð¸Ð½ÑƒÐ»Ð¾Ð³Ð¾ Ñ€Ð¾ÐºÑƒ ÑƒÑÐ¿Ñ–ÑˆÐ½Ð¾\n   - [ ] Ð‘ÑƒÐ´Ð¸Ð½Ð¾Ðº Ð±ÑƒÐ´Ð¾Ð²Ð°Ð½Ð¸Ð¹ Ð¿Ñ€Ð¾Ñ‚ÑÐ³Ð¾Ð¼ Ð±Ð°Ð³Ð°Ñ‚ÑŒÐ¾Ñ… Ñ€Ð¾ÐºÑ–Ð²\n   > ÐšÐ¾Ñ€Ð¾Ñ‚ÐºÐ¸Ð¹ Ð¿Ð°ÑÐ¸Ð² Â«Ð·Ð±ÑƒÐ´Ð¾Ð²Ð°Ð½Ð¾Â» Ð¿Ñ–Ð´ÐºÑ€ÐµÑÐ»ÑŽÑ” Ð·Ð°Ð²ÐµÑ€ÑˆÐµÐ½Ð¸Ð¹ Ñ€ÐµÐ·ÑƒÐ»ÑŒÑ‚Ð°Ñ‚.\n\n7. Ð¯ÐºÐµ Ñ€ÐµÑ‡ÐµÐ½Ð½Ñ Ð¿Ñ€Ð°Ð²Ð¸Ð»ÑŒÐ½Ð¾ Ð²Ð¸ÐºÐ¾Ñ€Ð¸ÑÑ‚Ð¾Ð²ÑƒÑ” Ð·Ð²Ð¾Ñ€Ð¾Ñ‚Ð½Ð¸Ð¹ Ð¿Ð°ÑÐ¸Ð² Ð´Ð»Ñ Ð¾Ð¿Ð¸ÑÑƒ Ñ€ÐµÐ³ÑƒÐ»ÑÑ€Ð½Ð¾Ð³Ð¾ Ð¿Ñ€Ð¾Ñ†ÐµÑÑƒ Ð² Ñ‰Ð¾Ð´ÐµÐ½Ð½Ð¾Ð¼Ñƒ Ð¶Ð¸Ñ‚Ñ‚Ñ–?\n   - [ ] Ð¥Ð»Ñ–Ð± Ð²Ð¸Ð¿ÐµÑ‡ÐµÐ½Ð¾ ÐºÐ¾Ð¶Ð½Ð¾Ð³Ð¾ Ñ€Ð°Ð½ÐºÑƒ Ð² Ð¿ÐµÐºÐ°Ñ€Ð½Ñ–\n   - [x] Ð¥Ð»Ñ–Ð± Ð²Ð¸Ð¿Ñ–ÐºÐ°Ñ”Ñ‚ÑŒÑÑ Ñ‰Ð¾Ñ€Ð°Ð½ÐºÑƒ Ð¾ Ð¿'ÑÑ‚Ñ–Ð¹ Ð³Ð¾Ð´Ð¸Ð½Ñ–\n   - [ ] Ð¥Ð»Ñ–Ð± Ð²Ð¸Ð¿ÐµÑ‡ÐµÐ½Ð¸Ð¹ Ð¿ÐµÐºÐ°Ñ€ÐµÐ¼ Ñ‰Ð¾Ñ€Ð°Ð½ÐºÑƒ Ð²Ñ‡Ð°ÑÐ½Ð¾\n   - [ ] Ð¥Ð»Ñ–Ð± Ð²Ð¸Ð¿Ñ–ÐºÐ°Ð½Ð¾ Ð¿Ñ€Ð¾Ñ‚ÑÐ³Ð¾Ð¼ Ð±Ð°Ð³Ð°Ñ‚ÑŒÐ¾Ñ… ÑÑ‚Ð¾Ð»Ñ–Ñ‚ÑŒ\n   > Â«Ð’Ð¸Ð¿Ñ–ÐºÐ°Ñ”Ñ‚ÑŒÑÑ Ñ‰Ð¾Ñ€Ð°Ð½ÐºÑƒÂ» â€” Ñ€ÐµÐ³ÑƒÐ»ÑÑ€Ð½Ð¸Ð¹ Ð¿Ñ€Ð¾Ñ†ÐµÑ, Ð·Ð²Ð¾Ñ€Ð¾Ñ‚Ð½Ð¸Ð¹ Ð¿Ð°ÑÐ¸Ð².\n\n8. Ð¯ÐºÐ° Ñ‚Ñ€Ð°Ð½ÑÑ„Ð¾Ñ€Ð¼Ð°Ñ†Ñ–Ñ Ð°ÐºÑ‚Ð¸Ð²Ð½Ð¾Ð³Ð¾ Ñ€ÐµÑ‡ÐµÐ½Ð½Ñ Â«Ð¡Ñ‚ÑƒÐ´ÐµÐ½Ñ‚Ð¸ Ð½Ð°Ð¿Ð¸ÑÐ°Ð»Ð¸ ÐµÑÐµÂ» Ð² Ð¿Ð°ÑÐ¸Ð²Ð½Ðµ Ñ” Ð³Ñ€Ð°Ð¼Ð°Ñ‚Ð¸Ñ‡Ð½Ð¾ Ð¿Ñ€Ð°Ð²Ð¸Ð»ÑŒÐ½Ð¾ÑŽ?\n   - [ ] Ð¡Ñ‚ÑƒÐ´ÐµÐ½Ñ‚Ð¸ Ð½Ð°Ð¿Ð¸ÑÐ°Ð»Ð¸ ÐµÑÐµ â†’ Ð•ÑÐµ Ð½Ð°Ð¿Ð¸ÑÐ°Ð»Ð¾ÑÑ ÑÑ‚ÑƒÐ´ÐµÐ½Ñ‚Ð°Ð¼Ð¸\n   - [x] Ð¡Ñ‚ÑƒÐ´ÐµÐ½Ñ‚Ð¸ Ð½Ð°Ð¿Ð¸ÑÐ°Ð»Ð¸ ÐµÑÐµ â†’ Ð•ÑÐµ Ð½Ð°Ð¿Ð¸ÑÐ°Ð½Ðµ ÑÑ‚ÑƒÐ´ÐµÐ½Ñ‚Ð°Ð¼Ð¸\n   - [ ] Ð¡Ñ‚ÑƒÐ´ÐµÐ½Ñ‚Ð¸ Ð½Ð°Ð¿Ð¸ÑÐ°Ð»Ð¸ ÐµÑÐµ â†’ Ð•ÑÐµ Ð½Ð°Ð¿Ð¸ÑÐ°Ð»Ð¸ÑÑŒ ÑÑ‚ÑƒÐ´ÐµÐ½Ñ‚Ð°Ð¼Ð¸\n   - [ ] Ð¡Ñ‚ÑƒÐ´ÐµÐ½Ñ‚Ð¸ Ð½Ð°Ð¿Ð¸ÑÐ°Ð»Ð¸ ÐµÑÐµ â†’ Ð•ÑÐµ Ð½Ð°Ð¿Ð¸ÑÐ°Ð½Ð¸Ð¹ ÑÑ‚ÑƒÐ´ÐµÐ½Ñ‚Ð°Ð¼Ð¸\n   > ÐŸÐ¾Ð²Ð½Ð¸Ð¹ Ð¿Ð°ÑÐ¸Ð²: Â«ÐµÑÐµÂ» (Ñ.Ñ€.) â†’ Â«Ð½Ð°Ð¿Ð¸ÑÐ°Ð½ÐµÂ» (Ñ.Ñ€.) + Ð¾Ñ€ÑƒÐ´Ð½Ð¸Ð¹ Ð²Ñ–Ð´Ð¼Ñ–Ð½Ð¾Ðº.\n\n## match-up: ÐÐºÑ‚Ð¸Ð²Ð½Ð¸Ð¹ Ñ– Ð¿Ð°ÑÐ¸Ð²Ð½Ð¸Ð¹ ÑÑ‚Ð°Ð½\n> ÐŸÐ¾Ñ”Ð´Ð½Ð°Ð¹Ñ‚Ðµ Ð°ÐºÑ‚Ð¸Ð²Ð½Ðµ Ñ€ÐµÑ‡ÐµÐ½Ð½Ñ Ð· Ð¿Ñ€Ð°Ð²Ð¸Ð»ÑŒÐ½Ð¾ÑŽ Ð¿Ð°ÑÐ¸Ð²Ð½Ð¾ÑŽ Ñ„Ð¾Ñ€Ð¼Ð¾ÑŽ.\n\n| ÐÐºÑ‚Ð¸Ð²Ð½Ðµ Ñ€ÐµÑ‡ÐµÐ½Ð½Ñ | ÐŸÐ°ÑÐ¸Ð²Ð½Ðµ Ñ€ÐµÑ‡ÐµÐ½Ð½Ñ |\n|-----------------|-----------------|\n| ÐÐ²Ñ‚Ð¾Ñ€ Ð½Ð°Ð¿Ð¸ÑÐ°Ð² Ñ€Ð¾Ð¼Ð°Ð½. | Ð Ð¾Ð¼Ð°Ð½ Ð½Ð°Ð¿Ð¸ÑÐ°Ð½Ð¸Ð¹ Ð°Ð²Ñ‚Ð¾Ñ€Ð¾Ð¼. |\n| ÐšÐ¾Ð¼Ñ–ÑÑ–Ñ Ð¿Ñ€Ð¸Ð¹Ð½ÑÐ»Ð° Ñ€Ñ–ÑˆÐµÐ½Ð½Ñ. | Ð Ñ–ÑˆÐµÐ½Ð½Ñ Ð¿Ñ€Ð¸Ð¹Ð½ÑÑ‚Ðµ ÐºÐ¾Ð¼Ñ–ÑÑ–Ñ”ÑŽ. |\n| Ð¥Ñ‚Ð¾ÑÑŒ Ð²Ñ–Ð´ÐºÑ€Ð¸Ð² Ð´Ð²ÐµÑ€Ñ–. | Ð”Ð²ÐµÑ€Ñ– Ð²Ñ–Ð´ÐºÑ€Ð¸Ñ‚Ð¾. |\n| Ð Ð¾Ð±Ñ–Ñ‚Ð½Ð¸ÐºÐ¸ Ð±ÑƒÐ´ÑƒÑŽÑ‚ÑŒ Ð¼Ñ–ÑÑ‚. | ÐœÑ–ÑÑ‚ Ð±ÑƒÐ´ÑƒÑ”Ñ‚ÑŒÑÑ. |\n| ÐŸÐµÐºÐ°Ñ€ Ð²Ð¸Ð¿Ñ–ÐºÐ°Ñ” Ñ…Ð»Ñ–Ð±. | Ð¥Ð»Ñ–Ð± Ð²Ð¸Ð¿Ñ–ÐºÐ°Ñ”Ñ‚ÑŒÑÑ. |\n| Ð”Ð¸Ñ€ÐµÐºÑ‚Ð¾Ñ€ Ð¿Ñ–Ð´Ð¿Ð¸ÑÐ°Ð² ÐºÐ¾Ð½Ñ‚Ñ€Ð°ÐºÑ‚. | ÐšÐ¾Ð½Ñ‚Ñ€Ð°ÐºÑ‚ Ð¿Ñ–Ð´Ð¿Ð¸ÑÐ°Ð½Ð¸Ð¹ Ð´Ð¸Ñ€ÐµÐºÑ‚Ð¾Ñ€Ð¾Ð¼. |\n| Ð¥Ñ‚Ð¾ÑÑŒ Ð²Ð¸ÐºÐ¾Ð½Ð°Ð² Ñ€Ð¾Ð±Ð¾Ñ‚Ñƒ. | Ð Ð¾Ð±Ð¾Ñ‚Ñƒ Ð²Ð¸ÐºÐ¾Ð½Ð°Ð½Ð¾. |\n| Ð’Ñ‡ÐµÐ½Ñ– Ð´Ð¾ÑÐ»Ñ–Ð´Ð¶ÑƒÑŽÑ‚ÑŒ Ð¿Ñ€Ð¾Ð±Ð»ÐµÐ¼Ñƒ. | ÐŸÑ€Ð¾Ð±Ð»ÐµÐ¼Ð° Ð´Ð¾ÑÐ»Ñ–Ð´Ð¶ÑƒÑ”Ñ‚ÑŒÑÑ. |\n| Ð¥ÑƒÐ´Ð¾Ð¶Ð½Ð¸Ðº Ð½Ð°Ð¼Ð°Ð»ÑŽÐ²Ð°Ð² ÐºÐ°Ñ€Ñ‚Ð¸Ð½Ñƒ. | ÐšÐ°Ñ€Ñ‚Ð¸Ð½Ð° Ð½Ð°Ð¼Ð°Ð»ÑŒÐ¾Ð²Ð°Ð½Ð° Ñ…ÑƒÐ´Ð¾Ð¶Ð½Ð¸ÐºÐ¾Ð¼. |\n| Ð¥Ñ‚Ð¾ÑÑŒ Ð½Ð°Ð´Ñ–ÑÐ»Ð°Ð² Ð»Ð¸ÑÑ‚Ð°. | Ð›Ð¸ÑÑ‚Ð° Ð½Ð°Ð´Ñ–ÑÐ»Ð°Ð½Ð¾. |\n| Ð¡Ñ‚ÑƒÐ´ÐµÐ½Ñ‚Ð¸ Ð³Ð¾Ñ‚ÑƒÑŽÑ‚ÑŒ Ð¿Ñ€Ð¾ÐµÐºÑ‚. | ÐŸÑ€Ð¾ÐµÐºÑ‚ Ð³Ð¾Ñ‚ÑƒÑ”Ñ‚ÑŒÑÑ. |\n| Ð–ÑƒÑ€Ñ– Ð²Ð¸Ð·Ð½Ð°Ñ‡Ð¸Ð»Ð¾ Ð¿ÐµÑ€ÐµÐ¼Ð¾Ð¶Ñ†Ñ. | ÐŸÐµÑ€ÐµÐ¼Ð¾Ð¶Ñ†Ñ Ð²Ð¸Ð·Ð½Ð°Ñ‡ÐµÐ½Ð¾. |\n\n## fill-in: Ð’Ð¸Ð±ÐµÑ€Ñ–Ñ‚ÑŒ Ð¿Ñ€Ð°Ð²Ð¸Ð»ÑŒÐ½Ñƒ Ñ„Ð¾Ñ€Ð¼Ñƒ\n> Ð—Ð°Ð¿Ð¾Ð²Ð½Ñ–Ñ‚ÑŒ Ð¿Ñ€Ð¾Ð¿ÑƒÑÐºÐ¸ Ð¿Ñ€Ð°Ð²Ð¸Ð»ÑŒÐ½Ð¾ÑŽ Ð¿Ð°ÑÐ¸Ð²Ð½Ð¾ÑŽ ÐºÐ¾Ð½ÑÑ‚Ñ€ÑƒÐºÑ†Ñ–Ñ”ÑŽ.\n\n1. ÐšÐ½Ð¸Ð³Ð° ___ Ð²Ñ–Ð´Ð¾Ð¼Ð¸Ð¼ Ð¿Ð¸ÑÑŒÐ¼ÐµÐ½Ð½Ð¸ÐºÐ¾Ð¼ Ð¼Ð¸Ð½ÑƒÐ»Ð¾Ð³Ð¾ ÑÑ‚Ð¾Ð»Ñ–Ñ‚Ñ‚Ñ. (Ð½Ð°Ð¿Ð¸ÑÐ°Ð½Ð° / Ð½Ð°Ð¿Ð¸ÑÐ°Ð½Ð¾ / Ð¿Ð¸ÑˆÐµÑ‚ÑŒÑÑ)\n   > [!answer] Ð½Ð°Ð¿Ð¸ÑÐ°Ð½Ð°\n   > [!options] Ð½Ð°Ð¿Ð¸ÑÐ°Ð½Ð° | Ð½Ð°Ð¿Ð¸ÑÐ°Ð½Ð¾ | Ð¿Ð¸ÑˆÐµÑ‚ÑŒÑÑ | Ð¿Ð¸ÑÐ°Ð»Ð°ÑÑ\n\n2. Ð Ñ–ÑˆÐµÐ½Ð½Ñ ___ Ð¾Ð´Ð½Ð¾Ð³Ð¾Ð»Ð¾ÑÐ½Ð¾ Ð½Ð° Ð·Ð°ÑÑ–Ð´Ð°Ð½Ð½Ñ– ÐºÐ¾Ð¼Ñ–ÑÑ–Ñ—. (Ð¿Ñ€Ð¸Ð¹Ð½ÑÑ‚Ð¾ / Ð¿Ñ€Ð¸Ð¹Ð½ÑÑ‚Ðµ / Ð¿Ñ€Ð¸Ð¹Ð¼Ð°Ñ”Ñ‚ÑŒÑÑ)\n   > [!answer] Ð¿Ñ€Ð¸Ð¹Ð½ÑÑ‚Ð¾\n   > [!options] Ð¿Ñ€Ð¸Ð¹Ð½ÑÑ‚Ð¾ | Ð¿Ñ€Ð¸Ð¹Ð½ÑÑ‚Ðµ | Ð¿Ñ€Ð¸Ð¹Ð¼Ð°Ñ”Ñ‚ÑŒÑÑ | Ð¿Ñ€Ð¸Ð¹Ð½ÑÑ‚Ð¸Ð¹\n\n3. Ð¥Ð»Ñ–Ð± ___ Ñ‰Ð¾Ñ€Ð°Ð½ÐºÑƒ Ð¾ Ð¿'ÑÑ‚Ñ–Ð¹ Ð³Ð¾Ð´Ð¸Ð½Ñ–. (Ð²Ð¸Ð¿ÐµÑ‡ÐµÐ½Ð¾ / Ð²Ð¸Ð¿ÐµÑ‡ÐµÐ½Ð¸Ð¹ / Ð²Ð¸Ð¿Ñ–ÐºÐ°Ñ”Ñ‚ÑŒÑÑ)\n   > [!answer] Ð²Ð¸Ð¿Ñ–ÐºÐ°Ñ”Ñ‚ÑŒÑÑ\n   > [!options] Ð²Ð¸Ð¿Ñ–ÐºÐ°Ñ”Ñ‚ÑŒÑÑ | Ð²Ð¸Ð¿ÐµÑ‡ÐµÐ½Ð¾ | Ð²Ð¸Ð¿ÐµÑ‡ÐµÐ½Ð¸Ð¹ | Ð²Ð¸Ð¿ÐµÑ‡ÐµÐ½Ð°\n\n4. Ð”Ð¾ÐºÑƒÐ¼ÐµÐ½Ñ‚Ð¸ ___ ÑÐµÐºÑ€ÐµÑ‚Ð°Ñ€ÐµÐ¼ Ñ– Ð½Ð°Ð´Ñ–ÑÐ»Ð°Ð½Ñ– Ð´Ð¸Ñ€ÐµÐºÑ‚Ð¾Ñ€Ñƒ. (Ð¿Ñ–Ð´Ð³Ð¾Ñ‚Ð¾Ð²Ð»ÐµÐ½Ð¾ / Ð¿Ñ–Ð´Ð³Ð¾Ñ‚Ð¾Ð²Ð»ÐµÐ½Ñ– / Ð³Ð¾Ñ‚ÑƒÑŽÑ‚ÑŒÑÑ)\n   > [!answer] Ð¿Ñ–Ð´Ð³Ð¾Ñ‚Ð¾Ð²Ð»ÐµÐ½Ñ–\n   > [!options] Ð¿Ñ–Ð´Ð³Ð¾Ñ‚Ð¾Ð²Ð»ÐµÐ½Ñ– | Ð¿Ñ–Ð´Ð³Ð¾Ñ‚Ð¾Ð²Ð»ÐµÐ½Ð¾ | Ð³Ð¾Ñ‚ÑƒÑŽÑ‚ÑŒÑÑ | Ð³Ð¾Ñ‚ÑƒÐ²Ð°Ð»Ð¸ÑÑ\n\n5. Ð—Ð°Ñ€Ð°Ð· ___ Ð½Ð¾Ð²Ð¸Ð¹ Ð¼Ñ–ÑÑ‚ Ñ‡ÐµÑ€ÐµÐ· Ñ€Ñ–Ñ‡ÐºÑƒ. (Ð·Ð±ÑƒÐ´Ð¾Ð²Ð°Ð½Ð¾ / Ð·Ð±ÑƒÐ´Ð¾Ð²Ð°Ð½Ð¸Ð¹ / Ð±ÑƒÐ´ÑƒÑ”Ñ‚ÑŒÑÑ)\n   > [!answer] Ð±ÑƒÐ´ÑƒÑ”Ñ‚ÑŒÑÑ\n   > [!options] Ð±ÑƒÐ´ÑƒÑ”Ñ‚ÑŒÑÑ | Ð·Ð±ÑƒÐ´Ð¾Ð²Ð°Ð½Ð¾ | Ð·Ð±ÑƒÐ´Ð¾Ð²Ð°Ð½Ð¸Ð¹ | Ð±ÑƒÐ´ÑƒÐ²Ð°Ð²ÑÑ\n\n6. Ð£ÑÑ– ÐºÐ²Ð¸Ñ‚ÐºÐ¸ ___ Ñ‰Ðµ Ð¼Ð¸Ð½ÑƒÐ»Ð¾Ð³Ð¾ Ñ‚Ð¸Ð¶Ð½Ñ. (Ð¿Ñ€Ð¾Ð´Ð°Ð½Ð¾ / Ð¿Ñ€Ð¾Ð´Ð°Ð½Ñ– / Ð¿Ñ€Ð¾Ð´Ð°ÑŽÑ‚ÑŒÑÑ)\n   > [!answer] Ð¿Ñ€Ð¾Ð´Ð°Ð½Ð¾\n   > [!options] Ð¿Ñ€Ð¾Ð´Ð°Ð½Ð¾ | Ð¿Ñ€Ð¾Ð´Ð°Ð½Ñ– | Ð¿Ñ€Ð¾Ð´Ð°ÑŽÑ‚ÑŒÑÑ | Ð¿Ñ€Ð¾Ð´Ð°Ð²Ð°Ð»Ð¸ÑÑ\n\n7. Ð¦Ñ ÑÑ‚Ñ€Ð°Ð²Ð° ___ Ð· ÑÐ²Ñ–Ð¶Ð¸Ñ… Ð¼Ñ–ÑÑ†ÐµÐ²Ð¸Ñ… Ñ–Ð½Ð³Ñ€ÐµÐ´Ñ–Ñ”Ð½Ñ‚Ñ–Ð². (Ð¿Ñ€Ð¸Ð³Ð¾Ñ‚Ð¾Ð²Ð»ÐµÐ½Ð¾ / Ð¿Ñ€Ð¸Ð³Ð¾Ñ‚Ð¾Ð²Ð»ÐµÐ½Ð° / Ð³Ð¾Ñ‚ÑƒÑ”Ñ‚ÑŒÑÑ)\n   > [!answer] Ð³Ð¾Ñ‚ÑƒÑ”Ñ‚ÑŒÑÑ\n   > [!options] Ð³Ð¾Ñ‚ÑƒÑ”Ñ‚ÑŒÑÑ | Ð¿Ñ€Ð¸Ð³Ð¾Ñ‚Ð¾Ð²Ð»ÐµÐ½Ð¾ | Ð¿Ñ€Ð¸Ð³Ð¾Ñ‚Ð¾Ð²Ð»ÐµÐ½Ð° | Ð³Ð¾Ñ‚ÑƒÐ²Ð°Ð»Ð°ÑÑ\n\n8. Ð—Ð²Ñ–Ñ‚ ___ Ð°Ð½Ð°Ð»Ñ–Ñ‚Ð¸ÐºÐ°Ð¼Ð¸ Ñ‚Ð° Ð¿Ð¾Ð´Ð°Ð½Ð¾ ÐºÐµÑ€Ñ–Ð²Ð½Ð¸Ñ†Ñ‚Ð²Ñƒ. (Ð¿Ñ–Ð´Ð³Ð¾Ñ‚Ð¾Ð²Ð»ÐµÐ½Ð¾ / Ð¿Ñ–Ð´Ð³Ð¾Ñ‚Ð¾Ð²Ð»ÐµÐ½Ð¸Ð¹ / Ð³Ð¾Ñ‚ÑƒÑ”Ñ‚ÑŒÑÑ)\n   > [!answer] Ð¿Ñ–Ð´Ð³Ð¾Ñ‚Ð¾Ð²Ð»ÐµÐ½Ð¸Ð¹\n   > [!options] Ð¿Ñ–Ð´Ð³Ð¾Ñ‚Ð¾Ð²Ð»ÐµÐ½Ð¸Ð¹ | Ð¿Ñ–Ð´Ð³Ð¾Ñ‚Ð¾Ð²Ð»ÐµÐ½Ð¾ | Ð³Ð¾Ñ‚ÑƒÑ”Ñ‚ÑŒÑÑ | Ð³Ð¾Ñ‚ÑƒÐ²Ð°Ð²ÑÑ\n\n## true-false: ÐŸÑ€Ð°Ð²Ð¸Ð»Ð° Ð¿Ð°ÑÐ¸Ð²Ð½Ð¸Ñ… ÐºÐ¾Ð½ÑÑ‚Ñ€ÑƒÐºÑ†Ñ–Ð¹\n> Ð’Ð¸Ð·Ð½Ð°Ñ‡Ñ‚Ðµ, Ñ‡Ð¸ Ð¿Ñ€Ð°Ð²Ð¸Ð»ÑŒÐ½Ðµ ÐºÐ¾Ð¶Ð½Ðµ Ñ‚Ð²ÐµÑ€Ð´Ð¶ÐµÐ½Ð½Ñ.\n\n- [x] ÐŸÐ¾Ð²Ð½Ð¸Ð¹ Ð¿Ð°ÑÐ¸Ð² Ð²Ð¸Ð¼Ð°Ð³Ð°Ñ” ÑƒÐ·Ð³Ð¾Ð´Ð¶ÐµÐ½Ð½Ñ Ð´Ñ–Ñ”Ð¿Ñ€Ð¸ÐºÐ¼ÐµÑ‚Ð½Ð¸ÐºÐ° Ð· Ð¿Ñ–Ð´Ð¼ÐµÑ‚Ð¾Ð¼ Ñƒ Ñ€Ð¾Ð´Ñ– Ñ‚Ð° Ñ‡Ð¸ÑÐ»Ñ–.\n  > ÐŸÑ€Ð°Ð²Ð¸Ð»ÑŒÐ½Ð¾! ÐšÐ½Ð¸Ð³Ð° Ð½Ð°Ð¿Ð¸ÑÐ°Ð½Ð°, Ð»Ð¸ÑÑ‚ Ð½Ð°Ð¿Ð¸ÑÐ°Ð½Ð¸Ð¹, Ñ€ÐµÑ‡ÐµÐ½Ð½Ñ Ð½Ð°Ð¿Ð¸ÑÐ°Ð½Ðµ.\n\n- [ ] Ð—Ð²Ð¾Ñ€Ð¾Ñ‚Ð½Ð¸Ð¹ Ð¿Ð°ÑÐ¸Ð² Ð· -ÑÑ Ð·Ð°Ð²Ð¶Ð´Ð¸ Ð²ÐºÐ°Ð·ÑƒÑ” Ð½Ð° Ð²Ð¸ÐºÐ¾Ð½Ð°Ð²Ñ†Ñ Ð´Ñ–Ñ— Ð² Ð¾Ñ€ÑƒÐ´Ð½Ð¾Ð¼Ñƒ Ð²Ñ–Ð´Ð¼Ñ–Ð½ÐºÑƒ.\n  > ÐÐµÐ¿Ñ€Ð°Ð²Ð¸Ð»ÑŒÐ½Ð¾! Ð—Ð²Ð¾Ñ€Ð¾Ñ‚Ð½Ð¸Ð¹ Ð¿Ð°ÑÐ¸Ð² Ð·Ð°Ð·Ð²Ð¸Ñ‡Ð°Ð¹ Ð½Ðµ Ð¿Ð¾Ñ‚Ñ€ÐµÐ±ÑƒÑ” Ð²ÐºÐ°Ð·Ñ–Ð²ÐºÐ¸ Ð½Ð° Ð²Ð¸ÐºÐ¾Ð½Ð°Ð²Ñ†Ñ.\n\n- [x] ÐšÐ¾Ñ€Ð¾Ñ‚ÐºÐ¸Ð¹ Ð¿Ð°ÑÐ¸Ð² (-Ð½Ð¾/-Ñ‚Ð¾) Ð²Ð¸Ð¼Ð°Ð³Ð°Ñ” Ð´Ð¾Ð´Ð°Ñ‚ÐºÐ° Ñƒ Ð·Ð½Ð°Ñ…Ñ–Ð´Ð½Ð¾Ð¼Ñƒ Ð²Ñ–Ð´Ð¼Ñ–Ð½ÐºÑƒ.\n  > ÐŸÑ€Ð°Ð²Ð¸Ð»ÑŒÐ½Ð¾! Â«ÐšÐ½Ð¸Ð³Ñƒ Ð½Ð°Ð¿Ð¸ÑÐ°Ð½Ð¾Â», Â«Ð›Ð¸ÑÑ‚Ð° Ð²Ñ–Ð´Ð¿Ñ€Ð°Ð²Ð»ÐµÐ½Ð¾Â».\n\n- [ ] Ð—Ð²Ð¾Ñ€Ð¾Ñ‚Ð½Ð¸Ð¹ Ð¿Ð°ÑÐ¸Ð² Ð¼Ð¾Ð¶Ð½Ð° Ð²Ð¸ÐºÐ¾Ñ€Ð¸ÑÑ‚Ð¾Ð²ÑƒÐ²Ð°Ñ‚Ð¸ Ð´Ð»Ñ Ð¾Ð¿Ð¸ÑÑƒ Ð·Ð°Ð²ÐµÑ€ÑˆÐµÐ½Ð¸Ñ… Ð´Ñ–Ð¹ Ñƒ Ð¼Ð¸Ð½ÑƒÐ»Ð¾Ð¼Ñƒ.\n  > ÐÐµÐ¿Ñ€Ð°Ð²Ð¸Ð»ÑŒÐ½Ð¾! Ð—Ð²Ð¾Ñ€Ð¾Ñ‚Ð½Ð¸Ð¹ Ð¿Ð°ÑÐ¸Ð² Ð¿Ñ–Ð´ÐºÑ€ÐµÑÐ»ÑŽÑ” Ð¿Ñ€Ð¾Ñ†ÐµÑ, Ð½Ðµ Ð·Ð°Ð²ÐµÑ€ÑˆÐµÐ½Ñ–ÑÑ‚ÑŒ.\n\n- [x] Ð”Ð»Ñ Ð²Ð¸Ñ€Ð°Ð¶ÐµÐ½Ð½Ñ Ð¼Ð°Ð¹Ð±ÑƒÑ‚Ð½ÑŒÐ¾Ð³Ð¾ Ñ‡Ð°ÑÑƒ Ð² ÐºÐ¾Ñ€Ð¾Ñ‚ÐºÐ¾Ð¼Ñƒ Ð¿Ð°ÑÐ¸Ð²Ñ– Ð²Ð¸ÐºÐ¾Ñ€Ð¸ÑÑ‚Ð¾Ð²ÑƒÑ”Ñ‚ÑŒÑÑ Â«Ð±ÑƒÐ´ÐµÂ».\n  > ÐŸÑ€Ð°Ð²Ð¸Ð»ÑŒÐ½Ð¾! Â«Ð Ñ–ÑˆÐµÐ½Ð½Ñ Ð±ÑƒÐ´Ðµ Ð¿Ñ€Ð¸Ð¹Ð½ÑÑ‚Ð¾ Ð·Ð°Ð²Ñ‚Ñ€Ð°.Â»\n\n- [ ] Â«Ð‘ÑƒÐ´Ð¸Ð½Ð¾Ðº Ð±ÑƒÐ´ÑƒÑ”Ñ‚ÑŒÑÑ Ñ€Ð¾Ð±Ñ–Ñ‚Ð½Ð¸ÐºÐ°Ð¼Ð¸Â» â€” Ñ‚Ð¸Ð¿Ð¾Ð²Ð° ÐºÐ¾Ð½ÑÑ‚Ñ€ÑƒÐºÑ†Ñ–Ñ Ð·Ð²Ð¾Ñ€Ð¾Ñ‚Ð½Ð¾Ð³Ð¾ Ð¿Ð°ÑÐ¸Ð²Ñƒ.\n  > ÐÐµÐ¿Ñ€Ð°Ð²Ð¸Ð»ÑŒÐ½Ð¾! Ð—Ð²Ð¾Ñ€Ð¾Ñ‚Ð½Ð¸Ð¹ Ð¿Ð°ÑÐ¸Ð² Ñ€Ñ–Ð´ÐºÐ¾ Ð²Ð¸ÐºÐ¾Ñ€Ð¸ÑÑ‚Ð¾Ð²ÑƒÑ”Ñ‚ÑŒÑÑ Ð· Ð²Ð¸ÐºÐ¾Ð½Ð°Ð²Ñ†ÐµÐ¼.\n\n- [x] ÐŸÐ¾Ð²Ð½Ð¸Ð¹ Ð¿Ð°ÑÐ¸Ð² Ð½Ð°Ð¹ÐºÑ€Ð°Ñ‰Ðµ Ð¿Ñ–Ð´Ñ…Ð¾Ð´Ð¸Ñ‚ÑŒ, ÐºÐ¾Ð»Ð¸ Ð¿Ð¾Ñ‚Ñ€Ñ–Ð±Ð½Ð¾ Ð¿Ñ–Ð´ÐºÑ€ÐµÑÐ»Ð¸Ñ‚Ð¸ Ð²Ð¸ÐºÐ¾Ð½Ð°Ð²Ñ†Ñ Ð´Ñ–Ñ—.\n  > ÐŸÑ€Ð°Ð²Ð¸Ð»ÑŒÐ½Ð¾! Â«ÐšÐ½Ð¸Ð³Ð° Ð½Ð°Ð¿Ð¸ÑÐ°Ð½Ð° Ð¿Ð¸ÑÑŒÐ¼ÐµÐ½Ð½Ð¸ÐºÐ¾Ð¼Â» â€” Ð°ÐºÑ†ÐµÐ½Ñ‚ Ð½Ð° Ð°Ð²Ñ‚Ð¾Ñ€Ñ–.\n\n- [ ] Ð£ÑÑ– Ñ‚Ñ€Ð¸ Ñ‚Ð¸Ð¿Ð¸ Ð¿Ð°ÑÐ¸Ð²Ñƒ Ð¼Ð¾Ð¶ÑƒÑ‚ÑŒ Ð²Ð·Ð°Ñ”Ð¼Ð¾Ð·Ð°Ð¼Ñ–Ð½Ð½Ð¾ Ð²Ð¸ÐºÐ¾Ñ€Ð¸ÑÑ‚Ð¾Ð²ÑƒÐ²Ð°Ñ‚Ð¸ÑÑ Ð² Ð±ÑƒÐ´ÑŒ-ÑÐºÐ¾Ð¼Ñƒ ÐºÐ¾Ð½Ñ‚ÐµÐºÑÑ‚Ñ–.\n  > ÐÐµÐ¿Ñ€Ð°Ð²Ð¸Ð»ÑŒÐ½Ð¾! ÐšÐ¾Ð¶ÐµÐ½ Ñ‚Ð¸Ð¿ Ð¼Ð°Ñ” ÑÐ²Ð¾ÑŽ ÑÑ‚Ð¸Ð»Ñ–ÑÑ‚Ð¸Ñ‡Ð½Ñƒ Ñ„ÑƒÐ½ÐºÑ†Ñ–ÑŽ.\n\n## group-sort: Ð¢Ð¸Ð¿ Ð¿Ð°ÑÐ¸Ð²Ð½Ð¾Ñ— ÐºÐ¾Ð½ÑÑ‚Ñ€ÑƒÐºÑ†Ñ–Ñ—\n> Ð Ð¾Ð·Ð¿Ð¾Ð´Ñ–Ð»Ñ–Ñ‚ÑŒ Ñ€ÐµÑ‡ÐµÐ½Ð½Ñ Ð·Ð° Ñ‚Ð¸Ð¿Ð¾Ð¼ Ð¿Ð°ÑÐ¸Ð²Ð½Ð¾Ñ— ÐºÐ¾Ð½ÑÑ‚Ñ€ÑƒÐºÑ†Ñ–Ñ—.\n\n### ÐŸÐ¾Ð²Ð½Ð¸Ð¹ Ð¿Ð°ÑÐ¸Ð² (Ð· Ð´Ñ–Ñ”Ð¿Ñ€Ð¸ÐºÐ¼ÐµÑ‚Ð½Ð¸ÐºÐ¾Ð¼)\n- ÐšÐ½Ð¸Ð³Ð° Ð½Ð°Ð¿Ð¸ÑÐ°Ð½Ð° Ð²Ñ–Ð´Ð¾Ð¼Ð¸Ð¼ Ð°Ð²Ñ‚Ð¾Ñ€Ð¾Ð¼.\n- ÐšÐ°Ñ€Ñ‚Ð¸Ð½Ð° Ð½Ð°Ð¼Ð°Ð»ÑŒÐ¾Ð²Ð°Ð½Ð° Ñ…ÑƒÐ´Ð¾Ð¶Ð½Ð¸ÐºÐ¾Ð¼.\n- Ð Ð¾Ð±Ð¾Ñ‚Ð° Ð²Ð¸ÐºÐ¾Ð½Ð°Ð½Ð° ÑÑ‚ÑƒÐ´ÐµÐ½Ñ‚Ð°Ð¼Ð¸.\n- Ð£Ð³Ð¾Ð´Ð° Ð¿Ñ–Ð´Ð¿Ð¸ÑÐ°Ð½Ð° Ð¼Ñ–Ð½Ñ–ÑÑ‚Ñ€Ð°Ð¼Ð¸.\n- ÐŸÑ€Ð¾ÐµÐºÑ‚ ÑÑ…Ð²Ð°Ð»ÐµÐ½Ð¸Ð¹ ÐºÐ¾Ð¼Ñ–ÑÑ–Ñ”ÑŽ.\n- Ð¡Ñ‚Ð°Ñ‚Ñ‚Ñ Ð¾Ð¿ÑƒÐ±Ð»Ñ–ÐºÐ¾Ð²Ð°Ð½Ð° Ñ€ÐµÐ´Ð°ÐºÑ†Ñ–Ñ”ÑŽ.\n- Ð—Ð°Ð²Ð´Ð°Ð½Ð½Ñ Ð²Ð¸ÐºÐ¾Ð½Ð°Ð½Ðµ ÑƒÑ‡Ð½ÑÐ¼Ð¸.\n\n### ÐšÐ¾Ñ€Ð¾Ñ‚ÐºÐ¸Ð¹ Ð¿Ð°ÑÐ¸Ð² (-Ð½Ð¾/-Ñ‚Ð¾)\n- Ð Ñ–ÑˆÐµÐ½Ð½Ñ Ð¿Ñ€Ð¸Ð¹Ð½ÑÑ‚Ð¾ Ð¾Ð´Ð½Ð¾Ð³Ð¾Ð»Ð¾ÑÐ½Ð¾.\n- Ð”Ð¾ÐºÑƒÐ¼ÐµÐ½Ñ‚Ð¸ Ð¿Ñ–Ð´Ð³Ð¾Ñ‚Ð¾Ð²Ð»ÐµÐ½Ð¾ Ð²Ñ‡Ð°ÑÐ½Ð¾.\n- ÐœÐµÐ½Ñ– Ð±ÑƒÐ»Ð¾ ÑÐºÐ°Ð·Ð°Ð½Ð¾ Ñ‡ÐµÐºÐ°Ñ‚Ð¸.\n- Ð ÐµÐ·ÑƒÐ»ÑŒÑ‚Ð°Ñ‚Ð¸ Ð¾Ð³Ð¾Ð»Ð¾ÑˆÐµÐ½Ð¾ Ð¾Ñ„Ñ–Ñ†Ñ–Ð¹Ð½Ð¾.\n- ÐšÐ¾Ð½Ñ‚Ñ€Ð°ÐºÑ‚ Ð¿Ñ–Ð´Ð¿Ð¸ÑÐ°Ð½Ð¾ Ð²Ñ‡Ð¾Ñ€Ð°.\n- Ð—Ð°Ñ…Ð¾Ð´Ð¸ Ð·Ð°Ð¿Ð»Ð°Ð½Ð¾Ð²Ð°Ð½Ð¾ Ð½Ð° Ð²ÐµÑÐ½Ñƒ.\n- ÐŸÑ€Ð¾Ð±Ð»ÐµÐ¼Ñƒ Ð²Ð¸Ñ€Ñ–ÑˆÐµÐ½Ð¾ ÑƒÑÐ¿Ñ–ÑˆÐ½Ð¾.\n\n### Ð—Ð²Ð¾Ñ€Ð¾Ñ‚Ð½Ð¸Ð¹ Ð¿Ð°ÑÐ¸Ð² (-ÑÑ)\n- Ð¥Ð»Ñ–Ð± Ð²Ð¸Ð¿Ñ–ÐºÐ°Ñ”Ñ‚ÑŒÑÑ Ñ‰Ð¾Ñ€Ð°Ð½ÐºÑƒ.\n- Ð‘ÑƒÐ´Ð¸Ð½Ð¾Ðº Ð±ÑƒÐ´ÑƒÑ”Ñ‚ÑŒÑÑ ÑˆÐ²Ð¸Ð´ÐºÐ¾.\n- ÐŸÑ€Ð¾Ð±Ð»ÐµÐ¼Ð° Ð²Ð¸Ñ€Ñ–ÑˆÑƒÑ”Ñ‚ÑŒÑÑ Ð·Ð°Ñ€Ð°Ð·.\n- Ð”Ð¾ÐºÑƒÐ¼ÐµÐ½Ñ‚Ð¸ Ð³Ð¾Ñ‚ÑƒÑŽÑ‚ÑŒÑÑ ÑÐµÐºÑ€ÐµÑ‚Ð°Ñ€ÐµÐ¼.\n- Ð†ÑÐ¿Ð¸Ñ‚Ð¸ Ð¿Ñ€Ð¾Ð²Ð¾Ð´ÑÑ‚ÑŒÑÑ Ñ‰Ð¾Ñ€Ð¾ÐºÑƒ.\n- Ð¡Ñ‚Ð°Ñ‚Ñ‚Ñ– Ð¿ÑƒÐ±Ð»Ñ–ÐºÑƒÑŽÑ‚ÑŒÑÑ Ñ‰Ð¾Ñ‚Ð¸Ð¶Ð½Ñ.\n- Ð Ñ–ÑˆÐµÐ½Ð½Ñ Ð¿Ñ€Ð¸Ð¹Ð¼Ð°ÑŽÑ‚ÑŒÑÑ ÐºÐ¾Ð»ÐµÐºÑ‚Ð¸Ð²Ð½Ð¾.\n\n## unjumble: ÐŸÐ¾Ð±ÑƒÐ´ÑƒÐ¹Ñ‚Ðµ Ð¿Ð°ÑÐ¸Ð²Ð½Ðµ Ñ€ÐµÑ‡ÐµÐ½Ð½Ñ\n> Ð Ð¾Ð·Ñ‚Ð°ÑˆÑƒÐ¹Ñ‚Ðµ ÑÐ»Ð¾Ð²Ð° Ð² Ð¿Ñ€Ð°Ð²Ð¸Ð»ÑŒÐ½Ð¾Ð¼Ñƒ Ð¿Ð¾Ñ€ÑÐ´ÐºÑƒ, Ñ‰Ð¾Ð± ÑƒÑ‚Ð²Ð¾Ñ€Ð¸Ñ‚Ð¸ Ð¿Ð°ÑÐ¸Ð²Ð½Ðµ Ñ€ÐµÑ‡ÐµÐ½Ð½Ñ.\n\n1. Ð½Ð°Ð¿Ð¸ÑÐ°Ð½Ð° / Ð°Ð²Ñ‚Ð¾Ñ€Ð¾Ð¼ / Ð²Ñ–Ð´Ð¾Ð¼Ð¸Ð¼ / ÐºÐ½Ð¸Ð³Ð° / ÑƒÐºÑ€Ð°Ñ—Ð½ÑÑŒÐºÐ¸Ð¼ / Ñ†Ñ / Ð¼Ð¸Ð½ÑƒÐ»Ð¾Ð³Ð¾ / Ñ€Ð¾ÐºÑƒ / Ñ‚Ð° / Ð¿ÐµÑ€ÐµÐºÐ»Ð°Ð´ÐµÐ½Ð° / Ð±Ð°Ð³Ð°Ñ‚ÑŒÐ¼Ð° / Ð¼Ð¾Ð²Ð°Ð¼Ð¸\n   > [!answer] Ð¦Ñ ÐºÐ½Ð¸Ð³Ð° Ð½Ð°Ð¿Ð¸ÑÐ°Ð½Ð° Ð²Ñ–Ð´Ð¾Ð¼Ð¸Ð¼ ÑƒÐºÑ€Ð°Ñ—Ð½ÑÑŒÐºÐ¸Ð¼ Ð°Ð²Ñ‚Ð¾Ñ€Ð¾Ð¼ Ð¼Ð¸Ð½ÑƒÐ»Ð¾Ð³Ð¾ Ñ€Ð¾ÐºÑƒ Ñ‚Ð° Ð¿ÐµÑ€ÐµÐºÐ»Ð°Ð´ÐµÐ½Ð° Ð±Ð°Ð³Ð°Ñ‚ÑŒÐ¼Ð° Ð¼Ð¾Ð²Ð°Ð¼Ð¸.\n\n2. Ð¿Ñ€Ð¸Ð¹Ð½ÑÑ‚Ð¾ / ÐºÐ¾Ð¼Ñ–ÑÑ–Ñ”ÑŽ / Ð¾Ð´Ð½Ð¾Ð³Ð¾Ð»Ð¾ÑÐ½Ð¾ / Ñ€Ñ–ÑˆÐµÐ½Ð½Ñ / Ð¿Ñ–ÑÐ»Ñ / Ð¾Ð±Ð³Ð¾Ð²Ð¾Ñ€ÐµÐ½Ð½Ñ / Ñ‚Ñ€Ð¸Ð²Ð°Ð»Ð¾Ð³Ð¾ / Ð±ÑƒÐ»Ð¾ / ÑƒÑÑ–Ñ… / Ð¼Ð¾Ð¶Ð»Ð¸Ð²Ð¸Ñ… / Ð²Ð°Ñ€Ñ–Ð°Ð½Ñ‚Ñ–Ð²\n   > [!answer] Ð Ñ–ÑˆÐµÐ½Ð½Ñ Ð±ÑƒÐ»Ð¾ Ð¿Ñ€Ð¸Ð¹Ð½ÑÑ‚Ð¾ ÐºÐ¾Ð¼Ñ–ÑÑ–Ñ”ÑŽ Ð¾Ð´Ð½Ð¾Ð³Ð¾Ð»Ð¾ÑÐ½Ð¾ Ð¿Ñ–ÑÐ»Ñ Ñ‚Ñ€Ð¸Ð²Ð°Ð»Ð¾Ð³Ð¾ Ð¾Ð±Ð³Ð¾Ð²Ð¾Ñ€ÐµÐ½Ð½Ñ ÑƒÑÑ–Ñ… Ð¼Ð¾Ð¶Ð»Ð¸Ð²Ð¸Ñ… Ð²Ð°Ñ€Ñ–Ð°Ð½Ñ‚Ñ–Ð².\n\n3. Ð±ÑƒÐ´ÑƒÑ”Ñ‚ÑŒÑÑ / Ð½Ð¾Ð²Ð¸Ð¹ / ÑˆÐ²Ð¸Ð´ÐºÐ¾ / ÑÑ‚Ð°Ð´Ñ–Ð¾Ð½ / Ð´ÑƒÐ¶Ðµ / Ð·Ð°Ñ€Ð°Ð· / Ñƒ / Ð½Ð°ÑˆÐ¾Ð¼Ñƒ / Ð¼Ñ–ÑÑ‚Ñ– / Ð´Ð»Ñ / Ð¾Ð»Ñ–Ð¼Ð¿Ñ–Ð¹ÑÑŒÐºÐ¸Ñ… / Ð·Ð¼Ð°Ð³Ð°Ð½ÑŒ\n   > [!answer] ÐÐ¾Ð²Ð¸Ð¹ ÑÑ‚Ð°Ð´Ñ–Ð¾Ð½ Ð·Ð°Ñ€Ð°Ð· Ð±ÑƒÐ´ÑƒÑ”Ñ‚ÑŒÑÑ Ð´ÑƒÐ¶Ðµ ÑˆÐ²Ð¸Ð´ÐºÐ¾ Ñƒ Ð½Ð°ÑˆÐ¾Ð¼Ñƒ Ð¼Ñ–ÑÑ‚Ñ– Ð´Ð»Ñ Ð¾Ð»Ñ–Ð¼Ð¿Ñ–Ð¹ÑÑŒÐºÐ¸Ñ… Ð·Ð¼Ð°Ð³Ð°Ð½ÑŒ.\n\n4. Ð¿Ñ–Ð´Ð³Ð¾Ñ‚Ð¾Ð²Ð»ÐµÐ½Ð¾ / Ð´Ð¾ÐºÑƒÐ¼ÐµÐ½Ñ‚Ð¸ / Ð±ÑƒÐ»Ð¸ / Ñ‚Ð° / ÑÐµÐºÑ€ÐµÑ‚Ð°Ñ€ÐµÐ¼ / Ð½Ð°Ð´Ñ–ÑÐ»Ð°Ð½Ð¾ / Ð¿Ð°Ñ€Ñ‚Ð½ÐµÑ€Ð°Ð¼ / ÑƒÑÑ– / Ð´Ð¾ / ÐºÑ–Ð½Ñ†Ñ / Ñ€Ð¾Ð±Ð¾Ñ‡Ð¾Ð³Ð¾ / Ð´Ð½Ñ\n   > [!answer] Ð£ÑÑ– Ð´Ð¾ÐºÑƒÐ¼ÐµÐ½Ñ‚Ð¸ Ð±ÑƒÐ»Ð¸ Ð¿Ñ–Ð´Ð³Ð¾Ñ‚Ð¾Ð²Ð»ÐµÐ½Ð¾ ÑÐµÐºÑ€ÐµÑ‚Ð°Ñ€ÐµÐ¼ Ñ‚Ð° Ð½Ð°Ð´Ñ–ÑÐ»Ð°Ð½Ð¾ Ð¿Ð°Ñ€Ñ‚Ð½ÐµÑ€Ð°Ð¼ Ð´Ð¾ ÐºÑ–Ð½Ñ†Ñ Ñ€Ð¾Ð±Ð¾Ñ‡Ð¾Ð³Ð¾ Ð´Ð½Ñ.\n\n5. Ð²Ð¸Ð¿Ñ–ÐºÐ°Ñ”Ñ‚ÑŒÑÑ / Ñ…Ð»Ñ–Ð± / Ð¿ÐµÐºÐ°Ñ€Ð½Ñ– / Ð¾ / Ñ‰Ð¾Ñ€Ð°Ð½ÐºÑƒ / Ð² / Ð¿'ÑÑ‚Ñ–Ð¹ / Ñ†Ñ–Ð¹ / Ð³Ð¾Ð´Ð¸Ð½Ñ– / Ð·Ð° / Ñ‚Ñ€Ð°Ð´Ð¸Ñ†Ñ–Ð¹Ð½Ð¸Ð¼ / ÑƒÐºÑ€Ð°Ñ—Ð½ÑÑŒÐºÐ¸Ð¼ / Ñ€ÐµÑ†ÐµÐ¿Ñ‚Ð¾Ð¼\n   > [!answer] Ð¥Ð»Ñ–Ð± Ð²Ð¸Ð¿Ñ–ÐºÐ°Ñ”Ñ‚ÑŒÑÑ Ð² Ñ†Ñ–Ð¹ Ð¿ÐµÐºÐ°Ñ€Ð½Ñ– Ñ‰Ð¾Ñ€Ð°Ð½ÐºÑƒ Ð¾ Ð¿'ÑÑ‚Ñ–Ð¹ Ð³Ð¾Ð´Ð¸Ð½Ñ– Ð·Ð° Ñ‚Ñ€Ð°Ð´Ð¸Ñ†Ñ–Ð¹Ð½Ð¸Ð¼ ÑƒÐºÑ€Ð°Ñ—Ð½ÑÑŒÐºÐ¸Ð¼ Ñ€ÐµÑ†ÐµÐ¿Ñ‚Ð¾Ð¼.\n\n6. Ð¿ÐµÑ€ÐµÐ²Ñ–Ñ€ÑÑ”Ñ‚ÑŒÑÑ / Ñ‚ÐµÐºÑÑ‚ / Ñ€ÐµÐ´Ð°ÐºÑ‚Ð¾Ñ€Ð¾Ð¼ / ÑƒÐ²Ð°Ð¶Ð½Ð¾ / Ñ‚Ð° / ÐºÐ¾Ñ€ÐµÐºÑ‚Ð¾Ñ€Ð¾Ð¼ / Ñ€ÐµÑ‚ÐµÐ»ÑŒÐ½Ð¾ / Ð·Ð°Ñ€Ð°Ð· / Ð¿ÐµÑ€ÐµÐ´ / Ð¿ÑƒÐ±Ð»Ñ–ÐºÐ°Ñ†Ñ–Ñ”ÑŽ / Ð² / Ð¶ÑƒÑ€Ð½Ð°Ð»Ñ–\n   > [!answer] Ð¢ÐµÐºÑÑ‚ Ð·Ð°Ñ€Ð°Ð· ÑƒÐ²Ð°Ð¶Ð½Ð¾ Ð¿ÐµÑ€ÐµÐ²Ñ–Ñ€ÑÑ”Ñ‚ÑŒÑÑ Ñ€ÐµÐ´Ð°ÐºÑ‚Ð¾Ñ€Ð¾Ð¼ Ñ‚Ð° Ñ€ÐµÑ‚ÐµÐ»ÑŒÐ½Ð¾ ÐºÐ¾Ñ€ÐµÐºÑ‚Ð¾Ñ€Ð¾Ð¼ Ð¿ÐµÑ€ÐµÐ´ Ð¿ÑƒÐ±Ð»Ñ–ÐºÐ°Ñ†Ñ–Ñ”ÑŽ Ð² Ð¶ÑƒÑ€Ð½Ð°Ð»Ñ–.\n\n## error-correction: Ð’Ð¸Ð¿Ñ€Ð°Ð²Ñ‚Ðµ Ð¿Ð¾Ð¼Ð¸Ð»ÐºÐ¸\n> ÐšÐ¾Ð¶Ð½Ðµ Ñ€ÐµÑ‡ÐµÐ½Ð½Ñ Ð¼Ñ–ÑÑ‚Ð¸Ñ‚ÑŒ Ð¾Ð´Ð½Ñƒ Ð¿Ð¾Ð¼Ð¸Ð»ÐºÑƒ. Ð—Ð½Ð°Ð¹Ð´Ñ–Ñ‚ÑŒ Ñ– Ð²Ð¸Ð¿Ñ€Ð°Ð²Ñ‚Ðµ Ñ—Ñ—.\n\n1. ÐšÐ½Ð¸Ð³Ð° Ð½Ð°Ð¿Ð¸ÑÐ°Ð½Ð¸Ð¹ Ð²Ñ–Ð´Ð¾Ð¼Ð¸Ð¼ ÑƒÐºÑ€Ð°Ñ—Ð½ÑÑŒÐºÐ¸Ð¼ Ð¿Ð¸ÑÑŒÐ¼ÐµÐ½Ð½Ð¸ÐºÐ¾Ð¼.\n   > [!error] Ð½Ð°Ð¿Ð¸ÑÐ°Ð½Ð¸Ð¹\n   > [!answer] Ð½Ð°Ð¿Ð¸ÑÐ°Ð½Ð°\n   > [!options] Ð½Ð°Ð¿Ð¸ÑÐ°Ð½Ð¸Ð¹ | Ð½Ð°Ð¿Ð¸ÑÐ°Ð½Ð° | Ð½Ð°Ð¿Ð¸ÑÐ°Ð½Ðµ | Ð½Ð°Ð¿Ð¸ÑÐ°Ð½Ñ–\n   > [!explanation] Â«ÐšÐ½Ð¸Ð³Ð°Â» â€” Ð¶Ñ–Ð½Ð¾Ñ‡Ð¾Ð³Ð¾ Ñ€Ð¾Ð´Ñƒ, Ñ‚Ð¾Ð¼Ñƒ Ð´Ñ–Ñ”Ð¿Ñ€Ð¸ÐºÐ¼ÐµÑ‚Ð½Ð¸Ðº Â«Ð½Ð°Ð¿Ð¸ÑÐ°Ð½Ð°Â».\n\n2. Ð Ñ–ÑˆÐµÐ½Ð½Ñ Ð¿Ñ€Ð¸Ð¹Ð½ÑÑ‚Ð° ÐºÐ¾Ð¼Ñ–ÑÑ–Ñ”ÑŽ Ð¾Ð´Ð½Ð¾Ð³Ð¾Ð»Ð¾ÑÐ½Ð¾ Ð²Ñ‡Ð¾Ñ€Ð°.\n   > [!error] Ð¿Ñ€Ð¸Ð¹Ð½ÑÑ‚Ð°\n   > [!answer] Ð¿Ñ€Ð¸Ð¹Ð½ÑÑ‚Ðµ\n   > [!options] Ð¿Ñ€Ð¸Ð¹Ð½ÑÑ‚Ð° | Ð¿Ñ€Ð¸Ð¹Ð½ÑÑ‚Ðµ | Ð¿Ñ€Ð¸Ð¹Ð½ÑÑ‚Ð¸Ð¹ | Ð¿Ñ€Ð¸Ð¹Ð½ÑÑ‚Ñ–\n   > [!explanation] Â«Ð Ñ–ÑˆÐµÐ½Ð½ÑÂ» â€” ÑÐµÑ€ÐµÐ´Ð½ÑŒÐ¾Ð³Ð¾ Ñ€Ð¾Ð´Ñƒ, Ñ‚Ð¾Ð¼Ñƒ Ð´Ñ–Ñ”Ð¿Ñ€Ð¸ÐºÐ¼ÐµÑ‚Ð½Ð¸Ðº Â«Ð¿Ñ€Ð¸Ð¹Ð½ÑÑ‚ÐµÂ».\n\n3. ÐšÐ¾Ð½Ñ‚Ñ€Ð°ÐºÑ‚ Ð¿Ñ–Ð´Ð¿Ð¸ÑÑƒÑ”Ñ‚ÑŒÑÑ Ð²Ñ‡Ð¾Ñ€Ð° Ð´Ð¸Ñ€ÐµÐºÑ‚Ð¾Ñ€Ð¾Ð¼ ÐºÐ¾Ð¼Ð¿Ð°Ð½Ñ–Ñ—.\n   > [!error] Ð¿Ñ–Ð´Ð¿Ð¸ÑÑƒÑ”Ñ‚ÑŒÑÑ\n   > [!answer] Ð¿Ñ–Ð´Ð¿Ð¸ÑÐ°Ð½Ð¾\n   > [!options] Ð¿Ñ–Ð´Ð¿Ð¸ÑÑƒÑ”Ñ‚ÑŒÑÑ | Ð¿Ñ–Ð´Ð¿Ð¸ÑÐ°Ð½Ð¾ | Ð¿Ñ–Ð´Ð¿Ð¸ÑÐ°Ð½Ð¸Ð¹ | Ð¿Ñ–Ð´Ð¿Ð¸ÑÑƒÐ²Ð°Ð²ÑÑ\n   > [!explanation] Â«Ð’Ñ‡Ð¾Ñ€Ð°Â» â€” Ð·Ð°Ð²ÐµÑ€ÑˆÐµÐ½Ð° Ð´Ñ–Ñ, Ñ‚Ð¾Ð¼Ñƒ ÐºÐ¾Ñ€Ð¾Ñ‚ÐºÐ¸Ð¹ Ð¿Ð°ÑÐ¸Ð² Â«Ð¿Ñ–Ð´Ð¿Ð¸ÑÐ°Ð½Ð¾Â».\n\n4. Ð”Ð¾ÐºÑƒÐ¼ÐµÐ½Ñ‚ Ð¿Ñ–Ð´Ð³Ð¾Ñ‚Ð¾Ð²Ð»ÐµÐ½Ð¾ ÑŽÑ€Ð¸ÑÑ‚Ð¾Ð¼ Ñ‚Ð° Ð½Ð°Ð´Ñ–ÑÐ»Ð°Ð½Ñ– Ð¿Ð°Ñ€Ñ‚Ð½ÐµÑ€Ð°Ð¼.\n   > [!error] Ð½Ð°Ð´Ñ–ÑÐ»Ð°Ð½Ñ–\n   > [!answer] Ð½Ð°Ð´Ñ–ÑÐ»Ð°Ð½Ð¾\n   > [!options] Ð½Ð°Ð´Ñ–ÑÐ»Ð°Ð½Ñ– | Ð½Ð°Ð´Ñ–ÑÐ»Ð°Ð½Ð¾ | Ð½Ð°Ð´Ñ–ÑÐ»Ð°Ð½Ð¸Ð¹ | Ð½Ð°Ð´Ñ–ÑÐ»Ð°Ð½Ð°\n   > [!explanation] ÐžÐ±Ð¸Ð´Ð²Ñ– Ñ„Ð¾Ñ€Ð¼Ð¸ Ð¼Ð°ÑŽÑ‚ÑŒ Ð±ÑƒÑ‚Ð¸ ÐºÐ¾Ñ€Ð¾Ñ‚ÐºÐ¸Ð¼Ð¸: Â«Ð¿Ñ–Ð´Ð³Ð¾Ñ‚Ð¾Ð²Ð»ÐµÐ½Ð¾Â» Ñ‚Ð° Â«Ð½Ð°Ð´Ñ–ÑÐ»Ð°Ð½Ð¾Â».\n\n5. Ð‘ÑƒÐ´Ð¸Ð½Ð¾Ðº Ð±ÑƒÐ´ÑƒÐ²Ð°Ð²ÑÑ Ð·Ð°Ñ€Ð°Ð· Ð´ÑƒÐ¶Ðµ ÑˆÐ²Ð¸Ð´ÐºÐ¾ Ñ€Ð¾Ð±Ñ–Ñ‚Ð½Ð¸ÐºÐ°Ð¼Ð¸.\n   > [!error] Ð±ÑƒÐ´ÑƒÐ²Ð°Ð²ÑÑ\n   > [!answer] Ð±ÑƒÐ´ÑƒÑ”Ñ‚ÑŒÑÑ\n   > [!options] Ð±ÑƒÐ´ÑƒÐ²Ð°Ð²ÑÑ | Ð±ÑƒÐ´ÑƒÑ”Ñ‚ÑŒÑÑ | Ð·Ð±ÑƒÐ´Ð¾Ð²Ð°Ð½Ð¾ | Ð·Ð±ÑƒÐ´Ð¾Ð²Ð°Ð½Ð¸Ð¹\n   > [!explanation] Â«Ð—Ð°Ñ€Ð°Ð·Â» â€” Ñ‚ÐµÐ¿ÐµÑ€Ñ–ÑˆÐ½Ñ–Ð¹ Ñ‡Ð°Ñ, Ñ‚Ð¾Ð¼Ñƒ Â«Ð±ÑƒÐ´ÑƒÑ”Ñ‚ÑŒÑÑÂ».\n\n6. Ð ÐµÐ·ÑƒÐ»ÑŒÑ‚Ð°Ñ‚Ð¸ Ð±ÑƒÐ»Ð¾ Ð¾Ð³Ð¾Ð»Ð¾ÑˆÐµÐ½Ð¾ ÐºÐ¾Ð¼Ñ–ÑÑ–Ñ Ð½Ð° Ñ†ÐµÑ€ÐµÐ¼Ð¾Ð½Ñ–Ñ—.\n   > [!error] ÐºÐ¾Ð¼Ñ–ÑÑ–Ñ\n   > [!answer] ÐºÐ¾Ð¼Ñ–ÑÑ–Ñ”ÑŽ\n   > [!options] ÐºÐ¾Ð¼Ñ–ÑÑ–Ñ | ÐºÐ¾Ð¼Ñ–ÑÑ–Ñ”ÑŽ | ÐºÐ¾Ð¼Ñ–ÑÑ–Ñ— | ÐºÐ¾Ð¼Ñ–ÑÑ–ÑŽ\n   > [!explanation] Ð’Ð¸ÐºÐ¾Ð½Ð°Ð²ÐµÑ†ÑŒ ÑÑ‚Ð¾Ñ—Ñ‚ÑŒ Ð² Ð¾Ñ€ÑƒÐ´Ð½Ð¾Ð¼Ñƒ Ð²Ñ–Ð´Ð¼Ñ–Ð½ÐºÑƒ: Â«ÐºÐ¾Ð¼Ñ–ÑÑ–Ñ”ÑŽÂ».\n\n## cloze: ÐÐ¾Ð²Ð¸Ð½Ð½Ð° ÑÑ‚Ð°Ñ‚Ñ‚Ñ\n> Ð—Ð°Ð¿Ð¾Ð²Ð½Ñ–Ñ‚ÑŒ Ð¿Ñ€Ð¾Ð¿ÑƒÑÐºÐ¸ Ð¿Ñ€Ð°Ð²Ð¸Ð»ÑŒÐ½Ð¸Ð¼Ð¸ Ð¿Ð°ÑÐ¸Ð²Ð½Ð¸Ð¼Ð¸ Ñ„Ð¾Ñ€Ð¼Ð°Ð¼Ð¸.\n\nÐÐžÐ’Ð Ð¨ÐšÐžÐ›Ð Ð’Ð†Ð”ÐšÐ Ð˜Ð¢Ð Ð’ ÐšÐ˜Ð„Ð’Ð†\n\nÐ¡Ø«Ð³Ð¾Ð´Ð½Ñ– [___:1] Ð½Ð¾Ð²Ñƒ ÑˆÐºÐ¾Ð»Ñƒ Ð½Ð° ÑÑ‚Ð¾ ÐºÐ»Ð°ÑÑ–Ð² Ñƒ Ð¡Ð¾Ð»Ð¾Ð¼'ÑÐ½ÑÑŒÐºÐ¾Ð¼Ñƒ Ñ€Ð°Ð¹Ð¾Ð½Ñ– ÑÑ‚Ð¾Ð»Ð¸Ñ†Ñ–. Ð‘ÑƒÐ´Ñ–Ð²Ð»Ñ [___:2] Ð·Ð° Ð½Ð°Ð¹ÑÑƒÑ‡Ð°ÑÐ½Ñ–ÑˆÐ¸Ð¼Ð¸ ÑÑ‚Ð°Ð½Ð´Ð°Ñ€Ñ‚Ð°Ð¼Ð¸ Ð¿Ñ€Ð¾Ñ‚ÑÐ³Ð¾Ð¼ Ð´Ð²Ð¾Ñ… Ñ€Ð¾ÐºÑ–Ð². ÐŸÑ€Ð¾ÐµÐºÑ‚ [___:3] Ð¼Ñ–Ð¶Ð½Ð°Ñ€Ð¾Ð´Ð½Ð¾ÑŽ Ð°Ñ€Ñ…Ñ–Ñ‚ÐµÐºÑ‚ÑƒÑ€Ð½Ð¾ÑŽ ÑÑ‚ÑƒÐ´Ñ–Ñ”ÑŽ.\n\nÐÐ° Ñ†ÐµÑ€ÐµÐ¼Ð¾Ð½Ñ–Ñ— Ð²Ñ–Ð´ÐºÑ€Ð¸Ñ‚Ñ‚Ñ [___:4], Ñ‰Ð¾ ÑˆÐºÐ¾Ð»Ð° [___:5] ÑÑƒÑ‡Ð°ÑÐ½Ð¸Ð¼ Ð¾Ð±Ð»Ð°Ð´Ð½Ð°Ð½Ð½ÑÐ¼. ÐšÐ¾Ð¼Ð¿'ÑŽÑ‚ÐµÑ€Ð½Ñ– ÐºÐ»Ð°ÑÐ¸ [___:6] Ð·Ð° Ð¾ÑÑ‚Ð°Ð½Ð½Ñ–Ð¼ ÑÐ»Ð¾Ð²Ð¾Ð¼ Ñ‚ÐµÑ…Ð½Ñ–ÐºÐ¸. Ð¡Ð¿Ð¾Ñ€Ñ‚Ð¸Ð²Ð½Ð¸Ð¹ Ð·Ð°Ð» [___:7] Ð´Ð»Ñ Ñ€Ñ–Ð·Ð½Ð¸Ñ… Ð²Ð¸Ð´Ñ–Ð² ÑÐ¿Ð¾Ñ€Ñ‚Ñƒ.\n\nÐ—Ð° ÑÐ»Ð¾Ð²Ð°Ð¼Ð¸ Ð´Ð¸Ñ€ÐµÐºÑ‚Ð¾Ñ€Ð°, Ð½Ð°Ð²Ñ‡Ð°Ð½Ð½Ñ [___:8] Ð·Ð° Ñ–Ð½Ð½Ð¾Ð²Ð°Ñ†Ñ–Ð¹Ð½Ð¸Ð¼Ð¸ Ð¼ÐµÑ‚Ð¾Ð´Ð¸ÐºÐ°Ð¼Ð¸. ÐŸÑ–Ð´Ñ€ÑƒÑ‡Ð½Ð¸ÐºÐ¸ [___:9] ÑÐ¿ÐµÑ†Ñ–Ð°Ð»ÑŒÐ½Ð¾ Ð´Ð»Ñ Ñ†Ñ–Ñ”Ñ— ÑˆÐºÐ¾Ð»Ð¸. Ð£Ñ‡Ð¸Ñ‚ÐµÐ»Ñ– [___:10] Ð¿Ñ–ÑÐ»Ñ Ñ€ÐµÑ‚ÐµÐ»ÑŒÐ½Ð¾Ð³Ð¾ ÐºÐ¾Ð½ÐºÑƒÑ€ÑÐ½Ð¾Ð³Ð¾ Ð²Ñ–Ð´Ð±Ð¾Ñ€Ñƒ.\n\nÐ‘Ð°Ñ‚ÑŒÐºÐ¸, Ð´Ñ–Ñ‚Ð¸ ÑÐºÐ¸Ñ… [___:11] Ð´Ð¾ ÑˆÐºÐ¾Ð»Ð¸, Ð²Ð¸ÑÐ»Ð¾Ð²Ð¸Ð»Ð¸ Ð·Ð°Ð´Ð¾Ð²Ð¾Ð»ÐµÐ½Ð½Ñ. Â«ÐœÐ¸ Ñ€Ð°Ð´Ñ–, Ñ‰Ð¾ Ñ‚Ð°ÐºÐ° ÑˆÐºÐ¾Ð»Ð° [___:12] Ñƒ Ð½Ð°ÑˆÐ¾Ð¼Ñƒ Ñ€Ð°Ð¹Ð¾Ð½Ñ–Â», â€” [___:13] Ð¾Ð´Ð½Ñ–Ñ”ÑŽ Ð· Ð¼Ð°Ñ‚ÐµÑ€Ñ–Ð².\n\nÐÐ°ÑÑ‚ÑƒÐ¿Ð½Ð¾Ð³Ð¾ Ñ€Ð¾ÐºÑƒ [___:14] Ñ‰Ðµ Ñ‚Ñ€Ð¸ ÑˆÐºÐ¾Ð»Ð¸ Ð² Ñ–Ð½ÑˆÐ¸Ñ… Ñ€Ð°Ð¹Ð¾Ð½Ð°Ñ… Ð¼Ñ–ÑÑ‚Ð°.\n\n1. Ð²Ñ–Ð´ÐºÑ€Ð¸Ñ‚Ð¾ | Ð²Ñ–Ð´ÐºÑ€Ð¸Ð²Ð°Ñ”Ñ‚ÑŒÑÑ | Ð²Ñ–Ð´ÐºÑ€Ð¸Ñ‚Ð°\n   > [!answer] Ð²Ñ–Ð´ÐºÑ€Ð¸Ñ‚Ð¾\n\n2. Ð±ÑƒÐ´ÑƒÐ²Ð°Ð»Ð°ÑÑ | Ð·Ð±ÑƒÐ´Ð¾Ð²Ð°Ð½Ð¾ | Ð·Ð±ÑƒÐ´Ð¾Ð²Ð°Ð½Ð°\n   > [!answer] Ð·Ð±ÑƒÐ´Ð¾Ð²Ð°Ð½Ð°\n\n3. Ñ€Ð¾Ð·Ñ€Ð¾Ð±Ð»ÐµÐ½Ð¸Ð¹ | Ñ€Ð¾Ð·Ñ€Ð¾Ð±Ð»ÐµÐ½Ð¾ | Ñ€Ð¾Ð·Ñ€Ð¾Ð±Ð»ÑÑ”Ñ‚ÑŒÑÑ\n   > [!answer] Ñ€Ð¾Ð·Ñ€Ð¾Ð±Ð»ÐµÐ½Ð¸Ð¹\n\n4. Ð¿Ð¾Ð²Ñ–Ð´Ð¾Ð¼Ð»ÐµÐ½Ð¾ | Ð¿Ð¾Ð²Ñ–Ð´Ð¾Ð¼Ð»ÑÑ”Ñ‚ÑŒÑÑ | Ð¿Ð¾Ð²Ñ–Ð´Ð¾Ð¼Ð»ÐµÐ½Ð¸Ð¹\n   > [!answer] Ð¿Ð¾Ð²Ñ–Ð´Ð¾Ð¼Ð»ÐµÐ½Ð¾\n\n5. Ð¾Ð±Ð»Ð°Ð´Ð½Ð°Ð½Ð° | Ð¾Ð±Ð»Ð°Ð´Ð½Ð°Ð½Ð¾ | Ð¾Ð±Ð»Ð°Ð´Ð½ÑƒÑ”Ñ‚ÑŒÑÑ\n   > [!answer] Ð¾Ð±Ð»Ð°Ð´Ð½Ð°Ð½Ð°\n\n6. Ð¾ÑÐ½Ð°Ñ‰ÐµÐ½Ñ– | Ð¾ÑÐ½Ð°Ñ‰ÐµÐ½Ð¾ | Ð¾ÑÐ½Ð°Ñ‰ÑƒÑŽÑ‚ÑŒÑÑ\n   > [!answer] Ð¾ÑÐ½Ð°Ñ‰ÐµÐ½Ñ–\n\n7. Ð¿Ñ€Ð¸ÑÑ‚Ð¾ÑÐ¾Ð²Ð°Ð½Ð¸Ð¹ | Ð¿Ñ€Ð¸ÑÑ‚Ð¾ÑÐ¾Ð²Ð°Ð½Ð¾ | Ð¿Ñ€Ð¸ÑÑ‚Ð¾ÑÐ¾Ð²ÑƒÑ”Ñ‚ÑŒÑÑ\n   > [!answer] Ð¿Ñ€Ð¸ÑÑ‚Ð¾ÑÐ¾Ð²Ð°Ð½Ð¸Ð¹\n\n8. Ð¿Ñ€Ð¾Ð²Ð¾Ð´Ð¸Ñ‚ÑŒÑÑ | Ð¿Ñ€Ð¾Ð²ÐµÐ´ÐµÐ½Ð¾ | Ð¿Ñ€Ð¾Ð²ÐµÐ´ÐµÐ½Ðµ\n   > [!answer] Ð¿Ñ€Ð¾Ð²Ð¾Ð´Ð¸Ñ‚ÑŒÑÑ\n\n9. Ð½Ð°Ð¿Ð¸ÑÐ°Ð½Ð¾ | Ð½Ð°Ð¿Ð¸ÑÐ°Ð½Ñ– | Ð¿Ð¸ÑˆÑƒÑ‚ÑŒÑÑ\n   > [!answer] Ð½Ð°Ð¿Ð¸ÑÐ°Ð½Ð¾\n\n10. Ð²Ñ–Ð´Ñ–Ð±Ñ€Ð°Ð½Ð¾ | Ð²Ñ–Ð´Ñ–Ð±Ñ€Ð°Ð½Ñ– | Ð²Ñ–Ð´Ð±Ð¸Ñ€Ð°ÑŽÑ‚ÑŒÑÑ\n    > [!answer] Ð²Ñ–Ð´Ñ–Ð±Ñ€Ð°Ð½Ð¾\n\n11. Ð·Ð°Ñ€Ð°Ñ…Ð¾Ð²Ð°Ð½Ð¾ | Ð·Ð°Ñ€Ð°Ñ…Ð¾Ð²Ð°Ð½Ñ– | Ð·Ð°Ñ€Ð°Ñ…Ð¾Ð²ÑƒÑŽÑ‚ÑŒÑÑ\n    > [!answer] Ð·Ð°Ñ€Ð°Ñ…Ð¾Ð²Ð°Ð½Ð¾\n\n12. Ð·Ð±ÑƒÐ´Ð¾Ð²Ð°Ð½Ð¾ | Ð·Ð±ÑƒÐ´Ð¾Ð²Ð°Ð½Ð° | Ð±ÑƒÐ´ÑƒÑ”Ñ‚ÑŒÑÑ\n    > [!answer] Ð·Ð±ÑƒÐ´Ð¾Ð²Ð°Ð½Ð¾\n\n13. ÑÐºÐ°Ð·Ð°Ð½Ð¾ | ÑÐºÐ°Ð·Ð°Ð»Ð° | Ð³Ð¾Ð²Ð¾Ñ€Ð¸Ñ‚ÑŒÑÑ\n    > [!answer] ÑÐºÐ°Ð·Ð°Ð½Ð¾\n\n14. Ð·Ð°Ð¿Ð»Ð°Ð½Ð¾Ð²Ð°Ð½Ð¾ | Ð·Ð°Ð¿Ð»Ð°Ð½Ð¾Ð²Ð°Ð½Ñ– | Ð¿Ð»Ð°Ð½ÑƒÑ”Ñ‚ÑŒÑÑ\n    > [!answer] Ð·Ð°Ð¿Ð»Ð°Ð½Ð¾Ð²Ð°Ð½Ð¾\n\n## mark-the-words: Ð—Ð½Ð°Ð¹Ð´Ñ–Ñ‚ÑŒ Ð¿Ð°ÑÐ¸Ð²Ð½Ñ– ÐºÐ¾Ð½ÑÑ‚Ñ€ÑƒÐºÑ†Ñ–Ñ—\n> ÐŸÐ¾Ð·Ð½Ð°Ñ‡Ñ‚Ðµ Ð²ÑÑ– Ð¿Ð°ÑÐ¸Ð²Ð½Ñ– Ð´Ñ–Ñ”ÑÐ»Ð¾Ð²Ð° Ñ‚Ð° Ð´Ñ–Ñ”Ð¿Ñ€Ð¸ÐºÐ¼ÐµÑ‚Ð½Ð¸ÐºÐ¸ Ð² Ñ‚ÐµÐºÑÑ‚Ñ–.\n\nÐ’Ñ‡Ð¾Ñ€Ð° [Ð±ÑƒÐ»Ð¾ Ð¾Ð³Ð¾Ð»Ð¾ÑˆÐµÐ½Ð¾] Ñ€ÐµÐ·ÑƒÐ»ÑŒÑ‚Ð°Ñ‚Ð¸ ÐºÐ¾Ð½ÐºÑƒÑ€ÑÑƒ. ÐŸÐµÑ€ÐµÐ¼Ð¾Ð¶Ñ†Ñ– [Ð²Ð¸Ð·Ð½Ð°Ñ‡ÐµÐ½Ñ–] Ð¶ÑƒÑ€Ñ– Ð¿Ñ–ÑÐ»Ñ Ñ‚Ñ€Ð¸Ð²Ð°Ð»Ð¾Ð³Ð¾ Ð¾Ð±Ð³Ð¾Ð²Ð¾Ñ€ÐµÐ½Ð½Ñ. ÐÐ°Ð³Ð¾Ñ€Ð¾Ð´Ð¸ [Ð²Ñ€ÑƒÑ‡ÐµÐ½Ñ–] Ð½Ð° ÑƒÑ€Ð¾Ñ‡Ð¸ÑÑ‚Ñ–Ð¹ Ñ†ÐµÑ€ÐµÐ¼Ð¾Ð½Ñ–Ñ—. Ð—Ð°Ñ€Ð°Ð· [Ð³Ð¾Ñ‚ÑƒÑŽÑ‚ÑŒÑÑ] ÑÐµÑ€Ñ‚Ð¸Ñ„Ñ–ÐºÐ°Ñ‚Ð¸ Ð´Ð»Ñ Ð²ÑÑ–Ñ… ÑƒÑ‡Ð°ÑÐ½Ð¸ÐºÑ–Ð². ÐžÑ€Ð³Ð°Ð½Ñ–Ð·Ð°Ñ‚Ð¾Ñ€Ð°Ð¼Ð¸ [Ð·Ð°Ð¿Ð»Ð°Ð½Ð¾Ð²Ð°Ð½Ð¾] Ð¿Ñ€Ð¾Ð²ÐµÑÑ‚Ð¸ Ð½Ð°ÑÑ‚ÑƒÐ¿Ð½Ð¸Ð¹ ÐºÐ¾Ð½ÐºÑƒÑ€Ñ Ñ‡ÐµÑ€ÐµÐ· Ñ€Ñ–Ðº. Ð—Ð°ÑÐ²ÐºÐ¸ [Ð¿Ñ€Ð¸Ð¹Ð¼Ð°ÑŽÑ‚ÑŒÑÑ] Ð²Ð¶Ðµ Ð· Ð½Ð°ÑÑ‚ÑƒÐ¿Ð½Ð¾Ð³Ð¾ Ð¼Ñ–ÑÑÑ†Ñ.\n\n> 6 Ð¿Ð°ÑÐ¸Ð²Ð½Ð¸Ñ… Ñ„Ð¾Ñ€Ð¼: Ð±ÑƒÐ»Ð¾ Ð¾Ð³Ð¾Ð»Ð¾ÑˆÐµÐ½Ð¾, Ð²Ð¸Ð·Ð½Ð°Ñ‡ÐµÐ½Ñ–, Ð²Ñ€ÑƒÑ‡ÐµÐ½Ñ–, Ð³Ð¾Ñ‚ÑƒÑŽÑ‚ÑŒÑÑ, Ð·Ð°Ð¿Ð»Ð°Ð½Ð¾Ð²Ð°Ð½Ð¾, Ð¿Ñ€Ð¸Ð¹Ð¼Ð°ÑŽÑ‚ÑŒÑÑ.\n\n## dialogue-reorder: Ð Ð¾Ð·Ð¼Ð¾Ð²Ð° Ð² Ð¾Ñ„Ñ–ÑÑ–\n> Ð Ð¾Ð·Ñ‚Ð°ÑˆÑƒÐ¹Ñ‚Ðµ Ñ€ÐµÐ¿Ð»Ñ–ÐºÐ¸ Ð´Ñ–Ð°Ð»Ð¾Ð³Ñƒ Ð² Ð¿Ñ€Ð°Ð²Ð¸Ð»ÑŒÐ½Ð¾Ð¼Ñƒ Ð¿Ð¾Ñ€ÑÐ´ÐºÑƒ.\n\n- Ð: Ð”Ð¾Ð±Ñ€Ð¸Ð¹ Ð´ÐµÐ½ÑŒ! ÐÐ° ÑÐºÐ¾Ð¼Ñƒ ÐµÑ‚Ð°Ð¿Ñ– Ð½Ð°Ñˆ Ð¿Ñ€Ð¾ÐµÐºÑ‚?\n- Ð‘: ÐŸÐµÑ€ÑˆÐ° Ñ‡Ð°ÑÑ‚Ð¸Ð½Ð° Ð²Ð¶Ðµ Ð·Ð°Ð²ÐµÑ€ÑˆÐµÐ½Ð°, Ð´Ð¾ÐºÑƒÐ¼ÐµÐ½Ñ‚Ð¸ Ð¿Ñ–Ð´Ð³Ð¾Ñ‚Ð¾Ð²Ð»ÐµÐ½Ð¾.\n- Ð: Ð Ñ‰Ð¾ Ð·Ð°Ñ€Ð°Ð· Ñ€Ð¾Ð±Ð¸Ñ‚ÑŒÑÑ?\n- Ð‘: Ð—Ð°Ñ€Ð°Ð· Ð³Ð¾Ñ‚ÑƒÑ”Ñ‚ÑŒÑÑ Ð¿Ñ€ÐµÐ·ÐµÐ½Ñ‚Ð°Ñ†Ñ–Ñ, ÑÐ»Ð°Ð¹Ð´Ð¸ Ñ€Ð¾Ð·Ñ€Ð¾Ð±Ð»ÑÑŽÑ‚ÑŒÑÑ Ð´Ð¸Ð·Ð°Ð¹Ð½ÐµÑ€Ð¾Ð¼.\n- Ð: ÐšÐ¾Ð»Ð¸ Ð²ÑÐµ Ð±ÑƒÐ´Ðµ Ð³Ð¾Ñ‚Ð¾Ð²Ðµ?\n- Ð‘: ÐŸÑ€ÐµÐ·ÐµÐ½Ñ‚Ð°Ñ†Ñ–ÑŽ Ð±ÑƒÐ´Ðµ Ð·Ð°Ð²ÐµÑ€ÑˆÐµÐ½Ð¾ Ð´Ð¾ Ð¿'ÑÑ‚Ð½Ð¸Ñ†Ñ–, Ð¼Ð°Ñ‚ÐµÑ€Ñ–Ð°Ð»Ð¸ Ð±ÑƒÐ´ÑƒÑ‚ÑŒ Ð½Ð°Ð´Ñ–ÑÐ»Ð°Ð½Ð¾ Ð¿Ð°Ñ€Ñ‚Ð½ÐµÑ€Ð°Ð¼.\n- Ð: Ð§ÑƒÐ´Ð¾Ð²Ð¾. Ð¥Ñ‚Ð¾ Ð¿Ñ€Ð¾Ð²Ð¾Ð´Ð¸Ñ‚Ð¸Ð¼Ðµ Ð·ÑƒÑÑ‚Ñ€Ñ–Ñ‡?\n- Ð‘: Ð—ÑƒÑÑ‚Ñ€Ñ–Ñ‡ Ð±ÑƒÐ´Ðµ Ð¿Ñ€Ð¾Ð²ÐµÐ´ÐµÐ½Ð° ÐºÐµÑ€Ñ–Ð²Ð½Ð¸ÐºÐ¾Ð¼ Ð²Ñ–Ð´Ð´Ñ–Ð»Ñƒ, Ð²ÑÐµ Ð¾Ñ€Ð³Ð°Ð½Ñ–Ð·Ð¾Ð²Ð°Ð½Ð¾.\n\n## select: ÐŸÑ€Ð°Ð²Ð¸Ð»ÑŒÐ½Ñ– Ð¿Ð°ÑÐ¸Ð²Ð½Ñ– ÐºÐ¾Ð½ÑÑ‚Ñ€ÑƒÐºÑ†Ñ–Ñ—\n> ÐžÐ±ÐµÑ€Ñ–Ñ‚ÑŒ ÑƒÑÑ– Ð³Ñ€Ð°Ð¼Ð°Ñ‚Ð¸Ñ‡Ð½Ð¾ Ð¿Ñ€Ð°Ð²Ð¸Ð»ÑŒÐ½Ñ– Ð²Ð°Ñ€Ñ–Ð°Ð½Ñ‚Ð¸.\n\n1. Ð¯Ðº Ð¿Ñ€Ð°Ð²Ð¸Ð»ÑŒÐ½Ð¾ ÑÐºÐ°Ð·Ð°Ñ‚Ð¸, Ñ‰Ð¾ Ñ…Ñ‚Ð¾ÑÑŒ Ð·Ð°Ð²ÐµÑ€ÑˆÐ¸Ð² Ñ€Ð¾Ð±Ð¾Ñ‚Ñƒ (Ð°ÐºÑ†ÐµÐ½Ñ‚ Ð½Ð° Ñ€ÐµÐ·ÑƒÐ»ÑŒÑ‚Ð°Ñ‚Ñ–)?\n   - [x] Ð Ð¾Ð±Ð¾Ñ‚Ñƒ Ð²Ð¸ÐºÐ¾Ð½Ð°Ð½Ð¾.\n   - [ ] Ð Ð¾Ð±Ð¾Ñ‚Ð° Ð²Ð¸ÐºÐ¾Ð½ÑƒÑ”Ñ‚ÑŒÑÑ.\n   - [x] Ð Ð¾Ð±Ð¾Ñ‚Ð° Ð²Ð¸ÐºÐ¾Ð½Ð°Ð½Ð°.\n   - [ ] Ð Ð¾Ð±Ð¾Ñ‚Ð° Ð²Ð¸ÐºÐ¾Ð½Ð°Ð»Ð°ÑÑŒ.\n   > ÐšÐ¾Ñ€Ð¾Ñ‚ÐºÐ¸Ð¹ Ð¿Ð°ÑÐ¸Ð² Â«Ð²Ð¸ÐºÐ¾Ð½Ð°Ð½Ð¾Â» Ñ– Ð¿Ð¾Ð²Ð½Ð¸Ð¹ Â«Ð²Ð¸ÐºÐ¾Ð½Ð°Ð½Ð°Â» â€” Ð¾Ð±Ð¸Ð´Ð²Ð° Ð¿Ñ–Ð´ÐºÑ€ÐµÑÐ»ÑŽÑŽÑ‚ÑŒ Ñ€ÐµÐ·ÑƒÐ»ÑŒÑ‚Ð°Ñ‚.\n\n2. Ð¯ÐºÑ– Ñ€ÐµÑ‡ÐµÐ½Ð½Ñ Ð¿Ñ€Ð°Ð²Ð¸Ð»ÑŒÐ½Ð¾ Ð¾Ð¿Ð¸ÑÑƒÑŽÑ‚ÑŒ Ð¿Ñ€Ð¾Ñ†ÐµÑ, Ñ‰Ð¾ Ñ‚Ñ€Ð¸Ð²Ð°Ñ”?\n   - [ ] Ð‘ÑƒÐ´Ð¸Ð½Ð¾Ðº Ð·Ð±ÑƒÐ´Ð¾Ð²Ð°Ð½Ð¾.\n   - [x] Ð‘ÑƒÐ´Ð¸Ð½Ð¾Ðº Ð±ÑƒÐ´ÑƒÑ”Ñ‚ÑŒÑÑ.\n   - [ ] Ð‘ÑƒÐ´Ð¸Ð½Ð¾Ðº Ð·Ð±ÑƒÐ´Ð¾Ð²Ð°Ð½Ð¸Ð¹.\n   - [x] ÐœÑ–ÑÑ‚ Ñ€ÐµÐ¼Ð¾Ð½Ñ‚ÑƒÑ”Ñ‚ÑŒÑÑ.\n   > Ð—Ð²Ð¾Ñ€Ð¾Ñ‚Ð½Ð¸Ð¹ Ð¿Ð°ÑÐ¸Ð² Â«Ð±ÑƒÐ´ÑƒÑ”Ñ‚ÑŒÑÑÂ», Â«Ñ€ÐµÐ¼Ð¾Ð½Ñ‚ÑƒÑ”Ñ‚ÑŒÑÑÂ» Ð¾Ð¿Ð¸ÑÑƒÑ” Ð¿Ñ€Ð¾Ñ†ÐµÑ.\n\n3. Ð¯ÐºÑ– ÐºÐ¾Ð½ÑÑ‚Ñ€ÑƒÐºÑ†Ñ–Ñ— Ð¿Ñ€Ð°Ð²Ð¸Ð»ÑŒÐ½Ñ– Ð´Ð»Ñ Ð¾Ñ„Ñ–Ñ†Ñ–Ð¹Ð½Ð¾Ð³Ð¾ Ð´Ð¾ÐºÑƒÐ¼ÐµÐ½Ñ‚Ð°?\n   - [x] Ð Ñ–ÑˆÐµÐ½Ð½Ñ Ð¿Ñ€Ð¸Ð¹Ð½ÑÑ‚Ð¾ Ð¾Ð´Ð½Ð¾Ð³Ð¾Ð»Ð¾ÑÐ½Ð¾.\n   - [x] Ð Ñ–ÑˆÐµÐ½Ð½Ñ Ð¿Ñ€Ð¸Ð¹Ð½ÑÑ‚Ðµ ÐºÐ¾Ð¼Ñ–ÑÑ–Ñ”ÑŽ.\n   - [ ] Ð Ñ–ÑˆÐµÐ½Ð½Ñ Ð¿Ñ€Ð¸Ð¹Ð¼Ð°Ñ”Ñ‚ÑŒÑÑ Ð²Ñ‡Ð¾Ñ€Ð°.\n   - [x] Ð‘ÑƒÐ»Ð¾ ÑƒÑ…Ð²Ð°Ð»ÐµÐ½Ð¾ Ð½Ð¾Ð²Ð¸Ð¹ Ð·Ð°ÐºÐ¾Ð½.\n   > ÐšÐ¾Ñ€Ð¾Ñ‚ÐºÐ¸Ð¹ Ñ– Ð¿Ð¾Ð²Ð½Ð¸Ð¹ Ð¿Ð°ÑÐ¸Ð² Ñ‚Ð¸Ð¿Ð¾Ð²Ñ– Ð´Ð»Ñ Ð¾Ñ„Ñ–Ñ†Ñ–Ð¹Ð½Ð¾Ð³Ð¾ ÑÑ‚Ð¸Ð»ÑŽ.\n\n4. Ð¯ÐºÑ– Ñ€ÐµÑ‡ÐµÐ½Ð½Ñ Ð¿Ñ€Ð°Ð²Ð¸Ð»ÑŒÐ½Ð¾ Ð¿ÐµÑ€ÐµÐ´Ð°ÑŽÑ‚ÑŒ Ð·Ð°Ð²ÐµÑ€ÑˆÐµÐ½Ñƒ Ð´Ñ–ÑŽ Ð· Ð²Ð¸ÐºÐ¾Ð½Ð°Ð²Ñ†ÐµÐ¼?\n   - [x] ÐšÐ½Ð¸Ð³Ð° Ð½Ð°Ð¿Ð¸ÑÐ°Ð½Ð° Ð²Ñ–Ð´Ð¾Ð¼Ð¸Ð¼ Ð°Ð²Ñ‚Ð¾Ñ€Ð¾Ð¼.\n   - [ ] ÐšÐ½Ð¸Ð³Ñƒ Ð½Ð°Ð¿Ð¸ÑÐ°Ð½Ð¾ Ð°Ð²Ñ‚Ð¾Ñ€Ð¾Ð¼ Ð²Ñ–Ð´Ð¾Ð¼Ð¸Ð¹.\n   - [x] ÐšÐ°Ñ€Ñ‚Ð¸Ð½Ð° Ð½Ð°Ð¼Ð°Ð»ÑŒÐ¾Ð²Ð°Ð½Ð° Ñ…ÑƒÐ´Ð¾Ð¶Ð½Ð¸ÐºÐ¾Ð¼.\n   - [ ] ÐšÐ°Ñ€Ñ‚Ð¸Ð½Ñƒ Ð½Ð°Ð¼Ð°Ð»ÑŒÐ¾Ð²Ð°Ð½Ð¾ Ñ…ÑƒÐ´Ð¾Ð¶Ð½Ð¸Ðº.\n   > ÐŸÐ¾Ð²Ð½Ð¸Ð¹ Ð¿Ð°ÑÐ¸Ð²: Ð¿Ñ–Ð´Ð¼ÐµÑ‚ + Ð´Ñ–Ñ”Ð¿Ñ€Ð¸ÐºÐ¼ÐµÑ‚Ð½Ð¸Ðº + Ð²Ð¸ÐºÐ¾Ð½Ð°Ð²ÐµÑ†ÑŒ Ð² Ð¾Ñ€ÑƒÐ´Ð½Ð¾Ð¼Ñƒ Ð²Ñ–Ð´Ð¼Ñ–Ð½ÐºÑƒ.\n\n5. Ð¯ÐºÑ– Ñ€ÐµÑ‡ÐµÐ½Ð½Ñ Ð³Ñ€Ð°Ð¼Ð°Ñ‚Ð¸Ñ‡Ð½Ð¾ Ð¿Ñ€Ð°Ð²Ð¸Ð»ÑŒÐ½Ñ– Ð´Ð»Ñ Ð¾Ð¿Ð¸ÑÑƒ Ñ€ÐµÐ³ÑƒÐ»ÑÑ€Ð½Ð¾Ñ— Ð´Ñ–Ñ—?\n   - [x] Ð¥Ð»Ñ–Ð± Ð²Ð¸Ð¿Ñ–ÐºÐ°Ñ”Ñ‚ÑŒÑÑ Ñ‰Ð¾Ñ€Ð°Ð½ÐºÑƒ Ð² Ð¿ÐµÐºÐ°Ñ€Ð½Ñ–.\n   - [ ] Ð¥Ð»Ñ–Ð± Ð²Ð¸Ð¿ÐµÑ‡ÐµÐ½Ð¾ Ñ‰Ð¾Ñ€Ð°Ð½ÐºÑƒ Ð² Ð¿ÐµÐºÐ°Ñ€Ð½Ñ–.\n   - [x] Ð“Ð°Ð·ÐµÑ‚Ð¸ Ð´Ñ€ÑƒÐºÑƒÑŽÑ‚ÑŒÑÑ Ñ‰Ð¾Ð´Ð½Ñ Ð¾ ÑˆÐ¾ÑÑ‚Ñ–Ð¹.\n   - [ ] Ð“Ð°Ð·ÐµÑ‚Ð¸ Ð½Ð°Ð´Ñ€ÑƒÐºÐ¾Ð²Ð°Ð½Ð¾ Ñ‰Ð¾Ð´Ð½Ñ Ð¾ ÑˆÐ¾ÑÑ‚Ñ–Ð¹.\n   > Ð—Ð²Ð¾Ñ€Ð¾Ñ‚Ð½Ð¸Ð¹ Ð¿Ð°ÑÐ¸Ð² Ð´Ð»Ñ Ñ€ÐµÐ³ÑƒÐ»ÑÑ€Ð½Ð¸Ñ… Ð¿Ñ€Ð¾Ñ†ÐµÑÑ–Ð²: Â«Ð²Ð¸Ð¿Ñ–ÐºÐ°Ñ”Ñ‚ÑŒÑÑÂ», Â«Ð´Ñ€ÑƒÐºÑƒÑŽÑ‚ÑŒÑÑÂ».\n\n6. Ð¯ÐºÑ– ÐºÐ¾Ð½ÑÑ‚Ñ€ÑƒÐºÑ†Ñ–Ñ— Ð· Ð´Ð°Ð²Ð°Ð»ÑŒÐ½Ð¸Ð¼ Ð²Ñ–Ð´Ð¼Ñ–Ð½ÐºÐ¾Ð¼ Ð¿Ñ€Ð°Ð²Ð¸Ð»ÑŒÐ½Ñ–?\n   - [x] ÐœÐµÐ½Ñ– Ð±ÑƒÐ»Ð¾ ÑÐºÐ°Ð·Ð°Ð½Ð¾ Ñ‡ÐµÐºÐ°Ñ‚Ð¸.\n   - [x] ÐÐ°Ð¼ Ð´Ð¾Ñ€ÑƒÑ‡ÐµÐ½Ð¾ Ñ†Ðµ Ð·Ð°Ð²Ð´Ð°Ð½Ð½Ñ.\n   - [ ] ÐœÐµÐ½Ðµ Ð±ÑƒÐ»Ð¾ ÑÐºÐ°Ð·Ð°Ð½Ð¾ Ñ‡ÐµÐºÐ°Ñ‚Ð¸.\n   - [ ] ÐÐ°Ñ Ð´Ð¾Ñ€ÑƒÑ‡ÐµÐ½Ð¾ Ñ†Ðµ Ð·Ð°Ð²Ð´Ð°Ð½Ð½Ñ.\n   > Ð”Ð°Ð²Ð°Ð»ÑŒÐ½Ð¸Ð¹ Ð²Ñ–Ð´Ð¼Ñ–Ð½Ð¾Ðº (Ð¼ÐµÐ½Ñ–, Ð½Ð°Ð¼) + ÐºÐ¾Ñ€Ð¾Ñ‚ÐºÐ¸Ð¹ Ð¿Ð°ÑÐ¸Ð².\n\n## translate: ÐŸÐµÑ€ÐµÐºÐ»Ð°Ð´Ñ–Ñ‚ÑŒ ÑƒÐºÑ€Ð°Ñ—Ð½ÑÑŒÐºÐ¾ÑŽ\n> ÐžÐ±ÐµÑ€Ñ–Ñ‚ÑŒ Ð¿Ñ€Ð°Ð²Ð¸Ð»ÑŒÐ½Ð¸Ð¹ Ð¿ÐµÑ€ÐµÐºÐ»Ð°Ð´ Ñ–Ð· Ð²Ð¸ÐºÐ¾Ñ€Ð¸ÑÑ‚Ð°Ð½Ð½ÑÐ¼ Ð¿Ð°ÑÐ¸Ð²Ð½Ð¾Ñ— ÐºÐ¾Ð½ÑÑ‚Ñ€ÑƒÐºÑ†Ñ–Ñ—.\n\n1. The book was written by a famous author.\n   - [x] ÐšÐ½Ð¸Ð³Ð° Ð½Ð°Ð¿Ð¸ÑÐ°Ð½Ð° Ð²Ñ–Ð´Ð¾Ð¼Ð¸Ð¼ Ð°Ð²Ñ‚Ð¾Ñ€Ð¾Ð¼.\n   - [ ] ÐšÐ½Ð¸Ð³Ñƒ Ð½Ð°Ð¿Ð¸ÑÐ°Ð½Ð¾ Ð°Ð²Ñ‚Ð¾Ñ€Ð¾Ð¼ Ð²Ñ–Ð´Ð¾Ð¼Ð¸Ð¹.\n   - [ ] ÐšÐ½Ð¸Ð³Ð° Ð¿Ð¸ÑˆÐµÑ‚ÑŒÑÑ Ð²Ñ–Ð´Ð¾Ð¼Ð¸Ð¼ Ð°Ð²Ñ‚Ð¾Ñ€Ð¾Ð¼.\n   - [ ] ÐšÐ½Ð¸Ð³Ð¸ Ð½Ð°Ð¿Ð¸ÑÐ°Ð½Ñ– Ð°Ð²Ñ‚Ð¾Ñ€Ð¾Ð¼ Ð²Ñ–Ð´Ð¾Ð¼Ð¾Ð¼Ñƒ.\n   > ÐŸÐ¾Ð²Ð½Ð¸Ð¹ Ð¿Ð°ÑÐ¸Ð² Ð· Ð²Ð¸ÐºÐ¾Ð½Ð°Ð²Ñ†ÐµÐ¼: Â«ÐšÐ½Ð¸Ð³Ð° Ð½Ð°Ð¿Ð¸ÑÐ°Ð½Ð° Ð°Ð²Ñ‚Ð¾Ñ€Ð¾Ð¼Â».\n\n2. A decision has been made.\n   - [ ] Ð Ñ–ÑˆÐµÐ½Ð½Ñ Ð¿Ñ€Ð¸Ð¹Ð¼Ð°Ñ”Ñ‚ÑŒÑÑ.\n   - [x] Ð Ñ–ÑˆÐµÐ½Ð½Ñ Ð¿Ñ€Ð¸Ð¹Ð½ÑÑ‚Ð¾.\n   - [ ] Ð Ñ–ÑˆÐµÐ½Ð½Ñ Ð¿Ñ€Ð¸Ð¹Ð½ÑÑ‚Ð¸Ð¹.\n   - [ ] Ð Ñ–ÑˆÐµÐ½Ð½Ñ Ð¿Ñ€Ð¸Ð¹Ð¼Ð°Ð»Ð¾ÑÑ.\n   > ÐšÐ¾Ñ€Ð¾Ñ‚ÐºÐ¸Ð¹ Ð¿Ð°ÑÐ¸Ð² Ð´Ð»Ñ Ñ€ÐµÐ·ÑƒÐ»ÑŒÑ‚Ð°Ñ‚Ñƒ: Â«Ð Ñ–ÑˆÐµÐ½Ð½Ñ Ð¿Ñ€Ð¸Ð¹Ð½ÑÑ‚Ð¾Â».\n\n3. Bread is baked every morning.\n   - [ ] Ð¥Ð»Ñ–Ð± Ð²Ð¸Ð¿ÐµÑ‡ÐµÐ½Ð¾ Ñ‰Ð¾Ñ€Ð°Ð½ÐºÑƒ.\n   - [ ] Ð¥Ð»Ñ–Ð± Ð²Ð¸Ð¿ÐµÑ‡ÐµÐ½Ð¸Ð¹ Ñ‰Ð¾Ñ€Ð°Ð½ÐºÑƒ.\n   - [x] Ð¥Ð»Ñ–Ð± Ð²Ð¸Ð¿Ñ–ÐºÐ°Ñ”Ñ‚ÑŒÑÑ Ñ‰Ð¾Ñ€Ð°Ð½ÐºÑƒ.\n   - [ ] Ð¥Ð»Ñ–Ð±Ð° Ð²Ð¸Ð¿Ñ–ÐºÐ°Ð½Ð¾ Ñ‰Ð¾Ñ€Ð°Ð½ÐºÑƒ.\n   > Ð—Ð²Ð¾Ñ€Ð¾Ñ‚Ð½Ð¸Ð¹ Ð¿Ð°ÑÐ¸Ð² Ð´Ð»Ñ Ñ€ÐµÐ³ÑƒÐ»ÑÑ€Ð½Ð¾Ð³Ð¾ Ð¿Ñ€Ð¾Ñ†ÐµÑÑƒ: Â«Ð¥Ð»Ñ–Ð± Ð²Ð¸Ð¿Ñ–ÐºÐ°Ñ”Ñ‚ÑŒÑÑÂ».\n\n4. The documents were prepared by the secretary.\n   - [ ] Ð”Ð¾ÐºÑƒÐ¼ÐµÐ½Ñ‚Ð¸ Ð³Ð¾Ñ‚ÑƒÑŽÑ‚ÑŒÑÑ ÑÐµÐºÑ€ÐµÑ‚Ð°Ñ€ÐµÐ¼.\n   - [x] Ð”Ð¾ÐºÑƒÐ¼ÐµÐ½Ñ‚Ð¸ Ð¿Ñ–Ð´Ð³Ð¾Ñ‚Ð¾Ð²Ð»ÐµÐ½Ñ– ÑÐµÐºÑ€ÐµÑ‚Ð°Ñ€ÐµÐ¼.\n   - [ ] Ð”Ð¾ÐºÑƒÐ¼ÐµÐ½Ñ‚Ñ–Ð² Ð¿Ñ–Ð´Ð³Ð¾Ñ‚Ð¾Ð²Ð»ÐµÐ½Ð¾ ÑÐµÐºÑ€ÐµÑ‚Ð°Ñ€ÐµÐ¼.\n   - [ ] Ð”Ð¾ÐºÑƒÐ¼ÐµÐ½Ñ‚Ð¸ Ð¿Ñ–Ð´Ð³Ð¾Ñ‚Ð¾Ð²Ð»ÐµÐ½Ð¸Ð¹ ÑÐµÐºÑ€ÐµÑ‚Ð°Ñ€ÐºÐ¾ÑŽ.\n   > ÐŸÐ¾Ð²Ð½Ð¸Ð¹ Ð¿Ð°ÑÐ¸Ð²: Â«Ð”Ð¾ÐºÑƒÐ¼ÐµÐ½Ñ‚Ð¸ Ð¿Ñ–Ð´Ð³Ð¾Ñ‚Ð¾Ð²Ð»ÐµÐ½Ñ– ÑÐµÐºÑ€ÐµÑ‚Ð°Ñ€ÐµÐ¼Â».\n\n5. The problem is being solved now.\n   - [ ] ÐŸÑ€Ð¾Ð±Ð»ÐµÐ¼Ñƒ Ð²Ð¸Ñ€Ñ–ÑˆÐµÐ½Ð¾ Ð·Ð°Ñ€Ð°Ð·.\n   - [ ] ÐŸÑ€Ð¾Ð±Ð»ÐµÐ¼Ð° Ð²Ð¸Ñ€Ñ–ÑˆÐµÐ½Ð° Ð·Ð°Ñ€Ð°Ð·.\n   - [x] ÐŸÑ€Ð¾Ð±Ð»ÐµÐ¼Ð° Ð²Ð¸Ñ€Ñ–ÑˆÑƒÑ”Ñ‚ÑŒÑÑ Ð·Ð°Ñ€Ð°Ð·.\n   - [ ] ÐŸÑ€Ð¾Ð±Ð»ÐµÐ¼Ð¸ Ð²Ð¸Ñ€Ñ–ÑˆÑƒÑŽÑ‚ÑŒÑÑ Ð·Ð°Ñ€Ð°Ð·.\n   > Ð—Ð²Ð¾Ñ€Ð¾Ñ‚Ð½Ð¸Ð¹ Ð¿Ð°ÑÐ¸Ð² Ð´Ð»Ñ Ð¿Ñ€Ð¾Ñ†ÐµÑÑƒ: Â«ÐŸÑ€Ð¾Ð±Ð»ÐµÐ¼Ð° Ð²Ð¸Ñ€Ñ–ÑˆÑƒÑ”Ñ‚ÑŒÑÑÂ».\n\n6. I was told to wait.\n   - [ ] Ð¯ ÑÐºÐ°Ð·Ð°Ð½Ð¸Ð¹ Ñ‡ÐµÐºÐ°Ñ‚Ð¸.\n   - [x] ÐœÐµÐ½Ñ– Ð±ÑƒÐ»Ð¾ ÑÐºÐ°Ð·Ð°Ð½Ð¾ Ñ‡ÐµÐºÐ°Ñ‚Ð¸.\n   - [ ] ÐœÐµÐ½Ðµ ÑÐºÐ°Ð·Ð°Ð½Ð¾ Ñ‡ÐµÐºÐ°Ñ‚Ð¸.\n   - [ ] ÐœÐ½Ð¾ÑŽ ÑÐºÐ°Ð·Ð°Ð½Ð¾ Ñ‡ÐµÐºÐ°Ñ‚Ð¸.\n   > Ð”Ð°Ð²Ð°Ð»ÑŒÐ½Ð¸Ð¹ Ð²Ñ–Ð´Ð¼Ñ–Ð½Ð¾Ðº + ÐºÐ¾Ñ€Ð¾Ñ‚ÐºÐ¸Ð¹ Ð¿Ð°ÑÐ¸Ð²: Â«ÐœÐµÐ½Ñ– Ð±ÑƒÐ»Ð¾ ÑÐºÐ°Ð·Ð°Ð½Ð¾Â».\n\n---\n\n# ÐŸÑ–Ð´ÑÑƒÐ¼Ð¾Ðº\n\n**Ð©Ð¾ Ð²Ð¸ Ð½Ð°Ð²Ñ‡Ð¸Ð»Ð¸ÑÑ:**\n\n1. Ð£ÐºÑ€Ð°Ñ—Ð½ÑÑŒÐºÐ° Ð¼Ð°Ñ” Ñ‚Ñ€Ð¸ Ñ‚Ð¸Ð¿Ð¸ Ð¿Ð°ÑÐ¸Ð²Ð½Ð¸Ñ… ÐºÐ¾Ð½ÑÑ‚Ñ€ÑƒÐºÑ†Ñ–Ð¹: Ð¿Ð¾Ð²Ð½Ð¸Ð¹ Ð¿Ð°ÑÐ¸Ð² (Ð· Ð´Ñ–Ñ”Ð¿Ñ€Ð¸ÐºÐ¼ÐµÑ‚Ð½Ð¸ÐºÐ¾Ð¼), ÐºÐ¾Ñ€Ð¾Ñ‚ÐºÐ¸Ð¹ Ð¿Ð°ÑÐ¸Ð² (-Ð½Ð¾/-Ñ‚Ð¾) Ñ‚Ð° Ð·Ð²Ð¾Ñ€Ð¾Ñ‚Ð½Ð¸Ð¹ Ð¿Ð°ÑÐ¸Ð² (-ÑÑ).\n2. ÐŸÐ¾Ð²Ð½Ð¸Ð¹ Ð¿Ð°ÑÐ¸Ð² Ð²Ð¸ÐºÐ¾Ñ€Ð¸ÑÑ‚Ð¾Ð²ÑƒÑ”Ñ‚ÑŒÑÑ, ÐºÐ¾Ð»Ð¸ Ð¿Ð¾Ñ‚Ñ€Ñ–Ð±Ð½Ð¾ Ð½Ð°Ð·Ð²Ð°Ñ‚Ð¸ Ð²Ð¸ÐºÐ¾Ð½Ð°Ð²Ñ†Ñ: Â«ÐšÐ½Ð¸Ð³Ð° Ð½Ð°Ð¿Ð¸ÑÐ°Ð½Ð° Ð°Ð²Ñ‚Ð¾Ñ€Ð¾Ð¼Â».\n3. ÐšÐ¾Ñ€Ð¾Ñ‚ÐºÐ¸Ð¹ Ð¿Ð°ÑÐ¸Ð² Ð¿Ñ–Ð´ÐºÑ€ÐµÑÐ»ÑŽÑ” Ñ€ÐµÐ·ÑƒÐ»ÑŒÑ‚Ð°Ñ‚ Ð±ÐµÐ· Ð²Ð¸ÐºÐ¾Ð½Ð°Ð²Ñ†Ñ: Â«ÐšÐ½Ð¸Ð³Ñƒ Ð½Ð°Ð¿Ð¸ÑÐ°Ð½Ð¾Â».\n4. Ð—Ð²Ð¾Ñ€Ð¾Ñ‚Ð½Ð¸Ð¹ Ð¿Ð°ÑÐ¸Ð² Ð¾Ð¿Ð¸ÑÑƒÑ” Ð¿Ñ€Ð¾Ñ†ÐµÑ: Â«ÐšÐ½Ð¸Ð³Ð° Ð¿Ð¸ÑˆÐµÑ‚ÑŒÑÑ ÑˆÐ²Ð¸Ð´ÐºÐ¾Â».\n5. ÐšÐ¾Ð¶ÐµÐ½ Ñ‚Ð¸Ð¿ Ð¼Ð°Ñ” ÑÐ²Ñ–Ð¹ ÑÑ‚Ð¸Ð»Ñ–ÑÑ‚Ð¸Ñ‡Ð½Ð¸Ð¹ Ð²Ñ–Ð´Ñ‚Ñ–Ð½Ð¾Ðº Ñ– ÑÑ„ÐµÑ€Ñƒ Ð²Ð¶Ð¸Ð²Ð°Ð½Ð½Ñ.\n\n**ÐžÑÐ½Ð¾Ð²Ð½Ðµ Ð¿Ñ€Ð°Ð²Ð¸Ð»Ð¾:**\n\n> ÐžÐ±Ð¸Ñ€Ð°Ð¹Ñ‚Ðµ Ñ‚Ð¸Ð¿ Ð¿Ð°ÑÐ¸Ð²Ñƒ Ð·Ð°Ð»ÐµÐ¶Ð½Ð¾ Ð²Ñ–Ð´ Ñ‚Ð¾Ð³Ð¾, Ñ‰Ð¾ Ð²Ð°Ð¶Ð»Ð¸Ð²Ñ–ÑˆÐµ: Ð²Ð¸ÐºÐ¾Ð½Ð°Ð²ÐµÑ†ÑŒ (Ð¿Ð¾Ð²Ð½Ð¸Ð¹ Ð¿Ð°ÑÐ¸Ð²), Ñ€ÐµÐ·ÑƒÐ»ÑŒÑ‚Ð°Ñ‚ (ÐºÐ¾Ñ€Ð¾Ñ‚ÐºÐ¸Ð¹ Ð¿Ð°ÑÐ¸Ð²) Ñ‡Ð¸ Ð¿Ñ€Ð¾Ñ†ÐµÑ (Ð·Ð²Ð¾Ñ€Ð¾Ñ‚Ð½Ð¸Ð¹ Ð¿Ð°ÑÐ¸Ð²).\n\n**Ð”Ð°Ð»Ñ–:**\n\nÐ£ Ð½Ð°ÑÑ‚ÑƒÐ¿Ð½Ð¾Ð¼Ñƒ Ð¼Ð¾Ð´ÑƒÐ»Ñ– Ð¼Ð¸ Ñ€Ð¾Ð·Ð³Ð»ÑÐ½ÐµÐ¼Ð¾ Ð´ÐµÐ¼Ñ–Ð½ÑƒÑ‚Ð¸Ð²Ð¸ (Ð¿ÐµÑÑ‚Ð»Ð¸Ð²Ñ– Ñ„Ð¾Ñ€Ð¼Ð¸) â€” Ð²Ð°Ð¶Ð»Ð¸Ð²Ð¸Ð¹ ÐµÐ»ÐµÐ¼ÐµÐ½Ñ‚ ÑƒÐºÑ€Ð°Ñ—Ð½ÑÑŒÐºÐ¾Ñ— Ð¼Ð¾Ð²Ð¸, ÑÐºÐ¸Ð¹ Ð²Ð¸Ñ€Ð°Ð¶Ð°Ñ” Ð½Ñ–Ð¶Ð½Ñ–ÑÑ‚ÑŒ, Ñ–Ñ€Ð¾Ð½Ñ–ÑŽ Ð°Ð±Ð¾ Ð²Ð²Ñ–Ñ‡Ð»Ð¸Ð²Ñ–ÑÑ‚ÑŒ.\n\n> âœ… **Ð¡Ð°Ð¼Ð¾Ð¿ÐµÑ€ÐµÐ²Ñ–Ñ€ÐºÐ°**\n>\n> Ð§Ð¸ Ð¼Ð¾Ð¶ÐµÑ‚Ðµ Ð²Ð¸:\n> - [ ] Ð Ð¾Ð·Ñ€Ñ–Ð·Ð½Ð¸Ñ‚Ð¸ Ñ‚Ñ€Ð¸ Ñ‚Ð¸Ð¿Ð¸ Ð¿Ð°ÑÐ¸Ð²Ð½Ð¸Ñ… ÐºÐ¾Ð½ÑÑ‚Ñ€ÑƒÐºÑ†Ñ–Ð¹?\n> - [ ] Ð¢Ñ€Ð°Ð½ÑÑ„Ð¾Ñ€Ð¼ÑƒÐ²Ð°Ñ‚Ð¸ Ð°ÐºÑ‚Ð¸Ð²Ð½Ðµ Ñ€ÐµÑ‡ÐµÐ½Ð½Ñ Ð² ÑƒÑÑ– Ñ‚Ñ€Ð¸ Ñ‚Ð¸Ð¿Ð¸ Ð¿Ð°ÑÐ¸Ð²Ñƒ?\n> - [ ] ÐžÐ±Ñ€Ð°Ñ‚Ð¸ Ð¿Ñ€Ð°Ð²Ð¸Ð»ÑŒÐ½Ð¸Ð¹ Ñ‚Ð¸Ð¿ Ð¿Ð°ÑÐ¸Ð²Ñƒ Ð·Ð°Ð»ÐµÐ¶Ð½Ð¾ Ð²Ñ–Ð´ ÐºÐ¾Ð½Ñ‚ÐµÐºÑÑ‚Ñƒ?\n> - [ ] Ð’Ð¸ÐºÐ¾Ñ€Ð¸ÑÑ‚Ð¾Ð²ÑƒÐ²Ð°Ñ‚Ð¸ Ð¿Ð°ÑÐ¸Ð² Ñƒ Ñ€Ñ–Ð·Ð½Ð¸Ñ… Ñ‡Ð°ÑÐ¾Ð²Ð¸Ñ… Ñ„Ð¾Ñ€Ð¼Ð°Ñ…?\n>\n> Ð¯ÐºÑ‰Ð¾ Ñ‚Ð°Ðº â€” Ð²Ð¸ Ð³Ð¾Ñ‚Ð¾Ð²Ñ– Ð´Ð¾ Ð¼Ð¾Ð´ÑƒÐ»Ñ Ð¿Ñ€Ð¾ Ð´ÐµÐ¼Ñ–Ð½ÑƒÑ‚Ð¸Ð²Ð¸!\n\n---\n\n# Ð¡Ð»Ð¾Ð²Ð½Ð¸Ðº\n\n| Ð¡Ð»Ð¾Ð²Ð¾ | ÐŸÐµÑ€ÐµÐºÐ»Ð°Ð´ | ÐŸÑ€Ð¸Ð¼Ñ–Ñ‚ÐºÐ¸ |\n|-------|----------|----------|\n| **Ð°Ð²Ñ‚Ð¾Ñ€** | author | Ñ‚Ð¾Ð¹, Ñ…Ñ‚Ð¾ ÑÑ‚Ð²Ð¾Ñ€Ð¸Ð² Ñ‚Ð²Ñ–Ñ€ |\n| **Ð²Ð¸ÐºÐ¾Ð½Ð°Ð²ÐµÑ†ÑŒ** | performer, executor | Ñ‚Ð¾Ð¹, Ñ…Ñ‚Ð¾ Ð²Ð¸ÐºÐ¾Ð½ÑƒÑ” Ð´Ñ–ÑŽ |\n| **Ñ‚Ð²Ð¾Ñ€ÐµÑ†ÑŒ** | creator | Ñ‚Ð¾Ð¹, Ñ…Ñ‚Ð¾ ÑÑ‚Ð²Ð¾Ñ€ÑŽÑ” |\n| **Ð·Ð°ÑÐ½Ð¾Ð²Ð½Ð¸Ðº** | founder | Ñ‚Ð¾Ð¹, Ñ…Ñ‚Ð¾ Ð·Ð°ÑÐ½ÑƒÐ²Ð°Ð² |\n| **Ñ–Ð½Ñ–Ñ†Ñ–Ð°Ñ‚Ð¾Ñ€** | initiator | Ñ‚Ð¾Ð¹, Ñ…Ñ‚Ð¾ Ñ–Ð½Ñ–Ñ†Ñ–ÑŽÑ” |\n| **Ð¾Ñ€Ð³Ð°Ð½Ñ–Ð·Ð°Ñ‚Ð¾Ñ€** | organizer | Ñ‚Ð¾Ð¹, Ñ…Ñ‚Ð¾ Ð¾Ñ€Ð³Ð°Ð½Ñ–Ð·Ð¾Ð²ÑƒÑ” |\n| **Ð²Ñ–Ð´Ð¿Ð¾Ð²Ñ–Ð´Ð°Ð»ÑŒÐ½Ð¸Ð¹** | responsible | Ñ‚Ð¾Ð¹, Ñ…Ñ‚Ð¾ Ð½ÐµÑÐµ Ð²Ñ–Ð´Ð¿Ð¾Ð²Ñ–Ð´Ð°Ð»ÑŒÐ½Ñ–ÑÑ‚ÑŒ |\n| **Ð¿Ñ€Ð¸Ñ‡ÐµÑ‚Ð½Ð¸Ð¹** | involved | Ñ‚Ð¾Ð¹, Ñ…Ñ‚Ð¾ Ð¼Ð°Ñ” Ð²Ñ–Ð´Ð½Ð¾ÑˆÐµÐ½Ð½Ñ |\n| **Ð·Ð°Ð»ÑƒÑ‡ÐµÐ½Ð¸Ð¹** | engaged, involved | Ñ‚Ð¾Ð¹, ÐºÐ¾Ð³Ð¾ Ð·Ð°Ð»ÑƒÑ‡Ð¸Ð»Ð¸ |\n| **Ð·Ð°Ð´Ñ–ÑÐ½Ð¸Ð¹** | employed, involved | Ñ‚Ð¾Ð¹, ÐºÐ¾Ð³Ð¾ Ð·Ð°Ð´Ñ–ÑÐ»Ð¸ |\n| **ÑƒÑ€Ð°Ð¶ÐµÐ½Ð¸Ð¹** | affected, struck | Ñ‚Ð¾Ð¹, ÐºÐ¾Ð³Ð¾ Ð²Ñ€Ð°Ð·Ð¸Ð»Ð¾ |\n| **Ð²Ñ€Ð°Ð¶ÐµÐ½Ð¸Ð¹** | impressed, amazed | Ñ‚Ð¾Ð¹, Ñ…Ñ‚Ð¾ Ð¿Ñ–Ð´ Ð²Ñ€Ð°Ð¶ÐµÐ½Ð½ÑÐ¼ |\n| **Ð·Ð²Ð¾Ñ€ÑƒÑˆÐµÐ½Ð¸Ð¹** | touched, moved | Ñ‚Ð¾Ð¹, ÐºÐ¾Ð³Ð¾ Ð·Ð²Ð¾Ñ€ÑƒÑˆÐ¸Ð»Ð¾ |\n| **Ð·Ð´Ð¸Ð²Ð¾Ð²Ð°Ð½Ð¸Ð¹** | surprised | Ñ‚Ð¾Ð¹, Ñ…Ñ‚Ð¾ Ð·Ð´Ð¸Ð²ÑƒÐ²Ð°Ð²ÑÑ |\n| **Ñ€Ð¾Ð·Ñ‡Ð°Ñ€Ð¾Ð²Ð°Ð½Ð¸Ð¹** | disappointed | Ñ‚Ð¾Ð¹, Ñ…Ñ‚Ð¾ Ñ€Ð¾Ð·Ñ‡Ð°Ñ€ÑƒÐ²Ð°Ð²ÑÑ |\n| **Ð·Ð°Ð´Ð¾Ð²Ð¾Ð»ÐµÐ½Ð¸Ð¹** | satisfied | Ñ‚Ð¾Ð¹, Ñ…Ñ‚Ð¾ Ð·Ð°Ð´Ð¾Ð²Ð¾Ð»ÐµÐ½Ð¸Ð¹ |\n| **ÑÑ‚ÑƒÑ€Ð±Ð¾Ð²Ð°Ð½Ð¸Ð¹** | worried, concerned | Ñ‚Ð¾Ð¹, Ñ…Ñ‚Ð¾ Ñ‚ÑƒÑ€Ð±ÑƒÑ”Ñ‚ÑŒÑÑ |\n| **Ð¿ÐµÑ€ÐµÐºÐ¾Ð½Ð°Ð½Ð¸Ð¹** | convinced | Ñ‚Ð¾Ð¹, ÐºÐ¾Ð³Ð¾ Ð¿ÐµÑ€ÐµÐºÐ¾Ð½Ð°Ð»Ð¸ |\n| **Ð·Ð¼ÑƒÑˆÐµÐ½Ð¸Ð¹** | forced, compelled | Ñ‚Ð¾Ð¹, ÐºÐ¾Ð³Ð¾ Ð·Ð¼ÑƒÑÐ¸Ð»Ð¸ |\n| **Ð·Ð¾Ð±Ð¾Ð²'ÑÐ·Ð°Ð½Ð¸Ð¹** | obliged | Ñ‚Ð¾Ð¹, Ñ…Ñ‚Ð¾ Ð¼Ð°Ñ” Ð¾Ð±Ð¾Ð²'ÑÐ·Ð¾Ðº |\n| **Ð¿Ð°ÑÐ¸Ð²Ð½Ð¸Ð¹ ÑÑ‚Ð°Ð½** | passive voice | Ð³Ñ€Ð°Ð¼Ð°Ñ‚Ð¸Ñ‡Ð½Ð° ÐºÐ°Ñ‚ÐµÐ³Ð¾Ñ€Ñ–Ñ |\n| **Ð°ÐºÑ‚Ð¸Ð²Ð½Ð¸Ð¹ ÑÑ‚Ð°Ð½** | active voice | Ð³Ñ€Ð°Ð¼Ð°Ñ‚Ð¸Ñ‡Ð½Ð° ÐºÐ°Ñ‚ÐµÐ³Ð¾Ñ€Ñ–Ñ |\n| **Ð·Ð²Ð¾Ñ€Ð¾Ñ‚Ð½Ð¸Ð¹ Ð¿Ð°ÑÐ¸Ð²** | reflexive passive | ÐºÐ¾Ð½ÑÑ‚Ñ€ÑƒÐºÑ†Ñ–Ñ Ð· -ÑÑ |\n| **Ð²Ð¸ÐºÐ¾Ð½Ð°Ð²ÐµÑ†ÑŒ Ð´Ñ–Ñ—** | agent | Ñ‚Ð¾Ð¹, Ñ…Ñ‚Ð¾ Ð²Ð¸ÐºÐ¾Ð½ÑƒÑ” Ð´Ñ–ÑŽ |\n| **Ð¾Ñ€ÑƒÐ´Ð½Ð¸Ð¹ Ð²Ñ–Ð´Ð¼Ñ–Ð½Ð¾Ðº** | instrumental case | Ð´Ð»Ñ Ð²Ð¸ÐºÐ¾Ð½Ð°Ð²Ñ†Ñ |\n| **Ñ‚Ñ€Ð°Ð½ÑÑ„Ð¾Ñ€Ð¼Ð°Ñ†Ñ–Ñ** | transformation | Ð·Ð¼Ñ–Ð½Ð° ÑÑ‚Ñ€ÑƒÐºÑ‚ÑƒÑ€Ð¸ Ñ€ÐµÑ‡ÐµÐ½Ð½Ñ |\n| **ÑƒÐ·Ð³Ð¾Ð´Ð¶ÐµÐ½Ð½Ñ** | agreement | Ð³Ñ€Ð°Ð¼Ð°Ñ‚Ð¸Ñ‡Ð½Ðµ ÑƒÐ·Ð³Ð¾Ð´Ð¶ÐµÐ½Ð½Ñ |\n| **Ð´Ð¾Ð´Ð°Ñ‚Ð¾Ðº** | object | Ð³Ñ€Ð°Ð¼Ð°Ñ‚Ð¸Ñ‡Ð½Ð¸Ð¹ Ñ‚ÐµÑ€Ð¼Ñ–Ð½ |\n| **Ð¿Ñ–Ð´Ð¼ÐµÑ‚** | subject | Ð³Ñ€Ð°Ð¼Ð°Ñ‚Ð¸Ñ‡Ð½Ð¸Ð¹ Ñ‚ÐµÑ€Ð¼Ñ–Ð½ |\n| **Ð¿Ñ€Ð¸ÑÑƒÐ´Ð¾Ðº** | predicate | Ð³Ñ€Ð°Ð¼Ð°Ñ‚Ð¸Ñ‡Ð½Ð¸Ð¹ Ñ‚ÐµÑ€Ð¼Ñ–Ð½ |\n| **Ð´Ñ–Ñ”Ð¿Ñ€Ð¸ÐºÐ¼ÐµÑ‚Ð½Ð¸Ðº** | participle | Ð´Ñ–Ñ”ÑÐ»Ñ–Ð²Ð½Ð° Ñ„Ð¾Ñ€Ð¼Ð° |\n| **Ð¿Ð¾Ð²Ð½Ð¸Ð¹ Ð¿Ð°ÑÐ¸Ð²** | full passive | Ð· Ð´Ñ–Ñ”Ð¿Ñ€Ð¸ÐºÐ¼ÐµÑ‚Ð½Ð¸ÐºÐ¾Ð¼ |\n| **ÐºÐ¾Ñ€Ð¾Ñ‚ÐºÐ¸Ð¹ Ð¿Ð°ÑÐ¸Ð²** | short passive | -Ð½Ð¾/-Ñ‚Ð¾ Ñ„Ð¾Ñ€Ð¼Ð° |\n| **Ñ€ÐµÐ·ÑƒÐ»ÑŒÑ‚Ð°Ñ‚** | result | Ð¿Ñ–Ð´ÐºÑ€ÐµÑÐ»ÑŽÑ”Ñ‚ÑŒÑÑ ÐºÐ¾Ñ€Ð¾Ñ‚ÐºÐ¸Ð¼ Ð¿Ð°ÑÐ¸Ð²Ð¾Ð¼ |\n| **Ð¿Ñ€Ð¾Ñ†ÐµÑ** | process | Ð¿Ñ–Ð´ÐºÑ€ÐµÑÐ»ÑŽÑ”Ñ‚ÑŒÑÑ Ð·Ð²Ð¾Ñ€Ð¾Ñ‚Ð½Ð¸Ð¼ Ð¿Ð°ÑÐ¸Ð²Ð¾Ð¼ |\n",
    "createdAt": "2025-12-25T23:07:04.437491Z",
    "modifiedAt": "2025-12-25T23:07:04.437491Z",
    "version": 2
  },
  "activities": [],
  "vocabulary": {
    "moduleId": "mod-uk-B1-47",
    "level": "B1",
    "phase": "B1.4 Advanced Grammar",
    "wordCount": 35,
    "newWordCount": 35,
    "reviewWordCount": 0,
    "transliterationMode": "none",
    "words": [
      {
        "id": "vocab-1",
        "uk": "**Ð°Ð²Ñ‚Ð¾Ñ€**",
        "ipa": "author",
        "en": "Ñ‚Ð¾Ð¹, Ñ…Ñ‚Ð¾ ÑÑ‚Ð²Ð¾Ñ€Ð¸Ð² Ñ‚Ð²Ñ–Ñ€",
        "pos": "",
        "gender": null,
        "note": ""
      },
      {
        "id": "vocab-2",
        "uk": "**Ð²Ð¸ÐºÐ¾Ð½Ð°Ð²ÐµÑ†ÑŒ**",
        "ipa": "performer, executor",
        "en": "Ñ‚Ð¾Ð¹, Ñ…Ñ‚Ð¾ Ð²Ð¸ÐºÐ¾Ð½ÑƒÑ” Ð´Ñ–ÑŽ",
        "pos": "",
        "gender": null,
        "note": ""
      },
      {
        "id": "vocab-3",
        "uk": "**Ñ‚Ð²Ð¾Ñ€ÐµÑ†ÑŒ**",
        "ipa": "creator",
        "en": "Ñ‚Ð¾Ð¹, Ñ…Ñ‚Ð¾ ÑÑ‚Ð²Ð¾Ñ€ÑŽÑ”",
        "pos": "",
        "gender": null,
        "note": ""
      },
      {
        "id": "vocab-4",
        "uk": "**Ð·Ð°ÑÐ½Ð¾Ð²Ð½Ð¸Ðº**",
        "ipa": "founder",
        "en": "Ñ‚Ð¾Ð¹, Ñ…Ñ‚Ð¾ Ð·Ð°ÑÐ½ÑƒÐ²Ð°Ð²",
        "pos": "",
        "gender": null,
        "note": ""
      },
      {
        "id": "vocab-5",
        "uk": "**Ñ–Ð½Ñ–Ñ†Ñ–Ð°Ñ‚Ð¾Ñ€**",
        "ipa": "initiator",
        "en": "Ñ‚Ð¾Ð¹, Ñ…Ñ‚Ð¾ Ñ–Ð½Ñ–Ñ†Ñ–ÑŽÑ”",
        "pos": "",
        "gender": null,
        "note": ""
      },
      {
        "id": "vocab-6",
        "uk": "**Ð¾Ñ€Ð³Ð°Ð½Ñ–Ð·Ð°Ñ‚Ð¾Ñ€**",
        "ipa": "organizer",
        "en": "Ñ‚Ð¾Ð¹, Ñ…Ñ‚Ð¾ Ð¾Ñ€Ð³Ð°Ð½Ñ–Ð·Ð¾Ð²ÑƒÑ”",
        "pos": "",
        "gender": null,
        "note": ""
      },
      {
        "id": "vocab-7",
        "uk": "**Ð²Ñ–Ð´Ð¿Ð¾Ð²Ñ–Ð´Ð°Ð»ÑŒÐ½Ð¸Ð¹**",
        "ipa": "responsible",
        "en": "Ñ‚Ð¾Ð¹, Ñ…Ñ‚Ð¾ Ð½ÐµÑÐµ Ð²Ñ–Ð´Ð¿Ð¾Ð²Ñ–Ð´Ð°Ð»ÑŒÐ½Ñ–ÑÑ‚ÑŒ",
        "pos": "",
        "gender": null,
        "note": ""
      },
      {
        "id": "vocab-8",
        "uk": "**Ð¿Ñ€Ð¸Ñ‡ÐµÑ‚Ð½Ð¸Ð¹**",
        "ipa": "involved",
        "en": "Ñ‚Ð¾Ð¹, Ñ…Ñ‚Ð¾ Ð¼Ð°Ñ” Ð²Ñ–Ð´Ð½Ð¾ÑˆÐµÐ½Ð½Ñ",
        "pos": "",
        "gender": null,
        "note": ""
      },
      {
        "id": "vocab-9",
        "uk": "**Ð·Ð°Ð»ÑƒÑ‡ÐµÐ½Ð¸Ð¹**",
        "ipa": "engaged, involved",
        "en": "Ñ‚Ð¾Ð¹, ÐºÐ¾Ð³Ð¾ Ð·Ð°Ð»ÑƒÑ‡Ð¸Ð»Ð¸",
        "pos": "",
        "gender": null,
        "note": ""
      },
      {
        "id": "vocab-10",
        "uk": "**Ð·Ð°Ð´Ñ–ÑÐ½Ð¸Ð¹**",
        "ipa": "employed, involved",
        "en": "Ñ‚Ð¾Ð¹, ÐºÐ¾Ð³Ð¾ Ð·Ð°Ð´Ñ–ÑÐ»Ð¸",
        "pos": "",
        "gender": null,
        "note": ""
      },
      {
        "id": "vocab-11",
        "uk": "**ÑƒÑ€Ð°Ð¶ÐµÐ½Ð¸Ð¹**",
        "ipa": "affected, struck",
        "en": "Ñ‚Ð¾Ð¹, ÐºÐ¾Ð³Ð¾ Ð²Ñ€Ð°Ð·Ð¸Ð»Ð¾",
        "pos": "",
        "gender": null,
        "note": ""
      },
      {
        "id": "vocab-12",
        "uk": "**Ð²Ñ€Ð°Ð¶ÐµÐ½Ð¸Ð¹**",
        "ipa": "impressed, amazed",
        "en": "Ñ‚Ð¾Ð¹, Ñ…Ñ‚Ð¾ Ð¿Ñ–Ð´ Ð²Ñ€Ð°Ð¶ÐµÐ½Ð½ÑÐ¼",
        "pos": "",
        "gender": null,
        "note": ""
      },
      {
        "id": "vocab-13",
        "uk": "**Ð·Ð²Ð¾Ñ€ÑƒÑˆÐµÐ½Ð¸Ð¹**",
        "ipa": "touched, moved",
        "en": "Ñ‚Ð¾Ð¹, ÐºÐ¾Ð³Ð¾ Ð·Ð²Ð¾Ñ€ÑƒÑˆÐ¸Ð»Ð¾",
        "pos": "",
        "gender": null,
        "note": ""
      },
      {
        "id": "vocab-14",
        "uk": "**Ð·Ð´Ð¸Ð²Ð¾Ð²Ð°Ð½Ð¸Ð¹**",
        "ipa": "surprised",
        "en": "Ñ‚Ð¾Ð¹, Ñ…Ñ‚Ð¾ Ð·Ð´Ð¸Ð²ÑƒÐ²Ð°Ð²ÑÑ",
        "pos": "",
        "gender": null,
        "note": ""
      },
      {
        "id": "vocab-15",
        "uk": "**Ñ€Ð¾Ð·Ñ‡Ð°Ñ€Ð¾Ð²Ð°Ð½Ð¸Ð¹**",
        "ipa": "disappointed",
        "en": "Ñ‚Ð¾Ð¹, Ñ…Ñ‚Ð¾ Ñ€Ð¾Ð·Ñ‡Ð°Ñ€ÑƒÐ²Ð°Ð²ÑÑ",
        "pos": "",
        "gender": null,
        "note": ""
      },
      {
        "id": "vocab-16",
        "uk": "**Ð·Ð°Ð´Ð¾Ð²Ð¾Ð»ÐµÐ½Ð¸Ð¹**",
        "ipa": "satisfied",
        "en": "Ñ‚Ð¾Ð¹, Ñ…Ñ‚Ð¾ Ð·Ð°Ð´Ð¾Ð²Ð¾Ð»ÐµÐ½Ð¸Ð¹",
        "pos": "",
        "gender": null,
        "note": ""
      },
      {
        "id": "vocab-17",
        "uk": "**ÑÑ‚ÑƒÑ€Ð±Ð¾Ð²Ð°Ð½Ð¸Ð¹**",
        "ipa": "worried, concerned",
        "en": "Ñ‚Ð¾Ð¹, Ñ…Ñ‚Ð¾ Ñ‚ÑƒÑ€Ð±ÑƒÑ”Ñ‚ÑŒÑÑ",
        "pos": "",
        "gender": null,
        "note": ""
      },
      {
        "id": "vocab-18",
        "uk": "**Ð¿ÐµÑ€ÐµÐºÐ¾Ð½Ð°Ð½Ð¸Ð¹**",
        "ipa": "convinced",
        "en": "Ñ‚Ð¾Ð¹, ÐºÐ¾Ð³Ð¾ Ð¿ÐµÑ€ÐµÐºÐ¾Ð½Ð°Ð»Ð¸",
        "pos": "",
        "gender": null,
        "note": ""
      },
      {
        "id": "vocab-19",
        "uk": "**Ð·Ð¼ÑƒÑˆÐµÐ½Ð¸Ð¹**",
        "ipa": "forced, compelled",
        "en": "Ñ‚Ð¾Ð¹, ÐºÐ¾Ð³Ð¾ Ð·Ð¼ÑƒÑÐ¸Ð»Ð¸",
        "pos": "",
        "gender": null,
        "note": ""
      },
      {
        "id": "vocab-20",
        "uk": "**Ð·Ð¾Ð±Ð¾Ð²'ÑÐ·Ð°Ð½Ð¸Ð¹**",
        "ipa": "obliged",
        "en": "Ñ‚Ð¾Ð¹, Ñ…Ñ‚Ð¾ Ð¼Ð°Ñ” Ð¾Ð±Ð¾Ð²'ÑÐ·Ð¾Ðº",
        "pos": "",
        "gender": null,
        "note": ""
      },
      {
        "id": "vocab-21",
        "uk": "**Ð¿Ð°ÑÐ¸Ð²Ð½Ð¸Ð¹ ÑÑ‚Ð°Ð½**",
        "ipa": "passive voice",
        "en": "Ð³Ñ€Ð°Ð¼Ð°Ñ‚Ð¸Ñ‡Ð½Ð° ÐºÐ°Ñ‚ÐµÐ³Ð¾Ñ€Ñ–Ñ",
        "pos": "",
        "gender": null,
        "note": ""
      },
      {
        "id": "vocab-22",
        "uk": "**Ð°ÐºÑ‚Ð¸Ð²Ð½Ð¸Ð¹ ÑÑ‚Ð°Ð½**",
        "ipa": "active voice",
        "en": "Ð³Ñ€Ð°Ð¼Ð°Ñ‚Ð¸Ñ‡Ð½Ð° ÐºÐ°Ñ‚ÐµÐ³Ð¾Ñ€Ñ–Ñ",
        "pos": "",
        "gender": null,
        "note": ""
      },
      {
        "id": "vocab-23",
        "uk": "**Ð·Ð²Ð¾Ñ€Ð¾Ñ‚Ð½Ð¸Ð¹ Ð¿Ð°ÑÐ¸Ð²**",
        "ipa": "reflexive passive",
        "en": "ÐºÐ¾Ð½ÑÑ‚Ñ€ÑƒÐºÑ†Ñ–Ñ Ð· -ÑÑ",
        "pos": "",
        "gender": null,
        "note": ""
      },
      {
        "id": "vocab-24",
        "uk": "**Ð²Ð¸ÐºÐ¾Ð½Ð°Ð²ÐµÑ†ÑŒ Ð´Ñ–Ñ—**",
        "ipa": "agent",
        "en": "Ñ‚Ð¾Ð¹, Ñ…Ñ‚Ð¾ Ð²Ð¸ÐºÐ¾Ð½ÑƒÑ” Ð´Ñ–ÑŽ",
        "pos": "",
        "gender": null,
        "note": ""
      },
      {
        "id": "vocab-25",
        "uk": "**Ð¾Ñ€ÑƒÐ´Ð½Ð¸Ð¹ Ð²Ñ–Ð´Ð¼Ñ–Ð½Ð¾Ðº**",
        "ipa": "instrumental case",
        "en": "Ð´Ð»Ñ Ð²Ð¸ÐºÐ¾Ð½Ð°Ð²Ñ†Ñ",
        "pos": "",
        "gender": null,
        "note": ""
      },
      {
        "id": "vocab-26",
        "uk": "**Ñ‚Ñ€Ð°Ð½ÑÑ„Ð¾Ñ€Ð¼Ð°Ñ†Ñ–Ñ**",
        "ipa": "transformation",
        "en": "Ð·Ð¼Ñ–Ð½Ð° ÑÑ‚Ñ€ÑƒÐºÑ‚ÑƒÑ€Ð¸ Ñ€ÐµÑ‡ÐµÐ½Ð½Ñ",
        "pos": "",
        "gender": null,
        "note": ""
      },
      {
        "id": "vocab-27",
        "uk": "**ÑƒÐ·Ð³Ð¾Ð´Ð¶ÐµÐ½Ð½Ñ**",
        "ipa": "agreement",
        "en": "Ð³Ñ€Ð°Ð¼Ð°Ñ‚Ð¸Ñ‡Ð½Ðµ ÑƒÐ·Ð³Ð¾Ð´Ð¶ÐµÐ½Ð½Ñ",
        "pos": "",
        "gender": null,
        "note": ""
      },
      {
        "id": "vocab-28",
        "uk": "**Ð´Ð¾Ð´Ð°Ñ‚Ð¾Ðº**",
        "ipa": "object",
        "en": "Ð³Ñ€Ð°Ð¼Ð°Ñ‚Ð¸Ñ‡Ð½Ð¸Ð¹ Ñ‚ÐµÑ€Ð¼Ñ–Ð½",
        "pos": "",
        "gender": null,
        "note": ""
      },
      {
        "id": "vocab-29",
        "uk": "**Ð¿Ñ–Ð´Ð¼ÐµÑ‚**",
        "ipa": "subject",
        "en": "Ð³Ñ€Ð°Ð¼Ð°Ñ‚Ð¸Ñ‡Ð½Ð¸Ð¹ Ñ‚ÐµÑ€Ð¼Ñ–Ð½",
        "pos": "",
        "gender": null,
        "note": ""
      },
      {
        "id": "vocab-30",
        "uk": "**Ð¿Ñ€Ð¸ÑÑƒÐ´Ð¾Ðº**",
        "ipa": "predicate",
        "en": "Ð³Ñ€Ð°Ð¼Ð°Ñ‚Ð¸Ñ‡Ð½Ð¸Ð¹ Ñ‚ÐµÑ€Ð¼Ñ–Ð½",
        "pos": "",
        "gender": null,
        "note": ""
      },
      {
        "id": "vocab-31",
        "uk": "**Ð´Ñ–Ñ”Ð¿Ñ€Ð¸ÐºÐ¼ÐµÑ‚Ð½Ð¸Ðº**",
        "ipa": "participle",
        "en": "Ð´Ñ–Ñ”ÑÐ»Ñ–Ð²Ð½Ð° Ñ„Ð¾Ñ€Ð¼Ð°",
        "pos": "",
        "gender": null,
        "note": ""
      },
      {
        "id": "vocab-32",
        "uk": "**Ð¿Ð¾Ð²Ð½Ð¸Ð¹ Ð¿Ð°ÑÐ¸Ð²**",
        "ipa": "full passive",
        "en": "Ð· Ð´Ñ–Ñ”Ð¿Ñ€Ð¸ÐºÐ¼ÐµÑ‚Ð½Ð¸ÐºÐ¾Ð¼",
        "pos": "",
        "gender": null,
        "note": ""
      },
      {
        "id": "vocab-33",
        "uk": "**ÐºÐ¾Ñ€Ð¾Ñ‚ÐºÐ¸Ð¹ Ð¿Ð°ÑÐ¸Ð²**",
        "ipa": "short passive",
        "en": "-Ð½Ð¾/-Ñ‚Ð¾ Ñ„Ð¾Ñ€Ð¼Ð°",
        "pos": "",
        "gender": null,
        "note": ""
      },
      {
        "id": "vocab-34",
        "uk": "**Ñ€ÐµÐ·ÑƒÐ»ÑŒÑ‚Ð°Ñ‚**",
        "ipa": "result",
        "en": "Ð¿Ñ–Ð´ÐºÑ€ÐµÑÐ»ÑŽÑ”Ñ‚ÑŒÑÑ ÐºÐ¾Ñ€Ð¾Ñ‚ÐºÐ¸Ð¼ Ð¿Ð°ÑÐ¸Ð²Ð¾Ð¼",
        "pos": "",
        "gender": null,
        "note": ""
      },
      {
        "id": "vocab-35",
        "uk": "**Ð¿Ñ€Ð¾Ñ†ÐµÑ**",
        "ipa": "process",
        "en": "Ð¿Ñ–Ð´ÐºÑ€ÐµÑÐ»ÑŽÑ”Ñ‚ÑŒÑÑ Ð·Ð²Ð¾Ñ€Ð¾Ñ‚Ð½Ð¸Ð¼ Ð¿Ð°ÑÐ¸Ð²Ð¾Ð¼",
        "pos": "",
        "gender": null,
        "note": ""
      }
    ],
    "reviewWords": []
  }
}