{
  "$schema": "../../../schemas/vibe-module.schema.json",
  "lesson": {
    "id": "lesson-uk-B1-37",
    "moduleId": "mod-uk-B1-37",
    "languagePair": "l2-uk-en",
    "subject": "language",
    "owner": "curricula-opus",
    "visibility": "public",
    "language": "uk",
    "targetLevel": "B1",
    "phase": "B1.3b Complex Sentences",
    "moduleNumber": 37,
    "moduleType": "grammar",
    "pedagogy": "TTT",
    "immersionLevel": 0.6,
    "title": "Ğ§Ğ°ÑĞ¾Ğ²Ñ– Ğ¿Ñ–Ğ´Ñ€ÑĞ´Ğ½Ñ– Ñ€ĞµÑ‡ĞµĞ½Ğ½Ñ",
    "titleUk": null,
    "subtitle": "Temporal Clauses Deep Dive",
    "description": "Learner can express Ñ‡Ğ°ÑĞ¾Ğ²Ñ– Ğ²Ñ–Ğ´Ğ½Ğ¾ÑˆĞµĞ½Ğ½Ñ using various temporal connectors",
    "objectives": [
      "Learner can express Ñ‡Ğ°ÑĞ¾Ğ²Ñ– Ğ²Ñ–Ğ´Ğ½Ğ¾ÑˆĞµĞ½Ğ½Ñ using various temporal connectors",
      "Learner can sequence events using appropriate temporal markers",
      "Learner can distinguish simultaneous vs sequential actions"
    ],
    "objectivesUk": null,
    "grammarFocus": [
      "Temporal clause constructions with ĞºĞ¾Ğ»Ğ¸, Ğ¿Ñ–ÑĞ»Ñ Ñ‚Ğ¾Ğ³Ğ¾ ÑĞº, Ğ¿Ğ¾ĞºĞ¸",
      "Sequence of events with Ğ¿ĞµÑ€Ñˆ Ğ½Ñ–Ğ¶, ÑĞº Ñ‚Ñ–Ğ»ÑŒĞºĞ¸"
    ],
    "tags": [
      "grammar",
      "complex-sentences",
      "temporal-clauses"
    ],
    "totalDuration": 90,
    "transliterationMode": "none",
    "sections": [
      {
        "id": "section-1",
        "name": "ĞŸÑ–Ğ´ÑÑƒĞ¼Ğ¾Ğº",
        "nameEn": null,
        "type": "summary",
        "content": "**Ğ©Ğ¾ Ğ²Ğ¸ Ğ½Ğ°Ğ²Ñ‡Ğ¸Ğ»Ğ¸ÑÑ:**\n\n1. **ĞĞ´Ğ½Ğ¾Ñ‡Ğ°ÑĞ½Ñ–ÑÑ‚ÑŒ:** ĞºĞ¾Ğ»Ğ¸, Ñƒ Ñ‚Ğ¾Ğ¹ Ñ‡Ğ°Ñ ÑĞº, Ğ¿Ğ¾ĞºĞ¸ â€” Ğ´Ñ–Ñ— Ğ²Ñ–Ğ´Ğ±ÑƒĞ²Ğ°ÑÑ‚ÑŒÑÑ Ğ¿Ğ°Ñ€Ğ°Ğ»ĞµĞ»ÑŒĞ½Ğ¾.\n2. **ĞŸĞ¾ÑĞ»Ñ–Ğ´Ğ¾Ğ²Ğ½Ñ–ÑÑ‚ÑŒ:** Ğ¿Ñ–ÑĞ»Ñ Ñ‚Ğ¾Ğ³Ğ¾ ÑĞº, ÑĞº Ñ‚Ñ–Ğ»ÑŒĞºĞ¸, Ñ‰Ğ¾Ğ¹Ğ½Ğ¾ â€” Ğ¾Ğ´Ğ½Ğ° Ğ´Ñ–Ñ Ğ¿Ñ–ÑĞ»Ñ Ñ–Ğ½ÑˆĞ¾Ñ—.\n3. **ĞŸĞ¾Ğ¿ĞµÑ€ĞµĞ´Ğ½Ñ–ÑÑ‚ÑŒ:** Ğ¿ĞµÑ€Ñˆ Ğ½Ñ–Ğ¶, Ğ´Ğ¾ Ñ‚Ğ¾Ğ³Ğ¾ ÑĞº â€” Ğ¾Ğ´Ğ½Ğ° Ğ´Ñ–Ñ Ğ¿ĞµÑ€ĞµĞ´ Ñ–Ğ½ÑˆĞ¾Ñ.\n4. **Ğ¢Ñ€Ğ¸Ğ²Ğ°Ğ»Ñ–ÑÑ‚ÑŒ:** Ğ¿Ğ¾ĞºĞ¸, Ğ´Ğ¾ĞºĞ¸, Ğ²ĞµÑÑŒ Ñ‡Ğ°Ñ â€” Ğ´Ñ–Ñ Ğ¾Ñ…Ğ¾Ğ¿Ğ»ÑÑ” Ğ¿ĞµÑ€Ñ–Ğ¾Ğ´.\n5. **Ğ ĞµĞ³ÑƒĞ»ÑÑ€Ğ½Ñ–ÑÑ‚ÑŒ:** ĞºĞ¾Ğ¶Ğ½Ğ¾Ğ³Ğ¾ Ñ€Ğ°Ğ·Ñƒ ĞºĞ¾Ğ»Ğ¸, Ñ‰Ğ¾Ñ€Ğ°Ğ·Ñƒ ÑĞº â€” Ğ¿Ğ¾Ğ²Ñ‚Ğ¾Ñ€ÑĞ²Ğ°Ğ½Ñ– Ğ´Ñ–Ñ—.\n\n**ĞÑĞ½Ğ¾Ğ²Ğ½Ğµ Ğ¿Ñ€Ğ°Ğ²Ğ¸Ğ»Ğ¾:**\n\n> Ğ§Ğ°ÑĞ¾Ğ²Ğ¸Ğ¹ ÑĞ¿Ğ¾Ğ»ÑƒÑ‡Ğ½Ğ¸Ğº Ğ²Ğ¸Ğ·Ğ½Ğ°Ñ‡Ğ°Ñ” Ğ²Ñ–Ğ´Ğ½Ğ¾ÑˆĞµĞ½Ğ½Ñ Ğ¼Ñ–Ğ¶ Ğ´Ñ–ÑĞ¼Ğ¸: Ğ¾Ğ´Ğ½Ğ¾Ñ‡Ğ°ÑĞ½Ñ–ÑÑ‚ÑŒ (ĞºĞ¾Ğ»Ğ¸), Ğ¿Ğ¾ÑĞ»Ñ–Ğ´Ğ¾Ğ²Ğ½Ñ–ÑÑ‚ÑŒ (Ğ¿Ñ–ÑĞ»Ñ Ñ‚Ğ¾Ğ³Ğ¾ ÑĞº), Ğ¿Ğ¾Ğ¿ĞµÑ€ĞµĞ´Ğ½Ñ–ÑÑ‚ÑŒ (Ğ¿ĞµÑ€Ñˆ Ğ½Ñ–Ğ¶). ĞĞ±Ğ¸Ñ€Ğ°Ğ¹Ñ‚Ğµ ÑĞ¿Ğ¾Ğ»ÑƒÑ‡Ğ½Ğ¸Ğº Ğ²Ñ–Ğ´Ğ¿Ğ¾Ğ²Ñ–Ğ´Ğ½Ğ¾ Ğ´Ğ¾ Ğ»Ğ¾Ğ³Ñ–ĞºĞ¸ Ğ¿Ğ¾Ğ´Ñ–Ğ¹!\n\n**Ğ”Ğ°Ğ»Ñ–:**\n\nĞ£ Ğ½Ğ°ÑÑ‚ÑƒĞ¿Ğ½Ğ¾Ğ¼Ñƒ Ğ¼Ğ¾Ğ´ÑƒĞ»Ñ– (Ğœ38) Ğ¼Ğ¸ Ñ€Ğ¾Ğ·Ğ³Ğ»ÑĞ½ĞµĞ¼Ğ¾ **Ñ–Ğ½Ñ‚ĞµĞ³Ñ€Ğ°Ñ†Ñ–Ñ Ğ²ÑÑ–Ñ… Ñ‚Ğ¸Ğ¿Ñ–Ğ² ÑĞºĞ»Ğ°Ğ´Ğ½Ğ¸Ñ… Ñ€ĞµÑ‡ĞµĞ½ÑŒ** Ñ‚Ğ° **Ğ¾Ğ´Ğ½Ğ¾ÑĞºĞ»Ğ°Ğ´Ğ½Ñ– Ñ€ĞµÑ‡ĞµĞ½Ğ½Ñ**. Ğ¦Ğµ Ğ´Ğ¾Ğ·Ğ²Ğ¾Ğ»Ğ¸Ñ‚ÑŒ Ğ²Ğ°Ğ¼ Ğ±ÑƒĞ´ÑƒĞ²Ğ°Ñ‚Ğ¸ ÑĞ¿Ñ€Ğ°Ğ²Ğ´Ñ– ÑĞºĞ»Ğ°Ğ´Ğ½Ñ– Ñ‚ĞµĞºÑÑ‚Ğ¸, Ğ¿Ğ¾Ñ”Ğ´Ğ½ÑƒÑÑ‡Ğ¸ Ğ¿Ñ€Ğ¸Ñ‡Ğ¸Ğ½Ğ¾Ğ²Ñ–, Ñ‡Ğ°ÑĞ¾Ğ²Ñ–, ÑƒĞ¼Ğ¾Ğ²Ğ½Ñ– Ñ‚Ğ° Ğ²Ñ–Ğ´Ğ½Ğ¾ÑĞ½Ñ– ĞºĞ¾Ğ½ÑÑ‚Ñ€ÑƒĞºÑ†Ñ–Ñ—!\n\n> âœ… **Ğ¡Ğ°Ğ¼Ğ¾Ğ¿ĞµÑ€ĞµĞ²Ñ–Ñ€ĞºĞ°**\n>\n> Ğ§Ğ¸ Ğ¼Ğ¾Ğ¶ĞµÑ‚Ğµ Ğ²Ğ¸:\n> - [ ] Ğ’Ğ¸ĞºĞ¾Ñ€Ğ¸ÑÑ‚Ğ°Ñ‚Ğ¸ Â«ĞºĞ¾Ğ»Ğ¸Â», Â«Ñƒ Ñ‚Ğ¾Ğ¹ Ñ‡Ğ°Ñ ÑĞºÂ» Ğ´Ğ»Ñ Ğ¾Ğ´Ğ½Ğ¾Ñ‡Ğ°ÑĞ½Ğ¸Ñ… Ğ´Ñ–Ğ¹?\n> - [ ] Ğ’Ğ¸ĞºĞ¾Ñ€Ğ¸ÑÑ‚Ğ°Ñ‚Ğ¸ Â«Ğ¿Ñ–ÑĞ»Ñ Ñ‚Ğ¾Ğ³Ğ¾ ÑĞºÂ», Â«ÑĞº Ñ‚Ñ–Ğ»ÑŒĞºĞ¸Â» Ğ´Ğ»Ñ Ğ¿Ğ¾ÑĞ»Ñ–Ğ´Ğ¾Ğ²Ğ½Ğ¸Ñ… Ğ´Ñ–Ğ¹?\n> - [ ] Ğ’Ğ¸ĞºĞ¾Ñ€Ğ¸ÑÑ‚Ğ°Ñ‚Ğ¸ Â«Ğ¿ĞµÑ€Ñˆ Ğ½Ñ–Ğ¶Â», Â«Ğ´Ğ¾ Ñ‚Ğ¾Ğ³Ğ¾ ÑĞºÂ» Ğ´Ğ»Ñ Ğ¿Ğ¾Ğ¿ĞµÑ€ĞµĞ´Ğ½Ñ–Ñ… Ğ´Ñ–Ğ¹?\n> - [ ] ĞŸÑ€Ğ°Ğ²Ğ¸Ğ»ÑŒĞ½Ğ¾ Ğ·Ğ°ÑÑ‚Ğ¾ÑÑƒĞ²Ğ°Ñ‚Ğ¸ Â«Ğ¿Ğ¾ĞºĞ¸ Ğ½ĞµÂ» Ğ· Ğ·Ğ°Ğ¿ĞµÑ€ĞµÑ‡ĞµĞ½Ğ½ÑĞ¼?\n>\n> Ğ¯ĞºÑ‰Ğ¾ Ñ‚Ğ°Ğº â€” Ğ¿ĞµÑ€ĞµÑ…Ğ¾Ğ´ÑŒÑ‚Ğµ Ğ´Ğ¾ Ğ²Ğ¿Ñ€Ğ°Ğ²!\n\n---\n\n> [!resources] ğŸ§ Ğ—Ğ¾Ğ²Ğ½Ñ–ÑˆĞ½Ñ– Ñ€ĞµÑÑƒÑ€ÑĞ¸\n>\n> **Ğ”Ğ¾Ğ´Ğ°Ñ‚ĞºĞ¾Ğ²Ñ– Ğ¼Ğ°Ñ‚ĞµÑ€Ñ–Ğ°Ğ»Ğ¸ Ğ´Ğ»Ñ Ğ²Ğ¸Ğ²Ñ‡ĞµĞ½Ğ½Ñ:**\n> - ğŸ“– [Ğ§Ğ°ÑĞ¾Ğ²Ñ– ÑĞ¿Ğ¾Ğ»ÑƒÑ‡Ğ½Ğ¸ĞºĞ¸](https://uk.wikipedia.org/wiki/Ğ¡Ğ¿Ğ¾Ğ»ÑƒÑ‡Ğ½Ğ¸Ğº) â€” Ğ’Ñ–ĞºÑ–Ğ¿ĞµĞ´Ñ–Ñ\n> - ğŸ“º [Ukrainian Grammar](https://www.youtube.com/@ukrainianlesson) â€” Ğ²Ñ–Ğ´ĞµĞ¾ÑƒÑ€Ğ¾ĞºĞ¸\n> - ğŸ§ [Ukrainian Lessons Podcast](https://ukrainianlessons.com/) â€” Ğ¿Ğ¾Ğ´ĞºĞ°ÑÑ‚ Ğ´Ğ»Ñ Ğ²Ğ¸Ğ²Ñ‡ĞµĞ½Ğ½Ñ\n\n---"
      },
      {
        "id": "section-2",
        "name": "Ğ’Ğ¿Ñ€Ğ°Ğ²Ğ¸",
        "nameEn": null,
        "type": "activities",
        "content": "## quiz: Ğ’Ğ¸Ğ±ĞµÑ€Ñ–Ñ‚ÑŒ Ğ¿Ñ€Ğ°Ğ²Ğ¸Ğ»ÑŒĞ½Ñƒ Ğ²Ñ–Ğ´Ğ¿Ğ¾Ğ²Ñ–Ğ´ÑŒ\n\n1. Ğ¯ĞºĞ¸Ğ¹ ÑĞ¿Ğ¾Ğ»ÑƒÑ‡Ğ½Ğ¸Ğº Ğ²Ğ¸ĞºĞ¾Ñ€Ğ¸ÑÑ‚Ğ¾Ğ²ÑƒÑ”Ñ‚ÑŒÑÑ Ğ´Ğ»Ñ Ğ²Ğ¸Ñ€Ğ°Ğ¶ĞµĞ½Ğ½Ñ Ğ¾Ğ´Ğ½Ğ¾Ñ‡Ğ°ÑĞ½Ğ¸Ñ… Ğ´Ñ–Ğ¹, Ñ‰Ğ¾ Ğ²Ñ–Ğ´Ğ±ÑƒĞ²Ğ°ÑÑ‚ÑŒÑÑ Ğ¿Ğ°Ñ€Ğ°Ğ»ĞµĞ»ÑŒĞ½Ğ¾ Ñƒ Ñ‡Ğ°ÑÑ–?\n   - [x] Ñƒ Ñ‚Ğ¾Ğ¹ Ñ‡Ğ°Ñ ÑĞº\n   - [ ] Ğ¿Ñ–ÑĞ»Ñ Ñ‚Ğ¾Ğ³Ğ¾ ÑĞº\n   - [ ] Ğ¿ĞµÑ€Ñˆ Ğ½Ñ–Ğ¶\n   - [ ] ÑĞº Ñ‚Ñ–Ğ»ÑŒĞºĞ¸\n   > Â«Ğ£ Ñ‚Ğ¾Ğ¹ Ñ‡Ğ°Ñ ÑĞºÂ» Ğ²Ğ¸Ñ€Ğ°Ğ¶Ğ°Ñ” Ğ¿Ğ°Ñ€Ğ°Ğ»ĞµĞ»ÑŒĞ½Ñ–ÑÑ‚ÑŒ Ğ´Ñ–Ğ¹.\n\n2. Ğ¯ĞºĞµ Ğ· Ğ½Ğ°Ğ²ĞµĞ´ĞµĞ½Ğ¸Ñ… Ñ€ĞµÑ‡ĞµĞ½ÑŒ Ğ¿Ñ€Ğ°Ğ²Ğ¸Ğ»ÑŒĞ½Ğ¾ Ğ²Ğ¸Ñ€Ğ°Ğ¶Ğ°Ñ” Ğ¿Ğ¾ÑĞ»Ñ–Ğ´Ğ¾Ğ²Ğ½Ñ–ÑÑ‚ÑŒ Ğ¿Ğ¾Ğ´Ñ–Ğ¹ Ğ· Ğ²Ğ¸ĞºĞ¾Ñ€Ğ¸ÑÑ‚Ğ°Ğ½Ğ½ÑĞ¼ ÑĞ¿Ğ¾Ğ»ÑƒÑ‡Ğ½Ğ¸ĞºĞ° Ñ‡Ğ°ÑÑƒ?\n   - [ ] ĞšĞ¾Ğ»Ğ¸ Ğ²Ñ–Ğ½ Ğ¿Ñ€Ğ¸Ğ¹ÑˆĞ¾Ğ², Ğ¼Ğ¸ Ğ³Ğ¾Ğ²Ğ¾Ñ€Ğ¸Ğ»Ğ¸.\n   - [x] ĞŸÑ–ÑĞ»Ñ Ñ‚Ğ¾Ğ³Ğ¾ ÑĞº Ğ²Ñ–Ğ½ Ğ¿Ñ–ÑˆĞ¾Ğ², Ğ¼Ğ¸ Ğ¿Ñ€Ğ¾Ğ´Ğ¾Ğ²Ğ¶Ğ¸Ğ»Ğ¸ Ñ€Ğ¾Ğ·Ğ¼Ğ¾Ğ²Ñƒ.\n   - [ ] ĞŸĞ¾ĞºĞ¸ Ğ²Ğ¾Ğ½Ğ° Ğ³Ğ¾Ñ‚ÑƒĞ²Ğ°Ğ»Ğ°, Ğ²Ñ–Ğ½ Ñ‡Ğ¸Ñ‚Ğ°Ğ² Ğ³Ğ°Ğ·ĞµÑ‚Ñƒ.\n   - [ ] Ğ£ Ñ‚Ğ¾Ğ¹ Ñ‡Ğ°Ñ ÑĞº Ğ±Ğ°Ñ‚ÑŒĞºĞ¸ Ğ²Ñ–Ğ´Ğ¿Ğ¾Ñ‡Ğ¸Ğ²Ğ°Ğ»Ğ¸, Ğ´Ñ–Ñ‚Ğ¸ Ğ³Ñ€Ğ°Ğ»Ğ¸ÑÑ.\n   > Â«ĞŸÑ–ÑĞ»Ñ Ñ‚Ğ¾Ğ³Ğ¾ ÑĞºÂ» Ğ²Ğ¸Ñ€Ğ°Ğ¶Ğ°Ñ” Ğ¿Ğ¾ÑĞ»Ñ–Ğ´Ğ¾Ğ²Ğ½Ñ–ÑÑ‚ÑŒ: ÑĞ¿Ğ¾Ñ‡Ğ°Ñ‚ĞºÑƒ Ğ¾Ğ´Ğ½Ğ° Ğ´Ñ–Ñ, Ğ¿Ğ¾Ñ‚Ñ–Ğ¼ Ñ–Ğ½ÑˆĞ°.\n\n3. Ğ¯ĞºĞ¸Ğ¹ ÑĞ¿Ğ¾Ğ»ÑƒÑ‡Ğ½Ğ¸Ğº Ğ²Ğ¸ĞºĞ¾Ñ€Ğ¸ÑÑ‚Ğ¾Ğ²ÑƒÑ”Ñ‚ÑŒÑÑ Ğ´Ğ»Ñ Ğ²Ğ¸Ñ€Ğ°Ğ¶ĞµĞ½Ğ½Ñ Ğ´Ñ–Ñ—, ÑĞºĞ° Ğ²Ñ–Ğ´Ğ±ÑƒĞ²Ğ°Ñ”Ñ‚ÑŒÑÑ Ğ±ĞµĞ·Ğ¿Ğ¾ÑĞµÑ€ĞµĞ´Ğ½ÑŒĞ¾ Ğ¿ĞµÑ€ĞµĞ´ Ñ–Ğ½ÑˆĞ¾Ñ Ğ´Ñ–Ñ”Ñ?\n   - [ ] Ğ¿Ñ–ÑĞ»Ñ Ñ‚Ğ¾Ğ³Ğ¾ ÑĞº\n   - [ ] ÑĞº Ñ‚Ñ–Ğ»ÑŒĞºĞ¸\n   - [x] Ğ¿ĞµÑ€Ñˆ Ğ½Ñ–Ğ¶\n   - [ ] Ğ²Ñ–Ğ´Ñ‚Ğ¾Ğ´Ñ– ÑĞº\n   > Â«ĞŸĞµÑ€Ñˆ Ğ½Ñ–Ğ¶Â» = Ğ´Ğ¾ Ñ‚Ğ¾Ğ³Ğ¾, ÑĞº.\n\n4. Ğ¯Ğº Ğ¿Ñ€Ğ°Ğ²Ğ¸Ğ»ÑŒĞ½Ğ¾ Ğ·Ğ°Ğ²ĞµÑ€ÑˆĞ¸Ñ‚Ğ¸ Ñ€ĞµÑ‡ĞµĞ½Ğ½Ñ Ğ· Ğ²Ğ¸ĞºĞ¾Ñ€Ğ¸ÑÑ‚Ğ°Ğ½Ğ½ÑĞ¼ Ñ‡Ğ°ÑĞ¾Ğ²Ğ¾Ğ³Ğ¾ ÑĞ¿Ğ¾Ğ»ÑƒÑ‡Ğ½Ğ¸ĞºĞ°: Â«Ğ§ĞµĞºĞ°Ğ¹ Ñ‚ÑƒÑ‚, Ğ¿Ğ¾ĞºĞ¸ Ñ ___Â»?\n   - [ ] Ğ¿Ñ€Ğ¸Ğ¹Ğ´Ñƒ\n   - [x] Ğ½Ğµ Ğ¿Ñ€Ğ¸Ğ¹Ğ´Ñƒ\n   - [ ] Ğ¿Ñ€Ğ¸Ñ…Ğ¾Ğ´Ğ¶Ñƒ\n   - [ ] Ğ¿Ñ€Ğ¸Ñ…Ğ¾Ğ´Ğ¸Ğ²\n   > Â«ĞŸĞ¾ĞºĞ¸ Ğ½ĞµÂ» Ğ²Ğ¸Ğ¼Ğ°Ğ³Ğ°Ñ” Ğ·Ğ°Ğ¿ĞµÑ€ĞµÑ‡ĞµĞ½Ğ½Ñ.\n\n5. Ğ¯ĞºĞ¸Ğ¹ ÑĞ¿Ğ¾Ğ»ÑƒÑ‡Ğ½Ğ¸Ğº Ğ½Ğ°Ğ¹ĞºÑ€Ğ°Ñ‰Ğµ Ğ¿ĞµÑ€ĞµĞ´Ğ°Ñ” Ñ–Ğ´ĞµÑ Ğ¼Ğ¸Ñ‚Ñ‚Ñ”Ğ²Ğ¾Ñ— Ñ€ĞµĞ°ĞºÑ†Ñ–Ñ— Ğ½Ğ° Ğ¿Ğ¾Ğ´Ñ–Ñ Ğ² ÑƒĞºÑ€Ğ°Ñ—Ğ½ÑÑŒĞºÑ–Ğ¹ Ğ¼Ğ¾Ğ²Ñ–?\n   - [ ] ĞºĞ¾Ğ»Ğ¸\n   - [ ] Ğ¿Ğ¾ĞºĞ¸\n   - [x] ÑĞº Ñ‚Ñ–Ğ»ÑŒĞºĞ¸\n   - [ ] Ğ² Ğ¼Ñ–Ñ€Ñƒ Ñ‚Ğ¾Ğ³Ğ¾ ÑĞº\n   > Â«Ğ¯Ğº Ñ‚Ñ–Ğ»ÑŒĞºĞ¸Â» Ğ²Ğ¸Ñ€Ğ°Ğ¶Ğ°Ñ” Ğ½ĞµĞ³Ğ°Ğ¹Ğ½Ñƒ Ñ€ĞµĞ°ĞºÑ†Ñ–Ñ.\n\n6. Ğ¯ĞºĞµ Ğ· Ğ½Ğ°Ğ²ĞµĞ´ĞµĞ½Ğ¸Ñ… Ñ€ĞµÑ‡ĞµĞ½ÑŒ Ğ¼Ñ–ÑÑ‚Ğ¸Ñ‚ÑŒ Ñ‡Ğ°ÑĞ¾Ğ²Ğ¸Ğ¹ ÑĞ¿Ğ¾Ğ»ÑƒÑ‡Ğ½Ğ¸Ğº, Ñ‰Ğ¾ Ğ²Ğ¸Ñ€Ğ°Ğ¶Ğ°Ñ” Ñ€ĞµĞ³ÑƒĞ»ÑÑ€Ğ½Ñ–ÑÑ‚ÑŒ Ğ¿Ğ¾Ğ²Ñ‚Ğ¾Ñ€ÑĞ²Ğ°Ğ½Ğ¸Ñ… Ğ¿Ğ¾Ğ´Ñ–Ğ¹?\n   - [ ] ĞšĞ¾Ğ»Ğ¸ Ğ²Ñ–Ğ½ Ğ¿Ñ€Ğ¸Ğ¹ÑˆĞ¾Ğ², Ğ¼Ğ¸ Ğ¾Ğ±Ñ–Ğ´Ğ°Ğ»Ğ¸.\n   - [ ] ĞŸÑ–ÑĞ»Ñ Ñ‚Ğ¾Ğ³Ğ¾ ÑĞº Ğ¿Ñ–ÑˆĞ¾Ğ² Ğ´Ğ¾Ñ‰, Ğ·'ÑĞ²Ğ¸Ğ»Ğ°ÑÑŒ Ğ²ĞµÑĞµĞ»ĞºĞ°.\n   - [x] ĞšĞ¾Ğ¶Ğ½Ğ¾Ğ³Ğ¾ Ñ€Ğ°Ğ·Ñƒ ĞºĞ¾Ğ»Ğ¸ Ğ²Ñ–Ğ½ Ğ¿Ñ€Ğ¸Ñ…Ğ¾Ğ´Ğ¸Ñ‚ÑŒ, Ğ¿Ñ€Ğ¸Ğ½Ğ¾ÑĞ¸Ñ‚ÑŒ ĞºĞ²Ñ–Ñ‚Ğ¸.\n   - [ ] ĞŸĞµÑ€Ñˆ Ğ½Ñ–Ğ¶ Ğ¿Ñ–Ñ‚Ğ¸, Ğ²Ñ–Ğ½ Ğ¿Ğ¾Ğ¿Ñ€Ğ¾Ñ‰Ğ°Ğ²ÑÑ Ğ· ÑƒÑÑ–Ğ¼Ğ°.\n   > Â«ĞšĞ¾Ğ¶Ğ½Ğ¾Ğ³Ğ¾ Ñ€Ğ°Ğ·Ñƒ ĞºĞ¾Ğ»Ğ¸Â» Ğ²Ğ¸Ñ€Ğ°Ğ¶Ğ°Ñ” Ñ€ĞµĞ³ÑƒĞ»ÑÑ€Ğ½Ñ–ÑÑ‚ÑŒ.\n\n7. Ğ¯ĞºĞ¸Ğ¹ ÑĞ¿Ğ¾Ğ»ÑƒÑ‡Ğ½Ğ¸Ğº Ğ²Ğ¸ĞºĞ¾Ñ€Ğ¸ÑÑ‚Ğ¾Ğ²ÑƒÑ”Ñ‚ÑŒÑÑ Ğ´Ğ»Ñ Ğ²Ğ¸Ñ€Ğ°Ğ¶ĞµĞ½Ğ½Ñ Ğ´Ñ–Ñ—, ÑĞºĞ° Ñ‚Ñ€Ğ¸Ğ²Ğ°Ñ” Ğ¿Ñ€Ğ¾Ñ‚ÑĞ³Ğ¾Ğ¼ ÑƒÑÑŒĞ¾Ğ³Ğ¾ Ğ¿ĞµÑ€Ñ–Ğ¾Ğ´Ñƒ Ñ–Ğ½ÑˆĞ¾Ñ— Ğ´Ñ–Ñ—?\n   - [ ] ÑĞº Ñ‚Ñ–Ğ»ÑŒĞºĞ¸\n   - [x] Ğ¿Ğ¾ĞºĞ¸\n   - [ ] Ñ‰Ğ¾Ğ¹Ğ½Ğ¾\n   - [ ] Ğ¿Ñ–ÑĞ»Ñ Ñ‚Ğ¾Ğ³Ğ¾ ÑĞº\n   > Â«ĞŸĞ¾ĞºĞ¸Â» Ğ²Ğ¸Ñ€Ğ°Ğ¶Ğ°Ñ” Ñ‚Ñ€Ğ¸Ğ²Ğ°Ğ»Ñ–ÑÑ‚ÑŒ.\n\n8. Ğ¯ĞºĞ° Ğ¾ÑĞ½Ğ¾Ğ²Ğ½Ğ° Ğ²Ñ–Ğ´Ğ¼Ñ–Ğ½Ğ½Ñ–ÑÑ‚ÑŒ Ğ¼Ñ–Ğ¶ ÑĞ¿Ğ¾Ğ»ÑƒÑ‡Ğ½Ğ¸ĞºĞ°Ğ¼Ğ¸ Â«Ñ‰Ğ¾Ğ¹Ğ½Ğ¾Â» Ñ‚Ğ° Â«Ğ· Ñ‚Ğ¸Ñ… Ğ¿Ñ–Ñ€ ÑĞºÂ» Ñƒ Ğ²Ğ¸Ñ€Ğ°Ğ¶ĞµĞ½Ğ½Ñ– Ñ‡Ğ°ÑĞ¾Ğ²Ğ¸Ñ… Ğ²Ñ–Ğ´Ğ½Ğ¾ÑˆĞµĞ½ÑŒ?\n   - [x] Â«Ğ©Ğ¾Ğ¹Ğ½Ğ¾Â» â€” Ğ¼Ğ¸Ñ‚Ñ‚Ñ”Ğ²Ñ–ÑÑ‚ÑŒ, Â«Ğ· Ñ‚Ğ¸Ñ… Ğ¿Ñ–Ñ€ ÑĞºÂ» â€” Ñ‚Ñ€Ğ¸Ğ²Ğ°Ğ»Ñ–ÑÑ‚ÑŒ Ğ²Ñ–Ğ´ Ğ¼Ğ¸Ğ½ÑƒĞ»Ğ¾Ğ³Ğ¾\n   - [ ] ĞĞµĞ¼Ğ°Ñ” Ğ²Ñ–Ğ´Ğ¼Ñ–Ğ½Ğ½Ğ¾ÑÑ‚Ñ–, Ğ²Ğ¾Ğ½Ğ¸ ÑĞ¸Ğ½Ğ¾Ğ½Ñ–Ğ¼Ğ¸.\n   - [ ] Â«Ğ©Ğ¾Ğ¹Ğ½Ğ¾Â» â€” ĞºĞ½Ğ¸Ğ¶Ğ½Ğ¸Ğ¹, Â«Ğ· Ñ‚Ğ¸Ñ… Ğ¿Ñ–Ñ€ ÑĞºÂ» â€” Ñ€Ğ¾Ğ·Ğ¼Ğ¾Ğ²Ğ½Ğ¸Ğ¹.\n   - [ ] Â«Ğ©Ğ¾Ğ¹Ğ½Ğ¾Â» â€” Ğ¼Ğ°Ğ¹Ğ±ÑƒÑ‚Ğ½Ñ”, Â«Ğ· Ñ‚Ğ¸Ñ… Ğ¿Ñ–Ñ€ ÑĞºÂ» â€” Ğ¼Ğ¸Ğ½ÑƒĞ»Ğµ.\n   > Â«Ğ©Ğ¾Ğ¹Ğ½Ğ¾Â» = Ğ»ĞµĞ´Ğ²Ğµ, Ñ‚Ñ–Ğ»ÑŒĞºĞ¸-Ğ½Ğ¾; Â«Ğ· Ñ‚Ğ¸Ñ… Ğ¿Ñ–Ñ€ ÑĞºÂ» = Ğ²Ñ–Ğ´ Ñ‚Ğ¾Ğ³Ğ¾ Ñ‡Ğ°ÑÑƒ Ğ´Ğ¾ Ñ‚ĞµĞ¿ĞµÑ€.\n\n---\n\n## match-up: Ğ—'Ñ”Ğ´Ğ½Ğ°Ğ¹Ñ‚Ğµ ÑĞ¿Ğ¾Ğ»ÑƒÑ‡Ğ½Ğ¸Ğº Ğ· Ğ¹Ğ¾Ğ³Ğ¾ Ñ„ÑƒĞ½ĞºÑ†Ñ–Ñ”Ñ\n\n- ĞºĞ¾Ğ»Ğ¸ :: Ğ¾Ğ´Ğ½Ğ¾Ñ‡Ğ°ÑĞ½Ñ–ÑÑ‚ÑŒ Ğ°Ğ±Ğ¾ Ğ¼Ğ¾Ğ¼ĞµĞ½Ñ‚ Ğ² Ñ‡Ğ°ÑÑ–\n- Ğ¿Ñ–ÑĞ»Ñ Ñ‚Ğ¾Ğ³Ğ¾ ÑĞº :: Ğ¿Ğ¾ÑĞ»Ñ–Ğ´Ğ¾Ğ²Ğ½Ñ–ÑÑ‚ÑŒ (Ğ¾Ğ´Ğ½Ğ° Ğ´Ñ–Ñ Ğ¿Ñ–ÑĞ»Ñ Ñ–Ğ½ÑˆĞ¾Ñ—)\n- Ğ¿ĞµÑ€Ñˆ Ğ½Ñ–Ğ¶ :: Ğ¿Ğ¾Ğ¿ĞµÑ€ĞµĞ´Ğ½Ñ–ÑÑ‚ÑŒ (Ğ¾Ğ´Ğ½Ğ° Ğ´Ñ–Ñ Ğ´Ğ¾ Ñ–Ğ½ÑˆĞ¾Ñ—)\n- ÑĞº Ñ‚Ñ–Ğ»ÑŒĞºĞ¸ :: Ğ½ĞµĞ³Ğ°Ğ¹Ğ½Ğ° Ñ€ĞµĞ°ĞºÑ†Ñ–Ñ Ğ½Ğ° Ğ¿Ğ¾Ğ´Ñ–Ñ\n- Ğ¿Ğ¾ĞºĞ¸ :: Ñ‚Ñ€Ğ¸Ğ²Ğ°Ğ»Ñ–ÑÑ‚ÑŒ Ğ´Ñ–Ñ— Ñƒ Ñ‡Ğ°ÑÑ–\n- Ñ‰Ğ¾Ğ¹Ğ½Ğ¾ :: Ğ¼Ğ¸Ñ‚Ñ‚Ñ”Ğ²Ñ–ÑÑ‚ÑŒ, Ğ»ĞµĞ´Ğ²Ğµ Ğ²ÑÑ‚Ğ¸Ğ³\n- Ñƒ Ñ‚Ğ¾Ğ¹ Ñ‡Ğ°Ñ ÑĞº :: Ğ¿Ğ°Ñ€Ğ°Ğ»ĞµĞ»ÑŒĞ½Ñ–ÑÑ‚ÑŒ Ğ´Ğ²Ğ¾Ñ… Ğ´Ñ–Ğ¹\n- Ğ· Ñ‚Ğ¸Ñ… Ğ¿Ñ–Ñ€ ÑĞº :: Ñ‚Ñ€Ğ¸Ğ²Ğ°Ğ»Ñ–ÑÑ‚ÑŒ Ğ²Ñ–Ğ´ Ğ¼Ğ¸Ğ½ÑƒĞ»Ğ¾Ğ³Ğ¾ Ğ¼Ğ¾Ğ¼ĞµĞ½Ñ‚Ñƒ\n- Ğ´Ğ¾ Ñ‚Ğ¾Ğ³Ğ¾ ÑĞº :: Ğ´Ñ–Ñ Ñ€Ğ½Ñ–ÑˆĞµ Ğ·Ğ° Ğ³Ğ¾Ğ»Ğ¾Ğ²Ğ½Ñƒ\n- ĞºĞ¾Ğ¶Ğ½Ğ¾Ğ³Ğ¾ Ñ€Ğ°Ğ·Ñƒ ĞºĞ¾Ğ»Ğ¸ :: Ñ€ĞµĞ³ÑƒĞ»ÑÑ€Ğ½Ñ–ÑÑ‚ÑŒ Ğ¿Ğ¾Ğ²Ñ‚Ğ¾Ñ€ĞµĞ½Ğ½Ñ\n- Ğ´Ğ¾ĞºĞ¸ Ğ½Ğµ :: Ğ¾Ñ‡Ñ–ĞºÑƒĞ²Ğ°Ğ½Ğ½Ñ Ñ€ĞµĞ·ÑƒĞ»ÑŒÑ‚Ğ°Ñ‚Ñƒ\n- Ğ² Ğ¼Ñ–Ñ€Ñƒ Ñ‚Ğ¾Ğ³Ğ¾ ÑĞº :: Ğ¿Ğ¾ÑÑ‚ÑƒĞ¿Ğ¾Ğ²Ğ¸Ğ¹ Ñ€Ğ¾Ğ·Ğ²Ğ¸Ñ‚Ğ¾Ğº\n\n---\n\n## fill-in: Ğ”Ğ¾Ğ¿Ğ¾Ğ²Ğ½Ñ–Ñ‚ÑŒ Ñ€ĞµÑ‡ĞµĞ½Ğ½Ñ Ğ¿Ñ€Ğ°Ğ²Ğ¸Ğ»ÑŒĞ½Ğ¸Ğ¼ ÑĞ¿Ğ¾Ğ»ÑƒÑ‡Ğ½Ğ¸ĞºĞ¾Ğ¼\n\n1. ___ Ğ²Ñ–Ğ½ Ğ¿Ñ€Ğ¸Ğ¹ÑˆĞ¾Ğ², Ğ¼Ğ¸ Ğ²Ğ¶Ğµ Ğ²ĞµÑ‡ĞµÑ€ÑĞ»Ğ¸.\n   > [!answer] ĞšĞ¾Ğ»Ğ¸\n   > [!options] ĞšĞ¾Ğ»Ğ¸ | ĞŸÑ–ÑĞ»Ñ Ñ‚Ğ¾Ğ³Ğ¾ ÑĞº | ĞŸĞµÑ€Ñˆ Ğ½Ñ–Ğ¶ | ĞŸĞ¾ĞºĞ¸\n\n2. ___ ÑĞ¾Ğ½Ñ†Ğµ Ğ·Ñ–Ğ¹ÑˆĞ»Ğ¾, Ğ¼Ğ¸ Ğ²Ğ¸Ñ€ÑƒÑˆĞ¸Ğ»Ğ¸ Ğ² Ğ´Ğ¾Ñ€Ğ¾Ğ³Ñƒ Ğ½ĞµĞ³Ğ°Ğ¹Ğ½Ğ¾.\n   > [!answer] Ğ¯Ğº Ñ‚Ñ–Ğ»ÑŒĞºĞ¸\n   > [!options] Ğ¯Ğº Ñ‚Ñ–Ğ»ÑŒĞºĞ¸ | ĞšĞ¾Ğ»Ğ¸ | ĞŸĞ¾ĞºĞ¸ | Ğ£ Ñ‚Ğ¾Ğ¹ Ñ‡Ğ°Ñ ÑĞº\n\n3. ___ Ğ¿Ğ¾Ñ‡Ğ°Ñ‚Ğ¸ Ñ€Ğ¾Ğ±Ğ¾Ñ‚Ñƒ, ÑƒĞ²Ğ°Ğ¶Ğ½Ğ¾ Ğ¿Ñ€Ğ¾Ñ‡Ğ¸Ñ‚Ğ°Ğ¹ Ñ–Ğ½ÑÑ‚Ñ€ÑƒĞºÑ†Ñ–Ñ Ğ´Ğ¾ ĞºÑ–Ğ½Ñ†Ñ.\n   > [!answer] ĞŸĞµÑ€Ñˆ Ğ½Ñ–Ğ¶\n   > [!options] ĞŸĞµÑ€Ñˆ Ğ½Ñ–Ğ¶ | ĞŸÑ–ÑĞ»Ñ Ñ‚Ğ¾Ğ³Ğ¾ ÑĞº | ĞšĞ¾Ğ»Ğ¸ | ĞŸĞ¾ĞºĞ¸\n\n4. Ğ§ĞµĞºĞ°Ğ¹ Ñ‚ÑƒÑ‚, ___ Ñ ___ Ğ¿Ğ¾Ğ²ĞµÑ€Ğ½ÑƒÑÑ Ğ· Ğ¼Ğ°Ğ³Ğ°Ğ·Ğ¸Ğ½Ñƒ.\n   > [!answer] Ğ¿Ğ¾ĞºĞ¸ Ğ½Ğµ\n   > [!options] Ğ¿Ğ¾ĞºĞ¸ Ğ½Ğµ | Ğ¿Ğ¾ĞºĞ¸ | ĞºĞ¾Ğ»Ğ¸ | ÑĞº Ñ‚Ñ–Ğ»ÑŒĞºĞ¸\n\n5. ___ Ğ¼Ğ¸ Ğ·Ğ°ĞºÑ–Ğ½Ñ‡Ğ¸Ğ»Ğ¸ Ğ¿Ñ€Ğ¾ĞµĞºÑ‚, Ğ¿Ğ¾Ñ—Ñ…Ğ°Ğ»Ğ¸ ÑĞ²ÑÑ‚ĞºÑƒĞ²Ğ°Ñ‚Ğ¸ Ñƒ Ñ€ĞµÑÑ‚Ğ¾Ñ€Ğ°Ğ½.\n   > [!answer] ĞŸÑ–ÑĞ»Ñ Ñ‚Ğ¾Ğ³Ğ¾ ÑĞº\n   > [!options] ĞŸÑ–ÑĞ»Ñ Ñ‚Ğ¾Ğ³Ğ¾ ÑĞº | ĞŸĞµÑ€Ñˆ Ğ½Ñ–Ğ¶ | ĞŸĞ¾ĞºĞ¸ | ĞšĞ¾Ğ»Ğ¸\n\n6. ___ Ğ²Ñ–Ğ½ ÑÑ‚Ğ°Ğ² Ğ´Ğ¸Ñ€ĞµĞºÑ‚Ğ¾Ñ€Ğ¾Ğ¼, Ğ½Ñ–Ñ…Ñ‚Ğ¾ Ğ½Ğµ Ğ·Ğ½Ğ°Ğ² Ğ¹Ğ¾Ğ³Ğ¾ Ñ–Ğ¼ĞµĞ½Ñ– Ğ² ĞºĞ¾Ğ¼Ğ¿Ğ°Ğ½Ñ–Ñ—.\n   > [!answer] Ğ”Ğ¾ Ñ‚Ğ¾Ğ³Ğ¾ ÑĞº\n   > [!options] Ğ”Ğ¾ Ñ‚Ğ¾Ğ³Ğ¾ ÑĞº | ĞŸÑ–ÑĞ»Ñ Ñ‚Ğ¾Ğ³Ğ¾ ÑĞº | ĞŸĞ¾ĞºĞ¸ | Ğ¯Ğº Ñ‚Ñ–Ğ»ÑŒĞºĞ¸\n\n7. ___ Ñ Ğ±Ğ°Ñ‡Ñƒ Ñ†Ğµ Ğ¼Ñ–ÑÑ†Ğµ, Ğ·Ğ³Ğ°Ğ´ÑƒÑ ÑĞ²Ğ¾Ñ” Ğ´Ğ¸Ñ‚Ğ¸Ğ½ÑÑ‚Ğ²Ğ¾ Ñ‚Ğ° Ğ±Ğ°Ñ‚ÑŒĞºÑ–Ğ².\n   > [!answer] ĞšĞ¾Ğ¶Ğ½Ğ¾Ğ³Ğ¾ Ñ€Ğ°Ğ·Ñƒ ĞºĞ¾Ğ»Ğ¸\n   > [!options] ĞšĞ¾Ğ¶Ğ½Ğ¾Ğ³Ğ¾ Ñ€Ğ°Ğ·Ñƒ ĞºĞ¾Ğ»Ğ¸ | Ğ¯Ğº Ñ‚Ñ–Ğ»ÑŒĞºĞ¸ | Ğ©Ğ¾Ğ¹Ğ½Ğ¾ | Ğ›ĞµĞ´Ğ²Ğµ\n\n8. ___ Ğ²Ğ¾Ğ½Ğ° Ğ³Ğ¾Ñ‚ÑƒĞ²Ğ°Ğ»Ğ° Ğ²ĞµÑ‡ĞµÑ€Ñ, Ğ²Ñ–Ğ½ Ñ‡Ğ¸Ñ‚Ğ°Ğ² Ğ³Ğ°Ğ·ĞµÑ‚Ñƒ Ğ½Ğ° Ğ´Ğ¸Ğ²Ğ°Ğ½Ñ–.\n   > [!answer] Ğ£ Ñ‚Ğ¾Ğ¹ Ñ‡Ğ°Ñ ÑĞº\n   > [!options] Ğ£ Ñ‚Ğ¾Ğ¹ Ñ‡Ğ°Ñ ÑĞº | ĞŸÑ–ÑĞ»Ñ Ñ‚Ğ¾Ğ³Ğ¾ ÑĞº | ĞŸĞµÑ€Ñˆ Ğ½Ñ–Ğ¶ | Ğ¯Ğº Ñ‚Ñ–Ğ»ÑŒĞºĞ¸\n\n---\n\n## true-false: ĞŸÑ€Ğ°Ğ²Ğ´Ğ° Ñ‡Ğ¸ Ğ½ĞµĞ¿Ñ€Ğ°Ğ²Ğ´Ğ°?\n\n1. Ğ¡Ğ¿Ğ¾Ğ»ÑƒÑ‡Ğ½Ğ¸Ğº Â«ĞºĞ¾Ğ»Ğ¸Â» Ğ²Ğ¸Ñ€Ğ°Ğ¶Ğ°Ñ” Ğ¾Ğ´Ğ½Ğ¾Ñ‡Ğ°ÑĞ½Ñ–ÑÑ‚ÑŒ Ğ´Ñ–Ğ¹.\n   - [x] ĞŸÑ€Ğ°Ğ²Ğ´Ğ°\n   - [ ] ĞĞµĞ¿Ñ€Ğ°Ğ²Ğ´Ğ°\n\n2. Â«ĞŸÑ–ÑĞ»Ñ Ñ‚Ğ¾Ğ³Ğ¾ ÑĞºÂ» Ğ²Ğ¸Ñ€Ğ°Ğ¶Ğ°Ñ” Ğ´Ñ–Ñ, ÑĞºĞ° Ğ²Ñ–Ğ´Ğ±ÑƒĞ²Ğ°Ñ”Ñ‚ÑŒÑÑ Ñ€Ğ°Ğ½Ñ–ÑˆĞµ Ğ·Ğ° Ğ³Ğ¾Ğ»Ğ¾Ğ²Ğ½Ñƒ.\n   - [ ] ĞŸÑ€Ğ°Ğ²Ğ´Ğ°\n   - [x] ĞĞµĞ¿Ñ€Ğ°Ğ²Ğ´Ğ°\n\n3. Â«ĞŸĞµÑ€Ñˆ Ğ½Ñ–Ğ¶Â» Ñ– Â«Ğ´Ğ¾ Ñ‚Ğ¾Ğ³Ğ¾ ÑĞºÂ» â€” Ñ†Ğµ ÑĞ¸Ğ½Ğ¾Ğ½Ñ–Ğ¼Ğ¸.\n   - [x] ĞŸÑ€Ğ°Ğ²Ğ´Ğ°\n   - [ ] ĞĞµĞ¿Ñ€Ğ°Ğ²Ğ´Ğ°\n\n4. Ğ’Ğ¸Ñ€Ğ°Ğ· Â«Ğ¿Ğ¾ĞºĞ¸ Ğ½ĞµÂ» Ğ²Ğ¸Ğ¼Ğ°Ğ³Ğ°Ñ” Ğ·Ğ°Ğ¿ĞµÑ€ĞµÑ‡ĞµĞ½Ğ½Ñ Ğ² Ğ¿Ñ–Ğ´Ñ€ÑĞ´Ğ½Ğ¾Ğ¼Ñƒ Ñ€ĞµÑ‡ĞµĞ½Ğ½Ñ–.\n   - [x] ĞŸÑ€Ğ°Ğ²Ğ´Ğ°\n   - [ ] ĞĞµĞ¿Ñ€Ğ°Ğ²Ğ´Ğ°\n\n5. Â«Ğ¯Ğº Ñ‚Ñ–Ğ»ÑŒĞºĞ¸Â» Ñ‚Ğ° Â«Ñ‰Ğ¾Ğ¹Ğ½Ğ¾Â» Ğ²Ğ¸Ñ€Ğ°Ğ¶Ğ°ÑÑ‚ÑŒ Ğ¼Ğ¸Ñ‚Ñ‚Ñ”Ğ²Ñƒ Ñ€ĞµĞ°ĞºÑ†Ñ–Ñ.\n   - [x] ĞŸÑ€Ğ°Ğ²Ğ´Ğ°\n   - [ ] ĞĞµĞ¿Ñ€Ğ°Ğ²Ğ´Ğ°\n\n6. Â«Ğ— Ñ‚Ğ¸Ñ… Ğ¿Ñ–Ñ€ ÑĞºÂ» Ğ²Ğ¸ĞºĞ¾Ñ€Ğ¸ÑÑ‚Ğ¾Ğ²ÑƒÑ”Ñ‚ÑŒÑÑ Ğ´Ğ»Ñ Ğ¾Ğ´Ğ½Ğ¾ĞºÑ€Ğ°Ñ‚Ğ½Ğ¸Ñ… Ğ¿Ğ¾Ğ´Ñ–Ğ¹.\n   - [ ] ĞŸÑ€Ğ°Ğ²Ğ´Ğ°\n   - [x] ĞĞµĞ¿Ñ€Ğ°Ğ²Ğ´Ğ°\n\n7. Â«Ğ£ Ñ‚Ğ¾Ğ¹ Ñ‡Ğ°Ñ ÑĞºÂ» Ğ¼Ğ¾Ğ¶Ğ½Ğ° Ğ·Ğ°Ğ¼Ñ–Ğ½Ğ¸Ñ‚Ğ¸ Ğ½Ğ° Â«Ğ¿Ğ¾ĞºĞ¸Â» Ğ±ĞµĞ· Ğ·Ğ¼Ñ–Ğ½Ğ¸ Ğ·Ğ½Ğ°Ñ‡ĞµĞ½Ğ½Ñ.\n   - [x] ĞŸÑ€Ğ°Ğ²Ğ´Ğ°\n   - [ ] ĞĞµĞ¿Ñ€Ğ°Ğ²Ğ´Ğ°\n\n8. Ğ¡Ğ»Ğ¾Ğ²Ğ¾ Â«Ñ‰Ğ¾Ğ¹Ğ½Ğ¾Â» Ñ” ÑƒĞ½Ñ–ĞºĞ°Ğ»ÑŒĞ½Ğ¸Ğ¼ ÑƒĞºÑ€Ğ°Ñ—Ğ½ÑÑŒĞºĞ¸Ğ¼ ÑĞ¿Ğ¾Ğ»ÑƒÑ‡Ğ½Ğ¸ĞºĞ¾Ğ¼ Ğ±ĞµĞ· Ğ¿Ñ€ÑĞ¼Ğ¾Ğ³Ğ¾ Ñ€Ğ¾ÑÑ–Ğ¹ÑÑŒĞºĞ¾Ğ³Ğ¾ ĞµĞºĞ²Ñ–Ğ²Ğ°Ğ»ĞµĞ½Ñ‚Ğ°.\n   - [x] ĞŸÑ€Ğ°Ğ²Ğ´Ğ°\n   - [ ] ĞĞµĞ¿Ñ€Ğ°Ğ²Ğ´Ğ°\n\n---\n\n## group-sort: Ğ Ğ¾Ğ·Ğ¿Ğ¾Ğ´Ñ–Ğ»Ñ–Ñ‚ÑŒ ÑĞ¿Ğ¾Ğ»ÑƒÑ‡Ğ½Ğ¸ĞºĞ¸ Ğ·Ğ° Ñ‚Ğ¸Ğ¿Ğ¾Ğ¼ Ñ‡Ğ°ÑĞ¾Ğ²Ğ¸Ñ… Ğ²Ñ–Ğ´Ğ½Ğ¾ÑˆĞµĞ½ÑŒ\n\n### ĞĞ´Ğ½Ğ¾Ñ‡Ğ°ÑĞ½Ñ–ÑÑ‚ÑŒ (Ğ¿Ğ°Ñ€Ğ°Ğ»ĞµĞ»ÑŒĞ½Ñ– Ğ´Ñ–Ñ—)\n- ĞºĞ¾Ğ»Ğ¸\n- Ñƒ Ñ‚Ğ¾Ğ¹ Ñ‡Ğ°Ñ ÑĞº\n- Ğ¿Ğ¾ĞºĞ¸\n- Ğ² Ğ¼Ñ–Ñ€Ñƒ Ñ‚Ğ¾Ğ³Ğ¾ ÑĞº\n\n### ĞŸĞ¾ÑĞ»Ñ–Ğ´Ğ¾Ğ²Ğ½Ñ–ÑÑ‚ÑŒ (Ğ¿Ñ–ÑĞ»Ñ Ñ–Ğ½ÑˆĞ¾Ñ— Ğ´Ñ–Ñ—)\n- Ğ¿Ñ–ÑĞ»Ñ Ñ‚Ğ¾Ğ³Ğ¾ ÑĞº\n- ÑĞº Ñ‚Ñ–Ğ»ÑŒĞºĞ¸\n- Ñ‰Ğ¾Ğ¹Ğ½Ğ¾\n- Ğ»ĞµĞ´Ğ²Ğµ\n- Ğ· Ñ‚Ğ¸Ñ… Ğ¿Ñ–Ñ€ ÑĞº\n\n### ĞŸĞ¾Ğ¿ĞµÑ€ĞµĞ´Ğ½Ñ–ÑÑ‚ÑŒ (Ğ´Ğ¾ Ñ–Ğ½ÑˆĞ¾Ñ— Ğ´Ñ–Ñ—)\n- Ğ¿ĞµÑ€Ñˆ Ğ½Ñ–Ğ¶\n- Ğ´Ğ¾ Ñ‚Ğ¾Ğ³Ğ¾ ÑĞº\n- Ğ¿ĞµÑ€ĞµĞ´ Ñ‚Ğ¸Ğ¼ ÑĞº\n- Ğ¿Ğ¾ĞºĞ¸ Ğ½Ğµ\n- Ğ´Ğ¾ĞºĞ¸ Ğ½Ğµ\n\n---\n\n## unjumble: Ğ¡ĞºĞ»Ğ°Ğ´Ñ–Ñ‚ÑŒ Ñ€ĞµÑ‡ĞµĞ½Ğ½Ñ Ğ· Ñ€Ğ¾Ğ·ÑĞ¸Ğ¿Ğ°Ğ½Ğ¸Ñ… ÑĞ»Ñ–Ğ²\n\n1. ĞºĞ¾Ğ»Ğ¸ / Ğ²Ñ–Ğ½ / Ğ¿Ñ€Ğ¸Ğ¹ÑˆĞ¾Ğ² / Ğ´Ğ¾Ğ´Ğ¾Ğ¼Ñƒ / , / Ğ¼Ğ¸ / Ğ²Ğ¶Ğµ / Ğ²ĞµÑ‡ĞµÑ€ÑĞ»Ğ¸ / Ñ€Ğ°Ğ·Ğ¾Ğ¼ / ÑƒÑÑ–Ñ”Ñ / ÑÑ–Ğ¼'Ñ”Ñ\n   > [!answer] ĞšĞ¾Ğ»Ğ¸ Ğ²Ñ–Ğ½ Ğ¿Ñ€Ğ¸Ğ¹ÑˆĞ¾Ğ² Ğ´Ğ¾Ğ´Ğ¾Ğ¼Ñƒ, Ğ¼Ğ¸ Ğ²Ğ¶Ğµ Ğ²ĞµÑ‡ĞµÑ€ÑĞ»Ğ¸ Ñ€Ğ°Ğ·Ğ¾Ğ¼ ÑƒÑÑ–Ñ”Ñ ÑÑ–Ğ¼'Ñ”Ñ.\n\n2. Ğ¿Ñ–ÑĞ»Ñ / Ñ‚Ğ¾Ğ³Ğ¾ / ÑĞº / Ğ²Ğ¾Ğ½Ğ° / Ğ·Ğ°ĞºÑ–Ğ½Ñ‡Ğ¸Ğ»Ğ° / ÑƒĞ½Ñ–Ğ²ĞµÑ€ÑĞ¸Ñ‚ĞµÑ‚ / , / Ğ¿Ğ¾Ñ‡Ğ°Ğ»Ğ° / Ğ¿Ñ€Ğ°Ñ†ÑĞ²Ğ°Ñ‚Ğ¸ / Ğ² / Ğ²ĞµĞ»Ğ¸ĞºÑ–Ğ¹ / ĞºĞ¾Ğ¼Ğ¿Ğ°Ğ½Ñ–Ñ—\n   > [!answer] ĞŸÑ–ÑĞ»Ñ Ñ‚Ğ¾Ğ³Ğ¾ ÑĞº Ğ²Ğ¾Ğ½Ğ° Ğ·Ğ°ĞºÑ–Ğ½Ñ‡Ğ¸Ğ»Ğ° ÑƒĞ½Ñ–Ğ²ĞµÑ€ÑĞ¸Ñ‚ĞµÑ‚, Ğ¿Ğ¾Ñ‡Ğ°Ğ»Ğ° Ğ¿Ñ€Ğ°Ñ†ÑĞ²Ğ°Ñ‚Ğ¸ Ğ² Ğ²ĞµĞ»Ğ¸ĞºÑ–Ğ¹ ĞºĞ¾Ğ¼Ğ¿Ğ°Ğ½Ñ–Ñ—.\n\n3. Ğ¿ĞµÑ€Ñˆ / Ğ½Ñ–Ğ¶ / Ğ¿Ñ–Ñ‚Ğ¸ / Ğ½Ğ° / Ğ²Ğ°Ğ¶Ğ»Ğ¸Ğ²Ñƒ / Ğ·ÑƒÑÑ‚Ñ€Ñ–Ñ‡ / , / Ğ²Ñ–Ğ½ / Ñ€ĞµÑ‚ĞµĞ»ÑŒĞ½Ğ¾ / Ğ¿Ñ–Ğ´Ğ³Ğ¾Ñ‚ÑƒĞ²Ğ°Ğ²ÑÑ / Ğ´Ğ¾ / Ğ½ĞµÑ—\n   > [!answer] ĞŸĞµÑ€Ñˆ Ğ½Ñ–Ğ¶ Ğ¿Ñ–Ñ‚Ğ¸ Ğ½Ğ° Ğ²Ğ°Ğ¶Ğ»Ğ¸Ğ²Ñƒ Ğ·ÑƒÑÑ‚Ñ€Ñ–Ñ‡, Ğ²Ñ–Ğ½ Ñ€ĞµÑ‚ĞµĞ»ÑŒĞ½Ğ¾ Ğ¿Ñ–Ğ´Ğ³Ğ¾Ñ‚ÑƒĞ²Ğ°Ğ²ÑÑ Ğ´Ğ¾ Ğ½ĞµÑ—.\n\n4. ÑĞº / Ñ‚Ñ–Ğ»ÑŒĞºĞ¸ / Ğ¿Ğ¾Ñ‡ÑƒĞ²ÑÑ / Ğ³ÑƒÑ‡Ğ½Ğ¸Ğ¹ / Ğ´Ğ·Ğ²Ñ–Ğ½Ğ¾Ğº / Ğ±ÑƒĞ´Ğ¸Ğ»ÑŒĞ½Ğ¸ĞºĞ° / , / Ğ²Ñ–Ğ½ / Ğ¼Ğ¸Ñ‚Ñ‚Ñ”Ğ²Ğ¾ / Ğ¿Ñ€Ğ¾ĞºĞ¸Ğ½ÑƒĞ²ÑÑ / Ñ– / Ğ²ÑÑ‚Ğ°Ğ²\n   > [!answer] Ğ¯Ğº Ñ‚Ñ–Ğ»ÑŒĞºĞ¸ Ğ¿Ğ¾Ñ‡ÑƒĞ²ÑÑ Ğ³ÑƒÑ‡Ğ½Ğ¸Ğ¹ Ğ´Ğ·Ğ²Ñ–Ğ½Ğ¾Ğº Ğ±ÑƒĞ´Ğ¸Ğ»ÑŒĞ½Ğ¸ĞºĞ°, Ğ²Ñ–Ğ½ Ğ¼Ğ¸Ñ‚Ñ‚Ñ”Ğ²Ğ¾ Ğ¿Ñ€Ğ¾ĞºĞ¸Ğ½ÑƒĞ²ÑÑ Ñ– Ğ²ÑÑ‚Ğ°Ğ².\n\n5. Ğ¿Ğ¾ĞºĞ¸ / Ğ¼Ğ¸ / Ñ‡ĞµĞºĞ°Ğ»Ğ¸ / Ğ½Ğ° / Ğ¿Ğ¾Ñ‚ÑĞ³ / Ğ´Ğ¾ / Ğ›ÑŒĞ²Ğ¾Ğ²Ğ° / , / Ğ²Ğ¸Ñ€Ñ–ÑˆĞ¸Ğ»Ğ¸ / Ğ²Ğ¸Ğ¿Ğ¸Ñ‚Ğ¸ / ĞºĞ°Ğ²Ñƒ / Ğ² / ĞºĞ°Ğ²'ÑÑ€Ğ½Ñ–\n   > [!answer] ĞŸĞ¾ĞºĞ¸ Ğ¼Ğ¸ Ñ‡ĞµĞºĞ°Ğ»Ğ¸ Ğ½Ğ° Ğ¿Ğ¾Ñ‚ÑĞ³ Ğ´Ğ¾ Ğ›ÑŒĞ²Ğ¾Ğ²Ğ°, Ğ²Ğ¸Ñ€Ñ–ÑˆĞ¸Ğ»Ğ¸ Ğ²Ğ¸Ğ¿Ğ¸Ñ‚Ğ¸ ĞºĞ°Ğ²Ñƒ Ğ² ĞºĞ°Ğ²'ÑÑ€Ğ½Ñ–.\n\n6. ĞºĞ¾Ğ¶Ğ½Ğ¾Ğ³Ğ¾ / Ñ€Ğ°Ğ·Ñƒ / ĞºĞ¾Ğ»Ğ¸ / Ñ / Ğ¿Ñ€Ğ¸Ñ—Ğ¶Ğ´Ğ¶Ğ°Ñ / Ğ´Ğ¾ / Ñ€Ñ–Ğ´Ğ½Ğ¾Ğ³Ğ¾ / Ğ¼Ñ–ÑÑ‚Ğ° / , / Ğ²Ñ–Ğ´Ğ²Ñ–Ğ´ÑƒÑ / Ğ±Ğ°Ñ‚ÑŒĞºÑ–Ğ²ÑÑŒĞºĞ¸Ğ¹ / Ğ´Ñ–Ğ¼\n   > [!answer] ĞšĞ¾Ğ¶Ğ½Ğ¾Ğ³Ğ¾ Ñ€Ğ°Ğ·Ñƒ ĞºĞ¾Ğ»Ğ¸ Ñ Ğ¿Ñ€Ğ¸Ñ—Ğ¶Ğ´Ğ¶Ğ°Ñ Ğ´Ğ¾ Ñ€Ñ–Ğ´Ğ½Ğ¾Ğ³Ğ¾ Ğ¼Ñ–ÑÑ‚Ğ°, Ğ²Ñ–Ğ´Ğ²Ñ–Ğ´ÑƒÑ Ğ±Ğ°Ñ‚ÑŒĞºÑ–Ğ²ÑÑŒĞºĞ¸Ğ¹ Ğ´Ñ–Ğ¼.\n\n---\n\n## error-correction: Ğ—Ğ½Ğ°Ğ¹Ğ´Ñ–Ñ‚ÑŒ Ñ– Ğ²Ğ¸Ğ¿Ñ€Ğ°Ğ²Ñ‚Ğµ Ğ¿Ğ¾Ğ¼Ğ¸Ğ»ĞºÑƒ\n\n1. Ğ§ĞµĞºĞ°Ğ¹ Ñ‚ÑƒÑ‚, Ğ¿Ğ¾ĞºĞ¸ Ñ Ğ¿Ñ€Ğ¸Ğ¹Ğ´Ñƒ Ğ· Ğ¼Ğ°Ğ³Ğ°Ğ·Ğ¸Ğ½Ñƒ Ğ´Ğ¾Ğ´Ğ¾Ğ¼Ñƒ.\n   > [!error] Ğ¿Ñ€Ğ¸Ğ¹Ğ´Ñƒ\n   > [!answer] Ğ½Ğµ Ğ¿Ñ€Ğ¸Ğ¹Ğ´Ñƒ\n   > [!options] Ğ½Ğµ Ğ¿Ñ€Ğ¸Ğ¹Ğ´Ñƒ | Ğ¿Ñ€Ğ¸Ñ…Ğ¾Ğ´Ğ¶Ñƒ | Ğ¿Ñ€Ğ¸Ñ…Ğ¾Ğ´Ğ¸Ğ² | Ğ¿Ñ€Ğ¸Ğ¹ÑˆĞ¾Ğ²\n   > [!explanation] Â«ĞŸĞ¾ĞºĞ¸ Ğ½ĞµÂ» Ğ²Ğ¸Ğ¼Ğ°Ğ³Ğ°Ñ” Ğ·Ğ°Ğ¿ĞµÑ€ĞµÑ‡ĞµĞ½Ğ½Ñ.\n\n2. ĞŸÑ–ÑĞ»Ñ Ñ‚Ğ¾Ğ³Ğ¾ ÑĞº Ğ²Ñ–Ğ½ Ğ¿Ñ–ÑˆĞ¾Ğ², Ğ¼Ğ¸ Ğ³Ğ¾Ğ²Ğ¾Ñ€Ğ¸Ğ»Ğ¸ Ğ²Ğ¶Ğµ Ğ¿Ñ€Ğ¾ Ñ†Ğµ.\n   > [!error] Ğ³Ğ¾Ğ²Ğ¾Ñ€Ğ¸Ğ»Ğ¸\n   > [!answer] Ğ¿Ñ€Ğ¾Ğ´Ğ¾Ğ²Ğ¶Ğ¸Ğ»Ğ¸ Ğ³Ğ¾Ğ²Ğ¾Ñ€Ğ¸Ñ‚Ğ¸\n   > [!options] Ğ¿Ñ€Ğ¾Ğ´Ğ¾Ğ²Ğ¶Ğ¸Ğ»Ğ¸ Ğ³Ğ¾Ğ²Ğ¾Ñ€Ğ¸Ñ‚Ğ¸ | Ğ³Ğ¾Ğ²Ğ¾Ñ€Ğ¸Ğ¼Ğ¾ | Ğ±ÑƒĞ´ĞµĞ¼Ğ¾ Ğ³Ğ¾Ğ²Ğ¾Ñ€Ğ¸Ñ‚Ğ¸ | Ğ¿Ğ¾Ñ‡Ğ°Ğ»Ğ¸ Ğ³Ğ¾Ğ²Ğ¾Ñ€Ğ¸Ñ‚Ğ¸\n   > [!explanation] Â«ĞŸÑ–ÑĞ»Ñ Ñ‚Ğ¾Ğ³Ğ¾ ÑĞºÂ» Ğ²ĞºĞ°Ğ·ÑƒÑ” Ğ½Ğ° Ğ¿Ğ¾ÑĞ»Ñ–Ğ´Ğ¾Ğ²Ğ½Ñ–ÑÑ‚ÑŒ, Ñ‚Ğ¾Ğ¼Ñƒ Ğ¿Ğ¾Ñ‚Ñ€Ñ–Ğ±ĞµĞ½ Ñ€ĞµĞ·ÑƒĞ»ÑŒÑ‚Ğ°Ñ‚.\n\n3. ĞŸĞµÑ€Ñˆ Ğ½Ñ–Ğ¶ Ğ²Ñ–Ğ½ Ğ¿Ñ–ÑˆĞ¾Ğ², Ğ¼Ğ¸ Ğ¿Ñ€Ğ¾Ğ´Ğ¾Ğ²Ğ¶Ğ¸Ğ»Ğ¸ Ñ€Ğ¾Ğ·Ğ¼Ğ¾Ğ²Ñƒ Ğ´Ğ°Ğ»Ñ–.\n   > [!error] ĞŸĞµÑ€Ñˆ Ğ½Ñ–Ğ¶\n   > [!answer] ĞŸÑ–ÑĞ»Ñ Ñ‚Ğ¾Ğ³Ğ¾ ÑĞº\n   > [!options] ĞŸÑ–ÑĞ»Ñ Ñ‚Ğ¾Ğ³Ğ¾ ÑĞº | ĞšĞ¾Ğ»Ğ¸ | Ğ¯Ğº Ñ‚Ñ–Ğ»ÑŒĞºĞ¸ | ĞŸĞ¾ĞºĞ¸\n   > [!explanation] Â«ĞŸÑ€Ğ¾Ğ´Ğ¾Ğ²Ğ¶Ğ¸Ğ»Ğ¸Â» Ğ²ĞºĞ°Ğ·ÑƒÑ” Ğ½Ğ° Ğ¿Ğ¾ÑĞ»Ñ–Ğ´Ğ¾Ğ²Ğ½Ñ–ÑÑ‚ÑŒ Ğ¿Ñ–ÑĞ»Ñ Ñ–Ğ½ÑˆĞ¾Ñ— Ğ´Ñ–Ñ—.\n\n4. Ğ¯Ğº Ñ‚Ñ–Ğ»ÑŒĞºĞ¸ Ğ²Ñ–Ğ½ Ğ¿Ğ¾ÑÑ‚ÑƒĞ¿Ğ¾Ğ²Ğ¾ ÑÑ‚Ğ°Ğ²Ğ°Ğ² ĞºÑ€Ğ°Ñ‰Ğ¸Ğ¼, Ğ¼Ğ¸ Ñ€Ğ°Ğ´Ñ–Ñ‚Ğ¸.\n   > [!error] Ğ¯Ğº Ñ‚Ñ–Ğ»ÑŒĞºĞ¸\n   > [!answer] Ğ’ Ğ¼Ñ–Ñ€Ñƒ Ñ‚Ğ¾Ğ³Ğ¾ ÑĞº\n   > [!options] Ğ’ Ğ¼Ñ–Ñ€Ñƒ Ñ‚Ğ¾Ğ³Ğ¾ ÑĞº | ĞŸĞ¾ĞºĞ¸ | ĞšĞ¾Ğ»Ğ¸ | ĞŸÑ–ÑĞ»Ñ Ñ‚Ğ¾Ğ³Ğ¾ ÑĞº\n   > [!explanation] Â«ĞŸĞ¾ÑÑ‚ÑƒĞ¿Ğ¾Ğ²Ğ¾Â» Ğ²Ğ¸Ğ¼Ğ°Ğ³Ğ°Ñ” Â«Ğ² Ğ¼Ñ–Ñ€Ñƒ Ñ‚Ğ¾Ğ³Ğ¾ ÑĞºÂ», Ğ° Ğ½Ğµ Ğ¼Ğ¸Ñ‚Ñ‚Ñ”Ğ²Ğ¾Ğ³Ğ¾ Â«ÑĞº Ñ‚Ñ–Ğ»ÑŒĞºĞ¸Â».\n\n5. ĞšĞ¾Ğ»Ğ¸ Ğ²Ğ¾Ğ½Ğ° Ğ·Ğ°ĞºÑ–Ğ½Ñ‡Ğ¸Ğ»Ğ° ÑˆĞºĞ¾Ğ»Ñƒ, Ğ²Ñ‡Ğ¸Ğ»Ğ°ÑÑ Ñ‚Ğ°Ğ¼ Ğ´Ğ²Ğ°Ğ½Ğ°Ğ´Ñ†ÑÑ‚ÑŒ Ñ€Ğ¾ĞºÑ–Ğ².\n   > [!error] ĞšĞ¾Ğ»Ğ¸ Ğ²Ğ¾Ğ½Ğ° Ğ·Ğ°ĞºÑ–Ğ½Ñ‡Ğ¸Ğ»Ğ°\n   > [!answer] Ğ”Ğ¾ Ñ‚Ğ¾Ğ³Ğ¾ ÑĞº Ğ²Ğ¾Ğ½Ğ° Ğ·Ğ°ĞºÑ–Ğ½Ñ‡Ğ¸Ğ»Ğ°\n   > [!options] Ğ”Ğ¾ Ñ‚Ğ¾Ğ³Ğ¾ ÑĞº Ğ²Ğ¾Ğ½Ğ° Ğ·Ğ°ĞºÑ–Ğ½Ñ‡Ğ¸Ğ»Ğ° | ĞŸÑ–ÑĞ»Ñ Ñ‚Ğ¾Ğ³Ğ¾ ÑĞº | ĞŸĞ¾ĞºĞ¸ | Ğ¯Ğº Ñ‚Ñ–Ğ»ÑŒĞºĞ¸\n   > [!explanation] 12 Ñ€Ğ¾ĞºÑ–Ğ² Ğ½Ğ°Ğ²Ñ‡Ğ°Ğ½Ğ½Ñ â€” Ñ†Ğµ Ğ¿ĞµÑ€Ñ–Ğ¾Ğ´ Ğ”Ğ Ğ·Ğ°ĞºÑ–Ğ½Ñ‡ĞµĞ½Ğ½Ñ.\n\n6. Ğ©Ğ¾Ğ¹Ğ½Ğ¾ Ğ²Ñ–Ğ½ Ğ²Ñ…Ğ¾Ğ´Ğ¸Ğ², Ğ¿Ğ¾Ñ‡Ğ°Ğ²ÑÑ Ğ³ÑƒÑ‡Ğ½Ğ¸Ğ¹ Ğ´Ğ¾Ñ‰ Ğ½Ğ° Ğ²ÑƒĞ»Ğ¸Ñ†Ñ–.\n   > [!error] Ğ²Ñ…Ğ¾Ğ´Ğ¸Ğ²\n   > [!answer] ÑƒĞ²Ñ–Ğ¹ÑˆĞ¾Ğ²\n   > [!options] ÑƒĞ²Ñ–Ğ¹ÑˆĞ¾Ğ² | Ğ²Ñ…Ğ¾Ğ´Ğ¸Ñ‚ÑŒ | Ğ±ÑƒĞ´Ğµ Ğ²Ñ…Ğ¾Ğ´Ğ¸Ñ‚Ğ¸ | Ğ²Ñ…Ğ¾Ğ´ÑÑ‡Ğ¸\n   > [!explanation] Â«Ğ©Ğ¾Ğ¹Ğ½Ğ¾Â» Ğ²Ğ¸Ğ¼Ğ°Ğ³Ğ°Ñ” Ğ´Ğ¾ĞºĞ¾Ğ½Ğ°Ğ½Ğ¾Ğ³Ğ¾ Ğ²Ğ¸Ğ´Ñƒ Ğ´Ğ»Ñ Ğ²Ğ¸Ñ€Ğ°Ğ¶ĞµĞ½Ğ½Ñ Ğ¼Ğ¸Ñ‚Ñ‚Ñ”Ğ²Ğ¾ÑÑ‚Ñ–.\n\n---\n\n## cloze: Ğ—Ğ°Ğ¿Ğ¾Ğ²Ğ½Ñ–Ñ‚ÑŒ Ğ¿Ñ€Ğ¾Ğ¿ÑƒÑĞºĞ¸ Ğ² Ñ‚ĞµĞºÑÑ‚Ñ–\n\nĞœĞ¸Ğ½ÑƒĞ»Ğ¾Ğ³Ğ¾ Ğ»Ñ–Ñ‚Ğ° Ñ Ğ²Ğ¸Ñ€Ñ–ÑˆĞ¸Ğ² Ğ¿Ğ¾Ğ´Ğ¾Ñ€Ğ¾Ğ¶ÑƒĞ²Ğ°Ñ‚Ğ¸ Ğ£ĞºÑ€Ğ°Ñ—Ğ½Ğ¾Ñ. (1)___ Ñ Ğ¿Ñ€Ğ¸Ñ—Ñ…Ğ°Ğ² Ğ´Ğ¾ Ğ›ÑŒĞ²Ğ¾Ğ²Ğ°, Ğ¾Ğ´Ñ€Ğ°Ğ·Ñƒ Ğ¿Ñ–ÑˆĞ¾Ğ² Ğ´Ğ¾ ÑÑ‚Ğ°Ñ€Ğ¾Ğ³Ğ¾ Ğ¼Ñ–ÑÑ‚Ğ°. (2)___ Ñ Ğ³ÑƒĞ»ÑĞ² Ñ†ĞµĞ½Ñ‚Ñ€Ğ¾Ğ¼, Ñ„Ğ¾Ñ‚Ğ¾Ğ³Ñ€Ğ°Ñ„ÑƒĞ²Ğ°Ğ² ĞºĞ¾Ğ¶Ğ½Ñƒ Ğ±ÑƒĞ´Ñ–Ğ²Ğ»Ñ. (3)___ Ğ¾Ğ±Ñ–Ğ¹ÑˆĞ¾Ğ² ÑƒĞ²ĞµÑÑŒ Ñ†ĞµĞ½Ñ‚Ñ€, Ğ·Ğ°Ğ¹ÑˆĞ¾Ğ² Ñƒ ĞºĞ°Ğ²'ÑÑ€Ğ½Ñ.\n\n(4)___ Ñ Ğ¿Ğ¸Ğ² ĞºĞ°Ğ²Ñƒ, Ğ¿Ğ¾Ğ·Ğ½Ğ°Ğ¹Ğ¾Ğ¼Ğ¸Ğ²ÑÑ Ğ· Ñ†Ñ–ĞºĞ°Ğ²Ğ¾Ñ Ğ»ÑĞ´Ğ¸Ğ½Ğ¾Ñ. (5)___ Ğ¼Ğ¸ Ğ¿Ğ¾Ñ‡Ğ°Ğ»Ğ¸ Ñ€Ğ¾Ğ·Ğ¼Ğ¾Ğ²Ğ»ÑÑ‚Ğ¸, Ñ‡Ğ°Ñ Ğ¼Ğ¸Ğ½ÑƒĞ² Ğ½ĞµĞ¿Ğ¾Ğ¼Ñ–Ñ‚Ğ½Ğ¾. (6)___ Ğ¿Ğ¾Ğ¿Ñ€Ğ¾Ñ‰Ğ°Ñ‚Ğ¸ÑÑ, Ğ¼Ğ¸ Ğ¾Ğ±Ğ¼Ñ–Ğ½ÑĞ»Ğ¸ÑÑ ĞºĞ¾Ğ½Ñ‚Ğ°ĞºÑ‚Ğ°Ğ¼Ğ¸.\n\n(7)___ Ñ Ğ¿Ñ€Ğ¸Ñ—Ñ…Ğ°Ğ² Ğ´Ğ¾Ğ´Ğ¾Ğ¼Ñƒ, Ñ‡Ğ°ÑÑ‚Ğ¾ Ğ·Ğ³Ğ°Ğ´ÑƒÑ Ñ‚Ñƒ Ğ¿Ğ¾Ğ´Ğ¾Ñ€Ğ¾Ğ¶. (8)___ Ñ Ğ±Ğ°Ñ‡Ñƒ Ñ„Ğ¾Ñ‚Ğ¾Ğ³Ñ€Ğ°Ñ„Ñ–Ñ—, Ğ·Ğ½Ğ¾Ğ²Ñƒ Ğ²Ñ–Ğ´Ñ‡ÑƒĞ²Ğ°Ñ Ñ‚Ñƒ Ğ°Ñ‚Ğ¼Ğ¾ÑÑ„ĞµÑ€Ñƒ. (9)___ Ğ½Ğµ Ğ¿Ğ¾Ñ—Ğ´Ñƒ Ñ‚ÑƒĞ´Ğ¸ Ğ·Ğ½Ğ¾Ğ²Ñƒ, Ğ±ÑƒĞ´Ñƒ Ğ¼Ñ€Ñ–ÑÑ‚Ğ¸ Ğ¿Ñ€Ğ¾ Ñ†Ğµ Ğ¼Ñ–ÑÑ‚Ğ¾.\n\n(10)___ Ğ½Ğ°ÑÑ‚Ğ°Ğ½Ğµ Ğ½Ğ°ÑÑ‚ÑƒĞ¿Ğ½Ğµ Ğ»Ñ–Ñ‚Ğ¾, Ğ¾Ğ±Ğ¾Ğ²'ÑĞ·ĞºĞ¾Ğ²Ğ¾ Ğ¿Ğ¾Ğ²ĞµÑ€Ğ½ÑƒÑÑ. (11)___ Ğ¿Ğ¾Ğ±Ğ°Ñ‡Ñƒ Ğ·Ğ½Ğ°Ğ¹Ğ¾Ğ¼Ñ– Ğ²ÑƒĞ»Ğ¸Ñ†Ñ–, Ğ²Ñ–Ğ´Ñ‡ÑƒÑ Ñ‰Ğ°ÑÑ‚Ñ. (12)___ Ğ¿Ğ¾Ñ‡Ğ½Ñƒ Ğ¿Ğ¾Ğ´Ğ¾Ñ€Ğ¾Ğ¶, Ñ€ĞµÑ‚ĞµĞ»ÑŒĞ½Ğ¾ ÑĞ¿Ğ»Ğ°Ğ½ÑƒÑÑ Ğ¼Ğ°Ñ€ÑˆÑ€ÑƒÑ‚. (13)___ Ğ²ÑĞµ Ğ±ÑƒĞ´Ğµ Ğ³Ğ¾Ñ‚Ğ¾Ğ²Ğ¾, Ğ²Ğ¸Ñ€ÑƒÑˆÑƒ Ğ² Ğ´Ğ¾Ñ€Ğ¾Ğ³Ñƒ. (14)___ Ğ¿Ğ¾Ğ´Ğ¾Ñ€Ğ¾Ğ¶ÑƒÑ, Ğ·Ğ°Ğ²Ğ¶Ğ´Ğ¸ Ğ²Ñ–Ğ´ĞºÑ€Ğ¸Ğ²Ğ°Ñ Ğ´Ğ»Ñ ÑĞµĞ±Ğµ Ğ½Ğ¾Ğ²Ğµ.\n\n- (1) :: Ğ¯Ğº Ñ‚Ñ–Ğ»ÑŒĞºĞ¸ | ĞŸĞ¾ĞºĞ¸ | ĞŸĞµÑ€Ñˆ Ğ½Ñ–Ğ¶ | ĞšĞ¾Ğ»Ğ¸\n- (2) :: ĞŸĞ¾ĞºĞ¸ | ĞŸÑ–ÑĞ»Ñ Ñ‚Ğ¾Ğ³Ğ¾ ÑĞº | ĞŸĞµÑ€Ñˆ Ğ½Ñ–Ğ¶ | Ğ”Ğ¾ Ñ‚Ğ¾Ğ³Ğ¾ ÑĞº\n- (3) :: ĞŸÑ–ÑĞ»Ñ Ñ‚Ğ¾Ğ³Ğ¾ ÑĞº | ĞŸĞ¾ĞºĞ¸ | ĞšĞ¾Ğ»Ğ¸ | Ğ”Ğ¾ Ñ‚Ğ¾Ğ³Ğ¾ ÑĞº\n- (4) :: ĞŸĞ¾ĞºĞ¸ | ĞŸÑ–ÑĞ»Ñ Ñ‚Ğ¾Ğ³Ğ¾ ÑĞº | ĞŸĞµÑ€Ñˆ Ğ½Ñ–Ğ¶ | Ğ¯Ğº Ñ‚Ñ–Ğ»ÑŒĞºĞ¸\n- (5) :: Ğ¯Ğº Ñ‚Ñ–Ğ»ÑŒĞºĞ¸ | ĞŸĞ¾ĞºĞ¸ Ğ½Ğµ | ĞŸĞµÑ€Ñˆ Ğ½Ñ–Ğ¶ | Ğ”Ğ¾ Ñ‚Ğ¾Ğ³Ğ¾ ÑĞº\n- (6) :: ĞŸĞµÑ€Ñˆ Ğ½Ñ–Ğ¶ | ĞŸÑ–ÑĞ»Ñ Ñ‚Ğ¾Ğ³Ğ¾ ÑĞº | ĞŸĞ¾ĞºĞ¸ | Ğ¯Ğº Ñ‚Ñ–Ğ»ÑŒĞºĞ¸\n- (7) :: Ğ— Ñ‚Ğ¸Ñ… Ğ¿Ñ–Ñ€ ÑĞº | ĞŸĞµÑ€Ñˆ Ğ½Ñ–Ğ¶ | Ğ”Ğ¾ Ñ‚Ğ¾Ğ³Ğ¾ ÑĞº | Ğ¯Ğº Ñ‚Ñ–Ğ»ÑŒĞºĞ¸\n- (8) :: ĞšĞ¾Ğ¶Ğ½Ğ¾Ğ³Ğ¾ Ñ€Ğ°Ğ·Ñƒ ĞºĞ¾Ğ»Ğ¸ | ĞŸÑ–ÑĞ»Ñ Ñ‚Ğ¾Ğ³Ğ¾ ÑĞº | ĞŸĞµÑ€Ñˆ Ğ½Ñ–Ğ¶ | ĞŸĞ¾ĞºĞ¸\n- (9) :: ĞŸĞ¾ĞºĞ¸ | ĞŸĞ¾ĞºĞ¸ Ğ½Ğµ | Ğ¯Ğº Ñ‚Ñ–Ğ»ÑŒĞºĞ¸ | ĞšĞ¾Ğ»Ğ¸\n- (10) :: Ğ¯Ğº Ñ‚Ñ–Ğ»ÑŒĞºĞ¸ | ĞŸĞ¾ĞºĞ¸ | ĞŸĞµÑ€Ñˆ Ğ½Ñ–Ğ¶ | Ğ”Ğ¾ Ñ‚Ğ¾Ğ³Ğ¾ ÑĞº\n- (11) :: Ğ¯Ğº Ñ‚Ñ–Ğ»ÑŒĞºĞ¸ | ĞŸĞ¾ĞºĞ¸ | ĞŸĞµÑ€Ñˆ Ğ½Ñ–Ğ¶ | ĞŸÑ–ÑĞ»Ñ Ñ‚Ğ¾Ğ³Ğ¾ ÑĞº\n- (12) :: ĞŸĞµÑ€Ñˆ Ğ½Ñ–Ğ¶ | ĞŸÑ–ÑĞ»Ñ Ñ‚Ğ¾Ğ³Ğ¾ ÑĞº | ĞŸĞ¾ĞºĞ¸ | Ğ¯Ğº Ñ‚Ñ–Ğ»ÑŒĞºĞ¸\n- (13) :: Ğ¯Ğº Ñ‚Ñ–Ğ»ÑŒĞºĞ¸ | ĞŸĞ¾ĞºĞ¸ | ĞŸĞµÑ€Ñˆ Ğ½Ñ–Ğ¶ | Ğ”Ğ¾ Ñ‚Ğ¾Ğ³Ğ¾ ÑĞº\n- (14) :: ĞšĞ¾Ğ¶Ğ½Ğ¾Ğ³Ğ¾ Ñ€Ğ°Ğ·Ñƒ ĞºĞ¾Ğ»Ğ¸ | ĞŸÑ–ÑĞ»Ñ Ñ‚Ğ¾Ğ³Ğ¾ ÑĞº | ĞŸĞµÑ€Ñˆ Ğ½Ñ–Ğ¶ | Ğ¯Ğº Ñ‚Ñ–Ğ»ÑŒĞºĞ¸\n\n---\n\n## mark-the-words: ĞŸĞ¾Ğ·Ğ½Ğ°Ñ‡Ñ‚Ğµ Ñ‡Ğ°ÑĞ¾Ğ²Ñ– ÑĞ¿Ğ¾Ğ»ÑƒÑ‡Ğ½Ğ¸ĞºĞ¸\n\n[ĞšĞ¾Ğ»Ğ¸] Ğ²Ñ–Ğ½ Ğ¿Ñ€Ğ¸Ğ¹ÑˆĞ¾Ğ², Ğ¼Ğ¸ Ğ¾Ğ±Ñ–Ğ´Ğ°Ğ»Ğ¸. [ĞŸÑ–ÑĞ»Ñ Ñ‚Ğ¾Ğ³Ğ¾ ÑĞº] Ğ·Ğ°ĞºÑ–Ğ½Ñ‡Ğ¸Ğ»Ğ¸, Ğ¿Ñ–ÑˆĞ»Ğ¸ Ğ½Ğ° Ğ¿Ñ€Ğ¾Ğ³ÑƒĞ»ÑĞ½ĞºÑƒ. [ĞŸĞ¾ĞºĞ¸] Ğ³ÑƒĞ»ÑĞ»Ğ¸, Ñ€Ğ¾Ğ·Ğ¼Ğ¾Ğ²Ğ»ÑĞ»Ğ¸. [ĞŸĞµÑ€Ñˆ Ğ½Ñ–Ğ¶] Ğ¿Ğ¾Ğ²ĞµÑ€Ğ½ÑƒÑ‚Ğ¸ÑÑ, ĞºÑƒĞ¿Ğ¸Ğ»Ğ¸ Ğ¼Ğ¾Ñ€Ğ¾Ğ·Ğ¸Ğ²Ğ¾. [Ğ¯Ğº Ñ‚Ñ–Ğ»ÑŒĞºĞ¸] Ğ¿Ñ€Ğ¸Ğ¹ÑˆĞ»Ğ¸ Ğ´Ğ¾Ğ´Ğ¾Ğ¼Ñƒ, ÑƒĞ²Ñ–Ğ¼ĞºĞ½ÑƒĞ»Ğ¸ Ñ‚ĞµĞ»ĞµĞ²Ñ–Ğ·Ğ¾Ñ€. [ĞšĞ¾Ğ¶Ğ½Ğ¾Ğ³Ğ¾ Ñ€Ğ°Ğ·Ñƒ ĞºĞ¾Ğ»Ğ¸] Ğ´Ğ¸Ğ²Ğ¸Ğ¼Ğ¾ÑÑ Ñ†ĞµĞ¹ ÑĞµÑ€Ñ–Ğ°Ğ», ÑĞ¼Ñ–Ñ”Ğ¼Ğ¾ÑÑ. [Ğ— Ñ‚Ğ¸Ñ… Ğ¿Ñ–Ñ€ ÑĞº] Ğ¿Ğ¾Ñ‡Ğ°Ğ»Ğ¸ Ğ´Ğ¸Ğ²Ğ¸Ñ‚Ğ¸ÑÑ, Ğ½Ğµ Ğ¼Ğ¾Ğ¶ĞµĞ¼Ğ¾ Ğ·ÑƒĞ¿Ğ¸Ğ½Ğ¸Ñ‚Ğ¸ÑÑ. [Ğ”Ğ¾ Ñ‚Ğ¾Ğ³Ğ¾ ÑĞº] Ğ¿Ğ¾Ñ‡Ğ°Ğ»Ğ¸, Ğ½Ğµ Ğ·Ğ½Ğ°Ğ»Ğ¸, Ñ‰Ğ¾ Ğ²Ñ–Ğ½ Ñ‚Ğ°ĞºĞ¸Ğ¹ Ñ†Ñ–ĞºĞ°Ğ²Ğ¸Ğ¹.\n\n---\n\n## dialogue-reorder: Ğ’Ğ¿Ğ¾Ñ€ÑĞ´ĞºÑƒĞ¹Ñ‚Ğµ Ğ´Ñ–Ğ°Ğ»Ğ¾Ğ³\n\n- Ğ¯Ğº Ñ‚Ñ–Ğ»ÑŒĞºĞ¸ Ğ·Ğ°ĞºÑ–Ğ½Ñ‡Ñƒ Ñ†ĞµĞ¹ Ğ¿Ñ€Ğ¾ĞµĞºÑ‚, Ğ¿Ğ¾Ñ—Ğ´ĞµĞ¼Ğ¾ Ñ€Ğ°Ğ·Ğ¾Ğ¼.\n- ĞšĞ¾Ğ»Ğ¸ Ñ‚Ğ¸ Ğ¿Ğ»Ğ°Ğ½ÑƒÑ”Ñˆ Ğ¿Ğ¾Ñ—Ñ…Ğ°Ñ‚Ğ¸ Ñƒ Ğ²Ñ–Ğ´Ğ¿ÑƒÑÑ‚ĞºÑƒ Ñ†ÑŒĞ¾Ğ³Ğ¾ Ñ€Ğ¾ĞºÑƒ?\n- ĞŸĞµÑ€Ñˆ Ğ½Ñ–Ğ¶ Ğ¿Ğ¾Ñ—Ñ…Ğ°Ñ‚Ğ¸, Ñ‚Ñ€ĞµĞ±Ğ° Ğ·Ğ°Ğ²ĞµÑ€ÑˆĞ¸Ñ‚Ğ¸ Ğ²ÑÑ– ÑĞ¿Ñ€Ğ°Ğ²Ğ¸ Ğ½Ğ° Ñ€Ğ¾Ğ±Ğ¾Ñ‚Ñ–.\n- ĞŸĞ¾ĞºĞ¸ Ñ‡ĞµĞºĞ°Ñ, Ğ²Ğ¸Ğ²Ñ‡Ğ°Ñ‚Ğ¸Ğ¼Ñƒ Ñ–Ñ‚Ğ°Ğ»Ñ–Ğ¹ÑÑŒĞºÑƒ Ğ´Ğ»Ñ Ğ¿Ğ¾Ğ´Ğ¾Ñ€Ğ¾Ğ¶Ñ–.\n- ĞŸÑ–ÑĞ»Ñ Ñ‚Ğ¾Ğ³Ğ¾ ÑĞº Ğ¿Ğ¾Ğ²ĞµÑ€Ğ½ĞµĞ¼Ğ¾ÑÑ, Ñ€Ğ¾Ğ·ĞºĞ°Ğ¶ĞµĞ¼ Ğ´Ñ€ÑƒĞ·ÑĞ¼ Ğ¿Ñ€Ğ¾ Ğ¿Ñ€Ğ¸Ğ³Ğ¾Ğ´Ğ¸.\n- Ğ”Ğ¾Ğ±Ñ€Ğµ, Ñ‡ĞµĞºĞ°Ñ‚Ğ¸Ğ¼Ñƒ, Ğ´Ğ¾ĞºĞ¸ Ñ‚Ğ¸ Ğ½Ğµ Ğ·Ğ°ĞºÑ–Ğ½Ñ‡Ğ¸Ñˆ ÑƒÑĞµ.\n\n> [!answer]\n> 1. ĞšĞ¾Ğ»Ğ¸ Ñ‚Ğ¸ Ğ¿Ğ»Ğ°Ğ½ÑƒÑ”Ñˆ Ğ¿Ğ¾Ñ—Ñ…Ğ°Ñ‚Ğ¸ Ñƒ Ğ²Ñ–Ğ´Ğ¿ÑƒÑÑ‚ĞºÑƒ Ñ†ÑŒĞ¾Ğ³Ğ¾ Ñ€Ğ¾ĞºÑƒ?\n> 2. Ğ¯Ğº Ñ‚Ñ–Ğ»ÑŒĞºĞ¸ Ğ·Ğ°ĞºÑ–Ğ½Ñ‡Ñƒ Ñ†ĞµĞ¹ Ğ¿Ñ€Ğ¾ĞµĞºÑ‚, Ğ¿Ğ¾Ñ—Ğ´ĞµĞ¼Ğ¾ Ñ€Ğ°Ğ·Ğ¾Ğ¼.\n> 3. ĞŸĞµÑ€Ñˆ Ğ½Ñ–Ğ¶ Ğ¿Ğ¾Ñ—Ñ…Ğ°Ñ‚Ğ¸, Ñ‚Ñ€ĞµĞ±Ğ° Ğ·Ğ°Ğ²ĞµÑ€ÑˆĞ¸Ñ‚Ğ¸ Ğ²ÑÑ– ÑĞ¿Ñ€Ğ°Ğ²Ğ¸ Ğ½Ğ° Ñ€Ğ¾Ğ±Ğ¾Ñ‚Ñ–.\n> 4. Ğ”Ğ¾Ğ±Ñ€Ğµ, Ñ‡ĞµĞºĞ°Ñ‚Ğ¸Ğ¼Ñƒ, Ğ´Ğ¾ĞºĞ¸ Ñ‚Ğ¸ Ğ½Ğµ Ğ·Ğ°ĞºÑ–Ğ½Ñ‡Ğ¸Ñˆ ÑƒÑĞµ.\n> 5. ĞŸĞ¾ĞºĞ¸ Ñ‡ĞµĞºĞ°Ñ, Ğ²Ğ¸Ğ²Ñ‡Ğ°Ñ‚Ğ¸Ğ¼Ñƒ Ñ–Ñ‚Ğ°Ğ»Ñ–Ğ¹ÑÑŒĞºÑƒ Ğ´Ğ»Ñ Ğ¿Ğ¾Ğ´Ğ¾Ñ€Ğ¾Ğ¶Ñ–.\n> 6. ĞŸÑ–ÑĞ»Ñ Ñ‚Ğ¾Ğ³Ğ¾ ÑĞº Ğ¿Ğ¾Ğ²ĞµÑ€Ğ½ĞµĞ¼Ğ¾ÑÑ, Ñ€Ğ¾Ğ·ĞºĞ°Ğ¶ĞµĞ¼ Ğ´Ñ€ÑƒĞ·ÑĞ¼ Ğ¿Ñ€Ğ¾ Ğ¿Ñ€Ğ¸Ğ³Ğ¾Ğ´Ğ¸.\n\n---\n\n## select: Ğ’Ğ¸Ğ±ĞµÑ€Ñ–Ñ‚ÑŒ ÑƒÑÑ– Ğ³Ñ€Ğ°Ğ¼Ğ°Ñ‚Ğ¸Ñ‡Ğ½Ğ¾ Ğ¿Ñ€Ğ°Ğ²Ğ¸Ğ»ÑŒĞ½Ñ– Ñ€ĞµÑ‡ĞµĞ½Ğ½Ñ\n\n- [x] ĞšĞ¾Ğ»Ğ¸ Ğ²Ñ–Ğ½ Ğ¿Ñ€Ğ¸Ğ¹ÑˆĞ¾Ğ², Ğ¼Ğ¸ Ğ²Ğ¶Ğµ Ğ²ĞµÑ‡ĞµÑ€ÑĞ»Ğ¸.\n- [ ] Ğ§ĞµĞºĞ°Ğ¹, Ğ¿Ğ¾ĞºĞ¸ Ñ Ğ¿Ñ€Ğ¸Ğ¹Ğ´Ñƒ.\n- [x] Ğ§ĞµĞºĞ°Ğ¹, Ğ¿Ğ¾ĞºĞ¸ Ñ Ğ½Ğµ Ğ¿Ñ€Ğ¸Ğ¹Ğ´Ñƒ.\n- [x] ĞŸÑ–ÑĞ»Ñ Ñ‚Ğ¾Ğ³Ğ¾ ÑĞº Ğ²Ñ–Ğ½ Ğ¿Ñ–ÑˆĞ¾Ğ², Ğ½Ğ°ÑÑ‚Ğ°Ğ»Ğ° Ñ‚Ğ¸ÑˆĞ°.\n- [ ] ĞŸĞµÑ€Ñˆ Ğ½Ñ–Ğ¶ Ğ²Ñ–Ğ½ Ğ¿Ñ–ÑˆĞ¾Ğ², Ğ¼Ğ¸ Ğ¿Ñ€Ğ¾Ğ´Ğ¾Ğ²Ğ¶Ğ¸Ğ»Ğ¸ Ñ€Ğ¾Ğ·Ğ¼Ğ¾Ğ²Ñƒ.\n- [x] ĞŸĞµÑ€Ñˆ Ğ½Ñ–Ğ¶ Ğ¿Ñ–Ñ‚Ğ¸, Ğ²Ñ–Ğ½ Ğ¿Ğ¾Ğ¿Ñ€Ğ¾Ñ‰Ğ°Ğ²ÑÑ.\n- [x] Ğ¯Ğº Ñ‚Ñ–Ğ»ÑŒĞºĞ¸ Ğ¿Ğ¾Ñ‡ÑƒĞ²ÑÑ Ğ´Ğ·Ğ²Ñ–Ğ½Ğ¾Ğº, ÑƒÑÑ– Ğ²ÑÑ‚Ğ°Ğ»Ğ¸.\n- [ ] Ğ¯Ğº Ñ‚Ñ–Ğ»ÑŒĞºĞ¸ Ğ²Ñ–Ğ½ Ğ¿Ğ¾ÑÑ‚ÑƒĞ¿Ğ¾Ğ²Ğ¾ Ğ²Ñ‡Ğ¸Ğ²ÑÑ, ÑÑ‚Ğ°Ğ²Ğ°Ğ² ĞºÑ€Ğ°Ñ‰Ğ¸Ğ¼.\n- [x] ĞŸĞ¾ĞºĞ¸ Ğ²Ğ¾Ğ½Ğ° Ğ³Ğ¾Ñ‚ÑƒĞ²Ğ°Ğ»Ğ°, Ğ²Ñ–Ğ½ Ñ‡Ğ¸Ñ‚Ğ°Ğ² Ğ³Ğ°Ğ·ĞµÑ‚Ñƒ.\n- [ ] ĞŸÑ–ÑĞ»Ñ Ñ‚Ğ¾Ğ³Ğ¾ ÑĞº Ğ¼Ğ¸ Ğ¿Ñ€Ğ¸Ñ—Ñ…Ğ°Ğ»Ğ¸, Ñ—Ñ…Ğ°Ğ»Ğ¸ Ñ‚Ñ€Ğ¸ Ğ³Ğ¾Ğ´Ğ¸Ğ½Ğ¸.\n- [x] ĞšĞ¾Ğ¶Ğ½Ğ¾Ğ³Ğ¾ Ñ€Ğ°Ğ·Ñƒ ĞºĞ¾Ğ»Ğ¸ Ğ²Ñ–Ğ½ Ğ¿Ñ€Ğ¸Ñ…Ğ¾Ğ´Ğ¸Ñ‚ÑŒ, Ğ¿Ñ€Ğ¸Ğ½Ğ¾ÑĞ¸Ñ‚ÑŒ ĞºĞ²Ñ–Ñ‚Ğ¸.\n- [x] Ğ— Ñ‚Ğ¸Ñ… Ğ¿Ñ–Ñ€ ÑĞº Ğ²Ñ–Ğ½ Ğ¿ĞµÑ€ĞµÑ—Ñ…Ğ°Ğ², Ğ¼Ğ¸ Ñ€Ñ–Ğ´ĞºĞ¾ Ğ±Ğ°Ñ‡Ğ¸Ğ¼Ğ¾ÑÑ.\n\n---\n\n## translate: ĞŸĞµÑ€ĞµĞºĞ»Ğ°Ğ´Ñ–Ñ‚ÑŒ Ğ½Ğ° ÑƒĞºÑ€Ğ°Ñ—Ğ½ÑÑŒĞºÑƒ Ğ¼Ğ¾Ğ²Ñƒ\n\n1. When he came, we were already having dinner with the whole family.\n   - [x] ĞšĞ¾Ğ»Ğ¸ Ğ²Ñ–Ğ½ Ğ¿Ñ€Ğ¸Ğ¹ÑˆĞ¾Ğ², Ğ¼Ğ¸ Ğ²Ğ¶Ğµ Ğ²ĞµÑ‡ĞµÑ€ÑĞ»Ğ¸ Ğ· ÑƒÑÑ–Ñ”Ñ ÑÑ–Ğ¼'Ñ”Ñ.\n   - [ ] ĞŸÑ–ÑĞ»Ñ Ñ‚Ğ¾Ğ³Ğ¾ ÑĞº Ğ²Ñ–Ğ½ Ğ¿Ñ€Ğ¸Ğ¹ÑˆĞ¾Ğ², Ğ¼Ğ¸ Ğ²ĞµÑ‡ĞµÑ€ÑĞ»Ğ¸.\n   - [ ] ĞŸĞµÑ€Ñˆ Ğ½Ñ–Ğ¶ Ğ²Ñ–Ğ½ Ğ¿Ñ€Ğ¸Ğ¹ÑˆĞ¾Ğ², Ğ¼Ğ¸ Ğ²ĞµÑ‡ĞµÑ€ÑĞ»Ğ¸.\n   - [ ] ĞŸĞ¾ĞºĞ¸ Ğ²Ñ–Ğ½ Ğ¿Ñ€Ğ¸Ğ¹ÑˆĞ¾Ğ², Ğ¼Ğ¸ Ğ²ĞµÑ‡ĞµÑ€ÑĞ»Ğ¸.\n\n2. As soon as the sun rose, we set off on our journey.\n   - [x] Ğ¯Ğº Ñ‚Ñ–Ğ»ÑŒĞºĞ¸ ÑĞ¾Ğ½Ñ†Ğµ Ğ·Ñ–Ğ¹ÑˆĞ»Ğ¾, Ğ¼Ğ¸ Ğ²Ğ¸Ñ€ÑƒÑˆĞ¸Ğ»Ğ¸ Ğ² Ğ´Ğ¾Ñ€Ğ¾Ğ³Ñƒ.\n   - [ ] ĞšĞ¾Ğ»Ğ¸ ÑĞ¾Ğ½Ñ†Ğµ Ğ·Ñ–Ğ¹ÑˆĞ»Ğ¾, Ğ¼Ğ¸ Ğ²Ğ¸Ñ€ÑƒÑˆĞ¸Ğ»Ğ¸.\n   - [ ] ĞŸĞ¾ĞºĞ¸ ÑĞ¾Ğ½Ñ†Ğµ ÑÑ…Ğ¾Ğ´Ğ¸Ğ»Ğ¾, Ğ¼Ğ¸ Ğ²Ğ¸Ñ€ÑƒÑˆĞ¸Ğ»Ğ¸.\n   - [ ] ĞŸĞµÑ€Ñˆ Ğ½Ñ–Ğ¶ ÑĞ¾Ğ½Ñ†Ğµ Ğ·Ñ–Ğ¹ÑˆĞ»Ğ¾, Ğ¼Ğ¸ Ğ²Ğ¸Ñ€ÑƒÑˆĞ¸Ğ»Ğ¸.\n\n3. Before leaving, he said goodbye to everyone in the office.\n   - [x] ĞŸĞµÑ€Ñˆ Ğ½Ñ–Ğ¶ Ğ¿Ñ–Ñ‚Ğ¸, Ğ²Ñ–Ğ½ Ğ¿Ğ¾Ğ¿Ñ€Ğ¾Ñ‰Ğ°Ğ²ÑÑ Ğ· ÑƒÑÑ–Ğ¼Ğ° Ğ² Ğ¾Ñ„Ñ–ÑÑ–.\n   - [ ] ĞŸÑ–ÑĞ»Ñ Ñ‚Ğ¾Ğ³Ğ¾ ÑĞº Ğ¿Ñ–ÑˆĞ¾Ğ², Ğ²Ñ–Ğ½ Ğ¿Ğ¾Ğ¿Ñ€Ğ¾Ñ‰Ğ°Ğ²ÑÑ.\n   - [ ] ĞšĞ¾Ğ»Ğ¸ Ğ¿Ñ–ÑˆĞ¾Ğ², Ğ²Ñ–Ğ½ Ğ¿Ğ¾Ğ¿Ñ€Ğ¾Ñ‰Ğ°Ğ²ÑÑ.\n   - [ ] ĞŸĞ¾ĞºĞ¸ Ğ¹ÑˆĞ¾Ğ², Ğ²Ñ–Ğ½ Ğ¿Ñ€Ğ¾Ñ‰Ğ°Ğ²ÑÑ.\n\n4. Wait here until I return from the store with groceries.\n   - [x] Ğ§ĞµĞºĞ°Ğ¹ Ñ‚ÑƒÑ‚, Ğ¿Ğ¾ĞºĞ¸ Ñ Ğ½Ğµ Ğ¿Ğ¾Ğ²ĞµÑ€Ğ½ÑƒÑÑ Ğ· Ğ¼Ğ°Ğ³Ğ°Ğ·Ğ¸Ğ½Ñƒ Ğ· Ğ¿Ñ€Ğ¾Ğ´ÑƒĞºÑ‚Ğ°Ğ¼Ğ¸.\n   - [ ] Ğ§ĞµĞºĞ°Ğ¹ Ñ‚ÑƒÑ‚, Ğ¿Ğ¾ĞºĞ¸ Ñ Ğ¿Ğ¾Ğ²ĞµÑ€Ğ½ÑƒÑÑ.\n   - [ ] Ğ§ĞµĞºĞ°Ğ¹ Ñ‚ÑƒÑ‚, ĞºĞ¾Ğ»Ğ¸ Ñ Ğ¿Ğ¾Ğ²ĞµÑ€Ğ½ÑƒÑÑ.\n   - [ ] Ğ§ĞµĞºĞ°Ğ¹ Ñ‚ÑƒÑ‚, Ğ¿Ñ–ÑĞ»Ñ Ñ‚Ğ¾Ğ³Ğ¾ ÑĞº Ğ¿Ğ¾Ğ²ĞµÑ€Ğ½ÑƒÑÑ.\n\n5. While she was cooking dinner, he was reading a newspaper.\n   - [x] ĞŸĞ¾ĞºĞ¸ Ğ²Ğ¾Ğ½Ğ° Ğ³Ğ¾Ñ‚ÑƒĞ²Ğ°Ğ»Ğ° Ğ²ĞµÑ‡ĞµÑ€Ñ, Ğ²Ñ–Ğ½ Ñ‡Ğ¸Ñ‚Ğ°Ğ² Ğ³Ğ°Ğ·ĞµÑ‚Ñƒ.\n   - [ ] ĞšĞ¾Ğ»Ğ¸ Ğ²Ğ¾Ğ½Ğ° Ğ³Ğ¾Ñ‚ÑƒĞ²Ğ°Ğ»Ğ° Ğ²ĞµÑ‡ĞµÑ€Ñ, Ğ²Ñ–Ğ½ Ñ‡Ğ¸Ñ‚Ğ°Ğ².\n   - [ ] ĞŸÑ–ÑĞ»Ñ Ñ‚Ğ¾Ğ³Ğ¾ ÑĞº Ğ²Ğ¾Ğ½Ğ° Ğ³Ğ¾Ñ‚ÑƒĞ²Ğ°Ğ»Ğ°, Ğ²Ñ–Ğ½ Ñ‡Ğ¸Ñ‚Ğ°Ğ².\n   - [ ] ĞŸĞµÑ€Ñˆ Ğ½Ñ–Ğ¶ Ğ²Ğ¾Ğ½Ğ° Ğ³Ğ¾Ñ‚ÑƒĞ²Ğ°Ğ»Ğ°, Ğ²Ñ–Ğ½ Ñ‡Ğ¸Ñ‚Ğ°Ğ².\n\n6. Every time I visit this city, I remember my childhood years.\n   - [x] ĞšĞ¾Ğ¶Ğ½Ğ¾Ğ³Ğ¾ Ñ€Ğ°Ğ·Ñƒ ĞºĞ¾Ğ»Ğ¸ Ñ Ğ²Ñ–Ğ´Ğ²Ñ–Ğ´ÑƒÑ Ñ†Ğµ Ğ¼Ñ–ÑÑ‚Ğ¾, Ğ·Ğ³Ğ°Ğ´ÑƒÑ Ğ´Ğ¸Ñ‚ÑÑ‡Ñ– Ñ€Ğ¾ĞºĞ¸.\n   - [ ] ĞšĞ¾Ğ»Ğ¸ Ñ Ğ²Ñ–Ğ´Ğ²Ñ–Ğ´ÑƒÑ Ñ†Ğµ Ğ¼Ñ–ÑÑ‚Ğ¾, Ğ·Ğ³Ğ°Ğ´ÑƒÑ.\n   - [ ] ĞŸÑ–ÑĞ»Ñ Ñ‚Ğ¾Ğ³Ğ¾ ÑĞº Ğ²Ñ–Ğ´Ğ²Ñ–Ğ´ÑƒÑ Ğ¼Ñ–ÑÑ‚Ğ¾, Ğ·Ğ³Ğ°Ğ´ÑƒÑ.\n   - [ ] ĞŸĞ¾ĞºĞ¸ Ğ²Ñ–Ğ´Ğ²Ñ–Ğ´ÑƒÑ Ğ¼Ñ–ÑÑ‚Ğ¾, Ğ·Ğ³Ğ°Ğ´ÑƒÑ.\n\n---"
      },
      {
        "id": "section-3",
        "name": "Ğ¡Ğ»Ğ¾Ğ²Ğ½Ğ¸Ğº",
        "nameEn": null,
        "type": "vocabulary",
        "content": "| Ğ¡Ğ»Ğ¾Ğ²Ğ¾ | Ğ’Ğ¸Ğ¼Ğ¾Ğ²Ğ° | ĞŸĞµÑ€ĞµĞºĞ»Ğ°Ğ´ | Ğ§Ğœ | ĞŸÑ€Ğ¸Ğ¼Ñ–Ñ‚ĞºĞ° |\n|-------|--------|----------|-----|----------|\n| **ĞºĞ¾Ğ»Ğ¸** | /kÉ”ËˆlÉª/ | when | ÑĞ¿Ğ¾Ğ»ÑƒÑ‡Ğ½. | ÑƒĞ½Ñ–Ğ²ĞµÑ€ÑĞ°Ğ»ÑŒĞ½Ğ¸Ğ¹ Ñ‡Ğ°ÑĞ¾Ğ²Ğ¸Ğ¹ |\n| **Ğ¿Ñ–ÑĞ»Ñ Ñ‚Ğ¾Ğ³Ğ¾ ÑĞº** | /ËˆpÊ²islÊ²É‘ tÉ”ËˆÉ¦É” jÉ‘k/ | after | ÑĞ¿Ğ¾Ğ»ÑƒÑ‡Ğ½. | Ğ¿Ğ¾ÑĞ»Ñ–Ğ´Ğ¾Ğ²Ğ½Ñ–ÑÑ‚ÑŒ |\n| **Ğ¿ĞµÑ€Ñˆ Ğ½Ñ–Ğ¶** | /pÉ›rÊƒ nÊ²iÊ’/ | before | ÑĞ¿Ğ¾Ğ»ÑƒÑ‡Ğ½. | Ğ¿Ğ¾Ğ¿ĞµÑ€ĞµĞ´Ğ½Ñ–ÑÑ‚ÑŒ |\n| **Ğ¿ĞµÑ€ĞµĞ´ Ñ‚Ğ¸Ğ¼ ÑĞº** | /ËˆpÉ›rÉ›d tÉªm jÉ‘k/ | before | ÑĞ¿Ğ¾Ğ»ÑƒÑ‡Ğ½. | ÑĞ¸Ğ½Ğ¾Ğ½Ñ–Ğ¼ Â«Ğ¿ĞµÑ€Ñˆ Ğ½Ñ–Ğ¶Â» |\n| **Ğ´Ğ¾ Ñ‚Ğ¾Ğ³Ğ¾ ÑĞº** | /dÉ” tÉ”ËˆÉ¦É” jÉ‘k/ | before | ÑĞ¿Ğ¾Ğ»ÑƒÑ‡Ğ½. | Ñ„Ğ¾Ñ€Ğ¼Ğ°Ğ»ÑŒĞ½Ğ¸Ğ¹ Ğ²Ğ°Ñ€Ñ–Ğ°Ğ½Ñ‚ |\n| **Ğ¿Ğ¾ĞºĞ¸** | /ËˆpÉ”kÉª/ | while | ÑĞ¿Ğ¾Ğ»ÑƒÑ‡Ğ½. | Ñ‚Ñ€Ğ¸Ğ²Ğ°Ğ»Ñ–ÑÑ‚ÑŒ |\n| **Ğ¿Ğ¾ĞºĞ¸ Ğ½Ğµ** | /ËˆpÉ”kÉª nÉ›/ | until | ÑĞ¿Ğ¾Ğ»ÑƒÑ‡Ğ½. | Ğ¾Ñ‡Ñ–ĞºÑƒĞ²Ğ°Ğ½Ğ½Ñ Ñ€ĞµĞ·ÑƒĞ»ÑŒÑ‚Ğ°Ñ‚Ñƒ |\n| **Ğ´Ğ¾ĞºĞ¸** | /ËˆdÉ”kÉª/ | while, as long as | ÑĞ¿Ğ¾Ğ»ÑƒÑ‡Ğ½. | ÑĞ¸Ğ½Ğ¾Ğ½Ñ–Ğ¼ Â«Ğ¿Ğ¾ĞºĞ¸Â» |\n| **Ğ´Ğ¾ĞºĞ¸ Ğ½Ğµ** | /ËˆdÉ”kÉª nÉ›/ | until | ÑĞ¿Ğ¾Ğ»ÑƒÑ‡Ğ½. | ÑĞ¸Ğ½Ğ¾Ğ½Ñ–Ğ¼ Â«Ğ¿Ğ¾ĞºĞ¸ Ğ½ĞµÂ» |\n| **ÑĞº Ñ‚Ñ–Ğ»ÑŒĞºĞ¸** | /jÉ‘k ËˆtÊ²ilÊ²kÉª/ | as soon as | ÑĞ¿Ğ¾Ğ»ÑƒÑ‡Ğ½. | Ğ½ĞµĞ³Ğ°Ğ¹Ğ½Ğ° Ñ€ĞµĞ°ĞºÑ†Ñ–Ñ |\n| **Ñ‰Ğ¾Ğ¹Ğ½Ğ¾** | /ËˆÊƒtÊƒÉ”jnÉ”/ | just, barely | ÑĞ¿Ğ¾Ğ»ÑƒÑ‡Ğ½. | Ğ¼Ğ¸Ñ‚Ñ‚Ñ”Ğ²Ñ–ÑÑ‚ÑŒ |\n| **Ğ»ĞµĞ´Ğ²Ğµ** | /ËˆlÉ›dwÉ›/ | scarcely, hardly | ÑĞ¿Ğ¾Ğ»ÑƒÑ‡Ğ½. | Ğ»ĞµĞ´Ğ²Ğµ Ğ²ÑÑ‚Ğ¸Ğ³ |\n| **Ğ¼Ğ°Ğ»Ğ¾ Ğ½Ğµ** | /ËˆmÉ‘lÉ” nÉ›/ | almost | Ğ²Ğ¸Ñ€Ğ°Ğ· | Ğ»ĞµĞ´Ğ²Ğµ Ğ½Ğµ |\n| **Ñƒ Ñ‚Ğ¾Ğ¹ Ñ‡Ğ°Ñ ÑĞº** | /u tÉ”j tÊƒÉ‘s jÉ‘k/ | while, whereas | ÑĞ¿Ğ¾Ğ»ÑƒÑ‡Ğ½. | Ğ¿Ğ°Ñ€Ğ°Ğ»ĞµĞ»ÑŒĞ½Ñ–ÑÑ‚ÑŒ |\n| **Ğ² Ğ¼Ñ–Ñ€Ñƒ Ñ‚Ğ¾Ğ³Ğ¾ ÑĞº** | /w ËˆmÊ²iru tÉ”ËˆÉ¦É” jÉ‘k/ | as, to the extent that | ÑĞ¿Ğ¾Ğ»ÑƒÑ‡Ğ½. | Ğ¿Ğ¾ÑÑ‚ÑƒĞ¿Ğ¾Ğ²Ñ–ÑÑ‚ÑŒ |\n| **Ñƒ Ñ‚Ğ¾Ğ¹ Ğ¼Ğ¾Ğ¼ĞµĞ½Ñ‚ ĞºĞ¾Ğ»Ğ¸** | /u tÉ”j mÉ”ËˆmÉ›nt kÉ”ËˆlÉª/ | at the moment when | Ğ²Ğ¸Ñ€Ğ°Ğ· | Ñ‚Ğ¾Ñ‡Ğ½Ğ¸Ğ¹ Ğ¼Ğ¾Ğ¼ĞµĞ½Ñ‚ |\n| **Ğ²Ñ–Ğ´Ñ‚Ğ¾Ğ´Ñ– ÑĞº** | /wÊ²idtÉ”ËˆdÊ²i jÉ‘k/ | since then | ÑĞ¿Ğ¾Ğ»ÑƒÑ‡Ğ½. | Ğ²Ñ–Ğ´ Ğ¼Ğ¸Ğ½ÑƒĞ»Ğ¾Ğ³Ğ¾ Ğ¼Ğ¾Ğ¼ĞµĞ½Ñ‚Ñƒ |\n| **Ğ· Ñ‚Ğ¸Ñ… Ğ¿Ñ–Ñ€ ÑĞº** | /z tÉªx pÊ²ir jÉ‘k/ | since | ÑĞ¿Ğ¾Ğ»ÑƒÑ‡Ğ½. | ÑĞ¸Ğ½Ğ¾Ğ½Ñ–Ğ¼ Â«Ğ²Ñ–Ğ´Ñ‚Ğ¾Ğ´Ñ– ÑĞºÂ» |\n| **Ğ´Ğ¾ Ñ‚Ğ¸Ñ… Ğ¿Ñ–Ñ€ Ğ¿Ğ¾ĞºĞ¸** | /dÉ” tÉªx pÊ²ir ËˆpÉ”kÉª/ | until | Ğ²Ğ¸Ñ€Ğ°Ğ· | Ğ´Ğ¾ Ğ´Ğ¾ÑÑĞ³Ğ½ĞµĞ½Ğ½Ñ |\n| **Ğ²ĞµÑÑŒ Ñ‡Ğ°Ñ Ğ¿Ğ¾ĞºĞ¸** | /wÉ›sÊ² tÊƒÉ‘s ËˆpÉ”kÉª/ | the whole time while | Ğ²Ğ¸Ñ€Ğ°Ğ· | ÑƒĞ²ĞµÑÑŒ Ğ¿ĞµÑ€Ñ–Ğ¾Ğ´ |\n| **ĞºĞ¾Ğ¶Ğ½Ğ¾Ğ³Ğ¾ Ñ€Ğ°Ğ·Ñƒ ĞºĞ¾Ğ»Ğ¸** | /ËˆkÉ”Ê’nÉ”É¦É” ËˆrÉ‘zu kÉ”ËˆlÉª/ | every time when | Ğ²Ğ¸Ñ€Ğ°Ğ· | Ñ€ĞµĞ³ÑƒĞ»ÑÑ€Ğ½Ñ–ÑÑ‚ÑŒ |\n| **Ñ‰Ğ¾Ñ€Ğ°Ğ·Ñƒ ÑĞº** | /ËˆÊƒtÊƒÉ”rÉ‘zu jÉ‘k/ | each time when | Ğ²Ğ¸Ñ€Ğ°Ğ· | ÑĞ¸Ğ½Ğ¾Ğ½Ñ–Ğ¼ |\n| **Ğ¾Ğ´Ğ½Ğ¾Ñ‡Ğ°ÑĞ½Ñ–ÑÑ‚ÑŒ** | /É”dnÉ”ËˆtÊƒÉ‘snÊ²istÊ²/ | simultaneity | Ñ–Ğ¼. (Ğ¶.Ñ€.) | Ğ¿Ğ°Ñ€Ğ°Ğ»ĞµĞ»ÑŒĞ½Ñ–ÑÑ‚ÑŒ Ğ´Ñ–Ğ¹ |\n| **Ğ¿Ğ¾ÑĞ»Ñ–Ğ´Ğ¾Ğ²Ğ½Ñ–ÑÑ‚ÑŒ** | /pÉ”slÊ²iËˆdÉ”wnÊ²istÊ²/ | sequence | Ñ–Ğ¼. (Ğ¶.Ñ€.) | Ğ¿Ğ¾Ñ€ÑĞ´Ğ¾Ğº Ğ´Ñ–Ğ¹ |\n| **Ğ¿Ğ¾Ğ¿ĞµÑ€ĞµĞ´Ğ½Ñ–ÑÑ‚ÑŒ** | /pÉ”pÉ›ËˆrÉ›dnÊ²istÊ²/ | precedence | Ñ–Ğ¼. (Ğ¶.Ñ€.) | Ñ€Ğ°Ğ½Ñ–ÑˆĞµ Ğ·Ğ° Ñ–Ğ½ÑˆÑƒ Ğ´Ñ–Ñ |"
      }
    ],
    "rawMarkdown": "---\nmodule: b1-37\ntitle: \"Ğ§Ğ°ÑĞ¾Ğ²Ñ– Ğ¿Ñ–Ğ´Ñ€ÑĞ´Ğ½Ñ– Ñ€ĞµÑ‡ĞµĞ½Ğ½Ñ\"\nsubtitle: \"Temporal Clauses Deep Dive\"\nversion: \"1.0\"\nphase: \"B1.3b Complex Sentences\"\npedagogy: \"TTT\"\nduration: 90\ntransliteration: none\ntags:\n  - grammar\n  - complex-sentences\n  - temporal-clauses\ngrammar:\n  - \"Temporal clause constructions with ĞºĞ¾Ğ»Ğ¸, Ğ¿Ñ–ÑĞ»Ñ Ñ‚Ğ¾Ğ³Ğ¾ ÑĞº, Ğ¿Ğ¾ĞºĞ¸\"\n  - \"Sequence of events with Ğ¿ĞµÑ€Ñˆ Ğ½Ñ–Ğ¶, ÑĞº Ñ‚Ñ–Ğ»ÑŒĞºĞ¸\"\nobjectives:\n  - \"Learner can express Ñ‡Ğ°ÑĞ¾Ğ²Ñ– Ğ²Ñ–Ğ´Ğ½Ğ¾ÑˆĞµĞ½Ğ½Ñ using various temporal connectors\"\n  - \"Learner can sequence events using appropriate temporal markers\"\n  - \"Learner can distinguish simultaneous vs sequential actions\"\nvocabulary_count: 25\n---\n\n> [!motivation]\n> ĞšĞ¾Ğ»Ğ¸ Ñ†Ğµ ÑÑ‚Ğ°Ğ»Ğ¾ÑÑ? Ğ©Ğ¾ Ğ±ÑƒĞ»Ğ¾ Ñ€Ğ°Ğ½Ñ–ÑˆĞµ, Ğ° Ñ‰Ğ¾ Ğ¿Ğ¾Ñ‚Ñ–Ğ¼? Ğ§Ğ°ÑĞ¾Ğ²Ñ– ÑĞ¿Ğ¾Ğ»ÑƒÑ‡Ğ½Ğ¸ĞºĞ¸ â€” Ñ†Ğµ Ñ…Ñ€Ğ¾Ğ½Ğ¾Ğ»Ğ¾Ğ³Ñ–Ñ‡Ğ½Ğ° ĞºĞ°Ñ€Ñ‚Ğ° Ğ²Ğ°ÑˆĞ¾Ğ³Ğ¾ Ğ¼Ğ¾Ğ²Ğ»ĞµĞ½Ğ½Ñ ÑƒĞºÑ€Ğ°Ñ—Ğ½ÑÑŒĞºĞ¾Ñ Ğ¼Ğ¾Ğ²Ğ¾Ñ. Ğ’Ğ¾Ğ½Ğ¸ Ğ´Ğ¾Ğ·Ğ²Ğ¾Ğ»ÑÑÑ‚ÑŒ Ğ±ÑƒĞ´ÑƒĞ²Ğ°Ñ‚Ğ¸ ÑĞºĞ»Ğ°Ğ´Ğ½Ñ– Ğ½Ğ°Ñ€Ğ°Ñ‚Ğ¸Ğ²Ğ¸, Ğ¾Ğ¿Ğ¸ÑÑƒĞ²Ğ°Ñ‚Ğ¸ Ğ¿Ğ¾ÑĞ»Ñ–Ğ´Ğ¾Ğ²Ğ½Ñ–ÑÑ‚ÑŒ Ğ¿Ğ¾Ğ´Ñ–Ğ¹ Ñ– Ñ‚Ğ¾Ñ‡Ğ½Ğ¾ Ğ¿ĞµÑ€ĞµĞ´Ğ°Ğ²Ğ°Ñ‚Ğ¸ Ñ‡Ğ°ÑĞ¾Ğ²Ñ– Ğ²Ñ–Ğ´Ğ½Ğ¾ÑˆĞµĞ½Ğ½Ñ Ğ¼Ñ–Ğ¶ Ğ´Ñ–ÑĞ¼Ğ¸. Ğ‘ĞµĞ· Ğ½Ğ¸Ñ… Ğ½ĞµĞ¼Ğ¾Ğ¶Ğ»Ğ¸Ğ²Ğ¾ Ñ€Ğ¾Ğ·Ğ¿Ğ¾Ğ²Ñ–ÑÑ‚Ğ¸ Ñ†Ñ–ĞºĞ°Ğ²Ñƒ Ñ–ÑÑ‚Ğ¾Ñ€Ñ–Ñ Ñ‡Ğ¸ Ğ¿Ğ¾ÑÑĞ½Ğ¸Ñ‚Ğ¸ ÑĞºĞ»Ğ°Ğ´Ğ½Ğ¸Ğ¹ Ğ¿Ñ€Ğ¾Ñ†ĞµÑ. ĞĞ¿Ğ°Ğ½ÑƒĞ¹Ñ‚Ğµ Ñ†Ñ– ĞºĞ¾Ğ½ÑÑ‚Ñ€ÑƒĞºÑ†Ñ–Ñ— â€” Ñ– Ğ²Ğ°ÑˆÑ– Ñ€Ğ¾Ğ·Ğ¿Ğ¾Ğ²Ñ–Ğ´Ñ– ÑÑ‚Ğ°Ğ½ÑƒÑ‚ÑŒ Ñ‡Ñ–Ñ‚ĞºĞ¸Ğ¼Ğ¸, Ğ»Ğ¾Ğ³Ñ–Ñ‡Ğ½Ğ¸Ğ¼Ğ¸ Ñ‚Ğ° Ğ·Ğ°Ñ…Ğ¾Ğ¿Ğ»Ğ¸Ğ²Ğ¸Ğ¼Ğ¸ Ğ´Ğ»Ñ ÑĞ»ÑƒÑ…Ğ°Ñ‡Ñ–Ğ²!\n\n---\n\n## Ğ¢ĞµÑÑ‚\n\nĞŸÑ€Ğ¾Ñ‡Ğ¸Ñ‚Ğ°Ğ¹Ñ‚Ğµ ÑƒĞ²Ğ°Ğ¶Ğ½Ğ¾ Ñ‚Ñ€Ğ¸ Ñ€ĞµÑ‡ĞµĞ½Ğ½Ñ Ğ½Ğ¸Ğ¶Ñ‡Ğµ Ñ– Ğ²Ğ¸Ğ·Ğ½Ğ°Ñ‡Ñ‚Ğµ Ñ‡Ğ°ÑĞ¾Ğ²Ñ– Ğ²Ñ–Ğ´Ğ½Ğ¾ÑˆĞµĞ½Ğ½Ñ:\n\n1. **ĞšĞ¾Ğ»Ğ¸ Ğ²Ñ–Ğ½ Ğ¿Ñ€Ğ¸Ğ¹ÑˆĞ¾Ğ², Ğ¼Ğ¸ Ğ³Ğ¾Ğ²Ğ¾Ñ€Ğ¸Ğ»Ğ¸.** (Ğ¾Ğ´Ğ½Ğ¾Ñ‡Ğ°ÑĞ½Ñ–ÑÑ‚ÑŒ)\n2. **ĞŸÑ–ÑĞ»Ñ Ñ‚Ğ¾Ğ³Ğ¾ ÑĞº Ğ²Ñ–Ğ½ Ğ¿Ñ–ÑˆĞ¾Ğ², Ğ¼Ğ¸ Ğ¿Ñ€Ğ¾Ğ´Ğ¾Ğ²Ğ¶Ğ¸Ğ»Ğ¸ Ñ€Ğ¾Ğ·Ğ¼Ğ¾Ğ²Ñƒ.** (Ğ¿Ğ¾ÑĞ»Ñ–Ğ´Ğ¾Ğ²Ğ½Ñ–ÑÑ‚ÑŒ)\n3. **ĞŸĞµÑ€Ñˆ Ğ½Ñ–Ğ¶ Ğ¿Ñ–Ñ‚Ğ¸, Ğ²Ñ–Ğ½ Ğ¿Ğ¾Ğ¿Ñ€Ğ¾Ñ‰Ğ°Ğ²ÑÑ.** (Ğ¿Ğ¾Ğ¿ĞµÑ€ĞµĞ´Ğ½Ñ Ğ´Ñ–Ñ)\n\nĞšĞ¾Ğ¶Ğ½Ğµ Ñ€ĞµÑ‡ĞµĞ½Ğ½Ñ Ğ¾Ğ¿Ğ¸ÑÑƒÑ” Ñ€Ñ–Ğ·Ğ½Ñ– Ñ‡Ğ°ÑĞ¾Ğ²Ñ– Ğ²Ñ–Ğ´Ğ½Ğ¾ÑˆĞµĞ½Ğ½Ñ:\n- **ĞŸĞµÑ€ÑˆĞµ Ñ€ĞµÑ‡ĞµĞ½Ğ½Ñ:** Ğ´Ñ–Ñ— Ğ²Ñ–Ğ´Ğ±ÑƒĞ²Ğ°ÑÑ‚ÑŒÑÑ **Ğ¾Ğ´Ğ½Ğ¾Ñ‡Ğ°ÑĞ½Ğ¾** â€” Ğ²Ñ–Ğ½ Ğ¿Ñ€Ğ¸Ğ¹ÑˆĞ¾Ğ², Ñ– Ğ² Ñ‚Ğ¾Ğ¹ Ğ¼Ğ¾Ğ¼ĞµĞ½Ñ‚ Ğ¼Ğ¸ Ğ³Ğ¾Ğ²Ğ¾Ñ€Ğ¸Ğ»Ğ¸.\n- **Ğ”Ñ€ÑƒĞ³Ğµ Ñ€ĞµÑ‡ĞµĞ½Ğ½Ñ:** Ğ¾Ğ´Ğ½Ğ° Ğ´Ñ–Ñ **Ğ¿Ñ–ÑĞ»Ñ** Ñ–Ğ½ÑˆĞ¾Ñ— â€” ÑĞ¿Ğ¾Ñ‡Ğ°Ñ‚ĞºÑƒ Ğ²Ñ–Ğ½ Ğ¿Ñ–ÑˆĞ¾Ğ², Ğ¿Ğ¾Ñ‚Ñ–Ğ¼ Ğ¼Ğ¸ Ğ¿Ñ€Ğ¾Ğ´Ğ¾Ğ²Ğ¶Ğ¸Ğ»Ğ¸.\n- **Ğ¢Ñ€ĞµÑ‚Ñ” Ñ€ĞµÑ‡ĞµĞ½Ğ½Ñ:** Ğ¾Ğ´Ğ½Ğ° Ğ´Ñ–Ñ **Ğ¿ĞµÑ€ĞµĞ´** Ñ–Ğ½ÑˆĞ¾Ñ â€” ÑĞ¿Ğ¾Ñ‡Ğ°Ñ‚ĞºÑƒ Ğ¿Ğ¾Ğ¿Ñ€Ğ¾Ñ‰Ğ°Ğ²ÑÑ, Ğ¿Ğ¾Ñ‚Ñ–Ğ¼ Ğ¿Ñ–ÑˆĞ¾Ğ².\n\nĞ¦Ğµ â€” **Ñ‡Ğ°ÑĞ¾Ğ²Ñ– Ğ¿Ñ–Ğ´Ñ€ÑĞ´Ğ½Ñ– Ñ€ĞµÑ‡ĞµĞ½Ğ½Ñ** Ğ² ÑƒĞºÑ€Ğ°Ñ—Ğ½ÑÑŒĞºÑ–Ğ¹ Ğ¼Ğ¾Ğ²Ñ–. Ğ Ñ–Ğ·Ğ½Ñ– ÑĞ¿Ğ¾Ğ»ÑƒÑ‡Ğ½Ğ¸ĞºĞ¸, Ñ€Ñ–Ğ·Ğ½Ñ– Ñ‡Ğ°ÑĞ¾Ğ²Ñ– Ğ²Ñ–Ğ´Ğ½Ğ¾ÑˆĞµĞ½Ğ½Ñ Ñ‚Ğ° Ğ·Ğ½Ğ°Ñ‡ĞµĞ½Ğ½Ñ.\n\n> ğŸ’¡ **Ğ¦Ñ–ĞºĞ°Ğ²Ğ¸Ğ¹ Ñ„Ğ°ĞºÑ‚**\n> Ğ§Ğ°ÑĞ¾Ğ²Ñ– ÑĞ¿Ğ¾Ğ»ÑƒÑ‡Ğ½Ğ¸ĞºĞ¸ â€” Ñ†Ğµ Ğ½Ğ°Ğ¹Ğ´Ğ°Ğ²Ğ½Ñ–ÑˆĞ¸Ğ¹ Ñ‚Ğ¸Ğ¿ ÑĞºĞ»Ğ°Ğ´Ğ½Ğ¸Ñ… ĞºĞ¾Ğ½ÑÑ‚Ñ€ÑƒĞºÑ†Ñ–Ğ¹ Ñƒ Ğ±ÑƒĞ´ÑŒ-ÑĞºÑ–Ğ¹ Ğ¼Ğ¾Ğ²Ñ–. Ğ©Ğµ Ğ¿ĞµÑ€Ğ²Ñ–ÑĞ½Ñ– Ğ»ÑĞ´Ğ¸ Ğ¿Ğ¾Ñ‚Ñ€ĞµĞ±ÑƒĞ²Ğ°Ğ»Ğ¸ ÑĞ¿Ğ¾ÑĞ¾Ğ±Ñƒ Ğ¾Ğ¿Ğ¸ÑĞ°Ñ‚Ğ¸: Â«ĞšĞ¾Ğ»Ğ¸ ÑĞ¾Ğ½Ñ†Ğµ Ğ·Ñ–Ğ¹ÑˆĞ»Ğ¾, Ğ¼Ğ¸ Ğ²Ğ¸Ğ¹ÑˆĞ»Ğ¸ Ğ½Ğ° Ğ¿Ğ¾Ğ»ÑĞ²Ğ°Ğ½Ğ½Ñ.Â» Ğ£ĞºÑ€Ğ°Ñ—Ğ½ÑÑŒĞºĞ° Ğ¼Ğ¾Ğ²Ğ° Ğ·Ğ±ĞµÑ€ĞµĞ³Ğ»Ğ° Ğ±Ğ°Ğ³Ğ°Ñ‚Ñƒ ÑĞ¸ÑÑ‚ĞµĞ¼Ñƒ Ñ‡Ğ°ÑĞ¾Ğ²Ğ¸Ñ… ÑĞ¿Ğ¾Ğ»ÑƒÑ‡Ğ½Ğ¸ĞºÑ–Ğ², ÑĞºĞ° Ğ´Ğ¾Ğ·Ğ²Ğ¾Ğ»ÑÑ” Ñ‚Ğ¾Ñ‡Ğ½Ğ¾ Ğ¿ĞµÑ€ĞµĞ´Ğ°Ñ‚Ğ¸ Ğ½Ğ°Ğ¹Ñ‚Ğ¾Ğ½ÑˆÑ– Ğ½ÑĞ°Ğ½ÑĞ¸ Ñ‡Ğ°ÑĞ¾Ğ²Ğ¸Ñ… Ğ²Ñ–Ğ´Ğ½Ğ¾ÑˆĞµĞ½ÑŒ! Ğ¡Ğ°Ğ¼Ğµ Ñ†Ñ Ğ±Ğ°Ğ³Ğ°Ñ‚Ğ¾Ğ³Ñ€Ğ°Ğ½Ğ½Ñ–ÑÑ‚ÑŒ Ñ€Ğ¾Ğ±Ğ¸Ñ‚ÑŒ ÑƒĞºÑ€Ğ°Ñ—Ğ½ÑÑŒĞºÑƒ Ğ¼Ğ¾Ğ²Ñƒ Ğ¾ÑĞ¾Ğ±Ğ»Ğ¸Ğ²Ğ¾ Ğ²Ğ¸Ñ€Ğ°Ğ·Ğ½Ğ¾Ñ Ñ‚Ğ° Ñ‚Ğ¾Ñ‡Ğ½Ğ¾Ñ Ñƒ Ğ²Ğ¸Ñ€Ğ°Ğ¶ĞµĞ½Ğ½Ñ– Ñ‡Ğ°ÑĞ¾Ğ²Ğ¸Ñ… ĞºĞ¾Ğ½Ñ†ĞµĞ¿Ñ†Ñ–Ğ¹.\n\n---\n\n## ĞŸĞ¾ÑÑĞ½ĞµĞ½Ğ½Ñ\n\n### ĞĞ´Ğ½Ğ¾Ñ‡Ğ°ÑĞ½Ñ–ÑÑ‚ÑŒ Ğ´Ñ–Ğ¹: ĞºĞ¾Ğ»Ğ¸, Ñƒ Ñ‚Ğ¾Ğ¹ Ñ‡Ğ°Ñ ÑĞº\n\n**ĞĞ´Ğ½Ğ¾Ñ‡Ğ°ÑĞ½Ñ– Ğ´Ñ–Ñ—** Ğ²Ñ–Ğ´Ğ±ÑƒĞ²Ğ°ÑÑ‚ÑŒÑÑ Ğ² Ğ¾Ğ´Ğ¸Ğ½ Ñ– Ñ‚Ğ¾Ğ¹ ÑĞ°Ğ¼Ğ¸Ğ¹ Ğ¼Ğ¾Ğ¼ĞµĞ½Ñ‚ Ğ°Ğ±Ğ¾ Ğ¿ĞµÑ€Ñ–Ğ¾Ğ´ Ñ‡Ğ°ÑÑƒ.\n\n#### ĞÑĞ½Ğ¾Ğ²Ğ½Ñ– ÑĞ¿Ğ¾Ğ»ÑƒÑ‡Ğ½Ğ¸ĞºĞ¸ Ğ¾Ğ´Ğ½Ğ¾Ñ‡Ğ°ÑĞ½Ğ¾ÑÑ‚Ñ–\n\n| Ğ¡Ğ¿Ğ¾Ğ»ÑƒÑ‡Ğ½Ğ¸Ğº | Ğ—Ğ½Ğ°Ñ‡ĞµĞ½Ğ½Ñ | ĞŸÑ€Ğ¸ĞºĞ»Ğ°Ğ´ |\n|-----------|----------|---------|\n| **ĞºĞ¾Ğ»Ğ¸** | Ñƒ Ğ¼Ğ¾Ğ¼ĞµĞ½Ñ‚, ĞºĞ¾Ğ»Ğ¸ | ĞšĞ¾Ğ»Ğ¸ Ğ²Ñ–Ğ½ Ğ¿Ñ€Ğ¸Ğ¹ÑˆĞ¾Ğ², Ğ¼Ğ¸ Ğ¾Ğ±Ñ–Ğ´Ğ°Ğ»Ğ¸. |\n| **Ñƒ Ñ‚Ğ¾Ğ¹ Ñ‡Ğ°Ñ ÑĞº** | Ğ¿Ğ°Ñ€Ğ°Ğ»ĞµĞ»ÑŒĞ½Ğ¾, Ğ²Ğ¾Ğ´Ğ½Ğ¾Ñ‡Ğ°Ñ | Ğ£ Ñ‚Ğ¾Ğ¹ Ñ‡Ğ°Ñ ÑĞº Ğ²Ğ¾Ğ½Ğ° Ğ³Ğ¾Ñ‚ÑƒĞ²Ğ°Ğ»Ğ°, Ğ²Ñ–Ğ½ Ñ‡Ğ¸Ñ‚Ğ°Ğ². |\n| **Ğ¿Ğ¾ĞºĞ¸** | Ğ¿Ñ€Ğ¾Ñ‚ÑĞ³Ğ¾Ğ¼ Ñ‡Ğ°ÑÑƒ | ĞŸĞ¾ĞºĞ¸ Ñ Ğ¿Ñ€Ğ°Ñ†ÑĞ²Ğ°Ğ², Ğ´Ñ–Ñ‚Ğ¸ Ğ³Ñ€Ğ°Ğ»Ğ¸ÑÑ. |\n| **Ğ² Ğ¼Ñ–Ñ€Ñƒ Ñ‚Ğ¾Ğ³Ğ¾ ÑĞº** | Ğ¿Ğ¾ÑÑ‚ÑƒĞ¿Ğ¾Ğ²Ğ¾ | Ğ’ Ğ¼Ñ–Ñ€Ñƒ Ñ‚Ğ¾Ğ³Ğ¾ ÑĞº Ğ½Ñ–Ñ‡ Ğ½Ğ°Ğ±Ğ»Ğ¸Ğ¶Ğ°Ğ»Ğ°ÑÑŒ, ÑÑ‚Ğ°Ğ²Ğ°Ğ»Ğ¾ Ñ‚ĞµĞ¼Ğ½Ñ–ÑˆĞµ. |\n\n#### ĞŸÑ€Ğ¸ĞºĞ»Ğ°Ğ´Ğ¸ Ğ¾Ğ´Ğ½Ğ¾Ñ‡Ğ°ÑĞ½Ğ¸Ñ… Ğ´Ñ–Ğ¹\n\n**Â«ĞšĞ¾Ğ»Ğ¸Â» â€” Ğ½Ğ°Ğ¹ÑƒĞ½Ñ–Ğ²ĞµÑ€ÑĞ°Ğ»ÑŒĞ½Ñ–ÑˆĞ¸Ğ¹:**\n- **ĞšĞ¾Ğ»Ğ¸** Ğ¼Ğ°Ğ¼Ğ° Ğ¿Ñ€Ğ¸Ğ¹ÑˆĞ»Ğ° Ğ´Ğ¾Ğ´Ğ¾Ğ¼Ñƒ, Ñ Ğ²Ğ¶Ğµ ÑĞ¿Ğ°Ğ².\n- **ĞšĞ¾Ğ»Ğ¸** Ğ¼Ğ¸ Ğ¶Ğ¸Ğ»Ğ¸ Ñƒ Ğ›ÑŒĞ²Ğ¾Ğ²Ñ–, Ñ‡Ğ°ÑÑ‚Ğ¾ Ğ²Ñ–Ğ´Ğ²Ñ–Ğ´ÑƒĞ²Ğ°Ğ»Ğ¸ Ñ‚ĞµĞ°Ñ‚Ñ€.\n- **ĞšĞ¾Ğ»Ğ¸** Ğ²Ñ–Ğ½ Ğ³Ğ¾Ğ²Ğ¾Ñ€Ğ¸Ğ², ÑƒÑÑ– ÑƒĞ²Ğ°Ğ¶Ğ½Ğ¾ ÑĞ»ÑƒÑ…Ğ°Ğ»Ğ¸.\n\n**Â«Ğ£ Ñ‚Ğ¾Ğ¹ Ñ‡Ğ°Ñ ÑĞºÂ» â€” Ğ½Ğ°Ğ³Ğ¾Ğ»Ğ¾Ñ Ğ½Ğ° Ğ¿Ğ°Ñ€Ğ°Ğ»ĞµĞ»ÑŒĞ½Ğ¾ÑÑ‚Ñ–:**\n- **Ğ£ Ñ‚Ğ¾Ğ¹ Ñ‡Ğ°Ñ ÑĞº** Ğ¾Ğ´Ğ½Ñ– Ğ¿Ñ€Ğ°Ñ†ÑĞ²Ğ°Ğ»Ğ¸, Ñ–Ğ½ÑˆÑ– Ğ²Ñ–Ğ´Ğ¿Ğ¾Ñ‡Ğ¸Ğ²Ğ°Ğ»Ğ¸.\n- **Ğ£ Ñ‚Ğ¾Ğ¹ Ñ‡Ğ°Ñ ÑĞº** Ğ±Ğ°Ñ‚ÑŒĞºĞ¾ Ñ€ĞµĞ¼Ğ¾Ğ½Ñ‚ÑƒĞ²Ğ°Ğ² Ğ¼Ğ°ÑˆĞ¸Ğ½Ñƒ, Ğ¼Ğ°Ñ‚Ğ¸ Ğ³Ğ¾Ñ‚ÑƒĞ²Ğ°Ğ»Ğ° Ğ¾Ğ±Ñ–Ğ´.\n\n**Â«ĞŸĞ¾ĞºĞ¸Â» â€” Ñ‚Ñ€Ğ¸Ğ²Ğ°Ğ»Ñ–ÑÑ‚ÑŒ:**\n- **ĞŸĞ¾ĞºĞ¸** Ñ‚Ğ¸ ÑĞ¿Ğ°Ğ², Ñ Ğ²ÑÑ‚Ğ¸Ğ³ Ğ¿Ñ€Ğ¸Ğ±Ñ€Ğ°Ñ‚Ğ¸ ĞºÑ–Ğ¼Ğ½Ğ°Ñ‚Ñƒ.\n- **ĞŸĞ¾ĞºĞ¸** Ğ´Ñ–Ñ‚Ğ¸ Ğ² ÑˆĞºĞ¾Ğ»Ñ–, Ğ¼Ğ°Ğ¼Ğ° Ğ¿Ñ€Ğ°Ñ†ÑÑ” Ğ²Ğ´Ğ¾Ğ¼Ğ°.\n\n> ğŸŒ **Ğ£ Ñ€ĞµĞ°Ğ»ÑŒĞ½Ğ¾Ğ¼Ñƒ Ğ¶Ğ¸Ñ‚Ñ‚Ñ–**\n> Ğ£ Ñ‰Ğ¾Ğ´ĞµĞ½Ğ½Ğ¸Ñ… Ñ€Ğ¾Ğ·Ğ¼Ğ¾Ğ²Ğ°Ñ… ÑƒĞºÑ€Ğ°Ñ—Ğ½Ñ†Ñ– Ñ‡Ğ°ÑÑ‚Ğ¾ Ğ²Ğ¸ĞºĞ¾Ñ€Ğ¸ÑÑ‚Ğ¾Ğ²ÑƒÑÑ‚ÑŒ Â«Ğ¿Ğ¾ĞºĞ¸Â» Ğ´Ğ»Ñ Ğ¾Ğ¿Ğ¸ÑÑƒ Ğ¿Ğ°Ñ€Ğ°Ğ»ĞµĞ»ÑŒĞ½Ğ¸Ñ… Ğ´Ñ–Ğ¹: *Â«ĞŸĞ¾ĞºĞ¸ Ñ‡Ğ°Ğ¹ Ğ¾ÑÑ‚Ğ¸Ğ³Ğ°Ñ”, Ñ€Ğ¾Ğ·ĞºĞ°Ğ¶Ğ¸, ÑĞº ÑĞ¿Ñ€Ğ°Ğ²Ğ¸!Â»* Ğ°Ğ±Ğ¾ *Â«ĞŸĞ¾ĞºĞ¸ Ğ¼Ğ¸ Ñ‡ĞµĞºĞ°Ñ”Ğ¼Ğ¾ Ğ°Ğ²Ñ‚Ğ¾Ğ±ÑƒÑ, Ğ´Ğ°Ğ²Ğ°Ğ¹ Ğ¿Ğ¾Ğ²Ñ‚Ğ¾Ñ€Ğ¸Ğ¼Ğ¾ Ğ¿Ğ»Ğ°Ğ½.Â»* Ğ¦Ğµ Ğ¿Ñ€Ğ¸Ñ€Ğ¾Ğ´Ğ½Ğ¸Ğ¹ ÑĞ¿Ğ¾ÑÑ–Ğ± Ğ¾Ñ€Ğ³Ğ°Ğ½Ñ–Ğ·ÑƒĞ²Ğ°Ñ‚Ğ¸ Ñ‡Ğ°Ñ Ñƒ Ğ±ĞµÑÑ–Ğ´Ñ–!\n\n#### Ğ’Ñ–Ğ´Ğ¼Ñ–Ğ½Ğ½Ğ¾ÑÑ‚Ñ– Ğ¼Ñ–Ğ¶ ÑĞ¿Ğ¾Ğ»ÑƒÑ‡Ğ½Ğ¸ĞºĞ°Ğ¼Ğ¸ Ğ¾Ğ´Ğ½Ğ¾Ñ‡Ğ°ÑĞ½Ğ¾ÑÑ‚Ñ–\n\nĞšĞ¾Ğ¶ĞµĞ½ ÑĞ¿Ğ¾Ğ»ÑƒÑ‡Ğ½Ğ¸Ğº Ğ¼Ğ°Ñ” ÑĞ²Ğ¾Ñ— Ğ²Ñ–Ğ´Ñ‚Ñ–Ğ½ĞºĞ¸ Ğ·Ğ½Ğ°Ñ‡ĞµĞ½Ğ½Ñ Ñ‚Ğ° ÑÑ‚Ğ¸Ğ»Ñ–ÑÑ‚Ğ¸Ñ‡Ğ½Ñ– Ğ¾ÑĞ¾Ğ±Ğ»Ğ¸Ğ²Ğ¾ÑÑ‚Ñ–:\n\n**Â«ĞšĞ¾Ğ»Ğ¸Â» vs Â«Ñƒ Ñ‚Ğ¾Ğ¹ Ñ‡Ğ°Ñ ÑĞºÂ»:**\n- Â«ĞšĞ¾Ğ»Ğ¸Â» â€” ÑƒĞ½Ñ–Ğ²ĞµÑ€ÑĞ°Ğ»ÑŒĞ½Ğ¸Ğ¹, Ğ¼Ğ¾Ğ¶Ğµ Ğ¾Ğ·Ğ½Ğ°Ñ‡Ğ°Ñ‚Ğ¸ Ñ– Ğ¼Ğ¾Ğ¼ĞµĞ½Ñ‚, Ñ– Ğ¿ĞµÑ€Ñ–Ğ¾Ğ´: *Â«ĞšĞ¾Ğ»Ğ¸ Ğ²Ñ–Ğ½ Ğ·Ğ°Ğ¹ÑˆĞ¾Ğ², Ğ¼Ğ¸ Ğ¾Ğ±Ñ–Ğ´Ğ°Ğ»Ğ¸.Â»*\n- Â«Ğ£ Ñ‚Ğ¾Ğ¹ Ñ‡Ğ°Ñ ÑĞºÂ» â€” Ğ½Ğ°Ğ³Ğ¾Ğ»Ğ¾Ñ Ğ½Ğ° Ğ¿Ğ°Ñ€Ğ°Ğ»ĞµĞ»ÑŒĞ½Ğ¾ÑÑ‚Ñ– Ğ´Ğ²Ğ¾Ñ… Ñ€Ñ–Ğ·Ğ½Ğ¸Ñ… Ğ´Ñ–Ğ¹: *Â«Ğ£ Ñ‚Ğ¾Ğ¹ Ñ‡Ğ°Ñ ÑĞº Ğ¾Ğ´Ğ½Ñ– Ğ¿Ñ€Ğ°Ñ†ÑĞ²Ğ°Ğ»Ğ¸, Ñ–Ğ½ÑˆÑ– Ğ²Ñ–Ğ´Ğ¿Ğ¾Ñ‡Ğ¸Ğ²Ğ°Ğ»Ğ¸.Â»*\n\n**Â«ĞŸĞ¾ĞºĞ¸Â» vs Â«Ğ² Ğ¼Ñ–Ñ€Ñƒ Ñ‚Ğ¾Ğ³Ğ¾ ÑĞºÂ»:**\n- Â«ĞŸĞ¾ĞºĞ¸Â» â€” Ñ‚Ñ€Ğ¸Ğ²Ğ°Ğ»Ñ–ÑÑ‚ÑŒ Ğ±ĞµĞ· Ğ·Ğ¼Ñ–Ğ½: *Â«ĞŸĞ¾ĞºĞ¸ Ñ‚Ğ¸ ÑĞ¿Ğ°Ğ², Ñ Ğ¿Ñ€Ğ°Ñ†ÑĞ²Ğ°Ğ².Â»*\n- Â«Ğ’ Ğ¼Ñ–Ñ€Ñƒ Ñ‚Ğ¾Ğ³Ğ¾ ÑĞºÂ» â€” Ğ¿Ğ¾ÑÑ‚ÑƒĞ¿Ğ¾Ğ²Ğ° Ğ·Ğ¼Ñ–Ğ½Ğ°: *Â«Ğ’ Ğ¼Ñ–Ñ€Ñƒ Ñ‚Ğ¾Ğ³Ğ¾ ÑĞº Ğ½Ñ–Ñ‡ Ğ½Ğ°Ğ±Ğ»Ğ¸Ğ¶Ğ°Ğ»Ğ°ÑÑŒ, ÑÑ‚Ğ°Ğ²Ğ°Ğ»Ğ¾ Ñ‚ĞµĞ¼Ğ½Ñ–ÑˆĞµ.Â»*\n\n> ğŸ¯ **ĞŸÑ€Ğ°ĞºÑ‚Ğ¸Ñ‡Ğ½Ğ° Ğ¿Ğ¾Ñ€Ğ°Ğ´Ğ°**\n> Ğ”Ğ»Ñ Ğ¾Ğ´Ğ½Ğ¾Ñ‡Ğ°ÑĞ½Ğ¸Ñ… Ğ´Ñ–Ğ¹ Ğ½Ğ°Ğ¹Ñ‡Ğ°ÑÑ‚Ñ–ÑˆĞµ Ğ²Ğ¸ĞºĞ¾Ñ€Ğ¸ÑÑ‚Ğ¾Ğ²ÑƒĞ¹Ñ‚Ğµ Â«ĞºĞ¾Ğ»Ğ¸Â» Ğ°Ğ±Ğ¾ Â«Ğ¿Ğ¾ĞºĞ¸Â». Â«Ğ£ Ñ‚Ğ¾Ğ¹ Ñ‡Ğ°Ñ ÑĞºÂ» Ğ·Ğ²ÑƒÑ‡Ğ¸Ñ‚ÑŒ Ğ±Ñ–Ğ»ÑŒÑˆ Ñ„Ğ¾Ñ€Ğ¼Ğ°Ğ»ÑŒĞ½Ğ¾ Ñ‚Ğ° ĞºĞ½Ğ¸Ğ¶Ğ½Ğ¾, Ñ‚Ğ¾Ğ¼Ñƒ ĞºÑ€Ğ°Ñ‰Ğµ Ğ¿Ñ–Ğ´Ñ…Ğ¾Ğ´Ğ¸Ñ‚ÑŒ Ğ´Ğ»Ñ Ğ¿Ğ¸ÑÑŒĞ¼Ğ¾Ğ²Ğ¸Ñ… Ñ‚ĞµĞºÑÑ‚Ñ–Ğ².\n\n---\n\n### ĞŸĞ¾ÑĞ»Ñ–Ğ´Ğ¾Ğ²Ğ½Ñ–ÑÑ‚ÑŒ Ğ´Ñ–Ğ¹: Ğ¿Ñ–ÑĞ»Ñ Ñ‚Ğ¾Ğ³Ğ¾ ÑĞº, ÑĞº Ñ‚Ñ–Ğ»ÑŒĞºĞ¸\n\n**ĞŸĞ¾ÑĞ»Ñ–Ğ´Ğ¾Ğ²Ğ½Ñ– Ğ´Ñ–Ñ—** Ğ²Ñ–Ğ´Ğ±ÑƒĞ²Ğ°ÑÑ‚ÑŒÑÑ Ğ¾Ğ´Ğ½Ğ° Ğ·Ğ° Ğ¾Ğ´Ğ½Ğ¾Ñ Ğ² Ğ¿ĞµĞ²Ğ½Ğ¾Ğ¼Ñƒ Ğ¿Ğ¾Ñ€ÑĞ´ĞºÑƒ.\n\n#### Ğ¡Ğ¿Ğ¾Ğ»ÑƒÑ‡Ğ½Ğ¸ĞºĞ¸ Ğ¿Ğ¾ÑĞ»Ñ–Ğ´Ğ¾Ğ²Ğ½Ğ¾ÑÑ‚Ñ–\n\n| Ğ¡Ğ¿Ğ¾Ğ»ÑƒÑ‡Ğ½Ğ¸Ğº | Ğ—Ğ½Ğ°Ñ‡ĞµĞ½Ğ½Ñ | ĞŸÑ€Ğ¸ĞºĞ»Ğ°Ğ´ |\n|-----------|----------|---------|\n| **Ğ¿Ñ–ÑĞ»Ñ Ñ‚Ğ¾Ğ³Ğ¾ ÑĞº** | Ğ¾Ğ´Ñ€Ğ°Ğ·Ñƒ Ğ¿Ñ–ÑĞ»Ñ | ĞŸÑ–ÑĞ»Ñ Ñ‚Ğ¾Ğ³Ğ¾ ÑĞº Ğ²Ñ–Ğ½ Ğ¿Ñ–ÑˆĞ¾Ğ², Ğ½Ğ°ÑÑ‚Ğ°Ğ»Ğ° Ñ‚Ğ¸ÑˆĞ°. |\n| **ÑĞº Ñ‚Ñ–Ğ»ÑŒĞºĞ¸** | Ğ½ĞµĞ³Ğ°Ğ¹Ğ½Ğ¾ Ğ¿Ñ–ÑĞ»Ñ | Ğ¯Ğº Ñ‚Ñ–Ğ»ÑŒĞºĞ¸ Ğ¿Ğ¾Ñ‡ÑƒĞ²ÑÑ Ğ´Ğ·Ğ²Ñ–Ğ½Ğ¾Ğº, ÑƒÑÑ– Ğ²ÑÑ‚Ğ°Ğ»Ğ¸. |\n| **Ñ‰Ğ¾Ğ¹Ğ½Ğ¾** | Ğ»ĞµĞ´Ğ²Ğµ, Ñ‚Ñ–Ğ»ÑŒĞºĞ¸-Ğ½Ğ¾ | Ğ©Ğ¾Ğ¹Ğ½Ğ¾ Ğ²Ñ–Ğ½ ÑƒĞ²Ñ–Ğ¹ÑˆĞ¾Ğ², Ğ¿Ğ¾Ñ‡Ğ°Ğ²ÑÑ Ğ´Ğ¾Ñ‰. |\n| **Ğ»ĞµĞ´Ğ²Ğµ** | Ğ¼Ğ°Ğ»Ğ¾ Ğ½Ğµ, Ğ»ĞµĞ´Ğ²Ğµ Ğ²ÑÑ‚Ğ¸Ğ³ | Ğ›ĞµĞ´Ğ²Ğµ Ğ¼Ğ¸ Ğ²Ğ¸Ğ¹ÑˆĞ»Ğ¸, Ğ¿Ñ–ÑˆĞ¾Ğ² Ğ³Ñ€Ğ°Ğ´. |\n| **Ğ· Ñ‚Ğ¸Ñ… Ğ¿Ñ–Ñ€ ÑĞº** | Ğ²Ñ–Ğ´ Ñ‚Ğ¾Ğ³Ğ¾ Ñ‡Ğ°ÑÑƒ | Ğ— Ñ‚Ğ¸Ñ… Ğ¿Ñ–Ñ€ ÑĞº Ğ²Ñ–Ğ½ Ğ¿ĞµÑ€ĞµÑ—Ñ…Ğ°Ğ², Ğ¼Ğ¸ Ñ€Ñ–Ğ´ĞºĞ¾ Ğ±Ğ°Ñ‡Ğ¸Ğ¼Ğ¾ÑÑ. |\n| **Ğ²Ñ–Ğ´Ñ‚Ğ¾Ğ´Ñ– ÑĞº** | Ğ²Ñ–Ğ´ Ñ‚Ğ¾Ğ³Ğ¾ Ğ¼Ğ¾Ğ¼ĞµĞ½Ñ‚Ñƒ | Ğ’Ñ–Ğ´Ñ‚Ğ¾Ğ´Ñ– ÑĞº Ğ²Ğ¾Ğ½Ğ° Ğ·Ğ°ĞºÑ–Ğ½Ñ‡Ğ¸Ğ»Ğ° ÑƒĞ½Ñ–Ğ²ĞµÑ€ÑĞ¸Ñ‚ĞµÑ‚, Ğ¿Ñ€Ğ°Ñ†ÑÑ” Ñ‚ÑƒÑ‚. |\n\n#### ĞŸÑ€Ğ¸ĞºĞ»Ğ°Ğ´Ğ¸ Ğ¿Ğ¾ÑĞ»Ñ–Ğ´Ğ¾Ğ²Ğ½Ğ¸Ñ… Ğ´Ñ–Ğ¹\n\n**Â«ĞŸÑ–ÑĞ»Ñ Ñ‚Ğ¾Ğ³Ğ¾ ÑĞºÂ» â€” Ñ‡Ñ–Ñ‚ĞºĞ° Ğ¿Ğ¾ÑĞ»Ñ–Ğ´Ğ¾Ğ²Ğ½Ñ–ÑÑ‚ÑŒ:**\n- **ĞŸÑ–ÑĞ»Ñ Ñ‚Ğ¾Ğ³Ğ¾ ÑĞº** Ğ²Ñ–Ğ½ Ğ·Ğ°ĞºÑ–Ğ½Ñ‡Ğ¸Ğ² Ñ€Ğ¾Ğ±Ğ¾Ñ‚Ñƒ, Ğ¿Ñ–ÑˆĞ¾Ğ² Ğ´Ğ¾Ğ´Ğ¾Ğ¼Ñƒ.\n- **ĞŸÑ–ÑĞ»Ñ Ñ‚Ğ¾Ğ³Ğ¾ ÑĞº** Ğ¼Ğ¸ Ğ¿Ğ¾Ğ²ĞµÑ‡ĞµÑ€ÑĞ»Ğ¸, Ğ´Ğ¸Ğ²Ğ¸Ğ»Ğ¸ÑÑ Ñ„Ñ–Ğ»ÑŒĞ¼.\n- **ĞŸÑ–ÑĞ»Ñ Ñ‚Ğ¾Ğ³Ğ¾ ÑĞº** Ğ¿Ñ€Ğ¾Ğ¹ÑˆĞ¾Ğ² Ğ´Ğ¾Ñ‰, Ğ·'ÑĞ²Ğ¸Ğ»Ğ°ÑÑŒ Ğ²ĞµÑĞµĞ»ĞºĞ°.\n\n**Â«Ğ¯Ğº Ñ‚Ñ–Ğ»ÑŒĞºĞ¸Â» â€” Ğ½ĞµĞ³Ğ°Ğ¹Ğ½Ğ° Ñ€ĞµĞ°ĞºÑ†Ñ–Ñ:**\n- **Ğ¯Ğº Ñ‚Ñ–Ğ»ÑŒĞºĞ¸** Ğ¿Ğ¾Ñ‡ÑƒĞ²ÑÑ Ğ´Ğ·Ğ²Ñ–Ğ½Ğ¾Ğº, ÑƒÑÑ– Ğ·Ğ°Ğ¼Ğ¾Ğ²ĞºĞ»Ğ¸.\n- **Ğ¯Ğº Ñ‚Ñ–Ğ»ÑŒĞºĞ¸** ÑĞ¾Ğ½Ñ†Ğµ Ğ·Ñ–Ğ¹ÑˆĞ»Ğ¾, Ğ¼Ğ¸ Ğ²Ğ¸Ñ€ÑƒÑˆĞ¸Ğ»Ğ¸ Ğ² Ğ´Ğ¾Ñ€Ğ¾Ğ³Ñƒ.\n- **Ğ¯Ğº Ñ‚Ñ–Ğ»ÑŒĞºĞ¸** Ñ Ğ¿Ğ¾Ğ±Ğ°Ñ‡Ğ¸Ğ² Ñ—Ñ—, Ğ¾Ğ´Ñ€Ğ°Ğ·Ñƒ Ğ²Ğ¿Ñ–Ğ·Ğ½Ğ°Ğ².\n\n**Â«Ğ©Ğ¾Ğ¹Ğ½Ğ¾Â» Ñ‚Ğ° Â«Ğ»ĞµĞ´Ğ²ĞµÂ» â€” Ğ½Ğ°Ğ³Ğ¾Ğ»Ğ¾Ñ Ğ½Ğ° Ğ¼Ğ¾Ğ¼ĞµĞ½Ñ‚Ğ°Ğ»ÑŒĞ½Ğ¾ÑÑ‚Ñ–:**\n- **Ğ©Ğ¾Ğ¹Ğ½Ğ¾** Ğ²Ñ–Ğ½ Ğ·Ğ°ÑĞ½ÑƒĞ², Ğ·Ğ°Ğ´Ğ·Ğ²Ğ¾Ğ½Ğ¸Ğ² Ñ‚ĞµĞ»ĞµÑ„Ğ¾Ğ½.\n- **Ğ›ĞµĞ´Ğ²Ğµ** Ğ²Ğ¾Ğ½Ğ° Ğ²Ğ¸Ğ¹ÑˆĞ»Ğ° Ğ· Ğ´Ğ¾Ğ¼Ñƒ, Ğ¿Ğ¾Ñ‡Ğ°Ğ²ÑÑ Ğ´Ğ¾Ñ‰.\n\n> ğŸ’¡ **Ğ¦Ñ–ĞºĞ°Ğ²Ğ¸Ğ¹ Ñ„Ğ°ĞºÑ‚**\n> Ğ¡Ğ»Ğ¾Ğ²Ğ¾ Â«Ñ‰Ğ¾Ğ¹Ğ½Ğ¾Â» Ğ¿Ğ¾Ñ…Ğ¾Ğ´Ğ¸Ñ‚ÑŒ Ğ²Ñ–Ğ´ Â«Ñ‰Ğ¾Â» + Â«Ğ¾Ğ¹Ğ½Ğ¾Â» (Ğ´Ğ°Ğ²Ğ½Ñ Ñ„Ğ¾Ñ€Ğ¼Ğ° Â«Ñ‚Ñ–Ğ»ÑŒĞºĞ¸Â»). Ğ¦Ğµ ÑƒĞ½Ñ–ĞºĞ°Ğ»ÑŒĞ½Ğµ ÑƒĞºÑ€Ğ°Ñ—Ğ½ÑÑŒĞºĞµ ÑĞ»Ğ¾Ğ²Ğ¾, ÑĞºĞµ Ñ‚Ğ¾Ñ‡Ğ½Ğ¾ Ğ¿ĞµÑ€ĞµĞ´Ğ°Ñ” Ñ–Ğ´ĞµÑ Â«Ñ‚Ñ–Ğ»ÑŒĞºĞ¸-Ğ½Ğ¾, Ğ»ĞµĞ´Ğ²Ğµ Ğ²ÑÑ‚Ğ¸Ğ³Â». Ğ Ğ¾ÑÑ–Ğ¹ÑÑŒĞºĞ° Ğ¼Ğ¾Ğ²Ğ° Ğ½Ğµ Ğ¼Ğ°Ñ” Ğ¿Ñ€ÑĞ¼Ğ¾Ğ³Ğ¾ ĞµĞºĞ²Ñ–Ğ²Ğ°Ğ»ĞµĞ½Ñ‚Ğ° â€” Ğ·Ğ°Ğ¼Ñ–ÑÑ‚ÑŒ Ğ½ÑŒĞ¾Ğ³Ğ¾ Ğ²Ğ¸ĞºĞ¾Ñ€Ğ¸ÑÑ‚Ğ¾Ğ²ÑƒÑÑ‚ÑŒ Â«Ñ‚Ğ¾Ğ»ÑŒĞºĞ¾ Ñ‡Ñ‚Ğ¾Â» Ğ°Ğ±Ğ¾ Â«ĞµĞ´Ğ²Ğ°Â»!\n\n---\n\n### ĞŸĞ¾Ğ¿ĞµÑ€ĞµĞ´Ğ½Ñ–ÑÑ‚ÑŒ Ğ´Ñ–Ğ¹: Ğ¿ĞµÑ€Ñˆ Ğ½Ñ–Ğ¶, Ğ´Ğ¾ Ñ‚Ğ¾Ğ³Ğ¾ ÑĞº\n\n**ĞŸĞ¾Ğ¿ĞµÑ€ĞµĞ´Ğ½Ñ– Ğ´Ñ–Ñ—** Ğ²Ñ–Ğ´Ğ±ÑƒĞ²Ğ°ÑÑ‚ÑŒÑÑ Ñ€Ğ°Ğ½Ñ–ÑˆĞµ Ğ·Ğ° Ğ³Ğ¾Ğ»Ğ¾Ğ²Ğ½Ñƒ Ğ´Ñ–Ñ.\n\n#### Ğ¡Ğ¿Ğ¾Ğ»ÑƒÑ‡Ğ½Ğ¸ĞºĞ¸ Ğ¿Ğ¾Ğ¿ĞµÑ€ĞµĞ´Ğ½Ğ¾ÑÑ‚Ñ–\n\n| Ğ¡Ğ¿Ğ¾Ğ»ÑƒÑ‡Ğ½Ğ¸Ğº | Ğ—Ğ½Ğ°Ñ‡ĞµĞ½Ğ½Ñ | ĞŸÑ€Ğ¸ĞºĞ»Ğ°Ğ´ |\n|-----------|----------|---------|\n| **Ğ¿ĞµÑ€Ñˆ Ğ½Ñ–Ğ¶** | Ğ´Ğ¾ Ñ‚Ğ¾Ğ³Ğ¾, ÑĞº | ĞŸĞµÑ€Ñˆ Ğ½Ñ–Ğ¶ Ğ¿Ñ–Ñ‚Ğ¸, Ğ²Ñ–Ğ½ Ğ¿Ğ¾Ğ¿Ñ€Ğ¾Ñ‰Ğ°Ğ²ÑÑ. |\n| **Ğ´Ğ¾ Ñ‚Ğ¾Ğ³Ğ¾ ÑĞº** | Ñ€Ğ°Ğ½Ñ–ÑˆĞµ, Ğ½Ñ–Ğ¶ | Ğ”Ğ¾ Ñ‚Ğ¾Ğ³Ğ¾ ÑĞº Ğ¿Ğ¾Ñ‡Ğ°Ñ‚Ğ¸, Ğ¿Ñ€Ğ¾Ñ‡Ğ¸Ñ‚Ğ°Ğ¹ Ñ–Ğ½ÑÑ‚Ñ€ÑƒĞºÑ†Ñ–Ñ. |\n| **Ğ¿ĞµÑ€ĞµĞ´ Ñ‚Ğ¸Ğ¼ ÑĞº** | Ğ±ĞµĞ·Ğ¿Ğ¾ÑĞµÑ€ĞµĞ´Ğ½ÑŒĞ¾ Ğ´Ğ¾ | ĞŸĞµÑ€ĞµĞ´ Ñ‚Ğ¸Ğ¼ ÑĞº Ğ·Ğ°ÑĞ½ÑƒÑ‚Ğ¸, Ğ²Ğ¾Ğ½Ğ° Ñ‡Ğ¸Ñ‚Ğ°Ğ»Ğ° ĞºĞ½Ğ¸Ğ³Ñƒ. |\n| **Ğ¿Ğ¾ĞºĞ¸ Ğ½Ğµ** | Ğ°Ğ¶ Ğ¿Ğ¾ĞºĞ¸ | Ğ§ĞµĞºĞ°Ğ¹, Ğ¿Ğ¾ĞºĞ¸ Ğ½Ğµ Ğ¿Ñ€Ğ¸Ğ¹Ğ´Ñƒ. |\n| **Ğ´Ğ¾ĞºĞ¸ Ğ½Ğµ** | Ğ°Ğ¶ Ğ´Ğ¾ĞºĞ¸ | ĞĞµ Ğ¹Ğ´Ğ¸, Ğ´Ğ¾ĞºĞ¸ Ğ½Ğµ Ğ¿Ğ¾Ğ³Ğ¾Ğ²Ğ¾Ñ€Ğ¸Ğ¼Ğ¾. |\n\n#### ĞŸÑ€Ğ¸ĞºĞ»Ğ°Ğ´Ğ¸ Ğ¿Ğ¾Ğ¿ĞµÑ€ĞµĞ´Ğ½Ñ–Ñ… Ğ´Ñ–Ğ¹\n\n**Â«ĞŸĞµÑ€Ñˆ Ğ½Ñ–Ğ¶Â» â€” ĞºĞ»Ğ°ÑĞ¸Ñ‡Ğ½Ğ¸Ğ¹ Ğ²Ğ°Ñ€Ñ–Ğ°Ğ½Ñ‚:**\n- **ĞŸĞµÑ€Ñˆ Ğ½Ñ–Ğ¶** Ğ¿Ñ€Ğ¸Ğ¹Ğ½ÑÑ‚Ğ¸ Ñ€Ñ–ÑˆĞµĞ½Ğ½Ñ, Ğ¿Ğ¾Ğ´ÑƒĞ¼Ğ°Ğ¹ ÑƒĞ²Ğ°Ğ¶Ğ½Ğ¾.\n- **ĞŸĞµÑ€Ñˆ Ğ½Ñ–Ğ¶** Ğ¿Ğ¾Ñ‡Ğ°Ñ‚Ğ¸ Ğ¿Ñ€Ğ¾ĞµĞºÑ‚, Ğ¼Ğ¸ ÑĞºĞ»Ğ°Ğ»Ğ¸ Ğ¿Ğ»Ğ°Ğ½.\n- **ĞŸĞµÑ€Ñˆ Ğ½Ñ–Ğ¶** Ğ²Ğ¸Ğ¹Ñ‚Ğ¸ Ğ½Ğ° ÑÑ†ĞµĞ½Ñƒ, Ğ²Ñ–Ğ½ Ñ…Ğ²Ğ¸Ğ»ÑĞ²Ğ°Ğ²ÑÑ.\n\n**Â«Ğ”Ğ¾ Ñ‚Ğ¾Ğ³Ğ¾ ÑĞºÂ» Ñ‚Ğ° Â«Ğ¿ĞµÑ€ĞµĞ´ Ñ‚Ğ¸Ğ¼ ÑĞºÂ»:**\n- **Ğ”Ğ¾ Ñ‚Ğ¾Ğ³Ğ¾ ÑĞº** Ğ²Ñ–Ğ½ ÑÑ‚Ğ°Ğ² Ğ²Ñ–Ğ´Ğ¾Ğ¼Ğ¸Ğ¼, Ğ½Ñ–Ñ…Ñ‚Ğ¾ Ğ½Ğµ Ğ·Ğ½Ğ°Ğ² Ğ¹Ğ¾Ğ³Ğ¾ Ñ–Ğ¼ĞµĞ½Ñ–.\n- **ĞŸĞµÑ€ĞµĞ´ Ñ‚Ğ¸Ğ¼ ÑĞº** Ğ·Ğ°ÑĞ½ÑƒÑ‚Ğ¸, Ğ´Ñ–Ñ‚Ğ¸ Ğ·Ğ°Ğ²Ğ¶Ğ´Ğ¸ ÑĞ»ÑƒÑ…Ğ°ÑÑ‚ÑŒ ĞºĞ°Ğ·ĞºÑƒ.\n\n**Â«ĞŸĞ¾ĞºĞ¸ Ğ½ĞµÂ» Ñ‚Ğ° Â«Ğ´Ğ¾ĞºĞ¸ Ğ½ĞµÂ» â€” Ğ¾Ñ‡Ñ–ĞºÑƒĞ²Ğ°Ğ½Ğ½Ñ Ñ€ĞµĞ·ÑƒĞ»ÑŒÑ‚Ğ°Ñ‚Ñƒ:**\n- Ğ¯ Ñ‡ĞµĞºĞ°Ñ‚Ğ¸Ğ¼Ñƒ, **Ğ¿Ğ¾ĞºĞ¸** Ñ‚Ğ¸ **Ğ½Ğµ** Ğ¿Ğ¾Ğ²ĞµÑ€Ğ½ĞµÑˆÑÑ.\n- Ğ’Ñ–Ğ½ Ğ¿Ñ€Ğ°Ñ†ÑĞ²Ğ°Ñ‚Ğ¸Ğ¼Ğµ, **Ğ´Ğ¾ĞºĞ¸ Ğ½Ğµ** Ğ·Ğ°ĞºÑ–Ğ½Ñ‡Ğ¸Ñ‚ÑŒ Ğ¿Ñ€Ğ¾ĞµĞºÑ‚.\n\n> âš ï¸ **Ğ’Ğ°Ğ¶Ğ»Ğ¸Ğ²Ğ¸Ğ¹ Ğ½ÑĞ°Ğ½Ñ**\n> Â«ĞŸĞ¾ĞºĞ¸ Ğ½ĞµÂ» Ñ– Â«Ğ´Ğ¾ĞºĞ¸ Ğ½ĞµÂ» Ğ²Ğ¸Ğ¼Ğ°Ğ³Ğ°ÑÑ‚ÑŒ Ğ·Ğ°Ğ¿ĞµÑ€ĞµÑ‡ĞµĞ½Ğ½Ñ Ğ² Ğ¿Ñ–Ğ´Ñ€ÑĞ´Ğ½Ğ¾Ğ¼Ñƒ Ñ€ĞµÑ‡ĞµĞ½Ğ½Ñ–:\n> âœ… ĞŸÑ€Ğ°Ğ²Ğ¸Ğ»ÑŒĞ½Ğ¾: Ğ§ĞµĞºĞ°Ğ¹, Ğ¿Ğ¾ĞºĞ¸ Ñ **Ğ½Ğµ** Ğ¿Ñ€Ğ¸Ğ¹Ğ´Ñƒ.\n> âŒ ĞĞµĞ¿Ñ€Ğ°Ğ²Ğ¸Ğ»ÑŒĞ½Ğ¾: Ğ§ĞµĞºĞ°Ğ¹, Ğ¿Ğ¾ĞºĞ¸ Ñ Ğ¿Ñ€Ğ¸Ğ¹Ğ´Ñƒ.\n> Ğ¦Ğµ Ğ¾Ğ´Ğ½Ğ° Ğ· Ğ½Ğ°Ğ¹Ñ‡Ğ°ÑÑ‚Ñ–ÑˆĞ¸Ñ… Ğ¿Ğ¾Ğ¼Ğ¸Ğ»Ğ¾Ğº Ñ–Ğ½Ğ¾Ğ·ĞµĞ¼Ñ†Ñ–Ğ²!\n\n---\n\n### Ğ¢Ñ€Ğ¸Ğ²Ğ°Ğ»Ñ–ÑÑ‚ÑŒ Ñ– Ğ¼ĞµĞ¶Ñ–: Ğ¿Ğ¾ĞºĞ¸, Ğ´Ğ¾ĞºĞ¸, Ğ²ĞµÑÑŒ Ñ‡Ğ°Ñ\n\n**Ğ¢Ñ€Ğ¸Ğ²Ğ°Ğ»Ñ– Ğ´Ñ–Ñ—** Ğ¾Ñ…Ğ¾Ğ¿Ğ»ÑÑÑ‚ÑŒ Ğ¿ĞµĞ²Ğ½Ğ¸Ğ¹ Ğ¿ĞµÑ€Ñ–Ğ¾Ğ´ Ñ‡Ğ°ÑÑƒ.\n\n| Ğ¡Ğ¿Ğ¾Ğ»ÑƒÑ‡Ğ½Ğ¸Ğº | Ğ—Ğ½Ğ°Ñ‡ĞµĞ½Ğ½Ñ | ĞŸÑ€Ğ¸ĞºĞ»Ğ°Ğ´ |\n|-----------|----------|---------|\n| **Ğ¿Ğ¾ĞºĞ¸** | Ğ¿Ñ€Ğ¾Ñ‚ÑĞ³Ğ¾Ğ¼ Ñ‡Ğ°ÑÑƒ | ĞŸĞ¾ĞºĞ¸ Ğ´Ğ¾Ñ‰ Ğ¹ÑˆĞ¾Ğ², Ğ¼Ğ¸ ÑĞ¸Ğ´Ñ–Ğ»Ğ¸ Ğ²Ğ´Ğ¾Ğ¼Ğ°. |\n| **Ğ´Ğ¾ĞºĞ¸** | Ğ²ĞµÑÑŒ Ñ‡Ğ°Ñ, Ğ°Ğ¶ Ğ´Ğ¾ | Ğ”Ğ¾ĞºĞ¸ Ñ Ğ¶Ğ¸Ğ²Ñƒ, Ğ¿Ğ°Ğ¼'ÑÑ‚Ğ°Ñ‚Ğ¸Ğ¼Ñƒ. |\n| **Ğ²ĞµÑÑŒ Ñ‡Ğ°Ñ Ğ¿Ğ¾ĞºĞ¸** | ÑƒĞ²ĞµÑÑŒ Ğ¿ĞµÑ€Ñ–Ğ¾Ğ´ | Ğ’ĞµÑÑŒ Ñ‡Ğ°Ñ Ğ¿Ğ¾ĞºĞ¸ Ğ¼Ğ¸ Ñ‡ĞµĞºĞ°Ğ»Ğ¸, Ğ²Ğ¾Ğ½Ğ° Ğ½ĞµÑ€Ğ²ÑƒĞ²Ğ°Ğ»Ğ°. |\n| **Ğ´Ğ¾ Ñ‚Ğ¸Ñ… Ğ¿Ñ–Ñ€ Ğ¿Ğ¾ĞºĞ¸** | Ğ°Ğ¶ Ğ´Ğ¾ Ğ¼Ğ¾Ğ¼ĞµĞ½Ñ‚Ñƒ | Ğ’Ñ–Ğ½ Ğ¿Ñ€Ğ°Ñ†ÑĞ²Ğ°Ñ‚Ğ¸Ğ¼Ğµ Ğ´Ğ¾ Ñ‚Ğ¸Ñ… Ğ¿Ñ–Ñ€, Ğ¿Ğ¾ĞºĞ¸ Ğ½Ğµ Ğ·Ğ°ĞºÑ–Ğ½Ñ‡Ğ¸Ñ‚ÑŒ. |\n\n**ĞŸÑ€Ğ¸ĞºĞ»Ğ°Ğ´Ğ¸ Ñ‚Ñ€Ğ¸Ğ²Ğ°Ğ»Ğ¸Ñ… Ğ´Ñ–Ğ¹:**\n- **ĞŸĞ¾ĞºĞ¸** Ğ±Ğ°Ñ‚ÑŒĞºĞ¸ Ğ½Ğ° Ñ€Ğ¾Ğ±Ğ¾Ñ‚Ñ–, Ğ´Ñ–Ñ‚Ğ¸ Ğ² ÑˆĞºĞ¾Ğ»Ñ–.\n- **Ğ”Ğ¾ĞºĞ¸** Ñ” Ğ½Ğ°Ğ´Ñ–Ñ, Ğ²Ğ°Ñ€Ñ‚Ğ¾ Ğ±Ğ¾Ñ€Ğ¾Ñ‚Ğ¸ÑÑ.\n- **Ğ’ĞµÑÑŒ Ñ‡Ğ°Ñ Ğ¿Ğ¾ĞºĞ¸** Ñ‚Ñ€Ğ¸Ğ²Ğ°Ğ»Ğ° Ğ¿Ğ¾Ğ´Ğ¾Ñ€Ğ¾Ğ¶, Ğ¼Ğ¸ Ñ„Ğ¾Ñ‚Ğ¾Ğ³Ñ€Ğ°Ñ„ÑƒĞ²Ğ°Ğ»Ğ¸ ĞºÑ€Ğ°Ñ”Ğ²Ğ¸Ğ´Ğ¸.\n\n> ğŸ¬ **ĞšÑƒĞ»ÑŒÑ‚ÑƒÑ€Ğ½Ğ¸Ğ¹ Ğ¼Ğ¾Ğ¼ĞµĞ½Ñ‚**\n> Ğ’ ÑƒĞºÑ€Ğ°Ñ—Ğ½ÑÑŒĞºĞ¸Ñ… Ğ½Ğ°Ñ€Ğ¾Ğ´Ğ½Ğ¸Ñ… Ğ¿Ñ–ÑĞ½ÑÑ… Ñ‡Ğ°ÑĞ¾Ğ²Ñ– ÑĞ¿Ğ¾Ğ»ÑƒÑ‡Ğ½Ğ¸ĞºĞ¸ ÑÑ‚Ğ²Ğ¾Ñ€ÑÑÑ‚ÑŒ Ğ¾ÑĞ¾Ğ±Ğ»Ğ¸Ğ²Ñƒ Ğ°Ñ‚Ğ¼Ğ¾ÑÑ„ĞµÑ€Ñƒ: *Â«ĞŸĞ¾ĞºĞ¸ ÑĞ¾Ğ½Ñ†Ğµ Ğ·Ñ–Ğ¹Ğ´Ğµ, Ñ€Ğ¾ÑĞ° Ğ¾Ñ‡Ñ– Ğ²Ğ¸Ñ—ÑÑ‚ÑŒÂ»* â€” Ğ¿Ñ€Ğ¸ÑĞ»Ñ–Ğ²'Ñ Ğ¿Ñ€Ğ¾ Ğ½ĞµÑ‚ĞµÑ€Ğ¿Ğ»ÑÑ‡Ñ–ÑÑ‚ÑŒ. *Â«Ğ”Ğ¾ĞºĞ¸ Ğ¶Ğ¸Ğ²Ñƒ â€” Ñ‚ĞµĞ±Ğµ Ğ»ÑĞ±Ğ¸Ñ‚Ğ¸Ğ¼ÑƒÂ»* â€” Ğ²Ğ¸Ñ€Ğ°Ğ¶ĞµĞ½Ğ½Ñ Ğ²Ñ–Ñ‡Ğ½Ğ¾Ñ— Ğ»ÑĞ±Ğ¾Ğ²Ñ–. Ğ§Ğ°ÑĞ¾Ğ²Ñ– ĞºĞ¾Ğ½ÑÑ‚Ñ€ÑƒĞºÑ†Ñ–Ñ— Ğ½Ğ°Ğ´Ğ°ÑÑ‚ÑŒ Ğ¼Ğ¾Ğ²Ğ»ĞµĞ½Ğ½Ñ Ğ¿Ğ¾ĞµÑ‚Ğ¸Ñ‡Ğ½Ğ¾ÑÑ‚Ñ– Ñ‚Ğ° Ğ³Ğ»Ğ¸Ğ±Ğ¸Ğ½Ğ¸!\n\n---\n\n### Ğ ĞµĞ³ÑƒĞ»ÑÑ€Ğ½Ñ–ÑÑ‚ÑŒ: ĞºĞ¾Ğ¶Ğ½Ğ¾Ğ³Ğ¾ Ñ€Ğ°Ğ·Ñƒ ĞºĞ¾Ğ»Ğ¸, Ñ‰Ğ¾Ñ€Ğ°Ğ·Ñƒ ÑĞº\n\n**ĞŸĞ¾Ğ²Ñ‚Ğ¾Ñ€ÑĞ²Ğ°Ğ½Ñ– Ğ´Ñ–Ñ—** Ğ²Ñ–Ğ´Ğ±ÑƒĞ²Ğ°ÑÑ‚ÑŒÑÑ Ñ€ĞµĞ³ÑƒĞ»ÑÑ€Ğ½Ğ¾.\n\n| Ğ’Ğ¸Ñ€Ğ°Ğ· | Ğ—Ğ½Ğ°Ñ‡ĞµĞ½Ğ½Ñ | ĞŸÑ€Ğ¸ĞºĞ»Ğ°Ğ´ |\n|-------|----------|---------|\n| **ĞºĞ¾Ğ¶Ğ½Ğ¾Ğ³Ğ¾ Ñ€Ğ°Ğ·Ñƒ ĞºĞ¾Ğ»Ğ¸** | Ğ¿Ñ€Ğ¸ ĞºĞ¾Ğ¶Ğ½Ñ–Ğ¹ Ğ½Ğ°Ğ³Ğ¾Ğ´Ñ– | ĞšĞ¾Ğ¶Ğ½Ğ¾Ğ³Ğ¾ Ñ€Ğ°Ğ·Ñƒ ĞºĞ¾Ğ»Ğ¸ Ğ²Ñ–Ğ½ Ğ¿Ñ€Ğ¸Ñ…Ğ¾Ğ´Ğ¸Ñ‚ÑŒ, Ğ¿Ñ€Ğ¸Ğ½Ğ¾ÑĞ¸Ñ‚ÑŒ ĞºĞ²Ñ–Ñ‚Ğ¸. |\n| **Ñ‰Ğ¾Ñ€Ğ°Ğ·Ñƒ ÑĞº** | Ğ¿Ñ€Ğ¸ ĞºĞ¾Ğ¶Ğ½Ğ¾Ğ¼Ñƒ Ğ²Ğ¸Ğ¿Ğ°Ğ´ĞºÑƒ | Ğ©Ğ¾Ñ€Ğ°Ğ·Ñƒ ÑĞº Ğ¼Ğ¸ Ğ·ÑƒÑÑ‚Ñ€Ñ–Ñ‡Ğ°Ñ”Ğ¼Ğ¾ÑÑŒ, Ğ·Ğ³Ğ°Ğ´ÑƒÑ”Ğ¼Ğ¾ Ğ¼Ğ¸Ğ½ÑƒĞ»Ğµ. |\n| **Ğ·Ğ°Ğ²Ğ¶Ğ´Ğ¸ ĞºĞ¾Ğ»Ğ¸** | Ğ¿Ğ¾ÑÑ‚Ñ–Ğ¹Ğ½Ğ¾, ĞºĞ¾Ğ»Ğ¸ | Ğ—Ğ°Ğ²Ğ¶Ğ´Ğ¸ ĞºĞ¾Ğ»Ğ¸ Ğ¹Ğ´Ğµ Ğ´Ğ¾Ñ‰, Ğ²Ñ–Ğ½ Ğ±ĞµÑ€Ğµ Ğ¿Ğ°Ñ€Ğ°ÑĞ¾Ğ»ÑŒĞºÑƒ. |\n\n**ĞŸÑ€Ğ¸ĞºĞ»Ğ°Ğ´Ğ¸ Ñ€ĞµĞ³ÑƒĞ»ÑÑ€Ğ½Ğ¾ÑÑ‚Ñ–:**\n- **ĞšĞ¾Ğ¶Ğ½Ğ¾Ğ³Ğ¾ Ñ€Ğ°Ğ·Ñƒ ĞºĞ¾Ğ»Ğ¸** Ñ Ğ±Ğ°Ñ‡Ñƒ Ñ†Ğµ Ğ¼Ñ–ÑÑ†Ğµ, Ğ·Ğ³Ğ°Ğ´ÑƒÑ Ğ´Ğ¸Ñ‚Ğ¸Ğ½ÑÑ‚Ğ²Ğ¾.\n- **Ğ©Ğ¾Ñ€Ğ°Ğ·Ñƒ ÑĞº** Ğ²Ğ¾Ğ½Ğ° ÑĞ¿Ñ–Ğ²Ğ°Ñ”, ÑƒÑÑ– Ğ°Ğ¿Ğ»Ğ¾Ğ´ÑƒÑÑ‚ÑŒ.\n- **Ğ—Ğ°Ğ²Ğ¶Ğ´Ğ¸ ĞºĞ¾Ğ»Ğ¸** Ğ½Ğ°ÑÑ‚Ğ°Ñ” Ğ²ĞµÑĞ½Ğ°, Ğ²Ñ–Ğ½ Ñ—Ğ´Ğµ Ğ´Ğ¾ ÑĞµĞ»Ğ°.\n\n> ğŸ‡ºğŸ‡¦ **Ğ£ĞºÑ€Ğ°Ñ—Ğ½ÑÑŒĞºĞ° Ñ–Ğ´ĞµĞ½Ñ‚Ğ¸Ñ‡Ğ½Ñ–ÑÑ‚ÑŒ**\n> Ğ§Ğ°ÑĞ¾Ğ²Ñ– ÑĞ¿Ğ¾Ğ»ÑƒÑ‡Ğ½Ğ¸ĞºĞ¸ Ğ² ÑƒĞºÑ€Ğ°Ñ—Ğ½ÑÑŒĞºÑ–Ğ¹ Ğ¼Ğ¾Ğ²Ñ– Ğ±Ğ°Ğ³Ğ°Ñ‚ÑˆÑ–, Ğ½Ñ–Ğ¶ Ñƒ Ğ±Ğ°Ğ³Ğ°Ñ‚ÑŒĞ¾Ñ… Ñ–Ğ½ÑˆĞ¸Ñ…. ĞœĞ¸ Ğ¼Ğ°Ñ”Ğ¼Ğ¾ Ñ‚Ğ¾Ğ½ĞºÑ– Ğ½ÑĞ°Ğ½ÑĞ¸: Â«ĞºĞ¾Ğ»Ğ¸Â» (Ğ·Ğ°Ğ³Ğ°Ğ»ÑŒĞ½Ğµ), Â«ÑĞº Ñ‚Ñ–Ğ»ÑŒĞºĞ¸Â» (Ğ½ĞµĞ³Ğ°Ğ¹Ğ½Ğ¾), Â«Ñ‰Ğ¾Ğ¹Ğ½Ğ¾Â» (Ğ»ĞµĞ´Ğ²Ğµ Ğ²ÑÑ‚Ğ¸Ğ³), Â«Ğ¿ĞµÑ€Ñˆ Ğ½Ñ–Ğ¶Â» (Ğ´Ğ¾ Ñ‚Ğ¾Ğ³Ğ¾), Â«Ğ¿Ğ¾ĞºĞ¸Â» (Ğ¿Ñ€Ğ¾Ñ‚ÑĞ³Ğ¾Ğ¼). Ğ¦Ñ Ğ±Ğ°Ğ³Ğ°Ñ‚Ğ¾Ğ³Ñ€Ğ°Ğ½Ğ½Ñ–ÑÑ‚ÑŒ Ğ´Ğ¾Ğ·Ğ²Ğ¾Ğ»ÑÑ” Ñ‚Ğ¾Ñ‡Ğ½Ğ¾ Ğ¿ĞµÑ€ĞµĞ´Ğ°Ñ‚Ğ¸ Ğ½Ğ°Ğ¹ÑĞºĞ»Ğ°Ğ´Ğ½Ñ–ÑˆÑ– Ñ‡Ğ°ÑĞ¾Ğ²Ñ– Ğ²Ñ–Ğ´Ğ½Ğ¾ÑˆĞµĞ½Ğ½Ñ!\n\n---\n\n## ĞŸÑ€Ğ°ĞºÑ‚Ğ¸ĞºĞ°\n\n### Ğ¯Ğº Ğ¾Ğ±Ñ€Ğ°Ñ‚Ğ¸ Ğ¿Ñ€Ğ°Ğ²Ğ¸Ğ»ÑŒĞ½Ğ¸Ğ¹ ÑĞ¿Ğ¾Ğ»ÑƒÑ‡Ğ½Ğ¸Ğº?\n\nĞ—Ğ°Ğ´Ğ°Ğ¹Ñ‚Ğµ ÑĞ¾Ğ±Ñ– Ñ†Ñ– Ğ¿Ğ¸Ñ‚Ğ°Ğ½Ğ½Ñ:\n\n1. **Ğ”Ñ–Ñ— Ğ¾Ğ´Ğ½Ğ¾Ñ‡Ğ°ÑĞ½Ñ– Ñ‡Ğ¸ Ğ¿Ğ¾ÑĞ»Ñ–Ğ´Ğ¾Ğ²Ğ½Ñ–?**\n   - ĞĞ´Ğ½Ğ¾Ñ‡Ğ°ÑĞ½Ñ– â†’ ĞºĞ¾Ğ»Ğ¸, Ñƒ Ñ‚Ğ¾Ğ¹ Ñ‡Ğ°Ñ ÑĞº, Ğ¿Ğ¾ĞºĞ¸\n   - ĞŸĞ¾ÑĞ»Ñ–Ğ´Ğ¾Ğ²Ğ½Ñ– â†’ Ğ¿Ñ–ÑĞ»Ñ Ñ‚Ğ¾Ğ³Ğ¾ ÑĞº, ÑĞº Ñ‚Ñ–Ğ»ÑŒĞºĞ¸, Ğ¿ĞµÑ€Ñˆ Ğ½Ñ–Ğ¶\n\n2. **Ğ¯ĞºĞ° Ğ´Ñ–Ñ Ñ€Ğ°Ğ½Ñ–ÑˆĞµ?**\n   - ĞŸÑ–Ğ´Ñ€ÑĞ´Ğ½Ğ° Ñ€Ğ°Ğ½Ñ–ÑˆĞµ â†’ Ğ¿ĞµÑ€Ñˆ Ğ½Ñ–Ğ¶, Ğ´Ğ¾ Ñ‚Ğ¾Ğ³Ğ¾ ÑĞº\n   - Ğ“Ğ¾Ğ»Ğ¾Ğ²Ğ½Ğ° Ñ€Ğ°Ğ½Ñ–ÑˆĞµ â†’ Ğ¿Ñ–ÑĞ»Ñ Ñ‚Ğ¾Ğ³Ğ¾ ÑĞº, ÑĞº Ñ‚Ñ–Ğ»ÑŒĞºĞ¸\n\n3. **Ğ”Ñ–Ñ Ğ¼Ğ¸Ñ‚Ñ‚Ñ”Ğ²Ğ° Ñ‡Ğ¸ Ñ‚Ñ€Ğ¸Ğ²Ğ°Ğ»Ğ°?**\n   - ĞœĞ¸Ñ‚Ñ‚Ñ”Ğ²Ğ° â†’ ÑĞº Ñ‚Ñ–Ğ»ÑŒĞºĞ¸, Ñ‰Ğ¾Ğ¹Ğ½Ğ¾, Ğ»ĞµĞ´Ğ²Ğµ\n   - Ğ¢Ñ€Ğ¸Ğ²Ğ°Ğ»Ğ° â†’ Ğ¿Ğ¾ĞºĞ¸, Ğ´Ğ¾ĞºĞ¸, Ğ²ĞµÑÑŒ Ñ‡Ğ°Ñ\n\n### Ğ¢Ğ¸Ğ¿Ğ¾Ğ²Ñ– Ğ¿Ğ¾Ğ¼Ğ¸Ğ»ĞºĞ¸ Ñ‚Ğ° ÑĞº Ñ—Ñ… ÑƒĞ½Ğ¸ĞºĞ½ÑƒÑ‚Ğ¸\n\n**ĞŸĞ¾Ğ¼Ğ¸Ğ»ĞºĞ° 1: ĞŸĞ»ÑƒÑ‚Ğ°Ğ½Ğ¸Ğ½Ğ° Â«Ğ¿Ğ¾ĞºĞ¸Â» Ñ– Â«Ğ¿Ğ¾ĞºĞ¸ Ğ½ĞµÂ»**\n\nâŒ ĞĞµĞ¿Ñ€Ğ°Ğ²Ğ¸Ğ»ÑŒĞ½Ğ¾: Ğ§ĞµĞºĞ°Ğ¹, Ğ¿Ğ¾ĞºĞ¸ Ñ Ğ¿Ñ€Ğ¸Ğ¹Ğ´Ñƒ.\nâœ… ĞŸÑ€Ğ°Ğ²Ğ¸Ğ»ÑŒĞ½Ğ¾: Ğ§ĞµĞºĞ°Ğ¹, Ğ¿Ğ¾ĞºĞ¸ Ñ Ğ½Ğµ Ğ¿Ñ€Ğ¸Ğ¹Ğ´Ñƒ.\n\n**Ğ§Ğ¾Ğ¼Ñƒ?** Â«ĞŸĞ¾ĞºĞ¸ Ğ½ĞµÂ» Ğ²Ğ¸Ğ¼Ğ°Ğ³Ğ°Ñ” Ğ·Ğ°Ğ¿ĞµÑ€ĞµÑ‡ĞµĞ½Ğ½Ñ Ğ´Ğ»Ñ Ğ²Ğ¸Ñ€Ğ°Ğ¶ĞµĞ½Ğ½Ñ Ğ¾Ñ‡Ñ–ĞºÑƒĞ²Ğ°Ğ½Ğ½Ñ Ñ€ĞµĞ·ÑƒĞ»ÑŒÑ‚Ğ°Ñ‚Ñƒ.\n\n**ĞŸĞ¾Ğ¼Ğ¸Ğ»ĞºĞ° 2: ĞĞµĞ¿Ñ€Ğ°Ğ²Ğ¸Ğ»ÑŒĞ½Ğ¸Ğ¹ Ğ¿Ğ¾Ñ€ÑĞ´Ğ¾Ğº Ğ´Ñ–Ğ¹**\n\nâŒ ĞĞµĞ¿Ñ€Ğ°Ğ²Ğ¸Ğ»ÑŒĞ½Ğ¾: ĞŸÑ–ÑĞ»Ñ Ñ‚Ğ¾Ğ³Ğ¾ ÑĞº Ğ¼Ğ¸ Ğ¿Ñ€Ğ¸Ñ—Ñ…Ğ°Ğ»Ğ¸, Ñ—Ñ…Ğ°Ğ»Ğ¸ Ñ‚Ñ€Ğ¸ Ğ³Ğ¾Ğ´Ğ¸Ğ½Ğ¸.\nâœ… ĞŸÑ€Ğ°Ğ²Ğ¸Ğ»ÑŒĞ½Ğ¾: ĞŸÑ–ÑĞ»Ñ Ñ‚Ğ¾Ğ³Ğ¾ ÑĞº Ğ¼Ğ¸ Ñ—Ñ…Ğ°Ğ»Ğ¸ Ñ‚Ñ€Ğ¸ Ğ³Ğ¾Ğ´Ğ¸Ğ½Ğ¸, Ğ¿Ñ€Ğ¸Ñ—Ñ…Ğ°Ğ»Ğ¸.\n\n**Ğ§Ğ¾Ğ¼Ñƒ?** Â«ĞŸÑ–ÑĞ»Ñ Ñ‚Ğ¾Ğ³Ğ¾ ÑĞºÂ» Ğ²ĞºĞ°Ğ·ÑƒÑ” Ğ½Ğ° Ğ¿Ğ¾Ğ¿ĞµÑ€ĞµĞ´Ğ½Ñ Ğ´Ñ–Ñ.\n\n**ĞŸĞ¾Ğ¼Ğ¸Ğ»ĞºĞ° 3: ĞŸĞ»ÑƒÑ‚Ğ°Ğ½Ğ¸Ğ½Ğ° Â«Ğ¿ĞµÑ€Ñˆ Ğ½Ñ–Ğ¶Â» Ñ– Â«Ğ¿Ñ–ÑĞ»Ñ Ñ‚Ğ¾Ğ³Ğ¾ ÑĞºÂ»**\n\nâŒ ĞĞµĞ¿Ñ€Ğ°Ğ²Ğ¸Ğ»ÑŒĞ½Ğ¾: ĞŸĞµÑ€Ñˆ Ğ½Ñ–Ğ¶ Ğ²Ñ–Ğ½ Ğ¿Ñ–ÑˆĞ¾Ğ², Ğ¼Ğ¸ Ğ¿Ğ¾Ğ³Ğ¾Ğ²Ğ¾Ñ€Ğ¸Ğ»Ğ¸. (ÑĞºÑ‰Ğ¾ Ñ€Ğ¾Ğ·Ğ¼Ğ¾Ğ²Ğ° Ğ±ÑƒĞ»Ğ° Ğ¿Ñ–ÑĞ»Ñ)\nâœ… ĞŸÑ€Ğ°Ğ²Ğ¸Ğ»ÑŒĞ½Ğ¾: ĞŸÑ–ÑĞ»Ñ Ñ‚Ğ¾Ğ³Ğ¾ ÑĞº Ğ¼Ğ¸ Ğ¿Ğ¾Ğ³Ğ¾Ğ²Ğ¾Ñ€Ğ¸Ğ»Ğ¸, Ğ²Ñ–Ğ½ Ğ¿Ñ–ÑˆĞ¾Ğ².\n\n**Ğ§Ğ¾Ğ¼Ñƒ?** Â«ĞŸĞµÑ€Ñˆ Ğ½Ñ–Ğ¶Â» = Ğ´Ğ¾ Ñ‚Ğ¾Ğ³Ğ¾, ÑĞº; Â«Ğ¿Ñ–ÑĞ»Ñ Ñ‚Ğ¾Ğ³Ğ¾ ÑĞºÂ» = Ğ¿Ñ–ÑĞ»Ñ Ñ‚Ğ¾Ğ³Ğ¾, ÑĞº.\n\n> ğŸ¯ **ĞŸÑ€Ğ°ĞºÑ‚Ğ¸Ñ‡Ğ½Ğ° Ğ¿Ğ¾Ñ€Ğ°Ğ´Ğ°**\n> ĞŸĞ¾ÑĞ»Ñ–Ğ´Ğ¾Ğ²Ğ½Ñ–ÑÑ‚ÑŒ Ğ¿Ñ€Ğ¾ÑÑ‚Ñ–ÑˆĞµ Ğ·Ğ°Ğ¿Ğ°Ğ¼'ÑÑ‚Ğ°Ñ‚Ğ¸ ÑÑ…ĞµĞ¼Ğ¾Ñ: **Ğ”Ğ†Ğ¯ 1 â†’ Ğ”Ğ†Ğ¯ 2**. Ğ¯ĞºÑ‰Ğ¾ Ğ”Ğ†Ğ¯ 1 Ğ² Ğ¿Ñ–Ğ´Ñ€ÑĞ´Ğ½Ğ¾Ğ¼Ñƒ Ñ€ĞµÑ‡ĞµĞ½Ğ½Ñ– â€” Ñ†Ğµ Â«Ğ¿ĞµÑ€Ñˆ Ğ½Ñ–Ğ¶Â» Ğ°Ğ±Ğ¾ Â«Ğ´Ğ¾ Ñ‚Ğ¾Ğ³Ğ¾ ÑĞºÂ». Ğ¯ĞºÑ‰Ğ¾ Ğ”Ğ†Ğ¯ 2 Ğ² Ğ¿Ñ–Ğ´Ñ€ÑĞ´Ğ½Ğ¾Ğ¼Ñƒ Ñ€ĞµÑ‡ĞµĞ½Ğ½Ñ– â€” Ñ†Ğµ Â«Ğ¿Ñ–ÑĞ»Ñ Ñ‚Ğ¾Ğ³Ğ¾ ÑĞºÂ» Ğ°Ğ±Ğ¾ Â«ÑĞº Ñ‚Ñ–Ğ»ÑŒĞºĞ¸Â».\n\n---\n\n## Ğ”Ñ–Ğ°Ğ»Ğ¾Ğ³Ğ¸\n\n### Ğ”Ñ–Ğ°Ğ»Ğ¾Ğ³ 1: Ğ Ğ°Ğ½Ğ¾Ğº\n\n**ĞœĞ°Ğ¼Ğ°:** Ğ©Ğ¾ Ñ‚Ğ¸ Ñ€Ğ¾Ğ±Ğ¸Ğ², ĞºĞ¾Ğ»Ğ¸ Ñ Ğ¿Ñ€Ğ¸Ğ¹ÑˆĞ»Ğ°?\n\n**Ğ¡Ğ¸Ğ½:** ĞšĞ¾Ğ»Ğ¸ Ñ‚Ğ¸ Ğ¿Ñ€Ğ¸Ğ¹ÑˆĞ»Ğ°, Ñ Ğ²Ğ¶Ğµ ÑĞ½Ñ–Ğ´Ğ°Ğ².\n\n**ĞœĞ°Ğ¼Ğ°:** Ğ Ñ‰Ğ¾ Ñ‚Ğ¸ Ñ€Ğ¾Ğ±Ğ¸Ğ² Ğ´Ğ¾ Ñ‚Ğ¾Ğ³Ğ¾?\n\n**Ğ¡Ğ¸Ğ½:** ĞŸĞµÑ€Ñˆ Ğ½Ñ–Ğ¶ ÑĞ½Ñ–Ğ´Ğ°Ñ‚Ğ¸, Ñ Ğ¿Ñ€Ğ¸Ğ¹Ğ½ÑĞ² Ğ´ÑƒÑˆ. Ğ Ğ¿Ñ–ÑĞ»Ñ Ñ‚Ğ¾Ğ³Ğ¾ ÑĞº Ğ¿Ğ¾Ğ´Ğ·Ğ²Ğ¾Ğ½Ğ¸Ğ² Ğ±ÑƒĞ´Ğ¸Ğ»ÑŒĞ½Ğ¸Ğº, Ñ Ñ‰Ğµ Ğ¿'ÑÑ‚ÑŒ Ñ…Ğ²Ğ¸Ğ»Ğ¸Ğ½ Ğ»ĞµĞ¶Ğ°Ğ².\n\n**ĞœĞ°Ğ¼Ğ°:** Ğ¯Ğº Ñ‚Ñ–Ğ»ÑŒĞºĞ¸ Ñ Ğ¿Ñ–ÑˆĞ»Ğ° Ğ½Ğ° Ñ€Ğ¾Ğ±Ğ¾Ñ‚Ñƒ, Ñ‚Ğ¸, Ğ¼Ğ°Ğ±ÑƒÑ‚ÑŒ, ÑƒĞ²Ñ–Ğ¼ĞºĞ½ÑƒĞ² ĞºĞ¾Ğ¼Ğ¿'ÑÑ‚ĞµÑ€?\n\n**Ğ¡Ğ¸Ğ½:** ĞÑ–, Ğ¿Ğ¾ĞºĞ¸ Ñ‚Ğ¸ Ğ±ÑƒĞ»Ğ° Ğ²Ğ´Ğ¾Ğ¼Ğ°, Ñ Ñ‡Ğ¸Ñ‚Ğ°Ğ² ĞºĞ½Ğ¸Ğ¶ĞºÑƒ!\n\n---\n\n### Ğ”Ñ–Ğ°Ğ»Ğ¾Ğ³ 2: ĞŸĞ¾Ğ´Ğ¾Ñ€Ğ¾Ğ¶\n\n**Ğ¢ÑƒÑ€Ğ¸ÑÑ‚:** ĞšĞ¾Ğ»Ğ¸ Ğ½Ğ°Ğ¹ĞºÑ€Ğ°Ñ‰Ğµ Ğ²Ñ–Ğ´Ğ²Ñ–Ğ´Ğ°Ñ‚Ğ¸ ĞšĞ°Ñ€Ğ¿Ğ°Ñ‚Ğ¸?\n\n**Ğ“Ñ–Ğ´:** ĞšĞ¾Ğ¶Ğ½Ğ¾Ğ³Ğ¾ Ñ€Ğ°Ğ·Ñƒ ĞºĞ¾Ğ»Ğ¸ Ñ Ñ‚Ğ°Ğ¼ Ğ±ÑƒĞ²Ğ°Ñ, Ğ½Ğ°Ğ¹ĞºÑ€Ğ°Ñ‰Ğµ Ğ½Ğ°Ğ²ĞµÑĞ½Ñ–.\n\n**Ğ¢ÑƒÑ€Ğ¸ÑÑ‚:** Ğ Ñ‰Ğ¾ Ñ€Ğ¾Ğ±Ğ¸Ñ‚Ğ¸, Ğ¿Ğ¾ĞºĞ¸ Ñ‡ĞµĞºĞ°Ñ”Ğ¼Ğ¾ Ğ½Ğ° Ğ¿Ğ¾Ñ—Ğ·Ğ´?\n\n**Ğ“Ñ–Ğ´:** ĞŸĞ¾ĞºĞ¸ Ñ‡ĞµĞºĞ°Ñ”Ğ¼Ğ¾, Ğ¼Ğ¾Ğ¶ĞµĞ¼Ğ¾ Ğ¾Ğ³Ğ»ÑĞ½ÑƒÑ‚Ğ¸ Ğ¼Ñ–ÑÑ‚Ğ¾. ĞŸÑ–ÑĞ»Ñ Ñ‚Ğ¾Ğ³Ğ¾ ÑĞº ÑÑĞ´ĞµĞ¼Ğ¾ Ğ² Ğ¿Ğ¾Ñ‚ÑĞ³, Ñ—Ñ…Ğ°Ñ‚Ğ¸Ğ¼ĞµĞ¼Ğ¾ ÑˆÑ–ÑÑ‚ÑŒ Ğ³Ğ¾Ğ´Ğ¸Ğ½.\n\n**Ğ¢ÑƒÑ€Ğ¸ÑÑ‚:** Ğ”Ğ¾ Ñ‚Ğ¾Ğ³Ğ¾ ÑĞº Ğ²Ğ¸Ñ—Ñ…Ğ°Ñ‚Ğ¸, Ñ‚Ñ€ĞµĞ±Ğ° Ñ‰Ğ¾ÑÑŒ Ğ¿Ğ¾Ñ—ÑÑ‚Ğ¸!\n\n**Ğ“Ñ–Ğ´:** Ğ¯Ğº Ñ‚Ñ–Ğ»ÑŒĞºĞ¸ Ğ·Ğ½Ğ°Ğ¹Ğ´ĞµĞ¼Ğ¾ ĞºĞ°Ğ²'ÑÑ€Ğ½Ñ, Ğ·ÑƒĞ¿Ğ¸Ğ½Ğ¸Ğ¼Ğ¾ÑÑŒ.\n\n---\n\n### Ğ”Ñ–Ğ°Ğ»Ğ¾Ğ³ 3: Ğ Ğ¾Ğ±Ğ¾Ñ‚Ğ°\n\n**Ğ¨ĞµÑ„:** ĞšĞ¾Ğ»Ğ¸ Ğ·Ğ°ĞºÑ–Ğ½Ñ‡Ğ¸Ñˆ Ğ·Ğ²Ñ–Ñ‚?\n\n**ĞŸÑ€Ğ°Ñ†Ñ–Ğ²Ğ½Ğ¸Ğº:** Ğ”Ğ¾ Ñ‚Ğ¾Ğ³Ğ¾ ÑĞº Ğ¿Ñ–Ğ´Ñƒ Ğ´Ğ¾Ğ´Ğ¾Ğ¼Ñƒ, Ğ¾Ğ±Ğ¾Ğ²'ÑĞ·ĞºĞ¾Ğ²Ğ¾ Ğ·Ğ°ĞºÑ–Ğ½Ñ‡Ñƒ.\n\n**Ğ¨ĞµÑ„:** Ğ Ñ‰Ğ¾ Ñ€Ğ¾Ğ±Ğ¸Ğ² ÑƒĞ²ĞµÑÑŒ Ñ€Ğ°Ğ½Ğ¾Ğº?\n\n**ĞŸÑ€Ğ°Ñ†Ñ–Ğ²Ğ½Ğ¸Ğº:** ĞŸĞ¾ĞºĞ¸ Ğ³Ğ¾Ñ‚ÑƒĞ²Ğ°Ğ² Ğ·Ğ²Ñ–Ñ‚, Ğ°Ğ½Ğ°Ğ»Ñ–Ğ·ÑƒĞ²Ğ°Ğ² Ğ´Ğ°Ğ½Ñ–. Ğ©Ğ¾Ğ¹Ğ½Ğ¾ Ğ¾Ñ‚Ñ€Ğ¸Ğ¼Ğ°Ğ² Ğ¾ÑÑ‚Ğ°Ğ½Ğ½Ñ Ñ–Ğ½Ñ„Ğ¾Ñ€Ğ¼Ğ°Ñ†Ñ–Ñ, Ğ¾Ğ´Ñ€Ğ°Ğ·Ñƒ Ğ¿Ğ¾Ñ‡Ğ°Ğ² Ğ¿Ğ¸ÑĞ°Ñ‚Ğ¸.\n\n**Ğ¨ĞµÑ„:** Ğ”Ğ¾Ğ±Ñ€Ğµ. Ğ¯Ğº Ñ‚Ñ–Ğ»ÑŒĞºĞ¸ Ğ·Ğ°ĞºÑ–Ğ½Ñ‡Ğ¸Ñˆ, Ğ¿Ñ€Ğ¸Ğ½ĞµÑĞ¸ Ğ¼ĞµĞ½Ñ–.\n\n**ĞŸÑ€Ğ°Ñ†Ñ–Ğ²Ğ½Ğ¸Ğº:** ĞŸÑ–ÑĞ»Ñ Ñ‚Ğ¾Ğ³Ğ¾ ÑĞº Ğ¿ĞµÑ€ĞµĞ²Ñ–Ñ€Ñ Ğ¿Ğ¾Ğ¼Ğ¸Ğ»ĞºĞ¸, Ğ¾Ğ´Ñ€Ğ°Ğ·Ñƒ Ğ·Ğ°Ğ½ĞµÑÑƒ!\n\n---\n\n### Ğ”Ñ–Ğ°Ğ»Ğ¾Ğ³ 4: Ğ¡Ğ¿Ğ¾Ğ³Ğ°Ğ´Ğ¸\n\n**Ğ”Ñ–Ğ´ÑƒÑÑŒ:** ĞšĞ¾Ğ»Ğ¸ Ñ Ğ±ÑƒĞ² Ğ¼Ğ¾Ğ»Ğ¾Ğ´Ğ¸Ğ¹, ÑƒÑĞµ Ğ±ÑƒĞ»Ğ¾ Ñ–Ğ½Ğ°ĞºÑˆĞµ.\n\n**ĞĞ½ÑƒĞº:** Ğ ĞºĞ¾Ğ»Ğ¸ Ğ²Ğ¸ Ğ¿Ğ¾Ğ·Ğ½Ğ°Ğ¹Ğ¾Ğ¼Ğ¸Ğ»Ğ¸ÑÑŒ Ğ· Ğ±Ğ°Ğ±ÑƒÑĞµÑ?\n\n**Ğ”Ñ–Ğ´ÑƒÑÑŒ:** Ğ¯Ğº Ñ‚Ñ–Ğ»ÑŒĞºĞ¸ Ñ Ñ—Ñ— Ğ¿Ğ¾Ğ±Ğ°Ñ‡Ğ¸Ğ², Ğ¾Ğ´Ñ€Ğ°Ğ·Ñƒ Ğ·Ğ°ĞºĞ¾Ñ…Ğ°Ğ²ÑÑ. ĞœĞ¸ Ğ·ÑƒÑÑ‚Ñ€Ñ–Ğ»Ğ¸ÑÑ, ĞºĞ¾Ğ»Ğ¸ Ñ‰Ğµ Ğ±ÑƒĞ»Ğ¸ ÑÑ‚ÑƒĞ´ĞµĞ½Ñ‚Ğ°Ğ¼Ğ¸.\n\n**ĞĞ½ÑƒĞº:** Ğ ĞºĞ¾Ğ»Ğ¸ Ğ¾Ğ´Ñ€ÑƒĞ¶Ğ¸Ğ»Ğ¸ÑÑŒ?\n\n**Ğ”Ñ–Ğ´ÑƒÑÑŒ:** ĞŸÑ–ÑĞ»Ñ Ñ‚Ğ¾Ğ³Ğ¾ ÑĞº Ñ Ğ·Ğ°ĞºÑ–Ğ½Ñ‡Ğ¸Ğ² ÑƒĞ½Ñ–Ğ²ĞµÑ€ÑĞ¸Ñ‚ĞµÑ‚, Ğ¼Ğ¸ Ğ¾Ğ´Ñ€ÑƒĞ¶Ğ¸Ğ»Ğ¸ÑÑŒ. ĞŸĞµÑ€Ñˆ Ğ½Ñ–Ğ¶ Ğ·Ğ°Ğ¿Ñ€Ğ¾Ğ¿Ğ¾Ğ½ÑƒĞ²Ğ°Ñ‚Ğ¸ Ñ—Ğ¹ Ñ€ÑƒĞºÑƒ, Ñ Ğ´Ğ¾Ğ²Ğ³Ğ¾ Ñ…Ğ²Ğ¸Ğ»ÑĞ²Ğ°Ğ²ÑÑ!\n\n**ĞĞ½ÑƒĞº:** Ğ’Ñ–Ğ´Ñ‚Ğ¾Ğ´Ñ– ÑĞº Ğ²Ğ¸ Ñ€Ğ°Ğ·Ğ¾Ğ¼, ÑĞºÑ–Ğ»ÑŒĞºĞ¸ Ñ€Ğ¾ĞºÑ–Ğ² Ğ¼Ğ¸Ğ½ÑƒĞ»Ğ¾?\n\n**Ğ”Ñ–Ğ´ÑƒÑÑŒ:** Ğ— Ñ‚Ğ¸Ñ… Ğ¿Ñ–Ñ€ ÑĞº Ğ¼Ğ¸ Ğ¾Ğ´Ñ€ÑƒĞ¶Ğ¸Ğ»Ğ¸ÑÑŒ â€” Ğ²Ğ¶Ğµ Ğ¿'ÑÑ‚Ğ´ĞµÑÑÑ‚ Ñ€Ğ¾ĞºÑ–Ğ²!\n\n---\n\n# ĞŸÑ–Ğ´ÑÑƒĞ¼Ğ¾Ğº\n\n**Ğ©Ğ¾ Ğ²Ğ¸ Ğ½Ğ°Ğ²Ñ‡Ğ¸Ğ»Ğ¸ÑÑ:**\n\n1. **ĞĞ´Ğ½Ğ¾Ñ‡Ğ°ÑĞ½Ñ–ÑÑ‚ÑŒ:** ĞºĞ¾Ğ»Ğ¸, Ñƒ Ñ‚Ğ¾Ğ¹ Ñ‡Ğ°Ñ ÑĞº, Ğ¿Ğ¾ĞºĞ¸ â€” Ğ´Ñ–Ñ— Ğ²Ñ–Ğ´Ğ±ÑƒĞ²Ğ°ÑÑ‚ÑŒÑÑ Ğ¿Ğ°Ñ€Ğ°Ğ»ĞµĞ»ÑŒĞ½Ğ¾.\n2. **ĞŸĞ¾ÑĞ»Ñ–Ğ´Ğ¾Ğ²Ğ½Ñ–ÑÑ‚ÑŒ:** Ğ¿Ñ–ÑĞ»Ñ Ñ‚Ğ¾Ğ³Ğ¾ ÑĞº, ÑĞº Ñ‚Ñ–Ğ»ÑŒĞºĞ¸, Ñ‰Ğ¾Ğ¹Ğ½Ğ¾ â€” Ğ¾Ğ´Ğ½Ğ° Ğ´Ñ–Ñ Ğ¿Ñ–ÑĞ»Ñ Ñ–Ğ½ÑˆĞ¾Ñ—.\n3. **ĞŸĞ¾Ğ¿ĞµÑ€ĞµĞ´Ğ½Ñ–ÑÑ‚ÑŒ:** Ğ¿ĞµÑ€Ñˆ Ğ½Ñ–Ğ¶, Ğ´Ğ¾ Ñ‚Ğ¾Ğ³Ğ¾ ÑĞº â€” Ğ¾Ğ´Ğ½Ğ° Ğ´Ñ–Ñ Ğ¿ĞµÑ€ĞµĞ´ Ñ–Ğ½ÑˆĞ¾Ñ.\n4. **Ğ¢Ñ€Ğ¸Ğ²Ğ°Ğ»Ñ–ÑÑ‚ÑŒ:** Ğ¿Ğ¾ĞºĞ¸, Ğ´Ğ¾ĞºĞ¸, Ğ²ĞµÑÑŒ Ñ‡Ğ°Ñ â€” Ğ´Ñ–Ñ Ğ¾Ñ…Ğ¾Ğ¿Ğ»ÑÑ” Ğ¿ĞµÑ€Ñ–Ğ¾Ğ´.\n5. **Ğ ĞµĞ³ÑƒĞ»ÑÑ€Ğ½Ñ–ÑÑ‚ÑŒ:** ĞºĞ¾Ğ¶Ğ½Ğ¾Ğ³Ğ¾ Ñ€Ğ°Ğ·Ñƒ ĞºĞ¾Ğ»Ğ¸, Ñ‰Ğ¾Ñ€Ğ°Ğ·Ñƒ ÑĞº â€” Ğ¿Ğ¾Ğ²Ñ‚Ğ¾Ñ€ÑĞ²Ğ°Ğ½Ñ– Ğ´Ñ–Ñ—.\n\n**ĞÑĞ½Ğ¾Ğ²Ğ½Ğµ Ğ¿Ñ€Ğ°Ğ²Ğ¸Ğ»Ğ¾:**\n\n> Ğ§Ğ°ÑĞ¾Ğ²Ğ¸Ğ¹ ÑĞ¿Ğ¾Ğ»ÑƒÑ‡Ğ½Ğ¸Ğº Ğ²Ğ¸Ğ·Ğ½Ğ°Ñ‡Ğ°Ñ” Ğ²Ñ–Ğ´Ğ½Ğ¾ÑˆĞµĞ½Ğ½Ñ Ğ¼Ñ–Ğ¶ Ğ´Ñ–ÑĞ¼Ğ¸: Ğ¾Ğ´Ğ½Ğ¾Ñ‡Ğ°ÑĞ½Ñ–ÑÑ‚ÑŒ (ĞºĞ¾Ğ»Ğ¸), Ğ¿Ğ¾ÑĞ»Ñ–Ğ´Ğ¾Ğ²Ğ½Ñ–ÑÑ‚ÑŒ (Ğ¿Ñ–ÑĞ»Ñ Ñ‚Ğ¾Ğ³Ğ¾ ÑĞº), Ğ¿Ğ¾Ğ¿ĞµÑ€ĞµĞ´Ğ½Ñ–ÑÑ‚ÑŒ (Ğ¿ĞµÑ€Ñˆ Ğ½Ñ–Ğ¶). ĞĞ±Ğ¸Ñ€Ğ°Ğ¹Ñ‚Ğµ ÑĞ¿Ğ¾Ğ»ÑƒÑ‡Ğ½Ğ¸Ğº Ğ²Ñ–Ğ´Ğ¿Ğ¾Ğ²Ñ–Ğ´Ğ½Ğ¾ Ğ´Ğ¾ Ğ»Ğ¾Ğ³Ñ–ĞºĞ¸ Ğ¿Ğ¾Ğ´Ñ–Ğ¹!\n\n**Ğ”Ğ°Ğ»Ñ–:**\n\nĞ£ Ğ½Ğ°ÑÑ‚ÑƒĞ¿Ğ½Ğ¾Ğ¼Ñƒ Ğ¼Ğ¾Ğ´ÑƒĞ»Ñ– (Ğœ38) Ğ¼Ğ¸ Ñ€Ğ¾Ğ·Ğ³Ğ»ÑĞ½ĞµĞ¼Ğ¾ **Ñ–Ğ½Ñ‚ĞµĞ³Ñ€Ğ°Ñ†Ñ–Ñ Ğ²ÑÑ–Ñ… Ñ‚Ğ¸Ğ¿Ñ–Ğ² ÑĞºĞ»Ğ°Ğ´Ğ½Ğ¸Ñ… Ñ€ĞµÑ‡ĞµĞ½ÑŒ** Ñ‚Ğ° **Ğ¾Ğ´Ğ½Ğ¾ÑĞºĞ»Ğ°Ğ´Ğ½Ñ– Ñ€ĞµÑ‡ĞµĞ½Ğ½Ñ**. Ğ¦Ğµ Ğ´Ğ¾Ğ·Ğ²Ğ¾Ğ»Ğ¸Ñ‚ÑŒ Ğ²Ğ°Ğ¼ Ğ±ÑƒĞ´ÑƒĞ²Ğ°Ñ‚Ğ¸ ÑĞ¿Ñ€Ğ°Ğ²Ğ´Ñ– ÑĞºĞ»Ğ°Ğ´Ğ½Ñ– Ñ‚ĞµĞºÑÑ‚Ğ¸, Ğ¿Ğ¾Ñ”Ğ´Ğ½ÑƒÑÑ‡Ğ¸ Ğ¿Ñ€Ğ¸Ñ‡Ğ¸Ğ½Ğ¾Ğ²Ñ–, Ñ‡Ğ°ÑĞ¾Ğ²Ñ–, ÑƒĞ¼Ğ¾Ğ²Ğ½Ñ– Ñ‚Ğ° Ğ²Ñ–Ğ´Ğ½Ğ¾ÑĞ½Ñ– ĞºĞ¾Ğ½ÑÑ‚Ñ€ÑƒĞºÑ†Ñ–Ñ—!\n\n> âœ… **Ğ¡Ğ°Ğ¼Ğ¾Ğ¿ĞµÑ€ĞµĞ²Ñ–Ñ€ĞºĞ°**\n>\n> Ğ§Ğ¸ Ğ¼Ğ¾Ğ¶ĞµÑ‚Ğµ Ğ²Ğ¸:\n> - [ ] Ğ’Ğ¸ĞºĞ¾Ñ€Ğ¸ÑÑ‚Ğ°Ñ‚Ğ¸ Â«ĞºĞ¾Ğ»Ğ¸Â», Â«Ñƒ Ñ‚Ğ¾Ğ¹ Ñ‡Ğ°Ñ ÑĞºÂ» Ğ´Ğ»Ñ Ğ¾Ğ´Ğ½Ğ¾Ñ‡Ğ°ÑĞ½Ğ¸Ñ… Ğ´Ñ–Ğ¹?\n> - [ ] Ğ’Ğ¸ĞºĞ¾Ñ€Ğ¸ÑÑ‚Ğ°Ñ‚Ğ¸ Â«Ğ¿Ñ–ÑĞ»Ñ Ñ‚Ğ¾Ğ³Ğ¾ ÑĞºÂ», Â«ÑĞº Ñ‚Ñ–Ğ»ÑŒĞºĞ¸Â» Ğ´Ğ»Ñ Ğ¿Ğ¾ÑĞ»Ñ–Ğ´Ğ¾Ğ²Ğ½Ğ¸Ñ… Ğ´Ñ–Ğ¹?\n> - [ ] Ğ’Ğ¸ĞºĞ¾Ñ€Ğ¸ÑÑ‚Ğ°Ñ‚Ğ¸ Â«Ğ¿ĞµÑ€Ñˆ Ğ½Ñ–Ğ¶Â», Â«Ğ´Ğ¾ Ñ‚Ğ¾Ğ³Ğ¾ ÑĞºÂ» Ğ´Ğ»Ñ Ğ¿Ğ¾Ğ¿ĞµÑ€ĞµĞ´Ğ½Ñ–Ñ… Ğ´Ñ–Ğ¹?\n> - [ ] ĞŸÑ€Ğ°Ğ²Ğ¸Ğ»ÑŒĞ½Ğ¾ Ğ·Ğ°ÑÑ‚Ğ¾ÑÑƒĞ²Ğ°Ñ‚Ğ¸ Â«Ğ¿Ğ¾ĞºĞ¸ Ğ½ĞµÂ» Ğ· Ğ·Ğ°Ğ¿ĞµÑ€ĞµÑ‡ĞµĞ½Ğ½ÑĞ¼?\n>\n> Ğ¯ĞºÑ‰Ğ¾ Ñ‚Ğ°Ğº â€” Ğ¿ĞµÑ€ĞµÑ…Ğ¾Ğ´ÑŒÑ‚Ğµ Ğ´Ğ¾ Ğ²Ğ¿Ñ€Ğ°Ğ²!\n\n---\n\n> [!resources] ğŸ§ Ğ—Ğ¾Ğ²Ğ½Ñ–ÑˆĞ½Ñ– Ñ€ĞµÑÑƒÑ€ÑĞ¸\n>\n> **Ğ”Ğ¾Ğ´Ğ°Ñ‚ĞºĞ¾Ğ²Ñ– Ğ¼Ğ°Ñ‚ĞµÑ€Ñ–Ğ°Ğ»Ğ¸ Ğ´Ğ»Ñ Ğ²Ğ¸Ğ²Ñ‡ĞµĞ½Ğ½Ñ:**\n> - ğŸ“– [Ğ§Ğ°ÑĞ¾Ğ²Ñ– ÑĞ¿Ğ¾Ğ»ÑƒÑ‡Ğ½Ğ¸ĞºĞ¸](https://uk.wikipedia.org/wiki/Ğ¡Ğ¿Ğ¾Ğ»ÑƒÑ‡Ğ½Ğ¸Ğº) â€” Ğ’Ñ–ĞºÑ–Ğ¿ĞµĞ´Ñ–Ñ\n> - ğŸ“º [Ukrainian Grammar](https://www.youtube.com/@ukrainianlesson) â€” Ğ²Ñ–Ğ´ĞµĞ¾ÑƒÑ€Ğ¾ĞºĞ¸\n> - ğŸ§ [Ukrainian Lessons Podcast](https://ukrainianlessons.com/) â€” Ğ¿Ğ¾Ğ´ĞºĞ°ÑÑ‚ Ğ´Ğ»Ñ Ğ²Ğ¸Ğ²Ñ‡ĞµĞ½Ğ½Ñ\n\n---\n\n# Ğ’Ğ¿Ñ€Ğ°Ğ²Ğ¸\n\n## quiz: Ğ’Ğ¸Ğ±ĞµÑ€Ñ–Ñ‚ÑŒ Ğ¿Ñ€Ğ°Ğ²Ğ¸Ğ»ÑŒĞ½Ñƒ Ğ²Ñ–Ğ´Ğ¿Ğ¾Ğ²Ñ–Ğ´ÑŒ\n\n1. Ğ¯ĞºĞ¸Ğ¹ ÑĞ¿Ğ¾Ğ»ÑƒÑ‡Ğ½Ğ¸Ğº Ğ²Ğ¸ĞºĞ¾Ñ€Ğ¸ÑÑ‚Ğ¾Ğ²ÑƒÑ”Ñ‚ÑŒÑÑ Ğ´Ğ»Ñ Ğ²Ğ¸Ñ€Ğ°Ğ¶ĞµĞ½Ğ½Ñ Ğ¾Ğ´Ğ½Ğ¾Ñ‡Ğ°ÑĞ½Ğ¸Ñ… Ğ´Ñ–Ğ¹, Ñ‰Ğ¾ Ğ²Ñ–Ğ´Ğ±ÑƒĞ²Ğ°ÑÑ‚ÑŒÑÑ Ğ¿Ğ°Ñ€Ğ°Ğ»ĞµĞ»ÑŒĞ½Ğ¾ Ñƒ Ñ‡Ğ°ÑÑ–?\n   - [x] Ñƒ Ñ‚Ğ¾Ğ¹ Ñ‡Ğ°Ñ ÑĞº\n   - [ ] Ğ¿Ñ–ÑĞ»Ñ Ñ‚Ğ¾Ğ³Ğ¾ ÑĞº\n   - [ ] Ğ¿ĞµÑ€Ñˆ Ğ½Ñ–Ğ¶\n   - [ ] ÑĞº Ñ‚Ñ–Ğ»ÑŒĞºĞ¸\n   > Â«Ğ£ Ñ‚Ğ¾Ğ¹ Ñ‡Ğ°Ñ ÑĞºÂ» Ğ²Ğ¸Ñ€Ğ°Ğ¶Ğ°Ñ” Ğ¿Ğ°Ñ€Ğ°Ğ»ĞµĞ»ÑŒĞ½Ñ–ÑÑ‚ÑŒ Ğ´Ñ–Ğ¹.\n\n2. Ğ¯ĞºĞµ Ğ· Ğ½Ğ°Ğ²ĞµĞ´ĞµĞ½Ğ¸Ñ… Ñ€ĞµÑ‡ĞµĞ½ÑŒ Ğ¿Ñ€Ğ°Ğ²Ğ¸Ğ»ÑŒĞ½Ğ¾ Ğ²Ğ¸Ñ€Ğ°Ğ¶Ğ°Ñ” Ğ¿Ğ¾ÑĞ»Ñ–Ğ´Ğ¾Ğ²Ğ½Ñ–ÑÑ‚ÑŒ Ğ¿Ğ¾Ğ´Ñ–Ğ¹ Ğ· Ğ²Ğ¸ĞºĞ¾Ñ€Ğ¸ÑÑ‚Ğ°Ğ½Ğ½ÑĞ¼ ÑĞ¿Ğ¾Ğ»ÑƒÑ‡Ğ½Ğ¸ĞºĞ° Ñ‡Ğ°ÑÑƒ?\n   - [ ] ĞšĞ¾Ğ»Ğ¸ Ğ²Ñ–Ğ½ Ğ¿Ñ€Ğ¸Ğ¹ÑˆĞ¾Ğ², Ğ¼Ğ¸ Ğ³Ğ¾Ğ²Ğ¾Ñ€Ğ¸Ğ»Ğ¸.\n   - [x] ĞŸÑ–ÑĞ»Ñ Ñ‚Ğ¾Ğ³Ğ¾ ÑĞº Ğ²Ñ–Ğ½ Ğ¿Ñ–ÑˆĞ¾Ğ², Ğ¼Ğ¸ Ğ¿Ñ€Ğ¾Ğ´Ğ¾Ğ²Ğ¶Ğ¸Ğ»Ğ¸ Ñ€Ğ¾Ğ·Ğ¼Ğ¾Ğ²Ñƒ.\n   - [ ] ĞŸĞ¾ĞºĞ¸ Ğ²Ğ¾Ğ½Ğ° Ğ³Ğ¾Ñ‚ÑƒĞ²Ğ°Ğ»Ğ°, Ğ²Ñ–Ğ½ Ñ‡Ğ¸Ñ‚Ğ°Ğ² Ğ³Ğ°Ğ·ĞµÑ‚Ñƒ.\n   - [ ] Ğ£ Ñ‚Ğ¾Ğ¹ Ñ‡Ğ°Ñ ÑĞº Ğ±Ğ°Ñ‚ÑŒĞºĞ¸ Ğ²Ñ–Ğ´Ğ¿Ğ¾Ñ‡Ğ¸Ğ²Ğ°Ğ»Ğ¸, Ğ´Ñ–Ñ‚Ğ¸ Ğ³Ñ€Ğ°Ğ»Ğ¸ÑÑ.\n   > Â«ĞŸÑ–ÑĞ»Ñ Ñ‚Ğ¾Ğ³Ğ¾ ÑĞºÂ» Ğ²Ğ¸Ñ€Ğ°Ğ¶Ğ°Ñ” Ğ¿Ğ¾ÑĞ»Ñ–Ğ´Ğ¾Ğ²Ğ½Ñ–ÑÑ‚ÑŒ: ÑĞ¿Ğ¾Ñ‡Ğ°Ñ‚ĞºÑƒ Ğ¾Ğ´Ğ½Ğ° Ğ´Ñ–Ñ, Ğ¿Ğ¾Ñ‚Ñ–Ğ¼ Ñ–Ğ½ÑˆĞ°.\n\n3. Ğ¯ĞºĞ¸Ğ¹ ÑĞ¿Ğ¾Ğ»ÑƒÑ‡Ğ½Ğ¸Ğº Ğ²Ğ¸ĞºĞ¾Ñ€Ğ¸ÑÑ‚Ğ¾Ğ²ÑƒÑ”Ñ‚ÑŒÑÑ Ğ´Ğ»Ñ Ğ²Ğ¸Ñ€Ğ°Ğ¶ĞµĞ½Ğ½Ñ Ğ´Ñ–Ñ—, ÑĞºĞ° Ğ²Ñ–Ğ´Ğ±ÑƒĞ²Ğ°Ñ”Ñ‚ÑŒÑÑ Ğ±ĞµĞ·Ğ¿Ğ¾ÑĞµÑ€ĞµĞ´Ğ½ÑŒĞ¾ Ğ¿ĞµÑ€ĞµĞ´ Ñ–Ğ½ÑˆĞ¾Ñ Ğ´Ñ–Ñ”Ñ?\n   - [ ] Ğ¿Ñ–ÑĞ»Ñ Ñ‚Ğ¾Ğ³Ğ¾ ÑĞº\n   - [ ] ÑĞº Ñ‚Ñ–Ğ»ÑŒĞºĞ¸\n   - [x] Ğ¿ĞµÑ€Ñˆ Ğ½Ñ–Ğ¶\n   - [ ] Ğ²Ñ–Ğ´Ñ‚Ğ¾Ğ´Ñ– ÑĞº\n   > Â«ĞŸĞµÑ€Ñˆ Ğ½Ñ–Ğ¶Â» = Ğ´Ğ¾ Ñ‚Ğ¾Ğ³Ğ¾, ÑĞº.\n\n4. Ğ¯Ğº Ğ¿Ñ€Ğ°Ğ²Ğ¸Ğ»ÑŒĞ½Ğ¾ Ğ·Ğ°Ğ²ĞµÑ€ÑˆĞ¸Ñ‚Ğ¸ Ñ€ĞµÑ‡ĞµĞ½Ğ½Ñ Ğ· Ğ²Ğ¸ĞºĞ¾Ñ€Ğ¸ÑÑ‚Ğ°Ğ½Ğ½ÑĞ¼ Ñ‡Ğ°ÑĞ¾Ğ²Ğ¾Ğ³Ğ¾ ÑĞ¿Ğ¾Ğ»ÑƒÑ‡Ğ½Ğ¸ĞºĞ°: Â«Ğ§ĞµĞºĞ°Ğ¹ Ñ‚ÑƒÑ‚, Ğ¿Ğ¾ĞºĞ¸ Ñ ___Â»?\n   - [ ] Ğ¿Ñ€Ğ¸Ğ¹Ğ´Ñƒ\n   - [x] Ğ½Ğµ Ğ¿Ñ€Ğ¸Ğ¹Ğ´Ñƒ\n   - [ ] Ğ¿Ñ€Ğ¸Ñ…Ğ¾Ğ´Ğ¶Ñƒ\n   - [ ] Ğ¿Ñ€Ğ¸Ñ…Ğ¾Ğ´Ğ¸Ğ²\n   > Â«ĞŸĞ¾ĞºĞ¸ Ğ½ĞµÂ» Ğ²Ğ¸Ğ¼Ğ°Ğ³Ğ°Ñ” Ğ·Ğ°Ğ¿ĞµÑ€ĞµÑ‡ĞµĞ½Ğ½Ñ.\n\n5. Ğ¯ĞºĞ¸Ğ¹ ÑĞ¿Ğ¾Ğ»ÑƒÑ‡Ğ½Ğ¸Ğº Ğ½Ğ°Ğ¹ĞºÑ€Ğ°Ñ‰Ğµ Ğ¿ĞµÑ€ĞµĞ´Ğ°Ñ” Ñ–Ğ´ĞµÑ Ğ¼Ğ¸Ñ‚Ñ‚Ñ”Ğ²Ğ¾Ñ— Ñ€ĞµĞ°ĞºÑ†Ñ–Ñ— Ğ½Ğ° Ğ¿Ğ¾Ğ´Ñ–Ñ Ğ² ÑƒĞºÑ€Ğ°Ñ—Ğ½ÑÑŒĞºÑ–Ğ¹ Ğ¼Ğ¾Ğ²Ñ–?\n   - [ ] ĞºĞ¾Ğ»Ğ¸\n   - [ ] Ğ¿Ğ¾ĞºĞ¸\n   - [x] ÑĞº Ñ‚Ñ–Ğ»ÑŒĞºĞ¸\n   - [ ] Ğ² Ğ¼Ñ–Ñ€Ñƒ Ñ‚Ğ¾Ğ³Ğ¾ ÑĞº\n   > Â«Ğ¯Ğº Ñ‚Ñ–Ğ»ÑŒĞºĞ¸Â» Ğ²Ğ¸Ñ€Ğ°Ğ¶Ğ°Ñ” Ğ½ĞµĞ³Ğ°Ğ¹Ğ½Ñƒ Ñ€ĞµĞ°ĞºÑ†Ñ–Ñ.\n\n6. Ğ¯ĞºĞµ Ğ· Ğ½Ğ°Ğ²ĞµĞ´ĞµĞ½Ğ¸Ñ… Ñ€ĞµÑ‡ĞµĞ½ÑŒ Ğ¼Ñ–ÑÑ‚Ğ¸Ñ‚ÑŒ Ñ‡Ğ°ÑĞ¾Ğ²Ğ¸Ğ¹ ÑĞ¿Ğ¾Ğ»ÑƒÑ‡Ğ½Ğ¸Ğº, Ñ‰Ğ¾ Ğ²Ğ¸Ñ€Ğ°Ğ¶Ğ°Ñ” Ñ€ĞµĞ³ÑƒĞ»ÑÑ€Ğ½Ñ–ÑÑ‚ÑŒ Ğ¿Ğ¾Ğ²Ñ‚Ğ¾Ñ€ÑĞ²Ğ°Ğ½Ğ¸Ñ… Ğ¿Ğ¾Ğ´Ñ–Ğ¹?\n   - [ ] ĞšĞ¾Ğ»Ğ¸ Ğ²Ñ–Ğ½ Ğ¿Ñ€Ğ¸Ğ¹ÑˆĞ¾Ğ², Ğ¼Ğ¸ Ğ¾Ğ±Ñ–Ğ´Ğ°Ğ»Ğ¸.\n   - [ ] ĞŸÑ–ÑĞ»Ñ Ñ‚Ğ¾Ğ³Ğ¾ ÑĞº Ğ¿Ñ–ÑˆĞ¾Ğ² Ğ´Ğ¾Ñ‰, Ğ·'ÑĞ²Ğ¸Ğ»Ğ°ÑÑŒ Ğ²ĞµÑĞµĞ»ĞºĞ°.\n   - [x] ĞšĞ¾Ğ¶Ğ½Ğ¾Ğ³Ğ¾ Ñ€Ğ°Ğ·Ñƒ ĞºĞ¾Ğ»Ğ¸ Ğ²Ñ–Ğ½ Ğ¿Ñ€Ğ¸Ñ…Ğ¾Ğ´Ğ¸Ñ‚ÑŒ, Ğ¿Ñ€Ğ¸Ğ½Ğ¾ÑĞ¸Ñ‚ÑŒ ĞºĞ²Ñ–Ñ‚Ğ¸.\n   - [ ] ĞŸĞµÑ€Ñˆ Ğ½Ñ–Ğ¶ Ğ¿Ñ–Ñ‚Ğ¸, Ğ²Ñ–Ğ½ Ğ¿Ğ¾Ğ¿Ñ€Ğ¾Ñ‰Ğ°Ğ²ÑÑ Ğ· ÑƒÑÑ–Ğ¼Ğ°.\n   > Â«ĞšĞ¾Ğ¶Ğ½Ğ¾Ğ³Ğ¾ Ñ€Ğ°Ğ·Ñƒ ĞºĞ¾Ğ»Ğ¸Â» Ğ²Ğ¸Ñ€Ğ°Ğ¶Ğ°Ñ” Ñ€ĞµĞ³ÑƒĞ»ÑÑ€Ğ½Ñ–ÑÑ‚ÑŒ.\n\n7. Ğ¯ĞºĞ¸Ğ¹ ÑĞ¿Ğ¾Ğ»ÑƒÑ‡Ğ½Ğ¸Ğº Ğ²Ğ¸ĞºĞ¾Ñ€Ğ¸ÑÑ‚Ğ¾Ğ²ÑƒÑ”Ñ‚ÑŒÑÑ Ğ´Ğ»Ñ Ğ²Ğ¸Ñ€Ğ°Ğ¶ĞµĞ½Ğ½Ñ Ğ´Ñ–Ñ—, ÑĞºĞ° Ñ‚Ñ€Ğ¸Ğ²Ğ°Ñ” Ğ¿Ñ€Ğ¾Ñ‚ÑĞ³Ğ¾Ğ¼ ÑƒÑÑŒĞ¾Ğ³Ğ¾ Ğ¿ĞµÑ€Ñ–Ğ¾Ğ´Ñƒ Ñ–Ğ½ÑˆĞ¾Ñ— Ğ´Ñ–Ñ—?\n   - [ ] ÑĞº Ñ‚Ñ–Ğ»ÑŒĞºĞ¸\n   - [x] Ğ¿Ğ¾ĞºĞ¸\n   - [ ] Ñ‰Ğ¾Ğ¹Ğ½Ğ¾\n   - [ ] Ğ¿Ñ–ÑĞ»Ñ Ñ‚Ğ¾Ğ³Ğ¾ ÑĞº\n   > Â«ĞŸĞ¾ĞºĞ¸Â» Ğ²Ğ¸Ñ€Ğ°Ğ¶Ğ°Ñ” Ñ‚Ñ€Ğ¸Ğ²Ğ°Ğ»Ñ–ÑÑ‚ÑŒ.\n\n8. Ğ¯ĞºĞ° Ğ¾ÑĞ½Ğ¾Ğ²Ğ½Ğ° Ğ²Ñ–Ğ´Ğ¼Ñ–Ğ½Ğ½Ñ–ÑÑ‚ÑŒ Ğ¼Ñ–Ğ¶ ÑĞ¿Ğ¾Ğ»ÑƒÑ‡Ğ½Ğ¸ĞºĞ°Ğ¼Ğ¸ Â«Ñ‰Ğ¾Ğ¹Ğ½Ğ¾Â» Ñ‚Ğ° Â«Ğ· Ñ‚Ğ¸Ñ… Ğ¿Ñ–Ñ€ ÑĞºÂ» Ñƒ Ğ²Ğ¸Ñ€Ğ°Ğ¶ĞµĞ½Ğ½Ñ– Ñ‡Ğ°ÑĞ¾Ğ²Ğ¸Ñ… Ğ²Ñ–Ğ´Ğ½Ğ¾ÑˆĞµĞ½ÑŒ?\n   - [x] Â«Ğ©Ğ¾Ğ¹Ğ½Ğ¾Â» â€” Ğ¼Ğ¸Ñ‚Ñ‚Ñ”Ğ²Ñ–ÑÑ‚ÑŒ, Â«Ğ· Ñ‚Ğ¸Ñ… Ğ¿Ñ–Ñ€ ÑĞºÂ» â€” Ñ‚Ñ€Ğ¸Ğ²Ğ°Ğ»Ñ–ÑÑ‚ÑŒ Ğ²Ñ–Ğ´ Ğ¼Ğ¸Ğ½ÑƒĞ»Ğ¾Ğ³Ğ¾\n   - [ ] ĞĞµĞ¼Ğ°Ñ” Ğ²Ñ–Ğ´Ğ¼Ñ–Ğ½Ğ½Ğ¾ÑÑ‚Ñ–, Ğ²Ğ¾Ğ½Ğ¸ ÑĞ¸Ğ½Ğ¾Ğ½Ñ–Ğ¼Ğ¸.\n   - [ ] Â«Ğ©Ğ¾Ğ¹Ğ½Ğ¾Â» â€” ĞºĞ½Ğ¸Ğ¶Ğ½Ğ¸Ğ¹, Â«Ğ· Ñ‚Ğ¸Ñ… Ğ¿Ñ–Ñ€ ÑĞºÂ» â€” Ñ€Ğ¾Ğ·Ğ¼Ğ¾Ğ²Ğ½Ğ¸Ğ¹.\n   - [ ] Â«Ğ©Ğ¾Ğ¹Ğ½Ğ¾Â» â€” Ğ¼Ğ°Ğ¹Ğ±ÑƒÑ‚Ğ½Ñ”, Â«Ğ· Ñ‚Ğ¸Ñ… Ğ¿Ñ–Ñ€ ÑĞºÂ» â€” Ğ¼Ğ¸Ğ½ÑƒĞ»Ğµ.\n   > Â«Ğ©Ğ¾Ğ¹Ğ½Ğ¾Â» = Ğ»ĞµĞ´Ğ²Ğµ, Ñ‚Ñ–Ğ»ÑŒĞºĞ¸-Ğ½Ğ¾; Â«Ğ· Ñ‚Ğ¸Ñ… Ğ¿Ñ–Ñ€ ÑĞºÂ» = Ğ²Ñ–Ğ´ Ñ‚Ğ¾Ğ³Ğ¾ Ñ‡Ğ°ÑÑƒ Ğ´Ğ¾ Ñ‚ĞµĞ¿ĞµÑ€.\n\n---\n\n## match-up: Ğ—'Ñ”Ğ´Ğ½Ğ°Ğ¹Ñ‚Ğµ ÑĞ¿Ğ¾Ğ»ÑƒÑ‡Ğ½Ğ¸Ğº Ğ· Ğ¹Ğ¾Ğ³Ğ¾ Ñ„ÑƒĞ½ĞºÑ†Ñ–Ñ”Ñ\n\n- ĞºĞ¾Ğ»Ğ¸ :: Ğ¾Ğ´Ğ½Ğ¾Ñ‡Ğ°ÑĞ½Ñ–ÑÑ‚ÑŒ Ğ°Ğ±Ğ¾ Ğ¼Ğ¾Ğ¼ĞµĞ½Ñ‚ Ğ² Ñ‡Ğ°ÑÑ–\n- Ğ¿Ñ–ÑĞ»Ñ Ñ‚Ğ¾Ğ³Ğ¾ ÑĞº :: Ğ¿Ğ¾ÑĞ»Ñ–Ğ´Ğ¾Ğ²Ğ½Ñ–ÑÑ‚ÑŒ (Ğ¾Ğ´Ğ½Ğ° Ğ´Ñ–Ñ Ğ¿Ñ–ÑĞ»Ñ Ñ–Ğ½ÑˆĞ¾Ñ—)\n- Ğ¿ĞµÑ€Ñˆ Ğ½Ñ–Ğ¶ :: Ğ¿Ğ¾Ğ¿ĞµÑ€ĞµĞ´Ğ½Ñ–ÑÑ‚ÑŒ (Ğ¾Ğ´Ğ½Ğ° Ğ´Ñ–Ñ Ğ´Ğ¾ Ñ–Ğ½ÑˆĞ¾Ñ—)\n- ÑĞº Ñ‚Ñ–Ğ»ÑŒĞºĞ¸ :: Ğ½ĞµĞ³Ğ°Ğ¹Ğ½Ğ° Ñ€ĞµĞ°ĞºÑ†Ñ–Ñ Ğ½Ğ° Ğ¿Ğ¾Ğ´Ñ–Ñ\n- Ğ¿Ğ¾ĞºĞ¸ :: Ñ‚Ñ€Ğ¸Ğ²Ğ°Ğ»Ñ–ÑÑ‚ÑŒ Ğ´Ñ–Ñ— Ñƒ Ñ‡Ğ°ÑÑ–\n- Ñ‰Ğ¾Ğ¹Ğ½Ğ¾ :: Ğ¼Ğ¸Ñ‚Ñ‚Ñ”Ğ²Ñ–ÑÑ‚ÑŒ, Ğ»ĞµĞ´Ğ²Ğµ Ğ²ÑÑ‚Ğ¸Ğ³\n- Ñƒ Ñ‚Ğ¾Ğ¹ Ñ‡Ğ°Ñ ÑĞº :: Ğ¿Ğ°Ñ€Ğ°Ğ»ĞµĞ»ÑŒĞ½Ñ–ÑÑ‚ÑŒ Ğ´Ğ²Ğ¾Ñ… Ğ´Ñ–Ğ¹\n- Ğ· Ñ‚Ğ¸Ñ… Ğ¿Ñ–Ñ€ ÑĞº :: Ñ‚Ñ€Ğ¸Ğ²Ğ°Ğ»Ñ–ÑÑ‚ÑŒ Ğ²Ñ–Ğ´ Ğ¼Ğ¸Ğ½ÑƒĞ»Ğ¾Ğ³Ğ¾ Ğ¼Ğ¾Ğ¼ĞµĞ½Ñ‚Ñƒ\n- Ğ´Ğ¾ Ñ‚Ğ¾Ğ³Ğ¾ ÑĞº :: Ğ´Ñ–Ñ Ñ€Ğ½Ñ–ÑˆĞµ Ğ·Ğ° Ğ³Ğ¾Ğ»Ğ¾Ğ²Ğ½Ñƒ\n- ĞºĞ¾Ğ¶Ğ½Ğ¾Ğ³Ğ¾ Ñ€Ğ°Ğ·Ñƒ ĞºĞ¾Ğ»Ğ¸ :: Ñ€ĞµĞ³ÑƒĞ»ÑÑ€Ğ½Ñ–ÑÑ‚ÑŒ Ğ¿Ğ¾Ğ²Ñ‚Ğ¾Ñ€ĞµĞ½Ğ½Ñ\n- Ğ´Ğ¾ĞºĞ¸ Ğ½Ğµ :: Ğ¾Ñ‡Ñ–ĞºÑƒĞ²Ğ°Ğ½Ğ½Ñ Ñ€ĞµĞ·ÑƒĞ»ÑŒÑ‚Ğ°Ñ‚Ñƒ\n- Ğ² Ğ¼Ñ–Ñ€Ñƒ Ñ‚Ğ¾Ğ³Ğ¾ ÑĞº :: Ğ¿Ğ¾ÑÑ‚ÑƒĞ¿Ğ¾Ğ²Ğ¸Ğ¹ Ñ€Ğ¾Ğ·Ğ²Ğ¸Ñ‚Ğ¾Ğº\n\n---\n\n## fill-in: Ğ”Ğ¾Ğ¿Ğ¾Ğ²Ğ½Ñ–Ñ‚ÑŒ Ñ€ĞµÑ‡ĞµĞ½Ğ½Ñ Ğ¿Ñ€Ğ°Ğ²Ğ¸Ğ»ÑŒĞ½Ğ¸Ğ¼ ÑĞ¿Ğ¾Ğ»ÑƒÑ‡Ğ½Ğ¸ĞºĞ¾Ğ¼\n\n1. ___ Ğ²Ñ–Ğ½ Ğ¿Ñ€Ğ¸Ğ¹ÑˆĞ¾Ğ², Ğ¼Ğ¸ Ğ²Ğ¶Ğµ Ğ²ĞµÑ‡ĞµÑ€ÑĞ»Ğ¸.\n   > [!answer] ĞšĞ¾Ğ»Ğ¸\n   > [!options] ĞšĞ¾Ğ»Ğ¸ | ĞŸÑ–ÑĞ»Ñ Ñ‚Ğ¾Ğ³Ğ¾ ÑĞº | ĞŸĞµÑ€Ñˆ Ğ½Ñ–Ğ¶ | ĞŸĞ¾ĞºĞ¸\n\n2. ___ ÑĞ¾Ğ½Ñ†Ğµ Ğ·Ñ–Ğ¹ÑˆĞ»Ğ¾, Ğ¼Ğ¸ Ğ²Ğ¸Ñ€ÑƒÑˆĞ¸Ğ»Ğ¸ Ğ² Ğ´Ğ¾Ñ€Ğ¾Ğ³Ñƒ Ğ½ĞµĞ³Ğ°Ğ¹Ğ½Ğ¾.\n   > [!answer] Ğ¯Ğº Ñ‚Ñ–Ğ»ÑŒĞºĞ¸\n   > [!options] Ğ¯Ğº Ñ‚Ñ–Ğ»ÑŒĞºĞ¸ | ĞšĞ¾Ğ»Ğ¸ | ĞŸĞ¾ĞºĞ¸ | Ğ£ Ñ‚Ğ¾Ğ¹ Ñ‡Ğ°Ñ ÑĞº\n\n3. ___ Ğ¿Ğ¾Ñ‡Ğ°Ñ‚Ğ¸ Ñ€Ğ¾Ğ±Ğ¾Ñ‚Ñƒ, ÑƒĞ²Ğ°Ğ¶Ğ½Ğ¾ Ğ¿Ñ€Ğ¾Ñ‡Ğ¸Ñ‚Ğ°Ğ¹ Ñ–Ğ½ÑÑ‚Ñ€ÑƒĞºÑ†Ñ–Ñ Ğ´Ğ¾ ĞºÑ–Ğ½Ñ†Ñ.\n   > [!answer] ĞŸĞµÑ€Ñˆ Ğ½Ñ–Ğ¶\n   > [!options] ĞŸĞµÑ€Ñˆ Ğ½Ñ–Ğ¶ | ĞŸÑ–ÑĞ»Ñ Ñ‚Ğ¾Ğ³Ğ¾ ÑĞº | ĞšĞ¾Ğ»Ğ¸ | ĞŸĞ¾ĞºĞ¸\n\n4. Ğ§ĞµĞºĞ°Ğ¹ Ñ‚ÑƒÑ‚, ___ Ñ ___ Ğ¿Ğ¾Ğ²ĞµÑ€Ğ½ÑƒÑÑ Ğ· Ğ¼Ğ°Ğ³Ğ°Ğ·Ğ¸Ğ½Ñƒ.\n   > [!answer] Ğ¿Ğ¾ĞºĞ¸ Ğ½Ğµ\n   > [!options] Ğ¿Ğ¾ĞºĞ¸ Ğ½Ğµ | Ğ¿Ğ¾ĞºĞ¸ | ĞºĞ¾Ğ»Ğ¸ | ÑĞº Ñ‚Ñ–Ğ»ÑŒĞºĞ¸\n\n5. ___ Ğ¼Ğ¸ Ğ·Ğ°ĞºÑ–Ğ½Ñ‡Ğ¸Ğ»Ğ¸ Ğ¿Ñ€Ğ¾ĞµĞºÑ‚, Ğ¿Ğ¾Ñ—Ñ…Ğ°Ğ»Ğ¸ ÑĞ²ÑÑ‚ĞºÑƒĞ²Ğ°Ñ‚Ğ¸ Ñƒ Ñ€ĞµÑÑ‚Ğ¾Ñ€Ğ°Ğ½.\n   > [!answer] ĞŸÑ–ÑĞ»Ñ Ñ‚Ğ¾Ğ³Ğ¾ ÑĞº\n   > [!options] ĞŸÑ–ÑĞ»Ñ Ñ‚Ğ¾Ğ³Ğ¾ ÑĞº | ĞŸĞµÑ€Ñˆ Ğ½Ñ–Ğ¶ | ĞŸĞ¾ĞºĞ¸ | ĞšĞ¾Ğ»Ğ¸\n\n6. ___ Ğ²Ñ–Ğ½ ÑÑ‚Ğ°Ğ² Ğ´Ğ¸Ñ€ĞµĞºÑ‚Ğ¾Ñ€Ğ¾Ğ¼, Ğ½Ñ–Ñ…Ñ‚Ğ¾ Ğ½Ğµ Ğ·Ğ½Ğ°Ğ² Ğ¹Ğ¾Ğ³Ğ¾ Ñ–Ğ¼ĞµĞ½Ñ– Ğ² ĞºĞ¾Ğ¼Ğ¿Ğ°Ğ½Ñ–Ñ—.\n   > [!answer] Ğ”Ğ¾ Ñ‚Ğ¾Ğ³Ğ¾ ÑĞº\n   > [!options] Ğ”Ğ¾ Ñ‚Ğ¾Ğ³Ğ¾ ÑĞº | ĞŸÑ–ÑĞ»Ñ Ñ‚Ğ¾Ğ³Ğ¾ ÑĞº | ĞŸĞ¾ĞºĞ¸ | Ğ¯Ğº Ñ‚Ñ–Ğ»ÑŒĞºĞ¸\n\n7. ___ Ñ Ğ±Ğ°Ñ‡Ñƒ Ñ†Ğµ Ğ¼Ñ–ÑÑ†Ğµ, Ğ·Ğ³Ğ°Ğ´ÑƒÑ ÑĞ²Ğ¾Ñ” Ğ´Ğ¸Ñ‚Ğ¸Ğ½ÑÑ‚Ğ²Ğ¾ Ñ‚Ğ° Ğ±Ğ°Ñ‚ÑŒĞºÑ–Ğ².\n   > [!answer] ĞšĞ¾Ğ¶Ğ½Ğ¾Ğ³Ğ¾ Ñ€Ğ°Ğ·Ñƒ ĞºĞ¾Ğ»Ğ¸\n   > [!options] ĞšĞ¾Ğ¶Ğ½Ğ¾Ğ³Ğ¾ Ñ€Ğ°Ğ·Ñƒ ĞºĞ¾Ğ»Ğ¸ | Ğ¯Ğº Ñ‚Ñ–Ğ»ÑŒĞºĞ¸ | Ğ©Ğ¾Ğ¹Ğ½Ğ¾ | Ğ›ĞµĞ´Ğ²Ğµ\n\n8. ___ Ğ²Ğ¾Ğ½Ğ° Ğ³Ğ¾Ñ‚ÑƒĞ²Ğ°Ğ»Ğ° Ğ²ĞµÑ‡ĞµÑ€Ñ, Ğ²Ñ–Ğ½ Ñ‡Ğ¸Ñ‚Ğ°Ğ² Ğ³Ğ°Ğ·ĞµÑ‚Ñƒ Ğ½Ğ° Ğ´Ğ¸Ğ²Ğ°Ğ½Ñ–.\n   > [!answer] Ğ£ Ñ‚Ğ¾Ğ¹ Ñ‡Ğ°Ñ ÑĞº\n   > [!options] Ğ£ Ñ‚Ğ¾Ğ¹ Ñ‡Ğ°Ñ ÑĞº | ĞŸÑ–ÑĞ»Ñ Ñ‚Ğ¾Ğ³Ğ¾ ÑĞº | ĞŸĞµÑ€Ñˆ Ğ½Ñ–Ğ¶ | Ğ¯Ğº Ñ‚Ñ–Ğ»ÑŒĞºĞ¸\n\n---\n\n## true-false: ĞŸÑ€Ğ°Ğ²Ğ´Ğ° Ñ‡Ğ¸ Ğ½ĞµĞ¿Ñ€Ğ°Ğ²Ğ´Ğ°?\n\n1. Ğ¡Ğ¿Ğ¾Ğ»ÑƒÑ‡Ğ½Ğ¸Ğº Â«ĞºĞ¾Ğ»Ğ¸Â» Ğ²Ğ¸Ñ€Ğ°Ğ¶Ğ°Ñ” Ğ¾Ğ´Ğ½Ğ¾Ñ‡Ğ°ÑĞ½Ñ–ÑÑ‚ÑŒ Ğ´Ñ–Ğ¹.\n   - [x] ĞŸÑ€Ğ°Ğ²Ğ´Ğ°\n   - [ ] ĞĞµĞ¿Ñ€Ğ°Ğ²Ğ´Ğ°\n\n2. Â«ĞŸÑ–ÑĞ»Ñ Ñ‚Ğ¾Ğ³Ğ¾ ÑĞºÂ» Ğ²Ğ¸Ñ€Ğ°Ğ¶Ğ°Ñ” Ğ´Ñ–Ñ, ÑĞºĞ° Ğ²Ñ–Ğ´Ğ±ÑƒĞ²Ğ°Ñ”Ñ‚ÑŒÑÑ Ñ€Ğ°Ğ½Ñ–ÑˆĞµ Ğ·Ğ° Ğ³Ğ¾Ğ»Ğ¾Ğ²Ğ½Ñƒ.\n   - [ ] ĞŸÑ€Ğ°Ğ²Ğ´Ğ°\n   - [x] ĞĞµĞ¿Ñ€Ğ°Ğ²Ğ´Ğ°\n\n3. Â«ĞŸĞµÑ€Ñˆ Ğ½Ñ–Ğ¶Â» Ñ– Â«Ğ´Ğ¾ Ñ‚Ğ¾Ğ³Ğ¾ ÑĞºÂ» â€” Ñ†Ğµ ÑĞ¸Ğ½Ğ¾Ğ½Ñ–Ğ¼Ğ¸.\n   - [x] ĞŸÑ€Ğ°Ğ²Ğ´Ğ°\n   - [ ] ĞĞµĞ¿Ñ€Ğ°Ğ²Ğ´Ğ°\n\n4. Ğ’Ğ¸Ñ€Ğ°Ğ· Â«Ğ¿Ğ¾ĞºĞ¸ Ğ½ĞµÂ» Ğ²Ğ¸Ğ¼Ğ°Ğ³Ğ°Ñ” Ğ·Ğ°Ğ¿ĞµÑ€ĞµÑ‡ĞµĞ½Ğ½Ñ Ğ² Ğ¿Ñ–Ğ´Ñ€ÑĞ´Ğ½Ğ¾Ğ¼Ñƒ Ñ€ĞµÑ‡ĞµĞ½Ğ½Ñ–.\n   - [x] ĞŸÑ€Ğ°Ğ²Ğ´Ğ°\n   - [ ] ĞĞµĞ¿Ñ€Ğ°Ğ²Ğ´Ğ°\n\n5. Â«Ğ¯Ğº Ñ‚Ñ–Ğ»ÑŒĞºĞ¸Â» Ñ‚Ğ° Â«Ñ‰Ğ¾Ğ¹Ğ½Ğ¾Â» Ğ²Ğ¸Ñ€Ğ°Ğ¶Ğ°ÑÑ‚ÑŒ Ğ¼Ğ¸Ñ‚Ñ‚Ñ”Ğ²Ñƒ Ñ€ĞµĞ°ĞºÑ†Ñ–Ñ.\n   - [x] ĞŸÑ€Ğ°Ğ²Ğ´Ğ°\n   - [ ] ĞĞµĞ¿Ñ€Ğ°Ğ²Ğ´Ğ°\n\n6. Â«Ğ— Ñ‚Ğ¸Ñ… Ğ¿Ñ–Ñ€ ÑĞºÂ» Ğ²Ğ¸ĞºĞ¾Ñ€Ğ¸ÑÑ‚Ğ¾Ğ²ÑƒÑ”Ñ‚ÑŒÑÑ Ğ´Ğ»Ñ Ğ¾Ğ´Ğ½Ğ¾ĞºÑ€Ğ°Ñ‚Ğ½Ğ¸Ñ… Ğ¿Ğ¾Ğ´Ñ–Ğ¹.\n   - [ ] ĞŸÑ€Ğ°Ğ²Ğ´Ğ°\n   - [x] ĞĞµĞ¿Ñ€Ğ°Ğ²Ğ´Ğ°\n\n7. Â«Ğ£ Ñ‚Ğ¾Ğ¹ Ñ‡Ğ°Ñ ÑĞºÂ» Ğ¼Ğ¾Ğ¶Ğ½Ğ° Ğ·Ğ°Ğ¼Ñ–Ğ½Ğ¸Ñ‚Ğ¸ Ğ½Ğ° Â«Ğ¿Ğ¾ĞºĞ¸Â» Ğ±ĞµĞ· Ğ·Ğ¼Ñ–Ğ½Ğ¸ Ğ·Ğ½Ğ°Ñ‡ĞµĞ½Ğ½Ñ.\n   - [x] ĞŸÑ€Ğ°Ğ²Ğ´Ğ°\n   - [ ] ĞĞµĞ¿Ñ€Ğ°Ğ²Ğ´Ğ°\n\n8. Ğ¡Ğ»Ğ¾Ğ²Ğ¾ Â«Ñ‰Ğ¾Ğ¹Ğ½Ğ¾Â» Ñ” ÑƒĞ½Ñ–ĞºĞ°Ğ»ÑŒĞ½Ğ¸Ğ¼ ÑƒĞºÑ€Ğ°Ñ—Ğ½ÑÑŒĞºĞ¸Ğ¼ ÑĞ¿Ğ¾Ğ»ÑƒÑ‡Ğ½Ğ¸ĞºĞ¾Ğ¼ Ğ±ĞµĞ· Ğ¿Ñ€ÑĞ¼Ğ¾Ğ³Ğ¾ Ñ€Ğ¾ÑÑ–Ğ¹ÑÑŒĞºĞ¾Ğ³Ğ¾ ĞµĞºĞ²Ñ–Ğ²Ğ°Ğ»ĞµĞ½Ñ‚Ğ°.\n   - [x] ĞŸÑ€Ğ°Ğ²Ğ´Ğ°\n   - [ ] ĞĞµĞ¿Ñ€Ğ°Ğ²Ğ´Ğ°\n\n---\n\n## group-sort: Ğ Ğ¾Ğ·Ğ¿Ğ¾Ğ´Ñ–Ğ»Ñ–Ñ‚ÑŒ ÑĞ¿Ğ¾Ğ»ÑƒÑ‡Ğ½Ğ¸ĞºĞ¸ Ğ·Ğ° Ñ‚Ğ¸Ğ¿Ğ¾Ğ¼ Ñ‡Ğ°ÑĞ¾Ğ²Ğ¸Ñ… Ğ²Ñ–Ğ´Ğ½Ğ¾ÑˆĞµĞ½ÑŒ\n\n### ĞĞ´Ğ½Ğ¾Ñ‡Ğ°ÑĞ½Ñ–ÑÑ‚ÑŒ (Ğ¿Ğ°Ñ€Ğ°Ğ»ĞµĞ»ÑŒĞ½Ñ– Ğ´Ñ–Ñ—)\n- ĞºĞ¾Ğ»Ğ¸\n- Ñƒ Ñ‚Ğ¾Ğ¹ Ñ‡Ğ°Ñ ÑĞº\n- Ğ¿Ğ¾ĞºĞ¸\n- Ğ² Ğ¼Ñ–Ñ€Ñƒ Ñ‚Ğ¾Ğ³Ğ¾ ÑĞº\n\n### ĞŸĞ¾ÑĞ»Ñ–Ğ´Ğ¾Ğ²Ğ½Ñ–ÑÑ‚ÑŒ (Ğ¿Ñ–ÑĞ»Ñ Ñ–Ğ½ÑˆĞ¾Ñ— Ğ´Ñ–Ñ—)\n- Ğ¿Ñ–ÑĞ»Ñ Ñ‚Ğ¾Ğ³Ğ¾ ÑĞº\n- ÑĞº Ñ‚Ñ–Ğ»ÑŒĞºĞ¸\n- Ñ‰Ğ¾Ğ¹Ğ½Ğ¾\n- Ğ»ĞµĞ´Ğ²Ğµ\n- Ğ· Ñ‚Ğ¸Ñ… Ğ¿Ñ–Ñ€ ÑĞº\n\n### ĞŸĞ¾Ğ¿ĞµÑ€ĞµĞ´Ğ½Ñ–ÑÑ‚ÑŒ (Ğ´Ğ¾ Ñ–Ğ½ÑˆĞ¾Ñ— Ğ´Ñ–Ñ—)\n- Ğ¿ĞµÑ€Ñˆ Ğ½Ñ–Ğ¶\n- Ğ´Ğ¾ Ñ‚Ğ¾Ğ³Ğ¾ ÑĞº\n- Ğ¿ĞµÑ€ĞµĞ´ Ñ‚Ğ¸Ğ¼ ÑĞº\n- Ğ¿Ğ¾ĞºĞ¸ Ğ½Ğµ\n- Ğ´Ğ¾ĞºĞ¸ Ğ½Ğµ\n\n---\n\n## unjumble: Ğ¡ĞºĞ»Ğ°Ğ´Ñ–Ñ‚ÑŒ Ñ€ĞµÑ‡ĞµĞ½Ğ½Ñ Ğ· Ñ€Ğ¾Ğ·ÑĞ¸Ğ¿Ğ°Ğ½Ğ¸Ñ… ÑĞ»Ñ–Ğ²\n\n1. ĞºĞ¾Ğ»Ğ¸ / Ğ²Ñ–Ğ½ / Ğ¿Ñ€Ğ¸Ğ¹ÑˆĞ¾Ğ² / Ğ´Ğ¾Ğ´Ğ¾Ğ¼Ñƒ / , / Ğ¼Ğ¸ / Ğ²Ğ¶Ğµ / Ğ²ĞµÑ‡ĞµÑ€ÑĞ»Ğ¸ / Ñ€Ğ°Ğ·Ğ¾Ğ¼ / ÑƒÑÑ–Ñ”Ñ / ÑÑ–Ğ¼'Ñ”Ñ\n   > [!answer] ĞšĞ¾Ğ»Ğ¸ Ğ²Ñ–Ğ½ Ğ¿Ñ€Ğ¸Ğ¹ÑˆĞ¾Ğ² Ğ´Ğ¾Ğ´Ğ¾Ğ¼Ñƒ, Ğ¼Ğ¸ Ğ²Ğ¶Ğµ Ğ²ĞµÑ‡ĞµÑ€ÑĞ»Ğ¸ Ñ€Ğ°Ğ·Ğ¾Ğ¼ ÑƒÑÑ–Ñ”Ñ ÑÑ–Ğ¼'Ñ”Ñ.\n\n2. Ğ¿Ñ–ÑĞ»Ñ / Ñ‚Ğ¾Ğ³Ğ¾ / ÑĞº / Ğ²Ğ¾Ğ½Ğ° / Ğ·Ğ°ĞºÑ–Ğ½Ñ‡Ğ¸Ğ»Ğ° / ÑƒĞ½Ñ–Ğ²ĞµÑ€ÑĞ¸Ñ‚ĞµÑ‚ / , / Ğ¿Ğ¾Ñ‡Ğ°Ğ»Ğ° / Ğ¿Ñ€Ğ°Ñ†ÑĞ²Ğ°Ñ‚Ğ¸ / Ğ² / Ğ²ĞµĞ»Ğ¸ĞºÑ–Ğ¹ / ĞºĞ¾Ğ¼Ğ¿Ğ°Ğ½Ñ–Ñ—\n   > [!answer] ĞŸÑ–ÑĞ»Ñ Ñ‚Ğ¾Ğ³Ğ¾ ÑĞº Ğ²Ğ¾Ğ½Ğ° Ğ·Ğ°ĞºÑ–Ğ½Ñ‡Ğ¸Ğ»Ğ° ÑƒĞ½Ñ–Ğ²ĞµÑ€ÑĞ¸Ñ‚ĞµÑ‚, Ğ¿Ğ¾Ñ‡Ğ°Ğ»Ğ° Ğ¿Ñ€Ğ°Ñ†ÑĞ²Ğ°Ñ‚Ğ¸ Ğ² Ğ²ĞµĞ»Ğ¸ĞºÑ–Ğ¹ ĞºĞ¾Ğ¼Ğ¿Ğ°Ğ½Ñ–Ñ—.\n\n3. Ğ¿ĞµÑ€Ñˆ / Ğ½Ñ–Ğ¶ / Ğ¿Ñ–Ñ‚Ğ¸ / Ğ½Ğ° / Ğ²Ğ°Ğ¶Ğ»Ğ¸Ğ²Ñƒ / Ğ·ÑƒÑÑ‚Ñ€Ñ–Ñ‡ / , / Ğ²Ñ–Ğ½ / Ñ€ĞµÑ‚ĞµĞ»ÑŒĞ½Ğ¾ / Ğ¿Ñ–Ğ´Ğ³Ğ¾Ñ‚ÑƒĞ²Ğ°Ğ²ÑÑ / Ğ´Ğ¾ / Ğ½ĞµÑ—\n   > [!answer] ĞŸĞµÑ€Ñˆ Ğ½Ñ–Ğ¶ Ğ¿Ñ–Ñ‚Ğ¸ Ğ½Ğ° Ğ²Ğ°Ğ¶Ğ»Ğ¸Ğ²Ñƒ Ğ·ÑƒÑÑ‚Ñ€Ñ–Ñ‡, Ğ²Ñ–Ğ½ Ñ€ĞµÑ‚ĞµĞ»ÑŒĞ½Ğ¾ Ğ¿Ñ–Ğ´Ğ³Ğ¾Ñ‚ÑƒĞ²Ğ°Ğ²ÑÑ Ğ´Ğ¾ Ğ½ĞµÑ—.\n\n4. ÑĞº / Ñ‚Ñ–Ğ»ÑŒĞºĞ¸ / Ğ¿Ğ¾Ñ‡ÑƒĞ²ÑÑ / Ğ³ÑƒÑ‡Ğ½Ğ¸Ğ¹ / Ğ´Ğ·Ğ²Ñ–Ğ½Ğ¾Ğº / Ğ±ÑƒĞ´Ğ¸Ğ»ÑŒĞ½Ğ¸ĞºĞ° / , / Ğ²Ñ–Ğ½ / Ğ¼Ğ¸Ñ‚Ñ‚Ñ”Ğ²Ğ¾ / Ğ¿Ñ€Ğ¾ĞºĞ¸Ğ½ÑƒĞ²ÑÑ / Ñ– / Ğ²ÑÑ‚Ğ°Ğ²\n   > [!answer] Ğ¯Ğº Ñ‚Ñ–Ğ»ÑŒĞºĞ¸ Ğ¿Ğ¾Ñ‡ÑƒĞ²ÑÑ Ğ³ÑƒÑ‡Ğ½Ğ¸Ğ¹ Ğ´Ğ·Ğ²Ñ–Ğ½Ğ¾Ğº Ğ±ÑƒĞ´Ğ¸Ğ»ÑŒĞ½Ğ¸ĞºĞ°, Ğ²Ñ–Ğ½ Ğ¼Ğ¸Ñ‚Ñ‚Ñ”Ğ²Ğ¾ Ğ¿Ñ€Ğ¾ĞºĞ¸Ğ½ÑƒĞ²ÑÑ Ñ– Ğ²ÑÑ‚Ğ°Ğ².\n\n5. Ğ¿Ğ¾ĞºĞ¸ / Ğ¼Ğ¸ / Ñ‡ĞµĞºĞ°Ğ»Ğ¸ / Ğ½Ğ° / Ğ¿Ğ¾Ñ‚ÑĞ³ / Ğ´Ğ¾ / Ğ›ÑŒĞ²Ğ¾Ğ²Ğ° / , / Ğ²Ğ¸Ñ€Ñ–ÑˆĞ¸Ğ»Ğ¸ / Ğ²Ğ¸Ğ¿Ğ¸Ñ‚Ğ¸ / ĞºĞ°Ğ²Ñƒ / Ğ² / ĞºĞ°Ğ²'ÑÑ€Ğ½Ñ–\n   > [!answer] ĞŸĞ¾ĞºĞ¸ Ğ¼Ğ¸ Ñ‡ĞµĞºĞ°Ğ»Ğ¸ Ğ½Ğ° Ğ¿Ğ¾Ñ‚ÑĞ³ Ğ´Ğ¾ Ğ›ÑŒĞ²Ğ¾Ğ²Ğ°, Ğ²Ğ¸Ñ€Ñ–ÑˆĞ¸Ğ»Ğ¸ Ğ²Ğ¸Ğ¿Ğ¸Ñ‚Ğ¸ ĞºĞ°Ğ²Ñƒ Ğ² ĞºĞ°Ğ²'ÑÑ€Ğ½Ñ–.\n\n6. ĞºĞ¾Ğ¶Ğ½Ğ¾Ğ³Ğ¾ / Ñ€Ğ°Ğ·Ñƒ / ĞºĞ¾Ğ»Ğ¸ / Ñ / Ğ¿Ñ€Ğ¸Ñ—Ğ¶Ğ´Ğ¶Ğ°Ñ / Ğ´Ğ¾ / Ñ€Ñ–Ğ´Ğ½Ğ¾Ğ³Ğ¾ / Ğ¼Ñ–ÑÑ‚Ğ° / , / Ğ²Ñ–Ğ´Ğ²Ñ–Ğ´ÑƒÑ / Ğ±Ğ°Ñ‚ÑŒĞºÑ–Ğ²ÑÑŒĞºĞ¸Ğ¹ / Ğ´Ñ–Ğ¼\n   > [!answer] ĞšĞ¾Ğ¶Ğ½Ğ¾Ğ³Ğ¾ Ñ€Ğ°Ğ·Ñƒ ĞºĞ¾Ğ»Ğ¸ Ñ Ğ¿Ñ€Ğ¸Ñ—Ğ¶Ğ´Ğ¶Ğ°Ñ Ğ´Ğ¾ Ñ€Ñ–Ğ´Ğ½Ğ¾Ğ³Ğ¾ Ğ¼Ñ–ÑÑ‚Ğ°, Ğ²Ñ–Ğ´Ğ²Ñ–Ğ´ÑƒÑ Ğ±Ğ°Ñ‚ÑŒĞºÑ–Ğ²ÑÑŒĞºĞ¸Ğ¹ Ğ´Ñ–Ğ¼.\n\n---\n\n## error-correction: Ğ—Ğ½Ğ°Ğ¹Ğ´Ñ–Ñ‚ÑŒ Ñ– Ğ²Ğ¸Ğ¿Ñ€Ğ°Ğ²Ñ‚Ğµ Ğ¿Ğ¾Ğ¼Ğ¸Ğ»ĞºÑƒ\n\n1. Ğ§ĞµĞºĞ°Ğ¹ Ñ‚ÑƒÑ‚, Ğ¿Ğ¾ĞºĞ¸ Ñ Ğ¿Ñ€Ğ¸Ğ¹Ğ´Ñƒ Ğ· Ğ¼Ğ°Ğ³Ğ°Ğ·Ğ¸Ğ½Ñƒ Ğ´Ğ¾Ğ´Ğ¾Ğ¼Ñƒ.\n   > [!error] Ğ¿Ñ€Ğ¸Ğ¹Ğ´Ñƒ\n   > [!answer] Ğ½Ğµ Ğ¿Ñ€Ğ¸Ğ¹Ğ´Ñƒ\n   > [!options] Ğ½Ğµ Ğ¿Ñ€Ğ¸Ğ¹Ğ´Ñƒ | Ğ¿Ñ€Ğ¸Ñ…Ğ¾Ğ´Ğ¶Ñƒ | Ğ¿Ñ€Ğ¸Ñ…Ğ¾Ğ´Ğ¸Ğ² | Ğ¿Ñ€Ğ¸Ğ¹ÑˆĞ¾Ğ²\n   > [!explanation] Â«ĞŸĞ¾ĞºĞ¸ Ğ½ĞµÂ» Ğ²Ğ¸Ğ¼Ğ°Ğ³Ğ°Ñ” Ğ·Ğ°Ğ¿ĞµÑ€ĞµÑ‡ĞµĞ½Ğ½Ñ.\n\n2. ĞŸÑ–ÑĞ»Ñ Ñ‚Ğ¾Ğ³Ğ¾ ÑĞº Ğ²Ñ–Ğ½ Ğ¿Ñ–ÑˆĞ¾Ğ², Ğ¼Ğ¸ Ğ³Ğ¾Ğ²Ğ¾Ñ€Ğ¸Ğ»Ğ¸ Ğ²Ğ¶Ğµ Ğ¿Ñ€Ğ¾ Ñ†Ğµ.\n   > [!error] Ğ³Ğ¾Ğ²Ğ¾Ñ€Ğ¸Ğ»Ğ¸\n   > [!answer] Ğ¿Ñ€Ğ¾Ğ´Ğ¾Ğ²Ğ¶Ğ¸Ğ»Ğ¸ Ğ³Ğ¾Ğ²Ğ¾Ñ€Ğ¸Ñ‚Ğ¸\n   > [!options] Ğ¿Ñ€Ğ¾Ğ´Ğ¾Ğ²Ğ¶Ğ¸Ğ»Ğ¸ Ğ³Ğ¾Ğ²Ğ¾Ñ€Ğ¸Ñ‚Ğ¸ | Ğ³Ğ¾Ğ²Ğ¾Ñ€Ğ¸Ğ¼Ğ¾ | Ğ±ÑƒĞ´ĞµĞ¼Ğ¾ Ğ³Ğ¾Ğ²Ğ¾Ñ€Ğ¸Ñ‚Ğ¸ | Ğ¿Ğ¾Ñ‡Ğ°Ğ»Ğ¸ Ğ³Ğ¾Ğ²Ğ¾Ñ€Ğ¸Ñ‚Ğ¸\n   > [!explanation] Â«ĞŸÑ–ÑĞ»Ñ Ñ‚Ğ¾Ğ³Ğ¾ ÑĞºÂ» Ğ²ĞºĞ°Ğ·ÑƒÑ” Ğ½Ğ° Ğ¿Ğ¾ÑĞ»Ñ–Ğ´Ğ¾Ğ²Ğ½Ñ–ÑÑ‚ÑŒ, Ñ‚Ğ¾Ğ¼Ñƒ Ğ¿Ğ¾Ñ‚Ñ€Ñ–Ğ±ĞµĞ½ Ñ€ĞµĞ·ÑƒĞ»ÑŒÑ‚Ğ°Ñ‚.\n\n3. ĞŸĞµÑ€Ñˆ Ğ½Ñ–Ğ¶ Ğ²Ñ–Ğ½ Ğ¿Ñ–ÑˆĞ¾Ğ², Ğ¼Ğ¸ Ğ¿Ñ€Ğ¾Ğ´Ğ¾Ğ²Ğ¶Ğ¸Ğ»Ğ¸ Ñ€Ğ¾Ğ·Ğ¼Ğ¾Ğ²Ñƒ Ğ´Ğ°Ğ»Ñ–.\n   > [!error] ĞŸĞµÑ€Ñˆ Ğ½Ñ–Ğ¶\n   > [!answer] ĞŸÑ–ÑĞ»Ñ Ñ‚Ğ¾Ğ³Ğ¾ ÑĞº\n   > [!options] ĞŸÑ–ÑĞ»Ñ Ñ‚Ğ¾Ğ³Ğ¾ ÑĞº | ĞšĞ¾Ğ»Ğ¸ | Ğ¯Ğº Ñ‚Ñ–Ğ»ÑŒĞºĞ¸ | ĞŸĞ¾ĞºĞ¸\n   > [!explanation] Â«ĞŸÑ€Ğ¾Ğ´Ğ¾Ğ²Ğ¶Ğ¸Ğ»Ğ¸Â» Ğ²ĞºĞ°Ğ·ÑƒÑ” Ğ½Ğ° Ğ¿Ğ¾ÑĞ»Ñ–Ğ´Ğ¾Ğ²Ğ½Ñ–ÑÑ‚ÑŒ Ğ¿Ñ–ÑĞ»Ñ Ñ–Ğ½ÑˆĞ¾Ñ— Ğ´Ñ–Ñ—.\n\n4. Ğ¯Ğº Ñ‚Ñ–Ğ»ÑŒĞºĞ¸ Ğ²Ñ–Ğ½ Ğ¿Ğ¾ÑÑ‚ÑƒĞ¿Ğ¾Ğ²Ğ¾ ÑÑ‚Ğ°Ğ²Ğ°Ğ² ĞºÑ€Ğ°Ñ‰Ğ¸Ğ¼, Ğ¼Ğ¸ Ñ€Ğ°Ğ´Ñ–Ñ‚Ğ¸.\n   > [!error] Ğ¯Ğº Ñ‚Ñ–Ğ»ÑŒĞºĞ¸\n   > [!answer] Ğ’ Ğ¼Ñ–Ñ€Ñƒ Ñ‚Ğ¾Ğ³Ğ¾ ÑĞº\n   > [!options] Ğ’ Ğ¼Ñ–Ñ€Ñƒ Ñ‚Ğ¾Ğ³Ğ¾ ÑĞº | ĞŸĞ¾ĞºĞ¸ | ĞšĞ¾Ğ»Ğ¸ | ĞŸÑ–ÑĞ»Ñ Ñ‚Ğ¾Ğ³Ğ¾ ÑĞº\n   > [!explanation] Â«ĞŸĞ¾ÑÑ‚ÑƒĞ¿Ğ¾Ğ²Ğ¾Â» Ğ²Ğ¸Ğ¼Ğ°Ğ³Ğ°Ñ” Â«Ğ² Ğ¼Ñ–Ñ€Ñƒ Ñ‚Ğ¾Ğ³Ğ¾ ÑĞºÂ», Ğ° Ğ½Ğµ Ğ¼Ğ¸Ñ‚Ñ‚Ñ”Ğ²Ğ¾Ğ³Ğ¾ Â«ÑĞº Ñ‚Ñ–Ğ»ÑŒĞºĞ¸Â».\n\n5. ĞšĞ¾Ğ»Ğ¸ Ğ²Ğ¾Ğ½Ğ° Ğ·Ğ°ĞºÑ–Ğ½Ñ‡Ğ¸Ğ»Ğ° ÑˆĞºĞ¾Ğ»Ñƒ, Ğ²Ñ‡Ğ¸Ğ»Ğ°ÑÑ Ñ‚Ğ°Ğ¼ Ğ´Ğ²Ğ°Ğ½Ğ°Ğ´Ñ†ÑÑ‚ÑŒ Ñ€Ğ¾ĞºÑ–Ğ².\n   > [!error] ĞšĞ¾Ğ»Ğ¸ Ğ²Ğ¾Ğ½Ğ° Ğ·Ğ°ĞºÑ–Ğ½Ñ‡Ğ¸Ğ»Ğ°\n   > [!answer] Ğ”Ğ¾ Ñ‚Ğ¾Ğ³Ğ¾ ÑĞº Ğ²Ğ¾Ğ½Ğ° Ğ·Ğ°ĞºÑ–Ğ½Ñ‡Ğ¸Ğ»Ğ°\n   > [!options] Ğ”Ğ¾ Ñ‚Ğ¾Ğ³Ğ¾ ÑĞº Ğ²Ğ¾Ğ½Ğ° Ğ·Ğ°ĞºÑ–Ğ½Ñ‡Ğ¸Ğ»Ğ° | ĞŸÑ–ÑĞ»Ñ Ñ‚Ğ¾Ğ³Ğ¾ ÑĞº | ĞŸĞ¾ĞºĞ¸ | Ğ¯Ğº Ñ‚Ñ–Ğ»ÑŒĞºĞ¸\n   > [!explanation] 12 Ñ€Ğ¾ĞºÑ–Ğ² Ğ½Ğ°Ğ²Ñ‡Ğ°Ğ½Ğ½Ñ â€” Ñ†Ğµ Ğ¿ĞµÑ€Ñ–Ğ¾Ğ´ Ğ”Ğ Ğ·Ğ°ĞºÑ–Ğ½Ñ‡ĞµĞ½Ğ½Ñ.\n\n6. Ğ©Ğ¾Ğ¹Ğ½Ğ¾ Ğ²Ñ–Ğ½ Ğ²Ñ…Ğ¾Ğ´Ğ¸Ğ², Ğ¿Ğ¾Ñ‡Ğ°Ğ²ÑÑ Ğ³ÑƒÑ‡Ğ½Ğ¸Ğ¹ Ğ´Ğ¾Ñ‰ Ğ½Ğ° Ğ²ÑƒĞ»Ğ¸Ñ†Ñ–.\n   > [!error] Ğ²Ñ…Ğ¾Ğ´Ğ¸Ğ²\n   > [!answer] ÑƒĞ²Ñ–Ğ¹ÑˆĞ¾Ğ²\n   > [!options] ÑƒĞ²Ñ–Ğ¹ÑˆĞ¾Ğ² | Ğ²Ñ…Ğ¾Ğ´Ğ¸Ñ‚ÑŒ | Ğ±ÑƒĞ´Ğµ Ğ²Ñ…Ğ¾Ğ´Ğ¸Ñ‚Ğ¸ | Ğ²Ñ…Ğ¾Ğ´ÑÑ‡Ğ¸\n   > [!explanation] Â«Ğ©Ğ¾Ğ¹Ğ½Ğ¾Â» Ğ²Ğ¸Ğ¼Ğ°Ğ³Ğ°Ñ” Ğ´Ğ¾ĞºĞ¾Ğ½Ğ°Ğ½Ğ¾Ğ³Ğ¾ Ğ²Ğ¸Ğ´Ñƒ Ğ´Ğ»Ñ Ğ²Ğ¸Ñ€Ğ°Ğ¶ĞµĞ½Ğ½Ñ Ğ¼Ğ¸Ñ‚Ñ‚Ñ”Ğ²Ğ¾ÑÑ‚Ñ–.\n\n---\n\n## cloze: Ğ—Ğ°Ğ¿Ğ¾Ğ²Ğ½Ñ–Ñ‚ÑŒ Ğ¿Ñ€Ğ¾Ğ¿ÑƒÑĞºĞ¸ Ğ² Ñ‚ĞµĞºÑÑ‚Ñ–\n\nĞœĞ¸Ğ½ÑƒĞ»Ğ¾Ğ³Ğ¾ Ğ»Ñ–Ñ‚Ğ° Ñ Ğ²Ğ¸Ñ€Ñ–ÑˆĞ¸Ğ² Ğ¿Ğ¾Ğ´Ğ¾Ñ€Ğ¾Ğ¶ÑƒĞ²Ğ°Ñ‚Ğ¸ Ğ£ĞºÑ€Ğ°Ñ—Ğ½Ğ¾Ñ. (1)___ Ñ Ğ¿Ñ€Ğ¸Ñ—Ñ…Ğ°Ğ² Ğ´Ğ¾ Ğ›ÑŒĞ²Ğ¾Ğ²Ğ°, Ğ¾Ğ´Ñ€Ğ°Ğ·Ñƒ Ğ¿Ñ–ÑˆĞ¾Ğ² Ğ´Ğ¾ ÑÑ‚Ğ°Ñ€Ğ¾Ğ³Ğ¾ Ğ¼Ñ–ÑÑ‚Ğ°. (2)___ Ñ Ğ³ÑƒĞ»ÑĞ² Ñ†ĞµĞ½Ñ‚Ñ€Ğ¾Ğ¼, Ñ„Ğ¾Ñ‚Ğ¾Ğ³Ñ€Ğ°Ñ„ÑƒĞ²Ğ°Ğ² ĞºĞ¾Ğ¶Ğ½Ñƒ Ğ±ÑƒĞ´Ñ–Ğ²Ğ»Ñ. (3)___ Ğ¾Ğ±Ñ–Ğ¹ÑˆĞ¾Ğ² ÑƒĞ²ĞµÑÑŒ Ñ†ĞµĞ½Ñ‚Ñ€, Ğ·Ğ°Ğ¹ÑˆĞ¾Ğ² Ñƒ ĞºĞ°Ğ²'ÑÑ€Ğ½Ñ.\n\n(4)___ Ñ Ğ¿Ğ¸Ğ² ĞºĞ°Ğ²Ñƒ, Ğ¿Ğ¾Ğ·Ğ½Ğ°Ğ¹Ğ¾Ğ¼Ğ¸Ğ²ÑÑ Ğ· Ñ†Ñ–ĞºĞ°Ğ²Ğ¾Ñ Ğ»ÑĞ´Ğ¸Ğ½Ğ¾Ñ. (5)___ Ğ¼Ğ¸ Ğ¿Ğ¾Ñ‡Ğ°Ğ»Ğ¸ Ñ€Ğ¾Ğ·Ğ¼Ğ¾Ğ²Ğ»ÑÑ‚Ğ¸, Ñ‡Ğ°Ñ Ğ¼Ğ¸Ğ½ÑƒĞ² Ğ½ĞµĞ¿Ğ¾Ğ¼Ñ–Ñ‚Ğ½Ğ¾. (6)___ Ğ¿Ğ¾Ğ¿Ñ€Ğ¾Ñ‰Ğ°Ñ‚Ğ¸ÑÑ, Ğ¼Ğ¸ Ğ¾Ğ±Ğ¼Ñ–Ğ½ÑĞ»Ğ¸ÑÑ ĞºĞ¾Ğ½Ñ‚Ğ°ĞºÑ‚Ğ°Ğ¼Ğ¸.\n\n(7)___ Ñ Ğ¿Ñ€Ğ¸Ñ—Ñ…Ğ°Ğ² Ğ´Ğ¾Ğ´Ğ¾Ğ¼Ñƒ, Ñ‡Ğ°ÑÑ‚Ğ¾ Ğ·Ğ³Ğ°Ğ´ÑƒÑ Ñ‚Ñƒ Ğ¿Ğ¾Ğ´Ğ¾Ñ€Ğ¾Ğ¶. (8)___ Ñ Ğ±Ğ°Ñ‡Ñƒ Ñ„Ğ¾Ñ‚Ğ¾Ğ³Ñ€Ğ°Ñ„Ñ–Ñ—, Ğ·Ğ½Ğ¾Ğ²Ñƒ Ğ²Ñ–Ğ´Ñ‡ÑƒĞ²Ğ°Ñ Ñ‚Ñƒ Ğ°Ñ‚Ğ¼Ğ¾ÑÑ„ĞµÑ€Ñƒ. (9)___ Ğ½Ğµ Ğ¿Ğ¾Ñ—Ğ´Ñƒ Ñ‚ÑƒĞ´Ğ¸ Ğ·Ğ½Ğ¾Ğ²Ñƒ, Ğ±ÑƒĞ´Ñƒ Ğ¼Ñ€Ñ–ÑÑ‚Ğ¸ Ğ¿Ñ€Ğ¾ Ñ†Ğµ Ğ¼Ñ–ÑÑ‚Ğ¾.\n\n(10)___ Ğ½Ğ°ÑÑ‚Ğ°Ğ½Ğµ Ğ½Ğ°ÑÑ‚ÑƒĞ¿Ğ½Ğµ Ğ»Ñ–Ñ‚Ğ¾, Ğ¾Ğ±Ğ¾Ğ²'ÑĞ·ĞºĞ¾Ğ²Ğ¾ Ğ¿Ğ¾Ğ²ĞµÑ€Ğ½ÑƒÑÑ. (11)___ Ğ¿Ğ¾Ğ±Ğ°Ñ‡Ñƒ Ğ·Ğ½Ğ°Ğ¹Ğ¾Ğ¼Ñ– Ğ²ÑƒĞ»Ğ¸Ñ†Ñ–, Ğ²Ñ–Ğ´Ñ‡ÑƒÑ Ñ‰Ğ°ÑÑ‚Ñ. (12)___ Ğ¿Ğ¾Ñ‡Ğ½Ñƒ Ğ¿Ğ¾Ğ´Ğ¾Ñ€Ğ¾Ğ¶, Ñ€ĞµÑ‚ĞµĞ»ÑŒĞ½Ğ¾ ÑĞ¿Ğ»Ğ°Ğ½ÑƒÑÑ Ğ¼Ğ°Ñ€ÑˆÑ€ÑƒÑ‚. (13)___ Ğ²ÑĞµ Ğ±ÑƒĞ´Ğµ Ğ³Ğ¾Ñ‚Ğ¾Ğ²Ğ¾, Ğ²Ğ¸Ñ€ÑƒÑˆÑƒ Ğ² Ğ´Ğ¾Ñ€Ğ¾Ğ³Ñƒ. (14)___ Ğ¿Ğ¾Ğ´Ğ¾Ñ€Ğ¾Ğ¶ÑƒÑ, Ğ·Ğ°Ğ²Ğ¶Ğ´Ğ¸ Ğ²Ñ–Ğ´ĞºÑ€Ğ¸Ğ²Ğ°Ñ Ğ´Ğ»Ñ ÑĞµĞ±Ğµ Ğ½Ğ¾Ğ²Ğµ.\n\n- (1) :: Ğ¯Ğº Ñ‚Ñ–Ğ»ÑŒĞºĞ¸ | ĞŸĞ¾ĞºĞ¸ | ĞŸĞµÑ€Ñˆ Ğ½Ñ–Ğ¶ | ĞšĞ¾Ğ»Ğ¸\n- (2) :: ĞŸĞ¾ĞºĞ¸ | ĞŸÑ–ÑĞ»Ñ Ñ‚Ğ¾Ğ³Ğ¾ ÑĞº | ĞŸĞµÑ€Ñˆ Ğ½Ñ–Ğ¶ | Ğ”Ğ¾ Ñ‚Ğ¾Ğ³Ğ¾ ÑĞº\n- (3) :: ĞŸÑ–ÑĞ»Ñ Ñ‚Ğ¾Ğ³Ğ¾ ÑĞº | ĞŸĞ¾ĞºĞ¸ | ĞšĞ¾Ğ»Ğ¸ | Ğ”Ğ¾ Ñ‚Ğ¾Ğ³Ğ¾ ÑĞº\n- (4) :: ĞŸĞ¾ĞºĞ¸ | ĞŸÑ–ÑĞ»Ñ Ñ‚Ğ¾Ğ³Ğ¾ ÑĞº | ĞŸĞµÑ€Ñˆ Ğ½Ñ–Ğ¶ | Ğ¯Ğº Ñ‚Ñ–Ğ»ÑŒĞºĞ¸\n- (5) :: Ğ¯Ğº Ñ‚Ñ–Ğ»ÑŒĞºĞ¸ | ĞŸĞ¾ĞºĞ¸ Ğ½Ğµ | ĞŸĞµÑ€Ñˆ Ğ½Ñ–Ğ¶ | Ğ”Ğ¾ Ñ‚Ğ¾Ğ³Ğ¾ ÑĞº\n- (6) :: ĞŸĞµÑ€Ñˆ Ğ½Ñ–Ğ¶ | ĞŸÑ–ÑĞ»Ñ Ñ‚Ğ¾Ğ³Ğ¾ ÑĞº | ĞŸĞ¾ĞºĞ¸ | Ğ¯Ğº Ñ‚Ñ–Ğ»ÑŒĞºĞ¸\n- (7) :: Ğ— Ñ‚Ğ¸Ñ… Ğ¿Ñ–Ñ€ ÑĞº | ĞŸĞµÑ€Ñˆ Ğ½Ñ–Ğ¶ | Ğ”Ğ¾ Ñ‚Ğ¾Ğ³Ğ¾ ÑĞº | Ğ¯Ğº Ñ‚Ñ–Ğ»ÑŒĞºĞ¸\n- (8) :: ĞšĞ¾Ğ¶Ğ½Ğ¾Ğ³Ğ¾ Ñ€Ğ°Ğ·Ñƒ ĞºĞ¾Ğ»Ğ¸ | ĞŸÑ–ÑĞ»Ñ Ñ‚Ğ¾Ğ³Ğ¾ ÑĞº | ĞŸĞµÑ€Ñˆ Ğ½Ñ–Ğ¶ | ĞŸĞ¾ĞºĞ¸\n- (9) :: ĞŸĞ¾ĞºĞ¸ | ĞŸĞ¾ĞºĞ¸ Ğ½Ğµ | Ğ¯Ğº Ñ‚Ñ–Ğ»ÑŒĞºĞ¸ | ĞšĞ¾Ğ»Ğ¸\n- (10) :: Ğ¯Ğº Ñ‚Ñ–Ğ»ÑŒĞºĞ¸ | ĞŸĞ¾ĞºĞ¸ | ĞŸĞµÑ€Ñˆ Ğ½Ñ–Ğ¶ | Ğ”Ğ¾ Ñ‚Ğ¾Ğ³Ğ¾ ÑĞº\n- (11) :: Ğ¯Ğº Ñ‚Ñ–Ğ»ÑŒĞºĞ¸ | ĞŸĞ¾ĞºĞ¸ | ĞŸĞµÑ€Ñˆ Ğ½Ñ–Ğ¶ | ĞŸÑ–ÑĞ»Ñ Ñ‚Ğ¾Ğ³Ğ¾ ÑĞº\n- (12) :: ĞŸĞµÑ€Ñˆ Ğ½Ñ–Ğ¶ | ĞŸÑ–ÑĞ»Ñ Ñ‚Ğ¾Ğ³Ğ¾ ÑĞº | ĞŸĞ¾ĞºĞ¸ | Ğ¯Ğº Ñ‚Ñ–Ğ»ÑŒĞºĞ¸\n- (13) :: Ğ¯Ğº Ñ‚Ñ–Ğ»ÑŒĞºĞ¸ | ĞŸĞ¾ĞºĞ¸ | ĞŸĞµÑ€Ñˆ Ğ½Ñ–Ğ¶ | Ğ”Ğ¾ Ñ‚Ğ¾Ğ³Ğ¾ ÑĞº\n- (14) :: ĞšĞ¾Ğ¶Ğ½Ğ¾Ğ³Ğ¾ Ñ€Ğ°Ğ·Ñƒ ĞºĞ¾Ğ»Ğ¸ | ĞŸÑ–ÑĞ»Ñ Ñ‚Ğ¾Ğ³Ğ¾ ÑĞº | ĞŸĞµÑ€Ñˆ Ğ½Ñ–Ğ¶ | Ğ¯Ğº Ñ‚Ñ–Ğ»ÑŒĞºĞ¸\n\n---\n\n## mark-the-words: ĞŸĞ¾Ğ·Ğ½Ğ°Ñ‡Ñ‚Ğµ Ñ‡Ğ°ÑĞ¾Ğ²Ñ– ÑĞ¿Ğ¾Ğ»ÑƒÑ‡Ğ½Ğ¸ĞºĞ¸\n\n[ĞšĞ¾Ğ»Ğ¸] Ğ²Ñ–Ğ½ Ğ¿Ñ€Ğ¸Ğ¹ÑˆĞ¾Ğ², Ğ¼Ğ¸ Ğ¾Ğ±Ñ–Ğ´Ğ°Ğ»Ğ¸. [ĞŸÑ–ÑĞ»Ñ Ñ‚Ğ¾Ğ³Ğ¾ ÑĞº] Ğ·Ğ°ĞºÑ–Ğ½Ñ‡Ğ¸Ğ»Ğ¸, Ğ¿Ñ–ÑˆĞ»Ğ¸ Ğ½Ğ° Ğ¿Ñ€Ğ¾Ğ³ÑƒĞ»ÑĞ½ĞºÑƒ. [ĞŸĞ¾ĞºĞ¸] Ğ³ÑƒĞ»ÑĞ»Ğ¸, Ñ€Ğ¾Ğ·Ğ¼Ğ¾Ğ²Ğ»ÑĞ»Ğ¸. [ĞŸĞµÑ€Ñˆ Ğ½Ñ–Ğ¶] Ğ¿Ğ¾Ğ²ĞµÑ€Ğ½ÑƒÑ‚Ğ¸ÑÑ, ĞºÑƒĞ¿Ğ¸Ğ»Ğ¸ Ğ¼Ğ¾Ñ€Ğ¾Ğ·Ğ¸Ğ²Ğ¾. [Ğ¯Ğº Ñ‚Ñ–Ğ»ÑŒĞºĞ¸] Ğ¿Ñ€Ğ¸Ğ¹ÑˆĞ»Ğ¸ Ğ´Ğ¾Ğ´Ğ¾Ğ¼Ñƒ, ÑƒĞ²Ñ–Ğ¼ĞºĞ½ÑƒĞ»Ğ¸ Ñ‚ĞµĞ»ĞµĞ²Ñ–Ğ·Ğ¾Ñ€. [ĞšĞ¾Ğ¶Ğ½Ğ¾Ğ³Ğ¾ Ñ€Ğ°Ğ·Ñƒ ĞºĞ¾Ğ»Ğ¸] Ğ´Ğ¸Ğ²Ğ¸Ğ¼Ğ¾ÑÑ Ñ†ĞµĞ¹ ÑĞµÑ€Ñ–Ğ°Ğ», ÑĞ¼Ñ–Ñ”Ğ¼Ğ¾ÑÑ. [Ğ— Ñ‚Ğ¸Ñ… Ğ¿Ñ–Ñ€ ÑĞº] Ğ¿Ğ¾Ñ‡Ğ°Ğ»Ğ¸ Ğ´Ğ¸Ğ²Ğ¸Ñ‚Ğ¸ÑÑ, Ğ½Ğµ Ğ¼Ğ¾Ğ¶ĞµĞ¼Ğ¾ Ğ·ÑƒĞ¿Ğ¸Ğ½Ğ¸Ñ‚Ğ¸ÑÑ. [Ğ”Ğ¾ Ñ‚Ğ¾Ğ³Ğ¾ ÑĞº] Ğ¿Ğ¾Ñ‡Ğ°Ğ»Ğ¸, Ğ½Ğµ Ğ·Ğ½Ğ°Ğ»Ğ¸, Ñ‰Ğ¾ Ğ²Ñ–Ğ½ Ñ‚Ğ°ĞºĞ¸Ğ¹ Ñ†Ñ–ĞºĞ°Ğ²Ğ¸Ğ¹.\n\n---\n\n## dialogue-reorder: Ğ’Ğ¿Ğ¾Ñ€ÑĞ´ĞºÑƒĞ¹Ñ‚Ğµ Ğ´Ñ–Ğ°Ğ»Ğ¾Ğ³\n\n- Ğ¯Ğº Ñ‚Ñ–Ğ»ÑŒĞºĞ¸ Ğ·Ğ°ĞºÑ–Ğ½Ñ‡Ñƒ Ñ†ĞµĞ¹ Ğ¿Ñ€Ğ¾ĞµĞºÑ‚, Ğ¿Ğ¾Ñ—Ğ´ĞµĞ¼Ğ¾ Ñ€Ğ°Ğ·Ğ¾Ğ¼.\n- ĞšĞ¾Ğ»Ğ¸ Ñ‚Ğ¸ Ğ¿Ğ»Ğ°Ğ½ÑƒÑ”Ñˆ Ğ¿Ğ¾Ñ—Ñ…Ğ°Ñ‚Ğ¸ Ñƒ Ğ²Ñ–Ğ´Ğ¿ÑƒÑÑ‚ĞºÑƒ Ñ†ÑŒĞ¾Ğ³Ğ¾ Ñ€Ğ¾ĞºÑƒ?\n- ĞŸĞµÑ€Ñˆ Ğ½Ñ–Ğ¶ Ğ¿Ğ¾Ñ—Ñ…Ğ°Ñ‚Ğ¸, Ñ‚Ñ€ĞµĞ±Ğ° Ğ·Ğ°Ğ²ĞµÑ€ÑˆĞ¸Ñ‚Ğ¸ Ğ²ÑÑ– ÑĞ¿Ñ€Ğ°Ğ²Ğ¸ Ğ½Ğ° Ñ€Ğ¾Ğ±Ğ¾Ñ‚Ñ–.\n- ĞŸĞ¾ĞºĞ¸ Ñ‡ĞµĞºĞ°Ñ, Ğ²Ğ¸Ğ²Ñ‡Ğ°Ñ‚Ğ¸Ğ¼Ñƒ Ñ–Ñ‚Ğ°Ğ»Ñ–Ğ¹ÑÑŒĞºÑƒ Ğ´Ğ»Ñ Ğ¿Ğ¾Ğ´Ğ¾Ñ€Ğ¾Ğ¶Ñ–.\n- ĞŸÑ–ÑĞ»Ñ Ñ‚Ğ¾Ğ³Ğ¾ ÑĞº Ğ¿Ğ¾Ğ²ĞµÑ€Ğ½ĞµĞ¼Ğ¾ÑÑ, Ñ€Ğ¾Ğ·ĞºĞ°Ğ¶ĞµĞ¼ Ğ´Ñ€ÑƒĞ·ÑĞ¼ Ğ¿Ñ€Ğ¾ Ğ¿Ñ€Ğ¸Ğ³Ğ¾Ğ´Ğ¸.\n- Ğ”Ğ¾Ğ±Ñ€Ğµ, Ñ‡ĞµĞºĞ°Ñ‚Ğ¸Ğ¼Ñƒ, Ğ´Ğ¾ĞºĞ¸ Ñ‚Ğ¸ Ğ½Ğµ Ğ·Ğ°ĞºÑ–Ğ½Ñ‡Ğ¸Ñˆ ÑƒÑĞµ.\n\n> [!answer]\n> 1. ĞšĞ¾Ğ»Ğ¸ Ñ‚Ğ¸ Ğ¿Ğ»Ğ°Ğ½ÑƒÑ”Ñˆ Ğ¿Ğ¾Ñ—Ñ…Ğ°Ñ‚Ğ¸ Ñƒ Ğ²Ñ–Ğ´Ğ¿ÑƒÑÑ‚ĞºÑƒ Ñ†ÑŒĞ¾Ğ³Ğ¾ Ñ€Ğ¾ĞºÑƒ?\n> 2. Ğ¯Ğº Ñ‚Ñ–Ğ»ÑŒĞºĞ¸ Ğ·Ğ°ĞºÑ–Ğ½Ñ‡Ñƒ Ñ†ĞµĞ¹ Ğ¿Ñ€Ğ¾ĞµĞºÑ‚, Ğ¿Ğ¾Ñ—Ğ´ĞµĞ¼Ğ¾ Ñ€Ğ°Ğ·Ğ¾Ğ¼.\n> 3. ĞŸĞµÑ€Ñˆ Ğ½Ñ–Ğ¶ Ğ¿Ğ¾Ñ—Ñ…Ğ°Ñ‚Ğ¸, Ñ‚Ñ€ĞµĞ±Ğ° Ğ·Ğ°Ğ²ĞµÑ€ÑˆĞ¸Ñ‚Ğ¸ Ğ²ÑÑ– ÑĞ¿Ñ€Ğ°Ğ²Ğ¸ Ğ½Ğ° Ñ€Ğ¾Ğ±Ğ¾Ñ‚Ñ–.\n> 4. Ğ”Ğ¾Ğ±Ñ€Ğµ, Ñ‡ĞµĞºĞ°Ñ‚Ğ¸Ğ¼Ñƒ, Ğ´Ğ¾ĞºĞ¸ Ñ‚Ğ¸ Ğ½Ğµ Ğ·Ğ°ĞºÑ–Ğ½Ñ‡Ğ¸Ñˆ ÑƒÑĞµ.\n> 5. ĞŸĞ¾ĞºĞ¸ Ñ‡ĞµĞºĞ°Ñ, Ğ²Ğ¸Ğ²Ñ‡Ğ°Ñ‚Ğ¸Ğ¼Ñƒ Ñ–Ñ‚Ğ°Ğ»Ñ–Ğ¹ÑÑŒĞºÑƒ Ğ´Ğ»Ñ Ğ¿Ğ¾Ğ´Ğ¾Ñ€Ğ¾Ğ¶Ñ–.\n> 6. ĞŸÑ–ÑĞ»Ñ Ñ‚Ğ¾Ğ³Ğ¾ ÑĞº Ğ¿Ğ¾Ğ²ĞµÑ€Ğ½ĞµĞ¼Ğ¾ÑÑ, Ñ€Ğ¾Ğ·ĞºĞ°Ğ¶ĞµĞ¼ Ğ´Ñ€ÑƒĞ·ÑĞ¼ Ğ¿Ñ€Ğ¾ Ğ¿Ñ€Ğ¸Ğ³Ğ¾Ğ´Ğ¸.\n\n---\n\n## select: Ğ’Ğ¸Ğ±ĞµÑ€Ñ–Ñ‚ÑŒ ÑƒÑÑ– Ğ³Ñ€Ğ°Ğ¼Ğ°Ñ‚Ğ¸Ñ‡Ğ½Ğ¾ Ğ¿Ñ€Ğ°Ğ²Ğ¸Ğ»ÑŒĞ½Ñ– Ñ€ĞµÑ‡ĞµĞ½Ğ½Ñ\n\n- [x] ĞšĞ¾Ğ»Ğ¸ Ğ²Ñ–Ğ½ Ğ¿Ñ€Ğ¸Ğ¹ÑˆĞ¾Ğ², Ğ¼Ğ¸ Ğ²Ğ¶Ğµ Ğ²ĞµÑ‡ĞµÑ€ÑĞ»Ğ¸.\n- [ ] Ğ§ĞµĞºĞ°Ğ¹, Ğ¿Ğ¾ĞºĞ¸ Ñ Ğ¿Ñ€Ğ¸Ğ¹Ğ´Ñƒ.\n- [x] Ğ§ĞµĞºĞ°Ğ¹, Ğ¿Ğ¾ĞºĞ¸ Ñ Ğ½Ğµ Ğ¿Ñ€Ğ¸Ğ¹Ğ´Ñƒ.\n- [x] ĞŸÑ–ÑĞ»Ñ Ñ‚Ğ¾Ğ³Ğ¾ ÑĞº Ğ²Ñ–Ğ½ Ğ¿Ñ–ÑˆĞ¾Ğ², Ğ½Ğ°ÑÑ‚Ğ°Ğ»Ğ° Ñ‚Ğ¸ÑˆĞ°.\n- [ ] ĞŸĞµÑ€Ñˆ Ğ½Ñ–Ğ¶ Ğ²Ñ–Ğ½ Ğ¿Ñ–ÑˆĞ¾Ğ², Ğ¼Ğ¸ Ğ¿Ñ€Ğ¾Ğ´Ğ¾Ğ²Ğ¶Ğ¸Ğ»Ğ¸ Ñ€Ğ¾Ğ·Ğ¼Ğ¾Ğ²Ñƒ.\n- [x] ĞŸĞµÑ€Ñˆ Ğ½Ñ–Ğ¶ Ğ¿Ñ–Ñ‚Ğ¸, Ğ²Ñ–Ğ½ Ğ¿Ğ¾Ğ¿Ñ€Ğ¾Ñ‰Ğ°Ğ²ÑÑ.\n- [x] Ğ¯Ğº Ñ‚Ñ–Ğ»ÑŒĞºĞ¸ Ğ¿Ğ¾Ñ‡ÑƒĞ²ÑÑ Ğ´Ğ·Ğ²Ñ–Ğ½Ğ¾Ğº, ÑƒÑÑ– Ğ²ÑÑ‚Ğ°Ğ»Ğ¸.\n- [ ] Ğ¯Ğº Ñ‚Ñ–Ğ»ÑŒĞºĞ¸ Ğ²Ñ–Ğ½ Ğ¿Ğ¾ÑÑ‚ÑƒĞ¿Ğ¾Ğ²Ğ¾ Ğ²Ñ‡Ğ¸Ğ²ÑÑ, ÑÑ‚Ğ°Ğ²Ğ°Ğ² ĞºÑ€Ğ°Ñ‰Ğ¸Ğ¼.\n- [x] ĞŸĞ¾ĞºĞ¸ Ğ²Ğ¾Ğ½Ğ° Ğ³Ğ¾Ñ‚ÑƒĞ²Ğ°Ğ»Ğ°, Ğ²Ñ–Ğ½ Ñ‡Ğ¸Ñ‚Ğ°Ğ² Ğ³Ğ°Ğ·ĞµÑ‚Ñƒ.\n- [ ] ĞŸÑ–ÑĞ»Ñ Ñ‚Ğ¾Ğ³Ğ¾ ÑĞº Ğ¼Ğ¸ Ğ¿Ñ€Ğ¸Ñ—Ñ…Ğ°Ğ»Ğ¸, Ñ—Ñ…Ğ°Ğ»Ğ¸ Ñ‚Ñ€Ğ¸ Ğ³Ğ¾Ğ´Ğ¸Ğ½Ğ¸.\n- [x] ĞšĞ¾Ğ¶Ğ½Ğ¾Ğ³Ğ¾ Ñ€Ğ°Ğ·Ñƒ ĞºĞ¾Ğ»Ğ¸ Ğ²Ñ–Ğ½ Ğ¿Ñ€Ğ¸Ñ…Ğ¾Ğ´Ğ¸Ñ‚ÑŒ, Ğ¿Ñ€Ğ¸Ğ½Ğ¾ÑĞ¸Ñ‚ÑŒ ĞºĞ²Ñ–Ñ‚Ğ¸.\n- [x] Ğ— Ñ‚Ğ¸Ñ… Ğ¿Ñ–Ñ€ ÑĞº Ğ²Ñ–Ğ½ Ğ¿ĞµÑ€ĞµÑ—Ñ…Ğ°Ğ², Ğ¼Ğ¸ Ñ€Ñ–Ğ´ĞºĞ¾ Ğ±Ğ°Ñ‡Ğ¸Ğ¼Ğ¾ÑÑ.\n\n---\n\n## translate: ĞŸĞµÑ€ĞµĞºĞ»Ğ°Ğ´Ñ–Ñ‚ÑŒ Ğ½Ğ° ÑƒĞºÑ€Ğ°Ñ—Ğ½ÑÑŒĞºÑƒ Ğ¼Ğ¾Ğ²Ñƒ\n\n1. When he came, we were already having dinner with the whole family.\n   - [x] ĞšĞ¾Ğ»Ğ¸ Ğ²Ñ–Ğ½ Ğ¿Ñ€Ğ¸Ğ¹ÑˆĞ¾Ğ², Ğ¼Ğ¸ Ğ²Ğ¶Ğµ Ğ²ĞµÑ‡ĞµÑ€ÑĞ»Ğ¸ Ğ· ÑƒÑÑ–Ñ”Ñ ÑÑ–Ğ¼'Ñ”Ñ.\n   - [ ] ĞŸÑ–ÑĞ»Ñ Ñ‚Ğ¾Ğ³Ğ¾ ÑĞº Ğ²Ñ–Ğ½ Ğ¿Ñ€Ğ¸Ğ¹ÑˆĞ¾Ğ², Ğ¼Ğ¸ Ğ²ĞµÑ‡ĞµÑ€ÑĞ»Ğ¸.\n   - [ ] ĞŸĞµÑ€Ñˆ Ğ½Ñ–Ğ¶ Ğ²Ñ–Ğ½ Ğ¿Ñ€Ğ¸Ğ¹ÑˆĞ¾Ğ², Ğ¼Ğ¸ Ğ²ĞµÑ‡ĞµÑ€ÑĞ»Ğ¸.\n   - [ ] ĞŸĞ¾ĞºĞ¸ Ğ²Ñ–Ğ½ Ğ¿Ñ€Ğ¸Ğ¹ÑˆĞ¾Ğ², Ğ¼Ğ¸ Ğ²ĞµÑ‡ĞµÑ€ÑĞ»Ğ¸.\n\n2. As soon as the sun rose, we set off on our journey.\n   - [x] Ğ¯Ğº Ñ‚Ñ–Ğ»ÑŒĞºĞ¸ ÑĞ¾Ğ½Ñ†Ğµ Ğ·Ñ–Ğ¹ÑˆĞ»Ğ¾, Ğ¼Ğ¸ Ğ²Ğ¸Ñ€ÑƒÑˆĞ¸Ğ»Ğ¸ Ğ² Ğ´Ğ¾Ñ€Ğ¾Ğ³Ñƒ.\n   - [ ] ĞšĞ¾Ğ»Ğ¸ ÑĞ¾Ğ½Ñ†Ğµ Ğ·Ñ–Ğ¹ÑˆĞ»Ğ¾, Ğ¼Ğ¸ Ğ²Ğ¸Ñ€ÑƒÑˆĞ¸Ğ»Ğ¸.\n   - [ ] ĞŸĞ¾ĞºĞ¸ ÑĞ¾Ğ½Ñ†Ğµ ÑÑ…Ğ¾Ğ´Ğ¸Ğ»Ğ¾, Ğ¼Ğ¸ Ğ²Ğ¸Ñ€ÑƒÑˆĞ¸Ğ»Ğ¸.\n   - [ ] ĞŸĞµÑ€Ñˆ Ğ½Ñ–Ğ¶ ÑĞ¾Ğ½Ñ†Ğµ Ğ·Ñ–Ğ¹ÑˆĞ»Ğ¾, Ğ¼Ğ¸ Ğ²Ğ¸Ñ€ÑƒÑˆĞ¸Ğ»Ğ¸.\n\n3. Before leaving, he said goodbye to everyone in the office.\n   - [x] ĞŸĞµÑ€Ñˆ Ğ½Ñ–Ğ¶ Ğ¿Ñ–Ñ‚Ğ¸, Ğ²Ñ–Ğ½ Ğ¿Ğ¾Ğ¿Ñ€Ğ¾Ñ‰Ğ°Ğ²ÑÑ Ğ· ÑƒÑÑ–Ğ¼Ğ° Ğ² Ğ¾Ñ„Ñ–ÑÑ–.\n   - [ ] ĞŸÑ–ÑĞ»Ñ Ñ‚Ğ¾Ğ³Ğ¾ ÑĞº Ğ¿Ñ–ÑˆĞ¾Ğ², Ğ²Ñ–Ğ½ Ğ¿Ğ¾Ğ¿Ñ€Ğ¾Ñ‰Ğ°Ğ²ÑÑ.\n   - [ ] ĞšĞ¾Ğ»Ğ¸ Ğ¿Ñ–ÑˆĞ¾Ğ², Ğ²Ñ–Ğ½ Ğ¿Ğ¾Ğ¿Ñ€Ğ¾Ñ‰Ğ°Ğ²ÑÑ.\n   - [ ] ĞŸĞ¾ĞºĞ¸ Ğ¹ÑˆĞ¾Ğ², Ğ²Ñ–Ğ½ Ğ¿Ñ€Ğ¾Ñ‰Ğ°Ğ²ÑÑ.\n\n4. Wait here until I return from the store with groceries.\n   - [x] Ğ§ĞµĞºĞ°Ğ¹ Ñ‚ÑƒÑ‚, Ğ¿Ğ¾ĞºĞ¸ Ñ Ğ½Ğµ Ğ¿Ğ¾Ğ²ĞµÑ€Ğ½ÑƒÑÑ Ğ· Ğ¼Ğ°Ğ³Ğ°Ğ·Ğ¸Ğ½Ñƒ Ğ· Ğ¿Ñ€Ğ¾Ğ´ÑƒĞºÑ‚Ğ°Ğ¼Ğ¸.\n   - [ ] Ğ§ĞµĞºĞ°Ğ¹ Ñ‚ÑƒÑ‚, Ğ¿Ğ¾ĞºĞ¸ Ñ Ğ¿Ğ¾Ğ²ĞµÑ€Ğ½ÑƒÑÑ.\n   - [ ] Ğ§ĞµĞºĞ°Ğ¹ Ñ‚ÑƒÑ‚, ĞºĞ¾Ğ»Ğ¸ Ñ Ğ¿Ğ¾Ğ²ĞµÑ€Ğ½ÑƒÑÑ.\n   - [ ] Ğ§ĞµĞºĞ°Ğ¹ Ñ‚ÑƒÑ‚, Ğ¿Ñ–ÑĞ»Ñ Ñ‚Ğ¾Ğ³Ğ¾ ÑĞº Ğ¿Ğ¾Ğ²ĞµÑ€Ğ½ÑƒÑÑ.\n\n5. While she was cooking dinner, he was reading a newspaper.\n   - [x] ĞŸĞ¾ĞºĞ¸ Ğ²Ğ¾Ğ½Ğ° Ğ³Ğ¾Ñ‚ÑƒĞ²Ğ°Ğ»Ğ° Ğ²ĞµÑ‡ĞµÑ€Ñ, Ğ²Ñ–Ğ½ Ñ‡Ğ¸Ñ‚Ğ°Ğ² Ğ³Ğ°Ğ·ĞµÑ‚Ñƒ.\n   - [ ] ĞšĞ¾Ğ»Ğ¸ Ğ²Ğ¾Ğ½Ğ° Ğ³Ğ¾Ñ‚ÑƒĞ²Ğ°Ğ»Ğ° Ğ²ĞµÑ‡ĞµÑ€Ñ, Ğ²Ñ–Ğ½ Ñ‡Ğ¸Ñ‚Ğ°Ğ².\n   - [ ] ĞŸÑ–ÑĞ»Ñ Ñ‚Ğ¾Ğ³Ğ¾ ÑĞº Ğ²Ğ¾Ğ½Ğ° Ğ³Ğ¾Ñ‚ÑƒĞ²Ğ°Ğ»Ğ°, Ğ²Ñ–Ğ½ Ñ‡Ğ¸Ñ‚Ğ°Ğ².\n   - [ ] ĞŸĞµÑ€Ñˆ Ğ½Ñ–Ğ¶ Ğ²Ğ¾Ğ½Ğ° Ğ³Ğ¾Ñ‚ÑƒĞ²Ğ°Ğ»Ğ°, Ğ²Ñ–Ğ½ Ñ‡Ğ¸Ñ‚Ğ°Ğ².\n\n6. Every time I visit this city, I remember my childhood years.\n   - [x] ĞšĞ¾Ğ¶Ğ½Ğ¾Ğ³Ğ¾ Ñ€Ğ°Ğ·Ñƒ ĞºĞ¾Ğ»Ğ¸ Ñ Ğ²Ñ–Ğ´Ğ²Ñ–Ğ´ÑƒÑ Ñ†Ğµ Ğ¼Ñ–ÑÑ‚Ğ¾, Ğ·Ğ³Ğ°Ğ´ÑƒÑ Ğ´Ğ¸Ñ‚ÑÑ‡Ñ– Ñ€Ğ¾ĞºĞ¸.\n   - [ ] ĞšĞ¾Ğ»Ğ¸ Ñ Ğ²Ñ–Ğ´Ğ²Ñ–Ğ´ÑƒÑ Ñ†Ğµ Ğ¼Ñ–ÑÑ‚Ğ¾, Ğ·Ğ³Ğ°Ğ´ÑƒÑ.\n   - [ ] ĞŸÑ–ÑĞ»Ñ Ñ‚Ğ¾Ğ³Ğ¾ ÑĞº Ğ²Ñ–Ğ´Ğ²Ñ–Ğ´ÑƒÑ Ğ¼Ñ–ÑÑ‚Ğ¾, Ğ·Ğ³Ğ°Ğ´ÑƒÑ.\n   - [ ] ĞŸĞ¾ĞºĞ¸ Ğ²Ñ–Ğ´Ğ²Ñ–Ğ´ÑƒÑ Ğ¼Ñ–ÑÑ‚Ğ¾, Ğ·Ğ³Ğ°Ğ´ÑƒÑ.\n\n---\n\n# Ğ¡Ğ»Ğ¾Ğ²Ğ½Ğ¸Ğº\n\n| Ğ¡Ğ»Ğ¾Ğ²Ğ¾ | Ğ’Ğ¸Ğ¼Ğ¾Ğ²Ğ° | ĞŸĞµÑ€ĞµĞºĞ»Ğ°Ğ´ | Ğ§Ğœ | ĞŸÑ€Ğ¸Ğ¼Ñ–Ñ‚ĞºĞ° |\n|-------|--------|----------|-----|----------|\n| **ĞºĞ¾Ğ»Ğ¸** | /kÉ”ËˆlÉª/ | when | ÑĞ¿Ğ¾Ğ»ÑƒÑ‡Ğ½. | ÑƒĞ½Ñ–Ğ²ĞµÑ€ÑĞ°Ğ»ÑŒĞ½Ğ¸Ğ¹ Ñ‡Ğ°ÑĞ¾Ğ²Ğ¸Ğ¹ |\n| **Ğ¿Ñ–ÑĞ»Ñ Ñ‚Ğ¾Ğ³Ğ¾ ÑĞº** | /ËˆpÊ²islÊ²É‘ tÉ”ËˆÉ¦É” jÉ‘k/ | after | ÑĞ¿Ğ¾Ğ»ÑƒÑ‡Ğ½. | Ğ¿Ğ¾ÑĞ»Ñ–Ğ´Ğ¾Ğ²Ğ½Ñ–ÑÑ‚ÑŒ |\n| **Ğ¿ĞµÑ€Ñˆ Ğ½Ñ–Ğ¶** | /pÉ›rÊƒ nÊ²iÊ’/ | before | ÑĞ¿Ğ¾Ğ»ÑƒÑ‡Ğ½. | Ğ¿Ğ¾Ğ¿ĞµÑ€ĞµĞ´Ğ½Ñ–ÑÑ‚ÑŒ |\n| **Ğ¿ĞµÑ€ĞµĞ´ Ñ‚Ğ¸Ğ¼ ÑĞº** | /ËˆpÉ›rÉ›d tÉªm jÉ‘k/ | before | ÑĞ¿Ğ¾Ğ»ÑƒÑ‡Ğ½. | ÑĞ¸Ğ½Ğ¾Ğ½Ñ–Ğ¼ Â«Ğ¿ĞµÑ€Ñˆ Ğ½Ñ–Ğ¶Â» |\n| **Ğ´Ğ¾ Ñ‚Ğ¾Ğ³Ğ¾ ÑĞº** | /dÉ” tÉ”ËˆÉ¦É” jÉ‘k/ | before | ÑĞ¿Ğ¾Ğ»ÑƒÑ‡Ğ½. | Ñ„Ğ¾Ñ€Ğ¼Ğ°Ğ»ÑŒĞ½Ğ¸Ğ¹ Ğ²Ğ°Ñ€Ñ–Ğ°Ğ½Ñ‚ |\n| **Ğ¿Ğ¾ĞºĞ¸** | /ËˆpÉ”kÉª/ | while | ÑĞ¿Ğ¾Ğ»ÑƒÑ‡Ğ½. | Ñ‚Ñ€Ğ¸Ğ²Ğ°Ğ»Ñ–ÑÑ‚ÑŒ |\n| **Ğ¿Ğ¾ĞºĞ¸ Ğ½Ğµ** | /ËˆpÉ”kÉª nÉ›/ | until | ÑĞ¿Ğ¾Ğ»ÑƒÑ‡Ğ½. | Ğ¾Ñ‡Ñ–ĞºÑƒĞ²Ğ°Ğ½Ğ½Ñ Ñ€ĞµĞ·ÑƒĞ»ÑŒÑ‚Ğ°Ñ‚Ñƒ |\n| **Ğ´Ğ¾ĞºĞ¸** | /ËˆdÉ”kÉª/ | while, as long as | ÑĞ¿Ğ¾Ğ»ÑƒÑ‡Ğ½. | ÑĞ¸Ğ½Ğ¾Ğ½Ñ–Ğ¼ Â«Ğ¿Ğ¾ĞºĞ¸Â» |\n| **Ğ´Ğ¾ĞºĞ¸ Ğ½Ğµ** | /ËˆdÉ”kÉª nÉ›/ | until | ÑĞ¿Ğ¾Ğ»ÑƒÑ‡Ğ½. | ÑĞ¸Ğ½Ğ¾Ğ½Ñ–Ğ¼ Â«Ğ¿Ğ¾ĞºĞ¸ Ğ½ĞµÂ» |\n| **ÑĞº Ñ‚Ñ–Ğ»ÑŒĞºĞ¸** | /jÉ‘k ËˆtÊ²ilÊ²kÉª/ | as soon as | ÑĞ¿Ğ¾Ğ»ÑƒÑ‡Ğ½. | Ğ½ĞµĞ³Ğ°Ğ¹Ğ½Ğ° Ñ€ĞµĞ°ĞºÑ†Ñ–Ñ |\n| **Ñ‰Ğ¾Ğ¹Ğ½Ğ¾** | /ËˆÊƒtÊƒÉ”jnÉ”/ | just, barely | ÑĞ¿Ğ¾Ğ»ÑƒÑ‡Ğ½. | Ğ¼Ğ¸Ñ‚Ñ‚Ñ”Ğ²Ñ–ÑÑ‚ÑŒ |\n| **Ğ»ĞµĞ´Ğ²Ğµ** | /ËˆlÉ›dwÉ›/ | scarcely, hardly | ÑĞ¿Ğ¾Ğ»ÑƒÑ‡Ğ½. | Ğ»ĞµĞ´Ğ²Ğµ Ğ²ÑÑ‚Ğ¸Ğ³ |\n| **Ğ¼Ğ°Ğ»Ğ¾ Ğ½Ğµ** | /ËˆmÉ‘lÉ” nÉ›/ | almost | Ğ²Ğ¸Ñ€Ğ°Ğ· | Ğ»ĞµĞ´Ğ²Ğµ Ğ½Ğµ |\n| **Ñƒ Ñ‚Ğ¾Ğ¹ Ñ‡Ğ°Ñ ÑĞº** | /u tÉ”j tÊƒÉ‘s jÉ‘k/ | while, whereas | ÑĞ¿Ğ¾Ğ»ÑƒÑ‡Ğ½. | Ğ¿Ğ°Ñ€Ğ°Ğ»ĞµĞ»ÑŒĞ½Ñ–ÑÑ‚ÑŒ |\n| **Ğ² Ğ¼Ñ–Ñ€Ñƒ Ñ‚Ğ¾Ğ³Ğ¾ ÑĞº** | /w ËˆmÊ²iru tÉ”ËˆÉ¦É” jÉ‘k/ | as, to the extent that | ÑĞ¿Ğ¾Ğ»ÑƒÑ‡Ğ½. | Ğ¿Ğ¾ÑÑ‚ÑƒĞ¿Ğ¾Ğ²Ñ–ÑÑ‚ÑŒ |\n| **Ñƒ Ñ‚Ğ¾Ğ¹ Ğ¼Ğ¾Ğ¼ĞµĞ½Ñ‚ ĞºĞ¾Ğ»Ğ¸** | /u tÉ”j mÉ”ËˆmÉ›nt kÉ”ËˆlÉª/ | at the moment when | Ğ²Ğ¸Ñ€Ğ°Ğ· | Ñ‚Ğ¾Ñ‡Ğ½Ğ¸Ğ¹ Ğ¼Ğ¾Ğ¼ĞµĞ½Ñ‚ |\n| **Ğ²Ñ–Ğ´Ñ‚Ğ¾Ğ´Ñ– ÑĞº** | /wÊ²idtÉ”ËˆdÊ²i jÉ‘k/ | since then | ÑĞ¿Ğ¾Ğ»ÑƒÑ‡Ğ½. | Ğ²Ñ–Ğ´ Ğ¼Ğ¸Ğ½ÑƒĞ»Ğ¾Ğ³Ğ¾ Ğ¼Ğ¾Ğ¼ĞµĞ½Ñ‚Ñƒ |\n| **Ğ· Ñ‚Ğ¸Ñ… Ğ¿Ñ–Ñ€ ÑĞº** | /z tÉªx pÊ²ir jÉ‘k/ | since | ÑĞ¿Ğ¾Ğ»ÑƒÑ‡Ğ½. | ÑĞ¸Ğ½Ğ¾Ğ½Ñ–Ğ¼ Â«Ğ²Ñ–Ğ´Ñ‚Ğ¾Ğ´Ñ– ÑĞºÂ» |\n| **Ğ´Ğ¾ Ñ‚Ğ¸Ñ… Ğ¿Ñ–Ñ€ Ğ¿Ğ¾ĞºĞ¸** | /dÉ” tÉªx pÊ²ir ËˆpÉ”kÉª/ | until | Ğ²Ğ¸Ñ€Ğ°Ğ· | Ğ´Ğ¾ Ğ´Ğ¾ÑÑĞ³Ğ½ĞµĞ½Ğ½Ñ |\n| **Ğ²ĞµÑÑŒ Ñ‡Ğ°Ñ Ğ¿Ğ¾ĞºĞ¸** | /wÉ›sÊ² tÊƒÉ‘s ËˆpÉ”kÉª/ | the whole time while | Ğ²Ğ¸Ñ€Ğ°Ğ· | ÑƒĞ²ĞµÑÑŒ Ğ¿ĞµÑ€Ñ–Ğ¾Ğ´ |\n| **ĞºĞ¾Ğ¶Ğ½Ğ¾Ğ³Ğ¾ Ñ€Ğ°Ğ·Ñƒ ĞºĞ¾Ğ»Ğ¸** | /ËˆkÉ”Ê’nÉ”É¦É” ËˆrÉ‘zu kÉ”ËˆlÉª/ | every time when | Ğ²Ğ¸Ñ€Ğ°Ğ· | Ñ€ĞµĞ³ÑƒĞ»ÑÑ€Ğ½Ñ–ÑÑ‚ÑŒ |\n| **Ñ‰Ğ¾Ñ€Ğ°Ğ·Ñƒ ÑĞº** | /ËˆÊƒtÊƒÉ”rÉ‘zu jÉ‘k/ | each time when | Ğ²Ğ¸Ñ€Ğ°Ğ· | ÑĞ¸Ğ½Ğ¾Ğ½Ñ–Ğ¼ |\n| **Ğ¾Ğ´Ğ½Ğ¾Ñ‡Ğ°ÑĞ½Ñ–ÑÑ‚ÑŒ** | /É”dnÉ”ËˆtÊƒÉ‘snÊ²istÊ²/ | simultaneity | Ñ–Ğ¼. (Ğ¶.Ñ€.) | Ğ¿Ğ°Ñ€Ğ°Ğ»ĞµĞ»ÑŒĞ½Ñ–ÑÑ‚ÑŒ Ğ´Ñ–Ğ¹ |\n| **Ğ¿Ğ¾ÑĞ»Ñ–Ğ´Ğ¾Ğ²Ğ½Ñ–ÑÑ‚ÑŒ** | /pÉ”slÊ²iËˆdÉ”wnÊ²istÊ²/ | sequence | Ñ–Ğ¼. (Ğ¶.Ñ€.) | Ğ¿Ğ¾Ñ€ÑĞ´Ğ¾Ğº Ğ´Ñ–Ğ¹ |\n| **Ğ¿Ğ¾Ğ¿ĞµÑ€ĞµĞ´Ğ½Ñ–ÑÑ‚ÑŒ** | /pÉ”pÉ›ËˆrÉ›dnÊ²istÊ²/ | precedence | Ñ–Ğ¼. (Ğ¶.Ñ€.) | Ñ€Ğ°Ğ½Ñ–ÑˆĞµ Ğ·Ğ° Ñ–Ğ½ÑˆÑƒ Ğ´Ñ–Ñ |\n",
    "createdAt": "2025-12-25T19:48:31.855098Z",
    "modifiedAt": "2025-12-25T19:48:31.855098Z",
    "version": 2
  },
  "activities": [],
  "vocabulary": {
    "moduleId": "mod-uk-B1-37",
    "level": "B1",
    "phase": "B1.3b Complex Sentences",
    "wordCount": 25,
    "newWordCount": 25,
    "reviewWordCount": 0,
    "transliterationMode": "none",
    "words": [
      {
        "id": "vocab-1",
        "uk": "**ĞºĞ¾Ğ»Ğ¸**",
        "ipa": "/kÉ”ËˆlÉª/",
        "en": "when",
        "pos": "ÑĞ¿Ğ¾Ğ»ÑƒÑ‡Ğ½.",
        "gender": null,
        "note": ""
      },
      {
        "id": "vocab-2",
        "uk": "**Ğ¿Ñ–ÑĞ»Ñ Ñ‚Ğ¾Ğ³Ğ¾ ÑĞº**",
        "ipa": "/ËˆpÊ²islÊ²É‘ tÉ”ËˆÉ¦É” jÉ‘k/",
        "en": "after",
        "pos": "ÑĞ¿Ğ¾Ğ»ÑƒÑ‡Ğ½.",
        "gender": null,
        "note": ""
      },
      {
        "id": "vocab-3",
        "uk": "**Ğ¿ĞµÑ€Ñˆ Ğ½Ñ–Ğ¶**",
        "ipa": "/pÉ›rÊƒ nÊ²iÊ’/",
        "en": "before",
        "pos": "ÑĞ¿Ğ¾Ğ»ÑƒÑ‡Ğ½.",
        "gender": null,
        "note": ""
      },
      {
        "id": "vocab-4",
        "uk": "**Ğ¿ĞµÑ€ĞµĞ´ Ñ‚Ğ¸Ğ¼ ÑĞº**",
        "ipa": "/ËˆpÉ›rÉ›d tÉªm jÉ‘k/",
        "en": "before",
        "pos": "ÑĞ¿Ğ¾Ğ»ÑƒÑ‡Ğ½.",
        "gender": null,
        "note": ""
      },
      {
        "id": "vocab-5",
        "uk": "**Ğ´Ğ¾ Ñ‚Ğ¾Ğ³Ğ¾ ÑĞº**",
        "ipa": "/dÉ” tÉ”ËˆÉ¦É” jÉ‘k/",
        "en": "before",
        "pos": "ÑĞ¿Ğ¾Ğ»ÑƒÑ‡Ğ½.",
        "gender": null,
        "note": ""
      },
      {
        "id": "vocab-6",
        "uk": "**Ğ¿Ğ¾ĞºĞ¸**",
        "ipa": "/ËˆpÉ”kÉª/",
        "en": "while",
        "pos": "ÑĞ¿Ğ¾Ğ»ÑƒÑ‡Ğ½.",
        "gender": null,
        "note": ""
      },
      {
        "id": "vocab-7",
        "uk": "**Ğ¿Ğ¾ĞºĞ¸ Ğ½Ğµ**",
        "ipa": "/ËˆpÉ”kÉª nÉ›/",
        "en": "until",
        "pos": "ÑĞ¿Ğ¾Ğ»ÑƒÑ‡Ğ½.",
        "gender": null,
        "note": ""
      },
      {
        "id": "vocab-8",
        "uk": "**Ğ´Ğ¾ĞºĞ¸**",
        "ipa": "/ËˆdÉ”kÉª/",
        "en": "while, as long as",
        "pos": "ÑĞ¿Ğ¾Ğ»ÑƒÑ‡Ğ½.",
        "gender": null,
        "note": ""
      },
      {
        "id": "vocab-9",
        "uk": "**Ğ´Ğ¾ĞºĞ¸ Ğ½Ğµ**",
        "ipa": "/ËˆdÉ”kÉª nÉ›/",
        "en": "until",
        "pos": "ÑĞ¿Ğ¾Ğ»ÑƒÑ‡Ğ½.",
        "gender": null,
        "note": ""
      },
      {
        "id": "vocab-10",
        "uk": "**ÑĞº Ñ‚Ñ–Ğ»ÑŒĞºĞ¸**",
        "ipa": "/jÉ‘k ËˆtÊ²ilÊ²kÉª/",
        "en": "as soon as",
        "pos": "ÑĞ¿Ğ¾Ğ»ÑƒÑ‡Ğ½.",
        "gender": null,
        "note": ""
      },
      {
        "id": "vocab-11",
        "uk": "**Ñ‰Ğ¾Ğ¹Ğ½Ğ¾**",
        "ipa": "/ËˆÊƒtÊƒÉ”jnÉ”/",
        "en": "just, barely",
        "pos": "ÑĞ¿Ğ¾Ğ»ÑƒÑ‡Ğ½.",
        "gender": null,
        "note": ""
      },
      {
        "id": "vocab-12",
        "uk": "**Ğ»ĞµĞ´Ğ²Ğµ**",
        "ipa": "/ËˆlÉ›dwÉ›/",
        "en": "scarcely, hardly",
        "pos": "ÑĞ¿Ğ¾Ğ»ÑƒÑ‡Ğ½.",
        "gender": null,
        "note": ""
      },
      {
        "id": "vocab-13",
        "uk": "**Ğ¼Ğ°Ğ»Ğ¾ Ğ½Ğµ**",
        "ipa": "/ËˆmÉ‘lÉ” nÉ›/",
        "en": "almost",
        "pos": "Ğ²Ğ¸Ñ€Ğ°Ğ·",
        "gender": null,
        "note": ""
      },
      {
        "id": "vocab-14",
        "uk": "**Ñƒ Ñ‚Ğ¾Ğ¹ Ñ‡Ğ°Ñ ÑĞº**",
        "ipa": "/u tÉ”j tÊƒÉ‘s jÉ‘k/",
        "en": "while, whereas",
        "pos": "ÑĞ¿Ğ¾Ğ»ÑƒÑ‡Ğ½.",
        "gender": null,
        "note": ""
      },
      {
        "id": "vocab-15",
        "uk": "**Ğ² Ğ¼Ñ–Ñ€Ñƒ Ñ‚Ğ¾Ğ³Ğ¾ ÑĞº**",
        "ipa": "/w ËˆmÊ²iru tÉ”ËˆÉ¦É” jÉ‘k/",
        "en": "as, to the extent that",
        "pos": "ÑĞ¿Ğ¾Ğ»ÑƒÑ‡Ğ½.",
        "gender": null,
        "note": ""
      },
      {
        "id": "vocab-16",
        "uk": "**Ñƒ Ñ‚Ğ¾Ğ¹ Ğ¼Ğ¾Ğ¼ĞµĞ½Ñ‚ ĞºĞ¾Ğ»Ğ¸**",
        "ipa": "/u tÉ”j mÉ”ËˆmÉ›nt kÉ”ËˆlÉª/",
        "en": "at the moment when",
        "pos": "Ğ²Ğ¸Ñ€Ğ°Ğ·",
        "gender": null,
        "note": ""
      },
      {
        "id": "vocab-17",
        "uk": "**Ğ²Ñ–Ğ´Ñ‚Ğ¾Ğ´Ñ– ÑĞº**",
        "ipa": "/wÊ²idtÉ”ËˆdÊ²i jÉ‘k/",
        "en": "since then",
        "pos": "ÑĞ¿Ğ¾Ğ»ÑƒÑ‡Ğ½.",
        "gender": null,
        "note": ""
      },
      {
        "id": "vocab-18",
        "uk": "**Ğ· Ñ‚Ğ¸Ñ… Ğ¿Ñ–Ñ€ ÑĞº**",
        "ipa": "/z tÉªx pÊ²ir jÉ‘k/",
        "en": "since",
        "pos": "ÑĞ¿Ğ¾Ğ»ÑƒÑ‡Ğ½.",
        "gender": null,
        "note": ""
      },
      {
        "id": "vocab-19",
        "uk": "**Ğ´Ğ¾ Ñ‚Ğ¸Ñ… Ğ¿Ñ–Ñ€ Ğ¿Ğ¾ĞºĞ¸**",
        "ipa": "/dÉ” tÉªx pÊ²ir ËˆpÉ”kÉª/",
        "en": "until",
        "pos": "Ğ²Ğ¸Ñ€Ğ°Ğ·",
        "gender": null,
        "note": ""
      },
      {
        "id": "vocab-20",
        "uk": "**Ğ²ĞµÑÑŒ Ñ‡Ğ°Ñ Ğ¿Ğ¾ĞºĞ¸**",
        "ipa": "/wÉ›sÊ² tÊƒÉ‘s ËˆpÉ”kÉª/",
        "en": "the whole time while",
        "pos": "Ğ²Ğ¸Ñ€Ğ°Ğ·",
        "gender": null,
        "note": ""
      },
      {
        "id": "vocab-21",
        "uk": "**ĞºĞ¾Ğ¶Ğ½Ğ¾Ğ³Ğ¾ Ñ€Ğ°Ğ·Ñƒ ĞºĞ¾Ğ»Ğ¸**",
        "ipa": "/ËˆkÉ”Ê’nÉ”É¦É” ËˆrÉ‘zu kÉ”ËˆlÉª/",
        "en": "every time when",
        "pos": "Ğ²Ğ¸Ñ€Ğ°Ğ·",
        "gender": null,
        "note": ""
      },
      {
        "id": "vocab-22",
        "uk": "**Ñ‰Ğ¾Ñ€Ğ°Ğ·Ñƒ ÑĞº**",
        "ipa": "/ËˆÊƒtÊƒÉ”rÉ‘zu jÉ‘k/",
        "en": "each time when",
        "pos": "Ğ²Ğ¸Ñ€Ğ°Ğ·",
        "gender": null,
        "note": ""
      },
      {
        "id": "vocab-23",
        "uk": "**Ğ¾Ğ´Ğ½Ğ¾Ñ‡Ğ°ÑĞ½Ñ–ÑÑ‚ÑŒ**",
        "ipa": "/É”dnÉ”ËˆtÊƒÉ‘snÊ²istÊ²/",
        "en": "simultaneity",
        "pos": "Ñ–Ğ¼. (Ğ¶.Ñ€.)",
        "gender": null,
        "note": ""
      },
      {
        "id": "vocab-24",
        "uk": "**Ğ¿Ğ¾ÑĞ»Ñ–Ğ´Ğ¾Ğ²Ğ½Ñ–ÑÑ‚ÑŒ**",
        "ipa": "/pÉ”slÊ²iËˆdÉ”wnÊ²istÊ²/",
        "en": "sequence",
        "pos": "Ñ–Ğ¼. (Ğ¶.Ñ€.)",
        "gender": null,
        "note": ""
      },
      {
        "id": "vocab-25",
        "uk": "**Ğ¿Ğ¾Ğ¿ĞµÑ€ĞµĞ´Ğ½Ñ–ÑÑ‚ÑŒ**",
        "ipa": "/pÉ”pÉ›ËˆrÉ›dnÊ²istÊ²/",
        "en": "precedence",
        "pos": "Ñ–Ğ¼. (Ğ¶.Ñ€.)",
        "gender": null,
        "note": ""
      }
    ],
    "reviewWords": []
  }
}