{
  "$schema": "../../../schemas/vibe-module.schema.json",
  "lesson": {
    "id": "lesson-uk-B1-39",
    "moduleId": "mod-uk-B1-39",
    "languagePair": "l2-uk-en",
    "subject": "language",
    "owner": "curricula-opus",
    "visibility": "public",
    "language": "uk",
    "targetLevel": "B1",
    "phase": "B1.3b Complex Sentences",
    "moduleNumber": 39,
    "moduleType": "grammar",
    "pedagogy": "TTT",
    "immersionLevel": 0.6,
    "title": "ĞĞµĞ¿Ñ€ÑĞ¼Ğ° Ğ¼Ğ¾Ğ²Ğ°: Ñ‚Ğ²ĞµÑ€Ğ´Ğ¶ĞµĞ½Ğ½Ñ",
    "titleUk": null,
    "subtitle": "Reported Statements",
    "description": "Learner can report what someone said using indirect speech",
    "objectives": [
      "Learner can report what someone said using indirect speech",
      "Learner can apply tense backshift in reported statements",
      "Learner can use appropriate reporting verbs"
    ],
    "objectivesUk": null,
    "grammarFocus": [
      "Converting direct speech to indirect speech",
      "Ğ’Ñ–Ğ½ ÑĞºĞ°Ğ·Ğ°Ğ², Ñ‰Ğ¾... constructions"
    ],
    "tags": [
      "grammar",
      "reported-speech",
      "indirect-speech",
      "statements"
    ],
    "totalDuration": 90,
    "transliterationMode": "none",
    "sections": [
      {
        "id": "section-1",
        "name": "ĞŸÑ–Ğ´ÑÑƒĞ¼Ğ¾Ğº",
        "nameEn": null,
        "type": "summary",
        "content": "**Ğ©Ğ¾ Ğ²Ğ¸ Ğ½Ğ°Ğ²Ñ‡Ğ¸Ğ»Ğ¸ÑÑ:**\n\n1. **Ğ¡Ñ‚Ñ€ÑƒĞºÑ‚ÑƒÑ€Ğ°:** ĞŸÑ€ÑĞ¼Ğ° â†’ ĞĞµĞ¿Ñ€ÑĞ¼Ğ°: Ğ´Ğ¾Ğ´Ğ°Ñ”Ğ¼Ğ¾ Â«Ñ‰Ğ¾Â», Ğ·Ğ¼Ñ–Ğ½ÑÑ”Ğ¼Ğ¾ Ğ·Ğ°Ğ¹Ğ¼ĞµĞ½Ğ½Ğ¸ĞºĞ¸.\n2. **Ğ”Ñ–Ñ”ÑĞ»Ğ¾Ğ²Ğ° Ğ²Ğ²ĞµĞ´ĞµĞ½Ğ½Ñ:** ÑĞºĞ°Ğ·Ğ°Ñ‚Ğ¸, Ğ³Ğ¾Ğ²Ğ¾Ñ€Ğ¸Ñ‚Ğ¸, Ğ¿Ğ¾ÑÑĞ½Ğ¸Ñ‚Ğ¸, Ğ·Ğ°ÑĞ²Ğ¸Ñ‚Ğ¸, Ğ´Ğ¾Ğ´Ğ°Ñ‚Ğ¸, Ğ·Ğ°ÑƒĞ²Ğ°Ğ¶Ğ¸Ñ‚Ğ¸.\n3. **Ğ—ÑÑƒĞ² Ñ‡Ğ°ÑÑ–Ğ²:** Ğ·Ğ°Ğ»ĞµĞ¶Ğ¸Ñ‚ÑŒ Ğ²Ñ–Ğ´ Ğ°ĞºÑ‚ÑƒĞ°Ğ»ÑŒĞ½Ğ¾ÑÑ‚Ñ– Ğ´Ñ–Ñ—.\n4. **Ğ’ĞºĞ°Ğ·Ñ–Ğ²Ğ½Ñ– ÑĞ»Ğ¾Ğ²Ğ°:** Ğ·Ğ°Ñ€Ğ°Ğ· â†’ Ñ‚Ğ¾Ğ´Ñ–, Ñ‚ÑƒÑ‚ â†’ Ñ‚Ğ°Ğ¼, Ğ·Ğ°Ğ²Ñ‚Ñ€Ğ° â†’ Ğ½Ğ°ÑÑ‚ÑƒĞ¿Ğ½Ğ¾Ğ³Ğ¾ Ğ´Ğ½Ñ.\n\n**ĞÑĞ½Ğ¾Ğ²Ğ½Ğµ Ğ¿Ñ€Ğ°Ğ²Ğ¸Ğ»Ğ¾:**\n\n> ĞĞµĞ¿Ñ€ÑĞ¼Ğ° Ğ¼Ğ¾Ğ²Ğ° Ğ¿ĞµÑ€ĞµĞ´Ğ°Ñ” Ğ·Ğ¼Ñ–ÑÑ‚, Ğ° Ğ½Ğµ Ñ„Ğ¾Ñ€Ğ¼Ñƒ. Ğ“Ğ¾Ğ»Ğ¾Ğ²Ğ½Ğµ â€” Ğ¿Ñ€Ğ°Ğ²Ğ¸Ğ»ÑŒĞ½Ğ¾ Ğ²Ğ¸Ğ·Ğ½Ğ°Ñ‡Ğ¸Ñ‚Ğ¸: Ñ…Ñ‚Ğ¾ Ğ³Ğ¾Ğ²Ğ¾Ñ€Ğ¸Ñ‚ÑŒ, Ğ¿Ñ€Ğ¾ ĞºĞ¾Ğ³Ğ¾, Ñ‡Ğ¸ Ğ´Ñ–Ñ Ñ‰Ğµ Ğ°ĞºÑ‚ÑƒĞ°Ğ»ÑŒĞ½Ğ°. Ğ’Ğ¸ĞºĞ¾Ñ€Ğ¸ÑÑ‚Ğ¾Ğ²ÑƒĞ¹Ñ‚Ğµ Ñ€Ñ–Ğ·Ğ½Ñ– Ğ´Ñ–Ñ”ÑĞ»Ğ¾Ğ²Ğ° Ğ²Ğ²ĞµĞ´ĞµĞ½Ğ½Ñ Ğ´Ğ»Ñ Ñ‚Ğ¾Ñ‡Ğ½Ğ¾Ñ— Ğ¿ĞµÑ€ĞµĞ´Ğ°Ñ‡Ñ– Ğ½ÑĞ°Ğ½ÑÑ–Ğ²!\n\n**Ğ”Ğ°Ğ»Ñ–:**\n\nĞ£ Ğ½Ğ°ÑÑ‚ÑƒĞ¿Ğ½Ğ¾Ğ¼Ñƒ Ğ¼Ğ¾Ğ´ÑƒĞ»Ñ– (Ğœ40) Ğ¼Ğ¸ Ñ€Ğ¾Ğ·Ğ³Ğ»ÑĞ½ĞµĞ¼Ğ¾ **Ğ½ĞµĞ¿Ñ€ÑĞ¼Ñ– Ğ¿Ğ¸Ñ‚Ğ°Ğ½Ğ½Ñ Ñ‚Ğ° Ğ½Ğ°ĞºĞ°Ğ·Ğ¸** â€” ÑĞº Ğ¿ĞµÑ€ĞµĞ´Ğ°Ğ²Ğ°Ñ‚Ğ¸ Ñ‡ÑƒĞ¶Ñ– Ğ¿Ğ¸Ñ‚Ğ°Ğ½Ğ½Ñ Ñ‚Ğ° ĞºĞ¾Ğ¼Ğ°Ğ½Ğ´Ğ¸: Â«Ğ’Ñ–Ğ½ Ğ·Ğ°Ğ¿Ğ¸Ñ‚Ğ°Ğ², Ñ‡Ğ¸...Â», Â«Ğ’Ğ¾Ğ½Ğ° Ğ¿Ğ¾Ğ¿Ñ€Ğ¾ÑĞ¸Ğ»Ğ°, Ñ‰Ğ¾Ğ±...Â». Ğ¦Ğµ Ğ·Ğ°Ğ²ĞµÑ€ÑˆĞ¸Ñ‚ÑŒ Ñ‚ĞµĞ¼Ñƒ Ğ½ĞµĞ¿Ñ€ÑĞ¼Ğ¾Ñ— Ğ¼Ğ¾Ğ²Ğ¸!\n\n> âœ… **Ğ¡Ğ°Ğ¼Ğ¾Ğ¿ĞµÑ€ĞµĞ²Ñ–Ñ€ĞºĞ°**\n>\n> Ğ§Ğ¸ Ğ¼Ğ¾Ğ¶ĞµÑ‚Ğµ Ğ²Ğ¸:\n> - [ ] ĞŸĞµÑ€ĞµÑ‚Ğ²Ğ¾Ñ€Ğ¸Ñ‚Ğ¸ Ğ¿Ñ€ÑĞ¼Ñƒ Ğ¼Ğ¾Ğ²Ñƒ Ğ½Ğ° Ğ½ĞµĞ¿Ñ€ÑĞ¼Ñƒ?\n> - [ ] ĞŸÑ€Ğ°Ğ²Ğ¸Ğ»ÑŒĞ½Ğ¾ Ğ·Ğ¼Ñ–Ğ½Ğ¸Ñ‚Ğ¸ Ğ·Ğ°Ğ¹Ğ¼ĞµĞ½Ğ½Ğ¸ĞºĞ¸?\n> - [ ] Ğ’Ğ¸Ğ·Ğ½Ğ°Ñ‡Ğ¸Ñ‚Ğ¸, Ñ‡Ğ¸ Ğ¿Ğ¾Ñ‚Ñ€Ñ–Ğ±ĞµĞ½ Ğ·ÑÑƒĞ² Ñ‡Ğ°ÑÑƒ?\n> - [ ] Ğ’Ğ¸ĞºĞ¾Ñ€Ğ¸ÑÑ‚Ğ°Ñ‚Ğ¸ Ñ€Ñ–Ğ·Ğ½Ñ– Ğ´Ñ–Ñ”ÑĞ»Ğ¾Ğ²Ğ° Ğ²Ğ²ĞµĞ´ĞµĞ½Ğ½Ñ?\n>\n> Ğ¯ĞºÑ‰Ğ¾ Ñ‚Ğ°Ğº â€” Ğ¿ĞµÑ€ĞµÑ…Ğ¾Ğ´ÑŒÑ‚Ğµ Ğ´Ğ¾ Ğ²Ğ¿Ñ€Ğ°Ğ²!\n\n---\n\n> [!resources] ğŸ§ Ğ—Ğ¾Ğ²Ğ½Ñ–ÑˆĞ½Ñ– Ñ€ĞµÑÑƒÑ€ÑĞ¸\n>\n> **Ğ”Ğ¾Ğ´Ğ°Ñ‚ĞºĞ¾Ğ²Ñ– Ğ¼Ğ°Ñ‚ĞµÑ€Ñ–Ğ°Ğ»Ğ¸ Ğ´Ğ»Ñ Ğ²Ğ¸Ğ²Ñ‡ĞµĞ½Ğ½Ñ:**\n> - ğŸ“– [ĞĞµĞ¿Ñ€ÑĞ¼Ğ° Ğ¼Ğ¾Ğ²Ğ°](https://uk.wikipedia.org/wiki/ĞĞµĞ¿Ñ€ÑĞ¼Ğ°_Ğ¼Ğ¾Ğ²Ğ°) â€” Ğ’Ñ–ĞºÑ–Ğ¿ĞµĞ´Ñ–Ñ\n> - ğŸ“º [Ukrainian Grammar](https://www.youtube.com/@ukrainianlesson) â€” Ğ²Ñ–Ğ´ĞµĞ¾ÑƒÑ€Ğ¾ĞºĞ¸\n> - ğŸ§ [Ukrainian Lessons Podcast](https://ukrainianlessons.com/) â€” Ğ¿Ğ¾Ğ´ĞºĞ°ÑÑ‚ Ğ´Ğ»Ñ Ğ²Ğ¸Ğ²Ñ‡ĞµĞ½Ğ½Ñ\n\n---"
      },
      {
        "id": "section-2",
        "name": "Ğ’Ğ¿Ñ€Ğ°Ğ²Ğ¸",
        "nameEn": null,
        "type": "activities",
        "content": "## quiz: Ğ’Ğ¸Ğ±ĞµÑ€Ñ–Ñ‚ÑŒ Ğ¿Ñ€Ğ°Ğ²Ğ¸Ğ»ÑŒĞ½Ñƒ Ğ²Ñ–Ğ´Ğ¿Ğ¾Ğ²Ñ–Ğ´ÑŒ\n\n1. Ğ¯ĞºĞ° Ğ¾ÑĞ½Ğ¾Ğ²Ğ½Ğ° Ñ„ÑƒĞ½ĞºÑ†Ñ–Ñ ÑĞ¿Ğ¾Ğ»ÑƒÑ‡Ğ½Ğ¸ĞºĞ° Â«Ñ‰Ğ¾Â» Ñƒ Ğ½ĞµĞ¿Ñ€ÑĞ¼Ñ–Ğ¹ Ğ¼Ğ¾Ğ²Ñ– Ğ² ÑƒĞºÑ€Ğ°Ñ—Ğ½ÑÑŒĞºĞ¸Ñ… ÑĞºĞ»Ğ°Ğ´Ğ½Ğ¸Ñ… Ñ€ĞµÑ‡ĞµĞ½Ğ½ÑÑ…?\n   - [ ] Ğ’Ğ²Ğ¾Ğ´Ğ¸Ñ‚ÑŒ Ğ¿Ñ€ÑĞ¼Ñƒ Ñ†Ğ¸Ñ‚Ğ°Ñ‚Ñƒ Ğ· Ğ»Ğ°Ğ¿ĞºĞ°Ğ¼Ğ¸\n   - [x] Ğ—'Ñ”Ğ´Ğ½ÑƒÑ” Ğ³Ğ¾Ğ»Ğ¾Ğ²Ğ½Ğµ Ñ€ĞµÑ‡ĞµĞ½Ğ½Ñ Ğ· Ğ¿Ñ–Ğ´Ñ€ÑĞ´Ğ½Ğ¸Ğ¼\n   - [ ] Ğ—Ğ°Ğ¼Ñ–Ğ½ÑÑ” Ğ´Ñ–Ñ”ÑĞ»Ğ¾Ğ²Ğ¾ Ğ¼Ğ¾Ğ²Ğ»ĞµĞ½Ğ½Ñ\n   - [ ] Ğ’ĞºĞ°Ğ·ÑƒÑ” Ğ½Ğ° Ñ‡Ğ°Ñ Ğ´Ñ–Ñ— Ğ² Ñ€ĞµÑ‡ĞµĞ½Ğ½Ñ–\n   > Â«Ğ©Ğ¾Â» â€” ÑĞ¿Ğ¾Ğ»ÑƒÑ‡Ğ½Ğ¸Ğº, Ñ‰Ğ¾ Ğ·'Ñ”Ğ´Ğ½ÑƒÑ” Ñ‡Ğ°ÑÑ‚Ğ¸Ğ½Ğ¸ Ğ² Ğ½ĞµĞ¿Ñ€ÑĞ¼Ñ–Ğ¹ Ğ¼Ğ¾Ğ²Ñ–.\n\n2. Ğ¯Ğº Ğ¿Ñ€Ğ°Ğ²Ğ¸Ğ»ÑŒĞ½Ğ¾ Ğ¿ĞµÑ€ĞµÑ‚Ğ²Ğ¾Ñ€Ğ¸Ñ‚Ğ¸ Ğ¿Ñ€ÑĞ¼Ñƒ Ğ¼Ğ¾Ğ²Ñƒ Â«Ğ¯ Ğ¿Ñ€Ğ¸Ğ¹Ğ´Ñƒ Ğ·Ğ°Ğ²Ñ‚Ñ€Ğ°Â» Ğ½Ğ° Ğ½ĞµĞ¿Ñ€ÑĞ¼Ñƒ, ÑĞºÑ‰Ğ¾ ÑÑƒĞ±'Ñ”ĞºÑ‚ â€” Ğ²Ñ–Ğ½?\n   - [x] Ğ’Ñ–Ğ½ ÑĞºĞ°Ğ·Ğ°Ğ², Ñ‰Ğ¾ Ğ²Ñ–Ğ½ Ğ¿Ñ€Ğ¸Ğ¹Ğ´Ğµ Ğ·Ğ°Ğ²Ñ‚Ñ€Ğ°.\n   - [ ] Ğ’Ñ–Ğ½ ÑĞºĞ°Ğ·Ğ°Ğ², Ñ‰Ğ¾ Ñ Ğ¿Ñ€Ğ¸Ğ¹Ğ´Ñƒ Ğ·Ğ°Ğ²Ñ‚Ñ€Ğ°.\n   - [ ] Ğ’Ñ–Ğ½ ÑĞºĞ°Ğ·Ğ°Ğ²: Â«Ğ¯ Ğ¿Ñ€Ğ¸Ğ¹Ğ´Ñƒ Ğ·Ğ°Ğ²Ñ‚Ñ€Ğ°.Â»\n   - [ ] Ğ’Ñ–Ğ½ ÑĞºĞ°Ğ·Ğ°Ğ², Ñ‰Ğ¾ Ğ²Ñ–Ğ½ Ğ¿Ñ€Ğ¸Ğ¹Ğ´Ñƒ.\n   > Ğ—Ğ°Ğ¹Ğ¼ĞµĞ½Ğ½Ğ¸Ğº Â«ÑÂ» Ğ·Ğ¼Ñ–Ğ½ÑÑ”Ñ‚ÑŒÑÑ Ğ½Ğ° Â«Ğ²Ñ–Ğ½Â».\n\n3. ĞšĞ¾Ğ»Ğ¸ Ğ² ÑƒĞºÑ€Ğ°Ñ—Ğ½ÑÑŒĞºÑ–Ğ¹ Ğ½ĞµĞ¿Ñ€ÑĞ¼Ñ–Ğ¹ Ğ¼Ğ¾Ğ²Ñ– Ğ¾Ğ±Ğ¾Ğ²'ÑĞ·ĞºĞ¾Ğ²Ğ¾ Ğ¿Ğ¾Ñ‚Ñ€Ñ–Ğ±ĞµĞ½ Ğ·ÑÑƒĞ² Ñ‡Ğ°ÑÑƒ Ğ´Ñ–Ñ”ÑĞ»Ğ¾Ğ²Ğ° Ğ´Ğ¾ Ğ¼Ğ¸Ğ½ÑƒĞ»Ğ¾Ğ³Ğ¾?\n   - [ ] Ğ—Ğ°Ğ²Ğ¶Ğ´Ğ¸, ÑĞº Ğ² Ğ°Ğ½Ğ³Ğ»Ñ–Ğ¹ÑÑŒĞºÑ–Ğ¹ Ğ¼Ğ¾Ğ²Ñ–\n   - [x] ĞšĞ¾Ğ»Ğ¸ Ğ´Ñ–Ñ Ğ²Ğ¶Ğµ Ğ½ĞµĞ°ĞºÑ‚ÑƒĞ°Ğ»ÑŒĞ½Ğ° Ğ½Ğ° Ğ¼Ğ¾Ğ¼ĞµĞ½Ñ‚ Ğ¼Ğ¾Ğ²Ğ»ĞµĞ½Ğ½Ñ\n   - [ ] ĞÑ–ĞºĞ¾Ğ»Ğ¸, Ñ‡Ğ°Ñ Ğ½Ğµ Ğ·Ğ¼Ñ–Ğ½ÑÑ”Ñ‚ÑŒÑÑ\n   - [ ] Ğ¢Ñ–Ğ»ÑŒĞºĞ¸ Ğ· Ğ´Ñ–Ñ”ÑĞ»Ğ¾Ğ²Ğ¾Ğ¼ Â«Ğ±ÑƒÑ‚Ğ¸Â»\n   > Ğ—ÑÑƒĞ² Ğ¿Ğ¾Ñ‚Ñ€Ñ–Ğ±ĞµĞ½, ĞºĞ¾Ğ»Ğ¸ Ğ´Ñ–Ñ Ğ²Ğ¶Ğµ Ğ½Ğµ Ğ²Ñ–Ğ´Ğ±ÑƒĞ²Ğ°Ñ”Ñ‚ÑŒÑÑ.\n\n4. Ğ¯ĞºĞµ Ğ´Ñ–Ñ”ÑĞ»Ğ¾Ğ²Ğ¾ Ğ²Ğ²ĞµĞ´ĞµĞ½Ğ½Ñ Ğ²Ğ¸ĞºĞ¾Ñ€Ğ¸ÑÑ‚Ğ¾Ğ²ÑƒÑ”Ñ‚ÑŒÑÑ Ğ´Ğ»Ñ Ğ¾Ñ„Ñ–Ñ†Ñ–Ğ¹Ğ½Ğ¸Ñ… Ğ·Ğ°ÑĞ² Ñ– Ğ¿Ğ¾Ğ²Ñ–Ğ´Ğ¾Ğ¼Ğ»ĞµĞ½ÑŒ Ñƒ Ğ½ĞµĞ¿Ñ€ÑĞ¼Ñ–Ğ¹ Ğ¼Ğ¾Ğ²Ñ–?\n   - [ ] ÑĞºĞ°Ğ·Ğ°Ñ‚Ğ¸\n   - [x] Ğ·Ğ°ÑĞ²Ğ¸Ñ‚Ğ¸\n   - [ ] Ğ³Ğ¾Ğ²Ğ¾Ñ€Ğ¸Ñ‚Ğ¸\n   - [ ] Ğ·Ğ°ÑƒĞ²Ğ°Ğ¶Ğ¸Ñ‚Ğ¸\n   > Â«Ğ—Ğ°ÑĞ²Ğ¸Ñ‚Ğ¸Â» â€” Ğ¾Ñ„Ñ–Ñ†Ñ–Ğ¹Ğ½Ğµ, Ğ²Ğ¸ĞºĞ¾Ñ€Ğ¸ÑÑ‚Ğ¾Ğ²ÑƒÑ”Ñ‚ÑŒÑÑ Ğ´Ğ»Ñ Ğ·Ğ°ÑĞ².\n\n5. Ğ¯Ğº Ğ·Ğ¼Ñ–Ğ½ÑÑ”Ñ‚ÑŒÑÑ ÑĞ»Ğ¾Ğ²Ğ¾ Â«Ğ·Ğ°Ğ²Ñ‚Ñ€Ğ°Â» Ğ¿Ñ€Ğ¸ Ğ¿ĞµÑ€ĞµÑ…Ğ¾Ğ´Ñ– Ğ´Ğ¾ Ğ½ĞµĞ¿Ñ€ÑĞ¼Ğ¾Ñ— Ğ¼Ğ¾Ğ²Ğ¸, ÑĞºÑ‰Ğ¾ Ñ€Ğ¾Ğ·Ğ¿Ğ¾Ğ²Ñ–Ğ´ÑŒ Ğ²ĞµĞ´ĞµÑ‚ÑŒÑÑ Ğ² Ğ¼Ğ¸Ğ½ÑƒĞ»Ğ¾Ğ¼Ñƒ Ñ‡Ğ°ÑÑ–?\n   - [x] Ğ½Ğ°ÑÑ‚ÑƒĞ¿Ğ½Ğ¾Ğ³Ğ¾ Ğ´Ğ½Ñ\n   - [ ] Ğ·Ğ°Ğ²Ñ‚Ñ€Ğ° (Ğ½Ğµ Ğ·Ğ¼Ñ–Ğ½ÑÑ”Ñ‚ÑŒÑÑ)\n   - [ ] Ñ‚Ğ¾Ğ³Ğ¾ Ğ´Ğ½Ñ\n   - [ ] Ğ½Ğ°Ğ¿ĞµÑ€ĞµĞ´Ğ¾Ğ´Ğ½Ñ–\n   > Â«Ğ—Ğ°Ğ²Ñ‚Ñ€Ğ°Â» â†’ Â«Ğ½Ğ°ÑÑ‚ÑƒĞ¿Ğ½Ğ¾Ğ³Ğ¾ Ğ´Ğ½ÑÂ» Ğ² Ğ¼Ğ¸Ğ½ÑƒĞ»Ğ¾Ğ¼Ñƒ ĞºĞ¾Ğ½Ñ‚ĞµĞºÑÑ‚Ñ–.\n\n6. Ğ¯ĞºĞ° Ñ€Ñ–Ğ·Ğ½Ğ¸Ñ†Ñ Ğ¼Ñ–Ğ¶ Ğ´Ñ–Ñ”ÑĞ»Ğ¾Ğ²Ğ°Ğ¼Ğ¸ Â«ÑÑ‚Ğ²ĞµÑ€Ğ´Ğ¶ÑƒĞ²Ğ°Ñ‚Ğ¸Â» Ñ‚Ğ° Â«ÑĞºĞ°Ğ·Ğ°Ñ‚Ğ¸Â» Ñƒ Ğ²Ğ²ĞµĞ´ĞµĞ½Ğ½Ñ– Ğ½ĞµĞ¿Ñ€ÑĞ¼Ğ¾Ñ— Ğ¼Ğ¾Ğ²Ğ¸ Ğ² ÑƒĞºÑ€Ğ°Ñ—Ğ½ÑÑŒĞºÑ–Ğ¹?\n   - [ ] ĞĞµĞ¼Ğ°Ñ” Ñ€Ñ–Ğ·Ğ½Ğ¸Ñ†Ñ–, Ğ²Ğ¾Ğ½Ğ¸ ÑĞ¸Ğ½Ğ¾Ğ½Ñ–Ğ¼Ğ¸\n   - [x] Â«Ğ¡Ñ‚Ğ²ĞµÑ€Ğ´Ğ¶ÑƒĞ²Ğ°Ñ‚Ğ¸Â» Ğ¼Ğ¾Ğ¶Ğµ Ğ¾Ğ·Ğ½Ğ°Ñ‡Ğ°Ñ‚Ğ¸ ÑÑƒĞ¼Ğ½Ñ–Ğ² Ñƒ Ğ¿Ñ€Ğ°Ğ²Ğ´Ğ¸Ğ²Ğ¾ÑÑ‚Ñ–\n   - [ ] Â«Ğ¡Ñ‚Ğ²ĞµÑ€Ğ´Ğ¶ÑƒĞ²Ğ°Ñ‚Ğ¸Â» â€” Ğ½ĞµÑ„Ğ¾Ñ€Ğ¼Ğ°Ğ»ÑŒĞ½Ğµ\n   - [ ] Â«Ğ¡ĞºĞ°Ğ·Ğ°Ñ‚Ğ¸Â» â€” Ñ‚Ñ–Ğ»ÑŒĞºĞ¸ Ğ´Ğ»Ñ Ğ¾Ñ„Ñ–Ñ†Ñ–Ğ¹Ğ½Ğ¸Ñ… ĞºĞ¾Ğ½Ñ‚ĞµĞºÑÑ‚Ñ–Ğ²\n   > Â«Ğ¡Ñ‚Ğ²ĞµÑ€Ğ´Ğ¶ÑƒÑ”Â» Ğ¼Ğ¾Ğ¶Ğµ Ğ²Ğ¸Ñ€Ğ°Ğ¶Ğ°Ñ‚Ğ¸ Ğ´Ğ¸ÑÑ‚Ğ°Ğ½Ñ†Ñ–Ñ Ğ²Ñ–Ğ´ Ñ–Ğ½Ñ„Ğ¾Ñ€Ğ¼Ğ°Ñ†Ñ–Ñ—.\n\n7. Ğ¯Ğº Ğ¿Ñ€Ğ°Ğ²Ğ¸Ğ»ÑŒĞ½Ğ¾ Ğ¿ĞµÑ€ĞµĞ´Ğ°Ñ‚Ğ¸ Ğ½ĞµĞ¿Ñ€ÑĞ¼Ñƒ Ğ¼Ğ¾Ğ²Ñƒ Ğ· Ğ¼Ğ¾Ğ´Ğ°Ğ»ÑŒĞ½Ğ¸Ğ¼ Ğ´Ñ–Ñ”ÑĞ»Ğ¾Ğ²Ğ¾Ğ¼: Â«Ğ¯ Ğ¼Ğ¾Ğ¶Ñƒ Ğ´Ğ¾Ğ¿Ğ¾Ğ¼Ğ¾Ğ³Ñ‚Ğ¸ Ñ‚Ğ¾Ğ±Ñ– Ğ· Ñ†Ğ¸Ğ¼Â»?\n   - [x] Ğ’Ñ–Ğ½ ÑĞºĞ°Ğ·Ğ°Ğ², Ñ‰Ğ¾ Ğ¼Ğ¾Ğ¶Ğµ Ğ´Ğ¾Ğ¿Ğ¾Ğ¼Ğ¾Ğ³Ñ‚Ğ¸ Ğ¼ĞµĞ½Ñ– Ğ· Ñ†Ğ¸Ğ¼.\n   - [ ] Ğ’Ñ–Ğ½ ÑĞºĞ°Ğ·Ğ°Ğ², Ñ‰Ğ¾ Ğ¼Ñ–Ğ³ Ğ´Ğ¾Ğ¿Ğ¾Ğ¼Ğ¾Ğ³Ñ‚Ğ¸.\n   - [ ] Ğ’Ñ–Ğ½ ÑĞºĞ°Ğ·Ğ°Ğ²: Â«Ğ¯ Ğ¼Ğ¾Ğ¶Ñƒ Ğ´Ğ¾Ğ¿Ğ¾Ğ¼Ğ¾Ğ³Ñ‚Ğ¸.Â»\n   - [ ] Ğ’Ñ–Ğ½ ÑĞºĞ°Ğ·Ğ°Ğ², Ñ‰Ğ¾ Ñ Ğ¼Ğ¾Ğ¶Ñƒ Ğ´Ğ¾Ğ¿Ğ¾Ğ¼Ğ¾Ğ³Ñ‚Ğ¸.\n   > ĞœĞ¾Ğ´Ğ°Ğ»ÑŒĞ½Ñ– Ğ´Ñ–Ñ”ÑĞ»Ğ¾Ğ²Ğ° Ñ‡Ğ°ÑÑ‚Ğ¾ Ğ·Ğ±ĞµÑ€Ñ–Ğ³Ğ°ÑÑ‚ÑŒ Ñ„Ğ¾Ñ€Ğ¼Ñƒ.\n\n8. Ğ£ ÑĞºĞ¾Ğ¼Ñƒ Ğ¿Ğ¾Ñ€ÑĞ´ĞºÑƒ ÑĞ»Ñ–Ğ´ Ğ·Ğ´Ñ–Ğ¹ÑĞ½ÑĞ²Ğ°Ñ‚Ğ¸ Ğ¿ĞµÑ€ĞµĞµÑ‚Ğ²Ğ¾Ñ€ĞµĞ½Ğ½Ñ Ğ¿Ñ€ÑĞ¼Ğ¾Ñ— Ğ¼Ğ¾Ğ²Ğ¸ Ğ½Ğ° Ğ½ĞµĞ¿Ñ€ÑĞ¼Ñƒ Ğ² ÑƒĞºÑ€Ğ°Ñ—Ğ½ÑÑŒĞºÑ–Ğ¹ Ğ¼Ğ¾Ğ²Ñ–?\n   - [x] Ğ”Ñ–Ñ”ÑĞ»Ğ¾Ğ²Ğ¾ Ğ²Ğ²ĞµĞ´ĞµĞ½Ğ½Ñ â†’ Ñ‰Ğ¾ â†’ Ğ·Ğ¼Ñ–Ğ½Ğ° Ğ·Ğ°Ğ¹Ğ¼ĞµĞ½Ğ½Ğ¸ĞºÑ–Ğ² â†’ Ğ·Ğ¼Ñ–Ğ½Ğ° Ñ‡Ğ°ÑÑƒ\n   - [ ] Ğ—Ğ¼Ñ–Ğ½Ğ° Ñ‡Ğ°ÑÑƒ â†’ Ğ·Ğ¼Ñ–Ğ½Ğ° Ğ·Ğ°Ğ¹Ğ¼ĞµĞ½Ğ½Ğ¸ĞºÑ–Ğ² â†’ Ñ‰Ğ¾ â†’ Ğ´Ñ–Ñ”ÑĞ»Ğ¾Ğ²Ğ¾\n   - [ ] Ğ—Ğ¼Ñ–Ğ½Ğ° Ğ·Ğ°Ğ¹Ğ¼ĞµĞ½Ğ½Ğ¸ĞºÑ–Ğ² â†’ Ğ´Ñ–Ñ”ÑĞ»Ğ¾Ğ²Ğ¾ â†’ Ñ‰Ğ¾ â†’ Ñ‡Ğ°Ñ\n   - [ ] ĞĞµĞ¼Ğ°Ñ” Ğ¿Ğ¾Ñ€ÑĞ´ĞºÑƒ, Ğ²ÑĞµ Ğ¾Ğ´Ğ½Ğ¾Ñ‡Ğ°ÑĞ½Ğ¾\n   > Ğ›Ğ¾Ğ³Ñ–Ñ‡Ğ½Ğ¸Ğ¹ Ğ¿Ğ¾Ñ€ÑĞ´Ğ¾Ğº: Ğ´Ñ–Ñ”ÑĞ»Ğ¾Ğ²Ğ¾, Ñ‰Ğ¾, Ğ·Ğ°Ğ¹Ğ¼ĞµĞ½Ğ½Ğ¸ĞºĞ¸, Ñ‡Ğ°Ñ.\n\n---\n\n## match-up: Ğ—'Ñ”Ğ´Ğ½Ğ°Ğ¹Ñ‚Ğµ Ğ´Ñ–Ñ”ÑĞ»Ğ¾Ğ²Ğ¾ Ğ²Ğ²ĞµĞ´ĞµĞ½Ğ½Ñ Ğ· Ğ¹Ğ¾Ğ³Ğ¾ Ğ·Ğ½Ğ°Ñ‡ĞµĞ½Ğ½ÑĞ¼\n\n- ÑĞºĞ°Ğ·Ğ°Ñ‚Ğ¸ :: Ğ·Ğ°Ğ³Ğ°Ğ»ÑŒĞ½Ğµ Ğ½ĞµĞ¹Ñ‚Ñ€Ğ°Ğ»ÑŒĞ½Ğµ Ğ¿Ğ¾Ğ²Ñ–Ğ´Ğ¾Ğ¼Ğ»ĞµĞ½Ğ½Ñ\n- Ğ³Ğ¾Ğ²Ğ¾Ñ€Ğ¸Ñ‚Ğ¸ :: Ñ‚Ñ€Ğ¸Ğ²Ğ°Ğ»Ğ° Ñ€Ğ¾Ğ·Ğ¼Ğ¾Ğ²Ğ° Ğ°Ğ±Ğ¾ Ğ¾Ğ±Ğ³Ğ¾Ğ²Ğ¾Ñ€ĞµĞ½Ğ½Ñ\n- Ğ¿Ğ¾Ğ²Ñ–Ğ´Ğ¾Ğ¼Ğ¸Ñ‚Ğ¸ :: Ğ¾Ñ„Ñ–Ñ†Ñ–Ğ¹Ğ½Ğ° Ğ¿ĞµÑ€ĞµĞ´Ğ°Ñ‡Ğ° Ñ–Ğ½Ñ„Ğ¾Ñ€Ğ¼Ğ°Ñ†Ñ–Ñ—\n- Ğ·Ğ°ÑĞ²Ğ¸Ñ‚Ğ¸ :: Ğ¾Ñ„Ñ–Ñ†Ñ–Ğ¹Ğ½Ğ° Ğ¿ÑƒĞ±Ğ»Ñ–Ñ‡Ğ½Ğ° Ğ·Ğ°ÑĞ²Ğ°\n- Ğ¿Ğ¾ÑÑĞ½Ğ¸Ñ‚Ğ¸ :: Ñ€Ğ¾Ğ·'ÑÑĞ½ĞµĞ½Ğ½Ñ ÑĞºĞ»Ğ°Ğ´Ğ½Ğ¾Ğ³Ğ¾ Ğ¿Ğ¸Ñ‚Ğ°Ğ½Ğ½Ñ\n- Ğ´Ğ¾Ğ´Ğ°Ñ‚Ğ¸ :: Ğ´Ğ¾Ğ´Ğ°Ñ‚ĞºĞ¾Ğ²Ğ° Ñ–Ğ½Ñ„Ğ¾Ñ€Ğ¼Ğ°Ñ†Ñ–Ñ Ğ´Ğ¾ ÑĞºĞ°Ğ·Ğ°Ğ½Ğ¾Ğ³Ğ¾\n- Ğ·Ğ°ÑƒĞ²Ğ°Ğ¶Ğ¸Ñ‚Ğ¸ :: ĞºĞ¾Ñ€Ğ¾Ñ‚ĞºĞ¸Ğ¹ ĞºĞ¾Ğ¼ĞµĞ½Ñ‚Ğ°Ñ€\n- ÑÑ‚Ğ²ĞµÑ€Ğ´Ğ¶ÑƒĞ²Ğ°Ñ‚Ğ¸ :: Ğ½Ğ°Ğ¿Ğ¾Ğ»ÑĞ³Ğ°Ğ½Ğ½Ñ Ğ½Ğ° Ğ¿Ñ€Ğ°Ğ²Ğ´Ğ¸Ğ²Ğ¾ÑÑ‚Ñ–\n- Ğ²Ğ¸Ğ·Ğ½Ğ°Ñ‚Ğ¸ :: Ğ²Ğ¸Ğ·Ğ½Ğ°Ğ½Ğ½Ñ Ñ„Ğ°ĞºÑ‚Ñƒ Ğ°Ğ±Ğ¾ Ğ¿Ğ¾Ğ¼Ğ¸Ğ»ĞºĞ¸\n- Ğ·Ğ°Ğ¿ĞµÑ€ĞµÑ‡Ğ¸Ñ‚Ğ¸ :: Ğ²Ñ–Ğ´Ğ¼Ğ¾Ğ²Ğ° Ğ°Ğ±Ğ¾ Ğ·Ğ°Ğ¿ĞµÑ€ĞµÑ‡ĞµĞ½Ğ½Ñ Ñ„Ğ°ĞºÑ‚Ñƒ\n- Ğ¿Ñ–Ğ´Ñ‚Ğ²ĞµÑ€Ğ´Ğ¸Ñ‚Ğ¸ :: Ğ¿Ñ–Ğ´Ñ‚Ğ²ĞµÑ€Ğ´Ğ¶ĞµĞ½Ğ½Ñ Ñ–Ğ½Ñ„Ğ¾Ñ€Ğ¼Ğ°Ñ†Ñ–Ñ—\n- Ğ½Ğ°Ñ‚ÑĞºĞ½ÑƒÑ‚Ğ¸ :: Ğ½ĞµĞ¿Ñ€ÑĞ¼Ğ° Ğ²ĞºĞ°Ğ·Ñ–Ğ²ĞºĞ° Ğ½Ğ° Ñ‰Ğ¾ÑÑŒ\n\n---\n\n## fill-in: Ğ”Ğ¾Ğ¿Ğ¾Ğ²Ğ½Ñ–Ñ‚ÑŒ Ñ€ĞµÑ‡ĞµĞ½Ğ½Ñ Ğ¿Ñ€Ğ°Ğ²Ğ¸Ğ»ÑŒĞ½Ğ¸Ğ¼ ÑĞ¿Ğ¾Ğ»ÑƒÑ‡Ğ½Ğ¸ĞºĞ¾Ğ¼ Ğ°Ğ±Ğ¾ Ğ·Ğ°Ğ¹Ğ¼ĞµĞ½Ğ½Ğ¸ĞºĞ¾Ğ¼\n\n1. Ğ’Ñ–Ğ½ ÑĞºĞ°Ğ·Ğ°Ğ², ___ Ğ²Ñ–Ğ½ Ğ¿Ñ€Ğ¸Ğ¹Ğ´Ğµ Ğ·Ğ°Ğ²Ñ‚Ñ€Ğ° Ğ½Ğ° Ğ·ÑƒÑÑ‚Ñ€Ñ–Ñ‡.\n   > [!answer] Ñ‰Ğ¾\n   > [!options] Ñ‰Ğ¾ | ÑĞºĞ¸Ğ¹ | ĞºĞ¾Ğ»Ğ¸ | Ñ‚Ğ¾Ğ¼Ñƒ Ñ‰Ğ¾\n\n2. Ğ’Ğ¾Ğ½Ğ° ÑĞºĞ°Ğ·Ğ°Ğ»Ğ°, Ñ‰Ğ¾ ___ Ğ»ÑĞ±Ğ¸Ñ‚ÑŒ Ñ†Ñ ĞºĞ½Ğ¸Ğ³Ñƒ.\n   > [!answer] Ğ²Ğ¾Ğ½Ğ°\n   > [!options] Ğ²Ğ¾Ğ½Ğ° | Ñ | Ñ‚Ğ¸ | Ğ²Ñ–Ğ½\n\n3. ĞœĞ°Ñ€Ñ–Ñ Ğ¿Ğ¾ÑÑĞ½Ğ¸Ğ»Ğ°, ___ Ğ²Ğ¾Ğ½Ğ° Ğ·Ğ°Ğ¿Ñ–Ğ·Ğ½ÑÑ”Ñ‚ÑŒÑÑ Ñ‡ĞµÑ€ĞµĞ· Ğ·Ğ°Ñ‚Ğ¾Ñ€.\n   > [!answer] Ñ‰Ğ¾\n   > [!options] Ñ‰Ğ¾ | Ñ‚Ğ¾Ğ¼Ñƒ Ñ‰Ğ¾ | Ñ‡Ğ¾Ğ¼Ñƒ | Ğ±Ğ¾\n\n4. ĞŸĞµÑ‚Ñ€Ğ¾ ÑĞºĞ°Ğ·Ğ°Ğ², Ñ‰Ğ¾ Ğ¿Ñ€Ğ¸Ñ—Ğ´Ğµ ___ Ğ´Ğ½Ñ Ğ½Ğ° Ğ½Ğ°ÑˆÑƒ Ğ²ĞµÑ‡Ñ–Ñ€ĞºÑƒ.\n   > [!answer] Ğ½Ğ°ÑÑ‚ÑƒĞ¿Ğ½Ğ¾Ğ³Ğ¾\n   > [!options] Ğ½Ğ°ÑÑ‚ÑƒĞ¿Ğ½Ğ¾Ğ³Ğ¾ | Ğ·Ğ°Ğ²Ñ‚Ñ€Ğ° | ÑÑŒĞ¾Ğ³Ğ¾Ğ´Ğ½Ñ– | Ñ‚Ğ¾Ğ³Ğ¾\n\n5. Ğ’Ğ¾Ğ½Ğ° Ğ´Ğ¾Ğ´Ğ°Ğ»Ğ°, Ñ‰Ğ¾ Ğ±ÑƒĞ´Ğµ Ñ‡ĞµĞºĞ°Ñ‚Ğ¸ Ğ½Ğ° Ğ½Ğ°Ñ ___.\n   > [!answer] Ñ‚Ğ°Ğ¼\n   > [!options] Ñ‚Ğ°Ğ¼ | Ñ‚ÑƒÑ‚ | Ğ·Ğ°Ñ€Ğ°Ğ· | Ğ·Ğ°Ğ²Ñ‚Ñ€Ğ°\n\n6. Ğ¨ĞµÑ„ ___, Ñ‰Ğ¾ Ğ¿Ñ€Ğ¾ĞµĞºÑ‚ Ğ¼Ğ°Ñ” Ğ±ÑƒÑ‚Ğ¸ Ğ·Ğ°Ğ²ĞµÑ€ÑˆĞµĞ½Ğ¸Ğ¹.\n   > [!answer] Ğ·Ğ°ÑĞ²Ğ¸Ğ²\n   > [!options] Ğ·Ğ°ÑĞ²Ğ¸Ğ² | Ğ³Ğ¾Ğ²Ğ¾Ñ€Ğ¸Ğ² | ĞºĞ°Ğ¶Ğµ | ÑĞºĞ°Ğ·Ğ°Ñ‚Ğ¸\n\n7. Ğ’Ñ–Ğ½ Ğ·Ğ°ÑƒĞ²Ğ°Ğ¶Ğ¸Ğ², ___ Ğ¿Ğ¾Ğ³Ğ¾Ğ´Ğ° ÑÑŒĞ¾Ğ³Ğ¾Ğ´Ğ½Ñ– Ğ³Ğ°Ñ€Ğ½Ğ°.\n   > [!answer] Ñ‰Ğ¾\n   > [!options] Ñ‰Ğ¾ | ÑĞºĞ° | Ñ‚Ğ¾Ğ¼Ñƒ Ñ‰Ğ¾ | Ğ±Ğ¾\n\n8. Ğ’Ğ¾Ğ½Ğ° ÑĞºĞ°Ğ·Ğ°Ğ»Ğ°, Ñ‰Ğ¾ ___ ĞºĞ½Ğ¸Ğ³Ğ° Ñ†Ñ–ĞºĞ°Ğ²Ğ°.\n   > [!answer] Ñ†Ñ\n   > [!options] Ñ†Ñ | Ñ‚Ğ° | ÑĞºĞ° | ĞºĞ¾Ñ‚Ñ€Ğ°\n\n---\n\n## true-false: ĞŸÑ€Ğ°Ğ²Ğ´Ğ° Ñ‡Ğ¸ Ğ½ĞµĞ¿Ñ€Ğ°Ğ²Ğ´Ğ°?\n\n1. Ğ’ ÑƒĞºÑ€Ğ°Ñ—Ğ½ÑÑŒĞºÑ–Ğ¹ Ğ½ĞµĞ¿Ñ€ÑĞ¼Ñ–Ğ¹ Ğ¼Ğ¾Ğ²Ñ– ÑĞ¿Ğ¾Ğ»ÑƒÑ‡Ğ½Ğ¸Ğº Â«Ñ‰Ğ¾Â» Ğ¾Ğ±Ğ¾Ğ²'ÑĞ·ĞºĞ¾Ğ²Ğ¸Ğ¹ Ñƒ Ğ¿Ğ¸ÑÑŒĞ¼Ğ¾Ğ²Ğ¸Ñ… Ñ‚ĞµĞºÑÑ‚Ğ°Ñ….\n   - [x] ĞŸÑ€Ğ°Ğ²Ğ´Ğ°\n   - [ ] ĞĞµĞ¿Ñ€Ğ°Ğ²Ğ´Ğ°\n\n2. Ğ—ÑÑƒĞ² Ñ‡Ğ°ÑÑ–Ğ² Ñƒ Ğ½ĞµĞ¿Ñ€ÑĞ¼Ñ–Ğ¹ Ğ¼Ğ¾Ğ²Ñ– Ğ·Ğ°Ğ²Ğ¶Ğ´Ğ¸ Ğ¾Ğ±Ğ¾Ğ²'ÑĞ·ĞºĞ¾Ğ²Ğ¸Ğ¹, ÑĞº Ğ² Ğ°Ğ½Ğ³Ğ»Ñ–Ğ¹ÑÑŒĞºÑ–Ğ¹.\n   - [ ] ĞŸÑ€Ğ°Ğ²Ğ´Ğ°\n   - [x] ĞĞµĞ¿Ñ€Ğ°Ğ²Ğ´Ğ°\n\n3. ĞŸÑ€Ğ¸ Ğ¿ĞµÑ€ĞµÑ…Ğ¾Ğ´Ñ– Ğ´Ğ¾ Ğ½ĞµĞ¿Ñ€ÑĞ¼Ğ¾Ñ— Ğ¼Ğ¾Ğ²Ğ¸ Ğ·Ğ°Ğ¹Ğ¼ĞµĞ½Ğ½Ğ¸Ğº Â«ÑÂ» Ğ·Ğ°Ğ²Ğ¶Ğ´Ğ¸ Ğ·Ğ¼Ñ–Ğ½ÑÑ”Ñ‚ÑŒÑÑ.\n   - [x] ĞŸÑ€Ğ°Ğ²Ğ´Ğ°\n   - [ ] ĞĞµĞ¿Ñ€Ğ°Ğ²Ğ´Ğ°\n\n4. Ğ¡Ğ»Ğ¾Ğ²Ğ¾ Â«Ğ·Ğ°Ğ²Ñ‚Ñ€Ğ°Â» Ğ² Ğ½ĞµĞ¿Ñ€ÑĞ¼Ñ–Ğ¹ Ğ¼Ğ¾Ğ²Ñ– Ğ² Ğ¼Ğ¸Ğ½ÑƒĞ»Ğ¾Ğ¼Ñƒ ÑÑ‚Ğ°Ñ” Â«Ğ½Ğ°ÑÑ‚ÑƒĞ¿Ğ½Ğ¾Ğ³Ğ¾ Ğ´Ğ½ÑÂ».\n   - [x] ĞŸÑ€Ğ°Ğ²Ğ´Ğ°\n   - [ ] ĞĞµĞ¿Ñ€Ğ°Ğ²Ğ´Ğ°\n\n5. Ğ”Ñ–Ñ”ÑĞ»Ğ¾Ğ²Ğ° Â«ÑĞºĞ°Ğ·Ğ°Ñ‚Ğ¸Â» Ñ– Â«Ğ·Ğ°ÑĞ²Ğ¸Ñ‚Ğ¸Â» Ğ¼Ğ°ÑÑ‚ÑŒ Ğ¾Ğ´Ğ½Ğ°ĞºĞ¾Ğ²Ğµ Ğ·Ğ½Ğ°Ñ‡ĞµĞ½Ğ½Ñ.\n   - [ ] ĞŸÑ€Ğ°Ğ²Ğ´Ğ°\n   - [x] ĞĞµĞ¿Ñ€Ğ°Ğ²Ğ´Ğ°\n\n6. Ğ£ Ñ€Ğ¾Ğ·Ğ¼Ğ¾Ğ²Ğ½Ğ¾Ğ¼Ñƒ ÑÑ‚Ğ¸Ğ»Ñ– ÑĞ¿Ğ¾Ğ»ÑƒÑ‡Ğ½Ğ¸Ğº Â«Ñ‰Ğ¾Â» Ğ¼Ğ¾Ğ¶Ğ½Ğ° Ğ¾Ğ¿ÑƒÑĞºĞ°Ñ‚Ğ¸.\n   - [x] ĞŸÑ€Ğ°Ğ²Ğ´Ğ°\n   - [ ] ĞĞµĞ¿Ñ€Ğ°Ğ²Ğ´Ğ°\n\n7. ĞœĞ¾Ğ´Ğ°Ğ»ÑŒĞ½Ñ– Ğ´Ñ–Ñ”ÑĞ»Ğ¾Ğ²Ğ° Ğ² Ğ½ĞµĞ¿Ñ€ÑĞ¼Ñ–Ğ¹ Ğ¼Ğ¾Ğ²Ñ– Ğ·Ğ°Ğ²Ğ¶Ğ´Ğ¸ Ğ·Ğ¼Ñ–Ğ½ÑÑÑ‚ÑŒ Ñ„Ğ¾Ñ€Ğ¼Ñƒ.\n   - [ ] ĞŸÑ€Ğ°Ğ²Ğ´Ğ°\n   - [x] ĞĞµĞ¿Ñ€Ğ°Ğ²Ğ´Ğ°\n\n8. Â«Ğ¡Ñ‚Ğ²ĞµÑ€Ğ´Ğ¶ÑƒĞ²Ğ°Ñ‚Ğ¸Â» Ğ¼Ğ¾Ğ¶Ğµ Ğ²Ğ¸Ñ€Ğ°Ğ¶Ğ°Ñ‚Ğ¸ ÑÑƒĞ¼Ğ½Ñ–Ğ² Ñƒ Ğ¿Ñ€Ğ°Ğ²Ğ´Ğ¸Ğ²Ğ¾ÑÑ‚Ñ– Ñ–Ğ½Ñ„Ğ¾Ñ€Ğ¼Ğ°Ñ†Ñ–Ñ—.\n   - [x] ĞŸÑ€Ğ°Ğ²Ğ´Ğ°\n   - [ ] ĞĞµĞ¿Ñ€Ğ°Ğ²Ğ´Ğ°\n\n---\n\n## group-sort: Ğ Ğ¾Ğ·Ğ¿Ğ¾Ğ´Ñ–Ğ»Ñ–Ñ‚ÑŒ Ğ´Ñ–Ñ”ÑĞ»Ğ¾Ğ²Ğ° Ğ·Ğ° ÑÑ‚ÑƒĞ¿ĞµĞ½ĞµĞ¼ Ñ„Ğ¾Ñ€Ğ¼Ğ°Ğ»ÑŒĞ½Ğ¾ÑÑ‚Ñ–\n\n### ĞĞµĞ¹Ñ‚Ñ€Ğ°Ğ»ÑŒĞ½Ñ– (Ñ€Ğ¾Ğ·Ğ¼Ğ¾Ğ²Ğ½Ñ–)\n- ÑĞºĞ°Ğ·Ğ°Ñ‚Ğ¸\n- Ğ³Ğ¾Ğ²Ğ¾Ñ€Ğ¸Ñ‚Ğ¸\n- Ğ´Ğ¾Ğ´Ğ°Ñ‚Ğ¸\n- Ğ·Ğ°ÑƒĞ²Ğ°Ğ¶Ğ¸Ñ‚Ğ¸\n\n### Ğ¤Ğ¾Ñ€Ğ¼Ğ°Ğ»ÑŒĞ½Ñ– (Ğ¾Ñ„Ñ–Ñ†Ñ–Ğ¹Ğ½Ñ–)\n- Ğ·Ğ°ÑĞ²Ğ¸Ñ‚Ğ¸\n- Ğ¿Ğ¾Ğ²Ñ–Ğ´Ğ¾Ğ¼Ğ¸Ñ‚Ğ¸\n- Ğ¿Ñ–Ğ´Ñ‚Ğ²ĞµÑ€Ğ´Ğ¸Ñ‚Ğ¸\n- ĞºĞ¾Ğ½ÑÑ‚Ğ°Ñ‚ÑƒĞ²Ğ°Ñ‚Ğ¸\n\n### Ğ•Ğ¼Ğ¾Ñ†Ñ–Ğ¹Ğ½Ğ¾ Ğ·Ğ°Ğ±Ğ°Ñ€Ğ²Ğ»ĞµĞ½Ñ–\n- ÑÑ‚Ğ²ĞµÑ€Ğ´Ğ¶ÑƒĞ²Ğ°Ñ‚Ğ¸\n- Ğ·Ğ°Ğ¿ĞµÑ€ĞµÑ‡Ğ¸Ñ‚Ğ¸\n- Ğ²Ğ¸Ğ·Ğ½Ğ°Ñ‚Ğ¸\n- Ğ½Ğ°Ğ¿Ğ¾Ğ»ÑĞ³Ğ°Ñ‚Ğ¸\n- Ğ¿ĞµÑ€ĞµĞºĞ¾Ğ½ÑƒĞ²Ğ°Ñ‚Ğ¸\n- ÑĞºĞ°Ñ€Ğ¶Ğ¸Ñ‚Ğ¸ÑÑ\n\n---\n\n## unjumble: Ğ¡ĞºĞ»Ğ°Ğ´Ñ–Ñ‚ÑŒ Ñ€ĞµÑ‡ĞµĞ½Ğ½Ñ Ğ· Ñ€Ğ¾Ğ·ÑĞ¸Ğ¿Ğ°Ğ½Ğ¸Ñ… ÑĞ»Ñ–Ğ²\n\n1. Ğ²Ñ–Ğ½ / ÑĞºĞ°Ğ·Ğ°Ğ² / , / Ñ‰Ğ¾ / Ğ²Ğ¾Ğ½Ğ° / Ğ¿Ñ€Ğ¸Ğ¹Ğ´Ğµ / Ğ·Ğ°Ğ²Ñ‚Ñ€Ğ° / Ğ²Ğ²ĞµÑ‡ĞµÑ€Ñ– / Ğ½Ğ° / Ğ½Ğ°ÑˆÑƒ / ÑĞ²ÑÑ‚ĞºĞ¾Ğ²Ñƒ / Ğ²ĞµÑ‡ĞµÑ€Ñ\n   > [!answer] Ğ’Ñ–Ğ½ ÑĞºĞ°Ğ·Ğ°Ğ², Ñ‰Ğ¾ Ğ²Ğ¾Ğ½Ğ° Ğ¿Ñ€Ğ¸Ğ¹Ğ´Ğµ Ğ·Ğ°Ğ²Ñ‚Ñ€Ğ° Ğ²Ğ²ĞµÑ‡ĞµÑ€Ñ– Ğ½Ğ° Ğ½Ğ°ÑˆÑƒ ÑĞ²ÑÑ‚ĞºĞ¾Ğ²Ñƒ Ğ²ĞµÑ‡ĞµÑ€Ñ.\n\n2. Ğ²Ğ¾Ğ½Ğ° / Ğ¿Ğ¾ÑÑĞ½Ğ¸Ğ»Ğ° / , / Ñ‰Ğ¾ / Ğ¿Ğ¾Ñ‚Ñ€Ñ–Ğ±Ğ½Ğ¾ / Ğ±Ñ–Ğ»ÑŒÑˆĞµ / Ñ‡Ğ°ÑÑƒ / Ğ´Ğ»Ñ / Ğ·Ğ°Ğ²ĞµÑ€ÑˆĞµĞ½Ğ½Ñ / Ñ†ÑŒĞ¾Ğ³Ğ¾ / Ğ²Ğ°Ğ¶Ğ»Ğ¸Ğ²Ğ¾Ğ³Ğ¾ / Ğ¿Ñ€Ğ¾ĞµĞºÑ‚Ñƒ\n   > [!answer] Ğ’Ğ¾Ğ½Ğ° Ğ¿Ğ¾ÑÑĞ½Ğ¸Ğ»Ğ°, Ñ‰Ğ¾ Ğ¿Ğ¾Ñ‚Ñ€Ñ–Ğ±Ğ½Ğ¾ Ğ±Ñ–Ğ»ÑŒÑˆĞµ Ñ‡Ğ°ÑÑƒ Ğ´Ğ»Ñ Ğ·Ğ°Ğ²ĞµÑ€ÑˆĞµĞ½Ğ½Ñ Ñ†ÑŒĞ¾Ğ³Ğ¾ Ğ²Ğ°Ğ¶Ğ»Ğ¸Ğ²Ğ¾Ğ³Ğ¾ Ğ¿Ñ€Ğ¾ĞµĞºÑ‚Ñƒ.\n\n3. Ğ´Ğ¸Ñ€ĞµĞºÑ‚Ğ¾Ñ€ / Ğ·Ğ°ÑĞ²Ğ¸Ğ² / , / Ñ‰Ğ¾ / Ğ·Ğ±Ğ¾Ñ€Ğ¸ / Ğ¿ĞµÑ€ĞµĞ½ĞµÑĞµĞ½Ğ¾ / Ğ½Ğ° / Ğ½Ğ°ÑÑ‚ÑƒĞ¿Ğ½Ğ¸Ğ¹ / Ñ‚Ğ¸Ğ¶Ğ´ĞµĞ½ÑŒ / Ñ‡ĞµÑ€ĞµĞ· / Ğ¹Ğ¾Ğ³Ğ¾ / Ğ²Ñ–Ğ´Ñ€ÑĞ´Ğ¶ĞµĞ½Ğ½Ñ\n   > [!answer] Ğ”Ğ¸Ñ€ĞµĞºÑ‚Ğ¾Ñ€ Ğ·Ğ°ÑĞ²Ğ¸Ğ², Ñ‰Ğ¾ Ğ·Ğ±Ğ¾Ñ€Ğ¸ Ğ¿ĞµÑ€ĞµĞ½ĞµÑĞµĞ½Ğ¾ Ğ½Ğ° Ğ½Ğ°ÑÑ‚ÑƒĞ¿Ğ½Ğ¸Ğ¹ Ñ‚Ğ¸Ğ¶Ğ´ĞµĞ½ÑŒ Ñ‡ĞµÑ€ĞµĞ· Ğ¹Ğ¾Ğ³Ğ¾ Ğ²Ñ–Ğ´Ñ€ÑĞ´Ğ¶ĞµĞ½Ğ½Ñ.\n\n4. Ğ²Ñ–Ğ½ / Ğ´Ğ¾Ğ´Ğ°Ğ² / , / Ñ‰Ğ¾ / Ğ±ÑƒĞ´Ğµ / Ñ‡ĞµĞºĞ°Ñ‚Ğ¸ / Ğ½Ğ° / Ğ²Ñ–Ğ´Ğ¿Ğ¾Ğ²Ñ–Ğ´ÑŒ / Ğ´Ğ¾ / ĞºÑ–Ğ½Ñ†Ñ / Ñ€Ğ¾Ğ±Ğ¾Ñ‡Ğ¾Ğ³Ğ¾ / Ğ´Ğ½Ñ\n   > [!answer] Ğ’Ñ–Ğ½ Ğ´Ğ¾Ğ´Ğ°Ğ², Ñ‰Ğ¾ Ğ±ÑƒĞ´Ğµ Ñ‡ĞµĞºĞ°Ñ‚Ğ¸ Ğ½Ğ° Ğ²Ñ–Ğ´Ğ¿Ğ¾Ğ²Ñ–Ğ´ÑŒ Ğ´Ğ¾ ĞºÑ–Ğ½Ñ†Ñ Ñ€Ğ¾Ğ±Ğ¾Ñ‡Ğ¾Ğ³Ğ¾ Ğ´Ğ½Ñ.\n\n5. Ğ²Ğ¾Ğ½Ğ° / Ğ·Ğ°ÑƒĞ²Ğ°Ğ¶Ğ¸Ğ»Ğ° / , / Ñ‰Ğ¾ / Ğ¿Ğ¾Ğ³Ğ¾Ğ´Ğ° / ÑÑŒĞ¾Ğ³Ğ¾Ğ´Ğ½Ñ– / Ğ½Ğ°Ğ´Ğ·Ğ²Ğ¸Ñ‡Ğ°Ğ¹Ğ½Ğ¾ / Ğ³Ğ°Ñ€Ğ½Ğ° / Ğ´Ğ»Ñ / Ñ‚Ñ€Ğ¸Ğ²Ğ°Ğ»Ğ¾Ñ— / Ğ¿Ñ€Ğ¾Ğ³ÑƒĞ»ÑĞ½ĞºĞ¸ / Ğ¿Ğ°Ñ€ĞºĞ¾Ğ¼\n   > [!answer] Ğ’Ğ¾Ğ½Ğ° Ğ·Ğ°ÑƒĞ²Ğ°Ğ¶Ğ¸Ğ»Ğ°, Ñ‰Ğ¾ Ğ¿Ğ¾Ğ³Ğ¾Ğ´Ğ° ÑÑŒĞ¾Ğ³Ğ¾Ğ´Ğ½Ñ– Ğ½Ğ°Ğ´Ğ·Ğ²Ğ¸Ñ‡Ğ°Ğ¹Ğ½Ğ¾ Ğ³Ğ°Ñ€Ğ½Ğ° Ğ´Ğ»Ñ Ñ‚Ñ€Ğ¸Ğ²Ğ°Ğ»Ğ¾Ñ— Ğ¿Ñ€Ğ¾Ğ³ÑƒĞ»ÑĞ½ĞºĞ¸ Ğ¿Ğ°Ñ€ĞºĞ¾Ğ¼.\n\n6. ÑĞ²Ñ–Ğ´Ğ¾Ğº / ÑÑ‚Ğ²ĞµÑ€Ğ´Ğ¶ÑƒÑ” / , / Ñ‰Ğ¾ / Ğ²Ñ–Ğ½ / Ğ±Ğ°Ñ‡Ğ¸Ğ² / Ñ†Ñ / Ğ»ÑĞ´Ğ¸Ğ½Ñƒ / Ñ‚Ğ°Ğ¼ / Ñ‚Ğ¾Ğ³Ğ¾ / ÑĞ°Ğ¼Ğ¾Ğ³Ğ¾ / Ğ²ĞµÑ‡Ğ¾Ñ€Ğ°\n   > [!answer] Ğ¡Ğ²Ñ–Ğ´Ğ¾Ğº ÑÑ‚Ğ²ĞµÑ€Ğ´Ğ¶ÑƒÑ”, Ñ‰Ğ¾ Ğ²Ñ–Ğ½ Ğ±Ğ°Ñ‡Ğ¸Ğ² Ñ†Ñ Ğ»ÑĞ´Ğ¸Ğ½Ñƒ Ñ‚Ğ°Ğ¼ Ñ‚Ğ¾Ğ³Ğ¾ ÑĞ°Ğ¼Ğ¾Ğ³Ğ¾ Ğ²ĞµÑ‡Ğ¾Ñ€Ğ°.\n\n---\n\n## error-correction: Ğ—Ğ½Ğ°Ğ¹Ğ´Ñ–Ñ‚ÑŒ Ñ– Ğ²Ğ¸Ğ¿Ñ€Ğ°Ğ²Ñ‚Ğµ Ğ¿Ğ¾Ğ¼Ğ¸Ğ»ĞºÑƒ\n\n1. Ğ’Ñ–Ğ½ ÑĞºĞ°Ğ·Ğ°Ğ² Ğ²Ñ–Ğ½ Ğ¿Ñ€Ğ¸Ğ¹Ğ´Ğµ Ğ·Ğ°Ğ²Ñ‚Ñ€Ğ° Ğ½Ğ° Ğ½Ğ°ÑˆÑƒ Ğ·ÑƒÑÑ‚Ñ€Ñ–Ñ‡.\n   > [!error] ÑĞºĞ°Ğ·Ğ°Ğ² Ğ²Ñ–Ğ½\n   > [!answer] ÑĞºĞ°Ğ·Ğ°Ğ², Ñ‰Ğ¾ Ğ²Ñ–Ğ½\n   > [!options] ÑĞºĞ°Ğ·Ğ°Ğ², Ñ‰Ğ¾ Ğ²Ñ–Ğ½ | ÑĞºĞ°Ğ·Ğ°Ğ²: Ğ²Ñ–Ğ½ | ÑĞºĞ°Ğ·Ğ°Ğ² Ğ¹ Ğ²Ñ–Ğ½ | ÑĞºĞ°Ğ·Ğ°Ğ² Ñ– Ğ²Ñ–Ğ½\n   > [!explanation] ĞŸĞ¾Ñ‚Ñ€Ñ–Ğ±ĞµĞ½ ÑĞ¿Ğ¾Ğ»ÑƒÑ‡Ğ½Ğ¸Ğº Â«Ñ‰Ğ¾Â» Ñƒ Ğ½ĞµĞ¿Ñ€ÑĞ¼Ñ–Ğ¹ Ğ¼Ğ¾Ğ²Ñ–.\n\n2. Ğ’Ğ¾Ğ½Ğ° ÑĞºĞ°Ğ·Ğ°Ğ»Ğ°, Ñ‰Ğ¾ Ñ Ğ»ÑĞ±Ğ»Ñ Ñ†Ñ ĞºĞ½Ğ¸Ğ³Ñƒ. (ÑĞºÑ‰Ğ¾ Ğ¼Ğ¾Ğ²ĞµÑ†ÑŒ â€” Ğ²Ğ¾Ğ½Ğ°)\n   > [!error] Ñ Ğ»ÑĞ±Ğ»Ñ\n   > [!answer] Ğ²Ğ¾Ğ½Ğ° Ğ»ÑĞ±Ğ¸Ñ‚ÑŒ\n   > [!options] Ğ²Ğ¾Ğ½Ğ° Ğ»ÑĞ±Ğ¸Ñ‚ÑŒ | Ñ Ğ»ÑĞ±Ğ¸Ñ‚ÑŒ | Ğ²Ğ¾Ğ½Ğ° Ğ»ÑĞ±Ğ»Ñ | Ğ²Ğ¾Ğ½Ğ° Ğ»ÑĞ±Ğ¸Ğ»Ğ°\n   > [!explanation] Ğ—Ğ°Ğ¹Ğ¼ĞµĞ½Ğ½Ğ¸Ğº Ğ¼Ğ°Ñ” Ğ²Ñ–Ğ´Ğ¿Ğ¾Ğ²Ñ–Ğ´Ğ°Ñ‚Ğ¸ Ğ¼Ğ¾Ğ²Ñ†Ñ.\n\n3. Ğ’Ñ–Ğ½ ÑĞºĞ°Ğ·Ğ°Ğ², Ñ‰Ğ¾ Ğ¿Ñ€Ğ°Ñ†ÑĞ²Ğ°Ğ² Ñ‚ÑƒÑ‚. (ÑĞºÑ‰Ğ¾ Ğ²Ñ–Ğ½ Ñ‰Ğµ Ğ¿Ñ€Ğ°Ñ†ÑÑ” Ñ‚Ğ°Ğ¼)\n   > [!error] Ğ¿Ñ€Ğ°Ñ†ÑĞ²Ğ°Ğ²\n   > [!answer] Ğ¿Ñ€Ğ°Ñ†ÑÑ”\n   > [!options] Ğ¿Ñ€Ğ°Ñ†ÑÑ” | Ğ¿Ñ€Ğ°Ñ†ÑĞ²Ğ°Ñ‚Ğ¸Ğ¼Ğµ | Ğ±ÑƒĞ´Ğµ Ğ¿Ñ€Ğ°Ñ†ÑĞ²Ğ°Ñ‚Ğ¸ | Ğ¿Ñ€Ğ°Ñ†ÑĞ²Ğ°Ğ»Ğ°\n   > [!explanation] Ğ—ÑÑƒĞ² Ñ‡Ğ°ÑÑƒ Ğ½Ğµ Ğ¿Ğ¾Ñ‚Ñ€Ñ–Ğ±ĞµĞ½, ÑĞºÑ‰Ğ¾ Ğ´Ñ–Ñ Ğ°ĞºÑ‚ÑƒĞ°Ğ»ÑŒĞ½Ğ°.\n\n4. Ğ’Ğ¾Ğ½Ğ° ÑĞºĞ°Ğ·Ğ°Ğ»Ğ°: Ñ‰Ğ¾ Ğ²Ğ¾Ğ½Ğ° Ğ¿Ñ€Ğ¸Ğ¹Ğ´Ğµ Ğ·Ğ°Ğ²Ñ‚Ñ€Ğ°.\n   > [!error] ÑĞºĞ°Ğ·Ğ°Ğ»Ğ°: Ñ‰Ğ¾\n   > [!answer] ÑĞºĞ°Ğ·Ğ°Ğ»Ğ°, Ñ‰Ğ¾\n   > [!options] ÑĞºĞ°Ğ·Ğ°Ğ»Ğ°, Ñ‰Ğ¾ | ÑĞºĞ°Ğ·Ğ°Ğ»Ğ° â€” Ñ‰Ğ¾ | ÑĞºĞ°Ğ·Ğ°Ğ»Ğ°; Ñ‰Ğ¾ | ÑĞºĞ°Ğ·Ğ°Ğ»Ğ°! Ñ‰Ğ¾\n   > [!explanation] Ğ”Ğ²Ğ¾ĞºÑ€Ğ°Ğ¿ĞºĞ° Ğ´Ğ»Ñ Ğ¿Ñ€ÑĞ¼Ğ¾Ñ— Ğ¼Ğ¾Ğ²Ğ¸, ĞºĞ¾Ğ¼Ğ° Ğ´Ğ»Ñ Ğ½ĞµĞ¿Ñ€ÑĞ¼Ğ¾Ñ—.\n\n5. Ğ’Ñ–Ğ½ Ğ³Ğ¾Ğ²Ğ¾Ñ€Ğ¸Ğ², Ñ‰Ğ¾ Ğ²Ñ–Ğ½ Ğ¿Ñ€Ğ¸Ñ—Ñ…Ğ°Ğ² Ğ²Ñ‡Ğ¾Ñ€Ğ°. (Ğ½ĞµĞ¿Ñ€ÑĞ¼Ğ° Ğ¼Ğ¾Ğ²Ğ° Ğ² Ğ¼Ğ¸Ğ½ÑƒĞ»Ğ¾Ğ¼Ñƒ)\n   > [!error] Ğ²Ñ‡Ğ¾Ñ€Ğ°\n   > [!answer] Ğ½Ğ°Ğ¿ĞµÑ€ĞµĞ´Ğ¾Ğ´Ğ½Ñ–\n   > [!options] Ğ½Ğ°Ğ¿ĞµÑ€ĞµĞ´Ğ¾Ğ´Ğ½Ñ– | Ğ·Ğ°Ğ²Ñ‚Ñ€Ğ° | ÑÑŒĞ¾Ğ³Ğ¾Ğ´Ğ½Ñ– | Ñ‚Ğ¾Ğ´Ñ–\n   > [!explanation] Â«Ğ’Ñ‡Ğ¾Ñ€Ğ°Â» â†’ Â«Ğ½Ğ°Ğ¿ĞµÑ€ĞµĞ´Ğ¾Ğ´Ğ½Ñ–Â» Ğ² Ğ¼Ğ¸Ğ½ÑƒĞ»Ğ¾Ğ¼Ñƒ ĞºĞ¾Ğ½Ñ‚ĞµĞºÑÑ‚Ñ–.\n\n6. Ğ’Ğ¾Ğ½Ğ° Ğ·Ğ°ÑƒĞ²Ğ°Ğ¶Ğ¸Ğ»Ğ° Ñ‰Ğ¾ Ğ¿Ğ¾Ğ³Ğ¾Ğ´Ğ° Ğ³Ğ°Ñ€Ğ½Ğ° ÑÑŒĞ¾Ğ³Ğ¾Ğ´Ğ½Ñ– Ğ½Ğ°Ğ´Ğ²Ğ¾Ñ€Ñ–.\n   > [!error] Ğ·Ğ°ÑƒĞ²Ğ°Ğ¶Ğ¸Ğ»Ğ° Ñ‰Ğ¾\n   > [!answer] Ğ·Ğ°ÑƒĞ²Ğ°Ğ¶Ğ¸Ğ»Ğ°, Ñ‰Ğ¾\n   > [!options] Ğ·Ğ°ÑƒĞ²Ğ°Ğ¶Ğ¸Ğ»Ğ°, Ñ‰Ğ¾ | Ğ·Ğ°ÑƒĞ²Ğ°Ğ¶Ğ¸Ğ»Ğ°: Ñ‰Ğ¾ | Ğ·Ğ°ÑƒĞ²Ğ°Ğ¶Ğ¸Ğ»Ğ° â€” Ñ‰Ğ¾ | Ğ·Ğ°ÑƒĞ²Ğ°Ğ¶Ğ¸Ğ»Ğ°; Ñ‰Ğ¾\n   > [!explanation] ĞŸĞ¾Ñ‚Ñ€Ñ–Ğ±Ğ½Ğ° ĞºĞ¾Ğ¼Ğ° Ğ¿ĞµÑ€ĞµĞ´ Â«Ñ‰Ğ¾Â».\n\n---\n\n## cloze: Ğ—Ğ°Ğ¿Ğ¾Ğ²Ğ½Ñ–Ñ‚ÑŒ Ğ¿Ñ€Ğ¾Ğ¿ÑƒÑĞºĞ¸ Ğ² Ñ‚ĞµĞºÑÑ‚Ñ–\n\nĞ£Ñ‡Ğ¾Ñ€Ğ° Ñ Ñ€Ğ¾Ğ·Ğ¼Ğ¾Ğ²Ğ»ÑĞ² Ñ–Ğ· Ğ´Ñ€ÑƒĞ³Ğ¾Ğ¼. Ğ’Ñ–Ğ½ (1)___, Ñ‰Ğ¾ Ñ—Ğ´Ğµ Ñƒ Ğ²Ñ–Ğ´Ğ¿ÑƒÑÑ‚ĞºÑƒ. Ğ’Ñ–Ğ½ (2)___, Ñ‰Ğ¾ Ğ¿Ğ»Ğ°Ğ½ÑƒÑ” Ğ¿Ğ¾Ñ—Ñ…Ğ°Ñ‚Ğ¸ Ğ½Ğ° Ğ¼Ğ¾Ñ€Ğµ. Ğ’Ñ–Ğ½ (3)___, Ñ‰Ğ¾ Ñ†Ğµ Ğ±ÑƒĞ´Ğµ (4)___ Ñ‚Ğ¸Ğ¶Ğ´ĞµĞ½ÑŒ. Ğ¯ Ğ·Ğ°Ğ¿Ğ¸Ñ‚Ğ°Ğ², ĞºÑƒĞ´Ğ¸ ÑĞ°Ğ¼Ğµ. Ğ’Ñ–Ğ½ Ğ±ÑƒĞ² Ğ´ÑƒĞ¶Ğµ (5)___ Ñ†Ñ–Ñ”Ñ Ğ¿Ğ¾Ğ´Ğ¾Ñ€Ğ¾Ğ¶Ğ¶Ñ.\n\nĞ’Ñ–Ğ½ (6)___, Ñ‰Ğ¾ Ñ—Ğ´Ğµ Ğ² ĞĞ´ĞµÑÑƒ. Ğ’Ñ–Ğ½ (7)___, Ñ‰Ğ¾ Ñ‚Ğ°Ğ¼ Ñ‡ÑƒĞ´Ğ¾Ğ²Ñ– Ğ¿Ğ»ÑĞ¶Ñ–. Ğ’Ñ–Ğ½ (8)___, Ñ‰Ğ¾ Ğ·Ğ½Ğ°Ğ¹Ğ¾Ğ¼Ñ– Ñ€ĞµĞºĞ¾Ğ¼ĞµĞ½Ğ´ÑƒĞ²Ğ°Ğ»Ğ¸ ÑĞ°Ğ¼Ğµ Ñ†Ğµ Ğ¼Ñ–ÑÑ†Ğµ. Ğ¯ (9)___, Ñ‰Ğ¾ Ñ‚Ğ°ĞºĞ¾Ğ¶ Ñ…Ğ¾Ñ‚Ñ–Ğ² Ğ±Ğ¸ Ğ¿Ğ¾Ñ—Ñ…Ğ°Ñ‚Ğ¸ Ñ‚ÑƒĞ´Ğ¸.\n\nĞŸĞ¾Ñ‚Ñ–Ğ¼ Ğ²Ñ–Ğ½ (10)___, Ñ‰Ğ¾ Ğ²Ñ–Ğ·ÑŒĞ¼Ğµ Ğ±Ğ°Ğ³Ğ°Ñ‚Ğ¾ ĞºĞ½Ğ¸Ğ¶Ğ¾Ğº. Ğ’Ñ–Ğ½ (11)___, Ñ‰Ğ¾ Ğ»ÑĞ±Ğ¸Ñ‚ÑŒ Ñ‡Ğ¸Ñ‚Ğ°Ñ‚Ğ¸ Ğ½Ğ° Ğ¿Ğ»ÑĞ¶Ñ–. Ğ¯ (12)___, Ñ‰Ğ¾ Ñ†Ğµ Ğ³Ğ°Ñ€Ğ½Ğ° Ñ–Ğ´ĞµÑ. Ğ’Ñ–Ğ½ (13)___, Ñ‰Ğ¾ Ğ¿Ğ¾Ğ²ĞµÑ€Ğ½ĞµÑ‚ÑŒÑÑ Ñ‡ĞµÑ€ĞµĞ· Ğ´Ğ²Ğ° Ñ‚Ğ¸Ğ¶Ğ½Ñ–. Ğ’Ñ–Ğ½ (14)___, Ñ‰Ğ¾ Ğ¾Ğ±Ğ¾Ğ²'ÑĞ·ĞºĞ¾Ğ²Ğ¾ Ñ€Ğ¾Ğ·ĞºĞ°Ğ¶Ğµ Ğ¿Ñ€Ğ¾ Ğ¿Ğ¾Ğ´Ğ¾Ñ€Ğ¾Ğ¶.\n\n- (1) :: ÑĞºĞ°Ğ·Ğ°Ğ² | ÑĞºĞ°Ğ·Ğ°Ğ»Ğ° | ÑĞºĞ°Ğ¶Ñƒ | ÑĞºĞ°Ğ¶Ğµ\n- (2) :: Ğ¿Ğ¾ÑÑĞ½Ğ¸Ğ² | Ğ¿Ğ¾ÑÑĞ½Ğ¸Ğ»Ğ° | Ğ¿Ğ¾ÑÑĞ½ÑÑ‚ÑŒ | Ğ¿Ğ¾ÑÑĞ½ÑÑ\n- (3) :: Ğ´Ğ¾Ğ´Ğ°Ğ² | Ğ´Ğ¾Ğ´Ğ°Ğ»Ğ° | Ğ´Ğ¾Ğ´Ğ°Ğ¼ | Ğ´Ğ¾Ğ´Ğ°ÑÑ‚ÑŒ\n- (4) :: Ğ½Ğ°ÑÑ‚ÑƒĞ¿Ğ½Ğ¾Ğ³Ğ¾ | Ñ‚Ğ¾Ğ³Ğ¾ | Ñ†ÑŒĞ¾Ğ³Ğ¾ | Ğ¿Ğ¾Ğ¿ĞµÑ€ĞµĞ´Ğ½ÑŒĞ¾Ğ³Ğ¾\n- (5) :: Ğ·Ğ°Ñ†Ñ–ĞºĞ°Ğ²Ğ»ĞµĞ½Ğ¸Ğ¹ | Ğ·Ğ°Ñ†Ñ–ĞºĞ°Ğ²Ğ»ĞµĞ½Ğ° | ÑÑƒĞ¼Ğ½Ğ¸Ğ¹ | Ğ·Ğ»Ğ¸Ğ¹\n- (6) :: Ğ²Ñ–Ğ´Ğ¿Ğ¾Ğ²Ñ–Ğ² | Ğ²Ñ–Ğ´Ğ¿Ğ¾Ğ²Ñ–Ğ»Ğ° | Ğ²Ñ–Ğ´Ğ¿Ğ¾Ğ²Ñ–Ğ¼ | Ğ²Ñ–Ğ´Ğ¿Ğ¾Ğ²Ñ–Ğ´Ğ°Ñ\n- (7) :: Ğ·Ğ°ÑƒĞ²Ğ°Ğ¶Ğ¸Ğ² | Ğ·Ğ°ÑƒĞ²Ğ°Ğ¶Ğ¸Ğ»Ğ° | Ğ·Ğ°ÑƒĞ²Ğ°Ğ¶Ñƒ | Ğ·Ğ°ÑƒĞ²Ğ°Ğ¶Ğ°Ñ‚ÑŒ\n- (8) :: ÑÑ‚Ğ²ĞµÑ€Ğ´Ğ¶ÑƒĞ²Ğ°Ğ² | ÑÑ‚Ğ²ĞµÑ€Ğ´Ğ¶ÑƒĞ²Ğ°Ğ»Ğ° | ÑÑ‚Ğ²ĞµÑ€Ğ´Ğ¶ÑƒÑ | ÑÑ‚Ğ²ĞµÑ€Ğ´Ğ¶ÑƒÑÑ‚ÑŒ\n- (9) :: Ğ·Ğ°ÑƒĞ²Ğ°Ğ¶Ğ¸Ğ² | Ğ·Ğ°ÑƒĞ²Ğ°Ğ¶Ğ¸Ğ»Ğ° | Ğ·Ğ°ÑƒĞ²Ğ°Ğ¶Ñƒ | Ğ·Ğ°ÑƒĞ²Ğ°Ğ¶ÑƒÑÑ‚ÑŒ\n- (10) :: Ğ´Ğ¾Ğ´Ğ°Ğ² | Ğ´Ğ¾Ğ´Ğ°Ğ»Ğ° | Ğ´Ğ¾Ğ´Ğ°Ğ¼ | Ğ´Ğ¾Ğ´Ğ°ÑÑ‚ÑŒ\n- (11) :: Ğ¿Ğ¾ÑÑĞ½Ğ¸Ğ² | Ğ¿Ğ¾ÑÑĞ½Ğ¸Ğ»Ğ° | Ğ¿Ğ¾ÑÑĞ½ÑÑ | Ğ¿Ğ¾ÑÑĞ½ÑÑ‚ÑŒ\n- (12) :: Ğ¿Ğ¾Ğ³Ğ¾Ğ´Ğ¸Ğ²ÑÑ | Ğ¿Ğ¾Ğ³Ğ¾Ğ´Ğ¸Ğ»Ğ°ÑÑ | Ğ¿Ğ¾Ğ³Ğ¾Ğ´Ğ¶ÑƒÑÑÑŒ | Ğ¿Ğ¾Ğ³Ğ¾Ğ´ÑÑ‚ÑŒÑÑ\n- (13) :: Ğ¿Ğ¾Ğ¾Ğ±Ñ–Ñ†ÑĞ² | Ğ¿Ğ¾Ğ¾Ğ±Ñ–Ñ†ÑĞ»Ğ° | Ğ¿Ğ¾Ğ¾Ğ±Ñ–Ñ†ÑÑ | Ğ¿Ğ¾Ğ¾Ğ±Ñ–Ñ†ÑÑÑ‚ÑŒ\n- (14) :: Ğ·Ğ°Ğ¿ĞµĞ²Ğ½Ğ¸Ğ² | Ğ·Ğ°Ğ¿ĞµĞ²Ğ½Ğ¸Ğ»Ğ° | Ğ·Ğ°Ğ¿ĞµĞ²Ğ½Ñ | Ğ·Ğ°Ğ¿ĞµĞ²Ğ½ÑÑÑ‚ÑŒ\n\n---\n\n## mark-the-words: ĞŸĞ¾Ğ·Ğ½Ğ°Ñ‡Ñ‚Ğµ Ğ´Ñ–Ñ”ÑĞ»Ğ¾Ğ²Ğ° Ğ²Ğ²ĞµĞ´ĞµĞ½Ğ½Ñ Ğ½ĞµĞ¿Ñ€ÑĞ¼Ğ¾Ñ— Ğ¼Ğ¾Ğ²Ğ¸\n\nĞ’Ñ–Ğ½ [ÑĞºĞ°Ğ·Ğ°Ğ²], Ñ‰Ğ¾ Ğ¿Ñ€Ğ¸Ğ¹Ğ´Ğµ Ğ·Ğ°Ğ²Ñ‚Ñ€Ğ°. Ğ’Ğ¾Ğ½Ğ° [Ğ¿Ğ¾ÑÑĞ½Ğ¸Ğ»Ğ°], Ñ‰Ğ¾ Ğ¿Ğ¾Ñ‚Ñ€Ñ–Ğ±Ğ½Ğ¾ Ğ±Ñ–Ğ»ÑŒÑˆĞµ Ñ‡Ğ°ÑÑƒ. Ğ”Ğ¸Ñ€ĞµĞºÑ‚Ğ¾Ñ€ [Ğ·Ğ°ÑĞ²Ğ¸Ğ²], Ñ‰Ğ¾ Ğ·Ğ±Ğ¾Ñ€Ğ¸ Ğ¿ĞµÑ€ĞµĞ½ĞµÑĞµĞ½Ğ¾. Ğ’Ñ–Ğ½ [Ğ´Ğ¾Ğ´Ğ°Ğ²], Ñ‰Ğ¾ Ğ±ÑƒĞ´Ğµ Ñ‡ĞµĞºĞ°Ñ‚Ğ¸. Ğ’Ğ¾Ğ½Ğ° [Ğ·Ğ°ÑƒĞ²Ğ°Ğ¶Ğ¸Ğ»Ğ°], Ñ‰Ğ¾ Ğ¿Ğ¾Ğ³Ğ¾Ğ´Ğ° Ğ³Ğ°Ñ€Ğ½Ğ°. Ğ¡Ğ²Ñ–Ğ´Ğ¾Ğº [ÑÑ‚Ğ²ĞµÑ€Ğ´Ğ¶ÑƒÑ”], Ñ‰Ğ¾ Ğ±Ğ°Ñ‡Ğ¸Ğ² Ñ†Ğµ. Ğ’Ñ–Ğ½ [Ğ²Ğ¸Ğ·Ğ½Ğ°Ğ²], Ñ‰Ğ¾ Ğ¿Ğ¾Ğ¼Ğ¸Ğ»Ğ¸Ğ²ÑÑ. Ğ’Ğ¾Ğ½Ğ° [Ğ·Ğ°Ğ¿ĞµÑ€ĞµÑ‡Ğ¸Ğ»Ğ°], Ñ‰Ğ¾ Ğ±ÑƒĞ»Ğ° Ñ‚Ğ°Ğ¼.\n\n---\n\n## dialogue-reorder: Ğ’Ğ¿Ğ¾Ñ€ÑĞ´ĞºÑƒĞ¹Ñ‚Ğµ Ğ´Ñ–Ğ°Ğ»Ğ¾Ğ³\n\n- Ğ’Ñ–Ğ½ ÑĞºĞ°Ğ·Ğ°Ğ², Ñ‰Ğ¾ Ğ¿Ñ€Ğ¾ĞµĞºÑ‚ Ğ¿Ñ€Ğ¾ÑÑƒĞ²Ğ°Ñ”Ñ‚ÑŒÑÑ Ğ´Ğ¾Ğ±Ñ€Ğµ Ñ– Ğ¼Ğ¸ Ğ²ÑÑ‚Ğ¸Ğ³Ğ½ĞµĞ¼Ğ¾.\n- Ğ©Ğ¾ ÑĞºĞ°Ğ·Ğ°Ğ² ÑˆĞµÑ„ Ğ½Ğ° ÑÑŒĞ¾Ğ³Ğ¾Ğ´Ğ½Ñ–ÑˆĞ½Ñ–Ğ¹ Ğ·ÑƒÑÑ‚Ñ€Ñ–Ñ‡Ñ–?\n- Ğ§ÑƒĞ´Ğ¾Ğ²Ğ¾! Ğ Ğ¿Ñ€Ğ¾ Ğ±ÑĞ´Ğ¶ĞµÑ‚ Ğ²Ñ–Ğ½ Ñ‰Ğ¾ÑÑŒ Ğ³Ğ¾Ğ²Ğ¾Ñ€Ğ¸Ğ²?\n- Ğ’Ñ–Ğ½ Ğ¿Ğ¾ÑÑĞ½Ğ¸Ğ², Ñ‰Ğ¾ Ğ±ÑĞ´Ğ¶ĞµÑ‚ Ğ±ÑƒĞ´Ğµ Ğ·Ğ±Ñ–Ğ»ÑŒÑˆĞµĞ½Ğ¾ Ğ½Ğ° Ğ½Ğ°ÑÑ‚ÑƒĞ¿Ğ½Ğ¸Ğ¹ Ñ€Ñ–Ğº.\n- Ğ Ñ‰Ğ¾ Ğ²Ñ–Ğ½ ĞºĞ°Ğ·Ğ°Ğ² Ğ¿Ñ€Ğ¾ Ğ²Ñ–Ğ´Ğ¿ÑƒÑÑ‚ĞºĞ¸ Ñ‚Ğ° Ğ²Ğ¸Ñ…Ñ–Ğ´Ğ½Ñ–?\n- Ğ’Ñ–Ğ½ Ğ´Ğ¾Ğ´Ğ°Ğ², Ñ‰Ğ¾ Ğ¿Ğ¾Ñ‚Ñ€Ñ–Ğ±Ğ½Ğ¾ Ğ¿Ğ¾Ğ´Ğ°Ñ‚Ğ¸ Ğ·Ğ°ÑĞ²ĞºĞ¸ Ğ´Ğ¾ ĞºÑ–Ğ½Ñ†Ñ Ğ¼Ñ–ÑÑÑ†Ñ.\n\n> [!answer]\n> 1. Ğ©Ğ¾ ÑĞºĞ°Ğ·Ğ°Ğ² ÑˆĞµÑ„ Ğ½Ğ° ÑÑŒĞ¾Ğ³Ğ¾Ğ´Ğ½Ñ–ÑˆĞ½Ñ–Ğ¹ Ğ·ÑƒÑÑ‚Ñ€Ñ–Ñ‡Ñ–?\n> 2. Ğ’Ñ–Ğ½ ÑĞºĞ°Ğ·Ğ°Ğ², Ñ‰Ğ¾ Ğ¿Ñ€Ğ¾ĞµĞºÑ‚ Ğ¿Ñ€Ğ¾ÑÑƒĞ²Ğ°Ñ”Ñ‚ÑŒÑÑ Ğ´Ğ¾Ğ±Ñ€Ğµ Ñ– Ğ¼Ğ¸ Ğ²ÑÑ‚Ğ¸Ğ³Ğ½ĞµĞ¼Ğ¾.\n> 3. Ğ§ÑƒĞ´Ğ¾Ğ²Ğ¾! Ğ Ğ¿Ñ€Ğ¾ Ğ±ÑĞ´Ğ¶ĞµÑ‚ Ğ²Ñ–Ğ½ Ñ‰Ğ¾ÑÑŒ Ğ³Ğ¾Ğ²Ğ¾Ñ€Ğ¸Ğ²?\n> 4. Ğ’Ñ–Ğ½ Ğ¿Ğ¾ÑÑĞ½Ğ¸Ğ², Ñ‰Ğ¾ Ğ±ÑĞ´Ğ¶ĞµÑ‚ Ğ±ÑƒĞ´Ğµ Ğ·Ğ±Ñ–Ğ»ÑŒÑˆĞµĞ½Ğ¾ Ğ½Ğ° Ğ½Ğ°ÑÑ‚ÑƒĞ¿Ğ½Ğ¸Ğ¹ Ñ€Ñ–Ğº.\n> 5. Ğ Ñ‰Ğ¾ Ğ²Ñ–Ğ½ ĞºĞ°Ğ·Ğ°Ğ² Ğ¿Ñ€Ğ¾ Ğ²Ñ–Ğ´Ğ¿ÑƒÑÑ‚ĞºĞ¸ Ñ‚Ğ° Ğ²Ğ¸Ñ…Ñ–Ğ´Ğ½Ñ–?\n> 6. Ğ’Ñ–Ğ½ Ğ´Ğ¾Ğ´Ğ°Ğ², Ñ‰Ğ¾ Ğ¿Ğ¾Ñ‚Ñ€Ñ–Ğ±Ğ½Ğ¾ Ğ¿Ğ¾Ğ´Ğ°Ñ‚Ğ¸ Ğ·Ğ°ÑĞ²ĞºĞ¸ Ğ´Ğ¾ ĞºÑ–Ğ½Ñ†Ñ Ğ¼Ñ–ÑÑÑ†Ñ.\n\n---\n\n## select: Ğ’Ğ¸Ğ±ĞµÑ€Ñ–Ñ‚ÑŒ ÑƒÑÑ– Ğ³Ñ€Ğ°Ğ¼Ğ°Ñ‚Ğ¸Ñ‡Ğ½Ğ¾ Ğ¿Ñ€Ğ°Ğ²Ğ¸Ğ»ÑŒĞ½Ñ– Ñ€ĞµÑ‡ĞµĞ½Ğ½Ñ\n\n- [x] Ğ’Ñ–Ğ½ ÑĞºĞ°Ğ·Ğ°Ğ², Ñ‰Ğ¾ Ğ¿Ñ€Ğ¸Ğ¹Ğ´Ğµ Ğ·Ğ°Ğ²Ñ‚Ñ€Ğ°.\n- [ ] Ğ’Ñ–Ğ½ ÑĞºĞ°Ğ·Ğ°Ğ² Ñ‰Ğ¾ Ğ¿Ñ€Ğ¸Ğ¹Ğ´Ğµ Ğ·Ğ°Ğ²Ñ‚Ñ€Ğ°.\n- [x] Ğ’Ğ¾Ğ½Ğ° Ğ¿Ğ¾ÑÑĞ½Ğ¸Ğ»Ğ°, Ñ‰Ğ¾ Ğ¿Ğ¾Ñ‚Ñ€Ñ–Ğ±ĞµĞ½ Ñ‡Ğ°Ñ.\n- [ ] Ğ’Ğ¾Ğ½Ğ° Ğ¿Ğ¾ÑÑĞ½Ğ¸Ğ»Ğ°, Ñ‰Ğ¾ Ñ Ğ¿Ğ¾Ñ‚Ñ€Ñ–Ğ±ĞµĞ½ Ñ‡Ğ°Ñ.\n- [x] Ğ”Ğ¸Ñ€ĞµĞºÑ‚Ğ¾Ñ€ Ğ·Ğ°ÑĞ²Ğ¸Ğ², Ñ‰Ğ¾ Ğ·Ğ±Ğ¾Ñ€Ğ¸ Ğ¿ĞµÑ€ĞµĞ½ĞµÑĞµĞ½Ğ¾.\n- [ ] Ğ”Ğ¸Ñ€ĞµĞºÑ‚Ğ¾Ñ€ Ğ·Ğ°ÑĞ²Ğ¸Ğ²: Ñ‰Ğ¾ Ğ·Ğ±Ğ¾Ñ€Ğ¸ Ğ¿ĞµÑ€ĞµĞ½ĞµÑĞµĞ½Ğ¾.\n- [x] Ğ’Ñ–Ğ½ Ğ·Ğ°ÑƒĞ²Ğ°Ğ¶Ğ¸Ğ², Ñ‰Ğ¾ Ğ¿Ğ¾Ğ³Ğ¾Ğ´Ğ° Ğ³Ğ°Ñ€Ğ½Ğ°.\n- [ ] Ğ’Ñ–Ğ½ Ğ·Ğ°ÑƒĞ²Ğ°Ğ¶Ğ¸Ğ² Ñ‰Ğ¾ Ğ¿Ğ¾Ğ³Ğ¾Ğ´Ğ° Ğ³Ğ°Ñ€Ğ½Ğ°.\n- [x] Ğ’Ğ¾Ğ½Ğ° ÑĞºĞ°Ğ·Ğ°Ğ»Ğ°, Ñ‰Ğ¾ Ğ²Ğ¾Ğ½Ğ° Ğ¿Ñ€Ğ¸Ğ¹Ğ´Ğµ.\n- [x] Ğ¡Ğ²Ñ–Ğ´Ğ¾Ğº ÑÑ‚Ğ²ĞµÑ€Ğ´Ğ¶ÑƒÑ”, Ñ‰Ğ¾ Ğ±Ğ°Ñ‡Ğ¸Ğ² Ñ†Ğµ.\n- [x] Ğ’Ñ–Ğ½ Ğ´Ğ¾Ğ´Ğ°Ğ², Ñ‰Ğ¾ Ğ±ÑƒĞ´Ğµ Ñ‡ĞµĞºĞ°Ñ‚Ğ¸.\n- [ ] Ğ’Ñ–Ğ½ Ğ´Ğ¾Ğ´Ğ°Ğ², Ğ²Ñ–Ğ½ Ğ±ÑƒĞ´Ğµ Ñ‡ĞµĞºĞ°Ñ‚Ğ¸.\n\n---\n\n## translate: ĞŸĞµÑ€ĞµĞºĞ»Ğ°Ğ´Ñ–Ñ‚ÑŒ Ğ½Ğ° ÑƒĞºÑ€Ğ°Ñ—Ğ½ÑÑŒĞºÑƒ Ğ¼Ğ¾Ğ²Ñƒ\n\n1. He said that he would come tomorrow evening to our place.\n   - [x] Ğ’Ñ–Ğ½ ÑĞºĞ°Ğ·Ğ°Ğ², Ñ‰Ğ¾ Ğ¿Ñ€Ğ¸Ğ¹Ğ´Ğµ Ğ·Ğ°Ğ²Ñ‚Ñ€Ğ° Ğ²Ğ²ĞµÑ‡ĞµÑ€Ñ– Ğ´Ğ¾ Ğ½Ğ°Ñ.\n   - [ ] Ğ’Ñ–Ğ½ ÑĞºĞ°Ğ·Ğ°Ğ², Ñ Ğ¿Ñ€Ğ¸Ğ¹Ğ´Ñƒ Ğ·Ğ°Ğ²Ñ‚Ñ€Ğ°.\n   - [ ] Ğ’Ñ–Ğ½ ÑĞºĞ°Ğ·Ğ°Ğ² Ñ‰Ğ¾ Ğ²Ñ–Ğ½ Ğ¿Ñ€Ğ¸Ğ¹Ğ´Ğµ.\n   - [ ] Ğ’Ñ–Ğ½ ÑĞºĞ°Ğ·Ğ°Ğ²: Ñ‰Ğ¾ Ğ¿Ñ€Ğ¸Ğ¹Ğ´Ğµ.\n\n2. She explained that she needed more time for this project.\n   - [x] Ğ’Ğ¾Ğ½Ğ° Ğ¿Ğ¾ÑÑĞ½Ğ¸Ğ»Ğ°, Ñ‰Ğ¾ Ñ—Ğ¹ Ğ¿Ğ¾Ñ‚Ñ€Ñ–Ğ±Ğ½Ğ¾ Ğ±Ñ–Ğ»ÑŒÑˆĞµ Ñ‡Ğ°ÑÑƒ Ğ´Ğ»Ñ Ñ†ÑŒĞ¾Ğ³Ğ¾ Ğ¿Ñ€Ğ¾ĞµĞºÑ‚Ñƒ.\n   - [ ] Ğ’Ğ¾Ğ½Ğ° Ğ¿Ğ¾ÑÑĞ½Ğ¸Ğ»Ğ° Ñ‰Ğ¾ Ğ¼ĞµĞ½Ñ– Ğ¿Ğ¾Ñ‚Ñ€Ñ–Ğ±Ğ½Ğ¾ Ñ‡Ğ°Ñ.\n   - [ ] Ğ’Ğ¾Ğ½Ğ° Ğ¿Ğ¾ÑÑĞ½Ğ¸Ğ»Ğ°, Ñ Ğ¿Ğ¾Ñ‚Ñ€Ñ–Ğ±Ğ½Ğ¾ Ñ‡Ğ°Ñ.\n   - [ ] Ğ’Ğ¾Ğ½Ğ° Ğ¿Ğ¾ÑÑĞ½Ğ¸Ğ»Ğ°: Ñ‰Ğ¾ Ğ¿Ğ¾Ñ‚Ñ€Ñ–Ğ±Ğ½Ğ¾ Ñ‡Ğ°Ñ.\n\n3. The director announced that the meeting was postponed until next week.\n   - [x] Ğ”Ğ¸Ñ€ĞµĞºÑ‚Ğ¾Ñ€ Ğ·Ğ°ÑĞ²Ğ¸Ğ², Ñ‰Ğ¾ Ğ·Ğ±Ğ¾Ñ€Ğ¸ Ğ¿ĞµÑ€ĞµĞ½ĞµÑĞµĞ½Ğ¾ Ğ½Ğ° Ğ½Ğ°ÑÑ‚ÑƒĞ¿Ğ½Ğ¸Ğ¹ Ñ‚Ğ¸Ğ¶Ğ´ĞµĞ½ÑŒ.\n   - [ ] Ğ”Ğ¸Ñ€ĞµĞºÑ‚Ğ¾Ñ€ Ğ·Ğ°ÑĞ²Ğ¸Ğ² Ñ‰Ğ¾ Ğ·Ğ±Ğ¾Ñ€Ğ¸ Ğ¿ĞµÑ€ĞµĞ½ĞµÑĞµĞ½Ğ¾.\n   - [ ] Ğ”Ğ¸Ñ€ĞµĞºÑ‚Ğ¾Ñ€ Ğ·Ğ°ÑĞ²Ğ¸Ğ², Ğ·Ğ±Ğ¾Ñ€Ğ¸ Ğ¿ĞµÑ€ĞµĞ½ĞµÑĞµĞ½Ğ¾.\n   - [ ] Ğ”Ğ¸Ñ€ĞµĞºÑ‚Ğ¾Ñ€ Ğ·Ğ°ÑĞ²Ğ¸Ğ²: Ñ‰Ğ¾ Ğ·Ğ±Ğ¾Ñ€Ğ¸.\n\n4. He added that he would wait for a response until Friday.\n   - [x] Ğ’Ñ–Ğ½ Ğ´Ğ¾Ğ´Ğ°Ğ², Ñ‰Ğ¾ Ğ±ÑƒĞ´Ğµ Ñ‡ĞµĞºĞ°Ñ‚Ğ¸ Ğ½Ğ° Ğ²Ñ–Ğ´Ğ¿Ğ¾Ğ²Ñ–Ğ´ÑŒ Ğ´Ğ¾ Ğ¿'ÑÑ‚Ğ½Ğ¸Ñ†Ñ–.\n   - [ ] Ğ’Ñ–Ğ½ Ğ´Ğ¾Ğ´Ğ°Ğ² Ñ‰Ğ¾ Ñ‡ĞµĞºĞ°Ñ‚Ğ¸Ğ¼Ğµ Ğ²Ñ–Ğ´Ğ¿Ğ¾Ğ²Ñ–Ğ´ÑŒ.\n   - [ ] Ğ’Ñ–Ğ½ Ğ´Ğ¾Ğ´Ğ°Ğ², Ñ Ğ±ÑƒĞ´Ñƒ Ñ‡ĞµĞºĞ°Ñ‚Ğ¸.\n   - [ ] Ğ’Ñ–Ğ½ Ğ´Ğ¾Ğ´Ğ°Ğ² Ñ‡ĞµĞºĞ°Ñ‚Ğ¸ Ğ´Ğ¾ Ğ¿'ÑÑ‚Ğ½Ğ¸Ñ†Ñ–.\n\n5. She noted that the weather was nice today for a walk.\n   - [x] Ğ’Ğ¾Ğ½Ğ° Ğ·Ğ°ÑƒĞ²Ğ°Ğ¶Ğ¸Ğ»Ğ°, Ñ‰Ğ¾ Ğ¿Ğ¾Ğ³Ğ¾Ğ´Ğ° ÑÑŒĞ¾Ğ³Ğ¾Ğ´Ğ½Ñ– Ğ³Ğ°Ñ€Ğ½Ğ° Ğ´Ğ»Ñ Ğ¿Ñ€Ğ¾Ğ³ÑƒĞ»ÑĞ½ĞºĞ¸.\n   - [ ] Ğ’Ğ¾Ğ½Ğ° Ğ·Ğ°ÑƒĞ²Ğ°Ğ¶Ğ¸Ğ»Ğ° Ñ‰Ğ¾ Ğ¿Ğ¾Ğ³Ğ¾Ğ´Ğ° Ğ³Ğ°Ñ€Ğ½Ğ°.\n   - [ ] Ğ’Ğ¾Ğ½Ğ° Ğ·Ğ°ÑƒĞ²Ğ°Ğ¶Ğ¸Ğ»Ğ°, Ğ¿Ğ¾Ğ³Ğ¾Ğ´Ğ° Ğ³Ğ°Ñ€Ğ½Ğ°.\n   - [ ] Ğ’Ğ¾Ğ½Ğ° Ğ·Ğ°ÑƒĞ²Ğ°Ğ¶Ğ¸Ğ»Ğ°: Ñ‰Ğ¾ Ğ¿Ğ¾Ğ³Ğ¾Ğ´Ğ°.\n\n6. The witness claims that he saw this person there that same evening.\n   - [x] Ğ¡Ğ²Ñ–Ğ´Ğ¾Ğº ÑÑ‚Ğ²ĞµÑ€Ğ´Ğ¶ÑƒÑ”, Ñ‰Ğ¾ Ğ²Ñ–Ğ½ Ğ±Ğ°Ñ‡Ğ¸Ğ² Ñ†Ñ Ğ»ÑĞ´Ğ¸Ğ½Ñƒ Ñ‚Ğ°Ğ¼ Ñ‚Ğ¾Ğ³Ğ¾ ÑĞ°Ğ¼Ğ¾Ğ³Ğ¾ Ğ²ĞµÑ‡Ğ¾Ñ€Ğ°.\n   - [ ] Ğ¡Ğ²Ñ–Ğ´Ğ¾Ğº ÑÑ‚Ğ²ĞµÑ€Ğ´Ğ¶ÑƒÑ” Ñ‰Ğ¾ Ğ±Ğ°Ñ‡Ğ¸Ğ² Ğ»ÑĞ´Ğ¸Ğ½Ñƒ.\n   - [ ] Ğ¡Ğ²Ñ–Ğ´Ğ¾Ğº ÑÑ‚Ğ²ĞµÑ€Ğ´Ğ¶ÑƒÑ”, Ñ Ğ±Ğ°Ñ‡Ğ¸Ğ².\n   - [ ] Ğ¡Ğ²Ñ–Ğ´Ğ¾Ğº ÑÑ‚Ğ²ĞµÑ€Ğ´Ğ¶ÑƒÑ”: Ñ‰Ğ¾ Ğ±Ğ°Ñ‡Ğ¸Ğ².\n\n---"
      },
      {
        "id": "section-3",
        "name": "Ğ¡Ğ»Ğ¾Ğ²Ğ½Ğ¸Ğº",
        "nameEn": null,
        "type": "vocabulary",
        "content": "| Ğ¡Ğ»Ğ¾Ğ²Ğ¾ | Ğ’Ğ¸Ğ¼Ğ¾Ğ²Ğ° | ĞŸĞµÑ€ĞµĞºĞ»Ğ°Ğ´ | Ğ§Ğœ | ĞŸÑ€Ğ¸Ğ¼Ñ–Ñ‚ĞºĞ° |\n|-------|--------|----------|-----|----------|\n| **Ğ½ĞµĞ¿Ñ€ÑĞ¼Ğ° Ğ¼Ğ¾Ğ²Ğ°** | /nÉ›prÊ²É‘ËˆmÉ‘ ËˆmÉ”wÉ‘/ | indirect speech | Ğ²Ğ¸Ñ€Ğ°Ğ· | Ğ¿ĞµÑ€ĞµĞ´Ğ°Ñ‡Ğ° Ñ‡ÑƒĞ¶Ğ¸Ñ… ÑĞ»Ñ–Ğ² |\n| **Ğ¿Ñ€ÑĞ¼Ğ° Ğ¼Ğ¾Ğ²Ğ°** | /prÊ²É‘ËˆmÉ‘ ËˆmÉ”wÉ‘/ | direct speech | Ğ²Ğ¸Ñ€Ğ°Ğ· | Ğ´Ğ¾ÑĞ»Ñ–Ğ²Ğ½Ğµ Ñ†Ğ¸Ñ‚ÑƒĞ²Ğ°Ğ½Ğ½Ñ |\n| **Ğ´Ñ–Ñ”ÑĞ»Ğ¾Ğ²Ğ¾ Ğ²Ğ²ĞµĞ´ĞµĞ½Ğ½Ñ** | /dÊ²iËˆjÉ›slÉ”wÉ” wËˆwÉ›dÉ›nÊ²É‘/ | reporting verb | Ğ²Ğ¸Ñ€Ğ°Ğ· | Ğ²Ğ²Ğ¾Ğ´Ğ¸Ñ‚ÑŒ Ğ½ĞµĞ¿Ñ€ÑĞ¼Ñƒ Ğ¼Ğ¾Ğ²Ñƒ |\n| **ÑĞºĞ°Ğ·Ğ°Ñ‚Ğ¸** | /skÉ‘ËˆzÉ‘tÉª/ | to say | Ğ´Ñ–Ñ”ÑĞ». | Ğ½ĞµĞ¹Ñ‚Ñ€Ğ°Ğ»ÑŒĞ½Ğµ |\n| **Ğ³Ğ¾Ğ²Ğ¾Ñ€Ğ¸Ñ‚Ğ¸** | /É¦É”wÉ”ËˆrÉªtÉª/ | to speak/tell | Ğ´Ñ–Ñ”ÑĞ». | Ñ‚Ñ€Ğ¸Ğ²Ğ°Ğ»Ğ° Ñ€Ğ¾Ğ·Ğ¼Ğ¾Ğ²Ğ° |\n| **Ğ¿Ğ¾Ğ²Ñ–Ğ´Ğ¾Ğ¼Ğ¸Ñ‚Ğ¸** | /pÉ”wÊ²idÉ”ËˆmÉªtÉª/ | to inform | Ğ´Ñ–Ñ”ÑĞ». | Ğ¾Ñ„Ñ–Ñ†Ñ–Ğ¹Ğ½Ğµ |\n| **Ğ·Ğ°ÑĞ²Ğ¸Ñ‚Ğ¸** | /zÉ‘jÉ‘ËˆwÉªtÉª/ | to declare | Ğ´Ñ–Ñ”ÑĞ». | Ğ¾Ñ„Ñ–Ñ†Ñ–Ğ¹Ğ½Ğ° Ğ·Ğ°ÑĞ²Ğ° |\n| **Ğ¿Ğ¾ÑÑĞ½Ğ¸Ñ‚Ğ¸** | /pÉ”jÉ‘sËˆnÉªtÉª/ | to explain | Ğ´Ñ–Ñ”ÑĞ». | Ñ€Ğ¾Ğ·'ÑÑĞ½ĞµĞ½Ğ½Ñ |\n| **Ğ´Ğ¾Ğ´Ğ°Ñ‚Ğ¸** | /dÉ”ËˆdÉ‘tÉª/ | to add | Ğ´Ñ–Ñ”ÑĞ». | Ğ´Ğ¾Ğ´Ğ°Ñ‚ĞºĞ¾Ğ²Ğ° Ñ–Ğ½Ñ„Ğ¾Ñ€Ğ¼Ğ°Ñ†Ñ–Ñ |\n| **Ğ·Ğ°ÑƒĞ²Ğ°Ğ¶Ğ¸Ñ‚Ğ¸** | /zÉ‘uËˆwÉ‘Ê’ÉªtÉª/ | to remark | Ğ´Ñ–Ñ”ÑĞ». | ĞºĞ¾Ğ¼ĞµĞ½Ñ‚Ğ°Ñ€ |\n| **ÑÑ‚Ğ²ĞµÑ€Ğ´Ğ¶ÑƒĞ²Ğ°Ñ‚Ğ¸** | /stwÉ›rËˆdÊ’uwÉ‘tÉª/ | to claim | Ğ´Ñ–Ñ”ÑĞ». | Ğ½Ğ°Ğ¿Ğ¾Ğ»ÑĞ³Ğ°Ğ½Ğ½Ñ |\n| **Ğ²Ğ¸Ğ·Ğ½Ğ°Ñ‚Ğ¸** | /wÉªzËˆnÉ‘tÉª/ | to admit | Ğ´Ñ–Ñ”ÑĞ». | Ğ²Ğ¸Ğ·Ğ½Ğ°Ğ½Ğ½Ñ |\n| **Ğ·Ğ°Ğ¿ĞµÑ€ĞµÑ‡Ğ¸Ñ‚Ğ¸** | /zÉ‘pÉ›ËˆrÉ›tÊƒÉªtÉª/ | to deny | Ğ´Ñ–Ñ”ÑĞ». | Ğ·Ğ°Ğ¿ĞµÑ€ĞµÑ‡ĞµĞ½Ğ½Ñ |\n| **Ğ¿Ñ–Ğ´Ñ‚Ğ²ĞµÑ€Ğ´Ğ¸Ñ‚Ğ¸** | /pÊ²idtwÉ›rËˆdÉªtÉª/ | to confirm | Ğ´Ñ–Ñ”ÑĞ». | Ğ¿Ñ–Ğ´Ñ‚Ğ²ĞµÑ€Ğ´Ğ¶ĞµĞ½Ğ½Ñ |\n| **Ğ½Ğ°Ñ‚ÑĞºĞ½ÑƒÑ‚Ğ¸** | /nÉ‘ËˆtÊ²É‘knutÉª/ | to hint | Ğ´Ñ–Ñ”ÑĞ». | Ğ½ĞµĞ¿Ñ€ÑĞ¼Ğ° Ğ²ĞºĞ°Ğ·Ñ–Ğ²ĞºĞ° |\n| **Ğ·ÑÑƒĞ² Ñ‡Ğ°ÑÑƒ** | /zsuw ËˆtÊƒÉ‘su/ | tense backshift | Ğ²Ğ¸Ñ€Ğ°Ğ· | Ğ·Ğ¼Ñ–Ğ½Ğ° Ñ‡Ğ°ÑÑƒ Ğ´Ñ–Ñ”ÑĞ»Ğ¾Ğ²Ğ° |\n| **Ğ½Ğ°ÑÑ‚ÑƒĞ¿Ğ½Ğ¾Ğ³Ğ¾ Ğ´Ğ½Ñ** | /nÉ‘sËˆtupnÉ”É¦É” dnÊ²É‘/ | the next day | Ğ²Ğ¸Ñ€Ğ°Ğ· | = Ğ·Ğ°Ğ²Ñ‚Ñ€Ğ° Ğ² Ğ¼Ğ¸Ğ½ÑƒĞ»Ğ¾Ğ¼Ñƒ |\n| **Ğ½Ğ°Ğ¿ĞµÑ€ĞµĞ´Ğ¾Ğ´Ğ½Ñ–** | /nÉ‘pÉ›rÉ›ËˆdÉ”dnÊ²i/ | the day before | Ğ¿Ñ€Ğ¸ÑĞ». | = Ğ²Ñ‡Ğ¾Ñ€Ğ° Ğ² Ğ¼Ğ¸Ğ½ÑƒĞ»Ğ¾Ğ¼Ñƒ |\n| **Ñ‚Ğ¾Ğ³Ğ¾ Ğ´Ğ½Ñ** | /tÉ”ËˆÉ¦É” dnÊ²É‘/ | that day | Ğ²Ğ¸Ñ€Ğ°Ğ· | = ÑÑŒĞ¾Ğ³Ğ¾Ğ´Ğ½Ñ– Ğ² Ğ¼Ğ¸Ğ½ÑƒĞ»Ğ¾Ğ¼Ñƒ |\n| **Ñ‚Ğ¾Ğ´Ñ–** | /tÉ”ËˆdÊ²i/ | then | Ğ¿Ñ€Ğ¸ÑĞ». | = Ğ·Ğ°Ñ€Ğ°Ğ· Ğ² Ğ¼Ğ¸Ğ½ÑƒĞ»Ğ¾Ğ¼Ñƒ |\n| **Ğ¿ĞµÑ€ĞµĞºĞ°Ğ·** | /pÉ›rÉ›ËˆkÉ‘z/ | retelling | Ñ–Ğ¼. (Ñ‡.Ñ€.) | Ğ¿ĞµÑ€ĞµĞ´Ğ°Ñ‡Ğ° Ğ·Ğ¼Ñ–ÑÑ‚Ñƒ |\n| **Ñ†Ğ¸Ñ‚ÑƒĞ²Ğ°Ğ½Ğ½Ñ** | /tÍ¡sÉªtuËˆwÉ‘nÊ²É‘/ | quotation | Ñ–Ğ¼. (Ñ.Ñ€.) | Ğ´Ğ¾ÑĞ»Ñ–Ğ²Ğ½Ğµ Ğ¿Ğ¾Ğ²Ñ‚Ğ¾Ñ€ĞµĞ½Ğ½Ñ |\n| **Ğ¿ĞµÑ€ĞµĞ´Ğ°Ñ‚Ğ¸** | /pÉ›rÉ›ËˆdÉ‘tÉª/ | to convey | Ğ´Ñ–Ñ”ÑĞ». | Ğ¿ĞµÑ€ĞµĞ´Ğ°Ñ‚Ğ¸ Ñ–Ğ½Ñ„Ğ¾Ñ€Ğ¼Ğ°Ñ†Ñ–Ñ |\n| **ÑĞ¿Ğ¾Ñ‚Ğ²Ğ¾Ñ€Ğ¸Ñ‚Ğ¸** | /spÉ”twÉ”ËˆrÉªtÉª/ | to distort | Ğ´Ñ–Ñ”ÑĞ». | Ğ·Ğ¼Ñ–Ğ½Ğ¸Ñ‚Ğ¸ Ğ·Ğ¼Ñ–ÑÑ‚ |\n| **ĞºĞ¾Ğ½Ñ‚ĞµĞºÑÑ‚** | /kÉ”nËˆtÉ›kst/ | context | Ñ–Ğ¼. (Ñ‡.Ñ€.) | Ğ¾Ğ±ÑÑ‚Ğ°Ğ²Ğ¸Ğ½Ğ¸ |"
      }
    ],
    "rawMarkdown": "---\nmodule: b1-39\ntitle: \"ĞĞµĞ¿Ñ€ÑĞ¼Ğ° Ğ¼Ğ¾Ğ²Ğ°: Ñ‚Ğ²ĞµÑ€Ğ´Ğ¶ĞµĞ½Ğ½Ñ\"\nsubtitle: \"Reported Statements\"\nversion: \"1.0\"\nphase: \"B1.3b Complex Sentences\"\npedagogy: \"TTT\"\nduration: 90\ntransliteration: none\ntags:\n  - grammar\n  - reported-speech\n  - indirect-speech\n  - statements\ngrammar:\n  - \"Converting direct speech to indirect speech\"\n  - \"Ğ’Ñ–Ğ½ ÑĞºĞ°Ğ·Ğ°Ğ², Ñ‰Ğ¾... constructions\"\nobjectives:\n  - \"Learner can report what someone said using indirect speech\"\n  - \"Learner can apply tense backshift in reported statements\"\n  - \"Learner can use appropriate reporting verbs\"\nvocabulary_count: 25\n---\n\n> [!motivation]\n> Â«Ğ’Ñ–Ğ½ ÑĞºĞ°Ğ·Ğ°Ğ², Ñ‰Ğ¾ Ğ¿Ñ€Ğ¸Ğ¹Ğ´Ğµ Ğ·Ğ°Ğ²Ñ‚Ñ€Ğ°.Â» Ğ¯Ğº Ğ¿ĞµÑ€ĞµĞ´Ğ°Ñ‚Ğ¸ Ñ‡ÑƒĞ¶Ñ– ÑĞ»Ğ¾Ğ²Ğ°? ĞĞµĞ¿Ñ€ÑĞ¼Ğ° Ğ¼Ğ¾Ğ²Ğ° â€” Ñ†Ğµ Ñ„ÑƒĞ½Ğ´Ğ°Ğ¼ĞµĞ½Ñ‚Ğ°Ğ»ÑŒĞ½Ğ° Ğ½Ğ°Ğ²Ğ¸Ñ‡ĞºĞ° Ğ´Ğ»Ñ Ğ¿ĞµÑ€ĞµĞºĞ°Ğ·Ñƒ Ñ€Ğ¾Ğ·Ğ¼Ğ¾Ğ², Ğ½Ğ°Ğ¿Ğ¸ÑĞ°Ğ½Ğ½Ñ Ğ·Ğ²Ñ–Ñ‚Ñ–Ğ², Ğ¿Ñ–Ğ´ÑÑƒĞ¼Ğ¾Ğ²ÑƒĞ²Ğ°Ğ½Ğ½Ñ Ñ–Ğ½Ñ„Ğ¾Ñ€Ğ¼Ğ°Ñ†Ñ–Ñ— Ñ‚Ğ° Ñ†Ğ¸Ñ‚ÑƒĞ²Ğ°Ğ½Ğ½Ñ Ğ´Ğ¶ĞµÑ€ĞµĞ» Ğ² Ğ°ĞºĞ°Ğ´ĞµĞ¼Ñ–Ñ‡Ğ½Ğ¸Ñ… Ñ‚ĞµĞºÑÑ‚Ğ°Ñ…. ĞĞ¿Ğ°Ğ½ÑƒĞ²Ğ°Ğ²ÑˆĞ¸ Ğ½ĞµĞ¿Ñ€ÑĞ¼Ñƒ Ğ¼Ğ¾Ğ²Ñƒ, Ğ²Ğ¸ Ğ·Ğ¼Ğ¾Ğ¶ĞµÑ‚Ğµ Ñ‚Ğ¾Ñ‡Ğ½Ğ¾ Ğ¿ĞµÑ€ĞµĞ´Ğ°Ğ²Ğ°Ñ‚Ğ¸ Ğ´ÑƒĞ¼ĞºĞ¸ Ñ–Ğ½ÑˆĞ¸Ñ… Ğ»ÑĞ´ĞµĞ¹ Ğ±ĞµĞ· ÑĞ¿Ğ¾Ñ‚Ğ²Ğ¾Ñ€ĞµĞ½Ğ½Ñ Ğ·Ğ¼Ñ–ÑÑ‚Ñƒ! Ğ¦Ğµ ĞºÑ€Ğ¸Ñ‚Ğ¸Ñ‡Ğ½Ğ¾ Ğ²Ğ°Ğ¶Ğ»Ğ¸Ğ²Ğ¾ Ğ´Ğ»Ñ Ğ¶ÑƒÑ€Ğ½Ğ°Ğ»Ñ–ÑÑ‚Ğ¸ĞºĞ¸, Ğ½Ğ°ÑƒĞºĞ¾Ğ²Ğ¾Ğ³Ğ¾ Ğ¿Ğ¸ÑÑŒĞ¼Ğ° Ñ‚Ğ° Ğ¿Ğ¾Ğ²ÑÑĞºĞ´ĞµĞ½Ğ½Ğ¾Ğ³Ğ¾ ÑĞ¿Ñ–Ğ»ĞºÑƒĞ²Ğ°Ğ½Ğ½Ñ.\n\n---\n\n## Ğ¢ĞµÑÑ‚\n\nĞŸĞ¾Ñ€Ñ–Ğ²Ğ½ÑĞ¹Ñ‚Ğµ Ğ´Ğ²Ğ° Ñ€ĞµÑ‡ĞµĞ½Ğ½Ñ Ñ– Ğ²Ğ¸Ğ·Ğ½Ğ°Ñ‡Ñ‚Ğµ Ğ¾ÑĞ½Ğ¾Ğ²Ğ½Ñ– Ğ²Ñ–Ğ´Ğ¼Ñ–Ğ½Ğ½Ğ¾ÑÑ‚Ñ– Ğ¼Ñ–Ğ¶ Ğ¿Ñ€ÑĞ¼Ğ¾Ñ Ñ‚Ğ° Ğ½ĞµĞ¿Ñ€ÑĞ¼Ğ¾Ñ Ğ¼Ğ¾Ğ²Ğ¾Ñ. Ğ£Ğ²Ğ°Ğ¶Ğ½Ğ¾ Ğ¿Ñ€Ğ¾Ñ‡Ğ¸Ñ‚Ğ°Ğ¹Ñ‚Ğµ Ğ¾Ğ±Ğ¸Ğ´Ğ²Ğ° Ğ¿Ñ€Ğ¸ĞºĞ»Ğ°Ğ´Ğ¸ Ñ‚Ğ° Ğ·Ğ²ĞµÑ€Ğ½Ñ–Ñ‚ÑŒ ÑƒĞ²Ğ°Ğ³Ñƒ Ğ½Ğ° Ğ·Ğ¼Ñ–Ğ½Ğ¸:\n\n**ĞŸÑ€ÑĞ¼Ğ° Ğ¼Ğ¾Ğ²Ğ°:** ĞœĞ°Ñ€Ñ–Ñ ĞºĞ°Ğ¶Ğµ: Â«Ğ¯ Ğ¿Ñ€Ğ¸Ğ¹Ğ´Ñƒ Ğ·Ğ°Ğ²Ñ‚Ñ€Ğ° Ğ´Ğ¾ Ñ‚ĞµĞ±Ğµ Ğ² Ğ³Ğ¾ÑÑ‚Ñ– Ğ½Ğ° Ğ²ĞµÑ‡ĞµÑ€Ñ.Â»\n\n**ĞĞµĞ¿Ñ€ÑĞ¼Ğ° Ğ¼Ğ¾Ğ²Ğ°:** ĞœĞ°Ñ€Ñ–Ñ ĞºĞ°Ğ¶Ğµ, Ñ‰Ğ¾ Ğ²Ğ¾Ğ½Ğ° Ğ¿Ñ€Ğ¸Ğ¹Ğ´Ğµ Ğ·Ğ°Ğ²Ñ‚Ñ€Ğ° Ğ´Ğ¾ Ğ¼ĞµĞ½Ğµ Ğ² Ğ³Ğ¾ÑÑ‚Ñ– Ğ½Ğ° Ğ²ĞµÑ‡ĞµÑ€Ñ.\n\nĞ¯ĞºÑ– Ğ·Ğ¼Ñ–Ğ½Ğ¸ Ğ²Ñ–Ğ´Ğ±ÑƒĞ»Ğ¸ÑÑ Ğ¿Ñ€Ğ¸ Ğ¿ĞµÑ€ĞµÑ…Ğ¾Ğ´Ñ– Ğ´Ğ¾ Ğ½ĞµĞ¿Ñ€ÑĞ¼Ğ¾Ñ— Ğ¼Ğ¾Ğ²Ğ¸?\n\n1. **Ğ—Ğ½Ğ¸ĞºĞ»Ğ¸ Ğ»Ğ°Ğ¿ĞºĞ¸** â€” Ğ¼Ğ¸ Ğ±Ñ–Ğ»ÑŒÑˆĞµ Ğ½Ğµ Ñ†Ğ¸Ñ‚ÑƒÑ”Ğ¼Ğ¾ Ğ´Ğ¾ÑĞ»Ñ–Ğ²Ğ½Ğ¾.\n2. **Ğ—'ÑĞ²Ğ¸Ğ²ÑÑ ÑĞ¿Ğ¾Ğ»ÑƒÑ‡Ğ½Ğ¸Ğº Â«Ñ‰Ğ¾Â»** â€” Ğ²Ñ–Ğ½ Ğ·'Ñ”Ğ´Ğ½ÑƒÑ” Ğ³Ğ¾Ğ»Ğ¾Ğ²Ğ½Ğµ Ñ€ĞµÑ‡ĞµĞ½Ğ½Ñ Ğ· Ğ¿Ñ–Ğ´Ñ€ÑĞ´Ğ½Ğ¸Ğ¼.\n3. **Ğ—Ğ¼Ñ–Ğ½Ğ¸Ğ²ÑÑ Ğ·Ğ°Ğ¹Ğ¼ĞµĞ½Ğ½Ğ¸Ğº** â€” Â«ÑÂ» â†’ Â«Ğ²Ğ¾Ğ½Ğ°Â» (Ğ· Ñ‚Ğ¾Ñ‡ĞºĞ¸ Ğ·Ğ¾Ñ€Ñƒ Ñ‚Ğ¾Ğ³Ğ¾, Ñ…Ñ‚Ğ¾ Ğ¿ĞµÑ€ĞµĞ´Ğ°Ñ”).\n4. **Ğ—Ğ¼Ñ–Ğ½Ğ¸Ğ²ÑÑ Ğ¿Ñ€Ğ¸ÑĞ²Ñ–Ğ¹Ğ½Ğ¸Ğ¹ Ğ·Ğ°Ğ¹Ğ¼ĞµĞ½Ğ½Ğ¸Ğº** â€” Â«Ñ‚ĞµĞ±ĞµÂ» â†’ Â«Ğ¼ĞµĞ½ĞµÂ».\n\nĞ¦Ğµ â€” **Ğ½ĞµĞ¿Ñ€ÑĞ¼Ğ° Ğ¼Ğ¾Ğ²Ğ°** (Ğ½ĞµĞ¿Ñ€ÑĞ¼Ğµ Ğ¼Ğ¾Ğ²Ğ»ĞµĞ½Ğ½Ñ, indirect speech). ĞœĞ¸ Ğ¿ĞµÑ€ĞµĞ´Ğ°Ñ”Ğ¼Ğ¾ Ğ·Ğ¼Ñ–ÑÑ‚ Ñ‡ÑƒĞ¶Ğ¸Ñ… ÑĞ»Ñ–Ğ², Ğ° Ğ½Ğµ Ñ†Ğ¸Ñ‚ÑƒÑ”Ğ¼Ğ¾ Ñ—Ñ… Ğ´Ğ¾ÑĞ»Ñ–Ğ²Ğ½Ğ¾, Ğ¿Ñ€Ğ¸ Ñ†ÑŒĞ¾Ğ¼Ñƒ Ğ°Ğ´Ğ°Ğ¿Ñ‚ÑƒÑÑ‡Ğ¸ Ğ·Ğ°Ğ¹Ğ¼ĞµĞ½Ğ½Ğ¸ĞºĞ¸ Ñ‚Ğ° Ñ–Ğ½ÑˆÑ– ĞµĞ»ĞµĞ¼ĞµĞ½Ñ‚Ğ¸ Ğ´Ğ¾ ĞºĞ¾Ğ½Ñ‚ĞµĞºÑÑ‚Ñƒ.\n\n> ğŸ’¡ **Ğ¦Ñ–ĞºĞ°Ğ²Ğ¸Ğ¹ Ñ„Ğ°ĞºÑ‚**\n> Ğ’ ÑƒĞºÑ€Ğ°Ñ—Ğ½ÑÑŒĞºÑ–Ğ¹ Ğ¼Ğ¾Ğ²Ñ– Ğ½ĞµĞ¿Ñ€ÑĞ¼Ğ° Ğ¼Ğ¾Ğ²Ğ° Ñ‡Ğ°ÑÑ‚Ğ¾ Ğ¿Ñ€Ğ¾ÑÑ‚Ñ–ÑˆĞ°, Ğ½Ñ–Ğ¶ Ğ² Ğ°Ğ½Ğ³Ğ»Ñ–Ğ¹ÑÑŒĞºÑ–Ğ¹, Ğ±Ğ¾ Ğ½Ğµ Ğ·Ğ°Ğ²Ğ¶Ğ´Ğ¸ Ğ¿Ğ¾Ñ‚Ñ€Ñ–Ğ±ĞµĞ½ Ğ·ÑÑƒĞ² Ñ‡Ğ°ÑÑ–Ğ². Ğ¯ĞºÑ‰Ğ¾ Ğ´Ñ–Ñ Ñ‰Ğµ Ğ°ĞºÑ‚ÑƒĞ°Ğ»ÑŒĞ½Ğ°, Ñ‡Ğ°Ñ Ğ´Ñ–Ñ”ÑĞ»Ğ¾Ğ²Ğ° Ğ¼Ğ¾Ğ¶Ğµ Ğ·Ğ°Ğ»Ğ¸ÑˆĞ°Ñ‚Ğ¸ÑÑ Ğ½ĞµĞ·Ğ¼Ñ–Ğ½Ğ½Ğ¸Ğ¼: Â«Ğ’Ñ–Ğ½ ÑĞºĞ°Ğ·Ğ°Ğ², Ñ‰Ğ¾ Ğ²Ñ–Ğ½ Ğ¿Ñ€Ğ°Ñ†ÑÑ” Ñ‚ÑƒÑ‚.Â» Ğ’ Ğ°Ğ½Ğ³Ğ»Ñ–Ğ¹ÑÑŒĞºÑ–Ğ¹ Ñ†Ğµ Ğ¾Ğ±Ğ¾Ğ²'ÑĞ·ĞºĞ¾Ğ²Ğ¾ Ğ±ÑƒĞ»Ğ¾ Ğ± past: Â«He said that he worked there.Â» Ğ¦Ñ Ğ³Ğ½ÑƒÑ‡ĞºÑ–ÑÑ‚ÑŒ Ñ€Ğ¾Ğ±Ğ¸Ñ‚ÑŒ ÑƒĞºÑ€Ğ°Ñ—Ğ½ÑÑŒĞºÑƒ Ğ½ĞµĞ¿Ñ€ÑĞ¼Ñƒ Ğ¼Ğ¾Ğ²Ñƒ Ñ–Ğ½Ñ‚ÑƒÑ—Ñ‚Ğ¸Ğ²Ğ½Ñ–ÑˆĞ¾Ñ Ğ´Ğ»Ñ Ğ²Ğ¸Ğ²Ñ‡ĞµĞ½Ğ½Ñ! ĞšÑ€Ñ–Ğ¼ Ñ‚Ğ¾Ğ³Ğ¾, ÑƒĞºÑ€Ğ°Ñ—Ğ½ÑÑŒĞºĞ° Ğ¼Ğ¾Ğ²Ğ° Ğ¼Ğ°Ñ” Ğ½Ğ°Ğ±Ğ°Ğ³Ğ°Ñ‚Ğ¾ Ğ±Ñ–Ğ»ÑŒÑˆĞµ Ğ´Ñ–Ñ”ÑĞ»Ñ–Ğ² Ğ²Ğ²ĞµĞ´ĞµĞ½Ğ½Ñ, Ğ½Ñ–Ğ¶ Ğ°Ğ½Ğ³Ğ»Ñ–Ğ¹ÑÑŒĞºĞ°, Ñ‰Ğ¾ Ğ´Ğ¾Ğ·Ğ²Ğ¾Ğ»ÑÑ” Ñ‚Ğ¾Ñ‡Ğ½Ñ–ÑˆĞµ Ğ¿ĞµÑ€ĞµĞ´Ğ°Ğ²Ğ°Ñ‚Ğ¸ Ğ½ÑĞ°Ğ½ÑĞ¸ Ñ‚Ğ° ĞµĞ¼Ğ¾Ñ†Ñ–Ğ¹Ğ½Ğµ Ğ·Ğ°Ğ±Ğ°Ñ€Ğ²Ğ»ĞµĞ½Ğ½Ñ Ğ²Ğ¸ÑĞ»Ğ¾Ğ²Ğ»ÑĞ²Ğ°Ğ½ÑŒ. Ğ¦Ğµ ÑĞ¿Ñ€Ğ°Ğ²Ğ¶Ğ½Ñ Ğ¿ĞµÑ€ĞµĞ²Ğ°Ğ³Ğ° Ğ´Ğ»Ñ Ñ‚Ğ¸Ñ…, Ñ…Ñ‚Ğ¾ Ñ…Ğ¾Ñ‡Ğµ Ğ³Ğ¾Ğ²Ğ¾Ñ€Ğ¸Ñ‚Ğ¸ Ğ²Ğ¸Ñ€Ğ°Ğ·Ğ½Ğ¾Ñ ÑƒĞºÑ€Ğ°Ñ—Ğ½ÑÑŒĞºĞ¾Ñ!\n\n---\n\n## ĞŸĞ¾ÑÑĞ½ĞµĞ½Ğ½Ñ\n\n### Ğ©Ğ¾ Ñ‚Ğ°ĞºĞµ Ğ½ĞµĞ¿Ñ€ÑĞ¼Ğ° Ğ¼Ğ¾Ğ²Ğ°?\n\n**ĞĞµĞ¿Ñ€ÑĞ¼Ğ° Ğ¼Ğ¾Ğ²Ğ°** (indirect speech, reported speech) â€” Ñ†Ğµ ÑĞ¿Ğ¾ÑÑ–Ğ± Ğ¿ĞµÑ€ĞµĞ´Ğ°Ñ‡Ñ– Ñ‡ÑƒĞ¶Ğ¸Ñ… ÑĞ»Ñ–Ğ² Ğ±ĞµĞ· Ğ´Ğ¾ÑĞ»Ñ–Ğ²Ğ½Ğ¾Ğ³Ğ¾ Ñ†Ğ¸Ñ‚ÑƒĞ²Ğ°Ğ½Ğ½Ñ.\n\n| Ğ¢Ğ¸Ğ¿ | Ğ¡Ñ‚Ñ€ÑƒĞºÑ‚ÑƒÑ€Ğ° | ĞŸÑ€Ğ¸ĞºĞ»Ğ°Ğ´ |\n|-----|-----------|---------|\n| **ĞŸÑ€ÑĞ¼Ğ° Ğ¼Ğ¾Ğ²Ğ°** | Ğ¥Ñ‚Ğ¾ + Ğ´Ñ–Ñ”ÑĞ»Ğ¾Ğ²Ğ¾: Â«Ğ¦Ğ¸Ñ‚Ğ°Ñ‚Ğ°Â» | Ğ’Ñ–Ğ½ ÑĞºĞ°Ğ·Ğ°Ğ²: Â«Ğ¯ Ğ¹Ğ´Ñƒ.Â» |\n| **ĞĞµĞ¿Ñ€ÑĞ¼Ğ° Ğ¼Ğ¾Ğ²Ğ°** | Ğ¥Ñ‚Ğ¾ + Ğ´Ñ–Ñ”ÑĞ»Ğ¾Ğ²Ğ¾, Ñ‰Ğ¾ + Ğ·Ğ¼Ñ–ÑÑ‚ | Ğ’Ñ–Ğ½ ÑĞºĞ°Ğ·Ğ°Ğ², Ñ‰Ğ¾ Ğ²Ñ–Ğ½ Ñ–Ğ´Ğµ. |\n\n#### ĞÑĞ½Ğ¾Ğ²Ğ½Ñ– Ğ¿Ñ€Ğ°Ğ²Ğ¸Ğ»Ğ° Ğ¿ĞµÑ€ĞµÑ…Ğ¾Ğ´Ñƒ\n\n**1. Ğ”Ğ¾Ğ´Ğ°Ñ”Ğ¼Ğ¾ ÑĞ¿Ğ¾Ğ»ÑƒÑ‡Ğ½Ğ¸Ğº Â«Ñ‰Ğ¾Â»:**\n\nĞŸÑ€ÑĞ¼Ğ°: Ğ’Ğ¾Ğ½Ğ° ĞºĞ°Ğ¶Ğµ: Â«Ğ¯ Ğ»ÑĞ±Ğ»Ñ Ñ†Ñ ĞºĞ½Ğ¸Ğ³Ñƒ.Â»\nĞĞµĞ¿Ñ€ÑĞ¼Ğ°: Ğ’Ğ¾Ğ½Ğ° ĞºĞ°Ğ¶Ğµ, **Ñ‰Ğ¾** Ğ²Ğ¾Ğ½Ğ° Ğ»ÑĞ±Ğ¸Ñ‚ÑŒ Ñ†Ñ ĞºĞ½Ğ¸Ğ³Ñƒ.\n\n**2. Ğ—Ğ¼Ñ–Ğ½ÑÑ”Ğ¼Ğ¾ Ğ·Ğ°Ğ¹Ğ¼ĞµĞ½Ğ½Ğ¸ĞºĞ¸:**\n\n| ĞŸÑ€ÑĞ¼Ğ° Ğ¼Ğ¾Ğ²Ğ° | ĞĞµĞ¿Ñ€ÑĞ¼Ğ° Ğ¼Ğ¾Ğ²Ğ° | ĞŸĞ¾ÑÑĞ½ĞµĞ½Ğ½Ñ |\n|------------|--------------|-----------|\n| Ñ | Ğ²Ñ–Ğ½/Ğ²Ğ¾Ğ½Ğ° | Ğ¼Ğ¾Ğ²ĞµÑ†ÑŒ ÑÑ‚Ğ°Ñ” Ñ‚Ñ€ĞµÑ‚ÑŒĞ¾Ñ Ğ¾ÑĞ¾Ğ±Ğ¾Ñ |\n| Ñ‚Ğ¸ | Ñ/Ğ²Ñ–Ğ½/Ğ²Ğ¾Ğ½Ğ° | Ğ·Ğ°Ğ»ĞµĞ¶Ğ¸Ñ‚ÑŒ Ğ²Ñ–Ğ´ ĞºĞ¾Ğ½Ñ‚ĞµĞºÑÑ‚Ñƒ |\n| Ğ¼Ñ–Ğ¹ | Ğ¹Ğ¾Ğ³Ğ¾/Ñ—Ñ— | Ğ¿Ñ€Ğ¸ÑĞ²Ñ–Ğ¹Ğ½Ğ¸Ğ¹ Ğ·Ğ°Ğ¹Ğ¼ĞµĞ½Ğ½Ğ¸Ğº Ğ·Ğ¼Ñ–Ğ½ÑÑ”Ñ‚ÑŒÑÑ |\n| Ñ‚ÑƒÑ‚ | Ñ‚Ğ°Ğ¼ | Ğ¼Ñ–ÑÑ†Ğµ Ğ²Ñ–Ğ´Ğ½Ğ¾ÑĞ½Ğ¾ Ğ¼Ğ¾Ğ²Ñ†Ñ |\n| Ğ·Ğ°Ñ€Ğ°Ğ· | Ñ‚Ğ¾Ğ´Ñ– | Ñ‡Ğ°Ñ Ğ²Ñ–Ğ´Ğ½Ğ¾ÑĞ½Ğ¾ Ğ¼Ğ¾Ğ¼ĞµĞ½Ñ‚Ñƒ Ğ¼Ğ¾Ğ²Ğ»ĞµĞ½Ğ½Ñ |\n\n> ğŸŒ **Ğ£ Ñ€ĞµĞ°Ğ»ÑŒĞ½Ğ¾Ğ¼Ñƒ Ğ¶Ğ¸Ñ‚Ñ‚Ñ–**\n> Ğ£ Ñ‰Ğ¾Ğ´ĞµĞ½Ğ½Ğ¸Ñ… Ñ€Ğ¾Ğ·Ğ¼Ğ¾Ğ²Ğ°Ñ… ÑƒĞºÑ€Ğ°Ñ—Ğ½Ñ†Ñ– Ñ‡Ğ°ÑÑ‚Ğ¾ Ğ¾Ğ¿ÑƒÑĞºĞ°ÑÑ‚ÑŒ ÑĞ¿Ğ¾Ğ»ÑƒÑ‡Ğ½Ğ¸Ğº Â«Ñ‰Ğ¾Â» Ğ² Ñ€Ğ¾Ğ·Ğ¼Ğ¾Ğ²Ğ½Ğ¾Ğ¼Ñƒ ÑÑ‚Ñ–Ğ»Ñ–: *Â«Ğ’Ñ–Ğ½ ÑĞºĞ°Ğ·Ğ°Ğ², Ğ¹Ğ¾Ğ¼Ñƒ Ğ½Ñ–ĞºĞ¾Ğ»Ğ¸Â»* Ğ·Ğ°Ğ¼Ñ–ÑÑ‚ÑŒ *Â«Ğ’Ñ–Ğ½ ÑĞºĞ°Ğ·Ğ°Ğ², Ñ‰Ğ¾ Ğ¹Ğ¾Ğ¼Ñƒ Ğ½Ñ–ĞºĞ¾Ğ»Ğ¸.Â»* ĞŸÑ€Ğ¾Ñ‚Ğµ Ğ² Ğ¿Ğ¸ÑÑŒĞ¼Ğ¾Ğ²Ğ¸Ñ… Ñ‚Ğ° Ğ¾Ñ„Ñ–Ñ†Ñ–Ğ¹Ğ½Ğ¸Ñ… Ñ‚ĞµĞºÑÑ‚Ğ°Ñ… ÑĞ¿Ğ¾Ğ»ÑƒÑ‡Ğ½Ğ¸Ğº Â«Ñ‰Ğ¾Â» Ğ¾Ğ±Ğ¾Ğ²'ÑĞ·ĞºĞ¾Ğ²Ğ¸Ğ¹. Ğ¦Ğµ Ğ²Ğ°Ğ¶Ğ»Ğ¸Ğ²Ğ¾ Ğ¿Ğ°Ğ¼'ÑÑ‚Ğ°Ñ‚Ğ¸ Ğ¿Ñ€Ğ¸ Ğ½Ğ°Ğ¿Ğ¸ÑĞ°Ğ½Ğ½Ñ– ĞµÑĞµ Ñ‡Ğ¸ Ğ´Ñ–Ğ»Ğ¾Ğ²Ğ¸Ñ… Ğ»Ğ¸ÑÑ‚Ñ–Ğ²! ĞĞ°Ğ²Ñ‡Ñ–Ñ‚ÑŒÑÑ Ñ€Ğ¾Ğ·Ñ€Ñ–Ğ·Ğ½ÑÑ‚Ğ¸ ÑÑ‚Ğ¸Ğ»Ñ–ÑÑ‚Ğ¸Ñ‡Ğ½Ñ– Ñ€ĞµĞ³Ñ–ÑÑ‚Ñ€Ğ¸ ÑƒĞºÑ€Ğ°Ñ—Ğ½ÑÑŒĞºĞ¾Ñ— Ğ¼Ğ¾Ğ²Ğ¸, Ñ‰Ğ¾Ğ± Ğ²Ğ°ÑˆĞµ Ğ¼Ğ¾Ğ²Ğ»ĞµĞ½Ğ½Ñ Ğ·Ğ²ÑƒÑ‡Ğ°Ğ»Ğ¾ Ğ¿Ñ€Ğ¸Ñ€Ğ¾Ğ´Ğ½Ğ¾ Ğ² Ğ±ÑƒĞ´ÑŒ-ÑĞºĞ¾Ğ¼Ñƒ ĞºĞ¾Ğ½Ñ‚ĞµĞºÑÑ‚Ñ–.\n\n---\n\n### Ğ”Ñ–Ñ”ÑĞ»Ğ¾Ğ²Ğ° Ğ²Ğ²ĞµĞ´ĞµĞ½Ğ½Ñ Ğ½ĞµĞ¿Ñ€ÑĞ¼Ğ¾Ñ— Ğ¼Ğ¾Ğ²Ğ¸\n\nĞ£ Ğ½ĞµĞ¿Ñ€ÑĞ¼Ñ–Ğ¹ Ğ¼Ğ¾Ğ²Ñ– Ğ²Ğ¸ĞºĞ¾Ñ€Ğ¸ÑÑ‚Ğ¾Ğ²ÑƒÑÑ‚ÑŒÑÑ Ñ€Ñ–Ğ·Ğ½Ñ– **Ğ´Ñ–Ñ”ÑĞ»Ğ¾Ğ²Ğ° Ğ²Ğ²ĞµĞ´ĞµĞ½Ğ½Ñ** (reporting verbs):\n\n| Ğ”Ñ–Ñ”ÑĞ»Ğ¾Ğ²Ğ¾ | Ğ—Ğ½Ğ°Ñ‡ĞµĞ½Ğ½Ñ | ĞŸÑ€Ğ¸ĞºĞ»Ğ°Ğ´ |\n|----------|----------|---------|\n| **ÑĞºĞ°Ğ·Ğ°Ñ‚Ğ¸** | Ğ·Ğ°Ğ³Ğ°Ğ»ÑŒĞ½Ğµ Ğ¿Ğ¾Ğ²Ñ–Ğ´Ğ¾Ğ¼Ğ»ĞµĞ½Ğ½Ñ | Ğ’Ñ–Ğ½ ÑĞºĞ°Ğ·Ğ°Ğ², Ñ‰Ğ¾ Ğ¿Ñ€Ğ¸Ğ¹Ğ´Ğµ. |\n| **Ğ³Ğ¾Ğ²Ğ¾Ñ€Ğ¸Ñ‚Ğ¸** | Ñ‚Ñ€Ğ¸Ğ²Ğ°Ğ»Ğ° Ñ€Ğ¾Ğ·Ğ¼Ğ¾Ğ²Ğ° | Ğ’Ğ¾Ğ½Ğ° Ğ³Ğ¾Ğ²Ğ¾Ñ€Ğ¸Ğ»Ğ°, Ñ‰Ğ¾ Ğ²ÑĞµ Ğ´Ğ¾Ğ±Ñ€Ğµ. |\n| **Ğ¿Ğ¾Ğ²Ñ–Ğ´Ğ¾Ğ¼Ğ¸Ñ‚Ğ¸** | Ğ¾Ñ„Ñ–Ñ†Ñ–Ğ¹Ğ½Ğ° Ñ–Ğ½Ñ„Ğ¾Ñ€Ğ¼Ğ°Ñ†Ñ–Ñ | Ğ”Ğ¸Ñ€ĞµĞºÑ‚Ğ¾Ñ€ Ğ¿Ğ¾Ğ²Ñ–Ğ´Ğ¾Ğ¼Ğ¸Ğ², Ñ‰Ğ¾ Ğ·Ğ±Ğ¾Ñ€Ğ¸ Ğ¿ĞµÑ€ĞµĞ½ĞµÑĞµĞ½Ğ¾. |\n| **Ğ·Ğ°ÑĞ²Ğ¸Ñ‚Ğ¸** | Ğ¾Ñ„Ñ–Ñ†Ñ–Ğ¹Ğ½Ğ° Ğ·Ğ°ÑĞ²Ğ° | ĞŸÑ€ĞµĞ·Ğ¸Ğ´ĞµĞ½Ñ‚ Ğ·Ğ°ÑĞ²Ğ¸Ğ², Ñ‰Ğ¾ Ğ¿ĞµÑ€ĞµĞ³Ğ¾Ğ²Ğ¾Ñ€Ğ¸ Ğ¿Ñ€Ğ¾Ğ´Ğ¾Ğ²Ğ¶Ğ°Ñ‚ÑŒÑÑ. |\n| **Ğ¿Ğ¾ÑÑĞ½Ğ¸Ñ‚Ğ¸** | Ñ€Ğ¾Ğ·'ÑÑĞ½ĞµĞ½Ğ½Ñ | Ğ’Ñ‡Ğ¸Ñ‚ĞµĞ»ÑŒ Ğ¿Ğ¾ÑÑĞ½Ğ¸Ğ², Ñ‰Ğ¾ Ñ†Ğµ ÑĞºĞ»Ğ°Ğ´Ğ½Ğ° Ñ‚ĞµĞ¼Ğ°. |\n| **Ğ´Ğ¾Ğ´Ğ°Ñ‚Ğ¸** | Ğ´Ğ¾Ğ´Ğ°Ñ‚ĞºĞ¾Ğ²Ğ° Ñ–Ğ½Ñ„Ğ¾Ñ€Ğ¼Ğ°Ñ†Ñ–Ñ | Ğ’Ğ¾Ğ½Ğ° Ğ´Ğ¾Ğ´Ğ°Ğ»Ğ°, Ñ‰Ğ¾ Ğ±ÑƒĞ´Ğµ Ñ‡ĞµĞºĞ°Ñ‚Ğ¸ Ğ½Ğ° Ğ²Ñ–Ğ´Ğ¿Ğ¾Ğ²Ñ–Ğ´ÑŒ. |\n| **Ğ·Ğ°ÑƒĞ²Ğ°Ğ¶Ğ¸Ñ‚Ğ¸** | ĞºĞ¾Ğ¼ĞµĞ½Ñ‚Ğ°Ñ€ | Ğ’Ñ–Ğ½ Ğ·Ğ°ÑƒĞ²Ğ°Ğ¶Ğ¸Ğ², Ñ‰Ğ¾ Ğ¿Ğ¾Ğ³Ğ¾Ğ´Ğ° Ğ³Ğ°Ñ€Ğ½Ğ° ÑÑŒĞ¾Ğ³Ğ¾Ğ´Ğ½Ñ–. |\n| **ÑÑ‚Ğ²ĞµÑ€Ğ´Ğ¶ÑƒĞ²Ğ°Ñ‚Ğ¸** | Ğ½Ğ°Ğ¿Ğ¾Ğ»ÑĞ³Ğ°Ğ½Ğ½Ñ | Ğ¡Ğ²Ñ–Ğ´Ğ¾Ğº ÑÑ‚Ğ²ĞµÑ€Ğ´Ğ¶ÑƒÑ”, Ñ‰Ğ¾ Ğ±Ğ°Ñ‡Ğ¸Ğ² Ñ†Ğµ Ğ½Ğ° Ğ²Ğ»Ğ°ÑĞ½Ñ– Ğ¾Ñ‡Ñ–. |\n| **Ğ²Ğ¸Ğ·Ğ½Ğ°Ñ‚Ğ¸** | Ğ²Ğ¸Ğ·Ğ½Ğ°Ğ½Ğ½Ñ Ñ„Ğ°ĞºÑ‚Ñƒ | Ğ’Ñ–Ğ½ Ğ²Ğ¸Ğ·Ğ½Ğ°Ğ², Ñ‰Ğ¾ Ğ¿Ğ¾Ğ¼Ğ¸Ğ»Ğ¸Ğ²ÑÑ Ñƒ ÑĞ²Ğ¾Ñ—Ñ… Ñ€Ğ¾Ğ·Ñ€Ğ°Ñ…ÑƒĞ½ĞºĞ°Ñ…. |\n| **Ğ·Ğ°Ğ¿ĞµÑ€ĞµÑ‡Ğ¸Ñ‚Ğ¸** | Ğ·Ğ°Ğ¿ĞµÑ€ĞµÑ‡ĞµĞ½Ğ½Ñ | Ğ’Ğ¾Ğ½Ğ° Ğ·Ğ°Ğ¿ĞµÑ€ĞµÑ‡Ğ¸Ğ»Ğ°, Ñ‰Ğ¾ Ğ±ÑƒĞ»Ğ° Ñ‚Ğ°Ğ¼ Ñ‚Ñ–Ñ”Ñ— Ğ½Ğ¾Ñ‡Ñ–. |\n\n**ĞŸÑ€Ğ¸ĞºĞ»Ğ°Ğ´Ğ¸ Ğ· Ñ€Ñ–Ğ·Ğ½Ğ¸Ğ¼Ğ¸ Ğ´Ñ–Ñ”ÑĞ»Ğ¾Ğ²Ğ°Ğ¼Ğ¸ Ğ²Ğ²ĞµĞ´ĞµĞ½Ğ½Ñ:**\n\n- ĞœĞ°Ğ¼Ğ° **ÑĞºĞ°Ğ·Ğ°Ğ»Ğ°**, Ñ‰Ğ¾ Ğ²ĞµÑ‡ĞµÑ€Ñ Ğ³Ğ¾Ñ‚Ğ¾Ğ²Ğ° Ñ– Ğ²ÑÑ– Ğ¼Ğ¾Ğ¶ÑƒÑ‚ÑŒ ÑÑ–Ğ´Ğ°Ñ‚Ğ¸.\n- Ğ›Ñ–ĞºĞ°Ñ€ **Ğ¿Ğ¾ÑÑĞ½Ğ¸Ğ²**, Ñ‰Ğ¾ Ğ¿Ğ¾Ñ‚Ñ€Ñ–Ğ±Ğ½Ğ¾ Ğ¿Ñ€Ğ¸Ğ¹Ğ¼Ğ°Ñ‚Ğ¸ Ğ»Ñ–ĞºĞ¸ Ñ‚Ñ€Ğ¸Ñ‡Ñ– Ğ½Ğ° Ğ´ĞµĞ½ÑŒ.\n- ĞœÑ–Ğ½Ñ–ÑÑ‚Ñ€ **Ğ·Ğ°ÑĞ²Ğ¸Ğ²**, Ñ‰Ğ¾ Ñ€ĞµÑ„Ğ¾Ñ€Ğ¼Ğ° Ğ±ÑƒĞ´Ğµ Ğ·Ğ°Ğ²ĞµÑ€ÑˆĞµĞ½Ğ° Ğ´Ğ¾ ĞºÑ–Ğ½Ñ†Ñ Ñ€Ğ¾ĞºÑƒ.\n- Ğ”Ñ€ÑƒĞ³ **Ğ·Ğ°ÑƒĞ²Ğ°Ğ¶Ğ¸Ğ²**, Ñ‰Ğ¾ Ñ Ğ²Ğ¸Ğ³Ğ»ÑĞ´Ğ°Ñ Ğ²Ñ‚Ğ¾Ğ¼Ğ»ĞµĞ½Ğ¸Ğ¼ Ğ¾ÑÑ‚Ğ°Ğ½Ğ½Ñ–Ğ¼ Ñ‡Ğ°ÑĞ¾Ğ¼.\n\n> âš ï¸ **Ğ’Ğ°Ğ¶Ğ»Ğ¸Ğ²Ğ¸Ğ¹ Ğ½ÑĞ°Ğ½Ñ**\n> Ğ’Ğ¸Ğ±Ñ–Ñ€ Ğ´Ñ–Ñ”ÑĞ»Ğ¾Ğ²Ğ° Ğ²Ğ²ĞµĞ´ĞµĞ½Ğ½Ñ Ğ±ĞµĞ·Ğ¿Ğ¾ÑĞµÑ€ĞµĞ´Ğ½ÑŒĞ¾ Ğ²Ğ¿Ğ»Ğ¸Ğ²Ğ°Ñ” Ğ½Ğ° ÑĞ¿Ñ€Ğ¸Ğ¹Ğ½ÑÑ‚Ñ‚Ñ Ñ–Ğ½Ñ„Ğ¾Ñ€Ğ¼Ğ°Ñ†Ñ–Ñ—. Â«Ğ’Ñ–Ğ½ ÑĞºĞ°Ğ·Ğ°Ğ²Â» â€” Ğ½ĞµĞ¹Ñ‚Ñ€Ğ°Ğ»ÑŒĞ½Ğ¾. Â«Ğ’Ñ–Ğ½ Ğ·Ğ°ÑĞ²Ğ¸Ğ²Â» â€” Ğ¾Ñ„Ñ–Ñ†Ñ–Ğ¹Ğ½Ğ¾. Â«Ğ’Ñ–Ğ½ ÑÑ‚Ğ²ĞµÑ€Ğ´Ğ¶ÑƒÑ”Â» â€” Ğ¼Ğ¾Ğ¶Ğµ Ğ¾Ğ·Ğ½Ğ°Ñ‡Ğ°Ñ‚Ğ¸ ÑÑƒĞ¼Ğ½Ñ–Ğ² Ñƒ Ğ¿Ñ€Ğ°Ğ²Ğ´Ğ¸Ğ²Ğ¾ÑÑ‚Ñ–. Â«Ğ’Ñ–Ğ½ Ğ²Ğ¸Ğ·Ğ½Ğ°Ğ²Â» â€” Ğ°ĞºÑ†ĞµĞ½Ñ‚ Ğ½Ğ° Ğ²Ğ¸Ğ·Ğ½Ğ°Ğ½Ğ½Ñ– Ñ„Ğ°ĞºÑ‚Ñƒ! ĞĞ±Ğ¸Ñ€Ğ°Ğ¹Ñ‚Ğµ Ğ´Ñ–Ñ”ÑĞ»Ğ¾Ğ²Ğ¾ Ğ²Ñ–Ğ´Ğ¿Ğ¾Ğ²Ñ–Ğ´Ğ½Ğ¾ Ğ´Ğ¾ ĞºĞ¾Ğ½Ñ‚ĞµĞºÑÑ‚Ñƒ Ñ‚Ğ° Ğ²Ğ°ÑˆĞ¾Ğ³Ğ¾ ÑÑ‚Ğ°Ğ²Ğ»ĞµĞ½Ğ½Ñ Ğ´Ğ¾ Ñ–Ğ½Ñ„Ğ¾Ñ€Ğ¼Ğ°Ñ†Ñ–Ñ—.\n\n---\n\n### Ğ—ÑÑƒĞ² Ñ‡Ğ°ÑÑ–Ğ² (Tense Backshift) Ğ² ÑƒĞºÑ€Ğ°Ñ—Ğ½ÑÑŒĞºÑ–Ğ¹ Ğ½ĞµĞ¿Ñ€ÑĞ¼Ñ–Ğ¹ Ğ¼Ğ¾Ğ²Ñ–\n\nĞ’ ÑƒĞºÑ€Ğ°Ñ—Ğ½ÑÑŒĞºÑ–Ğ¹ Ğ¼Ğ¾Ğ²Ñ– Ğ·ÑÑƒĞ² Ñ‡Ğ°ÑÑ–Ğ² Ñƒ Ğ½ĞµĞ¿Ñ€ÑĞ¼Ñ–Ğ¹ Ğ¼Ğ¾Ğ²Ñ– Ğ½Ğµ Ñ‚Ğ°ĞºĞ¸Ğ¹ ÑÑ‚Ñ€Ğ¾Ğ³Ğ¸Ğ¹ Ñ– Ğ¾Ğ±Ğ¾Ğ²'ÑĞ·ĞºĞ¾Ğ²Ğ¸Ğ¹, ÑĞº Ğ² Ğ°Ğ½Ğ³Ğ»Ñ–Ğ¹ÑÑŒĞºÑ–Ğ¹, Ğ°Ğ»Ğµ Ğ²Ñ–Ğ½ Ñ‚Ğ°ĞºĞ¸ Ñ–ÑĞ½ÑƒÑ”:\n\n#### Ğ—ÑÑƒĞ² Ğ¿Ğ¾Ñ‚Ñ€Ñ–Ğ±ĞµĞ½, ĞºĞ¾Ğ»Ğ¸ Ğ´Ñ–Ñ Ğ²Ğ¶Ğµ Ğ½ĞµĞ°ĞºÑ‚ÑƒĞ°Ğ»ÑŒĞ½Ğ°\n\n**ĞŸÑ€ÑĞ¼Ğ°:** Ğ’Ñ–Ğ½ ÑĞºĞ°Ğ·Ğ°Ğ²: Â«Ğ¯ **Ğ¿Ñ€Ğ°Ñ†ÑÑ** Ğ½Ğ°Ğ´ Ğ¿Ñ€Ğ¾ĞµĞºÑ‚Ğ¾Ğ¼.Â» (Ñ‚Ğ¾Ğ´Ñ–)\n**ĞĞµĞ¿Ñ€ÑĞ¼Ğ°:** Ğ’Ñ–Ğ½ ÑĞºĞ°Ğ·Ğ°Ğ², Ñ‰Ğ¾ **Ğ¿Ñ€Ğ°Ñ†ÑĞ²Ğ°Ğ²** Ğ½Ğ°Ğ´ Ğ¿Ñ€Ğ¾ĞµĞºÑ‚Ğ¾Ğ¼. (Ğ·Ğ°Ñ€Ğ°Ğ· ÑƒĞ¶Ğµ Ğ½Ñ–)\n\n#### Ğ—ÑÑƒĞ² Ğ½Ğµ Ğ¿Ğ¾Ñ‚Ñ€Ñ–Ğ±ĞµĞ½, ĞºĞ¾Ğ»Ğ¸ Ğ´Ñ–Ñ Ñ‰Ğµ Ğ°ĞºÑ‚ÑƒĞ°Ğ»ÑŒĞ½Ğ°\n\n**ĞŸÑ€ÑĞ¼Ğ°:** Ğ’Ñ–Ğ½ ÑĞºĞ°Ğ·Ğ°Ğ²: Â«Ğ¯ **Ğ¿Ñ€Ğ°Ñ†ÑÑ** Ğ² Ñ†Ñ–Ğ¹ ĞºĞ¾Ğ¼Ğ¿Ğ°Ğ½Ñ–Ñ—.Â»\n**ĞĞµĞ¿Ñ€ÑĞ¼Ğ°:** Ğ’Ñ–Ğ½ ÑĞºĞ°Ğ·Ğ°Ğ², Ñ‰Ğ¾ **Ğ¿Ñ€Ğ°Ñ†ÑÑ”** Ğ² Ñ†Ñ–Ğ¹ ĞºĞ¾Ğ¼Ğ¿Ğ°Ğ½Ñ–Ñ—. (Ñ– Ğ·Ğ°Ñ€Ğ°Ğ· Ğ¿Ñ€Ğ°Ñ†ÑÑ”)\n\n#### ĞŸĞ¾Ñ€Ñ–Ğ²Ğ½ÑĞ»ÑŒĞ½Ğ° Ñ‚Ğ°Ğ±Ğ»Ğ¸Ñ†Ñ Ğ·ÑÑƒĞ²Ñƒ\n\n| ĞŸÑ€ÑĞ¼Ğ° Ğ¼Ğ¾Ğ²Ğ° | ĞĞµĞ¿Ñ€ÑĞ¼Ğ° (Ğ´Ñ–Ñ Ğ½ĞµĞ°ĞºÑ‚ÑƒĞ°Ğ»ÑŒĞ½Ğ°) | ĞĞµĞ¿Ñ€ÑĞ¼Ğ° (Ğ´Ñ–Ñ Ğ°ĞºÑ‚ÑƒĞ°Ğ»ÑŒĞ½Ğ°) |\n|------------|---------------------------|-------------------------|\n| Ğ¿Ñ€Ğ°Ñ†ÑÑ (Ñ‚ĞµĞ¿ĞµÑ€Ñ–ÑˆĞ½Ñ–Ğ¹) | Ğ¿Ñ€Ğ°Ñ†ÑĞ²Ğ°Ğ² | Ğ¿Ñ€Ğ°Ñ†ÑÑ” |\n| Ğ±ÑƒĞ´Ñƒ Ğ¿Ñ€Ğ°Ñ†ÑĞ²Ğ°Ñ‚Ğ¸ (Ğ¼Ğ°Ğ¹Ğ±ÑƒÑ‚Ğ½Ñ–Ğ¹) | Ğ¼Ğ°Ğ²/Ğ·Ğ±Ğ¸Ñ€Ğ°Ğ²ÑÑ Ğ¿Ñ€Ğ°Ñ†ÑĞ²Ğ°Ñ‚Ğ¸ | Ğ±ÑƒĞ´Ğµ Ğ¿Ñ€Ğ°Ñ†ÑĞ²Ğ°Ñ‚Ğ¸ |\n| Ğ¿Ñ€Ğ°Ñ†ÑĞ²Ğ°Ğ² (Ğ¼Ğ¸Ğ½ÑƒĞ»Ğ¸Ğ¹) | Ğ¿Ñ€Ğ°Ñ†ÑĞ²Ğ°Ğ² | Ğ¿Ñ€Ğ°Ñ†ÑĞ²Ğ°Ğ² |\n\n> ğŸ¯ **ĞŸÑ€Ğ°ĞºÑ‚Ğ¸Ñ‡Ğ½Ğ° Ğ¿Ğ¾Ñ€Ğ°Ğ´Ğ°**\n> Ğ¯ĞºÑ‰Ğ¾ Ğ²Ğ¸ Ğ½Ğµ Ğ²Ğ¿ĞµĞ²Ğ½ĞµĞ½Ñ–, Ñ‡Ğ¸ Ğ¿Ğ¾Ñ‚Ñ€Ñ–Ğ±ĞµĞ½ Ğ·ÑÑƒĞ² Ñ‡Ğ°ÑÑƒ â€” Ğ·Ğ°Ğ´Ğ°Ğ¹Ñ‚Ğµ ÑĞ¾Ğ±Ñ– Ğ¿Ğ¸Ñ‚Ğ°Ğ½Ğ½Ñ: Â«Ğ§Ğ¸ Ñ†Ñ Ğ´Ñ–Ñ Ñ‰Ğµ Ğ²Ñ–Ğ´Ğ±ÑƒĞ²Ğ°Ñ”Ñ‚ÑŒÑÑ Ğ·Ğ°Ñ€Ğ°Ğ·?Â» Ğ¯ĞºÑ‰Ğ¾ Ñ‚Ğ°Ğº â€” Ğ·ÑÑƒĞ² Ğ½Ğµ Ğ¿Ğ¾Ñ‚Ñ€Ñ–Ğ±ĞµĞ½. Ğ¯ĞºÑ‰Ğ¾ Ğ½Ñ– â€” Ğ²Ğ¸ĞºĞ¾Ñ€Ğ¸ÑÑ‚Ğ¾Ğ²ÑƒĞ¹Ñ‚Ğµ Ğ¼Ğ¸Ğ½ÑƒĞ»Ğ¸Ğ¹ Ñ‡Ğ°Ñ. Ğ¦Ğµ Ğ½Ğ°Ğ¹Ğ¿Ñ€Ğ¾ÑÑ‚Ñ–ÑˆĞ¸Ğ¹ ÑĞ¿Ğ¾ÑÑ–Ğ± Ğ²Ğ¸Ğ·Ğ½Ğ°Ñ‡Ğ¸Ñ‚Ğ¸ Ğ¿Ñ€Ğ°Ğ²Ğ¸Ğ»ÑŒĞ½Ñƒ Ñ„Ğ¾Ñ€Ğ¼Ñƒ Ğ´Ñ–Ñ”ÑĞ»Ğ¾Ğ²Ğ°!\n\n---\n\n### Ğ—Ğ¼Ñ–Ğ½Ğ° Ğ²ĞºĞ°Ğ·Ñ–Ğ²Ğ½Ğ¸Ñ… ÑĞ»Ñ–Ğ²\n\nĞŸÑ€Ğ¸ Ğ¿ĞµÑ€ĞµÑ…Ğ¾Ğ´Ñ– Ğ´Ğ¾ Ğ½ĞµĞ¿Ñ€ÑĞ¼Ğ¾Ñ— Ğ¼Ğ¾Ğ²Ğ¸ Ğ·Ğ¼Ñ–Ğ½ÑÑÑ‚ÑŒÑÑ ÑĞ»Ğ¾Ğ²Ğ°, Ñ‰Ğ¾ Ğ²ĞºĞ°Ğ·ÑƒÑÑ‚ÑŒ Ğ½Ğ° Ñ‡Ğ°Ñ Ñ– Ğ¼Ñ–ÑÑ†Ğµ:\n\n| ĞŸÑ€ÑĞ¼Ğ° Ğ¼Ğ¾Ğ²Ğ° | ĞĞµĞ¿Ñ€ÑĞ¼Ğ° Ğ¼Ğ¾Ğ²Ğ° |\n|------------|--------------|\n| Ğ·Ğ°Ñ€Ğ°Ğ· | Ñ‚Ğ¾Ğ´Ñ– |\n| ÑÑŒĞ¾Ğ³Ğ¾Ğ´Ğ½Ñ– | Ñ‚Ğ¾Ğ³Ğ¾ Ğ´Ğ½Ñ |\n| Ğ·Ğ°Ğ²Ñ‚Ñ€Ğ° | Ğ½Ğ°ÑÑ‚ÑƒĞ¿Ğ½Ğ¾Ğ³Ğ¾ Ğ´Ğ½Ñ |\n| Ğ²Ñ‡Ğ¾Ñ€Ğ° | Ğ½Ğ°Ğ¿ĞµÑ€ĞµĞ´Ğ¾Ğ´Ğ½Ñ–, Ğ¿Ğ¾Ğ¿ĞµÑ€ĞµĞ´Ğ½ÑŒĞ¾Ğ³Ğ¾ Ğ´Ğ½Ñ |\n| Ñ‚ÑƒÑ‚ | Ñ‚Ğ°Ğ¼ |\n| Ñ†ĞµĞ¹ | Ñ‚Ğ¾Ğ¹ |\n| Ñ†Ñ– | Ñ‚Ñ– |\n\n**ĞŸÑ€Ğ¸ĞºĞ»Ğ°Ğ´Ğ¸:**\n\n- ĞŸÑ€ÑĞ¼Ğ°: Â«Ğ¯ Ğ¿Ñ€Ğ¸Ñ—Ğ´Ñƒ **ÑÑŒĞ¾Ğ³Ğ¾Ğ´Ğ½Ñ–**.Â»\n- ĞĞµĞ¿Ñ€ÑĞ¼Ğ°: Ğ’Ñ–Ğ½ ÑĞºĞ°Ğ·Ğ°Ğ², Ñ‰Ğ¾ Ğ¿Ñ€Ğ¸Ñ—Ğ´Ğµ **Ñ‚Ğ¾Ğ³Ğ¾ Ğ´Ğ½Ñ**.\n\n- ĞŸÑ€ÑĞ¼Ğ°: Â«Ğ—Ğ°Ñ‚ĞµĞ»ĞµÑ„Ğ¾Ğ½ÑƒÑ **Ğ·Ğ°Ğ²Ñ‚Ñ€Ğ°**.Â»\n- ĞĞµĞ¿Ñ€ÑĞ¼Ğ°: Ğ’Ğ¾Ğ½Ğ° ÑĞºĞ°Ğ·Ğ°Ğ»Ğ°, Ñ‰Ğ¾ Ğ·Ğ°Ñ‚ĞµĞ»ĞµÑ„Ğ¾Ğ½ÑƒÑ” **Ğ½Ğ°ÑÑ‚ÑƒĞ¿Ğ½Ğ¾Ğ³Ğ¾ Ğ´Ğ½Ñ**.\n\n> ğŸ¬ **ĞšÑƒĞ»ÑŒÑ‚ÑƒÑ€Ğ½Ğ¸Ğ¹ Ğ¼Ğ¾Ğ¼ĞµĞ½Ñ‚**\n> Ğ£ Ğ¶ÑƒÑ€Ğ½Ğ°Ğ»Ñ–ÑÑ‚Ğ¸Ñ†Ñ– Ğ½ĞµĞ¿Ñ€ÑĞ¼Ğ° Ğ¼Ğ¾Ğ²Ğ° Ğ²Ğ¸ĞºĞ¾Ñ€Ğ¸ÑÑ‚Ğ¾Ğ²ÑƒÑ”Ñ‚ÑŒÑÑ Ğ¿Ğ¾ÑÑ‚Ñ–Ğ¹Ğ½Ğ¾ Ğ´Ğ»Ñ Ğ¿ĞµÑ€ĞµĞ´Ğ°Ñ‡Ñ– Ğ·Ğ°ÑĞ² Ğ¿Ğ¾Ğ»Ñ–Ñ‚Ğ¸ĞºÑ–Ğ², ĞµĞºÑĞ¿ĞµÑ€Ñ‚Ñ–Ğ² Ñ‚Ğ° ÑĞ²Ñ–Ğ´ĞºÑ–Ğ² Ğ¿Ğ¾Ğ´Ñ–Ğ¹. Ğ£Ğ¼Ñ–Ğ½Ğ½Ñ Ñ‚Ğ¾Ñ‡Ğ½Ğ¾ Ğ¿ĞµÑ€ĞµĞ´Ğ°Ğ²Ğ°Ñ‚Ğ¸ Ñ‡ÑƒĞ¶Ñ– ÑĞ»Ğ¾Ğ²Ğ° Ğ±ĞµĞ· ÑĞ¿Ğ¾Ñ‚Ğ²Ğ¾Ñ€ĞµĞ½Ğ½Ñ â€” ĞºĞ»ÑÑ‡Ğ¾Ğ²Ğ° Ğ½Ğ°Ğ²Ğ¸Ñ‡ĞºĞ° Ğ¶ÑƒÑ€Ğ½Ğ°Ğ»Ñ–ÑÑ‚Ğ°. ĞŸĞ¾Ğ¼Ğ¸Ğ»ĞºĞ¸ Ğ² Ğ½ĞµĞ¿Ñ€ÑĞ¼Ñ–Ğ¹ Ğ¼Ğ¾Ğ²Ñ– Ğ¼Ğ¾Ğ¶ÑƒÑ‚ÑŒ Ğ¿Ñ€Ğ¸Ğ·Ğ²ĞµÑÑ‚Ğ¸ Ğ´Ğ¾ Ğ½ĞµÑ‚Ğ¾Ñ‡Ğ½Ğ¾ÑÑ‚ĞµĞ¹ Ñ‚Ğ° Ğ½Ğ°Ğ²Ñ–Ñ‚ÑŒ ÑÑ€Ğ¸Ğ´Ğ¸Ñ‡Ğ½Ğ¸Ñ… Ğ¿Ñ€Ğ¾Ğ±Ğ»ĞµĞ¼! Ğ£ĞºÑ€Ğ°Ñ—Ğ½ÑÑŒĞºÑ– Ğ¶ÑƒÑ€Ğ½Ğ°Ğ»Ñ–ÑÑ‚Ğ¸ Ğ²Ğ¸ĞºĞ¾Ñ€Ğ¸ÑÑ‚Ğ¾Ğ²ÑƒÑÑ‚ÑŒ Ñ€Ñ–Ğ·Ğ½Ñ– Ğ´Ñ–Ñ”ÑĞ»Ğ¾Ğ²Ğ° Ğ²Ğ²ĞµĞ´ĞµĞ½Ğ½Ñ, Ñ‰Ğ¾Ğ± Ğ¿ĞµÑ€ĞµĞ´Ğ°Ñ‚Ğ¸ Ğ½ÑĞ°Ğ½ÑĞ¸: Â«Ğ·Ğ°ÑĞ²Ğ¸Ğ²Â» Ğ´Ğ»Ñ Ğ¾Ñ„Ñ–Ñ†Ñ–Ğ¹Ğ½Ğ¸Ñ… Ğ·Ğ°ÑĞ², Â«ÑÑ‚Ğ²ĞµÑ€Ğ´Ğ¶ÑƒÑ”Â» ĞºĞ¾Ğ»Ğ¸ Ñ” ÑÑƒĞ¼Ğ½Ñ–Ğ²Ğ¸ Ğ² Ğ¿Ñ€Ğ°Ğ²Ğ´Ğ¸Ğ²Ğ¾ÑÑ‚Ñ–, Â«Ğ²Ğ¸Ğ·Ğ½Ğ°Ğ²Â» ĞºĞ¾Ğ»Ğ¸ Ğ¹Ğ´ĞµÑ‚ÑŒÑÑ Ğ¿Ñ€Ğ¾ Ğ²Ğ°Ğ¶Ğ»Ğ¸Ğ²Ğµ Ğ·Ñ–Ğ·Ğ½Ğ°Ğ½Ğ½Ñ.\n\n### Ğ—Ğ°ÑÑ‚Ğ¾ÑÑƒĞ²Ğ°Ğ½Ğ½Ñ Ğ½ĞµĞ¿Ñ€ÑĞ¼Ğ¾Ñ— Ğ¼Ğ¾Ğ²Ğ¸ Ğ² Ñ€Ñ–Ğ·Ğ½Ğ¸Ñ… ĞºĞ¾Ğ½Ñ‚ĞµĞºÑÑ‚Ğ°Ñ…\n\n#### Ğ£ Ğ¿Ğ¾Ğ±ÑƒÑ‚Ğ¾Ğ²Ğ¾Ğ¼Ñƒ ÑĞ¿Ñ–Ğ»ĞºÑƒĞ²Ğ°Ğ½Ğ½Ñ–\n\nĞ£ Ğ¿Ğ¾Ğ²ÑÑĞºĞ´ĞµĞ½Ğ½Ğ¸Ñ… Ñ€Ğ¾Ğ·Ğ¼Ğ¾Ğ²Ğ°Ñ… Ğ½ĞµĞ¿Ñ€ÑĞ¼Ğ° Ğ¼Ğ¾Ğ²Ğ° Ğ´Ğ¾Ğ¿Ğ¾Ğ¼Ğ°Ğ³Ğ°Ñ” Ğ¿ĞµÑ€ĞµĞºĞ°Ğ·Ğ°Ñ‚Ğ¸ Ğ½Ğ¾Ğ²Ğ¸Ğ½Ğ¸, Ğ¿Ğ»Ñ–Ñ‚ĞºĞ¸, Ñ–Ğ½Ñ„Ğ¾Ñ€Ğ¼Ğ°Ñ†Ñ–Ñ Ğ²Ñ–Ğ´ Ğ´Ñ€ÑƒĞ·Ñ–Ğ² Ñ‚Ğ° Ğ·Ğ½Ğ°Ğ¹Ğ¾Ğ¼Ğ¸Ñ…:\n\n- *Â«ĞœĞ°Ğ¼Ğ° ÑĞºĞ°Ğ·Ğ°Ğ»Ğ°, Ñ‰Ğ¾ Ğ²ĞµÑ‡ĞµÑ€Ñ Ğ±ÑƒĞ´Ğµ Ğ¾ ÑÑŒĞ¾Ğ¼Ñ–Ğ¹.Â»*\n- *Â«Ğ¡ÑƒÑÑ–Ğ´ Ğ³Ğ¾Ğ²Ğ¾Ñ€Ğ¸Ğ², Ñ‰Ğ¾ Ğ·Ğ°Ğ²Ñ‚Ñ€Ğ° Ğ±ÑƒĞ´Ğµ Ğ´Ğ¾Ñ‰.Â»*\n- *Â«ĞŸĞ¾Ğ´Ñ€ÑƒĞ³Ğ° Ğ¿Ğ¾Ğ²Ñ–Ğ´Ğ¾Ğ¼Ğ¸Ğ»Ğ°, Ñ‰Ğ¾ Ğ²Ğ¸Ğ¹ÑˆĞ»Ğ° Ğ·Ğ°Ğ¼Ñ–Ğ¶.Â»*\n\n#### Ğ’ Ğ¾Ñ„Ñ–Ñ†Ñ–Ğ¹Ğ½Ğ¾Ğ¼Ñƒ Ğ»Ğ¸ÑÑ‚ÑƒĞ²Ğ°Ğ½Ğ½Ñ–\n\nĞ£ Ğ´Ñ–Ğ»Ğ¾Ğ²Ğ¸Ñ… Ğ´Ğ¾ĞºÑƒĞ¼ĞµĞ½Ñ‚Ğ°Ñ… Ğ½ĞµĞ¿Ñ€ÑĞ¼Ğ° Ğ¼Ğ¾Ğ²Ğ° Ğ²Ğ¸ĞºĞ¾Ñ€Ğ¸ÑÑ‚Ğ¾Ğ²ÑƒÑ”Ñ‚ÑŒÑÑ Ğ´Ğ»Ñ Ğ¿Ñ€Ğ¾Ñ‚Ğ¾ĞºĞ¾Ğ»ÑĞ²Ğ°Ğ½Ğ½Ñ, Ğ½Ğ°Ğ¿Ğ¸ÑĞ°Ğ½Ğ½Ñ Ğ·Ğ²Ñ–Ñ‚Ñ–Ğ² Ñ‚Ğ° Ğ¿Ñ–Ğ´ÑÑƒĞ¼Ğ¾Ğ²ÑƒĞ²Ğ°Ğ½Ğ½Ñ Ğ·ÑƒÑÑ‚Ñ€Ñ–Ñ‡ĞµĞ¹:\n\n- *Â«ĞĞ° Ğ·Ğ°ÑÑ–Ğ´Ğ°Ğ½Ğ½Ñ– Ğ´Ğ¸Ñ€ĞµĞºÑ‚Ğ¾Ñ€ Ğ·Ğ°ÑĞ²Ğ¸Ğ², Ñ‰Ğ¾ ĞºĞ¾Ğ¼Ğ¿Ğ°Ğ½Ñ–Ñ Ñ€Ğ¾Ğ·ÑˆĞ¸Ñ€ÑĞ²Ğ°Ñ‚Ğ¸Ğ¼Ğµ Ğ²Ğ¸Ñ€Ğ¾Ğ±Ğ½Ğ¸Ñ†Ñ‚Ğ²Ğ¾.Â»*\n- *Â«ĞšĞ»Ñ–Ñ”Ğ½Ñ‚ Ğ¿Ğ¾Ğ²Ñ–Ğ´Ğ¾Ğ¼Ğ¸Ğ², Ñ‰Ğ¾ Ğ¼Ğ°Ñ” Ğ¿Ñ€ĞµÑ‚ĞµĞ½Ğ·Ñ–Ñ— Ñ‰Ğ¾Ğ´Ğ¾ ÑĞºĞ¾ÑÑ‚Ñ– Ğ¿Ñ€Ğ¾Ğ´ÑƒĞºÑ†Ñ–Ñ—.Â»*\n- *Â«ĞŸÑ€ĞµĞ´ÑÑ‚Ğ°Ğ²Ğ½Ğ¸Ğº Ğ¿Ñ–Ğ´Ñ‚Ğ²ĞµÑ€Ğ´Ğ¸Ğ², Ñ‰Ğ¾ ÑƒĞ³Ğ¾Ğ´Ğ° Ğ±ÑƒĞ´Ğµ Ğ¿Ñ–Ğ´Ğ¿Ğ¸ÑĞ°Ğ½Ğ° Ğ½Ğ°ÑÑ‚ÑƒĞ¿Ğ½Ğ¾Ğ³Ğ¾ Ñ‚Ğ¸Ğ¶Ğ½Ñ.Â»*\n\n#### Ğ£ Ğ½Ğ°ÑƒĞºĞ¾Ğ²Ğ¸Ñ… Ñ‚ĞµĞºÑÑ‚Ğ°Ñ…\n\nĞ’ Ğ°ĞºĞ°Ğ´ĞµĞ¼Ñ–Ñ‡Ğ½Ğ¾Ğ¼Ñƒ Ğ¿Ğ¸ÑÑŒĞ¼Ñ– Ğ½ĞµĞ¿Ñ€ÑĞ¼Ğ° Ğ¼Ğ¾Ğ²Ğ° Ñ” Ğ¾ÑĞ½Ğ¾Ğ²Ğ½Ğ¸Ğ¼ ÑĞ¿Ğ¾ÑĞ¾Ğ±Ğ¾Ğ¼ Ñ†Ğ¸Ñ‚ÑƒĞ²Ğ°Ğ½Ğ½Ñ Ğ´Ğ¶ĞµÑ€ĞµĞ» Ñ‚Ğ° Ğ¿Ğ¾ÑĞ¸Ğ»Ğ°Ğ½Ğ½Ñ Ğ½Ğ° Ğ´Ğ¾ÑĞ»Ñ–Ğ´Ğ¶ĞµĞ½Ğ½Ñ:\n\n- *Â«Ğ¨ĞµĞ²Ñ‡ĞµĞ½ĞºĞ¾ ÑÑ‚Ğ²ĞµÑ€Ğ´Ğ¶ÑƒĞ²Ğ°Ğ², Ñ‰Ğ¾ Ğ¼Ğ¾Ğ²Ğ° Ñ” Ğ¾ÑĞ½Ğ¾Ğ²Ğ¾Ñ Ğ½Ğ°Ñ†Ñ–Ğ¾Ğ½Ğ°Ğ»ÑŒĞ½Ğ¾Ñ— Ñ–Ğ´ĞµĞ½Ñ‚Ğ¸Ñ‡Ğ½Ğ¾ÑÑ‚Ñ–.Â»*\n- *Â«Ğ”Ğ¾ÑĞ»Ñ–Ğ´Ğ½Ğ¸ĞºĞ¸ Ğ·Ğ°ÑƒĞ²Ğ°Ğ¶Ğ¸Ğ»Ğ¸, Ñ‰Ğ¾ Ñ€ĞµĞ·ÑƒĞ»ÑŒÑ‚Ğ°Ñ‚Ğ¸ Ğ¿Ñ–Ğ´Ñ‚Ğ²ĞµÑ€Ğ´Ğ¶ÑƒÑÑ‚ÑŒ Ğ³Ñ–Ğ¿Ğ¾Ñ‚ĞµĞ·Ñƒ.Â»*\n- *Â«ĞĞ²Ñ‚Ğ¾Ñ€ Ğ¿Ğ¾ÑÑĞ½Ğ¸Ğ², Ñ‰Ğ¾ Ğ¹Ğ¾Ğ³Ğ¾ Ñ‚ĞµĞ¾Ñ€Ñ–Ñ Ğ±Ğ°Ğ·ÑƒÑ”Ñ‚ÑŒÑÑ Ğ½Ğ° Ğ½Ğ¾Ğ²Ñ–Ñ‚Ğ½Ñ–Ñ… Ğ´Ğ°Ğ½Ğ¸Ñ….Â»*\n\n> ğŸ¯ **ĞŸÑ€Ğ°ĞºÑ‚Ğ¸Ñ‡Ğ½Ğ° Ğ¿Ğ¾Ñ€Ğ°Ğ´Ğ°**\n> Ğ£ Ñ€Ñ–Ğ·Ğ½Ğ¸Ñ… ĞºĞ¾Ğ½Ñ‚ĞµĞºÑÑ‚Ğ°Ñ… Ğ¾Ğ±Ğ¸Ñ€Ğ°Ğ¹Ñ‚Ğµ Ğ²Ñ–Ğ´Ğ¿Ğ¾Ğ²Ñ–Ğ´Ğ½Ñ– Ğ´Ñ–Ñ”ÑĞ»Ğ¾Ğ²Ğ° Ğ²Ğ²ĞµĞ´ĞµĞ½Ğ½Ñ. Ğ”Ğ»Ñ Ğ¿Ğ¾Ğ±ÑƒÑ‚Ğ¾Ğ²Ğ¸Ñ… Ñ€Ğ¾Ğ·Ğ¼Ğ¾Ğ² Ğ¿Ñ–Ğ´Ñ–Ğ¹Ğ´ÑƒÑ‚ÑŒ Ğ½ĞµĞ¹Ñ‚Ñ€Ğ°Ğ»ÑŒĞ½Ñ– Â«ÑĞºĞ°Ğ·Ğ°Ğ²Â», Â«Ğ³Ğ¾Ğ²Ğ¾Ñ€Ğ¸Ğ²Â». Ğ”Ğ»Ñ Ğ¾Ñ„Ñ–Ñ†Ñ–Ğ¹Ğ½Ğ¸Ñ… Ñ‚ĞµĞºÑÑ‚Ñ–Ğ² Ğ²Ğ¸ĞºĞ¾Ñ€Ğ¸ÑÑ‚Ğ¾Ğ²ÑƒĞ¹Ñ‚Ğµ Â«Ğ·Ğ°ÑĞ²Ğ¸Ğ²Â», Â«Ğ¿Ğ¾Ğ²Ñ–Ğ´Ğ¾Ğ¼Ğ¸Ğ²Â», Â«Ğ¿Ñ–Ğ´Ñ‚Ğ²ĞµÑ€Ğ´Ğ¸Ğ²Â». Ğ”Ğ»Ñ Ğ½Ğ°ÑƒĞºĞ¾Ğ²Ğ¸Ñ… Ñ€Ğ¾Ğ±Ñ–Ñ‚ Ğ¿Ñ–Ğ´Ñ…Ğ¾Ğ´ÑÑ‚ÑŒ Â«ÑÑ‚Ğ²ĞµÑ€Ğ´Ğ¶ÑƒÑ”Â», Â«Ğ·Ğ°ÑƒĞ²Ğ°Ğ¶ÑƒÑ”Â», Â«Ğ¿Ğ¾ÑÑĞ½ÑÑ”Â».\n\n---\n\n### Ğ¡ĞºĞ»Ğ°Ğ´Ğ½Ñ– Ğ²Ğ¸Ğ¿Ğ°Ğ´ĞºĞ¸\n\n#### ĞšÑ–Ğ»ÑŒĞºĞ° Ğ´Ñ–Ñ”ÑĞ»Ñ–Ğ² Ğ¼Ğ¾Ğ²Ğ»ĞµĞ½Ğ½Ñ\n\n- Ğ’Ñ–Ğ½ **ÑĞºĞ°Ğ·Ğ°Ğ²**, Ñ‰Ğ¾ Ğ¿Ñ€Ğ¸Ğ¹Ğ´Ğµ, Ñ– **Ğ´Ğ¾Ğ´Ğ°Ğ²**, Ñ‰Ğ¾ Ğ¿Ñ€Ğ¸Ğ½ĞµÑĞµ Ğ¿Ğ¾Ğ´Ğ°Ñ€ÑƒĞ½Ğ¾Ğº.\n- Ğ’Ğ¾Ğ½Ğ° **Ğ¿Ğ¾ÑÑĞ½Ğ¸Ğ»Ğ°**, Ñ‰Ğ¾ Ğ·Ğ°Ğ¿Ñ–Ğ·Ğ½ÑÑ”Ñ‚ÑŒÑÑ, Ñ– **Ğ¿Ğ¾Ğ¿Ñ€Ğ¾ÑĞ¸Ğ»Ğ°**, Ñ‰Ğ¾Ğ± Ğ¿Ğ¾Ñ‡ĞµĞºĞ°Ğ»Ğ¸.\n\n#### ĞĞµĞ¿Ñ€ÑĞ¼Ğ° Ğ¼Ğ¾Ğ²Ğ° Ğ² Ğ¼Ğ¸Ğ½ÑƒĞ»Ğ¾Ğ¼Ñƒ Ğ· Ğ¼Ğ¸Ğ½ÑƒĞ»Ğ¸Ğ¼\n\n- ĞŸÑ€ÑĞ¼Ğ°: Ğ’Ñ–Ğ½ ÑĞºĞ°Ğ·Ğ°Ğ²: Â«Ğ¯ **Ğ±Ğ°Ñ‡Ğ¸Ğ²** Ñ†Ğµ **Ğ²Ñ‡Ğ¾Ñ€Ğ°**.Â»\n- ĞĞµĞ¿Ñ€ÑĞ¼Ğ°: Ğ’Ñ–Ğ½ ÑĞºĞ°Ğ·Ğ°Ğ², Ñ‰Ğ¾ **Ğ±Ğ°Ñ‡Ğ¸Ğ²** Ñ†Ğµ **Ğ½Ğ°Ğ¿ĞµÑ€ĞµĞ´Ğ¾Ğ´Ğ½Ñ–**.\n\n#### ĞĞµĞ¿Ñ€ÑĞ¼Ğ° Ğ¼Ğ¾Ğ²Ğ° Ğ· Ğ¼Ğ¾Ğ´Ğ°Ğ»ÑŒĞ½Ğ¸Ğ¼Ğ¸ Ğ´Ñ–Ñ”ÑĞ»Ğ¾Ğ²Ğ°Ğ¼Ğ¸\n\n- ĞŸÑ€ÑĞ¼Ğ°: Â«Ğ¯ **Ğ¼Ğ¾Ğ¶Ñƒ** Ğ´Ğ¾Ğ¿Ğ¾Ğ¼Ğ¾Ğ³Ñ‚Ğ¸.Â»\n- ĞĞµĞ¿Ñ€ÑĞ¼Ğ°: Ğ’Ñ–Ğ½ ÑĞºĞ°Ğ·Ğ°Ğ², Ñ‰Ğ¾ **Ğ¼Ğ¾Ğ¶Ğµ** Ğ´Ğ¾Ğ¿Ğ¾Ğ¼Ğ¾Ğ³Ñ‚Ğ¸.\n\n- ĞŸÑ€ÑĞ¼Ğ°: Â«Ğ¯ **Ğ¿Ğ¾Ğ²Ğ¸Ğ½ĞµĞ½** Ğ¿Ñ–Ñ‚Ğ¸.Â»\n- ĞĞµĞ¿Ñ€ÑĞ¼Ğ°: Ğ’Ñ–Ğ½ ÑĞºĞ°Ğ·Ğ°Ğ², Ñ‰Ğ¾ **Ğ¿Ğ¾Ğ²Ğ¸Ğ½ĞµĞ½** Ğ¿Ñ–Ñ‚Ğ¸.\n\n> ğŸ‡ºğŸ‡¦ **Ğ£ĞºÑ€Ğ°Ñ—Ğ½ÑÑŒĞºĞ° Ñ–Ğ´ĞµĞ½Ñ‚Ğ¸Ñ‡Ğ½Ñ–ÑÑ‚ÑŒ**\n> Ğ£ĞºÑ€Ğ°Ñ—Ğ½ÑÑŒĞºĞ° Ğ¼Ğ¾Ğ²Ğ° Ğ¼Ğ°Ñ” Ğ±Ğ°Ğ³Ğ°Ñ‚Ğ¸Ğ¹ Ğ°Ñ€ÑĞµĞ½Ğ°Ğ» Ğ´Ñ–Ñ”ÑĞ»Ñ–Ğ² Ğ¼Ğ¾Ğ²Ğ»ĞµĞ½Ğ½Ñ: ÑĞºĞ°Ğ·Ğ°Ñ‚Ğ¸, Ğ³Ğ¾Ğ²Ğ¾Ñ€Ğ¸Ñ‚Ğ¸, Ğ¼Ğ¾Ğ²Ğ¸Ñ‚Ğ¸, Ğ¿Ñ€Ğ¾Ğ¼Ğ¾Ğ²Ğ¸Ñ‚Ğ¸, Ğ²Ğ¸Ğ¼Ğ¾Ğ²Ğ¸Ñ‚Ğ¸, Ğ²Ğ¸ÑĞ»Ğ¾Ğ²Ğ¸Ñ‚Ğ¸, Ğ·Ğ°ÑĞ²Ğ¸Ñ‚Ğ¸, Ğ¿Ğ¾Ğ²Ñ–Ğ´Ğ¾Ğ¼Ğ¸Ñ‚Ğ¸, Ğ·Ğ°ÑƒĞ²Ğ°Ğ¶Ğ¸Ñ‚Ğ¸, Ğ¿Ğ¾ÑÑĞ½Ğ¸Ñ‚Ğ¸, Ğ´Ğ¾Ğ´Ğ°Ñ‚Ğ¸. Ğ¦Ñ Ñ€Ñ–Ğ·Ğ½Ğ¾Ğ¼Ğ°Ğ½Ñ–Ñ‚Ğ½Ñ–ÑÑ‚ÑŒ Ğ´Ğ¾Ğ·Ğ²Ğ¾Ğ»ÑÑ” Ñ‚Ğ¾Ñ‡Ğ½Ğ¾ Ğ¿ĞµÑ€ĞµĞ´Ğ°Ñ‚Ğ¸ Ğ½ÑĞ°Ğ½ÑĞ¸ Ñ‚Ğ¾Ğ³Ğ¾, ÑĞº ÑĞ°Ğ¼Ğµ Ğ±ÑƒĞ»Ğ¾ ÑĞºĞ°Ğ·Ğ°Ğ½Ğ¾ â€” Ñ‚Ğ¸Ñ…Ğ¾, Ğ³Ğ¾Ğ»Ğ¾ÑĞ½Ğ¾, Ğ¾Ñ„Ñ–Ñ†Ñ–Ğ¹Ğ½Ğ¾, Ğ½ĞµĞ²Ğ¸Ğ¼ÑƒÑˆĞµĞ½Ğ¾. Ğ¦Ğµ Ğ¾ÑĞ¾Ğ±Ğ»Ğ¸Ğ²Ğ° Ğ²Ğ¸Ñ€Ğ°Ğ·Ğ½Ñ–ÑÑ‚ÑŒ ÑƒĞºÑ€Ğ°Ñ—Ğ½ÑÑŒĞºĞ¾Ñ— Ğ¼Ğ¾Ğ²Ğ¸!\n\n---\n\n## ĞŸÑ€Ğ°ĞºÑ‚Ğ¸ĞºĞ°\n\n### ĞĞ»Ğ³Ğ¾Ñ€Ğ¸Ñ‚Ğ¼ Ğ¿ĞµÑ€ĞµÑ…Ğ¾Ğ´Ñƒ Ğ´Ğ¾ Ğ½ĞµĞ¿Ñ€ÑĞ¼Ğ¾Ñ— Ğ¼Ğ¾Ğ²Ğ¸\n\n**ĞšÑ€Ğ¾Ğº 1:** Ğ’Ğ¸Ğ·Ğ½Ğ°Ñ‡Ñ‚Ğµ Ğ´Ñ–Ñ”ÑĞ»Ğ¾Ğ²Ğ¾ Ğ²Ğ²ĞµĞ´ĞµĞ½Ğ½Ñ (ÑĞºĞ°Ğ·Ğ°Ğ², Ğ¿Ğ¾ÑÑĞ½Ğ¸Ğ², Ğ·Ğ°ÑĞ²Ğ¸Ğ²...).\n**ĞšÑ€Ğ¾Ğº 2:** Ğ”Ğ¾Ğ´Ğ°Ğ¹Ñ‚Ğµ ÑĞ¿Ğ¾Ğ»ÑƒÑ‡Ğ½Ğ¸Ğº Â«Ñ‰Ğ¾Â».\n**ĞšÑ€Ğ¾Ğº 3:** Ğ—Ğ¼Ñ–Ğ½Ñ–Ñ‚ÑŒ Ğ·Ğ°Ğ¹Ğ¼ĞµĞ½Ğ½Ğ¸ĞºĞ¸ Ğ²Ñ–Ğ´Ğ¿Ğ¾Ğ²Ñ–Ğ´Ğ½Ğ¾ Ğ´Ğ¾ ĞºĞ¾Ğ½Ñ‚ĞµĞºÑÑ‚Ñƒ.\n**ĞšÑ€Ğ¾Ğº 4:** Ğ—Ğ° Ğ¿Ğ¾Ñ‚Ñ€ĞµĞ±Ğ¸ Ğ·Ğ¼Ñ–Ğ½Ñ–Ñ‚ÑŒ Ñ‡Ğ°Ñ Ğ´Ñ–Ñ”ÑĞ»Ğ¾Ğ²Ğ° Ñ‚Ğ° Ğ²ĞºĞ°Ğ·Ñ–Ğ²Ğ½Ñ– ÑĞ»Ğ¾Ğ²Ğ°.\n\n**ĞŸÑ€Ğ¸ĞºĞ»Ğ°Ğ´ Ğ¿Ğ¾ĞºÑ€Ğ¾ĞºĞ¾Ğ²Ğ¾Ğ³Ğ¾ Ğ¿ĞµÑ€ĞµÑ…Ğ¾Ğ´Ñƒ:**\n\nĞŸÑ€ÑĞ¼Ğ°: ĞœĞ°Ñ€Ñ–Ñ ĞºĞ°Ğ¶Ğµ: Â«Ğ¯ **Ğ·Ñ€Ğ¾Ğ±Ğ»Ñ** Ñ†Ğµ **Ğ·Ğ°Ğ²Ñ‚Ñ€Ğ°** **Ñ‚ÑƒÑ‚**.Â»\n\n1. Ğ”Ñ–Ñ”ÑĞ»Ğ¾Ğ²Ğ¾: ĞºĞ°Ğ¶Ğµ\n2. + Ñ‰Ğ¾: ĞœĞ°Ñ€Ñ–Ñ ĞºĞ°Ğ¶Ğµ, Ñ‰Ğ¾...\n3. + Ğ·Ğ°Ğ¹Ğ¼ĞµĞ½Ğ½Ğ¸Ğº: ĞœĞ°Ñ€Ñ–Ñ ĞºĞ°Ğ¶Ğµ, Ñ‰Ğ¾ **Ğ²Ğ¾Ğ½Ğ°**...\n4. + Ñ‡Ğ°Ñ: ĞœĞ°Ñ€Ñ–Ñ ĞºĞ°Ğ¶Ğµ, Ñ‰Ğ¾ Ğ²Ğ¾Ğ½Ğ° **Ğ·Ñ€Ğ¾Ğ±Ğ¸Ñ‚ÑŒ** Ñ†Ğµ **Ğ½Ğ°ÑÑ‚ÑƒĞ¿Ğ½Ğ¾Ğ³Ğ¾ Ğ´Ğ½Ñ** **Ñ‚Ğ°Ğ¼**.\n\n**Ğ ĞµĞ·ÑƒĞ»ÑŒÑ‚Ğ°Ñ‚:** ĞœĞ°Ñ€Ñ–Ñ ĞºĞ°Ğ¶Ğµ, Ñ‰Ğ¾ Ğ²Ğ¾Ğ½Ğ° Ğ·Ñ€Ğ¾Ğ±Ğ¸Ñ‚ÑŒ Ñ†Ğµ Ğ½Ğ°ÑÑ‚ÑƒĞ¿Ğ½Ğ¾Ğ³Ğ¾ Ğ´Ğ½Ñ Ñ‚Ğ°Ğ¼.\n\n### Ğ¢Ğ¸Ğ¿Ğ¾Ğ²Ñ– Ğ¿Ğ¾Ğ¼Ğ¸Ğ»ĞºĞ¸\n\n**ĞŸĞ¾Ğ¼Ğ¸Ğ»ĞºĞ° 1: ĞŸÑ€Ğ¾Ğ¿ÑƒÑĞº Â«Ñ‰Ğ¾Â»**\n\nâŒ ĞĞµĞ¿Ñ€Ğ°Ğ²Ğ¸Ğ»ÑŒĞ½Ğ¾: Ğ’Ñ–Ğ½ ÑĞºĞ°Ğ·Ğ°Ğ² Ğ²Ñ–Ğ½ Ğ¿Ñ€Ğ¸Ğ¹Ğ´Ğµ.\nâœ… ĞŸÑ€Ğ°Ğ²Ğ¸Ğ»ÑŒĞ½Ğ¾: Ğ’Ñ–Ğ½ ÑĞºĞ°Ğ·Ğ°Ğ², **Ñ‰Ğ¾** Ğ²Ñ–Ğ½ Ğ¿Ñ€Ğ¸Ğ¹Ğ´Ğµ.\n\n**ĞŸĞ¾Ğ¼Ğ¸Ğ»ĞºĞ° 2: ĞĞµĞ·Ğ¼Ñ–Ğ½ĞµĞ½Ñ– Ğ·Ğ°Ğ¹Ğ¼ĞµĞ½Ğ½Ğ¸ĞºĞ¸**\n\nâŒ ĞĞµĞ¿Ñ€Ğ°Ğ²Ğ¸Ğ»ÑŒĞ½Ğ¾: Ğ’Ğ¾Ğ½Ğ° ÑĞºĞ°Ğ·Ğ°Ğ»Ğ°, Ñ‰Ğ¾ **Ñ** Ğ¿Ñ€Ğ¸Ğ¹Ğ´Ñƒ. (ÑĞºÑ‰Ğ¾ Ğ¼Ğ¾Ğ²ĞµÑ†ÑŒ â€” Ğ²Ğ¾Ğ½Ğ°)\nâœ… ĞŸÑ€Ğ°Ğ²Ğ¸Ğ»ÑŒĞ½Ğ¾: Ğ’Ğ¾Ğ½Ğ° ÑĞºĞ°Ğ·Ğ°Ğ»Ğ°, Ñ‰Ğ¾ **Ğ²Ğ¾Ğ½Ğ°** Ğ¿Ñ€Ğ¸Ğ¹Ğ´Ğµ.\n\n**ĞŸĞ¾Ğ¼Ğ¸Ğ»ĞºĞ° 3: ĞĞ°Ğ´Ğ¼Ñ–Ñ€Ğ½Ğ¸Ğ¹ Ğ·ÑÑƒĞ² Ñ‡Ğ°ÑÑƒ**\n\nâŒ ĞĞµĞ¿Ñ€Ğ°Ğ²Ğ¸Ğ»ÑŒĞ½Ğ¾: Ğ’Ñ–Ğ½ ÑĞºĞ°Ğ·Ğ°Ğ², Ñ‰Ğ¾ **Ğ¿Ñ€Ğ°Ñ†ÑĞ²Ğ°Ğ²** Ñ‚ÑƒÑ‚. (ÑĞºÑ‰Ğ¾ Ñ‰Ğµ Ğ¿Ñ€Ğ°Ñ†ÑÑ”)\nâœ… ĞŸÑ€Ğ°Ğ²Ğ¸Ğ»ÑŒĞ½Ğ¾: Ğ’Ñ–Ğ½ ÑĞºĞ°Ğ·Ğ°Ğ², Ñ‰Ğ¾ **Ğ¿Ñ€Ğ°Ñ†ÑÑ”** Ñ‚ÑƒÑ‚.\n\n> ğŸ¯ **ĞŸÑ€Ğ°ĞºÑ‚Ğ¸Ñ‡Ğ½Ğ° Ğ¿Ğ¾Ñ€Ğ°Ğ´Ğ°**\n> ĞšĞ¾Ğ½Ñ‚ĞµĞºÑÑ‚ â€” Ğ³Ğ¾Ğ»Ğ¾Ğ²Ğ½Ğ¸Ğ¹ Ğ¿Ğ¾Ğ¼Ñ–Ñ‡Ğ½Ğ¸Ğº! Ğ—Ğ°Ğ²Ğ¶Ğ´Ğ¸ Ğ´ÑƒĞ¼Ğ°Ğ¹Ñ‚Ğµ: Ñ…Ñ‚Ğ¾ Ğ³Ğ¾Ğ²Ğ¾Ñ€Ğ¸Ñ‚ÑŒ, ĞºĞ¾Ğ¼Ñƒ, Ğ¿Ñ€Ğ¾ ĞºĞ¾Ğ³Ğ¾? Ğ¦Ğµ Ğ´Ğ¾Ğ¿Ğ¾Ğ¼Ğ¾Ğ¶Ğµ Ğ¿Ñ€Ğ°Ğ²Ğ¸Ğ»ÑŒĞ½Ğ¾ Ğ·Ğ¼Ñ–Ğ½Ğ¸Ñ‚Ğ¸ Ğ·Ğ°Ğ¹Ğ¼ĞµĞ½Ğ½Ğ¸ĞºĞ¸. Ğ¢Ğ°ĞºĞ¾Ğ¶ Ğ²Ñ€Ğ°Ñ…Ğ¾Ğ²ÑƒĞ¹Ñ‚Ğµ, Ñ‡Ğ¸ Ğ´Ñ–Ñ Ñ‰Ğµ Ğ°ĞºÑ‚ÑƒĞ°Ğ»ÑŒĞ½Ğ° â€” Ñ†Ğµ Ğ²Ğ¸Ğ·Ğ½Ğ°Ñ‡Ğ¸Ñ‚ÑŒ, Ñ‡Ğ¸ Ğ¿Ğ¾Ñ‚Ñ€Ñ–Ğ±ĞµĞ½ Ğ·ÑÑƒĞ² Ñ‡Ğ°ÑÑƒ Ğ² Ğ¿Ñ–Ğ´Ñ€ÑĞ´Ğ½Ğ¾Ğ¼Ñƒ Ñ€ĞµÑ‡ĞµĞ½Ğ½Ñ–!\n\n---\n\n## Ğ”Ñ–Ğ°Ğ»Ğ¾Ğ³Ğ¸\n\n### Ğ”Ñ–Ğ°Ğ»Ğ¾Ğ³ 1: ĞŸĞµÑ€ĞµĞºĞ°Ğ· Ñ€Ğ¾Ğ·Ğ¼Ğ¾Ğ²Ğ¸\n\n**ĞĞºÑĞ°Ğ½Ğ°:** Ğ©Ğ¾ ÑĞºĞ°Ğ·Ğ°Ğ² ÑˆĞµÑ„ Ğ½Ğ° Ğ·ÑƒÑÑ‚Ñ€Ñ–Ñ‡Ñ– ÑÑŒĞ¾Ğ³Ğ¾Ğ´Ğ½Ñ–?\n\n**ĞŸĞµÑ‚Ñ€Ğ¾:** Ğ’Ñ–Ğ½ ÑĞºĞ°Ğ·Ğ°Ğ², Ñ‰Ğ¾ Ğ¿Ñ€Ğ¾ĞµĞºÑ‚ Ğ¿Ñ€Ğ¾ÑÑƒĞ²Ğ°Ñ”Ñ‚ÑŒÑÑ Ğ´Ğ¾Ğ±Ñ€Ğµ Ñ– Ñ‰Ğ¾ Ğ¼Ğ¸ Ğ²ÑÑ‚Ğ¸Ğ³Ğ½ĞµĞ¼Ğ¾ Ğ´Ğ¾ Ğ´ĞµĞ´Ğ»Ğ°Ğ¹Ğ½Ñƒ.\n\n**ĞĞºÑĞ°Ğ½Ğ°:** Ğ Ñ‰Ğ¾ Ğ²Ñ–Ğ½ Ğ³Ğ¾Ğ²Ğ¾Ñ€Ğ¸Ğ² Ğ¿Ñ€Ğ¾ Ğ±ÑĞ´Ğ¶ĞµÑ‚ Ğ½Ğ°ÑˆĞ¾Ğ³Ğ¾ Ğ²Ñ–Ğ´Ğ´Ñ–Ğ»Ñƒ?\n\n**ĞŸĞµÑ‚Ñ€Ğ¾:** Ğ’Ñ–Ğ½ Ğ¿Ğ¾ÑÑĞ½Ğ¸Ğ², Ñ‰Ğ¾ Ğ±ÑĞ´Ğ¶ĞµÑ‚ Ğ±ÑƒĞ´Ğµ Ğ·Ğ±Ñ–Ğ»ÑŒÑˆĞµĞ½Ğ¾ Ğ½Ğ° Ğ´ĞµÑÑÑ‚ÑŒ Ğ²Ñ–Ğ´ÑĞ¾Ñ‚ĞºÑ–Ğ².\n\n**ĞĞºÑĞ°Ğ½Ğ°:** Ğ§ÑƒĞ´Ğ¾Ğ²Ğ¾! Ğ Ğ¿Ñ€Ğ¾ Ğ²Ñ–Ğ´Ğ¿ÑƒÑÑ‚ĞºĞ¸ Ñ‰Ğ¾ÑÑŒ Ğ·Ğ³Ğ°Ğ´ÑƒĞ²Ğ°Ğ² Ñ†ÑŒĞ¾Ğ³Ğ¾ Ñ€Ğ°Ğ·Ñƒ?\n\n**ĞŸĞµÑ‚Ñ€Ğ¾:** Ğ¢Ğ°Ğº, Ğ²Ñ–Ğ½ Ğ´Ğ¾Ğ´Ğ°Ğ², Ñ‰Ğ¾ Ğ½Ğ°Ğ¼ Ğ¿Ğ¾Ñ‚Ñ€Ñ–Ğ±Ğ½Ğ¾ Ğ¿Ğ¾Ğ´Ğ°Ñ‚Ğ¸ Ğ·Ğ°ÑĞ²ĞºĞ¸ Ğ´Ğ¾ ĞºÑ–Ğ½Ñ†Ñ Ğ¼Ñ–ÑÑÑ†Ñ.\n\n---\n\n### Ğ”Ñ–Ğ°Ğ»Ğ¾Ğ³ 2: ĞĞ¾Ğ²Ğ¸Ğ½Ğ¸\n\n**Ğ–ÑƒÑ€Ğ½Ğ°Ğ»Ñ–ÑÑ‚:** Ğ©Ğ¾ Ğ·Ğ°ÑĞ²Ğ¸Ğ² Ğ¿Ñ€ĞµĞ·Ğ¸Ğ´ĞµĞ½Ñ‚ Ğ½Ğ° Ğ¿Ñ€ĞµÑ-ĞºĞ¾Ğ½Ñ„ĞµÑ€ĞµĞ½Ñ†Ñ–Ñ—?\n\n**Ğ ĞµĞ´Ğ°ĞºÑ‚Ğ¾Ñ€:** Ğ’Ñ–Ğ½ Ğ·Ğ°ÑĞ²Ğ¸Ğ², Ñ‰Ğ¾ Ğ¿ĞµÑ€ĞµĞ³Ğ¾Ğ²Ğ¾Ñ€Ğ¸ Ğ¿Ñ€Ğ¾Ğ¹ÑˆĞ»Ğ¸ ÑƒÑĞ¿Ñ–ÑˆĞ½Ğ¾ Ñ– Ğ¾Ğ±Ğ¸Ğ´Ğ²Ñ– ÑÑ‚Ğ¾Ñ€Ğ¾Ğ½Ğ¸ Ğ·Ğ°Ğ´Ğ¾Ğ²Ğ¾Ğ»ĞµĞ½Ñ–.\n\n**Ğ–ÑƒÑ€Ğ½Ğ°Ğ»Ñ–ÑÑ‚:** Ğ Ğ¾Ğ¿Ğ¾Ğ·Ğ¸Ñ†Ñ–Ñ Ñ‰Ğ¾ ĞºĞ°Ğ¶Ğµ Ğ¿Ñ€Ğ¾ Ñ†Ğµ?\n\n**Ğ ĞµĞ´Ğ°ĞºÑ‚Ğ¾Ñ€:** Ğ›Ñ–Ğ´ĞµÑ€ Ğ¾Ğ¿Ğ¾Ğ·Ğ¸Ñ†Ñ–Ñ— ÑÑ‚Ğ²ĞµÑ€Ğ´Ğ¶ÑƒÑ”, Ñ‰Ğ¾ ÑƒĞ¼Ğ¾Ğ²Ğ¸ ÑƒĞ³Ğ¾Ğ´Ğ¸ Ğ½ĞµĞ²Ğ¸Ğ³Ñ–Ğ´Ğ½Ñ– Ğ´Ğ»Ñ ĞºÑ€Ğ°Ñ—Ğ½Ğ¸.\n\n**Ğ–ÑƒÑ€Ğ½Ğ°Ğ»Ñ–ÑÑ‚:** Ğ Ğ¼Ñ–Ğ¶Ğ½Ğ°Ñ€Ğ¾Ğ´Ğ½Ñ– ĞµĞºÑĞ¿ĞµÑ€Ñ‚Ğ¸ Ñ‰Ğ¾ Ğ³Ğ¾Ğ²Ğ¾Ñ€ÑÑ‚ÑŒ?\n\n**Ğ ĞµĞ´Ğ°ĞºÑ‚Ğ¾Ñ€:** Ğ•ĞºÑĞ¿ĞµÑ€Ñ‚Ğ¸ Ğ·Ğ°ÑƒĞ²Ğ°Ğ¶Ğ¸Ğ»Ğ¸, Ñ‰Ğ¾ Ñ†Ğµ Ğ²Ğ°Ğ¶Ğ»Ğ¸Ğ²Ğ¸Ğ¹ ĞºÑ€Ğ¾Ğº Ñƒ Ğ¿Ñ€Ğ°Ğ²Ğ¸Ğ»ÑŒĞ½Ğ¾Ğ¼Ñƒ Ğ½Ğ°Ğ¿Ñ€ÑĞ¼ĞºÑƒ.\n\n---\n\n### Ğ”Ñ–Ğ°Ğ»Ğ¾Ğ³ 3: ĞŸĞ»Ñ–Ñ‚ĞºĞ¸\n\n**Ğ“Ğ°Ğ½Ğ½Ğ°:** Ğ¢Ğ¸ Ñ‡ÑƒĞ»Ğ°, Ñ‰Ğ¾ ĞœĞ°Ñ€Ñ–Ñ Ñ€Ğ¾Ğ·Ğ¿Ğ¾Ğ²Ñ–Ğ´Ğ°Ğ»Ğ° Ğ¿Ñ€Ğ¾ Ğ²ĞµÑ‡Ñ–Ñ€ĞºÑƒ?\n\n**Ğ¡Ğ¾Ñ„Ñ–Ñ:** Ğ¢Ğ°Ğº, Ğ²Ğ¾Ğ½Ğ° ÑĞºĞ°Ğ·Ğ°Ğ»Ğ°, Ñ‰Ğ¾ Ñ‚Ğ°Ğ¼ Ğ±ÑƒĞ»Ğ¾ Ğ´ÑƒĞ¶Ğµ Ğ²ĞµÑĞµĞ»Ğ¾ Ñ– Ğ¼ÑƒĞ·Ğ¸ĞºĞ° Ğ±ÑƒĞ»Ğ° Ñ‡ÑƒĞ´Ğ¾Ğ²Ğ°.\n\n**Ğ“Ğ°Ğ½Ğ½Ğ°:** Ğ Ñ‰Ğ¾ Ğ²Ğ¾Ğ½Ğ° Ğ³Ğ¾Ğ²Ğ¾Ñ€Ğ¸Ğ»Ğ° Ğ¿Ñ€Ğ¾ Ñ—Ğ¶Ñƒ Ñ‚Ğ° Ğ½Ğ°Ğ¿Ğ¾Ñ—?\n\n**Ğ¡Ğ¾Ñ„Ñ–Ñ:** Ğ’Ğ¾Ğ½Ğ° Ğ´Ğ¾Ğ´Ğ°Ğ»Ğ°, Ñ‰Ğ¾ Ñ—Ğ¶Ğ° Ğ±ÑƒĞ»Ğ° ÑĞ¼Ğ°Ñ‡Ğ½Ğ°, Ğ°Ğ»Ğµ Ñ—Ñ— Ğ±ÑƒĞ»Ğ¾ Ğ·Ğ°Ğ¼Ğ°Ğ»Ğ¾.\n\n**Ğ“Ğ°Ğ½Ğ½Ğ°:** Ğ Ñ…Ñ‚Ğ¾ Ñ‚Ğ°Ğ¼ Ğ±ÑƒĞ² Ñ–Ğ· Ğ·Ğ½Ğ°Ğ¹Ğ¾Ğ¼Ğ¸Ñ…?\n\n**Ğ¡Ğ¾Ñ„Ñ–Ñ:** Ğ’Ğ¾Ğ½Ğ° Ğ·Ğ°ÑƒĞ²Ğ°Ğ¶Ğ¸Ğ»Ğ°, Ñ‰Ğ¾ Ğ±Ğ°Ñ‡Ğ¸Ğ»Ğ° Ñ‚Ğ°Ğ¼ Ñ‚Ñ–Ğ»ÑŒĞºĞ¸ ĞºÑ–Ğ»ÑŒĞºĞ¾Ñ… ÑĞ¿Ñ–Ğ»ÑŒĞ½Ğ¸Ñ… Ğ´Ñ€ÑƒĞ·Ñ–Ğ².\n\n---\n\n### Ğ”Ñ–Ğ°Ğ»Ğ¾Ğ³ 4: Ğ›Ñ–ĞºĞ°Ñ€\n\n**ĞŸĞ°Ñ†Ñ–Ñ”Ğ½Ñ‚:** Ğ©Ğ¾ ÑĞºĞ°Ğ·Ğ°Ğ² Ğ»Ñ–ĞºĞ°Ñ€ Ğ¿Ñ€Ğ¾ Ğ¼Ğ¾Ñ— Ğ°Ğ½Ğ°Ğ»Ñ–Ğ·Ğ¸?\n\n**ĞœĞµĞ´ÑĞµÑÑ‚Ñ€Ğ°:** Ğ’Ñ–Ğ½ ÑĞºĞ°Ğ·Ğ°Ğ², Ñ‰Ğ¾ Ğ²Ğ°ÑˆÑ– Ğ°Ğ½Ğ°Ğ»Ñ–Ğ·Ğ¸ Ğ² Ğ½Ğ¾Ñ€Ğ¼Ñ– Ñ– Ñ…Ğ²Ğ¸Ğ»ÑĞ²Ğ°Ñ‚Ğ¸ÑÑ Ğ½Ğµ Ğ¿Ğ¾Ñ‚Ñ€Ñ–Ğ±Ğ½Ğ¾.\n\n**ĞŸĞ°Ñ†Ñ–Ñ”Ğ½Ñ‚:** Ğ Ñ‰Ğ¾ Ğ²Ñ–Ğ½ Ñ€ĞµĞºĞ¾Ğ¼ĞµĞ½Ğ´ÑƒÑ” Ğ´Ğ»Ñ Ğ¿Ñ€Ğ¾Ñ„Ñ–Ğ»Ğ°ĞºÑ‚Ğ¸ĞºĞ¸?\n\n**ĞœĞµĞ´ÑĞµÑÑ‚Ñ€Ğ°:** Ğ’Ñ–Ğ½ Ğ¿Ğ¾ÑÑĞ½Ğ¸Ğ², Ñ‰Ğ¾ Ğ¿Ğ¾Ñ‚Ñ€Ñ–Ğ±Ğ½Ğ¾ Ğ±Ñ–Ğ»ÑŒÑˆĞµ Ñ€ÑƒÑ…Ğ°Ñ‚Ğ¸ÑÑ Ñ– ĞºÑ€Ğ°Ñ‰Ğµ Ñ…Ğ°Ñ€Ñ‡ÑƒĞ²Ğ°Ñ‚Ğ¸ÑÑ.\n\n**ĞŸĞ°Ñ†Ñ–Ñ”Ğ½Ñ‚:** ĞšĞ¾Ğ»Ğ¸ Ğ½Ğ°ÑÑ‚ÑƒĞ¿Ğ½Ğ¸Ğ¹ Ğ¿Ñ€Ğ¸Ğ¹Ğ¾Ğ¼ Ğ±ÑƒĞ´Ğµ Ñƒ Ğ½ÑŒĞ¾Ğ³Ğ¾?\n\n**ĞœĞµĞ´ÑĞµÑÑ‚Ñ€Ğ°:** Ğ’Ñ–Ğ½ Ğ´Ğ¾Ğ´Ğ°Ğ², Ñ‰Ğ¾ Ğ²Ğ°Ğ¼ Ğ¿Ğ¾Ñ‚Ñ€Ñ–Ğ±Ğ½Ğ¾ Ğ¿Ñ€Ğ¸Ğ¹Ñ‚Ğ¸ Ñ‡ĞµÑ€ĞµĞ· Ğ¼Ñ–ÑÑÑ†ÑŒ Ğ½Ğ° ĞºĞ¾Ğ½Ñ‚Ñ€Ğ¾Ğ»ÑŒ.\n\n---\n\n# ĞŸÑ–Ğ´ÑÑƒĞ¼Ğ¾Ğº\n\n**Ğ©Ğ¾ Ğ²Ğ¸ Ğ½Ğ°Ğ²Ñ‡Ğ¸Ğ»Ğ¸ÑÑ:**\n\n1. **Ğ¡Ñ‚Ñ€ÑƒĞºÑ‚ÑƒÑ€Ğ°:** ĞŸÑ€ÑĞ¼Ğ° â†’ ĞĞµĞ¿Ñ€ÑĞ¼Ğ°: Ğ´Ğ¾Ğ´Ğ°Ñ”Ğ¼Ğ¾ Â«Ñ‰Ğ¾Â», Ğ·Ğ¼Ñ–Ğ½ÑÑ”Ğ¼Ğ¾ Ğ·Ğ°Ğ¹Ğ¼ĞµĞ½Ğ½Ğ¸ĞºĞ¸.\n2. **Ğ”Ñ–Ñ”ÑĞ»Ğ¾Ğ²Ğ° Ğ²Ğ²ĞµĞ´ĞµĞ½Ğ½Ñ:** ÑĞºĞ°Ğ·Ğ°Ñ‚Ğ¸, Ğ³Ğ¾Ğ²Ğ¾Ñ€Ğ¸Ñ‚Ğ¸, Ğ¿Ğ¾ÑÑĞ½Ğ¸Ñ‚Ğ¸, Ğ·Ğ°ÑĞ²Ğ¸Ñ‚Ğ¸, Ğ´Ğ¾Ğ´Ğ°Ñ‚Ğ¸, Ğ·Ğ°ÑƒĞ²Ğ°Ğ¶Ğ¸Ñ‚Ğ¸.\n3. **Ğ—ÑÑƒĞ² Ñ‡Ğ°ÑÑ–Ğ²:** Ğ·Ğ°Ğ»ĞµĞ¶Ğ¸Ñ‚ÑŒ Ğ²Ñ–Ğ´ Ğ°ĞºÑ‚ÑƒĞ°Ğ»ÑŒĞ½Ğ¾ÑÑ‚Ñ– Ğ´Ñ–Ñ—.\n4. **Ğ’ĞºĞ°Ğ·Ñ–Ğ²Ğ½Ñ– ÑĞ»Ğ¾Ğ²Ğ°:** Ğ·Ğ°Ñ€Ğ°Ğ· â†’ Ñ‚Ğ¾Ğ´Ñ–, Ñ‚ÑƒÑ‚ â†’ Ñ‚Ğ°Ğ¼, Ğ·Ğ°Ğ²Ñ‚Ñ€Ğ° â†’ Ğ½Ğ°ÑÑ‚ÑƒĞ¿Ğ½Ğ¾Ğ³Ğ¾ Ğ´Ğ½Ñ.\n\n**ĞÑĞ½Ğ¾Ğ²Ğ½Ğµ Ğ¿Ñ€Ğ°Ğ²Ğ¸Ğ»Ğ¾:**\n\n> ĞĞµĞ¿Ñ€ÑĞ¼Ğ° Ğ¼Ğ¾Ğ²Ğ° Ğ¿ĞµÑ€ĞµĞ´Ğ°Ñ” Ğ·Ğ¼Ñ–ÑÑ‚, Ğ° Ğ½Ğµ Ñ„Ğ¾Ñ€Ğ¼Ñƒ. Ğ“Ğ¾Ğ»Ğ¾Ğ²Ğ½Ğµ â€” Ğ¿Ñ€Ğ°Ğ²Ğ¸Ğ»ÑŒĞ½Ğ¾ Ğ²Ğ¸Ğ·Ğ½Ğ°Ñ‡Ğ¸Ñ‚Ğ¸: Ñ…Ñ‚Ğ¾ Ğ³Ğ¾Ğ²Ğ¾Ñ€Ğ¸Ñ‚ÑŒ, Ğ¿Ñ€Ğ¾ ĞºĞ¾Ğ³Ğ¾, Ñ‡Ğ¸ Ğ´Ñ–Ñ Ñ‰Ğµ Ğ°ĞºÑ‚ÑƒĞ°Ğ»ÑŒĞ½Ğ°. Ğ’Ğ¸ĞºĞ¾Ñ€Ğ¸ÑÑ‚Ğ¾Ğ²ÑƒĞ¹Ñ‚Ğµ Ñ€Ñ–Ğ·Ğ½Ñ– Ğ´Ñ–Ñ”ÑĞ»Ğ¾Ğ²Ğ° Ğ²Ğ²ĞµĞ´ĞµĞ½Ğ½Ñ Ğ´Ğ»Ñ Ñ‚Ğ¾Ñ‡Ğ½Ğ¾Ñ— Ğ¿ĞµÑ€ĞµĞ´Ğ°Ñ‡Ñ– Ğ½ÑĞ°Ğ½ÑÑ–Ğ²!\n\n**Ğ”Ğ°Ğ»Ñ–:**\n\nĞ£ Ğ½Ğ°ÑÑ‚ÑƒĞ¿Ğ½Ğ¾Ğ¼Ñƒ Ğ¼Ğ¾Ğ´ÑƒĞ»Ñ– (Ğœ40) Ğ¼Ğ¸ Ñ€Ğ¾Ğ·Ğ³Ğ»ÑĞ½ĞµĞ¼Ğ¾ **Ğ½ĞµĞ¿Ñ€ÑĞ¼Ñ– Ğ¿Ğ¸Ñ‚Ğ°Ğ½Ğ½Ñ Ñ‚Ğ° Ğ½Ğ°ĞºĞ°Ğ·Ğ¸** â€” ÑĞº Ğ¿ĞµÑ€ĞµĞ´Ğ°Ğ²Ğ°Ñ‚Ğ¸ Ñ‡ÑƒĞ¶Ñ– Ğ¿Ğ¸Ñ‚Ğ°Ğ½Ğ½Ñ Ñ‚Ğ° ĞºĞ¾Ğ¼Ğ°Ğ½Ğ´Ğ¸: Â«Ğ’Ñ–Ğ½ Ğ·Ğ°Ğ¿Ğ¸Ñ‚Ğ°Ğ², Ñ‡Ğ¸...Â», Â«Ğ’Ğ¾Ğ½Ğ° Ğ¿Ğ¾Ğ¿Ñ€Ğ¾ÑĞ¸Ğ»Ğ°, Ñ‰Ğ¾Ğ±...Â». Ğ¦Ğµ Ğ·Ğ°Ğ²ĞµÑ€ÑˆĞ¸Ñ‚ÑŒ Ñ‚ĞµĞ¼Ñƒ Ğ½ĞµĞ¿Ñ€ÑĞ¼Ğ¾Ñ— Ğ¼Ğ¾Ğ²Ğ¸!\n\n> âœ… **Ğ¡Ğ°Ğ¼Ğ¾Ğ¿ĞµÑ€ĞµĞ²Ñ–Ñ€ĞºĞ°**\n>\n> Ğ§Ğ¸ Ğ¼Ğ¾Ğ¶ĞµÑ‚Ğµ Ğ²Ğ¸:\n> - [ ] ĞŸĞµÑ€ĞµÑ‚Ğ²Ğ¾Ñ€Ğ¸Ñ‚Ğ¸ Ğ¿Ñ€ÑĞ¼Ñƒ Ğ¼Ğ¾Ğ²Ñƒ Ğ½Ğ° Ğ½ĞµĞ¿Ñ€ÑĞ¼Ñƒ?\n> - [ ] ĞŸÑ€Ğ°Ğ²Ğ¸Ğ»ÑŒĞ½Ğ¾ Ğ·Ğ¼Ñ–Ğ½Ğ¸Ñ‚Ğ¸ Ğ·Ğ°Ğ¹Ğ¼ĞµĞ½Ğ½Ğ¸ĞºĞ¸?\n> - [ ] Ğ’Ğ¸Ğ·Ğ½Ğ°Ñ‡Ğ¸Ñ‚Ğ¸, Ñ‡Ğ¸ Ğ¿Ğ¾Ñ‚Ñ€Ñ–Ğ±ĞµĞ½ Ğ·ÑÑƒĞ² Ñ‡Ğ°ÑÑƒ?\n> - [ ] Ğ’Ğ¸ĞºĞ¾Ñ€Ğ¸ÑÑ‚Ğ°Ñ‚Ğ¸ Ñ€Ñ–Ğ·Ğ½Ñ– Ğ´Ñ–Ñ”ÑĞ»Ğ¾Ğ²Ğ° Ğ²Ğ²ĞµĞ´ĞµĞ½Ğ½Ñ?\n>\n> Ğ¯ĞºÑ‰Ğ¾ Ñ‚Ğ°Ğº â€” Ğ¿ĞµÑ€ĞµÑ…Ğ¾Ğ´ÑŒÑ‚Ğµ Ğ´Ğ¾ Ğ²Ğ¿Ñ€Ğ°Ğ²!\n\n---\n\n> [!resources] ğŸ§ Ğ—Ğ¾Ğ²Ğ½Ñ–ÑˆĞ½Ñ– Ñ€ĞµÑÑƒÑ€ÑĞ¸\n>\n> **Ğ”Ğ¾Ğ´Ğ°Ñ‚ĞºĞ¾Ğ²Ñ– Ğ¼Ğ°Ñ‚ĞµÑ€Ñ–Ğ°Ğ»Ğ¸ Ğ´Ğ»Ñ Ğ²Ğ¸Ğ²Ñ‡ĞµĞ½Ğ½Ñ:**\n> - ğŸ“– [ĞĞµĞ¿Ñ€ÑĞ¼Ğ° Ğ¼Ğ¾Ğ²Ğ°](https://uk.wikipedia.org/wiki/ĞĞµĞ¿Ñ€ÑĞ¼Ğ°_Ğ¼Ğ¾Ğ²Ğ°) â€” Ğ’Ñ–ĞºÑ–Ğ¿ĞµĞ´Ñ–Ñ\n> - ğŸ“º [Ukrainian Grammar](https://www.youtube.com/@ukrainianlesson) â€” Ğ²Ñ–Ğ´ĞµĞ¾ÑƒÑ€Ğ¾ĞºĞ¸\n> - ğŸ§ [Ukrainian Lessons Podcast](https://ukrainianlessons.com/) â€” Ğ¿Ğ¾Ğ´ĞºĞ°ÑÑ‚ Ğ´Ğ»Ñ Ğ²Ğ¸Ğ²Ñ‡ĞµĞ½Ğ½Ñ\n\n---\n\n# Ğ’Ğ¿Ñ€Ğ°Ğ²Ğ¸\n\n## quiz: Ğ’Ğ¸Ğ±ĞµÑ€Ñ–Ñ‚ÑŒ Ğ¿Ñ€Ğ°Ğ²Ğ¸Ğ»ÑŒĞ½Ñƒ Ğ²Ñ–Ğ´Ğ¿Ğ¾Ğ²Ñ–Ğ´ÑŒ\n\n1. Ğ¯ĞºĞ° Ğ¾ÑĞ½Ğ¾Ğ²Ğ½Ğ° Ñ„ÑƒĞ½ĞºÑ†Ñ–Ñ ÑĞ¿Ğ¾Ğ»ÑƒÑ‡Ğ½Ğ¸ĞºĞ° Â«Ñ‰Ğ¾Â» Ñƒ Ğ½ĞµĞ¿Ñ€ÑĞ¼Ñ–Ğ¹ Ğ¼Ğ¾Ğ²Ñ– Ğ² ÑƒĞºÑ€Ğ°Ñ—Ğ½ÑÑŒĞºĞ¸Ñ… ÑĞºĞ»Ğ°Ğ´Ğ½Ğ¸Ñ… Ñ€ĞµÑ‡ĞµĞ½Ğ½ÑÑ…?\n   - [ ] Ğ’Ğ²Ğ¾Ğ´Ğ¸Ñ‚ÑŒ Ğ¿Ñ€ÑĞ¼Ñƒ Ñ†Ğ¸Ñ‚Ğ°Ñ‚Ñƒ Ğ· Ğ»Ğ°Ğ¿ĞºĞ°Ğ¼Ğ¸\n   - [x] Ğ—'Ñ”Ğ´Ğ½ÑƒÑ” Ğ³Ğ¾Ğ»Ğ¾Ğ²Ğ½Ğµ Ñ€ĞµÑ‡ĞµĞ½Ğ½Ñ Ğ· Ğ¿Ñ–Ğ´Ñ€ÑĞ´Ğ½Ğ¸Ğ¼\n   - [ ] Ğ—Ğ°Ğ¼Ñ–Ğ½ÑÑ” Ğ´Ñ–Ñ”ÑĞ»Ğ¾Ğ²Ğ¾ Ğ¼Ğ¾Ğ²Ğ»ĞµĞ½Ğ½Ñ\n   - [ ] Ğ’ĞºĞ°Ğ·ÑƒÑ” Ğ½Ğ° Ñ‡Ğ°Ñ Ğ´Ñ–Ñ— Ğ² Ñ€ĞµÑ‡ĞµĞ½Ğ½Ñ–\n   > Â«Ğ©Ğ¾Â» â€” ÑĞ¿Ğ¾Ğ»ÑƒÑ‡Ğ½Ğ¸Ğº, Ñ‰Ğ¾ Ğ·'Ñ”Ğ´Ğ½ÑƒÑ” Ñ‡Ğ°ÑÑ‚Ğ¸Ğ½Ğ¸ Ğ² Ğ½ĞµĞ¿Ñ€ÑĞ¼Ñ–Ğ¹ Ğ¼Ğ¾Ğ²Ñ–.\n\n2. Ğ¯Ğº Ğ¿Ñ€Ğ°Ğ²Ğ¸Ğ»ÑŒĞ½Ğ¾ Ğ¿ĞµÑ€ĞµÑ‚Ğ²Ğ¾Ñ€Ğ¸Ñ‚Ğ¸ Ğ¿Ñ€ÑĞ¼Ñƒ Ğ¼Ğ¾Ğ²Ñƒ Â«Ğ¯ Ğ¿Ñ€Ğ¸Ğ¹Ğ´Ñƒ Ğ·Ğ°Ğ²Ñ‚Ñ€Ğ°Â» Ğ½Ğ° Ğ½ĞµĞ¿Ñ€ÑĞ¼Ñƒ, ÑĞºÑ‰Ğ¾ ÑÑƒĞ±'Ñ”ĞºÑ‚ â€” Ğ²Ñ–Ğ½?\n   - [x] Ğ’Ñ–Ğ½ ÑĞºĞ°Ğ·Ğ°Ğ², Ñ‰Ğ¾ Ğ²Ñ–Ğ½ Ğ¿Ñ€Ğ¸Ğ¹Ğ´Ğµ Ğ·Ğ°Ğ²Ñ‚Ñ€Ğ°.\n   - [ ] Ğ’Ñ–Ğ½ ÑĞºĞ°Ğ·Ğ°Ğ², Ñ‰Ğ¾ Ñ Ğ¿Ñ€Ğ¸Ğ¹Ğ´Ñƒ Ğ·Ğ°Ğ²Ñ‚Ñ€Ğ°.\n   - [ ] Ğ’Ñ–Ğ½ ÑĞºĞ°Ğ·Ğ°Ğ²: Â«Ğ¯ Ğ¿Ñ€Ğ¸Ğ¹Ğ´Ñƒ Ğ·Ğ°Ğ²Ñ‚Ñ€Ğ°.Â»\n   - [ ] Ğ’Ñ–Ğ½ ÑĞºĞ°Ğ·Ğ°Ğ², Ñ‰Ğ¾ Ğ²Ñ–Ğ½ Ğ¿Ñ€Ğ¸Ğ¹Ğ´Ñƒ.\n   > Ğ—Ğ°Ğ¹Ğ¼ĞµĞ½Ğ½Ğ¸Ğº Â«ÑÂ» Ğ·Ğ¼Ñ–Ğ½ÑÑ”Ñ‚ÑŒÑÑ Ğ½Ğ° Â«Ğ²Ñ–Ğ½Â».\n\n3. ĞšĞ¾Ğ»Ğ¸ Ğ² ÑƒĞºÑ€Ğ°Ñ—Ğ½ÑÑŒĞºÑ–Ğ¹ Ğ½ĞµĞ¿Ñ€ÑĞ¼Ñ–Ğ¹ Ğ¼Ğ¾Ğ²Ñ– Ğ¾Ğ±Ğ¾Ğ²'ÑĞ·ĞºĞ¾Ğ²Ğ¾ Ğ¿Ğ¾Ñ‚Ñ€Ñ–Ğ±ĞµĞ½ Ğ·ÑÑƒĞ² Ñ‡Ğ°ÑÑƒ Ğ´Ñ–Ñ”ÑĞ»Ğ¾Ğ²Ğ° Ğ´Ğ¾ Ğ¼Ğ¸Ğ½ÑƒĞ»Ğ¾Ğ³Ğ¾?\n   - [ ] Ğ—Ğ°Ğ²Ğ¶Ğ´Ğ¸, ÑĞº Ğ² Ğ°Ğ½Ğ³Ğ»Ñ–Ğ¹ÑÑŒĞºÑ–Ğ¹ Ğ¼Ğ¾Ğ²Ñ–\n   - [x] ĞšĞ¾Ğ»Ğ¸ Ğ´Ñ–Ñ Ğ²Ğ¶Ğµ Ğ½ĞµĞ°ĞºÑ‚ÑƒĞ°Ğ»ÑŒĞ½Ğ° Ğ½Ğ° Ğ¼Ğ¾Ğ¼ĞµĞ½Ñ‚ Ğ¼Ğ¾Ğ²Ğ»ĞµĞ½Ğ½Ñ\n   - [ ] ĞÑ–ĞºĞ¾Ğ»Ğ¸, Ñ‡Ğ°Ñ Ğ½Ğµ Ğ·Ğ¼Ñ–Ğ½ÑÑ”Ñ‚ÑŒÑÑ\n   - [ ] Ğ¢Ñ–Ğ»ÑŒĞºĞ¸ Ğ· Ğ´Ñ–Ñ”ÑĞ»Ğ¾Ğ²Ğ¾Ğ¼ Â«Ğ±ÑƒÑ‚Ğ¸Â»\n   > Ğ—ÑÑƒĞ² Ğ¿Ğ¾Ñ‚Ñ€Ñ–Ğ±ĞµĞ½, ĞºĞ¾Ğ»Ğ¸ Ğ´Ñ–Ñ Ğ²Ğ¶Ğµ Ğ½Ğµ Ğ²Ñ–Ğ´Ğ±ÑƒĞ²Ğ°Ñ”Ñ‚ÑŒÑÑ.\n\n4. Ğ¯ĞºĞµ Ğ´Ñ–Ñ”ÑĞ»Ğ¾Ğ²Ğ¾ Ğ²Ğ²ĞµĞ´ĞµĞ½Ğ½Ñ Ğ²Ğ¸ĞºĞ¾Ñ€Ğ¸ÑÑ‚Ğ¾Ğ²ÑƒÑ”Ñ‚ÑŒÑÑ Ğ´Ğ»Ñ Ğ¾Ñ„Ñ–Ñ†Ñ–Ğ¹Ğ½Ğ¸Ñ… Ğ·Ğ°ÑĞ² Ñ– Ğ¿Ğ¾Ğ²Ñ–Ğ´Ğ¾Ğ¼Ğ»ĞµĞ½ÑŒ Ñƒ Ğ½ĞµĞ¿Ñ€ÑĞ¼Ñ–Ğ¹ Ğ¼Ğ¾Ğ²Ñ–?\n   - [ ] ÑĞºĞ°Ğ·Ğ°Ñ‚Ğ¸\n   - [x] Ğ·Ğ°ÑĞ²Ğ¸Ñ‚Ğ¸\n   - [ ] Ğ³Ğ¾Ğ²Ğ¾Ñ€Ğ¸Ñ‚Ğ¸\n   - [ ] Ğ·Ğ°ÑƒĞ²Ğ°Ğ¶Ğ¸Ñ‚Ğ¸\n   > Â«Ğ—Ğ°ÑĞ²Ğ¸Ñ‚Ğ¸Â» â€” Ğ¾Ñ„Ñ–Ñ†Ñ–Ğ¹Ğ½Ğµ, Ğ²Ğ¸ĞºĞ¾Ñ€Ğ¸ÑÑ‚Ğ¾Ğ²ÑƒÑ”Ñ‚ÑŒÑÑ Ğ´Ğ»Ñ Ğ·Ğ°ÑĞ².\n\n5. Ğ¯Ğº Ğ·Ğ¼Ñ–Ğ½ÑÑ”Ñ‚ÑŒÑÑ ÑĞ»Ğ¾Ğ²Ğ¾ Â«Ğ·Ğ°Ğ²Ñ‚Ñ€Ğ°Â» Ğ¿Ñ€Ğ¸ Ğ¿ĞµÑ€ĞµÑ…Ğ¾Ğ´Ñ– Ğ´Ğ¾ Ğ½ĞµĞ¿Ñ€ÑĞ¼Ğ¾Ñ— Ğ¼Ğ¾Ğ²Ğ¸, ÑĞºÑ‰Ğ¾ Ñ€Ğ¾Ğ·Ğ¿Ğ¾Ğ²Ñ–Ğ´ÑŒ Ğ²ĞµĞ´ĞµÑ‚ÑŒÑÑ Ğ² Ğ¼Ğ¸Ğ½ÑƒĞ»Ğ¾Ğ¼Ñƒ Ñ‡Ğ°ÑÑ–?\n   - [x] Ğ½Ğ°ÑÑ‚ÑƒĞ¿Ğ½Ğ¾Ğ³Ğ¾ Ğ´Ğ½Ñ\n   - [ ] Ğ·Ğ°Ğ²Ñ‚Ñ€Ğ° (Ğ½Ğµ Ğ·Ğ¼Ñ–Ğ½ÑÑ”Ñ‚ÑŒÑÑ)\n   - [ ] Ñ‚Ğ¾Ğ³Ğ¾ Ğ´Ğ½Ñ\n   - [ ] Ğ½Ğ°Ğ¿ĞµÑ€ĞµĞ´Ğ¾Ğ´Ğ½Ñ–\n   > Â«Ğ—Ğ°Ğ²Ñ‚Ñ€Ğ°Â» â†’ Â«Ğ½Ğ°ÑÑ‚ÑƒĞ¿Ğ½Ğ¾Ğ³Ğ¾ Ğ´Ğ½ÑÂ» Ğ² Ğ¼Ğ¸Ğ½ÑƒĞ»Ğ¾Ğ¼Ñƒ ĞºĞ¾Ğ½Ñ‚ĞµĞºÑÑ‚Ñ–.\n\n6. Ğ¯ĞºĞ° Ñ€Ñ–Ğ·Ğ½Ğ¸Ñ†Ñ Ğ¼Ñ–Ğ¶ Ğ´Ñ–Ñ”ÑĞ»Ğ¾Ğ²Ğ°Ğ¼Ğ¸ Â«ÑÑ‚Ğ²ĞµÑ€Ğ´Ğ¶ÑƒĞ²Ğ°Ñ‚Ğ¸Â» Ñ‚Ğ° Â«ÑĞºĞ°Ğ·Ğ°Ñ‚Ğ¸Â» Ñƒ Ğ²Ğ²ĞµĞ´ĞµĞ½Ğ½Ñ– Ğ½ĞµĞ¿Ñ€ÑĞ¼Ğ¾Ñ— Ğ¼Ğ¾Ğ²Ğ¸ Ğ² ÑƒĞºÑ€Ğ°Ñ—Ğ½ÑÑŒĞºÑ–Ğ¹?\n   - [ ] ĞĞµĞ¼Ğ°Ñ” Ñ€Ñ–Ğ·Ğ½Ğ¸Ñ†Ñ–, Ğ²Ğ¾Ğ½Ğ¸ ÑĞ¸Ğ½Ğ¾Ğ½Ñ–Ğ¼Ğ¸\n   - [x] Â«Ğ¡Ñ‚Ğ²ĞµÑ€Ğ´Ğ¶ÑƒĞ²Ğ°Ñ‚Ğ¸Â» Ğ¼Ğ¾Ğ¶Ğµ Ğ¾Ğ·Ğ½Ğ°Ñ‡Ğ°Ñ‚Ğ¸ ÑÑƒĞ¼Ğ½Ñ–Ğ² Ñƒ Ğ¿Ñ€Ğ°Ğ²Ğ´Ğ¸Ğ²Ğ¾ÑÑ‚Ñ–\n   - [ ] Â«Ğ¡Ñ‚Ğ²ĞµÑ€Ğ´Ğ¶ÑƒĞ²Ğ°Ñ‚Ğ¸Â» â€” Ğ½ĞµÑ„Ğ¾Ñ€Ğ¼Ğ°Ğ»ÑŒĞ½Ğµ\n   - [ ] Â«Ğ¡ĞºĞ°Ğ·Ğ°Ñ‚Ğ¸Â» â€” Ñ‚Ñ–Ğ»ÑŒĞºĞ¸ Ğ´Ğ»Ñ Ğ¾Ñ„Ñ–Ñ†Ñ–Ğ¹Ğ½Ğ¸Ñ… ĞºĞ¾Ğ½Ñ‚ĞµĞºÑÑ‚Ñ–Ğ²\n   > Â«Ğ¡Ñ‚Ğ²ĞµÑ€Ğ´Ğ¶ÑƒÑ”Â» Ğ¼Ğ¾Ğ¶Ğµ Ğ²Ğ¸Ñ€Ğ°Ğ¶Ğ°Ñ‚Ğ¸ Ğ´Ğ¸ÑÑ‚Ğ°Ğ½Ñ†Ñ–Ñ Ğ²Ñ–Ğ´ Ñ–Ğ½Ñ„Ğ¾Ñ€Ğ¼Ğ°Ñ†Ñ–Ñ—.\n\n7. Ğ¯Ğº Ğ¿Ñ€Ğ°Ğ²Ğ¸Ğ»ÑŒĞ½Ğ¾ Ğ¿ĞµÑ€ĞµĞ´Ğ°Ñ‚Ğ¸ Ğ½ĞµĞ¿Ñ€ÑĞ¼Ñƒ Ğ¼Ğ¾Ğ²Ñƒ Ğ· Ğ¼Ğ¾Ğ´Ğ°Ğ»ÑŒĞ½Ğ¸Ğ¼ Ğ´Ñ–Ñ”ÑĞ»Ğ¾Ğ²Ğ¾Ğ¼: Â«Ğ¯ Ğ¼Ğ¾Ğ¶Ñƒ Ğ´Ğ¾Ğ¿Ğ¾Ğ¼Ğ¾Ğ³Ñ‚Ğ¸ Ñ‚Ğ¾Ğ±Ñ– Ğ· Ñ†Ğ¸Ğ¼Â»?\n   - [x] Ğ’Ñ–Ğ½ ÑĞºĞ°Ğ·Ğ°Ğ², Ñ‰Ğ¾ Ğ¼Ğ¾Ğ¶Ğµ Ğ´Ğ¾Ğ¿Ğ¾Ğ¼Ğ¾Ğ³Ñ‚Ğ¸ Ğ¼ĞµĞ½Ñ– Ğ· Ñ†Ğ¸Ğ¼.\n   - [ ] Ğ’Ñ–Ğ½ ÑĞºĞ°Ğ·Ğ°Ğ², Ñ‰Ğ¾ Ğ¼Ñ–Ğ³ Ğ´Ğ¾Ğ¿Ğ¾Ğ¼Ğ¾Ğ³Ñ‚Ğ¸.\n   - [ ] Ğ’Ñ–Ğ½ ÑĞºĞ°Ğ·Ğ°Ğ²: Â«Ğ¯ Ğ¼Ğ¾Ğ¶Ñƒ Ğ´Ğ¾Ğ¿Ğ¾Ğ¼Ğ¾Ğ³Ñ‚Ğ¸.Â»\n   - [ ] Ğ’Ñ–Ğ½ ÑĞºĞ°Ğ·Ğ°Ğ², Ñ‰Ğ¾ Ñ Ğ¼Ğ¾Ğ¶Ñƒ Ğ´Ğ¾Ğ¿Ğ¾Ğ¼Ğ¾Ğ³Ñ‚Ğ¸.\n   > ĞœĞ¾Ğ´Ğ°Ğ»ÑŒĞ½Ñ– Ğ´Ñ–Ñ”ÑĞ»Ğ¾Ğ²Ğ° Ñ‡Ğ°ÑÑ‚Ğ¾ Ğ·Ğ±ĞµÑ€Ñ–Ğ³Ğ°ÑÑ‚ÑŒ Ñ„Ğ¾Ñ€Ğ¼Ñƒ.\n\n8. Ğ£ ÑĞºĞ¾Ğ¼Ñƒ Ğ¿Ğ¾Ñ€ÑĞ´ĞºÑƒ ÑĞ»Ñ–Ğ´ Ğ·Ğ´Ñ–Ğ¹ÑĞ½ÑĞ²Ğ°Ñ‚Ğ¸ Ğ¿ĞµÑ€ĞµĞµÑ‚Ğ²Ğ¾Ñ€ĞµĞ½Ğ½Ñ Ğ¿Ñ€ÑĞ¼Ğ¾Ñ— Ğ¼Ğ¾Ğ²Ğ¸ Ğ½Ğ° Ğ½ĞµĞ¿Ñ€ÑĞ¼Ñƒ Ğ² ÑƒĞºÑ€Ğ°Ñ—Ğ½ÑÑŒĞºÑ–Ğ¹ Ğ¼Ğ¾Ğ²Ñ–?\n   - [x] Ğ”Ñ–Ñ”ÑĞ»Ğ¾Ğ²Ğ¾ Ğ²Ğ²ĞµĞ´ĞµĞ½Ğ½Ñ â†’ Ñ‰Ğ¾ â†’ Ğ·Ğ¼Ñ–Ğ½Ğ° Ğ·Ğ°Ğ¹Ğ¼ĞµĞ½Ğ½Ğ¸ĞºÑ–Ğ² â†’ Ğ·Ğ¼Ñ–Ğ½Ğ° Ñ‡Ğ°ÑÑƒ\n   - [ ] Ğ—Ğ¼Ñ–Ğ½Ğ° Ñ‡Ğ°ÑÑƒ â†’ Ğ·Ğ¼Ñ–Ğ½Ğ° Ğ·Ğ°Ğ¹Ğ¼ĞµĞ½Ğ½Ğ¸ĞºÑ–Ğ² â†’ Ñ‰Ğ¾ â†’ Ğ´Ñ–Ñ”ÑĞ»Ğ¾Ğ²Ğ¾\n   - [ ] Ğ—Ğ¼Ñ–Ğ½Ğ° Ğ·Ğ°Ğ¹Ğ¼ĞµĞ½Ğ½Ğ¸ĞºÑ–Ğ² â†’ Ğ´Ñ–Ñ”ÑĞ»Ğ¾Ğ²Ğ¾ â†’ Ñ‰Ğ¾ â†’ Ñ‡Ğ°Ñ\n   - [ ] ĞĞµĞ¼Ğ°Ñ” Ğ¿Ğ¾Ñ€ÑĞ´ĞºÑƒ, Ğ²ÑĞµ Ğ¾Ğ´Ğ½Ğ¾Ñ‡Ğ°ÑĞ½Ğ¾\n   > Ğ›Ğ¾Ğ³Ñ–Ñ‡Ğ½Ğ¸Ğ¹ Ğ¿Ğ¾Ñ€ÑĞ´Ğ¾Ğº: Ğ´Ñ–Ñ”ÑĞ»Ğ¾Ğ²Ğ¾, Ñ‰Ğ¾, Ğ·Ğ°Ğ¹Ğ¼ĞµĞ½Ğ½Ğ¸ĞºĞ¸, Ñ‡Ğ°Ñ.\n\n---\n\n## match-up: Ğ—'Ñ”Ğ´Ğ½Ğ°Ğ¹Ñ‚Ğµ Ğ´Ñ–Ñ”ÑĞ»Ğ¾Ğ²Ğ¾ Ğ²Ğ²ĞµĞ´ĞµĞ½Ğ½Ñ Ğ· Ğ¹Ğ¾Ğ³Ğ¾ Ğ·Ğ½Ğ°Ñ‡ĞµĞ½Ğ½ÑĞ¼\n\n- ÑĞºĞ°Ğ·Ğ°Ñ‚Ğ¸ :: Ğ·Ğ°Ğ³Ğ°Ğ»ÑŒĞ½Ğµ Ğ½ĞµĞ¹Ñ‚Ñ€Ğ°Ğ»ÑŒĞ½Ğµ Ğ¿Ğ¾Ğ²Ñ–Ğ´Ğ¾Ğ¼Ğ»ĞµĞ½Ğ½Ñ\n- Ğ³Ğ¾Ğ²Ğ¾Ñ€Ğ¸Ñ‚Ğ¸ :: Ñ‚Ñ€Ğ¸Ğ²Ğ°Ğ»Ğ° Ñ€Ğ¾Ğ·Ğ¼Ğ¾Ğ²Ğ° Ğ°Ğ±Ğ¾ Ğ¾Ğ±Ğ³Ğ¾Ğ²Ğ¾Ñ€ĞµĞ½Ğ½Ñ\n- Ğ¿Ğ¾Ğ²Ñ–Ğ´Ğ¾Ğ¼Ğ¸Ñ‚Ğ¸ :: Ğ¾Ñ„Ñ–Ñ†Ñ–Ğ¹Ğ½Ğ° Ğ¿ĞµÑ€ĞµĞ´Ğ°Ñ‡Ğ° Ñ–Ğ½Ñ„Ğ¾Ñ€Ğ¼Ğ°Ñ†Ñ–Ñ—\n- Ğ·Ğ°ÑĞ²Ğ¸Ñ‚Ğ¸ :: Ğ¾Ñ„Ñ–Ñ†Ñ–Ğ¹Ğ½Ğ° Ğ¿ÑƒĞ±Ğ»Ñ–Ñ‡Ğ½Ğ° Ğ·Ğ°ÑĞ²Ğ°\n- Ğ¿Ğ¾ÑÑĞ½Ğ¸Ñ‚Ğ¸ :: Ñ€Ğ¾Ğ·'ÑÑĞ½ĞµĞ½Ğ½Ñ ÑĞºĞ»Ğ°Ğ´Ğ½Ğ¾Ğ³Ğ¾ Ğ¿Ğ¸Ñ‚Ğ°Ğ½Ğ½Ñ\n- Ğ´Ğ¾Ğ´Ğ°Ñ‚Ğ¸ :: Ğ´Ğ¾Ğ´Ğ°Ñ‚ĞºĞ¾Ğ²Ğ° Ñ–Ğ½Ñ„Ğ¾Ñ€Ğ¼Ğ°Ñ†Ñ–Ñ Ğ´Ğ¾ ÑĞºĞ°Ğ·Ğ°Ğ½Ğ¾Ğ³Ğ¾\n- Ğ·Ğ°ÑƒĞ²Ğ°Ğ¶Ğ¸Ñ‚Ğ¸ :: ĞºĞ¾Ñ€Ğ¾Ñ‚ĞºĞ¸Ğ¹ ĞºĞ¾Ğ¼ĞµĞ½Ñ‚Ğ°Ñ€\n- ÑÑ‚Ğ²ĞµÑ€Ğ´Ğ¶ÑƒĞ²Ğ°Ñ‚Ğ¸ :: Ğ½Ğ°Ğ¿Ğ¾Ğ»ÑĞ³Ğ°Ğ½Ğ½Ñ Ğ½Ğ° Ğ¿Ñ€Ğ°Ğ²Ğ´Ğ¸Ğ²Ğ¾ÑÑ‚Ñ–\n- Ğ²Ğ¸Ğ·Ğ½Ğ°Ñ‚Ğ¸ :: Ğ²Ğ¸Ğ·Ğ½Ğ°Ğ½Ğ½Ñ Ñ„Ğ°ĞºÑ‚Ñƒ Ğ°Ğ±Ğ¾ Ğ¿Ğ¾Ğ¼Ğ¸Ğ»ĞºĞ¸\n- Ğ·Ğ°Ğ¿ĞµÑ€ĞµÑ‡Ğ¸Ñ‚Ğ¸ :: Ğ²Ñ–Ğ´Ğ¼Ğ¾Ğ²Ğ° Ğ°Ğ±Ğ¾ Ğ·Ğ°Ğ¿ĞµÑ€ĞµÑ‡ĞµĞ½Ğ½Ñ Ñ„Ğ°ĞºÑ‚Ñƒ\n- Ğ¿Ñ–Ğ´Ñ‚Ğ²ĞµÑ€Ğ´Ğ¸Ñ‚Ğ¸ :: Ğ¿Ñ–Ğ´Ñ‚Ğ²ĞµÑ€Ğ´Ğ¶ĞµĞ½Ğ½Ñ Ñ–Ğ½Ñ„Ğ¾Ñ€Ğ¼Ğ°Ñ†Ñ–Ñ—\n- Ğ½Ğ°Ñ‚ÑĞºĞ½ÑƒÑ‚Ğ¸ :: Ğ½ĞµĞ¿Ñ€ÑĞ¼Ğ° Ğ²ĞºĞ°Ğ·Ñ–Ğ²ĞºĞ° Ğ½Ğ° Ñ‰Ğ¾ÑÑŒ\n\n---\n\n## fill-in: Ğ”Ğ¾Ğ¿Ğ¾Ğ²Ğ½Ñ–Ñ‚ÑŒ Ñ€ĞµÑ‡ĞµĞ½Ğ½Ñ Ğ¿Ñ€Ğ°Ğ²Ğ¸Ğ»ÑŒĞ½Ğ¸Ğ¼ ÑĞ¿Ğ¾Ğ»ÑƒÑ‡Ğ½Ğ¸ĞºĞ¾Ğ¼ Ğ°Ğ±Ğ¾ Ğ·Ğ°Ğ¹Ğ¼ĞµĞ½Ğ½Ğ¸ĞºĞ¾Ğ¼\n\n1. Ğ’Ñ–Ğ½ ÑĞºĞ°Ğ·Ğ°Ğ², ___ Ğ²Ñ–Ğ½ Ğ¿Ñ€Ğ¸Ğ¹Ğ´Ğµ Ğ·Ğ°Ğ²Ñ‚Ñ€Ğ° Ğ½Ğ° Ğ·ÑƒÑÑ‚Ñ€Ñ–Ñ‡.\n   > [!answer] Ñ‰Ğ¾\n   > [!options] Ñ‰Ğ¾ | ÑĞºĞ¸Ğ¹ | ĞºĞ¾Ğ»Ğ¸ | Ñ‚Ğ¾Ğ¼Ñƒ Ñ‰Ğ¾\n\n2. Ğ’Ğ¾Ğ½Ğ° ÑĞºĞ°Ğ·Ğ°Ğ»Ğ°, Ñ‰Ğ¾ ___ Ğ»ÑĞ±Ğ¸Ñ‚ÑŒ Ñ†Ñ ĞºĞ½Ğ¸Ğ³Ñƒ.\n   > [!answer] Ğ²Ğ¾Ğ½Ğ°\n   > [!options] Ğ²Ğ¾Ğ½Ğ° | Ñ | Ñ‚Ğ¸ | Ğ²Ñ–Ğ½\n\n3. ĞœĞ°Ñ€Ñ–Ñ Ğ¿Ğ¾ÑÑĞ½Ğ¸Ğ»Ğ°, ___ Ğ²Ğ¾Ğ½Ğ° Ğ·Ğ°Ğ¿Ñ–Ğ·Ğ½ÑÑ”Ñ‚ÑŒÑÑ Ñ‡ĞµÑ€ĞµĞ· Ğ·Ğ°Ñ‚Ğ¾Ñ€.\n   > [!answer] Ñ‰Ğ¾\n   > [!options] Ñ‰Ğ¾ | Ñ‚Ğ¾Ğ¼Ñƒ Ñ‰Ğ¾ | Ñ‡Ğ¾Ğ¼Ñƒ | Ğ±Ğ¾\n\n4. ĞŸĞµÑ‚Ñ€Ğ¾ ÑĞºĞ°Ğ·Ğ°Ğ², Ñ‰Ğ¾ Ğ¿Ñ€Ğ¸Ñ—Ğ´Ğµ ___ Ğ´Ğ½Ñ Ğ½Ğ° Ğ½Ğ°ÑˆÑƒ Ğ²ĞµÑ‡Ñ–Ñ€ĞºÑƒ.\n   > [!answer] Ğ½Ğ°ÑÑ‚ÑƒĞ¿Ğ½Ğ¾Ğ³Ğ¾\n   > [!options] Ğ½Ğ°ÑÑ‚ÑƒĞ¿Ğ½Ğ¾Ğ³Ğ¾ | Ğ·Ğ°Ğ²Ñ‚Ñ€Ğ° | ÑÑŒĞ¾Ğ³Ğ¾Ğ´Ğ½Ñ– | Ñ‚Ğ¾Ğ³Ğ¾\n\n5. Ğ’Ğ¾Ğ½Ğ° Ğ´Ğ¾Ğ´Ğ°Ğ»Ğ°, Ñ‰Ğ¾ Ğ±ÑƒĞ´Ğµ Ñ‡ĞµĞºĞ°Ñ‚Ğ¸ Ğ½Ğ° Ğ½Ğ°Ñ ___.\n   > [!answer] Ñ‚Ğ°Ğ¼\n   > [!options] Ñ‚Ğ°Ğ¼ | Ñ‚ÑƒÑ‚ | Ğ·Ğ°Ñ€Ğ°Ğ· | Ğ·Ğ°Ğ²Ñ‚Ñ€Ğ°\n\n6. Ğ¨ĞµÑ„ ___, Ñ‰Ğ¾ Ğ¿Ñ€Ğ¾ĞµĞºÑ‚ Ğ¼Ğ°Ñ” Ğ±ÑƒÑ‚Ğ¸ Ğ·Ğ°Ğ²ĞµÑ€ÑˆĞµĞ½Ğ¸Ğ¹.\n   > [!answer] Ğ·Ğ°ÑĞ²Ğ¸Ğ²\n   > [!options] Ğ·Ğ°ÑĞ²Ğ¸Ğ² | Ğ³Ğ¾Ğ²Ğ¾Ñ€Ğ¸Ğ² | ĞºĞ°Ğ¶Ğµ | ÑĞºĞ°Ğ·Ğ°Ñ‚Ğ¸\n\n7. Ğ’Ñ–Ğ½ Ğ·Ğ°ÑƒĞ²Ğ°Ğ¶Ğ¸Ğ², ___ Ğ¿Ğ¾Ğ³Ğ¾Ğ´Ğ° ÑÑŒĞ¾Ğ³Ğ¾Ğ´Ğ½Ñ– Ğ³Ğ°Ñ€Ğ½Ğ°.\n   > [!answer] Ñ‰Ğ¾\n   > [!options] Ñ‰Ğ¾ | ÑĞºĞ° | Ñ‚Ğ¾Ğ¼Ñƒ Ñ‰Ğ¾ | Ğ±Ğ¾\n\n8. Ğ’Ğ¾Ğ½Ğ° ÑĞºĞ°Ğ·Ğ°Ğ»Ğ°, Ñ‰Ğ¾ ___ ĞºĞ½Ğ¸Ğ³Ğ° Ñ†Ñ–ĞºĞ°Ğ²Ğ°.\n   > [!answer] Ñ†Ñ\n   > [!options] Ñ†Ñ | Ñ‚Ğ° | ÑĞºĞ° | ĞºĞ¾Ñ‚Ñ€Ğ°\n\n---\n\n## true-false: ĞŸÑ€Ğ°Ğ²Ğ´Ğ° Ñ‡Ğ¸ Ğ½ĞµĞ¿Ñ€Ğ°Ğ²Ğ´Ğ°?\n\n1. Ğ’ ÑƒĞºÑ€Ğ°Ñ—Ğ½ÑÑŒĞºÑ–Ğ¹ Ğ½ĞµĞ¿Ñ€ÑĞ¼Ñ–Ğ¹ Ğ¼Ğ¾Ğ²Ñ– ÑĞ¿Ğ¾Ğ»ÑƒÑ‡Ğ½Ğ¸Ğº Â«Ñ‰Ğ¾Â» Ğ¾Ğ±Ğ¾Ğ²'ÑĞ·ĞºĞ¾Ğ²Ğ¸Ğ¹ Ñƒ Ğ¿Ğ¸ÑÑŒĞ¼Ğ¾Ğ²Ğ¸Ñ… Ñ‚ĞµĞºÑÑ‚Ğ°Ñ….\n   - [x] ĞŸÑ€Ğ°Ğ²Ğ´Ğ°\n   - [ ] ĞĞµĞ¿Ñ€Ğ°Ğ²Ğ´Ğ°\n\n2. Ğ—ÑÑƒĞ² Ñ‡Ğ°ÑÑ–Ğ² Ñƒ Ğ½ĞµĞ¿Ñ€ÑĞ¼Ñ–Ğ¹ Ğ¼Ğ¾Ğ²Ñ– Ğ·Ğ°Ğ²Ğ¶Ğ´Ğ¸ Ğ¾Ğ±Ğ¾Ğ²'ÑĞ·ĞºĞ¾Ğ²Ğ¸Ğ¹, ÑĞº Ğ² Ğ°Ğ½Ğ³Ğ»Ñ–Ğ¹ÑÑŒĞºÑ–Ğ¹.\n   - [ ] ĞŸÑ€Ğ°Ğ²Ğ´Ğ°\n   - [x] ĞĞµĞ¿Ñ€Ğ°Ğ²Ğ´Ğ°\n\n3. ĞŸÑ€Ğ¸ Ğ¿ĞµÑ€ĞµÑ…Ğ¾Ğ´Ñ– Ğ´Ğ¾ Ğ½ĞµĞ¿Ñ€ÑĞ¼Ğ¾Ñ— Ğ¼Ğ¾Ğ²Ğ¸ Ğ·Ğ°Ğ¹Ğ¼ĞµĞ½Ğ½Ğ¸Ğº Â«ÑÂ» Ğ·Ğ°Ğ²Ğ¶Ğ´Ğ¸ Ğ·Ğ¼Ñ–Ğ½ÑÑ”Ñ‚ÑŒÑÑ.\n   - [x] ĞŸÑ€Ğ°Ğ²Ğ´Ğ°\n   - [ ] ĞĞµĞ¿Ñ€Ğ°Ğ²Ğ´Ğ°\n\n4. Ğ¡Ğ»Ğ¾Ğ²Ğ¾ Â«Ğ·Ğ°Ğ²Ñ‚Ñ€Ğ°Â» Ğ² Ğ½ĞµĞ¿Ñ€ÑĞ¼Ñ–Ğ¹ Ğ¼Ğ¾Ğ²Ñ– Ğ² Ğ¼Ğ¸Ğ½ÑƒĞ»Ğ¾Ğ¼Ñƒ ÑÑ‚Ğ°Ñ” Â«Ğ½Ğ°ÑÑ‚ÑƒĞ¿Ğ½Ğ¾Ğ³Ğ¾ Ğ´Ğ½ÑÂ».\n   - [x] ĞŸÑ€Ğ°Ğ²Ğ´Ğ°\n   - [ ] ĞĞµĞ¿Ñ€Ğ°Ğ²Ğ´Ğ°\n\n5. Ğ”Ñ–Ñ”ÑĞ»Ğ¾Ğ²Ğ° Â«ÑĞºĞ°Ğ·Ğ°Ñ‚Ğ¸Â» Ñ– Â«Ğ·Ğ°ÑĞ²Ğ¸Ñ‚Ğ¸Â» Ğ¼Ğ°ÑÑ‚ÑŒ Ğ¾Ğ´Ğ½Ğ°ĞºĞ¾Ğ²Ğµ Ğ·Ğ½Ğ°Ñ‡ĞµĞ½Ğ½Ñ.\n   - [ ] ĞŸÑ€Ğ°Ğ²Ğ´Ğ°\n   - [x] ĞĞµĞ¿Ñ€Ğ°Ğ²Ğ´Ğ°\n\n6. Ğ£ Ñ€Ğ¾Ğ·Ğ¼Ğ¾Ğ²Ğ½Ğ¾Ğ¼Ñƒ ÑÑ‚Ğ¸Ğ»Ñ– ÑĞ¿Ğ¾Ğ»ÑƒÑ‡Ğ½Ğ¸Ğº Â«Ñ‰Ğ¾Â» Ğ¼Ğ¾Ğ¶Ğ½Ğ° Ğ¾Ğ¿ÑƒÑĞºĞ°Ñ‚Ğ¸.\n   - [x] ĞŸÑ€Ğ°Ğ²Ğ´Ğ°\n   - [ ] ĞĞµĞ¿Ñ€Ğ°Ğ²Ğ´Ğ°\n\n7. ĞœĞ¾Ğ´Ğ°Ğ»ÑŒĞ½Ñ– Ğ´Ñ–Ñ”ÑĞ»Ğ¾Ğ²Ğ° Ğ² Ğ½ĞµĞ¿Ñ€ÑĞ¼Ñ–Ğ¹ Ğ¼Ğ¾Ğ²Ñ– Ğ·Ğ°Ğ²Ğ¶Ğ´Ğ¸ Ğ·Ğ¼Ñ–Ğ½ÑÑÑ‚ÑŒ Ñ„Ğ¾Ñ€Ğ¼Ñƒ.\n   - [ ] ĞŸÑ€Ğ°Ğ²Ğ´Ğ°\n   - [x] ĞĞµĞ¿Ñ€Ğ°Ğ²Ğ´Ğ°\n\n8. Â«Ğ¡Ñ‚Ğ²ĞµÑ€Ğ´Ğ¶ÑƒĞ²Ğ°Ñ‚Ğ¸Â» Ğ¼Ğ¾Ğ¶Ğµ Ğ²Ğ¸Ñ€Ğ°Ğ¶Ğ°Ñ‚Ğ¸ ÑÑƒĞ¼Ğ½Ñ–Ğ² Ñƒ Ğ¿Ñ€Ğ°Ğ²Ğ´Ğ¸Ğ²Ğ¾ÑÑ‚Ñ– Ñ–Ğ½Ñ„Ğ¾Ñ€Ğ¼Ğ°Ñ†Ñ–Ñ—.\n   - [x] ĞŸÑ€Ğ°Ğ²Ğ´Ğ°\n   - [ ] ĞĞµĞ¿Ñ€Ğ°Ğ²Ğ´Ğ°\n\n---\n\n## group-sort: Ğ Ğ¾Ğ·Ğ¿Ğ¾Ğ´Ñ–Ğ»Ñ–Ñ‚ÑŒ Ğ´Ñ–Ñ”ÑĞ»Ğ¾Ğ²Ğ° Ğ·Ğ° ÑÑ‚ÑƒĞ¿ĞµĞ½ĞµĞ¼ Ñ„Ğ¾Ñ€Ğ¼Ğ°Ğ»ÑŒĞ½Ğ¾ÑÑ‚Ñ–\n\n### ĞĞµĞ¹Ñ‚Ñ€Ğ°Ğ»ÑŒĞ½Ñ– (Ñ€Ğ¾Ğ·Ğ¼Ğ¾Ğ²Ğ½Ñ–)\n- ÑĞºĞ°Ğ·Ğ°Ñ‚Ğ¸\n- Ğ³Ğ¾Ğ²Ğ¾Ñ€Ğ¸Ñ‚Ğ¸\n- Ğ´Ğ¾Ğ´Ğ°Ñ‚Ğ¸\n- Ğ·Ğ°ÑƒĞ²Ğ°Ğ¶Ğ¸Ñ‚Ğ¸\n\n### Ğ¤Ğ¾Ñ€Ğ¼Ğ°Ğ»ÑŒĞ½Ñ– (Ğ¾Ñ„Ñ–Ñ†Ñ–Ğ¹Ğ½Ñ–)\n- Ğ·Ğ°ÑĞ²Ğ¸Ñ‚Ğ¸\n- Ğ¿Ğ¾Ğ²Ñ–Ğ´Ğ¾Ğ¼Ğ¸Ñ‚Ğ¸\n- Ğ¿Ñ–Ğ´Ñ‚Ğ²ĞµÑ€Ğ´Ğ¸Ñ‚Ğ¸\n- ĞºĞ¾Ğ½ÑÑ‚Ğ°Ñ‚ÑƒĞ²Ğ°Ñ‚Ğ¸\n\n### Ğ•Ğ¼Ğ¾Ñ†Ñ–Ğ¹Ğ½Ğ¾ Ğ·Ğ°Ğ±Ğ°Ñ€Ğ²Ğ»ĞµĞ½Ñ–\n- ÑÑ‚Ğ²ĞµÑ€Ğ´Ğ¶ÑƒĞ²Ğ°Ñ‚Ğ¸\n- Ğ·Ğ°Ğ¿ĞµÑ€ĞµÑ‡Ğ¸Ñ‚Ğ¸\n- Ğ²Ğ¸Ğ·Ğ½Ğ°Ñ‚Ğ¸\n- Ğ½Ğ°Ğ¿Ğ¾Ğ»ÑĞ³Ğ°Ñ‚Ğ¸\n- Ğ¿ĞµÑ€ĞµĞºĞ¾Ğ½ÑƒĞ²Ğ°Ñ‚Ğ¸\n- ÑĞºĞ°Ñ€Ğ¶Ğ¸Ñ‚Ğ¸ÑÑ\n\n---\n\n## unjumble: Ğ¡ĞºĞ»Ğ°Ğ´Ñ–Ñ‚ÑŒ Ñ€ĞµÑ‡ĞµĞ½Ğ½Ñ Ğ· Ñ€Ğ¾Ğ·ÑĞ¸Ğ¿Ğ°Ğ½Ğ¸Ñ… ÑĞ»Ñ–Ğ²\n\n1. Ğ²Ñ–Ğ½ / ÑĞºĞ°Ğ·Ğ°Ğ² / , / Ñ‰Ğ¾ / Ğ²Ğ¾Ğ½Ğ° / Ğ¿Ñ€Ğ¸Ğ¹Ğ´Ğµ / Ğ·Ğ°Ğ²Ñ‚Ñ€Ğ° / Ğ²Ğ²ĞµÑ‡ĞµÑ€Ñ– / Ğ½Ğ° / Ğ½Ğ°ÑˆÑƒ / ÑĞ²ÑÑ‚ĞºĞ¾Ğ²Ñƒ / Ğ²ĞµÑ‡ĞµÑ€Ñ\n   > [!answer] Ğ’Ñ–Ğ½ ÑĞºĞ°Ğ·Ğ°Ğ², Ñ‰Ğ¾ Ğ²Ğ¾Ğ½Ğ° Ğ¿Ñ€Ğ¸Ğ¹Ğ´Ğµ Ğ·Ğ°Ğ²Ñ‚Ñ€Ğ° Ğ²Ğ²ĞµÑ‡ĞµÑ€Ñ– Ğ½Ğ° Ğ½Ğ°ÑˆÑƒ ÑĞ²ÑÑ‚ĞºĞ¾Ğ²Ñƒ Ğ²ĞµÑ‡ĞµÑ€Ñ.\n\n2. Ğ²Ğ¾Ğ½Ğ° / Ğ¿Ğ¾ÑÑĞ½Ğ¸Ğ»Ğ° / , / Ñ‰Ğ¾ / Ğ¿Ğ¾Ñ‚Ñ€Ñ–Ğ±Ğ½Ğ¾ / Ğ±Ñ–Ğ»ÑŒÑˆĞµ / Ñ‡Ğ°ÑÑƒ / Ğ´Ğ»Ñ / Ğ·Ğ°Ğ²ĞµÑ€ÑˆĞµĞ½Ğ½Ñ / Ñ†ÑŒĞ¾Ğ³Ğ¾ / Ğ²Ğ°Ğ¶Ğ»Ğ¸Ğ²Ğ¾Ğ³Ğ¾ / Ğ¿Ñ€Ğ¾ĞµĞºÑ‚Ñƒ\n   > [!answer] Ğ’Ğ¾Ğ½Ğ° Ğ¿Ğ¾ÑÑĞ½Ğ¸Ğ»Ğ°, Ñ‰Ğ¾ Ğ¿Ğ¾Ñ‚Ñ€Ñ–Ğ±Ğ½Ğ¾ Ğ±Ñ–Ğ»ÑŒÑˆĞµ Ñ‡Ğ°ÑÑƒ Ğ´Ğ»Ñ Ğ·Ğ°Ğ²ĞµÑ€ÑˆĞµĞ½Ğ½Ñ Ñ†ÑŒĞ¾Ğ³Ğ¾ Ğ²Ğ°Ğ¶Ğ»Ğ¸Ğ²Ğ¾Ğ³Ğ¾ Ğ¿Ñ€Ğ¾ĞµĞºÑ‚Ñƒ.\n\n3. Ğ´Ğ¸Ñ€ĞµĞºÑ‚Ğ¾Ñ€ / Ğ·Ğ°ÑĞ²Ğ¸Ğ² / , / Ñ‰Ğ¾ / Ğ·Ğ±Ğ¾Ñ€Ğ¸ / Ğ¿ĞµÑ€ĞµĞ½ĞµÑĞµĞ½Ğ¾ / Ğ½Ğ° / Ğ½Ğ°ÑÑ‚ÑƒĞ¿Ğ½Ğ¸Ğ¹ / Ñ‚Ğ¸Ğ¶Ğ´ĞµĞ½ÑŒ / Ñ‡ĞµÑ€ĞµĞ· / Ğ¹Ğ¾Ğ³Ğ¾ / Ğ²Ñ–Ğ´Ñ€ÑĞ´Ğ¶ĞµĞ½Ğ½Ñ\n   > [!answer] Ğ”Ğ¸Ñ€ĞµĞºÑ‚Ğ¾Ñ€ Ğ·Ğ°ÑĞ²Ğ¸Ğ², Ñ‰Ğ¾ Ğ·Ğ±Ğ¾Ñ€Ğ¸ Ğ¿ĞµÑ€ĞµĞ½ĞµÑĞµĞ½Ğ¾ Ğ½Ğ° Ğ½Ğ°ÑÑ‚ÑƒĞ¿Ğ½Ğ¸Ğ¹ Ñ‚Ğ¸Ğ¶Ğ´ĞµĞ½ÑŒ Ñ‡ĞµÑ€ĞµĞ· Ğ¹Ğ¾Ğ³Ğ¾ Ğ²Ñ–Ğ´Ñ€ÑĞ´Ğ¶ĞµĞ½Ğ½Ñ.\n\n4. Ğ²Ñ–Ğ½ / Ğ´Ğ¾Ğ´Ğ°Ğ² / , / Ñ‰Ğ¾ / Ğ±ÑƒĞ´Ğµ / Ñ‡ĞµĞºĞ°Ñ‚Ğ¸ / Ğ½Ğ° / Ğ²Ñ–Ğ´Ğ¿Ğ¾Ğ²Ñ–Ğ´ÑŒ / Ğ´Ğ¾ / ĞºÑ–Ğ½Ñ†Ñ / Ñ€Ğ¾Ğ±Ğ¾Ñ‡Ğ¾Ğ³Ğ¾ / Ğ´Ğ½Ñ\n   > [!answer] Ğ’Ñ–Ğ½ Ğ´Ğ¾Ğ´Ğ°Ğ², Ñ‰Ğ¾ Ğ±ÑƒĞ´Ğµ Ñ‡ĞµĞºĞ°Ñ‚Ğ¸ Ğ½Ğ° Ğ²Ñ–Ğ´Ğ¿Ğ¾Ğ²Ñ–Ğ´ÑŒ Ğ´Ğ¾ ĞºÑ–Ğ½Ñ†Ñ Ñ€Ğ¾Ğ±Ğ¾Ñ‡Ğ¾Ğ³Ğ¾ Ğ´Ğ½Ñ.\n\n5. Ğ²Ğ¾Ğ½Ğ° / Ğ·Ğ°ÑƒĞ²Ğ°Ğ¶Ğ¸Ğ»Ğ° / , / Ñ‰Ğ¾ / Ğ¿Ğ¾Ğ³Ğ¾Ğ´Ğ° / ÑÑŒĞ¾Ğ³Ğ¾Ğ´Ğ½Ñ– / Ğ½Ğ°Ğ´Ğ·Ğ²Ğ¸Ñ‡Ğ°Ğ¹Ğ½Ğ¾ / Ğ³Ğ°Ñ€Ğ½Ğ° / Ğ´Ğ»Ñ / Ñ‚Ñ€Ğ¸Ğ²Ğ°Ğ»Ğ¾Ñ— / Ğ¿Ñ€Ğ¾Ğ³ÑƒĞ»ÑĞ½ĞºĞ¸ / Ğ¿Ğ°Ñ€ĞºĞ¾Ğ¼\n   > [!answer] Ğ’Ğ¾Ğ½Ğ° Ğ·Ğ°ÑƒĞ²Ğ°Ğ¶Ğ¸Ğ»Ğ°, Ñ‰Ğ¾ Ğ¿Ğ¾Ğ³Ğ¾Ğ´Ğ° ÑÑŒĞ¾Ğ³Ğ¾Ğ´Ğ½Ñ– Ğ½Ğ°Ğ´Ğ·Ğ²Ğ¸Ñ‡Ğ°Ğ¹Ğ½Ğ¾ Ğ³Ğ°Ñ€Ğ½Ğ° Ğ´Ğ»Ñ Ñ‚Ñ€Ğ¸Ğ²Ğ°Ğ»Ğ¾Ñ— Ğ¿Ñ€Ğ¾Ğ³ÑƒĞ»ÑĞ½ĞºĞ¸ Ğ¿Ğ°Ñ€ĞºĞ¾Ğ¼.\n\n6. ÑĞ²Ñ–Ğ´Ğ¾Ğº / ÑÑ‚Ğ²ĞµÑ€Ğ´Ğ¶ÑƒÑ” / , / Ñ‰Ğ¾ / Ğ²Ñ–Ğ½ / Ğ±Ğ°Ñ‡Ğ¸Ğ² / Ñ†Ñ / Ğ»ÑĞ´Ğ¸Ğ½Ñƒ / Ñ‚Ğ°Ğ¼ / Ñ‚Ğ¾Ğ³Ğ¾ / ÑĞ°Ğ¼Ğ¾Ğ³Ğ¾ / Ğ²ĞµÑ‡Ğ¾Ñ€Ğ°\n   > [!answer] Ğ¡Ğ²Ñ–Ğ´Ğ¾Ğº ÑÑ‚Ğ²ĞµÑ€Ğ´Ğ¶ÑƒÑ”, Ñ‰Ğ¾ Ğ²Ñ–Ğ½ Ğ±Ğ°Ñ‡Ğ¸Ğ² Ñ†Ñ Ğ»ÑĞ´Ğ¸Ğ½Ñƒ Ñ‚Ğ°Ğ¼ Ñ‚Ğ¾Ğ³Ğ¾ ÑĞ°Ğ¼Ğ¾Ğ³Ğ¾ Ğ²ĞµÑ‡Ğ¾Ñ€Ğ°.\n\n---\n\n## error-correction: Ğ—Ğ½Ğ°Ğ¹Ğ´Ñ–Ñ‚ÑŒ Ñ– Ğ²Ğ¸Ğ¿Ñ€Ğ°Ğ²Ñ‚Ğµ Ğ¿Ğ¾Ğ¼Ğ¸Ğ»ĞºÑƒ\n\n1. Ğ’Ñ–Ğ½ ÑĞºĞ°Ğ·Ğ°Ğ² Ğ²Ñ–Ğ½ Ğ¿Ñ€Ğ¸Ğ¹Ğ´Ğµ Ğ·Ğ°Ğ²Ñ‚Ñ€Ğ° Ğ½Ğ° Ğ½Ğ°ÑˆÑƒ Ğ·ÑƒÑÑ‚Ñ€Ñ–Ñ‡.\n   > [!error] ÑĞºĞ°Ğ·Ğ°Ğ² Ğ²Ñ–Ğ½\n   > [!answer] ÑĞºĞ°Ğ·Ğ°Ğ², Ñ‰Ğ¾ Ğ²Ñ–Ğ½\n   > [!options] ÑĞºĞ°Ğ·Ğ°Ğ², Ñ‰Ğ¾ Ğ²Ñ–Ğ½ | ÑĞºĞ°Ğ·Ğ°Ğ²: Ğ²Ñ–Ğ½ | ÑĞºĞ°Ğ·Ğ°Ğ² Ğ¹ Ğ²Ñ–Ğ½ | ÑĞºĞ°Ğ·Ğ°Ğ² Ñ– Ğ²Ñ–Ğ½\n   > [!explanation] ĞŸĞ¾Ñ‚Ñ€Ñ–Ğ±ĞµĞ½ ÑĞ¿Ğ¾Ğ»ÑƒÑ‡Ğ½Ğ¸Ğº Â«Ñ‰Ğ¾Â» Ñƒ Ğ½ĞµĞ¿Ñ€ÑĞ¼Ñ–Ğ¹ Ğ¼Ğ¾Ğ²Ñ–.\n\n2. Ğ’Ğ¾Ğ½Ğ° ÑĞºĞ°Ğ·Ğ°Ğ»Ğ°, Ñ‰Ğ¾ Ñ Ğ»ÑĞ±Ğ»Ñ Ñ†Ñ ĞºĞ½Ğ¸Ğ³Ñƒ. (ÑĞºÑ‰Ğ¾ Ğ¼Ğ¾Ğ²ĞµÑ†ÑŒ â€” Ğ²Ğ¾Ğ½Ğ°)\n   > [!error] Ñ Ğ»ÑĞ±Ğ»Ñ\n   > [!answer] Ğ²Ğ¾Ğ½Ğ° Ğ»ÑĞ±Ğ¸Ñ‚ÑŒ\n   > [!options] Ğ²Ğ¾Ğ½Ğ° Ğ»ÑĞ±Ğ¸Ñ‚ÑŒ | Ñ Ğ»ÑĞ±Ğ¸Ñ‚ÑŒ | Ğ²Ğ¾Ğ½Ğ° Ğ»ÑĞ±Ğ»Ñ | Ğ²Ğ¾Ğ½Ğ° Ğ»ÑĞ±Ğ¸Ğ»Ğ°\n   > [!explanation] Ğ—Ğ°Ğ¹Ğ¼ĞµĞ½Ğ½Ğ¸Ğº Ğ¼Ğ°Ñ” Ğ²Ñ–Ğ´Ğ¿Ğ¾Ğ²Ñ–Ğ´Ğ°Ñ‚Ğ¸ Ğ¼Ğ¾Ğ²Ñ†Ñ.\n\n3. Ğ’Ñ–Ğ½ ÑĞºĞ°Ğ·Ğ°Ğ², Ñ‰Ğ¾ Ğ¿Ñ€Ğ°Ñ†ÑĞ²Ğ°Ğ² Ñ‚ÑƒÑ‚. (ÑĞºÑ‰Ğ¾ Ğ²Ñ–Ğ½ Ñ‰Ğµ Ğ¿Ñ€Ğ°Ñ†ÑÑ” Ñ‚Ğ°Ğ¼)\n   > [!error] Ğ¿Ñ€Ğ°Ñ†ÑĞ²Ğ°Ğ²\n   > [!answer] Ğ¿Ñ€Ğ°Ñ†ÑÑ”\n   > [!options] Ğ¿Ñ€Ğ°Ñ†ÑÑ” | Ğ¿Ñ€Ğ°Ñ†ÑĞ²Ğ°Ñ‚Ğ¸Ğ¼Ğµ | Ğ±ÑƒĞ´Ğµ Ğ¿Ñ€Ğ°Ñ†ÑĞ²Ğ°Ñ‚Ğ¸ | Ğ¿Ñ€Ğ°Ñ†ÑĞ²Ğ°Ğ»Ğ°\n   > [!explanation] Ğ—ÑÑƒĞ² Ñ‡Ğ°ÑÑƒ Ğ½Ğµ Ğ¿Ğ¾Ñ‚Ñ€Ñ–Ğ±ĞµĞ½, ÑĞºÑ‰Ğ¾ Ğ´Ñ–Ñ Ğ°ĞºÑ‚ÑƒĞ°Ğ»ÑŒĞ½Ğ°.\n\n4. Ğ’Ğ¾Ğ½Ğ° ÑĞºĞ°Ğ·Ğ°Ğ»Ğ°: Ñ‰Ğ¾ Ğ²Ğ¾Ğ½Ğ° Ğ¿Ñ€Ğ¸Ğ¹Ğ´Ğµ Ğ·Ğ°Ğ²Ñ‚Ñ€Ğ°.\n   > [!error] ÑĞºĞ°Ğ·Ğ°Ğ»Ğ°: Ñ‰Ğ¾\n   > [!answer] ÑĞºĞ°Ğ·Ğ°Ğ»Ğ°, Ñ‰Ğ¾\n   > [!options] ÑĞºĞ°Ğ·Ğ°Ğ»Ğ°, Ñ‰Ğ¾ | ÑĞºĞ°Ğ·Ğ°Ğ»Ğ° â€” Ñ‰Ğ¾ | ÑĞºĞ°Ğ·Ğ°Ğ»Ğ°; Ñ‰Ğ¾ | ÑĞºĞ°Ğ·Ğ°Ğ»Ğ°! Ñ‰Ğ¾\n   > [!explanation] Ğ”Ğ²Ğ¾ĞºÑ€Ğ°Ğ¿ĞºĞ° Ğ´Ğ»Ñ Ğ¿Ñ€ÑĞ¼Ğ¾Ñ— Ğ¼Ğ¾Ğ²Ğ¸, ĞºĞ¾Ğ¼Ğ° Ğ´Ğ»Ñ Ğ½ĞµĞ¿Ñ€ÑĞ¼Ğ¾Ñ—.\n\n5. Ğ’Ñ–Ğ½ Ğ³Ğ¾Ğ²Ğ¾Ñ€Ğ¸Ğ², Ñ‰Ğ¾ Ğ²Ñ–Ğ½ Ğ¿Ñ€Ğ¸Ñ—Ñ…Ğ°Ğ² Ğ²Ñ‡Ğ¾Ñ€Ğ°. (Ğ½ĞµĞ¿Ñ€ÑĞ¼Ğ° Ğ¼Ğ¾Ğ²Ğ° Ğ² Ğ¼Ğ¸Ğ½ÑƒĞ»Ğ¾Ğ¼Ñƒ)\n   > [!error] Ğ²Ñ‡Ğ¾Ñ€Ğ°\n   > [!answer] Ğ½Ğ°Ğ¿ĞµÑ€ĞµĞ´Ğ¾Ğ´Ğ½Ñ–\n   > [!options] Ğ½Ğ°Ğ¿ĞµÑ€ĞµĞ´Ğ¾Ğ´Ğ½Ñ– | Ğ·Ğ°Ğ²Ñ‚Ñ€Ğ° | ÑÑŒĞ¾Ğ³Ğ¾Ğ´Ğ½Ñ– | Ñ‚Ğ¾Ğ´Ñ–\n   > [!explanation] Â«Ğ’Ñ‡Ğ¾Ñ€Ğ°Â» â†’ Â«Ğ½Ğ°Ğ¿ĞµÑ€ĞµĞ´Ğ¾Ğ´Ğ½Ñ–Â» Ğ² Ğ¼Ğ¸Ğ½ÑƒĞ»Ğ¾Ğ¼Ñƒ ĞºĞ¾Ğ½Ñ‚ĞµĞºÑÑ‚Ñ–.\n\n6. Ğ’Ğ¾Ğ½Ğ° Ğ·Ğ°ÑƒĞ²Ğ°Ğ¶Ğ¸Ğ»Ğ° Ñ‰Ğ¾ Ğ¿Ğ¾Ğ³Ğ¾Ğ´Ğ° Ğ³Ğ°Ñ€Ğ½Ğ° ÑÑŒĞ¾Ğ³Ğ¾Ğ´Ğ½Ñ– Ğ½Ğ°Ğ´Ğ²Ğ¾Ñ€Ñ–.\n   > [!error] Ğ·Ğ°ÑƒĞ²Ğ°Ğ¶Ğ¸Ğ»Ğ° Ñ‰Ğ¾\n   > [!answer] Ğ·Ğ°ÑƒĞ²Ğ°Ğ¶Ğ¸Ğ»Ğ°, Ñ‰Ğ¾\n   > [!options] Ğ·Ğ°ÑƒĞ²Ğ°Ğ¶Ğ¸Ğ»Ğ°, Ñ‰Ğ¾ | Ğ·Ğ°ÑƒĞ²Ğ°Ğ¶Ğ¸Ğ»Ğ°: Ñ‰Ğ¾ | Ğ·Ğ°ÑƒĞ²Ğ°Ğ¶Ğ¸Ğ»Ğ° â€” Ñ‰Ğ¾ | Ğ·Ğ°ÑƒĞ²Ğ°Ğ¶Ğ¸Ğ»Ğ°; Ñ‰Ğ¾\n   > [!explanation] ĞŸĞ¾Ñ‚Ñ€Ñ–Ğ±Ğ½Ğ° ĞºĞ¾Ğ¼Ğ° Ğ¿ĞµÑ€ĞµĞ´ Â«Ñ‰Ğ¾Â».\n\n---\n\n## cloze: Ğ—Ğ°Ğ¿Ğ¾Ğ²Ğ½Ñ–Ñ‚ÑŒ Ğ¿Ñ€Ğ¾Ğ¿ÑƒÑĞºĞ¸ Ğ² Ñ‚ĞµĞºÑÑ‚Ñ–\n\nĞ£Ñ‡Ğ¾Ñ€Ğ° Ñ Ñ€Ğ¾Ğ·Ğ¼Ğ¾Ğ²Ğ»ÑĞ² Ñ–Ğ· Ğ´Ñ€ÑƒĞ³Ğ¾Ğ¼. Ğ’Ñ–Ğ½ (1)___, Ñ‰Ğ¾ Ñ—Ğ´Ğµ Ñƒ Ğ²Ñ–Ğ´Ğ¿ÑƒÑÑ‚ĞºÑƒ. Ğ’Ñ–Ğ½ (2)___, Ñ‰Ğ¾ Ğ¿Ğ»Ğ°Ğ½ÑƒÑ” Ğ¿Ğ¾Ñ—Ñ…Ğ°Ñ‚Ğ¸ Ğ½Ğ° Ğ¼Ğ¾Ñ€Ğµ. Ğ’Ñ–Ğ½ (3)___, Ñ‰Ğ¾ Ñ†Ğµ Ğ±ÑƒĞ´Ğµ (4)___ Ñ‚Ğ¸Ğ¶Ğ´ĞµĞ½ÑŒ. Ğ¯ Ğ·Ğ°Ğ¿Ğ¸Ñ‚Ğ°Ğ², ĞºÑƒĞ´Ğ¸ ÑĞ°Ğ¼Ğµ. Ğ’Ñ–Ğ½ Ğ±ÑƒĞ² Ğ´ÑƒĞ¶Ğµ (5)___ Ñ†Ñ–Ñ”Ñ Ğ¿Ğ¾Ğ´Ğ¾Ñ€Ğ¾Ğ¶Ğ¶Ñ.\n\nĞ’Ñ–Ğ½ (6)___, Ñ‰Ğ¾ Ñ—Ğ´Ğµ Ğ² ĞĞ´ĞµÑÑƒ. Ğ’Ñ–Ğ½ (7)___, Ñ‰Ğ¾ Ñ‚Ğ°Ğ¼ Ñ‡ÑƒĞ´Ğ¾Ğ²Ñ– Ğ¿Ğ»ÑĞ¶Ñ–. Ğ’Ñ–Ğ½ (8)___, Ñ‰Ğ¾ Ğ·Ğ½Ğ°Ğ¹Ğ¾Ğ¼Ñ– Ñ€ĞµĞºĞ¾Ğ¼ĞµĞ½Ğ´ÑƒĞ²Ğ°Ğ»Ğ¸ ÑĞ°Ğ¼Ğµ Ñ†Ğµ Ğ¼Ñ–ÑÑ†Ğµ. Ğ¯ (9)___, Ñ‰Ğ¾ Ñ‚Ğ°ĞºĞ¾Ğ¶ Ñ…Ğ¾Ñ‚Ñ–Ğ² Ğ±Ğ¸ Ğ¿Ğ¾Ñ—Ñ…Ğ°Ñ‚Ğ¸ Ñ‚ÑƒĞ´Ğ¸.\n\nĞŸĞ¾Ñ‚Ñ–Ğ¼ Ğ²Ñ–Ğ½ (10)___, Ñ‰Ğ¾ Ğ²Ñ–Ğ·ÑŒĞ¼Ğµ Ğ±Ğ°Ğ³Ğ°Ñ‚Ğ¾ ĞºĞ½Ğ¸Ğ¶Ğ¾Ğº. Ğ’Ñ–Ğ½ (11)___, Ñ‰Ğ¾ Ğ»ÑĞ±Ğ¸Ñ‚ÑŒ Ñ‡Ğ¸Ñ‚Ğ°Ñ‚Ğ¸ Ğ½Ğ° Ğ¿Ğ»ÑĞ¶Ñ–. Ğ¯ (12)___, Ñ‰Ğ¾ Ñ†Ğµ Ğ³Ğ°Ñ€Ğ½Ğ° Ñ–Ğ´ĞµÑ. Ğ’Ñ–Ğ½ (13)___, Ñ‰Ğ¾ Ğ¿Ğ¾Ğ²ĞµÑ€Ğ½ĞµÑ‚ÑŒÑÑ Ñ‡ĞµÑ€ĞµĞ· Ğ´Ğ²Ğ° Ñ‚Ğ¸Ğ¶Ğ½Ñ–. Ğ’Ñ–Ğ½ (14)___, Ñ‰Ğ¾ Ğ¾Ğ±Ğ¾Ğ²'ÑĞ·ĞºĞ¾Ğ²Ğ¾ Ñ€Ğ¾Ğ·ĞºĞ°Ğ¶Ğµ Ğ¿Ñ€Ğ¾ Ğ¿Ğ¾Ğ´Ğ¾Ñ€Ğ¾Ğ¶.\n\n- (1) :: ÑĞºĞ°Ğ·Ğ°Ğ² | ÑĞºĞ°Ğ·Ğ°Ğ»Ğ° | ÑĞºĞ°Ğ¶Ñƒ | ÑĞºĞ°Ğ¶Ğµ\n- (2) :: Ğ¿Ğ¾ÑÑĞ½Ğ¸Ğ² | Ğ¿Ğ¾ÑÑĞ½Ğ¸Ğ»Ğ° | Ğ¿Ğ¾ÑÑĞ½ÑÑ‚ÑŒ | Ğ¿Ğ¾ÑÑĞ½ÑÑ\n- (3) :: Ğ´Ğ¾Ğ´Ğ°Ğ² | Ğ´Ğ¾Ğ´Ğ°Ğ»Ğ° | Ğ´Ğ¾Ğ´Ğ°Ğ¼ | Ğ´Ğ¾Ğ´Ğ°ÑÑ‚ÑŒ\n- (4) :: Ğ½Ğ°ÑÑ‚ÑƒĞ¿Ğ½Ğ¾Ğ³Ğ¾ | Ñ‚Ğ¾Ğ³Ğ¾ | Ñ†ÑŒĞ¾Ğ³Ğ¾ | Ğ¿Ğ¾Ğ¿ĞµÑ€ĞµĞ´Ğ½ÑŒĞ¾Ğ³Ğ¾\n- (5) :: Ğ·Ğ°Ñ†Ñ–ĞºĞ°Ğ²Ğ»ĞµĞ½Ğ¸Ğ¹ | Ğ·Ğ°Ñ†Ñ–ĞºĞ°Ğ²Ğ»ĞµĞ½Ğ° | ÑÑƒĞ¼Ğ½Ğ¸Ğ¹ | Ğ·Ğ»Ğ¸Ğ¹\n- (6) :: Ğ²Ñ–Ğ´Ğ¿Ğ¾Ğ²Ñ–Ğ² | Ğ²Ñ–Ğ´Ğ¿Ğ¾Ğ²Ñ–Ğ»Ğ° | Ğ²Ñ–Ğ´Ğ¿Ğ¾Ğ²Ñ–Ğ¼ | Ğ²Ñ–Ğ´Ğ¿Ğ¾Ğ²Ñ–Ğ´Ğ°Ñ\n- (7) :: Ğ·Ğ°ÑƒĞ²Ğ°Ğ¶Ğ¸Ğ² | Ğ·Ğ°ÑƒĞ²Ğ°Ğ¶Ğ¸Ğ»Ğ° | Ğ·Ğ°ÑƒĞ²Ğ°Ğ¶Ñƒ | Ğ·Ğ°ÑƒĞ²Ğ°Ğ¶Ğ°Ñ‚ÑŒ\n- (8) :: ÑÑ‚Ğ²ĞµÑ€Ğ´Ğ¶ÑƒĞ²Ğ°Ğ² | ÑÑ‚Ğ²ĞµÑ€Ğ´Ğ¶ÑƒĞ²Ğ°Ğ»Ğ° | ÑÑ‚Ğ²ĞµÑ€Ğ´Ğ¶ÑƒÑ | ÑÑ‚Ğ²ĞµÑ€Ğ´Ğ¶ÑƒÑÑ‚ÑŒ\n- (9) :: Ğ·Ğ°ÑƒĞ²Ğ°Ğ¶Ğ¸Ğ² | Ğ·Ğ°ÑƒĞ²Ğ°Ğ¶Ğ¸Ğ»Ğ° | Ğ·Ğ°ÑƒĞ²Ğ°Ğ¶Ñƒ | Ğ·Ğ°ÑƒĞ²Ğ°Ğ¶ÑƒÑÑ‚ÑŒ\n- (10) :: Ğ´Ğ¾Ğ´Ğ°Ğ² | Ğ´Ğ¾Ğ´Ğ°Ğ»Ğ° | Ğ´Ğ¾Ğ´Ğ°Ğ¼ | Ğ´Ğ¾Ğ´Ğ°ÑÑ‚ÑŒ\n- (11) :: Ğ¿Ğ¾ÑÑĞ½Ğ¸Ğ² | Ğ¿Ğ¾ÑÑĞ½Ğ¸Ğ»Ğ° | Ğ¿Ğ¾ÑÑĞ½ÑÑ | Ğ¿Ğ¾ÑÑĞ½ÑÑ‚ÑŒ\n- (12) :: Ğ¿Ğ¾Ğ³Ğ¾Ğ´Ğ¸Ğ²ÑÑ | Ğ¿Ğ¾Ğ³Ğ¾Ğ´Ğ¸Ğ»Ğ°ÑÑ | Ğ¿Ğ¾Ğ³Ğ¾Ğ´Ğ¶ÑƒÑÑÑŒ | Ğ¿Ğ¾Ğ³Ğ¾Ğ´ÑÑ‚ÑŒÑÑ\n- (13) :: Ğ¿Ğ¾Ğ¾Ğ±Ñ–Ñ†ÑĞ² | Ğ¿Ğ¾Ğ¾Ğ±Ñ–Ñ†ÑĞ»Ğ° | Ğ¿Ğ¾Ğ¾Ğ±Ñ–Ñ†ÑÑ | Ğ¿Ğ¾Ğ¾Ğ±Ñ–Ñ†ÑÑÑ‚ÑŒ\n- (14) :: Ğ·Ğ°Ğ¿ĞµĞ²Ğ½Ğ¸Ğ² | Ğ·Ğ°Ğ¿ĞµĞ²Ğ½Ğ¸Ğ»Ğ° | Ğ·Ğ°Ğ¿ĞµĞ²Ğ½Ñ | Ğ·Ğ°Ğ¿ĞµĞ²Ğ½ÑÑÑ‚ÑŒ\n\n---\n\n## mark-the-words: ĞŸĞ¾Ğ·Ğ½Ğ°Ñ‡Ñ‚Ğµ Ğ´Ñ–Ñ”ÑĞ»Ğ¾Ğ²Ğ° Ğ²Ğ²ĞµĞ´ĞµĞ½Ğ½Ñ Ğ½ĞµĞ¿Ñ€ÑĞ¼Ğ¾Ñ— Ğ¼Ğ¾Ğ²Ğ¸\n\nĞ’Ñ–Ğ½ [ÑĞºĞ°Ğ·Ğ°Ğ²], Ñ‰Ğ¾ Ğ¿Ñ€Ğ¸Ğ¹Ğ´Ğµ Ğ·Ğ°Ğ²Ñ‚Ñ€Ğ°. Ğ’Ğ¾Ğ½Ğ° [Ğ¿Ğ¾ÑÑĞ½Ğ¸Ğ»Ğ°], Ñ‰Ğ¾ Ğ¿Ğ¾Ñ‚Ñ€Ñ–Ğ±Ğ½Ğ¾ Ğ±Ñ–Ğ»ÑŒÑˆĞµ Ñ‡Ğ°ÑÑƒ. Ğ”Ğ¸Ñ€ĞµĞºÑ‚Ğ¾Ñ€ [Ğ·Ğ°ÑĞ²Ğ¸Ğ²], Ñ‰Ğ¾ Ğ·Ğ±Ğ¾Ñ€Ğ¸ Ğ¿ĞµÑ€ĞµĞ½ĞµÑĞµĞ½Ğ¾. Ğ’Ñ–Ğ½ [Ğ´Ğ¾Ğ´Ğ°Ğ²], Ñ‰Ğ¾ Ğ±ÑƒĞ´Ğµ Ñ‡ĞµĞºĞ°Ñ‚Ğ¸. Ğ’Ğ¾Ğ½Ğ° [Ğ·Ğ°ÑƒĞ²Ğ°Ğ¶Ğ¸Ğ»Ğ°], Ñ‰Ğ¾ Ğ¿Ğ¾Ğ³Ğ¾Ğ´Ğ° Ğ³Ğ°Ñ€Ğ½Ğ°. Ğ¡Ğ²Ñ–Ğ´Ğ¾Ğº [ÑÑ‚Ğ²ĞµÑ€Ğ´Ğ¶ÑƒÑ”], Ñ‰Ğ¾ Ğ±Ğ°Ñ‡Ğ¸Ğ² Ñ†Ğµ. Ğ’Ñ–Ğ½ [Ğ²Ğ¸Ğ·Ğ½Ğ°Ğ²], Ñ‰Ğ¾ Ğ¿Ğ¾Ğ¼Ğ¸Ğ»Ğ¸Ğ²ÑÑ. Ğ’Ğ¾Ğ½Ğ° [Ğ·Ğ°Ğ¿ĞµÑ€ĞµÑ‡Ğ¸Ğ»Ğ°], Ñ‰Ğ¾ Ğ±ÑƒĞ»Ğ° Ñ‚Ğ°Ğ¼.\n\n---\n\n## dialogue-reorder: Ğ’Ğ¿Ğ¾Ñ€ÑĞ´ĞºÑƒĞ¹Ñ‚Ğµ Ğ´Ñ–Ğ°Ğ»Ğ¾Ğ³\n\n- Ğ’Ñ–Ğ½ ÑĞºĞ°Ğ·Ğ°Ğ², Ñ‰Ğ¾ Ğ¿Ñ€Ğ¾ĞµĞºÑ‚ Ğ¿Ñ€Ğ¾ÑÑƒĞ²Ğ°Ñ”Ñ‚ÑŒÑÑ Ğ´Ğ¾Ğ±Ñ€Ğµ Ñ– Ğ¼Ğ¸ Ğ²ÑÑ‚Ğ¸Ğ³Ğ½ĞµĞ¼Ğ¾.\n- Ğ©Ğ¾ ÑĞºĞ°Ğ·Ğ°Ğ² ÑˆĞµÑ„ Ğ½Ğ° ÑÑŒĞ¾Ğ³Ğ¾Ğ´Ğ½Ñ–ÑˆĞ½Ñ–Ğ¹ Ğ·ÑƒÑÑ‚Ñ€Ñ–Ñ‡Ñ–?\n- Ğ§ÑƒĞ´Ğ¾Ğ²Ğ¾! Ğ Ğ¿Ñ€Ğ¾ Ğ±ÑĞ´Ğ¶ĞµÑ‚ Ğ²Ñ–Ğ½ Ñ‰Ğ¾ÑÑŒ Ğ³Ğ¾Ğ²Ğ¾Ñ€Ğ¸Ğ²?\n- Ğ’Ñ–Ğ½ Ğ¿Ğ¾ÑÑĞ½Ğ¸Ğ², Ñ‰Ğ¾ Ğ±ÑĞ´Ğ¶ĞµÑ‚ Ğ±ÑƒĞ´Ğµ Ğ·Ğ±Ñ–Ğ»ÑŒÑˆĞµĞ½Ğ¾ Ğ½Ğ° Ğ½Ğ°ÑÑ‚ÑƒĞ¿Ğ½Ğ¸Ğ¹ Ñ€Ñ–Ğº.\n- Ğ Ñ‰Ğ¾ Ğ²Ñ–Ğ½ ĞºĞ°Ğ·Ğ°Ğ² Ğ¿Ñ€Ğ¾ Ğ²Ñ–Ğ´Ğ¿ÑƒÑÑ‚ĞºĞ¸ Ñ‚Ğ° Ğ²Ğ¸Ñ…Ñ–Ğ´Ğ½Ñ–?\n- Ğ’Ñ–Ğ½ Ğ´Ğ¾Ğ´Ğ°Ğ², Ñ‰Ğ¾ Ğ¿Ğ¾Ñ‚Ñ€Ñ–Ğ±Ğ½Ğ¾ Ğ¿Ğ¾Ğ´Ğ°Ñ‚Ğ¸ Ğ·Ğ°ÑĞ²ĞºĞ¸ Ğ´Ğ¾ ĞºÑ–Ğ½Ñ†Ñ Ğ¼Ñ–ÑÑÑ†Ñ.\n\n> [!answer]\n> 1. Ğ©Ğ¾ ÑĞºĞ°Ğ·Ğ°Ğ² ÑˆĞµÑ„ Ğ½Ğ° ÑÑŒĞ¾Ğ³Ğ¾Ğ´Ğ½Ñ–ÑˆĞ½Ñ–Ğ¹ Ğ·ÑƒÑÑ‚Ñ€Ñ–Ñ‡Ñ–?\n> 2. Ğ’Ñ–Ğ½ ÑĞºĞ°Ğ·Ğ°Ğ², Ñ‰Ğ¾ Ğ¿Ñ€Ğ¾ĞµĞºÑ‚ Ğ¿Ñ€Ğ¾ÑÑƒĞ²Ğ°Ñ”Ñ‚ÑŒÑÑ Ğ´Ğ¾Ğ±Ñ€Ğµ Ñ– Ğ¼Ğ¸ Ğ²ÑÑ‚Ğ¸Ğ³Ğ½ĞµĞ¼Ğ¾.\n> 3. Ğ§ÑƒĞ´Ğ¾Ğ²Ğ¾! Ğ Ğ¿Ñ€Ğ¾ Ğ±ÑĞ´Ğ¶ĞµÑ‚ Ğ²Ñ–Ğ½ Ñ‰Ğ¾ÑÑŒ Ğ³Ğ¾Ğ²Ğ¾Ñ€Ğ¸Ğ²?\n> 4. Ğ’Ñ–Ğ½ Ğ¿Ğ¾ÑÑĞ½Ğ¸Ğ², Ñ‰Ğ¾ Ğ±ÑĞ´Ğ¶ĞµÑ‚ Ğ±ÑƒĞ´Ğµ Ğ·Ğ±Ñ–Ğ»ÑŒÑˆĞµĞ½Ğ¾ Ğ½Ğ° Ğ½Ğ°ÑÑ‚ÑƒĞ¿Ğ½Ğ¸Ğ¹ Ñ€Ñ–Ğº.\n> 5. Ğ Ñ‰Ğ¾ Ğ²Ñ–Ğ½ ĞºĞ°Ğ·Ğ°Ğ² Ğ¿Ñ€Ğ¾ Ğ²Ñ–Ğ´Ğ¿ÑƒÑÑ‚ĞºĞ¸ Ñ‚Ğ° Ğ²Ğ¸Ñ…Ñ–Ğ´Ğ½Ñ–?\n> 6. Ğ’Ñ–Ğ½ Ğ´Ğ¾Ğ´Ğ°Ğ², Ñ‰Ğ¾ Ğ¿Ğ¾Ñ‚Ñ€Ñ–Ğ±Ğ½Ğ¾ Ğ¿Ğ¾Ğ´Ğ°Ñ‚Ğ¸ Ğ·Ğ°ÑĞ²ĞºĞ¸ Ğ´Ğ¾ ĞºÑ–Ğ½Ñ†Ñ Ğ¼Ñ–ÑÑÑ†Ñ.\n\n---\n\n## select: Ğ’Ğ¸Ğ±ĞµÑ€Ñ–Ñ‚ÑŒ ÑƒÑÑ– Ğ³Ñ€Ğ°Ğ¼Ğ°Ñ‚Ğ¸Ñ‡Ğ½Ğ¾ Ğ¿Ñ€Ğ°Ğ²Ğ¸Ğ»ÑŒĞ½Ñ– Ñ€ĞµÑ‡ĞµĞ½Ğ½Ñ\n\n- [x] Ğ’Ñ–Ğ½ ÑĞºĞ°Ğ·Ğ°Ğ², Ñ‰Ğ¾ Ğ¿Ñ€Ğ¸Ğ¹Ğ´Ğµ Ğ·Ğ°Ğ²Ñ‚Ñ€Ğ°.\n- [ ] Ğ’Ñ–Ğ½ ÑĞºĞ°Ğ·Ğ°Ğ² Ñ‰Ğ¾ Ğ¿Ñ€Ğ¸Ğ¹Ğ´Ğµ Ğ·Ğ°Ğ²Ñ‚Ñ€Ğ°.\n- [x] Ğ’Ğ¾Ğ½Ğ° Ğ¿Ğ¾ÑÑĞ½Ğ¸Ğ»Ğ°, Ñ‰Ğ¾ Ğ¿Ğ¾Ñ‚Ñ€Ñ–Ğ±ĞµĞ½ Ñ‡Ğ°Ñ.\n- [ ] Ğ’Ğ¾Ğ½Ğ° Ğ¿Ğ¾ÑÑĞ½Ğ¸Ğ»Ğ°, Ñ‰Ğ¾ Ñ Ğ¿Ğ¾Ñ‚Ñ€Ñ–Ğ±ĞµĞ½ Ñ‡Ğ°Ñ.\n- [x] Ğ”Ğ¸Ñ€ĞµĞºÑ‚Ğ¾Ñ€ Ğ·Ğ°ÑĞ²Ğ¸Ğ², Ñ‰Ğ¾ Ğ·Ğ±Ğ¾Ñ€Ğ¸ Ğ¿ĞµÑ€ĞµĞ½ĞµÑĞµĞ½Ğ¾.\n- [ ] Ğ”Ğ¸Ñ€ĞµĞºÑ‚Ğ¾Ñ€ Ğ·Ğ°ÑĞ²Ğ¸Ğ²: Ñ‰Ğ¾ Ğ·Ğ±Ğ¾Ñ€Ğ¸ Ğ¿ĞµÑ€ĞµĞ½ĞµÑĞµĞ½Ğ¾.\n- [x] Ğ’Ñ–Ğ½ Ğ·Ğ°ÑƒĞ²Ğ°Ğ¶Ğ¸Ğ², Ñ‰Ğ¾ Ğ¿Ğ¾Ğ³Ğ¾Ğ´Ğ° Ğ³Ğ°Ñ€Ğ½Ğ°.\n- [ ] Ğ’Ñ–Ğ½ Ğ·Ğ°ÑƒĞ²Ğ°Ğ¶Ğ¸Ğ² Ñ‰Ğ¾ Ğ¿Ğ¾Ğ³Ğ¾Ğ´Ğ° Ğ³Ğ°Ñ€Ğ½Ğ°.\n- [x] Ğ’Ğ¾Ğ½Ğ° ÑĞºĞ°Ğ·Ğ°Ğ»Ğ°, Ñ‰Ğ¾ Ğ²Ğ¾Ğ½Ğ° Ğ¿Ñ€Ğ¸Ğ¹Ğ´Ğµ.\n- [x] Ğ¡Ğ²Ñ–Ğ´Ğ¾Ğº ÑÑ‚Ğ²ĞµÑ€Ğ´Ğ¶ÑƒÑ”, Ñ‰Ğ¾ Ğ±Ğ°Ñ‡Ğ¸Ğ² Ñ†Ğµ.\n- [x] Ğ’Ñ–Ğ½ Ğ´Ğ¾Ğ´Ğ°Ğ², Ñ‰Ğ¾ Ğ±ÑƒĞ´Ğµ Ñ‡ĞµĞºĞ°Ñ‚Ğ¸.\n- [ ] Ğ’Ñ–Ğ½ Ğ´Ğ¾Ğ´Ğ°Ğ², Ğ²Ñ–Ğ½ Ğ±ÑƒĞ´Ğµ Ñ‡ĞµĞºĞ°Ñ‚Ğ¸.\n\n---\n\n## translate: ĞŸĞµÑ€ĞµĞºĞ»Ğ°Ğ´Ñ–Ñ‚ÑŒ Ğ½Ğ° ÑƒĞºÑ€Ğ°Ñ—Ğ½ÑÑŒĞºÑƒ Ğ¼Ğ¾Ğ²Ñƒ\n\n1. He said that he would come tomorrow evening to our place.\n   - [x] Ğ’Ñ–Ğ½ ÑĞºĞ°Ğ·Ğ°Ğ², Ñ‰Ğ¾ Ğ¿Ñ€Ğ¸Ğ¹Ğ´Ğµ Ğ·Ğ°Ğ²Ñ‚Ñ€Ğ° Ğ²Ğ²ĞµÑ‡ĞµÑ€Ñ– Ğ´Ğ¾ Ğ½Ğ°Ñ.\n   - [ ] Ğ’Ñ–Ğ½ ÑĞºĞ°Ğ·Ğ°Ğ², Ñ Ğ¿Ñ€Ğ¸Ğ¹Ğ´Ñƒ Ğ·Ğ°Ğ²Ñ‚Ñ€Ğ°.\n   - [ ] Ğ’Ñ–Ğ½ ÑĞºĞ°Ğ·Ğ°Ğ² Ñ‰Ğ¾ Ğ²Ñ–Ğ½ Ğ¿Ñ€Ğ¸Ğ¹Ğ´Ğµ.\n   - [ ] Ğ’Ñ–Ğ½ ÑĞºĞ°Ğ·Ğ°Ğ²: Ñ‰Ğ¾ Ğ¿Ñ€Ğ¸Ğ¹Ğ´Ğµ.\n\n2. She explained that she needed more time for this project.\n   - [x] Ğ’Ğ¾Ğ½Ğ° Ğ¿Ğ¾ÑÑĞ½Ğ¸Ğ»Ğ°, Ñ‰Ğ¾ Ñ—Ğ¹ Ğ¿Ğ¾Ñ‚Ñ€Ñ–Ğ±Ğ½Ğ¾ Ğ±Ñ–Ğ»ÑŒÑˆĞµ Ñ‡Ğ°ÑÑƒ Ğ´Ğ»Ñ Ñ†ÑŒĞ¾Ğ³Ğ¾ Ğ¿Ñ€Ğ¾ĞµĞºÑ‚Ñƒ.\n   - [ ] Ğ’Ğ¾Ğ½Ğ° Ğ¿Ğ¾ÑÑĞ½Ğ¸Ğ»Ğ° Ñ‰Ğ¾ Ğ¼ĞµĞ½Ñ– Ğ¿Ğ¾Ñ‚Ñ€Ñ–Ğ±Ğ½Ğ¾ Ñ‡Ğ°Ñ.\n   - [ ] Ğ’Ğ¾Ğ½Ğ° Ğ¿Ğ¾ÑÑĞ½Ğ¸Ğ»Ğ°, Ñ Ğ¿Ğ¾Ñ‚Ñ€Ñ–Ğ±Ğ½Ğ¾ Ñ‡Ğ°Ñ.\n   - [ ] Ğ’Ğ¾Ğ½Ğ° Ğ¿Ğ¾ÑÑĞ½Ğ¸Ğ»Ğ°: Ñ‰Ğ¾ Ğ¿Ğ¾Ñ‚Ñ€Ñ–Ğ±Ğ½Ğ¾ Ñ‡Ğ°Ñ.\n\n3. The director announced that the meeting was postponed until next week.\n   - [x] Ğ”Ğ¸Ñ€ĞµĞºÑ‚Ğ¾Ñ€ Ğ·Ğ°ÑĞ²Ğ¸Ğ², Ñ‰Ğ¾ Ğ·Ğ±Ğ¾Ñ€Ğ¸ Ğ¿ĞµÑ€ĞµĞ½ĞµÑĞµĞ½Ğ¾ Ğ½Ğ° Ğ½Ğ°ÑÑ‚ÑƒĞ¿Ğ½Ğ¸Ğ¹ Ñ‚Ğ¸Ğ¶Ğ´ĞµĞ½ÑŒ.\n   - [ ] Ğ”Ğ¸Ñ€ĞµĞºÑ‚Ğ¾Ñ€ Ğ·Ğ°ÑĞ²Ğ¸Ğ² Ñ‰Ğ¾ Ğ·Ğ±Ğ¾Ñ€Ğ¸ Ğ¿ĞµÑ€ĞµĞ½ĞµÑĞµĞ½Ğ¾.\n   - [ ] Ğ”Ğ¸Ñ€ĞµĞºÑ‚Ğ¾Ñ€ Ğ·Ğ°ÑĞ²Ğ¸Ğ², Ğ·Ğ±Ğ¾Ñ€Ğ¸ Ğ¿ĞµÑ€ĞµĞ½ĞµÑĞµĞ½Ğ¾.\n   - [ ] Ğ”Ğ¸Ñ€ĞµĞºÑ‚Ğ¾Ñ€ Ğ·Ğ°ÑĞ²Ğ¸Ğ²: Ñ‰Ğ¾ Ğ·Ğ±Ğ¾Ñ€Ğ¸.\n\n4. He added that he would wait for a response until Friday.\n   - [x] Ğ’Ñ–Ğ½ Ğ´Ğ¾Ğ´Ğ°Ğ², Ñ‰Ğ¾ Ğ±ÑƒĞ´Ğµ Ñ‡ĞµĞºĞ°Ñ‚Ğ¸ Ğ½Ğ° Ğ²Ñ–Ğ´Ğ¿Ğ¾Ğ²Ñ–Ğ´ÑŒ Ğ´Ğ¾ Ğ¿'ÑÑ‚Ğ½Ğ¸Ñ†Ñ–.\n   - [ ] Ğ’Ñ–Ğ½ Ğ´Ğ¾Ğ´Ğ°Ğ² Ñ‰Ğ¾ Ñ‡ĞµĞºĞ°Ñ‚Ğ¸Ğ¼Ğµ Ğ²Ñ–Ğ´Ğ¿Ğ¾Ğ²Ñ–Ğ´ÑŒ.\n   - [ ] Ğ’Ñ–Ğ½ Ğ´Ğ¾Ğ´Ğ°Ğ², Ñ Ğ±ÑƒĞ´Ñƒ Ñ‡ĞµĞºĞ°Ñ‚Ğ¸.\n   - [ ] Ğ’Ñ–Ğ½ Ğ´Ğ¾Ğ´Ğ°Ğ² Ñ‡ĞµĞºĞ°Ñ‚Ğ¸ Ğ´Ğ¾ Ğ¿'ÑÑ‚Ğ½Ğ¸Ñ†Ñ–.\n\n5. She noted that the weather was nice today for a walk.\n   - [x] Ğ’Ğ¾Ğ½Ğ° Ğ·Ğ°ÑƒĞ²Ğ°Ğ¶Ğ¸Ğ»Ğ°, Ñ‰Ğ¾ Ğ¿Ğ¾Ğ³Ğ¾Ğ´Ğ° ÑÑŒĞ¾Ğ³Ğ¾Ğ´Ğ½Ñ– Ğ³Ğ°Ñ€Ğ½Ğ° Ğ´Ğ»Ñ Ğ¿Ñ€Ğ¾Ğ³ÑƒĞ»ÑĞ½ĞºĞ¸.\n   - [ ] Ğ’Ğ¾Ğ½Ğ° Ğ·Ğ°ÑƒĞ²Ğ°Ğ¶Ğ¸Ğ»Ğ° Ñ‰Ğ¾ Ğ¿Ğ¾Ğ³Ğ¾Ğ´Ğ° Ğ³Ğ°Ñ€Ğ½Ğ°.\n   - [ ] Ğ’Ğ¾Ğ½Ğ° Ğ·Ğ°ÑƒĞ²Ğ°Ğ¶Ğ¸Ğ»Ğ°, Ğ¿Ğ¾Ğ³Ğ¾Ğ´Ğ° Ğ³Ğ°Ñ€Ğ½Ğ°.\n   - [ ] Ğ’Ğ¾Ğ½Ğ° Ğ·Ğ°ÑƒĞ²Ğ°Ğ¶Ğ¸Ğ»Ğ°: Ñ‰Ğ¾ Ğ¿Ğ¾Ğ³Ğ¾Ğ´Ğ°.\n\n6. The witness claims that he saw this person there that same evening.\n   - [x] Ğ¡Ğ²Ñ–Ğ´Ğ¾Ğº ÑÑ‚Ğ²ĞµÑ€Ğ´Ğ¶ÑƒÑ”, Ñ‰Ğ¾ Ğ²Ñ–Ğ½ Ğ±Ğ°Ñ‡Ğ¸Ğ² Ñ†Ñ Ğ»ÑĞ´Ğ¸Ğ½Ñƒ Ñ‚Ğ°Ğ¼ Ñ‚Ğ¾Ğ³Ğ¾ ÑĞ°Ğ¼Ğ¾Ğ³Ğ¾ Ğ²ĞµÑ‡Ğ¾Ñ€Ğ°.\n   - [ ] Ğ¡Ğ²Ñ–Ğ´Ğ¾Ğº ÑÑ‚Ğ²ĞµÑ€Ğ´Ğ¶ÑƒÑ” Ñ‰Ğ¾ Ğ±Ğ°Ñ‡Ğ¸Ğ² Ğ»ÑĞ´Ğ¸Ğ½Ñƒ.\n   - [ ] Ğ¡Ğ²Ñ–Ğ´Ğ¾Ğº ÑÑ‚Ğ²ĞµÑ€Ğ´Ğ¶ÑƒÑ”, Ñ Ğ±Ğ°Ñ‡Ğ¸Ğ².\n   - [ ] Ğ¡Ğ²Ñ–Ğ´Ğ¾Ğº ÑÑ‚Ğ²ĞµÑ€Ğ´Ğ¶ÑƒÑ”: Ñ‰Ğ¾ Ğ±Ğ°Ñ‡Ğ¸Ğ².\n\n---\n\n# Ğ¡Ğ»Ğ¾Ğ²Ğ½Ğ¸Ğº\n\n| Ğ¡Ğ»Ğ¾Ğ²Ğ¾ | Ğ’Ğ¸Ğ¼Ğ¾Ğ²Ğ° | ĞŸĞµÑ€ĞµĞºĞ»Ğ°Ğ´ | Ğ§Ğœ | ĞŸÑ€Ğ¸Ğ¼Ñ–Ñ‚ĞºĞ° |\n|-------|--------|----------|-----|----------|\n| **Ğ½ĞµĞ¿Ñ€ÑĞ¼Ğ° Ğ¼Ğ¾Ğ²Ğ°** | /nÉ›prÊ²É‘ËˆmÉ‘ ËˆmÉ”wÉ‘/ | indirect speech | Ğ²Ğ¸Ñ€Ğ°Ğ· | Ğ¿ĞµÑ€ĞµĞ´Ğ°Ñ‡Ğ° Ñ‡ÑƒĞ¶Ğ¸Ñ… ÑĞ»Ñ–Ğ² |\n| **Ğ¿Ñ€ÑĞ¼Ğ° Ğ¼Ğ¾Ğ²Ğ°** | /prÊ²É‘ËˆmÉ‘ ËˆmÉ”wÉ‘/ | direct speech | Ğ²Ğ¸Ñ€Ğ°Ğ· | Ğ´Ğ¾ÑĞ»Ñ–Ğ²Ğ½Ğµ Ñ†Ğ¸Ñ‚ÑƒĞ²Ğ°Ğ½Ğ½Ñ |\n| **Ğ´Ñ–Ñ”ÑĞ»Ğ¾Ğ²Ğ¾ Ğ²Ğ²ĞµĞ´ĞµĞ½Ğ½Ñ** | /dÊ²iËˆjÉ›slÉ”wÉ” wËˆwÉ›dÉ›nÊ²É‘/ | reporting verb | Ğ²Ğ¸Ñ€Ğ°Ğ· | Ğ²Ğ²Ğ¾Ğ´Ğ¸Ñ‚ÑŒ Ğ½ĞµĞ¿Ñ€ÑĞ¼Ñƒ Ğ¼Ğ¾Ğ²Ñƒ |\n| **ÑĞºĞ°Ğ·Ğ°Ñ‚Ğ¸** | /skÉ‘ËˆzÉ‘tÉª/ | to say | Ğ´Ñ–Ñ”ÑĞ». | Ğ½ĞµĞ¹Ñ‚Ñ€Ğ°Ğ»ÑŒĞ½Ğµ |\n| **Ğ³Ğ¾Ğ²Ğ¾Ñ€Ğ¸Ñ‚Ğ¸** | /É¦É”wÉ”ËˆrÉªtÉª/ | to speak/tell | Ğ´Ñ–Ñ”ÑĞ». | Ñ‚Ñ€Ğ¸Ğ²Ğ°Ğ»Ğ° Ñ€Ğ¾Ğ·Ğ¼Ğ¾Ğ²Ğ° |\n| **Ğ¿Ğ¾Ğ²Ñ–Ğ´Ğ¾Ğ¼Ğ¸Ñ‚Ğ¸** | /pÉ”wÊ²idÉ”ËˆmÉªtÉª/ | to inform | Ğ´Ñ–Ñ”ÑĞ». | Ğ¾Ñ„Ñ–Ñ†Ñ–Ğ¹Ğ½Ğµ |\n| **Ğ·Ğ°ÑĞ²Ğ¸Ñ‚Ğ¸** | /zÉ‘jÉ‘ËˆwÉªtÉª/ | to declare | Ğ´Ñ–Ñ”ÑĞ». | Ğ¾Ñ„Ñ–Ñ†Ñ–Ğ¹Ğ½Ğ° Ğ·Ğ°ÑĞ²Ğ° |\n| **Ğ¿Ğ¾ÑÑĞ½Ğ¸Ñ‚Ğ¸** | /pÉ”jÉ‘sËˆnÉªtÉª/ | to explain | Ğ´Ñ–Ñ”ÑĞ». | Ñ€Ğ¾Ğ·'ÑÑĞ½ĞµĞ½Ğ½Ñ |\n| **Ğ´Ğ¾Ğ´Ğ°Ñ‚Ğ¸** | /dÉ”ËˆdÉ‘tÉª/ | to add | Ğ´Ñ–Ñ”ÑĞ». | Ğ´Ğ¾Ğ´Ğ°Ñ‚ĞºĞ¾Ğ²Ğ° Ñ–Ğ½Ñ„Ğ¾Ñ€Ğ¼Ğ°Ñ†Ñ–Ñ |\n| **Ğ·Ğ°ÑƒĞ²Ğ°Ğ¶Ğ¸Ñ‚Ğ¸** | /zÉ‘uËˆwÉ‘Ê’ÉªtÉª/ | to remark | Ğ´Ñ–Ñ”ÑĞ». | ĞºĞ¾Ğ¼ĞµĞ½Ñ‚Ğ°Ñ€ |\n| **ÑÑ‚Ğ²ĞµÑ€Ğ´Ğ¶ÑƒĞ²Ğ°Ñ‚Ğ¸** | /stwÉ›rËˆdÊ’uwÉ‘tÉª/ | to claim | Ğ´Ñ–Ñ”ÑĞ». | Ğ½Ğ°Ğ¿Ğ¾Ğ»ÑĞ³Ğ°Ğ½Ğ½Ñ |\n| **Ğ²Ğ¸Ğ·Ğ½Ğ°Ñ‚Ğ¸** | /wÉªzËˆnÉ‘tÉª/ | to admit | Ğ´Ñ–Ñ”ÑĞ». | Ğ²Ğ¸Ğ·Ğ½Ğ°Ğ½Ğ½Ñ |\n| **Ğ·Ğ°Ğ¿ĞµÑ€ĞµÑ‡Ğ¸Ñ‚Ğ¸** | /zÉ‘pÉ›ËˆrÉ›tÊƒÉªtÉª/ | to deny | Ğ´Ñ–Ñ”ÑĞ». | Ğ·Ğ°Ğ¿ĞµÑ€ĞµÑ‡ĞµĞ½Ğ½Ñ |\n| **Ğ¿Ñ–Ğ´Ñ‚Ğ²ĞµÑ€Ğ´Ğ¸Ñ‚Ğ¸** | /pÊ²idtwÉ›rËˆdÉªtÉª/ | to confirm | Ğ´Ñ–Ñ”ÑĞ». | Ğ¿Ñ–Ğ´Ñ‚Ğ²ĞµÑ€Ğ´Ğ¶ĞµĞ½Ğ½Ñ |\n| **Ğ½Ğ°Ñ‚ÑĞºĞ½ÑƒÑ‚Ğ¸** | /nÉ‘ËˆtÊ²É‘knutÉª/ | to hint | Ğ´Ñ–Ñ”ÑĞ». | Ğ½ĞµĞ¿Ñ€ÑĞ¼Ğ° Ğ²ĞºĞ°Ğ·Ñ–Ğ²ĞºĞ° |\n| **Ğ·ÑÑƒĞ² Ñ‡Ğ°ÑÑƒ** | /zsuw ËˆtÊƒÉ‘su/ | tense backshift | Ğ²Ğ¸Ñ€Ğ°Ğ· | Ğ·Ğ¼Ñ–Ğ½Ğ° Ñ‡Ğ°ÑÑƒ Ğ´Ñ–Ñ”ÑĞ»Ğ¾Ğ²Ğ° |\n| **Ğ½Ğ°ÑÑ‚ÑƒĞ¿Ğ½Ğ¾Ğ³Ğ¾ Ğ´Ğ½Ñ** | /nÉ‘sËˆtupnÉ”É¦É” dnÊ²É‘/ | the next day | Ğ²Ğ¸Ñ€Ğ°Ğ· | = Ğ·Ğ°Ğ²Ñ‚Ñ€Ğ° Ğ² Ğ¼Ğ¸Ğ½ÑƒĞ»Ğ¾Ğ¼Ñƒ |\n| **Ğ½Ğ°Ğ¿ĞµÑ€ĞµĞ´Ğ¾Ğ´Ğ½Ñ–** | /nÉ‘pÉ›rÉ›ËˆdÉ”dnÊ²i/ | the day before | Ğ¿Ñ€Ğ¸ÑĞ». | = Ğ²Ñ‡Ğ¾Ñ€Ğ° Ğ² Ğ¼Ğ¸Ğ½ÑƒĞ»Ğ¾Ğ¼Ñƒ |\n| **Ñ‚Ğ¾Ğ³Ğ¾ Ğ´Ğ½Ñ** | /tÉ”ËˆÉ¦É” dnÊ²É‘/ | that day | Ğ²Ğ¸Ñ€Ğ°Ğ· | = ÑÑŒĞ¾Ğ³Ğ¾Ğ´Ğ½Ñ– Ğ² Ğ¼Ğ¸Ğ½ÑƒĞ»Ğ¾Ğ¼Ñƒ |\n| **Ñ‚Ğ¾Ğ´Ñ–** | /tÉ”ËˆdÊ²i/ | then | Ğ¿Ñ€Ğ¸ÑĞ». | = Ğ·Ğ°Ñ€Ğ°Ğ· Ğ² Ğ¼Ğ¸Ğ½ÑƒĞ»Ğ¾Ğ¼Ñƒ |\n| **Ğ¿ĞµÑ€ĞµĞºĞ°Ğ·** | /pÉ›rÉ›ËˆkÉ‘z/ | retelling | Ñ–Ğ¼. (Ñ‡.Ñ€.) | Ğ¿ĞµÑ€ĞµĞ´Ğ°Ñ‡Ğ° Ğ·Ğ¼Ñ–ÑÑ‚Ñƒ |\n| **Ñ†Ğ¸Ñ‚ÑƒĞ²Ğ°Ğ½Ğ½Ñ** | /tÍ¡sÉªtuËˆwÉ‘nÊ²É‘/ | quotation | Ñ–Ğ¼. (Ñ.Ñ€.) | Ğ´Ğ¾ÑĞ»Ñ–Ğ²Ğ½Ğµ Ğ¿Ğ¾Ğ²Ñ‚Ğ¾Ñ€ĞµĞ½Ğ½Ñ |\n| **Ğ¿ĞµÑ€ĞµĞ´Ğ°Ñ‚Ğ¸** | /pÉ›rÉ›ËˆdÉ‘tÉª/ | to convey | Ğ´Ñ–Ñ”ÑĞ». | Ğ¿ĞµÑ€ĞµĞ´Ğ°Ñ‚Ğ¸ Ñ–Ğ½Ñ„Ğ¾Ñ€Ğ¼Ğ°Ñ†Ñ–Ñ |\n| **ÑĞ¿Ğ¾Ñ‚Ğ²Ğ¾Ñ€Ğ¸Ñ‚Ğ¸** | /spÉ”twÉ”ËˆrÉªtÉª/ | to distort | Ğ´Ñ–Ñ”ÑĞ». | Ğ·Ğ¼Ñ–Ğ½Ğ¸Ñ‚Ğ¸ Ğ·Ğ¼Ñ–ÑÑ‚ |\n| **ĞºĞ¾Ğ½Ñ‚ĞµĞºÑÑ‚** | /kÉ”nËˆtÉ›kst/ | context | Ñ–Ğ¼. (Ñ‡.Ñ€.) | Ğ¾Ğ±ÑÑ‚Ğ°Ğ²Ğ¸Ğ½Ğ¸ |\n",
    "createdAt": "2025-12-25T19:48:31.858912Z",
    "modifiedAt": "2025-12-25T19:48:31.858912Z",
    "version": 2
  },
  "activities": [],
  "vocabulary": {
    "moduleId": "mod-uk-B1-39",
    "level": "B1",
    "phase": "B1.3b Complex Sentences",
    "wordCount": 25,
    "newWordCount": 25,
    "reviewWordCount": 0,
    "transliterationMode": "none",
    "words": [
      {
        "id": "vocab-1",
        "uk": "**Ğ½ĞµĞ¿Ñ€ÑĞ¼Ğ° Ğ¼Ğ¾Ğ²Ğ°**",
        "ipa": "/nÉ›prÊ²É‘ËˆmÉ‘ ËˆmÉ”wÉ‘/",
        "en": "indirect speech",
        "pos": "Ğ²Ğ¸Ñ€Ğ°Ğ·",
        "gender": null,
        "note": ""
      },
      {
        "id": "vocab-2",
        "uk": "**Ğ¿Ñ€ÑĞ¼Ğ° Ğ¼Ğ¾Ğ²Ğ°**",
        "ipa": "/prÊ²É‘ËˆmÉ‘ ËˆmÉ”wÉ‘/",
        "en": "direct speech",
        "pos": "Ğ²Ğ¸Ñ€Ğ°Ğ·",
        "gender": null,
        "note": ""
      },
      {
        "id": "vocab-3",
        "uk": "**Ğ´Ñ–Ñ”ÑĞ»Ğ¾Ğ²Ğ¾ Ğ²Ğ²ĞµĞ´ĞµĞ½Ğ½Ñ**",
        "ipa": "/dÊ²iËˆjÉ›slÉ”wÉ” wËˆwÉ›dÉ›nÊ²É‘/",
        "en": "reporting verb",
        "pos": "Ğ²Ğ¸Ñ€Ğ°Ğ·",
        "gender": null,
        "note": ""
      },
      {
        "id": "vocab-4",
        "uk": "**ÑĞºĞ°Ğ·Ğ°Ñ‚Ğ¸**",
        "ipa": "/skÉ‘ËˆzÉ‘tÉª/",
        "en": "to say",
        "pos": "Ğ´Ñ–Ñ”ÑĞ».",
        "gender": null,
        "note": ""
      },
      {
        "id": "vocab-5",
        "uk": "**Ğ³Ğ¾Ğ²Ğ¾Ñ€Ğ¸Ñ‚Ğ¸**",
        "ipa": "/É¦É”wÉ”ËˆrÉªtÉª/",
        "en": "to speak/tell",
        "pos": "Ğ´Ñ–Ñ”ÑĞ».",
        "gender": null,
        "note": ""
      },
      {
        "id": "vocab-6",
        "uk": "**Ğ¿Ğ¾Ğ²Ñ–Ğ´Ğ¾Ğ¼Ğ¸Ñ‚Ğ¸**",
        "ipa": "/pÉ”wÊ²idÉ”ËˆmÉªtÉª/",
        "en": "to inform",
        "pos": "Ğ´Ñ–Ñ”ÑĞ».",
        "gender": null,
        "note": ""
      },
      {
        "id": "vocab-7",
        "uk": "**Ğ·Ğ°ÑĞ²Ğ¸Ñ‚Ğ¸**",
        "ipa": "/zÉ‘jÉ‘ËˆwÉªtÉª/",
        "en": "to declare",
        "pos": "Ğ´Ñ–Ñ”ÑĞ».",
        "gender": null,
        "note": ""
      },
      {
        "id": "vocab-8",
        "uk": "**Ğ¿Ğ¾ÑÑĞ½Ğ¸Ñ‚Ğ¸**",
        "ipa": "/pÉ”jÉ‘sËˆnÉªtÉª/",
        "en": "to explain",
        "pos": "Ğ´Ñ–Ñ”ÑĞ».",
        "gender": null,
        "note": ""
      },
      {
        "id": "vocab-9",
        "uk": "**Ğ´Ğ¾Ğ´Ğ°Ñ‚Ğ¸**",
        "ipa": "/dÉ”ËˆdÉ‘tÉª/",
        "en": "to add",
        "pos": "Ğ´Ñ–Ñ”ÑĞ».",
        "gender": null,
        "note": ""
      },
      {
        "id": "vocab-10",
        "uk": "**Ğ·Ğ°ÑƒĞ²Ğ°Ğ¶Ğ¸Ñ‚Ğ¸**",
        "ipa": "/zÉ‘uËˆwÉ‘Ê’ÉªtÉª/",
        "en": "to remark",
        "pos": "Ğ´Ñ–Ñ”ÑĞ».",
        "gender": null,
        "note": ""
      },
      {
        "id": "vocab-11",
        "uk": "**ÑÑ‚Ğ²ĞµÑ€Ğ´Ğ¶ÑƒĞ²Ğ°Ñ‚Ğ¸**",
        "ipa": "/stwÉ›rËˆdÊ’uwÉ‘tÉª/",
        "en": "to claim",
        "pos": "Ğ´Ñ–Ñ”ÑĞ».",
        "gender": null,
        "note": ""
      },
      {
        "id": "vocab-12",
        "uk": "**Ğ²Ğ¸Ğ·Ğ½Ğ°Ñ‚Ğ¸**",
        "ipa": "/wÉªzËˆnÉ‘tÉª/",
        "en": "to admit",
        "pos": "Ğ´Ñ–Ñ”ÑĞ».",
        "gender": null,
        "note": ""
      },
      {
        "id": "vocab-13",
        "uk": "**Ğ·Ğ°Ğ¿ĞµÑ€ĞµÑ‡Ğ¸Ñ‚Ğ¸**",
        "ipa": "/zÉ‘pÉ›ËˆrÉ›tÊƒÉªtÉª/",
        "en": "to deny",
        "pos": "Ğ´Ñ–Ñ”ÑĞ».",
        "gender": null,
        "note": ""
      },
      {
        "id": "vocab-14",
        "uk": "**Ğ¿Ñ–Ğ´Ñ‚Ğ²ĞµÑ€Ğ´Ğ¸Ñ‚Ğ¸**",
        "ipa": "/pÊ²idtwÉ›rËˆdÉªtÉª/",
        "en": "to confirm",
        "pos": "Ğ´Ñ–Ñ”ÑĞ».",
        "gender": null,
        "note": ""
      },
      {
        "id": "vocab-15",
        "uk": "**Ğ½Ğ°Ñ‚ÑĞºĞ½ÑƒÑ‚Ğ¸**",
        "ipa": "/nÉ‘ËˆtÊ²É‘knutÉª/",
        "en": "to hint",
        "pos": "Ğ´Ñ–Ñ”ÑĞ».",
        "gender": null,
        "note": ""
      },
      {
        "id": "vocab-16",
        "uk": "**Ğ·ÑÑƒĞ² Ñ‡Ğ°ÑÑƒ**",
        "ipa": "/zsuw ËˆtÊƒÉ‘su/",
        "en": "tense backshift",
        "pos": "Ğ²Ğ¸Ñ€Ğ°Ğ·",
        "gender": null,
        "note": ""
      },
      {
        "id": "vocab-17",
        "uk": "**Ğ½Ğ°ÑÑ‚ÑƒĞ¿Ğ½Ğ¾Ğ³Ğ¾ Ğ´Ğ½Ñ**",
        "ipa": "/nÉ‘sËˆtupnÉ”É¦É” dnÊ²É‘/",
        "en": "the next day",
        "pos": "Ğ²Ğ¸Ñ€Ğ°Ğ·",
        "gender": null,
        "note": ""
      },
      {
        "id": "vocab-18",
        "uk": "**Ğ½Ğ°Ğ¿ĞµÑ€ĞµĞ´Ğ¾Ğ´Ğ½Ñ–**",
        "ipa": "/nÉ‘pÉ›rÉ›ËˆdÉ”dnÊ²i/",
        "en": "the day before",
        "pos": "Ğ¿Ñ€Ğ¸ÑĞ».",
        "gender": null,
        "note": ""
      },
      {
        "id": "vocab-19",
        "uk": "**Ñ‚Ğ¾Ğ³Ğ¾ Ğ´Ğ½Ñ**",
        "ipa": "/tÉ”ËˆÉ¦É” dnÊ²É‘/",
        "en": "that day",
        "pos": "Ğ²Ğ¸Ñ€Ğ°Ğ·",
        "gender": null,
        "note": ""
      },
      {
        "id": "vocab-20",
        "uk": "**Ñ‚Ğ¾Ğ´Ñ–**",
        "ipa": "/tÉ”ËˆdÊ²i/",
        "en": "then",
        "pos": "Ğ¿Ñ€Ğ¸ÑĞ».",
        "gender": null,
        "note": ""
      },
      {
        "id": "vocab-21",
        "uk": "**Ğ¿ĞµÑ€ĞµĞºĞ°Ğ·**",
        "ipa": "/pÉ›rÉ›ËˆkÉ‘z/",
        "en": "retelling",
        "pos": "Ñ–Ğ¼. (Ñ‡.Ñ€.)",
        "gender": null,
        "note": ""
      },
      {
        "id": "vocab-22",
        "uk": "**Ñ†Ğ¸Ñ‚ÑƒĞ²Ğ°Ğ½Ğ½Ñ**",
        "ipa": "/tÍ¡sÉªtuËˆwÉ‘nÊ²É‘/",
        "en": "quotation",
        "pos": "Ñ–Ğ¼. (Ñ.Ñ€.)",
        "gender": null,
        "note": ""
      },
      {
        "id": "vocab-23",
        "uk": "**Ğ¿ĞµÑ€ĞµĞ´Ğ°Ñ‚Ğ¸**",
        "ipa": "/pÉ›rÉ›ËˆdÉ‘tÉª/",
        "en": "to convey",
        "pos": "Ğ´Ñ–Ñ”ÑĞ».",
        "gender": null,
        "note": ""
      },
      {
        "id": "vocab-24",
        "uk": "**ÑĞ¿Ğ¾Ñ‚Ğ²Ğ¾Ñ€Ğ¸Ñ‚Ğ¸**",
        "ipa": "/spÉ”twÉ”ËˆrÉªtÉª/",
        "en": "to distort",
        "pos": "Ğ´Ñ–Ñ”ÑĞ».",
        "gender": null,
        "note": ""
      },
      {
        "id": "vocab-25",
        "uk": "**ĞºĞ¾Ğ½Ñ‚ĞµĞºÑÑ‚**",
        "ipa": "/kÉ”nËˆtÉ›kst/",
        "en": "context",
        "pos": "Ñ–Ğ¼. (Ñ‡.Ñ€.)",
        "gender": null,
        "note": ""
      }
    ],
    "reviewWords": []
  }
}