{
  "$schema": "../../../schemas/vibe-module.schema.json",
  "lesson": {
    "id": "lesson-uk-B1-81",
    "moduleId": "mod-uk-B1-81",
    "languagePair": "l2-uk-en",
    "subject": "language",
    "owner": "learn-ukrainian",
    "visibility": "public",
    "language": "uk",
    "targetLevel": "B1",
    "phase": "B1.1",
    "moduleNumber": 81,
    "moduleType": "grammar",
    "pedagogy": "PPP",
    "immersionLevel": 0.6,
    "title": "Module 81",
    "titleUk": null,
    "subtitle": null,
    "description": "Module 81",
    "objectives": [],
    "objectivesUk": null,
    "grammarFocus": [],
    "tags": [],
    "totalDuration": 45,
    "transliterationMode": "none",
    "sections": [
      {
        "id": "section-1",
        "name": "Біг в Україні",
        "nameEn": null,
        "type": "content",
        "content": "## Вступ\n\nЧи замислювалися ви колись, чому в неділю вранці сотні людей у яскравих кросівках збираються в центрі Києва або Львова? Відповідь проста — в Україні триваючи справжній біговий бум! Ще десять років тому біг вважався лише нудною частиною шкільних уроків фізкультури, але сьогодні це символ успіху, здоров'я та активної життєвої позиції. Біг став не просто спортом, а потужним соціальним інструментом, що об'єднує тисячі людей різних професій та віку. Від ранкових пробіжок на самоті до масштабних міжнародних марафонів — бігова культура в Україні розвивається неймовірними темпами.\n\nУ цьому модулі ми детально дослідимо світ українського бігу. Ви дізнаєтесь про найпрестижніші забіги країни, такі як Київський марафон та напівмарафони від \"Нової Пошти\". Ми поговоримо про унікальну атмосферу бігових клубів, де люди знаходять не лише партнерів для тренувань, а й справжніх друзів. Також ми обговоримо важливий аспект благодійності, адже багато українських забігів спрямовані на допомогу дітям, лікарням або Збройним силам України. Ви вивчите специфічну лексику, яка допоможе вам зареєструватися на змагання, обговорити свій тренувальний план та розповісти про власні спортивні досягнення.\n\nМи розглянемо, як біг змінює міський простір і як громади створюють безкоштовні ініціативи, такі як Parkrun. Ви навчитеся впевнено почуватися у розмові з українськими бігунами, розуміти оголошення про спортивні події та мотивувати інших до активного способу життя. Незалежно від того, чи ви досвідчений марафонець, чи тільки думаєте про свою першу пробіжку, цей модуль відкриє для вас нові горизонти української спортивної культури. Готові до старту?\n\n> [!cultural] **Real World:**\n> В українських містах забіги часто проходять через історичні центри. Наприклад, траса Київського марафону пролягає через **Хрещатик**, повз **Софійський собор**, **Золоті ворота** та **Майдан Незалежності**. Це унікальна можливість побачити пам'ятки архітектури **Києва** без автомобілів та міської метушні.\n\n---\n\n## Презентація\n\n#### Passage 1: Розвиток бігової культури: Від хобі до способу життя\n\nБігова культура в Україні пройшла довгий шлях трансформації. Якщо раніше людину, яка біжить вулицею, могли запитати: \"За ким ти женешся?\" або \"Куди ти поспішаєш?\", то сьогодні біг — це невід'ємна частина міського пейзажу. Сучасні українці обирають біг, тому що це найдоступніший вид активності. Вам не потрібен дорогий абонемент у спортзал або складне обладнання — достатньо лише пари якісних кросівок та бажання.\n\nОдним із головних рушіїв цієї культури стала поява професійних організаторів забігів, таких як компанія **Run Ukraine**. Саме вони почали проводити заходи європейського рівня, де кожен учасник відчуває себе справжнім атлетом. Це не просто змагання, а великі спортивні фестивалі з музикою, зонами відпочинку та підтримкою вболівальників вздовж усієї дистанції. Мода на біг також тісно пов'язана з трендом на здоровий спосіб життя (ЗСЖ). Для багатьох молодих професіоналів пробіжка перед роботою — це спосіб очистити думки, зняти стрес та зарядитися енергією для інтелектуальних викликів.\n\nВажливу роль у популяризації бігу відіграють соціальні мережі. Фотографії з фінішною медаллю або скріншоти з додатку Strava мотивують тисячі інших людей вийти на першу пробіжку. Біг перестав бути самотньою активністю. По всій країні виникають бігові спільноти та клуби. Вони організовують спільні тренування, лекції про техніку бігу та правильне харчування. Це створює відчуття належності до великої та позитивної команди.\n\n> [!tip] **Чи знали ви?**\n> В Україні існує ініціатива \"Parkrun Ukraine\". Це безкоштовні щотижневі забіги на 5 кілометрів, які проводяться щосуботи вранці в парках багатьох міст, таких як **Київ**, **Львів**, **Одеса** та **Харків**. Тут немає професійного суперництва, головне — це участь, спілкування та гарний настрій на вихідні.\n\n**Comprehension Questions (3-4):**\n\n1. Як змінилося ставлення українців до бігу за останнє десятиліття?\n2. Яка компанія є одним з головних організаторів бігових заходів в Україні?\n3. Чому соціальні мережі важливі для розвитку бігової культури?\n4. Яка основна особливість ініціативи Parkrun?\n\n#### Passage 2: Найвідоміші забіги України: Атмосфера та виклики\n\nЯкщо ви запитаєте українського бігуна про головні події року, він обов'язково назве **Kyiv Marathon** (Київський марафон) та **Kyiv Half Marathon** (Київський напівмарафон). Ці заходи збирають понад 10-15 тисяч учасників. Реєстрація на такі події зазвичай відкривається за кілька місяців, а слоти на популярні дистанції розкуповують дуже швидко. Учасники сплачують стартовий внесок, який іде на організацію заходу, логістику, воду на трасі та, звісно, на виготовлення пам'ятних медалей.\n\nКиївський напівмарафон, який традиційно проходить навесні, вважається одним із найшвидших та наймальовничіших у Східній Європі. Траса зазвичай пролягає по набережній Дніпра та через історичний **Поділ**. Для багатьох бігунів це шанс встановити особистий рекорд, адже маршрут майже плоский, без крутих підйомів. Натомість повний марафон (42,195 км) у жовтні — це справжній виклик. Бігунам доводиться долати затяжні київські пагорби, що потребує серйозної фізичної та ментальної підготовки.\n\nОсобливою популярністю користується серія забігів **\"Нова Пошта напівмарафон\"**, які проходять у різних містах України: **Полтаві**, **Чернігові**, **Черкасах**, **Житомирі** та інших. Ці забіги називають \"найдушевнішими\", бо вони відкривають красу обласних центрів та залучають місцевих жителів. Кожен фінішер отримує унікальну медаль, дизайн якої часто відображає символіку конкретного міста. На фініші панує неймовірна ейфорія: виснажені, але щасливі атлети обіймаються, роблять селфі та обговорюють свій темп та результат.\n\n> [!note] **Pop Culture Moment:**\n> Українські марафони часто мають зіркових учасників. Наприклад, мер **Києва** Віталій Кличко або відомі телеведучі часто пробігають символічні дистанції, щоб підтримати спортивний дух міста та привернути увагу до благодійності. Також популярною є пісня \"Running\" українського гурту, яка стала неофіційним гімном багатьох бігових клубів.\n\n**Comprehension Questions (3-4):**\n\n1. Які дві головні бігові події Києва згадані в тексті?\n2. Що входить у вартість стартового внеску на великих забігах?\n3. Чим відрізняється весняний напівмарафон від осіннього марафону в Києві?\n4. Чому серію забігів від \"Нової Пошти\" називають \"найдушевнішими\"?\n\n#### Passage 3: Біг заради добра: Клуби, волонтери та благодійність\n\nБіг в Україні має дуже сильне соціальне забарвлення. Одним із найстаріших та найвідоміших заходів є благодійний забіг **\"Пробіг під каштанами\"**, який проходить щороку на День Києва. Тисячі людей у однакових футболках біжать **Хрещатиком**, щоб зібрати кошти для Центру дитячої кардіології та кардіохірургії. Це подія для всієї родини: є забіги для малюків, які ще тільки вчаться ходити, забіги на ходулях і навіть забіги з собаками.\n\nУспіх будь-якого марафону залежати від не лише від атлетів, а й від величезної армії волонтерів. Це люди, які безкоштовно допомагають на точках гідратації (роздають воду та фрукти), видають стартові пакети, навігують учасників на трасі та вішають медалі на шию фінішерам. Їхня підтримка неоціненна, особливо на останніх кілометрах дистанції, коли сили бігуна вже на межі. Багато хто приходить вболівати цілими сім'ями, створюючи плакати з кумедними написами: \"Біжи, наче ти вкрав цей телефон!\" або \"На фініші на тебе чекає піца!\".\n\nБігові клуби, такі як **TopRunners**, **KM Running Club** або **Adidas Runners Kyiv**, стали справжніми осередками активного життя. У клубі ви не просто тренуєтеся, ви стаєте частиною спільноти. Тренери допомагають поставити правильну техніку, щоб уникнути травм, та розробляють індивідуальні плани підготовки до змагань. Для багатьох біг став платформою для благодійних зборів. Наприклад, бігуни-фандрейзери збирають кошти на протези для ветеранів війни або на обладнання для дитячих будинків, перетворюючи свої кілометри на реальну допомогу.\n\n> [!important] **Fun Fact:**\n> Під час повномасштабної війни українські бігуни почали проводити \"віртуальні забіги\". Ви можете пробігти дистанцію в будь-якому безпечному місці світу, завантажити результат у систему та отримати медаль поштою. Усі внески від таких заходів зазвичай ідуть на гуманітарні потреби України. Найпопулярніший такий забіг зібрав учасників з 50 країн світу.\n\n**Comprehension Questions (3-4):**\n\n1. На яку мету збирають кошти під час \"Пробігу під каштанами\"?\n2. Яку роль виконують волонтери на бігових заходах?\n3. Чим корисні бігові клуби для початківців?\n4. Як змінився формат благодійних забігів під час війни?\n\n---\n\n## Практика\n\nТепер, коли ви ознайомилися з біговою культурою України, настав час закріпити знання. У розділі вправ ви знайдете завдання на перевірку розуміння текстів та використання нової лексики. Зверніть увагу на назви дистанцій, процеси підготовки та ролі учасників спортивних подій. Ви навчитеся розрізняти темп від швидкості, розуміти структуру спортивного внеску та цінувати роботу волонтерів.\n\nПам'ятайте, що в бігу, як і у вивченні мови, головне — це регулярність та поступовість. Не намагайтеся вивчити все одразу, рухайтеся у своєму темпі!\n\n---\n\n## Продукція\n\n#### Діалог 1: Реєстрація на марафон\n\n**Максим:** Привіт, Денисе! Ти чув, що вже відкрилася реєстрація на осінній забіг у Києві?\n**Денис:** Привіт! Так, бачив оголошення у Фейсбуці. Ти плануєш брати участь цього року?\n**Максим:** Обов'язково! Я хочу пробігти напівмарафон. Моя мета — встановити новий особистий рекорд. Минулого разу я пробіг за 1 годину 50 хвилин, тепер хочу швидше.\n**Денис:** Круто! А я ще вагаюся між дистанцією 5 та 10 кілометрів. Давно не тренувався через роботу.\n**Максим:** Давай на десять! Час ще є, встигнемо підготуватися. Реєструйся швидше, зараз ціна на стартовий внесок найнижча. Чим ближче до старту, тим дорожче.\n**Денис:** Справді? Тоді треба поспішати. А що входить у пакет учасника?\n**Максим:** Офіційна футболка, номер з чіпом для вимірювання часу, медаль на фініші та подарунки від спонсорів. Також на трасі будуть фрукти та вода.\n**Денис:** Звучить переконливо. Вмовив, реєструюся на десятку! Будемо готуватися разом.\n\n#### Діалог 2: Обговорення тренувального плану\n\n**Олена:** Тетяно, привіт! Ти сьогодні була на тренуванні в клубі?\n**Тетяна:** Привіт! Так, ми сьогодні бігали інтервали на стадіоні. Було дуже важко, але тренер каже, що це найкращий спосіб підвищити темп.\n**Олена:** О, інтервали — це справжній виклик для серця. Яка у вас була дистанція?\n**Тетяна:** 8 разів по 400 метрів. Я ледь добігла останнє коло. А ти як готуєшся до свого першого марафону?\n**Олена:** Я поки що просто збільшую обсяги. На вихідних пробігла свою першу \"тридцятку\". Це було неймовірно! Тепер я вірю, що зможу подолати фініш.\n**Тетяна:** 30 кілометрів — це вже серйозно. Головне зараз — не отримати травму. Не забувай про розтяжку та відпочинок.\n**Олена:** Так, я тепер уважно слухаю свій організм. Здоров'я — понад усе.\n**Тетяна:** Згодна. Побачимося на старті! Буду за тебе вболівати.\n\n#### Діалог 3: Після фінішу\n\n**Учасник:** (важко дихає) Ох, це було неймовірно! Я зробив це! Я фінішував!\n**Волонтер:** Вітаю! Ви молодець! Тримайте вашу медаль, ви її заслужили.\n**Учасник:** Дякую! Це моя перша медаль за напівмарафон. Дистанція була непростою, особливо останні три кілометри.\n**Волонтер:** Ви показали чудовий результат. Проходьте далі в зону відпочинку, там є вода та ізотоніки. Також можете зробити масаж.\n**Учасник:** О, масаж — це саме те, що мені зараз потрібно. Мої ноги просто \"кам'яні\".\n**Волонтер:** Розумію вас. Також не забудьте отримати свій яблучний пиріг, це наш традиційний бонус для фінішерів сьогодні.\n**Учасник:** Вау, дякую! Ваша підтримка та усмішки волонтерів дуже допомагали на трасі. Ви — крута команда!\n\n> [!cultural] **Real World:**\n> Для реєстрації на більшість українських марафонів вам знадобиться створити аккаунт на сайті організатора (наприклад, RunUkraine.org). Також обов'язково перевірте, чи потрібна медична довідка або спортивна страхова на вашу дистанцію. В Україні дуже популярно бігати в **Голосіївському парку** в **Києві** або в **Стрийському парку** у **Львові**.\n\n---"
      },
      {
        "id": "section-2",
        "name": "Підсумок",
        "nameEn": null,
        "type": "summary",
        "content": "У цьому модулі ми занурилися в динамічний світ бігу в Україні. Ви дізналися, що біг — це набагато більше, ніж просто пересування ногами. Це культура, яка базується на цінностях здоров'я, взаємодопомоги та постійного самовдосконалення.\n\n**Ви навчилися:**\n\n- Розповідати про розвиток бігової культури в сучасних українських містах.\n- Називати головні спортивні заходи (марафони, напівмарафони) та пояснювати їхні особливості.\n- Розуміти роль благодійності та волонтерства у спортивних подіях.\n- Спілкуватися на теми реєстрації на змагання, тренувальних планів та спортивних результатів.\n\nБіг вчить нас, що навіть найдовша дистанція починається з першого кроку. Тепер у вас є лінгвістичні інструменти, щоб стати частиною цієї великої бігової сім'ї. Не бійтеся викликів, ставте власні рекорди і пам'ятайте — головна перемога завжди над самим собою!\n\n---"
      },
      {
        "id": "section-3",
        "name": "Словник",
        "nameEn": null,
        "type": "vocabulary",
        "content": "| Слово | Вимова | English | PoS | Примітки |\n|-------|--------|---------|-----|----------|\n| біг | [b⁽ʲ⁾iɦ] | running | noun (m) | загальна назва виду спорту |\n| забіг | [zɑˈb⁽ʲ⁾iɦ] | race / run (event) | noun (m) | конкретна спортивна подія |\n| марафон | [mɑɾɑˈfɔn] | marathon | noun (m) | дистанція 42,195 км |\n| напівмарафон | [nɑˈp⁽ʲ⁾iwmɑɾɑfɔn] | half marathon | noun (m) | дистанція 21,097 км |\n| старт | [stɑɾt] | start | noun (m) | початок дистанції |\n| фініш | [fˈinʲiʃ] | finish | noun (m) | кінець дистанції |\n| медаль | [meˈdɑlʲ] | medal | noun (f) | нагорода за фініш |\n| учасник | [ʊˈt͡ʃɑsnɪk] | participant | noun (m) | той, хто бере участь |\n| реєстрація | [ɾejesˈtɾɑt͡sʲijɑ] | registration | noun (f) | процес запису на захід |\n| внесок | [wˈnɛsok] | fee / contribution | noun (m) | гроші за участь або на благодійність |\n| результат | [ɾezʊlʲˈtɑt] | result | noun (m) | час або місце після фінішу |\n| особистий рекорд | [osoˈbɪstɪj ɾeˈkɔɾd] | personal best | noun phrase (m) | найкращий власний результат |\n| рекорд | [reˈkɔrd] | record | noun (m) | найвище досягнення |\n| темп | [tɛmp] | pace | noun (m) | кількість хвилин на кілометр |\n| дистанція | [dɪsˈtɑnʲt͡sʲijɑ] | distance | noun (f) | довжина маршруту |\n| біговий клуб | [b⁽ʲ⁾iɦoˈwɪj klʊb] | running club | noun phrase (m) | спільнота бігунів |\n| клуб | [klub] | club | noun (m) | організація або спільнота |\n| тренуватися | [tɾenʊˈwɑtɪsʲɑ] | to train | verb | готувати тіло до навантажень |\n| готуватися | [ɦotʊˈwɑtɪsʲɑ] | to prepare | verb | планувати та виконувати кроки до мети |\n| брати участь | [bˈɾɑtɪ ˈut͡ʃɑsʲtʲ] | to participate | verb phrase | бути частиною заходу |\n| перемагати | [peɾemɑˈɦɑtɪ] | to win | verb | бути кращим за інших або за себе |\n| вболівати | [wbol⁽ʲ⁾iˈwɑtɪ] | to cheer for | verb | підтримувати учасників |\n| волонтер | [woɫonˈtɛɾ] | volunteer | noun (m) | помічник на безкоштовній основі |\n| благодійність | [bɫɑɦoˈd⁽ʲ⁾ijnʲisʲtʲ] | charity | noun (f) | безкорислива допомога |\n| здоров'я | [zdoˈɾowjɑ] | health | noun (n) | стан організму |\n| виклик | [wˈɪkɫɪk] | challenge | noun (m) | важке завдання, випробування |\n| команда | [koˈmɑndɑ] | team | noun (f) | група людей з однією метою |\n\n---\n\n> [!resources]\n> ## Ресурси\n>\n> #### Articles and Websites\n> * [Run Ukraine](https://runukraine.org/) - Головний організатор бігових подій в Україні\n> * [Parkrun Ukraine](https://www.facebook.com/parkrunukraine/) - Інформація про щосуботні безкоштовні забіги\n> * [Журнал \"Ногибоги\"](https://nogibogi.com/) - Популярне українське видання про біг та ЗСЖ\n> * [Пробіг під каштанами](https://probeg.com.ua/) - Офіційний сайт найстарішого благодійного забігу\n>\n> #### Videos and Media\n> * [YouTube: Як почати бігати](https://www.youtube.com/) - Відеоуроки від українських тренерів\n> * [Подкаст \"Вухами\"](https://thevillage.com.ua/) - Розмови про ментальне здоров'я та спорт\n>\n> #### Further Reading\n> * Андрій Пивоваров \"Біг\" - Книга українського автора про філософію марафонського бігу.\n\n---"
      },
      {
        "id": "section-4",
        "name": "Вправи",
        "nameEn": null,
        "type": "activities",
        "content": "Перевірте свої знання за допомогою інтерактивних вправ у наступному розділі."
      }
    ],
    "rawMarkdown": "# Біг в Україні\n\n## Вступ\n\nЧи замислювалися ви колись, чому в неділю вранці сотні людей у яскравих кросівках збираються в центрі Києва або Львова? Відповідь проста — в Україні триваючи справжній біговий бум! Ще десять років тому біг вважався лише нудною частиною шкільних уроків фізкультури, але сьогодні це символ успіху, здоров'я та активної життєвої позиції. Біг став не просто спортом, а потужним соціальним інструментом, що об'єднує тисячі людей різних професій та віку. Від ранкових пробіжок на самоті до масштабних міжнародних марафонів — бігова культура в Україні розвивається неймовірними темпами.\n\nУ цьому модулі ми детально дослідимо світ українського бігу. Ви дізнаєтесь про найпрестижніші забіги країни, такі як Київський марафон та напівмарафони від \"Нової Пошти\". Ми поговоримо про унікальну атмосферу бігових клубів, де люди знаходять не лише партнерів для тренувань, а й справжніх друзів. Також ми обговоримо важливий аспект благодійності, адже багато українських забігів спрямовані на допомогу дітям, лікарням або Збройним силам України. Ви вивчите специфічну лексику, яка допоможе вам зареєструватися на змагання, обговорити свій тренувальний план та розповісти про власні спортивні досягнення.\n\nМи розглянемо, як біг змінює міський простір і як громади створюють безкоштовні ініціативи, такі як Parkrun. Ви навчитеся впевнено почуватися у розмові з українськими бігунами, розуміти оголошення про спортивні події та мотивувати інших до активного способу життя. Незалежно від того, чи ви досвідчений марафонець, чи тільки думаєте про свою першу пробіжку, цей модуль відкриє для вас нові горизонти української спортивної культури. Готові до старту?\n\n> [!cultural] **Real World:**\n> В українських містах забіги часто проходять через історичні центри. Наприклад, траса Київського марафону пролягає через **Хрещатик**, повз **Софійський собор**, **Золоті ворота** та **Майдан Незалежності**. Це унікальна можливість побачити пам'ятки архітектури **Києва** без автомобілів та міської метушні.\n\n---\n\n## Презентація\n\n#### Passage 1: Розвиток бігової культури: Від хобі до способу життя\n\nБігова культура в Україні пройшла довгий шлях трансформації. Якщо раніше людину, яка біжить вулицею, могли запитати: \"За ким ти женешся?\" або \"Куди ти поспішаєш?\", то сьогодні біг — це невід'ємна частина міського пейзажу. Сучасні українці обирають біг, тому що це найдоступніший вид активності. Вам не потрібен дорогий абонемент у спортзал або складне обладнання — достатньо лише пари якісних кросівок та бажання.\n\nОдним із головних рушіїв цієї культури стала поява професійних організаторів забігів, таких як компанія **Run Ukraine**. Саме вони почали проводити заходи європейського рівня, де кожен учасник відчуває себе справжнім атлетом. Це не просто змагання, а великі спортивні фестивалі з музикою, зонами відпочинку та підтримкою вболівальників вздовж усієї дистанції. Мода на біг також тісно пов'язана з трендом на здоровий спосіб життя (ЗСЖ). Для багатьох молодих професіоналів пробіжка перед роботою — це спосіб очистити думки, зняти стрес та зарядитися енергією для інтелектуальних викликів.\n\nВажливу роль у популяризації бігу відіграють соціальні мережі. Фотографії з фінішною медаллю або скріншоти з додатку Strava мотивують тисячі інших людей вийти на першу пробіжку. Біг перестав бути самотньою активністю. По всій країні виникають бігові спільноти та клуби. Вони організовують спільні тренування, лекції про техніку бігу та правильне харчування. Це створює відчуття належності до великої та позитивної команди.\n\n> [!tip] **Чи знали ви?**\n> В Україні існує ініціатива \"Parkrun Ukraine\". Це безкоштовні щотижневі забіги на 5 кілометрів, які проводяться щосуботи вранці в парках багатьох міст, таких як **Київ**, **Львів**, **Одеса** та **Харків**. Тут немає професійного суперництва, головне — це участь, спілкування та гарний настрій на вихідні.\n\n**Comprehension Questions (3-4):**\n\n1. Як змінилося ставлення українців до бігу за останнє десятиліття?\n2. Яка компанія є одним з головних організаторів бігових заходів в Україні?\n3. Чому соціальні мережі важливі для розвитку бігової культури?\n4. Яка основна особливість ініціативи Parkrun?\n\n#### Passage 2: Найвідоміші забіги України: Атмосфера та виклики\n\nЯкщо ви запитаєте українського бігуна про головні події року, він обов'язково назве **Kyiv Marathon** (Київський марафон) та **Kyiv Half Marathon** (Київський напівмарафон). Ці заходи збирають понад 10-15 тисяч учасників. Реєстрація на такі події зазвичай відкривається за кілька місяців, а слоти на популярні дистанції розкуповують дуже швидко. Учасники сплачують стартовий внесок, який іде на організацію заходу, логістику, воду на трасі та, звісно, на виготовлення пам'ятних медалей.\n\nКиївський напівмарафон, який традиційно проходить навесні, вважається одним із найшвидших та наймальовничіших у Східній Європі. Траса зазвичай пролягає по набережній Дніпра та через історичний **Поділ**. Для багатьох бігунів це шанс встановити особистий рекорд, адже маршрут майже плоский, без крутих підйомів. Натомість повний марафон (42,195 км) у жовтні — це справжній виклик. Бігунам доводиться долати затяжні київські пагорби, що потребує серйозної фізичної та ментальної підготовки.\n\nОсобливою популярністю користується серія забігів **\"Нова Пошта напівмарафон\"**, які проходять у різних містах України: **Полтаві**, **Чернігові**, **Черкасах**, **Житомирі** та інших. Ці забіги називають \"найдушевнішими\", бо вони відкривають красу обласних центрів та залучають місцевих жителів. Кожен фінішер отримує унікальну медаль, дизайн якої часто відображає символіку конкретного міста. На фініші панує неймовірна ейфорія: виснажені, але щасливі атлети обіймаються, роблять селфі та обговорюють свій темп та результат.\n\n> [!note] **Pop Culture Moment:**\n> Українські марафони часто мають зіркових учасників. Наприклад, мер **Києва** Віталій Кличко або відомі телеведучі часто пробігають символічні дистанції, щоб підтримати спортивний дух міста та привернути увагу до благодійності. Також популярною є пісня \"Running\" українського гурту, яка стала неофіційним гімном багатьох бігових клубів.\n\n**Comprehension Questions (3-4):**\n\n1. Які дві головні бігові події Києва згадані в тексті?\n2. Що входить у вартість стартового внеску на великих забігах?\n3. Чим відрізняється весняний напівмарафон від осіннього марафону в Києві?\n4. Чому серію забігів від \"Нової Пошти\" називають \"найдушевнішими\"?\n\n#### Passage 3: Біг заради добра: Клуби, волонтери та благодійність\n\nБіг в Україні має дуже сильне соціальне забарвлення. Одним із найстаріших та найвідоміших заходів є благодійний забіг **\"Пробіг під каштанами\"**, який проходить щороку на День Києва. Тисячі людей у однакових футболках біжать **Хрещатиком**, щоб зібрати кошти для Центру дитячої кардіології та кардіохірургії. Це подія для всієї родини: є забіги для малюків, які ще тільки вчаться ходити, забіги на ходулях і навіть забіги з собаками.\n\nУспіх будь-якого марафону залежати від не лише від атлетів, а й від величезної армії волонтерів. Це люди, які безкоштовно допомагають на точках гідратації (роздають воду та фрукти), видають стартові пакети, навігують учасників на трасі та вішають медалі на шию фінішерам. Їхня підтримка неоціненна, особливо на останніх кілометрах дистанції, коли сили бігуна вже на межі. Багато хто приходить вболівати цілими сім'ями, створюючи плакати з кумедними написами: \"Біжи, наче ти вкрав цей телефон!\" або \"На фініші на тебе чекає піца!\".\n\nБігові клуби, такі як **TopRunners**, **KM Running Club** або **Adidas Runners Kyiv**, стали справжніми осередками активного життя. У клубі ви не просто тренуєтеся, ви стаєте частиною спільноти. Тренери допомагають поставити правильну техніку, щоб уникнути травм, та розробляють індивідуальні плани підготовки до змагань. Для багатьох біг став платформою для благодійних зборів. Наприклад, бігуни-фандрейзери збирають кошти на протези для ветеранів війни або на обладнання для дитячих будинків, перетворюючи свої кілометри на реальну допомогу.\n\n> [!important] **Fun Fact:**\n> Під час повномасштабної війни українські бігуни почали проводити \"віртуальні забіги\". Ви можете пробігти дистанцію в будь-якому безпечному місці світу, завантажити результат у систему та отримати медаль поштою. Усі внески від таких заходів зазвичай ідуть на гуманітарні потреби України. Найпопулярніший такий забіг зібрав учасників з 50 країн світу.\n\n**Comprehension Questions (3-4):**\n\n1. На яку мету збирають кошти під час \"Пробігу під каштанами\"?\n2. Яку роль виконують волонтери на бігових заходах?\n3. Чим корисні бігові клуби для початківців?\n4. Як змінився формат благодійних забігів під час війни?\n\n---\n\n## Практика\n\nТепер, коли ви ознайомилися з біговою культурою України, настав час закріпити знання. У розділі вправ ви знайдете завдання на перевірку розуміння текстів та використання нової лексики. Зверніть увагу на назви дистанцій, процеси підготовки та ролі учасників спортивних подій. Ви навчитеся розрізняти темп від швидкості, розуміти структуру спортивного внеску та цінувати роботу волонтерів.\n\nПам'ятайте, що в бігу, як і у вивченні мови, головне — це регулярність та поступовість. Не намагайтеся вивчити все одразу, рухайтеся у своєму темпі!\n\n---\n\n## Продукція\n\n#### Діалог 1: Реєстрація на марафон\n\n**Максим:** Привіт, Денисе! Ти чув, що вже відкрилася реєстрація на осінній забіг у Києві?\n**Денис:** Привіт! Так, бачив оголошення у Фейсбуці. Ти плануєш брати участь цього року?\n**Максим:** Обов'язково! Я хочу пробігти напівмарафон. Моя мета — встановити новий особистий рекорд. Минулого разу я пробіг за 1 годину 50 хвилин, тепер хочу швидше.\n**Денис:** Круто! А я ще вагаюся між дистанцією 5 та 10 кілометрів. Давно не тренувався через роботу.\n**Максим:** Давай на десять! Час ще є, встигнемо підготуватися. Реєструйся швидше, зараз ціна на стартовий внесок найнижча. Чим ближче до старту, тим дорожче.\n**Денис:** Справді? Тоді треба поспішати. А що входить у пакет учасника?\n**Максим:** Офіційна футболка, номер з чіпом для вимірювання часу, медаль на фініші та подарунки від спонсорів. Також на трасі будуть фрукти та вода.\n**Денис:** Звучить переконливо. Вмовив, реєструюся на десятку! Будемо готуватися разом.\n\n#### Діалог 2: Обговорення тренувального плану\n\n**Олена:** Тетяно, привіт! Ти сьогодні була на тренуванні в клубі?\n**Тетяна:** Привіт! Так, ми сьогодні бігали інтервали на стадіоні. Було дуже важко, але тренер каже, що це найкращий спосіб підвищити темп.\n**Олена:** О, інтервали — це справжній виклик для серця. Яка у вас була дистанція?\n**Тетяна:** 8 разів по 400 метрів. Я ледь добігла останнє коло. А ти як готуєшся до свого першого марафону?\n**Олена:** Я поки що просто збільшую обсяги. На вихідних пробігла свою першу \"тридцятку\". Це було неймовірно! Тепер я вірю, що зможу подолати фініш.\n**Тетяна:** 30 кілометрів — це вже серйозно. Головне зараз — не отримати травму. Не забувай про розтяжку та відпочинок.\n**Олена:** Так, я тепер уважно слухаю свій організм. Здоров'я — понад усе.\n**Тетяна:** Згодна. Побачимося на старті! Буду за тебе вболівати.\n\n#### Діалог 3: Після фінішу\n\n**Учасник:** (важко дихає) Ох, це було неймовірно! Я зробив це! Я фінішував!\n**Волонтер:** Вітаю! Ви молодець! Тримайте вашу медаль, ви її заслужили.\n**Учасник:** Дякую! Це моя перша медаль за напівмарафон. Дистанція була непростою, особливо останні три кілометри.\n**Волонтер:** Ви показали чудовий результат. Проходьте далі в зону відпочинку, там є вода та ізотоніки. Також можете зробити масаж.\n**Учасник:** О, масаж — це саме те, що мені зараз потрібно. Мої ноги просто \"кам'яні\".\n**Волонтер:** Розумію вас. Також не забудьте отримати свій яблучний пиріг, це наш традиційний бонус для фінішерів сьогодні.\n**Учасник:** Вау, дякую! Ваша підтримка та усмішки волонтерів дуже допомагали на трасі. Ви — крута команда!\n\n> [!cultural] **Real World:**\n> Для реєстрації на більшість українських марафонів вам знадобиться створити аккаунт на сайті організатора (наприклад, RunUkraine.org). Також обов'язково перевірте, чи потрібна медична довідка або спортивна страхова на вашу дистанцію. В Україні дуже популярно бігати в **Голосіївському парку** в **Києві** або в **Стрийському парку** у **Львові**.\n\n---\n\n# Підсумок\n\nУ цьому модулі ми занурилися в динамічний світ бігу в Україні. Ви дізналися, що біг — це набагато більше, ніж просто пересування ногами. Це культура, яка базується на цінностях здоров'я, взаємодопомоги та постійного самовдосконалення.\n\n**Ви навчилися:**\n\n- Розповідати про розвиток бігової культури в сучасних українських містах.\n- Називати головні спортивні заходи (марафони, напівмарафони) та пояснювати їхні особливості.\n- Розуміти роль благодійності та волонтерства у спортивних подіях.\n- Спілкуватися на теми реєстрації на змагання, тренувальних планів та спортивних результатів.\n\nБіг вчить нас, що навіть найдовша дистанція починається з першого кроку. Тепер у вас є лінгвістичні інструменти, щоб стати частиною цієї великої бігової сім'ї. Не бійтеся викликів, ставте власні рекорди і пам'ятайте — головна перемога завжди над самим собою!\n\n---\n\n# Словник\n\n| Слово | Вимова | English | PoS | Примітки |\n|-------|--------|---------|-----|----------|\n| біг | [b⁽ʲ⁾iɦ] | running | noun (m) | загальна назва виду спорту |\n| забіг | [zɑˈb⁽ʲ⁾iɦ] | race / run (event) | noun (m) | конкретна спортивна подія |\n| марафон | [mɑɾɑˈfɔn] | marathon | noun (m) | дистанція 42,195 км |\n| напівмарафон | [nɑˈp⁽ʲ⁾iwmɑɾɑfɔn] | half marathon | noun (m) | дистанція 21,097 км |\n| старт | [stɑɾt] | start | noun (m) | початок дистанції |\n| фініш | [fˈinʲiʃ] | finish | noun (m) | кінець дистанції |\n| медаль | [meˈdɑlʲ] | medal | noun (f) | нагорода за фініш |\n| учасник | [ʊˈt͡ʃɑsnɪk] | participant | noun (m) | той, хто бере участь |\n| реєстрація | [ɾejesˈtɾɑt͡sʲijɑ] | registration | noun (f) | процес запису на захід |\n| внесок | [wˈnɛsok] | fee / contribution | noun (m) | гроші за участь або на благодійність |\n| результат | [ɾezʊlʲˈtɑt] | result | noun (m) | час або місце після фінішу |\n| особистий рекорд | [osoˈbɪstɪj ɾeˈkɔɾd] | personal best | noun phrase (m) | найкращий власний результат |\n| рекорд | [reˈkɔrd] | record | noun (m) | найвище досягнення |\n| темп | [tɛmp] | pace | noun (m) | кількість хвилин на кілометр |\n| дистанція | [dɪsˈtɑnʲt͡sʲijɑ] | distance | noun (f) | довжина маршруту |\n| біговий клуб | [b⁽ʲ⁾iɦoˈwɪj klʊb] | running club | noun phrase (m) | спільнота бігунів |\n| клуб | [klub] | club | noun (m) | організація або спільнота |\n| тренуватися | [tɾenʊˈwɑtɪsʲɑ] | to train | verb | готувати тіло до навантажень |\n| готуватися | [ɦotʊˈwɑtɪsʲɑ] | to prepare | verb | планувати та виконувати кроки до мети |\n| брати участь | [bˈɾɑtɪ ˈut͡ʃɑsʲtʲ] | to participate | verb phrase | бути частиною заходу |\n| перемагати | [peɾemɑˈɦɑtɪ] | to win | verb | бути кращим за інших або за себе |\n| вболівати | [wbol⁽ʲ⁾iˈwɑtɪ] | to cheer for | verb | підтримувати учасників |\n| волонтер | [woɫonˈtɛɾ] | volunteer | noun (m) | помічник на безкоштовній основі |\n| благодійність | [bɫɑɦoˈd⁽ʲ⁾ijnʲisʲtʲ] | charity | noun (f) | безкорислива допомога |\n| здоров'я | [zdoˈɾowjɑ] | health | noun (n) | стан організму |\n| виклик | [wˈɪkɫɪk] | challenge | noun (m) | важке завдання, випробування |\n| команда | [koˈmɑndɑ] | team | noun (f) | група людей з однією метою |\n\n---\n\n> [!resources]\n> ## Ресурси\n>\n> #### Articles and Websites\n> * [Run Ukraine](https://runukraine.org/) - Головний організатор бігових подій в Україні\n> * [Parkrun Ukraine](https://www.facebook.com/parkrunukraine/) - Інформація про щосуботні безкоштовні забіги\n> * [Журнал \"Ногибоги\"](https://nogibogi.com/) - Популярне українське видання про біг та ЗСЖ\n> * [Пробіг під каштанами](https://probeg.com.ua/) - Офіційний сайт найстарішого благодійного забігу\n>\n> #### Videos and Media\n> * [YouTube: Як почати бігати](https://www.youtube.com/) - Відеоуроки від українських тренерів\n> * [Подкаст \"Вухами\"](https://thevillage.com.ua/) - Розмови про ментальне здоров'я та спорт\n>\n> #### Further Reading\n> * Андрій Пивоваров \"Біг\" - Книга українського автора про філософію марафонського бігу.\n\n---\n\n# Вправи\n\nПеревірте свої знання за допомогою інтерактивних вправ у наступному розділі.\n",
    "createdAt": "2026-01-02T09:01:54.238671Z",
    "modifiedAt": "2026-01-02T09:01:54.238671Z",
    "version": 2
  },
  "activities": [],
  "vocabulary": {
    "moduleId": "mod-uk-B1-81",
    "level": "B1",
    "phase": "B1.1",
    "wordCount": 27,
    "newWordCount": 27,
    "reviewWordCount": 0,
    "transliterationMode": "none",
    "words": [
      {
        "id": "vocab-1",
        "uk": "біг",
        "ipa": "[b⁽ʲ⁾iɦ]",
        "en": "running",
        "pos": "noun (m)",
        "gender": null,
        "note": ""
      },
      {
        "id": "vocab-2",
        "uk": "забіг",
        "ipa": "[zɑˈb⁽ʲ⁾iɦ]",
        "en": "race / run (event)",
        "pos": "noun (m)",
        "gender": null,
        "note": ""
      },
      {
        "id": "vocab-3",
        "uk": "марафон",
        "ipa": "[mɑɾɑˈfɔn]",
        "en": "marathon",
        "pos": "noun (m)",
        "gender": null,
        "note": ""
      },
      {
        "id": "vocab-4",
        "uk": "напівмарафон",
        "ipa": "[nɑˈp⁽ʲ⁾iwmɑɾɑfɔn]",
        "en": "half marathon",
        "pos": "noun (m)",
        "gender": null,
        "note": ""
      },
      {
        "id": "vocab-5",
        "uk": "старт",
        "ipa": "[stɑɾt]",
        "en": "start",
        "pos": "noun (m)",
        "gender": null,
        "note": ""
      },
      {
        "id": "vocab-6",
        "uk": "фініш",
        "ipa": "[fˈinʲiʃ]",
        "en": "finish",
        "pos": "noun (m)",
        "gender": null,
        "note": ""
      },
      {
        "id": "vocab-7",
        "uk": "медаль",
        "ipa": "[meˈdɑlʲ]",
        "en": "medal",
        "pos": "noun (f)",
        "gender": null,
        "note": ""
      },
      {
        "id": "vocab-8",
        "uk": "учасник",
        "ipa": "[ʊˈt͡ʃɑsnɪk]",
        "en": "participant",
        "pos": "noun (m)",
        "gender": null,
        "note": ""
      },
      {
        "id": "vocab-9",
        "uk": "реєстрація",
        "ipa": "[ɾejesˈtɾɑt͡sʲijɑ]",
        "en": "registration",
        "pos": "noun (f)",
        "gender": null,
        "note": ""
      },
      {
        "id": "vocab-10",
        "uk": "внесок",
        "ipa": "[wˈnɛsok]",
        "en": "fee / contribution",
        "pos": "noun (m)",
        "gender": null,
        "note": ""
      },
      {
        "id": "vocab-11",
        "uk": "результат",
        "ipa": "[ɾezʊlʲˈtɑt]",
        "en": "result",
        "pos": "noun (m)",
        "gender": null,
        "note": ""
      },
      {
        "id": "vocab-12",
        "uk": "особистий рекорд",
        "ipa": "[osoˈbɪstɪj ɾeˈkɔɾd]",
        "en": "personal best",
        "pos": "noun phrase (m)",
        "gender": null,
        "note": ""
      },
      {
        "id": "vocab-13",
        "uk": "рекорд",
        "ipa": "[reˈkɔrd]",
        "en": "record",
        "pos": "noun (m)",
        "gender": null,
        "note": ""
      },
      {
        "id": "vocab-14",
        "uk": "темп",
        "ipa": "[tɛmp]",
        "en": "pace",
        "pos": "noun (m)",
        "gender": null,
        "note": ""
      },
      {
        "id": "vocab-15",
        "uk": "дистанція",
        "ipa": "[dɪsˈtɑnʲt͡sʲijɑ]",
        "en": "distance",
        "pos": "noun (f)",
        "gender": null,
        "note": ""
      },
      {
        "id": "vocab-16",
        "uk": "біговий клуб",
        "ipa": "[b⁽ʲ⁾iɦoˈwɪj klʊb]",
        "en": "running club",
        "pos": "noun phrase (m)",
        "gender": null,
        "note": ""
      },
      {
        "id": "vocab-17",
        "uk": "клуб",
        "ipa": "[klub]",
        "en": "club",
        "pos": "noun (m)",
        "gender": null,
        "note": ""
      },
      {
        "id": "vocab-18",
        "uk": "тренуватися",
        "ipa": "[tɾenʊˈwɑtɪsʲɑ]",
        "en": "to train",
        "pos": "verb",
        "gender": null,
        "note": ""
      },
      {
        "id": "vocab-19",
        "uk": "готуватися",
        "ipa": "[ɦotʊˈwɑtɪsʲɑ]",
        "en": "to prepare",
        "pos": "verb",
        "gender": null,
        "note": ""
      },
      {
        "id": "vocab-20",
        "uk": "брати участь",
        "ipa": "[bˈɾɑtɪ ˈut͡ʃɑsʲtʲ]",
        "en": "to participate",
        "pos": "verb phrase",
        "gender": null,
        "note": ""
      },
      {
        "id": "vocab-21",
        "uk": "перемагати",
        "ipa": "[peɾemɑˈɦɑtɪ]",
        "en": "to win",
        "pos": "verb",
        "gender": null,
        "note": ""
      },
      {
        "id": "vocab-22",
        "uk": "вболівати",
        "ipa": "[wbol⁽ʲ⁾iˈwɑtɪ]",
        "en": "to cheer for",
        "pos": "verb",
        "gender": null,
        "note": ""
      },
      {
        "id": "vocab-23",
        "uk": "волонтер",
        "ipa": "[woɫonˈtɛɾ]",
        "en": "volunteer",
        "pos": "noun (m)",
        "gender": null,
        "note": ""
      },
      {
        "id": "vocab-24",
        "uk": "благодійність",
        "ipa": "[bɫɑɦoˈd⁽ʲ⁾ijnʲisʲtʲ]",
        "en": "charity",
        "pos": "noun (f)",
        "gender": null,
        "note": ""
      },
      {
        "id": "vocab-25",
        "uk": "здоров'я",
        "ipa": "[zdoˈɾowjɑ]",
        "en": "health",
        "pos": "noun (n)",
        "gender": null,
        "note": ""
      },
      {
        "id": "vocab-26",
        "uk": "виклик",
        "ipa": "[wˈɪkɫɪk]",
        "en": "challenge",
        "pos": "noun (m)",
        "gender": null,
        "note": ""
      },
      {
        "id": "vocab-27",
        "uk": "команда",
        "ipa": "[koˈmɑndɑ]",
        "en": "team",
        "pos": "noun (f)",
        "gender": null,
        "note": ""
      }
    ],
    "reviewWords": []
  }
}