{
  "$schema": "../../../schemas/vibe-module.schema.json",
  "lesson": {
    "id": "lesson-uk-B1-42",
    "moduleId": "mod-uk-B1-42",
    "languagePair": "l2-uk-en",
    "subject": "language",
    "owner": "curricula-opus",
    "visibility": "public",
    "language": "uk",
    "targetLevel": "B1",
    "phase": "B1.4 Advanced Grammar",
    "moduleNumber": 42,
    "moduleType": "grammar",
    "pedagogy": "TTT",
    "immersionLevel": 0.6,
    "title": "Ð”Ñ–Ñ”Ð¿Ñ€Ð¸ÑÐ»Ñ–Ð²Ð½Ð¸ÐºÐ¸ Ð½ÐµÐ´Ð¾ÐºÐ¾Ð½Ð°Ð½Ð¾Ð³Ð¾ Ð²Ð¸Ð´Ñƒ",
    "titleUk": null,
    "subtitle": "Adverbial Participles - Imperfective (-ÑŽÑ‡Ð¸/-Ð°Ñ‡Ð¸)",
    "description": "Learner can form imperfective adverbial participles using -ÑŽÑ‡Ð¸/-Ð°Ñ‡Ð¸ suffixes",
    "objectives": [
      "Learner can form imperfective adverbial participles using -ÑŽÑ‡Ð¸/-Ð°Ñ‡Ð¸ suffixes",
      "Learner can use adverbial participles to express simultaneous actions",
      "Learner understands when imperfective participles are preferred over perfective"
    ],
    "objectivesUk": null,
    "grammarFocus": [
      "Ð”Ñ–Ñ”Ð¿Ñ€Ð¸ÑÐ»Ñ–Ð²Ð½Ð¸ÐºÐ¸ Ð½ÐµÐ´Ð¾ÐºÐ¾Ð½Ð°Ð½Ð¾Ð³Ð¾ Ð²Ð¸Ð´Ñƒ",
      "Ð¡ÑƒÑ„Ñ–ÐºÑÐ¸ -ÑŽÑ‡Ð¸/-Ð°Ñ‡Ð¸",
      "ÐžÐ´Ð½Ð¾Ñ‡Ð°ÑÐ½Ñ–ÑÑ‚ÑŒ Ð´Ñ–Ð¹"
    ],
    "tags": [
      "grammar",
      "participles",
      "adverbial-participles",
      "imperfective"
    ],
    "totalDuration": 90,
    "transliterationMode": "none",
    "sections": [
      {
        "id": "section-1",
        "name": "Ð”Ñ–Ñ”Ð¿Ñ€Ð¸ÑÐ»Ñ–Ð²Ð½Ð¸ÐºÐ¸ Ð½ÐµÐ´Ð¾ÐºÐ¾Ð½Ð°Ð½Ð¾Ð³Ð¾ Ð²Ð¸Ð´Ñƒ",
        "nameEn": null,
        "type": "content",
        "content": "> ðŸŽ¯ **Ð§Ð¾Ð¼Ñƒ Ñ†Ðµ Ð²Ð°Ð¶Ð»Ð¸Ð²Ð¾?**\n>\n> Ð”Ñ–Ñ”Ð¿Ñ€Ð¸ÑÐ»Ñ–Ð²Ð½Ð¸ÐºÐ¸ â€” Ñ†Ðµ Ð¾ÑÐ¾Ð±Ð»Ð¸Ð²Ñ– Ñ„Ð¾Ñ€Ð¼Ð¸ Ð´Ñ–Ñ”ÑÐ»Ð¾Ð²Ð°, ÑÐºÑ– Ð¾Ð¿Ð¸ÑÑƒÑŽÑ‚ÑŒ Ð´Ð¾Ð´Ð°Ñ‚ÐºÐ¾Ð²Ñƒ Ð´Ñ–ÑŽ. Ð—Ð°Ð¼Ñ–ÑÑ‚ÑŒ Ð´Ð²Ð¾Ñ… Ñ€ÐµÑ‡ÐµÐ½ÑŒ (Â«Ð’Ñ–Ð½ Ñ‡Ð¸Ñ‚Ð°Ð² ÐºÐ½Ð¸Ð³Ñƒ. Ð’Ñ–Ð½ Ð¿Ð¸Ð² ÐºÐ°Ð²Ñƒ.Â») ÑƒÐºÑ€Ð°Ñ—Ð½Ñ†Ñ– ÐºÐ°Ð¶ÑƒÑ‚ÑŒ: Â«Ð§Ð¸Ñ‚Ð°ÑŽÑ‡Ð¸ ÐºÐ½Ð¸Ð³Ñƒ, Ð²Ñ–Ð½ Ð¿Ð¸Ð² ÐºÐ°Ð²Ñƒ.Â» Ð¦Ðµ Ñ€Ð¾Ð±Ð¸Ñ‚ÑŒ Ð¼Ð¾Ð²Ñƒ ÑÑ‚Ð¸ÑÐ»Ð¾ÑŽ, ÐµÐ»ÐµÐ³Ð°Ð½Ñ‚Ð½Ð¾ÑŽ Ñ‚Ð° Ð¿Ñ€Ð¸Ñ€Ð¾Ð´Ð½Ð¾ÑŽ. Ð”Ñ–Ñ”Ð¿Ñ€Ð¸ÑÐ»Ñ–Ð²Ð½Ð¸ÐºÐ¸ Ð½ÐµÐ´Ð¾ÐºÐ¾Ð½Ð°Ð½Ð¾Ð³Ð¾ Ð²Ð¸Ð´Ñƒ Ð¿Ð¾ÐºÐ°Ð·ÑƒÑŽÑ‚ÑŒ **Ð¾Ð´Ð½Ð¾Ñ‡Ð°ÑÐ½Ñ–ÑÑ‚ÑŒ** Ð´Ñ–Ð¹ â€” ÐºÐ¾Ð»Ð¸ Ð´Ð²Ñ– Ñ€ÐµÑ‡Ñ– Ð²Ñ–Ð´Ð±ÑƒÐ²Ð°ÑŽÑ‚ÑŒÑÑ Ð² Ð¾Ð´Ð¸Ð½ Ñ– Ñ‚Ð¾Ð¹ ÑÐ°Ð¼Ð¸Ð¹ Ð¼Ð¾Ð¼ÐµÐ½Ñ‚ Ñ‡Ð°ÑÑƒ. ÐžÐ¿Ð°Ð½ÑƒÐ²Ð°Ð²ÑˆÐ¸ Ñ†ÑŽ Ð²Ð°Ð¶Ð»Ð¸Ð²Ñƒ Ð³Ñ€Ð°Ð¼Ð°Ñ‚Ð¸Ñ‡Ð½Ñƒ Ñ„Ð¾Ñ€Ð¼Ñƒ, Ð²Ð¸ Ð·Ð¼Ð¾Ð¶ÐµÑ‚Ðµ Ð³Ð¾Ð²Ð¾Ñ€Ð¸Ñ‚Ð¸ Ð¿Ñ€Ð¸Ñ€Ð¾Ð´Ð½Ñ–ÑˆÐµ Ñ– Ð·Ñ€Ð¾Ð·ÑƒÐ¼Ñ–Ñ‚Ð¸ ÑÐºÐ»Ð°Ð´Ð½Ñ–ÑˆÑ– ÑƒÐºÑ€Ð°Ñ—Ð½ÑÑŒÐºÑ– Ñ‚ÐµÐºÑÑ‚Ð¸.\n\n---\n\n## Ð”Ñ–Ð°Ð³Ð½Ð¾ÑÑ‚Ð¸ÐºÐ°\n\nÐŸÐ¾Ñ€Ñ–Ð²Ð½ÑÐ¹Ñ‚Ðµ Ð´Ð²Ð° Ð²Ð°Ñ€Ñ–Ð°Ð½Ñ‚Ð¸ ÐºÐ¾Ð¶Ð½Ð¾Ð³Ð¾ Ñ€ÐµÑ‡ÐµÐ½Ð½Ñ:\n\n**ÐŸÐ°Ñ€Ð° 1:**\n- Ð’Ñ–Ð½ Ð¹ÑˆÐ¾Ð² Ð²ÑƒÐ»Ð¸Ñ†ÐµÑŽ. Ð’Ñ–Ð½ Ñ€Ð¾Ð·Ð¼Ð¾Ð²Ð»ÑÐ² Ð¿Ð¾ Ñ‚ÐµÐ»ÐµÑ„Ð¾Ð½Ñƒ.\n- **Ð™Ð´ÑƒÑ‡Ð¸ Ð²ÑƒÐ»Ð¸Ñ†ÐµÑŽ**, Ð²Ñ–Ð½ Ñ€Ð¾Ð·Ð¼Ð¾Ð²Ð»ÑÐ² Ð¿Ð¾ Ñ‚ÐµÐ»ÐµÑ„Ð¾Ð½Ñƒ.\n\n**ÐŸÐ°Ñ€Ð° 2:**\n- Ð’Ð¾Ð½Ð° ÑÐ»ÑƒÑ…Ð°Ð»Ð° Ð¼ÑƒÐ·Ð¸ÐºÑƒ. Ð’Ð¾Ð½Ð° Ð³Ð¾Ñ‚ÑƒÐ²Ð°Ð»Ð° Ð²ÐµÑ‡ÐµÑ€ÑŽ.\n- **Ð¡Ð»ÑƒÑ…Ð°ÑŽÑ‡Ð¸ Ð¼ÑƒÐ·Ð¸ÐºÑƒ**, Ð²Ð¾Ð½Ð° Ð³Ð¾Ñ‚ÑƒÐ²Ð°Ð»Ð° Ð²ÐµÑ‡ÐµÑ€ÑŽ.\n\n**ÐŸÐ°Ñ€Ð° 3:**\n- Ð¡Ñ‚ÑƒÐ´ÐµÐ½Ñ‚Ð¸ ÑÐ¸Ð´Ñ–Ð»Ð¸ Ð² Ð°ÑƒÐ´Ð¸Ñ‚Ð¾Ñ€Ñ–Ñ—. Ð¡Ñ‚ÑƒÐ´ÐµÐ½Ñ‚Ð¸ Ð·Ð°Ð¿Ð¸ÑÑƒÐ²Ð°Ð»Ð¸ Ð»ÐµÐºÑ†Ñ–ÑŽ.\n- **Ð¡Ð¸Ð´ÑÑ‡Ð¸ Ð² Ð°ÑƒÐ´Ð¸Ñ‚Ð¾Ñ€Ñ–Ñ—**, ÑÑ‚ÑƒÐ´ÐµÐ½Ñ‚Ð¸ Ð·Ð°Ð¿Ð¸ÑÑƒÐ²Ð°Ð»Ð¸ Ð»ÐµÐºÑ†Ñ–ÑŽ.\n\nÐ—Ð²ÐµÑ€Ð½Ñ–Ñ‚ÑŒ ÑƒÐ²Ð°Ð³Ñƒ Ð½Ð° Ð²Ð¸Ð´Ñ–Ð»ÐµÐ½Ñ– ÑÐ»Ð¾Ð²Ð°: **Ð¹Ð´ÑƒÑ‡Ð¸**, **ÑÐ»ÑƒÑ…Ð°ÑŽÑ‡Ð¸**, **ÑÐ¸Ð´ÑÑ‡Ð¸**. Ð¦Ðµ Ð´Ñ–Ñ”Ð¿Ñ€Ð¸ÑÐ»Ñ–Ð²Ð½Ð¸ÐºÐ¸ Ð½ÐµÐ´Ð¾ÐºÐ¾Ð½Ð°Ð½Ð¾Ð³Ð¾ Ð²Ð¸Ð´Ñƒ. Ð’Ð¾Ð½Ð¸ ÑƒÑ‚Ð²Ð¾Ñ€ÑŽÑŽÑ‚ÑŒÑÑ Ð²Ñ–Ð´ Ð´Ñ–Ñ”ÑÐ»Ñ–Ð² Ð½ÐµÐ´Ð¾ÐºÐ¾Ð½Ð°Ð½Ð¾Ð³Ð¾ Ð²Ð¸Ð´Ñƒ Ñ– Ð¿Ð¾ÐºÐ°Ð·ÑƒÑŽÑ‚ÑŒ, Ñ‰Ð¾ Ð´Ð²Ñ– Ð´Ñ–Ñ— Ð²Ñ–Ð´Ð±ÑƒÐ²Ð°ÑŽÑ‚ÑŒÑÑ **Ð¾Ð´Ð½Ð¾Ñ‡Ð°ÑÐ½Ð¾**. Ð¦Ñ– Ñ„Ð¾Ñ€Ð¼Ð¸ Ñ” Ñ…Ð°Ñ€Ð°ÐºÑ‚ÐµÑ€Ð½Ð¾ÑŽ Ð¾Ð·Ð½Ð°ÐºÐ¾ÑŽ ÑÑƒÑ‡Ð°ÑÐ½Ð¾Ñ— ÑƒÐºÑ€Ð°Ñ—Ð½ÑÑŒÐºÐ¾Ñ— Ð¼Ð¾Ð²Ð¸ Ñ– ÑˆÐ¸Ñ€Ð¾ÐºÐ¾ Ð²Ð¶Ð¸Ð²Ð°ÑŽÑ‚ÑŒÑÑ ÑÐº Ñƒ Ñ€Ð¾Ð·Ð¼Ð¾Ð²Ð½Ð¾Ð¼Ñƒ, Ñ‚Ð°Ðº Ñ– Ð² Ð¾Ñ„Ñ–Ñ†Ñ–Ð¹Ð½Ð¾Ð¼Ñƒ Ð¼Ð¾Ð²Ð»ÐµÐ½Ð½Ñ–.\n\n---\n\n## ÐŸÐ¾ÑÑÐ½ÐµÐ½Ð½Ñ\n\n### Ð©Ð¾ Ñ‚Ð°ÐºÐµ Ð´Ñ–Ñ”Ð¿Ñ€Ð¸ÑÐ»Ñ–Ð²Ð½Ð¸Ðº?\n\nÐ”Ñ–Ñ”Ð¿Ñ€Ð¸ÑÐ»Ñ–Ð²Ð½Ð¸Ðº â€” Ñ†Ðµ Ð½ÐµÐ·Ð¼Ñ–Ð½ÑŽÐ²Ð°Ð½Ð° Ñ„Ð¾Ñ€Ð¼Ð° Ð´Ñ–Ñ”ÑÐ»Ð¾Ð²Ð°, ÑÐºÐ° Ð¾Ð¿Ð¸ÑÑƒÑ” **Ð´Ð¾Ð´Ð°Ñ‚ÐºÐ¾Ð²Ñƒ Ð´Ñ–ÑŽ** Ð¿Ñ€Ð¸ Ð¾ÑÐ½Ð¾Ð²Ð½Ð¾Ð¼Ñƒ Ð´Ñ–Ñ”ÑÐ»Ð¾Ð²Ñ– Ð² Ñ€ÐµÑ‡ÐµÐ½Ð½Ñ–. Ð”Ñ–Ñ”Ð¿Ñ€Ð¸ÑÐ»Ñ–Ð²Ð½Ð¸Ðº Ð²Ñ–Ð´Ð¿Ð¾Ð²Ñ–Ð´Ð°Ñ” Ð½Ð° Ð¿Ð¸Ñ‚Ð°Ð½Ð½Ñ: **Ð¯Ðº?**, **ÐšÐ¾Ð»Ð¸?**, **Ð©Ð¾ Ñ€Ð¾Ð±Ð»ÑÑ‡Ð¸?**\n\nÐÐ° Ð²Ñ–Ð´Ð¼Ñ–Ð½Ñƒ Ð²Ñ–Ð´ Ñ–Ð½ÑˆÐ¸Ñ… Ð´Ñ–Ñ”ÑÐ»Ñ–Ð²Ð½Ð¸Ñ… Ñ„Ð¾Ñ€Ð¼, Ð´Ñ–Ñ”Ð¿Ñ€Ð¸ÑÐ»Ñ–Ð²Ð½Ð¸ÐºÐ¸ Ð½Ðµ Ð·Ð¼Ñ–Ð½ÑŽÑŽÑ‚ÑŒÑÑ Ð·Ð° Ñ€Ð¾Ð´Ð°Ð¼Ð¸, Ñ‡Ð¸ÑÐ»Ð°Ð¼Ð¸, Ð¾ÑÐ¾Ð±Ð°Ð¼Ð¸ Ñ‡Ð¸ Ñ‡Ð°ÑÐ°Ð¼Ð¸. Ð’Ð¾Ð½Ð¸ Ð·Ð°Ð²Ð¶Ð´Ð¸ Ð²Ð¸Ñ€Ð°Ð¶Ð°ÑŽÑ‚ÑŒ Ð´Ñ–ÑŽ, Ñ‰Ð¾ ÑÑƒÐ¿Ñ€Ð¾Ð²Ð¾Ð´Ð¶ÑƒÑ” Ð¾ÑÐ½Ð¾Ð²Ð½Ðµ Ð´Ñ–Ñ”ÑÐ»Ð¾Ð²Ð¾ Ð² Ñ€ÐµÑ‡ÐµÐ½Ð½Ñ–. Ð¡Ð°Ð¼Ðµ Ñ†Ñ Ð½ÐµÐ·Ð¼Ñ–Ð½ÑŽÐ²Ð°Ð½Ñ–ÑÑ‚ÑŒ Ñ€Ð¾Ð±Ð¸Ñ‚ÑŒ Ñ—Ñ… Ð´ÑƒÐ¶Ðµ Ð·Ñ€ÑƒÑ‡Ð½Ð¸Ð¼Ð¸ Ð² Ð¼Ð¾Ð²Ð»ÐµÐ½Ð½Ñ–: Ð²Ð¸ Ð²Ð¸Ð²Ñ‡Ð°Ñ”Ñ‚Ðµ Ð¾Ð´Ð½Ñƒ Ñ„Ð¾Ñ€Ð¼Ñƒ Ñ– Ð²Ð¸ÐºÐ¾Ñ€Ð¸ÑÑ‚Ð¾Ð²ÑƒÑ”Ñ‚Ðµ Ñ—Ñ— Ð² Ð±ÑƒÐ´ÑŒ-ÑÐºÐ¾Ð¼Ñƒ ÐºÐ¾Ð½Ñ‚ÐµÐºÑÑ‚Ñ–.\n\nÐ”Ñ–Ñ”Ð¿Ñ€Ð¸ÑÐ»Ñ–Ð²Ð½Ð¸ÐºÐ¸ Ñ‡Ð°ÑÑ‚Ð¾ Ð½Ð°Ð·Ð¸Ð²Ð°ÑŽÑ‚ÑŒ Â«Ð´Ñ–Ñ”ÑÐ»Ñ–Ð²Ð½Ð¸Ð¼Ð¸ Ð¿Ñ€Ð¸ÑÐ»Ñ–Ð²Ð½Ð¸ÐºÐ°Ð¼Ð¸Â», Ñ‚Ð¾Ð¼Ñƒ Ñ‰Ð¾ Ð²Ð¾Ð½Ð¸ Ñ„ÑƒÐ½ÐºÑ†Ñ–Ð¾Ð½ÑƒÑŽÑ‚ÑŒ ÑÐº Ð¾Ð±ÑÑ‚Ð°Ð²Ð¸Ð½Ð¸ Ð² Ñ€ÐµÑ‡ÐµÐ½Ð½Ñ–, Ð¾Ð¿Ð¸ÑÑƒÑŽÑ‡Ð¸ Ð¾Ð±ÑÑ‚Ð°Ð²Ð¸Ð½Ð¸, Ð·Ð° ÑÐºÐ¸Ñ… Ð²Ñ–Ð´Ð±ÑƒÐ²Ð°Ñ”Ñ‚ÑŒÑÑ Ð¾ÑÐ½Ð¾Ð²Ð½Ð° Ð´Ñ–Ñ. ÐŸÐ¾Ñ€Ñ–Ð²Ð½ÑÐ¹Ñ‚Ðµ:\n- Ð’Ñ–Ð½ **ÑˆÐ²Ð¸Ð´ÐºÐ¾** Ð±Ñ–Ð³. (Ð¿Ñ€Ð¸ÑÐ»Ñ–Ð²Ð½Ð¸Ðº Ð¾Ð¿Ð¸ÑÑƒÑ” ÑÐº)\n- Ð’Ñ–Ð½ Ð±Ñ–Ð³, **ÑƒÑÐ¼Ñ–Ñ…Ð°ÑŽÑ‡Ð¸ÑÑŒ**. (Ð´Ñ–Ñ”Ð¿Ñ€Ð¸ÑÐ»Ñ–Ð²Ð½Ð¸Ðº Ð¾Ð¿Ð¸ÑÑƒÑ” ÑÑƒÐ¿Ñ€Ð¾Ð²Ñ–Ð´Ð½Ñƒ Ð´Ñ–ÑŽ)\n\n### Ð£Ñ‚Ð²Ð¾Ñ€ÐµÐ½Ð½Ñ Ð´Ñ–Ñ”Ð¿Ñ€Ð¸ÑÐ»Ñ–Ð²Ð½Ð¸ÐºÑ–Ð² Ð½ÐµÐ´Ð¾ÐºÐ¾Ð½Ð°Ð½Ð¾Ð³Ð¾ Ð²Ð¸Ð´Ñƒ\n\n**Ð¤Ð¾Ñ€Ð¼ÑƒÐ»Ð°:** Ð¾ÑÐ½Ð¾Ð²Ð° Ñ‚ÐµÐ¿ÐµÑ€Ñ–ÑˆÐ½ÑŒÐ¾Ð³Ð¾ Ñ‡Ð°ÑÑƒ + **-ÑŽÑ‡Ð¸** (Ð¿Ñ–ÑÐ»Ñ Ð³Ð¾Ð»Ð¾ÑÐ½Ð¾Ñ—) Ð°Ð±Ð¾ **-Ð°Ñ‡Ð¸** (Ð¿Ñ–ÑÐ»Ñ Ð¿Ñ€Ð¸Ð³Ð¾Ð»Ð¾ÑÐ½Ð¾Ñ—)\n\n| Ð†Ð½Ñ„Ñ–Ð½Ñ–Ñ‚Ð¸Ð² | ÐžÑÐ½Ð¾Ð²Ð° | Ð¡ÑƒÑ„Ñ–ÐºÑ | Ð”Ñ–Ñ”Ð¿Ñ€Ð¸ÑÐ»Ñ–Ð²Ð½Ð¸Ðº |\n|-----------|--------|--------|---------------|\n| Ñ‡Ð¸Ñ‚Ð°Ñ‚Ð¸ | Ñ‡Ð¸Ñ‚Ð°- | -ÑŽÑ‡Ð¸ | **Ñ‡Ð¸Ñ‚Ð°ÑŽÑ‡Ð¸** |\n| Ð¿Ð¸ÑÐ°Ñ‚Ð¸ | Ð¿Ð¸Ñˆ- | -ÑƒÑ‡Ð¸ | **Ð¿Ð¸ÑˆÑƒÑ‡Ð¸** |\n| Ð³Ð¾Ð²Ð¾Ñ€Ð¸Ñ‚Ð¸ | Ð³Ð¾Ð²Ð¾Ñ€- | -ÑÑ‡Ð¸ | **Ð³Ð¾Ð²Ð¾Ñ€ÑÑ‡Ð¸** |\n| ÑÐ»ÑƒÑ…Ð°Ñ‚Ð¸ | ÑÐ»ÑƒÑ…Ð°- | -ÑŽÑ‡Ð¸ | **ÑÐ»ÑƒÑ…Ð°ÑŽÑ‡Ð¸** |\n| Ð±Ñ–Ð³Ñ‚Ð¸ | Ð±Ñ–Ð¶- | -Ð°Ñ‡Ð¸ | **Ð±Ñ–Ð¶Ð°Ñ‡Ð¸** |\n| Ð¹Ñ‚Ð¸ | Ð¹Ð´- | -ÑƒÑ‡Ð¸ | **Ð¹Ð´ÑƒÑ‡Ð¸** |\n| ÑÑ‚Ð¾ÑÑ‚Ð¸ | ÑÑ‚Ð¾- | -ÑÑ‡Ð¸ | **ÑÑ‚Ð¾ÑÑ‡Ð¸** |\n| ÑÐ¸Ð´Ñ–Ñ‚Ð¸ | ÑÐ¸Ð´- | -ÑÑ‡Ð¸ | **ÑÐ¸Ð´ÑÑ‡Ð¸** |\n| Ð»ÐµÐ¶Ð°Ñ‚Ð¸ | Ð»ÐµÐ¶- | -Ð°Ñ‡Ð¸ | **Ð»ÐµÐ¶Ð°Ñ‡Ð¸** |\n| Ñ—ÑÑ‚Ð¸ | Ñ—Ð´- | -ÑƒÑ‡Ð¸ | **Ñ—Ð´ÑƒÑ‡Ð¸** |\n| Ð²ÐµÑÑ‚Ð¸ | Ð²ÐµÐ´- | -ÑƒÑ‡Ð¸ | **Ð²ÐµÐ´ÑƒÑ‡Ð¸** |\n| Ð½ÐµÑÑ‚Ð¸ | Ð½ÐµÑ- | -ÑƒÑ‡Ð¸ | **Ð½ÐµÑÑƒÑ‡Ð¸** |\n\n**ÐŸÑ€Ð¸ÐºÐ»Ð°Ð´Ð¸ Ð² Ñ€ÐµÑ‡ÐµÐ½Ð½ÑÑ…:**\n\n- **Ð§Ð¸Ñ‚Ð°ÑŽÑ‡Ð¸** Ñ†ÑŽ ÐºÐ½Ð¸Ð³Ñƒ, Ñ Ð´Ñ–Ð·Ð½Ð°Ð²ÑÑ Ð±Ð°Ð³Ð°Ñ‚Ð¾ Ð½Ð¾Ð²Ð¾Ð³Ð¾ Ð¿Ñ€Ð¾ ÑƒÐºÑ€Ð°Ñ—Ð½ÑÑŒÐºÑƒ ÐºÑƒÐ»ÑŒÑ‚ÑƒÑ€Ñƒ.\n- Ð¥ÑƒÐ´Ð¾Ð¶Ð½Ð¸Ðº Ð¼Ð°Ð»ÑŽÐ²Ð°Ð² ÐºÐ°Ñ€Ñ‚Ð¸Ð½Ñƒ, **ÑÐ¿Ñ–Ð²Ð°ÑŽÑ‡Ð¸** Ð²ÐµÑÐµÐ»Ñƒ Ð¿Ñ–ÑÐ½ÑŽ.\n- **ÐŸÐ¸ÑˆÑƒÑ‡Ð¸** Ð»Ð¸ÑÑ‚Ð°, Ð²Ð¾Ð½Ð° Ð·Ð³Ð°Ð´ÑƒÐ²Ð°Ð»Ð° Ð¼Ð¸Ð½ÑƒÐ»Ñ– Ñ‡Ð°ÑÐ¸ Ð² ÐžÐ´ÐµÑÑ–.\n- Ð¡Ñ‚ÑƒÐ´ÐµÐ½Ñ‚Ð¸ **ÑÐ»ÑƒÑ…Ð°ÑŽÑ‡Ð¸** Ð»ÐµÐºÑ†Ñ–ÑŽ, Ð·Ð°Ð¿Ð¸ÑÑƒÐ²Ð°Ð»Ð¸ ÐºÐ»ÑŽÑ‡Ð¾Ð²Ñ– Ñ‚ÐµÐ·Ð¸ Ð´Ð¾ Ð·Ð¾ÑˆÐ¸Ñ‚Ñ–Ð².\n\n> ðŸ’¡ **Ð—Ð²ÐµÑ€Ð½Ñ–Ñ‚ÑŒ ÑƒÐ²Ð°Ð³Ñƒ!**\n>\n> Ð”Ñ–Ñ”Ð¿Ñ€Ð¸ÑÐ»Ñ–Ð²Ð½Ð¸ÐºÐ¸ ÑƒÑ‚Ð²Ð¾Ñ€ÑŽÑŽÑ‚ÑŒÑÑ Ð²Ñ–Ð´ Ð¾ÑÐ½Ð¾Ð²Ð¸ **Ñ‚ÐµÐ¿ÐµÑ€Ñ–ÑˆÐ½ÑŒÐ¾Ð³Ð¾ Ñ‡Ð°ÑÑƒ**, Ð° Ð½Ðµ Ð²Ñ–Ð´ Ñ–Ð½Ñ„Ñ–Ð½Ñ–Ñ‚Ð¸Ð²Ð°. Ð¢Ð¾Ð¼Ñƒ: Ð¿Ð¸ÑÐ°Ñ‚Ð¸ â†’ Ð¿Ð¸Ñˆ-ÑƒÑ‡Ð¸ (Ð½Ðµ Ð¿Ð¸ÑÐ°-ÑŽÑ‡Ð¸), Ð±Ñ–Ð³Ñ‚Ð¸ â†’ Ð±Ñ–Ð¶-Ð°Ñ‡Ð¸ (Ð½Ðµ Ð±Ñ–Ð³-ÑŽÑ‡Ð¸).\n\n### Ð ÐµÑ„Ð»ÐµÐºÑÐ¸Ð²Ð½Ñ– Ð´Ñ–Ñ”Ð¿Ñ€Ð¸ÑÐ»Ñ–Ð²Ð½Ð¸ÐºÐ¸\n\nÐ¯ÐºÑ‰Ð¾ Ð´Ñ–Ñ”ÑÐ»Ð¾Ð²Ð¾ Ð·Ð²Ð¾Ñ€Ð¾Ñ‚Ð½Ðµ (Ð· Ñ‡Ð°ÑÑ‚ÐºÐ¾ÑŽ -ÑÑ), Ð´Ñ–Ñ”Ð¿Ñ€Ð¸ÑÐ»Ñ–Ð²Ð½Ð¸Ðº Ñ‚Ð°ÐºÐ¾Ð¶ Ð¼Ð°Ñ” Ñ‡Ð°ÑÑ‚ÐºÑƒ **-ÑÑŒ**:\n\n| Ð†Ð½Ñ„Ñ–Ð½Ñ–Ñ‚Ð¸Ð² | Ð”Ñ–Ñ”Ð¿Ñ€Ð¸ÑÐ»Ñ–Ð²Ð½Ð¸Ðº |\n|-----------|---------------|\n| Ð²Ð¼Ð¸Ð²Ð°Ñ‚Ð¸ÑÑ | **Ð²Ð¼Ð¸Ð²Ð°ÑŽÑ‡Ð¸ÑÑŒ** |\n| Ð¾Ð´ÑÐ³Ð°Ñ‚Ð¸ÑÑ | **Ð¾Ð´ÑÐ³Ð°ÑŽÑ‡Ð¸ÑÑŒ** |\n| Ð¿Ð¾Ð²ÐµÑ€Ñ‚Ð°Ñ‚Ð¸ÑÑ | **Ð¿Ð¾Ð²ÐµÑ€Ñ‚Ð°ÑŽÑ‡Ð¸ÑÑŒ** |\n| Ð³Ð¾Ñ‚ÑƒÐ²Ð°Ñ‚Ð¸ÑÑ | **Ð³Ð¾Ñ‚ÑƒÑŽÑ‡Ð¸ÑÑŒ** |\n| Ð´Ð¸Ð²Ð¸Ñ‚Ð¸ÑÑ | **Ð´Ð¸Ð²Ð»ÑÑ‡Ð¸ÑÑŒ** |\n| ÑƒÑÐ¼Ñ–Ñ…Ð°Ñ‚Ð¸ÑÑ | **ÑƒÑÐ¼Ñ–Ñ…Ð°ÑŽÑ‡Ð¸ÑÑŒ** |\n\nÐ—Ð²ÐµÑ€Ð½Ñ–Ñ‚ÑŒ ÑƒÐ²Ð°Ð³Ñƒ, Ñ‰Ð¾ Ñ‡Ð°ÑÑ‚ÐºÐ° **-ÑÑŒ** Ñƒ Ð´Ñ–Ñ”Ð¿Ñ€Ð¸ÑÐ»Ñ–Ð²Ð½Ð¸ÐºÐ°Ñ… Ð·Ð°Ð²Ð¶Ð´Ð¸ ÑÑ‚Ð¾Ñ—Ñ‚ÑŒ Ñƒ ÐºÑ–Ð½Ñ†Ñ– ÑÐ»Ð¾Ð²Ð°, Ð½Ð° Ð²Ñ–Ð´Ð¼Ñ–Ð½Ñƒ Ð²Ñ–Ð´ Ñ–Ð½Ñ„Ñ–Ð½Ñ–Ñ‚Ð¸Ð²Ð°, Ð´Ðµ Ñ‡Ð°ÑÑ‚ÐºÐ° **-ÑÑ** Ð¼Ð¾Ð¶Ðµ Ð¼Ð°Ñ‚Ð¸ Ð²Ð°Ñ€Ñ–Ð°Ð½Ñ‚ **-ÑÑŒ** Ð¿Ñ–ÑÐ»Ñ Ð³Ð¾Ð»Ð¾ÑÐ½Ð¾Ñ—. Ð£ Ð´Ñ–Ñ”Ð¿Ñ€Ð¸ÑÐ»Ñ–Ð²Ð½Ð¸ÐºÐ°Ñ… Ð²Ð°Ñ€Ñ–Ð°Ð½Ñ‚ **-ÑÑŒ** Ñ” Ð¾Ð±Ð¾Ð²'ÑÐ·ÐºÐ¾Ð²Ð¸Ð¼ Ð½ÐµÐ·Ð°Ð»ÐµÐ¶Ð½Ð¾ Ð²Ñ–Ð´ Ð¿Ð¾Ð¿ÐµÑ€ÐµÐ´Ð½ÑŒÐ¾Ð³Ð¾ Ð·Ð²ÑƒÐºÑƒ. Ð¦Ðµ Ð²Ð°Ð¶Ð»Ð¸Ð²Ð° Ñ„Ð¾Ð½ÐµÑ‚Ð¸Ñ‡Ð½Ð° Ð¾ÑÐ¾Ð±Ð»Ð¸Ð²Ñ–ÑÑ‚ÑŒ ÑƒÐºÑ€Ð°Ñ—Ð½ÑÑŒÐºÐ¾Ñ— Ð¼Ð¾Ð²Ð¸, ÑÐºÐ° Ð²Ñ–Ð´Ñ€Ñ–Ð·Ð½ÑÑ” Ñ—Ñ— Ð²Ñ–Ð´ Ð±Ð°Ð³Ð°Ñ‚ÑŒÐ¾Ñ… Ñ–Ð½ÑˆÐ¸Ñ… ÑÐ»Ð¾Ð²'ÑÐ½ÑÑŒÐºÐ¸Ñ… Ð¼Ð¾Ð².\n\n**ÐŸÑ€Ð¸ÐºÐ»Ð°Ð´Ð¸ Ð·Ñ– Ð·Ð²Ð¾Ñ€Ð¾Ñ‚Ð½Ð¸Ð¼Ð¸ Ð´Ñ–Ñ”Ð¿Ñ€Ð¸ÑÐ»Ñ–Ð²Ð½Ð¸ÐºÐ°Ð¼Ð¸:**\n\n- **ÐŸÐ¾Ð²ÐµÑ€Ñ‚Ð°ÑŽÑ‡Ð¸ÑÑŒ** Ð· ÐšÐ°Ñ€Ð¿Ð°Ñ‚, Ñ‚ÑƒÑ€Ð¸ÑÑ‚Ð¸ Ð·Ð°Ñ…Ð¾Ð¿Ð»ÑŽÐ²Ð°Ð»Ð¸ÑÑ ÐºÑ€Ð°Ñ”Ð²Ð¸Ð´Ð°Ð¼Ð¸.\n- Ð’Ð¾Ð½Ð° ÑÑ‚Ð¾ÑÐ»Ð° Ð±Ñ–Ð»Ñ Ð²Ñ–ÐºÐ½Ð°, **ÑƒÑÐ¼Ñ–Ñ…Ð°ÑŽÑ‡Ð¸ÑÑŒ** Ñ‚ÐµÐ¿Ð»Ð¾Ð¼Ñƒ Ñ€Ð°Ð½ÐºÐ¾Ð²Ð¾Ð¼Ñƒ ÑÐ¾Ð½Ñ†ÑŽ.\n- **Ð“Ð¾Ñ‚ÑƒÑŽÑ‡Ð¸ÑÑŒ** Ð´Ð¾ Ð²Ð¸ÑÑ‚ÑƒÐ¿Ñƒ Ñƒ Ð›ÑŒÐ²Ñ–Ð²ÑÑŒÐºÑ–Ð¹ Ð¾Ð¿ÐµÑ€Ñ–, ÑÐ¿Ñ–Ð²Ð°Ñ‡ÐºÐ° Ð¿Ð¾Ð²Ñ‚Ð¾Ñ€ÑŽÐ²Ð°Ð»Ð° Ð°Ñ€Ñ–Ñ—.\n- Ð”Ñ–Ñ‚Ð¸ Ð±Ñ–Ð³Ð°Ð»Ð¸ Ð¿Ð¾ Ð´Ð²Ð¾Ñ€Ñƒ, **ÑÐ¼Ñ–ÑŽÑ‡Ð¸ÑÑŒ** Ñ– **Ñ€Ð°Ð´Ñ–ÑŽÑ‡Ð¸ÑÑŒ** Ñ‚ÐµÐ¿Ð»Ñ–Ð¹ Ð¿Ð¾Ð³Ð¾Ð´Ñ–.\n\n### Ð¤Ð¾Ð½ÐµÑ‚Ð¸Ñ‡Ð½Ñ– Ñ‡ÐµÑ€Ð³ÑƒÐ²Ð°Ð½Ð½Ñ Ñƒ Ð´Ñ–Ñ”Ð¿Ñ€Ð¸ÑÐ»Ñ–Ð²Ð½Ð¸ÐºÐ°Ñ…\n\nÐŸÑ€Ð¸ ÑƒÑ‚Ð²Ð¾Ñ€ÐµÐ½Ð½Ñ– Ð´Ñ–Ñ”Ð¿Ñ€Ð¸ÑÐ»Ñ–Ð²Ð½Ð¸ÐºÑ–Ð² Ñ‡Ð°ÑÑ‚Ð¾ Ð²Ñ–Ð´Ð±ÑƒÐ²Ð°ÑŽÑ‚ÑŒÑÑ Ð²Ð°Ð¶Ð»Ð¸Ð²Ñ– Ñ‡ÐµÑ€Ð³ÑƒÐ²Ð°Ð½Ð½Ñ Ð¿Ñ€Ð¸Ð³Ð¾Ð»Ð¾ÑÐ½Ð¸Ñ…, ÑÐºÑ– Ð¿Ð¾Ñ‚Ñ€Ñ–Ð±Ð½Ð¾ Ð·Ð°Ð¿Ð°Ð¼'ÑÑ‚Ð°Ñ‚Ð¸:\n\n| Ð†Ð½Ñ„Ñ–Ð½Ñ–Ñ‚Ð¸Ð² | Ð§ÐµÑ€Ð³ÑƒÐ²Ð°Ð½Ð½Ñ | Ð”Ñ–Ñ”Ð¿Ñ€Ð¸ÑÐ»Ñ–Ð²Ð½Ð¸Ðº |\n|-----------|------------|---------------|\n| Ð¿Ð¸ÑÐ°Ñ‚Ð¸ | Ñ â†’ Ñˆ | **Ð¿Ð¸ÑˆÑƒÑ‡Ð¸** |\n| ÐºÐ°Ð·Ð°Ñ‚Ð¸ | Ð· â†’ Ð¶ | **ÐºÐ°Ð¶ÑƒÑ‡Ð¸** |\n| Ñ—Ð·Ð´Ð¸Ñ‚Ð¸ | Ð·Ð´ â†’ Ð¶Ð´ | **Ñ—Ð·Ð´ÑÑ‡Ð¸** |\n| Ð¼Ñ–ÑÐ¸Ñ‚Ð¸ | Ñ â†’ Ñ (Ð±ÐµÐ· Ñ‡ÐµÑ€Ð³ÑƒÐ²Ð°Ð½Ð½Ñ) | **Ð¼Ñ–ÑÑÑ‡Ð¸** |\n| Ð¿Ñ€Ð¾ÑÐ¸Ñ‚Ð¸ | Ñ â†’ Ñˆ | **Ð¿Ñ€Ð¾ÑˆÐ°Ñ‡Ð¸** |\n\nÐ¦Ñ– Ñ‡ÐµÑ€Ð³ÑƒÐ²Ð°Ð½Ð½Ñ Ñ” Ð¿Ñ€Ð¸Ñ€Ð¾Ð´Ð½Ð¸Ð¼Ð¸ Ð´Ð»Ñ ÑƒÐºÑ€Ð°Ñ—Ð½ÑÑŒÐºÐ¾Ñ— Ñ„Ð¾Ð½ÐµÑ‚Ð¸ÐºÐ¸ Ñ– Ð²Ñ–Ð´Ð¾Ð±Ñ€Ð°Ð¶Ð°ÑŽÑ‚ÑŒ Ð´Ð°Ð²Ð½Ñ– Ð·Ð²ÑƒÐºÐ¾Ð²Ñ– Ð·Ð°ÐºÐ¾Ð½Ð¸. Ð‡Ñ… Ð·Ð½Ð°Ð½Ð½Ñ Ð´Ð¾Ð¿Ð¾Ð¼Ð°Ð³Ð°Ñ” Ð¿Ñ€Ð°Ð²Ð¸Ð»ÑŒÐ½Ð¾ ÑƒÑ‚Ð²Ð¾Ñ€ÑŽÐ²Ð°Ñ‚Ð¸ Ð½Ðµ Ñ‚Ñ–Ð»ÑŒÐºÐ¸ Ð´Ñ–Ñ”Ð¿Ñ€Ð¸ÑÐ»Ñ–Ð²Ð½Ð¸ÐºÐ¸, Ð°Ð»Ðµ Ð¹ Ñ–Ð½ÑˆÑ– Ð´Ñ–Ñ”ÑÐ»Ñ–Ð²Ð½Ñ– Ñ„Ð¾Ñ€Ð¼Ð¸.\n\n### Ð”Ñ–Ñ”Ð¿Ñ€Ð¸ÑÐ»Ñ–Ð²Ð½Ð¸ÐºÐ¸ Ñ‚Ð° Ñ‡Ð°Ñ\n\nÐ’Ð°Ð¶Ð»Ð¸Ð²Ð¾ Ñ€Ð¾Ð·ÑƒÐ¼Ñ–Ñ‚Ð¸, Ñ‰Ð¾ Ð´Ñ–Ñ”Ð¿Ñ€Ð¸ÑÐ»Ñ–Ð²Ð½Ð¸ÐºÐ¸ Ð½ÐµÐ´Ð¾ÐºÐ¾Ð½Ð°Ð½Ð¾Ð³Ð¾ Ð²Ð¸Ð´Ñƒ Ð½Ðµ Ð¼Ð°ÑŽÑ‚ÑŒ Ð³Ñ€Ð°Ð¼Ð°Ñ‚Ð¸Ñ‡Ð½Ð¾Ð³Ð¾ Ñ‡Ð°ÑÑƒ Ð² Ñ‚Ñ€Ð°Ð´Ð¸Ñ†Ñ–Ð¹Ð½Ð¾Ð¼Ñƒ Ñ€Ð¾Ð·ÑƒÐ¼Ñ–Ð½Ð½Ñ–. Ð§Ð°Ñ Ð´Ñ–Ñ”Ð¿Ñ€Ð¸ÑÐ»Ñ–Ð²Ð½Ð¸ÐºÐ¾Ð²Ð¾Ñ— ÐºÐ¾Ð½ÑÑ‚Ñ€ÑƒÐºÑ†Ñ–Ñ— Ð²Ð¸Ð·Ð½Ð°Ñ‡Ð°Ñ”Ñ‚ÑŒÑÑ Ñ‡Ð°ÑÐ¾Ð¼ Ð¾ÑÐ½Ð¾Ð²Ð½Ð¾Ð³Ð¾ Ð´Ñ–Ñ”ÑÐ»Ð¾Ð²Ð° Ð² Ñ€ÐµÑ‡ÐµÐ½Ð½Ñ–:\n\n- **ÐœÐ¸Ð½ÑƒÐ»Ð¸Ð¹ Ñ‡Ð°Ñ:** Ð§Ð¸Ñ‚Ð°ÑŽÑ‡Ð¸ ÐºÐ½Ð¸Ð³Ñƒ, Ð²Ñ–Ð½ **Ð´ÑƒÐ¼Ð°Ð²** Ð¿Ñ€Ð¾ Ð¼Ð°Ð¹Ð±ÑƒÑ‚Ð½Ñ”.\n- **Ð¢ÐµÐ¿ÐµÑ€Ñ–ÑˆÐ½Ñ–Ð¹ Ñ‡Ð°Ñ:** Ð§Ð¸Ñ‚Ð°ÑŽÑ‡Ð¸ ÐºÐ½Ð¸Ð³Ñƒ, Ð²Ñ–Ð½ **Ð´ÑƒÐ¼Ð°Ñ”** Ð¿Ñ€Ð¾ Ð¼Ð°Ð¹Ð±ÑƒÑ‚Ð½Ñ”.\n- **ÐœÐ°Ð¹Ð±ÑƒÑ‚Ð½Ñ–Ð¹ Ñ‡Ð°Ñ:** Ð§Ð¸Ñ‚Ð°ÑŽÑ‡Ð¸ ÐºÐ½Ð¸Ð³Ñƒ, Ð²Ñ–Ð½ **Ð´ÑƒÐ¼Ð°Ñ‚Ð¸Ð¼Ðµ** Ð¿Ñ€Ð¾ Ð¼Ð°Ð¹Ð±ÑƒÑ‚Ð½Ñ”.\n\nÐ£ Ð²ÑÑ–Ñ… Ñ‚Ñ€ÑŒÐ¾Ñ… Ñ€ÐµÑ‡ÐµÐ½Ð½ÑÑ… Ð´Ñ–Ñ”Ð¿Ñ€Ð¸ÑÐ»Ñ–Ð²Ð½Ð¸Ðº Â«Ñ‡Ð¸Ñ‚Ð°ÑŽÑ‡Ð¸Â» Ð·Ð°Ð»Ð¸ÑˆÐ°Ñ”Ñ‚ÑŒÑÑ Ð½ÐµÐ·Ð¼Ñ–Ð½Ð½Ð¸Ð¼, Ð°Ð»Ðµ Ñ‡Ð°Ñ ÑƒÑÑ–Ñ”Ñ— ÐºÐ¾Ð½ÑÑ‚Ñ€ÑƒÐºÑ†Ñ–Ñ— Ð·Ð¼Ñ–Ð½ÑŽÑ”Ñ‚ÑŒÑÑ Ð·Ð°Ð»ÐµÐ¶Ð½Ð¾ Ð²Ñ–Ð´ Ð¾ÑÐ½Ð¾Ð²Ð½Ð¾Ð³Ð¾ Ð´Ñ–Ñ”ÑÐ»Ð¾Ð²Ð°.\n\n> ðŸŒ **Ð£ Ñ€ÐµÐ°Ð»ÑŒÐ½Ð¾Ð¼Ñƒ Ð¶Ð¸Ñ‚Ñ‚Ñ–**\n>\n> Ð”Ñ–Ñ”Ð¿Ñ€Ð¸ÑÐ»Ñ–Ð²Ð½Ð¸ÐºÐ¸ Ð´ÑƒÐ¶Ðµ Ð¿Ð¾Ð¿ÑƒÐ»ÑÑ€Ð½Ñ– Ð² ÑƒÐºÑ€Ð°Ñ—Ð½ÑÑŒÐºÑ–Ð¹ Ð»Ñ–Ñ‚ÐµÑ€Ð°Ñ‚ÑƒÑ€Ñ– Ñ‚Ð° Ð¿ÑƒÐ±Ð»Ñ–Ñ†Ð¸ÑÑ‚Ð¸Ñ†Ñ–. Ð’Ð¾Ð½Ð¸ Ñ€Ð¾Ð±Ð»ÑÑ‚ÑŒ Ñ‚ÐµÐºÑÑ‚ Ð±Ñ–Ð»ÑŒÑˆ Ð´Ð¸Ð½Ð°Ð¼Ñ–Ñ‡Ð½Ð¸Ð¼ Ñ– Ð²Ð¸Ñ€Ð°Ð·Ð½Ð¸Ð¼. Ð’Ð¸ Ñ‡Ð°ÑÑ‚Ð¾ Ð¿Ð¾Ñ‡ÑƒÑ”Ñ‚Ðµ Ñ—Ñ… Ñƒ Ð½Ð¾Ð²Ð¸Ð½Ð°Ñ…: Â«Ð’Ð¸ÑÑ‚ÑƒÐ¿Ð°ÑŽÑ‡Ð¸ Ð½Ð° ÐºÐ¾Ð½Ñ„ÐµÑ€ÐµÐ½Ñ†Ñ–Ñ—, Ð¿Ñ€ÐµÐ·Ð¸Ð´ÐµÐ½Ñ‚ Ð·Ð°ÑÐ²Ð¸Ð²...Â», Â«ÐŸÐ¾Ð²ÐµÑ€Ñ‚Ð°ÑŽÑ‡Ð¸ÑÑŒ Ð´Ð¾Ð´Ð¾Ð¼Ñƒ, Ð²Ñ–Ð½ Ð·ÑƒÑÑ‚Ñ€Ñ–Ð² Ð´Ñ€ÑƒÐ³Ð°...Â» Ð¦Ñ ÐºÐ¾Ð½ÑÑ‚Ñ€ÑƒÐºÑ†Ñ–Ñ Ð´Ð¾Ð·Ð²Ð¾Ð»ÑÑ” Ð¿ÐµÑ€ÐµÐ´Ð°Ñ‚Ð¸ Ð´Ð²Ñ– Ð¿Ð°Ñ€Ð°Ð»ÐµÐ»ÑŒÐ½Ñ– Ð´Ñ–Ñ— Ð¾Ð´Ð½Ð¸Ð¼ ÐºÐ¾Ð¼Ð¿Ð°ÐºÑ‚Ð½Ð¸Ð¼ Ñ€ÐµÑ‡ÐµÐ½Ð½ÑÐ¼, Ñ‰Ð¾ Ð¾ÑÐ¾Ð±Ð»Ð¸Ð²Ð¾ Ñ†Ñ–Ð½ÑƒÑ”Ñ‚ÑŒÑÑ Ð² Ð¶ÑƒÑ€Ð½Ð°Ð»Ñ–ÑÑ‚Ð¸Ñ†Ñ–, Ð´Ðµ Ð²Ð°Ð¶Ð»Ð¸Ð²Ð° ÐµÐºÐ¾Ð½Ð¾Ð¼Ñ–Ñ ÑÐ»Ñ–Ð².\n\n### Ð¤ÑƒÐ½ÐºÑ†Ñ–Ñ: Ð¾Ð´Ð½Ð¾Ñ‡Ð°ÑÐ½Ñ–ÑÑ‚ÑŒ Ð´Ñ–Ð¹\n\nÐ”Ñ–Ñ”Ð¿Ñ€Ð¸ÑÐ»Ñ–Ð²Ð½Ð¸Ðº Ð½ÐµÐ´Ð¾ÐºÐ¾Ð½Ð°Ð½Ð¾Ð³Ð¾ Ð²Ð¸Ð´Ñƒ Ð¿Ð¾ÐºÐ°Ð·ÑƒÑ”, Ñ‰Ð¾ **Ð´Ð¾Ð´Ð°Ñ‚ÐºÐ¾Ð²Ð° Ð´Ñ–Ñ Ð²Ñ–Ð´Ð±ÑƒÐ²Ð°Ñ”Ñ‚ÑŒÑÑ Ð¾Ð´Ð½Ð¾Ñ‡Ð°ÑÐ½Ð¾ Ð· Ð¾ÑÐ½Ð¾Ð²Ð½Ð¾ÑŽ**:\n\n| Ð”Ñ–Ñ”Ð¿Ñ€Ð¸ÑÐ»Ñ–Ð²Ð½Ð¸ÐºÐ¾Ð²Ð° ÐºÐ¾Ð½ÑÑ‚Ñ€ÑƒÐºÑ†Ñ–Ñ | Ð—Ð½Ð°Ñ‡ÐµÐ½Ð½Ñ |\n|------------------------------|----------|\n| **Ð§Ð¸Ñ‚Ð°ÑŽÑ‡Ð¸** ÐºÐ½Ð¸Ð³Ñƒ, Ð²Ñ–Ð½ Ð¿Ð¸Ð² ÐºÐ°Ð²Ñƒ. | Ð§Ð¸Ñ‚Ð°Ð½Ð½Ñ Ñ– Ð¿Ð¸Ñ‚Ñ‚Ñ Ð²Ñ–Ð´Ð±ÑƒÐ²Ð°Ð»Ð¸ÑÑ Ð¾Ð´Ð½Ð¾Ñ‡Ð°ÑÐ½Ð¾. |\n| **Ð™Ð´ÑƒÑ‡Ð¸** Ð²ÑƒÐ»Ð¸Ñ†ÐµÑŽ, Ñ Ð·ÑƒÑÑ‚Ñ€Ñ–Ð² Ð´Ñ€ÑƒÐ³Ð°. | Ð—ÑƒÑÑ‚Ñ€Ñ–Ñ‡ ÑÑ‚Ð°Ð»Ð°ÑÑ Ð¿Ñ–Ð´ Ñ‡Ð°Ñ Ñ…Ð¾Ð´ÑŒÐ±Ð¸. |\n| **ÐŸÑ€Ð°Ñ†ÑŽÑŽÑ‡Ð¸** Ð²Ð´Ð¾Ð¼Ð°, Ð²Ð¾Ð½Ð° ÑÐ»ÑƒÑ…Ð°Ð»Ð° Ð¼ÑƒÐ·Ð¸ÐºÑƒ. | Ð Ð¾Ð±Ð¾Ñ‚Ð° Ñ– ÑÐ»ÑƒÑ…Ð°Ð½Ð½Ñ Ð¼ÑƒÐ·Ð¸ÐºÐ¸ â€” Ð¾Ð´Ð½Ð¾Ñ‡Ð°ÑÐ½Ñ–. |\n| **Ð”Ð¸Ð²Ð»ÑÑ‡Ð¸ÑÑŒ** Ñ„Ñ–Ð»ÑŒÐ¼, Ð´Ñ–Ñ‚Ð¸ Ñ—Ð»Ð¸ Ð¿Ð¾Ð¿ÐºÐ¾Ñ€Ð½. | Ð”Ð¸Ð²Ð¸Ñ‚Ð¸ÑÑ Ñ– Ñ—ÑÑ‚Ð¸ â€” Ð¾Ð´Ð½Ðµ Ñ– Ñ‚Ðµ Ð¶ ÑÐ°Ð¼Ðµ Ñ‡Ð°Ñ. |\n\n### ÐŸÐ¾Ð·Ð¸Ñ†Ñ–Ñ Ð´Ñ–Ñ”Ð¿Ñ€Ð¸ÑÐ»Ñ–Ð²Ð½Ð¸ÐºÐ° Ð² Ñ€ÐµÑ‡ÐµÐ½Ð½Ñ–\n\nÐ”Ñ–Ñ”Ð¿Ñ€Ð¸ÑÐ»Ñ–Ð²Ð½Ð¸ÐºÐ¾Ð²Ð° ÐºÐ¾Ð½ÑÑ‚Ñ€ÑƒÐºÑ†Ñ–Ñ Ð¼Ð¾Ð¶Ðµ ÑÑ‚Ð¾ÑÑ‚Ð¸ Ð½Ð° **Ð¿Ð¾Ñ‡Ð°Ñ‚ÐºÑƒ**, Ð² **ÑÐµÑ€ÐµÐ´Ð¸Ð½Ñ–** Ð°Ð±Ð¾ Ð² **ÐºÑ–Ð½Ñ†Ñ–** Ñ€ÐµÑ‡ÐµÐ½Ð½Ñ:\n\n1. **ÐÐ° Ð¿Ð¾Ñ‡Ð°Ñ‚ÐºÑƒ:** Ð§Ð¸Ñ‚Ð°ÑŽÑ‡Ð¸ ÐºÐ½Ð¸Ð³Ñƒ, Ð²Ñ–Ð½ Ð·Ð°ÑÐ¼ÑƒÑ‚Ð¸Ð²ÑÑ.\n2. **Ð’ ÑÐµÑ€ÐµÐ´Ð¸Ð½Ñ–:** Ð’Ñ–Ð½, Ñ‡Ð¸Ñ‚Ð°ÑŽÑ‡Ð¸ ÐºÐ½Ð¸Ð³Ñƒ, Ð·Ð°ÑÐ¼ÑƒÑ‚Ð¸Ð²ÑÑ.\n3. **Ð’ ÐºÑ–Ð½Ñ†Ñ–:** Ð’Ñ–Ð½ Ð·Ð°ÑÐ¼ÑƒÑ‚Ð¸Ð²ÑÑ, Ñ‡Ð¸Ñ‚Ð°ÑŽÑ‡Ð¸ ÐºÐ½Ð¸Ð³Ñƒ.\n\n> ðŸŽ¯ **Ð¦Ñ–ÐºÐ°Ð²Ð¸Ð¹ Ñ„Ð°ÐºÑ‚**\n>\n> Ð”Ñ–Ñ”Ð¿Ñ€Ð¸ÑÐ»Ñ–Ð²Ð½Ð¸ÐºÐ¸ Ð°ÐºÑ‚Ð¸Ð²Ð½Ð¾ Ð²Ð¸ÐºÐ¾Ñ€Ð¸ÑÑ‚Ð¾Ð²ÑƒÑŽÑ‚ÑŒÑÑ Ð² ÑƒÐºÑ€Ð°Ñ—Ð½ÑÑŒÐºÑ–Ð¹ Ð¿Ñ–ÑÐµÐ½Ð½Ñ–Ð¹ Ñ‚Ð²Ð¾Ñ€Ñ‡Ð¾ÑÑ‚Ñ–. Ð£ Ð·Ð½Ð°Ð¼ÐµÐ½Ð¸Ñ‚Ñ–Ð¹ Ð¿Ñ–ÑÐ½Ñ– Â«ÐžÐ¹, Ñƒ Ð»ÑƒÐ·Ñ– Ñ‡ÐµÑ€Ð²Ð¾Ð½Ð° ÐºÐ°Ð»Ð¸Ð½Ð°Â» Ð·Ð²ÑƒÑ‡Ð¸Ñ‚ÑŒ: Â«ÐœÐ°Ñ€ÑˆÐ¸Ñ€ÑƒÑŽÑ‚ÑŒ Ð½Ð°ÑˆÑ– Ð´Ð¾Ð±Ñ€Ð¾Ð²Ð¾Ð»ÑŒÑ†Ñ–, Ð²Ð¸Ð·Ð²Ð¾Ð»ÑÑŽÑ‡Ð¸ Ñ€Ñ–Ð´Ð½Ð¸Ð¹ ÐºÑ€Ð°Ð¹Â». Ð¢ÑƒÑ‚ Ð´Ñ–Ñ”Ð¿Ñ€Ð¸ÑÐ»Ñ–Ð²Ð½Ð¸Ðº Â«Ð²Ð¸Ð·Ð²Ð¾Ð»ÑÑŽÑ‡Ð¸Â» ÑÑ‚Ð²Ð¾Ñ€ÑŽÑ” Ð¾Ð±Ñ€Ð°Ð· Ð¿Ð¾ÑÑ‚Ñ–Ð¹Ð½Ð¾Ñ—, Ñ‚Ñ€Ð¸Ð²Ð°Ð»Ð¾Ñ— Ð´Ñ–Ñ— â€” Ð±Ð¾Ñ€Ñ†Ñ– Ð¿Ñ€Ð¾Ð´Ð¾Ð²Ð¶ÑƒÑŽÑ‚ÑŒ Ð²Ð¸Ð·Ð²Ð¾Ð»ÑÑ‚Ð¸ ÐºÑ€Ð°Ð¹, Ð¿Ð¾ÐºÐ¸ Ð¼Ð°Ñ€ÑˆÐ¸Ñ€ÑƒÑŽÑ‚ÑŒ.\n\n> ðŸŽ¬ **ÐšÑƒÐ»ÑŒÑ‚ÑƒÑ€Ð½Ð¸Ð¹ Ð¼Ð¾Ð¼ÐµÐ½Ñ‚**\n>\n> Ð£ ÐºÐ»Ð°ÑÐ¸Ñ‡Ð½Ñ–Ð¹ ÑƒÐºÑ€Ð°Ñ—Ð½ÑÑŒÐºÑ–Ð¹ Ð¿Ð¾ÐµÐ·Ñ–Ñ— Ð´Ñ–Ñ”Ð¿Ñ€Ð¸ÑÐ»Ñ–Ð²Ð½Ð¸ÐºÐ¸ ÑÑ‚Ð²Ð¾Ñ€ÑŽÑŽÑ‚ÑŒ Ð¾ÑÐ¾Ð±Ð»Ð¸Ð²Ð¸Ð¹ Ñ€Ð¸Ñ‚Ð¼ Ñ– Ð¿Ð»Ð°Ð²Ð½Ñ–ÑÑ‚ÑŒ. Ð¢Ð°Ñ€Ð°Ñ Ð¨ÐµÐ²Ñ‡ÐµÐ½ÐºÐ¾ Ñ‡Ð°ÑÑ‚Ð¾ Ð²Ð¸ÐºÐ¾Ñ€Ð¸ÑÑ‚Ð¾Ð²ÑƒÐ²Ð°Ð² Ñ—Ñ…: Â«Ð† Ð´ÑƒÐ¼Ð°ÑŽÑ‡Ð¸, ÑÑƒÐ¼ÑƒÑŽÑ‡Ð¸, / Ð”Ð¸Ð²Ð»ÑŽÑÑŒ Ð½Ð° Ñ‚ÐµÐ¼Ð½Ð¸Ð¹ Ð»Ñ–Ñ...Â» Ð¦Ñ Ñ„Ð¾Ñ€Ð¼Ð° Ð½Ð°Ð´Ð°Ñ” Ñ‚ÐµÐºÑÑ‚Ñƒ Ð¿Ð¾ÐµÑ‚Ð¸Ñ‡Ð½Ð¾Ñ— Ð¼ÐµÐ»Ð¾Ð´Ñ–Ð¹Ð½Ð¾ÑÑ‚Ñ–.\n\n### Ð¡ÑƒÐ±'Ñ”ÐºÑ‚ Ð´Ñ–Ñ”Ð¿Ñ€Ð¸ÑÐ»Ñ–Ð²Ð½Ð¸ÐºÐ°\n\n**Ð’Ð°Ð¶Ð»Ð¸Ð²Ðµ Ð¿Ñ€Ð°Ð²Ð¸Ð»Ð¾:** ÑÑƒÐ±'Ñ”ÐºÑ‚ Ð´Ñ–Ñ”Ð¿Ñ€Ð¸ÑÐ»Ñ–Ð²Ð½Ð¸ÐºÐ° Ñ– ÑÑƒÐ±'Ñ”ÐºÑ‚ Ð¾ÑÐ½Ð¾Ð²Ð½Ð¾Ð³Ð¾ Ð´Ñ–Ñ”ÑÐ»Ð¾Ð²Ð° Ð¼Ð°ÑŽÑ‚ÑŒ Ð±ÑƒÑ‚Ð¸ **Ð¾Ð´Ð½Ð°ÐºÐ¾Ð²Ð¸Ð¼Ð¸**!\n\nâœ… **ÐŸÑ€Ð°Ð²Ð¸Ð»ÑŒÐ½Ð¾:** Ð§Ð¸Ñ‚Ð°ÑŽÑ‡Ð¸ ÐºÐ½Ð¸Ð³Ñƒ, **Ð²Ñ–Ð½** Ð·Ð°ÑÐ½ÑƒÐ². (Ð’Ñ–Ð½ Ñ‡Ð¸Ñ‚Ð°Ð². Ð’Ñ–Ð½ Ð·Ð°ÑÐ½ÑƒÐ².)\nâŒ **ÐÐµÐ¿Ñ€Ð°Ð²Ð¸Ð»ÑŒÐ½Ð¾:** Ð§Ð¸Ñ‚Ð°ÑŽÑ‡Ð¸ ÐºÐ½Ð¸Ð³Ñƒ, **Ð¼ÐµÐ½Ñ–** ÑÑ‚Ð°Ð»Ð¾ Ð½ÑƒÐ´Ð½Ð¾. (Ð¥Ñ‚Ð¾ Ñ‡Ð¸Ñ‚Ð°Ð²? ÐœÐµÐ½Ñ– Ð½Ðµ Ð¼Ð¾Ð¶Ð½Ð° Ñ‡Ð¸Ñ‚Ð°Ñ‚Ð¸.)\n\nâœ… **ÐŸÑ€Ð°Ð²Ð¸Ð»ÑŒÐ½Ð¾:** Ð™Ð´ÑƒÑ‡Ð¸ Ð´Ð¾Ð´Ð¾Ð¼Ñƒ, **Ñ** ÐºÑƒÐ¿Ð¸Ð² Ñ…Ð»Ñ–Ð±Ð°. (Ð¯ Ð¹ÑˆÐ¾Ð². Ð¯ ÐºÑƒÐ¿Ð¸Ð².)\nâŒ **ÐÐµÐ¿Ñ€Ð°Ð²Ð¸Ð»ÑŒÐ½Ð¾:** Ð™Ð´ÑƒÑ‡Ð¸ Ð´Ð¾Ð´Ð¾Ð¼Ñƒ, **Ð¿Ð¾Ñ‡Ð°Ð²ÑÑ Ð´Ð¾Ñ‰**. (Ð¥Ñ‚Ð¾ Ð¹ÑˆÐ¾Ð²? Ð”Ð¾Ñ‰ Ð½Ðµ Ñ…Ð¾Ð´Ð¸Ñ‚ÑŒ!)\n\n> âš ï¸ **Ð¢Ð¸Ð¿Ð¾Ð²Ð° Ð¿Ð¾Ð¼Ð¸Ð»ÐºÐ°!**\n>\n> Ð‘Ð°Ð³Ð°Ñ‚Ð¾ ÑÑ‚ÑƒÐ´ÐµÐ½Ñ‚Ñ–Ð² Ñ€Ð¾Ð±Ð»ÑÑ‚ÑŒ Ð¿Ð¾Ð¼Ð¸Ð»ÐºÑƒ Ð² ÑƒÐ·Ð³Ð¾Ð´Ð¶ÐµÐ½Ð½Ñ– ÑÑƒÐ±'Ñ”ÐºÑ‚Ñ–Ð². Ð—Ð°Ð¿Ð°Ð¼'ÑÑ‚Ð°Ð¹Ñ‚Ðµ: Ñ‚Ð¾Ð¹, Ñ…Ñ‚Ð¾ Ð²Ð¸ÐºÐ¾Ð½ÑƒÑ” Ð´Ð¾Ð´Ð°Ñ‚ÐºÐ¾Ð²Ñƒ Ð´Ñ–ÑŽ (Ð´Ñ–Ñ”Ð¿Ñ€Ð¸ÑÐ»Ñ–Ð²Ð½Ð¸Ðº), Ð¼Ð°Ñ” Ð±ÑƒÑ‚Ð¸ Ñ‚Ð¸Ð¼ ÑÐ°Ð¼Ð¸Ð¼, Ñ…Ñ‚Ð¾ Ð²Ð¸ÐºÐ¾Ð½ÑƒÑ” Ð¾ÑÐ½Ð¾Ð²Ð½Ñƒ Ð´Ñ–ÑŽ.\n\n---\n\n## ÐŸÑ€Ð°ÐºÑ‚Ð¸ÐºÐ°\n\n### Ð¯Ðº Ð²Ð¸Ð±Ñ€Ð°Ñ‚Ð¸ Ð¿Ñ€Ð°Ð²Ð¸Ð»ÑŒÐ½Ñƒ Ñ„Ð¾Ñ€Ð¼Ñƒ?\n\n**ÐšÑ€Ð¾Ðº 1:** Ð’Ð¸Ð·Ð½Ð°Ñ‡Ñ‚Ðµ Ð¾ÑÐ½Ð¾Ð²Ñƒ Ñ‚ÐµÐ¿ÐµÑ€Ñ–ÑˆÐ½ÑŒÐ¾Ð³Ð¾ Ñ‡Ð°ÑÑƒ Ð´Ñ–Ñ”ÑÐ»Ð¾Ð²Ð°.\n- Ñ‡Ð¸Ñ‚Ð°Ñ‚Ð¸ â†’ Ñ Ñ‡Ð¸Ñ‚Ð°ÑŽ â†’ Ñ‡Ð¸Ñ‚Ð°-\n- Ð¿Ð¸ÑÐ°Ñ‚Ð¸ â†’ Ñ Ð¿Ð¸ÑˆÑƒ â†’ Ð¿Ð¸Ñˆ-\n- Ð±Ñ–Ð³Ñ‚Ð¸ â†’ Ñ Ð±Ñ–Ð¶Ñƒ â†’ Ð±Ñ–Ð¶-\n\nÐ¦Ðµ Ð½Ð°Ð¹Ð²Ð°Ð¶Ð»Ð¸Ð²Ñ–ÑˆÐ¸Ð¹ ÐºÑ€Ð¾Ðº, Ñ‚Ð¾Ð¼Ñƒ Ñ‰Ð¾ Ð±Ð°Ð³Ð°Ñ‚Ð¾ Ð¿Ð¾Ð¼Ð¸Ð»Ð¾Ðº Ð²Ð¸Ð½Ð¸ÐºÐ°ÑŽÑ‚ÑŒ ÑÐ°Ð¼Ðµ Ñ‡ÐµÑ€ÐµÐ· Ð½ÐµÐ¿Ñ€Ð°Ð²Ð¸Ð»ÑŒÐ½Ðµ Ð²Ð¸Ð·Ð½Ð°Ñ‡ÐµÐ½Ð½Ñ Ð¾ÑÐ½Ð¾Ð²Ð¸. ÐŸÐ°Ð¼'ÑÑ‚Ð°Ð¹Ñ‚Ðµ: Ð¼Ð¸ Ð±ÐµÑ€ÐµÐ¼Ð¾ Ñ„Ð¾Ñ€Ð¼Ñƒ Ñ‚ÐµÐ¿ÐµÑ€Ñ–ÑˆÐ½ÑŒÐ¾Ð³Ð¾ Ñ‡Ð°ÑÑƒ Ð²Ñ–Ð´ Ð¿ÐµÑ€ÑˆÐ¾Ñ— Ð¾ÑÐ¾Ð±Ð¸ Ð¾Ð´Ð½Ð¸Ð½Ð¸, Ð¿Ñ€Ð¸Ð±Ð¸Ñ€Ð°Ñ”Ð¼Ð¾ Ð¾ÑÐ¾Ð±Ð¾Ð²Ðµ Ð·Ð°ÐºÑ–Ð½Ñ‡ÐµÐ½Ð½Ñ, Ñ– Ð¾Ñ‚Ñ€Ð¸Ð¼ÑƒÑ”Ð¼Ð¾ Ð¾ÑÐ½Ð¾Ð²Ñƒ.\n\n**ÐšÑ€Ð¾Ðº 2:** Ð”Ð¾Ð´Ð°Ð¹Ñ‚Ðµ ÑÑƒÑ„Ñ–ÐºÑ -ÑŽÑ‡Ð¸/-ÑƒÑ‡Ð¸/-Ð°Ñ‡Ð¸/-ÑÑ‡Ð¸.\n- Ñ‡Ð¸Ñ‚Ð°- + -ÑŽÑ‡Ð¸ â†’ Ñ‡Ð¸Ñ‚Ð°ÑŽÑ‡Ð¸\n- Ð¿Ð¸Ñˆ- + -ÑƒÑ‡Ð¸ â†’ Ð¿Ð¸ÑˆÑƒÑ‡Ð¸\n- Ð±Ñ–Ð¶- + -Ð°Ñ‡Ð¸ â†’ Ð±Ñ–Ð¶Ð°Ñ‡Ð¸\n\nÐ’Ð¸Ð±Ñ–Ñ€ Ð¼Ñ–Ð¶ Ð²Ð°Ñ€Ñ–Ð°Ð½Ñ‚Ð°Ð¼Ð¸ ÑÑƒÑ„Ñ–ÐºÑÐ° Ð·Ð°Ð»ÐµÐ¶Ð¸Ñ‚ÑŒ Ð²Ñ–Ð´ ÐºÑ–Ð½Ñ†ÐµÐ²Ð¾Ð³Ð¾ Ð·Ð²ÑƒÐºÑƒ Ð¾ÑÐ½Ð¾Ð²Ð¸ Ñ‚Ð° Ð²Ñ–Ð´ ÐºÐ¾Ð½ÐºÑ€ÐµÑ‚Ð½Ð¾Ð³Ð¾ Ð´Ñ–Ñ”ÑÐ»Ð¾Ð²Ð°. Ð—Ð°Ð³Ð°Ð»ÑŒÐ½Ðµ Ð¿Ñ€Ð°Ð²Ð¸Ð»Ð¾: Ð¿Ñ–ÑÐ»Ñ Ð³Ð¾Ð»Ð¾ÑÐ½Ð¾Ñ— Ñ‡Ð°ÑÑ‚Ñ–ÑˆÐµ -ÑŽÑ‡Ð¸, Ð¿Ñ–ÑÐ»Ñ Ð¿Ñ€Ð¸Ð³Ð¾Ð»Ð¾ÑÐ½Ð¾Ñ— â€” Ð·Ð°Ð»ÐµÐ¶Ð¸Ñ‚ÑŒ Ð²Ñ–Ð´ Ð´Ñ–Ñ”ÑÐ»Ð¾Ð²Ð°.\n\n**ÐšÑ€Ð¾Ðº 3:** Ð”Ð»Ñ Ð·Ð²Ð¾Ñ€Ð¾Ñ‚Ð½Ð¸Ñ… Ð´Ñ–Ñ”ÑÐ»Ñ–Ð² Ð´Ð¾Ð´Ð°Ð¹Ñ‚Ðµ -ÑÑŒ.\n- Ð¾Ð´ÑÐ³Ð°Ñ‚Ð¸ÑÑ â†’ Ð¾Ð´ÑÐ³Ð°ÑŽÑ‡Ð¸ÑÑŒ\n- Ð²Ð¼Ð¸Ð²Ð°Ñ‚Ð¸ÑÑ â†’ Ð²Ð¼Ð¸Ð²Ð°ÑŽÑ‡Ð¸ÑÑŒ\n\nÐŸÐ°Ð¼'ÑÑ‚Ð°Ð¹Ñ‚Ðµ: Ñ‡Ð°ÑÑ‚ÐºÐ° -ÑÑŒ Ñ” ÑÐºÐ¾Ñ€Ð¾Ñ‡ÐµÐ½Ð¾ÑŽ Ñ„Ð¾Ñ€Ð¼Ð¾ÑŽ -ÑÑ Ñ– Ð²Ð¸ÐºÐ¾Ñ€Ð¸ÑÑ‚Ð¾Ð²ÑƒÑ”Ñ‚ÑŒÑÑ ÑÐ°Ð¼Ðµ Ð² Ð´Ñ–Ñ”Ð¿Ñ€Ð¸ÑÐ»Ñ–Ð²Ð½Ð¸ÐºÐ°Ñ…. ÐÑ–ÐºÐ¾Ð»Ð¸ Ð½Ðµ Ð²Ð¸ÐºÐ¾Ñ€Ð¸ÑÑ‚Ð¾Ð²ÑƒÐ¹Ñ‚Ðµ Ñ„Ð¾Ñ€Ð¼Ñƒ -ÑÑ Ð² Ð´Ñ–Ñ”Ð¿Ñ€Ð¸ÑÐ»Ñ–Ð²Ð½Ð¸ÐºÐ°Ñ… â€” Ñ†Ðµ Ð³Ñ€Ð°Ð¼Ð°Ñ‚Ð¸Ñ‡Ð½Ð° Ð¿Ð¾Ð¼Ð¸Ð»ÐºÐ°.\n\n### Ð’Ð¸ÐºÐ¾Ñ€Ð¸ÑÑ‚Ð°Ð½Ð½Ñ Ð´Ñ–Ñ”Ð¿Ñ€Ð¸ÑÐ»Ñ–Ð²Ð½Ð¸ÐºÑ–Ð² Ñƒ Ñ€Ñ–Ð·Ð½Ð¸Ñ… ÑÑ‚Ð¸Ð»ÑÑ…\n\nÐ”Ñ–Ñ”Ð¿Ñ€Ð¸ÑÐ»Ñ–Ð²Ð½Ð¸ÐºÐ¸ Ð°ÐºÑ‚Ð¸Ð²Ð½Ð¾ Ð²Ð¸ÐºÐ¾Ñ€Ð¸ÑÑ‚Ð¾Ð²ÑƒÑŽÑ‚ÑŒÑÑ Ð² Ñ€Ñ–Ð·Ð½Ð¸Ñ… Ñ„ÑƒÐ½ÐºÑ†Ñ–Ð¾Ð½Ð°Ð»ÑŒÐ½Ð¸Ñ… ÑÑ‚Ð¸Ð»ÑÑ… ÑƒÐºÑ€Ð°Ñ—Ð½ÑÑŒÐºÐ¾Ñ— Ð¼Ð¾Ð²Ð¸:\n\n**Ð¥ÑƒÐ´Ð¾Ð¶Ð½Ñ–Ð¹ ÑÑ‚Ð¸Ð»ÑŒ:** Ð”Ñ–Ñ”Ð¿Ñ€Ð¸ÑÐ»Ñ–Ð²Ð½Ð¸ÐºÐ¸ Ð½Ð°Ð´Ð°ÑŽÑ‚ÑŒ Ñ‚ÐµÐºÑÑ‚Ñƒ Ð¿Ð»Ð°Ð²Ð½Ð¾ÑÑ‚Ñ– Ñ‚Ð° Ð¿Ð¾ÐµÑ‚Ð¸Ñ‡Ð½Ð¾ÑÑ‚Ñ–. ÐŸÐ¸ÑÑŒÐ¼ÐµÐ½Ð½Ð¸ÐºÐ¸ Ð²Ð¸ÐºÐ¾Ñ€Ð¸ÑÑ‚Ð¾Ð²ÑƒÑŽÑ‚ÑŒ Ñ—Ñ… Ð´Ð»Ñ ÑÑ‚Ð²Ð¾Ñ€ÐµÐ½Ð½Ñ ÑÐºÐ»Ð°Ð´Ð½Ð¸Ñ…, Ð±Ð°Ð³Ð°Ñ‚Ð¾ÑˆÐ°Ñ€Ð¾Ð²Ð¸Ñ… Ð¾Ð±Ñ€Ð°Ð·Ñ–Ð².\n\n**ÐÐ°ÑƒÐºÐ¾Ð²Ð¸Ð¹ ÑÑ‚Ð¸Ð»ÑŒ:** Ð£ Ð½Ð°ÑƒÐºÐ¾Ð²Ð¸Ñ… Ñ‚ÐµÐºÑÑ‚Ð°Ñ… Ð´Ñ–Ñ”Ð¿Ñ€Ð¸ÑÐ»Ñ–Ð²Ð½Ð¸ÐºÐ¸ Ð´Ð¾Ð¿Ð¾Ð¼Ð°Ð³Ð°ÑŽÑ‚ÑŒ ÑÑ‚Ð¸ÑÐ»Ð¾ Ð¿ÐµÑ€ÐµÐ´Ð°Ð²Ð°Ñ‚Ð¸ Ð¿Ð°Ñ€Ð°Ð»ÐµÐ»ÑŒÐ½Ñ– Ð¿Ñ€Ð¾Ñ†ÐµÑÐ¸ Ñ‚Ð° ÑƒÐ¼Ð¾Ð²Ð¸.\n\n**ÐŸÑƒÐ±Ð»Ñ–Ñ†Ð¸ÑÑ‚Ð¸Ñ‡Ð½Ð¸Ð¹ ÑÑ‚Ð¸Ð»ÑŒ:** Ð–ÑƒÑ€Ð½Ð°Ð»Ñ–ÑÑ‚Ð¸ Ñ†Ñ–Ð½ÑƒÑŽÑ‚ÑŒ Ð´Ñ–Ñ”Ð¿Ñ€Ð¸ÑÐ»Ñ–Ð²Ð½Ð¸ÐºÐ¸ Ð·Ð° Ñ—Ñ…Ð½ÑŽ Ð·Ð´Ð°Ñ‚Ð½Ñ–ÑÑ‚ÑŒ ÐµÐºÐ¾Ð½Ð¾Ð¼Ð¸Ñ‚Ð¸ Ð¼Ñ–ÑÑ†Ðµ, Ð·Ð±ÐµÑ€Ñ–Ð³Ð°ÑŽÑ‡Ð¸ Ñ–Ð½Ñ„Ð¾Ñ€Ð¼Ð°Ñ‚Ð¸Ð²Ð½Ñ–ÑÑ‚ÑŒ.\n\n**ÐžÑ„Ñ–Ñ†Ñ–Ð¹Ð½Ð¾-Ð´Ñ–Ð»Ð¾Ð²Ð¸Ð¹ ÑÑ‚Ð¸Ð»ÑŒ:** Ð£ Ð´Ð¾ÐºÑƒÐ¼ÐµÐ½Ñ‚Ð°Ñ… Ð´Ñ–Ñ”Ð¿Ñ€Ð¸ÑÐ»Ñ–Ð²Ð½Ð¸ÐºÐ¸ Ð²Ð¸ÐºÐ¾Ñ€Ð¸ÑÑ‚Ð¾Ð²ÑƒÑŽÑ‚ÑŒÑÑ Ð´Ð»Ñ Ñ‚Ð¾Ñ‡Ð½Ð¾Ð³Ð¾ Ð¾Ð¿Ð¸ÑÑƒ Ð¿Ð¾ÑÐ»Ñ–Ð´Ð¾Ð²Ð½Ð¾ÑÑ‚Ñ– Ð´Ñ–Ð¹.\n\n### Ð¢Ð¸Ð¿Ð¾Ð²Ñ– Ð¿Ð¾Ð¼Ð¸Ð»ÐºÐ¸ Ñ‚Ð° ÑÐº Ñ—Ñ… ÑƒÐ½Ð¸ÐºÐ½ÑƒÑ‚Ð¸\n\n**ÐŸÐ¾Ð¼Ð¸Ð»ÐºÐ° 1: ÐÐµÐ¿Ñ€Ð°Ð²Ð¸Ð»ÑŒÐ½Ð° Ð¾ÑÐ½Ð¾Ð²Ð°**\n\nâŒ ÐÐµÐ¿Ñ€Ð°Ð²Ð¸Ð»ÑŒÐ½Ð¾: Ð¿Ð¸ÑÐ°ÑŽÑ‡Ð¸ (Ð²Ñ–Ð´ Ð¿Ð¸ÑÐ°-)\nâœ… ÐŸÑ€Ð°Ð²Ð¸Ð»ÑŒÐ½Ð¾: Ð¿Ð¸ÑˆÑƒÑ‡Ð¸ (Ð²Ñ–Ð´ Ð¿Ð¸Ñˆ-)\n\n**Ð§Ð¾Ð¼Ñƒ?** ÐžÑÐ½Ð¾Ð²Ð° Ð±ÐµÑ€ÐµÑ‚ÑŒÑÑ Ð· Ñ‚ÐµÐ¿ÐµÑ€Ñ–ÑˆÐ½ÑŒÐ¾Ð³Ð¾ Ñ‡Ð°ÑÑƒ (Ñ Ð¿Ð¸ÑˆÑƒ), Ð° Ð½Ðµ Ð· Ñ–Ð½Ñ„Ñ–Ð½Ñ–Ñ‚Ð¸Ð²Ð°. Ð¦Ðµ Ð¾Ð´Ð½Ð° Ð· Ð½Ð°Ð¹Ð¿Ð¾ÑˆÐ¸Ñ€ÐµÐ½Ñ–ÑˆÐ¸Ñ… Ð¿Ð¾Ð¼Ð¸Ð»Ð¾Ðº ÑÐµÑ€ÐµÐ´ ÑÑ‚ÑƒÐ´ÐµÐ½Ñ‚Ñ–Ð², ÑÐºÑ– Ð½Ð°Ð²Ñ‡Ð°ÑŽÑ‚ÑŒÑÑ ÑƒÐºÑ€Ð°Ñ—Ð½ÑÑŒÐºÐ¾Ñ— Ð¼Ð¾Ð²Ð¸.\n\n**ÐŸÐ¾Ð¼Ð¸Ð»ÐºÐ° 2: Ð Ñ–Ð·Ð½Ñ– ÑÑƒÐ±'Ñ”ÐºÑ‚Ð¸**\n\nâŒ ÐÐµÐ¿Ñ€Ð°Ð²Ð¸Ð»ÑŒÐ½Ð¾: Ð§Ð¸Ñ‚Ð°ÑŽÑ‡Ð¸ ÑÑ‚Ð°Ñ‚Ñ‚ÑŽ, Ð¼ÐµÐ½Ñ– ÑÑ‚Ð°Ð»Ð¾ Ñ†Ñ–ÐºÐ°Ð²Ð¾.\nâœ… ÐŸÑ€Ð°Ð²Ð¸Ð»ÑŒÐ½Ð¾: Ð§Ð¸Ñ‚Ð°ÑŽÑ‡Ð¸ ÑÑ‚Ð°Ñ‚Ñ‚ÑŽ, Ñ Ð·Ð°Ñ†Ñ–ÐºÐ°Ð²Ð¸Ð²ÑÑ.\n\n**Ð§Ð¾Ð¼Ñƒ?** Ð¡ÑƒÐ±'Ñ”ÐºÑ‚ Ð´Ñ–Ñ”Ð¿Ñ€Ð¸ÑÐ»Ñ–Ð²Ð½Ð¸ÐºÐ° (Ñ…Ñ‚Ð¾ Ñ‡Ð¸Ñ‚Ð°Ð²?) Ð¼Ð°Ñ” Ð·Ð±Ñ–Ð³Ð°Ñ‚Ð¸ÑÑ Ð· ÑÑƒÐ±'Ñ”ÐºÑ‚Ð¾Ð¼ Ð¾ÑÐ½Ð¾Ð²Ð½Ð¾Ð³Ð¾ Ð´Ñ–Ñ”ÑÐ»Ð¾Ð²Ð° (Ñ…Ñ‚Ð¾ Ð·Ð°Ñ†Ñ–ÐºÐ°Ð²Ð¸Ð²ÑÑ?). Ð¦Ñ Ð¿Ð¾Ð¼Ð¸Ð»ÐºÐ° Ñ” ÐºÐ°Ð»ÑŒÐºÐ¾ÑŽ Ð· Ñ€Ð¾ÑÑ–Ð¹ÑÑŒÐºÐ¾Ñ— Ð¼Ð¾Ð²Ð¸, Ð´Ðµ Ð¿Ð¾Ð´Ñ–Ð±Ð½Ñ– ÐºÐ¾Ð½ÑÑ‚Ñ€ÑƒÐºÑ†Ñ–Ñ— Ñ–Ð½Ð¾Ð´Ñ– Ð´Ð¾Ð¿ÑƒÑÐºÐ°ÑŽÑ‚ÑŒÑÑ Ð² Ñ€Ð¾Ð·Ð¼Ð¾Ð²Ð½Ð¾Ð¼Ñƒ Ð¼Ð¾Ð²Ð»ÐµÐ½Ð½Ñ–.\n\n**ÐŸÐ¾Ð¼Ð¸Ð»ÐºÐ° 3: ÐŸÐ»ÑƒÑ‚Ð°Ð½Ð½Ñ Ð· Ð¿Ñ€Ð¸ÐºÐ¼ÐµÑ‚Ð½Ð¸ÐºÐ°Ð¼Ð¸**\n\nâŒ ÐÐµÐ¿Ñ€Ð°Ð²Ð¸Ð»ÑŒÐ½Ð¾: ÑÐ¿Ð»ÑÑ‡Ð¸Ð¹ Ñ‡Ð¾Ð»Ð¾Ð²Ñ–Ðº (Ñ†Ðµ Ð´Ñ–Ñ”Ð¿Ñ€Ð¸ÐºÐ¼ÐµÑ‚Ð½Ð¸Ðº!)\nâœ… ÐŸÑ€Ð°Ð²Ð¸Ð»ÑŒÐ½Ð¾: ÑÐ¿Ð°Ñ‡Ð¸ (Ð½ÐµÐ¼Ð°Ñ” Ñ‚Ð°ÐºÐ¾Ñ— Ñ„Ð¾Ñ€Ð¼Ð¸!) â†’ ÐŸÐ¾ÐºÐ¸ Ð²Ñ–Ð½ ÑÐ¿Ð°Ð²...\n\n**Ð§Ð¾Ð¼Ñƒ?** ÐÐµ Ð²ÑÑ– Ð´Ñ–Ñ”ÑÐ»Ð¾Ð²Ð° Ð¼Ð°ÑŽÑ‚ÑŒ Ð´Ñ–Ñ”Ð¿Ñ€Ð¸ÑÐ»Ñ–Ð²Ð½Ð¸ÐºÐ¾Ð²Ñ– Ñ„Ð¾Ñ€Ð¼Ð¸. Ð’Ñ–Ð´ Ð´Ñ–Ñ”ÑÐ»Ð¾Ð²Ð° Â«ÑÐ¿Ð°Ñ‚Ð¸Â» Ð´Ñ–Ñ”Ð¿Ñ€Ð¸ÑÐ»Ñ–Ð²Ð½Ð¸Ðº Ð½Ðµ ÑƒÑ‚Ð²Ð¾Ñ€ÑŽÑ”Ñ‚ÑŒÑÑ Ð¿Ñ€Ð¸Ñ€Ð¾Ð´Ð½Ð¾. Ð£ Ñ‚Ð°ÐºÐ¸Ñ… Ð²Ð¸Ð¿Ð°Ð´ÐºÐ°Ñ… ÐºÑ€Ð°Ñ‰Ðµ Ð²Ð¸ÐºÐ¾Ñ€Ð¸ÑÑ‚Ð¾Ð²ÑƒÐ²Ð°Ñ‚Ð¸ Ð¿Ñ–Ð´Ñ€ÑÐ´Ð½Ðµ Ñ€ÐµÑ‡ÐµÐ½Ð½Ñ.\n\n> ðŸ’¡ **ÐŸÑ€Ð°ÐºÑ‚Ð¸Ñ‡Ð½Ð° Ð¿Ð¾Ñ€Ð°Ð´Ð°**\n>\n> ÐÐµ Ð²ÑÑ– Ð´Ñ–Ñ”ÑÐ»Ð¾Ð²Ð° Ð»ÐµÐ³ÐºÐ¾ ÑƒÑ‚Ð²Ð¾Ñ€ÑŽÑŽÑ‚ÑŒ Ð´Ñ–Ñ”Ð¿Ñ€Ð¸ÑÐ»Ñ–Ð²Ð½Ð¸ÐºÐ¸. Ð¯ÐºÑ‰Ð¾ Ñ„Ð¾Ñ€Ð¼Ð° Ð·Ð²ÑƒÑ‡Ð¸Ñ‚ÑŒ Ð½ÐµÐ·Ð²Ð¸Ñ‡Ð½Ð¾, ÐºÑ€Ð°Ñ‰Ðµ Ð²Ð¸ÐºÐ¾Ñ€Ð¸ÑÑ‚Ð¾Ð²ÑƒÐ¹Ñ‚Ðµ Ð¿Ñ–Ð´Ñ€ÑÐ´Ð½Ðµ Ñ€ÐµÑ‡ÐµÐ½Ð½Ñ Ð· Â«ÐºÐ¾Ð»Ð¸Â» Ð°Ð±Ð¾ Â«Ð¿Ð¾ÐºÐ¸Â». ÐÐ°Ð¿Ñ€Ð¸ÐºÐ»Ð°Ð´, Ð·Ð°Ð¼Ñ–ÑÑ‚ÑŒ Ð´Ð¸Ð²Ð½Ð¾Ñ— Ñ„Ð¾Ñ€Ð¼Ð¸ Â«ÑÐ¿Ð°Ñ‡Ð¸Â» Ð²Ð¸ÐºÐ¾Ñ€Ð¸ÑÑ‚Ð¾Ð²ÑƒÐ¹Ñ‚Ðµ Â«Ð¿Ð¾ÐºÐ¸ Ð²Ñ–Ð½ ÑÐ¿Ð°Ð²Â» Ð°Ð±Ð¾ Â«ÐºÐ¾Ð»Ð¸ Ð²Ñ–Ð½ ÑÐ¿Ð°Ð²Â».\n\n---\n\n## Ð”Ñ–Ð°Ð»Ð¾Ð³Ð¸\n\n### Ð”Ñ–Ð°Ð»Ð¾Ð³ 1: ÐÐ° Ñ€Ð¾Ð±Ð¾Ñ‚Ñ–\n\n**ÐœÐ°Ñ€Ñ–Ñ:** Ð©Ð¾ Ñ‚Ð¸ Ñ€Ð¾Ð±Ð¸Ñˆ?\n\n**ÐÐ½Ð´Ñ€Ñ–Ð¹:** ÐŸÑ€Ð°Ñ†ÑŽÑŽ, ÑÐ»ÑƒÑ…Ð°ÑŽÑ‡Ð¸ Ð¿Ð¾Ð´ÐºÐ°ÑÑ‚. Ð¢Ð°Ðº Ð»ÐµÐ³ÑˆÐµ ÐºÐ¾Ð½Ñ†ÐµÐ½Ñ‚Ñ€ÑƒÐ²Ð°Ñ‚Ð¸ÑÑ.\n\n**ÐœÐ°Ñ€Ñ–Ñ:** Ð¡Ð¿Ñ€Ð°Ð²Ð´Ñ–? Ð¯ Ð½Ðµ Ð¼Ð¾Ð¶Ñƒ Ð¿Ñ€Ð°Ñ†ÑŽÐ²Ð°Ñ‚Ð¸, ÑÐ»ÑƒÑ…Ð°ÑŽÑ‡Ð¸ Ñ‰Ð¾ÑÑŒ. ÐœÐµÐ½Ðµ Ñ†Ðµ Ð²Ñ–Ð´Ð²Ð¾Ð»Ñ–ÐºÐ°Ñ”.\n\n**ÐÐ½Ð´Ñ€Ñ–Ð¹:** Ð Ñ Ð½Ð°Ð²Ð¿Ð°ÐºÐ¸. Ð¡Ð¸Ð´ÑÑ‡Ð¸ Ð² Ñ‚Ð¸ÑˆÑ–, ÑˆÐ²Ð¸Ð´ÐºÐ¾ Ð²Ñ‚Ð¾Ð¼Ð»ÑŽÑŽÑÑ.\n\n### Ð”Ñ–Ð°Ð»Ð¾Ð³ 2: ÐŸÑ€Ð¾ Ð²Ð¸Ñ…Ñ–Ð´Ð½Ñ–\n\n**ÐžÐ»ÐµÐ½Ð°:** Ð¯Ðº Ð¿Ñ€Ð¾Ð²ÐµÐ»Ð° Ð²Ð¸Ñ…Ñ–Ð´Ð½Ñ–?\n\n**Ð¢ÐµÑ‚ÑÐ½Ð°:** Ð§ÑƒÐ´Ð¾Ð²Ð¾! Ð“ÑƒÐ»ÑÑŽÑ‡Ð¸ Ð¿Ð°Ñ€ÐºÐ¾Ð¼, Ð·ÑƒÑÑ‚Ñ€Ñ–Ð»Ð° ÑÑ‚Ð°Ñ€Ñƒ Ð¿Ð¾Ð´Ñ€ÑƒÐ³Ñƒ. ÐœÐ¸ Ñ€Ð¾Ð·Ð¼Ð¾Ð²Ð»ÑÐ»Ð¸ Ð³Ð¾Ð´Ð¸Ð½Ñƒ!\n\n**ÐžÐ»ÐµÐ½Ð°:** ÐŸÐ¾Ð²ÐµÑ€Ñ‚Ð°ÑŽÑ‡Ð¸ÑÑŒ Ð´Ð¾Ð´Ð¾Ð¼Ñƒ, Ð½Ðµ Ð·Ð°Ð¼ÐµÑ€Ð·Ð»Ð°? Ð‘ÑƒÐ»Ð¾ Ð¶ Ñ…Ð¾Ð»Ð¾Ð´Ð½Ð¾!\n\n**Ð¢ÐµÑ‚ÑÐ½Ð°:** ÐÑ–, Ð¹Ð´ÑƒÑ‡Ð¸ ÑˆÐ²Ð¸Ð´ÐºÐ¾, Ð½Ðµ Ð¿Ð¾Ð¼Ñ–Ñ‚Ð¸Ð»Ð° Ñ…Ð¾Ð»Ð¾Ð´Ñƒ.\n\n### Ð”Ñ–Ð°Ð»Ð¾Ð³ 3: ÐŸÑ€Ð¾ Ð½Ð°Ð²Ñ‡Ð°Ð½Ð½Ñ\n\n**Ð’Ð¸ÐºÐ»Ð°Ð´Ð°Ñ‡:** Ð¯Ðº Ð²Ð¸ Ð²Ñ‡Ð¸Ñ‚Ðµ Ð½Ð¾Ð²Ñ– ÑÐ»Ð¾Ð²Ð°?\n\n**Ð¡Ñ‚ÑƒÐ´ÐµÐ½Ñ‚:** Ð§Ð¸Ñ‚Ð°ÑŽÑ‡Ð¸ Ñ‚ÐµÐºÑÑ‚Ð¸, Ð²Ð¸Ð¿Ð¸ÑÑƒÑŽ Ð½ÐµÐ·Ð½Ð°Ð¹Ð¾Ð¼Ñ– ÑÐ»Ð¾Ð²Ð°. ÐŸÐ¾Ñ‚Ñ–Ð¼, Ð¿Ð¾Ð²Ñ‚Ð¾Ñ€ÑŽÑŽÑ‡Ð¸ Ñ—Ñ… ÐºÑ–Ð»ÑŒÐºÐ° Ñ€Ð°Ð·Ñ–Ð², Ð·Ð°Ð¿Ð°Ð¼'ÑÑ‚Ð¾Ð²ÑƒÑŽ.\n\n**Ð’Ð¸ÐºÐ»Ð°Ð´Ð°Ñ‡:** Ð“Ð°Ñ€Ð½Ð¸Ð¹ Ð¼ÐµÑ‚Ð¾Ð´! Ð’Ð¸Ð²Ñ‡Ð°ÑŽÑ‡Ð¸ Ð¼Ð¾Ð²Ñƒ Ñ‚Ð°ÐºÐ¸Ð¼ Ñ‡Ð¸Ð½Ð¾Ð¼, Ð²Ð¸ Ð´Ð¾ÑÑÐ³Ð½ÐµÑ‚Ðµ ÑƒÑÐ¿Ñ–Ñ…Ñƒ.\n\n### Ð”Ñ–Ð°Ð»Ð¾Ð³ 4: Ð£ ÐºÐ°Ñ„Ðµ\n\n**ÐžÑ„Ñ–Ñ†Ñ–Ð°Ð½Ñ‚:** Ð¡Ð»ÑƒÑ…Ð°ÑŽ Ð²Ð°Ñ, Ñ‰Ð¾ Ð±ÑƒÐ´ÐµÑ‚Ðµ Ð·Ð°Ð¼Ð¾Ð²Ð»ÑÑ‚Ð¸?\n\n**ÐšÐ»Ñ–Ñ”Ð½Ñ‚:** Ð”Ð¸Ð²Ð»ÑÑ‡Ð¸ÑÑŒ Ð½Ð° Ð¼ÐµÐ½ÑŽ, Ð½Ðµ Ð¼Ð¾Ð¶Ñƒ Ð²Ð¸Ð·Ð½Ð°Ñ‡Ð¸Ñ‚Ð¸ÑÑ. Ð’ÑÐµ Ð²Ð¸Ð³Ð»ÑÐ´Ð°Ñ” ÑÐ¼Ð°Ñ‡Ð½Ð¾!\n\n**ÐžÑ„Ñ–Ñ†Ñ–Ð°Ð½Ñ‚:** Ð ÐµÐºÐ¾Ð¼ÐµÐ½Ð´ÑƒÑŽ Ð±Ð¾Ñ€Ñ‰. Ð‡Ð´ÑÑ‡Ð¸ Ð¹Ð¾Ð³Ð¾, Ð²Ð¸ Ð²Ñ–Ð´Ñ‡ÑƒÑ”Ñ‚Ðµ ÑÐ¿Ñ€Ð°Ð²Ð¶Ð½Ñ–Ð¹ ÑƒÐºÑ€Ð°Ñ—Ð½ÑÑŒÐºÐ¸Ð¹ ÑÐ¼Ð°Ðº.\n\n---\n\n> ðŸ‡ºðŸ‡¦ **ÐŸÑ€Ð°Ð²Ð´Ð° Ð¿Ñ€Ð¾Ñ‚Ð¸ Ð¼Ñ–Ñ„Ñƒ**\n>\n> **ÐœÐ†Ð¤:** Ð”Ñ–Ñ”Ð¿Ñ€Ð¸ÑÐ»Ñ–Ð²Ð½Ð¸ÐºÐ¸ â€” Ñ†Ðµ Ð·Ð°ÑÑ‚Ð°Ñ€Ñ–Ð»Ð° Ñ„Ð¾Ñ€Ð¼Ð°, ÑÐºÑƒ ÑÑƒÑ‡Ð°ÑÐ½Ñ– ÑƒÐºÑ€Ð°Ñ—Ð½Ñ†Ñ– Ð½Ðµ Ð²Ð¸ÐºÐ¾Ñ€Ð¸ÑÑ‚Ð¾Ð²ÑƒÑŽÑ‚ÑŒ.\n>\n> **ÐŸÐ ÐÐ’Ð”Ð:** Ð”Ñ–Ñ”Ð¿Ñ€Ð¸ÑÐ»Ñ–Ð²Ð½Ð¸ÐºÐ¸ Ð°ÐºÑ‚Ð¸Ð²Ð½Ð¾ Ð²Ð¸ÐºÐ¾Ñ€Ð¸ÑÑ‚Ð¾Ð²ÑƒÑŽÑ‚ÑŒÑÑ Ð² ÑÑƒÑ‡Ð°ÑÐ½Ñ–Ð¹ ÑƒÐºÑ€Ð°Ñ—Ð½ÑÑŒÐºÑ–Ð¹ Ð¼Ð¾Ð²Ñ– â€” Ð² Ð¶ÑƒÑ€Ð½Ð°Ð»Ñ–ÑÑ‚Ð¸Ñ†Ñ–, Ð½Ð°ÑƒÑ†Ñ–, Ñ…ÑƒÐ´Ð¾Ð¶Ð½Ñ–Ð¹ Ð»Ñ–Ñ‚ÐµÑ€Ð°Ñ‚ÑƒÑ€Ñ– Ñ‚Ð° Ñ€Ð¾Ð·Ð¼Ð¾Ð²Ð½Ñ–Ð¹ Ð¼Ð¾Ð²Ñ–. Ð’Ð¾Ð½Ð¸ Ñ” Ð¾Ð·Ð½Ð°ÐºÐ¾ÑŽ Ð¾ÑÐ²Ñ–Ñ‡ÐµÐ½Ð¾Ð³Ð¾ Ð¼Ð¾Ð²Ð»ÐµÐ½Ð½Ñ Ñ– Ñ€Ð¾Ð±Ð»ÑÑ‚ÑŒ Ð¼Ð¾Ð²Ñƒ Ð±Ñ–Ð»ÑŒÑˆ Ð²Ð¸Ñ€Ð°Ð·Ð½Ð¾ÑŽ. Ð†Ð¼Ð¿ÐµÑ€ÑÑŒÐºÐ° Ñ€Ð¾ÑÑ–Ð¹ÑÑŒÐºÐ° Ð¿Ñ€Ð¾Ð¿Ð°Ð³Ð°Ð½Ð´Ð° Ñ‡Ð°ÑÑ‚Ð¾ Ð½Ð°Ð¼Ð°Ð³Ð°Ð»Ð°ÑÑ Ð¿Ñ€Ð¸Ð¼ÐµÐ½ÑˆÐ¸Ñ‚Ð¸ Ð±Ð°Ð³Ð°Ñ‚ÑÑ‚Ð²Ð¾ ÑƒÐºÑ€Ð°Ñ—Ð½ÑÑŒÐºÐ¾Ñ— Ð³Ñ€Ð°Ð¼Ð°Ñ‚Ð¸ÐºÐ¸, ÑÑ‚Ð²ÐµÑ€Ð´Ð¶ÑƒÑŽÑ‡Ð¸, Ñ‰Ð¾ ÑƒÐºÑ€Ð°Ñ—Ð½ÑÑŒÐºÐ° â€” Ñ†Ðµ Â«Ð¿Ñ€Ð¾ÑÑ‚Ð° ÑÐµÐ»ÑÐ½ÑÑŒÐºÐ° Ð¼Ð¾Ð²Ð°Â». ÐÐ°ÑÐ¿Ñ€Ð°Ð²Ð´Ñ– ÑƒÐºÑ€Ð°Ñ—Ð½ÑÑŒÐºÐ° Ð¼Ð°Ñ” Ð±Ð°Ð³Ð°Ñ‚Ð¸Ð¹ Ð³Ñ€Ð°Ð¼Ð°Ñ‚Ð¸Ñ‡Ð½Ð¸Ð¹ Ð°Ð¿Ð°Ñ€Ð°Ñ‚, Ð²ÐºÐ»ÑŽÑ‡Ð°ÑŽÑ‡Ð¸ ÑÐ¸ÑÑ‚ÐµÐ¼Ñƒ Ð´Ñ–Ñ”Ð¿Ñ€Ð¸ÑÐ»Ñ–Ð²Ð½Ð¸ÐºÑ–Ð², ÑÐºÐ° Ð·Ð±ÐµÑ€ÐµÐ³Ð»Ð°ÑÑ ÐºÑ€Ð°Ñ‰Ðµ, Ð½Ñ–Ð¶ Ñƒ Ð±Ð°Ð³Ð°Ñ‚ÑŒÐ¾Ñ… ÑÑƒÑÑ–Ð´Ð½Ñ–Ñ… Ð¼Ð¾Ð²Ð°Ñ….\n\n---\n\n> ðŸ“– **Ð†ÑÑ‚Ð¾Ñ€Ð¸Ñ‡Ð½Ð° Ð´Ð¾Ð²Ñ–Ð´ÐºÐ°**\n>\n> Ð”Ñ–Ñ”Ð¿Ñ€Ð¸ÑÐ»Ñ–Ð²Ð½Ð¸ÐºÐ¸ Ñ–ÑÐ½ÑƒÑŽÑ‚ÑŒ Ð² ÑƒÐºÑ€Ð°Ñ—Ð½ÑÑŒÐºÑ–Ð¹ Ð¼Ð¾Ð²Ñ– Ð· Ð´Ð°Ð²Ð½Ñ–Ñ… Ñ‡Ð°ÑÑ–Ð². ÐÐ°Ð²Ñ–Ñ‚ÑŒ Ñƒ Â«Ð¡Ð»Ð¾Ð²Ñ– Ð¾ Ð¿Ð¾Ð»ÐºÑƒ Ð†Ð³Ð¾Ñ€ÐµÐ²Ñ–Ð¼Â» (XII ÑÑ‚Ð¾Ð»Ñ–Ñ‚Ñ‚Ñ) Ñ” Ð´Ñ–Ñ”Ð¿Ñ€Ð¸ÑÐ»Ñ–Ð²Ð½Ð¸ÐºÐ¾Ð²Ñ– ÐºÐ¾Ð½ÑÑ‚Ñ€ÑƒÐºÑ†Ñ–Ñ—. Ð¦Ñ Ð³Ñ€Ð°Ð¼Ð°Ñ‚Ð¸Ñ‡Ð½Ð° Ñ„Ð¾Ñ€Ð¼Ð° â€” ÑÐ¿Ñ–Ð»ÑŒÐ½Ð° ÑÐ¿Ð°Ð´Ñ‰Ð¸Ð½Ð° ÑÐ»Ð¾Ð²'ÑÐ½ÑÑŒÐºÐ¸Ñ… Ð¼Ð¾Ð², Ð°Ð»Ðµ ÑƒÐºÑ€Ð°Ñ—Ð½ÑÑŒÐºÐ° Ð¼Ð¾Ð²Ð° Ð·Ð±ÐµÑ€ÐµÐ³Ð»Ð° Ñ—Ñ— Ð¾ÑÐ¾Ð±Ð»Ð¸Ð²Ð¾ ÑÑÐºÑ€Ð°Ð²Ð¾. ÐÐµÐ·Ð²Ð°Ð¶Ð°ÑŽÑ‡Ð¸ Ð½Ð° Ð·Ð°Ð±Ð¾Ñ€Ð¾Ð½Ð¸ ÑƒÐºÑ€Ð°Ñ—Ð½ÑÑŒÐºÐ¾Ñ— Ð¼Ð¾Ð²Ð¸ Ð¿Ñ–Ð´ Ñ‡Ð°Ñ Ð Ð¾ÑÑ–Ð¹ÑÑŒÐºÐ¾Ñ— Ñ–Ð¼Ð¿ÐµÑ€Ñ–Ñ— (Ð•Ð¼ÑÑŒÐºÐ¸Ð¹ ÑƒÐºÐ°Ð· 1876 Ñ€Ð¾ÐºÑƒ, Ð’Ð°Ð»ÑƒÑ”Ð²ÑÑŒÐºÐ¸Ð¹ Ñ†Ð¸Ñ€ÐºÑƒÐ»ÑÑ€ 1863 Ñ€Ð¾ÐºÑƒ), ÑƒÐºÑ€Ð°Ñ—Ð½Ñ†Ñ– Ð¿Ñ€Ð¾Ð´Ð¾Ð²Ð¶ÑƒÐ²Ð°Ð»Ð¸ Ð²Ð¸ÐºÐ¾Ñ€Ð¸ÑÑ‚Ð¾Ð²ÑƒÐ²Ð°Ñ‚Ð¸ Ð´Ñ–Ñ”Ð¿Ñ€Ð¸ÑÐ»Ñ–Ð²Ð½Ð¸ÐºÐ¸ Ð² ÑƒÑÐ½Ð¾Ð¼Ñƒ Ð¼Ð¾Ð²Ð»ÐµÐ½Ð½Ñ– Ñ‚Ð° Ñ‚Ð°Ñ”Ð¼Ð½Ð¾ Ð² Ð¿Ð¸ÑÐµÐ¼Ð½Ð¾ÑÑ‚Ñ–. Ð¡ÑŒÐ¾Ð³Ð¾Ð´Ð½Ñ– Ñ†Ñ Ð³Ñ€Ð°Ð¼Ð°Ñ‚Ð¸Ñ‡Ð½Ð° Ñ„Ð¾Ñ€Ð¼Ð° Ñ” ÑÐ¸Ð¼Ð²Ð¾Ð»Ð¾Ð¼ Ð½ÐµÐ¿ÐµÑ€ÐµÑ€Ð²Ð½Ð¾ÑÑ‚Ñ– ÑƒÐºÑ€Ð°Ñ—Ð½ÑÑŒÐºÐ¾Ñ— Ð¼Ð¾Ð²Ð½Ð¾Ñ— Ñ‚Ñ€Ð°Ð´Ð¸Ñ†Ñ–Ñ— Ñ‚Ð° Ñ—Ñ— Ð¾Ð¿Ð¾Ñ€Ñƒ Ð°ÑÐ¸Ð¼Ñ–Ð»ÑÑ†Ñ–Ñ—.\n\n---"
      },
      {
        "id": "section-2",
        "name": "ÐŸÑ–Ð´ÑÑƒÐ¼Ð¾Ðº",
        "nameEn": null,
        "type": "summary",
        "content": "**Ð©Ð¾ Ð²Ð¸ Ð½Ð°Ð²Ñ‡Ð¸Ð»Ð¸ÑÑ:**\n\n1. Ð”Ñ–Ñ”Ð¿Ñ€Ð¸ÑÐ»Ñ–Ð²Ð½Ð¸ÐºÐ¸ Ð½ÐµÐ´Ð¾ÐºÐ¾Ð½Ð°Ð½Ð¾Ð³Ð¾ Ð²Ð¸Ð´Ñƒ ÑƒÑ‚Ð²Ð¾Ñ€ÑŽÑŽÑ‚ÑŒÑÑ Ð²Ñ–Ð´ Ð¾ÑÐ½Ð¾Ð²Ð¸ Ñ‚ÐµÐ¿ÐµÑ€Ñ–ÑˆÐ½ÑŒÐ¾Ð³Ð¾ Ñ‡Ð°ÑÑƒ + ÑÑƒÑ„Ñ–ÐºÑ -ÑŽÑ‡Ð¸/-Ð°Ñ‡Ð¸.\n2. Ð’Ð¾Ð½Ð¸ Ð²Ð¸Ñ€Ð°Ð¶Ð°ÑŽÑ‚ÑŒ **Ð¾Ð´Ð½Ð¾Ñ‡Ð°ÑÐ½Ñ–ÑÑ‚ÑŒ** Ð´Ð¾Ð´Ð°Ñ‚ÐºÐ¾Ð²Ð¾Ñ— Ñ‚Ð° Ð¾ÑÐ½Ð¾Ð²Ð½Ð¾Ñ— Ð´Ñ–Ð¹.\n3. Ð¡ÑƒÐ±'Ñ”ÐºÑ‚ Ð´Ñ–Ñ”Ð¿Ñ€Ð¸ÑÐ»Ñ–Ð²Ð½Ð¸ÐºÐ° Ñ– Ð¾ÑÐ½Ð¾Ð²Ð½Ð¾Ð³Ð¾ Ð´Ñ–Ñ”ÑÐ»Ð¾Ð²Ð° Ð¼Ð°ÑŽÑ‚ÑŒ **Ð·Ð±Ñ–Ð³Ð°Ñ‚Ð¸ÑÑ**.\n4. Ð—Ð²Ð¾Ñ€Ð¾Ñ‚Ð½Ñ– Ð´Ñ–Ñ”ÑÐ»Ð¾Ð²Ð° ÑƒÑ‚Ð²Ð¾Ñ€ÑŽÑŽÑ‚ÑŒ Ð´Ñ–Ñ”Ð¿Ñ€Ð¸ÑÐ»Ñ–Ð²Ð½Ð¸ÐºÐ¸ Ð· Ñ‡Ð°ÑÑ‚ÐºÐ¾ÑŽ **-ÑÑŒ**.\n\n**ÐžÑÐ½Ð¾Ð²Ð½Ðµ Ð¿Ñ€Ð°Ð²Ð¸Ð»Ð¾:**\n\n> Ð”Ñ–Ñ”Ð¿Ñ€Ð¸ÑÐ»Ñ–Ð²Ð½Ð¸Ðº Ð²Ñ–Ð´Ð¿Ð¾Ð²Ñ–Ð´Ð°Ñ” Ð½Ð° Ð¿Ð¸Ñ‚Ð°Ð½Ð½Ñ Â«Ð©Ð¾ Ñ€Ð¾Ð±Ð»ÑÑ‡Ð¸?Â» Ñ– Ð¿Ð¾ÐºÐ°Ð·ÑƒÑ”, Ð©Ðž Ñ‰Ðµ Ð²Ñ–Ð´Ð±ÑƒÐ²Ð°Ð»Ð¾ÑÑ Ð¾Ð´Ð½Ð¾Ñ‡Ð°ÑÐ½Ð¾ Ð· Ð¾ÑÐ½Ð¾Ð²Ð½Ð¾ÑŽ Ð´Ñ–Ñ”ÑŽ.\n\n**Ð”Ð°Ð»Ñ–:**\n\nÐ£ Ð½Ð°ÑÑ‚ÑƒÐ¿Ð½Ð¾Ð¼Ñƒ Ð¼Ð¾Ð´ÑƒÐ»Ñ– (43) Ð¼Ð¸ Ñ€Ð¾Ð·Ð³Ð»ÑÐ½ÐµÐ¼Ð¾ Ð´Ñ–Ñ”Ð¿Ñ€Ð¸ÑÐ»Ñ–Ð²Ð½Ð¸ÐºÐ¸ **Ð´Ð¾ÐºÐ¾Ð½Ð°Ð½Ð¾Ð³Ð¾ Ð²Ð¸Ð´Ñƒ** Ð· ÑÑƒÑ„Ñ–ÐºÑÐ°Ð¼Ð¸ -Ð²ÑˆÐ¸/-ÑˆÐ¸, ÑÐºÑ– Ð²Ð¸Ñ€Ð°Ð¶Ð°ÑŽÑ‚ÑŒ **Ð¿Ð¾Ð¿ÐµÑ€ÐµÐ´Ð½Ñ–ÑÑ‚ÑŒ** Ð´Ñ–Ð¹.\n\n> âœ… **Ð¡Ð°Ð¼Ð¾Ð¿ÐµÑ€ÐµÐ²Ñ–Ñ€ÐºÐ°**\n>\n> Ð§Ð¸ Ð¼Ð¾Ð¶ÐµÑ‚Ðµ Ð²Ð¸:\n> - [ ] Ð£Ñ‚Ð²Ð¾Ñ€Ð¸Ñ‚Ð¸ Ð´Ñ–Ñ”Ð¿Ñ€Ð¸ÑÐ»Ñ–Ð²Ð½Ð¸Ðº Ð²Ñ–Ð´ Ð´Ñ–Ñ”ÑÐ»Ñ–Ð²: Ñ‡Ð¸Ñ‚Ð°Ñ‚Ð¸, Ð¿Ð¸ÑÐ°Ñ‚Ð¸, Ð¹Ñ‚Ð¸, ÑÐ¸Ð´Ñ–Ñ‚Ð¸?\n> - [ ] Ð¡ÐºÐ»Ð°ÑÑ‚Ð¸ Ñ€ÐµÑ‡ÐµÐ½Ð½Ñ Ð· Ð´Ñ–Ñ”Ð¿Ñ€Ð¸ÑÐ»Ñ–Ð²Ð½Ð¸ÐºÐ¾Ð¼, Ñ‰Ð¾ Ð²Ð¸Ñ€Ð°Ð¶Ð°Ñ” Ð¾Ð´Ð½Ð¾Ñ‡Ð°ÑÐ½Ñ–ÑÑ‚ÑŒ?\n> - [ ] Ð’Ð¸Ð·Ð½Ð°Ñ‡Ð¸Ñ‚Ð¸ Ð¿Ð¾Ð¼Ð¸Ð»ÐºÑƒ Ð² Ñ€ÐµÑ‡ÐµÐ½Ð½Ñ–: Â«Ð§Ð¸Ñ‚Ð°ÑŽÑ‡Ð¸ ÐºÐ½Ð¸Ð³Ñƒ, Ð¼ÐµÐ½Ñ– ÑÑ‚Ð°Ð»Ð¾ ÑÑƒÐ¼Ð½Ð¾Â»?\n> - [ ] ÐŸÐ¾ÑÑÐ½Ð¸Ñ‚Ð¸ Ñ€Ñ–Ð·Ð½Ð¸Ñ†ÑŽ Ð¼Ñ–Ð¶ Â«Ñ‡Ð¸Ñ‚Ð°ÑŽÑ‡Ð¸Â» Ñ– Â«Ð¿Ñ€Ð¾Ñ‡Ð¸Ñ‚Ð°Ð²ÑˆÐ¸Â»?\n>\n> Ð¯ÐºÑ‰Ð¾ Ñ‚Ð°Ðº â€” Ð²Ð¸ Ð³Ð¾Ñ‚Ð¾Ð²Ñ– Ð´Ð¾ Ð²Ð¿Ñ€Ð°Ð²!\n\n---\n\n> [!resources] ðŸŽ§ Ð—Ð¾Ð²Ð½Ñ–ÑˆÐ½Ñ– Ñ€ÐµÑÑƒÑ€ÑÐ¸\n>\n> **Ð”Ð¾Ð´Ð°Ñ‚ÐºÐ¾Ð²Ñ– Ð¼Ð°Ñ‚ÐµÑ€Ñ–Ð°Ð»Ð¸:**\n> - ðŸ“– [Ð”Ñ–Ñ”Ð¿Ñ€Ð¸ÑÐ»Ñ–Ð²Ð½Ð¸Ðº Ñƒ Ð’Ñ–ÐºÑ–Ð¿ÐµÐ´Ñ–Ñ—](https://uk.wikipedia.org/wiki/Ð”Ñ–Ñ”Ð¿Ñ€Ð¸ÑÐ»Ñ–Ð²Ð½Ð¸Ðº) â€” Ð´ÐµÑ‚Ð°Ð»ÑŒÐ½Ð° Ð³Ñ€Ð°Ð¼Ð°Ñ‚Ð¸Ñ‡Ð½Ð° ÑÑ‚Ð°Ñ‚Ñ‚Ñ\n> - ðŸ“º [Ð”Ñ–Ñ”Ð¿Ñ€Ð¸ÑÐ»Ñ–Ð²Ð½Ð¸ÐºÐ¸: Ð²Ñ–Ð´ÐµÐ¾ Ð¿Ð¾ÑÑÐ½ÐµÐ½Ð½Ñ](https://www.youtube.com/results?search_query=Ð´Ñ–Ñ”Ð¿Ñ€Ð¸ÑÐ»Ñ–Ð²Ð½Ð¸Ðº+ÑƒÐºÑ€Ð°Ñ—Ð½ÑÑŒÐºÐ°) â€” Ð²Ñ–Ð´ÐµÐ¾ÑƒÑ€Ð¾ÐºÐ¸\n\n---"
      },
      {
        "id": "section-3",
        "name": "Ð’Ð¿Ñ€Ð°Ð²Ð¸",
        "nameEn": null,
        "type": "activities",
        "content": "## quiz: Ð¢ÐµÐ¾Ñ€ÐµÑ‚Ð¸Ñ‡Ð½Ñ– Ð·Ð½Ð°Ð½Ð½Ñ Ð¿Ñ€Ð¾ Ð´Ñ–Ñ”Ð¿Ñ€Ð¸ÑÐ»Ñ–Ð²Ð½Ð¸ÐºÐ¸ Ð½ÐµÐ´Ð¾ÐºÐ¾Ð½Ð°Ð½Ð¾Ð³Ð¾ Ð²Ð¸Ð´Ñƒ\n\n> ÐŸÐµÑ€ÐµÐ²Ñ–Ñ€Ñ‚Ðµ ÑÐ²Ð¾Ñ” Ñ€Ð¾Ð·ÑƒÐ¼Ñ–Ð½Ð½Ñ ÑƒÑ‚Ð²Ð¾Ñ€ÐµÐ½Ð½Ñ Ñ‚Ð° Ð²Ð¸ÐºÐ¾Ñ€Ð¸ÑÑ‚Ð°Ð½Ð½Ñ Ð´Ñ–Ñ”Ð¿Ñ€Ð¸ÑÐ»Ñ–Ð²Ð½Ð¸ÐºÑ–Ð² Ð½ÐµÐ´Ð¾ÐºÐ¾Ð½Ð°Ð½Ð¾Ð³Ð¾ Ð²Ð¸Ð´Ñƒ Ð² ÑƒÐºÑ€Ð°Ñ—Ð½ÑÑŒÐºÑ–Ð¹ Ð¼Ð¾Ð²Ñ–.\n\n1. Ð¯ÐºÐ¸Ð¹ ÑÑƒÑ„Ñ–ÐºÑ Ð²Ð¸ÐºÐ¾Ñ€Ð¸ÑÑ‚Ð¾Ð²ÑƒÑ”Ñ‚ÑŒÑÑ Ð´Ð»Ñ ÑƒÑ‚Ð²Ð¾Ñ€ÐµÐ½Ð½Ñ Ð´Ñ–Ñ”Ð¿Ñ€Ð¸ÑÐ»Ñ–Ð²Ð½Ð¸ÐºÐ° Ð½ÐµÐ´Ð¾ÐºÐ¾Ð½Ð°Ð½Ð¾Ð³Ð¾ Ð²Ð¸Ð´Ñƒ Ð²Ñ–Ð´ Ð´Ñ–Ñ”ÑÐ»Ð¾Ð²Ð° Ð· Ð¾ÑÐ½Ð¾Ð²Ð¾ÑŽ Ð½Ð° Ð³Ð¾Ð»Ð¾ÑÐ½Ñƒ?\n   - [x] -ÑŽÑ‡Ð¸\n   - [ ] -Ð²ÑˆÐ¸\n   - [ ] -ÑˆÐ¸Ð¹\n   - [ ] -Ð½Ð¸Ð¹\n   > Ð¡ÑƒÑ„Ñ–ÐºÑ -ÑŽÑ‡Ð¸ Ð´Ð¾Ð´Ð°Ñ”Ñ‚ÑŒÑÑ Ð´Ð¾ Ð¾ÑÐ½Ð¾Ð²Ð¸ Ñ‚ÐµÐ¿ÐµÑ€Ñ–ÑˆÐ½ÑŒÐ¾Ð³Ð¾ Ñ‡Ð°ÑÑƒ Ð½Ð° Ð³Ð¾Ð»Ð¾ÑÐ½Ñƒ: Ñ‡Ð¸Ñ‚Ð°Ñ‚Ð¸ â†’ Ñ‡Ð¸Ñ‚Ð°ÑŽÑ‡Ð¸.\n\n2. Ð¯ÐºÑƒ Ñ„ÑƒÐ½ÐºÑ†Ñ–ÑŽ Ð²Ð¸ÐºÐ¾Ð½ÑƒÑ” Ð´Ñ–Ñ”Ð¿Ñ€Ð¸ÑÐ»Ñ–Ð²Ð½Ð¸Ðº Ð½ÐµÐ´Ð¾ÐºÐ¾Ð½Ð°Ð½Ð¾Ð³Ð¾ Ð²Ð¸Ð´Ñƒ Ð² Ñ€ÐµÑ‡ÐµÐ½Ð½Ñ– Â«Ð§Ð¸Ñ‚Ð°ÑŽÑ‡Ð¸ ÐºÐ½Ð¸Ð³Ñƒ, Ð²Ñ–Ð½ Ð¿Ð¸Ð² ÐºÐ°Ð²ÑƒÂ»?\n   - [x] Ð’Ð¸Ñ€Ð°Ð¶Ð°Ñ” Ð¾Ð´Ð½Ð¾Ñ‡Ð°ÑÐ½Ñ–ÑÑ‚ÑŒ Ð´Ñ–Ð¹\n   - [ ] Ð’Ð¸Ñ€Ð°Ð¶Ð°Ñ” Ð¿Ð¾Ð¿ÐµÑ€ÐµÐ´Ð½Ñ–ÑÑ‚ÑŒ Ð´Ñ–Ð¹\n   - [ ] Ð’Ð¸Ñ€Ð°Ð¶Ð°Ñ” Ñ€ÐµÐ·ÑƒÐ»ÑŒÑ‚Ð°Ñ‚ Ð´Ñ–Ñ—\n   - [ ] Ð’Ð¸Ñ€Ð°Ð¶Ð°Ñ” Ð¿Ñ€Ð¸Ñ‡Ð¸Ð½Ñƒ Ð´Ñ–Ñ—\n   > Ð”Ñ–Ñ”Ð¿Ñ€Ð¸ÑÐ»Ñ–Ð²Ð½Ð¸Ðº ÐÐ”Ð’ Ð¿Ð¾ÐºÐ°Ð·ÑƒÑ”, Ñ‰Ð¾ Ñ‡Ð¸Ñ‚Ð°Ð½Ð½Ñ Ñ– Ð¿Ð¸Ñ‚Ñ‚Ñ Ð²Ñ–Ð´Ð±ÑƒÐ²Ð°Ð»Ð¸ÑÑ Ð¾Ð´Ð½Ð¾Ñ‡Ð°ÑÐ½Ð¾.\n\n3. Ð’Ñ–Ð´ ÑÐºÐ¾Ñ— Ð¾ÑÐ½Ð¾Ð²Ð¸ ÑƒÑ‚Ð²Ð¾Ñ€ÑŽÑ”Ñ‚ÑŒÑÑ Ð´Ñ–Ñ”Ð¿Ñ€Ð¸ÑÐ»Ñ–Ð²Ð½Ð¸Ðº Ð½ÐµÐ´Ð¾ÐºÐ¾Ð½Ð°Ð½Ð¾Ð³Ð¾ Ð²Ð¸Ð´Ñƒ Ð´Ð»Ñ Ð´Ñ–Ñ”ÑÐ»Ð¾Ð²Ð° Â«Ð¿Ð¸ÑÐ°Ñ‚Ð¸Â» Ð² ÑƒÐºÑ€Ð°Ñ—Ð½ÑÑŒÐºÑ–Ð¹ Ð¼Ð¾Ð²Ñ–?\n   - [x] Ð’Ñ–Ð´ Ð¾ÑÐ½Ð¾Ð²Ð¸ Ñ‚ÐµÐ¿ÐµÑ€Ñ–ÑˆÐ½ÑŒÐ¾Ð³Ð¾ Ñ‡Ð°ÑÑƒ (Ð¿Ð¸Ñˆ-)\n   - [ ] Ð’Ñ–Ð´ Ð¾ÑÐ½Ð¾Ð²Ð¸ Ñ–Ð½Ñ„Ñ–Ð½Ñ–Ñ‚Ð¸Ð²Ð° (Ð¿Ð¸ÑÐ°-)\n   - [ ] Ð’Ñ–Ð´ Ð¾ÑÐ½Ð¾Ð²Ð¸ Ð¼Ð¸Ð½ÑƒÐ»Ð¾Ð³Ð¾ Ñ‡Ð°ÑÑƒ (Ð¿Ð¸ÑÐ°-)\n   - [ ] Ð’Ñ–Ð´ Ð¾ÑÐ½Ð¾Ð²Ð¸ Ð¼Ð°Ð¹Ð±ÑƒÑ‚Ð½ÑŒÐ¾Ð³Ð¾ Ñ‡Ð°ÑÑƒ (Ð¿Ð¸ÑÐ°Ñ‚Ð¸Ð¼-)\n   > Ð”Ñ–Ñ”Ð¿Ñ€Ð¸ÑÐ»Ñ–Ð²Ð½Ð¸ÐºÐ¸ ÑƒÑ‚Ð²Ð¾Ñ€ÑŽÑŽÑ‚ÑŒÑÑ Ð²Ñ–Ð´ Ð¾ÑÐ½Ð¾Ð²Ð¸ Ñ‚ÐµÐ¿ÐµÑ€Ñ–ÑˆÐ½ÑŒÐ¾Ð³Ð¾ Ñ‡Ð°ÑÑƒ: Ñ Ð¿Ð¸ÑˆÑƒ â†’ Ð¿Ð¸Ñˆ- â†’ Ð¿Ð¸ÑˆÑƒÑ‡Ð¸.\n\n4. Ð¯ÐºÐµ Ð·Ð°ÐºÑ–Ð½Ñ‡ÐµÐ½Ð½Ñ Ð¼Ð°Ñ” Ð´Ñ–Ñ”Ð¿Ñ€Ð¸ÑÐ»Ñ–Ð²Ð½Ð¸Ðº Ð½ÐµÐ´Ð¾ÐºÐ¾Ð½Ð°Ð½Ð¾Ð³Ð¾ Ð²Ð¸Ð´Ñƒ Ð²Ñ–Ð´ Ð·Ð²Ð¾Ñ€Ð¾Ñ‚Ð½Ð¾Ð³Ð¾ Ð´Ñ–Ñ”ÑÐ»Ð¾Ð²Ð° Â«Ð¾Ð´ÑÐ³Ð°Ñ‚Ð¸ÑÑÂ» Ð² ÑƒÐºÑ€Ð°Ñ—Ð½ÑÑŒÐºÑ–Ð¹ Ð³Ñ€Ð°Ð¼Ð°Ñ‚Ð¸Ñ†Ñ–?\n   - [x] -ÑÑŒ (Ð¾Ð´ÑÐ³Ð°ÑŽÑ‡Ð¸ÑÑŒ)\n   - [ ] -ÑÑ (Ð¾Ð´ÑÐ³Ð°ÑŽÑ‡Ð¸ÑÑ)\n   - [ ] -ÑˆÐ¸ (Ð¾Ð´ÑÐ³Ð°Ð²ÑˆÐ¸)\n   - [ ] -Ð½Ð¸Ð¹ (Ð¾Ð´ÑÐ³Ð°Ð½Ð¸Ð¹)\n   > Ð—Ð²Ð¾Ñ€Ð¾Ñ‚Ð½Ñ– Ð´Ñ–Ñ”ÑÐ»Ð¾Ð²Ð° ÑƒÑ‚Ð²Ð¾Ñ€ÑŽÑŽÑ‚ÑŒ Ð´Ñ–Ñ”Ð¿Ñ€Ð¸ÑÐ»Ñ–Ð²Ð½Ð¸ÐºÐ¸ Ð· Ñ‡Ð°ÑÑ‚ÐºÐ¾ÑŽ -ÑÑŒ: Ð¾Ð´ÑÐ³Ð°Ñ‚Ð¸ÑÑ â†’ Ð¾Ð´ÑÐ³Ð°ÑŽÑ‡Ð¸ÑÑŒ.\n\n5. Ð¯ÐºÐ° Ð³Ñ€Ð°Ð¼Ð°Ñ‚Ð¸Ñ‡Ð½Ð° Ð¿Ð¾Ð¼Ð¸Ð»ÐºÐ° Ð² Ñ€ÐµÑ‡ÐµÐ½Ð½Ñ– Â«Ð§Ð¸Ñ‚Ð°ÑŽÑ‡Ð¸ ÐºÐ½Ð¸Ð³Ñƒ, Ð¼ÐµÐ½Ñ– ÑÑ‚Ð°Ð»Ð¾ ÑÑƒÐ¼Ð½Ð¾Â» Ð· Ñ‚Ð¾Ñ‡ÐºÐ¸ Ð·Ð¾Ñ€Ñƒ ÑƒÐºÑ€Ð°Ñ—Ð½ÑÑŒÐºÐ¾Ñ— Ð³Ñ€Ð°Ð¼Ð°Ñ‚Ð¸ÐºÐ¸?\n   - [x] Ð Ñ–Ð·Ð½Ñ– ÑÑƒÐ±'Ñ”ÐºÑ‚Ð¸ Ð´Ñ–Ñ”Ð¿Ñ€Ð¸ÑÐ»Ñ–Ð²Ð½Ð¸ÐºÐ° Ñ‚Ð° Ð¾ÑÐ½Ð¾Ð²Ð½Ð¾Ð³Ð¾ Ð´Ñ–Ñ”ÑÐ»Ð¾Ð²Ð°\n   - [ ] ÐÐµÐ¿Ñ€Ð°Ð²Ð¸Ð»ÑŒÐ½Ð¸Ð¹ ÑÑƒÑ„Ñ–ÐºÑ Ð´Ñ–Ñ”Ð¿Ñ€Ð¸ÑÐ»Ñ–Ð²Ð½Ð¸ÐºÐ°\n   - [ ] ÐÐµÐ¿Ñ€Ð°Ð²Ð¸Ð»ÑŒÐ½Ð¸Ð¹ Ð²Ñ–Ð´Ð¼Ñ–Ð½Ð¾Ðº Ñ–Ð¼ÐµÐ½Ð½Ð¸ÐºÐ°\n   - [ ] ÐÐµÐ¿Ñ€Ð°Ð²Ð¸Ð»ÑŒÐ½Ð¸Ð¹ Ñ‡Ð°Ñ Ð¾ÑÐ½Ð¾Ð²Ð½Ð¾Ð³Ð¾ Ð´Ñ–Ñ”ÑÐ»Ð¾Ð²Ð°\n   > Ð¡ÑƒÐ±'Ñ”ÐºÑ‚ Ð´Ñ–Ñ”Ð¿Ñ€Ð¸ÑÐ»Ñ–Ð²Ð½Ð¸ÐºÐ° (Ñ…Ñ‚Ð¾ Ñ‡Ð¸Ñ‚Ð°Ð²?) Ð¼Ð°Ñ” Ð·Ð±Ñ–Ð³Ð°Ñ‚Ð¸ÑÑ Ð· ÑÑƒÐ±'Ñ”ÐºÑ‚Ð¾Ð¼ Ð¾ÑÐ½Ð¾Ð²Ð½Ð¾Ð³Ð¾ Ð´Ñ–Ñ”ÑÐ»Ð¾Ð²Ð°.\n\n6. Ð¯ÐºÐ¸Ð¹ Ð¿Ñ€Ð°Ð²Ð¸Ð»ÑŒÐ½Ð¸Ð¹ Ð´Ñ–Ñ”Ð¿Ñ€Ð¸ÑÐ»Ñ–Ð²Ð½Ð¸Ðº ÑƒÑ‚Ð²Ð¾Ñ€ÑŽÑ”Ñ‚ÑŒÑÑ Ð²Ñ–Ð´ Ð´Ñ–Ñ”ÑÐ»Ð¾Ð²Ð° Â«Ð±Ñ–Ð³Ñ‚Ð¸Â» Ð² ÑƒÐºÑ€Ð°Ñ—Ð½ÑÑŒÐºÑ–Ð¹ Ð¼Ð¾Ð²Ñ– Ð· ÑƒÑ€Ð°Ñ…ÑƒÐ²Ð°Ð½Ð½ÑÐ¼ Ñ‡ÐµÑ€Ð³ÑƒÐ²Ð°Ð½Ð½Ñ?\n   - [x] Ð±Ñ–Ð¶Ð°Ñ‡Ð¸\n   - [ ] Ð±Ñ–Ð³ÑƒÑ‡Ð¸\n   - [ ] Ð±Ñ–Ð³Ð°ÑŽÑ‡Ð¸\n   - [ ] Ð±ÐµÐ¶Ð°Ñ‡Ð¸\n   > Ð’Ñ–Ð´ Ð¾ÑÐ½Ð¾Ð²Ð¸ Ñ‚ÐµÐ¿ÐµÑ€Ñ–ÑˆÐ½ÑŒÐ¾Ð³Ð¾ Ñ‡Ð°ÑÑƒ Â«Ð±Ñ–Ð¶-Â» (Ñ Ð±Ñ–Ð¶Ñƒ) + ÑÑƒÑ„Ñ–ÐºÑ -Ð°Ñ‡Ð¸ = Ð±Ñ–Ð¶Ð°Ñ‡Ð¸.\n\n7. ÐÐ° ÑÐºÐµ Ð¿Ð¸Ñ‚Ð°Ð½Ð½Ñ Ð²Ñ–Ð´Ð¿Ð¾Ð²Ñ–Ð´Ð°Ñ” Ð´Ñ–Ñ”Ð¿Ñ€Ð¸ÑÐ»Ñ–Ð²Ð½Ð¸Ðº Ñƒ Ñ€ÐµÑ‡ÐµÐ½Ð½Ñ– Â«Ð™Ð´ÑƒÑ‡Ð¸ Ð²ÑƒÐ»Ð¸Ñ†ÐµÑŽ, Ð²Ñ–Ð½ Ð´ÑƒÐ¼Ð°Ð² Ð¿Ñ€Ð¾ Ñ€Ð¾Ð±Ð¾Ñ‚ÑƒÂ»?\n   - [x] Ð©Ð¾ Ñ€Ð¾Ð±Ð»ÑÑ‡Ð¸?\n   - [ ] Ð©Ð¾ Ð·Ñ€Ð¾Ð±Ð¸Ð²ÑˆÐ¸?\n   - [ ] Ð¯ÐºÐ¸Ð¹?\n   - [ ] ÐšÑƒÐ´Ð¸?\n   > Ð”Ñ–Ñ”Ð¿Ñ€Ð¸ÑÐ»Ñ–Ð²Ð½Ð¸Ðº Ð²Ñ–Ð´Ð¿Ð¾Ð²Ñ–Ð´Ð°Ñ” Ð½Ð° Ð¿Ð¸Ñ‚Ð°Ð½Ð½Ñ Â«Ð©Ð¾ Ñ€Ð¾Ð±Ð»ÑÑ‡Ð¸?Â» â€” Ð™Ð´ÑƒÑ‡Ð¸ (Ñ‰Ð¾ Ñ€Ð¾Ð±Ð»ÑÑ‡Ð¸?) Ð²ÑƒÐ»Ð¸Ñ†ÐµÑŽ.\n\n8. Ð§Ð¾Ð¼Ñƒ Ð´Ñ–Ñ”Ð¿Ñ€Ð¸ÑÐ»Ñ–Ð²Ð½Ð¸Ðº Â«Ñ‡Ð¸Ñ‚Ð°ÑŽÑ‡Ð¸Â» Ð²Ð²Ð°Ð¶Ð°Ñ”Ñ‚ÑŒÑÑ Ñ„Ð¾Ñ€Ð¼Ð¾ÑŽ Ð½ÐµÐ´Ð¾ÐºÐ¾Ð½Ð°Ð½Ð¾Ð³Ð¾ Ð²Ð¸Ð´Ñƒ Ñƒ ÑÐ¸ÑÑ‚ÐµÐ¼Ñ– ÑƒÐºÑ€Ð°Ñ—Ð½ÑÑŒÐºÐ¸Ñ… Ð´Ñ–Ñ”ÑÐ»Ñ–Ð² Ñ–Ð· Ð³Ñ€Ð°Ð¼Ð°Ñ‚Ð¸Ñ‡Ð½Ð¾Ñ— Ñ‚Ð¾Ñ‡ÐºÐ¸ Ð·Ð¾Ñ€Ñƒ?\n   - [x] Ð¢Ð¾Ð¼Ñƒ Ñ‰Ð¾ Ð²Ñ–Ð½ ÑƒÑ‚Ð²Ð¾Ñ€ÐµÐ½Ð¸Ð¹ Ð²Ñ–Ð´ Ð´Ñ–Ñ”ÑÐ»Ð¾Ð²Ð° Ð½ÐµÐ´Ð¾ÐºÐ¾Ð½Ð°Ð½Ð¾Ð³Ð¾ Ð²Ð¸Ð´Ñƒ Â«Ñ‡Ð¸Ñ‚Ð°Ñ‚Ð¸Â»\n   - [ ] Ð¢Ð¾Ð¼Ñƒ Ñ‰Ð¾ Ð²Ñ–Ð½ Ð¼Ð°Ñ” ÑÑƒÑ„Ñ–ÐºÑ -ÑŽÑ‡Ð¸\n   - [ ] Ð¢Ð¾Ð¼Ñƒ Ñ‰Ð¾ Ð²Ñ–Ð½ Ð²Ð¸Ñ€Ð°Ð¶Ð°Ñ” Ð¼Ð¸Ð½ÑƒÐ»Ñƒ Ð´Ñ–ÑŽ\n   - [ ] Ð¢Ð¾Ð¼Ñƒ Ñ‰Ð¾ Ð²Ñ–Ð½ Ñ” Ð·Ð²Ð¾Ñ€Ð¾Ñ‚Ð½Ð¸Ð¼ Ð´Ñ–Ñ”ÑÐ»Ð¾Ð²Ð¾Ð¼\n   > Ð’Ð¸Ð´ Ð´Ñ–Ñ”Ð¿Ñ€Ð¸ÑÐ»Ñ–Ð²Ð½Ð¸ÐºÐ° Ð·Ð°Ð»ÐµÐ¶Ð¸Ñ‚ÑŒ Ð²Ñ–Ð´ Ð²Ð¸Ð´Ñƒ Ð´Ñ–Ñ”ÑÐ»Ð¾Ð²Ð°, Ð²Ñ–Ð´ ÑÐºÐ¾Ð³Ð¾ Ð²Ñ–Ð½ ÑƒÑ‚Ð²Ð¾Ñ€ÐµÐ½Ð¸Ð¹.\n\n9. Ð¯ÐºÑƒ ÑÐ¸Ð½Ñ‚Ð°ÐºÑÐ¸Ñ‡Ð½Ñƒ Ð¿Ð¾Ð·Ð¸Ñ†Ñ–ÑŽ Ð¼Ð¾Ð¶Ðµ Ð·Ð°Ð¹Ð¼Ð°Ñ‚Ð¸ Ð´Ñ–Ñ”Ð¿Ñ€Ð¸ÑÐ»Ñ–Ð²Ð½Ð¸ÐºÐ¾Ð²Ð° ÐºÐ¾Ð½ÑÑ‚Ñ€ÑƒÐºÑ†Ñ–Ñ Â«Ñ‡Ð¸Ñ‚Ð°ÑŽÑ‡Ð¸ ÐºÐ½Ð¸Ð³ÑƒÂ» Ð² ÑƒÐºÑ€Ð°Ñ—Ð½ÑÑŒÐºÐ¾Ð¼Ñƒ Ñ€ÐµÑ‡ÐµÐ½Ð½Ñ–?\n   - [x] ÐÐ° Ð¿Ð¾Ñ‡Ð°Ñ‚ÐºÑƒ, Ð² ÑÐµÑ€ÐµÐ´Ð¸Ð½Ñ– Ð°Ð±Ð¾ Ð² ÐºÑ–Ð½Ñ†Ñ– Ñ€ÐµÑ‡ÐµÐ½Ð½Ñ\n   - [ ] Ð¢Ñ–Ð»ÑŒÐºÐ¸ Ð½Ð° Ð¿Ð¾Ñ‡Ð°Ñ‚ÐºÑƒ Ñ€ÐµÑ‡ÐµÐ½Ð½Ñ\n   - [ ] Ð¢Ñ–Ð»ÑŒÐºÐ¸ Ð² ÐºÑ–Ð½Ñ†Ñ– Ñ€ÐµÑ‡ÐµÐ½Ð½Ñ\n   - [ ] Ð¢Ñ–Ð»ÑŒÐºÐ¸ Ð² ÑÐµÑ€ÐµÐ´Ð¸Ð½Ñ– Ñ€ÐµÑ‡ÐµÐ½Ð½Ñ\n   > Ð”Ñ–Ñ”Ð¿Ñ€Ð¸ÑÐ»Ñ–Ð²Ð½Ð¸ÐºÐ¾Ð²Ð° ÐºÐ¾Ð½ÑÑ‚Ñ€ÑƒÐºÑ†Ñ–Ñ Ð¼Ð¾Ð¶Ðµ ÑÑ‚Ð¾ÑÑ‚Ð¸ Ð² Ð±ÑƒÐ´ÑŒ-ÑÐºÑ–Ð¹ Ð¿Ð¾Ð·Ð¸Ñ†Ñ–Ñ— Ð² Ñ€ÐµÑ‡ÐµÐ½Ð½Ñ–.\n\n10. Ð¯ÐºÐ¸Ð¹ Ð´Ñ–Ñ”Ð¿Ñ€Ð¸ÑÐ»Ñ–Ð²Ð½Ð¸Ðº Ð½ÐµÐ´Ð¾ÐºÐ¾Ð½Ð°Ð½Ð¾Ð³Ð¾ Ð²Ð¸Ð´Ñƒ Ð¿Ñ€Ð°Ð²Ð¸Ð»ÑŒÐ½Ð¾ ÑƒÑ‚Ð²Ð¾Ñ€ÐµÐ½Ð¾ Ð²Ñ–Ð´ Ð·Ð²Ð¾Ñ€Ð¾Ñ‚Ð½Ð¾Ð³Ð¾ Ð´Ñ–Ñ”ÑÐ»Ð¾Ð²Ð° Â«Ð´Ð¸Ð²Ð¸Ñ‚Ð¸ÑÑÂ» Ð² ÑÑƒÑ‡Ð°ÑÐ½Ñ–Ð¹ ÑƒÐºÑ€Ð°Ñ—Ð½ÑÑŒÐºÑ–Ð¹ Ð¼Ð¾Ð²Ñ–?\n    - [x] Ð´Ð¸Ð²Ð»ÑÑ‡Ð¸ÑÑŒ\n    - [ ] Ð´Ð¸Ð²Ð»ÑÑ‡Ð¸\n    - [ ] Ð´Ð¸Ð²Ð¸Ð²ÑˆÐ¸ÑÑŒ\n    - [ ] Ð´Ð¸Ð²Ð¸Ñ‚Ð¸ÑÑŒ\n    > Ð’Ñ–Ð´ Ð¾ÑÐ½Ð¾Ð²Ð¸ Â«Ð´Ð¸Ð²Ð»-Â» (Ñ Ð´Ð¸Ð²Ð»ÑŽÑÑ) + -ÑÑ‡Ð¸ + -ÑÑŒ = Ð´Ð¸Ð²Ð»ÑÑ‡Ð¸ÑÑŒ.\n\n11. Ð§Ð¾Ð¼Ñƒ Ð² Ñ€ÐµÑ‡ÐµÐ½Ð½Ñ– Â«ÐŸÐ¾Ð²ÐµÑ€Ñ‚Ð°ÑŽÑ‡Ð¸ÑÑŒ Ð´Ð¾Ð´Ð¾Ð¼Ñƒ, Ð²Ñ–Ð½ ÐºÑƒÐ¿Ð¸Ð² Ñ…Ð»Ñ–Ð±Ð°Â» Ð´Ñ–Ñ”Ð¿Ñ€Ð¸ÑÐ»Ñ–Ð²Ð½Ð¸Ðº Ð²Ð¸Ñ€Ð°Ð¶Ð°Ñ” Ð¾Ð´Ð½Ð¾Ñ‡Ð°ÑÐ½Ñ–ÑÑ‚ÑŒ Ð´Ñ–Ð¹?\n    - [x] Ð¢Ð¾Ð¼Ñƒ Ñ‰Ð¾ ÐºÑƒÐ¿Ñ–Ð²Ð»Ñ Ð²Ñ–Ð´Ð±ÑƒÐ»Ð°ÑÑ Ð¿Ñ–Ð´ Ñ‡Ð°Ñ Ð¿Ð¾Ð²ÐµÑ€Ð½ÐµÐ½Ð½Ñ Ð´Ð¾Ð´Ð¾Ð¼Ñƒ\n    - [ ] Ð¢Ð¾Ð¼Ñƒ Ñ‰Ð¾ ÐºÑƒÐ¿Ñ–Ð²Ð»Ñ Ð²Ñ–Ð´Ð±ÑƒÐ»Ð°ÑÑ Ð´Ð¾ Ð¿Ð¾Ð²ÐµÑ€Ð½ÐµÐ½Ð½Ñ Ð´Ð¾Ð´Ð¾Ð¼Ñƒ\n    - [ ] Ð¢Ð¾Ð¼Ñƒ Ñ‰Ð¾ ÐºÑƒÐ¿Ñ–Ð²Ð»Ñ Ð²Ñ–Ð´Ð±ÑƒÐ»Ð°ÑÑ Ð¿Ñ–ÑÐ»Ñ Ð¿Ð¾Ð²ÐµÑ€Ð½ÐµÐ½Ð½Ñ Ð´Ð¾Ð´Ð¾Ð¼Ñƒ\n    - [ ] Ð¢Ð¾Ð¼Ñƒ Ñ‰Ð¾ ÐºÑƒÐ¿Ñ–Ð²Ð»Ñ Ñ– Ð¿Ð¾Ð²ÐµÑ€Ð½ÐµÐ½Ð½Ñ Ð½Ðµ Ð¿Ð¾Ð²'ÑÐ·Ð°Ð½Ñ–\n    > Ð”Ñ–Ñ”Ð¿Ñ€Ð¸ÑÐ»Ñ–Ð²Ð½Ð¸Ðº ÐÐ”Ð’ Ð¿Ð¾ÐºÐ°Ð·ÑƒÑ”, Ñ‰Ð¾ Ð´Ñ–Ñ Ð²Ñ–Ð´Ð±ÑƒÐ²Ð°Ð»Ð°ÑÑ Ð¾Ð´Ð½Ð¾Ñ‡Ð°ÑÐ½Ð¾ Ð· Ð¾ÑÐ½Ð¾Ð²Ð½Ð¾ÑŽ.\n\n12. Ð¯ÐºÐ¸Ð¹ ÑÑƒÑ„Ñ–ÐºÑ Ð²Ð¸ÐºÐ¾Ñ€Ð¸ÑÑ‚Ð¾Ð²ÑƒÑ”Ñ‚ÑŒÑÑ Ð´Ð»Ñ ÑƒÑ‚Ð²Ð¾Ñ€ÐµÐ½Ð½Ñ Ð´Ñ–Ñ”Ð¿Ñ€Ð¸ÑÐ»Ñ–Ð²Ð½Ð¸ÐºÐ° Ð²Ñ–Ð´ Ð´Ñ–Ñ”ÑÐ»Ð¾Ð²Ð° Â«ÑÐ¸Ð´Ñ–Ñ‚Ð¸Â» Ð² ÑƒÐºÑ€Ð°Ñ—Ð½ÑÑŒÐºÑ–Ð¹ Ð¼Ð¾Ð²Ñ–?\n    - [x] -ÑÑ‡Ð¸ (ÑÐ¸Ð´ÑÑ‡Ð¸)\n    - [ ] -ÑŽÑ‡Ð¸ (ÑÐ¸Ð´ÑŽÑ‡Ð¸)\n    - [ ] -Ð°Ñ‡Ð¸ (ÑÐ¸Ð´Ð°Ñ‡Ð¸)\n    - [ ] -Ð²ÑˆÐ¸ (ÑÐ¸Ð´Ñ–Ð²ÑˆÐ¸)\n    > Ð’Ñ–Ð´ Ð¾ÑÐ½Ð¾Ð²Ð¸ Â«ÑÐ¸Ð´-Â» + ÑÑƒÑ„Ñ–ÐºÑ -ÑÑ‡Ð¸ = ÑÐ¸Ð´ÑÑ‡Ð¸.\n\n13. Ð¯ÐºÑƒ ÑÑ‚Ð¸Ð»Ñ–ÑÑ‚Ð¸Ñ‡Ð½Ñƒ Ñ„ÑƒÐ½ÐºÑ†Ñ–ÑŽ Ð²Ð¸ÐºÐ¾Ð½ÑƒÑŽÑ‚ÑŒ Ð´Ñ–Ñ”Ð¿Ñ€Ð¸ÑÐ»Ñ–Ð²Ð½Ð¸ÐºÐ¸ Ð½ÐµÐ´Ð¾ÐºÐ¾Ð½Ð°Ð½Ð¾Ð³Ð¾ Ð²Ð¸Ð´Ñƒ Ñƒ ÑÑƒÑ‡Ð°ÑÐ½Ñ–Ð¹ ÑƒÐºÑ€Ð°Ñ—Ð½ÑÑŒÐºÑ–Ð¹ Ð»Ñ–Ñ‚ÐµÑ€Ð°Ñ‚ÑƒÑ€Ñ–, Ð¶ÑƒÑ€Ð½Ð°Ð»Ñ–ÑÑ‚Ð¸Ñ†Ñ– Ñ‚Ð° Ð¿ÑƒÐ±Ð»Ñ–Ñ†Ð¸ÑÑ‚Ð¸Ñ†Ñ–?\n    - [x] Ð’Ð¾Ð½Ð¸ Ñ€Ð¾Ð±Ð»ÑÑ‚ÑŒ Ñ‚ÐµÐºÑÑ‚ Ð±Ñ–Ð»ÑŒÑˆ Ð´Ð¸Ð½Ð°Ð¼Ñ–Ñ‡Ð½Ð¸Ð¼ Ñ– ÑÑ‚Ð¸ÑÐ»Ð¸Ð¼\n    - [ ] Ð’Ð¾Ð½Ð¸ Ñ” Ð·Ð°ÑÑ‚Ð°Ñ€Ñ–Ð»Ð¾ÑŽ Ñ„Ð¾Ñ€Ð¼Ð¾ÑŽ Ñ– Ð½Ðµ Ð²Ð¸ÐºÐ¾Ñ€Ð¸ÑÑ‚Ð¾Ð²ÑƒÑŽÑ‚ÑŒÑÑ\n    - [ ] Ð’Ð¾Ð½Ð¸ Ð²Ð¸ÐºÐ¾Ñ€Ð¸ÑÑ‚Ð¾Ð²ÑƒÑŽÑ‚ÑŒÑÑ Ñ‚Ñ–Ð»ÑŒÐºÐ¸ Ð² Ñ€Ð¾Ð·Ð¼Ð¾Ð²Ð½Ñ–Ð¹ Ð¼Ð¾Ð²Ñ–\n    - [ ] Ð’Ð¾Ð½Ð¸ Ð²Ð¶Ð¸Ð²Ð°ÑŽÑ‚ÑŒÑÑ Ñ‚Ñ–Ð»ÑŒÐºÐ¸ Ð² ÑŽÑ€Ð¸Ð´Ð¸Ñ‡Ð½Ð¸Ñ… Ð´Ð¾ÐºÑƒÐ¼ÐµÐ½Ñ‚Ð°Ñ…\n    > Ð”Ñ–Ñ”Ð¿Ñ€Ð¸ÑÐ»Ñ–Ð²Ð½Ð¸ÐºÐ¸ Ð°ÐºÑ‚Ð¸Ð²Ð½Ð¾ Ð²Ð¶Ð¸Ð²Ð°ÑŽÑ‚ÑŒÑÑ Ð² ÑÑƒÑ‡Ð°ÑÐ½Ñ–Ð¹ Ð¼Ð¾Ð²Ñ– Ñ– Ñ€Ð¾Ð±Ð»ÑÑ‚ÑŒ Ñ‚ÐµÐºÑÑ‚ Ð²Ð¸Ñ€Ð°Ð·Ð½Ñ–ÑˆÐ¸Ð¼.\n\n14. Ð§Ð¾Ð¼Ñƒ Ð²Ñ–Ð´ Ð´Ñ–Ñ”ÑÐ»Ð¾Ð²Ð° Â«ÑÐ¿Ð°Ñ‚Ð¸Â» Ð²Ð°Ð¶ÐºÐ¾ ÑƒÑ‚Ð²Ð¾Ñ€Ð¸Ñ‚Ð¸ Ð¿Ñ€Ð¸Ñ€Ð¾Ð´Ð½Ð¸Ð¹ Ñ‚Ð° Ð¼Ð¸Ð»Ð¾Ð·Ð²ÑƒÑ‡Ð½Ð¸Ð¹ Ð´Ñ–Ñ”Ð¿Ñ€Ð¸ÑÐ»Ñ–Ð²Ð½Ð¸Ðº Ð½ÐµÐ´Ð¾ÐºÐ¾Ð½Ð°Ð½Ð¾Ð³Ð¾ Ð²Ð¸Ð´Ñƒ Ð² ÑƒÐºÑ€Ð°Ñ—Ð½ÑÑŒÐºÑ–Ð¹ Ð¼Ð¾Ð²Ñ–?\n    - [x] Ð¢Ð¾Ð¼Ñƒ Ñ‰Ð¾ Ð½Ðµ Ð²ÑÑ– Ð´Ñ–Ñ”ÑÐ»Ð¾Ð²Ð° Ð»ÐµÐ³ÐºÐ¾ ÑƒÑ‚Ð²Ð¾Ñ€ÑŽÑŽÑ‚ÑŒ Ð´Ñ–Ñ”Ð¿Ñ€Ð¸ÑÐ»Ñ–Ð²Ð½Ð¸ÐºÐ¾Ð²Ñ– Ñ„Ð¾Ñ€Ð¼Ð¸\n    - [ ] Ð¢Ð¾Ð¼Ñƒ Ñ‰Ð¾ Â«ÑÐ¿Ð°Ñ‚Ð¸Â» â€” Ð·Ð²Ð¾Ñ€Ð¾Ñ‚Ð½Ðµ Ð´Ñ–Ñ”ÑÐ»Ð¾Ð²Ð¾\n    - [ ] Ð¢Ð¾Ð¼Ñƒ Ñ‰Ð¾ Â«ÑÐ¿Ð°Ñ‚Ð¸Â» â€” Ð´Ñ–Ñ”ÑÐ»Ð¾Ð²Ð¾ Ð´Ð¾ÐºÐ¾Ð½Ð°Ð½Ð¾Ð³Ð¾ Ð²Ð¸Ð´Ñƒ\n    - [ ] Ð¢Ð¾Ð¼Ñƒ Ñ‰Ð¾ Â«ÑÐ¿Ð°Ñ‚Ð¸Â» â€” Ð½ÐµÐ¿ÐµÑ€ÐµÑ…Ñ–Ð´Ð½Ðµ Ð´Ñ–Ñ”ÑÐ»Ð¾Ð²Ð¾\n    > Ð”ÐµÑÐºÑ– Ð´Ñ–Ñ”ÑÐ»Ð¾Ð²Ð° Ð½Ðµ Ð¼Ð°ÑŽÑ‚ÑŒ Ð¿Ñ€Ð¸Ñ€Ð¾Ð´Ð½Ð¸Ñ… Ð´Ñ–Ñ”Ð¿Ñ€Ð¸ÑÐ»Ñ–Ð²Ð½Ð¸ÐºÐ¾Ð²Ð¸Ñ… Ñ„Ð¾Ñ€Ð¼ Ñƒ Ð¼Ð¾Ð²Ð»ÐµÐ½Ð½Ñ–.\n\n## match-up: Ð†Ð½Ñ„Ñ–Ð½Ñ–Ñ‚Ð¸Ð² Ñ‚Ð° Ð²Ñ–Ð´Ð¿Ð¾Ð²Ñ–Ð´Ð½Ð¸Ð¹ Ð´Ñ–Ñ”Ð¿Ñ€Ð¸ÑÐ»Ñ–Ð²Ð½Ð¸Ðº\n\n> Ð—Ð½Ð°Ð¹Ð´Ñ–Ñ‚ÑŒ Ð¿Ñ€Ð°Ð²Ð¸Ð»ÑŒÐ½Ñ– Ð¿Ð°Ñ€Ð¸: Ð´Ñ–Ñ”ÑÐ»Ð¾Ð²Ð¾ Ñ‚Ð° Ð¹Ð¾Ð³Ð¾ Ð´Ñ–Ñ”Ð¿Ñ€Ð¸ÑÐ»Ñ–Ð²Ð½Ð¸Ðº Ð½ÐµÐ´Ð¾ÐºÐ¾Ð½Ð°Ð½Ð¾Ð³Ð¾ Ð²Ð¸Ð´Ñƒ.\n\n- Ñ‡Ð¸Ñ‚Ð°Ñ‚Ð¸ :: Ñ‡Ð¸Ñ‚Ð°ÑŽÑ‡Ð¸\n- Ð¿Ð¸ÑÐ°Ñ‚Ð¸ :: Ð¿Ð¸ÑˆÑƒÑ‡Ð¸\n- Ð¹Ñ‚Ð¸ :: Ð¹Ð´ÑƒÑ‡Ð¸\n- Ð±Ñ–Ð³Ñ‚Ð¸ :: Ð±Ñ–Ð¶Ð°Ñ‡Ð¸\n- Ð³Ð¾Ð²Ð¾Ñ€Ð¸Ñ‚Ð¸ :: Ð³Ð¾Ð²Ð¾Ñ€ÑÑ‡Ð¸\n- ÑÐ»ÑƒÑ…Ð°Ñ‚Ð¸ :: ÑÐ»ÑƒÑ…Ð°ÑŽÑ‡Ð¸\n- ÑÐ¸Ð´Ñ–Ñ‚Ð¸ :: ÑÐ¸Ð´ÑÑ‡Ð¸\n- ÑÑ‚Ð¾ÑÑ‚Ð¸ :: ÑÑ‚Ð¾ÑÑ‡Ð¸\n- Ð´Ð¸Ð²Ð¸Ñ‚Ð¸ÑÑ :: Ð´Ð¸Ð²Ð»ÑÑ‡Ð¸ÑÑŒ\n- Ð²Ð¼Ð¸Ð²Ð°Ñ‚Ð¸ÑÑ :: Ð²Ð¼Ð¸Ð²Ð°ÑŽÑ‡Ð¸ÑÑŒ\n- Ð¾Ð´ÑÐ³Ð°Ñ‚Ð¸ÑÑ :: Ð¾Ð´ÑÐ³Ð°ÑŽÑ‡Ð¸ÑÑŒ\n- Ð¿Ð¾Ð²ÐµÑ€Ñ‚Ð°Ñ‚Ð¸ÑÑ :: Ð¿Ð¾Ð²ÐµÑ€Ñ‚Ð°ÑŽÑ‡Ð¸ÑÑŒ\n- Ð³Ð¾Ñ‚ÑƒÐ²Ð°Ñ‚Ð¸ÑÑ :: Ð³Ð¾Ñ‚ÑƒÑŽÑ‡Ð¸ÑÑŒ\n- Ð½ÐµÑÑ‚Ð¸ :: Ð½ÐµÑÑƒÑ‡Ð¸\n\n## fill-in: Ð£Ñ‚Ð²Ð¾Ñ€ÐµÐ½Ð½Ñ Ð´Ñ–Ñ”Ð¿Ñ€Ð¸ÑÐ»Ñ–Ð²Ð½Ð¸ÐºÑ–Ð² Ð½ÐµÐ´Ð¾ÐºÐ¾Ð½Ð°Ð½Ð¾Ð³Ð¾ Ð²Ð¸Ð´Ñƒ\n> Ð—Ð°Ð¿Ð¾Ð²Ð½Ñ–Ñ‚ÑŒ Ð¿Ñ€Ð¾Ð¿ÑƒÑÐºÐ¸ Ð¿Ñ€Ð°Ð²Ð¸Ð»ÑŒÐ½Ð¾ÑŽ Ñ„Ð¾Ñ€Ð¼Ð¾ÑŽ Ð´Ñ–Ñ”Ð¿Ñ€Ð¸ÑÐ»Ñ–Ð²Ð½Ð¸ÐºÐ° Ð½ÐµÐ´Ð¾ÐºÐ¾Ð½Ð°Ð½Ð¾Ð³Ð¾ Ð²Ð¸Ð´Ñƒ Ð²Ñ–Ð´ Ð´Ñ–Ñ”ÑÐ»Ð¾Ð²Ð° Ð² Ð´ÑƒÐ¶ÐºÐ°Ñ….\n\n1. ___ (Ñ‡Ð¸Ñ‚Ð°Ñ‚Ð¸) Ð³Ð°Ð·ÐµÑ‚Ñƒ, Ð±Ð°Ñ‚ÑŒÐºÐ¾ ÑÐ½Ñ–Ð´Ð°Ð² Ð½Ð° ÐºÑƒÑ…Ð½Ñ–.\n   > [!answer] Ð§Ð¸Ñ‚Ð°ÑŽÑ‡Ð¸\n   > [!options] Ð§Ð¸Ñ‚Ð°ÑŽÑ‡Ð¸ | Ð§Ð¸Ñ‚Ð°Ð²ÑˆÐ¸ | ÐŸÑ€Ð¾Ñ‡Ð¸Ñ‚Ð°Ð²ÑˆÐ¸ | Ð§Ð¸Ñ‚Ð°ÑŽÐ²ÑˆÐ¸\n   > Ð”Ñ–Ñ”Ð¿Ñ€Ð¸ÑÐ»Ñ–Ð²Ð½Ð¸Ðº ÐÐ”Ð’ Ð²Ñ–Ð´ Â«Ñ‡Ð¸Ñ‚Ð°Ñ‚Ð¸Â» â€” Â«Ñ‡Ð¸Ñ‚Ð°ÑŽÑ‡Ð¸Â».\n\n2. ___ (ÑÐ»ÑƒÑ…Ð°Ñ‚Ð¸) Ð¼ÑƒÐ·Ð¸ÐºÑƒ, Ð²Ð¾Ð½Ð° Ñ€Ð¾Ð±Ð¸Ð»Ð° Ð´Ð¾Ð¼Ð°ÑˆÐ½Ñ” Ð·Ð°Ð²Ð´Ð°Ð½Ð½Ñ.\n   > [!answer] Ð¡Ð»ÑƒÑ…Ð°ÑŽÑ‡Ð¸\n   > [!options] Ð¡Ð»ÑƒÑ…Ð°ÑŽÑ‡Ð¸ | Ð¡Ð»ÑƒÑ…Ð°Ð²ÑˆÐ¸ | ÐŸÐ¾ÑÐ»ÑƒÑ…Ð°Ð²ÑˆÐ¸ | Ð¡Ð»ÑƒÑ…Ð°ÑŽÐ²ÑˆÐ¸\n   > Ð”Ñ–Ñ”Ð¿Ñ€Ð¸ÑÐ»Ñ–Ð²Ð½Ð¸Ðº ÐÐ”Ð’ Ð²Ñ–Ð´ Â«ÑÐ»ÑƒÑ…Ð°Ñ‚Ð¸Â» â€” Â«ÑÐ»ÑƒÑ…Ð°ÑŽÑ‡Ð¸Â».\n\n3. ___ (Ð¹Ñ‚Ð¸) Ð²ÑƒÐ»Ð¸Ñ†ÐµÑŽ, Ñ Ð·ÑƒÑÑ‚Ñ€Ñ–Ð² ÑÐ²Ð¾Ð³Ð¾ ÑÑ‚Ð°Ñ€Ð¾Ð³Ð¾ Ð´Ñ€ÑƒÐ³Ð°.\n   > [!answer] Ð™Ð´ÑƒÑ‡Ð¸\n   > [!options] Ð™Ð´ÑƒÑ‡Ð¸ | ÐŸÑ–ÑˆÐ¾Ð²ÑˆÐ¸ | Ð™Ð´Ñ–Ð²ÑˆÐ¸ | Ð™ÑˆÐ¾Ð²ÑˆÐ¸\n   > Ð”Ñ–Ñ”Ð¿Ñ€Ð¸ÑÐ»Ñ–Ð²Ð½Ð¸Ðº ÐÐ”Ð’ Ð²Ñ–Ð´ Â«Ð¹Ñ‚Ð¸Â» â€” Â«Ð¹Ð´ÑƒÑ‡Ð¸Â».\n\n4. ___ (Ð±Ñ–Ð³Ñ‚Ð¸) Ð´Ð¾ Ð°Ð²Ñ‚Ð¾Ð±ÑƒÑÐ°, Ð²Ñ–Ð½ Ð·Ð°Ð³ÑƒÐ±Ð¸Ð² ÐºÐ»ÑŽÑ‡Ñ–.\n   > [!answer] Ð‘Ñ–Ð¶Ð°Ñ‡Ð¸\n   > [!options] Ð‘Ñ–Ð¶Ð°Ñ‡Ð¸ | Ð‘Ñ–Ð³ÑƒÑ‡Ð¸ | ÐŸÐ¾Ð±Ñ–Ð³ÑˆÐ¸ | Ð‘Ñ–Ð³Ð°ÑŽÑ‡Ð¸\n   > Ð”Ñ–Ñ”Ð¿Ñ€Ð¸ÑÐ»Ñ–Ð²Ð½Ð¸Ðº ÐÐ”Ð’ Ð²Ñ–Ð´ Â«Ð±Ñ–Ð³Ñ‚Ð¸Â» â€” Â«Ð±Ñ–Ð¶Ð°Ñ‡Ð¸Â» (Ð²Ñ–Ð´ Ð¾ÑÐ½Ð¾Ð²Ð¸ Â«Ð±Ñ–Ð¶-Â»).\n\n5. ___ (Ð³Ð¾Ð²Ð¾Ñ€Ð¸Ñ‚Ð¸) Ð¿Ð¾ Ñ‚ÐµÐ»ÐµÑ„Ð¾Ð½Ñƒ, Ð²Ð¾Ð½Ð° Ð³Ð¾Ñ‚ÑƒÐ²Ð°Ð»Ð° Ð²ÐµÑ‡ÐµÑ€ÑŽ.\n   > [!answer] Ð“Ð¾Ð²Ð¾Ñ€ÑÑ‡Ð¸\n   > [!options] Ð“Ð¾Ð²Ð¾Ñ€ÑÑ‡Ð¸ | Ð“Ð¾Ð²Ð¾Ñ€ÑŽÑ‡Ð¸ | ÐŸÐ¾Ð³Ð¾Ð²Ð¾Ñ€Ð¸Ð²ÑˆÐ¸ | Ð“Ð¾Ð²Ð¾Ñ€Ñ–Ð²ÑˆÐ¸\n   > Ð”Ñ–Ñ”Ð¿Ñ€Ð¸ÑÐ»Ñ–Ð²Ð½Ð¸Ðº ÐÐ”Ð’ Ð²Ñ–Ð´ Â«Ð³Ð¾Ð²Ð¾Ñ€Ð¸Ñ‚Ð¸Â» â€” Â«Ð³Ð¾Ð²Ð¾Ñ€ÑÑ‡Ð¸Â».\n\n6. ___ (ÑÐ¸Ð´Ñ–Ñ‚Ð¸) Ð² Ð¿Ð°Ñ€ÐºÑƒ, Ð´Ñ–Ñ‚Ð¸ Ð³Ñ€Ð°Ð»Ð¸ÑÑ Ð· Ð¼'ÑÑ‡ÐµÐ¼.\n   > [!answer] Ð¡Ð¸Ð´ÑÑ‡Ð¸\n   > [!options] Ð¡Ð¸Ð´ÑÑ‡Ð¸ | Ð¡Ð¸Ð´Ñ–ÑŽÑ‡Ð¸ | ÐŸÐ¾ÑÐ¸Ð´Ñ–Ð²ÑˆÐ¸ | Ð¡Ð¸Ð´Ñ–Ð²ÑˆÐ¸\n   > Ð”Ñ–Ñ”Ð¿Ñ€Ð¸ÑÐ»Ñ–Ð²Ð½Ð¸Ðº ÐÐ”Ð’ Ð²Ñ–Ð´ Â«ÑÐ¸Ð´Ñ–Ñ‚Ð¸Â» â€” Â«ÑÐ¸Ð´ÑÑ‡Ð¸Â».\n\n7. ___ (Ð¿Ð¸ÑÐ°Ñ‚Ð¸) Ð»Ð¸ÑÑ‚Ð°, Ð²Ñ–Ð½ Ð´ÑƒÐ¼Ð°Ð² Ð¿Ñ€Ð¾ ÑÐ²Ð¾ÑŽ ÑÑ–Ð¼'ÑŽ.\n   > [!answer] ÐŸÐ¸ÑˆÑƒÑ‡Ð¸\n   > [!options] ÐŸÐ¸ÑˆÑƒÑ‡Ð¸ | ÐŸÐ¸ÑÐ°ÑŽÑ‡Ð¸ | ÐÐ°Ð¿Ð¸ÑÐ°Ð²ÑˆÐ¸ | ÐŸÐ¸ÑÐ°Ð²ÑˆÐ¸\n   > Ð”Ñ–Ñ”Ð¿Ñ€Ð¸ÑÐ»Ñ–Ð²Ð½Ð¸Ðº ÐÐ”Ð’ Ð²Ñ–Ð´ Â«Ð¿Ð¸ÑÐ°Ñ‚Ð¸Â» â€” Â«Ð¿Ð¸ÑˆÑƒÑ‡Ð¸Â» (Ð²Ñ–Ð´ Ð¾ÑÐ½Ð¾Ð²Ð¸ Â«Ð¿Ð¸Ñˆ-Â»).\n\n8. ___ (Ð´Ð¸Ð²Ð¸Ñ‚Ð¸ÑÑ) Ñƒ Ð²Ñ–ÐºÐ½Ð¾, Ð±Ð°Ð±ÑƒÑÑ Ñ‡ÐµÐºÐ°Ð»Ð° Ð½Ð° Ð¾Ð½ÑƒÐºÑ–Ð².\n   > [!answer] Ð”Ð¸Ð²Ð»ÑÑ‡Ð¸ÑÑŒ\n   > [!options] Ð”Ð¸Ð²Ð»ÑÑ‡Ð¸ÑÑŒ | Ð”Ð¸Ð²Ð»ÑŽÑ‡Ð¸ÑÑŒ | ÐŸÐ¾Ð´Ð¸Ð²Ð¸Ð²ÑˆÐ¸ÑÑŒ | Ð”Ð¸Ð²Ð»ÑÑ‡Ð¸ÑÑ\n   > Ð”Ñ–Ñ”Ð¿Ñ€Ð¸ÑÐ»Ñ–Ð²Ð½Ð¸Ðº ÐÐ”Ð’ Ð²Ñ–Ð´ Ð·Ð²Ð¾Ñ€Ð¾Ñ‚Ð½Ð¾Ð³Ð¾ Â«Ð´Ð¸Ð²Ð¸Ñ‚Ð¸ÑÑÂ» â€” Â«Ð´Ð¸Ð²Ð»ÑÑ‡Ð¸ÑÑŒÂ».\n\n9. ___ (Ð¿Ð¾Ð²ÐµÑ€Ñ‚Ð°Ñ‚Ð¸ÑÑ) Ð· Ñ€Ð¾Ð±Ð¾Ñ‚Ð¸, Ð²Ñ–Ð½ Ð·Ð°Ð²Ð¶Ð´Ð¸ ÐºÑƒÐ¿ÑƒÐ²Ð°Ð² Ñ…Ð»Ñ–Ð±.\n   > [!answer] ÐŸÐ¾Ð²ÐµÑ€Ñ‚Ð°ÑŽÑ‡Ð¸ÑÑŒ\n   > [!options] ÐŸÐ¾Ð²ÐµÑ€Ñ‚Ð°ÑŽÑ‡Ð¸ÑÑŒ | ÐŸÐ¾Ð²ÐµÑ€Ð½ÑƒÐ²ÑˆÐ¸ÑÑŒ | ÐŸÐ¾Ð²ÐµÑ€Ñ‚ÑƒÐ²ÑˆÐ¸ÑÑŒ | ÐŸÐ¾Ð²ÐµÑ€Ñ‚Ð°ÑŽÑ‡Ð¸ÑÑ\n   > Ð”Ñ–Ñ”Ð¿Ñ€Ð¸ÑÐ»Ñ–Ð²Ð½Ð¸Ðº ÐÐ”Ð’ Ð²Ñ–Ð´ Â«Ð¿Ð¾Ð²ÐµÑ€Ñ‚Ð°Ñ‚Ð¸ÑÑÂ» â€” Â«Ð¿Ð¾Ð²ÐµÑ€Ñ‚Ð°ÑŽÑ‡Ð¸ÑÑŒÂ».\n\n10. ___ (Ð³Ð¾Ñ‚ÑƒÐ²Ð°Ñ‚Ð¸ÑÑ) Ð´Ð¾ Ñ–ÑÐ¿Ð¸Ñ‚Ñƒ, ÑÑ‚ÑƒÐ´ÐµÐ½Ñ‚Ð¸ Ð½Ðµ ÑÐ¿Ð°Ð»Ð¸ Ð²ÑÑŽ Ð½Ñ–Ñ‡.\n    > [!answer] Ð“Ð¾Ñ‚ÑƒÑŽÑ‡Ð¸ÑÑŒ\n    > [!options] Ð“Ð¾Ñ‚ÑƒÑŽÑ‡Ð¸ÑÑŒ | ÐŸÑ€Ð¸Ð³Ð¾Ñ‚ÑƒÐ²Ð°Ð²ÑˆÐ¸ÑÑŒ | Ð“Ð¾Ñ‚Ð¾Ð²Ð¸Ð²ÑˆÐ¸ÑÑŒ | Ð“Ð¾Ñ‚ÑƒÑŽÑ‡Ð¸ÑÑ\n    > Ð”Ñ–Ñ”Ð¿Ñ€Ð¸ÑÐ»Ñ–Ð²Ð½Ð¸Ðº ÐÐ”Ð’ Ð²Ñ–Ð´ Â«Ð³Ð¾Ñ‚ÑƒÐ²Ð°Ñ‚Ð¸ÑÑÂ» â€” Â«Ð³Ð¾Ñ‚ÑƒÑŽÑ‡Ð¸ÑÑŒÂ».\n\n11. ___ (Ð½ÐµÑÑ‚Ð¸) Ð²Ð°Ð¶ÐºÑ– ÑÑƒÐ¼ÐºÐ¸, Ð¼Ð°Ð¼Ð° Ð¹ÑˆÐ»Ð° Ð´Ð¾ Ð´Ð¾Ð¼Ñƒ.\n    > [!answer] ÐÐµÑÑƒÑ‡Ð¸\n    > [!options] ÐÐµÑÑƒÑ‡Ð¸ | ÐÐµÑÑÑ‡Ð¸ | ÐŸÑ€Ð¸Ð½Ñ–ÑÑˆÐ¸ | ÐÐµÑÑ–Ð²ÑˆÐ¸\n    > Ð”Ñ–Ñ”Ð¿Ñ€Ð¸ÑÐ»Ñ–Ð²Ð½Ð¸Ðº ÐÐ”Ð’ Ð²Ñ–Ð´ Â«Ð½ÐµÑÑ‚Ð¸Â» â€” Â«Ð½ÐµÑÑƒÑ‡Ð¸Â».\n\n12. ___ (ÑÑ‚Ð¾ÑÑ‚Ð¸) Ð² Ñ‡ÐµÑ€Ð·Ñ–, Ð»ÑŽÐ´Ð¸ Ñ€Ð¾Ð·Ð¼Ð¾Ð²Ð»ÑÐ»Ð¸ Ð¿Ñ€Ð¾ Ð¿Ð¾Ð³Ð¾Ð´Ñƒ.\n    > [!answer] Ð¡Ñ‚Ð¾ÑÑ‡Ð¸\n    > [!options] Ð¡Ñ‚Ð¾ÑÑ‡Ð¸ | Ð¡Ñ‚Ð¾ÑŽÑ‡Ð¸ | ÐŸÐ¾ÑÑ‚Ð¾ÑÐ²ÑˆÐ¸ | Ð¡Ñ‚Ð¾ÑÑŽÑ‡Ð¸\n    > Ð”Ñ–Ñ”Ð¿Ñ€Ð¸ÑÐ»Ñ–Ð²Ð½Ð¸Ðº ÐÐ”Ð’ Ð²Ñ–Ð´ Â«ÑÑ‚Ð¾ÑÑ‚Ð¸Â» â€” Â«ÑÑ‚Ð¾ÑÑ‡Ð¸Â».\n\n13. ___ (Ð²Ð¼Ð¸Ð²Ð°Ñ‚Ð¸ÑÑ) Ñ…Ð¾Ð»Ð¾Ð´Ð½Ð¾ÑŽ Ð²Ð¾Ð´Ð¾ÑŽ, Ð²Ñ–Ð½ Ð¿Ñ€Ð¾ÐºÐ¸Ð´Ð°Ð²ÑÑ ÑˆÐ²Ð¸Ð´ÑˆÐµ.\n    > [!answer] Ð’Ð¼Ð¸Ð²Ð°ÑŽÑ‡Ð¸ÑÑŒ\n    > [!options] Ð’Ð¼Ð¸Ð²Ð°ÑŽÑ‡Ð¸ÑÑŒ | Ð’Ð¼Ð¸Ð²ÑˆÐ¸ÑÑŒ | Ð’Ð¼Ð¸Ð²Ð°ÑŽÑ‡Ð¸ÑÑ | Ð’Ð¼Ð¸Ð²Ð°Ð²ÑˆÐ¸ÑÑŒ\n    > Ð”Ñ–Ñ”Ð¿Ñ€Ð¸ÑÐ»Ñ–Ð²Ð½Ð¸Ðº ÐÐ”Ð’ Ð²Ñ–Ð´ Â«Ð²Ð¼Ð¸Ð²Ð°Ñ‚Ð¸ÑÑÂ» â€” Â«Ð²Ð¼Ð¸Ð²Ð°ÑŽÑ‡Ð¸ÑÑŒÂ».\n\n14. ___ (Ð¾Ð´ÑÐ³Ð°Ñ‚Ð¸ÑÑ) Ð¿Ð¾ÑÐ¿Ñ–Ñ…Ð¾Ð¼, Ð²Ð¾Ð½Ð° Ð·Ð°Ð±ÑƒÐ»Ð° Ð²Ð·ÑÑ‚Ð¸ Ð¿Ð°Ñ€Ð°ÑÐ¾Ð»ÑŒÐºÑƒ.\n    > [!answer] ÐžÐ´ÑÐ³Ð°ÑŽÑ‡Ð¸ÑÑŒ\n    > [!options] ÐžÐ´ÑÐ³Ð°ÑŽÑ‡Ð¸ÑÑŒ | ÐžÐ´ÑÐ³Ð½ÑƒÐ²ÑˆÐ¸ÑÑŒ | ÐžÐ´ÑÐ³Ð°ÑŽÑ‡Ð¸ÑÑ | ÐžÐ´ÑÐ³Ð°Ð²ÑˆÐ¸ÑÑŒ\n    > Ð”Ñ–Ñ”Ð¿Ñ€Ð¸ÑÐ»Ñ–Ð²Ð½Ð¸Ðº ÐÐ”Ð’ Ð²Ñ–Ð´ Â«Ð¾Ð´ÑÐ³Ð°Ñ‚Ð¸ÑÑÂ» â€” Â«Ð¾Ð´ÑÐ³Ð°ÑŽÑ‡Ð¸ÑÑŒÂ».\n\n## true-false: ÐŸÑ€Ð°Ð²Ð¸Ð»Ð° Ð²Ð¶Ð¸Ð²Ð°Ð½Ð½Ñ Ð´Ñ–Ñ”Ð¿Ñ€Ð¸ÑÐ»Ñ–Ð²Ð½Ð¸ÐºÑ–Ð²\n\n> Ð’Ð¸Ð·Ð½Ð°Ñ‡Ñ‚Ðµ, Ñ‡Ð¸ Ð¿Ñ€Ð°Ð²Ð¸Ð»ÑŒÐ½Ñ– Ñ‚Ð²ÐµÑ€Ð´Ð¶ÐµÐ½Ð½Ñ Ð¿Ñ€Ð¾ Ð´Ñ–Ñ”Ð¿Ñ€Ð¸ÑÐ»Ñ–Ð²Ð½Ð¸ÐºÐ¸ Ð½ÐµÐ´Ð¾ÐºÐ¾Ð½Ð°Ð½Ð¾Ð³Ð¾ Ð²Ð¸Ð´Ñƒ.\n\n- [x] Ð”Ñ–Ñ”Ð¿Ñ€Ð¸ÑÐ»Ñ–Ð²Ð½Ð¸ÐºÐ¸ Ð½ÐµÐ´Ð¾ÐºÐ¾Ð½Ð°Ð½Ð¾Ð³Ð¾ Ð²Ð¸Ð´Ñƒ ÑƒÑ‚Ð²Ð¾Ñ€ÑŽÑŽÑ‚ÑŒÑÑ Ð²Ñ–Ð´ Ð¾ÑÐ½Ð¾Ð²Ð¸ Ñ‚ÐµÐ¿ÐµÑ€Ñ–ÑˆÐ½ÑŒÐ¾Ð³Ð¾ Ñ‡Ð°ÑÑƒ.\n  > ÐŸÑ€Ð°Ð²Ð¸Ð»ÑŒÐ½Ð¾! ÐžÑÐ½Ð¾Ð²Ð° Ð±ÐµÑ€ÐµÑ‚ÑŒÑÑ Ð· Ñ„Ð¾Ñ€Ð¼Ð¸ Ñ‚ÐµÐ¿ÐµÑ€Ñ–ÑˆÐ½ÑŒÐ¾Ð³Ð¾ Ñ‡Ð°ÑÑƒ: Ñ‡Ð¸Ñ‚Ð°Ñ‚Ð¸ â†’ Ñ‡Ð¸Ñ‚Ð°ÑŽ â†’ Ñ‡Ð¸Ñ‚Ð°-.\n\n- [ ] Ð¡ÑƒÑ„Ñ–ÐºÑ -Ð²ÑˆÐ¸ Ð²Ð¸ÐºÐ¾Ñ€Ð¸ÑÑ‚Ð¾Ð²ÑƒÑ”Ñ‚ÑŒÑÑ Ð´Ð»Ñ ÑƒÑ‚Ð²Ð¾Ñ€ÐµÐ½Ð½Ñ Ð´Ñ–Ñ”Ð¿Ñ€Ð¸ÑÐ»Ñ–Ð²Ð½Ð¸ÐºÑ–Ð² Ð½ÐµÐ´Ð¾ÐºÐ¾Ð½Ð°Ð½Ð¾Ð³Ð¾ Ð²Ð¸Ð´Ñƒ.\n  > ÐÐµÐ¿Ñ€Ð°Ð²Ð¸Ð»ÑŒÐ½Ð¾! Ð¡ÑƒÑ„Ñ–ÐºÑ -Ð²ÑˆÐ¸ Ð²Ð¸ÐºÐ¾Ñ€Ð¸ÑÑ‚Ð¾Ð²ÑƒÑ”Ñ‚ÑŒÑÑ Ð´Ð»Ñ Ð´Ð¾ÐºÐ¾Ð½Ð°Ð½Ð¾Ð³Ð¾ Ð²Ð¸Ð´Ñƒ. ÐÐ”Ð’ Ð¼Ð°Ñ” ÑÑƒÑ„Ñ–ÐºÑÐ¸ -ÑŽÑ‡Ð¸/-Ð°Ñ‡Ð¸.\n\n- [ ] Ð”Ñ–Ñ”Ð¿Ñ€Ð¸ÑÐ»Ñ–Ð²Ð½Ð¸Ðº Ñ– Ð¾ÑÐ½Ð¾Ð²Ð½Ðµ Ð´Ñ–Ñ”ÑÐ»Ð¾Ð²Ð¾ Ð¼Ð¾Ð¶ÑƒÑ‚ÑŒ Ð¼Ð°Ñ‚Ð¸ Ñ€Ñ–Ð·Ð½Ð¸Ñ… ÑÑƒÐ±'Ñ”ÐºÑ‚Ñ–Ð².\n  > ÐÐµÐ¿Ñ€Ð°Ð²Ð¸Ð»ÑŒÐ½Ð¾! Ð¡ÑƒÐ±'Ñ”ÐºÑ‚ Ð´Ñ–Ñ”Ð¿Ñ€Ð¸ÑÐ»Ñ–Ð²Ð½Ð¸ÐºÐ° Ñ– Ð¾ÑÐ½Ð¾Ð²Ð½Ð¾Ð³Ð¾ Ð´Ñ–Ñ”ÑÐ»Ð¾Ð²Ð° Ð¼Ð°ÑŽÑ‚ÑŒ Ð·Ð±Ñ–Ð³Ð°Ñ‚Ð¸ÑÑ.\n\n- [x] Ð”Ñ–Ñ”Ð¿Ñ€Ð¸ÑÐ»Ñ–Ð²Ð½Ð¸ÐºÐ¸ Ð½ÐµÐ´Ð¾ÐºÐ¾Ð½Ð°Ð½Ð¾Ð³Ð¾ Ð²Ð¸Ð´Ñƒ Ð²Ð¸Ñ€Ð°Ð¶Ð°ÑŽÑ‚ÑŒ Ð¾Ð´Ð½Ð¾Ñ‡Ð°ÑÐ½Ñ–ÑÑ‚ÑŒ Ð´Ñ–Ð¹.\n  > ÐŸÑ€Ð°Ð²Ð¸Ð»ÑŒÐ½Ð¾! ÐÐ”Ð’ Ð¿Ð¾ÐºÐ°Ð·ÑƒÑ”, Ñ‰Ð¾ Ð´Ð²Ñ– Ð´Ñ–Ñ— Ð²Ñ–Ð´Ð±ÑƒÐ²Ð°ÑŽÑ‚ÑŒÑÑ Ð¾Ð´Ð½Ð¾Ñ‡Ð°ÑÐ½Ð¾.\n\n- [ ] Ð’Ñ–Ð´ Ð´Ñ–Ñ”ÑÐ»Ð¾Ð²Ð° Â«Ð¿Ð¸ÑÐ°Ñ‚Ð¸Â» Ð´Ñ–Ñ”Ð¿Ñ€Ð¸ÑÐ»Ñ–Ð²Ð½Ð¸Ðº ÑƒÑ‚Ð²Ð¾Ñ€ÑŽÑ”Ñ‚ÑŒÑÑ Ð· Ð¾ÑÐ½Ð¾Ð²Ð¾ÑŽ Â«Ð¿Ð¸ÑÐ°-Â».\n  > ÐÐµÐ¿Ñ€Ð°Ð²Ð¸Ð»ÑŒÐ½Ð¾! ÐžÑÐ½Ð¾Ð²Ð° Ð±ÐµÑ€ÐµÑ‚ÑŒÑÑ Ð· Ñ‚ÐµÐ¿ÐµÑ€Ñ–ÑˆÐ½ÑŒÐ¾Ð³Ð¾ Ñ‡Ð°ÑÑƒ: Ñ Ð¿Ð¸ÑˆÑƒ â†’ Ð¿Ð¸Ñˆ- â†’ Ð¿Ð¸ÑˆÑƒÑ‡Ð¸.\n\n- [x] Ð—Ð²Ð¾Ñ€Ð¾Ñ‚Ð½Ñ– Ð´Ñ–Ñ”ÑÐ»Ð¾Ð²Ð° ÑƒÑ‚Ð²Ð¾Ñ€ÑŽÑŽÑ‚ÑŒ Ð´Ñ–Ñ”Ð¿Ñ€Ð¸ÑÐ»Ñ–Ð²Ð½Ð¸ÐºÐ¸ Ð· Ñ‡Ð°ÑÑ‚ÐºÐ¾ÑŽ -ÑÑŒ.\n  > ÐŸÑ€Ð°Ð²Ð¸Ð»ÑŒÐ½Ð¾! ÐÐ°Ð¿Ñ€Ð¸ÐºÐ»Ð°Ð´: Ð¾Ð´ÑÐ³Ð°Ñ‚Ð¸ÑÑ â†’ Ð¾Ð´ÑÐ³Ð°ÑŽÑ‡Ð¸ÑÑŒ.\n\n- [ ] Ð”Ñ–Ñ”Ð¿Ñ€Ð¸ÑÐ»Ñ–Ð²Ð½Ð¸ÐºÐ¾Ð²Ð° ÐºÐ¾Ð½ÑÑ‚Ñ€ÑƒÐºÑ†Ñ–Ñ Ð¼Ð¾Ð¶Ðµ ÑÑ‚Ð¾ÑÑ‚Ð¸ Ñ‚Ñ–Ð»ÑŒÐºÐ¸ Ð½Ð° Ð¿Ð¾Ñ‡Ð°Ñ‚ÐºÑƒ Ñ€ÐµÑ‡ÐµÐ½Ð½Ñ.\n  > ÐÐµÐ¿Ñ€Ð°Ð²Ð¸Ð»ÑŒÐ½Ð¾! Ð”Ñ–Ñ”Ð¿Ñ€Ð¸ÑÐ»Ñ–Ð²Ð½Ð¸Ðº Ð¼Ð¾Ð¶Ðµ Ð±ÑƒÑ‚Ð¸ Ð½Ð° Ð¿Ð¾Ñ‡Ð°Ñ‚ÐºÑƒ, Ð² ÑÐµÑ€ÐµÐ´Ð¸Ð½Ñ– Ð°Ð±Ð¾ Ð² ÐºÑ–Ð½Ñ†Ñ– Ñ€ÐµÑ‡ÐµÐ½Ð½Ñ.\n\n- [x] Ð”Ñ–Ñ”Ð¿Ñ€Ð¸ÑÐ»Ñ–Ð²Ð½Ð¸Ðº Â«Ð±Ñ–Ð¶Ð°Ñ‡Ð¸Â» ÑƒÑ‚Ð²Ð¾Ñ€ÐµÐ½Ð¸Ð¹ Ð²Ñ–Ð´ Ð¾ÑÐ½Ð¾Ð²Ð¸ Â«Ð±Ñ–Ð¶-Â».\n  > ÐŸÑ€Ð°Ð²Ð¸Ð»ÑŒÐ½Ð¾! Ð‘Ñ–Ð³Ñ‚Ð¸ â†’ Ð±Ñ–Ð¶Ñƒ â†’ Ð±Ñ–Ð¶- + -Ð°Ñ‡Ð¸ = Ð±Ñ–Ð¶Ð°Ñ‡Ð¸.\n\n- [ ] Ð”Ñ–Ñ”Ð¿Ñ€Ð¸ÑÐ»Ñ–Ð²Ð½Ð¸Ðº Ð²Ñ–Ð´Ð¿Ð¾Ð²Ñ–Ð´Ð°Ñ” Ð½Ð° Ð¿Ð¸Ñ‚Ð°Ð½Ð½Ñ Â«Ð¯ÐºÐ¸Ð¹?Â».\n  > ÐÐµÐ¿Ñ€Ð°Ð²Ð¸Ð»ÑŒÐ½Ð¾! Ð”Ñ–Ñ”Ð¿Ñ€Ð¸ÑÐ»Ñ–Ð²Ð½Ð¸Ðº Ð²Ñ–Ð´Ð¿Ð¾Ð²Ñ–Ð´Ð°Ñ” Ð½Ð° Ð¿Ð¸Ñ‚Ð°Ð½Ð½Ñ Â«Ð©Ð¾ Ñ€Ð¾Ð±Ð»ÑÑ‡Ð¸?Â» Ð°Ð±Ð¾ Â«Ð¯Ðº?Â».\n\n- [x] Ð”Ñ–Ñ”Ð¿Ñ€Ð¸ÑÐ»Ñ–Ð²Ð½Ð¸ÐºÐ¸ Ð°ÐºÑ‚Ð¸Ð²Ð½Ð¾ Ð²Ð¸ÐºÐ¾Ñ€Ð¸ÑÑ‚Ð¾Ð²ÑƒÑŽÑ‚ÑŒÑÑ Ð² ÑÑƒÑ‡Ð°ÑÐ½Ñ–Ð¹ ÑƒÐºÑ€Ð°Ñ—Ð½ÑÑŒÐºÑ–Ð¹ Ð¼Ð¾Ð²Ñ–.\n  > ÐŸÑ€Ð°Ð²Ð¸Ð»ÑŒÐ½Ð¾! Ð”Ñ–Ñ”Ð¿Ñ€Ð¸ÑÐ»Ñ–Ð²Ð½Ð¸ÐºÐ¸ Ñ‡Ð°ÑÑ‚Ð¾ Ð²Ð¶Ð¸Ð²Ð°ÑŽÑ‚ÑŒÑÑ Ð² Ð¶ÑƒÑ€Ð½Ð°Ð»Ñ–ÑÑ‚Ð¸Ñ†Ñ–, Ð»Ñ–Ñ‚ÐµÑ€Ð°Ñ‚ÑƒÑ€Ñ– Ñ‚Ð° Ñ€Ð¾Ð·Ð¼Ð¾Ð²Ð½Ð¾Ð¼Ñƒ Ð¼Ð¾Ð²Ð»ÐµÐ½Ð½Ñ–.\n\n- [x] Ð’Ñ–Ð´ Ð´Ñ–Ñ”ÑÐ»Ð¾Ð²Ð° Â«Ð¹Ñ‚Ð¸Â» Ð´Ñ–Ñ”Ð¿Ñ€Ð¸ÑÐ»Ñ–Ð²Ð½Ð¸Ðº â€” Â«Ð¹Ð´ÑƒÑ‡Ð¸Â».\n  > ÐŸÑ€Ð°Ð²Ð¸Ð»ÑŒÐ½Ð¾! Ð™Ñ‚Ð¸ â†’ Ð¹Ð´Ñƒ â†’ Ð¹Ð´- + -ÑƒÑ‡Ð¸ = Ð¹Ð´ÑƒÑ‡Ð¸.\n\n- [ ] Ð¡ÑƒÑ„Ñ–ÐºÑ -ÑŽÑ‡Ð¸ Ð´Ð¾Ð´Ð°Ñ”Ñ‚ÑŒÑÑ Ð¿Ñ–ÑÐ»Ñ Ð¿Ñ€Ð¸Ð³Ð¾Ð»Ð¾ÑÐ½Ð¾Ñ—.\n  > ÐÐµÐ¿Ñ€Ð°Ð²Ð¸Ð»ÑŒÐ½Ð¾! Ð¡ÑƒÑ„Ñ–ÐºÑ -ÑŽÑ‡Ð¸ Ð´Ð¾Ð´Ð°Ñ”Ñ‚ÑŒÑÑ Ð¿Ñ–ÑÐ»Ñ Ð³Ð¾Ð»Ð¾ÑÐ½Ð¾Ñ—, Ð° -Ð°Ñ‡Ð¸ â€” Ð¿Ñ–ÑÐ»Ñ Ð¿Ñ€Ð¸Ð³Ð¾Ð»Ð¾ÑÐ½Ð¾Ñ—.\n\n- [ ] Ð ÐµÑ‡ÐµÐ½Ð½Ñ Â«Ð§Ð¸Ñ‚Ð°ÑŽÑ‡Ð¸ ÐºÐ½Ð¸Ð³Ñƒ, Ð¼ÐµÐ½Ñ– ÑÑ‚Ð°Ð»Ð¾ ÑÑƒÐ¼Ð½Ð¾Â» Ñ” Ð³Ñ€Ð°Ð¼Ð°Ñ‚Ð¸Ñ‡Ð½Ð¾ Ð¿Ñ€Ð°Ð²Ð¸Ð»ÑŒÐ½Ð¸Ð¼.\n  > ÐÐµÐ¿Ñ€Ð°Ð²Ð¸Ð»ÑŒÐ½Ð¾! Ð¡ÑƒÐ±'Ñ”ÐºÑ‚Ð¸ Ð½Ðµ Ð·Ð±Ñ–Ð³Ð°ÑŽÑ‚ÑŒÑÑ: Ñ…Ñ‚Ð¾ Ñ‡Ð¸Ñ‚Ð°Ð²? Ð¥Ñ‚Ð¾ Ð·Ð°ÑÑƒÐ¼ÑƒÐ²Ð°Ð²? ÐŸÑ€Ð°Ð²Ð¸Ð»ÑŒÐ½Ð¾: Â«Ð§Ð¸Ñ‚Ð°ÑŽÑ‡Ð¸ ÐºÐ½Ð¸Ð³Ñƒ, Ñ Ð·Ð°ÑÑƒÐ¼ÑƒÐ²Ð°Ð²Â».\n\n- [x] Ð”Ñ–Ñ”Ð¿Ñ€Ð¸ÑÐ»Ñ–Ð²Ð½Ð¸Ðº Â«ÑÐ»ÑƒÑ…Ð°ÑŽÑ‡Ð¸Â» ÑƒÑ‚Ð²Ð¾Ñ€ÐµÐ½Ð¸Ð¹ Ð²Ñ–Ð´ Ð´Ñ–Ñ”ÑÐ»Ð¾Ð²Ð° Ð½ÐµÐ´Ð¾ÐºÐ¾Ð½Ð°Ð½Ð¾Ð³Ð¾ Ð²Ð¸Ð´Ñƒ.\n  > ÐŸÑ€Ð°Ð²Ð¸Ð»ÑŒÐ½Ð¾! Â«Ð¡Ð»ÑƒÑ…Ð°Ñ‚Ð¸Â» â€” Ð´Ñ–Ñ”ÑÐ»Ð¾Ð²Ð¾ Ð½ÐµÐ´Ð¾ÐºÐ¾Ð½Ð°Ð½Ð¾Ð³Ð¾ Ð²Ð¸Ð´Ñƒ.\n\n## group-sort: ÐšÐ»Ð°ÑÐ¸Ñ„Ñ–ÐºÐ°Ñ†Ñ–Ñ Ñ„Ð¾Ñ€Ð¼ Ð´Ñ–Ñ”Ð¿Ñ€Ð¸ÑÐ»Ñ–Ð²Ð½Ð¸ÐºÑ–Ð²\n\n> Ð Ð¾Ð·Ð¿Ð¾Ð´Ñ–Ð»Ñ–Ñ‚ÑŒ ÑÐ»Ð¾Ð²Ð° Ð½Ð° Ñ‚Ñ€Ð¸ Ð³Ñ€ÑƒÐ¿Ð¸: Ð¿Ñ€Ð°Ð²Ð¸Ð»ÑŒÐ½Ð¾ ÑƒÑ‚Ð²Ð¾Ñ€ÐµÐ½Ñ– Ð´Ñ–Ñ”Ð¿Ñ€Ð¸ÑÐ»Ñ–Ð²Ð½Ð¸ÐºÐ¸ ÐÐ”Ð’, Ð´Ñ–Ñ”Ð¿Ñ€Ð¸ÑÐ»Ñ–Ð²Ð½Ð¸ÐºÐ¸ Ð”Ð’ Ñ‚Ð° Ð½ÐµÐ¿Ñ€Ð°Ð²Ð¸Ð»ÑŒÐ½Ñ– Ñ„Ð¾Ñ€Ð¼Ð¸.\n\n### Ð”Ñ–Ñ”Ð¿Ñ€Ð¸ÑÐ»Ñ–Ð²Ð½Ð¸ÐºÐ¸ ÐÐ”Ð’ (Ð¿Ñ€Ð°Ð²Ð¸Ð»ÑŒÐ½Ñ–)\n- Ñ‡Ð¸Ñ‚Ð°ÑŽÑ‡Ð¸\n- Ð¿Ð¸ÑˆÑƒÑ‡Ð¸\n- Ð¹Ð´ÑƒÑ‡Ð¸\n- Ð±Ñ–Ð¶Ð°Ñ‡Ð¸\n- Ð³Ð¾Ð²Ð¾Ñ€ÑÑ‡Ð¸\n- ÑÐ»ÑƒÑ…Ð°ÑŽÑ‡Ð¸\n- ÑÐ¸Ð´ÑÑ‡Ð¸\n- Ð´Ð¸Ð²Ð»ÑÑ‡Ð¸ÑÑŒ\n\n### Ð”Ñ–Ñ”Ð¿Ñ€Ð¸ÑÐ»Ñ–Ð²Ð½Ð¸ÐºÐ¸ Ð”Ð’ (Ð¿Ñ€Ð°Ð²Ð¸Ð»ÑŒÐ½Ñ–)\n- Ð¿Ñ€Ð¾Ñ‡Ð¸Ñ‚Ð°Ð²ÑˆÐ¸\n- Ð½Ð°Ð¿Ð¸ÑÐ°Ð²ÑˆÐ¸\n- Ð¿Ñ–ÑˆÐ¾Ð²ÑˆÐ¸\n- Ð¿Ð¾Ð±Ñ–Ð¶Ð°Ð²ÑˆÐ¸\n- ÑÐºÐ°Ð·Ð°Ð²ÑˆÐ¸\n- Ð¿Ð¾ÑÐ»ÑƒÑ…Ð°Ð²ÑˆÐ¸\n\n### ÐÐµÐ¿Ñ€Ð°Ð²Ð¸Ð»ÑŒÐ½Ñ– Ñ„Ð¾Ñ€Ð¼Ð¸\n- Ð¿Ð¸ÑÐ°ÑŽÑ‡Ð¸\n- Ð±Ñ–Ð³ÑƒÑ‡Ð¸\n- Ñ‡Ð¸Ñ‚Ð°Ð²ÑˆÐ¸\n- Ð¹Ð´ÑƒÐ²ÑˆÐ¸\n- Ð³Ð¾Ð²Ð¾Ñ€ÑŽÑ‡Ð¸\n- ÑÐ¸Ð´Ñ–ÑŽÑ‡Ð¸\n\n## unjumble: ÐŸÐ¾Ð±ÑƒÐ´Ð¾Ð²Ð° Ñ€ÐµÑ‡ÐµÐ½ÑŒ Ð· Ð´Ñ–Ñ”Ð¿Ñ€Ð¸ÑÐ»Ñ–Ð²Ð½Ð¸ÐºÐ°Ð¼Ð¸\n\n> Ð Ð¾Ð·Ñ‚Ð°ÑˆÑƒÐ¹Ñ‚Ðµ ÑÐ»Ð¾Ð²Ð° Ð² Ð¿Ñ€Ð°Ð²Ð¸Ð»ÑŒÐ½Ð¾Ð¼Ñƒ Ð¿Ð¾Ñ€ÑÐ´ÐºÑƒ, Ñ‰Ð¾Ð± ÑƒÑ‚Ð²Ð¾Ñ€Ð¸Ñ‚Ð¸ Ð³Ñ€Ð°Ð¼Ð°Ñ‚Ð¸Ñ‡Ð½Ð¾ Ð¿Ñ€Ð°Ð²Ð¸Ð»ÑŒÐ½Ðµ Ñ€ÐµÑ‡ÐµÐ½Ð½Ñ Ð· Ð´Ñ–Ñ”Ð¿Ñ€Ð¸ÑÐ»Ñ–Ð²Ð½Ð¸ÐºÐ¾Ð¼.\n\n1. Ñ‡Ð¸Ñ‚Ð°ÑŽÑ‡Ð¸ / Ñ†Ñ–ÐºÐ°Ð²Ñƒ / ÑÑ‚Ð°Ñ‚Ñ‚ÑŽ / Ð¿Ñ€Ð¾ / ÑƒÐºÑ€Ð°Ñ—Ð½ÑÑŒÐºÑƒ / Ñ–ÑÑ‚Ð¾Ñ€Ñ–ÑŽ / Ð²Ñ–Ð½ / Ð·Ð°Ð¿Ð¸ÑÑƒÐ²Ð°Ð² / Ð²Ð°Ð¶Ð»Ð¸Ð²Ñ– / Ñ„Ð°ÐºÑ‚Ð¸ / Ð² / Ð·Ð¾ÑˆÐ¸Ñ‚ / Ð´Ð»Ñ / Ð¿Ð°Ð¼'ÑÑ‚Ñ–\n   > [!answer] Ð§Ð¸Ñ‚Ð°ÑŽÑ‡Ð¸ Ñ†Ñ–ÐºÐ°Ð²Ñƒ ÑÑ‚Ð°Ñ‚Ñ‚ÑŽ Ð¿Ñ€Ð¾ ÑƒÐºÑ€Ð°Ñ—Ð½ÑÑŒÐºÑƒ Ñ–ÑÑ‚Ð¾Ñ€Ñ–ÑŽ, Ð²Ñ–Ð½ Ð·Ð°Ð¿Ð¸ÑÑƒÐ²Ð°Ð² Ð²Ð°Ð¶Ð»Ð¸Ð²Ñ– Ñ„Ð°ÐºÑ‚Ð¸ Ð² Ð·Ð¾ÑˆÐ¸Ñ‚ Ð´Ð»Ñ Ð¿Ð°Ð¼'ÑÑ‚Ñ–.\n\n2. Ð¹Ð´ÑƒÑ‡Ð¸ / Ð²Ñ€Ð°Ð½Ñ†Ñ– / Ð´Ð¾ / Ñ€Ð¾Ð±Ð¾Ñ‚Ð¸ / Ñ‡ÐµÑ€ÐµÐ· / Ñ†ÐµÐ½Ñ‚Ñ€Ð°Ð»ÑŒÐ½Ð¸Ð¹ / Ð¿Ð°Ñ€Ðº / Ð²Ð¾Ð½Ð° / Ð·Ð°Ð²Ð¶Ð´Ð¸ / Ð½Ð°ÑÐ¾Ð»Ð¾Ð´Ð¶ÑƒÐ²Ð°Ð»Ð°ÑÑ / ÑÐ²Ñ–Ð¶Ð¸Ð¼ / Ð¿Ð¾Ð²Ñ–Ñ‚Ñ€ÑÐ¼ / Ñ– / ÐºÑ€Ð°ÑÐ¾ÑŽ\n   > [!answer] Ð™Ð´ÑƒÑ‡Ð¸ Ð²Ñ€Ð°Ð½Ñ†Ñ– Ð´Ð¾ Ñ€Ð¾Ð±Ð¾Ñ‚Ð¸ Ñ‡ÐµÑ€ÐµÐ· Ñ†ÐµÐ½Ñ‚Ñ€Ð°Ð»ÑŒÐ½Ð¸Ð¹ Ð¿Ð°Ñ€Ðº, Ð²Ð¾Ð½Ð° Ð·Ð°Ð²Ð¶Ð´Ð¸ Ð½Ð°ÑÐ¾Ð»Ð¾Ð´Ð¶ÑƒÐ²Ð°Ð»Ð°ÑÑ ÑÐ²Ñ–Ð¶Ð¸Ð¼ Ð¿Ð¾Ð²Ñ–Ñ‚Ñ€ÑÐ¼ Ñ– ÐºÑ€Ð°ÑÐ¾ÑŽ.\n\n3. ÑÐ»ÑƒÑ…Ð°ÑŽÑ‡Ð¸ / ÑƒÐ²Ð°Ð¶Ð½Ð¾ / Ð¿Ð¾ÑÑÐ½ÐµÐ½Ð½Ñ / Ð²Ð¸ÐºÐ»Ð°Ð´Ð°Ñ‡Ð° / Ð¿Ñ€Ð¾ / Ð³Ñ€Ð°Ð¼Ð°Ñ‚Ð¸ÐºÑƒ / ÑÑ‚ÑƒÐ´ÐµÐ½Ñ‚Ð¸ / Ð·Ð°Ð¿Ð¸ÑÑƒÐ²Ð°Ð»Ð¸ / Ð²ÑÑ– / Ð²Ð°Ð¶Ð»Ð¸Ð²Ñ– / Ð¿Ñ€Ð°Ð²Ð¸Ð»Ð° / Ð´Ð¾ / Ð·Ð¾ÑˆÐ¸Ñ‚Ñ–Ð²\n   > [!answer] Ð¡Ð»ÑƒÑ…Ð°ÑŽÑ‡Ð¸ ÑƒÐ²Ð°Ð¶Ð½Ð¾ Ð¿Ð¾ÑÑÐ½ÐµÐ½Ð½Ñ Ð²Ð¸ÐºÐ»Ð°Ð´Ð°Ñ‡Ð° Ð¿Ñ€Ð¾ Ð³Ñ€Ð°Ð¼Ð°Ñ‚Ð¸ÐºÑƒ, ÑÑ‚ÑƒÐ´ÐµÐ½Ñ‚Ð¸ Ð·Ð°Ð¿Ð¸ÑÑƒÐ²Ð°Ð»Ð¸ Ð²ÑÑ– Ð²Ð°Ð¶Ð»Ð¸Ð²Ñ– Ð¿Ñ€Ð°Ð²Ð¸Ð»Ð° Ð´Ð¾ Ð·Ð¾ÑˆÐ¸Ñ‚Ñ–Ð².\n\n4. Ð¿Ð¾Ð²ÐµÑ€Ñ‚Ð°ÑŽÑ‡Ð¸ÑÑŒ / Ð¿Ñ–Ð·Ð½Ð¾ / Ð²Ð²ÐµÑ‡ÐµÑ€Ñ– / Ð´Ð¾Ð´Ð¾Ð¼Ñƒ / Ð· / Ð²Ð°Ð¶ÐºÐ¾Ñ— / Ñ€Ð¾Ð±Ð¾Ñ‚Ð¸ / Ð²Ñ–Ð½ / Ð·Ð°Ð²Ð¶Ð´Ð¸ / ÐºÑƒÐ¿ÑƒÐ²Ð°Ð² / ÑÐ²Ñ–Ð¶Ð¸Ð¹ / Ñ…Ð»Ñ–Ð± / Ñƒ / Ð¿ÐµÐºÐ°Ñ€Ð½Ñ–\n   > [!answer] ÐŸÐ¾Ð²ÐµÑ€Ñ‚Ð°ÑŽÑ‡Ð¸ÑÑŒ Ð¿Ñ–Ð·Ð½Ð¾ Ð²Ð²ÐµÑ‡ÐµÑ€Ñ– Ð´Ð¾Ð´Ð¾Ð¼Ñƒ Ð· Ð²Ð°Ð¶ÐºÐ¾Ñ— Ñ€Ð¾Ð±Ð¾Ñ‚Ð¸, Ð²Ñ–Ð½ Ð·Ð°Ð²Ð¶Ð´Ð¸ ÐºÑƒÐ¿ÑƒÐ²Ð°Ð² ÑÐ²Ñ–Ð¶Ð¸Ð¹ Ñ…Ð»Ñ–Ð± Ñƒ Ð¿ÐµÐºÐ°Ñ€Ð½Ñ–.\n\n5. Ð³Ð¾Ñ‚ÑƒÑŽÑ‡Ð¸ÑÑŒ / ÑÑ‚Ð°Ñ€Ð°Ð½Ð½Ð¾ / Ð´Ð¾ / Ð²Ð°Ð¶Ð»Ð¸Ð²Ð¾Ð³Ð¾ / Ñ–ÑÐ¿Ð¸Ñ‚Ñƒ / Ð· / ÑƒÐºÑ€Ð°Ñ—Ð½ÑÑŒÐºÐ¾Ñ— / Ð¼Ð¾Ð²Ð¸ / ÑÑ‚ÑƒÐ´ÐµÐ½Ñ‚ÐºÐ° / Ð¿Ð¾Ð²Ñ‚Ð¾Ñ€ÑŽÐ²Ð°Ð»Ð° / Ð³Ñ€Ð°Ð¼Ð°Ñ‚Ð¸Ñ‡Ð½Ñ– / Ð¿Ñ€Ð°Ð²Ð¸Ð»Ð° / ÐºÐ¾Ð¶Ð½Ð¾Ð³Ð¾ / Ð´Ð½Ñ\n   > [!answer] Ð“Ð¾Ñ‚ÑƒÑŽÑ‡Ð¸ÑÑŒ ÑÑ‚Ð°Ñ€Ð°Ð½Ð½Ð¾ Ð´Ð¾ Ð²Ð°Ð¶Ð»Ð¸Ð²Ð¾Ð³Ð¾ Ñ–ÑÐ¿Ð¸Ñ‚Ñƒ Ð· ÑƒÐºÑ€Ð°Ñ—Ð½ÑÑŒÐºÐ¾Ñ— Ð¼Ð¾Ð²Ð¸, ÑÑ‚ÑƒÐ´ÐµÐ½Ñ‚ÐºÐ° Ð¿Ð¾Ð²Ñ‚Ð¾Ñ€ÑŽÐ²Ð°Ð»Ð° Ð³Ñ€Ð°Ð¼Ð°Ñ‚Ð¸Ñ‡Ð½Ñ– Ð¿Ñ€Ð°Ð²Ð¸Ð»Ð° ÐºÐ¾Ð¶Ð½Ð¾Ð³Ð¾ Ð´Ð½Ñ.\n\n6. Ð´Ð¸Ð²Ð»ÑÑ‡Ð¸ÑÑŒ / Ð·Ð°Ñ…Ð¾Ð¿Ð»ÐµÐ½Ð¾ / Ñƒ / Ð²Ñ–ÐºÐ½Ð¾ / Ð¿Ð¾Ñ—Ð·Ð´Ð° / Ð½Ð° / Ð¼Ð°Ð»ÑŒÐ¾Ð²Ð½Ð¸Ñ‡Ñ– / ÑƒÐºÑ€Ð°Ñ—Ð½ÑÑŒÐºÑ– / ÐºÑ€Ð°Ñ”Ð²Ð¸Ð´Ð¸ / Ñ‚ÑƒÑ€Ð¸ÑÑ‚Ð¸ / Ñ„Ð¾Ñ‚Ð¾Ð³Ñ€Ð°Ñ„ÑƒÐ²Ð°Ð»Ð¸ / ÐºÐ¾Ð¶ÐµÐ½ / Ð¼Ð¾Ð¼ÐµÐ½Ñ‚ / Ð¿Ð¾Ð´Ð¾Ñ€Ð¾Ð¶Ñ–\n   > [!answer] Ð”Ð¸Ð²Ð»ÑÑ‡Ð¸ÑÑŒ Ð·Ð°Ñ…Ð¾Ð¿Ð»ÐµÐ½Ð¾ Ñƒ Ð²Ñ–ÐºÐ½Ð¾ Ð¿Ð¾Ñ—Ð·Ð´Ð° Ð½Ð° Ð¼Ð°Ð»ÑŒÐ¾Ð²Ð½Ð¸Ñ‡Ñ– ÑƒÐºÑ€Ð°Ñ—Ð½ÑÑŒÐºÑ– ÐºÑ€Ð°Ñ”Ð²Ð¸Ð´Ð¸, Ñ‚ÑƒÑ€Ð¸ÑÑ‚Ð¸ Ñ„Ð¾Ñ‚Ð¾Ð³Ñ€Ð°Ñ„ÑƒÐ²Ð°Ð»Ð¸ ÐºÐ¾Ð¶ÐµÐ½ Ð¼Ð¾Ð¼ÐµÐ½Ñ‚ Ð¿Ð¾Ð´Ð¾Ñ€Ð¾Ð¶Ñ–.\n\n7. Ð¿Ñ€Ð°Ñ†ÑŽÑŽÑ‡Ð¸ / Ð²Ð´Ð¾Ð¼Ð° / Ð½Ð°Ð´ / ÑÐºÐ»Ð°Ð´Ð½Ð¸Ð¼ / Ð¿Ñ€Ð¾Ñ”ÐºÑ‚Ð¾Ð¼ / Ð´Ð»Ñ / Ð¼Ñ–Ð¶Ð½Ð°Ñ€Ð¾Ð´Ð½Ð¾Ñ— / ÐºÐ¾Ð¼Ð¿Ð°Ð½Ñ–Ñ— / Ð²Ñ–Ð½ / Ñ‡Ð°ÑÑ‚Ð¾ / Ð·Ð°Ð±ÑƒÐ²Ð°Ð² / Ð¿Ñ€Ð¾ / Ð¾Ð±Ñ–Ð´ / Ñ‚Ð° / Ð²Ñ–Ð´Ð¿Ð¾Ñ‡Ð¸Ð½Ð¾Ðº\n   > [!answer] ÐŸÑ€Ð°Ñ†ÑŽÑŽÑ‡Ð¸ Ð²Ð´Ð¾Ð¼Ð° Ð½Ð°Ð´ ÑÐºÐ»Ð°Ð´Ð½Ð¸Ð¼ Ð¿Ñ€Ð¾Ñ”ÐºÑ‚Ð¾Ð¼ Ð´Ð»Ñ Ð¼Ñ–Ð¶Ð½Ð°Ñ€Ð¾Ð´Ð½Ð¾Ñ— ÐºÐ¾Ð¼Ð¿Ð°Ð½Ñ–Ñ—, Ð²Ñ–Ð½ Ñ‡Ð°ÑÑ‚Ð¾ Ð·Ð°Ð±ÑƒÐ²Ð°Ð² Ð¿Ñ€Ð¾ Ð¾Ð±Ñ–Ð´ Ñ‚Ð° Ð²Ñ–Ð´Ð¿Ð¾Ñ‡Ð¸Ð½Ð¾Ðº.\n\n8. ÑÐ¸Ð´ÑÑ‡Ð¸ / ÐºÐ¾Ð¼Ñ„Ð¾Ñ€Ñ‚Ð½Ð¾ / Ð² / Ð·Ð°Ñ‚Ð¸ÑˆÐ½Ð¾Ð¼Ñƒ / ÐºÐ°Ñ„Ðµ / Ð±Ñ–Ð»Ñ / Ð²ÐµÐ»Ð¸ÐºÐ¾Ð³Ð¾ / Ð²Ñ–ÐºÐ½Ð° / Ð· / Ð²Ð¸Ð´Ð¾Ð¼ / Ð½Ð° / Ð¿Ð»Ð¾Ñ‰Ñƒ / Ð²Ð¾Ð½Ð° / Ñ‡Ð¸Ñ‚Ð°Ð»Ð° / ÑƒÐ»ÑŽÐ±Ð»ÐµÐ½Ñƒ / ÐºÐ½Ð¸Ð³Ñƒ\n   > [!answer] Ð¡Ð¸Ð´ÑÑ‡Ð¸ ÐºÐ¾Ð¼Ñ„Ð¾Ñ€Ñ‚Ð½Ð¾ Ð² Ð·Ð°Ñ‚Ð¸ÑˆÐ½Ð¾Ð¼Ñƒ ÐºÐ°Ñ„Ðµ Ð±Ñ–Ð»Ñ Ð²ÐµÐ»Ð¸ÐºÐ¾Ð³Ð¾ Ð²Ñ–ÐºÐ½Ð° Ð· Ð²Ð¸Ð´Ð¾Ð¼ Ð½Ð° Ð¿Ð»Ð¾Ñ‰Ñƒ, Ð²Ð¾Ð½Ð° Ñ‡Ð¸Ñ‚Ð°Ð»Ð° ÑƒÐ»ÑŽÐ±Ð»ÐµÐ½Ñƒ ÐºÐ½Ð¸Ð³Ñƒ.\n\n## error-correction: Ð’Ð¸Ð¿Ñ€Ð°Ð²Ð»ÐµÐ½Ð½Ñ Ð¿Ð¾Ð¼Ð¸Ð»Ð¾Ðº Ñƒ Ð´Ñ–Ñ”Ð¿Ñ€Ð¸ÑÐ»Ñ–Ð²Ð½Ð¸ÐºÐ¾Ð²Ð¸Ñ… ÐºÐ¾Ð½ÑÑ‚Ñ€ÑƒÐºÑ†Ñ–ÑÑ…\n\n> Ð—Ð½Ð°Ð¹Ð´Ñ–Ñ‚ÑŒ Ñ– Ð²Ð¸Ð¿Ñ€Ð°Ð²Ñ‚Ðµ Ð¿Ð¾Ð¼Ð¸Ð»ÐºÑƒ Ð² ÐºÐ¾Ð¶Ð½Ð¾Ð¼Ñƒ Ñ€ÐµÑ‡ÐµÐ½Ð½Ñ–, Ð¿Ð¾Ð²'ÑÐ·Ð°Ð½Ñƒ Ð· Ð´Ñ–Ñ”Ð¿Ñ€Ð¸ÑÐ»Ñ–Ð²Ð½Ð¸ÐºÐ°Ð¼Ð¸.\n\n1. Ð§Ð¸Ñ‚Ð°ÑŽÑ‡Ð¸ ÐºÐ½Ð¸Ð³Ñƒ, Ð¼ÐµÐ½Ñ– ÑÑ‚Ð°Ð»Ð¾ ÑÑƒÐ¼Ð½Ð¾ Ð²Ñ–Ð´ Ñ†Ñ–Ñ”Ñ— Ñ–ÑÑ‚Ð¾Ñ€Ñ–Ñ—.\n   > [!error] Ð¼ÐµÐ½Ñ– ÑÑ‚Ð°Ð»Ð¾ ÑÑƒÐ¼Ð½Ð¾\n   > [!answer] Ñ Ð·Ð°ÑÑƒÐ¼ÑƒÐ²Ð°Ð²\n   > [!options] Ð¼ÐµÐ½Ñ– ÑÑ‚Ð°Ð»Ð¾ ÑÑƒÐ¼Ð½Ð¾ | Ñ Ð·Ð°ÑÑƒÐ¼ÑƒÐ²Ð°Ð² | Ð¹Ð¾Ð¼Ñƒ ÑÑ‚Ð°Ð»Ð¾ ÑÑƒÐ¼Ð½Ð¾ | Ð²Ð¾Ð½Ð° Ð·Ð°ÑÑƒÐ¼ÑƒÐ²Ð°Ð»Ð°\n   > [!explanation] Ð¡ÑƒÐ±'Ñ”ÐºÑ‚ Ð´Ñ–Ñ”Ð¿Ñ€Ð¸ÑÐ»Ñ–Ð²Ð½Ð¸ÐºÐ° (Ñ…Ñ‚Ð¾ Ñ‡Ð¸Ñ‚Ð°Ð²?) Ð¼Ð°Ñ” Ð·Ð±Ñ–Ð³Ð°Ñ‚Ð¸ÑÑ Ð· ÑÑƒÐ±'Ñ”ÐºÑ‚Ð¾Ð¼ Ð¾ÑÐ½Ð¾Ð²Ð½Ð¾Ð³Ð¾ Ð´Ñ–Ñ”ÑÐ»Ð¾Ð²Ð°.\n\n2. ÐŸÐ¸ÑÐ°ÑŽÑ‡Ð¸ Ð»Ð¸ÑÑ‚Ð° ÑÐ²Ð¾Ñ—Ð¹ Ð±Ð°Ð±ÑƒÑÑ–, Ð²Ñ–Ð½ Ð´ÑƒÐ¼Ð°Ð² Ð¿Ñ€Ð¾ Ð´Ð¸Ñ‚Ð¸Ð½ÑÑ‚Ð²Ð¾.\n   > [!error] ÐŸÐ¸ÑÐ°ÑŽÑ‡Ð¸\n   > [!answer] ÐŸÐ¸ÑˆÑƒÑ‡Ð¸\n   > [!options] ÐŸÐ¸ÑÐ°ÑŽÑ‡Ð¸ | ÐŸÐ¸ÑˆÑƒÑ‡Ð¸ | ÐŸÐ¸ÑÐ°Ð²ÑˆÐ¸ | ÐÐ°Ð¿Ð¸ÑÐ°Ð²ÑˆÐ¸\n   > [!explanation] Ð”Ñ–Ñ”Ð¿Ñ€Ð¸ÑÐ»Ñ–Ð²Ð½Ð¸Ðº ÑƒÑ‚Ð²Ð¾Ñ€ÑŽÑ”Ñ‚ÑŒÑÑ Ð²Ñ–Ð´ Ð¾ÑÐ½Ð¾Ð²Ð¸ Ñ‚ÐµÐ¿ÐµÑ€Ñ–ÑˆÐ½ÑŒÐ¾Ð³Ð¾ Ñ‡Ð°ÑÑƒ: Ð¿Ð¸Ñˆ- + -ÑƒÑ‡Ð¸ = Ð¿Ð¸ÑˆÑƒÑ‡Ð¸.\n\n3. Ð™Ð´ÑƒÑ‡Ð¸ Ð´Ð¾ ÑˆÐºÐ¾Ð»Ð¸, Ð¿Ð¾Ñ‡Ð°Ð²ÑÑ ÑÐ¸Ð»ÑŒÐ½Ð¸Ð¹ Ð´Ð¾Ñ‰ Ñ– Ð·Ð»Ð¸Ð²Ð°.\n   > [!error] Ð¿Ð¾Ñ‡Ð°Ð²ÑÑ ÑÐ¸Ð»ÑŒÐ½Ð¸Ð¹ Ð´Ð¾Ñ‰\n   > [!answer] Ñ Ð¿Ð¾Ñ‚Ñ€Ð°Ð¿Ð¸Ð² Ð¿Ñ–Ð´ Ð´Ð¾Ñ‰\n   > [!options] Ð¿Ð¾Ñ‡Ð°Ð²ÑÑ ÑÐ¸Ð»ÑŒÐ½Ð¸Ð¹ Ð´Ð¾Ñ‰ | Ñ Ð¿Ð¾Ñ‚Ñ€Ð°Ð¿Ð¸Ð² Ð¿Ñ–Ð´ Ð´Ð¾Ñ‰ | Ð²Ñ–Ð½ Ð¿Ð¾Ñ‡Ð°Ð²ÑÑ | Ð´Ð¾Ñ‰ Ð¿Ð¾Ñ‡Ð°Ð²ÑÑ\n   > [!explanation] Ð”Ð¾Ñ‰ Ð½Ðµ Ð¼Ð¾Ð¶Ðµ Â«Ð¹Ñ‚Ð¸ Ð´Ð¾ ÑˆÐºÐ¾Ð»Ð¸Â» â€” ÑÑƒÐ±'Ñ”ÐºÑ‚Ð¸ Ð¼Ð°ÑŽÑ‚ÑŒ Ð·Ð±Ñ–Ð³Ð°Ñ‚Ð¸ÑÑ.\n\n4. Ð‘Ñ–Ð³ÑƒÑ‡Ð¸ Ð´Ð¾ Ð°Ð²Ñ‚Ð¾Ð±ÑƒÑÐ° Ð½Ð° Ð·ÑƒÐ¿Ð¸Ð½ÐºÑƒ, Ð²Ð¾Ð½Ð° Ð·Ð°Ð³ÑƒÐ±Ð¸Ð»Ð° Ñ‚ÐµÐ»ÐµÑ„Ð¾Ð½.\n   > [!error] Ð‘Ñ–Ð³ÑƒÑ‡Ð¸\n   > [!answer] Ð‘Ñ–Ð¶Ð°Ñ‡Ð¸\n   > [!options] Ð‘Ñ–Ð³ÑƒÑ‡Ð¸ | Ð‘Ñ–Ð¶Ð°Ñ‡Ð¸ | Ð‘Ñ–Ð³Ð°Ð²ÑˆÐ¸ | ÐŸÐ¾Ð±Ñ–Ð³ÑˆÐ¸\n   > [!explanation] Ð’Ñ–Ð´ Ð¾ÑÐ½Ð¾Ð²Ð¸ Â«Ð±Ñ–Ð¶-Â» (Ñ Ð±Ñ–Ð¶Ñƒ) ÑƒÑ‚Ð²Ð¾Ñ€ÑŽÑ”Ñ‚ÑŒÑÑ Â«Ð±Ñ–Ð¶Ð°Ñ‡Ð¸Â», Ð½Ðµ Â«Ð±Ñ–Ð³ÑƒÑ‡Ð¸Â».\n\n5. Ð¡Ð»ÑƒÑ…Ð°ÑŽÑ‡Ð¸ Ð¼ÑƒÐ·Ð¸ÐºÑƒ Ð² Ð½Ð°Ð²ÑƒÑˆÐ½Ð¸ÐºÐ°Ñ…, Ð¹Ð¾Ð¼Ñƒ Ð·Ð°Ñ‚ÐµÐ»ÐµÑ„Ð¾Ð½ÑƒÐ²Ð°Ð»Ð¸ Ð´Ñ€ÑƒÐ·Ñ–.\n   > [!error] Ð¹Ð¾Ð¼Ñƒ Ð·Ð°Ñ‚ÐµÐ»ÐµÑ„Ð¾Ð½ÑƒÐ²Ð°Ð»Ð¸\n   > [!answer] Ð²Ñ–Ð½ Ð¾Ñ‚Ñ€Ð¸Ð¼Ð°Ð² Ð´Ð·Ð²Ñ–Ð½Ð¾Ðº\n   > [!options] Ð¹Ð¾Ð¼Ñƒ Ð·Ð°Ñ‚ÐµÐ»ÐµÑ„Ð¾Ð½ÑƒÐ²Ð°Ð»Ð¸ | Ð²Ñ–Ð½ Ð¾Ñ‚Ñ€Ð¸Ð¼Ð°Ð² Ð´Ð·Ð²Ñ–Ð½Ð¾Ðº | Ð´Ñ€ÑƒÐ·Ñ– Ð·Ð°Ñ‚ÐµÐ»ÐµÑ„Ð¾Ð½ÑƒÐ²Ð°Ð»Ð¸ | Ñ—Ð¹ Ð·Ð°Ñ‚ÐµÐ»ÐµÑ„Ð¾Ð½ÑƒÐ²Ð°Ð»Ð¸\n   > [!explanation] Ð¥Ñ‚Ð¾ ÑÐ»ÑƒÑ…Ð°Ð² Ð¼ÑƒÐ·Ð¸ÐºÑƒ? Ð’Ñ–Ð½. Ð¥Ñ‚Ð¾ Ð¾Ñ‚Ñ€Ð¸Ð¼Ð°Ð² Ð´Ð·Ð²Ñ–Ð½Ð¾Ðº? Ð¢ÐµÐ¶ Ð²Ñ–Ð½. Ð¡ÑƒÐ±'Ñ”ÐºÑ‚Ð¸ Ð¼Ð°ÑŽÑ‚ÑŒ Ð·Ð±Ñ–Ð³Ð°Ñ‚Ð¸ÑÑ.\n\n6. Ð¡Ð¸Ð´Ñ–ÑŽÑ‡Ð¸ Ð² Ð¿Ð°Ñ€ÐºÑƒ Ð½Ð° Ð»Ð°Ð²Ñ†Ñ–, Ð´Ñ–Ñ‚Ð¸ Ð³Ð¾Ð´ÑƒÐ²Ð°Ð»Ð¸ Ð³Ð¾Ð»ÑƒÐ±Ñ–Ð² Ñ…Ð»Ñ–Ð±Ð¾Ð¼.\n   > [!error] Ð¡Ð¸Ð´Ñ–ÑŽÑ‡Ð¸\n   > [!answer] Ð¡Ð¸Ð´ÑÑ‡Ð¸\n   > [!options] Ð¡Ð¸Ð´Ñ–ÑŽÑ‡Ð¸ | Ð¡Ð¸Ð´ÑÑ‡Ð¸ | Ð¡Ð¸Ð´Ñ–Ð²ÑˆÐ¸ | Ð¡Ð¸Ð´ÑŒÐ¾ÑƒÑ‡Ð¸\n   > [!explanation] Ð’Ñ–Ð´ Ð¾ÑÐ½Ð¾Ð²Ð¸ Â«ÑÐ¸Ð´-Â» ÑƒÑ‚Ð²Ð¾Ñ€ÑŽÑ”Ñ‚ÑŒÑÑ Â«ÑÐ¸Ð´ÑÑ‡Ð¸Â» Ð· ÑÑƒÑ„Ñ–ÐºÑÐ¾Ð¼ -ÑÑ‡Ð¸.\n\n7. Ð”Ð¸Ð²Ð¸Ð²ÑˆÐ¸ Ð² Ñ‚ÐµÐ»ÐµÐ²Ñ–Ð·Ð¾Ñ€ Ð½Ð¾Ð²Ð¸Ð½Ð¸, Ð±Ð°Ð±ÑƒÑÑ Ð²'ÑÐ·Ð°Ð»Ð° Ñ‚ÐµÐ¿Ð»Ð¸Ð¹ ÑÐ²ÐµÑ‚Ñ€.\n   > [!error] Ð”Ð¸Ð²Ð¸Ð²ÑˆÐ¸\n   > [!answer] Ð”Ð¸Ð²Ð»ÑÑ‡Ð¸ÑÑŒ\n   > [!options] Ð”Ð¸Ð²Ð¸Ð²ÑˆÐ¸ | Ð”Ð¸Ð²Ð»ÑÑ‡Ð¸ÑÑŒ | Ð”Ð¸Ð²Ð¸Ð²ÑˆÐ¸ÑÑŒ | ÐŸÐ¾Ð´Ð¸Ð²Ð¸Ð²ÑˆÐ¸\n   > [!explanation] Ð’Ñ–Ð´ Ð·Ð²Ð¾Ñ€Ð¾Ñ‚Ð½Ð¾Ð³Ð¾ Ð´Ñ–Ñ”ÑÐ»Ð¾Ð²Ð° Â«Ð´Ð¸Ð²Ð¸Ñ‚Ð¸ÑÑÂ» ÑƒÑ‚Ð²Ð¾Ñ€ÑŽÑ”Ñ‚ÑŒÑÑ Â«Ð´Ð¸Ð²Ð»ÑÑ‡Ð¸ÑÑŒÂ».\n\n8. Ð“Ð¾Ð²Ð¾Ñ€ÑŽÑ‡Ð¸ Ð¿Ð¾ Ñ‚ÐµÐ»ÐµÑ„Ð¾Ð½Ñƒ Ð· ÐºÐ¾Ð»ÐµÐ³Ð¾ÑŽ, Ð²Ð¾Ð½Ð° Ð³Ð¾Ñ‚ÑƒÐ²Ð°Ð»Ð° Ð²ÐµÑ‡ÐµÑ€ÑŽ Ð½Ð° ÐºÑƒÑ…Ð½Ñ–.\n   > [!error] Ð“Ð¾Ð²Ð¾Ñ€ÑŽÑ‡Ð¸\n   > [!answer] Ð“Ð¾Ð²Ð¾Ñ€ÑÑ‡Ð¸\n   > [!options] Ð“Ð¾Ð²Ð¾Ñ€ÑŽÑ‡Ð¸ | Ð“Ð¾Ð²Ð¾Ñ€ÑÑ‡Ð¸ | Ð“Ð¾Ð²Ð¾Ñ€Ð¸Ð²ÑˆÐ¸ | ÐŸÐ¾Ð³Ð¾Ð²Ð¾Ñ€Ð¸Ð²ÑˆÐ¸\n   > [!explanation] Ð’Ñ–Ð´ Ð¾ÑÐ½Ð¾Ð²Ð¸ Â«Ð³Ð¾Ð²Ð¾Ñ€-Â» ÑƒÑ‚Ð²Ð¾Ñ€ÑŽÑ”Ñ‚ÑŒÑÑ Â«Ð³Ð¾Ð²Ð¾Ñ€ÑÑ‡Ð¸Â» Ð· ÑÑƒÑ„Ñ–ÐºÑÐ¾Ð¼ -ÑÑ‡Ð¸.\n\n## cloze: Ð”Ñ–Ñ”Ð¿Ñ€Ð¸ÑÐ»Ñ–Ð²Ð½Ð¸ÐºÐ¸ Ð² ÐºÐ¾Ð½Ñ‚ÐµÐºÑÑ‚Ñ–\n\n> Ð—Ð°Ð¿Ð¾Ð²Ð½Ñ–Ñ‚ÑŒ Ð¿Ñ€Ð¾Ð¿ÑƒÑÐºÐ¸ Ð¿Ñ€Ð°Ð²Ð¸Ð»ÑŒÐ½Ð¸Ð¼Ð¸ Ñ„Ð¾Ñ€Ð¼Ð°Ð¼Ð¸ Ð´Ñ–Ñ”Ð¿Ñ€Ð¸ÑÐ»Ñ–Ð²Ð½Ð¸ÐºÑ–Ð² Ñƒ Ñ‚ÐµÐºÑÑ‚Ñ– Ð¿Ñ€Ð¾ ÑƒÐºÑ€Ð°Ñ—Ð½ÑÑŒÐºÑ– Ñ‚Ñ€Ð°Ð´Ð¸Ñ†Ñ–Ñ—.\n\nÐœÐ¸Ð½ÑƒÐ»Ð¾Ð³Ð¾ Ñ€Ð¾ÐºÑƒ Ð¼Ð¸ Ð²Ñ–Ð´Ð²Ñ–Ð´Ð°Ð»Ð¸ ÑƒÐºÑ€Ð°Ñ—Ð½ÑÑŒÐºÐµ ÑÐµÐ»Ð¾. [___:1:Ð¿Ñ€Ð¸Ñ—Ð¶Ð´Ð¶Ð°ÑŽÑ‡Ð¸|Ð¿Ñ€Ð¸Ñ—Ñ…Ð°Ð²ÑˆÐ¸|Ð¿Ñ€Ð¸Ñ”Ð·Ð´ÑÑ‡Ð¸] Ð´Ð¾ Ð±Ð°Ð±ÑƒÑÑ–, Ð¼Ð¸ Ð·Ð°Ð²Ð¶Ð´Ð¸ Ð²Ñ–Ð´Ñ‡ÑƒÐ²Ð°Ñ”Ð¼Ð¾ Ñ€Ð°Ð´Ñ–ÑÑ‚ÑŒ. [___:2:Ð’Ð¸Ñ…Ð¾Ð´ÑÑ‡Ð¸|Ð’Ð¸Ð¹Ð´ÑƒÑ‡Ð¸|Ð’Ð¸Ñ…Ð¾Ð´Ð¸Ð²ÑˆÐ¸] Ð· Ð°Ð²Ñ‚Ð¾Ð±ÑƒÑÐ°, Ð¼Ð¸ Ð¿Ð¾Ð±Ð°Ñ‡Ð¸Ð»Ð¸ ÐºÑ€Ð°ÑÐ¸Ð²Ñ– ÐºÑ€Ð°Ñ”Ð²Ð¸Ð´Ð¸. Ð‘Ð°Ð±ÑƒÑÑ Ñ‡ÐµÐºÐ°Ð»Ð° Ð½Ð° Ð½Ð°Ñ, [___:3:ÑÑ‚Ð¾ÑÑ‡Ð¸|ÑÑ‚Ð¾ÑŽÐ²ÑˆÐ¸|ÑÑ‚Ð¾ÑÑŽÑ‡Ð¸] Ð±Ñ–Ð»Ñ Ñ…Ð°Ñ‚Ð¸. [___:4:Ð’Ñ–Ñ‚Ð°ÑŽÑ‡Ð¸ÑÑŒ|Ð’Ñ–Ñ‚Ð°Ð²ÑˆÐ¸ÑÑŒ|Ð’Ñ–Ñ‚Ð°ÑŽÑ‡Ð¸ÑÑ] Ð· Ð½Ð°Ð¼Ð¸, Ð²Ð¾Ð½Ð° Ð¿Ð»Ð°ÐºÐ°Ð»Ð° Ð²Ñ–Ð´ Ñ‰Ð°ÑÑ‚Ñ. ÐœÐ¸ Ð¿Ñ€Ð¾Ð²ÐµÐ»Ð¸ Ñ‚Ð°Ð¼ Ñ‚Ð¸Ð¶Ð´ÐµÐ½ÑŒ, [___:5:Ð½Ð°ÑÐ¾Ð»Ð¾Ð´Ð¶ÑƒÑŽÑ‡Ð¸ÑÑŒ|Ð½Ð°ÑÐ¾Ð»Ð¾Ð´Ð¸Ð²ÑˆÐ¸ÑÑŒ|Ð½Ð°ÑÐ¾Ð»Ð¾Ð¶Ð´ÑƒÑŽÑ‡Ð¸] ÑÐ²Ñ–Ð¶Ð¸Ð¼ Ð¿Ð¾Ð²Ñ–Ñ‚Ñ€ÑÐ¼ Ñ‚Ð° ÑƒÐºÑ€Ð°Ñ—Ð½ÑÑŒÐºÐ¾ÑŽ Ð¿Ñ€Ð¸Ñ€Ð¾Ð´Ð¾ÑŽ.\n\nÐšÐ¾Ð¶Ð½Ð¾Ð³Ð¾ Ñ€Ð°Ð½ÐºÑƒ, [___:6:Ð¿Ñ€Ð¾ÐºÐ¸Ð´Ð°ÑŽÑ‡Ð¸ÑÑŒ|Ð¿Ñ€Ð¾ÐºÐ¸Ð½ÑƒÐ²ÑˆÐ¸ÑÑŒ|Ð¿Ñ€Ð¾ÐºÐ¸Ð´ÑƒÑŽÑ‡Ð¸ÑÑŒ] Ñ€Ð°Ð½Ð¾, Ñ Ñ‡ÑƒÐ² ÑÐ¿Ñ–Ð² Ð¿Ñ–Ð²Ð½Ñ. [___:7:Ð¡Ð½Ñ–Ð´Ð°ÑŽÑ‡Ð¸|Ð¡Ð½Ñ–Ð´Ð°Ð²ÑˆÐ¸|Ð¡Ð½Ñ–Ð´ÑŽÑ‡Ð¸] Ð½Ð° Ð²ÐµÑ€Ð°Ð½Ð´Ñ–, Ð¼Ð¸ Ð¼Ð¸Ð»ÑƒÐ²Ð°Ð»Ð¸ÑÑ ÑÑ…Ð¾Ð´Ð¾Ð¼ ÑÐ¾Ð½Ñ†Ñ. Ð‘Ð°Ð±ÑƒÑÑ Ð³Ð¾Ñ‚ÑƒÐ²Ð°Ð»Ð° Ñ—Ð¶Ñƒ, [___:8:ÑÐ¿Ñ–Ð²Ð°ÑŽÑ‡Ð¸|ÑÐ¿Ñ–Ð²Ð°Ð²ÑˆÐ¸|ÑÐ¿Ñ–Ð²ÑƒÑŽÑ‡Ð¸] ÑƒÐºÑ€Ð°Ñ—Ð½ÑÑŒÐºÑ– Ð½Ð°Ñ€Ð¾Ð´Ð½Ñ– Ð¿Ñ–ÑÐ½Ñ–. [___:9:Ð¡Ð»ÑƒÑ…Ð°ÑŽÑ‡Ð¸|Ð¡Ð»ÑƒÑ…Ð°Ð²ÑˆÐ¸|Ð¡Ð»ÑƒÑ…ÑƒÑŽÑ‡Ð¸] Ñ—Ñ— Ð³Ð¾Ð»Ð¾Ñ, Ñ Ð²Ñ–Ð´Ñ‡ÑƒÐ²Ð°Ð² Ð·Ð²'ÑÐ·Ð¾Ðº Ð·Ñ– ÑÐ²Ð¾Ñ—Ð¼Ð¸ ÐºÐ¾Ñ€ÐµÐ½ÑÐ¼Ð¸.\n\nÐ£Ð´ÐµÐ½ÑŒ, [___:10:Ð³ÑƒÐ»ÑÑŽÑ‡Ð¸|Ð³ÑƒÐ»ÑÐ²ÑˆÐ¸|Ð³ÑƒÐ»ÑŽÑŽÑ‡Ð¸] Ð¿Ð¾Ð»ÑÐ¼Ð¸, Ð¼Ð¸ Ð·Ð±Ð¸Ñ€Ð°Ð»Ð¸ ÐºÐ²Ñ–Ñ‚Ð¸ Ñ‚Ð° ÑÐ³Ð¾Ð´Ð¸. Ð”Ñ–Ð´ÑƒÑÑŒ Ñ€Ð¾Ð·Ð¿Ð¾Ð²Ñ–Ð´Ð°Ð² Ñ–ÑÑ‚Ð¾Ñ€Ñ–Ñ—, [___:11:ÑÐ¸Ð´ÑÑ‡Ð¸|ÑÐ¸Ð´Ñ–Ð²ÑˆÐ¸|ÑÐ¸Ð´ÑŽÑ‡Ð¸] Ð¿Ñ–Ð´ ÑÑ‚Ð°Ñ€Ð¸Ð¼ Ð´ÑƒÐ±Ð¾Ð¼. [___:12:ÐŸÐ¾Ð²ÐµÑ€Ñ‚Ð°ÑŽÑ‡Ð¸ÑÑŒ|ÐŸÐ¾Ð²ÐµÑ€Ð½ÑƒÐ²ÑˆÐ¸ÑÑŒ|ÐŸÐ¾Ð²ÐµÑ€Ñ‚ÑƒÐ²ÑˆÐ¸ÑÑŒ] Ð²Ð²ÐµÑ‡ÐµÑ€Ñ– Ð´Ð¾Ð´Ð¾Ð¼Ñƒ, Ð¼Ð¸ Ð±Ð°Ñ‡Ð¸Ð»Ð¸ Ð·Ð°Ñ…Ñ–Ð´ ÑÐ¾Ð½Ñ†Ñ Ð½Ð°Ð´ ÑÐµÐ»Ð¾Ð¼. [___:13:Ð’ÐµÑ‡ÐµÑ€ÑÑŽÑ‡Ð¸|Ð’ÐµÑ‡ÐµÑ€ÑÐ²ÑˆÐ¸|Ð’ÐµÑ‡ÐµÑ€ÑƒÑŽÑ‡Ð¸] Ñ€Ð°Ð·Ð¾Ð¼ ÑƒÑÑ–Ñ”ÑŽ Ñ€Ð¾Ð´Ð¸Ð½Ð¾ÑŽ, Ð¼Ð¸ Ð´Ñ–Ð»Ð¸Ð»Ð¸ÑÑ Ð²Ñ€Ð°Ð¶ÐµÐ½Ð½ÑÐ¼Ð¸ Ð²Ñ–Ð´ Ð´Ð½Ñ. [___:14:Ð—Ð°ÑÐ¸Ð½Ð°ÑŽÑ‡Ð¸|Ð—Ð°ÑÐ½ÑƒÐ²ÑˆÐ¸|Ð—Ð°ÑÐ¸Ð½ÑƒÐ²ÑˆÐ¸] Ð¿Ñ–Ð·Ð½Ð¾ Ð²Ð²ÐµÑ‡ÐµÑ€Ñ–, Ñ Ð¼Ñ€Ñ–ÑÐ² Ð¿Ñ€Ð¾ Ð½Ð°ÑÑ‚ÑƒÐ¿Ð½Ð¸Ð¹ Ð´ÐµÐ½ÑŒ.\n\n## mark-the-words: Ð—Ð½Ð°Ð¹Ð´Ñ–Ñ‚ÑŒ Ð´Ñ–Ñ”Ð¿Ñ€Ð¸ÑÐ»Ñ–Ð²Ð½Ð¸ÐºÐ¸ Ð½ÐµÐ´Ð¾ÐºÐ¾Ð½Ð°Ð½Ð¾Ð³Ð¾ Ð²Ð¸Ð´Ñƒ\n\n> Ð—Ð½Ð°Ð¹Ð´Ñ–Ñ‚ÑŒ Ñ– Ð¿Ð¾Ð·Ð½Ð°Ñ‡Ñ‚Ðµ Ð²ÑÑ– Ð´Ñ–Ñ”Ð¿Ñ€Ð¸ÑÐ»Ñ–Ð²Ð½Ð¸ÐºÐ¸ Ð½ÐµÐ´Ð¾ÐºÐ¾Ð½Ð°Ð½Ð¾Ð³Ð¾ Ð²Ð¸Ð´Ñƒ Ð² Ñ‚ÐµÐºÑÑ‚Ñ–.\n\nÐžÐ»ÐµÐ½Ð° ÑÐ¸Ð´Ñ–Ð»Ð° Ð±Ñ–Ð»Ñ Ð²Ñ–ÐºÐ½Ð°, [Ð´Ð¸Ð²Ð»ÑÑ‡Ð¸ÑÑŒ] Ð½Ð° Ð²ÑƒÐ»Ð¸Ñ†ÑŽ. ÐÐ°Ð´Ð²Ð¾Ñ€Ñ– Ð¹ÑˆÐ¾Ð² Ð´Ð¾Ñ‰, [Ð±Ð°Ñ€Ð°Ð±Ð°Ð½ÑÑ‡Ð¸] Ð¿Ð¾ ÑˆÐ¸Ð±ÐºÐ°Ñ…. Ð’Ð¾Ð½Ð° Ñ‡Ð¸Ñ‚Ð°Ð»Ð° ÐºÐ½Ð¸Ð³Ñƒ, [Ñ‡Ð°Ñ Ð²Ñ–Ð´ Ñ‡Ð°ÑÑƒ Ð¿Ñ–Ð´Ð½Ð¾ÑÑÑ‡Ð¸] Ñ‡Ð°ÑˆÐºÑƒ Ñ‡Ð°ÑŽ Ð´Ð¾ Ð³ÑƒÐ±. [Ð”ÑƒÐ¼Ð°ÑŽÑ‡Ð¸] Ð¿Ñ€Ð¾ Ð¼Ð°Ð¹Ð±ÑƒÑ‚Ð½Ñ”, Ð²Ð¾Ð½Ð° Ð¿Ð¾ÑÐ¼Ñ–Ñ…Ð°Ð»Ð°ÑÑ. Ð—Ð° Ð²Ñ–ÐºÐ½Ð¾Ð¼ Ð»ÑŽÐ´Ð¸ Ð¹ÑˆÐ»Ð¸, [Ñ…Ð¾Ð²Ð°ÑŽÑ‡Ð¸ÑÑŒ] Ð¿Ñ–Ð´ Ð¿Ð°Ñ€Ð°ÑÐ¾Ð»ÑŒÐºÐ°Ð¼Ð¸. Ð”Ñ–Ñ‚Ð¸ Ð±Ñ–Ð³Ð»Ð¸ Ð´Ð¾Ð´Ð¾Ð¼Ñƒ, [ÑÐ¼Ñ–ÑŽÑ‡Ð¸ÑÑŒ] Ñ‚Ð° [Ñ€Ð¾Ð·Ð±Ñ€Ð¸Ð·ÐºÑƒÑŽÑ‡Ð¸] ÐºÐ°Ð»ÑŽÐ¶Ñ–. ÐžÐ»ÐµÐ½Ð° Ð·Ð°ÐºÑ€Ð¸Ð»Ð° ÐºÐ½Ð¸Ð³Ñƒ, [Ð²Ñ–Ð´Ñ‡ÑƒÐ²Ð°ÑŽÑ‡Ð¸] ÑÐ¿Ð¾ÐºÑ–Ð¹ Ñ– Ð·Ð°Ñ‚Ð¸ÑˆÐ¾Ðº. [Ð’ÑÑ‚Ð°ÑŽÑ‡Ð¸] Ð· ÐºÑ€Ñ–ÑÐ»Ð°, Ð²Ð¾Ð½Ð° Ð¿Ñ–ÑˆÐ»Ð° Ð³Ð¾Ñ‚ÑƒÐ²Ð°Ñ‚Ð¸ Ð²ÐµÑ‡ÐµÑ€ÑŽ.\n\n## dialogue-reorder: Ð”Ñ–Ð°Ð»Ð¾Ð³ Ð¿Ñ€Ð¾ Ñ€Ð¾Ð±Ð¾Ñ‡Ð¸Ð¹ Ð´ÐµÐ½ÑŒ\n\n> Ð Ð¾Ð·Ñ‚Ð°ÑˆÑƒÐ¹Ñ‚Ðµ Ñ€ÐµÐ¿Ð»Ñ–ÐºÐ¸ Ð´Ñ–Ð°Ð»Ð¾Ð³Ñƒ Ð² Ð¿Ñ€Ð°Ð²Ð¸Ð»ÑŒÐ½Ð¾Ð¼Ñƒ Ð¿Ð¾Ñ€ÑÐ´ÐºÑƒ.\n\n- ÐœÐµÐ½Ñ– Ð¿Ð¾Ð´Ð¾Ð±Ð°Ñ”Ñ‚ÑŒÑÑ Ð¿Ñ€Ð°Ñ†ÑŽÐ²Ð°Ñ‚Ð¸, ÑÐ»ÑƒÑ…Ð°ÑŽÑ‡Ð¸ Ð¼ÑƒÐ·Ð¸ÐºÑƒ Ñƒ Ñ„Ð¾Ð½Ð¾Ð²Ð¾Ð¼Ñƒ Ñ€ÐµÐ¶Ð¸Ð¼Ñ–.\n- Ð¡Ð¿Ñ€Ð°Ð²Ð´Ñ–? Ð Ñ, Ð¿Ñ€Ð°Ñ†ÑŽÑŽÑ‡Ð¸ Ð²Ð´Ð¾Ð¼Ð°, Ð¿Ð¾Ñ‚Ñ€ÐµÐ±ÑƒÑŽ Ð¿Ð¾Ð²Ð½Ð¾Ñ— Ñ‚Ð¸ÑˆÑ– Ð´Ð»Ñ ÐºÐ¾Ð½Ñ†ÐµÐ½Ñ‚Ñ€Ð°Ñ†Ñ–Ñ—.\n- ÐŸÐ¾Ð²ÐµÑ€Ñ‚Ð°ÑŽÑ‡Ð¸ÑÑŒ Ð· Ñ€Ð¾Ð±Ð¾Ñ‚Ð¸, Ñ Ð·Ð°Ð²Ð¶Ð´Ð¸ Ð¿Ð¾Ñ‡ÑƒÐ²Ð°ÑŽÑÑ Ð²Ñ‚Ð¾Ð¼Ð»ÐµÐ½Ð¸Ð¼ Ñ– Ñ…Ð¾Ñ‡Ñƒ Ð²Ñ–Ð´Ð¿Ð¾Ñ‡Ð¸Ñ‚Ð¸.\n- Ð Ð¾Ð·ÑƒÐ¼Ñ–ÑŽ Ñ‚ÐµÐ±Ðµ! ÐŸÑ€Ð°Ñ†ÑŽÑŽÑ‡Ð¸ Ð²ÐµÑÑŒ Ð´ÐµÐ½ÑŒ Ð·Ð° ÐºÐ¾Ð¼Ð¿'ÑŽÑ‚ÐµÑ€Ð¾Ð¼, Ð²Ð°Ð¶ÐºÐ¾ Ð·Ð±ÐµÑ€Ñ–Ð³Ð°Ñ‚Ð¸ ÐµÐ½ÐµÑ€Ð³Ñ–ÑŽ Ð´Ð¾ Ð²ÐµÑ‡Ð¾Ñ€Ð°.\n- Ð¯Ðº Ñ‚Ð¸ Ð²Ñ–Ð´Ð¿Ð¾Ñ‡Ð¸Ð²Ð°Ñ”Ñˆ, Ð¿Ñ€Ð¸Ñ…Ð¾Ð´ÑÑ‡Ð¸ Ð´Ð¾Ð´Ð¾Ð¼Ñƒ Ð¿Ñ–ÑÐ»Ñ Ñ‚Ð°ÐºÐ¾Ð³Ð¾ Ð½Ð°Ð¿Ñ€ÑƒÐ¶ÐµÐ½Ð¾Ð³Ð¾ Ð´Ð½Ñ?\n- Ð—Ð°Ð·Ð²Ð¸Ñ‡Ð°Ð¹, ÑÐ¸Ð´ÑÑ‡Ð¸ Ð½Ð° Ð´Ð¸Ð²Ð°Ð½Ñ–, Ð´Ð¸Ð²Ð»ÑŽÑÑ ÑÐµÑ€Ñ–Ð°Ð»Ð¸ Ñ‚Ð° Ð¿'ÑŽ Ð³Ð°Ñ€ÑÑ‡Ð¸Ð¹ Ñ‡Ð°Ð¹.\n\n## select: Ð’Ð¸Ð±Ñ–Ñ€ Ð¿Ñ€Ð°Ð²Ð¸Ð»ÑŒÐ½Ð¾Ð³Ð¾ Ð´Ñ–Ñ”Ð¿Ñ€Ð¸ÑÐ»Ñ–Ð²Ð½Ð¸ÐºÐ°\n\n> Ð’Ð¸Ð±ÐµÑ€Ñ–Ñ‚ÑŒ Ð¿Ñ€Ð°Ð²Ð¸Ð»ÑŒÐ½Ñƒ Ñ„Ð¾Ñ€Ð¼Ñƒ Ð´Ñ–Ñ”Ð¿Ñ€Ð¸ÑÐ»Ñ–Ð²Ð½Ð¸ÐºÐ° Ð°Ð±Ð¾ ÐºÐ¾Ð½ÑÑ‚Ñ€ÑƒÐºÑ†Ñ–ÑŽ Ð´Ð»Ñ ÐºÐ¾Ð¶Ð½Ð¾Ð³Ð¾ Ñ€ÐµÑ‡ÐµÐ½Ð½Ñ.\n\n1. _________ ÐºÐ½Ð¸Ð³Ñƒ, Ð²Ñ–Ð½ Ñ€Ð¾Ð±Ð¸Ð² Ð½Ð¾Ñ‚Ð°Ñ‚ÐºÐ¸.\n   - [x] Ð§Ð¸Ñ‚Ð°ÑŽÑ‡Ð¸\n   - [ ] Ð§Ð¸Ñ‚Ð°Ð²ÑˆÐ¸\n   - [ ] ÐŸÑ€Ð¾Ñ‡Ð¸Ñ‚Ð°Ð²ÑˆÐ¸\n   - [ ] ÐŸÑ€Ð¾Ñ‡Ð¸Ñ‚Ð°ÑŽÑ‡Ð¸\n\n2. _________ Ð´Ð¾Ð´Ð¾Ð¼Ñƒ, Ð²Ð¾Ð½Ð° Ð·ÑƒÑÑ‚Ñ€Ñ–Ð»Ð° Ð¿Ð¾Ð´Ñ€ÑƒÐ³Ñƒ.\n   - [x] Ð™Ð´ÑƒÑ‡Ð¸\n   - [ ] Ð™Ð´Ñ–Ð²ÑˆÐ¸\n   - [ ] ÐŸÑ–ÑˆÐ¾Ð²ÑˆÐ¸\n   - [ ] ÐŸÑ–Ð¹ÑˆÐ¾Ð²ÑˆÐ¸\n\n3. Ð¡Ñ‚ÑƒÐ´ÐµÐ½Ñ‚Ð¸ Ð²Ñ‡Ð¸Ð»Ð¸ÑÑ, _________ ÐºÐ¾Ð½ÑÐ¿ÐµÐºÑ‚Ð¸ Ð»ÐµÐºÑ†Ñ–Ð¹.\n   - [x] Ð¿ÐµÑ€ÐµÐ³Ð»ÑÐ´Ð°ÑŽÑ‡Ð¸\n   - [ ] Ð¿ÐµÑ€ÐµÐ³Ð»ÑÐ½ÑƒÐ²ÑˆÐ¸\n   - [ ] Ð¿ÐµÑ€ÐµÐ³Ð»ÑÐ´Ð°Ð²ÑˆÐ¸\n   - [ ] Ð¿ÐµÑ€ÐµÐ³Ð»ÑÐ´ÑŽÑ‡Ð¸\n\n4. _________ Ð² Ñ‡ÐµÑ€Ð·Ñ– Ð´Ð¾ ÐºÐ°ÑÐ¸, Ð»ÑŽÐ´Ð¸ Ñ€Ð¾Ð·Ð¼Ð¾Ð²Ð»ÑÐ»Ð¸.\n   - [x] Ð¡Ñ‚Ð¾ÑÑ‡Ð¸\n   - [ ] Ð¡Ñ‚Ð¾ÑŽÐ²ÑˆÐ¸\n   - [ ] ÐŸÐ¾ÑÑ‚Ð¾ÑÐ²ÑˆÐ¸\n   - [ ] Ð¡Ñ‚Ð¾ÑÑŽÑ‡Ð¸\n\n5. Ð’Ð¾Ð½Ð° Ð¿Ñ€Ð°Ñ†ÑŽÐ²Ð°Ð»Ð°, _________ ÐºÐ°Ð²Ñƒ.\n   - [x] Ð¿'ÑŽÑ‡Ð¸\n   - [ ] Ð¿Ð¸Ð²ÑˆÐ¸\n   - [ ] Ð²Ð¸Ð¿Ð¸Ð²ÑˆÐ¸\n   - [ ] Ð¿'ÑÐ²ÑˆÐ¸\n\n6. _________ Ð¿Ñ€Ð¾ Ð¼Ð°Ð¹Ð±ÑƒÑ‚Ð½Ñ”, Ð²Ñ–Ð½ Ñ…Ð²Ð¸Ð»ÑŽÐ²Ð°Ð²ÑÑ.\n   - [x] Ð”ÑƒÐ¼Ð°ÑŽÑ‡Ð¸\n   - [ ] Ð”ÑƒÐ¼Ð°Ð²ÑˆÐ¸\n   - [ ] ÐŸÐ¾Ð´ÑƒÐ¼Ð°Ð²ÑˆÐ¸\n   - [ ] Ð”ÑƒÐ¼ÑƒÑŽÑ‡Ð¸\n\n## translate: ÐŸÐµÑ€ÐµÐºÐ»Ð°Ð´ Ñ€ÐµÑ‡ÐµÐ½ÑŒ Ð· Ð´Ñ–Ñ”Ð¿Ñ€Ð¸ÑÐ»Ñ–Ð²Ð½Ð¸ÐºÐ°Ð¼Ð¸\n\n> Ð’Ð¸Ð±ÐµÑ€Ñ–Ñ‚ÑŒ Ð¿Ñ€Ð°Ð²Ð¸Ð»ÑŒÐ½Ð¸Ð¹ Ð¿ÐµÑ€ÐµÐºÐ»Ð°Ð´ Ñ€ÐµÑ‡ÐµÐ½Ð½Ñ ÑƒÐºÑ€Ð°Ñ—Ð½ÑÑŒÐºÐ¾ÑŽ Ð¼Ð¾Ð²Ð¾ÑŽ, Ð²Ð¸ÐºÐ¾Ñ€Ð¸ÑÑ‚Ð¾Ð²ÑƒÑŽÑ‡Ð¸ Ð´Ñ–Ñ”Ð¿Ñ€Ð¸ÑÐ»Ñ–Ð²Ð½Ð¸ÐºÐ¸ Ð½ÐµÐ´Ð¾ÐºÐ¾Ð½Ð°Ð½Ð¾Ð³Ð¾ Ð²Ð¸Ð´Ñƒ.\n\n1. While reading the newspaper, grandfather was drinking coffee.\n   - [ ] ÐŸÑ€Ð¾Ñ‡Ð¸Ñ‚Ð°Ð²ÑˆÐ¸ Ð³Ð°Ð·ÐµÑ‚Ñƒ, Ð´Ñ–Ð´ÑƒÑÑŒ Ð¿Ð¸Ð² ÐºÐ°Ð²Ñƒ.\n   - [x] Ð§Ð¸Ñ‚Ð°ÑŽÑ‡Ð¸ Ð³Ð°Ð·ÐµÑ‚Ñƒ, Ð´Ñ–Ð´ÑƒÑÑŒ Ð¿Ð¸Ð² ÐºÐ°Ð²Ñƒ.\n   - [ ] Ð§Ð¸Ñ‚Ð°Ñ‚Ð¸ Ð³Ð°Ð·ÐµÑ‚Ñƒ, Ð´Ñ–Ð´ÑƒÑÑŒ Ð¿Ð¸Ð² ÐºÐ°Ð²Ñƒ.\n   - [ ] Ð§Ð¸Ñ‚Ð°Ñ”Ð¼Ð¾ Ð³Ð°Ð·ÐµÑ‚Ñƒ, Ð´Ñ–Ð´ÑƒÑÑŒ Ð¿Ð¸Ð² ÐºÐ°Ð²Ñƒ.\n   > ÐžÐ´Ð½Ð¾Ñ‡Ð°ÑÐ½Ñ–ÑÑ‚ÑŒ Ð´Ñ–Ð¹ Ð¿Ð¾Ñ‚Ñ€ÐµÐ±ÑƒÑ” Ð´Ñ–Ñ”Ð¿Ñ€Ð¸ÑÐ»Ñ–Ð²Ð½Ð¸ÐºÐ° ÐÐ”Ð’ Â«Ñ‡Ð¸Ñ‚Ð°ÑŽÑ‡Ð¸Â».\n\n2. Walking through the park, she was thinking about her future.\n   - [x] Ð™Ð´ÑƒÑ‡Ð¸ Ñ‡ÐµÑ€ÐµÐ· Ð¿Ð°Ñ€Ðº, Ð²Ð¾Ð½Ð° Ð´ÑƒÐ¼Ð°Ð»Ð° Ð¿Ñ€Ð¾ Ð¼Ð°Ð¹Ð±ÑƒÑ‚Ð½Ñ”.\n   - [ ] ÐŸÑ–ÑˆÐ¾Ð²ÑˆÐ¸ Ñ‡ÐµÑ€ÐµÐ· Ð¿Ð°Ñ€Ðº, Ð²Ð¾Ð½Ð° Ð´ÑƒÐ¼Ð°Ð»Ð° Ð¿Ñ€Ð¾ Ð¼Ð°Ð¹Ð±ÑƒÑ‚Ð½Ñ”.\n   - [ ] Ð¥Ð¾Ð´Ð¸Ñ‚Ð¸ Ñ‡ÐµÑ€ÐµÐ· Ð¿Ð°Ñ€Ðº, Ð²Ð¾Ð½Ð° Ð´ÑƒÐ¼Ð°Ð»Ð° Ð¿Ñ€Ð¾ Ð¼Ð°Ð¹Ð±ÑƒÑ‚Ð½Ñ”.\n   - [ ] Ð™Ð´ÐµÐ¼Ð¾ Ñ‡ÐµÑ€ÐµÐ· Ð¿Ð°Ñ€Ðº, Ð²Ð¾Ð½Ð° Ð´ÑƒÐ¼Ð°Ð»Ð° Ð¿Ñ€Ð¾ Ð¼Ð°Ð¹Ð±ÑƒÑ‚Ð½Ñ”.\n   > Ð”Ñ–Ñ”Ð¿Ñ€Ð¸ÑÐ»Ñ–Ð²Ð½Ð¸Ðº ÐÐ”Ð’ Â«Ð¹Ð´ÑƒÑ‡Ð¸Â» Ð²Ð¸Ñ€Ð°Ð¶Ð°Ñ” Ð¾Ð´Ð½Ð¾Ñ‡Ð°ÑÐ½Ñ–ÑÑ‚ÑŒ.\n\n3. Listening to music, I was doing my homework.\n   - [ ] ÐŸÐ¾ÑÐ»ÑƒÑ…Ð°Ð²ÑˆÐ¸ Ð¼ÑƒÐ·Ð¸ÐºÑƒ, Ñ Ñ€Ð¾Ð±Ð¸Ð² Ð´Ð¾Ð¼Ð°ÑˆÐ½Ñ” Ð·Ð°Ð²Ð´Ð°Ð½Ð½Ñ.\n   - [ ] Ð¡Ð»ÑƒÑ…Ð°Ñ‚Ð¸ Ð¼ÑƒÐ·Ð¸ÐºÑƒ, Ñ Ñ€Ð¾Ð±Ð¸Ð² Ð´Ð¾Ð¼Ð°ÑˆÐ½Ñ” Ð·Ð°Ð²Ð´Ð°Ð½Ð½Ñ.\n   - [x] Ð¡Ð»ÑƒÑ…Ð°ÑŽÑ‡Ð¸ Ð¼ÑƒÐ·Ð¸ÐºÑƒ, Ñ Ñ€Ð¾Ð±Ð¸Ð² Ð´Ð¾Ð¼Ð°ÑˆÐ½Ñ” Ð·Ð°Ð²Ð´Ð°Ð½Ð½Ñ.\n   - [ ] Ð¡Ð»ÑƒÑ…Ð°Ð»Ð° Ð¼ÑƒÐ·Ð¸ÐºÑƒ, Ñ Ñ€Ð¾Ð±Ð¸Ð² Ð´Ð¾Ð¼Ð°ÑˆÐ½Ñ” Ð·Ð°Ð²Ð´Ð°Ð½Ð½Ñ.\n   > Ð”Ñ–Ñ”Ð¿Ñ€Ð¸ÑÐ»Ñ–Ð²Ð½Ð¸Ðº ÐÐ”Ð’ Â«ÑÐ»ÑƒÑ…Ð°ÑŽÑ‡Ð¸Â» Ð¿Ð¾ÐºÐ°Ð·ÑƒÑ” Ð¿Ð°Ñ€Ð°Ð»ÐµÐ»ÑŒÐ½Ñ– Ð´Ñ–Ñ—.\n\n4. Sitting on the bench, they were watching the sunset.\n   - [ ] Ð¡Ð¸Ð´Ñ–Ð²ÑˆÐ¸ Ð½Ð° Ð»Ð°Ð²Ñ†Ñ–, Ð²Ð¾Ð½Ð¸ Ð´Ð¸Ð²Ð¸Ð»Ð¸ÑÑ Ð½Ð° Ð·Ð°Ñ…Ñ–Ð´.\n   - [ ] Ð¡Ð¸Ð´Ñ–Ñ‚Ð¸ Ð½Ð° Ð»Ð°Ð²Ñ†Ñ–, Ð²Ð¾Ð½Ð¸ Ð´Ð¸Ð²Ð¸Ð»Ð¸ÑÑ Ð½Ð° Ð·Ð°Ñ…Ñ–Ð´.\n   - [x] Ð¡Ð¸Ð´ÑÑ‡Ð¸ Ð½Ð° Ð»Ð°Ð²Ñ†Ñ–, Ð²Ð¾Ð½Ð¸ Ð´Ð¸Ð²Ð¸Ð»Ð¸ÑÑ Ð½Ð° Ð·Ð°Ñ…Ñ–Ð´ ÑÐ¾Ð½Ñ†Ñ.\n   - [ ] Ð¡Ð¸Ð´Ñ–Ð»Ð¸ Ð½Ð° Ð»Ð°Ð²Ñ†Ñ–, Ð²Ð¾Ð½Ð¸ Ð´Ð¸Ð²Ð¸Ð»Ð¸ÑÑ Ð½Ð° Ð·Ð°Ñ…Ñ–Ð´ ÑÐ¾Ð½Ñ†Ñ.\n   > Â«Ð¡Ð¸Ð´ÑÑ‡Ð¸Â» â€” Ð´Ñ–Ñ”Ð¿Ñ€Ð¸ÑÐ»Ñ–Ð²Ð½Ð¸Ðº ÐÐ”Ð’ Ð²Ñ–Ð´ Â«ÑÐ¸Ð´Ñ–Ñ‚Ð¸Â».\n\n5. While preparing dinner, mother was talking on the phone.\n   - [x] Ð“Ð¾Ñ‚ÑƒÑŽÑ‡Ð¸ Ð²ÐµÑ‡ÐµÑ€ÑŽ, Ð¼Ð°Ð¼Ð° Ñ€Ð¾Ð·Ð¼Ð¾Ð²Ð»ÑÐ»Ð° Ð¿Ð¾ Ñ‚ÐµÐ»ÐµÑ„Ð¾Ð½Ñƒ.\n   - [ ] ÐŸÑ€Ð¸Ð³Ð¾Ñ‚ÑƒÐ²Ð°Ð²ÑˆÐ¸ Ð²ÐµÑ‡ÐµÑ€ÑŽ, Ð¼Ð°Ð¼Ð° Ñ€Ð¾Ð·Ð¼Ð¾Ð²Ð»ÑÐ»Ð° Ð¿Ð¾ Ñ‚ÐµÐ»ÐµÑ„Ð¾Ð½Ñƒ.\n   - [ ] Ð“Ð¾Ñ‚ÑƒÐ²Ð°Ñ‚Ð¸ Ð²ÐµÑ‡ÐµÑ€ÑŽ, Ð¼Ð°Ð¼Ð° Ñ€Ð¾Ð·Ð¼Ð¾Ð²Ð»ÑÐ»Ð° Ð¿Ð¾ Ñ‚ÐµÐ»ÐµÑ„Ð¾Ð½Ñƒ.\n   - [ ] Ð“Ð¾Ñ‚ÑƒÑ” Ð²ÐµÑ‡ÐµÑ€ÑŽ, Ð¼Ð°Ð¼Ð° Ñ€Ð¾Ð·Ð¼Ð¾Ð²Ð»ÑÐ»Ð° Ð¿Ð¾ Ñ‚ÐµÐ»ÐµÑ„Ð¾Ð½Ñƒ.\n   > Â«Ð“Ð¾Ñ‚ÑƒÑŽÑ‡Ð¸Â» Ð²Ð¸Ñ€Ð°Ð¶Ð°Ñ” Ð´Ñ–ÑŽ, Ñ‰Ð¾ Ð²Ñ–Ð´Ð±ÑƒÐ²Ð°Ñ”Ñ‚ÑŒÑÑ Ð¾Ð´Ð½Ð¾Ñ‡Ð°ÑÐ½Ð¾ Ð· Ñ€Ð¾Ð·Ð¼Ð¾Ð²Ð¾ÑŽ.\n\n6. Returning home from work, he always bought fresh bread.\n   - [ ] ÐŸÐ¾Ð²ÐµÑ€Ð½ÑƒÐ²ÑˆÐ¸ÑÑŒ Ð´Ð¾Ð´Ð¾Ð¼Ñƒ Ð· Ñ€Ð¾Ð±Ð¾Ñ‚Ð¸, Ð²Ñ–Ð½ ÐºÑƒÐ¿ÑƒÐ²Ð°Ð² Ñ…Ð»Ñ–Ð±.\n   - [x] ÐŸÐ¾Ð²ÐµÑ€Ñ‚Ð°ÑŽÑ‡Ð¸ÑÑŒ Ð´Ð¾Ð´Ð¾Ð¼Ñƒ Ð· Ñ€Ð¾Ð±Ð¾Ñ‚Ð¸, Ð²Ñ–Ð½ Ð·Ð°Ð²Ð¶Ð´Ð¸ ÐºÑƒÐ¿ÑƒÐ²Ð°Ð² Ñ…Ð»Ñ–Ð±.\n   - [ ] ÐŸÐ¾Ð²ÐµÑ€Ñ‚Ð°Ñ‚Ð¸ÑÑ Ð´Ð¾Ð´Ð¾Ð¼Ñƒ Ð· Ñ€Ð¾Ð±Ð¾Ñ‚Ð¸, Ð²Ñ–Ð½ ÐºÑƒÐ¿ÑƒÐ²Ð°Ð² Ñ…Ð»Ñ–Ð±.\n   - [ ] ÐŸÐ¾Ð²ÐµÑ€Ð½ÑƒÐ²ÑÑ Ð´Ð¾Ð´Ð¾Ð¼Ñƒ Ð· Ñ€Ð¾Ð±Ð¾Ñ‚Ð¸, Ð²Ñ–Ð½ ÐºÑƒÐ¿ÑƒÐ²Ð°Ð² Ñ…Ð»Ñ–Ð±.\n   > Â«ÐŸÐ¾Ð²ÐµÑ€Ñ‚Ð°ÑŽÑ‡Ð¸ÑÑŒÂ» â€” Ð´Ñ–Ñ”Ð¿Ñ€Ð¸ÑÐ»Ñ–Ð²Ð½Ð¸Ðº Ð²Ñ–Ð´ Ð·Ð²Ð¾Ñ€Ð¾Ñ‚Ð½Ð¾Ð³Ð¾ Ð´Ñ–Ñ”ÑÐ»Ð¾Ð²Ð°.\n\n7. While standing at the bus stop, people were waiting for the bus.\n   - [ ] ÐŸÐ¾ÑÑ‚Ð¾ÑÐ²ÑˆÐ¸ Ð½Ð° Ð·ÑƒÐ¿Ð¸Ð½Ñ†Ñ–, Ð»ÑŽÐ´Ð¸ Ñ‡ÐµÐºÐ°Ð»Ð¸ Ð½Ð° Ð°Ð²Ñ‚Ð¾Ð±ÑƒÑ.\n   - [ ] Ð¡Ñ‚Ð¾ÑÑ‚Ð¸ Ð½Ð° Ð·ÑƒÐ¿Ð¸Ð½Ñ†Ñ–, Ð»ÑŽÐ´Ð¸ Ñ‡ÐµÐºÐ°Ð»Ð¸ Ð½Ð° Ð°Ð²Ñ‚Ð¾Ð±ÑƒÑ.\n   - [x] Ð¡Ñ‚Ð¾ÑÑ‡Ð¸ Ð½Ð° Ð·ÑƒÐ¿Ð¸Ð½Ñ†Ñ–, Ð»ÑŽÐ´Ð¸ Ñ‡ÐµÐºÐ°Ð»Ð¸ Ð½Ð° Ð°Ð²Ñ‚Ð¾Ð±ÑƒÑ.\n   - [ ] Ð¡Ñ‚Ð¾ÑÐ»Ð¸ Ð½Ð° Ð·ÑƒÐ¿Ð¸Ð½Ñ†Ñ–, Ð»ÑŽÐ´Ð¸ Ñ‡ÐµÐºÐ°Ð»Ð¸ Ð½Ð° Ð°Ð²Ñ‚Ð¾Ð±ÑƒÑ.\n   > Â«Ð¡Ñ‚Ð¾ÑÑ‡Ð¸Â» ÑƒÑ‚Ð²Ð¾Ñ€ÑŽÑ”Ñ‚ÑŒÑÑ Ð²Ñ–Ð´ Ð¾ÑÐ½Ð¾Ð²Ð¸ Â«ÑÑ‚Ð¾-Â» + ÑÑƒÑ„Ñ–ÐºÑ -ÑÑ‡Ð¸.\n\n8. Writing the letter, he was remembering his childhood.\n   - [ ] ÐÐ°Ð¿Ð¸ÑÐ°Ð²ÑˆÐ¸ Ð»Ð¸ÑÑ‚Ð°, Ð²Ñ–Ð½ Ð·Ð³Ð°Ð´ÑƒÐ²Ð°Ð² Ð´Ð¸Ñ‚Ð¸Ð½ÑÑ‚Ð²Ð¾.\n   - [ ] ÐŸÐ¸ÑÐ°Ñ‚Ð¸ Ð»Ð¸ÑÑ‚Ð°, Ð²Ñ–Ð½ Ð·Ð³Ð°Ð´ÑƒÐ²Ð°Ð² Ð´Ð¸Ñ‚Ð¸Ð½ÑÑ‚Ð²Ð¾.\n   - [ ] ÐŸÐ¸ÑÐ°ÑŽÑ‡Ð¸ Ð»Ð¸ÑÑ‚Ð°, Ð²Ñ–Ð½ Ð·Ð³Ð°Ð´ÑƒÐ²Ð°Ð² Ð´Ð¸Ñ‚Ð¸Ð½ÑÑ‚Ð²Ð¾.\n   - [x] ÐŸÐ¸ÑˆÑƒÑ‡Ð¸ Ð»Ð¸ÑÑ‚Ð°, Ð²Ñ–Ð½ Ð·Ð³Ð°Ð´ÑƒÐ²Ð°Ð² ÑÐ²Ð¾Ñ” Ð´Ð¸Ñ‚Ð¸Ð½ÑÑ‚Ð²Ð¾.\n   > Â«ÐŸÐ¸ÑˆÑƒÑ‡Ð¸Â» â€” Ð²Ñ–Ð´ Ð¾ÑÐ½Ð¾Ð²Ð¸ Â«Ð¿Ð¸Ñˆ-Â» (Ð½Ðµ Â«Ð¿Ð¸ÑÐ°-Â»!).\n\n---"
      },
      {
        "id": "section-4",
        "name": "Ð¡Ð»Ð¾Ð²Ð½Ð¸Ðº",
        "nameEn": null,
        "type": "vocabulary",
        "content": "| Ð¡Ð»Ð¾Ð²Ð¾ | Ð’Ð¸Ð¼Ð¾Ð²Ð° | ÐŸÐµÑ€ÐµÐºÐ»Ð°Ð´ | Ð§Ðœ | ÐŸÑ€Ð¸Ð¼Ñ–Ñ‚ÐºÐ° |\n|-------|--------|----------|-----|----------|\n| **Ñ‡Ð¸Ñ‚Ð°ÑŽÑ‡Ð¸** | /tÊƒÉªËˆtÉ‘jutÊƒÉª/ | while reading | Ð´Ñ–Ñ”Ð¿Ñ€. | Ð²Ñ–Ð´ Â«Ñ‡Ð¸Ñ‚Ð°Ñ‚Ð¸Â» |\n| **Ð¿Ð¸ÑˆÑƒÑ‡Ð¸** | /ËˆpÉªÊƒutÊƒÉª/ | while writing | Ð´Ñ–Ñ”Ð¿Ñ€. | Ð²Ñ–Ð´ Â«Ð¿Ð¸ÑÐ°Ñ‚Ð¸Â» |\n| **Ð³Ð¾Ð²Ð¾Ñ€ÑÑ‡Ð¸** | /É¦owoËˆrÊ²atÊƒÉª/ | while speaking | Ð´Ñ–Ñ”Ð¿Ñ€. | Ð²Ñ–Ð´ Â«Ð³Ð¾Ð²Ð¾Ñ€Ð¸Ñ‚Ð¸Â» |\n| **ÑÐ»ÑƒÑ…Ð°ÑŽÑ‡Ð¸** | /sluËˆxÉ‘jutÊƒÉª/ | while listening | Ð´Ñ–Ñ”Ð¿Ñ€. | Ð²Ñ–Ð´ Â«ÑÐ»ÑƒÑ…Ð°Ñ‚Ð¸Â» |\n| **Ð´Ð¸Ð²Ð»ÑÑ‡Ð¸ÑÑŒ** | /dÉªwËˆlÊ²atÊƒÉªsÊ²/ | while watching | Ð´Ñ–Ñ”Ð¿Ñ€. | Ð²Ñ–Ð´ Â«Ð´Ð¸Ð²Ð¸Ñ‚Ð¸ÑÑÂ» |\n| **Ð´ÑƒÐ¼Ð°ÑŽÑ‡Ð¸** | /duËˆmÉ‘jutÊƒÉª/ | while thinking | Ð´Ñ–Ñ”Ð¿Ñ€. | Ð²Ñ–Ð´ Â«Ð´ÑƒÐ¼Ð°Ñ‚Ð¸Â» |\n| **Ð¿Ñ€Ð°Ñ†ÑŽÑŽÑ‡Ð¸** | /prÉ‘ËˆtÍ¡sÊ²ujutÊƒÉª/ | while working | Ð´Ñ–Ñ”Ð¿Ñ€. | Ð²Ñ–Ð´ Â«Ð¿Ñ€Ð°Ñ†ÑŽÐ²Ð°Ñ‚Ð¸Â» |\n| **Ð¹Ð´ÑƒÑ‡Ð¸** | /ËˆjdutÊƒÉª/ | while going | Ð´Ñ–Ñ”Ð¿Ñ€. | Ð²Ñ–Ð´ Â«Ð¹Ñ‚Ð¸Â» |\n| **Ð±Ñ–Ð¶Ð°Ñ‡Ð¸** | /bÊ²iËˆÊ’É‘tÊƒÉª/ | while running | Ð´Ñ–Ñ”Ð¿Ñ€. | Ð²Ñ–Ð´ Â«Ð±Ñ–Ð³Ñ‚Ð¸Â» |\n| **ÑÑ‚Ð¾ÑÑ‡Ð¸** | /stoËˆjatÊƒÉª/ | while standing | Ð´Ñ–Ñ”Ð¿Ñ€. | Ð²Ñ–Ð´ Â«ÑÑ‚Ð¾ÑÑ‚Ð¸Â» |\n| **ÑÐ¸Ð´ÑÑ‡Ð¸** | /sÉªËˆdÊ²atÊƒÉª/ | while sitting | Ð´Ñ–Ñ”Ð¿Ñ€. | Ð²Ñ–Ð´ Â«ÑÐ¸Ð´Ñ–Ñ‚Ð¸Â» |\n| **Ð»ÐµÐ¶Ð°Ñ‡Ð¸** | /leËˆÊ’É‘tÊƒÉª/ | while lying | Ð´Ñ–Ñ”Ð¿Ñ€. | Ð²Ñ–Ð´ Â«Ð»ÐµÐ¶Ð°Ñ‚Ð¸Â» |\n| **Ñ—Ð´ÑƒÑ‡Ð¸** | /ËˆjidutÊƒÉª/ | while eating | Ð´Ñ–Ñ”Ð¿Ñ€. | Ð²Ñ–Ð´ Â«Ñ—ÑÑ‚Ð¸Â» |\n| **Ð»ÐµÑ‚ÑÑ‡Ð¸** | /leËˆtÊ²atÊƒÉª/ | while flying | Ð´Ñ–Ñ”Ð¿Ñ€. | Ð²Ñ–Ð´ Â«Ð»ÐµÑ‚Ñ–Ñ‚Ð¸Â» |\n| **Ð½ÐµÑÑƒÑ‡Ð¸** | /neËˆsutÊƒÉª/ | while carrying | Ð´Ñ–Ñ”Ð¿Ñ€. | Ð²Ñ–Ð´ Â«Ð½ÐµÑÑ‚Ð¸Â» |\n| **Ð²ÐµÐ´ÑƒÑ‡Ð¸** | /weËˆdutÊƒÉª/ | while leading | Ð´Ñ–Ñ”Ð¿Ñ€. | Ð²Ñ–Ð´ Â«Ð²ÐµÑÑ‚Ð¸Â» |\n| **Ð¿Ð¾Ð²ÐµÑ€Ñ‚Ð°ÑŽÑ‡Ð¸ÑÑŒ** | /powÉ›rËˆtÉ‘jutÊƒÉªsÊ²/ | while returning | Ð´Ñ–Ñ”Ð¿Ñ€. | Ð²Ñ–Ð´ Â«Ð¿Ð¾Ð²ÐµÑ€Ñ‚Ð°Ñ‚Ð¸ÑÑÂ» |\n| **Ð¾Ð´ÑÐ³Ð°ÑŽÑ‡Ð¸ÑÑŒ** | /odÊ²É‘ËˆÉ¦É‘jutÊƒÉªsÊ²/ | while dressing | Ð´Ñ–Ñ”Ð¿Ñ€. | Ð²Ñ–Ð´ Â«Ð¾Ð´ÑÐ³Ð°Ñ‚Ð¸ÑÑÂ» |\n| **Ð²Ð¼Ð¸Ð²Ð°ÑŽÑ‡Ð¸ÑÑŒ** | /wmÉªËˆwÉ‘jutÊƒÉªsÊ²/ | while washing | Ð´Ñ–Ñ”Ð¿Ñ€. | Ð²Ñ–Ð´ Â«Ð²Ð¼Ð¸Ð²Ð°Ñ‚Ð¸ÑÑÂ» |\n| **Ð³Ð¾Ñ‚ÑƒÑŽÑ‡Ð¸ÑÑŒ** | /É¦oËˆtujutÊƒÉªsÊ²/ | while preparing | Ð´Ñ–Ñ”Ð¿Ñ€. | Ð²Ñ–Ð´ Â«Ð³Ð¾Ñ‚ÑƒÐ²Ð°Ñ‚Ð¸ÑÑÂ» |\n| **ÑÐ¿Ñ–Ð²Ð°ÑŽÑ‡Ð¸** | /spÊ²iËˆwÉ‘jutÊƒÉª/ | while singing | Ð´Ñ–Ñ”Ð¿Ñ€. | Ð²Ñ–Ð´ Â«ÑÐ¿Ñ–Ð²Ð°Ñ‚Ð¸Â» |\n| **Ð³ÑƒÐ»ÑÑŽÑ‡Ð¸** | /É¦uËˆlÊ²ajutÊƒÉª/ | while walking | Ð´Ñ–Ñ”Ð¿Ñ€. | Ð²Ñ–Ð´ Â«Ð³ÑƒÐ»ÑÑ‚Ð¸Â» |\n| **Ñ‡ÐµÐºÐ°ÑŽÑ‡Ð¸** | /tÊƒeËˆkÉ‘jutÊƒÉª/ | while waiting | Ð´Ñ–Ñ”Ð¿Ñ€. | Ð²Ñ–Ð´ Â«Ñ‡ÐµÐºÐ°Ñ‚Ð¸Â» |\n| **Ñ€Ð°Ñ…ÑƒÑŽÑ‡Ð¸** | /rÉ‘ËˆxujutÊƒÉª/ | while counting | Ð´Ñ–Ñ”Ð¿Ñ€. | Ð²Ñ–Ð´ Â«Ñ€Ð°Ñ…ÑƒÐ²Ð°Ñ‚Ð¸Â» |\n| **Ð¼Ð¾Ð²Ñ‡Ð°Ñ‡Ð¸** | /mowËˆtÊƒÉ‘tÊƒÉª/ | while being silent | Ð´Ñ–Ñ”Ð¿Ñ€. | Ð²Ñ–Ð´ Â«Ð¼Ð¾Ð²Ñ‡Ð°Ñ‚Ð¸Â» |"
      }
    ],
    "rawMarkdown": "---\nmodule: b1-42\ntitle: \"Ð”Ñ–Ñ”Ð¿Ñ€Ð¸ÑÐ»Ñ–Ð²Ð½Ð¸ÐºÐ¸ Ð½ÐµÐ´Ð¾ÐºÐ¾Ð½Ð°Ð½Ð¾Ð³Ð¾ Ð²Ð¸Ð´Ñƒ\"\nsubtitle: \"Adverbial Participles - Imperfective (-ÑŽÑ‡Ð¸/-Ð°Ñ‡Ð¸)\"\nversion: \"1.0\"\nphase: \"B1.4 Advanced Grammar\"\npedagogy: \"TTT\"\nduration: 90\ntransliteration: none\ntags:\n  - grammar\n  - participles\n  - adverbial-participles\n  - imperfective\ngrammar:\n  - \"Ð”Ñ–Ñ”Ð¿Ñ€Ð¸ÑÐ»Ñ–Ð²Ð½Ð¸ÐºÐ¸ Ð½ÐµÐ´Ð¾ÐºÐ¾Ð½Ð°Ð½Ð¾Ð³Ð¾ Ð²Ð¸Ð´Ñƒ\"\n  - \"Ð¡ÑƒÑ„Ñ–ÐºÑÐ¸ -ÑŽÑ‡Ð¸/-Ð°Ñ‡Ð¸\"\n  - \"ÐžÐ´Ð½Ð¾Ñ‡Ð°ÑÐ½Ñ–ÑÑ‚ÑŒ Ð´Ñ–Ð¹\"\nobjectives:\n  - \"Learner can form imperfective adverbial participles using -ÑŽÑ‡Ð¸/-Ð°Ñ‡Ð¸ suffixes\"\n  - \"Learner can use adverbial participles to express simultaneous actions\"\n  - \"Learner understands when imperfective participles are preferred over perfective\"\nvocabulary_count: 20\n---\n\n# Ð”Ñ–Ñ”Ð¿Ñ€Ð¸ÑÐ»Ñ–Ð²Ð½Ð¸ÐºÐ¸ Ð½ÐµÐ´Ð¾ÐºÐ¾Ð½Ð°Ð½Ð¾Ð³Ð¾ Ð²Ð¸Ð´Ñƒ\n\n> ðŸŽ¯ **Ð§Ð¾Ð¼Ñƒ Ñ†Ðµ Ð²Ð°Ð¶Ð»Ð¸Ð²Ð¾?**\n>\n> Ð”Ñ–Ñ”Ð¿Ñ€Ð¸ÑÐ»Ñ–Ð²Ð½Ð¸ÐºÐ¸ â€” Ñ†Ðµ Ð¾ÑÐ¾Ð±Ð»Ð¸Ð²Ñ– Ñ„Ð¾Ñ€Ð¼Ð¸ Ð´Ñ–Ñ”ÑÐ»Ð¾Ð²Ð°, ÑÐºÑ– Ð¾Ð¿Ð¸ÑÑƒÑŽÑ‚ÑŒ Ð´Ð¾Ð´Ð°Ñ‚ÐºÐ¾Ð²Ñƒ Ð´Ñ–ÑŽ. Ð—Ð°Ð¼Ñ–ÑÑ‚ÑŒ Ð´Ð²Ð¾Ñ… Ñ€ÐµÑ‡ÐµÐ½ÑŒ (Â«Ð’Ñ–Ð½ Ñ‡Ð¸Ñ‚Ð°Ð² ÐºÐ½Ð¸Ð³Ñƒ. Ð’Ñ–Ð½ Ð¿Ð¸Ð² ÐºÐ°Ð²Ñƒ.Â») ÑƒÐºÑ€Ð°Ñ—Ð½Ñ†Ñ– ÐºÐ°Ð¶ÑƒÑ‚ÑŒ: Â«Ð§Ð¸Ñ‚Ð°ÑŽÑ‡Ð¸ ÐºÐ½Ð¸Ð³Ñƒ, Ð²Ñ–Ð½ Ð¿Ð¸Ð² ÐºÐ°Ð²Ñƒ.Â» Ð¦Ðµ Ñ€Ð¾Ð±Ð¸Ñ‚ÑŒ Ð¼Ð¾Ð²Ñƒ ÑÑ‚Ð¸ÑÐ»Ð¾ÑŽ, ÐµÐ»ÐµÐ³Ð°Ð½Ñ‚Ð½Ð¾ÑŽ Ñ‚Ð° Ð¿Ñ€Ð¸Ñ€Ð¾Ð´Ð½Ð¾ÑŽ. Ð”Ñ–Ñ”Ð¿Ñ€Ð¸ÑÐ»Ñ–Ð²Ð½Ð¸ÐºÐ¸ Ð½ÐµÐ´Ð¾ÐºÐ¾Ð½Ð°Ð½Ð¾Ð³Ð¾ Ð²Ð¸Ð´Ñƒ Ð¿Ð¾ÐºÐ°Ð·ÑƒÑŽÑ‚ÑŒ **Ð¾Ð´Ð½Ð¾Ñ‡Ð°ÑÐ½Ñ–ÑÑ‚ÑŒ** Ð´Ñ–Ð¹ â€” ÐºÐ¾Ð»Ð¸ Ð´Ð²Ñ– Ñ€ÐµÑ‡Ñ– Ð²Ñ–Ð´Ð±ÑƒÐ²Ð°ÑŽÑ‚ÑŒÑÑ Ð² Ð¾Ð´Ð¸Ð½ Ñ– Ñ‚Ð¾Ð¹ ÑÐ°Ð¼Ð¸Ð¹ Ð¼Ð¾Ð¼ÐµÐ½Ñ‚ Ñ‡Ð°ÑÑƒ. ÐžÐ¿Ð°Ð½ÑƒÐ²Ð°Ð²ÑˆÐ¸ Ñ†ÑŽ Ð²Ð°Ð¶Ð»Ð¸Ð²Ñƒ Ð³Ñ€Ð°Ð¼Ð°Ñ‚Ð¸Ñ‡Ð½Ñƒ Ñ„Ð¾Ñ€Ð¼Ñƒ, Ð²Ð¸ Ð·Ð¼Ð¾Ð¶ÐµÑ‚Ðµ Ð³Ð¾Ð²Ð¾Ñ€Ð¸Ñ‚Ð¸ Ð¿Ñ€Ð¸Ñ€Ð¾Ð´Ð½Ñ–ÑˆÐµ Ñ– Ð·Ñ€Ð¾Ð·ÑƒÐ¼Ñ–Ñ‚Ð¸ ÑÐºÐ»Ð°Ð´Ð½Ñ–ÑˆÑ– ÑƒÐºÑ€Ð°Ñ—Ð½ÑÑŒÐºÑ– Ñ‚ÐµÐºÑÑ‚Ð¸.\n\n---\n\n## Ð”Ñ–Ð°Ð³Ð½Ð¾ÑÑ‚Ð¸ÐºÐ°\n\nÐŸÐ¾Ñ€Ñ–Ð²Ð½ÑÐ¹Ñ‚Ðµ Ð´Ð²Ð° Ð²Ð°Ñ€Ñ–Ð°Ð½Ñ‚Ð¸ ÐºÐ¾Ð¶Ð½Ð¾Ð³Ð¾ Ñ€ÐµÑ‡ÐµÐ½Ð½Ñ:\n\n**ÐŸÐ°Ñ€Ð° 1:**\n- Ð’Ñ–Ð½ Ð¹ÑˆÐ¾Ð² Ð²ÑƒÐ»Ð¸Ñ†ÐµÑŽ. Ð’Ñ–Ð½ Ñ€Ð¾Ð·Ð¼Ð¾Ð²Ð»ÑÐ² Ð¿Ð¾ Ñ‚ÐµÐ»ÐµÑ„Ð¾Ð½Ñƒ.\n- **Ð™Ð´ÑƒÑ‡Ð¸ Ð²ÑƒÐ»Ð¸Ñ†ÐµÑŽ**, Ð²Ñ–Ð½ Ñ€Ð¾Ð·Ð¼Ð¾Ð²Ð»ÑÐ² Ð¿Ð¾ Ñ‚ÐµÐ»ÐµÑ„Ð¾Ð½Ñƒ.\n\n**ÐŸÐ°Ñ€Ð° 2:**\n- Ð’Ð¾Ð½Ð° ÑÐ»ÑƒÑ…Ð°Ð»Ð° Ð¼ÑƒÐ·Ð¸ÐºÑƒ. Ð’Ð¾Ð½Ð° Ð³Ð¾Ñ‚ÑƒÐ²Ð°Ð»Ð° Ð²ÐµÑ‡ÐµÑ€ÑŽ.\n- **Ð¡Ð»ÑƒÑ…Ð°ÑŽÑ‡Ð¸ Ð¼ÑƒÐ·Ð¸ÐºÑƒ**, Ð²Ð¾Ð½Ð° Ð³Ð¾Ñ‚ÑƒÐ²Ð°Ð»Ð° Ð²ÐµÑ‡ÐµÑ€ÑŽ.\n\n**ÐŸÐ°Ñ€Ð° 3:**\n- Ð¡Ñ‚ÑƒÐ´ÐµÐ½Ñ‚Ð¸ ÑÐ¸Ð´Ñ–Ð»Ð¸ Ð² Ð°ÑƒÐ´Ð¸Ñ‚Ð¾Ñ€Ñ–Ñ—. Ð¡Ñ‚ÑƒÐ´ÐµÐ½Ñ‚Ð¸ Ð·Ð°Ð¿Ð¸ÑÑƒÐ²Ð°Ð»Ð¸ Ð»ÐµÐºÑ†Ñ–ÑŽ.\n- **Ð¡Ð¸Ð´ÑÑ‡Ð¸ Ð² Ð°ÑƒÐ´Ð¸Ñ‚Ð¾Ñ€Ñ–Ñ—**, ÑÑ‚ÑƒÐ´ÐµÐ½Ñ‚Ð¸ Ð·Ð°Ð¿Ð¸ÑÑƒÐ²Ð°Ð»Ð¸ Ð»ÐµÐºÑ†Ñ–ÑŽ.\n\nÐ—Ð²ÐµÑ€Ð½Ñ–Ñ‚ÑŒ ÑƒÐ²Ð°Ð³Ñƒ Ð½Ð° Ð²Ð¸Ð´Ñ–Ð»ÐµÐ½Ñ– ÑÐ»Ð¾Ð²Ð°: **Ð¹Ð´ÑƒÑ‡Ð¸**, **ÑÐ»ÑƒÑ…Ð°ÑŽÑ‡Ð¸**, **ÑÐ¸Ð´ÑÑ‡Ð¸**. Ð¦Ðµ Ð´Ñ–Ñ”Ð¿Ñ€Ð¸ÑÐ»Ñ–Ð²Ð½Ð¸ÐºÐ¸ Ð½ÐµÐ´Ð¾ÐºÐ¾Ð½Ð°Ð½Ð¾Ð³Ð¾ Ð²Ð¸Ð´Ñƒ. Ð’Ð¾Ð½Ð¸ ÑƒÑ‚Ð²Ð¾Ñ€ÑŽÑŽÑ‚ÑŒÑÑ Ð²Ñ–Ð´ Ð´Ñ–Ñ”ÑÐ»Ñ–Ð² Ð½ÐµÐ´Ð¾ÐºÐ¾Ð½Ð°Ð½Ð¾Ð³Ð¾ Ð²Ð¸Ð´Ñƒ Ñ– Ð¿Ð¾ÐºÐ°Ð·ÑƒÑŽÑ‚ÑŒ, Ñ‰Ð¾ Ð´Ð²Ñ– Ð´Ñ–Ñ— Ð²Ñ–Ð´Ð±ÑƒÐ²Ð°ÑŽÑ‚ÑŒÑÑ **Ð¾Ð´Ð½Ð¾Ñ‡Ð°ÑÐ½Ð¾**. Ð¦Ñ– Ñ„Ð¾Ñ€Ð¼Ð¸ Ñ” Ñ…Ð°Ñ€Ð°ÐºÑ‚ÐµÑ€Ð½Ð¾ÑŽ Ð¾Ð·Ð½Ð°ÐºÐ¾ÑŽ ÑÑƒÑ‡Ð°ÑÐ½Ð¾Ñ— ÑƒÐºÑ€Ð°Ñ—Ð½ÑÑŒÐºÐ¾Ñ— Ð¼Ð¾Ð²Ð¸ Ñ– ÑˆÐ¸Ñ€Ð¾ÐºÐ¾ Ð²Ð¶Ð¸Ð²Ð°ÑŽÑ‚ÑŒÑÑ ÑÐº Ñƒ Ñ€Ð¾Ð·Ð¼Ð¾Ð²Ð½Ð¾Ð¼Ñƒ, Ñ‚Ð°Ðº Ñ– Ð² Ð¾Ñ„Ñ–Ñ†Ñ–Ð¹Ð½Ð¾Ð¼Ñƒ Ð¼Ð¾Ð²Ð»ÐµÐ½Ð½Ñ–.\n\n---\n\n## ÐŸÐ¾ÑÑÐ½ÐµÐ½Ð½Ñ\n\n### Ð©Ð¾ Ñ‚Ð°ÐºÐµ Ð´Ñ–Ñ”Ð¿Ñ€Ð¸ÑÐ»Ñ–Ð²Ð½Ð¸Ðº?\n\nÐ”Ñ–Ñ”Ð¿Ñ€Ð¸ÑÐ»Ñ–Ð²Ð½Ð¸Ðº â€” Ñ†Ðµ Ð½ÐµÐ·Ð¼Ñ–Ð½ÑŽÐ²Ð°Ð½Ð° Ñ„Ð¾Ñ€Ð¼Ð° Ð´Ñ–Ñ”ÑÐ»Ð¾Ð²Ð°, ÑÐºÐ° Ð¾Ð¿Ð¸ÑÑƒÑ” **Ð´Ð¾Ð´Ð°Ñ‚ÐºÐ¾Ð²Ñƒ Ð´Ñ–ÑŽ** Ð¿Ñ€Ð¸ Ð¾ÑÐ½Ð¾Ð²Ð½Ð¾Ð¼Ñƒ Ð´Ñ–Ñ”ÑÐ»Ð¾Ð²Ñ– Ð² Ñ€ÐµÑ‡ÐµÐ½Ð½Ñ–. Ð”Ñ–Ñ”Ð¿Ñ€Ð¸ÑÐ»Ñ–Ð²Ð½Ð¸Ðº Ð²Ñ–Ð´Ð¿Ð¾Ð²Ñ–Ð´Ð°Ñ” Ð½Ð° Ð¿Ð¸Ñ‚Ð°Ð½Ð½Ñ: **Ð¯Ðº?**, **ÐšÐ¾Ð»Ð¸?**, **Ð©Ð¾ Ñ€Ð¾Ð±Ð»ÑÑ‡Ð¸?**\n\nÐÐ° Ð²Ñ–Ð´Ð¼Ñ–Ð½Ñƒ Ð²Ñ–Ð´ Ñ–Ð½ÑˆÐ¸Ñ… Ð´Ñ–Ñ”ÑÐ»Ñ–Ð²Ð½Ð¸Ñ… Ñ„Ð¾Ñ€Ð¼, Ð´Ñ–Ñ”Ð¿Ñ€Ð¸ÑÐ»Ñ–Ð²Ð½Ð¸ÐºÐ¸ Ð½Ðµ Ð·Ð¼Ñ–Ð½ÑŽÑŽÑ‚ÑŒÑÑ Ð·Ð° Ñ€Ð¾Ð´Ð°Ð¼Ð¸, Ñ‡Ð¸ÑÐ»Ð°Ð¼Ð¸, Ð¾ÑÐ¾Ð±Ð°Ð¼Ð¸ Ñ‡Ð¸ Ñ‡Ð°ÑÐ°Ð¼Ð¸. Ð’Ð¾Ð½Ð¸ Ð·Ð°Ð²Ð¶Ð´Ð¸ Ð²Ð¸Ñ€Ð°Ð¶Ð°ÑŽÑ‚ÑŒ Ð´Ñ–ÑŽ, Ñ‰Ð¾ ÑÑƒÐ¿Ñ€Ð¾Ð²Ð¾Ð´Ð¶ÑƒÑ” Ð¾ÑÐ½Ð¾Ð²Ð½Ðµ Ð´Ñ–Ñ”ÑÐ»Ð¾Ð²Ð¾ Ð² Ñ€ÐµÑ‡ÐµÐ½Ð½Ñ–. Ð¡Ð°Ð¼Ðµ Ñ†Ñ Ð½ÐµÐ·Ð¼Ñ–Ð½ÑŽÐ²Ð°Ð½Ñ–ÑÑ‚ÑŒ Ñ€Ð¾Ð±Ð¸Ñ‚ÑŒ Ñ—Ñ… Ð´ÑƒÐ¶Ðµ Ð·Ñ€ÑƒÑ‡Ð½Ð¸Ð¼Ð¸ Ð² Ð¼Ð¾Ð²Ð»ÐµÐ½Ð½Ñ–: Ð²Ð¸ Ð²Ð¸Ð²Ñ‡Ð°Ñ”Ñ‚Ðµ Ð¾Ð´Ð½Ñƒ Ñ„Ð¾Ñ€Ð¼Ñƒ Ñ– Ð²Ð¸ÐºÐ¾Ñ€Ð¸ÑÑ‚Ð¾Ð²ÑƒÑ”Ñ‚Ðµ Ñ—Ñ— Ð² Ð±ÑƒÐ´ÑŒ-ÑÐºÐ¾Ð¼Ñƒ ÐºÐ¾Ð½Ñ‚ÐµÐºÑÑ‚Ñ–.\n\nÐ”Ñ–Ñ”Ð¿Ñ€Ð¸ÑÐ»Ñ–Ð²Ð½Ð¸ÐºÐ¸ Ñ‡Ð°ÑÑ‚Ð¾ Ð½Ð°Ð·Ð¸Ð²Ð°ÑŽÑ‚ÑŒ Â«Ð´Ñ–Ñ”ÑÐ»Ñ–Ð²Ð½Ð¸Ð¼Ð¸ Ð¿Ñ€Ð¸ÑÐ»Ñ–Ð²Ð½Ð¸ÐºÐ°Ð¼Ð¸Â», Ñ‚Ð¾Ð¼Ñƒ Ñ‰Ð¾ Ð²Ð¾Ð½Ð¸ Ñ„ÑƒÐ½ÐºÑ†Ñ–Ð¾Ð½ÑƒÑŽÑ‚ÑŒ ÑÐº Ð¾Ð±ÑÑ‚Ð°Ð²Ð¸Ð½Ð¸ Ð² Ñ€ÐµÑ‡ÐµÐ½Ð½Ñ–, Ð¾Ð¿Ð¸ÑÑƒÑŽÑ‡Ð¸ Ð¾Ð±ÑÑ‚Ð°Ð²Ð¸Ð½Ð¸, Ð·Ð° ÑÐºÐ¸Ñ… Ð²Ñ–Ð´Ð±ÑƒÐ²Ð°Ñ”Ñ‚ÑŒÑÑ Ð¾ÑÐ½Ð¾Ð²Ð½Ð° Ð´Ñ–Ñ. ÐŸÐ¾Ñ€Ñ–Ð²Ð½ÑÐ¹Ñ‚Ðµ:\n- Ð’Ñ–Ð½ **ÑˆÐ²Ð¸Ð´ÐºÐ¾** Ð±Ñ–Ð³. (Ð¿Ñ€Ð¸ÑÐ»Ñ–Ð²Ð½Ð¸Ðº Ð¾Ð¿Ð¸ÑÑƒÑ” ÑÐº)\n- Ð’Ñ–Ð½ Ð±Ñ–Ð³, **ÑƒÑÐ¼Ñ–Ñ…Ð°ÑŽÑ‡Ð¸ÑÑŒ**. (Ð´Ñ–Ñ”Ð¿Ñ€Ð¸ÑÐ»Ñ–Ð²Ð½Ð¸Ðº Ð¾Ð¿Ð¸ÑÑƒÑ” ÑÑƒÐ¿Ñ€Ð¾Ð²Ñ–Ð´Ð½Ñƒ Ð´Ñ–ÑŽ)\n\n### Ð£Ñ‚Ð²Ð¾Ñ€ÐµÐ½Ð½Ñ Ð´Ñ–Ñ”Ð¿Ñ€Ð¸ÑÐ»Ñ–Ð²Ð½Ð¸ÐºÑ–Ð² Ð½ÐµÐ´Ð¾ÐºÐ¾Ð½Ð°Ð½Ð¾Ð³Ð¾ Ð²Ð¸Ð´Ñƒ\n\n**Ð¤Ð¾Ñ€Ð¼ÑƒÐ»Ð°:** Ð¾ÑÐ½Ð¾Ð²Ð° Ñ‚ÐµÐ¿ÐµÑ€Ñ–ÑˆÐ½ÑŒÐ¾Ð³Ð¾ Ñ‡Ð°ÑÑƒ + **-ÑŽÑ‡Ð¸** (Ð¿Ñ–ÑÐ»Ñ Ð³Ð¾Ð»Ð¾ÑÐ½Ð¾Ñ—) Ð°Ð±Ð¾ **-Ð°Ñ‡Ð¸** (Ð¿Ñ–ÑÐ»Ñ Ð¿Ñ€Ð¸Ð³Ð¾Ð»Ð¾ÑÐ½Ð¾Ñ—)\n\n| Ð†Ð½Ñ„Ñ–Ð½Ñ–Ñ‚Ð¸Ð² | ÐžÑÐ½Ð¾Ð²Ð° | Ð¡ÑƒÑ„Ñ–ÐºÑ | Ð”Ñ–Ñ”Ð¿Ñ€Ð¸ÑÐ»Ñ–Ð²Ð½Ð¸Ðº |\n|-----------|--------|--------|---------------|\n| Ñ‡Ð¸Ñ‚Ð°Ñ‚Ð¸ | Ñ‡Ð¸Ñ‚Ð°- | -ÑŽÑ‡Ð¸ | **Ñ‡Ð¸Ñ‚Ð°ÑŽÑ‡Ð¸** |\n| Ð¿Ð¸ÑÐ°Ñ‚Ð¸ | Ð¿Ð¸Ñˆ- | -ÑƒÑ‡Ð¸ | **Ð¿Ð¸ÑˆÑƒÑ‡Ð¸** |\n| Ð³Ð¾Ð²Ð¾Ñ€Ð¸Ñ‚Ð¸ | Ð³Ð¾Ð²Ð¾Ñ€- | -ÑÑ‡Ð¸ | **Ð³Ð¾Ð²Ð¾Ñ€ÑÑ‡Ð¸** |\n| ÑÐ»ÑƒÑ…Ð°Ñ‚Ð¸ | ÑÐ»ÑƒÑ…Ð°- | -ÑŽÑ‡Ð¸ | **ÑÐ»ÑƒÑ…Ð°ÑŽÑ‡Ð¸** |\n| Ð±Ñ–Ð³Ñ‚Ð¸ | Ð±Ñ–Ð¶- | -Ð°Ñ‡Ð¸ | **Ð±Ñ–Ð¶Ð°Ñ‡Ð¸** |\n| Ð¹Ñ‚Ð¸ | Ð¹Ð´- | -ÑƒÑ‡Ð¸ | **Ð¹Ð´ÑƒÑ‡Ð¸** |\n| ÑÑ‚Ð¾ÑÑ‚Ð¸ | ÑÑ‚Ð¾- | -ÑÑ‡Ð¸ | **ÑÑ‚Ð¾ÑÑ‡Ð¸** |\n| ÑÐ¸Ð´Ñ–Ñ‚Ð¸ | ÑÐ¸Ð´- | -ÑÑ‡Ð¸ | **ÑÐ¸Ð´ÑÑ‡Ð¸** |\n| Ð»ÐµÐ¶Ð°Ñ‚Ð¸ | Ð»ÐµÐ¶- | -Ð°Ñ‡Ð¸ | **Ð»ÐµÐ¶Ð°Ñ‡Ð¸** |\n| Ñ—ÑÑ‚Ð¸ | Ñ—Ð´- | -ÑƒÑ‡Ð¸ | **Ñ—Ð´ÑƒÑ‡Ð¸** |\n| Ð²ÐµÑÑ‚Ð¸ | Ð²ÐµÐ´- | -ÑƒÑ‡Ð¸ | **Ð²ÐµÐ´ÑƒÑ‡Ð¸** |\n| Ð½ÐµÑÑ‚Ð¸ | Ð½ÐµÑ- | -ÑƒÑ‡Ð¸ | **Ð½ÐµÑÑƒÑ‡Ð¸** |\n\n**ÐŸÑ€Ð¸ÐºÐ»Ð°Ð´Ð¸ Ð² Ñ€ÐµÑ‡ÐµÐ½Ð½ÑÑ…:**\n\n- **Ð§Ð¸Ñ‚Ð°ÑŽÑ‡Ð¸** Ñ†ÑŽ ÐºÐ½Ð¸Ð³Ñƒ, Ñ Ð´Ñ–Ð·Ð½Ð°Ð²ÑÑ Ð±Ð°Ð³Ð°Ñ‚Ð¾ Ð½Ð¾Ð²Ð¾Ð³Ð¾ Ð¿Ñ€Ð¾ ÑƒÐºÑ€Ð°Ñ—Ð½ÑÑŒÐºÑƒ ÐºÑƒÐ»ÑŒÑ‚ÑƒÑ€Ñƒ.\n- Ð¥ÑƒÐ´Ð¾Ð¶Ð½Ð¸Ðº Ð¼Ð°Ð»ÑŽÐ²Ð°Ð² ÐºÐ°Ñ€Ñ‚Ð¸Ð½Ñƒ, **ÑÐ¿Ñ–Ð²Ð°ÑŽÑ‡Ð¸** Ð²ÐµÑÐµÐ»Ñƒ Ð¿Ñ–ÑÐ½ÑŽ.\n- **ÐŸÐ¸ÑˆÑƒÑ‡Ð¸** Ð»Ð¸ÑÑ‚Ð°, Ð²Ð¾Ð½Ð° Ð·Ð³Ð°Ð´ÑƒÐ²Ð°Ð»Ð° Ð¼Ð¸Ð½ÑƒÐ»Ñ– Ñ‡Ð°ÑÐ¸ Ð² ÐžÐ´ÐµÑÑ–.\n- Ð¡Ñ‚ÑƒÐ´ÐµÐ½Ñ‚Ð¸ **ÑÐ»ÑƒÑ…Ð°ÑŽÑ‡Ð¸** Ð»ÐµÐºÑ†Ñ–ÑŽ, Ð·Ð°Ð¿Ð¸ÑÑƒÐ²Ð°Ð»Ð¸ ÐºÐ»ÑŽÑ‡Ð¾Ð²Ñ– Ñ‚ÐµÐ·Ð¸ Ð´Ð¾ Ð·Ð¾ÑˆÐ¸Ñ‚Ñ–Ð².\n\n> ðŸ’¡ **Ð—Ð²ÐµÑ€Ð½Ñ–Ñ‚ÑŒ ÑƒÐ²Ð°Ð³Ñƒ!**\n>\n> Ð”Ñ–Ñ”Ð¿Ñ€Ð¸ÑÐ»Ñ–Ð²Ð½Ð¸ÐºÐ¸ ÑƒÑ‚Ð²Ð¾Ñ€ÑŽÑŽÑ‚ÑŒÑÑ Ð²Ñ–Ð´ Ð¾ÑÐ½Ð¾Ð²Ð¸ **Ñ‚ÐµÐ¿ÐµÑ€Ñ–ÑˆÐ½ÑŒÐ¾Ð³Ð¾ Ñ‡Ð°ÑÑƒ**, Ð° Ð½Ðµ Ð²Ñ–Ð´ Ñ–Ð½Ñ„Ñ–Ð½Ñ–Ñ‚Ð¸Ð²Ð°. Ð¢Ð¾Ð¼Ñƒ: Ð¿Ð¸ÑÐ°Ñ‚Ð¸ â†’ Ð¿Ð¸Ñˆ-ÑƒÑ‡Ð¸ (Ð½Ðµ Ð¿Ð¸ÑÐ°-ÑŽÑ‡Ð¸), Ð±Ñ–Ð³Ñ‚Ð¸ â†’ Ð±Ñ–Ð¶-Ð°Ñ‡Ð¸ (Ð½Ðµ Ð±Ñ–Ð³-ÑŽÑ‡Ð¸).\n\n### Ð ÐµÑ„Ð»ÐµÐºÑÐ¸Ð²Ð½Ñ– Ð´Ñ–Ñ”Ð¿Ñ€Ð¸ÑÐ»Ñ–Ð²Ð½Ð¸ÐºÐ¸\n\nÐ¯ÐºÑ‰Ð¾ Ð´Ñ–Ñ”ÑÐ»Ð¾Ð²Ð¾ Ð·Ð²Ð¾Ñ€Ð¾Ñ‚Ð½Ðµ (Ð· Ñ‡Ð°ÑÑ‚ÐºÐ¾ÑŽ -ÑÑ), Ð´Ñ–Ñ”Ð¿Ñ€Ð¸ÑÐ»Ñ–Ð²Ð½Ð¸Ðº Ñ‚Ð°ÐºÐ¾Ð¶ Ð¼Ð°Ñ” Ñ‡Ð°ÑÑ‚ÐºÑƒ **-ÑÑŒ**:\n\n| Ð†Ð½Ñ„Ñ–Ð½Ñ–Ñ‚Ð¸Ð² | Ð”Ñ–Ñ”Ð¿Ñ€Ð¸ÑÐ»Ñ–Ð²Ð½Ð¸Ðº |\n|-----------|---------------|\n| Ð²Ð¼Ð¸Ð²Ð°Ñ‚Ð¸ÑÑ | **Ð²Ð¼Ð¸Ð²Ð°ÑŽÑ‡Ð¸ÑÑŒ** |\n| Ð¾Ð´ÑÐ³Ð°Ñ‚Ð¸ÑÑ | **Ð¾Ð´ÑÐ³Ð°ÑŽÑ‡Ð¸ÑÑŒ** |\n| Ð¿Ð¾Ð²ÐµÑ€Ñ‚Ð°Ñ‚Ð¸ÑÑ | **Ð¿Ð¾Ð²ÐµÑ€Ñ‚Ð°ÑŽÑ‡Ð¸ÑÑŒ** |\n| Ð³Ð¾Ñ‚ÑƒÐ²Ð°Ñ‚Ð¸ÑÑ | **Ð³Ð¾Ñ‚ÑƒÑŽÑ‡Ð¸ÑÑŒ** |\n| Ð´Ð¸Ð²Ð¸Ñ‚Ð¸ÑÑ | **Ð´Ð¸Ð²Ð»ÑÑ‡Ð¸ÑÑŒ** |\n| ÑƒÑÐ¼Ñ–Ñ…Ð°Ñ‚Ð¸ÑÑ | **ÑƒÑÐ¼Ñ–Ñ…Ð°ÑŽÑ‡Ð¸ÑÑŒ** |\n\nÐ—Ð²ÐµÑ€Ð½Ñ–Ñ‚ÑŒ ÑƒÐ²Ð°Ð³Ñƒ, Ñ‰Ð¾ Ñ‡Ð°ÑÑ‚ÐºÐ° **-ÑÑŒ** Ñƒ Ð´Ñ–Ñ”Ð¿Ñ€Ð¸ÑÐ»Ñ–Ð²Ð½Ð¸ÐºÐ°Ñ… Ð·Ð°Ð²Ð¶Ð´Ð¸ ÑÑ‚Ð¾Ñ—Ñ‚ÑŒ Ñƒ ÐºÑ–Ð½Ñ†Ñ– ÑÐ»Ð¾Ð²Ð°, Ð½Ð° Ð²Ñ–Ð´Ð¼Ñ–Ð½Ñƒ Ð²Ñ–Ð´ Ñ–Ð½Ñ„Ñ–Ð½Ñ–Ñ‚Ð¸Ð²Ð°, Ð´Ðµ Ñ‡Ð°ÑÑ‚ÐºÐ° **-ÑÑ** Ð¼Ð¾Ð¶Ðµ Ð¼Ð°Ñ‚Ð¸ Ð²Ð°Ñ€Ñ–Ð°Ð½Ñ‚ **-ÑÑŒ** Ð¿Ñ–ÑÐ»Ñ Ð³Ð¾Ð»Ð¾ÑÐ½Ð¾Ñ—. Ð£ Ð´Ñ–Ñ”Ð¿Ñ€Ð¸ÑÐ»Ñ–Ð²Ð½Ð¸ÐºÐ°Ñ… Ð²Ð°Ñ€Ñ–Ð°Ð½Ñ‚ **-ÑÑŒ** Ñ” Ð¾Ð±Ð¾Ð²'ÑÐ·ÐºÐ¾Ð²Ð¸Ð¼ Ð½ÐµÐ·Ð°Ð»ÐµÐ¶Ð½Ð¾ Ð²Ñ–Ð´ Ð¿Ð¾Ð¿ÐµÑ€ÐµÐ´Ð½ÑŒÐ¾Ð³Ð¾ Ð·Ð²ÑƒÐºÑƒ. Ð¦Ðµ Ð²Ð°Ð¶Ð»Ð¸Ð²Ð° Ñ„Ð¾Ð½ÐµÑ‚Ð¸Ñ‡Ð½Ð° Ð¾ÑÐ¾Ð±Ð»Ð¸Ð²Ñ–ÑÑ‚ÑŒ ÑƒÐºÑ€Ð°Ñ—Ð½ÑÑŒÐºÐ¾Ñ— Ð¼Ð¾Ð²Ð¸, ÑÐºÐ° Ð²Ñ–Ð´Ñ€Ñ–Ð·Ð½ÑÑ” Ñ—Ñ— Ð²Ñ–Ð´ Ð±Ð°Ð³Ð°Ñ‚ÑŒÐ¾Ñ… Ñ–Ð½ÑˆÐ¸Ñ… ÑÐ»Ð¾Ð²'ÑÐ½ÑÑŒÐºÐ¸Ñ… Ð¼Ð¾Ð².\n\n**ÐŸÑ€Ð¸ÐºÐ»Ð°Ð´Ð¸ Ð·Ñ– Ð·Ð²Ð¾Ñ€Ð¾Ñ‚Ð½Ð¸Ð¼Ð¸ Ð´Ñ–Ñ”Ð¿Ñ€Ð¸ÑÐ»Ñ–Ð²Ð½Ð¸ÐºÐ°Ð¼Ð¸:**\n\n- **ÐŸÐ¾Ð²ÐµÑ€Ñ‚Ð°ÑŽÑ‡Ð¸ÑÑŒ** Ð· ÐšÐ°Ñ€Ð¿Ð°Ñ‚, Ñ‚ÑƒÑ€Ð¸ÑÑ‚Ð¸ Ð·Ð°Ñ…Ð¾Ð¿Ð»ÑŽÐ²Ð°Ð»Ð¸ÑÑ ÐºÑ€Ð°Ñ”Ð²Ð¸Ð´Ð°Ð¼Ð¸.\n- Ð’Ð¾Ð½Ð° ÑÑ‚Ð¾ÑÐ»Ð° Ð±Ñ–Ð»Ñ Ð²Ñ–ÐºÐ½Ð°, **ÑƒÑÐ¼Ñ–Ñ…Ð°ÑŽÑ‡Ð¸ÑÑŒ** Ñ‚ÐµÐ¿Ð»Ð¾Ð¼Ñƒ Ñ€Ð°Ð½ÐºÐ¾Ð²Ð¾Ð¼Ñƒ ÑÐ¾Ð½Ñ†ÑŽ.\n- **Ð“Ð¾Ñ‚ÑƒÑŽÑ‡Ð¸ÑÑŒ** Ð´Ð¾ Ð²Ð¸ÑÑ‚ÑƒÐ¿Ñƒ Ñƒ Ð›ÑŒÐ²Ñ–Ð²ÑÑŒÐºÑ–Ð¹ Ð¾Ð¿ÐµÑ€Ñ–, ÑÐ¿Ñ–Ð²Ð°Ñ‡ÐºÐ° Ð¿Ð¾Ð²Ñ‚Ð¾Ñ€ÑŽÐ²Ð°Ð»Ð° Ð°Ñ€Ñ–Ñ—.\n- Ð”Ñ–Ñ‚Ð¸ Ð±Ñ–Ð³Ð°Ð»Ð¸ Ð¿Ð¾ Ð´Ð²Ð¾Ñ€Ñƒ, **ÑÐ¼Ñ–ÑŽÑ‡Ð¸ÑÑŒ** Ñ– **Ñ€Ð°Ð´Ñ–ÑŽÑ‡Ð¸ÑÑŒ** Ñ‚ÐµÐ¿Ð»Ñ–Ð¹ Ð¿Ð¾Ð³Ð¾Ð´Ñ–.\n\n### Ð¤Ð¾Ð½ÐµÑ‚Ð¸Ñ‡Ð½Ñ– Ñ‡ÐµÑ€Ð³ÑƒÐ²Ð°Ð½Ð½Ñ Ñƒ Ð´Ñ–Ñ”Ð¿Ñ€Ð¸ÑÐ»Ñ–Ð²Ð½Ð¸ÐºÐ°Ñ…\n\nÐŸÑ€Ð¸ ÑƒÑ‚Ð²Ð¾Ñ€ÐµÐ½Ð½Ñ– Ð´Ñ–Ñ”Ð¿Ñ€Ð¸ÑÐ»Ñ–Ð²Ð½Ð¸ÐºÑ–Ð² Ñ‡Ð°ÑÑ‚Ð¾ Ð²Ñ–Ð´Ð±ÑƒÐ²Ð°ÑŽÑ‚ÑŒÑÑ Ð²Ð°Ð¶Ð»Ð¸Ð²Ñ– Ñ‡ÐµÑ€Ð³ÑƒÐ²Ð°Ð½Ð½Ñ Ð¿Ñ€Ð¸Ð³Ð¾Ð»Ð¾ÑÐ½Ð¸Ñ…, ÑÐºÑ– Ð¿Ð¾Ñ‚Ñ€Ñ–Ð±Ð½Ð¾ Ð·Ð°Ð¿Ð°Ð¼'ÑÑ‚Ð°Ñ‚Ð¸:\n\n| Ð†Ð½Ñ„Ñ–Ð½Ñ–Ñ‚Ð¸Ð² | Ð§ÐµÑ€Ð³ÑƒÐ²Ð°Ð½Ð½Ñ | Ð”Ñ–Ñ”Ð¿Ñ€Ð¸ÑÐ»Ñ–Ð²Ð½Ð¸Ðº |\n|-----------|------------|---------------|\n| Ð¿Ð¸ÑÐ°Ñ‚Ð¸ | Ñ â†’ Ñˆ | **Ð¿Ð¸ÑˆÑƒÑ‡Ð¸** |\n| ÐºÐ°Ð·Ð°Ñ‚Ð¸ | Ð· â†’ Ð¶ | **ÐºÐ°Ð¶ÑƒÑ‡Ð¸** |\n| Ñ—Ð·Ð´Ð¸Ñ‚Ð¸ | Ð·Ð´ â†’ Ð¶Ð´ | **Ñ—Ð·Ð´ÑÑ‡Ð¸** |\n| Ð¼Ñ–ÑÐ¸Ñ‚Ð¸ | Ñ â†’ Ñ (Ð±ÐµÐ· Ñ‡ÐµÑ€Ð³ÑƒÐ²Ð°Ð½Ð½Ñ) | **Ð¼Ñ–ÑÑÑ‡Ð¸** |\n| Ð¿Ñ€Ð¾ÑÐ¸Ñ‚Ð¸ | Ñ â†’ Ñˆ | **Ð¿Ñ€Ð¾ÑˆÐ°Ñ‡Ð¸** |\n\nÐ¦Ñ– Ñ‡ÐµÑ€Ð³ÑƒÐ²Ð°Ð½Ð½Ñ Ñ” Ð¿Ñ€Ð¸Ñ€Ð¾Ð´Ð½Ð¸Ð¼Ð¸ Ð´Ð»Ñ ÑƒÐºÑ€Ð°Ñ—Ð½ÑÑŒÐºÐ¾Ñ— Ñ„Ð¾Ð½ÐµÑ‚Ð¸ÐºÐ¸ Ñ– Ð²Ñ–Ð´Ð¾Ð±Ñ€Ð°Ð¶Ð°ÑŽÑ‚ÑŒ Ð´Ð°Ð²Ð½Ñ– Ð·Ð²ÑƒÐºÐ¾Ð²Ñ– Ð·Ð°ÐºÐ¾Ð½Ð¸. Ð‡Ñ… Ð·Ð½Ð°Ð½Ð½Ñ Ð´Ð¾Ð¿Ð¾Ð¼Ð°Ð³Ð°Ñ” Ð¿Ñ€Ð°Ð²Ð¸Ð»ÑŒÐ½Ð¾ ÑƒÑ‚Ð²Ð¾Ñ€ÑŽÐ²Ð°Ñ‚Ð¸ Ð½Ðµ Ñ‚Ñ–Ð»ÑŒÐºÐ¸ Ð´Ñ–Ñ”Ð¿Ñ€Ð¸ÑÐ»Ñ–Ð²Ð½Ð¸ÐºÐ¸, Ð°Ð»Ðµ Ð¹ Ñ–Ð½ÑˆÑ– Ð´Ñ–Ñ”ÑÐ»Ñ–Ð²Ð½Ñ– Ñ„Ð¾Ñ€Ð¼Ð¸.\n\n### Ð”Ñ–Ñ”Ð¿Ñ€Ð¸ÑÐ»Ñ–Ð²Ð½Ð¸ÐºÐ¸ Ñ‚Ð° Ñ‡Ð°Ñ\n\nÐ’Ð°Ð¶Ð»Ð¸Ð²Ð¾ Ñ€Ð¾Ð·ÑƒÐ¼Ñ–Ñ‚Ð¸, Ñ‰Ð¾ Ð´Ñ–Ñ”Ð¿Ñ€Ð¸ÑÐ»Ñ–Ð²Ð½Ð¸ÐºÐ¸ Ð½ÐµÐ´Ð¾ÐºÐ¾Ð½Ð°Ð½Ð¾Ð³Ð¾ Ð²Ð¸Ð´Ñƒ Ð½Ðµ Ð¼Ð°ÑŽÑ‚ÑŒ Ð³Ñ€Ð°Ð¼Ð°Ñ‚Ð¸Ñ‡Ð½Ð¾Ð³Ð¾ Ñ‡Ð°ÑÑƒ Ð² Ñ‚Ñ€Ð°Ð´Ð¸Ñ†Ñ–Ð¹Ð½Ð¾Ð¼Ñƒ Ñ€Ð¾Ð·ÑƒÐ¼Ñ–Ð½Ð½Ñ–. Ð§Ð°Ñ Ð´Ñ–Ñ”Ð¿Ñ€Ð¸ÑÐ»Ñ–Ð²Ð½Ð¸ÐºÐ¾Ð²Ð¾Ñ— ÐºÐ¾Ð½ÑÑ‚Ñ€ÑƒÐºÑ†Ñ–Ñ— Ð²Ð¸Ð·Ð½Ð°Ñ‡Ð°Ñ”Ñ‚ÑŒÑÑ Ñ‡Ð°ÑÐ¾Ð¼ Ð¾ÑÐ½Ð¾Ð²Ð½Ð¾Ð³Ð¾ Ð´Ñ–Ñ”ÑÐ»Ð¾Ð²Ð° Ð² Ñ€ÐµÑ‡ÐµÐ½Ð½Ñ–:\n\n- **ÐœÐ¸Ð½ÑƒÐ»Ð¸Ð¹ Ñ‡Ð°Ñ:** Ð§Ð¸Ñ‚Ð°ÑŽÑ‡Ð¸ ÐºÐ½Ð¸Ð³Ñƒ, Ð²Ñ–Ð½ **Ð´ÑƒÐ¼Ð°Ð²** Ð¿Ñ€Ð¾ Ð¼Ð°Ð¹Ð±ÑƒÑ‚Ð½Ñ”.\n- **Ð¢ÐµÐ¿ÐµÑ€Ñ–ÑˆÐ½Ñ–Ð¹ Ñ‡Ð°Ñ:** Ð§Ð¸Ñ‚Ð°ÑŽÑ‡Ð¸ ÐºÐ½Ð¸Ð³Ñƒ, Ð²Ñ–Ð½ **Ð´ÑƒÐ¼Ð°Ñ”** Ð¿Ñ€Ð¾ Ð¼Ð°Ð¹Ð±ÑƒÑ‚Ð½Ñ”.\n- **ÐœÐ°Ð¹Ð±ÑƒÑ‚Ð½Ñ–Ð¹ Ñ‡Ð°Ñ:** Ð§Ð¸Ñ‚Ð°ÑŽÑ‡Ð¸ ÐºÐ½Ð¸Ð³Ñƒ, Ð²Ñ–Ð½ **Ð´ÑƒÐ¼Ð°Ñ‚Ð¸Ð¼Ðµ** Ð¿Ñ€Ð¾ Ð¼Ð°Ð¹Ð±ÑƒÑ‚Ð½Ñ”.\n\nÐ£ Ð²ÑÑ–Ñ… Ñ‚Ñ€ÑŒÐ¾Ñ… Ñ€ÐµÑ‡ÐµÐ½Ð½ÑÑ… Ð´Ñ–Ñ”Ð¿Ñ€Ð¸ÑÐ»Ñ–Ð²Ð½Ð¸Ðº Â«Ñ‡Ð¸Ñ‚Ð°ÑŽÑ‡Ð¸Â» Ð·Ð°Ð»Ð¸ÑˆÐ°Ñ”Ñ‚ÑŒÑÑ Ð½ÐµÐ·Ð¼Ñ–Ð½Ð½Ð¸Ð¼, Ð°Ð»Ðµ Ñ‡Ð°Ñ ÑƒÑÑ–Ñ”Ñ— ÐºÐ¾Ð½ÑÑ‚Ñ€ÑƒÐºÑ†Ñ–Ñ— Ð·Ð¼Ñ–Ð½ÑŽÑ”Ñ‚ÑŒÑÑ Ð·Ð°Ð»ÐµÐ¶Ð½Ð¾ Ð²Ñ–Ð´ Ð¾ÑÐ½Ð¾Ð²Ð½Ð¾Ð³Ð¾ Ð´Ñ–Ñ”ÑÐ»Ð¾Ð²Ð°.\n\n> ðŸŒ **Ð£ Ñ€ÐµÐ°Ð»ÑŒÐ½Ð¾Ð¼Ñƒ Ð¶Ð¸Ñ‚Ñ‚Ñ–**\n>\n> Ð”Ñ–Ñ”Ð¿Ñ€Ð¸ÑÐ»Ñ–Ð²Ð½Ð¸ÐºÐ¸ Ð´ÑƒÐ¶Ðµ Ð¿Ð¾Ð¿ÑƒÐ»ÑÑ€Ð½Ñ– Ð² ÑƒÐºÑ€Ð°Ñ—Ð½ÑÑŒÐºÑ–Ð¹ Ð»Ñ–Ñ‚ÐµÑ€Ð°Ñ‚ÑƒÑ€Ñ– Ñ‚Ð° Ð¿ÑƒÐ±Ð»Ñ–Ñ†Ð¸ÑÑ‚Ð¸Ñ†Ñ–. Ð’Ð¾Ð½Ð¸ Ñ€Ð¾Ð±Ð»ÑÑ‚ÑŒ Ñ‚ÐµÐºÑÑ‚ Ð±Ñ–Ð»ÑŒÑˆ Ð´Ð¸Ð½Ð°Ð¼Ñ–Ñ‡Ð½Ð¸Ð¼ Ñ– Ð²Ð¸Ñ€Ð°Ð·Ð½Ð¸Ð¼. Ð’Ð¸ Ñ‡Ð°ÑÑ‚Ð¾ Ð¿Ð¾Ñ‡ÑƒÑ”Ñ‚Ðµ Ñ—Ñ… Ñƒ Ð½Ð¾Ð²Ð¸Ð½Ð°Ñ…: Â«Ð’Ð¸ÑÑ‚ÑƒÐ¿Ð°ÑŽÑ‡Ð¸ Ð½Ð° ÐºÐ¾Ð½Ñ„ÐµÑ€ÐµÐ½Ñ†Ñ–Ñ—, Ð¿Ñ€ÐµÐ·Ð¸Ð´ÐµÐ½Ñ‚ Ð·Ð°ÑÐ²Ð¸Ð²...Â», Â«ÐŸÐ¾Ð²ÐµÑ€Ñ‚Ð°ÑŽÑ‡Ð¸ÑÑŒ Ð´Ð¾Ð´Ð¾Ð¼Ñƒ, Ð²Ñ–Ð½ Ð·ÑƒÑÑ‚Ñ€Ñ–Ð² Ð´Ñ€ÑƒÐ³Ð°...Â» Ð¦Ñ ÐºÐ¾Ð½ÑÑ‚Ñ€ÑƒÐºÑ†Ñ–Ñ Ð´Ð¾Ð·Ð²Ð¾Ð»ÑÑ” Ð¿ÐµÑ€ÐµÐ´Ð°Ñ‚Ð¸ Ð´Ð²Ñ– Ð¿Ð°Ñ€Ð°Ð»ÐµÐ»ÑŒÐ½Ñ– Ð´Ñ–Ñ— Ð¾Ð´Ð½Ð¸Ð¼ ÐºÐ¾Ð¼Ð¿Ð°ÐºÑ‚Ð½Ð¸Ð¼ Ñ€ÐµÑ‡ÐµÐ½Ð½ÑÐ¼, Ñ‰Ð¾ Ð¾ÑÐ¾Ð±Ð»Ð¸Ð²Ð¾ Ñ†Ñ–Ð½ÑƒÑ”Ñ‚ÑŒÑÑ Ð² Ð¶ÑƒÑ€Ð½Ð°Ð»Ñ–ÑÑ‚Ð¸Ñ†Ñ–, Ð´Ðµ Ð²Ð°Ð¶Ð»Ð¸Ð²Ð° ÐµÐºÐ¾Ð½Ð¾Ð¼Ñ–Ñ ÑÐ»Ñ–Ð².\n\n### Ð¤ÑƒÐ½ÐºÑ†Ñ–Ñ: Ð¾Ð´Ð½Ð¾Ñ‡Ð°ÑÐ½Ñ–ÑÑ‚ÑŒ Ð´Ñ–Ð¹\n\nÐ”Ñ–Ñ”Ð¿Ñ€Ð¸ÑÐ»Ñ–Ð²Ð½Ð¸Ðº Ð½ÐµÐ´Ð¾ÐºÐ¾Ð½Ð°Ð½Ð¾Ð³Ð¾ Ð²Ð¸Ð´Ñƒ Ð¿Ð¾ÐºÐ°Ð·ÑƒÑ”, Ñ‰Ð¾ **Ð´Ð¾Ð´Ð°Ñ‚ÐºÐ¾Ð²Ð° Ð´Ñ–Ñ Ð²Ñ–Ð´Ð±ÑƒÐ²Ð°Ñ”Ñ‚ÑŒÑÑ Ð¾Ð´Ð½Ð¾Ñ‡Ð°ÑÐ½Ð¾ Ð· Ð¾ÑÐ½Ð¾Ð²Ð½Ð¾ÑŽ**:\n\n| Ð”Ñ–Ñ”Ð¿Ñ€Ð¸ÑÐ»Ñ–Ð²Ð½Ð¸ÐºÐ¾Ð²Ð° ÐºÐ¾Ð½ÑÑ‚Ñ€ÑƒÐºÑ†Ñ–Ñ | Ð—Ð½Ð°Ñ‡ÐµÐ½Ð½Ñ |\n|------------------------------|----------|\n| **Ð§Ð¸Ñ‚Ð°ÑŽÑ‡Ð¸** ÐºÐ½Ð¸Ð³Ñƒ, Ð²Ñ–Ð½ Ð¿Ð¸Ð² ÐºÐ°Ð²Ñƒ. | Ð§Ð¸Ñ‚Ð°Ð½Ð½Ñ Ñ– Ð¿Ð¸Ñ‚Ñ‚Ñ Ð²Ñ–Ð´Ð±ÑƒÐ²Ð°Ð»Ð¸ÑÑ Ð¾Ð´Ð½Ð¾Ñ‡Ð°ÑÐ½Ð¾. |\n| **Ð™Ð´ÑƒÑ‡Ð¸** Ð²ÑƒÐ»Ð¸Ñ†ÐµÑŽ, Ñ Ð·ÑƒÑÑ‚Ñ€Ñ–Ð² Ð´Ñ€ÑƒÐ³Ð°. | Ð—ÑƒÑÑ‚Ñ€Ñ–Ñ‡ ÑÑ‚Ð°Ð»Ð°ÑÑ Ð¿Ñ–Ð´ Ñ‡Ð°Ñ Ñ…Ð¾Ð´ÑŒÐ±Ð¸. |\n| **ÐŸÑ€Ð°Ñ†ÑŽÑŽÑ‡Ð¸** Ð²Ð´Ð¾Ð¼Ð°, Ð²Ð¾Ð½Ð° ÑÐ»ÑƒÑ…Ð°Ð»Ð° Ð¼ÑƒÐ·Ð¸ÐºÑƒ. | Ð Ð¾Ð±Ð¾Ñ‚Ð° Ñ– ÑÐ»ÑƒÑ…Ð°Ð½Ð½Ñ Ð¼ÑƒÐ·Ð¸ÐºÐ¸ â€” Ð¾Ð´Ð½Ð¾Ñ‡Ð°ÑÐ½Ñ–. |\n| **Ð”Ð¸Ð²Ð»ÑÑ‡Ð¸ÑÑŒ** Ñ„Ñ–Ð»ÑŒÐ¼, Ð´Ñ–Ñ‚Ð¸ Ñ—Ð»Ð¸ Ð¿Ð¾Ð¿ÐºÐ¾Ñ€Ð½. | Ð”Ð¸Ð²Ð¸Ñ‚Ð¸ÑÑ Ñ– Ñ—ÑÑ‚Ð¸ â€” Ð¾Ð´Ð½Ðµ Ñ– Ñ‚Ðµ Ð¶ ÑÐ°Ð¼Ðµ Ñ‡Ð°Ñ. |\n\n### ÐŸÐ¾Ð·Ð¸Ñ†Ñ–Ñ Ð´Ñ–Ñ”Ð¿Ñ€Ð¸ÑÐ»Ñ–Ð²Ð½Ð¸ÐºÐ° Ð² Ñ€ÐµÑ‡ÐµÐ½Ð½Ñ–\n\nÐ”Ñ–Ñ”Ð¿Ñ€Ð¸ÑÐ»Ñ–Ð²Ð½Ð¸ÐºÐ¾Ð²Ð° ÐºÐ¾Ð½ÑÑ‚Ñ€ÑƒÐºÑ†Ñ–Ñ Ð¼Ð¾Ð¶Ðµ ÑÑ‚Ð¾ÑÑ‚Ð¸ Ð½Ð° **Ð¿Ð¾Ñ‡Ð°Ñ‚ÐºÑƒ**, Ð² **ÑÐµÑ€ÐµÐ´Ð¸Ð½Ñ–** Ð°Ð±Ð¾ Ð² **ÐºÑ–Ð½Ñ†Ñ–** Ñ€ÐµÑ‡ÐµÐ½Ð½Ñ:\n\n1. **ÐÐ° Ð¿Ð¾Ñ‡Ð°Ñ‚ÐºÑƒ:** Ð§Ð¸Ñ‚Ð°ÑŽÑ‡Ð¸ ÐºÐ½Ð¸Ð³Ñƒ, Ð²Ñ–Ð½ Ð·Ð°ÑÐ¼ÑƒÑ‚Ð¸Ð²ÑÑ.\n2. **Ð’ ÑÐµÑ€ÐµÐ´Ð¸Ð½Ñ–:** Ð’Ñ–Ð½, Ñ‡Ð¸Ñ‚Ð°ÑŽÑ‡Ð¸ ÐºÐ½Ð¸Ð³Ñƒ, Ð·Ð°ÑÐ¼ÑƒÑ‚Ð¸Ð²ÑÑ.\n3. **Ð’ ÐºÑ–Ð½Ñ†Ñ–:** Ð’Ñ–Ð½ Ð·Ð°ÑÐ¼ÑƒÑ‚Ð¸Ð²ÑÑ, Ñ‡Ð¸Ñ‚Ð°ÑŽÑ‡Ð¸ ÐºÐ½Ð¸Ð³Ñƒ.\n\n> ðŸŽ¯ **Ð¦Ñ–ÐºÐ°Ð²Ð¸Ð¹ Ñ„Ð°ÐºÑ‚**\n>\n> Ð”Ñ–Ñ”Ð¿Ñ€Ð¸ÑÐ»Ñ–Ð²Ð½Ð¸ÐºÐ¸ Ð°ÐºÑ‚Ð¸Ð²Ð½Ð¾ Ð²Ð¸ÐºÐ¾Ñ€Ð¸ÑÑ‚Ð¾Ð²ÑƒÑŽÑ‚ÑŒÑÑ Ð² ÑƒÐºÑ€Ð°Ñ—Ð½ÑÑŒÐºÑ–Ð¹ Ð¿Ñ–ÑÐµÐ½Ð½Ñ–Ð¹ Ñ‚Ð²Ð¾Ñ€Ñ‡Ð¾ÑÑ‚Ñ–. Ð£ Ð·Ð½Ð°Ð¼ÐµÐ½Ð¸Ñ‚Ñ–Ð¹ Ð¿Ñ–ÑÐ½Ñ– Â«ÐžÐ¹, Ñƒ Ð»ÑƒÐ·Ñ– Ñ‡ÐµÑ€Ð²Ð¾Ð½Ð° ÐºÐ°Ð»Ð¸Ð½Ð°Â» Ð·Ð²ÑƒÑ‡Ð¸Ñ‚ÑŒ: Â«ÐœÐ°Ñ€ÑˆÐ¸Ñ€ÑƒÑŽÑ‚ÑŒ Ð½Ð°ÑˆÑ– Ð´Ð¾Ð±Ñ€Ð¾Ð²Ð¾Ð»ÑŒÑ†Ñ–, Ð²Ð¸Ð·Ð²Ð¾Ð»ÑÑŽÑ‡Ð¸ Ñ€Ñ–Ð´Ð½Ð¸Ð¹ ÐºÑ€Ð°Ð¹Â». Ð¢ÑƒÑ‚ Ð´Ñ–Ñ”Ð¿Ñ€Ð¸ÑÐ»Ñ–Ð²Ð½Ð¸Ðº Â«Ð²Ð¸Ð·Ð²Ð¾Ð»ÑÑŽÑ‡Ð¸Â» ÑÑ‚Ð²Ð¾Ñ€ÑŽÑ” Ð¾Ð±Ñ€Ð°Ð· Ð¿Ð¾ÑÑ‚Ñ–Ð¹Ð½Ð¾Ñ—, Ñ‚Ñ€Ð¸Ð²Ð°Ð»Ð¾Ñ— Ð´Ñ–Ñ— â€” Ð±Ð¾Ñ€Ñ†Ñ– Ð¿Ñ€Ð¾Ð´Ð¾Ð²Ð¶ÑƒÑŽÑ‚ÑŒ Ð²Ð¸Ð·Ð²Ð¾Ð»ÑÑ‚Ð¸ ÐºÑ€Ð°Ð¹, Ð¿Ð¾ÐºÐ¸ Ð¼Ð°Ñ€ÑˆÐ¸Ñ€ÑƒÑŽÑ‚ÑŒ.\n\n> ðŸŽ¬ **ÐšÑƒÐ»ÑŒÑ‚ÑƒÑ€Ð½Ð¸Ð¹ Ð¼Ð¾Ð¼ÐµÐ½Ñ‚**\n>\n> Ð£ ÐºÐ»Ð°ÑÐ¸Ñ‡Ð½Ñ–Ð¹ ÑƒÐºÑ€Ð°Ñ—Ð½ÑÑŒÐºÑ–Ð¹ Ð¿Ð¾ÐµÐ·Ñ–Ñ— Ð´Ñ–Ñ”Ð¿Ñ€Ð¸ÑÐ»Ñ–Ð²Ð½Ð¸ÐºÐ¸ ÑÑ‚Ð²Ð¾Ñ€ÑŽÑŽÑ‚ÑŒ Ð¾ÑÐ¾Ð±Ð»Ð¸Ð²Ð¸Ð¹ Ñ€Ð¸Ñ‚Ð¼ Ñ– Ð¿Ð»Ð°Ð²Ð½Ñ–ÑÑ‚ÑŒ. Ð¢Ð°Ñ€Ð°Ñ Ð¨ÐµÐ²Ñ‡ÐµÐ½ÐºÐ¾ Ñ‡Ð°ÑÑ‚Ð¾ Ð²Ð¸ÐºÐ¾Ñ€Ð¸ÑÑ‚Ð¾Ð²ÑƒÐ²Ð°Ð² Ñ—Ñ…: Â«Ð† Ð´ÑƒÐ¼Ð°ÑŽÑ‡Ð¸, ÑÑƒÐ¼ÑƒÑŽÑ‡Ð¸, / Ð”Ð¸Ð²Ð»ÑŽÑÑŒ Ð½Ð° Ñ‚ÐµÐ¼Ð½Ð¸Ð¹ Ð»Ñ–Ñ...Â» Ð¦Ñ Ñ„Ð¾Ñ€Ð¼Ð° Ð½Ð°Ð´Ð°Ñ” Ñ‚ÐµÐºÑÑ‚Ñƒ Ð¿Ð¾ÐµÑ‚Ð¸Ñ‡Ð½Ð¾Ñ— Ð¼ÐµÐ»Ð¾Ð´Ñ–Ð¹Ð½Ð¾ÑÑ‚Ñ–.\n\n### Ð¡ÑƒÐ±'Ñ”ÐºÑ‚ Ð´Ñ–Ñ”Ð¿Ñ€Ð¸ÑÐ»Ñ–Ð²Ð½Ð¸ÐºÐ°\n\n**Ð’Ð°Ð¶Ð»Ð¸Ð²Ðµ Ð¿Ñ€Ð°Ð²Ð¸Ð»Ð¾:** ÑÑƒÐ±'Ñ”ÐºÑ‚ Ð´Ñ–Ñ”Ð¿Ñ€Ð¸ÑÐ»Ñ–Ð²Ð½Ð¸ÐºÐ° Ñ– ÑÑƒÐ±'Ñ”ÐºÑ‚ Ð¾ÑÐ½Ð¾Ð²Ð½Ð¾Ð³Ð¾ Ð´Ñ–Ñ”ÑÐ»Ð¾Ð²Ð° Ð¼Ð°ÑŽÑ‚ÑŒ Ð±ÑƒÑ‚Ð¸ **Ð¾Ð´Ð½Ð°ÐºÐ¾Ð²Ð¸Ð¼Ð¸**!\n\nâœ… **ÐŸÑ€Ð°Ð²Ð¸Ð»ÑŒÐ½Ð¾:** Ð§Ð¸Ñ‚Ð°ÑŽÑ‡Ð¸ ÐºÐ½Ð¸Ð³Ñƒ, **Ð²Ñ–Ð½** Ð·Ð°ÑÐ½ÑƒÐ². (Ð’Ñ–Ð½ Ñ‡Ð¸Ñ‚Ð°Ð². Ð’Ñ–Ð½ Ð·Ð°ÑÐ½ÑƒÐ².)\nâŒ **ÐÐµÐ¿Ñ€Ð°Ð²Ð¸Ð»ÑŒÐ½Ð¾:** Ð§Ð¸Ñ‚Ð°ÑŽÑ‡Ð¸ ÐºÐ½Ð¸Ð³Ñƒ, **Ð¼ÐµÐ½Ñ–** ÑÑ‚Ð°Ð»Ð¾ Ð½ÑƒÐ´Ð½Ð¾. (Ð¥Ñ‚Ð¾ Ñ‡Ð¸Ñ‚Ð°Ð²? ÐœÐµÐ½Ñ– Ð½Ðµ Ð¼Ð¾Ð¶Ð½Ð° Ñ‡Ð¸Ñ‚Ð°Ñ‚Ð¸.)\n\nâœ… **ÐŸÑ€Ð°Ð²Ð¸Ð»ÑŒÐ½Ð¾:** Ð™Ð´ÑƒÑ‡Ð¸ Ð´Ð¾Ð´Ð¾Ð¼Ñƒ, **Ñ** ÐºÑƒÐ¿Ð¸Ð² Ñ…Ð»Ñ–Ð±Ð°. (Ð¯ Ð¹ÑˆÐ¾Ð². Ð¯ ÐºÑƒÐ¿Ð¸Ð².)\nâŒ **ÐÐµÐ¿Ñ€Ð°Ð²Ð¸Ð»ÑŒÐ½Ð¾:** Ð™Ð´ÑƒÑ‡Ð¸ Ð´Ð¾Ð´Ð¾Ð¼Ñƒ, **Ð¿Ð¾Ñ‡Ð°Ð²ÑÑ Ð´Ð¾Ñ‰**. (Ð¥Ñ‚Ð¾ Ð¹ÑˆÐ¾Ð²? Ð”Ð¾Ñ‰ Ð½Ðµ Ñ…Ð¾Ð´Ð¸Ñ‚ÑŒ!)\n\n> âš ï¸ **Ð¢Ð¸Ð¿Ð¾Ð²Ð° Ð¿Ð¾Ð¼Ð¸Ð»ÐºÐ°!**\n>\n> Ð‘Ð°Ð³Ð°Ñ‚Ð¾ ÑÑ‚ÑƒÐ´ÐµÐ½Ñ‚Ñ–Ð² Ñ€Ð¾Ð±Ð»ÑÑ‚ÑŒ Ð¿Ð¾Ð¼Ð¸Ð»ÐºÑƒ Ð² ÑƒÐ·Ð³Ð¾Ð´Ð¶ÐµÐ½Ð½Ñ– ÑÑƒÐ±'Ñ”ÐºÑ‚Ñ–Ð². Ð—Ð°Ð¿Ð°Ð¼'ÑÑ‚Ð°Ð¹Ñ‚Ðµ: Ñ‚Ð¾Ð¹, Ñ…Ñ‚Ð¾ Ð²Ð¸ÐºÐ¾Ð½ÑƒÑ” Ð´Ð¾Ð´Ð°Ñ‚ÐºÐ¾Ð²Ñƒ Ð´Ñ–ÑŽ (Ð´Ñ–Ñ”Ð¿Ñ€Ð¸ÑÐ»Ñ–Ð²Ð½Ð¸Ðº), Ð¼Ð°Ñ” Ð±ÑƒÑ‚Ð¸ Ñ‚Ð¸Ð¼ ÑÐ°Ð¼Ð¸Ð¼, Ñ…Ñ‚Ð¾ Ð²Ð¸ÐºÐ¾Ð½ÑƒÑ” Ð¾ÑÐ½Ð¾Ð²Ð½Ñƒ Ð´Ñ–ÑŽ.\n\n---\n\n## ÐŸÑ€Ð°ÐºÑ‚Ð¸ÐºÐ°\n\n### Ð¯Ðº Ð²Ð¸Ð±Ñ€Ð°Ñ‚Ð¸ Ð¿Ñ€Ð°Ð²Ð¸Ð»ÑŒÐ½Ñƒ Ñ„Ð¾Ñ€Ð¼Ñƒ?\n\n**ÐšÑ€Ð¾Ðº 1:** Ð’Ð¸Ð·Ð½Ð°Ñ‡Ñ‚Ðµ Ð¾ÑÐ½Ð¾Ð²Ñƒ Ñ‚ÐµÐ¿ÐµÑ€Ñ–ÑˆÐ½ÑŒÐ¾Ð³Ð¾ Ñ‡Ð°ÑÑƒ Ð´Ñ–Ñ”ÑÐ»Ð¾Ð²Ð°.\n- Ñ‡Ð¸Ñ‚Ð°Ñ‚Ð¸ â†’ Ñ Ñ‡Ð¸Ñ‚Ð°ÑŽ â†’ Ñ‡Ð¸Ñ‚Ð°-\n- Ð¿Ð¸ÑÐ°Ñ‚Ð¸ â†’ Ñ Ð¿Ð¸ÑˆÑƒ â†’ Ð¿Ð¸Ñˆ-\n- Ð±Ñ–Ð³Ñ‚Ð¸ â†’ Ñ Ð±Ñ–Ð¶Ñƒ â†’ Ð±Ñ–Ð¶-\n\nÐ¦Ðµ Ð½Ð°Ð¹Ð²Ð°Ð¶Ð»Ð¸Ð²Ñ–ÑˆÐ¸Ð¹ ÐºÑ€Ð¾Ðº, Ñ‚Ð¾Ð¼Ñƒ Ñ‰Ð¾ Ð±Ð°Ð³Ð°Ñ‚Ð¾ Ð¿Ð¾Ð¼Ð¸Ð»Ð¾Ðº Ð²Ð¸Ð½Ð¸ÐºÐ°ÑŽÑ‚ÑŒ ÑÐ°Ð¼Ðµ Ñ‡ÐµÑ€ÐµÐ· Ð½ÐµÐ¿Ñ€Ð°Ð²Ð¸Ð»ÑŒÐ½Ðµ Ð²Ð¸Ð·Ð½Ð°Ñ‡ÐµÐ½Ð½Ñ Ð¾ÑÐ½Ð¾Ð²Ð¸. ÐŸÐ°Ð¼'ÑÑ‚Ð°Ð¹Ñ‚Ðµ: Ð¼Ð¸ Ð±ÐµÑ€ÐµÐ¼Ð¾ Ñ„Ð¾Ñ€Ð¼Ñƒ Ñ‚ÐµÐ¿ÐµÑ€Ñ–ÑˆÐ½ÑŒÐ¾Ð³Ð¾ Ñ‡Ð°ÑÑƒ Ð²Ñ–Ð´ Ð¿ÐµÑ€ÑˆÐ¾Ñ— Ð¾ÑÐ¾Ð±Ð¸ Ð¾Ð´Ð½Ð¸Ð½Ð¸, Ð¿Ñ€Ð¸Ð±Ð¸Ñ€Ð°Ñ”Ð¼Ð¾ Ð¾ÑÐ¾Ð±Ð¾Ð²Ðµ Ð·Ð°ÐºÑ–Ð½Ñ‡ÐµÐ½Ð½Ñ, Ñ– Ð¾Ñ‚Ñ€Ð¸Ð¼ÑƒÑ”Ð¼Ð¾ Ð¾ÑÐ½Ð¾Ð²Ñƒ.\n\n**ÐšÑ€Ð¾Ðº 2:** Ð”Ð¾Ð´Ð°Ð¹Ñ‚Ðµ ÑÑƒÑ„Ñ–ÐºÑ -ÑŽÑ‡Ð¸/-ÑƒÑ‡Ð¸/-Ð°Ñ‡Ð¸/-ÑÑ‡Ð¸.\n- Ñ‡Ð¸Ñ‚Ð°- + -ÑŽÑ‡Ð¸ â†’ Ñ‡Ð¸Ñ‚Ð°ÑŽÑ‡Ð¸\n- Ð¿Ð¸Ñˆ- + -ÑƒÑ‡Ð¸ â†’ Ð¿Ð¸ÑˆÑƒÑ‡Ð¸\n- Ð±Ñ–Ð¶- + -Ð°Ñ‡Ð¸ â†’ Ð±Ñ–Ð¶Ð°Ñ‡Ð¸\n\nÐ’Ð¸Ð±Ñ–Ñ€ Ð¼Ñ–Ð¶ Ð²Ð°Ñ€Ñ–Ð°Ð½Ñ‚Ð°Ð¼Ð¸ ÑÑƒÑ„Ñ–ÐºÑÐ° Ð·Ð°Ð»ÐµÐ¶Ð¸Ñ‚ÑŒ Ð²Ñ–Ð´ ÐºÑ–Ð½Ñ†ÐµÐ²Ð¾Ð³Ð¾ Ð·Ð²ÑƒÐºÑƒ Ð¾ÑÐ½Ð¾Ð²Ð¸ Ñ‚Ð° Ð²Ñ–Ð´ ÐºÐ¾Ð½ÐºÑ€ÐµÑ‚Ð½Ð¾Ð³Ð¾ Ð´Ñ–Ñ”ÑÐ»Ð¾Ð²Ð°. Ð—Ð°Ð³Ð°Ð»ÑŒÐ½Ðµ Ð¿Ñ€Ð°Ð²Ð¸Ð»Ð¾: Ð¿Ñ–ÑÐ»Ñ Ð³Ð¾Ð»Ð¾ÑÐ½Ð¾Ñ— Ñ‡Ð°ÑÑ‚Ñ–ÑˆÐµ -ÑŽÑ‡Ð¸, Ð¿Ñ–ÑÐ»Ñ Ð¿Ñ€Ð¸Ð³Ð¾Ð»Ð¾ÑÐ½Ð¾Ñ— â€” Ð·Ð°Ð»ÐµÐ¶Ð¸Ñ‚ÑŒ Ð²Ñ–Ð´ Ð´Ñ–Ñ”ÑÐ»Ð¾Ð²Ð°.\n\n**ÐšÑ€Ð¾Ðº 3:** Ð”Ð»Ñ Ð·Ð²Ð¾Ñ€Ð¾Ñ‚Ð½Ð¸Ñ… Ð´Ñ–Ñ”ÑÐ»Ñ–Ð² Ð´Ð¾Ð´Ð°Ð¹Ñ‚Ðµ -ÑÑŒ.\n- Ð¾Ð´ÑÐ³Ð°Ñ‚Ð¸ÑÑ â†’ Ð¾Ð´ÑÐ³Ð°ÑŽÑ‡Ð¸ÑÑŒ\n- Ð²Ð¼Ð¸Ð²Ð°Ñ‚Ð¸ÑÑ â†’ Ð²Ð¼Ð¸Ð²Ð°ÑŽÑ‡Ð¸ÑÑŒ\n\nÐŸÐ°Ð¼'ÑÑ‚Ð°Ð¹Ñ‚Ðµ: Ñ‡Ð°ÑÑ‚ÐºÐ° -ÑÑŒ Ñ” ÑÐºÐ¾Ñ€Ð¾Ñ‡ÐµÐ½Ð¾ÑŽ Ñ„Ð¾Ñ€Ð¼Ð¾ÑŽ -ÑÑ Ñ– Ð²Ð¸ÐºÐ¾Ñ€Ð¸ÑÑ‚Ð¾Ð²ÑƒÑ”Ñ‚ÑŒÑÑ ÑÐ°Ð¼Ðµ Ð² Ð´Ñ–Ñ”Ð¿Ñ€Ð¸ÑÐ»Ñ–Ð²Ð½Ð¸ÐºÐ°Ñ…. ÐÑ–ÐºÐ¾Ð»Ð¸ Ð½Ðµ Ð²Ð¸ÐºÐ¾Ñ€Ð¸ÑÑ‚Ð¾Ð²ÑƒÐ¹Ñ‚Ðµ Ñ„Ð¾Ñ€Ð¼Ñƒ -ÑÑ Ð² Ð´Ñ–Ñ”Ð¿Ñ€Ð¸ÑÐ»Ñ–Ð²Ð½Ð¸ÐºÐ°Ñ… â€” Ñ†Ðµ Ð³Ñ€Ð°Ð¼Ð°Ñ‚Ð¸Ñ‡Ð½Ð° Ð¿Ð¾Ð¼Ð¸Ð»ÐºÐ°.\n\n### Ð’Ð¸ÐºÐ¾Ñ€Ð¸ÑÑ‚Ð°Ð½Ð½Ñ Ð´Ñ–Ñ”Ð¿Ñ€Ð¸ÑÐ»Ñ–Ð²Ð½Ð¸ÐºÑ–Ð² Ñƒ Ñ€Ñ–Ð·Ð½Ð¸Ñ… ÑÑ‚Ð¸Ð»ÑÑ…\n\nÐ”Ñ–Ñ”Ð¿Ñ€Ð¸ÑÐ»Ñ–Ð²Ð½Ð¸ÐºÐ¸ Ð°ÐºÑ‚Ð¸Ð²Ð½Ð¾ Ð²Ð¸ÐºÐ¾Ñ€Ð¸ÑÑ‚Ð¾Ð²ÑƒÑŽÑ‚ÑŒÑÑ Ð² Ñ€Ñ–Ð·Ð½Ð¸Ñ… Ñ„ÑƒÐ½ÐºÑ†Ñ–Ð¾Ð½Ð°Ð»ÑŒÐ½Ð¸Ñ… ÑÑ‚Ð¸Ð»ÑÑ… ÑƒÐºÑ€Ð°Ñ—Ð½ÑÑŒÐºÐ¾Ñ— Ð¼Ð¾Ð²Ð¸:\n\n**Ð¥ÑƒÐ´Ð¾Ð¶Ð½Ñ–Ð¹ ÑÑ‚Ð¸Ð»ÑŒ:** Ð”Ñ–Ñ”Ð¿Ñ€Ð¸ÑÐ»Ñ–Ð²Ð½Ð¸ÐºÐ¸ Ð½Ð°Ð´Ð°ÑŽÑ‚ÑŒ Ñ‚ÐµÐºÑÑ‚Ñƒ Ð¿Ð»Ð°Ð²Ð½Ð¾ÑÑ‚Ñ– Ñ‚Ð° Ð¿Ð¾ÐµÑ‚Ð¸Ñ‡Ð½Ð¾ÑÑ‚Ñ–. ÐŸÐ¸ÑÑŒÐ¼ÐµÐ½Ð½Ð¸ÐºÐ¸ Ð²Ð¸ÐºÐ¾Ñ€Ð¸ÑÑ‚Ð¾Ð²ÑƒÑŽÑ‚ÑŒ Ñ—Ñ… Ð´Ð»Ñ ÑÑ‚Ð²Ð¾Ñ€ÐµÐ½Ð½Ñ ÑÐºÐ»Ð°Ð´Ð½Ð¸Ñ…, Ð±Ð°Ð³Ð°Ñ‚Ð¾ÑˆÐ°Ñ€Ð¾Ð²Ð¸Ñ… Ð¾Ð±Ñ€Ð°Ð·Ñ–Ð².\n\n**ÐÐ°ÑƒÐºÐ¾Ð²Ð¸Ð¹ ÑÑ‚Ð¸Ð»ÑŒ:** Ð£ Ð½Ð°ÑƒÐºÐ¾Ð²Ð¸Ñ… Ñ‚ÐµÐºÑÑ‚Ð°Ñ… Ð´Ñ–Ñ”Ð¿Ñ€Ð¸ÑÐ»Ñ–Ð²Ð½Ð¸ÐºÐ¸ Ð´Ð¾Ð¿Ð¾Ð¼Ð°Ð³Ð°ÑŽÑ‚ÑŒ ÑÑ‚Ð¸ÑÐ»Ð¾ Ð¿ÐµÑ€ÐµÐ´Ð°Ð²Ð°Ñ‚Ð¸ Ð¿Ð°Ñ€Ð°Ð»ÐµÐ»ÑŒÐ½Ñ– Ð¿Ñ€Ð¾Ñ†ÐµÑÐ¸ Ñ‚Ð° ÑƒÐ¼Ð¾Ð²Ð¸.\n\n**ÐŸÑƒÐ±Ð»Ñ–Ñ†Ð¸ÑÑ‚Ð¸Ñ‡Ð½Ð¸Ð¹ ÑÑ‚Ð¸Ð»ÑŒ:** Ð–ÑƒÑ€Ð½Ð°Ð»Ñ–ÑÑ‚Ð¸ Ñ†Ñ–Ð½ÑƒÑŽÑ‚ÑŒ Ð´Ñ–Ñ”Ð¿Ñ€Ð¸ÑÐ»Ñ–Ð²Ð½Ð¸ÐºÐ¸ Ð·Ð° Ñ—Ñ…Ð½ÑŽ Ð·Ð´Ð°Ñ‚Ð½Ñ–ÑÑ‚ÑŒ ÐµÐºÐ¾Ð½Ð¾Ð¼Ð¸Ñ‚Ð¸ Ð¼Ñ–ÑÑ†Ðµ, Ð·Ð±ÐµÑ€Ñ–Ð³Ð°ÑŽÑ‡Ð¸ Ñ–Ð½Ñ„Ð¾Ñ€Ð¼Ð°Ñ‚Ð¸Ð²Ð½Ñ–ÑÑ‚ÑŒ.\n\n**ÐžÑ„Ñ–Ñ†Ñ–Ð¹Ð½Ð¾-Ð´Ñ–Ð»Ð¾Ð²Ð¸Ð¹ ÑÑ‚Ð¸Ð»ÑŒ:** Ð£ Ð´Ð¾ÐºÑƒÐ¼ÐµÐ½Ñ‚Ð°Ñ… Ð´Ñ–Ñ”Ð¿Ñ€Ð¸ÑÐ»Ñ–Ð²Ð½Ð¸ÐºÐ¸ Ð²Ð¸ÐºÐ¾Ñ€Ð¸ÑÑ‚Ð¾Ð²ÑƒÑŽÑ‚ÑŒÑÑ Ð´Ð»Ñ Ñ‚Ð¾Ñ‡Ð½Ð¾Ð³Ð¾ Ð¾Ð¿Ð¸ÑÑƒ Ð¿Ð¾ÑÐ»Ñ–Ð´Ð¾Ð²Ð½Ð¾ÑÑ‚Ñ– Ð´Ñ–Ð¹.\n\n### Ð¢Ð¸Ð¿Ð¾Ð²Ñ– Ð¿Ð¾Ð¼Ð¸Ð»ÐºÐ¸ Ñ‚Ð° ÑÐº Ñ—Ñ… ÑƒÐ½Ð¸ÐºÐ½ÑƒÑ‚Ð¸\n\n**ÐŸÐ¾Ð¼Ð¸Ð»ÐºÐ° 1: ÐÐµÐ¿Ñ€Ð°Ð²Ð¸Ð»ÑŒÐ½Ð° Ð¾ÑÐ½Ð¾Ð²Ð°**\n\nâŒ ÐÐµÐ¿Ñ€Ð°Ð²Ð¸Ð»ÑŒÐ½Ð¾: Ð¿Ð¸ÑÐ°ÑŽÑ‡Ð¸ (Ð²Ñ–Ð´ Ð¿Ð¸ÑÐ°-)\nâœ… ÐŸÑ€Ð°Ð²Ð¸Ð»ÑŒÐ½Ð¾: Ð¿Ð¸ÑˆÑƒÑ‡Ð¸ (Ð²Ñ–Ð´ Ð¿Ð¸Ñˆ-)\n\n**Ð§Ð¾Ð¼Ñƒ?** ÐžÑÐ½Ð¾Ð²Ð° Ð±ÐµÑ€ÐµÑ‚ÑŒÑÑ Ð· Ñ‚ÐµÐ¿ÐµÑ€Ñ–ÑˆÐ½ÑŒÐ¾Ð³Ð¾ Ñ‡Ð°ÑÑƒ (Ñ Ð¿Ð¸ÑˆÑƒ), Ð° Ð½Ðµ Ð· Ñ–Ð½Ñ„Ñ–Ð½Ñ–Ñ‚Ð¸Ð²Ð°. Ð¦Ðµ Ð¾Ð´Ð½Ð° Ð· Ð½Ð°Ð¹Ð¿Ð¾ÑˆÐ¸Ñ€ÐµÐ½Ñ–ÑˆÐ¸Ñ… Ð¿Ð¾Ð¼Ð¸Ð»Ð¾Ðº ÑÐµÑ€ÐµÐ´ ÑÑ‚ÑƒÐ´ÐµÐ½Ñ‚Ñ–Ð², ÑÐºÑ– Ð½Ð°Ð²Ñ‡Ð°ÑŽÑ‚ÑŒÑÑ ÑƒÐºÑ€Ð°Ñ—Ð½ÑÑŒÐºÐ¾Ñ— Ð¼Ð¾Ð²Ð¸.\n\n**ÐŸÐ¾Ð¼Ð¸Ð»ÐºÐ° 2: Ð Ñ–Ð·Ð½Ñ– ÑÑƒÐ±'Ñ”ÐºÑ‚Ð¸**\n\nâŒ ÐÐµÐ¿Ñ€Ð°Ð²Ð¸Ð»ÑŒÐ½Ð¾: Ð§Ð¸Ñ‚Ð°ÑŽÑ‡Ð¸ ÑÑ‚Ð°Ñ‚Ñ‚ÑŽ, Ð¼ÐµÐ½Ñ– ÑÑ‚Ð°Ð»Ð¾ Ñ†Ñ–ÐºÐ°Ð²Ð¾.\nâœ… ÐŸÑ€Ð°Ð²Ð¸Ð»ÑŒÐ½Ð¾: Ð§Ð¸Ñ‚Ð°ÑŽÑ‡Ð¸ ÑÑ‚Ð°Ñ‚Ñ‚ÑŽ, Ñ Ð·Ð°Ñ†Ñ–ÐºÐ°Ð²Ð¸Ð²ÑÑ.\n\n**Ð§Ð¾Ð¼Ñƒ?** Ð¡ÑƒÐ±'Ñ”ÐºÑ‚ Ð´Ñ–Ñ”Ð¿Ñ€Ð¸ÑÐ»Ñ–Ð²Ð½Ð¸ÐºÐ° (Ñ…Ñ‚Ð¾ Ñ‡Ð¸Ñ‚Ð°Ð²?) Ð¼Ð°Ñ” Ð·Ð±Ñ–Ð³Ð°Ñ‚Ð¸ÑÑ Ð· ÑÑƒÐ±'Ñ”ÐºÑ‚Ð¾Ð¼ Ð¾ÑÐ½Ð¾Ð²Ð½Ð¾Ð³Ð¾ Ð´Ñ–Ñ”ÑÐ»Ð¾Ð²Ð° (Ñ…Ñ‚Ð¾ Ð·Ð°Ñ†Ñ–ÐºÐ°Ð²Ð¸Ð²ÑÑ?). Ð¦Ñ Ð¿Ð¾Ð¼Ð¸Ð»ÐºÐ° Ñ” ÐºÐ°Ð»ÑŒÐºÐ¾ÑŽ Ð· Ñ€Ð¾ÑÑ–Ð¹ÑÑŒÐºÐ¾Ñ— Ð¼Ð¾Ð²Ð¸, Ð´Ðµ Ð¿Ð¾Ð´Ñ–Ð±Ð½Ñ– ÐºÐ¾Ð½ÑÑ‚Ñ€ÑƒÐºÑ†Ñ–Ñ— Ñ–Ð½Ð¾Ð´Ñ– Ð´Ð¾Ð¿ÑƒÑÐºÐ°ÑŽÑ‚ÑŒÑÑ Ð² Ñ€Ð¾Ð·Ð¼Ð¾Ð²Ð½Ð¾Ð¼Ñƒ Ð¼Ð¾Ð²Ð»ÐµÐ½Ð½Ñ–.\n\n**ÐŸÐ¾Ð¼Ð¸Ð»ÐºÐ° 3: ÐŸÐ»ÑƒÑ‚Ð°Ð½Ð½Ñ Ð· Ð¿Ñ€Ð¸ÐºÐ¼ÐµÑ‚Ð½Ð¸ÐºÐ°Ð¼Ð¸**\n\nâŒ ÐÐµÐ¿Ñ€Ð°Ð²Ð¸Ð»ÑŒÐ½Ð¾: ÑÐ¿Ð»ÑÑ‡Ð¸Ð¹ Ñ‡Ð¾Ð»Ð¾Ð²Ñ–Ðº (Ñ†Ðµ Ð´Ñ–Ñ”Ð¿Ñ€Ð¸ÐºÐ¼ÐµÑ‚Ð½Ð¸Ðº!)\nâœ… ÐŸÑ€Ð°Ð²Ð¸Ð»ÑŒÐ½Ð¾: ÑÐ¿Ð°Ñ‡Ð¸ (Ð½ÐµÐ¼Ð°Ñ” Ñ‚Ð°ÐºÐ¾Ñ— Ñ„Ð¾Ñ€Ð¼Ð¸!) â†’ ÐŸÐ¾ÐºÐ¸ Ð²Ñ–Ð½ ÑÐ¿Ð°Ð²...\n\n**Ð§Ð¾Ð¼Ñƒ?** ÐÐµ Ð²ÑÑ– Ð´Ñ–Ñ”ÑÐ»Ð¾Ð²Ð° Ð¼Ð°ÑŽÑ‚ÑŒ Ð´Ñ–Ñ”Ð¿Ñ€Ð¸ÑÐ»Ñ–Ð²Ð½Ð¸ÐºÐ¾Ð²Ñ– Ñ„Ð¾Ñ€Ð¼Ð¸. Ð’Ñ–Ð´ Ð´Ñ–Ñ”ÑÐ»Ð¾Ð²Ð° Â«ÑÐ¿Ð°Ñ‚Ð¸Â» Ð´Ñ–Ñ”Ð¿Ñ€Ð¸ÑÐ»Ñ–Ð²Ð½Ð¸Ðº Ð½Ðµ ÑƒÑ‚Ð²Ð¾Ñ€ÑŽÑ”Ñ‚ÑŒÑÑ Ð¿Ñ€Ð¸Ñ€Ð¾Ð´Ð½Ð¾. Ð£ Ñ‚Ð°ÐºÐ¸Ñ… Ð²Ð¸Ð¿Ð°Ð´ÐºÐ°Ñ… ÐºÑ€Ð°Ñ‰Ðµ Ð²Ð¸ÐºÐ¾Ñ€Ð¸ÑÑ‚Ð¾Ð²ÑƒÐ²Ð°Ñ‚Ð¸ Ð¿Ñ–Ð´Ñ€ÑÐ´Ð½Ðµ Ñ€ÐµÑ‡ÐµÐ½Ð½Ñ.\n\n> ðŸ’¡ **ÐŸÑ€Ð°ÐºÑ‚Ð¸Ñ‡Ð½Ð° Ð¿Ð¾Ñ€Ð°Ð´Ð°**\n>\n> ÐÐµ Ð²ÑÑ– Ð´Ñ–Ñ”ÑÐ»Ð¾Ð²Ð° Ð»ÐµÐ³ÐºÐ¾ ÑƒÑ‚Ð²Ð¾Ñ€ÑŽÑŽÑ‚ÑŒ Ð´Ñ–Ñ”Ð¿Ñ€Ð¸ÑÐ»Ñ–Ð²Ð½Ð¸ÐºÐ¸. Ð¯ÐºÑ‰Ð¾ Ñ„Ð¾Ñ€Ð¼Ð° Ð·Ð²ÑƒÑ‡Ð¸Ñ‚ÑŒ Ð½ÐµÐ·Ð²Ð¸Ñ‡Ð½Ð¾, ÐºÑ€Ð°Ñ‰Ðµ Ð²Ð¸ÐºÐ¾Ñ€Ð¸ÑÑ‚Ð¾Ð²ÑƒÐ¹Ñ‚Ðµ Ð¿Ñ–Ð´Ñ€ÑÐ´Ð½Ðµ Ñ€ÐµÑ‡ÐµÐ½Ð½Ñ Ð· Â«ÐºÐ¾Ð»Ð¸Â» Ð°Ð±Ð¾ Â«Ð¿Ð¾ÐºÐ¸Â». ÐÐ°Ð¿Ñ€Ð¸ÐºÐ»Ð°Ð´, Ð·Ð°Ð¼Ñ–ÑÑ‚ÑŒ Ð´Ð¸Ð²Ð½Ð¾Ñ— Ñ„Ð¾Ñ€Ð¼Ð¸ Â«ÑÐ¿Ð°Ñ‡Ð¸Â» Ð²Ð¸ÐºÐ¾Ñ€Ð¸ÑÑ‚Ð¾Ð²ÑƒÐ¹Ñ‚Ðµ Â«Ð¿Ð¾ÐºÐ¸ Ð²Ñ–Ð½ ÑÐ¿Ð°Ð²Â» Ð°Ð±Ð¾ Â«ÐºÐ¾Ð»Ð¸ Ð²Ñ–Ð½ ÑÐ¿Ð°Ð²Â».\n\n---\n\n## Ð”Ñ–Ð°Ð»Ð¾Ð³Ð¸\n\n### Ð”Ñ–Ð°Ð»Ð¾Ð³ 1: ÐÐ° Ñ€Ð¾Ð±Ð¾Ñ‚Ñ–\n\n**ÐœÐ°Ñ€Ñ–Ñ:** Ð©Ð¾ Ñ‚Ð¸ Ñ€Ð¾Ð±Ð¸Ñˆ?\n\n**ÐÐ½Ð´Ñ€Ñ–Ð¹:** ÐŸÑ€Ð°Ñ†ÑŽÑŽ, ÑÐ»ÑƒÑ…Ð°ÑŽÑ‡Ð¸ Ð¿Ð¾Ð´ÐºÐ°ÑÑ‚. Ð¢Ð°Ðº Ð»ÐµÐ³ÑˆÐµ ÐºÐ¾Ð½Ñ†ÐµÐ½Ñ‚Ñ€ÑƒÐ²Ð°Ñ‚Ð¸ÑÑ.\n\n**ÐœÐ°Ñ€Ñ–Ñ:** Ð¡Ð¿Ñ€Ð°Ð²Ð´Ñ–? Ð¯ Ð½Ðµ Ð¼Ð¾Ð¶Ñƒ Ð¿Ñ€Ð°Ñ†ÑŽÐ²Ð°Ñ‚Ð¸, ÑÐ»ÑƒÑ…Ð°ÑŽÑ‡Ð¸ Ñ‰Ð¾ÑÑŒ. ÐœÐµÐ½Ðµ Ñ†Ðµ Ð²Ñ–Ð´Ð²Ð¾Ð»Ñ–ÐºÐ°Ñ”.\n\n**ÐÐ½Ð´Ñ€Ñ–Ð¹:** Ð Ñ Ð½Ð°Ð²Ð¿Ð°ÐºÐ¸. Ð¡Ð¸Ð´ÑÑ‡Ð¸ Ð² Ñ‚Ð¸ÑˆÑ–, ÑˆÐ²Ð¸Ð´ÐºÐ¾ Ð²Ñ‚Ð¾Ð¼Ð»ÑŽÑŽÑÑ.\n\n### Ð”Ñ–Ð°Ð»Ð¾Ð³ 2: ÐŸÑ€Ð¾ Ð²Ð¸Ñ…Ñ–Ð´Ð½Ñ–\n\n**ÐžÐ»ÐµÐ½Ð°:** Ð¯Ðº Ð¿Ñ€Ð¾Ð²ÐµÐ»Ð° Ð²Ð¸Ñ…Ñ–Ð´Ð½Ñ–?\n\n**Ð¢ÐµÑ‚ÑÐ½Ð°:** Ð§ÑƒÐ´Ð¾Ð²Ð¾! Ð“ÑƒÐ»ÑÑŽÑ‡Ð¸ Ð¿Ð°Ñ€ÐºÐ¾Ð¼, Ð·ÑƒÑÑ‚Ñ€Ñ–Ð»Ð° ÑÑ‚Ð°Ñ€Ñƒ Ð¿Ð¾Ð´Ñ€ÑƒÐ³Ñƒ. ÐœÐ¸ Ñ€Ð¾Ð·Ð¼Ð¾Ð²Ð»ÑÐ»Ð¸ Ð³Ð¾Ð´Ð¸Ð½Ñƒ!\n\n**ÐžÐ»ÐµÐ½Ð°:** ÐŸÐ¾Ð²ÐµÑ€Ñ‚Ð°ÑŽÑ‡Ð¸ÑÑŒ Ð´Ð¾Ð´Ð¾Ð¼Ñƒ, Ð½Ðµ Ð·Ð°Ð¼ÐµÑ€Ð·Ð»Ð°? Ð‘ÑƒÐ»Ð¾ Ð¶ Ñ…Ð¾Ð»Ð¾Ð´Ð½Ð¾!\n\n**Ð¢ÐµÑ‚ÑÐ½Ð°:** ÐÑ–, Ð¹Ð´ÑƒÑ‡Ð¸ ÑˆÐ²Ð¸Ð´ÐºÐ¾, Ð½Ðµ Ð¿Ð¾Ð¼Ñ–Ñ‚Ð¸Ð»Ð° Ñ…Ð¾Ð»Ð¾Ð´Ñƒ.\n\n### Ð”Ñ–Ð°Ð»Ð¾Ð³ 3: ÐŸÑ€Ð¾ Ð½Ð°Ð²Ñ‡Ð°Ð½Ð½Ñ\n\n**Ð’Ð¸ÐºÐ»Ð°Ð´Ð°Ñ‡:** Ð¯Ðº Ð²Ð¸ Ð²Ñ‡Ð¸Ñ‚Ðµ Ð½Ð¾Ð²Ñ– ÑÐ»Ð¾Ð²Ð°?\n\n**Ð¡Ñ‚ÑƒÐ´ÐµÐ½Ñ‚:** Ð§Ð¸Ñ‚Ð°ÑŽÑ‡Ð¸ Ñ‚ÐµÐºÑÑ‚Ð¸, Ð²Ð¸Ð¿Ð¸ÑÑƒÑŽ Ð½ÐµÐ·Ð½Ð°Ð¹Ð¾Ð¼Ñ– ÑÐ»Ð¾Ð²Ð°. ÐŸÐ¾Ñ‚Ñ–Ð¼, Ð¿Ð¾Ð²Ñ‚Ð¾Ñ€ÑŽÑŽÑ‡Ð¸ Ñ—Ñ… ÐºÑ–Ð»ÑŒÐºÐ° Ñ€Ð°Ð·Ñ–Ð², Ð·Ð°Ð¿Ð°Ð¼'ÑÑ‚Ð¾Ð²ÑƒÑŽ.\n\n**Ð’Ð¸ÐºÐ»Ð°Ð´Ð°Ñ‡:** Ð“Ð°Ñ€Ð½Ð¸Ð¹ Ð¼ÐµÑ‚Ð¾Ð´! Ð’Ð¸Ð²Ñ‡Ð°ÑŽÑ‡Ð¸ Ð¼Ð¾Ð²Ñƒ Ñ‚Ð°ÐºÐ¸Ð¼ Ñ‡Ð¸Ð½Ð¾Ð¼, Ð²Ð¸ Ð´Ð¾ÑÑÐ³Ð½ÐµÑ‚Ðµ ÑƒÑÐ¿Ñ–Ñ…Ñƒ.\n\n### Ð”Ñ–Ð°Ð»Ð¾Ð³ 4: Ð£ ÐºÐ°Ñ„Ðµ\n\n**ÐžÑ„Ñ–Ñ†Ñ–Ð°Ð½Ñ‚:** Ð¡Ð»ÑƒÑ…Ð°ÑŽ Ð²Ð°Ñ, Ñ‰Ð¾ Ð±ÑƒÐ´ÐµÑ‚Ðµ Ð·Ð°Ð¼Ð¾Ð²Ð»ÑÑ‚Ð¸?\n\n**ÐšÐ»Ñ–Ñ”Ð½Ñ‚:** Ð”Ð¸Ð²Ð»ÑÑ‡Ð¸ÑÑŒ Ð½Ð° Ð¼ÐµÐ½ÑŽ, Ð½Ðµ Ð¼Ð¾Ð¶Ñƒ Ð²Ð¸Ð·Ð½Ð°Ñ‡Ð¸Ñ‚Ð¸ÑÑ. Ð’ÑÐµ Ð²Ð¸Ð³Ð»ÑÐ´Ð°Ñ” ÑÐ¼Ð°Ñ‡Ð½Ð¾!\n\n**ÐžÑ„Ñ–Ñ†Ñ–Ð°Ð½Ñ‚:** Ð ÐµÐºÐ¾Ð¼ÐµÐ½Ð´ÑƒÑŽ Ð±Ð¾Ñ€Ñ‰. Ð‡Ð´ÑÑ‡Ð¸ Ð¹Ð¾Ð³Ð¾, Ð²Ð¸ Ð²Ñ–Ð´Ñ‡ÑƒÑ”Ñ‚Ðµ ÑÐ¿Ñ€Ð°Ð²Ð¶Ð½Ñ–Ð¹ ÑƒÐºÑ€Ð°Ñ—Ð½ÑÑŒÐºÐ¸Ð¹ ÑÐ¼Ð°Ðº.\n\n---\n\n> ðŸ‡ºðŸ‡¦ **ÐŸÑ€Ð°Ð²Ð´Ð° Ð¿Ñ€Ð¾Ñ‚Ð¸ Ð¼Ñ–Ñ„Ñƒ**\n>\n> **ÐœÐ†Ð¤:** Ð”Ñ–Ñ”Ð¿Ñ€Ð¸ÑÐ»Ñ–Ð²Ð½Ð¸ÐºÐ¸ â€” Ñ†Ðµ Ð·Ð°ÑÑ‚Ð°Ñ€Ñ–Ð»Ð° Ñ„Ð¾Ñ€Ð¼Ð°, ÑÐºÑƒ ÑÑƒÑ‡Ð°ÑÐ½Ñ– ÑƒÐºÑ€Ð°Ñ—Ð½Ñ†Ñ– Ð½Ðµ Ð²Ð¸ÐºÐ¾Ñ€Ð¸ÑÑ‚Ð¾Ð²ÑƒÑŽÑ‚ÑŒ.\n>\n> **ÐŸÐ ÐÐ’Ð”Ð:** Ð”Ñ–Ñ”Ð¿Ñ€Ð¸ÑÐ»Ñ–Ð²Ð½Ð¸ÐºÐ¸ Ð°ÐºÑ‚Ð¸Ð²Ð½Ð¾ Ð²Ð¸ÐºÐ¾Ñ€Ð¸ÑÑ‚Ð¾Ð²ÑƒÑŽÑ‚ÑŒÑÑ Ð² ÑÑƒÑ‡Ð°ÑÐ½Ñ–Ð¹ ÑƒÐºÑ€Ð°Ñ—Ð½ÑÑŒÐºÑ–Ð¹ Ð¼Ð¾Ð²Ñ– â€” Ð² Ð¶ÑƒÑ€Ð½Ð°Ð»Ñ–ÑÑ‚Ð¸Ñ†Ñ–, Ð½Ð°ÑƒÑ†Ñ–, Ñ…ÑƒÐ´Ð¾Ð¶Ð½Ñ–Ð¹ Ð»Ñ–Ñ‚ÐµÑ€Ð°Ñ‚ÑƒÑ€Ñ– Ñ‚Ð° Ñ€Ð¾Ð·Ð¼Ð¾Ð²Ð½Ñ–Ð¹ Ð¼Ð¾Ð²Ñ–. Ð’Ð¾Ð½Ð¸ Ñ” Ð¾Ð·Ð½Ð°ÐºÐ¾ÑŽ Ð¾ÑÐ²Ñ–Ñ‡ÐµÐ½Ð¾Ð³Ð¾ Ð¼Ð¾Ð²Ð»ÐµÐ½Ð½Ñ Ñ– Ñ€Ð¾Ð±Ð»ÑÑ‚ÑŒ Ð¼Ð¾Ð²Ñƒ Ð±Ñ–Ð»ÑŒÑˆ Ð²Ð¸Ñ€Ð°Ð·Ð½Ð¾ÑŽ. Ð†Ð¼Ð¿ÐµÑ€ÑÑŒÐºÐ° Ñ€Ð¾ÑÑ–Ð¹ÑÑŒÐºÐ° Ð¿Ñ€Ð¾Ð¿Ð°Ð³Ð°Ð½Ð´Ð° Ñ‡Ð°ÑÑ‚Ð¾ Ð½Ð°Ð¼Ð°Ð³Ð°Ð»Ð°ÑÑ Ð¿Ñ€Ð¸Ð¼ÐµÐ½ÑˆÐ¸Ñ‚Ð¸ Ð±Ð°Ð³Ð°Ñ‚ÑÑ‚Ð²Ð¾ ÑƒÐºÑ€Ð°Ñ—Ð½ÑÑŒÐºÐ¾Ñ— Ð³Ñ€Ð°Ð¼Ð°Ñ‚Ð¸ÐºÐ¸, ÑÑ‚Ð²ÐµÑ€Ð´Ð¶ÑƒÑŽÑ‡Ð¸, Ñ‰Ð¾ ÑƒÐºÑ€Ð°Ñ—Ð½ÑÑŒÐºÐ° â€” Ñ†Ðµ Â«Ð¿Ñ€Ð¾ÑÑ‚Ð° ÑÐµÐ»ÑÐ½ÑÑŒÐºÐ° Ð¼Ð¾Ð²Ð°Â». ÐÐ°ÑÐ¿Ñ€Ð°Ð²Ð´Ñ– ÑƒÐºÑ€Ð°Ñ—Ð½ÑÑŒÐºÐ° Ð¼Ð°Ñ” Ð±Ð°Ð³Ð°Ñ‚Ð¸Ð¹ Ð³Ñ€Ð°Ð¼Ð°Ñ‚Ð¸Ñ‡Ð½Ð¸Ð¹ Ð°Ð¿Ð°Ñ€Ð°Ñ‚, Ð²ÐºÐ»ÑŽÑ‡Ð°ÑŽÑ‡Ð¸ ÑÐ¸ÑÑ‚ÐµÐ¼Ñƒ Ð´Ñ–Ñ”Ð¿Ñ€Ð¸ÑÐ»Ñ–Ð²Ð½Ð¸ÐºÑ–Ð², ÑÐºÐ° Ð·Ð±ÐµÑ€ÐµÐ³Ð»Ð°ÑÑ ÐºÑ€Ð°Ñ‰Ðµ, Ð½Ñ–Ð¶ Ñƒ Ð±Ð°Ð³Ð°Ñ‚ÑŒÐ¾Ñ… ÑÑƒÑÑ–Ð´Ð½Ñ–Ñ… Ð¼Ð¾Ð²Ð°Ñ….\n\n---\n\n> ðŸ“– **Ð†ÑÑ‚Ð¾Ñ€Ð¸Ñ‡Ð½Ð° Ð´Ð¾Ð²Ñ–Ð´ÐºÐ°**\n>\n> Ð”Ñ–Ñ”Ð¿Ñ€Ð¸ÑÐ»Ñ–Ð²Ð½Ð¸ÐºÐ¸ Ñ–ÑÐ½ÑƒÑŽÑ‚ÑŒ Ð² ÑƒÐºÑ€Ð°Ñ—Ð½ÑÑŒÐºÑ–Ð¹ Ð¼Ð¾Ð²Ñ– Ð· Ð´Ð°Ð²Ð½Ñ–Ñ… Ñ‡Ð°ÑÑ–Ð². ÐÐ°Ð²Ñ–Ñ‚ÑŒ Ñƒ Â«Ð¡Ð»Ð¾Ð²Ñ– Ð¾ Ð¿Ð¾Ð»ÐºÑƒ Ð†Ð³Ð¾Ñ€ÐµÐ²Ñ–Ð¼Â» (XII ÑÑ‚Ð¾Ð»Ñ–Ñ‚Ñ‚Ñ) Ñ” Ð´Ñ–Ñ”Ð¿Ñ€Ð¸ÑÐ»Ñ–Ð²Ð½Ð¸ÐºÐ¾Ð²Ñ– ÐºÐ¾Ð½ÑÑ‚Ñ€ÑƒÐºÑ†Ñ–Ñ—. Ð¦Ñ Ð³Ñ€Ð°Ð¼Ð°Ñ‚Ð¸Ñ‡Ð½Ð° Ñ„Ð¾Ñ€Ð¼Ð° â€” ÑÐ¿Ñ–Ð»ÑŒÐ½Ð° ÑÐ¿Ð°Ð´Ñ‰Ð¸Ð½Ð° ÑÐ»Ð¾Ð²'ÑÐ½ÑÑŒÐºÐ¸Ñ… Ð¼Ð¾Ð², Ð°Ð»Ðµ ÑƒÐºÑ€Ð°Ñ—Ð½ÑÑŒÐºÐ° Ð¼Ð¾Ð²Ð° Ð·Ð±ÐµÑ€ÐµÐ³Ð»Ð° Ñ—Ñ— Ð¾ÑÐ¾Ð±Ð»Ð¸Ð²Ð¾ ÑÑÐºÑ€Ð°Ð²Ð¾. ÐÐµÐ·Ð²Ð°Ð¶Ð°ÑŽÑ‡Ð¸ Ð½Ð° Ð·Ð°Ð±Ð¾Ñ€Ð¾Ð½Ð¸ ÑƒÐºÑ€Ð°Ñ—Ð½ÑÑŒÐºÐ¾Ñ— Ð¼Ð¾Ð²Ð¸ Ð¿Ñ–Ð´ Ñ‡Ð°Ñ Ð Ð¾ÑÑ–Ð¹ÑÑŒÐºÐ¾Ñ— Ñ–Ð¼Ð¿ÐµÑ€Ñ–Ñ— (Ð•Ð¼ÑÑŒÐºÐ¸Ð¹ ÑƒÐºÐ°Ð· 1876 Ñ€Ð¾ÐºÑƒ, Ð’Ð°Ð»ÑƒÑ”Ð²ÑÑŒÐºÐ¸Ð¹ Ñ†Ð¸Ñ€ÐºÑƒÐ»ÑÑ€ 1863 Ñ€Ð¾ÐºÑƒ), ÑƒÐºÑ€Ð°Ñ—Ð½Ñ†Ñ– Ð¿Ñ€Ð¾Ð´Ð¾Ð²Ð¶ÑƒÐ²Ð°Ð»Ð¸ Ð²Ð¸ÐºÐ¾Ñ€Ð¸ÑÑ‚Ð¾Ð²ÑƒÐ²Ð°Ñ‚Ð¸ Ð´Ñ–Ñ”Ð¿Ñ€Ð¸ÑÐ»Ñ–Ð²Ð½Ð¸ÐºÐ¸ Ð² ÑƒÑÐ½Ð¾Ð¼Ñƒ Ð¼Ð¾Ð²Ð»ÐµÐ½Ð½Ñ– Ñ‚Ð° Ñ‚Ð°Ñ”Ð¼Ð½Ð¾ Ð² Ð¿Ð¸ÑÐµÐ¼Ð½Ð¾ÑÑ‚Ñ–. Ð¡ÑŒÐ¾Ð³Ð¾Ð´Ð½Ñ– Ñ†Ñ Ð³Ñ€Ð°Ð¼Ð°Ñ‚Ð¸Ñ‡Ð½Ð° Ñ„Ð¾Ñ€Ð¼Ð° Ñ” ÑÐ¸Ð¼Ð²Ð¾Ð»Ð¾Ð¼ Ð½ÐµÐ¿ÐµÑ€ÐµÑ€Ð²Ð½Ð¾ÑÑ‚Ñ– ÑƒÐºÑ€Ð°Ñ—Ð½ÑÑŒÐºÐ¾Ñ— Ð¼Ð¾Ð²Ð½Ð¾Ñ— Ñ‚Ñ€Ð°Ð´Ð¸Ñ†Ñ–Ñ— Ñ‚Ð° Ñ—Ñ— Ð¾Ð¿Ð¾Ñ€Ñƒ Ð°ÑÐ¸Ð¼Ñ–Ð»ÑÑ†Ñ–Ñ—.\n\n---\n\n# ÐŸÑ–Ð´ÑÑƒÐ¼Ð¾Ðº\n\n**Ð©Ð¾ Ð²Ð¸ Ð½Ð°Ð²Ñ‡Ð¸Ð»Ð¸ÑÑ:**\n\n1. Ð”Ñ–Ñ”Ð¿Ñ€Ð¸ÑÐ»Ñ–Ð²Ð½Ð¸ÐºÐ¸ Ð½ÐµÐ´Ð¾ÐºÐ¾Ð½Ð°Ð½Ð¾Ð³Ð¾ Ð²Ð¸Ð´Ñƒ ÑƒÑ‚Ð²Ð¾Ñ€ÑŽÑŽÑ‚ÑŒÑÑ Ð²Ñ–Ð´ Ð¾ÑÐ½Ð¾Ð²Ð¸ Ñ‚ÐµÐ¿ÐµÑ€Ñ–ÑˆÐ½ÑŒÐ¾Ð³Ð¾ Ñ‡Ð°ÑÑƒ + ÑÑƒÑ„Ñ–ÐºÑ -ÑŽÑ‡Ð¸/-Ð°Ñ‡Ð¸.\n2. Ð’Ð¾Ð½Ð¸ Ð²Ð¸Ñ€Ð°Ð¶Ð°ÑŽÑ‚ÑŒ **Ð¾Ð´Ð½Ð¾Ñ‡Ð°ÑÐ½Ñ–ÑÑ‚ÑŒ** Ð´Ð¾Ð´Ð°Ñ‚ÐºÐ¾Ð²Ð¾Ñ— Ñ‚Ð° Ð¾ÑÐ½Ð¾Ð²Ð½Ð¾Ñ— Ð´Ñ–Ð¹.\n3. Ð¡ÑƒÐ±'Ñ”ÐºÑ‚ Ð´Ñ–Ñ”Ð¿Ñ€Ð¸ÑÐ»Ñ–Ð²Ð½Ð¸ÐºÐ° Ñ– Ð¾ÑÐ½Ð¾Ð²Ð½Ð¾Ð³Ð¾ Ð´Ñ–Ñ”ÑÐ»Ð¾Ð²Ð° Ð¼Ð°ÑŽÑ‚ÑŒ **Ð·Ð±Ñ–Ð³Ð°Ñ‚Ð¸ÑÑ**.\n4. Ð—Ð²Ð¾Ñ€Ð¾Ñ‚Ð½Ñ– Ð´Ñ–Ñ”ÑÐ»Ð¾Ð²Ð° ÑƒÑ‚Ð²Ð¾Ñ€ÑŽÑŽÑ‚ÑŒ Ð´Ñ–Ñ”Ð¿Ñ€Ð¸ÑÐ»Ñ–Ð²Ð½Ð¸ÐºÐ¸ Ð· Ñ‡Ð°ÑÑ‚ÐºÐ¾ÑŽ **-ÑÑŒ**.\n\n**ÐžÑÐ½Ð¾Ð²Ð½Ðµ Ð¿Ñ€Ð°Ð²Ð¸Ð»Ð¾:**\n\n> Ð”Ñ–Ñ”Ð¿Ñ€Ð¸ÑÐ»Ñ–Ð²Ð½Ð¸Ðº Ð²Ñ–Ð´Ð¿Ð¾Ð²Ñ–Ð´Ð°Ñ” Ð½Ð° Ð¿Ð¸Ñ‚Ð°Ð½Ð½Ñ Â«Ð©Ð¾ Ñ€Ð¾Ð±Ð»ÑÑ‡Ð¸?Â» Ñ– Ð¿Ð¾ÐºÐ°Ð·ÑƒÑ”, Ð©Ðž Ñ‰Ðµ Ð²Ñ–Ð´Ð±ÑƒÐ²Ð°Ð»Ð¾ÑÑ Ð¾Ð´Ð½Ð¾Ñ‡Ð°ÑÐ½Ð¾ Ð· Ð¾ÑÐ½Ð¾Ð²Ð½Ð¾ÑŽ Ð´Ñ–Ñ”ÑŽ.\n\n**Ð”Ð°Ð»Ñ–:**\n\nÐ£ Ð½Ð°ÑÑ‚ÑƒÐ¿Ð½Ð¾Ð¼Ñƒ Ð¼Ð¾Ð´ÑƒÐ»Ñ– (43) Ð¼Ð¸ Ñ€Ð¾Ð·Ð³Ð»ÑÐ½ÐµÐ¼Ð¾ Ð´Ñ–Ñ”Ð¿Ñ€Ð¸ÑÐ»Ñ–Ð²Ð½Ð¸ÐºÐ¸ **Ð´Ð¾ÐºÐ¾Ð½Ð°Ð½Ð¾Ð³Ð¾ Ð²Ð¸Ð´Ñƒ** Ð· ÑÑƒÑ„Ñ–ÐºÑÐ°Ð¼Ð¸ -Ð²ÑˆÐ¸/-ÑˆÐ¸, ÑÐºÑ– Ð²Ð¸Ñ€Ð°Ð¶Ð°ÑŽÑ‚ÑŒ **Ð¿Ð¾Ð¿ÐµÑ€ÐµÐ´Ð½Ñ–ÑÑ‚ÑŒ** Ð´Ñ–Ð¹.\n\n> âœ… **Ð¡Ð°Ð¼Ð¾Ð¿ÐµÑ€ÐµÐ²Ñ–Ñ€ÐºÐ°**\n>\n> Ð§Ð¸ Ð¼Ð¾Ð¶ÐµÑ‚Ðµ Ð²Ð¸:\n> - [ ] Ð£Ñ‚Ð²Ð¾Ñ€Ð¸Ñ‚Ð¸ Ð´Ñ–Ñ”Ð¿Ñ€Ð¸ÑÐ»Ñ–Ð²Ð½Ð¸Ðº Ð²Ñ–Ð´ Ð´Ñ–Ñ”ÑÐ»Ñ–Ð²: Ñ‡Ð¸Ñ‚Ð°Ñ‚Ð¸, Ð¿Ð¸ÑÐ°Ñ‚Ð¸, Ð¹Ñ‚Ð¸, ÑÐ¸Ð´Ñ–Ñ‚Ð¸?\n> - [ ] Ð¡ÐºÐ»Ð°ÑÑ‚Ð¸ Ñ€ÐµÑ‡ÐµÐ½Ð½Ñ Ð· Ð´Ñ–Ñ”Ð¿Ñ€Ð¸ÑÐ»Ñ–Ð²Ð½Ð¸ÐºÐ¾Ð¼, Ñ‰Ð¾ Ð²Ð¸Ñ€Ð°Ð¶Ð°Ñ” Ð¾Ð´Ð½Ð¾Ñ‡Ð°ÑÐ½Ñ–ÑÑ‚ÑŒ?\n> - [ ] Ð’Ð¸Ð·Ð½Ð°Ñ‡Ð¸Ñ‚Ð¸ Ð¿Ð¾Ð¼Ð¸Ð»ÐºÑƒ Ð² Ñ€ÐµÑ‡ÐµÐ½Ð½Ñ–: Â«Ð§Ð¸Ñ‚Ð°ÑŽÑ‡Ð¸ ÐºÐ½Ð¸Ð³Ñƒ, Ð¼ÐµÐ½Ñ– ÑÑ‚Ð°Ð»Ð¾ ÑÑƒÐ¼Ð½Ð¾Â»?\n> - [ ] ÐŸÐ¾ÑÑÐ½Ð¸Ñ‚Ð¸ Ñ€Ñ–Ð·Ð½Ð¸Ñ†ÑŽ Ð¼Ñ–Ð¶ Â«Ñ‡Ð¸Ñ‚Ð°ÑŽÑ‡Ð¸Â» Ñ– Â«Ð¿Ñ€Ð¾Ñ‡Ð¸Ñ‚Ð°Ð²ÑˆÐ¸Â»?\n>\n> Ð¯ÐºÑ‰Ð¾ Ñ‚Ð°Ðº â€” Ð²Ð¸ Ð³Ð¾Ñ‚Ð¾Ð²Ñ– Ð´Ð¾ Ð²Ð¿Ñ€Ð°Ð²!\n\n---\n\n> [!resources] ðŸŽ§ Ð—Ð¾Ð²Ð½Ñ–ÑˆÐ½Ñ– Ñ€ÐµÑÑƒÑ€ÑÐ¸\n>\n> **Ð”Ð¾Ð´Ð°Ñ‚ÐºÐ¾Ð²Ñ– Ð¼Ð°Ñ‚ÐµÑ€Ñ–Ð°Ð»Ð¸:**\n> - ðŸ“– [Ð”Ñ–Ñ”Ð¿Ñ€Ð¸ÑÐ»Ñ–Ð²Ð½Ð¸Ðº Ñƒ Ð’Ñ–ÐºÑ–Ð¿ÐµÐ´Ñ–Ñ—](https://uk.wikipedia.org/wiki/Ð”Ñ–Ñ”Ð¿Ñ€Ð¸ÑÐ»Ñ–Ð²Ð½Ð¸Ðº) â€” Ð´ÐµÑ‚Ð°Ð»ÑŒÐ½Ð° Ð³Ñ€Ð°Ð¼Ð°Ñ‚Ð¸Ñ‡Ð½Ð° ÑÑ‚Ð°Ñ‚Ñ‚Ñ\n> - ðŸ“º [Ð”Ñ–Ñ”Ð¿Ñ€Ð¸ÑÐ»Ñ–Ð²Ð½Ð¸ÐºÐ¸: Ð²Ñ–Ð´ÐµÐ¾ Ð¿Ð¾ÑÑÐ½ÐµÐ½Ð½Ñ](https://www.youtube.com/results?search_query=Ð´Ñ–Ñ”Ð¿Ñ€Ð¸ÑÐ»Ñ–Ð²Ð½Ð¸Ðº+ÑƒÐºÑ€Ð°Ñ—Ð½ÑÑŒÐºÐ°) â€” Ð²Ñ–Ð´ÐµÐ¾ÑƒÑ€Ð¾ÐºÐ¸\n\n---\n\n# Ð’Ð¿Ñ€Ð°Ð²Ð¸\n\n## quiz: Ð¢ÐµÐ¾Ñ€ÐµÑ‚Ð¸Ñ‡Ð½Ñ– Ð·Ð½Ð°Ð½Ð½Ñ Ð¿Ñ€Ð¾ Ð´Ñ–Ñ”Ð¿Ñ€Ð¸ÑÐ»Ñ–Ð²Ð½Ð¸ÐºÐ¸ Ð½ÐµÐ´Ð¾ÐºÐ¾Ð½Ð°Ð½Ð¾Ð³Ð¾ Ð²Ð¸Ð´Ñƒ\n\n> ÐŸÐµÑ€ÐµÐ²Ñ–Ñ€Ñ‚Ðµ ÑÐ²Ð¾Ñ” Ñ€Ð¾Ð·ÑƒÐ¼Ñ–Ð½Ð½Ñ ÑƒÑ‚Ð²Ð¾Ñ€ÐµÐ½Ð½Ñ Ñ‚Ð° Ð²Ð¸ÐºÐ¾Ñ€Ð¸ÑÑ‚Ð°Ð½Ð½Ñ Ð´Ñ–Ñ”Ð¿Ñ€Ð¸ÑÐ»Ñ–Ð²Ð½Ð¸ÐºÑ–Ð² Ð½ÐµÐ´Ð¾ÐºÐ¾Ð½Ð°Ð½Ð¾Ð³Ð¾ Ð²Ð¸Ð´Ñƒ Ð² ÑƒÐºÑ€Ð°Ñ—Ð½ÑÑŒÐºÑ–Ð¹ Ð¼Ð¾Ð²Ñ–.\n\n1. Ð¯ÐºÐ¸Ð¹ ÑÑƒÑ„Ñ–ÐºÑ Ð²Ð¸ÐºÐ¾Ñ€Ð¸ÑÑ‚Ð¾Ð²ÑƒÑ”Ñ‚ÑŒÑÑ Ð´Ð»Ñ ÑƒÑ‚Ð²Ð¾Ñ€ÐµÐ½Ð½Ñ Ð´Ñ–Ñ”Ð¿Ñ€Ð¸ÑÐ»Ñ–Ð²Ð½Ð¸ÐºÐ° Ð½ÐµÐ´Ð¾ÐºÐ¾Ð½Ð°Ð½Ð¾Ð³Ð¾ Ð²Ð¸Ð´Ñƒ Ð²Ñ–Ð´ Ð´Ñ–Ñ”ÑÐ»Ð¾Ð²Ð° Ð· Ð¾ÑÐ½Ð¾Ð²Ð¾ÑŽ Ð½Ð° Ð³Ð¾Ð»Ð¾ÑÐ½Ñƒ?\n   - [x] -ÑŽÑ‡Ð¸\n   - [ ] -Ð²ÑˆÐ¸\n   - [ ] -ÑˆÐ¸Ð¹\n   - [ ] -Ð½Ð¸Ð¹\n   > Ð¡ÑƒÑ„Ñ–ÐºÑ -ÑŽÑ‡Ð¸ Ð´Ð¾Ð´Ð°Ñ”Ñ‚ÑŒÑÑ Ð´Ð¾ Ð¾ÑÐ½Ð¾Ð²Ð¸ Ñ‚ÐµÐ¿ÐµÑ€Ñ–ÑˆÐ½ÑŒÐ¾Ð³Ð¾ Ñ‡Ð°ÑÑƒ Ð½Ð° Ð³Ð¾Ð»Ð¾ÑÐ½Ñƒ: Ñ‡Ð¸Ñ‚Ð°Ñ‚Ð¸ â†’ Ñ‡Ð¸Ñ‚Ð°ÑŽÑ‡Ð¸.\n\n2. Ð¯ÐºÑƒ Ñ„ÑƒÐ½ÐºÑ†Ñ–ÑŽ Ð²Ð¸ÐºÐ¾Ð½ÑƒÑ” Ð´Ñ–Ñ”Ð¿Ñ€Ð¸ÑÐ»Ñ–Ð²Ð½Ð¸Ðº Ð½ÐµÐ´Ð¾ÐºÐ¾Ð½Ð°Ð½Ð¾Ð³Ð¾ Ð²Ð¸Ð´Ñƒ Ð² Ñ€ÐµÑ‡ÐµÐ½Ð½Ñ– Â«Ð§Ð¸Ñ‚Ð°ÑŽÑ‡Ð¸ ÐºÐ½Ð¸Ð³Ñƒ, Ð²Ñ–Ð½ Ð¿Ð¸Ð² ÐºÐ°Ð²ÑƒÂ»?\n   - [x] Ð’Ð¸Ñ€Ð°Ð¶Ð°Ñ” Ð¾Ð´Ð½Ð¾Ñ‡Ð°ÑÐ½Ñ–ÑÑ‚ÑŒ Ð´Ñ–Ð¹\n   - [ ] Ð’Ð¸Ñ€Ð°Ð¶Ð°Ñ” Ð¿Ð¾Ð¿ÐµÑ€ÐµÐ´Ð½Ñ–ÑÑ‚ÑŒ Ð´Ñ–Ð¹\n   - [ ] Ð’Ð¸Ñ€Ð°Ð¶Ð°Ñ” Ñ€ÐµÐ·ÑƒÐ»ÑŒÑ‚Ð°Ñ‚ Ð´Ñ–Ñ—\n   - [ ] Ð’Ð¸Ñ€Ð°Ð¶Ð°Ñ” Ð¿Ñ€Ð¸Ñ‡Ð¸Ð½Ñƒ Ð´Ñ–Ñ—\n   > Ð”Ñ–Ñ”Ð¿Ñ€Ð¸ÑÐ»Ñ–Ð²Ð½Ð¸Ðº ÐÐ”Ð’ Ð¿Ð¾ÐºÐ°Ð·ÑƒÑ”, Ñ‰Ð¾ Ñ‡Ð¸Ñ‚Ð°Ð½Ð½Ñ Ñ– Ð¿Ð¸Ñ‚Ñ‚Ñ Ð²Ñ–Ð´Ð±ÑƒÐ²Ð°Ð»Ð¸ÑÑ Ð¾Ð´Ð½Ð¾Ñ‡Ð°ÑÐ½Ð¾.\n\n3. Ð’Ñ–Ð´ ÑÐºÐ¾Ñ— Ð¾ÑÐ½Ð¾Ð²Ð¸ ÑƒÑ‚Ð²Ð¾Ñ€ÑŽÑ”Ñ‚ÑŒÑÑ Ð´Ñ–Ñ”Ð¿Ñ€Ð¸ÑÐ»Ñ–Ð²Ð½Ð¸Ðº Ð½ÐµÐ´Ð¾ÐºÐ¾Ð½Ð°Ð½Ð¾Ð³Ð¾ Ð²Ð¸Ð´Ñƒ Ð´Ð»Ñ Ð´Ñ–Ñ”ÑÐ»Ð¾Ð²Ð° Â«Ð¿Ð¸ÑÐ°Ñ‚Ð¸Â» Ð² ÑƒÐºÑ€Ð°Ñ—Ð½ÑÑŒÐºÑ–Ð¹ Ð¼Ð¾Ð²Ñ–?\n   - [x] Ð’Ñ–Ð´ Ð¾ÑÐ½Ð¾Ð²Ð¸ Ñ‚ÐµÐ¿ÐµÑ€Ñ–ÑˆÐ½ÑŒÐ¾Ð³Ð¾ Ñ‡Ð°ÑÑƒ (Ð¿Ð¸Ñˆ-)\n   - [ ] Ð’Ñ–Ð´ Ð¾ÑÐ½Ð¾Ð²Ð¸ Ñ–Ð½Ñ„Ñ–Ð½Ñ–Ñ‚Ð¸Ð²Ð° (Ð¿Ð¸ÑÐ°-)\n   - [ ] Ð’Ñ–Ð´ Ð¾ÑÐ½Ð¾Ð²Ð¸ Ð¼Ð¸Ð½ÑƒÐ»Ð¾Ð³Ð¾ Ñ‡Ð°ÑÑƒ (Ð¿Ð¸ÑÐ°-)\n   - [ ] Ð’Ñ–Ð´ Ð¾ÑÐ½Ð¾Ð²Ð¸ Ð¼Ð°Ð¹Ð±ÑƒÑ‚Ð½ÑŒÐ¾Ð³Ð¾ Ñ‡Ð°ÑÑƒ (Ð¿Ð¸ÑÐ°Ñ‚Ð¸Ð¼-)\n   > Ð”Ñ–Ñ”Ð¿Ñ€Ð¸ÑÐ»Ñ–Ð²Ð½Ð¸ÐºÐ¸ ÑƒÑ‚Ð²Ð¾Ñ€ÑŽÑŽÑ‚ÑŒÑÑ Ð²Ñ–Ð´ Ð¾ÑÐ½Ð¾Ð²Ð¸ Ñ‚ÐµÐ¿ÐµÑ€Ñ–ÑˆÐ½ÑŒÐ¾Ð³Ð¾ Ñ‡Ð°ÑÑƒ: Ñ Ð¿Ð¸ÑˆÑƒ â†’ Ð¿Ð¸Ñˆ- â†’ Ð¿Ð¸ÑˆÑƒÑ‡Ð¸.\n\n4. Ð¯ÐºÐµ Ð·Ð°ÐºÑ–Ð½Ñ‡ÐµÐ½Ð½Ñ Ð¼Ð°Ñ” Ð´Ñ–Ñ”Ð¿Ñ€Ð¸ÑÐ»Ñ–Ð²Ð½Ð¸Ðº Ð½ÐµÐ´Ð¾ÐºÐ¾Ð½Ð°Ð½Ð¾Ð³Ð¾ Ð²Ð¸Ð´Ñƒ Ð²Ñ–Ð´ Ð·Ð²Ð¾Ñ€Ð¾Ñ‚Ð½Ð¾Ð³Ð¾ Ð´Ñ–Ñ”ÑÐ»Ð¾Ð²Ð° Â«Ð¾Ð´ÑÐ³Ð°Ñ‚Ð¸ÑÑÂ» Ð² ÑƒÐºÑ€Ð°Ñ—Ð½ÑÑŒÐºÑ–Ð¹ Ð³Ñ€Ð°Ð¼Ð°Ñ‚Ð¸Ñ†Ñ–?\n   - [x] -ÑÑŒ (Ð¾Ð´ÑÐ³Ð°ÑŽÑ‡Ð¸ÑÑŒ)\n   - [ ] -ÑÑ (Ð¾Ð´ÑÐ³Ð°ÑŽÑ‡Ð¸ÑÑ)\n   - [ ] -ÑˆÐ¸ (Ð¾Ð´ÑÐ³Ð°Ð²ÑˆÐ¸)\n   - [ ] -Ð½Ð¸Ð¹ (Ð¾Ð´ÑÐ³Ð°Ð½Ð¸Ð¹)\n   > Ð—Ð²Ð¾Ñ€Ð¾Ñ‚Ð½Ñ– Ð´Ñ–Ñ”ÑÐ»Ð¾Ð²Ð° ÑƒÑ‚Ð²Ð¾Ñ€ÑŽÑŽÑ‚ÑŒ Ð´Ñ–Ñ”Ð¿Ñ€Ð¸ÑÐ»Ñ–Ð²Ð½Ð¸ÐºÐ¸ Ð· Ñ‡Ð°ÑÑ‚ÐºÐ¾ÑŽ -ÑÑŒ: Ð¾Ð´ÑÐ³Ð°Ñ‚Ð¸ÑÑ â†’ Ð¾Ð´ÑÐ³Ð°ÑŽÑ‡Ð¸ÑÑŒ.\n\n5. Ð¯ÐºÐ° Ð³Ñ€Ð°Ð¼Ð°Ñ‚Ð¸Ñ‡Ð½Ð° Ð¿Ð¾Ð¼Ð¸Ð»ÐºÐ° Ð² Ñ€ÐµÑ‡ÐµÐ½Ð½Ñ– Â«Ð§Ð¸Ñ‚Ð°ÑŽÑ‡Ð¸ ÐºÐ½Ð¸Ð³Ñƒ, Ð¼ÐµÐ½Ñ– ÑÑ‚Ð°Ð»Ð¾ ÑÑƒÐ¼Ð½Ð¾Â» Ð· Ñ‚Ð¾Ñ‡ÐºÐ¸ Ð·Ð¾Ñ€Ñƒ ÑƒÐºÑ€Ð°Ñ—Ð½ÑÑŒÐºÐ¾Ñ— Ð³Ñ€Ð°Ð¼Ð°Ñ‚Ð¸ÐºÐ¸?\n   - [x] Ð Ñ–Ð·Ð½Ñ– ÑÑƒÐ±'Ñ”ÐºÑ‚Ð¸ Ð´Ñ–Ñ”Ð¿Ñ€Ð¸ÑÐ»Ñ–Ð²Ð½Ð¸ÐºÐ° Ñ‚Ð° Ð¾ÑÐ½Ð¾Ð²Ð½Ð¾Ð³Ð¾ Ð´Ñ–Ñ”ÑÐ»Ð¾Ð²Ð°\n   - [ ] ÐÐµÐ¿Ñ€Ð°Ð²Ð¸Ð»ÑŒÐ½Ð¸Ð¹ ÑÑƒÑ„Ñ–ÐºÑ Ð´Ñ–Ñ”Ð¿Ñ€Ð¸ÑÐ»Ñ–Ð²Ð½Ð¸ÐºÐ°\n   - [ ] ÐÐµÐ¿Ñ€Ð°Ð²Ð¸Ð»ÑŒÐ½Ð¸Ð¹ Ð²Ñ–Ð´Ð¼Ñ–Ð½Ð¾Ðº Ñ–Ð¼ÐµÐ½Ð½Ð¸ÐºÐ°\n   - [ ] ÐÐµÐ¿Ñ€Ð°Ð²Ð¸Ð»ÑŒÐ½Ð¸Ð¹ Ñ‡Ð°Ñ Ð¾ÑÐ½Ð¾Ð²Ð½Ð¾Ð³Ð¾ Ð´Ñ–Ñ”ÑÐ»Ð¾Ð²Ð°\n   > Ð¡ÑƒÐ±'Ñ”ÐºÑ‚ Ð´Ñ–Ñ”Ð¿Ñ€Ð¸ÑÐ»Ñ–Ð²Ð½Ð¸ÐºÐ° (Ñ…Ñ‚Ð¾ Ñ‡Ð¸Ñ‚Ð°Ð²?) Ð¼Ð°Ñ” Ð·Ð±Ñ–Ð³Ð°Ñ‚Ð¸ÑÑ Ð· ÑÑƒÐ±'Ñ”ÐºÑ‚Ð¾Ð¼ Ð¾ÑÐ½Ð¾Ð²Ð½Ð¾Ð³Ð¾ Ð´Ñ–Ñ”ÑÐ»Ð¾Ð²Ð°.\n\n6. Ð¯ÐºÐ¸Ð¹ Ð¿Ñ€Ð°Ð²Ð¸Ð»ÑŒÐ½Ð¸Ð¹ Ð´Ñ–Ñ”Ð¿Ñ€Ð¸ÑÐ»Ñ–Ð²Ð½Ð¸Ðº ÑƒÑ‚Ð²Ð¾Ñ€ÑŽÑ”Ñ‚ÑŒÑÑ Ð²Ñ–Ð´ Ð´Ñ–Ñ”ÑÐ»Ð¾Ð²Ð° Â«Ð±Ñ–Ð³Ñ‚Ð¸Â» Ð² ÑƒÐºÑ€Ð°Ñ—Ð½ÑÑŒÐºÑ–Ð¹ Ð¼Ð¾Ð²Ñ– Ð· ÑƒÑ€Ð°Ñ…ÑƒÐ²Ð°Ð½Ð½ÑÐ¼ Ñ‡ÐµÑ€Ð³ÑƒÐ²Ð°Ð½Ð½Ñ?\n   - [x] Ð±Ñ–Ð¶Ð°Ñ‡Ð¸\n   - [ ] Ð±Ñ–Ð³ÑƒÑ‡Ð¸\n   - [ ] Ð±Ñ–Ð³Ð°ÑŽÑ‡Ð¸\n   - [ ] Ð±ÐµÐ¶Ð°Ñ‡Ð¸\n   > Ð’Ñ–Ð´ Ð¾ÑÐ½Ð¾Ð²Ð¸ Ñ‚ÐµÐ¿ÐµÑ€Ñ–ÑˆÐ½ÑŒÐ¾Ð³Ð¾ Ñ‡Ð°ÑÑƒ Â«Ð±Ñ–Ð¶-Â» (Ñ Ð±Ñ–Ð¶Ñƒ) + ÑÑƒÑ„Ñ–ÐºÑ -Ð°Ñ‡Ð¸ = Ð±Ñ–Ð¶Ð°Ñ‡Ð¸.\n\n7. ÐÐ° ÑÐºÐµ Ð¿Ð¸Ñ‚Ð°Ð½Ð½Ñ Ð²Ñ–Ð´Ð¿Ð¾Ð²Ñ–Ð´Ð°Ñ” Ð´Ñ–Ñ”Ð¿Ñ€Ð¸ÑÐ»Ñ–Ð²Ð½Ð¸Ðº Ñƒ Ñ€ÐµÑ‡ÐµÐ½Ð½Ñ– Â«Ð™Ð´ÑƒÑ‡Ð¸ Ð²ÑƒÐ»Ð¸Ñ†ÐµÑŽ, Ð²Ñ–Ð½ Ð´ÑƒÐ¼Ð°Ð² Ð¿Ñ€Ð¾ Ñ€Ð¾Ð±Ð¾Ñ‚ÑƒÂ»?\n   - [x] Ð©Ð¾ Ñ€Ð¾Ð±Ð»ÑÑ‡Ð¸?\n   - [ ] Ð©Ð¾ Ð·Ñ€Ð¾Ð±Ð¸Ð²ÑˆÐ¸?\n   - [ ] Ð¯ÐºÐ¸Ð¹?\n   - [ ] ÐšÑƒÐ´Ð¸?\n   > Ð”Ñ–Ñ”Ð¿Ñ€Ð¸ÑÐ»Ñ–Ð²Ð½Ð¸Ðº Ð²Ñ–Ð´Ð¿Ð¾Ð²Ñ–Ð´Ð°Ñ” Ð½Ð° Ð¿Ð¸Ñ‚Ð°Ð½Ð½Ñ Â«Ð©Ð¾ Ñ€Ð¾Ð±Ð»ÑÑ‡Ð¸?Â» â€” Ð™Ð´ÑƒÑ‡Ð¸ (Ñ‰Ð¾ Ñ€Ð¾Ð±Ð»ÑÑ‡Ð¸?) Ð²ÑƒÐ»Ð¸Ñ†ÐµÑŽ.\n\n8. Ð§Ð¾Ð¼Ñƒ Ð´Ñ–Ñ”Ð¿Ñ€Ð¸ÑÐ»Ñ–Ð²Ð½Ð¸Ðº Â«Ñ‡Ð¸Ñ‚Ð°ÑŽÑ‡Ð¸Â» Ð²Ð²Ð°Ð¶Ð°Ñ”Ñ‚ÑŒÑÑ Ñ„Ð¾Ñ€Ð¼Ð¾ÑŽ Ð½ÐµÐ´Ð¾ÐºÐ¾Ð½Ð°Ð½Ð¾Ð³Ð¾ Ð²Ð¸Ð´Ñƒ Ñƒ ÑÐ¸ÑÑ‚ÐµÐ¼Ñ– ÑƒÐºÑ€Ð°Ñ—Ð½ÑÑŒÐºÐ¸Ñ… Ð´Ñ–Ñ”ÑÐ»Ñ–Ð² Ñ–Ð· Ð³Ñ€Ð°Ð¼Ð°Ñ‚Ð¸Ñ‡Ð½Ð¾Ñ— Ñ‚Ð¾Ñ‡ÐºÐ¸ Ð·Ð¾Ñ€Ñƒ?\n   - [x] Ð¢Ð¾Ð¼Ñƒ Ñ‰Ð¾ Ð²Ñ–Ð½ ÑƒÑ‚Ð²Ð¾Ñ€ÐµÐ½Ð¸Ð¹ Ð²Ñ–Ð´ Ð´Ñ–Ñ”ÑÐ»Ð¾Ð²Ð° Ð½ÐµÐ´Ð¾ÐºÐ¾Ð½Ð°Ð½Ð¾Ð³Ð¾ Ð²Ð¸Ð´Ñƒ Â«Ñ‡Ð¸Ñ‚Ð°Ñ‚Ð¸Â»\n   - [ ] Ð¢Ð¾Ð¼Ñƒ Ñ‰Ð¾ Ð²Ñ–Ð½ Ð¼Ð°Ñ” ÑÑƒÑ„Ñ–ÐºÑ -ÑŽÑ‡Ð¸\n   - [ ] Ð¢Ð¾Ð¼Ñƒ Ñ‰Ð¾ Ð²Ñ–Ð½ Ð²Ð¸Ñ€Ð°Ð¶Ð°Ñ” Ð¼Ð¸Ð½ÑƒÐ»Ñƒ Ð´Ñ–ÑŽ\n   - [ ] Ð¢Ð¾Ð¼Ñƒ Ñ‰Ð¾ Ð²Ñ–Ð½ Ñ” Ð·Ð²Ð¾Ñ€Ð¾Ñ‚Ð½Ð¸Ð¼ Ð´Ñ–Ñ”ÑÐ»Ð¾Ð²Ð¾Ð¼\n   > Ð’Ð¸Ð´ Ð´Ñ–Ñ”Ð¿Ñ€Ð¸ÑÐ»Ñ–Ð²Ð½Ð¸ÐºÐ° Ð·Ð°Ð»ÐµÐ¶Ð¸Ñ‚ÑŒ Ð²Ñ–Ð´ Ð²Ð¸Ð´Ñƒ Ð´Ñ–Ñ”ÑÐ»Ð¾Ð²Ð°, Ð²Ñ–Ð´ ÑÐºÐ¾Ð³Ð¾ Ð²Ñ–Ð½ ÑƒÑ‚Ð²Ð¾Ñ€ÐµÐ½Ð¸Ð¹.\n\n9. Ð¯ÐºÑƒ ÑÐ¸Ð½Ñ‚Ð°ÐºÑÐ¸Ñ‡Ð½Ñƒ Ð¿Ð¾Ð·Ð¸Ñ†Ñ–ÑŽ Ð¼Ð¾Ð¶Ðµ Ð·Ð°Ð¹Ð¼Ð°Ñ‚Ð¸ Ð´Ñ–Ñ”Ð¿Ñ€Ð¸ÑÐ»Ñ–Ð²Ð½Ð¸ÐºÐ¾Ð²Ð° ÐºÐ¾Ð½ÑÑ‚Ñ€ÑƒÐºÑ†Ñ–Ñ Â«Ñ‡Ð¸Ñ‚Ð°ÑŽÑ‡Ð¸ ÐºÐ½Ð¸Ð³ÑƒÂ» Ð² ÑƒÐºÑ€Ð°Ñ—Ð½ÑÑŒÐºÐ¾Ð¼Ñƒ Ñ€ÐµÑ‡ÐµÐ½Ð½Ñ–?\n   - [x] ÐÐ° Ð¿Ð¾Ñ‡Ð°Ñ‚ÐºÑƒ, Ð² ÑÐµÑ€ÐµÐ´Ð¸Ð½Ñ– Ð°Ð±Ð¾ Ð² ÐºÑ–Ð½Ñ†Ñ– Ñ€ÐµÑ‡ÐµÐ½Ð½Ñ\n   - [ ] Ð¢Ñ–Ð»ÑŒÐºÐ¸ Ð½Ð° Ð¿Ð¾Ñ‡Ð°Ñ‚ÐºÑƒ Ñ€ÐµÑ‡ÐµÐ½Ð½Ñ\n   - [ ] Ð¢Ñ–Ð»ÑŒÐºÐ¸ Ð² ÐºÑ–Ð½Ñ†Ñ– Ñ€ÐµÑ‡ÐµÐ½Ð½Ñ\n   - [ ] Ð¢Ñ–Ð»ÑŒÐºÐ¸ Ð² ÑÐµÑ€ÐµÐ´Ð¸Ð½Ñ– Ñ€ÐµÑ‡ÐµÐ½Ð½Ñ\n   > Ð”Ñ–Ñ”Ð¿Ñ€Ð¸ÑÐ»Ñ–Ð²Ð½Ð¸ÐºÐ¾Ð²Ð° ÐºÐ¾Ð½ÑÑ‚Ñ€ÑƒÐºÑ†Ñ–Ñ Ð¼Ð¾Ð¶Ðµ ÑÑ‚Ð¾ÑÑ‚Ð¸ Ð² Ð±ÑƒÐ´ÑŒ-ÑÐºÑ–Ð¹ Ð¿Ð¾Ð·Ð¸Ñ†Ñ–Ñ— Ð² Ñ€ÐµÑ‡ÐµÐ½Ð½Ñ–.\n\n10. Ð¯ÐºÐ¸Ð¹ Ð´Ñ–Ñ”Ð¿Ñ€Ð¸ÑÐ»Ñ–Ð²Ð½Ð¸Ðº Ð½ÐµÐ´Ð¾ÐºÐ¾Ð½Ð°Ð½Ð¾Ð³Ð¾ Ð²Ð¸Ð´Ñƒ Ð¿Ñ€Ð°Ð²Ð¸Ð»ÑŒÐ½Ð¾ ÑƒÑ‚Ð²Ð¾Ñ€ÐµÐ½Ð¾ Ð²Ñ–Ð´ Ð·Ð²Ð¾Ñ€Ð¾Ñ‚Ð½Ð¾Ð³Ð¾ Ð´Ñ–Ñ”ÑÐ»Ð¾Ð²Ð° Â«Ð´Ð¸Ð²Ð¸Ñ‚Ð¸ÑÑÂ» Ð² ÑÑƒÑ‡Ð°ÑÐ½Ñ–Ð¹ ÑƒÐºÑ€Ð°Ñ—Ð½ÑÑŒÐºÑ–Ð¹ Ð¼Ð¾Ð²Ñ–?\n    - [x] Ð´Ð¸Ð²Ð»ÑÑ‡Ð¸ÑÑŒ\n    - [ ] Ð´Ð¸Ð²Ð»ÑÑ‡Ð¸\n    - [ ] Ð´Ð¸Ð²Ð¸Ð²ÑˆÐ¸ÑÑŒ\n    - [ ] Ð´Ð¸Ð²Ð¸Ñ‚Ð¸ÑÑŒ\n    > Ð’Ñ–Ð´ Ð¾ÑÐ½Ð¾Ð²Ð¸ Â«Ð´Ð¸Ð²Ð»-Â» (Ñ Ð´Ð¸Ð²Ð»ÑŽÑÑ) + -ÑÑ‡Ð¸ + -ÑÑŒ = Ð´Ð¸Ð²Ð»ÑÑ‡Ð¸ÑÑŒ.\n\n11. Ð§Ð¾Ð¼Ñƒ Ð² Ñ€ÐµÑ‡ÐµÐ½Ð½Ñ– Â«ÐŸÐ¾Ð²ÐµÑ€Ñ‚Ð°ÑŽÑ‡Ð¸ÑÑŒ Ð´Ð¾Ð´Ð¾Ð¼Ñƒ, Ð²Ñ–Ð½ ÐºÑƒÐ¿Ð¸Ð² Ñ…Ð»Ñ–Ð±Ð°Â» Ð´Ñ–Ñ”Ð¿Ñ€Ð¸ÑÐ»Ñ–Ð²Ð½Ð¸Ðº Ð²Ð¸Ñ€Ð°Ð¶Ð°Ñ” Ð¾Ð´Ð½Ð¾Ñ‡Ð°ÑÐ½Ñ–ÑÑ‚ÑŒ Ð´Ñ–Ð¹?\n    - [x] Ð¢Ð¾Ð¼Ñƒ Ñ‰Ð¾ ÐºÑƒÐ¿Ñ–Ð²Ð»Ñ Ð²Ñ–Ð´Ð±ÑƒÐ»Ð°ÑÑ Ð¿Ñ–Ð´ Ñ‡Ð°Ñ Ð¿Ð¾Ð²ÐµÑ€Ð½ÐµÐ½Ð½Ñ Ð´Ð¾Ð´Ð¾Ð¼Ñƒ\n    - [ ] Ð¢Ð¾Ð¼Ñƒ Ñ‰Ð¾ ÐºÑƒÐ¿Ñ–Ð²Ð»Ñ Ð²Ñ–Ð´Ð±ÑƒÐ»Ð°ÑÑ Ð´Ð¾ Ð¿Ð¾Ð²ÐµÑ€Ð½ÐµÐ½Ð½Ñ Ð´Ð¾Ð´Ð¾Ð¼Ñƒ\n    - [ ] Ð¢Ð¾Ð¼Ñƒ Ñ‰Ð¾ ÐºÑƒÐ¿Ñ–Ð²Ð»Ñ Ð²Ñ–Ð´Ð±ÑƒÐ»Ð°ÑÑ Ð¿Ñ–ÑÐ»Ñ Ð¿Ð¾Ð²ÐµÑ€Ð½ÐµÐ½Ð½Ñ Ð´Ð¾Ð´Ð¾Ð¼Ñƒ\n    - [ ] Ð¢Ð¾Ð¼Ñƒ Ñ‰Ð¾ ÐºÑƒÐ¿Ñ–Ð²Ð»Ñ Ñ– Ð¿Ð¾Ð²ÐµÑ€Ð½ÐµÐ½Ð½Ñ Ð½Ðµ Ð¿Ð¾Ð²'ÑÐ·Ð°Ð½Ñ–\n    > Ð”Ñ–Ñ”Ð¿Ñ€Ð¸ÑÐ»Ñ–Ð²Ð½Ð¸Ðº ÐÐ”Ð’ Ð¿Ð¾ÐºÐ°Ð·ÑƒÑ”, Ñ‰Ð¾ Ð´Ñ–Ñ Ð²Ñ–Ð´Ð±ÑƒÐ²Ð°Ð»Ð°ÑÑ Ð¾Ð´Ð½Ð¾Ñ‡Ð°ÑÐ½Ð¾ Ð· Ð¾ÑÐ½Ð¾Ð²Ð½Ð¾ÑŽ.\n\n12. Ð¯ÐºÐ¸Ð¹ ÑÑƒÑ„Ñ–ÐºÑ Ð²Ð¸ÐºÐ¾Ñ€Ð¸ÑÑ‚Ð¾Ð²ÑƒÑ”Ñ‚ÑŒÑÑ Ð´Ð»Ñ ÑƒÑ‚Ð²Ð¾Ñ€ÐµÐ½Ð½Ñ Ð´Ñ–Ñ”Ð¿Ñ€Ð¸ÑÐ»Ñ–Ð²Ð½Ð¸ÐºÐ° Ð²Ñ–Ð´ Ð´Ñ–Ñ”ÑÐ»Ð¾Ð²Ð° Â«ÑÐ¸Ð´Ñ–Ñ‚Ð¸Â» Ð² ÑƒÐºÑ€Ð°Ñ—Ð½ÑÑŒÐºÑ–Ð¹ Ð¼Ð¾Ð²Ñ–?\n    - [x] -ÑÑ‡Ð¸ (ÑÐ¸Ð´ÑÑ‡Ð¸)\n    - [ ] -ÑŽÑ‡Ð¸ (ÑÐ¸Ð´ÑŽÑ‡Ð¸)\n    - [ ] -Ð°Ñ‡Ð¸ (ÑÐ¸Ð´Ð°Ñ‡Ð¸)\n    - [ ] -Ð²ÑˆÐ¸ (ÑÐ¸Ð´Ñ–Ð²ÑˆÐ¸)\n    > Ð’Ñ–Ð´ Ð¾ÑÐ½Ð¾Ð²Ð¸ Â«ÑÐ¸Ð´-Â» + ÑÑƒÑ„Ñ–ÐºÑ -ÑÑ‡Ð¸ = ÑÐ¸Ð´ÑÑ‡Ð¸.\n\n13. Ð¯ÐºÑƒ ÑÑ‚Ð¸Ð»Ñ–ÑÑ‚Ð¸Ñ‡Ð½Ñƒ Ñ„ÑƒÐ½ÐºÑ†Ñ–ÑŽ Ð²Ð¸ÐºÐ¾Ð½ÑƒÑŽÑ‚ÑŒ Ð´Ñ–Ñ”Ð¿Ñ€Ð¸ÑÐ»Ñ–Ð²Ð½Ð¸ÐºÐ¸ Ð½ÐµÐ´Ð¾ÐºÐ¾Ð½Ð°Ð½Ð¾Ð³Ð¾ Ð²Ð¸Ð´Ñƒ Ñƒ ÑÑƒÑ‡Ð°ÑÐ½Ñ–Ð¹ ÑƒÐºÑ€Ð°Ñ—Ð½ÑÑŒÐºÑ–Ð¹ Ð»Ñ–Ñ‚ÐµÑ€Ð°Ñ‚ÑƒÑ€Ñ–, Ð¶ÑƒÑ€Ð½Ð°Ð»Ñ–ÑÑ‚Ð¸Ñ†Ñ– Ñ‚Ð° Ð¿ÑƒÐ±Ð»Ñ–Ñ†Ð¸ÑÑ‚Ð¸Ñ†Ñ–?\n    - [x] Ð’Ð¾Ð½Ð¸ Ñ€Ð¾Ð±Ð»ÑÑ‚ÑŒ Ñ‚ÐµÐºÑÑ‚ Ð±Ñ–Ð»ÑŒÑˆ Ð´Ð¸Ð½Ð°Ð¼Ñ–Ñ‡Ð½Ð¸Ð¼ Ñ– ÑÑ‚Ð¸ÑÐ»Ð¸Ð¼\n    - [ ] Ð’Ð¾Ð½Ð¸ Ñ” Ð·Ð°ÑÑ‚Ð°Ñ€Ñ–Ð»Ð¾ÑŽ Ñ„Ð¾Ñ€Ð¼Ð¾ÑŽ Ñ– Ð½Ðµ Ð²Ð¸ÐºÐ¾Ñ€Ð¸ÑÑ‚Ð¾Ð²ÑƒÑŽÑ‚ÑŒÑÑ\n    - [ ] Ð’Ð¾Ð½Ð¸ Ð²Ð¸ÐºÐ¾Ñ€Ð¸ÑÑ‚Ð¾Ð²ÑƒÑŽÑ‚ÑŒÑÑ Ñ‚Ñ–Ð»ÑŒÐºÐ¸ Ð² Ñ€Ð¾Ð·Ð¼Ð¾Ð²Ð½Ñ–Ð¹ Ð¼Ð¾Ð²Ñ–\n    - [ ] Ð’Ð¾Ð½Ð¸ Ð²Ð¶Ð¸Ð²Ð°ÑŽÑ‚ÑŒÑÑ Ñ‚Ñ–Ð»ÑŒÐºÐ¸ Ð² ÑŽÑ€Ð¸Ð´Ð¸Ñ‡Ð½Ð¸Ñ… Ð´Ð¾ÐºÑƒÐ¼ÐµÐ½Ñ‚Ð°Ñ…\n    > Ð”Ñ–Ñ”Ð¿Ñ€Ð¸ÑÐ»Ñ–Ð²Ð½Ð¸ÐºÐ¸ Ð°ÐºÑ‚Ð¸Ð²Ð½Ð¾ Ð²Ð¶Ð¸Ð²Ð°ÑŽÑ‚ÑŒÑÑ Ð² ÑÑƒÑ‡Ð°ÑÐ½Ñ–Ð¹ Ð¼Ð¾Ð²Ñ– Ñ– Ñ€Ð¾Ð±Ð»ÑÑ‚ÑŒ Ñ‚ÐµÐºÑÑ‚ Ð²Ð¸Ñ€Ð°Ð·Ð½Ñ–ÑˆÐ¸Ð¼.\n\n14. Ð§Ð¾Ð¼Ñƒ Ð²Ñ–Ð´ Ð´Ñ–Ñ”ÑÐ»Ð¾Ð²Ð° Â«ÑÐ¿Ð°Ñ‚Ð¸Â» Ð²Ð°Ð¶ÐºÐ¾ ÑƒÑ‚Ð²Ð¾Ñ€Ð¸Ñ‚Ð¸ Ð¿Ñ€Ð¸Ñ€Ð¾Ð´Ð½Ð¸Ð¹ Ñ‚Ð° Ð¼Ð¸Ð»Ð¾Ð·Ð²ÑƒÑ‡Ð½Ð¸Ð¹ Ð´Ñ–Ñ”Ð¿Ñ€Ð¸ÑÐ»Ñ–Ð²Ð½Ð¸Ðº Ð½ÐµÐ´Ð¾ÐºÐ¾Ð½Ð°Ð½Ð¾Ð³Ð¾ Ð²Ð¸Ð´Ñƒ Ð² ÑƒÐºÑ€Ð°Ñ—Ð½ÑÑŒÐºÑ–Ð¹ Ð¼Ð¾Ð²Ñ–?\n    - [x] Ð¢Ð¾Ð¼Ñƒ Ñ‰Ð¾ Ð½Ðµ Ð²ÑÑ– Ð´Ñ–Ñ”ÑÐ»Ð¾Ð²Ð° Ð»ÐµÐ³ÐºÐ¾ ÑƒÑ‚Ð²Ð¾Ñ€ÑŽÑŽÑ‚ÑŒ Ð´Ñ–Ñ”Ð¿Ñ€Ð¸ÑÐ»Ñ–Ð²Ð½Ð¸ÐºÐ¾Ð²Ñ– Ñ„Ð¾Ñ€Ð¼Ð¸\n    - [ ] Ð¢Ð¾Ð¼Ñƒ Ñ‰Ð¾ Â«ÑÐ¿Ð°Ñ‚Ð¸Â» â€” Ð·Ð²Ð¾Ñ€Ð¾Ñ‚Ð½Ðµ Ð´Ñ–Ñ”ÑÐ»Ð¾Ð²Ð¾\n    - [ ] Ð¢Ð¾Ð¼Ñƒ Ñ‰Ð¾ Â«ÑÐ¿Ð°Ñ‚Ð¸Â» â€” Ð´Ñ–Ñ”ÑÐ»Ð¾Ð²Ð¾ Ð´Ð¾ÐºÐ¾Ð½Ð°Ð½Ð¾Ð³Ð¾ Ð²Ð¸Ð´Ñƒ\n    - [ ] Ð¢Ð¾Ð¼Ñƒ Ñ‰Ð¾ Â«ÑÐ¿Ð°Ñ‚Ð¸Â» â€” Ð½ÐµÐ¿ÐµÑ€ÐµÑ…Ñ–Ð´Ð½Ðµ Ð´Ñ–Ñ”ÑÐ»Ð¾Ð²Ð¾\n    > Ð”ÐµÑÐºÑ– Ð´Ñ–Ñ”ÑÐ»Ð¾Ð²Ð° Ð½Ðµ Ð¼Ð°ÑŽÑ‚ÑŒ Ð¿Ñ€Ð¸Ñ€Ð¾Ð´Ð½Ð¸Ñ… Ð´Ñ–Ñ”Ð¿Ñ€Ð¸ÑÐ»Ñ–Ð²Ð½Ð¸ÐºÐ¾Ð²Ð¸Ñ… Ñ„Ð¾Ñ€Ð¼ Ñƒ Ð¼Ð¾Ð²Ð»ÐµÐ½Ð½Ñ–.\n\n## match-up: Ð†Ð½Ñ„Ñ–Ð½Ñ–Ñ‚Ð¸Ð² Ñ‚Ð° Ð²Ñ–Ð´Ð¿Ð¾Ð²Ñ–Ð´Ð½Ð¸Ð¹ Ð´Ñ–Ñ”Ð¿Ñ€Ð¸ÑÐ»Ñ–Ð²Ð½Ð¸Ðº\n\n> Ð—Ð½Ð°Ð¹Ð´Ñ–Ñ‚ÑŒ Ð¿Ñ€Ð°Ð²Ð¸Ð»ÑŒÐ½Ñ– Ð¿Ð°Ñ€Ð¸: Ð´Ñ–Ñ”ÑÐ»Ð¾Ð²Ð¾ Ñ‚Ð° Ð¹Ð¾Ð³Ð¾ Ð´Ñ–Ñ”Ð¿Ñ€Ð¸ÑÐ»Ñ–Ð²Ð½Ð¸Ðº Ð½ÐµÐ´Ð¾ÐºÐ¾Ð½Ð°Ð½Ð¾Ð³Ð¾ Ð²Ð¸Ð´Ñƒ.\n\n- Ñ‡Ð¸Ñ‚Ð°Ñ‚Ð¸ :: Ñ‡Ð¸Ñ‚Ð°ÑŽÑ‡Ð¸\n- Ð¿Ð¸ÑÐ°Ñ‚Ð¸ :: Ð¿Ð¸ÑˆÑƒÑ‡Ð¸\n- Ð¹Ñ‚Ð¸ :: Ð¹Ð´ÑƒÑ‡Ð¸\n- Ð±Ñ–Ð³Ñ‚Ð¸ :: Ð±Ñ–Ð¶Ð°Ñ‡Ð¸\n- Ð³Ð¾Ð²Ð¾Ñ€Ð¸Ñ‚Ð¸ :: Ð³Ð¾Ð²Ð¾Ñ€ÑÑ‡Ð¸\n- ÑÐ»ÑƒÑ…Ð°Ñ‚Ð¸ :: ÑÐ»ÑƒÑ…Ð°ÑŽÑ‡Ð¸\n- ÑÐ¸Ð´Ñ–Ñ‚Ð¸ :: ÑÐ¸Ð´ÑÑ‡Ð¸\n- ÑÑ‚Ð¾ÑÑ‚Ð¸ :: ÑÑ‚Ð¾ÑÑ‡Ð¸\n- Ð´Ð¸Ð²Ð¸Ñ‚Ð¸ÑÑ :: Ð´Ð¸Ð²Ð»ÑÑ‡Ð¸ÑÑŒ\n- Ð²Ð¼Ð¸Ð²Ð°Ñ‚Ð¸ÑÑ :: Ð²Ð¼Ð¸Ð²Ð°ÑŽÑ‡Ð¸ÑÑŒ\n- Ð¾Ð´ÑÐ³Ð°Ñ‚Ð¸ÑÑ :: Ð¾Ð´ÑÐ³Ð°ÑŽÑ‡Ð¸ÑÑŒ\n- Ð¿Ð¾Ð²ÐµÑ€Ñ‚Ð°Ñ‚Ð¸ÑÑ :: Ð¿Ð¾Ð²ÐµÑ€Ñ‚Ð°ÑŽÑ‡Ð¸ÑÑŒ\n- Ð³Ð¾Ñ‚ÑƒÐ²Ð°Ñ‚Ð¸ÑÑ :: Ð³Ð¾Ñ‚ÑƒÑŽÑ‡Ð¸ÑÑŒ\n- Ð½ÐµÑÑ‚Ð¸ :: Ð½ÐµÑÑƒÑ‡Ð¸\n\n## fill-in: Ð£Ñ‚Ð²Ð¾Ñ€ÐµÐ½Ð½Ñ Ð´Ñ–Ñ”Ð¿Ñ€Ð¸ÑÐ»Ñ–Ð²Ð½Ð¸ÐºÑ–Ð² Ð½ÐµÐ´Ð¾ÐºÐ¾Ð½Ð°Ð½Ð¾Ð³Ð¾ Ð²Ð¸Ð´Ñƒ\n> Ð—Ð°Ð¿Ð¾Ð²Ð½Ñ–Ñ‚ÑŒ Ð¿Ñ€Ð¾Ð¿ÑƒÑÐºÐ¸ Ð¿Ñ€Ð°Ð²Ð¸Ð»ÑŒÐ½Ð¾ÑŽ Ñ„Ð¾Ñ€Ð¼Ð¾ÑŽ Ð´Ñ–Ñ”Ð¿Ñ€Ð¸ÑÐ»Ñ–Ð²Ð½Ð¸ÐºÐ° Ð½ÐµÐ´Ð¾ÐºÐ¾Ð½Ð°Ð½Ð¾Ð³Ð¾ Ð²Ð¸Ð´Ñƒ Ð²Ñ–Ð´ Ð´Ñ–Ñ”ÑÐ»Ð¾Ð²Ð° Ð² Ð´ÑƒÐ¶ÐºÐ°Ñ….\n\n1. ___ (Ñ‡Ð¸Ñ‚Ð°Ñ‚Ð¸) Ð³Ð°Ð·ÐµÑ‚Ñƒ, Ð±Ð°Ñ‚ÑŒÐºÐ¾ ÑÐ½Ñ–Ð´Ð°Ð² Ð½Ð° ÐºÑƒÑ…Ð½Ñ–.\n   > [!answer] Ð§Ð¸Ñ‚Ð°ÑŽÑ‡Ð¸\n   > [!options] Ð§Ð¸Ñ‚Ð°ÑŽÑ‡Ð¸ | Ð§Ð¸Ñ‚Ð°Ð²ÑˆÐ¸ | ÐŸÑ€Ð¾Ñ‡Ð¸Ñ‚Ð°Ð²ÑˆÐ¸ | Ð§Ð¸Ñ‚Ð°ÑŽÐ²ÑˆÐ¸\n   > Ð”Ñ–Ñ”Ð¿Ñ€Ð¸ÑÐ»Ñ–Ð²Ð½Ð¸Ðº ÐÐ”Ð’ Ð²Ñ–Ð´ Â«Ñ‡Ð¸Ñ‚Ð°Ñ‚Ð¸Â» â€” Â«Ñ‡Ð¸Ñ‚Ð°ÑŽÑ‡Ð¸Â».\n\n2. ___ (ÑÐ»ÑƒÑ…Ð°Ñ‚Ð¸) Ð¼ÑƒÐ·Ð¸ÐºÑƒ, Ð²Ð¾Ð½Ð° Ñ€Ð¾Ð±Ð¸Ð»Ð° Ð´Ð¾Ð¼Ð°ÑˆÐ½Ñ” Ð·Ð°Ð²Ð´Ð°Ð½Ð½Ñ.\n   > [!answer] Ð¡Ð»ÑƒÑ…Ð°ÑŽÑ‡Ð¸\n   > [!options] Ð¡Ð»ÑƒÑ…Ð°ÑŽÑ‡Ð¸ | Ð¡Ð»ÑƒÑ…Ð°Ð²ÑˆÐ¸ | ÐŸÐ¾ÑÐ»ÑƒÑ…Ð°Ð²ÑˆÐ¸ | Ð¡Ð»ÑƒÑ…Ð°ÑŽÐ²ÑˆÐ¸\n   > Ð”Ñ–Ñ”Ð¿Ñ€Ð¸ÑÐ»Ñ–Ð²Ð½Ð¸Ðº ÐÐ”Ð’ Ð²Ñ–Ð´ Â«ÑÐ»ÑƒÑ…Ð°Ñ‚Ð¸Â» â€” Â«ÑÐ»ÑƒÑ…Ð°ÑŽÑ‡Ð¸Â».\n\n3. ___ (Ð¹Ñ‚Ð¸) Ð²ÑƒÐ»Ð¸Ñ†ÐµÑŽ, Ñ Ð·ÑƒÑÑ‚Ñ€Ñ–Ð² ÑÐ²Ð¾Ð³Ð¾ ÑÑ‚Ð°Ñ€Ð¾Ð³Ð¾ Ð´Ñ€ÑƒÐ³Ð°.\n   > [!answer] Ð™Ð´ÑƒÑ‡Ð¸\n   > [!options] Ð™Ð´ÑƒÑ‡Ð¸ | ÐŸÑ–ÑˆÐ¾Ð²ÑˆÐ¸ | Ð™Ð´Ñ–Ð²ÑˆÐ¸ | Ð™ÑˆÐ¾Ð²ÑˆÐ¸\n   > Ð”Ñ–Ñ”Ð¿Ñ€Ð¸ÑÐ»Ñ–Ð²Ð½Ð¸Ðº ÐÐ”Ð’ Ð²Ñ–Ð´ Â«Ð¹Ñ‚Ð¸Â» â€” Â«Ð¹Ð´ÑƒÑ‡Ð¸Â».\n\n4. ___ (Ð±Ñ–Ð³Ñ‚Ð¸) Ð´Ð¾ Ð°Ð²Ñ‚Ð¾Ð±ÑƒÑÐ°, Ð²Ñ–Ð½ Ð·Ð°Ð³ÑƒÐ±Ð¸Ð² ÐºÐ»ÑŽÑ‡Ñ–.\n   > [!answer] Ð‘Ñ–Ð¶Ð°Ñ‡Ð¸\n   > [!options] Ð‘Ñ–Ð¶Ð°Ñ‡Ð¸ | Ð‘Ñ–Ð³ÑƒÑ‡Ð¸ | ÐŸÐ¾Ð±Ñ–Ð³ÑˆÐ¸ | Ð‘Ñ–Ð³Ð°ÑŽÑ‡Ð¸\n   > Ð”Ñ–Ñ”Ð¿Ñ€Ð¸ÑÐ»Ñ–Ð²Ð½Ð¸Ðº ÐÐ”Ð’ Ð²Ñ–Ð´ Â«Ð±Ñ–Ð³Ñ‚Ð¸Â» â€” Â«Ð±Ñ–Ð¶Ð°Ñ‡Ð¸Â» (Ð²Ñ–Ð´ Ð¾ÑÐ½Ð¾Ð²Ð¸ Â«Ð±Ñ–Ð¶-Â»).\n\n5. ___ (Ð³Ð¾Ð²Ð¾Ñ€Ð¸Ñ‚Ð¸) Ð¿Ð¾ Ñ‚ÐµÐ»ÐµÑ„Ð¾Ð½Ñƒ, Ð²Ð¾Ð½Ð° Ð³Ð¾Ñ‚ÑƒÐ²Ð°Ð»Ð° Ð²ÐµÑ‡ÐµÑ€ÑŽ.\n   > [!answer] Ð“Ð¾Ð²Ð¾Ñ€ÑÑ‡Ð¸\n   > [!options] Ð“Ð¾Ð²Ð¾Ñ€ÑÑ‡Ð¸ | Ð“Ð¾Ð²Ð¾Ñ€ÑŽÑ‡Ð¸ | ÐŸÐ¾Ð³Ð¾Ð²Ð¾Ñ€Ð¸Ð²ÑˆÐ¸ | Ð“Ð¾Ð²Ð¾Ñ€Ñ–Ð²ÑˆÐ¸\n   > Ð”Ñ–Ñ”Ð¿Ñ€Ð¸ÑÐ»Ñ–Ð²Ð½Ð¸Ðº ÐÐ”Ð’ Ð²Ñ–Ð´ Â«Ð³Ð¾Ð²Ð¾Ñ€Ð¸Ñ‚Ð¸Â» â€” Â«Ð³Ð¾Ð²Ð¾Ñ€ÑÑ‡Ð¸Â».\n\n6. ___ (ÑÐ¸Ð´Ñ–Ñ‚Ð¸) Ð² Ð¿Ð°Ñ€ÐºÑƒ, Ð´Ñ–Ñ‚Ð¸ Ð³Ñ€Ð°Ð»Ð¸ÑÑ Ð· Ð¼'ÑÑ‡ÐµÐ¼.\n   > [!answer] Ð¡Ð¸Ð´ÑÑ‡Ð¸\n   > [!options] Ð¡Ð¸Ð´ÑÑ‡Ð¸ | Ð¡Ð¸Ð´Ñ–ÑŽÑ‡Ð¸ | ÐŸÐ¾ÑÐ¸Ð´Ñ–Ð²ÑˆÐ¸ | Ð¡Ð¸Ð´Ñ–Ð²ÑˆÐ¸\n   > Ð”Ñ–Ñ”Ð¿Ñ€Ð¸ÑÐ»Ñ–Ð²Ð½Ð¸Ðº ÐÐ”Ð’ Ð²Ñ–Ð´ Â«ÑÐ¸Ð´Ñ–Ñ‚Ð¸Â» â€” Â«ÑÐ¸Ð´ÑÑ‡Ð¸Â».\n\n7. ___ (Ð¿Ð¸ÑÐ°Ñ‚Ð¸) Ð»Ð¸ÑÑ‚Ð°, Ð²Ñ–Ð½ Ð´ÑƒÐ¼Ð°Ð² Ð¿Ñ€Ð¾ ÑÐ²Ð¾ÑŽ ÑÑ–Ð¼'ÑŽ.\n   > [!answer] ÐŸÐ¸ÑˆÑƒÑ‡Ð¸\n   > [!options] ÐŸÐ¸ÑˆÑƒÑ‡Ð¸ | ÐŸÐ¸ÑÐ°ÑŽÑ‡Ð¸ | ÐÐ°Ð¿Ð¸ÑÐ°Ð²ÑˆÐ¸ | ÐŸÐ¸ÑÐ°Ð²ÑˆÐ¸\n   > Ð”Ñ–Ñ”Ð¿Ñ€Ð¸ÑÐ»Ñ–Ð²Ð½Ð¸Ðº ÐÐ”Ð’ Ð²Ñ–Ð´ Â«Ð¿Ð¸ÑÐ°Ñ‚Ð¸Â» â€” Â«Ð¿Ð¸ÑˆÑƒÑ‡Ð¸Â» (Ð²Ñ–Ð´ Ð¾ÑÐ½Ð¾Ð²Ð¸ Â«Ð¿Ð¸Ñˆ-Â»).\n\n8. ___ (Ð´Ð¸Ð²Ð¸Ñ‚Ð¸ÑÑ) Ñƒ Ð²Ñ–ÐºÐ½Ð¾, Ð±Ð°Ð±ÑƒÑÑ Ñ‡ÐµÐºÐ°Ð»Ð° Ð½Ð° Ð¾Ð½ÑƒÐºÑ–Ð².\n   > [!answer] Ð”Ð¸Ð²Ð»ÑÑ‡Ð¸ÑÑŒ\n   > [!options] Ð”Ð¸Ð²Ð»ÑÑ‡Ð¸ÑÑŒ | Ð”Ð¸Ð²Ð»ÑŽÑ‡Ð¸ÑÑŒ | ÐŸÐ¾Ð´Ð¸Ð²Ð¸Ð²ÑˆÐ¸ÑÑŒ | Ð”Ð¸Ð²Ð»ÑÑ‡Ð¸ÑÑ\n   > Ð”Ñ–Ñ”Ð¿Ñ€Ð¸ÑÐ»Ñ–Ð²Ð½Ð¸Ðº ÐÐ”Ð’ Ð²Ñ–Ð´ Ð·Ð²Ð¾Ñ€Ð¾Ñ‚Ð½Ð¾Ð³Ð¾ Â«Ð´Ð¸Ð²Ð¸Ñ‚Ð¸ÑÑÂ» â€” Â«Ð´Ð¸Ð²Ð»ÑÑ‡Ð¸ÑÑŒÂ».\n\n9. ___ (Ð¿Ð¾Ð²ÐµÑ€Ñ‚Ð°Ñ‚Ð¸ÑÑ) Ð· Ñ€Ð¾Ð±Ð¾Ñ‚Ð¸, Ð²Ñ–Ð½ Ð·Ð°Ð²Ð¶Ð´Ð¸ ÐºÑƒÐ¿ÑƒÐ²Ð°Ð² Ñ…Ð»Ñ–Ð±.\n   > [!answer] ÐŸÐ¾Ð²ÐµÑ€Ñ‚Ð°ÑŽÑ‡Ð¸ÑÑŒ\n   > [!options] ÐŸÐ¾Ð²ÐµÑ€Ñ‚Ð°ÑŽÑ‡Ð¸ÑÑŒ | ÐŸÐ¾Ð²ÐµÑ€Ð½ÑƒÐ²ÑˆÐ¸ÑÑŒ | ÐŸÐ¾Ð²ÐµÑ€Ñ‚ÑƒÐ²ÑˆÐ¸ÑÑŒ | ÐŸÐ¾Ð²ÐµÑ€Ñ‚Ð°ÑŽÑ‡Ð¸ÑÑ\n   > Ð”Ñ–Ñ”Ð¿Ñ€Ð¸ÑÐ»Ñ–Ð²Ð½Ð¸Ðº ÐÐ”Ð’ Ð²Ñ–Ð´ Â«Ð¿Ð¾Ð²ÐµÑ€Ñ‚Ð°Ñ‚Ð¸ÑÑÂ» â€” Â«Ð¿Ð¾Ð²ÐµÑ€Ñ‚Ð°ÑŽÑ‡Ð¸ÑÑŒÂ».\n\n10. ___ (Ð³Ð¾Ñ‚ÑƒÐ²Ð°Ñ‚Ð¸ÑÑ) Ð´Ð¾ Ñ–ÑÐ¿Ð¸Ñ‚Ñƒ, ÑÑ‚ÑƒÐ´ÐµÐ½Ñ‚Ð¸ Ð½Ðµ ÑÐ¿Ð°Ð»Ð¸ Ð²ÑÑŽ Ð½Ñ–Ñ‡.\n    > [!answer] Ð“Ð¾Ñ‚ÑƒÑŽÑ‡Ð¸ÑÑŒ\n    > [!options] Ð“Ð¾Ñ‚ÑƒÑŽÑ‡Ð¸ÑÑŒ | ÐŸÑ€Ð¸Ð³Ð¾Ñ‚ÑƒÐ²Ð°Ð²ÑˆÐ¸ÑÑŒ | Ð“Ð¾Ñ‚Ð¾Ð²Ð¸Ð²ÑˆÐ¸ÑÑŒ | Ð“Ð¾Ñ‚ÑƒÑŽÑ‡Ð¸ÑÑ\n    > Ð”Ñ–Ñ”Ð¿Ñ€Ð¸ÑÐ»Ñ–Ð²Ð½Ð¸Ðº ÐÐ”Ð’ Ð²Ñ–Ð´ Â«Ð³Ð¾Ñ‚ÑƒÐ²Ð°Ñ‚Ð¸ÑÑÂ» â€” Â«Ð³Ð¾Ñ‚ÑƒÑŽÑ‡Ð¸ÑÑŒÂ».\n\n11. ___ (Ð½ÐµÑÑ‚Ð¸) Ð²Ð°Ð¶ÐºÑ– ÑÑƒÐ¼ÐºÐ¸, Ð¼Ð°Ð¼Ð° Ð¹ÑˆÐ»Ð° Ð´Ð¾ Ð´Ð¾Ð¼Ñƒ.\n    > [!answer] ÐÐµÑÑƒÑ‡Ð¸\n    > [!options] ÐÐµÑÑƒÑ‡Ð¸ | ÐÐµÑÑÑ‡Ð¸ | ÐŸÑ€Ð¸Ð½Ñ–ÑÑˆÐ¸ | ÐÐµÑÑ–Ð²ÑˆÐ¸\n    > Ð”Ñ–Ñ”Ð¿Ñ€Ð¸ÑÐ»Ñ–Ð²Ð½Ð¸Ðº ÐÐ”Ð’ Ð²Ñ–Ð´ Â«Ð½ÐµÑÑ‚Ð¸Â» â€” Â«Ð½ÐµÑÑƒÑ‡Ð¸Â».\n\n12. ___ (ÑÑ‚Ð¾ÑÑ‚Ð¸) Ð² Ñ‡ÐµÑ€Ð·Ñ–, Ð»ÑŽÐ´Ð¸ Ñ€Ð¾Ð·Ð¼Ð¾Ð²Ð»ÑÐ»Ð¸ Ð¿Ñ€Ð¾ Ð¿Ð¾Ð³Ð¾Ð´Ñƒ.\n    > [!answer] Ð¡Ñ‚Ð¾ÑÑ‡Ð¸\n    > [!options] Ð¡Ñ‚Ð¾ÑÑ‡Ð¸ | Ð¡Ñ‚Ð¾ÑŽÑ‡Ð¸ | ÐŸÐ¾ÑÑ‚Ð¾ÑÐ²ÑˆÐ¸ | Ð¡Ñ‚Ð¾ÑÑŽÑ‡Ð¸\n    > Ð”Ñ–Ñ”Ð¿Ñ€Ð¸ÑÐ»Ñ–Ð²Ð½Ð¸Ðº ÐÐ”Ð’ Ð²Ñ–Ð´ Â«ÑÑ‚Ð¾ÑÑ‚Ð¸Â» â€” Â«ÑÑ‚Ð¾ÑÑ‡Ð¸Â».\n\n13. ___ (Ð²Ð¼Ð¸Ð²Ð°Ñ‚Ð¸ÑÑ) Ñ…Ð¾Ð»Ð¾Ð´Ð½Ð¾ÑŽ Ð²Ð¾Ð´Ð¾ÑŽ, Ð²Ñ–Ð½ Ð¿Ñ€Ð¾ÐºÐ¸Ð´Ð°Ð²ÑÑ ÑˆÐ²Ð¸Ð´ÑˆÐµ.\n    > [!answer] Ð’Ð¼Ð¸Ð²Ð°ÑŽÑ‡Ð¸ÑÑŒ\n    > [!options] Ð’Ð¼Ð¸Ð²Ð°ÑŽÑ‡Ð¸ÑÑŒ | Ð’Ð¼Ð¸Ð²ÑˆÐ¸ÑÑŒ | Ð’Ð¼Ð¸Ð²Ð°ÑŽÑ‡Ð¸ÑÑ | Ð’Ð¼Ð¸Ð²Ð°Ð²ÑˆÐ¸ÑÑŒ\n    > Ð”Ñ–Ñ”Ð¿Ñ€Ð¸ÑÐ»Ñ–Ð²Ð½Ð¸Ðº ÐÐ”Ð’ Ð²Ñ–Ð´ Â«Ð²Ð¼Ð¸Ð²Ð°Ñ‚Ð¸ÑÑÂ» â€” Â«Ð²Ð¼Ð¸Ð²Ð°ÑŽÑ‡Ð¸ÑÑŒÂ».\n\n14. ___ (Ð¾Ð´ÑÐ³Ð°Ñ‚Ð¸ÑÑ) Ð¿Ð¾ÑÐ¿Ñ–Ñ…Ð¾Ð¼, Ð²Ð¾Ð½Ð° Ð·Ð°Ð±ÑƒÐ»Ð° Ð²Ð·ÑÑ‚Ð¸ Ð¿Ð°Ñ€Ð°ÑÐ¾Ð»ÑŒÐºÑƒ.\n    > [!answer] ÐžÐ´ÑÐ³Ð°ÑŽÑ‡Ð¸ÑÑŒ\n    > [!options] ÐžÐ´ÑÐ³Ð°ÑŽÑ‡Ð¸ÑÑŒ | ÐžÐ´ÑÐ³Ð½ÑƒÐ²ÑˆÐ¸ÑÑŒ | ÐžÐ´ÑÐ³Ð°ÑŽÑ‡Ð¸ÑÑ | ÐžÐ´ÑÐ³Ð°Ð²ÑˆÐ¸ÑÑŒ\n    > Ð”Ñ–Ñ”Ð¿Ñ€Ð¸ÑÐ»Ñ–Ð²Ð½Ð¸Ðº ÐÐ”Ð’ Ð²Ñ–Ð´ Â«Ð¾Ð´ÑÐ³Ð°Ñ‚Ð¸ÑÑÂ» â€” Â«Ð¾Ð´ÑÐ³Ð°ÑŽÑ‡Ð¸ÑÑŒÂ».\n\n## true-false: ÐŸÑ€Ð°Ð²Ð¸Ð»Ð° Ð²Ð¶Ð¸Ð²Ð°Ð½Ð½Ñ Ð´Ñ–Ñ”Ð¿Ñ€Ð¸ÑÐ»Ñ–Ð²Ð½Ð¸ÐºÑ–Ð²\n\n> Ð’Ð¸Ð·Ð½Ð°Ñ‡Ñ‚Ðµ, Ñ‡Ð¸ Ð¿Ñ€Ð°Ð²Ð¸Ð»ÑŒÐ½Ñ– Ñ‚Ð²ÐµÑ€Ð´Ð¶ÐµÐ½Ð½Ñ Ð¿Ñ€Ð¾ Ð´Ñ–Ñ”Ð¿Ñ€Ð¸ÑÐ»Ñ–Ð²Ð½Ð¸ÐºÐ¸ Ð½ÐµÐ´Ð¾ÐºÐ¾Ð½Ð°Ð½Ð¾Ð³Ð¾ Ð²Ð¸Ð´Ñƒ.\n\n- [x] Ð”Ñ–Ñ”Ð¿Ñ€Ð¸ÑÐ»Ñ–Ð²Ð½Ð¸ÐºÐ¸ Ð½ÐµÐ´Ð¾ÐºÐ¾Ð½Ð°Ð½Ð¾Ð³Ð¾ Ð²Ð¸Ð´Ñƒ ÑƒÑ‚Ð²Ð¾Ñ€ÑŽÑŽÑ‚ÑŒÑÑ Ð²Ñ–Ð´ Ð¾ÑÐ½Ð¾Ð²Ð¸ Ñ‚ÐµÐ¿ÐµÑ€Ñ–ÑˆÐ½ÑŒÐ¾Ð³Ð¾ Ñ‡Ð°ÑÑƒ.\n  > ÐŸÑ€Ð°Ð²Ð¸Ð»ÑŒÐ½Ð¾! ÐžÑÐ½Ð¾Ð²Ð° Ð±ÐµÑ€ÐµÑ‚ÑŒÑÑ Ð· Ñ„Ð¾Ñ€Ð¼Ð¸ Ñ‚ÐµÐ¿ÐµÑ€Ñ–ÑˆÐ½ÑŒÐ¾Ð³Ð¾ Ñ‡Ð°ÑÑƒ: Ñ‡Ð¸Ñ‚Ð°Ñ‚Ð¸ â†’ Ñ‡Ð¸Ñ‚Ð°ÑŽ â†’ Ñ‡Ð¸Ñ‚Ð°-.\n\n- [ ] Ð¡ÑƒÑ„Ñ–ÐºÑ -Ð²ÑˆÐ¸ Ð²Ð¸ÐºÐ¾Ñ€Ð¸ÑÑ‚Ð¾Ð²ÑƒÑ”Ñ‚ÑŒÑÑ Ð´Ð»Ñ ÑƒÑ‚Ð²Ð¾Ñ€ÐµÐ½Ð½Ñ Ð´Ñ–Ñ”Ð¿Ñ€Ð¸ÑÐ»Ñ–Ð²Ð½Ð¸ÐºÑ–Ð² Ð½ÐµÐ´Ð¾ÐºÐ¾Ð½Ð°Ð½Ð¾Ð³Ð¾ Ð²Ð¸Ð´Ñƒ.\n  > ÐÐµÐ¿Ñ€Ð°Ð²Ð¸Ð»ÑŒÐ½Ð¾! Ð¡ÑƒÑ„Ñ–ÐºÑ -Ð²ÑˆÐ¸ Ð²Ð¸ÐºÐ¾Ñ€Ð¸ÑÑ‚Ð¾Ð²ÑƒÑ”Ñ‚ÑŒÑÑ Ð´Ð»Ñ Ð´Ð¾ÐºÐ¾Ð½Ð°Ð½Ð¾Ð³Ð¾ Ð²Ð¸Ð´Ñƒ. ÐÐ”Ð’ Ð¼Ð°Ñ” ÑÑƒÑ„Ñ–ÐºÑÐ¸ -ÑŽÑ‡Ð¸/-Ð°Ñ‡Ð¸.\n\n- [ ] Ð”Ñ–Ñ”Ð¿Ñ€Ð¸ÑÐ»Ñ–Ð²Ð½Ð¸Ðº Ñ– Ð¾ÑÐ½Ð¾Ð²Ð½Ðµ Ð´Ñ–Ñ”ÑÐ»Ð¾Ð²Ð¾ Ð¼Ð¾Ð¶ÑƒÑ‚ÑŒ Ð¼Ð°Ñ‚Ð¸ Ñ€Ñ–Ð·Ð½Ð¸Ñ… ÑÑƒÐ±'Ñ”ÐºÑ‚Ñ–Ð².\n  > ÐÐµÐ¿Ñ€Ð°Ð²Ð¸Ð»ÑŒÐ½Ð¾! Ð¡ÑƒÐ±'Ñ”ÐºÑ‚ Ð´Ñ–Ñ”Ð¿Ñ€Ð¸ÑÐ»Ñ–Ð²Ð½Ð¸ÐºÐ° Ñ– Ð¾ÑÐ½Ð¾Ð²Ð½Ð¾Ð³Ð¾ Ð´Ñ–Ñ”ÑÐ»Ð¾Ð²Ð° Ð¼Ð°ÑŽÑ‚ÑŒ Ð·Ð±Ñ–Ð³Ð°Ñ‚Ð¸ÑÑ.\n\n- [x] Ð”Ñ–Ñ”Ð¿Ñ€Ð¸ÑÐ»Ñ–Ð²Ð½Ð¸ÐºÐ¸ Ð½ÐµÐ´Ð¾ÐºÐ¾Ð½Ð°Ð½Ð¾Ð³Ð¾ Ð²Ð¸Ð´Ñƒ Ð²Ð¸Ñ€Ð°Ð¶Ð°ÑŽÑ‚ÑŒ Ð¾Ð´Ð½Ð¾Ñ‡Ð°ÑÐ½Ñ–ÑÑ‚ÑŒ Ð´Ñ–Ð¹.\n  > ÐŸÑ€Ð°Ð²Ð¸Ð»ÑŒÐ½Ð¾! ÐÐ”Ð’ Ð¿Ð¾ÐºÐ°Ð·ÑƒÑ”, Ñ‰Ð¾ Ð´Ð²Ñ– Ð´Ñ–Ñ— Ð²Ñ–Ð´Ð±ÑƒÐ²Ð°ÑŽÑ‚ÑŒÑÑ Ð¾Ð´Ð½Ð¾Ñ‡Ð°ÑÐ½Ð¾.\n\n- [ ] Ð’Ñ–Ð´ Ð´Ñ–Ñ”ÑÐ»Ð¾Ð²Ð° Â«Ð¿Ð¸ÑÐ°Ñ‚Ð¸Â» Ð´Ñ–Ñ”Ð¿Ñ€Ð¸ÑÐ»Ñ–Ð²Ð½Ð¸Ðº ÑƒÑ‚Ð²Ð¾Ñ€ÑŽÑ”Ñ‚ÑŒÑÑ Ð· Ð¾ÑÐ½Ð¾Ð²Ð¾ÑŽ Â«Ð¿Ð¸ÑÐ°-Â».\n  > ÐÐµÐ¿Ñ€Ð°Ð²Ð¸Ð»ÑŒÐ½Ð¾! ÐžÑÐ½Ð¾Ð²Ð° Ð±ÐµÑ€ÐµÑ‚ÑŒÑÑ Ð· Ñ‚ÐµÐ¿ÐµÑ€Ñ–ÑˆÐ½ÑŒÐ¾Ð³Ð¾ Ñ‡Ð°ÑÑƒ: Ñ Ð¿Ð¸ÑˆÑƒ â†’ Ð¿Ð¸Ñˆ- â†’ Ð¿Ð¸ÑˆÑƒÑ‡Ð¸.\n\n- [x] Ð—Ð²Ð¾Ñ€Ð¾Ñ‚Ð½Ñ– Ð´Ñ–Ñ”ÑÐ»Ð¾Ð²Ð° ÑƒÑ‚Ð²Ð¾Ñ€ÑŽÑŽÑ‚ÑŒ Ð´Ñ–Ñ”Ð¿Ñ€Ð¸ÑÐ»Ñ–Ð²Ð½Ð¸ÐºÐ¸ Ð· Ñ‡Ð°ÑÑ‚ÐºÐ¾ÑŽ -ÑÑŒ.\n  > ÐŸÑ€Ð°Ð²Ð¸Ð»ÑŒÐ½Ð¾! ÐÐ°Ð¿Ñ€Ð¸ÐºÐ»Ð°Ð´: Ð¾Ð´ÑÐ³Ð°Ñ‚Ð¸ÑÑ â†’ Ð¾Ð´ÑÐ³Ð°ÑŽÑ‡Ð¸ÑÑŒ.\n\n- [ ] Ð”Ñ–Ñ”Ð¿Ñ€Ð¸ÑÐ»Ñ–Ð²Ð½Ð¸ÐºÐ¾Ð²Ð° ÐºÐ¾Ð½ÑÑ‚Ñ€ÑƒÐºÑ†Ñ–Ñ Ð¼Ð¾Ð¶Ðµ ÑÑ‚Ð¾ÑÑ‚Ð¸ Ñ‚Ñ–Ð»ÑŒÐºÐ¸ Ð½Ð° Ð¿Ð¾Ñ‡Ð°Ñ‚ÐºÑƒ Ñ€ÐµÑ‡ÐµÐ½Ð½Ñ.\n  > ÐÐµÐ¿Ñ€Ð°Ð²Ð¸Ð»ÑŒÐ½Ð¾! Ð”Ñ–Ñ”Ð¿Ñ€Ð¸ÑÐ»Ñ–Ð²Ð½Ð¸Ðº Ð¼Ð¾Ð¶Ðµ Ð±ÑƒÑ‚Ð¸ Ð½Ð° Ð¿Ð¾Ñ‡Ð°Ñ‚ÐºÑƒ, Ð² ÑÐµÑ€ÐµÐ´Ð¸Ð½Ñ– Ð°Ð±Ð¾ Ð² ÐºÑ–Ð½Ñ†Ñ– Ñ€ÐµÑ‡ÐµÐ½Ð½Ñ.\n\n- [x] Ð”Ñ–Ñ”Ð¿Ñ€Ð¸ÑÐ»Ñ–Ð²Ð½Ð¸Ðº Â«Ð±Ñ–Ð¶Ð°Ñ‡Ð¸Â» ÑƒÑ‚Ð²Ð¾Ñ€ÐµÐ½Ð¸Ð¹ Ð²Ñ–Ð´ Ð¾ÑÐ½Ð¾Ð²Ð¸ Â«Ð±Ñ–Ð¶-Â».\n  > ÐŸÑ€Ð°Ð²Ð¸Ð»ÑŒÐ½Ð¾! Ð‘Ñ–Ð³Ñ‚Ð¸ â†’ Ð±Ñ–Ð¶Ñƒ â†’ Ð±Ñ–Ð¶- + -Ð°Ñ‡Ð¸ = Ð±Ñ–Ð¶Ð°Ñ‡Ð¸.\n\n- [ ] Ð”Ñ–Ñ”Ð¿Ñ€Ð¸ÑÐ»Ñ–Ð²Ð½Ð¸Ðº Ð²Ñ–Ð´Ð¿Ð¾Ð²Ñ–Ð´Ð°Ñ” Ð½Ð° Ð¿Ð¸Ñ‚Ð°Ð½Ð½Ñ Â«Ð¯ÐºÐ¸Ð¹?Â».\n  > ÐÐµÐ¿Ñ€Ð°Ð²Ð¸Ð»ÑŒÐ½Ð¾! Ð”Ñ–Ñ”Ð¿Ñ€Ð¸ÑÐ»Ñ–Ð²Ð½Ð¸Ðº Ð²Ñ–Ð´Ð¿Ð¾Ð²Ñ–Ð´Ð°Ñ” Ð½Ð° Ð¿Ð¸Ñ‚Ð°Ð½Ð½Ñ Â«Ð©Ð¾ Ñ€Ð¾Ð±Ð»ÑÑ‡Ð¸?Â» Ð°Ð±Ð¾ Â«Ð¯Ðº?Â».\n\n- [x] Ð”Ñ–Ñ”Ð¿Ñ€Ð¸ÑÐ»Ñ–Ð²Ð½Ð¸ÐºÐ¸ Ð°ÐºÑ‚Ð¸Ð²Ð½Ð¾ Ð²Ð¸ÐºÐ¾Ñ€Ð¸ÑÑ‚Ð¾Ð²ÑƒÑŽÑ‚ÑŒÑÑ Ð² ÑÑƒÑ‡Ð°ÑÐ½Ñ–Ð¹ ÑƒÐºÑ€Ð°Ñ—Ð½ÑÑŒÐºÑ–Ð¹ Ð¼Ð¾Ð²Ñ–.\n  > ÐŸÑ€Ð°Ð²Ð¸Ð»ÑŒÐ½Ð¾! Ð”Ñ–Ñ”Ð¿Ñ€Ð¸ÑÐ»Ñ–Ð²Ð½Ð¸ÐºÐ¸ Ñ‡Ð°ÑÑ‚Ð¾ Ð²Ð¶Ð¸Ð²Ð°ÑŽÑ‚ÑŒÑÑ Ð² Ð¶ÑƒÑ€Ð½Ð°Ð»Ñ–ÑÑ‚Ð¸Ñ†Ñ–, Ð»Ñ–Ñ‚ÐµÑ€Ð°Ñ‚ÑƒÑ€Ñ– Ñ‚Ð° Ñ€Ð¾Ð·Ð¼Ð¾Ð²Ð½Ð¾Ð¼Ñƒ Ð¼Ð¾Ð²Ð»ÐµÐ½Ð½Ñ–.\n\n- [x] Ð’Ñ–Ð´ Ð´Ñ–Ñ”ÑÐ»Ð¾Ð²Ð° Â«Ð¹Ñ‚Ð¸Â» Ð´Ñ–Ñ”Ð¿Ñ€Ð¸ÑÐ»Ñ–Ð²Ð½Ð¸Ðº â€” Â«Ð¹Ð´ÑƒÑ‡Ð¸Â».\n  > ÐŸÑ€Ð°Ð²Ð¸Ð»ÑŒÐ½Ð¾! Ð™Ñ‚Ð¸ â†’ Ð¹Ð´Ñƒ â†’ Ð¹Ð´- + -ÑƒÑ‡Ð¸ = Ð¹Ð´ÑƒÑ‡Ð¸.\n\n- [ ] Ð¡ÑƒÑ„Ñ–ÐºÑ -ÑŽÑ‡Ð¸ Ð´Ð¾Ð´Ð°Ñ”Ñ‚ÑŒÑÑ Ð¿Ñ–ÑÐ»Ñ Ð¿Ñ€Ð¸Ð³Ð¾Ð»Ð¾ÑÐ½Ð¾Ñ—.\n  > ÐÐµÐ¿Ñ€Ð°Ð²Ð¸Ð»ÑŒÐ½Ð¾! Ð¡ÑƒÑ„Ñ–ÐºÑ -ÑŽÑ‡Ð¸ Ð´Ð¾Ð´Ð°Ñ”Ñ‚ÑŒÑÑ Ð¿Ñ–ÑÐ»Ñ Ð³Ð¾Ð»Ð¾ÑÐ½Ð¾Ñ—, Ð° -Ð°Ñ‡Ð¸ â€” Ð¿Ñ–ÑÐ»Ñ Ð¿Ñ€Ð¸Ð³Ð¾Ð»Ð¾ÑÐ½Ð¾Ñ—.\n\n- [ ] Ð ÐµÑ‡ÐµÐ½Ð½Ñ Â«Ð§Ð¸Ñ‚Ð°ÑŽÑ‡Ð¸ ÐºÐ½Ð¸Ð³Ñƒ, Ð¼ÐµÐ½Ñ– ÑÑ‚Ð°Ð»Ð¾ ÑÑƒÐ¼Ð½Ð¾Â» Ñ” Ð³Ñ€Ð°Ð¼Ð°Ñ‚Ð¸Ñ‡Ð½Ð¾ Ð¿Ñ€Ð°Ð²Ð¸Ð»ÑŒÐ½Ð¸Ð¼.\n  > ÐÐµÐ¿Ñ€Ð°Ð²Ð¸Ð»ÑŒÐ½Ð¾! Ð¡ÑƒÐ±'Ñ”ÐºÑ‚Ð¸ Ð½Ðµ Ð·Ð±Ñ–Ð³Ð°ÑŽÑ‚ÑŒÑÑ: Ñ…Ñ‚Ð¾ Ñ‡Ð¸Ñ‚Ð°Ð²? Ð¥Ñ‚Ð¾ Ð·Ð°ÑÑƒÐ¼ÑƒÐ²Ð°Ð²? ÐŸÑ€Ð°Ð²Ð¸Ð»ÑŒÐ½Ð¾: Â«Ð§Ð¸Ñ‚Ð°ÑŽÑ‡Ð¸ ÐºÐ½Ð¸Ð³Ñƒ, Ñ Ð·Ð°ÑÑƒÐ¼ÑƒÐ²Ð°Ð²Â».\n\n- [x] Ð”Ñ–Ñ”Ð¿Ñ€Ð¸ÑÐ»Ñ–Ð²Ð½Ð¸Ðº Â«ÑÐ»ÑƒÑ…Ð°ÑŽÑ‡Ð¸Â» ÑƒÑ‚Ð²Ð¾Ñ€ÐµÐ½Ð¸Ð¹ Ð²Ñ–Ð´ Ð´Ñ–Ñ”ÑÐ»Ð¾Ð²Ð° Ð½ÐµÐ´Ð¾ÐºÐ¾Ð½Ð°Ð½Ð¾Ð³Ð¾ Ð²Ð¸Ð´Ñƒ.\n  > ÐŸÑ€Ð°Ð²Ð¸Ð»ÑŒÐ½Ð¾! Â«Ð¡Ð»ÑƒÑ…Ð°Ñ‚Ð¸Â» â€” Ð´Ñ–Ñ”ÑÐ»Ð¾Ð²Ð¾ Ð½ÐµÐ´Ð¾ÐºÐ¾Ð½Ð°Ð½Ð¾Ð³Ð¾ Ð²Ð¸Ð´Ñƒ.\n\n## group-sort: ÐšÐ»Ð°ÑÐ¸Ñ„Ñ–ÐºÐ°Ñ†Ñ–Ñ Ñ„Ð¾Ñ€Ð¼ Ð´Ñ–Ñ”Ð¿Ñ€Ð¸ÑÐ»Ñ–Ð²Ð½Ð¸ÐºÑ–Ð²\n\n> Ð Ð¾Ð·Ð¿Ð¾Ð´Ñ–Ð»Ñ–Ñ‚ÑŒ ÑÐ»Ð¾Ð²Ð° Ð½Ð° Ñ‚Ñ€Ð¸ Ð³Ñ€ÑƒÐ¿Ð¸: Ð¿Ñ€Ð°Ð²Ð¸Ð»ÑŒÐ½Ð¾ ÑƒÑ‚Ð²Ð¾Ñ€ÐµÐ½Ñ– Ð´Ñ–Ñ”Ð¿Ñ€Ð¸ÑÐ»Ñ–Ð²Ð½Ð¸ÐºÐ¸ ÐÐ”Ð’, Ð´Ñ–Ñ”Ð¿Ñ€Ð¸ÑÐ»Ñ–Ð²Ð½Ð¸ÐºÐ¸ Ð”Ð’ Ñ‚Ð° Ð½ÐµÐ¿Ñ€Ð°Ð²Ð¸Ð»ÑŒÐ½Ñ– Ñ„Ð¾Ñ€Ð¼Ð¸.\n\n### Ð”Ñ–Ñ”Ð¿Ñ€Ð¸ÑÐ»Ñ–Ð²Ð½Ð¸ÐºÐ¸ ÐÐ”Ð’ (Ð¿Ñ€Ð°Ð²Ð¸Ð»ÑŒÐ½Ñ–)\n- Ñ‡Ð¸Ñ‚Ð°ÑŽÑ‡Ð¸\n- Ð¿Ð¸ÑˆÑƒÑ‡Ð¸\n- Ð¹Ð´ÑƒÑ‡Ð¸\n- Ð±Ñ–Ð¶Ð°Ñ‡Ð¸\n- Ð³Ð¾Ð²Ð¾Ñ€ÑÑ‡Ð¸\n- ÑÐ»ÑƒÑ…Ð°ÑŽÑ‡Ð¸\n- ÑÐ¸Ð´ÑÑ‡Ð¸\n- Ð´Ð¸Ð²Ð»ÑÑ‡Ð¸ÑÑŒ\n\n### Ð”Ñ–Ñ”Ð¿Ñ€Ð¸ÑÐ»Ñ–Ð²Ð½Ð¸ÐºÐ¸ Ð”Ð’ (Ð¿Ñ€Ð°Ð²Ð¸Ð»ÑŒÐ½Ñ–)\n- Ð¿Ñ€Ð¾Ñ‡Ð¸Ñ‚Ð°Ð²ÑˆÐ¸\n- Ð½Ð°Ð¿Ð¸ÑÐ°Ð²ÑˆÐ¸\n- Ð¿Ñ–ÑˆÐ¾Ð²ÑˆÐ¸\n- Ð¿Ð¾Ð±Ñ–Ð¶Ð°Ð²ÑˆÐ¸\n- ÑÐºÐ°Ð·Ð°Ð²ÑˆÐ¸\n- Ð¿Ð¾ÑÐ»ÑƒÑ…Ð°Ð²ÑˆÐ¸\n\n### ÐÐµÐ¿Ñ€Ð°Ð²Ð¸Ð»ÑŒÐ½Ñ– Ñ„Ð¾Ñ€Ð¼Ð¸\n- Ð¿Ð¸ÑÐ°ÑŽÑ‡Ð¸\n- Ð±Ñ–Ð³ÑƒÑ‡Ð¸\n- Ñ‡Ð¸Ñ‚Ð°Ð²ÑˆÐ¸\n- Ð¹Ð´ÑƒÐ²ÑˆÐ¸\n- Ð³Ð¾Ð²Ð¾Ñ€ÑŽÑ‡Ð¸\n- ÑÐ¸Ð´Ñ–ÑŽÑ‡Ð¸\n\n## unjumble: ÐŸÐ¾Ð±ÑƒÐ´Ð¾Ð²Ð° Ñ€ÐµÑ‡ÐµÐ½ÑŒ Ð· Ð´Ñ–Ñ”Ð¿Ñ€Ð¸ÑÐ»Ñ–Ð²Ð½Ð¸ÐºÐ°Ð¼Ð¸\n\n> Ð Ð¾Ð·Ñ‚Ð°ÑˆÑƒÐ¹Ñ‚Ðµ ÑÐ»Ð¾Ð²Ð° Ð² Ð¿Ñ€Ð°Ð²Ð¸Ð»ÑŒÐ½Ð¾Ð¼Ñƒ Ð¿Ð¾Ñ€ÑÐ´ÐºÑƒ, Ñ‰Ð¾Ð± ÑƒÑ‚Ð²Ð¾Ñ€Ð¸Ñ‚Ð¸ Ð³Ñ€Ð°Ð¼Ð°Ñ‚Ð¸Ñ‡Ð½Ð¾ Ð¿Ñ€Ð°Ð²Ð¸Ð»ÑŒÐ½Ðµ Ñ€ÐµÑ‡ÐµÐ½Ð½Ñ Ð· Ð´Ñ–Ñ”Ð¿Ñ€Ð¸ÑÐ»Ñ–Ð²Ð½Ð¸ÐºÐ¾Ð¼.\n\n1. Ñ‡Ð¸Ñ‚Ð°ÑŽÑ‡Ð¸ / Ñ†Ñ–ÐºÐ°Ð²Ñƒ / ÑÑ‚Ð°Ñ‚Ñ‚ÑŽ / Ð¿Ñ€Ð¾ / ÑƒÐºÑ€Ð°Ñ—Ð½ÑÑŒÐºÑƒ / Ñ–ÑÑ‚Ð¾Ñ€Ñ–ÑŽ / Ð²Ñ–Ð½ / Ð·Ð°Ð¿Ð¸ÑÑƒÐ²Ð°Ð² / Ð²Ð°Ð¶Ð»Ð¸Ð²Ñ– / Ñ„Ð°ÐºÑ‚Ð¸ / Ð² / Ð·Ð¾ÑˆÐ¸Ñ‚ / Ð´Ð»Ñ / Ð¿Ð°Ð¼'ÑÑ‚Ñ–\n   > [!answer] Ð§Ð¸Ñ‚Ð°ÑŽÑ‡Ð¸ Ñ†Ñ–ÐºÐ°Ð²Ñƒ ÑÑ‚Ð°Ñ‚Ñ‚ÑŽ Ð¿Ñ€Ð¾ ÑƒÐºÑ€Ð°Ñ—Ð½ÑÑŒÐºÑƒ Ñ–ÑÑ‚Ð¾Ñ€Ñ–ÑŽ, Ð²Ñ–Ð½ Ð·Ð°Ð¿Ð¸ÑÑƒÐ²Ð°Ð² Ð²Ð°Ð¶Ð»Ð¸Ð²Ñ– Ñ„Ð°ÐºÑ‚Ð¸ Ð² Ð·Ð¾ÑˆÐ¸Ñ‚ Ð´Ð»Ñ Ð¿Ð°Ð¼'ÑÑ‚Ñ–.\n\n2. Ð¹Ð´ÑƒÑ‡Ð¸ / Ð²Ñ€Ð°Ð½Ñ†Ñ– / Ð´Ð¾ / Ñ€Ð¾Ð±Ð¾Ñ‚Ð¸ / Ñ‡ÐµÑ€ÐµÐ· / Ñ†ÐµÐ½Ñ‚Ñ€Ð°Ð»ÑŒÐ½Ð¸Ð¹ / Ð¿Ð°Ñ€Ðº / Ð²Ð¾Ð½Ð° / Ð·Ð°Ð²Ð¶Ð´Ð¸ / Ð½Ð°ÑÐ¾Ð»Ð¾Ð´Ð¶ÑƒÐ²Ð°Ð»Ð°ÑÑ / ÑÐ²Ñ–Ð¶Ð¸Ð¼ / Ð¿Ð¾Ð²Ñ–Ñ‚Ñ€ÑÐ¼ / Ñ– / ÐºÑ€Ð°ÑÐ¾ÑŽ\n   > [!answer] Ð™Ð´ÑƒÑ‡Ð¸ Ð²Ñ€Ð°Ð½Ñ†Ñ– Ð´Ð¾ Ñ€Ð¾Ð±Ð¾Ñ‚Ð¸ Ñ‡ÐµÑ€ÐµÐ· Ñ†ÐµÐ½Ñ‚Ñ€Ð°Ð»ÑŒÐ½Ð¸Ð¹ Ð¿Ð°Ñ€Ðº, Ð²Ð¾Ð½Ð° Ð·Ð°Ð²Ð¶Ð´Ð¸ Ð½Ð°ÑÐ¾Ð»Ð¾Ð´Ð¶ÑƒÐ²Ð°Ð»Ð°ÑÑ ÑÐ²Ñ–Ð¶Ð¸Ð¼ Ð¿Ð¾Ð²Ñ–Ñ‚Ñ€ÑÐ¼ Ñ– ÐºÑ€Ð°ÑÐ¾ÑŽ.\n\n3. ÑÐ»ÑƒÑ…Ð°ÑŽÑ‡Ð¸ / ÑƒÐ²Ð°Ð¶Ð½Ð¾ / Ð¿Ð¾ÑÑÐ½ÐµÐ½Ð½Ñ / Ð²Ð¸ÐºÐ»Ð°Ð´Ð°Ñ‡Ð° / Ð¿Ñ€Ð¾ / Ð³Ñ€Ð°Ð¼Ð°Ñ‚Ð¸ÐºÑƒ / ÑÑ‚ÑƒÐ´ÐµÐ½Ñ‚Ð¸ / Ð·Ð°Ð¿Ð¸ÑÑƒÐ²Ð°Ð»Ð¸ / Ð²ÑÑ– / Ð²Ð°Ð¶Ð»Ð¸Ð²Ñ– / Ð¿Ñ€Ð°Ð²Ð¸Ð»Ð° / Ð´Ð¾ / Ð·Ð¾ÑˆÐ¸Ñ‚Ñ–Ð²\n   > [!answer] Ð¡Ð»ÑƒÑ…Ð°ÑŽÑ‡Ð¸ ÑƒÐ²Ð°Ð¶Ð½Ð¾ Ð¿Ð¾ÑÑÐ½ÐµÐ½Ð½Ñ Ð²Ð¸ÐºÐ»Ð°Ð´Ð°Ñ‡Ð° Ð¿Ñ€Ð¾ Ð³Ñ€Ð°Ð¼Ð°Ñ‚Ð¸ÐºÑƒ, ÑÑ‚ÑƒÐ´ÐµÐ½Ñ‚Ð¸ Ð·Ð°Ð¿Ð¸ÑÑƒÐ²Ð°Ð»Ð¸ Ð²ÑÑ– Ð²Ð°Ð¶Ð»Ð¸Ð²Ñ– Ð¿Ñ€Ð°Ð²Ð¸Ð»Ð° Ð´Ð¾ Ð·Ð¾ÑˆÐ¸Ñ‚Ñ–Ð².\n\n4. Ð¿Ð¾Ð²ÐµÑ€Ñ‚Ð°ÑŽÑ‡Ð¸ÑÑŒ / Ð¿Ñ–Ð·Ð½Ð¾ / Ð²Ð²ÐµÑ‡ÐµÑ€Ñ– / Ð´Ð¾Ð´Ð¾Ð¼Ñƒ / Ð· / Ð²Ð°Ð¶ÐºÐ¾Ñ— / Ñ€Ð¾Ð±Ð¾Ñ‚Ð¸ / Ð²Ñ–Ð½ / Ð·Ð°Ð²Ð¶Ð´Ð¸ / ÐºÑƒÐ¿ÑƒÐ²Ð°Ð² / ÑÐ²Ñ–Ð¶Ð¸Ð¹ / Ñ…Ð»Ñ–Ð± / Ñƒ / Ð¿ÐµÐºÐ°Ñ€Ð½Ñ–\n   > [!answer] ÐŸÐ¾Ð²ÐµÑ€Ñ‚Ð°ÑŽÑ‡Ð¸ÑÑŒ Ð¿Ñ–Ð·Ð½Ð¾ Ð²Ð²ÐµÑ‡ÐµÑ€Ñ– Ð´Ð¾Ð´Ð¾Ð¼Ñƒ Ð· Ð²Ð°Ð¶ÐºÐ¾Ñ— Ñ€Ð¾Ð±Ð¾Ñ‚Ð¸, Ð²Ñ–Ð½ Ð·Ð°Ð²Ð¶Ð´Ð¸ ÐºÑƒÐ¿ÑƒÐ²Ð°Ð² ÑÐ²Ñ–Ð¶Ð¸Ð¹ Ñ…Ð»Ñ–Ð± Ñƒ Ð¿ÐµÐºÐ°Ñ€Ð½Ñ–.\n\n5. Ð³Ð¾Ñ‚ÑƒÑŽÑ‡Ð¸ÑÑŒ / ÑÑ‚Ð°Ñ€Ð°Ð½Ð½Ð¾ / Ð´Ð¾ / Ð²Ð°Ð¶Ð»Ð¸Ð²Ð¾Ð³Ð¾ / Ñ–ÑÐ¿Ð¸Ñ‚Ñƒ / Ð· / ÑƒÐºÑ€Ð°Ñ—Ð½ÑÑŒÐºÐ¾Ñ— / Ð¼Ð¾Ð²Ð¸ / ÑÑ‚ÑƒÐ´ÐµÐ½Ñ‚ÐºÐ° / Ð¿Ð¾Ð²Ñ‚Ð¾Ñ€ÑŽÐ²Ð°Ð»Ð° / Ð³Ñ€Ð°Ð¼Ð°Ñ‚Ð¸Ñ‡Ð½Ñ– / Ð¿Ñ€Ð°Ð²Ð¸Ð»Ð° / ÐºÐ¾Ð¶Ð½Ð¾Ð³Ð¾ / Ð´Ð½Ñ\n   > [!answer] Ð“Ð¾Ñ‚ÑƒÑŽÑ‡Ð¸ÑÑŒ ÑÑ‚Ð°Ñ€Ð°Ð½Ð½Ð¾ Ð´Ð¾ Ð²Ð°Ð¶Ð»Ð¸Ð²Ð¾Ð³Ð¾ Ñ–ÑÐ¿Ð¸Ñ‚Ñƒ Ð· ÑƒÐºÑ€Ð°Ñ—Ð½ÑÑŒÐºÐ¾Ñ— Ð¼Ð¾Ð²Ð¸, ÑÑ‚ÑƒÐ´ÐµÐ½Ñ‚ÐºÐ° Ð¿Ð¾Ð²Ñ‚Ð¾Ñ€ÑŽÐ²Ð°Ð»Ð° Ð³Ñ€Ð°Ð¼Ð°Ñ‚Ð¸Ñ‡Ð½Ñ– Ð¿Ñ€Ð°Ð²Ð¸Ð»Ð° ÐºÐ¾Ð¶Ð½Ð¾Ð³Ð¾ Ð´Ð½Ñ.\n\n6. Ð´Ð¸Ð²Ð»ÑÑ‡Ð¸ÑÑŒ / Ð·Ð°Ñ…Ð¾Ð¿Ð»ÐµÐ½Ð¾ / Ñƒ / Ð²Ñ–ÐºÐ½Ð¾ / Ð¿Ð¾Ñ—Ð·Ð´Ð° / Ð½Ð° / Ð¼Ð°Ð»ÑŒÐ¾Ð²Ð½Ð¸Ñ‡Ñ– / ÑƒÐºÑ€Ð°Ñ—Ð½ÑÑŒÐºÑ– / ÐºÑ€Ð°Ñ”Ð²Ð¸Ð´Ð¸ / Ñ‚ÑƒÑ€Ð¸ÑÑ‚Ð¸ / Ñ„Ð¾Ñ‚Ð¾Ð³Ñ€Ð°Ñ„ÑƒÐ²Ð°Ð»Ð¸ / ÐºÐ¾Ð¶ÐµÐ½ / Ð¼Ð¾Ð¼ÐµÐ½Ñ‚ / Ð¿Ð¾Ð´Ð¾Ñ€Ð¾Ð¶Ñ–\n   > [!answer] Ð”Ð¸Ð²Ð»ÑÑ‡Ð¸ÑÑŒ Ð·Ð°Ñ…Ð¾Ð¿Ð»ÐµÐ½Ð¾ Ñƒ Ð²Ñ–ÐºÐ½Ð¾ Ð¿Ð¾Ñ—Ð·Ð´Ð° Ð½Ð° Ð¼Ð°Ð»ÑŒÐ¾Ð²Ð½Ð¸Ñ‡Ñ– ÑƒÐºÑ€Ð°Ñ—Ð½ÑÑŒÐºÑ– ÐºÑ€Ð°Ñ”Ð²Ð¸Ð´Ð¸, Ñ‚ÑƒÑ€Ð¸ÑÑ‚Ð¸ Ñ„Ð¾Ñ‚Ð¾Ð³Ñ€Ð°Ñ„ÑƒÐ²Ð°Ð»Ð¸ ÐºÐ¾Ð¶ÐµÐ½ Ð¼Ð¾Ð¼ÐµÐ½Ñ‚ Ð¿Ð¾Ð´Ð¾Ñ€Ð¾Ð¶Ñ–.\n\n7. Ð¿Ñ€Ð°Ñ†ÑŽÑŽÑ‡Ð¸ / Ð²Ð´Ð¾Ð¼Ð° / Ð½Ð°Ð´ / ÑÐºÐ»Ð°Ð´Ð½Ð¸Ð¼ / Ð¿Ñ€Ð¾Ñ”ÐºÑ‚Ð¾Ð¼ / Ð´Ð»Ñ / Ð¼Ñ–Ð¶Ð½Ð°Ñ€Ð¾Ð´Ð½Ð¾Ñ— / ÐºÐ¾Ð¼Ð¿Ð°Ð½Ñ–Ñ— / Ð²Ñ–Ð½ / Ñ‡Ð°ÑÑ‚Ð¾ / Ð·Ð°Ð±ÑƒÐ²Ð°Ð² / Ð¿Ñ€Ð¾ / Ð¾Ð±Ñ–Ð´ / Ñ‚Ð° / Ð²Ñ–Ð´Ð¿Ð¾Ñ‡Ð¸Ð½Ð¾Ðº\n   > [!answer] ÐŸÑ€Ð°Ñ†ÑŽÑŽÑ‡Ð¸ Ð²Ð´Ð¾Ð¼Ð° Ð½Ð°Ð´ ÑÐºÐ»Ð°Ð´Ð½Ð¸Ð¼ Ð¿Ñ€Ð¾Ñ”ÐºÑ‚Ð¾Ð¼ Ð´Ð»Ñ Ð¼Ñ–Ð¶Ð½Ð°Ñ€Ð¾Ð´Ð½Ð¾Ñ— ÐºÐ¾Ð¼Ð¿Ð°Ð½Ñ–Ñ—, Ð²Ñ–Ð½ Ñ‡Ð°ÑÑ‚Ð¾ Ð·Ð°Ð±ÑƒÐ²Ð°Ð² Ð¿Ñ€Ð¾ Ð¾Ð±Ñ–Ð´ Ñ‚Ð° Ð²Ñ–Ð´Ð¿Ð¾Ñ‡Ð¸Ð½Ð¾Ðº.\n\n8. ÑÐ¸Ð´ÑÑ‡Ð¸ / ÐºÐ¾Ð¼Ñ„Ð¾Ñ€Ñ‚Ð½Ð¾ / Ð² / Ð·Ð°Ñ‚Ð¸ÑˆÐ½Ð¾Ð¼Ñƒ / ÐºÐ°Ñ„Ðµ / Ð±Ñ–Ð»Ñ / Ð²ÐµÐ»Ð¸ÐºÐ¾Ð³Ð¾ / Ð²Ñ–ÐºÐ½Ð° / Ð· / Ð²Ð¸Ð´Ð¾Ð¼ / Ð½Ð° / Ð¿Ð»Ð¾Ñ‰Ñƒ / Ð²Ð¾Ð½Ð° / Ñ‡Ð¸Ñ‚Ð°Ð»Ð° / ÑƒÐ»ÑŽÐ±Ð»ÐµÐ½Ñƒ / ÐºÐ½Ð¸Ð³Ñƒ\n   > [!answer] Ð¡Ð¸Ð´ÑÑ‡Ð¸ ÐºÐ¾Ð¼Ñ„Ð¾Ñ€Ñ‚Ð½Ð¾ Ð² Ð·Ð°Ñ‚Ð¸ÑˆÐ½Ð¾Ð¼Ñƒ ÐºÐ°Ñ„Ðµ Ð±Ñ–Ð»Ñ Ð²ÐµÐ»Ð¸ÐºÐ¾Ð³Ð¾ Ð²Ñ–ÐºÐ½Ð° Ð· Ð²Ð¸Ð´Ð¾Ð¼ Ð½Ð° Ð¿Ð»Ð¾Ñ‰Ñƒ, Ð²Ð¾Ð½Ð° Ñ‡Ð¸Ñ‚Ð°Ð»Ð° ÑƒÐ»ÑŽÐ±Ð»ÐµÐ½Ñƒ ÐºÐ½Ð¸Ð³Ñƒ.\n\n## error-correction: Ð’Ð¸Ð¿Ñ€Ð°Ð²Ð»ÐµÐ½Ð½Ñ Ð¿Ð¾Ð¼Ð¸Ð»Ð¾Ðº Ñƒ Ð´Ñ–Ñ”Ð¿Ñ€Ð¸ÑÐ»Ñ–Ð²Ð½Ð¸ÐºÐ¾Ð²Ð¸Ñ… ÐºÐ¾Ð½ÑÑ‚Ñ€ÑƒÐºÑ†Ñ–ÑÑ…\n\n> Ð—Ð½Ð°Ð¹Ð´Ñ–Ñ‚ÑŒ Ñ– Ð²Ð¸Ð¿Ñ€Ð°Ð²Ñ‚Ðµ Ð¿Ð¾Ð¼Ð¸Ð»ÐºÑƒ Ð² ÐºÐ¾Ð¶Ð½Ð¾Ð¼Ñƒ Ñ€ÐµÑ‡ÐµÐ½Ð½Ñ–, Ð¿Ð¾Ð²'ÑÐ·Ð°Ð½Ñƒ Ð· Ð´Ñ–Ñ”Ð¿Ñ€Ð¸ÑÐ»Ñ–Ð²Ð½Ð¸ÐºÐ°Ð¼Ð¸.\n\n1. Ð§Ð¸Ñ‚Ð°ÑŽÑ‡Ð¸ ÐºÐ½Ð¸Ð³Ñƒ, Ð¼ÐµÐ½Ñ– ÑÑ‚Ð°Ð»Ð¾ ÑÑƒÐ¼Ð½Ð¾ Ð²Ñ–Ð´ Ñ†Ñ–Ñ”Ñ— Ñ–ÑÑ‚Ð¾Ñ€Ñ–Ñ—.\n   > [!error] Ð¼ÐµÐ½Ñ– ÑÑ‚Ð°Ð»Ð¾ ÑÑƒÐ¼Ð½Ð¾\n   > [!answer] Ñ Ð·Ð°ÑÑƒÐ¼ÑƒÐ²Ð°Ð²\n   > [!options] Ð¼ÐµÐ½Ñ– ÑÑ‚Ð°Ð»Ð¾ ÑÑƒÐ¼Ð½Ð¾ | Ñ Ð·Ð°ÑÑƒÐ¼ÑƒÐ²Ð°Ð² | Ð¹Ð¾Ð¼Ñƒ ÑÑ‚Ð°Ð»Ð¾ ÑÑƒÐ¼Ð½Ð¾ | Ð²Ð¾Ð½Ð° Ð·Ð°ÑÑƒÐ¼ÑƒÐ²Ð°Ð»Ð°\n   > [!explanation] Ð¡ÑƒÐ±'Ñ”ÐºÑ‚ Ð´Ñ–Ñ”Ð¿Ñ€Ð¸ÑÐ»Ñ–Ð²Ð½Ð¸ÐºÐ° (Ñ…Ñ‚Ð¾ Ñ‡Ð¸Ñ‚Ð°Ð²?) Ð¼Ð°Ñ” Ð·Ð±Ñ–Ð³Ð°Ñ‚Ð¸ÑÑ Ð· ÑÑƒÐ±'Ñ”ÐºÑ‚Ð¾Ð¼ Ð¾ÑÐ½Ð¾Ð²Ð½Ð¾Ð³Ð¾ Ð´Ñ–Ñ”ÑÐ»Ð¾Ð²Ð°.\n\n2. ÐŸÐ¸ÑÐ°ÑŽÑ‡Ð¸ Ð»Ð¸ÑÑ‚Ð° ÑÐ²Ð¾Ñ—Ð¹ Ð±Ð°Ð±ÑƒÑÑ–, Ð²Ñ–Ð½ Ð´ÑƒÐ¼Ð°Ð² Ð¿Ñ€Ð¾ Ð´Ð¸Ñ‚Ð¸Ð½ÑÑ‚Ð²Ð¾.\n   > [!error] ÐŸÐ¸ÑÐ°ÑŽÑ‡Ð¸\n   > [!answer] ÐŸÐ¸ÑˆÑƒÑ‡Ð¸\n   > [!options] ÐŸÐ¸ÑÐ°ÑŽÑ‡Ð¸ | ÐŸÐ¸ÑˆÑƒÑ‡Ð¸ | ÐŸÐ¸ÑÐ°Ð²ÑˆÐ¸ | ÐÐ°Ð¿Ð¸ÑÐ°Ð²ÑˆÐ¸\n   > [!explanation] Ð”Ñ–Ñ”Ð¿Ñ€Ð¸ÑÐ»Ñ–Ð²Ð½Ð¸Ðº ÑƒÑ‚Ð²Ð¾Ñ€ÑŽÑ”Ñ‚ÑŒÑÑ Ð²Ñ–Ð´ Ð¾ÑÐ½Ð¾Ð²Ð¸ Ñ‚ÐµÐ¿ÐµÑ€Ñ–ÑˆÐ½ÑŒÐ¾Ð³Ð¾ Ñ‡Ð°ÑÑƒ: Ð¿Ð¸Ñˆ- + -ÑƒÑ‡Ð¸ = Ð¿Ð¸ÑˆÑƒÑ‡Ð¸.\n\n3. Ð™Ð´ÑƒÑ‡Ð¸ Ð´Ð¾ ÑˆÐºÐ¾Ð»Ð¸, Ð¿Ð¾Ñ‡Ð°Ð²ÑÑ ÑÐ¸Ð»ÑŒÐ½Ð¸Ð¹ Ð´Ð¾Ñ‰ Ñ– Ð·Ð»Ð¸Ð²Ð°.\n   > [!error] Ð¿Ð¾Ñ‡Ð°Ð²ÑÑ ÑÐ¸Ð»ÑŒÐ½Ð¸Ð¹ Ð´Ð¾Ñ‰\n   > [!answer] Ñ Ð¿Ð¾Ñ‚Ñ€Ð°Ð¿Ð¸Ð² Ð¿Ñ–Ð´ Ð´Ð¾Ñ‰\n   > [!options] Ð¿Ð¾Ñ‡Ð°Ð²ÑÑ ÑÐ¸Ð»ÑŒÐ½Ð¸Ð¹ Ð´Ð¾Ñ‰ | Ñ Ð¿Ð¾Ñ‚Ñ€Ð°Ð¿Ð¸Ð² Ð¿Ñ–Ð´ Ð´Ð¾Ñ‰ | Ð²Ñ–Ð½ Ð¿Ð¾Ñ‡Ð°Ð²ÑÑ | Ð´Ð¾Ñ‰ Ð¿Ð¾Ñ‡Ð°Ð²ÑÑ\n   > [!explanation] Ð”Ð¾Ñ‰ Ð½Ðµ Ð¼Ð¾Ð¶Ðµ Â«Ð¹Ñ‚Ð¸ Ð´Ð¾ ÑˆÐºÐ¾Ð»Ð¸Â» â€” ÑÑƒÐ±'Ñ”ÐºÑ‚Ð¸ Ð¼Ð°ÑŽÑ‚ÑŒ Ð·Ð±Ñ–Ð³Ð°Ñ‚Ð¸ÑÑ.\n\n4. Ð‘Ñ–Ð³ÑƒÑ‡Ð¸ Ð´Ð¾ Ð°Ð²Ñ‚Ð¾Ð±ÑƒÑÐ° Ð½Ð° Ð·ÑƒÐ¿Ð¸Ð½ÐºÑƒ, Ð²Ð¾Ð½Ð° Ð·Ð°Ð³ÑƒÐ±Ð¸Ð»Ð° Ñ‚ÐµÐ»ÐµÑ„Ð¾Ð½.\n   > [!error] Ð‘Ñ–Ð³ÑƒÑ‡Ð¸\n   > [!answer] Ð‘Ñ–Ð¶Ð°Ñ‡Ð¸\n   > [!options] Ð‘Ñ–Ð³ÑƒÑ‡Ð¸ | Ð‘Ñ–Ð¶Ð°Ñ‡Ð¸ | Ð‘Ñ–Ð³Ð°Ð²ÑˆÐ¸ | ÐŸÐ¾Ð±Ñ–Ð³ÑˆÐ¸\n   > [!explanation] Ð’Ñ–Ð´ Ð¾ÑÐ½Ð¾Ð²Ð¸ Â«Ð±Ñ–Ð¶-Â» (Ñ Ð±Ñ–Ð¶Ñƒ) ÑƒÑ‚Ð²Ð¾Ñ€ÑŽÑ”Ñ‚ÑŒÑÑ Â«Ð±Ñ–Ð¶Ð°Ñ‡Ð¸Â», Ð½Ðµ Â«Ð±Ñ–Ð³ÑƒÑ‡Ð¸Â».\n\n5. Ð¡Ð»ÑƒÑ…Ð°ÑŽÑ‡Ð¸ Ð¼ÑƒÐ·Ð¸ÐºÑƒ Ð² Ð½Ð°Ð²ÑƒÑˆÐ½Ð¸ÐºÐ°Ñ…, Ð¹Ð¾Ð¼Ñƒ Ð·Ð°Ñ‚ÐµÐ»ÐµÑ„Ð¾Ð½ÑƒÐ²Ð°Ð»Ð¸ Ð´Ñ€ÑƒÐ·Ñ–.\n   > [!error] Ð¹Ð¾Ð¼Ñƒ Ð·Ð°Ñ‚ÐµÐ»ÐµÑ„Ð¾Ð½ÑƒÐ²Ð°Ð»Ð¸\n   > [!answer] Ð²Ñ–Ð½ Ð¾Ñ‚Ñ€Ð¸Ð¼Ð°Ð² Ð´Ð·Ð²Ñ–Ð½Ð¾Ðº\n   > [!options] Ð¹Ð¾Ð¼Ñƒ Ð·Ð°Ñ‚ÐµÐ»ÐµÑ„Ð¾Ð½ÑƒÐ²Ð°Ð»Ð¸ | Ð²Ñ–Ð½ Ð¾Ñ‚Ñ€Ð¸Ð¼Ð°Ð² Ð´Ð·Ð²Ñ–Ð½Ð¾Ðº | Ð´Ñ€ÑƒÐ·Ñ– Ð·Ð°Ñ‚ÐµÐ»ÐµÑ„Ð¾Ð½ÑƒÐ²Ð°Ð»Ð¸ | Ñ—Ð¹ Ð·Ð°Ñ‚ÐµÐ»ÐµÑ„Ð¾Ð½ÑƒÐ²Ð°Ð»Ð¸\n   > [!explanation] Ð¥Ñ‚Ð¾ ÑÐ»ÑƒÑ…Ð°Ð² Ð¼ÑƒÐ·Ð¸ÐºÑƒ? Ð’Ñ–Ð½. Ð¥Ñ‚Ð¾ Ð¾Ñ‚Ñ€Ð¸Ð¼Ð°Ð² Ð´Ð·Ð²Ñ–Ð½Ð¾Ðº? Ð¢ÐµÐ¶ Ð²Ñ–Ð½. Ð¡ÑƒÐ±'Ñ”ÐºÑ‚Ð¸ Ð¼Ð°ÑŽÑ‚ÑŒ Ð·Ð±Ñ–Ð³Ð°Ñ‚Ð¸ÑÑ.\n\n6. Ð¡Ð¸Ð´Ñ–ÑŽÑ‡Ð¸ Ð² Ð¿Ð°Ñ€ÐºÑƒ Ð½Ð° Ð»Ð°Ð²Ñ†Ñ–, Ð´Ñ–Ñ‚Ð¸ Ð³Ð¾Ð´ÑƒÐ²Ð°Ð»Ð¸ Ð³Ð¾Ð»ÑƒÐ±Ñ–Ð² Ñ…Ð»Ñ–Ð±Ð¾Ð¼.\n   > [!error] Ð¡Ð¸Ð´Ñ–ÑŽÑ‡Ð¸\n   > [!answer] Ð¡Ð¸Ð´ÑÑ‡Ð¸\n   > [!options] Ð¡Ð¸Ð´Ñ–ÑŽÑ‡Ð¸ | Ð¡Ð¸Ð´ÑÑ‡Ð¸ | Ð¡Ð¸Ð´Ñ–Ð²ÑˆÐ¸ | Ð¡Ð¸Ð´ÑŒÐ¾ÑƒÑ‡Ð¸\n   > [!explanation] Ð’Ñ–Ð´ Ð¾ÑÐ½Ð¾Ð²Ð¸ Â«ÑÐ¸Ð´-Â» ÑƒÑ‚Ð²Ð¾Ñ€ÑŽÑ”Ñ‚ÑŒÑÑ Â«ÑÐ¸Ð´ÑÑ‡Ð¸Â» Ð· ÑÑƒÑ„Ñ–ÐºÑÐ¾Ð¼ -ÑÑ‡Ð¸.\n\n7. Ð”Ð¸Ð²Ð¸Ð²ÑˆÐ¸ Ð² Ñ‚ÐµÐ»ÐµÐ²Ñ–Ð·Ð¾Ñ€ Ð½Ð¾Ð²Ð¸Ð½Ð¸, Ð±Ð°Ð±ÑƒÑÑ Ð²'ÑÐ·Ð°Ð»Ð° Ñ‚ÐµÐ¿Ð»Ð¸Ð¹ ÑÐ²ÐµÑ‚Ñ€.\n   > [!error] Ð”Ð¸Ð²Ð¸Ð²ÑˆÐ¸\n   > [!answer] Ð”Ð¸Ð²Ð»ÑÑ‡Ð¸ÑÑŒ\n   > [!options] Ð”Ð¸Ð²Ð¸Ð²ÑˆÐ¸ | Ð”Ð¸Ð²Ð»ÑÑ‡Ð¸ÑÑŒ | Ð”Ð¸Ð²Ð¸Ð²ÑˆÐ¸ÑÑŒ | ÐŸÐ¾Ð´Ð¸Ð²Ð¸Ð²ÑˆÐ¸\n   > [!explanation] Ð’Ñ–Ð´ Ð·Ð²Ð¾Ñ€Ð¾Ñ‚Ð½Ð¾Ð³Ð¾ Ð´Ñ–Ñ”ÑÐ»Ð¾Ð²Ð° Â«Ð´Ð¸Ð²Ð¸Ñ‚Ð¸ÑÑÂ» ÑƒÑ‚Ð²Ð¾Ñ€ÑŽÑ”Ñ‚ÑŒÑÑ Â«Ð´Ð¸Ð²Ð»ÑÑ‡Ð¸ÑÑŒÂ».\n\n8. Ð“Ð¾Ð²Ð¾Ñ€ÑŽÑ‡Ð¸ Ð¿Ð¾ Ñ‚ÐµÐ»ÐµÑ„Ð¾Ð½Ñƒ Ð· ÐºÐ¾Ð»ÐµÐ³Ð¾ÑŽ, Ð²Ð¾Ð½Ð° Ð³Ð¾Ñ‚ÑƒÐ²Ð°Ð»Ð° Ð²ÐµÑ‡ÐµÑ€ÑŽ Ð½Ð° ÐºÑƒÑ…Ð½Ñ–.\n   > [!error] Ð“Ð¾Ð²Ð¾Ñ€ÑŽÑ‡Ð¸\n   > [!answer] Ð“Ð¾Ð²Ð¾Ñ€ÑÑ‡Ð¸\n   > [!options] Ð“Ð¾Ð²Ð¾Ñ€ÑŽÑ‡Ð¸ | Ð“Ð¾Ð²Ð¾Ñ€ÑÑ‡Ð¸ | Ð“Ð¾Ð²Ð¾Ñ€Ð¸Ð²ÑˆÐ¸ | ÐŸÐ¾Ð³Ð¾Ð²Ð¾Ñ€Ð¸Ð²ÑˆÐ¸\n   > [!explanation] Ð’Ñ–Ð´ Ð¾ÑÐ½Ð¾Ð²Ð¸ Â«Ð³Ð¾Ð²Ð¾Ñ€-Â» ÑƒÑ‚Ð²Ð¾Ñ€ÑŽÑ”Ñ‚ÑŒÑÑ Â«Ð³Ð¾Ð²Ð¾Ñ€ÑÑ‡Ð¸Â» Ð· ÑÑƒÑ„Ñ–ÐºÑÐ¾Ð¼ -ÑÑ‡Ð¸.\n\n## cloze: Ð”Ñ–Ñ”Ð¿Ñ€Ð¸ÑÐ»Ñ–Ð²Ð½Ð¸ÐºÐ¸ Ð² ÐºÐ¾Ð½Ñ‚ÐµÐºÑÑ‚Ñ–\n\n> Ð—Ð°Ð¿Ð¾Ð²Ð½Ñ–Ñ‚ÑŒ Ð¿Ñ€Ð¾Ð¿ÑƒÑÐºÐ¸ Ð¿Ñ€Ð°Ð²Ð¸Ð»ÑŒÐ½Ð¸Ð¼Ð¸ Ñ„Ð¾Ñ€Ð¼Ð°Ð¼Ð¸ Ð´Ñ–Ñ”Ð¿Ñ€Ð¸ÑÐ»Ñ–Ð²Ð½Ð¸ÐºÑ–Ð² Ñƒ Ñ‚ÐµÐºÑÑ‚Ñ– Ð¿Ñ€Ð¾ ÑƒÐºÑ€Ð°Ñ—Ð½ÑÑŒÐºÑ– Ñ‚Ñ€Ð°Ð´Ð¸Ñ†Ñ–Ñ—.\n\nÐœÐ¸Ð½ÑƒÐ»Ð¾Ð³Ð¾ Ñ€Ð¾ÐºÑƒ Ð¼Ð¸ Ð²Ñ–Ð´Ð²Ñ–Ð´Ð°Ð»Ð¸ ÑƒÐºÑ€Ð°Ñ—Ð½ÑÑŒÐºÐµ ÑÐµÐ»Ð¾. [___:1:Ð¿Ñ€Ð¸Ñ—Ð¶Ð´Ð¶Ð°ÑŽÑ‡Ð¸|Ð¿Ñ€Ð¸Ñ—Ñ…Ð°Ð²ÑˆÐ¸|Ð¿Ñ€Ð¸Ñ”Ð·Ð´ÑÑ‡Ð¸] Ð´Ð¾ Ð±Ð°Ð±ÑƒÑÑ–, Ð¼Ð¸ Ð·Ð°Ð²Ð¶Ð´Ð¸ Ð²Ñ–Ð´Ñ‡ÑƒÐ²Ð°Ñ”Ð¼Ð¾ Ñ€Ð°Ð´Ñ–ÑÑ‚ÑŒ. [___:2:Ð’Ð¸Ñ…Ð¾Ð´ÑÑ‡Ð¸|Ð’Ð¸Ð¹Ð´ÑƒÑ‡Ð¸|Ð’Ð¸Ñ…Ð¾Ð´Ð¸Ð²ÑˆÐ¸] Ð· Ð°Ð²Ñ‚Ð¾Ð±ÑƒÑÐ°, Ð¼Ð¸ Ð¿Ð¾Ð±Ð°Ñ‡Ð¸Ð»Ð¸ ÐºÑ€Ð°ÑÐ¸Ð²Ñ– ÐºÑ€Ð°Ñ”Ð²Ð¸Ð´Ð¸. Ð‘Ð°Ð±ÑƒÑÑ Ñ‡ÐµÐºÐ°Ð»Ð° Ð½Ð° Ð½Ð°Ñ, [___:3:ÑÑ‚Ð¾ÑÑ‡Ð¸|ÑÑ‚Ð¾ÑŽÐ²ÑˆÐ¸|ÑÑ‚Ð¾ÑÑŽÑ‡Ð¸] Ð±Ñ–Ð»Ñ Ñ…Ð°Ñ‚Ð¸. [___:4:Ð’Ñ–Ñ‚Ð°ÑŽÑ‡Ð¸ÑÑŒ|Ð’Ñ–Ñ‚Ð°Ð²ÑˆÐ¸ÑÑŒ|Ð’Ñ–Ñ‚Ð°ÑŽÑ‡Ð¸ÑÑ] Ð· Ð½Ð°Ð¼Ð¸, Ð²Ð¾Ð½Ð° Ð¿Ð»Ð°ÐºÐ°Ð»Ð° Ð²Ñ–Ð´ Ñ‰Ð°ÑÑ‚Ñ. ÐœÐ¸ Ð¿Ñ€Ð¾Ð²ÐµÐ»Ð¸ Ñ‚Ð°Ð¼ Ñ‚Ð¸Ð¶Ð´ÐµÐ½ÑŒ, [___:5:Ð½Ð°ÑÐ¾Ð»Ð¾Ð´Ð¶ÑƒÑŽÑ‡Ð¸ÑÑŒ|Ð½Ð°ÑÐ¾Ð»Ð¾Ð´Ð¸Ð²ÑˆÐ¸ÑÑŒ|Ð½Ð°ÑÐ¾Ð»Ð¾Ð¶Ð´ÑƒÑŽÑ‡Ð¸] ÑÐ²Ñ–Ð¶Ð¸Ð¼ Ð¿Ð¾Ð²Ñ–Ñ‚Ñ€ÑÐ¼ Ñ‚Ð° ÑƒÐºÑ€Ð°Ñ—Ð½ÑÑŒÐºÐ¾ÑŽ Ð¿Ñ€Ð¸Ñ€Ð¾Ð´Ð¾ÑŽ.\n\nÐšÐ¾Ð¶Ð½Ð¾Ð³Ð¾ Ñ€Ð°Ð½ÐºÑƒ, [___:6:Ð¿Ñ€Ð¾ÐºÐ¸Ð´Ð°ÑŽÑ‡Ð¸ÑÑŒ|Ð¿Ñ€Ð¾ÐºÐ¸Ð½ÑƒÐ²ÑˆÐ¸ÑÑŒ|Ð¿Ñ€Ð¾ÐºÐ¸Ð´ÑƒÑŽÑ‡Ð¸ÑÑŒ] Ñ€Ð°Ð½Ð¾, Ñ Ñ‡ÑƒÐ² ÑÐ¿Ñ–Ð² Ð¿Ñ–Ð²Ð½Ñ. [___:7:Ð¡Ð½Ñ–Ð´Ð°ÑŽÑ‡Ð¸|Ð¡Ð½Ñ–Ð´Ð°Ð²ÑˆÐ¸|Ð¡Ð½Ñ–Ð´ÑŽÑ‡Ð¸] Ð½Ð° Ð²ÐµÑ€Ð°Ð½Ð´Ñ–, Ð¼Ð¸ Ð¼Ð¸Ð»ÑƒÐ²Ð°Ð»Ð¸ÑÑ ÑÑ…Ð¾Ð´Ð¾Ð¼ ÑÐ¾Ð½Ñ†Ñ. Ð‘Ð°Ð±ÑƒÑÑ Ð³Ð¾Ñ‚ÑƒÐ²Ð°Ð»Ð° Ñ—Ð¶Ñƒ, [___:8:ÑÐ¿Ñ–Ð²Ð°ÑŽÑ‡Ð¸|ÑÐ¿Ñ–Ð²Ð°Ð²ÑˆÐ¸|ÑÐ¿Ñ–Ð²ÑƒÑŽÑ‡Ð¸] ÑƒÐºÑ€Ð°Ñ—Ð½ÑÑŒÐºÑ– Ð½Ð°Ñ€Ð¾Ð´Ð½Ñ– Ð¿Ñ–ÑÐ½Ñ–. [___:9:Ð¡Ð»ÑƒÑ…Ð°ÑŽÑ‡Ð¸|Ð¡Ð»ÑƒÑ…Ð°Ð²ÑˆÐ¸|Ð¡Ð»ÑƒÑ…ÑƒÑŽÑ‡Ð¸] Ñ—Ñ— Ð³Ð¾Ð»Ð¾Ñ, Ñ Ð²Ñ–Ð´Ñ‡ÑƒÐ²Ð°Ð² Ð·Ð²'ÑÐ·Ð¾Ðº Ð·Ñ– ÑÐ²Ð¾Ñ—Ð¼Ð¸ ÐºÐ¾Ñ€ÐµÐ½ÑÐ¼Ð¸.\n\nÐ£Ð´ÐµÐ½ÑŒ, [___:10:Ð³ÑƒÐ»ÑÑŽÑ‡Ð¸|Ð³ÑƒÐ»ÑÐ²ÑˆÐ¸|Ð³ÑƒÐ»ÑŽÑŽÑ‡Ð¸] Ð¿Ð¾Ð»ÑÐ¼Ð¸, Ð¼Ð¸ Ð·Ð±Ð¸Ñ€Ð°Ð»Ð¸ ÐºÐ²Ñ–Ñ‚Ð¸ Ñ‚Ð° ÑÐ³Ð¾Ð´Ð¸. Ð”Ñ–Ð´ÑƒÑÑŒ Ñ€Ð¾Ð·Ð¿Ð¾Ð²Ñ–Ð´Ð°Ð² Ñ–ÑÑ‚Ð¾Ñ€Ñ–Ñ—, [___:11:ÑÐ¸Ð´ÑÑ‡Ð¸|ÑÐ¸Ð´Ñ–Ð²ÑˆÐ¸|ÑÐ¸Ð´ÑŽÑ‡Ð¸] Ð¿Ñ–Ð´ ÑÑ‚Ð°Ñ€Ð¸Ð¼ Ð´ÑƒÐ±Ð¾Ð¼. [___:12:ÐŸÐ¾Ð²ÐµÑ€Ñ‚Ð°ÑŽÑ‡Ð¸ÑÑŒ|ÐŸÐ¾Ð²ÐµÑ€Ð½ÑƒÐ²ÑˆÐ¸ÑÑŒ|ÐŸÐ¾Ð²ÐµÑ€Ñ‚ÑƒÐ²ÑˆÐ¸ÑÑŒ] Ð²Ð²ÐµÑ‡ÐµÑ€Ñ– Ð´Ð¾Ð´Ð¾Ð¼Ñƒ, Ð¼Ð¸ Ð±Ð°Ñ‡Ð¸Ð»Ð¸ Ð·Ð°Ñ…Ñ–Ð´ ÑÐ¾Ð½Ñ†Ñ Ð½Ð°Ð´ ÑÐµÐ»Ð¾Ð¼. [___:13:Ð’ÐµÑ‡ÐµÑ€ÑÑŽÑ‡Ð¸|Ð’ÐµÑ‡ÐµÑ€ÑÐ²ÑˆÐ¸|Ð’ÐµÑ‡ÐµÑ€ÑƒÑŽÑ‡Ð¸] Ñ€Ð°Ð·Ð¾Ð¼ ÑƒÑÑ–Ñ”ÑŽ Ñ€Ð¾Ð´Ð¸Ð½Ð¾ÑŽ, Ð¼Ð¸ Ð´Ñ–Ð»Ð¸Ð»Ð¸ÑÑ Ð²Ñ€Ð°Ð¶ÐµÐ½Ð½ÑÐ¼Ð¸ Ð²Ñ–Ð´ Ð´Ð½Ñ. [___:14:Ð—Ð°ÑÐ¸Ð½Ð°ÑŽÑ‡Ð¸|Ð—Ð°ÑÐ½ÑƒÐ²ÑˆÐ¸|Ð—Ð°ÑÐ¸Ð½ÑƒÐ²ÑˆÐ¸] Ð¿Ñ–Ð·Ð½Ð¾ Ð²Ð²ÐµÑ‡ÐµÑ€Ñ–, Ñ Ð¼Ñ€Ñ–ÑÐ² Ð¿Ñ€Ð¾ Ð½Ð°ÑÑ‚ÑƒÐ¿Ð½Ð¸Ð¹ Ð´ÐµÐ½ÑŒ.\n\n## mark-the-words: Ð—Ð½Ð°Ð¹Ð´Ñ–Ñ‚ÑŒ Ð´Ñ–Ñ”Ð¿Ñ€Ð¸ÑÐ»Ñ–Ð²Ð½Ð¸ÐºÐ¸ Ð½ÐµÐ´Ð¾ÐºÐ¾Ð½Ð°Ð½Ð¾Ð³Ð¾ Ð²Ð¸Ð´Ñƒ\n\n> Ð—Ð½Ð°Ð¹Ð´Ñ–Ñ‚ÑŒ Ñ– Ð¿Ð¾Ð·Ð½Ð°Ñ‡Ñ‚Ðµ Ð²ÑÑ– Ð´Ñ–Ñ”Ð¿Ñ€Ð¸ÑÐ»Ñ–Ð²Ð½Ð¸ÐºÐ¸ Ð½ÐµÐ´Ð¾ÐºÐ¾Ð½Ð°Ð½Ð¾Ð³Ð¾ Ð²Ð¸Ð´Ñƒ Ð² Ñ‚ÐµÐºÑÑ‚Ñ–.\n\nÐžÐ»ÐµÐ½Ð° ÑÐ¸Ð´Ñ–Ð»Ð° Ð±Ñ–Ð»Ñ Ð²Ñ–ÐºÐ½Ð°, [Ð´Ð¸Ð²Ð»ÑÑ‡Ð¸ÑÑŒ] Ð½Ð° Ð²ÑƒÐ»Ð¸Ñ†ÑŽ. ÐÐ°Ð´Ð²Ð¾Ñ€Ñ– Ð¹ÑˆÐ¾Ð² Ð´Ð¾Ñ‰, [Ð±Ð°Ñ€Ð°Ð±Ð°Ð½ÑÑ‡Ð¸] Ð¿Ð¾ ÑˆÐ¸Ð±ÐºÐ°Ñ…. Ð’Ð¾Ð½Ð° Ñ‡Ð¸Ñ‚Ð°Ð»Ð° ÐºÐ½Ð¸Ð³Ñƒ, [Ñ‡Ð°Ñ Ð²Ñ–Ð´ Ñ‡Ð°ÑÑƒ Ð¿Ñ–Ð´Ð½Ð¾ÑÑÑ‡Ð¸] Ñ‡Ð°ÑˆÐºÑƒ Ñ‡Ð°ÑŽ Ð´Ð¾ Ð³ÑƒÐ±. [Ð”ÑƒÐ¼Ð°ÑŽÑ‡Ð¸] Ð¿Ñ€Ð¾ Ð¼Ð°Ð¹Ð±ÑƒÑ‚Ð½Ñ”, Ð²Ð¾Ð½Ð° Ð¿Ð¾ÑÐ¼Ñ–Ñ…Ð°Ð»Ð°ÑÑ. Ð—Ð° Ð²Ñ–ÐºÐ½Ð¾Ð¼ Ð»ÑŽÐ´Ð¸ Ð¹ÑˆÐ»Ð¸, [Ñ…Ð¾Ð²Ð°ÑŽÑ‡Ð¸ÑÑŒ] Ð¿Ñ–Ð´ Ð¿Ð°Ñ€Ð°ÑÐ¾Ð»ÑŒÐºÐ°Ð¼Ð¸. Ð”Ñ–Ñ‚Ð¸ Ð±Ñ–Ð³Ð»Ð¸ Ð´Ð¾Ð´Ð¾Ð¼Ñƒ, [ÑÐ¼Ñ–ÑŽÑ‡Ð¸ÑÑŒ] Ñ‚Ð° [Ñ€Ð¾Ð·Ð±Ñ€Ð¸Ð·ÐºÑƒÑŽÑ‡Ð¸] ÐºÐ°Ð»ÑŽÐ¶Ñ–. ÐžÐ»ÐµÐ½Ð° Ð·Ð°ÐºÑ€Ð¸Ð»Ð° ÐºÐ½Ð¸Ð³Ñƒ, [Ð²Ñ–Ð´Ñ‡ÑƒÐ²Ð°ÑŽÑ‡Ð¸] ÑÐ¿Ð¾ÐºÑ–Ð¹ Ñ– Ð·Ð°Ñ‚Ð¸ÑˆÐ¾Ðº. [Ð’ÑÑ‚Ð°ÑŽÑ‡Ð¸] Ð· ÐºÑ€Ñ–ÑÐ»Ð°, Ð²Ð¾Ð½Ð° Ð¿Ñ–ÑˆÐ»Ð° Ð³Ð¾Ñ‚ÑƒÐ²Ð°Ñ‚Ð¸ Ð²ÐµÑ‡ÐµÑ€ÑŽ.\n\n## dialogue-reorder: Ð”Ñ–Ð°Ð»Ð¾Ð³ Ð¿Ñ€Ð¾ Ñ€Ð¾Ð±Ð¾Ñ‡Ð¸Ð¹ Ð´ÐµÐ½ÑŒ\n\n> Ð Ð¾Ð·Ñ‚Ð°ÑˆÑƒÐ¹Ñ‚Ðµ Ñ€ÐµÐ¿Ð»Ñ–ÐºÐ¸ Ð´Ñ–Ð°Ð»Ð¾Ð³Ñƒ Ð² Ð¿Ñ€Ð°Ð²Ð¸Ð»ÑŒÐ½Ð¾Ð¼Ñƒ Ð¿Ð¾Ñ€ÑÐ´ÐºÑƒ.\n\n- ÐœÐµÐ½Ñ– Ð¿Ð¾Ð´Ð¾Ð±Ð°Ñ”Ñ‚ÑŒÑÑ Ð¿Ñ€Ð°Ñ†ÑŽÐ²Ð°Ñ‚Ð¸, ÑÐ»ÑƒÑ…Ð°ÑŽÑ‡Ð¸ Ð¼ÑƒÐ·Ð¸ÐºÑƒ Ñƒ Ñ„Ð¾Ð½Ð¾Ð²Ð¾Ð¼Ñƒ Ñ€ÐµÐ¶Ð¸Ð¼Ñ–.\n- Ð¡Ð¿Ñ€Ð°Ð²Ð´Ñ–? Ð Ñ, Ð¿Ñ€Ð°Ñ†ÑŽÑŽÑ‡Ð¸ Ð²Ð´Ð¾Ð¼Ð°, Ð¿Ð¾Ñ‚Ñ€ÐµÐ±ÑƒÑŽ Ð¿Ð¾Ð²Ð½Ð¾Ñ— Ñ‚Ð¸ÑˆÑ– Ð´Ð»Ñ ÐºÐ¾Ð½Ñ†ÐµÐ½Ñ‚Ñ€Ð°Ñ†Ñ–Ñ—.\n- ÐŸÐ¾Ð²ÐµÑ€Ñ‚Ð°ÑŽÑ‡Ð¸ÑÑŒ Ð· Ñ€Ð¾Ð±Ð¾Ñ‚Ð¸, Ñ Ð·Ð°Ð²Ð¶Ð´Ð¸ Ð¿Ð¾Ñ‡ÑƒÐ²Ð°ÑŽÑÑ Ð²Ñ‚Ð¾Ð¼Ð»ÐµÐ½Ð¸Ð¼ Ñ– Ñ…Ð¾Ñ‡Ñƒ Ð²Ñ–Ð´Ð¿Ð¾Ñ‡Ð¸Ñ‚Ð¸.\n- Ð Ð¾Ð·ÑƒÐ¼Ñ–ÑŽ Ñ‚ÐµÐ±Ðµ! ÐŸÑ€Ð°Ñ†ÑŽÑŽÑ‡Ð¸ Ð²ÐµÑÑŒ Ð´ÐµÐ½ÑŒ Ð·Ð° ÐºÐ¾Ð¼Ð¿'ÑŽÑ‚ÐµÑ€Ð¾Ð¼, Ð²Ð°Ð¶ÐºÐ¾ Ð·Ð±ÐµÑ€Ñ–Ð³Ð°Ñ‚Ð¸ ÐµÐ½ÐµÑ€Ð³Ñ–ÑŽ Ð´Ð¾ Ð²ÐµÑ‡Ð¾Ñ€Ð°.\n- Ð¯Ðº Ñ‚Ð¸ Ð²Ñ–Ð´Ð¿Ð¾Ñ‡Ð¸Ð²Ð°Ñ”Ñˆ, Ð¿Ñ€Ð¸Ñ…Ð¾Ð´ÑÑ‡Ð¸ Ð´Ð¾Ð´Ð¾Ð¼Ñƒ Ð¿Ñ–ÑÐ»Ñ Ñ‚Ð°ÐºÐ¾Ð³Ð¾ Ð½Ð°Ð¿Ñ€ÑƒÐ¶ÐµÐ½Ð¾Ð³Ð¾ Ð´Ð½Ñ?\n- Ð—Ð°Ð·Ð²Ð¸Ñ‡Ð°Ð¹, ÑÐ¸Ð´ÑÑ‡Ð¸ Ð½Ð° Ð´Ð¸Ð²Ð°Ð½Ñ–, Ð´Ð¸Ð²Ð»ÑŽÑÑ ÑÐµÑ€Ñ–Ð°Ð»Ð¸ Ñ‚Ð° Ð¿'ÑŽ Ð³Ð°Ñ€ÑÑ‡Ð¸Ð¹ Ñ‡Ð°Ð¹.\n\n## select: Ð’Ð¸Ð±Ñ–Ñ€ Ð¿Ñ€Ð°Ð²Ð¸Ð»ÑŒÐ½Ð¾Ð³Ð¾ Ð´Ñ–Ñ”Ð¿Ñ€Ð¸ÑÐ»Ñ–Ð²Ð½Ð¸ÐºÐ°\n\n> Ð’Ð¸Ð±ÐµÑ€Ñ–Ñ‚ÑŒ Ð¿Ñ€Ð°Ð²Ð¸Ð»ÑŒÐ½Ñƒ Ñ„Ð¾Ñ€Ð¼Ñƒ Ð´Ñ–Ñ”Ð¿Ñ€Ð¸ÑÐ»Ñ–Ð²Ð½Ð¸ÐºÐ° Ð°Ð±Ð¾ ÐºÐ¾Ð½ÑÑ‚Ñ€ÑƒÐºÑ†Ñ–ÑŽ Ð´Ð»Ñ ÐºÐ¾Ð¶Ð½Ð¾Ð³Ð¾ Ñ€ÐµÑ‡ÐµÐ½Ð½Ñ.\n\n1. _________ ÐºÐ½Ð¸Ð³Ñƒ, Ð²Ñ–Ð½ Ñ€Ð¾Ð±Ð¸Ð² Ð½Ð¾Ñ‚Ð°Ñ‚ÐºÐ¸.\n   - [x] Ð§Ð¸Ñ‚Ð°ÑŽÑ‡Ð¸\n   - [ ] Ð§Ð¸Ñ‚Ð°Ð²ÑˆÐ¸\n   - [ ] ÐŸÑ€Ð¾Ñ‡Ð¸Ñ‚Ð°Ð²ÑˆÐ¸\n   - [ ] ÐŸÑ€Ð¾Ñ‡Ð¸Ñ‚Ð°ÑŽÑ‡Ð¸\n\n2. _________ Ð´Ð¾Ð´Ð¾Ð¼Ñƒ, Ð²Ð¾Ð½Ð° Ð·ÑƒÑÑ‚Ñ€Ñ–Ð»Ð° Ð¿Ð¾Ð´Ñ€ÑƒÐ³Ñƒ.\n   - [x] Ð™Ð´ÑƒÑ‡Ð¸\n   - [ ] Ð™Ð´Ñ–Ð²ÑˆÐ¸\n   - [ ] ÐŸÑ–ÑˆÐ¾Ð²ÑˆÐ¸\n   - [ ] ÐŸÑ–Ð¹ÑˆÐ¾Ð²ÑˆÐ¸\n\n3. Ð¡Ñ‚ÑƒÐ´ÐµÐ½Ñ‚Ð¸ Ð²Ñ‡Ð¸Ð»Ð¸ÑÑ, _________ ÐºÐ¾Ð½ÑÐ¿ÐµÐºÑ‚Ð¸ Ð»ÐµÐºÑ†Ñ–Ð¹.\n   - [x] Ð¿ÐµÑ€ÐµÐ³Ð»ÑÐ´Ð°ÑŽÑ‡Ð¸\n   - [ ] Ð¿ÐµÑ€ÐµÐ³Ð»ÑÐ½ÑƒÐ²ÑˆÐ¸\n   - [ ] Ð¿ÐµÑ€ÐµÐ³Ð»ÑÐ´Ð°Ð²ÑˆÐ¸\n   - [ ] Ð¿ÐµÑ€ÐµÐ³Ð»ÑÐ´ÑŽÑ‡Ð¸\n\n4. _________ Ð² Ñ‡ÐµÑ€Ð·Ñ– Ð´Ð¾ ÐºÐ°ÑÐ¸, Ð»ÑŽÐ´Ð¸ Ñ€Ð¾Ð·Ð¼Ð¾Ð²Ð»ÑÐ»Ð¸.\n   - [x] Ð¡Ñ‚Ð¾ÑÑ‡Ð¸\n   - [ ] Ð¡Ñ‚Ð¾ÑŽÐ²ÑˆÐ¸\n   - [ ] ÐŸÐ¾ÑÑ‚Ð¾ÑÐ²ÑˆÐ¸\n   - [ ] Ð¡Ñ‚Ð¾ÑÑŽÑ‡Ð¸\n\n5. Ð’Ð¾Ð½Ð° Ð¿Ñ€Ð°Ñ†ÑŽÐ²Ð°Ð»Ð°, _________ ÐºÐ°Ð²Ñƒ.\n   - [x] Ð¿'ÑŽÑ‡Ð¸\n   - [ ] Ð¿Ð¸Ð²ÑˆÐ¸\n   - [ ] Ð²Ð¸Ð¿Ð¸Ð²ÑˆÐ¸\n   - [ ] Ð¿'ÑÐ²ÑˆÐ¸\n\n6. _________ Ð¿Ñ€Ð¾ Ð¼Ð°Ð¹Ð±ÑƒÑ‚Ð½Ñ”, Ð²Ñ–Ð½ Ñ…Ð²Ð¸Ð»ÑŽÐ²Ð°Ð²ÑÑ.\n   - [x] Ð”ÑƒÐ¼Ð°ÑŽÑ‡Ð¸\n   - [ ] Ð”ÑƒÐ¼Ð°Ð²ÑˆÐ¸\n   - [ ] ÐŸÐ¾Ð´ÑƒÐ¼Ð°Ð²ÑˆÐ¸\n   - [ ] Ð”ÑƒÐ¼ÑƒÑŽÑ‡Ð¸\n\n## translate: ÐŸÐµÑ€ÐµÐºÐ»Ð°Ð´ Ñ€ÐµÑ‡ÐµÐ½ÑŒ Ð· Ð´Ñ–Ñ”Ð¿Ñ€Ð¸ÑÐ»Ñ–Ð²Ð½Ð¸ÐºÐ°Ð¼Ð¸\n\n> Ð’Ð¸Ð±ÐµÑ€Ñ–Ñ‚ÑŒ Ð¿Ñ€Ð°Ð²Ð¸Ð»ÑŒÐ½Ð¸Ð¹ Ð¿ÐµÑ€ÐµÐºÐ»Ð°Ð´ Ñ€ÐµÑ‡ÐµÐ½Ð½Ñ ÑƒÐºÑ€Ð°Ñ—Ð½ÑÑŒÐºÐ¾ÑŽ Ð¼Ð¾Ð²Ð¾ÑŽ, Ð²Ð¸ÐºÐ¾Ñ€Ð¸ÑÑ‚Ð¾Ð²ÑƒÑŽÑ‡Ð¸ Ð´Ñ–Ñ”Ð¿Ñ€Ð¸ÑÐ»Ñ–Ð²Ð½Ð¸ÐºÐ¸ Ð½ÐµÐ´Ð¾ÐºÐ¾Ð½Ð°Ð½Ð¾Ð³Ð¾ Ð²Ð¸Ð´Ñƒ.\n\n1. While reading the newspaper, grandfather was drinking coffee.\n   - [ ] ÐŸÑ€Ð¾Ñ‡Ð¸Ñ‚Ð°Ð²ÑˆÐ¸ Ð³Ð°Ð·ÐµÑ‚Ñƒ, Ð´Ñ–Ð´ÑƒÑÑŒ Ð¿Ð¸Ð² ÐºÐ°Ð²Ñƒ.\n   - [x] Ð§Ð¸Ñ‚Ð°ÑŽÑ‡Ð¸ Ð³Ð°Ð·ÐµÑ‚Ñƒ, Ð´Ñ–Ð´ÑƒÑÑŒ Ð¿Ð¸Ð² ÐºÐ°Ð²Ñƒ.\n   - [ ] Ð§Ð¸Ñ‚Ð°Ñ‚Ð¸ Ð³Ð°Ð·ÐµÑ‚Ñƒ, Ð´Ñ–Ð´ÑƒÑÑŒ Ð¿Ð¸Ð² ÐºÐ°Ð²Ñƒ.\n   - [ ] Ð§Ð¸Ñ‚Ð°Ñ”Ð¼Ð¾ Ð³Ð°Ð·ÐµÑ‚Ñƒ, Ð´Ñ–Ð´ÑƒÑÑŒ Ð¿Ð¸Ð² ÐºÐ°Ð²Ñƒ.\n   > ÐžÐ´Ð½Ð¾Ñ‡Ð°ÑÐ½Ñ–ÑÑ‚ÑŒ Ð´Ñ–Ð¹ Ð¿Ð¾Ñ‚Ñ€ÐµÐ±ÑƒÑ” Ð´Ñ–Ñ”Ð¿Ñ€Ð¸ÑÐ»Ñ–Ð²Ð½Ð¸ÐºÐ° ÐÐ”Ð’ Â«Ñ‡Ð¸Ñ‚Ð°ÑŽÑ‡Ð¸Â».\n\n2. Walking through the park, she was thinking about her future.\n   - [x] Ð™Ð´ÑƒÑ‡Ð¸ Ñ‡ÐµÑ€ÐµÐ· Ð¿Ð°Ñ€Ðº, Ð²Ð¾Ð½Ð° Ð´ÑƒÐ¼Ð°Ð»Ð° Ð¿Ñ€Ð¾ Ð¼Ð°Ð¹Ð±ÑƒÑ‚Ð½Ñ”.\n   - [ ] ÐŸÑ–ÑˆÐ¾Ð²ÑˆÐ¸ Ñ‡ÐµÑ€ÐµÐ· Ð¿Ð°Ñ€Ðº, Ð²Ð¾Ð½Ð° Ð´ÑƒÐ¼Ð°Ð»Ð° Ð¿Ñ€Ð¾ Ð¼Ð°Ð¹Ð±ÑƒÑ‚Ð½Ñ”.\n   - [ ] Ð¥Ð¾Ð´Ð¸Ñ‚Ð¸ Ñ‡ÐµÑ€ÐµÐ· Ð¿Ð°Ñ€Ðº, Ð²Ð¾Ð½Ð° Ð´ÑƒÐ¼Ð°Ð»Ð° Ð¿Ñ€Ð¾ Ð¼Ð°Ð¹Ð±ÑƒÑ‚Ð½Ñ”.\n   - [ ] Ð™Ð´ÐµÐ¼Ð¾ Ñ‡ÐµÑ€ÐµÐ· Ð¿Ð°Ñ€Ðº, Ð²Ð¾Ð½Ð° Ð´ÑƒÐ¼Ð°Ð»Ð° Ð¿Ñ€Ð¾ Ð¼Ð°Ð¹Ð±ÑƒÑ‚Ð½Ñ”.\n   > Ð”Ñ–Ñ”Ð¿Ñ€Ð¸ÑÐ»Ñ–Ð²Ð½Ð¸Ðº ÐÐ”Ð’ Â«Ð¹Ð´ÑƒÑ‡Ð¸Â» Ð²Ð¸Ñ€Ð°Ð¶Ð°Ñ” Ð¾Ð´Ð½Ð¾Ñ‡Ð°ÑÐ½Ñ–ÑÑ‚ÑŒ.\n\n3. Listening to music, I was doing my homework.\n   - [ ] ÐŸÐ¾ÑÐ»ÑƒÑ…Ð°Ð²ÑˆÐ¸ Ð¼ÑƒÐ·Ð¸ÐºÑƒ, Ñ Ñ€Ð¾Ð±Ð¸Ð² Ð´Ð¾Ð¼Ð°ÑˆÐ½Ñ” Ð·Ð°Ð²Ð´Ð°Ð½Ð½Ñ.\n   - [ ] Ð¡Ð»ÑƒÑ…Ð°Ñ‚Ð¸ Ð¼ÑƒÐ·Ð¸ÐºÑƒ, Ñ Ñ€Ð¾Ð±Ð¸Ð² Ð´Ð¾Ð¼Ð°ÑˆÐ½Ñ” Ð·Ð°Ð²Ð´Ð°Ð½Ð½Ñ.\n   - [x] Ð¡Ð»ÑƒÑ…Ð°ÑŽÑ‡Ð¸ Ð¼ÑƒÐ·Ð¸ÐºÑƒ, Ñ Ñ€Ð¾Ð±Ð¸Ð² Ð´Ð¾Ð¼Ð°ÑˆÐ½Ñ” Ð·Ð°Ð²Ð´Ð°Ð½Ð½Ñ.\n   - [ ] Ð¡Ð»ÑƒÑ…Ð°Ð»Ð° Ð¼ÑƒÐ·Ð¸ÐºÑƒ, Ñ Ñ€Ð¾Ð±Ð¸Ð² Ð´Ð¾Ð¼Ð°ÑˆÐ½Ñ” Ð·Ð°Ð²Ð´Ð°Ð½Ð½Ñ.\n   > Ð”Ñ–Ñ”Ð¿Ñ€Ð¸ÑÐ»Ñ–Ð²Ð½Ð¸Ðº ÐÐ”Ð’ Â«ÑÐ»ÑƒÑ…Ð°ÑŽÑ‡Ð¸Â» Ð¿Ð¾ÐºÐ°Ð·ÑƒÑ” Ð¿Ð°Ñ€Ð°Ð»ÐµÐ»ÑŒÐ½Ñ– Ð´Ñ–Ñ—.\n\n4. Sitting on the bench, they were watching the sunset.\n   - [ ] Ð¡Ð¸Ð´Ñ–Ð²ÑˆÐ¸ Ð½Ð° Ð»Ð°Ð²Ñ†Ñ–, Ð²Ð¾Ð½Ð¸ Ð´Ð¸Ð²Ð¸Ð»Ð¸ÑÑ Ð½Ð° Ð·Ð°Ñ…Ñ–Ð´.\n   - [ ] Ð¡Ð¸Ð´Ñ–Ñ‚Ð¸ Ð½Ð° Ð»Ð°Ð²Ñ†Ñ–, Ð²Ð¾Ð½Ð¸ Ð´Ð¸Ð²Ð¸Ð»Ð¸ÑÑ Ð½Ð° Ð·Ð°Ñ…Ñ–Ð´.\n   - [x] Ð¡Ð¸Ð´ÑÑ‡Ð¸ Ð½Ð° Ð»Ð°Ð²Ñ†Ñ–, Ð²Ð¾Ð½Ð¸ Ð´Ð¸Ð²Ð¸Ð»Ð¸ÑÑ Ð½Ð° Ð·Ð°Ñ…Ñ–Ð´ ÑÐ¾Ð½Ñ†Ñ.\n   - [ ] Ð¡Ð¸Ð´Ñ–Ð»Ð¸ Ð½Ð° Ð»Ð°Ð²Ñ†Ñ–, Ð²Ð¾Ð½Ð¸ Ð´Ð¸Ð²Ð¸Ð»Ð¸ÑÑ Ð½Ð° Ð·Ð°Ñ…Ñ–Ð´ ÑÐ¾Ð½Ñ†Ñ.\n   > Â«Ð¡Ð¸Ð´ÑÑ‡Ð¸Â» â€” Ð´Ñ–Ñ”Ð¿Ñ€Ð¸ÑÐ»Ñ–Ð²Ð½Ð¸Ðº ÐÐ”Ð’ Ð²Ñ–Ð´ Â«ÑÐ¸Ð´Ñ–Ñ‚Ð¸Â».\n\n5. While preparing dinner, mother was talking on the phone.\n   - [x] Ð“Ð¾Ñ‚ÑƒÑŽÑ‡Ð¸ Ð²ÐµÑ‡ÐµÑ€ÑŽ, Ð¼Ð°Ð¼Ð° Ñ€Ð¾Ð·Ð¼Ð¾Ð²Ð»ÑÐ»Ð° Ð¿Ð¾ Ñ‚ÐµÐ»ÐµÑ„Ð¾Ð½Ñƒ.\n   - [ ] ÐŸÑ€Ð¸Ð³Ð¾Ñ‚ÑƒÐ²Ð°Ð²ÑˆÐ¸ Ð²ÐµÑ‡ÐµÑ€ÑŽ, Ð¼Ð°Ð¼Ð° Ñ€Ð¾Ð·Ð¼Ð¾Ð²Ð»ÑÐ»Ð° Ð¿Ð¾ Ñ‚ÐµÐ»ÐµÑ„Ð¾Ð½Ñƒ.\n   - [ ] Ð“Ð¾Ñ‚ÑƒÐ²Ð°Ñ‚Ð¸ Ð²ÐµÑ‡ÐµÑ€ÑŽ, Ð¼Ð°Ð¼Ð° Ñ€Ð¾Ð·Ð¼Ð¾Ð²Ð»ÑÐ»Ð° Ð¿Ð¾ Ñ‚ÐµÐ»ÐµÑ„Ð¾Ð½Ñƒ.\n   - [ ] Ð“Ð¾Ñ‚ÑƒÑ” Ð²ÐµÑ‡ÐµÑ€ÑŽ, Ð¼Ð°Ð¼Ð° Ñ€Ð¾Ð·Ð¼Ð¾Ð²Ð»ÑÐ»Ð° Ð¿Ð¾ Ñ‚ÐµÐ»ÐµÑ„Ð¾Ð½Ñƒ.\n   > Â«Ð“Ð¾Ñ‚ÑƒÑŽÑ‡Ð¸Â» Ð²Ð¸Ñ€Ð°Ð¶Ð°Ñ” Ð´Ñ–ÑŽ, Ñ‰Ð¾ Ð²Ñ–Ð´Ð±ÑƒÐ²Ð°Ñ”Ñ‚ÑŒÑÑ Ð¾Ð´Ð½Ð¾Ñ‡Ð°ÑÐ½Ð¾ Ð· Ñ€Ð¾Ð·Ð¼Ð¾Ð²Ð¾ÑŽ.\n\n6. Returning home from work, he always bought fresh bread.\n   - [ ] ÐŸÐ¾Ð²ÐµÑ€Ð½ÑƒÐ²ÑˆÐ¸ÑÑŒ Ð´Ð¾Ð´Ð¾Ð¼Ñƒ Ð· Ñ€Ð¾Ð±Ð¾Ñ‚Ð¸, Ð²Ñ–Ð½ ÐºÑƒÐ¿ÑƒÐ²Ð°Ð² Ñ…Ð»Ñ–Ð±.\n   - [x] ÐŸÐ¾Ð²ÐµÑ€Ñ‚Ð°ÑŽÑ‡Ð¸ÑÑŒ Ð´Ð¾Ð´Ð¾Ð¼Ñƒ Ð· Ñ€Ð¾Ð±Ð¾Ñ‚Ð¸, Ð²Ñ–Ð½ Ð·Ð°Ð²Ð¶Ð´Ð¸ ÐºÑƒÐ¿ÑƒÐ²Ð°Ð² Ñ…Ð»Ñ–Ð±.\n   - [ ] ÐŸÐ¾Ð²ÐµÑ€Ñ‚Ð°Ñ‚Ð¸ÑÑ Ð´Ð¾Ð´Ð¾Ð¼Ñƒ Ð· Ñ€Ð¾Ð±Ð¾Ñ‚Ð¸, Ð²Ñ–Ð½ ÐºÑƒÐ¿ÑƒÐ²Ð°Ð² Ñ…Ð»Ñ–Ð±.\n   - [ ] ÐŸÐ¾Ð²ÐµÑ€Ð½ÑƒÐ²ÑÑ Ð´Ð¾Ð´Ð¾Ð¼Ñƒ Ð· Ñ€Ð¾Ð±Ð¾Ñ‚Ð¸, Ð²Ñ–Ð½ ÐºÑƒÐ¿ÑƒÐ²Ð°Ð² Ñ…Ð»Ñ–Ð±.\n   > Â«ÐŸÐ¾Ð²ÐµÑ€Ñ‚Ð°ÑŽÑ‡Ð¸ÑÑŒÂ» â€” Ð´Ñ–Ñ”Ð¿Ñ€Ð¸ÑÐ»Ñ–Ð²Ð½Ð¸Ðº Ð²Ñ–Ð´ Ð·Ð²Ð¾Ñ€Ð¾Ñ‚Ð½Ð¾Ð³Ð¾ Ð´Ñ–Ñ”ÑÐ»Ð¾Ð²Ð°.\n\n7. While standing at the bus stop, people were waiting for the bus.\n   - [ ] ÐŸÐ¾ÑÑ‚Ð¾ÑÐ²ÑˆÐ¸ Ð½Ð° Ð·ÑƒÐ¿Ð¸Ð½Ñ†Ñ–, Ð»ÑŽÐ´Ð¸ Ñ‡ÐµÐºÐ°Ð»Ð¸ Ð½Ð° Ð°Ð²Ñ‚Ð¾Ð±ÑƒÑ.\n   - [ ] Ð¡Ñ‚Ð¾ÑÑ‚Ð¸ Ð½Ð° Ð·ÑƒÐ¿Ð¸Ð½Ñ†Ñ–, Ð»ÑŽÐ´Ð¸ Ñ‡ÐµÐºÐ°Ð»Ð¸ Ð½Ð° Ð°Ð²Ñ‚Ð¾Ð±ÑƒÑ.\n   - [x] Ð¡Ñ‚Ð¾ÑÑ‡Ð¸ Ð½Ð° Ð·ÑƒÐ¿Ð¸Ð½Ñ†Ñ–, Ð»ÑŽÐ´Ð¸ Ñ‡ÐµÐºÐ°Ð»Ð¸ Ð½Ð° Ð°Ð²Ñ‚Ð¾Ð±ÑƒÑ.\n   - [ ] Ð¡Ñ‚Ð¾ÑÐ»Ð¸ Ð½Ð° Ð·ÑƒÐ¿Ð¸Ð½Ñ†Ñ–, Ð»ÑŽÐ´Ð¸ Ñ‡ÐµÐºÐ°Ð»Ð¸ Ð½Ð° Ð°Ð²Ñ‚Ð¾Ð±ÑƒÑ.\n   > Â«Ð¡Ñ‚Ð¾ÑÑ‡Ð¸Â» ÑƒÑ‚Ð²Ð¾Ñ€ÑŽÑ”Ñ‚ÑŒÑÑ Ð²Ñ–Ð´ Ð¾ÑÐ½Ð¾Ð²Ð¸ Â«ÑÑ‚Ð¾-Â» + ÑÑƒÑ„Ñ–ÐºÑ -ÑÑ‡Ð¸.\n\n8. Writing the letter, he was remembering his childhood.\n   - [ ] ÐÐ°Ð¿Ð¸ÑÐ°Ð²ÑˆÐ¸ Ð»Ð¸ÑÑ‚Ð°, Ð²Ñ–Ð½ Ð·Ð³Ð°Ð´ÑƒÐ²Ð°Ð² Ð´Ð¸Ñ‚Ð¸Ð½ÑÑ‚Ð²Ð¾.\n   - [ ] ÐŸÐ¸ÑÐ°Ñ‚Ð¸ Ð»Ð¸ÑÑ‚Ð°, Ð²Ñ–Ð½ Ð·Ð³Ð°Ð´ÑƒÐ²Ð°Ð² Ð´Ð¸Ñ‚Ð¸Ð½ÑÑ‚Ð²Ð¾.\n   - [ ] ÐŸÐ¸ÑÐ°ÑŽÑ‡Ð¸ Ð»Ð¸ÑÑ‚Ð°, Ð²Ñ–Ð½ Ð·Ð³Ð°Ð´ÑƒÐ²Ð°Ð² Ð´Ð¸Ñ‚Ð¸Ð½ÑÑ‚Ð²Ð¾.\n   - [x] ÐŸÐ¸ÑˆÑƒÑ‡Ð¸ Ð»Ð¸ÑÑ‚Ð°, Ð²Ñ–Ð½ Ð·Ð³Ð°Ð´ÑƒÐ²Ð°Ð² ÑÐ²Ð¾Ñ” Ð´Ð¸Ñ‚Ð¸Ð½ÑÑ‚Ð²Ð¾.\n   > Â«ÐŸÐ¸ÑˆÑƒÑ‡Ð¸Â» â€” Ð²Ñ–Ð´ Ð¾ÑÐ½Ð¾Ð²Ð¸ Â«Ð¿Ð¸Ñˆ-Â» (Ð½Ðµ Â«Ð¿Ð¸ÑÐ°-Â»!).\n\n---\n\n# Ð¡Ð»Ð¾Ð²Ð½Ð¸Ðº\n\n| Ð¡Ð»Ð¾Ð²Ð¾ | Ð’Ð¸Ð¼Ð¾Ð²Ð° | ÐŸÐµÑ€ÐµÐºÐ»Ð°Ð´ | Ð§Ðœ | ÐŸÑ€Ð¸Ð¼Ñ–Ñ‚ÐºÐ° |\n|-------|--------|----------|-----|----------|\n| **Ñ‡Ð¸Ñ‚Ð°ÑŽÑ‡Ð¸** | /tÊƒÉªËˆtÉ‘jutÊƒÉª/ | while reading | Ð´Ñ–Ñ”Ð¿Ñ€. | Ð²Ñ–Ð´ Â«Ñ‡Ð¸Ñ‚Ð°Ñ‚Ð¸Â» |\n| **Ð¿Ð¸ÑˆÑƒÑ‡Ð¸** | /ËˆpÉªÊƒutÊƒÉª/ | while writing | Ð´Ñ–Ñ”Ð¿Ñ€. | Ð²Ñ–Ð´ Â«Ð¿Ð¸ÑÐ°Ñ‚Ð¸Â» |\n| **Ð³Ð¾Ð²Ð¾Ñ€ÑÑ‡Ð¸** | /É¦owoËˆrÊ²atÊƒÉª/ | while speaking | Ð´Ñ–Ñ”Ð¿Ñ€. | Ð²Ñ–Ð´ Â«Ð³Ð¾Ð²Ð¾Ñ€Ð¸Ñ‚Ð¸Â» |\n| **ÑÐ»ÑƒÑ…Ð°ÑŽÑ‡Ð¸** | /sluËˆxÉ‘jutÊƒÉª/ | while listening | Ð´Ñ–Ñ”Ð¿Ñ€. | Ð²Ñ–Ð´ Â«ÑÐ»ÑƒÑ…Ð°Ñ‚Ð¸Â» |\n| **Ð´Ð¸Ð²Ð»ÑÑ‡Ð¸ÑÑŒ** | /dÉªwËˆlÊ²atÊƒÉªsÊ²/ | while watching | Ð´Ñ–Ñ”Ð¿Ñ€. | Ð²Ñ–Ð´ Â«Ð´Ð¸Ð²Ð¸Ñ‚Ð¸ÑÑÂ» |\n| **Ð´ÑƒÐ¼Ð°ÑŽÑ‡Ð¸** | /duËˆmÉ‘jutÊƒÉª/ | while thinking | Ð´Ñ–Ñ”Ð¿Ñ€. | Ð²Ñ–Ð´ Â«Ð´ÑƒÐ¼Ð°Ñ‚Ð¸Â» |\n| **Ð¿Ñ€Ð°Ñ†ÑŽÑŽÑ‡Ð¸** | /prÉ‘ËˆtÍ¡sÊ²ujutÊƒÉª/ | while working | Ð´Ñ–Ñ”Ð¿Ñ€. | Ð²Ñ–Ð´ Â«Ð¿Ñ€Ð°Ñ†ÑŽÐ²Ð°Ñ‚Ð¸Â» |\n| **Ð¹Ð´ÑƒÑ‡Ð¸** | /ËˆjdutÊƒÉª/ | while going | Ð´Ñ–Ñ”Ð¿Ñ€. | Ð²Ñ–Ð´ Â«Ð¹Ñ‚Ð¸Â» |\n| **Ð±Ñ–Ð¶Ð°Ñ‡Ð¸** | /bÊ²iËˆÊ’É‘tÊƒÉª/ | while running | Ð´Ñ–Ñ”Ð¿Ñ€. | Ð²Ñ–Ð´ Â«Ð±Ñ–Ð³Ñ‚Ð¸Â» |\n| **ÑÑ‚Ð¾ÑÑ‡Ð¸** | /stoËˆjatÊƒÉª/ | while standing | Ð´Ñ–Ñ”Ð¿Ñ€. | Ð²Ñ–Ð´ Â«ÑÑ‚Ð¾ÑÑ‚Ð¸Â» |\n| **ÑÐ¸Ð´ÑÑ‡Ð¸** | /sÉªËˆdÊ²atÊƒÉª/ | while sitting | Ð´Ñ–Ñ”Ð¿Ñ€. | Ð²Ñ–Ð´ Â«ÑÐ¸Ð´Ñ–Ñ‚Ð¸Â» |\n| **Ð»ÐµÐ¶Ð°Ñ‡Ð¸** | /leËˆÊ’É‘tÊƒÉª/ | while lying | Ð´Ñ–Ñ”Ð¿Ñ€. | Ð²Ñ–Ð´ Â«Ð»ÐµÐ¶Ð°Ñ‚Ð¸Â» |\n| **Ñ—Ð´ÑƒÑ‡Ð¸** | /ËˆjidutÊƒÉª/ | while eating | Ð´Ñ–Ñ”Ð¿Ñ€. | Ð²Ñ–Ð´ Â«Ñ—ÑÑ‚Ð¸Â» |\n| **Ð»ÐµÑ‚ÑÑ‡Ð¸** | /leËˆtÊ²atÊƒÉª/ | while flying | Ð´Ñ–Ñ”Ð¿Ñ€. | Ð²Ñ–Ð´ Â«Ð»ÐµÑ‚Ñ–Ñ‚Ð¸Â» |\n| **Ð½ÐµÑÑƒÑ‡Ð¸** | /neËˆsutÊƒÉª/ | while carrying | Ð´Ñ–Ñ”Ð¿Ñ€. | Ð²Ñ–Ð´ Â«Ð½ÐµÑÑ‚Ð¸Â» |\n| **Ð²ÐµÐ´ÑƒÑ‡Ð¸** | /weËˆdutÊƒÉª/ | while leading | Ð´Ñ–Ñ”Ð¿Ñ€. | Ð²Ñ–Ð´ Â«Ð²ÐµÑÑ‚Ð¸Â» |\n| **Ð¿Ð¾Ð²ÐµÑ€Ñ‚Ð°ÑŽÑ‡Ð¸ÑÑŒ** | /powÉ›rËˆtÉ‘jutÊƒÉªsÊ²/ | while returning | Ð´Ñ–Ñ”Ð¿Ñ€. | Ð²Ñ–Ð´ Â«Ð¿Ð¾Ð²ÐµÑ€Ñ‚Ð°Ñ‚Ð¸ÑÑÂ» |\n| **Ð¾Ð´ÑÐ³Ð°ÑŽÑ‡Ð¸ÑÑŒ** | /odÊ²É‘ËˆÉ¦É‘jutÊƒÉªsÊ²/ | while dressing | Ð´Ñ–Ñ”Ð¿Ñ€. | Ð²Ñ–Ð´ Â«Ð¾Ð´ÑÐ³Ð°Ñ‚Ð¸ÑÑÂ» |\n| **Ð²Ð¼Ð¸Ð²Ð°ÑŽÑ‡Ð¸ÑÑŒ** | /wmÉªËˆwÉ‘jutÊƒÉªsÊ²/ | while washing | Ð´Ñ–Ñ”Ð¿Ñ€. | Ð²Ñ–Ð´ Â«Ð²Ð¼Ð¸Ð²Ð°Ñ‚Ð¸ÑÑÂ» |\n| **Ð³Ð¾Ñ‚ÑƒÑŽÑ‡Ð¸ÑÑŒ** | /É¦oËˆtujutÊƒÉªsÊ²/ | while preparing | Ð´Ñ–Ñ”Ð¿Ñ€. | Ð²Ñ–Ð´ Â«Ð³Ð¾Ñ‚ÑƒÐ²Ð°Ñ‚Ð¸ÑÑÂ» |\n| **ÑÐ¿Ñ–Ð²Ð°ÑŽÑ‡Ð¸** | /spÊ²iËˆwÉ‘jutÊƒÉª/ | while singing | Ð´Ñ–Ñ”Ð¿Ñ€. | Ð²Ñ–Ð´ Â«ÑÐ¿Ñ–Ð²Ð°Ñ‚Ð¸Â» |\n| **Ð³ÑƒÐ»ÑÑŽÑ‡Ð¸** | /É¦uËˆlÊ²ajutÊƒÉª/ | while walking | Ð´Ñ–Ñ”Ð¿Ñ€. | Ð²Ñ–Ð´ Â«Ð³ÑƒÐ»ÑÑ‚Ð¸Â» |\n| **Ñ‡ÐµÐºÐ°ÑŽÑ‡Ð¸** | /tÊƒeËˆkÉ‘jutÊƒÉª/ | while waiting | Ð´Ñ–Ñ”Ð¿Ñ€. | Ð²Ñ–Ð´ Â«Ñ‡ÐµÐºÐ°Ñ‚Ð¸Â» |\n| **Ñ€Ð°Ñ…ÑƒÑŽÑ‡Ð¸** | /rÉ‘ËˆxujutÊƒÉª/ | while counting | Ð´Ñ–Ñ”Ð¿Ñ€. | Ð²Ñ–Ð´ Â«Ñ€Ð°Ñ…ÑƒÐ²Ð°Ñ‚Ð¸Â» |\n| **Ð¼Ð¾Ð²Ñ‡Ð°Ñ‡Ð¸** | /mowËˆtÊƒÉ‘tÊƒÉª/ | while being silent | Ð´Ñ–Ñ”Ð¿Ñ€. | Ð²Ñ–Ð´ Â«Ð¼Ð¾Ð²Ñ‡Ð°Ñ‚Ð¸Â» |\n",
    "createdAt": "2025-12-26T18:40:04.935672Z",
    "modifiedAt": "2025-12-26T18:40:04.935672Z",
    "version": 2
  },
  "activities": [],
  "vocabulary": {
    "moduleId": "mod-uk-B1-42",
    "level": "B1",
    "phase": "B1.4 Advanced Grammar",
    "wordCount": 25,
    "newWordCount": 25,
    "reviewWordCount": 0,
    "transliterationMode": "none",
    "words": [
      {
        "id": "vocab-1",
        "uk": "**Ñ‡Ð¸Ñ‚Ð°ÑŽÑ‡Ð¸**",
        "ipa": "/tÊƒÉªËˆtÉ‘jutÊƒÉª/",
        "en": "while reading",
        "pos": "Ð´Ñ–Ñ”Ð¿Ñ€.",
        "gender": null,
        "note": ""
      },
      {
        "id": "vocab-2",
        "uk": "**Ð¿Ð¸ÑˆÑƒÑ‡Ð¸**",
        "ipa": "/ËˆpÉªÊƒutÊƒÉª/",
        "en": "while writing",
        "pos": "Ð´Ñ–Ñ”Ð¿Ñ€.",
        "gender": null,
        "note": ""
      },
      {
        "id": "vocab-3",
        "uk": "**Ð³Ð¾Ð²Ð¾Ñ€ÑÑ‡Ð¸**",
        "ipa": "/É¦owoËˆrÊ²atÊƒÉª/",
        "en": "while speaking",
        "pos": "Ð´Ñ–Ñ”Ð¿Ñ€.",
        "gender": null,
        "note": ""
      },
      {
        "id": "vocab-4",
        "uk": "**ÑÐ»ÑƒÑ…Ð°ÑŽÑ‡Ð¸**",
        "ipa": "/sluËˆxÉ‘jutÊƒÉª/",
        "en": "while listening",
        "pos": "Ð´Ñ–Ñ”Ð¿Ñ€.",
        "gender": null,
        "note": ""
      },
      {
        "id": "vocab-5",
        "uk": "**Ð´Ð¸Ð²Ð»ÑÑ‡Ð¸ÑÑŒ**",
        "ipa": "/dÉªwËˆlÊ²atÊƒÉªsÊ²/",
        "en": "while watching",
        "pos": "Ð´Ñ–Ñ”Ð¿Ñ€.",
        "gender": null,
        "note": ""
      },
      {
        "id": "vocab-6",
        "uk": "**Ð´ÑƒÐ¼Ð°ÑŽÑ‡Ð¸**",
        "ipa": "/duËˆmÉ‘jutÊƒÉª/",
        "en": "while thinking",
        "pos": "Ð´Ñ–Ñ”Ð¿Ñ€.",
        "gender": null,
        "note": ""
      },
      {
        "id": "vocab-7",
        "uk": "**Ð¿Ñ€Ð°Ñ†ÑŽÑŽÑ‡Ð¸**",
        "ipa": "/prÉ‘ËˆtÍ¡sÊ²ujutÊƒÉª/",
        "en": "while working",
        "pos": "Ð´Ñ–Ñ”Ð¿Ñ€.",
        "gender": null,
        "note": ""
      },
      {
        "id": "vocab-8",
        "uk": "**Ð¹Ð´ÑƒÑ‡Ð¸**",
        "ipa": "/ËˆjdutÊƒÉª/",
        "en": "while going",
        "pos": "Ð´Ñ–Ñ”Ð¿Ñ€.",
        "gender": null,
        "note": ""
      },
      {
        "id": "vocab-9",
        "uk": "**Ð±Ñ–Ð¶Ð°Ñ‡Ð¸**",
        "ipa": "/bÊ²iËˆÊ’É‘tÊƒÉª/",
        "en": "while running",
        "pos": "Ð´Ñ–Ñ”Ð¿Ñ€.",
        "gender": null,
        "note": ""
      },
      {
        "id": "vocab-10",
        "uk": "**ÑÑ‚Ð¾ÑÑ‡Ð¸**",
        "ipa": "/stoËˆjatÊƒÉª/",
        "en": "while standing",
        "pos": "Ð´Ñ–Ñ”Ð¿Ñ€.",
        "gender": null,
        "note": ""
      },
      {
        "id": "vocab-11",
        "uk": "**ÑÐ¸Ð´ÑÑ‡Ð¸**",
        "ipa": "/sÉªËˆdÊ²atÊƒÉª/",
        "en": "while sitting",
        "pos": "Ð´Ñ–Ñ”Ð¿Ñ€.",
        "gender": null,
        "note": ""
      },
      {
        "id": "vocab-12",
        "uk": "**Ð»ÐµÐ¶Ð°Ñ‡Ð¸**",
        "ipa": "/leËˆÊ’É‘tÊƒÉª/",
        "en": "while lying",
        "pos": "Ð´Ñ–Ñ”Ð¿Ñ€.",
        "gender": null,
        "note": ""
      },
      {
        "id": "vocab-13",
        "uk": "**Ñ—Ð´ÑƒÑ‡Ð¸**",
        "ipa": "/ËˆjidutÊƒÉª/",
        "en": "while eating",
        "pos": "Ð´Ñ–Ñ”Ð¿Ñ€.",
        "gender": null,
        "note": ""
      },
      {
        "id": "vocab-14",
        "uk": "**Ð»ÐµÑ‚ÑÑ‡Ð¸**",
        "ipa": "/leËˆtÊ²atÊƒÉª/",
        "en": "while flying",
        "pos": "Ð´Ñ–Ñ”Ð¿Ñ€.",
        "gender": null,
        "note": ""
      },
      {
        "id": "vocab-15",
        "uk": "**Ð½ÐµÑÑƒÑ‡Ð¸**",
        "ipa": "/neËˆsutÊƒÉª/",
        "en": "while carrying",
        "pos": "Ð´Ñ–Ñ”Ð¿Ñ€.",
        "gender": null,
        "note": ""
      },
      {
        "id": "vocab-16",
        "uk": "**Ð²ÐµÐ´ÑƒÑ‡Ð¸**",
        "ipa": "/weËˆdutÊƒÉª/",
        "en": "while leading",
        "pos": "Ð´Ñ–Ñ”Ð¿Ñ€.",
        "gender": null,
        "note": ""
      },
      {
        "id": "vocab-17",
        "uk": "**Ð¿Ð¾Ð²ÐµÑ€Ñ‚Ð°ÑŽÑ‡Ð¸ÑÑŒ**",
        "ipa": "/powÉ›rËˆtÉ‘jutÊƒÉªsÊ²/",
        "en": "while returning",
        "pos": "Ð´Ñ–Ñ”Ð¿Ñ€.",
        "gender": null,
        "note": ""
      },
      {
        "id": "vocab-18",
        "uk": "**Ð¾Ð´ÑÐ³Ð°ÑŽÑ‡Ð¸ÑÑŒ**",
        "ipa": "/odÊ²É‘ËˆÉ¦É‘jutÊƒÉªsÊ²/",
        "en": "while dressing",
        "pos": "Ð´Ñ–Ñ”Ð¿Ñ€.",
        "gender": null,
        "note": ""
      },
      {
        "id": "vocab-19",
        "uk": "**Ð²Ð¼Ð¸Ð²Ð°ÑŽÑ‡Ð¸ÑÑŒ**",
        "ipa": "/wmÉªËˆwÉ‘jutÊƒÉªsÊ²/",
        "en": "while washing",
        "pos": "Ð´Ñ–Ñ”Ð¿Ñ€.",
        "gender": null,
        "note": ""
      },
      {
        "id": "vocab-20",
        "uk": "**Ð³Ð¾Ñ‚ÑƒÑŽÑ‡Ð¸ÑÑŒ**",
        "ipa": "/É¦oËˆtujutÊƒÉªsÊ²/",
        "en": "while preparing",
        "pos": "Ð´Ñ–Ñ”Ð¿Ñ€.",
        "gender": null,
        "note": ""
      },
      {
        "id": "vocab-21",
        "uk": "**ÑÐ¿Ñ–Ð²Ð°ÑŽÑ‡Ð¸**",
        "ipa": "/spÊ²iËˆwÉ‘jutÊƒÉª/",
        "en": "while singing",
        "pos": "Ð´Ñ–Ñ”Ð¿Ñ€.",
        "gender": null,
        "note": ""
      },
      {
        "id": "vocab-22",
        "uk": "**Ð³ÑƒÐ»ÑÑŽÑ‡Ð¸**",
        "ipa": "/É¦uËˆlÊ²ajutÊƒÉª/",
        "en": "while walking",
        "pos": "Ð´Ñ–Ñ”Ð¿Ñ€.",
        "gender": null,
        "note": ""
      },
      {
        "id": "vocab-23",
        "uk": "**Ñ‡ÐµÐºÐ°ÑŽÑ‡Ð¸**",
        "ipa": "/tÊƒeËˆkÉ‘jutÊƒÉª/",
        "en": "while waiting",
        "pos": "Ð´Ñ–Ñ”Ð¿Ñ€.",
        "gender": null,
        "note": ""
      },
      {
        "id": "vocab-24",
        "uk": "**Ñ€Ð°Ñ…ÑƒÑŽÑ‡Ð¸**",
        "ipa": "/rÉ‘ËˆxujutÊƒÉª/",
        "en": "while counting",
        "pos": "Ð´Ñ–Ñ”Ð¿Ñ€.",
        "gender": null,
        "note": ""
      },
      {
        "id": "vocab-25",
        "uk": "**Ð¼Ð¾Ð²Ñ‡Ð°Ñ‡Ð¸**",
        "ipa": "/mowËˆtÊƒÉ‘tÊƒÉª/",
        "en": "while being silent",
        "pos": "Ð´Ñ–Ñ”Ð¿Ñ€.",
        "gender": null,
        "note": ""
      }
    ],
    "reviewWords": []
  }
}