{
  "$schema": "../../../schemas/vibe-module.schema.json",
  "lesson": {
    "id": "lesson-uk-B1-31",
    "moduleId": "mod-uk-B1-31",
    "languagePair": "l2-uk-en",
    "subject": "language",
    "owner": "curricula-opus",
    "visibility": "public",
    "language": "uk",
    "targetLevel": "B1",
    "phase": "B1.3a Complex Sentences",
    "moduleNumber": 31,
    "moduleType": "grammar",
    "pedagogy": "TTT",
    "immersionLevel": 0.6,
    "title": "Ð£Ð¼Ð¾Ð²Ð½Ñ– Ñ€ÐµÑ‡ÐµÐ½Ð½Ñ: Ñ€ÐµÐ°Ð»ÑŒÐ½Ð° ÑƒÐ¼Ð¾Ð²Ð° (ÑÐºÑ‰Ð¾)",
    "titleUk": null,
    "subtitle": "Real Conditionals - If Clauses",
    "description": "Learner understands real conditional constructions",
    "objectives": [
      "Learner understands real conditional constructions",
      "Learner can form conditional sentences with ÑÐºÑ‰Ð¾",
      "Learner can use correct tense sequences in conditionals"
    ],
    "objectivesUk": null,
    "grammarFocus": [
      "Real conditional constructions with ÑÐºÑ‰Ð¾",
      "Tense sequences in conditional sentences"
    ],
    "tags": [
      "grammar",
      "conditionals",
      "complex-sentences",
      "yakshcho"
    ],
    "totalDuration": 90,
    "transliterationMode": "none",
    "sections": [
      {
        "id": "section-1",
        "name": "ÐŸÑ–Ð´ÑÑƒÐ¼Ð¾Ðº",
        "nameEn": null,
        "type": "summary",
        "content": "**Ð©Ð¾ Ð²Ð¸ Ð½Ð°Ð²Ñ‡Ð¸Ð»Ð¸ÑÑ Ð² Ñ†ÑŒÐ¾Ð¼Ñƒ Ð¼Ð¾Ð´ÑƒÐ»Ñ–:**\n\n1. **Ð ÐµÐ°Ð»ÑŒÐ½Ð° ÑƒÐ¼Ð¾Ð²Ð°:** ÐžÐ¿Ð¸ÑÑƒÑ” ÑÐ¸Ñ‚ÑƒÐ°Ñ†Ñ–Ñ—, Ñ‰Ð¾ Ð¼Ð¾Ð¶ÑƒÑ‚ÑŒ ÑÐ¿Ñ€Ð°Ð²Ð´Ñ– ÑÑ‚Ð°Ñ‚Ð¸ÑÑ.\n2. **Ð¡Ð¿Ð¾Ð»ÑƒÑ‡Ð½Ð¸Ðº Â«ÑÐºÑ‰Ð¾Â»:** Ð’Ð²Ð¾Ð´Ð¸Ñ‚ÑŒ ÑƒÐ¼Ð¾Ð²Ñƒ Ð² Ñ€ÐµÑ‡ÐµÐ½Ð½Ñ–.\n3. **Ð§Ð°ÑÐ¾Ð²Ñ– ÑÑ…ÐµÐ¼Ð¸:** Ð¢ÐµÐ¿ÐµÑ€Ñ–ÑˆÐ½Ñ–Ð¹ + Ñ‚ÐµÐ¿ÐµÑ€Ñ–ÑˆÐ½Ñ–Ð¹ (Ð·Ð°Ð³Ð°Ð»ÑŒÐ½Ðµ) Ð°Ð±Ð¾ Ð¼Ð°Ð¹Ð±ÑƒÑ‚Ð½Ñ–Ð¹ + Ð¼Ð°Ð¹Ð±ÑƒÑ‚Ð½Ñ–Ð¹ (ÐºÐ¾Ð½ÐºÑ€ÐµÑ‚Ð½Ðµ).\n4. **ÐÐ»ÑŒÑ‚ÐµÑ€Ð½Ð°Ñ‚Ð¸Ð²Ð¸:** Â«ÐšÐ¾Ð»Ð¸Â», Â«Ñƒ Ð²Ð¸Ð¿Ð°Ð´ÐºÑƒ ÑÐºÑ‰Ð¾Â», Â«Ð·Ð° ÑƒÐ¼Ð¾Ð²Ð¸ Ñ‰Ð¾Â» Ñ‚Ð° Ñ–Ð½ÑˆÑ–.\n\n**ÐžÑÐ½Ð¾Ð²Ð½Ðµ Ð¿Ñ€Ð°Ð²Ð¸Ð»Ð¾:**\n\n> Ð ÐµÐ°Ð»ÑŒÐ½Ð° ÑƒÐ¼Ð¾Ð²Ð° = Ð¼Ð¾Ð¶Ð»Ð¸Ð²Ð° ÑÐ¸Ñ‚ÑƒÐ°Ñ†Ñ–Ñ. Ð’Ð¸ÐºÐ¾Ñ€Ð¸ÑÑ‚Ð¾Ð²ÑƒÐ¹Ñ‚Ðµ Â«ÑÐºÑ‰Ð¾Â» + Ð²Ñ–Ð´Ð¿Ð¾Ð²Ñ–Ð´Ð½Ð¸Ð¹ Ñ‡Ð°Ñ Ð´Ñ–Ñ”ÑÐ»Ð¾Ð²Ð°, ÑƒÐ·Ð³Ð¾Ð´Ð¶ÑƒÑŽÑ‡Ð¸ Ð¾Ð±Ð¸Ð´Ð²Ñ– Ñ‡Ð°ÑÑ‚Ð¸Ð½Ð¸ Ñ€ÐµÑ‡ÐµÐ½Ð½Ñ.\n\n**Ð”Ð°Ð»Ñ–:**\n\nÐ£ Ð½Ð°ÑÑ‚ÑƒÐ¿Ð½Ð¸Ñ… Ð¼Ð¾Ð´ÑƒÐ»ÑÑ… Ð¼Ð¸ Ñ€Ð¾Ð·Ð³Ð»ÑÐ½ÐµÐ¼Ð¾ **Ð½ÐµÑ€ÐµÐ°Ð»ÑŒÐ½Ñ– ÑƒÐ¼Ð¾Ð²Ð¸** Ð· Â«ÑÐºÐ±Ð¸Â» (Ð¼Ð¾Ð´ÑƒÐ»ÑŒ 32) Ñ‚Ð° **ÑÐºÐ»Ð°Ð´Ð½Ñ– ÐºÐ¾Ð¼Ð±Ñ–Ð½Ð¾Ð²Ð°Ð½Ñ– ÑƒÐ¼Ð¾Ð²Ð¸** (Ð¼Ð¾Ð´ÑƒÐ»ÑŒ 33). Ð¦Ðµ Ð´Ð¾Ð·Ð²Ð¾Ð»Ð¸Ñ‚ÑŒ Ð²Ð°Ð¼ Ð²Ð¸Ñ€Ð°Ð¶Ð°Ñ‚Ð¸ Ð³Ñ–Ð¿Ð¾Ñ‚ÐµÑ‚Ð¸Ñ‡Ð½Ñ– ÑÐ¸Ñ‚ÑƒÐ°Ñ†Ñ–Ñ— Ñ‚Ð° ÐºÐ¾Ð½Ñ‚Ñ€Ñ„Ð°ÐºÑ‚Ð¸Ñ‡Ð½Ñ– Ð¿Ñ€Ð¸Ð¿ÑƒÑ‰ÐµÐ½Ð½Ñ.\n\n> âœ… **Ð¡Ð°Ð¼Ð¾Ð¿ÐµÑ€ÐµÐ²Ñ–Ñ€ÐºÐ°**\n>\n> Ð§Ð¸ Ð¼Ð¾Ð¶ÐµÑ‚Ðµ Ð²Ð¸:\n> - [ ] Ð Ð¾Ð·Ñ€Ñ–Ð·Ð½Ð¸Ñ‚Ð¸ Ñ€ÐµÐ°Ð»ÑŒÐ½Ñƒ Ð¹ Ð½ÐµÑ€ÐµÐ°Ð»ÑŒÐ½Ñƒ ÑƒÐ¼Ð¾Ð²Ñƒ?\n> - [ ] ÐžÐ±Ñ€Ð°Ñ‚Ð¸ Ð¿Ñ€Ð°Ð²Ð¸Ð»ÑŒÐ½Ð¸Ð¹ Ñ‡Ð°ÑÐ¾Ð²Ð¸Ð¹ Ð¿Ð»Ð°Ð½ Ð´Ð»Ñ ÑƒÐ¼Ð¾Ð²Ð½Ð¾Ð³Ð¾ Ñ€ÐµÑ‡ÐµÐ½Ð½Ñ?\n> - [ ] Ð’Ð¸ÐºÐ¾Ñ€Ð¸ÑÑ‚Ð°Ñ‚Ð¸ Ð°Ð»ÑŒÑ‚ÐµÑ€Ð½Ð°Ñ‚Ð¸Ð²Ð½Ñ– ÑÐ¿Ð¾Ð»ÑƒÑ‡Ð½Ð¸ÐºÐ¸ ÑƒÐ¼Ð¾Ð²Ð¸?\n> - [ ] ÐŸÑ€Ð°Ð²Ð¸Ð»ÑŒÐ½Ð¾ Ñ€Ð¾Ð·ÑÑ‚Ð°Ð²Ð¸Ñ‚Ð¸ Ñ€Ð¾Ð·Ð´Ñ–Ð»Ð¾Ð²Ñ– Ð·Ð½Ð°ÐºÐ¸ Ð² ÑƒÐ¼Ð¾Ð²Ð½Ð¸Ñ… Ñ€ÐµÑ‡ÐµÐ½Ð½ÑÑ…?\n>\n> Ð¯ÐºÑ‰Ð¾ Ñ‚Ð°Ðº â€” Ð¿ÐµÑ€ÐµÑ…Ð¾Ð´ÑŒÑ‚Ðµ Ð´Ð¾ Ð²Ð¿Ñ€Ð°Ð² Ð´Ð»Ñ Ð·Ð°ÐºÑ€Ñ–Ð¿Ð»ÐµÐ½Ð½Ñ Ð¼Ð°Ñ‚ÐµÑ€Ñ–Ð°Ð»Ñƒ!\n\n---\n\n> [!resources] ðŸŽ§ Ð—Ð¾Ð²Ð½Ñ–ÑˆÐ½Ñ– Ñ€ÐµÑÑƒÑ€ÑÐ¸\n>\n> **Ð”Ð¾Ð´Ð°Ñ‚ÐºÐ¾Ð²Ñ– Ð¼Ð°Ñ‚ÐµÑ€Ñ–Ð°Ð»Ð¸ Ð´Ð»Ñ Ð²Ð¸Ð²Ñ‡ÐµÐ½Ð½Ñ:**\n> - ðŸ“– [Ð£Ð¼Ð¾Ð²Ð½Ñ– Ñ€ÐµÑ‡ÐµÐ½Ð½Ñ](https://uk.wikipedia.org/wiki/Ð¡ÐºÐ»Ð°Ð´Ð½Ð¾Ð¿Ñ–Ð´Ñ€ÑÐ´Ð½Ðµ_Ñ€ÐµÑ‡ÐµÐ½Ð½Ñ) â€” Ð’Ñ–ÐºÑ–Ð¿ÐµÐ´Ñ–Ñ\n> - ðŸ“º [Ukrainian Grammar](https://www.youtube.com/@ukrainianlesson) â€” Ð²Ñ–Ð´ÐµÐ¾ÑƒÑ€Ð¾ÐºÐ¸\n> - ðŸŽ§ [Ukrainian Lessons Podcast](https://ukrainianlessons.com/) â€” Ð¿Ð¾Ð´ÐºÐ°ÑÑ‚ Ð´Ð»Ñ Ð²Ð¸Ð²Ñ‡ÐµÐ½Ð½Ñ\n\n---"
      },
      {
        "id": "section-2",
        "name": "Ð’Ð¿Ñ€Ð°Ð²Ð¸",
        "nameEn": null,
        "type": "activities",
        "content": "## quiz: Ð’Ð¸Ð±ÐµÑ€Ñ–Ñ‚ÑŒ Ð¿Ñ€Ð°Ð²Ð¸Ð»ÑŒÐ½Ñƒ Ð²Ñ–Ð´Ð¿Ð¾Ð²Ñ–Ð´ÑŒ\n\n1. Ð¯ÐºÐµ Ñ€ÐµÑ‡ÐµÐ½Ð½Ñ Ñ” Ð¿Ñ€Ð°Ð²Ð¸Ð»ÑŒÐ½Ð¸Ð¼ Ð¿Ñ€Ð¸ÐºÐ»Ð°Ð´Ð¾Ð¼ Ñ€ÐµÐ°Ð»ÑŒÐ½Ð¾Ñ— ÑƒÐ¼Ð¾Ð²Ð¸ Ð· Ð²Ð¸ÐºÐ¾Ñ€Ð¸ÑÑ‚Ð°Ð½Ð½ÑÐ¼ ÑÐ¿Ð¾Ð»ÑƒÑ‡Ð½Ð¸ÐºÐ° Â«ÑÐºÑ‰Ð¾Â» Ð² ÑƒÐºÑ€Ð°Ñ—Ð½ÑÑŒÐºÑ–Ð¹ Ð¼Ð¾Ð²Ñ–?\n   - [x] Ð¯ÐºÑ‰Ð¾ Ð¼Ð°Ñ‚Ð¸Ð¼ÐµÑˆ Ñ‡Ð°Ñ, Ð·Ð°Ñ‚ÐµÐ»ÐµÑ„Ð¾Ð½ÑƒÐ¹ Ð¼ÐµÐ½Ñ– Ð²Ð²ÐµÑ‡ÐµÑ€Ñ–.\n   - [ ] Ð¯ÐºÐ±Ð¸ Ð¼Ð°Ñ‚Ð¸Ð¼ÐµÑˆ Ñ‡Ð°Ñ, Ð·Ð°Ñ‚ÐµÐ»ÐµÑ„Ð¾Ð½ÑƒÐ¹ Ð¼ÐµÐ½Ñ– Ð²Ð²ÐµÑ‡ÐµÑ€Ñ–.\n   - [ ] Ð¯ÐºÑ‰Ð¾ Ð¼Ð°Ñ‚Ð¸Ð¼ÐµÑˆ Ñ‡Ð°Ñ, Ð·Ð°Ñ‚ÐµÐ»ÐµÑ„Ð¾Ð½ÑƒÐ²Ð°Ð² Ð¼ÐµÐ½Ñ– Ð²Ð²ÐµÑ‡ÐµÑ€Ñ–.\n   - [ ] ÐšÐ¾Ð»Ð¸ Ð± Ð¼Ð°Ñ‚Ð¸Ð¼ÐµÑˆ Ñ‡Ð°Ñ, Ð·Ð°Ñ‚ÐµÐ»ÐµÑ„Ð¾Ð½ÑƒÐ¹ Ð¼ÐµÐ½Ñ– Ð²Ð²ÐµÑ‡ÐµÑ€Ñ–.\n   > Ð ÐµÐ°Ð»ÑŒÐ½Ð° ÑƒÐ¼Ð¾Ð²Ð° Ð²Ð¸ÐºÐ¾Ñ€Ð¸ÑÑ‚Ð¾Ð²ÑƒÑ” Â«ÑÐºÑ‰Ð¾Â» + Ð¼Ð°Ð¹Ð±ÑƒÑ‚Ð½Ñ–Ð¹/Ñ‚ÐµÐ¿ÐµÑ€Ñ–ÑˆÐ½Ñ–Ð¹ Ñ‡Ð°Ñ.\n\n2. Ð¯ÐºÐ¸Ð¹ Ñ‡Ð°ÑÐ¾Ð²Ð¸Ð¹ Ð¿Ð»Ð°Ð½ Ñ” Ð¿Ñ€Ð°Ð²Ð¸Ð»ÑŒÐ½Ð¸Ð¼ Ð´Ð»Ñ Ñ€ÐµÐ°Ð»ÑŒÐ½Ð¾Ñ— ÑƒÐ¼Ð¾Ð²Ð¸, Ñ‰Ð¾ Ð¾Ð¿Ð¸ÑÑƒÑ” ÐºÐ¾Ð½ÐºÑ€ÐµÑ‚Ð½Ñƒ Ð¼Ð°Ð¹Ð±ÑƒÑ‚Ð½ÑŽ ÑÐ¸Ñ‚ÑƒÐ°Ñ†Ñ–ÑŽ?\n   - [ ] ÐœÐ¸Ð½ÑƒÐ»Ð¸Ð¹ Ñ‡Ð°Ñ Ð² ÑƒÐ¼Ð¾Ð²Ñ– + Ñ‚ÐµÐ¿ÐµÑ€Ñ–ÑˆÐ½Ñ–Ð¹ Ñ‡Ð°Ñ Ñƒ Ð½Ð°ÑÐ»Ñ–Ð´ÐºÑƒ.\n   - [ ] Ð¢ÐµÐ¿ÐµÑ€Ñ–ÑˆÐ½Ñ–Ð¹ Ñ‡Ð°Ñ Ð² ÑƒÐ¼Ð¾Ð²Ñ– + Ð¼Ð¸Ð½ÑƒÐ»Ð¸Ð¹ Ñ‡Ð°Ñ Ñƒ Ð½Ð°ÑÐ»Ñ–Ð´ÐºÑƒ.\n   - [x] ÐœÐ°Ð¹Ð±ÑƒÑ‚Ð½Ñ–Ð¹ Ñ‡Ð°Ñ Ð² ÑƒÐ¼Ð¾Ð²Ñ– + Ð¼Ð°Ð¹Ð±ÑƒÑ‚Ð½Ñ–Ð¹ Ñ‡Ð°Ñ Ñƒ Ð½Ð°ÑÐ»Ñ–Ð´ÐºÑƒ.\n   - [ ] Ð£Ð¼Ð¾Ð²Ð½Ð¸Ð¹ ÑÐ¿Ð¾ÑÑ–Ð± Ð² Ð¾Ð±Ð¾Ñ… Ñ‡Ð°ÑÑ‚Ð¸Ð½Ð°Ñ… Ñ€ÐµÑ‡ÐµÐ½Ð½Ñ.\n   > Ð”Ð»Ñ ÐºÐ¾Ð½ÐºÑ€ÐµÑ‚Ð½Ð¸Ñ… Ð¼Ð°Ð¹Ð±ÑƒÑ‚Ð½Ñ–Ñ… ÑÐ¸Ñ‚ÑƒÐ°Ñ†Ñ–Ð¹: Ð¼Ð°Ð¹Ð±ÑƒÑ‚Ð½Ñ–Ð¹ + Ð¼Ð°Ð¹Ð±ÑƒÑ‚Ð½Ñ–Ð¹.\n\n3. Ð£ ÑÐºÐ¾Ð¼Ñƒ Ð· Ð½Ð°Ð²ÐµÐ´ÐµÐ½Ð¸Ñ… Ñ€ÐµÑ‡ÐµÐ½ÑŒ Ð¿Ñ€Ð°Ð²Ð¸Ð»ÑŒÐ½Ð¾ Ð²Ð¸ÐºÐ¾Ñ€Ð¸ÑÑ‚Ð°Ð½Ð¾ Ð·Ð°Ð¿ÐµÑ€ÐµÑ‡ÐµÐ½Ð½Ñ Ð² ÑƒÐ¼Ð¾Ð²Ð½Ñ–Ð¹ Ñ‡Ð°ÑÑ‚Ð¸Ð½Ñ– Ð· Â«ÑÐºÑ‰Ð¾Â»?\n   - [x] Ð¯ÐºÑ‰Ð¾ Ð²Ñ–Ð½ Ð½Ðµ Ð¿Ñ€Ð¸Ð¹Ð´Ðµ Ð²Ñ‡Ð°ÑÐ½Ð¾, Ð¼Ð¸ Ð¿Ð¾Ñ‡Ð½ÐµÐ¼Ð¾ Ð±ÐµÐ· Ð½ÑŒÐ¾Ð³Ð¾.\n   - [ ] Ð¯ÐºÑ‰Ð¾ Ð½Ðµ Ð²Ñ–Ð½ Ð¿Ñ€Ð¸Ð¹Ð´Ðµ Ð²Ñ‡Ð°ÑÐ½Ð¾, Ð¼Ð¸ Ð¿Ð¾Ñ‡Ð½ÐµÐ¼Ð¾ Ð±ÐµÐ· Ð½ÑŒÐ¾Ð³Ð¾.\n   - [ ] Ð¯ÐºÑ‰Ð¾ Ð²Ñ–Ð½ Ð¿Ñ€Ð¸Ð¹Ð´Ðµ Ð½Ðµ Ð²Ñ‡Ð°ÑÐ½Ð¾, Ð¼Ð¸ Ð¿Ð¾Ñ‡Ð½ÐµÐ¼Ð¾ Ð±ÐµÐ· Ð½ÑŒÐ¾Ð³Ð¾.\n   - [ ] ÐÐµ ÑÐºÑ‰Ð¾ Ð²Ñ–Ð½ Ð¿Ñ€Ð¸Ð¹Ð´Ðµ, Ð¼Ð¸ Ð¿Ð¾Ñ‡Ð½ÐµÐ¼Ð¾ Ð±ÐµÐ· Ð½ÑŒÐ¾Ð³Ð¾.\n   > Ð—Ð°Ð¿ÐµÑ€ÐµÑ‡ÐµÐ½Ð½Ñ Â«Ð½ÐµÂ» ÑÑ‚Ð°Ð²Ð¸Ñ‚ÑŒÑÑ Ð¿ÐµÑ€ÐµÐ´ Ð´Ñ–Ñ”ÑÐ»Ð¾Ð²Ð¾Ð¼ Ð² ÑƒÐ¼Ð¾Ð²Ñ–.\n\n4. Ð¯ÐºÐ¸Ð¹ ÑÐ¿Ð¾Ð»ÑƒÑ‡Ð½Ð¸Ðº Ð¼Ð¾Ð¶Ð½Ð° Ð²Ð¸ÐºÐ¾Ñ€Ð¸ÑÑ‚Ð°Ñ‚Ð¸ Ð·Ð°Ð¼Ñ–ÑÑ‚ÑŒ Â«ÑÐºÑ‰Ð¾Â» Ð´Ð»Ñ Ð²Ð¸Ñ€Ð°Ð¶ÐµÐ½Ð½Ñ ÑƒÐ¼Ð¾Ð²Ð¸ Ð· Ñ‡Ð°ÑÐ¾Ð²Ð¸Ð¼ Ð²Ñ–Ð´Ñ‚Ñ–Ð½ÐºÐ¾Ð¼?\n   - [ ] Ñ‚Ð¾Ð¼Ñƒ Ñ‰Ð¾\n   - [x] ÐºÐ¾Ð»Ð¸\n   - [ ] Ñ…Ð¾Ñ‡Ð°\n   - [ ] Ð±Ð¾\n   > Â«ÐšÐ¾Ð»Ð¸Â» Ð¼Ð¾Ð¶Ðµ Ð¼Ð°Ñ‚Ð¸ ÑƒÐ¼Ð¾Ð²Ð½Ðµ Ð·Ð½Ð°Ñ‡ÐµÐ½Ð½Ñ: Â«ÐšÐ¾Ð»Ð¸ Ð¼Ð°Ñ‚Ð¸Ð¼ÐµÑˆ Ñ‡Ð°Ñ...Â»\n\n5. Ð¯ÐºÐµ Ð· Ð½Ð°Ð²ÐµÐ´ÐµÐ½Ð¸Ñ… Ñ€ÐµÑ‡ÐµÐ½ÑŒ Ð¼Ñ–ÑÑ‚Ð¸Ñ‚ÑŒ Ð¿Ð¾Ð¼Ð¸Ð»ÐºÑƒ Ð² Ð¿ÑƒÐ½ÐºÑ‚ÑƒÐ°Ñ†Ñ–Ñ— ÑƒÐ¼Ð¾Ð²Ð½Ð¾Ð³Ð¾ Ñ€ÐµÑ‡ÐµÐ½Ð½Ñ Ð· Ð²Ð¸ÐºÐ¾Ñ€Ð¸ÑÑ‚Ð°Ð½Ð½ÑÐ¼ ÑÐ¿Ð¾Ð»ÑƒÑ‡Ð½Ð¸ÐºÐ° Â«ÑÐºÑ‰Ð¾Â»?\n   - [ ] Ð¯ÐºÑ‰Ð¾ Ñ…Ð¾Ñ‡ÐµÑˆ, Ñ Ð¼Ð¾Ð¶Ñƒ Ð´Ð¾Ð¿Ð¾Ð¼Ð¾Ð³Ñ‚Ð¸ Ñ‚Ð¾Ð±Ñ–.\n   - [x] Ð¯ÐºÑ‰Ð¾ Ñ…Ð¾Ñ‡ÐµÑˆ Ñ Ð¼Ð¾Ð¶Ñƒ Ð´Ð¾Ð¿Ð¾Ð¼Ð¾Ð³Ñ‚Ð¸ Ñ‚Ð¾Ð±Ñ–.\n   - [ ] Ð¯ Ð¼Ð¾Ð¶Ñƒ Ð´Ð¾Ð¿Ð¾Ð¼Ð¾Ð³Ñ‚Ð¸ Ñ‚Ð¾Ð±Ñ–, ÑÐºÑ‰Ð¾ Ñ…Ð¾Ñ‡ÐµÑˆ.\n   - [ ] Ð¯ÐºÑ‰Ð¾ Ñ…Ð¾Ñ‡ÐµÑˆ â€” Ð´Ð¾Ð¿Ð¾Ð¼Ð¾Ð¶Ñƒ.\n   > ÐŸÑ–ÑÐ»Ñ Ð¿Ñ–Ð´Ñ€ÑÐ´Ð½Ð¾Ð³Ð¾ Ñ€ÐµÑ‡ÐµÐ½Ð½Ñ Ð· Â«ÑÐºÑ‰Ð¾Â» Ð¿Ð¾Ñ‚Ñ€Ñ–Ð±Ð½Ð° ÐºÐ¾Ð¼Ð°.\n\n6. Ð¯ÐºÐ¸Ð¹ Ñ‡Ð°ÑÐ¾Ð²Ð¸Ð¹ Ð¿Ð»Ð°Ð½ Ð¿Ñ–Ð´Ñ…Ð¾Ð´Ð¸Ñ‚ÑŒ Ð´Ð»Ñ Ð²Ð¸Ñ€Ð°Ð¶ÐµÐ½Ð½Ñ Ð·Ð°Ð³Ð°Ð»ÑŒÐ½Ð¾Ñ— Ñ–ÑÑ‚Ð¸Ð½Ð¸ Ð°Ð±Ð¾ Ð¿Ð¾ÑÑ‚Ñ–Ð¹Ð½Ð¾Ð³Ð¾ Ð·Ð²'ÑÐ·ÐºÑƒ?\n   - [x] Ð¢ÐµÐ¿ÐµÑ€Ñ–ÑˆÐ½Ñ–Ð¹ Ñ‡Ð°Ñ Ð² ÑƒÐ¼Ð¾Ð²Ñ– + Ñ‚ÐµÐ¿ÐµÑ€Ñ–ÑˆÐ½Ñ–Ð¹ Ñ‡Ð°Ñ Ñƒ Ð½Ð°ÑÐ»Ñ–Ð´ÐºÑƒ.\n   - [ ] ÐœÐ°Ð¹Ð±ÑƒÑ‚Ð½Ñ–Ð¹ Ñ‡Ð°Ñ Ð² ÑƒÐ¼Ð¾Ð²Ñ– + Ð¼Ð°Ð¹Ð±ÑƒÑ‚Ð½Ñ–Ð¹ Ñ‡Ð°Ñ Ñƒ Ð½Ð°ÑÐ»Ñ–Ð´ÐºÑƒ.\n   - [ ] ÐœÐ¸Ð½ÑƒÐ»Ð¸Ð¹ Ñ‡Ð°Ñ Ð² Ð¾Ð±Ð¾Ñ… Ñ‡Ð°ÑÑ‚Ð¸Ð½Ð°Ñ… Ñ€ÐµÑ‡ÐµÐ½Ð½Ñ.\n   - [ ] Ð£Ð¼Ð¾Ð²Ð½Ð¸Ð¹ ÑÐ¿Ð¾ÑÑ–Ð± Ð² Ð¾Ð±Ð¾Ñ… Ñ‡Ð°ÑÑ‚Ð¸Ð½Ð°Ñ… Ñ€ÐµÑ‡ÐµÐ½Ð½Ñ.\n   > Ð—Ð°Ð³Ð°Ð»ÑŒÐ½Ñ– Ñ–ÑÑ‚Ð¸Ð½Ð¸: Ñ‚ÐµÐ¿ÐµÑ€Ñ–ÑˆÐ½Ñ–Ð¹ + Ñ‚ÐµÐ¿ÐµÑ€Ñ–ÑˆÐ½Ñ–Ð¹.\n\n7. Ð¯ÐºÐ° ÐºÐ¾Ð½ÑÑ‚Ñ€ÑƒÐºÑ†Ñ–Ñ Ñ” Ð¿Ñ€Ð°Ð²Ð¸Ð»ÑŒÐ½Ð¸Ð¼ ÐµÐºÐ²Ñ–Ð²Ð°Ð»ÐµÐ½Ñ‚Ð¾Ð¼ Ð°Ð½Ð³Ð»Ñ–Ð¹ÑÑŒÐºÐ¾Ð³Ð¾ Â«in case ifÂ» Ð´Ð»Ñ Ð²Ð¸Ñ€Ð°Ð¶ÐµÐ½Ð½Ñ Ð·Ð°Ð¿Ð°ÑÐ½Ð¾Ð³Ð¾ Ð¿Ð»Ð°Ð½Ñƒ?\n   - [ ] ÑÐºÑ‰Ð¾ Ñ‚Ñ–Ð»ÑŒÐºÐ¸\n   - [ ] Ñ‚Ð¾Ð¼Ñƒ Ñ‰Ð¾\n   - [x] Ñƒ Ð²Ð¸Ð¿Ð°Ð´ÐºÑƒ ÑÐºÑ‰Ð¾\n   - [ ] Ñ…Ð¾Ñ‡Ð° Ð±\n   > Â«Ð£ Ð²Ð¸Ð¿Ð°Ð´ÐºÑƒ ÑÐºÑ‰Ð¾Â» = in case if.\n\n8. Ð¯Ðº Ð¿Ñ€Ð°Ð²Ð¸Ð»ÑŒÐ½Ð¾ Ð²Ð¸Ñ€Ð°Ð·Ð¸Ñ‚Ð¸ ÑƒÐ¼Ð¾Ð²Ñƒ Â«ÑÐºÑ‰Ð¾ Ð½Ðµ Ð±ÑƒÐ´Ðµ Ð´Ð¾Ñ‰ÑƒÂ» Ð² Ñ€ÐµÑ‡ÐµÐ½Ð½Ñ– Â«ÐœÐ¸ Ð¿Ñ–Ð´ÐµÐ¼Ð¾ Ð½Ð° Ð¿Ñ€Ð¾Ð³ÑƒÐ»ÑÐ½ÐºÑƒÂ»?\n   - [ ] ÐœÐ¸ Ð¿Ñ–Ð´ÐµÐ¼Ð¾ Ð½Ð° Ð¿Ñ€Ð¾Ð³ÑƒÐ»ÑÐ½ÐºÑƒ ÑÐºÑ‰Ð¾ Ð´Ð¾Ñ‰ Ð½Ðµ Ð±ÑƒÐ´Ðµ.\n   - [x] ÐœÐ¸ Ð¿Ñ–Ð´ÐµÐ¼Ð¾ Ð½Ð° Ð¿Ñ€Ð¾Ð³ÑƒÐ»ÑÐ½ÐºÑƒ, ÑÐºÑ‰Ð¾ Ð½Ðµ Ð±ÑƒÐ´Ðµ Ð´Ð¾Ñ‰Ñƒ.\n   - [ ] ÐœÐ¸ Ð¿Ñ–Ð´ÐµÐ¼Ð¾ Ð½Ð° Ð¿Ñ€Ð¾Ð³ÑƒÐ»ÑÐ½ÐºÑƒ, ÑÐºÑ‰Ð¾ Ð±ÑƒÐ´Ðµ Ð½Ðµ Ð´Ð¾Ñ‰Ñƒ.\n   - [ ] ÐœÐ¸ Ð¿Ñ–Ð´ÐµÐ¼Ð¾ Ð½Ð° Ð¿Ñ€Ð¾Ð³ÑƒÐ»ÑÐ½ÐºÑƒ Ð½Ðµ ÑÐºÑ‰Ð¾ Ð±ÑƒÐ´Ðµ Ð´Ð¾Ñ‰.\n   > ÐŸÑ€Ð°Ð²Ð¸Ð»ÑŒÐ½Ð¸Ð¹ Ð¿Ð¾Ñ€ÑÐ´Ð¾Ðº: Â«ÑÐºÑ‰Ð¾ Ð½Ðµ Ð±ÑƒÐ´Ðµ Ð´Ð¾Ñ‰ÑƒÂ».\n\n---\n\n## match-up: Ð—'Ñ”Ð´Ð½Ð°Ð¹Ñ‚Ðµ ÑƒÐ¼Ð¾Ð²Ñƒ Ð· Ð½Ð°ÑÐ»Ñ–Ð´ÐºÐ¾Ð¼\n\n- Ð¯ÐºÑ‰Ð¾ Ð±ÑƒÐ´Ðµ Ð³Ð°Ñ€Ð½Ð° Ð¿Ð¾Ð³Ð¾Ð´Ð° :: Ð¼Ð¸ Ð¿Ñ–Ð´ÐµÐ¼Ð¾ Ð½Ð° Ð¿Ñ–ÐºÐ½Ñ–Ðº.\n- Ð¯ÐºÑ‰Ð¾ Ð¼Ð°Ñ‚Ð¸Ð¼ÐµÑˆ Ñ‡Ð°Ñ :: Ð·Ð°Ñ‚ÐµÐ»ÐµÑ„Ð¾Ð½ÑƒÐ¹ Ð¼ÐµÐ½Ñ– Ð²Ð²ÐµÑ‡ÐµÑ€Ñ–.\n- Ð¯ÐºÑ‰Ð¾ Ñ…Ð¾Ñ‡ÐµÑˆ :: Ñ Ð¼Ð¾Ð¶Ñƒ Ð´Ð¾Ð¿Ð¾Ð¼Ð¾Ð³Ñ‚Ð¸ Ñ‚Ð¾Ð±Ñ–.\n- Ð¯ÐºÑ‰Ð¾ Ð²Ñ–Ð½ Ð·Ð°Ð¿Ñ–Ð·Ð½Ð¸Ñ‚ÑŒÑÑ :: Ð¼Ð¸ Ð¿Ð¾Ñ‡Ð½ÐµÐ¼Ð¾ Ð±ÐµÐ· Ð½ÑŒÐ¾Ð³Ð¾.\n- Ð¯ÐºÑ‰Ð¾ Ð´Ð¾Ñ‰Ð¸Ñ‚Ð¸Ð¼Ðµ :: Ð²Ñ–Ð·ÑŒÐ¼Ð¸ Ð¿Ð°Ñ€Ð°ÑÐ¾Ð»ÑŒÐºÑƒ Ð· ÑÐ¾Ð±Ð¾ÑŽ.\n- Ð¯ÐºÑ‰Ð¾ Ñ‚Ð¸ Ð½Ðµ Ñ€Ð¾Ð·ÑƒÐ¼Ñ–Ñ”Ñˆ :: Ð¿Ð¸Ñ‚Ð°Ð¹ Ð±ÐµÐ· Ð²Ð°Ð³Ð°Ð½ÑŒ.\n- Ð¯ÐºÑ‰Ð¾ Ð¿Ð¾Ð³Ð¾Ð´Ð¸ÑˆÑÑ :: Ð¼Ð¸ Ð¿Ñ–Ð´Ð¿Ð¸ÑˆÐµÐ¼Ð¾ ÐºÐ¾Ð½Ñ‚Ñ€Ð°ÐºÑ‚ Ð·Ð°Ð²Ñ‚Ñ€Ð°.\n- Ð¯ÐºÑ‰Ð¾ Ð²Ð¸Ð½Ð¸ÐºÐ½ÑƒÑ‚ÑŒ Ð·Ð°Ð¿Ð¸Ñ‚Ð°Ð½Ð½Ñ :: Ð·Ð²ÐµÑ€Ð½Ñ–Ñ‚ÑŒÑÑ Ð´Ð¾ Ð¼ÐµÐ½ÐµÐ´Ð¶ÐµÑ€Ð°.\n- Ð¯ÐºÑ‰Ð¾ Ð·Ð°ÐºÑ–Ð½Ñ‡Ð¸Ñˆ Ñ€Ð°Ð½Ñ–ÑˆÐµ :: Ð¼Ð¾Ð¶ÐµÑˆ Ñ–Ñ‚Ð¸ Ð´Ð¾Ð´Ð¾Ð¼Ñƒ.\n- Ð¯ÐºÑ‰Ð¾ Ð²ÑÐµ Ð±ÑƒÐ´Ðµ Ð´Ð¾Ð±Ñ€Ðµ :: Ð¿Ð¾Ð±Ð°Ñ‡Ð¸Ð¼Ð¾ÑÑ Ð² Ð¿Ð¾Ð½ÐµÐ´Ñ–Ð»Ð¾Ðº.\n- Ð£ Ð²Ð¸Ð¿Ð°Ð´ÐºÑƒ ÑÐºÑ‰Ð¾ Ð·Ð°Ð±ÑƒÐ´ÐµÑˆ :: Ð½Ð°Ð³Ð°Ð´Ð°ÑŽ Ñ‚Ð¾Ð±Ñ– Ð·Ð°Ð²Ñ‚Ñ€Ð°.\n- Ð—Ð° ÑƒÐ¼Ð¾Ð²Ð¸ Ñ‰Ð¾ Ð²ÑÑ– Ð¿Ð¾Ð³Ð¾Ð´ÑÑ‚ÑŒÑÑ :: Ð¿Ð¾Ñ‡Ð½ÐµÐ¼Ð¾ Ñ€Ð¾Ð±Ð¾Ñ‚Ñƒ Ð½ÐµÐ³Ð°Ð¹Ð½Ð¾.\n\n---\n\n## fill-in: Ð”Ð¾Ð¿Ð¾Ð²Ð½Ñ–Ñ‚ÑŒ Ñ€ÐµÑ‡ÐµÐ½Ð½Ñ Ð¿Ñ€Ð°Ð²Ð¸Ð»ÑŒÐ½Ð¾ÑŽ Ñ„Ð¾Ñ€Ð¼Ð¾ÑŽ\n\n1. Ð¯ÐºÑ‰Ð¾ Ð²Ñ–Ð½ ___ Ð²Ñ‡Ð°ÑÐ½Ð¾, Ð¼Ð¸ Ð¿Ð¾Ð³Ð¾Ð²Ð¾Ñ€Ð¸Ð¼Ð¾ Ð¿Ñ€Ð¾ Ð²Ð°Ð¶Ð»Ð¸Ð²Ð¸Ð¹ Ð¿Ñ€Ð¾Ñ”ÐºÑ‚.\n   > [!answer] Ð¿Ñ€Ð¸Ð¹Ð´Ðµ\n   > [!options] Ð¿Ñ€Ð¸Ð¹Ð´Ðµ | Ð¿Ñ€Ð¸Ñ…Ð¾Ð´Ð¸Ñ‚ÑŒ | Ð¿Ñ€Ð¸Ð¹ÑˆÐ¾Ð² | Ð¿Ñ€Ð¸Ñ…Ð¾Ð´Ð¸Ð²\n\n2. ÐœÐ¸ Ð¿Ñ–Ð´ÐµÐ¼Ð¾ Ð½Ð° Ð¿Ñ€Ð¾Ð³ÑƒÐ»ÑÐ½ÐºÑƒ, ÑÐºÑ‰Ð¾ Ð¿Ð¾Ð³Ð¾Ð´Ð° ___ Ð³Ð°Ñ€Ð½Ð¾ÑŽ.\n   > [!answer] Ð±ÑƒÐ´Ðµ\n   > [!options] Ð±ÑƒÐ´Ðµ | Ñ” | Ð±ÑƒÐ»Ð° | Ð±ÑƒÐ²Ð°Ð»Ð°\n\n3. Ð¯ÐºÑ‰Ð¾ Ñ‚Ð¸ ___ Ð´Ð¾Ð¿Ð¾Ð¼Ð¾Ð³Ñ‚Ð¸, Ñ Ð±ÑƒÐ´Ñƒ Ð´ÑƒÐ¶Ðµ Ð²Ð´ÑÑ‡Ð½Ð¸Ð¹ Ñ‚Ð¾Ð±Ñ–.\n   > [!answer] Ð·Ð¼Ð¾Ð¶ÐµÑˆ\n   > [!options] Ð·Ð¼Ð¾Ð¶ÐµÑˆ | Ð¼Ð¾Ð¶ÐµÑˆ | Ð·Ð¼Ñ–Ð³ | Ð¼Ð¾Ð³Ñ‚Ð¸Ð¼ÐµÑˆ\n\n4. Ð¯ÐºÑ‰Ð¾ Ñƒ Ð²Ð°Ñ ___ Ð·Ð°Ð¿Ð¸Ñ‚Ð°Ð½Ð½Ñ, Ð·Ð²ÐµÑ€Ð½Ñ–Ñ‚ÑŒÑÑ Ð´Ð¾ Ð°Ð´Ð¼Ñ–Ð½Ñ–ÑÑ‚Ñ€Ð°Ñ‚Ð¾Ñ€Ð°.\n   > [!answer] Ð²Ð¸Ð½Ð¸ÐºÐ½ÑƒÑ‚ÑŒ\n   > [!options] Ð²Ð¸Ð½Ð¸ÐºÐ½ÑƒÑ‚ÑŒ | Ð²Ð¸Ð½Ð¸ÐºÐ°ÑŽÑ‚ÑŒ | Ð²Ð¸Ð½Ð¸ÐºÐ»Ð¸ | Ð²Ð¸Ð½Ð¸ÐºÐ°Ñ‚Ð¸Ð¼ÑƒÑ‚ÑŒ\n\n5. Ð¯ Ð·Ð°Ñ‚ÐµÐ»ÐµÑ„Ð¾Ð½ÑƒÑŽ Ñ‚Ð¾Ð±Ñ– Ð²Ð²ÐµÑ‡ÐµÑ€Ñ–, ÑÐºÑ‰Ð¾ ___ Ñ€Ð°Ð½Ñ–ÑˆÐµ Ð· Ñ€Ð¾Ð±Ð¾Ñ‚Ð¸.\n   > [!answer] Ð·Ð°ÐºÑ–Ð½Ñ‡Ñƒ\n   > [!options] Ð·Ð°ÐºÑ–Ð½Ñ‡Ñƒ | Ð·Ð°ÐºÑ–Ð½Ñ‡Ð¸Ð² | Ð·Ð°ÐºÑ–Ð½Ñ‡ÑƒÑŽ | Ð·Ð°ÐºÑ–Ð½Ñ‡ÑƒÐ²Ð°Ð²\n\n6. Ð¯ÐºÑ‰Ð¾ Ð²Ð¾Ð´Ð° ___ Ð´Ð¾ ÑÑ‚Ð° Ð³Ñ€Ð°Ð´ÑƒÑÑ–Ð², Ð²Ð¾Ð½Ð° Ð¿Ð¾Ñ‡Ð¸Ð½Ð°Ñ” ÐºÐ¸Ð¿Ñ–Ñ‚Ð¸.\n   > [!answer] Ð½Ð°Ð³Ñ€Ñ–Ð²Ð°Ñ”Ñ‚ÑŒÑÑ\n   > [!options] Ð½Ð°Ð³Ñ€Ñ–Ð²Ð°Ñ”Ñ‚ÑŒÑÑ | Ð½Ð°Ð³Ñ€Ñ–Ñ”Ñ‚ÑŒÑÑ | Ð½Ð°Ð³Ñ€Ñ–Ð»Ð°ÑÑ | Ð½Ð°Ð³Ñ€Ñ–Ð²Ð°Ñ‚Ð¸Ð¼ÐµÑ‚ÑŒÑÑ\n\n7. Ð¯ÐºÑ‰Ð¾ Ð½Ðµ ___ Ñ‡Ð°ÑÑƒ, Ð¿ÐµÑ€ÐµÐ½ÐµÑÐµÐ¼Ð¾ Ð·ÑƒÑÑ‚Ñ€Ñ–Ñ‡ Ð½Ð° Ð½Ð°ÑÑ‚ÑƒÐ¿Ð½Ð¸Ð¹ Ñ‚Ð¸Ð¶Ð´ÐµÐ½ÑŒ.\n   > [!answer] Ð±ÑƒÐ´Ðµ\n   > [!options] Ð±ÑƒÐ´Ðµ | Ñ” | Ð±ÑƒÐ»Ð¾ | Ð±ÑƒÐ²Ð°Ð»Ð¾\n\n8. ÐœÐ¸ Ð¿Ð¾Ñ‡Ð½ÐµÐ¼Ð¾ Ð½Ð°Ñ€Ð°Ð´Ñƒ Ð±ÐµÐ· Ð½ÑŒÐ¾Ð³Ð¾, ÑÐºÑ‰Ð¾ Ð²Ñ–Ð½ ___ Ð¿Ñ€Ð¾Ñ‚ÑÐ³Ð¾Ð¼ Ð³Ð¾Ð´Ð¸Ð½Ð¸.\n   > [!answer] Ð½Ðµ Ð¿Ñ€Ð¸Ð¹Ð´Ðµ\n   > [!options] Ð½Ðµ Ð¿Ñ€Ð¸Ð¹Ð´Ðµ | Ð½Ðµ Ð¿Ñ€Ð¸Ñ…Ð¾Ð´Ð¸Ñ‚ÑŒ | Ð½Ðµ Ð¿Ñ€Ð¸Ð¹ÑˆÐ¾Ð² | Ð½Ðµ Ð¿Ñ€Ð¸Ñ…Ð¾Ð´Ð¸Ð²\n\n---\n\n## true-false: ÐŸÑ€Ð°Ð²Ð´Ð° Ñ‡Ð¸ Ð½ÐµÐ¿Ñ€Ð°Ð²Ð´Ð°?\n\n1. Ð ÐµÐ°Ð»ÑŒÐ½Ð° ÑƒÐ¼Ð¾Ð²Ð° Ð· Â«ÑÐºÑ‰Ð¾Â» Ð¾Ð¿Ð¸ÑÑƒÑ” ÑÐ¸Ñ‚ÑƒÐ°Ñ†Ñ–Ñ—, Ñ‰Ð¾ Ð¼Ð¾Ð¶ÑƒÑ‚ÑŒ ÑÐ¿Ñ€Ð°Ð²Ð´Ñ– ÑÑ‚Ð°Ñ‚Ð¸ÑÑ.\n   - [x] ÐŸÑ€Ð°Ð²Ð´Ð°\n   - [ ] ÐÐµÐ¿Ñ€Ð°Ð²Ð´Ð°\n\n2. Ð£ Ñ€ÐµÐ°Ð»ÑŒÐ½Ð¸Ñ… ÑƒÐ¼Ð¾Ð²Ð°Ñ… Ð·Ð°Ð²Ð¶Ð´Ð¸ Ð²Ð¸ÐºÐ¾Ñ€Ð¸ÑÑ‚Ð¾Ð²ÑƒÑ”Ñ‚ÑŒÑÑ Ð¼Ð¸Ð½ÑƒÐ»Ð¸Ð¹ Ñ‡Ð°Ñ Ð´Ñ–Ñ”ÑÐ»Ð¾Ð²Ð°.\n   - [ ] ÐŸÑ€Ð°Ð²Ð´Ð°\n   - [x] ÐÐµÐ¿Ñ€Ð°Ð²Ð´Ð°\n\n3. Ð¡Ð¿Ð¾Ð»ÑƒÑ‡Ð½Ð¸Ðº Â«ÐºÐ¾Ð»Ð¸Â» Ð½Ñ–ÐºÐ¾Ð»Ð¸ Ð½Ðµ Ð¼Ð¾Ð¶Ðµ Ð¼Ð°Ñ‚Ð¸ ÑƒÐ¼Ð¾Ð²Ð½Ð¾Ð³Ð¾ Ð·Ð½Ð°Ñ‡ÐµÐ½Ð½Ñ.\n   - [ ] ÐŸÑ€Ð°Ð²Ð´Ð°\n   - [x] ÐÐµÐ¿Ñ€Ð°Ð²Ð´Ð°\n\n4. ÐŸÑ–ÑÐ»Ñ Ð¿Ñ–Ð´Ñ€ÑÐ´Ð½Ð¾Ð³Ð¾ Ñ€ÐµÑ‡ÐµÐ½Ð½Ñ Ð· Â«ÑÐºÑ‰Ð¾Â» Ð½Ð° Ð¿Ð¾Ñ‡Ð°Ñ‚ÐºÑƒ Ð¿Ð¾Ñ‚Ñ€Ñ–Ð±Ð½Ð° ÐºÐ¾Ð¼Ð°.\n   - [x] ÐŸÑ€Ð°Ð²Ð´Ð°\n   - [ ] ÐÐµÐ¿Ñ€Ð°Ð²Ð´Ð°\n\n5. Â«Ð£ Ð²Ð¸Ð¿Ð°Ð´ÐºÑƒ ÑÐºÑ‰Ð¾Â» Ñ– Â«Ð·Ð° ÑƒÐ¼Ð¾Ð²Ð¸ Ñ‰Ð¾Â» Ñ” Ð°Ð»ÑŒÑ‚ÐµÑ€Ð½Ð°Ñ‚Ð¸Ð²Ð°Ð¼Ð¸ Ð´Ð¾ Â«ÑÐºÑ‰Ð¾Â».\n   - [x] ÐŸÑ€Ð°Ð²Ð´Ð°\n   - [ ] ÐÐµÐ¿Ñ€Ð°Ð²Ð´Ð°\n\n6. Ð”Ð»Ñ Ð·Ð°Ð³Ð°Ð»ÑŒÐ½Ð¸Ñ… Ñ–ÑÑ‚Ð¸Ð½ Ð²Ð¸ÐºÐ¾Ñ€Ð¸ÑÑ‚Ð¾Ð²ÑƒÑŽÑ‚ÑŒ Ñ‚ÐµÐ¿ÐµÑ€Ñ–ÑˆÐ½Ñ–Ð¹ Ñ‡Ð°Ñ Ð² Ð¾Ð±Ð¾Ñ… Ñ‡Ð°ÑÑ‚Ð¸Ð½Ð°Ñ….\n   - [x] ÐŸÑ€Ð°Ð²Ð´Ð°\n   - [ ] ÐÐµÐ¿Ñ€Ð°Ð²Ð´Ð°\n\n7. Ð ÐµÑ‡ÐµÐ½Ð½Ñ Â«Ð¯ÐºÐ±Ð¸ Ð²Ñ–Ð½ Ð¿Ñ€Ð¸Ð¹ÑˆÐ¾Ð²Â» â€” Ñ†Ðµ Ð¿Ñ€Ð¸ÐºÐ»Ð°Ð´ Ñ€ÐµÐ°Ð»ÑŒÐ½Ð¾Ñ— ÑƒÐ¼Ð¾Ð²Ð¸.\n   - [ ] ÐŸÑ€Ð°Ð²Ð´Ð°\n   - [x] ÐÐµÐ¿Ñ€Ð°Ð²Ð´Ð°\n\n8. Ð’ ÑƒÐ¼Ð¾Ð²Ð½Ð¸Ñ… Ñ€ÐµÑ‡ÐµÐ½Ð½ÑÑ… Ð°ÑÐ¿ÐµÐºÑ‚ Ð´Ñ–Ñ”ÑÐ»Ð¾Ð²Ð° Ð½Ðµ Ð¼Ð°Ñ” Ð·Ð½Ð°Ñ‡ÐµÐ½Ð½Ñ Ð²Ð·Ð°Ð³Ð°Ð»Ñ–.\n   - [ ] ÐŸÑ€Ð°Ð²Ð´Ð°\n   - [x] ÐÐµÐ¿Ñ€Ð°Ð²Ð´Ð°\n\n---\n\n## group-sort: Ð Ð¾Ð·Ð¿Ð¾Ð´Ñ–Ð»Ñ–Ñ‚ÑŒ Ð²Ð¸Ñ€Ð°Ð·Ð¸ Ð·Ð° ÐºÐ°Ñ‚ÐµÐ³Ð¾Ñ€Ñ–ÑÐ¼Ð¸\n\n### Ð ÐµÐ°Ð»ÑŒÐ½Ð° ÑƒÐ¼Ð¾Ð²Ð°\n- Ð¯ÐºÑ‰Ð¾ Ð¼Ð°Ñ‚Ð¸Ð¼ÐµÑˆ Ñ‡Ð°Ñ, Ð·Ð°Ñ‚ÐµÐ»ÐµÑ„Ð¾Ð½ÑƒÐ¹.\n- Ð¯ÐºÑ‰Ð¾ Ð²Ñ–Ð½ Ð¿Ñ€Ð¸Ð¹Ð´Ðµ, Ð¿Ð¾Ð³Ð¾Ð²Ð¾Ñ€Ð¸Ð¼Ð¾.\n- Ð¯ÐºÑ‰Ð¾ Ñ…Ð¾Ñ‡ÐµÑˆ, Ð´Ð¾Ð¿Ð¾Ð¼Ð¾Ð¶Ñƒ.\n- Ð¯ÐºÑ‰Ð¾ Ð±ÑƒÐ´Ðµ Ð´Ð¾Ñ‰, Ð²Ñ–Ð·ÑŒÐ¼Ñƒ Ð¿Ð°Ñ€Ð°ÑÐ¾Ð»ÑŒÐºÑƒ.\n\n### ÐÐµÑ€ÐµÐ°Ð»ÑŒÐ½Ð° ÑƒÐ¼Ð¾Ð²Ð°\n- Ð¯ÐºÐ±Ð¸ Ñ Ð¼Ð°Ð² Ñ‡Ð°Ñ, Ð´Ð¾Ð¿Ð¾Ð¼Ñ–Ð³ Ð±Ð¸.\n- Ð¯ÐºÐ±Ð¸ Ð²Ð¾Ð½Ð° Ð¿Ñ€Ð¸Ð¹ÑˆÐ»Ð°, Ð¼Ð¸ Ð± Ð¿Ð¾Ð³Ð¾Ð²Ð¾Ñ€Ð¸Ð»Ð¸.\n- Ð¯ÐºÐ±Ð¸ Ñ Ð±ÑƒÐ² Ð±Ð°Ð³Ð°Ñ‚Ð¸Ð¹, ÐºÑƒÐ¿Ð¸Ð² Ð±Ð¸ Ð±ÑƒÐ´Ð¸Ð½Ð¾Ðº.\n- ÐšÐ¾Ð»Ð¸ Ð± Ñ Ð·Ð½Ð°Ð², ÑÐºÐ°Ð·Ð°Ð² Ð±Ð¸.\n\n### Ð§Ð°ÑÐ¾Ð²Ð¸Ð¹ ÑÐ¿Ð¾Ð»ÑƒÑ‡Ð½Ð¸Ðº (Ð½Ðµ ÑƒÐ¼Ð¾Ð²Ð°)\n- ÐšÐ¾Ð»Ð¸ Ð²Ñ–Ð½ Ð¿Ñ€Ð¸Ð¹ÑˆÐ¾Ð², Ð¼Ð¸ Ð²Ð¶Ðµ Ð¾Ð±Ñ–Ð´Ð°Ð»Ð¸.\n- ÐŸÑ–ÑÐ»Ñ Ñ‚Ð¾Ð³Ð¾ ÑÐº Ð²Ð¾Ð½Ð° Ð¿Ñ–ÑˆÐ»Ð°, Ð¼Ð¸ Ð¿Ð¾Ñ‡Ð°Ð»Ð¸.\n- ÐŸÐ¾ÐºÐ¸ Ð²Ñ–Ð½ Ð¿Ñ€Ð°Ñ†ÑŽÐ²Ð°Ð², Ñ Ñ‡ÐµÐºÐ°Ð»Ð°.\n- Ð¯Ðº Ñ‚Ñ–Ð»ÑŒÐºÐ¸ Ð¿Ð¾Ñ‡Ð°Ð²ÑÑ Ð´Ð¾Ñ‰, Ð¼Ð¸ ÑÑ…Ð¾Ð²Ð°Ð»Ð¸ÑÑ.\n\n### ÐÐ»ÑŒÑ‚ÐµÑ€Ð½Ð°Ñ‚Ð¸Ð²Ð½Ñ– ÑÐ¿Ð¾Ð»ÑƒÑ‡Ð½Ð¸ÐºÐ¸ ÑƒÐ¼Ð¾Ð²Ð¸\n- Ð£ Ð²Ð¸Ð¿Ð°Ð´ÐºÑƒ ÑÐºÑ‰Ð¾ Ð·Ð°Ð±ÑƒÐ´ÐµÑˆ, Ð½Ð°Ð³Ð°Ð´Ð°ÑŽ.\n- Ð—Ð° ÑƒÐ¼Ð¾Ð²Ð¸ Ñ‰Ð¾ Ð²ÑÑ– Ð¿Ð¾Ð³Ð¾Ð´ÑÑ‚ÑŒÑÑ, Ð¿Ð¾Ñ‡Ð½ÐµÐ¼Ð¾.\n- ÐŸÑ€Ð¸ ÑƒÐ¼Ð¾Ð²Ñ– Ñ‰Ð¾ Ð¾Ð¿Ð»Ð°Ñ‚Ð¸Ñ‚Ðµ, Ð´Ð¾ÑÑ‚Ð°Ð²Ð¸Ð¼Ð¾.\n- Ð£ Ñ€Ð°Ð·Ñ– ÑÐºÑ‰Ð¾ Ð½Ðµ Ð²ÑÑ‚Ð¸Ð³Ð½ÐµÐ¼Ð¾, Ð¿Ð¾Ð²Ñ–Ð´Ð¾Ð¼Ð¸Ð¼Ð¾.\n\n---\n\n## unjumble: Ð¡ÐºÐ»Ð°Ð´Ñ–Ñ‚ÑŒ Ñ€ÐµÑ‡ÐµÐ½Ð½Ñ Ð· Ñ€Ð¾Ð·ÑÐ¸Ð¿Ð°Ð½Ð¸Ñ… ÑÐ»Ñ–Ð²\n\n1. Ð¼Ð°Ñ‚Ð¸Ð¼Ñƒ / ÑÐºÑ‰Ð¾ / Ð·Ð°Ñ‚ÐµÐ»ÐµÑ„Ð¾Ð½ÑƒÑŽ / Ñ‡Ð°Ñ / Ñ‚Ð¾Ð±Ñ– / Ð²Ð²ÐµÑ‡ÐµÑ€Ñ– / Ñ / , / Ð¾Ð±Ð¾Ð²'ÑÐ·ÐºÐ¾Ð²Ð¾ / Ð²Ñ–Ð»ÑŒÐ½Ð¸Ð¹ / Ð½Ð° / Ñ‚Ð¸Ð¶Ð½Ñ– / Ñ†ÑŒÐ¾Ð¼Ñƒ / Ð·Ð°Ð²Ñ‚Ñ€Ð°\n   > [!answer] Ð¯ÐºÑ‰Ð¾ Ð¼Ð°Ñ‚Ð¸Ð¼Ñƒ Ð²Ñ–Ð»ÑŒÐ½Ð¸Ð¹ Ñ‡Ð°Ñ Ð½Ð° Ñ†ÑŒÐ¾Ð¼Ñƒ Ñ‚Ð¸Ð¶Ð½Ñ–, Ñ Ð¾Ð±Ð¾Ð²'ÑÐ·ÐºÐ¾Ð²Ð¾ Ð·Ð°Ñ‚ÐµÐ»ÐµÑ„Ð¾Ð½ÑƒÑŽ Ñ‚Ð¾Ð±Ñ– Ð²Ð²ÐµÑ‡ÐµÑ€Ñ– Ð·Ð°Ð²Ñ‚Ñ€Ð°.\n\n2. Ð¿Ð¾Ð³Ð¾Ð´Ð° / Ð±ÑƒÐ´Ðµ / Ð¼Ð¸ / Ð¿Ñ€Ð¾Ð³ÑƒÐ»ÑÐ½ÐºÑƒ / Ð½Ð° / Ð¿Ñ–Ð´ÐµÐ¼Ð¾ / Ð³Ð°Ñ€Ð½Ð¾ÑŽ / ÑÐºÑ‰Ð¾ / , / Ð² / Ð¿Ð°Ñ€Ðº / Ð¼Ñ–ÑÑŒÐºÐ¸Ð¹\n   > [!answer] Ð¯ÐºÑ‰Ð¾ Ð¿Ð¾Ð³Ð¾Ð´Ð° Ð±ÑƒÐ´Ðµ Ð³Ð°Ñ€Ð½Ð¾ÑŽ, Ð¼Ð¸ Ð¿Ñ–Ð´ÐµÐ¼Ð¾ Ð½Ð° Ð¿Ñ€Ð¾Ð³ÑƒÐ»ÑÐ½ÐºÑƒ Ð² Ð¼Ñ–ÑÑŒÐºÐ¸Ð¹ Ð¿Ð°Ñ€Ðº.\n\n3. Ð·Ð°Ð¿Ñ–Ð·Ð½Ð¸Ñ‚ÑŒÑÑ / Ð²Ñ–Ð½ / ÑÐºÑ‰Ð¾ / , / Ð¼Ð¸ / Ð±ÐµÐ· / Ð¿Ð¾Ñ‡Ð½ÐµÐ¼Ð¾ / Ð½Ð°Ñ€Ð°Ð´Ð¸ / Ð½ÑŒÐ¾Ð³Ð¾ / Ð¿Ñ€Ð¾Ð²ÐµÐ´ÐµÐ½Ð½Ñ / Ð²Ð°Ð¶Ð»Ð¸Ð²Ð¾Ñ— / ÑÑŒÐ¾Ð³Ð¾Ð´Ð½Ñ– / Ð¾ / Ð´ÐµÑÑÑ‚Ñ–Ð¹ / Ð³Ð¾Ð´Ð¸Ð½Ñ–\n   > [!answer] Ð¯ÐºÑ‰Ð¾ Ð²Ñ–Ð½ Ð·Ð°Ð¿Ñ–Ð·Ð½Ð¸Ñ‚ÑŒÑÑ ÑÑŒÐ¾Ð³Ð¾Ð´Ð½Ñ–, Ð¼Ð¸ Ð¿Ð¾Ñ‡Ð½ÐµÐ¼Ð¾ Ð¿Ñ€Ð¾Ð²ÐµÐ´ÐµÐ½Ð½Ñ Ð²Ð°Ð¶Ð»Ð¸Ð²Ð¾Ñ— Ð½Ð°Ñ€Ð°Ð´Ð¸ Ð¾ Ð´ÐµÑÑÑ‚Ñ–Ð¹ Ð³Ð¾Ð´Ð¸Ð½Ñ– Ð±ÐµÐ· Ð½ÑŒÐ¾Ð³Ð¾.\n\n4. Ð·Ð°Ð¿Ð¸Ñ‚Ð°Ð½Ð½Ñ / Ð²Ð¸Ð½Ð¸ÐºÐ½ÑƒÑ‚ÑŒ / Ð°Ð´Ð¼Ñ–Ð½Ñ–ÑÑ‚Ñ€Ð°Ñ‚Ð¾Ñ€Ð° / Ð´Ð¾ / ÑÐºÑ‰Ð¾ / Ð·Ð²ÐµÑ€Ð½Ñ–Ñ‚ÑŒÑÑ / , / Ñƒ / Ð²Ð°Ñ / Ð½Ð°ÑˆÐ¾Ð³Ð¾ / Ð±ÑƒÐ´ÑŒ / Ð»Ð°ÑÐºÐ° / Ð½ÐµÐ³Ð°Ð¹Ð½Ð¾ / Ð¾Ñ„Ñ–ÑÑƒ\n   > [!answer] Ð¯ÐºÑ‰Ð¾ Ñƒ Ð²Ð°Ñ Ð²Ð¸Ð½Ð¸ÐºÐ½ÑƒÑ‚ÑŒ Ð·Ð°Ð¿Ð¸Ñ‚Ð°Ð½Ð½Ñ, Ð±ÑƒÐ´ÑŒ Ð»Ð°ÑÐºÐ°, Ð½ÐµÐ³Ð°Ð¹Ð½Ð¾ Ð·Ð²ÐµÑ€Ð½Ñ–Ñ‚ÑŒÑÑ Ð´Ð¾ Ð½Ð°ÑˆÐ¾Ð³Ð¾ Ð°Ð´Ð¼Ñ–Ð½Ñ–ÑÑ‚Ñ€Ð°Ñ‚Ð¾Ñ€Ð° Ð¾Ñ„Ñ–ÑÑƒ.\n\n5. Ñƒ / ÑÐºÑ‰Ð¾ / Ð·Ð°Ð±ÑƒÐ´ÐµÑˆ / Ð²Ð¸Ð¿Ð°Ð´ÐºÑƒ / , / Ð½Ð°Ð³Ð°Ð´Ð°ÑŽ / Ñ / Ñ‚Ð¾Ð±Ñ– / Ð¿Ñ€Ð¾ / Ð·ÑƒÑÑ‚Ñ€Ñ–Ñ‡ / Ð²Ð°Ð¶Ð»Ð¸Ð²Ñƒ / Ð·Ð°Ð²Ñ‚Ñ€Ð°\n   > [!answer] Ð£ Ð²Ð¸Ð¿Ð°Ð´ÐºÑƒ ÑÐºÑ‰Ð¾ Ð·Ð°Ð±ÑƒÐ´ÐµÑˆ, Ñ Ð½Ð°Ð³Ð°Ð´Ð°ÑŽ Ñ‚Ð¾Ð±Ñ– Ð¿Ñ€Ð¾ Ð²Ð°Ð¶Ð»Ð¸Ð²Ñƒ Ð·ÑƒÑÑ‚Ñ€Ñ–Ñ‡ Ð·Ð°Ð²Ñ‚Ñ€Ð°.\n\n6. Ð·Ð°ÐºÑ–Ð½Ñ‡Ñƒ / Ñ€Ð°Ð½Ñ–ÑˆÐµ / Ñ / ÑÐºÑ‰Ð¾ / , / Ð´Ð¾Ð´Ð¾Ð¼Ñƒ / Ð·Ð¼Ð¾Ð¶Ñƒ / Ð¿Ñ–Ñ‚Ð¸ / Ñ€Ð¾Ð±Ð¾Ñ‚Ñƒ / ÑÑŒÐ¾Ð³Ð¾Ð´Ð½Ñ– / Ð²Ð°Ð¶Ð»Ð¸Ð²Ñƒ / Ñ†ÑŽ\n   > [!answer] Ð¯ÐºÑ‰Ð¾ Ñ Ð·Ð°ÐºÑ–Ð½Ñ‡Ñƒ Ñ†ÑŽ Ð²Ð°Ð¶Ð»Ð¸Ð²Ñƒ Ñ€Ð¾Ð±Ð¾Ñ‚Ñƒ Ñ€Ð°Ð½Ñ–ÑˆÐµ, Ð·Ð¼Ð¾Ð¶Ñƒ Ð¿Ñ–Ñ‚Ð¸ Ð´Ð¾Ð´Ð¾Ð¼Ñƒ ÑÑŒÐ¾Ð³Ð¾Ð´Ð½Ñ–.\n\n---\n\n## error-correction: Ð—Ð½Ð°Ð¹Ð´Ñ–Ñ‚ÑŒ Ñ– Ð²Ð¸Ð¿Ñ€Ð°Ð²Ñ‚Ðµ Ð¿Ð¾Ð¼Ð¸Ð»ÐºÑƒ\n\n1. Ð¯ÐºÑ‰Ð¾ Ð²Ñ–Ð½ Ð¿Ñ€Ð¸Ð¹Ð´Ðµ, Ñ ÐºÐ°Ð¶Ñƒ Ð¹Ð¾Ð¼Ñƒ Ð¿Ñ€Ð°Ð²Ð´Ñƒ Ð¿Ñ€Ð¾ ÑÐ¸Ñ‚ÑƒÐ°Ñ†Ñ–ÑŽ.\n   > [!error] ÐºÐ°Ð¶Ñƒ\n   > [!answer] ÑÐºÐ°Ð¶Ñƒ\n   > [!options] ÑÐºÐ°Ð¶Ñƒ | ÐºÐ°Ð·Ð°Ñ‚Ð¸Ð¼Ñƒ | Ð³Ð¾Ð²Ð¾Ñ€ÑŽ | ÑÐºÐ°Ð·Ð°Ð²\n   > [!explanation] Ð’ Ð¾Ð±Ð¾Ñ… Ñ‡Ð°ÑÑ‚Ð¸Ð½Ð°Ñ… Ð¿Ð¾Ñ‚Ñ€Ñ–Ð±ÐµÐ½ Ð¼Ð°Ð¹Ð±ÑƒÑ‚Ð½Ñ–Ð¹ Ñ‡Ð°Ñ Ð´Ð»Ñ ÐºÐ¾Ð½ÐºÑ€ÐµÑ‚Ð½Ð¾Ñ— ÑÐ¸Ñ‚ÑƒÐ°Ñ†Ñ–Ñ—.\n\n2. Ð¯ÐºÐ±Ð¸ Ð²Ñ–Ð½ Ð¿Ñ€Ð¸Ð¹Ð´Ðµ Ð²Ñ‡Ð°ÑÐ½Ð¾, Ð¼Ð¸ Ð¿Ð¾Ð³Ð¾Ð²Ð¾Ñ€Ð¸Ð¼Ð¾ Ð¿Ñ€Ð¾ Ð²Ð°Ð¶Ð»Ð¸Ð²Ñ– ÑÐ¿Ñ€Ð°Ð²Ð¸.\n   > [!error] Ð¯ÐºÐ±Ð¸\n   > [!answer] Ð¯ÐºÑ‰Ð¾\n   > [!options] Ð¯ÐºÑ‰Ð¾ | ÐšÐ¾Ð»Ð¸ Ð± | ÐšÐ¾Ð»Ð¸ | Ð¥Ð¾Ñ‡Ð°\n   > [!explanation] Ð”Ð»Ñ Ñ€ÐµÐ°Ð»ÑŒÐ½Ð¾Ñ— ÑƒÐ¼Ð¾Ð²Ð¸ Ð²Ð¸ÐºÐ¾Ñ€Ð¸ÑÑ‚Ð¾Ð²ÑƒÑ”Ð¼Ð¾ Â«ÑÐºÑ‰Ð¾Â», Ð½Ðµ Â«ÑÐºÐ±Ð¸Â».\n\n3. Ð¯ÐºÑ‰Ð¾ Ð¼Ð°Ñ‚Ð¸Ð¼ÐµÑˆ Ñ‡Ð°Ñ Ð·Ð°Ñ‚ÐµÐ»ÐµÑ„Ð¾Ð½ÑƒÐ¹ Ð¼ÐµÐ½Ñ– Ð²Ð²ÐµÑ‡ÐµÑ€Ñ– Ð¿Ñ–ÑÐ»Ñ Ñ€Ð¾Ð±Ð¾Ñ‚Ð¸.\n   > [!error] Ñ‡Ð°Ñ Ð·Ð°Ñ‚ÐµÐ»ÐµÑ„Ð¾Ð½ÑƒÐ¹\n   > [!answer] Ñ‡Ð°Ñ, Ð·Ð°Ñ‚ÐµÐ»ÐµÑ„Ð¾Ð½ÑƒÐ¹\n   > [!options] Ñ‡Ð°Ñ, Ð·Ð°Ñ‚ÐµÐ»ÐµÑ„Ð¾Ð½ÑƒÐ¹ | Ñ‡Ð°Ñ. Ð—Ð°Ñ‚ÐµÐ»ÐµÑ„Ð¾Ð½ÑƒÐ¹ | Ñ‡Ð°Ñ: Ð·Ð°Ñ‚ÐµÐ»ÐµÑ„Ð¾Ð½ÑƒÐ¹ | Ñ‡Ð°Ñ â€” Ð·Ð°Ñ‚ÐµÐ»ÐµÑ„Ð¾Ð½ÑƒÐ¹,\n   > [!explanation] ÐŸÑ–ÑÐ»Ñ Ð¿Ñ–Ð´Ñ€ÑÐ´Ð½Ð¾Ð³Ð¾ Ñ€ÐµÑ‡ÐµÐ½Ð½Ñ Ð· Â«ÑÐºÑ‰Ð¾Â» Ð¿Ð¾Ñ‚Ñ€Ñ–Ð±Ð½Ð° ÐºÐ¾Ð¼Ð°.\n\n4. ÐœÐ¸ Ð¿Ñ–Ð´ÐµÐ¼Ð¾ ÑÐºÑ‰Ð¾ Ð±ÑƒÐ´Ðµ Ð¿Ð¾Ð³Ð¾Ð´Ð° Ð³Ð°Ñ€Ð½Ð° Ð½Ð° Ð¿Ñ€Ð¾Ð³ÑƒÐ»ÑÐ½ÐºÑƒ Ð²Ð²ÐµÑ‡ÐµÑ€Ñ–.\n   > [!error] ÑÐºÑ‰Ð¾ Ð±ÑƒÐ´Ðµ Ð¿Ð¾Ð³Ð¾Ð´Ð° Ð³Ð°Ñ€Ð½Ð°\n   > [!answer] ÑÐºÑ‰Ð¾ Ð¿Ð¾Ð³Ð¾Ð´Ð° Ð±ÑƒÐ´Ðµ Ð³Ð°Ñ€Ð½Ð°\n   > [!options] ÑÐºÑ‰Ð¾ Ð¿Ð¾Ð³Ð¾Ð´Ð° Ð±ÑƒÐ´Ðµ Ð³Ð°Ñ€Ð½Ð° | ÑÐºÑ‰Ð¾ Ð³Ð°Ñ€Ð½Ð° Ð¿Ð¾Ð³Ð¾Ð´Ð° Ð±ÑƒÐ´Ðµ | ÑÐºÑ‰Ð¾ Ð±ÑƒÐ´Ðµ Ð³Ð°Ñ€Ð½Ð¾ÑŽ Ð¿Ð¾Ð³Ð¾Ð´Ð° | ÑÐºÑ‰Ð¾ Ð¿Ð¾Ð³Ð¾Ð´Ð° Ð³Ð°Ñ€Ð½Ð° Ð±ÑƒÐ´Ðµ\n   > [!explanation] ÐŸÑ€Ð°Ð²Ð¸Ð»ÑŒÐ½Ð¸Ð¹ Ð¿Ð¾Ñ€ÑÐ´Ð¾Ðº ÑÐ»Ñ–Ð²: Â«ÑÐºÑ‰Ð¾ Ð¿Ð¾Ð³Ð¾Ð´Ð° Ð±ÑƒÐ´Ðµ Ð³Ð°Ñ€Ð½Ð°Â».\n\n5. Ð¯ÐºÑ‰Ð¾ Ñ…Ð¾Ñ‡ÐµÑˆ, Ð¼Ð¾Ð¶Ñƒ Ñ Ð´Ð¾Ð¿Ð¾Ð¼Ð¾Ð³Ñ‚Ð¸ Ñ‚Ð¾Ð±Ñ– Ð· Ð¿Ñ€Ð¾Ñ”ÐºÑ‚Ð¾Ð¼.\n   > [!error] Ð¼Ð¾Ð¶Ñƒ Ñ\n   > [!answer] Ñ Ð¼Ð¾Ð¶Ñƒ\n   > [!options] Ñ Ð¼Ð¾Ð¶Ñƒ | Ð¼Ð¾Ð¶Ñƒ-Ñ | Ñ-Ð¼Ð¾Ð¶Ñƒ | Ð¼Ð¾Ð¶Ñƒ, Ñ\n   > [!explanation] Ð¡Ñ‚Ð°Ð½Ð´Ð°Ñ€Ñ‚Ð½Ð¸Ð¹ Ð¿Ð¾Ñ€ÑÐ´Ð¾Ðº ÑÐ»Ñ–Ð²: Ð¿Ñ–Ð´Ð¼ÐµÑ‚ + Ð¿Ñ€Ð¸ÑÑƒÐ´Ð¾Ðº.\n\n6. Ð¯ÐºÑ‰Ð¾ Ñƒ Ð½Ð°Ñ Ð½Ðµ Ð±ÑƒÐ´Ðµ Ñ‡Ð°Ñ, Ð¼Ð¸ Ð¿ÐµÑ€ÐµÐ½ÐµÑÐµÐ¼Ð¾ Ð·ÑƒÑÑ‚Ñ€Ñ–Ñ‡.\n   > [!error] Ñ‡Ð°Ñ\n   > [!answer] Ñ‡Ð°ÑÑƒ\n   > [!options] Ñ‡Ð°ÑÑƒ | Ñ‡Ð°ÑÐ¸ | Ñ‡Ð°ÑÐ¾Ð¼ | Ñ‡Ð°ÑÑ–Ð²\n   > [!explanation] ÐŸÑ–ÑÐ»Ñ Â«Ð½Ðµ Ð±ÑƒÐ´ÐµÂ» Ð¿Ð¾Ñ‚Ñ€Ñ–Ð±ÐµÐ½ Ñ€Ð¾Ð´Ð¾Ð²Ð¸Ð¹ Ð²Ñ–Ð´Ð¼Ñ–Ð½Ð¾Ðº: Ñ‡Ð°ÑÑƒ.\n\n---\n\n## cloze: Ð—Ð°Ð¿Ð¾Ð²Ð½Ñ–Ñ‚ÑŒ Ð¿Ñ€Ð¾Ð¿ÑƒÑÐºÐ¸ Ð² Ñ‚ÐµÐºÑÑ‚Ñ–\n\nÐœÐ°Ñ€Ñ–Ñ Ñ‚Ð° ÐÐ½Ð´Ñ€Ñ–Ð¹ Ð¿Ð»Ð°Ð½ÑƒÑŽÑ‚ÑŒ Ð²Ð¸Ñ…Ñ–Ð´Ð½Ñ–. ÐÐ½Ð´Ñ€Ñ–Ð¹ ÐºÐ°Ð¶Ðµ: Â«(1)___ Ð¿Ð¾Ð³Ð¾Ð´Ð° (2)___ Ð³Ð°Ñ€Ð½Ð¾ÑŽ, Ð¼Ð¸ Ð·Ð¼Ð¾Ð¶ÐµÐ¼Ð¾ Ð¿Ð¾Ñ—Ñ…Ð°Ñ‚Ð¸ Ð½Ð° Ð¿Ñ–ÐºÐ½Ñ–Ðº Ð·Ð° Ð¼Ñ–ÑÑ‚Ð¾Â». ÐœÐ°Ñ€Ñ–Ñ Ð²Ñ–Ð´Ð¿Ð¾Ð²Ñ–Ð´Ð°Ñ”: Â«Ð§ÑƒÐ´Ð¾Ð²Ð° Ñ–Ð´ÐµÑ! Ð (3)___ (4)___ Ð´Ð¾Ñ‰, Ñ‰Ð¾ Ñ‚Ð¾Ð´Ñ– Ñ€Ð¾Ð±Ð¸Ñ‚Ð¸Ð¼ÐµÐ¼Ð¾?Â» ÐÐ½Ð´Ñ€Ñ–Ð¹ Ð´ÑƒÐ¼Ð°Ñ” Ñ– ÐºÐ°Ð¶Ðµ: Â«(5)___ Ð±ÑƒÐ´Ðµ Ð´Ð¾Ñ‰, (6)___ Ð²Ð´Ð¾Ð¼Ð° Ð¹ (7)___ ÑÐºÐ¸Ð¹ÑÑŒ Ñ„Ñ–Ð»ÑŒÐ¼Â». ÐœÐ°Ñ€Ñ–Ñ Ð¿Ð¾Ð³Ð¾Ð´Ð¶ÑƒÑ”Ñ‚ÑŒÑÑ: Â«Ð”Ð¾Ð±Ñ€Ðµ. Ð (8)___ Ð´Ñ€ÑƒÐ·Ñ– (9)___ Ð¿Ñ€Ð¸Ñ”Ð´Ð½Ð°Ñ‚Ð¸ÑÑ?Â» ÐÐ½Ð´Ñ€Ñ–Ð¹ Ð²Ñ–Ð´Ð¿Ð¾Ð²Ñ–Ð´Ð°Ñ”: Â«(10)___ Ð²Ð¾Ð½Ð¸ Ð·Ð°Ñ…Ð¾Ñ‡ÑƒÑ‚ÑŒ, Ð· Ñ€Ð°Ð´Ñ–ÑÑ‚ÑŽ (11)___ Ñ—Ñ… Ñ€Ð°Ð·Ð¾Ð¼ Ð· Ð½Ð°Ð¼Ð¸Â». ÐœÐ°Ñ€Ñ–Ñ ÐºÐ°Ð¶Ðµ: Â«Ð£ (12)___ (13)___ Ð²Ð¾Ð½Ð¸ Ð½Ðµ Ð·Ð¼Ð¾Ð¶ÑƒÑ‚ÑŒ, Ð¼Ð¸ Ð¿Ñ€Ð¾Ð²ÐµÐ´ÐµÐ¼Ð¾ Ñ‡Ð°Ñ ÑƒÐ´Ð²Ð¾Ñ…Â». ÐÐ½Ð´Ñ€Ñ–Ð¹ ÐºÐ°Ð¶Ðµ: Â«(14)___ Ð²ÑÐµ Ð±ÑƒÐ´Ðµ Ð´Ð¾Ð±Ñ€Ðµ, Ñ†Ðµ Ð±ÑƒÐ´ÑƒÑ‚ÑŒ Ñ‡ÑƒÐ´Ð¾Ð²Ñ– Ð²Ð¸Ñ…Ñ–Ð´Ð½Ñ–!Â»\n\n- (1) :: Ð¯ÐºÑ‰Ð¾ | Ð¯ÐºÐ±Ð¸ | ÐšÐ¾Ð»Ð¸ Ð± | Ð¥Ð¾Ñ‡Ð°\n- (2) :: Ð±ÑƒÐ´Ðµ | Ñ” | Ð±ÑƒÐ»Ð° | Ð±ÑƒÐ²Ð°Ð»Ð°\n- (3) :: ÑÐºÑ‰Ð¾ | ÑÐºÐ±Ð¸ | ÐºÐ¾Ð»Ð¸ Ð± | Ñ…Ð¾Ñ‡Ð°\n- (4) :: Ð±ÑƒÐ´Ðµ | Ñ” | Ð±ÑƒÐ² | Ð±ÑƒÐ²Ð°Ð²\n- (5) :: Ð¯ÐºÑ‰Ð¾ | Ð¯ÐºÐ±Ð¸ | Ð¥Ð¾Ñ‡Ð° | Ð‘Ð¾\n- (6) :: Ð·Ð°Ð»Ð¸ÑˆÐ¸Ð¼Ð¾ÑÑ | Ð·Ð°Ð»Ð¸ÑˆÐ°Ñ”Ð¼Ð¾ÑÑ | Ð·Ð°Ð»Ð¸ÑˆÐ¸Ð»Ð¸ÑÑ | Ð·Ð°Ð»Ð¸ÑˆÐ°Ñ‚Ð¸Ð¼ÐµÐ¼Ð¾ÑÑ\n- (7) :: Ð¿Ð¾Ð´Ð¸Ð²Ð¸Ð¼Ð¾ÑÑ | Ð´Ð¸Ð²Ð¸Ð¼Ð¾ÑÑ | Ð´Ð¸Ð²Ð¸Ð»Ð¸ÑÑ | Ð´Ð¸Ð²Ð¸Ñ‚Ð¸Ð¼ÐµÐ¼Ð¾ÑÑ\n- (8) :: ÑÐºÑ‰Ð¾ | ÑÐºÐ±Ð¸ | ÐºÐ¾Ð»Ð¸ Ð± | Ñ…Ð¾Ñ‡Ð°\n- (9) :: Ð·Ð°Ñ…Ð¾Ñ‡ÑƒÑ‚ÑŒ | Ñ…Ð¾Ñ‡ÑƒÑ‚ÑŒ | Ñ…Ð¾Ñ‚Ñ–Ð»Ð¸ | Ñ…Ð¾Ñ‚Ñ–Ñ‚Ð¸Ð¼ÑƒÑ‚ÑŒ\n- (10) :: Ð¯ÐºÑ‰Ð¾ | Ð¯ÐºÐ±Ð¸ | Ð¥Ð¾Ñ‡Ð° | Ð¢Ð¾Ð¼Ñƒ Ñ‰Ð¾\n- (11) :: Ð·Ð°Ð¿Ñ€Ð¾ÑÐ¸Ð¼Ð¾ | Ð·Ð°Ð¿Ñ€Ð¾ÑˆÑƒÑ”Ð¼Ð¾ | Ð·Ð°Ð¿Ñ€Ð¾ÑÐ¸Ð»Ð¸ | Ð·Ð°Ð¿Ñ€Ð¾ÑˆÑƒÑ”Ð¼Ð¾\n- (12) :: Ð²Ð¸Ð¿Ð°Ð´ÐºÑƒ | Ñ€Ð°Ð·Ñ– | ÑƒÐ¼Ð¾Ð²Ñ– | ÑÐ¸Ñ‚ÑƒÐ°Ñ†Ñ–Ñ—\n- (13) :: ÑÐºÑ‰Ð¾ | ÑÐºÐ±Ð¸ | ÐºÐ¾Ð»Ð¸ Ð± | ÐºÐ¾Ð»Ð¸\n- (14) :: Ð¯ÐºÑ‰Ð¾ | Ð¯ÐºÐ±Ð¸ | Ð¥Ð¾Ñ‡Ð° | Ð¢Ð¾Ð¼Ñƒ Ñ‰Ð¾\n\n---\n\n## mark-the-words: ÐŸÐ¾Ð·Ð½Ð°Ñ‡Ñ‚Ðµ ÑÐ¿Ð¾Ð»ÑƒÑ‡Ð½Ð¸ÐºÐ¸ ÑƒÐ¼Ð¾Ð²Ð¸\n\n[Ð¯ÐºÑ‰Ð¾] Ð¼Ð°Ñ‚Ð¸Ð¼ÐµÑˆ Ñ‡Ð°Ñ, Ð·Ð°Ñ‚ÐµÐ»ÐµÑ„Ð¾Ð½ÑƒÐ¹ Ð¼ÐµÐ½Ñ– Ð²Ð²ÐµÑ‡ÐµÑ€Ñ–. [Ð£ Ð²Ð¸Ð¿Ð°Ð´ÐºÑƒ ÑÐºÑ‰Ð¾] Ð·Ð°Ð±ÑƒÐ´ÐµÑˆ, Ñ Ð½Ð°Ð³Ð°Ð´Ð°ÑŽ. [Ð¯ÐºÑ‰Ð¾] Ð¿Ð¾Ð³Ð¾Ð´Ð° Ð±ÑƒÐ´Ðµ Ð³Ð°Ñ€Ð½Ð¾ÑŽ, Ð¼Ð¸ Ð¿Ñ–Ð´ÐµÐ¼Ð¾ Ð½Ð° Ð¿Ñ€Ð¾Ð³ÑƒÐ»ÑÐ½ÐºÑƒ. [Ð—Ð° ÑƒÐ¼Ð¾Ð²Ð¸ Ñ‰Ð¾] Ð²ÑÑ– Ð¿Ð¾Ð³Ð¾Ð´ÑÑ‚ÑŒÑÑ, Ð¿Ð¾Ñ‡Ð½ÐµÐ¼Ð¾ Ð¿Ñ€Ð¾Ñ”ÐºÑ‚. [Ð¯ÐºÑ‰Ð¾] Ð²Ñ–Ð½ Ð½Ðµ Ð¿Ñ€Ð¸Ð¹Ð´Ðµ Ð²Ñ‡Ð°ÑÐ½Ð¾, Ð¼Ð¸ Ð¿Ð¾Ñ‡Ð½ÐµÐ¼Ð¾ Ð±ÐµÐ· Ð½ÑŒÐ¾Ð³Ð¾. [Ð£ Ñ€Ð°Ð·Ñ– ÑÐºÑ‰Ð¾] Ð²Ð¸Ð½Ð¸ÐºÐ½ÑƒÑ‚ÑŒ Ð¿Ñ€Ð¾Ð±Ð»ÐµÐ¼Ð¸, Ð·Ð²ÐµÑ€Ð½Ñ–Ñ‚ÑŒÑÑ Ð´Ð¾ Ð°Ð´Ð¼Ñ–Ð½Ñ–ÑÑ‚Ñ€Ð°Ñ‚Ð¾Ñ€Ð°. [Ð¯ÐºÑ‰Ð¾] Ñ…Ð¾Ñ‡ÐµÑˆ, Ñ Ð¼Ð¾Ð¶Ñƒ Ð´Ð¾Ð¿Ð¾Ð¼Ð¾Ð³Ñ‚Ð¸. [ÐŸÑ€Ð¸ ÑƒÐ¼Ð¾Ð²Ñ– Ñ‰Ð¾] Ð²Ð¸ Ð¾Ð¿Ð»Ð°Ñ‚Ð¸Ñ‚Ðµ, Ð¼Ð¸ Ð´Ð¾ÑÑ‚Ð°Ð²Ð¸Ð¼Ð¾ Ñ‚Ð¾Ð²Ð°Ñ€ Ð¿Ñ€Ð¾Ñ‚ÑÐ³Ð¾Ð¼ Ñ‚Ð¸Ð¶Ð½Ñ.\n\n---\n\n## dialogue-reorder: Ð’Ð¿Ð¾Ñ€ÑÐ´ÐºÑƒÐ¹Ñ‚Ðµ Ð´Ñ–Ð°Ð»Ð¾Ð³\n\n- Ð¯ÐºÑ‰Ð¾ Ð±ÑƒÐ´Ðµ Ð´Ð¾Ñ‰, Ñ‰Ð¾ Ñ‚Ð¾Ð´Ñ– Ñ€Ð¾Ð±Ð¸Ñ‚Ð¸Ð¼ÐµÐ¼Ð¾?\n- Ð©Ð¾ Ð¿Ð»Ð°Ð½ÑƒÑ”Ð¼Ð¾ Ñ€Ð¾Ð±Ð¸Ñ‚Ð¸ Ð½Ð° Ð²Ð¸Ñ…Ñ–Ð´Ð½Ð¸Ñ…?\n- Ð¯ÐºÑ‰Ð¾ Ð¿Ð¾Ð³Ð¾Ð´Ð° Ð±ÑƒÐ´Ðµ Ð³Ð°Ñ€Ð½Ð¾ÑŽ, Ð¼Ð¾Ð¶ÐµÐ¼Ð¾ Ð¿Ð¾Ñ—Ñ…Ð°Ñ‚Ð¸ Ð½Ð° Ð¿Ñ–ÐºÐ½Ñ–Ðº.\n- Ð”Ð¾Ð±Ñ€Ðµ, Ñ†Ðµ Ñ…Ð¾Ñ€Ð¾ÑˆÐ¸Ð¹ Ð¿Ð»Ð°Ð½ Ð½Ð° Ð±ÑƒÐ´ÑŒ-ÑÐºÑƒ Ð¿Ð¾Ð³Ð¾Ð´Ñƒ.\n- Ð¯ÐºÑ‰Ð¾ Ð±ÑƒÐ´Ðµ Ð´Ð¾Ñ‰, Ð·Ð°Ð»Ð¸ÑˆÐ¸Ð¼Ð¾ÑÑ Ð²Ð´Ð¾Ð¼Ð° Ð¹ Ð¿Ð¾Ð´Ð¸Ð²Ð¸Ð¼Ð¾ÑÑ Ñ„Ñ–Ð»ÑŒÐ¼.\n- Ð§ÑƒÐ´Ð¾Ð²Ð° Ñ–Ð´ÐµÑ! Ð¯ Ð²Ð¶Ðµ Ñ‡ÐµÐºÐ°ÑŽ Ð½Ð° Ð²Ð¸Ñ…Ñ–Ð´Ð½Ñ–!\n\n> [!answer]\n> 1. Ð©Ð¾ Ð¿Ð»Ð°Ð½ÑƒÑ”Ð¼Ð¾ Ñ€Ð¾Ð±Ð¸Ñ‚Ð¸ Ð½Ð° Ð²Ð¸Ñ…Ñ–Ð´Ð½Ð¸Ñ…?\n> 2. Ð¯ÐºÑ‰Ð¾ Ð¿Ð¾Ð³Ð¾Ð´Ð° Ð±ÑƒÐ´Ðµ Ð³Ð°Ñ€Ð½Ð¾ÑŽ, Ð¼Ð¾Ð¶ÐµÐ¼Ð¾ Ð¿Ð¾Ñ—Ñ…Ð°Ñ‚Ð¸ Ð½Ð° Ð¿Ñ–ÐºÐ½Ñ–Ðº.\n> 3. Ð¯ÐºÑ‰Ð¾ Ð±ÑƒÐ´Ðµ Ð´Ð¾Ñ‰, Ñ‰Ð¾ Ñ‚Ð¾Ð´Ñ– Ñ€Ð¾Ð±Ð¸Ñ‚Ð¸Ð¼ÐµÐ¼Ð¾?\n> 4. Ð¯ÐºÑ‰Ð¾ Ð±ÑƒÐ´Ðµ Ð´Ð¾Ñ‰, Ð·Ð°Ð»Ð¸ÑˆÐ¸Ð¼Ð¾ÑÑ Ð²Ð´Ð¾Ð¼Ð° Ð¹ Ð¿Ð¾Ð´Ð¸Ð²Ð¸Ð¼Ð¾ÑÑ Ñ„Ñ–Ð»ÑŒÐ¼.\n> 5. Ð”Ð¾Ð±Ñ€Ðµ, Ñ†Ðµ Ñ…Ð¾Ñ€Ð¾ÑˆÐ¸Ð¹ Ð¿Ð»Ð°Ð½ Ð½Ð° Ð±ÑƒÐ´ÑŒ-ÑÐºÑƒ Ð¿Ð¾Ð³Ð¾Ð´Ñƒ.\n> 6. Ð§ÑƒÐ´Ð¾Ð²Ð° Ñ–Ð´ÐµÑ! Ð¯ Ð²Ð¶Ðµ Ñ‡ÐµÐºÐ°ÑŽ Ð½Ð° Ð²Ð¸Ñ…Ñ–Ð´Ð½Ñ–!\n\n---\n\n## select: Ð’Ð¸Ð±ÐµÑ€Ñ–Ñ‚ÑŒ ÑƒÑÑ– Ð¿Ñ€Ð°Ð²Ð¸Ð»ÑŒÐ½Ñ– Ñ€ÐµÑ‡ÐµÐ½Ð½Ñ\n\n- [x] Ð¯ÐºÑ‰Ð¾ Ð¼Ð°Ñ‚Ð¸Ð¼ÐµÑˆ Ñ‡Ð°Ñ, Ð·Ð°Ñ‚ÐµÐ»ÐµÑ„Ð¾Ð½ÑƒÐ¹ Ð¼ÐµÐ½Ñ– Ð²Ð²ÐµÑ‡ÐµÑ€Ñ–.\n- [ ] Ð¯ÐºÐ±Ð¸ Ð¼Ð°Ñ‚Ð¸Ð¼ÐµÑˆ Ñ‡Ð°Ñ, Ð·Ð°Ñ‚ÐµÐ»ÐµÑ„Ð¾Ð½ÑƒÐ¹ Ð¼ÐµÐ½Ñ– Ð²Ð²ÐµÑ‡ÐµÑ€Ñ–.\n- [x] Ð¯ÐºÑ‰Ð¾ Ð²Ñ–Ð½ Ð¿Ñ€Ð¸Ð¹Ð´Ðµ, Ð¼Ð¸ Ð¿Ð¾Ð³Ð¾Ð²Ð¾Ñ€Ð¸Ð¼Ð¾ Ð· Ð½Ð¸Ð¼.\n- [ ] Ð¯ÐºÑ‰Ð¾ Ð²Ñ–Ð½ Ð¿Ñ€Ð¸Ð¹Ð´Ðµ, Ð¼Ð¸ Ð¿Ð¾Ð³Ð¾Ð²Ð¾Ñ€Ð¸Ð¼Ð¾ Ð± Ð· Ð½Ð¸Ð¼.\n- [x] ÐœÐ¸ Ð¿Ñ–Ð´ÐµÐ¼Ð¾ Ð½Ð° Ð¿Ñ€Ð¾Ð³ÑƒÐ»ÑÐ½ÐºÑƒ, ÑÐºÑ‰Ð¾ Ð¿Ð¾Ð³Ð¾Ð´Ð° Ð±ÑƒÐ´Ðµ Ð³Ð°Ñ€Ð½Ð°.\n- [ ] ÐœÐ¸ Ð¿Ñ–Ð´ÐµÐ¼Ð¾ Ð½Ð° Ð¿Ñ€Ð¾Ð³ÑƒÐ»ÑÐ½ÐºÑƒ ÑÐºÑ‰Ð¾ Ð¿Ð¾Ð³Ð¾Ð´Ð° Ð±ÑƒÐ´Ðµ Ð³Ð°Ñ€Ð½Ð°.\n- [x] Ð£ Ð²Ð¸Ð¿Ð°Ð´ÐºÑƒ ÑÐºÑ‰Ð¾ Ð·Ð°Ð±ÑƒÐ´ÐµÑˆ, Ñ Ð½Ð°Ð³Ð°Ð´Ð°ÑŽ Ñ‚Ð¾Ð±Ñ–.\n- [ ] Ð£ Ð²Ð¸Ð¿Ð°Ð´ÐºÑƒ ÑÐºÐ±Ð¸ Ð·Ð°Ð±ÑƒÐ´ÐµÑˆ, Ñ Ð½Ð°Ð³Ð°Ð´Ð°ÑŽ Ñ‚Ð¾Ð±Ñ–.\n\n---\n\n## translate: ÐŸÐµÑ€ÐµÐºÐ»Ð°Ð´Ñ–Ñ‚ÑŒ Ð½Ð° ÑƒÐºÑ€Ð°Ñ—Ð½ÑÑŒÐºÑƒ Ð¼Ð¾Ð²Ñƒ\n\n1. If the weather is good, we will go for a walk in the park.\n   - [x] Ð¯ÐºÑ‰Ð¾ Ð¿Ð¾Ð³Ð¾Ð´Ð° Ð±ÑƒÐ´Ðµ Ð³Ð°Ñ€Ð½Ð¾ÑŽ, Ð¼Ð¸ Ð¿Ñ–Ð´ÐµÐ¼Ð¾ Ð½Ð° Ð¿Ñ€Ð¾Ð³ÑƒÐ»ÑÐ½ÐºÑƒ Ð² Ð¿Ð°Ñ€Ðº.\n   - [ ] Ð¯ÐºÐ±Ð¸ Ð¿Ð¾Ð³Ð¾Ð´Ð° Ð±ÑƒÐ´Ðµ Ð³Ð°Ñ€Ð½Ð¾ÑŽ, Ð¼Ð¸ Ð¿Ñ–Ð´ÐµÐ¼Ð¾ Ð² Ð¿Ð°Ñ€Ðº.\n   - [ ] Ð¯ÐºÑ‰Ð¾ Ð¿Ð¾Ð³Ð¾Ð´Ð° Ð³Ð°Ñ€Ð½Ð° Ð±ÑƒÐ»Ð°, Ð¼Ð¸ Ð¹Ð´ÐµÐ¼Ð¾ Ð² Ð¿Ð°Ñ€Ðº.\n   - [ ] ÐšÐ¾Ð»Ð¸ Ð± Ð¿Ð¾Ð³Ð¾Ð´Ð° Ð±ÑƒÐ´Ðµ, Ð¼Ð¸ Ð¿Ñ–Ð´ÐµÐ¼Ð¾ Ð³ÑƒÐ»ÑÑ‚Ð¸.\n\n2. If you want, I can help you with the project.\n   - [x] Ð¯ÐºÑ‰Ð¾ Ñ…Ð¾Ñ‡ÐµÑˆ, Ñ Ð¼Ð¾Ð¶Ñƒ Ð´Ð¾Ð¿Ð¾Ð¼Ð¾Ð³Ñ‚Ð¸ Ñ‚Ð¾Ð±Ñ– Ð· Ð¿Ñ€Ð¾Ñ”ÐºÑ‚Ð¾Ð¼.\n   - [ ] Ð¯ÐºÐ±Ð¸ Ñ…Ð¾Ñ‡ÐµÑˆ, Ð¼Ð¾Ð¶Ñƒ Ð´Ð¾Ð¿Ð¾Ð¼Ð¾Ð³Ñ‚Ð¸ Ð· Ð¿Ñ€Ð¾Ñ”ÐºÑ‚Ð¾Ð¼.\n   - [ ] Ð¯ÐºÑ‰Ð¾ Ñ‚Ð¸ Ñ…Ð¾Ñ‚Ñ–Ð»Ð°, Ñ Ð´Ð¾Ð¿Ð¾Ð¼Ð°Ð³Ð°ÑŽ Ñ‚Ð¾Ð±Ñ–.\n   - [ ] ÐšÐ¾Ð»Ð¸ Ð± Ñ‚Ð¸ Ñ…Ð¾Ñ‡ÐµÑˆ, Ñ Ð´Ð¾Ð¿Ð¾Ð¼Ð¾Ð¶Ñƒ Ñ‚Ð¾Ð±Ñ–.\n\n3. If he comes late, we will start without him.\n   - [x] Ð¯ÐºÑ‰Ð¾ Ð²Ñ–Ð½ Ð¿Ñ€Ð¸Ð¹Ð´Ðµ Ð¿Ñ–Ð·Ð½Ð¾, Ð¼Ð¸ Ð¿Ð¾Ñ‡Ð½ÐµÐ¼Ð¾ Ð±ÐµÐ· Ð½ÑŒÐ¾Ð³Ð¾.\n   - [ ] Ð¯ÐºÐ±Ð¸ Ð²Ñ–Ð½ Ð¿Ñ€Ð¸Ð¹ÑˆÐ¾Ð² Ð¿Ñ–Ð·Ð½Ð¾, Ð¼Ð¸ Ð¿Ð¾Ñ‡Ð½ÐµÐ¼Ð¾ Ð±ÐµÐ· Ð½ÑŒÐ¾Ð³Ð¾.\n   - [ ] Ð¯ÐºÑ‰Ð¾ Ð²Ñ–Ð½ Ð¿Ñ€Ð¸Ñ…Ð¾Ð´Ð¸Ñ‚ÑŒ Ð¿Ñ–Ð·Ð½Ð¾, Ð¼Ð¸ Ð¿Ð¾Ñ‡Ð°Ð»Ð¸ Ð±ÐµÐ· Ð½ÑŒÐ¾Ð³Ð¾.\n   - [ ] ÐšÐ¾Ð»Ð¸ Ð± Ð²Ñ–Ð½ Ð¿Ñ€Ð¸Ð¹Ð´Ðµ, Ð¼Ð¸ Ð¿Ð¾Ñ‡Ð½ÐµÐ¼Ð¾ Ð±ÐµÐ·.\n\n4. In case you forget, I will remind you tomorrow.\n   - [x] Ð£ Ð²Ð¸Ð¿Ð°Ð´ÐºÑƒ ÑÐºÑ‰Ð¾ Ð·Ð°Ð±ÑƒÐ´ÐµÑˆ, Ñ Ð½Ð°Ð³Ð°Ð´Ð°ÑŽ Ñ‚Ð¾Ð±Ñ– Ð·Ð°Ð²Ñ‚Ñ€Ð°.\n   - [ ] Ð£ Ð²Ð¸Ð¿Ð°Ð´ÐºÑƒ ÑÐºÐ±Ð¸ Ð·Ð°Ð±ÑƒÐ´ÐµÑˆ, Ð½Ð°Ð³Ð°Ð´Ð°ÑŽ Ñ‚Ð¾Ð±Ñ–.\n   - [ ] Ð¯ÐºÑ‰Ð¾ Ñƒ Ð²Ð¸Ð¿Ð°Ð´ÐºÑƒ Ð·Ð°Ð±ÑƒÐ²Ð°Ñ”Ñˆ, Ð½Ð°Ð³Ð°Ð´Ð°ÑŽ.\n   - [ ] ÐšÐ¾Ð»Ð¸ Ð± Ñ‚Ð¸ Ð·Ð°Ð±ÑƒÐ², Ñ Ð½Ð°Ð³Ð°Ð´Ð°Ð² Ð±Ð¸.\n\n5. If you don't understand, please ask me for help.\n   - [x] Ð¯ÐºÑ‰Ð¾ Ð½Ðµ Ñ€Ð¾Ð·ÑƒÐ¼Ñ–Ñ”Ñˆ, Ð±ÑƒÐ´ÑŒ Ð»Ð°ÑÐºÐ°, Ð¿Ð¸Ñ‚Ð°Ð¹ Ð¼ÐµÐ½Ðµ.\n   - [ ] Ð¯ÐºÐ±Ð¸ Ð½Ðµ Ñ€Ð¾Ð·ÑƒÐ¼Ñ–Ñ”Ñˆ, Ð¿Ð¸Ñ‚Ð°Ð¹ Ð¼ÐµÐ½Ðµ, Ð±ÑƒÐ´ÑŒ Ð»Ð°ÑÐºÐ°.\n   - [ ] Ð¯ÐºÑ‰Ð¾ Ñ‚Ð¸ Ð½Ðµ Ñ€Ð¾Ð·ÑƒÐ¼Ñ–Ð², Ð¿Ð¸Ñ‚Ð°Ð¹ Ð´Ð¾Ð¿Ð¾Ð¼Ð¾Ð³Ñƒ.\n   - [ ] ÐšÐ¾Ð»Ð¸ Ð± Ð½Ðµ Ñ€Ð¾Ð·ÑƒÐ¼Ñ–Ñ”Ñˆ, Ð·Ð°Ð¿Ð¸Ñ‚Ð°Ð¹ Ð¼ÐµÐ½Ðµ.\n\n6. If questions arise, contact the administrator immediately.\n   - [x] Ð¯ÐºÑ‰Ð¾ Ð²Ð¸Ð½Ð¸ÐºÐ½ÑƒÑ‚ÑŒ Ð·Ð°Ð¿Ð¸Ñ‚Ð°Ð½Ð½Ñ, Ð·Ð²ÐµÑ€Ð½Ñ–Ñ‚ÑŒÑÑ Ð´Ð¾ Ð°Ð´Ð¼Ñ–Ð½Ñ–ÑÑ‚Ñ€Ð°Ñ‚Ð¾Ñ€Ð° Ð½ÐµÐ³Ð°Ð¹Ð½Ð¾.\n   - [ ] Ð¯ÐºÐ±Ð¸ Ð²Ð¸Ð½Ð¸ÐºÐ½ÑƒÑ‚ÑŒ Ð·Ð°Ð¿Ð¸Ñ‚Ð°Ð½Ð½Ñ, Ð·Ð²ÐµÑ€Ð½ÑƒÑ‚Ð¸ÑÑ Ð´Ð¾ Ð°Ð´Ð¼Ñ–Ð½Ñ–ÑÑ‚Ñ€Ð°Ñ‚Ð¾Ñ€Ð°.\n   - [ ] Ð¯ÐºÑ‰Ð¾ Ð·Ð°Ð¿Ð¸Ñ‚Ð°Ð½Ð½Ñ Ð²Ð¸Ð½Ð¸ÐºÐ°ÑŽÑ‚ÑŒ, Ð·Ð²ÐµÑ€Ð½Ñ–Ñ‚ÑŒÑÑ Ð½ÐµÐ³Ð°Ð¹Ð½Ð¾ Ð°Ð´Ð¼Ñ–Ð½Ñ–ÑÑ‚Ñ€Ð°Ñ‚Ð¾Ñ€.\n   - [ ] ÐšÐ¾Ð»Ð¸ Ð± Ð·Ð°Ð¿Ð¸Ñ‚Ð°Ð½Ð½Ñ, Ð°Ð´Ð¼Ñ–Ð½Ñ–ÑÑ‚Ñ€Ð°Ñ‚Ð¾Ñ€ Ð·Ð²ÐµÑ€Ð½Ñ–Ñ‚ÑŒÑÑ.\n\n---"
      },
      {
        "id": "section-3",
        "name": "Ð¡Ð»Ð¾Ð²Ð½Ð¸Ðº",
        "nameEn": null,
        "type": "vocabulary",
        "content": "| Ð¡Ð»Ð¾Ð²Ð¾ | Ð’Ð¸Ð¼Ð¾Ð²Ð° | ÐŸÐµÑ€ÐµÐºÐ»Ð°Ð´ | Ð§Ðœ | ÐŸÑ€Ð¸Ð¼Ñ–Ñ‚ÐºÐ° |\n|-------|--------|----------|-----|----------|\n| **ÑÐºÑ‰Ð¾** | /jÉ‘kËˆÊƒtÊƒÉ”/ | if | ÑÐ¿Ð¾Ð»ÑƒÑ‡Ð½. | Ð²Ð²Ð¾Ð´Ð¸Ñ‚ÑŒ ÑƒÐ¼Ð¾Ð²Ñƒ |\n| **ÐºÐ¾Ð»Ð¸** | /kÉ”ËˆlÉª/ | when, if (conditional) | ÑÐ¿Ð¾Ð»ÑƒÑ‡Ð½. | Ñ‡Ð°ÑÐ¾Ð²Ð¸Ð¹ Ð°Ð±Ð¾ ÑƒÐ¼Ð¾Ð²Ð½Ð¸Ð¹ |\n| **Ñƒ Ð²Ð¸Ð¿Ð°Ð´ÐºÑƒ ÑÐºÑ‰Ð¾** | /u ËˆwÉªpÉ‘dku jÉ‘kËˆÊƒtÊƒÉ”/ | in case if | ÑÐ¿Ð¾Ð»ÑƒÑ‡Ð½. | Ð´Ð»Ñ Ð·Ð°Ð¿Ð°ÑÐ½Ð¾Ð³Ð¾ Ð¿Ð»Ð°Ð½Ñƒ |\n| **Ð·Ð° ÑƒÐ¼Ð¾Ð²Ð¸ Ñ‰Ð¾** | /zÉ‘ uËˆmÉ”wÉª ÊƒtÊƒÉ”/ | provided that | ÑÐ¿Ð¾Ð»ÑƒÑ‡Ð½. | ÑƒÐ¼Ð¾Ð²Ð°-Ð²Ð¸Ð¼Ð¾Ð³Ð° |\n| **Ð¿Ñ€Ð¸ ÑƒÐ¼Ð¾Ð²Ñ– Ñ‰Ð¾** | /prÉª uËˆmÉ”wÉª ÊƒtÊƒÉ”/ | on condition that | ÑÐ¿Ð¾Ð»ÑƒÑ‡Ð½. | Ñ„Ð¾Ñ€Ð¼Ð°Ð»ÑŒÐ½Ðµ |\n| **Ñƒ Ñ€Ð°Ð·Ñ– ÑÐºÑ‰Ð¾** | /u ËˆrÉ‘zÊ²i jÉ‘kËˆÊƒtÊƒÉ”/ | in the event that | ÑÐ¿Ð¾Ð»ÑƒÑ‡Ð½. | Ð¾Ñ„Ñ–Ñ†Ñ–Ð¹Ð½Ðµ |\n| **ÑƒÐ¼Ð¾Ð²Ð°** | /uËˆmÉ”wÉ‘/ | condition | Ñ–Ð¼. (Ð¶.Ñ€.) | Ð¾Ð±ÑÑ‚Ð°Ð²Ð¸Ð½Ð° |\n| **Ð½Ð°ÑÐ»Ñ–Ð´Ð¾Ðº** | /nÉ‘ËˆslÊ²idÉ”k/ | consequence, result | Ñ–Ð¼. (Ñ‡.Ñ€.) | Ñ€ÐµÐ·ÑƒÐ»ÑŒÑ‚Ð°Ñ‚ Ð´Ñ–Ñ— |\n| **Ñ‚Ð¾Ð´Ñ–** | /tÉ”ËˆdÊ²i/ | then | Ð¿Ñ€Ð¸ÑÐ». | Ñƒ Ñ‚Ð°ÐºÐ¾Ð¼Ñƒ Ñ€Ð°Ð·Ñ– |\n| **Ð¼Ð¾Ð¶Ð»Ð¸Ð²Ð¾** | /mÉ”Ê’ËˆlÉªwÉ”/ | possibly, maybe | Ð¿Ñ€Ð¸ÑÐ». | Ð²ÐºÐ°Ð·ÑƒÑ” Ð½Ð° Ð¹Ð¼Ð¾Ð²Ñ–Ñ€Ð½Ñ–ÑÑ‚ÑŒ |\n| **Ð¹Ð¼Ð¾Ð²Ñ–Ñ€Ð½Ð¾** | /jmÉ”ËˆwÊ²irnÉ”/ | probably | Ð¿Ñ€Ð¸ÑÐ». | Ð²Ð¸ÑÐ¾ÐºÐ° Ð¹Ð¼Ð¾Ð²Ñ–Ñ€Ð½Ñ–ÑÑ‚ÑŒ |\n| **Ð¿ÐµÐ²Ð½Ð¾** | /ËˆpewnÉ”/ | surely, certainly | Ð¿Ñ€Ð¸ÑÐ». | Ð²Ð¿ÐµÐ²Ð½ÐµÐ½Ñ–ÑÑ‚ÑŒ |\n| **Ð½Ð°Ð¿ÐµÐ²Ð½Ð¾** | /nÉ‘ËˆpewnÉ”/ | certainly, for sure | Ð¿Ñ€Ð¸ÑÐ». | Ð²Ð¸ÑÐ¾ÐºÐ° Ð²Ð¿ÐµÐ²Ð½ÐµÐ½Ñ–ÑÑ‚ÑŒ |\n| **Ð¼Ð¾Ð¶Ð»Ð¸Ð²Ñ–ÑÑ‚ÑŒ** | /mÉ”Ê’ËˆlÉªwÊ²istÊ²/ | possibility | Ñ–Ð¼. (Ð¶.Ñ€.) | ÑˆÐ°Ð½Ñ Ð½Ð° Ð¿Ð¾Ð´Ñ–ÑŽ |\n| **Ð² Ñ‚Ð°ÐºÐ¾Ð¼Ñƒ Ñ€Ð°Ð·Ñ–** | /w tÉ‘ËˆkÉ”mu ËˆrÉ‘zÊ²i/ | in that case | Ð¿Ñ€Ð¸ÑÐ». | Ñƒ Ñ‚Ð°ÐºÑ–Ð¹ ÑÐ¸Ñ‚ÑƒÐ°Ñ†Ñ–Ñ— |\n| **Ñ–Ð½Ð°ÐºÑˆÐµ** | /iËˆnÉ‘kÊƒÉ›/ | otherwise | Ð¿Ñ€Ð¸ÑÐ». | ÑÐºÑ‰Ð¾ Ð½Ñ– |\n| **Ð² Ñ–Ð½ÑˆÐ¾Ð¼Ñƒ Ð²Ð¸Ð¿Ð°Ð´ÐºÑƒ** | /w ËˆinÊƒÉ”mu ËˆwÉªpÉ‘dku/ | otherwise | Ð¿Ñ€Ð¸ÑÐ». | Ð°Ð»ÑŒÑ‚ÐµÑ€Ð½Ð°Ñ‚Ð¸Ð²Ð° |\n| **Ð¿Ñ€Ð¾Ñ‚Ðµ** | /prÉ”ËˆtÉ›/ | however | ÑÐ¿Ð¾Ð»ÑƒÑ‡Ð½. | ÐºÐ¾Ð½Ñ‚Ñ€Ð°ÑÑ‚ |\n| **Ð¾Ð´Ð½Ð°Ðº** | /É”dËˆnÉ‘k/ | however | ÑÐ¿Ð¾Ð»ÑƒÑ‡Ð½. | Ñ„Ð¾Ñ€Ð¼Ð°Ð»ÑŒÐ½Ð¸Ð¹ ÐºÐ¾Ð½Ñ‚Ñ€Ð°ÑÑ‚ |\n| **Ð¾Ñ‚Ð¶Ðµ** | /É”tËˆÊ’É›/ | therefore, so | ÑÐ¿Ð¾Ð»ÑƒÑ‡Ð½. | Ð²Ð¸ÑÐ½Ð¾Ð²Ð¾Ðº |\n| **Ñ‚Ð¾Ð¼Ñƒ** | /tÉ”Ëˆmu/ | therefore | ÑÐ¿Ð¾Ð»ÑƒÑ‡Ð½. | Ð¿Ñ€Ð¸Ñ‡Ð¸Ð½Ð°-Ð½Ð°ÑÐ»Ñ–Ð´Ð¾Ðº |\n| **Ñ‡ÐµÑ€ÐµÐ· Ñ†Ðµ** | /ËˆtÊƒÉ›rÉ›z tÍ¡sÉ›/ | because of this | Ð¿Ñ€Ð¸ÑÐ». | Ð¿Ð¾ÑÑÐ½ÐµÐ½Ð½Ñ |\n| **Ð·Ð½Ð°Ñ‡Ð¸Ñ‚ÑŒ** | /ËˆznÉ‘tÊƒÉªtÊ²/ | it means, therefore | Ð´Ñ–Ñ”ÑÐ». | Ð»Ð¾Ð³Ñ–Ñ‡Ð½Ð¸Ð¹ Ð²Ð¸ÑÐ½Ð¾Ð²Ð¾Ðº |\n| **Ð²Ð¸Ñ…Ð¾Ð´Ð¸Ñ‚ÑŒ** | /wÉªËˆxÉ”dÉªtÊ²/ | it turns out | Ð´Ñ–Ñ”ÑÐ». | Ð²Ð¸ÑÐ²Ð»ÑÑ”Ñ‚ÑŒÑÑ |\n| **Ð²ÑÐµ Ð¾Ð´Ð½Ð¾** | /wsÊ²É› É”dËˆnÉ”/ | anyway, nevertheless | Ð¿Ñ€Ð¸ÑÐ». | Ð½ÐµÐ·Ð²Ð°Ð¶Ð°ÑŽÑ‡Ð¸ Ð½Ñ– Ð½Ð° Ñ‰Ð¾ |"
      }
    ],
    "rawMarkdown": "---\nmodule: b1-31\ntitle: \"Ð£Ð¼Ð¾Ð²Ð½Ñ– Ñ€ÐµÑ‡ÐµÐ½Ð½Ñ: Ñ€ÐµÐ°Ð»ÑŒÐ½Ð° ÑƒÐ¼Ð¾Ð²Ð° (ÑÐºÑ‰Ð¾)\"\nsubtitle: \"Real Conditionals - If Clauses\"\nversion: \"1.0\"\nphase: \"B1.3a Complex Sentences\"\npedagogy: \"TTT\"\nduration: 90\ntransliteration: none\ntags:\n  - grammar\n  - conditionals\n  - complex-sentences\n  - yakshcho\ngrammar:\n  - \"Real conditional constructions with ÑÐºÑ‰Ð¾\"\n  - \"Tense sequences in conditional sentences\"\nobjectives:\n  - \"Learner understands real conditional constructions\"\n  - \"Learner can form conditional sentences with ÑÐºÑ‰Ð¾\"\n  - \"Learner can use correct tense sequences in conditionals\"\nvocabulary_count: 25\n---\n\n> [!motivation]\n> Ð£Ð¼Ð¾Ð²Ð½Ñ– Ñ€ÐµÑ‡ÐµÐ½Ð½Ñ â€” Ñ†Ðµ ÑÐµÑ€Ñ†Ðµ Ð»Ð¾Ð³Ñ–Ñ‡Ð½Ð¾Ð³Ð¾ Ð¼Ð¸ÑÐ»ÐµÐ½Ð½Ñ. ÐšÐ¾Ð»Ð¸ Ð²Ð¸ Ð³Ð¾Ð²Ð¾Ñ€Ð¸Ñ‚Ðµ Â«ÑÐºÑ‰Ð¾... Ñ‚Ð¾...Â», Ð²Ð¸ Ð¿Ð¾ÐºÐ°Ð·ÑƒÑ”Ñ‚Ðµ Ð·Ð²'ÑÐ·Ð¾Ðº Ð¼Ñ–Ð¶ Ð¿Ñ€Ð¸Ñ‡Ð¸Ð½Ð¾ÑŽ Ñ– Ð½Ð°ÑÐ»Ñ–Ð´ÐºÐ¾Ð¼. Ð‘ÐµÐ· Ñ†Ñ–Ñ”Ñ— ÐºÐ¾Ð½ÑÑ‚Ñ€ÑƒÐºÑ†Ñ–Ñ— Ð½ÐµÐ¼Ð¾Ð¶Ð»Ð¸Ð²Ð¾ Ð¾Ð±Ð³Ð¾Ð²Ð¾Ñ€ÑŽÐ²Ð°Ñ‚Ð¸ Ð¿Ð»Ð°Ð½Ð¸, Ð´Ð°Ð²Ð°Ñ‚Ð¸ Ð¿Ð¾Ñ€Ð°Ð´Ð¸, Ñ€Ð¾Ð±Ð¸Ñ‚Ð¸ Ð¿Ñ€Ð¾Ð³Ð½Ð¾Ð·Ð¸ Ñ‡Ð¸ Ð°Ð½Ð°Ð»Ñ–Ð·ÑƒÐ²Ð°Ñ‚Ð¸ ÑÐ¸Ñ‚ÑƒÐ°Ñ†Ñ–Ñ—. Ð£ÐºÑ€Ð°Ñ—Ð½ÑÑŒÐºÐ° Ð¼Ð¾Ð²Ð° Ð¼Ð°Ñ” Ð±Ð°Ð³Ð°Ñ‚Ñƒ ÑÐ¸ÑÑ‚ÐµÐ¼Ñƒ ÑƒÐ¼Ð¾Ð²Ð½Ð¸Ñ… Ñ€ÐµÑ‡ÐµÐ½ÑŒ. Ð£ Ñ†ÑŒÐ¾Ð¼Ñƒ Ð¼Ð¾Ð´ÑƒÐ»Ñ– Ð¼Ð¸ Ð·Ð¾ÑÐµÑ€ÐµÐ´Ð¸Ð¼Ð¾ÑÑ Ð½Ð° **Ñ€ÐµÐ°Ð»ÑŒÐ½Ð¸Ñ… ÑƒÐ¼Ð¾Ð²Ð°Ñ…** â€” Ñ‚Ð¸Ñ…, Ñ‰Ð¾ Ð¼Ð¾Ð¶ÑƒÑ‚ÑŒ ÑÐ¿Ñ€Ð°Ð²Ð´Ñ– ÑÑ‚Ð°Ñ‚Ð¸ÑÑ. ÐžÐ¿Ð°Ð½ÑƒÐ²Ð°Ð²ÑˆÐ¸ Ñ†ÑŽ Ð²Ð°Ð¶Ð»Ð¸Ð²Ñƒ Ñ‚ÐµÐ¼Ñƒ, Ð²Ð¸ Ð·Ð¼Ð¾Ð¶ÐµÑ‚Ðµ Ð²Ð¿ÐµÐ²Ð½ÐµÐ½Ð¾ Ñ„Ð¾Ñ€Ð¼ÑƒÐ»ÑŽÐ²Ð°Ñ‚Ð¸ Ð¿Ð»Ð°Ð½Ð¸ Ð½Ð° Ð¼Ð°Ð¹Ð±ÑƒÑ‚Ð½Ñ”. Ð¢Ð°ÐºÐ¾Ð¶ Ð²Ð¸ Ð½Ð°Ð²Ñ‡Ð¸Ñ‚ÐµÑÑ Ð´Ð°Ð²Ð°Ñ‚Ð¸ Ð¿Ð¾Ñ€Ð°Ð´Ð¸ Ð´Ñ€ÑƒÐ·ÑÐ¼ Ñ– ÐºÐ¾Ð»ÐµÐ³Ð°Ð¼, Ð¾Ð±Ð³Ð¾Ð²Ð¾Ñ€ÑŽÐ²Ð°Ñ‚Ð¸ Ð¼Ð¾Ð¶Ð»Ð¸Ð²Ñ– ÑÑ†ÐµÐ½Ð°Ñ€Ñ–Ñ— Ñ€Ð¾Ð·Ð²Ð¸Ñ‚ÐºÑƒ Ð¿Ð¾Ð´Ñ–Ð¹ Ñ‚Ð° Ð°Ð½Ð°Ð»Ñ–Ð·ÑƒÐ²Ð°Ñ‚Ð¸ Ñ€Ñ–Ð·Ð½Ð¾Ð¼Ð°Ð½Ñ–Ñ‚Ð½Ñ– Ð³Ñ–Ð¿Ð¾Ñ‚ÐµÑ‚Ð¸Ñ‡Ð½Ñ– ÑÐ¸Ñ‚ÑƒÐ°Ñ†Ñ–Ñ— Ð² Ð¿Ð¾Ð²ÑÑÐºÐ´ÐµÐ½Ð½Ð¾Ð¼Ñƒ ÑÐ¿Ñ–Ð»ÐºÑƒÐ²Ð°Ð½Ð½Ñ–.\n\n---\n\n## Ð¢ÐµÑÑ‚: ÐŸÐµÑ€ÐµÐ²Ñ–Ñ€Ñ‚Ðµ ÑÐµÐ±Ðµ\n\nÐ¡Ð¿Ñ€Ð¾Ð±ÑƒÐ¹Ñ‚Ðµ Ð¿ÐµÑ€ÐµÐºÐ»Ð°ÑÑ‚Ð¸ Ñ†Ñ– Ñ€ÐµÑ‡ÐµÐ½Ð½Ñ Ð½Ð° ÑƒÐºÑ€Ð°Ñ—Ð½ÑÑŒÐºÑƒ. Ð¯Ðº Ð±Ð¸ Ð²Ð¸ Ñ—Ñ… ÑÐºÐ°Ð·Ð°Ð»Ð¸ Ð·Ð° Ð´Ð¾Ð¿Ð¾Ð¼Ð¾Ð³Ð¾ÑŽ ÑƒÐ¼Ð¾Ð²Ð½Ð¸Ñ… ÐºÐ¾Ð½ÑÑ‚Ñ€ÑƒÐºÑ†Ñ–Ð¹?\n\n1. If it rains, I will take an umbrella.\n2. If you want, I can help you with the project.\n3. If he comes late, we will start without him.\n4. If the weather is good, we will go for a walk in the park.\n\nÐ¯ÐºÑ‰Ð¾ Ð²Ð¸ Ð½ÐµÐ²Ð¿ÐµÐ²Ð½ÐµÐ½Ñ–, ÑÐºÐ¸Ð¹ ÑÐ°Ð¼Ðµ Ñ‡Ð°Ñ Ð¿Ð¾Ñ‚Ñ€Ñ–Ð±Ð½Ð¾ Ð²Ð¸ÐºÐ¾Ñ€Ð¸ÑÑ‚Ð¾Ð²ÑƒÐ²Ð°Ñ‚Ð¸ Ð² ÐºÐ¾Ð¶Ð½Ñ–Ð¹ Ñ‡Ð°ÑÑ‚Ð¸Ð½Ñ– ÑƒÐ¼Ð¾Ð²Ð½Ð¾Ð³Ð¾ Ñ€ÐµÑ‡ÐµÐ½Ð½Ñ â€” Ñ†ÐµÐ¹ Ð¼Ð¾Ð´ÑƒÐ»ÑŒ ÑÐ°Ð¼Ðµ Ð´Ð»Ñ Ð²Ð°Ñ!\n\n> [!observe]\n> ÐŸÐ¾Ñ€Ñ–Ð²Ð½ÑÐ¹Ñ‚Ðµ Ñ†Ñ– Ñ€ÐµÑ‡ÐµÐ½Ð½Ñ Ð¹ Ð·Ð²ÐµÑ€Ð½Ñ–Ñ‚ÑŒ ÑƒÐ²Ð°Ð³Ñƒ Ð½Ð° Ñ‡Ð°Ñ Ð´Ñ–Ñ”ÑÐ»Ð¾Ð²Ð° Ð² ÐºÐ¾Ð¶Ð½Ñ–Ð¹ Ñ‡Ð°ÑÑ‚Ð¸Ð½Ñ–:\n> - **Ð¯ÐºÑ‰Ð¾** Ñ **Ð¼Ð°Ñ‚Ð¸Ð¼Ñƒ** Ñ‡Ð°Ñ, Ñ **Ð´Ð¾Ð¿Ð¾Ð¼Ð¾Ð¶Ñƒ** Ñ‚Ð¾Ð±Ñ–. (Ð¼Ð°Ð¹Ð±ÑƒÑ‚Ð½Ñ–Ð¹ + Ð¼Ð°Ð¹Ð±ÑƒÑ‚Ð½Ñ–Ð¹)\n> - **Ð¯ÐºÑ‰Ð¾** Ñ‚Ð¸ **Ñ…Ð¾Ñ‡ÐµÑˆ**, Ñ **Ð¼Ð¾Ð¶Ñƒ** Ð´Ð¾Ð¿Ð¾Ð¼Ð¾Ð³Ñ‚Ð¸. (Ñ‚ÐµÐ¿ÐµÑ€Ñ–ÑˆÐ½Ñ–Ð¹ + Ñ‚ÐµÐ¿ÐµÑ€Ñ–ÑˆÐ½Ñ–Ð¹)\n> - **Ð¯ÐºÑ‰Ð¾** Ð²Ñ–Ð½ **Ð¿Ñ€Ð¸Ð¹Ð´Ðµ** Ð¿Ñ–Ð·Ð½Ð¾, Ð¼Ð¸ **Ð¿Ð¾Ñ‡Ð½ÐµÐ¼Ð¾** Ð±ÐµÐ· Ð½ÑŒÐ¾Ð³Ð¾. (Ð¼Ð°Ð¹Ð±ÑƒÑ‚Ð½Ñ–Ð¹ + Ð¼Ð°Ð¹Ð±ÑƒÑ‚Ð½Ñ–Ð¹)\n\n---\n\n## ÐŸÐ¾ÑÑÐ½ÐµÐ½Ð½Ñ\n\n### Ð©Ð¾ Ñ‚Ð°ÐºÐµ Ñ€ÐµÐ°Ð»ÑŒÐ½Ð° ÑƒÐ¼Ð¾Ð²Ð°?\n\n**Ð ÐµÐ°Ð»ÑŒÐ½Ð° ÑƒÐ¼Ð¾Ð²Ð°** Ð¾Ð¿Ð¸ÑÑƒÑ” ÑÐ¸Ñ‚ÑƒÐ°Ñ†Ñ–Ñ—, ÑÐºÑ–:\n- ÐœÐ¾Ð¶ÑƒÑ‚ÑŒ Ð²Ñ–Ð´Ð±ÑƒÑ‚Ð¸ÑÑ Ð·Ð°Ñ€Ð°Ð·\n- ÐœÐ¾Ð¶ÑƒÑ‚ÑŒ Ð²Ñ–Ð´Ð±ÑƒÑ‚Ð¸ÑÑ Ð² Ð¼Ð°Ð¹Ð±ÑƒÑ‚Ð½ÑŒÐ¾Ð¼Ñƒ\n- Ð„ Ð»Ð¾Ð³Ñ–Ñ‡Ð½Ð¾ Ð¼Ð¾Ð¶Ð»Ð¸Ð²Ð¸Ð¼Ð¸\n- ÐÐµ ÑÑƒÐ¿ÐµÑ€ÐµÑ‡Ð°Ñ‚ÑŒ Ñ€ÐµÐ°Ð»ÑŒÐ½Ð¾ÑÑ‚Ñ–\n\nÐœÐ¸ Ð²Ð¸ÐºÐ¾Ñ€Ð¸ÑÑ‚Ð¾Ð²ÑƒÑ”Ð¼Ð¾ ÑÐ¿Ð¾Ð»ÑƒÑ‡Ð½Ð¸Ðº **ÑÐºÑ‰Ð¾** (if) Ð´Ð»Ñ Ð²Ð²ÐµÐ´ÐµÐ½Ð½Ñ ÑƒÐ¼Ð¾Ð²Ð¸.\n\n### Ð¡Ñ‚Ñ€ÑƒÐºÑ‚ÑƒÑ€Ð° ÑƒÐ¼Ð¾Ð²Ð½Ð¸Ñ… Ñ€ÐµÑ‡ÐµÐ½ÑŒ\n\n```\nÐ¯ÐºÑ‰Ð¾ + ÑƒÐ¼Ð¾Ð²Ð° , Ð½Ð°ÑÐ»Ñ–Ð´Ð¾Ðº\nÐÐ‘Ðž\nÐÐ°ÑÐ»Ñ–Ð´Ð¾Ðº , ÑÐºÑ‰Ð¾ + ÑƒÐ¼Ð¾Ð²Ð°\n```\n\n**ÐŸÑ€Ð¸ÐºÐ»Ð°Ð´Ð¸ Ð¾Ð±Ð¾Ñ… ÑÑ‚Ñ€ÑƒÐºÑ‚ÑƒÑ€:**\n- **Ð¯ÐºÑ‰Ð¾** Ð±ÑƒÐ´Ðµ Ð³Ð°Ñ€Ð½Ð° Ð¿Ð¾Ð³Ð¾Ð´Ð°, Ð¼Ð¸ Ð¿Ñ–Ð´ÐµÐ¼Ð¾ Ð½Ð° Ð¿Ñ€Ð¾Ð³ÑƒÐ»ÑÐ½ÐºÑƒ Ð²Ð²ÐµÑ‡ÐµÑ€Ñ–.\n- ÐœÐ¸ Ð¿Ñ–Ð´ÐµÐ¼Ð¾ Ð½Ð° Ð¿Ñ€Ð¾Ð³ÑƒÐ»ÑÐ½ÐºÑƒ Ð²Ð²ÐµÑ‡ÐµÑ€Ñ–, **ÑÐºÑ‰Ð¾** Ð±ÑƒÐ´Ðµ Ð³Ð°Ñ€Ð½Ð° Ð¿Ð¾Ð³Ð¾Ð´Ð°.\n\n> ðŸ’¡ **Ð¦Ñ–ÐºÐ°Ð²Ð¸Ð¹ Ñ„Ð°ÐºÑ‚**\n> Ð£ÐºÑ€Ð°Ñ—Ð½ÑÑŒÐºÐµ Â«ÑÐºÑ‰Ð¾Â» Ð¿Ð¾Ñ…Ð¾Ð´Ð¸Ñ‚ÑŒ Ð²Ñ–Ð´ Ð´Ð°Ð²Ð½ÑŒÐ¾ÑÐ»Ð¾Ð²'ÑÐ½ÑÑŒÐºÐ¾Ð³Ð¾ Â«ÑÐºÐ¾Â» + Â«Ñ‰Ð°Â». Ð¦Ðµ Ñ‚Ð¾Ð¹ ÑÐ°Ð¼Ð¸Ð¹ ÐºÐ¾Ñ€Ñ–Ð½ÑŒ, Ñ‰Ð¾ Ð¹ Ñƒ Ð¿Ð¸Ñ‚Ð°Ð»ÑŒÐ½Ð¾Ð¼Ñƒ ÑÐ»Ð¾Ð²Ñ– Â«ÑÐºÂ» (how). ÐŸÐ¾Ñ‡Ð°Ñ‚ÐºÐ¾Ð²Ðµ Ð·Ð½Ð°Ñ‡ÐµÐ½Ð½Ñ â€” Â«ÑÐºÐ¸Ð¼ ÑÐ¿Ð¾ÑÐ¾Ð±Ð¾Ð¼Â», Â«Ð·Ð° ÑÐºÐ¸Ñ… Ð¾Ð±ÑÑ‚Ð°Ð²Ð¸Ð½Â». Ð¦Ðµ Ð¿Ð¾ÐºÐ°Ð·ÑƒÑ” Ð³Ð»Ð¸Ð±Ð¾ÐºÐ¸Ð¹ Ð·Ð²'ÑÐ·Ð¾Ðº Ð¼Ñ–Ð¶ Ð¿Ð¸Ñ‚Ð°Ð½Ð½ÑÐ¼Ð¸ Ñ‚Ð° ÑƒÐ¼Ð¾Ð²Ð°Ð¼Ð¸ Ð² ÑÐ»Ð¾Ð²'ÑÐ½ÑÑŒÐºÐ¾Ð¼Ñƒ ÑÐ²Ñ–Ñ‚Ð¾Ð³Ð»ÑÐ´Ñ–!\n\n### Ð§Ð°ÑÐ¾Ð²Ñ– ÑÑ…ÐµÐ¼Ð¸ Ñ€ÐµÐ°Ð»ÑŒÐ½Ð¸Ñ… ÑƒÐ¼Ð¾Ð²\n\n#### Ð¡Ñ…ÐµÐ¼Ð° 1: Ð¢ÐµÐ¿ÐµÑ€Ñ–ÑˆÐ½Ñ–Ð¹ + Ñ‚ÐµÐ¿ÐµÑ€Ñ–ÑˆÐ½Ñ–Ð¹ (Ð·Ð°Ð³Ð°Ð»ÑŒÐ½Ð° Ñ–ÑÑ‚Ð¸Ð½Ð°)\n\n| Ð£Ð¼Ð¾Ð²Ð° | ÐÐ°ÑÐ»Ñ–Ð´Ð¾Ðº | Ð—Ð½Ð°Ñ‡ÐµÐ½Ð½Ñ |\n|-------|----------|----------|\n| Ð¯ÐºÑ‰Ð¾ Ñ‚Ð¸ **Ñ…Ð¾Ñ‡ÐµÑˆ** | Ñ **Ð¼Ð¾Ð¶Ñƒ** Ð´Ð¾Ð¿Ð¾Ð¼Ð¾Ð³Ñ‚Ð¸ | Ð·Ð°Ð³Ð°Ð»ÑŒÐ½Ð° Ð¿Ñ€Ð¾Ð¿Ð¾Ð·Ð¸Ñ†Ñ–Ñ |\n| Ð¯ÐºÑ‰Ð¾ Ð²Ñ–Ð½ **Ð¿Ñ€Ð°Ñ†ÑŽÑ”** | Ð²Ñ–Ð½ **Ð·Ð°Ñ€Ð¾Ð±Ð»ÑÑ”** | Ð¿Ñ€Ð¸Ñ‡Ð¸Ð½Ð½Ð¾-Ð½Ð°ÑÐ»Ñ–Ð´ÐºÐ¾Ð²Ð¸Ð¹ Ð·Ð²'ÑÐ·Ð¾Ðº |\n| Ð¯ÐºÑ‰Ð¾ Ð²Ð¾Ð´Ð° **ÐºÐ¸Ð¿Ð¸Ñ‚ÑŒ** | Ð²Ð¾Ð½Ð° **Ð²Ð¸Ð¿Ð°Ñ€Ð¾Ð²ÑƒÑ”Ñ‚ÑŒÑÑ** | Ð½Ð°ÑƒÐºÐ¾Ð²Ð¸Ð¹ Ñ„Ð°ÐºÑ‚ |\n| Ð¯ÐºÑ‰Ð¾ Ñ‚Ð¸ **Ð½Ðµ Ñ€Ð¾Ð·ÑƒÐ¼Ñ–Ñ”Ñˆ** | **Ð¿Ð¸Ñ‚Ð°Ð¹** | Ð·Ð°Ð³Ð°Ð»ÑŒÐ½Ð° Ð¿Ð¾Ñ€Ð°Ð´Ð° |\n\n**ÐšÐ¾Ð»Ð¸ Ð²Ð¸ÐºÐ¾Ñ€Ð¸ÑÑ‚Ð¾Ð²ÑƒÐ²Ð°Ñ‚Ð¸:** Ð”Ð»Ñ Ð²Ð¸Ñ€Ð°Ð¶ÐµÐ½Ð½Ñ Ð·Ð°Ð³Ð°Ð»ÑŒÐ½Ð¸Ñ… Ñ–ÑÑ‚Ð¸Ð½, Ð·Ð²Ð¸Ñ‡Ð¾Ðº, Ð·Ð°ÐºÐ¾Ð½Ñ–Ð² Ð¿Ñ€Ð¸Ñ€Ð¾Ð´Ð¸, Ð¿Ð¾ÑÑ‚Ñ–Ð¹Ð½Ð¸Ñ… Ð·Ð²'ÑÐ·ÐºÑ–Ð².\n\n#### Ð¡Ñ…ÐµÐ¼Ð° 2: ÐœÐ°Ð¹Ð±ÑƒÑ‚Ð½Ñ–Ð¹ + Ð¼Ð°Ð¹Ð±ÑƒÑ‚Ð½Ñ–Ð¹ (ÐºÐ¾Ð½ÐºÑ€ÐµÑ‚Ð½Ð° ÑÐ¸Ñ‚ÑƒÐ°Ñ†Ñ–Ñ)\n\n| Ð£Ð¼Ð¾Ð²Ð° | ÐÐ°ÑÐ»Ñ–Ð´Ð¾Ðº | Ð—Ð½Ð°Ñ‡ÐµÐ½Ð½Ñ |\n|-------|----------|----------|\n| Ð¯ÐºÑ‰Ð¾ **Ð±ÑƒÐ´Ðµ** Ð´Ð¾Ñ‰ | Ñ **Ð²Ñ–Ð·ÑŒÐ¼Ñƒ** Ð¿Ð°Ñ€Ð°ÑÐ¾Ð»ÑŒÐºÑƒ | Ð¿Ð»Ð°Ð½ Ð½Ð° Ð¼Ð°Ð¹Ð±ÑƒÑ‚Ð½Ñ” |\n| Ð¯ÐºÑ‰Ð¾ Ð²Ñ–Ð½ **Ð¿Ñ€Ð¸Ð¹Ð´Ðµ** | Ð¼Ð¸ **Ð¿Ð¾Ð³Ð¾Ð²Ð¾Ñ€Ð¸Ð¼Ð¾** | Ð¼Ð¾Ð¶Ð»Ð¸Ð²Ð° Ð¿Ð¾Ð´Ñ–Ñ |\n| Ð¯ÐºÑ‰Ð¾ Ñ‚Ð¸ **Ð´Ð¾Ð¿Ð¾Ð¼Ð¾Ð¶ÐµÑˆ** | Ð¼Ð¸ **Ð·Ð°ÐºÑ–Ð½Ñ‡Ð¸Ð¼Ð¾** ÑˆÐ²Ð¸Ð´ÑˆÐµ | ÑƒÐ¼Ð¾Ð²Ð½Ð° Ð¾Ð±Ñ–Ñ†ÑÐ½ÐºÐ° |\n| Ð¯ÐºÑ‰Ð¾ **Ð²ÑÑ‚Ð¸Ð³Ð½Ñƒ** | Ñ **Ð·Ð°Ñ‚ÐµÐ»ÐµÑ„Ð¾Ð½ÑƒÑŽ** | Ð½ÐµÐ²Ð¸Ð·Ð½Ð°Ñ‡ÐµÐ½Ð° ÑƒÐ¼Ð¾Ð²Ð° |\n\n**ÐšÐ¾Ð»Ð¸ Ð²Ð¸ÐºÐ¾Ñ€Ð¸ÑÑ‚Ð¾Ð²ÑƒÐ²Ð°Ñ‚Ð¸:** Ð”Ð»Ñ ÐºÐ¾Ð½ÐºÑ€ÐµÑ‚Ð½Ð¸Ñ… Ð¿Ð»Ð°Ð½Ñ–Ð², Ð¿ÐµÑ€ÐµÐ´Ð±Ð°Ñ‡ÐµÐ½ÑŒ, Ð¾Ð±Ñ–Ñ†ÑÐ½Ð¾Ðº Ð½Ð° Ð¼Ð°Ð¹Ð±ÑƒÑ‚Ð½Ñ”.\n\n#### Ð¡Ñ…ÐµÐ¼Ð° 3: Ð¢ÐµÐ¿ÐµÑ€Ñ–ÑˆÐ½Ñ–Ð¹ + Ð¼Ð°Ð¹Ð±ÑƒÑ‚Ð½Ñ–Ð¹ (Ð·Ð¼Ñ–ÑˆÐ°Ð½Ð° ÑÑ…ÐµÐ¼Ð°)\n\n| Ð£Ð¼Ð¾Ð²Ð° | ÐÐ°ÑÐ»Ñ–Ð´Ð¾Ðº | Ð—Ð½Ð°Ñ‡ÐµÐ½Ð½Ñ |\n|-------|----------|----------|\n| Ð¯ÐºÑ‰Ð¾ Ñ‚Ð¸ **Ð³Ð¾Ñ‚Ð¾Ð²Ð¸Ð¹** | Ð¼Ð¸ **Ð¼Ð¾Ð¶ÐµÐ¼Ð¾ Ð¿Ñ–Ñ‚Ð¸** | ÑÑ‚Ð°Ð½ â†’ Ð´Ñ–Ñ |\n| Ð¯ÐºÑ‰Ð¾ Ñ‚Ð¸ **Ð²Ñ–Ð»ÑŒÐ½Ð¸Ð¹** | Ð¼Ð¸ **Ð¿Ð¾Ð³Ð¾Ð²Ð¾Ñ€Ð¸Ð¼Ð¾** | ÑÑ‚Ð°Ð½ â†’ Ð¿Ð»Ð°Ð½ |\n| Ð¯ÐºÑ‰Ð¾ Ñ†Ðµ **Ð¿Ñ€Ð°Ð²Ð´Ð°** | Ñ **Ð·Ð´Ð¸Ð²ÑƒÑŽÑÑ** | Ñ„Ð°ÐºÑ‚ â†’ Ñ€ÐµÐ°ÐºÑ†Ñ–Ñ |\n| Ð¯ÐºÑ‰Ð¾ Ð²Ð¸ **Ð¿Ð¾Ð³Ð¾Ð´Ð¶ÑƒÑ”Ñ‚ÐµÑÑŒ** | Ð¼Ð¸ **Ð¿Ñ–Ð´Ð¿Ð¸ÑˆÐµÐ¼Ð¾** | Ñ€Ñ–ÑˆÐµÐ½Ð½Ñ â†’ Ð´Ñ–Ñ |\n\n**ÐšÐ¾Ð»Ð¸ Ð²Ð¸ÐºÐ¾Ñ€Ð¸ÑÑ‚Ð¾Ð²ÑƒÐ²Ð°Ñ‚Ð¸:** ÐšÐ¾Ð»Ð¸ ÑƒÐ¼Ð¾Ð²Ð° â€” Ñ†Ðµ ÑÑ‚Ð°Ð½ Ð°Ð±Ð¾ Ñ„Ð°ÐºÑ‚, Ð° Ð½Ð°ÑÐ»Ñ–Ð´Ð¾Ðº â€” Ð´Ñ–Ñ Ð² Ð¼Ð°Ð¹Ð±ÑƒÑ‚Ð½ÑŒÐ¾Ð¼Ñƒ.\n\n> ðŸŒ **Ð£ Ñ€ÐµÐ°Ð»ÑŒÐ½Ð¾Ð¼Ñƒ ÑÐ²Ñ–Ñ‚Ñ–**\n> Ð£ Ð´Ñ–Ð»Ð¾Ð²Ð¾Ð¼Ñƒ Ð»Ð¸ÑÑ‚ÑƒÐ²Ð°Ð½Ð½Ñ– Ñ€ÐµÐ°Ð»ÑŒÐ½Ñ– ÑƒÐ¼Ð¾Ð²Ð¸ Ð´ÑƒÐ¶Ðµ Ð¿Ð¾ÑˆÐ¸Ñ€ÐµÐ½Ñ–: Â«Ð¯ÐºÑ‰Ð¾ Ð’Ð¸ Ð¿Ð¾Ð³Ð¾Ð´Ð¶ÑƒÑ”Ñ‚ÐµÑÑŒ Ñ–Ð· ÑƒÐ¼Ð¾Ð²Ð°Ð¼Ð¸ ÐºÐ¾Ð½Ñ‚Ñ€Ð°ÐºÑ‚Ñƒ, Ð¿Ñ€Ð¾ÑÐ¸Ð¼Ð¾ Ð½Ð°Ð´Ñ–ÑÐ»Ð°Ñ‚Ð¸ Ð¿Ñ–Ð´Ð¿Ð¸ÑÐ°Ð½Ð¸Ð¹ Ð¿Ñ€Ð¸Ð¼Ñ–Ñ€Ð½Ð¸Ðº Ð´Ð¾ Ð¿'ÑÑ‚Ð½Ð¸Ñ†Ñ–Â», Â«Ð¯ÐºÑ‰Ð¾ Ð²Ð¸Ð½Ð¸ÐºÐ½ÑƒÑ‚ÑŒ Ð·Ð°Ð¿Ð¸Ñ‚Ð°Ð½Ð½Ñ, Ð±ÑƒÐ´ÑŒ Ð»Ð°ÑÐºÐ°, Ð·Ð²'ÑÐ¶Ñ–Ñ‚ÑŒÑÑ Ð· Ð½Ð°ÑˆÐ¸Ð¼ Ð²Ñ–Ð´Ð´Ñ–Ð»Ð¾Ð¼ Ð¿Ñ–Ð´Ñ‚Ñ€Ð¸Ð¼ÐºÐ¸Â». Ð—Ð²ÐµÑ€Ð½Ñ–Ñ‚ÑŒ ÑƒÐ²Ð°Ð³Ñƒ Ð½Ð° Ð²Ð²Ñ–Ñ‡Ð»Ð¸Ð²Ñƒ Ñ„Ð¾Ñ€Ð¼Ñƒ Â«Ð’Ð¸Â» Ð· Ð²ÐµÐ»Ð¸ÐºÐ¾Ñ— Ð»Ñ–Ñ‚ÐµÑ€Ð¸ Ñ‚Ð° Ñ„Ð¾Ñ€Ð¼Ð°Ð»ÑŒÐ½Ð¸Ð¹ ÑÑ‚Ð¸Ð»ÑŒ.\n\n### ÐÐ»ÑŒÑ‚ÐµÑ€Ð½Ð°Ñ‚Ð¸Ð²Ð½Ñ– ÑÐ¿Ð¾Ð»ÑƒÑ‡Ð½Ð¸ÐºÐ¸\n\nÐšÑ€Ñ–Ð¼ Â«ÑÐºÑ‰Ð¾Â», Ñ” Ñ–Ð½ÑˆÑ– ÑÐ¿Ð¾ÑÐ¾Ð±Ð¸ Ð²Ð¸Ñ€Ð°Ð·Ð¸Ñ‚Ð¸ ÑƒÐ¼Ð¾Ð²Ñƒ:\n\n| Ð¡Ð¿Ð¾Ð»ÑƒÑ‡Ð½Ð¸Ðº | Ð—Ð½Ð°Ñ‡ÐµÐ½Ð½Ñ | ÐŸÑ€Ð¸ÐºÐ»Ð°Ð´ |\n|-----------|----------|---------|\n| **ÑÐºÑ‰Ð¾** | if (Ð½ÐµÐ¹Ñ‚Ñ€Ð°Ð»ÑŒÐ½Ð¸Ð¹) | Ð¯ÐºÑ‰Ð¾ Ñ…Ð¾Ñ‡ÐµÑˆ, Ð´Ð¾Ð¿Ð¾Ð¼Ð¾Ð¶Ñƒ. |\n| **ÐºÐ¾Ð»Ð¸** | when/if (Ñ‡Ð°ÑÐ¾Ð²Ð¸Ð¹ Ð²Ñ–Ð´Ñ‚Ñ–Ð½Ð¾Ðº) | ÐšÐ¾Ð»Ð¸ Ð¼Ð°Ñ‚Ð¸Ð¼ÐµÑˆ Ñ‡Ð°Ñ, Ð·Ð°Ñ‚ÐµÐ»ÐµÑ„Ð¾Ð½ÑƒÐ¹. |\n| **Ñƒ Ð²Ð¸Ð¿Ð°Ð´ÐºÑƒ ÑÐºÑ‰Ð¾** | in case | Ð£ Ð²Ð¸Ð¿Ð°Ð´ÐºÑƒ ÑÐºÑ‰Ð¾ Ð·Ð°Ð±ÑƒÐ´ÐµÑˆ, Ð½Ð°Ð³Ð°Ð´Ð°ÑŽ. |\n| **Ð·Ð° ÑƒÐ¼Ð¾Ð²Ð¸ Ñ‰Ð¾** | provided that | Ð—Ð° ÑƒÐ¼Ð¾Ð²Ð¸ Ñ‰Ð¾ Ð²ÑÑ– Ð¿Ð¾Ð³Ð¾Ð´ÑÑ‚ÑŒÑÑ, Ð¿Ð¾Ñ‡Ð½ÐµÐ¼Ð¾. |\n| **Ð¿Ñ€Ð¸ ÑƒÐ¼Ð¾Ð²Ñ– Ñ‰Ð¾** | on condition that | ÐŸÑ€Ð¸ ÑƒÐ¼Ð¾Ð²Ñ– Ñ‰Ð¾ Ð¾Ð¿Ð»Ð°Ñ‚Ð¸Ñ‚Ðµ, Ð´Ð¾ÑÑ‚Ð°Ð²Ð¸Ð¼Ð¾. |\n| **Ñƒ Ñ€Ð°Ð·Ñ– ÑÐºÑ‰Ð¾** | in the event that | Ð£ Ñ€Ð°Ð·Ñ– ÑÐºÑ‰Ð¾ Ð½Ðµ Ð²ÑÑ‚Ð¸Ð³Ð½ÐµÐ¼Ð¾, Ð¿Ð¾Ð²Ñ–Ð´Ð¾Ð¼Ð¸Ð¼Ð¾. |\n\n> âš ï¸ **Ð’Ð°Ð¶Ð»Ð¸Ð²Ð¸Ð¹ Ð½ÑŽÐ°Ð½Ñ**\n> ÐšÐ¾Ð»Ð¸ Â«ÐºÐ¾Ð»Ð¸Â» Ð²Ð¶Ð¸Ð²Ð°Ñ”Ñ‚ÑŒÑÑ Ð·Ð°Ð¼Ñ–ÑÑ‚ÑŒ Â«ÑÐºÑ‰Ð¾Â», Ð²Ð¾Ð½Ð¾ Ð½Ð°Ð±ÑƒÐ²Ð°Ñ” ÑƒÐ¼Ð¾Ð²Ð½Ð¾Ð³Ð¾ Ð·Ð½Ð°Ñ‡ÐµÐ½Ð½Ñ: Â«ÐšÐ¾Ð»Ð¸ Ð¼Ð°Ñ‚Ð¸Ð¼ÐµÑˆ Ñ‡Ð°Ñ, Ð·Ð°Ñ‚ÐµÐ»ÐµÑ„Ð¾Ð½ÑƒÐ¹Â» = Â«Ð¯ÐºÑ‰Ð¾ Ð¼Ð°Ñ‚Ð¸Ð¼ÐµÑˆ Ñ‡Ð°Ñ...Â». Ð£ Ñ†ÑŒÐ¾Ð¼Ñƒ Ð²Ð¸Ð¿Ð°Ð´ÐºÑƒ Â«ÐºÐ¾Ð»Ð¸Â» Ð½Ðµ Ð¾Ð·Ð½Ð°Ñ‡Ð°Ñ” ÐºÐ¾Ð½ÐºÑ€ÐµÑ‚Ð½Ð¸Ð¹ Ð¼Ð¾Ð¼ÐµÐ½Ñ‚ Ñ‡Ð°ÑÑƒ, Ð° Ð¼Ð¾Ð¶Ð»Ð¸Ð²Ñƒ ÑƒÐ¼Ð¾Ð²Ñƒ.\n\n### Ð—Ð°Ð¿ÐµÑ€ÐµÑ‡ÐµÐ½Ð½Ñ Ð² ÑƒÐ¼Ð¾Ð²Ð½Ð¸Ñ… Ñ€ÐµÑ‡ÐµÐ½Ð½ÑÑ…\n\nÐ—Ð°Ð¿ÐµÑ€ÐµÑ‡ÐµÐ½Ð½Ñ Ð¼Ð¾Ð¶Ðµ Ð±ÑƒÑ‚Ð¸ Ð² ÑƒÐ¼Ð¾Ð²Ñ–, Ð½Ð°ÑÐ»Ñ–Ð´ÐºÑƒ Ð°Ð±Ð¾ Ð¾Ð±Ð¾Ñ… Ñ‡Ð°ÑÑ‚Ð¸Ð½Ð°Ñ…:\n\n**Ð—Ð°Ð¿ÐµÑ€ÐµÑ‡ÐµÐ½Ð½Ñ Ð² ÑƒÐ¼Ð¾Ð²Ñ–:**\n- Ð¯ÐºÑ‰Ð¾ Ñ‚Ð¸ **Ð½Ðµ** Ñ…Ð¾Ñ‡ÐµÑˆ, Ñ Ð½Ðµ Ð±ÑƒÐ´Ñƒ Ð½Ð°Ð¿Ð¾Ð»ÑÐ³Ð°Ñ‚Ð¸ Ð²Ð·Ð°Ð³Ð°Ð»Ñ–.\n- Ð¯ÐºÑ‰Ð¾ Ñƒ Ð½Ð°Ñ **Ð½Ðµ Ð±ÑƒÐ´Ðµ** Ñ‡Ð°ÑÑƒ, Ð¼Ð¸ Ð¿ÐµÑ€ÐµÐ½ÐµÑÐµÐ¼Ð¾ Ð·ÑƒÑÑ‚Ñ€Ñ–Ñ‡ Ð½Ð° Ð¿Ñ–Ð·Ð½Ñ–ÑˆÐµ.\n\n**Ð—Ð°Ð¿ÐµÑ€ÐµÑ‡ÐµÐ½Ð½Ñ Ð² Ð½Ð°ÑÐ»Ñ–Ð´ÐºÑƒ:**\n- Ð¯ÐºÑ‰Ð¾ Ð²Ñ–Ð½ Ð·Ð°Ð¿Ñ–Ð·Ð½Ð¸Ñ‚ÑŒÑÑ, Ð¼Ð¸ **Ð½Ðµ** Ñ‡ÐµÐºÐ°Ñ‚Ð¸Ð¼ÐµÐ¼Ð¾ Ð½Ð° Ð½ÑŒÐ¾Ð³Ð¾.\n- Ð¯ÐºÑ‰Ð¾ Ð¿Ð¾Ð³Ð¾Ð´Ð° Ð±ÑƒÐ´Ðµ Ð¿Ð¾Ð³Ð°Ð½Ð¾ÑŽ, Ð¼Ð¸ **Ð½Ðµ** Ð¿Ñ–Ð´ÐµÐ¼Ð¾ Ð½Ñ–ÐºÑƒÐ´Ð¸.\n\n**Ð—Ð°Ð¿ÐµÑ€ÐµÑ‡ÐµÐ½Ð½Ñ Ð² Ð¾Ð±Ð¾Ñ… Ñ‡Ð°ÑÑ‚Ð¸Ð½Ð°Ñ…:**\n- Ð¯ÐºÑ‰Ð¾ Ñ‚Ð¸ **Ð½Ðµ** Ð·Ð°Ñ‚ÐµÐ»ÐµÑ„Ð¾Ð½ÑƒÑ”Ñˆ, Ñ **Ð½Ðµ** Ð±ÑƒÐ´Ñƒ Ð·Ð½Ð°Ñ‚Ð¸ Ñ‚Ð²Ð¾Ñ—Ñ… Ð¿Ð»Ð°Ð½Ñ–Ð².\n- Ð¯ÐºÑ‰Ð¾ Ð²Ð¾Ð½Ð° **Ð½Ðµ** Ð¿Ð¾Ð³Ð¾Ð´Ð¸Ñ‚ÑŒÑÑ, Ð¼Ð¸ **Ð½Ðµ** Ð·Ð¼Ð¾Ð¶ÐµÐ¼Ð¾ Ð¿Ñ€Ð¾Ð´Ð¾Ð²Ð¶ÑƒÐ²Ð°Ñ‚Ð¸ Ð¿Ñ€Ð¾Ñ”ÐºÑ‚.\n\n> ðŸŽ¬ **ÐšÑƒÐ»ÑŒÑ‚ÑƒÑ€Ð½Ð¸Ð¹ Ð¼Ð¾Ð¼ÐµÐ½Ñ‚**\n> Ð£ ÐºÑƒÐ»ÑŒÑ‚Ð¾Ð²Ð¾Ð¼Ñƒ ÑƒÐºÑ€Ð°Ñ—Ð½ÑÑŒÐºÐ¾Ð¼Ñƒ Ñ„Ñ–Ð»ÑŒÐ¼Ñ– Â«ÐŸÑ€Ð¾Ð¿Ð°Ð»Ð° Ð³Ñ€Ð°Ð¼Ð¾Ñ‚Ð°Â» Ð³ÐµÑ€Ð¾Ñ— Ñ‡Ð°ÑÑ‚Ð¾ ÐºÐ°Ð¶ÑƒÑ‚ÑŒ: Â«Ð¯ÐºÑ‰Ð¾ Ð½Ðµ Ð¿Ð¾Ð²ÐµÑ€Ð½ÐµÑˆ Ð³Ñ€Ð°Ð¼Ð¾Ñ‚Ñƒ, Ð³Ð¾Ð»Ð¾Ð²Ñƒ Ð²Ñ‚Ñ€Ð°Ñ‚Ð¸Ñˆ!Â» Ð¦Ðµ Ð¿Ð¾ÐºÐ°Ð·ÑƒÑ”, ÑÐº ÑƒÐ¼Ð¾Ð²Ð½Ñ– Ñ€ÐµÑ‡ÐµÐ½Ð½Ñ Ð²Ð¸ÐºÐ¾Ñ€Ð¸ÑÑ‚Ð¾Ð²ÑƒÑŽÑ‚ÑŒÑÑ Ð´Ð»Ñ Ð¿Ð¾Ð¿ÐµÑ€ÐµÐ´Ð¶ÐµÐ½ÑŒ Ñ– Ð·Ð°Ð³Ñ€Ð¾Ð· Ñƒ Ñ‚Ñ€Ð°Ð´Ð¸Ñ†Ñ–Ð¹Ð½Ñ–Ð¹ ÑƒÐºÑ€Ð°Ñ—Ð½ÑÑŒÐºÑ–Ð¹ Ð¼Ð¾Ð²Ñ–. Ð—Ð²ÐµÑ€Ð½Ñ–Ñ‚ÑŒ ÑƒÐ²Ð°Ð³Ñƒ Ð½Ð° Ð´Ð¾ÐºÐ¾Ð½Ð°Ð½Ð¸Ð¹ Ð²Ð¸Ð´ Ð´Ð»Ñ ÐºÐ¾Ð½ÐºÑ€ÐµÑ‚Ð½Ð¾Ð³Ð¾ Ñ€ÐµÐ·ÑƒÐ»ÑŒÑ‚Ð°Ñ‚Ñƒ.\n\n### ÐŸÑƒÐ½ÐºÑ‚ÑƒÐ°Ñ†Ñ–Ñ Ð² ÑƒÐ¼Ð¾Ð²Ð½Ð¸Ñ… Ñ€ÐµÑ‡ÐµÐ½Ð½ÑÑ…\n\n**ÐŸÑ€Ð°Ð²Ð¸Ð»Ð° Ð²Ð¸ÐºÐ¾Ñ€Ð¸ÑÑ‚Ð°Ð½Ð½Ñ ÐºÐ¾Ð¼Ð¸:**\n\n1. **ÐšÐ¾Ð¼Ð° Ð¿ÐµÑ€ÐµÐ´ Â«ÑÐºÑ‰Ð¾Â»**, ÑÐºÑ‰Ð¾ Ð¿Ñ–Ð´Ñ€ÑÐ´Ð½Ðµ Ñ€ÐµÑ‡ÐµÐ½Ð½Ñ Ð¹Ð´Ðµ Ð´Ñ€ÑƒÐ³Ð¸Ð¼:\n   - ÐœÐ¸ Ð¿Ñ–Ð´ÐµÐ¼Ð¾ Ð½Ð° Ð¿Ñ€Ð¾Ð³ÑƒÐ»ÑÐ½ÐºÑƒ**,** ÑÐºÑ‰Ð¾ Ð±ÑƒÐ´Ðµ Ð³Ð°Ñ€Ð½Ð° Ð¿Ð¾Ð³Ð¾Ð´Ð°.\n\n2. **ÐšÐ¾Ð¼Ð° Ð¿Ñ–ÑÐ»Ñ Ð¿Ñ–Ð´Ñ€ÑÐ´Ð½Ð¾Ð³Ð¾ Ñ€ÐµÑ‡ÐµÐ½Ð½Ñ Ð· Â«ÑÐºÑ‰Ð¾Â»**, ÑÐºÑ‰Ð¾ Ð²Ð¾Ð½Ð¾ Ð¹Ð´Ðµ Ð¿ÐµÑ€ÑˆÐ¸Ð¼:\n   - Ð¯ÐºÑ‰Ð¾ Ð±ÑƒÐ´Ðµ Ð³Ð°Ñ€Ð½Ð° Ð¿Ð¾Ð³Ð¾Ð´Ð°**,** Ð¼Ð¸ Ð¿Ñ–Ð´ÐµÐ¼Ð¾ Ð½Ð° Ð¿Ñ€Ð¾Ð³ÑƒÐ»ÑÐ½ÐºÑƒ.\n\n3. **Ð‘ÐµÐ· ÐºÐ¾Ð¼Ð¸**, ÑÐºÑ‰Ð¾ Ñ€ÐµÑ‡ÐµÐ½Ð½Ñ Ð´ÑƒÐ¶Ðµ ÐºÐ¾Ñ€Ð¾Ñ‚ÐºÐµ Ð¹ Ñ‚Ñ–ÑÐ½Ð¾ Ð¿Ð¾Ð²'ÑÐ·Ð°Ð½Ðµ:\n   - Ð¯ÐºÑ‰Ð¾ Ñ…Ð¾Ñ‡ÐµÑˆ â€” Ð´Ð¾Ð¿Ð¾Ð¼Ð¾Ð¶Ñƒ. (Ñ€Ð¾Ð·Ð¼Ð¾Ð²Ð½Ð¸Ð¹ ÑÑ‚Ð¸Ð»ÑŒ, Ñ‚Ð¸Ñ€Ðµ Ð·Ð°Ð¼Ñ–ÑÑ‚ÑŒ ÐºÐ¾Ð¼Ð¸)\n\n> ðŸŽ¯ **Ð¦Ñ–ÐºÐ°Ð²Ð¸Ð¹ Ñ„Ð°ÐºÑ‚**\n> Ð£ÐºÑ€Ð°Ñ—Ð½ÑÑŒÐºÑ– Ð¿Ñ€Ð¸ÑÐ»Ñ–Ð²'Ñ Ñ‡Ð°ÑÑ‚Ð¾ Ð²Ð¸ÐºÐ¾Ñ€Ð¸ÑÑ‚Ð¾Ð²ÑƒÑŽÑ‚ÑŒ ÑƒÐ¼Ð¾Ð²Ð½Ñ– Ñ€ÐµÑ‡ÐµÐ½Ð½Ñ: Â«Ð¯ÐºÑ‰Ð¾ Ñ€Ð°Ð´Ñ–ÑÑ‚ÑŒ Ð½Ð° Ð´Ð²Ð¾Ñ…, Ñ€Ð°Ð´Ñ–ÑÑ‚ÑŒ Ð¿Ð¾Ð´Ð²Ñ–Ð¹Ð½Ð°Â» â€” Ñ†Ðµ Ð¿Ð¾ÐºÐ°Ð·ÑƒÑ” Ð½Ð°Ñ€Ð¾Ð´Ð½Ñƒ Ð¼ÑƒÐ´Ñ€Ñ–ÑÑ‚ÑŒ Ð¿Ñ€Ð¾ ÑÐ¿Ñ–Ð»ÑŒÐ½Ðµ Ñ‰Ð°ÑÑ‚Ñ. Â«Ð¯ÐºÑ‰Ð¾ Ð³Ð¾Ñ€Ð¸ Ð½Ðµ Ð¹Ð´ÑƒÑ‚ÑŒ Ð´Ð¾ ÐœÐ°Ð³Ð¾Ð¼ÐµÑ‚Ð°, ÐœÐ°Ð³Ð¾Ð¼ÐµÑ‚ Ñ–Ð´Ðµ Ð´Ð¾ Ð³Ñ–Ñ€Â» â€” Ð°Ð´Ð°Ð¿Ñ‚Ð¾Ð²Ð°Ð½Ðµ Ð°Ñ€Ð°Ð±ÑÑŒÐºÐµ Ð¿Ñ€Ð¸ÑÐ»Ñ–Ð²'Ñ, Ð¿Ð¾Ð¿ÑƒÐ»ÑÑ€Ð½Ðµ Ð² Ð£ÐºÑ€Ð°Ñ—Ð½Ñ–. Ð’Ð¸Ð²Ñ‡Ð°Ð¹Ñ‚Ðµ Ð³Ñ€Ð°Ð¼Ð°Ñ‚Ð¸ÐºÑƒ Ñ‡ÐµÑ€ÐµÐ· Ð½Ð°Ñ€Ð¾Ð´Ð½Ñƒ Ð¼ÑƒÐ´Ñ€Ñ–ÑÑ‚ÑŒ!\n\n### ÐÑÐ¿ÐµÐºÑ‚ Ñƒ Ñ€ÐµÐ°Ð»ÑŒÐ½Ð¸Ñ… ÑƒÐ¼Ð¾Ð²Ð°Ñ…\n\nÐ’Ð¸Ð±Ñ–Ñ€ Ð²Ð¸Ð´Ñƒ Ð´Ñ–Ñ”ÑÐ»Ð¾Ð²Ð° Ð·Ð°Ð»ÐµÐ¶Ð¸Ñ‚ÑŒ Ð²Ñ–Ð´ Ð·Ð½Ð°Ñ‡ÐµÐ½Ð½Ñ:\n\n**Ð”Ð¾ÐºÐ¾Ð½Ð°Ð½Ð¸Ð¹ Ð²Ð¸Ð´** â€” Ð¾Ð´Ð½Ð¾Ñ€Ð°Ð·Ð¾Ð²Ð°, ÐºÐ¾Ð½ÐºÑ€ÐµÑ‚Ð½Ð° Ð´Ñ–Ñ:\n- Ð¯ÐºÑ‰Ð¾ Ð²Ñ–Ð½ **Ð¿Ñ€Ð¸Ð¹Ð´Ðµ**, Ð¼Ð¸ **Ð¿Ð¾Ð³Ð¾Ð²Ð¾Ñ€Ð¸Ð¼Ð¾**. (Ð¾Ð´Ð½Ð° Ð·ÑƒÑÑ‚Ñ€Ñ–Ñ‡)\n- Ð¯ÐºÑ‰Ð¾ Ñ‚Ð¸ **Ð·Ð°ÐºÑ–Ð½Ñ‡Ð¸Ñˆ**, **Ð¿Ð¾ÐºÐ°Ð¶ÐµÑˆ** Ð¼ÐµÐ½Ñ–. (Ð¾Ð´Ð¸Ð½ Ñ€ÐµÐ·ÑƒÐ»ÑŒÑ‚Ð°Ñ‚)\n\n**ÐÐµÐ´Ð¾ÐºÐ¾Ð½Ð°Ð½Ð¸Ð¹ Ð²Ð¸Ð´** â€” Ð¿Ñ€Ð¾Ñ†ÐµÑ Ð°Ð±Ð¾ Ð¿Ð¾Ð²Ñ‚Ð¾Ñ€ÐµÐ½Ð½Ñ:\n- Ð¯ÐºÑ‰Ð¾ Ð²Ñ–Ð½ **Ð¿Ñ€Ð¸Ñ…Ð¾Ð´Ð¸Ñ‚Ð¸Ð¼Ðµ** Ñ‰Ð¾Ð´Ð½Ñ, Ð¼Ð¸ **Ñ€Ð¾Ð·Ð¼Ð¾Ð²Ð»ÑÑ‚Ð¸Ð¼ÐµÐ¼Ð¾**. (Ñ€ÐµÐ³ÑƒÐ»ÑÑ€Ð½Ð¾)\n- Ð¯ÐºÑ‰Ð¾ Ñ‚Ð¸ **Ð¿Ñ€Ð°Ñ†ÑŽÐ²Ð°Ñ‚Ð¸Ð¼ÐµÑˆ** ÑÑ‚Ð°Ñ€Ð°Ð½Ð½Ð¾, **Ð´Ð¾ÑÑÐ³Ð°Ñ‚Ð¸Ð¼ÐµÑˆ** ÑƒÑÐ¿Ñ–Ñ…Ñƒ. (Ð·Ð°Ð³Ð°Ð»ÑŒÐ½Ð° Ñ–ÑÑ‚Ð¸Ð½Ð°)\n\n> ðŸ‡ºðŸ‡¦ **Ð£ÐºÑ€Ð°Ñ—Ð½ÑÑŒÐºÐ° ÐºÑƒÐ»ÑŒÑ‚ÑƒÑ€Ð°**\n> Ð£ Ñ‚Ñ€Ð°Ð´Ð¸Ñ†Ñ–Ð¹Ð½Ð¸Ñ… Ð½Ð°Ñ€Ð¾Ð´Ð½Ð¸Ñ… Ð¿Ñ–ÑÐ½ÑÑ… Ñ‡Ð°ÑÑ‚Ð¾ Ð·ÑƒÑÑ‚Ñ€Ñ–Ñ‡Ð°ÑŽÑ‚ÑŒÑÑ ÑƒÐ¼Ð¾Ð²Ð½Ñ– Ñ€ÐµÑ‡ÐµÐ½Ð½Ñ: Â«Ð¯ÐºÑ‰Ð¾ Ñ Ð¿Ñ–Ð´Ñƒ Ð·Ð° Ñ‚ÐµÐ±Ðµ, Ñ…Ñ‚Ð¾ Ð¼Ð°Ñ‚Ñ–Ñ€ Ð´Ð¾Ð³Ð»ÑÐ´Ð°Ñ‚Ð¸Ð¼Ðµ?Â» Ð¦Ðµ Ð²Ñ–Ð´Ð¾Ð±Ñ€Ð°Ð¶Ð°Ñ” Ð²Ð°Ð¶Ð»Ð¸Ð²Ñ–ÑÑ‚ÑŒ Ñ€Ð¾Ð´Ð¸Ð½Ð½Ð¸Ñ… Ñ†Ñ–Ð½Ð½Ð¾ÑÑ‚ÐµÐ¹ Ð² ÑƒÐºÑ€Ð°Ñ—Ð½ÑÑŒÐºÑ–Ð¹ ÐºÑƒÐ»ÑŒÑ‚ÑƒÑ€Ñ–. Ð—Ð²ÐµÑ€Ð½Ñ–Ñ‚ÑŒ ÑƒÐ²Ð°Ð³Ñƒ Ð½Ð° Ð²Ð¸ÐºÐ¾Ñ€Ð¸ÑÑ‚Ð°Ð½Ð½Ñ Ð¼Ð°Ð¹Ð±ÑƒÑ‚Ð½ÑŒÐ¾Ð³Ð¾ Ñ‡Ð°ÑÑƒ Ð² Ð¾Ð±Ð¾Ñ… Ñ‡Ð°ÑÑ‚Ð¸Ð½Ð°Ñ… Ñ€ÐµÑ‡ÐµÐ½Ð½Ñ!\n\n---\n\n## ÐŸÑ€Ð°ÐºÑ‚Ð¸ÐºÐ°\n\n### Ð¯Ðº Ð¿Ð¾Ð±ÑƒÐ´ÑƒÐ²Ð°Ñ‚Ð¸ ÑƒÐ¼Ð¾Ð²Ð½Ðµ Ñ€ÐµÑ‡ÐµÐ½Ð½Ñ?\n\nÐ—Ð°Ð´Ð°Ð¹Ñ‚Ðµ ÑÐ¾Ð±Ñ– Ñ†Ñ– Ð¿Ð¸Ñ‚Ð°Ð½Ð½Ñ:\n\n1. **Ð§Ð¸ Ñ†Ðµ Ñ€ÐµÐ°Ð»ÑŒÐ½Ð° Ð¼Ð¾Ð¶Ð»Ð¸Ð²Ñ–ÑÑ‚ÑŒ?**\n   - Ð¢Ð°Ðº â†’ Ñ€ÐµÐ°Ð»ÑŒÐ½Ð° ÑƒÐ¼Ð¾Ð²Ð° (ÑÐºÑ‰Ð¾)\n   - ÐÑ–, Ñ†Ðµ Ð½ÐµÑ€ÐµÐ°Ð»ÑŒÐ½Ð¾ â†’ Ð½ÐµÑ€ÐµÐ°Ð»ÑŒÐ½Ð° ÑƒÐ¼Ð¾Ð²Ð° (ÑÐºÐ±Ð¸ â€” Ð½Ð°ÑÑ‚ÑƒÐ¿Ð½Ð¸Ð¹ Ð¼Ð¾Ð´ÑƒÐ»ÑŒ)\n\n2. **Ð¦Ðµ Ð·Ð°Ð³Ð°Ð»ÑŒÐ½Ð° Ñ–ÑÑ‚Ð¸Ð½Ð° Ñ‡Ð¸ ÐºÐ¾Ð½ÐºÑ€ÐµÑ‚Ð½Ð° ÑÐ¸Ñ‚ÑƒÐ°Ñ†Ñ–Ñ?**\n   - Ð—Ð°Ð³Ð°Ð»ÑŒÐ½Ð° Ñ–ÑÑ‚Ð¸Ð½Ð° â†’ Ñ‚ÐµÐ¿ÐµÑ€Ñ–ÑˆÐ½Ñ–Ð¹ + Ñ‚ÐµÐ¿ÐµÑ€Ñ–ÑˆÐ½Ñ–Ð¹\n   - ÐšÐ¾Ð½ÐºÑ€ÐµÑ‚Ð½Ð° ÑÐ¸Ñ‚ÑƒÐ°Ñ†Ñ–Ñ â†’ Ð¼Ð°Ð¹Ð±ÑƒÑ‚Ð½Ñ–Ð¹ + Ð¼Ð°Ð¹Ð±ÑƒÑ‚Ð½Ñ–Ð¹\n\n3. **Ð¯ÐºÐ¸Ð¹ Ð°ÑÐ¿ÐµÐºÑ‚ Ð¿Ñ–Ð´Ñ…Ð¾Ð´Ð¸Ñ‚ÑŒ?**\n   - ÐžÐ´Ð½Ð¾Ñ€Ð°Ð·Ð¾Ð²Ð° Ð´Ñ–Ñ â†’ Ð´Ð¾ÐºÐ¾Ð½Ð°Ð½Ð¸Ð¹ Ð²Ð¸Ð´\n   - ÐŸÐ¾Ð²Ñ‚Ð¾Ñ€ÐµÐ½Ð½Ñ Ð°Ð±Ð¾ Ð¿Ñ€Ð¾Ñ†ÐµÑ â†’ Ð½ÐµÐ´Ð¾ÐºÐ¾Ð½Ð°Ð½Ð¸Ð¹ Ð²Ð¸Ð´\n\n### Ð¢Ð¸Ð¿Ð¾Ð²Ñ– Ð¿Ð¾Ð¼Ð¸Ð»ÐºÐ¸ Ñ‚Ð° ÑÐº Ñ—Ñ… ÑƒÐ½Ð¸ÐºÐ½ÑƒÑ‚Ð¸\n\n**ÐŸÐ¾Ð¼Ð¸Ð»ÐºÐ° 1: Ð¢ÐµÐ¿ÐµÑ€Ñ–ÑˆÐ½Ñ–Ð¹ Ñ‡Ð°Ñ Ð·Ð°Ð¼Ñ–ÑÑ‚ÑŒ Ð¼Ð°Ð¹Ð±ÑƒÑ‚Ð½ÑŒÐ¾Ð³Ð¾**\n\nâŒ ÐÐµÐ¿Ñ€Ð°Ð²Ð¸Ð»ÑŒÐ½Ð¾: Ð¯ÐºÑ‰Ð¾ Ð²Ñ–Ð½ **Ð¿Ñ€Ð¸Ð¹Ð´Ðµ**, Ñ **ÐºÐ°Ð¶Ñƒ** Ð¹Ð¾Ð¼Ñƒ Ð¿Ñ€Ð°Ð²Ð´Ñƒ.\nâœ… ÐŸÑ€Ð°Ð²Ð¸Ð»ÑŒÐ½Ð¾: Ð¯ÐºÑ‰Ð¾ Ð²Ñ–Ð½ **Ð¿Ñ€Ð¸Ð¹Ð´Ðµ**, Ñ **ÑÐºÐ°Ð¶Ñƒ** Ð¹Ð¾Ð¼Ñƒ Ð¿Ñ€Ð°Ð²Ð´Ñƒ.\n\n**Ð§Ð¾Ð¼Ñƒ?** Ð’ Ð¾Ð±Ð¾Ñ… Ñ‡Ð°ÑÑ‚Ð¸Ð½Ð°Ñ… Ð¿Ð¾Ñ‚Ñ€Ñ–Ð±ÐµÐ½ Ð¾Ð´Ð½Ð°ÐºÐ¾Ð²Ð¸Ð¹ Ñ‡Ð°ÑÐ¾Ð²Ð¸Ð¹ Ð¿Ð»Ð°Ð½ â€” Ð¼Ð°Ð¹Ð±ÑƒÑ‚Ð½Ñ–Ð¹.\n\n**ÐŸÐ¾Ð¼Ð¸Ð»ÐºÐ° 2: ÐÐµÐ¿Ñ€Ð°Ð²Ð¸Ð»ÑŒÐ½Ð¸Ð¹ ÑÐ¿Ð¾Ð»ÑƒÑ‡Ð½Ð¸Ðº**\n\nâŒ ÐÐµÐ¿Ñ€Ð°Ð²Ð¸Ð»ÑŒÐ½Ð¾: **ÐšÐ¾Ð»Ð¸ Ð±** Ð²Ñ–Ð½ Ð¿Ñ€Ð¸Ð¹ÑˆÐ¾Ð², Ð¼Ð¸ Ð¿Ð¾Ð³Ð¾Ð²Ð¾Ñ€Ð¸Ð»Ð¸ Ð±.\nâœ… ÐŸÑ€Ð°Ð²Ð¸Ð»ÑŒÐ½Ð¾: **Ð¯ÐºÑ‰Ð¾** Ð²Ñ–Ð½ Ð¿Ñ€Ð¸Ð¹Ð´Ðµ, Ð¼Ð¸ Ð¿Ð¾Ð³Ð¾Ð²Ð¾Ñ€Ð¸Ð¼Ð¾.\n\n**Ð§Ð¾Ð¼Ñƒ?** Â«ÐšÐ¾Ð»Ð¸ Ð±Â» Ð²Ð¸ÐºÐ¾Ñ€Ð¸ÑÑ‚Ð¾Ð²ÑƒÑ”Ñ‚ÑŒÑÑ Ð´Ð»Ñ Ð½ÐµÑ€ÐµÐ°Ð»ÑŒÐ½Ð¸Ñ… ÑƒÐ¼Ð¾Ð² (Ð· Â«Ð±Â»). Ð”Ð»Ñ Ñ€ÐµÐ°Ð»ÑŒÐ½Ð¸Ñ… ÑƒÐ¼Ð¾Ð² â€” Â«ÑÐºÑ‰Ð¾Â».\n\n**ÐŸÐ¾Ð¼Ð¸Ð»ÐºÐ° 3: ÐŸÑ€Ð¾Ð¿ÑƒÑÐº ÐºÐ¾Ð¼Ð¸**\n\nâŒ ÐÐµÐ¿Ñ€Ð°Ð²Ð¸Ð»ÑŒÐ½Ð¾: Ð¯ÐºÑ‰Ð¾ Ð¼Ð°Ñ‚Ð¸Ð¼ÐµÑˆ Ñ‡Ð°Ñ Ð·Ð°Ñ‚ÐµÐ»ÐµÑ„Ð¾Ð½ÑƒÐ¹ Ð¼ÐµÐ½Ñ– Ð²Ð²ÐµÑ‡ÐµÑ€Ñ–.\nâœ… ÐŸÑ€Ð°Ð²Ð¸Ð»ÑŒÐ½Ð¾: Ð¯ÐºÑ‰Ð¾ Ð¼Ð°Ñ‚Ð¸Ð¼ÐµÑˆ Ñ‡Ð°Ñ**,** Ð·Ð°Ñ‚ÐµÐ»ÐµÑ„Ð¾Ð½ÑƒÐ¹ Ð¼ÐµÐ½Ñ– Ð²Ð²ÐµÑ‡ÐµÑ€Ñ–.\n\n**Ð§Ð¾Ð¼Ñƒ?** ÐŸÑ–Ð´Ñ€ÑÐ´Ð½Ðµ Ñ€ÐµÑ‡ÐµÐ½Ð½Ñ Ð²Ñ–Ð´Ð´Ñ–Ð»ÑÑ”Ñ‚ÑŒÑÑ ÐºÐ¾Ð¼Ð¾ÑŽ Ð²Ñ–Ð´ Ð³Ð¾Ð»Ð¾Ð²Ð½Ð¾Ð³Ð¾.\n\n**ÐŸÐ¾Ð¼Ð¸Ð»ÐºÐ° 4: ÐÐµÐ¿Ñ€Ð°Ð²Ð¸Ð»ÑŒÐ½Ð¸Ð¹ Ð¿Ð¾Ñ€ÑÐ´Ð¾Ðº ÑÐ»Ñ–Ð²**\n\nâŒ ÐÐµÐ¿Ñ€Ð°Ð²Ð¸Ð»ÑŒÐ½Ð¾: ÐœÐ¸ Ð¿Ñ–Ð´ÐµÐ¼Ð¾ ÑÐºÑ‰Ð¾ Ð±ÑƒÐ´Ðµ Ð¿Ð¾Ð³Ð¾Ð´Ð° Ð³Ð°Ñ€Ð½Ð° Ð½Ð° Ð¿Ñ€Ð¾Ð³ÑƒÐ»ÑÐ½ÐºÑƒ.\nâœ… ÐŸÑ€Ð°Ð²Ð¸Ð»ÑŒÐ½Ð¾: ÐœÐ¸ Ð¿Ñ–Ð´ÐµÐ¼Ð¾ Ð½Ð° Ð¿Ñ€Ð¾Ð³ÑƒÐ»ÑÐ½ÐºÑƒ, ÑÐºÑ‰Ð¾ Ð¿Ð¾Ð³Ð¾Ð´Ð° Ð±ÑƒÐ´Ðµ Ð³Ð°Ñ€Ð½Ð°.\n\n**Ð§Ð¾Ð¼Ñƒ?** ÐŸÑ–Ð´Ñ€ÑÐ´Ð½Ðµ Ñ€ÐµÑ‡ÐµÐ½Ð½Ñ Ð· Â«ÑÐºÑ‰Ð¾Â» Ð¼Ð°Ñ” Ð±ÑƒÑ‚Ð¸ Ð°Ð±Ð¾ Ð½Ð° Ð¿Ð¾Ñ‡Ð°Ñ‚ÐºÑƒ, Ð°Ð±Ð¾ Ð² ÐºÑ–Ð½Ñ†Ñ–, Ð°Ð»Ðµ Ñ†Ñ–Ð»Ðµ.\n\n> ðŸŽ® **Ð†Ð³Ñ€Ð¾Ð²Ð¸Ð¹ Ð¼Ð¾Ð¼ÐµÐ½Ñ‚**\n> Ð£ Ð²Ñ–Ð´ÐµÐ¾Ñ–Ð³Ñ€Ð°Ñ… Ñ‡Ð°ÑÑ‚Ð¾ Ð·ÑƒÑÑ‚Ñ€Ñ–Ñ‡Ð°ÑŽÑ‚ÑŒÑÑ Ð´Ñ–Ð°Ð»Ð¾Ð³Ð¸ Ð· ÑƒÐ¼Ð¾Ð²Ð½Ð¸Ð¼Ð¸ Ñ€ÐµÑ‡ÐµÐ½Ð½ÑÐ¼Ð¸. Ð£ Â«Ð’Ñ–Ð´ÑŒÐ¼Ð°ÐºÑƒ 3Â» NPC Ð¼Ð¾Ð¶Ðµ ÑÐºÐ°Ð·Ð°Ñ‚Ð¸: Â«Ð¯ÐºÑ‰Ð¾ Ð·Ð½Ð°Ð¹Ð´ÐµÑˆ Ð¼Ð¾ÑŽ Ð´Ð¾Ñ‡ÐºÑƒ, Ð´Ð°Ð¼ Ñ‚Ð¾Ð±Ñ– ÑÑ‚Ð¾ Ð·Ð¾Ð»Ð¾Ñ‚Ð¸Ñ…Â». Ð¦Ðµ ÐºÐ»Ð°ÑÐ¸Ñ‡Ð½Ð° ÑÑ‚Ñ€ÑƒÐºÑ‚ÑƒÑ€Ð° ÐºÐ²ÐµÑÑ‚Ð¾Ð²Ð¾Ð³Ð¾ Ð·Ð°Ð²Ð´Ð°Ð½Ð½Ñ! Ð—Ð²ÐµÑ€Ð½Ñ–Ñ‚ÑŒ ÑƒÐ²Ð°Ð³Ñƒ Ð½Ð° Ð¼Ð°Ð¹Ð±ÑƒÑ‚Ð½Ñ–Ð¹ Ñ‡Ð°Ñ Ð² Ð¾Ð±Ð¾Ñ… Ñ‡Ð°ÑÑ‚Ð¸Ð½Ð°Ñ….\n\n---\n\n## Ð”Ñ–Ð°Ð»Ð¾Ð³Ð¸\n\n### Ð”Ñ–Ð°Ð»Ð¾Ð³ 1: ÐŸÐ»Ð°Ð½ÑƒÐ²Ð°Ð½Ð½Ñ Ð²Ð¸Ñ…Ñ–Ð´Ð½Ð¸Ñ…\n\n**ÐÐ½Ð´Ñ€Ñ–Ð¹:** Ð¯Ðº Ð´ÑƒÐ¼Ð°Ñ”Ñˆ, Ñ‰Ð¾ Ð±ÑƒÐ´ÐµÐ¼Ð¾ Ñ€Ð¾Ð±Ð¸Ñ‚Ð¸ Ð½Ð° Ð²Ð¸Ñ…Ñ–Ð´Ð½Ð¸Ñ…?\n\n**ÐœÐ°Ñ€Ñ–Ñ:** Ð¯ÐºÑ‰Ð¾ Ð¿Ð¾Ð³Ð¾Ð´Ð° Ð±ÑƒÐ´Ðµ Ð³Ð°Ñ€Ð½Ð¾ÑŽ, Ð¼Ð¾Ð¶ÐµÐ¼Ð¾ Ð¿Ð¾Ñ—Ñ…Ð°Ñ‚Ð¸ Ð·Ð° Ð¼Ñ–ÑÑ‚Ð¾ Ð½Ð° Ð¿Ñ–ÐºÐ½Ñ–Ðº.\n\n**ÐÐ½Ð´Ñ€Ñ–Ð¹:** Ð§ÑƒÐ´Ð¾Ð²Ð° Ñ–Ð´ÐµÑ! Ð ÑÐºÑ‰Ð¾ Ð±ÑƒÐ´Ðµ Ð´Ð¾Ñ‰, Ñ‰Ð¾ Ñ‚Ð¾Ð´Ñ– Ñ€Ð¾Ð±Ð¸Ñ‚Ð¸Ð¼ÐµÐ¼Ð¾?\n\n**ÐœÐ°Ñ€Ñ–Ñ:** Ð¯ÐºÑ‰Ð¾ Ð±ÑƒÐ´Ðµ Ð´Ð¾Ñ‰, Ð·Ð°Ð»Ð¸ÑˆÐ¸Ð¼Ð¾ÑÑ Ð²Ð´Ð¾Ð¼Ð° Ð¹ Ð¿Ð¾Ð´Ð¸Ð²Ð¸Ð¼Ð¾ÑÑ ÑÐºÐ¸Ð¹ÑÑŒ Ñ„Ñ–Ð»ÑŒÐ¼.\n\n**ÐÐ½Ð´Ñ€Ñ–Ð¹:** Ð”Ð¾Ð±Ñ€Ðµ. Ð ÑÐºÑ‰Ð¾ Ð´Ñ€ÑƒÐ·Ñ– Ð·Ð°Ñ…Ð¾Ñ‡ÑƒÑ‚ÑŒ Ð¿Ñ€Ð¸Ñ”Ð´Ð½Ð°Ñ‚Ð¸ÑÑ?\n\n**ÐœÐ°Ñ€Ñ–Ñ:** Ð¯ÐºÑ‰Ð¾ Ð²Ð¾Ð½Ð¸ Ð·Ð°Ñ…Ð¾Ñ‡ÑƒÑ‚ÑŒ, Ð· Ñ€Ð°Ð´Ñ–ÑÑ‚ÑŽ Ð·Ð°Ð¿Ñ€Ð¾ÑÐ¸Ð¼Ð¾ Ñ—Ñ… Ñ€Ð°Ð·Ð¾Ð¼ Ð· Ð½Ð°Ð¼Ð¸.\n\n---\n\n### Ð”Ñ–Ð°Ð»Ð¾Ð³ 2: ÐÐ° Ñ€Ð¾Ð±Ð¾Ñ‚Ñ–\n\n**ÐžÐ»ÐµÐ½Ð°:** ÐŸÐ°Ð½Ðµ Ð´Ð¸Ñ€ÐµÐºÑ‚Ð¾Ñ€Ðµ, ÑÐºÑ‰Ð¾ Ñ Ð·Ð°ÐºÑ–Ð½Ñ‡Ñƒ Ð·Ð²Ñ–Ñ‚ ÑÑŒÐ¾Ð³Ð¾Ð´Ð½Ñ–, Ñ‡Ð¸ Ð¼Ð¾Ð¶Ñƒ Ð²Ð·ÑÑ‚Ð¸ Ð·Ð°Ð²Ñ‚Ñ€Ð° Ð²Ð¸Ñ…Ñ–Ð´Ð½Ð¸Ð¹?\n\n**Ð”Ð¸Ñ€ÐµÐºÑ‚Ð¾Ñ€:** Ð¯ÐºÑ‰Ð¾ Ð·Ð²Ñ–Ñ‚ Ð±ÑƒÐ´Ðµ Ð³Ð¾Ñ‚Ð¾Ð²Ð¸Ð¹ Ð´Ð¾ Ð¿'ÑÑ‚Ð¾Ñ— Ð³Ð¾Ð´Ð¸Ð½Ð¸, Ð½Ðµ Ð±Ð°Ñ‡Ñƒ Ð¿Ñ€Ð¾Ð±Ð»ÐµÐ¼.\n\n**ÐžÐ»ÐµÐ½Ð°:** Ð”ÑÐºÑƒÑŽ. Ð ÑÐºÑ‰Ð¾ Ð²Ð¸Ð½Ð¸ÐºÐ½ÑƒÑ‚ÑŒ Ð·Ð°Ð¿Ð¸Ñ‚Ð°Ð½Ð½Ñ Ñ‰Ð¾Ð´Ð¾ Ð´Ð°Ð½Ð¸Ñ…?\n\n**Ð”Ð¸Ñ€ÐµÐºÑ‚Ð¾Ñ€:** Ð¯ÐºÑ‰Ð¾ Ð±ÑƒÐ´ÑƒÑ‚ÑŒ Ð·Ð°Ð¿Ð¸Ñ‚Ð°Ð½Ð½Ñ, Ð·Ð°Ñ‚ÐµÐ»ÐµÑ„Ð¾Ð½ÑƒÐ¹Ñ‚Ðµ Ð¼ÐµÐ½Ñ– Ð½Ð° Ð¼Ð¾Ð±Ñ–Ð»ÑŒÐ½Ð¸Ð¹.\n\n**ÐžÐ»ÐµÐ½Ð°:** Ð—Ñ€Ð¾Ð·ÑƒÐ¼Ñ–Ð»Ð°. Ð¯ÐºÑ‰Ð¾ Ð²ÑÐµ Ð±ÑƒÐ´Ðµ Ð´Ð¾Ð±Ñ€Ðµ, Ð¿Ð¾Ð±Ð°Ñ‡Ð¸Ð¼Ð¾ÑÑ Ð² Ð¿Ð¾Ð½ÐµÐ´Ñ–Ð»Ð¾Ðº.\n\n**Ð”Ð¸Ñ€ÐµÐºÑ‚Ð¾Ñ€:** Ð“Ð°Ñ€Ð°Ð·Ð´. Ð¯ÐºÑ‰Ð¾ Ñ‰Ð¾ÑÑŒ Ð·Ð¼Ñ–Ð½Ð¸Ñ‚ÑŒÑÑ, Ð¿Ð¾Ð²Ñ–Ð´Ð¾Ð¼Ñ‚Ðµ Ð¼ÐµÐ½Ñ– Ð·Ð°Ð·Ð´Ð°Ð»ÐµÐ³Ñ–Ð´ÑŒ.\n\n---\n\n### Ð”Ñ–Ð°Ð»Ð¾Ð³ 3: Ð›Ñ–ÐºÐ°Ñ€ Ñ– Ð¿Ð°Ñ†Ñ–Ñ”Ð½Ñ‚\n\n**Ð›Ñ–ÐºÐ°Ñ€:** ÐŸÐ°Ð½Ðµ Ð†Ð²Ð°Ð½Ðµ, ÑÐºÑ‰Ð¾ Ð²Ð¸ Ð±ÑƒÐ´ÐµÑ‚Ðµ Ð´Ð¾Ñ‚Ñ€Ð¸Ð¼ÑƒÐ²Ð°Ñ‚Ð¸ÑÑ Ð´Ñ–Ñ”Ñ‚Ð¸, ÑÑ‚Ð°Ð½ Ð¿Ð¾Ð»Ñ–Ð¿ÑˆÐ¸Ñ‚ÑŒÑÑ.\n\n**ÐŸÐ°Ñ†Ñ–Ñ”Ð½Ñ‚:** Ð ÑÐºÑ‰Ð¾ Ñ Ñ–Ð½Ð¾Ð´Ñ– Ð¿Ð¾Ñ€ÑƒÑˆÑƒÐ²Ð°Ñ‚Ð¸Ð¼Ñƒ Ñ€ÐµÐ¶Ð¸Ð¼ Ñ…Ð°Ñ€Ñ‡ÑƒÐ²Ð°Ð½Ð½Ñ?\n\n**Ð›Ñ–ÐºÐ°Ñ€:** Ð¯ÐºÑ‰Ð¾ Ð±ÑƒÐ´ÐµÑ‚Ðµ Ð¿Ð¾Ñ€ÑƒÑˆÑƒÐ²Ð°Ñ‚Ð¸ Ñ€ÐµÐ³ÑƒÐ»ÑÑ€Ð½Ð¾, Ð»Ñ–ÐºÑƒÐ²Ð°Ð½Ð½Ñ Ð½Ðµ Ð´Ð°ÑÑ‚ÑŒ Ñ€ÐµÐ·ÑƒÐ»ÑŒÑ‚Ð°Ñ‚Ñƒ.\n\n**ÐŸÐ°Ñ†Ñ–Ñ”Ð½Ñ‚:** Ð—Ñ€Ð¾Ð·ÑƒÐ¼Ñ–Ð². Ð ÑÐºÑ‰Ð¾ ÑÑ‚Ð°Ð½Ðµ Ð³Ñ–Ñ€ÑˆÐµ, Ñ‰Ð¾ Ñ€Ð¾Ð±Ð¸Ñ‚Ð¸?\n\n**Ð›Ñ–ÐºÐ°Ñ€:** Ð¯ÐºÑ‰Ð¾ Ð·'ÑÐ²Ð»ÑÑ‚ÑŒÑÑ Ð½Ð¾Ð²Ñ– ÑÐ¸Ð¼Ð¿Ñ‚Ð¾Ð¼Ð¸, Ð½ÐµÐ³Ð°Ð¹Ð½Ð¾ Ð·Ð²ÐµÑ€Ð½Ñ–Ñ‚ÑŒÑÑ Ð´Ð¾ Ð»Ñ–ÐºÐ°Ñ€Ð½Ñ–.\n\n**ÐŸÐ°Ñ†Ñ–Ñ”Ð½Ñ‚:** Ð”Ð¾Ð±Ñ€Ðµ, Ð±ÑƒÐ´Ñƒ Ð´Ð¾Ñ‚Ñ€Ð¸Ð¼ÑƒÐ²Ð°Ñ‚Ð¸ÑÑ Ð²ÑÑ–Ñ… Ð²Ð°ÑˆÐ¸Ñ… Ñ€ÐµÐºÐ¾Ð¼ÐµÐ½Ð´Ð°Ñ†Ñ–Ð¹.\n\n---\n\n### Ð”Ñ–Ð°Ð»Ð¾Ð³ 4: Ð’Ñ‡Ð¸Ñ‚ÐµÐ»ÑŒ Ñ– ÑƒÑ‡ÐµÐ½ÑŒ\n\n**Ð£Ñ‡ÐµÐ½ÑŒ:** ÐŸÐ°Ð½Ðµ Ð²Ñ‡Ð¸Ñ‚ÐµÐ»ÑŽ, ÑÐºÑ‰Ð¾ Ñ Ð½Ðµ Ð²ÑÑ‚Ð¸Ð³Ð½Ñƒ Ð·Ð´Ð°Ñ‚Ð¸ Ñ€Ð¾Ð±Ð¾Ñ‚Ñƒ ÑÑŒÐ¾Ð³Ð¾Ð´Ð½Ñ–?\n\n**Ð’Ñ‡Ð¸Ñ‚ÐµÐ»ÑŒ:** Ð¯ÐºÑ‰Ð¾ Ð½Ðµ Ð²ÑÑ‚Ð¸Ð³Ð½ÐµÑˆ, Ð·Ð´Ð°ÑÐ¸ Ð·Ð°Ð²Ñ‚Ñ€Ð°, Ð°Ð»Ðµ Ð¾Ñ†Ñ–Ð½ÐºÐ° Ð±ÑƒÐ´Ðµ Ð½Ð¸Ð¶Ñ‡Ð¾ÑŽ.\n\n**Ð£Ñ‡ÐµÐ½ÑŒ:** Ð ÑÐºÑ‰Ð¾ Ñ Ð·Ð°Ñ…Ð²Ð¾Ñ€Ñ–Ð² Ñ– Ð½Ðµ Ð¼Ð¾Ð¶Ñƒ Ð¿Ñ€Ð¸Ð¹Ñ‚Ð¸ Ð´Ð¾ ÑˆÐºÐ¾Ð»Ð¸?\n\n**Ð’Ñ‡Ð¸Ñ‚ÐµÐ»ÑŒ:** Ð¯ÐºÑ‰Ð¾ Ð·Ð°Ñ…Ð²Ð¾Ñ€Ñ–Ñ”Ñˆ, Ð¿Ñ€Ð¸Ð½ÐµÑÐµÑˆ Ð´Ð¾Ð²Ñ–Ð´ÐºÑƒ Ð²Ñ–Ð´ Ð»Ñ–ÐºÐ°Ñ€Ñ Ð¹ Ð·Ð´Ð°ÑÐ¸ Ð¿Ñ–Ð·Ð½Ñ–ÑˆÐµ.\n\n**Ð£Ñ‡ÐµÐ½ÑŒ:** Ð—Ñ€Ð¾Ð·ÑƒÐ¼Ñ–Ð². Ð¯ÐºÑ‰Ð¾ Ð¼Ð°Ñ‚Ð¸Ð¼Ñƒ Ð·Ð°Ð¿Ð¸Ñ‚Ð°Ð½Ð½Ñ, Ð¼Ð¾Ð¶Ñƒ Ð·Ð²ÐµÑ€Ð½ÑƒÑ‚Ð¸ÑÑ?\n\n**Ð’Ñ‡Ð¸Ñ‚ÐµÐ»ÑŒ:** Ð—Ð²Ð¸Ñ‡Ð°Ð¹Ð½Ð¾. Ð¯ÐºÑ‰Ð¾ Ð¿Ð¾Ñ‚Ñ€Ñ–Ð±Ð½Ð° Ð´Ð¾Ð¿Ð¾Ð¼Ð¾Ð³Ð°, Ð·Ð°Ð²Ð¶Ð´Ð¸ Ð¼Ð¾Ð¶ÐµÑˆ Ð¿Ð¸Ñ‚Ð°Ñ‚Ð¸.\n\n---\n\n### Ð”Ñ–Ð°Ð»Ð¾Ð³ 5: ÐŸÐ»Ð°Ð½ÑƒÐ²Ð°Ð½Ð½Ñ Ð¿Ð¾Ð´Ð¾Ñ€Ð¾Ð¶Ñ–\n\n**ÐžÐ»Ñ:** ÐœÐ¸ Ñ—Ð´ÐµÐ¼Ð¾ Ð´Ð¾ Ð›ÑŒÐ²Ð¾Ð²Ð° Ð½Ð° Ð²Ð¸Ñ…Ñ–Ð´Ð½Ñ–. Ð¯ÐºÑ‰Ð¾ Ñ…Ð¾Ñ‡ÐµÑˆ, Ð¿Ñ€Ð¸Ñ”Ð´Ð½ÑƒÐ¹ÑÑ!\n\n**Ð®Ñ€Ñ–Ð¹:** Ð¯ÐºÑ‰Ð¾ Ð²ÑÑ‚Ð¸Ð³Ð½Ñƒ Ð·Ð°ÐºÑ–Ð½Ñ‡Ð¸Ñ‚Ð¸ Ð¿Ñ€Ð¾Ñ”ÐºÑ‚, Ð¾Ð±Ð¾Ð²'ÑÐ·ÐºÐ¾Ð²Ð¾ Ð¿Ñ€Ð¸Ñ”Ð´Ð½Ð°ÑŽÑÑ.\n\n**ÐžÐ»Ñ:** Ð§ÑƒÐ´Ð¾Ð²Ð¾! Ð¯ÐºÑ‰Ð¾ Ð¿Ð¾Ñ—Ð´ÐµÑˆ, Ð·Ð°Ð±Ñ€Ð¾Ð½ÑŽÑŽ Ñ‚Ð¾Ð±Ñ– Ð¼Ñ–ÑÑ†Ðµ Ð² Ð³Ð¾Ñ‚ÐµÐ»Ñ–.\n\n**Ð®Ñ€Ñ–Ð¹:** Ð”ÑÐºÑƒÑŽ. Ð ÑÐºÑ‰Ð¾ Ð¼ÐµÐ½Ñ– Ð´Ð¾Ð²ÐµÐ´ÐµÑ‚ÑŒÑÑ Ñ€Ð°Ð¿Ñ‚Ð¾Ð²Ð¾ Ð¿Ð¾Ð²ÐµÑ€Ð½ÑƒÑ‚Ð¸ÑÑ?\n\n**ÐžÐ»Ñ:** Ð¯ÐºÑ‰Ð¾ Ð´Ð¾Ð²ÐµÐ´ÐµÑ‚ÑŒÑÑ Ð¿Ð¾Ð²ÐµÑ€Ð½ÑƒÑ‚Ð¸ÑÑ, Ñ Ð·Ñ€Ð¾Ð·ÑƒÐ¼Ñ–ÑŽ. Ð Ð¾Ð±Ð¾Ñ‚Ð° Ñ” Ñ€Ð¾Ð±Ð¾Ñ‚Ð°.\n\n**Ð®Ñ€Ñ–Ð¹:** Ð”Ð¾Ð±Ñ€Ðµ, Ð´Ð°Ð¼ Ð·Ð½Ð°Ñ‚Ð¸ Ð´Ð¾ Ð¿'ÑÑ‚Ð½Ð¸Ñ†Ñ–, ÑÐºÑ‰Ð¾ Ð·Ð¼Ð¾Ð¶Ñƒ Ð¿Ð¾Ñ—Ñ…Ð°Ñ‚Ð¸.\n\n> ðŸŒ **Ð ÐµÐ°Ð»ÑŒÐ½Ð¸Ð¹ ÑÐ²Ñ–Ñ‚**\n> Ð£ Ð¿Ð¾Ð²ÑÑÐºÐ´ÐµÐ½Ð½Ð¾Ð¼Ñƒ ÑÐ¿Ñ–Ð»ÐºÑƒÐ²Ð°Ð½Ð½Ñ– ÑƒÐºÑ€Ð°Ñ—Ð½Ñ†Ñ– Ñ‡Ð°ÑÑ‚Ð¾ Ð²Ð¸ÐºÐ¾Ñ€Ð¸ÑÑ‚Ð¾Ð²ÑƒÑŽÑ‚ÑŒ ÑÐºÐ¾Ñ€Ð¾Ñ‡ÐµÐ½Ñ– Ñ„Ð¾Ñ€Ð¼Ð¸: Â«Ð¯ÐºÑ‰Ð¾ Ñ…Ð¾Ñ‡ÐµÑˆ â€” Ð¹Ð´Ð¸Â», Â«Ð¯ÐºÑ‰Ð¾ Ñ‰Ð¾ â€” Ð´Ð·Ð²Ð¾Ð½Ð¸Â». Ð¦Ðµ Ð¿Ð¾ÐºÐ°Ð·ÑƒÑ” Ð³Ð½ÑƒÑ‡ÐºÑ–ÑÑ‚ÑŒ ÑƒÐ¼Ð¾Ð²Ð½Ð¸Ñ… ÐºÐ¾Ð½ÑÑ‚Ñ€ÑƒÐºÑ†Ñ–Ð¹ Ñƒ Ñ€Ð¾Ð·Ð¼Ð¾Ð²Ð½Ñ–Ð¹ Ð¼Ð¾Ð²Ñ–. Ð¢Ð¸Ñ€Ðµ Ð·Ð°Ð¼Ñ–Ð½ÑŽÑ” ÐºÐ¾Ð¼Ñƒ Ð² ÑˆÐ²Ð¸Ð´ÐºÐ¾Ð¼Ñƒ Ð¼Ð¾Ð²Ð»ÐµÐ½Ð½Ñ–.\n\n---\n\n# ÐŸÑ–Ð´ÑÑƒÐ¼Ð¾Ðº\n\n**Ð©Ð¾ Ð²Ð¸ Ð½Ð°Ð²Ñ‡Ð¸Ð»Ð¸ÑÑ Ð² Ñ†ÑŒÐ¾Ð¼Ñƒ Ð¼Ð¾Ð´ÑƒÐ»Ñ–:**\n\n1. **Ð ÐµÐ°Ð»ÑŒÐ½Ð° ÑƒÐ¼Ð¾Ð²Ð°:** ÐžÐ¿Ð¸ÑÑƒÑ” ÑÐ¸Ñ‚ÑƒÐ°Ñ†Ñ–Ñ—, Ñ‰Ð¾ Ð¼Ð¾Ð¶ÑƒÑ‚ÑŒ ÑÐ¿Ñ€Ð°Ð²Ð´Ñ– ÑÑ‚Ð°Ñ‚Ð¸ÑÑ.\n2. **Ð¡Ð¿Ð¾Ð»ÑƒÑ‡Ð½Ð¸Ðº Â«ÑÐºÑ‰Ð¾Â»:** Ð’Ð²Ð¾Ð´Ð¸Ñ‚ÑŒ ÑƒÐ¼Ð¾Ð²Ñƒ Ð² Ñ€ÐµÑ‡ÐµÐ½Ð½Ñ–.\n3. **Ð§Ð°ÑÐ¾Ð²Ñ– ÑÑ…ÐµÐ¼Ð¸:** Ð¢ÐµÐ¿ÐµÑ€Ñ–ÑˆÐ½Ñ–Ð¹ + Ñ‚ÐµÐ¿ÐµÑ€Ñ–ÑˆÐ½Ñ–Ð¹ (Ð·Ð°Ð³Ð°Ð»ÑŒÐ½Ðµ) Ð°Ð±Ð¾ Ð¼Ð°Ð¹Ð±ÑƒÑ‚Ð½Ñ–Ð¹ + Ð¼Ð°Ð¹Ð±ÑƒÑ‚Ð½Ñ–Ð¹ (ÐºÐ¾Ð½ÐºÑ€ÐµÑ‚Ð½Ðµ).\n4. **ÐÐ»ÑŒÑ‚ÐµÑ€Ð½Ð°Ñ‚Ð¸Ð²Ð¸:** Â«ÐšÐ¾Ð»Ð¸Â», Â«Ñƒ Ð²Ð¸Ð¿Ð°Ð´ÐºÑƒ ÑÐºÑ‰Ð¾Â», Â«Ð·Ð° ÑƒÐ¼Ð¾Ð²Ð¸ Ñ‰Ð¾Â» Ñ‚Ð° Ñ–Ð½ÑˆÑ–.\n\n**ÐžÑÐ½Ð¾Ð²Ð½Ðµ Ð¿Ñ€Ð°Ð²Ð¸Ð»Ð¾:**\n\n> Ð ÐµÐ°Ð»ÑŒÐ½Ð° ÑƒÐ¼Ð¾Ð²Ð° = Ð¼Ð¾Ð¶Ð»Ð¸Ð²Ð° ÑÐ¸Ñ‚ÑƒÐ°Ñ†Ñ–Ñ. Ð’Ð¸ÐºÐ¾Ñ€Ð¸ÑÑ‚Ð¾Ð²ÑƒÐ¹Ñ‚Ðµ Â«ÑÐºÑ‰Ð¾Â» + Ð²Ñ–Ð´Ð¿Ð¾Ð²Ñ–Ð´Ð½Ð¸Ð¹ Ñ‡Ð°Ñ Ð´Ñ–Ñ”ÑÐ»Ð¾Ð²Ð°, ÑƒÐ·Ð³Ð¾Ð´Ð¶ÑƒÑŽÑ‡Ð¸ Ð¾Ð±Ð¸Ð´Ð²Ñ– Ñ‡Ð°ÑÑ‚Ð¸Ð½Ð¸ Ñ€ÐµÑ‡ÐµÐ½Ð½Ñ.\n\n**Ð”Ð°Ð»Ñ–:**\n\nÐ£ Ð½Ð°ÑÑ‚ÑƒÐ¿Ð½Ð¸Ñ… Ð¼Ð¾Ð´ÑƒÐ»ÑÑ… Ð¼Ð¸ Ñ€Ð¾Ð·Ð³Ð»ÑÐ½ÐµÐ¼Ð¾ **Ð½ÐµÑ€ÐµÐ°Ð»ÑŒÐ½Ñ– ÑƒÐ¼Ð¾Ð²Ð¸** Ð· Â«ÑÐºÐ±Ð¸Â» (Ð¼Ð¾Ð´ÑƒÐ»ÑŒ 32) Ñ‚Ð° **ÑÐºÐ»Ð°Ð´Ð½Ñ– ÐºÐ¾Ð¼Ð±Ñ–Ð½Ð¾Ð²Ð°Ð½Ñ– ÑƒÐ¼Ð¾Ð²Ð¸** (Ð¼Ð¾Ð´ÑƒÐ»ÑŒ 33). Ð¦Ðµ Ð´Ð¾Ð·Ð²Ð¾Ð»Ð¸Ñ‚ÑŒ Ð²Ð°Ð¼ Ð²Ð¸Ñ€Ð°Ð¶Ð°Ñ‚Ð¸ Ð³Ñ–Ð¿Ð¾Ñ‚ÐµÑ‚Ð¸Ñ‡Ð½Ñ– ÑÐ¸Ñ‚ÑƒÐ°Ñ†Ñ–Ñ— Ñ‚Ð° ÐºÐ¾Ð½Ñ‚Ñ€Ñ„Ð°ÐºÑ‚Ð¸Ñ‡Ð½Ñ– Ð¿Ñ€Ð¸Ð¿ÑƒÑ‰ÐµÐ½Ð½Ñ.\n\n> âœ… **Ð¡Ð°Ð¼Ð¾Ð¿ÐµÑ€ÐµÐ²Ñ–Ñ€ÐºÐ°**\n>\n> Ð§Ð¸ Ð¼Ð¾Ð¶ÐµÑ‚Ðµ Ð²Ð¸:\n> - [ ] Ð Ð¾Ð·Ñ€Ñ–Ð·Ð½Ð¸Ñ‚Ð¸ Ñ€ÐµÐ°Ð»ÑŒÐ½Ñƒ Ð¹ Ð½ÐµÑ€ÐµÐ°Ð»ÑŒÐ½Ñƒ ÑƒÐ¼Ð¾Ð²Ñƒ?\n> - [ ] ÐžÐ±Ñ€Ð°Ñ‚Ð¸ Ð¿Ñ€Ð°Ð²Ð¸Ð»ÑŒÐ½Ð¸Ð¹ Ñ‡Ð°ÑÐ¾Ð²Ð¸Ð¹ Ð¿Ð»Ð°Ð½ Ð´Ð»Ñ ÑƒÐ¼Ð¾Ð²Ð½Ð¾Ð³Ð¾ Ñ€ÐµÑ‡ÐµÐ½Ð½Ñ?\n> - [ ] Ð’Ð¸ÐºÐ¾Ñ€Ð¸ÑÑ‚Ð°Ñ‚Ð¸ Ð°Ð»ÑŒÑ‚ÐµÑ€Ð½Ð°Ñ‚Ð¸Ð²Ð½Ñ– ÑÐ¿Ð¾Ð»ÑƒÑ‡Ð½Ð¸ÐºÐ¸ ÑƒÐ¼Ð¾Ð²Ð¸?\n> - [ ] ÐŸÑ€Ð°Ð²Ð¸Ð»ÑŒÐ½Ð¾ Ñ€Ð¾Ð·ÑÑ‚Ð°Ð²Ð¸Ñ‚Ð¸ Ñ€Ð¾Ð·Ð´Ñ–Ð»Ð¾Ð²Ñ– Ð·Ð½Ð°ÐºÐ¸ Ð² ÑƒÐ¼Ð¾Ð²Ð½Ð¸Ñ… Ñ€ÐµÑ‡ÐµÐ½Ð½ÑÑ…?\n>\n> Ð¯ÐºÑ‰Ð¾ Ñ‚Ð°Ðº â€” Ð¿ÐµÑ€ÐµÑ…Ð¾Ð´ÑŒÑ‚Ðµ Ð´Ð¾ Ð²Ð¿Ñ€Ð°Ð² Ð´Ð»Ñ Ð·Ð°ÐºÑ€Ñ–Ð¿Ð»ÐµÐ½Ð½Ñ Ð¼Ð°Ñ‚ÐµÑ€Ñ–Ð°Ð»Ñƒ!\n\n---\n\n> [!resources] ðŸŽ§ Ð—Ð¾Ð²Ð½Ñ–ÑˆÐ½Ñ– Ñ€ÐµÑÑƒÑ€ÑÐ¸\n>\n> **Ð”Ð¾Ð´Ð°Ñ‚ÐºÐ¾Ð²Ñ– Ð¼Ð°Ñ‚ÐµÑ€Ñ–Ð°Ð»Ð¸ Ð´Ð»Ñ Ð²Ð¸Ð²Ñ‡ÐµÐ½Ð½Ñ:**\n> - ðŸ“– [Ð£Ð¼Ð¾Ð²Ð½Ñ– Ñ€ÐµÑ‡ÐµÐ½Ð½Ñ](https://uk.wikipedia.org/wiki/Ð¡ÐºÐ»Ð°Ð´Ð½Ð¾Ð¿Ñ–Ð´Ñ€ÑÐ´Ð½Ðµ_Ñ€ÐµÑ‡ÐµÐ½Ð½Ñ) â€” Ð’Ñ–ÐºÑ–Ð¿ÐµÐ´Ñ–Ñ\n> - ðŸ“º [Ukrainian Grammar](https://www.youtube.com/@ukrainianlesson) â€” Ð²Ñ–Ð´ÐµÐ¾ÑƒÑ€Ð¾ÐºÐ¸\n> - ðŸŽ§ [Ukrainian Lessons Podcast](https://ukrainianlessons.com/) â€” Ð¿Ð¾Ð´ÐºÐ°ÑÑ‚ Ð´Ð»Ñ Ð²Ð¸Ð²Ñ‡ÐµÐ½Ð½Ñ\n\n---\n\n# Ð’Ð¿Ñ€Ð°Ð²Ð¸\n\n## quiz: Ð’Ð¸Ð±ÐµÑ€Ñ–Ñ‚ÑŒ Ð¿Ñ€Ð°Ð²Ð¸Ð»ÑŒÐ½Ñƒ Ð²Ñ–Ð´Ð¿Ð¾Ð²Ñ–Ð´ÑŒ\n\n1. Ð¯ÐºÐµ Ñ€ÐµÑ‡ÐµÐ½Ð½Ñ Ñ” Ð¿Ñ€Ð°Ð²Ð¸Ð»ÑŒÐ½Ð¸Ð¼ Ð¿Ñ€Ð¸ÐºÐ»Ð°Ð´Ð¾Ð¼ Ñ€ÐµÐ°Ð»ÑŒÐ½Ð¾Ñ— ÑƒÐ¼Ð¾Ð²Ð¸ Ð· Ð²Ð¸ÐºÐ¾Ñ€Ð¸ÑÑ‚Ð°Ð½Ð½ÑÐ¼ ÑÐ¿Ð¾Ð»ÑƒÑ‡Ð½Ð¸ÐºÐ° Â«ÑÐºÑ‰Ð¾Â» Ð² ÑƒÐºÑ€Ð°Ñ—Ð½ÑÑŒÐºÑ–Ð¹ Ð¼Ð¾Ð²Ñ–?\n   - [x] Ð¯ÐºÑ‰Ð¾ Ð¼Ð°Ñ‚Ð¸Ð¼ÐµÑˆ Ñ‡Ð°Ñ, Ð·Ð°Ñ‚ÐµÐ»ÐµÑ„Ð¾Ð½ÑƒÐ¹ Ð¼ÐµÐ½Ñ– Ð²Ð²ÐµÑ‡ÐµÑ€Ñ–.\n   - [ ] Ð¯ÐºÐ±Ð¸ Ð¼Ð°Ñ‚Ð¸Ð¼ÐµÑˆ Ñ‡Ð°Ñ, Ð·Ð°Ñ‚ÐµÐ»ÐµÑ„Ð¾Ð½ÑƒÐ¹ Ð¼ÐµÐ½Ñ– Ð²Ð²ÐµÑ‡ÐµÑ€Ñ–.\n   - [ ] Ð¯ÐºÑ‰Ð¾ Ð¼Ð°Ñ‚Ð¸Ð¼ÐµÑˆ Ñ‡Ð°Ñ, Ð·Ð°Ñ‚ÐµÐ»ÐµÑ„Ð¾Ð½ÑƒÐ²Ð°Ð² Ð¼ÐµÐ½Ñ– Ð²Ð²ÐµÑ‡ÐµÑ€Ñ–.\n   - [ ] ÐšÐ¾Ð»Ð¸ Ð± Ð¼Ð°Ñ‚Ð¸Ð¼ÐµÑˆ Ñ‡Ð°Ñ, Ð·Ð°Ñ‚ÐµÐ»ÐµÑ„Ð¾Ð½ÑƒÐ¹ Ð¼ÐµÐ½Ñ– Ð²Ð²ÐµÑ‡ÐµÑ€Ñ–.\n   > Ð ÐµÐ°Ð»ÑŒÐ½Ð° ÑƒÐ¼Ð¾Ð²Ð° Ð²Ð¸ÐºÐ¾Ñ€Ð¸ÑÑ‚Ð¾Ð²ÑƒÑ” Â«ÑÐºÑ‰Ð¾Â» + Ð¼Ð°Ð¹Ð±ÑƒÑ‚Ð½Ñ–Ð¹/Ñ‚ÐµÐ¿ÐµÑ€Ñ–ÑˆÐ½Ñ–Ð¹ Ñ‡Ð°Ñ.\n\n2. Ð¯ÐºÐ¸Ð¹ Ñ‡Ð°ÑÐ¾Ð²Ð¸Ð¹ Ð¿Ð»Ð°Ð½ Ñ” Ð¿Ñ€Ð°Ð²Ð¸Ð»ÑŒÐ½Ð¸Ð¼ Ð´Ð»Ñ Ñ€ÐµÐ°Ð»ÑŒÐ½Ð¾Ñ— ÑƒÐ¼Ð¾Ð²Ð¸, Ñ‰Ð¾ Ð¾Ð¿Ð¸ÑÑƒÑ” ÐºÐ¾Ð½ÐºÑ€ÐµÑ‚Ð½Ñƒ Ð¼Ð°Ð¹Ð±ÑƒÑ‚Ð½ÑŽ ÑÐ¸Ñ‚ÑƒÐ°Ñ†Ñ–ÑŽ?\n   - [ ] ÐœÐ¸Ð½ÑƒÐ»Ð¸Ð¹ Ñ‡Ð°Ñ Ð² ÑƒÐ¼Ð¾Ð²Ñ– + Ñ‚ÐµÐ¿ÐµÑ€Ñ–ÑˆÐ½Ñ–Ð¹ Ñ‡Ð°Ñ Ñƒ Ð½Ð°ÑÐ»Ñ–Ð´ÐºÑƒ.\n   - [ ] Ð¢ÐµÐ¿ÐµÑ€Ñ–ÑˆÐ½Ñ–Ð¹ Ñ‡Ð°Ñ Ð² ÑƒÐ¼Ð¾Ð²Ñ– + Ð¼Ð¸Ð½ÑƒÐ»Ð¸Ð¹ Ñ‡Ð°Ñ Ñƒ Ð½Ð°ÑÐ»Ñ–Ð´ÐºÑƒ.\n   - [x] ÐœÐ°Ð¹Ð±ÑƒÑ‚Ð½Ñ–Ð¹ Ñ‡Ð°Ñ Ð² ÑƒÐ¼Ð¾Ð²Ñ– + Ð¼Ð°Ð¹Ð±ÑƒÑ‚Ð½Ñ–Ð¹ Ñ‡Ð°Ñ Ñƒ Ð½Ð°ÑÐ»Ñ–Ð´ÐºÑƒ.\n   - [ ] Ð£Ð¼Ð¾Ð²Ð½Ð¸Ð¹ ÑÐ¿Ð¾ÑÑ–Ð± Ð² Ð¾Ð±Ð¾Ñ… Ñ‡Ð°ÑÑ‚Ð¸Ð½Ð°Ñ… Ñ€ÐµÑ‡ÐµÐ½Ð½Ñ.\n   > Ð”Ð»Ñ ÐºÐ¾Ð½ÐºÑ€ÐµÑ‚Ð½Ð¸Ñ… Ð¼Ð°Ð¹Ð±ÑƒÑ‚Ð½Ñ–Ñ… ÑÐ¸Ñ‚ÑƒÐ°Ñ†Ñ–Ð¹: Ð¼Ð°Ð¹Ð±ÑƒÑ‚Ð½Ñ–Ð¹ + Ð¼Ð°Ð¹Ð±ÑƒÑ‚Ð½Ñ–Ð¹.\n\n3. Ð£ ÑÐºÐ¾Ð¼Ñƒ Ð· Ð½Ð°Ð²ÐµÐ´ÐµÐ½Ð¸Ñ… Ñ€ÐµÑ‡ÐµÐ½ÑŒ Ð¿Ñ€Ð°Ð²Ð¸Ð»ÑŒÐ½Ð¾ Ð²Ð¸ÐºÐ¾Ñ€Ð¸ÑÑ‚Ð°Ð½Ð¾ Ð·Ð°Ð¿ÐµÑ€ÐµÑ‡ÐµÐ½Ð½Ñ Ð² ÑƒÐ¼Ð¾Ð²Ð½Ñ–Ð¹ Ñ‡Ð°ÑÑ‚Ð¸Ð½Ñ– Ð· Â«ÑÐºÑ‰Ð¾Â»?\n   - [x] Ð¯ÐºÑ‰Ð¾ Ð²Ñ–Ð½ Ð½Ðµ Ð¿Ñ€Ð¸Ð¹Ð´Ðµ Ð²Ñ‡Ð°ÑÐ½Ð¾, Ð¼Ð¸ Ð¿Ð¾Ñ‡Ð½ÐµÐ¼Ð¾ Ð±ÐµÐ· Ð½ÑŒÐ¾Ð³Ð¾.\n   - [ ] Ð¯ÐºÑ‰Ð¾ Ð½Ðµ Ð²Ñ–Ð½ Ð¿Ñ€Ð¸Ð¹Ð´Ðµ Ð²Ñ‡Ð°ÑÐ½Ð¾, Ð¼Ð¸ Ð¿Ð¾Ñ‡Ð½ÐµÐ¼Ð¾ Ð±ÐµÐ· Ð½ÑŒÐ¾Ð³Ð¾.\n   - [ ] Ð¯ÐºÑ‰Ð¾ Ð²Ñ–Ð½ Ð¿Ñ€Ð¸Ð¹Ð´Ðµ Ð½Ðµ Ð²Ñ‡Ð°ÑÐ½Ð¾, Ð¼Ð¸ Ð¿Ð¾Ñ‡Ð½ÐµÐ¼Ð¾ Ð±ÐµÐ· Ð½ÑŒÐ¾Ð³Ð¾.\n   - [ ] ÐÐµ ÑÐºÑ‰Ð¾ Ð²Ñ–Ð½ Ð¿Ñ€Ð¸Ð¹Ð´Ðµ, Ð¼Ð¸ Ð¿Ð¾Ñ‡Ð½ÐµÐ¼Ð¾ Ð±ÐµÐ· Ð½ÑŒÐ¾Ð³Ð¾.\n   > Ð—Ð°Ð¿ÐµÑ€ÐµÑ‡ÐµÐ½Ð½Ñ Â«Ð½ÐµÂ» ÑÑ‚Ð°Ð²Ð¸Ñ‚ÑŒÑÑ Ð¿ÐµÑ€ÐµÐ´ Ð´Ñ–Ñ”ÑÐ»Ð¾Ð²Ð¾Ð¼ Ð² ÑƒÐ¼Ð¾Ð²Ñ–.\n\n4. Ð¯ÐºÐ¸Ð¹ ÑÐ¿Ð¾Ð»ÑƒÑ‡Ð½Ð¸Ðº Ð¼Ð¾Ð¶Ð½Ð° Ð²Ð¸ÐºÐ¾Ñ€Ð¸ÑÑ‚Ð°Ñ‚Ð¸ Ð·Ð°Ð¼Ñ–ÑÑ‚ÑŒ Â«ÑÐºÑ‰Ð¾Â» Ð´Ð»Ñ Ð²Ð¸Ñ€Ð°Ð¶ÐµÐ½Ð½Ñ ÑƒÐ¼Ð¾Ð²Ð¸ Ð· Ñ‡Ð°ÑÐ¾Ð²Ð¸Ð¼ Ð²Ñ–Ð´Ñ‚Ñ–Ð½ÐºÐ¾Ð¼?\n   - [ ] Ñ‚Ð¾Ð¼Ñƒ Ñ‰Ð¾\n   - [x] ÐºÐ¾Ð»Ð¸\n   - [ ] Ñ…Ð¾Ñ‡Ð°\n   - [ ] Ð±Ð¾\n   > Â«ÐšÐ¾Ð»Ð¸Â» Ð¼Ð¾Ð¶Ðµ Ð¼Ð°Ñ‚Ð¸ ÑƒÐ¼Ð¾Ð²Ð½Ðµ Ð·Ð½Ð°Ñ‡ÐµÐ½Ð½Ñ: Â«ÐšÐ¾Ð»Ð¸ Ð¼Ð°Ñ‚Ð¸Ð¼ÐµÑˆ Ñ‡Ð°Ñ...Â»\n\n5. Ð¯ÐºÐµ Ð· Ð½Ð°Ð²ÐµÐ´ÐµÐ½Ð¸Ñ… Ñ€ÐµÑ‡ÐµÐ½ÑŒ Ð¼Ñ–ÑÑ‚Ð¸Ñ‚ÑŒ Ð¿Ð¾Ð¼Ð¸Ð»ÐºÑƒ Ð² Ð¿ÑƒÐ½ÐºÑ‚ÑƒÐ°Ñ†Ñ–Ñ— ÑƒÐ¼Ð¾Ð²Ð½Ð¾Ð³Ð¾ Ñ€ÐµÑ‡ÐµÐ½Ð½Ñ Ð· Ð²Ð¸ÐºÐ¾Ñ€Ð¸ÑÑ‚Ð°Ð½Ð½ÑÐ¼ ÑÐ¿Ð¾Ð»ÑƒÑ‡Ð½Ð¸ÐºÐ° Â«ÑÐºÑ‰Ð¾Â»?\n   - [ ] Ð¯ÐºÑ‰Ð¾ Ñ…Ð¾Ñ‡ÐµÑˆ, Ñ Ð¼Ð¾Ð¶Ñƒ Ð´Ð¾Ð¿Ð¾Ð¼Ð¾Ð³Ñ‚Ð¸ Ñ‚Ð¾Ð±Ñ–.\n   - [x] Ð¯ÐºÑ‰Ð¾ Ñ…Ð¾Ñ‡ÐµÑˆ Ñ Ð¼Ð¾Ð¶Ñƒ Ð´Ð¾Ð¿Ð¾Ð¼Ð¾Ð³Ñ‚Ð¸ Ñ‚Ð¾Ð±Ñ–.\n   - [ ] Ð¯ Ð¼Ð¾Ð¶Ñƒ Ð´Ð¾Ð¿Ð¾Ð¼Ð¾Ð³Ñ‚Ð¸ Ñ‚Ð¾Ð±Ñ–, ÑÐºÑ‰Ð¾ Ñ…Ð¾Ñ‡ÐµÑˆ.\n   - [ ] Ð¯ÐºÑ‰Ð¾ Ñ…Ð¾Ñ‡ÐµÑˆ â€” Ð´Ð¾Ð¿Ð¾Ð¼Ð¾Ð¶Ñƒ.\n   > ÐŸÑ–ÑÐ»Ñ Ð¿Ñ–Ð´Ñ€ÑÐ´Ð½Ð¾Ð³Ð¾ Ñ€ÐµÑ‡ÐµÐ½Ð½Ñ Ð· Â«ÑÐºÑ‰Ð¾Â» Ð¿Ð¾Ñ‚Ñ€Ñ–Ð±Ð½Ð° ÐºÐ¾Ð¼Ð°.\n\n6. Ð¯ÐºÐ¸Ð¹ Ñ‡Ð°ÑÐ¾Ð²Ð¸Ð¹ Ð¿Ð»Ð°Ð½ Ð¿Ñ–Ð´Ñ…Ð¾Ð´Ð¸Ñ‚ÑŒ Ð´Ð»Ñ Ð²Ð¸Ñ€Ð°Ð¶ÐµÐ½Ð½Ñ Ð·Ð°Ð³Ð°Ð»ÑŒÐ½Ð¾Ñ— Ñ–ÑÑ‚Ð¸Ð½Ð¸ Ð°Ð±Ð¾ Ð¿Ð¾ÑÑ‚Ñ–Ð¹Ð½Ð¾Ð³Ð¾ Ð·Ð²'ÑÐ·ÐºÑƒ?\n   - [x] Ð¢ÐµÐ¿ÐµÑ€Ñ–ÑˆÐ½Ñ–Ð¹ Ñ‡Ð°Ñ Ð² ÑƒÐ¼Ð¾Ð²Ñ– + Ñ‚ÐµÐ¿ÐµÑ€Ñ–ÑˆÐ½Ñ–Ð¹ Ñ‡Ð°Ñ Ñƒ Ð½Ð°ÑÐ»Ñ–Ð´ÐºÑƒ.\n   - [ ] ÐœÐ°Ð¹Ð±ÑƒÑ‚Ð½Ñ–Ð¹ Ñ‡Ð°Ñ Ð² ÑƒÐ¼Ð¾Ð²Ñ– + Ð¼Ð°Ð¹Ð±ÑƒÑ‚Ð½Ñ–Ð¹ Ñ‡Ð°Ñ Ñƒ Ð½Ð°ÑÐ»Ñ–Ð´ÐºÑƒ.\n   - [ ] ÐœÐ¸Ð½ÑƒÐ»Ð¸Ð¹ Ñ‡Ð°Ñ Ð² Ð¾Ð±Ð¾Ñ… Ñ‡Ð°ÑÑ‚Ð¸Ð½Ð°Ñ… Ñ€ÐµÑ‡ÐµÐ½Ð½Ñ.\n   - [ ] Ð£Ð¼Ð¾Ð²Ð½Ð¸Ð¹ ÑÐ¿Ð¾ÑÑ–Ð± Ð² Ð¾Ð±Ð¾Ñ… Ñ‡Ð°ÑÑ‚Ð¸Ð½Ð°Ñ… Ñ€ÐµÑ‡ÐµÐ½Ð½Ñ.\n   > Ð—Ð°Ð³Ð°Ð»ÑŒÐ½Ñ– Ñ–ÑÑ‚Ð¸Ð½Ð¸: Ñ‚ÐµÐ¿ÐµÑ€Ñ–ÑˆÐ½Ñ–Ð¹ + Ñ‚ÐµÐ¿ÐµÑ€Ñ–ÑˆÐ½Ñ–Ð¹.\n\n7. Ð¯ÐºÐ° ÐºÐ¾Ð½ÑÑ‚Ñ€ÑƒÐºÑ†Ñ–Ñ Ñ” Ð¿Ñ€Ð°Ð²Ð¸Ð»ÑŒÐ½Ð¸Ð¼ ÐµÐºÐ²Ñ–Ð²Ð°Ð»ÐµÐ½Ñ‚Ð¾Ð¼ Ð°Ð½Ð³Ð»Ñ–Ð¹ÑÑŒÐºÐ¾Ð³Ð¾ Â«in case ifÂ» Ð´Ð»Ñ Ð²Ð¸Ñ€Ð°Ð¶ÐµÐ½Ð½Ñ Ð·Ð°Ð¿Ð°ÑÐ½Ð¾Ð³Ð¾ Ð¿Ð»Ð°Ð½Ñƒ?\n   - [ ] ÑÐºÑ‰Ð¾ Ñ‚Ñ–Ð»ÑŒÐºÐ¸\n   - [ ] Ñ‚Ð¾Ð¼Ñƒ Ñ‰Ð¾\n   - [x] Ñƒ Ð²Ð¸Ð¿Ð°Ð´ÐºÑƒ ÑÐºÑ‰Ð¾\n   - [ ] Ñ…Ð¾Ñ‡Ð° Ð±\n   > Â«Ð£ Ð²Ð¸Ð¿Ð°Ð´ÐºÑƒ ÑÐºÑ‰Ð¾Â» = in case if.\n\n8. Ð¯Ðº Ð¿Ñ€Ð°Ð²Ð¸Ð»ÑŒÐ½Ð¾ Ð²Ð¸Ñ€Ð°Ð·Ð¸Ñ‚Ð¸ ÑƒÐ¼Ð¾Ð²Ñƒ Â«ÑÐºÑ‰Ð¾ Ð½Ðµ Ð±ÑƒÐ´Ðµ Ð´Ð¾Ñ‰ÑƒÂ» Ð² Ñ€ÐµÑ‡ÐµÐ½Ð½Ñ– Â«ÐœÐ¸ Ð¿Ñ–Ð´ÐµÐ¼Ð¾ Ð½Ð° Ð¿Ñ€Ð¾Ð³ÑƒÐ»ÑÐ½ÐºÑƒÂ»?\n   - [ ] ÐœÐ¸ Ð¿Ñ–Ð´ÐµÐ¼Ð¾ Ð½Ð° Ð¿Ñ€Ð¾Ð³ÑƒÐ»ÑÐ½ÐºÑƒ ÑÐºÑ‰Ð¾ Ð´Ð¾Ñ‰ Ð½Ðµ Ð±ÑƒÐ´Ðµ.\n   - [x] ÐœÐ¸ Ð¿Ñ–Ð´ÐµÐ¼Ð¾ Ð½Ð° Ð¿Ñ€Ð¾Ð³ÑƒÐ»ÑÐ½ÐºÑƒ, ÑÐºÑ‰Ð¾ Ð½Ðµ Ð±ÑƒÐ´Ðµ Ð´Ð¾Ñ‰Ñƒ.\n   - [ ] ÐœÐ¸ Ð¿Ñ–Ð´ÐµÐ¼Ð¾ Ð½Ð° Ð¿Ñ€Ð¾Ð³ÑƒÐ»ÑÐ½ÐºÑƒ, ÑÐºÑ‰Ð¾ Ð±ÑƒÐ´Ðµ Ð½Ðµ Ð´Ð¾Ñ‰Ñƒ.\n   - [ ] ÐœÐ¸ Ð¿Ñ–Ð´ÐµÐ¼Ð¾ Ð½Ð° Ð¿Ñ€Ð¾Ð³ÑƒÐ»ÑÐ½ÐºÑƒ Ð½Ðµ ÑÐºÑ‰Ð¾ Ð±ÑƒÐ´Ðµ Ð´Ð¾Ñ‰.\n   > ÐŸÑ€Ð°Ð²Ð¸Ð»ÑŒÐ½Ð¸Ð¹ Ð¿Ð¾Ñ€ÑÐ´Ð¾Ðº: Â«ÑÐºÑ‰Ð¾ Ð½Ðµ Ð±ÑƒÐ´Ðµ Ð´Ð¾Ñ‰ÑƒÂ».\n\n---\n\n## match-up: Ð—'Ñ”Ð´Ð½Ð°Ð¹Ñ‚Ðµ ÑƒÐ¼Ð¾Ð²Ñƒ Ð· Ð½Ð°ÑÐ»Ñ–Ð´ÐºÐ¾Ð¼\n\n- Ð¯ÐºÑ‰Ð¾ Ð±ÑƒÐ´Ðµ Ð³Ð°Ñ€Ð½Ð° Ð¿Ð¾Ð³Ð¾Ð´Ð° :: Ð¼Ð¸ Ð¿Ñ–Ð´ÐµÐ¼Ð¾ Ð½Ð° Ð¿Ñ–ÐºÐ½Ñ–Ðº.\n- Ð¯ÐºÑ‰Ð¾ Ð¼Ð°Ñ‚Ð¸Ð¼ÐµÑˆ Ñ‡Ð°Ñ :: Ð·Ð°Ñ‚ÐµÐ»ÐµÑ„Ð¾Ð½ÑƒÐ¹ Ð¼ÐµÐ½Ñ– Ð²Ð²ÐµÑ‡ÐµÑ€Ñ–.\n- Ð¯ÐºÑ‰Ð¾ Ñ…Ð¾Ñ‡ÐµÑˆ :: Ñ Ð¼Ð¾Ð¶Ñƒ Ð´Ð¾Ð¿Ð¾Ð¼Ð¾Ð³Ñ‚Ð¸ Ñ‚Ð¾Ð±Ñ–.\n- Ð¯ÐºÑ‰Ð¾ Ð²Ñ–Ð½ Ð·Ð°Ð¿Ñ–Ð·Ð½Ð¸Ñ‚ÑŒÑÑ :: Ð¼Ð¸ Ð¿Ð¾Ñ‡Ð½ÐµÐ¼Ð¾ Ð±ÐµÐ· Ð½ÑŒÐ¾Ð³Ð¾.\n- Ð¯ÐºÑ‰Ð¾ Ð´Ð¾Ñ‰Ð¸Ñ‚Ð¸Ð¼Ðµ :: Ð²Ñ–Ð·ÑŒÐ¼Ð¸ Ð¿Ð°Ñ€Ð°ÑÐ¾Ð»ÑŒÐºÑƒ Ð· ÑÐ¾Ð±Ð¾ÑŽ.\n- Ð¯ÐºÑ‰Ð¾ Ñ‚Ð¸ Ð½Ðµ Ñ€Ð¾Ð·ÑƒÐ¼Ñ–Ñ”Ñˆ :: Ð¿Ð¸Ñ‚Ð°Ð¹ Ð±ÐµÐ· Ð²Ð°Ð³Ð°Ð½ÑŒ.\n- Ð¯ÐºÑ‰Ð¾ Ð¿Ð¾Ð³Ð¾Ð´Ð¸ÑˆÑÑ :: Ð¼Ð¸ Ð¿Ñ–Ð´Ð¿Ð¸ÑˆÐµÐ¼Ð¾ ÐºÐ¾Ð½Ñ‚Ñ€Ð°ÐºÑ‚ Ð·Ð°Ð²Ñ‚Ñ€Ð°.\n- Ð¯ÐºÑ‰Ð¾ Ð²Ð¸Ð½Ð¸ÐºÐ½ÑƒÑ‚ÑŒ Ð·Ð°Ð¿Ð¸Ñ‚Ð°Ð½Ð½Ñ :: Ð·Ð²ÐµÑ€Ð½Ñ–Ñ‚ÑŒÑÑ Ð´Ð¾ Ð¼ÐµÐ½ÐµÐ´Ð¶ÐµÑ€Ð°.\n- Ð¯ÐºÑ‰Ð¾ Ð·Ð°ÐºÑ–Ð½Ñ‡Ð¸Ñˆ Ñ€Ð°Ð½Ñ–ÑˆÐµ :: Ð¼Ð¾Ð¶ÐµÑˆ Ñ–Ñ‚Ð¸ Ð´Ð¾Ð´Ð¾Ð¼Ñƒ.\n- Ð¯ÐºÑ‰Ð¾ Ð²ÑÐµ Ð±ÑƒÐ´Ðµ Ð´Ð¾Ð±Ñ€Ðµ :: Ð¿Ð¾Ð±Ð°Ñ‡Ð¸Ð¼Ð¾ÑÑ Ð² Ð¿Ð¾Ð½ÐµÐ´Ñ–Ð»Ð¾Ðº.\n- Ð£ Ð²Ð¸Ð¿Ð°Ð´ÐºÑƒ ÑÐºÑ‰Ð¾ Ð·Ð°Ð±ÑƒÐ´ÐµÑˆ :: Ð½Ð°Ð³Ð°Ð´Ð°ÑŽ Ñ‚Ð¾Ð±Ñ– Ð·Ð°Ð²Ñ‚Ñ€Ð°.\n- Ð—Ð° ÑƒÐ¼Ð¾Ð²Ð¸ Ñ‰Ð¾ Ð²ÑÑ– Ð¿Ð¾Ð³Ð¾Ð´ÑÑ‚ÑŒÑÑ :: Ð¿Ð¾Ñ‡Ð½ÐµÐ¼Ð¾ Ñ€Ð¾Ð±Ð¾Ñ‚Ñƒ Ð½ÐµÐ³Ð°Ð¹Ð½Ð¾.\n\n---\n\n## fill-in: Ð”Ð¾Ð¿Ð¾Ð²Ð½Ñ–Ñ‚ÑŒ Ñ€ÐµÑ‡ÐµÐ½Ð½Ñ Ð¿Ñ€Ð°Ð²Ð¸Ð»ÑŒÐ½Ð¾ÑŽ Ñ„Ð¾Ñ€Ð¼Ð¾ÑŽ\n\n1. Ð¯ÐºÑ‰Ð¾ Ð²Ñ–Ð½ ___ Ð²Ñ‡Ð°ÑÐ½Ð¾, Ð¼Ð¸ Ð¿Ð¾Ð³Ð¾Ð²Ð¾Ñ€Ð¸Ð¼Ð¾ Ð¿Ñ€Ð¾ Ð²Ð°Ð¶Ð»Ð¸Ð²Ð¸Ð¹ Ð¿Ñ€Ð¾Ñ”ÐºÑ‚.\n   > [!answer] Ð¿Ñ€Ð¸Ð¹Ð´Ðµ\n   > [!options] Ð¿Ñ€Ð¸Ð¹Ð´Ðµ | Ð¿Ñ€Ð¸Ñ…Ð¾Ð´Ð¸Ñ‚ÑŒ | Ð¿Ñ€Ð¸Ð¹ÑˆÐ¾Ð² | Ð¿Ñ€Ð¸Ñ…Ð¾Ð´Ð¸Ð²\n\n2. ÐœÐ¸ Ð¿Ñ–Ð´ÐµÐ¼Ð¾ Ð½Ð° Ð¿Ñ€Ð¾Ð³ÑƒÐ»ÑÐ½ÐºÑƒ, ÑÐºÑ‰Ð¾ Ð¿Ð¾Ð³Ð¾Ð´Ð° ___ Ð³Ð°Ñ€Ð½Ð¾ÑŽ.\n   > [!answer] Ð±ÑƒÐ´Ðµ\n   > [!options] Ð±ÑƒÐ´Ðµ | Ñ” | Ð±ÑƒÐ»Ð° | Ð±ÑƒÐ²Ð°Ð»Ð°\n\n3. Ð¯ÐºÑ‰Ð¾ Ñ‚Ð¸ ___ Ð´Ð¾Ð¿Ð¾Ð¼Ð¾Ð³Ñ‚Ð¸, Ñ Ð±ÑƒÐ´Ñƒ Ð´ÑƒÐ¶Ðµ Ð²Ð´ÑÑ‡Ð½Ð¸Ð¹ Ñ‚Ð¾Ð±Ñ–.\n   > [!answer] Ð·Ð¼Ð¾Ð¶ÐµÑˆ\n   > [!options] Ð·Ð¼Ð¾Ð¶ÐµÑˆ | Ð¼Ð¾Ð¶ÐµÑˆ | Ð·Ð¼Ñ–Ð³ | Ð¼Ð¾Ð³Ñ‚Ð¸Ð¼ÐµÑˆ\n\n4. Ð¯ÐºÑ‰Ð¾ Ñƒ Ð²Ð°Ñ ___ Ð·Ð°Ð¿Ð¸Ñ‚Ð°Ð½Ð½Ñ, Ð·Ð²ÐµÑ€Ð½Ñ–Ñ‚ÑŒÑÑ Ð´Ð¾ Ð°Ð´Ð¼Ñ–Ð½Ñ–ÑÑ‚Ñ€Ð°Ñ‚Ð¾Ñ€Ð°.\n   > [!answer] Ð²Ð¸Ð½Ð¸ÐºÐ½ÑƒÑ‚ÑŒ\n   > [!options] Ð²Ð¸Ð½Ð¸ÐºÐ½ÑƒÑ‚ÑŒ | Ð²Ð¸Ð½Ð¸ÐºÐ°ÑŽÑ‚ÑŒ | Ð²Ð¸Ð½Ð¸ÐºÐ»Ð¸ | Ð²Ð¸Ð½Ð¸ÐºÐ°Ñ‚Ð¸Ð¼ÑƒÑ‚ÑŒ\n\n5. Ð¯ Ð·Ð°Ñ‚ÐµÐ»ÐµÑ„Ð¾Ð½ÑƒÑŽ Ñ‚Ð¾Ð±Ñ– Ð²Ð²ÐµÑ‡ÐµÑ€Ñ–, ÑÐºÑ‰Ð¾ ___ Ñ€Ð°Ð½Ñ–ÑˆÐµ Ð· Ñ€Ð¾Ð±Ð¾Ñ‚Ð¸.\n   > [!answer] Ð·Ð°ÐºÑ–Ð½Ñ‡Ñƒ\n   > [!options] Ð·Ð°ÐºÑ–Ð½Ñ‡Ñƒ | Ð·Ð°ÐºÑ–Ð½Ñ‡Ð¸Ð² | Ð·Ð°ÐºÑ–Ð½Ñ‡ÑƒÑŽ | Ð·Ð°ÐºÑ–Ð½Ñ‡ÑƒÐ²Ð°Ð²\n\n6. Ð¯ÐºÑ‰Ð¾ Ð²Ð¾Ð´Ð° ___ Ð´Ð¾ ÑÑ‚Ð° Ð³Ñ€Ð°Ð´ÑƒÑÑ–Ð², Ð²Ð¾Ð½Ð° Ð¿Ð¾Ñ‡Ð¸Ð½Ð°Ñ” ÐºÐ¸Ð¿Ñ–Ñ‚Ð¸.\n   > [!answer] Ð½Ð°Ð³Ñ€Ñ–Ð²Ð°Ñ”Ñ‚ÑŒÑÑ\n   > [!options] Ð½Ð°Ð³Ñ€Ñ–Ð²Ð°Ñ”Ñ‚ÑŒÑÑ | Ð½Ð°Ð³Ñ€Ñ–Ñ”Ñ‚ÑŒÑÑ | Ð½Ð°Ð³Ñ€Ñ–Ð»Ð°ÑÑ | Ð½Ð°Ð³Ñ€Ñ–Ð²Ð°Ñ‚Ð¸Ð¼ÐµÑ‚ÑŒÑÑ\n\n7. Ð¯ÐºÑ‰Ð¾ Ð½Ðµ ___ Ñ‡Ð°ÑÑƒ, Ð¿ÐµÑ€ÐµÐ½ÐµÑÐµÐ¼Ð¾ Ð·ÑƒÑÑ‚Ñ€Ñ–Ñ‡ Ð½Ð° Ð½Ð°ÑÑ‚ÑƒÐ¿Ð½Ð¸Ð¹ Ñ‚Ð¸Ð¶Ð´ÐµÐ½ÑŒ.\n   > [!answer] Ð±ÑƒÐ´Ðµ\n   > [!options] Ð±ÑƒÐ´Ðµ | Ñ” | Ð±ÑƒÐ»Ð¾ | Ð±ÑƒÐ²Ð°Ð»Ð¾\n\n8. ÐœÐ¸ Ð¿Ð¾Ñ‡Ð½ÐµÐ¼Ð¾ Ð½Ð°Ñ€Ð°Ð´Ñƒ Ð±ÐµÐ· Ð½ÑŒÐ¾Ð³Ð¾, ÑÐºÑ‰Ð¾ Ð²Ñ–Ð½ ___ Ð¿Ñ€Ð¾Ñ‚ÑÐ³Ð¾Ð¼ Ð³Ð¾Ð´Ð¸Ð½Ð¸.\n   > [!answer] Ð½Ðµ Ð¿Ñ€Ð¸Ð¹Ð´Ðµ\n   > [!options] Ð½Ðµ Ð¿Ñ€Ð¸Ð¹Ð´Ðµ | Ð½Ðµ Ð¿Ñ€Ð¸Ñ…Ð¾Ð´Ð¸Ñ‚ÑŒ | Ð½Ðµ Ð¿Ñ€Ð¸Ð¹ÑˆÐ¾Ð² | Ð½Ðµ Ð¿Ñ€Ð¸Ñ…Ð¾Ð´Ð¸Ð²\n\n---\n\n## true-false: ÐŸÑ€Ð°Ð²Ð´Ð° Ñ‡Ð¸ Ð½ÐµÐ¿Ñ€Ð°Ð²Ð´Ð°?\n\n1. Ð ÐµÐ°Ð»ÑŒÐ½Ð° ÑƒÐ¼Ð¾Ð²Ð° Ð· Â«ÑÐºÑ‰Ð¾Â» Ð¾Ð¿Ð¸ÑÑƒÑ” ÑÐ¸Ñ‚ÑƒÐ°Ñ†Ñ–Ñ—, Ñ‰Ð¾ Ð¼Ð¾Ð¶ÑƒÑ‚ÑŒ ÑÐ¿Ñ€Ð°Ð²Ð´Ñ– ÑÑ‚Ð°Ñ‚Ð¸ÑÑ.\n   - [x] ÐŸÑ€Ð°Ð²Ð´Ð°\n   - [ ] ÐÐµÐ¿Ñ€Ð°Ð²Ð´Ð°\n\n2. Ð£ Ñ€ÐµÐ°Ð»ÑŒÐ½Ð¸Ñ… ÑƒÐ¼Ð¾Ð²Ð°Ñ… Ð·Ð°Ð²Ð¶Ð´Ð¸ Ð²Ð¸ÐºÐ¾Ñ€Ð¸ÑÑ‚Ð¾Ð²ÑƒÑ”Ñ‚ÑŒÑÑ Ð¼Ð¸Ð½ÑƒÐ»Ð¸Ð¹ Ñ‡Ð°Ñ Ð´Ñ–Ñ”ÑÐ»Ð¾Ð²Ð°.\n   - [ ] ÐŸÑ€Ð°Ð²Ð´Ð°\n   - [x] ÐÐµÐ¿Ñ€Ð°Ð²Ð´Ð°\n\n3. Ð¡Ð¿Ð¾Ð»ÑƒÑ‡Ð½Ð¸Ðº Â«ÐºÐ¾Ð»Ð¸Â» Ð½Ñ–ÐºÐ¾Ð»Ð¸ Ð½Ðµ Ð¼Ð¾Ð¶Ðµ Ð¼Ð°Ñ‚Ð¸ ÑƒÐ¼Ð¾Ð²Ð½Ð¾Ð³Ð¾ Ð·Ð½Ð°Ñ‡ÐµÐ½Ð½Ñ.\n   - [ ] ÐŸÑ€Ð°Ð²Ð´Ð°\n   - [x] ÐÐµÐ¿Ñ€Ð°Ð²Ð´Ð°\n\n4. ÐŸÑ–ÑÐ»Ñ Ð¿Ñ–Ð´Ñ€ÑÐ´Ð½Ð¾Ð³Ð¾ Ñ€ÐµÑ‡ÐµÐ½Ð½Ñ Ð· Â«ÑÐºÑ‰Ð¾Â» Ð½Ð° Ð¿Ð¾Ñ‡Ð°Ñ‚ÐºÑƒ Ð¿Ð¾Ñ‚Ñ€Ñ–Ð±Ð½Ð° ÐºÐ¾Ð¼Ð°.\n   - [x] ÐŸÑ€Ð°Ð²Ð´Ð°\n   - [ ] ÐÐµÐ¿Ñ€Ð°Ð²Ð´Ð°\n\n5. Â«Ð£ Ð²Ð¸Ð¿Ð°Ð´ÐºÑƒ ÑÐºÑ‰Ð¾Â» Ñ– Â«Ð·Ð° ÑƒÐ¼Ð¾Ð²Ð¸ Ñ‰Ð¾Â» Ñ” Ð°Ð»ÑŒÑ‚ÐµÑ€Ð½Ð°Ñ‚Ð¸Ð²Ð°Ð¼Ð¸ Ð´Ð¾ Â«ÑÐºÑ‰Ð¾Â».\n   - [x] ÐŸÑ€Ð°Ð²Ð´Ð°\n   - [ ] ÐÐµÐ¿Ñ€Ð°Ð²Ð´Ð°\n\n6. Ð”Ð»Ñ Ð·Ð°Ð³Ð°Ð»ÑŒÐ½Ð¸Ñ… Ñ–ÑÑ‚Ð¸Ð½ Ð²Ð¸ÐºÐ¾Ñ€Ð¸ÑÑ‚Ð¾Ð²ÑƒÑŽÑ‚ÑŒ Ñ‚ÐµÐ¿ÐµÑ€Ñ–ÑˆÐ½Ñ–Ð¹ Ñ‡Ð°Ñ Ð² Ð¾Ð±Ð¾Ñ… Ñ‡Ð°ÑÑ‚Ð¸Ð½Ð°Ñ….\n   - [x] ÐŸÑ€Ð°Ð²Ð´Ð°\n   - [ ] ÐÐµÐ¿Ñ€Ð°Ð²Ð´Ð°\n\n7. Ð ÐµÑ‡ÐµÐ½Ð½Ñ Â«Ð¯ÐºÐ±Ð¸ Ð²Ñ–Ð½ Ð¿Ñ€Ð¸Ð¹ÑˆÐ¾Ð²Â» â€” Ñ†Ðµ Ð¿Ñ€Ð¸ÐºÐ»Ð°Ð´ Ñ€ÐµÐ°Ð»ÑŒÐ½Ð¾Ñ— ÑƒÐ¼Ð¾Ð²Ð¸.\n   - [ ] ÐŸÑ€Ð°Ð²Ð´Ð°\n   - [x] ÐÐµÐ¿Ñ€Ð°Ð²Ð´Ð°\n\n8. Ð’ ÑƒÐ¼Ð¾Ð²Ð½Ð¸Ñ… Ñ€ÐµÑ‡ÐµÐ½Ð½ÑÑ… Ð°ÑÐ¿ÐµÐºÑ‚ Ð´Ñ–Ñ”ÑÐ»Ð¾Ð²Ð° Ð½Ðµ Ð¼Ð°Ñ” Ð·Ð½Ð°Ñ‡ÐµÐ½Ð½Ñ Ð²Ð·Ð°Ð³Ð°Ð»Ñ–.\n   - [ ] ÐŸÑ€Ð°Ð²Ð´Ð°\n   - [x] ÐÐµÐ¿Ñ€Ð°Ð²Ð´Ð°\n\n---\n\n## group-sort: Ð Ð¾Ð·Ð¿Ð¾Ð´Ñ–Ð»Ñ–Ñ‚ÑŒ Ð²Ð¸Ñ€Ð°Ð·Ð¸ Ð·Ð° ÐºÐ°Ñ‚ÐµÐ³Ð¾Ñ€Ñ–ÑÐ¼Ð¸\n\n### Ð ÐµÐ°Ð»ÑŒÐ½Ð° ÑƒÐ¼Ð¾Ð²Ð°\n- Ð¯ÐºÑ‰Ð¾ Ð¼Ð°Ñ‚Ð¸Ð¼ÐµÑˆ Ñ‡Ð°Ñ, Ð·Ð°Ñ‚ÐµÐ»ÐµÑ„Ð¾Ð½ÑƒÐ¹.\n- Ð¯ÐºÑ‰Ð¾ Ð²Ñ–Ð½ Ð¿Ñ€Ð¸Ð¹Ð´Ðµ, Ð¿Ð¾Ð³Ð¾Ð²Ð¾Ñ€Ð¸Ð¼Ð¾.\n- Ð¯ÐºÑ‰Ð¾ Ñ…Ð¾Ñ‡ÐµÑˆ, Ð´Ð¾Ð¿Ð¾Ð¼Ð¾Ð¶Ñƒ.\n- Ð¯ÐºÑ‰Ð¾ Ð±ÑƒÐ´Ðµ Ð´Ð¾Ñ‰, Ð²Ñ–Ð·ÑŒÐ¼Ñƒ Ð¿Ð°Ñ€Ð°ÑÐ¾Ð»ÑŒÐºÑƒ.\n\n### ÐÐµÑ€ÐµÐ°Ð»ÑŒÐ½Ð° ÑƒÐ¼Ð¾Ð²Ð°\n- Ð¯ÐºÐ±Ð¸ Ñ Ð¼Ð°Ð² Ñ‡Ð°Ñ, Ð´Ð¾Ð¿Ð¾Ð¼Ñ–Ð³ Ð±Ð¸.\n- Ð¯ÐºÐ±Ð¸ Ð²Ð¾Ð½Ð° Ð¿Ñ€Ð¸Ð¹ÑˆÐ»Ð°, Ð¼Ð¸ Ð± Ð¿Ð¾Ð³Ð¾Ð²Ð¾Ñ€Ð¸Ð»Ð¸.\n- Ð¯ÐºÐ±Ð¸ Ñ Ð±ÑƒÐ² Ð±Ð°Ð³Ð°Ñ‚Ð¸Ð¹, ÐºÑƒÐ¿Ð¸Ð² Ð±Ð¸ Ð±ÑƒÐ´Ð¸Ð½Ð¾Ðº.\n- ÐšÐ¾Ð»Ð¸ Ð± Ñ Ð·Ð½Ð°Ð², ÑÐºÐ°Ð·Ð°Ð² Ð±Ð¸.\n\n### Ð§Ð°ÑÐ¾Ð²Ð¸Ð¹ ÑÐ¿Ð¾Ð»ÑƒÑ‡Ð½Ð¸Ðº (Ð½Ðµ ÑƒÐ¼Ð¾Ð²Ð°)\n- ÐšÐ¾Ð»Ð¸ Ð²Ñ–Ð½ Ð¿Ñ€Ð¸Ð¹ÑˆÐ¾Ð², Ð¼Ð¸ Ð²Ð¶Ðµ Ð¾Ð±Ñ–Ð´Ð°Ð»Ð¸.\n- ÐŸÑ–ÑÐ»Ñ Ñ‚Ð¾Ð³Ð¾ ÑÐº Ð²Ð¾Ð½Ð° Ð¿Ñ–ÑˆÐ»Ð°, Ð¼Ð¸ Ð¿Ð¾Ñ‡Ð°Ð»Ð¸.\n- ÐŸÐ¾ÐºÐ¸ Ð²Ñ–Ð½ Ð¿Ñ€Ð°Ñ†ÑŽÐ²Ð°Ð², Ñ Ñ‡ÐµÐºÐ°Ð»Ð°.\n- Ð¯Ðº Ñ‚Ñ–Ð»ÑŒÐºÐ¸ Ð¿Ð¾Ñ‡Ð°Ð²ÑÑ Ð´Ð¾Ñ‰, Ð¼Ð¸ ÑÑ…Ð¾Ð²Ð°Ð»Ð¸ÑÑ.\n\n### ÐÐ»ÑŒÑ‚ÐµÑ€Ð½Ð°Ñ‚Ð¸Ð²Ð½Ñ– ÑÐ¿Ð¾Ð»ÑƒÑ‡Ð½Ð¸ÐºÐ¸ ÑƒÐ¼Ð¾Ð²Ð¸\n- Ð£ Ð²Ð¸Ð¿Ð°Ð´ÐºÑƒ ÑÐºÑ‰Ð¾ Ð·Ð°Ð±ÑƒÐ´ÐµÑˆ, Ð½Ð°Ð³Ð°Ð´Ð°ÑŽ.\n- Ð—Ð° ÑƒÐ¼Ð¾Ð²Ð¸ Ñ‰Ð¾ Ð²ÑÑ– Ð¿Ð¾Ð³Ð¾Ð´ÑÑ‚ÑŒÑÑ, Ð¿Ð¾Ñ‡Ð½ÐµÐ¼Ð¾.\n- ÐŸÑ€Ð¸ ÑƒÐ¼Ð¾Ð²Ñ– Ñ‰Ð¾ Ð¾Ð¿Ð»Ð°Ñ‚Ð¸Ñ‚Ðµ, Ð´Ð¾ÑÑ‚Ð°Ð²Ð¸Ð¼Ð¾.\n- Ð£ Ñ€Ð°Ð·Ñ– ÑÐºÑ‰Ð¾ Ð½Ðµ Ð²ÑÑ‚Ð¸Ð³Ð½ÐµÐ¼Ð¾, Ð¿Ð¾Ð²Ñ–Ð´Ð¾Ð¼Ð¸Ð¼Ð¾.\n\n---\n\n## unjumble: Ð¡ÐºÐ»Ð°Ð´Ñ–Ñ‚ÑŒ Ñ€ÐµÑ‡ÐµÐ½Ð½Ñ Ð· Ñ€Ð¾Ð·ÑÐ¸Ð¿Ð°Ð½Ð¸Ñ… ÑÐ»Ñ–Ð²\n\n1. Ð¼Ð°Ñ‚Ð¸Ð¼Ñƒ / ÑÐºÑ‰Ð¾ / Ð·Ð°Ñ‚ÐµÐ»ÐµÑ„Ð¾Ð½ÑƒÑŽ / Ñ‡Ð°Ñ / Ñ‚Ð¾Ð±Ñ– / Ð²Ð²ÐµÑ‡ÐµÑ€Ñ– / Ñ / , / Ð¾Ð±Ð¾Ð²'ÑÐ·ÐºÐ¾Ð²Ð¾ / Ð²Ñ–Ð»ÑŒÐ½Ð¸Ð¹ / Ð½Ð° / Ñ‚Ð¸Ð¶Ð½Ñ– / Ñ†ÑŒÐ¾Ð¼Ñƒ / Ð·Ð°Ð²Ñ‚Ñ€Ð°\n   > [!answer] Ð¯ÐºÑ‰Ð¾ Ð¼Ð°Ñ‚Ð¸Ð¼Ñƒ Ð²Ñ–Ð»ÑŒÐ½Ð¸Ð¹ Ñ‡Ð°Ñ Ð½Ð° Ñ†ÑŒÐ¾Ð¼Ñƒ Ñ‚Ð¸Ð¶Ð½Ñ–, Ñ Ð¾Ð±Ð¾Ð²'ÑÐ·ÐºÐ¾Ð²Ð¾ Ð·Ð°Ñ‚ÐµÐ»ÐµÑ„Ð¾Ð½ÑƒÑŽ Ñ‚Ð¾Ð±Ñ– Ð²Ð²ÐµÑ‡ÐµÑ€Ñ– Ð·Ð°Ð²Ñ‚Ñ€Ð°.\n\n2. Ð¿Ð¾Ð³Ð¾Ð´Ð° / Ð±ÑƒÐ´Ðµ / Ð¼Ð¸ / Ð¿Ñ€Ð¾Ð³ÑƒÐ»ÑÐ½ÐºÑƒ / Ð½Ð° / Ð¿Ñ–Ð´ÐµÐ¼Ð¾ / Ð³Ð°Ñ€Ð½Ð¾ÑŽ / ÑÐºÑ‰Ð¾ / , / Ð² / Ð¿Ð°Ñ€Ðº / Ð¼Ñ–ÑÑŒÐºÐ¸Ð¹\n   > [!answer] Ð¯ÐºÑ‰Ð¾ Ð¿Ð¾Ð³Ð¾Ð´Ð° Ð±ÑƒÐ´Ðµ Ð³Ð°Ñ€Ð½Ð¾ÑŽ, Ð¼Ð¸ Ð¿Ñ–Ð´ÐµÐ¼Ð¾ Ð½Ð° Ð¿Ñ€Ð¾Ð³ÑƒÐ»ÑÐ½ÐºÑƒ Ð² Ð¼Ñ–ÑÑŒÐºÐ¸Ð¹ Ð¿Ð°Ñ€Ðº.\n\n3. Ð·Ð°Ð¿Ñ–Ð·Ð½Ð¸Ñ‚ÑŒÑÑ / Ð²Ñ–Ð½ / ÑÐºÑ‰Ð¾ / , / Ð¼Ð¸ / Ð±ÐµÐ· / Ð¿Ð¾Ñ‡Ð½ÐµÐ¼Ð¾ / Ð½Ð°Ñ€Ð°Ð´Ð¸ / Ð½ÑŒÐ¾Ð³Ð¾ / Ð¿Ñ€Ð¾Ð²ÐµÐ´ÐµÐ½Ð½Ñ / Ð²Ð°Ð¶Ð»Ð¸Ð²Ð¾Ñ— / ÑÑŒÐ¾Ð³Ð¾Ð´Ð½Ñ– / Ð¾ / Ð´ÐµÑÑÑ‚Ñ–Ð¹ / Ð³Ð¾Ð´Ð¸Ð½Ñ–\n   > [!answer] Ð¯ÐºÑ‰Ð¾ Ð²Ñ–Ð½ Ð·Ð°Ð¿Ñ–Ð·Ð½Ð¸Ñ‚ÑŒÑÑ ÑÑŒÐ¾Ð³Ð¾Ð´Ð½Ñ–, Ð¼Ð¸ Ð¿Ð¾Ñ‡Ð½ÐµÐ¼Ð¾ Ð¿Ñ€Ð¾Ð²ÐµÐ´ÐµÐ½Ð½Ñ Ð²Ð°Ð¶Ð»Ð¸Ð²Ð¾Ñ— Ð½Ð°Ñ€Ð°Ð´Ð¸ Ð¾ Ð´ÐµÑÑÑ‚Ñ–Ð¹ Ð³Ð¾Ð´Ð¸Ð½Ñ– Ð±ÐµÐ· Ð½ÑŒÐ¾Ð³Ð¾.\n\n4. Ð·Ð°Ð¿Ð¸Ñ‚Ð°Ð½Ð½Ñ / Ð²Ð¸Ð½Ð¸ÐºÐ½ÑƒÑ‚ÑŒ / Ð°Ð´Ð¼Ñ–Ð½Ñ–ÑÑ‚Ñ€Ð°Ñ‚Ð¾Ñ€Ð° / Ð´Ð¾ / ÑÐºÑ‰Ð¾ / Ð·Ð²ÐµÑ€Ð½Ñ–Ñ‚ÑŒÑÑ / , / Ñƒ / Ð²Ð°Ñ / Ð½Ð°ÑˆÐ¾Ð³Ð¾ / Ð±ÑƒÐ´ÑŒ / Ð»Ð°ÑÐºÐ° / Ð½ÐµÐ³Ð°Ð¹Ð½Ð¾ / Ð¾Ñ„Ñ–ÑÑƒ\n   > [!answer] Ð¯ÐºÑ‰Ð¾ Ñƒ Ð²Ð°Ñ Ð²Ð¸Ð½Ð¸ÐºÐ½ÑƒÑ‚ÑŒ Ð·Ð°Ð¿Ð¸Ñ‚Ð°Ð½Ð½Ñ, Ð±ÑƒÐ´ÑŒ Ð»Ð°ÑÐºÐ°, Ð½ÐµÐ³Ð°Ð¹Ð½Ð¾ Ð·Ð²ÐµÑ€Ð½Ñ–Ñ‚ÑŒÑÑ Ð´Ð¾ Ð½Ð°ÑˆÐ¾Ð³Ð¾ Ð°Ð´Ð¼Ñ–Ð½Ñ–ÑÑ‚Ñ€Ð°Ñ‚Ð¾Ñ€Ð° Ð¾Ñ„Ñ–ÑÑƒ.\n\n5. Ñƒ / ÑÐºÑ‰Ð¾ / Ð·Ð°Ð±ÑƒÐ´ÐµÑˆ / Ð²Ð¸Ð¿Ð°Ð´ÐºÑƒ / , / Ð½Ð°Ð³Ð°Ð´Ð°ÑŽ / Ñ / Ñ‚Ð¾Ð±Ñ– / Ð¿Ñ€Ð¾ / Ð·ÑƒÑÑ‚Ñ€Ñ–Ñ‡ / Ð²Ð°Ð¶Ð»Ð¸Ð²Ñƒ / Ð·Ð°Ð²Ñ‚Ñ€Ð°\n   > [!answer] Ð£ Ð²Ð¸Ð¿Ð°Ð´ÐºÑƒ ÑÐºÑ‰Ð¾ Ð·Ð°Ð±ÑƒÐ´ÐµÑˆ, Ñ Ð½Ð°Ð³Ð°Ð´Ð°ÑŽ Ñ‚Ð¾Ð±Ñ– Ð¿Ñ€Ð¾ Ð²Ð°Ð¶Ð»Ð¸Ð²Ñƒ Ð·ÑƒÑÑ‚Ñ€Ñ–Ñ‡ Ð·Ð°Ð²Ñ‚Ñ€Ð°.\n\n6. Ð·Ð°ÐºÑ–Ð½Ñ‡Ñƒ / Ñ€Ð°Ð½Ñ–ÑˆÐµ / Ñ / ÑÐºÑ‰Ð¾ / , / Ð´Ð¾Ð´Ð¾Ð¼Ñƒ / Ð·Ð¼Ð¾Ð¶Ñƒ / Ð¿Ñ–Ñ‚Ð¸ / Ñ€Ð¾Ð±Ð¾Ñ‚Ñƒ / ÑÑŒÐ¾Ð³Ð¾Ð´Ð½Ñ– / Ð²Ð°Ð¶Ð»Ð¸Ð²Ñƒ / Ñ†ÑŽ\n   > [!answer] Ð¯ÐºÑ‰Ð¾ Ñ Ð·Ð°ÐºÑ–Ð½Ñ‡Ñƒ Ñ†ÑŽ Ð²Ð°Ð¶Ð»Ð¸Ð²Ñƒ Ñ€Ð¾Ð±Ð¾Ñ‚Ñƒ Ñ€Ð°Ð½Ñ–ÑˆÐµ, Ð·Ð¼Ð¾Ð¶Ñƒ Ð¿Ñ–Ñ‚Ð¸ Ð´Ð¾Ð´Ð¾Ð¼Ñƒ ÑÑŒÐ¾Ð³Ð¾Ð´Ð½Ñ–.\n\n---\n\n## error-correction: Ð—Ð½Ð°Ð¹Ð´Ñ–Ñ‚ÑŒ Ñ– Ð²Ð¸Ð¿Ñ€Ð°Ð²Ñ‚Ðµ Ð¿Ð¾Ð¼Ð¸Ð»ÐºÑƒ\n\n1. Ð¯ÐºÑ‰Ð¾ Ð²Ñ–Ð½ Ð¿Ñ€Ð¸Ð¹Ð´Ðµ, Ñ ÐºÐ°Ð¶Ñƒ Ð¹Ð¾Ð¼Ñƒ Ð¿Ñ€Ð°Ð²Ð´Ñƒ Ð¿Ñ€Ð¾ ÑÐ¸Ñ‚ÑƒÐ°Ñ†Ñ–ÑŽ.\n   > [!error] ÐºÐ°Ð¶Ñƒ\n   > [!answer] ÑÐºÐ°Ð¶Ñƒ\n   > [!options] ÑÐºÐ°Ð¶Ñƒ | ÐºÐ°Ð·Ð°Ñ‚Ð¸Ð¼Ñƒ | Ð³Ð¾Ð²Ð¾Ñ€ÑŽ | ÑÐºÐ°Ð·Ð°Ð²\n   > [!explanation] Ð’ Ð¾Ð±Ð¾Ñ… Ñ‡Ð°ÑÑ‚Ð¸Ð½Ð°Ñ… Ð¿Ð¾Ñ‚Ñ€Ñ–Ð±ÐµÐ½ Ð¼Ð°Ð¹Ð±ÑƒÑ‚Ð½Ñ–Ð¹ Ñ‡Ð°Ñ Ð´Ð»Ñ ÐºÐ¾Ð½ÐºÑ€ÐµÑ‚Ð½Ð¾Ñ— ÑÐ¸Ñ‚ÑƒÐ°Ñ†Ñ–Ñ—.\n\n2. Ð¯ÐºÐ±Ð¸ Ð²Ñ–Ð½ Ð¿Ñ€Ð¸Ð¹Ð´Ðµ Ð²Ñ‡Ð°ÑÐ½Ð¾, Ð¼Ð¸ Ð¿Ð¾Ð³Ð¾Ð²Ð¾Ñ€Ð¸Ð¼Ð¾ Ð¿Ñ€Ð¾ Ð²Ð°Ð¶Ð»Ð¸Ð²Ñ– ÑÐ¿Ñ€Ð°Ð²Ð¸.\n   > [!error] Ð¯ÐºÐ±Ð¸\n   > [!answer] Ð¯ÐºÑ‰Ð¾\n   > [!options] Ð¯ÐºÑ‰Ð¾ | ÐšÐ¾Ð»Ð¸ Ð± | ÐšÐ¾Ð»Ð¸ | Ð¥Ð¾Ñ‡Ð°\n   > [!explanation] Ð”Ð»Ñ Ñ€ÐµÐ°Ð»ÑŒÐ½Ð¾Ñ— ÑƒÐ¼Ð¾Ð²Ð¸ Ð²Ð¸ÐºÐ¾Ñ€Ð¸ÑÑ‚Ð¾Ð²ÑƒÑ”Ð¼Ð¾ Â«ÑÐºÑ‰Ð¾Â», Ð½Ðµ Â«ÑÐºÐ±Ð¸Â».\n\n3. Ð¯ÐºÑ‰Ð¾ Ð¼Ð°Ñ‚Ð¸Ð¼ÐµÑˆ Ñ‡Ð°Ñ Ð·Ð°Ñ‚ÐµÐ»ÐµÑ„Ð¾Ð½ÑƒÐ¹ Ð¼ÐµÐ½Ñ– Ð²Ð²ÐµÑ‡ÐµÑ€Ñ– Ð¿Ñ–ÑÐ»Ñ Ñ€Ð¾Ð±Ð¾Ñ‚Ð¸.\n   > [!error] Ñ‡Ð°Ñ Ð·Ð°Ñ‚ÐµÐ»ÐµÑ„Ð¾Ð½ÑƒÐ¹\n   > [!answer] Ñ‡Ð°Ñ, Ð·Ð°Ñ‚ÐµÐ»ÐµÑ„Ð¾Ð½ÑƒÐ¹\n   > [!options] Ñ‡Ð°Ñ, Ð·Ð°Ñ‚ÐµÐ»ÐµÑ„Ð¾Ð½ÑƒÐ¹ | Ñ‡Ð°Ñ. Ð—Ð°Ñ‚ÐµÐ»ÐµÑ„Ð¾Ð½ÑƒÐ¹ | Ñ‡Ð°Ñ: Ð·Ð°Ñ‚ÐµÐ»ÐµÑ„Ð¾Ð½ÑƒÐ¹ | Ñ‡Ð°Ñ â€” Ð·Ð°Ñ‚ÐµÐ»ÐµÑ„Ð¾Ð½ÑƒÐ¹,\n   > [!explanation] ÐŸÑ–ÑÐ»Ñ Ð¿Ñ–Ð´Ñ€ÑÐ´Ð½Ð¾Ð³Ð¾ Ñ€ÐµÑ‡ÐµÐ½Ð½Ñ Ð· Â«ÑÐºÑ‰Ð¾Â» Ð¿Ð¾Ñ‚Ñ€Ñ–Ð±Ð½Ð° ÐºÐ¾Ð¼Ð°.\n\n4. ÐœÐ¸ Ð¿Ñ–Ð´ÐµÐ¼Ð¾ ÑÐºÑ‰Ð¾ Ð±ÑƒÐ´Ðµ Ð¿Ð¾Ð³Ð¾Ð´Ð° Ð³Ð°Ñ€Ð½Ð° Ð½Ð° Ð¿Ñ€Ð¾Ð³ÑƒÐ»ÑÐ½ÐºÑƒ Ð²Ð²ÐµÑ‡ÐµÑ€Ñ–.\n   > [!error] ÑÐºÑ‰Ð¾ Ð±ÑƒÐ´Ðµ Ð¿Ð¾Ð³Ð¾Ð´Ð° Ð³Ð°Ñ€Ð½Ð°\n   > [!answer] ÑÐºÑ‰Ð¾ Ð¿Ð¾Ð³Ð¾Ð´Ð° Ð±ÑƒÐ´Ðµ Ð³Ð°Ñ€Ð½Ð°\n   > [!options] ÑÐºÑ‰Ð¾ Ð¿Ð¾Ð³Ð¾Ð´Ð° Ð±ÑƒÐ´Ðµ Ð³Ð°Ñ€Ð½Ð° | ÑÐºÑ‰Ð¾ Ð³Ð°Ñ€Ð½Ð° Ð¿Ð¾Ð³Ð¾Ð´Ð° Ð±ÑƒÐ´Ðµ | ÑÐºÑ‰Ð¾ Ð±ÑƒÐ´Ðµ Ð³Ð°Ñ€Ð½Ð¾ÑŽ Ð¿Ð¾Ð³Ð¾Ð´Ð° | ÑÐºÑ‰Ð¾ Ð¿Ð¾Ð³Ð¾Ð´Ð° Ð³Ð°Ñ€Ð½Ð° Ð±ÑƒÐ´Ðµ\n   > [!explanation] ÐŸÑ€Ð°Ð²Ð¸Ð»ÑŒÐ½Ð¸Ð¹ Ð¿Ð¾Ñ€ÑÐ´Ð¾Ðº ÑÐ»Ñ–Ð²: Â«ÑÐºÑ‰Ð¾ Ð¿Ð¾Ð³Ð¾Ð´Ð° Ð±ÑƒÐ´Ðµ Ð³Ð°Ñ€Ð½Ð°Â».\n\n5. Ð¯ÐºÑ‰Ð¾ Ñ…Ð¾Ñ‡ÐµÑˆ, Ð¼Ð¾Ð¶Ñƒ Ñ Ð´Ð¾Ð¿Ð¾Ð¼Ð¾Ð³Ñ‚Ð¸ Ñ‚Ð¾Ð±Ñ– Ð· Ð¿Ñ€Ð¾Ñ”ÐºÑ‚Ð¾Ð¼.\n   > [!error] Ð¼Ð¾Ð¶Ñƒ Ñ\n   > [!answer] Ñ Ð¼Ð¾Ð¶Ñƒ\n   > [!options] Ñ Ð¼Ð¾Ð¶Ñƒ | Ð¼Ð¾Ð¶Ñƒ-Ñ | Ñ-Ð¼Ð¾Ð¶Ñƒ | Ð¼Ð¾Ð¶Ñƒ, Ñ\n   > [!explanation] Ð¡Ñ‚Ð°Ð½Ð´Ð°Ñ€Ñ‚Ð½Ð¸Ð¹ Ð¿Ð¾Ñ€ÑÐ´Ð¾Ðº ÑÐ»Ñ–Ð²: Ð¿Ñ–Ð´Ð¼ÐµÑ‚ + Ð¿Ñ€Ð¸ÑÑƒÐ´Ð¾Ðº.\n\n6. Ð¯ÐºÑ‰Ð¾ Ñƒ Ð½Ð°Ñ Ð½Ðµ Ð±ÑƒÐ´Ðµ Ñ‡Ð°Ñ, Ð¼Ð¸ Ð¿ÐµÑ€ÐµÐ½ÐµÑÐµÐ¼Ð¾ Ð·ÑƒÑÑ‚Ñ€Ñ–Ñ‡.\n   > [!error] Ñ‡Ð°Ñ\n   > [!answer] Ñ‡Ð°ÑÑƒ\n   > [!options] Ñ‡Ð°ÑÑƒ | Ñ‡Ð°ÑÐ¸ | Ñ‡Ð°ÑÐ¾Ð¼ | Ñ‡Ð°ÑÑ–Ð²\n   > [!explanation] ÐŸÑ–ÑÐ»Ñ Â«Ð½Ðµ Ð±ÑƒÐ´ÐµÂ» Ð¿Ð¾Ñ‚Ñ€Ñ–Ð±ÐµÐ½ Ñ€Ð¾Ð´Ð¾Ð²Ð¸Ð¹ Ð²Ñ–Ð´Ð¼Ñ–Ð½Ð¾Ðº: Ñ‡Ð°ÑÑƒ.\n\n---\n\n## cloze: Ð—Ð°Ð¿Ð¾Ð²Ð½Ñ–Ñ‚ÑŒ Ð¿Ñ€Ð¾Ð¿ÑƒÑÐºÐ¸ Ð² Ñ‚ÐµÐºÑÑ‚Ñ–\n\nÐœÐ°Ñ€Ñ–Ñ Ñ‚Ð° ÐÐ½Ð´Ñ€Ñ–Ð¹ Ð¿Ð»Ð°Ð½ÑƒÑŽÑ‚ÑŒ Ð²Ð¸Ñ…Ñ–Ð´Ð½Ñ–. ÐÐ½Ð´Ñ€Ñ–Ð¹ ÐºÐ°Ð¶Ðµ: Â«(1)___ Ð¿Ð¾Ð³Ð¾Ð´Ð° (2)___ Ð³Ð°Ñ€Ð½Ð¾ÑŽ, Ð¼Ð¸ Ð·Ð¼Ð¾Ð¶ÐµÐ¼Ð¾ Ð¿Ð¾Ñ—Ñ…Ð°Ñ‚Ð¸ Ð½Ð° Ð¿Ñ–ÐºÐ½Ñ–Ðº Ð·Ð° Ð¼Ñ–ÑÑ‚Ð¾Â». ÐœÐ°Ñ€Ñ–Ñ Ð²Ñ–Ð´Ð¿Ð¾Ð²Ñ–Ð´Ð°Ñ”: Â«Ð§ÑƒÐ´Ð¾Ð²Ð° Ñ–Ð´ÐµÑ! Ð (3)___ (4)___ Ð´Ð¾Ñ‰, Ñ‰Ð¾ Ñ‚Ð¾Ð´Ñ– Ñ€Ð¾Ð±Ð¸Ñ‚Ð¸Ð¼ÐµÐ¼Ð¾?Â» ÐÐ½Ð´Ñ€Ñ–Ð¹ Ð´ÑƒÐ¼Ð°Ñ” Ñ– ÐºÐ°Ð¶Ðµ: Â«(5)___ Ð±ÑƒÐ´Ðµ Ð´Ð¾Ñ‰, (6)___ Ð²Ð´Ð¾Ð¼Ð° Ð¹ (7)___ ÑÐºÐ¸Ð¹ÑÑŒ Ñ„Ñ–Ð»ÑŒÐ¼Â». ÐœÐ°Ñ€Ñ–Ñ Ð¿Ð¾Ð³Ð¾Ð´Ð¶ÑƒÑ”Ñ‚ÑŒÑÑ: Â«Ð”Ð¾Ð±Ñ€Ðµ. Ð (8)___ Ð´Ñ€ÑƒÐ·Ñ– (9)___ Ð¿Ñ€Ð¸Ñ”Ð´Ð½Ð°Ñ‚Ð¸ÑÑ?Â» ÐÐ½Ð´Ñ€Ñ–Ð¹ Ð²Ñ–Ð´Ð¿Ð¾Ð²Ñ–Ð´Ð°Ñ”: Â«(10)___ Ð²Ð¾Ð½Ð¸ Ð·Ð°Ñ…Ð¾Ñ‡ÑƒÑ‚ÑŒ, Ð· Ñ€Ð°Ð´Ñ–ÑÑ‚ÑŽ (11)___ Ñ—Ñ… Ñ€Ð°Ð·Ð¾Ð¼ Ð· Ð½Ð°Ð¼Ð¸Â». ÐœÐ°Ñ€Ñ–Ñ ÐºÐ°Ð¶Ðµ: Â«Ð£ (12)___ (13)___ Ð²Ð¾Ð½Ð¸ Ð½Ðµ Ð·Ð¼Ð¾Ð¶ÑƒÑ‚ÑŒ, Ð¼Ð¸ Ð¿Ñ€Ð¾Ð²ÐµÐ´ÐµÐ¼Ð¾ Ñ‡Ð°Ñ ÑƒÐ´Ð²Ð¾Ñ…Â». ÐÐ½Ð´Ñ€Ñ–Ð¹ ÐºÐ°Ð¶Ðµ: Â«(14)___ Ð²ÑÐµ Ð±ÑƒÐ´Ðµ Ð´Ð¾Ð±Ñ€Ðµ, Ñ†Ðµ Ð±ÑƒÐ´ÑƒÑ‚ÑŒ Ñ‡ÑƒÐ´Ð¾Ð²Ñ– Ð²Ð¸Ñ…Ñ–Ð´Ð½Ñ–!Â»\n\n- (1) :: Ð¯ÐºÑ‰Ð¾ | Ð¯ÐºÐ±Ð¸ | ÐšÐ¾Ð»Ð¸ Ð± | Ð¥Ð¾Ñ‡Ð°\n- (2) :: Ð±ÑƒÐ´Ðµ | Ñ” | Ð±ÑƒÐ»Ð° | Ð±ÑƒÐ²Ð°Ð»Ð°\n- (3) :: ÑÐºÑ‰Ð¾ | ÑÐºÐ±Ð¸ | ÐºÐ¾Ð»Ð¸ Ð± | Ñ…Ð¾Ñ‡Ð°\n- (4) :: Ð±ÑƒÐ´Ðµ | Ñ” | Ð±ÑƒÐ² | Ð±ÑƒÐ²Ð°Ð²\n- (5) :: Ð¯ÐºÑ‰Ð¾ | Ð¯ÐºÐ±Ð¸ | Ð¥Ð¾Ñ‡Ð° | Ð‘Ð¾\n- (6) :: Ð·Ð°Ð»Ð¸ÑˆÐ¸Ð¼Ð¾ÑÑ | Ð·Ð°Ð»Ð¸ÑˆÐ°Ñ”Ð¼Ð¾ÑÑ | Ð·Ð°Ð»Ð¸ÑˆÐ¸Ð»Ð¸ÑÑ | Ð·Ð°Ð»Ð¸ÑˆÐ°Ñ‚Ð¸Ð¼ÐµÐ¼Ð¾ÑÑ\n- (7) :: Ð¿Ð¾Ð´Ð¸Ð²Ð¸Ð¼Ð¾ÑÑ | Ð´Ð¸Ð²Ð¸Ð¼Ð¾ÑÑ | Ð´Ð¸Ð²Ð¸Ð»Ð¸ÑÑ | Ð´Ð¸Ð²Ð¸Ñ‚Ð¸Ð¼ÐµÐ¼Ð¾ÑÑ\n- (8) :: ÑÐºÑ‰Ð¾ | ÑÐºÐ±Ð¸ | ÐºÐ¾Ð»Ð¸ Ð± | Ñ…Ð¾Ñ‡Ð°\n- (9) :: Ð·Ð°Ñ…Ð¾Ñ‡ÑƒÑ‚ÑŒ | Ñ…Ð¾Ñ‡ÑƒÑ‚ÑŒ | Ñ…Ð¾Ñ‚Ñ–Ð»Ð¸ | Ñ…Ð¾Ñ‚Ñ–Ñ‚Ð¸Ð¼ÑƒÑ‚ÑŒ\n- (10) :: Ð¯ÐºÑ‰Ð¾ | Ð¯ÐºÐ±Ð¸ | Ð¥Ð¾Ñ‡Ð° | Ð¢Ð¾Ð¼Ñƒ Ñ‰Ð¾\n- (11) :: Ð·Ð°Ð¿Ñ€Ð¾ÑÐ¸Ð¼Ð¾ | Ð·Ð°Ð¿Ñ€Ð¾ÑˆÑƒÑ”Ð¼Ð¾ | Ð·Ð°Ð¿Ñ€Ð¾ÑÐ¸Ð»Ð¸ | Ð·Ð°Ð¿Ñ€Ð¾ÑˆÑƒÑ”Ð¼Ð¾\n- (12) :: Ð²Ð¸Ð¿Ð°Ð´ÐºÑƒ | Ñ€Ð°Ð·Ñ– | ÑƒÐ¼Ð¾Ð²Ñ– | ÑÐ¸Ñ‚ÑƒÐ°Ñ†Ñ–Ñ—\n- (13) :: ÑÐºÑ‰Ð¾ | ÑÐºÐ±Ð¸ | ÐºÐ¾Ð»Ð¸ Ð± | ÐºÐ¾Ð»Ð¸\n- (14) :: Ð¯ÐºÑ‰Ð¾ | Ð¯ÐºÐ±Ð¸ | Ð¥Ð¾Ñ‡Ð° | Ð¢Ð¾Ð¼Ñƒ Ñ‰Ð¾\n\n---\n\n## mark-the-words: ÐŸÐ¾Ð·Ð½Ð°Ñ‡Ñ‚Ðµ ÑÐ¿Ð¾Ð»ÑƒÑ‡Ð½Ð¸ÐºÐ¸ ÑƒÐ¼Ð¾Ð²Ð¸\n\n[Ð¯ÐºÑ‰Ð¾] Ð¼Ð°Ñ‚Ð¸Ð¼ÐµÑˆ Ñ‡Ð°Ñ, Ð·Ð°Ñ‚ÐµÐ»ÐµÑ„Ð¾Ð½ÑƒÐ¹ Ð¼ÐµÐ½Ñ– Ð²Ð²ÐµÑ‡ÐµÑ€Ñ–. [Ð£ Ð²Ð¸Ð¿Ð°Ð´ÐºÑƒ ÑÐºÑ‰Ð¾] Ð·Ð°Ð±ÑƒÐ´ÐµÑˆ, Ñ Ð½Ð°Ð³Ð°Ð´Ð°ÑŽ. [Ð¯ÐºÑ‰Ð¾] Ð¿Ð¾Ð³Ð¾Ð´Ð° Ð±ÑƒÐ´Ðµ Ð³Ð°Ñ€Ð½Ð¾ÑŽ, Ð¼Ð¸ Ð¿Ñ–Ð´ÐµÐ¼Ð¾ Ð½Ð° Ð¿Ñ€Ð¾Ð³ÑƒÐ»ÑÐ½ÐºÑƒ. [Ð—Ð° ÑƒÐ¼Ð¾Ð²Ð¸ Ñ‰Ð¾] Ð²ÑÑ– Ð¿Ð¾Ð³Ð¾Ð´ÑÑ‚ÑŒÑÑ, Ð¿Ð¾Ñ‡Ð½ÐµÐ¼Ð¾ Ð¿Ñ€Ð¾Ñ”ÐºÑ‚. [Ð¯ÐºÑ‰Ð¾] Ð²Ñ–Ð½ Ð½Ðµ Ð¿Ñ€Ð¸Ð¹Ð´Ðµ Ð²Ñ‡Ð°ÑÐ½Ð¾, Ð¼Ð¸ Ð¿Ð¾Ñ‡Ð½ÐµÐ¼Ð¾ Ð±ÐµÐ· Ð½ÑŒÐ¾Ð³Ð¾. [Ð£ Ñ€Ð°Ð·Ñ– ÑÐºÑ‰Ð¾] Ð²Ð¸Ð½Ð¸ÐºÐ½ÑƒÑ‚ÑŒ Ð¿Ñ€Ð¾Ð±Ð»ÐµÐ¼Ð¸, Ð·Ð²ÐµÑ€Ð½Ñ–Ñ‚ÑŒÑÑ Ð´Ð¾ Ð°Ð´Ð¼Ñ–Ð½Ñ–ÑÑ‚Ñ€Ð°Ñ‚Ð¾Ñ€Ð°. [Ð¯ÐºÑ‰Ð¾] Ñ…Ð¾Ñ‡ÐµÑˆ, Ñ Ð¼Ð¾Ð¶Ñƒ Ð´Ð¾Ð¿Ð¾Ð¼Ð¾Ð³Ñ‚Ð¸. [ÐŸÑ€Ð¸ ÑƒÐ¼Ð¾Ð²Ñ– Ñ‰Ð¾] Ð²Ð¸ Ð¾Ð¿Ð»Ð°Ñ‚Ð¸Ñ‚Ðµ, Ð¼Ð¸ Ð´Ð¾ÑÑ‚Ð°Ð²Ð¸Ð¼Ð¾ Ñ‚Ð¾Ð²Ð°Ñ€ Ð¿Ñ€Ð¾Ñ‚ÑÐ³Ð¾Ð¼ Ñ‚Ð¸Ð¶Ð½Ñ.\n\n---\n\n## dialogue-reorder: Ð’Ð¿Ð¾Ñ€ÑÐ´ÐºÑƒÐ¹Ñ‚Ðµ Ð´Ñ–Ð°Ð»Ð¾Ð³\n\n- Ð¯ÐºÑ‰Ð¾ Ð±ÑƒÐ´Ðµ Ð´Ð¾Ñ‰, Ñ‰Ð¾ Ñ‚Ð¾Ð´Ñ– Ñ€Ð¾Ð±Ð¸Ñ‚Ð¸Ð¼ÐµÐ¼Ð¾?\n- Ð©Ð¾ Ð¿Ð»Ð°Ð½ÑƒÑ”Ð¼Ð¾ Ñ€Ð¾Ð±Ð¸Ñ‚Ð¸ Ð½Ð° Ð²Ð¸Ñ…Ñ–Ð´Ð½Ð¸Ñ…?\n- Ð¯ÐºÑ‰Ð¾ Ð¿Ð¾Ð³Ð¾Ð´Ð° Ð±ÑƒÐ´Ðµ Ð³Ð°Ñ€Ð½Ð¾ÑŽ, Ð¼Ð¾Ð¶ÐµÐ¼Ð¾ Ð¿Ð¾Ñ—Ñ…Ð°Ñ‚Ð¸ Ð½Ð° Ð¿Ñ–ÐºÐ½Ñ–Ðº.\n- Ð”Ð¾Ð±Ñ€Ðµ, Ñ†Ðµ Ñ…Ð¾Ñ€Ð¾ÑˆÐ¸Ð¹ Ð¿Ð»Ð°Ð½ Ð½Ð° Ð±ÑƒÐ´ÑŒ-ÑÐºÑƒ Ð¿Ð¾Ð³Ð¾Ð´Ñƒ.\n- Ð¯ÐºÑ‰Ð¾ Ð±ÑƒÐ´Ðµ Ð´Ð¾Ñ‰, Ð·Ð°Ð»Ð¸ÑˆÐ¸Ð¼Ð¾ÑÑ Ð²Ð´Ð¾Ð¼Ð° Ð¹ Ð¿Ð¾Ð´Ð¸Ð²Ð¸Ð¼Ð¾ÑÑ Ñ„Ñ–Ð»ÑŒÐ¼.\n- Ð§ÑƒÐ´Ð¾Ð²Ð° Ñ–Ð´ÐµÑ! Ð¯ Ð²Ð¶Ðµ Ñ‡ÐµÐºÐ°ÑŽ Ð½Ð° Ð²Ð¸Ñ…Ñ–Ð´Ð½Ñ–!\n\n> [!answer]\n> 1. Ð©Ð¾ Ð¿Ð»Ð°Ð½ÑƒÑ”Ð¼Ð¾ Ñ€Ð¾Ð±Ð¸Ñ‚Ð¸ Ð½Ð° Ð²Ð¸Ñ…Ñ–Ð´Ð½Ð¸Ñ…?\n> 2. Ð¯ÐºÑ‰Ð¾ Ð¿Ð¾Ð³Ð¾Ð´Ð° Ð±ÑƒÐ´Ðµ Ð³Ð°Ñ€Ð½Ð¾ÑŽ, Ð¼Ð¾Ð¶ÐµÐ¼Ð¾ Ð¿Ð¾Ñ—Ñ…Ð°Ñ‚Ð¸ Ð½Ð° Ð¿Ñ–ÐºÐ½Ñ–Ðº.\n> 3. Ð¯ÐºÑ‰Ð¾ Ð±ÑƒÐ´Ðµ Ð´Ð¾Ñ‰, Ñ‰Ð¾ Ñ‚Ð¾Ð´Ñ– Ñ€Ð¾Ð±Ð¸Ñ‚Ð¸Ð¼ÐµÐ¼Ð¾?\n> 4. Ð¯ÐºÑ‰Ð¾ Ð±ÑƒÐ´Ðµ Ð´Ð¾Ñ‰, Ð·Ð°Ð»Ð¸ÑˆÐ¸Ð¼Ð¾ÑÑ Ð²Ð´Ð¾Ð¼Ð° Ð¹ Ð¿Ð¾Ð´Ð¸Ð²Ð¸Ð¼Ð¾ÑÑ Ñ„Ñ–Ð»ÑŒÐ¼.\n> 5. Ð”Ð¾Ð±Ñ€Ðµ, Ñ†Ðµ Ñ…Ð¾Ñ€Ð¾ÑˆÐ¸Ð¹ Ð¿Ð»Ð°Ð½ Ð½Ð° Ð±ÑƒÐ´ÑŒ-ÑÐºÑƒ Ð¿Ð¾Ð³Ð¾Ð´Ñƒ.\n> 6. Ð§ÑƒÐ´Ð¾Ð²Ð° Ñ–Ð´ÐµÑ! Ð¯ Ð²Ð¶Ðµ Ñ‡ÐµÐºÐ°ÑŽ Ð½Ð° Ð²Ð¸Ñ…Ñ–Ð´Ð½Ñ–!\n\n---\n\n## select: Ð’Ð¸Ð±ÐµÑ€Ñ–Ñ‚ÑŒ ÑƒÑÑ– Ð¿Ñ€Ð°Ð²Ð¸Ð»ÑŒÐ½Ñ– Ñ€ÐµÑ‡ÐµÐ½Ð½Ñ\n\n- [x] Ð¯ÐºÑ‰Ð¾ Ð¼Ð°Ñ‚Ð¸Ð¼ÐµÑˆ Ñ‡Ð°Ñ, Ð·Ð°Ñ‚ÐµÐ»ÐµÑ„Ð¾Ð½ÑƒÐ¹ Ð¼ÐµÐ½Ñ– Ð²Ð²ÐµÑ‡ÐµÑ€Ñ–.\n- [ ] Ð¯ÐºÐ±Ð¸ Ð¼Ð°Ñ‚Ð¸Ð¼ÐµÑˆ Ñ‡Ð°Ñ, Ð·Ð°Ñ‚ÐµÐ»ÐµÑ„Ð¾Ð½ÑƒÐ¹ Ð¼ÐµÐ½Ñ– Ð²Ð²ÐµÑ‡ÐµÑ€Ñ–.\n- [x] Ð¯ÐºÑ‰Ð¾ Ð²Ñ–Ð½ Ð¿Ñ€Ð¸Ð¹Ð´Ðµ, Ð¼Ð¸ Ð¿Ð¾Ð³Ð¾Ð²Ð¾Ñ€Ð¸Ð¼Ð¾ Ð· Ð½Ð¸Ð¼.\n- [ ] Ð¯ÐºÑ‰Ð¾ Ð²Ñ–Ð½ Ð¿Ñ€Ð¸Ð¹Ð´Ðµ, Ð¼Ð¸ Ð¿Ð¾Ð³Ð¾Ð²Ð¾Ñ€Ð¸Ð¼Ð¾ Ð± Ð· Ð½Ð¸Ð¼.\n- [x] ÐœÐ¸ Ð¿Ñ–Ð´ÐµÐ¼Ð¾ Ð½Ð° Ð¿Ñ€Ð¾Ð³ÑƒÐ»ÑÐ½ÐºÑƒ, ÑÐºÑ‰Ð¾ Ð¿Ð¾Ð³Ð¾Ð´Ð° Ð±ÑƒÐ´Ðµ Ð³Ð°Ñ€Ð½Ð°.\n- [ ] ÐœÐ¸ Ð¿Ñ–Ð´ÐµÐ¼Ð¾ Ð½Ð° Ð¿Ñ€Ð¾Ð³ÑƒÐ»ÑÐ½ÐºÑƒ ÑÐºÑ‰Ð¾ Ð¿Ð¾Ð³Ð¾Ð´Ð° Ð±ÑƒÐ´Ðµ Ð³Ð°Ñ€Ð½Ð°.\n- [x] Ð£ Ð²Ð¸Ð¿Ð°Ð´ÐºÑƒ ÑÐºÑ‰Ð¾ Ð·Ð°Ð±ÑƒÐ´ÐµÑˆ, Ñ Ð½Ð°Ð³Ð°Ð´Ð°ÑŽ Ñ‚Ð¾Ð±Ñ–.\n- [ ] Ð£ Ð²Ð¸Ð¿Ð°Ð´ÐºÑƒ ÑÐºÐ±Ð¸ Ð·Ð°Ð±ÑƒÐ´ÐµÑˆ, Ñ Ð½Ð°Ð³Ð°Ð´Ð°ÑŽ Ñ‚Ð¾Ð±Ñ–.\n\n---\n\n## translate: ÐŸÐµÑ€ÐµÐºÐ»Ð°Ð´Ñ–Ñ‚ÑŒ Ð½Ð° ÑƒÐºÑ€Ð°Ñ—Ð½ÑÑŒÐºÑƒ Ð¼Ð¾Ð²Ñƒ\n\n1. If the weather is good, we will go for a walk in the park.\n   - [x] Ð¯ÐºÑ‰Ð¾ Ð¿Ð¾Ð³Ð¾Ð´Ð° Ð±ÑƒÐ´Ðµ Ð³Ð°Ñ€Ð½Ð¾ÑŽ, Ð¼Ð¸ Ð¿Ñ–Ð´ÐµÐ¼Ð¾ Ð½Ð° Ð¿Ñ€Ð¾Ð³ÑƒÐ»ÑÐ½ÐºÑƒ Ð² Ð¿Ð°Ñ€Ðº.\n   - [ ] Ð¯ÐºÐ±Ð¸ Ð¿Ð¾Ð³Ð¾Ð´Ð° Ð±ÑƒÐ´Ðµ Ð³Ð°Ñ€Ð½Ð¾ÑŽ, Ð¼Ð¸ Ð¿Ñ–Ð´ÐµÐ¼Ð¾ Ð² Ð¿Ð°Ñ€Ðº.\n   - [ ] Ð¯ÐºÑ‰Ð¾ Ð¿Ð¾Ð³Ð¾Ð´Ð° Ð³Ð°Ñ€Ð½Ð° Ð±ÑƒÐ»Ð°, Ð¼Ð¸ Ð¹Ð´ÐµÐ¼Ð¾ Ð² Ð¿Ð°Ñ€Ðº.\n   - [ ] ÐšÐ¾Ð»Ð¸ Ð± Ð¿Ð¾Ð³Ð¾Ð´Ð° Ð±ÑƒÐ´Ðµ, Ð¼Ð¸ Ð¿Ñ–Ð´ÐµÐ¼Ð¾ Ð³ÑƒÐ»ÑÑ‚Ð¸.\n\n2. If you want, I can help you with the project.\n   - [x] Ð¯ÐºÑ‰Ð¾ Ñ…Ð¾Ñ‡ÐµÑˆ, Ñ Ð¼Ð¾Ð¶Ñƒ Ð´Ð¾Ð¿Ð¾Ð¼Ð¾Ð³Ñ‚Ð¸ Ñ‚Ð¾Ð±Ñ– Ð· Ð¿Ñ€Ð¾Ñ”ÐºÑ‚Ð¾Ð¼.\n   - [ ] Ð¯ÐºÐ±Ð¸ Ñ…Ð¾Ñ‡ÐµÑˆ, Ð¼Ð¾Ð¶Ñƒ Ð´Ð¾Ð¿Ð¾Ð¼Ð¾Ð³Ñ‚Ð¸ Ð· Ð¿Ñ€Ð¾Ñ”ÐºÑ‚Ð¾Ð¼.\n   - [ ] Ð¯ÐºÑ‰Ð¾ Ñ‚Ð¸ Ñ…Ð¾Ñ‚Ñ–Ð»Ð°, Ñ Ð´Ð¾Ð¿Ð¾Ð¼Ð°Ð³Ð°ÑŽ Ñ‚Ð¾Ð±Ñ–.\n   - [ ] ÐšÐ¾Ð»Ð¸ Ð± Ñ‚Ð¸ Ñ…Ð¾Ñ‡ÐµÑˆ, Ñ Ð´Ð¾Ð¿Ð¾Ð¼Ð¾Ð¶Ñƒ Ñ‚Ð¾Ð±Ñ–.\n\n3. If he comes late, we will start without him.\n   - [x] Ð¯ÐºÑ‰Ð¾ Ð²Ñ–Ð½ Ð¿Ñ€Ð¸Ð¹Ð´Ðµ Ð¿Ñ–Ð·Ð½Ð¾, Ð¼Ð¸ Ð¿Ð¾Ñ‡Ð½ÐµÐ¼Ð¾ Ð±ÐµÐ· Ð½ÑŒÐ¾Ð³Ð¾.\n   - [ ] Ð¯ÐºÐ±Ð¸ Ð²Ñ–Ð½ Ð¿Ñ€Ð¸Ð¹ÑˆÐ¾Ð² Ð¿Ñ–Ð·Ð½Ð¾, Ð¼Ð¸ Ð¿Ð¾Ñ‡Ð½ÐµÐ¼Ð¾ Ð±ÐµÐ· Ð½ÑŒÐ¾Ð³Ð¾.\n   - [ ] Ð¯ÐºÑ‰Ð¾ Ð²Ñ–Ð½ Ð¿Ñ€Ð¸Ñ…Ð¾Ð´Ð¸Ñ‚ÑŒ Ð¿Ñ–Ð·Ð½Ð¾, Ð¼Ð¸ Ð¿Ð¾Ñ‡Ð°Ð»Ð¸ Ð±ÐµÐ· Ð½ÑŒÐ¾Ð³Ð¾.\n   - [ ] ÐšÐ¾Ð»Ð¸ Ð± Ð²Ñ–Ð½ Ð¿Ñ€Ð¸Ð¹Ð´Ðµ, Ð¼Ð¸ Ð¿Ð¾Ñ‡Ð½ÐµÐ¼Ð¾ Ð±ÐµÐ·.\n\n4. In case you forget, I will remind you tomorrow.\n   - [x] Ð£ Ð²Ð¸Ð¿Ð°Ð´ÐºÑƒ ÑÐºÑ‰Ð¾ Ð·Ð°Ð±ÑƒÐ´ÐµÑˆ, Ñ Ð½Ð°Ð³Ð°Ð´Ð°ÑŽ Ñ‚Ð¾Ð±Ñ– Ð·Ð°Ð²Ñ‚Ñ€Ð°.\n   - [ ] Ð£ Ð²Ð¸Ð¿Ð°Ð´ÐºÑƒ ÑÐºÐ±Ð¸ Ð·Ð°Ð±ÑƒÐ´ÐµÑˆ, Ð½Ð°Ð³Ð°Ð´Ð°ÑŽ Ñ‚Ð¾Ð±Ñ–.\n   - [ ] Ð¯ÐºÑ‰Ð¾ Ñƒ Ð²Ð¸Ð¿Ð°Ð´ÐºÑƒ Ð·Ð°Ð±ÑƒÐ²Ð°Ñ”Ñˆ, Ð½Ð°Ð³Ð°Ð´Ð°ÑŽ.\n   - [ ] ÐšÐ¾Ð»Ð¸ Ð± Ñ‚Ð¸ Ð·Ð°Ð±ÑƒÐ², Ñ Ð½Ð°Ð³Ð°Ð´Ð°Ð² Ð±Ð¸.\n\n5. If you don't understand, please ask me for help.\n   - [x] Ð¯ÐºÑ‰Ð¾ Ð½Ðµ Ñ€Ð¾Ð·ÑƒÐ¼Ñ–Ñ”Ñˆ, Ð±ÑƒÐ´ÑŒ Ð»Ð°ÑÐºÐ°, Ð¿Ð¸Ñ‚Ð°Ð¹ Ð¼ÐµÐ½Ðµ.\n   - [ ] Ð¯ÐºÐ±Ð¸ Ð½Ðµ Ñ€Ð¾Ð·ÑƒÐ¼Ñ–Ñ”Ñˆ, Ð¿Ð¸Ñ‚Ð°Ð¹ Ð¼ÐµÐ½Ðµ, Ð±ÑƒÐ´ÑŒ Ð»Ð°ÑÐºÐ°.\n   - [ ] Ð¯ÐºÑ‰Ð¾ Ñ‚Ð¸ Ð½Ðµ Ñ€Ð¾Ð·ÑƒÐ¼Ñ–Ð², Ð¿Ð¸Ñ‚Ð°Ð¹ Ð´Ð¾Ð¿Ð¾Ð¼Ð¾Ð³Ñƒ.\n   - [ ] ÐšÐ¾Ð»Ð¸ Ð± Ð½Ðµ Ñ€Ð¾Ð·ÑƒÐ¼Ñ–Ñ”Ñˆ, Ð·Ð°Ð¿Ð¸Ñ‚Ð°Ð¹ Ð¼ÐµÐ½Ðµ.\n\n6. If questions arise, contact the administrator immediately.\n   - [x] Ð¯ÐºÑ‰Ð¾ Ð²Ð¸Ð½Ð¸ÐºÐ½ÑƒÑ‚ÑŒ Ð·Ð°Ð¿Ð¸Ñ‚Ð°Ð½Ð½Ñ, Ð·Ð²ÐµÑ€Ð½Ñ–Ñ‚ÑŒÑÑ Ð´Ð¾ Ð°Ð´Ð¼Ñ–Ð½Ñ–ÑÑ‚Ñ€Ð°Ñ‚Ð¾Ñ€Ð° Ð½ÐµÐ³Ð°Ð¹Ð½Ð¾.\n   - [ ] Ð¯ÐºÐ±Ð¸ Ð²Ð¸Ð½Ð¸ÐºÐ½ÑƒÑ‚ÑŒ Ð·Ð°Ð¿Ð¸Ñ‚Ð°Ð½Ð½Ñ, Ð·Ð²ÐµÑ€Ð½ÑƒÑ‚Ð¸ÑÑ Ð´Ð¾ Ð°Ð´Ð¼Ñ–Ð½Ñ–ÑÑ‚Ñ€Ð°Ñ‚Ð¾Ñ€Ð°.\n   - [ ] Ð¯ÐºÑ‰Ð¾ Ð·Ð°Ð¿Ð¸Ñ‚Ð°Ð½Ð½Ñ Ð²Ð¸Ð½Ð¸ÐºÐ°ÑŽÑ‚ÑŒ, Ð·Ð²ÐµÑ€Ð½Ñ–Ñ‚ÑŒÑÑ Ð½ÐµÐ³Ð°Ð¹Ð½Ð¾ Ð°Ð´Ð¼Ñ–Ð½Ñ–ÑÑ‚Ñ€Ð°Ñ‚Ð¾Ñ€.\n   - [ ] ÐšÐ¾Ð»Ð¸ Ð± Ð·Ð°Ð¿Ð¸Ñ‚Ð°Ð½Ð½Ñ, Ð°Ð´Ð¼Ñ–Ð½Ñ–ÑÑ‚Ñ€Ð°Ñ‚Ð¾Ñ€ Ð·Ð²ÐµÑ€Ð½Ñ–Ñ‚ÑŒÑÑ.\n\n---\n\n# Ð¡Ð»Ð¾Ð²Ð½Ð¸Ðº\n\n| Ð¡Ð»Ð¾Ð²Ð¾ | Ð’Ð¸Ð¼Ð¾Ð²Ð° | ÐŸÐµÑ€ÐµÐºÐ»Ð°Ð´ | Ð§Ðœ | ÐŸÑ€Ð¸Ð¼Ñ–Ñ‚ÐºÐ° |\n|-------|--------|----------|-----|----------|\n| **ÑÐºÑ‰Ð¾** | /jÉ‘kËˆÊƒtÊƒÉ”/ | if | ÑÐ¿Ð¾Ð»ÑƒÑ‡Ð½. | Ð²Ð²Ð¾Ð´Ð¸Ñ‚ÑŒ ÑƒÐ¼Ð¾Ð²Ñƒ |\n| **ÐºÐ¾Ð»Ð¸** | /kÉ”ËˆlÉª/ | when, if (conditional) | ÑÐ¿Ð¾Ð»ÑƒÑ‡Ð½. | Ñ‡Ð°ÑÐ¾Ð²Ð¸Ð¹ Ð°Ð±Ð¾ ÑƒÐ¼Ð¾Ð²Ð½Ð¸Ð¹ |\n| **Ñƒ Ð²Ð¸Ð¿Ð°Ð´ÐºÑƒ ÑÐºÑ‰Ð¾** | /u ËˆwÉªpÉ‘dku jÉ‘kËˆÊƒtÊƒÉ”/ | in case if | ÑÐ¿Ð¾Ð»ÑƒÑ‡Ð½. | Ð´Ð»Ñ Ð·Ð°Ð¿Ð°ÑÐ½Ð¾Ð³Ð¾ Ð¿Ð»Ð°Ð½Ñƒ |\n| **Ð·Ð° ÑƒÐ¼Ð¾Ð²Ð¸ Ñ‰Ð¾** | /zÉ‘ uËˆmÉ”wÉª ÊƒtÊƒÉ”/ | provided that | ÑÐ¿Ð¾Ð»ÑƒÑ‡Ð½. | ÑƒÐ¼Ð¾Ð²Ð°-Ð²Ð¸Ð¼Ð¾Ð³Ð° |\n| **Ð¿Ñ€Ð¸ ÑƒÐ¼Ð¾Ð²Ñ– Ñ‰Ð¾** | /prÉª uËˆmÉ”wÉª ÊƒtÊƒÉ”/ | on condition that | ÑÐ¿Ð¾Ð»ÑƒÑ‡Ð½. | Ñ„Ð¾Ñ€Ð¼Ð°Ð»ÑŒÐ½Ðµ |\n| **Ñƒ Ñ€Ð°Ð·Ñ– ÑÐºÑ‰Ð¾** | /u ËˆrÉ‘zÊ²i jÉ‘kËˆÊƒtÊƒÉ”/ | in the event that | ÑÐ¿Ð¾Ð»ÑƒÑ‡Ð½. | Ð¾Ñ„Ñ–Ñ†Ñ–Ð¹Ð½Ðµ |\n| **ÑƒÐ¼Ð¾Ð²Ð°** | /uËˆmÉ”wÉ‘/ | condition | Ñ–Ð¼. (Ð¶.Ñ€.) | Ð¾Ð±ÑÑ‚Ð°Ð²Ð¸Ð½Ð° |\n| **Ð½Ð°ÑÐ»Ñ–Ð´Ð¾Ðº** | /nÉ‘ËˆslÊ²idÉ”k/ | consequence, result | Ñ–Ð¼. (Ñ‡.Ñ€.) | Ñ€ÐµÐ·ÑƒÐ»ÑŒÑ‚Ð°Ñ‚ Ð´Ñ–Ñ— |\n| **Ñ‚Ð¾Ð´Ñ–** | /tÉ”ËˆdÊ²i/ | then | Ð¿Ñ€Ð¸ÑÐ». | Ñƒ Ñ‚Ð°ÐºÐ¾Ð¼Ñƒ Ñ€Ð°Ð·Ñ– |\n| **Ð¼Ð¾Ð¶Ð»Ð¸Ð²Ð¾** | /mÉ”Ê’ËˆlÉªwÉ”/ | possibly, maybe | Ð¿Ñ€Ð¸ÑÐ». | Ð²ÐºÐ°Ð·ÑƒÑ” Ð½Ð° Ð¹Ð¼Ð¾Ð²Ñ–Ñ€Ð½Ñ–ÑÑ‚ÑŒ |\n| **Ð¹Ð¼Ð¾Ð²Ñ–Ñ€Ð½Ð¾** | /jmÉ”ËˆwÊ²irnÉ”/ | probably | Ð¿Ñ€Ð¸ÑÐ». | Ð²Ð¸ÑÐ¾ÐºÐ° Ð¹Ð¼Ð¾Ð²Ñ–Ñ€Ð½Ñ–ÑÑ‚ÑŒ |\n| **Ð¿ÐµÐ²Ð½Ð¾** | /ËˆpewnÉ”/ | surely, certainly | Ð¿Ñ€Ð¸ÑÐ». | Ð²Ð¿ÐµÐ²Ð½ÐµÐ½Ñ–ÑÑ‚ÑŒ |\n| **Ð½Ð°Ð¿ÐµÐ²Ð½Ð¾** | /nÉ‘ËˆpewnÉ”/ | certainly, for sure | Ð¿Ñ€Ð¸ÑÐ». | Ð²Ð¸ÑÐ¾ÐºÐ° Ð²Ð¿ÐµÐ²Ð½ÐµÐ½Ñ–ÑÑ‚ÑŒ |\n| **Ð¼Ð¾Ð¶Ð»Ð¸Ð²Ñ–ÑÑ‚ÑŒ** | /mÉ”Ê’ËˆlÉªwÊ²istÊ²/ | possibility | Ñ–Ð¼. (Ð¶.Ñ€.) | ÑˆÐ°Ð½Ñ Ð½Ð° Ð¿Ð¾Ð´Ñ–ÑŽ |\n| **Ð² Ñ‚Ð°ÐºÐ¾Ð¼Ñƒ Ñ€Ð°Ð·Ñ–** | /w tÉ‘ËˆkÉ”mu ËˆrÉ‘zÊ²i/ | in that case | Ð¿Ñ€Ð¸ÑÐ». | Ñƒ Ñ‚Ð°ÐºÑ–Ð¹ ÑÐ¸Ñ‚ÑƒÐ°Ñ†Ñ–Ñ— |\n| **Ñ–Ð½Ð°ÐºÑˆÐµ** | /iËˆnÉ‘kÊƒÉ›/ | otherwise | Ð¿Ñ€Ð¸ÑÐ». | ÑÐºÑ‰Ð¾ Ð½Ñ– |\n| **Ð² Ñ–Ð½ÑˆÐ¾Ð¼Ñƒ Ð²Ð¸Ð¿Ð°Ð´ÐºÑƒ** | /w ËˆinÊƒÉ”mu ËˆwÉªpÉ‘dku/ | otherwise | Ð¿Ñ€Ð¸ÑÐ». | Ð°Ð»ÑŒÑ‚ÐµÑ€Ð½Ð°Ñ‚Ð¸Ð²Ð° |\n| **Ð¿Ñ€Ð¾Ñ‚Ðµ** | /prÉ”ËˆtÉ›/ | however | ÑÐ¿Ð¾Ð»ÑƒÑ‡Ð½. | ÐºÐ¾Ð½Ñ‚Ñ€Ð°ÑÑ‚ |\n| **Ð¾Ð´Ð½Ð°Ðº** | /É”dËˆnÉ‘k/ | however | ÑÐ¿Ð¾Ð»ÑƒÑ‡Ð½. | Ñ„Ð¾Ñ€Ð¼Ð°Ð»ÑŒÐ½Ð¸Ð¹ ÐºÐ¾Ð½Ñ‚Ñ€Ð°ÑÑ‚ |\n| **Ð¾Ñ‚Ð¶Ðµ** | /É”tËˆÊ’É›/ | therefore, so | ÑÐ¿Ð¾Ð»ÑƒÑ‡Ð½. | Ð²Ð¸ÑÐ½Ð¾Ð²Ð¾Ðº |\n| **Ñ‚Ð¾Ð¼Ñƒ** | /tÉ”Ëˆmu/ | therefore | ÑÐ¿Ð¾Ð»ÑƒÑ‡Ð½. | Ð¿Ñ€Ð¸Ñ‡Ð¸Ð½Ð°-Ð½Ð°ÑÐ»Ñ–Ð´Ð¾Ðº |\n| **Ñ‡ÐµÑ€ÐµÐ· Ñ†Ðµ** | /ËˆtÊƒÉ›rÉ›z tÍ¡sÉ›/ | because of this | Ð¿Ñ€Ð¸ÑÐ». | Ð¿Ð¾ÑÑÐ½ÐµÐ½Ð½Ñ |\n| **Ð·Ð½Ð°Ñ‡Ð¸Ñ‚ÑŒ** | /ËˆznÉ‘tÊƒÉªtÊ²/ | it means, therefore | Ð´Ñ–Ñ”ÑÐ». | Ð»Ð¾Ð³Ñ–Ñ‡Ð½Ð¸Ð¹ Ð²Ð¸ÑÐ½Ð¾Ð²Ð¾Ðº |\n| **Ð²Ð¸Ñ…Ð¾Ð´Ð¸Ñ‚ÑŒ** | /wÉªËˆxÉ”dÉªtÊ²/ | it turns out | Ð´Ñ–Ñ”ÑÐ». | Ð²Ð¸ÑÐ²Ð»ÑÑ”Ñ‚ÑŒÑÑ |\n| **Ð²ÑÐµ Ð¾Ð´Ð½Ð¾** | /wsÊ²É› É”dËˆnÉ”/ | anyway, nevertheless | Ð¿Ñ€Ð¸ÑÐ». | Ð½ÐµÐ·Ð²Ð°Ð¶Ð°ÑŽÑ‡Ð¸ Ð½Ñ– Ð½Ð° Ñ‰Ð¾ |\n",
    "createdAt": "2025-12-25T19:48:31.843589Z",
    "modifiedAt": "2025-12-25T19:48:31.843589Z",
    "version": 2
  },
  "activities": [],
  "vocabulary": {
    "moduleId": "mod-uk-B1-31",
    "level": "B1",
    "phase": "B1.3a Complex Sentences",
    "wordCount": 25,
    "newWordCount": 25,
    "reviewWordCount": 0,
    "transliterationMode": "none",
    "words": [
      {
        "id": "vocab-1",
        "uk": "**ÑÐºÑ‰Ð¾**",
        "ipa": "/jÉ‘kËˆÊƒtÊƒÉ”/",
        "en": "if",
        "pos": "ÑÐ¿Ð¾Ð»ÑƒÑ‡Ð½.",
        "gender": null,
        "note": ""
      },
      {
        "id": "vocab-2",
        "uk": "**ÐºÐ¾Ð»Ð¸**",
        "ipa": "/kÉ”ËˆlÉª/",
        "en": "when, if (conditional)",
        "pos": "ÑÐ¿Ð¾Ð»ÑƒÑ‡Ð½.",
        "gender": null,
        "note": ""
      },
      {
        "id": "vocab-3",
        "uk": "**Ñƒ Ð²Ð¸Ð¿Ð°Ð´ÐºÑƒ ÑÐºÑ‰Ð¾**",
        "ipa": "/u ËˆwÉªpÉ‘dku jÉ‘kËˆÊƒtÊƒÉ”/",
        "en": "in case if",
        "pos": "ÑÐ¿Ð¾Ð»ÑƒÑ‡Ð½.",
        "gender": null,
        "note": ""
      },
      {
        "id": "vocab-4",
        "uk": "**Ð·Ð° ÑƒÐ¼Ð¾Ð²Ð¸ Ñ‰Ð¾**",
        "ipa": "/zÉ‘ uËˆmÉ”wÉª ÊƒtÊƒÉ”/",
        "en": "provided that",
        "pos": "ÑÐ¿Ð¾Ð»ÑƒÑ‡Ð½.",
        "gender": null,
        "note": ""
      },
      {
        "id": "vocab-5",
        "uk": "**Ð¿Ñ€Ð¸ ÑƒÐ¼Ð¾Ð²Ñ– Ñ‰Ð¾**",
        "ipa": "/prÉª uËˆmÉ”wÉª ÊƒtÊƒÉ”/",
        "en": "on condition that",
        "pos": "ÑÐ¿Ð¾Ð»ÑƒÑ‡Ð½.",
        "gender": null,
        "note": ""
      },
      {
        "id": "vocab-6",
        "uk": "**Ñƒ Ñ€Ð°Ð·Ñ– ÑÐºÑ‰Ð¾**",
        "ipa": "/u ËˆrÉ‘zÊ²i jÉ‘kËˆÊƒtÊƒÉ”/",
        "en": "in the event that",
        "pos": "ÑÐ¿Ð¾Ð»ÑƒÑ‡Ð½.",
        "gender": null,
        "note": ""
      },
      {
        "id": "vocab-7",
        "uk": "**ÑƒÐ¼Ð¾Ð²Ð°**",
        "ipa": "/uËˆmÉ”wÉ‘/",
        "en": "condition",
        "pos": "Ñ–Ð¼. (Ð¶.Ñ€.)",
        "gender": null,
        "note": ""
      },
      {
        "id": "vocab-8",
        "uk": "**Ð½Ð°ÑÐ»Ñ–Ð´Ð¾Ðº**",
        "ipa": "/nÉ‘ËˆslÊ²idÉ”k/",
        "en": "consequence, result",
        "pos": "Ñ–Ð¼. (Ñ‡.Ñ€.)",
        "gender": null,
        "note": ""
      },
      {
        "id": "vocab-9",
        "uk": "**Ñ‚Ð¾Ð´Ñ–**",
        "ipa": "/tÉ”ËˆdÊ²i/",
        "en": "then",
        "pos": "Ð¿Ñ€Ð¸ÑÐ».",
        "gender": null,
        "note": ""
      },
      {
        "id": "vocab-10",
        "uk": "**Ð¼Ð¾Ð¶Ð»Ð¸Ð²Ð¾**",
        "ipa": "/mÉ”Ê’ËˆlÉªwÉ”/",
        "en": "possibly, maybe",
        "pos": "Ð¿Ñ€Ð¸ÑÐ».",
        "gender": null,
        "note": ""
      },
      {
        "id": "vocab-11",
        "uk": "**Ð¹Ð¼Ð¾Ð²Ñ–Ñ€Ð½Ð¾**",
        "ipa": "/jmÉ”ËˆwÊ²irnÉ”/",
        "en": "probably",
        "pos": "Ð¿Ñ€Ð¸ÑÐ».",
        "gender": null,
        "note": ""
      },
      {
        "id": "vocab-12",
        "uk": "**Ð¿ÐµÐ²Ð½Ð¾**",
        "ipa": "/ËˆpewnÉ”/",
        "en": "surely, certainly",
        "pos": "Ð¿Ñ€Ð¸ÑÐ».",
        "gender": null,
        "note": ""
      },
      {
        "id": "vocab-13",
        "uk": "**Ð½Ð°Ð¿ÐµÐ²Ð½Ð¾**",
        "ipa": "/nÉ‘ËˆpewnÉ”/",
        "en": "certainly, for sure",
        "pos": "Ð¿Ñ€Ð¸ÑÐ».",
        "gender": null,
        "note": ""
      },
      {
        "id": "vocab-14",
        "uk": "**Ð¼Ð¾Ð¶Ð»Ð¸Ð²Ñ–ÑÑ‚ÑŒ**",
        "ipa": "/mÉ”Ê’ËˆlÉªwÊ²istÊ²/",
        "en": "possibility",
        "pos": "Ñ–Ð¼. (Ð¶.Ñ€.)",
        "gender": null,
        "note": ""
      },
      {
        "id": "vocab-15",
        "uk": "**Ð² Ñ‚Ð°ÐºÐ¾Ð¼Ñƒ Ñ€Ð°Ð·Ñ–**",
        "ipa": "/w tÉ‘ËˆkÉ”mu ËˆrÉ‘zÊ²i/",
        "en": "in that case",
        "pos": "Ð¿Ñ€Ð¸ÑÐ».",
        "gender": null,
        "note": ""
      },
      {
        "id": "vocab-16",
        "uk": "**Ñ–Ð½Ð°ÐºÑˆÐµ**",
        "ipa": "/iËˆnÉ‘kÊƒÉ›/",
        "en": "otherwise",
        "pos": "Ð¿Ñ€Ð¸ÑÐ».",
        "gender": null,
        "note": ""
      },
      {
        "id": "vocab-17",
        "uk": "**Ð² Ñ–Ð½ÑˆÐ¾Ð¼Ñƒ Ð²Ð¸Ð¿Ð°Ð´ÐºÑƒ**",
        "ipa": "/w ËˆinÊƒÉ”mu ËˆwÉªpÉ‘dku/",
        "en": "otherwise",
        "pos": "Ð¿Ñ€Ð¸ÑÐ».",
        "gender": null,
        "note": ""
      },
      {
        "id": "vocab-18",
        "uk": "**Ð¿Ñ€Ð¾Ñ‚Ðµ**",
        "ipa": "/prÉ”ËˆtÉ›/",
        "en": "however",
        "pos": "ÑÐ¿Ð¾Ð»ÑƒÑ‡Ð½.",
        "gender": null,
        "note": ""
      },
      {
        "id": "vocab-19",
        "uk": "**Ð¾Ð´Ð½Ð°Ðº**",
        "ipa": "/É”dËˆnÉ‘k/",
        "en": "however",
        "pos": "ÑÐ¿Ð¾Ð»ÑƒÑ‡Ð½.",
        "gender": null,
        "note": ""
      },
      {
        "id": "vocab-20",
        "uk": "**Ð¾Ñ‚Ð¶Ðµ**",
        "ipa": "/É”tËˆÊ’É›/",
        "en": "therefore, so",
        "pos": "ÑÐ¿Ð¾Ð»ÑƒÑ‡Ð½.",
        "gender": null,
        "note": ""
      },
      {
        "id": "vocab-21",
        "uk": "**Ñ‚Ð¾Ð¼Ñƒ**",
        "ipa": "/tÉ”Ëˆmu/",
        "en": "therefore",
        "pos": "ÑÐ¿Ð¾Ð»ÑƒÑ‡Ð½.",
        "gender": null,
        "note": ""
      },
      {
        "id": "vocab-22",
        "uk": "**Ñ‡ÐµÑ€ÐµÐ· Ñ†Ðµ**",
        "ipa": "/ËˆtÊƒÉ›rÉ›z tÍ¡sÉ›/",
        "en": "because of this",
        "pos": "Ð¿Ñ€Ð¸ÑÐ».",
        "gender": null,
        "note": ""
      },
      {
        "id": "vocab-23",
        "uk": "**Ð·Ð½Ð°Ñ‡Ð¸Ñ‚ÑŒ**",
        "ipa": "/ËˆznÉ‘tÊƒÉªtÊ²/",
        "en": "it means, therefore",
        "pos": "Ð´Ñ–Ñ”ÑÐ».",
        "gender": null,
        "note": ""
      },
      {
        "id": "vocab-24",
        "uk": "**Ð²Ð¸Ñ…Ð¾Ð´Ð¸Ñ‚ÑŒ**",
        "ipa": "/wÉªËˆxÉ”dÉªtÊ²/",
        "en": "it turns out",
        "pos": "Ð´Ñ–Ñ”ÑÐ».",
        "gender": null,
        "note": ""
      },
      {
        "id": "vocab-25",
        "uk": "**Ð²ÑÐµ Ð¾Ð´Ð½Ð¾**",
        "ipa": "/wsÊ²É› É”dËˆnÉ”/",
        "en": "anyway, nevertheless",
        "pos": "Ð¿Ñ€Ð¸ÑÐ».",
        "gender": null,
        "note": ""
      }
    ],
    "reviewWords": []
  }
}