{
  "$schema": "../../../schemas/vibe-module.schema.json",
  "lesson": {
    "id": "lesson-uk-B1-33",
    "moduleId": "mod-uk-B1-33",
    "languagePair": "l2-uk-en",
    "subject": "language",
    "owner": "curricula-opus",
    "visibility": "public",
    "language": "uk",
    "targetLevel": "B1",
    "phase": "B1.3a Complex Sentences",
    "moduleNumber": 33,
    "moduleType": "grammar",
    "pedagogy": "TTT",
    "immersionLevel": 0.6,
    "title": "Ð£Ð¼Ð¾Ð²Ð½Ñ– Ñ€ÐµÑ‡ÐµÐ½Ð½Ñ: Ð·Ð¼Ñ–ÑˆÐ°Ð½Ñ– Ñ‚Ð° ÑÐºÐ»Ð°Ð´Ð½Ñ– ÑƒÐ¼Ð¾Ð²Ð¸",
    "titleUk": null,
    "subtitle": "Mixed and Complex Conditionals",
    "description": "Learner understands mixed conditional types",
    "objectives": [
      "Learner understands mixed conditional types",
      "Learner can combine real and unreal conditions",
      "Learner can form chained conditional sentences"
    ],
    "objectivesUk": null,
    "grammarFocus": [
      "Mixed conditional constructions",
      "Chained conditionals",
      "Complex condition-consequence relationships"
    ],
    "tags": [
      "grammar",
      "conditionals",
      "complex-sentences",
      "mixed-conditionals"
    ],
    "totalDuration": 90,
    "transliterationMode": "none",
    "sections": [
      {
        "id": "section-1",
        "name": "ÐŸÑ–Ð´ÑÑƒÐ¼Ð¾Ðº",
        "nameEn": null,
        "type": "summary",
        "content": "**Ð©Ð¾ Ð²Ð¸ Ð½Ð°Ð²Ñ‡Ð¸Ð»Ð¸ÑÑ Ð² Ñ†ÑŒÐ¾Ð¼Ñƒ Ð¼Ð¾Ð´ÑƒÐ»Ñ–:**\n\n1. **Ð—Ð¼Ñ–ÑˆÐ°Ð½Ð° ÑƒÐ¼Ð¾Ð²Ð° (Ð¼Ð¸Ð½ÑƒÐ»Ðµ â†’ Ñ‚ÐµÐ¿ÐµÑ€Ñ–ÑˆÐ½Ñ”):** Ð¯ÐºÐ±Ð¸ Ñ Ð²Ð¸Ð²Ñ‡Ð¸Ð² Ñ‚Ð¾Ð´Ñ–, Ð·Ð°Ñ€Ð°Ð· Ð±Ð¸ Ð·Ð½Ð°Ð².\n2. **Ð—Ð¼Ñ–ÑˆÐ°Ð½Ð° ÑƒÐ¼Ð¾Ð²Ð° (Ñ‚ÐµÐ¿ÐµÑ€Ñ–ÑˆÐ½Ñ” â†’ Ð¼Ð¸Ð½ÑƒÐ»Ðµ):** Ð¯ÐºÐ±Ð¸ Ñ Ð±ÑƒÐ² ÑÐ¼Ñ–Ð»Ð¸Ð²Ñ–ÑˆÐ¸Ð¼, ÑÐºÐ°Ð·Ð°Ð² Ð±Ð¸ Ñ‚Ð¾Ð´Ñ–.\n3. **Ð›Ð°Ð½Ñ†ÑŽÐ³Ð¾Ð²Ñ– ÑƒÐ¼Ð¾Ð²Ð¸:** Ð¯ÐºÑ‰Ð¾ A, Ñ– ÑÐºÑ‰Ð¾ B, Ñ‚Ð¾ C.\n4. **ÐÐ°ÑÐ»Ñ–Ð´ÐºÐ¾Ð²Ñ– Ð»Ð°Ð½Ñ†ÑŽÐ³Ð¸:** Ð¯ÐºÑ‰Ð¾ A â†’ B â†’ C.\n\n**ÐžÑÐ½Ð¾Ð²Ð½Ðµ Ð¿Ñ€Ð°Ð²Ð¸Ð»Ð¾:**\n\n> Ð£ Ð·Ð¼Ñ–ÑˆÐ°Ð½Ð¸Ñ… ÑƒÐ¼Ð¾Ð²Ð°Ñ… Ñ‡Ð°Ñ ÑƒÐ¼Ð¾Ð²Ð¸ â‰  Ñ‡Ð°Ñ Ð½Ð°ÑÐ»Ñ–Ð´ÐºÑƒ. Ð’Ð¸ÐºÐ¾Ñ€Ð¸ÑÑ‚Ð¾Ð²ÑƒÐ¹Ñ‚Ðµ Ñ‡Ð°ÑÐ¾Ð²Ñ– Ð¼Ð°Ñ€ÐºÐµÑ€Ð¸ (Ñ‚Ð¾Ð´Ñ–, Ð·Ð°Ñ€Ð°Ð·) Ð´Ð»Ñ ÑÑÐ½Ð¾ÑÑ‚Ñ–.\n\n**Ð”Ð°Ð»Ñ–:**\n\nÐ£ Ð¼Ð¾Ð´ÑƒÐ»Ñ– 34 Ð²Ð¸ ÑÐºÐ»Ð°Ð´ÐµÑ‚Ðµ **ÐºÐ¾Ð½Ñ‚Ñ€Ð¾Ð»ÑŒÐ½Ñƒ Ñ‚Ð¾Ñ‡ÐºÑƒ** Ð· ÑƒÑÑ–Ñ… ÑÐºÐ»Ð°Ð´Ð½Ð¸Ñ… Ñ€ÐµÑ‡ÐµÐ½ÑŒ: Ð²Ñ–Ð´Ð½Ð¾ÑÐ½Ð¸Ñ… (ÑÐºÐ¸Ð¹, Ð´Ðµ, ÐºÐ¾Ð»Ð¸), Ð¼ÐµÑ‚Ð¸ (Ñ‰Ð¾Ð±), Ñ‚Ð° ÑƒÐ¼Ð¾Ð²Ð½Ð¸Ñ… (ÑÐºÑ‰Ð¾, ÑÐºÐ±Ð¸, Ð·Ð¼Ñ–ÑˆÐ°Ð½Ð¸Ñ…). Ð¦Ðµ Ð¿Ñ–Ð´Ð³Ð¾Ñ‚ÑƒÑ” Ð²Ð°Ñ Ð´Ð¾ Ñ„Ð°Ð·Ð¸ B1.3b â€” Ð´Ð¾Ð¿ÑƒÑÑ‚Ð¾Ð²Ñ–, Ð¿Ñ€Ð¸Ñ‡Ð¸Ð½Ð¾Ð²Ñ– Ñ‚Ð° Ñ‡Ð°ÑÐ¾Ð²Ñ– Ñ€ÐµÑ‡ÐµÐ½Ð½Ñ.\n\n> âœ… **Ð¡Ð°Ð¼Ð¾Ð¿ÐµÑ€ÐµÐ²Ñ–Ñ€ÐºÐ°**\n>\n> Ð§Ð¸ Ð¼Ð¾Ð¶ÐµÑ‚Ðµ Ð²Ð¸:\n> - [ ] Ð¡Ñ„Ð¾Ñ€Ð¼ÑƒÐ»ÑŽÐ²Ð°Ñ‚Ð¸ Ð·Ð¼Ñ–ÑˆÐ°Ð½Ñƒ ÑƒÐ¼Ð¾Ð²Ñƒ Â«Ð¼Ð¸Ð½ÑƒÐ»Ðµ â†’ Ñ‚ÐµÐ¿ÐµÑ€Ñ–ÑˆÐ½Ñ”Â»?\n> - [ ] Ð¡Ñ„Ð¾Ñ€Ð¼ÑƒÐ»ÑŽÐ²Ð°Ñ‚Ð¸ Ð·Ð¼Ñ–ÑˆÐ°Ð½Ñƒ ÑƒÐ¼Ð¾Ð²Ñƒ Â«Ñ‚ÐµÐ¿ÐµÑ€Ñ–ÑˆÐ½Ñ” â†’ Ð¼Ð¸Ð½ÑƒÐ»ÐµÂ»?\n> - [ ] ÐŸÐ¾Ð±ÑƒÐ´ÑƒÐ²Ð°Ñ‚Ð¸ Ð»Ð°Ð½Ñ†ÑŽÐ³Ð¾Ð²Ñƒ ÑƒÐ¼Ð¾Ð²Ñƒ Ð· ÐºÑ–Ð»ÑŒÐºÐ¾Ð¼Ð° Â«ÑÐºÑ‰Ð¾Â»?\n> - [ ] ÐŸÑ€Ð°Ð²Ð¸Ð»ÑŒÐ½Ð¾ Ð²Ð¸ÐºÐ¾Ñ€Ð¸ÑÑ‚Ð°Ñ‚Ð¸ Ñ‡Ð°ÑÐ¾Ð²Ñ– Ð¼Ð°Ñ€ÐºÐµÑ€Ð¸ (Ñ‚Ð¾Ð´Ñ–, Ð·Ð°Ñ€Ð°Ð·)?\n>\n> Ð¯ÐºÑ‰Ð¾ Ñ‚Ð°Ðº â€” Ð²Ð¸ Ð³Ð¾Ñ‚Ð¾Ð²Ñ– Ð´Ð¾ ÐºÐ¾Ð½Ñ‚Ñ€Ð¾Ð»ÑŒÐ½Ð¾Ñ— Ñ‚Ð¾Ñ‡ÐºÐ¸!\n\n---\n\n> [!resources] ðŸŽ§ Ð—Ð¾Ð²Ð½Ñ–ÑˆÐ½Ñ– Ñ€ÐµÑÑƒÑ€ÑÐ¸\n>\n> **Ð”Ð¾Ð´Ð°Ñ‚ÐºÐ¾Ð²Ñ– Ð¼Ð°Ñ‚ÐµÑ€Ñ–Ð°Ð»Ð¸ Ð´Ð»Ñ Ð²Ð¸Ð²Ñ‡ÐµÐ½Ð½Ñ:**\n> - ðŸ“– [Ð£Ð¼Ð¾Ð²Ð½Ñ– Ñ€ÐµÑ‡ÐµÐ½Ð½Ñ](https://uk.wikipedia.org/wiki/Ð¡ÐºÐ»Ð°Ð´Ð½Ð¾Ð¿Ñ–Ð´Ñ€ÑÐ´Ð½Ðµ_Ñ€ÐµÑ‡ÐµÐ½Ð½Ñ) â€” Ð’Ñ–ÐºÑ–Ð¿ÐµÐ´Ñ–Ñ\n> - ðŸ“º [Ukrainian Grammar](https://www.youtube.com/@ukrainianlesson) â€” Ð²Ñ–Ð´ÐµÐ¾ÑƒÑ€Ð¾ÐºÐ¸\n> - ðŸŽ§ [Ukrainian Lessons Podcast](https://ukrainianlessons.com/) â€” Ð¿Ð¾Ð´ÐºÐ°ÑÑ‚ Ð´Ð»Ñ Ð²Ð¸Ð²Ñ‡ÐµÐ½Ð½Ñ\n\n---"
      },
      {
        "id": "section-2",
        "name": "Ð’Ð¿Ñ€Ð°Ð²Ð¸",
        "nameEn": null,
        "type": "activities",
        "content": "## quiz: Ð’Ð¸Ð±ÐµÑ€Ñ–Ñ‚ÑŒ Ð¿Ñ€Ð°Ð²Ð¸Ð»ÑŒÐ½Ñƒ Ð²Ñ–Ð´Ð¿Ð¾Ð²Ñ–Ð´ÑŒ\n\n1. Ð¯ÐºÐµ Ñ€ÐµÑ‡ÐµÐ½Ð½Ñ Ñ” Ð¿Ñ€Ð¸ÐºÐ»Ð°Ð´Ð¾Ð¼ Ð·Ð¼Ñ–ÑˆÐ°Ð½Ð¾Ñ— ÑƒÐ¼Ð¾Ð²Ð¸, Ð´Ðµ Ð¼Ð¸Ð½ÑƒÐ»Ð° Ð¿Ð¾Ð´Ñ–Ñ Ð²Ð¿Ð»Ð¸Ð²Ð°Ñ” Ð½Ð° Ñ‚ÐµÐ¿ÐµÑ€Ñ–ÑˆÐ½ÑŽ ÑÐ¸Ñ‚ÑƒÐ°Ñ†Ñ–ÑŽ?\n   - [x] Ð¯ÐºÐ±Ð¸ Ñ Ð²Ð¸Ð²Ñ‡Ð¸Ð² Ñ‚Ð¾Ð´Ñ–, Ð·Ð°Ñ€Ð°Ð· Ð±Ð¸ Ð·Ð½Ð°Ð² Ð²Ñ–Ð´Ð¿Ð¾Ð²Ñ–Ð´ÑŒ.\n   - [ ] Ð¯ÐºÐ±Ð¸ Ñ Ð¼Ð°Ð² Ñ‡Ð°Ñ, Ð´Ð¾Ð¿Ð¾Ð¼Ñ–Ð³ Ð±Ð¸ Ñ‚Ð¾Ð±Ñ–.\n   - [ ] Ð¯ÐºÑ‰Ð¾ Ð¼Ð°Ñ‚Ð¸Ð¼ÐµÑˆ Ñ‡Ð°Ñ, Ð·Ð°Ñ‚ÐµÐ»ÐµÑ„Ð¾Ð½ÑƒÐ¹ Ð¼ÐµÐ½Ñ–.\n   - [ ] Ð¯ÐºÐ±Ð¸ Ð²Ñ–Ð½ Ð¿Ñ€Ð¸Ð¹ÑˆÐ¾Ð², Ð¼Ð¸ Ð± Ð¿Ð¾Ð³Ð¾Ð²Ð¾Ñ€Ð¸Ð»Ð¸.\n   > ÐœÐ¸Ð½ÑƒÐ»Ð¸Ð¹ Ñ‡Ð°Ñ ÑƒÐ¼Ð¾Ð²Ð¸ â†’ Ñ‚ÐµÐ¿ÐµÑ€Ñ–ÑˆÐ½Ñ–Ð¹ Ñ‡Ð°Ñ Ð½Ð°ÑÐ»Ñ–Ð´ÐºÑƒ = Ð·Ð¼Ñ–ÑˆÐ°Ð½Ð° ÑƒÐ¼Ð¾Ð²Ð°.\n\n2. Ð¯ÐºÐµ Ñ€ÐµÑ‡ÐµÐ½Ð½Ñ Ñ” Ð¿Ñ€Ð¸ÐºÐ»Ð°Ð´Ð¾Ð¼ Ð·Ð¼Ñ–ÑˆÐ°Ð½Ð¾Ñ— ÑƒÐ¼Ð¾Ð²Ð¸, Ð´Ðµ Ñ‚ÐµÐ¿ÐµÑ€Ñ–ÑˆÐ½Ñ Ñ€Ð¸ÑÐ° Ð¿Ð¾ÑÑÐ½ÑŽÑ” Ð¼Ð¸Ð½ÑƒÐ»Ñƒ Ð¿Ð¾Ð´Ñ–ÑŽ?\n   - [ ] Ð¯ÐºÐ±Ð¸ Ñ Ð²Ð¸Ð²Ñ‡Ð¸Ð², Ð·Ð½Ð°Ð² Ð±Ð¸ Ð·Ð°Ñ€Ð°Ð·.\n   - [x] Ð¯ÐºÐ±Ð¸ Ñ Ð±ÑƒÐ² ÑÐ¼Ñ–Ð»Ð¸Ð²Ñ–ÑˆÐ¸Ð¼, ÑÐºÐ°Ð·Ð°Ð² Ð±Ð¸ Ñ—Ð¹ Ð¿Ñ€Ð°Ð²Ð´Ñƒ Ñ‚Ð¾Ð´Ñ–.\n   - [ ] Ð¯ÐºÑ‰Ð¾ Ñ…Ð¾Ñ‡ÐµÑˆ, Ð´Ð¾Ð¿Ð¾Ð¼Ð¾Ð¶Ñƒ Ñ‚Ð¾Ð±Ñ–.\n   - [ ] Ð¯ÐºÐ±Ð¸ Ð²Ñ–Ð½ Ð¿Ñ€Ð¸Ð¹ÑˆÐ¾Ð², Ð¿Ð¾Ð³Ð¾Ð²Ð¾Ñ€Ð¸Ð»Ð¸ Ð±.\n   > Ð¢ÐµÐ¿ÐµÑ€Ñ–ÑˆÐ½Ñ Ñ€Ð¸ÑÐ° â†’ Ð¼Ð¸Ð½ÑƒÐ»Ð° Ð´Ñ–Ñ = Ð·Ð¼Ñ–ÑˆÐ°Ð½Ð° ÑƒÐ¼Ð¾Ð²Ð° Ñ‚Ð¸Ð¿Ñƒ 2.\n\n3. Ð¯ÐºÐµ Ð· Ð½Ð°Ð²ÐµÐ´ÐµÐ½Ð¸Ñ… Ñ€ÐµÑ‡ÐµÐ½ÑŒ Ñ” Ð¿Ñ€Ð°Ð²Ð¸Ð»ÑŒÐ½Ð¾ÑŽ Ð»Ð°Ð½Ñ†ÑŽÐ³Ð¾Ð²Ð¾ÑŽ ÑƒÐ¼Ð¾Ð²Ð¾ÑŽ Ð· ÐºÑ–Ð»ÑŒÐºÐ¾Ð¼Ð° Ð¿Ñ–Ð´Ñ€ÑÐ´Ð½Ð¸Ð¼Ð¸ Ñ€ÐµÑ‡ÐµÐ½Ð½ÑÐ¼Ð¸ Ð² ÑƒÐºÑ€Ð°Ñ—Ð½ÑÑŒÐºÑ–Ð¹ Ð¼Ð¾Ð²Ñ–?\n   - [x] Ð¯ÐºÑ‰Ð¾ Ð¿Ñ€Ð¸Ð¹Ð´Ðµ, Ñ– ÑÐºÑ‰Ð¾ Ð¼Ð°Ñ‚Ð¸Ð¼Ðµ Ñ‡Ð°Ñ, Ð¿Ð¾Ð³Ð¾Ð²Ð¾Ñ€Ð¸Ð¼Ð¾ Ð· Ð½Ð¸Ð¼.\n   - [ ] Ð¯ÐºÑ‰Ð¾ Ð¿Ñ€Ð¸Ð¹Ð´Ðµ, Ñ– ÑÐºÐ±Ð¸ Ð¼Ð°Ð² Ñ‡Ð°Ñ, Ð¿Ð¾Ð³Ð¾Ð²Ð¾Ñ€Ð¸Ð¼Ð¾.\n   - [ ] Ð¯ÐºÐ±Ð¸ Ð¿Ñ€Ð¸Ð¹ÑˆÐ¾Ð², Ñ– ÑÐºÑ‰Ð¾ Ð¼Ð°Ñ‚Ð¸Ð¼Ðµ Ñ‡Ð°Ñ, Ð¿Ð¾Ð³Ð¾Ð²Ð¾Ñ€Ð¸Ð¼Ð¾.\n   - [ ] Ð¯ÐºÑ‰Ð¾ Ð¹ ÑÐºÑ‰Ð¾ Ð¿Ñ€Ð¸Ð¹Ð´Ðµ Ð¼Ð°Ñ‚Ð¸Ð¼Ðµ Ñ‡Ð°Ñ, Ð¿Ð¾Ð³Ð¾Ð²Ð¾Ñ€Ð¸Ð¼Ð¾.\n   > Ð’ Ð»Ð°Ð½Ñ†ÑŽÐ³Ñƒ Ð²ÑÑ– ÑƒÐ¼Ð¾Ð²Ð¸ Ð¼Ð°ÑŽÑ‚ÑŒ Ð±ÑƒÑ‚Ð¸ Ð°Ð±Ð¾ Ñ€ÐµÐ°Ð»ÑŒÐ½Ð¸Ð¼Ð¸, Ð°Ð±Ð¾ Ð½ÐµÑ€ÐµÐ°Ð»ÑŒÐ½Ð¸Ð¼Ð¸.\n\n4. Ð¯Ðº Ð¿Ñ€Ð°Ð²Ð¸Ð»ÑŒÐ½Ð¾ Ð²Ð¸Ñ€Ð°Ð·Ð¸Ñ‚Ð¸ Ð´ÑƒÐ¼ÐºÑƒ Â«If I had studied then, I would know nowÂ»?\n   - [ ] Ð¯ÐºÑ‰Ð¾ Ð²Ð¸Ð²Ñ‡Ñƒ, Ð·Ð½Ð°Ñ‚Ð¸Ð¼Ñƒ Ð·Ð°Ñ€Ð°Ð·.\n   - [x] Ð¯ÐºÐ±Ð¸ Ñ Ð²Ð¸Ð²Ñ‡Ð¸Ð² Ñ‚Ð¾Ð´Ñ–, Ð·Ð°Ñ€Ð°Ð· Ð±Ð¸ Ð·Ð½Ð°Ð².\n   - [ ] Ð¯ÐºÐ±Ð¸ Ñ Ð²Ð¸Ð²Ñ‡Ñƒ, Ð·Ð½Ð°Ð² Ð±Ð¸ Ð·Ð°Ñ€Ð°Ð·.\n   - [ ] Ð¯ÐºÑ‰Ð¾ Ð²Ð¸Ð²Ñ‡Ð¸Ð², Ð·Ð½Ð°ÑŽ Ð·Ð°Ñ€Ð°Ð·.\n   > Ð—Ð¼Ñ–ÑˆÐ°Ð½Ð° ÑƒÐ¼Ð¾Ð²Ð°: Ð¼Ð¸Ð½ÑƒÐ»Ðµ â†’ Ñ‚ÐµÐ¿ÐµÑ€Ñ–ÑˆÐ½Ñ”.\n\n5. Ð¯ÐºÐ° ÑÐ°Ð¼Ðµ ÐºÐ¾Ð½ÑÑ‚Ñ€ÑƒÐºÑ†Ñ–Ñ Ð²Ð¸ÐºÐ¾Ñ€Ð¸ÑÑ‚Ð¾Ð²ÑƒÑ”Ñ‚ÑŒÑÑ Ð´Ð»Ñ Ð²Ð¸Ñ€Ð°Ð¶ÐµÐ½Ð½Ñ Ð°Ð»ÑŒÑ‚ÐµÑ€Ð½Ð°Ñ‚Ð¸Ð²Ð½Ð¾Ð³Ð¾ Ð½Ð°ÑÐ»Ñ–Ð´ÐºÑƒ Ð² ÑƒÐºÑ€Ð°Ñ—Ð½ÑÑŒÐºÐ¾Ð¼Ñƒ ÑƒÐ¼Ð¾Ð²Ð½Ð¾Ð¼Ñƒ Ñ€ÐµÑ‡ÐµÐ½Ð½Ñ–?\n   - [ ] Ñ‚Ð¾Ð¼Ñƒ Ñ‰Ð¾\n   - [ ] Ñ…Ð¾Ñ‡Ð°\n   - [x] Ñ–Ð½Ð°ÐºÑˆÐµ\n   - [ ] Ñ‚Ð¾Ð±Ñ‚Ð¾\n   > Â«Ð†Ð½Ð°ÐºÑˆÐµÂ» = otherwise, Ð°Ð»ÑŒÑ‚ÐµÑ€Ð½Ð°Ñ‚Ð¸Ð²Ð½Ð¸Ð¹ Ð½Ð°ÑÐ»Ñ–Ð´Ð¾Ðº.\n\n6. Ð§Ð¾Ð¼Ñƒ Ð² Ñ€ÐµÑ‡ÐµÐ½Ð½Ñ– Â«Ð¯ÐºÐ±Ð¸ Ñ Ð²Ð¸Ð²Ñ‡Ð¸Ð² Ñ‚Ð¾Ð´Ñ–, Ð·Ð°Ñ€Ð°Ð· Ð±Ð¸ Ð·Ð½Ð°Ð²Â» Ð¿Ð¾Ñ‚Ñ€Ñ–Ð±Ð½Ð° Ñ‡Ð°ÑÑ‚ÐºÐ° Â«Ð±Â» Ñƒ Ð½Ð°ÑÐ»Ñ–Ð´ÐºÑƒ?\n   - [ ] Ð¢Ð¾Ð¼Ñƒ Ñ‰Ð¾ Ñ†Ðµ Ð¼Ð¸Ð½ÑƒÐ»Ð¸Ð¹ Ñ‡Ð°Ñ.\n   - [ ] Ð¢Ð¾Ð¼Ñƒ Ñ‰Ð¾ ÑÑƒÐ±'Ñ”ÐºÑ‚Ð¸ Ñ€Ñ–Ð·Ð½Ñ–.\n   - [x] Ð¢Ð¾Ð¼Ñƒ Ñ‰Ð¾ Ð½Ð°ÑÐ»Ñ–Ð´Ð¾Ðº Ñ” Ð³Ñ–Ð¿Ð¾Ñ‚ÐµÑ‚Ð¸Ñ‡Ð½Ð¸Ð¼.\n   - [ ] Ð¢Ð¾Ð¼Ñƒ Ñ‰Ð¾ Ñ†Ðµ Ñ‚ÐµÐ¿ÐµÑ€Ñ–ÑˆÐ½Ñ–Ð¹ Ñ‡Ð°Ñ.\n   > Ð§Ð°ÑÑ‚ÐºÐ° Â«Ð±Â» Ð¿Ð¾Ð·Ð½Ð°Ñ‡Ð°Ñ” ÑƒÐ¼Ð¾Ð²Ð½Ð¸Ð¹ (Ð³Ñ–Ð¿Ð¾Ñ‚ÐµÑ‚Ð¸Ñ‡Ð½Ð¸Ð¹) ÑÐ¿Ð¾ÑÑ–Ð±.\n\n7. Ð¯ÐºÐµ Ð· Ð½Ð°Ð²ÐµÐ´ÐµÐ½Ð¸Ñ… Ñ€ÐµÑ‡ÐµÐ½ÑŒ Ñ” Ð¿Ñ€Ð¸ÐºÐ»Ð°Ð´Ð¾Ð¼ Ð½Ð°ÑÐ»Ñ–Ð´ÐºÐ¾Ð²Ð¾Ð³Ð¾ Ð»Ð°Ð½Ñ†ÑŽÐ³Ð° ÑƒÐ¼Ð¾Ð² Ñƒ Ñ€ÐµÐ°Ð»Ñ–ÑÑ‚Ð¸Ñ‡Ð½Ð¾Ð¼Ñƒ ÑÑ†ÐµÐ½Ð°Ñ€Ñ–Ñ—?\n   - [ ] Ð¯ÐºÐ±Ð¸ Ð¼Ð°Ð² Ð³Ñ€Ð¾ÑˆÑ–, ÐºÑƒÐ¿Ð¸Ð² Ð±Ð¸ Ð¼Ð°ÑˆÐ¸Ð½Ñƒ.\n   - [x] Ð¯ÐºÑ‰Ð¾ Ð²Ð¸Ð²Ñ‡Ð¸Ñˆ Ð¼Ð¾Ð²Ñƒ, Ð·Ð½Ð°Ð¹Ð´ÐµÑˆ Ñ€Ð¾Ð±Ð¾Ñ‚Ñƒ. Ð ÑÐºÑ‰Ð¾ Ð·Ð½Ð°Ð¹Ð´ÐµÑˆ, Ð·Ð°Ñ€Ð¾Ð±Ð¸Ñˆ Ð³Ñ€Ð¾ÑˆÑ–.\n   - [ ] Ð¯ÐºÐ±Ð¸ Ð¿Ñ€Ð¸Ð¹ÑˆÐ¾Ð², Ð¿Ð¾Ð³Ð¾Ð²Ð¾Ñ€Ð¸Ð»Ð¸ Ð± Ð· Ð½Ð¸Ð¼.\n   - [ ] Ð¯ÐºÑ‰Ð¾ Ñ…Ð¾Ñ‡ÐµÑˆ, Ð´Ð¾Ð¿Ð¾Ð¼Ð¾Ð¶Ñƒ Ñ‚Ð¾Ð±Ñ– Ð·Ð°Ñ€Ð°Ð·.\n   > Ð›Ð°Ð½Ñ†ÑŽÐ³: A â†’ B â†’ C.\n\n8. Ð¯Ðº Ð¼Ð¾Ð¶Ð½Ð° Ð²Ð¸Ð·Ð½Ð°Ñ‡Ð¸Ñ‚Ð¸, Ñ‡Ð¸ Ð¿Ð¾Ñ‚Ñ€Ñ–Ð±Ð½Ð° Ð·Ð¼Ñ–ÑˆÐ°Ð½Ð° ÑƒÐ¼Ð¾Ð²Ð°, Ñ‡Ð¸ ÑÑ‚Ð°Ð½Ð´Ð°Ñ€Ñ‚Ð½Ð° Ð½ÐµÑ€ÐµÐ°Ð»ÑŒÐ½Ð° Ð² ÐºÐ¾Ð½ÐºÑ€ÐµÑ‚Ð½Ð¾Ð¼Ñƒ Ð²Ð¸Ð¿Ð°Ð´ÐºÑƒ?\n   - [ ] Ð—Ð° ÐºÑ–Ð»ÑŒÐºÑ–ÑÑ‚ÑŽ ÑÐ»Ñ–Ð² Ñƒ Ñ€ÐµÑ‡ÐµÐ½Ð½Ñ–.\n   - [ ] Ð—Ð° Ñ€Ð¾Ð´Ð¾Ð¼ Ð¿Ñ–Ð´Ð¼ÐµÑ‚Ð° Ð² Ñ€ÐµÑ‡ÐµÐ½Ð½Ñ–.\n   - [x] Ð—Ð° Ñ‚Ð¸Ð¼, Ñ‡Ð¸ Ð·Ð±Ñ–Ð³Ð°ÑŽÑ‚ÑŒÑÑ Ñ‡Ð°ÑÐ¸ ÑƒÐ¼Ð¾Ð²Ð¸ Ñ‚Ð° Ð½Ð°ÑÐ»Ñ–Ð´ÐºÑƒ.\n   - [ ] Ð—Ð° Ð¿Ð¾Ð·Ð¸Ñ†Ñ–Ñ”ÑŽ Ñ‡Ð°ÑÑ‚ÐºÐ¸ Â«Ð±Â».\n   > Ð Ñ–Ð·Ð½Ñ– Ñ‡Ð°ÑÐ¸ = Ð·Ð¼Ñ–ÑˆÐ°Ð½Ð°, Ð¾Ð´Ð½Ð°ÐºÐ¾Ð²Ñ– = ÑÑ‚Ð°Ð½Ð´Ð°Ñ€Ñ‚Ð½Ð°.\n\n---\n\n## match-up: Ð—'Ñ”Ð´Ð½Ð°Ð¹Ñ‚Ðµ ÑƒÐ¼Ð¾Ð²Ñƒ Ð· Ð½Ð°ÑÐ»Ñ–Ð´ÐºÐ¾Ð¼\n\n- Ð¯ÐºÐ±Ð¸ Ñ Ð²Ð¸Ð²Ñ‡Ð¸Ð² Ñ‚Ð¾Ð´Ñ– :: Ð·Ð°Ñ€Ð°Ð· Ð±Ð¸ Ð·Ð½Ð°Ð² Ð²Ñ–Ð´Ð¿Ð¾Ð²Ñ–Ð´ÑŒ.\n- Ð¯ÐºÐ±Ð¸ Ñ Ð±ÑƒÐ² ÑÐ¼Ñ–Ð»Ð¸Ð²Ñ–ÑˆÐ¸Ð¼ :: ÑÐºÐ°Ð·Ð°Ð² Ð±Ð¸ Ñ—Ð¹ Ð¿Ñ€Ð°Ð²Ð´Ñƒ.\n- Ð¯ÐºÑ‰Ð¾ Ð¿Ñ€Ð¸Ð¹Ð´Ðµ, Ñ– ÑÐºÑ‰Ð¾ Ð¼Ð°Ñ‚Ð¸Ð¼Ðµ Ñ‡Ð°Ñ :: Ð¿Ð¾Ð³Ð¾Ð²Ð¾Ñ€Ð¸Ð¼Ð¾ Ð· Ð½Ð¸Ð¼.\n- Ð¯ÐºÐ±Ð¸ Ð¼Ð¸ Ð¿ÐµÑ€ÐµÑ—Ñ…Ð°Ð»Ð¸ Ñ‚Ð¾Ð´Ñ– :: Ð·Ð°Ñ€Ð°Ð· Ð±Ð¸ Ð¶Ð¸Ð»Ð¸ Ð² ÐšÐ¸Ñ”Ð²Ñ–.\n- Ð¯ÐºÑ‰Ð¾ Ð²Ð¸Ð²Ñ‡Ð¸Ñˆ Ð¼Ð¾Ð²Ñƒ :: Ð·Ð½Ð°Ð¹Ð´ÐµÑˆ Ñ…Ð¾Ñ€Ð¾ÑˆÑƒ Ñ€Ð¾Ð±Ð¾Ñ‚Ñƒ.\n- Ð¯ÐºÐ±Ð¸ Ð²Ñ–Ð½ Ð½Ðµ Ð·Ð°Ñ…Ð²Ð¾Ñ€Ñ–Ð² :: Ð¿Ñ€Ð°Ñ†ÑŽÐ²Ð°Ð² Ð±Ð¸ ÑÑŒÐ¾Ð³Ð¾Ð´Ð½Ñ–.\n- Ð†Ð½Ð°ÐºÑˆÐµ Ð½Ðµ Ð²ÑÑ‚Ð¸Ð³Ð½ÐµÐ¼Ð¾ :: Ð¿Ñ€Ð°Ñ†ÑŽÐ¹ ÑˆÐ²Ð¸Ð´ÑˆÐµ Ð·Ð°Ñ€Ð°Ð·.\n- Ð¯ÐºÐ±Ð¸ Ñ Ð±ÑƒÐ² Ð±Ð°Ð³Ð°Ñ‚ÑˆÐ¸Ð¼ :: Ð½Ðµ Ð·Ñ€Ð¾Ð±Ð¸Ð² Ð±Ð¸ Ñ‚Ñ–Ñ”Ñ— Ð¿Ð¾Ð¼Ð¸Ð»ÐºÐ¸.\n- Ð£ Ñ‚Ð°ÐºÐ¾Ð¼Ñƒ Ñ€Ð°Ð·Ñ– Ð·Ð°Ð»Ð¸ÑˆÐ¸Ð¼Ð¾ÑÑ Ð²Ð´Ð¾Ð¼Ð° :: ÑÐºÑ‰Ð¾ Ð±ÑƒÐ´Ðµ Ð´Ð¾Ñ‰.\n- Ð¯ÐºÑ‰Ð¾ Ð¿Ð¾Ñ‡Ð½ÐµÑˆ Ð·Ð°Ñ€Ð°Ð· :: Ð·Ð° Ñ€Ñ–Ðº Ð´Ð¾ÑÑÐ³Ð½ÐµÑˆ Ñ€ÐµÐ·ÑƒÐ»ÑŒÑ‚Ð°Ñ‚Ñƒ.\n- Ð¯ÐºÐ±Ð¸ Ð·Ð½Ð°Ð»Ð¸ Ð°Ð´Ñ€ÐµÑÑƒ :: Ð·Ð½Ð°Ð¹ÑˆÐ»Ð¸ Ð± Ð´Ð¾Ñ€Ð¾Ð³Ñƒ Ð²Ñ‡Ð¾Ñ€Ð°.\n- Ð’ Ñ–Ð½ÑˆÐ¾Ð¼Ñƒ Ð²Ð¸Ð¿Ð°Ð´ÐºÑƒ Ð·Ð²Ñ–Ð»ÑŒÐ½ÑÑ‚ÑŒ :: Ð¿Ñ€Ð°Ñ†ÑŽÐ¹ ÑÑ‚Ð°Ñ€Ð°Ð½Ð½Ñ–ÑˆÐµ.\n\n---\n\n## fill-in: Ð”Ð¾Ð¿Ð¾Ð²Ð½Ñ–Ñ‚ÑŒ Ñ€ÐµÑ‡ÐµÐ½Ð½Ñ Ð¿Ñ€Ð°Ð²Ð¸Ð»ÑŒÐ½Ð¾ÑŽ Ñ„Ð¾Ñ€Ð¼Ð¾ÑŽ\n\n1. Ð¯ÐºÐ±Ð¸ Ñ Ð²Ð¸Ð²Ñ‡Ð¸Ð² Ð°Ð½Ð³Ð»Ñ–Ð¹ÑÑŒÐºÑƒ ___, Ð·Ð°Ñ€Ð°Ð· Ð±Ð¸ Ð¼Ð°Ð² ÐºÑ€Ð°Ñ‰Ñƒ Ñ€Ð¾Ð±Ð¾Ñ‚Ñƒ.\n   > [!answer] Ñ‚Ð¾Ð´Ñ–\n   > [!options] Ñ‚Ð¾Ð´Ñ– | Ð·Ð°Ñ€Ð°Ð· | Ð·Ð°Ð²Ñ‚Ñ€Ð° | ÑÑŒÐ¾Ð³Ð¾Ð´Ð½Ñ–\n\n2. Ð¯ÐºÐ±Ð¸ Ð²Ñ–Ð½ ___ ÑÐ¼Ñ–Ð»Ð¸Ð²Ñ–ÑˆÐ¸Ð¼, ÑÐºÐ°Ð·Ð°Ð² Ð±Ð¸ Ñ—Ð¹ Ð¿Ñ€Ð°Ð²Ð´Ñƒ Ð¼Ð¸Ð½ÑƒÐ»Ð¾Ð³Ð¾ Ñ‚Ð¸Ð¶Ð½Ñ.\n   > [!answer] Ð±ÑƒÐ²\n   > [!options] Ð±ÑƒÐ² | Ñ” | Ð±ÑƒÐ´Ðµ | Ð±ÑƒÑ‚Ð¸\n\n3. Ð¯ÐºÑ‰Ð¾ Ð¿Ñ€Ð¸Ð¹Ð´Ðµ, ___ ÑÐºÑ‰Ð¾ Ð¼Ð°Ñ‚Ð¸Ð¼Ðµ Ñ‡Ð°Ñ, Ð¿Ð¾Ð³Ð¾Ð²Ð¾Ñ€Ð¸Ð¼Ð¾ Ð· Ð½Ð¸Ð¼ ÑÑŒÐ¾Ð³Ð¾Ð´Ð½Ñ–.\n   > [!answer] Ñ–\n   > [!options] Ñ– | Ð°Ð±Ð¾ | Ð°Ð»Ðµ | Ñ‡Ð¸\n\n4. Ð¯ÐºÐ±Ð¸ Ð¼Ð¸ Ð¿ÐµÑ€ÐµÑ—Ñ…Ð°Ð»Ð¸ Ð´Ð¾ ÐšÐ¸Ñ”Ð²Ð° Ñ‚Ð¾Ð´Ñ–, ___ Ð±Ð¸ Ð¶Ð¸Ð»Ð¸ Ñ‚Ð°Ð¼ Ð·Ð°Ñ€Ð°Ð·.\n   > [!answer] Ð¼Ð¸\n   > [!options] Ð¼Ð¸ | Ð²Ð¾Ð½Ð¸ | Ð²Ð¸ | Ñ\n\n5. Ð’Ð¸Ð²Ñ‡Ð°Ð¹ ÑÑ‚Ð°Ñ€Ð°Ð½Ð½Ð¾, ___ Ð½Ðµ Ð·Ð´Ð°ÑÐ¸ ÐµÐºÐ·Ð°Ð¼ÐµÐ½ Ð½Ð°ÑÑ‚ÑƒÐ¿Ð½Ð¾Ð³Ð¾ Ñ‚Ð¸Ð¶Ð½Ñ.\n   > [!answer] Ñ–Ð½Ð°ÐºÑˆÐµ\n   > [!options] Ñ–Ð½Ð°ÐºÑˆÐµ | Ñ‚Ð¾Ð¼Ñƒ | Ñ…Ð¾Ñ‡Ð° | Ð±Ð¾\n\n6. Ð¯ÐºÐ±Ð¸ Ñ ___ Ð¿Ñ€Ð¾ Ñ†Ðµ Ñ€Ð°Ð½Ñ–ÑˆÐµ, Ð¿Ð¾Ð¿ÐµÑ€ÐµÐ´Ð¸Ð² Ð±Ð¸ Ñ‚ÐµÐ±Ðµ Ð½ÐµÐ³Ð°Ð¹Ð½Ð¾.\n   > [!answer] Ð·Ð½Ð°Ð²\n   > [!options] Ð·Ð½Ð°Ð² | Ð·Ð½Ð°ÑŽ | Ð·Ð½Ð°Ñ‚Ð¸Ð¼Ñƒ | Ð·Ð½Ð°Ñ‚Ð¸\n\n7. Ð¯ÐºÑ‰Ð¾ Ð²Ð¸Ð²Ñ‡Ð¸Ñˆ Ð¼Ð¾Ð²Ñƒ, Ð·Ð½Ð°Ð¹Ð´ÐµÑˆ Ñ€Ð¾Ð±Ð¾Ñ‚Ñƒ. Ð ÑÐºÑ‰Ð¾ Ð·Ð½Ð°Ð¹Ð´ÐµÑˆ Ñ€Ð¾Ð±Ð¾Ñ‚Ñƒ, ___ Ð³Ñ€Ð¾ÑˆÑ–.\n   > [!answer] Ð·Ð°Ñ€Ð¾Ð±Ð¸Ñˆ\n   > [!options] Ð·Ð°Ñ€Ð¾Ð±Ð¸Ñˆ | Ð·Ð°Ñ€Ð¾Ð±Ð¸Ð² | Ð·Ð°Ñ€Ð¾Ð±Ð»ÑÑ”Ñˆ | Ð·Ð°Ñ€Ð¾Ð±Ð¸Ñ‚Ð¸\n\n8. Ð£ ___ Ñ€Ð°Ð·Ñ– Ð·Ð°Ð»Ð¸ÑˆÐ¸Ð¼Ð¾ÑÑ Ð²Ð´Ð¾Ð¼Ð° Ð¹ Ð¿Ð¾Ð´Ð¸Ð²Ð¸Ð¼Ð¾ÑÑ Ñ„Ñ–Ð»ÑŒÐ¼.\n   > [!answer] Ñ‚Ð°ÐºÐ¾Ð¼Ñƒ\n   > [!options] Ñ‚Ð°ÐºÐ¾Ð¼Ñƒ | Ñ‚Ð¾Ð¼Ñƒ | Ñ†ÑŒÐ¾Ð¼Ñƒ | ÑÐºÐ¾Ð¼Ñƒ\n\n---\n\n## true-false: ÐŸÑ€Ð°Ð²Ð´Ð° Ñ‡Ð¸ Ð½ÐµÐ¿Ñ€Ð°Ð²Ð´Ð°?\n\n1. Ð—Ð¼Ñ–ÑˆÐ°Ð½Ñ– ÑƒÐ¼Ð¾Ð²Ð¸ â€” Ñ†Ðµ Ñ€ÐµÑ‡ÐµÐ½Ð½Ñ, Ð´Ðµ Ñ‡Ð°Ñ ÑƒÐ¼Ð¾Ð²Ð¸ Ð½Ðµ Ð·Ð±Ñ–Ð³Ð°Ñ”Ñ‚ÑŒÑÑ Ð· Ñ‡Ð°ÑÐ¾Ð¼ Ð½Ð°ÑÐ»Ñ–Ð´ÐºÑƒ.\n   - [x] ÐŸÑ€Ð°Ð²Ð´Ð°\n   - [ ] ÐÐµÐ¿Ñ€Ð°Ð²Ð´Ð°\n\n2. Ð£ Ð»Ð°Ð½Ñ†ÑŽÐ³Ð¾Ð²Ð¸Ñ… ÑƒÐ¼Ð¾Ð²Ð°Ñ… Ð¼Ð¾Ð¶Ð½Ð° Ð·Ð¼Ñ–ÑˆÑƒÐ²Ð°Ñ‚Ð¸ Â«ÑÐºÑ‰Ð¾Â» Ñ– Â«ÑÐºÐ±Ð¸Â».\n   - [ ] ÐŸÑ€Ð°Ð²Ð´Ð°\n   - [x] ÐÐµÐ¿Ñ€Ð°Ð²Ð´Ð°\n\n3. Â«Ð¯ÐºÐ±Ð¸ Ñ Ð²Ð¸Ð²Ñ‡Ð¸Ð² Ñ‚Ð¾Ð´Ñ–, Ð·Ð°Ñ€Ð°Ð· Ð±Ð¸ Ð·Ð½Ð°Ð²Â» â€” Ñ†Ðµ Ð¿Ñ€Ð¸ÐºÐ»Ð°Ð´ Ð·Ð¼Ñ–ÑˆÐ°Ð½Ð¾Ñ— ÑƒÐ¼Ð¾Ð²Ð¸.\n   - [x] ÐŸÑ€Ð°Ð²Ð´Ð°\n   - [ ] ÐÐµÐ¿Ñ€Ð°Ð²Ð´Ð°\n\n4. Ð§Ð°ÑÐ¾Ð²Ñ– Ð¼Ð°Ñ€ÐºÐµÑ€Ð¸ Â«Ñ‚Ð¾Ð´Ñ–Â» Ñ– Â«Ð·Ð°Ñ€Ð°Ð·Â» Ð½Ðµ Ð¿Ð¾Ñ‚Ñ€Ñ–Ð±Ð½Ñ– Ð² Ð·Ð¼Ñ–ÑˆÐ°Ð½Ð¸Ñ… ÑƒÐ¼Ð¾Ð²Ð°Ñ….\n   - [ ] ÐŸÑ€Ð°Ð²Ð´Ð°\n   - [x] ÐÐµÐ¿Ñ€Ð°Ð²Ð´Ð°\n\n5. Â«Ð†Ð½Ð°ÐºÑˆÐµÂ» Ð²Ð¸ÐºÐ¾Ñ€Ð¸ÑÑ‚Ð¾Ð²ÑƒÑ”Ñ‚ÑŒÑÑ Ð´Ð»Ñ Ð²Ð¸Ñ€Ð°Ð¶ÐµÐ½Ð½Ñ Ð°Ð»ÑŒÑ‚ÐµÑ€Ð½Ð°Ñ‚Ð¸Ð²Ð½Ð¾Ð³Ð¾ Ð½Ð°ÑÐ»Ñ–Ð´ÐºÑƒ.\n   - [x] ÐŸÑ€Ð°Ð²Ð´Ð°\n   - [ ] ÐÐµÐ¿Ñ€Ð°Ð²Ð´Ð°\n\n6. ÐÐ°ÑÐ»Ñ–Ð´ÐºÐ¾Ð²Ð¸Ð¹ Ð»Ð°Ð½Ñ†ÑŽÐ³ â€” Ñ†Ðµ ÐºÐ¾Ð»Ð¸ A Ð²ÐµÐ´Ðµ Ð´Ð¾ B, Ð° B Ð²ÐµÐ´Ðµ Ð´Ð¾ C.\n   - [x] ÐŸÑ€Ð°Ð²Ð´Ð°\n   - [ ] ÐÐµÐ¿Ñ€Ð°Ð²Ð´Ð°\n\n7. Ð—Ð¼Ñ–ÑˆÐ°Ð½Ð° ÑƒÐ¼Ð¾Ð²Ð° Â«Ñ‚ÐµÐ¿ÐµÑ€Ñ–ÑˆÐ½Ñ” â†’ Ð¼Ð¸Ð½ÑƒÐ»ÐµÂ» Ð¾Ð·Ð½Ð°Ñ‡Ð°Ñ”, Ñ‰Ð¾ Ñ€Ð¸ÑÐ° Ð»ÑŽÐ´Ð¸Ð½Ð¸ Ð¿Ð¾ÑÑÐ½ÑŽÑ” Ð¼Ð¸Ð½ÑƒÐ»Ñƒ Ð¿Ð¾Ð´Ñ–ÑŽ.\n   - [x] ÐŸÑ€Ð°Ð²Ð´Ð°\n   - [ ] ÐÐµÐ¿Ñ€Ð°Ð²Ð´Ð°\n\n8. Ð£ Ð·Ð¼Ñ–ÑˆÐ°Ð½Ð¸Ñ… ÑƒÐ¼Ð¾Ð²Ð°Ñ… Ñ‡Ð°ÑÑ‚ÐºÐ° Â«Ð±Â» Ð½Ðµ Ð¿Ð¾Ñ‚Ñ€Ñ–Ð±Ð½Ð° Ð² Ð½Ð°ÑÐ»Ñ–Ð´ÐºÑƒ.\n   - [ ] ÐŸÑ€Ð°Ð²Ð´Ð°\n   - [x] ÐÐµÐ¿Ñ€Ð°Ð²Ð´Ð°\n\n---\n\n## group-sort: Ð Ð¾Ð·Ð¿Ð¾Ð´Ñ–Ð»Ñ–Ñ‚ÑŒ Ñ€ÐµÑ‡ÐµÐ½Ð½Ñ Ð·Ð° Ñ‚Ð¸Ð¿Ð°Ð¼Ð¸\n\n### Ð—Ð¼Ñ–ÑˆÐ°Ð½Ð° (Ð¼Ð¸Ð½ÑƒÐ»Ðµ â†’ Ñ‚ÐµÐ¿ÐµÑ€Ñ–ÑˆÐ½Ñ”)\n- Ð¯ÐºÐ±Ð¸ Ñ Ð²Ð¸Ð²Ñ‡Ð¸Ð² Ñ‚Ð¾Ð´Ñ–, Ð·Ð°Ñ€Ð°Ð· Ð±Ð¸ Ð·Ð½Ð°Ð².\n- Ð¯ÐºÐ±Ð¸ Ð¼Ð¸ Ð¿ÐµÑ€ÐµÑ—Ñ…Ð°Ð»Ð¸, Ð¶Ð¸Ð»Ð¸ Ð± Ñƒ ÐšÐ¸Ñ”Ð²Ñ–.\n- Ð¯ÐºÐ±Ð¸ Ð²Ñ–Ð½ Ð½Ðµ Ð·Ð°Ñ…Ð²Ð¾Ñ€Ñ–Ð², Ð¿Ñ€Ð°Ñ†ÑŽÐ²Ð°Ð² Ð±Ð¸ ÑÑŒÐ¾Ð³Ð¾Ð´Ð½Ñ–.\n- Ð¯ÐºÐ±Ð¸ Ð±Ð°Ñ‚ÑŒÐºÐ¸ Ð¿ÐµÑ€ÐµÑ—Ñ…Ð°Ð»Ð¸, Ñ Ð± Ð·Ð°Ñ€Ð°Ð· Ð¶Ð¸Ð² Ñ‚Ð°Ð¼.\n\n### Ð—Ð¼Ñ–ÑˆÐ°Ð½Ð° (Ñ‚ÐµÐ¿ÐµÑ€Ñ–ÑˆÐ½Ñ” â†’ Ð¼Ð¸Ð½ÑƒÐ»Ðµ)\n- Ð¯ÐºÐ±Ð¸ Ñ Ð±ÑƒÐ² ÑÐ¼Ñ–Ð»Ð¸Ð²Ñ–ÑˆÐ¸Ð¼, ÑÐºÐ°Ð·Ð°Ð² Ð±Ð¸ Ñ‚Ð¾Ð´Ñ–.\n- Ð¯ÐºÐ±Ð¸ Ð²Ñ–Ð½ Ð·Ð½Ð°Ð² Ð¼Ð¾Ð²Ñƒ, Ð¿Ð¾Ñ—Ñ…Ð°Ð² Ð±Ð¸ Ñ‚Ð¾Ð´Ñ–.\n- Ð¯ÐºÐ±Ð¸ Ð¼Ð¸ Ð¼Ð°Ð»Ð¸ Ð³Ñ€Ð¾ÑˆÑ–, ÐºÑƒÐ¿Ð¸Ð»Ð¸ Ð± Ñ‚Ð¾Ð´Ñ–.\n- Ð¯ÐºÐ±Ð¸ Ð²Ð¾Ð½Ð° Ð»ÑŽÐ±Ð¸Ð»Ð° Ñ‡Ð¸Ñ‚Ð°Ñ‚Ð¸, Ð¿Ñ€Ð¾Ñ‡Ð¸Ñ‚Ð°Ð»Ð° Ð±.\n\n### Ð›Ð°Ð½Ñ†ÑŽÐ³Ð¾Ð²Ð° ÑƒÐ¼Ð¾Ð²Ð°\n- Ð¯ÐºÑ‰Ð¾ Ð¿Ñ€Ð¸Ð¹Ð´Ðµ, Ñ– ÑÐºÑ‰Ð¾ Ð¼Ð°Ñ‚Ð¸Ð¼Ðµ Ñ‡Ð°Ñ, Ð¿Ð¾Ð³Ð¾Ð²Ð¾Ñ€Ð¸Ð¼Ð¾.\n- Ð¯ÐºÐ±Ð¸ Ð¼Ð°Ð² Ð³Ñ€Ð¾ÑˆÑ–, Ñ– ÑÐºÐ±Ð¸ Ð¼Ð°Ð² Ñ‡Ð°Ñ, Ð¿Ð¾Ñ—Ñ…Ð°Ð² Ð±Ð¸.\n- Ð¯ÐºÑ‰Ð¾ Ð½Ðµ Ð±ÑƒÐ´Ðµ Ð´Ð¾Ñ‰Ñƒ, Ñ– ÑÐºÑ‰Ð¾ Ð¼Ð°ÑˆÐ¸Ð½Ð° Ð²Ñ–Ð»ÑŒÐ½Ð°, Ð¿Ð¾Ñ—Ð´ÐµÐ¼Ð¾.\n- Ð¯ÐºÑ‰Ð¾ Ð²Ð¸Ð²Ñ‡Ð¸Ñˆ, Ñ– ÑÐºÑ‰Ð¾ Ð·Ð´Ð°ÑÐ¸, Ð¾Ñ‚Ñ€Ð¸Ð¼Ð°Ñ”Ñˆ Ð´Ð¸Ð¿Ð»Ð¾Ð¼.\n\n### ÐÐ°ÑÐ»Ñ–Ð´ÐºÐ¾Ð²Ð¸Ð¹ Ð»Ð°Ð½Ñ†ÑŽÐ³\n- Ð’Ð¸Ð²Ñ‡Ð¸Ñˆ Ð¼Ð¾Ð²Ñƒ â†’ Ð·Ð½Ð°Ð¹Ð´ÐµÑˆ Ñ€Ð¾Ð±Ð¾Ñ‚Ñƒ â†’ Ð·Ð°Ñ€Ð¾Ð±Ð¸Ñˆ Ð³Ñ€Ð¾ÑˆÑ–.\n- Ð—Ð°Ð¿Ñ–Ð·Ð½Ð¸ÑˆÑÑ â†’ Ð¿Ñ€Ð¾Ð¿ÑƒÑÑ‚Ð¸Ñˆ Ð½Ð°Ñ€Ð°Ð´Ñƒ â†’ Ð²Ñ‚Ñ€Ð°Ñ‚Ð¸Ñˆ ÑˆÐ°Ð½Ñ.\n- ÐŸÐ¾Ñ‡Ð½ÐµÑˆ Ð·Ð°Ñ€Ð°Ð· â†’ Ð´Ð¾ÑÑÐ³Ð½ÐµÑˆ Ð·Ð° Ñ€Ñ–Ðº â†’ ÑÑ‚Ð°Ð½ÐµÑˆ ÐµÐºÑÐ¿ÐµÑ€Ñ‚Ð¾Ð¼.\n- Ð†Ð½Ð²ÐµÑÑ‚ÑƒÑ”Ñˆ â†’ Ð¾Ñ‚Ñ€Ð¸Ð¼Ð°Ñ”Ñˆ Ð¿Ñ€Ð¸Ð±ÑƒÑ‚Ð¾Ðº â†’ Ñ€Ð¾Ð·ÑˆÐ¸Ñ€Ð¸ÑˆÑÑ.\n\n---\n\n## unjumble: Ð¡ÐºÐ»Ð°Ð´Ñ–Ñ‚ÑŒ Ñ€ÐµÑ‡ÐµÐ½Ð½Ñ Ð· Ñ€Ð¾Ð·ÑÐ¸Ð¿Ð°Ð½Ð¸Ñ… ÑÐ»Ñ–Ð²\n\n1. Ð²Ð¸Ð²Ñ‡Ð¸Ð² / Ñ‚Ð¾Ð´Ñ– / Ð·Ð½Ð°Ð² / Ð±Ð¸ / Ñ / Ð²Ñ–Ð´Ð¿Ð¾Ð²Ñ–Ð´ÑŒ / ÑÐºÐ±Ð¸ / Ð·Ð°Ñ€Ð°Ð· / Ñ / Ð½Ð° / Ð¿Ð¸Ñ‚Ð°Ð½Ð½Ñ\n   > [!answer] Ð¯ÐºÐ±Ð¸ Ñ Ð²Ð¸Ð²Ñ‡Ð¸Ð² Ñ‚Ð¾Ð´Ñ–, Ñ Ð·Ð°Ñ€Ð°Ð· Ð±Ð¸ Ð·Ð½Ð°Ð² Ð²Ñ–Ð´Ð¿Ð¾Ð²Ñ–Ð´ÑŒ Ð½Ð° Ð¿Ð¸Ñ‚Ð°Ð½Ð½Ñ.\n\n2. ÑÐ¼Ñ–Ð»Ð¸Ð²Ñ–ÑˆÐ¸Ð¼ / Ð±ÑƒÐ² / ÑÐºÐ±Ð¸ / Ñ / Ñ—Ð¹ / ÑÐºÐ°Ð·Ð°Ð² / Ð± / Ð¿Ñ€Ð°Ð²Ð´Ñƒ / Ñ / Ñ‚Ð¾Ð´Ñ– / ÑƒÑÑŽ\n   > [!answer] Ð¯ÐºÐ±Ð¸ Ñ Ð±ÑƒÐ² ÑÐ¼Ñ–Ð»Ð¸Ð²Ñ–ÑˆÐ¸Ð¼, Ñ Ð± ÑÐºÐ°Ð·Ð°Ð² Ñ—Ð¹ ÑƒÑÑŽ Ð¿Ñ€Ð°Ð²Ð´Ñƒ Ñ‚Ð¾Ð´Ñ–.\n\n3. Ð¿Ñ€Ð¸Ð¹Ð´Ðµ / ÑÐºÑ‰Ð¾ / Ñ– / Ð¼Ð°Ñ‚Ð¸Ð¼Ðµ / Ñ‡Ð°Ñ / ÑÐºÑ‰Ð¾ / , / Ð½Ð¸Ð¼ / Ð¿Ð¾Ð³Ð¾Ð²Ð¾Ñ€Ð¸Ð¼Ð¾ / Ð¼Ð¸ / Ð· / ÑÑŒÐ¾Ð³Ð¾Ð´Ð½Ñ–\n   > [!answer] Ð¯ÐºÑ‰Ð¾ Ð¿Ñ€Ð¸Ð¹Ð´Ðµ, Ñ– ÑÐºÑ‰Ð¾ Ð¼Ð°Ñ‚Ð¸Ð¼Ðµ Ñ‡Ð°Ñ, Ð¼Ð¸ Ð¿Ð¾Ð³Ð¾Ð²Ð¾Ñ€Ð¸Ð¼Ð¾ Ð· Ð½Ð¸Ð¼ ÑÑŒÐ¾Ð³Ð¾Ð´Ð½Ñ–.\n\n4. Ð¿ÐµÑ€ÐµÑ—Ñ…Ð°Ð»Ð¸ / ÑÐºÐ±Ð¸ / Ð´Ð¾ / ÐšÐ¸Ñ”Ð²Ð° / Ð¼Ð¸ / Ñ‚Ð¾Ð´Ñ– / Ð± / Ð·Ð°Ñ€Ð°Ð· / Ñ‚Ð°Ð¼ / Ð¶Ð¸Ð»Ð¸ / Ð¼Ð¸\n   > [!answer] Ð¯ÐºÐ±Ð¸ Ð¼Ð¸ Ð¿ÐµÑ€ÐµÑ—Ñ…Ð°Ð»Ð¸ Ð´Ð¾ ÐšÐ¸Ñ”Ð²Ð° Ñ‚Ð¾Ð´Ñ–, Ð¼Ð¸ Ð± Ð¶Ð¸Ð»Ð¸ Ñ‚Ð°Ð¼ Ð·Ð°Ñ€Ð°Ð·.\n\n5. Ð²Ð¸Ð²Ñ‡Ð¸Ñˆ / ÑÐºÑ‰Ð¾ / Ð·Ð½Ð°Ð¹Ð´ÐµÑˆ / Ð¼Ð¾Ð²Ñƒ / , / Ñ€Ð¾Ð±Ð¾Ñ‚Ñƒ / Ð° / Ð·Ð½Ð°Ð¹Ð´ÐµÑˆ / ÑÐºÑ‰Ð¾ / , / Ð·Ð°Ñ€Ð¾Ð±Ð¸Ñˆ / Ð³Ñ€Ð¾ÑˆÑ– / Ñ…Ð¾Ñ€Ð¾ÑˆÑ–\n   > [!answer] Ð¯ÐºÑ‰Ð¾ Ð²Ð¸Ð²Ñ‡Ð¸Ñˆ Ð¼Ð¾Ð²Ñƒ, Ð·Ð½Ð°Ð¹Ð´ÐµÑˆ Ñ€Ð¾Ð±Ð¾Ñ‚Ñƒ, Ð° ÑÐºÑ‰Ð¾ Ð·Ð½Ð°Ð¹Ð´ÐµÑˆ, Ð·Ð°Ñ€Ð¾Ð±Ð¸Ñˆ Ñ…Ð¾Ñ€Ð¾ÑˆÑ– Ð³Ñ€Ð¾ÑˆÑ–.\n\n6. Ñ–Ð½Ð°ÐºÑˆÐµ / ÑÑ‚Ð°Ñ€Ð°Ð½Ð½Ð¾ / Ð²Ð¸Ð²Ñ‡Ð°Ð¹ / ÐµÐºÐ·Ð°Ð¼ÐµÐ½ / Ð·Ð´Ð°ÑÐ¸ / Ð½Ðµ / Ð²Ð°Ð¶Ð»Ð¸Ð²Ð¸Ð¹ / Ñ†ÐµÐ¹ / Ð½Ð°ÑÑ‚ÑƒÐ¿Ð½Ð¾Ð³Ð¾ / Ñ‚Ð¸Ð¶Ð½Ñ / Ð· / Ð¼Ð°Ñ‚ÐµÐ¼Ð°Ñ‚Ð¸ÐºÐ¸\n   > [!answer] Ð’Ð¸Ð²Ñ‡Ð°Ð¹ ÑÑ‚Ð°Ñ€Ð°Ð½Ð½Ð¾, Ñ–Ð½Ð°ÐºÑˆÐµ Ð½Ðµ Ð·Ð´Ð°ÑÐ¸ Ñ†ÐµÐ¹ Ð²Ð°Ð¶Ð»Ð¸Ð²Ð¸Ð¹ ÐµÐºÐ·Ð°Ð¼ÐµÐ½ Ð· Ð¼Ð°Ñ‚ÐµÐ¼Ð°Ñ‚Ð¸ÐºÐ¸ Ð½Ð°ÑÑ‚ÑƒÐ¿Ð½Ð¾Ð³Ð¾ Ñ‚Ð¸Ð¶Ð½Ñ.\n\n---\n\n## error-correction: Ð—Ð½Ð°Ð¹Ð´Ñ–Ñ‚ÑŒ Ñ– Ð²Ð¸Ð¿Ñ€Ð°Ð²Ñ‚Ðµ Ð¿Ð¾Ð¼Ð¸Ð»ÐºÑƒ\n\n1. Ð¯ÐºÑ‰Ð¾ Ð¿Ñ€Ð¸Ð¹Ð´Ðµ, Ñ– ÑÐºÐ±Ð¸ Ð¼Ð°Ð² Ñ‡Ð°Ñ, Ð¿Ð¾Ð³Ð¾Ð²Ð¾Ñ€Ð¸Ð¼Ð¾ Ð· Ð½Ð¸Ð¼ ÑÑŒÐ¾Ð³Ð¾Ð´Ð½Ñ–.\n   > [!error] ÑÐºÐ±Ð¸\n   > [!answer] ÑÐºÑ‰Ð¾\n   > [!options] ÑÐºÑ‰Ð¾ | ÐºÐ¾Ð»Ð¸ Ð± | Ñ…Ð¾Ñ‡Ð° | Ñ‚Ð¾Ð¼Ñƒ Ñ‰Ð¾\n   > [!explanation] Ð’ Ð»Ð°Ð½Ñ†ÑŽÐ³Ñƒ Ð²ÑÑ– ÑƒÐ¼Ð¾Ð²Ð¸ Ð¼Ð°ÑŽÑ‚ÑŒ Ð±ÑƒÑ‚Ð¸ Ð°Ð±Ð¾ Ñ€ÐµÐ°Ð»ÑŒÐ½Ð¸Ð¼Ð¸, Ð°Ð±Ð¾ Ð½ÐµÑ€ÐµÐ°Ð»ÑŒÐ½Ð¸Ð¼Ð¸.\n\n2. Ð¯ÐºÐ±Ð¸ Ñ Ð²Ð¸Ð²Ñ‡Ð¸Ð² Ñ‚Ð¾Ð´Ñ–, Ð·Ð°Ñ€Ð°Ð· Ð·Ð½Ð°ÑŽ Ð²Ñ–Ð´Ð¿Ð¾Ð²Ñ–Ð´ÑŒ Ð½Ð° Ð¿Ð¸Ñ‚Ð°Ð½Ð½Ñ.\n   > [!error] Ð·Ð½Ð°ÑŽ\n   > [!answer] Ð±Ð¸ Ð·Ð½Ð°Ð²\n   > [!options] Ð±Ð¸ Ð·Ð½Ð°Ð² | Ð·Ð½Ð°Ñ‚Ð¸Ð¼Ñƒ | Ð·Ð½Ð°Ð² | Ð·Ð½Ð°Ñ”Ñˆ\n   > [!explanation] ÐÐ°ÑÐ»Ñ–Ð´Ð¾Ðº Ñƒ Ð·Ð¼Ñ–ÑˆÐ°Ð½Ñ–Ð¹ ÑƒÐ¼Ð¾Ð²Ñ– Ð¿Ð¾Ñ‚Ñ€ÐµÐ±ÑƒÑ” Ñ‡Ð°ÑÑ‚ÐºÐ¸ Â«Ð±Â».\n\n3. Ð¯ÐºÐ±Ð¸ Ñ Ð±ÑƒÐ² ÑÐ¼Ñ–Ð»Ð¸Ð²Ñ–ÑˆÐ¸Ð¼, ÑÐºÐ°Ð¶Ñƒ Ñ—Ð¹ Ð¿Ñ€Ð°Ð²Ð´Ñƒ Ð¼Ð¸Ð½ÑƒÐ»Ð¾Ð³Ð¾ Ñ‚Ð¸Ð¶Ð½Ñ.\n   > [!error] ÑÐºÐ°Ð¶Ñƒ\n   > [!answer] ÑÐºÐ°Ð·Ð°Ð² Ð±Ð¸\n   > [!options] ÑÐºÐ°Ð·Ð°Ð² Ð±Ð¸ | ÐºÐ°Ð¶Ñƒ | ÑÐºÐ°Ð·Ð°Ñ‚Ð¸ | Ð³Ð¾Ð²Ð¾Ñ€ÑŽ\n   > [!explanation] ÐœÐ¸Ð½ÑƒÐ»Ð° Ð¿Ð¾Ð´Ñ–Ñ Ð²Ð¸Ð¼Ð°Ð³Ð°Ñ” Ð¼Ð¸Ð½ÑƒÐ»Ð¾Ñ— Ñ„Ð¾Ñ€Ð¼Ð¸ Ð· Â«Ð±Â».\n\n4. Ð¯ÐºÐ±Ð¸ Ð¼Ð¸ Ð¿ÐµÑ€ÐµÑ—Ñ…Ð°Ð»Ð¸, Ð·Ð°Ñ€Ð°Ð· Ð± Ð¼Ð¸ Ð¶Ð¸Ð»Ð¸ Ð² ÐšÐ¸Ñ”Ð²Ñ– Ð²Ð¶Ðµ Ð´ÐµÑÑÑ‚ÑŒ Ñ€Ð¾ÐºÑ–Ð².\n   > [!error] Ð± Ð¼Ð¸\n   > [!answer] Ð¼Ð¸ Ð±\n   > [!options] Ð¼Ð¸ Ð± | Ð± Ð²Ð¾Ð½Ð¸ | Ð¼Ð¸ Ð±Ð¸ | Ð± Ð¼Ð¸ Ð±\n   > [!explanation] ÐŸÑ€Ð°Ð²Ð¸Ð»ÑŒÐ½Ð¸Ð¹ Ð¿Ð¾Ñ€ÑÐ´Ð¾Ðº: Ð¿Ñ–Ð´Ð¼ÐµÑ‚ + Ð±.\n\n5. Ð’Ð¸Ð²Ñ‡Ð°Ð¹ ÑÑ‚Ð°Ñ€Ð°Ð½Ð½Ð¾, Ñ‚Ð¾Ð¼Ñƒ Ñ‰Ð¾ Ð½Ðµ Ð·Ð´Ð°ÑÐ¸ ÐµÐºÐ·Ð°Ð¼ÐµÐ½ Ð½Ð°ÑÑ‚ÑƒÐ¿Ð½Ð¾Ð³Ð¾ Ñ‚Ð¸Ð¶Ð½Ñ.\n   > [!error] Ñ‚Ð¾Ð¼Ñƒ Ñ‰Ð¾\n   > [!answer] Ñ–Ð½Ð°ÐºÑˆÐµ\n   > [!options] Ñ–Ð½Ð°ÐºÑˆÐµ | Ñ…Ð¾Ñ‡Ð° | Ð±Ð¾ | Ñ‰Ð¾Ð±\n   > [!explanation] Â«Ð†Ð½Ð°ÐºÑˆÐµÂ» = otherwise, Ð´Ð»Ñ Ð°Ð»ÑŒÑ‚ÐµÑ€Ð½Ð°Ñ‚Ð¸Ð²Ð½Ð¾Ð³Ð¾ Ð½Ð°ÑÐ»Ñ–Ð´ÐºÑƒ.\n\n6. Ð¯ÐºÐ±Ð¸ Ñ Ð²Ð¸Ð²Ñ‡Ð¸Ð², Ñ Ð·Ð½Ð°Ð² Ð± Ð·Ð°Ñ€Ð°Ð· Ð²Ñ–Ð´Ð¿Ð¾Ð²Ñ–Ð´ÑŒ Ð½Ð° Ð¿Ð¸Ñ‚Ð°Ð½Ð½Ñ.\n   > [!error] Ð·Ð½Ð°Ð² Ð±\n   > [!answer] Ð± Ð·Ð½Ð°Ð²\n   > [!options] Ð± Ð·Ð½Ð°Ð² | Ð·Ð½Ð°ÑŽ Ð± | Ð±Ð¸ Ð·Ð½Ð°Ð² | Ð·Ð½Ð°Ð² Ð±Ð¸ Ð±\n   > [!explanation] Â«Ð‘Â» ÑÑ‚Ð¾Ñ—Ñ‚ÑŒ Ð¿ÐµÑ€ÐµÐ´ Ð´Ñ–Ñ”ÑÐ»Ð¾Ð²Ð¾Ð¼: Ñ Ð± Ð·Ð½Ð°Ð².\n\n---\n\n## cloze: Ð—Ð°Ð¿Ð¾Ð²Ð½Ñ–Ñ‚ÑŒ Ð¿Ñ€Ð¾Ð¿ÑƒÑÐºÐ¸ Ð² Ñ‚ÐµÐºÑÑ‚Ñ–\n\nÐžÐ»ÐµÐ½Ð° Ð´ÑƒÐ¼Ð°Ñ” Ð¿Ñ€Ð¾ ÑÐ²Ð¾Ñ” Ð¶Ð¸Ñ‚Ñ‚Ñ. Â«(1)___ Ñ Ñ‚Ð¾Ð´Ñ– Ð²Ð¸Ð²Ñ‡Ð¸Ð»Ð° Ð¿Ñ€Ð¾Ð³Ñ€Ð°Ð¼ÑƒÐ²Ð°Ð½Ð½Ñ, Ð·Ð°Ñ€Ð°Ð· (2)___ Ð¼Ð°Ð»Ð° ÐºÑ€Ð°Ñ‰Ñƒ Ñ€Ð¾Ð±Ð¾Ñ‚Ñƒ. ÐÐ»Ðµ (3)___ Ñ (4)___ Ð±Ñ–Ð»ÑŒÑˆ Ñ†Ñ–Ð»ÐµÑÐ¿Ñ€ÑÐ¼Ð¾Ð²Ð°Ð½Ð¾ÑŽ, Ð¿Ð¾Ñ‡Ð°Ð»Ð° (5)___ Ñ€Ð°Ð½Ñ–ÑˆÐµ. Ð (6)___ Ñ Ð¿Ð¾Ñ‡Ð½Ñƒ Ð·Ð°Ñ€Ð°Ð·, (7)___ ÑÐºÑ‰Ð¾ Ð±ÑƒÐ´Ñƒ ÑÑ‚Ð°Ñ€Ð°Ð½Ð½Ð¾ÑŽ, Ð·Ð° Ñ€Ñ–Ðº (8)___ Ñ€ÐµÐ·ÑƒÐ»ÑŒÑ‚Ð°Ñ‚Ñƒ. (9)___ Ð²Ð¸Ð²Ñ‡Ñƒ Python, Ð·Ð½Ð°Ð¹Ð´Ñƒ Ð½Ð¾Ð²Ñƒ Ñ€Ð¾Ð±Ð¾Ñ‚Ñƒ. Ð (10)___ Ð·Ð½Ð°Ð¹Ð´Ñƒ Ñ€Ð¾Ð±Ð¾Ñ‚Ñƒ, (11)___ Ð±Ñ–Ð»ÑŒÑˆÐµ. (12)___ Ñ†Ðµ Ð»Ð°Ð½Ñ†ÑŽÐ³: Ð¾Ð´Ð½Ð° Ð´Ñ–Ñ Ð²ÐµÐ´Ðµ Ð´Ð¾ Ñ–Ð½ÑˆÐ¾Ñ—. (13)___, Ð¿Ð¾Ñ‚Ñ€Ñ–Ð±Ð½Ð¾ Ð¿Ñ€Ð°Ñ†ÑŽÐ²Ð°Ñ‚Ð¸ ÑÑ‚Ð°Ñ€Ð°Ð½Ð½Ð¾, (14)___ Ð½Ñ–Ñ‡Ð¾Ð³Ð¾ Ð½Ðµ Ð·Ð¼Ñ–Ð½Ð¸Ñ‚ÑŒÑÑ.Â»\n\n- (1) :: Ð¯ÐºÐ±Ð¸ | Ð¯ÐºÑ‰Ð¾ | ÐšÐ¾Ð»Ð¸ | Ð¥Ð¾Ñ‡Ð°\n- (2) :: Ð± | Ð±Ð¸ | Ð±Ð° | Ð±Ð¾\n- (3) :: ÑÐºÐ±Ð¸ | ÑÐºÑ‰Ð¾ | ÐºÐ¾Ð»Ð¸ | Ñ…Ð¾Ñ‡Ð°\n- (4) :: Ð±ÑƒÐ»Ð° | Ñ” | Ð±ÑƒÐ´Ñƒ | Ð±ÑƒÑ‚Ð¸\n- (5) :: Ð± | Ð±Ð¸ | Ð±Ð° | Ð±Ð¾\n- (6) :: ÑÐºÑ‰Ð¾ | ÑÐºÐ±Ð¸ | ÐºÐ¾Ð»Ð¸ Ð± | Ñ…Ð¾Ñ‡Ð°\n- (7) :: Ñ– | Ð°Ð±Ð¾ | Ð°Ð»Ðµ | Ñ‡Ð¸\n- (8) :: Ð´Ð¾ÑÑÐ³Ð½Ñƒ | Ð´Ð¾ÑÑÐ³ | Ð´Ð¾ÑÑÐ³Ð°ÑŽ | Ð´Ð¾ÑÑÐ³Ñ‚Ð¸\n- (9) :: Ð¯ÐºÑ‰Ð¾ | Ð¯ÐºÐ±Ð¸ | ÐšÐ¾Ð»Ð¸ Ð± | Ð¥Ð¾Ñ‡Ð°\n- (10) :: ÑÐºÑ‰Ð¾ | ÑÐºÐ±Ð¸ | ÐºÐ¾Ð»Ð¸ Ð± | Ñ…Ð¾Ñ‡Ð°\n- (11) :: Ð·Ð°Ñ€Ð¾Ð±Ð»ÑÑ‚Ð¸ | Ð·Ð°Ñ€Ð¾Ð±Ð¸Ð»Ð° | Ð·Ð°Ñ€Ð¾Ð±Ð»ÑÑŽ | Ð·Ð°Ñ€Ð¾Ð±Ð»ÑÑ‚Ð¸Ð¼Ñƒ\n- (12) :: Ð‘Ð°Ñ‡Ñƒ | Ð‘Ð°Ñ‡Ð¸Ð² | Ð‘Ð°Ñ‡Ð¸Ñˆ | Ð‘Ð°Ñ‡Ð¸Ð»Ð¸\n- (13) :: ÐžÑ‚Ð¶Ðµ | Ð¥Ð¾Ñ‡Ð° | Ð¢Ð¾Ð¼Ñƒ | Ð‘Ð¾\n- (14) :: Ñ–Ð½Ð°ÐºÑˆÐµ | Ñ‚Ð¾Ð¼Ñƒ | Ñ…Ð¾Ñ‡Ð° | Ð±Ð¾\n\n---\n\n## mark-the-words: ÐŸÐ¾Ð·Ð½Ð°Ñ‡Ñ‚Ðµ Ñ‡Ð°ÑÐ¾Ð²Ñ– Ð¼Ð°Ñ€ÐºÐµÑ€Ð¸ Ñ‚Ð° ÑÐ¿Ð¾Ð»ÑƒÑ‡Ð½Ð¸ÐºÐ¸ ÑƒÐ¼Ð¾Ð²Ð¸\n\n[Ð¯ÐºÐ±Ð¸] Ñ Ð²Ð¸Ð²Ñ‡Ð¸Ð² [Ñ‚Ð¾Ð´Ñ–], [Ð·Ð°Ñ€Ð°Ð·] Ð±Ð¸ Ð·Ð½Ð°Ð² Ð²Ñ–Ð´Ð¿Ð¾Ð²Ñ–Ð´ÑŒ. [Ð¯ÐºÐ±Ð¸] Ð²Ñ–Ð½ Ð±ÑƒÐ² ÑÐ¼Ñ–Ð»Ð¸Ð²Ñ–ÑˆÐ¸Ð¼, ÑÐºÐ°Ð·Ð°Ð² Ð±Ð¸ [Ñ‚Ð¾Ð´Ñ–] Ð¿Ñ€Ð°Ð²Ð´Ñƒ. [Ð¯ÐºÑ‰Ð¾] Ð¿Ñ€Ð¸Ð¹Ð´Ðµ, [Ñ– ÑÐºÑ‰Ð¾] Ð¼Ð°Ñ‚Ð¸Ð¼Ðµ Ñ‡Ð°Ñ, Ð¿Ð¾Ð³Ð¾Ð²Ð¾Ñ€Ð¸Ð¼Ð¾. [Ð†Ð½Ð°ÐºÑˆÐµ] Ð½Ðµ Ð²ÑÑ‚Ð¸Ð³Ð½ÐµÐ¼Ð¾ Ð½Ð° Ð¿Ð¾Ñ‚ÑÐ³. [Ð£ Ñ‚Ð°ÐºÐ¾Ð¼Ñƒ Ñ€Ð°Ð·Ñ–] Ð·Ð°Ð»Ð¸ÑˆÐ¸Ð¼Ð¾ÑÑ Ð²Ð´Ð¾Ð¼Ð°. [Ð¯ÐºÐ±Ð¸] Ð¼Ð¸ Ð¿ÐµÑ€ÐµÑ—Ñ…Ð°Ð»Ð¸ [Ñ‚Ð¾Ð´Ñ–], [Ð·Ð°Ñ€Ð°Ð·] Ð±Ð¸ Ð¶Ð¸Ð»Ð¸ Ð² ÐšÐ¸Ñ”Ð²Ñ–. [Ð’ Ñ–Ð½ÑˆÐ¾Ð¼Ñƒ Ð²Ð¸Ð¿Ð°Ð´ÐºÑƒ] Ð´Ð¾Ð²ÐµÐ´ÐµÑ‚ÑŒÑÑ Ñ‡ÐµÐºÐ°Ñ‚Ð¸.\n\n---\n\n## dialogue-reorder: Ð’Ð¿Ð¾Ñ€ÑÐ´ÐºÑƒÐ¹Ñ‚Ðµ Ð´Ñ–Ð°Ð»Ð¾Ð³\n\n- Ð ÑÐºÐ±Ð¸ Ñ‚Ð¸ Ð¼Ð°Ð»Ð° Ñ–Ð½ÑˆÑƒ Ð¿Ñ€Ð¾Ñ„ÐµÑÑ–ÑŽ, Ñ‡Ð¸ Ð±ÑƒÐ»Ð° Ð± Ñ‰Ð°ÑÐ»Ð¸Ð²Ñ–ÑˆÐ¾ÑŽ?\n- Ð—Ð½Ð°Ñ”Ñˆ, ÑÐºÐ±Ð¸ Ñ Ð²Ð¸Ð²Ñ‡Ð¸Ð»Ð° Ð¿Ñ€Ð¾Ð³Ñ€Ð°Ð¼ÑƒÐ²Ð°Ð½Ð½Ñ Ñ‚Ð¾Ð´Ñ–, Ð·Ð°Ñ€Ð°Ð· Ð¼Ð°Ð»Ð° Ð± ÐºÑ€Ð°Ñ‰Ñƒ Ð·Ð°Ñ€Ð¿Ð»Ð°Ñ‚Ñƒ.\n- ÐœÐ¾Ð¶Ð»Ð¸Ð²Ð¾. ÐÐ»Ðµ ÑÐºÐ±Ð¸ Ð¼Ð°Ð»Ð° Ñ–Ð½ÑˆÑƒ Ñ€Ð¾Ð±Ð¾Ñ‚Ñƒ, Ð¼Ð¾Ð¶Ð»Ð¸Ð²Ð¾, Ð¼ÐµÐ½ÑˆÐµ Ñ‡Ð°ÑÑƒ Ð´Ð»Ñ ÑÑ–Ð¼'Ñ—.\n- Ð¢Ð¸ Ð¿Ñ€Ð°Ð²Ð°. Ð¯ÐºÐ±Ð¸ Ð¼Ð¸ Ð·Ð°Ð²Ð¶Ð´Ð¸ Ð¾Ð±Ð¸Ñ€Ð°Ð»Ð¸ Ð³Ñ€Ð¾ÑˆÑ–, Ð²Ñ‚Ñ€Ð°Ñ‚Ð¸Ð»Ð¸ Ð± Ñ–Ð½ÑˆÑ– Ñ€ÐµÑ‡Ñ–.\n- Ð¡Ð°Ð¼Ðµ Ñ‚Ð°Ðº. Ð¯ÐºÐ±Ð¸ Ð¼Ð¾Ð³Ð»Ð° Ð¿Ð¾Ð²ÐµÑ€Ð½ÑƒÑ‚Ð¸ Ñ‡Ð°Ñ, Ð·Ñ€Ð¾Ð±Ð¸Ð»Ð° Ð± Ñ‚Ð¾Ð¹ ÑÐ°Ð¼Ð¸Ð¹ Ð²Ð¸Ð±Ñ–Ñ€.\n- Ð‘Ð°Ñ‡Ð¸Ñˆ, Ð·Ð½Ð°Ñ‡Ð¸Ñ‚ÑŒ Ñ‚Ð¸ Ð½Ð° Ð¿Ñ€Ð°Ð²Ð¸Ð»ÑŒÐ½Ð¾Ð¼Ñƒ ÑˆÐ»ÑÑ…Ñƒ Ð² Ð¶Ð¸Ñ‚Ñ‚Ñ–!\n\n> [!answer]\n> 1. Ð—Ð½Ð°Ñ”Ñˆ, ÑÐºÐ±Ð¸ Ñ Ð²Ð¸Ð²Ñ‡Ð¸Ð»Ð° Ð¿Ñ€Ð¾Ð³Ñ€Ð°Ð¼ÑƒÐ²Ð°Ð½Ð½Ñ Ñ‚Ð¾Ð´Ñ–, Ð·Ð°Ñ€Ð°Ð· Ð¼Ð°Ð»Ð° Ð± ÐºÑ€Ð°Ñ‰Ñƒ Ð·Ð°Ñ€Ð¿Ð»Ð°Ñ‚Ñƒ.\n> 2. Ð ÑÐºÐ±Ð¸ Ñ‚Ð¸ Ð¼Ð°Ð»Ð° Ñ–Ð½ÑˆÑƒ Ð¿Ñ€Ð¾Ñ„ÐµÑÑ–ÑŽ, Ñ‡Ð¸ Ð±ÑƒÐ»Ð° Ð± Ñ‰Ð°ÑÐ»Ð¸Ð²Ñ–ÑˆÐ¾ÑŽ?\n> 3. ÐœÐ¾Ð¶Ð»Ð¸Ð²Ð¾. ÐÐ»Ðµ ÑÐºÐ±Ð¸ Ð¼Ð°Ð»Ð° Ñ–Ð½ÑˆÑƒ Ñ€Ð¾Ð±Ð¾Ñ‚Ñƒ, Ð¼Ð¾Ð¶Ð»Ð¸Ð²Ð¾, Ð¼ÐµÐ½ÑˆÐµ Ñ‡Ð°ÑÑƒ Ð´Ð»Ñ ÑÑ–Ð¼'Ñ—.\n> 4. Ð¢Ð¸ Ð¿Ñ€Ð°Ð²Ð°. Ð¯ÐºÐ±Ð¸ Ð¼Ð¸ Ð·Ð°Ð²Ð¶Ð´Ð¸ Ð¾Ð±Ð¸Ñ€Ð°Ð»Ð¸ Ð³Ñ€Ð¾ÑˆÑ–, Ð²Ñ‚Ñ€Ð°Ñ‚Ð¸Ð»Ð¸ Ð± Ñ–Ð½ÑˆÑ– Ñ€ÐµÑ‡Ñ–.\n> 5. Ð¡Ð°Ð¼Ðµ Ñ‚Ð°Ðº. Ð¯ÐºÐ±Ð¸ Ð¼Ð¾Ð³Ð»Ð° Ð¿Ð¾Ð²ÐµÑ€Ð½ÑƒÑ‚Ð¸ Ñ‡Ð°Ñ, Ð·Ñ€Ð¾Ð±Ð¸Ð»Ð° Ð± Ñ‚Ð¾Ð¹ ÑÐ°Ð¼Ð¸Ð¹ Ð²Ð¸Ð±Ñ–Ñ€.\n> 6. Ð‘Ð°Ñ‡Ð¸Ñˆ, Ð·Ð½Ð°Ñ‡Ð¸Ñ‚ÑŒ Ñ‚Ð¸ Ð½Ð° Ð¿Ñ€Ð°Ð²Ð¸Ð»ÑŒÐ½Ð¾Ð¼Ñƒ ÑˆÐ»ÑÑ…Ñƒ Ð² Ð¶Ð¸Ñ‚Ñ‚Ñ–!\n\n---\n\n## select: Ð’Ð¸Ð±ÐµÑ€Ñ–Ñ‚ÑŒ ÑƒÑÑ– Ð³Ñ€Ð°Ð¼Ð°Ñ‚Ð¸Ñ‡Ð½Ð¾ Ð¿Ñ€Ð°Ð²Ð¸Ð»ÑŒÐ½Ñ– Ñ€ÐµÑ‡ÐµÐ½Ð½Ñ\n\n- [x] Ð¯ÐºÐ±Ð¸ Ñ Ð²Ð¸Ð²Ñ‡Ð¸Ð² Ñ‚Ð¾Ð´Ñ–, Ð·Ð°Ñ€Ð°Ð· Ð±Ð¸ Ð·Ð½Ð°Ð² Ð²Ñ–Ð´Ð¿Ð¾Ð²Ñ–Ð´ÑŒ.\n- [ ] Ð¯ÐºÐ±Ð¸ Ñ Ð²Ð¸Ð²Ñ‡Ð¸Ð² Ñ‚Ð¾Ð´Ñ–, Ð·Ð°Ñ€Ð°Ð· Ð·Ð½Ð°ÑŽ Ð²Ñ–Ð´Ð¿Ð¾Ð²Ñ–Ð´ÑŒ.\n- [x] Ð¯ÐºÑ‰Ð¾ Ð¿Ñ€Ð¸Ð¹Ð´Ðµ, Ñ– ÑÐºÑ‰Ð¾ Ð¼Ð°Ñ‚Ð¸Ð¼Ðµ Ñ‡Ð°Ñ, Ð¿Ð¾Ð³Ð¾Ð²Ð¾Ñ€Ð¸Ð¼Ð¾.\n- [ ] Ð¯ÐºÑ‰Ð¾ Ð¿Ñ€Ð¸Ð¹Ð´Ðµ, Ñ– ÑÐºÐ±Ð¸ Ð¼Ð°Ð² Ñ‡Ð°Ñ, Ð¿Ð¾Ð³Ð¾Ð²Ð¾Ñ€Ð¸Ð¼Ð¾.\n- [x] Ð¯ÐºÐ±Ð¸ Ñ Ð±ÑƒÐ² ÑÐ¼Ñ–Ð»Ð¸Ð²Ñ–ÑˆÐ¸Ð¼, ÑÐºÐ°Ð·Ð°Ð² Ð±Ð¸ Ñ‚Ð¾Ð´Ñ–.\n- [ ] Ð¯ÐºÐ±Ð¸ Ñ Ñ” ÑÐ¼Ñ–Ð»Ð¸Ð²Ñ–ÑˆÐ¸Ð¼, ÑÐºÐ°Ð·Ð°Ð² Ð±Ð¸ Ñ‚Ð¾Ð´Ñ–.\n- [x] Ð’Ð¸Ð²Ñ‡Ð°Ð¹ ÑÑ‚Ð°Ñ€Ð°Ð½Ð½Ð¾, Ñ–Ð½Ð°ÐºÑˆÐµ Ð½Ðµ Ð·Ð´Ð°ÑÐ¸ ÐµÐºÐ·Ð°Ð¼ÐµÐ½.\n- [ ] Ð’Ð¸Ð²Ñ‡Ð°Ð¹ ÑÑ‚Ð°Ñ€Ð°Ð½Ð½Ð¾, Ñ‚Ð¾Ð¼Ñƒ Ñ‰Ð¾ Ð½Ðµ Ð·Ð´Ð°ÑÐ¸ ÐµÐºÐ·Ð°Ð¼ÐµÐ½.\n\n---\n\n## translate: ÐŸÐµÑ€ÐµÐºÐ»Ð°Ð´Ñ–Ñ‚ÑŒ Ð½Ð° ÑƒÐºÑ€Ð°Ñ—Ð½ÑÑŒÐºÑƒ Ð¼Ð¾Ð²Ñƒ\n\n1. If I had studied then, I would know the answer now.\n   - [x] Ð¯ÐºÐ±Ð¸ Ñ Ð²Ð¸Ð²Ñ‡Ð¸Ð² Ñ‚Ð¾Ð´Ñ–, Ð·Ð°Ñ€Ð°Ð· Ð±Ð¸ Ð·Ð½Ð°Ð² Ð²Ñ–Ð´Ð¿Ð¾Ð²Ñ–Ð´ÑŒ.\n   - [ ] Ð¯ÐºÑ‰Ð¾ Ñ Ð²Ð¸Ð²Ñ‡Ñƒ, Ð·Ð½Ð°Ñ‚Ð¸Ð¼Ñƒ Ð²Ñ–Ð´Ð¿Ð¾Ð²Ñ–Ð´ÑŒ.\n   - [ ] Ð¯ÐºÐ±Ð¸ Ñ Ð²Ð¸Ð²Ñ‡Ñƒ, Ð·Ð½Ð°ÑŽ Ð²Ñ–Ð´Ð¿Ð¾Ð²Ñ–Ð´ÑŒ.\n   - [ ] Ð¯ÐºÑ‰Ð¾ Ð²Ð¸Ð²Ñ‡Ð¸Ð², Ð·Ð½Ð°ÑŽ Ñ‚ÐµÐ¿ÐµÑ€.\n\n2. If he were braver, he would have told her the truth yesterday.\n   - [x] Ð¯ÐºÐ±Ð¸ Ð²Ñ–Ð½ Ð±ÑƒÐ² ÑÐ¼Ñ–Ð»Ð¸Ð²Ñ–ÑˆÐ¸Ð¼, Ð²Ñ–Ð½ Ð±Ð¸ ÑÐºÐ°Ð·Ð°Ð² Ñ—Ð¹ Ð¿Ñ€Ð°Ð²Ð´Ñƒ Ð²Ñ‡Ð¾Ñ€Ð°.\n   - [ ] Ð¯ÐºÑ‰Ð¾ Ð²Ñ–Ð½ ÑÐ¼Ñ–Ð»Ð¸Ð²Ð¸Ð¹, ÑÐºÐ°Ð¶Ðµ Ñ—Ð¹ Ð¿Ñ€Ð°Ð²Ð´Ñƒ.\n   - [ ] Ð¯ÐºÐ±Ð¸ Ð²Ñ–Ð½ Ñ” ÑÐ¼Ñ–Ð»Ð¸Ð²Ð¸Ð¹, ÑÐºÐ°Ð·Ð°Ð² Ð±Ð¸.\n   - [ ] ÐšÐ¾Ð»Ð¸ Ð±ÑƒÐ² ÑÐ¼Ñ–Ð»Ð¸Ð²Ð¸Ð¹, ÑÐºÐ°Ð·Ð°Ð² Ð¿Ñ€Ð°Ð²Ð´Ñƒ.\n\n3. If it rains, and if we can't go outside, we will watch a movie.\n   - [x] Ð¯ÐºÑ‰Ð¾ Ð±ÑƒÐ´Ðµ Ð´Ð¾Ñ‰, Ñ– ÑÐºÑ‰Ð¾ Ð½Ðµ Ð·Ð¼Ð¾Ð¶ÐµÐ¼Ð¾ Ð²Ð¸Ð¹Ñ‚Ð¸, Ð¿Ð¾Ð´Ð¸Ð²Ð¸Ð¼Ð¾ÑÑ Ñ„Ñ–Ð»ÑŒÐ¼.\n   - [ ] Ð¯ÐºÐ±Ð¸ Ð´Ð¾Ñ‰, Ñ– ÑÐºÑ‰Ð¾ Ð²Ð¸Ð¹Ð´ÐµÐ¼Ð¾, Ñ„Ñ–Ð»ÑŒÐ¼.\n   - [ ] Ð¯ÐºÑ‰Ð¾ Ð´Ð¾Ñ‰, Ñ– ÑÐºÐ±Ð¸ Ð²Ð¸Ð¹ÑˆÐ»Ð¸, Ð¿Ð¾Ð´Ð¸Ð²Ð¸Ð¼Ð¾ÑÑ.\n   - [ ] ÐšÐ¾Ð»Ð¸ Ð´Ð¾Ñ‰ Ñ– Ð½Ðµ Ð²Ð¸Ð¹Ð´ÐµÐ¼Ð¾, Ñ„Ñ–Ð»ÑŒÐ¼.\n\n4. Study hard, otherwise you won't pass the exam.\n   - [x] Ð’Ð¸Ð²Ñ‡Ð°Ð¹ ÑÑ‚Ð°Ñ€Ð°Ð½Ð½Ð¾, Ñ–Ð½Ð°ÐºÑˆÐµ Ð½Ðµ Ð·Ð´Ð°ÑÐ¸ ÐµÐºÐ·Ð°Ð¼ÐµÐ½.\n   - [ ] Ð’Ð¸Ð²Ñ‡Ð°Ð¹ ÑÑ‚Ð°Ñ€Ð°Ð½Ð½Ð¾, Ñ‚Ð¾Ð¼Ñƒ Ñ‰Ð¾ Ð·Ð´Ð°ÑÐ¸ ÐµÐºÐ·Ð°Ð¼ÐµÐ½.\n   - [ ] Ð’Ð¸Ð²Ñ‡Ð°Ñ”Ñˆ ÑÑ‚Ð°Ñ€Ð°Ð½Ð½Ð¾, Ñ…Ð¾Ñ‡Ð° Ð½Ðµ Ð·Ð´Ð°ÑÐ¸.\n   - [ ] Ð’Ð¸Ð²Ñ‡Ð¸ ÑÑ‚Ð°Ñ€Ð°Ð½Ð½Ð¾, Ð±Ð¾ Ð·Ð´Ð°ÑÐ¸ ÐµÐºÐ·Ð°Ð¼ÐµÐ½.\n\n5. If we had moved then, we would be living in Kyiv now.\n   - [x] Ð¯ÐºÐ±Ð¸ Ð¼Ð¸ Ð¿ÐµÑ€ÐµÑ—Ñ…Ð°Ð»Ð¸ Ñ‚Ð¾Ð´Ñ–, Ð·Ð°Ñ€Ð°Ð· Ð±Ð¸ Ð¶Ð¸Ð»Ð¸ Ð² ÐšÐ¸Ñ”Ð²Ñ–.\n   - [ ] Ð¯ÐºÑ‰Ð¾ Ð¿ÐµÑ€ÐµÑ—Ð´ÐµÐ¼Ð¾, Ð±ÑƒÐ´ÐµÐ¼Ð¾ Ð¶Ð¸Ñ‚Ð¸ Ð² ÐšÐ¸Ñ”Ð²Ñ–.\n   - [ ] Ð¯ÐºÐ±Ð¸ Ð¿ÐµÑ€ÐµÑ—Ð¶Ð´Ð¶Ð°Ñ”Ð¼Ð¾, Ð¶Ð¸Ð²ÐµÐ¼Ð¾ Ð² ÐšÐ¸Ñ”Ð²Ñ–.\n   - [ ] ÐšÐ¾Ð»Ð¸ Ð¿ÐµÑ€ÐµÑ—Ñ…Ð°Ð»Ð¸, Ð¶Ð¸Ð»Ð¸ Ð² ÐšÐ¸Ñ”Ð²Ñ–.\n\n6. If you learn the language, you'll find a job. And if you find a job, you'll earn money.\n   - [x] Ð¯ÐºÑ‰Ð¾ Ð²Ð¸Ð²Ñ‡Ð¸Ñˆ Ð¼Ð¾Ð²Ñƒ, Ð·Ð½Ð°Ð¹Ð´ÐµÑˆ Ñ€Ð¾Ð±Ð¾Ñ‚Ñƒ. Ð ÑÐºÑ‰Ð¾ Ð·Ð½Ð°Ð¹Ð´ÐµÑˆ, Ð·Ð°Ñ€Ð¾Ð±Ð¸Ñˆ Ð³Ñ€Ð¾ÑˆÑ–.\n   - [ ] Ð¯ÐºÐ±Ð¸ Ð²Ð¸Ð²Ñ‡Ð¸Ñˆ, Ð·Ð½Ð°Ð¹ÑˆÐ¾Ð² Ð±Ð¸ Ñ€Ð¾Ð±Ð¾Ñ‚Ñƒ, Ð·Ð°Ñ€Ð¾Ð±Ð¸Ð² Ð³Ñ€Ð¾ÑˆÑ–.\n   - [ ] Ð¯ÐºÑ‰Ð¾ Ð²Ð¸Ð²Ñ‡Ð¸Ð², Ð·Ð½Ð°Ñ…Ð¾Ð´Ð¸Ñˆ Ñ€Ð¾Ð±Ð¾Ñ‚Ñƒ, Ð·Ð°Ñ€Ð¾Ð±Ð»ÑÑ”Ñˆ.\n   - [ ] ÐšÐ¾Ð»Ð¸ Ð²Ð¸Ð²Ñ‡Ð¸Ñˆ Ð¼Ð¾Ð²Ñƒ, Ñ€Ð¾Ð±Ð¾Ñ‚Ñƒ Ð³Ñ€Ð¾ÑˆÑ–.\n\n---"
      },
      {
        "id": "section-3",
        "name": "Ð¡Ð»Ð¾Ð²Ð½Ð¸Ðº",
        "nameEn": null,
        "type": "vocabulary",
        "content": "| Ð¡Ð»Ð¾Ð²Ð¾ | Ð’Ð¸Ð¼Ð¾Ð²Ð° | ÐŸÐµÑ€ÐµÐºÐ»Ð°Ð´ | Ð§Ðœ | ÐŸÑ€Ð¸Ð¼Ñ–Ñ‚ÐºÐ° |\n|-------|--------|----------|-----|----------|\n| **Ð·Ð¼Ñ–ÑˆÐ°Ð½Ð¸Ð¹** | /ËˆzmÊ²iÊƒÉ‘nÉªj/ | mixed | Ð¿Ñ€Ð¸ÐºÐ¼. | Ð¿Ð¾Ñ”Ð´Ð½Ð°Ð½Ð½Ñ Ñ€Ñ–Ð·Ð½Ð¸Ñ… Ñ‚Ð¸Ð¿Ñ–Ð² |\n| **Ð»Ð°Ð½Ñ†ÑŽÐ³Ð¾Ð²Ð¸Ð¹** | /lÉ‘nËˆtÍ¡sjuÉ¦É”wÉªj/ | chained | Ð¿Ñ€Ð¸ÐºÐ¼. | Ð¿Ð¾ÑÐ»Ñ–Ð´Ð¾Ð²Ð½Ð¾ Ð·'Ñ”Ð´Ð½Ð°Ð½Ð¸Ð¹ |\n| **Ð½Ð°ÑÐ»Ñ–Ð´Ð¾Ðº** | /nÉ‘ËˆslÊ²idÉ”k/ | consequence | Ñ–Ð¼. (Ñ‡.Ñ€.) | Ñ€ÐµÐ·ÑƒÐ»ÑŒÑ‚Ð°Ñ‚ |\n| **Ñ‚Ð¾Ð´Ñ–** | /tÉ”ËˆdÊ²i/ | then (past) | Ð¿Ñ€Ð¸ÑÐ». | Ð² Ð¼Ð¸Ð½ÑƒÐ»Ð¾Ð¼Ñƒ |\n| **Ð·Ð°Ñ€Ð°Ð·** | /zÉ‘ËˆrÉ‘z/ | now | Ð¿Ñ€Ð¸ÑÐ». | Ð² Ñ‚ÐµÐ¿ÐµÑ€Ñ–ÑˆÐ½ÑŒÐ¾Ð¼Ñƒ |\n| **Ñ–Ð½Ð°ÐºÑˆÐµ** | /iËˆnÉ‘kÊƒÉ›/ | otherwise | Ð¿Ñ€Ð¸ÑÐ». | ÑÐºÑ‰Ð¾ Ð½Ñ– |\n| **Ð² Ñ–Ð½ÑˆÐ¾Ð¼Ñƒ Ð²Ð¸Ð¿Ð°Ð´ÐºÑƒ** | /w ËˆinÊƒÉ”mu ËˆwÉªpÉ‘dku/ | otherwise | Ð²Ð¸Ñ€Ð°Ð· | Ð°Ð»ÑŒÑ‚ÐµÑ€Ð½Ð°Ñ‚Ð¸Ð²Ð° |\n| **Ñƒ Ñ‚Ð°ÐºÐ¾Ð¼Ñƒ Ñ€Ð°Ð·Ñ–** | /u tÉ‘ËˆkÉ”mu ËˆrÉ‘zÊ²i/ | in that case | Ð²Ð¸Ñ€Ð°Ð· | Ð·Ð° Ñ‚Ð°ÐºÐ¸Ñ… ÑƒÐ¼Ð¾Ð² |\n| **Ð¿Ñ€Ð¾Ñ‚Ðµ** | /prÉ”ËˆtÉ›/ | however | ÑÐ¿Ð¾Ð»ÑƒÑ‡Ð½. | ÐºÐ¾Ð½Ñ‚Ñ€Ð°ÑÑ‚ |\n| **Ð¾Ð´Ð½Ð°Ðº** | /É”dËˆnÉ‘k/ | however | ÑÐ¿Ð¾Ð»ÑƒÑ‡Ð½. | Ñ„Ð¾Ñ€Ð¼Ð°Ð»ÑŒÐ½Ð¸Ð¹ ÐºÐ¾Ð½Ñ‚Ñ€Ð°ÑÑ‚ |\n| **Ð°Ð»Ðµ** | /É‘ËˆlÉ›/ | but | ÑÐ¿Ð¾Ð»ÑƒÑ‡Ð½. | Ð¿Ñ€Ð¾Ñ‚Ð¸ÑÑ‚Ð°Ð²Ð»ÐµÐ½Ð½Ñ |\n| **Ñ…Ð¾Ñ‡Ð°** | /xÉ”ËˆtÊƒÉ‘/ | although | ÑÐ¿Ð¾Ð»ÑƒÑ‡Ð½. | Ð´Ð¾Ð¿ÑƒÑÑ‚Ð¾Ð²Ð¸Ð¹ |\n| **Ð½Ð°Ð²Ñ–Ñ‚ÑŒ ÑÐºÑ‰Ð¾** | /nÉ‘ËˆwÊ²itÊ² jÉ‘kËˆÊƒtÊƒÉ”/ | even if | Ð²Ð¸Ñ€Ð°Ð· | Ð¿Ð¾ÑÐ¸Ð»ÐµÐ½Ð° ÑƒÐ¼Ð¾Ð²Ð° |\n| **Ñ‚Ð¸Ð¼ Ð±Ñ–Ð»ÑŒÑˆÐµ** | /tÉªm ËˆbÊ²ilÊ²ÊƒÉ›/ | all the more | Ð²Ð¸Ñ€Ð°Ð· | Ð¿Ñ–Ð´ÑÐ¸Ð»ÐµÐ½Ð½Ñ |\n| **Ñ‚Ð¸Ð¼ Ð¼ÐµÐ½ÑˆÐµ** | /tÉªm ËˆmÉ›nÊƒÉ›/ | all the less | Ð²Ð¸Ñ€Ð°Ð· | Ð¿Ð¾ÑÐ»Ð°Ð±Ð»ÐµÐ½Ð½Ñ |\n| **Ð²ÑÐµ Ð¾Ð´Ð½Ð¾** | /wsÊ²É› É”dËˆnÉ”/ | anyway | Ð¿Ñ€Ð¸ÑÐ». | Ð½ÐµÐ·Ð²Ð°Ð¶Ð°ÑŽÑ‡Ð¸ Ð½Ñ– Ð½Ð° Ñ‰Ð¾ |\n| **Ð² Ð±ÑƒÐ´ÑŒ-ÑÐºÐ¾Ð¼Ñƒ Ñ€Ð°Ð·Ñ–** | /w budÊ²ËˆjÉ‘kÉ”mu ËˆrÉ‘zÊ²i/ | in any case | Ð²Ð¸Ñ€Ð°Ð· | Ð·Ð° Ð±ÑƒÐ´ÑŒ-ÑÐºÐ¸Ñ… Ð¾Ð±ÑÑ‚Ð°Ð²Ð¸Ð½ |\n| **Ñ‚Ð°Ðº Ñ‡Ð¸ Ñ–Ð½Ð°ÐºÑˆÐµ** | /tÉ‘k tÊƒÉª iËˆnÉ‘kÊƒÉ›/ | one way or another | Ð²Ð¸Ñ€Ð°Ð· | Ñƒ Ð±ÑƒÐ´ÑŒ-ÑÐºÐ¾Ð¼Ñƒ Ð²Ð¸Ð¿Ð°Ð´ÐºÑƒ |\n| **ÑÐº Ð±Ð¸ Ñ‚Ð°Ð¼ Ð½Ðµ Ð±ÑƒÐ»Ð¾** | /jÉ‘k bÉª tÉ‘m nÉ› ËˆbulÉ”/ | be that as it may | Ð²Ð¸Ñ€Ð°Ð· | Ð½ÐµÐ·Ð²Ð°Ð¶Ð°ÑŽÑ‡Ð¸ Ð½Ñ– Ð½Ð° Ñ‰Ð¾ |\n| **Ð¿Ñ€Ð¸ Ñ†ÑŒÐ¾Ð¼Ñƒ** | /prÉª ËˆtÍ¡sÊ²É”mu/ | at the same time | Ð²Ð¸Ñ€Ð°Ð· | Ð¾Ð´Ð½Ð¾Ñ‡Ð°ÑÐ½Ð¾ |\n| **Ð´Ð¾ Ñ‚Ð¾Ð³Ð¾ Ð¶** | /dÉ” tÉ”ËˆÉ¦É” Ê’/ | besides, moreover | Ð²Ð¸Ñ€Ð°Ð· | ÐºÑ€Ñ–Ð¼ Ñ‚Ð¾Ð³Ð¾ |\n| **ÐºÑ€Ñ–Ð¼ Ñ‚Ð¾Ð³Ð¾** | /krÊ²im tÉ”ËˆÉ¦É”/ | besides | Ð²Ð¸Ñ€Ð°Ð· | Ð½Ð° Ð´Ð¾Ð´Ð°Ñ‚Ð¾Ðº |\n| **Ð±Ñ–Ð»ÑŒÑˆÐµ Ñ‚Ð¾Ð³Ð¾** | /ËˆbÊ²ilÊ²ÊƒÉ› tÉ”ËˆÉ¦É”/ | moreover | Ð²Ð¸Ñ€Ð°Ð· | Ñ‰Ðµ Ð±Ñ–Ð»ÑŒÑˆÐµ |\n| **ÐºÐ¾Ð½Ñ‚Ñ€Ñ„Ð°ÐºÑ‚Ð¸Ñ‡Ð½Ð¸Ð¹** | /kÉ”ntrfÉ‘kËˆtÉªtÊƒnÉªj/ | counterfactual | Ð¿Ñ€Ð¸ÐºÐ¼. | Ñ‰Ð¾ ÑÑƒÐ¿ÐµÑ€ÐµÑ‡Ð¸Ñ‚ÑŒ Ñ„Ð°ÐºÑ‚Ð°Ð¼ |\n| **Ð°Ð»ÑŒÑ‚ÐµÑ€Ð½Ð°Ñ‚Ð¸Ð²Ð°** | /É‘lÊ²tÉ›rnÉ‘ËˆtÉªwÉ‘/ | alternative | Ñ–Ð¼. (Ð¶.Ñ€.) | Ñ–Ð½ÑˆÐ¸Ð¹ Ð²Ð°Ñ€Ñ–Ð°Ð½Ñ‚ |"
      }
    ],
    "rawMarkdown": "---\nmodule: b1-33\ntitle: \"Ð£Ð¼Ð¾Ð²Ð½Ñ– Ñ€ÐµÑ‡ÐµÐ½Ð½Ñ: Ð·Ð¼Ñ–ÑˆÐ°Ð½Ñ– Ñ‚Ð° ÑÐºÐ»Ð°Ð´Ð½Ñ– ÑƒÐ¼Ð¾Ð²Ð¸\"\nsubtitle: \"Mixed and Complex Conditionals\"\nversion: \"1.0\"\nphase: \"B1.3a Complex Sentences\"\npedagogy: \"TTT\"\nduration: 90\ntransliteration: none\ntags:\n  - grammar\n  - conditionals\n  - complex-sentences\n  - mixed-conditionals\ngrammar:\n  - \"Mixed conditional constructions\"\n  - \"Chained conditionals\"\n  - \"Complex condition-consequence relationships\"\nobjectives:\n  - \"Learner understands mixed conditional types\"\n  - \"Learner can combine real and unreal conditions\"\n  - \"Learner can form chained conditional sentences\"\nvocabulary_count: 25\n---\n\n> [!motivation]\n> Ð–Ð¸Ñ‚Ñ‚Ñ Ñ€Ñ–Ð´ÐºÐ¾ Ð±ÑƒÐ²Ð°Ñ” Ð¿Ñ€Ð¾ÑÑ‚Ð¸Ð¼. Ð†Ð½Ð¾Ð´Ñ– Ð½Ð°ÑÐ»Ñ–Ð´Ð¾Ðº Ð¼Ð¸Ð½ÑƒÐ»Ð¾Ñ— Ð¿Ð¾Ð¼Ð¸Ð»ÐºÐ¸ Ð²Ñ–Ð´Ñ‡ÑƒÐ²Ð°Ñ”Ñ‚ÑŒÑÑ ÑÑŒÐ¾Ð³Ð¾Ð´Ð½Ñ–. Ð†Ð½Ð¾Ð´Ñ– Ñ‚ÐµÐ¿ÐµÑ€Ñ–ÑˆÐ½Ñ Ñ€Ð¸ÑÐ° Ñ…Ð°Ñ€Ð°ÐºÑ‚ÐµÑ€Ñƒ Ð¿Ð¾ÑÑÐ½ÑŽÑ”, Ñ‡Ð¾Ð¼Ñƒ Ñ‰Ð¾ÑÑŒ Ð½Ðµ ÑÑ‚Ð°Ð»Ð¾ÑÑ Ð² Ð¼Ð¸Ð½ÑƒÐ»Ð¾Ð¼Ñƒ. Ð¢Ð°ÐºÑ– ÑÐºÐ»Ð°Ð´Ð½Ñ– Ð·Ð²'ÑÐ·ÐºÐ¸ Ð²Ð¸Ð¼Ð°Ð³Ð°ÑŽÑ‚ÑŒ **Ð·Ð¼Ñ–ÑˆÐ°Ð½Ð¸Ñ… ÑƒÐ¼Ð¾Ð²** â€” ÐºÐ¾Ð½ÑÑ‚Ñ€ÑƒÐºÑ†Ñ–Ð¹, Ð´Ðµ Ñ‡Ð°Ñ ÑƒÐ¼Ð¾Ð²Ð¸ Ð¹ Ð½Ð°ÑÐ»Ñ–Ð´ÐºÑƒ Ð½Ðµ Ð·Ð±Ñ–Ð³Ð°ÑŽÑ‚ÑŒÑÑ. Ð¦Ðµ Ð²ÐµÑ€ÑˆÐ¸Ð½Ð° Ð³Ñ€Ð°Ð¼Ð°Ñ‚Ð¸ÐºÐ¸ ÑƒÐ¼Ð¾Ð²Ð½Ð¸Ñ… Ñ€ÐµÑ‡ÐµÐ½ÑŒ, Ñ– Ð²Ð¾Ð½Ð° Ð´Ð°ÑÑ‚ÑŒ Ð²Ð°Ð¼ ÑÐ¿Ñ€Ð°Ð²Ð¶Ð½ÑŽ ÑÐ²Ð¾Ð±Ð¾Ð´Ñƒ Ð²Ð¸Ñ€Ð°Ð¶ÐµÐ½Ð½Ñ Ð´ÑƒÐ¼Ð¾Ðº.\n\n---\n\n## Ð¢ÐµÑÑ‚: ÐŸÐµÑ€ÐµÐ²Ñ–Ñ€Ñ‚Ðµ ÑÐµÐ±Ðµ\n\nÐ¡Ð¿Ñ€Ð¾Ð±ÑƒÐ¹Ñ‚Ðµ Ð¿ÐµÑ€ÐµÐºÐ»Ð°ÑÑ‚Ð¸ Ñ†Ñ– ÑÐºÐ»Ð°Ð´Ð½Ñ– Ñ€ÐµÑ‡ÐµÐ½Ð½Ñ Ð½Ð° ÑƒÐºÑ€Ð°Ñ—Ð½ÑÑŒÐºÑƒ:\n\n1. If I had studied then, I would know the answer now.\n2. If he were more careful, he wouldn't have made that mistake yesterday.\n3. If it rains and we can't go outside, we will watch a movie at home.\n4. If you want to succeed, and if you have enough motivation, you will achieve your goals.\n\nÐ¯ÐºÑ‰Ð¾ Ð²Ð¸ Ð½ÐµÐ²Ð¿ÐµÐ²Ð½ÐµÐ½Ñ–, ÑÐº Ð¿Ð¾Ñ”Ð´Ð½Ð°Ñ‚Ð¸ Ñ€Ñ–Ð·Ð½Ñ– Ñ‡Ð°ÑÐ¾Ð²Ñ– Ð¿Ð»Ð°Ð½Ð¸ â€” Ñ†ÐµÐ¹ Ð¼Ð¾Ð´ÑƒÐ»ÑŒ ÑÐ°Ð¼Ðµ Ð´Ð»Ñ Ð²Ð°Ñ.\n\n> [!observe]\n> ÐŸÐ¾Ñ€Ñ–Ð²Ð½ÑÐ¹Ñ‚Ðµ Ñ†Ñ– Ñ€ÐµÑ‡ÐµÐ½Ð½Ñ:\n> - **Ð¡Ñ‚Ð°Ð½Ð´Ð°Ñ€Ñ‚Ð½Ð° Ð½ÐµÑ€ÐµÐ°Ð»ÑŒÐ½Ð°:** Ð¯ÐºÐ±Ð¸ Ñ Ð²Ð¸Ð²Ñ‡Ð¸Ð², Ñ Ð± Ð·Ð½Ð°Ð². (Ð¼Ð¸Ð½ÑƒÐ»Ðµ â†’ Ð¼Ð¸Ð½ÑƒÐ»Ðµ)\n> - **Ð—Ð¼Ñ–ÑˆÐ°Ð½Ð° (Ð¼Ð¸Ð½ÑƒÐ»Ðµ â†’ Ñ‚ÐµÐ¿ÐµÑ€Ñ–ÑˆÐ½Ñ”):** Ð¯ÐºÐ±Ð¸ Ñ Ð²Ð¸Ð²Ñ‡Ð¸Ð² Ñ‚Ð¾Ð´Ñ–, Ñ Ð± Ð·Ð°Ñ€Ð°Ð· Ð·Ð½Ð°Ð².\n> - **Ð—Ð¼Ñ–ÑˆÐ°Ð½Ð° (Ñ‚ÐµÐ¿ÐµÑ€Ñ–ÑˆÐ½Ñ” â†’ Ð¼Ð¸Ð½ÑƒÐ»Ðµ):** Ð¯ÐºÐ±Ð¸ Ñ Ð±ÑƒÐ² Ñ€Ð¾Ð·ÑƒÐ¼Ð½Ñ–ÑˆÐ¸Ð¼, Ð½Ðµ Ð·Ñ€Ð¾Ð±Ð¸Ð² Ð±Ð¸ Ñ‚Ñ–Ñ”Ñ— Ð¿Ð¾Ð¼Ð¸Ð»ÐºÐ¸.\n\n---\n\n## ÐŸÐ¾ÑÑÐ½ÐµÐ½Ð½Ñ\n\n### Ð©Ð¾ Ñ‚Ð°ÐºÐµ Ð·Ð¼Ñ–ÑˆÐ°Ð½Ñ– ÑƒÐ¼Ð¾Ð²Ð¸?\n\n**Ð—Ð¼Ñ–ÑˆÐ°Ð½Ñ– ÑƒÐ¼Ð¾Ð²Ð¸** â€” Ñ†Ðµ Ñ€ÐµÑ‡ÐµÐ½Ð½Ñ, Ð´Ðµ:\n- Ð§Ð°Ñ ÑƒÐ¼Ð¾Ð²Ð¸ â‰  Ñ‡Ð°Ñ Ð½Ð°ÑÐ»Ñ–Ð´ÐºÑƒ\n- ÐœÐ¸Ð½ÑƒÐ»Ð° Ð´Ñ–Ñ Ð²Ð¿Ð»Ð¸Ð²Ð°Ñ” Ð½Ð° Ñ‚ÐµÐ¿ÐµÑ€Ñ–ÑˆÐ½ÑŽ ÑÐ¸Ñ‚ÑƒÐ°Ñ†Ñ–ÑŽ\n- Ð¢ÐµÐ¿ÐµÑ€Ñ–ÑˆÐ½Ñ Ñ€Ð¸ÑÐ° Ð¿Ð¾ÑÑÐ½ÑŽÑ” Ð¼Ð¸Ð½ÑƒÐ»Ñƒ Ð¿Ð¾Ð´Ñ–ÑŽ\n- ÐšÑ–Ð»ÑŒÐºÐ° ÑƒÐ¼Ð¾Ð² Ð¿Ð¾Ñ”Ð´Ð½ÑƒÑŽÑ‚ÑŒÑÑ Ð² Ð¾Ð´Ð½Ð¾Ð¼Ñƒ Ñ€ÐµÑ‡ÐµÐ½Ð½Ñ–\n\n### Ð¢Ð¸Ð¿ 1: ÐœÐ¸Ð½ÑƒÐ»Ð° ÑƒÐ¼Ð¾Ð²Ð° â†’ Ð¢ÐµÐ¿ÐµÑ€Ñ–ÑˆÐ½Ñ–Ð¹ Ð½Ð°ÑÐ»Ñ–Ð´Ð¾Ðº\n\n**Ð¡Ñ‚Ñ€ÑƒÐºÑ‚ÑƒÑ€Ð°:** Ð¯ÐºÐ±Ð¸ + Ð¼Ð¸Ð½ÑƒÐ»Ð° Ñ„Ð¾Ñ€Ð¼Ð° (Ð¿Ñ€Ð¾ Ð¼Ð¸Ð½ÑƒÐ»Ðµ), Ð¿Ñ–Ð´Ð¼ÐµÑ‚ + Ð± + Ð¼Ð¸Ð½ÑƒÐ»Ð° Ñ„Ð¾Ñ€Ð¼Ð° (Ð¿Ñ€Ð¾ Ð·Ð°Ñ€Ð°Ð·)\n\n| Ð£Ð¼Ð¾Ð²Ð° (Ð¼Ð¸Ð½ÑƒÐ»Ðµ) | ÐÐ°ÑÐ»Ñ–Ð´Ð¾Ðº (Ñ‚ÐµÐ¿ÐµÑ€Ñ–ÑˆÐ½Ñ”) | Ð—Ð½Ð°Ñ‡ÐµÐ½Ð½Ñ |\n|----------------|----------------------|----------|\n| Ð¯ÐºÐ±Ð¸ Ñ **Ð²Ð¸Ð²Ñ‡Ð¸Ð²** Ñ‚Ð¾Ð´Ñ– | Ñ **Ð± Ð·Ð½Ð°Ð²** Ð·Ð°Ñ€Ð°Ð· | Ð¯ Ð½Ðµ Ð²Ð¸Ð²Ñ‡Ð¸Ð² â†’ Ð½Ðµ Ð·Ð½Ð°ÑŽ |\n| Ð¯ÐºÐ±Ð¸ Ð²Ñ–Ð½ **Ð½Ðµ Ð·Ð°Ñ…Ð²Ð¾Ñ€Ñ–Ð²** | Ð²Ñ–Ð½ **Ð±Ð¸ Ð¿Ñ€Ð°Ñ†ÑŽÐ²Ð°Ð²** ÑÑŒÐ¾Ð³Ð¾Ð´Ð½Ñ– | Ð—Ð°Ñ…Ð²Ð¾Ñ€Ñ–Ð² â†’ Ð½Ðµ Ð¿Ñ€Ð°Ñ†ÑŽÑ” |\n| Ð¯ÐºÐ±Ð¸ Ð¼Ð¸ **Ð¿ÐµÑ€ÐµÑ—Ñ…Ð°Ð»Ð¸** | Ð¼Ð¸ **Ð± Ð¶Ð¸Ð»Ð¸** Ð² ÐšÐ¸Ñ”Ð²Ñ– | ÐÐµ Ð¿ÐµÑ€ÐµÑ—Ñ…Ð°Ð»Ð¸ â†’ Ð½Ðµ Ð¶Ð¸Ð²ÐµÐ¼Ð¾ |\n| Ð¯ÐºÐ±Ð¸ Ð²Ð¾Ð½Ð° **Ð²Ð¸Ð¹ÑˆÐ»Ð° Ð·Ð°Ð¼Ñ–Ð¶** | Ð²Ð¾Ð½Ð° **Ð± Ð¼Ð°Ð»Ð°** Ð´Ñ–Ñ‚ÐµÐ¹ | ÐÐµ Ð²Ð¸Ð¹ÑˆÐ»Ð° â†’ Ð½Ðµ Ð¼Ð°Ñ” |\n\n**ÐŸÑ€Ð¸ÐºÐ»Ð°Ð´Ð¸ Ð· ÐºÐ¾Ð½Ñ‚ÐµÐºÑÑ‚Ð¾Ð¼:**\n- Ð¯ÐºÐ±Ð¸ Ñ Ð²Ð¸Ð²Ñ‡Ð¸Ð² Ð°Ð½Ð³Ð»Ñ–Ð¹ÑÑŒÐºÑƒ Ð² ÑˆÐºÐ¾Ð»Ñ– ÑÑ‚Ð°Ñ€Ð°Ð½Ð½Ñ–ÑˆÐµ, Ð·Ð°Ñ€Ð°Ð· Ð±Ð¸ Ð¼Ð°Ð² ÐºÑ€Ð°Ñ‰Ñƒ Ñ€Ð¾Ð±Ð¾Ñ‚Ñƒ.\n- Ð¯ÐºÐ±Ð¸ Ð±Ð°Ñ‚ÑŒÐºÐ¸ Ð¿ÐµÑ€ÐµÑ—Ñ…Ð°Ð»Ð¸ Ð´Ð¾ ÐšÐ°Ð½Ð°Ð´Ð¸, Ñ Ð± Ð·Ð°Ñ€Ð°Ð· Ð¶Ð¸Ð² Ñ‚Ð°Ð¼ Ñ– Ð±ÑƒÐ² Ð±Ð¸ Ð³Ñ€Ð¾Ð¼Ð°Ð´ÑÐ½Ð¸Ð½Ð¾Ð¼.\n- Ð¯ÐºÐ±Ð¸ Ð²Ñ–Ð½ Ð½Ðµ ÐºÑƒÑ€Ð¸Ð² ÑƒÑÐµ Ð¶Ð¸Ñ‚Ñ‚Ñ, Ð¹Ð¾Ð³Ð¾ Ð·Ð´Ð¾Ñ€Ð¾Ð²'Ñ Ð± Ð±ÑƒÐ»Ð¾ Ð½Ð°Ð±Ð°Ð³Ð°Ñ‚Ð¾ ÐºÑ€Ð°Ñ‰Ð¸Ð¼.\n\n> ðŸ’¡ **Ð¦Ñ–ÐºÐ°Ð²Ð¸Ð¹ Ñ„Ð°ÐºÑ‚**\n> Ð—Ð¼Ñ–ÑˆÐ°Ð½Ñ– ÑƒÐ¼Ð¾Ð²Ð¸ â€” Ñ†Ðµ ÑƒÐ½Ñ–ÐºÐ°Ð»ÑŒÐ½Ð° Ð·Ð´Ð°Ñ‚Ð½Ñ–ÑÑ‚ÑŒ Ð»ÑŽÐ´ÑÑŒÐºÐ¾Ð³Ð¾ Ð¼Ð¸ÑÐ»ÐµÐ½Ð½Ñ Ð¼Ð¾Ð´ÐµÐ»ÑŽÐ²Ð°Ñ‚Ð¸ Ð°Ð»ÑŒÑ‚ÐµÑ€Ð½Ð°Ñ‚Ð¸Ð²Ð½Ñ– Ñ€ÐµÐ°Ð»ÑŒÐ½Ð¾ÑÑ‚Ñ–. Ð›Ñ–Ð½Ð³Ð²Ñ–ÑÑ‚Ð¸ Ð½Ð°Ð·Ð¸Ð²Ð°ÑŽÑ‚ÑŒ Ñ†Ðµ Â«ÐºÐ¾Ð½Ñ‚Ñ€Ñ„Ð°ÐºÑ‚Ð¸Ñ‡Ð½Ðµ Ð¼Ð¸ÑÐ»ÐµÐ½Ð½ÑÂ». Ð”Ð¾ÑÐ»Ñ–Ð´Ð¶ÐµÐ½Ð½Ñ Ð¿Ð¾ÐºÐ°Ð·ÑƒÑŽÑ‚ÑŒ, Ñ‰Ð¾ Ð·Ð´Ð°Ñ‚Ð½Ñ–ÑÑ‚ÑŒ Ñ„Ð¾Ñ€Ð¼ÑƒÐ²Ð°Ñ‚Ð¸ Ñ‚Ð°ÐºÑ– Ñ€ÐµÑ‡ÐµÐ½Ð½Ñ Ð¿Ð¾Ð²'ÑÐ·Ð°Ð½Ð° Ð· Ñ€Ð¾Ð·Ð²Ð¸Ñ‚ÐºÐ¾Ð¼ ÐºÑ€Ð¸Ñ‚Ð¸Ñ‡Ð½Ð¾Ð³Ð¾ Ð¼Ð¸ÑÐ»ÐµÐ½Ð½Ñ Ñ‚Ð° ÐµÐ¼Ð¿Ð°Ñ‚Ñ–Ñ—! Ð‘ÐµÐ· Ñ†ÑŒÐ¾Ð³Ð¾ Ð¼ÐµÑ…Ð°Ð½Ñ–Ð·Ð¼Ñƒ Ð¼Ð¸ Ð½Ðµ Ð¼Ð¾Ð³Ð»Ð¸ Ð± Ð°Ð½Ð°Ð»Ñ–Ð·ÑƒÐ²Ð°Ñ‚Ð¸ Ð¿Ð¾Ð¼Ð¸Ð»ÐºÐ¸ Ð¹ Ð²Ñ‡Ð¸Ñ‚Ð¸ÑÑ Ð½Ð° Ð½Ð¸Ñ….\n\n> ðŸ‡ºðŸ‡¦ **ÐšÑƒÐ»ÑŒÑ‚ÑƒÑ€Ð½Ð¸Ð¹ Ð¼Ð¾Ð¼ÐµÐ½Ñ‚**\n>\n> Ð£ Ð›ÑŒÐ²Ð¾Ð²Ñ– Ñ‡Ð°ÑÑ‚Ð¾ ÐºÐ°Ð¶ÑƒÑ‚ÑŒ: Â«Ð¯ÐºÐ±Ð¸ Ð½Ðµ Ð²Ñ–Ð¹Ð½Ð¸ Ñ‚Ð° Ð¾ÐºÑƒÐ¿Ð°Ñ†Ñ–Ñ—, Ð›ÑŒÐ²Ñ–Ð² Ð±Ð¸ ÑÑ‚Ð°Ð² Ð¾Ð´Ð½Ð¸Ð¼ Ñ–Ð· Ð½Ð°Ð¹ÐºÑ€Ð°ÑÐ¸Ð²Ñ–ÑˆÐ¸Ñ… Ð¼Ñ–ÑÑ‚ Ð„Ð²Ñ€Ð¾Ð¿Ð¸Â». Ð¦Ðµ Ð¿Ñ€Ð¸ÐºÐ»Ð°Ð´ Ð·Ð¼Ñ–ÑˆÐ°Ð½Ð¾Ñ— ÑƒÐ¼Ð¾Ð²Ð¸ Ð¼Ð¸Ð½ÑƒÐ»Ðµ â†’ Ñ‚ÐµÐ¿ÐµÑ€Ñ–ÑˆÐ½Ñ”. Ð†ÑÑ‚Ð¾Ñ€Ñ–Ñ Ð£ÐºÑ€Ð°Ñ—Ð½Ð¸ ÑÐ¿Ð¾Ð²Ð½ÐµÐ½Ð° Ñ‚Ð°ÐºÐ¸Ñ… Ñ€Ð¾Ð·Ð´ÑƒÐ¼Ñ–Ð² Ð¿Ñ€Ð¾ Ð°Ð»ÑŒÑ‚ÐµÑ€Ð½Ð°Ñ‚Ð¸Ð²Ð½Ñ– ÑˆÐ»ÑÑ…Ð¸ Ñ€Ð¾Ð·Ð²Ð¸Ñ‚ÐºÑƒ.\n\n### Ð¢Ð¸Ð¿ 2: Ð¢ÐµÐ¿ÐµÑ€Ñ–ÑˆÐ½Ñ ÑƒÐ¼Ð¾Ð²Ð° â†’ ÐœÐ¸Ð½ÑƒÐ»Ð¸Ð¹ Ð½Ð°ÑÐ»Ñ–Ð´Ð¾Ðº\n\n**Ð¡Ñ‚Ñ€ÑƒÐºÑ‚ÑƒÑ€Ð°:** Ð¯ÐºÐ±Ð¸ + Ð¼Ð¸Ð½ÑƒÐ»Ð° Ñ„Ð¾Ñ€Ð¼Ð° (Ð¿Ñ€Ð¾ Ð¿Ð¾ÑÑ‚Ñ–Ð¹Ð½Ñƒ Ñ€Ð¸ÑÑƒ), Ð¿Ñ–Ð´Ð¼ÐµÑ‚ + Ð± + Ð¼Ð¸Ð½ÑƒÐ»Ð° Ñ„Ð¾Ñ€Ð¼Ð° (Ð¿Ñ€Ð¾ Ð¼Ð¸Ð½ÑƒÐ»Ñƒ Ð¿Ð¾Ð´Ñ–ÑŽ)\n\n| Ð£Ð¼Ð¾Ð²Ð° (Ñ‚ÐµÐ¿ÐµÑ€Ñ–ÑˆÐ½Ñ”) | ÐÐ°ÑÐ»Ñ–Ð´Ð¾Ðº (Ð¼Ð¸Ð½ÑƒÐ»Ðµ) | Ð—Ð½Ð°Ñ‡ÐµÐ½Ð½Ñ |\n|-------------------|-------------------|----------|\n| Ð¯ÐºÐ±Ð¸ Ñ **Ð±ÑƒÐ²** ÑÐ¼Ñ–Ð»Ð¸Ð²Ñ–ÑˆÐ¸Ð¼ | Ñ **Ð± ÑÐºÐ°Ð·Ð°Ð²** Ñ—Ð¹ | Ð¯ Ð½ÐµÑÐ¼Ñ–Ð»Ð¸Ð²Ð¸Ð¹ â†’ Ð½Ðµ ÑÐºÐ°Ð·Ð°Ð² |\n| Ð¯ÐºÐ±Ð¸ Ð²Ñ–Ð½ **Ð·Ð½Ð°Ð²** Ð¼Ð¾Ð²Ñƒ | Ð²Ñ–Ð½ **Ð±Ð¸ Ð¿Ð¾Ñ—Ñ…Ð°Ð²** | ÐÐµ Ð·Ð½Ð°Ñ” â†’ Ð½Ðµ Ð¿Ð¾Ñ—Ñ…Ð°Ð² |\n| Ð¯ÐºÐ±Ð¸ Ð¼Ð¸ **Ð¼Ð°Ð»Ð¸** Ð³Ñ€Ð¾ÑˆÑ– | Ð¼Ð¸ **Ð± ÐºÑƒÐ¿Ð¸Ð»Ð¸** | ÐÐµ Ð¼Ð°Ñ”Ð¼Ð¾ â†’ Ð½Ðµ ÐºÑƒÐ¿Ð¸Ð»Ð¸ |\n| Ð¯ÐºÐ±Ð¸ Ð²Ð¾Ð½Ð° **Ð»ÑŽÐ±Ð¸Ð»Ð°** Ñ‡Ð¸Ñ‚Ð°Ñ‚Ð¸ | Ð²Ð¾Ð½Ð° **Ð± Ð¿Ñ€Ð¾Ñ‡Ð¸Ñ‚Ð°Ð»Ð°** | ÐÐµ Ð»ÑŽÐ±Ð¸Ñ‚ÑŒ â†’ Ð½Ðµ Ð¿Ñ€Ð¾Ñ‡Ð¸Ñ‚Ð°Ð»Ð° |\n\n**ÐŸÑ€Ð¸ÐºÐ»Ð°Ð´Ð¸ Ð· ÐºÐ¾Ð½Ñ‚ÐµÐºÑÑ‚Ð¾Ð¼:**\n- Ð¯ÐºÐ±Ð¸ Ñ Ð±ÑƒÐ² Ð±Ñ–Ð»ÑŒÑˆ Ð¾Ñ€Ð³Ð°Ð½Ñ–Ð·Ð¾Ð²Ð°Ð½Ð¸Ð¼, Ð½Ðµ Ð·Ð°Ð±ÑƒÐ² Ð±Ð¸ Ð¿Ñ€Ð¾ Ð·ÑƒÑÑ‚Ñ€Ñ–Ñ‡ ÑƒÑ‡Ð¾Ñ€Ð°.\n- Ð¯ÐºÐ±Ð¸ Ð²Ñ–Ð½ Ð´Ð¾Ð±Ñ€Ðµ Ð·Ð½Ð°Ð² ÑƒÐºÑ€Ð°Ñ—Ð½ÑÑŒÐºÑƒ Ð¼Ð¾Ð²Ñƒ, Ð²Ñ–Ð½ Ð±Ð¸ Ð¿ÐµÑ€ÐµÐºÐ»Ð°Ð² Ñ‚Ð¾Ð¹ Ñ‚ÐµÐºÑÑ‚ Ð¼Ð¸Ð½ÑƒÐ»Ð¾Ð³Ð¾ Ñ‚Ð¸Ð¶Ð½Ñ.\n- Ð¯ÐºÐ±Ð¸ Ð¼Ð¸ Ð½Ðµ Ð±Ð¾ÑÐ»Ð¸ÑÑ Ñ€Ð¸Ð·Ð¸ÐºÑƒÐ²Ð°Ñ‚Ð¸, Ð¼Ð¸ Ð± Ð²Ñ–Ð´ÐºÑ€Ð¸Ð»Ð¸ Ð²Ð»Ð°ÑÐ½Ð¸Ð¹ Ð±Ñ–Ð·Ð½ÐµÑ Ð´Ð°Ð²Ð½Ð¾.\n\n> ðŸŒ **Ð£ Ñ€ÐµÐ°Ð»ÑŒÐ½Ð¾Ð¼Ñƒ ÑÐ²Ñ–Ñ‚Ñ–**\n> Ð£ Ð¿ÑÐ¸Ñ…Ð¾Ñ‚ÐµÑ€Ð°Ð¿Ñ–Ñ— Ð·Ð¼Ñ–ÑˆÐ°Ð½Ñ– ÑƒÐ¼Ð¾Ð²Ð¸ Ð´Ð¾Ð¿Ð¾Ð¼Ð°Ð³Ð°ÑŽÑ‚ÑŒ Ð¾ÑÐ¼Ð¸ÑÐ»Ð¸Ñ‚Ð¸ Ð·Ð²'ÑÐ·Ð¾Ðº Ð¼Ñ–Ð¶ Ð¾ÑÐ¾Ð±Ð¸ÑÑ‚Ñ–ÑÐ½Ð¸Ð¼Ð¸ Ñ€Ð¸ÑÐ°Ð¼Ð¸ Ñ‚Ð° Ð¼Ð¸Ð½ÑƒÐ»Ð¸Ð¼Ð¸ Ð¿Ð¾Ð´Ñ–ÑÐ¼Ð¸: Â«Ð¯ÐºÐ±Ð¸ Ð²Ð¸ Ð±ÑƒÐ»Ð¸ Ð±Ñ–Ð»ÑŒÑˆ Ð²Ð¿ÐµÐ²Ð½ÐµÐ½Ð¸Ð¼ Ñƒ ÑÐ¾Ð±Ñ–, ÑÐº Ð±Ð¸ Ñ†Ðµ Ð²Ð¿Ð»Ð¸Ð½ÑƒÐ»Ð¾ Ð½Ð° Ñ‚Ñƒ ÑÐ¸Ñ‚ÑƒÐ°Ñ†Ñ–ÑŽ?Â» Ð¦Ðµ Ð¿Ð¾Ñ‚ÑƒÐ¶Ð½Ð¸Ð¹ Ñ–Ð½ÑÑ‚Ñ€ÑƒÐ¼ÐµÐ½Ñ‚ ÑÐ°Ð¼Ð¾Ð¿Ñ–Ð·Ð½Ð°Ð½Ð½Ñ Ñ‚Ð° Ð¾ÑÐ¾Ð±Ð¸ÑÑ‚Ñ–ÑÐ½Ð¾Ð³Ð¾ Ð·Ñ€Ð¾ÑÑ‚Ð°Ð½Ð½Ñ!\n\n### Ð¢Ð¸Ð¿ 3: Ð›Ð°Ð½Ñ†ÑŽÐ³Ð¾Ð²Ñ– ÑƒÐ¼Ð¾Ð²Ð¸\n\n**Ð¡Ñ‚Ñ€ÑƒÐºÑ‚ÑƒÑ€Ð°:** Ð¯ÐºÑ‰Ð¾/Ð¯ÐºÐ±Ð¸ + ÑƒÐ¼Ð¾Ð²Ð° 1, Ñ– ÑÐºÑ‰Ð¾/ÑÐºÐ±Ð¸ + ÑƒÐ¼Ð¾Ð²Ð° 2, Ð½Ð°ÑÐ»Ñ–Ð´Ð¾Ðº\n\n**ÐšÑ–Ð»ÑŒÐºÐ° ÑƒÐ¼Ð¾Ð² Ð´Ð»Ñ Ð¾Ð´Ð½Ð¾Ð³Ð¾ Ð½Ð°ÑÐ»Ñ–Ð´ÐºÑƒ:**\n- Ð¯ÐºÑ‰Ð¾ Ð¼Ð°Ñ‚Ð¸Ð¼ÐµÑˆ Ñ‡Ð°Ñ, **Ñ– ÑÐºÑ‰Ð¾** Ñ…Ð¾Ñ‚Ñ–Ñ‚Ð¸Ð¼ÐµÑˆ, Ð¿Ñ€Ð¸Ñ…Ð¾Ð´ÑŒ Ð´Ð¾ Ð½Ð°Ñ Ð½Ð° Ð²ÐµÑ‡ÐµÑ€ÑŽ.\n- Ð¯ÐºÐ±Ð¸ Ñ Ð¼Ð°Ð² Ð³Ñ€Ð¾ÑˆÑ–, **Ñ– ÑÐºÐ±Ð¸** Ð¼Ð°Ð² Ñ‡Ð°Ñ, Ð¿Ð¾Ñ—Ñ…Ð°Ð² Ð±Ð¸ Ñƒ Ð²Ñ–Ð´Ð¿ÑƒÑÑ‚ÐºÑƒ Ð½Ð° Ð¼Ð¾Ñ€Ðµ.\n- Ð¯ÐºÑ‰Ð¾ ÑÑŒÐ¾Ð³Ð¾Ð´Ð½Ñ– Ð½Ðµ Ð±ÑƒÐ´Ðµ Ð´Ð¾Ñ‰Ñƒ, **Ñ– ÑÐºÑ‰Ð¾** Ð¼Ð°ÑˆÐ¸Ð½Ð° Ð±ÑƒÐ´Ðµ Ð²Ñ–Ð»ÑŒÐ½Ð°, Ð¿Ð¾Ñ—Ð´ÐµÐ¼Ð¾ Ð·Ð° Ð¼Ñ–ÑÑ‚Ð¾.\n\n**ÐÐ»ÑŒÑ‚ÐµÑ€Ð½Ð°Ñ‚Ð¸Ð²Ð½Ñ– ÑƒÐ¼Ð¾Ð²Ð¸ (Ð°Ð±Ð¾):**\n- Ð¯ÐºÑ‰Ð¾ Ð²Ñ–Ð½ Ð¿Ñ€Ð¸Ð¹Ð´Ðµ **Ð°Ð±Ð¾ ÑÐºÑ‰Ð¾** Ð·Ð°Ñ‚ÐµÐ»ÐµÑ„Ð¾Ð½ÑƒÑ”, Ð¿ÐµÑ€ÐµÐ´Ð°Ð¹ Ð¹Ð¾Ð¼Ñƒ Ñ†ÑŽ Ð½Ð¾Ð²Ð¸Ð½Ñƒ.\n- Ð¯ÐºÐ±Ð¸ Ð²Ñ–Ð½ Ð´Ð¾Ð¿Ð¾Ð¼Ñ–Ð³ **Ñ‡Ð¸ ÑÐºÐ±Ð¸** Ñ…Ð¾Ñ‡Ð° Ð± Ð¿Ð¾Ñ€Ð°Ð´Ð¸Ð², Ð±ÑƒÐ»Ð¾ Ð± Ð»ÐµÐ³ÑˆÐµ ÑÐ¿Ñ€Ð°Ð²Ð¸Ñ‚Ð¸ÑÑ.\n\n> âš ï¸ **Ð’Ð°Ð¶Ð»Ð¸Ð²Ð¸Ð¹ Ð½ÑŽÐ°Ð½Ñ**\n> Ð£ Ð»Ð°Ð½Ñ†ÑŽÐ³Ð¾Ð²Ð¸Ñ… ÑƒÐ¼Ð¾Ð²Ð°Ñ… ÑƒÑÑ– Ñ‡Ð°ÑÑ‚Ð¸Ð½Ð¸ Ð¼Ð°ÑŽÑ‚ÑŒ Ð±ÑƒÑ‚Ð¸ Ð°Ð±Ð¾ Ñ€ÐµÐ°Ð»ÑŒÐ½Ð¸Ð¼Ð¸ (Ð· Â«ÑÐºÑ‰Ð¾Â»), Ð°Ð±Ð¾ Ð½ÐµÑ€ÐµÐ°Ð»ÑŒÐ½Ð¸Ð¼Ð¸ (Ð· Â«ÑÐºÐ±Ð¸Â»). ÐÐµ Ð·Ð¼Ñ–ÑˆÑƒÐ¹Ñ‚Ðµ Â«ÑÐºÑ‰Ð¾Â» Ñ– Â«ÑÐºÐ±Ð¸Â» Ð² Ð¾Ð´Ð½Ð¾Ð¼Ñƒ Ñ€ÐµÑ‡ÐµÐ½Ð½Ñ–!\n> âŒ Ð¯ÐºÑ‰Ð¾ Ð¿Ñ€Ð¸Ð¹Ð´Ðµ, Ñ– ÑÐºÐ±Ð¸ Ð¼Ð°Ð² Ñ‡Ð°Ñ...\n> âœ… Ð¯ÐºÑ‰Ð¾ Ð¿Ñ€Ð¸Ð¹Ð´Ðµ, Ñ– ÑÐºÑ‰Ð¾ Ð¼Ð°Ñ‚Ð¸Ð¼Ðµ Ñ‡Ð°Ñ...\n> âœ… Ð¯ÐºÐ±Ð¸ Ð¿Ñ€Ð¸Ð¹ÑˆÐ¾Ð², Ñ– ÑÐºÐ±Ð¸ Ð¼Ð°Ð² Ñ‡Ð°Ñ...\n\n> ðŸ‡ºðŸ‡¦ **ÐšÑƒÐ»ÑŒÑ‚ÑƒÑ€Ð½Ð¸Ð¹ Ð¼Ð¾Ð¼ÐµÐ½Ñ‚**\n>\n> ÐžÐ´ÐµÑÐ° ÑÐ»Ð°Ð²Ð¸Ñ‚ÑŒÑÑ ÑÐ²Ð¾Ñ—Ð¼ Ð³ÑƒÐ¼Ð¾Ñ€Ð¾Ð¼. ÐžÐ´ÐµÑÐ¸Ñ‚Ð¸ ÐºÐ°Ð¶ÑƒÑ‚ÑŒ: Â«Ð¯ÐºÑ‰Ð¾ Ñ‚Ð¸ Ñ…Ð¾Ñ‡ÐµÑˆ Ð½Ð° Ð¼Ð¾Ñ€Ðµ, Ñ– ÑÐºÑ‰Ð¾ Ñ” Ð²Ñ–Ð»ÑŒÐ½Ð¸Ð¹ Ñ‡Ð°Ñ â€” Ð±Ñ–Ð¶Ð¸ Ð½Ð° Ð›Ð°Ð½Ð¶ÐµÑ€Ð¾Ð½!Â» Ð¦Ðµ Ð»Ð°Ð½Ñ†ÑŽÐ³Ð¾Ð²Ð° ÑƒÐ¼Ð¾Ð²Ð° Ð² Ð´Ñ–Ñ—. ÐžÐ´ÐµÑÐ° â€” Ð¼Ñ–ÑÑ‚Ð¾, Ð´Ðµ Ð¼Ð¾Ð²Ð° Ð²Ñ–Ð´Ð¾Ð±Ñ€Ð°Ð¶Ð°Ñ” Ð¿Ñ€Ð°ÐºÑ‚Ð¸Ñ‡Ð½Ð¸Ð¹ Ð¿Ñ–Ð´Ñ…Ñ–Ð´ Ð´Ð¾ Ð¶Ð¸Ñ‚Ñ‚Ñ.\n\n### Ð¢Ð¸Ð¿ 4: ÐÐ°ÑÐ»Ñ–Ð´ÐºÐ¾Ð²Ñ– Ð»Ð°Ð½Ñ†ÑŽÐ³Ð¸\n\n**Ð¡Ñ‚Ñ€ÑƒÐºÑ‚ÑƒÑ€Ð°:** Ð¯ÐºÑ‰Ð¾ A, Ñ‚Ð¾ B. Ð ÑÐºÑ‰Ð¾ B, Ñ‚Ð¾ C.\n\n| ÐŸÐµÑ€ÑˆÐ° ÑƒÐ¼Ð¾Ð²Ð° | ÐŸÐµÑ€ÑˆÐ¸Ð¹ Ð½Ð°ÑÐ»Ñ–Ð´Ð¾Ðº | Ð”Ñ€ÑƒÐ³Ð¸Ð¹ Ð½Ð°ÑÐ»Ñ–Ð´Ð¾Ðº |\n|-------------|-----------------|-----------------|\n| Ð¯ÐºÑ‰Ð¾ Ð²Ð¸Ð²Ñ‡Ð¸Ñˆ Ð¼Ð¾Ð²Ñƒ | Ð·Ð½Ð°Ð¹Ð´ÐµÑˆ Ñ€Ð¾Ð±Ð¾Ñ‚Ñƒ | Ð·Ð°Ñ€Ð¾Ð±Ð¸Ñˆ Ð³Ñ€Ð¾ÑˆÑ– |\n| Ð¯ÐºÐ±Ð¸ Ð¼Ð°Ð² Ð³Ñ€Ð¾ÑˆÑ– | ÐºÑƒÐ¿Ð¸Ð² Ð±Ð¸ Ð´Ñ–Ð¼ | Ð¶Ð¸Ð² Ð±Ð¸ Ñ‰Ð°ÑÐ»Ð¸Ð²Ð¾ |\n| Ð¯ÐºÑ‰Ð¾ Ð½Ðµ Ð²ÑÑ‚Ð¸Ð³Ð½Ñƒ | Ð·Ð°Ð¿Ñ–Ð·Ð½ÑŽÑÑ | Ð¿Ñ€Ð¾Ð¿ÑƒÑ‰Ñƒ Ð½Ð°Ñ€Ð°Ð´Ñƒ |\n\n**ÐŸÑ€Ð¸ÐºÐ»Ð°Ð´Ð¸ Ð¿Ð¾Ð²Ð½Ð¸Ñ… Ð»Ð°Ð½Ñ†ÑŽÐ³Ñ–Ð²:**\n- Ð¯ÐºÑ‰Ð¾ Ð²Ð¸Ð²Ñ‡Ð¸Ñˆ ÑƒÐºÑ€Ð°Ñ—Ð½ÑÑŒÐºÑƒ Ð¼Ð¾Ð²Ñƒ, Ð·Ð½Ð°Ð¹Ð´ÐµÑˆ Ñ…Ð¾Ñ€Ð¾ÑˆÑƒ Ñ€Ð¾Ð±Ð¾Ñ‚Ñƒ. Ð ÑÐºÑ‰Ð¾ Ð·Ð½Ð°Ð¹Ð´ÐµÑˆ Ñ€Ð¾Ð±Ð¾Ñ‚Ñƒ, Ð·Ð°Ñ€Ð¾Ð±Ð¸Ñˆ Ð³Ñ€Ð¾ÑˆÑ–.\n- Ð¯ÐºÐ±Ð¸ Ñ Ñ‚Ð¾Ð´Ñ– Ð²Ð¸Ð²Ñ‡Ð¸Ð²ÑÑ ÐºÑ€Ð°Ñ‰Ðµ, Ð·Ð½Ð°Ð¹ÑˆÐ¾Ð² Ð±Ð¸ ÐºÑ€Ð°Ñ‰Ñƒ Ñ€Ð¾Ð±Ð¾Ñ‚Ñƒ. Ð ÑÐºÐ±Ð¸ Ð·Ð½Ð°Ð¹ÑˆÐ¾Ð² Ñ€Ð¾Ð±Ð¾Ñ‚Ñƒ, Ð¶Ð¸Ð² Ð±Ð¸ Ð·Ð°Ñ€Ð°Ð· Ñ–Ð½Ð°ÐºÑˆÐµ.\n\n> ðŸŽ¬ **ÐšÑƒÐ»ÑŒÑ‚ÑƒÑ€Ð½Ð¸Ð¹ Ð¼Ð¾Ð¼ÐµÐ½Ñ‚**\n> Ð£ ÐºÐ»Ð°ÑÐ¸Ñ‡Ð½Ñ–Ð¹ ÑƒÐºÑ€Ð°Ñ—Ð½ÑÑŒÐºÑ–Ð¹ Ð»Ñ–Ñ‚ÐµÑ€Ð°Ñ‚ÑƒÑ€Ñ– Ñ‡Ð°ÑÑ‚Ð¾ Ð·ÑƒÑÑ‚Ñ€Ñ–Ñ‡Ð°ÑŽÑ‚ÑŒÑÑ ÑÐºÐ»Ð°Ð´Ð½Ñ– ÑƒÐ¼Ð¾Ð²Ð½Ñ– ÐºÐ¾Ð½ÑÑ‚Ñ€ÑƒÐºÑ†Ñ–Ñ—. Ð£ Â«Ð›Ñ–ÑÐ¾Ð²Ñ–Ð¹ Ð¿Ñ–ÑÐ½Ñ–Â» Ð›ÐµÑÑ– Ð£ÐºÑ€Ð°Ñ—Ð½ÐºÐ¸ ÐœÐ°Ð²ÐºÐ° ÐºÐ°Ð¶Ðµ: Â«Ð¯ÐºÐ±Ð¸ Ñ‚Ð¸ Ð¼ÐµÐ½Ðµ Ð½Ðµ Ð»ÑŽÐ±Ð¸Ð², Ñ Ð± Ð½Ðµ Ñ–ÑÐ½ÑƒÐ²Ð°Ð»Ð°Â». Ð¦Ðµ Ð·Ð¼Ñ–ÑˆÐ°Ð½Ð° ÑƒÐ¼Ð¾Ð²Ð°: Ñ‚ÐµÐ¿ÐµÑ€Ñ–ÑˆÐ½Ñ Ð»ÑŽÐ±Ð¾Ð² â†’ Ð¼Ð¸Ð½ÑƒÐ»Ðµ Ð²Ð¸Ð½Ð¸ÐºÐ½ÐµÐ½Ð½Ñ. Ð—Ð²ÐµÑ€Ð½Ñ–Ñ‚ÑŒ ÑƒÐ²Ð°Ð³Ñƒ Ð½Ð° Ñ„Ñ–Ð»Ð¾ÑÐ¾Ñ„ÑÑŒÐºÑƒ Ð³Ð»Ð¸Ð±Ð¸Ð½Ñƒ Ð²Ð¸ÐºÐ¾Ñ€Ð¸ÑÑ‚Ð°Ð½Ð½Ñ Ð³Ñ€Ð°Ð¼Ð°Ñ‚Ð¸ÐºÐ¸!\n\n### ÐŸÐ¾Ñ€Ñ–Ð²Ð½ÑÐ½Ð½Ñ Ð²ÑÑ–Ñ… Ñ‚Ð¸Ð¿Ñ–Ð² ÑƒÐ¼Ð¾Ð²\n\n| Ð¢Ð¸Ð¿ | Ð¡Ð¿Ð¾Ð»ÑƒÑ‡Ð½Ð¸Ðº | Ð§Ð°Ñ ÑƒÐ¼Ð¾Ð²Ð¸ | Ð§Ð°Ñ Ð½Ð°ÑÐ»Ñ–Ð´ÐºÑƒ | ÐŸÑ€Ð¸ÐºÐ»Ð°Ð´ |\n|-----|-----------|-----------|--------------|---------|\n| Ð ÐµÐ°Ð»ÑŒÐ½Ð° | ÑÐºÑ‰Ð¾ | Ñ‚ÐµÐ¿./Ð¼Ð°Ð¹Ð±. | Ñ‚ÐµÐ¿./Ð¼Ð°Ð¹Ð±. | Ð¯ÐºÑ‰Ð¾ Ð¿Ñ€Ð¸Ð¹Ð´Ðµ â†’ Ð¿Ð¾Ð³Ð¾Ð²Ð¾Ñ€Ð¸Ð¼Ð¾ |\n| ÐÐµÑ€ÐµÐ°Ð»ÑŒÐ½Ð° | ÑÐºÐ±Ð¸ | Ð¼Ð¸Ð½ÑƒÐ»Ð¸Ð¹ | Ð¼Ð¸Ð½ÑƒÐ»Ð¸Ð¹ + Ð± | Ð¯ÐºÐ±Ð¸ Ð¿Ñ€Ð¸Ð¹ÑˆÐ¾Ð² â†’ Ð¿Ð¾Ð³Ð¾Ð²Ð¾Ñ€Ð¸Ð»Ð¸ Ð± |\n| Ð—Ð¼Ñ–ÑˆÐ°Ð½Ð° 1 | ÑÐºÐ±Ð¸ | Ð¼Ð¸Ð½. (Ð¿Ð¾Ð´Ñ–Ñ) | Ð¼Ð¸Ð½. + Ð± (Ð·Ð°Ñ€Ð°Ð·) | Ð¯ÐºÐ±Ð¸ Ð²Ð¸Ð²Ñ‡Ð¸Ð² â†’ Ð± Ð·Ð½Ð°Ð² Ð·Ð°Ñ€Ð°Ð· |\n| Ð—Ð¼Ñ–ÑˆÐ°Ð½Ð° 2 | ÑÐºÐ±Ð¸ | Ð¼Ð¸Ð½. (Ñ€Ð¸ÑÐ°) | Ð¼Ð¸Ð½. + Ð± (Ð¿Ð¾Ð´Ñ–Ñ) | Ð¯ÐºÐ±Ð¸ Ð±ÑƒÐ² â†’ Ð± ÑÐºÐ°Ð·Ð°Ð² |\n| Ð›Ð°Ð½Ñ†ÑŽÐ³Ð¾Ð²Ð° | ÑÐºÑ‰Ð¾ + ÑÐºÑ‰Ð¾ | Ñ‚ÐµÐ¿./Ð¼Ð°Ð¹Ð±. | Ñ‚ÐµÐ¿./Ð¼Ð°Ð¹Ð±. | Ð¯ÐºÑ‰Ð¾ A, Ñ– ÑÐºÑ‰Ð¾ B â†’ C |\n\n> ðŸŽ¯ **Ð¦Ñ–ÐºÐ°Ð²Ð¸Ð¹ Ñ„Ð°ÐºÑ‚**\n> Ð—Ð¼Ñ–ÑˆÐ°Ð½Ñ– ÑƒÐ¼Ð¾Ð²Ð¸ Ñ‡Ð°ÑÑ‚Ð¾ Ð²Ð¸ÐºÐ¾Ñ€Ð¸ÑÑ‚Ð¾Ð²ÑƒÑŽÑ‚ÑŒÑÑ Ð´Ð»Ñ Ð²Ð¸Ñ€Ð°Ð¶ÐµÐ½Ð½Ñ Ð¶Ð¸Ñ‚Ñ‚Ñ”Ð²Ð¸Ñ… Ð¶Ð°Ð»Ñ–Ð² Ñ– Ð¼Ñ€Ñ–ÑÐ½ÑŒ. ÐŸÑÐ¸Ñ…Ð¾Ð»Ð¾Ð³Ð¸ ÐºÐ°Ð¶ÑƒÑ‚ÑŒ, Ñ‰Ð¾ Ð»ÑŽÐ´Ð¸, ÑÐºÑ– Ñ‡Ð°ÑÑ‚Ð¾ Ð²Ð¸ÐºÐ¾Ñ€Ð¸ÑÑ‚Ð¾Ð²ÑƒÑŽÑ‚ÑŒ Â«ÑÐºÐ±Ð¸ Ñ Ñ‚Ð¾Ð´Ñ–...Â», Ð¼Ð°ÑŽÑ‚ÑŒ Ñ‚ÐµÐ½Ð´ÐµÐ½Ñ†Ñ–ÑŽ Ð´Ð¾ Ñ€ÑƒÐ¼Ð¸Ð½Ð°Ñ†Ñ–Ñ— (Ð½Ð°Ð²'ÑÐ·Ð»Ð¸Ð²Ð¸Ñ… Ð´ÑƒÐ¼Ð¾Ðº Ð¿Ñ€Ð¾ Ð¼Ð¸Ð½ÑƒÐ»Ðµ). Ð Ð¾Ð·ÑƒÐ¼Ñ–Ð½Ð½Ñ Ð³Ñ€Ð°Ð¼Ð°Ñ‚Ð¸ÐºÐ¸ Ð´Ð¾Ð¿Ð¾Ð¼Ð°Ð³Ð°Ñ” ÑƒÑÐ²Ñ–Ð´Ð¾Ð¼Ð»ÑŽÐ²Ð°Ñ‚Ð¸ ÑÐ²Ð¾Ñ— Ð´ÑƒÐ¼ÐºÐ¾Ð²Ñ– Ð¿Ð°Ñ‚ÐµÑ€Ð½Ð¸!\n\n### ÐÐ»ÑŒÑ‚ÐµÑ€Ð½Ð°Ñ‚Ð¸Ð²Ð½Ñ– ÐºÐ¾Ð½ÑÑ‚Ñ€ÑƒÐºÑ†Ñ–Ñ—\n\nÐ—Ð°Ð¼Ñ–ÑÑ‚ÑŒ Ð¿Ñ€Ð¾ÑÑ‚Ð¾Ð³Ð¾ Â«ÑÐºÐ±Ð¸Â» Ð¼Ð¾Ð¶Ð½Ð° Ð²Ð¸ÐºÐ¾Ñ€Ð¸ÑÑ‚Ð¾Ð²ÑƒÐ²Ð°Ñ‚Ð¸:\n\n| ÐšÐ¾Ð½ÑÑ‚Ñ€ÑƒÐºÑ†Ñ–Ñ | Ð—Ð½Ð°Ñ‡ÐµÐ½Ð½Ñ | ÐŸÑ€Ð¸ÐºÐ»Ð°Ð´ |\n|-------------|----------|---------|\n| **Ñƒ Ñ‚Ð°ÐºÐ¾Ð¼Ñƒ Ñ€Ð°Ð·Ñ–** | in that case | Ð¯ÐºÑ‰Ð¾ Ð¿Ñ€Ð¸Ð¹Ð´Ðµ, Ñƒ Ñ‚Ð°ÐºÐ¾Ð¼Ñƒ Ñ€Ð°Ð·Ñ– Ð¿Ð¾Ð³Ð¾Ð²Ð¾Ñ€Ð¸Ð¼Ð¾. |\n| **Ñ–Ð½Ð°ÐºÑˆÐµ** | otherwise | Ð’Ð¸Ð²Ñ‡Ð°Ð¹, Ñ–Ð½Ð°ÐºÑˆÐµ Ð½Ðµ Ð·Ð´Ð°ÑÐ¸ ÐµÐºÐ·Ð°Ð¼ÐµÐ½. |\n| **Ð² Ñ–Ð½ÑˆÐ¾Ð¼Ñƒ Ð²Ð¸Ð¿Ð°Ð´ÐºÑƒ** | otherwise | ÐŸÑ€Ð°Ñ†ÑŽÐ¹ ÑÑ‚Ð°Ñ€Ð°Ð½Ð½Ð¾, Ð² Ñ–Ð½ÑˆÐ¾Ð¼Ñƒ Ð²Ð¸Ð¿Ð°Ð´ÐºÑƒ Ð·Ð²Ñ–Ð»ÑŒÐ½ÑÑ‚ÑŒ. |\n| **Ð¿Ñ€Ð¾Ñ‚Ðµ** | however | Ð¥Ð¾Ñ‚Ñ–Ð² Ð±Ð¸, Ð¿Ñ€Ð¾Ñ‚Ðµ Ð½Ðµ Ð¼Ð¾Ð¶Ñƒ. |\n| **Ð¾Ð´Ð½Ð°Ðº** | however | Ð¡Ð¿Ñ€Ð¾Ð±ÑƒÐ²Ð°Ð² Ð±Ð¸, Ð¾Ð´Ð½Ð°Ðº Ñ†Ðµ Ð½ÐµÐ¼Ð¾Ð¶Ð»Ð¸Ð²Ð¾. |\n| **Ð°Ð»Ðµ** | but | Ð¯ÐºÐ±Ð¸ Ð¼Ð°Ð² Ñ‡Ð°Ñ, Ð¿Ð¾Ñ—Ñ…Ð°Ð² Ð±Ð¸, Ð°Ð»Ðµ Ð¼Ð°ÑŽ Ñ€Ð¾Ð±Ð¾Ñ‚Ñƒ. |\n\n> ðŸ‡ºðŸ‡¦ **ÐšÑƒÐ»ÑŒÑ‚ÑƒÑ€Ð½Ð¸Ð¹ Ð¼Ð¾Ð¼ÐµÐ½Ñ‚**\n>\n> Ð£ Ð½Ð°Ñ€Ð¾Ð´Ð½Ð¸Ñ… Ð¿Ñ€Ð¸ÑÐ»Ñ–Ð²'ÑÑ… Ñ‡Ð°ÑÑ‚Ð¾ Ð·ÑƒÑÑ‚Ñ€Ñ–Ñ‡Ð°ÑŽÑ‚ÑŒÑÑ ÑÐºÐ»Ð°Ð´Ð½Ñ– ÑƒÐ¼Ð¾Ð²Ð¸: Â«Ð¯ÐºÐ±Ð¸ Ð·Ð½Ð°Ð², Ð´Ðµ Ð²Ð¿Ð°Ð´ÐµÑˆ, ÑÐ¾Ð»Ð¾Ð¼ÐºÐ¸ Ð± Ð¿Ñ–Ð´ÑÑ‚ÐµÐ»Ð¸Ð²Â» â€” Ñ†Ðµ ÐºÐ»Ð°ÑÐ¸Ñ‡Ð½Ð° Ð·Ð¼Ñ–ÑˆÐ°Ð½Ð° ÑƒÐ¼Ð¾Ð²Ð°: Ð¼Ð¸Ð½ÑƒÐ»Ðµ Ð·Ð½Ð°Ð½Ð½Ñ â†’ Ð¼Ð¸Ð½ÑƒÐ»Ð° Ð´Ñ–Ñ Ð´Ð»Ñ Ð·Ð°Ð¿Ð¾Ð±Ñ–Ð³Ð°Ð½Ð½Ñ Ñ‚ÐµÐ¿ÐµÑ€Ñ–ÑˆÐ½ÑŒÐ¾Ð¼Ñƒ Ñ€ÐµÐ·ÑƒÐ»ÑŒÑ‚Ð°Ñ‚Ñƒ. ÐšÐ¸Ñ—Ð² Ð·Ð±ÐµÑ€Ñ–Ð³Ð°Ñ” Ñ‚Ð¸ÑÑÑ‡Ñ– Ñ‚Ð°ÐºÐ¸Ñ… Ð¿Ñ€Ð¸ÑÐ»Ñ–Ð²'Ñ—Ð² Ñƒ Ñ„Ð¾Ð»ÑŒÐºÐ»Ð¾Ñ€Ð½Ð¸Ñ… Ð°Ñ€Ñ…Ñ–Ð²Ð°Ñ…. Ð’Ð¸Ð²Ñ‡Ð°Ð¹Ñ‚Ðµ Ð³Ñ€Ð°Ð¼Ð°Ñ‚Ð¸ÐºÑƒ Ñ‡ÐµÑ€ÐµÐ· Ð½Ð°Ñ€Ð¾Ð´Ð½Ñƒ Ð¼ÑƒÐ´Ñ€Ñ–ÑÑ‚ÑŒ!\n\n---\n\n## ÐŸÑ€Ð°ÐºÑ‚Ð¸ÐºÐ°\n\n### Ð¯Ðº Ð¾Ð±Ñ€Ð°Ñ‚Ð¸ Ð¿Ñ€Ð°Ð²Ð¸Ð»ÑŒÐ½Ð¸Ð¹ Ñ‚Ð¸Ð¿ ÑƒÐ¼Ð¾Ð²Ð¸?\n\nÐ—Ð°Ð´Ð°Ð¹Ñ‚Ðµ ÑÐ¾Ð±Ñ– Ñ†Ñ– Ð¿Ð¸Ñ‚Ð°Ð½Ð½Ñ:\n\n1. **ÐŸÑ€Ð¾ ÑÐºÐ¸Ð¹ Ñ‡Ð°Ñ ÑƒÐ¼Ð¾Ð²Ð°?**\n   - ÐœÐ¸Ð½ÑƒÐ»Ð° Ð¿Ð¾Ð´Ñ–Ñ â†’ Ð¯ÐºÐ±Ð¸ Ñ Ð²Ð¸Ð²Ñ‡Ð¸Ð² Ñ‚Ð¾Ð´Ñ–...\n   - Ð¢ÐµÐ¿ÐµÑ€Ñ–ÑˆÐ½Ñ Ñ€Ð¸ÑÐ° â†’ Ð¯ÐºÐ±Ð¸ Ñ Ð±ÑƒÐ² ÑÐ¼Ñ–Ð»Ð¸Ð²Ñ–ÑˆÐ¸Ð¼...\n   - ÐœÐ°Ð¹Ð±ÑƒÑ‚Ð½Ñ Ð¼Ð¾Ð¶Ð»Ð¸Ð²Ñ–ÑÑ‚ÑŒ â†’ Ð¯ÐºÑ‰Ð¾ Ð¼Ð°Ñ‚Ð¸Ð¼Ñƒ Ñ‡Ð°Ñ...\n\n2. **ÐŸÑ€Ð¾ ÑÐºÐ¸Ð¹ Ñ‡Ð°Ñ Ð½Ð°ÑÐ»Ñ–Ð´Ð¾Ðº?**\n   - Ð¢ÐµÐ¿ÐµÑ€Ñ–ÑˆÐ½Ñ–Ð¹ Ñ€ÐµÐ·ÑƒÐ»ÑŒÑ‚Ð°Ñ‚ â†’ ...Ð·Ð°Ñ€Ð°Ð· Ð±Ð¸ Ð·Ð½Ð°Ð².\n   - ÐœÐ¸Ð½ÑƒÐ»Ð° Ð¿Ð¾Ð´Ñ–Ñ â†’ ...ÑÐºÐ°Ð·Ð°Ð² Ð±Ð¸.\n   - ÐœÐ°Ð¹Ð±ÑƒÑ‚Ð½Ñ Ð´Ñ–Ñ â†’ ...Ð´Ð¾Ð¿Ð¾Ð¼Ð¾Ð¶Ñƒ.\n\n3. **Ð§Ð¸ Ð·Ð±Ñ–Ð³Ð°ÑŽÑ‚ÑŒÑÑ Ñ‡Ð°ÑÐ¸?**\n   - Ð¢Ð°Ðº â†’ ÑÑ‚Ð°Ð½Ð´Ð°Ñ€Ñ‚Ð½Ð° ÑƒÐ¼Ð¾Ð²Ð° (Ñ€ÐµÐ°Ð»ÑŒÐ½Ð° Ð°Ð±Ð¾ Ð½ÐµÑ€ÐµÐ°Ð»ÑŒÐ½Ð°)\n   - ÐÑ– â†’ Ð·Ð¼Ñ–ÑˆÐ°Ð½Ð° ÑƒÐ¼Ð¾Ð²Ð°\n\n4. **Ð§Ð¸ Ñ” ÐºÑ–Ð»ÑŒÐºÐ° ÑƒÐ¼Ð¾Ð²?**\n   - Ð¢Ð°Ðº â†’ Ð»Ð°Ð½Ñ†ÑŽÐ³Ð¾Ð²Ð° ÑƒÐ¼Ð¾Ð²Ð°: ÑÐºÑ‰Ð¾ A, Ñ– ÑÐºÑ‰Ð¾ B...\n\n### Ð¢Ð¸Ð¿Ð¾Ð²Ñ– Ð¿Ð¾Ð¼Ð¸Ð»ÐºÐ¸ Ñ‚Ð° ÑÐº Ñ—Ñ… ÑƒÐ½Ð¸ÐºÐ½ÑƒÑ‚Ð¸\n\n**ÐŸÐ¾Ð¼Ð¸Ð»ÐºÐ° 1: Ð—Ð¼Ñ–ÑˆÑƒÐ²Ð°Ð½Ð½Ñ Â«ÑÐºÑ‰Ð¾Â» Ñ– Â«ÑÐºÐ±Ð¸Â» Ð² Ð»Ð°Ð½Ñ†ÑŽÐ³Ñƒ**\n\nâŒ ÐÐµÐ¿Ñ€Ð°Ð²Ð¸Ð»ÑŒÐ½Ð¾: Ð¯ÐºÑ‰Ð¾ Ð¿Ñ€Ð¸Ð¹Ð´Ðµ, Ñ– ÑÐºÐ±Ð¸ Ð¼Ð°Ð² Ñ‡Ð°Ñ, Ð¿Ð¾Ð³Ð¾Ð²Ð¾Ñ€Ð¸Ð¼Ð¾.\nâœ… ÐŸÑ€Ð°Ð²Ð¸Ð»ÑŒÐ½Ð¾: Ð¯ÐºÑ‰Ð¾ Ð¿Ñ€Ð¸Ð¹Ð´Ðµ, Ñ– ÑÐºÑ‰Ð¾ Ð¼Ð°Ñ‚Ð¸Ð¼Ðµ Ñ‡Ð°Ñ, Ð¿Ð¾Ð³Ð¾Ð²Ð¾Ñ€Ð¸Ð¼Ð¾.\n\n**Ð§Ð¾Ð¼Ñƒ?** Ð’ Ð¾Ð´Ð½Ð¾Ð¼Ñƒ Ð»Ð°Ð½Ñ†ÑŽÐ³Ñƒ Ð²ÑÑ– ÑƒÐ¼Ð¾Ð²Ð¸ Ð¼Ð°ÑŽÑ‚ÑŒ Ð±ÑƒÑ‚Ð¸ Ð°Ð±Ð¾ Ñ€ÐµÐ°Ð»ÑŒÐ½Ð¸Ð¼Ð¸, Ð°Ð±Ð¾ Ð½ÐµÑ€ÐµÐ°Ð»ÑŒÐ½Ð¸Ð¼Ð¸.\n\n**ÐŸÐ¾Ð¼Ð¸Ð»ÐºÐ° 2: ÐÐµÐ¿Ñ€Ð°Ð²Ð¸Ð»ÑŒÐ½Ð¸Ð¹ Ñ‡Ð°ÑÐ¾Ð²Ð¸Ð¹ Ð¼Ð°Ñ€ÐºÐµÑ€ Ñƒ Ð·Ð¼Ñ–ÑˆÐ°Ð½Ñ–Ð¹ ÑƒÐ¼Ð¾Ð²Ñ–**\n\nâŒ ÐÐµÐ¿Ñ€Ð°Ð²Ð¸Ð»ÑŒÐ½Ð¾: Ð¯ÐºÐ±Ð¸ Ñ Ð²Ð¸Ð²Ñ‡Ð¸Ð², Ð·Ð°Ñ€Ð°Ð· Ð·Ð½Ð°ÑŽ.\nâœ… ÐŸÑ€Ð°Ð²Ð¸Ð»ÑŒÐ½Ð¾: Ð¯ÐºÐ±Ð¸ Ñ Ð²Ð¸Ð²Ñ‡Ð¸Ð², Ð·Ð°Ñ€Ð°Ð· **Ð±Ð¸ Ð·Ð½Ð°Ð²**.\n\n**Ð§Ð¾Ð¼Ñƒ?** ÐÐ°Ð²Ñ–Ñ‚ÑŒ ÑÐºÑ‰Ð¾ Ð½Ð°ÑÐ»Ñ–Ð´Ð¾Ðº Ð¿Ñ€Ð¾ Ñ‚ÐµÐ¿ÐµÑ€Ñ–ÑˆÐ½Ñ”, Ð¿Ð¾Ñ‚Ñ€Ñ–Ð±Ð½Ð° Ñ‡Ð°ÑÑ‚ÐºÐ° Â«Ð±Â».\n\n**ÐŸÐ¾Ð¼Ð¸Ð»ÐºÐ° 3: Ð’Ñ–Ð´ÑÑƒÑ‚Ð½Ñ–ÑÑ‚ÑŒ ÐºÐ¾Ð½Ñ‚ÐµÐºÑÑ‚Ñƒ Ð² Ð·Ð¼Ñ–ÑˆÐ°Ð½Ñ–Ð¹ ÑƒÐ¼Ð¾Ð²Ñ–**\n\nâŒ ÐÐµÐ¿Ñ€Ð°Ð²Ð¸Ð»ÑŒÐ½Ð¾: Ð¯ÐºÐ±Ð¸ Ñ Ð²Ð¸Ð²Ñ‡Ð¸Ð², Ñ Ð± Ð·Ð½Ð°Ð². (Ð½ÐµÐ·Ñ€Ð¾Ð·ÑƒÐ¼Ñ–Ð»Ð¾, Ð¿Ñ€Ð¾ Ñ‰Ð¾)\nâœ… ÐŸÑ€Ð°Ð²Ð¸Ð»ÑŒÐ½Ð¾: Ð¯ÐºÐ±Ð¸ Ñ Ð²Ð¸Ð²Ñ‡Ð¸Ð² **Ñ‚Ð¾Ð´Ñ–**, Ñ Ð± **Ð·Ð°Ñ€Ð°Ð·** Ð·Ð½Ð°Ð².\n\n**Ð§Ð¾Ð¼Ñƒ?** Ð§Ð°ÑÐ¾Ð²Ñ– Ð¼Ð°Ñ€ÐºÐµÑ€Ð¸ Â«Ñ‚Ð¾Ð´Ñ–Â», Â«Ð·Ð°Ñ€Ð°Ð·Â» Ñ€Ð¾Ð±Ð»ÑÑ‚ÑŒ Ð·Ð¼Ñ–ÑˆÐ°Ð½Ñƒ ÑƒÐ¼Ð¾Ð²Ñƒ Ð·Ñ€Ð¾Ð·ÑƒÐ¼Ñ–Ð»Ð¾ÑŽ.\n\n**ÐŸÐ¾Ð¼Ð¸Ð»ÐºÐ° 4: ÐÐµÐ¿Ñ€Ð°Ð²Ð¸Ð»ÑŒÐ½Ð¸Ð¹ Ð¿Ð¾Ñ€ÑÐ´Ð¾Ðº Ñƒ Ð»Ð°Ð½Ñ†ÑŽÐ·Ñ–**\n\nâŒ ÐÐµÐ¿Ñ€Ð°Ð²Ð¸Ð»ÑŒÐ½Ð¾: Ð¯ÐºÑ‰Ð¾ Ñ– ÑÐºÑ‰Ð¾ Ð¿Ñ€Ð¸Ð¹Ð´Ðµ Ð¼Ð°Ñ‚Ð¸Ð¼Ðµ Ñ‡Ð°Ñ, Ð¿Ð¾Ð³Ð¾Ð²Ð¾Ñ€Ð¸Ð¼Ð¾.\nâœ… ÐŸÑ€Ð°Ð²Ð¸Ð»ÑŒÐ½Ð¾: Ð¯ÐºÑ‰Ð¾ Ð¿Ñ€Ð¸Ð¹Ð´Ðµ, Ñ– ÑÐºÑ‰Ð¾ Ð¼Ð°Ñ‚Ð¸Ð¼Ðµ Ñ‡Ð°Ñ, Ð¿Ð¾Ð³Ð¾Ð²Ð¾Ñ€Ð¸Ð¼Ð¾.\n\n**Ð§Ð¾Ð¼Ñƒ?** ÐšÐ¾Ð¶Ð½Ð° ÑƒÐ¼Ð¾Ð²Ð° â€” Ð¾ÐºÑ€ÐµÐ¼Ðµ Ð¿Ñ–Ð´Ñ€ÑÐ´Ð½Ðµ Ñ€ÐµÑ‡ÐµÐ½Ð½Ñ Ð· Ð²Ð»Ð°ÑÐ½Ð¸Ð¼ Â«ÑÐºÑ‰Ð¾Â».\n\n> ðŸŽ® **Ð†Ð³Ñ€Ð¾Ð²Ð¸Ð¹ Ð¼Ð¾Ð¼ÐµÐ½Ñ‚**\n> Ð£ Ñ€Ð¾Ð»ÐµÐ²Ð¸Ñ… Ñ–Ð³Ñ€Ð°Ñ… Ñ‡Ð°ÑÑ‚Ð¾ Ñ” Ð¼ÐµÑ…Ð°Ð½Ñ–ÐºÐ° Â«Ñ‰Ð¾ Ð±ÑƒÐ»Ð¾ Ð±, ÑÐºÐ±Ð¸Â». Ð£ Baldur's Gate 3 Ð³Ñ€Ð°Ð²Ñ†Ñ– Ð°Ð½Ð°Ð»Ñ–Ð·ÑƒÑŽÑ‚ÑŒ: Â«Ð¯ÐºÐ±Ð¸ Ñ Ñ‚Ð¾Ð´Ñ– Ð²Ð¸Ð±Ñ€Ð°Ð² Ñ–Ð½ÑˆÐ¸Ð¹ ÐºÐ»Ð°Ñ, Ð·Ð°Ñ€Ð°Ð· Ð±Ð¸ Ð¼Ð°Ð² Ñ–Ð½ÑˆÑ– Ð·Ð´Ñ–Ð±Ð½Ð¾ÑÑ‚Ñ–Â». Ð¦Ðµ Ñ–Ð´ÐµÐ°Ð»ÑŒÐ½Ð¸Ð¹ Ð¿Ñ€Ð¸ÐºÐ»Ð°Ð´ Ð·Ð¼Ñ–ÑˆÐ°Ð½Ð¾Ñ— ÑƒÐ¼Ð¾Ð²Ð¸: Ð¼Ð¸Ð½ÑƒÐ»Ð¸Ð¹ Ð²Ð¸Ð±Ñ–Ñ€ â†’ Ñ‚ÐµÐ¿ÐµÑ€Ñ–ÑˆÐ½Ñ–Ð¹ Ñ€ÐµÐ·ÑƒÐ»ÑŒÑ‚Ð°Ñ‚!\n\n---\n\n## Ð”Ñ–Ð°Ð»Ð¾Ð³Ð¸\n\n### Ð”Ñ–Ð°Ð»Ð¾Ð³ 1: ÐÐ½Ð°Ð»Ñ–Ð· Ð¼Ð¸Ð½ÑƒÐ»Ð¸Ñ… Ñ€Ñ–ÑˆÐµÐ½ÑŒ\n\n**ÐÐ½Ð´Ñ€Ñ–Ð¹:** Ð—Ð½Ð°Ñ”Ñˆ, ÑÐºÐ±Ð¸ Ñ Ñ‚Ð¾Ð´Ñ– Ð²ÑÑ‚ÑƒÐ¿Ð¸Ð² Ð´Ð¾ Ñ–Ð½ÑˆÐ¾Ð³Ð¾ ÑƒÐ½Ñ–Ð²ÐµÑ€ÑÐ¸Ñ‚ÐµÑ‚Ñƒ, Ð·Ð°Ñ€Ð°Ð· Ð±Ð¸ Ð¼Ð°Ð² Ñ–Ð½ÑˆÑƒ Ð¿Ñ€Ð¾Ñ„ÐµÑÑ–ÑŽ.\n\n**ÐœÐ°Ñ€Ñ–Ñ:** ÐœÐ¾Ð¶Ð»Ð¸Ð²Ð¾. Ð ÑÐºÐ±Ð¸ Ñ‚Ð¸ Ð¼Ð°Ð² Ñ–Ð½ÑˆÑƒ Ð¿Ñ€Ð¾Ñ„ÐµÑÑ–ÑŽ, Ð±ÑƒÐ² Ð±Ð¸ Ñ‰Ð°ÑÐ»Ð¸Ð²Ñ–ÑˆÐ¸Ð¼?\n\n**ÐÐ½Ð´Ñ€Ñ–Ð¹:** Ð’Ð°Ð¶ÐºÐ¾ ÑÐºÐ°Ð·Ð°Ñ‚Ð¸. Ð¯ÐºÐ±Ð¸ Ñ Ð±ÑƒÐ² Ð°Ð´Ð²Ð¾ÐºÐ°Ñ‚Ð¾Ð¼, Ð·Ð°Ñ€Ð¾Ð±Ð»ÑÐ² Ð±Ð¸ Ð±Ñ–Ð»ÑŒÑˆÐµ, Ð°Ð»Ðµ Ð¿Ñ€Ð°Ñ†ÑŽÐ²Ð°Ð² Ð±Ð¸ Ð±Ñ–Ð»ÑŒÑˆÐµ.\n\n**ÐœÐ°Ñ€Ñ–Ñ:** Ð‘Ð°Ñ‡Ð¸Ñˆ? ÐÐµ Ð²ÑÐµ Ñ‚Ð°Ðº Ð¿Ñ€Ð¾ÑÑ‚Ð¾. Ð¯ÐºÐ±Ð¸ Ð¼Ð¸ Ð·Ð½Ð°Ð»Ð¸ Ð¼Ð°Ð¹Ð±ÑƒÑ‚Ð½Ñ”, Ð¿Ñ€Ð¸Ð¹Ð¼Ð°Ð»Ð¸ Ð± Ñ–Ð½ÑˆÑ– Ñ€Ñ–ÑˆÐµÐ½Ð½Ñ.\n\n**ÐÐ½Ð´Ñ€Ñ–Ð¹:** Ð¢Ð¸ Ð¼Ð°Ñ”Ñˆ Ñ€Ð°Ñ†Ñ–ÑŽ. Ð¯ÐºÐ±Ð¸ Ñ Ð±ÑƒÐ² Ð¼ÑƒÐ´Ñ€Ñ–ÑˆÐ¸Ð¼ Ñ‚Ð¾Ð´Ñ–, Ð·Ñ€Ð¾Ð±Ð¸Ð² Ð±Ð¸ Ñ‚Ð¾Ð¹ ÑÐ°Ð¼Ð¸Ð¹ Ð²Ð¸Ð±Ñ–Ñ€.\n\n**ÐœÐ°Ñ€Ñ–Ñ:** ÐžÑÑŒ Ñ– Ð²ÑÐµ. Ð¯ÐºÐ±Ð¸ Ð¼Ð¸ Ð¼Ð¾Ð³Ð»Ð¸ Ð²ÑÐµ Ð·Ð¼Ñ–Ð½Ð¸Ñ‚Ð¸, Ð½Ðµ Ð²Ñ‡Ð¸Ð»Ð¸ÑÑ Ð± Ð½Ð° Ð¿Ð¾Ð¼Ð¸Ð»ÐºÐ°Ñ…!\n\n---\n\n### Ð”Ñ–Ð°Ð»Ð¾Ð³ 2: Ð¡ÐºÐ»Ð°Ð´Ð½Ñ– Ð¿Ð»Ð°Ð½Ð¸\n\n**ÐžÐ»ÐµÐ½Ð°:** Ð¯ÐºÑ‰Ð¾ Ð·Ð°Ð²Ñ‚Ñ€Ð° Ð±ÑƒÐ´Ðµ Ð³Ð°Ñ€Ð½Ð° Ð¿Ð¾Ð³Ð¾Ð´Ð°, Ñ– ÑÐºÑ‰Ð¾ Ð²ÑÑ– Ð·Ð¼Ð¾Ð¶ÑƒÑ‚ÑŒ, Ð¿Ð¾Ñ—Ð´ÐµÐ¼Ð¾ Ð½Ð° Ð¿Ñ–ÐºÐ½Ñ–Ðº.\n\n**ÐœÐ¸Ñ…Ð°Ð¹Ð»Ð¾:** Ð ÑÐºÑ‰Ð¾ Ñ…Ñ‚Ð¾ÑÑŒ Ð½Ðµ Ð·Ð¼Ð¾Ð¶Ðµ, Ð°Ð±Ð¾ ÑÐºÑ‰Ð¾ Ð±ÑƒÐ´Ðµ Ð´Ð¾Ñ‰?\n\n**ÐžÐ»ÐµÐ½Ð°:** Ð£ Ñ‚Ð°ÐºÐ¾Ð¼Ñƒ Ñ€Ð°Ð·Ñ– Ð·Ð°Ð»Ð¸ÑˆÐ¸Ð¼Ð¾ÑÑ Ð²Ð´Ð¾Ð¼Ð° Ð¹ Ð¿Ñ€Ð¸Ð³Ð¾Ñ‚ÑƒÑ”Ð¼Ð¾ Ñ‰Ð¾ÑÑŒ ÑÐ¼Ð°Ñ‡Ð½Ðµ Ñ€Ð°Ð·Ð¾Ð¼.\n\n**ÐœÐ¸Ñ…Ð°Ð¹Ð»Ð¾:** Ð”Ð¾Ð±Ñ€Ðµ. Ð† ÑÐºÑ‰Ð¾ Ð¿Ñ€Ð¸Ð³Ð¾Ñ‚ÑƒÑ”Ð¼Ð¾, Ñ– ÑÐºÑ‰Ð¾ Ð·Ð°Ð»Ð¸ÑˆÐ¸Ñ‚ÑŒÑÑ Ñ‡Ð°Ñ, Ð¿Ð¾Ð´Ð¸Ð²Ð¸Ð¼Ð¾ÑÑ Ñ„Ñ–Ð»ÑŒÐ¼.\n\n**ÐžÐ»ÐµÐ½Ð°:** Ð‘Ð°Ñ‡Ð¸Ñˆ, Ñƒ Ð½Ð°Ñ Ð¿Ð»Ð°Ð½ Ð½Ð° Ð±ÑƒÐ´ÑŒ-ÑÐºÐ¸Ð¹ Ð²Ð¸Ð¿Ð°Ð´Ð¾Ðº! Ð¦Ðµ Ð½Ð°Ð·Ð¸Ð²Ð°Ñ”Ñ‚ÑŒÑÑ Ð³Ð½ÑƒÑ‡ÐºÑ–ÑÑ‚ÑŒ.\n\n**ÐœÐ¸Ñ…Ð°Ð¹Ð»Ð¾:** Ð¯ÐºÐ±Ð¸ Ð²ÑÑ– Ñ‚Ð°Ðº Ð¿Ð»Ð°Ð½ÑƒÐ²Ð°Ð»Ð¸, Ð¿Ñ€Ð¾Ð±Ð»ÐµÐ¼ Ð±ÑƒÐ»Ð¾ Ð± Ð¼ÐµÐ½ÑˆÐµ Ð² Ð¶Ð¸Ñ‚Ñ‚Ñ–.\n\n---\n\n### Ð”Ñ–Ð°Ð»Ð¾Ð³ 3: Ð¤Ñ–Ð»Ð¾ÑÐ¾Ñ„ÑÑŒÐºÐ° Ñ€Ð¾Ð·Ð¼Ð¾Ð²Ð°\n\n**Ð’Ñ‡Ð¸Ñ‚ÐµÐ»ÑŒ:** Ð”Ð°Ð²Ð°Ð¹Ñ‚Ðµ Ð¾Ð±Ð³Ð¾Ð²Ð¾Ñ€Ð¸Ð¼Ð¾: ÑÐºÐ±Ð¸ Ð»ÑŽÐ´Ð¸ Ð½Ðµ Ð²Ð¸Ð½Ð°Ð¹ÑˆÐ»Ð¸ Ñ–Ð½Ñ‚ÐµÑ€Ð½ÐµÑ‚, ÑÐº Ð±Ð¸ Ð²Ð¸Ð³Ð»ÑÐ´Ð°Ð² ÑÐ²Ñ–Ñ‚?\n\n**Ð£Ñ‡ÐµÐ½ÑŒ 1:** Ð¯ÐºÐ±Ð¸ Ð½Ðµ Ð±ÑƒÐ»Ð¾ Ñ–Ð½Ñ‚ÐµÑ€Ð½ÐµÑ‚Ñƒ, Ð¼Ð¸ Ð± ÑÐ¿Ñ–Ð»ÐºÑƒÐ²Ð°Ð»Ð¸ÑÑ Ð»Ð¸ÑÑ‚Ð°Ð¼Ð¸, ÑÐº Ñ€Ð°Ð½Ñ–ÑˆÐµ.\n\n**Ð£Ñ‡ÐµÐ½ÑŒ 2:** Ð† ÑÐºÐ±Ð¸ Ð½Ðµ Ð±ÑƒÐ»Ð¾ ÑÐ¾Ñ†Ð¼ÐµÑ€ÐµÐ¶, Ð»ÑŽÐ´Ð¸ Ð± Ð¿Ñ€Ð¾Ð²Ð¾Ð´Ð¸Ð»Ð¸ Ð±Ñ–Ð»ÑŒÑˆÐµ Ñ‡Ð°ÑÑƒ Ñ€Ð°Ð·Ð¾Ð¼ Ð¾ÑÐ¾Ð±Ð¸ÑÑ‚Ð¾.\n\n**Ð’Ñ‡Ð¸Ñ‚ÐµÐ»ÑŒ:** Ð¦Ñ–ÐºÐ°Ð²Ð¾. Ð ÑÐºÐ±Ð¸ Ð²Ð¸ Ð¶Ð¸Ð»Ð¸ Ð² Ñ‚Ñ– Ñ‡Ð°ÑÐ¸, Ñ‡Ð¾Ð³Ð¾ Ð± Ð²Ð°Ð¼ Ð±Ñ€Ð°ÐºÑƒÐ²Ð°Ð»Ð¾?\n\n**Ð£Ñ‡ÐµÐ½ÑŒ 1:** Ð¯ÐºÐ±Ð¸ Ñ Ð¶Ð¸Ð² Ñ‚Ð¾Ð´Ñ–, Ð½Ðµ Ð¼Ð°Ð² Ð±Ð¸ ÑˆÐ²Ð¸Ð´ÐºÐ¾Ð³Ð¾ Ð´Ð¾ÑÑ‚ÑƒÐ¿Ñƒ Ð´Ð¾ Ñ–Ð½Ñ„Ð¾Ñ€Ð¼Ð°Ñ†Ñ–Ñ—.\n\n**Ð’Ñ‡Ð¸Ñ‚ÐµÐ»ÑŒ:** Ð‘Ð°Ñ‡Ð¸Ñ‚Ðµ, ÑÐº Ð¾Ð´Ð½Ð° ÑƒÐ¼Ð¾Ð²Ð° Ð²ÐµÐ´Ðµ Ð´Ð¾ Ñ–Ð½ÑˆÐ¾Ñ—? Ð¦Ðµ Ð»Ð°Ð½Ñ†ÑŽÐ³ Ð½Ð°ÑÐ»Ñ–Ð´ÐºÑ–Ð².\n\n---\n\n### Ð”Ñ–Ð°Ð»Ð¾Ð³ 4: ÐšÐ°Ñ€'Ñ”Ñ€Ð½Ñ– Ñ€Ð¾Ð·Ð´ÑƒÐ¼Ð¸\n\n**ÐšÐµÑ€Ñ–Ð²Ð½Ð¸Ðº:** Ð¯ÐºÐ±Ð¸ Ð²Ð¸ Ð²Ð¸Ð²Ñ‡Ð¸Ð»Ð¸ Python Ñ‚Ð¾Ð´Ñ–, Ð·Ð°Ñ€Ð°Ð· Ð±Ð¸ Ð¼Ð°Ð»Ð¸ Ð²Ð¸Ñ‰Ñƒ Ð·Ð°Ñ€Ð¿Ð»Ð°Ñ‚Ñƒ.\n\n**ÐŸÑ€Ð°Ñ†Ñ–Ð²Ð½Ð¸Ðº:** Ð—Ð½Ð°ÑŽ. Ð¯ÐºÐ±Ð¸ Ñ Ð±ÑƒÐ² Ð±Ñ–Ð»ÑŒÑˆ Ð´Ð°Ð»ÐµÐºÐ¾Ð³Ð»ÑÐ´Ð½Ð¸Ð¼, Ð¿Ð¾Ñ‡Ð°Ð² Ð±Ð¸ Ñ€Ð°Ð½Ñ–ÑˆÐµ.\n\n**ÐšÐµÑ€Ñ–Ð²Ð½Ð¸Ðº:** ÐÐµ Ð¿Ñ–Ð·Ð½Ð¾. Ð¯ÐºÑ‰Ð¾ Ð¿Ð¾Ñ‡Ð½ÐµÑ‚Ðµ Ð·Ð°Ñ€Ð°Ð·, Ñ– ÑÐºÑ‰Ð¾ Ð±ÑƒÐ´ÐµÑ‚Ðµ ÑÑ‚Ð°Ñ€Ð°Ð½Ð½Ñ–, Ð·Ð° Ñ€Ñ–Ðº Ð¿Ð¾ÐºÑ€Ð°Ñ‰Ð¸Ñ‚Ðµ Ð½Ð°Ð²Ð¸Ñ‡ÐºÐ¸.\n\n**ÐŸÑ€Ð°Ñ†Ñ–Ð²Ð½Ð¸Ðº:** Ð ÑÐºÑ‰Ð¾ Ð²Ð¸Ð²Ñ‡Ñƒ, Ñ– ÑÐºÑ‰Ð¾ Ð¿Ð¾ÐºÑ€Ð°Ñ‰Ñƒ, Ñ‡Ð¸ Ð¼Ð¾Ð¶Ð½Ð° Ñ€Ð¾Ð·Ñ€Ð°Ñ…Ð¾Ð²ÑƒÐ²Ð°Ñ‚Ð¸ Ð½Ð° Ð¿Ñ–Ð´Ð²Ð¸Ñ‰ÐµÐ½Ð½Ñ?\n\n**ÐšÐµÑ€Ñ–Ð²Ð½Ð¸Ðº:** Ð¯ÐºÑ‰Ð¾ Ð¿Ñ€Ð¾Ð´ÐµÐ¼Ð¾Ð½ÑÑ‚Ñ€ÑƒÑ”Ñ‚Ðµ Ð¿Ñ€Ð¾Ð³Ñ€ÐµÑ, Ñ– ÑÐºÑ‰Ð¾ Ð±ÑŽÐ´Ð¶ÐµÑ‚ Ð´Ð¾Ð·Ð²Ð¾Ð»Ð¸Ñ‚ÑŒ, Ð¾Ð±Ð¾Ð²'ÑÐ·ÐºÐ¾Ð²Ð¾.\n\n**ÐŸÑ€Ð°Ñ†Ñ–Ð²Ð½Ð¸Ðº:** Ð¢Ð¾Ð´Ñ– Ð¿Ð¾Ñ‡Ð¸Ð½Ð°ÑŽ ÑÑŒÐ¾Ð³Ð¾Ð´Ð½Ñ–! Ð¯ÐºÐ±Ð¸ Ð·Ð½Ð°Ð² Ñ€Ð°Ð½Ñ–ÑˆÐµ, Ð¿Ð¾Ñ‡Ð°Ð² Ð±Ð¸ Ð´Ð°Ð²Ð½Ð¾.\n\n---\n\n### Ð”Ñ–Ð°Ð»Ð¾Ð³ 5: Ð¡Ñ–Ð¼ÐµÐ¹Ð½Ñ– ÑÐ¿Ð¾Ð³Ð°Ð´Ð¸\n\n**Ð‘Ð°Ð±ÑƒÑÑ:** Ð¯ÐºÐ±Ð¸ Ð¼Ð¸ Ñ‚Ð¾Ð´Ñ– Ð½Ðµ Ð¿ÐµÑ€ÐµÑ—Ñ…Ð°Ð»Ð¸ Ð´Ð¾ Ð¼Ñ–ÑÑ‚Ð°, Ð²Ð¸ Ð± Ð²Ð¸Ñ€Ð¾ÑÐ»Ð¸ Ð² ÑÐµÐ»Ñ– Ð±Ñ–Ð»Ñ Ð¿Ñ€Ð¸Ñ€Ð¾Ð´Ð¸.\n\n**ÐžÐ½ÑƒÐº:** Ð ÑÐºÐ±Ð¸ Ð²Ð¸ Ð·Ð°Ð»Ð¸ÑˆÐ¸Ð»Ð¸ÑÑ Ð² ÑÐµÐ»Ñ–, ÑÐºÐ¸Ð¼ Ð±Ð¸ Ð±ÑƒÐ»Ð¾ Ð²Ð°ÑˆÐµ Ð¶Ð¸Ñ‚Ñ‚Ñ?\n\n**Ð‘Ð°Ð±ÑƒÑÑ:** Ð¯ÐºÐ±Ð¸ Ð·Ð°Ð»Ð¸ÑˆÐ¸Ð»Ð¸ÑÑ, Ñ Ð± Ð½Ðµ Ð·ÑƒÑÑ‚Ñ€Ñ–Ð»Ð° Ð²Ð°ÑˆÐ¾Ð³Ð¾ Ð´Ñ–Ð´ÑƒÑÑ Ð² Ð¼Ñ–ÑÑ‚Ñ–.\n\n**ÐžÐ½ÑƒÐº:** Ð—Ð½Ð°Ñ‡Ð¸Ñ‚ÑŒ, ÑÐºÐ±Ð¸ Ð²Ð¸ Ð½Ðµ Ð¿ÐµÑ€ÐµÑ—Ñ…Ð°Ð»Ð¸, Ð¼ÐµÐ½Ðµ Ð± Ð½Ðµ Ñ–ÑÐ½ÑƒÐ²Ð°Ð»Ð¾ Ð²Ð·Ð°Ð³Ð°Ð»Ñ–!\n\n**Ð‘Ð°Ð±ÑƒÑÑ:** Ð¡Ð°Ð¼Ðµ Ñ‚Ð°Ðº! Ð¯ÐºÐ±Ð¸ Ð¾Ð´Ð½Ð° Ð¼Ð°Ð»ÐµÐ½ÑŒÐºÐ° Ñ€Ñ–Ñ‡ Ð·Ð¼Ñ–Ð½Ð¸Ð»Ð°ÑÑ, Ð²ÑÐµ Ð±ÑƒÐ»Ð¾ Ð± Ñ–Ð½Ð°ÐºÑˆÐµ.\n\n**ÐžÐ½ÑƒÐº:** Ð–Ð¸Ñ‚Ñ‚Ñ â€” ÑÐº Ð»Ð°Ð½Ñ†ÑŽÐ¶Ð¾Ðº ÑƒÐ¼Ð¾Ð², Ð´Ðµ ÐºÐ¾Ð¶Ð½Ð° Ð»Ð°Ð½ÐºÐ° Ð²Ð°Ð¶Ð»Ð¸Ð²Ð°!\n\n> ðŸŒ **Ð ÐµÐ°Ð»ÑŒÐ½Ð¸Ð¹ ÑÐ²Ñ–Ñ‚**\n> Ð£ Ð±Ñ–Ð·Ð½ÐµÑÑ– Ñ‡Ð°ÑÑ‚Ð¾ Ð°Ð½Ð°Ð»Ñ–Ð·ÑƒÑŽÑ‚ÑŒ Ð°Ð»ÑŒÑ‚ÐµÑ€Ð½Ð°Ñ‚Ð¸Ð²Ð½Ñ– ÑÑ†ÐµÐ½Ð°Ñ€Ñ–Ñ—: Â«Ð¯ÐºÐ±Ð¸ Ð¼Ð¸ Ñ–Ð½Ð²ÐµÑÑ‚ÑƒÐ²Ð°Ð»Ð¸ Ñ‚Ð¾Ð´Ñ–, Ð·Ð°Ñ€Ð°Ð· Ð±Ð¸ Ð¼Ð°Ð»Ð¸ Ð¿Ñ€Ð¸Ð±ÑƒÑ‚Ð¾Ðº. ÐÐ»Ðµ ÑÐºÑ‰Ð¾ Ñ–Ð½Ð²ÐµÑÑ‚ÑƒÑ”Ð¼Ð¾ Ð·Ð°Ñ€Ð°Ð·, Ñ– ÑÐºÑ‰Ð¾ Ñ€Ð¸Ð½Ð¾Ðº ÑÑ‚Ð°Ð±Ñ–Ð»Ñ–Ð·ÑƒÑ”Ñ‚ÑŒÑÑ, Ñ‰Ðµ Ð¼Ð¾Ð¶ÐµÐ¼Ð¾ Ð²Ð¸Ð³Ñ€Ð°Ñ‚Ð¸Â». Ð¦Ðµ Ð¿Ð¾Ñ”Ð´Ð½Ð°Ð½Ð½Ñ Ð·Ð¼Ñ–ÑˆÐ°Ð½Ð¸Ñ… Ñ– Ð»Ð°Ð½Ñ†ÑŽÐ³Ð¾Ð²Ð¸Ñ… ÑƒÐ¼Ð¾Ð² Ñƒ Ð¿Ñ€Ð°ÐºÑ‚Ð¸Ñ‡Ð½Ð¾Ð¼Ñƒ ÐºÐ¾Ð½Ñ‚ÐµÐºÑÑ‚Ñ–!\n\n---\n\n# ÐŸÑ–Ð´ÑÑƒÐ¼Ð¾Ðº\n\n**Ð©Ð¾ Ð²Ð¸ Ð½Ð°Ð²Ñ‡Ð¸Ð»Ð¸ÑÑ Ð² Ñ†ÑŒÐ¾Ð¼Ñƒ Ð¼Ð¾Ð´ÑƒÐ»Ñ–:**\n\n1. **Ð—Ð¼Ñ–ÑˆÐ°Ð½Ð° ÑƒÐ¼Ð¾Ð²Ð° (Ð¼Ð¸Ð½ÑƒÐ»Ðµ â†’ Ñ‚ÐµÐ¿ÐµÑ€Ñ–ÑˆÐ½Ñ”):** Ð¯ÐºÐ±Ð¸ Ñ Ð²Ð¸Ð²Ñ‡Ð¸Ð² Ñ‚Ð¾Ð´Ñ–, Ð·Ð°Ñ€Ð°Ð· Ð±Ð¸ Ð·Ð½Ð°Ð².\n2. **Ð—Ð¼Ñ–ÑˆÐ°Ð½Ð° ÑƒÐ¼Ð¾Ð²Ð° (Ñ‚ÐµÐ¿ÐµÑ€Ñ–ÑˆÐ½Ñ” â†’ Ð¼Ð¸Ð½ÑƒÐ»Ðµ):** Ð¯ÐºÐ±Ð¸ Ñ Ð±ÑƒÐ² ÑÐ¼Ñ–Ð»Ð¸Ð²Ñ–ÑˆÐ¸Ð¼, ÑÐºÐ°Ð·Ð°Ð² Ð±Ð¸ Ñ‚Ð¾Ð´Ñ–.\n3. **Ð›Ð°Ð½Ñ†ÑŽÐ³Ð¾Ð²Ñ– ÑƒÐ¼Ð¾Ð²Ð¸:** Ð¯ÐºÑ‰Ð¾ A, Ñ– ÑÐºÑ‰Ð¾ B, Ñ‚Ð¾ C.\n4. **ÐÐ°ÑÐ»Ñ–Ð´ÐºÐ¾Ð²Ñ– Ð»Ð°Ð½Ñ†ÑŽÐ³Ð¸:** Ð¯ÐºÑ‰Ð¾ A â†’ B â†’ C.\n\n**ÐžÑÐ½Ð¾Ð²Ð½Ðµ Ð¿Ñ€Ð°Ð²Ð¸Ð»Ð¾:**\n\n> Ð£ Ð·Ð¼Ñ–ÑˆÐ°Ð½Ð¸Ñ… ÑƒÐ¼Ð¾Ð²Ð°Ñ… Ñ‡Ð°Ñ ÑƒÐ¼Ð¾Ð²Ð¸ â‰  Ñ‡Ð°Ñ Ð½Ð°ÑÐ»Ñ–Ð´ÐºÑƒ. Ð’Ð¸ÐºÐ¾Ñ€Ð¸ÑÑ‚Ð¾Ð²ÑƒÐ¹Ñ‚Ðµ Ñ‡Ð°ÑÐ¾Ð²Ñ– Ð¼Ð°Ñ€ÐºÐµÑ€Ð¸ (Ñ‚Ð¾Ð´Ñ–, Ð·Ð°Ñ€Ð°Ð·) Ð´Ð»Ñ ÑÑÐ½Ð¾ÑÑ‚Ñ–.\n\n**Ð”Ð°Ð»Ñ–:**\n\nÐ£ Ð¼Ð¾Ð´ÑƒÐ»Ñ– 34 Ð²Ð¸ ÑÐºÐ»Ð°Ð´ÐµÑ‚Ðµ **ÐºÐ¾Ð½Ñ‚Ñ€Ð¾Ð»ÑŒÐ½Ñƒ Ñ‚Ð¾Ñ‡ÐºÑƒ** Ð· ÑƒÑÑ–Ñ… ÑÐºÐ»Ð°Ð´Ð½Ð¸Ñ… Ñ€ÐµÑ‡ÐµÐ½ÑŒ: Ð²Ñ–Ð´Ð½Ð¾ÑÐ½Ð¸Ñ… (ÑÐºÐ¸Ð¹, Ð´Ðµ, ÐºÐ¾Ð»Ð¸), Ð¼ÐµÑ‚Ð¸ (Ñ‰Ð¾Ð±), Ñ‚Ð° ÑƒÐ¼Ð¾Ð²Ð½Ð¸Ñ… (ÑÐºÑ‰Ð¾, ÑÐºÐ±Ð¸, Ð·Ð¼Ñ–ÑˆÐ°Ð½Ð¸Ñ…). Ð¦Ðµ Ð¿Ñ–Ð´Ð³Ð¾Ñ‚ÑƒÑ” Ð²Ð°Ñ Ð´Ð¾ Ñ„Ð°Ð·Ð¸ B1.3b â€” Ð´Ð¾Ð¿ÑƒÑÑ‚Ð¾Ð²Ñ–, Ð¿Ñ€Ð¸Ñ‡Ð¸Ð½Ð¾Ð²Ñ– Ñ‚Ð° Ñ‡Ð°ÑÐ¾Ð²Ñ– Ñ€ÐµÑ‡ÐµÐ½Ð½Ñ.\n\n> âœ… **Ð¡Ð°Ð¼Ð¾Ð¿ÐµÑ€ÐµÐ²Ñ–Ñ€ÐºÐ°**\n>\n> Ð§Ð¸ Ð¼Ð¾Ð¶ÐµÑ‚Ðµ Ð²Ð¸:\n> - [ ] Ð¡Ñ„Ð¾Ñ€Ð¼ÑƒÐ»ÑŽÐ²Ð°Ñ‚Ð¸ Ð·Ð¼Ñ–ÑˆÐ°Ð½Ñƒ ÑƒÐ¼Ð¾Ð²Ñƒ Â«Ð¼Ð¸Ð½ÑƒÐ»Ðµ â†’ Ñ‚ÐµÐ¿ÐµÑ€Ñ–ÑˆÐ½Ñ”Â»?\n> - [ ] Ð¡Ñ„Ð¾Ñ€Ð¼ÑƒÐ»ÑŽÐ²Ð°Ñ‚Ð¸ Ð·Ð¼Ñ–ÑˆÐ°Ð½Ñƒ ÑƒÐ¼Ð¾Ð²Ñƒ Â«Ñ‚ÐµÐ¿ÐµÑ€Ñ–ÑˆÐ½Ñ” â†’ Ð¼Ð¸Ð½ÑƒÐ»ÐµÂ»?\n> - [ ] ÐŸÐ¾Ð±ÑƒÐ´ÑƒÐ²Ð°Ñ‚Ð¸ Ð»Ð°Ð½Ñ†ÑŽÐ³Ð¾Ð²Ñƒ ÑƒÐ¼Ð¾Ð²Ñƒ Ð· ÐºÑ–Ð»ÑŒÐºÐ¾Ð¼Ð° Â«ÑÐºÑ‰Ð¾Â»?\n> - [ ] ÐŸÑ€Ð°Ð²Ð¸Ð»ÑŒÐ½Ð¾ Ð²Ð¸ÐºÐ¾Ñ€Ð¸ÑÑ‚Ð°Ñ‚Ð¸ Ñ‡Ð°ÑÐ¾Ð²Ñ– Ð¼Ð°Ñ€ÐºÐµÑ€Ð¸ (Ñ‚Ð¾Ð´Ñ–, Ð·Ð°Ñ€Ð°Ð·)?\n>\n> Ð¯ÐºÑ‰Ð¾ Ñ‚Ð°Ðº â€” Ð²Ð¸ Ð³Ð¾Ñ‚Ð¾Ð²Ñ– Ð´Ð¾ ÐºÐ¾Ð½Ñ‚Ñ€Ð¾Ð»ÑŒÐ½Ð¾Ñ— Ñ‚Ð¾Ñ‡ÐºÐ¸!\n\n---\n\n> [!resources] ðŸŽ§ Ð—Ð¾Ð²Ð½Ñ–ÑˆÐ½Ñ– Ñ€ÐµÑÑƒÑ€ÑÐ¸\n>\n> **Ð”Ð¾Ð´Ð°Ñ‚ÐºÐ¾Ð²Ñ– Ð¼Ð°Ñ‚ÐµÑ€Ñ–Ð°Ð»Ð¸ Ð´Ð»Ñ Ð²Ð¸Ð²Ñ‡ÐµÐ½Ð½Ñ:**\n> - ðŸ“– [Ð£Ð¼Ð¾Ð²Ð½Ñ– Ñ€ÐµÑ‡ÐµÐ½Ð½Ñ](https://uk.wikipedia.org/wiki/Ð¡ÐºÐ»Ð°Ð´Ð½Ð¾Ð¿Ñ–Ð´Ñ€ÑÐ´Ð½Ðµ_Ñ€ÐµÑ‡ÐµÐ½Ð½Ñ) â€” Ð’Ñ–ÐºÑ–Ð¿ÐµÐ´Ñ–Ñ\n> - ðŸ“º [Ukrainian Grammar](https://www.youtube.com/@ukrainianlesson) â€” Ð²Ñ–Ð´ÐµÐ¾ÑƒÑ€Ð¾ÐºÐ¸\n> - ðŸŽ§ [Ukrainian Lessons Podcast](https://ukrainianlessons.com/) â€” Ð¿Ð¾Ð´ÐºÐ°ÑÑ‚ Ð´Ð»Ñ Ð²Ð¸Ð²Ñ‡ÐµÐ½Ð½Ñ\n\n---\n\n# Ð’Ð¿Ñ€Ð°Ð²Ð¸\n\n## quiz: Ð’Ð¸Ð±ÐµÑ€Ñ–Ñ‚ÑŒ Ð¿Ñ€Ð°Ð²Ð¸Ð»ÑŒÐ½Ñƒ Ð²Ñ–Ð´Ð¿Ð¾Ð²Ñ–Ð´ÑŒ\n\n1. Ð¯ÐºÐµ Ñ€ÐµÑ‡ÐµÐ½Ð½Ñ Ñ” Ð¿Ñ€Ð¸ÐºÐ»Ð°Ð´Ð¾Ð¼ Ð·Ð¼Ñ–ÑˆÐ°Ð½Ð¾Ñ— ÑƒÐ¼Ð¾Ð²Ð¸, Ð´Ðµ Ð¼Ð¸Ð½ÑƒÐ»Ð° Ð¿Ð¾Ð´Ñ–Ñ Ð²Ð¿Ð»Ð¸Ð²Ð°Ñ” Ð½Ð° Ñ‚ÐµÐ¿ÐµÑ€Ñ–ÑˆÐ½ÑŽ ÑÐ¸Ñ‚ÑƒÐ°Ñ†Ñ–ÑŽ?\n   - [x] Ð¯ÐºÐ±Ð¸ Ñ Ð²Ð¸Ð²Ñ‡Ð¸Ð² Ñ‚Ð¾Ð´Ñ–, Ð·Ð°Ñ€Ð°Ð· Ð±Ð¸ Ð·Ð½Ð°Ð² Ð²Ñ–Ð´Ð¿Ð¾Ð²Ñ–Ð´ÑŒ.\n   - [ ] Ð¯ÐºÐ±Ð¸ Ñ Ð¼Ð°Ð² Ñ‡Ð°Ñ, Ð´Ð¾Ð¿Ð¾Ð¼Ñ–Ð³ Ð±Ð¸ Ñ‚Ð¾Ð±Ñ–.\n   - [ ] Ð¯ÐºÑ‰Ð¾ Ð¼Ð°Ñ‚Ð¸Ð¼ÐµÑˆ Ñ‡Ð°Ñ, Ð·Ð°Ñ‚ÐµÐ»ÐµÑ„Ð¾Ð½ÑƒÐ¹ Ð¼ÐµÐ½Ñ–.\n   - [ ] Ð¯ÐºÐ±Ð¸ Ð²Ñ–Ð½ Ð¿Ñ€Ð¸Ð¹ÑˆÐ¾Ð², Ð¼Ð¸ Ð± Ð¿Ð¾Ð³Ð¾Ð²Ð¾Ñ€Ð¸Ð»Ð¸.\n   > ÐœÐ¸Ð½ÑƒÐ»Ð¸Ð¹ Ñ‡Ð°Ñ ÑƒÐ¼Ð¾Ð²Ð¸ â†’ Ñ‚ÐµÐ¿ÐµÑ€Ñ–ÑˆÐ½Ñ–Ð¹ Ñ‡Ð°Ñ Ð½Ð°ÑÐ»Ñ–Ð´ÐºÑƒ = Ð·Ð¼Ñ–ÑˆÐ°Ð½Ð° ÑƒÐ¼Ð¾Ð²Ð°.\n\n2. Ð¯ÐºÐµ Ñ€ÐµÑ‡ÐµÐ½Ð½Ñ Ñ” Ð¿Ñ€Ð¸ÐºÐ»Ð°Ð´Ð¾Ð¼ Ð·Ð¼Ñ–ÑˆÐ°Ð½Ð¾Ñ— ÑƒÐ¼Ð¾Ð²Ð¸, Ð´Ðµ Ñ‚ÐµÐ¿ÐµÑ€Ñ–ÑˆÐ½Ñ Ñ€Ð¸ÑÐ° Ð¿Ð¾ÑÑÐ½ÑŽÑ” Ð¼Ð¸Ð½ÑƒÐ»Ñƒ Ð¿Ð¾Ð´Ñ–ÑŽ?\n   - [ ] Ð¯ÐºÐ±Ð¸ Ñ Ð²Ð¸Ð²Ñ‡Ð¸Ð², Ð·Ð½Ð°Ð² Ð±Ð¸ Ð·Ð°Ñ€Ð°Ð·.\n   - [x] Ð¯ÐºÐ±Ð¸ Ñ Ð±ÑƒÐ² ÑÐ¼Ñ–Ð»Ð¸Ð²Ñ–ÑˆÐ¸Ð¼, ÑÐºÐ°Ð·Ð°Ð² Ð±Ð¸ Ñ—Ð¹ Ð¿Ñ€Ð°Ð²Ð´Ñƒ Ñ‚Ð¾Ð´Ñ–.\n   - [ ] Ð¯ÐºÑ‰Ð¾ Ñ…Ð¾Ñ‡ÐµÑˆ, Ð´Ð¾Ð¿Ð¾Ð¼Ð¾Ð¶Ñƒ Ñ‚Ð¾Ð±Ñ–.\n   - [ ] Ð¯ÐºÐ±Ð¸ Ð²Ñ–Ð½ Ð¿Ñ€Ð¸Ð¹ÑˆÐ¾Ð², Ð¿Ð¾Ð³Ð¾Ð²Ð¾Ñ€Ð¸Ð»Ð¸ Ð±.\n   > Ð¢ÐµÐ¿ÐµÑ€Ñ–ÑˆÐ½Ñ Ñ€Ð¸ÑÐ° â†’ Ð¼Ð¸Ð½ÑƒÐ»Ð° Ð´Ñ–Ñ = Ð·Ð¼Ñ–ÑˆÐ°Ð½Ð° ÑƒÐ¼Ð¾Ð²Ð° Ñ‚Ð¸Ð¿Ñƒ 2.\n\n3. Ð¯ÐºÐµ Ð· Ð½Ð°Ð²ÐµÐ´ÐµÐ½Ð¸Ñ… Ñ€ÐµÑ‡ÐµÐ½ÑŒ Ñ” Ð¿Ñ€Ð°Ð²Ð¸Ð»ÑŒÐ½Ð¾ÑŽ Ð»Ð°Ð½Ñ†ÑŽÐ³Ð¾Ð²Ð¾ÑŽ ÑƒÐ¼Ð¾Ð²Ð¾ÑŽ Ð· ÐºÑ–Ð»ÑŒÐºÐ¾Ð¼Ð° Ð¿Ñ–Ð´Ñ€ÑÐ´Ð½Ð¸Ð¼Ð¸ Ñ€ÐµÑ‡ÐµÐ½Ð½ÑÐ¼Ð¸ Ð² ÑƒÐºÑ€Ð°Ñ—Ð½ÑÑŒÐºÑ–Ð¹ Ð¼Ð¾Ð²Ñ–?\n   - [x] Ð¯ÐºÑ‰Ð¾ Ð¿Ñ€Ð¸Ð¹Ð´Ðµ, Ñ– ÑÐºÑ‰Ð¾ Ð¼Ð°Ñ‚Ð¸Ð¼Ðµ Ñ‡Ð°Ñ, Ð¿Ð¾Ð³Ð¾Ð²Ð¾Ñ€Ð¸Ð¼Ð¾ Ð· Ð½Ð¸Ð¼.\n   - [ ] Ð¯ÐºÑ‰Ð¾ Ð¿Ñ€Ð¸Ð¹Ð´Ðµ, Ñ– ÑÐºÐ±Ð¸ Ð¼Ð°Ð² Ñ‡Ð°Ñ, Ð¿Ð¾Ð³Ð¾Ð²Ð¾Ñ€Ð¸Ð¼Ð¾.\n   - [ ] Ð¯ÐºÐ±Ð¸ Ð¿Ñ€Ð¸Ð¹ÑˆÐ¾Ð², Ñ– ÑÐºÑ‰Ð¾ Ð¼Ð°Ñ‚Ð¸Ð¼Ðµ Ñ‡Ð°Ñ, Ð¿Ð¾Ð³Ð¾Ð²Ð¾Ñ€Ð¸Ð¼Ð¾.\n   - [ ] Ð¯ÐºÑ‰Ð¾ Ð¹ ÑÐºÑ‰Ð¾ Ð¿Ñ€Ð¸Ð¹Ð´Ðµ Ð¼Ð°Ñ‚Ð¸Ð¼Ðµ Ñ‡Ð°Ñ, Ð¿Ð¾Ð³Ð¾Ð²Ð¾Ñ€Ð¸Ð¼Ð¾.\n   > Ð’ Ð»Ð°Ð½Ñ†ÑŽÐ³Ñƒ Ð²ÑÑ– ÑƒÐ¼Ð¾Ð²Ð¸ Ð¼Ð°ÑŽÑ‚ÑŒ Ð±ÑƒÑ‚Ð¸ Ð°Ð±Ð¾ Ñ€ÐµÐ°Ð»ÑŒÐ½Ð¸Ð¼Ð¸, Ð°Ð±Ð¾ Ð½ÐµÑ€ÐµÐ°Ð»ÑŒÐ½Ð¸Ð¼Ð¸.\n\n4. Ð¯Ðº Ð¿Ñ€Ð°Ð²Ð¸Ð»ÑŒÐ½Ð¾ Ð²Ð¸Ñ€Ð°Ð·Ð¸Ñ‚Ð¸ Ð´ÑƒÐ¼ÐºÑƒ Â«If I had studied then, I would know nowÂ»?\n   - [ ] Ð¯ÐºÑ‰Ð¾ Ð²Ð¸Ð²Ñ‡Ñƒ, Ð·Ð½Ð°Ñ‚Ð¸Ð¼Ñƒ Ð·Ð°Ñ€Ð°Ð·.\n   - [x] Ð¯ÐºÐ±Ð¸ Ñ Ð²Ð¸Ð²Ñ‡Ð¸Ð² Ñ‚Ð¾Ð´Ñ–, Ð·Ð°Ñ€Ð°Ð· Ð±Ð¸ Ð·Ð½Ð°Ð².\n   - [ ] Ð¯ÐºÐ±Ð¸ Ñ Ð²Ð¸Ð²Ñ‡Ñƒ, Ð·Ð½Ð°Ð² Ð±Ð¸ Ð·Ð°Ñ€Ð°Ð·.\n   - [ ] Ð¯ÐºÑ‰Ð¾ Ð²Ð¸Ð²Ñ‡Ð¸Ð², Ð·Ð½Ð°ÑŽ Ð·Ð°Ñ€Ð°Ð·.\n   > Ð—Ð¼Ñ–ÑˆÐ°Ð½Ð° ÑƒÐ¼Ð¾Ð²Ð°: Ð¼Ð¸Ð½ÑƒÐ»Ðµ â†’ Ñ‚ÐµÐ¿ÐµÑ€Ñ–ÑˆÐ½Ñ”.\n\n5. Ð¯ÐºÐ° ÑÐ°Ð¼Ðµ ÐºÐ¾Ð½ÑÑ‚Ñ€ÑƒÐºÑ†Ñ–Ñ Ð²Ð¸ÐºÐ¾Ñ€Ð¸ÑÑ‚Ð¾Ð²ÑƒÑ”Ñ‚ÑŒÑÑ Ð´Ð»Ñ Ð²Ð¸Ñ€Ð°Ð¶ÐµÐ½Ð½Ñ Ð°Ð»ÑŒÑ‚ÐµÑ€Ð½Ð°Ñ‚Ð¸Ð²Ð½Ð¾Ð³Ð¾ Ð½Ð°ÑÐ»Ñ–Ð´ÐºÑƒ Ð² ÑƒÐºÑ€Ð°Ñ—Ð½ÑÑŒÐºÐ¾Ð¼Ñƒ ÑƒÐ¼Ð¾Ð²Ð½Ð¾Ð¼Ñƒ Ñ€ÐµÑ‡ÐµÐ½Ð½Ñ–?\n   - [ ] Ñ‚Ð¾Ð¼Ñƒ Ñ‰Ð¾\n   - [ ] Ñ…Ð¾Ñ‡Ð°\n   - [x] Ñ–Ð½Ð°ÐºÑˆÐµ\n   - [ ] Ñ‚Ð¾Ð±Ñ‚Ð¾\n   > Â«Ð†Ð½Ð°ÐºÑˆÐµÂ» = otherwise, Ð°Ð»ÑŒÑ‚ÐµÑ€Ð½Ð°Ñ‚Ð¸Ð²Ð½Ð¸Ð¹ Ð½Ð°ÑÐ»Ñ–Ð´Ð¾Ðº.\n\n6. Ð§Ð¾Ð¼Ñƒ Ð² Ñ€ÐµÑ‡ÐµÐ½Ð½Ñ– Â«Ð¯ÐºÐ±Ð¸ Ñ Ð²Ð¸Ð²Ñ‡Ð¸Ð² Ñ‚Ð¾Ð´Ñ–, Ð·Ð°Ñ€Ð°Ð· Ð±Ð¸ Ð·Ð½Ð°Ð²Â» Ð¿Ð¾Ñ‚Ñ€Ñ–Ð±Ð½Ð° Ñ‡Ð°ÑÑ‚ÐºÐ° Â«Ð±Â» Ñƒ Ð½Ð°ÑÐ»Ñ–Ð´ÐºÑƒ?\n   - [ ] Ð¢Ð¾Ð¼Ñƒ Ñ‰Ð¾ Ñ†Ðµ Ð¼Ð¸Ð½ÑƒÐ»Ð¸Ð¹ Ñ‡Ð°Ñ.\n   - [ ] Ð¢Ð¾Ð¼Ñƒ Ñ‰Ð¾ ÑÑƒÐ±'Ñ”ÐºÑ‚Ð¸ Ñ€Ñ–Ð·Ð½Ñ–.\n   - [x] Ð¢Ð¾Ð¼Ñƒ Ñ‰Ð¾ Ð½Ð°ÑÐ»Ñ–Ð´Ð¾Ðº Ñ” Ð³Ñ–Ð¿Ð¾Ñ‚ÐµÑ‚Ð¸Ñ‡Ð½Ð¸Ð¼.\n   - [ ] Ð¢Ð¾Ð¼Ñƒ Ñ‰Ð¾ Ñ†Ðµ Ñ‚ÐµÐ¿ÐµÑ€Ñ–ÑˆÐ½Ñ–Ð¹ Ñ‡Ð°Ñ.\n   > Ð§Ð°ÑÑ‚ÐºÐ° Â«Ð±Â» Ð¿Ð¾Ð·Ð½Ð°Ñ‡Ð°Ñ” ÑƒÐ¼Ð¾Ð²Ð½Ð¸Ð¹ (Ð³Ñ–Ð¿Ð¾Ñ‚ÐµÑ‚Ð¸Ñ‡Ð½Ð¸Ð¹) ÑÐ¿Ð¾ÑÑ–Ð±.\n\n7. Ð¯ÐºÐµ Ð· Ð½Ð°Ð²ÐµÐ´ÐµÐ½Ð¸Ñ… Ñ€ÐµÑ‡ÐµÐ½ÑŒ Ñ” Ð¿Ñ€Ð¸ÐºÐ»Ð°Ð´Ð¾Ð¼ Ð½Ð°ÑÐ»Ñ–Ð´ÐºÐ¾Ð²Ð¾Ð³Ð¾ Ð»Ð°Ð½Ñ†ÑŽÐ³Ð° ÑƒÐ¼Ð¾Ð² Ñƒ Ñ€ÐµÐ°Ð»Ñ–ÑÑ‚Ð¸Ñ‡Ð½Ð¾Ð¼Ñƒ ÑÑ†ÐµÐ½Ð°Ñ€Ñ–Ñ—?\n   - [ ] Ð¯ÐºÐ±Ð¸ Ð¼Ð°Ð² Ð³Ñ€Ð¾ÑˆÑ–, ÐºÑƒÐ¿Ð¸Ð² Ð±Ð¸ Ð¼Ð°ÑˆÐ¸Ð½Ñƒ.\n   - [x] Ð¯ÐºÑ‰Ð¾ Ð²Ð¸Ð²Ñ‡Ð¸Ñˆ Ð¼Ð¾Ð²Ñƒ, Ð·Ð½Ð°Ð¹Ð´ÐµÑˆ Ñ€Ð¾Ð±Ð¾Ñ‚Ñƒ. Ð ÑÐºÑ‰Ð¾ Ð·Ð½Ð°Ð¹Ð´ÐµÑˆ, Ð·Ð°Ñ€Ð¾Ð±Ð¸Ñˆ Ð³Ñ€Ð¾ÑˆÑ–.\n   - [ ] Ð¯ÐºÐ±Ð¸ Ð¿Ñ€Ð¸Ð¹ÑˆÐ¾Ð², Ð¿Ð¾Ð³Ð¾Ð²Ð¾Ñ€Ð¸Ð»Ð¸ Ð± Ð· Ð½Ð¸Ð¼.\n   - [ ] Ð¯ÐºÑ‰Ð¾ Ñ…Ð¾Ñ‡ÐµÑˆ, Ð´Ð¾Ð¿Ð¾Ð¼Ð¾Ð¶Ñƒ Ñ‚Ð¾Ð±Ñ– Ð·Ð°Ñ€Ð°Ð·.\n   > Ð›Ð°Ð½Ñ†ÑŽÐ³: A â†’ B â†’ C.\n\n8. Ð¯Ðº Ð¼Ð¾Ð¶Ð½Ð° Ð²Ð¸Ð·Ð½Ð°Ñ‡Ð¸Ñ‚Ð¸, Ñ‡Ð¸ Ð¿Ð¾Ñ‚Ñ€Ñ–Ð±Ð½Ð° Ð·Ð¼Ñ–ÑˆÐ°Ð½Ð° ÑƒÐ¼Ð¾Ð²Ð°, Ñ‡Ð¸ ÑÑ‚Ð°Ð½Ð´Ð°Ñ€Ñ‚Ð½Ð° Ð½ÐµÑ€ÐµÐ°Ð»ÑŒÐ½Ð° Ð² ÐºÐ¾Ð½ÐºÑ€ÐµÑ‚Ð½Ð¾Ð¼Ñƒ Ð²Ð¸Ð¿Ð°Ð´ÐºÑƒ?\n   - [ ] Ð—Ð° ÐºÑ–Ð»ÑŒÐºÑ–ÑÑ‚ÑŽ ÑÐ»Ñ–Ð² Ñƒ Ñ€ÐµÑ‡ÐµÐ½Ð½Ñ–.\n   - [ ] Ð—Ð° Ñ€Ð¾Ð´Ð¾Ð¼ Ð¿Ñ–Ð´Ð¼ÐµÑ‚Ð° Ð² Ñ€ÐµÑ‡ÐµÐ½Ð½Ñ–.\n   - [x] Ð—Ð° Ñ‚Ð¸Ð¼, Ñ‡Ð¸ Ð·Ð±Ñ–Ð³Ð°ÑŽÑ‚ÑŒÑÑ Ñ‡Ð°ÑÐ¸ ÑƒÐ¼Ð¾Ð²Ð¸ Ñ‚Ð° Ð½Ð°ÑÐ»Ñ–Ð´ÐºÑƒ.\n   - [ ] Ð—Ð° Ð¿Ð¾Ð·Ð¸Ñ†Ñ–Ñ”ÑŽ Ñ‡Ð°ÑÑ‚ÐºÐ¸ Â«Ð±Â».\n   > Ð Ñ–Ð·Ð½Ñ– Ñ‡Ð°ÑÐ¸ = Ð·Ð¼Ñ–ÑˆÐ°Ð½Ð°, Ð¾Ð´Ð½Ð°ÐºÐ¾Ð²Ñ– = ÑÑ‚Ð°Ð½Ð´Ð°Ñ€Ñ‚Ð½Ð°.\n\n---\n\n## match-up: Ð—'Ñ”Ð´Ð½Ð°Ð¹Ñ‚Ðµ ÑƒÐ¼Ð¾Ð²Ñƒ Ð· Ð½Ð°ÑÐ»Ñ–Ð´ÐºÐ¾Ð¼\n\n- Ð¯ÐºÐ±Ð¸ Ñ Ð²Ð¸Ð²Ñ‡Ð¸Ð² Ñ‚Ð¾Ð´Ñ– :: Ð·Ð°Ñ€Ð°Ð· Ð±Ð¸ Ð·Ð½Ð°Ð² Ð²Ñ–Ð´Ð¿Ð¾Ð²Ñ–Ð´ÑŒ.\n- Ð¯ÐºÐ±Ð¸ Ñ Ð±ÑƒÐ² ÑÐ¼Ñ–Ð»Ð¸Ð²Ñ–ÑˆÐ¸Ð¼ :: ÑÐºÐ°Ð·Ð°Ð² Ð±Ð¸ Ñ—Ð¹ Ð¿Ñ€Ð°Ð²Ð´Ñƒ.\n- Ð¯ÐºÑ‰Ð¾ Ð¿Ñ€Ð¸Ð¹Ð´Ðµ, Ñ– ÑÐºÑ‰Ð¾ Ð¼Ð°Ñ‚Ð¸Ð¼Ðµ Ñ‡Ð°Ñ :: Ð¿Ð¾Ð³Ð¾Ð²Ð¾Ñ€Ð¸Ð¼Ð¾ Ð· Ð½Ð¸Ð¼.\n- Ð¯ÐºÐ±Ð¸ Ð¼Ð¸ Ð¿ÐµÑ€ÐµÑ—Ñ…Ð°Ð»Ð¸ Ñ‚Ð¾Ð´Ñ– :: Ð·Ð°Ñ€Ð°Ð· Ð±Ð¸ Ð¶Ð¸Ð»Ð¸ Ð² ÐšÐ¸Ñ”Ð²Ñ–.\n- Ð¯ÐºÑ‰Ð¾ Ð²Ð¸Ð²Ñ‡Ð¸Ñˆ Ð¼Ð¾Ð²Ñƒ :: Ð·Ð½Ð°Ð¹Ð´ÐµÑˆ Ñ…Ð¾Ñ€Ð¾ÑˆÑƒ Ñ€Ð¾Ð±Ð¾Ñ‚Ñƒ.\n- Ð¯ÐºÐ±Ð¸ Ð²Ñ–Ð½ Ð½Ðµ Ð·Ð°Ñ…Ð²Ð¾Ñ€Ñ–Ð² :: Ð¿Ñ€Ð°Ñ†ÑŽÐ²Ð°Ð² Ð±Ð¸ ÑÑŒÐ¾Ð³Ð¾Ð´Ð½Ñ–.\n- Ð†Ð½Ð°ÐºÑˆÐµ Ð½Ðµ Ð²ÑÑ‚Ð¸Ð³Ð½ÐµÐ¼Ð¾ :: Ð¿Ñ€Ð°Ñ†ÑŽÐ¹ ÑˆÐ²Ð¸Ð´ÑˆÐµ Ð·Ð°Ñ€Ð°Ð·.\n- Ð¯ÐºÐ±Ð¸ Ñ Ð±ÑƒÐ² Ð±Ð°Ð³Ð°Ñ‚ÑˆÐ¸Ð¼ :: Ð½Ðµ Ð·Ñ€Ð¾Ð±Ð¸Ð² Ð±Ð¸ Ñ‚Ñ–Ñ”Ñ— Ð¿Ð¾Ð¼Ð¸Ð»ÐºÐ¸.\n- Ð£ Ñ‚Ð°ÐºÐ¾Ð¼Ñƒ Ñ€Ð°Ð·Ñ– Ð·Ð°Ð»Ð¸ÑˆÐ¸Ð¼Ð¾ÑÑ Ð²Ð´Ð¾Ð¼Ð° :: ÑÐºÑ‰Ð¾ Ð±ÑƒÐ´Ðµ Ð´Ð¾Ñ‰.\n- Ð¯ÐºÑ‰Ð¾ Ð¿Ð¾Ñ‡Ð½ÐµÑˆ Ð·Ð°Ñ€Ð°Ð· :: Ð·Ð° Ñ€Ñ–Ðº Ð´Ð¾ÑÑÐ³Ð½ÐµÑˆ Ñ€ÐµÐ·ÑƒÐ»ÑŒÑ‚Ð°Ñ‚Ñƒ.\n- Ð¯ÐºÐ±Ð¸ Ð·Ð½Ð°Ð»Ð¸ Ð°Ð´Ñ€ÐµÑÑƒ :: Ð·Ð½Ð°Ð¹ÑˆÐ»Ð¸ Ð± Ð´Ð¾Ñ€Ð¾Ð³Ñƒ Ð²Ñ‡Ð¾Ñ€Ð°.\n- Ð’ Ñ–Ð½ÑˆÐ¾Ð¼Ñƒ Ð²Ð¸Ð¿Ð°Ð´ÐºÑƒ Ð·Ð²Ñ–Ð»ÑŒÐ½ÑÑ‚ÑŒ :: Ð¿Ñ€Ð°Ñ†ÑŽÐ¹ ÑÑ‚Ð°Ñ€Ð°Ð½Ð½Ñ–ÑˆÐµ.\n\n---\n\n## fill-in: Ð”Ð¾Ð¿Ð¾Ð²Ð½Ñ–Ñ‚ÑŒ Ñ€ÐµÑ‡ÐµÐ½Ð½Ñ Ð¿Ñ€Ð°Ð²Ð¸Ð»ÑŒÐ½Ð¾ÑŽ Ñ„Ð¾Ñ€Ð¼Ð¾ÑŽ\n\n1. Ð¯ÐºÐ±Ð¸ Ñ Ð²Ð¸Ð²Ñ‡Ð¸Ð² Ð°Ð½Ð³Ð»Ñ–Ð¹ÑÑŒÐºÑƒ ___, Ð·Ð°Ñ€Ð°Ð· Ð±Ð¸ Ð¼Ð°Ð² ÐºÑ€Ð°Ñ‰Ñƒ Ñ€Ð¾Ð±Ð¾Ñ‚Ñƒ.\n   > [!answer] Ñ‚Ð¾Ð´Ñ–\n   > [!options] Ñ‚Ð¾Ð´Ñ– | Ð·Ð°Ñ€Ð°Ð· | Ð·Ð°Ð²Ñ‚Ñ€Ð° | ÑÑŒÐ¾Ð³Ð¾Ð´Ð½Ñ–\n\n2. Ð¯ÐºÐ±Ð¸ Ð²Ñ–Ð½ ___ ÑÐ¼Ñ–Ð»Ð¸Ð²Ñ–ÑˆÐ¸Ð¼, ÑÐºÐ°Ð·Ð°Ð² Ð±Ð¸ Ñ—Ð¹ Ð¿Ñ€Ð°Ð²Ð´Ñƒ Ð¼Ð¸Ð½ÑƒÐ»Ð¾Ð³Ð¾ Ñ‚Ð¸Ð¶Ð½Ñ.\n   > [!answer] Ð±ÑƒÐ²\n   > [!options] Ð±ÑƒÐ² | Ñ” | Ð±ÑƒÐ´Ðµ | Ð±ÑƒÑ‚Ð¸\n\n3. Ð¯ÐºÑ‰Ð¾ Ð¿Ñ€Ð¸Ð¹Ð´Ðµ, ___ ÑÐºÑ‰Ð¾ Ð¼Ð°Ñ‚Ð¸Ð¼Ðµ Ñ‡Ð°Ñ, Ð¿Ð¾Ð³Ð¾Ð²Ð¾Ñ€Ð¸Ð¼Ð¾ Ð· Ð½Ð¸Ð¼ ÑÑŒÐ¾Ð³Ð¾Ð´Ð½Ñ–.\n   > [!answer] Ñ–\n   > [!options] Ñ– | Ð°Ð±Ð¾ | Ð°Ð»Ðµ | Ñ‡Ð¸\n\n4. Ð¯ÐºÐ±Ð¸ Ð¼Ð¸ Ð¿ÐµÑ€ÐµÑ—Ñ…Ð°Ð»Ð¸ Ð´Ð¾ ÐšÐ¸Ñ”Ð²Ð° Ñ‚Ð¾Ð´Ñ–, ___ Ð±Ð¸ Ð¶Ð¸Ð»Ð¸ Ñ‚Ð°Ð¼ Ð·Ð°Ñ€Ð°Ð·.\n   > [!answer] Ð¼Ð¸\n   > [!options] Ð¼Ð¸ | Ð²Ð¾Ð½Ð¸ | Ð²Ð¸ | Ñ\n\n5. Ð’Ð¸Ð²Ñ‡Ð°Ð¹ ÑÑ‚Ð°Ñ€Ð°Ð½Ð½Ð¾, ___ Ð½Ðµ Ð·Ð´Ð°ÑÐ¸ ÐµÐºÐ·Ð°Ð¼ÐµÐ½ Ð½Ð°ÑÑ‚ÑƒÐ¿Ð½Ð¾Ð³Ð¾ Ñ‚Ð¸Ð¶Ð½Ñ.\n   > [!answer] Ñ–Ð½Ð°ÐºÑˆÐµ\n   > [!options] Ñ–Ð½Ð°ÐºÑˆÐµ | Ñ‚Ð¾Ð¼Ñƒ | Ñ…Ð¾Ñ‡Ð° | Ð±Ð¾\n\n6. Ð¯ÐºÐ±Ð¸ Ñ ___ Ð¿Ñ€Ð¾ Ñ†Ðµ Ñ€Ð°Ð½Ñ–ÑˆÐµ, Ð¿Ð¾Ð¿ÐµÑ€ÐµÐ´Ð¸Ð² Ð±Ð¸ Ñ‚ÐµÐ±Ðµ Ð½ÐµÐ³Ð°Ð¹Ð½Ð¾.\n   > [!answer] Ð·Ð½Ð°Ð²\n   > [!options] Ð·Ð½Ð°Ð² | Ð·Ð½Ð°ÑŽ | Ð·Ð½Ð°Ñ‚Ð¸Ð¼Ñƒ | Ð·Ð½Ð°Ñ‚Ð¸\n\n7. Ð¯ÐºÑ‰Ð¾ Ð²Ð¸Ð²Ñ‡Ð¸Ñˆ Ð¼Ð¾Ð²Ñƒ, Ð·Ð½Ð°Ð¹Ð´ÐµÑˆ Ñ€Ð¾Ð±Ð¾Ñ‚Ñƒ. Ð ÑÐºÑ‰Ð¾ Ð·Ð½Ð°Ð¹Ð´ÐµÑˆ Ñ€Ð¾Ð±Ð¾Ñ‚Ñƒ, ___ Ð³Ñ€Ð¾ÑˆÑ–.\n   > [!answer] Ð·Ð°Ñ€Ð¾Ð±Ð¸Ñˆ\n   > [!options] Ð·Ð°Ñ€Ð¾Ð±Ð¸Ñˆ | Ð·Ð°Ñ€Ð¾Ð±Ð¸Ð² | Ð·Ð°Ñ€Ð¾Ð±Ð»ÑÑ”Ñˆ | Ð·Ð°Ñ€Ð¾Ð±Ð¸Ñ‚Ð¸\n\n8. Ð£ ___ Ñ€Ð°Ð·Ñ– Ð·Ð°Ð»Ð¸ÑˆÐ¸Ð¼Ð¾ÑÑ Ð²Ð´Ð¾Ð¼Ð° Ð¹ Ð¿Ð¾Ð´Ð¸Ð²Ð¸Ð¼Ð¾ÑÑ Ñ„Ñ–Ð»ÑŒÐ¼.\n   > [!answer] Ñ‚Ð°ÐºÐ¾Ð¼Ñƒ\n   > [!options] Ñ‚Ð°ÐºÐ¾Ð¼Ñƒ | Ñ‚Ð¾Ð¼Ñƒ | Ñ†ÑŒÐ¾Ð¼Ñƒ | ÑÐºÐ¾Ð¼Ñƒ\n\n---\n\n## true-false: ÐŸÑ€Ð°Ð²Ð´Ð° Ñ‡Ð¸ Ð½ÐµÐ¿Ñ€Ð°Ð²Ð´Ð°?\n\n1. Ð—Ð¼Ñ–ÑˆÐ°Ð½Ñ– ÑƒÐ¼Ð¾Ð²Ð¸ â€” Ñ†Ðµ Ñ€ÐµÑ‡ÐµÐ½Ð½Ñ, Ð´Ðµ Ñ‡Ð°Ñ ÑƒÐ¼Ð¾Ð²Ð¸ Ð½Ðµ Ð·Ð±Ñ–Ð³Ð°Ñ”Ñ‚ÑŒÑÑ Ð· Ñ‡Ð°ÑÐ¾Ð¼ Ð½Ð°ÑÐ»Ñ–Ð´ÐºÑƒ.\n   - [x] ÐŸÑ€Ð°Ð²Ð´Ð°\n   - [ ] ÐÐµÐ¿Ñ€Ð°Ð²Ð´Ð°\n\n2. Ð£ Ð»Ð°Ð½Ñ†ÑŽÐ³Ð¾Ð²Ð¸Ñ… ÑƒÐ¼Ð¾Ð²Ð°Ñ… Ð¼Ð¾Ð¶Ð½Ð° Ð·Ð¼Ñ–ÑˆÑƒÐ²Ð°Ñ‚Ð¸ Â«ÑÐºÑ‰Ð¾Â» Ñ– Â«ÑÐºÐ±Ð¸Â».\n   - [ ] ÐŸÑ€Ð°Ð²Ð´Ð°\n   - [x] ÐÐµÐ¿Ñ€Ð°Ð²Ð´Ð°\n\n3. Â«Ð¯ÐºÐ±Ð¸ Ñ Ð²Ð¸Ð²Ñ‡Ð¸Ð² Ñ‚Ð¾Ð´Ñ–, Ð·Ð°Ñ€Ð°Ð· Ð±Ð¸ Ð·Ð½Ð°Ð²Â» â€” Ñ†Ðµ Ð¿Ñ€Ð¸ÐºÐ»Ð°Ð´ Ð·Ð¼Ñ–ÑˆÐ°Ð½Ð¾Ñ— ÑƒÐ¼Ð¾Ð²Ð¸.\n   - [x] ÐŸÑ€Ð°Ð²Ð´Ð°\n   - [ ] ÐÐµÐ¿Ñ€Ð°Ð²Ð´Ð°\n\n4. Ð§Ð°ÑÐ¾Ð²Ñ– Ð¼Ð°Ñ€ÐºÐµÑ€Ð¸ Â«Ñ‚Ð¾Ð´Ñ–Â» Ñ– Â«Ð·Ð°Ñ€Ð°Ð·Â» Ð½Ðµ Ð¿Ð¾Ñ‚Ñ€Ñ–Ð±Ð½Ñ– Ð² Ð·Ð¼Ñ–ÑˆÐ°Ð½Ð¸Ñ… ÑƒÐ¼Ð¾Ð²Ð°Ñ….\n   - [ ] ÐŸÑ€Ð°Ð²Ð´Ð°\n   - [x] ÐÐµÐ¿Ñ€Ð°Ð²Ð´Ð°\n\n5. Â«Ð†Ð½Ð°ÐºÑˆÐµÂ» Ð²Ð¸ÐºÐ¾Ñ€Ð¸ÑÑ‚Ð¾Ð²ÑƒÑ”Ñ‚ÑŒÑÑ Ð´Ð»Ñ Ð²Ð¸Ñ€Ð°Ð¶ÐµÐ½Ð½Ñ Ð°Ð»ÑŒÑ‚ÐµÑ€Ð½Ð°Ñ‚Ð¸Ð²Ð½Ð¾Ð³Ð¾ Ð½Ð°ÑÐ»Ñ–Ð´ÐºÑƒ.\n   - [x] ÐŸÑ€Ð°Ð²Ð´Ð°\n   - [ ] ÐÐµÐ¿Ñ€Ð°Ð²Ð´Ð°\n\n6. ÐÐ°ÑÐ»Ñ–Ð´ÐºÐ¾Ð²Ð¸Ð¹ Ð»Ð°Ð½Ñ†ÑŽÐ³ â€” Ñ†Ðµ ÐºÐ¾Ð»Ð¸ A Ð²ÐµÐ´Ðµ Ð´Ð¾ B, Ð° B Ð²ÐµÐ´Ðµ Ð´Ð¾ C.\n   - [x] ÐŸÑ€Ð°Ð²Ð´Ð°\n   - [ ] ÐÐµÐ¿Ñ€Ð°Ð²Ð´Ð°\n\n7. Ð—Ð¼Ñ–ÑˆÐ°Ð½Ð° ÑƒÐ¼Ð¾Ð²Ð° Â«Ñ‚ÐµÐ¿ÐµÑ€Ñ–ÑˆÐ½Ñ” â†’ Ð¼Ð¸Ð½ÑƒÐ»ÐµÂ» Ð¾Ð·Ð½Ð°Ñ‡Ð°Ñ”, Ñ‰Ð¾ Ñ€Ð¸ÑÐ° Ð»ÑŽÐ´Ð¸Ð½Ð¸ Ð¿Ð¾ÑÑÐ½ÑŽÑ” Ð¼Ð¸Ð½ÑƒÐ»Ñƒ Ð¿Ð¾Ð´Ñ–ÑŽ.\n   - [x] ÐŸÑ€Ð°Ð²Ð´Ð°\n   - [ ] ÐÐµÐ¿Ñ€Ð°Ð²Ð´Ð°\n\n8. Ð£ Ð·Ð¼Ñ–ÑˆÐ°Ð½Ð¸Ñ… ÑƒÐ¼Ð¾Ð²Ð°Ñ… Ñ‡Ð°ÑÑ‚ÐºÐ° Â«Ð±Â» Ð½Ðµ Ð¿Ð¾Ñ‚Ñ€Ñ–Ð±Ð½Ð° Ð² Ð½Ð°ÑÐ»Ñ–Ð´ÐºÑƒ.\n   - [ ] ÐŸÑ€Ð°Ð²Ð´Ð°\n   - [x] ÐÐµÐ¿Ñ€Ð°Ð²Ð´Ð°\n\n---\n\n## group-sort: Ð Ð¾Ð·Ð¿Ð¾Ð´Ñ–Ð»Ñ–Ñ‚ÑŒ Ñ€ÐµÑ‡ÐµÐ½Ð½Ñ Ð·Ð° Ñ‚Ð¸Ð¿Ð°Ð¼Ð¸\n\n### Ð—Ð¼Ñ–ÑˆÐ°Ð½Ð° (Ð¼Ð¸Ð½ÑƒÐ»Ðµ â†’ Ñ‚ÐµÐ¿ÐµÑ€Ñ–ÑˆÐ½Ñ”)\n- Ð¯ÐºÐ±Ð¸ Ñ Ð²Ð¸Ð²Ñ‡Ð¸Ð² Ñ‚Ð¾Ð´Ñ–, Ð·Ð°Ñ€Ð°Ð· Ð±Ð¸ Ð·Ð½Ð°Ð².\n- Ð¯ÐºÐ±Ð¸ Ð¼Ð¸ Ð¿ÐµÑ€ÐµÑ—Ñ…Ð°Ð»Ð¸, Ð¶Ð¸Ð»Ð¸ Ð± Ñƒ ÐšÐ¸Ñ”Ð²Ñ–.\n- Ð¯ÐºÐ±Ð¸ Ð²Ñ–Ð½ Ð½Ðµ Ð·Ð°Ñ…Ð²Ð¾Ñ€Ñ–Ð², Ð¿Ñ€Ð°Ñ†ÑŽÐ²Ð°Ð² Ð±Ð¸ ÑÑŒÐ¾Ð³Ð¾Ð´Ð½Ñ–.\n- Ð¯ÐºÐ±Ð¸ Ð±Ð°Ñ‚ÑŒÐºÐ¸ Ð¿ÐµÑ€ÐµÑ—Ñ…Ð°Ð»Ð¸, Ñ Ð± Ð·Ð°Ñ€Ð°Ð· Ð¶Ð¸Ð² Ñ‚Ð°Ð¼.\n\n### Ð—Ð¼Ñ–ÑˆÐ°Ð½Ð° (Ñ‚ÐµÐ¿ÐµÑ€Ñ–ÑˆÐ½Ñ” â†’ Ð¼Ð¸Ð½ÑƒÐ»Ðµ)\n- Ð¯ÐºÐ±Ð¸ Ñ Ð±ÑƒÐ² ÑÐ¼Ñ–Ð»Ð¸Ð²Ñ–ÑˆÐ¸Ð¼, ÑÐºÐ°Ð·Ð°Ð² Ð±Ð¸ Ñ‚Ð¾Ð´Ñ–.\n- Ð¯ÐºÐ±Ð¸ Ð²Ñ–Ð½ Ð·Ð½Ð°Ð² Ð¼Ð¾Ð²Ñƒ, Ð¿Ð¾Ñ—Ñ…Ð°Ð² Ð±Ð¸ Ñ‚Ð¾Ð´Ñ–.\n- Ð¯ÐºÐ±Ð¸ Ð¼Ð¸ Ð¼Ð°Ð»Ð¸ Ð³Ñ€Ð¾ÑˆÑ–, ÐºÑƒÐ¿Ð¸Ð»Ð¸ Ð± Ñ‚Ð¾Ð´Ñ–.\n- Ð¯ÐºÐ±Ð¸ Ð²Ð¾Ð½Ð° Ð»ÑŽÐ±Ð¸Ð»Ð° Ñ‡Ð¸Ñ‚Ð°Ñ‚Ð¸, Ð¿Ñ€Ð¾Ñ‡Ð¸Ñ‚Ð°Ð»Ð° Ð±.\n\n### Ð›Ð°Ð½Ñ†ÑŽÐ³Ð¾Ð²Ð° ÑƒÐ¼Ð¾Ð²Ð°\n- Ð¯ÐºÑ‰Ð¾ Ð¿Ñ€Ð¸Ð¹Ð´Ðµ, Ñ– ÑÐºÑ‰Ð¾ Ð¼Ð°Ñ‚Ð¸Ð¼Ðµ Ñ‡Ð°Ñ, Ð¿Ð¾Ð³Ð¾Ð²Ð¾Ñ€Ð¸Ð¼Ð¾.\n- Ð¯ÐºÐ±Ð¸ Ð¼Ð°Ð² Ð³Ñ€Ð¾ÑˆÑ–, Ñ– ÑÐºÐ±Ð¸ Ð¼Ð°Ð² Ñ‡Ð°Ñ, Ð¿Ð¾Ñ—Ñ…Ð°Ð² Ð±Ð¸.\n- Ð¯ÐºÑ‰Ð¾ Ð½Ðµ Ð±ÑƒÐ´Ðµ Ð´Ð¾Ñ‰Ñƒ, Ñ– ÑÐºÑ‰Ð¾ Ð¼Ð°ÑˆÐ¸Ð½Ð° Ð²Ñ–Ð»ÑŒÐ½Ð°, Ð¿Ð¾Ñ—Ð´ÐµÐ¼Ð¾.\n- Ð¯ÐºÑ‰Ð¾ Ð²Ð¸Ð²Ñ‡Ð¸Ñˆ, Ñ– ÑÐºÑ‰Ð¾ Ð·Ð´Ð°ÑÐ¸, Ð¾Ñ‚Ñ€Ð¸Ð¼Ð°Ñ”Ñˆ Ð´Ð¸Ð¿Ð»Ð¾Ð¼.\n\n### ÐÐ°ÑÐ»Ñ–Ð´ÐºÐ¾Ð²Ð¸Ð¹ Ð»Ð°Ð½Ñ†ÑŽÐ³\n- Ð’Ð¸Ð²Ñ‡Ð¸Ñˆ Ð¼Ð¾Ð²Ñƒ â†’ Ð·Ð½Ð°Ð¹Ð´ÐµÑˆ Ñ€Ð¾Ð±Ð¾Ñ‚Ñƒ â†’ Ð·Ð°Ñ€Ð¾Ð±Ð¸Ñˆ Ð³Ñ€Ð¾ÑˆÑ–.\n- Ð—Ð°Ð¿Ñ–Ð·Ð½Ð¸ÑˆÑÑ â†’ Ð¿Ñ€Ð¾Ð¿ÑƒÑÑ‚Ð¸Ñˆ Ð½Ð°Ñ€Ð°Ð´Ñƒ â†’ Ð²Ñ‚Ñ€Ð°Ñ‚Ð¸Ñˆ ÑˆÐ°Ð½Ñ.\n- ÐŸÐ¾Ñ‡Ð½ÐµÑˆ Ð·Ð°Ñ€Ð°Ð· â†’ Ð´Ð¾ÑÑÐ³Ð½ÐµÑˆ Ð·Ð° Ñ€Ñ–Ðº â†’ ÑÑ‚Ð°Ð½ÐµÑˆ ÐµÐºÑÐ¿ÐµÑ€Ñ‚Ð¾Ð¼.\n- Ð†Ð½Ð²ÐµÑÑ‚ÑƒÑ”Ñˆ â†’ Ð¾Ñ‚Ñ€Ð¸Ð¼Ð°Ñ”Ñˆ Ð¿Ñ€Ð¸Ð±ÑƒÑ‚Ð¾Ðº â†’ Ñ€Ð¾Ð·ÑˆÐ¸Ñ€Ð¸ÑˆÑÑ.\n\n---\n\n## unjumble: Ð¡ÐºÐ»Ð°Ð´Ñ–Ñ‚ÑŒ Ñ€ÐµÑ‡ÐµÐ½Ð½Ñ Ð· Ñ€Ð¾Ð·ÑÐ¸Ð¿Ð°Ð½Ð¸Ñ… ÑÐ»Ñ–Ð²\n\n1. Ð²Ð¸Ð²Ñ‡Ð¸Ð² / Ñ‚Ð¾Ð´Ñ– / Ð·Ð½Ð°Ð² / Ð±Ð¸ / Ñ / Ð²Ñ–Ð´Ð¿Ð¾Ð²Ñ–Ð´ÑŒ / ÑÐºÐ±Ð¸ / Ð·Ð°Ñ€Ð°Ð· / Ñ / Ð½Ð° / Ð¿Ð¸Ñ‚Ð°Ð½Ð½Ñ\n   > [!answer] Ð¯ÐºÐ±Ð¸ Ñ Ð²Ð¸Ð²Ñ‡Ð¸Ð² Ñ‚Ð¾Ð´Ñ–, Ñ Ð·Ð°Ñ€Ð°Ð· Ð±Ð¸ Ð·Ð½Ð°Ð² Ð²Ñ–Ð´Ð¿Ð¾Ð²Ñ–Ð´ÑŒ Ð½Ð° Ð¿Ð¸Ñ‚Ð°Ð½Ð½Ñ.\n\n2. ÑÐ¼Ñ–Ð»Ð¸Ð²Ñ–ÑˆÐ¸Ð¼ / Ð±ÑƒÐ² / ÑÐºÐ±Ð¸ / Ñ / Ñ—Ð¹ / ÑÐºÐ°Ð·Ð°Ð² / Ð± / Ð¿Ñ€Ð°Ð²Ð´Ñƒ / Ñ / Ñ‚Ð¾Ð´Ñ– / ÑƒÑÑŽ\n   > [!answer] Ð¯ÐºÐ±Ð¸ Ñ Ð±ÑƒÐ² ÑÐ¼Ñ–Ð»Ð¸Ð²Ñ–ÑˆÐ¸Ð¼, Ñ Ð± ÑÐºÐ°Ð·Ð°Ð² Ñ—Ð¹ ÑƒÑÑŽ Ð¿Ñ€Ð°Ð²Ð´Ñƒ Ñ‚Ð¾Ð´Ñ–.\n\n3. Ð¿Ñ€Ð¸Ð¹Ð´Ðµ / ÑÐºÑ‰Ð¾ / Ñ– / Ð¼Ð°Ñ‚Ð¸Ð¼Ðµ / Ñ‡Ð°Ñ / ÑÐºÑ‰Ð¾ / , / Ð½Ð¸Ð¼ / Ð¿Ð¾Ð³Ð¾Ð²Ð¾Ñ€Ð¸Ð¼Ð¾ / Ð¼Ð¸ / Ð· / ÑÑŒÐ¾Ð³Ð¾Ð´Ð½Ñ–\n   > [!answer] Ð¯ÐºÑ‰Ð¾ Ð¿Ñ€Ð¸Ð¹Ð´Ðµ, Ñ– ÑÐºÑ‰Ð¾ Ð¼Ð°Ñ‚Ð¸Ð¼Ðµ Ñ‡Ð°Ñ, Ð¼Ð¸ Ð¿Ð¾Ð³Ð¾Ð²Ð¾Ñ€Ð¸Ð¼Ð¾ Ð· Ð½Ð¸Ð¼ ÑÑŒÐ¾Ð³Ð¾Ð´Ð½Ñ–.\n\n4. Ð¿ÐµÑ€ÐµÑ—Ñ…Ð°Ð»Ð¸ / ÑÐºÐ±Ð¸ / Ð´Ð¾ / ÐšÐ¸Ñ”Ð²Ð° / Ð¼Ð¸ / Ñ‚Ð¾Ð´Ñ– / Ð± / Ð·Ð°Ñ€Ð°Ð· / Ñ‚Ð°Ð¼ / Ð¶Ð¸Ð»Ð¸ / Ð¼Ð¸\n   > [!answer] Ð¯ÐºÐ±Ð¸ Ð¼Ð¸ Ð¿ÐµÑ€ÐµÑ—Ñ…Ð°Ð»Ð¸ Ð´Ð¾ ÐšÐ¸Ñ”Ð²Ð° Ñ‚Ð¾Ð´Ñ–, Ð¼Ð¸ Ð± Ð¶Ð¸Ð»Ð¸ Ñ‚Ð°Ð¼ Ð·Ð°Ñ€Ð°Ð·.\n\n5. Ð²Ð¸Ð²Ñ‡Ð¸Ñˆ / ÑÐºÑ‰Ð¾ / Ð·Ð½Ð°Ð¹Ð´ÐµÑˆ / Ð¼Ð¾Ð²Ñƒ / , / Ñ€Ð¾Ð±Ð¾Ñ‚Ñƒ / Ð° / Ð·Ð½Ð°Ð¹Ð´ÐµÑˆ / ÑÐºÑ‰Ð¾ / , / Ð·Ð°Ñ€Ð¾Ð±Ð¸Ñˆ / Ð³Ñ€Ð¾ÑˆÑ– / Ñ…Ð¾Ñ€Ð¾ÑˆÑ–\n   > [!answer] Ð¯ÐºÑ‰Ð¾ Ð²Ð¸Ð²Ñ‡Ð¸Ñˆ Ð¼Ð¾Ð²Ñƒ, Ð·Ð½Ð°Ð¹Ð´ÐµÑˆ Ñ€Ð¾Ð±Ð¾Ñ‚Ñƒ, Ð° ÑÐºÑ‰Ð¾ Ð·Ð½Ð°Ð¹Ð´ÐµÑˆ, Ð·Ð°Ñ€Ð¾Ð±Ð¸Ñˆ Ñ…Ð¾Ñ€Ð¾ÑˆÑ– Ð³Ñ€Ð¾ÑˆÑ–.\n\n6. Ñ–Ð½Ð°ÐºÑˆÐµ / ÑÑ‚Ð°Ñ€Ð°Ð½Ð½Ð¾ / Ð²Ð¸Ð²Ñ‡Ð°Ð¹ / ÐµÐºÐ·Ð°Ð¼ÐµÐ½ / Ð·Ð´Ð°ÑÐ¸ / Ð½Ðµ / Ð²Ð°Ð¶Ð»Ð¸Ð²Ð¸Ð¹ / Ñ†ÐµÐ¹ / Ð½Ð°ÑÑ‚ÑƒÐ¿Ð½Ð¾Ð³Ð¾ / Ñ‚Ð¸Ð¶Ð½Ñ / Ð· / Ð¼Ð°Ñ‚ÐµÐ¼Ð°Ñ‚Ð¸ÐºÐ¸\n   > [!answer] Ð’Ð¸Ð²Ñ‡Ð°Ð¹ ÑÑ‚Ð°Ñ€Ð°Ð½Ð½Ð¾, Ñ–Ð½Ð°ÐºÑˆÐµ Ð½Ðµ Ð·Ð´Ð°ÑÐ¸ Ñ†ÐµÐ¹ Ð²Ð°Ð¶Ð»Ð¸Ð²Ð¸Ð¹ ÐµÐºÐ·Ð°Ð¼ÐµÐ½ Ð· Ð¼Ð°Ñ‚ÐµÐ¼Ð°Ñ‚Ð¸ÐºÐ¸ Ð½Ð°ÑÑ‚ÑƒÐ¿Ð½Ð¾Ð³Ð¾ Ñ‚Ð¸Ð¶Ð½Ñ.\n\n---\n\n## error-correction: Ð—Ð½Ð°Ð¹Ð´Ñ–Ñ‚ÑŒ Ñ– Ð²Ð¸Ð¿Ñ€Ð°Ð²Ñ‚Ðµ Ð¿Ð¾Ð¼Ð¸Ð»ÐºÑƒ\n\n1. Ð¯ÐºÑ‰Ð¾ Ð¿Ñ€Ð¸Ð¹Ð´Ðµ, Ñ– ÑÐºÐ±Ð¸ Ð¼Ð°Ð² Ñ‡Ð°Ñ, Ð¿Ð¾Ð³Ð¾Ð²Ð¾Ñ€Ð¸Ð¼Ð¾ Ð· Ð½Ð¸Ð¼ ÑÑŒÐ¾Ð³Ð¾Ð´Ð½Ñ–.\n   > [!error] ÑÐºÐ±Ð¸\n   > [!answer] ÑÐºÑ‰Ð¾\n   > [!options] ÑÐºÑ‰Ð¾ | ÐºÐ¾Ð»Ð¸ Ð± | Ñ…Ð¾Ñ‡Ð° | Ñ‚Ð¾Ð¼Ñƒ Ñ‰Ð¾\n   > [!explanation] Ð’ Ð»Ð°Ð½Ñ†ÑŽÐ³Ñƒ Ð²ÑÑ– ÑƒÐ¼Ð¾Ð²Ð¸ Ð¼Ð°ÑŽÑ‚ÑŒ Ð±ÑƒÑ‚Ð¸ Ð°Ð±Ð¾ Ñ€ÐµÐ°Ð»ÑŒÐ½Ð¸Ð¼Ð¸, Ð°Ð±Ð¾ Ð½ÐµÑ€ÐµÐ°Ð»ÑŒÐ½Ð¸Ð¼Ð¸.\n\n2. Ð¯ÐºÐ±Ð¸ Ñ Ð²Ð¸Ð²Ñ‡Ð¸Ð² Ñ‚Ð¾Ð´Ñ–, Ð·Ð°Ñ€Ð°Ð· Ð·Ð½Ð°ÑŽ Ð²Ñ–Ð´Ð¿Ð¾Ð²Ñ–Ð´ÑŒ Ð½Ð° Ð¿Ð¸Ñ‚Ð°Ð½Ð½Ñ.\n   > [!error] Ð·Ð½Ð°ÑŽ\n   > [!answer] Ð±Ð¸ Ð·Ð½Ð°Ð²\n   > [!options] Ð±Ð¸ Ð·Ð½Ð°Ð² | Ð·Ð½Ð°Ñ‚Ð¸Ð¼Ñƒ | Ð·Ð½Ð°Ð² | Ð·Ð½Ð°Ñ”Ñˆ\n   > [!explanation] ÐÐ°ÑÐ»Ñ–Ð´Ð¾Ðº Ñƒ Ð·Ð¼Ñ–ÑˆÐ°Ð½Ñ–Ð¹ ÑƒÐ¼Ð¾Ð²Ñ– Ð¿Ð¾Ñ‚Ñ€ÐµÐ±ÑƒÑ” Ñ‡Ð°ÑÑ‚ÐºÐ¸ Â«Ð±Â».\n\n3. Ð¯ÐºÐ±Ð¸ Ñ Ð±ÑƒÐ² ÑÐ¼Ñ–Ð»Ð¸Ð²Ñ–ÑˆÐ¸Ð¼, ÑÐºÐ°Ð¶Ñƒ Ñ—Ð¹ Ð¿Ñ€Ð°Ð²Ð´Ñƒ Ð¼Ð¸Ð½ÑƒÐ»Ð¾Ð³Ð¾ Ñ‚Ð¸Ð¶Ð½Ñ.\n   > [!error] ÑÐºÐ°Ð¶Ñƒ\n   > [!answer] ÑÐºÐ°Ð·Ð°Ð² Ð±Ð¸\n   > [!options] ÑÐºÐ°Ð·Ð°Ð² Ð±Ð¸ | ÐºÐ°Ð¶Ñƒ | ÑÐºÐ°Ð·Ð°Ñ‚Ð¸ | Ð³Ð¾Ð²Ð¾Ñ€ÑŽ\n   > [!explanation] ÐœÐ¸Ð½ÑƒÐ»Ð° Ð¿Ð¾Ð´Ñ–Ñ Ð²Ð¸Ð¼Ð°Ð³Ð°Ñ” Ð¼Ð¸Ð½ÑƒÐ»Ð¾Ñ— Ñ„Ð¾Ñ€Ð¼Ð¸ Ð· Â«Ð±Â».\n\n4. Ð¯ÐºÐ±Ð¸ Ð¼Ð¸ Ð¿ÐµÑ€ÐµÑ—Ñ…Ð°Ð»Ð¸, Ð·Ð°Ñ€Ð°Ð· Ð± Ð¼Ð¸ Ð¶Ð¸Ð»Ð¸ Ð² ÐšÐ¸Ñ”Ð²Ñ– Ð²Ð¶Ðµ Ð´ÐµÑÑÑ‚ÑŒ Ñ€Ð¾ÐºÑ–Ð².\n   > [!error] Ð± Ð¼Ð¸\n   > [!answer] Ð¼Ð¸ Ð±\n   > [!options] Ð¼Ð¸ Ð± | Ð± Ð²Ð¾Ð½Ð¸ | Ð¼Ð¸ Ð±Ð¸ | Ð± Ð¼Ð¸ Ð±\n   > [!explanation] ÐŸÑ€Ð°Ð²Ð¸Ð»ÑŒÐ½Ð¸Ð¹ Ð¿Ð¾Ñ€ÑÐ´Ð¾Ðº: Ð¿Ñ–Ð´Ð¼ÐµÑ‚ + Ð±.\n\n5. Ð’Ð¸Ð²Ñ‡Ð°Ð¹ ÑÑ‚Ð°Ñ€Ð°Ð½Ð½Ð¾, Ñ‚Ð¾Ð¼Ñƒ Ñ‰Ð¾ Ð½Ðµ Ð·Ð´Ð°ÑÐ¸ ÐµÐºÐ·Ð°Ð¼ÐµÐ½ Ð½Ð°ÑÑ‚ÑƒÐ¿Ð½Ð¾Ð³Ð¾ Ñ‚Ð¸Ð¶Ð½Ñ.\n   > [!error] Ñ‚Ð¾Ð¼Ñƒ Ñ‰Ð¾\n   > [!answer] Ñ–Ð½Ð°ÐºÑˆÐµ\n   > [!options] Ñ–Ð½Ð°ÐºÑˆÐµ | Ñ…Ð¾Ñ‡Ð° | Ð±Ð¾ | Ñ‰Ð¾Ð±\n   > [!explanation] Â«Ð†Ð½Ð°ÐºÑˆÐµÂ» = otherwise, Ð´Ð»Ñ Ð°Ð»ÑŒÑ‚ÐµÑ€Ð½Ð°Ñ‚Ð¸Ð²Ð½Ð¾Ð³Ð¾ Ð½Ð°ÑÐ»Ñ–Ð´ÐºÑƒ.\n\n6. Ð¯ÐºÐ±Ð¸ Ñ Ð²Ð¸Ð²Ñ‡Ð¸Ð², Ñ Ð·Ð½Ð°Ð² Ð± Ð·Ð°Ñ€Ð°Ð· Ð²Ñ–Ð´Ð¿Ð¾Ð²Ñ–Ð´ÑŒ Ð½Ð° Ð¿Ð¸Ñ‚Ð°Ð½Ð½Ñ.\n   > [!error] Ð·Ð½Ð°Ð² Ð±\n   > [!answer] Ð± Ð·Ð½Ð°Ð²\n   > [!options] Ð± Ð·Ð½Ð°Ð² | Ð·Ð½Ð°ÑŽ Ð± | Ð±Ð¸ Ð·Ð½Ð°Ð² | Ð·Ð½Ð°Ð² Ð±Ð¸ Ð±\n   > [!explanation] Â«Ð‘Â» ÑÑ‚Ð¾Ñ—Ñ‚ÑŒ Ð¿ÐµÑ€ÐµÐ´ Ð´Ñ–Ñ”ÑÐ»Ð¾Ð²Ð¾Ð¼: Ñ Ð± Ð·Ð½Ð°Ð².\n\n---\n\n## cloze: Ð—Ð°Ð¿Ð¾Ð²Ð½Ñ–Ñ‚ÑŒ Ð¿Ñ€Ð¾Ð¿ÑƒÑÐºÐ¸ Ð² Ñ‚ÐµÐºÑÑ‚Ñ–\n\nÐžÐ»ÐµÐ½Ð° Ð´ÑƒÐ¼Ð°Ñ” Ð¿Ñ€Ð¾ ÑÐ²Ð¾Ñ” Ð¶Ð¸Ñ‚Ñ‚Ñ. Â«(1)___ Ñ Ñ‚Ð¾Ð´Ñ– Ð²Ð¸Ð²Ñ‡Ð¸Ð»Ð° Ð¿Ñ€Ð¾Ð³Ñ€Ð°Ð¼ÑƒÐ²Ð°Ð½Ð½Ñ, Ð·Ð°Ñ€Ð°Ð· (2)___ Ð¼Ð°Ð»Ð° ÐºÑ€Ð°Ñ‰Ñƒ Ñ€Ð¾Ð±Ð¾Ñ‚Ñƒ. ÐÐ»Ðµ (3)___ Ñ (4)___ Ð±Ñ–Ð»ÑŒÑˆ Ñ†Ñ–Ð»ÐµÑÐ¿Ñ€ÑÐ¼Ð¾Ð²Ð°Ð½Ð¾ÑŽ, Ð¿Ð¾Ñ‡Ð°Ð»Ð° (5)___ Ñ€Ð°Ð½Ñ–ÑˆÐµ. Ð (6)___ Ñ Ð¿Ð¾Ñ‡Ð½Ñƒ Ð·Ð°Ñ€Ð°Ð·, (7)___ ÑÐºÑ‰Ð¾ Ð±ÑƒÐ´Ñƒ ÑÑ‚Ð°Ñ€Ð°Ð½Ð½Ð¾ÑŽ, Ð·Ð° Ñ€Ñ–Ðº (8)___ Ñ€ÐµÐ·ÑƒÐ»ÑŒÑ‚Ð°Ñ‚Ñƒ. (9)___ Ð²Ð¸Ð²Ñ‡Ñƒ Python, Ð·Ð½Ð°Ð¹Ð´Ñƒ Ð½Ð¾Ð²Ñƒ Ñ€Ð¾Ð±Ð¾Ñ‚Ñƒ. Ð (10)___ Ð·Ð½Ð°Ð¹Ð´Ñƒ Ñ€Ð¾Ð±Ð¾Ñ‚Ñƒ, (11)___ Ð±Ñ–Ð»ÑŒÑˆÐµ. (12)___ Ñ†Ðµ Ð»Ð°Ð½Ñ†ÑŽÐ³: Ð¾Ð´Ð½Ð° Ð´Ñ–Ñ Ð²ÐµÐ´Ðµ Ð´Ð¾ Ñ–Ð½ÑˆÐ¾Ñ—. (13)___, Ð¿Ð¾Ñ‚Ñ€Ñ–Ð±Ð½Ð¾ Ð¿Ñ€Ð°Ñ†ÑŽÐ²Ð°Ñ‚Ð¸ ÑÑ‚Ð°Ñ€Ð°Ð½Ð½Ð¾, (14)___ Ð½Ñ–Ñ‡Ð¾Ð³Ð¾ Ð½Ðµ Ð·Ð¼Ñ–Ð½Ð¸Ñ‚ÑŒÑÑ.Â»\n\n- (1) :: Ð¯ÐºÐ±Ð¸ | Ð¯ÐºÑ‰Ð¾ | ÐšÐ¾Ð»Ð¸ | Ð¥Ð¾Ñ‡Ð°\n- (2) :: Ð± | Ð±Ð¸ | Ð±Ð° | Ð±Ð¾\n- (3) :: ÑÐºÐ±Ð¸ | ÑÐºÑ‰Ð¾ | ÐºÐ¾Ð»Ð¸ | Ñ…Ð¾Ñ‡Ð°\n- (4) :: Ð±ÑƒÐ»Ð° | Ñ” | Ð±ÑƒÐ´Ñƒ | Ð±ÑƒÑ‚Ð¸\n- (5) :: Ð± | Ð±Ð¸ | Ð±Ð° | Ð±Ð¾\n- (6) :: ÑÐºÑ‰Ð¾ | ÑÐºÐ±Ð¸ | ÐºÐ¾Ð»Ð¸ Ð± | Ñ…Ð¾Ñ‡Ð°\n- (7) :: Ñ– | Ð°Ð±Ð¾ | Ð°Ð»Ðµ | Ñ‡Ð¸\n- (8) :: Ð´Ð¾ÑÑÐ³Ð½Ñƒ | Ð´Ð¾ÑÑÐ³ | Ð´Ð¾ÑÑÐ³Ð°ÑŽ | Ð´Ð¾ÑÑÐ³Ñ‚Ð¸\n- (9) :: Ð¯ÐºÑ‰Ð¾ | Ð¯ÐºÐ±Ð¸ | ÐšÐ¾Ð»Ð¸ Ð± | Ð¥Ð¾Ñ‡Ð°\n- (10) :: ÑÐºÑ‰Ð¾ | ÑÐºÐ±Ð¸ | ÐºÐ¾Ð»Ð¸ Ð± | Ñ…Ð¾Ñ‡Ð°\n- (11) :: Ð·Ð°Ñ€Ð¾Ð±Ð»ÑÑ‚Ð¸ | Ð·Ð°Ñ€Ð¾Ð±Ð¸Ð»Ð° | Ð·Ð°Ñ€Ð¾Ð±Ð»ÑÑŽ | Ð·Ð°Ñ€Ð¾Ð±Ð»ÑÑ‚Ð¸Ð¼Ñƒ\n- (12) :: Ð‘Ð°Ñ‡Ñƒ | Ð‘Ð°Ñ‡Ð¸Ð² | Ð‘Ð°Ñ‡Ð¸Ñˆ | Ð‘Ð°Ñ‡Ð¸Ð»Ð¸\n- (13) :: ÐžÑ‚Ð¶Ðµ | Ð¥Ð¾Ñ‡Ð° | Ð¢Ð¾Ð¼Ñƒ | Ð‘Ð¾\n- (14) :: Ñ–Ð½Ð°ÐºÑˆÐµ | Ñ‚Ð¾Ð¼Ñƒ | Ñ…Ð¾Ñ‡Ð° | Ð±Ð¾\n\n---\n\n## mark-the-words: ÐŸÐ¾Ð·Ð½Ð°Ñ‡Ñ‚Ðµ Ñ‡Ð°ÑÐ¾Ð²Ñ– Ð¼Ð°Ñ€ÐºÐµÑ€Ð¸ Ñ‚Ð° ÑÐ¿Ð¾Ð»ÑƒÑ‡Ð½Ð¸ÐºÐ¸ ÑƒÐ¼Ð¾Ð²Ð¸\n\n[Ð¯ÐºÐ±Ð¸] Ñ Ð²Ð¸Ð²Ñ‡Ð¸Ð² [Ñ‚Ð¾Ð´Ñ–], [Ð·Ð°Ñ€Ð°Ð·] Ð±Ð¸ Ð·Ð½Ð°Ð² Ð²Ñ–Ð´Ð¿Ð¾Ð²Ñ–Ð´ÑŒ. [Ð¯ÐºÐ±Ð¸] Ð²Ñ–Ð½ Ð±ÑƒÐ² ÑÐ¼Ñ–Ð»Ð¸Ð²Ñ–ÑˆÐ¸Ð¼, ÑÐºÐ°Ð·Ð°Ð² Ð±Ð¸ [Ñ‚Ð¾Ð´Ñ–] Ð¿Ñ€Ð°Ð²Ð´Ñƒ. [Ð¯ÐºÑ‰Ð¾] Ð¿Ñ€Ð¸Ð¹Ð´Ðµ, [Ñ– ÑÐºÑ‰Ð¾] Ð¼Ð°Ñ‚Ð¸Ð¼Ðµ Ñ‡Ð°Ñ, Ð¿Ð¾Ð³Ð¾Ð²Ð¾Ñ€Ð¸Ð¼Ð¾. [Ð†Ð½Ð°ÐºÑˆÐµ] Ð½Ðµ Ð²ÑÑ‚Ð¸Ð³Ð½ÐµÐ¼Ð¾ Ð½Ð° Ð¿Ð¾Ñ‚ÑÐ³. [Ð£ Ñ‚Ð°ÐºÐ¾Ð¼Ñƒ Ñ€Ð°Ð·Ñ–] Ð·Ð°Ð»Ð¸ÑˆÐ¸Ð¼Ð¾ÑÑ Ð²Ð´Ð¾Ð¼Ð°. [Ð¯ÐºÐ±Ð¸] Ð¼Ð¸ Ð¿ÐµÑ€ÐµÑ—Ñ…Ð°Ð»Ð¸ [Ñ‚Ð¾Ð´Ñ–], [Ð·Ð°Ñ€Ð°Ð·] Ð±Ð¸ Ð¶Ð¸Ð»Ð¸ Ð² ÐšÐ¸Ñ”Ð²Ñ–. [Ð’ Ñ–Ð½ÑˆÐ¾Ð¼Ñƒ Ð²Ð¸Ð¿Ð°Ð´ÐºÑƒ] Ð´Ð¾Ð²ÐµÐ´ÐµÑ‚ÑŒÑÑ Ñ‡ÐµÐºÐ°Ñ‚Ð¸.\n\n---\n\n## dialogue-reorder: Ð’Ð¿Ð¾Ñ€ÑÐ´ÐºÑƒÐ¹Ñ‚Ðµ Ð´Ñ–Ð°Ð»Ð¾Ð³\n\n- Ð ÑÐºÐ±Ð¸ Ñ‚Ð¸ Ð¼Ð°Ð»Ð° Ñ–Ð½ÑˆÑƒ Ð¿Ñ€Ð¾Ñ„ÐµÑÑ–ÑŽ, Ñ‡Ð¸ Ð±ÑƒÐ»Ð° Ð± Ñ‰Ð°ÑÐ»Ð¸Ð²Ñ–ÑˆÐ¾ÑŽ?\n- Ð—Ð½Ð°Ñ”Ñˆ, ÑÐºÐ±Ð¸ Ñ Ð²Ð¸Ð²Ñ‡Ð¸Ð»Ð° Ð¿Ñ€Ð¾Ð³Ñ€Ð°Ð¼ÑƒÐ²Ð°Ð½Ð½Ñ Ñ‚Ð¾Ð´Ñ–, Ð·Ð°Ñ€Ð°Ð· Ð¼Ð°Ð»Ð° Ð± ÐºÑ€Ð°Ñ‰Ñƒ Ð·Ð°Ñ€Ð¿Ð»Ð°Ñ‚Ñƒ.\n- ÐœÐ¾Ð¶Ð»Ð¸Ð²Ð¾. ÐÐ»Ðµ ÑÐºÐ±Ð¸ Ð¼Ð°Ð»Ð° Ñ–Ð½ÑˆÑƒ Ñ€Ð¾Ð±Ð¾Ñ‚Ñƒ, Ð¼Ð¾Ð¶Ð»Ð¸Ð²Ð¾, Ð¼ÐµÐ½ÑˆÐµ Ñ‡Ð°ÑÑƒ Ð´Ð»Ñ ÑÑ–Ð¼'Ñ—.\n- Ð¢Ð¸ Ð¿Ñ€Ð°Ð²Ð°. Ð¯ÐºÐ±Ð¸ Ð¼Ð¸ Ð·Ð°Ð²Ð¶Ð´Ð¸ Ð¾Ð±Ð¸Ñ€Ð°Ð»Ð¸ Ð³Ñ€Ð¾ÑˆÑ–, Ð²Ñ‚Ñ€Ð°Ñ‚Ð¸Ð»Ð¸ Ð± Ñ–Ð½ÑˆÑ– Ñ€ÐµÑ‡Ñ–.\n- Ð¡Ð°Ð¼Ðµ Ñ‚Ð°Ðº. Ð¯ÐºÐ±Ð¸ Ð¼Ð¾Ð³Ð»Ð° Ð¿Ð¾Ð²ÐµÑ€Ð½ÑƒÑ‚Ð¸ Ñ‡Ð°Ñ, Ð·Ñ€Ð¾Ð±Ð¸Ð»Ð° Ð± Ñ‚Ð¾Ð¹ ÑÐ°Ð¼Ð¸Ð¹ Ð²Ð¸Ð±Ñ–Ñ€.\n- Ð‘Ð°Ñ‡Ð¸Ñˆ, Ð·Ð½Ð°Ñ‡Ð¸Ñ‚ÑŒ Ñ‚Ð¸ Ð½Ð° Ð¿Ñ€Ð°Ð²Ð¸Ð»ÑŒÐ½Ð¾Ð¼Ñƒ ÑˆÐ»ÑÑ…Ñƒ Ð² Ð¶Ð¸Ñ‚Ñ‚Ñ–!\n\n> [!answer]\n> 1. Ð—Ð½Ð°Ñ”Ñˆ, ÑÐºÐ±Ð¸ Ñ Ð²Ð¸Ð²Ñ‡Ð¸Ð»Ð° Ð¿Ñ€Ð¾Ð³Ñ€Ð°Ð¼ÑƒÐ²Ð°Ð½Ð½Ñ Ñ‚Ð¾Ð´Ñ–, Ð·Ð°Ñ€Ð°Ð· Ð¼Ð°Ð»Ð° Ð± ÐºÑ€Ð°Ñ‰Ñƒ Ð·Ð°Ñ€Ð¿Ð»Ð°Ñ‚Ñƒ.\n> 2. Ð ÑÐºÐ±Ð¸ Ñ‚Ð¸ Ð¼Ð°Ð»Ð° Ñ–Ð½ÑˆÑƒ Ð¿Ñ€Ð¾Ñ„ÐµÑÑ–ÑŽ, Ñ‡Ð¸ Ð±ÑƒÐ»Ð° Ð± Ñ‰Ð°ÑÐ»Ð¸Ð²Ñ–ÑˆÐ¾ÑŽ?\n> 3. ÐœÐ¾Ð¶Ð»Ð¸Ð²Ð¾. ÐÐ»Ðµ ÑÐºÐ±Ð¸ Ð¼Ð°Ð»Ð° Ñ–Ð½ÑˆÑƒ Ñ€Ð¾Ð±Ð¾Ñ‚Ñƒ, Ð¼Ð¾Ð¶Ð»Ð¸Ð²Ð¾, Ð¼ÐµÐ½ÑˆÐµ Ñ‡Ð°ÑÑƒ Ð´Ð»Ñ ÑÑ–Ð¼'Ñ—.\n> 4. Ð¢Ð¸ Ð¿Ñ€Ð°Ð²Ð°. Ð¯ÐºÐ±Ð¸ Ð¼Ð¸ Ð·Ð°Ð²Ð¶Ð´Ð¸ Ð¾Ð±Ð¸Ñ€Ð°Ð»Ð¸ Ð³Ñ€Ð¾ÑˆÑ–, Ð²Ñ‚Ñ€Ð°Ñ‚Ð¸Ð»Ð¸ Ð± Ñ–Ð½ÑˆÑ– Ñ€ÐµÑ‡Ñ–.\n> 5. Ð¡Ð°Ð¼Ðµ Ñ‚Ð°Ðº. Ð¯ÐºÐ±Ð¸ Ð¼Ð¾Ð³Ð»Ð° Ð¿Ð¾Ð²ÐµÑ€Ð½ÑƒÑ‚Ð¸ Ñ‡Ð°Ñ, Ð·Ñ€Ð¾Ð±Ð¸Ð»Ð° Ð± Ñ‚Ð¾Ð¹ ÑÐ°Ð¼Ð¸Ð¹ Ð²Ð¸Ð±Ñ–Ñ€.\n> 6. Ð‘Ð°Ñ‡Ð¸Ñˆ, Ð·Ð½Ð°Ñ‡Ð¸Ñ‚ÑŒ Ñ‚Ð¸ Ð½Ð° Ð¿Ñ€Ð°Ð²Ð¸Ð»ÑŒÐ½Ð¾Ð¼Ñƒ ÑˆÐ»ÑÑ…Ñƒ Ð² Ð¶Ð¸Ñ‚Ñ‚Ñ–!\n\n---\n\n## select: Ð’Ð¸Ð±ÐµÑ€Ñ–Ñ‚ÑŒ ÑƒÑÑ– Ð³Ñ€Ð°Ð¼Ð°Ñ‚Ð¸Ñ‡Ð½Ð¾ Ð¿Ñ€Ð°Ð²Ð¸Ð»ÑŒÐ½Ñ– Ñ€ÐµÑ‡ÐµÐ½Ð½Ñ\n\n- [x] Ð¯ÐºÐ±Ð¸ Ñ Ð²Ð¸Ð²Ñ‡Ð¸Ð² Ñ‚Ð¾Ð´Ñ–, Ð·Ð°Ñ€Ð°Ð· Ð±Ð¸ Ð·Ð½Ð°Ð² Ð²Ñ–Ð´Ð¿Ð¾Ð²Ñ–Ð´ÑŒ.\n- [ ] Ð¯ÐºÐ±Ð¸ Ñ Ð²Ð¸Ð²Ñ‡Ð¸Ð² Ñ‚Ð¾Ð´Ñ–, Ð·Ð°Ñ€Ð°Ð· Ð·Ð½Ð°ÑŽ Ð²Ñ–Ð´Ð¿Ð¾Ð²Ñ–Ð´ÑŒ.\n- [x] Ð¯ÐºÑ‰Ð¾ Ð¿Ñ€Ð¸Ð¹Ð´Ðµ, Ñ– ÑÐºÑ‰Ð¾ Ð¼Ð°Ñ‚Ð¸Ð¼Ðµ Ñ‡Ð°Ñ, Ð¿Ð¾Ð³Ð¾Ð²Ð¾Ñ€Ð¸Ð¼Ð¾.\n- [ ] Ð¯ÐºÑ‰Ð¾ Ð¿Ñ€Ð¸Ð¹Ð´Ðµ, Ñ– ÑÐºÐ±Ð¸ Ð¼Ð°Ð² Ñ‡Ð°Ñ, Ð¿Ð¾Ð³Ð¾Ð²Ð¾Ñ€Ð¸Ð¼Ð¾.\n- [x] Ð¯ÐºÐ±Ð¸ Ñ Ð±ÑƒÐ² ÑÐ¼Ñ–Ð»Ð¸Ð²Ñ–ÑˆÐ¸Ð¼, ÑÐºÐ°Ð·Ð°Ð² Ð±Ð¸ Ñ‚Ð¾Ð´Ñ–.\n- [ ] Ð¯ÐºÐ±Ð¸ Ñ Ñ” ÑÐ¼Ñ–Ð»Ð¸Ð²Ñ–ÑˆÐ¸Ð¼, ÑÐºÐ°Ð·Ð°Ð² Ð±Ð¸ Ñ‚Ð¾Ð´Ñ–.\n- [x] Ð’Ð¸Ð²Ñ‡Ð°Ð¹ ÑÑ‚Ð°Ñ€Ð°Ð½Ð½Ð¾, Ñ–Ð½Ð°ÐºÑˆÐµ Ð½Ðµ Ð·Ð´Ð°ÑÐ¸ ÐµÐºÐ·Ð°Ð¼ÐµÐ½.\n- [ ] Ð’Ð¸Ð²Ñ‡Ð°Ð¹ ÑÑ‚Ð°Ñ€Ð°Ð½Ð½Ð¾, Ñ‚Ð¾Ð¼Ñƒ Ñ‰Ð¾ Ð½Ðµ Ð·Ð´Ð°ÑÐ¸ ÐµÐºÐ·Ð°Ð¼ÐµÐ½.\n\n---\n\n## translate: ÐŸÐµÑ€ÐµÐºÐ»Ð°Ð´Ñ–Ñ‚ÑŒ Ð½Ð° ÑƒÐºÑ€Ð°Ñ—Ð½ÑÑŒÐºÑƒ Ð¼Ð¾Ð²Ñƒ\n\n1. If I had studied then, I would know the answer now.\n   - [x] Ð¯ÐºÐ±Ð¸ Ñ Ð²Ð¸Ð²Ñ‡Ð¸Ð² Ñ‚Ð¾Ð´Ñ–, Ð·Ð°Ñ€Ð°Ð· Ð±Ð¸ Ð·Ð½Ð°Ð² Ð²Ñ–Ð´Ð¿Ð¾Ð²Ñ–Ð´ÑŒ.\n   - [ ] Ð¯ÐºÑ‰Ð¾ Ñ Ð²Ð¸Ð²Ñ‡Ñƒ, Ð·Ð½Ð°Ñ‚Ð¸Ð¼Ñƒ Ð²Ñ–Ð´Ð¿Ð¾Ð²Ñ–Ð´ÑŒ.\n   - [ ] Ð¯ÐºÐ±Ð¸ Ñ Ð²Ð¸Ð²Ñ‡Ñƒ, Ð·Ð½Ð°ÑŽ Ð²Ñ–Ð´Ð¿Ð¾Ð²Ñ–Ð´ÑŒ.\n   - [ ] Ð¯ÐºÑ‰Ð¾ Ð²Ð¸Ð²Ñ‡Ð¸Ð², Ð·Ð½Ð°ÑŽ Ñ‚ÐµÐ¿ÐµÑ€.\n\n2. If he were braver, he would have told her the truth yesterday.\n   - [x] Ð¯ÐºÐ±Ð¸ Ð²Ñ–Ð½ Ð±ÑƒÐ² ÑÐ¼Ñ–Ð»Ð¸Ð²Ñ–ÑˆÐ¸Ð¼, Ð²Ñ–Ð½ Ð±Ð¸ ÑÐºÐ°Ð·Ð°Ð² Ñ—Ð¹ Ð¿Ñ€Ð°Ð²Ð´Ñƒ Ð²Ñ‡Ð¾Ñ€Ð°.\n   - [ ] Ð¯ÐºÑ‰Ð¾ Ð²Ñ–Ð½ ÑÐ¼Ñ–Ð»Ð¸Ð²Ð¸Ð¹, ÑÐºÐ°Ð¶Ðµ Ñ—Ð¹ Ð¿Ñ€Ð°Ð²Ð´Ñƒ.\n   - [ ] Ð¯ÐºÐ±Ð¸ Ð²Ñ–Ð½ Ñ” ÑÐ¼Ñ–Ð»Ð¸Ð²Ð¸Ð¹, ÑÐºÐ°Ð·Ð°Ð² Ð±Ð¸.\n   - [ ] ÐšÐ¾Ð»Ð¸ Ð±ÑƒÐ² ÑÐ¼Ñ–Ð»Ð¸Ð²Ð¸Ð¹, ÑÐºÐ°Ð·Ð°Ð² Ð¿Ñ€Ð°Ð²Ð´Ñƒ.\n\n3. If it rains, and if we can't go outside, we will watch a movie.\n   - [x] Ð¯ÐºÑ‰Ð¾ Ð±ÑƒÐ´Ðµ Ð´Ð¾Ñ‰, Ñ– ÑÐºÑ‰Ð¾ Ð½Ðµ Ð·Ð¼Ð¾Ð¶ÐµÐ¼Ð¾ Ð²Ð¸Ð¹Ñ‚Ð¸, Ð¿Ð¾Ð´Ð¸Ð²Ð¸Ð¼Ð¾ÑÑ Ñ„Ñ–Ð»ÑŒÐ¼.\n   - [ ] Ð¯ÐºÐ±Ð¸ Ð´Ð¾Ñ‰, Ñ– ÑÐºÑ‰Ð¾ Ð²Ð¸Ð¹Ð´ÐµÐ¼Ð¾, Ñ„Ñ–Ð»ÑŒÐ¼.\n   - [ ] Ð¯ÐºÑ‰Ð¾ Ð´Ð¾Ñ‰, Ñ– ÑÐºÐ±Ð¸ Ð²Ð¸Ð¹ÑˆÐ»Ð¸, Ð¿Ð¾Ð´Ð¸Ð²Ð¸Ð¼Ð¾ÑÑ.\n   - [ ] ÐšÐ¾Ð»Ð¸ Ð´Ð¾Ñ‰ Ñ– Ð½Ðµ Ð²Ð¸Ð¹Ð´ÐµÐ¼Ð¾, Ñ„Ñ–Ð»ÑŒÐ¼.\n\n4. Study hard, otherwise you won't pass the exam.\n   - [x] Ð’Ð¸Ð²Ñ‡Ð°Ð¹ ÑÑ‚Ð°Ñ€Ð°Ð½Ð½Ð¾, Ñ–Ð½Ð°ÐºÑˆÐµ Ð½Ðµ Ð·Ð´Ð°ÑÐ¸ ÐµÐºÐ·Ð°Ð¼ÐµÐ½.\n   - [ ] Ð’Ð¸Ð²Ñ‡Ð°Ð¹ ÑÑ‚Ð°Ñ€Ð°Ð½Ð½Ð¾, Ñ‚Ð¾Ð¼Ñƒ Ñ‰Ð¾ Ð·Ð´Ð°ÑÐ¸ ÐµÐºÐ·Ð°Ð¼ÐµÐ½.\n   - [ ] Ð’Ð¸Ð²Ñ‡Ð°Ñ”Ñˆ ÑÑ‚Ð°Ñ€Ð°Ð½Ð½Ð¾, Ñ…Ð¾Ñ‡Ð° Ð½Ðµ Ð·Ð´Ð°ÑÐ¸.\n   - [ ] Ð’Ð¸Ð²Ñ‡Ð¸ ÑÑ‚Ð°Ñ€Ð°Ð½Ð½Ð¾, Ð±Ð¾ Ð·Ð´Ð°ÑÐ¸ ÐµÐºÐ·Ð°Ð¼ÐµÐ½.\n\n5. If we had moved then, we would be living in Kyiv now.\n   - [x] Ð¯ÐºÐ±Ð¸ Ð¼Ð¸ Ð¿ÐµÑ€ÐµÑ—Ñ…Ð°Ð»Ð¸ Ñ‚Ð¾Ð´Ñ–, Ð·Ð°Ñ€Ð°Ð· Ð±Ð¸ Ð¶Ð¸Ð»Ð¸ Ð² ÐšÐ¸Ñ”Ð²Ñ–.\n   - [ ] Ð¯ÐºÑ‰Ð¾ Ð¿ÐµÑ€ÐµÑ—Ð´ÐµÐ¼Ð¾, Ð±ÑƒÐ´ÐµÐ¼Ð¾ Ð¶Ð¸Ñ‚Ð¸ Ð² ÐšÐ¸Ñ”Ð²Ñ–.\n   - [ ] Ð¯ÐºÐ±Ð¸ Ð¿ÐµÑ€ÐµÑ—Ð¶Ð´Ð¶Ð°Ñ”Ð¼Ð¾, Ð¶Ð¸Ð²ÐµÐ¼Ð¾ Ð² ÐšÐ¸Ñ”Ð²Ñ–.\n   - [ ] ÐšÐ¾Ð»Ð¸ Ð¿ÐµÑ€ÐµÑ—Ñ…Ð°Ð»Ð¸, Ð¶Ð¸Ð»Ð¸ Ð² ÐšÐ¸Ñ”Ð²Ñ–.\n\n6. If you learn the language, you'll find a job. And if you find a job, you'll earn money.\n   - [x] Ð¯ÐºÑ‰Ð¾ Ð²Ð¸Ð²Ñ‡Ð¸Ñˆ Ð¼Ð¾Ð²Ñƒ, Ð·Ð½Ð°Ð¹Ð´ÐµÑˆ Ñ€Ð¾Ð±Ð¾Ñ‚Ñƒ. Ð ÑÐºÑ‰Ð¾ Ð·Ð½Ð°Ð¹Ð´ÐµÑˆ, Ð·Ð°Ñ€Ð¾Ð±Ð¸Ñˆ Ð³Ñ€Ð¾ÑˆÑ–.\n   - [ ] Ð¯ÐºÐ±Ð¸ Ð²Ð¸Ð²Ñ‡Ð¸Ñˆ, Ð·Ð½Ð°Ð¹ÑˆÐ¾Ð² Ð±Ð¸ Ñ€Ð¾Ð±Ð¾Ñ‚Ñƒ, Ð·Ð°Ñ€Ð¾Ð±Ð¸Ð² Ð³Ñ€Ð¾ÑˆÑ–.\n   - [ ] Ð¯ÐºÑ‰Ð¾ Ð²Ð¸Ð²Ñ‡Ð¸Ð², Ð·Ð½Ð°Ñ…Ð¾Ð´Ð¸Ñˆ Ñ€Ð¾Ð±Ð¾Ñ‚Ñƒ, Ð·Ð°Ñ€Ð¾Ð±Ð»ÑÑ”Ñˆ.\n   - [ ] ÐšÐ¾Ð»Ð¸ Ð²Ð¸Ð²Ñ‡Ð¸Ñˆ Ð¼Ð¾Ð²Ñƒ, Ñ€Ð¾Ð±Ð¾Ñ‚Ñƒ Ð³Ñ€Ð¾ÑˆÑ–.\n\n---\n\n# Ð¡Ð»Ð¾Ð²Ð½Ð¸Ðº\n\n| Ð¡Ð»Ð¾Ð²Ð¾ | Ð’Ð¸Ð¼Ð¾Ð²Ð° | ÐŸÐµÑ€ÐµÐºÐ»Ð°Ð´ | Ð§Ðœ | ÐŸÑ€Ð¸Ð¼Ñ–Ñ‚ÐºÐ° |\n|-------|--------|----------|-----|----------|\n| **Ð·Ð¼Ñ–ÑˆÐ°Ð½Ð¸Ð¹** | /ËˆzmÊ²iÊƒÉ‘nÉªj/ | mixed | Ð¿Ñ€Ð¸ÐºÐ¼. | Ð¿Ð¾Ñ”Ð´Ð½Ð°Ð½Ð½Ñ Ñ€Ñ–Ð·Ð½Ð¸Ñ… Ñ‚Ð¸Ð¿Ñ–Ð² |\n| **Ð»Ð°Ð½Ñ†ÑŽÐ³Ð¾Ð²Ð¸Ð¹** | /lÉ‘nËˆtÍ¡sjuÉ¦É”wÉªj/ | chained | Ð¿Ñ€Ð¸ÐºÐ¼. | Ð¿Ð¾ÑÐ»Ñ–Ð´Ð¾Ð²Ð½Ð¾ Ð·'Ñ”Ð´Ð½Ð°Ð½Ð¸Ð¹ |\n| **Ð½Ð°ÑÐ»Ñ–Ð´Ð¾Ðº** | /nÉ‘ËˆslÊ²idÉ”k/ | consequence | Ñ–Ð¼. (Ñ‡.Ñ€.) | Ñ€ÐµÐ·ÑƒÐ»ÑŒÑ‚Ð°Ñ‚ |\n| **Ñ‚Ð¾Ð´Ñ–** | /tÉ”ËˆdÊ²i/ | then (past) | Ð¿Ñ€Ð¸ÑÐ». | Ð² Ð¼Ð¸Ð½ÑƒÐ»Ð¾Ð¼Ñƒ |\n| **Ð·Ð°Ñ€Ð°Ð·** | /zÉ‘ËˆrÉ‘z/ | now | Ð¿Ñ€Ð¸ÑÐ». | Ð² Ñ‚ÐµÐ¿ÐµÑ€Ñ–ÑˆÐ½ÑŒÐ¾Ð¼Ñƒ |\n| **Ñ–Ð½Ð°ÐºÑˆÐµ** | /iËˆnÉ‘kÊƒÉ›/ | otherwise | Ð¿Ñ€Ð¸ÑÐ». | ÑÐºÑ‰Ð¾ Ð½Ñ– |\n| **Ð² Ñ–Ð½ÑˆÐ¾Ð¼Ñƒ Ð²Ð¸Ð¿Ð°Ð´ÐºÑƒ** | /w ËˆinÊƒÉ”mu ËˆwÉªpÉ‘dku/ | otherwise | Ð²Ð¸Ñ€Ð°Ð· | Ð°Ð»ÑŒÑ‚ÐµÑ€Ð½Ð°Ñ‚Ð¸Ð²Ð° |\n| **Ñƒ Ñ‚Ð°ÐºÐ¾Ð¼Ñƒ Ñ€Ð°Ð·Ñ–** | /u tÉ‘ËˆkÉ”mu ËˆrÉ‘zÊ²i/ | in that case | Ð²Ð¸Ñ€Ð°Ð· | Ð·Ð° Ñ‚Ð°ÐºÐ¸Ñ… ÑƒÐ¼Ð¾Ð² |\n| **Ð¿Ñ€Ð¾Ñ‚Ðµ** | /prÉ”ËˆtÉ›/ | however | ÑÐ¿Ð¾Ð»ÑƒÑ‡Ð½. | ÐºÐ¾Ð½Ñ‚Ñ€Ð°ÑÑ‚ |\n| **Ð¾Ð´Ð½Ð°Ðº** | /É”dËˆnÉ‘k/ | however | ÑÐ¿Ð¾Ð»ÑƒÑ‡Ð½. | Ñ„Ð¾Ñ€Ð¼Ð°Ð»ÑŒÐ½Ð¸Ð¹ ÐºÐ¾Ð½Ñ‚Ñ€Ð°ÑÑ‚ |\n| **Ð°Ð»Ðµ** | /É‘ËˆlÉ›/ | but | ÑÐ¿Ð¾Ð»ÑƒÑ‡Ð½. | Ð¿Ñ€Ð¾Ñ‚Ð¸ÑÑ‚Ð°Ð²Ð»ÐµÐ½Ð½Ñ |\n| **Ñ…Ð¾Ñ‡Ð°** | /xÉ”ËˆtÊƒÉ‘/ | although | ÑÐ¿Ð¾Ð»ÑƒÑ‡Ð½. | Ð´Ð¾Ð¿ÑƒÑÑ‚Ð¾Ð²Ð¸Ð¹ |\n| **Ð½Ð°Ð²Ñ–Ñ‚ÑŒ ÑÐºÑ‰Ð¾** | /nÉ‘ËˆwÊ²itÊ² jÉ‘kËˆÊƒtÊƒÉ”/ | even if | Ð²Ð¸Ñ€Ð°Ð· | Ð¿Ð¾ÑÐ¸Ð»ÐµÐ½Ð° ÑƒÐ¼Ð¾Ð²Ð° |\n| **Ñ‚Ð¸Ð¼ Ð±Ñ–Ð»ÑŒÑˆÐµ** | /tÉªm ËˆbÊ²ilÊ²ÊƒÉ›/ | all the more | Ð²Ð¸Ñ€Ð°Ð· | Ð¿Ñ–Ð´ÑÐ¸Ð»ÐµÐ½Ð½Ñ |\n| **Ñ‚Ð¸Ð¼ Ð¼ÐµÐ½ÑˆÐµ** | /tÉªm ËˆmÉ›nÊƒÉ›/ | all the less | Ð²Ð¸Ñ€Ð°Ð· | Ð¿Ð¾ÑÐ»Ð°Ð±Ð»ÐµÐ½Ð½Ñ |\n| **Ð²ÑÐµ Ð¾Ð´Ð½Ð¾** | /wsÊ²É› É”dËˆnÉ”/ | anyway | Ð¿Ñ€Ð¸ÑÐ». | Ð½ÐµÐ·Ð²Ð°Ð¶Ð°ÑŽÑ‡Ð¸ Ð½Ñ– Ð½Ð° Ñ‰Ð¾ |\n| **Ð² Ð±ÑƒÐ´ÑŒ-ÑÐºÐ¾Ð¼Ñƒ Ñ€Ð°Ð·Ñ–** | /w budÊ²ËˆjÉ‘kÉ”mu ËˆrÉ‘zÊ²i/ | in any case | Ð²Ð¸Ñ€Ð°Ð· | Ð·Ð° Ð±ÑƒÐ´ÑŒ-ÑÐºÐ¸Ñ… Ð¾Ð±ÑÑ‚Ð°Ð²Ð¸Ð½ |\n| **Ñ‚Ð°Ðº Ñ‡Ð¸ Ñ–Ð½Ð°ÐºÑˆÐµ** | /tÉ‘k tÊƒÉª iËˆnÉ‘kÊƒÉ›/ | one way or another | Ð²Ð¸Ñ€Ð°Ð· | Ñƒ Ð±ÑƒÐ´ÑŒ-ÑÐºÐ¾Ð¼Ñƒ Ð²Ð¸Ð¿Ð°Ð´ÐºÑƒ |\n| **ÑÐº Ð±Ð¸ Ñ‚Ð°Ð¼ Ð½Ðµ Ð±ÑƒÐ»Ð¾** | /jÉ‘k bÉª tÉ‘m nÉ› ËˆbulÉ”/ | be that as it may | Ð²Ð¸Ñ€Ð°Ð· | Ð½ÐµÐ·Ð²Ð°Ð¶Ð°ÑŽÑ‡Ð¸ Ð½Ñ– Ð½Ð° Ñ‰Ð¾ |\n| **Ð¿Ñ€Ð¸ Ñ†ÑŒÐ¾Ð¼Ñƒ** | /prÉª ËˆtÍ¡sÊ²É”mu/ | at the same time | Ð²Ð¸Ñ€Ð°Ð· | Ð¾Ð´Ð½Ð¾Ñ‡Ð°ÑÐ½Ð¾ |\n| **Ð´Ð¾ Ñ‚Ð¾Ð³Ð¾ Ð¶** | /dÉ” tÉ”ËˆÉ¦É” Ê’/ | besides, moreover | Ð²Ð¸Ñ€Ð°Ð· | ÐºÑ€Ñ–Ð¼ Ñ‚Ð¾Ð³Ð¾ |\n| **ÐºÑ€Ñ–Ð¼ Ñ‚Ð¾Ð³Ð¾** | /krÊ²im tÉ”ËˆÉ¦É”/ | besides | Ð²Ð¸Ñ€Ð°Ð· | Ð½Ð° Ð´Ð¾Ð´Ð°Ñ‚Ð¾Ðº |\n| **Ð±Ñ–Ð»ÑŒÑˆÐµ Ñ‚Ð¾Ð³Ð¾** | /ËˆbÊ²ilÊ²ÊƒÉ› tÉ”ËˆÉ¦É”/ | moreover | Ð²Ð¸Ñ€Ð°Ð· | Ñ‰Ðµ Ð±Ñ–Ð»ÑŒÑˆÐµ |\n| **ÐºÐ¾Ð½Ñ‚Ñ€Ñ„Ð°ÐºÑ‚Ð¸Ñ‡Ð½Ð¸Ð¹** | /kÉ”ntrfÉ‘kËˆtÉªtÊƒnÉªj/ | counterfactual | Ð¿Ñ€Ð¸ÐºÐ¼. | Ñ‰Ð¾ ÑÑƒÐ¿ÐµÑ€ÐµÑ‡Ð¸Ñ‚ÑŒ Ñ„Ð°ÐºÑ‚Ð°Ð¼ |\n| **Ð°Ð»ÑŒÑ‚ÐµÑ€Ð½Ð°Ñ‚Ð¸Ð²Ð°** | /É‘lÊ²tÉ›rnÉ‘ËˆtÉªwÉ‘/ | alternative | Ñ–Ð¼. (Ð¶.Ñ€.) | Ñ–Ð½ÑˆÐ¸Ð¹ Ð²Ð°Ñ€Ñ–Ð°Ð½Ñ‚ |\n",
    "createdAt": "2025-12-27T21:27:41.272088Z",
    "modifiedAt": "2025-12-27T21:27:41.272088Z",
    "version": 2
  },
  "activities": [],
  "vocabulary": {
    "moduleId": "mod-uk-B1-33",
    "level": "B1",
    "phase": "B1.3a Complex Sentences",
    "wordCount": 25,
    "newWordCount": 25,
    "reviewWordCount": 0,
    "transliterationMode": "none",
    "words": [
      {
        "id": "vocab-1",
        "uk": "**Ð·Ð¼Ñ–ÑˆÐ°Ð½Ð¸Ð¹**",
        "ipa": "/ËˆzmÊ²iÊƒÉ‘nÉªj/",
        "en": "mixed",
        "pos": "Ð¿Ñ€Ð¸ÐºÐ¼.",
        "gender": null,
        "note": ""
      },
      {
        "id": "vocab-2",
        "uk": "**Ð»Ð°Ð½Ñ†ÑŽÐ³Ð¾Ð²Ð¸Ð¹**",
        "ipa": "/lÉ‘nËˆtÍ¡sjuÉ¦É”wÉªj/",
        "en": "chained",
        "pos": "Ð¿Ñ€Ð¸ÐºÐ¼.",
        "gender": null,
        "note": ""
      },
      {
        "id": "vocab-3",
        "uk": "**Ð½Ð°ÑÐ»Ñ–Ð´Ð¾Ðº**",
        "ipa": "/nÉ‘ËˆslÊ²idÉ”k/",
        "en": "consequence",
        "pos": "Ñ–Ð¼. (Ñ‡.Ñ€.)",
        "gender": null,
        "note": ""
      },
      {
        "id": "vocab-4",
        "uk": "**Ñ‚Ð¾Ð´Ñ–**",
        "ipa": "/tÉ”ËˆdÊ²i/",
        "en": "then (past)",
        "pos": "Ð¿Ñ€Ð¸ÑÐ».",
        "gender": null,
        "note": ""
      },
      {
        "id": "vocab-5",
        "uk": "**Ð·Ð°Ñ€Ð°Ð·**",
        "ipa": "/zÉ‘ËˆrÉ‘z/",
        "en": "now",
        "pos": "Ð¿Ñ€Ð¸ÑÐ».",
        "gender": null,
        "note": ""
      },
      {
        "id": "vocab-6",
        "uk": "**Ñ–Ð½Ð°ÐºÑˆÐµ**",
        "ipa": "/iËˆnÉ‘kÊƒÉ›/",
        "en": "otherwise",
        "pos": "Ð¿Ñ€Ð¸ÑÐ».",
        "gender": null,
        "note": ""
      },
      {
        "id": "vocab-7",
        "uk": "**Ð² Ñ–Ð½ÑˆÐ¾Ð¼Ñƒ Ð²Ð¸Ð¿Ð°Ð´ÐºÑƒ**",
        "ipa": "/w ËˆinÊƒÉ”mu ËˆwÉªpÉ‘dku/",
        "en": "otherwise",
        "pos": "Ð²Ð¸Ñ€Ð°Ð·",
        "gender": null,
        "note": ""
      },
      {
        "id": "vocab-8",
        "uk": "**Ñƒ Ñ‚Ð°ÐºÐ¾Ð¼Ñƒ Ñ€Ð°Ð·Ñ–**",
        "ipa": "/u tÉ‘ËˆkÉ”mu ËˆrÉ‘zÊ²i/",
        "en": "in that case",
        "pos": "Ð²Ð¸Ñ€Ð°Ð·",
        "gender": null,
        "note": ""
      },
      {
        "id": "vocab-9",
        "uk": "**Ð¿Ñ€Ð¾Ñ‚Ðµ**",
        "ipa": "/prÉ”ËˆtÉ›/",
        "en": "however",
        "pos": "ÑÐ¿Ð¾Ð»ÑƒÑ‡Ð½.",
        "gender": null,
        "note": ""
      },
      {
        "id": "vocab-10",
        "uk": "**Ð¾Ð´Ð½Ð°Ðº**",
        "ipa": "/É”dËˆnÉ‘k/",
        "en": "however",
        "pos": "ÑÐ¿Ð¾Ð»ÑƒÑ‡Ð½.",
        "gender": null,
        "note": ""
      },
      {
        "id": "vocab-11",
        "uk": "**Ð°Ð»Ðµ**",
        "ipa": "/É‘ËˆlÉ›/",
        "en": "but",
        "pos": "ÑÐ¿Ð¾Ð»ÑƒÑ‡Ð½.",
        "gender": null,
        "note": ""
      },
      {
        "id": "vocab-12",
        "uk": "**Ñ…Ð¾Ñ‡Ð°**",
        "ipa": "/xÉ”ËˆtÊƒÉ‘/",
        "en": "although",
        "pos": "ÑÐ¿Ð¾Ð»ÑƒÑ‡Ð½.",
        "gender": null,
        "note": ""
      },
      {
        "id": "vocab-13",
        "uk": "**Ð½Ð°Ð²Ñ–Ñ‚ÑŒ ÑÐºÑ‰Ð¾**",
        "ipa": "/nÉ‘ËˆwÊ²itÊ² jÉ‘kËˆÊƒtÊƒÉ”/",
        "en": "even if",
        "pos": "Ð²Ð¸Ñ€Ð°Ð·",
        "gender": null,
        "note": ""
      },
      {
        "id": "vocab-14",
        "uk": "**Ñ‚Ð¸Ð¼ Ð±Ñ–Ð»ÑŒÑˆÐµ**",
        "ipa": "/tÉªm ËˆbÊ²ilÊ²ÊƒÉ›/",
        "en": "all the more",
        "pos": "Ð²Ð¸Ñ€Ð°Ð·",
        "gender": null,
        "note": ""
      },
      {
        "id": "vocab-15",
        "uk": "**Ñ‚Ð¸Ð¼ Ð¼ÐµÐ½ÑˆÐµ**",
        "ipa": "/tÉªm ËˆmÉ›nÊƒÉ›/",
        "en": "all the less",
        "pos": "Ð²Ð¸Ñ€Ð°Ð·",
        "gender": null,
        "note": ""
      },
      {
        "id": "vocab-16",
        "uk": "**Ð²ÑÐµ Ð¾Ð´Ð½Ð¾**",
        "ipa": "/wsÊ²É› É”dËˆnÉ”/",
        "en": "anyway",
        "pos": "Ð¿Ñ€Ð¸ÑÐ».",
        "gender": null,
        "note": ""
      },
      {
        "id": "vocab-17",
        "uk": "**Ð² Ð±ÑƒÐ´ÑŒ-ÑÐºÐ¾Ð¼Ñƒ Ñ€Ð°Ð·Ñ–**",
        "ipa": "/w budÊ²ËˆjÉ‘kÉ”mu ËˆrÉ‘zÊ²i/",
        "en": "in any case",
        "pos": "Ð²Ð¸Ñ€Ð°Ð·",
        "gender": null,
        "note": ""
      },
      {
        "id": "vocab-18",
        "uk": "**Ñ‚Ð°Ðº Ñ‡Ð¸ Ñ–Ð½Ð°ÐºÑˆÐµ**",
        "ipa": "/tÉ‘k tÊƒÉª iËˆnÉ‘kÊƒÉ›/",
        "en": "one way or another",
        "pos": "Ð²Ð¸Ñ€Ð°Ð·",
        "gender": null,
        "note": ""
      },
      {
        "id": "vocab-19",
        "uk": "**ÑÐº Ð±Ð¸ Ñ‚Ð°Ð¼ Ð½Ðµ Ð±ÑƒÐ»Ð¾**",
        "ipa": "/jÉ‘k bÉª tÉ‘m nÉ› ËˆbulÉ”/",
        "en": "be that as it may",
        "pos": "Ð²Ð¸Ñ€Ð°Ð·",
        "gender": null,
        "note": ""
      },
      {
        "id": "vocab-20",
        "uk": "**Ð¿Ñ€Ð¸ Ñ†ÑŒÐ¾Ð¼Ñƒ**",
        "ipa": "/prÉª ËˆtÍ¡sÊ²É”mu/",
        "en": "at the same time",
        "pos": "Ð²Ð¸Ñ€Ð°Ð·",
        "gender": null,
        "note": ""
      },
      {
        "id": "vocab-21",
        "uk": "**Ð´Ð¾ Ñ‚Ð¾Ð³Ð¾ Ð¶**",
        "ipa": "/dÉ” tÉ”ËˆÉ¦É” Ê’/",
        "en": "besides, moreover",
        "pos": "Ð²Ð¸Ñ€Ð°Ð·",
        "gender": null,
        "note": ""
      },
      {
        "id": "vocab-22",
        "uk": "**ÐºÑ€Ñ–Ð¼ Ñ‚Ð¾Ð³Ð¾**",
        "ipa": "/krÊ²im tÉ”ËˆÉ¦É”/",
        "en": "besides",
        "pos": "Ð²Ð¸Ñ€Ð°Ð·",
        "gender": null,
        "note": ""
      },
      {
        "id": "vocab-23",
        "uk": "**Ð±Ñ–Ð»ÑŒÑˆÐµ Ñ‚Ð¾Ð³Ð¾**",
        "ipa": "/ËˆbÊ²ilÊ²ÊƒÉ› tÉ”ËˆÉ¦É”/",
        "en": "moreover",
        "pos": "Ð²Ð¸Ñ€Ð°Ð·",
        "gender": null,
        "note": ""
      },
      {
        "id": "vocab-24",
        "uk": "**ÐºÐ¾Ð½Ñ‚Ñ€Ñ„Ð°ÐºÑ‚Ð¸Ñ‡Ð½Ð¸Ð¹**",
        "ipa": "/kÉ”ntrfÉ‘kËˆtÉªtÊƒnÉªj/",
        "en": "counterfactual",
        "pos": "Ð¿Ñ€Ð¸ÐºÐ¼.",
        "gender": null,
        "note": ""
      },
      {
        "id": "vocab-25",
        "uk": "**Ð°Ð»ÑŒÑ‚ÐµÑ€Ð½Ð°Ñ‚Ð¸Ð²Ð°**",
        "ipa": "/É‘lÊ²tÉ›rnÉ‘ËˆtÉªwÉ‘/",
        "en": "alternative",
        "pos": "Ñ–Ð¼. (Ð¶.Ñ€.)",
        "gender": null,
        "note": ""
      }
    ],
    "reviewWords": []
  }
}