{
  "$schema": "../../../schemas/vibe-module.schema.json",
  "lesson": {
    "id": "lesson-uk-B1-38",
    "moduleId": "mod-uk-B1-38",
    "languagePair": "l2-uk-en",
    "subject": "language",
    "owner": "curricula-opus",
    "visibility": "public",
    "language": "uk",
    "targetLevel": "B1",
    "phase": "B1.3b Complex Sentences",
    "moduleNumber": 38,
    "moduleType": "grammar",
    "pedagogy": "TTT",
    "immersionLevel": 0.6,
    "title": "ะะฝัะตะณัะฐััั ัะบะปะฐะดะฝะธั ัะตัะตะฝั",
    "titleUk": null,
    "subtitle": "Complex Sentence Integration",
    "description": "Learner can combine ะฟัะธัะธะฝะพะฒั, ัะฐัะพะฒั, ัะผะพะฒะฝั clauses",
    "objectives": [
      "Learner can combine ะฟัะธัะธะฝะพะฒั, ัะฐัะพะฒั, ัะผะพะฒะฝั clauses",
      "Learner can build multi-clause sentences",
      "Learner can choose appropriate connectors for context"
    ],
    "objectivesUk": null,
    "grammarFocus": [
      "Combining multiple clause types in one sentence",
      "Coordination and subordination together"
    ],
    "tags": [
      "grammar",
      "complex-sentences",
      "integration",
      "synthesis"
    ],
    "totalDuration": 90,
    "transliterationMode": "none",
    "sections": [
      {
        "id": "section-1",
        "name": "ะัะดััะผะพะบ",
        "nameEn": null,
        "type": "summary",
        "content": "**ะฉะพ ะฒะธ ะฝะฐะฒัะธะปะธัั:**\n\n1. **ะกัััะดะฝัััั vs ะฟัะดััะดะฝัััั:** ััััะดะฝั โ ััะฒะฝะพะฟัะฐะฒะฝั ัะฐััะธะฝะธ (ั, ะฐ, ะฐะปะต); ะฟัะดััะดะฝั โ ะทะฐะปะตะถะฝั (ัะพ, ัะบะธะน, ะบะพะปะธ, ัะพะผั ัะพ).\n2. **ะะพะผะฑัะฝัะฒะฐะฝะฝั ัะธะฟัะฒ:** ะฟัะธัะธะฝะฐ + ัะฐั, ัะฐั + ัะผะพะฒะฐ, ะฟัะธัะธะฝะฐ + ัะผะพะฒะฐ.\n3. **ะัะฒะฝั ะฟัะดััะดะฝะพััั:** ะพะดะฝะต ะฟัะดััะดะฝะต ะผะพะถะต ะทะฐะปะตะถะฐัะธ ะฒัะด ัะฝัะพะณะพ (ะดะฒะพััะฒะฝะตะฒั, ััะธััะฒะฝะตะฒั ะบะพะฝััััะบััั).\n4. **ะกัััะดะฝัััั + ะฟัะดััะดะฝัััั:** ะฝะฐะนัะบะปะฐะดะฝััั ัะตัะตะฝะฝั ะฟะพัะดะฝัััั ะพะฑะธะดะฒะฐ ัะธะฟะธ.\n\n**ะัะฝะพะฒะฝะต ะฟัะฐะฒะธะปะพ:**\n\n> ะกะบะปะฐะดะฝั ัะตัะตะฝะฝั ะฑัะดัััััั ะฟะพัััะฟะพะฒะพ: ัะฟะพัะฐัะบั ะณะพะปะพะฒะฝะต, ะฟะพััะผ ัะฐั, ะฟัะธัะธะฝะฐ, ัะผะพะฒะฐ, ะดะตัะฐะปั. ะะฑะตััะณะฐะนัะต ะปะพะณััะฝั ะฟะพัะปัะดะพะฒะฝัััั ั ะฝะต ะฟะตัะตะฒะฐะฝัะฐะถัะนัะต ัะตัะตะฝะฝั!\n\n**ะะฐะปั:**\n\nะฃ ะฝะฐัััะฟะฝะพะผั ะผะพะดัะปั (ะ39) ะผะธ ัะพะทะณะปัะฝะตะผะพ **ะฝะตะฟััะผั ะผะพะฒั** โ ัะบ ะฟะตัะตะดะฐะฒะฐัะธ ััะถั ัะปะพะฒะฐ: ยซะัะฝ ัะบะฐะทะฐะฒ, ัะพ...ยป, ยซะะพะฝะฐ ะทะฐะฟะธัะฐะปะฐ, ัะธ...ยป. ะฆะต ััะฝะดะฐะผะตะฝัะฐะปัะฝะฐ ะฝะฐะฒะธัะบะฐ ะดะปั ะฟะตัะตะบะฐะทั ัะฐ ัะธััะฒะฐะฝะฝั!\n\n> โ **ะกะฐะผะพะฟะตัะตะฒััะบะฐ**\n>\n> ะงะธ ะผะพะถะตัะต ะฒะธ:\n> - [ ] ะัะดััะทะฝะธัะธ ััััะดะฝะธะน ั ะฟัะดััะดะฝะธะน ะทะฒ'ัะทะพะบ?\n> - [ ] ะะพะผะฑัะฝัะฒะฐัะธ ะฟัะธัะธะฝะพะฒั, ัะฐัะพะฒั ัะฐ ัะผะพะฒะฝั ัะตัะตะฝะฝั?\n> - [ ] ะัะดัะฒะฐัะธ ะดะฒะพััะฒะฝะตะฒั ะฟัะดััะดะฝั ะบะพะฝััััะบััั?\n> - [ ] ะะพัะดะฝัะฒะฐัะธ ััััะดะฝัััั ั ะฟัะดััะดะฝัััั ะฒ ะพะดะฝะพะผั ัะตัะตะฝะฝั?\n>\n> ะฏะบัะพ ัะฐะบ โ ะฟะตัะตัะพะดััะต ะดะพ ะฒะฟัะฐะฒ!\n\n---\n\n> [!resources] ๐ง ะะพะฒะฝััะฝั ัะตััััะธ\n>\n> **ะะพะดะฐัะบะพะฒั ะผะฐัะตััะฐะปะธ ะดะปั ะฒะธะฒัะตะฝะฝั:**\n> - ๐ [ะกะธะฝัะฐะบัะธั](https://uk.wikipedia.org/wiki/ะกะธะฝัะฐะบัะธั) โ ะัะบัะฟะตะดัั\n> - ๐บ [Ukrainian Grammar](https://www.youtube.com/@ukrainianlesson) โ ะฒัะดะตะพััะพะบะธ\n> - ๐ง [Ukrainian Lessons Podcast](https://ukrainianlessons.com/) โ ะฟะพะดะบะฐัั ะดะปั ะฒะธะฒัะตะฝะฝั\n\n---"
      },
      {
        "id": "section-2",
        "name": "ะะฟัะฐะฒะธ",
        "nameEn": null,
        "type": "activities",
        "content": "## quiz: ะะธะฑะตัััั ะฟัะฐะฒะธะปัะฝั ะฒัะดะฟะพะฒัะดั\n\n1. ะฏะบะต ัะตัะตะฝะฝั ั ะฟัะธะบะปะฐะดะพะผ ััััะดะฝะพะณะพ ะทะฒ'ัะทะบั ะผัะถ ัะฐััะธะฝะฐะผะธ ะฒ ัะบัะฐัะฝััะบัะน ัะธะฝัะฐะบัะธัะฝัะน ัะธััะตะผั?\n   - [x] ะัะฝ ะฟัะธะนัะพะฒ, ั ะผะธ ะฟะพะณะพะฒะพัะธะปะธ.\n   - [ ] ะัะฝ ะฟัะธะนัะพะฒ, ะบะพะปะธ ั ัะธัะฐะฒ.\n   - [ ] ะัะฝ ะฟัะธะนัะพะฒ, ัะพะผั ัะพ ัะพััะฒ.\n   - [ ] ะัะฝ ะฟัะธะนัะพะฒ, ัะพะฑ ะฟะพะณะพะฒะพัะธัะธ.\n   > ะกะฟะพะปััะฝะธะบ ยซัยป ะท'ัะดะฝัั ััะฒะฝะพะฟัะฐะฒะฝั ัะฐััะธะฝะธ.\n\n2. ะฏะบะต ัะตัะตะฝะฝั ะผัััะธัั ะฟัะดััะดะฝะต ะฟัะธัะธะฝะพะฒะต, ัะบะต ะฟะพััะฝัั ะฟัะธัะธะฝั ะพัะฝะพะฒะฝะพั ะดัั ะฒ ัะตะบััั?\n   - [ ] ะะพะปะธ ะฒัะฝ ะฟัะธะนัะพะฒ, ะผะธ ะพะฑัะดะฐะปะธ.\n   - [x] ะัะฝ ะฝะต ะฟัะธะนัะพะฒ, ัะพะผั ัะพ ะทะฐัะฒะพััะฒ.\n   - [ ] ะฏะบัะพ ะฑัะดะต ัะฐั, ะทะฐัะตะปะตัะพะฝัั.\n   - [ ] ะะฝะธะณะฐ, ัะบั ัะธ ะดะฐะฒ, ััะบะฐะฒะฐ.\n   > ยซะขะพะผั ัะพยป ะฒะบะฐะทัั ะฝะฐ ะฟัะธัะธะฝั.\n\n3. ะกะบัะปัะบะธ ััะฒะฝัะฒ ะฟัะดััะดะฝะพััั ะฒ ัะตัะตะฝะฝั: ยซะฏ ะทะฝะฐั, ัะพ ะฒัะฝ ะฟัะธะนะดะต, ะบะพะปะธ ะทะฐะบัะฝัะธัั ัะพะฑะพััยป?\n   - [ ] ะะดะธะฝ ััะฒะตะฝั ะฟัะดััะดะฝะพััั\n   - [x] ะะฒะฐ ััะฒะฝั ะฟัะดััะดะฝะพััั\n   - [ ] ะขัะธ ััะฒะฝั ะฟัะดััะดะฝะพััั\n   - [ ] ะะตะผะฐั ะฟัะดััะดะฝะธั ัะตัะตะฝั\n   > ยซะฉะพ ะฒัะฝ ะฟัะธะนะดะตยป โ 1 ััะฒะตะฝั, ยซะบะพะปะธ ะทะฐะบัะฝัะธััยป โ 2 ััะฒะตะฝั.\n\n4. ะฏะบะธะน ัะฟะพะปััะฝะธะบ ะฒะธะบะพัะธััะพะฒัััััั ะดะปั ะทัััะฐะฒะปะตะฝะฝั ะดะฒะพั ะดัะน ะฐะฑะพ ัะธััะฐััะน ั ััััะดะฝะพะผั ัะตัะตะฝะฝั?\n   - [ ] ั\n   - [x] ะฐ\n   - [ ] ะฐะฑะพ\n   - [ ] ัะพะผั ัะพ\n   > ยซะยป ะฒะธัะฐะถะฐั ะทัััะฐะฒะปะตะฝะฝั: ยซะัะฝ ัะธัะฐั, ะฐ ะฒะพะฝะฐ ะฟะธัะต.ยป\n\n5. ะฏะบะต ะท ะฝะฐะฒะตะดะตะฝะธั ัะตัะตะฝั ะฟัะฐะฒะธะปัะฝะพ ะบะพะผะฑัะฝัั ัะฐัะพะฒะต ัะฐ ะฟัะธัะธะฝะพะฒะต ะฟัะดััะดะฝั ัะตัะตะฝะฝั ะฒ ะพะดะฝะพะผั?\n   - [x] ะะพะปะธ ะฒัะฝ ะฟัะธะนัะพะฒ, ะผะธ ะฒะถะต ัะฟะฐะปะธ, ัะพะผั ัะพ ะฒัะพะผะธะปะธัั.\n   - [ ] ะขะพะผั ัะพ ะฒัะฝ ะฟัะธะนัะพะฒ ะบะพะปะธ ะผะธ ัะฟะฐะปะธ.\n   - [ ] ะัะฝ ะฟัะธะนัะพะฒ ัะพะผั ัะพ ะบะพะปะธ ะผะธ ัะฟะฐะปะธ.\n   - [ ] ะะพะปะธ ัะพะผั ัะพ ะฒัะฝ ะฟัะธะนัะพะฒ ะผะธ ัะฟะฐะปะธ.\n   > ะัะฐะฒะธะปัะฝะธะน ะฟะพััะดะพะบ: ัะฐั โ ะณะพะปะพะฒะฝะต โ ะฟัะธัะธะฝะฐ.\n\n6. ะฉะพ ัะฐะบะต ะพะทะฝะฐัะฐะปัะฝะต ะฟัะดััะดะฝะต ัะตัะตะฝะฝั ะทะณัะดะฝะพ ะท ัะบัะฐัะฝััะบะพั ัะธะฝัะฐะบัะธัะฝะพั ะบะปะฐัะธััะบะฐัััั ัะบะปะฐะดะฝะธั ัะตัะตะฝั?\n   - [ ] ะะตัะตะฝะฝั, ัะพ ะฒัะดะฟะพะฒัะดะฐั ะฝะฐ ยซัะพะผั?ยป\n   - [ ] ะะตัะตะฝะฝั, ัะพ ะฒัะดะฟะพะฒัะดะฐั ะฝะฐ ยซะบะพะปะธ?ยป\n   - [x] ะะตัะตะฝะฝั, ัะพ ะฒัะดะฟะพะฒัะดะฐั ะฝะฐ ยซัะบะธะน?ยป\n   - [ ] ะะตัะตะฝะฝั, ัะพ ะฒัะดะฟะพะฒัะดะฐั ะฝะฐ ยซัะพ?ยป\n   > ะะทะฝะฐัะฐะปัะฝะต ะฒัะดะฟะพะฒัะดะฐั ะฝะฐ ยซัะบะธะน?ยป, ยซัะบะฐ?ยป, ยซัะบะต?ยป\n\n7. ะฏะบะธะน ัะฟะพะปััะฝะธะบ ะฒะธะบะพัะธััะพะฒัััััั ะดะปั ะฒะธัะฐะถะตะฝะฝั ะฟัะพัะธััะฐะฒะปะตะฝะฝั ะฒ ััััะดะฝะพะผั ัะบะปะฐะดะฝะพะผั ัะตัะตะฝะฝั ัะบัะฐัะฝััะบะพั ะผะพะฒะธ?\n   - [ ] ั\n   - [ ] ะฐ\n   - [x] ะฐะปะต\n   - [ ] ะฐะฑะพ\n   > ยซะะปะตยป ะฒะธัะฐะถะฐั ะฟัะพัะธััะฐะฒะปะตะฝะฝั.\n\n8. ะฃ ัะตัะตะฝะฝั ยซะะฐะผะฐ ะฟะพะฟัะพัะธะปะฐ, ัะพะฑ ั ะบัะฟะธะฒ ัะปัะฑ, ัะบะธะน ะฟะตัะต ะฟะตะบะฐัะฝัยป ัะบัะปัะบะธ ั ะฟัะดััะดะฝะธั ัะตัะตะฝั?\n   - [ ] ะะดะฝะต ะฟัะดััะดะฝะต ัะตัะตะฝะฝั\n   - [x] ะะฒะฐ ะฟัะดััะดะฝะธั ัะตัะตะฝะฝั\n   - [ ] ะขัะธ ะฟัะดััะดะฝะธั ัะตัะตะฝะฝั\n   - [ ] ะะตะผะฐั ะฟัะดััะดะฝะธั ัะตัะตะฝั\n   > ยซะฉะพะฑ ั ะบัะฟะธะฒยป ั ยซัะบะธะน ะฟะตัะตยป โ ะดะฒะฐ ะฟัะดััะดะฝะธั.\n\n---\n\n## match-up: ะ'ัะดะฝะฐะนัะต ัะธะฟ ัะตัะตะฝะฝั ะท ะนะพะณะพ ััะฝะบัััั\n\n- ะฟัะธัะธะฝะพะฒะต ะฟัะดััะดะฝะต :: ะฒัะดะฟะพะฒัะดะฐั ะฝะฐ ะฟะธัะฐะฝะฝั ยซัะพะผั?ยป\n- ัะฐัะพะฒะต ะฟัะดััะดะฝะต :: ะฒัะดะฟะพะฒัะดะฐั ะฝะฐ ะฟะธัะฐะฝะฝั ยซะบะพะปะธ?ยป\n- ัะผะพะฒะฝะต ะฟัะดััะดะฝะต :: ะฒัะดะฟะพะฒัะดะฐั ะฝะฐ ะฟะธัะฐะฝะฝั ยซะทะฐ ัะบะพั ัะผะพะฒะธ?ยป\n- ะพะทะฝะฐัะฐะปัะฝะต ะฟัะดััะดะฝะต :: ะฒัะดะฟะพะฒัะดะฐั ะฝะฐ ะฟะธัะฐะฝะฝั ยซัะบะธะน?ยป\n- ะท'ัััะฒะฐะปัะฝะต ะฟัะดััะดะฝะต :: ะฒัะดะฟะพะฒัะดะฐั ะฝะฐ ะฟะธัะฐะฝะฝั ยซัะพ?ยป\n- ะดะพะฟัััะพะฒะต ะฟัะดััะดะฝะต :: ะฒัะดะฟะพะฒัะดะฐั ะฝะฐ ะฟะธัะฐะฝะฝั ยซะฝะตะทะฒะฐะถะฐััะธ ะฝะฐ ัะพ?ยป\n- ััััะดะฝะต ะทั ัะฟะพะปััะฝะธะบะพะผ ยซัยป :: ัะดะฝะฐะปัะฝะธะน ะทะฒ'ัะทะพะบ ะผัะถ ัะฐััะธะฝะฐะผะธ\n- ััััะดะฝะต ะทั ัะฟะพะปััะฝะธะบะพะผ ยซะฐะปะตยป :: ะฟัะพัะธััะฐะฒะฝะธะน ะทะฒ'ัะทะพะบ\n- ััััะดะฝะต ะทั ัะฟะพะปััะฝะธะบะพะผ ยซะฐยป :: ะทัััะฐะฒะฝะธะน ะทะฒ'ัะทะพะบ\n- ััััะดะฝะต ะทั ัะฟะพะปััะฝะธะบะพะผ ยซะฐะฑะพยป :: ะฐะปััะตัะฝะฐัะธะฒะฝะธะน ะทะฒ'ัะทะพะบ\n- ะดะฒะพััะฒะฝะตะฒะฐ ะฟัะดััะดะฝัััั :: ะฟัะดััะดะฝะต ะทะฐะปะตะถะธัั ะฒัะด ะฟัะดััะดะฝะพะณะพ\n- ะบะพะผะฑัะฝะพะฒะฐะฝะธะน ะทะฒ'ัะทะพะบ :: ััััะดะฝัััั ะฟะปัั ะฟัะดััะดะฝัััั ัะฐะทะพะผ\n\n---\n\n## fill-in: ะะพะฟะพะฒะฝััั ัะตัะตะฝะฝั ะฟัะฐะฒะธะปัะฝะธะผ ัะฟะพะปััะฝะธะบะพะผ\n\n1. ะัะฝ ะฝะต ะฟัะธะนัะพะฒ, ___ ะทะฐัะฒะพััะฒ ะฝะฐะฟะตัะตะดะพะดะฝั.\n   > [!answer] ัะพะผั ัะพ\n   > [!options] ัะพะผั ัะพ | ั | ะฐ | ะฐะฑะพ\n\n2. ะะฐะผะฐ ะณะพััั, ___ ัะฐัะพ ะฟัะธะฑะธัะฐั ะบัะผะฝะฐัั.\n   > [!answer] ะฐ\n   > [!options] ะฐ | ัะพะผั ัะพ | ัะบัะพ | ะบะพะปะธ\n\n3. ะฏ ะทะฝะฐั, ___ ะฒัะฝ ะฟัะธัะดะต ะทะฐะฒััะฐ ะฒัะฐะฝัั.\n   > [!answer] ัะพ\n   > [!options] ัะพ | ะบะพะปะธ | ัะพะผั ัะพ | ัะบัะพ\n\n4. ___ ัะพะฝัะต ะทะฐะนัะปะพ, ะผะธ ะฟััะปะธ ะดะพะดะพะผั.\n   > [!answer] ะะพะปะธ\n   > [!options] ะะพะปะธ | ะขะพะผั ัะพ | ะฉะพ | ะะปะต\n\n5. ะะฝะธะณะฐ, ___ ัะธ ะดะฐะฒ ะผะตะฝั, ะดัะถะต ััะบะฐะฒะฐ.\n   > [!answer] ัะบั\n   > [!options] ัะบั | ัะพ | ะบะพะปะธ | ัะพะผั ัะพ\n\n6. ___ ะฑัะดะต ัะฐั, ะทะฐัะตะปะตัะพะฝัั ัะพะฑั ะฒะฒะตัะตัั.\n   > [!answer] ะฏะบัะพ\n   > [!options] ะฏะบัะพ | ะะพะปะธ | ะขะพะผั ัะพ | ะฉะพ\n\n7. ะัะฝ ัะพััะฒ ะดะพะฟะพะผะพะณัะธ, ___ ะฝะต ะทะฝะฐะฒ ัะบ.\n   > [!answer] ะฐะปะต\n   > [!options] ะฐะปะต | ั | ะฐะฑะพ | ัะพ\n\n8. ___ ะฒัะฝ ะฟะพะฟัะพัะธะฒ, ะผะธ ะดะพะฟะพะผะพะณะปะธ ะนะพะผั.\n   > [!answer] ะัะบัะปัะบะธ\n   > [!options] ะัะบัะปัะบะธ | ะฉะพ | ะฏะบะธะน | ะะปะต\n\n---\n\n## true-false: ะัะฐะฒะดะฐ ัะธ ะฝะตะฟัะฐะฒะดะฐ?\n\n1. ะกัััะดะฝะธะน ะทะฒ'ัะทะพะบ ะฟะพัะดะฝัั ััะฒะฝะพะฟัะฐะฒะฝั ัะฐััะธะฝะธ ัะตัะตะฝะฝั.\n   - [x] ะัะฐะฒะดะฐ\n   - [ ] ะะตะฟัะฐะฒะดะฐ\n\n2. ะัะดััะดะฝะต ัะตัะตะฝะฝั ะทะฐะฒะถะดะธ ััะพััั ะฟะตัะตะด ะณะพะปะพะฒะฝะธะผ.\n   - [ ] ะัะฐะฒะดะฐ\n   - [x] ะะตะฟัะฐะฒะดะฐ\n\n3. ะกะฟะพะปััะฝะธะบ ยซะฐยป ะฒะธัะฐะถะฐั ะฟัะพัะธััะฐะฒะปะตะฝะฝั.\n   - [ ] ะัะฐะฒะดะฐ\n   - [x] ะะตะฟัะฐะฒะดะฐ\n\n4. ะะทะฝะฐัะฐะปัะฝะต ะฟัะดััะดะฝะต ะฒัะดะฟะพะฒัะดะฐั ะฝะฐ ะฟะธัะฐะฝะฝั ยซัะบะธะน?ยป.\n   - [x] ะัะฐะฒะดะฐ\n   - [ ] ะะตะฟัะฐะฒะดะฐ\n\n5. ะ ะพะดะฝะพะผั ัะตัะตะฝะฝั ะผะพะถะต ะฑััะธ ััะปัะบะธ ะพะดะฝะต ะฟัะดััะดะฝะต.\n   - [ ] ะัะฐะฒะดะฐ\n   - [x] ะะตะฟัะฐะฒะดะฐ\n\n6. ะะฒะพััะฒะฝะตะฒะฐ ะฟัะดััะดะฝัััั โ ัะต ะบะพะปะธ ะฟัะดััะดะฝะต ะทะฐะปะตะถะธัั ะฒัะด ะฟัะดััะดะฝะพะณะพ.\n   - [x] ะัะฐะฒะดะฐ\n   - [ ] ะะตะฟัะฐะฒะดะฐ\n\n7. ะกะฟะพะปััะฝะธะบ ยซัะพะผั ัะพยป ะฒะฒะพะดะธัั ัะฐัะพะฒะต ะฟัะดััะดะฝะต ัะตัะตะฝะฝั.\n   - [ ] ะัะฐะฒะดะฐ\n   - [x] ะะตะฟัะฐะฒะดะฐ\n\n8. ะกัััะดะฝัััั ั ะฟัะดััะดะฝัััั ะผะพะถะฝะฐ ะฟะพัะดะฝัะฒะฐัะธ ะฒ ะพะดะฝะพะผั ัะตัะตะฝะฝั.\n   - [x] ะัะฐะฒะดะฐ\n   - [ ] ะะตะฟัะฐะฒะดะฐ\n\n---\n\n## group-sort: ะะพะทะฟะพะดัะปััั ัะฟะพะปััะฝะธะบะธ ะทะฐ ัะธะฟะพะผ ะทะฒ'ัะทะบั\n\n### ะกัััะดะฝั (ััะฒะฝะพะฟัะฐะฒะฝั ัะฐััะธะฝะธ)\n- ั\n- ัะฐ\n- ะฐ\n- ะฐะปะต\n- ะฟัะพัะต\n- ะฐะฑะพ\n\n### ะัะดััะดะฝั ะฟัะธัะธะฝะพะฒั\n- ัะพะผั ัะพ\n- ะฑะพ\n- ะพัะบัะปัะบะธ\n- ัะตัะตะท ัะต ัะพ\n\n### ะัะดััะดะฝั ัะฐัะพะฒั\n- ะบะพะปะธ\n- ะฟััะปั ัะพะณะพ ัะบ\n- ะฟะตัั ะฝัะถ\n- ะฟะพะบะธ\n\n### ะัะดััะดะฝั ะพะทะฝะฐัะฐะปัะฝั\n- ัะบะธะน\n- ัะบะฐ\n- ัะบะต\n- ะบะพััะธะน\n\n---\n\n## unjumble: ะกะบะปะฐะดััั ัะตัะตะฝะฝั ะท ัะพะทัะธะฟะฐะฝะธั ัะปัะฒ\n\n1. ะฒัะฝ / ะฟัะธะนัะพะฒ / , / ะบะพะปะธ / ั / ัะธัะฐะฒ / ะบะฝะธะณั / ััะบะฐะฒั / , / ัะบั / ัะธ / ะฟะพะดะฐััะฒะฐะฒ / ะผะตะฝั\n   > [!answer] ะัะฝ ะฟัะธะนัะพะฒ, ะบะพะปะธ ั ัะธัะฐะฒ ััะบะฐะฒั ะบะฝะธะณั, ัะบั ัะธ ะผะตะฝั ะฟะพะดะฐััะฒะฐะฒ.\n\n2. ัะพะผั / ัะพ / ะฝะฐะฟะตัะตะดะพะดะฝั / ะทะฐัะฒะพััะฒ / , / ะฒัะฝ / ะฝะต / ะฟัะธะนัะพะฒ / ะฝะฐ / ะฒะฐะถะปะธะฒั / ะทัััััั / ััะพัะฐ\n   > [!answer] ะัะฝ ะฝะต ะฟัะธะนัะพะฒ ะฝะฐ ะฒะฐะถะปะธะฒั ะทัััััั ััะพัะฐ, ัะพะผั ัะพ ะฝะฐะฟะตัะตะดะพะดะฝั ะทะฐัะฒะพััะฒ.\n\n3. ะผะฐะผะฐ / ะณะพััั / ัะผะฐัะฝั / ะฒะตัะตัั / , / ั / ัะฐัะพ / ะดะพะฟะพะผะฐะณะฐั / ัะน / ะฝะฐ / ะบััะฝั / ะบะพะถะฝะพะณะพ / ะฒะตัะพัะฐ\n   > [!answer] ะะฐะผะฐ ะณะพััั ัะผะฐัะฝั ะฒะตัะตัั, ั ัะฐัะพ ะดะพะฟะพะผะฐะณะฐั ัะน ะฝะฐ ะบััะฝั ะบะพะถะฝะพะณะพ ะฒะตัะพัะฐ.\n\n4. ัะบัะพ / ะทะฐะฒััะฐ / ะฑัะดะต / ะฒัะปัะฝะธะน / ัะฐั / , / ะผะธ / ะฟะพะณะพะฒะพัะธะผะพ / ะฟัะพ / ะฒัะต / , / ัะพ / ััะฐะปะพัั / ััะพะณะพะดะฝั\n   > [!answer] ะฏะบัะพ ะทะฐะฒััะฐ ะฑัะดะต ะฒัะปัะฝะธะน ัะฐั, ะผะธ ะฟะพะณะพะฒะพัะธะผะพ ะฟัะพ ะฒัะต, ัะพ ััะฐะปะพัั ััะพะณะพะดะฝั.\n\n5. ะบะพะปะธ / ะฒัะฝ / ะฟัะธััะฐะฒ / , / ะผะธ / ะฒะถะต / ัะฟะฐะปะธ / , / ะฑะพ / ะดัะถะต / ะฒัะพะผะธะปะธัั / ะฟััะปั / ัะพะฑะพัะธ\n   > [!answer] ะะพะปะธ ะฒัะฝ ะฟัะธััะฐะฒ, ะผะธ ะฒะถะต ัะฟะฐะปะธ, ะฑะพ ะดัะถะต ะฒัะพะผะธะปะธัั ะฟััะปั ัะพะฑะพัะธ.\n\n6. ะบะฝะธะณะฐ / , / ัะบั / ัะธ / ะดะฐะฒ / ะผะตะฝั / ะฒัะพัะฐ / , / ะฒะธัะฒะธะปะฐัั / ะดัะถะต / ััะบะฐะฒะพั / ัะฐ / ะทะฐัะพะฟะปะธะฒะพั\n   > [!answer] ะะฝะธะณะฐ, ัะบั ัะธ ะดะฐะฒ ะผะตะฝั ะฒัะพัะฐ, ะฒะธัะฒะธะปะฐัั ะดัะถะต ััะบะฐะฒะพั ัะฐ ะทะฐัะพะฟะปะธะฒะพั.\n\n---\n\n## error-correction: ะะฝะฐะนะดััั ั ะฒะธะฟัะฐะฒัะต ะฟะพะผะธะปะบั\n\n1. ะัะฝ ัะบะฐะทะฐะฒ ัะพะผั ัะพ ัะฒะพัะธะน ัะพ ะฝะต ะฟัะธะนะดะต ะทะฐะฒััะฐ.\n   > [!error] ัะพะผั ัะพ ัะฒะพัะธะน ัะพ\n   > [!answer] ัะพ ะฝะต ะฟัะธะนะดะต, ัะพะผั ัะพ ัะฒะพัะธะน\n   > [!options] ัะพ ะฝะต ะฟัะธะนะดะต, ัะพะผั ัะพ ัะฒะพัะธะน | ัะพะผั ัะฒะพัะธะน ัะพ | ัะฒะพัะธะน ัะพ ัะพะผั | ัะพ ัะพะผั ัะฒะพัะธะน\n   > [!explanation] ะัะฐะฒะธะปัะฝะธะน ะฟะพััะดะพะบ: ะท'ัััะฒะฐะปัะฝะต ะฟะตัะตะด ะฟัะธัะธะฝะพะฒะธะผ.\n\n2. ะฏ ะทะฝะฐั ัะพ ะฒัะฝ ะฟัะธะนะดะต ะบะพะปะธ ะทะฐะบัะฝัะธัั.\n   > [!error] ะทะฝะฐั ัะพ\n   > [!answer] ะทะฝะฐั, ัะพ\n   > [!options] ะทะฝะฐั, ัะพ | ะทะฝะฐั: ัะพ | ะทะฝะฐั-ัะพ | ะทะฝะฐั โ ัะพ\n   > [!explanation] ะะพัััะฑะฝะฐ ะบะพะผะฐ ะฟะตัะตะด ะฟัะดััะดะฝะธะผ.\n\n3. ะะพะปะธ ะฒัะฝ ะฟัะธะนัะพะฒ ั ะผะธ ะฟะพะณะพะฒะพัะธะปะธ.\n   > [!error] ะะพะปะธ ะฒัะฝ ะฟัะธะนัะพะฒ ั\n   > [!answer] ะะพะปะธ ะฒัะฝ ะฟัะธะนัะพะฒ,\n   > [!options] ะะพะปะธ ะฒัะฝ ะฟัะธะนัะพะฒ, | ะะพะปะธ ะฒัะฝ ะฟัะธะนัะพะฒ: | ะัะธะนัะพะฒ ะบะพะปะธ | ะัะฝ ะบะพะปะธ ะฟัะธะนัะพะฒ\n   > [!explanation] ะะพะผะฐ ะฒัะดะดัะปัั ะฟัะดััะดะฝะต ะฒัะด ะณะพะปะพะฒะฝะพะณะพ.\n\n4. ะขะพะผั ัะพ ะฟะพะณะพะดะฐ ะณะฐัะฝะฐ ะฐะปะต ะผะธ ะทะฐะปะธัะธะปะธัั ะฒะดะพะผะฐ.\n   > [!error] ะขะพะผั ัะพ ะฟะพะณะพะดะฐ ะณะฐัะฝะฐ ะฐะปะต\n   > [!answer] ะฅะพัะฐ ะฟะพะณะพะดะฐ ะณะฐัะฝะฐ,\n   > [!options] ะฅะพัะฐ ะฟะพะณะพะดะฐ ะณะฐัะฝะฐ, | ะะพะณะพะดะฐ ะณะฐัะฝะฐ ัะพะผั | ะะปะต ะฟะพะณะพะดะฐ ัะพะผั | ะขะพะผั ะฐะปะต ะฟะพะณะพะดะฐ\n   > [!explanation] ยซะขะพะผั ัะพยป โ ะฟัะธัะธะฝะฐ, ะฐ ะฟะพัััะฑะฝะพ ะดะพะฟัััะพะฒะต ยซัะพัะฐยป.\n\n5. ะัะฝ ะฟัะธะนัะพะฒ, ัะบะพะณะพ ะผะธ ัะตะบะฐะปะธ, ะบะพะปะธ ะฟะพะทะฒะพะฝะธะฒ ะดะทะฒัะฝะพะบ.\n   > [!error] ัะบะพะณะพ ะผะธ ัะตะบะฐะปะธ, ะบะพะปะธ\n   > [!answer] ะฝะฐ ัะบะพะณะพ ะผะธ ัะตะบะฐะปะธ, ะบะพะปะธ\n   > [!options] ะฝะฐ ัะบะพะณะพ ะผะธ ัะตะบะฐะปะธ, ะบะพะปะธ | ัะตะบะฐะปะธ ัะบะพะณะพ ะบะพะปะธ | ะบะพะปะธ ัะบะพะณะพ ัะตะบะฐะปะธ | ัะบะพะณะพ ะบะพะปะธ ัะตะบะฐะปะธ\n   > [!explanation] ะะพัััะฑะตะฝ ะฟัะธะนะผะตะฝะฝะธะบ ยซะฝะฐยป ะท ะดะฐะฒะฐะปัะฝะธะผ ะฒัะดะผัะฝะบะพะผ.\n\n6. ะะฐะผะฐ ัะบะฐะทะฐะปะฐ ัะพะฑ ั ะบัะฟะธะฒ ัะปัะฑ ัะบะธะน ัะฒัะถะธะน.\n   > [!error] ัะปัะฑ ัะบะธะน ัะฒัะถะธะน\n   > [!answer] ัะฒัะถะธะน ัะปัะฑ\n   > [!options] ัะฒัะถะธะน ัะปัะฑ | ัะปัะฑ ัะฒัะถะธะน | ัะบะธะน ัะปัะฑ ัะฒัะถะธะน | ัะฒัะถะธะน ัะบะธะน ัะปัะฑ\n   > [!explanation] ะัะธะบะผะตัะฝะธะบ ะฟะตัะตะด ัะผะตะฝะฝะธะบะพะผ, ะฑะตะท ะทะฐะนะฒะพะณะพ ะฟัะดััะดะฝะพะณะพ.\n\n---\n\n## cloze: ะะฐะฟะพะฒะฝััั ะฟัะพะฟััะบะธ ะฒ ัะตะบััั\n\nะะธะฝัะปะพะณะพ ัะธะถะฝั ั ะฒะธัััะธะฒ ะฒัะดะฒัะดะฐัะธ ะดััะณะฐ. (1)___ ั ะฟัะธััะฐะฒ ะดะพ ะนะพะณะพ ะดะพะผั, ะฟะพะฑะฐัะธะฒ, (2)___ ะฒัะบะฝะฐ ะทะฐัะธะฝะตะฝั. ะะฐัะตะปะตัะพะฝัะฒะฐะฒ ะนะพะผั, (3)___ ะฒัะฝ ะฝะต ะฒัะดะฟะพะฒัะดะฐะฒ. ะะพัะตะบะฐะฒ ะฟัะฒะณะพะดะธะฝะธ, (4)___ ะฒะธัััะธะฒ ะฟััะธ, (5)___ ะฒะถะต ะฑัะปะพ ะฟัะทะฝะพ.\n\n(6)___ ั ะนัะพะฒ ะดะพะดะพะผั, ะทัััััะฒ ััััะดะฐ, (7)___ ัะบะฐะทะฐะฒ, (8)___ ะดััะณ ะฟะพััะฐะฒ ั ะฒัะดััะดะถะตะฝะฝั. (9)___ ั ะฝะต ะทะฝะฐะฒ ะฟัะพ ัะต, ะดัะถะต ะทะดะธะฒัะฒะฐะฒัั.\n\n(10)___ ะฒัะฝ ะฟะพะฒะตัะฝะตัััั, ะพะฑะพะฒ'ัะทะบะพะฒะพ ะทัััััะฝะตะผะพัั. (11)___ ะฑัะดะต ัะฐั, ะฟะพะณะพะฒะพัะธะผะพ ะฟัะพ ะฒัะต. ะฏ ัะฟะพะดัะฒะฐััั, (12)___ ะฒัะฝ ะฟัะธะฒะตะทะต ััะบะฐะฒั ัััะพััั, (13)___ ะฒัะฝ ะทะฐะฒะถะดะธ ัะพะทะฟะพะฒัะดะฐั ะฟััะปั ะฟะพะดะพัะพะถะตะน. (14)___ ะผะธ ะดะฐะฒะฝะพ ะฝะต ะฑะฐัะธะปะธัั, ะฑัะดะต ะฑะฐะณะฐัะพ (15)___ ะพะฑะณะพะฒะพัะธัะธ ัะฐะทะพะผ.\n\n- (1) :: ะะพะปะธ | ะขะพะผั ัะพ | ะะปะต | ะะฑะพ\n- (2) :: ัะพ | ัะบะธะน | ะบะพะปะธ | ะฐะปะต\n- (3) :: ะฐะปะต | ั | ัะพ | ัะบะธะน\n- (4) :: ั | ะฐะปะต | ัะพ | ัะบะธะน\n- (5) :: ัะพะผั ัะพ | ั | ะฐ | ัะบะธะน\n- (6) :: ะะพะปะธ | ะขะพะผั ัะพ | ะฉะพ | ะฏะบะธะน\n- (7) :: ัะบะธะน | ัะพ | ะบะพะปะธ | ะฐะปะต\n- (8) :: ัะพ | ัะบะธะน | ะบะพะปะธ | ัะพะผั ัะพ\n- (9) :: ะัะบัะปัะบะธ | ะฉะพ | ะฏะบะธะน | ะะพะปะธ\n- (10) :: ะะพะปะธ | ะขะพะผั ัะพ | ะฉะพ | ะะปะต\n- (11) :: ะฏะบัะพ | ะขะพะผั ัะพ | ะฉะพ | ะฅะพัะฐ\n- (12) :: ัะพ | ัะบะธะน | ะบะพะปะธ | ะฐะปะต\n- (13) :: ัะบั | ัะพ | ะบะพะปะธ | ัะพะผั ัะพ\n- (14) :: ะัะบัะปัะบะธ | ะฉะพ | ะฏะบะธะน | ะะพะปะธ\n- (15) :: ัะพ | ัะบะธะน | ะบะพะปะธ | ะดะต\n\n---\n\n## mark-the-words: ะะพะทะฝะฐััะต ะฟัะดััะดะฝั ัะฟะพะปััะฝะธะบะธ\n\nะัะฝ ะฟัะธะนัะพะฒ, [ะบะพะปะธ] ัะพะฝัะต ะทะฐะนัะปะพ. ะะธ ัะฐะดั, [ัะพ] ะฒัะฝ ะฟัะธััะฐะฒ. [ะขะพะผั ัะพ] ะฑัะปะพ ะฟัะทะฝะพ, ะฒัั ะฒัะพะผะธะปะธัั. ะะฝะธะณะฐ, [ัะบั] ั ัะธัะฐะฒ, ััะบะฐะฒะฐ. [ะฏะบัะพ] ะผะฐัะธะผะตั ัะฐั, ะทะฐัะตะปะตัะพะฝัะน. [ะฅะพัะฐ] ะฒัะฝ ัะฒะพัะธะน, ะฒัะต ะพะดะฝะพ ะฟัะธะนัะพะฒ. [ะััะปั ัะพะณะพ ัะบ] ะทะฐะบัะฝัะธะฒ, ะฟััะพะฒ. [ะะตัั ะฝัะถ] ะฟััะธ, ะฟะพะฟัะพัะฐะฒัั. [ะัะบัะปัะบะธ] ะฒัั ะฟะพะณะพะดะธะปะธัั, ัััะตะฝะฝั ะฟัะธะนะฝัะปะธ.\n\n---\n\n## dialogue-reorder: ะะฟะพััะดะบัะนัะต ะดัะฐะปะพะณ\n\n- ะขะพะผั ัะพ ะบะพะปะธ ั ะฒะธัะพะดะธะฒ, ะทะฐัะตะปะตัะพะฝัะฒะฐะปะฐ ะผะฐะผะฐ, ัะบะฐ ะฑัะปะฐ ัะฒะพัะฐ.\n- ะงะพะผั ัะธ ะฝะต ะฟัะธะนัะพะฒ ะฒัะพัะฐ ะฝะฐ ะฝะฐัั ะทัััััั?\n- ะะพะฑัะต, ะฑะพ ะผะธ ัะฒะธะปัะฒะฐะปะธัั ะทะฐ ัะฒะพั ะผะฐะผั.\n- ะัะพะทัะผัะปะพ. ะฏะบะฑะธ ัะธ ะฟะพะฟะตัะตะดะธะฒ, ะผะธ ะฑ ะฟะตัะตะฝะตัะปะธ.\n- ะะพะปะธ ะฒัะต ะฑัะดะต ะณะฐัะฐะทะด, ะพะฑะพะฒ'ัะทะบะพะฒะพ ะทัััััะฝะตะผะพัั ะทะฝะพะฒั.\n- ะัะบัั, ัะพ ัะพะทัะผัััะต ะผะพั ัะธััะฐััั ัะท ะผะฐะผะพั.\n\n> [!answer]\n> 1. ะงะพะผั ัะธ ะฝะต ะฟัะธะนัะพะฒ ะฒัะพัะฐ ะฝะฐ ะฝะฐัั ะทัััััั?\n> 2. ะขะพะผั ัะพ ะบะพะปะธ ั ะฒะธัะพะดะธะฒ, ะทะฐัะตะปะตัะพะฝัะฒะฐะปะฐ ะผะฐะผะฐ, ัะบะฐ ะฑัะปะฐ ัะฒะพัะฐ.\n> 3. ะัะพะทัะผัะปะพ. ะฏะบะฑะธ ัะธ ะฟะพะฟะตัะตะดะธะฒ, ะผะธ ะฑ ะฟะตัะตะฝะตัะปะธ.\n> 4. ะัะบัั, ัะพ ัะพะทัะผัััะต ะผะพั ัะธััะฐััั ัะท ะผะฐะผะพั.\n> 5. ะะพะฑัะต, ะฑะพ ะผะธ ัะฒะธะปัะฒะฐะปะธัั ะทะฐ ัะฒะพั ะผะฐะผั.\n> 6. ะะพะปะธ ะฒัะต ะฑัะดะต ะณะฐัะฐะทะด, ะพะฑะพะฒ'ัะทะบะพะฒะพ ะทัััััะฝะตะผะพัั ะทะฝะพะฒั.\n\n---\n\n## select: ะะธะฑะตัััั ััั ะณัะฐะผะฐัะธัะฝะพ ะฟัะฐะฒะธะปัะฝั ัะบะปะฐะดะฝั ัะตัะตะฝะฝั\n\n- [x] ะะพะปะธ ะฒัะฝ ะฟัะธะนัะพะฒ, ะผะธ ะฒะถะต ะฒะตัะตััะปะธ.\n- [ ] ะัะฝ ะฟัะธะนัะพะฒ ะบะพะปะธ ะผะธ ะฒะตัะตััะปะธ.\n- [x] ะฏ ะทะฝะฐั, ัะพ ะฒัะฝ ะฟัะธัะดะต ะทะฐะฒััะฐ.\n- [ ] ะฏ ะทะฝะฐั ัะพ ะฒัะฝ ะฟัะธัะดะต.\n- [x] ะัะฝ ะฝะต ะฟัะธะนัะพะฒ, ัะพะผั ัะพ ะทะฐัะฒะพััะฒ.\n- [ ] ะขะพะผั ัะพ ะฒัะฝ ะฝะต ะฟัะธะนัะพะฒ ะทะฐัะฒะพััะฒ.\n- [x] ะะฝะธะณะฐ, ัะบั ัะธ ะดะฐะฒ, ััะบะฐะฒะฐ.\n- [ ] ะะฝะธะณะฐ ัะบั ัะธ ะดะฐะฒ ััะบะฐะฒะฐ.\n- [x] ะฏะบัะพ ะฑัะดะต ัะฐั, ะทะฐัะตะปะตัะพะฝัั.\n- [ ] ะฏะบัะพ ะฑัะดะต ัะฐั ะทะฐัะตะปะตัะพะฝัั.\n- [x] ะะฐะผะฐ ะณะพััั, ั ัะฐัะพ ะดะพะฟะพะผะฐะณะฐั.\n- [x] ะัะฝ ัะพััะฒ ะดะพะฟะพะผะพะณัะธ, ะฐะปะต ะฝะต ะทะฝะฐะฒ ัะบ.\n\n---\n\n## translate: ะะตัะตะบะปะฐะดััั ะฝะฐ ัะบัะฐัะฝััะบั ะผะพะฒั\n\n1. When he arrived, we were already sleeping because we were tired.\n   - [x] ะะพะปะธ ะฒัะฝ ะฟัะธััะฐะฒ, ะผะธ ะฒะถะต ัะฟะฐะปะธ, ะฑะพ ะฒัะพะผะธะปะธัั.\n   - [ ] ะัะฝ ะฟัะธััะฐะฒ ะบะพะปะธ ะผะธ ัะฟะฐะปะธ ะฑะพ ะฒัะพะผะธะปะธัั.\n   - [ ] ะขะพะผั ัะพ ะฒัะฝ ะฟัะธััะฐะฒ ะผะธ ัะฟะฐะปะธ.\n   - [ ] ะะพะปะธ ะฒัะฝ ะฑะพ ะฟัะธััะฐะฒ ะผะธ ัะฟะฐะปะธ.\n\n2. I know that he will come if he has time tomorrow.\n   - [x] ะฏ ะทะฝะฐั, ัะพ ะฒัะฝ ะฟัะธะนะดะต, ัะบัะพ ะผะฐัะธะผะต ัะฐั ะทะฐะฒััะฐ.\n   - [ ] ะฏ ะทะฝะฐั ะฒัะฝ ะฟัะธะนะดะต ัะบัะพ ัะฐั.\n   - [ ] ะัะฝ ะฟัะธะนะดะต ัะพ ั ะทะฝะฐั ัะบัะพ ัะฐั.\n   - [ ] ะฏะบัะพ ัะฐั ะฒัะฝ ะฟัะธะนะดะต ัะพ ะทะฝะฐั.\n\n3. The book that you gave me is very interesting and educational.\n   - [x] ะะฝะธะณะฐ, ัะบั ัะธ ะผะตะฝั ะดะฐะฒ, ะดัะถะต ััะบะฐะฒะฐ ั ะฟะพะฒัะฐะปัะฝะฐ.\n   - [ ] ะะฝะธะณะฐ ัะบั ะดะฐะฒ ััะบะฐะฒะฐ.\n   - [ ] ะขะธ ะดะฐะฒ ะบะฝะธะณะฐ ัะบั ััะบะฐะฒะฐ.\n   - [ ] ะฏะบั ะบะฝะธะณะฐ ัะธ ะดะฐะฒ ััะบะฐะฒะฐ.\n\n4. He didn't come because he was sick, although he wanted to.\n   - [x] ะัะฝ ะฝะต ะฟัะธะนัะพะฒ, ัะพะผั ัะพ ะทะฐัะฒะพััะฒ, ัะพัะฐ ัะพััะฒ.\n   - [ ] ะขะพะผั ัะพ ะฒัะฝ ะฝะต ะฟัะธะนัะพะฒ ัะฒะพัะธะน ัะพัะฐ.\n   - [ ] ะฅะพัะฐ ัะพััะฒ ะฒัะฝ ะฝะต ะฟัะธะนัะพะฒ ัะพะผั.\n   - [ ] ะัะฝ ัะพััะฒ ะฝะต ะฟัะธะนัะพะฒ ัะพะผั ัะพัะฐ.\n\n5. When I finish work, I will call you if it's not too late.\n   - [x] ะะพะปะธ ะทะฐะบัะฝัั ัะพะฑะพัั, ะทะฐัะตะปะตัะพะฝัั, ัะบัะพ ะฝะต ะฑัะดะต ะฝะฐะดัะพ ะฟัะทะฝะพ.\n   - [ ] ะะฐะบัะฝัั ัะพะฑะพัั ะบะพะปะธ ะทะฐัะตะปะตัะพะฝัั ัะบัะพ.\n   - [ ] ะฏะบัะพ ะบะพะปะธ ะทะฐะบัะฝัั ะทะฐัะตะปะตัะพะฝัั.\n   - [ ] ะะพะฑะพัั ะทะฐะบัะฝัั ะบะพะปะธ ะทะฐัะตะปะตัะพะฝัั.\n\n6. She said that she would come after she finished her project.\n   - [x] ะะพะฝะฐ ัะบะฐะทะฐะปะฐ, ัะพ ะฟัะธะนะดะต, ะฟััะปั ัะพะณะพ ัะบ ะทะฐะบัะฝัะธัั ะฟัะพะตะบั.\n   - [ ] ะกะบะฐะทะฐะปะฐ ะฒะพะฝะฐ ัะพ ะฟัะธะนะดะต ะฟััะปั ะฟัะพะตะบั.\n   - [ ] ะััะปั ัะพะณะพ ะฟัะธะนะดะต ัะพ ัะบะฐะทะฐะปะฐ.\n   - [ ] ะัะพะตะบั ะทะฐะบัะฝัะธัั ัะพ ะฟัะธะนะดะต ัะบะฐะทะฐะปะฐ.\n\n---"
      },
      {
        "id": "section-3",
        "name": "ะกะปะพะฒะฝะธะบ",
        "nameEn": null,
        "type": "vocabulary",
        "content": "| ะกะปะพะฒะพ | ะะธะผะพะฒะฐ | ะะตัะตะบะปะฐะด | ะงะ | ะัะธะผััะบะฐ |\n|-------|--------|----------|-----|----------|\n| **ััััะดะฝะธะน** | /suหrสฒษdnษชj/ | coordinate | ะฟัะธะบะผ. | ััะฒะฝะพะฟัะฐะฒะฝะธะน ะทะฒ'ัะทะพะบ |\n| **ะฟัะดััะดะฝะธะน** | /pสฒidหrสฒษdnษชj/ | subordinate | ะฟัะธะบะผ. | ะทะฐะปะตะถะฝะธะน ะทะฒ'ัะทะพะบ |\n| **ัะธะฝัะฐะบัะธั** | /sษชnหtษksษชs/ | syntax | ัะผ. (ั.ั.) | ะฑัะดะพะฒะฐ ัะตัะตะฝั |\n| **ะณะพะปะพะฒะฝะต ัะตัะตะฝะฝั** | /ษฆษlษwหnษ หrษtสษnสฒษ/ | main clause | ะฒะธัะฐะท | ะฝะตะทะฐะปะตะถะฝะฐ ัะฐััะธะฝะฐ |\n| **ะฟัะดััะดะฝะต ัะตัะตะฝะฝั** | /pสฒidหrสฒษdnษ หrษtสษnสฒษ/ | subordinate clause | ะฒะธัะฐะท | ะทะฐะปะตะถะฝะฐ ัะฐััะธะฝะฐ |\n| **ัะฟะพะปััะฝะธะบ** | /spษหlutสnษชk/ | conjunction | ัะผ. (ั.ั.) | ะท'ัะดะฝัั ัะฐััะธะฝะธ |\n| **ัะดะฝะฐะปัะฝะธะน** | /jษdหnษlสฒnษชj/ | copulative, joining | ะฟัะธะบะผ. | ั, ัะฐ, ะน |\n| **ะทัััะฐะฒะปะตะฝะฝั** | /zสฒistษwหlษnสฒษ/ | comparison | ัะผ. (ั.ั.) | ะฐ, ะถ |\n| **ะฟัะพัะธััะฐะฒะปะตะฝะฝั** | /prษtษชstษwหlษnสฒษ/ | contrast | ัะผ. (ั.ั.) | ะฐะปะต, ะฟัะพัะต |\n| **ะฟัะธัะธะฝะพะฒะต** | /prษชtสษชnษหwษ/ | causal | ะฟัะธะบะผ. | ัะพะผั ัะพ, ะฑะพ |\n| **ัะฐัะพะฒะต** | /tสษsษหwษ/ | temporal | ะฟัะธะบะผ. | ะบะพะปะธ, ะฟััะปั |\n| **ัะผะพะฒะฝะต** | /uหmษwnษ/ | conditional | ะฟัะธะบะผ. | ัะบัะพ, ัะบะฑะธ |\n| **ะพะทะฝะฐัะฐะปัะฝะต** | /ษznษtสษlสฒหnษ/ | attributive | ะฟัะธะบะผ. | ัะบะธะน, ัะพ |\n| **ะท'ัััะฒะฐะปัะฝะต** | /zjษsuหwษlสฒnษ/ | explanatory | ะฟัะธะบะผ. | ัะพ, ัะพะฑ |\n| **ะดะพะฟัััะพะฒะต** | /dษpusหtษwษ/ | concessive | ะฟัะธะบะผ. | ัะพัะฐ, ัะพั |\n| **ััะฒะตะฝั ะฟัะดััะดะฝะพััั** | /หrสฒiwษnสฒ pสฒidหrสฒษdnษstสฒi/ | level of subordination | ะฒะธัะฐะท | ะณะปะธะฑะธะฝะฐ ะทะฐะปะตะถะฝะพััั |\n| **ะดะฒะพััะฒะฝะตะฒะธะน** | /dwษหrสฒiwnษwษชj/ | two-level | ะฟัะธะบะผ. | ะดะฒะฐ ััะฒะฝั |\n| **ััะธััะฒะฝะตะฒะธะน** | /trษชหrสฒiwnษwษชj/ | three-level | ะฟัะธะบะผ. | ััะธ ััะฒะฝั |\n| **ะบะพะผะฑัะฝัะฒะฐะฝะฝั** | /kษmbสฒinuหwษnสฒษ/ | combining | ัะผ. (ั.ั.) | ะฟะพัะดะฝะฐะฝะฝั |\n| **ัะฝัะตะณัะฐััั** | /สฒintษษฆหrษtอกsสฒijษ/ | integration | ัะผ. (ะถ.ั.) | ะพะฑ'ัะดะฝะฐะฝะฝั |\n| **ะฟะพัะปัะดะพะฒะฝัััั** | /pษslสฒiหdษwnสฒistสฒ/ | sequence | ัะผ. (ะถ.ั.) | ะฟะพััะดะพะบ |\n| **ััััะบัััะฐ** | /strukหturษ/ | structure | ัะผ. (ะถ.ั.) | ะฑัะดะพะฒะฐ |\n| **ะบะพะผะฟะพะฝะตะฝั** | /kษmpษหnษnt/ | component | ัะผ. (ั.ั.) | ัะฐััะธะฝะฐ |\n| **ะปะพะณััะฝะธะน** | /lษหษฆสฒitสnษชj/ | logical | ะฟัะธะบะผ. | ัะพะทัะผะฝะธะน ะทะฒ'ัะทะพะบ |\n| **ะฐััััะตะบัััะฐ** | /ษrxสฒitษkหturษ/ | architecture | ัะผ. (ะถ.ั.) | ะฑัะดะพะฒะฐ, ััััะบัััะฐ |"
      }
    ],
    "rawMarkdown": "---\nmodule: b1-38\ntitle: \"ะะฝัะตะณัะฐััั ัะบะปะฐะดะฝะธั ัะตัะตะฝั\"\nsubtitle: \"Complex Sentence Integration\"\nversion: \"1.0\"\nphase: \"B1.3b Complex Sentences\"\npedagogy: \"TTT\"\nduration: 90\ntransliteration: none\ntags:\n  - grammar\n  - complex-sentences\n  - integration\n  - synthesis\ngrammar:\n  - \"Combining multiple clause types in one sentence\"\n  - \"Coordination and subordination together\"\nobjectives:\n  - \"Learner can combine ะฟัะธัะธะฝะพะฒั, ัะฐัะพะฒั, ัะผะพะฒะฝั clauses\"\n  - \"Learner can build multi-clause sentences\"\n  - \"Learner can choose appropriate connectors for context\"\nvocabulary_count: 25\n---\n\n> [!motivation]\n> ะฏะบ ะฟะพัะดะฝะฐัะธ ะฒัั ัะธะฟะธ ัะบะปะฐะดะฝะธั ัะตัะตะฝั ะฒ ะพะดะธะฝ ัะตะบัั? ะะฝัะตะณัะฐััั ัะบะปะฐะดะฝะธั ัะตัะตะฝั โ ัะต ะฒะตััะธะฝะฐ ะณัะฐะผะฐัะธัะฝะพั ะผะฐะนััะตัะฝะพััั ะฒ ัะบัะฐัะฝััะบัะน ะผะพะฒั. ะะพะปะธ ะฒะธ ะฒะผัััะต ะบะพะผะฑัะฝัะฒะฐัะธ ะฟัะธัะธะฝะพะฒั, ัะฐัะพะฒั, ัะผะพะฒะฝั ัะฐ ะฒัะดะฝะพัะฝั ัะตัะตะฝะฝั ะฒ ะพะดะฝะพะผั ัะตะบััั, ะฒะฐัะต ะผะพะฒะปะตะฝะฝั ััะฐั ะฟะพ-ัะฟัะฐะฒะถะฝัะพะผั ะฟัะธัะพะดะฝะธะผ ั ะฑะฐะณะฐัะธะผ. ะฆะต ะบะปััะพะฒะฐ ะฝะฐะฒะธัะบะฐ ะดะปั ะฝะฐะฟะธัะฐะฝะฝั ะตัะต, ะดะพะฟะพะฒัะดะตะน, ะพััััะนะฝะธั ะปะธัััะฒ ัะฐ ะฒะตะดะตะฝะฝั ัะบะปะฐะดะฝะธั ะดะธัะบัััะน ัะบัะฐัะฝััะบะพั ะผะพะฒะพั!\n\n---\n\n## ะขะตัั\n\nะัะพัะธัะฐะนัะต ัะฒะฐะถะฝะพ ัะบะปะฐะดะฝะต ัะตัะตะฝะฝั ะท ะบัะปัะบะพะผะฐ ัะธะฟะฐะผะธ ะฟัะดััะดะฝะธั ั ัะฟัะพะฑัะนัะต ะฒะธะทะฝะฐัะธัะธ ััะฝั ััะฝะบััั:\n\n**ะะพะปะธ ั ะฟัะธะนัะพะฒ ะดะพะดะพะผั, ะฟะพะฑะฐัะธะฒ, ัะพ ะผะฐะผะฐ ะณะพััั ะฒะตัะตัั, ัะพะผั ัะพ ะทะฐะฒััะฐ ะดะพ ะฝะฐั ะฟัะธัะดััั ะณะพััั, ัะบะธั ะผะธ ะดะฐะฒะฝะพ ะฝะต ะฑะฐัะธะปะธ.**\n\nะกะบัะปัะบะธ ะฟัะดััะดะฝะธั ัะตัะตะฝั ััั ะฒะธะบะพัะธััะฐะฝะพ ะฒ ััะพะผั ัะตัะตะฝะฝั?\n\n1. **ะงะฐัะพะฒะต:** ยซะะพะปะธ ั ะฟัะธะนัะพะฒ ะดะพะดะพะผัยป โ ะฒัะดะฟะพะฒัะดะฐั ะฝะฐ ยซะบะพะปะธ?ยป\n2. **ะ'ัััะฒะฐะปัะฝะต:** ยซัะพ ะผะฐะผะฐ ะณะพััั ะฒะตัะตััยป โ ะฒัะดะฟะพะฒัะดะฐั ะฝะฐ ยซัะพ ะฟะพะฑะฐัะธะฒ?ยป\n3. **ะัะธัะธะฝะพะฒะต:** ยซัะพะผั ัะพ ะทะฐะฒััะฐ ะฟัะธัะดััั ะณะพัััยป โ ะฒัะดะฟะพะฒัะดะฐั ะฝะฐ ยซัะพะผั?ยป\n4. **ะะทะฝะฐัะฐะปัะฝะต:** ยซัะบะธั ะผะธ ะดะฐะฒะฝะพ ะฝะต ะฑะฐัะธะปะธยป โ ะพะฟะธััั ยซัะบะธั ะณะพััะตะน?ยป\n\n**ะงะพัะธัะธ ะฟัะดััะดะฝะธั ัะตัะตะฝะฝั** ะฒ ะพะดะฝะพะผั ัะตัะตะฝะฝั! ะฆะต โ **ัะฝัะตะณัะฐััั ัะบะปะฐะดะฝะธั ัะตัะตะฝั** ะฒ ัะบัะฐัะฝััะบัะน ะผะพะฒั. ะะพะถะฝะต ะฟัะดััะดะฝะต ะฒะธะบะพะฝัั ัะฒะพั ััะฝะบััั, ะฐ ัะฐะทะพะผ ะฒะพะฝะธ ััะฒะพััััั ะฟะพะฒะฝะธะน, ะปะพะณััะฝะธะน ัะตะบัั.\n\n> ๐ก **ะฆัะบะฐะฒะธะน ัะฐะบั**\n> ะ ัะบัะฐัะฝััะบัะน ะปััะตัะฐัััั ะดะพะฒะถะธะฝะฐ ัะตัะตะฝั ะผะพะถะต ััะณะฐัะธ ะดะตัััะบัะฒ ัะปัะฒ ัะท ะฑะฐะณะฐััะผะฐ ะฟัะดััะดะฝะธะผะธ. ะะฒะฐะฝ ะคัะฐะฝะบะพ, ะะตัั ะฃะบัะฐัะฝะบะฐ, ะัะฝะฐ ะะพััะตะฝะบะพ ะผะฐะนััะตัะฝะพ ะฒะธะบะพัะธััะพะฒัะฒะฐะปะธ ัะบะปะฐะดะฝั ัะธะฝัะฐะบัะธัะฝั ะบะพะฝััััะบััั ะดะปั ััะฒะพัะตะฝะฝั ะณะปะธะฑะพะบะธั, ััะปะพัะพัััะบะธั ัะตะบัััะฒ. ะฆะต ะพัะพะฑะปะธะฒะฐ ัะธัะฐ ัะบัะฐัะฝััะบะพั ะปััะตัะฐัััะฝะพั ััะฐะดะธััั, ัะบะฐ ัะพะฑะธัั ะผะพะฒั ะฝะฐะดะทะฒะธัะฐะนะฝะพ ะฒะธัะฐะทะฝะพั ัะฐ ะฑะฐะณะฐัะพะณัะฐะฝะฝะพั! ะขะฐัะฐั ะจะตะฒัะตะฝะบะพ ัะฐะบะพะถ ะฒะธะบะพัะธััะพะฒัะฒะฐะฒ ัะบะปะฐะดะฝั ัะตัะตะฝะฝั ั ัะฒะพัะน ะฟัะพะทั, ัะพะฑ ะฟะตัะตะดะฐัะธ ะณะปะธะฑะธะฝั ะดัะผะพะบ ัะฐ ะตะผะพััะน. ะะฟะฐะฝัะฒะฐะฝะฝั ัะธั ะบะพะฝััััะบััะน ะฒัะดะบัะธะฒะฐั ะดะฒะตัั ะดะพ ัะพะทัะผัะฝะฝั ะบะปะฐัะธัะฝะพั ัะบัะฐัะฝััะบะพั ะปััะตัะฐัััะธ ั ะฒััะน ัั ะบัะฐัั ัะฐ ัะบะปะฐะดะฝะพััั!\n\n---\n\n## ะะพััะฝะตะฝะฝั\n\n### ะขะธะฟะธ ะฟะพัะดะฝะฐะฝะฝั ัะตัะตะฝั\n\nะ ัะบัะฐัะฝััะบัะน ะผะพะฒั ัะตัะตะฝะฝั ะผะพะถััั ะฟะพัะดะฝัะฒะฐัะธัั ะดะฒะพะผะฐ ะพัะฝะพะฒะฝะธะผะธ ัะฟะพัะพะฑะฐะผะธ:\n\n#### 1. ะกัััะดะฝัััั (ััะฒะฝะพะฟัะฐะฒะฝั ัะฐััะธะฝะธ)\n\n**ะกัััะดะฝะต ัะตัะตะฝะฝั** โ ัะต ะบะพะปะธ ัะฐััะธะฝะธ ััะฒะฝะพะฟัะฐะฒะฝั, ะท'ัะดะฝะฐะฝั ัะฟะพะปััะฝะธะบะฐะผะธ ยซัยป, ยซะฐยป, ยซะฐะปะตยป, ยซะฐะฑะพยป, ยซะฟัะพัะตยป.\n\n| ะกะฟะพะปััะฝะธะบ | ะะฝะฐัะตะฝะฝั | ะัะธะบะปะฐะด |\n|-----------|----------|---------|\n| **ั**, **ัะฐ** | ัะดะฝะฐะปัะฝั | ะะฐะผะฐ ะณะพััั, ั ัะฐัะพ ะดะพะฟะพะผะฐะณะฐั ัะน. |\n| **ะฐ** | ะทัััะฐะฒะปะตะฝะฝั | ะัะฝ ัะธัะฐั, ะฐ ะฒะพะฝะฐ ะฟะธัะต ัะฒัะน ะปะธัั. |\n| **ะฐะปะต**, **ะฟัะพัะต** | ะฟัะพัะธััะฐะฒะปะตะฝะฝั | ะัะปะพ ัะพะปะพะดะฝะพ, ะฐะปะต ะผะธ ะฟััะปะธ ะณัะปััะธ. |\n| **ะฐะฑะพ** | ะฐะปััะตัะฝะฐัะธะฒะฐ | ะะพัะดะตะผะพ ะฝะฐ ะผะพัะต, ะฐะฑะพ ะทะฐะปะธัะธะผะพัั ััั. |\n\n**ะัะธะบะปะฐะดะธ ััััะดะฝะธั ัะตัะตะฝั:**\n- ะกะพะฝัะต ะทะฐะนัะปะพ, **ั** ะฝะฐััะฐะปะฐ ัะธัะฐ.\n- ะัะฝ ัะพััะฒ ะดะพะฟะพะผะพะณัะธ, **ะฐะปะต** ะฝะต ะทะฝะฐะฒ ัะบ.\n- **ะะฑะพ** ะผะธ ะนะดะตะผะพ ะทะฐัะฐะท, **ะฐะฑะพ** ัะตะบะฐัะผะพ ะดะพ ะฒะตัะพัะฐ.\n\n#### 2. ะัะดััะดะฝัััั (ะฝะตััะฒะฝะพะฟัะฐะฒะฝั ัะฐััะธะฝะธ)\n\n**ะัะดััะดะฝะต ัะตัะตะฝะฝั** โ ัะต ะบะพะปะธ ะพะดะฝะฐ ัะฐััะธะฝะฐ ะทะฐะปะตะถะธัั ะฒัะด ัะฝัะพั, ะท'ัะดะฝะฐะฝั ะฟัะดััะดะฝะธะผะธ ัะฟะพะปััะฝะธะบะฐะผะธ ยซัะพยป, ยซัะบะธะนยป, ยซะบะพะปะธยป, ยซัะพะผั ัะพยป, ยซัะบัะพยป ัะพัะพ.\n\n| ะขะธะฟ | ะะธัะฐะฝะฝั | ะกะฟะพะปััะฝะธะบ | ะัะธะบะปะฐะด |\n|-----|---------|-----------|---------|\n| **ะัะธัะธะฝะพะฒะต** | ัะพะผั? | ัะพะผั ัะพ, ะฑะพ | ะัะฝ ะฝะต ะฟัะธะนัะพะฒ, ัะพะผั ัะพ ะทะฐัะฒะพััะฒ. |\n| **ะงะฐัะพะฒะต** | ะบะพะปะธ? | ะบะพะปะธ, ะฟััะปั ัะพะณะพ ัะบ | ะะพะปะธ ัะพะฝัะต ะทะฐะนัะปะพ, ะผะธ ะฟััะปะธ. |\n| **ะฃะผะพะฒะฝะต** | ะทะฐ ัะบะพั ัะผะพะฒะธ? | ัะบัะพ, ัะบะฑะธ | ะฏะบัะพ ะฑัะดะต ะณะฐัะฝะพ, ะฟะพัะดะตะผะพ. |\n| **ะะทะฝะฐัะฐะปัะฝะต** | ัะบะธะน? | ัะบะธะน, ัะพ, ะบะพััะธะน | ะะฝะธะณะฐ, ัะบั ัะธ ะดะฐะฒ, ััะบะฐะฒะฐ. |\n| **ะ'ัััะฒะฐะปัะฝะต** | ัะพ? | ัะพ, ัะพะฑ, ัะบ | ะฏ ะทะฝะฐั, ัะพ ะฒัะฝ ะฟัะธะนะดะต. |\n| **ะะพะฟัััะพะฒะต** | ะฝะตะทะฒะฐะถะฐััะธ ะฝะฐ ัะพ? | ัะพัะฐ, ัะพั | ะฅะพัะฐ ะฑัะปะพ ะฟัะทะฝะพ, ะผะธ ัะตะบะฐะปะธ. |\n\n> ๐ **ะฃ ัะตะฐะปัะฝะพะผั ะถะธััั**\n> ะฃ ัะพะทะผะพะฒะฝะพะผั ะผะพะฒะปะตะฝะฝั ัะบัะฐัะฝัั ัะฐััััะต ะฒะธะบะพัะธััะพะฒัััั ะบะพัะพัะบั ัะตัะตะฝะฝั ะท ะพะดะฝะธะผ-ะดะฒะพะผะฐ ะฟัะดััะดะฝะธะผะธ. ะัะพัะต ะฒ ะฟะธััะผะพะฒะธั ัะตะบััะฐั, ะพัะพะฑะปะธะฒะพ ะฒ ะพััััะนะฝะธั ะดะพะบัะผะตะฝัะฐั ัะฐ ะฝะฐัะบะพะฒัะน ะปััะตัะฐัััั, ัะฐััะพ ะทััััััะฐััััั ัะตัะตะฝะฝั ะท ัััะพะผะฐ-ัะพัะธัะผะฐ ััะฒะฝัะผะธ ะฟัะดััะดะฝะพััั. ะฃะผัะฝะฝั ัะธัะฐัะธ ัะฐ ะฑัะดัะฒะฐัะธ ัะฐะบั ัะตัะตะฝะฝั โ ะบะปััะพะฒะฐ ะฝะฐะฒะธัะบะฐ ะดะปั ะฐะบะฐะดะตะผััะฝะพั ะณัะฐะผะพัะฝะพััั!\n\n#### ะัะฐะบัะธัะฝะต ะทะฐััะพััะฒะฐะฝะฝั ะฟัะดััะดะฝะพััั\n\n**ะฃ ัะพะดะตะฝะฝะพะผั ัะฟัะปะบัะฒะฐะฝะฝั:**\nะัะพััั ะบะพะฝััััะบััั ะท ะพะดะฝะธะผ-ะดะฒะพะผะฐ ะฟัะดััะดะฝะธะผะธ ะดะพััะฐัะฝั ะดะปั ะฑัะปััะพััั ัะธััะฐััะน: *ยซะะฐัะตะปะตัะพะฝัะน ะผะตะฝั, ะบะพะปะธ ะฟัะธะนะดะตั ะดะพะดะพะผั, ะฑะพ ั ัะฒะธะปัััั.ยป*\n\n**ะฃ ะดัะปะพะฒะพะผั ะปะธัััะฒะฐะฝะฝั:**\nะะธะบะพัะธััะพะฒัะนัะต ะฑัะปัั ััััะบัััะพะฒะฐะฝั ัะตัะตะฝะฝั: *ยซะะพะฒัะดะพะผะปััะผะพ, ัะพ ะทะฐััะดะฐะฝะฝั, ัะบะต ะฑัะปะพ ะทะฐะฟะปะฐะฝะพะฒะฐะฝะต ะฝะฐ ะฟ'ััะฝะธัั, ะฟะตัะตะฝะตัะตะฝะพ ะฝะฐ ะฟะพะฝะตะดัะปะพะบ, ะพัะบัะปัะบะธ ะบะตััะฒะฝะธะบ ะฟะตัะตะฑัะฒะฐั ั ะฒัะดััะดะถะตะฝะฝั.ยป*\n\n**ะ ะฐะบะฐะดะตะผััะฝะพะผั ะฟะธััะผั:**\nะกะบะปะฐะดะฝั ะบะพะฝััััะบััั ะดะพะทะฒะพะปัััั ัะพัะฝะพ ะฟะตัะตะดะฐัะธ ะดัะผะบะธ: *ยซะะพัะปัะดะถะตะฝะฝั ะฟะพะบะฐะทัั, ัะพ ัััะดะตะฝัะธ, ัะบั ัะตะณัะปััะฝะพ ะฟัะฐะบัะธะบัััั ะฝะฐะฟะธัะฐะฝะฝั ัะบะปะฐะดะฝะธั ัะตัะตะฝั, ะดะตะผะพะฝััััััั ะบัะฐัั ัะตะทัะปััะฐัะธ ะฝะฐ ััะฟะธัะฐั, ัะพัะฐ ัะต ะฒะธะผะฐะณะฐั ะดะพะดะฐัะบะพะฒะพะณะพ ัะฐัั ะฝะฐ ะฟัะดะณะพัะพะฒะบั.ยป*\n\n> ๐ฏ **ะัะฐะบัะธัะฝะฐ ะฟะพัะฐะดะฐ**\n> ะะพัะธะฝะฐะนัะต ะท ะฟัะพััะธั ะบะพะฝััััะบััะน ั ะฟะพัััะฟะพะฒะพ ะดะพะดะฐะฒะฐะนัะต ัะบะปะฐะดะฝัััั. ะกะฟะพัะฐัะบั ะพะฟะฐะฝัะนัะต ัะตัะตะฝะฝั ะท ะพะดะฝะธะผ ะฟัะดััะดะฝะธะผ, ะฟะพััะผ ะฟะตัะตัะพะดััะต ะดะพ ะดะฒะพััะฒะฝะตะฒะธั ั ััะธััะฒะฝะตะฒะธั ะบะพะฝััััะบััะน. ะฆะต ะฟัะธัะพะดะฝะธะน ัะปัั ัะพะทะฒะธัะบั ัะธะฝัะฐะบัะธัะฝะพั ะบะพะผะฟะตัะตะฝััั!\n\n---\n\n### ะะพะผะฑัะฝัะฒะฐะฝะฝั ััะทะฝะธั ัะธะฟัะฒ\n\n#### ะัะธัะธะฝะฐ + ะงะฐั\n\n**ะกัะตะผะฐ:** ะะพะปะธ [ะงะะก], [ะฟะพะดัั], ัะพะผั ัะพ [ะะะะงะะะ].\n\n- **ะะพะปะธ** ั ะฟัะธะนัะพะฒ, ะฒัะฝ ัะถะต ัะฟะฐะฒ, **ัะพะผั ัะพ** ะฒัะพะผะธะฒัั.\n- **ะััะปั ัะพะณะพ ัะบ** ะฟััะพะฒ ะดะพั, ะผะธ ะทะฐะปะธัะธะปะธัั ะฒะดะพะผะฐ, **ะฑะพ** ะฝะต ะผะฐะปะธ ะฟะฐัะฐัะพะปัะบะธ.\n- **ะะตัั ะฝัะถ** ะฟััะธ, ะฒะพะฝะฐ ะทะฐัะตะปะตัะพะฝัะฒะฐะปะฐ, **ะพัะบัะปัะบะธ** ัะพััะปะฐ ะฟะพะฟะตัะตะดะธัะธ.\n\n#### ะงะฐั + ะฃะผะพะฒะฐ\n\n**ะกัะตะผะฐ:** ะะพะปะธ [ะงะะก], [ะฟะพะดัั], ัะบัะพ [ะฃะะะะ].\n\n- **ะะพะปะธ** ะฒัะฝ ะฟัะธัะดะต, ะฟะพะณะพะฒะพัะธะผะพ, **ัะบัะพ** ะฑัะดะต ัะฐั.\n- **ะััะปั ัะพะณะพ ัะบ** ะทะฐะบัะฝัะธะผะพ ัะพะฑะพัั, ะฟัะดะตะผะพ, **ัะบัะพ** ะฟะพะณะพะดะฐ ะฑัะดะต ะณะฐัะฝะฐ.\n- **ะฏะบ ััะปัะบะธ** ะฒัะต ะฑัะดะต ะณะพัะพะฒะพ, ะฟะพัะดะตะผะพ, **ัะบะฑะธ** ัะธ ะฟะพะณะพะดะธะฒัั ะท ัะธะผ ะฟะปะฐะฝะพะผ.\n\n#### ะัะธัะธะฝะฐ + ะฃะผะพะฒะฐ\n\n**ะกัะตะผะฐ:** [ะะพะดัั], ัะพะผั ัะพ [ะะะะงะะะ], ัะบัะพ [ะฃะะะะ].\n\n- ะัะฝ ะฝะต ะฟัะธะนะดะต, **ัะพะผั ัะพ** ะทะฐะนะฝััะธะน, **ัะบัะพ** ะฝะต ะทะฒัะปัะฝะธัััั ัะฐะฝััะต.\n- ะะธ ะทะฐะฟัะทะฝะธะผะพัั, **ะฑะพ** ะทะฐัะพั, **ัะบัะพ** ะฝะต ะฟะพัะดะตะผะพ ะพะฑ'ัะทะฝะพั ะดะพัะพะณะพั.\n\n> โ๏ธ **ะะฐะถะปะธะฒะธะน ะฝัะฐะฝั**\n> ะัะธ ะบะพะผะฑัะฝัะฒะฐะฝะฝั ะฟัะดััะดะฝะธั ัะตัะตะฝั ะฒะฐะถะปะธะฒะพ ะทะฑะตััะณะฐัะธ ะปะพะณััะฝั ะฟะพัะปัะดะพะฒะฝัััั: ัะฟะพัะฐัะบั ัะฐั, ะฟะพััะผ ะฟัะธัะธะฝะฐ, ะฟะพััะผ ัะผะพะฒะฐ. ะะพัััะตะฝะฝั ััะพะณะพ ะฟะพััะดะบั ะผะพะถะต ะทัะพะฑะธัะธ ัะตัะตะฝะฝั ะฝะตะทัะพะทัะผัะปะธะผ ะดะปั ัะธัะฐัะฐ ัะธ ัะปััะฐัะฐ!\n\n---\n\n### ะกะบะปะฐะดะฝั ัะตัะตะฝะฝั ะท ะบัะปัะบะพะผะฐ ััะฒะฝัะผะธ ะฟัะดััะดะฝะพััั\n\n#### ะะฒะพััะฒะฝะตะฒั ะบะพะฝััััะบััั\n\n**ะะพะปะพะฒะฝะต + ะฟัะดััะดะฝะต + ะฟัะดััะดะฝะต ะฒัะด ะฟัะดััะดะฝะพะณะพ:**\n\n- ะฏ ะทะฝะฐั, **ัะพ** ะฒัะฝ ะฟัะธะนะดะต, **ะบะพะปะธ** ะทะฐะบัะฝัะธัั ัะพะฑะพัั.\n  - ะะพะปะพะฒะฝะต: ยซะฏ ะทะฝะฐัยป\n  - ะัะดััะดะฝะต 1: ยซัะพ ะฒัะฝ ะฟัะธะนะดะตยป (ะทะฐะปะตะถะธัั ะฒัะด ะณะพะปะพะฒะฝะพะณะพ)\n  - ะัะดััะดะฝะต 2: ยซะบะพะปะธ ะทะฐะบัะฝัะธััยป (ะทะฐะปะตะถะธัั ะฒัะด ะฟัะดััะดะฝะพะณะพ 1)\n\n- ะัะฝ ัะบะฐะทะฐะฒ, **ัะพ** ะฟะพัะดะต, **ัะบัะพ** ะฑัะดะต ัะฐั ั ะณะฐัะฝะฐ ะฟะพะณะพะดะฐ.\n  - ะะพะปะพะฒะฝะต: ยซะัะฝ ัะบะฐะทะฐะฒยป\n  - ะัะดััะดะฝะต 1: ยซัะพ ะฟะพัะดะตยป\n  - ะัะดััะดะฝะต 2: ยซัะบัะพ ะฑัะดะต ัะฐัยป\n\n#### ะขัะธััะฒะฝะตะฒั ะบะพะฝััััะบััั\n\n- ะะฐะผะฐ ะฟะพะฟัะพัะธะปะฐ, **ัะพะฑ** ั ะบัะฟะธะฒ ัะปัะฑ, **ัะบะธะน** ะฟะตัะต ะฟะตะบะฐัะฝั, **ัะพ** ะฒัะดะบัะธะปะฐัั ะผะธะฝัะปะพะณะพ ะผััััั.\n  - ะะพะปะพะฒะฝะต: ยซะะฐะผะฐ ะฟะพะฟัะพัะธะปะฐยป\n  - ะัะดััะดะฝะต 1: ยซัะพะฑ ั ะบัะฟะธะฒ ัะปัะฑยป\n  - ะัะดััะดะฝะต 2: ยซัะบะธะน ะฟะตัะต ะฟะตะบะฐัะฝัยป\n  - ะัะดััะดะฝะต 3: ยซัะพ ะฒัะดะบัะธะปะฐัั ะผะธะฝัะปะพะณะพ ะผัััััยป\n\n> ๐ฌ **ะัะปััััะฝะธะน ะผะพะผะตะฝั**\n> ะฃ ััะธะดะธัะฝะธั ะดะพะบัะผะตะฝัะฐั ะฃะบัะฐัะฝะธ ัะฐััะพ ะทััััััะฐััััั ัะตัะตะฝะฝั ะท ะฟ'ัััะผะฐ ั ะฑัะปััะต ััะฒะฝัะผะธ ะฟัะดััะดะฝะพััั. ะฆะต ััะฒะพััั ะฟัะพะฑะปะตะผะธ ะดะปั ัะพะทัะผัะฝะฝั, ัะพะผั ัััะฐัะฝั ัะตัะพัะผะธ ัะฟััะผะพะฒะฐะฝั ะฝะฐ ัะฟัะพัะตะฝะฝั ะพััััะนะฝะพั ะผะพะฒะธ. ะัะพัะต ะดะปั ัะพะทัะผัะฝะฝั ะทะฐะบะพะฝัะฒ ั ะฝะพัะผะฐัะธะฒะฝะธั ะฐะบััะฒ ัั ะฝะฐะฒะธัะบะฐ ะทะฐะปะธัะฐััััั ะบัะธัะธัะฝะพ ะฒะฐะถะปะธะฒะพั ะดะปั ะบะพะถะฝะพะณะพ ะณัะพะผะฐะดัะฝะธะฝะฐ!\n\n---\n\n### ะกะฟะพะปััะตะฝะฝั ััััะดะฝะพััั ัะฐ ะฟัะดััะดะฝะพััั\n\nะะฐะนัะบะปะฐะดะฝััั ัะตัะตะฝะฝั ะฟะพัะดะฝัััั ะพะฑะธะดะฒะฐ ัะธะฟะธ ะทะฒ'ัะทะบั:\n\n**ะกัััะดะฝัััั + ะฟัะดััะดะฝัััั:**\n\n- ะัะฝ ะฟัะธะนัะพะฒ, **ะบะพะปะธ** ัะพะฝัะต ะทะฐะนัะปะพ, **ั** ะผะธ ะฟะพะณะพะฒะพัะธะปะธ, **ัะพะผั ัะพ** ะดะฐะฒะฝะพ ะฝะต ะฑะฐัะธะปะธัั.\n  - ะกัััะดะฝะธะน ะทะฒ'ัะทะพะบ: ยซะัะฝ ะฟัะธะนัะพะฒ... ั ะผะธ ะฟะพะณะพะฒะพัะธะปะธยป\n  - ะัะดััะดะฝะธะน 1: ยซะบะพะปะธ ัะพะฝัะต ะทะฐะนัะปะพยป\n  - ะัะดััะดะฝะธะน 2: ยซัะพะผั ัะพ ะดะฐะฒะฝะพ ะฝะต ะฑะฐัะธะปะธััยป\n\n- **ะฏะบัะพ** ะผะฐัะธะผะตั ัะฐั, ะทะฐัะตะปะตัะพะฝัะน, **ะฐ** **ะบะพะปะธ** ะฟัะธัะดะตั, ะทะฐัะพะดั ั ะณะพััั, **ะฑะพ** ะผะธ ะทะฐะฒะถะดะธ ัะฐะดั.\n  - ะกัััะดะฝะธะน ะทะฒ'ัะทะพะบ: ยซะทะฐัะตะปะตัะพะฝัะน, ะฐ ะทะฐัะพะดัยป\n  - ะัะดััะดะฝั: ยซะฏะบัะพ ะผะฐัะธะผะตัยป, ยซะบะพะปะธ ะฟัะธัะดะตัยป, ยซะฑะพ ะผะธ ัะฐะดัยป\n\n> ๐บ๐ฆ **ะฃะบัะฐัะฝััะบะฐ ัะดะตะฝัะธัะฝัััั**\n> ะกะบะปะฐะดะฝะธะน ัะธะฝัะฐะบัะธั ัะบัะฐัะฝััะบะพั ะผะพะฒะธ โ ัะต ะพะดะฝะฐ ะท ะฟัะธัะธะฝ, ัะพะผั ัะบัะฐัะฝััะบะฐ ะปััะตัะฐัััะฐ ัะฐะบะฐ ะฑะฐะณะฐัะฐ ัะฐ ะณะปะธะฑะพะบะฐ. ะะฐ ะฒัะดะผัะฝั ะฒัะด ะฐะฝะณะปัะนััะบะพั, ะดะต ะฟะตัะตะฒะฐะถะฐััั ะฟัะพััั ะบะพัะพัะบั ัะตัะตะฝะฝั, ัะบัะฐัะฝััะบะฐ ะดะพะทะฒะพะปัั ะฑัะดัะฒะฐัะธ ัะฟัะฐะฒะถะฝั ะฐััััะตะบัััะฝั ัะฟะพััะดะธ ะท ะดัะผะพะบ ัะฐ ัะดะตะน. ะกะฐะผะต ัั ัะธะฝัะฐะบัะธัะฝะฐ ะณะฝััะบัััั ะทัะพะฑะธะปะฐ ะผะพะถะปะธะฒะธะผะธ ัะตะดะตะฒัะธ ัะบัะฐัะฝััะบะพั ะฟะพะตะทัั ัะฐ ะฟัะพะทะธ. ะฆะต ะพัะพะฑะปะธะฒะฐ ะบัะฐัะฐ ะฝะฐัะพั ะผะพะฒะธ, ัะบั ะฒะฐััะพ ััะฝัะฒะฐัะธ ัะฐ ัะพะทะฒะธะฒะฐัะธ!\n\n---\n\n## ะัะฐะบัะธะบะฐ\n\n### ะฏะบ ะฑัะดัะฒะฐัะธ ัะบะปะฐะดะฝั ัะตัะตะฝะฝั?\n\n**ะัะพะบ 1:** ะะธะทะฝะฐััะต ะณะพะปะพะฒะฝั ะดัะผะบั.\n**ะัะพะบ 2:** ะะพะดะฐะนัะต ัะฐัะพะฒะธะน ะบะพะฝัะตะบัั (ะบะพะปะธ?).\n**ะัะพะบ 3:** ะะพะดะฐะนัะต ะฟัะธัะธะฝั ะฐะฑะพ ัะผะพะฒั (ัะพะผั? / ะทะฐ ัะบะพั ัะผะพะฒะธ?).\n**ะัะพะบ 4:** ะะพะดะฐะนัะต ะดะตัะฐะปั ัะตัะตะท ะพะทะฝะฐัะฐะปัะฝั ะฐะฑะพ ะท'ัััะฒะฐะปัะฝั ัะตัะตะฝะฝั.\n\n**ะัะธะบะปะฐะด ะฟะพะฑัะดะพะฒะธ:**\n\n1. ะะพะปะพะฒะฝะต: *ะฏ ะทะฐัะตะปะตัะพะฝัะฒะฐะฒ.*\n2. + ะงะฐั: *ะะพะปะธ ะฟัะธััะฐะฒ ะดะพะดะพะผั*, ั ะทะฐัะตะปะตัะพะฝัะฒะฐะฒ.\n3. + ะัะธัะธะฝะฐ: *ะะพะปะธ ะฟัะธััะฐะฒ*, ะทะฐัะตะปะตัะพะฝัะฒะฐะฒ, *ัะพะผั ัะพ ัะฒะธะปัะฒะฐะฒัั*.\n4. + ะะทะฝะฐัะฐะปัะฝะต: *ะะพะปะธ ะฟัะธััะฐะฒ*, ะทะฐัะตะปะตัะพะฝัะฒะฐะฒ ะผะฐะผั, *ัะบะฐ ัะตะบะฐะปะฐ*, *ัะพะผั ัะพ ัะฒะธะปัะฒะฐะฒัั*.\n\n**ะะตะทัะปััะฐั:** ยซะะพะปะธ ั ะฟัะธััะฐะฒ ะดะพะดะพะผั, ั ะทะฐัะตะปะตัะพะฝัะฒะฐะฒ ะผะฐะผั, ัะบะฐ ัะตะบะฐะปะฐ ะฝะฐ ะดะทะฒัะฝะพะบ, ัะพะผั ัะพ ะดัะถะต ัะฒะธะปัะฒะฐะฒัั ะฟัะพ ะฝะตั.ยป\n\n### ะขะธะฟะพะฒั ะฟะพะผะธะปะบะธ\n\n**ะะพะผะธะปะบะฐ 1: ะะพัััะตะฝะฝั ะฟะพััะดะบั ะฟัะดััะดะฝะธั**\n\nโ ะะตะฟัะฐะฒะธะปัะฝะพ: ะัะฝ ัะบะฐะทะฐะฒ ัะพะผั ัะพ ัะฒะพัะธะน, ัะพ ะฝะต ะฟัะธะนะดะต.\nโ ะัะฐะฒะธะปัะฝะพ: ะัะฝ ัะบะฐะทะฐะฒ, ัะพ ะฝะต ะฟัะธะนะดะต, ัะพะผั ัะพ ัะฒะพัะธะน.\n\n**ะะพะผะธะปะบะฐ 2: ะัะพะฟััะบ ะบะพะผะธ ะฟะตัะตะด ะฟัะดััะดะฝะธะผ**\n\nโ ะะตะฟัะฐะฒะธะปัะฝะพ: ะฏ ะทะฝะฐั ัะพ ะฒัะฝ ะฟัะธะนะดะต.\nโ ะัะฐะฒะธะปัะฝะพ: ะฏ ะทะฝะฐั, ัะพ ะฒัะฝ ะฟัะธะนะดะต.\n\n**ะะพะผะธะปะบะฐ 3: ะะฐะดะผััะฝะฐ ัะบะปะฐะดะฝัััั**\n\nโ ะฃะฝะธะบะฐะนัะต: ะะตัะตะฝั ะท ะฑัะปััะต ะฝัะถ 4-5 ะฟัะดััะดะฝะธะผะธ ะฒ ัะพะทะผะพะฒะฝะพะผั ััะธะปั.\nโ ะะตะบะพะผะตะฝะดะพะฒะฐะฝะพ: ะะพะทะดัะปัะนัะต ะฝะฐ 2-3 ัะตัะตะฝะฝั ะดะปั ััะฝะพััั.\n\n> ๐ฏ **ะัะฐะบัะธัะฝะฐ ะฟะพัะฐะดะฐ**\n> ะะปั ะฟะธััะผะพะฒะธั ัะตะบัััะฒ ะผะพะถะฝะฐ ะฒะธะบะพัะธััะพะฒัะฒะฐัะธ ัะตัะตะฝะฝั ะท 3-4 ะฟัะดััะดะฝะธะผะธ. ะะปั ััะฝะพะณะพ ะผะพะฒะปะตะฝะฝั ะบัะฐัะต ะพะฑะผะตะถะธัะธัั 1-2 ะฟัะดััะดะฝะธะผะธ. ะฆะต ะดะพะฟะพะผะพะถะต ะทะฑะตัะตะณัะธ ััะฝัััั ัะฐ ะทัะพะทัะผัะปัััั ะฒะฐัะพะณะพ ะฟะพะฒัะดะพะผะปะตะฝะฝั ะดะปั ัะฟัะฒัะพะทะผะพะฒะฝะธะบะฐ!\n\n---\n\n## ะัะฐะปะพะณะธ\n\n### ะัะฐะปะพะณ 1: ะะพััะฝะตะฝะฝั ัะธััะฐััั\n\n**ะะพะปะตะณะฐ:** ะงะพะผั ัะธ ะฝะต ะฟัะธะนัะพะฒ ะฝะฐ ะทัััััั ััะพัะฐ?\n\n**ะะปะตะบััะน:** ะขะพะผั ัะพ ะบะพะปะธ ั ะฒะธัะพะดะธะฒ ะท ะดะพะผั, ะทะฐัะตะปะตัะพะฝัะฒะฐะปะฐ ะผะฐะผะฐ, ัะบะฐ ัะบะฐะทะฐะปะฐ, ัะพ ะฟะพัััะฑะฝะฐ ะดะพะฟะพะผะพะณะฐ.\n\n**ะะพะปะตะณะฐ:** ะฉะพ ััะฐะปะพัั ัะท ัะฒะพัั ะผะฐะผะพั ะฒัะพัะฐ?\n\n**ะะปะตะบััะน:** ะััะปั ัะพะณะพ ัะบ ะฒะพะฝะฐ ะฟััะปะฐ ะฒ ะผะฐะณะฐะทะธะฝ, ัะน ััะฐะปะพ ะฟะพะณะฐะฝะพ, ัะพะผั ัะพ ะทะฐะฑัะปะฐ ะฒะทััะธ ะปัะบะธ.\n\n**ะะพะปะตะณะฐ:** ะัะพะทัะผัะปะพ. ะฏะบะฑะธ ัะธ ะฟะพะฟะตัะตะดะธะฒ, ะผะธ ะฑ ะฟะตัะตะฝะตัะปะธ.\n\n**ะะปะตะบััะน:** ะฏะบัะพ ะฑัะดะต ะผะพะถะปะธะฒัััั, ะทัััััะฝะตะผะพัั ะทะฐะฒััะฐ, ะบะพะปะธ ั ะฒัะต ะทะฐะปะฐะณะพะดะถั?\n\n---\n\n### ะัะฐะปะพะณ 2: ะะปะฐะฝัะฒะฐะฝะฝั\n\n**ะะฝะฝะฐ:** ะะพะปะธ ะฟะพัะดะตะผะพ ะฝะฐ ะฒัะดะฟะพัะธะฝะพะบ ััะพะณะพ ะปััะฐ?\n\n**ะะฐัะบะพ:** ะะพัะดะตะผะพ, ะบะพะปะธ ั ะทะฐะบัะฝัั ะฟัะพะตะบั, ัะบะธะน ะฒะตะดั ะฒะถะต ััะธ ะผััััั.\n\n**ะะฝะฝะฐ:** ะ ัะบัะพ ะฟัะพะตะบั ะทะฐััะณะฝะตัััั ะดะพะฒัะต ะฟะปะฐะฝั?\n\n**ะะฐัะบะพ:** ะขะพะดั ะฟะพัะดะตะผะพ ั ะฒะตัะตัะฝั, ัะพัะฐ ั ัะฟะพะดัะฒะฐััั, ัะพ ะฒัะต ะฑัะดะต ะณะพัะพะฒะพ ัะฐะฝััะต.\n\n**ะะฝะฝะฐ:** ะะพะฑัะต, ะฑะพ ั ัะพัั ะฟะพััะฐัะธ, ะฟะพะบะธ ะฟะพะณะพะดะฐ ัะต ะณะฐัะฝะฐ ะฝะฐ ัะทะฑะตัะตะถะถั.\n\n**ะะฐัะบะพ:** ะัะพะทัะผัะปะพ. ะฏะบ ััะปัะบะธ ะฒัะต ะฑัะดะต ะฒัะดะพะผะพ, ัะบะฐะถั ัะพะฑั ะพะดัะฐะทั!\n\n---\n\n### ะัะฐะปะพะณ 3: ะกะฟะพะณะฐะดะธ\n\n**ะัะดััั:** ะะพะปะธ ั ะฑัะฒ ะผะพะปะพะดะธะน, ะผะธ ะถะธะปะธ ะฒ ัะตะปั, ัะบะต ะปะตะถะฐะปะพ ะฑัะปั ัััะบะธ.\n\n**ะะฝัะบ:** ะ ัะพะผั ะฒะธ ะฟะตัะตััะฐะปะธ ะทะฒัะดัะธ ะดะพ ะผัััะฐ?\n\n**ะัะดััั:** ะะตัะตััะฐะปะธ, ัะพะผั ัะพ ะฑะฐััะบะพ ะทะฝะฐะนัะพะฒ ัะพะฑะพัั ะฒ ะผัััั, ะฟััะปั ัะพะณะพ ัะบ ะทะฐะบัะธะปะธ ะทะฐะฒะพะด.\n\n**ะะฝัะบ:** ะะธ ััะผัะฒะฐะปะธ ะทะฐ ัะตะปะพะผ, ัะบะต ะฑัะปะพ ะฒะฐัะธะผ ััะดะฝะธะผ ะดะพะผะพะผ?\n\n**ะัะดััั:** ะขะฐะบ, ัะพัะฐ ะฒ ะผัััั ะฑัะปะพ ะฑัะปััะต ะผะพะถะปะธะฒะพััะตะน, ั ะทะฐะฒะถะดะธ ะทะณะฐะดัะฒะฐะฒ ัะตะปะพ, ะดะต ะฟัะพะนัะปะพ ะดะธัะธะฝััะฒะพ.\n\n---\n\n### ะัะฐะปะพะณ 4: ะะฑะณะพะฒะพัะตะฝะฝั\n\n**ะกััะดะตะฝั:** ะฏะบัะพ ั ะฟัะฐะฒะธะปัะฝะพ ะทัะพะทัะผัะฒ, ัะพ ัะบะฐะทะฐะฒ ะปะตะบัะพั, ัะพ ัะตะผะฐ ัะบะปะฐะดะฝะฐ.\n\n**ะััะณ:** ะขะฐะบ, ัะพะผั ัะพ ะฒัะฝ ะฟะพััะฝัะฒะฐะฒ ัะตะพััั, ัะบะฐ ะฒะธะผะฐะณะฐั ะฑะฐะทะพะฒะธั ะทะฝะฐะฝั.\n\n**ะกััะดะตะฝั:** ะะพะปะธ ะฒัะฝ ะฟะพัะฐะฒ ะณะพะฒะพัะธัะธ ะฟัะพ ะดะตัะฐะปั, ั ะทะฐะณัะฑะธะฒัั, ะฑะพ ะฝะต ะฒััะธะณ.\n\n**ะััะณ:** ะฏ ะดะพะฟะพะผะพะถั ัะพะฑั, ัะบัะพ ัะพัะตั, ะฟััะปั ัะพะณะพ ัะบ ะทะฐะบัะฝัะฐัััั ะทะฐะฝัััั.\n\n**ะกััะดะตะฝั:** ะัะบัั! ะัะบัะปัะบะธ ัะธ ะดะพะฑัะต ัะพะทัะผััั ะผะฐัะตััะฐะป, ัะฒะพั ะดะพะฟะพะผะพะณะฐ ะฑัะดะต ััะฝะฝะพั.\n\n---\n\n# ะัะดััะผะพะบ\n\n**ะฉะพ ะฒะธ ะฝะฐะฒัะธะปะธัั:**\n\n1. **ะกัััะดะฝัััั vs ะฟัะดััะดะฝัััั:** ััััะดะฝั โ ััะฒะฝะพะฟัะฐะฒะฝั ัะฐััะธะฝะธ (ั, ะฐ, ะฐะปะต); ะฟัะดััะดะฝั โ ะทะฐะปะตะถะฝั (ัะพ, ัะบะธะน, ะบะพะปะธ, ัะพะผั ัะพ).\n2. **ะะพะผะฑัะฝัะฒะฐะฝะฝั ัะธะฟัะฒ:** ะฟัะธัะธะฝะฐ + ัะฐั, ัะฐั + ัะผะพะฒะฐ, ะฟัะธัะธะฝะฐ + ัะผะพะฒะฐ.\n3. **ะัะฒะฝั ะฟัะดััะดะฝะพััั:** ะพะดะฝะต ะฟัะดััะดะฝะต ะผะพะถะต ะทะฐะปะตะถะฐัะธ ะฒัะด ัะฝัะพะณะพ (ะดะฒะพััะฒะฝะตะฒั, ััะธััะฒะฝะตะฒั ะบะพะฝััััะบััั).\n4. **ะกัััะดะฝัััั + ะฟัะดััะดะฝัััั:** ะฝะฐะนัะบะปะฐะดะฝััั ัะตัะตะฝะฝั ะฟะพัะดะฝัััั ะพะฑะธะดะฒะฐ ัะธะฟะธ.\n\n**ะัะฝะพะฒะฝะต ะฟัะฐะฒะธะปะพ:**\n\n> ะกะบะปะฐะดะฝั ัะตัะตะฝะฝั ะฑัะดัััััั ะฟะพัััะฟะพะฒะพ: ัะฟะพัะฐัะบั ะณะพะปะพะฒะฝะต, ะฟะพััะผ ัะฐั, ะฟัะธัะธะฝะฐ, ัะผะพะฒะฐ, ะดะตัะฐะปั. ะะฑะตััะณะฐะนัะต ะปะพะณััะฝั ะฟะพัะปัะดะพะฒะฝัััั ั ะฝะต ะฟะตัะตะฒะฐะฝัะฐะถัะนัะต ัะตัะตะฝะฝั!\n\n**ะะฐะปั:**\n\nะฃ ะฝะฐัััะฟะฝะพะผั ะผะพะดัะปั (ะ39) ะผะธ ัะพะทะณะปัะฝะตะผะพ **ะฝะตะฟััะผั ะผะพะฒั** โ ัะบ ะฟะตัะตะดะฐะฒะฐัะธ ััะถั ัะปะพะฒะฐ: ยซะัะฝ ัะบะฐะทะฐะฒ, ัะพ...ยป, ยซะะพะฝะฐ ะทะฐะฟะธัะฐะปะฐ, ัะธ...ยป. ะฆะต ััะฝะดะฐะผะตะฝัะฐะปัะฝะฐ ะฝะฐะฒะธัะบะฐ ะดะปั ะฟะตัะตะบะฐะทั ัะฐ ัะธััะฒะฐะฝะฝั!\n\n> โ **ะกะฐะผะพะฟะตัะตะฒััะบะฐ**\n>\n> ะงะธ ะผะพะถะตัะต ะฒะธ:\n> - [ ] ะัะดััะทะฝะธัะธ ััััะดะฝะธะน ั ะฟัะดััะดะฝะธะน ะทะฒ'ัะทะพะบ?\n> - [ ] ะะพะผะฑัะฝัะฒะฐัะธ ะฟัะธัะธะฝะพะฒั, ัะฐัะพะฒั ัะฐ ัะผะพะฒะฝั ัะตัะตะฝะฝั?\n> - [ ] ะัะดัะฒะฐัะธ ะดะฒะพััะฒะฝะตะฒั ะฟัะดััะดะฝั ะบะพะฝััััะบััั?\n> - [ ] ะะพัะดะฝัะฒะฐัะธ ััััะดะฝัััั ั ะฟัะดััะดะฝัััั ะฒ ะพะดะฝะพะผั ัะตัะตะฝะฝั?\n>\n> ะฏะบัะพ ัะฐะบ โ ะฟะตัะตัะพะดััะต ะดะพ ะฒะฟัะฐะฒ!\n\n---\n\n> [!resources] ๐ง ะะพะฒะฝััะฝั ัะตััััะธ\n>\n> **ะะพะดะฐัะบะพะฒั ะผะฐัะตััะฐะปะธ ะดะปั ะฒะธะฒัะตะฝะฝั:**\n> - ๐ [ะกะธะฝัะฐะบัะธั](https://uk.wikipedia.org/wiki/ะกะธะฝัะฐะบัะธั) โ ะัะบัะฟะตะดัั\n> - ๐บ [Ukrainian Grammar](https://www.youtube.com/@ukrainianlesson) โ ะฒัะดะตะพััะพะบะธ\n> - ๐ง [Ukrainian Lessons Podcast](https://ukrainianlessons.com/) โ ะฟะพะดะบะฐัั ะดะปั ะฒะธะฒัะตะฝะฝั\n\n---\n\n# ะะฟัะฐะฒะธ\n\n## quiz: ะะธะฑะตัััั ะฟัะฐะฒะธะปัะฝั ะฒัะดะฟะพะฒัะดั\n\n1. ะฏะบะต ัะตัะตะฝะฝั ั ะฟัะธะบะปะฐะดะพะผ ััััะดะฝะพะณะพ ะทะฒ'ัะทะบั ะผัะถ ัะฐััะธะฝะฐะผะธ ะฒ ัะบัะฐัะฝััะบัะน ัะธะฝัะฐะบัะธัะฝัะน ัะธััะตะผั?\n   - [x] ะัะฝ ะฟัะธะนัะพะฒ, ั ะผะธ ะฟะพะณะพะฒะพัะธะปะธ.\n   - [ ] ะัะฝ ะฟัะธะนัะพะฒ, ะบะพะปะธ ั ัะธัะฐะฒ.\n   - [ ] ะัะฝ ะฟัะธะนัะพะฒ, ัะพะผั ัะพ ัะพััะฒ.\n   - [ ] ะัะฝ ะฟัะธะนัะพะฒ, ัะพะฑ ะฟะพะณะพะฒะพัะธัะธ.\n   > ะกะฟะพะปััะฝะธะบ ยซัยป ะท'ัะดะฝัั ััะฒะฝะพะฟัะฐะฒะฝั ัะฐััะธะฝะธ.\n\n2. ะฏะบะต ัะตัะตะฝะฝั ะผัััะธัั ะฟัะดััะดะฝะต ะฟัะธัะธะฝะพะฒะต, ัะบะต ะฟะพััะฝัั ะฟัะธัะธะฝั ะพัะฝะพะฒะฝะพั ะดัั ะฒ ัะตะบััั?\n   - [ ] ะะพะปะธ ะฒัะฝ ะฟัะธะนัะพะฒ, ะผะธ ะพะฑัะดะฐะปะธ.\n   - [x] ะัะฝ ะฝะต ะฟัะธะนัะพะฒ, ัะพะผั ัะพ ะทะฐัะฒะพััะฒ.\n   - [ ] ะฏะบัะพ ะฑัะดะต ัะฐั, ะทะฐัะตะปะตัะพะฝัั.\n   - [ ] ะะฝะธะณะฐ, ัะบั ัะธ ะดะฐะฒ, ััะบะฐะฒะฐ.\n   > ยซะขะพะผั ัะพยป ะฒะบะฐะทัั ะฝะฐ ะฟัะธัะธะฝั.\n\n3. ะกะบัะปัะบะธ ััะฒะฝัะฒ ะฟัะดััะดะฝะพััั ะฒ ัะตัะตะฝะฝั: ยซะฏ ะทะฝะฐั, ัะพ ะฒัะฝ ะฟัะธะนะดะต, ะบะพะปะธ ะทะฐะบัะฝัะธัั ัะพะฑะพััยป?\n   - [ ] ะะดะธะฝ ััะฒะตะฝั ะฟัะดััะดะฝะพััั\n   - [x] ะะฒะฐ ััะฒะฝั ะฟัะดััะดะฝะพััั\n   - [ ] ะขัะธ ััะฒะฝั ะฟัะดััะดะฝะพััั\n   - [ ] ะะตะผะฐั ะฟัะดััะดะฝะธั ัะตัะตะฝั\n   > ยซะฉะพ ะฒัะฝ ะฟัะธะนะดะตยป โ 1 ััะฒะตะฝั, ยซะบะพะปะธ ะทะฐะบัะฝัะธััยป โ 2 ััะฒะตะฝั.\n\n4. ะฏะบะธะน ัะฟะพะปััะฝะธะบ ะฒะธะบะพัะธััะพะฒัััััั ะดะปั ะทัััะฐะฒะปะตะฝะฝั ะดะฒะพั ะดัะน ะฐะฑะพ ัะธััะฐััะน ั ััััะดะฝะพะผั ัะตัะตะฝะฝั?\n   - [ ] ั\n   - [x] ะฐ\n   - [ ] ะฐะฑะพ\n   - [ ] ัะพะผั ัะพ\n   > ยซะยป ะฒะธัะฐะถะฐั ะทัััะฐะฒะปะตะฝะฝั: ยซะัะฝ ัะธัะฐั, ะฐ ะฒะพะฝะฐ ะฟะธัะต.ยป\n\n5. ะฏะบะต ะท ะฝะฐะฒะตะดะตะฝะธั ัะตัะตะฝั ะฟัะฐะฒะธะปัะฝะพ ะบะพะผะฑัะฝัั ัะฐัะพะฒะต ัะฐ ะฟัะธัะธะฝะพะฒะต ะฟัะดััะดะฝั ัะตัะตะฝะฝั ะฒ ะพะดะฝะพะผั?\n   - [x] ะะพะปะธ ะฒัะฝ ะฟัะธะนัะพะฒ, ะผะธ ะฒะถะต ัะฟะฐะปะธ, ัะพะผั ัะพ ะฒัะพะผะธะปะธัั.\n   - [ ] ะขะพะผั ัะพ ะฒัะฝ ะฟัะธะนัะพะฒ ะบะพะปะธ ะผะธ ัะฟะฐะปะธ.\n   - [ ] ะัะฝ ะฟัะธะนัะพะฒ ัะพะผั ัะพ ะบะพะปะธ ะผะธ ัะฟะฐะปะธ.\n   - [ ] ะะพะปะธ ัะพะผั ัะพ ะฒัะฝ ะฟัะธะนัะพะฒ ะผะธ ัะฟะฐะปะธ.\n   > ะัะฐะฒะธะปัะฝะธะน ะฟะพััะดะพะบ: ัะฐั โ ะณะพะปะพะฒะฝะต โ ะฟัะธัะธะฝะฐ.\n\n6. ะฉะพ ัะฐะบะต ะพะทะฝะฐัะฐะปัะฝะต ะฟัะดััะดะฝะต ัะตัะตะฝะฝั ะทะณัะดะฝะพ ะท ัะบัะฐัะฝััะบะพั ัะธะฝัะฐะบัะธัะฝะพั ะบะปะฐัะธััะบะฐัััั ัะบะปะฐะดะฝะธั ัะตัะตะฝั?\n   - [ ] ะะตัะตะฝะฝั, ัะพ ะฒัะดะฟะพะฒัะดะฐั ะฝะฐ ยซัะพะผั?ยป\n   - [ ] ะะตัะตะฝะฝั, ัะพ ะฒัะดะฟะพะฒัะดะฐั ะฝะฐ ยซะบะพะปะธ?ยป\n   - [x] ะะตัะตะฝะฝั, ัะพ ะฒัะดะฟะพะฒัะดะฐั ะฝะฐ ยซัะบะธะน?ยป\n   - [ ] ะะตัะตะฝะฝั, ัะพ ะฒัะดะฟะพะฒัะดะฐั ะฝะฐ ยซัะพ?ยป\n   > ะะทะฝะฐัะฐะปัะฝะต ะฒัะดะฟะพะฒัะดะฐั ะฝะฐ ยซัะบะธะน?ยป, ยซัะบะฐ?ยป, ยซัะบะต?ยป\n\n7. ะฏะบะธะน ัะฟะพะปััะฝะธะบ ะฒะธะบะพัะธััะพะฒัััััั ะดะปั ะฒะธัะฐะถะตะฝะฝั ะฟัะพัะธััะฐะฒะปะตะฝะฝั ะฒ ััััะดะฝะพะผั ัะบะปะฐะดะฝะพะผั ัะตัะตะฝะฝั ัะบัะฐัะฝััะบะพั ะผะพะฒะธ?\n   - [ ] ั\n   - [ ] ะฐ\n   - [x] ะฐะปะต\n   - [ ] ะฐะฑะพ\n   > ยซะะปะตยป ะฒะธัะฐะถะฐั ะฟัะพัะธััะฐะฒะปะตะฝะฝั.\n\n8. ะฃ ัะตัะตะฝะฝั ยซะะฐะผะฐ ะฟะพะฟัะพัะธะปะฐ, ัะพะฑ ั ะบัะฟะธะฒ ัะปัะฑ, ัะบะธะน ะฟะตัะต ะฟะตะบะฐัะฝัยป ัะบัะปัะบะธ ั ะฟัะดััะดะฝะธั ัะตัะตะฝั?\n   - [ ] ะะดะฝะต ะฟัะดััะดะฝะต ัะตัะตะฝะฝั\n   - [x] ะะฒะฐ ะฟัะดััะดะฝะธั ัะตัะตะฝะฝั\n   - [ ] ะขัะธ ะฟัะดััะดะฝะธั ัะตัะตะฝะฝั\n   - [ ] ะะตะผะฐั ะฟัะดััะดะฝะธั ัะตัะตะฝั\n   > ยซะฉะพะฑ ั ะบัะฟะธะฒยป ั ยซัะบะธะน ะฟะตัะตยป โ ะดะฒะฐ ะฟัะดััะดะฝะธั.\n\n---\n\n## match-up: ะ'ัะดะฝะฐะนัะต ัะธะฟ ัะตัะตะฝะฝั ะท ะนะพะณะพ ััะฝะบัััั\n\n- ะฟัะธัะธะฝะพะฒะต ะฟัะดััะดะฝะต :: ะฒัะดะฟะพะฒัะดะฐั ะฝะฐ ะฟะธัะฐะฝะฝั ยซัะพะผั?ยป\n- ัะฐัะพะฒะต ะฟัะดััะดะฝะต :: ะฒัะดะฟะพะฒัะดะฐั ะฝะฐ ะฟะธัะฐะฝะฝั ยซะบะพะปะธ?ยป\n- ัะผะพะฒะฝะต ะฟัะดััะดะฝะต :: ะฒัะดะฟะพะฒัะดะฐั ะฝะฐ ะฟะธัะฐะฝะฝั ยซะทะฐ ัะบะพั ัะผะพะฒะธ?ยป\n- ะพะทะฝะฐัะฐะปัะฝะต ะฟัะดััะดะฝะต :: ะฒัะดะฟะพะฒัะดะฐั ะฝะฐ ะฟะธัะฐะฝะฝั ยซัะบะธะน?ยป\n- ะท'ัััะฒะฐะปัะฝะต ะฟัะดััะดะฝะต :: ะฒัะดะฟะพะฒัะดะฐั ะฝะฐ ะฟะธัะฐะฝะฝั ยซัะพ?ยป\n- ะดะพะฟัััะพะฒะต ะฟัะดััะดะฝะต :: ะฒัะดะฟะพะฒัะดะฐั ะฝะฐ ะฟะธัะฐะฝะฝั ยซะฝะตะทะฒะฐะถะฐััะธ ะฝะฐ ัะพ?ยป\n- ััััะดะฝะต ะทั ัะฟะพะปััะฝะธะบะพะผ ยซัยป :: ัะดะฝะฐะปัะฝะธะน ะทะฒ'ัะทะพะบ ะผัะถ ัะฐััะธะฝะฐะผะธ\n- ััััะดะฝะต ะทั ัะฟะพะปััะฝะธะบะพะผ ยซะฐะปะตยป :: ะฟัะพัะธััะฐะฒะฝะธะน ะทะฒ'ัะทะพะบ\n- ััััะดะฝะต ะทั ัะฟะพะปััะฝะธะบะพะผ ยซะฐยป :: ะทัััะฐะฒะฝะธะน ะทะฒ'ัะทะพะบ\n- ััััะดะฝะต ะทั ัะฟะพะปััะฝะธะบะพะผ ยซะฐะฑะพยป :: ะฐะปััะตัะฝะฐัะธะฒะฝะธะน ะทะฒ'ัะทะพะบ\n- ะดะฒะพััะฒะฝะตะฒะฐ ะฟัะดััะดะฝัััั :: ะฟัะดััะดะฝะต ะทะฐะปะตะถะธัั ะฒัะด ะฟัะดััะดะฝะพะณะพ\n- ะบะพะผะฑัะฝะพะฒะฐะฝะธะน ะทะฒ'ัะทะพะบ :: ััััะดะฝัััั ะฟะปัั ะฟัะดััะดะฝัััั ัะฐะทะพะผ\n\n---\n\n## fill-in: ะะพะฟะพะฒะฝััั ัะตัะตะฝะฝั ะฟัะฐะฒะธะปัะฝะธะผ ัะฟะพะปััะฝะธะบะพะผ\n\n1. ะัะฝ ะฝะต ะฟัะธะนัะพะฒ, ___ ะทะฐัะฒะพััะฒ ะฝะฐะฟะตัะตะดะพะดะฝั.\n   > [!answer] ัะพะผั ัะพ\n   > [!options] ัะพะผั ัะพ | ั | ะฐ | ะฐะฑะพ\n\n2. ะะฐะผะฐ ะณะพััั, ___ ัะฐัะพ ะฟัะธะฑะธัะฐั ะบัะผะฝะฐัั.\n   > [!answer] ะฐ\n   > [!options] ะฐ | ัะพะผั ัะพ | ัะบัะพ | ะบะพะปะธ\n\n3. ะฏ ะทะฝะฐั, ___ ะฒัะฝ ะฟัะธัะดะต ะทะฐะฒััะฐ ะฒัะฐะฝัั.\n   > [!answer] ัะพ\n   > [!options] ัะพ | ะบะพะปะธ | ัะพะผั ัะพ | ัะบัะพ\n\n4. ___ ัะพะฝัะต ะทะฐะนัะปะพ, ะผะธ ะฟััะปะธ ะดะพะดะพะผั.\n   > [!answer] ะะพะปะธ\n   > [!options] ะะพะปะธ | ะขะพะผั ัะพ | ะฉะพ | ะะปะต\n\n5. ะะฝะธะณะฐ, ___ ัะธ ะดะฐะฒ ะผะตะฝั, ะดัะถะต ััะบะฐะฒะฐ.\n   > [!answer] ัะบั\n   > [!options] ัะบั | ัะพ | ะบะพะปะธ | ัะพะผั ัะพ\n\n6. ___ ะฑัะดะต ัะฐั, ะทะฐัะตะปะตัะพะฝัั ัะพะฑั ะฒะฒะตัะตัั.\n   > [!answer] ะฏะบัะพ\n   > [!options] ะฏะบัะพ | ะะพะปะธ | ะขะพะผั ัะพ | ะฉะพ\n\n7. ะัะฝ ัะพััะฒ ะดะพะฟะพะผะพะณัะธ, ___ ะฝะต ะทะฝะฐะฒ ัะบ.\n   > [!answer] ะฐะปะต\n   > [!options] ะฐะปะต | ั | ะฐะฑะพ | ัะพ\n\n8. ___ ะฒัะฝ ะฟะพะฟัะพัะธะฒ, ะผะธ ะดะพะฟะพะผะพะณะปะธ ะนะพะผั.\n   > [!answer] ะัะบัะปัะบะธ\n   > [!options] ะัะบัะปัะบะธ | ะฉะพ | ะฏะบะธะน | ะะปะต\n\n---\n\n## true-false: ะัะฐะฒะดะฐ ัะธ ะฝะตะฟัะฐะฒะดะฐ?\n\n1. ะกัััะดะฝะธะน ะทะฒ'ัะทะพะบ ะฟะพัะดะฝัั ััะฒะฝะพะฟัะฐะฒะฝั ัะฐััะธะฝะธ ัะตัะตะฝะฝั.\n   - [x] ะัะฐะฒะดะฐ\n   - [ ] ะะตะฟัะฐะฒะดะฐ\n\n2. ะัะดััะดะฝะต ัะตัะตะฝะฝั ะทะฐะฒะถะดะธ ััะพััั ะฟะตัะตะด ะณะพะปะพะฒะฝะธะผ.\n   - [ ] ะัะฐะฒะดะฐ\n   - [x] ะะตะฟัะฐะฒะดะฐ\n\n3. ะกะฟะพะปััะฝะธะบ ยซะฐยป ะฒะธัะฐะถะฐั ะฟัะพัะธััะฐะฒะปะตะฝะฝั.\n   - [ ] ะัะฐะฒะดะฐ\n   - [x] ะะตะฟัะฐะฒะดะฐ\n\n4. ะะทะฝะฐัะฐะปัะฝะต ะฟัะดััะดะฝะต ะฒัะดะฟะพะฒัะดะฐั ะฝะฐ ะฟะธัะฐะฝะฝั ยซัะบะธะน?ยป.\n   - [x] ะัะฐะฒะดะฐ\n   - [ ] ะะตะฟัะฐะฒะดะฐ\n\n5. ะ ะพะดะฝะพะผั ัะตัะตะฝะฝั ะผะพะถะต ะฑััะธ ััะปัะบะธ ะพะดะฝะต ะฟัะดััะดะฝะต.\n   - [ ] ะัะฐะฒะดะฐ\n   - [x] ะะตะฟัะฐะฒะดะฐ\n\n6. ะะฒะพััะฒะฝะตะฒะฐ ะฟัะดััะดะฝัััั โ ัะต ะบะพะปะธ ะฟัะดััะดะฝะต ะทะฐะปะตะถะธัั ะฒัะด ะฟัะดััะดะฝะพะณะพ.\n   - [x] ะัะฐะฒะดะฐ\n   - [ ] ะะตะฟัะฐะฒะดะฐ\n\n7. ะกะฟะพะปััะฝะธะบ ยซัะพะผั ัะพยป ะฒะฒะพะดะธัั ัะฐัะพะฒะต ะฟัะดััะดะฝะต ัะตัะตะฝะฝั.\n   - [ ] ะัะฐะฒะดะฐ\n   - [x] ะะตะฟัะฐะฒะดะฐ\n\n8. ะกัััะดะฝัััั ั ะฟัะดััะดะฝัััั ะผะพะถะฝะฐ ะฟะพัะดะฝัะฒะฐัะธ ะฒ ะพะดะฝะพะผั ัะตัะตะฝะฝั.\n   - [x] ะัะฐะฒะดะฐ\n   - [ ] ะะตะฟัะฐะฒะดะฐ\n\n---\n\n## group-sort: ะะพะทะฟะพะดัะปััั ัะฟะพะปััะฝะธะบะธ ะทะฐ ัะธะฟะพะผ ะทะฒ'ัะทะบั\n\n### ะกัััะดะฝั (ััะฒะฝะพะฟัะฐะฒะฝั ัะฐััะธะฝะธ)\n- ั\n- ัะฐ\n- ะฐ\n- ะฐะปะต\n- ะฟัะพัะต\n- ะฐะฑะพ\n\n### ะัะดััะดะฝั ะฟัะธัะธะฝะพะฒั\n- ัะพะผั ัะพ\n- ะฑะพ\n- ะพัะบัะปัะบะธ\n- ัะตัะตะท ัะต ัะพ\n\n### ะัะดััะดะฝั ัะฐัะพะฒั\n- ะบะพะปะธ\n- ะฟััะปั ัะพะณะพ ัะบ\n- ะฟะตัั ะฝัะถ\n- ะฟะพะบะธ\n\n### ะัะดััะดะฝั ะพะทะฝะฐัะฐะปัะฝั\n- ัะบะธะน\n- ัะบะฐ\n- ัะบะต\n- ะบะพััะธะน\n\n---\n\n## unjumble: ะกะบะปะฐะดััั ัะตัะตะฝะฝั ะท ัะพะทัะธะฟะฐะฝะธั ัะปัะฒ\n\n1. ะฒัะฝ / ะฟัะธะนัะพะฒ / , / ะบะพะปะธ / ั / ัะธัะฐะฒ / ะบะฝะธะณั / ััะบะฐะฒั / , / ัะบั / ัะธ / ะฟะพะดะฐััะฒะฐะฒ / ะผะตะฝั\n   > [!answer] ะัะฝ ะฟัะธะนัะพะฒ, ะบะพะปะธ ั ัะธัะฐะฒ ััะบะฐะฒั ะบะฝะธะณั, ัะบั ัะธ ะผะตะฝั ะฟะพะดะฐััะฒะฐะฒ.\n\n2. ัะพะผั / ัะพ / ะฝะฐะฟะตัะตะดะพะดะฝั / ะทะฐัะฒะพััะฒ / , / ะฒัะฝ / ะฝะต / ะฟัะธะนัะพะฒ / ะฝะฐ / ะฒะฐะถะปะธะฒั / ะทัััััั / ััะพัะฐ\n   > [!answer] ะัะฝ ะฝะต ะฟัะธะนัะพะฒ ะฝะฐ ะฒะฐะถะปะธะฒั ะทัััััั ััะพัะฐ, ัะพะผั ัะพ ะฝะฐะฟะตัะตะดะพะดะฝั ะทะฐัะฒะพััะฒ.\n\n3. ะผะฐะผะฐ / ะณะพััั / ัะผะฐัะฝั / ะฒะตัะตัั / , / ั / ัะฐัะพ / ะดะพะฟะพะผะฐะณะฐั / ัะน / ะฝะฐ / ะบััะฝั / ะบะพะถะฝะพะณะพ / ะฒะตัะพัะฐ\n   > [!answer] ะะฐะผะฐ ะณะพััั ัะผะฐัะฝั ะฒะตัะตัั, ั ัะฐัะพ ะดะพะฟะพะผะฐะณะฐั ัะน ะฝะฐ ะบััะฝั ะบะพะถะฝะพะณะพ ะฒะตัะพัะฐ.\n\n4. ัะบัะพ / ะทะฐะฒััะฐ / ะฑัะดะต / ะฒัะปัะฝะธะน / ัะฐั / , / ะผะธ / ะฟะพะณะพะฒะพัะธะผะพ / ะฟัะพ / ะฒัะต / , / ัะพ / ััะฐะปะพัั / ััะพะณะพะดะฝั\n   > [!answer] ะฏะบัะพ ะทะฐะฒััะฐ ะฑัะดะต ะฒัะปัะฝะธะน ัะฐั, ะผะธ ะฟะพะณะพะฒะพัะธะผะพ ะฟัะพ ะฒัะต, ัะพ ััะฐะปะพัั ััะพะณะพะดะฝั.\n\n5. ะบะพะปะธ / ะฒัะฝ / ะฟัะธััะฐะฒ / , / ะผะธ / ะฒะถะต / ัะฟะฐะปะธ / , / ะฑะพ / ะดัะถะต / ะฒัะพะผะธะปะธัั / ะฟััะปั / ัะพะฑะพัะธ\n   > [!answer] ะะพะปะธ ะฒัะฝ ะฟัะธััะฐะฒ, ะผะธ ะฒะถะต ัะฟะฐะปะธ, ะฑะพ ะดัะถะต ะฒัะพะผะธะปะธัั ะฟััะปั ัะพะฑะพัะธ.\n\n6. ะบะฝะธะณะฐ / , / ัะบั / ัะธ / ะดะฐะฒ / ะผะตะฝั / ะฒัะพัะฐ / , / ะฒะธัะฒะธะปะฐัั / ะดัะถะต / ััะบะฐะฒะพั / ัะฐ / ะทะฐัะพะฟะปะธะฒะพั\n   > [!answer] ะะฝะธะณะฐ, ัะบั ัะธ ะดะฐะฒ ะผะตะฝั ะฒัะพัะฐ, ะฒะธัะฒะธะปะฐัั ะดัะถะต ััะบะฐะฒะพั ัะฐ ะทะฐัะพะฟะปะธะฒะพั.\n\n---\n\n## error-correction: ะะฝะฐะนะดััั ั ะฒะธะฟัะฐะฒัะต ะฟะพะผะธะปะบั\n\n1. ะัะฝ ัะบะฐะทะฐะฒ ัะพะผั ัะพ ัะฒะพัะธะน ัะพ ะฝะต ะฟัะธะนะดะต ะทะฐะฒััะฐ.\n   > [!error] ัะพะผั ัะพ ัะฒะพัะธะน ัะพ\n   > [!answer] ัะพ ะฝะต ะฟัะธะนะดะต, ัะพะผั ัะพ ัะฒะพัะธะน\n   > [!options] ัะพ ะฝะต ะฟัะธะนะดะต, ัะพะผั ัะพ ัะฒะพัะธะน | ัะพะผั ัะฒะพัะธะน ัะพ | ัะฒะพัะธะน ัะพ ัะพะผั | ัะพ ัะพะผั ัะฒะพัะธะน\n   > [!explanation] ะัะฐะฒะธะปัะฝะธะน ะฟะพััะดะพะบ: ะท'ัััะฒะฐะปัะฝะต ะฟะตัะตะด ะฟัะธัะธะฝะพะฒะธะผ.\n\n2. ะฏ ะทะฝะฐั ัะพ ะฒัะฝ ะฟัะธะนะดะต ะบะพะปะธ ะทะฐะบัะฝัะธัั.\n   > [!error] ะทะฝะฐั ัะพ\n   > [!answer] ะทะฝะฐั, ัะพ\n   > [!options] ะทะฝะฐั, ัะพ | ะทะฝะฐั: ัะพ | ะทะฝะฐั-ัะพ | ะทะฝะฐั โ ัะพ\n   > [!explanation] ะะพัััะฑะฝะฐ ะบะพะผะฐ ะฟะตัะตะด ะฟัะดััะดะฝะธะผ.\n\n3. ะะพะปะธ ะฒัะฝ ะฟัะธะนัะพะฒ ั ะผะธ ะฟะพะณะพะฒะพัะธะปะธ.\n   > [!error] ะะพะปะธ ะฒัะฝ ะฟัะธะนัะพะฒ ั\n   > [!answer] ะะพะปะธ ะฒัะฝ ะฟัะธะนัะพะฒ,\n   > [!options] ะะพะปะธ ะฒัะฝ ะฟัะธะนัะพะฒ, | ะะพะปะธ ะฒัะฝ ะฟัะธะนัะพะฒ: | ะัะธะนัะพะฒ ะบะพะปะธ | ะัะฝ ะบะพะปะธ ะฟัะธะนัะพะฒ\n   > [!explanation] ะะพะผะฐ ะฒัะดะดัะปัั ะฟัะดััะดะฝะต ะฒัะด ะณะพะปะพะฒะฝะพะณะพ.\n\n4. ะขะพะผั ัะพ ะฟะพะณะพะดะฐ ะณะฐัะฝะฐ ะฐะปะต ะผะธ ะทะฐะปะธัะธะปะธัั ะฒะดะพะผะฐ.\n   > [!error] ะขะพะผั ัะพ ะฟะพะณะพะดะฐ ะณะฐัะฝะฐ ะฐะปะต\n   > [!answer] ะฅะพัะฐ ะฟะพะณะพะดะฐ ะณะฐัะฝะฐ,\n   > [!options] ะฅะพัะฐ ะฟะพะณะพะดะฐ ะณะฐัะฝะฐ, | ะะพะณะพะดะฐ ะณะฐัะฝะฐ ัะพะผั | ะะปะต ะฟะพะณะพะดะฐ ัะพะผั | ะขะพะผั ะฐะปะต ะฟะพะณะพะดะฐ\n   > [!explanation] ยซะขะพะผั ัะพยป โ ะฟัะธัะธะฝะฐ, ะฐ ะฟะพัััะฑะฝะพ ะดะพะฟัััะพะฒะต ยซัะพัะฐยป.\n\n5. ะัะฝ ะฟัะธะนัะพะฒ, ัะบะพะณะพ ะผะธ ัะตะบะฐะปะธ, ะบะพะปะธ ะฟะพะทะฒะพะฝะธะฒ ะดะทะฒัะฝะพะบ.\n   > [!error] ัะบะพะณะพ ะผะธ ัะตะบะฐะปะธ, ะบะพะปะธ\n   > [!answer] ะฝะฐ ัะบะพะณะพ ะผะธ ัะตะบะฐะปะธ, ะบะพะปะธ\n   > [!options] ะฝะฐ ัะบะพะณะพ ะผะธ ัะตะบะฐะปะธ, ะบะพะปะธ | ัะตะบะฐะปะธ ัะบะพะณะพ ะบะพะปะธ | ะบะพะปะธ ัะบะพะณะพ ัะตะบะฐะปะธ | ัะบะพะณะพ ะบะพะปะธ ัะตะบะฐะปะธ\n   > [!explanation] ะะพัััะฑะตะฝ ะฟัะธะนะผะตะฝะฝะธะบ ยซะฝะฐยป ะท ะดะฐะฒะฐะปัะฝะธะผ ะฒัะดะผัะฝะบะพะผ.\n\n6. ะะฐะผะฐ ัะบะฐะทะฐะปะฐ ัะพะฑ ั ะบัะฟะธะฒ ัะปัะฑ ัะบะธะน ัะฒัะถะธะน.\n   > [!error] ัะปัะฑ ัะบะธะน ัะฒัะถะธะน\n   > [!answer] ัะฒัะถะธะน ัะปัะฑ\n   > [!options] ัะฒัะถะธะน ัะปัะฑ | ัะปัะฑ ัะฒัะถะธะน | ัะบะธะน ัะปัะฑ ัะฒัะถะธะน | ัะฒัะถะธะน ัะบะธะน ัะปัะฑ\n   > [!explanation] ะัะธะบะผะตัะฝะธะบ ะฟะตัะตะด ัะผะตะฝะฝะธะบะพะผ, ะฑะตะท ะทะฐะนะฒะพะณะพ ะฟัะดััะดะฝะพะณะพ.\n\n---\n\n## cloze: ะะฐะฟะพะฒะฝััั ะฟัะพะฟััะบะธ ะฒ ัะตะบััั\n\nะะธะฝัะปะพะณะพ ัะธะถะฝั ั ะฒะธัััะธะฒ ะฒัะดะฒัะดะฐัะธ ะดััะณะฐ. (1)___ ั ะฟัะธััะฐะฒ ะดะพ ะนะพะณะพ ะดะพะผั, ะฟะพะฑะฐัะธะฒ, (2)___ ะฒัะบะฝะฐ ะทะฐัะธะฝะตะฝั. ะะฐัะตะปะตัะพะฝัะฒะฐะฒ ะนะพะผั, (3)___ ะฒัะฝ ะฝะต ะฒัะดะฟะพะฒัะดะฐะฒ. ะะพัะตะบะฐะฒ ะฟัะฒะณะพะดะธะฝะธ, (4)___ ะฒะธัััะธะฒ ะฟััะธ, (5)___ ะฒะถะต ะฑัะปะพ ะฟัะทะฝะพ.\n\n(6)___ ั ะนัะพะฒ ะดะพะดะพะผั, ะทัััััะฒ ััััะดะฐ, (7)___ ัะบะฐะทะฐะฒ, (8)___ ะดััะณ ะฟะพััะฐะฒ ั ะฒัะดััะดะถะตะฝะฝั. (9)___ ั ะฝะต ะทะฝะฐะฒ ะฟัะพ ัะต, ะดัะถะต ะทะดะธะฒัะฒะฐะฒัั.\n\n(10)___ ะฒัะฝ ะฟะพะฒะตัะฝะตัััั, ะพะฑะพะฒ'ัะทะบะพะฒะพ ะทัััััะฝะตะผะพัั. (11)___ ะฑัะดะต ัะฐั, ะฟะพะณะพะฒะพัะธะผะพ ะฟัะพ ะฒัะต. ะฏ ัะฟะพะดัะฒะฐััั, (12)___ ะฒัะฝ ะฟัะธะฒะตะทะต ััะบะฐะฒั ัััะพััั, (13)___ ะฒัะฝ ะทะฐะฒะถะดะธ ัะพะทะฟะพะฒัะดะฐั ะฟััะปั ะฟะพะดะพัะพะถะตะน. (14)___ ะผะธ ะดะฐะฒะฝะพ ะฝะต ะฑะฐัะธะปะธัั, ะฑัะดะต ะฑะฐะณะฐัะพ (15)___ ะพะฑะณะพะฒะพัะธัะธ ัะฐะทะพะผ.\n\n- (1) :: ะะพะปะธ | ะขะพะผั ัะพ | ะะปะต | ะะฑะพ\n- (2) :: ัะพ | ัะบะธะน | ะบะพะปะธ | ะฐะปะต\n- (3) :: ะฐะปะต | ั | ัะพ | ัะบะธะน\n- (4) :: ั | ะฐะปะต | ัะพ | ัะบะธะน\n- (5) :: ัะพะผั ัะพ | ั | ะฐ | ัะบะธะน\n- (6) :: ะะพะปะธ | ะขะพะผั ัะพ | ะฉะพ | ะฏะบะธะน\n- (7) :: ัะบะธะน | ัะพ | ะบะพะปะธ | ะฐะปะต\n- (8) :: ัะพ | ัะบะธะน | ะบะพะปะธ | ัะพะผั ัะพ\n- (9) :: ะัะบัะปัะบะธ | ะฉะพ | ะฏะบะธะน | ะะพะปะธ\n- (10) :: ะะพะปะธ | ะขะพะผั ัะพ | ะฉะพ | ะะปะต\n- (11) :: ะฏะบัะพ | ะขะพะผั ัะพ | ะฉะพ | ะฅะพัะฐ\n- (12) :: ัะพ | ัะบะธะน | ะบะพะปะธ | ะฐะปะต\n- (13) :: ัะบั | ัะพ | ะบะพะปะธ | ัะพะผั ัะพ\n- (14) :: ะัะบัะปัะบะธ | ะฉะพ | ะฏะบะธะน | ะะพะปะธ\n- (15) :: ัะพ | ัะบะธะน | ะบะพะปะธ | ะดะต\n\n---\n\n## mark-the-words: ะะพะทะฝะฐััะต ะฟัะดััะดะฝั ัะฟะพะปััะฝะธะบะธ\n\nะัะฝ ะฟัะธะนัะพะฒ, [ะบะพะปะธ] ัะพะฝัะต ะทะฐะนัะปะพ. ะะธ ัะฐะดั, [ัะพ] ะฒัะฝ ะฟัะธััะฐะฒ. [ะขะพะผั ัะพ] ะฑัะปะพ ะฟัะทะฝะพ, ะฒัั ะฒัะพะผะธะปะธัั. ะะฝะธะณะฐ, [ัะบั] ั ัะธัะฐะฒ, ััะบะฐะฒะฐ. [ะฏะบัะพ] ะผะฐัะธะผะตั ัะฐั, ะทะฐัะตะปะตัะพะฝัะน. [ะฅะพัะฐ] ะฒัะฝ ัะฒะพัะธะน, ะฒัะต ะพะดะฝะพ ะฟัะธะนัะพะฒ. [ะััะปั ัะพะณะพ ัะบ] ะทะฐะบัะฝัะธะฒ, ะฟััะพะฒ. [ะะตัั ะฝัะถ] ะฟััะธ, ะฟะพะฟัะพัะฐะฒัั. [ะัะบัะปัะบะธ] ะฒัั ะฟะพะณะพะดะธะปะธัั, ัััะตะฝะฝั ะฟัะธะนะฝัะปะธ.\n\n---\n\n## dialogue-reorder: ะะฟะพััะดะบัะนัะต ะดัะฐะปะพะณ\n\n- ะขะพะผั ัะพ ะบะพะปะธ ั ะฒะธัะพะดะธะฒ, ะทะฐัะตะปะตัะพะฝัะฒะฐะปะฐ ะผะฐะผะฐ, ัะบะฐ ะฑัะปะฐ ัะฒะพัะฐ.\n- ะงะพะผั ัะธ ะฝะต ะฟัะธะนัะพะฒ ะฒัะพัะฐ ะฝะฐ ะฝะฐัั ะทัััััั?\n- ะะพะฑัะต, ะฑะพ ะผะธ ัะฒะธะปัะฒะฐะปะธัั ะทะฐ ัะฒะพั ะผะฐะผั.\n- ะัะพะทัะผัะปะพ. ะฏะบะฑะธ ัะธ ะฟะพะฟะตัะตะดะธะฒ, ะผะธ ะฑ ะฟะตัะตะฝะตัะปะธ.\n- ะะพะปะธ ะฒัะต ะฑัะดะต ะณะฐัะฐะทะด, ะพะฑะพะฒ'ัะทะบะพะฒะพ ะทัััััะฝะตะผะพัั ะทะฝะพะฒั.\n- ะัะบัั, ัะพ ัะพะทัะผัััะต ะผะพั ัะธััะฐััั ัะท ะผะฐะผะพั.\n\n> [!answer]\n> 1. ะงะพะผั ัะธ ะฝะต ะฟัะธะนัะพะฒ ะฒัะพัะฐ ะฝะฐ ะฝะฐัั ะทัััััั?\n> 2. ะขะพะผั ัะพ ะบะพะปะธ ั ะฒะธัะพะดะธะฒ, ะทะฐัะตะปะตัะพะฝัะฒะฐะปะฐ ะผะฐะผะฐ, ัะบะฐ ะฑัะปะฐ ัะฒะพัะฐ.\n> 3. ะัะพะทัะผัะปะพ. ะฏะบะฑะธ ัะธ ะฟะพะฟะตัะตะดะธะฒ, ะผะธ ะฑ ะฟะตัะตะฝะตัะปะธ.\n> 4. ะัะบัั, ัะพ ัะพะทัะผัััะต ะผะพั ัะธััะฐััั ัะท ะผะฐะผะพั.\n> 5. ะะพะฑัะต, ะฑะพ ะผะธ ัะฒะธะปัะฒะฐะปะธัั ะทะฐ ัะฒะพั ะผะฐะผั.\n> 6. ะะพะปะธ ะฒัะต ะฑัะดะต ะณะฐัะฐะทะด, ะพะฑะพะฒ'ัะทะบะพะฒะพ ะทัััััะฝะตะผะพัั ะทะฝะพะฒั.\n\n---\n\n## select: ะะธะฑะตัััั ััั ะณัะฐะผะฐัะธัะฝะพ ะฟัะฐะฒะธะปัะฝั ัะบะปะฐะดะฝั ัะตัะตะฝะฝั\n\n- [x] ะะพะปะธ ะฒัะฝ ะฟัะธะนัะพะฒ, ะผะธ ะฒะถะต ะฒะตัะตััะปะธ.\n- [ ] ะัะฝ ะฟัะธะนัะพะฒ ะบะพะปะธ ะผะธ ะฒะตัะตััะปะธ.\n- [x] ะฏ ะทะฝะฐั, ัะพ ะฒัะฝ ะฟัะธัะดะต ะทะฐะฒััะฐ.\n- [ ] ะฏ ะทะฝะฐั ัะพ ะฒัะฝ ะฟัะธัะดะต.\n- [x] ะัะฝ ะฝะต ะฟัะธะนัะพะฒ, ัะพะผั ัะพ ะทะฐัะฒะพััะฒ.\n- [ ] ะขะพะผั ัะพ ะฒัะฝ ะฝะต ะฟัะธะนัะพะฒ ะทะฐัะฒะพััะฒ.\n- [x] ะะฝะธะณะฐ, ัะบั ัะธ ะดะฐะฒ, ััะบะฐะฒะฐ.\n- [ ] ะะฝะธะณะฐ ัะบั ัะธ ะดะฐะฒ ััะบะฐะฒะฐ.\n- [x] ะฏะบัะพ ะฑัะดะต ัะฐั, ะทะฐัะตะปะตัะพะฝัั.\n- [ ] ะฏะบัะพ ะฑัะดะต ัะฐั ะทะฐัะตะปะตัะพะฝัั.\n- [x] ะะฐะผะฐ ะณะพััั, ั ัะฐัะพ ะดะพะฟะพะผะฐะณะฐั.\n- [x] ะัะฝ ัะพััะฒ ะดะพะฟะพะผะพะณัะธ, ะฐะปะต ะฝะต ะทะฝะฐะฒ ัะบ.\n\n---\n\n## translate: ะะตัะตะบะปะฐะดััั ะฝะฐ ัะบัะฐัะฝััะบั ะผะพะฒั\n\n1. When he arrived, we were already sleeping because we were tired.\n   - [x] ะะพะปะธ ะฒัะฝ ะฟัะธััะฐะฒ, ะผะธ ะฒะถะต ัะฟะฐะปะธ, ะฑะพ ะฒัะพะผะธะปะธัั.\n   - [ ] ะัะฝ ะฟัะธััะฐะฒ ะบะพะปะธ ะผะธ ัะฟะฐะปะธ ะฑะพ ะฒัะพะผะธะปะธัั.\n   - [ ] ะขะพะผั ัะพ ะฒัะฝ ะฟัะธััะฐะฒ ะผะธ ัะฟะฐะปะธ.\n   - [ ] ะะพะปะธ ะฒัะฝ ะฑะพ ะฟัะธััะฐะฒ ะผะธ ัะฟะฐะปะธ.\n\n2. I know that he will come if he has time tomorrow.\n   - [x] ะฏ ะทะฝะฐั, ัะพ ะฒัะฝ ะฟัะธะนะดะต, ัะบัะพ ะผะฐัะธะผะต ัะฐั ะทะฐะฒััะฐ.\n   - [ ] ะฏ ะทะฝะฐั ะฒัะฝ ะฟัะธะนะดะต ัะบัะพ ัะฐั.\n   - [ ] ะัะฝ ะฟัะธะนะดะต ัะพ ั ะทะฝะฐั ัะบัะพ ัะฐั.\n   - [ ] ะฏะบัะพ ัะฐั ะฒัะฝ ะฟัะธะนะดะต ัะพ ะทะฝะฐั.\n\n3. The book that you gave me is very interesting and educational.\n   - [x] ะะฝะธะณะฐ, ัะบั ัะธ ะผะตะฝั ะดะฐะฒ, ะดัะถะต ััะบะฐะฒะฐ ั ะฟะพะฒัะฐะปัะฝะฐ.\n   - [ ] ะะฝะธะณะฐ ัะบั ะดะฐะฒ ััะบะฐะฒะฐ.\n   - [ ] ะขะธ ะดะฐะฒ ะบะฝะธะณะฐ ัะบั ััะบะฐะฒะฐ.\n   - [ ] ะฏะบั ะบะฝะธะณะฐ ัะธ ะดะฐะฒ ััะบะฐะฒะฐ.\n\n4. He didn't come because he was sick, although he wanted to.\n   - [x] ะัะฝ ะฝะต ะฟัะธะนัะพะฒ, ัะพะผั ัะพ ะทะฐัะฒะพััะฒ, ัะพัะฐ ัะพััะฒ.\n   - [ ] ะขะพะผั ัะพ ะฒัะฝ ะฝะต ะฟัะธะนัะพะฒ ัะฒะพัะธะน ัะพัะฐ.\n   - [ ] ะฅะพัะฐ ัะพััะฒ ะฒัะฝ ะฝะต ะฟัะธะนัะพะฒ ัะพะผั.\n   - [ ] ะัะฝ ัะพััะฒ ะฝะต ะฟัะธะนัะพะฒ ัะพะผั ัะพัะฐ.\n\n5. When I finish work, I will call you if it's not too late.\n   - [x] ะะพะปะธ ะทะฐะบัะฝัั ัะพะฑะพัั, ะทะฐัะตะปะตัะพะฝัั, ัะบัะพ ะฝะต ะฑัะดะต ะฝะฐะดัะพ ะฟัะทะฝะพ.\n   - [ ] ะะฐะบัะฝัั ัะพะฑะพัั ะบะพะปะธ ะทะฐัะตะปะตัะพะฝัั ัะบัะพ.\n   - [ ] ะฏะบัะพ ะบะพะปะธ ะทะฐะบัะฝัั ะทะฐัะตะปะตัะพะฝัั.\n   - [ ] ะะพะฑะพัั ะทะฐะบัะฝัั ะบะพะปะธ ะทะฐัะตะปะตัะพะฝัั.\n\n6. She said that she would come after she finished her project.\n   - [x] ะะพะฝะฐ ัะบะฐะทะฐะปะฐ, ัะพ ะฟัะธะนะดะต, ะฟััะปั ัะพะณะพ ัะบ ะทะฐะบัะฝัะธัั ะฟัะพะตะบั.\n   - [ ] ะกะบะฐะทะฐะปะฐ ะฒะพะฝะฐ ัะพ ะฟัะธะนะดะต ะฟััะปั ะฟัะพะตะบั.\n   - [ ] ะััะปั ัะพะณะพ ะฟัะธะนะดะต ัะพ ัะบะฐะทะฐะปะฐ.\n   - [ ] ะัะพะตะบั ะทะฐะบัะฝัะธัั ัะพ ะฟัะธะนะดะต ัะบะฐะทะฐะปะฐ.\n\n---\n\n# ะกะปะพะฒะฝะธะบ\n\n| ะกะปะพะฒะพ | ะะธะผะพะฒะฐ | ะะตัะตะบะปะฐะด | ะงะ | ะัะธะผััะบะฐ |\n|-------|--------|----------|-----|----------|\n| **ััััะดะฝะธะน** | /suหrสฒษdnษชj/ | coordinate | ะฟัะธะบะผ. | ััะฒะฝะพะฟัะฐะฒะฝะธะน ะทะฒ'ัะทะพะบ |\n| **ะฟัะดััะดะฝะธะน** | /pสฒidหrสฒษdnษชj/ | subordinate | ะฟัะธะบะผ. | ะทะฐะปะตะถะฝะธะน ะทะฒ'ัะทะพะบ |\n| **ัะธะฝัะฐะบัะธั** | /sษชnหtษksษชs/ | syntax | ัะผ. (ั.ั.) | ะฑัะดะพะฒะฐ ัะตัะตะฝั |\n| **ะณะพะปะพะฒะฝะต ัะตัะตะฝะฝั** | /ษฆษlษwหnษ หrษtสษnสฒษ/ | main clause | ะฒะธัะฐะท | ะฝะตะทะฐะปะตะถะฝะฐ ัะฐััะธะฝะฐ |\n| **ะฟัะดััะดะฝะต ัะตัะตะฝะฝั** | /pสฒidหrสฒษdnษ หrษtสษnสฒษ/ | subordinate clause | ะฒะธัะฐะท | ะทะฐะปะตะถะฝะฐ ัะฐััะธะฝะฐ |\n| **ัะฟะพะปััะฝะธะบ** | /spษหlutสnษชk/ | conjunction | ัะผ. (ั.ั.) | ะท'ัะดะฝัั ัะฐััะธะฝะธ |\n| **ัะดะฝะฐะปัะฝะธะน** | /jษdหnษlสฒnษชj/ | copulative, joining | ะฟัะธะบะผ. | ั, ัะฐ, ะน |\n| **ะทัััะฐะฒะปะตะฝะฝั** | /zสฒistษwหlษnสฒษ/ | comparison | ัะผ. (ั.ั.) | ะฐ, ะถ |\n| **ะฟัะพัะธััะฐะฒะปะตะฝะฝั** | /prษtษชstษwหlษnสฒษ/ | contrast | ัะผ. (ั.ั.) | ะฐะปะต, ะฟัะพัะต |\n| **ะฟัะธัะธะฝะพะฒะต** | /prษชtสษชnษหwษ/ | causal | ะฟัะธะบะผ. | ัะพะผั ัะพ, ะฑะพ |\n| **ัะฐัะพะฒะต** | /tสษsษหwษ/ | temporal | ะฟัะธะบะผ. | ะบะพะปะธ, ะฟััะปั |\n| **ัะผะพะฒะฝะต** | /uหmษwnษ/ | conditional | ะฟัะธะบะผ. | ัะบัะพ, ัะบะฑะธ |\n| **ะพะทะฝะฐัะฐะปัะฝะต** | /ษznษtสษlสฒหnษ/ | attributive | ะฟัะธะบะผ. | ัะบะธะน, ัะพ |\n| **ะท'ัััะฒะฐะปัะฝะต** | /zjษsuหwษlสฒnษ/ | explanatory | ะฟัะธะบะผ. | ัะพ, ัะพะฑ |\n| **ะดะพะฟัััะพะฒะต** | /dษpusหtษwษ/ | concessive | ะฟัะธะบะผ. | ัะพัะฐ, ัะพั |\n| **ััะฒะตะฝั ะฟัะดััะดะฝะพััั** | /หrสฒiwษnสฒ pสฒidหrสฒษdnษstสฒi/ | level of subordination | ะฒะธัะฐะท | ะณะปะธะฑะธะฝะฐ ะทะฐะปะตะถะฝะพััั |\n| **ะดะฒะพััะฒะฝะตะฒะธะน** | /dwษหrสฒiwnษwษชj/ | two-level | ะฟัะธะบะผ. | ะดะฒะฐ ััะฒะฝั |\n| **ััะธััะฒะฝะตะฒะธะน** | /trษชหrสฒiwnษwษชj/ | three-level | ะฟัะธะบะผ. | ััะธ ััะฒะฝั |\n| **ะบะพะผะฑัะฝัะฒะฐะฝะฝั** | /kษmbสฒinuหwษnสฒษ/ | combining | ัะผ. (ั.ั.) | ะฟะพัะดะฝะฐะฝะฝั |\n| **ัะฝัะตะณัะฐััั** | /สฒintษษฆหrษtอกsสฒijษ/ | integration | ัะผ. (ะถ.ั.) | ะพะฑ'ัะดะฝะฐะฝะฝั |\n| **ะฟะพัะปัะดะพะฒะฝัััั** | /pษslสฒiหdษwnสฒistสฒ/ | sequence | ัะผ. (ะถ.ั.) | ะฟะพััะดะพะบ |\n| **ััััะบัััะฐ** | /strukหturษ/ | structure | ัะผ. (ะถ.ั.) | ะฑัะดะพะฒะฐ |\n| **ะบะพะผะฟะพะฝะตะฝั** | /kษmpษหnษnt/ | component | ัะผ. (ั.ั.) | ัะฐััะธะฝะฐ |\n| **ะปะพะณััะฝะธะน** | /lษหษฆสฒitสnษชj/ | logical | ะฟัะธะบะผ. | ัะพะทัะผะฝะธะน ะทะฒ'ัะทะพะบ |\n| **ะฐััััะตะบัััะฐ** | /ษrxสฒitษkหturษ/ | architecture | ัะผ. (ะถ.ั.) | ะฑัะดะพะฒะฐ, ััััะบัััะฐ |\n",
    "createdAt": "2025-12-25T19:48:31.857064Z",
    "modifiedAt": "2025-12-25T19:48:31.857064Z",
    "version": 2
  },
  "activities": [],
  "vocabulary": {
    "moduleId": "mod-uk-B1-38",
    "level": "B1",
    "phase": "B1.3b Complex Sentences",
    "wordCount": 25,
    "newWordCount": 25,
    "reviewWordCount": 0,
    "transliterationMode": "none",
    "words": [
      {
        "id": "vocab-1",
        "uk": "**ััััะดะฝะธะน**",
        "ipa": "/suหrสฒษdnษชj/",
        "en": "coordinate",
        "pos": "ะฟัะธะบะผ.",
        "gender": null,
        "note": ""
      },
      {
        "id": "vocab-2",
        "uk": "**ะฟัะดััะดะฝะธะน**",
        "ipa": "/pสฒidหrสฒษdnษชj/",
        "en": "subordinate",
        "pos": "ะฟัะธะบะผ.",
        "gender": null,
        "note": ""
      },
      {
        "id": "vocab-3",
        "uk": "**ัะธะฝัะฐะบัะธั**",
        "ipa": "/sษชnหtษksษชs/",
        "en": "syntax",
        "pos": "ัะผ. (ั.ั.)",
        "gender": null,
        "note": ""
      },
      {
        "id": "vocab-4",
        "uk": "**ะณะพะปะพะฒะฝะต ัะตัะตะฝะฝั**",
        "ipa": "/ษฆษlษwหnษ หrษtสษnสฒษ/",
        "en": "main clause",
        "pos": "ะฒะธัะฐะท",
        "gender": null,
        "note": ""
      },
      {
        "id": "vocab-5",
        "uk": "**ะฟัะดััะดะฝะต ัะตัะตะฝะฝั**",
        "ipa": "/pสฒidหrสฒษdnษ หrษtสษnสฒษ/",
        "en": "subordinate clause",
        "pos": "ะฒะธัะฐะท",
        "gender": null,
        "note": ""
      },
      {
        "id": "vocab-6",
        "uk": "**ัะฟะพะปััะฝะธะบ**",
        "ipa": "/spษหlutสnษชk/",
        "en": "conjunction",
        "pos": "ัะผ. (ั.ั.)",
        "gender": null,
        "note": ""
      },
      {
        "id": "vocab-7",
        "uk": "**ัะดะฝะฐะปัะฝะธะน**",
        "ipa": "/jษdหnษlสฒnษชj/",
        "en": "copulative, joining",
        "pos": "ะฟัะธะบะผ.",
        "gender": null,
        "note": ""
      },
      {
        "id": "vocab-8",
        "uk": "**ะทัััะฐะฒะปะตะฝะฝั**",
        "ipa": "/zสฒistษwหlษnสฒษ/",
        "en": "comparison",
        "pos": "ัะผ. (ั.ั.)",
        "gender": null,
        "note": ""
      },
      {
        "id": "vocab-9",
        "uk": "**ะฟัะพัะธััะฐะฒะปะตะฝะฝั**",
        "ipa": "/prษtษชstษwหlษnสฒษ/",
        "en": "contrast",
        "pos": "ัะผ. (ั.ั.)",
        "gender": null,
        "note": ""
      },
      {
        "id": "vocab-10",
        "uk": "**ะฟัะธัะธะฝะพะฒะต**",
        "ipa": "/prษชtสษชnษหwษ/",
        "en": "causal",
        "pos": "ะฟัะธะบะผ.",
        "gender": null,
        "note": ""
      },
      {
        "id": "vocab-11",
        "uk": "**ัะฐัะพะฒะต**",
        "ipa": "/tสษsษหwษ/",
        "en": "temporal",
        "pos": "ะฟัะธะบะผ.",
        "gender": null,
        "note": ""
      },
      {
        "id": "vocab-12",
        "uk": "**ัะผะพะฒะฝะต**",
        "ipa": "/uหmษwnษ/",
        "en": "conditional",
        "pos": "ะฟัะธะบะผ.",
        "gender": null,
        "note": ""
      },
      {
        "id": "vocab-13",
        "uk": "**ะพะทะฝะฐัะฐะปัะฝะต**",
        "ipa": "/ษznษtสษlสฒหnษ/",
        "en": "attributive",
        "pos": "ะฟัะธะบะผ.",
        "gender": null,
        "note": ""
      },
      {
        "id": "vocab-14",
        "uk": "**ะท'ัััะฒะฐะปัะฝะต**",
        "ipa": "/zjษsuหwษlสฒnษ/",
        "en": "explanatory",
        "pos": "ะฟัะธะบะผ.",
        "gender": null,
        "note": ""
      },
      {
        "id": "vocab-15",
        "uk": "**ะดะพะฟัััะพะฒะต**",
        "ipa": "/dษpusหtษwษ/",
        "en": "concessive",
        "pos": "ะฟัะธะบะผ.",
        "gender": null,
        "note": ""
      },
      {
        "id": "vocab-16",
        "uk": "**ััะฒะตะฝั ะฟัะดััะดะฝะพััั**",
        "ipa": "/หrสฒiwษnสฒ pสฒidหrสฒษdnษstสฒi/",
        "en": "level of subordination",
        "pos": "ะฒะธัะฐะท",
        "gender": null,
        "note": ""
      },
      {
        "id": "vocab-17",
        "uk": "**ะดะฒะพััะฒะฝะตะฒะธะน**",
        "ipa": "/dwษหrสฒiwnษwษชj/",
        "en": "two-level",
        "pos": "ะฟัะธะบะผ.",
        "gender": null,
        "note": ""
      },
      {
        "id": "vocab-18",
        "uk": "**ััะธััะฒะฝะตะฒะธะน**",
        "ipa": "/trษชหrสฒiwnษwษชj/",
        "en": "three-level",
        "pos": "ะฟัะธะบะผ.",
        "gender": null,
        "note": ""
      },
      {
        "id": "vocab-19",
        "uk": "**ะบะพะผะฑัะฝัะฒะฐะฝะฝั**",
        "ipa": "/kษmbสฒinuหwษnสฒษ/",
        "en": "combining",
        "pos": "ัะผ. (ั.ั.)",
        "gender": null,
        "note": ""
      },
      {
        "id": "vocab-20",
        "uk": "**ัะฝัะตะณัะฐััั**",
        "ipa": "/สฒintษษฆหrษtอกsสฒijษ/",
        "en": "integration",
        "pos": "ัะผ. (ะถ.ั.)",
        "gender": null,
        "note": ""
      },
      {
        "id": "vocab-21",
        "uk": "**ะฟะพัะปัะดะพะฒะฝัััั**",
        "ipa": "/pษslสฒiหdษwnสฒistสฒ/",
        "en": "sequence",
        "pos": "ัะผ. (ะถ.ั.)",
        "gender": null,
        "note": ""
      },
      {
        "id": "vocab-22",
        "uk": "**ััััะบัััะฐ**",
        "ipa": "/strukหturษ/",
        "en": "structure",
        "pos": "ัะผ. (ะถ.ั.)",
        "gender": null,
        "note": ""
      },
      {
        "id": "vocab-23",
        "uk": "**ะบะพะผะฟะพะฝะตะฝั**",
        "ipa": "/kษmpษหnษnt/",
        "en": "component",
        "pos": "ัะผ. (ั.ั.)",
        "gender": null,
        "note": ""
      },
      {
        "id": "vocab-24",
        "uk": "**ะปะพะณััะฝะธะน**",
        "ipa": "/lษหษฆสฒitสnษชj/",
        "en": "logical",
        "pos": "ะฟัะธะบะผ.",
        "gender": null,
        "note": ""
      },
      {
        "id": "vocab-25",
        "uk": "**ะฐััััะตะบัััะฐ**",
        "ipa": "/ษrxสฒitษkหturษ/",
        "en": "architecture",
        "pos": "ัะผ. (ะถ.ั.)",
        "gender": null,
        "note": ""
      }
    ],
    "reviewWords": []
  }
}