{
  "$schema": "../../../schemas/vibe-module.schema.json",
  "lesson": {
    "id": "lesson-uk-B1-86",
    "moduleId": "mod-uk-B1-86",
    "languagePair": "l2-uk-en",
    "subject": "language",
    "owner": "curricula-opus",
    "visibility": "public",
    "language": "uk",
    "targetLevel": "B1",
    "phase": "B1.8",
    "moduleNumber": 86,
    "moduleType": "checkpoint",
    "pedagogy": "TBL",
    "immersionLevel": 0.6,
    "title": "ĞŸÑ–Ğ´ÑÑƒĞ¼ĞºĞ¾Ğ²Ğ¸Ğ¹ Ğ¼Ğ¾Ğ´ÑƒĞ»ÑŒ B1",
    "titleUk": null,
    "subtitle": "Comprehensive B1 Assessment",
    "description": "Learner can demonstrate comprehensive B1 mastery across all skills",
    "objectives": [
      "Learner can demonstrate comprehensive B1 mastery across all skills",
      "Learner can produce extended written discourse (250+ words)",
      "Learner can comprehend authentic Ukrainian texts",
      "Learner is ready to begin B2 level"
    ],
    "objectivesUk": null,
    "grammarFocus": [
      "aspect-review",
      "motion-verbs-review",
      "complex-sentences-review",
      "participles-review"
    ],
    "tags": [
      "capstone",
      "assessment",
      "integration",
      "b2-preparation"
    ],
    "totalDuration": 90,
    "transliterationMode": "none",
    "sections": [
      {
        "id": "section-1",
        "name": "Ğ’ÑÑ‚ÑƒĞ¿",
        "nameEn": null,
        "type": "intro",
        "content": "Ğ’Ñ–Ñ‚Ğ°Ñ”Ğ¼Ğ¾ Ğ²Ğ°Ñ Ğ½Ğ° Ñ„Ñ–Ğ½Ğ°Ğ»ÑŒĞ½Ğ¾Ğ¼Ñƒ ĞµÑ‚Ğ°Ğ¿Ñ– Ñ€Ñ–Ğ²Ğ½Ñ B1! Ğ¦ĞµĞ¹ Ğ¿Ñ–Ğ´ÑÑƒĞ¼ĞºĞ¾Ğ²Ğ¸Ğ¹ Ğ¼Ğ¾Ğ´ÑƒĞ»ÑŒ â€” Ğ²Ğ°ÑˆĞ° Ğ¾ÑÑ‚Ğ°Ğ½Ğ½Ñ Ğ·ÑƒĞ¿Ğ¸Ğ½ĞºĞ° Ğ¿ĞµÑ€ĞµĞ´ Ñ€Ñ–Ğ²Ğ½ĞµĞ¼ B2. Ğ¢ÑƒÑ‚ Ğ²Ğ¸ Ğ¿Ñ€Ğ¾Ğ´ĞµĞ¼Ğ¾Ğ½ÑÑ‚Ñ€ÑƒÑ”Ñ‚Ğµ Ğ²ÑĞµ, Ñ‰Ğ¾ Ğ²Ğ¸Ğ²Ñ‡Ğ¸Ğ»Ğ¸: Ğ³Ñ€Ğ°Ğ¼Ğ°Ñ‚Ğ¸ĞºÑƒ, Ğ»ĞµĞºÑĞ¸ĞºÑƒ, Ñ‡Ğ¸Ñ‚Ğ°Ğ½Ğ½Ñ, Ğ¿Ğ¸ÑÑŒĞ¼Ğ¾ Ñ‚Ğ° Ñ€Ğ¾Ğ·ÑƒĞ¼Ñ–Ğ½Ğ½Ñ Ğ½Ğ° ÑĞ»ÑƒÑ….\n\n> ğŸ’¡ **ĞŸĞ¾Ñ€Ğ°Ğ´Ğ°**\n> Ğ¦ĞµĞ¹ Ğ¼Ğ¾Ğ´ÑƒĞ»ÑŒ Ğ½Ğµ Ğ²Ğ²Ğ¾Ğ´Ğ¸Ñ‚ÑŒ Ğ½Ğ¾Ğ²Ğ¸Ñ… Ñ‚ĞµĞ¼. Ğ£ÑÑ– Ğ·Ğ°Ğ²Ğ´Ğ°Ğ½Ğ½Ñ Ğ±Ğ°Ğ·ÑƒÑÑ‚ÑŒÑÑ Ğ½Ğ° Ğ¼Ğ°Ñ‚ĞµÑ€Ñ–Ğ°Ğ»Ñ– Ğ¼Ğ¾Ğ´ÑƒĞ»Ñ–Ğ² M01-M85. Ğ¯ĞºÑ‰Ğ¾ Ñ‰Ğ¾ÑÑŒ Ğ·Ğ´Ğ°Ñ”Ñ‚ÑŒÑÑ ÑĞºĞ»Ğ°Ğ´Ğ½Ğ¸Ğ¼ â€” Ğ¿Ğ¾Ğ²ĞµÑ€Ğ½Ñ–Ñ‚ÑŒÑÑ Ğ´Ğ¾ Ğ²Ñ–Ğ´Ğ¿Ğ¾Ğ²Ñ–Ğ´Ğ½Ğ¾Ğ³Ğ¾ Ğ¼Ğ¾Ğ´ÑƒĞ»Ñ Ğ´Ğ»Ñ Ğ¿Ğ¾Ğ²Ñ‚Ğ¾Ñ€ĞµĞ½Ğ½Ñ.\n\n---\n\n## Ğ¡Ñ‚Ñ€ÑƒĞºÑ‚ÑƒÑ€Ğ° Ğ¿Ñ–Ğ´ÑÑƒĞ¼ĞºĞ¾Ğ²Ğ¾Ğ³Ğ¾ Ğ¼Ğ¾Ğ´ÑƒĞ»Ñ\n\nĞ’Ğ¸ Ğ²Ğ¸ĞºĞ¾Ğ½Ğ°Ñ”Ñ‚Ğµ **Ğ¿'ÑÑ‚ÑŒ ĞºĞ¾Ğ¼Ğ¿Ğ»ĞµĞºÑĞ½Ğ¸Ñ… Ğ·Ğ°Ğ²Ğ´Ğ°Ğ½ÑŒ**, ÑĞºÑ– Ğ¿ĞµÑ€ĞµĞ²Ñ–Ñ€ÑÑ‚ÑŒ ÑƒÑÑ– Ğ½Ğ°Ğ²Ğ¸Ñ‡ĞºĞ¸ Ñ€Ñ–Ğ²Ğ½Ñ B1:\n\n| Ğ—Ğ°Ğ²Ğ´Ğ°Ğ½Ğ½Ñ | ĞĞ°Ğ²Ğ¸Ñ‡ĞºĞ° | Ğ¤Ğ¾ĞºÑƒÑ |\n|----------|---------|-------|\n| Ğ—Ğ°Ğ²Ğ´Ğ°Ğ½Ğ½Ñ 1 | Ğ§Ğ¸Ñ‚Ğ°Ğ½Ğ½Ñ | ĞĞ²Ñ‚ĞµĞ½Ñ‚Ğ¸Ñ‡Ğ½Ğ¸Ğ¹ Ñ‚ĞµĞºÑÑ‚ Ñ–Ğ· Ğ·Ğ°Ğ¿Ğ¸Ñ‚Ğ°Ğ½Ğ½ÑĞ¼Ğ¸ |\n| Ğ—Ğ°Ğ²Ğ´Ğ°Ğ½Ğ½Ñ 2 | ĞŸĞ¸ÑÑŒĞ¼Ğ¾ | Ğ•ÑĞµ Ğ½Ğ° 250+ ÑĞ»Ñ–Ğ² |\n| Ğ—Ğ°Ğ²Ğ´Ğ°Ğ½Ğ½Ñ 3 | ĞÑƒĞ´Ñ–ÑĞ²Ğ°Ğ½Ğ½Ñ | ĞŸÑ–Ğ´ĞºĞ°ÑÑ‚ Ñ–Ğ· Ğ½Ğ¾Ñ‚Ğ°Ñ‚ĞºĞ°Ğ¼Ğ¸ |\n| Ğ—Ğ°Ğ²Ğ´Ğ°Ğ½Ğ½Ñ 4 | Ğ“Ñ€Ğ°Ğ¼Ğ°Ñ‚Ğ¸ĞºĞ° | ĞšĞ¾Ğ¼Ğ¿Ğ»ĞµĞºÑĞ½Ğ¸Ğ¹ Ñ‚ĞµÑÑ‚ |\n| Ğ—Ğ°Ğ²Ğ´Ğ°Ğ½Ğ½Ñ 5 | Ğ›ĞµĞºÑĞ¸ĞºĞ° | Ğ¢ĞµÑÑ‚ Ğ½Ğ° Ğ²ÑÑ– Ğ´Ğ¾Ğ¼ĞµĞ½Ğ¸ |\n\n---\n\n## Ğ—Ğ°Ğ²Ğ´Ğ°Ğ½Ğ½Ñ 1: Ğ§Ğ¸Ñ‚Ğ°Ğ½Ğ½Ñ\n\nĞŸÑ€Ğ¾Ñ‡Ğ¸Ñ‚Ğ°Ğ¹Ñ‚Ğµ ÑÑ‚Ğ°Ñ‚Ñ‚Ñ Ğ¿Ñ€Ğ¾ ÑƒĞºÑ€Ğ°Ñ—Ğ½ÑÑŒĞºÑƒ Ğ†Ğ¢-Ğ³Ğ°Ğ»ÑƒĞ·ÑŒ Ñ‚Ğ° Ğ´Ğ°Ğ¹Ñ‚Ğµ Ğ²Ñ–Ğ´Ğ¿Ğ¾Ğ²Ñ–Ğ´Ñ– Ğ½Ğ° Ğ·Ğ°Ğ¿Ğ¸Ñ‚Ğ°Ğ½Ğ½Ñ.\n\n---\n\n### Ğ¢ĞµĞºÑÑ‚ Ğ´Ğ»Ñ Ñ‡Ğ¸Ñ‚Ğ°Ğ½Ğ½Ñ\n\n**Ğ£ĞºÑ€Ğ°Ñ—Ğ½ÑÑŒĞºĞ° Ğ†Ğ¢-Ñ–Ğ½Ğ´ÑƒÑÑ‚Ñ€Ñ–Ñ: Ñ–ÑÑ‚Ğ¾Ñ€Ñ–Ñ ÑƒÑĞ¿Ñ–Ñ…Ñƒ**\n\nĞ£ĞºÑ€Ğ°Ñ—Ğ½Ğ° ÑÑ‚Ğ°Ğ»Ğ° Ğ¾Ğ´Ğ½Ñ–Ñ”Ñ Ğ· Ğ½Ğ°Ğ¹Ğ±Ñ–Ğ»ÑŒÑˆĞ¸Ñ… Ğ†Ğ¢-ĞºÑ€Ğ°Ñ—Ğ½ Ğ„Ğ²Ñ€Ğ¾Ğ¿Ğ¸. Ğ—Ğ° Ğ¾ÑÑ‚Ğ°Ğ½Ğ½Ñ– Ğ´ĞµÑÑÑ‚ÑŒ Ñ€Ğ¾ĞºÑ–Ğ² ĞºÑ–Ğ»ÑŒĞºÑ–ÑÑ‚ÑŒ IT-ÑĞ¿ĞµÑ†Ñ–Ğ°Ğ»Ñ–ÑÑ‚Ñ–Ğ² Ğ·Ñ€Ğ¾ÑĞ»Ğ° Ğ· Ğ¿'ÑÑ‚Ğ´ĞµÑÑÑ‚Ğ¸ Ñ‚Ğ¸ÑÑÑ‡ Ğ´Ğ¾ Ğ¿Ğ¾Ğ½Ğ°Ğ´ Ñ‚Ñ€ÑŒĞ¾Ñ…ÑĞ¾Ñ‚ Ñ‚Ğ¸ÑÑÑ‡. Ğ¢Ğ°ĞºĞ¸Ğ¹ ÑÑ‚Ñ€Ñ–Ğ¼ĞºĞ¸Ğ¹ Ñ€Ğ¾Ğ·Ğ²Ğ¸Ñ‚Ğ¾Ğº Ğ¿Ğ¾ÑÑĞ½ÑÑ”Ñ‚ÑŒÑÑ ĞºÑ–Ğ»ÑŒĞºĞ¾Ğ¼Ğ° Ñ„Ğ°ĞºÑ‚Ğ¾Ñ€Ğ°Ğ¼Ğ¸: ÑĞ¸Ğ»ÑŒĞ½Ğ¾Ñ Ñ‚ĞµÑ…Ğ½Ñ–Ñ‡Ğ½Ğ¾Ñ Ğ¾ÑĞ²Ñ–Ñ‚Ğ¾Ñ, Ğ½Ğ¸Ğ¶Ñ‡Ğ¸Ğ¼Ğ¸ Ğ·Ğ°Ñ€Ğ¿Ğ»Ğ°Ñ‚Ğ°Ğ¼Ğ¸ Ğ¿Ğ¾Ñ€Ñ–Ğ²Ğ½ÑĞ½Ğ¾ Ñ–Ğ· Ğ—Ğ°Ñ…Ñ–Ğ´Ğ½Ğ¾Ñ Ğ„Ğ²Ñ€Ğ¾Ğ¿Ğ¾Ñ Ñ‚Ğ° Ğ²Ğ¸ÑĞ¾ĞºĞ¾Ñ Ğ¼Ğ¾Ñ‚Ğ¸Ğ²Ğ°Ñ†Ñ–Ñ”Ñ Ğ¼Ğ¾Ğ»Ğ¾Ğ´Ñ–.\n\nĞĞ°Ğ¹Ğ±Ñ–Ğ»ÑŒÑˆÑ– ÑƒĞºÑ€Ğ°Ñ—Ğ½ÑÑŒĞºÑ– Ğ†Ğ¢-ĞºĞ¾Ğ¼Ğ¿Ğ°Ğ½Ñ–Ñ— â€” EPAM, SoftServe Ñ‚Ğ° GlobalLogic â€” Ğ¼Ğ°ÑÑ‚ÑŒ Ğ¾Ñ„Ñ–ÑĞ¸ Ğ² Ğ±Ğ°Ğ³Ğ°Ñ‚ÑŒĞ¾Ñ… Ğ¼Ñ–ÑÑ‚Ğ°Ñ…: ĞšĞ¸Ñ”Ğ²Ñ–, Ğ›ÑŒĞ²Ğ¾Ğ²Ñ–, Ğ¥Ğ°Ñ€ĞºĞ¾Ğ²Ñ–, ĞĞ´ĞµÑÑ– Ñ‚Ğ° Ğ”Ğ½Ñ–Ğ¿Ñ€Ñ–. Ğ¦Ñ– ĞºĞ¾Ğ¼Ğ¿Ğ°Ğ½Ñ–Ñ— Ğ¿Ñ€Ğ°Ñ†ÑÑÑ‚ÑŒ Ñ–Ğ· ĞºĞ»Ñ–Ñ”Ğ½Ñ‚Ğ°Ğ¼Ğ¸ Ğ· ÑƒÑÑŒĞ¾Ğ³Ğ¾ ÑĞ²Ñ–Ñ‚Ñƒ, Ñ€Ğ¾Ğ·Ñ€Ğ¾Ğ±Ğ»ÑÑÑ‡Ğ¸ Ğ¿Ñ€Ğ¾Ğ³Ñ€Ğ°Ğ¼Ğ½Ğµ Ğ·Ğ°Ğ±ĞµĞ·Ğ¿ĞµÑ‡ĞµĞ½Ğ½Ñ Ğ´Ğ»Ñ Ğ±Ğ°Ğ½ĞºÑ–Ğ², Ğ¼ĞµĞ´Ğ¸Ñ‡Ğ½Ğ¸Ñ… ÑƒÑÑ‚Ğ°Ğ½Ğ¾Ğ² Ñ‚Ğ° Ñ‚ĞµÑ…Ğ½Ğ¾Ğ»Ğ¾Ğ³Ñ–Ñ‡Ğ½Ğ¸Ñ… Ğ³Ñ–Ğ³Ğ°Ğ½Ñ‚Ñ–Ğ².\n\nĞĞºÑ€ĞµĞ¼Ğ¾ Ğ²Ğ°Ñ€Ñ‚Ğ¾ Ğ·Ğ³Ğ°Ğ´Ğ°Ñ‚Ğ¸ ÑƒĞºÑ€Ğ°Ñ—Ğ½ÑÑŒĞºÑ– ÑÑ‚Ğ°Ñ€Ñ‚Ğ°Ğ¿Ğ¸, ÑĞºÑ– Ğ·Ğ´Ğ¾Ğ±ÑƒĞ»Ğ¸ ÑĞ²Ñ–Ñ‚Ğ¾Ğ²Ğµ Ğ²Ğ¸Ğ·Ğ½Ğ°Ğ½Ğ½Ñ. Grammarly, Ğ·Ğ°ÑĞ½Ğ¾Ğ²Ğ°Ğ½Ğ° Ñƒ ĞšĞ¸Ñ”Ğ²Ñ– Ñƒ 2009 Ñ€Ğ¾Ñ†Ñ–, Ğ´Ğ¾Ğ¿Ğ¾Ğ¼Ğ°Ğ³Ğ°Ñ” Ğ¼Ñ–Ğ»ÑŒĞ¹Ğ¾Ğ½Ğ°Ğ¼ Ğ»ÑĞ´ĞµĞ¹ Ğ¿Ğ¸ÑĞ°Ñ‚Ğ¸ Ğ°Ğ½Ğ³Ğ»Ñ–Ğ¹ÑÑŒĞºĞ¾Ñ Ğ±ĞµĞ· Ğ¿Ğ¾Ğ¼Ğ¸Ğ»Ğ¾Ğº. GitLab, ÑÑ‚Ğ²Ğ¾Ñ€ĞµĞ½Ğ° ÑƒĞºÑ€Ğ°Ñ—Ğ½Ñ†ĞµĞ¼ Ğ”Ğ¼Ğ¸Ñ‚Ñ€Ğ¾Ğ¼ Ğ—Ğ°Ğ¿Ğ¾Ñ€Ğ¾Ğ¶Ñ†ĞµĞ¼, Ğ²Ğ¸ĞºĞ¾Ñ€Ğ¸ÑÑ‚Ğ¾Ğ²ÑƒÑ”Ñ‚ÑŒÑÑ Ğ¼Ñ–Ğ»ÑŒĞ¹Ğ¾Ğ½Ğ°Ğ¼Ğ¸ Ñ€Ğ¾Ğ·Ñ€Ğ¾Ğ±Ğ½Ğ¸ĞºÑ–Ğ² Ğ¿Ğ¾ Ğ²ÑÑŒĞ¾Ğ¼Ñƒ ÑĞ²Ñ–Ñ‚Ñƒ. MacPaw Ñ–Ğ· ĞšĞ¸Ñ”Ğ²Ğ° ÑÑ‚Ğ²Ğ¾Ñ€ÑÑ” Ğ¿Ğ¾Ğ¿ÑƒĞ»ÑÑ€Ğ½Ğµ Ğ¿Ñ€Ğ¾Ğ³Ñ€Ğ°Ğ¼Ğ½Ğµ Ğ·Ğ°Ğ±ĞµĞ·Ğ¿ĞµÑ‡ĞµĞ½Ğ½Ñ Ğ´Ğ»Ñ Mac.\n\nĞ’Ñ–Ğ¹Ğ½Ğ°, ÑĞºĞ° Ğ¿Ğ¾Ñ‡Ğ°Ğ»Ğ°ÑÑ Ñƒ 2022 Ñ€Ğ¾Ñ†Ñ–, ÑÑ‚Ğ²Ğ¾Ñ€Ğ¸Ğ»Ğ° ÑĞµÑ€Ğ¹Ğ¾Ğ·Ğ½Ñ– Ğ²Ğ¸ĞºĞ»Ğ¸ĞºĞ¸ Ğ´Ğ»Ñ Ğ³Ğ°Ğ»ÑƒĞ·Ñ–. Ğ‘Ğ°Ğ³Ğ°Ñ‚Ğ¾ ÑĞ¿ĞµÑ†Ñ–Ğ°Ğ»Ñ–ÑÑ‚Ñ–Ğ² Ğ±ÑƒĞ»Ğ¸ Ğ·Ğ¼ÑƒÑˆĞµĞ½Ñ– Ğ¿ĞµÑ€ĞµÑ—Ñ…Ğ°Ñ‚Ğ¸ Ğ² Ñ–Ğ½ÑˆÑ– Ğ¼Ñ–ÑÑ‚Ğ° Ğ°Ğ±Ğ¾ Ğ·Ğ° ĞºĞ¾Ñ€Ğ´Ğ¾Ğ½. ĞŸÑ€Ğ¾Ñ‚Ğµ Ñ–Ğ½Ğ´ÑƒÑÑ‚Ñ€Ñ–Ñ Ğ¿Ğ¾ĞºĞ°Ğ·Ğ°Ğ»Ğ° Ğ½ĞµĞ¹Ğ¼Ğ¾Ğ²Ñ–Ñ€Ğ½Ñƒ ÑÑ‚Ñ–Ğ¹ĞºÑ–ÑÑ‚ÑŒ. Ğ‘Ñ–Ğ»ÑŒÑˆÑ–ÑÑ‚ÑŒ ĞºĞ¾Ğ¼Ğ¿Ğ°Ğ½Ñ–Ğ¹ Ğ¿Ñ€Ğ¾Ğ´Ğ¾Ğ²Ğ¶Ğ¸Ğ»Ğ¸ Ñ€Ğ¾Ğ±Ğ¾Ñ‚Ñƒ, Ğ°Ğ´Ğ°Ğ¿Ñ‚ÑƒĞ²Ğ°Ğ²ÑˆĞ¸ÑÑŒ Ğ´Ğ¾ Ğ½Ğ¾Ğ²Ğ¸Ñ… ÑƒĞ¼Ğ¾Ğ². Ğ£ĞºÑ€Ğ°Ñ—Ğ½ÑÑŒĞºÑ– Ğ†Ğ¢-Ñ„Ğ°Ñ…Ñ–Ğ²Ñ†Ñ– Ğ´ĞµĞ¼Ğ¾Ğ½ÑÑ‚Ñ€ÑƒÑÑ‚ÑŒ Ğ½Ğµ Ğ»Ğ¸ÑˆĞµ Ñ‚ĞµÑ…Ğ½Ñ–Ñ‡Ğ½Ñƒ Ğ¼Ğ°Ğ¹ÑÑ‚ĞµÑ€Ğ½Ñ–ÑÑ‚ÑŒ, Ğ° Ğ¹ Ğ·Ğ´Ğ°Ñ‚Ğ½Ñ–ÑÑ‚ÑŒ Ğ´Ğ¾Ğ»Ğ°Ñ‚Ğ¸ ÑĞºĞ»Ğ°Ğ´Ğ½Ğ¾Ñ‰Ñ–.\n\nĞœĞ°Ğ¹Ğ±ÑƒÑ‚Ğ½Ñ” ÑƒĞºÑ€Ğ°Ñ—Ğ½ÑÑŒĞºĞ¾Ñ— Ğ†Ğ¢-Ğ³Ğ°Ğ»ÑƒĞ·Ñ– Ğ·Ğ°Ğ»Ğ¸ÑˆĞ°Ñ”Ñ‚ÑŒÑÑ Ğ¿ĞµÑ€ÑĞ¿ĞµĞºÑ‚Ğ¸Ğ²Ğ½Ğ¸Ğ¼. Ğ£Ñ€ÑĞ´ Ğ¿Ñ–Ğ´Ñ‚Ñ€Ğ¸Ğ¼ÑƒÑ” Ñ€Ğ¾Ğ·Ğ²Ğ¸Ñ‚Ğ¾Ğº Ñ‚ĞµÑ…Ğ½Ğ¾Ğ»Ğ¾Ğ³Ñ–Ñ‡Ğ½Ğ¾Ğ³Ğ¾ ÑĞµĞºÑ‚Ğ¾Ñ€Ñƒ, Ğ° ÑƒĞºÑ€Ğ°Ñ—Ğ½ÑÑŒĞºÑ– ÑƒĞ½Ñ–Ğ²ĞµÑ€ÑĞ¸Ñ‚ĞµÑ‚Ğ¸ Ğ³Ğ¾Ñ‚ÑƒÑÑ‚ÑŒ Ğ½Ğ¾Ğ²Ñ– Ğ¿Ğ¾ĞºĞ¾Ğ»Ñ–Ğ½Ğ½Ñ ÑĞ¿ĞµÑ†Ñ–Ğ°Ğ»Ñ–ÑÑ‚Ñ–Ğ². Ğ¯Ğº Ğ³Ğ¾Ğ²Ğ¾Ñ€ÑÑ‚ÑŒ ÑĞ°Ğ¼Ñ– Ğ°Ğ¹Ñ‚Ñ–ÑˆĞ½Ğ¸ĞºĞ¸: Â«ĞœĞ¸ Ğ¿Ğ¸ÑĞ°Ğ»Ğ¸ ĞºĞ¾Ğ´ Ğ¿Ñ–Ğ´ Ğ¾Ğ±ÑÑ‚Ñ€Ñ–Ğ»Ğ°Ğ¼Ğ¸, Ñ– Ğ¼Ğ¸ Ğ±ÑƒĞ´ĞµĞ¼Ğ¾ Ğ¿Ğ¸ÑĞ°Ñ‚Ğ¸ Ğ¹Ğ¾Ğ³Ğ¾ Ğ¿Ñ–ÑĞ»Ñ Ğ¿ĞµÑ€ĞµĞ¼Ğ¾Ğ³Ğ¸Â».\n\n> ğŸ¯ **Ğ¤Ğ°ĞºÑ‚**\n> Ğ£ĞºÑ€Ğ°Ñ—Ğ½Ğ° Ğ²Ñ…Ğ¾Ğ´Ğ¸Ñ‚ÑŒ Ğ´Ğ¾ Ñ‚Ğ¾Ğ¿-5 ĞºÑ€Ğ°Ñ—Ğ½ Ğ„Ğ²Ñ€Ğ¾Ğ¿Ğ¸ Ğ·Ğ° ĞºÑ–Ğ»ÑŒĞºÑ–ÑÑ‚Ñ Ğ†Ğ¢-ÑĞ¿ĞµÑ†Ñ–Ğ°Ğ»Ñ–ÑÑ‚Ñ–Ğ².\n\n---\n\n### Ğ—Ğ°Ğ¿Ğ¸Ñ‚Ğ°Ğ½Ğ½Ñ Ğ´Ğ¾ Ñ‚ĞµĞºÑÑ‚Ñƒ\n\nĞ”Ğ°Ğ¹Ñ‚Ğµ Ğ²Ñ–Ğ´Ğ¿Ğ¾Ğ²Ñ–Ğ´Ñ– Ğ½Ğ° Ğ·Ğ°Ğ¿Ğ¸Ñ‚Ğ°Ğ½Ğ½Ñ, Ğ¾Ğ±Ğ¸Ñ€Ğ°ÑÑ‡Ğ¸ Ğ¿Ñ€Ğ°Ğ²Ğ¸Ğ»ÑŒĞ½Ğ¸Ğ¹ Ğ²Ğ°Ñ€Ñ–Ğ°Ğ½Ñ‚:\n\n1. Ğ¡ĞºÑ–Ğ»ÑŒĞºĞ¸ Ğ†Ğ¢-ÑĞ¿ĞµÑ†Ñ–Ğ°Ğ»Ñ–ÑÑ‚Ñ–Ğ² Ğ¿Ñ€Ğ°Ñ†ÑÑ” Ğ² Ğ£ĞºÑ€Ğ°Ñ—Ğ½Ñ– Ğ·Ğ°Ñ€Ğ°Ğ·?\n\n2. Ğ¯ĞºÑ– Ñ„Ğ°ĞºÑ‚Ğ¾Ñ€Ğ¸ Ğ¿Ğ¾ÑÑĞ½ÑÑÑ‚ÑŒ Ñ€Ğ¾Ğ·Ğ²Ğ¸Ñ‚Ğ¾Ğº Ğ†Ğ¢-Ğ³Ğ°Ğ»ÑƒĞ·Ñ–?\n\n3. Ğ£ ÑĞºĞ¸Ñ… Ğ¼Ñ–ÑÑ‚Ğ°Ñ… Ñ” Ğ¾Ñ„Ñ–ÑĞ¸ Ğ½Ğ°Ğ¹Ğ±Ñ–Ğ»ÑŒÑˆĞ¸Ñ… Ğ†Ğ¢-ĞºĞ¾Ğ¼Ğ¿Ğ°Ğ½Ñ–Ğ¹?\n\n4. ĞšĞ¾Ğ»Ğ¸ Ğ±ÑƒĞ»Ğ° Ğ·Ğ°ÑĞ½Ğ¾Ğ²Ğ°Ğ½Ğ° Grammarly?\n\n5. Ğ¥Ñ‚Ğ¾ ÑÑ‚Ğ²Ğ¾Ñ€Ğ¸Ğ² GitLab?\n\n6. Ğ¯Ğº Ñ–Ğ½Ğ´ÑƒÑÑ‚Ñ€Ñ–Ñ Ğ²Ñ–Ğ´Ñ€ĞµĞ°Ğ³ÑƒĞ²Ğ°Ğ»Ğ° Ğ½Ğ° Ğ²Ñ–Ğ¹Ğ½Ñƒ?\n\n7. Ğ¯ĞºĞµ ÑÑ‚Ğ°Ğ²Ğ»ĞµĞ½Ğ½Ñ Ğ°Ğ²Ñ‚Ğ¾Ñ€Ğ° Ğ´Ğ¾ Ğ¼Ğ°Ğ¹Ğ±ÑƒÑ‚Ğ½ÑŒĞ¾Ğ³Ğ¾ Ğ³Ğ°Ğ»ÑƒĞ·Ñ–?\n\n8. Ğ©Ğ¾ Ğ¾Ğ·Ğ½Ğ°Ñ‡Ğ°Ñ” Ñ„Ñ€Ğ°Ğ·Ğ° Â«ÑÑ‚Ñ–Ğ¹ĞºÑ–ÑÑ‚ÑŒÂ» Ñƒ ĞºĞ¾Ğ½Ñ‚ĞµĞºÑÑ‚Ñ– ÑÑ‚Ğ°Ñ‚Ñ‚Ñ–?\n\n9. Ğ¯ĞºĞ° ĞºĞ¾Ğ¼Ğ¿Ğ°Ğ½Ñ–Ñ ÑÑ‚Ğ²Ğ¾Ñ€ÑÑ” Ğ¿Ñ€Ğ¾Ğ³Ñ€Ğ°Ğ¼Ğ¸ Ğ´Ğ»Ñ Mac?\n\n10. Ğ©Ğ¾ Ğ´ĞµĞ¼Ğ¾Ğ½ÑÑ‚Ñ€ÑƒÑÑ‚ÑŒ ÑƒĞºÑ€Ğ°Ñ—Ğ½ÑÑŒĞºÑ– Ğ†Ğ¢-Ñ„Ğ°Ñ…Ñ–Ğ²Ñ†Ñ–, Ğ¾ĞºÑ€Ñ–Ğ¼ Ñ‚ĞµÑ…Ğ½Ñ–Ñ‡Ğ½Ğ¾Ñ— Ğ¼Ğ°Ğ¹ÑÑ‚ĞµÑ€Ğ½Ğ¾ÑÑ‚Ñ–?\n\n---\n\n## Ğ—Ğ°Ğ²Ğ´Ğ°Ğ½Ğ½Ñ 2: ĞŸĞ¸ÑÑŒĞ¼Ğ¾\n\nĞĞ°Ğ¿Ğ¸ÑˆÑ–Ñ‚ÑŒ ĞµÑĞµ Ğ½Ğ° Ñ‚ĞµĞ¼Ñƒ: **Â«ĞœÑ–Ğ¹ Ğ´Ğ¾ÑĞ²Ñ–Ğ´ Ğ²Ğ¸Ğ²Ñ‡ĞµĞ½Ğ½Ñ ÑƒĞºÑ€Ğ°Ñ—Ğ½ÑÑŒĞºĞ¾Ñ— Ğ¼Ğ¾Ğ²Ğ¸Â»**.\n\n---\n\n### Ğ’Ğ¸Ğ¼Ğ¾Ğ³Ğ¸ Ğ´Ğ¾ ĞµÑĞµ\n\n- **ĞĞ±ÑÑĞ³:** 250+ ÑĞ»Ñ–Ğ²\n- **Ğ¡Ñ‚Ñ€ÑƒĞºÑ‚ÑƒÑ€Ğ°:** Ğ²ÑÑ‚ÑƒĞ¿, Ğ¾ÑĞ½Ğ¾Ğ²Ğ½Ğ° Ñ‡Ğ°ÑÑ‚Ğ¸Ğ½Ğ°, Ğ²Ğ¸ÑĞ½Ğ¾Ğ²Ğ¾Ğº\n- **Ğ“Ñ€Ğ°Ğ¼Ğ°Ñ‚Ğ¸ĞºĞ°:** Ğ²Ğ¸ĞºĞ¾Ñ€Ğ¸ÑÑ‚Ğ°Ğ¹Ñ‚Ğµ Ğ²Ğ¸Ğ´ Ğ´Ñ–Ñ”ÑĞ»Ğ¾Ğ²Ğ°, Ğ´Ñ–Ñ”ÑĞ»Ğ¾Ğ²Ğ° Ñ€ÑƒÑ…Ñƒ, ÑĞºĞ»Ğ°Ğ´Ğ½Ñ– Ñ€ĞµÑ‡ĞµĞ½Ğ½Ñ, Ğ¿Ğ°ÑĞ¸Ğ²Ğ½Ñ– ĞºĞ¾Ğ½ÑÑ‚Ñ€ÑƒĞºÑ†Ñ–Ñ—\n\n---\n\n### ĞŸĞ»Ğ°Ğ½ ĞµÑĞµ\n\n1. **Ğ’ÑÑ‚ÑƒĞ¿ (50 ÑĞ»Ñ–Ğ²)**\n   - Ğ§Ğ¾Ğ¼Ñƒ Ğ²Ğ¸ Ğ¿Ğ¾Ñ‡Ğ°Ğ»Ğ¸ Ğ²Ğ¸Ğ²Ñ‡Ğ°Ñ‚Ğ¸ ÑƒĞºÑ€Ğ°Ñ—Ğ½ÑÑŒĞºÑƒ?\n   - ĞšĞ¾Ğ»Ğ¸ Ñ†Ğµ Ğ±ÑƒĞ»Ğ¾?\n\n2. **ĞÑĞ½Ğ¾Ğ²Ğ½Ğ° Ñ‡Ğ°ÑÑ‚Ğ¸Ğ½Ğ° (150 ÑĞ»Ñ–Ğ²)**\n   - Ğ©Ğ¾ Ğ±ÑƒĞ»Ğ¾ Ğ½Ğ°Ğ¹ÑĞºĞ»Ğ°Ğ´Ğ½Ñ–ÑˆĞ¸Ğ¼?\n   - Ğ¯ĞºÑ– Ğ¼ĞµÑ‚Ğ¾Ğ´Ğ¸ Ğ´Ğ¾Ğ¿Ğ¾Ğ¼Ğ¾Ğ³Ğ»Ğ¸ Ğ²Ğ°Ğ¼ Ğ½Ğ°Ğ¹Ğ±Ñ–Ğ»ÑŒÑˆĞµ?\n   - ĞĞ¿Ğ¸ÑˆÑ–Ñ‚ÑŒ Ğ¾Ğ´Ğ¸Ğ½ Ğ¼Ğ¾Ğ¼ĞµĞ½Ñ‚, ĞºĞ¾Ğ»Ğ¸ Ğ²Ğ¸ Ğ²Ñ–Ğ´Ñ‡ÑƒĞ»Ğ¸ Ğ¿Ñ€Ğ¾Ğ³Ñ€ĞµÑ\n\n3. **Ğ’Ğ¸ÑĞ½Ğ¾Ğ²Ğ¾Ğº (50 ÑĞ»Ñ–Ğ²)**\n   - Ğ¯ĞºÑ– Ğ²Ğ°ÑˆÑ– Ğ¿Ğ»Ğ°Ğ½Ğ¸ Ğ½Ğ° Ğ¼Ğ°Ğ¹Ğ±ÑƒÑ‚Ğ½Ñ”?\n   - ĞšÑƒĞ´Ğ¸ Ğ²Ğ¸ Ñ…Ğ¾Ñ‚Ñ–Ğ»Ğ¸ Ğ± Ğ¿Ğ¾Ñ—Ñ…Ğ°Ñ‚Ğ¸ Ğ² Ğ£ĞºÑ€Ğ°Ñ—Ğ½Ñ–?\n\n> ğŸ’¡ **ĞŸĞ¾Ñ€Ğ°Ğ´Ğ°**\n> ĞŸĞ¾ĞºĞ°Ğ¶Ñ–Ñ‚ÑŒ Ğ²Ğ¾Ğ»Ğ¾Ğ´Ñ–Ğ½Ğ½Ñ Ğ²ÑÑ–Ğ¼Ğ° Ğ³Ñ€Ğ°Ğ¼Ğ°Ñ‚Ğ¸Ñ‡Ğ½Ğ¸Ğ¼Ğ¸ ÑÑ‚Ñ€ÑƒĞºÑ‚ÑƒÑ€Ğ°Ğ¼Ğ¸ B1. ĞĞ°Ğ¿Ñ€Ğ¸ĞºĞ»Ğ°Ğ´: Â«ĞšĞ¾Ğ»Ğ¸ Ñ Ğ¿Ñ€Ğ¸Ñ—Ñ…Ğ°Ğ²/Ğ¿Ñ€Ğ¸Ñ—Ñ…Ğ°Ğ»Ğ° Ğ´Ğ¾ Ğ›ÑŒĞ²Ğ¾Ğ²Ğ°...Â» (Ğ´Ñ–Ñ”ÑĞ»Ğ¾Ğ²Ğ¾ Ñ€ÑƒÑ…Ñƒ Ğ· Ğ¿Ñ€ĞµÑ„Ñ–ĞºÑĞ¾Ğ¼), Â«Ğ¯ Ñ…Ğ¾Ñ‡Ñƒ, Ñ‰Ğ¾Ğ± Ğ¼Ğ¾Ñ— Ğ´Ñ€ÑƒĞ·Ñ–...Â» (ÑĞºĞ»Ğ°Ğ´Ğ½Ğµ Ñ€ĞµÑ‡ĞµĞ½Ğ½Ñ), Â«ĞĞ°Ğ¿Ğ¸ÑĞ°Ğ½Ğ¸Ğ¹ Ğ¼Ğ½Ğ¾Ñ Ñ‚ĞµĞºÑÑ‚...Â» (Ğ¿Ğ°ÑĞ¸Ğ²Ğ½Ğ¸Ğ¹ Ğ´Ñ–Ñ”Ğ¿Ñ€Ğ¸ĞºĞ¼ĞµÑ‚Ğ½Ğ¸Ğº).\n\n---\n\n### Ğ ÑƒĞ±Ñ€Ğ¸ĞºĞ° Ğ¾Ñ†Ñ–Ğ½ÑĞ²Ğ°Ğ½Ğ½Ñ\n\n| ĞšÑ€Ğ¸Ñ‚ĞµÑ€Ñ–Ğ¹ | ĞœĞ°ĞºÑĞ¸Ğ¼ÑƒĞ¼ Ğ±Ğ°Ğ»Ñ–Ğ² | ĞĞ¿Ğ¸Ñ |\n|----------|----------------|------|\n| Ğ—Ğ¼Ñ–ÑÑ‚ | 5 | Ğ’ÑÑ– Ñ‡Ğ°ÑÑ‚Ğ¸Ğ½Ğ¸ Ğ¿Ğ»Ğ°Ğ½Ñƒ Ñ€Ğ¾Ğ·ĞºÑ€Ğ¸Ñ‚Ñ– |\n| Ğ“Ñ€Ğ°Ğ¼Ğ°Ñ‚Ğ¸ĞºĞ° | 5 | ĞŸÑ€Ğ°Ğ²Ğ¸Ğ»ÑŒĞ½Ğµ Ğ²Ğ¸ĞºĞ¾Ñ€Ğ¸ÑÑ‚Ğ°Ğ½Ğ½Ñ B1 ÑÑ‚Ñ€ÑƒĞºÑ‚ÑƒÑ€ |\n| Ğ›ĞµĞºÑĞ¸ĞºĞ° | 5 | Ğ Ñ–Ğ·Ğ½Ğ¾Ğ¼Ğ°Ğ½Ñ–Ñ‚Ğ½Ğ° Ğ»ĞµĞºÑĞ¸ĞºĞ° Ğ²ÑÑ–Ñ… Ğ´Ğ¾Ğ¼ĞµĞ½Ñ–Ğ² |\n| Ğ—Ğ²'ÑĞ·Ğ½Ñ–ÑÑ‚ÑŒ | 5 | Ğ›Ğ¾Ğ³Ñ–Ñ‡Ğ½Ğ° ÑÑ‚Ñ€ÑƒĞºÑ‚ÑƒÑ€Ğ°, ÑĞ¿Ğ¾Ğ»ÑƒÑ‡Ğ½Ğ¸ĞºĞ¸ |\n| **Ğ Ğ°Ğ·Ğ¾Ğ¼** | **20** | |\n\n---\n\n## Ğ—Ğ°Ğ²Ğ´Ğ°Ğ½Ğ½Ñ 3: ĞÑƒĞ´Ñ–ÑĞ²Ğ°Ğ½Ğ½Ñ\n\nĞŸÑ€Ğ¾ÑĞ»ÑƒÑ…Ğ°Ğ¹Ñ‚Ğµ Ğ¿Ğ¾Ğ´ĞºĞ°ÑÑ‚ Ğ¿Ñ€Ğ¾ ÑƒĞºÑ€Ğ°Ñ—Ğ½ÑÑŒĞºÑƒ ĞºÑƒĞ»ÑŒÑ‚ÑƒÑ€Ñƒ Ñ‚Ğ° Ğ´Ğ°Ğ¹Ñ‚Ğµ Ğ²Ñ–Ğ´Ğ¿Ğ¾Ğ²Ñ–Ğ´Ñ– Ğ½Ğ° Ğ·Ğ°Ğ¿Ğ¸Ñ‚Ğ°Ğ½Ğ½Ñ.\n\n---\n\n### Ğ ĞµĞºĞ¾Ğ¼ĞµĞ½Ğ´Ğ¾Ğ²Ğ°Ğ½Ñ– Ğ¿Ğ¾Ğ´ĞºĞ°ÑÑ‚Ğ¸\n\nĞĞ±ĞµÑ€Ñ–Ñ‚ÑŒ Ğ¾Ğ´Ğ¸Ğ½ Ğ¿Ğ¾Ğ´ĞºĞ°ÑÑ‚ (5-10 Ñ…Ğ²Ğ¸Ğ»Ğ¸Ğ½):\n\n- **ĞšĞ½Ğ¸Ğ¶ĞºĞ¾Ğ²Ğ¸Ğ¹ ĞÑ€ÑĞµĞ½Ğ°Ğ»** â€” Ğ¿Ñ€Ğ¾ ĞºĞ½Ğ¸Ğ³Ğ¸ Ñ‚Ğ° ĞºÑƒĞ»ÑŒÑ‚ÑƒÑ€Ñƒ\n- **Ğ Ğ¾Ğ·Ğ¼Ğ¾Ğ²Ğ°.ĞœĞµĞ´Ñ–Ğ°** â€” Ñ–Ğ½Ñ‚ĞµÑ€Ğ²'Ñ Ğ· Ñ†Ñ–ĞºĞ°Ğ²Ğ¸Ğ¼Ğ¸ Ğ»ÑĞ´ÑŒĞ¼Ğ¸\n- **Ğ¡ÑƒÑĞ¿Ñ–Ğ»ÑŒĞ½Ğµ Ğ Ğ°Ğ´Ñ–Ğ¾** â€” Ğ½Ğ¾Ğ²Ğ¸Ğ½Ğ¸ Ñ‚Ğ° Ğ°Ğ½Ğ°Ğ»Ñ–Ñ‚Ğ¸ĞºĞ°\n- **Ukrainian Lessons Podcast** â€” ÑƒÑ€Ğ¾ĞºĞ¸ Ğ´Ğ»Ñ Ğ²Ğ¸Ğ²Ñ‡ĞµĞ½Ğ½Ñ Ğ¼Ğ¾Ğ²Ğ¸\n\n---\n\n### Ğ—Ğ°Ğ²Ğ´Ğ°Ğ½Ğ½Ñ Ğ¿Ñ–Ğ´ Ñ‡Ğ°Ñ Ğ¿Ñ€Ğ¾ÑĞ»ÑƒÑ…Ğ¾Ğ²ÑƒĞ²Ğ°Ğ½Ğ½Ñ\n\n1. **ĞĞ¾Ñ‚Ğ°Ñ‚ĞºĞ¸:** Ğ—Ğ°Ğ¿Ğ¸ÑˆÑ–Ñ‚ÑŒ Ğ³Ğ¾Ğ»Ğ¾Ğ²Ğ½Ñ– Ğ´ÑƒĞ¼ĞºĞ¸ (5-7 Ğ¿ÑƒĞ½ĞºÑ‚Ñ–Ğ²)\n2. **ĞšĞ»ÑÑ‡Ğ¾Ğ²Ñ– ÑĞ»Ğ¾Ğ²Ğ°:** Ğ’Ğ¸Ğ´Ñ–Ğ»Ñ–Ñ‚ÑŒ 10 Ğ½Ğ¾Ğ²Ğ¸Ñ… ÑĞ»Ñ–Ğ²\n3. **Ğ ĞµĞ·ÑĞ¼Ğµ:** ĞĞ°Ğ¿Ğ¸ÑˆÑ–Ñ‚ÑŒ ĞºĞ¾Ñ€Ğ¾Ñ‚ĞºĞµ Ñ€ĞµĞ·ÑĞ¼Ğµ (50 ÑĞ»Ñ–Ğ²)\n\n---\n\n### Ğ—Ğ°Ğ¿Ğ¸Ñ‚Ğ°Ğ½Ğ½Ñ Ğ¿Ñ–ÑĞ»Ñ Ğ¿Ñ€Ğ¾ÑĞ»ÑƒÑ…Ğ¾Ğ²ÑƒĞ²Ğ°Ğ½Ğ½Ñ\n\n1. Ğ¯ĞºĞ° Ğ³Ğ¾Ğ»Ğ¾Ğ²Ğ½Ğ° Ñ‚ĞµĞ¼Ğ° Ğ¿Ğ¾Ğ´ĞºĞ°ÑÑ‚Ñƒ?\n2. Ğ¥Ñ‚Ğ¾ Ğ³Ğ¾Ğ»Ğ¾Ğ²Ğ½Ğ¸Ğ¹ Ğ³ĞµÑ€Ğ¾Ğ¹ Ğ°Ğ±Ğ¾ ÑĞ¿Ñ–ĞºĞµÑ€?\n3. Ğ¯ĞºÑ– Ğ°Ñ€Ğ³ÑƒĞ¼ĞµĞ½Ñ‚Ğ¸ Ğ½Ğ°Ğ²Ğ¾Ğ´Ğ¸Ğ»Ğ¸ÑÑŒ?\n4. Ğ— Ñ‡Ğ¸Ğ¼ Ğ²Ğ¸ Ğ¿Ğ¾Ğ³Ğ¾Ğ´Ğ¶ÑƒÑ”Ñ‚ĞµÑÑŒ? Ğ— Ñ‡Ğ¸Ğ¼ â€” Ğ½Ñ–?\n5. Ğ©Ğ¾ Ğ½Ğ¾Ğ²Ğ¾Ğ³Ğ¾ Ğ²Ğ¸ Ğ´Ñ–Ğ·Ğ½Ğ°Ğ»Ğ¸ÑÑŒ?\n\n> ğŸŒ **Ğ£ Ñ€ĞµĞ°Ğ»ÑŒĞ½Ğ¾Ğ¼Ñƒ Ğ¶Ğ¸Ñ‚Ñ‚Ñ–**\n> Ğ¡Ğ»ÑƒÑ…Ğ°Ğ¹Ñ‚Ğµ ÑƒĞºÑ€Ğ°Ñ—Ğ½ÑÑŒĞºÑ– Ğ¿Ğ¾Ğ´ĞºĞ°ÑÑ‚Ğ¸ Ñ‰Ğ¾Ğ´Ğ½Ñ Ğ¿Ğ¾ 10-15 Ñ…Ğ²Ğ¸Ğ»Ğ¸Ğ½. Ğ¦Ğµ Ğ½Ğ°Ğ¹ĞºÑ€Ğ°Ñ‰Ğ¸Ğ¹ ÑĞ¿Ğ¾ÑÑ–Ğ± Ğ¿Ğ¾ĞºÑ€Ğ°Ñ‰Ğ¸Ñ‚Ğ¸ Ñ€Ğ¾Ğ·ÑƒĞ¼Ñ–Ğ½Ğ½Ñ Ğ½Ğ° ÑĞ»ÑƒÑ… Ğ¿ĞµÑ€ĞµĞ´ Ñ€Ñ–Ğ²Ğ½ĞµĞ¼ B2.\n\n---\n\n## Ğ—Ğ°Ğ²Ğ´Ğ°Ğ½Ğ½Ñ 4: Ğ“Ñ€Ğ°Ğ¼Ğ°Ñ‚Ğ¸ĞºĞ°\n\nĞšĞ¾Ğ¼Ğ¿Ğ»ĞµĞºÑĞ½Ğ¸Ğ¹ Ñ‚ĞµÑÑ‚ Ğ½Ğ° Ğ²ÑÑ Ğ³Ñ€Ğ°Ğ¼Ğ°Ñ‚Ğ¸ĞºÑƒ B1.\n\n---\n\n### Ğ§Ğ°ÑÑ‚Ğ¸Ğ½Ğ° Ğ: Ğ’Ğ¸Ğ´ Ğ´Ñ–Ñ”ÑĞ»Ğ¾Ğ²Ğ°\n\nĞĞ±ĞµÑ€Ñ–Ñ‚ÑŒ Ğ¿Ñ€Ğ°Ğ²Ğ¸Ğ»ÑŒĞ½Ñƒ Ñ„Ğ¾Ñ€Ğ¼Ñƒ:\n\n1. Ğ’Ñ‡Ğ¾Ñ€Ğ° Ñ _______ (Ñ‡Ğ¸Ñ‚Ğ°Ğ²/Ğ¿Ñ€Ğ¾Ñ‡Ğ¸Ñ‚Ğ°Ğ²) Ñ†Ñ ĞºĞ½Ğ¸Ğ³Ñƒ Ğ²Ñ–Ğ´ Ğ¿Ğ¾Ñ‡Ğ°Ñ‚ĞºÑƒ Ğ´Ğ¾ ĞºÑ–Ğ½Ñ†Ñ.\n2. ĞšĞ¾Ğ»Ğ¸ Ñ Ğ±ÑƒĞ² ÑÑ‚ÑƒĞ´ĞµĞ½Ñ‚Ğ¾Ğ¼, Ñ Ñ‡Ğ°ÑÑ‚Ğ¾ _______ (Ñ‡Ğ¸Ñ‚Ğ°Ğ²/Ğ¿Ñ€Ğ¾Ñ‡Ğ¸Ñ‚Ğ°Ğ²) Ğ½Ğ°ÑƒĞºĞ¾Ğ²Ñ– ÑÑ‚Ğ°Ñ‚Ñ‚Ñ–.\n3. ĞĞµ _______ (Ğ²Ñ–Ğ´ĞºÑ€Ğ¸Ğ²Ğ°Ğ¹/Ğ²Ñ–Ğ´ĞºÑ€Ğ¸Ğ¹) Ğ²Ñ–ĞºĞ½Ğ¾ â€” Ğ½Ğ° Ğ²ÑƒĞ»Ğ¸Ñ†Ñ– Ñ…Ğ¾Ğ»Ğ¾Ğ´Ğ½Ğ¾!\n4. Ğ©Ğ¾Ğ´Ğ½Ñ _______ (Ğ²Ñ–Ğ´ĞºÑ€Ğ¸Ğ²Ğ°Ğ¹/Ğ²Ñ–Ğ´ĞºÑ€Ğ¸Ğ¹) Ğ²Ñ–ĞºĞ½Ğ¾ Ğ´Ğ»Ñ Ğ¿Ñ€Ğ¾Ğ²Ñ–Ñ‚Ñ€ÑĞ²Ğ°Ğ½Ğ½Ñ.\n5. Ğ¯ Ñ‰Ğµ Ğ½Ğµ _______ (Ğ¿Ğ¸ÑĞ°Ğ²/Ğ½Ğ°Ğ¿Ğ¸ÑĞ°Ğ²) Ğ·Ğ²Ñ–Ñ‚ â€” Ğ·Ñ€Ğ¾Ğ±Ğ»Ñ Ñ†Ğµ Ğ·Ğ°Ğ²Ñ‚Ñ€Ğ°.\n\n---\n\n### Ğ§Ğ°ÑÑ‚Ğ¸Ğ½Ğ° Ğ‘: Ğ”Ñ–Ñ”ÑĞ»Ğ¾Ğ²Ğ° Ñ€ÑƒÑ…Ñƒ\n\nĞ’ÑÑ‚Ğ°Ğ²Ñ‚Ğµ Ğ¿Ñ€Ğ°Ğ²Ğ¸Ğ»ÑŒĞ½Ğµ Ğ´Ñ–Ñ”ÑĞ»Ğ¾Ğ²Ğ¾:\n\n1. ĞœĞ¸ _______ (Ğ¿Ñ€Ğ¸Ñ…Ğ¾Ğ´Ğ¸Ğ»Ğ¸/Ğ¿Ñ€Ğ¸Ğ¹ÑˆĞ»Ğ¸) Ğ´Ğ¾ Ñ€ĞµÑÑ‚Ğ¾Ñ€Ğ°Ğ½Ñƒ Ğ¾ ÑÑŒĞ¾Ğ¼Ñ–Ğ¹ Ğ³Ğ¾Ğ´Ğ¸Ğ½Ñ–.\n2. Ğ›Ñ–Ñ‚Ğ°Ğº _______ (Ğ²Ñ–Ğ´Ğ»Ñ–Ñ‚Ğ°Ñ”/Ğ²Ñ–Ğ´Ğ»ĞµÑ‚Ñ–Ğ²) Ğ·Ğ° Ğ³Ğ¾Ğ´Ğ¸Ğ½Ñƒ.\n3. Ğ’Ğ¾Ğ½Ğ° _______ (Ğ¿ĞµÑ€ĞµÑ…Ğ¾Ğ´Ğ¸Ğ»Ğ°/Ğ¿ĞµÑ€ĞµĞ¹ÑˆĞ»Ğ°) Ñ‡ĞµÑ€ĞµĞ· Ğ´Ğ¾Ñ€Ğ¾Ğ³Ñƒ, ĞºĞ¾Ğ»Ğ¸ Ğ¿Ğ¾Ğ±Ğ°Ñ‡Ğ¸Ğ»Ğ° Ğ¿Ğ¾Ğ´Ñ€ÑƒĞ³Ñƒ.\n4. Ğ’Ñ–Ğ½ Ñ‡Ğ°ÑÑ‚Ğ¾ _______ (Ğ²Ğ¸Ñ…Ğ¾Ğ´Ğ¸Ğ²/Ğ²Ğ¸Ğ¹ÑˆĞ¾Ğ²) Ğ· Ğ´Ğ¾Ğ¼Ñƒ Ğ¾ Ğ²Ğ¾ÑÑŒĞ¼Ñ–Ğ¹ Ñ€Ğ°Ğ½ĞºÑƒ.\n5. ĞŸĞ¾Ñ‚ÑĞ³ ÑƒĞ¶Ğµ _______ (Ğ²Ñ–Ğ´Ñ…Ğ¾Ğ´Ğ¸Ğ²/Ğ²Ñ–Ğ´Ñ–Ğ¹ÑˆĞ¾Ğ²) Ğ²Ñ–Ğ´ Ğ¿Ğ»Ğ°Ñ‚Ñ„Ğ¾Ñ€Ğ¼Ğ¸.\n\n---\n\n### Ğ§Ğ°ÑÑ‚Ğ¸Ğ½Ğ° Ğ’: Ğ¡ĞºĞ»Ğ°Ğ´Ğ½Ñ– Ñ€ĞµÑ‡ĞµĞ½Ğ½Ñ\n\nĞ”Ğ¾Ğ¿Ğ¾Ğ²Ğ½Ñ–Ñ‚ÑŒ Ñ€ĞµÑ‡ĞµĞ½Ğ½Ñ ÑĞ¿Ğ¾Ğ»ÑƒÑ‡Ğ½Ğ¸ĞºĞ¾Ğ¼:\n\n1. Ğ¯ Ğ·Ğ°Ñ‚ĞµĞ»ĞµÑ„Ğ¾Ğ½ÑƒÑ Ñ‚Ğ¾Ğ±Ñ–, _______ Ğ¿Ñ€Ğ¸Ñ—Ğ´Ñƒ Ğ´Ğ¾Ğ´Ğ¾Ğ¼Ñƒ.\n2. Ğ’Ñ–Ğ½ Ğ½Ğµ Ğ¿Ñ€Ğ¸Ğ¹ÑˆĞ¾Ğ² Ğ½Ğ° Ğ·Ğ°Ğ½ÑÑ‚Ñ‚Ñ, _______ Ğ±ÑƒĞ² Ñ…Ğ²Ğ¾Ñ€Ğ¸Ğ¹.\n3. Ğ’Ğ¾Ğ½Ğ° Ğ²Ğ¸Ğ²Ñ‡Ğ°Ñ” ÑƒĞºÑ€Ğ°Ñ—Ğ½ÑÑŒĞºÑƒ, _______ Ñ…Ğ¾Ñ‡Ğµ Ğ¿Ñ€Ğ°Ñ†ÑĞ²Ğ°Ñ‚Ğ¸ Ğ² Ğ£ĞºÑ€Ğ°Ñ—Ğ½Ñ–.\n4. _______ Ñ Ğ¼Ğ°Ğ² Ğ±Ñ–Ğ»ÑŒÑˆĞµ Ñ‡Ğ°ÑÑƒ, Ñ Ğ± Ñ‡Ğ¸Ñ‚Ğ°Ğ² Ğ±Ñ–Ğ»ÑŒÑˆĞµ ĞºĞ½Ğ¸Ğ³.\n5. Ğ¦Ğµ Ñ‚Ğ¾Ğ¹ ÑÑ‚ÑƒĞ´ĞµĞ½Ñ‚, _______ Ğ¾Ñ‚Ñ€Ğ¸Ğ¼Ğ°Ğ² Ğ½Ğ°Ğ¹ĞºÑ€Ğ°Ñ‰Ñƒ Ğ¾Ñ†Ñ–Ğ½ĞºÑƒ.\n\n---\n\n### Ğ§Ğ°ÑÑ‚Ğ¸Ğ½Ğ° Ğ“: Ğ”Ñ–Ñ”Ğ¿Ñ€Ğ¸ĞºĞ¼ĞµÑ‚Ğ½Ğ¸ĞºĞ¸ Ñ‚Ğ° Ğ¿Ğ°ÑĞ¸Ğ²\n\nĞ¢Ñ€Ğ°Ğ½ÑÑ„Ğ¾Ñ€Ğ¼ÑƒĞ¹Ñ‚Ğµ Ñ€ĞµÑ‡ĞµĞ½Ğ½Ñ:\n\n1. Ğ¡Ñ‚ÑƒĞ´ĞµĞ½Ñ‚ Ğ½Ğ°Ğ¿Ğ¸ÑĞ°Ğ² ĞµÑĞµ. â†’ Ğ•ÑĞµ, _______ ÑÑ‚ÑƒĞ´ĞµĞ½Ñ‚Ğ¾Ğ¼...\n2. ĞšĞ½Ğ¸Ğ³Ñƒ Ğ¿ĞµÑ€ĞµĞºĞ»Ğ°Ğ»Ğ¸ ÑƒĞºÑ€Ğ°Ñ—Ğ½ÑÑŒĞºĞ¾Ñ. â†’ ĞšĞ½Ğ¸Ğ³Ğ° _______ ÑƒĞºÑ€Ğ°Ñ—Ğ½ÑÑŒĞºĞ¾Ñ.\n3. Ğ’Ñ–Ğ½ Ñ‡Ğ¸Ñ‚Ğ°Ğ² ĞºĞ½Ğ¸Ğ³Ñƒ Ñ– ÑĞ»ÑƒÑ…Ğ°Ğ² Ğ¼ÑƒĞ·Ğ¸ĞºÑƒ. â†’ _______ ĞºĞ½Ğ¸Ğ³Ñƒ, Ğ²Ñ–Ğ½ ÑĞ»ÑƒÑ…Ğ°Ğ² Ğ¼ÑƒĞ·Ğ¸ĞºÑƒ.\n4. Ğ’Ğ¾Ğ½Ğ° Ğ·Ğ°ĞºÑ–Ğ½Ñ‡Ğ¸Ğ»Ğ° Ñ€Ğ¾Ğ±Ğ¾Ñ‚Ñƒ Ñ– Ğ¿Ñ–ÑˆĞ»Ğ° Ğ´Ğ¾Ğ´Ğ¾Ğ¼Ñƒ. â†’ _______ Ñ€Ğ¾Ğ±Ğ¾Ñ‚Ñƒ, Ğ²Ğ¾Ğ½Ğ° Ğ¿Ñ–ÑˆĞ»Ğ° Ğ´Ğ¾Ğ´Ğ¾Ğ¼Ñƒ.\n5. Ğ¦Ğµ Ğ¿Ğ¸Ñ‚Ğ°Ğ½Ğ½Ñ Ñ‚Ñ€ĞµĞ±Ğ° Ñ€Ğ¾Ğ·Ğ³Ğ»ÑĞ½ÑƒÑ‚Ğ¸. â†’ Ğ¦Ğµ Ğ¿Ğ¸Ñ‚Ğ°Ğ½Ğ½Ñ _______.\n\n> ğŸ’¡ **ĞŸĞ¾Ñ€Ğ°Ğ´Ğ°**\n> Ğ¯ĞºÑ‰Ğ¾ Ğ²Ğ¸ Ğ´Ğ¾Ğ¿ÑƒÑÑ‚Ğ¸Ğ»Ğ¸ Ğ±Ñ–Ğ»ÑŒÑˆĞµ 5 Ğ¿Ğ¾Ğ¼Ğ¸Ğ»Ğ¾Ğº Ñƒ Ğ±ÑƒĞ´ÑŒ-ÑĞºÑ–Ğ¹ Ñ‡Ğ°ÑÑ‚Ğ¸Ğ½Ñ– â€” Ğ¿Ğ¾Ğ²ĞµÑ€Ğ½Ñ–Ñ‚ÑŒÑÑ Ğ´Ğ¾ Ğ²Ñ–Ğ´Ğ¿Ğ¾Ğ²Ñ–Ğ´Ğ½Ğ¸Ñ… Ğ¼Ğ¾Ğ´ÑƒĞ»Ñ–Ğ² Ğ´Ğ»Ñ Ğ¿Ğ¾Ğ²Ñ‚Ğ¾Ñ€ĞµĞ½Ğ½Ñ.\n\n---\n\n## Ğ—Ğ°Ğ²Ğ´Ğ°Ğ½Ğ½Ñ 5: Ğ›ĞµĞºÑĞ¸ĞºĞ°\n\nĞšĞ¾Ğ¼Ğ¿Ğ»ĞµĞºÑĞ½Ğ¸Ğ¹ Ñ‚ĞµÑÑ‚ Ğ½Ğ° Ğ²ÑÑ Ğ»ĞµĞºÑĞ¸ĞºÑƒ B1.\n\n---\n\n### Ğ§Ğ°ÑÑ‚Ğ¸Ğ½Ğ° Ğ: ĞĞ±ÑÑ‚Ñ€Ğ°ĞºÑ‚Ğ½Ñ– Ğ¿Ğ¾Ğ½ÑÑ‚Ñ‚Ñ (M52-55)\n\nĞĞ±ĞµÑ€Ñ–Ñ‚ÑŒ Ğ¿Ñ€Ğ°Ğ²Ğ¸Ğ»ÑŒĞ½Ğµ ÑĞ»Ğ¾Ğ²Ğ¾:\n\n1. Ğ”ĞµĞ¼Ğ¾ĞºÑ€Ğ°Ñ‚Ñ–Ñ Ğ±Ğ°Ğ·ÑƒÑ”Ñ‚ÑŒÑÑ Ğ½Ğ° Ğ¿Ñ€Ğ¸Ğ½Ñ†Ğ¸Ğ¿Ñ– Ñ€Ñ–Ğ²Ğ½Ğ¾ÑÑ‚Ñ– Ñ‚Ğ° _______.\n   - Ğ°) ÑĞ¿Ñ€Ğ°Ğ²ĞµĞ´Ğ»Ğ¸Ğ²Ğ¾ÑÑ‚Ñ–  Ğ±) Ğ½ĞµÑĞ¿Ñ€Ğ°Ğ²ĞµĞ´Ğ»Ğ¸Ğ²Ğ¾ÑÑ‚Ñ–  Ğ²) Ğ±Ğ°Ğ¹Ğ´ÑƒĞ¶Ğ¾ÑÑ‚Ñ–\n\n2. ĞĞ°ÑƒĞºĞ¾Ğ²ĞµÑ†ÑŒ Ğ¿Ñ€Ğ¾Ğ²Ñ–Ğ² _______ Ñ– Ğ¾Ñ‚Ñ€Ğ¸Ğ¼Ğ°Ğ² Ñ†Ñ–ĞºĞ°Ğ²Ñ– Ñ€ĞµĞ·ÑƒĞ»ÑŒÑ‚Ğ°Ñ‚Ğ¸.\n   - Ğ°) ĞºĞ¾Ğ½Ñ†ĞµĞ¿Ñ†Ñ–Ñ  Ğ±) Ğ´Ğ¾ÑĞ»Ñ–Ğ´Ğ¶ĞµĞ½Ğ½Ñ  Ğ²) Ğ³Ñ–Ğ¿Ğ¾Ñ‚ĞµĞ·Ñƒ\n\n3. Ğ¦ĞµĞ¹ Ğ¿Ñ€Ğ¾ĞµĞºÑ‚ Ğ¼Ğ°Ñ” Ğ²ĞµĞ»Ğ¸ĞºĞ¸Ğ¹ _______ Ğ´Ğ»Ñ Ñ€Ğ¾Ğ·Ğ²Ğ¸Ñ‚ĞºÑƒ Ğ¼Ñ–ÑÑ‚Ğ°.\n   - Ğ°) Ğ·Ğ½Ğ°Ñ‡ĞµĞ½Ğ½Ñ  Ğ±) Ğ²Ñ–Ğ´Ñ‡ÑƒÑ‚Ñ‚Ñ  Ğ²) Ğ²Ñ€Ğ°Ğ¶ĞµĞ½Ğ½Ñ\n\n---\n\n### Ğ§Ğ°ÑÑ‚Ğ¸Ğ½Ğ° Ğ‘: Ğ”Ğ¸ÑĞºÑƒÑ€Ñ Ñ‚Ğ° Ğ¼Ğ°Ñ€ĞºĞµÑ€Ğ¸ (M56-60)\n\nĞ’ÑÑ‚Ğ°Ğ²Ñ‚Ğµ Ğ¼Ğ°Ñ€ĞºĞµÑ€:\n\n1. _______, Ñ…Ğ¾Ñ‡Ñƒ Ğ¿Ğ¾Ğ´ÑĞºÑƒĞ²Ğ°Ñ‚Ğ¸ Ğ²ÑÑ–Ğ¼ ÑƒÑ‡Ğ°ÑĞ½Ğ¸ĞºĞ°Ğ¼.\n2. Ğ„ ĞºÑ–Ğ»ÑŒĞºĞ° Ğ°Ñ€Ğ³ÑƒĞ¼ĞµĞ½Ñ‚Ñ–Ğ² Â«Ğ·Ğ°Â». _______, Ñ” Ğ¹ Ğ°Ñ€Ğ³ÑƒĞ¼ĞµĞ½Ñ‚Ğ¸ Â«Ğ¿Ñ€Ğ¾Ñ‚Ğ¸Â».\n3. _______, Ñ…Ğ¾Ñ‡Ñƒ Ğ·Ğ°Ğ·Ğ½Ğ°Ñ‡Ğ¸Ñ‚Ğ¸ Ğ²Ğ°Ğ¶Ğ»Ğ¸Ğ²Ñ–ÑÑ‚ÑŒ Ñ†ÑŒĞ¾Ğ³Ğ¾ Ğ¿Ğ¸Ñ‚Ğ°Ğ½Ğ½Ñ.\n4. Ğ¦Ğµ ÑĞºĞ»Ğ°Ğ´Ğ½Ğ° Ğ¿Ñ€Ğ¾Ğ±Ğ»ĞµĞ¼Ğ°. _______, Ğ¼Ğ¸ Ğ·Ğ½Ğ°Ğ¹Ğ´ĞµĞ¼Ğ¾ Ñ€Ñ–ÑˆĞµĞ½Ğ½Ñ.\n\n---\n\n### Ğ§Ğ°ÑÑ‚Ğ¸Ğ½Ğ° Ğ’: ĞšÑƒĞ»ÑŒÑ‚ÑƒÑ€Ğ° Ñ‚Ğ° Ñ€ĞµĞ³Ñ–Ğ¾Ğ½Ğ¸ (M72-81)\n\nĞ¡Ğ¿Ñ–Ğ²ÑÑ‚Ğ°Ğ²Ñ‚Ğµ:\n\n| Ğ¢ĞµÑ€Ğ¼Ñ–Ğ½ | ĞĞ¿Ğ¸Ñ |\n|--------|------|\n| Ğ§Ğ¾Ñ€Ğ½Ğ¾Ğ±Ğ¸Ğ»ÑŒ | Ğ½Ğ°Ğ¹Ğ±Ñ–Ğ»ÑŒÑˆĞ° Ğ³Ğ¾Ñ€Ğ° ĞšĞ°Ñ€Ğ¿Ğ°Ñ‚ |\n| Ğ“Ğ¾Ğ²ĞµÑ€Ğ»Ğ° | Ğ¼Ñ–ÑÑ†Ğµ ÑĞ´ĞµÑ€Ğ½Ğ¾Ñ— ĞºĞ°Ñ‚Ğ°ÑÑ‚Ñ€Ğ¾Ñ„Ğ¸ |\n| Ğ›ÑŒĞ²Ñ–Ğ² | ĞºÑƒĞ»ÑŒÑ‚ÑƒÑ€Ğ½Ğ° ÑÑ‚Ğ¾Ğ»Ğ¸Ñ†Ñ |\n| ĞĞ´ĞµÑĞ° | Ğ¼Ñ–ÑÑ‚Ğ¾ Ğ±Ñ–Ğ»Ñ Ğ§Ğ¾Ñ€Ğ½Ğ¾Ğ³Ğ¾ Ğ¼Ğ¾Ñ€Ñ |\n\n---\n\n### Ğ§Ğ°ÑÑ‚Ğ¸Ğ½Ğ° Ğ“: ĞŸÑ€Ğ¾Ñ„ĞµÑÑ–Ğ¹Ğ½Ğ° Ğ»ĞµĞºÑĞ¸ĞºĞ° (M61, 66)\n\nĞ—Ğ°Ğ¿Ğ¾Ğ²Ğ½Ñ–Ñ‚ÑŒ Ğ¿Ñ€Ğ¾Ğ¿ÑƒÑĞºĞ¸:\n\n1. ĞšĞ¾Ğ¼Ğ¿Ğ°Ğ½Ñ–Ñ ÑˆÑƒĞºĞ°Ñ” Ğ´Ğ¾ÑĞ²Ñ–Ğ´Ñ‡ĞµĞ½Ğ¾Ğ³Ğ¾ _______ Ğ´Ğ»Ñ Ñ€Ğ¾Ğ·Ñ€Ğ¾Ğ±ĞºĞ¸ Ğ¿Ñ€Ğ¾Ğ³Ñ€Ğ°Ğ¼.\n2. ĞĞ° _______ Ğ¾Ğ±Ğ³Ğ¾Ğ²Ğ¾Ñ€ÑĞ²Ğ°Ğ»Ğ¸ ÑÑ‚Ñ€Ğ°Ñ‚ĞµĞ³Ñ–Ñ Ñ€Ğ¾Ğ·Ğ²Ğ¸Ñ‚ĞºÑƒ.\n3. Ğ’Ñ–Ğ½ Ğ¿Ğ¾Ğ´Ğ°Ğ² _______ Ğ½Ğ° Ğ²Ğ°ĞºĞ°Ğ½ÑÑ–Ñ Ğ¼ĞµĞ½ĞµĞ´Ğ¶ĞµÑ€Ğ°.\n4. ĞĞ°ÑˆĞ° _______ â€” ÑÑ‚Ğ°Ñ‚Ğ¸ Ğ»Ñ–Ğ´ĞµÑ€Ğ¾Ğ¼ Ñ€Ğ¸Ğ½ĞºÑƒ.\n\n---\n\n## Ğ¡Ğ°Ğ¼Ğ¾Ğ¾Ñ†Ñ–Ğ½ĞºĞ°\n\n### Ğ§Ğ¸ Ğ¼Ğ¾Ğ¶ĞµÑ‚Ğµ Ğ²Ğ¸...?\n\nĞÑ†Ñ–Ğ½Ñ–Ñ‚ÑŒ ÑĞ²Ğ¾Ñ— Ğ½Ğ°Ğ²Ğ¸Ñ‡ĞºĞ¸ Ğ·Ğ° ÑˆĞºĞ°Ğ»Ğ¾Ñ: âœ… Ğ¢Ğ°Ğº / âš ï¸ Ğ§Ğ°ÑÑ‚ĞºĞ¾Ğ²Ğ¾ / âŒ ĞÑ–\n\n---\n\n### Ğ§Ğ¸Ñ‚Ğ°Ğ½Ğ½Ñ\n\nĞ§Ğ¸ Ğ¼Ğ¾Ğ¶ĞµÑ‚Ğµ Ğ²Ğ¸ Ñ€Ğ¾Ğ·ÑƒĞ¼Ñ–Ñ‚Ğ¸ Ğ³Ğ¾Ğ»Ğ¾Ğ²Ğ½Ñ– Ğ´ÑƒĞ¼ĞºĞ¸ Ğ² ÑÑ‚Ğ°Ğ½Ğ´Ğ°Ñ€Ñ‚Ğ½Ğ¸Ñ… Ñ‚ĞµĞºÑÑ‚Ğ°Ñ…? Ğ§Ğ¸ Ğ¼Ğ¾Ğ¶ĞµÑ‚Ğµ Ñ‡Ğ¸Ñ‚Ğ°Ñ‚Ğ¸ ÑƒĞºÑ€Ğ°Ñ—Ğ½ÑÑŒĞºÑ– Ğ½Ğ¾Ğ²Ğ¸Ğ½Ğ¸ Ñ‚Ğ° Ñ€Ğ¾Ğ·ÑƒĞ¼Ñ–Ñ‚Ğ¸ Ğ¾ÑĞ½Ğ¾Ğ²Ğ½Ğ¸Ğ¹ Ğ·Ğ¼Ñ–ÑÑ‚? Ğ§Ğ¸ Ğ¼Ğ¾Ğ¶ĞµÑ‚Ğµ Ñ€Ğ¾Ğ·ÑƒĞ¼Ñ–Ñ‚Ğ¸ Ñ‚ĞµĞºÑÑ‚Ğ¸ Ğ¿Ñ€Ğ¾ Ğ·Ğ½Ğ°Ğ¹Ğ¾Ğ¼Ñ– Ñ‚ĞµĞ¼Ğ¸? Ğ§Ğ¸ Ğ¼Ğ¾Ğ¶ĞµÑ‚Ğµ Ğ·Ğ½Ğ°Ñ…Ğ¾Ğ´Ğ¸Ñ‚Ğ¸ ĞºĞ¾Ğ½ĞºÑ€ĞµÑ‚Ğ½Ñƒ Ñ–Ğ½Ñ„Ğ¾Ñ€Ğ¼Ğ°Ñ†Ñ–Ñ Ğ² Ñ‚ĞµĞºÑÑ‚Ğ°Ñ…?\n\n---\n\n### ĞŸĞ¸ÑÑŒĞ¼Ğ¾\n\nĞ§Ğ¸ Ğ¼Ğ¾Ğ¶ĞµÑ‚Ğµ Ğ²Ğ¸ Ğ¿Ğ¸ÑĞ°Ñ‚Ğ¸ Ğ·Ğ²'ÑĞ·Ğ½Ñ– Ñ‚ĞµĞºÑÑ‚Ğ¸ Ğ½Ğ° Ğ·Ğ½Ğ°Ğ¹Ğ¾Ğ¼Ñ– Ñ‚ĞµĞ¼Ğ¸ (200+ ÑĞ»Ñ–Ğ²)? Ğ§Ğ¸ Ğ¼Ğ¾Ğ¶ĞµÑ‚Ğµ Ğ¾Ğ¿Ğ¸ÑÑƒĞ²Ğ°Ñ‚Ğ¸ Ğ´Ğ¾ÑĞ²Ñ–Ğ´, Ğ¿Ğ¾Ğ´Ñ–Ñ—, Ğ¼Ñ€Ñ–Ñ—? Ğ§Ğ¸ Ğ¼Ğ¾Ğ¶ĞµÑ‚Ğµ Ğ´Ğ°Ğ²Ğ°Ñ‚Ğ¸ Ğ¿Ñ€Ğ¸Ñ‡Ğ¸Ğ½Ğ¸ Ñ‚Ğ° Ğ¿Ğ¾ÑÑĞ½ĞµĞ½Ğ½Ñ? Ğ§Ğ¸ Ğ¼Ğ¾Ğ¶ĞµÑ‚Ğµ Ğ¿Ğ¸ÑĞ°Ñ‚Ğ¸ Ğ¾Ñ„Ñ–Ñ†Ñ–Ğ¹Ğ½Ñ– Ñ‚Ğ° Ğ½ĞµĞ¾Ñ„Ñ–Ñ†Ñ–Ğ¹Ğ½Ñ– Ğ»Ğ¸ÑÑ‚Ğ¸?\n\n---\n\n### ĞÑƒĞ´Ñ–ÑĞ²Ğ°Ğ½Ğ½Ñ\n\nĞ§Ğ¸ Ğ¼Ğ¾Ğ¶ĞµÑ‚Ğµ Ğ²Ğ¸ Ñ€Ğ¾Ğ·ÑƒĞ¼Ñ–Ñ‚Ğ¸ Ğ³Ğ¾Ğ»Ğ¾Ğ²Ğ½Ñ– Ğ´ÑƒĞ¼ĞºĞ¸ Ñ‡Ñ–Ñ‚ĞºĞ¾Ñ— ÑÑ‚Ğ°Ğ½Ğ´Ğ°Ñ€Ñ‚Ğ½Ğ¾Ñ— ÑƒĞºÑ€Ğ°Ñ—Ğ½ÑÑŒĞºĞ¾Ñ— Ğ¼Ğ¾Ğ²Ğ¸? Ğ§Ğ¸ Ğ¼Ğ¾Ğ¶ĞµÑ‚Ğµ ÑĞ»ÑƒÑ…Ğ°Ñ‚Ğ¸ ÑƒĞºÑ€Ğ°Ñ—Ğ½ÑÑŒĞºÑ– Ğ¿Ğ¾Ğ´ĞºĞ°ÑÑ‚Ğ¸ Ñ‚Ğ° Ñ€Ğ¾Ğ·ÑƒĞ¼Ñ–Ñ‚Ğ¸ Ğ¾ÑĞ½Ğ¾Ğ²Ğ½Ğ¸Ğ¹ Ğ·Ğ¼Ñ–ÑÑ‚? Ğ§Ğ¸ Ğ¼Ğ¾Ğ¶ĞµÑ‚Ğµ Ñ€Ğ¾Ğ·ÑƒĞ¼Ñ–Ñ‚Ğ¸ Ğ¿Ğ¾Ğ²Ñ–Ğ»ÑŒĞ½Ñƒ Ñ‚Ğ° Ñ‡Ñ–Ñ‚ĞºÑƒ Ğ¼Ğ¾Ğ²Ñƒ Ğ½Ğ¾ÑÑ–Ñ—Ğ²? Ğ§Ğ¸ Ğ¼Ğ¾Ğ¶ĞµÑ‚Ğµ Ñ€Ğ¾Ğ±Ğ¸Ñ‚Ğ¸ Ğ½Ğ¾Ñ‚Ğ°Ñ‚ĞºĞ¸ Ğ¿Ñ–Ğ´ Ñ‡Ğ°Ñ Ğ¿Ñ€Ğ¾ÑĞ»ÑƒÑ…Ğ¾Ğ²ÑƒĞ²Ğ°Ğ½Ğ½Ñ?\n\n---\n\n### Ğ“Ñ€Ğ°Ğ¼Ğ°Ñ‚Ğ¸ĞºĞ°\n\nĞ§Ğ¸ Ğ¼Ğ¾Ğ¶ĞµÑ‚Ğµ Ğ²Ğ¸ Ğ¿Ñ€Ğ°Ğ²Ğ¸Ğ»ÑŒĞ½Ğ¾ Ğ²Ğ¸ĞºĞ¾Ñ€Ğ¸ÑÑ‚Ğ¾Ğ²ÑƒĞ²Ğ°Ñ‚Ğ¸ Ğ²Ğ¸Ğ´ Ğ´Ñ–Ñ”ÑĞ»Ğ¾Ğ²Ğ° Ñƒ Ğ²ÑÑ–Ñ… ĞºĞ¾Ğ½Ñ‚ĞµĞºÑÑ‚Ğ°Ñ…? Ğ§Ğ¸ Ğ¼Ğ¾Ğ¶ĞµÑ‚Ğµ Ğ²Ğ¸ĞºĞ¾Ñ€Ğ¸ÑÑ‚Ğ¾Ğ²ÑƒĞ²Ğ°Ñ‚Ğ¸ Ğ´Ñ–Ñ”ÑĞ»Ğ¾Ğ²Ğ° Ñ€ÑƒÑ…Ñƒ Ğ· Ğ¿Ñ€ĞµÑ„Ñ–ĞºÑĞ°Ğ¼Ğ¸? Ğ§Ğ¸ Ğ¼Ğ¾Ğ¶ĞµÑ‚Ğµ Ğ±ÑƒĞ´ÑƒĞ²Ğ°Ñ‚Ğ¸ ÑĞºĞ»Ğ°Ğ´Ğ½Ñ– Ñ€ĞµÑ‡ĞµĞ½Ğ½Ñ Ğ²ÑÑ–Ñ… Ñ‚Ğ¸Ğ¿Ñ–Ğ²? Ğ§Ğ¸ Ğ¼Ğ¾Ğ¶ĞµÑ‚Ğµ Ğ²Ğ¸ĞºĞ¾Ñ€Ğ¸ÑÑ‚Ğ¾Ğ²ÑƒĞ²Ğ°Ñ‚Ğ¸ Ğ´Ñ–Ñ”Ğ¿Ñ€Ğ¸ĞºĞ¼ĞµÑ‚Ğ½Ğ¸ĞºĞ¸ Ñ‚Ğ° Ğ¿Ğ°ÑĞ¸Ğ²Ğ½Ñ– ĞºĞ¾Ğ½ÑÑ‚Ñ€ÑƒĞºÑ†Ñ–Ñ—?\n\n---\n\n### Ğ›ĞµĞºÑĞ¸ĞºĞ°\n\nĞ§Ğ¸ Ğ¼Ğ¾Ğ¶ĞµÑ‚Ğµ Ğ²Ğ¸ Ğ²Ğ¸ĞºĞ¾Ñ€Ğ¸ÑÑ‚Ğ¾Ğ²ÑƒĞ²Ğ°Ñ‚Ğ¸ ~1,800 Ğ½Ğ¾Ğ²Ğ¸Ñ… ÑĞ»Ñ–Ğ² B1? Ğ§Ğ¸ Ğ¼Ğ¾Ğ¶ĞµÑ‚Ğµ Ğ¾Ğ±Ğ³Ğ¾Ğ²Ğ¾Ñ€ÑĞ²Ğ°Ñ‚Ğ¸ Ğ°Ğ±ÑÑ‚Ñ€Ğ°ĞºÑ‚Ğ½Ñ– Ñ‚ĞµĞ¼Ğ¸? Ğ§Ğ¸ Ğ¼Ğ¾Ğ¶ĞµÑ‚Ğµ Ğ²Ğ¸ÑĞ»Ğ¾Ğ²Ğ»ÑĞ²Ğ°Ñ‚Ğ¸ Ğ´ÑƒĞ¼ĞºĞ¸ Ñ‚Ğ° Ğ°Ñ€Ğ³ÑƒĞ¼ĞµĞ½Ñ‚Ğ¸? Ğ§Ğ¸ Ğ¼Ğ¾Ğ¶ĞµÑ‚Ğµ Ñ€Ğ¾Ğ·ÑƒĞ¼Ñ–Ñ‚Ğ¸ Ñ‚ĞµĞºÑÑ‚Ğ¸ Ğ¿Ñ€Ğ¾ ĞºÑƒĞ»ÑŒÑ‚ÑƒÑ€Ñƒ Ñ‚Ğ° ÑÑƒÑĞ¿Ñ–Ğ»ÑŒÑÑ‚Ğ²Ğ¾?\n\n---\n\n### Ğ†Ğ½Ñ‚ĞµÑ€Ğ¿Ñ€ĞµÑ‚Ğ°Ñ†Ñ–Ñ Ñ€ĞµĞ·ÑƒĞ»ÑŒÑ‚Ğ°Ñ‚Ñ–Ğ²\n\n| Ğ ĞµĞ·ÑƒĞ»ÑŒÑ‚Ğ°Ñ‚ | Ğ ĞµĞºĞ¾Ğ¼ĞµĞ½Ğ´Ğ°Ñ†Ñ–Ñ |\n|-----------|--------------|\n| 80%+ âœ… | Ğ’Ğ¸ Ğ³Ğ¾Ñ‚Ğ¾Ğ²Ñ– Ğ´Ğ¾ Ñ€Ñ–Ğ²Ğ½Ñ B2! |\n| 60-80% âš ï¸ | ĞŸĞ¾Ğ²Ñ‚Ğ¾Ñ€Ñ–Ñ‚ÑŒ ÑĞ»Ğ°Ğ±ĞºÑ– Ğ¾Ğ±Ğ»Ğ°ÑÑ‚Ñ– Ğ¿ĞµÑ€ĞµĞ´ B2 |\n| ĞœĞµĞ½ÑˆĞµ 60% âŒ | ĞŸĞ¾Ğ²ĞµÑ€Ğ½Ñ–Ñ‚ÑŒÑÑ Ğ´Ğ¾ Ğ¼Ğ¾Ğ´ÑƒĞ»Ñ–Ğ² B1 Ğ´Ğ»Ñ Ğ¿Ğ¾Ğ²Ñ‚Ğ¾Ñ€ĞµĞ½Ğ½Ñ |\n\n> ğŸ¯ **Ğ’Ğ°Ğ¶Ğ»Ğ¸Ğ²Ğ¾**\n> Ğ§ĞµÑĞ½Ğ¾ Ğ¾Ñ†Ñ–Ğ½ÑĞ¹Ñ‚Ğµ ÑĞ²Ğ¾Ñ— Ğ½Ğ°Ğ²Ğ¸Ñ‡ĞºĞ¸. ĞšÑ€Ğ°Ñ‰Ğµ Ğ¿Ğ¾Ğ²Ñ‚Ğ¾Ñ€Ğ¸Ñ‚Ğ¸ ÑĞºĞ»Ğ°Ğ´Ğ½Ñ– Ñ‚ĞµĞ¼Ğ¸ Ğ·Ğ°Ñ€Ğ°Ğ·, Ğ½Ñ–Ğ¶ Ğ¼Ğ°Ñ‚Ğ¸ Ğ¿Ñ€Ğ¾Ğ³Ğ°Ğ»Ğ¸Ğ½Ğ¸ Ğ½Ğ° Ñ€Ñ–Ğ²Ğ½Ñ– B2.\n\n---\n\n## Ğ”Ñ–Ğ°Ğ»Ğ¾Ğ³: Ğ Ğ¾Ğ·Ğ¼Ğ¾Ğ²Ğ° Ğ¿Ñ€Ğ¾ Ğ¿Ñ–Ğ´ÑÑƒĞ¼ĞºĞ¸ B1\n\n**ĞĞºÑĞ°Ğ½Ğ°:** ĞŸÑ€Ğ¸Ğ²Ñ–Ñ‚, Ğ¢Ğ°Ñ€Ğ°ÑĞµ! Ğ¯ Ñ‡ÑƒĞ»Ğ°, Ñ‰Ğ¾ Ñ‚Ğ¸ Ğ·Ğ°ĞºÑ–Ğ½Ñ‡Ğ¸Ğ² Ñ€Ñ–Ğ²ĞµĞ½ÑŒ B1. Ğ’Ñ–Ñ‚Ğ°Ñ Ñ‚ĞµĞ±Ğµ!\n\n**Ğ¢Ğ°Ñ€Ğ°Ñ:** Ğ”ÑĞºÑƒÑ, ĞĞºÑĞ°Ğ½Ğ¾! Ğ¦Ğµ Ğ±ÑƒĞ² Ğ´Ğ¾Ğ²Ğ³Ğ¸Ğ¹ ÑˆĞ»ÑÑ…, Ğ°Ğ»Ğµ Ñ Ğ´ÑƒĞ¶Ğµ Ğ·Ğ°Ğ´Ğ¾Ğ²Ğ¾Ğ»ĞµĞ½Ğ¸Ğ¹ Ñ€ĞµĞ·ÑƒĞ»ÑŒÑ‚Ğ°Ñ‚Ğ°Ğ¼Ğ¸.\n\n**ĞĞºÑĞ°Ğ½Ğ°:** Ğ©Ğ¾ Ğ±ÑƒĞ»Ğ¾ Ğ½Ğ°Ğ¹ÑĞºĞ»Ğ°Ğ´Ğ½Ñ–ÑˆĞ¸Ğ¼ Ğ´Ğ»Ñ Ñ‚ĞµĞ±Ğµ Ğ½Ğ° Ñ†ÑŒĞ¾Ğ¼Ñƒ Ñ€Ñ–Ğ²Ğ½Ñ–?\n\n**Ğ¢Ğ°Ñ€Ğ°Ñ:** ĞĞ°Ğ¹ÑĞºĞ»Ğ°Ğ´Ğ½Ñ–ÑˆĞ¸Ğ¼ Ğ±ÑƒĞ² Ğ²Ğ¸Ğ´ Ğ´Ñ–Ñ”ÑĞ»Ğ¾Ğ²Ğ°. ĞœĞµĞ½Ñ– Ğ¿Ğ¾Ñ‚Ñ€Ñ–Ğ±ĞµĞ½ Ğ±ÑƒĞ² Ñ‡Ğ°Ñ, Ñ‰Ğ¾Ğ± Ğ·Ñ€Ğ¾Ğ·ÑƒĞ¼Ñ–Ñ‚Ğ¸ Ñ€Ñ–Ğ·Ğ½Ğ¸Ñ†Ñ Ğ¼Ñ–Ğ¶ Ğ´Ğ¾ĞºĞ¾Ğ½Ğ°Ğ½Ğ¸Ğ¼ Ñ– Ğ½ĞµĞ´Ğ¾ĞºĞ¾Ğ½Ğ°Ğ½Ğ¸Ğ¼ Ğ²Ğ¸Ğ´Ğ¾Ğ¼.\n\n**ĞĞºÑĞ°Ğ½Ğ°:** Ğ¯ Ñ‚ĞµĞ±Ğµ Ñ€Ğ¾Ğ·ÑƒĞ¼Ñ–Ñ! Ğ Ğ´Ñ–Ñ”ÑĞ»Ğ¾Ğ²Ğ° Ñ€ÑƒÑ…Ñƒ? Ğ’Ğ¾Ğ½Ğ¸ Ñ‚Ğ°ĞºĞ¾Ğ¶ Ğ½ĞµĞ¿Ñ€Ğ¾ÑÑ‚Ñ– Ğ´Ğ»Ñ Ñ–Ğ½Ğ¾Ğ·ĞµĞ¼Ñ†Ñ–Ğ².\n\n**Ğ¢Ğ°Ñ€Ğ°Ñ:** Ğ¢Ğ°Ğº, Ğ´Ñ–Ñ”ÑĞ»Ğ¾Ğ²Ğ° Ñ€ÑƒÑ…Ñƒ Ğ· Ğ¿Ñ€ĞµÑ„Ñ–ĞºÑĞ°Ğ¼Ğ¸ â€” Ñ†Ğµ ÑĞ¿Ñ€Ğ°Ğ²Ğ¶Ğ½Ñ” Ğ²Ğ¸Ğ¿Ñ€Ğ¾Ğ±ÑƒĞ²Ğ°Ğ½Ğ½Ñ. ĞĞ°Ğ¿Ñ€Ğ¸ĞºĞ»Ğ°Ğ´, Ñ€Ñ–Ğ·Ğ½Ğ¸Ñ†Ñ Ğ¼Ñ–Ğ¶ Â«Ğ²Ğ¸Ñ…Ğ¾Ğ´Ğ¸Ñ‚Ğ¸Â» Ñ– Â«Ğ²Ğ¸Ñ…Ğ¾Ğ´Ğ¸Ñ‚Ğ¸Â» Ğ¼ĞµĞ½Ğµ ÑĞ¿Ğ¾Ñ‡Ğ°Ñ‚ĞºÑƒ Ğ±ĞµĞ½Ñ‚ĞµĞ¶Ğ¸Ğ»Ğ°.\n\n**ĞĞºÑĞ°Ğ½Ğ°:** Ğ¢Ğ¸ Ğ¼Ğ°Ñ”Ñˆ Ğ½Ğ° ÑƒĞ²Ğ°Ğ·Ñ– Â«Ğ²Ğ¸Ñ…Ğ¾Ğ´Ğ¸Ñ‚Ğ¸Â» Ñ– Â«Ğ²Ğ¸Ğ¹Ñ‚Ğ¸Â»?\n\n**Ğ¢Ğ°Ñ€Ğ°Ñ:** Ğ¡Ğ°Ğ¼Ğµ Ñ‚Ğ°Ğº! Ğ Ñ‰Ğµ ÑĞºĞ»Ğ°Ğ´Ğ½Ñ– Ñ€ĞµÑ‡ĞµĞ½Ğ½Ñ Ğ· ÑƒÑÑ–Ğ¼Ğ° Ñ†Ğ¸Ğ¼Ğ¸ ÑĞ¿Ğ¾Ğ»ÑƒÑ‡Ğ½Ğ¸ĞºĞ°Ğ¼Ğ¸: Â«ÑĞºÑ‰Ğ¾Â», Â«ÑĞºĞ±Ğ¸Â», Â«Ñ…Ğ¾Ñ‡Ğ°Â», Â«Ñ‰Ğ¾Ğ±Â»...\n\n**ĞĞºÑĞ°Ğ½Ğ°:** Ğ¦Ğµ Ğ²Ğ°Ğ¶Ğ»Ğ¸Ğ²Ñ– ÑÑ‚Ñ€ÑƒĞºÑ‚ÑƒÑ€Ğ¸ Ğ´Ğ»Ñ B2. Ğ¢Ğ¸ Ğ¿Ğ»Ğ°Ğ½ÑƒÑ”Ñˆ Ğ¿Ñ€Ğ¾Ğ´Ğ¾Ğ²Ğ¶ÑƒĞ²Ğ°Ñ‚Ğ¸ Ğ½Ğ°Ğ²Ñ‡Ğ°Ğ½Ğ½Ñ?\n\n**Ğ¢Ğ°Ñ€Ğ°Ñ:** Ğ—Ğ²Ğ¸Ñ‡Ğ°Ğ¹Ğ½Ğ¾! Ğ¯ Ñ…Ğ¾Ñ‡Ñƒ, Ñ‰Ğ¾Ğ± Ğ¼Ñ–Ğ¹ Ñ€Ñ–Ğ²ĞµĞ½ÑŒ Ğ±ÑƒĞ² Ğ´Ğ¾ÑÑ‚Ğ°Ñ‚Ğ½Ñ–Ğ¼ Ğ´Ğ»Ñ Ñ€Ğ¾Ğ±Ğ¾Ñ‚Ğ¸ Ğ² Ğ£ĞºÑ€Ğ°Ñ—Ğ½Ñ–. Ğ¢Ğ¾Ğ¼Ñƒ Ñ Ğ¿Ğ»Ğ°Ğ½ÑƒÑ Ğ¿Ğ¾Ñ—Ñ…Ğ°Ñ‚Ğ¸ Ğ´Ğ¾ Ğ›ÑŒĞ²Ğ¾Ğ²Ğ° Ğ½Ğ° Ğ¼Ğ¾Ğ²Ğ½Ñ– ĞºÑƒÑ€ÑĞ¸.\n\n**ĞĞºÑĞ°Ğ½Ğ°:** Ğ§ÑƒĞ´Ğ¾Ğ²Ğ¸Ğ¹ Ğ¿Ğ»Ğ°Ğ½! Ğ›ÑŒĞ²Ñ–Ğ² â€” Ğ¿Ñ€ĞµĞºÑ€Ğ°ÑĞ½Ğµ Ğ¼Ñ–ÑÑ‚Ğ¾ Ğ´Ğ»Ñ Ğ²Ğ¸Ğ²Ñ‡ĞµĞ½Ğ½Ñ ÑƒĞºÑ€Ğ°Ñ—Ğ½ÑÑŒĞºĞ¾Ñ—.\n\n**Ğ¢Ğ°Ñ€Ğ°Ñ:** Ğ¯ Ğ²Ğ¶Ğµ Ğ±Ñ€Ğ¾Ğ½ÑÑ ĞºĞ²Ğ¸Ñ‚ĞºĞ¸. ĞŸĞ¾Ñ—Ğ·Ğ´ Ğ²Ñ–Ğ´Ğ¿Ñ€Ğ°Ğ²Ğ»ÑÑ”Ñ‚ÑŒÑÑ Ğ·Ğ°Ğ²Ñ‚Ñ€Ğ° Ğ¾ Ğ²Ğ¾ÑÑŒĞ¼Ñ–Ğ¹ Ñ€Ğ°Ğ½ĞºÑƒ!\n\n> ğŸ¬ **ĞšÑƒĞ»ÑŒÑ‚ÑƒÑ€Ğ½Ğ¸Ğ¹ Ğ¼Ğ¾Ğ¼ĞµĞ½Ñ‚**\n> Ğ›ÑŒĞ²Ñ–Ğ² Ñ‡Ğ°ÑÑ‚Ğ¾ Ğ½Ğ°Ğ·Ğ¸Ğ²Ğ°ÑÑ‚ÑŒ Â«ĞºÑƒĞ»ÑŒÑ‚ÑƒÑ€Ğ½Ğ¾Ñ ÑÑ‚Ğ¾Ğ»Ğ¸Ñ†ĞµÑÂ» Ğ£ĞºÑ€Ğ°Ñ—Ğ½Ğ¸ Ğ·Ğ°Ğ²Ğ´ÑĞºĞ¸ Ğ¹Ğ¾Ğ³Ğ¾ Ğ°Ñ€Ñ…Ñ–Ñ‚ĞµĞºÑ‚ÑƒÑ€Ñ–, ĞºĞ°Ğ²'ÑÑ€Ğ½ÑĞ¼ Ñ‚Ğ° Ğ°Ñ‚Ğ¼Ğ¾ÑÑ„ĞµÑ€Ñ– ÑÑ‚Ğ°Ñ€Ğ¾Ğ³Ğ¾ Ñ”Ğ²Ñ€Ğ¾Ğ¿ĞµĞ¹ÑÑŒĞºĞ¾Ğ³Ğ¾ Ğ¼Ñ–ÑÑ‚Ğ°.\n\n---"
      },
      {
        "id": "section-2",
        "name": "ĞŸÑ–Ğ´ÑÑƒĞ¼Ğ¾Ğº",
        "nameEn": null,
        "type": "summary",
        "content": "## Ğ’Ğ°Ñˆ ÑˆĞ»ÑÑ… Ğ²Ñ–Ğ´ A1 Ğ´Ğ¾ B1\n\nĞ’Ñ–Ñ‚Ğ°Ñ”Ğ¼Ğ¾! Ğ’Ğ¸ Ğ¿Ñ€Ğ¾Ğ¹ÑˆĞ»Ğ¸ Ğ½ĞµĞ¹Ğ¼Ğ¾Ğ²Ñ–Ñ€Ğ½Ğ¸Ğ¹ ÑˆĞ»ÑÑ…:\n\n| Ğ Ñ–Ğ²ĞµĞ½ÑŒ | Ğ©Ğ¾ Ğ²Ğ¸ Ğ²Ğ¸Ğ²Ñ‡Ğ¸Ğ»Ğ¸ |\n|--------|--------------|\n| **A1** | ĞšĞ¸Ñ€Ğ¸Ğ»Ğ¸Ñ†Ñ, Ğ±Ğ°Ğ·Ğ¾Ğ²Ñ– Ñ„Ñ€Ğ°Ğ·Ğ¸, Ğ¿Ñ€Ğ¾ÑÑ‚Ğµ ÑĞ¿Ñ–Ğ»ĞºÑƒĞ²Ğ°Ğ½Ğ½Ñ |\n| **A2** | Ğ£ÑÑ– 7 Ğ²Ñ–Ğ´Ğ¼Ñ–Ğ½ĞºÑ–Ğ², Ğ¼Ğ¸Ğ½ÑƒĞ»Ğ¸Ğ¹ Ñ‚Ğ° Ğ¼Ğ°Ğ¹Ğ±ÑƒÑ‚Ğ½Ñ–Ğ¹ Ñ‡Ğ°Ñ |\n| **B1** | Ğ’Ğ¸Ğ´ Ğ´Ñ–Ñ”ÑĞ»Ğ¾Ğ²Ğ°, Ğ´Ñ–Ñ”ÑĞ»Ğ¾Ğ²Ğ° Ñ€ÑƒÑ…Ñƒ, ÑĞºĞ»Ğ°Ğ´Ğ½Ñ– Ñ€ĞµÑ‡ĞµĞ½Ğ½Ñ, Ğ´Ñ–Ñ”Ğ¿Ñ€Ğ¸ĞºĞ¼ĞµÑ‚Ğ½Ğ¸ĞºĞ¸ |\n\n---\n\n## Ğ’Ğ°ÑˆÑ– Ğ´Ğ¾ÑÑĞ³Ğ½ĞµĞ½Ğ½Ñ\n\nĞĞ° Ñ€Ñ–Ğ²Ğ½Ñ– B1 Ğ²Ğ¸ Ğ²Ğ¸Ğ²Ñ‡Ğ¸Ğ»Ğ¸:\n\n- **~1,800 Ğ½Ğ¾Ğ²Ğ¸Ñ… ÑĞ»Ñ–Ğ²** (Ğ·Ğ°Ğ³Ğ°Ğ»Ğ¾Ğ¼ ~3,500)\n- **Ğ’Ğ¸Ğ´ Ğ´Ñ–Ñ”ÑĞ»Ğ¾Ğ²Ğ°** Ñƒ Ğ²ÑÑ–Ñ… ĞºĞ¾Ğ½Ñ‚ĞµĞºÑÑ‚Ğ°Ñ…\n- **Ğ”Ñ–Ñ”ÑĞ»Ğ¾Ğ²Ğ° Ñ€ÑƒÑ…Ñƒ** Ğ· ÑƒÑÑ–Ğ¼Ğ° Ğ¿Ñ€ĞµÑ„Ñ–ĞºÑĞ°Ğ¼Ğ¸\n- **Ğ¡ĞºĞ»Ğ°Ğ´Ğ½Ñ– Ñ€ĞµÑ‡ĞµĞ½Ğ½Ñ** Ğ²ÑÑ–Ñ… Ñ‚Ğ¸Ğ¿Ñ–Ğ²\n- **Ğ”Ñ–Ñ”Ğ¿Ñ€Ğ¸ĞºĞ¼ĞµÑ‚Ğ½Ğ¸ĞºĞ¸** Ñ‚Ğ° Ğ¿Ğ°ÑĞ¸Ğ²Ğ½Ñ– ĞºĞ¾Ğ½ÑÑ‚Ñ€ÑƒĞºÑ†Ñ–Ñ—\n- **ĞšÑƒĞ»ÑŒÑ‚ÑƒÑ€Ñƒ** ÑÑƒÑ‡Ğ°ÑĞ½Ğ¾Ñ— Ğ£ĞºÑ€Ğ°Ñ—Ğ½Ğ¸\n\n---\n\n## ĞĞ°ÑÑ‚ÑƒĞ¿Ğ½Ğ¸Ğ¹ ĞºÑ€Ğ¾Ğº: Ğ Ñ–Ğ²ĞµĞ½ÑŒ B2\n\nĞĞ° Ñ€Ñ–Ğ²Ğ½Ñ– B2 Ğ²Ğ¸ Ğ±ÑƒĞ´ĞµÑ‚Ğµ:\n\n| ĞÑĞ¿ĞµĞºÑ‚ | Ğ—Ğ¼Ñ–ÑÑ‚ |\n|--------|-------|\n| **Ğ›ĞµĞºÑĞ¸ĞºĞ°** | +2,640 Ğ½Ğ¾Ğ²Ğ¸Ñ… ÑĞ»Ñ–Ğ² |\n| **Ğ“Ñ€Ğ°Ğ¼Ğ°Ñ‚Ğ¸ĞºĞ°** | Ğ£Ğ´Ğ¾ÑĞºĞ¾Ğ½Ğ°Ğ»ĞµĞ½Ğ½Ñ ÑÑ‚Ğ¸Ğ»Ñ, ÑĞºĞ»Ğ°Ğ´Ğ½Ñ– ÑÑ‚Ñ€ÑƒĞºÑ‚ÑƒÑ€Ğ¸ |\n| **Ğ§Ğ¸Ñ‚Ğ°Ğ½Ğ½Ñ** | Ğ›Ñ–Ñ‚ĞµÑ€Ğ°Ñ‚ÑƒÑ€Ğ°, Ğ°ĞºĞ°Ğ´ĞµĞ¼Ñ–Ñ‡Ğ½Ñ– Ñ‚ĞµĞºÑÑ‚Ğ¸ |\n| **ĞšÑƒĞ»ÑŒÑ‚ÑƒÑ€Ğ°** | Ğ†ÑÑ‚Ğ¾Ñ€Ñ–Ñ Ğ£ĞºÑ€Ğ°Ñ—Ğ½Ğ¸, Ğ±Ñ–Ğ¾Ğ³Ñ€Ğ°Ñ„Ñ–Ñ— Ğ²Ğ¸Ğ´Ğ°Ñ‚Ğ½Ğ¸Ñ… Ğ¿Ğ¾ÑÑ‚Ğ°Ñ‚ĞµĞ¹ |\n\n> ğŸŒ **Ğ ĞµĞºĞ¾Ğ¼ĞµĞ½Ğ´Ğ°Ñ†Ñ–Ñ**\n> ĞŸĞµÑ€ĞµĞ´ Ğ¿Ğ¾Ñ‡Ğ°Ñ‚ĞºĞ¾Ğ¼ B2 Ğ¿Ñ€Ğ¾Ğ´Ğ¾Ğ²Ğ¶ÑƒĞ¹Ñ‚Ğµ Ğ¿Ñ€Ğ°ĞºÑ‚Ğ¸ĞºÑƒ: Ñ‡Ğ¸Ñ‚Ğ°Ğ¹Ñ‚Ğµ ÑƒĞºÑ€Ğ°Ñ—Ğ½ÑÑŒĞºÑ– Ğ½Ğ¾Ğ²Ğ¸Ğ½Ğ¸ Ñ‰Ğ¾Ğ´Ğ½Ñ, ÑĞ»ÑƒÑ…Ğ°Ğ¹Ñ‚Ğµ Ğ¿Ğ¾Ğ´ĞºĞ°ÑÑ‚Ğ¸, ÑĞ¿Ñ–Ğ»ĞºÑƒĞ¹Ñ‚ĞµÑÑ ÑƒĞºÑ€Ğ°Ñ—Ğ½ÑÑŒĞºĞ¾Ñ.\n\n---\n\n## Ğ¡Ğ»Ğ¾Ğ²Ğ° Ğ¿Ñ–Ğ´Ñ‚Ñ€Ğ¸Ğ¼ĞºĞ¸\n\nĞ’Ğ¸ Ğ´Ğ¾ÑÑĞ³Ğ»Ğ¸ Ñ€Ñ–Ğ²Ğ½Ñ, ĞºĞ¾Ğ»Ğ¸ Ğ¼Ğ¾Ğ¶ĞµÑ‚Ğµ:\n\n- Ğ¡Ğ¿Ñ€Ğ°Ğ²Ğ»ÑÑ‚Ğ¸ÑÑ Ğ· Ğ±Ñ–Ğ»ÑŒÑˆÑ–ÑÑ‚Ñ ÑĞ¸Ñ‚ÑƒĞ°Ñ†Ñ–Ğ¹ Ğ¿Ñ–Ğ´ Ñ‡Ğ°Ñ Ğ¿Ğ¾Ğ´Ğ¾Ñ€Ğ¾Ğ¶Ñ– Ğ£ĞºÑ€Ğ°Ñ—Ğ½Ğ¾Ñ\n- Ğ Ğ¾Ğ·ÑƒĞ¼Ñ–Ñ‚Ğ¸ Ğ³Ğ¾Ğ»Ğ¾Ğ²Ğ½Ğ¸Ğ¹ Ğ·Ğ¼Ñ–ÑÑ‚ Ğ½Ğ¾Ğ²Ğ¸Ğ½ Ñ‚Ğ° Ğ¿Ğ¾Ğ´ĞºĞ°ÑÑ‚Ñ–Ğ²\n- ĞŸĞ¸ÑĞ°Ñ‚Ğ¸ ĞµÑĞµ Ñ‚Ğ° Ğ»Ğ¸ÑÑ‚Ğ¸ ÑƒĞºÑ€Ğ°Ñ—Ğ½ÑÑŒĞºĞ¾Ñ\n- ĞĞ±Ğ³Ğ¾Ğ²Ğ¾Ñ€ÑĞ²Ğ°Ñ‚Ğ¸ Ğ·Ğ½Ğ°Ğ¹Ğ¾Ğ¼Ñ– Ñ‚ĞµĞ¼Ğ¸ Ğ· Ğ½Ğ¾ÑÑ–ÑĞ¼Ğ¸ Ğ¼Ğ¾Ğ²Ğ¸\n\n**Ğ¦Ğµ Ğ·Ğ½Ğ°Ñ‡Ğ½Ğµ Ğ´Ğ¾ÑÑĞ³Ğ½ĞµĞ½Ğ½Ñ!** Ğ£ĞºÑ€Ğ°Ñ—Ğ½ÑÑŒĞºĞ° Ğ¼Ğ¾Ğ²Ğ° â€” Ğ¾Ğ´Ğ½Ğ° Ğ· Ğ½Ğ°Ğ¹ÑĞºĞ»Ğ°Ğ´Ğ½Ñ–ÑˆĞ¸Ñ… ÑĞ»Ğ¾Ğ²'ÑĞ½ÑÑŒĞºĞ¸Ñ… Ğ¼Ğ¾Ğ², Ñ– Ğ²Ğ¸ Ğ¿Ñ€Ğ¾Ğ¹ÑˆĞ»Ğ¸ Ğ´Ğ¾Ğ²Ğ³Ğ¸Ğ¹ ÑˆĞ»ÑÑ… Ğ²Ñ–Ğ´ ĞºĞ¸Ñ€Ğ¸Ğ»Ğ¸Ñ†Ñ– Ğ´Ğ¾ ÑĞºĞ»Ğ°Ğ´Ğ½Ğ¸Ñ… Ğ³Ñ€Ğ°Ğ¼Ğ°Ñ‚Ğ¸Ñ‡Ğ½Ğ¸Ñ… ÑÑ‚Ñ€ÑƒĞºÑ‚ÑƒÑ€.\n\nĞŸÑ€Ğ¾Ğ´Ğ¾Ğ²Ğ¶ÑƒĞ¹Ñ‚Ğµ Ğ²Ğ¸Ğ²Ñ‡Ğ°Ñ‚Ğ¸ ÑƒĞºÑ€Ğ°Ñ—Ğ½ÑÑŒĞºÑƒ Ğ· Ñ‚Ñ–Ñ”Ñ ÑĞ°Ğ¼Ğ¾Ñ Ğ½Ğ°Ğ¿Ğ¾Ğ»ĞµĞ³Ğ»Ğ¸Ğ²Ñ–ÑÑ‚Ñ, Ñ– Ñ€Ñ–Ğ²ĞµĞ½ÑŒ B2 Ğ½Ğµ Ğ·Ğ´Ğ°ÑÑ‚ÑŒÑÑ Ğ²Ğ°Ğ¼ ÑĞºĞ»Ğ°Ğ´Ğ½Ğ¸Ğ¼.\n\n**Ğ”Ğ¾ Ğ·ÑƒÑÑ‚Ñ€Ñ–Ñ‡Ñ– Ğ½Ğ° Ñ€Ñ–Ğ²Ğ½Ñ– B2!** ğŸ‡ºğŸ‡¦\n\n---\n\n## Ğ”Ğ¾Ğ´Ğ°Ñ‚ĞºĞ¾Ğ²Ñ– Ñ€ĞµÑÑƒÑ€ÑĞ¸\n\nĞ©Ğ¾Ğ± Ğ·Ğ°ĞºÑ€Ñ–Ğ¿Ğ¸Ñ‚Ğ¸ Ğ·Ğ½Ğ°Ğ½Ğ½Ñ Ñ€Ñ–Ğ²Ğ½Ñ B1 Ñ‚Ğ° Ğ¿Ñ–Ğ´Ğ³Ğ¾Ñ‚ÑƒĞ²Ğ°Ñ‚Ğ¸ÑÑ Ğ´Ğ¾ B2, Ñ€ĞµĞºĞ¾Ğ¼ĞµĞ½Ğ´ÑƒÑ”Ğ¼Ğ¾ Ğ²Ğ¸ĞºĞ¾Ñ€Ğ¸ÑÑ‚Ğ¾Ğ²ÑƒĞ²Ğ°Ñ‚Ğ¸ Ñ†Ñ– Ñ€ĞµÑÑƒÑ€ÑĞ¸ Ğ´Ğ»Ñ ÑĞ°Ğ¼Ğ¾ÑÑ‚Ñ–Ğ¹Ğ½Ğ¾Ğ³Ğ¾ Ğ½Ğ°Ğ²Ñ‡Ğ°Ğ½Ğ½Ñ Ñ‚Ğ° Ğ¿Ñ€Ğ°ĞºÑ‚Ğ¸ĞºĞ¸.\n\n> [!resources]\n> **ĞŸĞ¾Ğ´ĞºĞ°ÑÑ‚Ğ¸ Ğ´Ğ»Ñ Ğ¿Ñ€Ğ°ĞºÑ‚Ğ¸ĞºĞ¸:**\n> - [ĞšĞ½Ğ¸Ğ¶ĞºĞ¾Ğ²Ğ¸Ğ¹ ĞÑ€ÑĞµĞ½Ğ°Ğ»](https://bookforum.ua/podcast/) â€” Ğ¿Ñ€Ğ¾ ĞºĞ½Ğ¸Ğ³Ğ¸ Ñ‚Ğ° ĞºÑƒĞ»ÑŒÑ‚ÑƒÑ€Ñƒ\n> - [Ğ Ğ¾Ğ·Ğ¼Ğ¾Ğ²Ğ°.ĞœĞµĞ´Ñ–Ğ°](https://rozmova.media/) â€” Ñ–Ğ½Ñ‚ĞµÑ€Ğ²'Ñ Ğ· Ñ†Ñ–ĞºĞ°Ğ²Ğ¸Ğ¼Ğ¸ Ğ»ÑĞ´ÑŒĞ¼Ğ¸\n> - [Ğ¡ÑƒÑĞ¿Ñ–Ğ»ÑŒĞ½Ğµ Ğ Ğ°Ğ´Ñ–Ğ¾](https://suspilne.media/radio/) â€” Ğ½Ğ¾Ğ²Ğ¸Ğ½Ğ¸ Ñ‚Ğ° Ğ°Ğ½Ğ°Ğ»Ñ–Ñ‚Ğ¸ĞºĞ°\n> - [Ukrainian Lessons Podcast](https://www.ukrainianlessons.com/category/podcast/) â€” ÑƒÑ€Ğ¾ĞºĞ¸ Ğ´Ğ»Ñ Ğ²Ğ¸Ğ²Ñ‡ĞµĞ½Ğ½Ñ Ğ¼Ğ¾Ğ²Ğ¸\n\n---"
      },
      {
        "id": "section-3",
        "name": "Ğ’Ğ¿Ñ€Ğ°Ğ²Ğ¸",
        "nameEn": null,
        "type": "activities",
        "content": "---\n\n## quiz: ĞŸÑ–Ğ´ÑÑƒĞ¼ĞºĞ¾Ğ²Ğ¸Ğ¹ Ñ‚ĞµÑÑ‚ Ğ½Ğ° Ñ€Ğ¾Ğ·ÑƒĞ¼Ñ–Ğ½Ğ½Ñ Ñ‚ĞµĞºÑÑ‚Ñƒ\n\n> ĞŸÑ€Ğ¾Ñ‡Ğ¸Ñ‚Ğ°Ğ¹Ñ‚Ğµ Ñ‚ĞµĞºÑÑ‚ Ğ¿Ñ€Ğ¾ Ğ†Ğ¢-Ğ³Ğ°Ğ»ÑƒĞ·ÑŒ Ñ‰Ğµ Ñ€Ğ°Ğ· Ñ‚Ğ° Ğ¾Ğ±ĞµÑ€Ñ–Ñ‚ÑŒ Ğ¿Ñ€Ğ°Ğ²Ğ¸Ğ»ÑŒĞ½Ñƒ Ğ²Ñ–Ğ´Ğ¿Ğ¾Ğ²Ñ–Ğ´ÑŒ Ğ½Ğ° ĞºĞ¾Ğ¶Ğ½Ğµ Ğ·Ğ°Ğ¿Ğ¸Ñ‚Ğ°Ğ½Ğ½Ñ.\n\n1. Ğ—Ğ³Ñ–Ğ´Ğ½Ğ¾ Ğ· Ñ‚ĞµĞºÑÑ‚Ğ¾Ğ¼, ÑĞºÑ–Ğ»ÑŒĞºĞ¸ Ğ†Ğ¢-ÑĞ¿ĞµÑ†Ñ–Ğ°Ğ»Ñ–ÑÑ‚Ñ–Ğ² Ğ¿Ñ€Ğ°Ñ†ÑĞ²Ğ°Ğ»Ğ¾ Ğ² Ğ£ĞºÑ€Ğ°Ñ—Ğ½Ñ– Ğ´ĞµÑÑÑ‚ÑŒ Ñ€Ğ¾ĞºÑ–Ğ² Ñ‚Ğ¾Ğ¼Ñƒ, Ğ´Ğ¾ ÑÑ‚Ñ€Ñ–Ğ¼ĞºĞ¾Ğ³Ğ¾ Ğ·Ñ€Ğ¾ÑÑ‚Ğ°Ğ½Ğ½Ñ Ğ³Ğ°Ğ»ÑƒĞ·Ñ–?\n   - [ ] Ğ¢Ñ€Ğ¸ÑÑ‚Ğ° Ñ‚Ğ¸ÑÑÑ‡\n   - [x] ĞŸ'ÑÑ‚Ğ´ĞµÑÑÑ‚ Ñ‚Ğ¸ÑÑÑ‡\n   - [ ] Ğ¡Ñ‚Ğ¾ Ñ‚Ğ¸ÑÑÑ‡\n   - [ ] Ğ”Ğ²Ñ–ÑÑ‚Ñ– Ñ‚Ğ¸ÑÑÑ‡\n   > Ğ¢ĞµĞºÑÑ‚ Ñ‡Ñ–Ñ‚ĞºĞ¾ Ğ²ĞºĞ°Ğ·ÑƒÑ”, Ñ‰Ğ¾ ĞºÑ–Ğ»ÑŒĞºÑ–ÑÑ‚ÑŒ Ğ·Ñ€Ğ¾ÑĞ»Ğ° Â«Ğ· Ğ¿'ÑÑ‚Ğ´ĞµÑÑÑ‚Ğ¸ Ñ‚Ğ¸ÑÑÑ‡ Ğ´Ğ¾ Ğ¿Ğ¾Ğ½Ğ°Ğ´ Ñ‚Ñ€ÑŒĞ¾Ñ…ÑĞ¾Ñ‚ Ñ‚Ğ¸ÑÑÑ‡Â».\n\n2. Ğ¯ĞºÑ– Ñ‚Ñ€Ğ¸ Ñ„Ğ°ĞºÑ‚Ğ¾Ñ€Ğ¸ Ğ¿Ğ¾ÑÑĞ½ÑÑÑ‚ÑŒ Ñ€Ğ¾Ğ·Ğ²Ğ¸Ñ‚Ğ¾Ğº ÑƒĞºÑ€Ğ°Ñ—Ğ½ÑÑŒĞºĞ¾Ñ— Ğ†Ğ¢-Ğ³Ğ°Ğ»ÑƒĞ·Ñ– Ğ·Ğ³Ñ–Ğ´Ğ½Ğ¾ Ğ· Ñ‚ĞµĞºÑÑ‚Ğ¾Ğ¼ Ğ¿Ñ€Ğ¾ Ñ‚ĞµÑ…Ğ½Ğ¾Ğ»Ğ¾Ğ³Ñ–Ñ‡Ğ½Ğ¸Ğ¹ ÑĞµĞºÑ‚Ğ¾Ñ€ ĞºÑ€Ğ°Ñ—Ğ½Ğ¸?\n   - [ ] Ğ”ĞµÑ€Ğ¶Ğ°Ğ²Ğ½Ñ– ÑÑƒĞ±ÑĞ¸Ğ´Ñ–Ñ—, Ğ½Ğ¸Ğ·ÑŒĞºÑ– Ğ¿Ğ¾Ğ´Ğ°Ñ‚ĞºĞ¸, Ğ²ĞµĞ»Ğ¸ĞºĞµ Ğ½Ğ°ÑĞµĞ»ĞµĞ½Ğ½Ñ\n   - [x] Ğ¡Ğ¸Ğ»ÑŒĞ½Ğ° Ñ‚ĞµÑ…Ğ½Ñ–Ñ‡Ğ½Ğ° Ğ¾ÑĞ²Ñ–Ñ‚Ğ°, Ğ½Ğ¸Ğ¶Ñ‡Ñ– Ğ·Ğ°Ñ€Ğ¿Ğ»Ğ°Ñ‚Ğ¸, Ğ²Ğ¸ÑĞ¾ĞºĞ° Ğ¼Ğ¾Ñ‚Ğ¸Ğ²Ğ°Ñ†Ñ–Ñ Ğ¼Ğ¾Ğ»Ğ¾Ğ´Ñ–\n   - [ ] ĞĞ½Ğ³Ğ»Ñ–Ğ¹ÑÑŒĞºĞ° Ğ¼Ğ¾Ğ²Ğ°, Ğ³ĞµĞ¾Ğ³Ñ€Ğ°Ñ„Ñ–Ñ, ĞºĞ»Ñ–Ğ¼Ğ°Ñ‚\n   - [ ] Ğ”ĞµÑˆĞµĞ²Ğ° ĞµĞ»ĞµĞºÑ‚Ñ€Ğ¾ĞµĞ½ĞµÑ€Ğ³Ñ–Ñ, ÑˆĞ²Ğ¸Ğ´ĞºĞ¸Ğ¹ Ñ–Ğ½Ñ‚ĞµÑ€Ğ½ĞµÑ‚, ÑĞ¿Ñ€Ğ¸ÑÑ‚Ğ»Ğ¸Ğ²Ğµ Ğ·Ğ°ĞºĞ¾Ğ½Ğ¾Ğ´Ğ°Ğ²ÑÑ‚Ğ²Ğ¾\n   > ĞĞ²Ñ‚Ğ¾Ñ€ Ğ½Ğ°Ğ·Ğ¸Ğ²Ğ°Ñ” ÑĞ°Ğ¼Ğµ Ñ†Ñ– Ñ‚Ñ€Ğ¸ Ğ¿Ñ€Ğ¸Ñ‡Ğ¸Ğ½Ğ¸: Ğ¾ÑĞ²Ñ–Ñ‚Ñƒ, Ğ·Ğ°Ñ€Ğ¿Ğ»Ğ°Ñ‚Ğ¸ Ñ‚Ğ° Ğ¼Ğ¾Ñ‚Ğ¸Ğ²Ğ°Ñ†Ñ–Ñ.\n\n3. Ğ£ ÑĞºĞ¸Ñ… ÑĞ°Ğ¼Ğµ Ğ¼Ñ–ÑÑ‚Ğ°Ñ… Ğ£ĞºÑ€Ğ°Ñ—Ğ½Ğ¸, Ğ·Ğ³Ñ–Ğ´Ğ½Ğ¾ Ğ· Ñ‚ĞµĞºÑÑ‚Ğ¾Ğ¼, Ñ€Ğ¾Ğ·Ñ‚Ğ°ÑˆĞ¾Ğ²Ğ°Ğ½Ñ– Ğ¾Ñ„Ñ–ÑĞ¸ Ğ½Ğ°Ğ¹Ğ±Ñ–Ğ»ÑŒÑˆĞ¸Ñ… Ğ†Ğ¢-ĞºĞ¾Ğ¼Ğ¿Ğ°Ğ½Ñ–Ğ¹?\n   - [x] ĞšĞ¸Ñ—Ğ², Ğ›ÑŒĞ²Ñ–Ğ², Ğ¥Ğ°Ñ€ĞºÑ–Ğ², ĞĞ´ĞµÑĞ°, Ğ”Ğ½Ñ–Ğ¿Ñ€Ğ¾\n   - [ ] Ğ¢Ñ–Ğ»ÑŒĞºĞ¸ ĞšĞ¸Ñ—Ğ² Ñ‚Ğ° Ğ›ÑŒĞ²Ñ–Ğ²\n   - [ ] ĞšĞ¸Ñ—Ğ², Ğ¥Ğ°Ñ€ĞºÑ–Ğ², Ğ—Ğ°Ğ¿Ğ¾Ñ€Ñ–Ğ¶Ğ¶Ñ\n   - [ ] Ğ›ÑŒĞ²Ñ–Ğ², ĞĞ´ĞµÑĞ°, Ğ’Ñ–Ğ½Ğ½Ğ¸Ñ†Ñ\n   > Ğ¢ĞµĞºÑÑ‚ Ğ¿ĞµÑ€ĞµĞ»Ñ–Ñ‡ÑƒÑ”: Â«ĞšĞ¸Ñ”Ğ²Ñ–, Ğ›ÑŒĞ²Ğ¾Ğ²Ñ–, Ğ¥Ğ°Ñ€ĞºĞ¾Ğ²Ñ–, ĞĞ´ĞµÑÑ– Ñ‚Ğ° Ğ”Ğ½Ñ–Ğ¿Ñ€Ñ–Â».\n\n4. ĞšĞ¾Ğ»Ğ¸ Ğ±ÑƒĞ»Ğ° Ğ·Ğ°ÑĞ½Ğ¾Ğ²Ğ°Ğ½Ğ° ĞºĞ¾Ğ¼Ğ¿Ğ°Ğ½Ñ–Ñ Grammarly, ÑĞºĞ° Ğ´Ğ¾Ğ¿Ğ¾Ğ¼Ğ°Ğ³Ğ°Ñ” Ğ¼Ñ–Ğ»ÑŒĞ¹Ğ¾Ğ½Ğ°Ğ¼ Ğ»ÑĞ´ĞµĞ¹ Ğ¿Ğ¸ÑĞ°Ñ‚Ğ¸ Ğ°Ğ½Ğ³Ğ»Ñ–Ğ¹ÑÑŒĞºĞ¾Ñ Ğ±ĞµĞ· Ğ¿Ğ¾Ğ¼Ğ¸Ğ»Ğ¾Ğº?\n   - [ ] 2005 Ñ€Ğ¾Ñ†Ñ–\n   - [x] 2009 Ñ€Ğ¾Ñ†Ñ–\n   - [ ] 2012 Ñ€Ğ¾Ñ†Ñ–\n   - [ ] 2015 Ñ€Ğ¾Ñ†Ñ–\n   > Â«Grammarly, Ğ·Ğ°ÑĞ½Ğ¾Ğ²Ğ°Ğ½Ğ° Ñƒ ĞšĞ¸Ñ”Ğ²Ñ– Ñƒ 2009 Ñ€Ğ¾Ñ†Ñ–Â».\n\n5. Ğ¯Ğº Ğ½Ğ°Ğ·Ğ¸Ğ²Ğ°Ñ”Ñ‚ÑŒÑÑ ÑƒĞºÑ€Ğ°Ñ—Ğ½ÑÑŒĞºĞ¸Ğ¹ ÑÑ‚Ğ°Ñ€Ñ‚Ğ°Ğ¿, ÑĞºĞ¸Ğ¹ ÑÑ‚Ğ²Ğ¾Ñ€ÑÑ” Ğ¿Ğ¾Ğ¿ÑƒĞ»ÑÑ€Ğ½Ğµ Ğ¿Ñ€Ğ¾Ğ³Ñ€Ğ°Ğ¼Ğ½Ğµ Ğ·Ğ°Ğ±ĞµĞ·Ğ¿ĞµÑ‡ĞµĞ½Ğ½Ñ ÑĞ°Ğ¼Ğµ Ğ´Ğ»Ñ ĞºĞ¾Ğ¼Ğ¿'ÑÑ‚ĞµÑ€Ñ–Ğ² Mac?\n   - [ ] Grammarly\n   - [ ] GitLab\n   - [x] MacPaw\n   - [ ] SoftServe\n   > Â«MacPaw Ñ–Ğ· ĞšĞ¸Ñ”Ğ²Ğ° ÑÑ‚Ğ²Ğ¾Ñ€ÑÑ” Ğ¿Ğ¾Ğ¿ÑƒĞ»ÑÑ€Ğ½Ğµ Ğ¿Ñ€Ğ¾Ğ³Ñ€Ğ°Ğ¼Ğ½Ğµ Ğ·Ğ°Ğ±ĞµĞ·Ğ¿ĞµÑ‡ĞµĞ½Ğ½Ñ Ğ´Ğ»Ñ MacÂ».\n\n6. Ğ¯ĞºĞµ ÑÑ‚Ğ°Ğ²Ğ»ĞµĞ½Ğ½Ñ Ğ°Ğ²Ñ‚Ğ¾Ñ€Ğ° ÑÑ‚Ğ°Ñ‚Ñ‚Ñ– Ğ´Ğ¾ Ğ¼Ğ°Ğ¹Ğ±ÑƒÑ‚Ğ½ÑŒĞ¾Ğ³Ğ¾ ÑƒĞºÑ€Ğ°Ñ—Ğ½ÑÑŒĞºĞ¾Ñ— Ğ†Ğ¢-Ğ³Ğ°Ğ»ÑƒĞ·Ñ– Ğ¿Ñ–ÑĞ»Ñ Ğ²Ñ–Ğ¹Ğ½Ğ¸ Ñ‚Ğ° Ğ²ÑÑ–Ñ… Ğ²Ğ¸Ğ¿Ñ€Ğ¾Ğ±ÑƒĞ²Ğ°Ğ½ÑŒ?\n   - [ ] ĞŸĞµÑĞ¸Ğ¼Ñ–ÑÑ‚Ğ¸Ñ‡Ğ½Ğµ â€” Ğ°Ğ²Ñ‚Ğ¾Ñ€ Ğ²Ğ²Ğ°Ğ¶Ğ°Ñ”, Ñ‰Ğ¾ Ğ³Ğ°Ğ»ÑƒĞ·ÑŒ Ğ·Ğ°Ğ½ĞµĞ¿Ğ°Ğ´Ğ°Ñ”\n   - [ ] ĞĞµĞ¹Ñ‚Ñ€Ğ°Ğ»ÑŒĞ½Ğµ â€” Ğ°Ğ²Ñ‚Ğ¾Ñ€ Ğ½Ğµ Ğ²Ğ¸ÑĞ»Ğ¾Ğ²Ğ»ÑÑ” Ğ´ÑƒĞ¼ĞºĞ¸\n   - [x] ĞĞ¿Ñ‚Ğ¸Ğ¼Ñ–ÑÑ‚Ğ¸Ñ‡Ğ½Ğµ â€” Ğ°Ğ²Ñ‚Ğ¾Ñ€ Ğ²Ğ²Ğ°Ğ¶Ğ°Ñ” Ğ¼Ğ°Ğ¹Ğ±ÑƒÑ‚Ğ½Ñ” Ğ¿ĞµÑ€ÑĞ¿ĞµĞºÑ‚Ğ¸Ğ²Ğ½Ğ¸Ğ¼\n   - [ ] ĞĞµĞ²Ğ¸Ğ·Ğ½Ğ°Ñ‡ĞµĞ½Ğµ â€” Ğ°Ğ²Ñ‚Ğ¾Ñ€ Ğ½Ğµ Ğ·Ğ½Ğ°Ñ”, Ñ‰Ğ¾ Ğ±ÑƒĞ´Ğµ\n   > Â«ĞœĞ°Ğ¹Ğ±ÑƒÑ‚Ğ½Ñ” ÑƒĞºÑ€Ğ°Ñ—Ğ½ÑÑŒĞºĞ¾Ñ— Ğ†Ğ¢-Ğ³Ğ°Ğ»ÑƒĞ·Ñ– Ğ·Ğ°Ğ»Ğ¸ÑˆĞ°Ñ”Ñ‚ÑŒÑÑ Ğ¿ĞµÑ€ÑĞ¿ĞµĞºÑ‚Ğ¸Ğ²Ğ½Ğ¸Ğ¼Â».\n\n7. Ğ©Ğ¾ Ğ¾Ğ·Ğ½Ğ°Ñ‡Ğ°Ñ” ÑĞ»Ğ¾Ğ²Ğ¾ Â«ÑÑ‚Ñ–Ğ¹ĞºÑ–ÑÑ‚ÑŒÂ» Ñƒ ĞºĞ¾Ğ½Ñ‚ĞµĞºÑÑ‚Ñ– Ñ€ĞµĞ°ĞºÑ†Ñ–Ñ— Ğ†Ğ¢-Ñ–Ğ½Ğ´ÑƒÑÑ‚Ñ€Ñ–Ñ— Ğ½Ğ° Ğ²Ğ¸ĞºĞ»Ğ¸ĞºĞ¸, ÑĞ¿Ñ€Ğ¸Ñ‡Ğ¸Ğ½ĞµĞ½Ñ– Ğ²Ñ–Ğ¹Ğ½Ğ¾Ñ 2022 Ñ€Ğ¾ĞºÑƒ?\n   - [ ] Ğ—Ğ´Ğ°Ñ‚Ğ½Ñ–ÑÑ‚ÑŒ ÑˆĞ²Ğ¸Ğ´ĞºĞ¾ Ñ€Ğ¾ÑÑ‚Ğ¸\n   - [ ] Ğ—Ğ´Ğ°Ñ‚Ğ½Ñ–ÑÑ‚ÑŒ Ğ·Ğ°Ñ€Ğ¾Ğ±Ğ»ÑÑ‚Ğ¸ Ğ³Ñ€Ğ¾ÑˆÑ–\n   - [x] Ğ—Ğ´Ğ°Ñ‚Ğ½Ñ–ÑÑ‚ÑŒ Ğ²Ğ¸Ñ‚Ñ€Ğ¸Ğ¼ÑƒĞ²Ğ°Ñ‚Ğ¸ Ñ‚Ñ€ÑƒĞ´Ğ½Ğ¾Ñ‰Ñ– Ñ‚Ğ° Ğ¿Ñ€Ğ¾Ğ´Ğ¾Ğ²Ğ¶ÑƒĞ²Ğ°Ñ‚Ğ¸ Ñ€Ğ¾Ğ±Ğ¾Ñ‚Ñƒ\n   - [ ] Ğ—Ğ´Ğ°Ñ‚Ğ½Ñ–ÑÑ‚ÑŒ ÑÑ‚Ğ²Ğ¾Ñ€ÑĞ²Ğ°Ñ‚Ğ¸ Ğ½Ğ¾Ğ²Ñ– Ğ¿Ñ€Ğ¾Ğ´ÑƒĞºÑ‚Ğ¸\n   > ĞšĞ¾Ğ½Ñ‚ĞµĞºÑÑ‚ Ğ¿Ğ¾ĞºĞ°Ğ·ÑƒÑ”, Ñ‰Ğ¾ ĞºĞ¾Ğ¼Ğ¿Ğ°Ğ½Ñ–Ñ— Ğ¿Ñ€Ğ¾Ğ´Ğ¾Ğ²Ğ¶Ğ¸Ğ»Ğ¸ Ñ€Ğ¾Ğ±Ğ¾Ñ‚Ñƒ Ğ¿Ğ¾Ğ¿Ñ€Ğ¸ Ñ‚Ñ€ÑƒĞ´Ğ½Ğ¾Ñ‰Ñ–.\n\n8. Ğ¥Ñ‚Ğ¾ Ñ” Ğ·Ğ°ÑĞ½Ğ¾Ğ²Ğ½Ğ¸ĞºĞ¾Ğ¼ Ğ¿Ğ»Ğ°Ñ‚Ñ„Ğ¾Ñ€Ğ¼Ğ¸ GitLab, ÑĞºĞ° Ğ²Ğ¸ĞºĞ¾Ñ€Ğ¸ÑÑ‚Ğ¾Ğ²ÑƒÑ”Ñ‚ÑŒÑÑ Ğ¼Ñ–Ğ»ÑŒĞ¹Ğ¾Ğ½Ğ°Ğ¼Ğ¸ Ñ€Ğ¾Ğ·Ñ€Ğ¾Ğ±Ğ½Ğ¸ĞºÑ–Ğ² Ñƒ Ğ²ÑÑŒĞ¾Ğ¼Ñƒ ÑĞ²Ñ–Ñ‚Ñ–?\n   - [ ] ĞšĞ¾Ğ¼Ğ°Ğ½Ğ´Ğ° Ğ· ĞšÑ€ĞµĞ¼Ğ½Ñ–Ñ”Ğ²Ğ¾Ñ— Ğ´Ğ¾Ğ»Ğ¸Ğ½Ğ¸\n   - [x] Ğ£ĞºÑ€Ğ°Ñ—Ğ½ÑÑŒĞºĞ¸Ğ¹ Ñ€Ğ¾Ğ·Ñ€Ğ¾Ğ±Ğ½Ğ¸Ğº Ğ”Ğ¼Ğ¸Ñ‚Ñ€Ğ¾ Ğ—Ğ°Ğ¿Ğ¾Ñ€Ğ¾Ğ¶ĞµÑ†ÑŒ\n   - [ ] Ğ‘Ñ€Ğ¸Ñ‚Ğ°Ğ½ÑÑŒĞºĞ° ĞºĞ¾Ğ¼Ğ¿Ğ°Ğ½Ñ–Ñ\n   - [ ] ĞšĞ¾Ğ¼Ğ°Ğ½Ğ´Ğ° Grammarly\n   > Â«GitLab, ÑÑ‚Ğ²Ğ¾Ñ€ĞµĞ½Ğ° ÑƒĞºÑ€Ğ°Ñ—Ğ½Ñ†ĞµĞ¼ Ğ”Ğ¼Ğ¸Ñ‚Ñ€Ğ¾Ğ¼ Ğ—Ğ°Ğ¿Ğ¾Ñ€Ğ¾Ğ¶Ñ†ĞµĞ¼Â».\n\n9. Ğ©Ğ¾ Ğ´ĞµĞ¼Ğ¾Ğ½ÑÑ‚Ñ€ÑƒÑÑ‚ÑŒ ÑƒĞºÑ€Ğ°Ñ—Ğ½ÑÑŒĞºÑ– Ğ†Ğ¢-Ñ„Ğ°Ñ…Ñ–Ğ²Ñ†Ñ–, Ğ¾ĞºÑ€Ñ–Ğ¼ Ğ²Ğ¸ÑĞ¾ĞºĞ¾Ñ— Ñ‚ĞµÑ…Ğ½Ñ–Ñ‡Ğ½Ğ¾Ñ— Ğ¼Ğ°Ğ¹ÑÑ‚ĞµÑ€Ğ½Ğ¾ÑÑ‚Ñ–, Ğ·Ğ³Ñ–Ğ´Ğ½Ğ¾ Ğ· Ğ²Ğ¸ÑĞ½Ğ¾Ğ²ĞºĞ°Ğ¼Ğ¸ Ğ°Ğ²Ñ‚Ğ¾Ñ€Ğ° ÑÑ‚Ğ°Ñ‚Ñ‚Ñ–?\n   - [ ] Ğ—Ğ½Ğ°Ğ½Ğ½Ñ Ñ–Ğ½Ğ¾Ğ·ĞµĞ¼Ğ½Ğ¸Ñ… Ğ¼Ğ¾Ğ²\n   - [ ] Ğ‘Ğ°Ğ¶Ğ°Ğ½Ğ½Ñ Ğ¿Ñ€Ğ°Ñ†ÑĞ²Ğ°Ñ‚Ğ¸ Ğ·Ğ° ĞºĞ¾Ñ€Ğ´Ğ¾Ğ½Ğ¾Ğ¼\n   - [x] Ğ—Ğ´Ğ°Ñ‚Ğ½Ñ–ÑÑ‚ÑŒ Ğ´Ğ¾Ğ»Ğ°Ñ‚Ğ¸ ÑĞºĞ»Ğ°Ğ´Ğ½Ğ¾Ñ‰Ñ–\n   - [ ] ĞšÑ€ĞµĞ°Ñ‚Ğ¸Ğ²Ğ½Ñ–ÑÑ‚ÑŒ Ñƒ Ğ´Ğ¸Ğ·Ğ°Ğ¹Ğ½Ñ–\n   > Â«Ğ´ĞµĞ¼Ğ¾Ğ½ÑÑ‚Ñ€ÑƒÑÑ‚ÑŒ Ğ½Ğµ Ğ»Ğ¸ÑˆĞµ Ñ‚ĞµÑ…Ğ½Ñ–Ñ‡Ğ½Ñƒ Ğ¼Ğ°Ğ¹ÑÑ‚ĞµÑ€Ğ½Ñ–ÑÑ‚ÑŒ, Ğ° Ğ¹ Ğ·Ğ´Ğ°Ñ‚Ğ½Ñ–ÑÑ‚ÑŒ Ğ´Ğ¾Ğ»Ğ°Ñ‚Ğ¸ ÑĞºĞ»Ğ°Ğ´Ğ½Ğ¾Ñ‰Ñ–Â».\n\n10. Ğ¯ĞºĞ° Ñ†Ğ¸Ñ‚Ğ°Ñ‚Ğ° Ğ°Ğ¹Ñ‚Ñ–ÑˆĞ½Ğ¸ĞºÑ–Ğ² Ğ·Ğ°Ğ²ĞµÑ€ÑˆÑƒÑ” ÑÑ‚Ğ°Ñ‚Ñ‚Ñ Ñ‚Ğ° Ğ´ĞµĞ¼Ğ¾Ğ½ÑÑ‚Ñ€ÑƒÑ” Ñ—Ñ…Ğ½Ñ Ğ½Ğ°Ğ¿Ğ¾Ğ»ĞµĞ³Ğ»Ğ¸Ğ²Ñ–ÑÑ‚ÑŒ Ñ– Ğ²Ğ¿ĞµĞ²Ğ½ĞµĞ½Ñ–ÑÑ‚ÑŒ Ñƒ Ğ¿ĞµÑ€ĞµĞ¼Ğ¾Ğ·Ñ–?\n    - [ ] Â«ĞœĞ¸ Ğ½Ğ°Ğ¹ĞºÑ€Ğ°Ñ‰Ñ– Ğ¿Ñ€Ğ¾Ğ³Ñ€Ğ°Ğ¼Ñ–ÑÑ‚Ğ¸ Ñƒ ÑĞ²Ñ–Ñ‚Ñ–Â»\n    - [ ] Â«Ğ¢ĞµÑ…Ğ½Ğ¾Ğ»Ğ¾Ğ³Ñ–Ñ— â€” Ñ†Ğµ Ğ¼Ğ°Ğ¹Ğ±ÑƒÑ‚Ğ½Ñ”Â»\n    - [x] Â«ĞœĞ¸ Ğ¿Ğ¸ÑĞ°Ğ»Ğ¸ ĞºĞ¾Ğ´ Ğ¿Ñ–Ğ´ Ğ¾Ğ±ÑÑ‚Ñ€Ñ–Ğ»Ğ°Ğ¼Ğ¸, Ñ– Ğ¼Ğ¸ Ğ±ÑƒĞ´ĞµĞ¼Ğ¾ Ğ¿Ğ¸ÑĞ°Ñ‚Ğ¸ Ğ¹Ğ¾Ğ³Ğ¾ Ğ¿Ñ–ÑĞ»Ñ Ğ¿ĞµÑ€ĞµĞ¼Ğ¾Ğ³Ğ¸Â»\n    - [ ] Â«Ğ£ĞºÑ€Ğ°Ñ—Ğ½Ğ° ÑÑ‚Ğ°Ğ½Ğµ Ñ‚ĞµÑ…Ğ½Ğ¾Ğ»Ğ¾Ğ³Ñ–Ñ‡Ğ½Ğ¸Ğ¼ Ğ»Ñ–Ğ´ĞµÑ€Ğ¾Ğ¼ Ğ„Ğ²Ñ€Ğ¾Ğ¿Ğ¸Â»\n    > Ğ¦Ğµ Ğ´Ğ¾ÑĞ»Ñ–Ğ²Ğ½Ğ° Ñ†Ğ¸Ñ‚Ğ°Ñ‚Ğ° Ğ· Ğ¾ÑÑ‚Ğ°Ğ½Ğ½ÑŒĞ¾Ğ³Ğ¾ Ğ°Ğ±Ğ·Ğ°Ñ†Ñƒ Ñ‚ĞµĞºÑÑ‚Ñƒ.\n\n---\n\n## fill-in: Ğ’Ğ¸Ğ´ Ğ´Ñ–Ñ”ÑĞ»Ğ¾Ğ²Ğ° Ñƒ ĞºĞ¾Ğ½Ñ‚ĞµĞºÑÑ‚Ñ–\n\n> ĞĞ±ĞµÑ€Ñ–Ñ‚ÑŒ Ğ¿Ñ€Ğ°Ğ²Ğ¸Ğ»ÑŒĞ½Ñƒ Ñ„Ğ¾Ñ€Ğ¼Ñƒ Ğ´Ñ–Ñ”ÑĞ»Ğ¾Ğ²Ğ° â€” Ğ´Ğ¾ĞºĞ¾Ğ½Ğ°Ğ½Ñƒ Ğ°Ğ±Ğ¾ Ğ½ĞµĞ´Ğ¾ĞºĞ¾Ğ½Ğ°Ğ½Ñƒ â€” Ğ·Ğ°Ğ»ĞµĞ¶Ğ½Ğ¾ Ğ²Ñ–Ğ´ ĞºĞ¾Ğ½Ñ‚ĞµĞºÑÑ‚Ñƒ Ñ€ĞµÑ‡ĞµĞ½Ğ½Ñ.\n\n1. Ğ’Ñ‡Ğ¾Ñ€Ğ° ÑƒĞ²ĞµÑ‡ĞµÑ€Ñ– Ñ Ğ´Ğ¾Ğ²Ğ³Ğ¾ _______ Ğ½Ğ°Ğ´ Ñ†Ñ–Ñ”Ñ Ğ¿Ñ€Ğ¾Ğ±Ğ»ĞµĞ¼Ğ¾Ñ, Ğ°Ğ»Ğµ Ñ‚Ğ°Ğº Ñ– Ğ½Ğµ Ğ·Ğ½Ğ°Ğ¹ÑˆĞ¾Ğ² Ñ€Ñ–ÑˆĞµĞ½Ğ½Ñ.\n   > [!answer] Ğ´ÑƒĞ¼Ğ°Ğ²\n   > [!options] Ğ´ÑƒĞ¼Ğ°Ğ² | Ğ¿Ğ¾Ğ´ÑƒĞ¼Ğ°Ğ²\n\n2. ĞĞ°Ñ€ĞµÑˆÑ‚Ñ– Ñ _______ Ñ€Ñ–ÑˆĞµĞ½Ğ½Ñ, ÑĞºĞµ Ğ¼ĞµĞ½Ñ– ÑĞ¿Ğ¾Ğ´Ğ¾Ğ±Ğ°Ğ»Ğ¾ÑÑŒ â€” Ñ†Ğµ Ğ±ÑƒĞ»Ğ¾ Ğ¿Ñ–ÑĞ»Ñ Ğ³Ğ¾Ğ´Ğ¸Ğ½Ğ¸ Ñ€Ğ¾Ğ·Ğ´ÑƒĞ¼Ñ–Ğ².\n   > [!answer] Ğ¿Ñ€Ğ¸Ğ¹Ğ½ÑĞ²\n   > [!options] Ğ¿Ñ€Ğ¸Ğ¹Ğ¼Ğ°Ğ² | Ğ¿Ñ€Ğ¸Ğ¹Ğ½ÑĞ²\n\n3. Ğ©Ğ¾Ğ´Ğ½Ñ Ğ²Ğ¾Ğ½Ğ° _______ ÑÑ‚Ğ°Ñ‚Ñ‚Ñ– Ğ´Ğ»Ñ ÑĞ°Ğ¹Ñ‚Ñƒ â€” Ñ†Ğµ Ñ—Ñ— Ğ¾ÑĞ½Ğ¾Ğ²Ğ½Ğ° Ñ€Ğ¾Ğ±Ğ¾Ñ‚Ğ°.\n   > [!answer] Ğ¿Ğ¸ÑˆĞµ\n   > [!options] Ğ¿Ğ¸ÑˆĞµ | Ğ½Ğ°Ğ¿Ğ¸ÑˆĞµ\n\n4. ĞšĞ¾Ğ»Ğ¸ Ñ‚Ğ¸ _______ Ñ†ĞµĞ¹ Ğ·Ğ²Ñ–Ñ‚, Ğ½Ğ°Ğ´Ñ–ÑˆĞ»Ğ¸ Ğ¹Ğ¾Ğ³Ğ¾ Ğ¼ĞµĞ½Ñ– ĞµĞ»ĞµĞºÑ‚Ñ€Ğ¾Ğ½Ğ½Ğ¾Ñ Ğ¿Ğ¾ÑˆÑ‚Ğ¾Ñ.\n   > [!answer] Ğ½Ğ°Ğ¿Ğ¸ÑˆĞµÑˆ\n   > [!options] Ğ¿Ğ¸ÑĞ°Ñ‚Ğ¸Ğ¼ĞµÑˆ | Ğ½Ğ°Ğ¿Ğ¸ÑˆĞµÑˆ\n\n5. ĞĞµ _______ Ñƒ Ñ†Ñ ĞºÑ–Ğ¼Ğ½Ğ°Ñ‚Ñƒ â€” Ñ‚Ğ°Ğ¼ Ğ¿Ñ€Ğ°Ñ†ÑÑÑ‚ÑŒ!\n   > [!answer] Ğ·Ğ°Ñ…Ğ¾Ğ´ÑŒ\n   > [!options] Ğ·Ğ°Ñ…Ğ¾Ğ´ÑŒ | Ğ·Ğ°Ğ¹Ğ´Ğ¸\n\n6. _______ Ñƒ ĞºÑ–Ğ¼Ğ½Ğ°Ñ‚Ñƒ Ñ– ÑÑĞ´ÑŒ Ğ½Ğ° ÑÑ‚Ñ–Ğ»ĞµÑ†ÑŒ â€” Ñ Ğ·Ğ°Ñ€Ğ°Ğ· Ğ¿Ğ¾Ğ²ĞµÑ€Ğ½ÑƒÑÑ.\n   > [!answer] Ğ—Ğ°Ğ¹Ğ´Ğ¸\n   > [!options] Ğ—Ğ°Ñ…Ğ¾Ğ´ÑŒ | Ğ—Ğ°Ğ¹Ğ´Ğ¸\n\n7. Ğ’Ñ–Ğ½ Ğ·Ğ°Ğ²Ğ¶Ğ´Ğ¸ _______ Ğ¿Ñ–Ğ·Ğ½Ğ¾, Ñ‚Ğ¾Ğ¼Ñƒ Ğ¼Ğ¸ Ğ½Ñ–ĞºĞ¾Ğ»Ğ¸ Ğ½Ğµ ÑĞ½Ñ–Ğ´Ğ°Ñ”Ğ¼Ğ¾ Ñ€Ğ°Ğ·Ğ¾Ğ¼.\n   > [!answer] Ğ¿Ñ€Ğ¾ĞºĞ¸Ğ´Ğ°Ñ”Ñ‚ÑŒÑÑ\n   > [!options] Ğ¿Ñ€Ğ¾ĞºĞ¸Ğ´Ğ°Ñ”Ñ‚ÑŒÑÑ | Ğ¿Ñ€Ğ¾ĞºĞ¸Ğ½ĞµÑ‚ÑŒÑÑ\n\n8. Ğ’Ğ¾Ğ½Ğ° Ñ‰Ğµ Ğ½Ğµ _______ Ğ·Ğ²Ñ–Ñ‚ â€” Ğ·Ñ€Ğ¾Ğ±Ğ¸Ñ‚ÑŒ Ñ†Ğµ Ğ·Ğ°Ğ²Ñ‚Ñ€Ğ° Ğ²Ñ€Ğ°Ğ½Ñ†Ñ–.\n   > [!answer] Ğ½Ğ°Ğ¿Ğ¸ÑĞ°Ğ»Ğ°\n   > [!options] Ğ¿Ğ¸ÑĞ°Ğ»Ğ° | Ğ½Ğ°Ğ¿Ğ¸ÑĞ°Ğ»Ğ°\n\n9. ĞšĞ¾Ğ»Ğ¸ Ñ ÑÑ‚ÑƒĞ´ĞµĞ½Ñ‚, Ñ _______ Ğ±Ğ°Ğ³Ğ°Ñ‚Ğ¾ ĞºĞ½Ğ¸Ğ³ Ñ‰Ğ¾Ğ¼Ñ–ÑÑÑ†Ñ â€” Ñ‚ĞµĞ¿ĞµÑ€ Ğ½ĞµĞ¼Ğ°Ñ” Ñ‡Ğ°ÑÑƒ.\n   > [!answer] Ñ‡Ğ¸Ñ‚Ğ°Ğ²\n   > [!options] Ñ‡Ğ¸Ñ‚Ğ°Ğ² | Ğ¿Ñ€Ğ¾Ñ‡Ğ¸Ñ‚Ğ°Ğ²\n\n10. Ğ—Ğ° Ğ²Ğ¸Ñ…Ñ–Ğ´Ğ½Ñ– Ñ _______ ÑƒÑÑ ĞºĞ½Ğ¸Ğ³Ñƒ Ğ²Ñ–Ğ´ Ğ¿ĞµÑ€ÑˆĞ¾Ñ— Ğ´Ğ¾ Ğ¾ÑÑ‚Ğ°Ğ½Ğ½ÑŒĞ¾Ñ— ÑÑ‚Ğ¾Ñ€Ñ–Ğ½ĞºĞ¸.\n    > [!answer] Ğ¿Ñ€Ğ¾Ñ‡Ğ¸Ñ‚Ğ°Ğ²\n    > [!options] Ñ‡Ğ¸Ñ‚Ğ°Ğ² | Ğ¿Ñ€Ğ¾Ñ‡Ğ¸Ñ‚Ğ°Ğ²\n\n11. Ğ’Ğ¾Ğ½Ğ° Ğ´Ğ¾Ğ²Ğ³Ğ¾ _______ Ğ´Ğ¾ ÑƒĞ½Ñ–Ğ²ĞµÑ€ÑĞ¸Ñ‚ĞµÑ‚Ñƒ, Ğ±Ğ¾ Ğ¶Ğ¸Ğ»Ğ° Ğ´Ğ°Ğ»ĞµĞºĞ¾ Ğ²Ñ–Ğ´ Ñ†ĞµĞ½Ñ‚Ñ€Ñƒ.\n    > [!answer] Ñ—Ğ·Ğ´Ğ¸Ğ»Ğ°\n    > [!options] Ñ—Ğ·Ğ´Ğ¸Ğ»Ğ° | Ğ¿Ğ¾Ñ—Ñ…Ğ°Ğ»Ğ°\n\n12. Ğ’Ñ–Ğ½ Ğ½Ğµ _______ Ğ²Ñ‡Ğ¾Ñ€Ğ° Ğ½Ğ° Ğ·Ğ°Ğ½ÑÑ‚Ñ‚Ñ, Ğ±Ğ¾ Ğ±ÑƒĞ² Ñ…Ğ²Ğ¾Ñ€Ğ¸Ğ¹ Ğ½Ğ° Ğ³Ñ€Ğ¸Ğ¿.\n    > [!answer] Ğ¿Ñ€Ğ¸Ğ¹ÑˆĞ¾Ğ²\n    > [!options] Ğ¿Ñ€Ğ¸Ñ…Ğ¾Ğ´Ğ¸Ğ² | Ğ¿Ñ€Ğ¸Ğ¹ÑˆĞ¾Ğ²\n\n13. ĞœĞ¸ Ğ·Ğ°Ğ²Ğ¶Ğ´Ğ¸ _______ Ğ½Ğ° Ñ†Ñ– Ğ·Ğ±Ğ¾Ñ€Ğ¸ Ğ¾ Ğ´ĞµĞ²'ÑÑ‚Ñ–Ğ¹ Ñ€Ğ°Ğ½ĞºÑƒ â€” Ñ†Ğµ Ñ‚Ñ€Ğ°Ğ´Ğ¸Ñ†Ñ–Ñ.\n    > [!answer] Ğ¿Ñ€Ğ¸Ñ…Ğ¾Ğ´Ğ¸Ğ¼Ğ¾\n    > [!options] Ğ¿Ñ€Ğ¸Ñ…Ğ¾Ğ´Ğ¸Ğ¼Ğ¾ | Ğ¿Ñ€Ğ¸Ğ¹Ğ´ĞµĞ¼Ğ¾\n\n14. ĞšĞ¾Ğ»Ğ¸ Ñ‚Ğ¸ _______ Ğ´Ğ¾Ğ´Ğ¾Ğ¼Ñƒ, Ğ·Ğ°Ñ‚ĞµĞ»ĞµÑ„Ğ¾Ğ½ÑƒĞ¹ Ğ¼ĞµĞ½Ñ– â€” Ñ Ñ…Ğ²Ğ¸Ğ»ÑÑÑÑ.\n    > [!answer] Ğ¿Ñ€Ğ¸Ğ¹Ğ´ĞµÑˆ\n    > [!options] Ğ¿Ñ€Ğ¸Ñ…Ğ¾Ğ´Ğ¸Ñ‚Ğ¸Ğ¼ĞµÑˆ | Ğ¿Ñ€Ğ¸Ğ¹Ğ´ĞµÑˆ\n\n---\n\n## error-correction: Ğ“Ñ€Ğ°Ğ¼Ğ°Ñ‚Ğ¸Ñ‡Ğ½Ñ– Ğ¿Ğ¾Ğ¼Ğ¸Ğ»ĞºĞ¸ B1\n\n> Ğ—Ğ½Ğ°Ğ¹Ğ´Ñ–Ñ‚ÑŒ Ğ¿Ğ¾Ğ¼Ğ¸Ğ»ĞºÑƒ Ğ² Ñ€ĞµÑ‡ĞµĞ½Ğ½Ñ– Ñ‚Ğ° Ğ²Ğ¸Ğ¿Ñ€Ğ°Ğ²Ñ‚Ğµ Ñ—Ñ—. Ğ—Ğ²ĞµÑ€Ğ½Ñ–Ñ‚ÑŒ ÑƒĞ²Ğ°Ğ³Ñƒ Ğ½Ğ° Ğ²Ğ¸Ğ´ Ğ´Ñ–Ñ”ÑĞ»Ğ¾Ğ²Ğ°, Ğ´Ñ–Ñ”ÑĞ»Ğ¾Ğ²Ğ° Ñ€ÑƒÑ…Ñƒ, ÑĞºĞ»Ğ°Ğ´Ğ½Ñ– Ñ€ĞµÑ‡ĞµĞ½Ğ½Ñ Ñ‚Ğ° Ğ´Ñ–Ñ”Ğ¿Ñ€Ğ¸ĞºĞ¼ĞµÑ‚Ğ½Ğ¸ĞºĞ¸.\n\n1. Ğ¯ Ğ²Ñ‡Ğ¾Ñ€Ğ° Ñ‡Ğ¸Ñ‚Ğ°Ğ² Ñ†Ñ ĞºĞ½Ğ¸Ğ³Ñƒ Ğ²Ñ–Ğ´ Ğ¿Ğ¾Ñ‡Ğ°Ñ‚ĞºÑƒ Ğ´Ğ¾ ĞºÑ–Ğ½Ñ†Ñ.\n   > [!error] Ñ‡Ğ¸Ñ‚Ğ°Ğ²\n   > [!answer] Ğ¿Ñ€Ğ¾Ñ‡Ğ¸Ñ‚Ğ°Ğ²\n   > [!options] Ñ‡Ğ¸Ñ‚Ğ°Ğ² | Ğ¿Ñ€Ğ¾Ñ‡Ğ¸Ñ‚Ğ°Ğ² | Ñ‡Ğ¸Ñ‚Ğ°Ñ‚Ğ¸Ğ¼Ñƒ | Ğ¿Ğ¾Ñ‡Ğ¸Ñ‚Ğ°Ğ²\n   > [!explanation] Ğ¯ĞºÑ‰Ğ¾ Ğ²ĞºĞ°Ğ·Ğ°Ğ½Ğ¾ Ñ€ĞµĞ·ÑƒĞ»ÑŒÑ‚Ğ°Ñ‚ (Ğ²Ñ–Ğ´ Ğ¿Ğ¾Ñ‡Ğ°Ñ‚ĞºÑƒ Ğ´Ğ¾ ĞºÑ–Ğ½Ñ†Ñ), Ğ¿Ğ¾Ñ‚Ñ€Ñ–Ğ±ĞµĞ½ Ğ´Ğ¾ĞºĞ¾Ğ½Ğ°Ğ½Ğ¸Ğ¹ Ğ²Ğ¸Ğ´: Â«Ğ¿Ñ€Ğ¾Ñ‡Ğ¸Ñ‚Ğ°Ğ²Â».\n\n2. Ğ’Ğ¾Ğ½Ğ° Ñ‰Ğ¾Ğ´Ğ½Ñ Ğ¿Ñ€Ğ¸Ñ…Ğ¾Ğ´Ğ¸Ğ»Ğ° Ğ´Ğ¾ Ğ¾Ñ„Ñ–ÑÑƒ Ğ¾ Ğ²Ğ¾ÑÑŒĞ¼Ñ–Ğ¹ Ğ³Ğ¾Ğ´Ğ¸Ğ½Ñ– Ñ€Ğ°Ğ½ĞºÑƒ.\n   > [!error] Ğ¿Ñ€Ğ¸Ñ…Ğ¾Ğ´Ğ¸Ğ»Ğ°\n   > [!answer] Ğ¿Ñ€Ğ¸Ñ…Ğ¾Ğ´Ğ¸Ñ‚ÑŒ\n   > [!options] Ğ¿Ñ€Ğ¸Ñ…Ğ¾Ğ´Ğ¸Ğ»Ğ° | Ğ¿Ñ€Ğ¸Ñ…Ğ¾Ğ´Ğ¸Ñ‚ÑŒ | Ğ¿Ñ€Ğ¸Ğ¹ÑˆĞ»Ğ° | Ğ¿Ñ€Ğ¸Ñ…Ğ¾Ğ´Ğ¸Ñ‚Ğ¸Ğ¼Ğµ\n   > [!explanation] Â«Ğ©Ğ¾Ğ´Ğ½ÑÂ» Ğ²ĞºĞ°Ğ·ÑƒÑ” Ğ½Ğ° Ñ‚ĞµĞ¿ĞµÑ€Ñ–ÑˆĞ½Ñ–Ğ¹ Ñ‡Ğ°Ñ â€” Ğ¿Ğ¾Ñ‚Ñ€Ñ–Ğ±Ğ½Ğ¾ Â«Ğ¿Ñ€Ğ¸Ñ…Ğ¾Ğ´Ğ¸Ñ‚ÑŒÂ».\n\n3. Ğ¯ĞºÑ‰Ğ¾ Ğ± Ñ Ğ¼Ğ°Ğ² Ñ‡Ğ°Ñ, Ñ Ğ´Ğ¾Ğ¿Ğ¾Ğ¼Ğ¾Ğ¶Ñƒ Ñ‚Ğ¾Ğ±Ñ– Ğ· Ñ†Ğ¸Ğ¼ Ğ¿Ñ€Ğ¾ĞµĞºÑ‚Ğ¾Ğ¼.\n   > [!error] Ğ´Ğ¾Ğ¿Ğ¾Ğ¼Ğ¾Ğ¶Ñƒ\n   > [!answer] Ğ´Ğ¾Ğ¿Ğ¾Ğ¼Ñ–Ğ³ Ğ±Ğ¸\n   > [!options] Ğ´Ğ¾Ğ¿Ğ¾Ğ¼Ğ¾Ğ¶Ñƒ | Ğ´Ğ¾Ğ¿Ğ¾Ğ¼Ñ–Ğ³ Ğ±Ğ¸ | Ğ´Ğ¾Ğ¿Ğ¾Ğ¼Ğ°Ğ³Ğ°Ñ | Ğ´Ğ¾Ğ¿Ğ¾Ğ¼Ğ¾Ğ³Ñƒ\n   > [!explanation] Ğ’ ÑƒĞ¼Ğ¾Ğ²Ğ½Ğ¾Ğ¼Ñƒ ÑĞ¿Ğ¾ÑĞ¾Ğ±Ñ– (ÑĞºÑ‰Ğ¾ Ğ±... ) Ğ¿Ğ¾Ñ‚Ñ€Ñ–Ğ±Ğ½Ğ° Ñ„Ğ¾Ñ€Ğ¼Ğ° Â«Ğ´Ğ¾Ğ¿Ğ¾Ğ¼Ñ–Ğ³ Ğ±Ğ¸Â».\n\n4. Ğ¢ĞµĞºÑÑ‚, Ğ½Ğ°Ğ¿Ğ¸ÑĞ°Ğ½Ğ¸Ğ¹ ÑÑ‚ÑƒĞ´ĞµĞ½Ñ‚Ğ¾Ğ¼, Ğ±ÑƒĞ² Ğ´ÑƒĞ¶Ğµ Ñ†Ñ–ĞºĞ°Ğ²Ğ¸Ğ¼ Ğ´Ğ»Ñ Ñ‡Ğ¸Ñ‚Ğ°Ğ½Ğ½Ñ.\n   > [!error] Ñ†Ñ–ĞºĞ°Ğ²Ğ¸Ğ¼\n   > [!answer] Ñ†Ñ–ĞºĞ°Ğ²Ğ¸Ğ¹\n   > [!options] Ñ†Ñ–ĞºĞ°Ğ²Ğ¸Ğ¼ | Ñ†Ñ–ĞºĞ°Ğ²Ğ¸Ğ¹ | Ñ†Ñ–ĞºĞ°Ğ²Ğµ | Ñ†Ñ–ĞºĞ°Ğ²Ğ°\n   > [!explanation] ĞŸÑ–ÑĞ»Ñ Â«Ğ±ÑƒĞ²Â» Ğ¿Ğ¾Ñ‚Ñ€Ñ–Ğ±ĞµĞ½ Ğ½Ğ°Ğ·Ğ¸Ğ²Ğ½Ğ¸Ğ¹ Ğ²Ñ–Ğ´Ğ¼Ñ–Ğ½Ğ¾Ğº: Â«Ñ†Ñ–ĞºĞ°Ğ²Ğ¸Ğ¹Â», Ğ½Ğµ Ğ¾Ñ€ÑƒĞ´Ğ½Ğ¸Ğ¹.\n\n5. Ğ¯ Ñ…Ğ¾Ñ‡Ñƒ, Ñ‰Ğ¾ Ğ²Ñ–Ğ½ Ğ¿Ñ€Ğ¸Ğ¹ÑˆĞ¾Ğ² Ğ½Ğ° Ğ·ÑƒÑÑ‚Ñ€Ñ–Ñ‡ Ğ¾ Ñ‚Ñ€ĞµÑ‚Ñ–Ğ¹ Ğ³Ğ¾Ğ´Ğ¸Ğ½Ñ–.\n   > [!error] Ñ‰Ğ¾\n   > [!answer] Ñ‰Ğ¾Ğ±\n   > [!options] Ñ‰Ğ¾ | Ñ‰Ğ¾Ğ± | ĞºĞ¾Ğ»Ğ¸ | ÑĞºÑ‰Ğ¾\n   > [!explanation] Ğ”Ğ»Ñ Ğ²Ğ¸Ñ€Ğ°Ğ¶ĞµĞ½Ğ½Ñ Ğ±Ğ°Ğ¶Ğ°Ğ½Ğ½Ñ Ğ¿Ğ¾Ñ‚Ñ€Ñ–Ğ±ĞµĞ½ ÑĞ¿Ğ¾Ğ»ÑƒÑ‡Ğ½Ğ¸Ğº Â«Ñ‰Ğ¾Ğ±Â» + Ğ¼Ğ¸Ğ½ÑƒĞ»Ğ¸Ğ¹ Ñ‡Ğ°Ñ.\n\n6. Ğ›Ñ–Ñ‚Ğ°Ğº Ğ²Ñ–Ğ´Ñ…Ğ¾Ğ´Ğ¸Ñ‚ÑŒ Ğ·Ğ° Ğ³Ğ¾Ğ´Ğ¸Ğ½Ñƒ, Ñ‚Ğ¾Ğ¼Ñƒ Ğ¼Ğ¸ Ğ¿Ğ¾Ğ²Ğ¸Ğ½Ğ½Ñ– Ğ¿Ğ¾ÑĞ¿Ñ–ÑˆĞ°Ñ‚Ğ¸.\n   > [!error] Ğ²Ñ–Ğ´Ñ…Ğ¾Ğ´Ğ¸Ñ‚ÑŒ\n   > [!answer] Ğ²Ñ–Ğ´Ğ»Ñ–Ñ‚Ğ°Ñ”\n   > [!options] Ğ²Ñ–Ğ´Ñ…Ğ¾Ğ´Ğ¸Ñ‚ÑŒ | Ğ²Ñ–Ğ´Ğ»Ñ–Ñ‚Ğ°Ñ” | Ğ²Ñ–Ğ´Ğ¿Ğ»Ğ¸Ğ²Ğ°Ñ” | Ğ²Ñ–Ğ´'Ñ—Ğ¶Ğ´Ğ¶Ğ°Ñ”\n   > [!explanation] Ğ”Ğ»Ñ Ğ»Ñ–Ñ‚Ğ°ĞºÑ–Ğ² Ğ²Ğ¸ĞºĞ¾Ñ€Ğ¸ÑÑ‚Ğ¾Ğ²ÑƒÑ”Ñ‚ÑŒÑÑ Â«Ğ²Ñ–Ğ´Ğ»Ñ–Ñ‚Ğ°Ñ‚Ğ¸Â», Ğ½Ğµ Â«Ğ²Ñ–Ğ´Ñ…Ğ¾Ğ´Ğ¸Ñ‚Ğ¸Â».\n\n7. Ğ¦Ğµ Ñ‚Ğ¾Ğ¹ ÑÑ‚ÑƒĞ´ĞµĞ½Ñ‚, Ñ…Ñ‚Ğ¾ Ğ¾Ñ‚Ñ€Ğ¸Ğ¼Ğ°Ğ² Ğ½Ğ°Ğ¹ĞºÑ€Ğ°Ñ‰Ñƒ Ğ¾Ñ†Ñ–Ğ½ĞºÑƒ Ğ½Ğ° Ñ–ÑĞ¿Ğ¸Ñ‚Ñ–.\n   > [!error] Ñ…Ñ‚Ğ¾\n   > [!answer] ÑĞºĞ¸Ğ¹\n   > [!options] Ñ…Ñ‚Ğ¾ | ÑĞºĞ¸Ğ¹ | Ñ‰Ğ¾ | ĞºĞ¾Ñ‚Ñ€Ğ¸Ğ¹\n   > [!explanation] Ğ£ Ğ¿Ñ–Ğ´Ñ€ÑĞ´Ğ½Ğ¸Ñ… Ğ¾Ğ·Ğ½Ğ°Ñ‡Ğ°Ğ»ÑŒĞ½Ğ¸Ñ… Ñ€ĞµÑ‡ĞµĞ½Ğ½ÑÑ… Ğ²Ğ¸ĞºĞ¾Ñ€Ğ¸ÑÑ‚Ğ¾Ğ²ÑƒÑ”Ñ‚ÑŒÑÑ Â«ÑĞºĞ¸Ğ¹Â», Ğ½Ğµ Â«Ñ…Ñ‚Ğ¾Â».\n\n8. Ğ§Ğ¸Ñ‚Ğ°ÑÑ‡Ğ¸ ĞºĞ½Ğ¸Ğ³Ñƒ, Ğ¼ÑƒĞ·Ğ¸ĞºĞ° Ğ³Ñ€Ğ°Ğ»Ğ° Ğ½Ğ° Ñ„Ğ¾Ğ½Ñ– Ğ´ÑƒĞ¶Ğµ Ğ³Ğ¾Ğ»Ğ¾ÑĞ½Ğ¾.\n   > [!error] Ğ¼ÑƒĞ·Ğ¸ĞºĞ°\n   > [!answer] Ñ\n   > [!options] Ğ¼ÑƒĞ·Ğ¸ĞºĞ° | Ñ | Ğ²Ñ–Ğ½ | Ğ²Ğ¾Ğ½Ğ°\n   > [!explanation] Ğ”Ñ–Ñ”Ğ¿Ñ€Ğ¸ÑĞ»Ñ–Ğ²Ğ½Ğ¸Ğº Ğ¼Ğ°Ñ” ÑÑ‚Ğ¾ÑÑƒĞ²Ğ°Ñ‚Ğ¸ÑÑ Ğ¿Ñ–Ğ´Ğ¼ĞµÑ‚Ğ°: Â«Ğ§Ğ¸Ñ‚Ğ°ÑÑ‡Ğ¸ ĞºĞ½Ğ¸Ğ³Ñƒ, Ñ ÑĞ»ÑƒÑ…Ğ°Ğ² Ğ¼ÑƒĞ·Ğ¸ĞºÑƒÂ».\n\n9. ĞĞµ Ğ²Ñ–Ğ´ĞºÑ€Ğ¸Ğ¹ Ğ²Ñ–ĞºĞ½Ğ¾, Ğ±Ğ¾ Ğ½Ğ° Ğ²ÑƒĞ»Ğ¸Ñ†Ñ– Ğ´ÑƒĞ¶Ğµ Ñ…Ğ¾Ğ»Ğ¾Ğ´Ğ½Ğ¾ ÑÑŒĞ¾Ğ³Ğ¾Ğ´Ğ½Ñ–.\n   > [!error] Ğ²Ñ–Ğ´ĞºÑ€Ğ¸Ğ¹\n   > [!answer] Ğ²Ñ–Ğ´ĞºÑ€Ğ¸Ğ²Ğ°Ğ¹\n   > [!options] Ğ²Ñ–Ğ´ĞºÑ€Ğ¸Ğ¹ | Ğ²Ñ–Ğ´ĞºÑ€Ğ¸Ğ²Ğ°Ğ¹ | Ğ²Ñ–Ğ´ĞºÑ€Ğ¸Ğ²Ğ°Ñ”Ñˆ | Ğ²Ñ–Ğ´ĞºÑ€Ğ¸Ñ”Ñˆ\n   > [!explanation] Ğ”Ğ»Ñ Ğ·Ğ°Ğ±Ğ¾Ñ€Ğ¾Ğ½Ğ¸ Ğ²Ğ¸ĞºĞ¾Ñ€Ğ¸ÑÑ‚Ğ¾Ğ²ÑƒÑ”Ñ‚ÑŒÑÑ Ğ½ĞµĞ´Ğ¾ĞºĞ¾Ğ½Ğ°Ğ½Ğ¸Ğ¹ Ğ²Ğ¸Ğ´: Â«ĞĞµ Ğ²Ñ–Ğ´ĞºÑ€Ğ¸Ğ²Ğ°Ğ¹Â».\n\n10. Ğ’Ñ–Ğ½ Ğ²Ğ¸Ñ…Ğ¾Ğ´Ğ¸Ğ² Ğ· Ğ´Ğ¾Ğ¼Ñƒ, ĞºĞ¾Ğ»Ğ¸ Ğ¿Ğ¾Ñ‡Ğ°Ğ² ÑĞ¸Ğ»ÑŒĞ½Ğ¸Ğ¹ Ğ´Ğ¾Ñ‰ Ñ–Ğ· Ğ³Ñ€Ğ°Ğ´Ğ¾Ğ¼.\n    > [!error] Ğ¿Ğ¾Ñ‡Ğ°Ğ²\n    > [!answer] Ğ¿Ğ¾Ñ‡Ğ°Ğ²ÑÑ\n    > [!options] Ğ¿Ğ¾Ñ‡Ğ°Ğ² | Ğ¿Ğ¾Ñ‡Ğ°Ğ²ÑÑ | Ğ¿Ğ¾Ñ‡Ğ¸Ğ½Ğ°Ğ² | Ğ¿Ğ¾Ñ‡Ğ¸Ğ½Ğ°Ğ²ÑÑ\n    > [!explanation] Ğ”Ğ¾Ñ‰ Â«Ğ¿Ğ¾Ñ‡Ğ°Ğ²ÑÑÂ» (Ğ·Ğ²Ğ¾Ñ€Ğ¾Ñ‚Ğ½Ğ° Ñ„Ğ¾Ñ€Ğ¼Ğ°), Ğ½Ğµ Â«Ğ¿Ğ¾Ñ‡Ğ°Ğ²Â».\n\n11. Ğ’Ğ¾Ğ½Ğ° Ğ·Ğ°ĞºÑ–Ğ½Ñ‡Ğ¸Ğ²ÑˆĞ¸ Ñ€Ğ¾Ğ±Ğ¾Ñ‚Ñƒ Ñ– Ğ¿Ñ–ÑˆĞ»Ğ° Ğ´Ğ¾Ğ´Ğ¾Ğ¼Ñƒ Ğ²Ñ–Ğ´Ğ¿Ğ¾Ñ‡Ğ¸Ğ²Ğ°Ñ‚Ğ¸ Ğ¿Ñ–ÑĞ»Ñ Ğ²Ğ°Ğ¶ĞºĞ¾Ğ³Ğ¾ Ğ´Ğ½Ñ.\n    > [!error] Ğ·Ğ°ĞºÑ–Ğ½Ñ‡Ğ¸Ğ²ÑˆĞ¸ Ñ€Ğ¾Ğ±Ğ¾Ñ‚Ñƒ Ñ– Ğ¿Ñ–ÑˆĞ»Ğ°\n    > [!answer] Ğ·Ğ°ĞºÑ–Ğ½Ñ‡Ğ¸Ğ²ÑˆĞ¸ Ñ€Ğ¾Ğ±Ğ¾Ñ‚Ñƒ, Ğ¿Ñ–ÑˆĞ»Ğ°\n    > [!options] Ğ·Ğ°ĞºÑ–Ğ½Ñ‡Ğ¸Ğ²ÑˆĞ¸ Ñ€Ğ¾Ğ±Ğ¾Ñ‚Ñƒ Ñ– Ğ¿Ñ–ÑˆĞ»Ğ° | Ğ·Ğ°ĞºÑ–Ğ½Ñ‡Ğ¸Ğ²ÑˆĞ¸ Ñ€Ğ¾Ğ±Ğ¾Ñ‚Ñƒ, Ğ¿Ñ–ÑˆĞ»Ğ° | Ğ·Ğ°ĞºÑ–Ğ½Ñ‡Ğ¸Ğ»Ğ° Ñ€Ğ¾Ğ±Ğ¾Ñ‚Ñƒ Ğ¿Ñ–ÑˆĞ»Ğ° | Ğ·Ğ°ĞºÑ–Ğ½Ñ‡Ğ¸Ğ²ÑˆĞ¸ Ñ€Ğ¾Ğ±Ğ¾Ñ‚Ğ¸ Ğ¿Ñ–ÑˆĞ»Ğ°\n    > [!explanation] Ğ”Ñ–Ñ”Ğ¿Ñ€Ğ¸ÑĞ»Ñ–Ğ²Ğ½Ğ¸Ğº Ğ²Ñ–Ğ´Ğ¾ĞºÑ€ĞµĞ¼Ğ»ÑÑ”Ñ‚ÑŒÑÑ ĞºĞ¾Ğ¼Ğ¾Ñ, ÑĞ¿Ğ¾Ğ»ÑƒÑ‡Ğ½Ğ¸Ğº Â«Ñ–Â» Ğ·Ğ°Ğ¹Ğ²Ğ¸Ğ¹.\n\n12. ĞšĞ½Ğ¸Ğ³Ğ° Ğ¿ĞµÑ€ĞµĞºĞ»Ğ°Ğ»Ğ¸ ÑƒĞºÑ€Ğ°Ñ—Ğ½ÑÑŒĞºĞ¾Ñ Ğ¼Ğ¾Ğ²Ğ¾Ñ Ğ¼Ğ¸Ğ½ÑƒĞ»Ğ¾Ğ³Ğ¾ Ñ€Ğ¾ĞºÑƒ Ñƒ Ğ›ÑŒĞ²Ğ¾Ğ²Ñ–.\n    > [!error] ĞšĞ½Ğ¸Ğ³Ğ° Ğ¿ĞµÑ€ĞµĞºĞ»Ğ°Ğ»Ğ¸\n    > [!answer] ĞšĞ½Ğ¸Ğ³Ñƒ Ğ¿ĞµÑ€ĞµĞºĞ»Ğ°Ğ»Ğ¸\n    > [!options] ĞšĞ½Ğ¸Ğ³Ğ° Ğ¿ĞµÑ€ĞµĞºĞ»Ğ°Ğ»Ğ¸ | ĞšĞ½Ğ¸Ğ³Ñƒ Ğ¿ĞµÑ€ĞµĞºĞ»Ğ°Ğ»Ğ¸ | ĞšĞ½Ğ¸Ğ³Ğ¸ Ğ¿ĞµÑ€ĞµĞºĞ»Ğ°Ğ»Ğ¸ | ĞšĞ½Ğ¸Ğ·Ñ– Ğ¿ĞµÑ€ĞµĞºĞ»Ğ°Ğ»Ğ¸\n    > [!explanation] ĞĞ±'Ñ”ĞºÑ‚ Ğ´Ñ–Ñ— ÑÑ‚Ğ¾Ñ—Ñ‚ÑŒ Ñƒ Ğ·Ğ½Ğ°Ñ…Ñ–Ğ´Ğ½Ğ¾Ğ¼Ñƒ Ğ²Ñ–Ğ´Ğ¼Ñ–Ğ½ĞºÑƒ: Â«ĞšĞ½Ğ¸Ğ³Ñƒ Ğ¿ĞµÑ€ĞµĞºĞ»Ğ°Ğ»Ğ¸Â».\n\n---\n\n## match-up: Ğ¡Ğ¿Ğ¾Ğ»ÑƒÑ‡Ğ½Ğ¸ĞºĞ¸ Ñ‚Ğ° Ñ‚Ğ¸Ğ¿Ğ¸ Ñ€ĞµÑ‡ĞµĞ½ÑŒ\n\n> Ğ¡Ğ¿Ñ–Ğ²ÑÑ‚Ğ°Ğ²Ñ‚Ğµ ÑĞ¿Ğ¾Ğ»ÑƒÑ‡Ğ½Ğ¸Ğº Ñ–Ğ· Ñ‚Ğ¸Ğ¿Ğ¾Ğ¼ ÑĞºĞ»Ğ°Ğ´Ğ½Ğ¾Ğ³Ğ¾ Ñ€ĞµÑ‡ĞµĞ½Ğ½Ñ, ÑĞºĞ¸Ğ¹ Ğ²Ñ–Ğ½ Ğ²Ğ²Ğ¾Ğ´Ğ¸Ñ‚ÑŒ.\n\n| Ğ¡Ğ¿Ğ¾Ğ»ÑƒÑ‡Ğ½Ğ¸Ğº | Ğ¢Ğ¸Ğ¿ Ñ€ĞµÑ‡ĞµĞ½Ğ½Ñ |\n|-----------|-------------|\n| ÑĞºĞ¸Ğ¹, ÑĞºĞ°, ÑĞºĞµ | Ğ¾Ğ·Ğ½Ğ°Ñ‡Ğ°Ğ»ÑŒĞ½Ğµ |\n| Ñ‰Ğ¾Ğ± | Ğ¼ĞµÑ‚Ğ¸ |\n| ÑĞºÑ‰Ğ¾ | ÑƒĞ¼Ğ¾Ğ²Ğ½Ğµ Ñ€ĞµĞ°Ğ»ÑŒĞ½Ğµ |\n| ÑĞºĞ±Ğ¸ | ÑƒĞ¼Ğ¾Ğ²Ğ½Ğµ Ğ½ĞµÑ€ĞµĞ°Ğ»ÑŒĞ½Ğµ |\n| Ñ…Ğ¾Ñ‡Ğ° | Ğ´Ğ¾Ğ¿ÑƒÑÑ‚Ğ¾Ğ²Ğµ |\n| Ñ‚Ğ¾Ğ¼Ñƒ Ñ‰Ğ¾ | Ğ¿Ñ€Ğ¸Ñ‡Ğ¸Ğ½Ğ¸ |\n| ĞºĞ¾Ğ»Ğ¸ | Ñ‡Ğ°ÑĞ¾Ğ²Ğµ |\n| Ğ´Ğµ, ĞºÑƒĞ´Ğ¸, Ğ·Ğ²Ñ–Ğ´ĞºĞ¸ | Ğ¼Ñ–ÑÑ†Ñ |\n| Ğ¿Ğ¾ĞºĞ¸ | Ğ¾Ğ´Ğ½Ğ¾Ñ‡Ğ°ÑĞ½Ğ¾ÑÑ‚Ñ– |\n| ÑĞº Ñ‚Ñ–Ğ»ÑŒĞºĞ¸ | Ğ½ĞµĞ³Ğ°Ğ¹Ğ½Ğ¾ÑÑ‚Ñ– |\n| Ğ½ĞµĞ·Ğ²Ğ°Ğ¶Ğ°ÑÑ‡Ğ¸ Ğ½Ğ° Ñ‚Ğµ Ñ‰Ğ¾ | Ñ„Ğ¾Ñ€Ğ¼Ğ°Ğ»ÑŒĞ½Ğµ Ğ´Ğ¾Ğ¿ÑƒÑÑ‚Ğ¾Ğ²Ğµ |\n| Ñ‡ĞµÑ€ĞµĞ· Ñ‚Ğµ Ñ‰Ğ¾ | Ñ„Ğ¾Ñ€Ğ¼Ğ°Ğ»ÑŒĞ½Ğµ Ğ¿Ñ€Ğ¸Ñ‡Ğ¸Ğ½Ğ¸ |\n\n---\n\n## cloze: ĞšĞ¾Ğ¼Ğ¿Ğ»ĞµĞºÑĞ½Ğ¸Ğ¹ Ñ‚ĞµĞºÑÑ‚ B1\n\n> Ğ—Ğ°Ğ¿Ğ¾Ğ²Ğ½Ñ–Ñ‚ÑŒ Ğ¿Ñ€Ğ¾Ğ¿ÑƒÑĞºĞ¸, Ğ¾Ğ±Ğ¸Ñ€Ğ°ÑÑ‡Ğ¸ Ğ¿Ñ€Ğ°Ğ²Ğ¸Ğ»ÑŒĞ½Ñƒ Ğ²Ñ–Ğ´Ğ¿Ğ¾Ğ²Ñ–Ğ´ÑŒ. Ğ¢ĞµĞºÑÑ‚ Ğ¿ĞµÑ€ĞµĞ²Ñ–Ñ€ÑÑ” Ğ²ÑÑ Ğ³Ñ€Ğ°Ğ¼Ğ°Ñ‚Ğ¸ĞºÑƒ Ñ€Ñ–Ğ²Ğ½Ñ B1.\n\nĞœĞ¸Ğ½ÑƒĞ»Ğ¾Ğ³Ğ¾ Ñ‚Ğ¸Ğ¶Ğ½Ñ Ñ {Ğ²Ğ¸Ñ€Ñ–ÑˆĞ¸Ğ²|Ğ²Ğ¸Ñ€Ñ–ÑˆĞ¸Ğ²|Ğ²Ğ¸Ñ€Ñ–ÑˆÑƒĞ²Ğ°Ğ²|Ğ²Ğ¸Ñ€Ñ–ÑˆĞ°Ñ‚Ğ¸} Ğ¿Ğ¾Ñ—Ñ…Ğ°Ñ‚Ğ¸ Ğ´Ğ¾ Ğ›ÑŒĞ²Ğ¾Ğ²Ğ°, {Ñ‰Ğ¾Ğ±|Ñ‰Ğ¾Ğ±|Ñ‰Ğ¾|ÑĞºÑ‰Ğ¾} Ğ²Ñ–Ğ´Ğ²Ñ–Ğ´Ğ°Ñ‚Ğ¸ Ğ´Ñ€ÑƒĞ·Ñ–Ğ². ĞšĞ¾Ğ»Ğ¸ Ñ {Ğ¿Ñ€Ğ¸Ñ—Ñ…Ğ°Ğ²|Ğ¿Ñ€Ğ¸Ñ—Ñ…Ğ°Ğ²|Ğ¿Ñ€Ğ¸Ñ—Ğ¶Ğ´Ğ¶Ğ°Ğ²|Ñ—Ñ…Ğ°Ğ²} Ğ½Ğ° Ğ²Ğ¾ĞºĞ·Ğ°Ğ», Ğ¿Ğ¾Ñ‚ÑĞ³ ÑƒĞ¶Ğµ {ÑÑ‚Ğ¾ÑĞ²|ÑÑ‚Ğ¾ÑĞ²|ÑÑ‚Ğ°Ğ²|ÑÑ‚Ğ°Ğ½Ğµ} Ğ½Ğ° Ğ¿Ğ»Ğ°Ñ‚Ñ„Ğ¾Ñ€Ğ¼Ñ–. Ğ¯ ÑˆĞ²Ğ¸Ğ´ĞºĞ¾ {Ğ·Ğ°Ğ¹ÑˆĞ¾Ğ²|Ğ·Ğ°Ğ¹ÑˆĞ¾Ğ²|Ğ·Ğ°Ñ…Ğ¾Ğ´Ğ¸Ğ²|Ğ²Ñ…Ğ¾Ğ´Ğ¸Ğ²} Ñƒ Ğ²Ğ°Ğ³Ğ¾Ğ½ Ñ– Ğ·Ğ½Ğ°Ğ¹ÑˆĞ¾Ğ² ÑĞ²Ğ¾Ñ” Ğ¼Ñ–ÑÑ†Ğµ.\n\nĞ”Ğ¾Ñ€Ğ¾Ğ³Ğ¾Ñ Ñ {Ñ‡Ğ¸Ñ‚Ğ°Ğ²|Ñ‡Ğ¸Ñ‚Ğ°Ğ²|Ğ¿Ñ€Ğ¾Ñ‡Ğ¸Ñ‚Ğ°Ğ²|Ñ‡Ğ¸Ñ‚Ğ°Ñ‚Ğ¸Ğ¼Ñƒ} ĞºĞ½Ğ¸Ğ³Ñƒ, {ÑĞºÑƒ|ÑĞºÑƒ|ÑĞºĞ°|ÑĞºÑ–} Ğ¼ĞµĞ½Ñ– Ğ¿Ğ¾Ğ´Ğ°Ñ€ÑƒĞ²Ğ°Ğ² Ğ´Ñ€ÑƒĞ³. Ğ¦Ğµ Ğ±ÑƒĞ»Ğ° ĞºĞ½Ğ¸Ğ³Ğ° Ğ¿Ñ€Ğ¾ Ñ–ÑÑ‚Ğ¾Ñ€Ñ–Ñ Ğ£ĞºÑ€Ğ°Ñ—Ğ½Ğ¸, {Ğ½Ğ°Ğ¿Ğ¸ÑĞ°Ğ½Ğ°|Ğ½Ğ°Ğ¿Ğ¸ÑĞ°Ğ½Ğ°|Ğ½Ğ°Ğ¿Ğ¸ÑĞ°Ğ½Ğ¸Ğ¹|Ğ½Ğ°Ğ¿Ğ¸ÑĞ°Ğ½Ğµ} Ğ²Ñ–Ğ´Ğ¾Ğ¼Ğ¸Ğ¼ Ñ–ÑÑ‚Ğ¾Ñ€Ğ¸ĞºĞ¾Ğ¼. {Ğ§Ğ¸Ñ‚Ğ°ÑÑ‡Ğ¸|Ğ§Ğ¸Ñ‚Ğ°ÑÑ‡Ğ¸|ĞŸÑ€Ğ¾Ñ‡Ğ¸Ñ‚Ğ°Ğ²ÑˆĞ¸|Ğ§Ğ¸Ñ‚Ğ°Ñ‚Ğ¸} Ñ—Ñ—, Ñ Ğ´Ñ–Ğ·Ğ½Ğ°Ğ²ÑÑ Ğ±Ğ°Ğ³Ğ°Ñ‚Ğ¾ Ğ½Ğ¾Ğ²Ğ¾Ğ³Ğ¾.\n\n{Ğ¯ĞºĞ±Ğ¸|Ğ¯ĞºĞ±Ğ¸|Ğ¯ĞºÑ‰Ğ¾|ĞšĞ¾Ğ»Ğ¸} Ñƒ Ğ¼ĞµĞ½Ğµ Ğ±ÑƒĞ»Ğ¾ Ğ±Ñ–Ğ»ÑŒÑˆĞµ Ñ‡Ğ°ÑÑƒ, Ñ Ğ± {Ğ·Ğ°Ğ»Ğ¸ÑˆĞ¸Ğ²ÑÑ|Ğ·Ğ°Ğ»Ğ¸ÑˆĞ¸Ğ²ÑÑ|Ğ·Ğ°Ğ»Ğ¸ÑˆĞ°Ğ²ÑÑ|Ğ·Ğ°Ğ»Ğ¸ÑˆÑƒÑÑŒ} Ñƒ Ğ›ÑŒĞ²Ğ¾Ğ²Ñ– Ğ½Ğ° Ñ‚Ğ¸Ğ¶Ğ´ĞµĞ½ÑŒ. ĞĞ»Ğµ, {Ğ½ĞµĞ·Ğ²Ğ°Ğ¶Ğ°ÑÑ‡Ğ¸|Ğ½ĞµĞ·Ğ²Ğ°Ğ¶Ğ°ÑÑ‡Ğ¸|Ñ‡ĞµÑ€ĞµĞ·|Ñ‚Ğ¾Ğ¼Ñƒ} Ğ½Ğ° ĞºĞ¾Ñ€Ğ¾Ñ‚ĞºĞ¸Ğ¹ Ğ²Ñ–Ğ·Ğ¸Ñ‚, Ñ Ğ²ÑÑ‚Ğ¸Ğ³ {Ğ¿Ğ¾Ğ±Ğ°Ñ‡Ğ¸Ñ‚Ğ¸|Ğ¿Ğ¾Ğ±Ğ°Ñ‡Ğ¸Ñ‚Ğ¸|Ğ±Ğ°Ñ‡Ğ¸Ñ‚Ğ¸|Ğ¿Ğ¾Ğ±Ğ°Ñ‡Ğ¸Ğ²} Ğ±Ğ°Ğ³Ğ°Ñ‚Ğ¾ Ñ†Ñ–ĞºĞ°Ğ²Ğ¾Ğ³Ğ¾.\n\nĞœĞ¾Ñ— Ğ´Ñ€ÑƒĞ·Ñ– {Ğ¿Ğ¾ĞºĞ°Ğ·Ğ°Ğ»Ğ¸|Ğ¿Ğ¾ĞºĞ°Ğ·Ğ°Ğ»Ğ¸|Ğ¿Ğ¾ĞºĞ°Ğ·ÑƒĞ²Ğ°Ğ»Ğ¸|Ğ¿Ğ¾ĞºĞ°Ğ¶ÑƒÑ‚ÑŒ} Ğ¼ĞµĞ½Ñ– Ğ¼Ñ–ÑÑ‚Ğ¾, {ÑĞºĞµ|ÑĞºĞµ|ÑĞºĞ¸Ğ¹|ÑĞºĞ°} Ğ²Ğ¾Ğ½Ğ¸ Ğ´Ğ¾Ğ±Ñ€Ğµ Ğ·Ğ½Ğ°ÑÑ‚ÑŒ. ĞœĞ¸ {Ğ¿Ñ€Ğ¾Ğ¹ÑˆĞ»Ğ¸|Ğ¿Ñ€Ğ¾Ğ¹ÑˆĞ»Ğ¸|Ğ¿Ñ€Ğ¾Ñ…Ğ¾Ğ´Ğ¸Ğ»Ğ¸|Ğ¹ÑˆĞ»Ğ¸} Ñ‡ĞµÑ€ĞµĞ· ÑƒÑĞµ ÑÑ‚Ğ°Ñ€Ğµ Ğ¼Ñ–ÑÑ‚Ğ¾, {Ğ·ÑƒĞ¿Ğ¸Ğ½ÑÑÑ‡Ğ¸ÑÑŒ|Ğ·ÑƒĞ¿Ğ¸Ğ½ÑÑÑ‡Ğ¸ÑÑŒ|Ğ·ÑƒĞ¿Ğ¸Ğ½Ğ¸Ğ²ÑˆĞ¸ÑÑŒ|Ğ·ÑƒĞ¿Ğ¸Ğ½ÑÑ‚Ğ¸ÑÑ} Ğ±Ñ–Ğ»Ñ ĞºĞ¾Ğ¶Ğ½Ğ¾Ñ— Ğ¿Ğ°Ğ¼'ÑÑ‚ĞºĞ¸. {Ğ¥Ğ¾Ñ‡Ğ°|Ğ¥Ğ¾Ñ‡Ğ°|Ğ¢Ğ¾Ğ¼Ñƒ Ñ‰Ğ¾|Ğ§ĞµÑ€ĞµĞ·} Ğ¹ÑˆĞ¾Ğ² Ğ´Ğ¾Ñ‰, Ğ¼Ğ¸ Ğ½Ğµ {Ğ¿Ğ¾Ğ²ĞµÑ€Ñ‚Ğ°Ğ»Ğ¸ÑÑ|Ğ¿Ğ¾Ğ²ĞµÑ€Ñ‚Ğ°Ğ»Ğ¸ÑÑ|Ğ¿Ğ¾Ğ²ĞµÑ€Ğ½ÑƒĞ»Ğ¸ÑÑ|Ğ¿Ğ¾Ğ²ĞµÑ€Ñ‚Ğ°Ñ”Ğ¼Ğ¾ÑÑŒ} Ğ´Ğ¾Ğ´Ğ¾Ğ¼Ñƒ.\n\n---\n\n## group-sort: Ğ›ĞµĞºÑĞ¸Ñ‡Ğ½Ñ– Ğ´Ğ¾Ğ¼ĞµĞ½Ğ¸ B1\n\n> Ğ Ğ¾Ğ·Ğ¿Ğ¾Ğ´Ñ–Ğ»Ñ–Ñ‚ÑŒ ÑĞ»Ğ¾Ğ²Ğ° Ğ·Ğ° Ñ‚ĞµĞ¼Ğ°Ñ‚Ğ¸Ñ‡Ğ½Ğ¸Ğ¼Ğ¸ Ğ³Ñ€ÑƒĞ¿Ğ°Ğ¼Ğ¸, Ğ´Ğ¾ ÑĞºĞ¸Ñ… Ğ²Ğ¾Ğ½Ğ¸ Ğ½Ğ°Ğ»ĞµĞ¶Ğ°Ñ‚ÑŒ.\n\n### ĞĞ±ÑÑ‚Ñ€Ğ°ĞºÑ‚Ğ½Ñ– Ğ¿Ğ¾Ğ½ÑÑ‚Ñ‚Ñ\n\n- ÑĞ¿Ñ€Ğ°Ğ²ĞµĞ´Ğ»Ğ¸Ğ²Ñ–ÑÑ‚ÑŒ\n- Ğ³Ñ–Ğ¿Ğ¾Ñ‚ĞµĞ·Ğ°\n- ĞºĞ¾Ğ½Ñ†ĞµĞ¿Ñ†Ñ–Ñ\n- Ğ·Ğ½Ğ°Ñ‡ĞµĞ½Ğ½Ñ\n- Ğ´Ğ¾ÑĞ»Ñ–Ğ´Ğ¶ĞµĞ½Ğ½Ñ\n- ÑĞ²Ğ¾Ğ±Ğ¾Ğ´Ğ°\n- Ñ€Ñ–Ğ²Ğ½Ñ–ÑÑ‚ÑŒ\n\n### Ğ”Ğ¸ÑĞºÑƒÑ€ÑĞ¸Ğ²Ğ½Ñ– Ğ¼Ğ°Ñ€ĞºĞµÑ€Ğ¸\n\n- Ğ¿Ğ¾-Ğ¿ĞµÑ€ÑˆĞµ\n- Ğ¾Ğ´Ğ½Ğ°Ğº\n- Ğ¾Ñ‚Ğ¶Ğµ\n- Ğ· Ñ–Ğ½ÑˆĞ¾Ğ³Ğ¾ Ğ±Ğ¾ĞºÑƒ\n- Ğ½Ğ°ÑĞ°Ğ¼ĞºÑ–Ğ½ĞµÑ†ÑŒ\n- Ğ´Ğ¾ Ñ€ĞµÑ‡Ñ–\n- Ñ‚Ğ¾Ğ±Ñ‚Ğ¾\n\n### ĞŸÑ€Ğ¾Ñ„ĞµÑÑ–Ğ¹Ğ½Ğ° Ğ»ĞµĞºÑĞ¸ĞºĞ°\n\n- ÑĞ¿Ñ–Ğ²Ğ±ĞµÑÑ–Ğ´Ğ°\n- Ñ€ĞµĞ·ÑĞ¼Ğµ\n- Ğ²Ğ°ĞºĞ°Ğ½ÑÑ–Ñ\n- ÑÑ‚Ñ€Ğ°Ñ‚ĞµĞ³Ñ–Ñ\n- Ğ¼ĞµĞ½ĞµĞ´Ğ¶ĞµÑ€\n- ĞºĞ¾Ğ»ĞµĞ³Ğ°\n- Ğ¿Ñ€Ğ¾ĞµĞºÑ‚\n\n### ĞšÑƒĞ»ÑŒÑ‚ÑƒÑ€Ğ° Ñ‚Ğ° Ñ€ĞµĞ³Ñ–Ğ¾Ğ½Ğ¸\n\n- ĞšĞ°Ñ€Ğ¿Ğ°Ñ‚Ğ¸\n- Ğ²Ğ¸ÑˆĞ¸Ğ²Ğ°Ğ½ĞºĞ°\n- Ğ“Ğ¾Ğ²ĞµÑ€Ğ»Ğ°\n- Ğ±Ğ°Ğ½Ğ´ÑƒÑ€Ğ°\n- Ğ¿Ğ¸ÑĞ°Ğ½ĞºĞ°\n- Ğ›ÑŒĞ²Ñ–Ğ²\n- ĞĞ´ĞµÑĞ°\n\n### Ğ•Ğ¼Ğ¾Ñ†Ñ–Ñ— Ñ‚Ğ° ÑÑ‚Ğ¾ÑÑƒĞ½ĞºĞ¸\n\n- Ğ·Ğ°Ñ…Ğ¾Ğ¿Ğ»ĞµĞ½Ğ½Ñ\n- Ñ€Ğ¾Ğ·Ñ‡Ğ°Ñ€ÑƒĞ²Ğ°Ğ½Ğ½Ñ\n- Ğ½Ñ–Ğ¶Ğ½Ñ–ÑÑ‚ÑŒ\n- Ğ´Ğ¾Ğ²Ñ–Ñ€Ğ°\n- Ğ¿Ñ€Ğ¸Ğ²'ÑĞ·Ğ°Ğ½Ñ–ÑÑ‚ÑŒ\n- Ñ€Ğ°Ğ´Ñ–ÑÑ‚ÑŒ\n- ÑÑƒĞ¼\n\n---\n\n## unjumble: Ğ¡ĞºĞ»Ğ°Ğ´Ğ½Ñ– Ñ€ĞµÑ‡ĞµĞ½Ğ½Ñ B1\n\n> ĞŸĞ¾ÑÑ‚Ğ°Ğ²Ñ‚Ğµ ÑĞ»Ğ¾Ğ²Ğ° Ñƒ Ğ¿Ñ€Ğ°Ğ²Ğ¸Ğ»ÑŒĞ½Ğ¾Ğ¼Ñƒ Ğ¿Ğ¾Ñ€ÑĞ´ĞºÑƒ, Ñ‰Ğ¾Ğ± ÑƒÑ‚Ğ²Ğ¾Ñ€Ğ¸Ñ‚Ğ¸ Ğ³Ñ€Ğ°Ğ¼Ğ°Ñ‚Ğ¸Ñ‡Ğ½Ğ¾ Ğ¿Ñ€Ğ°Ğ²Ğ¸Ğ»ÑŒĞ½Ğµ Ñ€ĞµÑ‡ĞµĞ½Ğ½Ñ.\n\n1. Ñ / Ğ¾Ğ´Ñ€Ğ°Ğ·Ñƒ / Ğ¿Ñ€Ğ¸Ñ—Ğ´Ñƒ / ĞºĞ¾Ğ»Ğ¸ / Ğ´Ğ¾Ğ´Ğ¾Ğ¼Ñƒ / Ğ·Ğ°Ñ‚ĞµĞ»ĞµÑ„Ğ¾Ğ½ÑƒÑ / Ñ‚Ğ¾Ğ±Ñ– / ÑÑŒĞ¾Ğ³Ğ¾Ğ´Ğ½Ñ– / Ğ²ĞµÑ‡ĞµÑ€Ñ– / Ğ¿Ñ–ÑĞ»Ñ / Ñ / ÑƒĞ²ĞµÑ‡ĞµÑ€Ñ–\n   > [!answer] ĞšĞ¾Ğ»Ğ¸ Ñ Ğ¿Ñ€Ğ¸Ñ—Ğ´Ñƒ Ğ´Ğ¾Ğ´Ğ¾Ğ¼Ñƒ Ğ¿Ñ–ÑĞ»Ñ Ğ²ĞµÑ‡ĞµÑ€Ñ– ÑÑŒĞ¾Ğ³Ğ¾Ğ´Ğ½Ñ– ÑƒĞ²ĞµÑ‡ĞµÑ€Ñ–, Ñ Ğ¾Ğ´Ñ€Ğ°Ğ·Ñƒ Ğ·Ğ°Ñ‚ĞµĞ»ĞµÑ„Ğ¾Ğ½ÑƒÑ Ñ‚Ğ¾Ğ±Ñ–.\n\n2. Ğ²Ñ–Ğ½ / Ğ½Ğµ / Ğ¿Ñ€Ğ¸Ğ¹ÑˆĞ¾Ğ² / Ğ½Ğ° / Ğ·Ğ°Ğ½ÑÑ‚Ñ‚Ñ / Ñ‚Ğ¾Ğ¼Ñƒ / Ñ‰Ğ¾ / Ğ±ÑƒĞ² / Ñ…Ğ²Ğ¾Ñ€Ğ¸Ğ¹ / ÑÑŒĞ¾Ğ³Ğ¾Ğ´Ğ½Ñ– / Ñ– / Ğ²Ñ‡Ğ¾Ñ€Ğ°\n   > [!answer] Ğ’Ñ–Ğ½ Ğ½Ğµ Ğ¿Ñ€Ğ¸Ğ¹ÑˆĞ¾Ğ² Ğ½Ğ° Ğ·Ğ°Ğ½ÑÑ‚Ñ‚Ñ Ñ‚Ğ¾Ğ¼Ñƒ, Ñ‰Ğ¾ Ğ±ÑƒĞ² Ñ…Ğ²Ğ¾Ñ€Ğ¸Ğ¹ ÑÑŒĞ¾Ğ³Ğ¾Ğ´Ğ½Ñ– Ñ– Ğ²Ñ‡Ğ¾Ñ€Ğ°.\n\n3. ÑĞºĞ±Ğ¸ / Ñ / Ğ¼Ğ°Ğ² / Ğ±Ñ–Ğ»ÑŒÑˆĞµ / Ñ‡Ğ°ÑÑƒ / Ğ²Ñ–Ğ»ÑŒĞ½Ğ¾Ğ³Ğ¾ / Ñ / Ğ± / Ñ‡Ğ¸Ñ‚Ğ°Ğ² / Ğ±Ñ–Ğ»ÑŒÑˆĞµ / ĞºĞ½Ğ¸Ğ³ / Ñ‰Ğ¾Ğ´Ğ½Ñ\n   > [!answer] Ğ¯ĞºĞ±Ğ¸ Ñ Ğ¼Ğ°Ğ² Ğ±Ñ–Ğ»ÑŒÑˆĞµ Ğ²Ñ–Ğ»ÑŒĞ½Ğ¾Ğ³Ğ¾ Ñ‡Ğ°ÑÑƒ, Ñ Ğ± Ñ‡Ğ¸Ñ‚Ğ°Ğ² Ğ±Ñ–Ğ»ÑŒÑˆĞµ ĞºĞ½Ğ¸Ğ³ Ñ‰Ğ¾Ğ´Ğ½Ñ.\n\n4. Ñ†Ğµ / Ñ‚Ğ¾Ğ¹ / Ğ´ÑƒĞ¶Ğµ / Ñ‚Ğ°Ğ»Ğ°Ğ½Ğ¾Ğ²Ğ¸Ñ‚Ğ¸Ğ¹ / ÑÑ‚ÑƒĞ´ĞµĞ½Ñ‚ / ÑĞºĞ¸Ğ¹ / Ğ¾Ñ‚Ñ€Ğ¸Ğ¼Ğ°Ğ² / Ğ½Ğ°Ğ¹ĞºÑ€Ğ°Ñ‰Ñƒ / Ğ¾Ñ†Ñ–Ğ½ĞºÑƒ / Ğ½Ğ° / Ñ–ÑĞ¿Ğ¸Ñ‚Ñ– / Ğ²Ñ‡Ğ¾Ñ€Ğ°\n   > [!answer] Ğ¦Ğµ Ñ‚Ğ¾Ğ¹ Ğ´ÑƒĞ¶Ğµ Ñ‚Ğ°Ğ»Ğ°Ğ½Ğ¾Ğ²Ğ¸Ñ‚Ğ¸Ğ¹ ÑÑ‚ÑƒĞ´ĞµĞ½Ñ‚, ÑĞºĞ¸Ğ¹ Ğ¾Ñ‚Ñ€Ğ¸Ğ¼Ğ°Ğ² Ğ½Ğ°Ğ¹ĞºÑ€Ğ°Ñ‰Ñƒ Ğ¾Ñ†Ñ–Ğ½ĞºÑƒ Ğ½Ğ° Ñ–ÑĞ¿Ğ¸Ñ‚Ñ– Ğ²Ñ‡Ğ¾Ñ€Ğ°.\n\n5. Ğ½ĞµĞ·Ğ²Ğ°Ğ¶Ğ°ÑÑ‡Ğ¸ / Ğ½Ğ° / Ñ‚Ğµ / Ñ‰Ğ¾ / ÑĞ¸Ğ»ÑŒĞ½Ğ¾ / Ğ¹ÑˆĞ¾Ğ² / Ğ´Ğ¾Ñ‰ / Ğ¼Ğ¸ / Ğ¿Ñ–ÑˆĞ»Ğ¸ / Ğ½Ğ° / Ğ´Ğ¾Ğ²Ğ³Ñƒ / Ğ¿Ñ€Ğ¾Ğ³ÑƒĞ»ÑĞ½ĞºÑƒ\n   > [!answer] ĞĞµĞ·Ğ²Ğ°Ğ¶Ğ°ÑÑ‡Ğ¸ Ğ½Ğ° Ñ‚Ğµ, Ñ‰Ğ¾ ÑĞ¸Ğ»ÑŒĞ½Ğ¾ Ğ¹ÑˆĞ¾Ğ² Ğ´Ğ¾Ñ‰, Ğ¼Ğ¸ Ğ¿Ñ–ÑˆĞ»Ğ¸ Ğ½Ğ° Ğ´Ğ¾Ğ²Ğ³Ñƒ Ğ¿Ñ€Ğ¾Ğ³ÑƒĞ»ÑĞ½ĞºÑƒ.\n\n6. ĞºĞ½Ğ¸Ğ³Ğ° / Ğ½Ğ°Ğ¿Ğ¸ÑĞ°Ğ½Ğ° / Ğ²Ğ¸Ğ´Ğ°Ñ‚Ğ½Ğ¸Ğ¼ / Ğ²Ñ–Ğ´Ğ¾Ğ¼Ğ¸Ğ¼ / ÑƒĞºÑ€Ğ°Ñ—Ğ½ÑÑŒĞºĞ¸Ğ¼ / Ğ°Ğ²Ñ‚Ğ¾Ñ€Ğ¾Ğ¼ / ÑÑ‚Ğ°Ğ»Ğ° / Ğ±ĞµÑÑ‚ÑĞµĞ»ĞµÑ€Ğ¾Ğ¼ / Ğ¼Ğ¸Ğ½ÑƒĞ»Ğ¾Ğ³Ğ¾ / Ñ€Ğ¾ĞºÑƒ / Ğ² / Ğ£ĞºÑ€Ğ°Ñ—Ğ½Ñ–\n   > [!answer] ĞšĞ½Ğ¸Ğ³Ğ°, Ğ½Ğ°Ğ¿Ğ¸ÑĞ°Ğ½Ğ° Ğ²Ğ¸Ğ´Ğ°Ñ‚Ğ½Ğ¸Ğ¼ Ğ²Ñ–Ğ´Ğ¾Ğ¼Ğ¸Ğ¼ ÑƒĞºÑ€Ğ°Ñ—Ğ½ÑÑŒĞºĞ¸Ğ¼ Ğ°Ğ²Ñ‚Ğ¾Ñ€Ğ¾Ğ¼, ÑÑ‚Ğ°Ğ»Ğ° Ğ±ĞµÑÑ‚ÑĞµĞ»ĞµÑ€Ğ¾Ğ¼ Ğ¼Ğ¸Ğ½ÑƒĞ»Ğ¾Ğ³Ğ¾ Ñ€Ğ¾ĞºÑƒ Ğ² Ğ£ĞºÑ€Ğ°Ñ—Ğ½Ñ–.\n\n7. Ğ²Ğ¾Ğ½Ğ° / Ğ´ÑƒĞ¶Ğµ / Ñ…Ğ¾Ñ‡Ğµ / Ñ‰Ğ¾Ğ± / Ñ—Ñ— / Ğ´Ñ–Ñ‚Ğ¸ / Ğ²Ğ¸Ğ²Ñ‡Ğ°Ğ»Ğ¸ / ÑƒĞºÑ€Ğ°Ñ—Ğ½ÑÑŒĞºÑƒ / Ğ¼Ğ¾Ğ²Ñƒ / Ğ· / Ñ€Ğ°Ğ½Ğ½ÑŒĞ¾Ğ³Ğ¾ / Ğ´Ğ¸Ñ‚Ğ¸Ğ½ÑÑ‚Ğ²Ğ°\n   > [!answer] Ğ’Ğ¾Ğ½Ğ° Ğ´ÑƒĞ¶Ğµ Ñ…Ğ¾Ñ‡Ğµ, Ñ‰Ğ¾Ğ± Ñ—Ñ— Ğ´Ñ–Ñ‚Ğ¸ Ğ²Ğ¸Ğ²Ñ‡Ğ°Ğ»Ğ¸ ÑƒĞºÑ€Ğ°Ñ—Ğ½ÑÑŒĞºÑƒ Ğ¼Ğ¾Ğ²Ñƒ Ğ· Ñ€Ğ°Ğ½Ğ½ÑŒĞ¾Ğ³Ğ¾ Ğ´Ğ¸Ñ‚Ğ¸Ğ½ÑÑ‚Ğ²Ğ°.\n\n8. ÑƒĞ²Ğ°Ğ¶Ğ½Ğ¾ / Ğ¿Ñ€Ğ¾Ñ‡Ğ¸Ñ‚Ğ°Ğ²ÑˆĞ¸ / Ñ†Ñ / Ğ²Ğ°Ğ¶Ğ»Ğ¸Ğ²Ñƒ / ÑÑ‚Ğ°Ñ‚Ñ‚Ñ / Ğ²Ñ–Ğ½ / Ğ·Ñ€Ğ¾Ğ·ÑƒĞ¼Ñ–Ğ² / Ğ²Ğ°Ğ¶Ğ»Ğ¸Ğ²Ñ–ÑÑ‚ÑŒ / Ñ†Ñ–Ñ”Ñ— / Ğ¿Ñ€Ğ¾Ğ±Ğ»ĞµĞ¼Ğ¸ / Ğ´Ğ»Ñ / Ğ£ĞºÑ€Ğ°Ñ—Ğ½Ğ¸\n   > [!answer] Ğ£Ğ²Ğ°Ğ¶Ğ½Ğ¾ Ğ¿Ñ€Ğ¾Ñ‡Ğ¸Ñ‚Ğ°Ğ²ÑˆĞ¸ Ñ†Ñ Ğ²Ğ°Ğ¶Ğ»Ğ¸Ğ²Ñƒ ÑÑ‚Ğ°Ñ‚Ñ‚Ñ, Ğ²Ñ–Ğ½ Ğ·Ñ€Ğ¾Ğ·ÑƒĞ¼Ñ–Ğ² Ğ²Ğ°Ğ¶Ğ»Ğ¸Ğ²Ñ–ÑÑ‚ÑŒ Ñ†Ñ–Ñ”Ñ— Ğ¿Ñ€Ğ¾Ğ±Ğ»ĞµĞ¼Ğ¸ Ğ´Ğ»Ñ Ğ£ĞºÑ€Ğ°Ñ—Ğ½Ğ¸.\n\n9. Ñ…Ğ¾Ñ‡Ğ° / Ğ²Ñ–Ğ½ / Ğ´ÑƒĞ¶Ğµ / Ğ±Ğ°Ğ³Ğ°Ñ‚Ğ¾ / Ğ¿Ñ€Ğ°Ñ†ÑÑ” / Ğ²Ñ–Ğ½ / Ğ·Ğ°Ğ²Ğ¶Ğ´Ğ¸ / Ğ·Ğ½Ğ°Ñ…Ğ¾Ğ´Ğ¸Ñ‚ÑŒ / Ğ²Ñ–Ğ»ÑŒĞ½Ğ¸Ğ¹ / Ñ‡Ğ°Ñ / Ğ´Ğ»Ñ / ÑÑ–Ğ¼'Ñ—\n   > [!answer] Ğ¥Ğ¾Ñ‡Ğ° Ğ²Ñ–Ğ½ Ğ´ÑƒĞ¶Ğµ Ğ±Ğ°Ğ³Ğ°Ñ‚Ğ¾ Ğ¿Ñ€Ğ°Ñ†ÑÑ”, Ğ²Ñ–Ğ½ Ğ·Ğ°Ğ²Ğ¶Ğ´Ğ¸ Ğ·Ğ½Ğ°Ñ…Ğ¾Ğ´Ğ¸Ñ‚ÑŒ Ğ²Ñ–Ğ»ÑŒĞ½Ğ¸Ğ¹ Ñ‡Ğ°Ñ Ğ´Ğ»Ñ ÑÑ–Ğ¼'Ñ—.\n\n10. Ğ¿ĞµÑ€Ñˆ / Ğ½Ñ–Ğ¶ / Ğ¿Ñ€Ğ¸Ğ¹Ğ½ÑÑ‚Ğ¸ / Ğ²Ğ°Ğ¶Ğ»Ğ¸Ğ²Ğµ / Ñ€Ñ–ÑˆĞµĞ½Ğ½Ñ / Ğ²Ğ°Ğ¼ / Ğ¾Ğ±Ğ¾Ğ²'ÑĞ·ĞºĞ¾Ğ²Ğ¾ / Ğ¿Ğ¾Ñ‚Ñ€Ñ–Ğ±Ğ½Ğ¾ / Ğ´Ğ¾Ğ±Ñ€Ğµ / Ğ¿Ğ¾Ğ´ÑƒĞ¼Ğ°Ñ‚Ğ¸ / Ğ¿Ñ€Ğ¾ / Ğ½Ğ°ÑĞ»Ñ–Ğ´ĞºĞ¸\n    > [!answer] ĞŸĞµÑ€Ñˆ Ğ½Ñ–Ğ¶ Ğ¿Ñ€Ğ¸Ğ¹Ğ½ÑÑ‚Ğ¸ Ğ²Ğ°Ğ¶Ğ»Ğ¸Ğ²Ğµ Ñ€Ñ–ÑˆĞµĞ½Ğ½Ñ, Ğ²Ğ°Ğ¼ Ğ¾Ğ±Ğ¾Ğ²'ÑĞ·ĞºĞ¾Ğ²Ğ¾ Ğ¿Ğ¾Ñ‚Ñ€Ñ–Ğ±Ğ½Ğ¾ Ğ´Ğ¾Ğ±Ñ€Ğµ Ğ¿Ğ¾Ğ´ÑƒĞ¼Ğ°Ñ‚Ğ¸ Ğ¿Ñ€Ğ¾ Ğ½Ğ°ÑĞ»Ñ–Ğ´ĞºĞ¸.\n\n---\n\n## translate: ĞšĞ¾Ğ¼Ğ¿Ğ»ĞµĞºÑĞ½Ğ¸Ğ¹ Ğ¿ĞµÑ€ĞµĞºĞ»Ğ°Ğ´ B1\n\n> ĞĞ±ĞµÑ€Ñ–Ñ‚ÑŒ Ğ½Ğ°Ğ¹ĞºÑ€Ğ°Ñ‰Ğ¸Ğ¹ Ğ¿ĞµÑ€ĞµĞºĞ»Ğ°Ğ´ Ñ€ĞµÑ‡ĞµĞ½Ğ½Ñ ÑƒĞºÑ€Ğ°Ñ—Ğ½ÑÑŒĞºĞ¾Ñ Ğ¼Ğ¾Ğ²Ğ¾Ñ, ÑĞºĞ¸Ğ¹ Ğ´ĞµĞ¼Ğ¾Ğ½ÑÑ‚Ñ€ÑƒÑ” Ğ¿Ñ€Ğ°Ğ²Ğ¸Ğ»ÑŒĞ½Ğµ Ğ²Ğ¸ĞºĞ¾Ñ€Ğ¸ÑÑ‚Ğ°Ğ½Ğ½Ñ Ğ³Ñ€Ğ°Ğ¼Ğ°Ñ‚Ğ¸ĞºĞ¸ B1.\n\n1. I want you to come to the meeting at three o'clock.\n   - [ ] Ğ¯ Ñ…Ğ¾Ñ‡Ñƒ, Ñ‰Ğ¾ Ñ‚Ğ¸ Ğ¿Ñ€Ğ¸Ğ¹ÑˆĞ¾Ğ² Ğ½Ğ° Ğ·ÑƒÑÑ‚Ñ€Ñ–Ñ‡ Ğ¾ Ñ‚Ñ€ĞµÑ‚Ñ–Ğ¹ Ğ³Ğ¾Ğ´Ğ¸Ğ½Ñ–.\n   - [x] Ğ¯ Ñ…Ğ¾Ñ‡Ñƒ, Ñ‰Ğ¾Ğ± Ñ‚Ğ¸ Ğ¿Ñ€Ğ¸Ğ¹ÑˆĞ¾Ğ² Ğ½Ğ° Ğ·ÑƒÑÑ‚Ñ€Ñ–Ñ‡ Ğ¾ Ñ‚Ñ€ĞµÑ‚Ñ–Ğ¹ Ğ³Ğ¾Ğ´Ğ¸Ğ½Ñ–.\n   - [ ] Ğ¯ Ñ…Ğ¾Ñ‡Ñƒ, ĞºĞ¾Ğ»Ğ¸ Ñ‚Ğ¸ Ğ¿Ñ€Ğ¸Ğ¹ÑˆĞ¾Ğ² Ğ½Ğ° Ğ·ÑƒÑÑ‚Ñ€Ñ–Ñ‡ Ğ¾ Ñ‚Ñ€ĞµÑ‚Ñ–Ğ¹ Ğ³Ğ¾Ğ´Ğ¸Ğ½Ñ–.\n   - [ ] Ğ¯ Ñ…Ğ¾Ñ‡Ñƒ, ÑĞºĞ±Ğ¸ Ñ‚Ğ¸ Ğ¿Ñ€Ğ¸Ğ¹ÑˆĞ¾Ğ² Ğ½Ğ° Ğ·ÑƒÑÑ‚Ñ€Ñ–Ñ‡ Ğ¾ Ñ‚Ñ€ĞµÑ‚Ñ–Ğ¹ Ğ³Ğ¾Ğ´Ğ¸Ğ½Ñ–.\n   > Ğ”Ğ»Ñ Ğ²Ğ¸Ñ€Ğ°Ğ¶ĞµĞ½Ğ½Ñ Ğ±Ğ°Ğ¶Ğ°Ğ½Ğ½Ñ Ğ²Ğ¸ĞºĞ¾Ñ€Ğ¸ÑÑ‚Ğ¾Ğ²ÑƒÑ”Ñ‚ÑŒÑÑ Â«Ñ‰Ğ¾Ğ±Â» + Ğ¼Ğ¸Ğ½ÑƒĞ»Ğ¸Ğ¹ Ñ‡Ğ°Ñ.\n\n2. If I had more time, I would help you with this project.\n   - [ ] Ğ¯ĞºÑ‰Ğ¾ Ñ Ğ¼Ğ°Ñ Ğ±Ñ–Ğ»ÑŒÑˆĞµ Ñ‡Ğ°ÑÑƒ, Ñ Ğ´Ğ¾Ğ¿Ğ¾Ğ¼Ğ¾Ğ¶Ñƒ Ñ‚Ğ¾Ğ±Ñ– Ğ· Ñ†Ğ¸Ğ¼ Ğ¿Ñ€Ğ¾ĞµĞºÑ‚Ğ¾Ğ¼.\n   - [ ] Ğ¯ĞºÑ‰Ğ¾ Ğ± Ñ Ğ¼Ğ°Ğ² Ğ±Ñ–Ğ»ÑŒÑˆĞµ Ñ‡Ğ°ÑÑƒ, Ñ Ğ´Ğ¾Ğ¿Ğ¾Ğ¼Ğ°Ğ³Ğ°Ñ Ñ‚Ğ¾Ğ±Ñ– Ğ· Ñ†Ğ¸Ğ¼ Ğ¿Ñ€Ğ¾ĞµĞºÑ‚Ğ¾Ğ¼.\n   - [x] Ğ¯ĞºĞ±Ğ¸ Ñ Ğ¼Ğ°Ğ² Ğ±Ñ–Ğ»ÑŒÑˆĞµ Ñ‡Ğ°ÑÑƒ, Ñ Ğ± Ğ´Ğ¾Ğ¿Ğ¾Ğ¼Ñ–Ğ³ Ñ‚Ğ¾Ğ±Ñ– Ğ· Ñ†Ğ¸Ğ¼ Ğ¿Ñ€Ğ¾ĞµĞºÑ‚Ğ¾Ğ¼.\n   - [ ] ĞšĞ¾Ğ»Ğ¸ Ñ Ğ¼Ğ°Ğ² Ğ±Ñ–Ğ»ÑŒÑˆĞµ Ñ‡Ğ°ÑÑƒ, Ñ Ğ´Ğ¾Ğ¿Ğ¾Ğ¼Ñ–Ğ³ Ñ‚Ğ¾Ğ±Ñ– Ğ· Ñ†Ğ¸Ğ¼ Ğ¿Ñ€Ğ¾ĞµĞºÑ‚Ğ¾Ğ¼.\n   > ĞĞµÑ€ĞµĞ°Ğ»ÑŒĞ½Ğ° ÑƒĞ¼Ğ¾Ğ²Ğ°: Â«Ğ¯ĞºĞ±Ğ¸Â» + Ğ¼Ğ¸Ğ½ÑƒĞ»Ğ¸Ğ¹ Ñ‡Ğ°Ñ + Â«Ğ±Â» + Ğ¼Ğ¸Ğ½ÑƒĞ»Ğ¸Ğ¹ Ñ‡Ğ°Ñ.\n\n3. The book written by this author became a bestseller last year.\n   - [ ] ĞšĞ½Ğ¸Ğ³Ğ°, ÑĞºÑƒ Ğ¿Ğ¸ÑĞ°Ğ² Ñ†ĞµĞ¹ Ğ°Ğ²Ñ‚Ğ¾Ñ€, ÑÑ‚Ğ°Ğ»Ğ° Ğ±ĞµÑÑ‚ÑĞµĞ»ĞµÑ€Ğ¾Ğ¼ Ğ¼Ğ¸Ğ½ÑƒĞ»Ğ¾Ğ³Ğ¾ Ñ€Ğ¾ĞºÑƒ.\n   - [x] ĞšĞ½Ğ¸Ğ³Ğ°, Ğ½Ğ°Ğ¿Ğ¸ÑĞ°Ğ½Ğ° Ñ†Ğ¸Ğ¼ Ğ°Ğ²Ñ‚Ğ¾Ñ€Ğ¾Ğ¼, ÑÑ‚Ğ°Ğ»Ğ° Ğ±ĞµÑÑ‚ÑĞµĞ»ĞµÑ€Ğ¾Ğ¼ Ğ¼Ğ¸Ğ½ÑƒĞ»Ğ¾Ğ³Ğ¾ Ñ€Ğ¾ĞºÑƒ.\n   - [ ] ĞšĞ½Ğ¸Ğ³Ğ°, Ğ¿Ğ¸ÑˆÑƒÑ‡Ğ¸ Ñ†Ğ¸Ğ¼ Ğ°Ğ²Ñ‚Ğ¾Ñ€Ğ¾Ğ¼, ÑÑ‚Ğ°Ğ»Ğ° Ğ±ĞµÑÑ‚ÑĞµĞ»ĞµÑ€Ğ¾Ğ¼ Ğ¼Ğ¸Ğ½ÑƒĞ»Ğ¾Ğ³Ğ¾ Ñ€Ğ¾ĞºÑƒ.\n   - [ ] ĞšĞ½Ğ¸Ğ³Ğ°, Ñ‰Ğ¾ Ğ½Ğ°Ğ¿Ğ¸ÑĞ°Ğ»Ğ° Ñ†ĞµĞ¹ Ğ°Ğ²Ñ‚Ğ¾Ñ€, ÑÑ‚Ğ°Ğ»Ğ° Ğ±ĞµÑÑ‚ÑĞµĞ»ĞµÑ€Ğ¾Ğ¼ Ğ¼Ğ¸Ğ½ÑƒĞ»Ğ¾Ğ³Ğ¾ Ñ€Ğ¾ĞºÑƒ.\n   > ĞŸĞ°ÑĞ¸Ğ²Ğ½Ğ¸Ğ¹ Ğ´Ñ–Ñ”Ğ¿Ñ€Ğ¸ĞºĞ¼ĞµÑ‚Ğ½Ğ¸Ğº: Â«Ğ½Ğ°Ğ¿Ğ¸ÑĞ°Ğ½Ğ°Â» ÑƒĞ·Ğ³Ğ¾Ğ´Ğ¶ÑƒÑ”Ñ‚ÑŒÑÑ Ğ· Â«ĞºĞ½Ğ¸Ğ³Ğ°Â».\n\n4. While reading the book, I was listening to music.\n   - [ ] ĞŸÑ€Ğ¾Ñ‡Ğ¸Ñ‚Ğ°Ğ²ÑˆĞ¸ ĞºĞ½Ğ¸Ğ³Ñƒ, Ñ ÑĞ»ÑƒÑ…Ğ°Ğ² Ğ¼ÑƒĞ·Ğ¸ĞºÑƒ.\n   - [x] Ğ§Ğ¸Ñ‚Ğ°ÑÑ‡Ğ¸ ĞºĞ½Ğ¸Ğ³Ñƒ, Ñ ÑĞ»ÑƒÑ…Ğ°Ğ² Ğ¼ÑƒĞ·Ğ¸ĞºÑƒ.\n   - [ ] Ğ§Ğ¸Ñ‚Ğ°Ñ‚Ğ¸ ĞºĞ½Ğ¸Ğ³Ñƒ, Ñ ÑĞ»ÑƒÑ…Ğ°Ğ² Ğ¼ÑƒĞ·Ğ¸ĞºÑƒ.\n   - [ ] ĞšĞ¾Ğ»Ğ¸ Ñ‡Ğ¸Ñ‚Ğ°Ñ ĞºĞ½Ğ¸Ğ³Ñƒ, Ñ ÑĞ»ÑƒÑ…Ğ°Ğ² Ğ¼ÑƒĞ·Ğ¸ĞºÑƒ.\n   > ĞĞ´Ğ½Ğ¾Ñ‡Ğ°ÑĞ½Ñ–ÑÑ‚ÑŒ: Ğ½ĞµĞ´Ğ¾ĞºĞ¾Ğ½Ğ°Ğ½Ğ¸Ğ¹ Ğ´Ñ–Ñ”Ğ¿Ñ€Ğ¸ÑĞ»Ñ–Ğ²Ğ½Ğ¸Ğº Â«Ñ‡Ğ¸Ñ‚Ğ°ÑÑ‡Ğ¸Â».\n\n5. Although it was raining, we went for a walk in the park.\n   - [x] Ğ¥Ğ¾Ñ‡Ğ° Ğ¹ÑˆĞ¾Ğ² Ğ´Ğ¾Ñ‰, Ğ¼Ğ¸ Ğ¿Ñ–ÑˆĞ»Ğ¸ Ğ½Ğ° Ğ¿Ñ€Ğ¾Ğ³ÑƒĞ»ÑĞ½ĞºÑƒ Ğ² Ğ¿Ğ°Ñ€Ğº.\n   - [ ] Ğ¢Ğ¾Ğ¼Ñƒ Ñ‰Ğ¾ Ğ¹ÑˆĞ¾Ğ² Ğ´Ğ¾Ñ‰, Ğ¼Ğ¸ Ğ¿Ñ–ÑˆĞ»Ğ¸ Ğ½Ğ° Ğ¿Ñ€Ğ¾Ğ³ÑƒĞ»ÑĞ½ĞºÑƒ Ğ² Ğ¿Ğ°Ñ€Ğº.\n   - [ ] Ğ¯ĞºÑ‰Ğ¾ Ğ¹ÑˆĞ¾Ğ² Ğ´Ğ¾Ñ‰, Ğ¼Ğ¸ Ğ¿Ñ–ÑˆĞ»Ğ¸ Ğ½Ğ° Ğ¿Ñ€Ğ¾Ğ³ÑƒĞ»ÑĞ½ĞºÑƒ Ğ² Ğ¿Ğ°Ñ€Ğº.\n   - [ ] ĞšĞ¾Ğ»Ğ¸ Ğ¹ÑˆĞ¾Ğ² Ğ´Ğ¾Ñ‰, Ğ¼Ğ¸ Ğ¿Ñ–ÑˆĞ»Ğ¸ Ğ½Ğ° Ğ¿Ñ€Ğ¾Ğ³ÑƒĞ»ÑĞ½ĞºÑƒ Ğ² Ğ¿Ğ°Ñ€Ğº.\n   > Ğ”Ğ¾Ğ¿ÑƒÑÑ‚Ğ¾Ğ²Ğµ Ğ·Ğ½Ğ°Ñ‡ĞµĞ½Ğ½Ñ: Â«Ğ¥Ğ¾Ñ‡Ğ°Â» Ğ²ĞºĞ°Ğ·ÑƒÑ” Ğ½Ğ° Ğ¿Ñ€Ğ¾Ñ‚Ğ¸ÑÑ‚Ğ°Ğ²Ğ»ĞµĞ½Ğ½Ñ.\n\n6. The plane takes off in an hour, so we must hurry to the airport.\n   - [ ] Ğ›Ñ–Ñ‚Ğ°Ğº Ğ²Ñ–Ğ´Ñ…Ğ¾Ğ´Ğ¸Ñ‚ÑŒ Ğ·Ğ° Ğ³Ğ¾Ğ´Ğ¸Ğ½Ñƒ, Ñ‚Ğ¾Ğ¼Ñƒ Ğ¼Ğ¸ Ğ¿Ğ¾Ğ²Ğ¸Ğ½Ğ½Ñ– Ğ¿Ğ¾ÑĞ¿Ñ–ÑˆĞ°Ñ‚Ğ¸.\n   - [x] Ğ›Ñ–Ñ‚Ğ°Ğº Ğ²Ñ–Ğ´Ğ»Ñ–Ñ‚Ğ°Ñ” Ğ·Ğ° Ğ³Ğ¾Ğ´Ğ¸Ğ½Ñƒ, Ñ‚Ğ¾Ğ¼Ñƒ Ğ¼Ğ¸ Ğ¿Ğ¾Ğ²Ğ¸Ğ½Ğ½Ñ– Ğ¿Ğ¾ÑĞ¿Ñ–ÑˆĞ°Ñ‚Ğ¸ Ğ´Ğ¾ Ğ°ĞµÑ€Ğ¾Ğ¿Ğ¾Ñ€Ñ‚Ñƒ.\n   - [ ] Ğ›Ñ–Ñ‚Ğ°Ğº Ğ²Ñ–Ğ´Ğ¿Ğ»Ğ¸Ğ²Ğ°Ñ” Ğ·Ğ° Ğ³Ğ¾Ğ´Ğ¸Ğ½Ñƒ, Ñ‚Ğ¾Ğ¼Ñƒ Ğ¼Ğ¸ Ğ¿Ğ¾Ğ²Ğ¸Ğ½Ğ½Ñ– Ğ¿Ğ¾ÑĞ¿Ñ–ÑˆĞ°Ñ‚Ğ¸.\n   - [ ] Ğ›Ñ–Ñ‚Ğ°Ğº Ğ²Ñ–Ğ´'Ñ—Ğ¶Ğ´Ğ¶Ğ°Ñ” Ğ·Ğ° Ğ³Ğ¾Ğ´Ğ¸Ğ½Ñƒ, Ñ‚Ğ¾Ğ¼Ñƒ Ğ¼Ğ¸ Ğ¿Ğ¾Ğ²Ğ¸Ğ½Ğ½Ñ– Ğ¿Ğ¾ÑĞ¿Ñ–ÑˆĞ°Ñ‚Ğ¸.\n   > Ğ”Ğ»Ñ Ğ»Ñ–Ñ‚Ğ°ĞºÑ–Ğ²: Â«Ğ²Ñ–Ğ´Ğ»Ñ–Ñ‚Ğ°Ñ‚Ğ¸Â», Ğ½Ğµ Â«Ğ²Ñ–Ğ´Ñ…Ğ¾Ğ´Ğ¸Ñ‚Ğ¸Â».\n\n7. I came to the restaurant at seven o'clock, but my friend had already left.\n   - [ ] Ğ¯ Ğ¿Ñ€Ğ¸Ñ…Ğ¾Ğ´Ğ¸Ğ² Ğ´Ğ¾ Ñ€ĞµÑÑ‚Ğ¾Ñ€Ğ°Ğ½Ñƒ Ğ¾ ÑÑŒĞ¾Ğ¼Ñ–Ğ¹ Ğ³Ğ¾Ğ´Ğ¸Ğ½Ñ–, Ğ°Ğ»Ğµ Ğ¼Ñ–Ğ¹ Ğ´Ñ€ÑƒĞ³ ÑƒĞ¶Ğµ Ğ¿Ñ–ÑˆĞ¾Ğ².\n   - [x] Ğ¯ Ğ¿Ñ€Ğ¸Ğ¹ÑˆĞ¾Ğ² Ğ´Ğ¾ Ñ€ĞµÑÑ‚Ğ¾Ñ€Ğ°Ğ½Ñƒ Ğ¾ ÑÑŒĞ¾Ğ¼Ñ–Ğ¹ Ğ³Ğ¾Ğ´Ğ¸Ğ½Ñ–, Ğ°Ğ»Ğµ Ğ¼Ñ–Ğ¹ Ğ´Ñ€ÑƒĞ³ ÑƒĞ¶Ğµ Ğ¿Ñ–ÑˆĞ¾Ğ².\n   - [ ] Ğ¯ Ğ¹ÑˆĞ¾Ğ² Ğ´Ğ¾ Ñ€ĞµÑÑ‚Ğ¾Ñ€Ğ°Ğ½Ñƒ Ğ¾ ÑÑŒĞ¾Ğ¼Ñ–Ğ¹ Ğ³Ğ¾Ğ´Ğ¸Ğ½Ñ–, Ğ°Ğ»Ğµ Ğ¼Ñ–Ğ¹ Ğ´Ñ€ÑƒĞ³ ÑƒĞ¶Ğµ Ğ¿Ñ–ÑˆĞ¾Ğ².\n   - [ ] Ğ¯ Ğ¿Ñ€Ğ¸Ñ…Ğ¾Ğ´Ğ¶Ñƒ Ğ´Ğ¾ Ñ€ĞµÑÑ‚Ğ¾Ñ€Ğ°Ğ½Ñƒ Ğ¾ ÑÑŒĞ¾Ğ¼Ñ–Ğ¹ Ğ³Ğ¾Ğ´Ğ¸Ğ½Ñ–, Ğ°Ğ»Ğµ Ğ¼Ñ–Ğ¹ Ğ´Ñ€ÑƒĞ³ ÑƒĞ¶Ğµ Ğ¿Ñ–ÑˆĞ¾Ğ².\n   > ĞĞ´Ğ½Ğ¾ĞºÑ€Ğ°Ñ‚Ğ½Ğ° Ğ·Ğ°Ğ²ĞµÑ€ÑˆĞµĞ½Ğ° Ğ´Ñ–Ñ: Â«Ğ¿Ñ€Ğ¸Ğ¹ÑˆĞ¾Ğ²Â».\n\n8. This is the student who received the best grade on the exam yesterday.\n   - [ ] Ğ¦Ğµ Ñ‚Ğ¾Ğ¹ ÑÑ‚ÑƒĞ´ĞµĞ½Ñ‚, Ñ…Ñ‚Ğ¾ Ğ¾Ñ‚Ñ€Ğ¸Ğ¼Ğ°Ğ² Ğ½Ğ°Ğ¹ĞºÑ€Ğ°Ñ‰Ñƒ Ğ¾Ñ†Ñ–Ğ½ĞºÑƒ Ğ½Ğ° Ñ–ÑĞ¿Ğ¸Ñ‚Ñ– Ğ²Ñ‡Ğ¾Ñ€Ğ°.\n   - [x] Ğ¦Ğµ Ñ‚Ğ¾Ğ¹ ÑÑ‚ÑƒĞ´ĞµĞ½Ñ‚, ÑĞºĞ¸Ğ¹ Ğ¾Ñ‚Ñ€Ğ¸Ğ¼Ğ°Ğ² Ğ½Ğ°Ğ¹ĞºÑ€Ğ°Ñ‰Ñƒ Ğ¾Ñ†Ñ–Ğ½ĞºÑƒ Ğ½Ğ° Ñ–ÑĞ¿Ğ¸Ñ‚Ñ– Ğ²Ñ‡Ğ¾Ñ€Ğ°.\n   - [ ] Ğ¦Ğµ Ñ‚Ğ¾Ğ¹ ÑÑ‚ÑƒĞ´ĞµĞ½Ñ‚, Ñ‰Ğ¾ Ğ²Ñ–Ğ½ Ğ¾Ñ‚Ñ€Ğ¸Ğ¼Ğ°Ğ² Ğ½Ğ°Ğ¹ĞºÑ€Ğ°Ñ‰Ñƒ Ğ¾Ñ†Ñ–Ğ½ĞºÑƒ Ğ½Ğ° Ñ–ÑĞ¿Ğ¸Ñ‚Ñ– Ğ²Ñ‡Ğ¾Ñ€Ğ°.\n   - [ ] Ğ¦Ğµ Ñ‚Ğ¾Ğ¹ ÑÑ‚ÑƒĞ´ĞµĞ½Ñ‚, ĞºĞ¾Ñ‚Ñ€Ğ° Ğ¾Ñ‚Ñ€Ğ¸Ğ¼Ğ°Ğ»Ğ° Ğ½Ğ°Ğ¹ĞºÑ€Ğ°Ñ‰Ñƒ Ğ¾Ñ†Ñ–Ğ½ĞºÑƒ Ğ½Ğ° Ñ–ÑĞ¿Ğ¸Ñ‚Ñ– Ğ²Ñ‡Ğ¾Ñ€Ğ°.\n   > Ğ’ Ğ¾Ğ·Ğ½Ğ°Ñ‡Ğ°Ğ»ÑŒĞ½Ğ¸Ñ… Ñ€ĞµÑ‡ĞµĞ½Ğ½ÑÑ…: Â«ÑĞºĞ¸Ğ¹Â», Ğ½Ğµ Â«Ñ…Ñ‚Ğ¾Â».\n\n9. Having finished the work, she went home to rest after a long day.\n   - [ ] Ğ—Ğ°ĞºÑ–Ğ½Ñ‡ÑƒÑÑ‡Ğ¸ Ñ€Ğ¾Ğ±Ğ¾Ñ‚Ñƒ, Ğ²Ğ¾Ğ½Ğ° Ğ¿Ñ–ÑˆĞ»Ğ° Ğ´Ğ¾Ğ´Ğ¾Ğ¼Ñƒ Ğ²Ñ–Ğ´Ğ¿Ğ¾Ñ‡Ğ¸Ğ²Ğ°Ñ‚Ğ¸.\n   - [x] Ğ—Ğ°ĞºÑ–Ğ½Ñ‡Ğ¸Ğ²ÑˆĞ¸ Ñ€Ğ¾Ğ±Ğ¾Ñ‚Ñƒ, Ğ²Ğ¾Ğ½Ğ° Ğ¿Ñ–ÑˆĞ»Ğ° Ğ´Ğ¾Ğ´Ğ¾Ğ¼Ñƒ Ğ²Ñ–Ğ´Ğ¿Ğ¾Ñ‡Ğ¸Ğ²Ğ°Ñ‚Ğ¸ Ğ¿Ñ–ÑĞ»Ñ Ğ´Ğ¾Ğ²Ğ³Ğ¾Ğ³Ğ¾ Ğ´Ğ½Ñ.\n   - [ ] Ğ—Ğ°ĞºÑ–Ğ½Ñ‡Ğ¸Ñ‚Ğ¸ Ñ€Ğ¾Ğ±Ğ¾Ñ‚Ñƒ, Ğ²Ğ¾Ğ½Ğ° Ğ¿Ñ–ÑˆĞ»Ğ° Ğ´Ğ¾Ğ´Ğ¾Ğ¼Ñƒ Ğ²Ñ–Ğ´Ğ¿Ğ¾Ñ‡Ğ¸Ğ²Ğ°Ñ‚Ğ¸.\n   - [ ] ĞšĞ¾Ğ»Ğ¸ Ğ·Ğ°ĞºÑ–Ğ½Ñ‡Ğ¸Ğ»Ğ° Ñ€Ğ¾Ğ±Ğ¾Ñ‚Ñƒ, Ğ²Ğ¾Ğ½Ğ° Ğ¿Ñ–ÑˆĞ»Ğ° Ğ´Ğ¾Ğ´Ğ¾Ğ¼Ñƒ Ğ²Ñ–Ğ´Ğ¿Ğ¾Ñ‡Ğ¸Ğ²Ğ°Ñ‚Ğ¸.\n   > ĞŸĞ¾Ğ¿ĞµÑ€ĞµĞ´Ğ½Ñ–ÑÑ‚ÑŒ: Ğ´Ğ¾ĞºĞ¾Ğ½Ğ°Ğ½Ğ¸Ğ¹ Ğ´Ñ–Ñ”Ğ¿Ñ€Ğ¸ÑĞ»Ñ–Ğ²Ğ½Ğ¸Ğº Â«Ğ·Ğ°ĞºÑ–Ğ½Ñ‡Ğ¸Ğ²ÑˆĞ¸Â».\n\n10. Before making a decision, you need to think carefully about the consequences.\n    - [ ] ĞšĞ¾Ğ»Ğ¸ Ğ¿Ñ€Ğ¸Ğ¹Ğ¼Ğ°Ñ”Ñ‚Ğµ Ñ€Ñ–ÑˆĞµĞ½Ğ½Ñ, Ğ¿Ğ¾Ñ‚Ñ€Ñ–Ğ±Ğ½Ğ¾ Ğ´Ğ¾Ğ±Ñ€Ğµ Ğ¿Ğ¾Ğ´ÑƒĞ¼Ğ°Ñ‚Ğ¸ Ğ¿Ñ€Ğ¾ Ğ½Ğ°ÑĞ»Ñ–Ğ´ĞºĞ¸.\n    - [ ] ĞŸÑ–ÑĞ»Ñ Ñ‚Ğ¾Ğ³Ğ¾ ÑĞº Ğ¿Ñ€Ğ¸Ğ¹Ğ½ÑĞ»Ğ¸ Ñ€Ñ–ÑˆĞµĞ½Ğ½Ñ, Ğ¿Ğ¾Ñ‚Ñ€Ñ–Ğ±Ğ½Ğ¾ Ğ¿Ğ¾Ğ´ÑƒĞ¼Ğ°Ñ‚Ğ¸ Ğ¿Ñ€Ğ¾ Ğ½Ğ°ÑĞ»Ñ–Ğ´ĞºĞ¸.\n    - [x] ĞŸĞµÑ€Ñˆ Ğ½Ñ–Ğ¶ Ğ¿Ñ€Ğ¸Ğ¹Ğ½ÑÑ‚Ğ¸ Ñ€Ñ–ÑˆĞµĞ½Ğ½Ñ, Ğ¿Ğ¾Ñ‚Ñ€Ñ–Ğ±Ğ½Ğ¾ Ğ´Ğ¾Ğ±Ñ€Ğµ Ğ¿Ğ¾Ğ´ÑƒĞ¼Ğ°Ñ‚Ğ¸ Ğ¿Ñ€Ğ¾ Ğ½Ğ°ÑĞ»Ñ–Ğ´ĞºĞ¸.\n    - [ ] ĞŸÑ€Ğ¸Ğ¹Ğ¼Ğ°ÑÑ‡Ğ¸ Ñ€Ñ–ÑˆĞµĞ½Ğ½Ñ, Ğ¿Ğ¾Ñ‚Ñ€Ñ–Ğ±Ğ½Ğ¾ Ğ´Ğ¾Ğ±Ñ€Ğµ Ğ¿Ğ¾Ğ´ÑƒĞ¼Ğ°Ñ‚Ğ¸ Ğ¿Ñ€Ğ¾ Ğ½Ğ°ÑĞ»Ñ–Ğ´ĞºĞ¸.\n    > ĞŸĞ¾Ğ¿ĞµÑ€ĞµĞ´Ğ½Ñ–ÑÑ‚ÑŒ: Â«ĞŸĞµÑ€Ñˆ Ğ½Ñ–Ğ¶Â» + Ñ–Ğ½Ñ„Ñ–Ğ½Ñ–Ñ‚Ğ¸Ğ².\n\n---\n\n## true-false: Ğ¡Ğ°Ğ¼Ğ¾Ğ¾Ñ†Ñ–Ğ½ĞºĞ° B1\n\n> Ğ’Ğ¸Ğ·Ğ½Ğ°Ñ‡Ñ‚Ğµ, Ñ‡Ğ¸ Ğ¿Ñ€Ğ°Ğ²Ğ¸Ğ»ÑŒĞ½Ñ– Ñ†Ñ– Ñ‚Ğ²ĞµÑ€Ğ´Ğ¶ĞµĞ½Ğ½Ñ Ğ¿Ñ€Ğ¾ Ğ²Ğ°ÑˆÑ– Ğ½Ğ°Ğ²Ğ¸Ñ‡ĞºĞ¸ Ğ½Ğ° Ñ€Ñ–Ğ²Ğ½Ñ– B1. Ğ’Ñ–Ğ´Ğ¿Ğ¾Ğ²Ñ–Ğ´Ğ°Ğ¹Ñ‚Ğµ Ñ‡ĞµÑĞ½Ğ¾!\n\n1. ĞĞ° Ñ€Ñ–Ğ²Ğ½Ñ– B1 Ğ²Ğ¸ Ğ¿Ğ¾Ğ²Ğ¸Ğ½Ğ½Ñ– Ğ²Ğ¼Ñ–Ñ‚Ğ¸ Ñ€Ğ¾Ğ·ÑƒĞ¼Ñ–Ñ‚Ğ¸ Ğ³Ğ¾Ğ»Ğ¾Ğ²Ğ½Ñ– Ğ´ÑƒĞ¼ĞºĞ¸ ÑÑ‚Ğ°Ğ½Ğ´Ğ°Ñ€Ñ‚Ğ½Ğ¸Ñ… Ñ‚ĞµĞºÑÑ‚Ñ–Ğ² Ğ½Ğ° Ğ·Ğ½Ğ°Ğ¹Ğ¾Ğ¼Ñ– Ñ‚ĞµĞ¼Ğ¸.\n   - [x] ĞŸÑ€Ğ°Ğ²Ğ´Ğ°\n   - [ ] ĞĞµĞ¿Ñ€Ğ°Ğ²Ğ´Ğ°\n   > Ğ¦Ğµ Ğ¾Ğ´Ğ½Ğ° Ğ· ĞºĞ»ÑÑ‡Ğ¾Ğ²Ğ¸Ñ… ĞºĞ¾Ğ¼Ğ¿ĞµÑ‚ĞµĞ½Ñ†Ñ–Ğ¹ Ñ€Ñ–Ğ²Ğ½Ñ B1 Ğ·Ğ° ÑˆĞºĞ°Ğ»Ğ¾Ñ CEFR.\n\n2. ĞĞ° Ñ€Ñ–Ğ²Ğ½Ñ– B1 Ğ²Ğ¸ Ğ¿Ğ¾Ğ²Ğ¸Ğ½Ğ½Ñ– Ğ²Ğ¼Ñ–Ñ‚Ğ¸ Ğ¿Ğ¸ÑĞ°Ñ‚Ğ¸ Ñ‚ĞµĞºÑÑ‚Ğ¸ Ğ½Ğ° Ğ±ÑƒĞ´ÑŒ-ÑĞºÑƒ Ñ‚ĞµĞ¼Ñƒ Ğ±ĞµĞ· ÑĞ»Ğ¾Ğ²Ğ½Ğ¸ĞºĞ°.\n   - [ ] ĞŸÑ€Ğ°Ğ²Ğ´Ğ°\n   - [x] ĞĞµĞ¿Ñ€Ğ°Ğ²Ğ´Ğ°\n   > B1 Ğ¿ĞµÑ€ĞµĞ´Ğ±Ğ°Ñ‡Ğ°Ñ” Ğ¿Ğ¸ÑÑŒĞ¼Ğ¾ Ğ½Ğ° Ğ·Ğ½Ğ°Ğ¹Ğ¾Ğ¼Ñ– Ñ‚ĞµĞ¼Ğ¸, Ğ°Ğ»Ğµ ÑĞºĞ»Ğ°Ğ´Ğ½Ñ– Ñ‚ĞµĞºÑÑ‚Ğ¸ Ğ¿Ğ¾Ñ‚Ñ€ĞµĞ±ÑƒÑÑ‚ÑŒ ÑĞ»Ğ¾Ğ²Ğ½Ğ¸ĞºĞ°.\n\n3. Ğ’Ğ¸Ğ´ Ğ´Ñ–Ñ”ÑĞ»Ğ¾Ğ²Ğ° (Ğ´Ğ¾ĞºĞ¾Ğ½Ğ°Ğ½Ğ¸Ğ¹/Ğ½ĞµĞ´Ğ¾ĞºĞ¾Ğ½Ğ°Ğ½Ğ¸Ğ¹) â€” Ñ†Ğµ ĞºĞ»ÑÑ‡Ğ¾Ğ²Ğ° Ğ³Ñ€Ğ°Ğ¼Ğ°Ñ‚Ğ¸Ñ‡Ğ½Ğ° ĞºĞ°Ñ‚ĞµĞ³Ğ¾Ñ€Ñ–Ñ Ñ€Ñ–Ğ²Ğ½Ñ B1.\n   - [x] ĞŸÑ€Ğ°Ğ²Ğ´Ğ°\n   - [ ] ĞĞµĞ¿Ñ€Ğ°Ğ²Ğ´Ğ°\n   > ĞÑĞ¿ĞµĞºÑ‚ (Ğ²Ğ¸Ğ´) â€” Ñ†ĞµĞ½Ñ‚Ñ€Ğ°Ğ»ÑŒĞ½Ğ° Ñ‚ĞµĞ¼Ğ° Ğ³Ñ€Ğ°Ğ¼Ğ°Ñ‚Ğ¸ĞºĞ¸ B1 (M06-M15).\n\n4. ĞĞ° Ñ€Ñ–Ğ²Ğ½Ñ– B1 Ğ²Ğ¸ Ğ¿Ğ¾Ğ²Ğ¸Ğ½Ğ½Ñ– Ğ·Ğ½Ğ°Ñ‚Ğ¸ Ğ²ÑÑ– Ğ´Ñ–Ñ”ÑĞ»Ğ¾Ğ²Ğ° Ñ€ÑƒÑ…Ñƒ Ğ· ÑƒÑÑ–Ğ¼Ğ° Ğ¿Ñ€ĞµÑ„Ñ–ĞºÑĞ°Ğ¼Ğ¸.\n   - [x] ĞŸÑ€Ğ°Ğ²Ğ´Ğ°\n   - [ ] ĞĞµĞ¿Ñ€Ğ°Ğ²Ğ´Ğ°\n   > Ğ”Ñ–Ñ”ÑĞ»Ğ¾Ğ²Ğ° Ñ€ÑƒÑ…Ñƒ Ğ· Ğ¿Ñ€ĞµÑ„Ñ–ĞºÑĞ°Ğ¼Ğ¸ â€” Ğ¾ÑĞ½Ğ¾Ğ²Ğ° Ñ„Ğ°Ğ·Ğ¸ B1.2 (M16-M25).\n\n5. Ğ Ñ–Ğ²ĞµĞ½ÑŒ B2 Ğ·Ğ¾ÑĞµÑ€ĞµĞ´Ğ¶ĞµĞ½Ğ¸Ğ¹ Ğ½Ğ° Ğ²Ğ¸Ğ²Ñ‡ĞµĞ½Ğ½Ñ– ĞºĞ¸Ñ€Ğ¸Ğ»Ğ¸Ñ†Ñ– Ñ‚Ğ° Ğ±Ğ°Ğ·Ğ¾Ğ²Ğ¸Ñ… Ñ„Ñ€Ğ°Ğ·.\n   - [ ] ĞŸÑ€Ğ°Ğ²Ğ´Ğ°\n   - [x] ĞĞµĞ¿Ñ€Ğ°Ğ²Ğ´Ğ°\n   > ĞšĞ¸Ñ€Ğ¸Ğ»Ğ¸Ñ†Ñ Ğ²Ğ¸Ğ²Ñ‡Ğ°Ñ”Ñ‚ÑŒÑÑ Ğ½Ğ° A1. B2 â€” Ñ†Ğµ Ğ»Ñ–Ñ‚ĞµÑ€Ğ°Ñ‚ÑƒÑ€Ğ° Ñ‚Ğ° Ğ°ĞºĞ°Ğ´ĞµĞ¼Ñ–Ñ‡Ğ½Ğ° Ğ¼Ğ¾Ğ²Ğ°.\n\n6. Ğ”Ñ–Ñ”Ğ¿Ñ€Ğ¸ÑĞ»Ñ–Ğ²Ğ½Ğ¸ĞºĞ¸ Ğ½Ğ° -ÑÑ‡Ğ¸ Ğ¾Ğ¿Ğ¸ÑÑƒÑÑ‚ÑŒ Ğ¾Ğ´Ğ½Ğ¾Ñ‡Ğ°ÑĞ½Ñ– Ğ´Ñ–Ñ—, Ğ° Ğ½Ğ° -Ğ²ÑˆĞ¸ â€” Ğ¿Ğ¾Ğ¿ĞµÑ€ĞµĞ´Ğ½Ñ–.\n   - [x] ĞŸÑ€Ğ°Ğ²Ğ´Ğ°\n   - [ ] ĞĞµĞ¿Ñ€Ğ°Ğ²Ğ´Ğ°\n   > Ğ¦Ğµ Ğ¿Ñ€Ğ°Ğ²Ğ¸Ğ»ÑŒĞ½Ğµ Ñ€Ğ¾Ğ·Ñ€Ñ–Ğ·Ğ½ĞµĞ½Ğ½Ñ Ğ½ĞµĞ´Ğ¾ĞºĞ¾Ğ½Ğ°Ğ½Ğ¸Ñ… (-ÑÑ‡Ğ¸) Ñ– Ğ´Ğ¾ĞºĞ¾Ğ½Ğ°Ğ½Ğ¸Ñ… (-Ğ²ÑˆĞ¸) Ğ´Ñ–Ñ”Ğ¿Ñ€Ğ¸ÑĞ»Ñ–Ğ²Ğ½Ğ¸ĞºÑ–Ğ².\n\n7. Ğ¡Ğ¿Ğ¾Ğ»ÑƒÑ‡Ğ½Ğ¸Ğº Â«Ñ…Ğ¾Ñ‡Ğ°Â» Ğ²Ğ¸ĞºĞ¾Ñ€Ğ¸ÑÑ‚Ğ¾Ğ²ÑƒÑ”Ñ‚ÑŒÑÑ Ğ´Ğ»Ñ Ğ²Ğ¸Ñ€Ğ°Ğ¶ĞµĞ½Ğ½Ñ Ğ¿Ñ€Ğ¸Ñ‡Ğ¸Ğ½Ğ¸ Ğ´Ñ–Ñ—.\n   - [ ] ĞŸÑ€Ğ°Ğ²Ğ´Ğ°\n   - [x] ĞĞµĞ¿Ñ€Ğ°Ğ²Ğ´Ğ°\n   > Â«Ğ¥Ğ¾Ñ‡Ğ°Â» â€” Ğ´Ğ¾Ğ¿ÑƒÑÑ‚Ğ¾Ğ²Ğ¸Ğ¹ ÑĞ¿Ğ¾Ğ»ÑƒÑ‡Ğ½Ğ¸Ğº, Ğ½Ğµ Ğ¿Ñ€Ğ¸Ñ‡Ğ¸Ğ½Ğ¸. Ğ”Ğ»Ñ Ğ¿Ñ€Ğ¸Ñ‡Ğ¸Ğ½Ğ¸: Â«Ñ‚Ğ¾Ğ¼Ñƒ Ñ‰Ğ¾Â».\n\n8. ĞĞ° Ñ€Ñ–Ğ²Ğ½Ñ– B1 Ğ²Ğ¸ Ğ¿Ğ¾Ğ²Ğ¸Ğ½Ğ½Ñ– Ğ²Ğ¼Ñ–Ñ‚Ğ¸ ÑĞ¿Ñ–Ğ»ĞºÑƒĞ²Ğ°Ñ‚Ğ¸ÑÑ Ğ² Ğ±Ñ–Ğ»ÑŒÑˆĞ¾ÑÑ‚Ñ– ÑĞ¸Ñ‚ÑƒĞ°Ñ†Ñ–Ğ¹ Ğ¿Ñ–Ğ´ Ñ‡Ğ°Ñ Ğ¿Ğ¾Ğ´Ğ¾Ñ€Ğ¾Ğ¶Ñ– Ğ£ĞºÑ€Ğ°Ñ—Ğ½Ğ¾Ñ.\n   - [x] ĞŸÑ€Ğ°Ğ²Ğ´Ğ°\n   - [ ] ĞĞµĞ¿Ñ€Ğ°Ğ²Ğ´Ğ°\n   > Ğ¦Ğµ ÑÑ‚Ğ°Ğ½Ğ´Ğ°Ñ€Ñ‚Ğ½Ğ¸Ğ¹ Ğ´ĞµÑĞºÑ€Ğ¸Ğ¿Ñ‚Ğ¾Ñ€ B1 Ğ·Ğ° CEFR.\n\n9. ĞŸĞ°ÑĞ¸Ğ²Ğ½Ğ¸Ğ¹ Ğ´Ñ–Ñ”Ğ¿Ñ€Ğ¸ĞºĞ¼ĞµÑ‚Ğ½Ğ¸Ğº Â«Ğ½Ğ°Ğ¿Ğ¸ÑĞ°Ğ½Ğ¸Ğ¹Â» Ğ²Ğ¶Ğ¸Ğ²Ğ°Ñ”Ñ‚ÑŒÑÑ Ğ· Ñ‡Ğ¾Ğ»Ğ¾Ğ²Ñ–Ñ‡Ğ¸Ğ¼ Ñ€Ğ¾Ğ´Ğ¾Ğ¼, Â«Ğ½Ğ°Ğ¿Ğ¸ÑĞ°Ğ½Ğ°Â» â€” Ğ· Ğ¶Ñ–Ğ½Ğ¾Ñ‡Ğ¸Ğ¼.\n   - [x] ĞŸÑ€Ğ°Ğ²Ğ´Ğ°\n   - [ ] ĞĞµĞ¿Ñ€Ğ°Ğ²Ğ´Ğ°\n   > Ğ”Ñ–Ñ”Ğ¿Ñ€Ğ¸ĞºĞ¼ĞµÑ‚Ğ½Ğ¸ĞºĞ¸ ÑƒĞ·Ğ³Ğ¾Ğ´Ğ¶ÑƒÑÑ‚ÑŒÑÑ Ğ· Ñ–Ğ¼ĞµĞ½Ğ½Ğ¸ĞºĞ¾Ğ¼ Ñƒ Ñ€Ğ¾Ğ´Ñ–, Ñ‡Ğ¸ÑĞ»Ñ– Ñ‚Ğ° Ğ²Ñ–Ğ´Ğ¼Ñ–Ğ½ĞºÑƒ.\n\n10. ĞĞ° Ñ€Ñ–Ğ²Ğ½Ñ– B1 Ğ²Ğ¸ Ğ¿Ğ¾Ğ²Ğ¸Ğ½Ğ½Ñ– Ğ·Ğ½Ğ°Ñ‚Ğ¸ Ğ±Ğ»Ğ¸Ğ·ÑŒĞºĞ¾ 3,500 ÑƒĞºÑ€Ğ°Ñ—Ğ½ÑÑŒĞºĞ¸Ñ… ÑĞ»Ñ–Ğ² (Ñ€Ğ°Ğ·Ğ¾Ğ¼ Ğ· A1 Ñ‚Ğ° A2).\n    - [x] ĞŸÑ€Ğ°Ğ²Ğ´Ğ°\n    - [ ] ĞĞµĞ¿Ñ€Ğ°Ğ²Ğ´Ğ°\n    > A1 (~750) + A2 (~1,050) + B1 (~1,800) = ~3,600 ÑĞ»Ñ–Ğ².\n\n---\n\n## dialogue-reorder: Ğ Ğ¾Ğ·Ğ¼Ğ¾Ğ²Ğ° Ğ¿Ñ€Ğ¾ Ñ€Ñ–Ğ²ĞµĞ½ÑŒ B1\n\n> Ğ Ğ¾Ğ·ÑÑ‚Ğ°Ğ²Ñ‚Ğµ Ñ€ĞµĞ¿Ğ»Ñ–ĞºĞ¸ Ğ´Ñ–Ğ°Ğ»Ğ¾Ğ³Ñƒ Ğ² Ğ¿Ñ€Ğ°Ğ²Ğ¸Ğ»ÑŒĞ½Ğ¾Ğ¼Ñƒ Ğ¿Ğ¾Ñ€ÑĞ´ĞºÑƒ.\n\n1. ĞŸÑ€Ğ¸Ğ²Ñ–Ñ‚, Ğ¢Ğ°Ñ€Ğ°ÑĞµ! Ğ¯ Ñ‡ÑƒĞ»Ğ°, Ñ‰Ğ¾ Ñ‚Ğ¸ Ğ·Ğ°ĞºÑ–Ğ½Ñ‡Ğ¸Ğ² Ñ€Ñ–Ğ²ĞµĞ½ÑŒ B1. Ğ’Ñ–Ñ‚Ğ°Ñ Ñ‚ĞµĞ±Ğµ!\n2. Ğ”ÑĞºÑƒÑ, ĞĞºÑĞ°Ğ½Ğ¾! Ğ¦Ğµ Ğ±ÑƒĞ² Ğ´Ğ¾Ğ²Ğ³Ğ¸Ğ¹ ÑˆĞ»ÑÑ…, Ğ°Ğ»Ğµ Ñ Ğ´ÑƒĞ¶Ğµ Ğ·Ğ°Ğ´Ğ¾Ğ²Ğ¾Ğ»ĞµĞ½Ğ¸Ğ¹ Ñ€ĞµĞ·ÑƒĞ»ÑŒÑ‚Ğ°Ñ‚Ğ°Ğ¼Ğ¸.\n3. Ğ©Ğ¾ Ğ±ÑƒĞ»Ğ¾ Ğ½Ğ°Ğ¹ÑĞºĞ»Ğ°Ğ´Ğ½Ñ–ÑˆĞ¸Ğ¼ Ğ´Ğ»Ñ Ñ‚ĞµĞ±Ğµ Ğ½Ğ° Ñ†ÑŒĞ¾Ğ¼Ñƒ Ñ€Ñ–Ğ²Ğ½Ñ–?\n4. ĞĞ°Ğ¹ÑĞºĞ»Ğ°Ğ´Ğ½Ñ–ÑˆĞ¸Ğ¼ Ğ±ÑƒĞ² Ğ²Ğ¸Ğ´ Ğ´Ñ–Ñ”ÑĞ»Ğ¾Ğ²Ğ°. ĞœĞµĞ½Ñ– Ğ¿Ğ¾Ñ‚Ñ€Ñ–Ğ±ĞµĞ½ Ğ±ÑƒĞ² Ñ‡Ğ°Ñ, Ñ‰Ğ¾Ğ± Ğ·Ñ€Ğ¾Ğ·ÑƒĞ¼Ñ–Ñ‚Ğ¸ Ñ€Ñ–Ğ·Ğ½Ğ¸Ñ†Ñ.\n5. Ğ¯ Ñ‚ĞµĞ±Ğµ Ñ€Ğ¾Ğ·ÑƒĞ¼Ñ–Ñ! Ğ Ğ´Ñ–Ñ”ÑĞ»Ğ¾Ğ²Ğ° Ñ€ÑƒÑ…Ñƒ? Ğ’Ğ¾Ğ½Ğ¸ Ñ‚Ğ°ĞºĞ¾Ğ¶ Ğ½ĞµĞ¿Ñ€Ğ¾ÑÑ‚Ñ– Ğ´Ğ»Ñ Ñ–Ğ½Ğ¾Ğ·ĞµĞ¼Ñ†Ñ–Ğ².\n6. Ğ¢Ğ°Ğº, Ğ´Ñ–Ñ”ÑĞ»Ğ¾Ğ²Ğ° Ñ€ÑƒÑ…Ñƒ Ğ· Ğ¿Ñ€ĞµÑ„Ñ–ĞºÑĞ°Ğ¼Ğ¸ â€” Ñ†Ğµ ÑĞ¿Ñ€Ğ°Ğ²Ğ¶Ğ½Ñ” Ğ²Ğ¸Ğ¿Ñ€Ğ¾Ğ±ÑƒĞ²Ğ°Ğ½Ğ½Ñ.\n7. Ğ¢Ğ¸ Ğ¿Ğ»Ğ°Ğ½ÑƒÑ”Ñˆ Ğ¿Ñ€Ğ¾Ğ´Ğ¾Ğ²Ğ¶ÑƒĞ²Ğ°Ñ‚Ğ¸ Ğ½Ğ°Ğ²Ñ‡Ğ°Ğ½Ğ½Ñ Ğ½Ğ° Ñ€Ñ–Ğ²Ğ½Ñ– B2?\n8. Ğ—Ğ²Ğ¸Ñ‡Ğ°Ğ¹Ğ½Ğ¾! Ğ¯ Ñ…Ğ¾Ñ‡Ñƒ, Ñ‰Ğ¾Ğ± Ğ¼Ñ–Ğ¹ Ñ€Ñ–Ğ²ĞµĞ½ÑŒ Ğ±ÑƒĞ² Ğ´Ğ¾ÑÑ‚Ğ°Ñ‚Ğ½Ñ–Ğ¼ Ğ´Ğ»Ñ Ñ€Ğ¾Ğ±Ğ¾Ñ‚Ğ¸ Ğ² Ğ£ĞºÑ€Ğ°Ñ—Ğ½Ñ–.\n\n---\n\n## mark-the-words: Ğ—Ğ½Ğ°Ğ¹Ğ´Ñ–Ñ‚ÑŒ Ğ´Ñ–Ñ”Ğ¿Ñ€Ğ¸ĞºĞ¼ĞµÑ‚Ğ½Ğ¸ĞºĞ¸\n\n> Ğ—Ğ½Ğ°Ğ¹Ğ´Ñ–Ñ‚ÑŒ Ñ– Ğ²Ğ¸Ğ´Ñ–Ğ»Ñ–Ñ‚ÑŒ ÑƒÑÑ– Ğ´Ñ–Ñ”Ğ¿Ñ€Ğ¸ĞºĞ¼ĞµÑ‚Ğ½Ğ¸ĞºĞ¸ Ñ‚Ğ° Ğ´Ñ–Ñ”Ğ¿Ñ€Ğ¸ÑĞ»Ñ–Ğ²Ğ½Ğ¸ĞºĞ¸ Ğ² Ñ‚ĞµĞºÑÑ‚Ñ–.\n\n> ĞšĞ½Ğ¸Ğ³Ğ°, *Ğ½Ğ°Ğ¿Ğ¸ÑĞ°Ğ½Ğ°* Ğ²Ñ–Ğ´Ğ¾Ğ¼Ğ¸Ğ¼ Ğ°Ğ²Ñ‚Ğ¾Ñ€Ğ¾Ğ¼, ÑÑ‚Ğ°Ğ»Ğ° Ğ±ĞµÑÑ‚ÑĞµĞ»ĞµÑ€Ğ¾Ğ¼. *Ğ§Ğ¸Ñ‚Ğ°ÑÑ‡Ğ¸* Ñ†Ñ ĞºĞ½Ğ¸Ğ³Ñƒ, Ñ *Ğ´Ñ–Ğ·Ğ½Ğ°Ğ²ÑÑ* Ğ±Ğ°Ğ³Ğ°Ñ‚Ğ¾ Ğ½Ğ¾Ğ²Ğ¾Ğ³Ğ¾ Ğ¿Ñ€Ğ¾ Ğ£ĞºÑ€Ğ°Ñ—Ğ½Ñƒ. *ĞŸÑ€Ğ¾Ñ‡Ğ¸Ñ‚Ğ°Ğ²ÑˆĞ¸* Ğ¾ÑÑ‚Ğ°Ğ½Ğ½Ñ ÑÑ‚Ğ¾Ñ€Ñ–Ğ½ĞºÑƒ, Ñ *Ğ·Ğ°ĞºÑ€Ğ¸Ğ²* ĞºĞ½Ğ¸Ğ³Ñƒ Ñ– *Ğ·Ğ°Ğ´ÑƒĞ¼Ğ°Ğ²ÑÑ*. Ğ¢ĞµĞºÑÑ‚, *Ğ¿ĞµÑ€ĞµĞºĞ»Ğ°Ğ´ĞµĞ½Ğ¸Ğ¹* ÑƒĞºÑ€Ğ°Ñ—Ğ½ÑÑŒĞºĞ¾Ñ Ğ¼Ğ¾Ğ²Ğ¾Ñ, Ğ±ÑƒĞ² Ğ´ÑƒĞ¶Ğµ Ñ†Ñ–ĞºĞ°Ğ²Ğ¸Ğ¼.\n\n---\n\n## select: ĞŸÑ€Ğ°Ğ²Ğ¸Ğ»ÑŒĞ½Ñ– Ğ²Ñ–Ğ´Ğ¿Ğ¾Ğ²Ñ–Ğ´Ñ– Ğ¿Ñ€Ğ¾ B1\n\n> ĞĞ±ĞµÑ€Ñ–Ñ‚ÑŒ ÑƒÑÑ– Ğ¿Ñ€Ğ°Ğ²Ğ¸Ğ»ÑŒĞ½Ñ– Ñ‚Ğ²ĞµÑ€Ğ´Ğ¶ĞµĞ½Ğ½Ñ Ğ¿Ñ€Ğ¾ Ñ€Ñ–Ğ²ĞµĞ½ÑŒ B1.\n\n1. Ğ¯ĞºÑ– Ğ³Ñ€Ğ°Ğ¼Ğ°Ñ‚Ğ¸Ñ‡Ğ½Ñ– Ñ‚ĞµĞ¼Ğ¸ Ñ” Ñ†ĞµĞ½Ñ‚Ñ€Ğ°Ğ»ÑŒĞ½Ğ¸Ğ¼Ğ¸ Ğ´Ğ»Ñ Ñ€Ñ–Ğ²Ğ½Ñ B1?\n   - [x] Ğ’Ğ¸Ğ´ Ğ´Ñ–Ñ”ÑĞ»Ğ¾Ğ²Ğ° (Ğ´Ğ¾ĞºĞ¾Ğ½Ğ°Ğ½Ğ¸Ğ¹/Ğ½ĞµĞ´Ğ¾ĞºĞ¾Ğ½Ğ°Ğ½Ğ¸Ğ¹)\n   - [x] Ğ”Ñ–Ñ”ÑĞ»Ğ¾Ğ²Ğ° Ñ€ÑƒÑ…Ñƒ Ğ· Ğ¿Ñ€ĞµÑ„Ñ–ĞºÑĞ°Ğ¼Ğ¸\n   - [x] Ğ¡ĞºĞ»Ğ°Ğ´Ğ½Ñ– Ñ€ĞµÑ‡ĞµĞ½Ğ½Ñ Ğ· Ñ€Ñ–Ğ·Ğ½Ğ¸Ğ¼Ğ¸ Ñ‚Ğ¸Ğ¿Ğ°Ğ¼Ğ¸ Ğ¿Ñ–Ğ´Ñ€ÑĞ´Ğ½Ğ¸Ñ…\n   - [ ] ĞšĞ¸Ñ€Ğ¸Ğ»Ğ¸Ñ†Ñ Ñ‚Ğ° Ñ„Ğ¾Ğ½ĞµÑ‚Ğ¸ĞºĞ°\n   - [x] Ğ”Ñ–Ñ”Ğ¿Ñ€Ğ¸ĞºĞ¼ĞµÑ‚Ğ½Ğ¸ĞºĞ¸ Ñ‚Ğ° Ğ¿Ğ°ÑĞ¸Ğ²Ğ½Ñ– ĞºĞ¾Ğ½ÑÑ‚Ñ€ÑƒĞºÑ†Ñ–Ñ—\n\n2. Ğ¯ĞºÑ– Ğ½Ğ°Ğ²Ğ¸Ñ‡ĞºĞ¸ Ğ¿Ğ¾Ğ²Ğ¸Ğ½ĞµĞ½ Ğ¼Ğ°Ñ‚Ğ¸ ÑƒÑ‡ĞµĞ½ÑŒ Ğ½Ğ° Ñ€Ñ–Ğ²Ğ½Ñ– B1?\n   - [x] Ğ Ğ¾Ğ·ÑƒĞ¼Ñ–Ñ‚Ğ¸ Ğ³Ğ¾Ğ»Ğ¾Ğ²Ğ½Ğ¸Ğ¹ Ğ·Ğ¼Ñ–ÑÑ‚ Ğ½Ğ¾Ğ²Ğ¸Ğ½ Ñ‚Ğ° Ğ¿Ğ¾Ğ´ĞºĞ°ÑÑ‚Ñ–Ğ²\n   - [x] ĞŸĞ¸ÑĞ°Ñ‚Ğ¸ ĞµÑĞµ Ğ½Ğ° Ğ·Ğ½Ğ°Ğ¹Ğ¾Ğ¼Ñ– Ñ‚ĞµĞ¼Ğ¸\n   - [ ] Ğ§Ğ¸Ñ‚Ğ°Ñ‚Ğ¸ ĞºĞ»Ğ°ÑĞ¸Ñ‡Ğ½Ñƒ Ğ»Ñ–Ñ‚ĞµÑ€Ğ°Ñ‚ÑƒÑ€Ñƒ Ğ±ĞµĞ· ÑĞ»Ğ¾Ğ²Ğ½Ğ¸ĞºĞ°\n   - [x] Ğ¡Ğ¿Ñ–Ğ»ĞºÑƒĞ²Ğ°Ñ‚Ğ¸ÑÑ Ğ¿Ñ–Ğ´ Ñ‡Ğ°Ñ Ğ¿Ğ¾Ğ´Ğ¾Ñ€Ğ¾Ğ¶Ñ–\n   - [ ] ĞŸĞµÑ€ĞµĞºĞ»Ğ°Ğ´Ğ°Ñ‚Ğ¸ ÑÑ€Ğ¸Ğ´Ğ¸Ñ‡Ğ½Ñ– Ğ´Ğ¾ĞºÑƒĞ¼ĞµĞ½Ñ‚Ğ¸\n\n3. Ğ¯ĞºÑ– ÑĞ¿Ğ¾Ğ»ÑƒÑ‡Ğ½Ğ¸ĞºĞ¸ Ğ²Ğ¸ĞºĞ¾Ñ€Ğ¸ÑÑ‚Ğ¾Ğ²ÑƒÑÑ‚ÑŒÑÑ Ğ´Ğ»Ñ Ğ´Ğ¾Ğ¿ÑƒÑÑ‚Ğ¾Ğ²Ğ¸Ñ… Ñ€ĞµÑ‡ĞµĞ½ÑŒ?\n   - [x] Ñ…Ğ¾Ñ‡Ğ°\n   - [x] Ğ½ĞµĞ·Ğ²Ğ°Ğ¶Ğ°ÑÑ‡Ğ¸ Ğ½Ğ° Ñ‚Ğµ Ñ‰Ğ¾\n   - [ ] Ñ‚Ğ¾Ğ¼Ñƒ Ñ‰Ğ¾\n   - [ ] ÑĞºÑ‰Ğ¾\n   - [x] Ğ¿Ğ¾Ğ¿Ñ€Ğ¸ Ñ‚Ğµ Ñ‰Ğ¾\n\n4. Ğ¯ĞºÑ– Ğ´Ñ–Ñ”Ğ¿Ñ€Ğ¸ÑĞ»Ñ–Ğ²Ğ½Ğ¸ĞºĞ¸ Ğ²Ğ¸Ñ€Ğ°Ğ¶Ğ°ÑÑ‚ÑŒ Ğ¿Ğ¾Ğ¿ĞµÑ€ĞµĞ´Ğ½Ñ Ğ´Ñ–Ñ?\n   - [x] Ğ¿Ñ€Ğ¾Ñ‡Ğ¸Ñ‚Ğ°Ğ²ÑˆĞ¸\n   - [ ] Ñ‡Ğ¸Ñ‚Ğ°ÑÑ‡Ğ¸\n   - [x] Ğ·Ğ°ĞºÑ–Ğ½Ñ‡Ğ¸Ğ²ÑˆĞ¸\n   - [ ] Ğ¿Ñ€Ğ°Ñ†ÑÑÑ‡Ğ¸\n   - [x] Ğ½Ğ°Ğ¿Ğ¸ÑĞ°Ğ²ÑˆĞ¸\n\n5. Ğ¯ĞºÑ– Ñ‚ĞµĞ¼Ğ¸ Ğ²Ñ…Ğ¾Ğ´ÑÑ‚ÑŒ Ğ´Ğ¾ ĞºÑƒĞ»ÑŒÑ‚ÑƒÑ€Ğ½Ğ¾Ğ³Ğ¾ Ğ±Ğ»Ğ¾ĞºÑƒ B1?\n   - [x] Ğ ĞµĞ³Ñ–Ğ¾Ğ½Ğ¸ Ğ£ĞºÑ€Ğ°Ñ—Ğ½Ğ¸\n   - [x] Ğ¡ÑƒÑ‡Ğ°ÑĞ½Ğ° Ğ¼ÑƒĞ·Ğ¸ĞºĞ° Ñ‚Ğ° ĞºÑ–Ğ½Ğ¾\n   - [ ] Ğ¡ĞµÑ€ĞµĞ´Ğ½ÑŒĞ¾Ğ²Ñ–Ñ‡Ğ½Ğ° Ñ–ÑÑ‚Ğ¾Ñ€Ñ–Ñ\n   - [x] Ğ£ĞºÑ€Ğ°Ñ—Ğ½ÑÑŒĞºĞ° ĞºÑƒÑ…Ğ½Ñ\n   - [ ] Ğ”Ğ°Ğ²Ğ½ÑŒĞ¾Ğ³Ñ€ĞµÑ†ÑŒĞºĞ° Ñ„Ñ–Ğ»Ğ¾ÑĞ¾Ñ„Ñ–Ñ\n\n6. Ğ¯ĞºÑ– Ñ‚Ğ¸Ğ¿Ğ¸ ÑĞºĞ»Ğ°Ğ´Ğ½Ğ¸Ñ… Ñ€ĞµÑ‡ĞµĞ½ÑŒ Ğ²Ğ¸Ğ²Ñ‡Ğ°ÑÑ‚ÑŒÑÑ Ğ½Ğ° B1?\n   - [x] ĞĞ·Ğ½Ğ°Ñ‡Ğ°Ğ»ÑŒĞ½Ñ– Ğ· ÑĞºĞ¸Ğ¹, ÑĞºĞ°, ÑĞºĞµ\n   - [x] ĞœĞµÑ‚Ğ¸ Ğ· Ñ‰Ğ¾Ğ±\n   - [x] Ğ£Ğ¼Ğ¾Ğ²Ğ½Ñ– Ñ€ĞµĞ°Ğ»ÑŒĞ½Ñ– Ñ‚Ğ° Ğ½ĞµÑ€ĞµĞ°Ğ»ÑŒĞ½Ñ–\n   - [x] ĞŸÑ€Ğ¸Ñ‡Ğ¸Ğ½Ğ¸ Ğ· Ñ‚Ğ¾Ğ¼Ñƒ Ñ‰Ğ¾\n   - [ ] ĞŸĞ¾Ñ€Ñ–Ğ²Ğ½ÑĞ»ÑŒĞ½Ñ– Ğ· Ğ½Ñ–Ğ±Ğ¸\n\n---"
      },
      {
        "id": "section-4",
        "name": "Ğ¡Ğ»Ğ¾Ğ²Ğ½Ğ¸Ğº",
        "nameEn": null,
        "type": "vocabulary",
        "content": "| Ğ¡Ğ»Ğ¾Ğ²Ğ¾ | ĞŸĞµÑ€ĞµĞºĞ»Ğ°Ğ´ | ĞŸÑ€Ğ¸Ğ¼Ñ–Ñ‚ĞºĞ¸ |\n|-------|----------|----------|\n| Ğ°ĞºĞ°Ğ´ĞµĞ¼Ñ–Ñ‡Ğ½Ğ¸Ğ¹ | academic | Ñ€Ñ–Ğ²ĞµĞ½ÑŒ B2 |\n| Ğ¿Ğ¾Ğ³Ğ»Ğ¸Ğ±Ğ»ĞµĞ½Ğ¸Ğ¹ | in-depth | Ğ³Ğ»Ğ¸Ğ±ÑˆĞ¸Ğ¹ Ğ°Ğ½Ğ°Ğ»Ñ–Ğ· |\n| ÑƒĞ´Ğ¾ÑĞºĞ¾Ğ½Ğ°Ğ»ĞµĞ½Ğ½Ñ | improvement | Ğ¿Ñ€Ğ¾Ñ†ĞµÑ Ğ¿Ğ¾ĞºÑ€Ğ°Ñ‰ĞµĞ½Ğ½Ñ |\n| Ğ¿Ñ–Ğ´ÑÑƒĞ¼ĞºĞ¾Ğ²Ğ¸Ğ¹ | summary, final | Ğ·Ğ°Ğ²ĞµÑ€ÑˆĞ°Ğ»ÑŒĞ½Ğ¸Ğ¹ ĞµÑ‚Ğ°Ğ¿ |\n| ÑĞ°Ğ¼Ğ¾Ğ¾Ñ†Ñ–Ğ½ĞºĞ° | self-assessment | Ğ¾Ñ†Ñ–Ğ½ÑĞ²Ğ°Ğ½Ğ½Ñ ÑĞµĞ±Ğµ |\n| ĞºĞ¾Ğ¼Ğ¿Ğ»ĞµĞºÑĞ½Ğ¸Ğ¹ | comprehensive | Ğ²ÑĞµĞ¾Ñ…Ğ¾Ğ¿Ğ»ÑÑÑ‡Ğ¸Ğ¹ |\n| Ğ¿Ñ€Ğ¾Ğ´ĞµĞ¼Ğ¾Ğ½ÑÑ‚Ñ€ÑƒĞ²Ğ°Ñ‚Ğ¸ | to demonstrate | Ğ¿Ğ¾ĞºĞ°Ğ·Ğ°Ñ‚Ğ¸ Ğ½Ğ° Ğ¿Ñ€Ğ°ĞºÑ‚Ğ¸Ñ†Ñ– |\n| Ğ²Ğ¾Ğ»Ğ¾Ğ´Ñ–Ğ½Ğ½Ñ | command, mastery | Ñ€Ñ–Ğ²ĞµĞ½ÑŒ Ğ·Ğ½Ğ°Ğ½ÑŒ |\n| Ğ¿ĞµÑ€ÑĞ¿ĞµĞºÑ‚Ğ¸Ğ²Ğ½Ğ¸Ğ¹ | promising | Ğ¼Ğ°Ñ” Ğ¼Ğ°Ğ¹Ğ±ÑƒÑ‚Ğ½Ñ” |\n| Ğ½Ğ°Ğ¿Ğ¾Ğ»ĞµĞ³Ğ»Ğ¸Ğ²Ñ–ÑÑ‚ÑŒ | persistence | Ñ‚ĞµÑ€Ğ¿Ğ»ÑÑ‡Ñ–ÑÑ‚ÑŒ Ñƒ Ğ´Ğ¾ÑÑĞ³Ğ½ĞµĞ½Ğ½Ñ– Ğ¼ĞµÑ‚Ğ¸ |\n| ÑÑ‚Ñ–Ğ¹ĞºÑ–ÑÑ‚ÑŒ | resilience | Ğ·Ğ´Ğ°Ñ‚Ğ½Ñ–ÑÑ‚ÑŒ Ğ´Ğ¾Ğ»Ğ°Ñ‚Ğ¸ Ñ‚Ñ€ÑƒĞ´Ğ½Ğ¾Ñ‰Ñ– |\n| Ğ³Ğ°Ğ»ÑƒĞ·ÑŒ | industry, field | ÑÑ„ĞµÑ€Ğ° Ğ´Ñ–ÑĞ»ÑŒĞ½Ğ¾ÑÑ‚Ñ– |\n| Ñ€Ğ¾Ğ·Ñ€Ğ¾Ğ±Ğ½Ğ¸Ğº | developer | Ğ¿Ñ€Ğ¾Ğ³Ñ€Ğ°Ğ¼Ñ–ÑÑ‚ |\n| ÑÑ‚Ğ°Ñ€Ñ‚Ğ°Ğ¿ | startup | Ğ½Ğ¾Ğ²Ğ° ĞºĞ¾Ğ¼Ğ¿Ğ°Ğ½Ñ–Ñ |\n| Ğ²Ğ¸Ğ·Ğ½Ğ°Ğ½Ğ½Ñ | recognition | ÑˆĞ°Ğ½Ğ°, ÑĞ»Ğ°Ğ²Ğ° |\n| Ğ²Ğ¸ĞºĞ»Ğ¸Ğº | challenge | ÑĞºĞ»Ğ°Ğ´Ğ½Ğµ Ğ·Ğ°Ğ²Ğ´Ğ°Ğ½Ğ½Ñ |\n| Ğ°Ğ´Ğ°Ğ¿Ñ‚ÑƒĞ²Ğ°Ñ‚Ğ¸ÑÑ | to adapt | Ğ¿Ñ€Ğ¸ÑÑ‚Ğ¾ÑÑƒĞ²Ğ°Ñ‚Ğ¸ÑÑ |\n| Ğ¼Ğ°Ğ¹ÑÑ‚ĞµÑ€Ğ½Ñ–ÑÑ‚ÑŒ | mastery | Ğ²Ğ¸ÑĞ¾ĞºĞ¸Ğ¹ Ñ€Ñ–Ğ²ĞµĞ½ÑŒ Ğ²Ğ¼Ñ–Ğ½Ğ½Ñ |\n| Ñ‚ĞµÑ…Ğ½Ğ¾Ğ»Ğ¾Ğ³Ñ–Ñ‡Ğ½Ğ¸Ğ¹ | technological | Ğ¿Ğ¾Ğ²'ÑĞ·Ğ°Ğ½Ğ¸Ğ¹ Ğ· Ñ‚ĞµÑ…Ğ½Ğ¾Ğ»Ğ¾Ğ³Ñ–ÑĞ¼Ğ¸ |\n| ÑĞ¿ĞµÑ†Ñ–Ğ°Ğ»Ñ–ÑÑ‚ | specialist | Ñ„Ğ°Ñ…Ñ–Ğ²ĞµÑ†ÑŒ |\n| Ğ¿Ñ€Ğ¾Ğ³Ñ€Ğ°Ğ¼Ğ½Ğµ Ğ·Ğ°Ğ±ĞµĞ·Ğ¿ĞµÑ‡ĞµĞ½Ğ½Ñ | software | ĞºĞ¾Ğ¼Ğ¿'ÑÑ‚ĞµÑ€Ğ½Ñ– Ğ¿Ñ€Ğ¾Ğ³Ñ€Ğ°Ğ¼Ğ¸ |\n| ÑĞµĞºÑ‚Ğ¾Ñ€ | sector | Ñ‡Ğ°ÑÑ‚Ğ¸Ğ½Ğ° ĞµĞºĞ¾Ğ½Ğ¾Ğ¼Ñ–ĞºĞ¸ |\n| Ğ¿Ğ¾ĞºĞ¾Ğ»Ñ–Ğ½Ğ½Ñ | generation | Ğ»ÑĞ´Ğ¸ Ğ¾Ğ´Ğ½Ğ¾Ğ³Ğ¾ Ğ²Ñ–ĞºÑƒ |\n| Ğ¾Ğ±ÑÑ‚Ñ€Ñ–Ğ» | shelling | Ğ²Ğ¾Ñ”Ğ½Ğ½Ñ– Ğ´Ñ–Ñ— |\n| Ğ¿ĞµÑ€ĞµĞ¼Ğ¾Ğ³Ğ° | victory | Ğ²Ğ¸Ğ³Ñ€Ğ°Ñˆ |\n| ĞºĞ¾Ğ¼Ğ¿ĞµÑ‚ĞµĞ½Ñ†Ñ–Ñ | competency | Ğ·Ğ´Ğ°Ñ‚Ğ½Ñ–ÑÑ‚ÑŒ |\n| Ğ´ĞµÑĞºÑ€Ğ¸Ğ¿Ñ‚Ğ¾Ñ€ | descriptor | Ğ¾Ğ¿Ğ¸Ñ Ñ€Ñ–Ğ²Ğ½Ñ |\n| ÑˆĞºĞ°Ğ»Ğ° | scale | ÑĞ¸ÑÑ‚ĞµĞ¼Ğ° Ğ²Ğ¸Ğ¼Ñ–Ñ€ÑĞ²Ğ°Ğ½Ğ½Ñ |\n| ÑÑ‚Ñ€ÑƒĞºÑ‚ÑƒÑ€Ğ° | structure | Ğ±ÑƒĞ´Ğ¾Ğ²Ğ° |\n| ÑĞ¿Ğ¾Ğ»ÑƒÑ‡Ğ½Ğ¸Ğº | conjunction | Ğ³Ñ€Ğ°Ğ¼Ğ°Ñ‚Ğ¸Ñ‡Ğ½Ğ¸Ğ¹ Ñ‚ĞµÑ€Ğ¼Ñ–Ğ½ |\n| Ğ´Ñ–Ñ”Ğ¿Ñ€Ğ¸ĞºĞ¼ĞµÑ‚Ğ½Ğ¸Ğº | participle | Ğ³Ñ€Ğ°Ğ¼Ğ°Ñ‚Ğ¸Ñ‡Ğ½Ğ¸Ğ¹ Ñ‚ĞµÑ€Ğ¼Ñ–Ğ½ |\n| Ğ´Ñ–Ñ”Ğ¿Ñ€Ğ¸ÑĞ»Ñ–Ğ²Ğ½Ğ¸Ğº | adverbial participle | Ğ³Ñ€Ğ°Ğ¼Ğ°Ñ‚Ğ¸Ñ‡Ğ½Ğ¸Ğ¹ Ñ‚ĞµÑ€Ğ¼Ñ–Ğ½ |\n| Ğ¾Ğ·Ğ½Ğ°Ñ‡Ğ°Ğ»ÑŒĞ½Ğ¸Ğ¹ | relative | Ñ‚Ğ¸Ğ¿ Ğ¿Ñ–Ğ´Ñ€ÑĞ´Ğ½Ğ¾Ğ³Ğ¾ Ñ€ĞµÑ‡ĞµĞ½Ğ½Ñ |\n| Ğ´Ğ¾Ğ¿ÑƒÑÑ‚Ğ¾Ğ²Ğ¸Ğ¹ | concessive | Ñ‚Ğ¸Ğ¿ Ğ¿Ñ–Ğ´Ñ€ÑĞ´Ğ½Ğ¾Ğ³Ğ¾ Ñ€ĞµÑ‡ĞµĞ½Ğ½Ñ |\n| Ğ¿Ñ€Ğ¸Ñ‡Ğ¸Ğ½Ğ½Ğ¸Ğ¹ | causal | Ñ‚Ğ¸Ğ¿ Ğ¿Ñ–Ğ´Ñ€ÑĞ´Ğ½Ğ¾Ğ³Ğ¾ Ñ€ĞµÑ‡ĞµĞ½Ğ½Ñ |"
      }
    ],
    "rawMarkdown": "---\nmodule: b1-86\ntitle: \"ĞŸÑ–Ğ´ÑÑƒĞ¼ĞºĞ¾Ğ²Ğ¸Ğ¹ Ğ¼Ğ¾Ğ´ÑƒĞ»ÑŒ B1\"\nsubtitle: \"Comprehensive B1 Assessment\"\nversion: \"1.0\"\nphase: \"B1.8\"\npedagogy: \"TBL\"\nduration: 90\ntransliteration: \"none\"\ntags: [\"capstone\", \"assessment\", \"integration\", \"b2-preparation\"]\ngrammar: [\"aspect-review\", \"motion-verbs-review\", \"complex-sentences-review\", \"participles-review\"]\nobjectives:\n  - \"Learner can demonstrate comprehensive B1 mastery across all skills\"\n  - \"Learner can produce extended written discourse (250+ words)\"\n  - \"Learner can comprehend authentic Ukrainian texts\"\n  - \"Learner is ready to begin B2 level\"\nvocabulary_count: 35\n---\n\n# Ğ’ÑÑ‚ÑƒĞ¿\n\nĞ’Ñ–Ñ‚Ğ°Ñ”Ğ¼Ğ¾ Ğ²Ğ°Ñ Ğ½Ğ° Ñ„Ñ–Ğ½Ğ°Ğ»ÑŒĞ½Ğ¾Ğ¼Ñƒ ĞµÑ‚Ğ°Ğ¿Ñ– Ñ€Ñ–Ğ²Ğ½Ñ B1! Ğ¦ĞµĞ¹ Ğ¿Ñ–Ğ´ÑÑƒĞ¼ĞºĞ¾Ğ²Ğ¸Ğ¹ Ğ¼Ğ¾Ğ´ÑƒĞ»ÑŒ â€” Ğ²Ğ°ÑˆĞ° Ğ¾ÑÑ‚Ğ°Ğ½Ğ½Ñ Ğ·ÑƒĞ¿Ğ¸Ğ½ĞºĞ° Ğ¿ĞµÑ€ĞµĞ´ Ñ€Ñ–Ğ²Ğ½ĞµĞ¼ B2. Ğ¢ÑƒÑ‚ Ğ²Ğ¸ Ğ¿Ñ€Ğ¾Ğ´ĞµĞ¼Ğ¾Ğ½ÑÑ‚Ñ€ÑƒÑ”Ñ‚Ğµ Ğ²ÑĞµ, Ñ‰Ğ¾ Ğ²Ğ¸Ğ²Ñ‡Ğ¸Ğ»Ğ¸: Ğ³Ñ€Ğ°Ğ¼Ğ°Ñ‚Ğ¸ĞºÑƒ, Ğ»ĞµĞºÑĞ¸ĞºÑƒ, Ñ‡Ğ¸Ñ‚Ğ°Ğ½Ğ½Ñ, Ğ¿Ğ¸ÑÑŒĞ¼Ğ¾ Ñ‚Ğ° Ñ€Ğ¾Ğ·ÑƒĞ¼Ñ–Ğ½Ğ½Ñ Ğ½Ğ° ÑĞ»ÑƒÑ….\n\n> ğŸ’¡ **ĞŸĞ¾Ñ€Ğ°Ğ´Ğ°**\n> Ğ¦ĞµĞ¹ Ğ¼Ğ¾Ğ´ÑƒĞ»ÑŒ Ğ½Ğµ Ğ²Ğ²Ğ¾Ğ´Ğ¸Ñ‚ÑŒ Ğ½Ğ¾Ğ²Ğ¸Ñ… Ñ‚ĞµĞ¼. Ğ£ÑÑ– Ğ·Ğ°Ğ²Ğ´Ğ°Ğ½Ğ½Ñ Ğ±Ğ°Ğ·ÑƒÑÑ‚ÑŒÑÑ Ğ½Ğ° Ğ¼Ğ°Ñ‚ĞµÑ€Ñ–Ğ°Ğ»Ñ– Ğ¼Ğ¾Ğ´ÑƒĞ»Ñ–Ğ² M01-M85. Ğ¯ĞºÑ‰Ğ¾ Ñ‰Ğ¾ÑÑŒ Ğ·Ğ´Ğ°Ñ”Ñ‚ÑŒÑÑ ÑĞºĞ»Ğ°Ğ´Ğ½Ğ¸Ğ¼ â€” Ğ¿Ğ¾Ğ²ĞµÑ€Ğ½Ñ–Ñ‚ÑŒÑÑ Ğ´Ğ¾ Ğ²Ñ–Ğ´Ğ¿Ğ¾Ğ²Ñ–Ğ´Ğ½Ğ¾Ğ³Ğ¾ Ğ¼Ğ¾Ğ´ÑƒĞ»Ñ Ğ´Ğ»Ñ Ğ¿Ğ¾Ğ²Ñ‚Ğ¾Ñ€ĞµĞ½Ğ½Ñ.\n\n---\n\n## Ğ¡Ñ‚Ñ€ÑƒĞºÑ‚ÑƒÑ€Ğ° Ğ¿Ñ–Ğ´ÑÑƒĞ¼ĞºĞ¾Ğ²Ğ¾Ğ³Ğ¾ Ğ¼Ğ¾Ğ´ÑƒĞ»Ñ\n\nĞ’Ğ¸ Ğ²Ğ¸ĞºĞ¾Ğ½Ğ°Ñ”Ñ‚Ğµ **Ğ¿'ÑÑ‚ÑŒ ĞºĞ¾Ğ¼Ğ¿Ğ»ĞµĞºÑĞ½Ğ¸Ñ… Ğ·Ğ°Ğ²Ğ´Ğ°Ğ½ÑŒ**, ÑĞºÑ– Ğ¿ĞµÑ€ĞµĞ²Ñ–Ñ€ÑÑ‚ÑŒ ÑƒÑÑ– Ğ½Ğ°Ğ²Ğ¸Ñ‡ĞºĞ¸ Ñ€Ñ–Ğ²Ğ½Ñ B1:\n\n| Ğ—Ğ°Ğ²Ğ´Ğ°Ğ½Ğ½Ñ | ĞĞ°Ğ²Ğ¸Ñ‡ĞºĞ° | Ğ¤Ğ¾ĞºÑƒÑ |\n|----------|---------|-------|\n| Ğ—Ğ°Ğ²Ğ´Ğ°Ğ½Ğ½Ñ 1 | Ğ§Ğ¸Ñ‚Ğ°Ğ½Ğ½Ñ | ĞĞ²Ñ‚ĞµĞ½Ñ‚Ğ¸Ñ‡Ğ½Ğ¸Ğ¹ Ñ‚ĞµĞºÑÑ‚ Ñ–Ğ· Ğ·Ğ°Ğ¿Ğ¸Ñ‚Ğ°Ğ½Ğ½ÑĞ¼Ğ¸ |\n| Ğ—Ğ°Ğ²Ğ´Ğ°Ğ½Ğ½Ñ 2 | ĞŸĞ¸ÑÑŒĞ¼Ğ¾ | Ğ•ÑĞµ Ğ½Ğ° 250+ ÑĞ»Ñ–Ğ² |\n| Ğ—Ğ°Ğ²Ğ´Ğ°Ğ½Ğ½Ñ 3 | ĞÑƒĞ´Ñ–ÑĞ²Ğ°Ğ½Ğ½Ñ | ĞŸÑ–Ğ´ĞºĞ°ÑÑ‚ Ñ–Ğ· Ğ½Ğ¾Ñ‚Ğ°Ñ‚ĞºĞ°Ğ¼Ğ¸ |\n| Ğ—Ğ°Ğ²Ğ´Ğ°Ğ½Ğ½Ñ 4 | Ğ“Ñ€Ğ°Ğ¼Ğ°Ñ‚Ğ¸ĞºĞ° | ĞšĞ¾Ğ¼Ğ¿Ğ»ĞµĞºÑĞ½Ğ¸Ğ¹ Ñ‚ĞµÑÑ‚ |\n| Ğ—Ğ°Ğ²Ğ´Ğ°Ğ½Ğ½Ñ 5 | Ğ›ĞµĞºÑĞ¸ĞºĞ° | Ğ¢ĞµÑÑ‚ Ğ½Ğ° Ğ²ÑÑ– Ğ´Ğ¾Ğ¼ĞµĞ½Ğ¸ |\n\n---\n\n## Ğ—Ğ°Ğ²Ğ´Ğ°Ğ½Ğ½Ñ 1: Ğ§Ğ¸Ñ‚Ğ°Ğ½Ğ½Ñ\n\nĞŸÑ€Ğ¾Ñ‡Ğ¸Ñ‚Ğ°Ğ¹Ñ‚Ğµ ÑÑ‚Ğ°Ñ‚Ñ‚Ñ Ğ¿Ñ€Ğ¾ ÑƒĞºÑ€Ğ°Ñ—Ğ½ÑÑŒĞºÑƒ Ğ†Ğ¢-Ğ³Ğ°Ğ»ÑƒĞ·ÑŒ Ñ‚Ğ° Ğ´Ğ°Ğ¹Ñ‚Ğµ Ğ²Ñ–Ğ´Ğ¿Ğ¾Ğ²Ñ–Ğ´Ñ– Ğ½Ğ° Ğ·Ğ°Ğ¿Ğ¸Ñ‚Ğ°Ğ½Ğ½Ñ.\n\n---\n\n### Ğ¢ĞµĞºÑÑ‚ Ğ´Ğ»Ñ Ñ‡Ğ¸Ñ‚Ğ°Ğ½Ğ½Ñ\n\n**Ğ£ĞºÑ€Ğ°Ñ—Ğ½ÑÑŒĞºĞ° Ğ†Ğ¢-Ñ–Ğ½Ğ´ÑƒÑÑ‚Ñ€Ñ–Ñ: Ñ–ÑÑ‚Ğ¾Ñ€Ñ–Ñ ÑƒÑĞ¿Ñ–Ñ…Ñƒ**\n\nĞ£ĞºÑ€Ğ°Ñ—Ğ½Ğ° ÑÑ‚Ğ°Ğ»Ğ° Ğ¾Ğ´Ğ½Ñ–Ñ”Ñ Ğ· Ğ½Ğ°Ğ¹Ğ±Ñ–Ğ»ÑŒÑˆĞ¸Ñ… Ğ†Ğ¢-ĞºÑ€Ğ°Ñ—Ğ½ Ğ„Ğ²Ñ€Ğ¾Ğ¿Ğ¸. Ğ—Ğ° Ğ¾ÑÑ‚Ğ°Ğ½Ğ½Ñ– Ğ´ĞµÑÑÑ‚ÑŒ Ñ€Ğ¾ĞºÑ–Ğ² ĞºÑ–Ğ»ÑŒĞºÑ–ÑÑ‚ÑŒ IT-ÑĞ¿ĞµÑ†Ñ–Ğ°Ğ»Ñ–ÑÑ‚Ñ–Ğ² Ğ·Ñ€Ğ¾ÑĞ»Ğ° Ğ· Ğ¿'ÑÑ‚Ğ´ĞµÑÑÑ‚Ğ¸ Ñ‚Ğ¸ÑÑÑ‡ Ğ´Ğ¾ Ğ¿Ğ¾Ğ½Ğ°Ğ´ Ñ‚Ñ€ÑŒĞ¾Ñ…ÑĞ¾Ñ‚ Ñ‚Ğ¸ÑÑÑ‡. Ğ¢Ğ°ĞºĞ¸Ğ¹ ÑÑ‚Ñ€Ñ–Ğ¼ĞºĞ¸Ğ¹ Ñ€Ğ¾Ğ·Ğ²Ğ¸Ñ‚Ğ¾Ğº Ğ¿Ğ¾ÑÑĞ½ÑÑ”Ñ‚ÑŒÑÑ ĞºÑ–Ğ»ÑŒĞºĞ¾Ğ¼Ğ° Ñ„Ğ°ĞºÑ‚Ğ¾Ñ€Ğ°Ğ¼Ğ¸: ÑĞ¸Ğ»ÑŒĞ½Ğ¾Ñ Ñ‚ĞµÑ…Ğ½Ñ–Ñ‡Ğ½Ğ¾Ñ Ğ¾ÑĞ²Ñ–Ñ‚Ğ¾Ñ, Ğ½Ğ¸Ğ¶Ñ‡Ğ¸Ğ¼Ğ¸ Ğ·Ğ°Ñ€Ğ¿Ğ»Ğ°Ñ‚Ğ°Ğ¼Ğ¸ Ğ¿Ğ¾Ñ€Ñ–Ğ²Ğ½ÑĞ½Ğ¾ Ñ–Ğ· Ğ—Ğ°Ñ…Ñ–Ğ´Ğ½Ğ¾Ñ Ğ„Ğ²Ñ€Ğ¾Ğ¿Ğ¾Ñ Ñ‚Ğ° Ğ²Ğ¸ÑĞ¾ĞºĞ¾Ñ Ğ¼Ğ¾Ñ‚Ğ¸Ğ²Ğ°Ñ†Ñ–Ñ”Ñ Ğ¼Ğ¾Ğ»Ğ¾Ğ´Ñ–.\n\nĞĞ°Ğ¹Ğ±Ñ–Ğ»ÑŒÑˆÑ– ÑƒĞºÑ€Ğ°Ñ—Ğ½ÑÑŒĞºÑ– Ğ†Ğ¢-ĞºĞ¾Ğ¼Ğ¿Ğ°Ğ½Ñ–Ñ— â€” EPAM, SoftServe Ñ‚Ğ° GlobalLogic â€” Ğ¼Ğ°ÑÑ‚ÑŒ Ğ¾Ñ„Ñ–ÑĞ¸ Ğ² Ğ±Ğ°Ğ³Ğ°Ñ‚ÑŒĞ¾Ñ… Ğ¼Ñ–ÑÑ‚Ğ°Ñ…: ĞšĞ¸Ñ”Ğ²Ñ–, Ğ›ÑŒĞ²Ğ¾Ğ²Ñ–, Ğ¥Ğ°Ñ€ĞºĞ¾Ğ²Ñ–, ĞĞ´ĞµÑÑ– Ñ‚Ğ° Ğ”Ğ½Ñ–Ğ¿Ñ€Ñ–. Ğ¦Ñ– ĞºĞ¾Ğ¼Ğ¿Ğ°Ğ½Ñ–Ñ— Ğ¿Ñ€Ğ°Ñ†ÑÑÑ‚ÑŒ Ñ–Ğ· ĞºĞ»Ñ–Ñ”Ğ½Ñ‚Ğ°Ğ¼Ğ¸ Ğ· ÑƒÑÑŒĞ¾Ğ³Ğ¾ ÑĞ²Ñ–Ñ‚Ñƒ, Ñ€Ğ¾Ğ·Ñ€Ğ¾Ğ±Ğ»ÑÑÑ‡Ğ¸ Ğ¿Ñ€Ğ¾Ğ³Ñ€Ğ°Ğ¼Ğ½Ğµ Ğ·Ğ°Ğ±ĞµĞ·Ğ¿ĞµÑ‡ĞµĞ½Ğ½Ñ Ğ´Ğ»Ñ Ğ±Ğ°Ğ½ĞºÑ–Ğ², Ğ¼ĞµĞ´Ğ¸Ñ‡Ğ½Ğ¸Ñ… ÑƒÑÑ‚Ğ°Ğ½Ğ¾Ğ² Ñ‚Ğ° Ñ‚ĞµÑ…Ğ½Ğ¾Ğ»Ğ¾Ğ³Ñ–Ñ‡Ğ½Ğ¸Ñ… Ğ³Ñ–Ğ³Ğ°Ğ½Ñ‚Ñ–Ğ².\n\nĞĞºÑ€ĞµĞ¼Ğ¾ Ğ²Ğ°Ñ€Ñ‚Ğ¾ Ğ·Ğ³Ğ°Ğ´Ğ°Ñ‚Ğ¸ ÑƒĞºÑ€Ğ°Ñ—Ğ½ÑÑŒĞºÑ– ÑÑ‚Ğ°Ñ€Ñ‚Ğ°Ğ¿Ğ¸, ÑĞºÑ– Ğ·Ğ´Ğ¾Ğ±ÑƒĞ»Ğ¸ ÑĞ²Ñ–Ñ‚Ğ¾Ğ²Ğµ Ğ²Ğ¸Ğ·Ğ½Ğ°Ğ½Ğ½Ñ. Grammarly, Ğ·Ğ°ÑĞ½Ğ¾Ğ²Ğ°Ğ½Ğ° Ñƒ ĞšĞ¸Ñ”Ğ²Ñ– Ñƒ 2009 Ñ€Ğ¾Ñ†Ñ–, Ğ´Ğ¾Ğ¿Ğ¾Ğ¼Ğ°Ğ³Ğ°Ñ” Ğ¼Ñ–Ğ»ÑŒĞ¹Ğ¾Ğ½Ğ°Ğ¼ Ğ»ÑĞ´ĞµĞ¹ Ğ¿Ğ¸ÑĞ°Ñ‚Ğ¸ Ğ°Ğ½Ğ³Ğ»Ñ–Ğ¹ÑÑŒĞºĞ¾Ñ Ğ±ĞµĞ· Ğ¿Ğ¾Ğ¼Ğ¸Ğ»Ğ¾Ğº. GitLab, ÑÑ‚Ğ²Ğ¾Ñ€ĞµĞ½Ğ° ÑƒĞºÑ€Ğ°Ñ—Ğ½Ñ†ĞµĞ¼ Ğ”Ğ¼Ğ¸Ñ‚Ñ€Ğ¾Ğ¼ Ğ—Ğ°Ğ¿Ğ¾Ñ€Ğ¾Ğ¶Ñ†ĞµĞ¼, Ğ²Ğ¸ĞºĞ¾Ñ€Ğ¸ÑÑ‚Ğ¾Ğ²ÑƒÑ”Ñ‚ÑŒÑÑ Ğ¼Ñ–Ğ»ÑŒĞ¹Ğ¾Ğ½Ğ°Ğ¼Ğ¸ Ñ€Ğ¾Ğ·Ñ€Ğ¾Ğ±Ğ½Ğ¸ĞºÑ–Ğ² Ğ¿Ğ¾ Ğ²ÑÑŒĞ¾Ğ¼Ñƒ ÑĞ²Ñ–Ñ‚Ñƒ. MacPaw Ñ–Ğ· ĞšĞ¸Ñ”Ğ²Ğ° ÑÑ‚Ğ²Ğ¾Ñ€ÑÑ” Ğ¿Ğ¾Ğ¿ÑƒĞ»ÑÑ€Ğ½Ğµ Ğ¿Ñ€Ğ¾Ğ³Ñ€Ğ°Ğ¼Ğ½Ğµ Ğ·Ğ°Ğ±ĞµĞ·Ğ¿ĞµÑ‡ĞµĞ½Ğ½Ñ Ğ´Ğ»Ñ Mac.\n\nĞ’Ñ–Ğ¹Ğ½Ğ°, ÑĞºĞ° Ğ¿Ğ¾Ñ‡Ğ°Ğ»Ğ°ÑÑ Ñƒ 2022 Ñ€Ğ¾Ñ†Ñ–, ÑÑ‚Ğ²Ğ¾Ñ€Ğ¸Ğ»Ğ° ÑĞµÑ€Ğ¹Ğ¾Ğ·Ğ½Ñ– Ğ²Ğ¸ĞºĞ»Ğ¸ĞºĞ¸ Ğ´Ğ»Ñ Ğ³Ğ°Ğ»ÑƒĞ·Ñ–. Ğ‘Ğ°Ğ³Ğ°Ñ‚Ğ¾ ÑĞ¿ĞµÑ†Ñ–Ğ°Ğ»Ñ–ÑÑ‚Ñ–Ğ² Ğ±ÑƒĞ»Ğ¸ Ğ·Ğ¼ÑƒÑˆĞµĞ½Ñ– Ğ¿ĞµÑ€ĞµÑ—Ñ…Ğ°Ñ‚Ğ¸ Ğ² Ñ–Ğ½ÑˆÑ– Ğ¼Ñ–ÑÑ‚Ğ° Ğ°Ğ±Ğ¾ Ğ·Ğ° ĞºĞ¾Ñ€Ğ´Ğ¾Ğ½. ĞŸÑ€Ğ¾Ñ‚Ğµ Ñ–Ğ½Ğ´ÑƒÑÑ‚Ñ€Ñ–Ñ Ğ¿Ğ¾ĞºĞ°Ğ·Ğ°Ğ»Ğ° Ğ½ĞµĞ¹Ğ¼Ğ¾Ğ²Ñ–Ñ€Ğ½Ñƒ ÑÑ‚Ñ–Ğ¹ĞºÑ–ÑÑ‚ÑŒ. Ğ‘Ñ–Ğ»ÑŒÑˆÑ–ÑÑ‚ÑŒ ĞºĞ¾Ğ¼Ğ¿Ğ°Ğ½Ñ–Ğ¹ Ğ¿Ñ€Ğ¾Ğ´Ğ¾Ğ²Ğ¶Ğ¸Ğ»Ğ¸ Ñ€Ğ¾Ğ±Ğ¾Ñ‚Ñƒ, Ğ°Ğ´Ğ°Ğ¿Ñ‚ÑƒĞ²Ğ°Ğ²ÑˆĞ¸ÑÑŒ Ğ´Ğ¾ Ğ½Ğ¾Ğ²Ğ¸Ñ… ÑƒĞ¼Ğ¾Ğ². Ğ£ĞºÑ€Ğ°Ñ—Ğ½ÑÑŒĞºÑ– Ğ†Ğ¢-Ñ„Ğ°Ñ…Ñ–Ğ²Ñ†Ñ– Ğ´ĞµĞ¼Ğ¾Ğ½ÑÑ‚Ñ€ÑƒÑÑ‚ÑŒ Ğ½Ğµ Ğ»Ğ¸ÑˆĞµ Ñ‚ĞµÑ…Ğ½Ñ–Ñ‡Ğ½Ñƒ Ğ¼Ğ°Ğ¹ÑÑ‚ĞµÑ€Ğ½Ñ–ÑÑ‚ÑŒ, Ğ° Ğ¹ Ğ·Ğ´Ğ°Ñ‚Ğ½Ñ–ÑÑ‚ÑŒ Ğ´Ğ¾Ğ»Ğ°Ñ‚Ğ¸ ÑĞºĞ»Ğ°Ğ´Ğ½Ğ¾Ñ‰Ñ–.\n\nĞœĞ°Ğ¹Ğ±ÑƒÑ‚Ğ½Ñ” ÑƒĞºÑ€Ğ°Ñ—Ğ½ÑÑŒĞºĞ¾Ñ— Ğ†Ğ¢-Ğ³Ğ°Ğ»ÑƒĞ·Ñ– Ğ·Ğ°Ğ»Ğ¸ÑˆĞ°Ñ”Ñ‚ÑŒÑÑ Ğ¿ĞµÑ€ÑĞ¿ĞµĞºÑ‚Ğ¸Ğ²Ğ½Ğ¸Ğ¼. Ğ£Ñ€ÑĞ´ Ğ¿Ñ–Ğ´Ñ‚Ñ€Ğ¸Ğ¼ÑƒÑ” Ñ€Ğ¾Ğ·Ğ²Ğ¸Ñ‚Ğ¾Ğº Ñ‚ĞµÑ…Ğ½Ğ¾Ğ»Ğ¾Ğ³Ñ–Ñ‡Ğ½Ğ¾Ğ³Ğ¾ ÑĞµĞºÑ‚Ğ¾Ñ€Ñƒ, Ğ° ÑƒĞºÑ€Ğ°Ñ—Ğ½ÑÑŒĞºÑ– ÑƒĞ½Ñ–Ğ²ĞµÑ€ÑĞ¸Ñ‚ĞµÑ‚Ğ¸ Ğ³Ğ¾Ñ‚ÑƒÑÑ‚ÑŒ Ğ½Ğ¾Ğ²Ñ– Ğ¿Ğ¾ĞºĞ¾Ğ»Ñ–Ğ½Ğ½Ñ ÑĞ¿ĞµÑ†Ñ–Ğ°Ğ»Ñ–ÑÑ‚Ñ–Ğ². Ğ¯Ğº Ğ³Ğ¾Ğ²Ğ¾Ñ€ÑÑ‚ÑŒ ÑĞ°Ğ¼Ñ– Ğ°Ğ¹Ñ‚Ñ–ÑˆĞ½Ğ¸ĞºĞ¸: Â«ĞœĞ¸ Ğ¿Ğ¸ÑĞ°Ğ»Ğ¸ ĞºĞ¾Ğ´ Ğ¿Ñ–Ğ´ Ğ¾Ğ±ÑÑ‚Ñ€Ñ–Ğ»Ğ°Ğ¼Ğ¸, Ñ– Ğ¼Ğ¸ Ğ±ÑƒĞ´ĞµĞ¼Ğ¾ Ğ¿Ğ¸ÑĞ°Ñ‚Ğ¸ Ğ¹Ğ¾Ğ³Ğ¾ Ğ¿Ñ–ÑĞ»Ñ Ğ¿ĞµÑ€ĞµĞ¼Ğ¾Ğ³Ğ¸Â».\n\n> ğŸ¯ **Ğ¤Ğ°ĞºÑ‚**\n> Ğ£ĞºÑ€Ğ°Ñ—Ğ½Ğ° Ğ²Ñ…Ğ¾Ğ´Ğ¸Ñ‚ÑŒ Ğ´Ğ¾ Ñ‚Ğ¾Ğ¿-5 ĞºÑ€Ğ°Ñ—Ğ½ Ğ„Ğ²Ñ€Ğ¾Ğ¿Ğ¸ Ğ·Ğ° ĞºÑ–Ğ»ÑŒĞºÑ–ÑÑ‚Ñ Ğ†Ğ¢-ÑĞ¿ĞµÑ†Ñ–Ğ°Ğ»Ñ–ÑÑ‚Ñ–Ğ².\n\n---\n\n### Ğ—Ğ°Ğ¿Ğ¸Ñ‚Ğ°Ğ½Ğ½Ñ Ğ´Ğ¾ Ñ‚ĞµĞºÑÑ‚Ñƒ\n\nĞ”Ğ°Ğ¹Ñ‚Ğµ Ğ²Ñ–Ğ´Ğ¿Ğ¾Ğ²Ñ–Ğ´Ñ– Ğ½Ğ° Ğ·Ğ°Ğ¿Ğ¸Ñ‚Ğ°Ğ½Ğ½Ñ, Ğ¾Ğ±Ğ¸Ñ€Ğ°ÑÑ‡Ğ¸ Ğ¿Ñ€Ğ°Ğ²Ğ¸Ğ»ÑŒĞ½Ğ¸Ğ¹ Ğ²Ğ°Ñ€Ñ–Ğ°Ğ½Ñ‚:\n\n1. Ğ¡ĞºÑ–Ğ»ÑŒĞºĞ¸ Ğ†Ğ¢-ÑĞ¿ĞµÑ†Ñ–Ğ°Ğ»Ñ–ÑÑ‚Ñ–Ğ² Ğ¿Ñ€Ğ°Ñ†ÑÑ” Ğ² Ğ£ĞºÑ€Ğ°Ñ—Ğ½Ñ– Ğ·Ğ°Ñ€Ğ°Ğ·?\n\n2. Ğ¯ĞºÑ– Ñ„Ğ°ĞºÑ‚Ğ¾Ñ€Ğ¸ Ğ¿Ğ¾ÑÑĞ½ÑÑÑ‚ÑŒ Ñ€Ğ¾Ğ·Ğ²Ğ¸Ñ‚Ğ¾Ğº Ğ†Ğ¢-Ğ³Ğ°Ğ»ÑƒĞ·Ñ–?\n\n3. Ğ£ ÑĞºĞ¸Ñ… Ğ¼Ñ–ÑÑ‚Ğ°Ñ… Ñ” Ğ¾Ñ„Ñ–ÑĞ¸ Ğ½Ğ°Ğ¹Ğ±Ñ–Ğ»ÑŒÑˆĞ¸Ñ… Ğ†Ğ¢-ĞºĞ¾Ğ¼Ğ¿Ğ°Ğ½Ñ–Ğ¹?\n\n4. ĞšĞ¾Ğ»Ğ¸ Ğ±ÑƒĞ»Ğ° Ğ·Ğ°ÑĞ½Ğ¾Ğ²Ğ°Ğ½Ğ° Grammarly?\n\n5. Ğ¥Ñ‚Ğ¾ ÑÑ‚Ğ²Ğ¾Ñ€Ğ¸Ğ² GitLab?\n\n6. Ğ¯Ğº Ñ–Ğ½Ğ´ÑƒÑÑ‚Ñ€Ñ–Ñ Ğ²Ñ–Ğ´Ñ€ĞµĞ°Ğ³ÑƒĞ²Ğ°Ğ»Ğ° Ğ½Ğ° Ğ²Ñ–Ğ¹Ğ½Ñƒ?\n\n7. Ğ¯ĞºĞµ ÑÑ‚Ğ°Ğ²Ğ»ĞµĞ½Ğ½Ñ Ğ°Ğ²Ñ‚Ğ¾Ñ€Ğ° Ğ´Ğ¾ Ğ¼Ğ°Ğ¹Ğ±ÑƒÑ‚Ğ½ÑŒĞ¾Ğ³Ğ¾ Ğ³Ğ°Ğ»ÑƒĞ·Ñ–?\n\n8. Ğ©Ğ¾ Ğ¾Ğ·Ğ½Ğ°Ñ‡Ğ°Ñ” Ñ„Ñ€Ğ°Ğ·Ğ° Â«ÑÑ‚Ñ–Ğ¹ĞºÑ–ÑÑ‚ÑŒÂ» Ñƒ ĞºĞ¾Ğ½Ñ‚ĞµĞºÑÑ‚Ñ– ÑÑ‚Ğ°Ñ‚Ñ‚Ñ–?\n\n9. Ğ¯ĞºĞ° ĞºĞ¾Ğ¼Ğ¿Ğ°Ğ½Ñ–Ñ ÑÑ‚Ğ²Ğ¾Ñ€ÑÑ” Ğ¿Ñ€Ğ¾Ğ³Ñ€Ğ°Ğ¼Ğ¸ Ğ´Ğ»Ñ Mac?\n\n10. Ğ©Ğ¾ Ğ´ĞµĞ¼Ğ¾Ğ½ÑÑ‚Ñ€ÑƒÑÑ‚ÑŒ ÑƒĞºÑ€Ğ°Ñ—Ğ½ÑÑŒĞºÑ– Ğ†Ğ¢-Ñ„Ğ°Ñ…Ñ–Ğ²Ñ†Ñ–, Ğ¾ĞºÑ€Ñ–Ğ¼ Ñ‚ĞµÑ…Ğ½Ñ–Ñ‡Ğ½Ğ¾Ñ— Ğ¼Ğ°Ğ¹ÑÑ‚ĞµÑ€Ğ½Ğ¾ÑÑ‚Ñ–?\n\n---\n\n## Ğ—Ğ°Ğ²Ğ´Ğ°Ğ½Ğ½Ñ 2: ĞŸĞ¸ÑÑŒĞ¼Ğ¾\n\nĞĞ°Ğ¿Ğ¸ÑˆÑ–Ñ‚ÑŒ ĞµÑĞµ Ğ½Ğ° Ñ‚ĞµĞ¼Ñƒ: **Â«ĞœÑ–Ğ¹ Ğ´Ğ¾ÑĞ²Ñ–Ğ´ Ğ²Ğ¸Ğ²Ñ‡ĞµĞ½Ğ½Ñ ÑƒĞºÑ€Ğ°Ñ—Ğ½ÑÑŒĞºĞ¾Ñ— Ğ¼Ğ¾Ğ²Ğ¸Â»**.\n\n---\n\n### Ğ’Ğ¸Ğ¼Ğ¾Ğ³Ğ¸ Ğ´Ğ¾ ĞµÑĞµ\n\n- **ĞĞ±ÑÑĞ³:** 250+ ÑĞ»Ñ–Ğ²\n- **Ğ¡Ñ‚Ñ€ÑƒĞºÑ‚ÑƒÑ€Ğ°:** Ğ²ÑÑ‚ÑƒĞ¿, Ğ¾ÑĞ½Ğ¾Ğ²Ğ½Ğ° Ñ‡Ğ°ÑÑ‚Ğ¸Ğ½Ğ°, Ğ²Ğ¸ÑĞ½Ğ¾Ğ²Ğ¾Ğº\n- **Ğ“Ñ€Ğ°Ğ¼Ğ°Ñ‚Ğ¸ĞºĞ°:** Ğ²Ğ¸ĞºĞ¾Ñ€Ğ¸ÑÑ‚Ğ°Ğ¹Ñ‚Ğµ Ğ²Ğ¸Ğ´ Ğ´Ñ–Ñ”ÑĞ»Ğ¾Ğ²Ğ°, Ğ´Ñ–Ñ”ÑĞ»Ğ¾Ğ²Ğ° Ñ€ÑƒÑ…Ñƒ, ÑĞºĞ»Ğ°Ğ´Ğ½Ñ– Ñ€ĞµÑ‡ĞµĞ½Ğ½Ñ, Ğ¿Ğ°ÑĞ¸Ğ²Ğ½Ñ– ĞºĞ¾Ğ½ÑÑ‚Ñ€ÑƒĞºÑ†Ñ–Ñ—\n\n---\n\n### ĞŸĞ»Ğ°Ğ½ ĞµÑĞµ\n\n1. **Ğ’ÑÑ‚ÑƒĞ¿ (50 ÑĞ»Ñ–Ğ²)**\n   - Ğ§Ğ¾Ğ¼Ñƒ Ğ²Ğ¸ Ğ¿Ğ¾Ñ‡Ğ°Ğ»Ğ¸ Ğ²Ğ¸Ğ²Ñ‡Ğ°Ñ‚Ğ¸ ÑƒĞºÑ€Ğ°Ñ—Ğ½ÑÑŒĞºÑƒ?\n   - ĞšĞ¾Ğ»Ğ¸ Ñ†Ğµ Ğ±ÑƒĞ»Ğ¾?\n\n2. **ĞÑĞ½Ğ¾Ğ²Ğ½Ğ° Ñ‡Ğ°ÑÑ‚Ğ¸Ğ½Ğ° (150 ÑĞ»Ñ–Ğ²)**\n   - Ğ©Ğ¾ Ğ±ÑƒĞ»Ğ¾ Ğ½Ğ°Ğ¹ÑĞºĞ»Ğ°Ğ´Ğ½Ñ–ÑˆĞ¸Ğ¼?\n   - Ğ¯ĞºÑ– Ğ¼ĞµÑ‚Ğ¾Ğ´Ğ¸ Ğ´Ğ¾Ğ¿Ğ¾Ğ¼Ğ¾Ğ³Ğ»Ğ¸ Ğ²Ğ°Ğ¼ Ğ½Ğ°Ğ¹Ğ±Ñ–Ğ»ÑŒÑˆĞµ?\n   - ĞĞ¿Ğ¸ÑˆÑ–Ñ‚ÑŒ Ğ¾Ğ´Ğ¸Ğ½ Ğ¼Ğ¾Ğ¼ĞµĞ½Ñ‚, ĞºĞ¾Ğ»Ğ¸ Ğ²Ğ¸ Ğ²Ñ–Ğ´Ñ‡ÑƒĞ»Ğ¸ Ğ¿Ñ€Ğ¾Ğ³Ñ€ĞµÑ\n\n3. **Ğ’Ğ¸ÑĞ½Ğ¾Ğ²Ğ¾Ğº (50 ÑĞ»Ñ–Ğ²)**\n   - Ğ¯ĞºÑ– Ğ²Ğ°ÑˆÑ– Ğ¿Ğ»Ğ°Ğ½Ğ¸ Ğ½Ğ° Ğ¼Ğ°Ğ¹Ğ±ÑƒÑ‚Ğ½Ñ”?\n   - ĞšÑƒĞ´Ğ¸ Ğ²Ğ¸ Ñ…Ğ¾Ñ‚Ñ–Ğ»Ğ¸ Ğ± Ğ¿Ğ¾Ñ—Ñ…Ğ°Ñ‚Ğ¸ Ğ² Ğ£ĞºÑ€Ğ°Ñ—Ğ½Ñ–?\n\n> ğŸ’¡ **ĞŸĞ¾Ñ€Ğ°Ğ´Ğ°**\n> ĞŸĞ¾ĞºĞ°Ğ¶Ñ–Ñ‚ÑŒ Ğ²Ğ¾Ğ»Ğ¾Ğ´Ñ–Ğ½Ğ½Ñ Ğ²ÑÑ–Ğ¼Ğ° Ğ³Ñ€Ğ°Ğ¼Ğ°Ñ‚Ğ¸Ñ‡Ğ½Ğ¸Ğ¼Ğ¸ ÑÑ‚Ñ€ÑƒĞºÑ‚ÑƒÑ€Ğ°Ğ¼Ğ¸ B1. ĞĞ°Ğ¿Ñ€Ğ¸ĞºĞ»Ğ°Ğ´: Â«ĞšĞ¾Ğ»Ğ¸ Ñ Ğ¿Ñ€Ğ¸Ñ—Ñ…Ğ°Ğ²/Ğ¿Ñ€Ğ¸Ñ—Ñ…Ğ°Ğ»Ğ° Ğ´Ğ¾ Ğ›ÑŒĞ²Ğ¾Ğ²Ğ°...Â» (Ğ´Ñ–Ñ”ÑĞ»Ğ¾Ğ²Ğ¾ Ñ€ÑƒÑ…Ñƒ Ğ· Ğ¿Ñ€ĞµÑ„Ñ–ĞºÑĞ¾Ğ¼), Â«Ğ¯ Ñ…Ğ¾Ñ‡Ñƒ, Ñ‰Ğ¾Ğ± Ğ¼Ğ¾Ñ— Ğ´Ñ€ÑƒĞ·Ñ–...Â» (ÑĞºĞ»Ğ°Ğ´Ğ½Ğµ Ñ€ĞµÑ‡ĞµĞ½Ğ½Ñ), Â«ĞĞ°Ğ¿Ğ¸ÑĞ°Ğ½Ğ¸Ğ¹ Ğ¼Ğ½Ğ¾Ñ Ñ‚ĞµĞºÑÑ‚...Â» (Ğ¿Ğ°ÑĞ¸Ğ²Ğ½Ğ¸Ğ¹ Ğ´Ñ–Ñ”Ğ¿Ñ€Ğ¸ĞºĞ¼ĞµÑ‚Ğ½Ğ¸Ğº).\n\n---\n\n### Ğ ÑƒĞ±Ñ€Ğ¸ĞºĞ° Ğ¾Ñ†Ñ–Ğ½ÑĞ²Ğ°Ğ½Ğ½Ñ\n\n| ĞšÑ€Ğ¸Ñ‚ĞµÑ€Ñ–Ğ¹ | ĞœĞ°ĞºÑĞ¸Ğ¼ÑƒĞ¼ Ğ±Ğ°Ğ»Ñ–Ğ² | ĞĞ¿Ğ¸Ñ |\n|----------|----------------|------|\n| Ğ—Ğ¼Ñ–ÑÑ‚ | 5 | Ğ’ÑÑ– Ñ‡Ğ°ÑÑ‚Ğ¸Ğ½Ğ¸ Ğ¿Ğ»Ğ°Ğ½Ñƒ Ñ€Ğ¾Ğ·ĞºÑ€Ğ¸Ñ‚Ñ– |\n| Ğ“Ñ€Ğ°Ğ¼Ğ°Ñ‚Ğ¸ĞºĞ° | 5 | ĞŸÑ€Ğ°Ğ²Ğ¸Ğ»ÑŒĞ½Ğµ Ğ²Ğ¸ĞºĞ¾Ñ€Ğ¸ÑÑ‚Ğ°Ğ½Ğ½Ñ B1 ÑÑ‚Ñ€ÑƒĞºÑ‚ÑƒÑ€ |\n| Ğ›ĞµĞºÑĞ¸ĞºĞ° | 5 | Ğ Ñ–Ğ·Ğ½Ğ¾Ğ¼Ğ°Ğ½Ñ–Ñ‚Ğ½Ğ° Ğ»ĞµĞºÑĞ¸ĞºĞ° Ğ²ÑÑ–Ñ… Ğ´Ğ¾Ğ¼ĞµĞ½Ñ–Ğ² |\n| Ğ—Ğ²'ÑĞ·Ğ½Ñ–ÑÑ‚ÑŒ | 5 | Ğ›Ğ¾Ğ³Ñ–Ñ‡Ğ½Ğ° ÑÑ‚Ñ€ÑƒĞºÑ‚ÑƒÑ€Ğ°, ÑĞ¿Ğ¾Ğ»ÑƒÑ‡Ğ½Ğ¸ĞºĞ¸ |\n| **Ğ Ğ°Ğ·Ğ¾Ğ¼** | **20** | |\n\n---\n\n## Ğ—Ğ°Ğ²Ğ´Ğ°Ğ½Ğ½Ñ 3: ĞÑƒĞ´Ñ–ÑĞ²Ğ°Ğ½Ğ½Ñ\n\nĞŸÑ€Ğ¾ÑĞ»ÑƒÑ…Ğ°Ğ¹Ñ‚Ğµ Ğ¿Ğ¾Ğ´ĞºĞ°ÑÑ‚ Ğ¿Ñ€Ğ¾ ÑƒĞºÑ€Ğ°Ñ—Ğ½ÑÑŒĞºÑƒ ĞºÑƒĞ»ÑŒÑ‚ÑƒÑ€Ñƒ Ñ‚Ğ° Ğ´Ğ°Ğ¹Ñ‚Ğµ Ğ²Ñ–Ğ´Ğ¿Ğ¾Ğ²Ñ–Ğ´Ñ– Ğ½Ğ° Ğ·Ğ°Ğ¿Ğ¸Ñ‚Ğ°Ğ½Ğ½Ñ.\n\n---\n\n### Ğ ĞµĞºĞ¾Ğ¼ĞµĞ½Ğ´Ğ¾Ğ²Ğ°Ğ½Ñ– Ğ¿Ğ¾Ğ´ĞºĞ°ÑÑ‚Ğ¸\n\nĞĞ±ĞµÑ€Ñ–Ñ‚ÑŒ Ğ¾Ğ´Ğ¸Ğ½ Ğ¿Ğ¾Ğ´ĞºĞ°ÑÑ‚ (5-10 Ñ…Ğ²Ğ¸Ğ»Ğ¸Ğ½):\n\n- **ĞšĞ½Ğ¸Ğ¶ĞºĞ¾Ğ²Ğ¸Ğ¹ ĞÑ€ÑĞµĞ½Ğ°Ğ»** â€” Ğ¿Ñ€Ğ¾ ĞºĞ½Ğ¸Ğ³Ğ¸ Ñ‚Ğ° ĞºÑƒĞ»ÑŒÑ‚ÑƒÑ€Ñƒ\n- **Ğ Ğ¾Ğ·Ğ¼Ğ¾Ğ²Ğ°.ĞœĞµĞ´Ñ–Ğ°** â€” Ñ–Ğ½Ñ‚ĞµÑ€Ğ²'Ñ Ğ· Ñ†Ñ–ĞºĞ°Ğ²Ğ¸Ğ¼Ğ¸ Ğ»ÑĞ´ÑŒĞ¼Ğ¸\n- **Ğ¡ÑƒÑĞ¿Ñ–Ğ»ÑŒĞ½Ğµ Ğ Ğ°Ğ´Ñ–Ğ¾** â€” Ğ½Ğ¾Ğ²Ğ¸Ğ½Ğ¸ Ñ‚Ğ° Ğ°Ğ½Ğ°Ğ»Ñ–Ñ‚Ğ¸ĞºĞ°\n- **Ukrainian Lessons Podcast** â€” ÑƒÑ€Ğ¾ĞºĞ¸ Ğ´Ğ»Ñ Ğ²Ğ¸Ğ²Ñ‡ĞµĞ½Ğ½Ñ Ğ¼Ğ¾Ğ²Ğ¸\n\n---\n\n### Ğ—Ğ°Ğ²Ğ´Ğ°Ğ½Ğ½Ñ Ğ¿Ñ–Ğ´ Ñ‡Ğ°Ñ Ğ¿Ñ€Ğ¾ÑĞ»ÑƒÑ…Ğ¾Ğ²ÑƒĞ²Ğ°Ğ½Ğ½Ñ\n\n1. **ĞĞ¾Ñ‚Ğ°Ñ‚ĞºĞ¸:** Ğ—Ğ°Ğ¿Ğ¸ÑˆÑ–Ñ‚ÑŒ Ğ³Ğ¾Ğ»Ğ¾Ğ²Ğ½Ñ– Ğ´ÑƒĞ¼ĞºĞ¸ (5-7 Ğ¿ÑƒĞ½ĞºÑ‚Ñ–Ğ²)\n2. **ĞšĞ»ÑÑ‡Ğ¾Ğ²Ñ– ÑĞ»Ğ¾Ğ²Ğ°:** Ğ’Ğ¸Ğ´Ñ–Ğ»Ñ–Ñ‚ÑŒ 10 Ğ½Ğ¾Ğ²Ğ¸Ñ… ÑĞ»Ñ–Ğ²\n3. **Ğ ĞµĞ·ÑĞ¼Ğµ:** ĞĞ°Ğ¿Ğ¸ÑˆÑ–Ñ‚ÑŒ ĞºĞ¾Ñ€Ğ¾Ñ‚ĞºĞµ Ñ€ĞµĞ·ÑĞ¼Ğµ (50 ÑĞ»Ñ–Ğ²)\n\n---\n\n### Ğ—Ğ°Ğ¿Ğ¸Ñ‚Ğ°Ğ½Ğ½Ñ Ğ¿Ñ–ÑĞ»Ñ Ğ¿Ñ€Ğ¾ÑĞ»ÑƒÑ…Ğ¾Ğ²ÑƒĞ²Ğ°Ğ½Ğ½Ñ\n\n1. Ğ¯ĞºĞ° Ğ³Ğ¾Ğ»Ğ¾Ğ²Ğ½Ğ° Ñ‚ĞµĞ¼Ğ° Ğ¿Ğ¾Ğ´ĞºĞ°ÑÑ‚Ñƒ?\n2. Ğ¥Ñ‚Ğ¾ Ğ³Ğ¾Ğ»Ğ¾Ğ²Ğ½Ğ¸Ğ¹ Ğ³ĞµÑ€Ğ¾Ğ¹ Ğ°Ğ±Ğ¾ ÑĞ¿Ñ–ĞºĞµÑ€?\n3. Ğ¯ĞºÑ– Ğ°Ñ€Ğ³ÑƒĞ¼ĞµĞ½Ñ‚Ğ¸ Ğ½Ğ°Ğ²Ğ¾Ğ´Ğ¸Ğ»Ğ¸ÑÑŒ?\n4. Ğ— Ñ‡Ğ¸Ğ¼ Ğ²Ğ¸ Ğ¿Ğ¾Ğ³Ğ¾Ğ´Ğ¶ÑƒÑ”Ñ‚ĞµÑÑŒ? Ğ— Ñ‡Ğ¸Ğ¼ â€” Ğ½Ñ–?\n5. Ğ©Ğ¾ Ğ½Ğ¾Ğ²Ğ¾Ğ³Ğ¾ Ğ²Ğ¸ Ğ´Ñ–Ğ·Ğ½Ğ°Ğ»Ğ¸ÑÑŒ?\n\n> ğŸŒ **Ğ£ Ñ€ĞµĞ°Ğ»ÑŒĞ½Ğ¾Ğ¼Ñƒ Ğ¶Ğ¸Ñ‚Ñ‚Ñ–**\n> Ğ¡Ğ»ÑƒÑ…Ğ°Ğ¹Ñ‚Ğµ ÑƒĞºÑ€Ğ°Ñ—Ğ½ÑÑŒĞºÑ– Ğ¿Ğ¾Ğ´ĞºĞ°ÑÑ‚Ğ¸ Ñ‰Ğ¾Ğ´Ğ½Ñ Ğ¿Ğ¾ 10-15 Ñ…Ğ²Ğ¸Ğ»Ğ¸Ğ½. Ğ¦Ğµ Ğ½Ğ°Ğ¹ĞºÑ€Ğ°Ñ‰Ğ¸Ğ¹ ÑĞ¿Ğ¾ÑÑ–Ğ± Ğ¿Ğ¾ĞºÑ€Ğ°Ñ‰Ğ¸Ñ‚Ğ¸ Ñ€Ğ¾Ğ·ÑƒĞ¼Ñ–Ğ½Ğ½Ñ Ğ½Ğ° ÑĞ»ÑƒÑ… Ğ¿ĞµÑ€ĞµĞ´ Ñ€Ñ–Ğ²Ğ½ĞµĞ¼ B2.\n\n---\n\n## Ğ—Ğ°Ğ²Ğ´Ğ°Ğ½Ğ½Ñ 4: Ğ“Ñ€Ğ°Ğ¼Ğ°Ñ‚Ğ¸ĞºĞ°\n\nĞšĞ¾Ğ¼Ğ¿Ğ»ĞµĞºÑĞ½Ğ¸Ğ¹ Ñ‚ĞµÑÑ‚ Ğ½Ğ° Ğ²ÑÑ Ğ³Ñ€Ğ°Ğ¼Ğ°Ñ‚Ğ¸ĞºÑƒ B1.\n\n---\n\n### Ğ§Ğ°ÑÑ‚Ğ¸Ğ½Ğ° Ğ: Ğ’Ğ¸Ğ´ Ğ´Ñ–Ñ”ÑĞ»Ğ¾Ğ²Ğ°\n\nĞĞ±ĞµÑ€Ñ–Ñ‚ÑŒ Ğ¿Ñ€Ğ°Ğ²Ğ¸Ğ»ÑŒĞ½Ñƒ Ñ„Ğ¾Ñ€Ğ¼Ñƒ:\n\n1. Ğ’Ñ‡Ğ¾Ñ€Ğ° Ñ _______ (Ñ‡Ğ¸Ñ‚Ğ°Ğ²/Ğ¿Ñ€Ğ¾Ñ‡Ğ¸Ñ‚Ğ°Ğ²) Ñ†Ñ ĞºĞ½Ğ¸Ğ³Ñƒ Ğ²Ñ–Ğ´ Ğ¿Ğ¾Ñ‡Ğ°Ñ‚ĞºÑƒ Ğ´Ğ¾ ĞºÑ–Ğ½Ñ†Ñ.\n2. ĞšĞ¾Ğ»Ğ¸ Ñ Ğ±ÑƒĞ² ÑÑ‚ÑƒĞ´ĞµĞ½Ñ‚Ğ¾Ğ¼, Ñ Ñ‡Ğ°ÑÑ‚Ğ¾ _______ (Ñ‡Ğ¸Ñ‚Ğ°Ğ²/Ğ¿Ñ€Ğ¾Ñ‡Ğ¸Ñ‚Ğ°Ğ²) Ğ½Ğ°ÑƒĞºĞ¾Ğ²Ñ– ÑÑ‚Ğ°Ñ‚Ñ‚Ñ–.\n3. ĞĞµ _______ (Ğ²Ñ–Ğ´ĞºÑ€Ğ¸Ğ²Ğ°Ğ¹/Ğ²Ñ–Ğ´ĞºÑ€Ğ¸Ğ¹) Ğ²Ñ–ĞºĞ½Ğ¾ â€” Ğ½Ğ° Ğ²ÑƒĞ»Ğ¸Ñ†Ñ– Ñ…Ğ¾Ğ»Ğ¾Ğ´Ğ½Ğ¾!\n4. Ğ©Ğ¾Ğ´Ğ½Ñ _______ (Ğ²Ñ–Ğ´ĞºÑ€Ğ¸Ğ²Ğ°Ğ¹/Ğ²Ñ–Ğ´ĞºÑ€Ğ¸Ğ¹) Ğ²Ñ–ĞºĞ½Ğ¾ Ğ´Ğ»Ñ Ğ¿Ñ€Ğ¾Ğ²Ñ–Ñ‚Ñ€ÑĞ²Ğ°Ğ½Ğ½Ñ.\n5. Ğ¯ Ñ‰Ğµ Ğ½Ğµ _______ (Ğ¿Ğ¸ÑĞ°Ğ²/Ğ½Ğ°Ğ¿Ğ¸ÑĞ°Ğ²) Ğ·Ğ²Ñ–Ñ‚ â€” Ğ·Ñ€Ğ¾Ğ±Ğ»Ñ Ñ†Ğµ Ğ·Ğ°Ğ²Ñ‚Ñ€Ğ°.\n\n---\n\n### Ğ§Ğ°ÑÑ‚Ğ¸Ğ½Ğ° Ğ‘: Ğ”Ñ–Ñ”ÑĞ»Ğ¾Ğ²Ğ° Ñ€ÑƒÑ…Ñƒ\n\nĞ’ÑÑ‚Ğ°Ğ²Ñ‚Ğµ Ğ¿Ñ€Ğ°Ğ²Ğ¸Ğ»ÑŒĞ½Ğµ Ğ´Ñ–Ñ”ÑĞ»Ğ¾Ğ²Ğ¾:\n\n1. ĞœĞ¸ _______ (Ğ¿Ñ€Ğ¸Ñ…Ğ¾Ğ´Ğ¸Ğ»Ğ¸/Ğ¿Ñ€Ğ¸Ğ¹ÑˆĞ»Ğ¸) Ğ´Ğ¾ Ñ€ĞµÑÑ‚Ğ¾Ñ€Ğ°Ğ½Ñƒ Ğ¾ ÑÑŒĞ¾Ğ¼Ñ–Ğ¹ Ğ³Ğ¾Ğ´Ğ¸Ğ½Ñ–.\n2. Ğ›Ñ–Ñ‚Ğ°Ğº _______ (Ğ²Ñ–Ğ´Ğ»Ñ–Ñ‚Ğ°Ñ”/Ğ²Ñ–Ğ´Ğ»ĞµÑ‚Ñ–Ğ²) Ğ·Ğ° Ğ³Ğ¾Ğ´Ğ¸Ğ½Ñƒ.\n3. Ğ’Ğ¾Ğ½Ğ° _______ (Ğ¿ĞµÑ€ĞµÑ…Ğ¾Ğ´Ğ¸Ğ»Ğ°/Ğ¿ĞµÑ€ĞµĞ¹ÑˆĞ»Ğ°) Ñ‡ĞµÑ€ĞµĞ· Ğ´Ğ¾Ñ€Ğ¾Ğ³Ñƒ, ĞºĞ¾Ğ»Ğ¸ Ğ¿Ğ¾Ğ±Ğ°Ñ‡Ğ¸Ğ»Ğ° Ğ¿Ğ¾Ğ´Ñ€ÑƒĞ³Ñƒ.\n4. Ğ’Ñ–Ğ½ Ñ‡Ğ°ÑÑ‚Ğ¾ _______ (Ğ²Ğ¸Ñ…Ğ¾Ğ´Ğ¸Ğ²/Ğ²Ğ¸Ğ¹ÑˆĞ¾Ğ²) Ğ· Ğ´Ğ¾Ğ¼Ñƒ Ğ¾ Ğ²Ğ¾ÑÑŒĞ¼Ñ–Ğ¹ Ñ€Ğ°Ğ½ĞºÑƒ.\n5. ĞŸĞ¾Ñ‚ÑĞ³ ÑƒĞ¶Ğµ _______ (Ğ²Ñ–Ğ´Ñ…Ğ¾Ğ´Ğ¸Ğ²/Ğ²Ñ–Ğ´Ñ–Ğ¹ÑˆĞ¾Ğ²) Ğ²Ñ–Ğ´ Ğ¿Ğ»Ğ°Ñ‚Ñ„Ğ¾Ñ€Ğ¼Ğ¸.\n\n---\n\n### Ğ§Ğ°ÑÑ‚Ğ¸Ğ½Ğ° Ğ’: Ğ¡ĞºĞ»Ğ°Ğ´Ğ½Ñ– Ñ€ĞµÑ‡ĞµĞ½Ğ½Ñ\n\nĞ”Ğ¾Ğ¿Ğ¾Ğ²Ğ½Ñ–Ñ‚ÑŒ Ñ€ĞµÑ‡ĞµĞ½Ğ½Ñ ÑĞ¿Ğ¾Ğ»ÑƒÑ‡Ğ½Ğ¸ĞºĞ¾Ğ¼:\n\n1. Ğ¯ Ğ·Ğ°Ñ‚ĞµĞ»ĞµÑ„Ğ¾Ğ½ÑƒÑ Ñ‚Ğ¾Ğ±Ñ–, _______ Ğ¿Ñ€Ğ¸Ñ—Ğ´Ñƒ Ğ´Ğ¾Ğ´Ğ¾Ğ¼Ñƒ.\n2. Ğ’Ñ–Ğ½ Ğ½Ğµ Ğ¿Ñ€Ğ¸Ğ¹ÑˆĞ¾Ğ² Ğ½Ğ° Ğ·Ğ°Ğ½ÑÑ‚Ñ‚Ñ, _______ Ğ±ÑƒĞ² Ñ…Ğ²Ğ¾Ñ€Ğ¸Ğ¹.\n3. Ğ’Ğ¾Ğ½Ğ° Ğ²Ğ¸Ğ²Ñ‡Ğ°Ñ” ÑƒĞºÑ€Ğ°Ñ—Ğ½ÑÑŒĞºÑƒ, _______ Ñ…Ğ¾Ñ‡Ğµ Ğ¿Ñ€Ğ°Ñ†ÑĞ²Ğ°Ñ‚Ğ¸ Ğ² Ğ£ĞºÑ€Ğ°Ñ—Ğ½Ñ–.\n4. _______ Ñ Ğ¼Ğ°Ğ² Ğ±Ñ–Ğ»ÑŒÑˆĞµ Ñ‡Ğ°ÑÑƒ, Ñ Ğ± Ñ‡Ğ¸Ñ‚Ğ°Ğ² Ğ±Ñ–Ğ»ÑŒÑˆĞµ ĞºĞ½Ğ¸Ğ³.\n5. Ğ¦Ğµ Ñ‚Ğ¾Ğ¹ ÑÑ‚ÑƒĞ´ĞµĞ½Ñ‚, _______ Ğ¾Ñ‚Ñ€Ğ¸Ğ¼Ğ°Ğ² Ğ½Ğ°Ğ¹ĞºÑ€Ğ°Ñ‰Ñƒ Ğ¾Ñ†Ñ–Ğ½ĞºÑƒ.\n\n---\n\n### Ğ§Ğ°ÑÑ‚Ğ¸Ğ½Ğ° Ğ“: Ğ”Ñ–Ñ”Ğ¿Ñ€Ğ¸ĞºĞ¼ĞµÑ‚Ğ½Ğ¸ĞºĞ¸ Ñ‚Ğ° Ğ¿Ğ°ÑĞ¸Ğ²\n\nĞ¢Ñ€Ğ°Ğ½ÑÑ„Ğ¾Ñ€Ğ¼ÑƒĞ¹Ñ‚Ğµ Ñ€ĞµÑ‡ĞµĞ½Ğ½Ñ:\n\n1. Ğ¡Ñ‚ÑƒĞ´ĞµĞ½Ñ‚ Ğ½Ğ°Ğ¿Ğ¸ÑĞ°Ğ² ĞµÑĞµ. â†’ Ğ•ÑĞµ, _______ ÑÑ‚ÑƒĞ´ĞµĞ½Ñ‚Ğ¾Ğ¼...\n2. ĞšĞ½Ğ¸Ğ³Ñƒ Ğ¿ĞµÑ€ĞµĞºĞ»Ğ°Ğ»Ğ¸ ÑƒĞºÑ€Ğ°Ñ—Ğ½ÑÑŒĞºĞ¾Ñ. â†’ ĞšĞ½Ğ¸Ğ³Ğ° _______ ÑƒĞºÑ€Ğ°Ñ—Ğ½ÑÑŒĞºĞ¾Ñ.\n3. Ğ’Ñ–Ğ½ Ñ‡Ğ¸Ñ‚Ğ°Ğ² ĞºĞ½Ğ¸Ğ³Ñƒ Ñ– ÑĞ»ÑƒÑ…Ğ°Ğ² Ğ¼ÑƒĞ·Ğ¸ĞºÑƒ. â†’ _______ ĞºĞ½Ğ¸Ğ³Ñƒ, Ğ²Ñ–Ğ½ ÑĞ»ÑƒÑ…Ğ°Ğ² Ğ¼ÑƒĞ·Ğ¸ĞºÑƒ.\n4. Ğ’Ğ¾Ğ½Ğ° Ğ·Ğ°ĞºÑ–Ğ½Ñ‡Ğ¸Ğ»Ğ° Ñ€Ğ¾Ğ±Ğ¾Ñ‚Ñƒ Ñ– Ğ¿Ñ–ÑˆĞ»Ğ° Ğ´Ğ¾Ğ´Ğ¾Ğ¼Ñƒ. â†’ _______ Ñ€Ğ¾Ğ±Ğ¾Ñ‚Ñƒ, Ğ²Ğ¾Ğ½Ğ° Ğ¿Ñ–ÑˆĞ»Ğ° Ğ´Ğ¾Ğ´Ğ¾Ğ¼Ñƒ.\n5. Ğ¦Ğµ Ğ¿Ğ¸Ñ‚Ğ°Ğ½Ğ½Ñ Ñ‚Ñ€ĞµĞ±Ğ° Ñ€Ğ¾Ğ·Ğ³Ğ»ÑĞ½ÑƒÑ‚Ğ¸. â†’ Ğ¦Ğµ Ğ¿Ğ¸Ñ‚Ğ°Ğ½Ğ½Ñ _______.\n\n> ğŸ’¡ **ĞŸĞ¾Ñ€Ğ°Ğ´Ğ°**\n> Ğ¯ĞºÑ‰Ğ¾ Ğ²Ğ¸ Ğ´Ğ¾Ğ¿ÑƒÑÑ‚Ğ¸Ğ»Ğ¸ Ğ±Ñ–Ğ»ÑŒÑˆĞµ 5 Ğ¿Ğ¾Ğ¼Ğ¸Ğ»Ğ¾Ğº Ñƒ Ğ±ÑƒĞ´ÑŒ-ÑĞºÑ–Ğ¹ Ñ‡Ğ°ÑÑ‚Ğ¸Ğ½Ñ– â€” Ğ¿Ğ¾Ğ²ĞµÑ€Ğ½Ñ–Ñ‚ÑŒÑÑ Ğ´Ğ¾ Ğ²Ñ–Ğ´Ğ¿Ğ¾Ğ²Ñ–Ğ´Ğ½Ğ¸Ñ… Ğ¼Ğ¾Ğ´ÑƒĞ»Ñ–Ğ² Ğ´Ğ»Ñ Ğ¿Ğ¾Ğ²Ñ‚Ğ¾Ñ€ĞµĞ½Ğ½Ñ.\n\n---\n\n## Ğ—Ğ°Ğ²Ğ´Ğ°Ğ½Ğ½Ñ 5: Ğ›ĞµĞºÑĞ¸ĞºĞ°\n\nĞšĞ¾Ğ¼Ğ¿Ğ»ĞµĞºÑĞ½Ğ¸Ğ¹ Ñ‚ĞµÑÑ‚ Ğ½Ğ° Ğ²ÑÑ Ğ»ĞµĞºÑĞ¸ĞºÑƒ B1.\n\n---\n\n### Ğ§Ğ°ÑÑ‚Ğ¸Ğ½Ğ° Ğ: ĞĞ±ÑÑ‚Ñ€Ğ°ĞºÑ‚Ğ½Ñ– Ğ¿Ğ¾Ğ½ÑÑ‚Ñ‚Ñ (M52-55)\n\nĞĞ±ĞµÑ€Ñ–Ñ‚ÑŒ Ğ¿Ñ€Ğ°Ğ²Ğ¸Ğ»ÑŒĞ½Ğµ ÑĞ»Ğ¾Ğ²Ğ¾:\n\n1. Ğ”ĞµĞ¼Ğ¾ĞºÑ€Ğ°Ñ‚Ñ–Ñ Ğ±Ğ°Ğ·ÑƒÑ”Ñ‚ÑŒÑÑ Ğ½Ğ° Ğ¿Ñ€Ğ¸Ğ½Ñ†Ğ¸Ğ¿Ñ– Ñ€Ñ–Ğ²Ğ½Ğ¾ÑÑ‚Ñ– Ñ‚Ğ° _______.\n   - Ğ°) ÑĞ¿Ñ€Ğ°Ğ²ĞµĞ´Ğ»Ğ¸Ğ²Ğ¾ÑÑ‚Ñ–  Ğ±) Ğ½ĞµÑĞ¿Ñ€Ğ°Ğ²ĞµĞ´Ğ»Ğ¸Ğ²Ğ¾ÑÑ‚Ñ–  Ğ²) Ğ±Ğ°Ğ¹Ğ´ÑƒĞ¶Ğ¾ÑÑ‚Ñ–\n\n2. ĞĞ°ÑƒĞºĞ¾Ğ²ĞµÑ†ÑŒ Ğ¿Ñ€Ğ¾Ğ²Ñ–Ğ² _______ Ñ– Ğ¾Ñ‚Ñ€Ğ¸Ğ¼Ğ°Ğ² Ñ†Ñ–ĞºĞ°Ğ²Ñ– Ñ€ĞµĞ·ÑƒĞ»ÑŒÑ‚Ğ°Ñ‚Ğ¸.\n   - Ğ°) ĞºĞ¾Ğ½Ñ†ĞµĞ¿Ñ†Ñ–Ñ  Ğ±) Ğ´Ğ¾ÑĞ»Ñ–Ğ´Ğ¶ĞµĞ½Ğ½Ñ  Ğ²) Ğ³Ñ–Ğ¿Ğ¾Ñ‚ĞµĞ·Ñƒ\n\n3. Ğ¦ĞµĞ¹ Ğ¿Ñ€Ğ¾ĞµĞºÑ‚ Ğ¼Ğ°Ñ” Ğ²ĞµĞ»Ğ¸ĞºĞ¸Ğ¹ _______ Ğ´Ğ»Ñ Ñ€Ğ¾Ğ·Ğ²Ğ¸Ñ‚ĞºÑƒ Ğ¼Ñ–ÑÑ‚Ğ°.\n   - Ğ°) Ğ·Ğ½Ğ°Ñ‡ĞµĞ½Ğ½Ñ  Ğ±) Ğ²Ñ–Ğ´Ñ‡ÑƒÑ‚Ñ‚Ñ  Ğ²) Ğ²Ñ€Ğ°Ğ¶ĞµĞ½Ğ½Ñ\n\n---\n\n### Ğ§Ğ°ÑÑ‚Ğ¸Ğ½Ğ° Ğ‘: Ğ”Ğ¸ÑĞºÑƒÑ€Ñ Ñ‚Ğ° Ğ¼Ğ°Ñ€ĞºĞµÑ€Ğ¸ (M56-60)\n\nĞ’ÑÑ‚Ğ°Ğ²Ñ‚Ğµ Ğ¼Ğ°Ñ€ĞºĞµÑ€:\n\n1. _______, Ñ…Ğ¾Ñ‡Ñƒ Ğ¿Ğ¾Ğ´ÑĞºÑƒĞ²Ğ°Ñ‚Ğ¸ Ğ²ÑÑ–Ğ¼ ÑƒÑ‡Ğ°ÑĞ½Ğ¸ĞºĞ°Ğ¼.\n2. Ğ„ ĞºÑ–Ğ»ÑŒĞºĞ° Ğ°Ñ€Ğ³ÑƒĞ¼ĞµĞ½Ñ‚Ñ–Ğ² Â«Ğ·Ğ°Â». _______, Ñ” Ğ¹ Ğ°Ñ€Ğ³ÑƒĞ¼ĞµĞ½Ñ‚Ğ¸ Â«Ğ¿Ñ€Ğ¾Ñ‚Ğ¸Â».\n3. _______, Ñ…Ğ¾Ñ‡Ñƒ Ğ·Ğ°Ğ·Ğ½Ğ°Ñ‡Ğ¸Ñ‚Ğ¸ Ğ²Ğ°Ğ¶Ğ»Ğ¸Ğ²Ñ–ÑÑ‚ÑŒ Ñ†ÑŒĞ¾Ğ³Ğ¾ Ğ¿Ğ¸Ñ‚Ğ°Ğ½Ğ½Ñ.\n4. Ğ¦Ğµ ÑĞºĞ»Ğ°Ğ´Ğ½Ğ° Ğ¿Ñ€Ğ¾Ğ±Ğ»ĞµĞ¼Ğ°. _______, Ğ¼Ğ¸ Ğ·Ğ½Ğ°Ğ¹Ğ´ĞµĞ¼Ğ¾ Ñ€Ñ–ÑˆĞµĞ½Ğ½Ñ.\n\n---\n\n### Ğ§Ğ°ÑÑ‚Ğ¸Ğ½Ğ° Ğ’: ĞšÑƒĞ»ÑŒÑ‚ÑƒÑ€Ğ° Ñ‚Ğ° Ñ€ĞµĞ³Ñ–Ğ¾Ğ½Ğ¸ (M72-81)\n\nĞ¡Ğ¿Ñ–Ğ²ÑÑ‚Ğ°Ğ²Ñ‚Ğµ:\n\n| Ğ¢ĞµÑ€Ğ¼Ñ–Ğ½ | ĞĞ¿Ğ¸Ñ |\n|--------|------|\n| Ğ§Ğ¾Ñ€Ğ½Ğ¾Ğ±Ğ¸Ğ»ÑŒ | Ğ½Ğ°Ğ¹Ğ±Ñ–Ğ»ÑŒÑˆĞ° Ğ³Ğ¾Ñ€Ğ° ĞšĞ°Ñ€Ğ¿Ğ°Ñ‚ |\n| Ğ“Ğ¾Ğ²ĞµÑ€Ğ»Ğ° | Ğ¼Ñ–ÑÑ†Ğµ ÑĞ´ĞµÑ€Ğ½Ğ¾Ñ— ĞºĞ°Ñ‚Ğ°ÑÑ‚Ñ€Ğ¾Ñ„Ğ¸ |\n| Ğ›ÑŒĞ²Ñ–Ğ² | ĞºÑƒĞ»ÑŒÑ‚ÑƒÑ€Ğ½Ğ° ÑÑ‚Ğ¾Ğ»Ğ¸Ñ†Ñ |\n| ĞĞ´ĞµÑĞ° | Ğ¼Ñ–ÑÑ‚Ğ¾ Ğ±Ñ–Ğ»Ñ Ğ§Ğ¾Ñ€Ğ½Ğ¾Ğ³Ğ¾ Ğ¼Ğ¾Ñ€Ñ |\n\n---\n\n### Ğ§Ğ°ÑÑ‚Ğ¸Ğ½Ğ° Ğ“: ĞŸÑ€Ğ¾Ñ„ĞµÑÑ–Ğ¹Ğ½Ğ° Ğ»ĞµĞºÑĞ¸ĞºĞ° (M61, 66)\n\nĞ—Ğ°Ğ¿Ğ¾Ğ²Ğ½Ñ–Ñ‚ÑŒ Ğ¿Ñ€Ğ¾Ğ¿ÑƒÑĞºĞ¸:\n\n1. ĞšĞ¾Ğ¼Ğ¿Ğ°Ğ½Ñ–Ñ ÑˆÑƒĞºĞ°Ñ” Ğ´Ğ¾ÑĞ²Ñ–Ğ´Ñ‡ĞµĞ½Ğ¾Ğ³Ğ¾ _______ Ğ´Ğ»Ñ Ñ€Ğ¾Ğ·Ñ€Ğ¾Ğ±ĞºĞ¸ Ğ¿Ñ€Ğ¾Ğ³Ñ€Ğ°Ğ¼.\n2. ĞĞ° _______ Ğ¾Ğ±Ğ³Ğ¾Ğ²Ğ¾Ñ€ÑĞ²Ğ°Ğ»Ğ¸ ÑÑ‚Ñ€Ğ°Ñ‚ĞµĞ³Ñ–Ñ Ñ€Ğ¾Ğ·Ğ²Ğ¸Ñ‚ĞºÑƒ.\n3. Ğ’Ñ–Ğ½ Ğ¿Ğ¾Ğ´Ğ°Ğ² _______ Ğ½Ğ° Ğ²Ğ°ĞºĞ°Ğ½ÑÑ–Ñ Ğ¼ĞµĞ½ĞµĞ´Ğ¶ĞµÑ€Ğ°.\n4. ĞĞ°ÑˆĞ° _______ â€” ÑÑ‚Ğ°Ñ‚Ğ¸ Ğ»Ñ–Ğ´ĞµÑ€Ğ¾Ğ¼ Ñ€Ğ¸Ğ½ĞºÑƒ.\n\n---\n\n## Ğ¡Ğ°Ğ¼Ğ¾Ğ¾Ñ†Ñ–Ğ½ĞºĞ°\n\n### Ğ§Ğ¸ Ğ¼Ğ¾Ğ¶ĞµÑ‚Ğµ Ğ²Ğ¸...?\n\nĞÑ†Ñ–Ğ½Ñ–Ñ‚ÑŒ ÑĞ²Ğ¾Ñ— Ğ½Ğ°Ğ²Ğ¸Ñ‡ĞºĞ¸ Ğ·Ğ° ÑˆĞºĞ°Ğ»Ğ¾Ñ: âœ… Ğ¢Ğ°Ğº / âš ï¸ Ğ§Ğ°ÑÑ‚ĞºĞ¾Ğ²Ğ¾ / âŒ ĞÑ–\n\n---\n\n### Ğ§Ğ¸Ñ‚Ğ°Ğ½Ğ½Ñ\n\nĞ§Ğ¸ Ğ¼Ğ¾Ğ¶ĞµÑ‚Ğµ Ğ²Ğ¸ Ñ€Ğ¾Ğ·ÑƒĞ¼Ñ–Ñ‚Ğ¸ Ğ³Ğ¾Ğ»Ğ¾Ğ²Ğ½Ñ– Ğ´ÑƒĞ¼ĞºĞ¸ Ğ² ÑÑ‚Ğ°Ğ½Ğ´Ğ°Ñ€Ñ‚Ğ½Ğ¸Ñ… Ñ‚ĞµĞºÑÑ‚Ğ°Ñ…? Ğ§Ğ¸ Ğ¼Ğ¾Ğ¶ĞµÑ‚Ğµ Ñ‡Ğ¸Ñ‚Ğ°Ñ‚Ğ¸ ÑƒĞºÑ€Ğ°Ñ—Ğ½ÑÑŒĞºÑ– Ğ½Ğ¾Ğ²Ğ¸Ğ½Ğ¸ Ñ‚Ğ° Ñ€Ğ¾Ğ·ÑƒĞ¼Ñ–Ñ‚Ğ¸ Ğ¾ÑĞ½Ğ¾Ğ²Ğ½Ğ¸Ğ¹ Ğ·Ğ¼Ñ–ÑÑ‚? Ğ§Ğ¸ Ğ¼Ğ¾Ğ¶ĞµÑ‚Ğµ Ñ€Ğ¾Ğ·ÑƒĞ¼Ñ–Ñ‚Ğ¸ Ñ‚ĞµĞºÑÑ‚Ğ¸ Ğ¿Ñ€Ğ¾ Ğ·Ğ½Ğ°Ğ¹Ğ¾Ğ¼Ñ– Ñ‚ĞµĞ¼Ğ¸? Ğ§Ğ¸ Ğ¼Ğ¾Ğ¶ĞµÑ‚Ğµ Ğ·Ğ½Ğ°Ñ…Ğ¾Ğ´Ğ¸Ñ‚Ğ¸ ĞºĞ¾Ğ½ĞºÑ€ĞµÑ‚Ğ½Ñƒ Ñ–Ğ½Ñ„Ğ¾Ñ€Ğ¼Ğ°Ñ†Ñ–Ñ Ğ² Ñ‚ĞµĞºÑÑ‚Ğ°Ñ…?\n\n---\n\n### ĞŸĞ¸ÑÑŒĞ¼Ğ¾\n\nĞ§Ğ¸ Ğ¼Ğ¾Ğ¶ĞµÑ‚Ğµ Ğ²Ğ¸ Ğ¿Ğ¸ÑĞ°Ñ‚Ğ¸ Ğ·Ğ²'ÑĞ·Ğ½Ñ– Ñ‚ĞµĞºÑÑ‚Ğ¸ Ğ½Ğ° Ğ·Ğ½Ğ°Ğ¹Ğ¾Ğ¼Ñ– Ñ‚ĞµĞ¼Ğ¸ (200+ ÑĞ»Ñ–Ğ²)? Ğ§Ğ¸ Ğ¼Ğ¾Ğ¶ĞµÑ‚Ğµ Ğ¾Ğ¿Ğ¸ÑÑƒĞ²Ğ°Ñ‚Ğ¸ Ğ´Ğ¾ÑĞ²Ñ–Ğ´, Ğ¿Ğ¾Ğ´Ñ–Ñ—, Ğ¼Ñ€Ñ–Ñ—? Ğ§Ğ¸ Ğ¼Ğ¾Ğ¶ĞµÑ‚Ğµ Ğ´Ğ°Ğ²Ğ°Ñ‚Ğ¸ Ğ¿Ñ€Ğ¸Ñ‡Ğ¸Ğ½Ğ¸ Ñ‚Ğ° Ğ¿Ğ¾ÑÑĞ½ĞµĞ½Ğ½Ñ? Ğ§Ğ¸ Ğ¼Ğ¾Ğ¶ĞµÑ‚Ğµ Ğ¿Ğ¸ÑĞ°Ñ‚Ğ¸ Ğ¾Ñ„Ñ–Ñ†Ñ–Ğ¹Ğ½Ñ– Ñ‚Ğ° Ğ½ĞµĞ¾Ñ„Ñ–Ñ†Ñ–Ğ¹Ğ½Ñ– Ğ»Ğ¸ÑÑ‚Ğ¸?\n\n---\n\n### ĞÑƒĞ´Ñ–ÑĞ²Ğ°Ğ½Ğ½Ñ\n\nĞ§Ğ¸ Ğ¼Ğ¾Ğ¶ĞµÑ‚Ğµ Ğ²Ğ¸ Ñ€Ğ¾Ğ·ÑƒĞ¼Ñ–Ñ‚Ğ¸ Ğ³Ğ¾Ğ»Ğ¾Ğ²Ğ½Ñ– Ğ´ÑƒĞ¼ĞºĞ¸ Ñ‡Ñ–Ñ‚ĞºĞ¾Ñ— ÑÑ‚Ğ°Ğ½Ğ´Ğ°Ñ€Ñ‚Ğ½Ğ¾Ñ— ÑƒĞºÑ€Ğ°Ñ—Ğ½ÑÑŒĞºĞ¾Ñ— Ğ¼Ğ¾Ğ²Ğ¸? Ğ§Ğ¸ Ğ¼Ğ¾Ğ¶ĞµÑ‚Ğµ ÑĞ»ÑƒÑ…Ğ°Ñ‚Ğ¸ ÑƒĞºÑ€Ğ°Ñ—Ğ½ÑÑŒĞºÑ– Ğ¿Ğ¾Ğ´ĞºĞ°ÑÑ‚Ğ¸ Ñ‚Ğ° Ñ€Ğ¾Ğ·ÑƒĞ¼Ñ–Ñ‚Ğ¸ Ğ¾ÑĞ½Ğ¾Ğ²Ğ½Ğ¸Ğ¹ Ğ·Ğ¼Ñ–ÑÑ‚? Ğ§Ğ¸ Ğ¼Ğ¾Ğ¶ĞµÑ‚Ğµ Ñ€Ğ¾Ğ·ÑƒĞ¼Ñ–Ñ‚Ğ¸ Ğ¿Ğ¾Ğ²Ñ–Ğ»ÑŒĞ½Ñƒ Ñ‚Ğ° Ñ‡Ñ–Ñ‚ĞºÑƒ Ğ¼Ğ¾Ğ²Ñƒ Ğ½Ğ¾ÑÑ–Ñ—Ğ²? Ğ§Ğ¸ Ğ¼Ğ¾Ğ¶ĞµÑ‚Ğµ Ñ€Ğ¾Ğ±Ğ¸Ñ‚Ğ¸ Ğ½Ğ¾Ñ‚Ğ°Ñ‚ĞºĞ¸ Ğ¿Ñ–Ğ´ Ñ‡Ğ°Ñ Ğ¿Ñ€Ğ¾ÑĞ»ÑƒÑ…Ğ¾Ğ²ÑƒĞ²Ğ°Ğ½Ğ½Ñ?\n\n---\n\n### Ğ“Ñ€Ğ°Ğ¼Ğ°Ñ‚Ğ¸ĞºĞ°\n\nĞ§Ğ¸ Ğ¼Ğ¾Ğ¶ĞµÑ‚Ğµ Ğ²Ğ¸ Ğ¿Ñ€Ğ°Ğ²Ğ¸Ğ»ÑŒĞ½Ğ¾ Ğ²Ğ¸ĞºĞ¾Ñ€Ğ¸ÑÑ‚Ğ¾Ğ²ÑƒĞ²Ğ°Ñ‚Ğ¸ Ğ²Ğ¸Ğ´ Ğ´Ñ–Ñ”ÑĞ»Ğ¾Ğ²Ğ° Ñƒ Ğ²ÑÑ–Ñ… ĞºĞ¾Ğ½Ñ‚ĞµĞºÑÑ‚Ğ°Ñ…? Ğ§Ğ¸ Ğ¼Ğ¾Ğ¶ĞµÑ‚Ğµ Ğ²Ğ¸ĞºĞ¾Ñ€Ğ¸ÑÑ‚Ğ¾Ğ²ÑƒĞ²Ğ°Ñ‚Ğ¸ Ğ´Ñ–Ñ”ÑĞ»Ğ¾Ğ²Ğ° Ñ€ÑƒÑ…Ñƒ Ğ· Ğ¿Ñ€ĞµÑ„Ñ–ĞºÑĞ°Ğ¼Ğ¸? Ğ§Ğ¸ Ğ¼Ğ¾Ğ¶ĞµÑ‚Ğµ Ğ±ÑƒĞ´ÑƒĞ²Ğ°Ñ‚Ğ¸ ÑĞºĞ»Ğ°Ğ´Ğ½Ñ– Ñ€ĞµÑ‡ĞµĞ½Ğ½Ñ Ğ²ÑÑ–Ñ… Ñ‚Ğ¸Ğ¿Ñ–Ğ²? Ğ§Ğ¸ Ğ¼Ğ¾Ğ¶ĞµÑ‚Ğµ Ğ²Ğ¸ĞºĞ¾Ñ€Ğ¸ÑÑ‚Ğ¾Ğ²ÑƒĞ²Ğ°Ñ‚Ğ¸ Ğ´Ñ–Ñ”Ğ¿Ñ€Ğ¸ĞºĞ¼ĞµÑ‚Ğ½Ğ¸ĞºĞ¸ Ñ‚Ğ° Ğ¿Ğ°ÑĞ¸Ğ²Ğ½Ñ– ĞºĞ¾Ğ½ÑÑ‚Ñ€ÑƒĞºÑ†Ñ–Ñ—?\n\n---\n\n### Ğ›ĞµĞºÑĞ¸ĞºĞ°\n\nĞ§Ğ¸ Ğ¼Ğ¾Ğ¶ĞµÑ‚Ğµ Ğ²Ğ¸ Ğ²Ğ¸ĞºĞ¾Ñ€Ğ¸ÑÑ‚Ğ¾Ğ²ÑƒĞ²Ğ°Ñ‚Ğ¸ ~1,800 Ğ½Ğ¾Ğ²Ğ¸Ñ… ÑĞ»Ñ–Ğ² B1? Ğ§Ğ¸ Ğ¼Ğ¾Ğ¶ĞµÑ‚Ğµ Ğ¾Ğ±Ğ³Ğ¾Ğ²Ğ¾Ñ€ÑĞ²Ğ°Ñ‚Ğ¸ Ğ°Ğ±ÑÑ‚Ñ€Ğ°ĞºÑ‚Ğ½Ñ– Ñ‚ĞµĞ¼Ğ¸? Ğ§Ğ¸ Ğ¼Ğ¾Ğ¶ĞµÑ‚Ğµ Ğ²Ğ¸ÑĞ»Ğ¾Ğ²Ğ»ÑĞ²Ğ°Ñ‚Ğ¸ Ğ´ÑƒĞ¼ĞºĞ¸ Ñ‚Ğ° Ğ°Ñ€Ğ³ÑƒĞ¼ĞµĞ½Ñ‚Ğ¸? Ğ§Ğ¸ Ğ¼Ğ¾Ğ¶ĞµÑ‚Ğµ Ñ€Ğ¾Ğ·ÑƒĞ¼Ñ–Ñ‚Ğ¸ Ñ‚ĞµĞºÑÑ‚Ğ¸ Ğ¿Ñ€Ğ¾ ĞºÑƒĞ»ÑŒÑ‚ÑƒÑ€Ñƒ Ñ‚Ğ° ÑÑƒÑĞ¿Ñ–Ğ»ÑŒÑÑ‚Ğ²Ğ¾?\n\n---\n\n### Ğ†Ğ½Ñ‚ĞµÑ€Ğ¿Ñ€ĞµÑ‚Ğ°Ñ†Ñ–Ñ Ñ€ĞµĞ·ÑƒĞ»ÑŒÑ‚Ğ°Ñ‚Ñ–Ğ²\n\n| Ğ ĞµĞ·ÑƒĞ»ÑŒÑ‚Ğ°Ñ‚ | Ğ ĞµĞºĞ¾Ğ¼ĞµĞ½Ğ´Ğ°Ñ†Ñ–Ñ |\n|-----------|--------------|\n| 80%+ âœ… | Ğ’Ğ¸ Ğ³Ğ¾Ñ‚Ğ¾Ğ²Ñ– Ğ´Ğ¾ Ñ€Ñ–Ğ²Ğ½Ñ B2! |\n| 60-80% âš ï¸ | ĞŸĞ¾Ğ²Ñ‚Ğ¾Ñ€Ñ–Ñ‚ÑŒ ÑĞ»Ğ°Ğ±ĞºÑ– Ğ¾Ğ±Ğ»Ğ°ÑÑ‚Ñ– Ğ¿ĞµÑ€ĞµĞ´ B2 |\n| ĞœĞµĞ½ÑˆĞµ 60% âŒ | ĞŸĞ¾Ğ²ĞµÑ€Ğ½Ñ–Ñ‚ÑŒÑÑ Ğ´Ğ¾ Ğ¼Ğ¾Ğ´ÑƒĞ»Ñ–Ğ² B1 Ğ´Ğ»Ñ Ğ¿Ğ¾Ğ²Ñ‚Ğ¾Ñ€ĞµĞ½Ğ½Ñ |\n\n> ğŸ¯ **Ğ’Ğ°Ğ¶Ğ»Ğ¸Ğ²Ğ¾**\n> Ğ§ĞµÑĞ½Ğ¾ Ğ¾Ñ†Ñ–Ğ½ÑĞ¹Ñ‚Ğµ ÑĞ²Ğ¾Ñ— Ğ½Ğ°Ğ²Ğ¸Ñ‡ĞºĞ¸. ĞšÑ€Ğ°Ñ‰Ğµ Ğ¿Ğ¾Ğ²Ñ‚Ğ¾Ñ€Ğ¸Ñ‚Ğ¸ ÑĞºĞ»Ğ°Ğ´Ğ½Ñ– Ñ‚ĞµĞ¼Ğ¸ Ğ·Ğ°Ñ€Ğ°Ğ·, Ğ½Ñ–Ğ¶ Ğ¼Ğ°Ñ‚Ğ¸ Ğ¿Ñ€Ğ¾Ğ³Ğ°Ğ»Ğ¸Ğ½Ğ¸ Ğ½Ğ° Ñ€Ñ–Ğ²Ğ½Ñ– B2.\n\n---\n\n## Ğ”Ñ–Ğ°Ğ»Ğ¾Ğ³: Ğ Ğ¾Ğ·Ğ¼Ğ¾Ğ²Ğ° Ğ¿Ñ€Ğ¾ Ğ¿Ñ–Ğ´ÑÑƒĞ¼ĞºĞ¸ B1\n\n**ĞĞºÑĞ°Ğ½Ğ°:** ĞŸÑ€Ğ¸Ğ²Ñ–Ñ‚, Ğ¢Ğ°Ñ€Ğ°ÑĞµ! Ğ¯ Ñ‡ÑƒĞ»Ğ°, Ñ‰Ğ¾ Ñ‚Ğ¸ Ğ·Ğ°ĞºÑ–Ğ½Ñ‡Ğ¸Ğ² Ñ€Ñ–Ğ²ĞµĞ½ÑŒ B1. Ğ’Ñ–Ñ‚Ğ°Ñ Ñ‚ĞµĞ±Ğµ!\n\n**Ğ¢Ğ°Ñ€Ğ°Ñ:** Ğ”ÑĞºÑƒÑ, ĞĞºÑĞ°Ğ½Ğ¾! Ğ¦Ğµ Ğ±ÑƒĞ² Ğ´Ğ¾Ğ²Ğ³Ğ¸Ğ¹ ÑˆĞ»ÑÑ…, Ğ°Ğ»Ğµ Ñ Ğ´ÑƒĞ¶Ğµ Ğ·Ğ°Ğ´Ğ¾Ğ²Ğ¾Ğ»ĞµĞ½Ğ¸Ğ¹ Ñ€ĞµĞ·ÑƒĞ»ÑŒÑ‚Ğ°Ñ‚Ğ°Ğ¼Ğ¸.\n\n**ĞĞºÑĞ°Ğ½Ğ°:** Ğ©Ğ¾ Ğ±ÑƒĞ»Ğ¾ Ğ½Ğ°Ğ¹ÑĞºĞ»Ğ°Ğ´Ğ½Ñ–ÑˆĞ¸Ğ¼ Ğ´Ğ»Ñ Ñ‚ĞµĞ±Ğµ Ğ½Ğ° Ñ†ÑŒĞ¾Ğ¼Ñƒ Ñ€Ñ–Ğ²Ğ½Ñ–?\n\n**Ğ¢Ğ°Ñ€Ğ°Ñ:** ĞĞ°Ğ¹ÑĞºĞ»Ğ°Ğ´Ğ½Ñ–ÑˆĞ¸Ğ¼ Ğ±ÑƒĞ² Ğ²Ğ¸Ğ´ Ğ´Ñ–Ñ”ÑĞ»Ğ¾Ğ²Ğ°. ĞœĞµĞ½Ñ– Ğ¿Ğ¾Ñ‚Ñ€Ñ–Ğ±ĞµĞ½ Ğ±ÑƒĞ² Ñ‡Ğ°Ñ, Ñ‰Ğ¾Ğ± Ğ·Ñ€Ğ¾Ğ·ÑƒĞ¼Ñ–Ñ‚Ğ¸ Ñ€Ñ–Ğ·Ğ½Ğ¸Ñ†Ñ Ğ¼Ñ–Ğ¶ Ğ´Ğ¾ĞºĞ¾Ğ½Ğ°Ğ½Ğ¸Ğ¼ Ñ– Ğ½ĞµĞ´Ğ¾ĞºĞ¾Ğ½Ğ°Ğ½Ğ¸Ğ¼ Ğ²Ğ¸Ğ´Ğ¾Ğ¼.\n\n**ĞĞºÑĞ°Ğ½Ğ°:** Ğ¯ Ñ‚ĞµĞ±Ğµ Ñ€Ğ¾Ğ·ÑƒĞ¼Ñ–Ñ! Ğ Ğ´Ñ–Ñ”ÑĞ»Ğ¾Ğ²Ğ° Ñ€ÑƒÑ…Ñƒ? Ğ’Ğ¾Ğ½Ğ¸ Ñ‚Ğ°ĞºĞ¾Ğ¶ Ğ½ĞµĞ¿Ñ€Ğ¾ÑÑ‚Ñ– Ğ´Ğ»Ñ Ñ–Ğ½Ğ¾Ğ·ĞµĞ¼Ñ†Ñ–Ğ².\n\n**Ğ¢Ğ°Ñ€Ğ°Ñ:** Ğ¢Ğ°Ğº, Ğ´Ñ–Ñ”ÑĞ»Ğ¾Ğ²Ğ° Ñ€ÑƒÑ…Ñƒ Ğ· Ğ¿Ñ€ĞµÑ„Ñ–ĞºÑĞ°Ğ¼Ğ¸ â€” Ñ†Ğµ ÑĞ¿Ñ€Ğ°Ğ²Ğ¶Ğ½Ñ” Ğ²Ğ¸Ğ¿Ñ€Ğ¾Ğ±ÑƒĞ²Ğ°Ğ½Ğ½Ñ. ĞĞ°Ğ¿Ñ€Ğ¸ĞºĞ»Ğ°Ğ´, Ñ€Ñ–Ğ·Ğ½Ğ¸Ñ†Ñ Ğ¼Ñ–Ğ¶ Â«Ğ²Ğ¸Ñ…Ğ¾Ğ´Ğ¸Ñ‚Ğ¸Â» Ñ– Â«Ğ²Ğ¸Ñ…Ğ¾Ğ´Ğ¸Ñ‚Ğ¸Â» Ğ¼ĞµĞ½Ğµ ÑĞ¿Ğ¾Ñ‡Ğ°Ñ‚ĞºÑƒ Ğ±ĞµĞ½Ñ‚ĞµĞ¶Ğ¸Ğ»Ğ°.\n\n**ĞĞºÑĞ°Ğ½Ğ°:** Ğ¢Ğ¸ Ğ¼Ğ°Ñ”Ñˆ Ğ½Ğ° ÑƒĞ²Ğ°Ğ·Ñ– Â«Ğ²Ğ¸Ñ…Ğ¾Ğ´Ğ¸Ñ‚Ğ¸Â» Ñ– Â«Ğ²Ğ¸Ğ¹Ñ‚Ğ¸Â»?\n\n**Ğ¢Ğ°Ñ€Ğ°Ñ:** Ğ¡Ğ°Ğ¼Ğµ Ñ‚Ğ°Ğº! Ğ Ñ‰Ğµ ÑĞºĞ»Ğ°Ğ´Ğ½Ñ– Ñ€ĞµÑ‡ĞµĞ½Ğ½Ñ Ğ· ÑƒÑÑ–Ğ¼Ğ° Ñ†Ğ¸Ğ¼Ğ¸ ÑĞ¿Ğ¾Ğ»ÑƒÑ‡Ğ½Ğ¸ĞºĞ°Ğ¼Ğ¸: Â«ÑĞºÑ‰Ğ¾Â», Â«ÑĞºĞ±Ğ¸Â», Â«Ñ…Ğ¾Ñ‡Ğ°Â», Â«Ñ‰Ğ¾Ğ±Â»...\n\n**ĞĞºÑĞ°Ğ½Ğ°:** Ğ¦Ğµ Ğ²Ğ°Ğ¶Ğ»Ğ¸Ğ²Ñ– ÑÑ‚Ñ€ÑƒĞºÑ‚ÑƒÑ€Ğ¸ Ğ´Ğ»Ñ B2. Ğ¢Ğ¸ Ğ¿Ğ»Ğ°Ğ½ÑƒÑ”Ñˆ Ğ¿Ñ€Ğ¾Ğ´Ğ¾Ğ²Ğ¶ÑƒĞ²Ğ°Ñ‚Ğ¸ Ğ½Ğ°Ğ²Ñ‡Ğ°Ğ½Ğ½Ñ?\n\n**Ğ¢Ğ°Ñ€Ğ°Ñ:** Ğ—Ğ²Ğ¸Ñ‡Ğ°Ğ¹Ğ½Ğ¾! Ğ¯ Ñ…Ğ¾Ñ‡Ñƒ, Ñ‰Ğ¾Ğ± Ğ¼Ñ–Ğ¹ Ñ€Ñ–Ğ²ĞµĞ½ÑŒ Ğ±ÑƒĞ² Ğ´Ğ¾ÑÑ‚Ğ°Ñ‚Ğ½Ñ–Ğ¼ Ğ´Ğ»Ñ Ñ€Ğ¾Ğ±Ğ¾Ñ‚Ğ¸ Ğ² Ğ£ĞºÑ€Ğ°Ñ—Ğ½Ñ–. Ğ¢Ğ¾Ğ¼Ñƒ Ñ Ğ¿Ğ»Ğ°Ğ½ÑƒÑ Ğ¿Ğ¾Ñ—Ñ…Ğ°Ñ‚Ğ¸ Ğ´Ğ¾ Ğ›ÑŒĞ²Ğ¾Ğ²Ğ° Ğ½Ğ° Ğ¼Ğ¾Ğ²Ğ½Ñ– ĞºÑƒÑ€ÑĞ¸.\n\n**ĞĞºÑĞ°Ğ½Ğ°:** Ğ§ÑƒĞ´Ğ¾Ğ²Ğ¸Ğ¹ Ğ¿Ğ»Ğ°Ğ½! Ğ›ÑŒĞ²Ñ–Ğ² â€” Ğ¿Ñ€ĞµĞºÑ€Ğ°ÑĞ½Ğµ Ğ¼Ñ–ÑÑ‚Ğ¾ Ğ´Ğ»Ñ Ğ²Ğ¸Ğ²Ñ‡ĞµĞ½Ğ½Ñ ÑƒĞºÑ€Ğ°Ñ—Ğ½ÑÑŒĞºĞ¾Ñ—.\n\n**Ğ¢Ğ°Ñ€Ğ°Ñ:** Ğ¯ Ğ²Ğ¶Ğµ Ğ±Ñ€Ğ¾Ğ½ÑÑ ĞºĞ²Ğ¸Ñ‚ĞºĞ¸. ĞŸĞ¾Ñ—Ğ·Ğ´ Ğ²Ñ–Ğ´Ğ¿Ñ€Ğ°Ğ²Ğ»ÑÑ”Ñ‚ÑŒÑÑ Ğ·Ğ°Ğ²Ñ‚Ñ€Ğ° Ğ¾ Ğ²Ğ¾ÑÑŒĞ¼Ñ–Ğ¹ Ñ€Ğ°Ğ½ĞºÑƒ!\n\n> ğŸ¬ **ĞšÑƒĞ»ÑŒÑ‚ÑƒÑ€Ğ½Ğ¸Ğ¹ Ğ¼Ğ¾Ğ¼ĞµĞ½Ñ‚**\n> Ğ›ÑŒĞ²Ñ–Ğ² Ñ‡Ğ°ÑÑ‚Ğ¾ Ğ½Ğ°Ğ·Ğ¸Ğ²Ğ°ÑÑ‚ÑŒ Â«ĞºÑƒĞ»ÑŒÑ‚ÑƒÑ€Ğ½Ğ¾Ñ ÑÑ‚Ğ¾Ğ»Ğ¸Ñ†ĞµÑÂ» Ğ£ĞºÑ€Ğ°Ñ—Ğ½Ğ¸ Ğ·Ğ°Ğ²Ğ´ÑĞºĞ¸ Ğ¹Ğ¾Ğ³Ğ¾ Ğ°Ñ€Ñ…Ñ–Ñ‚ĞµĞºÑ‚ÑƒÑ€Ñ–, ĞºĞ°Ğ²'ÑÑ€Ğ½ÑĞ¼ Ñ‚Ğ° Ğ°Ñ‚Ğ¼Ğ¾ÑÑ„ĞµÑ€Ñ– ÑÑ‚Ğ°Ñ€Ğ¾Ğ³Ğ¾ Ñ”Ğ²Ñ€Ğ¾Ğ¿ĞµĞ¹ÑÑŒĞºĞ¾Ğ³Ğ¾ Ğ¼Ñ–ÑÑ‚Ğ°.\n\n---\n\n# ĞŸÑ–Ğ´ÑÑƒĞ¼Ğ¾Ğº\n\n## Ğ’Ğ°Ñˆ ÑˆĞ»ÑÑ… Ğ²Ñ–Ğ´ A1 Ğ´Ğ¾ B1\n\nĞ’Ñ–Ñ‚Ğ°Ñ”Ğ¼Ğ¾! Ğ’Ğ¸ Ğ¿Ñ€Ğ¾Ğ¹ÑˆĞ»Ğ¸ Ğ½ĞµĞ¹Ğ¼Ğ¾Ğ²Ñ–Ñ€Ğ½Ğ¸Ğ¹ ÑˆĞ»ÑÑ…:\n\n| Ğ Ñ–Ğ²ĞµĞ½ÑŒ | Ğ©Ğ¾ Ğ²Ğ¸ Ğ²Ğ¸Ğ²Ñ‡Ğ¸Ğ»Ğ¸ |\n|--------|--------------|\n| **A1** | ĞšĞ¸Ñ€Ğ¸Ğ»Ğ¸Ñ†Ñ, Ğ±Ğ°Ğ·Ğ¾Ğ²Ñ– Ñ„Ñ€Ğ°Ğ·Ğ¸, Ğ¿Ñ€Ğ¾ÑÑ‚Ğµ ÑĞ¿Ñ–Ğ»ĞºÑƒĞ²Ğ°Ğ½Ğ½Ñ |\n| **A2** | Ğ£ÑÑ– 7 Ğ²Ñ–Ğ´Ğ¼Ñ–Ğ½ĞºÑ–Ğ², Ğ¼Ğ¸Ğ½ÑƒĞ»Ğ¸Ğ¹ Ñ‚Ğ° Ğ¼Ğ°Ğ¹Ğ±ÑƒÑ‚Ğ½Ñ–Ğ¹ Ñ‡Ğ°Ñ |\n| **B1** | Ğ’Ğ¸Ğ´ Ğ´Ñ–Ñ”ÑĞ»Ğ¾Ğ²Ğ°, Ğ´Ñ–Ñ”ÑĞ»Ğ¾Ğ²Ğ° Ñ€ÑƒÑ…Ñƒ, ÑĞºĞ»Ğ°Ğ´Ğ½Ñ– Ñ€ĞµÑ‡ĞµĞ½Ğ½Ñ, Ğ´Ñ–Ñ”Ğ¿Ñ€Ğ¸ĞºĞ¼ĞµÑ‚Ğ½Ğ¸ĞºĞ¸ |\n\n---\n\n## Ğ’Ğ°ÑˆÑ– Ğ´Ğ¾ÑÑĞ³Ğ½ĞµĞ½Ğ½Ñ\n\nĞĞ° Ñ€Ñ–Ğ²Ğ½Ñ– B1 Ğ²Ğ¸ Ğ²Ğ¸Ğ²Ñ‡Ğ¸Ğ»Ğ¸:\n\n- **~1,800 Ğ½Ğ¾Ğ²Ğ¸Ñ… ÑĞ»Ñ–Ğ²** (Ğ·Ğ°Ğ³Ğ°Ğ»Ğ¾Ğ¼ ~3,500)\n- **Ğ’Ğ¸Ğ´ Ğ´Ñ–Ñ”ÑĞ»Ğ¾Ğ²Ğ°** Ñƒ Ğ²ÑÑ–Ñ… ĞºĞ¾Ğ½Ñ‚ĞµĞºÑÑ‚Ğ°Ñ…\n- **Ğ”Ñ–Ñ”ÑĞ»Ğ¾Ğ²Ğ° Ñ€ÑƒÑ…Ñƒ** Ğ· ÑƒÑÑ–Ğ¼Ğ° Ğ¿Ñ€ĞµÑ„Ñ–ĞºÑĞ°Ğ¼Ğ¸\n- **Ğ¡ĞºĞ»Ğ°Ğ´Ğ½Ñ– Ñ€ĞµÑ‡ĞµĞ½Ğ½Ñ** Ğ²ÑÑ–Ñ… Ñ‚Ğ¸Ğ¿Ñ–Ğ²\n- **Ğ”Ñ–Ñ”Ğ¿Ñ€Ğ¸ĞºĞ¼ĞµÑ‚Ğ½Ğ¸ĞºĞ¸** Ñ‚Ğ° Ğ¿Ğ°ÑĞ¸Ğ²Ğ½Ñ– ĞºĞ¾Ğ½ÑÑ‚Ñ€ÑƒĞºÑ†Ñ–Ñ—\n- **ĞšÑƒĞ»ÑŒÑ‚ÑƒÑ€Ñƒ** ÑÑƒÑ‡Ğ°ÑĞ½Ğ¾Ñ— Ğ£ĞºÑ€Ğ°Ñ—Ğ½Ğ¸\n\n---\n\n## ĞĞ°ÑÑ‚ÑƒĞ¿Ğ½Ğ¸Ğ¹ ĞºÑ€Ğ¾Ğº: Ğ Ñ–Ğ²ĞµĞ½ÑŒ B2\n\nĞĞ° Ñ€Ñ–Ğ²Ğ½Ñ– B2 Ğ²Ğ¸ Ğ±ÑƒĞ´ĞµÑ‚Ğµ:\n\n| ĞÑĞ¿ĞµĞºÑ‚ | Ğ—Ğ¼Ñ–ÑÑ‚ |\n|--------|-------|\n| **Ğ›ĞµĞºÑĞ¸ĞºĞ°** | +2,640 Ğ½Ğ¾Ğ²Ğ¸Ñ… ÑĞ»Ñ–Ğ² |\n| **Ğ“Ñ€Ğ°Ğ¼Ğ°Ñ‚Ğ¸ĞºĞ°** | Ğ£Ğ´Ğ¾ÑĞºĞ¾Ğ½Ğ°Ğ»ĞµĞ½Ğ½Ñ ÑÑ‚Ğ¸Ğ»Ñ, ÑĞºĞ»Ğ°Ğ´Ğ½Ñ– ÑÑ‚Ñ€ÑƒĞºÑ‚ÑƒÑ€Ğ¸ |\n| **Ğ§Ğ¸Ñ‚Ğ°Ğ½Ğ½Ñ** | Ğ›Ñ–Ñ‚ĞµÑ€Ğ°Ñ‚ÑƒÑ€Ğ°, Ğ°ĞºĞ°Ğ´ĞµĞ¼Ñ–Ñ‡Ğ½Ñ– Ñ‚ĞµĞºÑÑ‚Ğ¸ |\n| **ĞšÑƒĞ»ÑŒÑ‚ÑƒÑ€Ğ°** | Ğ†ÑÑ‚Ğ¾Ñ€Ñ–Ñ Ğ£ĞºÑ€Ğ°Ñ—Ğ½Ğ¸, Ğ±Ñ–Ğ¾Ğ³Ñ€Ğ°Ñ„Ñ–Ñ— Ğ²Ğ¸Ğ´Ğ°Ñ‚Ğ½Ğ¸Ñ… Ğ¿Ğ¾ÑÑ‚Ğ°Ñ‚ĞµĞ¹ |\n\n> ğŸŒ **Ğ ĞµĞºĞ¾Ğ¼ĞµĞ½Ğ´Ğ°Ñ†Ñ–Ñ**\n> ĞŸĞµÑ€ĞµĞ´ Ğ¿Ğ¾Ñ‡Ğ°Ñ‚ĞºĞ¾Ğ¼ B2 Ğ¿Ñ€Ğ¾Ğ´Ğ¾Ğ²Ğ¶ÑƒĞ¹Ñ‚Ğµ Ğ¿Ñ€Ğ°ĞºÑ‚Ğ¸ĞºÑƒ: Ñ‡Ğ¸Ñ‚Ğ°Ğ¹Ñ‚Ğµ ÑƒĞºÑ€Ğ°Ñ—Ğ½ÑÑŒĞºÑ– Ğ½Ğ¾Ğ²Ğ¸Ğ½Ğ¸ Ñ‰Ğ¾Ğ´Ğ½Ñ, ÑĞ»ÑƒÑ…Ğ°Ğ¹Ñ‚Ğµ Ğ¿Ğ¾Ğ´ĞºĞ°ÑÑ‚Ğ¸, ÑĞ¿Ñ–Ğ»ĞºÑƒĞ¹Ñ‚ĞµÑÑ ÑƒĞºÑ€Ğ°Ñ—Ğ½ÑÑŒĞºĞ¾Ñ.\n\n---\n\n## Ğ¡Ğ»Ğ¾Ğ²Ğ° Ğ¿Ñ–Ğ´Ñ‚Ñ€Ğ¸Ğ¼ĞºĞ¸\n\nĞ’Ğ¸ Ğ´Ğ¾ÑÑĞ³Ğ»Ğ¸ Ñ€Ñ–Ğ²Ğ½Ñ, ĞºĞ¾Ğ»Ğ¸ Ğ¼Ğ¾Ğ¶ĞµÑ‚Ğµ:\n\n- Ğ¡Ğ¿Ñ€Ğ°Ğ²Ğ»ÑÑ‚Ğ¸ÑÑ Ğ· Ğ±Ñ–Ğ»ÑŒÑˆÑ–ÑÑ‚Ñ ÑĞ¸Ñ‚ÑƒĞ°Ñ†Ñ–Ğ¹ Ğ¿Ñ–Ğ´ Ñ‡Ğ°Ñ Ğ¿Ğ¾Ğ´Ğ¾Ñ€Ğ¾Ğ¶Ñ– Ğ£ĞºÑ€Ğ°Ñ—Ğ½Ğ¾Ñ\n- Ğ Ğ¾Ğ·ÑƒĞ¼Ñ–Ñ‚Ğ¸ Ğ³Ğ¾Ğ»Ğ¾Ğ²Ğ½Ğ¸Ğ¹ Ğ·Ğ¼Ñ–ÑÑ‚ Ğ½Ğ¾Ğ²Ğ¸Ğ½ Ñ‚Ğ° Ğ¿Ğ¾Ğ´ĞºĞ°ÑÑ‚Ñ–Ğ²\n- ĞŸĞ¸ÑĞ°Ñ‚Ğ¸ ĞµÑĞµ Ñ‚Ğ° Ğ»Ğ¸ÑÑ‚Ğ¸ ÑƒĞºÑ€Ğ°Ñ—Ğ½ÑÑŒĞºĞ¾Ñ\n- ĞĞ±Ğ³Ğ¾Ğ²Ğ¾Ñ€ÑĞ²Ğ°Ñ‚Ğ¸ Ğ·Ğ½Ğ°Ğ¹Ğ¾Ğ¼Ñ– Ñ‚ĞµĞ¼Ğ¸ Ğ· Ğ½Ğ¾ÑÑ–ÑĞ¼Ğ¸ Ğ¼Ğ¾Ğ²Ğ¸\n\n**Ğ¦Ğµ Ğ·Ğ½Ğ°Ñ‡Ğ½Ğµ Ğ´Ğ¾ÑÑĞ³Ğ½ĞµĞ½Ğ½Ñ!** Ğ£ĞºÑ€Ğ°Ñ—Ğ½ÑÑŒĞºĞ° Ğ¼Ğ¾Ğ²Ğ° â€” Ğ¾Ğ´Ğ½Ğ° Ğ· Ğ½Ğ°Ğ¹ÑĞºĞ»Ğ°Ğ´Ğ½Ñ–ÑˆĞ¸Ñ… ÑĞ»Ğ¾Ğ²'ÑĞ½ÑÑŒĞºĞ¸Ñ… Ğ¼Ğ¾Ğ², Ñ– Ğ²Ğ¸ Ğ¿Ñ€Ğ¾Ğ¹ÑˆĞ»Ğ¸ Ğ´Ğ¾Ğ²Ğ³Ğ¸Ğ¹ ÑˆĞ»ÑÑ… Ğ²Ñ–Ğ´ ĞºĞ¸Ñ€Ğ¸Ğ»Ğ¸Ñ†Ñ– Ğ´Ğ¾ ÑĞºĞ»Ğ°Ğ´Ğ½Ğ¸Ñ… Ğ³Ñ€Ğ°Ğ¼Ğ°Ñ‚Ğ¸Ñ‡Ğ½Ğ¸Ñ… ÑÑ‚Ñ€ÑƒĞºÑ‚ÑƒÑ€.\n\nĞŸÑ€Ğ¾Ğ´Ğ¾Ğ²Ğ¶ÑƒĞ¹Ñ‚Ğµ Ğ²Ğ¸Ğ²Ñ‡Ğ°Ñ‚Ğ¸ ÑƒĞºÑ€Ğ°Ñ—Ğ½ÑÑŒĞºÑƒ Ğ· Ñ‚Ñ–Ñ”Ñ ÑĞ°Ğ¼Ğ¾Ñ Ğ½Ğ°Ğ¿Ğ¾Ğ»ĞµĞ³Ğ»Ğ¸Ğ²Ñ–ÑÑ‚Ñ, Ñ– Ñ€Ñ–Ğ²ĞµĞ½ÑŒ B2 Ğ½Ğµ Ğ·Ğ´Ğ°ÑÑ‚ÑŒÑÑ Ğ²Ğ°Ğ¼ ÑĞºĞ»Ğ°Ğ´Ğ½Ğ¸Ğ¼.\n\n**Ğ”Ğ¾ Ğ·ÑƒÑÑ‚Ñ€Ñ–Ñ‡Ñ– Ğ½Ğ° Ñ€Ñ–Ğ²Ğ½Ñ– B2!** ğŸ‡ºğŸ‡¦\n\n---\n\n## Ğ”Ğ¾Ğ´Ğ°Ñ‚ĞºĞ¾Ğ²Ñ– Ñ€ĞµÑÑƒÑ€ÑĞ¸\n\nĞ©Ğ¾Ğ± Ğ·Ğ°ĞºÑ€Ñ–Ğ¿Ğ¸Ñ‚Ğ¸ Ğ·Ğ½Ğ°Ğ½Ğ½Ñ Ñ€Ñ–Ğ²Ğ½Ñ B1 Ñ‚Ğ° Ğ¿Ñ–Ğ´Ğ³Ğ¾Ñ‚ÑƒĞ²Ğ°Ñ‚Ğ¸ÑÑ Ğ´Ğ¾ B2, Ñ€ĞµĞºĞ¾Ğ¼ĞµĞ½Ğ´ÑƒÑ”Ğ¼Ğ¾ Ğ²Ğ¸ĞºĞ¾Ñ€Ğ¸ÑÑ‚Ğ¾Ğ²ÑƒĞ²Ğ°Ñ‚Ğ¸ Ñ†Ñ– Ñ€ĞµÑÑƒÑ€ÑĞ¸ Ğ´Ğ»Ñ ÑĞ°Ğ¼Ğ¾ÑÑ‚Ñ–Ğ¹Ğ½Ğ¾Ğ³Ğ¾ Ğ½Ğ°Ğ²Ñ‡Ğ°Ğ½Ğ½Ñ Ñ‚Ğ° Ğ¿Ñ€Ğ°ĞºÑ‚Ğ¸ĞºĞ¸.\n\n> [!resources]\n> **ĞŸĞ¾Ğ´ĞºĞ°ÑÑ‚Ğ¸ Ğ´Ğ»Ñ Ğ¿Ñ€Ğ°ĞºÑ‚Ğ¸ĞºĞ¸:**\n> - [ĞšĞ½Ğ¸Ğ¶ĞºĞ¾Ğ²Ğ¸Ğ¹ ĞÑ€ÑĞµĞ½Ğ°Ğ»](https://bookforum.ua/podcast/) â€” Ğ¿Ñ€Ğ¾ ĞºĞ½Ğ¸Ğ³Ğ¸ Ñ‚Ğ° ĞºÑƒĞ»ÑŒÑ‚ÑƒÑ€Ñƒ\n> - [Ğ Ğ¾Ğ·Ğ¼Ğ¾Ğ²Ğ°.ĞœĞµĞ´Ñ–Ğ°](https://rozmova.media/) â€” Ñ–Ğ½Ñ‚ĞµÑ€Ğ²'Ñ Ğ· Ñ†Ñ–ĞºĞ°Ğ²Ğ¸Ğ¼Ğ¸ Ğ»ÑĞ´ÑŒĞ¼Ğ¸\n> - [Ğ¡ÑƒÑĞ¿Ñ–Ğ»ÑŒĞ½Ğµ Ğ Ğ°Ğ´Ñ–Ğ¾](https://suspilne.media/radio/) â€” Ğ½Ğ¾Ğ²Ğ¸Ğ½Ğ¸ Ñ‚Ğ° Ğ°Ğ½Ğ°Ğ»Ñ–Ñ‚Ğ¸ĞºĞ°\n> - [Ukrainian Lessons Podcast](https://www.ukrainianlessons.com/category/podcast/) â€” ÑƒÑ€Ğ¾ĞºĞ¸ Ğ´Ğ»Ñ Ğ²Ğ¸Ğ²Ñ‡ĞµĞ½Ğ½Ñ Ğ¼Ğ¾Ğ²Ğ¸\n\n---\n\n# Ğ’Ğ¿Ñ€Ğ°Ğ²Ğ¸\n\n---\n\n## quiz: ĞŸÑ–Ğ´ÑÑƒĞ¼ĞºĞ¾Ğ²Ğ¸Ğ¹ Ñ‚ĞµÑÑ‚ Ğ½Ğ° Ñ€Ğ¾Ğ·ÑƒĞ¼Ñ–Ğ½Ğ½Ñ Ñ‚ĞµĞºÑÑ‚Ñƒ\n\n> ĞŸÑ€Ğ¾Ñ‡Ğ¸Ñ‚Ğ°Ğ¹Ñ‚Ğµ Ñ‚ĞµĞºÑÑ‚ Ğ¿Ñ€Ğ¾ Ğ†Ğ¢-Ğ³Ğ°Ğ»ÑƒĞ·ÑŒ Ñ‰Ğµ Ñ€Ğ°Ğ· Ñ‚Ğ° Ğ¾Ğ±ĞµÑ€Ñ–Ñ‚ÑŒ Ğ¿Ñ€Ğ°Ğ²Ğ¸Ğ»ÑŒĞ½Ñƒ Ğ²Ñ–Ğ´Ğ¿Ğ¾Ğ²Ñ–Ğ´ÑŒ Ğ½Ğ° ĞºĞ¾Ğ¶Ğ½Ğµ Ğ·Ğ°Ğ¿Ğ¸Ñ‚Ğ°Ğ½Ğ½Ñ.\n\n1. Ğ—Ğ³Ñ–Ğ´Ğ½Ğ¾ Ğ· Ñ‚ĞµĞºÑÑ‚Ğ¾Ğ¼, ÑĞºÑ–Ğ»ÑŒĞºĞ¸ Ğ†Ğ¢-ÑĞ¿ĞµÑ†Ñ–Ğ°Ğ»Ñ–ÑÑ‚Ñ–Ğ² Ğ¿Ñ€Ğ°Ñ†ÑĞ²Ğ°Ğ»Ğ¾ Ğ² Ğ£ĞºÑ€Ğ°Ñ—Ğ½Ñ– Ğ´ĞµÑÑÑ‚ÑŒ Ñ€Ğ¾ĞºÑ–Ğ² Ñ‚Ğ¾Ğ¼Ñƒ, Ğ´Ğ¾ ÑÑ‚Ñ€Ñ–Ğ¼ĞºĞ¾Ğ³Ğ¾ Ğ·Ñ€Ğ¾ÑÑ‚Ğ°Ğ½Ğ½Ñ Ğ³Ğ°Ğ»ÑƒĞ·Ñ–?\n   - [ ] Ğ¢Ñ€Ğ¸ÑÑ‚Ğ° Ñ‚Ğ¸ÑÑÑ‡\n   - [x] ĞŸ'ÑÑ‚Ğ´ĞµÑÑÑ‚ Ñ‚Ğ¸ÑÑÑ‡\n   - [ ] Ğ¡Ñ‚Ğ¾ Ñ‚Ğ¸ÑÑÑ‡\n   - [ ] Ğ”Ğ²Ñ–ÑÑ‚Ñ– Ñ‚Ğ¸ÑÑÑ‡\n   > Ğ¢ĞµĞºÑÑ‚ Ñ‡Ñ–Ñ‚ĞºĞ¾ Ğ²ĞºĞ°Ğ·ÑƒÑ”, Ñ‰Ğ¾ ĞºÑ–Ğ»ÑŒĞºÑ–ÑÑ‚ÑŒ Ğ·Ñ€Ğ¾ÑĞ»Ğ° Â«Ğ· Ğ¿'ÑÑ‚Ğ´ĞµÑÑÑ‚Ğ¸ Ñ‚Ğ¸ÑÑÑ‡ Ğ´Ğ¾ Ğ¿Ğ¾Ğ½Ğ°Ğ´ Ñ‚Ñ€ÑŒĞ¾Ñ…ÑĞ¾Ñ‚ Ñ‚Ğ¸ÑÑÑ‡Â».\n\n2. Ğ¯ĞºÑ– Ñ‚Ñ€Ğ¸ Ñ„Ğ°ĞºÑ‚Ğ¾Ñ€Ğ¸ Ğ¿Ğ¾ÑÑĞ½ÑÑÑ‚ÑŒ Ñ€Ğ¾Ğ·Ğ²Ğ¸Ñ‚Ğ¾Ğº ÑƒĞºÑ€Ğ°Ñ—Ğ½ÑÑŒĞºĞ¾Ñ— Ğ†Ğ¢-Ğ³Ğ°Ğ»ÑƒĞ·Ñ– Ğ·Ğ³Ñ–Ğ´Ğ½Ğ¾ Ğ· Ñ‚ĞµĞºÑÑ‚Ğ¾Ğ¼ Ğ¿Ñ€Ğ¾ Ñ‚ĞµÑ…Ğ½Ğ¾Ğ»Ğ¾Ğ³Ñ–Ñ‡Ğ½Ğ¸Ğ¹ ÑĞµĞºÑ‚Ğ¾Ñ€ ĞºÑ€Ğ°Ñ—Ğ½Ğ¸?\n   - [ ] Ğ”ĞµÑ€Ğ¶Ğ°Ğ²Ğ½Ñ– ÑÑƒĞ±ÑĞ¸Ğ´Ñ–Ñ—, Ğ½Ğ¸Ğ·ÑŒĞºÑ– Ğ¿Ğ¾Ğ´Ğ°Ñ‚ĞºĞ¸, Ğ²ĞµĞ»Ğ¸ĞºĞµ Ğ½Ğ°ÑĞµĞ»ĞµĞ½Ğ½Ñ\n   - [x] Ğ¡Ğ¸Ğ»ÑŒĞ½Ğ° Ñ‚ĞµÑ…Ğ½Ñ–Ñ‡Ğ½Ğ° Ğ¾ÑĞ²Ñ–Ñ‚Ğ°, Ğ½Ğ¸Ğ¶Ñ‡Ñ– Ğ·Ğ°Ñ€Ğ¿Ğ»Ğ°Ñ‚Ğ¸, Ğ²Ğ¸ÑĞ¾ĞºĞ° Ğ¼Ğ¾Ñ‚Ğ¸Ğ²Ğ°Ñ†Ñ–Ñ Ğ¼Ğ¾Ğ»Ğ¾Ğ´Ñ–\n   - [ ] ĞĞ½Ğ³Ğ»Ñ–Ğ¹ÑÑŒĞºĞ° Ğ¼Ğ¾Ğ²Ğ°, Ğ³ĞµĞ¾Ğ³Ñ€Ğ°Ñ„Ñ–Ñ, ĞºĞ»Ñ–Ğ¼Ğ°Ñ‚\n   - [ ] Ğ”ĞµÑˆĞµĞ²Ğ° ĞµĞ»ĞµĞºÑ‚Ñ€Ğ¾ĞµĞ½ĞµÑ€Ğ³Ñ–Ñ, ÑˆĞ²Ğ¸Ğ´ĞºĞ¸Ğ¹ Ñ–Ğ½Ñ‚ĞµÑ€Ğ½ĞµÑ‚, ÑĞ¿Ñ€Ğ¸ÑÑ‚Ğ»Ğ¸Ğ²Ğµ Ğ·Ğ°ĞºĞ¾Ğ½Ğ¾Ğ´Ğ°Ğ²ÑÑ‚Ğ²Ğ¾\n   > ĞĞ²Ñ‚Ğ¾Ñ€ Ğ½Ğ°Ğ·Ğ¸Ğ²Ğ°Ñ” ÑĞ°Ğ¼Ğµ Ñ†Ñ– Ñ‚Ñ€Ğ¸ Ğ¿Ñ€Ğ¸Ñ‡Ğ¸Ğ½Ğ¸: Ğ¾ÑĞ²Ñ–Ñ‚Ñƒ, Ğ·Ğ°Ñ€Ğ¿Ğ»Ğ°Ñ‚Ğ¸ Ñ‚Ğ° Ğ¼Ğ¾Ñ‚Ğ¸Ğ²Ğ°Ñ†Ñ–Ñ.\n\n3. Ğ£ ÑĞºĞ¸Ñ… ÑĞ°Ğ¼Ğµ Ğ¼Ñ–ÑÑ‚Ğ°Ñ… Ğ£ĞºÑ€Ğ°Ñ—Ğ½Ğ¸, Ğ·Ğ³Ñ–Ğ´Ğ½Ğ¾ Ğ· Ñ‚ĞµĞºÑÑ‚Ğ¾Ğ¼, Ñ€Ğ¾Ğ·Ñ‚Ğ°ÑˆĞ¾Ğ²Ğ°Ğ½Ñ– Ğ¾Ñ„Ñ–ÑĞ¸ Ğ½Ğ°Ğ¹Ğ±Ñ–Ğ»ÑŒÑˆĞ¸Ñ… Ğ†Ğ¢-ĞºĞ¾Ğ¼Ğ¿Ğ°Ğ½Ñ–Ğ¹?\n   - [x] ĞšĞ¸Ñ—Ğ², Ğ›ÑŒĞ²Ñ–Ğ², Ğ¥Ğ°Ñ€ĞºÑ–Ğ², ĞĞ´ĞµÑĞ°, Ğ”Ğ½Ñ–Ğ¿Ñ€Ğ¾\n   - [ ] Ğ¢Ñ–Ğ»ÑŒĞºĞ¸ ĞšĞ¸Ñ—Ğ² Ñ‚Ğ° Ğ›ÑŒĞ²Ñ–Ğ²\n   - [ ] ĞšĞ¸Ñ—Ğ², Ğ¥Ğ°Ñ€ĞºÑ–Ğ², Ğ—Ğ°Ğ¿Ğ¾Ñ€Ñ–Ğ¶Ğ¶Ñ\n   - [ ] Ğ›ÑŒĞ²Ñ–Ğ², ĞĞ´ĞµÑĞ°, Ğ’Ñ–Ğ½Ğ½Ğ¸Ñ†Ñ\n   > Ğ¢ĞµĞºÑÑ‚ Ğ¿ĞµÑ€ĞµĞ»Ñ–Ñ‡ÑƒÑ”: Â«ĞšĞ¸Ñ”Ğ²Ñ–, Ğ›ÑŒĞ²Ğ¾Ğ²Ñ–, Ğ¥Ğ°Ñ€ĞºĞ¾Ğ²Ñ–, ĞĞ´ĞµÑÑ– Ñ‚Ğ° Ğ”Ğ½Ñ–Ğ¿Ñ€Ñ–Â».\n\n4. ĞšĞ¾Ğ»Ğ¸ Ğ±ÑƒĞ»Ğ° Ğ·Ğ°ÑĞ½Ğ¾Ğ²Ğ°Ğ½Ğ° ĞºĞ¾Ğ¼Ğ¿Ğ°Ğ½Ñ–Ñ Grammarly, ÑĞºĞ° Ğ´Ğ¾Ğ¿Ğ¾Ğ¼Ğ°Ğ³Ğ°Ñ” Ğ¼Ñ–Ğ»ÑŒĞ¹Ğ¾Ğ½Ğ°Ğ¼ Ğ»ÑĞ´ĞµĞ¹ Ğ¿Ğ¸ÑĞ°Ñ‚Ğ¸ Ğ°Ğ½Ğ³Ğ»Ñ–Ğ¹ÑÑŒĞºĞ¾Ñ Ğ±ĞµĞ· Ğ¿Ğ¾Ğ¼Ğ¸Ğ»Ğ¾Ğº?\n   - [ ] 2005 Ñ€Ğ¾Ñ†Ñ–\n   - [x] 2009 Ñ€Ğ¾Ñ†Ñ–\n   - [ ] 2012 Ñ€Ğ¾Ñ†Ñ–\n   - [ ] 2015 Ñ€Ğ¾Ñ†Ñ–\n   > Â«Grammarly, Ğ·Ğ°ÑĞ½Ğ¾Ğ²Ğ°Ğ½Ğ° Ñƒ ĞšĞ¸Ñ”Ğ²Ñ– Ñƒ 2009 Ñ€Ğ¾Ñ†Ñ–Â».\n\n5. Ğ¯Ğº Ğ½Ğ°Ğ·Ğ¸Ğ²Ğ°Ñ”Ñ‚ÑŒÑÑ ÑƒĞºÑ€Ğ°Ñ—Ğ½ÑÑŒĞºĞ¸Ğ¹ ÑÑ‚Ğ°Ñ€Ñ‚Ğ°Ğ¿, ÑĞºĞ¸Ğ¹ ÑÑ‚Ğ²Ğ¾Ñ€ÑÑ” Ğ¿Ğ¾Ğ¿ÑƒĞ»ÑÑ€Ğ½Ğµ Ğ¿Ñ€Ğ¾Ğ³Ñ€Ğ°Ğ¼Ğ½Ğµ Ğ·Ğ°Ğ±ĞµĞ·Ğ¿ĞµÑ‡ĞµĞ½Ğ½Ñ ÑĞ°Ğ¼Ğµ Ğ´Ğ»Ñ ĞºĞ¾Ğ¼Ğ¿'ÑÑ‚ĞµÑ€Ñ–Ğ² Mac?\n   - [ ] Grammarly\n   - [ ] GitLab\n   - [x] MacPaw\n   - [ ] SoftServe\n   > Â«MacPaw Ñ–Ğ· ĞšĞ¸Ñ”Ğ²Ğ° ÑÑ‚Ğ²Ğ¾Ñ€ÑÑ” Ğ¿Ğ¾Ğ¿ÑƒĞ»ÑÑ€Ğ½Ğµ Ğ¿Ñ€Ğ¾Ğ³Ñ€Ğ°Ğ¼Ğ½Ğµ Ğ·Ğ°Ğ±ĞµĞ·Ğ¿ĞµÑ‡ĞµĞ½Ğ½Ñ Ğ´Ğ»Ñ MacÂ».\n\n6. Ğ¯ĞºĞµ ÑÑ‚Ğ°Ğ²Ğ»ĞµĞ½Ğ½Ñ Ğ°Ğ²Ñ‚Ğ¾Ñ€Ğ° ÑÑ‚Ğ°Ñ‚Ñ‚Ñ– Ğ´Ğ¾ Ğ¼Ğ°Ğ¹Ğ±ÑƒÑ‚Ğ½ÑŒĞ¾Ğ³Ğ¾ ÑƒĞºÑ€Ğ°Ñ—Ğ½ÑÑŒĞºĞ¾Ñ— Ğ†Ğ¢-Ğ³Ğ°Ğ»ÑƒĞ·Ñ– Ğ¿Ñ–ÑĞ»Ñ Ğ²Ñ–Ğ¹Ğ½Ğ¸ Ñ‚Ğ° Ğ²ÑÑ–Ñ… Ğ²Ğ¸Ğ¿Ñ€Ğ¾Ğ±ÑƒĞ²Ğ°Ğ½ÑŒ?\n   - [ ] ĞŸĞµÑĞ¸Ğ¼Ñ–ÑÑ‚Ğ¸Ñ‡Ğ½Ğµ â€” Ğ°Ğ²Ñ‚Ğ¾Ñ€ Ğ²Ğ²Ğ°Ğ¶Ğ°Ñ”, Ñ‰Ğ¾ Ğ³Ğ°Ğ»ÑƒĞ·ÑŒ Ğ·Ğ°Ğ½ĞµĞ¿Ğ°Ğ´Ğ°Ñ”\n   - [ ] ĞĞµĞ¹Ñ‚Ñ€Ğ°Ğ»ÑŒĞ½Ğµ â€” Ğ°Ğ²Ñ‚Ğ¾Ñ€ Ğ½Ğµ Ğ²Ğ¸ÑĞ»Ğ¾Ğ²Ğ»ÑÑ” Ğ´ÑƒĞ¼ĞºĞ¸\n   - [x] ĞĞ¿Ñ‚Ğ¸Ğ¼Ñ–ÑÑ‚Ğ¸Ñ‡Ğ½Ğµ â€” Ğ°Ğ²Ñ‚Ğ¾Ñ€ Ğ²Ğ²Ğ°Ğ¶Ğ°Ñ” Ğ¼Ğ°Ğ¹Ğ±ÑƒÑ‚Ğ½Ñ” Ğ¿ĞµÑ€ÑĞ¿ĞµĞºÑ‚Ğ¸Ğ²Ğ½Ğ¸Ğ¼\n   - [ ] ĞĞµĞ²Ğ¸Ğ·Ğ½Ğ°Ñ‡ĞµĞ½Ğµ â€” Ğ°Ğ²Ñ‚Ğ¾Ñ€ Ğ½Ğµ Ğ·Ğ½Ğ°Ñ”, Ñ‰Ğ¾ Ğ±ÑƒĞ´Ğµ\n   > Â«ĞœĞ°Ğ¹Ğ±ÑƒÑ‚Ğ½Ñ” ÑƒĞºÑ€Ğ°Ñ—Ğ½ÑÑŒĞºĞ¾Ñ— Ğ†Ğ¢-Ğ³Ğ°Ğ»ÑƒĞ·Ñ– Ğ·Ğ°Ğ»Ğ¸ÑˆĞ°Ñ”Ñ‚ÑŒÑÑ Ğ¿ĞµÑ€ÑĞ¿ĞµĞºÑ‚Ğ¸Ğ²Ğ½Ğ¸Ğ¼Â».\n\n7. Ğ©Ğ¾ Ğ¾Ğ·Ğ½Ğ°Ñ‡Ğ°Ñ” ÑĞ»Ğ¾Ğ²Ğ¾ Â«ÑÑ‚Ñ–Ğ¹ĞºÑ–ÑÑ‚ÑŒÂ» Ñƒ ĞºĞ¾Ğ½Ñ‚ĞµĞºÑÑ‚Ñ– Ñ€ĞµĞ°ĞºÑ†Ñ–Ñ— Ğ†Ğ¢-Ñ–Ğ½Ğ´ÑƒÑÑ‚Ñ€Ñ–Ñ— Ğ½Ğ° Ğ²Ğ¸ĞºĞ»Ğ¸ĞºĞ¸, ÑĞ¿Ñ€Ğ¸Ñ‡Ğ¸Ğ½ĞµĞ½Ñ– Ğ²Ñ–Ğ¹Ğ½Ğ¾Ñ 2022 Ñ€Ğ¾ĞºÑƒ?\n   - [ ] Ğ—Ğ´Ğ°Ñ‚Ğ½Ñ–ÑÑ‚ÑŒ ÑˆĞ²Ğ¸Ğ´ĞºĞ¾ Ñ€Ğ¾ÑÑ‚Ğ¸\n   - [ ] Ğ—Ğ´Ğ°Ñ‚Ğ½Ñ–ÑÑ‚ÑŒ Ğ·Ğ°Ñ€Ğ¾Ğ±Ğ»ÑÑ‚Ğ¸ Ğ³Ñ€Ğ¾ÑˆÑ–\n   - [x] Ğ—Ğ´Ğ°Ñ‚Ğ½Ñ–ÑÑ‚ÑŒ Ğ²Ğ¸Ñ‚Ñ€Ğ¸Ğ¼ÑƒĞ²Ğ°Ñ‚Ğ¸ Ñ‚Ñ€ÑƒĞ´Ğ½Ğ¾Ñ‰Ñ– Ñ‚Ğ° Ğ¿Ñ€Ğ¾Ğ´Ğ¾Ğ²Ğ¶ÑƒĞ²Ğ°Ñ‚Ğ¸ Ñ€Ğ¾Ğ±Ğ¾Ñ‚Ñƒ\n   - [ ] Ğ—Ğ´Ğ°Ñ‚Ğ½Ñ–ÑÑ‚ÑŒ ÑÑ‚Ğ²Ğ¾Ñ€ÑĞ²Ğ°Ñ‚Ğ¸ Ğ½Ğ¾Ğ²Ñ– Ğ¿Ñ€Ğ¾Ğ´ÑƒĞºÑ‚Ğ¸\n   > ĞšĞ¾Ğ½Ñ‚ĞµĞºÑÑ‚ Ğ¿Ğ¾ĞºĞ°Ğ·ÑƒÑ”, Ñ‰Ğ¾ ĞºĞ¾Ğ¼Ğ¿Ğ°Ğ½Ñ–Ñ— Ğ¿Ñ€Ğ¾Ğ´Ğ¾Ğ²Ğ¶Ğ¸Ğ»Ğ¸ Ñ€Ğ¾Ğ±Ğ¾Ñ‚Ñƒ Ğ¿Ğ¾Ğ¿Ñ€Ğ¸ Ñ‚Ñ€ÑƒĞ´Ğ½Ğ¾Ñ‰Ñ–.\n\n8. Ğ¥Ñ‚Ğ¾ Ñ” Ğ·Ğ°ÑĞ½Ğ¾Ğ²Ğ½Ğ¸ĞºĞ¾Ğ¼ Ğ¿Ğ»Ğ°Ñ‚Ñ„Ğ¾Ñ€Ğ¼Ğ¸ GitLab, ÑĞºĞ° Ğ²Ğ¸ĞºĞ¾Ñ€Ğ¸ÑÑ‚Ğ¾Ğ²ÑƒÑ”Ñ‚ÑŒÑÑ Ğ¼Ñ–Ğ»ÑŒĞ¹Ğ¾Ğ½Ğ°Ğ¼Ğ¸ Ñ€Ğ¾Ğ·Ñ€Ğ¾Ğ±Ğ½Ğ¸ĞºÑ–Ğ² Ñƒ Ğ²ÑÑŒĞ¾Ğ¼Ñƒ ÑĞ²Ñ–Ñ‚Ñ–?\n   - [ ] ĞšĞ¾Ğ¼Ğ°Ğ½Ğ´Ğ° Ğ· ĞšÑ€ĞµĞ¼Ğ½Ñ–Ñ”Ğ²Ğ¾Ñ— Ğ´Ğ¾Ğ»Ğ¸Ğ½Ğ¸\n   - [x] Ğ£ĞºÑ€Ğ°Ñ—Ğ½ÑÑŒĞºĞ¸Ğ¹ Ñ€Ğ¾Ğ·Ñ€Ğ¾Ğ±Ğ½Ğ¸Ğº Ğ”Ğ¼Ğ¸Ñ‚Ñ€Ğ¾ Ğ—Ğ°Ğ¿Ğ¾Ñ€Ğ¾Ğ¶ĞµÑ†ÑŒ\n   - [ ] Ğ‘Ñ€Ğ¸Ñ‚Ğ°Ğ½ÑÑŒĞºĞ° ĞºĞ¾Ğ¼Ğ¿Ğ°Ğ½Ñ–Ñ\n   - [ ] ĞšĞ¾Ğ¼Ğ°Ğ½Ğ´Ğ° Grammarly\n   > Â«GitLab, ÑÑ‚Ğ²Ğ¾Ñ€ĞµĞ½Ğ° ÑƒĞºÑ€Ğ°Ñ—Ğ½Ñ†ĞµĞ¼ Ğ”Ğ¼Ğ¸Ñ‚Ñ€Ğ¾Ğ¼ Ğ—Ğ°Ğ¿Ğ¾Ñ€Ğ¾Ğ¶Ñ†ĞµĞ¼Â».\n\n9. Ğ©Ğ¾ Ğ´ĞµĞ¼Ğ¾Ğ½ÑÑ‚Ñ€ÑƒÑÑ‚ÑŒ ÑƒĞºÑ€Ğ°Ñ—Ğ½ÑÑŒĞºÑ– Ğ†Ğ¢-Ñ„Ğ°Ñ…Ñ–Ğ²Ñ†Ñ–, Ğ¾ĞºÑ€Ñ–Ğ¼ Ğ²Ğ¸ÑĞ¾ĞºĞ¾Ñ— Ñ‚ĞµÑ…Ğ½Ñ–Ñ‡Ğ½Ğ¾Ñ— Ğ¼Ğ°Ğ¹ÑÑ‚ĞµÑ€Ğ½Ğ¾ÑÑ‚Ñ–, Ğ·Ğ³Ñ–Ğ´Ğ½Ğ¾ Ğ· Ğ²Ğ¸ÑĞ½Ğ¾Ğ²ĞºĞ°Ğ¼Ğ¸ Ğ°Ğ²Ñ‚Ğ¾Ñ€Ğ° ÑÑ‚Ğ°Ñ‚Ñ‚Ñ–?\n   - [ ] Ğ—Ğ½Ğ°Ğ½Ğ½Ñ Ñ–Ğ½Ğ¾Ğ·ĞµĞ¼Ğ½Ğ¸Ñ… Ğ¼Ğ¾Ğ²\n   - [ ] Ğ‘Ğ°Ğ¶Ğ°Ğ½Ğ½Ñ Ğ¿Ñ€Ğ°Ñ†ÑĞ²Ğ°Ñ‚Ğ¸ Ğ·Ğ° ĞºĞ¾Ñ€Ğ´Ğ¾Ğ½Ğ¾Ğ¼\n   - [x] Ğ—Ğ´Ğ°Ñ‚Ğ½Ñ–ÑÑ‚ÑŒ Ğ´Ğ¾Ğ»Ğ°Ñ‚Ğ¸ ÑĞºĞ»Ğ°Ğ´Ğ½Ğ¾Ñ‰Ñ–\n   - [ ] ĞšÑ€ĞµĞ°Ñ‚Ğ¸Ğ²Ğ½Ñ–ÑÑ‚ÑŒ Ñƒ Ğ´Ğ¸Ğ·Ğ°Ğ¹Ğ½Ñ–\n   > Â«Ğ´ĞµĞ¼Ğ¾Ğ½ÑÑ‚Ñ€ÑƒÑÑ‚ÑŒ Ğ½Ğµ Ğ»Ğ¸ÑˆĞµ Ñ‚ĞµÑ…Ğ½Ñ–Ñ‡Ğ½Ñƒ Ğ¼Ğ°Ğ¹ÑÑ‚ĞµÑ€Ğ½Ñ–ÑÑ‚ÑŒ, Ğ° Ğ¹ Ğ·Ğ´Ğ°Ñ‚Ğ½Ñ–ÑÑ‚ÑŒ Ğ´Ğ¾Ğ»Ğ°Ñ‚Ğ¸ ÑĞºĞ»Ğ°Ğ´Ğ½Ğ¾Ñ‰Ñ–Â».\n\n10. Ğ¯ĞºĞ° Ñ†Ğ¸Ñ‚Ğ°Ñ‚Ğ° Ğ°Ğ¹Ñ‚Ñ–ÑˆĞ½Ğ¸ĞºÑ–Ğ² Ğ·Ğ°Ğ²ĞµÑ€ÑˆÑƒÑ” ÑÑ‚Ğ°Ñ‚Ñ‚Ñ Ñ‚Ğ° Ğ´ĞµĞ¼Ğ¾Ğ½ÑÑ‚Ñ€ÑƒÑ” Ñ—Ñ…Ğ½Ñ Ğ½Ğ°Ğ¿Ğ¾Ğ»ĞµĞ³Ğ»Ğ¸Ğ²Ñ–ÑÑ‚ÑŒ Ñ– Ğ²Ğ¿ĞµĞ²Ğ½ĞµĞ½Ñ–ÑÑ‚ÑŒ Ñƒ Ğ¿ĞµÑ€ĞµĞ¼Ğ¾Ğ·Ñ–?\n    - [ ] Â«ĞœĞ¸ Ğ½Ğ°Ğ¹ĞºÑ€Ğ°Ñ‰Ñ– Ğ¿Ñ€Ğ¾Ğ³Ñ€Ğ°Ğ¼Ñ–ÑÑ‚Ğ¸ Ñƒ ÑĞ²Ñ–Ñ‚Ñ–Â»\n    - [ ] Â«Ğ¢ĞµÑ…Ğ½Ğ¾Ğ»Ğ¾Ğ³Ñ–Ñ— â€” Ñ†Ğµ Ğ¼Ğ°Ğ¹Ğ±ÑƒÑ‚Ğ½Ñ”Â»\n    - [x] Â«ĞœĞ¸ Ğ¿Ğ¸ÑĞ°Ğ»Ğ¸ ĞºĞ¾Ğ´ Ğ¿Ñ–Ğ´ Ğ¾Ğ±ÑÑ‚Ñ€Ñ–Ğ»Ğ°Ğ¼Ğ¸, Ñ– Ğ¼Ğ¸ Ğ±ÑƒĞ´ĞµĞ¼Ğ¾ Ğ¿Ğ¸ÑĞ°Ñ‚Ğ¸ Ğ¹Ğ¾Ğ³Ğ¾ Ğ¿Ñ–ÑĞ»Ñ Ğ¿ĞµÑ€ĞµĞ¼Ğ¾Ğ³Ğ¸Â»\n    - [ ] Â«Ğ£ĞºÑ€Ğ°Ñ—Ğ½Ğ° ÑÑ‚Ğ°Ğ½Ğµ Ñ‚ĞµÑ…Ğ½Ğ¾Ğ»Ğ¾Ğ³Ñ–Ñ‡Ğ½Ğ¸Ğ¼ Ğ»Ñ–Ğ´ĞµÑ€Ğ¾Ğ¼ Ğ„Ğ²Ñ€Ğ¾Ğ¿Ğ¸Â»\n    > Ğ¦Ğµ Ğ´Ğ¾ÑĞ»Ñ–Ğ²Ğ½Ğ° Ñ†Ğ¸Ñ‚Ğ°Ñ‚Ğ° Ğ· Ğ¾ÑÑ‚Ğ°Ğ½Ğ½ÑŒĞ¾Ğ³Ğ¾ Ğ°Ğ±Ğ·Ğ°Ñ†Ñƒ Ñ‚ĞµĞºÑÑ‚Ñƒ.\n\n---\n\n## fill-in: Ğ’Ğ¸Ğ´ Ğ´Ñ–Ñ”ÑĞ»Ğ¾Ğ²Ğ° Ñƒ ĞºĞ¾Ğ½Ñ‚ĞµĞºÑÑ‚Ñ–\n\n> ĞĞ±ĞµÑ€Ñ–Ñ‚ÑŒ Ğ¿Ñ€Ğ°Ğ²Ğ¸Ğ»ÑŒĞ½Ñƒ Ñ„Ğ¾Ñ€Ğ¼Ñƒ Ğ´Ñ–Ñ”ÑĞ»Ğ¾Ğ²Ğ° â€” Ğ´Ğ¾ĞºĞ¾Ğ½Ğ°Ğ½Ñƒ Ğ°Ğ±Ğ¾ Ğ½ĞµĞ´Ğ¾ĞºĞ¾Ğ½Ğ°Ğ½Ñƒ â€” Ğ·Ğ°Ğ»ĞµĞ¶Ğ½Ğ¾ Ğ²Ñ–Ğ´ ĞºĞ¾Ğ½Ñ‚ĞµĞºÑÑ‚Ñƒ Ñ€ĞµÑ‡ĞµĞ½Ğ½Ñ.\n\n1. Ğ’Ñ‡Ğ¾Ñ€Ğ° ÑƒĞ²ĞµÑ‡ĞµÑ€Ñ– Ñ Ğ´Ğ¾Ğ²Ğ³Ğ¾ _______ Ğ½Ğ°Ğ´ Ñ†Ñ–Ñ”Ñ Ğ¿Ñ€Ğ¾Ğ±Ğ»ĞµĞ¼Ğ¾Ñ, Ğ°Ğ»Ğµ Ñ‚Ğ°Ğº Ñ– Ğ½Ğµ Ğ·Ğ½Ğ°Ğ¹ÑˆĞ¾Ğ² Ñ€Ñ–ÑˆĞµĞ½Ğ½Ñ.\n   > [!answer] Ğ´ÑƒĞ¼Ğ°Ğ²\n   > [!options] Ğ´ÑƒĞ¼Ğ°Ğ² | Ğ¿Ğ¾Ğ´ÑƒĞ¼Ğ°Ğ²\n\n2. ĞĞ°Ñ€ĞµÑˆÑ‚Ñ– Ñ _______ Ñ€Ñ–ÑˆĞµĞ½Ğ½Ñ, ÑĞºĞµ Ğ¼ĞµĞ½Ñ– ÑĞ¿Ğ¾Ğ´Ğ¾Ğ±Ğ°Ğ»Ğ¾ÑÑŒ â€” Ñ†Ğµ Ğ±ÑƒĞ»Ğ¾ Ğ¿Ñ–ÑĞ»Ñ Ğ³Ğ¾Ğ´Ğ¸Ğ½Ğ¸ Ñ€Ğ¾Ğ·Ğ´ÑƒĞ¼Ñ–Ğ².\n   > [!answer] Ğ¿Ñ€Ğ¸Ğ¹Ğ½ÑĞ²\n   > [!options] Ğ¿Ñ€Ğ¸Ğ¹Ğ¼Ğ°Ğ² | Ğ¿Ñ€Ğ¸Ğ¹Ğ½ÑĞ²\n\n3. Ğ©Ğ¾Ğ´Ğ½Ñ Ğ²Ğ¾Ğ½Ğ° _______ ÑÑ‚Ğ°Ñ‚Ñ‚Ñ– Ğ´Ğ»Ñ ÑĞ°Ğ¹Ñ‚Ñƒ â€” Ñ†Ğµ Ñ—Ñ— Ğ¾ÑĞ½Ğ¾Ğ²Ğ½Ğ° Ñ€Ğ¾Ğ±Ğ¾Ñ‚Ğ°.\n   > [!answer] Ğ¿Ğ¸ÑˆĞµ\n   > [!options] Ğ¿Ğ¸ÑˆĞµ | Ğ½Ğ°Ğ¿Ğ¸ÑˆĞµ\n\n4. ĞšĞ¾Ğ»Ğ¸ Ñ‚Ğ¸ _______ Ñ†ĞµĞ¹ Ğ·Ğ²Ñ–Ñ‚, Ğ½Ğ°Ğ´Ñ–ÑˆĞ»Ğ¸ Ğ¹Ğ¾Ğ³Ğ¾ Ğ¼ĞµĞ½Ñ– ĞµĞ»ĞµĞºÑ‚Ñ€Ğ¾Ğ½Ğ½Ğ¾Ñ Ğ¿Ğ¾ÑˆÑ‚Ğ¾Ñ.\n   > [!answer] Ğ½Ğ°Ğ¿Ğ¸ÑˆĞµÑˆ\n   > [!options] Ğ¿Ğ¸ÑĞ°Ñ‚Ğ¸Ğ¼ĞµÑˆ | Ğ½Ğ°Ğ¿Ğ¸ÑˆĞµÑˆ\n\n5. ĞĞµ _______ Ñƒ Ñ†Ñ ĞºÑ–Ğ¼Ğ½Ğ°Ñ‚Ñƒ â€” Ñ‚Ğ°Ğ¼ Ğ¿Ñ€Ğ°Ñ†ÑÑÑ‚ÑŒ!\n   > [!answer] Ğ·Ğ°Ñ…Ğ¾Ğ´ÑŒ\n   > [!options] Ğ·Ğ°Ñ…Ğ¾Ğ´ÑŒ | Ğ·Ğ°Ğ¹Ğ´Ğ¸\n\n6. _______ Ñƒ ĞºÑ–Ğ¼Ğ½Ğ°Ñ‚Ñƒ Ñ– ÑÑĞ´ÑŒ Ğ½Ğ° ÑÑ‚Ñ–Ğ»ĞµÑ†ÑŒ â€” Ñ Ğ·Ğ°Ñ€Ğ°Ğ· Ğ¿Ğ¾Ğ²ĞµÑ€Ğ½ÑƒÑÑ.\n   > [!answer] Ğ—Ğ°Ğ¹Ğ´Ğ¸\n   > [!options] Ğ—Ğ°Ñ…Ğ¾Ğ´ÑŒ | Ğ—Ğ°Ğ¹Ğ´Ğ¸\n\n7. Ğ’Ñ–Ğ½ Ğ·Ğ°Ğ²Ğ¶Ğ´Ğ¸ _______ Ğ¿Ñ–Ğ·Ğ½Ğ¾, Ñ‚Ğ¾Ğ¼Ñƒ Ğ¼Ğ¸ Ğ½Ñ–ĞºĞ¾Ğ»Ğ¸ Ğ½Ğµ ÑĞ½Ñ–Ğ´Ğ°Ñ”Ğ¼Ğ¾ Ñ€Ğ°Ğ·Ğ¾Ğ¼.\n   > [!answer] Ğ¿Ñ€Ğ¾ĞºĞ¸Ğ´Ğ°Ñ”Ñ‚ÑŒÑÑ\n   > [!options] Ğ¿Ñ€Ğ¾ĞºĞ¸Ğ´Ğ°Ñ”Ñ‚ÑŒÑÑ | Ğ¿Ñ€Ğ¾ĞºĞ¸Ğ½ĞµÑ‚ÑŒÑÑ\n\n8. Ğ’Ğ¾Ğ½Ğ° Ñ‰Ğµ Ğ½Ğµ _______ Ğ·Ğ²Ñ–Ñ‚ â€” Ğ·Ñ€Ğ¾Ğ±Ğ¸Ñ‚ÑŒ Ñ†Ğµ Ğ·Ğ°Ğ²Ñ‚Ñ€Ğ° Ğ²Ñ€Ğ°Ğ½Ñ†Ñ–.\n   > [!answer] Ğ½Ğ°Ğ¿Ğ¸ÑĞ°Ğ»Ğ°\n   > [!options] Ğ¿Ğ¸ÑĞ°Ğ»Ğ° | Ğ½Ğ°Ğ¿Ğ¸ÑĞ°Ğ»Ğ°\n\n9. ĞšĞ¾Ğ»Ğ¸ Ñ ÑÑ‚ÑƒĞ´ĞµĞ½Ñ‚, Ñ _______ Ğ±Ğ°Ğ³Ğ°Ñ‚Ğ¾ ĞºĞ½Ğ¸Ğ³ Ñ‰Ğ¾Ğ¼Ñ–ÑÑÑ†Ñ â€” Ñ‚ĞµĞ¿ĞµÑ€ Ğ½ĞµĞ¼Ğ°Ñ” Ñ‡Ğ°ÑÑƒ.\n   > [!answer] Ñ‡Ğ¸Ñ‚Ğ°Ğ²\n   > [!options] Ñ‡Ğ¸Ñ‚Ğ°Ğ² | Ğ¿Ñ€Ğ¾Ñ‡Ğ¸Ñ‚Ğ°Ğ²\n\n10. Ğ—Ğ° Ğ²Ğ¸Ñ…Ñ–Ğ´Ğ½Ñ– Ñ _______ ÑƒÑÑ ĞºĞ½Ğ¸Ğ³Ñƒ Ğ²Ñ–Ğ´ Ğ¿ĞµÑ€ÑˆĞ¾Ñ— Ğ´Ğ¾ Ğ¾ÑÑ‚Ğ°Ğ½Ğ½ÑŒĞ¾Ñ— ÑÑ‚Ğ¾Ñ€Ñ–Ğ½ĞºĞ¸.\n    > [!answer] Ğ¿Ñ€Ğ¾Ñ‡Ğ¸Ñ‚Ğ°Ğ²\n    > [!options] Ñ‡Ğ¸Ñ‚Ğ°Ğ² | Ğ¿Ñ€Ğ¾Ñ‡Ğ¸Ñ‚Ğ°Ğ²\n\n11. Ğ’Ğ¾Ğ½Ğ° Ğ´Ğ¾Ğ²Ğ³Ğ¾ _______ Ğ´Ğ¾ ÑƒĞ½Ñ–Ğ²ĞµÑ€ÑĞ¸Ñ‚ĞµÑ‚Ñƒ, Ğ±Ğ¾ Ğ¶Ğ¸Ğ»Ğ° Ğ´Ğ°Ğ»ĞµĞºĞ¾ Ğ²Ñ–Ğ´ Ñ†ĞµĞ½Ñ‚Ñ€Ñƒ.\n    > [!answer] Ñ—Ğ·Ğ´Ğ¸Ğ»Ğ°\n    > [!options] Ñ—Ğ·Ğ´Ğ¸Ğ»Ğ° | Ğ¿Ğ¾Ñ—Ñ…Ğ°Ğ»Ğ°\n\n12. Ğ’Ñ–Ğ½ Ğ½Ğµ _______ Ğ²Ñ‡Ğ¾Ñ€Ğ° Ğ½Ğ° Ğ·Ğ°Ğ½ÑÑ‚Ñ‚Ñ, Ğ±Ğ¾ Ğ±ÑƒĞ² Ñ…Ğ²Ğ¾Ñ€Ğ¸Ğ¹ Ğ½Ğ° Ğ³Ñ€Ğ¸Ğ¿.\n    > [!answer] Ğ¿Ñ€Ğ¸Ğ¹ÑˆĞ¾Ğ²\n    > [!options] Ğ¿Ñ€Ğ¸Ñ…Ğ¾Ğ´Ğ¸Ğ² | Ğ¿Ñ€Ğ¸Ğ¹ÑˆĞ¾Ğ²\n\n13. ĞœĞ¸ Ğ·Ğ°Ğ²Ğ¶Ğ´Ğ¸ _______ Ğ½Ğ° Ñ†Ñ– Ğ·Ğ±Ğ¾Ñ€Ğ¸ Ğ¾ Ğ´ĞµĞ²'ÑÑ‚Ñ–Ğ¹ Ñ€Ğ°Ğ½ĞºÑƒ â€” Ñ†Ğµ Ñ‚Ñ€Ğ°Ğ´Ğ¸Ñ†Ñ–Ñ.\n    > [!answer] Ğ¿Ñ€Ğ¸Ñ…Ğ¾Ğ´Ğ¸Ğ¼Ğ¾\n    > [!options] Ğ¿Ñ€Ğ¸Ñ…Ğ¾Ğ´Ğ¸Ğ¼Ğ¾ | Ğ¿Ñ€Ğ¸Ğ¹Ğ´ĞµĞ¼Ğ¾\n\n14. ĞšĞ¾Ğ»Ğ¸ Ñ‚Ğ¸ _______ Ğ´Ğ¾Ğ´Ğ¾Ğ¼Ñƒ, Ğ·Ğ°Ñ‚ĞµĞ»ĞµÑ„Ğ¾Ğ½ÑƒĞ¹ Ğ¼ĞµĞ½Ñ– â€” Ñ Ñ…Ğ²Ğ¸Ğ»ÑÑÑÑ.\n    > [!answer] Ğ¿Ñ€Ğ¸Ğ¹Ğ´ĞµÑˆ\n    > [!options] Ğ¿Ñ€Ğ¸Ñ…Ğ¾Ğ´Ğ¸Ñ‚Ğ¸Ğ¼ĞµÑˆ | Ğ¿Ñ€Ğ¸Ğ¹Ğ´ĞµÑˆ\n\n---\n\n## error-correction: Ğ“Ñ€Ğ°Ğ¼Ğ°Ñ‚Ğ¸Ñ‡Ğ½Ñ– Ğ¿Ğ¾Ğ¼Ğ¸Ğ»ĞºĞ¸ B1\n\n> Ğ—Ğ½Ğ°Ğ¹Ğ´Ñ–Ñ‚ÑŒ Ğ¿Ğ¾Ğ¼Ğ¸Ğ»ĞºÑƒ Ğ² Ñ€ĞµÑ‡ĞµĞ½Ğ½Ñ– Ñ‚Ğ° Ğ²Ğ¸Ğ¿Ñ€Ğ°Ğ²Ñ‚Ğµ Ñ—Ñ—. Ğ—Ğ²ĞµÑ€Ğ½Ñ–Ñ‚ÑŒ ÑƒĞ²Ğ°Ğ³Ñƒ Ğ½Ğ° Ğ²Ğ¸Ğ´ Ğ´Ñ–Ñ”ÑĞ»Ğ¾Ğ²Ğ°, Ğ´Ñ–Ñ”ÑĞ»Ğ¾Ğ²Ğ° Ñ€ÑƒÑ…Ñƒ, ÑĞºĞ»Ğ°Ğ´Ğ½Ñ– Ñ€ĞµÑ‡ĞµĞ½Ğ½Ñ Ñ‚Ğ° Ğ´Ñ–Ñ”Ğ¿Ñ€Ğ¸ĞºĞ¼ĞµÑ‚Ğ½Ğ¸ĞºĞ¸.\n\n1. Ğ¯ Ğ²Ñ‡Ğ¾Ñ€Ğ° Ñ‡Ğ¸Ñ‚Ğ°Ğ² Ñ†Ñ ĞºĞ½Ğ¸Ğ³Ñƒ Ğ²Ñ–Ğ´ Ğ¿Ğ¾Ñ‡Ğ°Ñ‚ĞºÑƒ Ğ´Ğ¾ ĞºÑ–Ğ½Ñ†Ñ.\n   > [!error] Ñ‡Ğ¸Ñ‚Ğ°Ğ²\n   > [!answer] Ğ¿Ñ€Ğ¾Ñ‡Ğ¸Ñ‚Ğ°Ğ²\n   > [!options] Ñ‡Ğ¸Ñ‚Ğ°Ğ² | Ğ¿Ñ€Ğ¾Ñ‡Ğ¸Ñ‚Ğ°Ğ² | Ñ‡Ğ¸Ñ‚Ğ°Ñ‚Ğ¸Ğ¼Ñƒ | Ğ¿Ğ¾Ñ‡Ğ¸Ñ‚Ğ°Ğ²\n   > [!explanation] Ğ¯ĞºÑ‰Ğ¾ Ğ²ĞºĞ°Ğ·Ğ°Ğ½Ğ¾ Ñ€ĞµĞ·ÑƒĞ»ÑŒÑ‚Ğ°Ñ‚ (Ğ²Ñ–Ğ´ Ğ¿Ğ¾Ñ‡Ğ°Ñ‚ĞºÑƒ Ğ´Ğ¾ ĞºÑ–Ğ½Ñ†Ñ), Ğ¿Ğ¾Ñ‚Ñ€Ñ–Ğ±ĞµĞ½ Ğ´Ğ¾ĞºĞ¾Ğ½Ğ°Ğ½Ğ¸Ğ¹ Ğ²Ğ¸Ğ´: Â«Ğ¿Ñ€Ğ¾Ñ‡Ğ¸Ñ‚Ğ°Ğ²Â».\n\n2. Ğ’Ğ¾Ğ½Ğ° Ñ‰Ğ¾Ğ´Ğ½Ñ Ğ¿Ñ€Ğ¸Ñ…Ğ¾Ğ´Ğ¸Ğ»Ğ° Ğ´Ğ¾ Ğ¾Ñ„Ñ–ÑÑƒ Ğ¾ Ğ²Ğ¾ÑÑŒĞ¼Ñ–Ğ¹ Ğ³Ğ¾Ğ´Ğ¸Ğ½Ñ– Ñ€Ğ°Ğ½ĞºÑƒ.\n   > [!error] Ğ¿Ñ€Ğ¸Ñ…Ğ¾Ğ´Ğ¸Ğ»Ğ°\n   > [!answer] Ğ¿Ñ€Ğ¸Ñ…Ğ¾Ğ´Ğ¸Ñ‚ÑŒ\n   > [!options] Ğ¿Ñ€Ğ¸Ñ…Ğ¾Ğ´Ğ¸Ğ»Ğ° | Ğ¿Ñ€Ğ¸Ñ…Ğ¾Ğ´Ğ¸Ñ‚ÑŒ | Ğ¿Ñ€Ğ¸Ğ¹ÑˆĞ»Ğ° | Ğ¿Ñ€Ğ¸Ñ…Ğ¾Ğ´Ğ¸Ñ‚Ğ¸Ğ¼Ğµ\n   > [!explanation] Â«Ğ©Ğ¾Ğ´Ğ½ÑÂ» Ğ²ĞºĞ°Ğ·ÑƒÑ” Ğ½Ğ° Ñ‚ĞµĞ¿ĞµÑ€Ñ–ÑˆĞ½Ñ–Ğ¹ Ñ‡Ğ°Ñ â€” Ğ¿Ğ¾Ñ‚Ñ€Ñ–Ğ±Ğ½Ğ¾ Â«Ğ¿Ñ€Ğ¸Ñ…Ğ¾Ğ´Ğ¸Ñ‚ÑŒÂ».\n\n3. Ğ¯ĞºÑ‰Ğ¾ Ğ± Ñ Ğ¼Ğ°Ğ² Ñ‡Ğ°Ñ, Ñ Ğ´Ğ¾Ğ¿Ğ¾Ğ¼Ğ¾Ğ¶Ñƒ Ñ‚Ğ¾Ğ±Ñ– Ğ· Ñ†Ğ¸Ğ¼ Ğ¿Ñ€Ğ¾ĞµĞºÑ‚Ğ¾Ğ¼.\n   > [!error] Ğ´Ğ¾Ğ¿Ğ¾Ğ¼Ğ¾Ğ¶Ñƒ\n   > [!answer] Ğ´Ğ¾Ğ¿Ğ¾Ğ¼Ñ–Ğ³ Ğ±Ğ¸\n   > [!options] Ğ´Ğ¾Ğ¿Ğ¾Ğ¼Ğ¾Ğ¶Ñƒ | Ğ´Ğ¾Ğ¿Ğ¾Ğ¼Ñ–Ğ³ Ğ±Ğ¸ | Ğ´Ğ¾Ğ¿Ğ¾Ğ¼Ğ°Ğ³Ğ°Ñ | Ğ´Ğ¾Ğ¿Ğ¾Ğ¼Ğ¾Ğ³Ñƒ\n   > [!explanation] Ğ’ ÑƒĞ¼Ğ¾Ğ²Ğ½Ğ¾Ğ¼Ñƒ ÑĞ¿Ğ¾ÑĞ¾Ğ±Ñ– (ÑĞºÑ‰Ğ¾ Ğ±... ) Ğ¿Ğ¾Ñ‚Ñ€Ñ–Ğ±Ğ½Ğ° Ñ„Ğ¾Ñ€Ğ¼Ğ° Â«Ğ´Ğ¾Ğ¿Ğ¾Ğ¼Ñ–Ğ³ Ğ±Ğ¸Â».\n\n4. Ğ¢ĞµĞºÑÑ‚, Ğ½Ğ°Ğ¿Ğ¸ÑĞ°Ğ½Ğ¸Ğ¹ ÑÑ‚ÑƒĞ´ĞµĞ½Ñ‚Ğ¾Ğ¼, Ğ±ÑƒĞ² Ğ´ÑƒĞ¶Ğµ Ñ†Ñ–ĞºĞ°Ğ²Ğ¸Ğ¼ Ğ´Ğ»Ñ Ñ‡Ğ¸Ñ‚Ğ°Ğ½Ğ½Ñ.\n   > [!error] Ñ†Ñ–ĞºĞ°Ğ²Ğ¸Ğ¼\n   > [!answer] Ñ†Ñ–ĞºĞ°Ğ²Ğ¸Ğ¹\n   > [!options] Ñ†Ñ–ĞºĞ°Ğ²Ğ¸Ğ¼ | Ñ†Ñ–ĞºĞ°Ğ²Ğ¸Ğ¹ | Ñ†Ñ–ĞºĞ°Ğ²Ğµ | Ñ†Ñ–ĞºĞ°Ğ²Ğ°\n   > [!explanation] ĞŸÑ–ÑĞ»Ñ Â«Ğ±ÑƒĞ²Â» Ğ¿Ğ¾Ñ‚Ñ€Ñ–Ğ±ĞµĞ½ Ğ½Ğ°Ğ·Ğ¸Ğ²Ğ½Ğ¸Ğ¹ Ğ²Ñ–Ğ´Ğ¼Ñ–Ğ½Ğ¾Ğº: Â«Ñ†Ñ–ĞºĞ°Ğ²Ğ¸Ğ¹Â», Ğ½Ğµ Ğ¾Ñ€ÑƒĞ´Ğ½Ğ¸Ğ¹.\n\n5. Ğ¯ Ñ…Ğ¾Ñ‡Ñƒ, Ñ‰Ğ¾ Ğ²Ñ–Ğ½ Ğ¿Ñ€Ğ¸Ğ¹ÑˆĞ¾Ğ² Ğ½Ğ° Ğ·ÑƒÑÑ‚Ñ€Ñ–Ñ‡ Ğ¾ Ñ‚Ñ€ĞµÑ‚Ñ–Ğ¹ Ğ³Ğ¾Ğ´Ğ¸Ğ½Ñ–.\n   > [!error] Ñ‰Ğ¾\n   > [!answer] Ñ‰Ğ¾Ğ±\n   > [!options] Ñ‰Ğ¾ | Ñ‰Ğ¾Ğ± | ĞºĞ¾Ğ»Ğ¸ | ÑĞºÑ‰Ğ¾\n   > [!explanation] Ğ”Ğ»Ñ Ğ²Ğ¸Ñ€Ğ°Ğ¶ĞµĞ½Ğ½Ñ Ğ±Ğ°Ğ¶Ğ°Ğ½Ğ½Ñ Ğ¿Ğ¾Ñ‚Ñ€Ñ–Ğ±ĞµĞ½ ÑĞ¿Ğ¾Ğ»ÑƒÑ‡Ğ½Ğ¸Ğº Â«Ñ‰Ğ¾Ğ±Â» + Ğ¼Ğ¸Ğ½ÑƒĞ»Ğ¸Ğ¹ Ñ‡Ğ°Ñ.\n\n6. Ğ›Ñ–Ñ‚Ğ°Ğº Ğ²Ñ–Ğ´Ñ…Ğ¾Ğ´Ğ¸Ñ‚ÑŒ Ğ·Ğ° Ğ³Ğ¾Ğ´Ğ¸Ğ½Ñƒ, Ñ‚Ğ¾Ğ¼Ñƒ Ğ¼Ğ¸ Ğ¿Ğ¾Ğ²Ğ¸Ğ½Ğ½Ñ– Ğ¿Ğ¾ÑĞ¿Ñ–ÑˆĞ°Ñ‚Ğ¸.\n   > [!error] Ğ²Ñ–Ğ´Ñ…Ğ¾Ğ´Ğ¸Ñ‚ÑŒ\n   > [!answer] Ğ²Ñ–Ğ´Ğ»Ñ–Ñ‚Ğ°Ñ”\n   > [!options] Ğ²Ñ–Ğ´Ñ…Ğ¾Ğ´Ğ¸Ñ‚ÑŒ | Ğ²Ñ–Ğ´Ğ»Ñ–Ñ‚Ğ°Ñ” | Ğ²Ñ–Ğ´Ğ¿Ğ»Ğ¸Ğ²Ğ°Ñ” | Ğ²Ñ–Ğ´'Ñ—Ğ¶Ğ´Ğ¶Ğ°Ñ”\n   > [!explanation] Ğ”Ğ»Ñ Ğ»Ñ–Ñ‚Ğ°ĞºÑ–Ğ² Ğ²Ğ¸ĞºĞ¾Ñ€Ğ¸ÑÑ‚Ğ¾Ğ²ÑƒÑ”Ñ‚ÑŒÑÑ Â«Ğ²Ñ–Ğ´Ğ»Ñ–Ñ‚Ğ°Ñ‚Ğ¸Â», Ğ½Ğµ Â«Ğ²Ñ–Ğ´Ñ…Ğ¾Ğ´Ğ¸Ñ‚Ğ¸Â».\n\n7. Ğ¦Ğµ Ñ‚Ğ¾Ğ¹ ÑÑ‚ÑƒĞ´ĞµĞ½Ñ‚, Ñ…Ñ‚Ğ¾ Ğ¾Ñ‚Ñ€Ğ¸Ğ¼Ğ°Ğ² Ğ½Ğ°Ğ¹ĞºÑ€Ğ°Ñ‰Ñƒ Ğ¾Ñ†Ñ–Ğ½ĞºÑƒ Ğ½Ğ° Ñ–ÑĞ¿Ğ¸Ñ‚Ñ–.\n   > [!error] Ñ…Ñ‚Ğ¾\n   > [!answer] ÑĞºĞ¸Ğ¹\n   > [!options] Ñ…Ñ‚Ğ¾ | ÑĞºĞ¸Ğ¹ | Ñ‰Ğ¾ | ĞºĞ¾Ñ‚Ñ€Ğ¸Ğ¹\n   > [!explanation] Ğ£ Ğ¿Ñ–Ğ´Ñ€ÑĞ´Ğ½Ğ¸Ñ… Ğ¾Ğ·Ğ½Ğ°Ñ‡Ğ°Ğ»ÑŒĞ½Ğ¸Ñ… Ñ€ĞµÑ‡ĞµĞ½Ğ½ÑÑ… Ğ²Ğ¸ĞºĞ¾Ñ€Ğ¸ÑÑ‚Ğ¾Ğ²ÑƒÑ”Ñ‚ÑŒÑÑ Â«ÑĞºĞ¸Ğ¹Â», Ğ½Ğµ Â«Ñ…Ñ‚Ğ¾Â».\n\n8. Ğ§Ğ¸Ñ‚Ğ°ÑÑ‡Ğ¸ ĞºĞ½Ğ¸Ğ³Ñƒ, Ğ¼ÑƒĞ·Ğ¸ĞºĞ° Ğ³Ñ€Ğ°Ğ»Ğ° Ğ½Ğ° Ñ„Ğ¾Ğ½Ñ– Ğ´ÑƒĞ¶Ğµ Ğ³Ğ¾Ğ»Ğ¾ÑĞ½Ğ¾.\n   > [!error] Ğ¼ÑƒĞ·Ğ¸ĞºĞ°\n   > [!answer] Ñ\n   > [!options] Ğ¼ÑƒĞ·Ğ¸ĞºĞ° | Ñ | Ğ²Ñ–Ğ½ | Ğ²Ğ¾Ğ½Ğ°\n   > [!explanation] Ğ”Ñ–Ñ”Ğ¿Ñ€Ğ¸ÑĞ»Ñ–Ğ²Ğ½Ğ¸Ğº Ğ¼Ğ°Ñ” ÑÑ‚Ğ¾ÑÑƒĞ²Ğ°Ñ‚Ğ¸ÑÑ Ğ¿Ñ–Ğ´Ğ¼ĞµÑ‚Ğ°: Â«Ğ§Ğ¸Ñ‚Ğ°ÑÑ‡Ğ¸ ĞºĞ½Ğ¸Ğ³Ñƒ, Ñ ÑĞ»ÑƒÑ…Ğ°Ğ² Ğ¼ÑƒĞ·Ğ¸ĞºÑƒÂ».\n\n9. ĞĞµ Ğ²Ñ–Ğ´ĞºÑ€Ğ¸Ğ¹ Ğ²Ñ–ĞºĞ½Ğ¾, Ğ±Ğ¾ Ğ½Ğ° Ğ²ÑƒĞ»Ğ¸Ñ†Ñ– Ğ´ÑƒĞ¶Ğµ Ñ…Ğ¾Ğ»Ğ¾Ğ´Ğ½Ğ¾ ÑÑŒĞ¾Ğ³Ğ¾Ğ´Ğ½Ñ–.\n   > [!error] Ğ²Ñ–Ğ´ĞºÑ€Ğ¸Ğ¹\n   > [!answer] Ğ²Ñ–Ğ´ĞºÑ€Ğ¸Ğ²Ğ°Ğ¹\n   > [!options] Ğ²Ñ–Ğ´ĞºÑ€Ğ¸Ğ¹ | Ğ²Ñ–Ğ´ĞºÑ€Ğ¸Ğ²Ğ°Ğ¹ | Ğ²Ñ–Ğ´ĞºÑ€Ğ¸Ğ²Ğ°Ñ”Ñˆ | Ğ²Ñ–Ğ´ĞºÑ€Ğ¸Ñ”Ñˆ\n   > [!explanation] Ğ”Ğ»Ñ Ğ·Ğ°Ğ±Ğ¾Ñ€Ğ¾Ğ½Ğ¸ Ğ²Ğ¸ĞºĞ¾Ñ€Ğ¸ÑÑ‚Ğ¾Ğ²ÑƒÑ”Ñ‚ÑŒÑÑ Ğ½ĞµĞ´Ğ¾ĞºĞ¾Ğ½Ğ°Ğ½Ğ¸Ğ¹ Ğ²Ğ¸Ğ´: Â«ĞĞµ Ğ²Ñ–Ğ´ĞºÑ€Ğ¸Ğ²Ğ°Ğ¹Â».\n\n10. Ğ’Ñ–Ğ½ Ğ²Ğ¸Ñ…Ğ¾Ğ´Ğ¸Ğ² Ğ· Ğ´Ğ¾Ğ¼Ñƒ, ĞºĞ¾Ğ»Ğ¸ Ğ¿Ğ¾Ñ‡Ğ°Ğ² ÑĞ¸Ğ»ÑŒĞ½Ğ¸Ğ¹ Ğ´Ğ¾Ñ‰ Ñ–Ğ· Ğ³Ñ€Ğ°Ğ´Ğ¾Ğ¼.\n    > [!error] Ğ¿Ğ¾Ñ‡Ğ°Ğ²\n    > [!answer] Ğ¿Ğ¾Ñ‡Ğ°Ğ²ÑÑ\n    > [!options] Ğ¿Ğ¾Ñ‡Ğ°Ğ² | Ğ¿Ğ¾Ñ‡Ğ°Ğ²ÑÑ | Ğ¿Ğ¾Ñ‡Ğ¸Ğ½Ğ°Ğ² | Ğ¿Ğ¾Ñ‡Ğ¸Ğ½Ğ°Ğ²ÑÑ\n    > [!explanation] Ğ”Ğ¾Ñ‰ Â«Ğ¿Ğ¾Ñ‡Ğ°Ğ²ÑÑÂ» (Ğ·Ğ²Ğ¾Ñ€Ğ¾Ñ‚Ğ½Ğ° Ñ„Ğ¾Ñ€Ğ¼Ğ°), Ğ½Ğµ Â«Ğ¿Ğ¾Ñ‡Ğ°Ğ²Â».\n\n11. Ğ’Ğ¾Ğ½Ğ° Ğ·Ğ°ĞºÑ–Ğ½Ñ‡Ğ¸Ğ²ÑˆĞ¸ Ñ€Ğ¾Ğ±Ğ¾Ñ‚Ñƒ Ñ– Ğ¿Ñ–ÑˆĞ»Ğ° Ğ´Ğ¾Ğ´Ğ¾Ğ¼Ñƒ Ğ²Ñ–Ğ´Ğ¿Ğ¾Ñ‡Ğ¸Ğ²Ğ°Ñ‚Ğ¸ Ğ¿Ñ–ÑĞ»Ñ Ğ²Ğ°Ğ¶ĞºĞ¾Ğ³Ğ¾ Ğ´Ğ½Ñ.\n    > [!error] Ğ·Ğ°ĞºÑ–Ğ½Ñ‡Ğ¸Ğ²ÑˆĞ¸ Ñ€Ğ¾Ğ±Ğ¾Ñ‚Ñƒ Ñ– Ğ¿Ñ–ÑˆĞ»Ğ°\n    > [!answer] Ğ·Ğ°ĞºÑ–Ğ½Ñ‡Ğ¸Ğ²ÑˆĞ¸ Ñ€Ğ¾Ğ±Ğ¾Ñ‚Ñƒ, Ğ¿Ñ–ÑˆĞ»Ğ°\n    > [!options] Ğ·Ğ°ĞºÑ–Ğ½Ñ‡Ğ¸Ğ²ÑˆĞ¸ Ñ€Ğ¾Ğ±Ğ¾Ñ‚Ñƒ Ñ– Ğ¿Ñ–ÑˆĞ»Ğ° | Ğ·Ğ°ĞºÑ–Ğ½Ñ‡Ğ¸Ğ²ÑˆĞ¸ Ñ€Ğ¾Ğ±Ğ¾Ñ‚Ñƒ, Ğ¿Ñ–ÑˆĞ»Ğ° | Ğ·Ğ°ĞºÑ–Ğ½Ñ‡Ğ¸Ğ»Ğ° Ñ€Ğ¾Ğ±Ğ¾Ñ‚Ñƒ Ğ¿Ñ–ÑˆĞ»Ğ° | Ğ·Ğ°ĞºÑ–Ğ½Ñ‡Ğ¸Ğ²ÑˆĞ¸ Ñ€Ğ¾Ğ±Ğ¾Ñ‚Ğ¸ Ğ¿Ñ–ÑˆĞ»Ğ°\n    > [!explanation] Ğ”Ñ–Ñ”Ğ¿Ñ€Ğ¸ÑĞ»Ñ–Ğ²Ğ½Ğ¸Ğº Ğ²Ñ–Ğ´Ğ¾ĞºÑ€ĞµĞ¼Ğ»ÑÑ”Ñ‚ÑŒÑÑ ĞºĞ¾Ğ¼Ğ¾Ñ, ÑĞ¿Ğ¾Ğ»ÑƒÑ‡Ğ½Ğ¸Ğº Â«Ñ–Â» Ğ·Ğ°Ğ¹Ğ²Ğ¸Ğ¹.\n\n12. ĞšĞ½Ğ¸Ğ³Ğ° Ğ¿ĞµÑ€ĞµĞºĞ»Ğ°Ğ»Ğ¸ ÑƒĞºÑ€Ğ°Ñ—Ğ½ÑÑŒĞºĞ¾Ñ Ğ¼Ğ¾Ğ²Ğ¾Ñ Ğ¼Ğ¸Ğ½ÑƒĞ»Ğ¾Ğ³Ğ¾ Ñ€Ğ¾ĞºÑƒ Ñƒ Ğ›ÑŒĞ²Ğ¾Ğ²Ñ–.\n    > [!error] ĞšĞ½Ğ¸Ğ³Ğ° Ğ¿ĞµÑ€ĞµĞºĞ»Ğ°Ğ»Ğ¸\n    > [!answer] ĞšĞ½Ğ¸Ğ³Ñƒ Ğ¿ĞµÑ€ĞµĞºĞ»Ğ°Ğ»Ğ¸\n    > [!options] ĞšĞ½Ğ¸Ğ³Ğ° Ğ¿ĞµÑ€ĞµĞºĞ»Ğ°Ğ»Ğ¸ | ĞšĞ½Ğ¸Ğ³Ñƒ Ğ¿ĞµÑ€ĞµĞºĞ»Ğ°Ğ»Ğ¸ | ĞšĞ½Ğ¸Ğ³Ğ¸ Ğ¿ĞµÑ€ĞµĞºĞ»Ğ°Ğ»Ğ¸ | ĞšĞ½Ğ¸Ğ·Ñ– Ğ¿ĞµÑ€ĞµĞºĞ»Ğ°Ğ»Ğ¸\n    > [!explanation] ĞĞ±'Ñ”ĞºÑ‚ Ğ´Ñ–Ñ— ÑÑ‚Ğ¾Ñ—Ñ‚ÑŒ Ñƒ Ğ·Ğ½Ğ°Ñ…Ñ–Ğ´Ğ½Ğ¾Ğ¼Ñƒ Ğ²Ñ–Ğ´Ğ¼Ñ–Ğ½ĞºÑƒ: Â«ĞšĞ½Ğ¸Ğ³Ñƒ Ğ¿ĞµÑ€ĞµĞºĞ»Ğ°Ğ»Ğ¸Â».\n\n---\n\n## match-up: Ğ¡Ğ¿Ğ¾Ğ»ÑƒÑ‡Ğ½Ğ¸ĞºĞ¸ Ñ‚Ğ° Ñ‚Ğ¸Ğ¿Ğ¸ Ñ€ĞµÑ‡ĞµĞ½ÑŒ\n\n> Ğ¡Ğ¿Ñ–Ğ²ÑÑ‚Ğ°Ğ²Ñ‚Ğµ ÑĞ¿Ğ¾Ğ»ÑƒÑ‡Ğ½Ğ¸Ğº Ñ–Ğ· Ñ‚Ğ¸Ğ¿Ğ¾Ğ¼ ÑĞºĞ»Ğ°Ğ´Ğ½Ğ¾Ğ³Ğ¾ Ñ€ĞµÑ‡ĞµĞ½Ğ½Ñ, ÑĞºĞ¸Ğ¹ Ğ²Ñ–Ğ½ Ğ²Ğ²Ğ¾Ğ´Ğ¸Ñ‚ÑŒ.\n\n| Ğ¡Ğ¿Ğ¾Ğ»ÑƒÑ‡Ğ½Ğ¸Ğº | Ğ¢Ğ¸Ğ¿ Ñ€ĞµÑ‡ĞµĞ½Ğ½Ñ |\n|-----------|-------------|\n| ÑĞºĞ¸Ğ¹, ÑĞºĞ°, ÑĞºĞµ | Ğ¾Ğ·Ğ½Ğ°Ñ‡Ğ°Ğ»ÑŒĞ½Ğµ |\n| Ñ‰Ğ¾Ğ± | Ğ¼ĞµÑ‚Ğ¸ |\n| ÑĞºÑ‰Ğ¾ | ÑƒĞ¼Ğ¾Ğ²Ğ½Ğµ Ñ€ĞµĞ°Ğ»ÑŒĞ½Ğµ |\n| ÑĞºĞ±Ğ¸ | ÑƒĞ¼Ğ¾Ğ²Ğ½Ğµ Ğ½ĞµÑ€ĞµĞ°Ğ»ÑŒĞ½Ğµ |\n| Ñ…Ğ¾Ñ‡Ğ° | Ğ´Ğ¾Ğ¿ÑƒÑÑ‚Ğ¾Ğ²Ğµ |\n| Ñ‚Ğ¾Ğ¼Ñƒ Ñ‰Ğ¾ | Ğ¿Ñ€Ğ¸Ñ‡Ğ¸Ğ½Ğ¸ |\n| ĞºĞ¾Ğ»Ğ¸ | Ñ‡Ğ°ÑĞ¾Ğ²Ğµ |\n| Ğ´Ğµ, ĞºÑƒĞ´Ğ¸, Ğ·Ğ²Ñ–Ğ´ĞºĞ¸ | Ğ¼Ñ–ÑÑ†Ñ |\n| Ğ¿Ğ¾ĞºĞ¸ | Ğ¾Ğ´Ğ½Ğ¾Ñ‡Ğ°ÑĞ½Ğ¾ÑÑ‚Ñ– |\n| ÑĞº Ñ‚Ñ–Ğ»ÑŒĞºĞ¸ | Ğ½ĞµĞ³Ğ°Ğ¹Ğ½Ğ¾ÑÑ‚Ñ– |\n| Ğ½ĞµĞ·Ğ²Ğ°Ğ¶Ğ°ÑÑ‡Ğ¸ Ğ½Ğ° Ñ‚Ğµ Ñ‰Ğ¾ | Ñ„Ğ¾Ñ€Ğ¼Ğ°Ğ»ÑŒĞ½Ğµ Ğ´Ğ¾Ğ¿ÑƒÑÑ‚Ğ¾Ğ²Ğµ |\n| Ñ‡ĞµÑ€ĞµĞ· Ñ‚Ğµ Ñ‰Ğ¾ | Ñ„Ğ¾Ñ€Ğ¼Ğ°Ğ»ÑŒĞ½Ğµ Ğ¿Ñ€Ğ¸Ñ‡Ğ¸Ğ½Ğ¸ |\n\n---\n\n## cloze: ĞšĞ¾Ğ¼Ğ¿Ğ»ĞµĞºÑĞ½Ğ¸Ğ¹ Ñ‚ĞµĞºÑÑ‚ B1\n\n> Ğ—Ğ°Ğ¿Ğ¾Ğ²Ğ½Ñ–Ñ‚ÑŒ Ğ¿Ñ€Ğ¾Ğ¿ÑƒÑĞºĞ¸, Ğ¾Ğ±Ğ¸Ñ€Ğ°ÑÑ‡Ğ¸ Ğ¿Ñ€Ğ°Ğ²Ğ¸Ğ»ÑŒĞ½Ñƒ Ğ²Ñ–Ğ´Ğ¿Ğ¾Ğ²Ñ–Ğ´ÑŒ. Ğ¢ĞµĞºÑÑ‚ Ğ¿ĞµÑ€ĞµĞ²Ñ–Ñ€ÑÑ” Ğ²ÑÑ Ğ³Ñ€Ğ°Ğ¼Ğ°Ñ‚Ğ¸ĞºÑƒ Ñ€Ñ–Ğ²Ğ½Ñ B1.\n\nĞœĞ¸Ğ½ÑƒĞ»Ğ¾Ğ³Ğ¾ Ñ‚Ğ¸Ğ¶Ğ½Ñ Ñ {Ğ²Ğ¸Ñ€Ñ–ÑˆĞ¸Ğ²|Ğ²Ğ¸Ñ€Ñ–ÑˆĞ¸Ğ²|Ğ²Ğ¸Ñ€Ñ–ÑˆÑƒĞ²Ğ°Ğ²|Ğ²Ğ¸Ñ€Ñ–ÑˆĞ°Ñ‚Ğ¸} Ğ¿Ğ¾Ñ—Ñ…Ğ°Ñ‚Ğ¸ Ğ´Ğ¾ Ğ›ÑŒĞ²Ğ¾Ğ²Ğ°, {Ñ‰Ğ¾Ğ±|Ñ‰Ğ¾Ğ±|Ñ‰Ğ¾|ÑĞºÑ‰Ğ¾} Ğ²Ñ–Ğ´Ğ²Ñ–Ğ´Ğ°Ñ‚Ğ¸ Ğ´Ñ€ÑƒĞ·Ñ–Ğ². ĞšĞ¾Ğ»Ğ¸ Ñ {Ğ¿Ñ€Ğ¸Ñ—Ñ…Ğ°Ğ²|Ğ¿Ñ€Ğ¸Ñ—Ñ…Ğ°Ğ²|Ğ¿Ñ€Ğ¸Ñ—Ğ¶Ğ´Ğ¶Ğ°Ğ²|Ñ—Ñ…Ğ°Ğ²} Ğ½Ğ° Ğ²Ğ¾ĞºĞ·Ğ°Ğ», Ğ¿Ğ¾Ñ‚ÑĞ³ ÑƒĞ¶Ğµ {ÑÑ‚Ğ¾ÑĞ²|ÑÑ‚Ğ¾ÑĞ²|ÑÑ‚Ğ°Ğ²|ÑÑ‚Ğ°Ğ½Ğµ} Ğ½Ğ° Ğ¿Ğ»Ğ°Ñ‚Ñ„Ğ¾Ñ€Ğ¼Ñ–. Ğ¯ ÑˆĞ²Ğ¸Ğ´ĞºĞ¾ {Ğ·Ğ°Ğ¹ÑˆĞ¾Ğ²|Ğ·Ğ°Ğ¹ÑˆĞ¾Ğ²|Ğ·Ğ°Ñ…Ğ¾Ğ´Ğ¸Ğ²|Ğ²Ñ…Ğ¾Ğ´Ğ¸Ğ²} Ñƒ Ğ²Ğ°Ğ³Ğ¾Ğ½ Ñ– Ğ·Ğ½Ğ°Ğ¹ÑˆĞ¾Ğ² ÑĞ²Ğ¾Ñ” Ğ¼Ñ–ÑÑ†Ğµ.\n\nĞ”Ğ¾Ñ€Ğ¾Ğ³Ğ¾Ñ Ñ {Ñ‡Ğ¸Ñ‚Ğ°Ğ²|Ñ‡Ğ¸Ñ‚Ğ°Ğ²|Ğ¿Ñ€Ğ¾Ñ‡Ğ¸Ñ‚Ğ°Ğ²|Ñ‡Ğ¸Ñ‚Ğ°Ñ‚Ğ¸Ğ¼Ñƒ} ĞºĞ½Ğ¸Ğ³Ñƒ, {ÑĞºÑƒ|ÑĞºÑƒ|ÑĞºĞ°|ÑĞºÑ–} Ğ¼ĞµĞ½Ñ– Ğ¿Ğ¾Ğ´Ğ°Ñ€ÑƒĞ²Ğ°Ğ² Ğ´Ñ€ÑƒĞ³. Ğ¦Ğµ Ğ±ÑƒĞ»Ğ° ĞºĞ½Ğ¸Ğ³Ğ° Ğ¿Ñ€Ğ¾ Ñ–ÑÑ‚Ğ¾Ñ€Ñ–Ñ Ğ£ĞºÑ€Ğ°Ñ—Ğ½Ğ¸, {Ğ½Ğ°Ğ¿Ğ¸ÑĞ°Ğ½Ğ°|Ğ½Ğ°Ğ¿Ğ¸ÑĞ°Ğ½Ğ°|Ğ½Ğ°Ğ¿Ğ¸ÑĞ°Ğ½Ğ¸Ğ¹|Ğ½Ğ°Ğ¿Ğ¸ÑĞ°Ğ½Ğµ} Ğ²Ñ–Ğ´Ğ¾Ğ¼Ğ¸Ğ¼ Ñ–ÑÑ‚Ğ¾Ñ€Ğ¸ĞºĞ¾Ğ¼. {Ğ§Ğ¸Ñ‚Ğ°ÑÑ‡Ğ¸|Ğ§Ğ¸Ñ‚Ğ°ÑÑ‡Ğ¸|ĞŸÑ€Ğ¾Ñ‡Ğ¸Ñ‚Ğ°Ğ²ÑˆĞ¸|Ğ§Ğ¸Ñ‚Ğ°Ñ‚Ğ¸} Ñ—Ñ—, Ñ Ğ´Ñ–Ğ·Ğ½Ğ°Ğ²ÑÑ Ğ±Ğ°Ğ³Ğ°Ñ‚Ğ¾ Ğ½Ğ¾Ğ²Ğ¾Ğ³Ğ¾.\n\n{Ğ¯ĞºĞ±Ğ¸|Ğ¯ĞºĞ±Ğ¸|Ğ¯ĞºÑ‰Ğ¾|ĞšĞ¾Ğ»Ğ¸} Ñƒ Ğ¼ĞµĞ½Ğµ Ğ±ÑƒĞ»Ğ¾ Ğ±Ñ–Ğ»ÑŒÑˆĞµ Ñ‡Ğ°ÑÑƒ, Ñ Ğ± {Ğ·Ğ°Ğ»Ğ¸ÑˆĞ¸Ğ²ÑÑ|Ğ·Ğ°Ğ»Ğ¸ÑˆĞ¸Ğ²ÑÑ|Ğ·Ğ°Ğ»Ğ¸ÑˆĞ°Ğ²ÑÑ|Ğ·Ğ°Ğ»Ğ¸ÑˆÑƒÑÑŒ} Ñƒ Ğ›ÑŒĞ²Ğ¾Ğ²Ñ– Ğ½Ğ° Ñ‚Ğ¸Ğ¶Ğ´ĞµĞ½ÑŒ. ĞĞ»Ğµ, {Ğ½ĞµĞ·Ğ²Ğ°Ğ¶Ğ°ÑÑ‡Ğ¸|Ğ½ĞµĞ·Ğ²Ğ°Ğ¶Ğ°ÑÑ‡Ğ¸|Ñ‡ĞµÑ€ĞµĞ·|Ñ‚Ğ¾Ğ¼Ñƒ} Ğ½Ğ° ĞºĞ¾Ñ€Ğ¾Ñ‚ĞºĞ¸Ğ¹ Ğ²Ñ–Ğ·Ğ¸Ñ‚, Ñ Ğ²ÑÑ‚Ğ¸Ğ³ {Ğ¿Ğ¾Ğ±Ğ°Ñ‡Ğ¸Ñ‚Ğ¸|Ğ¿Ğ¾Ğ±Ğ°Ñ‡Ğ¸Ñ‚Ğ¸|Ğ±Ğ°Ñ‡Ğ¸Ñ‚Ğ¸|Ğ¿Ğ¾Ğ±Ğ°Ñ‡Ğ¸Ğ²} Ğ±Ğ°Ğ³Ğ°Ñ‚Ğ¾ Ñ†Ñ–ĞºĞ°Ğ²Ğ¾Ğ³Ğ¾.\n\nĞœĞ¾Ñ— Ğ´Ñ€ÑƒĞ·Ñ– {Ğ¿Ğ¾ĞºĞ°Ğ·Ğ°Ğ»Ğ¸|Ğ¿Ğ¾ĞºĞ°Ğ·Ğ°Ğ»Ğ¸|Ğ¿Ğ¾ĞºĞ°Ğ·ÑƒĞ²Ğ°Ğ»Ğ¸|Ğ¿Ğ¾ĞºĞ°Ğ¶ÑƒÑ‚ÑŒ} Ğ¼ĞµĞ½Ñ– Ğ¼Ñ–ÑÑ‚Ğ¾, {ÑĞºĞµ|ÑĞºĞµ|ÑĞºĞ¸Ğ¹|ÑĞºĞ°} Ğ²Ğ¾Ğ½Ğ¸ Ğ´Ğ¾Ğ±Ñ€Ğµ Ğ·Ğ½Ğ°ÑÑ‚ÑŒ. ĞœĞ¸ {Ğ¿Ñ€Ğ¾Ğ¹ÑˆĞ»Ğ¸|Ğ¿Ñ€Ğ¾Ğ¹ÑˆĞ»Ğ¸|Ğ¿Ñ€Ğ¾Ñ…Ğ¾Ğ´Ğ¸Ğ»Ğ¸|Ğ¹ÑˆĞ»Ğ¸} Ñ‡ĞµÑ€ĞµĞ· ÑƒÑĞµ ÑÑ‚Ğ°Ñ€Ğµ Ğ¼Ñ–ÑÑ‚Ğ¾, {Ğ·ÑƒĞ¿Ğ¸Ğ½ÑÑÑ‡Ğ¸ÑÑŒ|Ğ·ÑƒĞ¿Ğ¸Ğ½ÑÑÑ‡Ğ¸ÑÑŒ|Ğ·ÑƒĞ¿Ğ¸Ğ½Ğ¸Ğ²ÑˆĞ¸ÑÑŒ|Ğ·ÑƒĞ¿Ğ¸Ğ½ÑÑ‚Ğ¸ÑÑ} Ğ±Ñ–Ğ»Ñ ĞºĞ¾Ğ¶Ğ½Ğ¾Ñ— Ğ¿Ğ°Ğ¼'ÑÑ‚ĞºĞ¸. {Ğ¥Ğ¾Ñ‡Ğ°|Ğ¥Ğ¾Ñ‡Ğ°|Ğ¢Ğ¾Ğ¼Ñƒ Ñ‰Ğ¾|Ğ§ĞµÑ€ĞµĞ·} Ğ¹ÑˆĞ¾Ğ² Ğ´Ğ¾Ñ‰, Ğ¼Ğ¸ Ğ½Ğµ {Ğ¿Ğ¾Ğ²ĞµÑ€Ñ‚Ğ°Ğ»Ğ¸ÑÑ|Ğ¿Ğ¾Ğ²ĞµÑ€Ñ‚Ğ°Ğ»Ğ¸ÑÑ|Ğ¿Ğ¾Ğ²ĞµÑ€Ğ½ÑƒĞ»Ğ¸ÑÑ|Ğ¿Ğ¾Ğ²ĞµÑ€Ñ‚Ğ°Ñ”Ğ¼Ğ¾ÑÑŒ} Ğ´Ğ¾Ğ´Ğ¾Ğ¼Ñƒ.\n\n---\n\n## group-sort: Ğ›ĞµĞºÑĞ¸Ñ‡Ğ½Ñ– Ğ´Ğ¾Ğ¼ĞµĞ½Ğ¸ B1\n\n> Ğ Ğ¾Ğ·Ğ¿Ğ¾Ğ´Ñ–Ğ»Ñ–Ñ‚ÑŒ ÑĞ»Ğ¾Ğ²Ğ° Ğ·Ğ° Ñ‚ĞµĞ¼Ğ°Ñ‚Ğ¸Ñ‡Ğ½Ğ¸Ğ¼Ğ¸ Ğ³Ñ€ÑƒĞ¿Ğ°Ğ¼Ğ¸, Ğ´Ğ¾ ÑĞºĞ¸Ñ… Ğ²Ğ¾Ğ½Ğ¸ Ğ½Ğ°Ğ»ĞµĞ¶Ğ°Ñ‚ÑŒ.\n\n### ĞĞ±ÑÑ‚Ñ€Ğ°ĞºÑ‚Ğ½Ñ– Ğ¿Ğ¾Ğ½ÑÑ‚Ñ‚Ñ\n\n- ÑĞ¿Ñ€Ğ°Ğ²ĞµĞ´Ğ»Ğ¸Ğ²Ñ–ÑÑ‚ÑŒ\n- Ğ³Ñ–Ğ¿Ğ¾Ñ‚ĞµĞ·Ğ°\n- ĞºĞ¾Ğ½Ñ†ĞµĞ¿Ñ†Ñ–Ñ\n- Ğ·Ğ½Ğ°Ñ‡ĞµĞ½Ğ½Ñ\n- Ğ´Ğ¾ÑĞ»Ñ–Ğ´Ğ¶ĞµĞ½Ğ½Ñ\n- ÑĞ²Ğ¾Ğ±Ğ¾Ğ´Ğ°\n- Ñ€Ñ–Ğ²Ğ½Ñ–ÑÑ‚ÑŒ\n\n### Ğ”Ğ¸ÑĞºÑƒÑ€ÑĞ¸Ğ²Ğ½Ñ– Ğ¼Ğ°Ñ€ĞºĞµÑ€Ğ¸\n\n- Ğ¿Ğ¾-Ğ¿ĞµÑ€ÑˆĞµ\n- Ğ¾Ğ´Ğ½Ğ°Ğº\n- Ğ¾Ñ‚Ğ¶Ğµ\n- Ğ· Ñ–Ğ½ÑˆĞ¾Ğ³Ğ¾ Ğ±Ğ¾ĞºÑƒ\n- Ğ½Ğ°ÑĞ°Ğ¼ĞºÑ–Ğ½ĞµÑ†ÑŒ\n- Ğ´Ğ¾ Ñ€ĞµÑ‡Ñ–\n- Ñ‚Ğ¾Ğ±Ñ‚Ğ¾\n\n### ĞŸÑ€Ğ¾Ñ„ĞµÑÑ–Ğ¹Ğ½Ğ° Ğ»ĞµĞºÑĞ¸ĞºĞ°\n\n- ÑĞ¿Ñ–Ğ²Ğ±ĞµÑÑ–Ğ´Ğ°\n- Ñ€ĞµĞ·ÑĞ¼Ğµ\n- Ğ²Ğ°ĞºĞ°Ğ½ÑÑ–Ñ\n- ÑÑ‚Ñ€Ğ°Ñ‚ĞµĞ³Ñ–Ñ\n- Ğ¼ĞµĞ½ĞµĞ´Ğ¶ĞµÑ€\n- ĞºĞ¾Ğ»ĞµĞ³Ğ°\n- Ğ¿Ñ€Ğ¾ĞµĞºÑ‚\n\n### ĞšÑƒĞ»ÑŒÑ‚ÑƒÑ€Ğ° Ñ‚Ğ° Ñ€ĞµĞ³Ñ–Ğ¾Ğ½Ğ¸\n\n- ĞšĞ°Ñ€Ğ¿Ğ°Ñ‚Ğ¸\n- Ğ²Ğ¸ÑˆĞ¸Ğ²Ğ°Ğ½ĞºĞ°\n- Ğ“Ğ¾Ğ²ĞµÑ€Ğ»Ğ°\n- Ğ±Ğ°Ğ½Ğ´ÑƒÑ€Ğ°\n- Ğ¿Ğ¸ÑĞ°Ğ½ĞºĞ°\n- Ğ›ÑŒĞ²Ñ–Ğ²\n- ĞĞ´ĞµÑĞ°\n\n### Ğ•Ğ¼Ğ¾Ñ†Ñ–Ñ— Ñ‚Ğ° ÑÑ‚Ğ¾ÑÑƒĞ½ĞºĞ¸\n\n- Ğ·Ğ°Ñ…Ğ¾Ğ¿Ğ»ĞµĞ½Ğ½Ñ\n- Ñ€Ğ¾Ğ·Ñ‡Ğ°Ñ€ÑƒĞ²Ğ°Ğ½Ğ½Ñ\n- Ğ½Ñ–Ğ¶Ğ½Ñ–ÑÑ‚ÑŒ\n- Ğ´Ğ¾Ğ²Ñ–Ñ€Ğ°\n- Ğ¿Ñ€Ğ¸Ğ²'ÑĞ·Ğ°Ğ½Ñ–ÑÑ‚ÑŒ\n- Ñ€Ğ°Ğ´Ñ–ÑÑ‚ÑŒ\n- ÑÑƒĞ¼\n\n---\n\n## unjumble: Ğ¡ĞºĞ»Ğ°Ğ´Ğ½Ñ– Ñ€ĞµÑ‡ĞµĞ½Ğ½Ñ B1\n\n> ĞŸĞ¾ÑÑ‚Ğ°Ğ²Ñ‚Ğµ ÑĞ»Ğ¾Ğ²Ğ° Ñƒ Ğ¿Ñ€Ğ°Ğ²Ğ¸Ğ»ÑŒĞ½Ğ¾Ğ¼Ñƒ Ğ¿Ğ¾Ñ€ÑĞ´ĞºÑƒ, Ñ‰Ğ¾Ğ± ÑƒÑ‚Ğ²Ğ¾Ñ€Ğ¸Ñ‚Ğ¸ Ğ³Ñ€Ğ°Ğ¼Ğ°Ñ‚Ğ¸Ñ‡Ğ½Ğ¾ Ğ¿Ñ€Ğ°Ğ²Ğ¸Ğ»ÑŒĞ½Ğµ Ñ€ĞµÑ‡ĞµĞ½Ğ½Ñ.\n\n1. Ñ / Ğ¾Ğ´Ñ€Ğ°Ğ·Ñƒ / Ğ¿Ñ€Ğ¸Ñ—Ğ´Ñƒ / ĞºĞ¾Ğ»Ğ¸ / Ğ´Ğ¾Ğ´Ğ¾Ğ¼Ñƒ / Ğ·Ğ°Ñ‚ĞµĞ»ĞµÑ„Ğ¾Ğ½ÑƒÑ / Ñ‚Ğ¾Ğ±Ñ– / ÑÑŒĞ¾Ğ³Ğ¾Ğ´Ğ½Ñ– / Ğ²ĞµÑ‡ĞµÑ€Ñ– / Ğ¿Ñ–ÑĞ»Ñ / Ñ / ÑƒĞ²ĞµÑ‡ĞµÑ€Ñ–\n   > [!answer] ĞšĞ¾Ğ»Ğ¸ Ñ Ğ¿Ñ€Ğ¸Ñ—Ğ´Ñƒ Ğ´Ğ¾Ğ´Ğ¾Ğ¼Ñƒ Ğ¿Ñ–ÑĞ»Ñ Ğ²ĞµÑ‡ĞµÑ€Ñ– ÑÑŒĞ¾Ğ³Ğ¾Ğ´Ğ½Ñ– ÑƒĞ²ĞµÑ‡ĞµÑ€Ñ–, Ñ Ğ¾Ğ´Ñ€Ğ°Ğ·Ñƒ Ğ·Ğ°Ñ‚ĞµĞ»ĞµÑ„Ğ¾Ğ½ÑƒÑ Ñ‚Ğ¾Ğ±Ñ–.\n\n2. Ğ²Ñ–Ğ½ / Ğ½Ğµ / Ğ¿Ñ€Ğ¸Ğ¹ÑˆĞ¾Ğ² / Ğ½Ğ° / Ğ·Ğ°Ğ½ÑÑ‚Ñ‚Ñ / Ñ‚Ğ¾Ğ¼Ñƒ / Ñ‰Ğ¾ / Ğ±ÑƒĞ² / Ñ…Ğ²Ğ¾Ñ€Ğ¸Ğ¹ / ÑÑŒĞ¾Ğ³Ğ¾Ğ´Ğ½Ñ– / Ñ– / Ğ²Ñ‡Ğ¾Ñ€Ğ°\n   > [!answer] Ğ’Ñ–Ğ½ Ğ½Ğµ Ğ¿Ñ€Ğ¸Ğ¹ÑˆĞ¾Ğ² Ğ½Ğ° Ğ·Ğ°Ğ½ÑÑ‚Ñ‚Ñ Ñ‚Ğ¾Ğ¼Ñƒ, Ñ‰Ğ¾ Ğ±ÑƒĞ² Ñ…Ğ²Ğ¾Ñ€Ğ¸Ğ¹ ÑÑŒĞ¾Ğ³Ğ¾Ğ´Ğ½Ñ– Ñ– Ğ²Ñ‡Ğ¾Ñ€Ğ°.\n\n3. ÑĞºĞ±Ğ¸ / Ñ / Ğ¼Ğ°Ğ² / Ğ±Ñ–Ğ»ÑŒÑˆĞµ / Ñ‡Ğ°ÑÑƒ / Ğ²Ñ–Ğ»ÑŒĞ½Ğ¾Ğ³Ğ¾ / Ñ / Ğ± / Ñ‡Ğ¸Ñ‚Ğ°Ğ² / Ğ±Ñ–Ğ»ÑŒÑˆĞµ / ĞºĞ½Ğ¸Ğ³ / Ñ‰Ğ¾Ğ´Ğ½Ñ\n   > [!answer] Ğ¯ĞºĞ±Ğ¸ Ñ Ğ¼Ğ°Ğ² Ğ±Ñ–Ğ»ÑŒÑˆĞµ Ğ²Ñ–Ğ»ÑŒĞ½Ğ¾Ğ³Ğ¾ Ñ‡Ğ°ÑÑƒ, Ñ Ğ± Ñ‡Ğ¸Ñ‚Ğ°Ğ² Ğ±Ñ–Ğ»ÑŒÑˆĞµ ĞºĞ½Ğ¸Ğ³ Ñ‰Ğ¾Ğ´Ğ½Ñ.\n\n4. Ñ†Ğµ / Ñ‚Ğ¾Ğ¹ / Ğ´ÑƒĞ¶Ğµ / Ñ‚Ğ°Ğ»Ğ°Ğ½Ğ¾Ğ²Ğ¸Ñ‚Ğ¸Ğ¹ / ÑÑ‚ÑƒĞ´ĞµĞ½Ñ‚ / ÑĞºĞ¸Ğ¹ / Ğ¾Ñ‚Ñ€Ğ¸Ğ¼Ğ°Ğ² / Ğ½Ğ°Ğ¹ĞºÑ€Ğ°Ñ‰Ñƒ / Ğ¾Ñ†Ñ–Ğ½ĞºÑƒ / Ğ½Ğ° / Ñ–ÑĞ¿Ğ¸Ñ‚Ñ– / Ğ²Ñ‡Ğ¾Ñ€Ğ°\n   > [!answer] Ğ¦Ğµ Ñ‚Ğ¾Ğ¹ Ğ´ÑƒĞ¶Ğµ Ñ‚Ğ°Ğ»Ğ°Ğ½Ğ¾Ğ²Ğ¸Ñ‚Ğ¸Ğ¹ ÑÑ‚ÑƒĞ´ĞµĞ½Ñ‚, ÑĞºĞ¸Ğ¹ Ğ¾Ñ‚Ñ€Ğ¸Ğ¼Ğ°Ğ² Ğ½Ğ°Ğ¹ĞºÑ€Ğ°Ñ‰Ñƒ Ğ¾Ñ†Ñ–Ğ½ĞºÑƒ Ğ½Ğ° Ñ–ÑĞ¿Ğ¸Ñ‚Ñ– Ğ²Ñ‡Ğ¾Ñ€Ğ°.\n\n5. Ğ½ĞµĞ·Ğ²Ğ°Ğ¶Ğ°ÑÑ‡Ğ¸ / Ğ½Ğ° / Ñ‚Ğµ / Ñ‰Ğ¾ / ÑĞ¸Ğ»ÑŒĞ½Ğ¾ / Ğ¹ÑˆĞ¾Ğ² / Ğ´Ğ¾Ñ‰ / Ğ¼Ğ¸ / Ğ¿Ñ–ÑˆĞ»Ğ¸ / Ğ½Ğ° / Ğ´Ğ¾Ğ²Ğ³Ñƒ / Ğ¿Ñ€Ğ¾Ğ³ÑƒĞ»ÑĞ½ĞºÑƒ\n   > [!answer] ĞĞµĞ·Ğ²Ğ°Ğ¶Ğ°ÑÑ‡Ğ¸ Ğ½Ğ° Ñ‚Ğµ, Ñ‰Ğ¾ ÑĞ¸Ğ»ÑŒĞ½Ğ¾ Ğ¹ÑˆĞ¾Ğ² Ğ´Ğ¾Ñ‰, Ğ¼Ğ¸ Ğ¿Ñ–ÑˆĞ»Ğ¸ Ğ½Ğ° Ğ´Ğ¾Ğ²Ğ³Ñƒ Ğ¿Ñ€Ğ¾Ğ³ÑƒĞ»ÑĞ½ĞºÑƒ.\n\n6. ĞºĞ½Ğ¸Ğ³Ğ° / Ğ½Ğ°Ğ¿Ğ¸ÑĞ°Ğ½Ğ° / Ğ²Ğ¸Ğ´Ğ°Ñ‚Ğ½Ğ¸Ğ¼ / Ğ²Ñ–Ğ´Ğ¾Ğ¼Ğ¸Ğ¼ / ÑƒĞºÑ€Ğ°Ñ—Ğ½ÑÑŒĞºĞ¸Ğ¼ / Ğ°Ğ²Ñ‚Ğ¾Ñ€Ğ¾Ğ¼ / ÑÑ‚Ğ°Ğ»Ğ° / Ğ±ĞµÑÑ‚ÑĞµĞ»ĞµÑ€Ğ¾Ğ¼ / Ğ¼Ğ¸Ğ½ÑƒĞ»Ğ¾Ğ³Ğ¾ / Ñ€Ğ¾ĞºÑƒ / Ğ² / Ğ£ĞºÑ€Ğ°Ñ—Ğ½Ñ–\n   > [!answer] ĞšĞ½Ğ¸Ğ³Ğ°, Ğ½Ğ°Ğ¿Ğ¸ÑĞ°Ğ½Ğ° Ğ²Ğ¸Ğ´Ğ°Ñ‚Ğ½Ğ¸Ğ¼ Ğ²Ñ–Ğ´Ğ¾Ğ¼Ğ¸Ğ¼ ÑƒĞºÑ€Ğ°Ñ—Ğ½ÑÑŒĞºĞ¸Ğ¼ Ğ°Ğ²Ñ‚Ğ¾Ñ€Ğ¾Ğ¼, ÑÑ‚Ğ°Ğ»Ğ° Ğ±ĞµÑÑ‚ÑĞµĞ»ĞµÑ€Ğ¾Ğ¼ Ğ¼Ğ¸Ğ½ÑƒĞ»Ğ¾Ğ³Ğ¾ Ñ€Ğ¾ĞºÑƒ Ğ² Ğ£ĞºÑ€Ğ°Ñ—Ğ½Ñ–.\n\n7. Ğ²Ğ¾Ğ½Ğ° / Ğ´ÑƒĞ¶Ğµ / Ñ…Ğ¾Ñ‡Ğµ / Ñ‰Ğ¾Ğ± / Ñ—Ñ— / Ğ´Ñ–Ñ‚Ğ¸ / Ğ²Ğ¸Ğ²Ñ‡Ğ°Ğ»Ğ¸ / ÑƒĞºÑ€Ğ°Ñ—Ğ½ÑÑŒĞºÑƒ / Ğ¼Ğ¾Ğ²Ñƒ / Ğ· / Ñ€Ğ°Ğ½Ğ½ÑŒĞ¾Ğ³Ğ¾ / Ğ´Ğ¸Ñ‚Ğ¸Ğ½ÑÑ‚Ğ²Ğ°\n   > [!answer] Ğ’Ğ¾Ğ½Ğ° Ğ´ÑƒĞ¶Ğµ Ñ…Ğ¾Ñ‡Ğµ, Ñ‰Ğ¾Ğ± Ñ—Ñ— Ğ´Ñ–Ñ‚Ğ¸ Ğ²Ğ¸Ğ²Ñ‡Ğ°Ğ»Ğ¸ ÑƒĞºÑ€Ğ°Ñ—Ğ½ÑÑŒĞºÑƒ Ğ¼Ğ¾Ğ²Ñƒ Ğ· Ñ€Ğ°Ğ½Ğ½ÑŒĞ¾Ğ³Ğ¾ Ğ´Ğ¸Ñ‚Ğ¸Ğ½ÑÑ‚Ğ²Ğ°.\n\n8. ÑƒĞ²Ğ°Ğ¶Ğ½Ğ¾ / Ğ¿Ñ€Ğ¾Ñ‡Ğ¸Ñ‚Ğ°Ğ²ÑˆĞ¸ / Ñ†Ñ / Ğ²Ğ°Ğ¶Ğ»Ğ¸Ğ²Ñƒ / ÑÑ‚Ğ°Ñ‚Ñ‚Ñ / Ğ²Ñ–Ğ½ / Ğ·Ñ€Ğ¾Ğ·ÑƒĞ¼Ñ–Ğ² / Ğ²Ğ°Ğ¶Ğ»Ğ¸Ğ²Ñ–ÑÑ‚ÑŒ / Ñ†Ñ–Ñ”Ñ— / Ğ¿Ñ€Ğ¾Ğ±Ğ»ĞµĞ¼Ğ¸ / Ğ´Ğ»Ñ / Ğ£ĞºÑ€Ğ°Ñ—Ğ½Ğ¸\n   > [!answer] Ğ£Ğ²Ğ°Ğ¶Ğ½Ğ¾ Ğ¿Ñ€Ğ¾Ñ‡Ğ¸Ñ‚Ğ°Ğ²ÑˆĞ¸ Ñ†Ñ Ğ²Ğ°Ğ¶Ğ»Ğ¸Ğ²Ñƒ ÑÑ‚Ğ°Ñ‚Ñ‚Ñ, Ğ²Ñ–Ğ½ Ğ·Ñ€Ğ¾Ğ·ÑƒĞ¼Ñ–Ğ² Ğ²Ğ°Ğ¶Ğ»Ğ¸Ğ²Ñ–ÑÑ‚ÑŒ Ñ†Ñ–Ñ”Ñ— Ğ¿Ñ€Ğ¾Ğ±Ğ»ĞµĞ¼Ğ¸ Ğ´Ğ»Ñ Ğ£ĞºÑ€Ğ°Ñ—Ğ½Ğ¸.\n\n9. Ñ…Ğ¾Ñ‡Ğ° / Ğ²Ñ–Ğ½ / Ğ´ÑƒĞ¶Ğµ / Ğ±Ğ°Ğ³Ğ°Ñ‚Ğ¾ / Ğ¿Ñ€Ğ°Ñ†ÑÑ” / Ğ²Ñ–Ğ½ / Ğ·Ğ°Ğ²Ğ¶Ğ´Ğ¸ / Ğ·Ğ½Ğ°Ñ…Ğ¾Ğ´Ğ¸Ñ‚ÑŒ / Ğ²Ñ–Ğ»ÑŒĞ½Ğ¸Ğ¹ / Ñ‡Ğ°Ñ / Ğ´Ğ»Ñ / ÑÑ–Ğ¼'Ñ—\n   > [!answer] Ğ¥Ğ¾Ñ‡Ğ° Ğ²Ñ–Ğ½ Ğ´ÑƒĞ¶Ğµ Ğ±Ğ°Ğ³Ğ°Ñ‚Ğ¾ Ğ¿Ñ€Ğ°Ñ†ÑÑ”, Ğ²Ñ–Ğ½ Ğ·Ğ°Ğ²Ğ¶Ğ´Ğ¸ Ğ·Ğ½Ğ°Ñ…Ğ¾Ğ´Ğ¸Ñ‚ÑŒ Ğ²Ñ–Ğ»ÑŒĞ½Ğ¸Ğ¹ Ñ‡Ğ°Ñ Ğ´Ğ»Ñ ÑÑ–Ğ¼'Ñ—.\n\n10. Ğ¿ĞµÑ€Ñˆ / Ğ½Ñ–Ğ¶ / Ğ¿Ñ€Ğ¸Ğ¹Ğ½ÑÑ‚Ğ¸ / Ğ²Ğ°Ğ¶Ğ»Ğ¸Ğ²Ğµ / Ñ€Ñ–ÑˆĞµĞ½Ğ½Ñ / Ğ²Ğ°Ğ¼ / Ğ¾Ğ±Ğ¾Ğ²'ÑĞ·ĞºĞ¾Ğ²Ğ¾ / Ğ¿Ğ¾Ñ‚Ñ€Ñ–Ğ±Ğ½Ğ¾ / Ğ´Ğ¾Ğ±Ñ€Ğµ / Ğ¿Ğ¾Ğ´ÑƒĞ¼Ğ°Ñ‚Ğ¸ / Ğ¿Ñ€Ğ¾ / Ğ½Ğ°ÑĞ»Ñ–Ğ´ĞºĞ¸\n    > [!answer] ĞŸĞµÑ€Ñˆ Ğ½Ñ–Ğ¶ Ğ¿Ñ€Ğ¸Ğ¹Ğ½ÑÑ‚Ğ¸ Ğ²Ğ°Ğ¶Ğ»Ğ¸Ğ²Ğµ Ñ€Ñ–ÑˆĞµĞ½Ğ½Ñ, Ğ²Ğ°Ğ¼ Ğ¾Ğ±Ğ¾Ğ²'ÑĞ·ĞºĞ¾Ğ²Ğ¾ Ğ¿Ğ¾Ñ‚Ñ€Ñ–Ğ±Ğ½Ğ¾ Ğ´Ğ¾Ğ±Ñ€Ğµ Ğ¿Ğ¾Ğ´ÑƒĞ¼Ğ°Ñ‚Ğ¸ Ğ¿Ñ€Ğ¾ Ğ½Ğ°ÑĞ»Ñ–Ğ´ĞºĞ¸.\n\n---\n\n## translate: ĞšĞ¾Ğ¼Ğ¿Ğ»ĞµĞºÑĞ½Ğ¸Ğ¹ Ğ¿ĞµÑ€ĞµĞºĞ»Ğ°Ğ´ B1\n\n> ĞĞ±ĞµÑ€Ñ–Ñ‚ÑŒ Ğ½Ğ°Ğ¹ĞºÑ€Ğ°Ñ‰Ğ¸Ğ¹ Ğ¿ĞµÑ€ĞµĞºĞ»Ğ°Ğ´ Ñ€ĞµÑ‡ĞµĞ½Ğ½Ñ ÑƒĞºÑ€Ğ°Ñ—Ğ½ÑÑŒĞºĞ¾Ñ Ğ¼Ğ¾Ğ²Ğ¾Ñ, ÑĞºĞ¸Ğ¹ Ğ´ĞµĞ¼Ğ¾Ğ½ÑÑ‚Ñ€ÑƒÑ” Ğ¿Ñ€Ğ°Ğ²Ğ¸Ğ»ÑŒĞ½Ğµ Ğ²Ğ¸ĞºĞ¾Ñ€Ğ¸ÑÑ‚Ğ°Ğ½Ğ½Ñ Ğ³Ñ€Ğ°Ğ¼Ğ°Ñ‚Ğ¸ĞºĞ¸ B1.\n\n1. I want you to come to the meeting at three o'clock.\n   - [ ] Ğ¯ Ñ…Ğ¾Ñ‡Ñƒ, Ñ‰Ğ¾ Ñ‚Ğ¸ Ğ¿Ñ€Ğ¸Ğ¹ÑˆĞ¾Ğ² Ğ½Ğ° Ğ·ÑƒÑÑ‚Ñ€Ñ–Ñ‡ Ğ¾ Ñ‚Ñ€ĞµÑ‚Ñ–Ğ¹ Ğ³Ğ¾Ğ´Ğ¸Ğ½Ñ–.\n   - [x] Ğ¯ Ñ…Ğ¾Ñ‡Ñƒ, Ñ‰Ğ¾Ğ± Ñ‚Ğ¸ Ğ¿Ñ€Ğ¸Ğ¹ÑˆĞ¾Ğ² Ğ½Ğ° Ğ·ÑƒÑÑ‚Ñ€Ñ–Ñ‡ Ğ¾ Ñ‚Ñ€ĞµÑ‚Ñ–Ğ¹ Ğ³Ğ¾Ğ´Ğ¸Ğ½Ñ–.\n   - [ ] Ğ¯ Ñ…Ğ¾Ñ‡Ñƒ, ĞºĞ¾Ğ»Ğ¸ Ñ‚Ğ¸ Ğ¿Ñ€Ğ¸Ğ¹ÑˆĞ¾Ğ² Ğ½Ğ° Ğ·ÑƒÑÑ‚Ñ€Ñ–Ñ‡ Ğ¾ Ñ‚Ñ€ĞµÑ‚Ñ–Ğ¹ Ğ³Ğ¾Ğ´Ğ¸Ğ½Ñ–.\n   - [ ] Ğ¯ Ñ…Ğ¾Ñ‡Ñƒ, ÑĞºĞ±Ğ¸ Ñ‚Ğ¸ Ğ¿Ñ€Ğ¸Ğ¹ÑˆĞ¾Ğ² Ğ½Ğ° Ğ·ÑƒÑÑ‚Ñ€Ñ–Ñ‡ Ğ¾ Ñ‚Ñ€ĞµÑ‚Ñ–Ğ¹ Ğ³Ğ¾Ğ´Ğ¸Ğ½Ñ–.\n   > Ğ”Ğ»Ñ Ğ²Ğ¸Ñ€Ğ°Ğ¶ĞµĞ½Ğ½Ñ Ğ±Ğ°Ğ¶Ğ°Ğ½Ğ½Ñ Ğ²Ğ¸ĞºĞ¾Ñ€Ğ¸ÑÑ‚Ğ¾Ğ²ÑƒÑ”Ñ‚ÑŒÑÑ Â«Ñ‰Ğ¾Ğ±Â» + Ğ¼Ğ¸Ğ½ÑƒĞ»Ğ¸Ğ¹ Ñ‡Ğ°Ñ.\n\n2. If I had more time, I would help you with this project.\n   - [ ] Ğ¯ĞºÑ‰Ğ¾ Ñ Ğ¼Ğ°Ñ Ğ±Ñ–Ğ»ÑŒÑˆĞµ Ñ‡Ğ°ÑÑƒ, Ñ Ğ´Ğ¾Ğ¿Ğ¾Ğ¼Ğ¾Ğ¶Ñƒ Ñ‚Ğ¾Ğ±Ñ– Ğ· Ñ†Ğ¸Ğ¼ Ğ¿Ñ€Ğ¾ĞµĞºÑ‚Ğ¾Ğ¼.\n   - [ ] Ğ¯ĞºÑ‰Ğ¾ Ğ± Ñ Ğ¼Ğ°Ğ² Ğ±Ñ–Ğ»ÑŒÑˆĞµ Ñ‡Ğ°ÑÑƒ, Ñ Ğ´Ğ¾Ğ¿Ğ¾Ğ¼Ğ°Ğ³Ğ°Ñ Ñ‚Ğ¾Ğ±Ñ– Ğ· Ñ†Ğ¸Ğ¼ Ğ¿Ñ€Ğ¾ĞµĞºÑ‚Ğ¾Ğ¼.\n   - [x] Ğ¯ĞºĞ±Ğ¸ Ñ Ğ¼Ğ°Ğ² Ğ±Ñ–Ğ»ÑŒÑˆĞµ Ñ‡Ğ°ÑÑƒ, Ñ Ğ± Ğ´Ğ¾Ğ¿Ğ¾Ğ¼Ñ–Ğ³ Ñ‚Ğ¾Ğ±Ñ– Ğ· Ñ†Ğ¸Ğ¼ Ğ¿Ñ€Ğ¾ĞµĞºÑ‚Ğ¾Ğ¼.\n   - [ ] ĞšĞ¾Ğ»Ğ¸ Ñ Ğ¼Ğ°Ğ² Ğ±Ñ–Ğ»ÑŒÑˆĞµ Ñ‡Ğ°ÑÑƒ, Ñ Ğ´Ğ¾Ğ¿Ğ¾Ğ¼Ñ–Ğ³ Ñ‚Ğ¾Ğ±Ñ– Ğ· Ñ†Ğ¸Ğ¼ Ğ¿Ñ€Ğ¾ĞµĞºÑ‚Ğ¾Ğ¼.\n   > ĞĞµÑ€ĞµĞ°Ğ»ÑŒĞ½Ğ° ÑƒĞ¼Ğ¾Ğ²Ğ°: Â«Ğ¯ĞºĞ±Ğ¸Â» + Ğ¼Ğ¸Ğ½ÑƒĞ»Ğ¸Ğ¹ Ñ‡Ğ°Ñ + Â«Ğ±Â» + Ğ¼Ğ¸Ğ½ÑƒĞ»Ğ¸Ğ¹ Ñ‡Ğ°Ñ.\n\n3. The book written by this author became a bestseller last year.\n   - [ ] ĞšĞ½Ğ¸Ğ³Ğ°, ÑĞºÑƒ Ğ¿Ğ¸ÑĞ°Ğ² Ñ†ĞµĞ¹ Ğ°Ğ²Ñ‚Ğ¾Ñ€, ÑÑ‚Ğ°Ğ»Ğ° Ğ±ĞµÑÑ‚ÑĞµĞ»ĞµÑ€Ğ¾Ğ¼ Ğ¼Ğ¸Ğ½ÑƒĞ»Ğ¾Ğ³Ğ¾ Ñ€Ğ¾ĞºÑƒ.\n   - [x] ĞšĞ½Ğ¸Ğ³Ğ°, Ğ½Ğ°Ğ¿Ğ¸ÑĞ°Ğ½Ğ° Ñ†Ğ¸Ğ¼ Ğ°Ğ²Ñ‚Ğ¾Ñ€Ğ¾Ğ¼, ÑÑ‚Ğ°Ğ»Ğ° Ğ±ĞµÑÑ‚ÑĞµĞ»ĞµÑ€Ğ¾Ğ¼ Ğ¼Ğ¸Ğ½ÑƒĞ»Ğ¾Ğ³Ğ¾ Ñ€Ğ¾ĞºÑƒ.\n   - [ ] ĞšĞ½Ğ¸Ğ³Ğ°, Ğ¿Ğ¸ÑˆÑƒÑ‡Ğ¸ Ñ†Ğ¸Ğ¼ Ğ°Ğ²Ñ‚Ğ¾Ñ€Ğ¾Ğ¼, ÑÑ‚Ğ°Ğ»Ğ° Ğ±ĞµÑÑ‚ÑĞµĞ»ĞµÑ€Ğ¾Ğ¼ Ğ¼Ğ¸Ğ½ÑƒĞ»Ğ¾Ğ³Ğ¾ Ñ€Ğ¾ĞºÑƒ.\n   - [ ] ĞšĞ½Ğ¸Ğ³Ğ°, Ñ‰Ğ¾ Ğ½Ğ°Ğ¿Ğ¸ÑĞ°Ğ»Ğ° Ñ†ĞµĞ¹ Ğ°Ğ²Ñ‚Ğ¾Ñ€, ÑÑ‚Ğ°Ğ»Ğ° Ğ±ĞµÑÑ‚ÑĞµĞ»ĞµÑ€Ğ¾Ğ¼ Ğ¼Ğ¸Ğ½ÑƒĞ»Ğ¾Ğ³Ğ¾ Ñ€Ğ¾ĞºÑƒ.\n   > ĞŸĞ°ÑĞ¸Ğ²Ğ½Ğ¸Ğ¹ Ğ´Ñ–Ñ”Ğ¿Ñ€Ğ¸ĞºĞ¼ĞµÑ‚Ğ½Ğ¸Ğº: Â«Ğ½Ğ°Ğ¿Ğ¸ÑĞ°Ğ½Ğ°Â» ÑƒĞ·Ğ³Ğ¾Ğ´Ğ¶ÑƒÑ”Ñ‚ÑŒÑÑ Ğ· Â«ĞºĞ½Ğ¸Ğ³Ğ°Â».\n\n4. While reading the book, I was listening to music.\n   - [ ] ĞŸÑ€Ğ¾Ñ‡Ğ¸Ñ‚Ğ°Ğ²ÑˆĞ¸ ĞºĞ½Ğ¸Ğ³Ñƒ, Ñ ÑĞ»ÑƒÑ…Ğ°Ğ² Ğ¼ÑƒĞ·Ğ¸ĞºÑƒ.\n   - [x] Ğ§Ğ¸Ñ‚Ğ°ÑÑ‡Ğ¸ ĞºĞ½Ğ¸Ğ³Ñƒ, Ñ ÑĞ»ÑƒÑ…Ğ°Ğ² Ğ¼ÑƒĞ·Ğ¸ĞºÑƒ.\n   - [ ] Ğ§Ğ¸Ñ‚Ğ°Ñ‚Ğ¸ ĞºĞ½Ğ¸Ğ³Ñƒ, Ñ ÑĞ»ÑƒÑ…Ğ°Ğ² Ğ¼ÑƒĞ·Ğ¸ĞºÑƒ.\n   - [ ] ĞšĞ¾Ğ»Ğ¸ Ñ‡Ğ¸Ñ‚Ğ°Ñ ĞºĞ½Ğ¸Ğ³Ñƒ, Ñ ÑĞ»ÑƒÑ…Ğ°Ğ² Ğ¼ÑƒĞ·Ğ¸ĞºÑƒ.\n   > ĞĞ´Ğ½Ğ¾Ñ‡Ğ°ÑĞ½Ñ–ÑÑ‚ÑŒ: Ğ½ĞµĞ´Ğ¾ĞºĞ¾Ğ½Ğ°Ğ½Ğ¸Ğ¹ Ğ´Ñ–Ñ”Ğ¿Ñ€Ğ¸ÑĞ»Ñ–Ğ²Ğ½Ğ¸Ğº Â«Ñ‡Ğ¸Ñ‚Ğ°ÑÑ‡Ğ¸Â».\n\n5. Although it was raining, we went for a walk in the park.\n   - [x] Ğ¥Ğ¾Ñ‡Ğ° Ğ¹ÑˆĞ¾Ğ² Ğ´Ğ¾Ñ‰, Ğ¼Ğ¸ Ğ¿Ñ–ÑˆĞ»Ğ¸ Ğ½Ğ° Ğ¿Ñ€Ğ¾Ğ³ÑƒĞ»ÑĞ½ĞºÑƒ Ğ² Ğ¿Ğ°Ñ€Ğº.\n   - [ ] Ğ¢Ğ¾Ğ¼Ñƒ Ñ‰Ğ¾ Ğ¹ÑˆĞ¾Ğ² Ğ´Ğ¾Ñ‰, Ğ¼Ğ¸ Ğ¿Ñ–ÑˆĞ»Ğ¸ Ğ½Ğ° Ğ¿Ñ€Ğ¾Ğ³ÑƒĞ»ÑĞ½ĞºÑƒ Ğ² Ğ¿Ğ°Ñ€Ğº.\n   - [ ] Ğ¯ĞºÑ‰Ğ¾ Ğ¹ÑˆĞ¾Ğ² Ğ´Ğ¾Ñ‰, Ğ¼Ğ¸ Ğ¿Ñ–ÑˆĞ»Ğ¸ Ğ½Ğ° Ğ¿Ñ€Ğ¾Ğ³ÑƒĞ»ÑĞ½ĞºÑƒ Ğ² Ğ¿Ğ°Ñ€Ğº.\n   - [ ] ĞšĞ¾Ğ»Ğ¸ Ğ¹ÑˆĞ¾Ğ² Ğ´Ğ¾Ñ‰, Ğ¼Ğ¸ Ğ¿Ñ–ÑˆĞ»Ğ¸ Ğ½Ğ° Ğ¿Ñ€Ğ¾Ğ³ÑƒĞ»ÑĞ½ĞºÑƒ Ğ² Ğ¿Ğ°Ñ€Ğº.\n   > Ğ”Ğ¾Ğ¿ÑƒÑÑ‚Ğ¾Ğ²Ğµ Ğ·Ğ½Ğ°Ñ‡ĞµĞ½Ğ½Ñ: Â«Ğ¥Ğ¾Ñ‡Ğ°Â» Ğ²ĞºĞ°Ğ·ÑƒÑ” Ğ½Ğ° Ğ¿Ñ€Ğ¾Ñ‚Ğ¸ÑÑ‚Ğ°Ğ²Ğ»ĞµĞ½Ğ½Ñ.\n\n6. The plane takes off in an hour, so we must hurry to the airport.\n   - [ ] Ğ›Ñ–Ñ‚Ğ°Ğº Ğ²Ñ–Ğ´Ñ…Ğ¾Ğ´Ğ¸Ñ‚ÑŒ Ğ·Ğ° Ğ³Ğ¾Ğ´Ğ¸Ğ½Ñƒ, Ñ‚Ğ¾Ğ¼Ñƒ Ğ¼Ğ¸ Ğ¿Ğ¾Ğ²Ğ¸Ğ½Ğ½Ñ– Ğ¿Ğ¾ÑĞ¿Ñ–ÑˆĞ°Ñ‚Ğ¸.\n   - [x] Ğ›Ñ–Ñ‚Ğ°Ğº Ğ²Ñ–Ğ´Ğ»Ñ–Ñ‚Ğ°Ñ” Ğ·Ğ° Ğ³Ğ¾Ğ´Ğ¸Ğ½Ñƒ, Ñ‚Ğ¾Ğ¼Ñƒ Ğ¼Ğ¸ Ğ¿Ğ¾Ğ²Ğ¸Ğ½Ğ½Ñ– Ğ¿Ğ¾ÑĞ¿Ñ–ÑˆĞ°Ñ‚Ğ¸ Ğ´Ğ¾ Ğ°ĞµÑ€Ğ¾Ğ¿Ğ¾Ñ€Ñ‚Ñƒ.\n   - [ ] Ğ›Ñ–Ñ‚Ğ°Ğº Ğ²Ñ–Ğ´Ğ¿Ğ»Ğ¸Ğ²Ğ°Ñ” Ğ·Ğ° Ğ³Ğ¾Ğ´Ğ¸Ğ½Ñƒ, Ñ‚Ğ¾Ğ¼Ñƒ Ğ¼Ğ¸ Ğ¿Ğ¾Ğ²Ğ¸Ğ½Ğ½Ñ– Ğ¿Ğ¾ÑĞ¿Ñ–ÑˆĞ°Ñ‚Ğ¸.\n   - [ ] Ğ›Ñ–Ñ‚Ğ°Ğº Ğ²Ñ–Ğ´'Ñ—Ğ¶Ğ´Ğ¶Ğ°Ñ” Ğ·Ğ° Ğ³Ğ¾Ğ´Ğ¸Ğ½Ñƒ, Ñ‚Ğ¾Ğ¼Ñƒ Ğ¼Ğ¸ Ğ¿Ğ¾Ğ²Ğ¸Ğ½Ğ½Ñ– Ğ¿Ğ¾ÑĞ¿Ñ–ÑˆĞ°Ñ‚Ğ¸.\n   > Ğ”Ğ»Ñ Ğ»Ñ–Ñ‚Ğ°ĞºÑ–Ğ²: Â«Ğ²Ñ–Ğ´Ğ»Ñ–Ñ‚Ğ°Ñ‚Ğ¸Â», Ğ½Ğµ Â«Ğ²Ñ–Ğ´Ñ…Ğ¾Ğ´Ğ¸Ñ‚Ğ¸Â».\n\n7. I came to the restaurant at seven o'clock, but my friend had already left.\n   - [ ] Ğ¯ Ğ¿Ñ€Ğ¸Ñ…Ğ¾Ğ´Ğ¸Ğ² Ğ´Ğ¾ Ñ€ĞµÑÑ‚Ğ¾Ñ€Ğ°Ğ½Ñƒ Ğ¾ ÑÑŒĞ¾Ğ¼Ñ–Ğ¹ Ğ³Ğ¾Ğ´Ğ¸Ğ½Ñ–, Ğ°Ğ»Ğµ Ğ¼Ñ–Ğ¹ Ğ´Ñ€ÑƒĞ³ ÑƒĞ¶Ğµ Ğ¿Ñ–ÑˆĞ¾Ğ².\n   - [x] Ğ¯ Ğ¿Ñ€Ğ¸Ğ¹ÑˆĞ¾Ğ² Ğ´Ğ¾ Ñ€ĞµÑÑ‚Ğ¾Ñ€Ğ°Ğ½Ñƒ Ğ¾ ÑÑŒĞ¾Ğ¼Ñ–Ğ¹ Ğ³Ğ¾Ğ´Ğ¸Ğ½Ñ–, Ğ°Ğ»Ğµ Ğ¼Ñ–Ğ¹ Ğ´Ñ€ÑƒĞ³ ÑƒĞ¶Ğµ Ğ¿Ñ–ÑˆĞ¾Ğ².\n   - [ ] Ğ¯ Ğ¹ÑˆĞ¾Ğ² Ğ´Ğ¾ Ñ€ĞµÑÑ‚Ğ¾Ñ€Ğ°Ğ½Ñƒ Ğ¾ ÑÑŒĞ¾Ğ¼Ñ–Ğ¹ Ğ³Ğ¾Ğ´Ğ¸Ğ½Ñ–, Ğ°Ğ»Ğµ Ğ¼Ñ–Ğ¹ Ğ´Ñ€ÑƒĞ³ ÑƒĞ¶Ğµ Ğ¿Ñ–ÑˆĞ¾Ğ².\n   - [ ] Ğ¯ Ğ¿Ñ€Ğ¸Ñ…Ğ¾Ğ´Ğ¶Ñƒ Ğ´Ğ¾ Ñ€ĞµÑÑ‚Ğ¾Ñ€Ğ°Ğ½Ñƒ Ğ¾ ÑÑŒĞ¾Ğ¼Ñ–Ğ¹ Ğ³Ğ¾Ğ´Ğ¸Ğ½Ñ–, Ğ°Ğ»Ğµ Ğ¼Ñ–Ğ¹ Ğ´Ñ€ÑƒĞ³ ÑƒĞ¶Ğµ Ğ¿Ñ–ÑˆĞ¾Ğ².\n   > ĞĞ´Ğ½Ğ¾ĞºÑ€Ğ°Ñ‚Ğ½Ğ° Ğ·Ğ°Ğ²ĞµÑ€ÑˆĞµĞ½Ğ° Ğ´Ñ–Ñ: Â«Ğ¿Ñ€Ğ¸Ğ¹ÑˆĞ¾Ğ²Â».\n\n8. This is the student who received the best grade on the exam yesterday.\n   - [ ] Ğ¦Ğµ Ñ‚Ğ¾Ğ¹ ÑÑ‚ÑƒĞ´ĞµĞ½Ñ‚, Ñ…Ñ‚Ğ¾ Ğ¾Ñ‚Ñ€Ğ¸Ğ¼Ğ°Ğ² Ğ½Ğ°Ğ¹ĞºÑ€Ğ°Ñ‰Ñƒ Ğ¾Ñ†Ñ–Ğ½ĞºÑƒ Ğ½Ğ° Ñ–ÑĞ¿Ğ¸Ñ‚Ñ– Ğ²Ñ‡Ğ¾Ñ€Ğ°.\n   - [x] Ğ¦Ğµ Ñ‚Ğ¾Ğ¹ ÑÑ‚ÑƒĞ´ĞµĞ½Ñ‚, ÑĞºĞ¸Ğ¹ Ğ¾Ñ‚Ñ€Ğ¸Ğ¼Ğ°Ğ² Ğ½Ğ°Ğ¹ĞºÑ€Ğ°Ñ‰Ñƒ Ğ¾Ñ†Ñ–Ğ½ĞºÑƒ Ğ½Ğ° Ñ–ÑĞ¿Ğ¸Ñ‚Ñ– Ğ²Ñ‡Ğ¾Ñ€Ğ°.\n   - [ ] Ğ¦Ğµ Ñ‚Ğ¾Ğ¹ ÑÑ‚ÑƒĞ´ĞµĞ½Ñ‚, Ñ‰Ğ¾ Ğ²Ñ–Ğ½ Ğ¾Ñ‚Ñ€Ğ¸Ğ¼Ğ°Ğ² Ğ½Ğ°Ğ¹ĞºÑ€Ğ°Ñ‰Ñƒ Ğ¾Ñ†Ñ–Ğ½ĞºÑƒ Ğ½Ğ° Ñ–ÑĞ¿Ğ¸Ñ‚Ñ– Ğ²Ñ‡Ğ¾Ñ€Ğ°.\n   - [ ] Ğ¦Ğµ Ñ‚Ğ¾Ğ¹ ÑÑ‚ÑƒĞ´ĞµĞ½Ñ‚, ĞºĞ¾Ñ‚Ñ€Ğ° Ğ¾Ñ‚Ñ€Ğ¸Ğ¼Ğ°Ğ»Ğ° Ğ½Ğ°Ğ¹ĞºÑ€Ğ°Ñ‰Ñƒ Ğ¾Ñ†Ñ–Ğ½ĞºÑƒ Ğ½Ğ° Ñ–ÑĞ¿Ğ¸Ñ‚Ñ– Ğ²Ñ‡Ğ¾Ñ€Ğ°.\n   > Ğ’ Ğ¾Ğ·Ğ½Ğ°Ñ‡Ğ°Ğ»ÑŒĞ½Ğ¸Ñ… Ñ€ĞµÑ‡ĞµĞ½Ğ½ÑÑ…: Â«ÑĞºĞ¸Ğ¹Â», Ğ½Ğµ Â«Ñ…Ñ‚Ğ¾Â».\n\n9. Having finished the work, she went home to rest after a long day.\n   - [ ] Ğ—Ğ°ĞºÑ–Ğ½Ñ‡ÑƒÑÑ‡Ğ¸ Ñ€Ğ¾Ğ±Ğ¾Ñ‚Ñƒ, Ğ²Ğ¾Ğ½Ğ° Ğ¿Ñ–ÑˆĞ»Ğ° Ğ´Ğ¾Ğ´Ğ¾Ğ¼Ñƒ Ğ²Ñ–Ğ´Ğ¿Ğ¾Ñ‡Ğ¸Ğ²Ğ°Ñ‚Ğ¸.\n   - [x] Ğ—Ğ°ĞºÑ–Ğ½Ñ‡Ğ¸Ğ²ÑˆĞ¸ Ñ€Ğ¾Ğ±Ğ¾Ñ‚Ñƒ, Ğ²Ğ¾Ğ½Ğ° Ğ¿Ñ–ÑˆĞ»Ğ° Ğ´Ğ¾Ğ´Ğ¾Ğ¼Ñƒ Ğ²Ñ–Ğ´Ğ¿Ğ¾Ñ‡Ğ¸Ğ²Ğ°Ñ‚Ğ¸ Ğ¿Ñ–ÑĞ»Ñ Ğ´Ğ¾Ğ²Ğ³Ğ¾Ğ³Ğ¾ Ğ´Ğ½Ñ.\n   - [ ] Ğ—Ğ°ĞºÑ–Ğ½Ñ‡Ğ¸Ñ‚Ğ¸ Ñ€Ğ¾Ğ±Ğ¾Ñ‚Ñƒ, Ğ²Ğ¾Ğ½Ğ° Ğ¿Ñ–ÑˆĞ»Ğ° Ğ´Ğ¾Ğ´Ğ¾Ğ¼Ñƒ Ğ²Ñ–Ğ´Ğ¿Ğ¾Ñ‡Ğ¸Ğ²Ğ°Ñ‚Ğ¸.\n   - [ ] ĞšĞ¾Ğ»Ğ¸ Ğ·Ğ°ĞºÑ–Ğ½Ñ‡Ğ¸Ğ»Ğ° Ñ€Ğ¾Ğ±Ğ¾Ñ‚Ñƒ, Ğ²Ğ¾Ğ½Ğ° Ğ¿Ñ–ÑˆĞ»Ğ° Ğ´Ğ¾Ğ´Ğ¾Ğ¼Ñƒ Ğ²Ñ–Ğ´Ğ¿Ğ¾Ñ‡Ğ¸Ğ²Ğ°Ñ‚Ğ¸.\n   > ĞŸĞ¾Ğ¿ĞµÑ€ĞµĞ´Ğ½Ñ–ÑÑ‚ÑŒ: Ğ´Ğ¾ĞºĞ¾Ğ½Ğ°Ğ½Ğ¸Ğ¹ Ğ´Ñ–Ñ”Ğ¿Ñ€Ğ¸ÑĞ»Ñ–Ğ²Ğ½Ğ¸Ğº Â«Ğ·Ğ°ĞºÑ–Ğ½Ñ‡Ğ¸Ğ²ÑˆĞ¸Â».\n\n10. Before making a decision, you need to think carefully about the consequences.\n    - [ ] ĞšĞ¾Ğ»Ğ¸ Ğ¿Ñ€Ğ¸Ğ¹Ğ¼Ğ°Ñ”Ñ‚Ğµ Ñ€Ñ–ÑˆĞµĞ½Ğ½Ñ, Ğ¿Ğ¾Ñ‚Ñ€Ñ–Ğ±Ğ½Ğ¾ Ğ´Ğ¾Ğ±Ñ€Ğµ Ğ¿Ğ¾Ğ´ÑƒĞ¼Ğ°Ñ‚Ğ¸ Ğ¿Ñ€Ğ¾ Ğ½Ğ°ÑĞ»Ñ–Ğ´ĞºĞ¸.\n    - [ ] ĞŸÑ–ÑĞ»Ñ Ñ‚Ğ¾Ğ³Ğ¾ ÑĞº Ğ¿Ñ€Ğ¸Ğ¹Ğ½ÑĞ»Ğ¸ Ñ€Ñ–ÑˆĞµĞ½Ğ½Ñ, Ğ¿Ğ¾Ñ‚Ñ€Ñ–Ğ±Ğ½Ğ¾ Ğ¿Ğ¾Ğ´ÑƒĞ¼Ğ°Ñ‚Ğ¸ Ğ¿Ñ€Ğ¾ Ğ½Ğ°ÑĞ»Ñ–Ğ´ĞºĞ¸.\n    - [x] ĞŸĞµÑ€Ñˆ Ğ½Ñ–Ğ¶ Ğ¿Ñ€Ğ¸Ğ¹Ğ½ÑÑ‚Ğ¸ Ñ€Ñ–ÑˆĞµĞ½Ğ½Ñ, Ğ¿Ğ¾Ñ‚Ñ€Ñ–Ğ±Ğ½Ğ¾ Ğ´Ğ¾Ğ±Ñ€Ğµ Ğ¿Ğ¾Ğ´ÑƒĞ¼Ğ°Ñ‚Ğ¸ Ğ¿Ñ€Ğ¾ Ğ½Ğ°ÑĞ»Ñ–Ğ´ĞºĞ¸.\n    - [ ] ĞŸÑ€Ğ¸Ğ¹Ğ¼Ğ°ÑÑ‡Ğ¸ Ñ€Ñ–ÑˆĞµĞ½Ğ½Ñ, Ğ¿Ğ¾Ñ‚Ñ€Ñ–Ğ±Ğ½Ğ¾ Ğ´Ğ¾Ğ±Ñ€Ğµ Ğ¿Ğ¾Ğ´ÑƒĞ¼Ğ°Ñ‚Ğ¸ Ğ¿Ñ€Ğ¾ Ğ½Ğ°ÑĞ»Ñ–Ğ´ĞºĞ¸.\n    > ĞŸĞ¾Ğ¿ĞµÑ€ĞµĞ´Ğ½Ñ–ÑÑ‚ÑŒ: Â«ĞŸĞµÑ€Ñˆ Ğ½Ñ–Ğ¶Â» + Ñ–Ğ½Ñ„Ñ–Ğ½Ñ–Ñ‚Ğ¸Ğ².\n\n---\n\n## true-false: Ğ¡Ğ°Ğ¼Ğ¾Ğ¾Ñ†Ñ–Ğ½ĞºĞ° B1\n\n> Ğ’Ğ¸Ğ·Ğ½Ğ°Ñ‡Ñ‚Ğµ, Ñ‡Ğ¸ Ğ¿Ñ€Ğ°Ğ²Ğ¸Ğ»ÑŒĞ½Ñ– Ñ†Ñ– Ñ‚Ğ²ĞµÑ€Ğ´Ğ¶ĞµĞ½Ğ½Ñ Ğ¿Ñ€Ğ¾ Ğ²Ğ°ÑˆÑ– Ğ½Ğ°Ğ²Ğ¸Ñ‡ĞºĞ¸ Ğ½Ğ° Ñ€Ñ–Ğ²Ğ½Ñ– B1. Ğ’Ñ–Ğ´Ğ¿Ğ¾Ğ²Ñ–Ğ´Ğ°Ğ¹Ñ‚Ğµ Ñ‡ĞµÑĞ½Ğ¾!\n\n1. ĞĞ° Ñ€Ñ–Ğ²Ğ½Ñ– B1 Ğ²Ğ¸ Ğ¿Ğ¾Ğ²Ğ¸Ğ½Ğ½Ñ– Ğ²Ğ¼Ñ–Ñ‚Ğ¸ Ñ€Ğ¾Ğ·ÑƒĞ¼Ñ–Ñ‚Ğ¸ Ğ³Ğ¾Ğ»Ğ¾Ğ²Ğ½Ñ– Ğ´ÑƒĞ¼ĞºĞ¸ ÑÑ‚Ğ°Ğ½Ğ´Ğ°Ñ€Ñ‚Ğ½Ğ¸Ñ… Ñ‚ĞµĞºÑÑ‚Ñ–Ğ² Ğ½Ğ° Ğ·Ğ½Ğ°Ğ¹Ğ¾Ğ¼Ñ– Ñ‚ĞµĞ¼Ğ¸.\n   - [x] ĞŸÑ€Ğ°Ğ²Ğ´Ğ°\n   - [ ] ĞĞµĞ¿Ñ€Ğ°Ğ²Ğ´Ğ°\n   > Ğ¦Ğµ Ğ¾Ğ´Ğ½Ğ° Ğ· ĞºĞ»ÑÑ‡Ğ¾Ğ²Ğ¸Ñ… ĞºĞ¾Ğ¼Ğ¿ĞµÑ‚ĞµĞ½Ñ†Ñ–Ğ¹ Ñ€Ñ–Ğ²Ğ½Ñ B1 Ğ·Ğ° ÑˆĞºĞ°Ğ»Ğ¾Ñ CEFR.\n\n2. ĞĞ° Ñ€Ñ–Ğ²Ğ½Ñ– B1 Ğ²Ğ¸ Ğ¿Ğ¾Ğ²Ğ¸Ğ½Ğ½Ñ– Ğ²Ğ¼Ñ–Ñ‚Ğ¸ Ğ¿Ğ¸ÑĞ°Ñ‚Ğ¸ Ñ‚ĞµĞºÑÑ‚Ğ¸ Ğ½Ğ° Ğ±ÑƒĞ´ÑŒ-ÑĞºÑƒ Ñ‚ĞµĞ¼Ñƒ Ğ±ĞµĞ· ÑĞ»Ğ¾Ğ²Ğ½Ğ¸ĞºĞ°.\n   - [ ] ĞŸÑ€Ğ°Ğ²Ğ´Ğ°\n   - [x] ĞĞµĞ¿Ñ€Ğ°Ğ²Ğ´Ğ°\n   > B1 Ğ¿ĞµÑ€ĞµĞ´Ğ±Ğ°Ñ‡Ğ°Ñ” Ğ¿Ğ¸ÑÑŒĞ¼Ğ¾ Ğ½Ğ° Ğ·Ğ½Ğ°Ğ¹Ğ¾Ğ¼Ñ– Ñ‚ĞµĞ¼Ğ¸, Ğ°Ğ»Ğµ ÑĞºĞ»Ğ°Ğ´Ğ½Ñ– Ñ‚ĞµĞºÑÑ‚Ğ¸ Ğ¿Ğ¾Ñ‚Ñ€ĞµĞ±ÑƒÑÑ‚ÑŒ ÑĞ»Ğ¾Ğ²Ğ½Ğ¸ĞºĞ°.\n\n3. Ğ’Ğ¸Ğ´ Ğ´Ñ–Ñ”ÑĞ»Ğ¾Ğ²Ğ° (Ğ´Ğ¾ĞºĞ¾Ğ½Ğ°Ğ½Ğ¸Ğ¹/Ğ½ĞµĞ´Ğ¾ĞºĞ¾Ğ½Ğ°Ğ½Ğ¸Ğ¹) â€” Ñ†Ğµ ĞºĞ»ÑÑ‡Ğ¾Ğ²Ğ° Ğ³Ñ€Ğ°Ğ¼Ğ°Ñ‚Ğ¸Ñ‡Ğ½Ğ° ĞºĞ°Ñ‚ĞµĞ³Ğ¾Ñ€Ñ–Ñ Ñ€Ñ–Ğ²Ğ½Ñ B1.\n   - [x] ĞŸÑ€Ğ°Ğ²Ğ´Ğ°\n   - [ ] ĞĞµĞ¿Ñ€Ğ°Ğ²Ğ´Ğ°\n   > ĞÑĞ¿ĞµĞºÑ‚ (Ğ²Ğ¸Ğ´) â€” Ñ†ĞµĞ½Ñ‚Ñ€Ğ°Ğ»ÑŒĞ½Ğ° Ñ‚ĞµĞ¼Ğ° Ğ³Ñ€Ğ°Ğ¼Ğ°Ñ‚Ğ¸ĞºĞ¸ B1 (M06-M15).\n\n4. ĞĞ° Ñ€Ñ–Ğ²Ğ½Ñ– B1 Ğ²Ğ¸ Ğ¿Ğ¾Ğ²Ğ¸Ğ½Ğ½Ñ– Ğ·Ğ½Ğ°Ñ‚Ğ¸ Ğ²ÑÑ– Ğ´Ñ–Ñ”ÑĞ»Ğ¾Ğ²Ğ° Ñ€ÑƒÑ…Ñƒ Ğ· ÑƒÑÑ–Ğ¼Ğ° Ğ¿Ñ€ĞµÑ„Ñ–ĞºÑĞ°Ğ¼Ğ¸.\n   - [x] ĞŸÑ€Ğ°Ğ²Ğ´Ğ°\n   - [ ] ĞĞµĞ¿Ñ€Ğ°Ğ²Ğ´Ğ°\n   > Ğ”Ñ–Ñ”ÑĞ»Ğ¾Ğ²Ğ° Ñ€ÑƒÑ…Ñƒ Ğ· Ğ¿Ñ€ĞµÑ„Ñ–ĞºÑĞ°Ğ¼Ğ¸ â€” Ğ¾ÑĞ½Ğ¾Ğ²Ğ° Ñ„Ğ°Ğ·Ğ¸ B1.2 (M16-M25).\n\n5. Ğ Ñ–Ğ²ĞµĞ½ÑŒ B2 Ğ·Ğ¾ÑĞµÑ€ĞµĞ´Ğ¶ĞµĞ½Ğ¸Ğ¹ Ğ½Ğ° Ğ²Ğ¸Ğ²Ñ‡ĞµĞ½Ğ½Ñ– ĞºĞ¸Ñ€Ğ¸Ğ»Ğ¸Ñ†Ñ– Ñ‚Ğ° Ğ±Ğ°Ğ·Ğ¾Ğ²Ğ¸Ñ… Ñ„Ñ€Ğ°Ğ·.\n   - [ ] ĞŸÑ€Ğ°Ğ²Ğ´Ğ°\n   - [x] ĞĞµĞ¿Ñ€Ğ°Ğ²Ğ´Ğ°\n   > ĞšĞ¸Ñ€Ğ¸Ğ»Ğ¸Ñ†Ñ Ğ²Ğ¸Ğ²Ñ‡Ğ°Ñ”Ñ‚ÑŒÑÑ Ğ½Ğ° A1. B2 â€” Ñ†Ğµ Ğ»Ñ–Ñ‚ĞµÑ€Ğ°Ñ‚ÑƒÑ€Ğ° Ñ‚Ğ° Ğ°ĞºĞ°Ğ´ĞµĞ¼Ñ–Ñ‡Ğ½Ğ° Ğ¼Ğ¾Ğ²Ğ°.\n\n6. Ğ”Ñ–Ñ”Ğ¿Ñ€Ğ¸ÑĞ»Ñ–Ğ²Ğ½Ğ¸ĞºĞ¸ Ğ½Ğ° -ÑÑ‡Ğ¸ Ğ¾Ğ¿Ğ¸ÑÑƒÑÑ‚ÑŒ Ğ¾Ğ´Ğ½Ğ¾Ñ‡Ğ°ÑĞ½Ñ– Ğ´Ñ–Ñ—, Ğ° Ğ½Ğ° -Ğ²ÑˆĞ¸ â€” Ğ¿Ğ¾Ğ¿ĞµÑ€ĞµĞ´Ğ½Ñ–.\n   - [x] ĞŸÑ€Ğ°Ğ²Ğ´Ğ°\n   - [ ] ĞĞµĞ¿Ñ€Ğ°Ğ²Ğ´Ğ°\n   > Ğ¦Ğµ Ğ¿Ñ€Ğ°Ğ²Ğ¸Ğ»ÑŒĞ½Ğµ Ñ€Ğ¾Ğ·Ñ€Ñ–Ğ·Ğ½ĞµĞ½Ğ½Ñ Ğ½ĞµĞ´Ğ¾ĞºĞ¾Ğ½Ğ°Ğ½Ğ¸Ñ… (-ÑÑ‡Ğ¸) Ñ– Ğ´Ğ¾ĞºĞ¾Ğ½Ğ°Ğ½Ğ¸Ñ… (-Ğ²ÑˆĞ¸) Ğ´Ñ–Ñ”Ğ¿Ñ€Ğ¸ÑĞ»Ñ–Ğ²Ğ½Ğ¸ĞºÑ–Ğ².\n\n7. Ğ¡Ğ¿Ğ¾Ğ»ÑƒÑ‡Ğ½Ğ¸Ğº Â«Ñ…Ğ¾Ñ‡Ğ°Â» Ğ²Ğ¸ĞºĞ¾Ñ€Ğ¸ÑÑ‚Ğ¾Ğ²ÑƒÑ”Ñ‚ÑŒÑÑ Ğ´Ğ»Ñ Ğ²Ğ¸Ñ€Ğ°Ğ¶ĞµĞ½Ğ½Ñ Ğ¿Ñ€Ğ¸Ñ‡Ğ¸Ğ½Ğ¸ Ğ´Ñ–Ñ—.\n   - [ ] ĞŸÑ€Ğ°Ğ²Ğ´Ğ°\n   - [x] ĞĞµĞ¿Ñ€Ğ°Ğ²Ğ´Ğ°\n   > Â«Ğ¥Ğ¾Ñ‡Ğ°Â» â€” Ğ´Ğ¾Ğ¿ÑƒÑÑ‚Ğ¾Ğ²Ğ¸Ğ¹ ÑĞ¿Ğ¾Ğ»ÑƒÑ‡Ğ½Ğ¸Ğº, Ğ½Ğµ Ğ¿Ñ€Ğ¸Ñ‡Ğ¸Ğ½Ğ¸. Ğ”Ğ»Ñ Ğ¿Ñ€Ğ¸Ñ‡Ğ¸Ğ½Ğ¸: Â«Ñ‚Ğ¾Ğ¼Ñƒ Ñ‰Ğ¾Â».\n\n8. ĞĞ° Ñ€Ñ–Ğ²Ğ½Ñ– B1 Ğ²Ğ¸ Ğ¿Ğ¾Ğ²Ğ¸Ğ½Ğ½Ñ– Ğ²Ğ¼Ñ–Ñ‚Ğ¸ ÑĞ¿Ñ–Ğ»ĞºÑƒĞ²Ğ°Ñ‚Ğ¸ÑÑ Ğ² Ğ±Ñ–Ğ»ÑŒÑˆĞ¾ÑÑ‚Ñ– ÑĞ¸Ñ‚ÑƒĞ°Ñ†Ñ–Ğ¹ Ğ¿Ñ–Ğ´ Ñ‡Ğ°Ñ Ğ¿Ğ¾Ğ´Ğ¾Ñ€Ğ¾Ğ¶Ñ– Ğ£ĞºÑ€Ğ°Ñ—Ğ½Ğ¾Ñ.\n   - [x] ĞŸÑ€Ğ°Ğ²Ğ´Ğ°\n   - [ ] ĞĞµĞ¿Ñ€Ğ°Ğ²Ğ´Ğ°\n   > Ğ¦Ğµ ÑÑ‚Ğ°Ğ½Ğ´Ğ°Ñ€Ñ‚Ğ½Ğ¸Ğ¹ Ğ´ĞµÑĞºÑ€Ğ¸Ğ¿Ñ‚Ğ¾Ñ€ B1 Ğ·Ğ° CEFR.\n\n9. ĞŸĞ°ÑĞ¸Ğ²Ğ½Ğ¸Ğ¹ Ğ´Ñ–Ñ”Ğ¿Ñ€Ğ¸ĞºĞ¼ĞµÑ‚Ğ½Ğ¸Ğº Â«Ğ½Ğ°Ğ¿Ğ¸ÑĞ°Ğ½Ğ¸Ğ¹Â» Ğ²Ğ¶Ğ¸Ğ²Ğ°Ñ”Ñ‚ÑŒÑÑ Ğ· Ñ‡Ğ¾Ğ»Ğ¾Ğ²Ñ–Ñ‡Ğ¸Ğ¼ Ñ€Ğ¾Ğ´Ğ¾Ğ¼, Â«Ğ½Ğ°Ğ¿Ğ¸ÑĞ°Ğ½Ğ°Â» â€” Ğ· Ğ¶Ñ–Ğ½Ğ¾Ñ‡Ğ¸Ğ¼.\n   - [x] ĞŸÑ€Ğ°Ğ²Ğ´Ğ°\n   - [ ] ĞĞµĞ¿Ñ€Ğ°Ğ²Ğ´Ğ°\n   > Ğ”Ñ–Ñ”Ğ¿Ñ€Ğ¸ĞºĞ¼ĞµÑ‚Ğ½Ğ¸ĞºĞ¸ ÑƒĞ·Ğ³Ğ¾Ğ´Ğ¶ÑƒÑÑ‚ÑŒÑÑ Ğ· Ñ–Ğ¼ĞµĞ½Ğ½Ğ¸ĞºĞ¾Ğ¼ Ñƒ Ñ€Ğ¾Ğ´Ñ–, Ñ‡Ğ¸ÑĞ»Ñ– Ñ‚Ğ° Ğ²Ñ–Ğ´Ğ¼Ñ–Ğ½ĞºÑƒ.\n\n10. ĞĞ° Ñ€Ñ–Ğ²Ğ½Ñ– B1 Ğ²Ğ¸ Ğ¿Ğ¾Ğ²Ğ¸Ğ½Ğ½Ñ– Ğ·Ğ½Ğ°Ñ‚Ğ¸ Ğ±Ğ»Ğ¸Ğ·ÑŒĞºĞ¾ 3,500 ÑƒĞºÑ€Ğ°Ñ—Ğ½ÑÑŒĞºĞ¸Ñ… ÑĞ»Ñ–Ğ² (Ñ€Ğ°Ğ·Ğ¾Ğ¼ Ğ· A1 Ñ‚Ğ° A2).\n    - [x] ĞŸÑ€Ğ°Ğ²Ğ´Ğ°\n    - [ ] ĞĞµĞ¿Ñ€Ğ°Ğ²Ğ´Ğ°\n    > A1 (~750) + A2 (~1,050) + B1 (~1,800) = ~3,600 ÑĞ»Ñ–Ğ².\n\n---\n\n## dialogue-reorder: Ğ Ğ¾Ğ·Ğ¼Ğ¾Ğ²Ğ° Ğ¿Ñ€Ğ¾ Ñ€Ñ–Ğ²ĞµĞ½ÑŒ B1\n\n> Ğ Ğ¾Ğ·ÑÑ‚Ğ°Ğ²Ñ‚Ğµ Ñ€ĞµĞ¿Ğ»Ñ–ĞºĞ¸ Ğ´Ñ–Ğ°Ğ»Ğ¾Ğ³Ñƒ Ğ² Ğ¿Ñ€Ğ°Ğ²Ğ¸Ğ»ÑŒĞ½Ğ¾Ğ¼Ñƒ Ğ¿Ğ¾Ñ€ÑĞ´ĞºÑƒ.\n\n1. ĞŸÑ€Ğ¸Ğ²Ñ–Ñ‚, Ğ¢Ğ°Ñ€Ğ°ÑĞµ! Ğ¯ Ñ‡ÑƒĞ»Ğ°, Ñ‰Ğ¾ Ñ‚Ğ¸ Ğ·Ğ°ĞºÑ–Ğ½Ñ‡Ğ¸Ğ² Ñ€Ñ–Ğ²ĞµĞ½ÑŒ B1. Ğ’Ñ–Ñ‚Ğ°Ñ Ñ‚ĞµĞ±Ğµ!\n2. Ğ”ÑĞºÑƒÑ, ĞĞºÑĞ°Ğ½Ğ¾! Ğ¦Ğµ Ğ±ÑƒĞ² Ğ´Ğ¾Ğ²Ğ³Ğ¸Ğ¹ ÑˆĞ»ÑÑ…, Ğ°Ğ»Ğµ Ñ Ğ´ÑƒĞ¶Ğµ Ğ·Ğ°Ğ´Ğ¾Ğ²Ğ¾Ğ»ĞµĞ½Ğ¸Ğ¹ Ñ€ĞµĞ·ÑƒĞ»ÑŒÑ‚Ğ°Ñ‚Ğ°Ğ¼Ğ¸.\n3. Ğ©Ğ¾ Ğ±ÑƒĞ»Ğ¾ Ğ½Ğ°Ğ¹ÑĞºĞ»Ğ°Ğ´Ğ½Ñ–ÑˆĞ¸Ğ¼ Ğ´Ğ»Ñ Ñ‚ĞµĞ±Ğµ Ğ½Ğ° Ñ†ÑŒĞ¾Ğ¼Ñƒ Ñ€Ñ–Ğ²Ğ½Ñ–?\n4. ĞĞ°Ğ¹ÑĞºĞ»Ğ°Ğ´Ğ½Ñ–ÑˆĞ¸Ğ¼ Ğ±ÑƒĞ² Ğ²Ğ¸Ğ´ Ğ´Ñ–Ñ”ÑĞ»Ğ¾Ğ²Ğ°. ĞœĞµĞ½Ñ– Ğ¿Ğ¾Ñ‚Ñ€Ñ–Ğ±ĞµĞ½ Ğ±ÑƒĞ² Ñ‡Ğ°Ñ, Ñ‰Ğ¾Ğ± Ğ·Ñ€Ğ¾Ğ·ÑƒĞ¼Ñ–Ñ‚Ğ¸ Ñ€Ñ–Ğ·Ğ½Ğ¸Ñ†Ñ.\n5. Ğ¯ Ñ‚ĞµĞ±Ğµ Ñ€Ğ¾Ğ·ÑƒĞ¼Ñ–Ñ! Ğ Ğ´Ñ–Ñ”ÑĞ»Ğ¾Ğ²Ğ° Ñ€ÑƒÑ…Ñƒ? Ğ’Ğ¾Ğ½Ğ¸ Ñ‚Ğ°ĞºĞ¾Ğ¶ Ğ½ĞµĞ¿Ñ€Ğ¾ÑÑ‚Ñ– Ğ´Ğ»Ñ Ñ–Ğ½Ğ¾Ğ·ĞµĞ¼Ñ†Ñ–Ğ².\n6. Ğ¢Ğ°Ğº, Ğ´Ñ–Ñ”ÑĞ»Ğ¾Ğ²Ğ° Ñ€ÑƒÑ…Ñƒ Ğ· Ğ¿Ñ€ĞµÑ„Ñ–ĞºÑĞ°Ğ¼Ğ¸ â€” Ñ†Ğµ ÑĞ¿Ñ€Ğ°Ğ²Ğ¶Ğ½Ñ” Ğ²Ğ¸Ğ¿Ñ€Ğ¾Ğ±ÑƒĞ²Ğ°Ğ½Ğ½Ñ.\n7. Ğ¢Ğ¸ Ğ¿Ğ»Ğ°Ğ½ÑƒÑ”Ñˆ Ğ¿Ñ€Ğ¾Ğ´Ğ¾Ğ²Ğ¶ÑƒĞ²Ğ°Ñ‚Ğ¸ Ğ½Ğ°Ğ²Ñ‡Ğ°Ğ½Ğ½Ñ Ğ½Ğ° Ñ€Ñ–Ğ²Ğ½Ñ– B2?\n8. Ğ—Ğ²Ğ¸Ñ‡Ğ°Ğ¹Ğ½Ğ¾! Ğ¯ Ñ…Ğ¾Ñ‡Ñƒ, Ñ‰Ğ¾Ğ± Ğ¼Ñ–Ğ¹ Ñ€Ñ–Ğ²ĞµĞ½ÑŒ Ğ±ÑƒĞ² Ğ´Ğ¾ÑÑ‚Ğ°Ñ‚Ğ½Ñ–Ğ¼ Ğ´Ğ»Ñ Ñ€Ğ¾Ğ±Ğ¾Ñ‚Ğ¸ Ğ² Ğ£ĞºÑ€Ğ°Ñ—Ğ½Ñ–.\n\n---\n\n## mark-the-words: Ğ—Ğ½Ğ°Ğ¹Ğ´Ñ–Ñ‚ÑŒ Ğ´Ñ–Ñ”Ğ¿Ñ€Ğ¸ĞºĞ¼ĞµÑ‚Ğ½Ğ¸ĞºĞ¸\n\n> Ğ—Ğ½Ğ°Ğ¹Ğ´Ñ–Ñ‚ÑŒ Ñ– Ğ²Ğ¸Ğ´Ñ–Ğ»Ñ–Ñ‚ÑŒ ÑƒÑÑ– Ğ´Ñ–Ñ”Ğ¿Ñ€Ğ¸ĞºĞ¼ĞµÑ‚Ğ½Ğ¸ĞºĞ¸ Ñ‚Ğ° Ğ´Ñ–Ñ”Ğ¿Ñ€Ğ¸ÑĞ»Ñ–Ğ²Ğ½Ğ¸ĞºĞ¸ Ğ² Ñ‚ĞµĞºÑÑ‚Ñ–.\n\n> ĞšĞ½Ğ¸Ğ³Ğ°, *Ğ½Ğ°Ğ¿Ğ¸ÑĞ°Ğ½Ğ°* Ğ²Ñ–Ğ´Ğ¾Ğ¼Ğ¸Ğ¼ Ğ°Ğ²Ñ‚Ğ¾Ñ€Ğ¾Ğ¼, ÑÑ‚Ğ°Ğ»Ğ° Ğ±ĞµÑÑ‚ÑĞµĞ»ĞµÑ€Ğ¾Ğ¼. *Ğ§Ğ¸Ñ‚Ğ°ÑÑ‡Ğ¸* Ñ†Ñ ĞºĞ½Ğ¸Ğ³Ñƒ, Ñ *Ğ´Ñ–Ğ·Ğ½Ğ°Ğ²ÑÑ* Ğ±Ğ°Ğ³Ğ°Ñ‚Ğ¾ Ğ½Ğ¾Ğ²Ğ¾Ğ³Ğ¾ Ğ¿Ñ€Ğ¾ Ğ£ĞºÑ€Ğ°Ñ—Ğ½Ñƒ. *ĞŸÑ€Ğ¾Ñ‡Ğ¸Ñ‚Ğ°Ğ²ÑˆĞ¸* Ğ¾ÑÑ‚Ğ°Ğ½Ğ½Ñ ÑÑ‚Ğ¾Ñ€Ñ–Ğ½ĞºÑƒ, Ñ *Ğ·Ğ°ĞºÑ€Ğ¸Ğ²* ĞºĞ½Ğ¸Ğ³Ñƒ Ñ– *Ğ·Ğ°Ğ´ÑƒĞ¼Ğ°Ğ²ÑÑ*. Ğ¢ĞµĞºÑÑ‚, *Ğ¿ĞµÑ€ĞµĞºĞ»Ğ°Ğ´ĞµĞ½Ğ¸Ğ¹* ÑƒĞºÑ€Ğ°Ñ—Ğ½ÑÑŒĞºĞ¾Ñ Ğ¼Ğ¾Ğ²Ğ¾Ñ, Ğ±ÑƒĞ² Ğ´ÑƒĞ¶Ğµ Ñ†Ñ–ĞºĞ°Ğ²Ğ¸Ğ¼.\n\n---\n\n## select: ĞŸÑ€Ğ°Ğ²Ğ¸Ğ»ÑŒĞ½Ñ– Ğ²Ñ–Ğ´Ğ¿Ğ¾Ğ²Ñ–Ğ´Ñ– Ğ¿Ñ€Ğ¾ B1\n\n> ĞĞ±ĞµÑ€Ñ–Ñ‚ÑŒ ÑƒÑÑ– Ğ¿Ñ€Ğ°Ğ²Ğ¸Ğ»ÑŒĞ½Ñ– Ñ‚Ğ²ĞµÑ€Ğ´Ğ¶ĞµĞ½Ğ½Ñ Ğ¿Ñ€Ğ¾ Ñ€Ñ–Ğ²ĞµĞ½ÑŒ B1.\n\n1. Ğ¯ĞºÑ– Ğ³Ñ€Ğ°Ğ¼Ğ°Ñ‚Ğ¸Ñ‡Ğ½Ñ– Ñ‚ĞµĞ¼Ğ¸ Ñ” Ñ†ĞµĞ½Ñ‚Ñ€Ğ°Ğ»ÑŒĞ½Ğ¸Ğ¼Ğ¸ Ğ´Ğ»Ñ Ñ€Ñ–Ğ²Ğ½Ñ B1?\n   - [x] Ğ’Ğ¸Ğ´ Ğ´Ñ–Ñ”ÑĞ»Ğ¾Ğ²Ğ° (Ğ´Ğ¾ĞºĞ¾Ğ½Ğ°Ğ½Ğ¸Ğ¹/Ğ½ĞµĞ´Ğ¾ĞºĞ¾Ğ½Ğ°Ğ½Ğ¸Ğ¹)\n   - [x] Ğ”Ñ–Ñ”ÑĞ»Ğ¾Ğ²Ğ° Ñ€ÑƒÑ…Ñƒ Ğ· Ğ¿Ñ€ĞµÑ„Ñ–ĞºÑĞ°Ğ¼Ğ¸\n   - [x] Ğ¡ĞºĞ»Ğ°Ğ´Ğ½Ñ– Ñ€ĞµÑ‡ĞµĞ½Ğ½Ñ Ğ· Ñ€Ñ–Ğ·Ğ½Ğ¸Ğ¼Ğ¸ Ñ‚Ğ¸Ğ¿Ğ°Ğ¼Ğ¸ Ğ¿Ñ–Ğ´Ñ€ÑĞ´Ğ½Ğ¸Ñ…\n   - [ ] ĞšĞ¸Ñ€Ğ¸Ğ»Ğ¸Ñ†Ñ Ñ‚Ğ° Ñ„Ğ¾Ğ½ĞµÑ‚Ğ¸ĞºĞ°\n   - [x] Ğ”Ñ–Ñ”Ğ¿Ñ€Ğ¸ĞºĞ¼ĞµÑ‚Ğ½Ğ¸ĞºĞ¸ Ñ‚Ğ° Ğ¿Ğ°ÑĞ¸Ğ²Ğ½Ñ– ĞºĞ¾Ğ½ÑÑ‚Ñ€ÑƒĞºÑ†Ñ–Ñ—\n\n2. Ğ¯ĞºÑ– Ğ½Ğ°Ğ²Ğ¸Ñ‡ĞºĞ¸ Ğ¿Ğ¾Ğ²Ğ¸Ğ½ĞµĞ½ Ğ¼Ğ°Ñ‚Ğ¸ ÑƒÑ‡ĞµĞ½ÑŒ Ğ½Ğ° Ñ€Ñ–Ğ²Ğ½Ñ– B1?\n   - [x] Ğ Ğ¾Ğ·ÑƒĞ¼Ñ–Ñ‚Ğ¸ Ğ³Ğ¾Ğ»Ğ¾Ğ²Ğ½Ğ¸Ğ¹ Ğ·Ğ¼Ñ–ÑÑ‚ Ğ½Ğ¾Ğ²Ğ¸Ğ½ Ñ‚Ğ° Ğ¿Ğ¾Ğ´ĞºĞ°ÑÑ‚Ñ–Ğ²\n   - [x] ĞŸĞ¸ÑĞ°Ñ‚Ğ¸ ĞµÑĞµ Ğ½Ğ° Ğ·Ğ½Ğ°Ğ¹Ğ¾Ğ¼Ñ– Ñ‚ĞµĞ¼Ğ¸\n   - [ ] Ğ§Ğ¸Ñ‚Ğ°Ñ‚Ğ¸ ĞºĞ»Ğ°ÑĞ¸Ñ‡Ğ½Ñƒ Ğ»Ñ–Ñ‚ĞµÑ€Ğ°Ñ‚ÑƒÑ€Ñƒ Ğ±ĞµĞ· ÑĞ»Ğ¾Ğ²Ğ½Ğ¸ĞºĞ°\n   - [x] Ğ¡Ğ¿Ñ–Ğ»ĞºÑƒĞ²Ğ°Ñ‚Ğ¸ÑÑ Ğ¿Ñ–Ğ´ Ñ‡Ğ°Ñ Ğ¿Ğ¾Ğ´Ğ¾Ñ€Ğ¾Ğ¶Ñ–\n   - [ ] ĞŸĞµÑ€ĞµĞºĞ»Ğ°Ğ´Ğ°Ñ‚Ğ¸ ÑÑ€Ğ¸Ğ´Ğ¸Ñ‡Ğ½Ñ– Ğ´Ğ¾ĞºÑƒĞ¼ĞµĞ½Ñ‚Ğ¸\n\n3. Ğ¯ĞºÑ– ÑĞ¿Ğ¾Ğ»ÑƒÑ‡Ğ½Ğ¸ĞºĞ¸ Ğ²Ğ¸ĞºĞ¾Ñ€Ğ¸ÑÑ‚Ğ¾Ğ²ÑƒÑÑ‚ÑŒÑÑ Ğ´Ğ»Ñ Ğ´Ğ¾Ğ¿ÑƒÑÑ‚Ğ¾Ğ²Ğ¸Ñ… Ñ€ĞµÑ‡ĞµĞ½ÑŒ?\n   - [x] Ñ…Ğ¾Ñ‡Ğ°\n   - [x] Ğ½ĞµĞ·Ğ²Ğ°Ğ¶Ğ°ÑÑ‡Ğ¸ Ğ½Ğ° Ñ‚Ğµ Ñ‰Ğ¾\n   - [ ] Ñ‚Ğ¾Ğ¼Ñƒ Ñ‰Ğ¾\n   - [ ] ÑĞºÑ‰Ğ¾\n   - [x] Ğ¿Ğ¾Ğ¿Ñ€Ğ¸ Ñ‚Ğµ Ñ‰Ğ¾\n\n4. Ğ¯ĞºÑ– Ğ´Ñ–Ñ”Ğ¿Ñ€Ğ¸ÑĞ»Ñ–Ğ²Ğ½Ğ¸ĞºĞ¸ Ğ²Ğ¸Ñ€Ğ°Ğ¶Ğ°ÑÑ‚ÑŒ Ğ¿Ğ¾Ğ¿ĞµÑ€ĞµĞ´Ğ½Ñ Ğ´Ñ–Ñ?\n   - [x] Ğ¿Ñ€Ğ¾Ñ‡Ğ¸Ñ‚Ğ°Ğ²ÑˆĞ¸\n   - [ ] Ñ‡Ğ¸Ñ‚Ğ°ÑÑ‡Ğ¸\n   - [x] Ğ·Ğ°ĞºÑ–Ğ½Ñ‡Ğ¸Ğ²ÑˆĞ¸\n   - [ ] Ğ¿Ñ€Ğ°Ñ†ÑÑÑ‡Ğ¸\n   - [x] Ğ½Ğ°Ğ¿Ğ¸ÑĞ°Ğ²ÑˆĞ¸\n\n5. Ğ¯ĞºÑ– Ñ‚ĞµĞ¼Ğ¸ Ğ²Ñ…Ğ¾Ğ´ÑÑ‚ÑŒ Ğ´Ğ¾ ĞºÑƒĞ»ÑŒÑ‚ÑƒÑ€Ğ½Ğ¾Ğ³Ğ¾ Ğ±Ğ»Ğ¾ĞºÑƒ B1?\n   - [x] Ğ ĞµĞ³Ñ–Ğ¾Ğ½Ğ¸ Ğ£ĞºÑ€Ğ°Ñ—Ğ½Ğ¸\n   - [x] Ğ¡ÑƒÑ‡Ğ°ÑĞ½Ğ° Ğ¼ÑƒĞ·Ğ¸ĞºĞ° Ñ‚Ğ° ĞºÑ–Ğ½Ğ¾\n   - [ ] Ğ¡ĞµÑ€ĞµĞ´Ğ½ÑŒĞ¾Ğ²Ñ–Ñ‡Ğ½Ğ° Ñ–ÑÑ‚Ğ¾Ñ€Ñ–Ñ\n   - [x] Ğ£ĞºÑ€Ğ°Ñ—Ğ½ÑÑŒĞºĞ° ĞºÑƒÑ…Ğ½Ñ\n   - [ ] Ğ”Ğ°Ğ²Ğ½ÑŒĞ¾Ğ³Ñ€ĞµÑ†ÑŒĞºĞ° Ñ„Ñ–Ğ»Ğ¾ÑĞ¾Ñ„Ñ–Ñ\n\n6. Ğ¯ĞºÑ– Ñ‚Ğ¸Ğ¿Ğ¸ ÑĞºĞ»Ğ°Ğ´Ğ½Ğ¸Ñ… Ñ€ĞµÑ‡ĞµĞ½ÑŒ Ğ²Ğ¸Ğ²Ñ‡Ğ°ÑÑ‚ÑŒÑÑ Ğ½Ğ° B1?\n   - [x] ĞĞ·Ğ½Ğ°Ñ‡Ğ°Ğ»ÑŒĞ½Ñ– Ğ· ÑĞºĞ¸Ğ¹, ÑĞºĞ°, ÑĞºĞµ\n   - [x] ĞœĞµÑ‚Ğ¸ Ğ· Ñ‰Ğ¾Ğ±\n   - [x] Ğ£Ğ¼Ğ¾Ğ²Ğ½Ñ– Ñ€ĞµĞ°Ğ»ÑŒĞ½Ñ– Ñ‚Ğ° Ğ½ĞµÑ€ĞµĞ°Ğ»ÑŒĞ½Ñ–\n   - [x] ĞŸÑ€Ğ¸Ñ‡Ğ¸Ğ½Ğ¸ Ğ· Ñ‚Ğ¾Ğ¼Ñƒ Ñ‰Ğ¾\n   - [ ] ĞŸĞ¾Ñ€Ñ–Ğ²Ğ½ÑĞ»ÑŒĞ½Ñ– Ğ· Ğ½Ñ–Ğ±Ğ¸\n\n---\n\n# Ğ¡Ğ»Ğ¾Ğ²Ğ½Ğ¸Ğº\n\n| Ğ¡Ğ»Ğ¾Ğ²Ğ¾ | ĞŸĞµÑ€ĞµĞºĞ»Ğ°Ğ´ | ĞŸÑ€Ğ¸Ğ¼Ñ–Ñ‚ĞºĞ¸ |\n|-------|----------|----------|\n| Ğ°ĞºĞ°Ğ´ĞµĞ¼Ñ–Ñ‡Ğ½Ğ¸Ğ¹ | academic | Ñ€Ñ–Ğ²ĞµĞ½ÑŒ B2 |\n| Ğ¿Ğ¾Ğ³Ğ»Ğ¸Ğ±Ğ»ĞµĞ½Ğ¸Ğ¹ | in-depth | Ğ³Ğ»Ğ¸Ğ±ÑˆĞ¸Ğ¹ Ğ°Ğ½Ğ°Ğ»Ñ–Ğ· |\n| ÑƒĞ´Ğ¾ÑĞºĞ¾Ğ½Ğ°Ğ»ĞµĞ½Ğ½Ñ | improvement | Ğ¿Ñ€Ğ¾Ñ†ĞµÑ Ğ¿Ğ¾ĞºÑ€Ğ°Ñ‰ĞµĞ½Ğ½Ñ |\n| Ğ¿Ñ–Ğ´ÑÑƒĞ¼ĞºĞ¾Ğ²Ğ¸Ğ¹ | summary, final | Ğ·Ğ°Ğ²ĞµÑ€ÑˆĞ°Ğ»ÑŒĞ½Ğ¸Ğ¹ ĞµÑ‚Ğ°Ğ¿ |\n| ÑĞ°Ğ¼Ğ¾Ğ¾Ñ†Ñ–Ğ½ĞºĞ° | self-assessment | Ğ¾Ñ†Ñ–Ğ½ÑĞ²Ğ°Ğ½Ğ½Ñ ÑĞµĞ±Ğµ |\n| ĞºĞ¾Ğ¼Ğ¿Ğ»ĞµĞºÑĞ½Ğ¸Ğ¹ | comprehensive | Ğ²ÑĞµĞ¾Ñ…Ğ¾Ğ¿Ğ»ÑÑÑ‡Ğ¸Ğ¹ |\n| Ğ¿Ñ€Ğ¾Ğ´ĞµĞ¼Ğ¾Ğ½ÑÑ‚Ñ€ÑƒĞ²Ğ°Ñ‚Ğ¸ | to demonstrate | Ğ¿Ğ¾ĞºĞ°Ğ·Ğ°Ñ‚Ğ¸ Ğ½Ğ° Ğ¿Ñ€Ğ°ĞºÑ‚Ğ¸Ñ†Ñ– |\n| Ğ²Ğ¾Ğ»Ğ¾Ğ´Ñ–Ğ½Ğ½Ñ | command, mastery | Ñ€Ñ–Ğ²ĞµĞ½ÑŒ Ğ·Ğ½Ğ°Ğ½ÑŒ |\n| Ğ¿ĞµÑ€ÑĞ¿ĞµĞºÑ‚Ğ¸Ğ²Ğ½Ğ¸Ğ¹ | promising | Ğ¼Ğ°Ñ” Ğ¼Ğ°Ğ¹Ğ±ÑƒÑ‚Ğ½Ñ” |\n| Ğ½Ğ°Ğ¿Ğ¾Ğ»ĞµĞ³Ğ»Ğ¸Ğ²Ñ–ÑÑ‚ÑŒ | persistence | Ñ‚ĞµÑ€Ğ¿Ğ»ÑÑ‡Ñ–ÑÑ‚ÑŒ Ñƒ Ğ´Ğ¾ÑÑĞ³Ğ½ĞµĞ½Ğ½Ñ– Ğ¼ĞµÑ‚Ğ¸ |\n| ÑÑ‚Ñ–Ğ¹ĞºÑ–ÑÑ‚ÑŒ | resilience | Ğ·Ğ´Ğ°Ñ‚Ğ½Ñ–ÑÑ‚ÑŒ Ğ´Ğ¾Ğ»Ğ°Ñ‚Ğ¸ Ñ‚Ñ€ÑƒĞ´Ğ½Ğ¾Ñ‰Ñ– |\n| Ğ³Ğ°Ğ»ÑƒĞ·ÑŒ | industry, field | ÑÑ„ĞµÑ€Ğ° Ğ´Ñ–ÑĞ»ÑŒĞ½Ğ¾ÑÑ‚Ñ– |\n| Ñ€Ğ¾Ğ·Ñ€Ğ¾Ğ±Ğ½Ğ¸Ğº | developer | Ğ¿Ñ€Ğ¾Ğ³Ñ€Ğ°Ğ¼Ñ–ÑÑ‚ |\n| ÑÑ‚Ğ°Ñ€Ñ‚Ğ°Ğ¿ | startup | Ğ½Ğ¾Ğ²Ğ° ĞºĞ¾Ğ¼Ğ¿Ğ°Ğ½Ñ–Ñ |\n| Ğ²Ğ¸Ğ·Ğ½Ğ°Ğ½Ğ½Ñ | recognition | ÑˆĞ°Ğ½Ğ°, ÑĞ»Ğ°Ğ²Ğ° |\n| Ğ²Ğ¸ĞºĞ»Ğ¸Ğº | challenge | ÑĞºĞ»Ğ°Ğ´Ğ½Ğµ Ğ·Ğ°Ğ²Ğ´Ğ°Ğ½Ğ½Ñ |\n| Ğ°Ğ´Ğ°Ğ¿Ñ‚ÑƒĞ²Ğ°Ñ‚Ğ¸ÑÑ | to adapt | Ğ¿Ñ€Ğ¸ÑÑ‚Ğ¾ÑÑƒĞ²Ğ°Ñ‚Ğ¸ÑÑ |\n| Ğ¼Ğ°Ğ¹ÑÑ‚ĞµÑ€Ğ½Ñ–ÑÑ‚ÑŒ | mastery | Ğ²Ğ¸ÑĞ¾ĞºĞ¸Ğ¹ Ñ€Ñ–Ğ²ĞµĞ½ÑŒ Ğ²Ğ¼Ñ–Ğ½Ğ½Ñ |\n| Ñ‚ĞµÑ…Ğ½Ğ¾Ğ»Ğ¾Ğ³Ñ–Ñ‡Ğ½Ğ¸Ğ¹ | technological | Ğ¿Ğ¾Ğ²'ÑĞ·Ğ°Ğ½Ğ¸Ğ¹ Ğ· Ñ‚ĞµÑ…Ğ½Ğ¾Ğ»Ğ¾Ğ³Ñ–ÑĞ¼Ğ¸ |\n| ÑĞ¿ĞµÑ†Ñ–Ğ°Ğ»Ñ–ÑÑ‚ | specialist | Ñ„Ğ°Ñ…Ñ–Ğ²ĞµÑ†ÑŒ |\n| Ğ¿Ñ€Ğ¾Ğ³Ñ€Ğ°Ğ¼Ğ½Ğµ Ğ·Ğ°Ğ±ĞµĞ·Ğ¿ĞµÑ‡ĞµĞ½Ğ½Ñ | software | ĞºĞ¾Ğ¼Ğ¿'ÑÑ‚ĞµÑ€Ğ½Ñ– Ğ¿Ñ€Ğ¾Ğ³Ñ€Ğ°Ğ¼Ğ¸ |\n| ÑĞµĞºÑ‚Ğ¾Ñ€ | sector | Ñ‡Ğ°ÑÑ‚Ğ¸Ğ½Ğ° ĞµĞºĞ¾Ğ½Ğ¾Ğ¼Ñ–ĞºĞ¸ |\n| Ğ¿Ğ¾ĞºĞ¾Ğ»Ñ–Ğ½Ğ½Ñ | generation | Ğ»ÑĞ´Ğ¸ Ğ¾Ğ´Ğ½Ğ¾Ğ³Ğ¾ Ğ²Ñ–ĞºÑƒ |\n| Ğ¾Ğ±ÑÑ‚Ñ€Ñ–Ğ» | shelling | Ğ²Ğ¾Ñ”Ğ½Ğ½Ñ– Ğ´Ñ–Ñ— |\n| Ğ¿ĞµÑ€ĞµĞ¼Ğ¾Ğ³Ğ° | victory | Ğ²Ğ¸Ğ³Ñ€Ğ°Ñˆ |\n| ĞºĞ¾Ğ¼Ğ¿ĞµÑ‚ĞµĞ½Ñ†Ñ–Ñ | competency | Ğ·Ğ´Ğ°Ñ‚Ğ½Ñ–ÑÑ‚ÑŒ |\n| Ğ´ĞµÑĞºÑ€Ğ¸Ğ¿Ñ‚Ğ¾Ñ€ | descriptor | Ğ¾Ğ¿Ğ¸Ñ Ñ€Ñ–Ğ²Ğ½Ñ |\n| ÑˆĞºĞ°Ğ»Ğ° | scale | ÑĞ¸ÑÑ‚ĞµĞ¼Ğ° Ğ²Ğ¸Ğ¼Ñ–Ñ€ÑĞ²Ğ°Ğ½Ğ½Ñ |\n| ÑÑ‚Ñ€ÑƒĞºÑ‚ÑƒÑ€Ğ° | structure | Ğ±ÑƒĞ´Ğ¾Ğ²Ğ° |\n| ÑĞ¿Ğ¾Ğ»ÑƒÑ‡Ğ½Ğ¸Ğº | conjunction | Ğ³Ñ€Ğ°Ğ¼Ğ°Ñ‚Ğ¸Ñ‡Ğ½Ğ¸Ğ¹ Ñ‚ĞµÑ€Ğ¼Ñ–Ğ½ |\n| Ğ´Ñ–Ñ”Ğ¿Ñ€Ğ¸ĞºĞ¼ĞµÑ‚Ğ½Ğ¸Ğº | participle | Ğ³Ñ€Ğ°Ğ¼Ğ°Ñ‚Ğ¸Ñ‡Ğ½Ğ¸Ğ¹ Ñ‚ĞµÑ€Ğ¼Ñ–Ğ½ |\n| Ğ´Ñ–Ñ”Ğ¿Ñ€Ğ¸ÑĞ»Ñ–Ğ²Ğ½Ğ¸Ğº | adverbial participle | Ğ³Ñ€Ğ°Ğ¼Ğ°Ñ‚Ğ¸Ñ‡Ğ½Ğ¸Ğ¹ Ñ‚ĞµÑ€Ğ¼Ñ–Ğ½ |\n| Ğ¾Ğ·Ğ½Ğ°Ñ‡Ğ°Ğ»ÑŒĞ½Ğ¸Ğ¹ | relative | Ñ‚Ğ¸Ğ¿ Ğ¿Ñ–Ğ´Ñ€ÑĞ´Ğ½Ğ¾Ğ³Ğ¾ Ñ€ĞµÑ‡ĞµĞ½Ğ½Ñ |\n| Ğ´Ğ¾Ğ¿ÑƒÑÑ‚Ğ¾Ğ²Ğ¸Ğ¹ | concessive | Ñ‚Ğ¸Ğ¿ Ğ¿Ñ–Ğ´Ñ€ÑĞ´Ğ½Ğ¾Ğ³Ğ¾ Ñ€ĞµÑ‡ĞµĞ½Ğ½Ñ |\n| Ğ¿Ñ€Ğ¸Ñ‡Ğ¸Ğ½Ğ½Ğ¸Ğ¹ | causal | Ñ‚Ğ¸Ğ¿ Ğ¿Ñ–Ğ´Ñ€ÑĞ´Ğ½Ğ¾Ğ³Ğ¾ Ñ€ĞµÑ‡ĞµĞ½Ğ½Ñ |\n",
    "createdAt": "2025-12-28T23:24:52.788885Z",
    "modifiedAt": "2025-12-28T23:24:52.788885Z",
    "version": 2
  },
  "activities": [],
  "vocabulary": {
    "moduleId": "mod-uk-B1-86",
    "level": "B1",
    "phase": "B1.8",
    "wordCount": 35,
    "newWordCount": 35,
    "reviewWordCount": 0,
    "transliterationMode": "none",
    "words": [
      {
        "id": "vocab-1",
        "uk": "Ğ°ĞºĞ°Ğ´ĞµĞ¼Ñ–Ñ‡Ğ½Ğ¸Ğ¹",
        "ipa": "academic",
        "en": "Ñ€Ñ–Ğ²ĞµĞ½ÑŒ B2",
        "pos": "",
        "gender": null,
        "note": ""
      },
      {
        "id": "vocab-2",
        "uk": "Ğ¿Ğ¾Ğ³Ğ»Ğ¸Ğ±Ğ»ĞµĞ½Ğ¸Ğ¹",
        "ipa": "in-depth",
        "en": "Ğ³Ğ»Ğ¸Ğ±ÑˆĞ¸Ğ¹ Ğ°Ğ½Ğ°Ğ»Ñ–Ğ·",
        "pos": "",
        "gender": null,
        "note": ""
      },
      {
        "id": "vocab-3",
        "uk": "ÑƒĞ´Ğ¾ÑĞºĞ¾Ğ½Ğ°Ğ»ĞµĞ½Ğ½Ñ",
        "ipa": "improvement",
        "en": "Ğ¿Ñ€Ğ¾Ñ†ĞµÑ Ğ¿Ğ¾ĞºÑ€Ğ°Ñ‰ĞµĞ½Ğ½Ñ",
        "pos": "",
        "gender": null,
        "note": ""
      },
      {
        "id": "vocab-4",
        "uk": "Ğ¿Ñ–Ğ´ÑÑƒĞ¼ĞºĞ¾Ğ²Ğ¸Ğ¹",
        "ipa": "summary, final",
        "en": "Ğ·Ğ°Ğ²ĞµÑ€ÑˆĞ°Ğ»ÑŒĞ½Ğ¸Ğ¹ ĞµÑ‚Ğ°Ğ¿",
        "pos": "",
        "gender": null,
        "note": ""
      },
      {
        "id": "vocab-5",
        "uk": "ÑĞ°Ğ¼Ğ¾Ğ¾Ñ†Ñ–Ğ½ĞºĞ°",
        "ipa": "self-assessment",
        "en": "Ğ¾Ñ†Ñ–Ğ½ÑĞ²Ğ°Ğ½Ğ½Ñ ÑĞµĞ±Ğµ",
        "pos": "",
        "gender": null,
        "note": ""
      },
      {
        "id": "vocab-6",
        "uk": "ĞºĞ¾Ğ¼Ğ¿Ğ»ĞµĞºÑĞ½Ğ¸Ğ¹",
        "ipa": "comprehensive",
        "en": "Ğ²ÑĞµĞ¾Ñ…Ğ¾Ğ¿Ğ»ÑÑÑ‡Ğ¸Ğ¹",
        "pos": "",
        "gender": null,
        "note": ""
      },
      {
        "id": "vocab-7",
        "uk": "Ğ¿Ñ€Ğ¾Ğ´ĞµĞ¼Ğ¾Ğ½ÑÑ‚Ñ€ÑƒĞ²Ğ°Ñ‚Ğ¸",
        "ipa": "to demonstrate",
        "en": "Ğ¿Ğ¾ĞºĞ°Ğ·Ğ°Ñ‚Ğ¸ Ğ½Ğ° Ğ¿Ñ€Ğ°ĞºÑ‚Ğ¸Ñ†Ñ–",
        "pos": "",
        "gender": null,
        "note": ""
      },
      {
        "id": "vocab-8",
        "uk": "Ğ²Ğ¾Ğ»Ğ¾Ğ´Ñ–Ğ½Ğ½Ñ",
        "ipa": "command, mastery",
        "en": "Ñ€Ñ–Ğ²ĞµĞ½ÑŒ Ğ·Ğ½Ğ°Ğ½ÑŒ",
        "pos": "",
        "gender": null,
        "note": ""
      },
      {
        "id": "vocab-9",
        "uk": "Ğ¿ĞµÑ€ÑĞ¿ĞµĞºÑ‚Ğ¸Ğ²Ğ½Ğ¸Ğ¹",
        "ipa": "promising",
        "en": "Ğ¼Ğ°Ñ” Ğ¼Ğ°Ğ¹Ğ±ÑƒÑ‚Ğ½Ñ”",
        "pos": "",
        "gender": null,
        "note": ""
      },
      {
        "id": "vocab-10",
        "uk": "Ğ½Ğ°Ğ¿Ğ¾Ğ»ĞµĞ³Ğ»Ğ¸Ğ²Ñ–ÑÑ‚ÑŒ",
        "ipa": "persistence",
        "en": "Ñ‚ĞµÑ€Ğ¿Ğ»ÑÑ‡Ñ–ÑÑ‚ÑŒ Ñƒ Ğ´Ğ¾ÑÑĞ³Ğ½ĞµĞ½Ğ½Ñ– Ğ¼ĞµÑ‚Ğ¸",
        "pos": "",
        "gender": null,
        "note": ""
      },
      {
        "id": "vocab-11",
        "uk": "ÑÑ‚Ñ–Ğ¹ĞºÑ–ÑÑ‚ÑŒ",
        "ipa": "resilience",
        "en": "Ğ·Ğ´Ğ°Ñ‚Ğ½Ñ–ÑÑ‚ÑŒ Ğ´Ğ¾Ğ»Ğ°Ñ‚Ğ¸ Ñ‚Ñ€ÑƒĞ´Ğ½Ğ¾Ñ‰Ñ–",
        "pos": "",
        "gender": null,
        "note": ""
      },
      {
        "id": "vocab-12",
        "uk": "Ğ³Ğ°Ğ»ÑƒĞ·ÑŒ",
        "ipa": "industry, field",
        "en": "ÑÑ„ĞµÑ€Ğ° Ğ´Ñ–ÑĞ»ÑŒĞ½Ğ¾ÑÑ‚Ñ–",
        "pos": "",
        "gender": null,
        "note": ""
      },
      {
        "id": "vocab-13",
        "uk": "Ñ€Ğ¾Ğ·Ñ€Ğ¾Ğ±Ğ½Ğ¸Ğº",
        "ipa": "developer",
        "en": "Ğ¿Ñ€Ğ¾Ğ³Ñ€Ğ°Ğ¼Ñ–ÑÑ‚",
        "pos": "",
        "gender": null,
        "note": ""
      },
      {
        "id": "vocab-14",
        "uk": "ÑÑ‚Ğ°Ñ€Ñ‚Ğ°Ğ¿",
        "ipa": "startup",
        "en": "Ğ½Ğ¾Ğ²Ğ° ĞºĞ¾Ğ¼Ğ¿Ğ°Ğ½Ñ–Ñ",
        "pos": "",
        "gender": null,
        "note": ""
      },
      {
        "id": "vocab-15",
        "uk": "Ğ²Ğ¸Ğ·Ğ½Ğ°Ğ½Ğ½Ñ",
        "ipa": "recognition",
        "en": "ÑˆĞ°Ğ½Ğ°, ÑĞ»Ğ°Ğ²Ğ°",
        "pos": "",
        "gender": null,
        "note": ""
      },
      {
        "id": "vocab-16",
        "uk": "Ğ²Ğ¸ĞºĞ»Ğ¸Ğº",
        "ipa": "challenge",
        "en": "ÑĞºĞ»Ğ°Ğ´Ğ½Ğµ Ğ·Ğ°Ğ²Ğ´Ğ°Ğ½Ğ½Ñ",
        "pos": "",
        "gender": null,
        "note": ""
      },
      {
        "id": "vocab-17",
        "uk": "Ğ°Ğ´Ğ°Ğ¿Ñ‚ÑƒĞ²Ğ°Ñ‚Ğ¸ÑÑ",
        "ipa": "to adapt",
        "en": "Ğ¿Ñ€Ğ¸ÑÑ‚Ğ¾ÑÑƒĞ²Ğ°Ñ‚Ğ¸ÑÑ",
        "pos": "",
        "gender": null,
        "note": ""
      },
      {
        "id": "vocab-18",
        "uk": "Ğ¼Ğ°Ğ¹ÑÑ‚ĞµÑ€Ğ½Ñ–ÑÑ‚ÑŒ",
        "ipa": "mastery",
        "en": "Ğ²Ğ¸ÑĞ¾ĞºĞ¸Ğ¹ Ñ€Ñ–Ğ²ĞµĞ½ÑŒ Ğ²Ğ¼Ñ–Ğ½Ğ½Ñ",
        "pos": "",
        "gender": null,
        "note": ""
      },
      {
        "id": "vocab-19",
        "uk": "Ñ‚ĞµÑ…Ğ½Ğ¾Ğ»Ğ¾Ğ³Ñ–Ñ‡Ğ½Ğ¸Ğ¹",
        "ipa": "technological",
        "en": "Ğ¿Ğ¾Ğ²'ÑĞ·Ğ°Ğ½Ğ¸Ğ¹ Ğ· Ñ‚ĞµÑ…Ğ½Ğ¾Ğ»Ğ¾Ğ³Ñ–ÑĞ¼Ğ¸",
        "pos": "",
        "gender": null,
        "note": ""
      },
      {
        "id": "vocab-20",
        "uk": "ÑĞ¿ĞµÑ†Ñ–Ğ°Ğ»Ñ–ÑÑ‚",
        "ipa": "specialist",
        "en": "Ñ„Ğ°Ñ…Ñ–Ğ²ĞµÑ†ÑŒ",
        "pos": "",
        "gender": null,
        "note": ""
      },
      {
        "id": "vocab-21",
        "uk": "Ğ¿Ñ€Ğ¾Ğ³Ñ€Ğ°Ğ¼Ğ½Ğµ Ğ·Ğ°Ğ±ĞµĞ·Ğ¿ĞµÑ‡ĞµĞ½Ğ½Ñ",
        "ipa": "software",
        "en": "ĞºĞ¾Ğ¼Ğ¿'ÑÑ‚ĞµÑ€Ğ½Ñ– Ğ¿Ñ€Ğ¾Ğ³Ñ€Ğ°Ğ¼Ğ¸",
        "pos": "",
        "gender": null,
        "note": ""
      },
      {
        "id": "vocab-22",
        "uk": "ÑĞµĞºÑ‚Ğ¾Ñ€",
        "ipa": "sector",
        "en": "Ñ‡Ğ°ÑÑ‚Ğ¸Ğ½Ğ° ĞµĞºĞ¾Ğ½Ğ¾Ğ¼Ñ–ĞºĞ¸",
        "pos": "",
        "gender": null,
        "note": ""
      },
      {
        "id": "vocab-23",
        "uk": "Ğ¿Ğ¾ĞºĞ¾Ğ»Ñ–Ğ½Ğ½Ñ",
        "ipa": "generation",
        "en": "Ğ»ÑĞ´Ğ¸ Ğ¾Ğ´Ğ½Ğ¾Ğ³Ğ¾ Ğ²Ñ–ĞºÑƒ",
        "pos": "",
        "gender": null,
        "note": ""
      },
      {
        "id": "vocab-24",
        "uk": "Ğ¾Ğ±ÑÑ‚Ñ€Ñ–Ğ»",
        "ipa": "shelling",
        "en": "Ğ²Ğ¾Ñ”Ğ½Ğ½Ñ– Ğ´Ñ–Ñ—",
        "pos": "",
        "gender": null,
        "note": ""
      },
      {
        "id": "vocab-25",
        "uk": "Ğ¿ĞµÑ€ĞµĞ¼Ğ¾Ğ³Ğ°",
        "ipa": "victory",
        "en": "Ğ²Ğ¸Ğ³Ñ€Ğ°Ñˆ",
        "pos": "",
        "gender": null,
        "note": ""
      },
      {
        "id": "vocab-26",
        "uk": "ĞºĞ¾Ğ¼Ğ¿ĞµÑ‚ĞµĞ½Ñ†Ñ–Ñ",
        "ipa": "competency",
        "en": "Ğ·Ğ´Ğ°Ñ‚Ğ½Ñ–ÑÑ‚ÑŒ",
        "pos": "",
        "gender": null,
        "note": ""
      },
      {
        "id": "vocab-27",
        "uk": "Ğ´ĞµÑĞºÑ€Ğ¸Ğ¿Ñ‚Ğ¾Ñ€",
        "ipa": "descriptor",
        "en": "Ğ¾Ğ¿Ğ¸Ñ Ñ€Ñ–Ğ²Ğ½Ñ",
        "pos": "",
        "gender": null,
        "note": ""
      },
      {
        "id": "vocab-28",
        "uk": "ÑˆĞºĞ°Ğ»Ğ°",
        "ipa": "scale",
        "en": "ÑĞ¸ÑÑ‚ĞµĞ¼Ğ° Ğ²Ğ¸Ğ¼Ñ–Ñ€ÑĞ²Ğ°Ğ½Ğ½Ñ",
        "pos": "",
        "gender": null,
        "note": ""
      },
      {
        "id": "vocab-29",
        "uk": "ÑÑ‚Ñ€ÑƒĞºÑ‚ÑƒÑ€Ğ°",
        "ipa": "structure",
        "en": "Ğ±ÑƒĞ´Ğ¾Ğ²Ğ°",
        "pos": "",
        "gender": null,
        "note": ""
      },
      {
        "id": "vocab-30",
        "uk": "ÑĞ¿Ğ¾Ğ»ÑƒÑ‡Ğ½Ğ¸Ğº",
        "ipa": "conjunction",
        "en": "Ğ³Ñ€Ğ°Ğ¼Ğ°Ñ‚Ğ¸Ñ‡Ğ½Ğ¸Ğ¹ Ñ‚ĞµÑ€Ğ¼Ñ–Ğ½",
        "pos": "",
        "gender": null,
        "note": ""
      },
      {
        "id": "vocab-31",
        "uk": "Ğ´Ñ–Ñ”Ğ¿Ñ€Ğ¸ĞºĞ¼ĞµÑ‚Ğ½Ğ¸Ğº",
        "ipa": "participle",
        "en": "Ğ³Ñ€Ğ°Ğ¼Ğ°Ñ‚Ğ¸Ñ‡Ğ½Ğ¸Ğ¹ Ñ‚ĞµÑ€Ğ¼Ñ–Ğ½",
        "pos": "",
        "gender": null,
        "note": ""
      },
      {
        "id": "vocab-32",
        "uk": "Ğ´Ñ–Ñ”Ğ¿Ñ€Ğ¸ÑĞ»Ñ–Ğ²Ğ½Ğ¸Ğº",
        "ipa": "adverbial participle",
        "en": "Ğ³Ñ€Ğ°Ğ¼Ğ°Ñ‚Ğ¸Ñ‡Ğ½Ğ¸Ğ¹ Ñ‚ĞµÑ€Ğ¼Ñ–Ğ½",
        "pos": "",
        "gender": null,
        "note": ""
      },
      {
        "id": "vocab-33",
        "uk": "Ğ¾Ğ·Ğ½Ğ°Ñ‡Ğ°Ğ»ÑŒĞ½Ğ¸Ğ¹",
        "ipa": "relative",
        "en": "Ñ‚Ğ¸Ğ¿ Ğ¿Ñ–Ğ´Ñ€ÑĞ´Ğ½Ğ¾Ğ³Ğ¾ Ñ€ĞµÑ‡ĞµĞ½Ğ½Ñ",
        "pos": "",
        "gender": null,
        "note": ""
      },
      {
        "id": "vocab-34",
        "uk": "Ğ´Ğ¾Ğ¿ÑƒÑÑ‚Ğ¾Ğ²Ğ¸Ğ¹",
        "ipa": "concessive",
        "en": "Ñ‚Ğ¸Ğ¿ Ğ¿Ñ–Ğ´Ñ€ÑĞ´Ğ½Ğ¾Ğ³Ğ¾ Ñ€ĞµÑ‡ĞµĞ½Ğ½Ñ",
        "pos": "",
        "gender": null,
        "note": ""
      },
      {
        "id": "vocab-35",
        "uk": "Ğ¿Ñ€Ğ¸Ñ‡Ğ¸Ğ½Ğ½Ğ¸Ğ¹",
        "ipa": "causal",
        "en": "Ñ‚Ğ¸Ğ¿ Ğ¿Ñ–Ğ´Ñ€ÑĞ´Ğ½Ğ¾Ğ³Ğ¾ Ñ€ĞµÑ‡ĞµĞ½Ğ½Ñ",
        "pos": "",
        "gender": null,
        "note": ""
      }
    ],
    "reviewWords": []
  }
}