{
  "$schema": "../../../schemas/vibe-module.schema.json",
  "lesson": {
    "id": "lesson-uk-B1-82",
    "moduleId": "mod-uk-B1-82",
    "languagePair": "l2-uk-en",
    "subject": "language",
    "owner": "learn-ukrainian",
    "visibility": "public",
    "language": "uk",
    "targetLevel": "B1",
    "phase": "B1.1",
    "moduleNumber": 82,
    "moduleType": "grammar",
    "pedagogy": "PPP",
    "immersionLevel": 0.6,
    "title": "Module 82",
    "titleUk": null,
    "subtitle": null,
    "description": "Module 82",
    "objectives": [],
    "objectivesUk": null,
    "grammarFocus": [],
    "tags": [],
    "totalDuration": 45,
    "transliterationMode": "none",
    "sections": [
      {
        "id": "section-1",
        "name": "Гори та трейлраннінг",
        "nameEn": null,
        "type": "content",
        "content": "## Вступ\n\nВи коли-небудь відчували поклик гір? В Україні гори — це не просто географічний об'єкт, а місце сили, натхнення та активного відпочинку. Українські Карпати щороку приваблюють тисячі туристів, які шукають пригод, чистого повітря та незабутніх краєвидів. Раніше походи в гори вважалися заняттям для вузького кола ентузіастів із важкими рюкзаками. Сьогодні це масова культура, яка включає і комфортний хайкінг, і екстремальний трейлраннінг.\n\nУ цьому модулі ми вирушимо в подорож найвищими хребтами України. Ви дізнаєтесь про особливості карпатського рельєфу, популярні маршрути на Чорногірському хребті та унікальну природу полонин. Ми детально обговоримо сучасний тренд — трейлраннінг (біг пересіченою місцевістю), який стає все більш популярним серед української молоді. Ви навчитеся вибирати правильне спорядження для походу, розуміти систему маркування стежок та діяти відповідально для забезпечення власної безпеки в умовах дикої природи.\n\nМи розглянемо питання екології та роль гірських рятувальників. Ви вивчите лексику, необхідну для планування гірського треку, опису погоди та обговорення вражень від підйому на вершину. Готові змінити міський асфальт на кам'янисті стежки Карпат? Ваша пригода починається тут!\n\n> [!cultural] **Real World:**\n> Найвищою точкою України є гора **Говерла** (2061 м). Підйом на неї є своєрідним \"ритуалом\" для багатьох українців. У святкові дні, особливо на День Незалежності, на вершині можна побачити сотні людей із державними прапорами. Це символ національної єдності та незламності. Також популярним є маршрут на гору **Піп Іван**, де розташована стара обсерваторія. Гірські традиції Карпат тісно пов'язані з культурою гуцулів, їхньою музикою на **трембіті** та смачною кухнею.\n\n---\n\n## Презентація\n\n#### Passage 1: Магія Карпатських хребтів\n\nУкраїнські Карпати — це частина великої гірської системи, яка пролягає через декілька країн Європи. В Україні вони поділяються на масиви, кожен із яких має свій характер. Найвищим і найпопулярнішим є **Чорногірський хребет**. Саме тут розташовані всі шість українських \"двотисячників\" (гори вище 2000 метрів): **Говерла**, Бребенескул, **Піп Іван** Чорногірський, Петрос, Гутин Томнатик та Ребра.\n\nМаршрути Чорногорою вражають своєю різноманітністю. Ви можете йти густими смерековими лісами, де повітря пахне хвоєю та свіжістю, а потім вийти на відкриті простори — **полонини**. Полонини — це високогірні пасовища, де влітку випасають овець та корів. Тут можна зустріти справжніх гуцульських пастухів і спробувати автентичний сир — бринзу або вурду, виготовлений за старовинними рецептами на відкритому вогнищі. Видатний письменник **Іван Франко** часто відвідував ці місця, зокрема село Криворівня, яке називають \"гуцульськими Афінами\".\n\nКраєвид, який відкривається з вершин, часто порівнюють із морем: хвилі гірських хребтів зникають за горизонтом, створюючи неймовірну панораму. Проте Карпати можуть бути підступними. Погода тут змінюється миттєво: яскраве сонце за п'ять хвилин може затягнути густим туманом, а спокійний вітер перетворитися на потужну бурю з дощем. Тому кожен мандрівник повинен мати при собі карту, компас або сучасний GPS-навігатор та уважно стежити за **маркуванням** на деревах і каменях. Кольорові смужки допомагають не збитися зі стежки навіть у погану видимість.\n\n> [!tip] **Чи знали ви?**\n> На вершині гори Піп Іван Чорногірський розташована покинута польська обсерваторія \"Білий Слон\". Взимку будівля повністю покривається снігом і льодом, через що вона здається схожою на величезну білу тварину. Сьогодні там діє пост гірських рятувальників, які допомагають туристам у складних ситуаціях. Багато туристів починають свій маршрут із селища **Ворохта** або міста **Яремче**.\n\n**Comprehension Questions (3-4):**\n\n1. Які гори в Україні називають \"двотисячниками\"?\n2. Що таке полонини і чим вони особливі?\n3. Чому погода в Карпатах вважається підступною?\n4. Для чого потрібне маркування на гірських маршрутах?\n\n#### Passage 2: Трейлраннінг: Біг над хмарами\n\nЯкщо ви вважаєте, що біг по асфальту — це нудно, спробуйте **трейлраннінг**. Це біг природним рельєфом: стежками, лісами, камінням та річками. В Україні цей вид спорту переживає справжній злет. Кожного сезону в Карпатах проходять десятки змагань, які збирають сотні учасників не лише з України, а й з-за кордону.\n\nНайвідомішим забігом є **Chornohora Sky Race**. Учасники долають дистанцію Чорногірським хребтом, піднімаючись на головні вершини країни. Це неймовірне випробування на витривалість: ви біжите над хмарами, бачачи під ногами безкраї гори. Інший популярний захід — **Ultra-trail Chornohora**, де дистанції можуть сягати 100 кілометрів і більше. Такий біг потребує не лише сильних ніг, а й міцного духу. Також відомими є забіги в масиві **Горгани**, де траси проходять через складні кам'яні розсипи.\n\nДля трейлраннінгу потрібне спеціальне **взуття** — кросівки з агресивним протектором, які не ковзають на мокрому камінні чи болоті. Також бігуни використовують легкі рюкзаки з питною системою, щоб підтримувати водний баланс на дистанції. Основна філософія трейлраннінгу в Україні — це гармонія з природою. Організатори зазвичай дотримуються принципів \"Leave No Trace\" (не залишай слідів): заборонено смітити на трасі, а все маркування знімається одразу після фінішу останнього учасника. Це спорт для тих, хто любить швидкість і свободу, але поважає гори.\n\n> [!note] **Pop Culture Moment:**\n> Останніми роками в українських соціальних мережах (Instagram, TikTok) став популярним формат \"гірського лайфстайлу\". Тревел-блогери знімають короткі відео з вершин Карпат під етно-музику (наприклад, гуртів **Go_A** або **Onuka**), що стимулює молодь відмовлятися від пасивного відпочинку на користь гірських пригод. Багато відео використовують хештег #Карпати.\n\n**Comprehension Questions (3-4):**\n\n1. Що таке трейлраннінг і чим він відрізняється від звичайного бігу?\n2. Які дистанції можуть пропонувати на ультра-трейлах у Карпатах?\n3. Яке спеціальне спорядження необхідне для гірського бігу?\n4. Що означає принцип \"Leave No Trace\" у контексті змагань?\n\n#### Passage 3: Безпека та відповідальність мандрівника\n\nГори не прощають легковажності. Безпека — це головне правило будь-якого виходу на маршрут, чи то коротка прогулянка, чи багатоденний похід із наметами. Перший крок до безпеки — це правильна підготовка. Ви повинні мати якісне **спорядження**: міцне взуття, зручний рюкзак, теплий одяг (навіть влітку!), намет, який витримує вітер, та теплий спальник.\n\nОбов'язковою умовою є реєстрація в гірській рятувальній службі. Українські **рятувальники** працюють цілодобово і часто ризикують життям, щоб знайти туристів, які загубилися в тумані або потрапили під лавину взимку. Додаток \"Порятунок у горах\" дозволяє передати сигнал SOS із точними координатами вашого місця перебування. Також важливо знати базові правила поводження з вогнем: розпалювати **вогнище** можна тільки в спеціально відведених місцях, щоб не спровокувати лісову пожежу. Справжні **козаки** колись теж подорожували цими краями, але сьогодні ми маємо дбати про збереження лісів.\n\nПам'ятайте про диких тварин. У Карпатах можна зустріти ведмедя або дику свиню, тому не варто залишати залишки їжі біля намету. Повага до природи — це також повага до себе. Забирайте все своє сміття з собою в місто. Тільки за таких умов ми зможемо зберегти красу українських гір для майбутніх поколінь. Насолоджуйтеся моментом, коли ви стоїте на вершині, вітер б'є в обличчя, а весь світ здається маленьким і зрозумілим. Це і є справжній смак свободи. Подорож на **Дністер** або в **Крим** (після звільнення) — це також чудові варіанти для активних мандрівників.\n\n> [!important] **Fun Fact:**\n> У Карпатах розташований географічний центр Європи. Він знаходиться неподалік від села Ділове у Рахівському районі. Багато туристів роблять тут зупинку перед початком підйому на Мармароський масив, який називають \"Гуцульськими Альпами\" через стрімкі скелясті схили. Ця територія **Закарпаття** багата на мінеральні джерела та унікальну флору.\n\n---\n\n## Практика\n\nВи готові перевірити свої знання про гірський відпочинок? У розділі вправ ви знайдете завдання, які допоможуть вам засвоїти нову лексику та краще зрозуміти тексти. Ви будете тренуватися описувати маршрути, вибирати необхідне взуття та спорядження для походу, а також розрізняти різні типи гірського рельєфу. Зверніть увагу на дієслова руху, які часто вживаються в контексті підйомів та спусків.\n\nПрацюйте уважно, звертайте увагу на контекст і не забувайте повертатися до текстів презентації, якщо виникнуть сумніви. Успіхів!\n\n---\n\n## Продукція\n\n#### Діалог 1: Планування карпатського походу\n\n**Олександр:** Привіт, Андрію! Ти бачив прогноз погоди на наступні вихідні? Обіцяють сонце без дощів.\n**Андрій:** Привіт! Так, якраз думав про це. Може, гайнемо в Карпати? Хочу піднятися на Піп Іван Чорногірський.\n**Олександр:** О, це крута ідея! Але там маршрут непростий, треба готуватися. У тебе є гарна карта і компас?\n**Андрій:** Маю паперову карту і завантажив офлайн-карти в телефон. А як щодо твого спорядження? Твій старий намет ще тримає вітер?\n**Олександр:** Купив новий, полегшений. Також оновив спальник, тепер не замерзну навіть при нулі. Але мені ще треба купити якісне взуття, бо мої старі кросівки зовсім розвалилися.\n**Андрій:** Тоді заїдь у магазин завтра. Бери з міцною підошвою, бо на Чорногорі багато каміння. І не забудь зареєструвати наш похід у рятувальників. Безпека понад усе!\n**Олександр:** Звісно. Давай зустрінемось у п'ятницю ввечері на вокзалі. Це буде справжня пригода!\n\n#### Діалог 2: Розмова про перше змагання з трейлраннінгу\n\n**Марія:** Привіт, Катю! Бачила твоє фото з медаллю у Фейсбуці. Ти пробігла свій перший трейл у горах?\n**Катя:** Привіт! Так, це був Chornohora Sky Race. Дистанція всього 24 кілометри, але підйом був неймовірно важкий.\n**Марія:** Вау, я захоплююся твоєю витривалістю! Як природа? Краєвиди допомогли добігти до фінішу?\n**Катя:** О так! Коли вибігаєш на гребінь хребта і бачиш перед собою всю Чорногору, втомленість просто зникає. Це не порівняти з бігом у парку.\n**Марія:** А як почуваєшся зараз? Ноги дуже болять?\n**Катя:** Є трохи, але ейфорія від результату сильніша. Найважче було спускатися стежкою по камінню, коли був сильний вітер.\n**Марія:** Розумію. Наступного разу я теж хочу спробувати. Допоможеш мені вибрати рюкзак і правильне взуття?\n**Катя:** Із задоволенням! Головне — почати тренуватися на пагорбах уже зараз.\n\n#### Діалог 3: Випадок у дорозі\n\n**Турист:** Добрий день! Випадково не знаєте, чи далеко ще до полонини? Здається, ми трохи збилися з маршруту в тумані.\n**Місцевий житель:** Добрий день. Ви пропустили потрібний поворот кілометра два тому. Бачите там синє маркування на камені? Вам треба було триматися його.\n**Турист:** Ох, ми справді були неуважні через вітер. Дякуємо! А погода далі не погіршиться?\n**Місцевий житель:** Зараз обід, зазвичай після другої години в Карпатах починається дощ. Раджу вам швидше спускатися до лісу, там безпечніше.\n**Турист:** Дякуємо за пораду. Добре, що ми маємо дощовики в рюкзаках. Удачі вам!\n\n> [!cultural] **Real World:**\n> В Україні біговий туризм стає популярним не лише в Карпатах. Наприклад, трейли проводяться в **Голосіївському лісі** в **Києві**, на **острові Хортиця** в **Запоріжжі** та на берегах **Дністра**. Кожен такий забіг — це спосіб пізнати географію та історію України через власну витривалість.\n\n---"
      },
      {
        "id": "section-2",
        "name": "Підсумок",
        "nameEn": null,
        "type": "summary",
        "content": "У цьому модулі ми дослідили світ гірських пригод в Україні. Ви дізналися про велич Карпатських хребтів, традиції полонинського життя та сучасний спорт — трейлраннінг.\n\n**Ви навчилися:**\n\n- Описувати гірські маршрути та вершини, використовуючи специфічну лексику (підйом, спуск, хребет).\n- Розуміти важливість безпеки в горах (рятувальники, маркування, реєстрація).\n- Обговорювати необхідне спорядження для походів та змагань (намет, спальник, рюкзак, взуття).\n- Розповідати про свої спортивні цілі та досягнення в умовах дикої природи.\n\nГори вчать нас терпінню, повазі до природи та вмінню долати труднощі. Сподіваємося, що після цього уроку ви відчуєте впевненість для своєї наступної гірської мандрівки. Не забувайте карту, слухайте своє серце і завжди повертайтеся додому щасливими. До зустрічі на вершині!\n\n---"
      },
      {
        "id": "section-3",
        "name": "Словник",
        "nameEn": null,
        "type": "vocabulary",
        "content": "| Слово | Вимова | English | PoS | Примітки |\n|-------|--------|---------|-----|----------|\n| гора | [ɦoˈɾɑ] | mountain | noun (f) | загальна назва |\n| вершина | [weɾˈʃɪnɑ] | peak / summit | noun (f) | найвища точка гори |\n| похід | [poˈxid] | hike / trek | noun (m) | подорож пішки |\n| трейлраннінг | [tɾejlˈɾɑnʲːinɡ] | trail running | noun (m) | біг природним рельєфом |\n| маршрут | [mɑɾˈʃɾut] | route | noun (m) | шлях руху |\n| стежка | [sˈtɛʒkɑ] | path / trail | noun (f) | вузька дорога в лісі чи горах |\n| маркування | [mɑɾkʊˈwɑnʲːɑ] | marking | noun (n) | кольорові знаки на трасі |\n| намет | [nɑˈmɛt] | tent | noun (m) | мобільне житло туриста |\n| спальник | [sˈpɑlʲnɪk] | sleeping bag | noun (m) | спеціальний мішок для сну |\n| вогнище | [wˈɔɦnɪʃt͡ʃe] | campfire | noun (n) | купа дров, що горить |\n| підніматися | [pidnʲiˈmɑtɪsʲɑ] | to ascend | verb | йти вгору |\n| спускатися | [spʊsˈkɑtɪsʲɑ] | to descend | verb | йти вниз |\n| краєвид | [kɾɑjeˈwɪd] | view / landscape | noun (m) | панорама природи |\n| природа | [pɾɪˈɾɔdɑ] | nature | noun (f) | світ навколо нас |\n| погода | [poˈɦɔdɑ] | weather | noun (f) | стан атмосфери |\n| дощ | [dɔʃt͡ʃ] | rain | noun (m) | опади у вигляді крапель |\n| вітер | [wˈitɛɾ] | wind | noun (m) | рух повітря |\n| безпека | [bezˈpɛkɑ] | safety | noun (f) | стан захищеності |\n| рятувальник | [ɾʲɑtʊˈwɑlʲnɪk] | rescuer | noun (m) | професіонал, що допомагає людям |\n| карта | [kˈɑɾtɑ] | map | noun (f) | графічне зображення місцевості |\n| компас | [kˈɔmpɑs] | compass | noun (m) | прилад для орієнтування |\n| ліс | [lʲis] | forest | noun (m) | територія з деревами |\n| полонина | [poɫoˈnɪnɑ] | polonyna | noun (f) | високогірне пасовище |\n| Говерла | [ɦoˈwɛɾɫɑ] | Hoverla | proper noun | найвища гора України |\n| Карпати | [kɑɾˈpɑtɪ] | Carpathians | proper noun | гірська система |\n| рюкзак | [ɾʲʊkˈzɑk] | backpack | noun (m) | сумка на спині |\n| взуття | [wˈzutʲːɑ] | footwear | noun (n) | те, що вдягають на ноги |\n| спорядження | [spoˈɾʲɑd͡ʒenʲːɑ] | equipment | noun (n) | набір необхідних речей |\n| панорама | [pɑnoˈɾɑmɑ] | panorama | noun (f) | широкий вид місцевості |\n| пригода | [pɾɪˈɦɔdɑ] | adventure | noun (f) | незвичайна подія |\n\n---\n\n---"
      },
      {
        "id": "section-4",
        "name": "Вправи",
        "nameEn": null,
        "type": "activities",
        "content": "Перевірте свої знання за допомогою інтерактивних вправ у наступному розділі."
      }
    ],
    "rawMarkdown": "# Гори та трейлраннінг\n\n## Вступ\n\nВи коли-небудь відчували поклик гір? В Україні гори — це не просто географічний об'єкт, а місце сили, натхнення та активного відпочинку. Українські Карпати щороку приваблюють тисячі туристів, які шукають пригод, чистого повітря та незабутніх краєвидів. Раніше походи в гори вважалися заняттям для вузького кола ентузіастів із важкими рюкзаками. Сьогодні це масова культура, яка включає і комфортний хайкінг, і екстремальний трейлраннінг.\n\nУ цьому модулі ми вирушимо в подорож найвищими хребтами України. Ви дізнаєтесь про особливості карпатського рельєфу, популярні маршрути на Чорногірському хребті та унікальну природу полонин. Ми детально обговоримо сучасний тренд — трейлраннінг (біг пересіченою місцевістю), який стає все більш популярним серед української молоді. Ви навчитеся вибирати правильне спорядження для походу, розуміти систему маркування стежок та діяти відповідально для забезпечення власної безпеки в умовах дикої природи.\n\nМи розглянемо питання екології та роль гірських рятувальників. Ви вивчите лексику, необхідну для планування гірського треку, опису погоди та обговорення вражень від підйому на вершину. Готові змінити міський асфальт на кам'янисті стежки Карпат? Ваша пригода починається тут!\n\n> [!cultural] **Real World:**\n> Найвищою точкою України є гора **Говерла** (2061 м). Підйом на неї є своєрідним \"ритуалом\" для багатьох українців. У святкові дні, особливо на День Незалежності, на вершині можна побачити сотні людей із державними прапорами. Це символ національної єдності та незламності. Також популярним є маршрут на гору **Піп Іван**, де розташована стара обсерваторія. Гірські традиції Карпат тісно пов'язані з культурою гуцулів, їхньою музикою на **трембіті** та смачною кухнею.\n\n---\n\n## Презентація\n\n#### Passage 1: Магія Карпатських хребтів\n\nУкраїнські Карпати — це частина великої гірської системи, яка пролягає через декілька країн Європи. В Україні вони поділяються на масиви, кожен із яких має свій характер. Найвищим і найпопулярнішим є **Чорногірський хребет**. Саме тут розташовані всі шість українських \"двотисячників\" (гори вище 2000 метрів): **Говерла**, Бребенескул, **Піп Іван** Чорногірський, Петрос, Гутин Томнатик та Ребра.\n\nМаршрути Чорногорою вражають своєю різноманітністю. Ви можете йти густими смерековими лісами, де повітря пахне хвоєю та свіжістю, а потім вийти на відкриті простори — **полонини**. Полонини — це високогірні пасовища, де влітку випасають овець та корів. Тут можна зустріти справжніх гуцульських пастухів і спробувати автентичний сир — бринзу або вурду, виготовлений за старовинними рецептами на відкритому вогнищі. Видатний письменник **Іван Франко** часто відвідував ці місця, зокрема село Криворівня, яке називають \"гуцульськими Афінами\".\n\nКраєвид, який відкривається з вершин, часто порівнюють із морем: хвилі гірських хребтів зникають за горизонтом, створюючи неймовірну панораму. Проте Карпати можуть бути підступними. Погода тут змінюється миттєво: яскраве сонце за п'ять хвилин може затягнути густим туманом, а спокійний вітер перетворитися на потужну бурю з дощем. Тому кожен мандрівник повинен мати при собі карту, компас або сучасний GPS-навігатор та уважно стежити за **маркуванням** на деревах і каменях. Кольорові смужки допомагають не збитися зі стежки навіть у погану видимість.\n\n> [!tip] **Чи знали ви?**\n> На вершині гори Піп Іван Чорногірський розташована покинута польська обсерваторія \"Білий Слон\". Взимку будівля повністю покривається снігом і льодом, через що вона здається схожою на величезну білу тварину. Сьогодні там діє пост гірських рятувальників, які допомагають туристам у складних ситуаціях. Багато туристів починають свій маршрут із селища **Ворохта** або міста **Яремче**.\n\n**Comprehension Questions (3-4):**\n\n1. Які гори в Україні називають \"двотисячниками\"?\n2. Що таке полонини і чим вони особливі?\n3. Чому погода в Карпатах вважається підступною?\n4. Для чого потрібне маркування на гірських маршрутах?\n\n#### Passage 2: Трейлраннінг: Біг над хмарами\n\nЯкщо ви вважаєте, що біг по асфальту — це нудно, спробуйте **трейлраннінг**. Це біг природним рельєфом: стежками, лісами, камінням та річками. В Україні цей вид спорту переживає справжній злет. Кожного сезону в Карпатах проходять десятки змагань, які збирають сотні учасників не лише з України, а й з-за кордону.\n\nНайвідомішим забігом є **Chornohora Sky Race**. Учасники долають дистанцію Чорногірським хребтом, піднімаючись на головні вершини країни. Це неймовірне випробування на витривалість: ви біжите над хмарами, бачачи під ногами безкраї гори. Інший популярний захід — **Ultra-trail Chornohora**, де дистанції можуть сягати 100 кілометрів і більше. Такий біг потребує не лише сильних ніг, а й міцного духу. Також відомими є забіги в масиві **Горгани**, де траси проходять через складні кам'яні розсипи.\n\nДля трейлраннінгу потрібне спеціальне **взуття** — кросівки з агресивним протектором, які не ковзають на мокрому камінні чи болоті. Також бігуни використовують легкі рюкзаки з питною системою, щоб підтримувати водний баланс на дистанції. Основна філософія трейлраннінгу в Україні — це гармонія з природою. Організатори зазвичай дотримуються принципів \"Leave No Trace\" (не залишай слідів): заборонено смітити на трасі, а все маркування знімається одразу після фінішу останнього учасника. Це спорт для тих, хто любить швидкість і свободу, але поважає гори.\n\n> [!note] **Pop Culture Moment:**\n> Останніми роками в українських соціальних мережах (Instagram, TikTok) став популярним формат \"гірського лайфстайлу\". Тревел-блогери знімають короткі відео з вершин Карпат під етно-музику (наприклад, гуртів **Go_A** або **Onuka**), що стимулює молодь відмовлятися від пасивного відпочинку на користь гірських пригод. Багато відео використовують хештег #Карпати.\n\n**Comprehension Questions (3-4):**\n\n1. Що таке трейлраннінг і чим він відрізняється від звичайного бігу?\n2. Які дистанції можуть пропонувати на ультра-трейлах у Карпатах?\n3. Яке спеціальне спорядження необхідне для гірського бігу?\n4. Що означає принцип \"Leave No Trace\" у контексті змагань?\n\n#### Passage 3: Безпека та відповідальність мандрівника\n\nГори не прощають легковажності. Безпека — це головне правило будь-якого виходу на маршрут, чи то коротка прогулянка, чи багатоденний похід із наметами. Перший крок до безпеки — це правильна підготовка. Ви повинні мати якісне **спорядження**: міцне взуття, зручний рюкзак, теплий одяг (навіть влітку!), намет, який витримує вітер, та теплий спальник.\n\nОбов'язковою умовою є реєстрація в гірській рятувальній службі. Українські **рятувальники** працюють цілодобово і часто ризикують життям, щоб знайти туристів, які загубилися в тумані або потрапили під лавину взимку. Додаток \"Порятунок у горах\" дозволяє передати сигнал SOS із точними координатами вашого місця перебування. Також важливо знати базові правила поводження з вогнем: розпалювати **вогнище** можна тільки в спеціально відведених місцях, щоб не спровокувати лісову пожежу. Справжні **козаки** колись теж подорожували цими краями, але сьогодні ми маємо дбати про збереження лісів.\n\nПам'ятайте про диких тварин. У Карпатах можна зустріти ведмедя або дику свиню, тому не варто залишати залишки їжі біля намету. Повага до природи — це також повага до себе. Забирайте все своє сміття з собою в місто. Тільки за таких умов ми зможемо зберегти красу українських гір для майбутніх поколінь. Насолоджуйтеся моментом, коли ви стоїте на вершині, вітер б'є в обличчя, а весь світ здається маленьким і зрозумілим. Це і є справжній смак свободи. Подорож на **Дністер** або в **Крим** (після звільнення) — це також чудові варіанти для активних мандрівників.\n\n> [!important] **Fun Fact:**\n> У Карпатах розташований географічний центр Європи. Він знаходиться неподалік від села Ділове у Рахівському районі. Багато туристів роблять тут зупинку перед початком підйому на Мармароський масив, який називають \"Гуцульськими Альпами\" через стрімкі скелясті схили. Ця територія **Закарпаття** багата на мінеральні джерела та унікальну флору.\n\n---\n\n## Практика\n\nВи готові перевірити свої знання про гірський відпочинок? У розділі вправ ви знайдете завдання, які допоможуть вам засвоїти нову лексику та краще зрозуміти тексти. Ви будете тренуватися описувати маршрути, вибирати необхідне взуття та спорядження для походу, а також розрізняти різні типи гірського рельєфу. Зверніть увагу на дієслова руху, які часто вживаються в контексті підйомів та спусків.\n\nПрацюйте уважно, звертайте увагу на контекст і не забувайте повертатися до текстів презентації, якщо виникнуть сумніви. Успіхів!\n\n---\n\n## Продукція\n\n#### Діалог 1: Планування карпатського походу\n\n**Олександр:** Привіт, Андрію! Ти бачив прогноз погоди на наступні вихідні? Обіцяють сонце без дощів.\n**Андрій:** Привіт! Так, якраз думав про це. Може, гайнемо в Карпати? Хочу піднятися на Піп Іван Чорногірський.\n**Олександр:** О, це крута ідея! Але там маршрут непростий, треба готуватися. У тебе є гарна карта і компас?\n**Андрій:** Маю паперову карту і завантажив офлайн-карти в телефон. А як щодо твого спорядження? Твій старий намет ще тримає вітер?\n**Олександр:** Купив новий, полегшений. Також оновив спальник, тепер не замерзну навіть при нулі. Але мені ще треба купити якісне взуття, бо мої старі кросівки зовсім розвалилися.\n**Андрій:** Тоді заїдь у магазин завтра. Бери з міцною підошвою, бо на Чорногорі багато каміння. І не забудь зареєструвати наш похід у рятувальників. Безпека понад усе!\n**Олександр:** Звісно. Давай зустрінемось у п'ятницю ввечері на вокзалі. Це буде справжня пригода!\n\n#### Діалог 2: Розмова про перше змагання з трейлраннінгу\n\n**Марія:** Привіт, Катю! Бачила твоє фото з медаллю у Фейсбуці. Ти пробігла свій перший трейл у горах?\n**Катя:** Привіт! Так, це був Chornohora Sky Race. Дистанція всього 24 кілометри, але підйом був неймовірно важкий.\n**Марія:** Вау, я захоплююся твоєю витривалістю! Як природа? Краєвиди допомогли добігти до фінішу?\n**Катя:** О так! Коли вибігаєш на гребінь хребта і бачиш перед собою всю Чорногору, втомленість просто зникає. Це не порівняти з бігом у парку.\n**Марія:** А як почуваєшся зараз? Ноги дуже болять?\n**Катя:** Є трохи, але ейфорія від результату сильніша. Найважче було спускатися стежкою по камінню, коли був сильний вітер.\n**Марія:** Розумію. Наступного разу я теж хочу спробувати. Допоможеш мені вибрати рюкзак і правильне взуття?\n**Катя:** Із задоволенням! Головне — почати тренуватися на пагорбах уже зараз.\n\n#### Діалог 3: Випадок у дорозі\n\n**Турист:** Добрий день! Випадково не знаєте, чи далеко ще до полонини? Здається, ми трохи збилися з маршруту в тумані.\n**Місцевий житель:** Добрий день. Ви пропустили потрібний поворот кілометра два тому. Бачите там синє маркування на камені? Вам треба було триматися його.\n**Турист:** Ох, ми справді були неуважні через вітер. Дякуємо! А погода далі не погіршиться?\n**Місцевий житель:** Зараз обід, зазвичай після другої години в Карпатах починається дощ. Раджу вам швидше спускатися до лісу, там безпечніше.\n**Турист:** Дякуємо за пораду. Добре, що ми маємо дощовики в рюкзаках. Удачі вам!\n\n> [!cultural] **Real World:**\n> В Україні біговий туризм стає популярним не лише в Карпатах. Наприклад, трейли проводяться в **Голосіївському лісі** в **Києві**, на **острові Хортиця** в **Запоріжжі** та на берегах **Дністра**. Кожен такий забіг — це спосіб пізнати географію та історію України через власну витривалість.\n\n---\n\n# Підсумок\n\nУ цьому модулі ми дослідили світ гірських пригод в Україні. Ви дізналися про велич Карпатських хребтів, традиції полонинського життя та сучасний спорт — трейлраннінг.\n\n**Ви навчилися:**\n\n- Описувати гірські маршрути та вершини, використовуючи специфічну лексику (підйом, спуск, хребет).\n- Розуміти важливість безпеки в горах (рятувальники, маркування, реєстрація).\n- Обговорювати необхідне спорядження для походів та змагань (намет, спальник, рюкзак, взуття).\n- Розповідати про свої спортивні цілі та досягнення в умовах дикої природи.\n\nГори вчать нас терпінню, повазі до природи та вмінню долати труднощі. Сподіваємося, що після цього уроку ви відчуєте впевненість для своєї наступної гірської мандрівки. Не забувайте карту, слухайте своє серце і завжди повертайтеся додому щасливими. До зустрічі на вершині!\n\n---\n\n# Словник\n\n| Слово | Вимова | English | PoS | Примітки |\n|-------|--------|---------|-----|----------|\n| гора | [ɦoˈɾɑ] | mountain | noun (f) | загальна назва |\n| вершина | [weɾˈʃɪnɑ] | peak / summit | noun (f) | найвища точка гори |\n| похід | [poˈxid] | hike / trek | noun (m) | подорож пішки |\n| трейлраннінг | [tɾejlˈɾɑnʲːinɡ] | trail running | noun (m) | біг природним рельєфом |\n| маршрут | [mɑɾˈʃɾut] | route | noun (m) | шлях руху |\n| стежка | [sˈtɛʒkɑ] | path / trail | noun (f) | вузька дорога в лісі чи горах |\n| маркування | [mɑɾkʊˈwɑnʲːɑ] | marking | noun (n) | кольорові знаки на трасі |\n| намет | [nɑˈmɛt] | tent | noun (m) | мобільне житло туриста |\n| спальник | [sˈpɑlʲnɪk] | sleeping bag | noun (m) | спеціальний мішок для сну |\n| вогнище | [wˈɔɦnɪʃt͡ʃe] | campfire | noun (n) | купа дров, що горить |\n| підніматися | [pidnʲiˈmɑtɪsʲɑ] | to ascend | verb | йти вгору |\n| спускатися | [spʊsˈkɑtɪsʲɑ] | to descend | verb | йти вниз |\n| краєвид | [kɾɑjeˈwɪd] | view / landscape | noun (m) | панорама природи |\n| природа | [pɾɪˈɾɔdɑ] | nature | noun (f) | світ навколо нас |\n| погода | [poˈɦɔdɑ] | weather | noun (f) | стан атмосфери |\n| дощ | [dɔʃt͡ʃ] | rain | noun (m) | опади у вигляді крапель |\n| вітер | [wˈitɛɾ] | wind | noun (m) | рух повітря |\n| безпека | [bezˈpɛkɑ] | safety | noun (f) | стан захищеності |\n| рятувальник | [ɾʲɑtʊˈwɑlʲnɪk] | rescuer | noun (m) | професіонал, що допомагає людям |\n| карта | [kˈɑɾtɑ] | map | noun (f) | графічне зображення місцевості |\n| компас | [kˈɔmpɑs] | compass | noun (m) | прилад для орієнтування |\n| ліс | [lʲis] | forest | noun (m) | територія з деревами |\n| полонина | [poɫoˈnɪnɑ] | polonyna | noun (f) | високогірне пасовище |\n| Говерла | [ɦoˈwɛɾɫɑ] | Hoverla | proper noun | найвища гора України |\n| Карпати | [kɑɾˈpɑtɪ] | Carpathians | proper noun | гірська система |\n| рюкзак | [ɾʲʊkˈzɑk] | backpack | noun (m) | сумка на спині |\n| взуття | [wˈzutʲːɑ] | footwear | noun (n) | те, що вдягають на ноги |\n| спорядження | [spoˈɾʲɑd͡ʒenʲːɑ] | equipment | noun (n) | набір необхідних речей |\n| панорама | [pɑnoˈɾɑmɑ] | panorama | noun (f) | широкий вид місцевості |\n| пригода | [pɾɪˈɦɔdɑ] | adventure | noun (f) | незвичайна подія |\n\n---\n\n---\n\n# Вправи\n\nПеревірте свої знання за допомогою інтерактивних вправ у наступному розділі.\n",
    "createdAt": "2026-01-04T21:33:28.399074Z",
    "modifiedAt": "2026-01-04T21:33:28.399074Z",
    "version": 2
  },
  "activities": [],
  "vocabulary": {
    "moduleId": "mod-uk-B1-82",
    "level": "B1",
    "phase": "B1.1",
    "wordCount": 30,
    "newWordCount": 30,
    "reviewWordCount": 0,
    "transliterationMode": "none",
    "words": [
      {
        "id": "vocab-1",
        "uk": "гора",
        "ipa": "[ɦoˈɾɑ]",
        "en": "mountain",
        "pos": "noun (f)",
        "gender": null,
        "note": ""
      },
      {
        "id": "vocab-2",
        "uk": "вершина",
        "ipa": "[weɾˈʃɪnɑ]",
        "en": "peak / summit",
        "pos": "noun (f)",
        "gender": null,
        "note": ""
      },
      {
        "id": "vocab-3",
        "uk": "похід",
        "ipa": "[poˈxid]",
        "en": "hike / trek",
        "pos": "noun (m)",
        "gender": null,
        "note": ""
      },
      {
        "id": "vocab-4",
        "uk": "трейлраннінг",
        "ipa": "[tɾejlˈɾɑnʲːinɡ]",
        "en": "trail running",
        "pos": "noun (m)",
        "gender": null,
        "note": ""
      },
      {
        "id": "vocab-5",
        "uk": "маршрут",
        "ipa": "[mɑɾˈʃɾut]",
        "en": "route",
        "pos": "noun (m)",
        "gender": null,
        "note": ""
      },
      {
        "id": "vocab-6",
        "uk": "стежка",
        "ipa": "[sˈtɛʒkɑ]",
        "en": "path / trail",
        "pos": "noun (f)",
        "gender": null,
        "note": ""
      },
      {
        "id": "vocab-7",
        "uk": "маркування",
        "ipa": "[mɑɾkʊˈwɑnʲːɑ]",
        "en": "marking",
        "pos": "noun (n)",
        "gender": null,
        "note": ""
      },
      {
        "id": "vocab-8",
        "uk": "намет",
        "ipa": "[nɑˈmɛt]",
        "en": "tent",
        "pos": "noun (m)",
        "gender": null,
        "note": ""
      },
      {
        "id": "vocab-9",
        "uk": "спальник",
        "ipa": "[sˈpɑlʲnɪk]",
        "en": "sleeping bag",
        "pos": "noun (m)",
        "gender": null,
        "note": ""
      },
      {
        "id": "vocab-10",
        "uk": "вогнище",
        "ipa": "[wˈɔɦnɪʃt͡ʃe]",
        "en": "campfire",
        "pos": "noun (n)",
        "gender": null,
        "note": ""
      },
      {
        "id": "vocab-11",
        "uk": "підніматися",
        "ipa": "[pidnʲiˈmɑtɪsʲɑ]",
        "en": "to ascend",
        "pos": "verb",
        "gender": null,
        "note": ""
      },
      {
        "id": "vocab-12",
        "uk": "спускатися",
        "ipa": "[spʊsˈkɑtɪsʲɑ]",
        "en": "to descend",
        "pos": "verb",
        "gender": null,
        "note": ""
      },
      {
        "id": "vocab-13",
        "uk": "краєвид",
        "ipa": "[kɾɑjeˈwɪd]",
        "en": "view / landscape",
        "pos": "noun (m)",
        "gender": null,
        "note": ""
      },
      {
        "id": "vocab-14",
        "uk": "природа",
        "ipa": "[pɾɪˈɾɔdɑ]",
        "en": "nature",
        "pos": "noun (f)",
        "gender": null,
        "note": ""
      },
      {
        "id": "vocab-15",
        "uk": "погода",
        "ipa": "[poˈɦɔdɑ]",
        "en": "weather",
        "pos": "noun (f)",
        "gender": null,
        "note": ""
      },
      {
        "id": "vocab-16",
        "uk": "дощ",
        "ipa": "[dɔʃt͡ʃ]",
        "en": "rain",
        "pos": "noun (m)",
        "gender": null,
        "note": ""
      },
      {
        "id": "vocab-17",
        "uk": "вітер",
        "ipa": "[wˈitɛɾ]",
        "en": "wind",
        "pos": "noun (m)",
        "gender": null,
        "note": ""
      },
      {
        "id": "vocab-18",
        "uk": "безпека",
        "ipa": "[bezˈpɛkɑ]",
        "en": "safety",
        "pos": "noun (f)",
        "gender": null,
        "note": ""
      },
      {
        "id": "vocab-19",
        "uk": "рятувальник",
        "ipa": "[ɾʲɑtʊˈwɑlʲnɪk]",
        "en": "rescuer",
        "pos": "noun (m)",
        "gender": null,
        "note": ""
      },
      {
        "id": "vocab-20",
        "uk": "карта",
        "ipa": "[kˈɑɾtɑ]",
        "en": "map",
        "pos": "noun (f)",
        "gender": null,
        "note": ""
      },
      {
        "id": "vocab-21",
        "uk": "компас",
        "ipa": "[kˈɔmpɑs]",
        "en": "compass",
        "pos": "noun (m)",
        "gender": null,
        "note": ""
      },
      {
        "id": "vocab-22",
        "uk": "ліс",
        "ipa": "[lʲis]",
        "en": "forest",
        "pos": "noun (m)",
        "gender": null,
        "note": ""
      },
      {
        "id": "vocab-23",
        "uk": "полонина",
        "ipa": "[poɫoˈnɪnɑ]",
        "en": "polonyna",
        "pos": "noun (f)",
        "gender": null,
        "note": ""
      },
      {
        "id": "vocab-24",
        "uk": "Говерла",
        "ipa": "[ɦoˈwɛɾɫɑ]",
        "en": "Hoverla",
        "pos": "proper noun",
        "gender": null,
        "note": ""
      },
      {
        "id": "vocab-25",
        "uk": "Карпати",
        "ipa": "[kɑɾˈpɑtɪ]",
        "en": "Carpathians",
        "pos": "proper noun",
        "gender": null,
        "note": ""
      },
      {
        "id": "vocab-26",
        "uk": "рюкзак",
        "ipa": "[ɾʲʊkˈzɑk]",
        "en": "backpack",
        "pos": "noun (m)",
        "gender": null,
        "note": ""
      },
      {
        "id": "vocab-27",
        "uk": "взуття",
        "ipa": "[wˈzutʲːɑ]",
        "en": "footwear",
        "pos": "noun (n)",
        "gender": null,
        "note": ""
      },
      {
        "id": "vocab-28",
        "uk": "спорядження",
        "ipa": "[spoˈɾʲɑd͡ʒenʲːɑ]",
        "en": "equipment",
        "pos": "noun (n)",
        "gender": null,
        "note": ""
      },
      {
        "id": "vocab-29",
        "uk": "панорама",
        "ipa": "[pɑnoˈɾɑmɑ]",
        "en": "panorama",
        "pos": "noun (f)",
        "gender": null,
        "note": ""
      },
      {
        "id": "vocab-30",
        "uk": "пригода",
        "ipa": "[pɾɪˈɦɔdɑ]",
        "en": "adventure",
        "pos": "noun (f)",
        "gender": null,
        "note": ""
      }
    ],
    "reviewWords": []
  },
  "external_resources": {
    "podcasts": [],
    "youtube": [],
    "articles": [],
    "books": [],
    "websites": [
      {
        "title": "Карпатський біосферний заповідник",
        "url": "http://cbr.nature.org.ua/",
        "relevance": "high",
        "source": "Офіційний сайт заповідника."
      },
      {
        "title": "Клуб піших туристів",
        "url": "https://www.facebook.com/groups/trekking.ua/",
        "relevance": "high",
        "source": "Спільнота для обміну досвідом."
      },
      {
        "title": "Прогноз погоди в горах",
        "url": "https://www.snow-forecast.com/",
        "relevance": "high",
        "source": "Точні дані для безпеки."
      }
    ]
  }
}