{
  "$schema": "../../../schemas/vibe-module.schema.json",
  "lesson": {
    "id": "lesson-uk-B2-35",
    "moduleId": "mod-uk-B2-35",
    "languagePair": "l2-uk-en",
    "subject": "language",
    "owner": "curricula-opus",
    "visibility": "public",
    "language": "uk",
    "targetLevel": "B2",
    "phase": "B2.2",
    "moduleNumber": 35,
    "moduleType": "history",
    "immersionLevel": 0.85,
    "title": "History: Galicia-Volhynia",
    "subtitle": "Галицько-Волинське князівство",
    "description": "Вивчити історію Галицько-Волинського князівства",
    "objectives": [
      "Вивчити історію Галицько-Волинського князівства",
      "Зрозуміти спадкоємність Київської Русі",
      "Читати історичні тексти",
      "Розширити історичну лексику"
    ],
    "grammarFocus": [],
    "tags": [
      "history",
      "galicia-volhynia",
      "kingdom",
      "medieval"
    ],
    "totalDuration": 50,
    "transliterationMode": "none",
    "sections": [
      {
        "id": "section-зміст-уроку",
        "name": "Зміст уроку",
        "type": "content",
        "content": "## Вступ: Єдиний Король Русі\n\nРік 1253. Місто Дорогичин.\n\nМаленьке місто на кордоні Русі та Польщі переповнене людьми. Папський легат прибув із Риму. Європейські посли спостерігають. І ось — момент, якого ніколи не було раніше і ніколи не буде потім.\n\nДанило Романович, князь Галицький та Волинський, стає на коліна. Легат кладе йому на голову корону. І проголошує латиною:\n\n*«Rex Russiae.»*\n\nКороль Русі.\n\nНе «великий князь». Не «цар». *Король* — титул, який визнає вся християнська Європа. Данило став першим і єдиним правителем, який носив цей титул. Ні до нього, ні після — ніхто.\n\nЧому це важливо? Тому що коронація означала: Європа визнала Русь *королівством*. Не провінцією. Не «варварською землею». Повноправною європейською державою.\n\nІ ця держава — не Московія. Це Галицько-Волинське князівство. Західна Україна. Львів, Галич, Володимир-Волинський. *Наша* земля.\n\nСьогодні ми розповімо історію цього королівства — справжнього спадкоємця Київської Русі.\n\n---\n\n## Розминка: Перевірте свої знання\n\n| Питання | Ваша відповідь |\n|---------|----------------|\n| Що сталося з Києвом у 1240 році? | ___ |\n| Хто заснував Львів? | ___ |\n| Хто був єдиним «Королем Русі»? | ___ |\n| Що сталося з князівством у XIV столітті? | ___ |\n\n**Відповіді:** Монголи зруйнували Київ; Данило Галицький; Данило Галицький; захоплене Польщею та Литвою.\n\n---\n\n## Частина 1: Після падіння Києва — нова надія\n\n1240 рік. Монголи щойно зруйнували Київ. Здавалося — кінець. Русь загинула.\n\nАле ні.\n\nНа заході, далеко від монгольських орд, існувало князівство, яке не тільки вижило — воно процвітало. Галицько-Волинське князівство, створене за 40 років до монгольської навали, стало новим центром руської державності.\n\n### Чому захід вистояв?\n\nГеографія. Карпатські гори та болота Полісся — природні бар'єри. Монголи, чия сила була в кінній атаці на відкритому просторі, не могли ефективно діяти в горах і лісах.\n\nМонголи *пройшли* через Галичину — це правда. Але вони не залишилися. Вони не створили там постійної влади, як на сході. Галицько-Волинське князівство залишилося *незалежним*.\n\n### Роман Мстиславич — засновник\n\nГалицько-Волинське князівство об'єднав Роман Мстиславич у 1199 році — за 40 років до монгольської навали.\n\nХто він був? Нащадок Володимира Мономаха, праправнук Ярослава Мудрого. Справжній Рюрикович. Князь воїн, якого літописець порівнював із левом, риссю, орлом і крокодилом (!) одночасно:\n\n*«Він кинувся на поганих, як той лев, розлютився, як та рись, і нищив, як той крокодил. Він пройшов по їхній землі, як орел...»*\n\nРомана боялися. Романа поважали. Але Роман загинув молодим — у 1205 році, в бою з поляками. Йому було близько 50 років. Його синам Данилу та Васильку — чотири та два роки.\n\nІ тут почався хаос.\n\n---\n\n> **Чи знали ви?**\n>\n> Після смерті Романа маленького Данила та його матір Анну переслідували по всій Європі. Бояри, угорці, поляки — всі хотіли контролювати малолітнього князя.\n>\n> Анна возила синів то до Угорщини, то до Польщі, то до Галича. Літопис описує жахливу сцену: угорський король Андраш посадив маленького Данила на престол — але за ним стояли угорські солдати, а не галицькі бояри.\n>\n> Данило запам'ятав це приниження. Коли він виріс — він повернув *усе*.\n\n---\n\n## Частина 2: Данило Галицький — людина-легенда\n\nДанило Романович (бл. 1201-1264) — одна з найвидатніших постатей української історії. Людина, яка втратила все в дитинстві — і все повернула.\n\n### 33 роки боротьби\n\nУявіть: вам чотири роки. Ваш батько щойно загинув. Вас виганяють із власного князівства. Наступні 33 роки вашого життя — це боротьба за повернення.\n\nХронологія:\n- **1205**: Смерть Романа. Хаос.\n- **1211**: 10-річного Данила (!) вперше саджають на престол. І скидають.\n- **1215**: Угорці захоплюють Галич.\n- **1221**: Данило починає повертати володіння.\n- **1230-ті**: Поступове об'єднання.\n- **1238**: Данило повністю контролює Галичину та Волинь.\n\n33 роки. Від чотирирічного вигнанця до наймогутнішого правителя Русі.\n\n### Монгольський виклик\n\nА потім — 1240 рік. Монголи.\n\nДанило не міг їх зупинити — ніхто не міг. Він відступив до Угорщини та Польщі, поки орда проходила через його землі. Потім повернувся — і почав відбудовувати.\n\nАле була проблема. Монголи не забули про нього. Хан Батий вимагав покори. У 1246 році Данило був змушений їхати до ставки хана — в Золоту Орду.\n\nЦе була принизлива подорож. Руський князь мав пити кумис (кобиляче молоко), кланятися ідолам, виконувати монгольські ритуали. Літопис сумно констатує:\n\n*«О, гірше зла честь татарська! Данило Романович, князь великий, володар Руської землі, Києва та Волині, Галича... — стоїть на колінах і холопом зветься!»*\n\nДанило повернувся з Орди — але вирішив, що так тривати не може.\n\n---\n\n> **Міф vs Факт**\n>\n> ❌ **Міф:** «Данило підкорився монголам і став їхнім васалом, як московські князі.»\n>\n> ✅ **Факт:** Данило *формально* визнав монгольську владу — він не мав вибору. Але на відміну від московських князів, він *активно* шукав способи скинути цю залежність. Він будував фортеці, шукав європейських союзників, намагався організувати хрестовий похід проти монголів. Московські князі співпрацювали з Ордою століттями. Данило боровся.\n\n---\n\n## Частина 3: Коронація та європейський вибір\n\nДанило зрозумів: самотужки монголів не перемогти. Потрібні союзники. І він знайшов найпотужнішого — Папу Римського.\n\n### Угода з Римом\n\nУ XIII столітті Папа Римський — це не просто релігійний лідер. Це найвпливовіша постать Європи. Папа міг проголосити хрестовий похід. Папа міг примирити королів. Папа міг *легітимізувати* правителя.\n\nДанило запропонував угоду: він приймає унію з католицизмом (об'єднання церков), а Папа допомагає проти монголів.\n\n### Коронація 1253 року\n\nПапа Інокентій IV погодився. У 1253 році в місті Дорогичин відбулася історична подія — Данила короновано як *Rex Russiae*, Короля Русі.\n\nЩо це означало?\n- **Міжнародне визнання**: Данило — не просто князь, а *король*, рівний європейським монархам\n- **Релігійна унія**: (теоретично) об'єднання з Римом\n- **Антимонгольський альянс**: (теоретично) європейська допомога\n\n### Чому «теоретично»?\n\nРеальність виявилася гіршою. Європейські монархи не поспішали на допомогу. Хрестовий похід так і не відбувся. Данило залишився сам проти монгольської загрози.\n\nА потім — ультиматум. Хан Бурундай у 1259 році вимагав, щоб Данило *зруйнував* власні фортеці. Як доказ лояльності.\n\nДанило був змушений підкоритися. Фортеці, які він будував роками, — розібрані. Надії на європейську допомогу — розбиті.\n\nАле коронація залишилася. Історичний прецедент: Русь — це *королівство*.\n\n---\n\n> **Чи знали ви?**\n>\n> Данило став Королем Русі, але він *не* змінив віру. Унія з Римом залишилася на папері — Данило не став католиком і не примушував своїх підданих. Він був прагматиком: коронація була потрібна для політичної легітимності, а не для релігійної революції.\n>\n> Цікаво, що Папа знав про це — і все одно короновував. Для Риму важливіше було мати *будь-якого* союзника на сході, ніж наполягати на негайному зверненні.\n\n---\n\n## Частина 4: Львів — місто короля\n\nСеред усіх досягнень Данила є одне, яке ми бачимо щодня: Львів.\n\n### Заснування\n\nДанило заснував Львів близько 1256 року (точна дата невідома) і назвав на честь свого сина Лева. Спочатку це була фортеця на горі (сучасний Високий Замок), пізніше — велике торгове місто.\n\nЧому саме там? Стратегічне розташування. Львів стояв на перехресті торгових шляхів — із Заходу на Схід, з Півночі на Південь. Через нього йшли каравани з Німеччини до Криму, з Польщі до Візантії.\n\n### Від фортеці до столиці\n\nПісля смерті Данила його син Лев (1264-1301) зробив Львів фактичною столицею. Місто росло, багатіло, залучало купців та ремісників з усієї Європи.\n\nДо XIV століття Львів став одним із найбільших міст Центральної Європи. Вірмени, євреї, німці, поляки, українці — всі жили разом, торгували, створювали унікальну культуру.\n\n---\n\n> **Чи знали ви?**\n>\n> Назва «Львів» — від імені *Лев*. Але чому княжого сина назвали Левом?\n>\n> Є теорія: Данило дав синові це ім'я на честь Папи Лева IX — як знак дружби з Римом. Інша теорія: лев був символом хоробрості та влади у середньовічній геральдиці.\n>\n> Так чи інакше, лев став символом міста. Він на гербі Львова досі. Лев, якого заснував *інший* Лев.\n\n---\n\n## Частина 5: Занепад — як усе закінчилося\n\nПісля смерті Данила в 1264 році князівство ще проіснувало майже 80 років. Але поступово слабшало.\n\n### Останні правителі\n\n| Правитель | Роки | Що сталося |\n|-----------|------|------------|\n| Лев I | 1264-1301 | Переніс столицю до Львова |\n| Юрій I | 1301-1308 | Підтримував православ'я |\n| Андрій та Лев II | 1308-1323 | Загинули в бою (обидва!) |\n| Юрій II Болеслав | 1323-1340 | Отруєний боярами |\n\nЗверніть увагу: Андрій та Лев II загинули *разом*, без спадкоємців. Юрія II *отруїли*. Династія Романовичів вимерла не природно — її знищили.\n\n### 1340-1349: Кінець\n\nПісля смерті Юрія II почалася боротьба за спадщину. Поляки та литовці вторглися в князівство.\n\n- **1340**: Польський король Казимир III захоплює Львів\n- **1349**: Остаточне польське завоювання Галичини\n- **1340-1392**: Волинь переходить під Литву\n\nГалицько-Волинське князівство припинило існування. Але *не* українська державність — вона продовжилася в інших формах.\n\n---\n\n> **Міф vs Факт**\n>\n> ❌ **Міф:** «Після 1340 року українці втратили державність і стали \"безправною масою\".»\n>\n> ✅ **Факт:** Українські (руські) землі *зберегли* значну автономію. У Великому князівстві Литовському руська мова була *офіційною*. Руська шляхта зберегла свої права. Православна церква продовжувала діяти. Так, незалежної держави не було — але говорити про повну «втрату» неправильно. Українська ідентичність продовжувала існувати.\n\n---\n\n## Чому це важливо: Деколонізаційний контекст\n\nГалицько-Волинське князівство руйнує кілька російських міфів:\n\n### Міф 1: «Після монголів Русь переїхала в Москву»\n\n**Правда:** Справжнім спадкоємцем Київської Русі було Галицько-Волинське князівство, а не Московія. Московія була периферією, улусом Золотої Орди. Галичина була *королівством*, визнаним Європою.\n\n### Міф 2: «Українці — пасивний народ без державності»\n\n**Правда:** Данило Галицький — приклад активної боротьби. 33 роки повертав владу. Шукав союзників по всій Європі. Будував фортеці. Це не «пасивність» — це *resilience*.\n\n### Міф 3: «Львів — польське місто»\n\n**Правда:** Львів заснований українським (руським) князем як столиця українського (руського) королівства. Поляки захопили його пізніше — але це не робить його «споконвічно польським».\n\n---\n\n## Практика\n\n### Завдання 1: Хронологія\n\nРозставте в правильному порядку:\n\n1. Коронація Данила\n2. Об'єднання Галичини та Волині\n3. Заснування Львова\n4. Польське завоювання\n5. Монгольська навала\n\n**Відповідь:** 2 (1199) → 5 (1240) → 1 (1253) → 3 (бл. 1256) → 4 (1340-1349)\n\n### Завдання 2: Заповніть пропуски\n\n1. Галицько-Волинське князівство об'єднав ___.\n   > [!answer] **Роман Мстиславич**\n2. Данило Галицький був коронований у ___ році.\n   > [!answer] **1253**\n3. Титул Данила латиною — ___.\n   > [!answer] **Rex Russiae**\n4. Львів названо на честь сина Данила — ___.\n   > [!answer] **Лева**\n5. У 1349 році Галичину захопила ___.\n   > [!answer] **Польща**\n### Завдання 3: Перекладіть\n\n1. Danylo was crowned King of Rus by the Pope.\n   > [!answer] **Данила короновано Папою Римським як Короля Русі.**\n2. He founded Lviv in honor of his son Lev.\n   > [!answer] **Він заснував Львів на честь свого сина Лева.**\n3. The kingdom was the true successor of Kyivan Rus.\n   > [!answer] **Королівство було справжнім спадкоємцем Київської Русі.**\n---\n\n## Продукція\n\n### Обговоріть\n\n1. Чому Данило шукав союзу з Папою, а не з монголами (як московські князі)?\n\n2. Яке значення мала коронація для української ідентичності?\n\n3. Як би змінилася історія, якби Галицько-Волинське королівство отримало європейську допомогу проти монголів?\n\n### Напишіть (150-200 слів)\n\nУявіть, що ви — літописець при дворі Данила. Опишіть день коронації 1253 року: що ви бачите, чуєте, відчуваєте.\n\n---\n\n\n---\n\n\n---\n\n\n---"
      },
      {
        "id": "section-summary",
        "name": "Підсумок",
        "nameEn": "Summary",
        "type": "summary",
        "content": "## Хронологія\n\n| Рік | Подія |\n|-----|-------|\n| 1199 | Роман об'єднує Галичину та Волинь |\n| 1205 | Смерть Романа, хаос |\n| 1238 | Данило відновлює контроль |\n| 1253 | Коронація — Rex Russiae |\n| бл. 1256 | Заснування Львова |\n| 1264 | Смерть Данила |\n| 1340-1349 | Польське та литовське завоювання |\n\n## Ключові постаті\n\n| Правитель | Досягнення |\n|-----------|------------|\n| Роман Мстиславич | Об'єднання (1199) |\n| Данило Галицький | Коронація, Львів, європейська орієнтація |\n| Лев I | Розвиток Львова |\n\n---\n\n> **Чому це важливо**\n>\n> Галицько-Волинське князівство — це доказ того, що Україна *не* була «провінцією» чи «периферією». Це було *королівство*, визнане Папою Римським, пов'язане шлюбами з європейськими монархіями.\n>\n> Коли росіяни кажуть, що «Україна — молода нація без історії», згадайте Данила Галицького. Перший і єдиний Король Русі. Засновник Львова. Людина, яка боролася за незалежність — не підкорялася, як московські князі.\n>\n> Галицько-Волинське королівство — це *наша* спадщина. І цю спадщину ніхто не заберет.\n>\n> **Слава Україні!**\n\n---\n\n## Наступний урок\n\nУ наступному модулі — Литовсько-Руська доба: як українські землі увійшли до Великого князівства Литовського і що це означало для української культури та мови."
      }
    ],
    "rawMarkdown": "---\ntitle: \"History: Galicia-Volhynia\"\nsubtitle: \"Галицько-Волинське князівство\"\nphase: B2.2\nduration: 50\ntransliteration: none\ntags: [history, galicia-volhynia, kingdom, medieval]\nobjectives:\n  - Вивчити історію Галицько-Волинського князівства\n  - Зрозуміти спадкоємність Київської Русі\n  - Читати історичні тексти\n  - Розширити історичну лексику\n---\n\n# Зміст уроку\n\n## Вступ: Єдиний Король Русі\n\nРік 1253. Місто Дорогичин.\n\nМаленьке місто на кордоні Русі та Польщі переповнене людьми. Папський легат прибув із Риму. Європейські посли спостерігають. І ось — момент, якого ніколи не було раніше і ніколи не буде потім.\n\nДанило Романович, князь Галицький та Волинський, стає на коліна. Легат кладе йому на голову корону. І проголошує латиною:\n\n*«Rex Russiae.»*\n\nКороль Русі.\n\nНе «великий князь». Не «цар». *Король* — титул, який визнає вся християнська Європа. Данило став першим і єдиним правителем, який носив цей титул. Ні до нього, ні після — ніхто.\n\nЧому це важливо? Тому що коронація означала: Європа визнала Русь *королівством*. Не провінцією. Не «варварською землею». Повноправною європейською державою.\n\nІ ця держава — не Московія. Це Галицько-Волинське князівство. Західна Україна. Львів, Галич, Володимир-Волинський. *Наша* земля.\n\nСьогодні ми розповімо історію цього королівства — справжнього спадкоємця Київської Русі.\n\n---\n\n## Розминка: Перевірте свої знання\n\n| Питання | Ваша відповідь |\n|---------|----------------|\n| Що сталося з Києвом у 1240 році? | ___ |\n| Хто заснував Львів? | ___ |\n| Хто був єдиним «Королем Русі»? | ___ |\n| Що сталося з князівством у XIV столітті? | ___ |\n\n**Відповіді:** Монголи зруйнували Київ; Данило Галицький; Данило Галицький; захоплене Польщею та Литвою.\n\n---\n\n## Частина 1: Після падіння Києва — нова надія\n\n1240 рік. Монголи щойно зруйнували Київ. Здавалося — кінець. Русь загинула.\n\nАле ні.\n\nНа заході, далеко від монгольських орд, існувало князівство, яке не тільки вижило — воно процвітало. Галицько-Волинське князівство, створене за 40 років до монгольської навали, стало новим центром руської державності.\n\n### Чому захід вистояв?\n\nГеографія. Карпатські гори та болота Полісся — природні бар'єри. Монголи, чия сила була в кінній атаці на відкритому просторі, не могли ефективно діяти в горах і лісах.\n\nМонголи *пройшли* через Галичину — це правда. Але вони не залишилися. Вони не створили там постійної влади, як на сході. Галицько-Волинське князівство залишилося *незалежним*.\n\n### Роман Мстиславич — засновник\n\nГалицько-Волинське князівство об'єднав Роман Мстиславич у 1199 році — за 40 років до монгольської навали.\n\nХто він був? Нащадок Володимира Мономаха, праправнук Ярослава Мудрого. Справжній Рюрикович. Князь воїн, якого літописець порівнював із левом, риссю, орлом і крокодилом (!) одночасно:\n\n*«Він кинувся на поганих, як той лев, розлютився, як та рись, і нищив, як той крокодил. Він пройшов по їхній землі, як орел...»*\n\nРомана боялися. Романа поважали. Але Роман загинув молодим — у 1205 році, в бою з поляками. Йому було близько 50 років. Його синам Данилу та Васильку — чотири та два роки.\n\nІ тут почався хаос.\n\n---\n\n> **Чи знали ви?**\n>\n> Після смерті Романа маленького Данила та його матір Анну переслідували по всій Європі. Бояри, угорці, поляки — всі хотіли контролювати малолітнього князя.\n>\n> Анна возила синів то до Угорщини, то до Польщі, то до Галича. Літопис описує жахливу сцену: угорський король Андраш посадив маленького Данила на престол — але за ним стояли угорські солдати, а не галицькі бояри.\n>\n> Данило запам'ятав це приниження. Коли він виріс — він повернув *усе*.\n\n---\n\n## Частина 2: Данило Галицький — людина-легенда\n\nДанило Романович (бл. 1201-1264) — одна з найвидатніших постатей української історії. Людина, яка втратила все в дитинстві — і все повернула.\n\n### 33 роки боротьби\n\nУявіть: вам чотири роки. Ваш батько щойно загинув. Вас виганяють із власного князівства. Наступні 33 роки вашого життя — це боротьба за повернення.\n\nХронологія:\n- **1205**: Смерть Романа. Хаос.\n- **1211**: 10-річного Данила (!) вперше саджають на престол. І скидають.\n- **1215**: Угорці захоплюють Галич.\n- **1221**: Данило починає повертати володіння.\n- **1230-ті**: Поступове об'єднання.\n- **1238**: Данило повністю контролює Галичину та Волинь.\n\n33 роки. Від чотирирічного вигнанця до наймогутнішого правителя Русі.\n\n### Монгольський виклик\n\nА потім — 1240 рік. Монголи.\n\nДанило не міг їх зупинити — ніхто не міг. Він відступив до Угорщини та Польщі, поки орда проходила через його землі. Потім повернувся — і почав відбудовувати.\n\nАле була проблема. Монголи не забули про нього. Хан Батий вимагав покори. У 1246 році Данило був змушений їхати до ставки хана — в Золоту Орду.\n\nЦе була принизлива подорож. Руський князь мав пити кумис (кобиляче молоко), кланятися ідолам, виконувати монгольські ритуали. Літопис сумно констатує:\n\n*«О, гірше зла честь татарська! Данило Романович, князь великий, володар Руської землі, Києва та Волині, Галича... — стоїть на колінах і холопом зветься!»*\n\nДанило повернувся з Орди — але вирішив, що так тривати не може.\n\n---\n\n> **Міф vs Факт**\n>\n> ❌ **Міф:** «Данило підкорився монголам і став їхнім васалом, як московські князі.»\n>\n> ✅ **Факт:** Данило *формально* визнав монгольську владу — він не мав вибору. Але на відміну від московських князів, він *активно* шукав способи скинути цю залежність. Він будував фортеці, шукав європейських союзників, намагався організувати хрестовий похід проти монголів. Московські князі співпрацювали з Ордою століттями. Данило боровся.\n\n---\n\n## Частина 3: Коронація та європейський вибір\n\nДанило зрозумів: самотужки монголів не перемогти. Потрібні союзники. І він знайшов найпотужнішого — Папу Римського.\n\n### Угода з Римом\n\nУ XIII столітті Папа Римський — це не просто релігійний лідер. Це найвпливовіша постать Європи. Папа міг проголосити хрестовий похід. Папа міг примирити королів. Папа міг *легітимізувати* правителя.\n\nДанило запропонував угоду: він приймає унію з католицизмом (об'єднання церков), а Папа допомагає проти монголів.\n\n### Коронація 1253 року\n\nПапа Інокентій IV погодився. У 1253 році в місті Дорогичин відбулася історична подія — Данила короновано як *Rex Russiae*, Короля Русі.\n\nЩо це означало?\n- **Міжнародне визнання**: Данило — не просто князь, а *король*, рівний європейським монархам\n- **Релігійна унія**: (теоретично) об'єднання з Римом\n- **Антимонгольський альянс**: (теоретично) європейська допомога\n\n### Чому «теоретично»?\n\nРеальність виявилася гіршою. Європейські монархи не поспішали на допомогу. Хрестовий похід так і не відбувся. Данило залишився сам проти монгольської загрози.\n\nА потім — ультиматум. Хан Бурундай у 1259 році вимагав, щоб Данило *зруйнував* власні фортеці. Як доказ лояльності.\n\nДанило був змушений підкоритися. Фортеці, які він будував роками, — розібрані. Надії на європейську допомогу — розбиті.\n\nАле коронація залишилася. Історичний прецедент: Русь — це *королівство*.\n\n---\n\n> **Чи знали ви?**\n>\n> Данило став Королем Русі, але він *не* змінив віру. Унія з Римом залишилася на папері — Данило не став католиком і не примушував своїх підданих. Він був прагматиком: коронація була потрібна для політичної легітимності, а не для релігійної революції.\n>\n> Цікаво, що Папа знав про це — і все одно короновував. Для Риму важливіше було мати *будь-якого* союзника на сході, ніж наполягати на негайному зверненні.\n\n---\n\n## Частина 4: Львів — місто короля\n\nСеред усіх досягнень Данила є одне, яке ми бачимо щодня: Львів.\n\n### Заснування\n\nДанило заснував Львів близько 1256 року (точна дата невідома) і назвав на честь свого сина Лева. Спочатку це була фортеця на горі (сучасний Високий Замок), пізніше — велике торгове місто.\n\nЧому саме там? Стратегічне розташування. Львів стояв на перехресті торгових шляхів — із Заходу на Схід, з Півночі на Південь. Через нього йшли каравани з Німеччини до Криму, з Польщі до Візантії.\n\n### Від фортеці до столиці\n\nПісля смерті Данила його син Лев (1264-1301) зробив Львів фактичною столицею. Місто росло, багатіло, залучало купців та ремісників з усієї Європи.\n\nДо XIV століття Львів став одним із найбільших міст Центральної Європи. Вірмени, євреї, німці, поляки, українці — всі жили разом, торгували, створювали унікальну культуру.\n\n---\n\n> **Чи знали ви?**\n>\n> Назва «Львів» — від імені *Лев*. Але чому княжого сина назвали Левом?\n>\n> Є теорія: Данило дав синові це ім'я на честь Папи Лева IX — як знак дружби з Римом. Інша теорія: лев був символом хоробрості та влади у середньовічній геральдиці.\n>\n> Так чи інакше, лев став символом міста. Він на гербі Львова досі. Лев, якого заснував *інший* Лев.\n\n---\n\n## Частина 5: Занепад — як усе закінчилося\n\nПісля смерті Данила в 1264 році князівство ще проіснувало майже 80 років. Але поступово слабшало.\n\n### Останні правителі\n\n| Правитель | Роки | Що сталося |\n|-----------|------|------------|\n| Лев I | 1264-1301 | Переніс столицю до Львова |\n| Юрій I | 1301-1308 | Підтримував православ'я |\n| Андрій та Лев II | 1308-1323 | Загинули в бою (обидва!) |\n| Юрій II Болеслав | 1323-1340 | Отруєний боярами |\n\nЗверніть увагу: Андрій та Лев II загинули *разом*, без спадкоємців. Юрія II *отруїли*. Династія Романовичів вимерла не природно — її знищили.\n\n### 1340-1349: Кінець\n\nПісля смерті Юрія II почалася боротьба за спадщину. Поляки та литовці вторглися в князівство.\n\n- **1340**: Польський король Казимир III захоплює Львів\n- **1349**: Остаточне польське завоювання Галичини\n- **1340-1392**: Волинь переходить під Литву\n\nГалицько-Волинське князівство припинило існування. Але *не* українська державність — вона продовжилася в інших формах.\n\n---\n\n> **Міф vs Факт**\n>\n> ❌ **Міф:** «Після 1340 року українці втратили державність і стали \"безправною масою\".»\n>\n> ✅ **Факт:** Українські (руські) землі *зберегли* значну автономію. У Великому князівстві Литовському руська мова була *офіційною*. Руська шляхта зберегла свої права. Православна церква продовжувала діяти. Так, незалежної держави не було — але говорити про повну «втрату» неправильно. Українська ідентичність продовжувала існувати.\n\n---\n\n## Чому це важливо: Деколонізаційний контекст\n\nГалицько-Волинське князівство руйнує кілька російських міфів:\n\n### Міф 1: «Після монголів Русь переїхала в Москву»\n\n**Правда:** Справжнім спадкоємцем Київської Русі було Галицько-Волинське князівство, а не Московія. Московія була периферією, улусом Золотої Орди. Галичина була *королівством*, визнаним Європою.\n\n### Міф 2: «Українці — пасивний народ без державності»\n\n**Правда:** Данило Галицький — приклад активної боротьби. 33 роки повертав владу. Шукав союзників по всій Європі. Будував фортеці. Це не «пасивність» — це *resilience*.\n\n### Міф 3: «Львів — польське місто»\n\n**Правда:** Львів заснований українським (руським) князем як столиця українського (руського) королівства. Поляки захопили його пізніше — але це не робить його «споконвічно польським».\n\n---\n\n## Практика\n\n### Завдання 1: Хронологія\n\nРозставте в правильному порядку:\n\n1. Коронація Данила\n2. Об'єднання Галичини та Волині\n3. Заснування Львова\n4. Польське завоювання\n5. Монгольська навала\n\n**Відповідь:** 2 (1199) → 5 (1240) → 1 (1253) → 3 (бл. 1256) → 4 (1340-1349)\n\n### Завдання 2: Заповніть пропуски\n\n1. Галицько-Волинське князівство об'єднав ___.\n   > [!answer] **Роман Мстиславич**\n2. Данило Галицький був коронований у ___ році.\n   > [!answer] **1253**\n3. Титул Данила латиною — ___.\n   > [!answer] **Rex Russiae**\n4. Львів названо на честь сина Данила — ___.\n   > [!answer] **Лева**\n5. У 1349 році Галичину захопила ___.\n   > [!answer] **Польща**\n### Завдання 3: Перекладіть\n\n1. Danylo was crowned King of Rus by the Pope.\n   > [!answer] **Данила короновано Папою Римським як Короля Русі.**\n2. He founded Lviv in honor of his son Lev.\n   > [!answer] **Він заснував Львів на честь свого сина Лева.**\n3. The kingdom was the true successor of Kyivan Rus.\n   > [!answer] **Королівство було справжнім спадкоємцем Київської Русі.**\n---\n\n## Продукція\n\n### Обговоріть\n\n1. Чому Данило шукав союзу з Папою, а не з монголами (як московські князі)?\n\n2. Яке значення мала коронація для української ідентичності?\n\n3. Як би змінилася історія, якби Галицько-Волинське королівство отримало європейську допомогу проти монголів?\n\n### Напишіть (150-200 слів)\n\nУявіть, що ви — літописець при дворі Данила. Опишіть день коронації 1253 року: що ви бачите, чуєте, відчуваєте.\n\n---\n\n# Вправи\n\n## quiz: Галицько-Волинське князівство\n\n> Виберіть правильну відповідь.\n\n1. Хто об'єднав Галичину та Волинь у 1199 році?\n   - [x] Роман Мстиславич\n   - [ ] Данило Галицький\n   - [ ] Лев I\n   > Данило був сином Романа.\n\n2. Данило Галицький був коронований:\n   - [ ] православним митрополитом\n   - [x] Папою Римським (через легата)\n   - [ ] візантійським імператором\n   > Інокентій IV, 1253 рік.\n\n3. Титул Данила латиною:\n   - [ ] Imperator Russiae\n   - [x] Rex Russiae\n   - [ ] Dux Russiae\n   > Король Русі.\n\n4. Хто заснував Львів?\n   - [ ] Роман Мстиславич\n   - [x] Данило Галицький\n   - [ ] Лев I\n   > На честь сина Лева.\n\n5. Коли Галичину захопила Польща?\n   - [ ] у 1253 році\n   - [ ] у 1264 році\n   - [x] у 1340-1349 роках\n   > Казимир III.\n\n6. **[Інтеграція: пасив]** Офіційний текст: «Данила ___ Папою Римським.»\n   - [x] короновано\n   - [ ] коронували\n   - [ ] коронується\n   > Офіційний/історичний текст → -но/-то.\n\n7. **[Інтеграція: регістр]** Художній текст: «Князь ___ нове місто.»\n   - [ ] засновано\n   - [x] заснував\n   - [ ] засновується\n   > Наратив → активний стан.\n\n8. Чому Галицько-Волинське князівство — справжній спадкоємець Київської Русі?\n   - [ ] Бо воно було ближче до Москви\n   - [x] Бо воно зберегло незалежність і було визнане Європою\n   - [ ] Бо воно підкорилося монголам\n   > На відміну від Московії, яка була улусом Орди.\n\n---\n\n# Словник\n\n| Слово | Вимова | Переклад | Приклад |\n|-------|--------|----------|---------|\n| князівство | /knʲɑˈzʲiwstwɔ/ | principality | Галицько-Волинське князівство існувало 150 років. |\n| королівство | /kɔrɔˈlʲiwstwɔ/ | kingdom | Данило створив Королівство Русі. |\n| король | /kɔˈrɔlʲ/ | king | Данило — єдиний Король Русі. |\n| коронація | /kɔrɔˈnɑt͡sʲijɑ/ | coronation | Коронація відбулася в 1253 році. |\n| боярин | /bɔˈjarɪn/ | boyar | Бояри часто конфліктували з князями. |\n| престол | /prɛsˈtɔl/ | throne | Данило боровся за престол 33 роки. |\n| спадкоємець | /spɑdkɔˈjɛmɛt͡sʲ/ | heir | Лев був спадкоємцем Данила. |\n| унія | /ˈunʲijɑ/ | union | Унія з Римом була політичним ходом. |\n| завоювання | /zɑwɔjuˈwɑnʲːɑ/ | conquest | Польське завоювання — 1349 рік. |\n| легат | /lɛˈɦɑt/ | legate | Папський легат провів коронацію. |\n| фортеця | /fɔrˈtɛt͡sʲɑ/ | fortress | Данило будував фортеці проти монголів. |\n\n---\n\n# Review Vocabulary\n\n| Word | First Module |\n|------|-------------|\n| спадкоємність | 207 |\n\n---\n\n# Підсумок\n\n## Хронологія\n\n| Рік | Подія |\n|-----|-------|\n| 1199 | Роман об'єднує Галичину та Волинь |\n| 1205 | Смерть Романа, хаос |\n| 1238 | Данило відновлює контроль |\n| 1253 | Коронація — Rex Russiae |\n| бл. 1256 | Заснування Львова |\n| 1264 | Смерть Данила |\n| 1340-1349 | Польське та литовське завоювання |\n\n## Ключові постаті\n\n| Правитель | Досягнення |\n|-----------|------------|\n| Роман Мстиславич | Об'єднання (1199) |\n| Данило Галицький | Коронація, Львів, європейська орієнтація |\n| Лев I | Розвиток Львова |\n\n---\n\n> **Чому це важливо**\n>\n> Галицько-Волинське князівство — це доказ того, що Україна *не* була «провінцією» чи «периферією». Це було *королівство*, визнане Папою Римським, пов'язане шлюбами з європейськими монархіями.\n>\n> Коли росіяни кажуть, що «Україна — молода нація без історії», згадайте Данила Галицького. Перший і єдиний Король Русі. Засновник Львова. Людина, яка боролася за незалежність — не підкорялася, як московські князі.\n>\n> Галицько-Волинське королівство — це *наша* спадщина. І цю спадщину ніхто не заберет.\n>\n> **Слава Україні!**\n\n---\n\n## Наступний урок\n\nУ наступному модулі — Литовсько-Руська доба: як українські землі увійшли до Великого князівства Литовського і що це означало для української культури та мови.\n",
    "createdAt": "2025-12-05T01:15:58.031Z",
    "modifiedAt": "2025-12-05T01:15:58.031Z",
    "version": 2
  },
  "activities": [
    {
      "id": "act-a1-0-quiz",
      "type": "quiz",
      "title": "Галицько-Волинське князівство",
      "description": "Виберіть правильну відповідь.",
      "content": {
        "type": "quiz",
        "questions": [
          {
            "question": "Хто об'єднав Галичину та Волинь у 1199 році?",
            "options": [
              "Роман Мстиславич",
              "Данило Галицький",
              "Лев I"
            ],
            "correctIndex": 0,
            "explanation": "Данило був сином Романа."
          },
          {
            "question": "Данило Галицький був коронований:",
            "options": [
              "православним митрополитом",
              "Папою Римським (через легата)",
              "візантійським імператором"
            ],
            "correctIndex": 1,
            "explanation": "Інокентій IV, 1253 рік."
          },
          {
            "question": "Титул Данила латиною:",
            "options": [
              "Imperator Russiae",
              "Rex Russiae",
              "Dux Russiae"
            ],
            "correctIndex": 1,
            "explanation": "Король Русі."
          },
          {
            "question": "Хто заснував Львів?",
            "options": [
              "Роман Мстиславич",
              "Данило Галицький",
              "Лев I"
            ],
            "correctIndex": 1,
            "explanation": "На честь сина Лева."
          },
          {
            "question": "Коли Галичину захопила Польща?",
            "options": [
              "у 1253 році",
              "у 1264 році",
              "у 1340-1349 роках"
            ],
            "correctIndex": 2,
            "explanation": "Казимир III."
          },
          {
            "question": "**[Інтеграція: пасив]** Офіційний текст: «Данила ___ Папою Римським.»",
            "options": [
              "короновано",
              "коронували",
              "коронується"
            ],
            "correctIndex": 0,
            "explanation": "Офіційний/історичний текст → -но/-то."
          },
          {
            "question": "**[Інтеграція: регістр]** Художній текст: «Князь ___ нове місто.»",
            "options": [
              "засновано",
              "заснував",
              "засновується"
            ],
            "correctIndex": 1,
            "explanation": "Наратив → активний стан."
          },
          {
            "question": "Чому Галицько-Волинське князівство — справжній спадкоємець Київської Русі?",
            "options": [
              "Бо воно було ближче до Москви",
              "Бо воно зберегло незалежність і було визнане Європою",
              "Бо воно підкорилося монголам"
            ],
            "correctIndex": 1,
            "explanation": "На відміну від Московії, яка була улусом Орди."
          }
        ],
        "shuffleQuestions": true,
        "shuffleOptions": true,
        "showCorrectAnswers": true
      },
      "subject": "language",
      "owner": "curricula-opus",
      "visibility": "public",
      "language": "uk",
      "difficultyLevel": "B2",
      "duration": 5,
      "tags": [],
      "createdAt": "2025-12-05T01:15:58.031Z",
      "modifiedAt": "2025-12-05T01:15:58.031Z"
    }
  ],
  "vocabulary": {
    "moduleId": "mod-uk-B2-35",
    "level": "B2",
    "phase": "B2.2",
    "wordCount": 12,
    "newWordCount": 11,
    "reviewWordCount": 1,
    "transliterationMode": "none",
    "words": [
      {
        "id": "v-knyazivstvo-0-0",
        "uk": "князівство",
        "en": "principality",
        "pos": "noun",
        "ipa": "/knʲɑˈzʲiwstwɔ/",
        "note": "Галицько-Волинське князівство існувало 150 років.",
        "isNew": true,
        "firstModule": 0
      },
      {
        "id": "v-korolivstvo-0-1",
        "uk": "королівство",
        "en": "kingdom",
        "pos": "noun",
        "ipa": "/kɔrɔˈlʲiwstwɔ/",
        "note": "Данило створив Королівство Русі.",
        "isNew": true,
        "firstModule": 0
      },
      {
        "id": "v-korolь-0-2",
        "uk": "король",
        "en": "king",
        "pos": "noun",
        "ipa": "/kɔˈrɔlʲ/",
        "note": "Данило — єдиний Король Русі.",
        "isNew": true,
        "firstModule": 0
      },
      {
        "id": "v-koronatsiya-0-3",
        "uk": "коронація",
        "en": "coronation",
        "pos": "noun",
        "ipa": "/kɔrɔˈnɑt͡sʲijɑ/",
        "note": "Коронація відбулася в 1253 році.",
        "isNew": true,
        "firstModule": 0
      },
      {
        "id": "v-boyaryn-0-4",
        "uk": "боярин",
        "en": "boyar",
        "pos": "noun",
        "ipa": "/bɔˈjarɪn/",
        "note": "Бояри часто конфліктували з князями.",
        "isNew": true,
        "firstModule": 0
      },
      {
        "id": "v-prestol-0-5",
        "uk": "престол",
        "en": "throne",
        "pos": "noun",
        "ipa": "/prɛsˈtɔl/",
        "note": "Данило боровся за престол 33 роки.",
        "isNew": true,
        "firstModule": 0
      },
      {
        "id": "v-spadkoyemetsь-0-6",
        "uk": "спадкоємець",
        "en": "heir",
        "pos": "noun",
        "ipa": "/spɑdkɔˈjɛmɛt͡sʲ/",
        "note": "Лев був спадкоємцем Данила.",
        "isNew": true,
        "firstModule": 0
      },
      {
        "id": "v-uniya-0-7",
        "uk": "унія",
        "en": "union",
        "pos": "noun",
        "ipa": "/ˈunʲijɑ/",
        "note": "Унія з Римом була політичним ходом.",
        "isNew": true,
        "firstModule": 0
      },
      {
        "id": "v-zavoyuvannya-0-8",
        "uk": "завоювання",
        "en": "conquest",
        "pos": "noun",
        "ipa": "/zɑwɔjuˈwɑnʲːɑ/",
        "note": "Польське завоювання — 1349 рік.",
        "isNew": true,
        "firstModule": 0
      },
      {
        "id": "v-lehat-0-9",
        "uk": "легат",
        "en": "legate",
        "pos": "noun",
        "ipa": "/lɛˈɦɑt/",
        "note": "Папський легат провів коронацію.",
        "isNew": true,
        "firstModule": 0
      },
      {
        "id": "v-fortetsya-0-10",
        "uk": "фортеця",
        "en": "fortress",
        "pos": "noun",
        "ipa": "/fɔrˈtɛt͡sʲɑ/",
        "note": "Данило будував фортеці проти монголів.",
        "isNew": true,
        "firstModule": 0
      }
    ],
    "reviewWords": [
      {
        "id": "v-spadkoyemnistь-0-1000",
        "uk": "спадкоємність",
        "en": "",
        "pos": "noun",
        "isNew": false,
        "firstModule": 207
      }
    ]
  }
}