{
  "$schema": "../../../schemas/vibe-module.schema.json",
  "lesson": {
    "id": "lesson-uk-B2-27",
    "moduleId": "mod-uk-B2-27",
    "languagePair": "l2-uk-en",
    "subject": "language",
    "owner": "curricula-opus",
    "visibility": "public",
    "language": "uk",
    "targetLevel": "B2",
    "phase": "B2.2",
    "moduleNumber": 27,
    "moduleType": "history",
    "immersionLevel": 0.85,
    "title": "History: Kyivan Rus I",
    "subtitle": "Київська Русь I: Виникнення",
    "description": "Зрозуміти походження Київської Русі",
    "objectives": [
      "Зрозуміти походження Київської Русі",
      "Розвінчати міф «Русь = Росія»",
      "Вивчити історичну термінологію",
      "Критично аналізувати історичні наративи"
    ],
    "grammarFocus": [],
    "tags": [
      "history",
      "kyivan-rus",
      "decolonization",
      "myth-busting"
    ],
    "totalDuration": 50,
    "transliterationMode": "none",
    "sections": [
      {
        "id": "section-зміст-уроку",
        "name": "Зміст уроку",
        "type": "content",
        "content": "## Вступ: Найбільша крадіжка в історії\n\nУявіть, що хтось вкрав вашу історію.\n\nНе просто якусь частину — а *всю* вашу історію. Ваших предків. Ваших героїв. Ваші храми, книги, традиції. І почав стверджувати, що це все — його.\n\nСаме це сталося з Київською Руссю.\n\nУ 1721 році Петро I, московський цар, вирішив, що йому потрібна нова назва для своєї держави. Стара назва — «Московія» або «Московське царство» — звучала занадто... провінційно. Він хотів імперію. Він хотів легітимність. Він хотів стародавню історію.\n\nІ він просто *взяв* її.\n\nПетро оголосив, що відтепер Московія називається «Російська імперія», а московити — «росіяни». А що таке «Русь»? Ну, це ж очевидно — «Русь» і «Росія» — одне й те саме, правда? Отже, Київ — це «російське» місто, а Київська Русь — «колиска російської державності».\n\nОдин підпис — і тисяча років української історії стала «російською».\n\nЦе не перебільшення. Це буквально те, що сталося. І наслідки цієї крадіжки ми відчуваємо досі — кожного разу, коли російський пропагандист каже, що «українці — це просто росіяни, які забули, хто вони».\n\nСьогодні ми відновлюємо правду. Ми розповімо справжню історію Київської Русі — української середньовічної держави, яку Москва так відчайдушно намагається привласнити.\n\n---\n\n## Розминка: Перевірте свої знання\n\nПерш ніж продовжити — маленький тест. Що з цього правда?\n\n| Твердження | Ваша відповідь |\n|------------|----------------|\n| Москва була столицею Київської Русі | Так / Ні |\n| «Русь» і «Росія» — синоніми | Так / Ні |\n| Київ заснований раніше за Москву | Так / Ні |\n| Московити завжди називали себе «русами» | Так / Ні |\n\n**Правильні відповіді:**\n- Москва була столицею Русі? **Ні.** (Москва заснована через 265 років після Києва!)\n- «Русь» і «Росія» — синоніми? **Ні.** (Це різні поняття)\n- Київ заснований раніше за Москву? **Так.** (882 vs 1147)\n- Московити завжди називали себе «русами»? **Ні.** (Лише з XVIII століття)\n\nЯкщо ви помилилися — не хвилюйтеся. Саме для цього ми тут.\n\n---\n\n## Частина 1: Що таке «Русь»? Три теорії\n\nПочнемо з головного питання: звідки взагалі взялася назва «Русь»?\n\nЦе питання археологи та лінгвісти обговорюють уже понад століття. І є три основні теорії.\n\n### Теорія 1: Норманська (скандинавська)\n\nЦя теорія стверджує, що «Русь» походить від фінського слова «ruotsi», яким фіни називали скандинавів. А скандинави (варяги) були купцями та воїнами, які мандрували річками від Балтики до Чорного моря.\n\n**Докази:** У скандинавських сагах згадується «Garðaríki» (Країна городів) — так вікінги називали землі на сході. Також багато імен перших київських князів — явно скандинавські: Олег (Helgi), Ігор (Ingvar), Ольга (Helga).\n\n**Контраргумент:** Навіть якщо назва прийшла від варягів, *населення* було слов'янським. Варяги — це верхівка, еліта, яка швидко асимілювалася. Вже внук Рюрика — Святослав — мав слов'янське ім'я.\n\n### Теорія 2: Слов'янська (від річки Рось)\n\nЦя теорія пропонує простіше пояснення: «Русь» — від річки Рось, що впадає в Дніпро неподалік від Києва. Річка давала назву племенам, які жили на її берегах, а потім — усій державі.\n\n**Докази:** Багато українських топонімів пов'язані з коренем «рос/рус»: Рось, Росава, Росія (село в Сумській області, не плутати з державою-агресором).\n\n**Контраргумент:** Лінгвісти сперечаються, чи була річка названа на честь людей, чи люди — на честь річки.\n\n### Теорія 3: Іранська (сарматська)\n\nНайекзотичніша теорія пов'язує «Русь» із давньоіранським словом «ruxs» або «roxs», що означає «світлий, сяючий». Сармати, іраномовний народ, який жив у степах України до слов'ян, могли залишити цю назву.\n\n**Докази:** Деякі античні автори згадують «роксоланів» (roxolani) — буквально «світлих аланів». Можливо, цей етнонім перейшов до слов'ян.\n\n---\n\n> **Чи знали ви?**\n>\n> У XIX столітті «норманська теорія» стала політичною зброєю. Деякі російські історики використовували її, щоб стверджувати: «Слов'яни не могли самі створити державу — їм потрібні були германці». Це відверто расистський аргумент. Українські історики відповідали: навіть якщо Рюрик був скандинавом, держава будувалася слов'янами на слов'янській землі слов'янською мовою.\n>\n> Сьогодні більшість серйозних істориків погоджуються: *походження* назви — менш важливе, ніж *реальність* держави. А реальність така: Київська Русь була слов'янською державою зі столицею в Києві. Крапка.\n\n---\n\n## Частина 2: Як виникла Київська Русь\n\nТепер — до фактів. Як саме постала ця держава?\n\n### Рюрик і варяги (862)\n\nЗгідно з «Повістю минулих літ» — найдавнішим українським літописом — слов'янські та фінські племена на півночі постійно воювали між собою. Втомившись від чвар, вони вирішили запросити зовнішнього правителя:\n\n*«Земля наша велика і багата, але порядку в ній немає. Прийдіть княжити і володіти нами.»*\n\nТак у 862 році Рюрик прийшов до Новгорода і став першим князем. Чи це історичний факт, чи легенда — досі дискутується. Але важливо інше: Рюрик правив *Новгородом*, не Києвом.\n\n### Олег і створення держави (882)\n\nСправжнім засновником Київської Русі вважається Олег — родич (можливо, шурин) Рюрика. У 882 році Олег зібрав військо і рушив на південь — до Києва.\n\nУ Києві на той час правили Аскольд і Дір — теж варяги. Олег хитрістю вбив їх і захопив місто. А потім сказав слова, які стали символом української державності:\n\n*«Хай буде Київ матір'ю міст руських!»*\n\nНе Новгород. Не Ладога. Київ. Саме Київ став центром нової держави. І залишався ним наступні 350 років.\n\n---\n\n> **Міф vs Факт**\n>\n> ❌ **Міф:** «Русь починалася з Новгорода, тому її спадкоємиця — Москва (яка ближче до Новгорода).»\n>\n> ✅ **Факт:** Рюрик дійсно спочатку правив у Новгороді, але *державу* створив Олег, і він одразу проголосив столицею *Київ*. Новгород залишався важливим містом, але завжди був підпорядкований Києву. А Москви взагалі не існувало ще 265 років. Говорити, що Москва — «спадкоємиця Русі», бо Новгород був на півночі — це як казати, що Румунія — спадкоємиця Римської імперії, бо теж починається на «Р».\n\n---\n\n### Хронологія перших правителів\n\n| Роки | Правитель | Головне |\n|------|-----------|---------|\n| 862-879 | Рюрик | Прийшов до Новгорода |\n| 879-912 | Олег | Захопив Київ, створив державу |\n| 912-945 | Ігор | Походи на Візантію, загинув від древлян |\n| 945-964 | Ольга | Регентша при малому Святославі |\n| 964-972 | Святослав | Великий воїн, походи на схід |\n\n### Олег Віщий: перший геополітик\n\nОлег правив 30 років, і за цей час перетворив Русь на серйозну силу. У 907 році він здійснив неймовірний похід на Константинополь (Царгород) — столицю Візантійської імперії, наймогутнішої держави тогочасного світу.\n\nЗа легендою, Олег прибив свій щит до воріт Царгорода — символ перемоги. Візантійці погодились платити данину і підписали вигідний для Русі торговий договір.\n\nЧи прибивав Олег щит насправді? Ми не знаємо. Але договір із Візантією — це історичний факт. Текст договору зберігся в літописах.\n\n---\n\n> **Чи знали ви?**\n>\n> Прізвисько «Віщий» Олег отримав за свою здатність передбачати події. Але помер він, за легендою, від того, чого не передбачив — від укусу змії, яка вилізла з черепа його мертвого коня. Ця історія стала основою для знаменитої «Пісні про віщого Олега» Олександра Пушкіна — одного з небагатьох творів російського поета, де він *не* намагається привласнити українську історію.\n\n---\n\n### Княгиня Ольга: перша християнка\n\nОльга — одна з найцікавіших постатей ранньої Русі. Після загибелі її чоловіка Ігоря від рук древлян (вони розірвали його між двома деревами за надмірне збирання данини), Ольга помстилася так жорстоко, що це стало легендою.\n\nСпочатку вона закопала живцем древлянських послів. Потім спалила другу групу послів у лазні. Потім влаштувала тризну (поминальний бенкет) біля древлянської столиці Іскоростеня — і вирізала п'ять тисяч п'яних древлян. А на завершення — спалила саме місто за допомогою горобців та голубів, до лапок яких прив'язали тліючу сірку.\n\nПісля такої помсти Ольга... прийняла християнство. У Константинополі. Вона стала першою правителькою Русі, яка хрестилася — задовго до офіційного хрещення Русі її онуком Володимиром.\n\n---\n\n> **Чи знали ви?**\n>\n> Ольга — єдина жінка в історії Русі, яка канонізована як *рівноапостольна* святая. Цей титул означає, що її внесок у поширення християнства прирівнюється до внеску апостолів. В усій історії християнства цей титул отримали лише п'ятеро жінок — і Ольга серед них.\n\n---\n\n## Частина 3: Чому «Русь» — це Україна, не Росія\n\nА тепер — найважливіша частина. Чому ми категорично стверджуємо, що Київська Русь — українська, а не російська?\n\n### Аргумент 1: Географія\n\nЦе найпростіший аргумент. Подивіться на карту:\n\n- **Київ** (столиця Русі) — сьогодні столиця України\n- **Чернігів** (друге за значенням місто) — в Україні\n- **Переяслав** (місто княжих з'їздів) — в Україні\n- **Галич** (столиця Галицького князівства) — в Україні\n\nА де Москва? Москву *засновано в 1147 році* — через 265 років після створення Київської Русі. І навіть тоді це було маленьке село на периферії. Москва *ніколи* не була частиною власне Київської Русі — вона входила до Володимиро-Суздальського князівства, яке відокремилось від Києва.\n\n### Аргумент 2: Мова\n\nМова Київської Русі — давньоруська (або давньоукраїнська, як її називають українські лінгвісти). Сучасні лінгвістичні дослідження показують, що:\n\n- Давньоруська мова *найближча* до сучасної української\n- Російська мова сформувалася значно пізніше, під впливом фіно-угорських та тюркських мов\n- Багато слів, які збереглися в українській, зникли з російської\n\nНаприклад, українське слово «працювати» — це давньоруське «працювати». Російське «работать» — від слова «раб» (робити роботу як раб). Яка мова ближча до оригіналу?\n\n### Аргумент 3: Культура\n\nКультурні пам'ятки Київської Русі — всі в Україні:\n\n- **Софія Київська** (1037) — найважливіший храм Русі, стоїть у Києві\n- **Києво-Печерська лавра** — духовний центр Русі, у Києві\n- **Десятинна церква** — перша кам'яна церква Русі, була в Києві\n\nА що в Москві? *Нічого* з часів Київської Русі. Бо Москви тоді *не існувало*.\n\n### Аргумент 4: Самоназва\n\nОсь найцікавіший факт: московити *не називали себе «русами»* до XVIII століття!\n\nКоли в XV-XVI століттях московські правителі почали претендувати на «руську» спадщину, вони не говорили «ми — Русь». Вони говорили «ми — спадкоємці Русі», що зовсім інше.\n\nНавіть у назвах: Московія, Московське царство, московити — не «Русь», не «руси». Лише Петро I у 1721 році *примусово* перейменував державу на «Російську імперію».\n\n---\n\n> **Міф vs Факт**\n>\n> ❌ **Міф:** «Українці та росіяни — один народ, тому Русь — спільна спадщина.»\n>\n> ✅ **Факт:** Ця теза — основа путінської пропаганди, яку він виклав у статті 2021 року. Але історичні факти говорять інше: українці та росіяни — різні народи з різною історією, мовою та культурою. Так, є спільне коріння — як у французів та італійців є спільне римське коріння. Але це не робить Францію та Італію «одним народом». Русь — це українська спадщина. Москва може мати свою історію — Московії, яка виникла пізніше і розвивалася окремо.\n\n---\n\n## Частина 4: Крадіжка історії — як це сталося\n\nЯк московитам вдалося «вкрасти» Русь? Це не сталося за одну ніч — це був довгий процес.\n\n### Крок 1: Претензії московських царів (XV-XVII ст.)\n\nПісля падіння Києва від монголів (1240) різні князівства претендували на «руську» спадщину. Московські князі — теж. Вони почали називати себе «государями всея Русі», хоча *фактично* більшість руських земель їм не належала.\n\n### Крок 2: Перейменування Московії (1721)\n\nПетро I офіційно перейменував Московію на «Російську імперію», а московитів — на «росіян». Це був маркетинговий хід: «Росія» звучить як «Русь», що створює ілюзію спадкоємності.\n\n### Крок 3: Переписування історії (XVIII-XIX ст.)\n\nРосійські історики почали систематично переписувати історію. Вони:\n- Називали Київську Русь «Древнерусское государство» (давньоруська держава), ігноруючи слово «Київ»\n- Стверджували, що «руси» = «росіяни»\n- Применшували роль Києва і перебільшували роль Новгорода та Москви\n\n### Крок 4: Радянська історіографія (XX ст.)\n\nСРСР продовжив цю традицію. У радянських підручниках Київська Русь подавалась як «спільна колиска» трьох «братніх народів» — росіян, українців та білорусів. При цьому «старший брат» (росіяни) чомусь успадкував *всю* спадщину.\n\n### Крок 5: Путінська пропаганда (XXI ст.)\n\nСьогодні Путін використовує ці міфи для виправдання війни. Його логіка: «Якщо Київська Русь — російська, то Київ — російське місто. А отже, Україна не має права на існування».\n\nСаме тому *знання правдивої історії — це акт спротиву*.\n\n---\n\n> **Чи знали ви?**\n>\n> У 2021 році Путін опублікував статтю «Про історичну єдність росіян та українців», де виклав усі ці міфи. Українські історики назвали статтю «маніфестом імперіалізму» та «історичною фальсифікацією». Через рік Росія почала повномасштабне вторгнення. Крадіжка історії — це не академічна дискусія. Це підготовка до війни.\n\n---\n\n## Термінологія: Важливі слова\n\n| Термін | Переклад | Пояснення |\n|--------|----------|-----------|\n| Русь | Rus | Історична назва держави та народу |\n| руси / русини | Ruthenians | Мешканці Русі (НЕ «росіяни»!) |\n| руський (давньоукр.) | Ruthenian | Прикметник від «Русь», НЕ «російський» |\n| давньоруський | Old Rus / Old Ukrainian | Мова та культура Русі |\n| Московія | Muscovy | Московське царство до 1721 р. |\n| московити | Muscovites | Мешканці Московії до 1721 р. |\n| варяги | Varangians | Скандинавські воїни-торговці |\n\n**Важливо:** Англійською часто плутають «Russian» (російський) і «Ruthenian» (руський). Це *різні* слова! Коли йдеться про Київську Русь, правильний переклад — «Ruthenian» або «Rus'», НЕ «Russian».\n\n---\n\n## Практика\n\n### Завдання 1: Заповніть пропуски\n\n1. Олег проголосив Київ «___ містам руським».\n   > [!answer] **матір'ю**\n2. Москву засновано в ___ році, через 265 років після Києва.\n   > [!answer] **1147**\n3. Петро I перейменував Московію на ___ імперію.\n   > [!answer] **Російську**\n4. Давньоруська мова найближча до сучасної ___.\n   > [!answer] **української**\n5. Софію Київську збудовано в ___ році.\n   > [!answer] **1037**\n### Завдання 2: Правда чи міф?\n\n| Твердження | П / М |\n|------------|-------|\n| 1. Москва була столицею Київської Русі. | **М** |\n| 2. Олег Віщий захопив Київ у 882 році. | **П** |\n| 3. Московити завжди називали себе «русами». | **М** |\n| 4. Ольга — перша правителька Русі, яка хрестилася. | **П** |\n| 5. «Русь» і «Росія» — історично одне й те саме. | **М** |\n\n### Завдання 3: Перекладіть (використовуйте пасив де доречно)\n\n1. Kyiv was founded centuries before Moscow.\n   > [!answer] **Київ засновано за століття до Москви.**\n2. The myth that Russia inherited Rus is false.\n   > [!answer] **Міф про те, що Росія успадкувала Русь, — хибний.**\n3. The treaty with Byzantium was signed by Oleg.\n   > [!answer] **Договір із Візантією було підписано Олегом.**\n4. Sophia Cathedral was built in 1037.\n   > [!answer] **Софію Київську збудовано в 1037 році.**\n---\n\n## Продукція\n\n### Обговоріть\n\n1. Чому Росія так відчайдушно намагається привласнити історію Русі? Яка в цьому вигода?\n\n2. Як імперські міфи використовуються для виправдання війни? Наведіть приклади.\n\n3. Що означає «деколонізація історії»? Як ви можете долучитися до цього процесу?\n\n### Напишіть (150-200 слів)\n\nУявіть, що ви пояснюєте іноземцю, чому Київська Русь — українська, а не російська держава. Напишіть короткий текст із трьома головними аргументами.\n\n---\n\n\n---\n\n\n---"
      },
      {
        "id": "section-summary",
        "name": "Підсумок",
        "nameEn": "Summary",
        "type": "summary",
        "content": "## Головні факти\n\n| Факт | Деталі |\n|------|--------|\n| Столиця Русі | Київ (з 882 року) |\n| Заснування Москви | 1147 рік (265 років пізніше!) |\n| Мова Русі | Давньоруська (найближча до української) |\n| Культурні пам'ятки | Софія Київська, Лавра — усі в Україні |\n| «Перейменування» | 1721: Московія → Російська імперія |\n\n## Імперський міф vs Правда\n\n| Міф | Правда |\n|-----|--------|\n| «Русь = Росія» | Русь — українська спадщина |\n| «Один народ» | Українці та росіяни — різні народи |\n| «Москва — спадкоємиця» | Москва виникла через 265 років |\n| «Спільна колиска» | Колиска стояла в Києві |\n\n---\n\n> **Чому це важливо**\n>\n> Знання правдивої історії — це не просто академічна вправа. Це спротив. Коли ви знаєте, що Київська Русь — українська держава, ви позбавляєте Росію головного аргументу для агресії. Коли ви розповідаєте цю правду іншим, ви боретеся з імперською пропагандою.\n>\n> *Русь — це Україна. Київ — наша столиця. Ця історія — наша.*\n>\n> **Слава Україні!**\n\n---\n\n## Наступний урок\n\nУ наступному модулі ми продовжимо історію Київської Русі: розквіт держави за Володимира Великого та Ярослава Мудрого, хрещення Русі, «Руська Правда» — перший збірник законів."
      }
    ],
    "rawMarkdown": "---\ntitle: \"History: Kyivan Rus I\"\nsubtitle: \"Київська Русь I: Виникнення\"\nphase: B2.2\nduration: 50\ntransliteration: none\ntags: [history, kyivan-rus, decolonization, myth-busting]\nobjectives:\n  - Зрозуміти походження Київської Русі\n  - Розвінчати міф «Русь = Росія»\n  - Вивчити історичну термінологію\n  - Критично аналізувати історичні наративи\n---\n\n# Зміст уроку\n\n## Вступ: Найбільша крадіжка в історії\n\nУявіть, що хтось вкрав вашу історію.\n\nНе просто якусь частину — а *всю* вашу історію. Ваших предків. Ваших героїв. Ваші храми, книги, традиції. І почав стверджувати, що це все — його.\n\nСаме це сталося з Київською Руссю.\n\nУ 1721 році Петро I, московський цар, вирішив, що йому потрібна нова назва для своєї держави. Стара назва — «Московія» або «Московське царство» — звучала занадто... провінційно. Він хотів імперію. Він хотів легітимність. Він хотів стародавню історію.\n\nІ він просто *взяв* її.\n\nПетро оголосив, що відтепер Московія називається «Російська імперія», а московити — «росіяни». А що таке «Русь»? Ну, це ж очевидно — «Русь» і «Росія» — одне й те саме, правда? Отже, Київ — це «російське» місто, а Київська Русь — «колиска російської державності».\n\nОдин підпис — і тисяча років української історії стала «російською».\n\nЦе не перебільшення. Це буквально те, що сталося. І наслідки цієї крадіжки ми відчуваємо досі — кожного разу, коли російський пропагандист каже, що «українці — це просто росіяни, які забули, хто вони».\n\nСьогодні ми відновлюємо правду. Ми розповімо справжню історію Київської Русі — української середньовічної держави, яку Москва так відчайдушно намагається привласнити.\n\n---\n\n## Розминка: Перевірте свої знання\n\nПерш ніж продовжити — маленький тест. Що з цього правда?\n\n| Твердження | Ваша відповідь |\n|------------|----------------|\n| Москва була столицею Київської Русі | Так / Ні |\n| «Русь» і «Росія» — синоніми | Так / Ні |\n| Київ заснований раніше за Москву | Так / Ні |\n| Московити завжди називали себе «русами» | Так / Ні |\n\n**Правильні відповіді:**\n- Москва була столицею Русі? **Ні.** (Москва заснована через 265 років після Києва!)\n- «Русь» і «Росія» — синоніми? **Ні.** (Це різні поняття)\n- Київ заснований раніше за Москву? **Так.** (882 vs 1147)\n- Московити завжди називали себе «русами»? **Ні.** (Лише з XVIII століття)\n\nЯкщо ви помилилися — не хвилюйтеся. Саме для цього ми тут.\n\n---\n\n## Частина 1: Що таке «Русь»? Три теорії\n\nПочнемо з головного питання: звідки взагалі взялася назва «Русь»?\n\nЦе питання археологи та лінгвісти обговорюють уже понад століття. І є три основні теорії.\n\n### Теорія 1: Норманська (скандинавська)\n\nЦя теорія стверджує, що «Русь» походить від фінського слова «ruotsi», яким фіни називали скандинавів. А скандинави (варяги) були купцями та воїнами, які мандрували річками від Балтики до Чорного моря.\n\n**Докази:** У скандинавських сагах згадується «Garðaríki» (Країна городів) — так вікінги називали землі на сході. Також багато імен перших київських князів — явно скандинавські: Олег (Helgi), Ігор (Ingvar), Ольга (Helga).\n\n**Контраргумент:** Навіть якщо назва прийшла від варягів, *населення* було слов'янським. Варяги — це верхівка, еліта, яка швидко асимілювалася. Вже внук Рюрика — Святослав — мав слов'янське ім'я.\n\n### Теорія 2: Слов'янська (від річки Рось)\n\nЦя теорія пропонує простіше пояснення: «Русь» — від річки Рось, що впадає в Дніпро неподалік від Києва. Річка давала назву племенам, які жили на її берегах, а потім — усій державі.\n\n**Докази:** Багато українських топонімів пов'язані з коренем «рос/рус»: Рось, Росава, Росія (село в Сумській області, не плутати з державою-агресором).\n\n**Контраргумент:** Лінгвісти сперечаються, чи була річка названа на честь людей, чи люди — на честь річки.\n\n### Теорія 3: Іранська (сарматська)\n\nНайекзотичніша теорія пов'язує «Русь» із давньоіранським словом «ruxs» або «roxs», що означає «світлий, сяючий». Сармати, іраномовний народ, який жив у степах України до слов'ян, могли залишити цю назву.\n\n**Докази:** Деякі античні автори згадують «роксоланів» (roxolani) — буквально «світлих аланів». Можливо, цей етнонім перейшов до слов'ян.\n\n---\n\n> **Чи знали ви?**\n>\n> У XIX столітті «норманська теорія» стала політичною зброєю. Деякі російські історики використовували її, щоб стверджувати: «Слов'яни не могли самі створити державу — їм потрібні були германці». Це відверто расистський аргумент. Українські історики відповідали: навіть якщо Рюрик був скандинавом, держава будувалася слов'янами на слов'янській землі слов'янською мовою.\n>\n> Сьогодні більшість серйозних істориків погоджуються: *походження* назви — менш важливе, ніж *реальність* держави. А реальність така: Київська Русь була слов'янською державою зі столицею в Києві. Крапка.\n\n---\n\n## Частина 2: Як виникла Київська Русь\n\nТепер — до фактів. Як саме постала ця держава?\n\n### Рюрик і варяги (862)\n\nЗгідно з «Повістю минулих літ» — найдавнішим українським літописом — слов'янські та фінські племена на півночі постійно воювали між собою. Втомившись від чвар, вони вирішили запросити зовнішнього правителя:\n\n*«Земля наша велика і багата, але порядку в ній немає. Прийдіть княжити і володіти нами.»*\n\nТак у 862 році Рюрик прийшов до Новгорода і став першим князем. Чи це історичний факт, чи легенда — досі дискутується. Але важливо інше: Рюрик правив *Новгородом*, не Києвом.\n\n### Олег і створення держави (882)\n\nСправжнім засновником Київської Русі вважається Олег — родич (можливо, шурин) Рюрика. У 882 році Олег зібрав військо і рушив на південь — до Києва.\n\nУ Києві на той час правили Аскольд і Дір — теж варяги. Олег хитрістю вбив їх і захопив місто. А потім сказав слова, які стали символом української державності:\n\n*«Хай буде Київ матір'ю міст руських!»*\n\nНе Новгород. Не Ладога. Київ. Саме Київ став центром нової держави. І залишався ним наступні 350 років.\n\n---\n\n> **Міф vs Факт**\n>\n> ❌ **Міф:** «Русь починалася з Новгорода, тому її спадкоємиця — Москва (яка ближче до Новгорода).»\n>\n> ✅ **Факт:** Рюрик дійсно спочатку правив у Новгороді, але *державу* створив Олег, і він одразу проголосив столицею *Київ*. Новгород залишався важливим містом, але завжди був підпорядкований Києву. А Москви взагалі не існувало ще 265 років. Говорити, що Москва — «спадкоємиця Русі», бо Новгород був на півночі — це як казати, що Румунія — спадкоємиця Римської імперії, бо теж починається на «Р».\n\n---\n\n### Хронологія перших правителів\n\n| Роки | Правитель | Головне |\n|------|-----------|---------|\n| 862-879 | Рюрик | Прийшов до Новгорода |\n| 879-912 | Олег | Захопив Київ, створив державу |\n| 912-945 | Ігор | Походи на Візантію, загинув від древлян |\n| 945-964 | Ольга | Регентша при малому Святославі |\n| 964-972 | Святослав | Великий воїн, походи на схід |\n\n### Олег Віщий: перший геополітик\n\nОлег правив 30 років, і за цей час перетворив Русь на серйозну силу. У 907 році він здійснив неймовірний похід на Константинополь (Царгород) — столицю Візантійської імперії, наймогутнішої держави тогочасного світу.\n\nЗа легендою, Олег прибив свій щит до воріт Царгорода — символ перемоги. Візантійці погодились платити данину і підписали вигідний для Русі торговий договір.\n\nЧи прибивав Олег щит насправді? Ми не знаємо. Але договір із Візантією — це історичний факт. Текст договору зберігся в літописах.\n\n---\n\n> **Чи знали ви?**\n>\n> Прізвисько «Віщий» Олег отримав за свою здатність передбачати події. Але помер він, за легендою, від того, чого не передбачив — від укусу змії, яка вилізла з черепа його мертвого коня. Ця історія стала основою для знаменитої «Пісні про віщого Олега» Олександра Пушкіна — одного з небагатьох творів російського поета, де він *не* намагається привласнити українську історію.\n\n---\n\n### Княгиня Ольга: перша християнка\n\nОльга — одна з найцікавіших постатей ранньої Русі. Після загибелі її чоловіка Ігоря від рук древлян (вони розірвали його між двома деревами за надмірне збирання данини), Ольга помстилася так жорстоко, що це стало легендою.\n\nСпочатку вона закопала живцем древлянських послів. Потім спалила другу групу послів у лазні. Потім влаштувала тризну (поминальний бенкет) біля древлянської столиці Іскоростеня — і вирізала п'ять тисяч п'яних древлян. А на завершення — спалила саме місто за допомогою горобців та голубів, до лапок яких прив'язали тліючу сірку.\n\nПісля такої помсти Ольга... прийняла християнство. У Константинополі. Вона стала першою правителькою Русі, яка хрестилася — задовго до офіційного хрещення Русі її онуком Володимиром.\n\n---\n\n> **Чи знали ви?**\n>\n> Ольга — єдина жінка в історії Русі, яка канонізована як *рівноапостольна* святая. Цей титул означає, що її внесок у поширення християнства прирівнюється до внеску апостолів. В усій історії християнства цей титул отримали лише п'ятеро жінок — і Ольга серед них.\n\n---\n\n## Частина 3: Чому «Русь» — це Україна, не Росія\n\nА тепер — найважливіша частина. Чому ми категорично стверджуємо, що Київська Русь — українська, а не російська?\n\n### Аргумент 1: Географія\n\nЦе найпростіший аргумент. Подивіться на карту:\n\n- **Київ** (столиця Русі) — сьогодні столиця України\n- **Чернігів** (друге за значенням місто) — в Україні\n- **Переяслав** (місто княжих з'їздів) — в Україні\n- **Галич** (столиця Галицького князівства) — в Україні\n\nА де Москва? Москву *засновано в 1147 році* — через 265 років після створення Київської Русі. І навіть тоді це було маленьке село на периферії. Москва *ніколи* не була частиною власне Київської Русі — вона входила до Володимиро-Суздальського князівства, яке відокремилось від Києва.\n\n### Аргумент 2: Мова\n\nМова Київської Русі — давньоруська (або давньоукраїнська, як її називають українські лінгвісти). Сучасні лінгвістичні дослідження показують, що:\n\n- Давньоруська мова *найближча* до сучасної української\n- Російська мова сформувалася значно пізніше, під впливом фіно-угорських та тюркських мов\n- Багато слів, які збереглися в українській, зникли з російської\n\nНаприклад, українське слово «працювати» — це давньоруське «працювати». Російське «работать» — від слова «раб» (робити роботу як раб). Яка мова ближча до оригіналу?\n\n### Аргумент 3: Культура\n\nКультурні пам'ятки Київської Русі — всі в Україні:\n\n- **Софія Київська** (1037) — найважливіший храм Русі, стоїть у Києві\n- **Києво-Печерська лавра** — духовний центр Русі, у Києві\n- **Десятинна церква** — перша кам'яна церква Русі, була в Києві\n\nА що в Москві? *Нічого* з часів Київської Русі. Бо Москви тоді *не існувало*.\n\n### Аргумент 4: Самоназва\n\nОсь найцікавіший факт: московити *не називали себе «русами»* до XVIII століття!\n\nКоли в XV-XVI століттях московські правителі почали претендувати на «руську» спадщину, вони не говорили «ми — Русь». Вони говорили «ми — спадкоємці Русі», що зовсім інше.\n\nНавіть у назвах: Московія, Московське царство, московити — не «Русь», не «руси». Лише Петро I у 1721 році *примусово* перейменував державу на «Російську імперію».\n\n---\n\n> **Міф vs Факт**\n>\n> ❌ **Міф:** «Українці та росіяни — один народ, тому Русь — спільна спадщина.»\n>\n> ✅ **Факт:** Ця теза — основа путінської пропаганди, яку він виклав у статті 2021 року. Але історичні факти говорять інше: українці та росіяни — різні народи з різною історією, мовою та культурою. Так, є спільне коріння — як у французів та італійців є спільне римське коріння. Але це не робить Францію та Італію «одним народом». Русь — це українська спадщина. Москва може мати свою історію — Московії, яка виникла пізніше і розвивалася окремо.\n\n---\n\n## Частина 4: Крадіжка історії — як це сталося\n\nЯк московитам вдалося «вкрасти» Русь? Це не сталося за одну ніч — це був довгий процес.\n\n### Крок 1: Претензії московських царів (XV-XVII ст.)\n\nПісля падіння Києва від монголів (1240) різні князівства претендували на «руську» спадщину. Московські князі — теж. Вони почали називати себе «государями всея Русі», хоча *фактично* більшість руських земель їм не належала.\n\n### Крок 2: Перейменування Московії (1721)\n\nПетро I офіційно перейменував Московію на «Російську імперію», а московитів — на «росіян». Це був маркетинговий хід: «Росія» звучить як «Русь», що створює ілюзію спадкоємності.\n\n### Крок 3: Переписування історії (XVIII-XIX ст.)\n\nРосійські історики почали систематично переписувати історію. Вони:\n- Називали Київську Русь «Древнерусское государство» (давньоруська держава), ігноруючи слово «Київ»\n- Стверджували, що «руси» = «росіяни»\n- Применшували роль Києва і перебільшували роль Новгорода та Москви\n\n### Крок 4: Радянська історіографія (XX ст.)\n\nСРСР продовжив цю традицію. У радянських підручниках Київська Русь подавалась як «спільна колиска» трьох «братніх народів» — росіян, українців та білорусів. При цьому «старший брат» (росіяни) чомусь успадкував *всю* спадщину.\n\n### Крок 5: Путінська пропаганда (XXI ст.)\n\nСьогодні Путін використовує ці міфи для виправдання війни. Його логіка: «Якщо Київська Русь — російська, то Київ — російське місто. А отже, Україна не має права на існування».\n\nСаме тому *знання правдивої історії — це акт спротиву*.\n\n---\n\n> **Чи знали ви?**\n>\n> У 2021 році Путін опублікував статтю «Про історичну єдність росіян та українців», де виклав усі ці міфи. Українські історики назвали статтю «маніфестом імперіалізму» та «історичною фальсифікацією». Через рік Росія почала повномасштабне вторгнення. Крадіжка історії — це не академічна дискусія. Це підготовка до війни.\n\n---\n\n## Термінологія: Важливі слова\n\n| Термін | Переклад | Пояснення |\n|--------|----------|-----------|\n| Русь | Rus | Історична назва держави та народу |\n| руси / русини | Ruthenians | Мешканці Русі (НЕ «росіяни»!) |\n| руський (давньоукр.) | Ruthenian | Прикметник від «Русь», НЕ «російський» |\n| давньоруський | Old Rus / Old Ukrainian | Мова та культура Русі |\n| Московія | Muscovy | Московське царство до 1721 р. |\n| московити | Muscovites | Мешканці Московії до 1721 р. |\n| варяги | Varangians | Скандинавські воїни-торговці |\n\n**Важливо:** Англійською часто плутають «Russian» (російський) і «Ruthenian» (руський). Це *різні* слова! Коли йдеться про Київську Русь, правильний переклад — «Ruthenian» або «Rus'», НЕ «Russian».\n\n---\n\n## Практика\n\n### Завдання 1: Заповніть пропуски\n\n1. Олег проголосив Київ «___ містам руським».\n   > [!answer] **матір'ю**\n2. Москву засновано в ___ році, через 265 років після Києва.\n   > [!answer] **1147**\n3. Петро I перейменував Московію на ___ імперію.\n   > [!answer] **Російську**\n4. Давньоруська мова найближча до сучасної ___.\n   > [!answer] **української**\n5. Софію Київську збудовано в ___ році.\n   > [!answer] **1037**\n### Завдання 2: Правда чи міф?\n\n| Твердження | П / М |\n|------------|-------|\n| 1. Москва була столицею Київської Русі. | **М** |\n| 2. Олег Віщий захопив Київ у 882 році. | **П** |\n| 3. Московити завжди називали себе «русами». | **М** |\n| 4. Ольга — перша правителька Русі, яка хрестилася. | **П** |\n| 5. «Русь» і «Росія» — історично одне й те саме. | **М** |\n\n### Завдання 3: Перекладіть (використовуйте пасив де доречно)\n\n1. Kyiv was founded centuries before Moscow.\n   > [!answer] **Київ засновано за століття до Москви.**\n2. The myth that Russia inherited Rus is false.\n   > [!answer] **Міф про те, що Росія успадкувала Русь, — хибний.**\n3. The treaty with Byzantium was signed by Oleg.\n   > [!answer] **Договір із Візантією було підписано Олегом.**\n4. Sophia Cathedral was built in 1037.\n   > [!answer] **Софію Київську збудовано в 1037 році.**\n---\n\n## Продукція\n\n### Обговоріть\n\n1. Чому Росія так відчайдушно намагається привласнити історію Русі? Яка в цьому вигода?\n\n2. Як імперські міфи використовуються для виправдання війни? Наведіть приклади.\n\n3. Що означає «деколонізація історії»? Як ви можете долучитися до цього процесу?\n\n### Напишіть (150-200 слів)\n\nУявіть, що ви пояснюєте іноземцю, чому Київська Русь — українська, а не російська держава. Напишіть короткий текст із трьома головними аргументами.\n\n---\n\n# Вправи\n\n## quiz: Київська Русь — факти та міфи\n\n> Виберіть правильну відповідь.\n\n1. Коли Олег захопив Київ і проголосив його столицею Русі?\n   - [ ] у 862 році\n   - [x] у 882 році\n   - [ ] у 1147 році\n   > 862 — прихід Рюрика до Новгорода. 1147 — заснування Москви.\n\n2. Москву засновано:\n   - [ ] до Київської Русі\n   - [ ] одночасно з Києвом\n   - [x] через 265 років після Києва\n   > Київ — 882, Москва — 1147.\n\n3. Петро I перейменував Московію на Російську імперію:\n   - [ ] у X столітті\n   - [ ] у XV столітті\n   - [x] у 1721 році (XVIII ст.)\n   > Це був маркетинговий хід для «крадіжки» руської спадщини.\n\n4. Давньоруська мова найближча до:\n   - [x] сучасної української\n   - [ ] сучасної російської\n   - [ ] сучасної білоруської\n   > Лінгвістичні дослідження підтверджують це.\n\n5. Княгиня Ольга відома тим, що:\n   - [ ] заснувала Київ\n   - [x] перша з правителів Русі прийняла християнство\n   - [ ] написала «Повість минулих літ»\n   > Вона хрестилася в Константинополі.\n\n6. **[Інтеграція: пасив]** Офіційний документ: «Договір із Візантією ___ у 907 році.»\n   - [x] підписано\n   - [ ] підписували\n   - [ ] підписується\n   > Офіційний історичний текст → -но/-то.\n\n7. **[Інтеграція: регістр]** Науковий текст: «Походження назви «Русь» ___ багатьма дослідниками.»\n   - [ ] досліджено\n   - [x] досліджується\n   - [ ] досліджували\n   > Науковий стиль, тривалий процес → -ся.\n\n8. Який аргумент НЕ підтверджує, що Русь — українська?\n   - [ ] Київ — столиця Русі — в Україні\n   - [ ] Давньоруська мова найближча до української\n   - [x] Москва називала себе «Руссю» з IX століття\n   > Москва почала називатися «Росією» лише з 1721 року.\n\n---\n\n# Словник\n\n| Слово | Вимова | Переклад | Приклад |\n|-------|--------|----------|---------|\n| Русь | /rusʲ/ | Rus | Київська Русь — українська держава. |\n| русини | /ruˈsɪnɪ/ | Ruthenians | Русини — мешканці Русі. |\n| варяги | /wɑˈrʲaɦɪ/ | Varangians | Варяги торгували по річках. |\n| племена | /plɛˈmɛnɑ/ | tribes | Слов'янські племена об'єдналися. |\n| заснувати | /zɑsnuˈwɑtɪ/ | to found (pf) | Олег заснував державу зі столицею в Києві. |\n| об'єднати | /ɔbˈjɛdnɑtɪ/ | to unite (pf) | Він об'єднав різні племена. |\n| захопити | /zɑxɔˈpɪtɪ/ | to capture (pf) | Олег захопив Київ у 882 році. |\n| правити | /prɑˈwɪtɪ/ | to rule (impf) | Ольга правила як регентша. |\n| спадщина | /ˈspɑdʃt͡ʃɪnɑ/ | heritage, legacy | Русь — українська спадщина. |\n| спадкоємність | /spɑdkɔˈjɛmnʲistʲ/ | succession | Московські претензії на спадкоємність — хибні. |\n| імперія | /ʲimˈpɛrʲijɑ/ | empire | Російська імперія виникла в 1721 році. |\n| розвінчати | /rɔzwʲinˈtʃɑtɪ/ | to debunk (pf) | Розвінчати імперські міфи. |\n| привласнити | /prɪwˈlɑsnɪtɪ/ | to appropriate (pf) | Росія намагається привласнити Русь. |\n| перейменувати | /pɛrɛjmɛnuˈwɑtɪ/ | to rename (pf) | Петро I перейменував Московію. |\n| фальсифікація | /fɑlʲsɪfʲiˈkɑt͡sʲijɑ/ | falsification | Історична фальсифікація — злочин. |\n\n---\n\n# Підсумок\n\n## Головні факти\n\n| Факт | Деталі |\n|------|--------|\n| Столиця Русі | Київ (з 882 року) |\n| Заснування Москви | 1147 рік (265 років пізніше!) |\n| Мова Русі | Давньоруська (найближча до української) |\n| Культурні пам'ятки | Софія Київська, Лавра — усі в Україні |\n| «Перейменування» | 1721: Московія → Російська імперія |\n\n## Імперський міф vs Правда\n\n| Міф | Правда |\n|-----|--------|\n| «Русь = Росія» | Русь — українська спадщина |\n| «Один народ» | Українці та росіяни — різні народи |\n| «Москва — спадкоємиця» | Москва виникла через 265 років |\n| «Спільна колиска» | Колиска стояла в Києві |\n\n---\n\n> **Чому це важливо**\n>\n> Знання правдивої історії — це не просто академічна вправа. Це спротив. Коли ви знаєте, що Київська Русь — українська держава, ви позбавляєте Росію головного аргументу для агресії. Коли ви розповідаєте цю правду іншим, ви боретеся з імперською пропагандою.\n>\n> *Русь — це Україна. Київ — наша столиця. Ця історія — наша.*\n>\n> **Слава Україні!**\n\n---\n\n## Наступний урок\n\nУ наступному модулі ми продовжимо історію Київської Русі: розквіт держави за Володимира Великого та Ярослава Мудрого, хрещення Русі, «Руська Правда» — перший збірник законів.\n",
    "createdAt": "2025-12-05T01:15:58.029Z",
    "modifiedAt": "2025-12-05T01:15:58.029Z",
    "version": 2
  },
  "activities": [
    {
      "id": "act-a1-0-quiz",
      "type": "quiz",
      "title": "Київська Русь — факти та міфи",
      "description": "Виберіть правильну відповідь.",
      "content": {
        "type": "quiz",
        "questions": [
          {
            "question": "Коли Олег захопив Київ і проголосив його столицею Русі?",
            "options": [
              "у 862 році",
              "у 882 році",
              "у 1147 році"
            ],
            "correctIndex": 1,
            "explanation": "862 — прихід Рюрика до Новгорода. 1147 — заснування Москви."
          },
          {
            "question": "Москву засновано:",
            "options": [
              "до Київської Русі",
              "одночасно з Києвом",
              "через 265 років після Києва"
            ],
            "correctIndex": 2,
            "explanation": "Київ — 882, Москва — 1147."
          },
          {
            "question": "Петро I перейменував Московію на Російську імперію:",
            "options": [
              "у X столітті",
              "у XV столітті",
              "у 1721 році (XVIII ст.)"
            ],
            "correctIndex": 2,
            "explanation": "Це був маркетинговий хід для «крадіжки» руської спадщини."
          },
          {
            "question": "Давньоруська мова найближча до:",
            "options": [
              "сучасної української",
              "сучасної російської",
              "сучасної білоруської"
            ],
            "correctIndex": 0,
            "explanation": "Лінгвістичні дослідження підтверджують це."
          },
          {
            "question": "Княгиня Ольга відома тим, що:",
            "options": [
              "заснувала Київ",
              "перша з правителів Русі прийняла християнство",
              "написала «Повість минулих літ»"
            ],
            "correctIndex": 1,
            "explanation": "Вона хрестилася в Константинополі."
          },
          {
            "question": "**[Інтеграція: пасив]** Офіційний документ: «Договір із Візантією ___ у 907 році.»",
            "options": [
              "підписано",
              "підписували",
              "підписується"
            ],
            "correctIndex": 0,
            "explanation": "Офіційний історичний текст → -но/-то."
          },
          {
            "question": "**[Інтеграція: регістр]** Науковий текст: «Походження назви «Русь» ___ багатьма дослідниками.»",
            "options": [
              "досліджено",
              "досліджується",
              "досліджували"
            ],
            "correctIndex": 1,
            "explanation": "Науковий стиль, тривалий процес → -ся."
          },
          {
            "question": "Який аргумент НЕ підтверджує, що Русь — українська?",
            "options": [
              "Київ — столиця Русі — в Україні",
              "Давньоруська мова найближча до української",
              "Москва називала себе «Руссю» з IX століття"
            ],
            "correctIndex": 2,
            "explanation": "Москва почала називатися «Росією» лише з 1721 року."
          }
        ],
        "shuffleQuestions": true,
        "shuffleOptions": true,
        "showCorrectAnswers": true
      },
      "subject": "language",
      "owner": "curricula-opus",
      "visibility": "public",
      "language": "uk",
      "difficultyLevel": "B2",
      "duration": 5,
      "tags": [],
      "createdAt": "2025-12-05T01:15:58.029Z",
      "modifiedAt": "2025-12-05T01:15:58.029Z"
    }
  ],
  "vocabulary": {
    "moduleId": "mod-uk-B2-27",
    "level": "B2",
    "phase": "B2.2",
    "wordCount": 15,
    "newWordCount": 15,
    "reviewWordCount": 0,
    "transliterationMode": "none",
    "words": [
      {
        "id": "v-rusь-0-0",
        "uk": "Русь",
        "en": "Rus",
        "pos": "noun",
        "ipa": "/rusʲ/",
        "note": "Київська Русь — українська держава.",
        "isNew": true,
        "firstModule": 0
      },
      {
        "id": "v-rusyny-0-1",
        "uk": "русини",
        "en": "Ruthenians",
        "pos": "noun",
        "ipa": "/ruˈsɪnɪ/",
        "note": "Русини — мешканці Русі.",
        "isNew": true,
        "firstModule": 0
      },
      {
        "id": "v-varyahy-0-2",
        "uk": "варяги",
        "en": "Varangians",
        "pos": "noun",
        "ipa": "/wɑˈrʲaɦɪ/",
        "note": "Варяги торгували по річках.",
        "isNew": true,
        "firstModule": 0
      },
      {
        "id": "v-plemena-0-3",
        "uk": "племена",
        "en": "tribes",
        "pos": "noun",
        "ipa": "/plɛˈmɛnɑ/",
        "note": "Слов'янські племена об'єдналися.",
        "isNew": true,
        "firstModule": 0
      },
      {
        "id": "v-zasnuvaty-0-4",
        "uk": "заснувати",
        "en": "to found (pf)",
        "pos": "noun",
        "ipa": "/zɑsnuˈwɑtɪ/",
        "note": "Олег заснував державу зі столицею в Києві.",
        "isNew": true,
        "firstModule": 0
      },
      {
        "id": "v-ob'yednaty-0-5",
        "uk": "об'єднати",
        "en": "to unite (pf)",
        "pos": "noun",
        "ipa": "/ɔbˈjɛdnɑtɪ/",
        "note": "Він об'єднав різні племена.",
        "isNew": true,
        "firstModule": 0
      },
      {
        "id": "v-zakhopyty-0-6",
        "uk": "захопити",
        "en": "to capture (pf)",
        "pos": "noun",
        "ipa": "/zɑxɔˈpɪtɪ/",
        "note": "Олег захопив Київ у 882 році.",
        "isNew": true,
        "firstModule": 0
      },
      {
        "id": "v-pravyty-0-7",
        "uk": "правити",
        "en": "to rule (impf)",
        "pos": "noun",
        "ipa": "/prɑˈwɪtɪ/",
        "note": "Ольга правила як регентша.",
        "isNew": true,
        "firstModule": 0
      },
      {
        "id": "v-spadshchyna-0-8",
        "uk": "спадщина",
        "en": "heritage, legacy",
        "pos": "noun",
        "ipa": "/ˈspɑdʃt͡ʃɪnɑ/",
        "note": "Русь — українська спадщина.",
        "isNew": true,
        "firstModule": 0
      },
      {
        "id": "v-spadkoyemnistь-0-9",
        "uk": "спадкоємність",
        "en": "succession",
        "pos": "noun",
        "ipa": "/spɑdkɔˈjɛmnʲistʲ/",
        "note": "Московські претензії на спадкоємність — хибні.",
        "isNew": true,
        "firstModule": 0
      },
      {
        "id": "v-imperiya-0-10",
        "uk": "імперія",
        "en": "empire",
        "pos": "noun",
        "ipa": "/ʲimˈpɛrʲijɑ/",
        "note": "Російська імперія виникла в 1721 році.",
        "isNew": true,
        "firstModule": 0
      },
      {
        "id": "v-rozvinchaty-0-11",
        "uk": "розвінчати",
        "en": "to debunk (pf)",
        "pos": "noun",
        "ipa": "/rɔzwʲinˈtʃɑtɪ/",
        "note": "Розвінчати імперські міфи.",
        "isNew": true,
        "firstModule": 0
      },
      {
        "id": "v-pryvlasnyty-0-12",
        "uk": "привласнити",
        "en": "to appropriate (pf)",
        "pos": "noun",
        "ipa": "/prɪwˈlɑsnɪtɪ/",
        "note": "Росія намагається привласнити Русь.",
        "isNew": true,
        "firstModule": 0
      },
      {
        "id": "v-pereymenuvaty-0-13",
        "uk": "перейменувати",
        "en": "to rename (pf)",
        "pos": "noun",
        "ipa": "/pɛrɛjmɛnuˈwɑtɪ/",
        "note": "Петро I перейменував Московію.",
        "isNew": true,
        "firstModule": 0
      },
      {
        "id": "v-falьsyfikatsiya-0-14",
        "uk": "фальсифікація",
        "en": "falsification",
        "pos": "noun",
        "ipa": "/fɑlʲsɪfʲiˈkɑt͡sʲijɑ/",
        "note": "Історична фальсифікація — злочин.",
        "isNew": true,
        "firstModule": 0
      }
    ]
  }
}