{
  "$schema": "../../../schemas/vibe-module.schema.json",
  "lesson": {
    "id": "lesson-uk-B2-28",
    "moduleId": "mod-uk-B2-28",
    "languagePair": "l2-uk-en",
    "subject": "language",
    "owner": "curricula-opus",
    "visibility": "public",
    "language": "uk",
    "targetLevel": "B2",
    "phase": "B2.2",
    "moduleNumber": 28,
    "moduleType": "history",
    "immersionLevel": 0.85,
    "title": "History: Kyivan Rus II",
    "subtitle": "Київська Русь II: Золота доба",
    "description": "Вивчити золоту добу Київської Русі",
    "objectives": [
      "Вивчити золоту добу Київської Русі",
      "Ознайомитися з культурними досягненнями",
      "Зрозуміти значення хрещення Русі",
      "Читати історичні тексти"
    ],
    "grammarFocus": [],
    "tags": [
      "history",
      "kyivan-rus",
      "culture",
      "christianity"
    ],
    "totalDuration": 50,
    "transliterationMode": "none",
    "sections": [
      {
        "id": "section-зміст-уроку",
        "name": "Зміст уроку",
        "type": "content",
        "content": "## Вступ: Коли Київ був столицею Європи\n\nРік 1050. Уявіть Париж.\n\nЦе маленьке місто з брудними вулицями, дерев'яними будинками та населенням близько 25 тисяч осіб. Французький король Генріх I ледве вміє писати — як і більшість європейської знаті того часу. Бібліотеки? Університети? Лише в мріях.\n\nА тепер уявіть Київ того самого року.\n\nНаселення — понад 50 тисяч (удвічі більше за Париж). Кам'яні храми з золотими куполами. Величезні бібліотеки з тисячами книг. Школи при монастирях. Мозаїки такої краси, що їх порівнюють із найкращими візантійськими. Водогін (?!) — за шість століть до Версаля.\n\nІ дружина французького короля — киянка. Анна Ярославна, дочка київського князя Ярослава Мудрого. Вона привезла до Парижа слов'янське Євангеліє, яке французи вважали такою святинею, що королі присягали на ньому протягом наступних 500 років. Вона підписувала документи — в країні, де більшість знаті ставила хрестики замість підписів.\n\nЦе була золота доба Київської Русі. Епоха, коли Київ був одним із найбільших і найрозвиненіших міст Європи. Епоха Володимира Великого і Ярослава Мудрого. Епоха, яку ви маєте знати — бо це *ваша* історія.\n\n---\n\n## Розминка: Що ви вже знаєте?\n\nПеревірте себе:\n\n| Питання | Ваша відповідь |\n|---------|----------------|\n| Хто охрестив Русь? | ___ |\n| У якому році? | ___ |\n| Хто збудував Софію Київську? | ___ |\n| Як звали дочку Ярослава — королеву Франції? | ___ |\n| У якому році Київ захопили монголи? | ___ |\n\n**Відповіді:** Володимир Великий, 988, Ярослав Мудрий, Анна, 1240.\n\nЯкщо ви відповіли правильно на все — чудово! Але сьогодні ви дізнаєтесь набагато більше, ніж сухі факти.\n\n---\n\n## Частина 1: Володимир Великий — людина, яка змінила все\n\nВолодимир Святославич (близько 958-1015) — одна з найсуперечливіших постатей української історії. Язичник, що став святим. Братовбивця, що став будівничим нації. Людина з сотнями дружин, що стала символом християнської моралі.\n\n### Шлях до влади\n\nІсторія Володимира починається з крові. Буквально.\n\nВін був одним із синів Святослава Хороброго — того самого, який воював із візантійцями та казав ворогам «Іду на ви!» перед кожним походом. Після смерті Святослава почалася війна між його синами.\n\nВолодимир спочатку програв. Його брат Ярополк вбив іншого брата Олега і захопив Київ. Володимир втік до Скандинавії — до варягів.\n\nТам він зібрав військо і повернувся. У 980 році він захопив Київ, вбив Ярополка — і став єдиним князем Русі.\n\nТак починалося правління людини, якого церква назве «рівноапостольним».\n\n### Язичницька реформа (перша спроба)\n\nПерша спроба Володимира об'єднати Русь була... дивною. Він вирішив реформувати язичництво. У 980 році він звів пантеон богів на київській горі — Перуна (бога грому), Хорса (бога сонця), Дажбога, Стрибога, Симаргла та Мокошу.\n\nЦе не спрацювало. Язичництво було занадто різноманітним — кожне плем'я мало своїх богів, свої обряди, свої традиції. Єдиний пантеон не міг їх об'єднати.\n\nВолодимир зрозумів: потрібна нова релігія. Одна для всіх.\n\n---\n\n> **Чи знали ви?**\n>\n> «Повість минулих літ» розповідає, що Володимир влаштував своєрідний «конкурс релігій». До нього прийшли посланці від мусульман (Булгарія), іудеїв (Хозарія), католиків (Німеччина) та православних (Візантія).\n>\n> Мусульманам Володимир нібито сказав: «Пити — веселість Русі, не можемо без цього». Іудеїв запитав: «А де ваша земля?» — і коли вони визнали, що Бог розсіяв їх по світу за гріхи, відповів: «То чого ж ви інших вчите?»\n>\n> Про візантійське православ'я посли сказали найкрасномовніше: «Ми не знали, чи на небі ми, чи на землі. Бо на землі немає такої краси».\n>\n> Звісно, це легенда. Реальні причини вибору були політичними та економічними. Але легенда показує, як русини пояснювали свій вибір — через *красу* і *радість*.\n\n---\n\n### Хрещення Русі (988)\n\n988 рік. Володимир приймає хрещення в Корсуні (Херсонесі) в Криму. Там же він одружується з візантійською принцесою Анною — сестрою імператорів Василія II та Костянтина VIII.\n\nЦе був унікальний дипломатичний успіх. Візантійські принцеси *не* виходили заміж за «варварів». Це було безпрецедентно. Володимир отримав не просто дружину — він отримав легітимність на рівні візантійських імпероторів.\n\nПовернувшись до Києва, Володимир наказав скинути статую Перуна в Дніпро і охрестити киян. За легендою, це відбулося масово — люди заходили в річку цілими сім'ями.\n\n*«І була радість велика на небі і на землі, бо стільки душ спасалося.»* — так описує цю подію літопис.\n\n### Що змінилося після хрещення?\n\nХрещення було не просто зміною релігії. Це була культурна революція:\n\n| До хрещення | Після хрещення |\n|-------------|----------------|\n| Язичницькі боги | Єдиний Бог, єдина церква |\n| Усна традиція | Писемність (кирилиця) |\n| Племінні звичаї | Єдиний закон |\n| Ізоляція | Зв'язки з Візантією та Європою |\n| Кремація | Поховання |\n\nРазом із християнством прийшла *освіта*. Візантійці привезли книги, вчителів, архітекторів, художників. За одне-два покоління Русь із «варварської» держави перетворилася на один із культурних центрів Європи.\n\n---\n\n> **Міф vs Факт**\n>\n> ❌ **Міф:** «Хрещення Русі було насильницьким — Володимир примусив усіх хреститися під загрозою смерті.»\n>\n> ✅ **Факт:** Хрещення дійсно було примусовим у тому сенсі, що це було рішення князя, а не народне волевиявлення. Але масових репресій не було. Язичництво співіснувало з християнством ще кілька століть — особливо на периферії. Навіть сьогодні в українській культурі є елементи язичництва: Купало, колядки, писанки. Реальність була складнішою за чорно-білі міфи.\n\n---\n\n## Частина 2: Ярослав Мудрий — будівничий цивілізації\n\nЯкщо Володимир створив підґрунтя, то Ярослав Володимирович (близько 978-1054) побудував на ньому цивілізацію.\n\n### Знову війна за престол\n\nІсторія повторюється. Після смерті Володимира в 1015 році почалася нова усобиця. Син Святополк (прозваний «Окаянним») убив трьох своїх братів — Бориса, Гліба та Святослава.\n\nБорис і Гліб відмовилися воювати проти старшого брата, бо вважали це гріхом. Їх убили беззбройних. Пізніше церква канонізувала їх як перших руських святих — символів смирення та братньої любові.\n\nЯрослав, який правив у Новгороді, зібрав військо і виступив проти Святополка. Війна тривала чотири роки. Нарешті, у 1019 році Ярослав переміг і став київським князем.\n\n### «Руська правда» — перший звід законів\n\nОдне з найважливіших досягнень Ярослава — «Руська правда». Це перший писаний звід законів у Східній Європі.\n\nЧому це важливо? До «Руської правди» судили за звичаєвим правом — тобто кожен суддя вирішував сам, як карати злочинця. Це призводило до хаосу та несправедливості.\n\n«Руська правда» встановила:\n- **Фіксовані штрафи** за злочини (замість кровної помсти)\n- **Права різних верств** (бояри, смерди, холопи)\n- **Процедуру суду** (свідки, докази)\n- **Захист власності** (покарання за крадіжку)\n\n---\n\n> **Чи знали ви?**\n>\n> «Руська правда» забороняла *кровну помсту* — практику, коли рід жертви мав право вбити злочинця або його родича. Замість цього встановлювався штраф — «віра». За вбивство вільної людини треба було заплатити 40 гривень. За вбивство княжого слуги — 80 гривень.\n>\n> Цікаво, що жінки та чоловіки мали *однаковий* правовий захист — незвичайно для середньовіччя. «Руська правда» каже: «За убивство жінки — та сама віра, що за чоловіка».\n>\n> Порівняйте із Західною Європою того часу, де жінки часто взагалі не мали правового статусу!\n\n---\n\n### Софія Київська — символ величі\n\nУ 1037 році Ярослав заклав Софію Київську — головний собор Русі. Це була не просто церква. Це був символ нової ери.\n\nСобор будували візантійські та місцеві майстри. 13 куполів (символізують Христа та 12 апостолів). Мозаїки із золотим тлом. Фрески, що зберігаються досі — через майже тисячу років!\n\nЦентральна мозаїка — Богородиця Оранта — стала символом Києва. Її називають «Нерушимою стіною», бо вона вистояла всі напади, пожежі, війни. Навіть коли монголи спалили Київ у 1240 році — Софія вціліла.\n\n**Софія стоїть і сьогодні.** Тепер це музей, але щоразу, коли ви дивитесь на ці мозаїки — ви дивитесь на ту саму красу, яку бачили кияни тисячу років тому. *Ваші предки*.\n\n---\n\n> **Чи знали ви?**\n>\n> Софія Київська — не просто церква. Це була ще й *бібліотека*. Ярослав зібрав там одну з найбільших книгозбірень Європи. За його наказом перекладали книги з грецької, латини, болгарської. Створювали нові твори.\n>\n> Сам Ярослав, за словами літопису, «книги любив, читаючи їх вдень і вночі». У часи, коли більшість європейських королів були неписьменними, київський князь був бібліофілом.\n>\n> Куди поділася бібліотека Ярослава? Ніхто не знає. Можливо, її сховали під час монгольської навали. Можливо, вона згоріла. Пошуки «бібліотеки Ярослава Мудрого» тривають досі — це одна з найбільших загадок української історії.\n\n---\n\n### Династичні зв'язки — Русь у центрі Європи\n\nЯрослав розумів: дипломатія — це шлюби. Він одружив своїх дітей із найвпливовішими європейськими родинами:\n\n| Дитина | Партнер | Країна |\n|--------|---------|--------|\n| Анна | Генріх I | Франція |\n| Єлизавета | Гаральд III Суворий | Норвегія |\n| Анастасія | Андраш I | Угорщина |\n| Ізяслав | Гертруда Польська | Польща |\n| Святослав | Ода Штаденська | Німеччина |\n| Всеволод | дочка Костянтина IX | Візантія |\n\nПодивіться на цей список. Франція, Норвегія, Угорщина, Польща, Німеччина, Візантія. Київська Русь була *в центрі* європейської політики.\n\n### Анна Ярославна — королева Франції\n\nАнна заслуговує окремої розповіді.\n\nУ 1051 році вона вийшла заміж за французького короля Генріха I. Їй було близько 19 років, йому — 43. Це був політичний шлюб, але Анна справила величезний вплив на Францію.\n\nВона привезла із Києва слов'янське Євангеліє (так зване «Реймське Євангеліє»). Французи вважали його такою святинею, що наступні королі присягали на ньому при коронації. Цю традицію зберігали *500 років* — до Французької революції!\n\nПісля смерті Генріха Анна була регенткою при малолітньому сині Філіпі I. Вона підписувала державні документи — причому *кирилицею*: «Анна ръина» (Анна-королева). Це єдині документи того часу, підписані королевою власноруч.\n\n---\n\n> **Міф vs Факт**\n>\n> ❌ **Міф:** «Анна Ярославна не любила Францію і скаржилася на примітивність французів.»\n>\n> ✅ **Факт:** Немає жодних історичних джерел, де Анна скаржиться на Францію. Знаменитий «лист», де вона нібито пише батькові «в яку варварську країну ти мене послав», — це **підробка XIX століття**, створена французьким істориком Левеком. Справжніх листів Анни не збереглося. Легенда красива, але неправдива.\n>\n> Що ми знаємо напевно: Анна заснувала монастир у Санлісі, була активною в політиці, і французи шанували її настільки, що поховали в королівському абатстві. Не схоже на «нещасну вигнанку».\n\n---\n\n## Частина 3: Занепад — як усе закінчилося\n\nПісля смерті Ярослава в 1054 році почався повільний, але невпинний занепад.\n\n### Усобиці\n\nЯрослав залишив детальний заповіт: як сини мають ділити владу, хто де княжує, як вирішувати суперечки. Але це не допомогло.\n\nУже в наступному поколінні почалися війни. Брати воювали з братами. Племінники — з дядьками. Київ переходив із рук в руки.\n\nНайгірше, що князі *запрошували чужинців* для допомоги у внутрішніх війнах. Половці (кочовий народ із степів) стали постійними «гостями» в руських землях. Іноді як вороги, іноді як союзники — але завжди грабуючи мирне населення.\n\n### Роздробленість\n\nДо XII століття єдина Київська Русь розпалася на десятки князівств:\n- Київське\n- Чернігівське\n- Переяславське\n- Галицьке\n- Волинське\n- Новгородське\n- Володимиро-Суздальське\n- та інші\n\nКожне князівство мало свого князя, своє військо, свою політику. Київ залишався формально «старшим», але реальна влада великого князя слабшала з кожним поколінням.\n\n### Монгольська навала (1237-1240)\n\nУ 1237 році з востоку прийшла катастрофа.\n\nМонгольська орда під проводом хана Батия (онука Чингісхана) вторглася в руські землі. Це була найбільша військова машина того часу — дисциплінована, жорстока, нездоланна.\n\nОдне за одним падали руські міста. Рязань. Володимир. Москва (тоді ще маленьке містечко). Князі намагалися чинити опір — і гинули.\n\nУ грудні 1240 року орда підійшла до Києва.\n\n---\n\n> **Чи знали ви?**\n>\n> Італійський посол Плано Карпіні проїжджав через Київ у 1246 році — через шість років після монгольської навали. Ось що він написав:\n>\n> *«Коли ми їхали через їхню землю, ми бачили незліченні голови та кістки мертвих людей, що лежали на полях. Місто Київ було дуже великим і густо населеним, а тепер воно зведене майже ні до чого: ледве двісті будинків там залишилося, і люди ці перебувають у найбільшому рабстві.»*\n>\n> Двісті будинків. У місті, яке мало 50 тисяч населення. Ось що таке була монгольська навала.\n\n---\n\n### Падіння Києва (1240)\n\nЛітопис так описує облогу:\n\n*«Прийшов Батий до Києва з великою силою, з множеством воїнів своїх, і оточив місто. Неможливо було почути один одного в місті від скрипу возів, ревіння верблюдів та іржання коней.»*\n\nКияни оборонялися відчайдушно. Командував обороною тисяцький Дмитро — навіть не князь (князь Данило Галицький у той час був за кордоном). Монголи застосували облогові машини, пробили стіни і ввірвалися в місто.\n\nОстанній рубіж оборони — Десятинна церква, перша кам'яна церква Русі. Там сховалися жінки, діти, старі. Монголи зруйнували церкву разом із людьми всередині.\n\n*Київ упав.*\n\nЦе не був кінець української історії — але це був кінець Київської Русі як єдиної держави.\n\n---\n\n> **Міф vs Факт**\n>\n> ❌ **Міф:** «Після монгольської навали Русь \"переїхала\" в Москву.»\n>\n> ✅ **Факт:** Ніякого «переїзду» не було. Галицько-Волинське князівство (на заході сучасної України) продовжувало існувати як незалежна держава ще 100 років. Його князь Данило Галицький у 1253 році отримав королівську корону від Папи Римського. Справжнім наступником Київської Русі було Галицько-Волинське королівство — а не Московія, яка була периферійним улусом Золотої Орди.\n\n---\n\n## Спадщина Київської Русі\n\nЩо залишила нам Київська Русь?\n\n| Сфера | Спадщина |\n|-------|----------|\n| **Віра** | Православне християнство (українське, не московське) |\n| **Мова** | Основа сучасної української мови |\n| **Право** | «Руська правда» — традиція писаного закону |\n| **Культура** | Літописи, архітектура, мистецтво |\n| **Ідентичність** | Назва «Русь», «руський» — це *ми* |\n| **Території** | Київ, Чернігів, Галич — *українські* міста |\n\n---\n\n## Практика\n\n### Завдання 1: Хронологія\n\nРозставте події в правильному порядку:\n\n1. Хрещення Русі\n2. Заснування Софії Київської\n3. Падіння Києва (монголи)\n4. «Руська правда»\n5. Шлюб Анни Ярославни\n\n**Відповідь:** 1 (988) → 4 (1016-1054) → 2 (1037) → 5 (1051) → 3 (1240)\n\n### Завдання 2: Заповніть пропуски\n\n1. Володимир охрестив Русь у ___ році.\n   > [!answer] **988**\n2. Ярослав Мудрий збудував ___ у 1037 році.\n   > [!answer] **Софію Київську**\n3. «___» — перший звід законів Русі.\n   > [!answer] **Руська правда**\n4. Анна Ярославна стала королевою ___.\n   > [!answer] **Франції**\n5. Монголи зруйнували Київ у ___ році.\n   > [!answer] **1240**\n### Завдання 3: Перекладіть (використовуйте пасив де доречно)\n\n1. Rus was baptized in 988.\n   > [!answer] **Русь було охрещено в 988 році.**\n2. Sophia Cathedral was built by Yaroslav the Wise.\n   > [!answer] **Софію Київську збудовано Ярославом Мудрим.**\n3. The \"Ruska Pravda\" was the first code of laws.\n   > [!answer] **«Руська правда» була першим зводом законів.**\n4. Kyiv was destroyed by the Mongols.\n   > [!answer] **Київ було зруйновано монголами.**\n---\n\n## Продукція\n\n### Обговоріть\n\n1. Чому хрещення Русі було культурною революцією, а не просто зміною релігії?\n\n2. Як династичні шлюби впливали на міжнародне становище Русі?\n\n3. Чому усобиці стали головною причиною занепаду Русі? Що могли б зробити князі, щоб цього уникнути?\n\n### Напишіть (150-200 слів)\n\nУявіть, що ви — літописець. Опишіть один день у Києві 1050 року: що ви бачите, чуєте, відчуваєте. Використайте факти з цього модуля.\n\n---\n\n\n---\n\n\n---\n\n\n---"
      },
      {
        "id": "section-summary",
        "name": "Підсумок",
        "nameEn": "Summary",
        "type": "summary",
        "content": "## Золота доба: ключові постаті\n\n| Князь | Роки | Головне |\n|-------|------|---------|\n| Володимир Великий | 980-1015 | Хрещення Русі (988) |\n| Ярослав Мудрий | 1019-1054 | Софія, «Руська правда», Анна |\n\n## Культурні досягнення\n\n| Досягнення | Значення |\n|------------|----------|\n| Хрещення (988) | Освіта, писемність, зв'язки з Європою |\n| Софія Київська (1037) | Символ величі, збереглася до сьогодні |\n| «Руська правда» | Перший писаний закон |\n| Анна Ярославна | Королева Франції, міжнародний престиж |\n\n## Занепад\n\n| Причина | Наслідок |\n|---------|----------|\n| Усобиці | Ослаблення влади |\n| Роздробленість | Втрата єдності |\n| Монгольська навала (1240) | Падіння Києва |\n\n---\n\n> **Чому це важливо**\n>\n> Золота доба Київської Русі — це не просто «древня історія». Це доказ того, що Україна була *в центрі* європейської цивілізації. Коли французи були неписьменними — кияни читали книги. Коли європейські королі воювали за селища — київські князі будували собори.\n>\n> І коли хтось каже, що Україна «молода нація» або «штучне утворення» — згадайте Софію Київську. Їй тисяча років. І вона досі стоїть — *у Києві*.\n>\n> **Слава Україні! Героям слава!**\n\n---\n\n## Наступний урок\n\nУ наступних модулях ми продовжимо історію: Галицько-Волинське королівство, Литовсько-Руська доба, Річ Посполита. Київська Русь упала — але українська історія продовжилася."
      }
    ],
    "rawMarkdown": "---\ntitle: \"History: Kyivan Rus II\"\nsubtitle: \"Київська Русь II: Золота доба\"\nphase: B2.2\nduration: 50\ntransliteration: none\ntags: [history, kyivan-rus, culture, christianity]\nobjectives:\n  - Вивчити золоту добу Київської Русі\n  - Ознайомитися з культурними досягненнями\n  - Зрозуміти значення хрещення Русі\n  - Читати історичні тексти\n---\n\n# Зміст уроку\n\n## Вступ: Коли Київ був столицею Європи\n\nРік 1050. Уявіть Париж.\n\nЦе маленьке місто з брудними вулицями, дерев'яними будинками та населенням близько 25 тисяч осіб. Французький король Генріх I ледве вміє писати — як і більшість європейської знаті того часу. Бібліотеки? Університети? Лише в мріях.\n\nА тепер уявіть Київ того самого року.\n\nНаселення — понад 50 тисяч (удвічі більше за Париж). Кам'яні храми з золотими куполами. Величезні бібліотеки з тисячами книг. Школи при монастирях. Мозаїки такої краси, що їх порівнюють із найкращими візантійськими. Водогін (?!) — за шість століть до Версаля.\n\nІ дружина французького короля — киянка. Анна Ярославна, дочка київського князя Ярослава Мудрого. Вона привезла до Парижа слов'янське Євангеліє, яке французи вважали такою святинею, що королі присягали на ньому протягом наступних 500 років. Вона підписувала документи — в країні, де більшість знаті ставила хрестики замість підписів.\n\nЦе була золота доба Київської Русі. Епоха, коли Київ був одним із найбільших і найрозвиненіших міст Європи. Епоха Володимира Великого і Ярослава Мудрого. Епоха, яку ви маєте знати — бо це *ваша* історія.\n\n---\n\n## Розминка: Що ви вже знаєте?\n\nПеревірте себе:\n\n| Питання | Ваша відповідь |\n|---------|----------------|\n| Хто охрестив Русь? | ___ |\n| У якому році? | ___ |\n| Хто збудував Софію Київську? | ___ |\n| Як звали дочку Ярослава — королеву Франції? | ___ |\n| У якому році Київ захопили монголи? | ___ |\n\n**Відповіді:** Володимир Великий, 988, Ярослав Мудрий, Анна, 1240.\n\nЯкщо ви відповіли правильно на все — чудово! Але сьогодні ви дізнаєтесь набагато більше, ніж сухі факти.\n\n---\n\n## Частина 1: Володимир Великий — людина, яка змінила все\n\nВолодимир Святославич (близько 958-1015) — одна з найсуперечливіших постатей української історії. Язичник, що став святим. Братовбивця, що став будівничим нації. Людина з сотнями дружин, що стала символом християнської моралі.\n\n### Шлях до влади\n\nІсторія Володимира починається з крові. Буквально.\n\nВін був одним із синів Святослава Хороброго — того самого, який воював із візантійцями та казав ворогам «Іду на ви!» перед кожним походом. Після смерті Святослава почалася війна між його синами.\n\nВолодимир спочатку програв. Його брат Ярополк вбив іншого брата Олега і захопив Київ. Володимир втік до Скандинавії — до варягів.\n\nТам він зібрав військо і повернувся. У 980 році він захопив Київ, вбив Ярополка — і став єдиним князем Русі.\n\nТак починалося правління людини, якого церква назве «рівноапостольним».\n\n### Язичницька реформа (перша спроба)\n\nПерша спроба Володимира об'єднати Русь була... дивною. Він вирішив реформувати язичництво. У 980 році він звів пантеон богів на київській горі — Перуна (бога грому), Хорса (бога сонця), Дажбога, Стрибога, Симаргла та Мокошу.\n\nЦе не спрацювало. Язичництво було занадто різноманітним — кожне плем'я мало своїх богів, свої обряди, свої традиції. Єдиний пантеон не міг їх об'єднати.\n\nВолодимир зрозумів: потрібна нова релігія. Одна для всіх.\n\n---\n\n> **Чи знали ви?**\n>\n> «Повість минулих літ» розповідає, що Володимир влаштував своєрідний «конкурс релігій». До нього прийшли посланці від мусульман (Булгарія), іудеїв (Хозарія), католиків (Німеччина) та православних (Візантія).\n>\n> Мусульманам Володимир нібито сказав: «Пити — веселість Русі, не можемо без цього». Іудеїв запитав: «А де ваша земля?» — і коли вони визнали, що Бог розсіяв їх по світу за гріхи, відповів: «То чого ж ви інших вчите?»\n>\n> Про візантійське православ'я посли сказали найкрасномовніше: «Ми не знали, чи на небі ми, чи на землі. Бо на землі немає такої краси».\n>\n> Звісно, це легенда. Реальні причини вибору були політичними та економічними. Але легенда показує, як русини пояснювали свій вибір — через *красу* і *радість*.\n\n---\n\n### Хрещення Русі (988)\n\n988 рік. Володимир приймає хрещення в Корсуні (Херсонесі) в Криму. Там же він одружується з візантійською принцесою Анною — сестрою імператорів Василія II та Костянтина VIII.\n\nЦе був унікальний дипломатичний успіх. Візантійські принцеси *не* виходили заміж за «варварів». Це було безпрецедентно. Володимир отримав не просто дружину — він отримав легітимність на рівні візантійських імпероторів.\n\nПовернувшись до Києва, Володимир наказав скинути статую Перуна в Дніпро і охрестити киян. За легендою, це відбулося масово — люди заходили в річку цілими сім'ями.\n\n*«І була радість велика на небі і на землі, бо стільки душ спасалося.»* — так описує цю подію літопис.\n\n### Що змінилося після хрещення?\n\nХрещення було не просто зміною релігії. Це була культурна революція:\n\n| До хрещення | Після хрещення |\n|-------------|----------------|\n| Язичницькі боги | Єдиний Бог, єдина церква |\n| Усна традиція | Писемність (кирилиця) |\n| Племінні звичаї | Єдиний закон |\n| Ізоляція | Зв'язки з Візантією та Європою |\n| Кремація | Поховання |\n\nРазом із християнством прийшла *освіта*. Візантійці привезли книги, вчителів, архітекторів, художників. За одне-два покоління Русь із «варварської» держави перетворилася на один із культурних центрів Європи.\n\n---\n\n> **Міф vs Факт**\n>\n> ❌ **Міф:** «Хрещення Русі було насильницьким — Володимир примусив усіх хреститися під загрозою смерті.»\n>\n> ✅ **Факт:** Хрещення дійсно було примусовим у тому сенсі, що це було рішення князя, а не народне волевиявлення. Але масових репресій не було. Язичництво співіснувало з християнством ще кілька століть — особливо на периферії. Навіть сьогодні в українській культурі є елементи язичництва: Купало, колядки, писанки. Реальність була складнішою за чорно-білі міфи.\n\n---\n\n## Частина 2: Ярослав Мудрий — будівничий цивілізації\n\nЯкщо Володимир створив підґрунтя, то Ярослав Володимирович (близько 978-1054) побудував на ньому цивілізацію.\n\n### Знову війна за престол\n\nІсторія повторюється. Після смерті Володимира в 1015 році почалася нова усобиця. Син Святополк (прозваний «Окаянним») убив трьох своїх братів — Бориса, Гліба та Святослава.\n\nБорис і Гліб відмовилися воювати проти старшого брата, бо вважали це гріхом. Їх убили беззбройних. Пізніше церква канонізувала їх як перших руських святих — символів смирення та братньої любові.\n\nЯрослав, який правив у Новгороді, зібрав військо і виступив проти Святополка. Війна тривала чотири роки. Нарешті, у 1019 році Ярослав переміг і став київським князем.\n\n### «Руська правда» — перший звід законів\n\nОдне з найважливіших досягнень Ярослава — «Руська правда». Це перший писаний звід законів у Східній Європі.\n\nЧому це важливо? До «Руської правди» судили за звичаєвим правом — тобто кожен суддя вирішував сам, як карати злочинця. Це призводило до хаосу та несправедливості.\n\n«Руська правда» встановила:\n- **Фіксовані штрафи** за злочини (замість кровної помсти)\n- **Права різних верств** (бояри, смерди, холопи)\n- **Процедуру суду** (свідки, докази)\n- **Захист власності** (покарання за крадіжку)\n\n---\n\n> **Чи знали ви?**\n>\n> «Руська правда» забороняла *кровну помсту* — практику, коли рід жертви мав право вбити злочинця або його родича. Замість цього встановлювався штраф — «віра». За вбивство вільної людини треба було заплатити 40 гривень. За вбивство княжого слуги — 80 гривень.\n>\n> Цікаво, що жінки та чоловіки мали *однаковий* правовий захист — незвичайно для середньовіччя. «Руська правда» каже: «За убивство жінки — та сама віра, що за чоловіка».\n>\n> Порівняйте із Західною Європою того часу, де жінки часто взагалі не мали правового статусу!\n\n---\n\n### Софія Київська — символ величі\n\nУ 1037 році Ярослав заклав Софію Київську — головний собор Русі. Це була не просто церква. Це був символ нової ери.\n\nСобор будували візантійські та місцеві майстри. 13 куполів (символізують Христа та 12 апостолів). Мозаїки із золотим тлом. Фрески, що зберігаються досі — через майже тисячу років!\n\nЦентральна мозаїка — Богородиця Оранта — стала символом Києва. Її називають «Нерушимою стіною», бо вона вистояла всі напади, пожежі, війни. Навіть коли монголи спалили Київ у 1240 році — Софія вціліла.\n\n**Софія стоїть і сьогодні.** Тепер це музей, але щоразу, коли ви дивитесь на ці мозаїки — ви дивитесь на ту саму красу, яку бачили кияни тисячу років тому. *Ваші предки*.\n\n---\n\n> **Чи знали ви?**\n>\n> Софія Київська — не просто церква. Це була ще й *бібліотека*. Ярослав зібрав там одну з найбільших книгозбірень Європи. За його наказом перекладали книги з грецької, латини, болгарської. Створювали нові твори.\n>\n> Сам Ярослав, за словами літопису, «книги любив, читаючи їх вдень і вночі». У часи, коли більшість європейських королів були неписьменними, київський князь був бібліофілом.\n>\n> Куди поділася бібліотека Ярослава? Ніхто не знає. Можливо, її сховали під час монгольської навали. Можливо, вона згоріла. Пошуки «бібліотеки Ярослава Мудрого» тривають досі — це одна з найбільших загадок української історії.\n\n---\n\n### Династичні зв'язки — Русь у центрі Європи\n\nЯрослав розумів: дипломатія — це шлюби. Він одружив своїх дітей із найвпливовішими європейськими родинами:\n\n| Дитина | Партнер | Країна |\n|--------|---------|--------|\n| Анна | Генріх I | Франція |\n| Єлизавета | Гаральд III Суворий | Норвегія |\n| Анастасія | Андраш I | Угорщина |\n| Ізяслав | Гертруда Польська | Польща |\n| Святослав | Ода Штаденська | Німеччина |\n| Всеволод | дочка Костянтина IX | Візантія |\n\nПодивіться на цей список. Франція, Норвегія, Угорщина, Польща, Німеччина, Візантія. Київська Русь була *в центрі* європейської політики.\n\n### Анна Ярославна — королева Франції\n\nАнна заслуговує окремої розповіді.\n\nУ 1051 році вона вийшла заміж за французького короля Генріха I. Їй було близько 19 років, йому — 43. Це був політичний шлюб, але Анна справила величезний вплив на Францію.\n\nВона привезла із Києва слов'янське Євангеліє (так зване «Реймське Євангеліє»). Французи вважали його такою святинею, що наступні королі присягали на ньому при коронації. Цю традицію зберігали *500 років* — до Французької революції!\n\nПісля смерті Генріха Анна була регенткою при малолітньому сині Філіпі I. Вона підписувала державні документи — причому *кирилицею*: «Анна ръина» (Анна-королева). Це єдині документи того часу, підписані королевою власноруч.\n\n---\n\n> **Міф vs Факт**\n>\n> ❌ **Міф:** «Анна Ярославна не любила Францію і скаржилася на примітивність французів.»\n>\n> ✅ **Факт:** Немає жодних історичних джерел, де Анна скаржиться на Францію. Знаменитий «лист», де вона нібито пише батькові «в яку варварську країну ти мене послав», — це **підробка XIX століття**, створена французьким істориком Левеком. Справжніх листів Анни не збереглося. Легенда красива, але неправдива.\n>\n> Що ми знаємо напевно: Анна заснувала монастир у Санлісі, була активною в політиці, і французи шанували її настільки, що поховали в королівському абатстві. Не схоже на «нещасну вигнанку».\n\n---\n\n## Частина 3: Занепад — як усе закінчилося\n\nПісля смерті Ярослава в 1054 році почався повільний, але невпинний занепад.\n\n### Усобиці\n\nЯрослав залишив детальний заповіт: як сини мають ділити владу, хто де княжує, як вирішувати суперечки. Але це не допомогло.\n\nУже в наступному поколінні почалися війни. Брати воювали з братами. Племінники — з дядьками. Київ переходив із рук в руки.\n\nНайгірше, що князі *запрошували чужинців* для допомоги у внутрішніх війнах. Половці (кочовий народ із степів) стали постійними «гостями» в руських землях. Іноді як вороги, іноді як союзники — але завжди грабуючи мирне населення.\n\n### Роздробленість\n\nДо XII століття єдина Київська Русь розпалася на десятки князівств:\n- Київське\n- Чернігівське\n- Переяславське\n- Галицьке\n- Волинське\n- Новгородське\n- Володимиро-Суздальське\n- та інші\n\nКожне князівство мало свого князя, своє військо, свою політику. Київ залишався формально «старшим», але реальна влада великого князя слабшала з кожним поколінням.\n\n### Монгольська навала (1237-1240)\n\nУ 1237 році з востоку прийшла катастрофа.\n\nМонгольська орда під проводом хана Батия (онука Чингісхана) вторглася в руські землі. Це була найбільша військова машина того часу — дисциплінована, жорстока, нездоланна.\n\nОдне за одним падали руські міста. Рязань. Володимир. Москва (тоді ще маленьке містечко). Князі намагалися чинити опір — і гинули.\n\nУ грудні 1240 року орда підійшла до Києва.\n\n---\n\n> **Чи знали ви?**\n>\n> Італійський посол Плано Карпіні проїжджав через Київ у 1246 році — через шість років після монгольської навали. Ось що він написав:\n>\n> *«Коли ми їхали через їхню землю, ми бачили незліченні голови та кістки мертвих людей, що лежали на полях. Місто Київ було дуже великим і густо населеним, а тепер воно зведене майже ні до чого: ледве двісті будинків там залишилося, і люди ці перебувають у найбільшому рабстві.»*\n>\n> Двісті будинків. У місті, яке мало 50 тисяч населення. Ось що таке була монгольська навала.\n\n---\n\n### Падіння Києва (1240)\n\nЛітопис так описує облогу:\n\n*«Прийшов Батий до Києва з великою силою, з множеством воїнів своїх, і оточив місто. Неможливо було почути один одного в місті від скрипу возів, ревіння верблюдів та іржання коней.»*\n\nКияни оборонялися відчайдушно. Командував обороною тисяцький Дмитро — навіть не князь (князь Данило Галицький у той час був за кордоном). Монголи застосували облогові машини, пробили стіни і ввірвалися в місто.\n\nОстанній рубіж оборони — Десятинна церква, перша кам'яна церква Русі. Там сховалися жінки, діти, старі. Монголи зруйнували церкву разом із людьми всередині.\n\n*Київ упав.*\n\nЦе не був кінець української історії — але це був кінець Київської Русі як єдиної держави.\n\n---\n\n> **Міф vs Факт**\n>\n> ❌ **Міф:** «Після монгольської навали Русь \"переїхала\" в Москву.»\n>\n> ✅ **Факт:** Ніякого «переїзду» не було. Галицько-Волинське князівство (на заході сучасної України) продовжувало існувати як незалежна держава ще 100 років. Його князь Данило Галицький у 1253 році отримав королівську корону від Папи Римського. Справжнім наступником Київської Русі було Галицько-Волинське королівство — а не Московія, яка була периферійним улусом Золотої Орди.\n\n---\n\n## Спадщина Київської Русі\n\nЩо залишила нам Київська Русь?\n\n| Сфера | Спадщина |\n|-------|----------|\n| **Віра** | Православне християнство (українське, не московське) |\n| **Мова** | Основа сучасної української мови |\n| **Право** | «Руська правда» — традиція писаного закону |\n| **Культура** | Літописи, архітектура, мистецтво |\n| **Ідентичність** | Назва «Русь», «руський» — це *ми* |\n| **Території** | Київ, Чернігів, Галич — *українські* міста |\n\n---\n\n## Практика\n\n### Завдання 1: Хронологія\n\nРозставте події в правильному порядку:\n\n1. Хрещення Русі\n2. Заснування Софії Київської\n3. Падіння Києва (монголи)\n4. «Руська правда»\n5. Шлюб Анни Ярославни\n\n**Відповідь:** 1 (988) → 4 (1016-1054) → 2 (1037) → 5 (1051) → 3 (1240)\n\n### Завдання 2: Заповніть пропуски\n\n1. Володимир охрестив Русь у ___ році.\n   > [!answer] **988**\n2. Ярослав Мудрий збудував ___ у 1037 році.\n   > [!answer] **Софію Київську**\n3. «___» — перший звід законів Русі.\n   > [!answer] **Руська правда**\n4. Анна Ярославна стала королевою ___.\n   > [!answer] **Франції**\n5. Монголи зруйнували Київ у ___ році.\n   > [!answer] **1240**\n### Завдання 3: Перекладіть (використовуйте пасив де доречно)\n\n1. Rus was baptized in 988.\n   > [!answer] **Русь було охрещено в 988 році.**\n2. Sophia Cathedral was built by Yaroslav the Wise.\n   > [!answer] **Софію Київську збудовано Ярославом Мудрим.**\n3. The \"Ruska Pravda\" was the first code of laws.\n   > [!answer] **«Руська правда» була першим зводом законів.**\n4. Kyiv was destroyed by the Mongols.\n   > [!answer] **Київ було зруйновано монголами.**\n---\n\n## Продукція\n\n### Обговоріть\n\n1. Чому хрещення Русі було культурною революцією, а не просто зміною релігії?\n\n2. Як династичні шлюби впливали на міжнародне становище Русі?\n\n3. Чому усобиці стали головною причиною занепаду Русі? Що могли б зробити князі, щоб цього уникнути?\n\n### Напишіть (150-200 слів)\n\nУявіть, що ви — літописець. Опишіть один день у Києві 1050 року: що ви бачите, чуєте, відчуваєте. Використайте факти з цього модуля.\n\n---\n\n# Вправи\n\n## quiz: Золота доба Київської Русі\n\n> Виберіть правильну відповідь.\n\n1. Русь охрещено у:\n   - [ ] 862 році\n   - [x] 988 році\n   - [ ] 1054 році\n   > 862 — прихід Рюрика. 1054 — смерть Ярослава.\n\n2. Хто хрестив Русь?\n   - [ ] Ярослав Мудрий\n   - [x] Володимир Великий\n   - [ ] Ольга\n   > Ольга хрестилася сама, але не хрестила всю Русь.\n\n3. Софію Київську збудовано:\n   - [ ] у 988 році\n   - [x] у 1037 році\n   - [ ] у 1240 році\n   > За часів Ярослава Мудрого.\n\n4. «Руська правда» — це:\n   - [ ] літопис\n   - [ ] церковний статут\n   - [x] звід законів\n   > Перший писаний закон Русі.\n\n5. Анна Ярославна була:\n   - [ ] імператрицею Візантії\n   - [x] королевою Франції\n   - [ ] княгинею Новгорода\n   > Дружина Генріха I.\n\n6. Київ зруйновано монголами у:\n   - [ ] 1054 році\n   - [ ] 1147 році\n   - [x] 1240 році\n   > Хан Батий.\n\n7. **[Інтеграція: пасив]** Офіційний текст: «Собор ___ у 1037 році.»\n   - [x] збудовано\n   - [ ] збудували\n   - [ ] будується\n   > Офіційний/історичний текст → -но/-то.\n\n8. **[Інтеграція: регістр]** Художній опис битви: «Вороги ___ місто.»\n   - [ ] зруйновано\n   - [x] зруйнували\n   - [ ] руйнується\n   > Художній/наративний стиль → активний стан.\n\n---\n\n# Словник\n\n| Слово | Вимова | Переклад | Приклад |\n|-------|--------|----------|---------|\n| хрещення | /xrɛˈʃt͡ʃɛnʲːɑ/ | baptism | Хрещення Русі відбулося в 988 році. |\n| собор | /sɔˈbɔr/ | cathedral | Софія Київська — головний собор Русі. |\n| монастир | /mɔnɑsˈtɪr/ | monastery | Печерська лавра — найдавніший монастир. |\n| літопис | /ˈlʲitɔpɪs/ | chronicle | «Повість минулих літ» — головний літопис. |\n| звід законів | /zwʲid zɑˈkɔnʲiw/ | code of laws | «Руська правда» — перший звід законів. |\n| усобиці | /uˈsɔbɪt͡sʲi/ | internecine wars | Усобиці ослабили Русь. |\n| роздробленість | /rɔzdrɔbˈlɛnʲistʲ/ | fragmentation | Роздробленість почалася після Ярослава. |\n| навала | /nɑˈwɑlɑ/ | invasion | Монгольська навала зруйнувала Київ. |\n| занепад | /zɑnɛˈpɑd/ | decline | Занепад Русі почався з усобиць. |\n| охрестити | /ɔxrɛsˈtɪtɪ/ | to baptize (pf) | Володимир охрестив Русь. |\n| панувати | /pɑnuˈwɑtɪ/ | to reign (impf) | Ярослав панував 35 років. |\n| занепасти | /zɑnɛˈpɑstɪ/ | to decline (pf) | Русь занепала через усобиці. |\n| зруйнувати | /zrujnuˈwɑtɪ/ | to destroy (pf) | Монголи зруйнували Київ. |\n\n---\n\n# Review Vocabulary\n\n| Word | First Module |\n|------|-------------|\n| спадщина | 207 |\n| збудувати | 62 |\n\n---\n\n# Підсумок\n\n## Золота доба: ключові постаті\n\n| Князь | Роки | Головне |\n|-------|------|---------|\n| Володимир Великий | 980-1015 | Хрещення Русі (988) |\n| Ярослав Мудрий | 1019-1054 | Софія, «Руська правда», Анна |\n\n## Культурні досягнення\n\n| Досягнення | Значення |\n|------------|----------|\n| Хрещення (988) | Освіта, писемність, зв'язки з Європою |\n| Софія Київська (1037) | Символ величі, збереглася до сьогодні |\n| «Руська правда» | Перший писаний закон |\n| Анна Ярославна | Королева Франції, міжнародний престиж |\n\n## Занепад\n\n| Причина | Наслідок |\n|---------|----------|\n| Усобиці | Ослаблення влади |\n| Роздробленість | Втрата єдності |\n| Монгольська навала (1240) | Падіння Києва |\n\n---\n\n> **Чому це важливо**\n>\n> Золота доба Київської Русі — це не просто «древня історія». Це доказ того, що Україна була *в центрі* європейської цивілізації. Коли французи були неписьменними — кияни читали книги. Коли європейські королі воювали за селища — київські князі будували собори.\n>\n> І коли хтось каже, що Україна «молода нація» або «штучне утворення» — згадайте Софію Київську. Їй тисяча років. І вона досі стоїть — *у Києві*.\n>\n> **Слава Україні! Героям слава!**\n\n---\n\n## Наступний урок\n\nУ наступних модулях ми продовжимо історію: Галицько-Волинське королівство, Литовсько-Руська доба, Річ Посполита. Київська Русь упала — але українська історія продовжилася.\n",
    "createdAt": "2025-12-05T01:15:58.029Z",
    "modifiedAt": "2025-12-05T01:15:58.029Z",
    "version": 2
  },
  "activities": [
    {
      "id": "act-a1-0-quiz",
      "type": "quiz",
      "title": "Золота доба Київської Русі",
      "description": "Виберіть правильну відповідь.",
      "content": {
        "type": "quiz",
        "questions": [
          {
            "question": "Русь охрещено у:",
            "options": [
              "862 році",
              "988 році",
              "1054 році"
            ],
            "correctIndex": 1,
            "explanation": "862 — прихід Рюрика. 1054 — смерть Ярослава."
          },
          {
            "question": "Хто хрестив Русь?",
            "options": [
              "Ярослав Мудрий",
              "Володимир Великий",
              "Ольга"
            ],
            "correctIndex": 1,
            "explanation": "Ольга хрестилася сама, але не хрестила всю Русь."
          },
          {
            "question": "Софію Київську збудовано:",
            "options": [
              "у 988 році",
              "у 1037 році",
              "у 1240 році"
            ],
            "correctIndex": 1,
            "explanation": "За часів Ярослава Мудрого."
          },
          {
            "question": "«Руська правда» — це:",
            "options": [
              "літопис",
              "церковний статут",
              "звід законів"
            ],
            "correctIndex": 2,
            "explanation": "Перший писаний закон Русі."
          },
          {
            "question": "Анна Ярославна була:",
            "options": [
              "імператрицею Візантії",
              "королевою Франції",
              "княгинею Новгорода"
            ],
            "correctIndex": 1,
            "explanation": "Дружина Генріха I."
          },
          {
            "question": "Київ зруйновано монголами у:",
            "options": [
              "1054 році",
              "1147 році",
              "1240 році"
            ],
            "correctIndex": 2,
            "explanation": "Хан Батий."
          },
          {
            "question": "**[Інтеграція: пасив]** Офіційний текст: «Собор ___ у 1037 році.»",
            "options": [
              "збудовано",
              "збудували",
              "будується"
            ],
            "correctIndex": 0,
            "explanation": "Офіційний/історичний текст → -но/-то."
          },
          {
            "question": "**[Інтеграція: регістр]** Художній опис битви: «Вороги ___ місто.»",
            "options": [
              "зруйновано",
              "зруйнували",
              "руйнується"
            ],
            "correctIndex": 1,
            "explanation": "Художній/наративний стиль → активний стан."
          }
        ],
        "shuffleQuestions": true,
        "shuffleOptions": true,
        "showCorrectAnswers": true
      },
      "subject": "language",
      "owner": "curricula-opus",
      "visibility": "public",
      "language": "uk",
      "difficultyLevel": "B2",
      "duration": 5,
      "tags": [],
      "createdAt": "2025-12-05T01:15:58.029Z",
      "modifiedAt": "2025-12-05T01:15:58.029Z"
    }
  ],
  "vocabulary": {
    "moduleId": "mod-uk-B2-28",
    "level": "B2",
    "phase": "B2.2",
    "wordCount": 15,
    "newWordCount": 13,
    "reviewWordCount": 2,
    "transliterationMode": "none",
    "words": [
      {
        "id": "v-khreshchennya-0-0",
        "uk": "хрещення",
        "en": "baptism",
        "pos": "noun",
        "ipa": "/xrɛˈʃt͡ʃɛnʲːɑ/",
        "note": "Хрещення Русі відбулося в 988 році.",
        "isNew": true,
        "firstModule": 0
      },
      {
        "id": "v-sobor-0-1",
        "uk": "собор",
        "en": "cathedral",
        "pos": "noun",
        "ipa": "/sɔˈbɔr/",
        "note": "Софія Київська — головний собор Русі.",
        "isNew": true,
        "firstModule": 0
      },
      {
        "id": "v-monastyr-0-2",
        "uk": "монастир",
        "en": "monastery",
        "pos": "noun",
        "ipa": "/mɔnɑsˈtɪr/",
        "note": "Печерська лавра — найдавніший монастир.",
        "isNew": true,
        "firstModule": 0
      },
      {
        "id": "v-litopys-0-3",
        "uk": "літопис",
        "en": "chronicle",
        "pos": "noun",
        "ipa": "/ˈlʲitɔpɪs/",
        "note": "«Повість минулих літ» — головний літопис.",
        "isNew": true,
        "firstModule": 0
      },
      {
        "id": "v-zvid-zakoniv-0-4",
        "uk": "звід законів",
        "en": "code of laws",
        "pos": "noun",
        "ipa": "/zwʲid zɑˈkɔnʲiw/",
        "note": "«Руська правда» — перший звід законів.",
        "isNew": true,
        "firstModule": 0
      },
      {
        "id": "v-usobytsi-0-5",
        "uk": "усобиці",
        "en": "internecine wars",
        "pos": "noun",
        "ipa": "/uˈsɔbɪt͡sʲi/",
        "note": "Усобиці ослабили Русь.",
        "isNew": true,
        "firstModule": 0
      },
      {
        "id": "v-rozdroblenistь-0-6",
        "uk": "роздробленість",
        "en": "fragmentation",
        "pos": "noun",
        "ipa": "/rɔzdrɔbˈlɛnʲistʲ/",
        "note": "Роздробленість почалася після Ярослава.",
        "isNew": true,
        "firstModule": 0
      },
      {
        "id": "v-navala-0-7",
        "uk": "навала",
        "en": "invasion",
        "pos": "noun",
        "ipa": "/nɑˈwɑlɑ/",
        "note": "Монгольська навала зруйнувала Київ.",
        "isNew": true,
        "firstModule": 0
      },
      {
        "id": "v-zanepad-0-8",
        "uk": "занепад",
        "en": "decline",
        "pos": "noun",
        "ipa": "/zɑnɛˈpɑd/",
        "note": "Занепад Русі почався з усобиць.",
        "isNew": true,
        "firstModule": 0
      },
      {
        "id": "v-okhrestyty-0-9",
        "uk": "охрестити",
        "en": "to baptize (pf)",
        "pos": "noun",
        "ipa": "/ɔxrɛsˈtɪtɪ/",
        "note": "Володимир охрестив Русь.",
        "isNew": true,
        "firstModule": 0
      },
      {
        "id": "v-panuvaty-0-10",
        "uk": "панувати",
        "en": "to reign (impf)",
        "pos": "noun",
        "ipa": "/pɑnuˈwɑtɪ/",
        "note": "Ярослав панував 35 років.",
        "isNew": true,
        "firstModule": 0
      },
      {
        "id": "v-zanepasty-0-11",
        "uk": "занепасти",
        "en": "to decline (pf)",
        "pos": "noun",
        "ipa": "/zɑnɛˈpɑstɪ/",
        "note": "Русь занепала через усобиці.",
        "isNew": true,
        "firstModule": 0
      },
      {
        "id": "v-zruynuvaty-0-12",
        "uk": "зруйнувати",
        "en": "to destroy (pf)",
        "pos": "noun",
        "ipa": "/zrujnuˈwɑtɪ/",
        "note": "Монголи зруйнували Київ.",
        "isNew": true,
        "firstModule": 0
      }
    ],
    "reviewWords": [
      {
        "id": "v-spadshchyna-0-1000",
        "uk": "спадщина",
        "en": "",
        "pos": "noun",
        "isNew": false,
        "firstModule": 207
      },
      {
        "id": "v-zbuduvaty-0-1001",
        "uk": "збудувати",
        "en": "",
        "pos": "noun",
        "isNew": false,
        "firstModule": 62
      }
    ]
  }
}