{
  "$schema": "../../../schemas/vibe-module.schema.json",
  "lesson": {
    "id": "lesson-uk-B2-37",
    "moduleId": "mod-uk-B2-37",
    "languagePair": "l2-uk-en",
    "subject": "language",
    "owner": "curricula-opus",
    "visibility": "public",
    "language": "uk",
    "targetLevel": "B2",
    "phase": "B2.2",
    "moduleNumber": 37,
    "moduleType": "history",
    "immersionLevel": 0.85,
    "title": "History: Polish Rule",
    "subtitle": "Україна під Польщею",
    "description": "Вивчити польський період української історії",
    "objectives": [
      "Вивчити польський період української історії",
      "Зрозуміти наслідки Люблінської унії",
      "Читати історичні тексти",
      "Розширити історичну лексику"
    ],
    "grammarFocus": [],
    "tags": [
      "history",
      "poland",
      "serfdom",
      "union",
      "rzeczpospolita"
    ],
    "totalDuration": 50,
    "transliterationMode": "none",
    "sections": [
      {
        "id": "section-зміст-уроку",
        "name": "Зміст уроку",
        "type": "content",
        "content": "## Вступ: Як з вільних селян зробили рабів\n\nУявіть таку сцену.\n\nРік 1550. Ви — український селянин у Литві. Життя непросте, але ви *вільні*. Ви обробляєте землю, платите податки, але можете переїхати в інше село, якщо вам не подобається пан. Ваші діти — ваші, не панські.\n\nРік 1600. Ви — той самий селянин. Але тепер ви під Польщею. І все змінилося. Ви працюєте на пана шість днів на тиждень. У вас залишається один день — неділя — для себе. Ви не можете залишити село без дозволу пана. Пан може вас продати. Пан може вас побити. Пан може забрати ваших дітей.\n\nЩо сталося за ці 50 років?\n\nЛюблінська унія. Річ Посполита. Польське панування.\n\nІсторія українського селянства під Польщею — це історія поступової втрати свободи. Це історія того, як мільйони вільних людей стали кріпаками — фактично рабами. І це історія того, як вони боролися за свою свободу.\n\nЦе — один із найтемніших періодів нашої історії. Але його треба знати, щоб зрозуміти, чому козаки повстали. Чому Хмельниччина сталася. Чому Україна — це нація борців.\n\n---\n\n## Розминка: До і після\n\n| Аспект | До Люблінської унії | Після |\n|--------|---------------------|-------|\n| Влада | Литовський князь | Польський магнат |\n| Мова | Руська (офіційна) | Польська |\n| Релігія | Православ'я захищене | Тиск католицизму |\n| Селяни | Відносно вільні | Кріпаки |\n| Еліта | Руська шляхта | Полонізована шляхта |\n\n---\n\n## Частина 1: Люблінська унія — катастрофа 1569 року\n\n### Що сталося?\n\n1 липня 1569 року в місті Люблін підписано документ, який змінив долю України на століття. Велике князівство Литовське та Польське королівство об'єдналися в єдину державу — Річ Посполиту.\n\n«Річ Посполита» — це латинський термін «Res Publica», що означає «спільна справа». Іронія в тому, що для українців ця «спільна справа» означала *втрату* всього.\n\n### Чому литовці погодились?\n\nЛитва переживала кризу. Війна з Москвою (Лівонська війна) виснажувала країну. Литовські магнати хотіли польської допомоги. Поляки погодились — але за ціну.\n\nЦіна: українські землі — Волинь, Київщина, Поділля, Брацлавщина — переходять *напряму* під Польську корону. Не під Литву в складі спільної держави — а безпосередньо під Польщу.\n\n### Що це означало для України?\n\n| Аспект | Зміна |\n|--------|-------|\n| Адміністрація | Литовські порядки → Польські воєводства |\n| Мова документів | Руська → Польська (поступово) |\n| Релігія | Рівноправ'я → Дискримінація православних |\n| Селяни | Обмежене кріпацтво → Повне закріпачення |\n| Еліта | Руська шляхта → Тиск полонізації |\n\n---\n\n> **Чи знали ви?**\n>\n> Українські воєводства в складі Речі Посполитої мали величезні території. Київське воєводство охоплювало понад 100 000 км² — більше, ніж сучасна Угорщина! Волинське, Подільське, Брацлавське воєводства — теж величезні.\n>\n> Але ці величезні території контролювали кілька десятків польських магнатів. Вишневецькі, Потоцькі, Конецпольські — вони володіли цілими «державами в державі». І ставилися до селян як до власності.\n\n---\n\n## Частина 2: Панщина — українське рабство\n\n### Як вільні селяни стали рабами\n\nЗакріпачення не сталося за один день. Це був повільний процес — закон за законом, обмеження за обмеженням.\n\n| Рік | Закон | Наслідок |\n|-----|-------|----------|\n| 1496 | Заборона переходу | Селяни не можуть залишати село |\n| 1505 | Обмеження прав | Селяни втрачають судовий захист |\n| 1520 | Збільшення панщини | Обов'язкова праця на пана |\n| 1573 | «Генріхові артикули» | Пан — суддя над селянами |\n| XVI-XVII ст. | Повне закріпачення | Селяни — власність пана |\n\n### Що таке панщина?\n\nПанщина — це примусова безоплатна праця селянина на землі пана. Спочатку це був один-два дні на тиждень. Потім три. Потім чотири. На момент козацьких повстань — п'ять-шість днів на тиждень.\n\nПодумайте про це. Шість днів на тиждень ви працюєте *безкоштовно* на когось іншого. У вас залишається *один день* — неділя — щоб обробити власну ділянку, вигодувати сім'ю, відпочити.\n\n### Права пана vs Права селянина\n\n| Пан міг | Селянин не міг |\n|---------|----------------|\n| Продати селянина | Залишити село без дозволу |\n| Покарати без суду | Скаржитися в суд |\n| Забрати землю | Володіти майном (все — панське) |\n| Відібрати дітей | Одружити дітей без дозволу |\n| Вбити (формально — ні, реально — без покарання) | Захистити себе |\n\n---\n\n> **Міф vs Факт**\n>\n> ❌ **Міф:** «Кріпацтво в Україні було такое саме, як у Росії — не краще, не гірше.»\n>\n> ✅ **Факт:** Польське кріпацтво було *жорстокішим* за ранньомосковське в багатьох аспектах. Поляки раніше закріпачили селян. Панщина в Україні досягала 5-6 днів на тиждень — більше, ніж у Росії того часу. І головне — в Україні кріпацтво впроваджували *чужинці* (поляки), що додавало національного приниження до соціального гноблення.\n\n---\n\n### Оренда — ще гірше\n\nБагато польських магнатів не хотіли самі управляти величезними маєтками. Вони здавали їх в *оренду*. Часто — євреям, яким було заборонено володіти землею, але дозволено орендувати.\n\nОрендар мав заплатити магнату фіксовану суму, а все зверху — його прибуток. Це створювало *стимул* вичавлювати з селян максимум. Орендар не думав про довгострокове — йому потрібен прибуток *зараз*.\n\nРезультат: ще більше гноблення. Селяни ненавиділи і панів, і орендарів. Це пояснює жорстокість козацьких повстань — накопичена ненависть вихлюпувалась.\n\n---\n\n> **Чи знали ви?**\n>\n> Літопис XVII століття описує життя українського селянина так:\n>\n> *«Селянин працює на пана від зорі до зорі. Шість днів — панщина. У неділю — своє поле. Якщо не встигне — голод. Пан може взяти останню корову, останній хліб. Якщо селянин втече — його ловлять, б'ють, калічать.»*\n>\n> Це не метафора. Це буквальний опис життя мільйонів українців протягом двох століть.\n\n---\n\n## Частина 3: Релігійна війна — Брестська унія\n\n### Чому віра мала значення?\n\nУ XVI столітті релігія — це не просто «приватна справа». Це ідентичність. Це політика. Це права.\n\nУ Речі Посполитій католики мали привілеї. Православні — ні. Щоб отримати посаду, потрібно було бути католиком. Щоб просунутися в суспільстві — бути католиком. Православні були громадянами «другого сорту».\n\n### Брестська унія 1596 року\n\nУ 1596 році частина православних єпископів підписала унію з Римом. Вони визнали владу Папи, але зберегли православний обряд. Так виникла *Греко-католицька* (уніатська) церква.\n\n| Аспект | Деталі |\n|--------|--------|\n| Дата | 9-10 жовтня 1596 |\n| Місце | Берестя (Брест) |\n| Суть | Частина православних визнала Папу |\n| Нова церква | Греко-католицька (уніатська) |\n| Обряд | Православний (східний) |\n| Підпорядкування | Папа Римський |\n\n### Чому єпископи погодились?\n\nМотиви були різні:\n- **Кар'єризм**: Уніати отримували права нарівні з католиками\n- **Відчай**: Православна церква була в занепаді, без підтримки\n- **Ідеалізм**: Деякі вірили, що унія об'єднає християн\n- **Тиск**: Польська влада підтримувала унію\n\n### Розкол\n\nАле не всі погодились. Частина єпископів, більшість духовенства та простий народ *відкинули* унію. Православна церква продовжила існувати — тепер як «нелегальна».\n\n| Група | Позиція |\n|-------|---------|\n| Уніатські єпископи | Прийняли унію |\n| Православні єпископи | Відкинули унію |\n| Більшість духовенства | Православні |\n| Козаки | Категорично православні |\n| Селяни | Переважно православні |\n| Полонізована шляхта | Католики або уніати |\n\n---\n\n> **Міф vs Факт**\n>\n> ❌ **Міф:** «Греко-католики — \"зрадники\" православ'я.»\n>\n> ✅ **Факт:** Історія складніша. Багато хто прийняв унію під тиском, без вибору. Пізніше греко-католицька церква стала *захисником* української ідентичності — особливо в Галичині під Австрією, а потім у боротьбі з радянською владою. Засуджувати греко-католиків як «зрадників» — спрощення. Краще розуміти історичний контекст.\n\n---\n\n## Частина 4: Культурний спротив — братства та академія\n\nПопри всі гоніння, українська культура не зникла. Вона *боролася*.\n\n### Братства\n\nБратства — це міські організації, які захищали православ'я та українську культуру. Вони створювали школи, друкарні, бібліотеки.\n\n| Братство | Місто | Досягнення |\n|----------|-------|------------|\n| Львівське | Львів | Школа (1586), друкарня, «Граматика» |\n| Острозьке | Острог | Академія (1576), Острозька Біблія (1581) |\n| Київське | Київ | Школа, підтримка Лаври |\n| Віленське | Вільно | Школа, друкарня |\n\n### Острозька Біблія (1581)\n\nЦе була перша повна Біблія церковнослов'янською мовою. Надрукована в Острозі Іваном Федоровим — першим українським друкарем.\n\nЧому це важливо? Біблія — найважливіша книга для християн. Мати власну Біблію — це мати *легітимність*. Православні могли сказати: «У нас є Святе Письмо нашою мовою. Ми — справжні християни.»\n\n### Києво-Могилянська академія (1632)\n\nУ 1632 році митрополит Петро Могила об'єднав школу Києво-Печерської лаври та Київського братства. Так виникла Києво-Могилянська академія — перший вищий навчальний заклад у Східній Європі.\n\nАкадемія викладала:\n- Латину (мова науки)\n- Грецьку (мова церкви)\n- Церковнослов'янську\n- Риторику, філософію, богослов'я\n\nТут навчалися майбутні гетьмани, митрополити, письменники. Це був *інтелектуальний центр* України.\n\n---\n\n> **Чи знали ви?**\n>\n> Києво-Могилянська академія стала зразком для Московської академії (1687). Коли Петро I почав модернізувати Росію, він запрошував саме випускників *Київської* академії — бо освічених людей у Московії просто не було.\n>\n> Феофан Прокопович, головний ідеолог петровських реформ — випускник Києво-Могилянки. Так само — багато інших діячів російської культури XVIII століття. Вони були *українцями* за походженням та освітою.\n\n---\n\n## Частина 5: Полонізація — як втрачали ідентичність\n\n### Що таке полонізація?\n\nПолонізація — це процес переходу на польську мову та культуру. Для української еліти це часто був *свідомий вибір* — спосіб отримати привілеї, зробити кар'єру, увійти в «вищий світ».\n\n### Як це виглядало?\n\nПокоління 1: Руська шляхта. Православні. Говорять руською. Одружуються з руськими.\n\nПокоління 2: Руська шляхта, але діти їздять в Польщу на навчання. Вивчають латину, польську. Повертаються «європейцями».\n\nПокоління 3: Говорять польською вдома. Переходять у католицизм (або унію). Руська мова — «хлопська».\n\nПокоління 4: Вважають себе поляками. Руське походження — «сором».\n\n### Приклад: Вишневецькі\n\nРід Вишневецьких — класичний приклад.\n\n- **Дмитро Вишневецький** (XVI ст.): православний, козацький ватажок, герой народних дум «Байда».\n- **Єремія Вишневецький** (XVII ст.): католик, полонізований магнат, *ворог* козаків, один із найжорстокіших переслідувачів Хмельницького.\n\nЗа два-три покоління — від козацького героя до козацького ката.\n\n---\n\n> **Міф vs Факт**\n>\n> ❌ **Міф:** «Полонізація була насильницькою — поляки примушували переходити на польську мову.»\n>\n> ✅ **Факт:** Полонізація здебільшого була *добровільною* — для еліти. Ніхто не тримав пістолета біля скроні. Але *система* була побудована так, що без полонізації неможливо було просунутися. Це більш підступна форма асиміляції — через привілеї, а не через насильство.\n>\n> Селян ніхто не полонізував — вони і так не мали прав. Вони залишалися українськими (руськими) — і саме з них пізніше виросла козацька нація.\n\n---\n\n## Чому це призвело до вибуху\n\nПідсумуємо. До середини XVII століття в Україні:\n\n- **Селяни** — кріпаки, фактичні раби, працюють 6 днів на тиждень\n- **Православні** — громадяни «другого сорту», їхню церкву переслідують\n- **Козаки** — вільні воїни, але їхні права постійно обмежують\n- **Еліта** — полонізується, зраджує свій народ\n\nЦе була вибухова суміш. Потрібна була лише іскра.\n\nУ 1648 році ця іскра спалахнула. Богдан Хмельницький підняв повстання. Почалася Хмельниччина — найбільша козацька війна в історії.\n\nАле це — тема наступних модулів.\n\n---\n\n## Практика\n\n### Завдання 1: Заповніть пропуски\n\n1. Люблінська унія підписана у ___ році.\n   > [!answer] **1569**\n2. Брестська унія створила ___ церкву.\n   > [!answer] **греко-католицьку**\n3. Острозьку Біблію надруковано у ___ році.\n   > [!answer] **1581**\n4. Києво-Могилянську академію заснував ___.\n   > [!answer] **Петро Могила**\n5. Примусова безоплатна праця на пана — це ___.\n   > [!answer] **панщина**\n### Завдання 2: Хронологія\n\nРозставте в правильному порядку:\n\n1. Брестська унія\n2. Люблінська унія\n3. Острозька Біблія\n4. Києво-Могилянська академія\n\n**Відповідь:** 2 (1569) → 3 (1581) → 1 (1596) → 4 (1632)\n\n### Завдання 3: Перекладіть\n\n1. Serfdom deprived peasants of their freedom.\n   > [!answer] **Кріпацтво позбавило селян свободи.**\n2. The brotherhoods defended Orthodox culture.\n   > [!answer] **Братства захищали православну культуру.**\n3. The Polonized elite abandoned their Ukrainian identity.\n   > [!answer] **Полонізована еліта зреклася своєї української ідентичності.**\n---\n\n## Продукція\n\n### Обговоріть\n\n1. Чому польське панування можна вважати формою колоніалізму?\n\n2. Яку роль відіграли братства та Києво-Могилянська академія в збереженні української культури?\n\n3. Як панщина та релігійні гоніння призвели до козацьких повстань?\n\n### Напишіть (150-200 слів)\n\nПорівняйте становище українців у Литві та в Речі Посполитій. Що змінилося на гірше? Що залишилося?\n\n---\n\n\n---\n\n\n---\n\n\n---"
      },
      {
        "id": "section-summary",
        "name": "Підсумок",
        "nameEn": "Summary",
        "type": "summary",
        "content": "## Хронологія\n\n| Рік | Подія |\n|-----|-------|\n| 1569 | Люблінська унія — Україна під Польщею |\n| 1581 | Острозька Біблія |\n| 1596 | Брестська унія — розкол церкви |\n| 1632 | Києво-Могилянська академія |\n| 1648 | Хмельниччина (початок) |\n\n## Ключові явища\n\n| Явище | Суть |\n|-------|------|\n| Панщина | 5-6 днів примусової праці |\n| Брестська унія | Розкол православних |\n| Полонізація | Асиміляція еліти |\n| Братства | Культурний спротив |\n\n---\n\n> **Чому це важливо**\n>\n> Польський період — це урок того, як *системне* гноблення руйнує суспільство. Панщина, релігійні гоніння, асиміляція еліти — все це разом створило вибухову ситуацію.\n>\n> Але цей період також показує силу *спротиву*. Братства, друкарні, академія, козаки — українці боролися. Вони не здалися. І врешті — повстали.\n>\n> Коли хтось каже, що «українці — мирний народ без історії боротьби», згадайте Хмельниччину. Згадайте, що їй передувало. І зрозумійте: *ми боролися завжди*.\n>\n> **Слава Україні! Героям слава!**\n\n---\n\n## Наступний урок\n\nІсторія B2.2 завершена! Ви вивчили:\n- Дослов'янську Україну (Трипілля, скіфи, греки)\n- Київську Русь (виникнення, золота доба, занепад)\n- Галицько-Волинське королівство\n- Литовський період\n- Польське панування\n\nУ наступних модулях B2.3 — козацька доба та імперський період."
      }
    ],
    "rawMarkdown": "---\ntitle: \"History: Polish Rule\"\nsubtitle: \"Україна під Польщею\"\nphase: B2.2\nduration: 50\ntransliteration: none\ntags: [history, poland, serfdom, union, rzeczpospolita]\nobjectives:\n  - Вивчити польський період української історії\n  - Зрозуміти наслідки Люблінської унії\n  - Читати історичні тексти\n  - Розширити історичну лексику\n---\n\n# Зміст уроку\n\n## Вступ: Як з вільних селян зробили рабів\n\nУявіть таку сцену.\n\nРік 1550. Ви — український селянин у Литві. Життя непросте, але ви *вільні*. Ви обробляєте землю, платите податки, але можете переїхати в інше село, якщо вам не подобається пан. Ваші діти — ваші, не панські.\n\nРік 1600. Ви — той самий селянин. Але тепер ви під Польщею. І все змінилося. Ви працюєте на пана шість днів на тиждень. У вас залишається один день — неділя — для себе. Ви не можете залишити село без дозволу пана. Пан може вас продати. Пан може вас побити. Пан може забрати ваших дітей.\n\nЩо сталося за ці 50 років?\n\nЛюблінська унія. Річ Посполита. Польське панування.\n\nІсторія українського селянства під Польщею — це історія поступової втрати свободи. Це історія того, як мільйони вільних людей стали кріпаками — фактично рабами. І це історія того, як вони боролися за свою свободу.\n\nЦе — один із найтемніших періодів нашої історії. Але його треба знати, щоб зрозуміти, чому козаки повстали. Чому Хмельниччина сталася. Чому Україна — це нація борців.\n\n---\n\n## Розминка: До і після\n\n| Аспект | До Люблінської унії | Після |\n|--------|---------------------|-------|\n| Влада | Литовський князь | Польський магнат |\n| Мова | Руська (офіційна) | Польська |\n| Релігія | Православ'я захищене | Тиск католицизму |\n| Селяни | Відносно вільні | Кріпаки |\n| Еліта | Руська шляхта | Полонізована шляхта |\n\n---\n\n## Частина 1: Люблінська унія — катастрофа 1569 року\n\n### Що сталося?\n\n1 липня 1569 року в місті Люблін підписано документ, який змінив долю України на століття. Велике князівство Литовське та Польське королівство об'єдналися в єдину державу — Річ Посполиту.\n\n«Річ Посполита» — це латинський термін «Res Publica», що означає «спільна справа». Іронія в тому, що для українців ця «спільна справа» означала *втрату* всього.\n\n### Чому литовці погодились?\n\nЛитва переживала кризу. Війна з Москвою (Лівонська війна) виснажувала країну. Литовські магнати хотіли польської допомоги. Поляки погодились — але за ціну.\n\nЦіна: українські землі — Волинь, Київщина, Поділля, Брацлавщина — переходять *напряму* під Польську корону. Не під Литву в складі спільної держави — а безпосередньо під Польщу.\n\n### Що це означало для України?\n\n| Аспект | Зміна |\n|--------|-------|\n| Адміністрація | Литовські порядки → Польські воєводства |\n| Мова документів | Руська → Польська (поступово) |\n| Релігія | Рівноправ'я → Дискримінація православних |\n| Селяни | Обмежене кріпацтво → Повне закріпачення |\n| Еліта | Руська шляхта → Тиск полонізації |\n\n---\n\n> **Чи знали ви?**\n>\n> Українські воєводства в складі Речі Посполитої мали величезні території. Київське воєводство охоплювало понад 100 000 км² — більше, ніж сучасна Угорщина! Волинське, Подільське, Брацлавське воєводства — теж величезні.\n>\n> Але ці величезні території контролювали кілька десятків польських магнатів. Вишневецькі, Потоцькі, Конецпольські — вони володіли цілими «державами в державі». І ставилися до селян як до власності.\n\n---\n\n## Частина 2: Панщина — українське рабство\n\n### Як вільні селяни стали рабами\n\nЗакріпачення не сталося за один день. Це був повільний процес — закон за законом, обмеження за обмеженням.\n\n| Рік | Закон | Наслідок |\n|-----|-------|----------|\n| 1496 | Заборона переходу | Селяни не можуть залишати село |\n| 1505 | Обмеження прав | Селяни втрачають судовий захист |\n| 1520 | Збільшення панщини | Обов'язкова праця на пана |\n| 1573 | «Генріхові артикули» | Пан — суддя над селянами |\n| XVI-XVII ст. | Повне закріпачення | Селяни — власність пана |\n\n### Що таке панщина?\n\nПанщина — це примусова безоплатна праця селянина на землі пана. Спочатку це був один-два дні на тиждень. Потім три. Потім чотири. На момент козацьких повстань — п'ять-шість днів на тиждень.\n\nПодумайте про це. Шість днів на тиждень ви працюєте *безкоштовно* на когось іншого. У вас залишається *один день* — неділя — щоб обробити власну ділянку, вигодувати сім'ю, відпочити.\n\n### Права пана vs Права селянина\n\n| Пан міг | Селянин не міг |\n|---------|----------------|\n| Продати селянина | Залишити село без дозволу |\n| Покарати без суду | Скаржитися в суд |\n| Забрати землю | Володіти майном (все — панське) |\n| Відібрати дітей | Одружити дітей без дозволу |\n| Вбити (формально — ні, реально — без покарання) | Захистити себе |\n\n---\n\n> **Міф vs Факт**\n>\n> ❌ **Міф:** «Кріпацтво в Україні було такое саме, як у Росії — не краще, не гірше.»\n>\n> ✅ **Факт:** Польське кріпацтво було *жорстокішим* за ранньомосковське в багатьох аспектах. Поляки раніше закріпачили селян. Панщина в Україні досягала 5-6 днів на тиждень — більше, ніж у Росії того часу. І головне — в Україні кріпацтво впроваджували *чужинці* (поляки), що додавало національного приниження до соціального гноблення.\n\n---\n\n### Оренда — ще гірше\n\nБагато польських магнатів не хотіли самі управляти величезними маєтками. Вони здавали їх в *оренду*. Часто — євреям, яким було заборонено володіти землею, але дозволено орендувати.\n\nОрендар мав заплатити магнату фіксовану суму, а все зверху — його прибуток. Це створювало *стимул* вичавлювати з селян максимум. Орендар не думав про довгострокове — йому потрібен прибуток *зараз*.\n\nРезультат: ще більше гноблення. Селяни ненавиділи і панів, і орендарів. Це пояснює жорстокість козацьких повстань — накопичена ненависть вихлюпувалась.\n\n---\n\n> **Чи знали ви?**\n>\n> Літопис XVII століття описує життя українського селянина так:\n>\n> *«Селянин працює на пана від зорі до зорі. Шість днів — панщина. У неділю — своє поле. Якщо не встигне — голод. Пан може взяти останню корову, останній хліб. Якщо селянин втече — його ловлять, б'ють, калічать.»*\n>\n> Це не метафора. Це буквальний опис життя мільйонів українців протягом двох століть.\n\n---\n\n## Частина 3: Релігійна війна — Брестська унія\n\n### Чому віра мала значення?\n\nУ XVI столітті релігія — це не просто «приватна справа». Це ідентичність. Це політика. Це права.\n\nУ Речі Посполитій католики мали привілеї. Православні — ні. Щоб отримати посаду, потрібно було бути католиком. Щоб просунутися в суспільстві — бути католиком. Православні були громадянами «другого сорту».\n\n### Брестська унія 1596 року\n\nУ 1596 році частина православних єпископів підписала унію з Римом. Вони визнали владу Папи, але зберегли православний обряд. Так виникла *Греко-католицька* (уніатська) церква.\n\n| Аспект | Деталі |\n|--------|--------|\n| Дата | 9-10 жовтня 1596 |\n| Місце | Берестя (Брест) |\n| Суть | Частина православних визнала Папу |\n| Нова церква | Греко-католицька (уніатська) |\n| Обряд | Православний (східний) |\n| Підпорядкування | Папа Римський |\n\n### Чому єпископи погодились?\n\nМотиви були різні:\n- **Кар'єризм**: Уніати отримували права нарівні з католиками\n- **Відчай**: Православна церква була в занепаді, без підтримки\n- **Ідеалізм**: Деякі вірили, що унія об'єднає християн\n- **Тиск**: Польська влада підтримувала унію\n\n### Розкол\n\nАле не всі погодились. Частина єпископів, більшість духовенства та простий народ *відкинули* унію. Православна церква продовжила існувати — тепер як «нелегальна».\n\n| Група | Позиція |\n|-------|---------|\n| Уніатські єпископи | Прийняли унію |\n| Православні єпископи | Відкинули унію |\n| Більшість духовенства | Православні |\n| Козаки | Категорично православні |\n| Селяни | Переважно православні |\n| Полонізована шляхта | Католики або уніати |\n\n---\n\n> **Міф vs Факт**\n>\n> ❌ **Міф:** «Греко-католики — \"зрадники\" православ'я.»\n>\n> ✅ **Факт:** Історія складніша. Багато хто прийняв унію під тиском, без вибору. Пізніше греко-католицька церква стала *захисником* української ідентичності — особливо в Галичині під Австрією, а потім у боротьбі з радянською владою. Засуджувати греко-католиків як «зрадників» — спрощення. Краще розуміти історичний контекст.\n\n---\n\n## Частина 4: Культурний спротив — братства та академія\n\nПопри всі гоніння, українська культура не зникла. Вона *боролася*.\n\n### Братства\n\nБратства — це міські організації, які захищали православ'я та українську культуру. Вони створювали школи, друкарні, бібліотеки.\n\n| Братство | Місто | Досягнення |\n|----------|-------|------------|\n| Львівське | Львів | Школа (1586), друкарня, «Граматика» |\n| Острозьке | Острог | Академія (1576), Острозька Біблія (1581) |\n| Київське | Київ | Школа, підтримка Лаври |\n| Віленське | Вільно | Школа, друкарня |\n\n### Острозька Біблія (1581)\n\nЦе була перша повна Біблія церковнослов'янською мовою. Надрукована в Острозі Іваном Федоровим — першим українським друкарем.\n\nЧому це важливо? Біблія — найважливіша книга для християн. Мати власну Біблію — це мати *легітимність*. Православні могли сказати: «У нас є Святе Письмо нашою мовою. Ми — справжні християни.»\n\n### Києво-Могилянська академія (1632)\n\nУ 1632 році митрополит Петро Могила об'єднав школу Києво-Печерської лаври та Київського братства. Так виникла Києво-Могилянська академія — перший вищий навчальний заклад у Східній Європі.\n\nАкадемія викладала:\n- Латину (мова науки)\n- Грецьку (мова церкви)\n- Церковнослов'янську\n- Риторику, філософію, богослов'я\n\nТут навчалися майбутні гетьмани, митрополити, письменники. Це був *інтелектуальний центр* України.\n\n---\n\n> **Чи знали ви?**\n>\n> Києво-Могилянська академія стала зразком для Московської академії (1687). Коли Петро I почав модернізувати Росію, він запрошував саме випускників *Київської* академії — бо освічених людей у Московії просто не було.\n>\n> Феофан Прокопович, головний ідеолог петровських реформ — випускник Києво-Могилянки. Так само — багато інших діячів російської культури XVIII століття. Вони були *українцями* за походженням та освітою.\n\n---\n\n## Частина 5: Полонізація — як втрачали ідентичність\n\n### Що таке полонізація?\n\nПолонізація — це процес переходу на польську мову та культуру. Для української еліти це часто був *свідомий вибір* — спосіб отримати привілеї, зробити кар'єру, увійти в «вищий світ».\n\n### Як це виглядало?\n\nПокоління 1: Руська шляхта. Православні. Говорять руською. Одружуються з руськими.\n\nПокоління 2: Руська шляхта, але діти їздять в Польщу на навчання. Вивчають латину, польську. Повертаються «європейцями».\n\nПокоління 3: Говорять польською вдома. Переходять у католицизм (або унію). Руська мова — «хлопська».\n\nПокоління 4: Вважають себе поляками. Руське походження — «сором».\n\n### Приклад: Вишневецькі\n\nРід Вишневецьких — класичний приклад.\n\n- **Дмитро Вишневецький** (XVI ст.): православний, козацький ватажок, герой народних дум «Байда».\n- **Єремія Вишневецький** (XVII ст.): католик, полонізований магнат, *ворог* козаків, один із найжорстокіших переслідувачів Хмельницького.\n\nЗа два-три покоління — від козацького героя до козацького ката.\n\n---\n\n> **Міф vs Факт**\n>\n> ❌ **Міф:** «Полонізація була насильницькою — поляки примушували переходити на польську мову.»\n>\n> ✅ **Факт:** Полонізація здебільшого була *добровільною* — для еліти. Ніхто не тримав пістолета біля скроні. Але *система* була побудована так, що без полонізації неможливо було просунутися. Це більш підступна форма асиміляції — через привілеї, а не через насильство.\n>\n> Селян ніхто не полонізував — вони і так не мали прав. Вони залишалися українськими (руськими) — і саме з них пізніше виросла козацька нація.\n\n---\n\n## Чому це призвело до вибуху\n\nПідсумуємо. До середини XVII століття в Україні:\n\n- **Селяни** — кріпаки, фактичні раби, працюють 6 днів на тиждень\n- **Православні** — громадяни «другого сорту», їхню церкву переслідують\n- **Козаки** — вільні воїни, але їхні права постійно обмежують\n- **Еліта** — полонізується, зраджує свій народ\n\nЦе була вибухова суміш. Потрібна була лише іскра.\n\nУ 1648 році ця іскра спалахнула. Богдан Хмельницький підняв повстання. Почалася Хмельниччина — найбільша козацька війна в історії.\n\nАле це — тема наступних модулів.\n\n---\n\n## Практика\n\n### Завдання 1: Заповніть пропуски\n\n1. Люблінська унія підписана у ___ році.\n   > [!answer] **1569**\n2. Брестська унія створила ___ церкву.\n   > [!answer] **греко-католицьку**\n3. Острозьку Біблію надруковано у ___ році.\n   > [!answer] **1581**\n4. Києво-Могилянську академію заснував ___.\n   > [!answer] **Петро Могила**\n5. Примусова безоплатна праця на пана — це ___.\n   > [!answer] **панщина**\n### Завдання 2: Хронологія\n\nРозставте в правильному порядку:\n\n1. Брестська унія\n2. Люблінська унія\n3. Острозька Біблія\n4. Києво-Могилянська академія\n\n**Відповідь:** 2 (1569) → 3 (1581) → 1 (1596) → 4 (1632)\n\n### Завдання 3: Перекладіть\n\n1. Serfdom deprived peasants of their freedom.\n   > [!answer] **Кріпацтво позбавило селян свободи.**\n2. The brotherhoods defended Orthodox culture.\n   > [!answer] **Братства захищали православну культуру.**\n3. The Polonized elite abandoned their Ukrainian identity.\n   > [!answer] **Полонізована еліта зреклася своєї української ідентичності.**\n---\n\n## Продукція\n\n### Обговоріть\n\n1. Чому польське панування можна вважати формою колоніалізму?\n\n2. Яку роль відіграли братства та Києво-Могилянська академія в збереженні української культури?\n\n3. Як панщина та релігійні гоніння призвели до козацьких повстань?\n\n### Напишіть (150-200 слів)\n\nПорівняйте становище українців у Литві та в Речі Посполитій. Що змінилося на гірше? Що залишилося?\n\n---\n\n# Вправи\n\n## quiz: Україна під Польщею\n\n> Виберіть правильну відповідь.\n\n1. Люблінська унія підписана у:\n   - [x] 1569 році\n   - [ ] 1596 році\n   - [ ] 1632 році\n   > Об'єднання Польщі та Литви.\n\n2. Брестська унія (1596) створила:\n   - [ ] нову православну церкву\n   - [x] греко-католицьку церкву\n   - [ ] протестантську церкву\n   > Унія з Римом зі збереженням східного обряду.\n\n3. «Панщина» — це:\n   - [x] примусова безоплатна праця на пана\n   - [ ] добровільний податок\n   - [ ] військова служба\n   > 5-6 днів на тиждень.\n\n4. Першу повну Біблію церковнослов'янською надрукував:\n   - [x] Іван Федоров\n   - [ ] Петро Могила\n   - [ ] Богдан Хмельницький\n   > Острозька Біблія, 1581.\n\n5. Києво-Могилянську академію засновано у:\n   - [ ] 1569 році\n   - [ ] 1596 році\n   - [x] 1632 році\n   > Петро Могила.\n\n6. Полонізація означала:\n   - [x] перехід на польську мову та культуру\n   - [ ] захист української мови\n   - [ ] військову службу\n   > Асиміляція еліти.\n\n7. **[Інтеграція: пасив]** Офіційний текст: «Унію ___ у 1596 році.»\n   - [x] підписано\n   - [ ] підписали\n   - [ ] підписується\n   > Офіційний/історичний → -но/-то.\n\n8. **[Інтеграція: регістр]** Публіцистика: «Братства ___ героїчну роль у збереженні культури.»\n   - [ ] відіграно\n   - [x] відіграли\n   - [ ] відіграють\n   > Публіцистичний/оцінний → активний стан.\n\n---\n\n# Словник\n\n| Слово | Вимова | Переклад | Приклад |\n|-------|--------|----------|---------|\n| Річ Посполита | /rʲitʃ pɔspɔˈlɪtɑ/ | Commonwealth | Річ Посполита — польсько-литовська держава. |\n| панщина | /ˈpɑnʃt͡ʃɪnɑ/ | serfdom, corvée | Панщина — 6 днів на тиждень. |\n| кріпак | /krʲiˈpɑk/ | serf | Кріпак не міг залишити село. |\n| закріпачення | /zɑkrʲipɑˈtʃɛnʲːɑ/ | enserfment | Закріпачення тривало століття. |\n| магнат | /mɑɦˈnɑt/ | magnate | Магнати володіли величезними землями. |\n| уніат | /unʲiˈjɑt/ | Uniate | Уніати визнали владу Папи. |\n| спротив | /sprɔˈtɪw/ | resistance | Культурний спротив — братства. |\n| гноблення | /ɦnɔˈblɛnʲːɑ/ | oppression | Гноблення селян призвело до повстань. |\n| оренда | /ɔˈrɛndɑ/ | lease | Оренда маєтків погіршувала становище. |\n\n---\n\n# Review Vocabulary\n\n| Word | First Module |\n|------|-------------|\n| шляхта | 196 |\n| братство | 63 |\n| полонізація | 196 |\n\n---\n\n# Підсумок\n\n## Хронологія\n\n| Рік | Подія |\n|-----|-------|\n| 1569 | Люблінська унія — Україна під Польщею |\n| 1581 | Острозька Біблія |\n| 1596 | Брестська унія — розкол церкви |\n| 1632 | Києво-Могилянська академія |\n| 1648 | Хмельниччина (початок) |\n\n## Ключові явища\n\n| Явище | Суть |\n|-------|------|\n| Панщина | 5-6 днів примусової праці |\n| Брестська унія | Розкол православних |\n| Полонізація | Асиміляція еліти |\n| Братства | Культурний спротив |\n\n---\n\n> **Чому це важливо**\n>\n> Польський період — це урок того, як *системне* гноблення руйнує суспільство. Панщина, релігійні гоніння, асиміляція еліти — все це разом створило вибухову ситуацію.\n>\n> Але цей період також показує силу *спротиву*. Братства, друкарні, академія, козаки — українці боролися. Вони не здалися. І врешті — повстали.\n>\n> Коли хтось каже, що «українці — мирний народ без історії боротьби», згадайте Хмельниччину. Згадайте, що їй передувало. І зрозумійте: *ми боролися завжди*.\n>\n> **Слава Україні! Героям слава!**\n\n---\n\n## Наступний урок\n\nІсторія B2.2 завершена! Ви вивчили:\n- Дослов'янську Україну (Трипілля, скіфи, греки)\n- Київську Русь (виникнення, золота доба, занепад)\n- Галицько-Волинське королівство\n- Литовський період\n- Польське панування\n\nУ наступних модулях B2.3 — козацька доба та імперський період.\n",
    "createdAt": "2025-12-05T01:15:58.032Z",
    "modifiedAt": "2025-12-05T01:15:58.032Z",
    "version": 2
  },
  "activities": [
    {
      "id": "act-a1-0-quiz",
      "type": "quiz",
      "title": "Україна під Польщею",
      "description": "Виберіть правильну відповідь.",
      "content": {
        "type": "quiz",
        "questions": [
          {
            "question": "Люблінська унія підписана у:",
            "options": [
              "1569 році",
              "1596 році",
              "1632 році"
            ],
            "correctIndex": 0,
            "explanation": "Об'єднання Польщі та Литви."
          },
          {
            "question": "Брестська унія (1596) створила:",
            "options": [
              "нову православну церкву",
              "греко-католицьку церкву",
              "протестантську церкву"
            ],
            "correctIndex": 1,
            "explanation": "Унія з Римом зі збереженням східного обряду."
          },
          {
            "question": "«Панщина» — це:",
            "options": [
              "примусова безоплатна праця на пана",
              "добровільний податок",
              "військова служба"
            ],
            "correctIndex": 0,
            "explanation": "5-6 днів на тиждень."
          },
          {
            "question": "Першу повну Біблію церковнослов'янською надрукував:",
            "options": [
              "Іван Федоров",
              "Петро Могила",
              "Богдан Хмельницький"
            ],
            "correctIndex": 0,
            "explanation": "Острозька Біблія, 1581."
          },
          {
            "question": "Києво-Могилянську академію засновано у:",
            "options": [
              "1569 році",
              "1596 році",
              "1632 році"
            ],
            "correctIndex": 2,
            "explanation": "Петро Могила."
          },
          {
            "question": "Полонізація означала:",
            "options": [
              "перехід на польську мову та культуру",
              "захист української мови",
              "військову службу"
            ],
            "correctIndex": 0,
            "explanation": "Асиміляція еліти."
          },
          {
            "question": "**[Інтеграція: пасив]** Офіційний текст: «Унію ___ у 1596 році.»",
            "options": [
              "підписано",
              "підписали",
              "підписується"
            ],
            "correctIndex": 0,
            "explanation": "Офіційний/історичний → -но/-то."
          },
          {
            "question": "**[Інтеграція: регістр]** Публіцистика: «Братства ___ героїчну роль у збереженні культури.»",
            "options": [
              "відіграно",
              "відіграли",
              "відіграють"
            ],
            "correctIndex": 1,
            "explanation": "Публіцистичний/оцінний → активний стан."
          }
        ],
        "shuffleQuestions": true,
        "shuffleOptions": true,
        "showCorrectAnswers": true
      },
      "subject": "language",
      "owner": "curricula-opus",
      "visibility": "public",
      "language": "uk",
      "difficultyLevel": "B2",
      "duration": 5,
      "tags": [],
      "createdAt": "2025-12-05T01:15:58.032Z",
      "modifiedAt": "2025-12-05T01:15:58.032Z"
    }
  ],
  "vocabulary": {
    "moduleId": "mod-uk-B2-37",
    "level": "B2",
    "phase": "B2.2",
    "wordCount": 12,
    "newWordCount": 9,
    "reviewWordCount": 3,
    "transliterationMode": "none",
    "words": [
      {
        "id": "v-rich-pospolyta-0-0",
        "uk": "Річ Посполита",
        "en": "Commonwealth",
        "pos": "noun",
        "ipa": "/rʲitʃ pɔspɔˈlɪtɑ/",
        "note": "Річ Посполита — польсько-литовська держава.",
        "isNew": true,
        "firstModule": 0
      },
      {
        "id": "v-panshchyna-0-1",
        "uk": "панщина",
        "en": "serfdom, corvée",
        "pos": "noun",
        "ipa": "/ˈpɑnʃt͡ʃɪnɑ/",
        "note": "Панщина — 6 днів на тиждень.",
        "isNew": true,
        "firstModule": 0
      },
      {
        "id": "v-kripak-0-2",
        "uk": "кріпак",
        "en": "serf",
        "pos": "noun",
        "ipa": "/krʲiˈpɑk/",
        "note": "Кріпак не міг залишити село.",
        "isNew": true,
        "firstModule": 0
      },
      {
        "id": "v-zakripachennya-0-3",
        "uk": "закріпачення",
        "en": "enserfment",
        "pos": "noun",
        "ipa": "/zɑkrʲipɑˈtʃɛnʲːɑ/",
        "note": "Закріпачення тривало століття.",
        "isNew": true,
        "firstModule": 0
      },
      {
        "id": "v-mahnat-0-4",
        "uk": "магнат",
        "en": "magnate",
        "pos": "noun",
        "ipa": "/mɑɦˈnɑt/",
        "note": "Магнати володіли величезними землями.",
        "isNew": true,
        "firstModule": 0
      },
      {
        "id": "v-uniat-0-5",
        "uk": "уніат",
        "en": "Uniate",
        "pos": "noun",
        "ipa": "/unʲiˈjɑt/",
        "note": "Уніати визнали владу Папи.",
        "isNew": true,
        "firstModule": 0
      },
      {
        "id": "v-sprotyv-0-6",
        "uk": "спротив",
        "en": "resistance",
        "pos": "noun",
        "ipa": "/sprɔˈtɪw/",
        "note": "Культурний спротив — братства.",
        "isNew": true,
        "firstModule": 0
      },
      {
        "id": "v-hnoblennya-0-7",
        "uk": "гноблення",
        "en": "oppression",
        "pos": "noun",
        "ipa": "/ɦnɔˈblɛnʲːɑ/",
        "note": "Гноблення селян призвело до повстань.",
        "isNew": true,
        "firstModule": 0
      },
      {
        "id": "v-orenda-0-8",
        "uk": "оренда",
        "en": "lease",
        "pos": "noun",
        "ipa": "/ɔˈrɛndɑ/",
        "note": "Оренда маєтків погіршувала становище.",
        "isNew": true,
        "firstModule": 0
      }
    ],
    "reviewWords": [
      {
        "id": "v-shlyakhta-0-1000",
        "uk": "шляхта",
        "en": "",
        "pos": "noun",
        "isNew": false,
        "firstModule": 196
      },
      {
        "id": "v-bratstvo-0-1001",
        "uk": "братство",
        "en": "",
        "pos": "noun",
        "isNew": false,
        "firstModule": 63
      },
      {
        "id": "v-polonizatsiya-0-1002",
        "uk": "полонізація",
        "en": "",
        "pos": "noun",
        "isNew": false,
        "firstModule": 196
      }
    ]
  }
}