{
  "$schema": "../../../schemas/vibe-module.schema.json",
  "lesson": {
    "id": "lesson-uk-A2-41",
    "moduleId": "mod-uk-A2-41",
    "languagePair": "l2-uk-en",
    "subject": "language",
    "owner": "curricula-opus",
    "visibility": "public",
    "language": "uk",
    "targetLevel": "A2",
    "phase": "A2.4",
    "moduleNumber": 41,
    "moduleType": "grammar",
    "pedagogy": "PPP",
    "immersionLevel": 0.4,
    "title": "Root Families II",
    "titleUk": null,
    "subtitle": "Motion and Perception Roots",
    "description": "Learner knows perception root families",
    "objectives": [
      "Learner knows perception root families",
      "Learner knows speaking root families",
      "Learner can recognize word connections"
    ],
    "objectivesUk": null,
    "grammarFocus": [
      "perception roots",
      "speaking roots"
    ],
    "tags": [
      "grammar",
      "word-formation",
      "roots"
    ],
    "totalDuration": "60 min",
    "transliterationMode": "none",
    "sections": [
      {
        "id": "section-1",
        "name": "Summary",
        "nameEn": null,
        "type": "summary",
        "content": "**ÐšÐ¾Ñ€Ñ–Ð½ÑŒ Ð±Ð°Ñ‡-:**\n- Ð±Ð°Ñ‡Ð¸Ñ‚Ð¸\n- Ð±Ð°Ñ‡ÐµÐ½Ð½Ñ\n- Ð¿Ð¾Ð±Ð°Ñ‡ÐµÐ½Ð½Ñ\n- Ð¿ÐµÑ€ÐµÐ´Ð±Ð°Ñ‡ÐµÐ½Ð½Ñ\n\n**ÐšÐ¾Ñ€Ñ–Ð½ÑŒ ÑÐ»ÑƒÑ…-/Ñ‡ÑƒÑ‚-:**\n- ÑÐ»ÑƒÑ…Ð°Ñ‚Ð¸\n- ÑÐ»ÑƒÑ…\n- ÑÐ»ÑƒÑ…Ð°Ñ‡\n- Ñ‡ÑƒÑ‚Ð¸\n- Ð¿Ð¾Ñ‡ÑƒÑ‚Ñ‚Ñ\n- Ð²Ñ–Ð´Ñ‡ÑƒÑ‚Ñ‚Ñ\n\n**ÐšÐ¾Ñ€Ñ–Ð½ÑŒ Ð³Ð¾Ð²Ð¾Ñ€-/Ð¼Ð¾Ð²-:**\n- Ð³Ð¾Ð²Ð¾Ñ€Ð¸Ñ‚Ð¸\n- Ñ€Ð¾Ð·Ð¼Ð¾Ð²Ð°\n- Ð¼Ð¾Ð²Ð°\n- Ð¼Ð¾Ð²Ð»ÐµÐ½Ð½Ñ\n- Ð¼Ð¾Ð²Ñ‡Ð°Ñ‚Ð¸\n- Ð¼Ð¾Ð²Ñ‡Ð°Ð½Ð½Ñ\n\nÐ¦Ñ– ÐºÐ¾Ñ€ÐµÐ½Ñ– Ð´Ð¾Ð¿Ð¾Ð¼Ð°Ð³Ð°ÑŽÑ‚ÑŒ Ñ€Ð¾Ð·ÑƒÐ¼Ñ–Ñ‚Ð¸ Ð½Ð¾Ð²Ñ– ÑÐ»Ð¾Ð²Ð° Ð°Ð²Ñ‚Ð¾Ð¼Ð°Ñ‚Ð¸Ñ‡Ð½Ð¾!\n\n---\n\n\n\n> ðŸ’¡ **ÐœÐ¾Ð²Ð° ÑÐº Ð´ÐµÑ€ÐµÐ²Ð¾**\n>\n> Â«Ð¡Ð»Ð¾Ð²Ð¾ â€” Ð½Ðµ Ð³Ð¾Ñ€Ð¾Ð±ÐµÑ†ÑŒ, Ð²Ð¸Ð»ÐµÑ‚Ð¸Ñ‚ÑŒ â€” Ð½Ðµ ÑÐ¿Ñ–Ð¹Ð¼Ð°Ñ”Ñˆ.Â» (ÐšÐ¾Ñ€Ñ–Ð½ÑŒ ÑÐ»Ð¾Ð²Ð° â€” ÐºÐ»ÑŽÑ‡ Ð´Ð¾ Ð·Ð½Ð°Ñ‡ÐµÐ½Ð½Ñ!)\n>\n> *Translation: \"A word is not a sparrow â€” once spoken, you can't take it back.\"*\n\n> ðŸ‡ºðŸ‡¦ **Ð Ð¾Ð´Ð¸Ð½Ð¸ ÐºÐ¾Ñ€ÐµÐ½Ñ–Ð² â€” ÐºÐ»ÑŽÑ‡ Ð´Ð¾ Ñ€Ð¾Ð·ÑƒÐ¼Ñ–Ð½Ð½Ñ**\n>\n> ÐšÐ¾Ð»Ð¸ Ð²Ð¸ Ð·Ð½Ð°Ñ”Ñ‚Ðµ Ð¾Ð´Ð¸Ð½ ÐºÐ¾Ñ€Ñ–Ð½ÑŒ, Ð²Ð¸ Ð·Ð½Ð°Ñ”Ñ‚Ðµ Ð´ÐµÑÑÑ‚ÐºÐ¸ ÑÐ»Ñ–Ð²:\n> - **ÑƒÑ‡-**: Ð²Ñ‡Ð¸Ñ‚Ð¸, ÑƒÑ‡ÐµÐ½ÑŒ, ÑƒÑ‡Ð¸Ñ‚ÐµÐ»ÑŒ, Ð½Ð°Ð²Ñ‡Ð°Ð½Ð½Ñ, Ð²Ð¸Ð²Ñ‡Ð°Ñ‚Ð¸\n> - **Ð»ÑŽÐ±-**: Ð»ÑŽÐ±Ð¸Ñ‚Ð¸, Ð»ÑŽÐ±Ð¾Ð², Ð»ÑŽÐ±Ð¸Ð¹, Ð¿Ð¾Ð»ÑŽÐ±Ð¸Ñ‚Ð¸\n> - **Ð¿Ð¸Ñ-**: Ð¿Ð¸ÑÐ°Ñ‚Ð¸, Ð¿Ð¸ÑÑŒÐ¼Ð¾, Ð¿Ð¸ÑÑŒÐ¼ÐµÐ½Ð½Ð¸Ðº, Ð·Ð°Ð¿Ð¸ÑÐ°Ñ‚Ð¸\n>\n> Ð¨ÑƒÐºÐ°Ð¹Ñ‚Ðµ ÐºÐ¾Ñ€ÐµÐ½Ñ– Ñƒ Ð½Ð¾Ð²Ð¸Ñ… ÑÐ»Ð¾Ð²Ð°Ñ… â€” Ñ†Ðµ Ð½Ð°Ð¹ÐºÑ€Ð°Ñ‰Ð¸Ð¹ ÑÐ¿Ð¾ÑÑ–Ð± Ñ€Ð¾Ð·ÑˆÐ¸Ñ€Ð¸Ñ‚Ð¸ ÑÐ»Ð¾Ð²Ð½Ð¸Ðº!\n\n> [!resources] ðŸ”— External Resources\n>\n> **YouTube:** [25 COMMON UKRAINIAN PHRASES EVERY LEARNER MUST KNOW...](https://www.youtube.com/watch?v=aJ2Ldu2TaKA) â€” Speak Ukrainian\n>\n> **Grammar Guide:** [Ukrainian Grammar](https://www.ukrainianlessons.com/ukrainian-tenses/) â€” Grammar overview\n>\n> **Interactive:** [Talk Ukrainian](https://talkukrainian.com/) â€” Practice exercises\n\n---"
      },
      {
        "id": "section-2",
        "name": "Activities",
        "nameEn": null,
        "type": "activities",
        "content": "## match-up: Perception Roots\n\n> Match the word to its meaning.\n\n- Ð±Ð°Ñ‡Ð¸Ñ‚Ð¸ :: to see\n- Ð±Ð°Ñ‡ÐµÐ½Ð½Ñ :: vision\n- Ð¿Ð¾Ð±Ð°Ñ‡ÐµÐ½Ð½Ñ :: meeting/date\n- ÑÐ»ÑƒÑ…Ð°Ñ‚Ð¸ :: to listen\n- ÑÐ»ÑƒÑ… :: hearing\n- ÑÐ»ÑƒÑ…Ð°Ñ‡ :: listener\n- Ñ‡ÑƒÑ‚Ð¸ :: to hear\n- Ð¿Ð¾Ñ‡ÑƒÑ‚Ñ‚Ñ :: feeling\n\n## match-up: Speech Roots\n\n> Match the word to its meaning.\n\n- Ð³Ð¾Ð²Ð¾Ñ€Ð¸Ñ‚Ð¸ :: to speak\n- Ñ€Ð¾Ð·Ð¼Ð¾Ð²Ð° :: conversation\n- Ð¼Ð¾Ð²Ð° :: language\n- Ð¼Ð¾Ð²Ð»ÐµÐ½Ð½Ñ :: speech\n- Ð¼Ð¾Ð²Ñ‡Ð°Ñ‚Ð¸ :: to be silent\n- Ð¼Ð¾Ð²Ñ‡Ð°Ð½Ð½Ñ :: silence\n- Ð´ÑƒÐ¼Ð°Ñ‚Ð¸ :: to think\n- Ð´ÑƒÐ¼ÐºÐ° :: thought\n\n## fill-in: Root Families\n\n> Complete the sentences.\n\n1. Ð¯ Ñ…Ð¾Ñ‡Ñƒ [___] Ñ‚ÐµÐ±Ðµ. (see)\n   > [!answer] Ð±Ð°Ñ‡Ð¸Ñ‚Ð¸\n   > [!options] Ð±Ð°Ñ‡Ð¸Ñ‚Ð¸ | ÑÐ»ÑƒÑ…Ð°Ñ‚Ð¸ | Ð³Ð¾Ð²Ð¾Ñ€Ð¸Ñ‚Ð¸ | Ñ‡ÑƒÑ‚Ð¸\n\n2. [___] ÑƒÐ²Ð°Ð¶Ð½Ð¾! (Listen)\n   > [!answer] Ð¡Ð»ÑƒÑ…Ð°Ð¹\n   > [!options] Ð¡Ð»ÑƒÑ…Ð°Ð¹ | Ð‘Ð°Ñ‡ | Ð“Ð¾Ð²Ð¾Ñ€Ð¸ | ÐŸÐ¸ÑˆÐ¸\n\n3. Ð£ÐºÑ€Ð°Ñ—Ð½ÑÑŒÐºÐ° [___] ÐºÑ€Ð°ÑÐ¸Ð²Ð°. (language)\n   > [!answer] Ð¼Ð¾Ð²Ð°\n   > [!options] Ð¼Ð¾Ð²Ð° | Ñ€Ð¾Ð·Ð¼Ð¾Ð²Ð° | Ð¼Ð¾Ð²Ð»ÐµÐ½Ð½Ñ | ÑÐ»Ð¾Ð²Ð¾\n\n4. Ð¯ [___] Ð¼ÑƒÐ·Ð¸ÐºÑƒ Ð·Ð´Ð°Ð»ÐµÐºÑƒ. (hear)\n   > [!answer] Ñ‡ÑƒÑŽ\n   > [!options] Ñ‡ÑƒÑŽ | ÑÐ»ÑƒÑ…Ð°ÑŽ | Ð±Ð°Ñ‡Ñƒ | Ð³Ð¾Ð²Ð¾Ñ€ÑŽ\n\n5. ÐœÐ¸ Ð¼Ð°Ð»Ð¸ Ð³Ð°Ñ€Ð½Ñƒ [___]. (conversation)\n   > [!answer] Ñ€Ð¾Ð·Ð¼Ð¾Ð²Ñƒ\n   > [!options] Ñ€Ð¾Ð·Ð¼Ð¾Ð²Ñƒ | Ð¼Ð¾Ð²Ñƒ | ÑÐ»Ð¾Ð²Ð¾ | Ð±Ð°Ñ‡ÐµÐ½Ð½Ñ\n\n6. Ð’Ð¾Ð½Ð¸ Ð¼Ð°Ð»Ð¸ Ñ€Ð¾Ð¼Ð°Ð½Ñ‚Ð¸Ñ‡Ð½Ðµ [___]. (date)\n   > [!answer] Ð¿Ð¾Ð±Ð°Ñ‡ÐµÐ½Ð½Ñ\n   > [!options] Ð¿Ð¾Ð±Ð°Ñ‡ÐµÐ½Ð½Ñ | Ð±Ð°Ñ‡ÐµÐ½Ð½Ñ | Ñ€Ð¾Ð·Ð¼Ð¾Ð²Ð° | ÑÐ»ÑƒÑ…Ð°Ð½Ð½Ñ\n\n7. [___] Ð±ÑƒÐ»Ð¸ ÑƒÐ²Ð°Ð¶Ð½Ð¸Ð¼Ð¸. (listeners)\n   > [!answer] Ð¡Ð»ÑƒÑ…Ð°Ñ‡Ñ–\n   > [!options] Ð¡Ð»ÑƒÑ…Ð°Ñ‡Ñ– | ÐœÐ¾Ð²Ñ†Ñ– | Ð§Ð¸Ñ‚Ð°Ñ‡Ñ– | Ð“Ð»ÑÐ´Ð°Ñ‡Ñ–\n\n8. Ð‘ÑƒÐ´ÑŒ Ð»Ð°ÑÐºÐ°, [___]! (be silent)\n   > [!answer] Ð¼Ð¾Ð²Ñ‡Ð¸\n   > [!options] Ð¼Ð¾Ð²Ñ‡Ð¸ | Ð³Ð¾Ð²Ð¾Ñ€Ð¸ | ÑÐ»ÑƒÑ…Ð°Ð¹ | Ð´Ð¸Ð²Ð¸ÑÑŒ\n\n## quiz: Perception Roots\n\n1. Ð”Ð¾ ÑÐºÐ¾Ð³Ð¾ ÑÐ°Ð¼Ðµ Ñ‚Ð¸Ð¿Ñƒ ÑÐ¿Ñ€Ð¸Ð¹Ð½ÑÑ‚Ñ‚Ñ Ð²Ñ–Ð´Ð½Ð¾ÑÐ¸Ñ‚ÑŒÑÑ ÑƒÐºÑ€Ð°Ñ—Ð½ÑÑŒÐºÐ¸Ð¹ ÐºÐ¾Ñ€Ñ–Ð½ÑŒ \"Ð±Ð°Ñ‡-\" Ñƒ ÑÐ»Ð¾Ð²Ð°Ñ… \"Ð±Ð°Ñ‡Ð¸Ñ‚Ð¸\" Ñ‚Ð° \"Ð±Ð°Ñ‡ÐµÐ½Ð½Ñ\" Ð·Ð³Ñ–Ð´Ð½Ð¾ Ð· Ð»Ð¾Ð³Ñ–ÐºÐ¾ÑŽ Ð¼Ð¾Ð²Ð¸?\n   - [x] Ð¦ÐµÐ¹ ÐºÐ¾Ñ€Ñ–Ð½ÑŒ Ð±ÐµÐ·Ð¿Ð¾ÑÐµÑ€ÐµÐ´Ð½ÑŒÐ¾ Ð²Ñ–Ð´Ð½Ð¾ÑÐ¸Ñ‚ÑŒÑÑ Ð´Ð¾ Ð¿Ñ€Ð¾Ñ†ÐµÑÑƒ Ð±Ð°Ñ‡ÐµÐ½Ð½Ñ Ñ‚Ð° Ð·Ð¾Ñ€Ð¾Ð²Ð¾Ð³Ð¾ ÑÐ¿Ñ€Ð¸Ð¹Ð½ÑÑ‚Ñ‚Ñ ÑÐ²Ñ–Ñ‚Ñƒ\n   - [ ] Ð¦ÐµÐ¹ ÐºÐ¾Ñ€Ñ–Ð½ÑŒ Ð±ÐµÐ·Ð¿Ð¾ÑÐµÑ€ÐµÐ´Ð½ÑŒÐ¾ Ð²Ñ–Ð´Ð½Ð¾ÑÐ¸Ñ‚ÑŒÑÑ Ð´Ð¾ Ð¿Ñ€Ð¾Ñ†ÐµÑÑƒ ÑÐ»ÑƒÑ…Ð°Ð½Ð½Ñ Ñ‚Ð° Ð°ÑƒÐ´Ñ–Ð°Ð»ÑŒÐ½Ð¾Ð³Ð¾ ÑÐ¿Ñ€Ð¸Ð¹Ð½ÑÑ‚Ñ‚Ñ\n   - [ ] Ð¦ÐµÐ¹ ÐºÐ¾Ñ€Ñ–Ð½ÑŒ Ð±ÐµÐ·Ð¿Ð¾ÑÐµÑ€ÐµÐ´Ð½ÑŒÐ¾ Ð²Ñ–Ð´Ð½Ð¾ÑÐ¸Ñ‚ÑŒÑÑ Ð´Ð¾ Ð¿Ñ€Ð¾Ñ†ÐµÑÑƒ Ð³Ð¾Ð²Ð¾Ñ€Ñ–Ð½Ð½Ñ Ñ‚Ð° Ð¼Ð¾Ð²Ð»ÐµÐ½Ð½Ñ”Ð²Ð¾Ñ— Ð´Ñ–ÑÐ»ÑŒÐ½Ð¾ÑÑ‚Ñ–\n   - [ ] Ð¦ÐµÐ¹ ÐºÐ¾Ñ€Ñ–Ð½ÑŒ Ð±ÐµÐ·Ð¿Ð¾ÑÐµÑ€ÐµÐ´Ð½ÑŒÐ¾ Ð²Ñ–Ð´Ð½Ð¾ÑÐ¸Ñ‚ÑŒÑÑ Ð´Ð¾ Ð¿Ñ€Ð¾Ñ†ÐµÑÑƒ Ð´ÑƒÐ¼Ð°Ð½Ð½Ñ Ñ‚Ð° Ñ€Ð¾Ð·ÑƒÐ¼Ð¾Ð²Ð¾Ñ— Ð´Ñ–ÑÐ»ÑŒÐ½Ð¾ÑÑ‚Ñ–\n\n---\n\n2. Ð”Ð¾ ÑÐºÐ¾Ð³Ð¾ ÑÐ°Ð¼Ðµ Ñ‚Ð¸Ð¿Ñƒ ÑÐ¿Ñ€Ð¸Ð¹Ð½ÑÑ‚Ñ‚Ñ Ð²Ñ–Ð´Ð½Ð¾ÑÐ¸Ñ‚ÑŒÑÑ ÑƒÐºÑ€Ð°Ñ—Ð½ÑÑŒÐºÐ¸Ð¹ ÐºÐ¾Ñ€Ñ–Ð½ÑŒ \"ÑÐ»ÑƒÑ…-\" Ñƒ ÑÐ»Ð¾Ð²Ð°Ñ… \"ÑÐ»ÑƒÑ…Ð°Ñ‚Ð¸\" Ñ‚Ð° \"ÑÐ»ÑƒÑ…\" Ð·Ð³Ñ–Ð´Ð½Ð¾ Ð· Ð»Ð¾Ð³Ñ–ÐºÐ¾ÑŽ Ð¼Ð¾Ð²Ð¸?\n   - [x] Ð¦ÐµÐ¹ ÐºÐ¾Ñ€Ñ–Ð½ÑŒ Ð±ÐµÐ·Ð¿Ð¾ÑÐµÑ€ÐµÐ´Ð½ÑŒÐ¾ Ð²Ñ–Ð´Ð½Ð¾ÑÐ¸Ñ‚ÑŒÑÑ Ð´Ð¾ Ð¿Ñ€Ð¾Ñ†ÐµÑÑƒ Ð°ÐºÑ‚Ð¸Ð²Ð½Ð¾Ð³Ð¾ ÑÐ»ÑƒÑ…Ð°Ð½Ð½Ñ Ñ‚Ð° Ð°ÑƒÐ´Ñ–Ð°Ð»ÑŒÐ½Ð¾Ð³Ð¾ ÑÐ¿Ñ€Ð¸Ð¹Ð½ÑÑ‚Ñ‚Ñ\n   - [ ] Ð¦ÐµÐ¹ ÐºÐ¾Ñ€Ñ–Ð½ÑŒ Ð±ÐµÐ·Ð¿Ð¾ÑÐµÑ€ÐµÐ´Ð½ÑŒÐ¾ Ð²Ñ–Ð´Ð½Ð¾ÑÐ¸Ñ‚ÑŒÑÑ Ð´Ð¾ Ð¿Ñ€Ð¾Ñ†ÐµÑÑƒ Ð±Ð°Ñ‡ÐµÐ½Ð½Ñ Ñ‚Ð° Ð·Ð¾Ñ€Ð¾Ð²Ð¾Ð³Ð¾ ÑÐ¿Ñ€Ð¸Ð¹Ð½ÑÑ‚Ñ‚Ñ ÑÐ²Ñ–Ñ‚Ñƒ\n   - [ ] Ð¦ÐµÐ¹ ÐºÐ¾Ñ€Ñ–Ð½ÑŒ Ð±ÐµÐ·Ð¿Ð¾ÑÐµÑ€ÐµÐ´Ð½ÑŒÐ¾ Ð²Ñ–Ð´Ð½Ð¾ÑÐ¸Ñ‚ÑŒÑÑ Ð´Ð¾ Ð¿Ñ€Ð¾Ñ†ÐµÑÑƒ Ð´ÑƒÐ¼Ð°Ð½Ð½Ñ Ñ‚Ð° Ñ€Ð¾Ð·ÑƒÐ¼Ð¾Ð²Ð¾Ñ— Ð´Ñ–ÑÐ»ÑŒÐ½Ð¾ÑÑ‚Ñ– Ð»ÑŽÐ´Ð¸Ð½Ð¸\n   - [ ] Ð¦ÐµÐ¹ ÐºÐ¾Ñ€Ñ–Ð½ÑŒ Ð±ÐµÐ·Ð¿Ð¾ÑÐµÑ€ÐµÐ´Ð½ÑŒÐ¾ Ð²Ñ–Ð´Ð½Ð¾ÑÐ¸Ñ‚ÑŒÑÑ Ð´Ð¾ Ð¿Ñ€Ð¾Ñ†ÐµÑÑƒ Ð³Ð¾Ð²Ð¾Ñ€Ñ–Ð½Ð½Ñ Ñ‚Ð° Ð¼Ð¾Ð²Ð»ÐµÐ½Ð½Ñ”Ð²Ð¾Ñ— Ð´Ñ–ÑÐ»ÑŒÐ½Ð¾ÑÑ‚Ñ–\n\n---\n\n3. Ð”Ð¾ ÑÐºÐ¾Ñ— ÑÐ°Ð¼Ðµ ÑÑ„ÐµÑ€Ð¸ Ð´Ñ–ÑÐ»ÑŒÐ½Ð¾ÑÑ‚Ñ– Ð²Ñ–Ð´Ð½Ð¾ÑÑÑ‚ÑŒÑÑ ÑƒÐºÑ€Ð°Ñ—Ð½ÑÑŒÐºÑ– ÐºÐ¾Ñ€ÐµÐ½Ñ– \"Ð³Ð¾Ð²Ð¾Ñ€-\" Ñ‚Ð° \"Ð¼Ð¾Ð²-\" Ñƒ ÑÐ»Ð¾Ð²Ð°Ñ… \"Ð³Ð¾Ð²Ð¾Ñ€Ð¸Ñ‚Ð¸\" Ñ– \"Ð¼Ð¾Ð²Ð°\"?\n   - [x] Ð¦Ñ– ÐºÐ¾Ñ€ÐµÐ½Ñ– Ð±ÐµÐ·Ð¿Ð¾ÑÐµÑ€ÐµÐ´Ð½ÑŒÐ¾ Ð²Ñ–Ð´Ð½Ð¾ÑÑÑ‚ÑŒÑÑ Ð´Ð¾ ÑÑ„ÐµÑ€Ð¸ Ð³Ð¾Ð²Ð¾Ñ€Ñ–Ð½Ð½Ñ Ð¼Ð¾Ð²Ð»ÐµÐ½Ð½Ñ Ñ‚Ð° Ð¼Ð¾Ð²Ð½Ð¾Ñ— ÐºÐ¾Ð¼ÑƒÐ½Ñ–ÐºÐ°Ñ†Ñ–Ñ—\n   - [ ] Ð¦Ñ– ÐºÐ¾Ñ€ÐµÐ½Ñ– Ð±ÐµÐ·Ð¿Ð¾ÑÐµÑ€ÐµÐ´Ð½ÑŒÐ¾ Ð²Ñ–Ð´Ð½Ð¾ÑÑÑ‚ÑŒÑÑ Ð´Ð¾ ÑÑ„ÐµÑ€Ð¸ Ð±Ð°Ñ‡ÐµÐ½Ð½Ñ Ñ‚Ð° Ð·Ð¾Ñ€Ð¾Ð²Ð¾Ð³Ð¾ ÑÐ¿Ñ€Ð¸Ð¹Ð½ÑÑ‚Ñ‚Ñ\n   - [ ] Ð¦Ñ– ÐºÐ¾Ñ€ÐµÐ½Ñ– Ð±ÐµÐ·Ð¿Ð¾ÑÐµÑ€ÐµÐ´Ð½ÑŒÐ¾ Ð²Ñ–Ð´Ð½Ð¾ÑÑÑ‚ÑŒÑÑ Ð´Ð¾ ÑÑ„ÐµÑ€Ð¸ ÑÐ»ÑƒÑ…Ð°Ð½Ð½Ñ Ñ‚Ð° Ð°ÑƒÐ´Ñ–Ð°Ð»ÑŒÐ½Ð¾Ð³Ð¾ ÑÐ¿Ñ€Ð¸Ð¹Ð½ÑÑ‚Ñ‚Ñ\n   - [ ] Ð¦Ñ– ÐºÐ¾Ñ€ÐµÐ½Ñ– Ð±ÐµÐ·Ð¿Ð¾ÑÐµÑ€ÐµÐ´Ð½ÑŒÐ¾ Ð²Ñ–Ð´Ð½Ð¾ÑÑÑ‚ÑŒÑÑ Ð´Ð¾ ÑÑ„ÐµÑ€Ð¸ Ð´ÑƒÐ¼Ð°Ð½Ð½Ñ Ñ‚Ð° Ñ€Ð¾Ð·ÑƒÐ¼Ð¾Ð²Ð¾Ñ— Ð´Ñ–ÑÐ»ÑŒÐ½Ð¾ÑÑ‚Ñ–\n\n---\n\n4. Ð©Ð¾ ÑÐ°Ð¼Ðµ Ð¾Ð·Ð½Ð°Ñ‡Ð°Ñ” ÑƒÐºÑ€Ð°Ñ—Ð½ÑÑŒÐºÐµ ÑÐ»Ð¾Ð²Ð¾ \"Ð¿Ð¾Ð±Ð°Ñ‡ÐµÐ½Ð½Ñ\" ÑÐºÐµ ÑƒÑ‚Ð²Ð¾Ñ€ÐµÐ½Ðµ Ð²Ñ–Ð´ ÐºÐ¾Ñ€ÐµÐ½Ñ \"Ð±Ð°Ñ‡-\" Ð· Ð¿Ñ€ÐµÑ„Ñ–ÐºÑÐ¾Ð¼ \"Ð¿Ð¾-\" Ñƒ Ð¿Ð¾Ð²ÑÑÐºÐ´ÐµÐ½Ð½Ñ–Ð¹ Ð¼Ð¾Ð²Ñ–?\n   - [x] Ð¦Ðµ ÑÐ»Ð¾Ð²Ð¾ Ð¾Ð·Ð½Ð°Ñ‡Ð°Ñ” Ð·ÑƒÑÑ‚Ñ€Ñ–Ñ‡ Ð°Ð±Ð¾ Ð¿Ð¾Ð±Ð°Ñ‡ÐµÐ½Ð½Ñ Ð¼Ñ–Ð¶ Ð»ÑŽÐ´ÑŒÐ¼Ð¸ Ñƒ Ð¿ÐµÐ²Ð½Ð¸Ð¹ Ñ‡Ð°Ñ\n   - [ ] Ð¦Ðµ ÑÐ»Ð¾Ð²Ð¾ Ð¾Ð·Ð½Ð°Ñ‡Ð°Ñ” Ñ…ÑƒÐ´Ð¾Ð¶Ð½Ñ” Ð±Ð°Ñ‡ÐµÐ½Ð½Ñ Ð°Ð±Ð¾ Ð¿ÐµÑ€ÑÐ¿ÐµÐºÑ‚Ð¸Ð²Ñƒ Ð¼Ð¸Ñ‚Ñ†Ñ Ð½Ð° ÑÐ²Ñ–Ñ‚\n   - [ ] Ð¦Ðµ ÑÐ»Ð¾Ð²Ð¾ Ð¾Ð·Ð½Ð°Ñ‡Ð°Ñ” Ð¿ÐµÑ€ÐµÐ´Ð±Ð°Ñ‡ÐµÐ½Ð½Ñ Ð°Ð±Ð¾ Ð¿Ñ€Ð¾Ð³Ð½Ð¾Ð· Ð¼Ð°Ð¹Ð±ÑƒÑ‚Ð½Ñ–Ñ… Ð¿Ð¾Ð´Ñ–Ð¹\n   - [ ] Ð¦Ðµ ÑÐ»Ð¾Ð²Ð¾ Ð¾Ð·Ð½Ð°Ñ‡Ð°Ñ” Ð¿Ñ€Ð¾Ñ†ÐµÑ ÑÐ¿Ð¾ÑÑ‚ÐµÑ€ÐµÐ¶ÐµÐ½Ð½Ñ Ð°Ð±Ð¾ Ð´Ð¸Ð²Ð»ÐµÐ½Ð½Ñ Ð½Ð° Ñ‰Ð¾ÑÑŒ\n\n---\n\n5. Ð©Ð¾ ÑÐ°Ð¼Ðµ Ð¾Ð·Ð½Ð°Ñ‡Ð°Ñ” ÑƒÐºÑ€Ð°Ñ—Ð½ÑÑŒÐºÐµ ÑÐ»Ð¾Ð²Ð¾ \"ÑÐ»ÑƒÑ…Ð°Ñ‡\" ÑÐºÐµ ÑƒÑ‚Ð²Ð¾Ñ€ÐµÐ½Ðµ Ð²Ñ–Ð´ ÐºÐ¾Ñ€ÐµÐ½Ñ \"ÑÐ»ÑƒÑ…-\" Ð· ÑÑƒÑ„Ñ–ÐºÑÐ¾Ð¼ \"-Ð°Ñ‡\" Ñƒ ÐºÐ¾Ð½Ñ‚ÐµÐºÑÑ‚Ñ– Ð¾ÑÐ²Ñ–Ñ‚Ð¸?\n   - [x] Ð¦Ðµ ÑÐ»Ð¾Ð²Ð¾ Ð¾Ð·Ð½Ð°Ñ‡Ð°Ñ” Ð»ÑŽÐ´Ð¸Ð½Ñƒ ÑÐºÐ° ÑÐ»ÑƒÑ…Ð°Ñ” Ð»ÐµÐºÑ†Ñ–Ñ— Ð°Ð±Ð¾ Ñ€Ð°Ð´Ñ–Ð¾Ð¿ÐµÑ€ÐµÐ´Ð°Ñ‡Ñ– ÑƒÐ²Ð°Ð¶Ð½Ð¾\n   - [ ] Ð¦Ðµ ÑÐ»Ð¾Ð²Ð¾ Ð¾Ð·Ð½Ð°Ñ‡Ð°Ñ” Ð»ÑŽÐ´Ð¸Ð½Ñƒ ÑÐºÐ° Ð³Ð¾Ð²Ð¾Ñ€Ð¸Ñ‚ÑŒ Ð°Ð±Ð¾ Ð²Ð¸ÑÑ‚ÑƒÐ¿Ð°Ñ” Ð¿ÐµÑ€ÐµÐ´ Ð°ÑƒÐ´Ð¸Ñ‚Ð¾Ñ€Ñ–Ñ”ÑŽ Ð¿ÑƒÐ±Ð»Ñ–Ñ‡Ð½Ð¾\n   - [ ] Ð¦Ðµ ÑÐ»Ð¾Ð²Ð¾ Ð¾Ð·Ð½Ð°Ñ‡Ð°Ñ” Ð»ÑŽÐ´Ð¸Ð½Ñƒ ÑÐºÐ° Ð´Ð¸Ð²Ð¸Ñ‚ÑŒÑÑ Ð°Ð±Ð¾ ÑÐ¿Ð¾ÑÑ‚ÐµÑ€Ñ–Ð³Ð°Ñ” Ð·Ð° Ð¿Ð¾Ð´Ñ–ÑÐ¼Ð¸ Ð½Ð°Ð²ÐºÐ¾Ð»Ð¾\n   - [ ] Ð¦Ðµ ÑÐ»Ð¾Ð²Ð¾ Ð¾Ð·Ð½Ð°Ñ‡Ð°Ñ” Ð»ÑŽÐ´Ð¸Ð½Ñƒ ÑÐºÐ° Ð´ÑƒÐ¼Ð°Ñ” Ð°Ð±Ð¾ Ñ€Ð¾Ð·Ð´ÑƒÐ¼ÑƒÑ” Ð½Ð°Ð´ ÑÐºÐ»Ð°Ð´Ð½Ð¸Ð¼Ð¸ Ð¿Ð¸Ñ‚Ð°Ð½Ð½ÑÐ¼Ð¸\n\n---\n\n6. Ð¯ÐºÐ° ÑÐ°Ð¼Ðµ Ñ€Ñ–Ð·Ð½Ð¸Ñ†Ñ Ð¼Ñ–Ð¶ ÑƒÐºÑ€Ð°Ñ—Ð½ÑÑŒÐºÐ¸Ð¼Ð¸ ÑÐ»Ð¾Ð²Ð°Ð¼Ð¸ \"Ð¼Ð¾Ð²Ð°\" Ñ‚Ð° \"Ð¼Ð¾Ð²Ð»ÐµÐ½Ð½Ñ\" ÑÐºÑ– Ð¾Ð±Ð¸Ð´Ð²Ð° Ð¿Ð¾Ñ…Ð¾Ð´ÑÑ‚ÑŒ Ð²Ñ–Ð´ ÐºÐ¾Ñ€ÐµÐ½Ñ \"Ð¼Ð¾Ð²-\" Ñƒ Ð»Ñ–Ð½Ð³Ð²Ñ–ÑÑ‚Ð¸Ñ†Ñ–?\n   - [x] Ð¡Ð»Ð¾Ð²Ð¾ \"Ð¼Ð¾Ð²Ð°\" Ð¾Ð·Ð½Ð°Ñ‡Ð°Ñ” Ð¼Ð¾Ð²Ð½Ñƒ ÑÐ¸ÑÑ‚ÐµÐ¼Ñƒ Ð° \"Ð¼Ð¾Ð²Ð»ÐµÐ½Ð½Ñ\" Ð¾Ð·Ð½Ð°Ñ‡Ð°Ñ” Ð°ÐºÑ‚ Ð³Ð¾Ð²Ð¾Ñ€Ñ–Ð½Ð½Ñ\n   - [ ] Ð¡Ð»Ð¾Ð²Ð¾ \"Ð¼Ð¾Ð²Ð°\" Ð¾Ð·Ð½Ð°Ñ‡Ð°Ñ” Ð°ÐºÑ‚ Ð³Ð¾Ð²Ð¾Ñ€Ñ–Ð½Ð½Ñ Ð° \"Ð¼Ð¾Ð²Ð»ÐµÐ½Ð½Ñ\" Ð¾Ð·Ð½Ð°Ñ‡Ð°Ñ” Ð¼Ð¾Ð²Ð½Ñƒ ÑÐ¸ÑÑ‚ÐµÐ¼Ñƒ\n   - [ ] Ð¦Ñ– Ð´Ð²Ð° ÑÐ»Ð¾Ð²Ð° Ñ” Ð¿Ð¾Ð²Ð½Ð¸Ð¼Ð¸ ÑÐ¸Ð½Ð¾Ð½Ñ–Ð¼Ð°Ð¼Ð¸ Ñ– Ð¾Ð·Ð½Ð°Ñ‡Ð°ÑŽÑ‚ÑŒ Ð°Ð±ÑÐ¾Ð»ÑŽÑ‚Ð½Ð¾ Ð¾Ð´Ð½Ðµ Ð¹ Ñ‚Ðµ ÑÐ°Ð¼Ðµ\n   - [ ] Ð¡Ð»Ð¾Ð²Ð¾ \"Ð¼Ð¾Ð²Ð°\" Ð¾Ð·Ð½Ð°Ñ‡Ð°Ñ” Ð¿Ð¸ÑÑŒÐ¼Ð¾ Ð° \"Ð¼Ð¾Ð²Ð»ÐµÐ½Ð½Ñ\" Ð¾Ð·Ð½Ð°Ñ‡Ð°Ñ” ÑƒÑÐ½Ðµ ÑÐ¿Ñ–Ð»ÐºÑƒÐ²Ð°Ð½Ð½Ñ\n\n---\n\n7. Ð©Ð¾ ÑÐ°Ð¼Ðµ Ð¾Ð·Ð½Ð°Ñ‡Ð°Ñ” ÑƒÐºÑ€Ð°Ñ—Ð½ÑÑŒÐºÐµ Ð´Ñ–Ñ”ÑÐ»Ð¾Ð²Ð¾ \"Ð¼Ð¾Ð²Ñ‡Ð°Ñ‚Ð¸\" ÑÐºÐµ ÑƒÑ‚Ð²Ð¾Ñ€ÐµÐ½Ðµ Ð²Ñ–Ð´ ÐºÐ¾Ñ€ÐµÐ½Ñ \"Ð¼Ð¾Ð²-\" Ð· Ð´Ð¾Ð´Ð°Ñ‚ÐºÐ¾Ð²Ð¸Ð¼ ÐµÐ»ÐµÐ¼ÐµÐ½Ñ‚Ð¾Ð¼ \"-Ñ‡-\" Ñƒ Ð¿Ð¾Ð²ÑÑÐºÐ´ÐµÐ½Ð½Ñ–Ð¹ Ð¼Ð¾Ð²Ñ–?\n   - [x] Ð¦Ðµ Ð´Ñ–Ñ”ÑÐ»Ð¾Ð²Ð¾ Ð¾Ð·Ð½Ð°Ñ‡Ð°Ñ” Ð±ÑƒÑ‚Ð¸ Ð¼Ð¾Ð²Ñ‡Ð°Ð·Ð½Ð¸Ð¼ Ð°Ð±Ð¾ Ð½Ðµ Ð³Ð¾Ð²Ð¾Ñ€Ð¸Ñ‚Ð¸ Ð·Ð¾Ð²ÑÑ–Ð¼ Ñƒ Ð¿ÐµÐ²Ð½Ñ–Ð¹ ÑÐ¸Ñ‚ÑƒÐ°Ñ†Ñ–Ñ—\n   - [ ] Ð¦Ðµ Ð´Ñ–Ñ”ÑÐ»Ð¾Ð²Ð¾ Ð¾Ð·Ð½Ð°Ñ‡Ð°Ñ” Ð³Ð¾Ð²Ð¾Ñ€Ð¸Ñ‚Ð¸ Ð°Ð±Ð¾ Ñ€Ð¾Ð·Ð¼Ð¾Ð²Ð»ÑÑ‚Ð¸ Ð· Ñ–Ð½ÑˆÐ¸Ð¼Ð¸ Ð»ÑŽÐ´ÑŒÐ¼Ð¸ Ð°ÐºÑ‚Ð¸Ð²Ð½Ð¾\n   - [ ] Ð¦Ðµ Ð´Ñ–Ñ”ÑÐ»Ð¾Ð²Ð¾ Ð¾Ð·Ð½Ð°Ñ‡Ð°Ñ” ÑÐ»ÑƒÑ…Ð°Ñ‚Ð¸ Ð°Ð±Ð¾ ÑÐ¿Ñ€Ð¸Ð¹Ð¼Ð°Ñ‚Ð¸ Ð·Ð²ÑƒÐºÐ¸ Ð²ÑƒÑ…Ð°Ð¼Ð¸ ÑƒÐ²Ð°Ð¶Ð½Ð¾\n   - [ ] Ð¦Ðµ Ð´Ñ–Ñ”ÑÐ»Ð¾Ð²Ð¾ Ð¾Ð·Ð½Ð°Ñ‡Ð°Ñ” Ð´Ð¸Ð²Ð¸Ñ‚Ð¸ÑÑ Ð°Ð±Ð¾ ÑÐ¿Ð¾ÑÑ‚ÐµÑ€Ñ–Ð³Ð°Ñ‚Ð¸ Ð·Ð° Ð¿Ð¾Ð´Ñ–ÑÐ¼Ð¸ Ð¾Ñ‡Ð¸Ð¼Ð°\n\n---\n\n8. Ð¯ÐºÐ° ÑÐ°Ð¼Ðµ Ñ€Ñ–Ð·Ð½Ð¸Ñ†Ñ Ð¼Ñ–Ð¶ ÑƒÐºÑ€Ð°Ñ—Ð½ÑÑŒÐºÐ¸Ð¼Ð¸ ÑÐ»Ð¾Ð²Ð°Ð¼Ð¸ \"Ð¿Ð¾Ñ‡ÑƒÑ‚Ñ‚Ñ\" Ñ‚Ð° \"Ð²Ñ–Ð´Ñ‡ÑƒÑ‚Ñ‚Ñ\" ÑÐºÑ– Ð¾Ð±Ð¸Ð´Ð²Ð° Ð¿Ð¾Ñ…Ð¾Ð´ÑÑ‚ÑŒ Ð²Ñ–Ð´ ÐºÐ¾Ñ€ÐµÐ½Ñ \"Ñ‡ÑƒÑ‚-\" Ñƒ Ð¿ÑÐ¸Ñ…Ð¾Ð»Ð¾Ð³Ñ–Ñ—?\n   - [x] Ð¡Ð»Ð¾Ð²Ð¾ \"Ð¿Ð¾Ñ‡ÑƒÑ‚Ñ‚Ñ\" Ð¾Ð·Ð½Ð°Ñ‡Ð°Ñ” ÐµÐ¼Ð¾Ñ†Ñ–Ð¹Ð½Ñ– Ð¿ÐµÑ€ÐµÐ¶Ð¸Ð²Ð°Ð½Ð½Ñ Ð° \"Ð²Ñ–Ð´Ñ‡ÑƒÑ‚Ñ‚Ñ\" Ð¾Ð·Ð½Ð°Ñ‡Ð°Ñ” Ñ„Ñ–Ð·Ð¸Ñ‡Ð½Ñ– Ð²Ñ–Ð´Ñ‡ÑƒÑ‚Ñ‚Ñ\n   - [ ] Ð¡Ð»Ð¾Ð²Ð¾ \"Ð¿Ð¾Ñ‡ÑƒÑ‚Ñ‚Ñ\" Ð¾Ð·Ð½Ð°Ñ‡Ð°Ñ” Ñ„Ñ–Ð·Ð¸Ñ‡Ð½Ñ– Ð²Ñ–Ð´Ñ‡ÑƒÑ‚Ñ‚Ñ Ð° \"Ð²Ñ–Ð´Ñ‡ÑƒÑ‚Ñ‚Ñ\" Ð¾Ð·Ð½Ð°Ñ‡Ð°Ñ” ÐµÐ¼Ð¾Ñ†Ñ–Ð¹Ð½Ñ– Ð¿ÐµÑ€ÐµÐ¶Ð¸Ð²Ð°Ð½Ð½Ñ\n   - [ ] Ð¦Ñ– Ð´Ð²Ð° ÑÐ»Ð¾Ð²Ð° Ñ” Ð¿Ð¾Ð²Ð½Ð¸Ð¼Ð¸ ÑÐ¸Ð½Ð¾Ð½Ñ–Ð¼Ð°Ð¼Ð¸ Ñ– Ð¾Ð·Ð½Ð°Ñ‡Ð°ÑŽÑ‚ÑŒ Ð°Ð±ÑÐ¾Ð»ÑŽÑ‚Ð½Ð¾ Ð¾Ð´Ð½Ðµ Ð¹ Ñ‚Ðµ ÑÐ°Ð¼Ðµ\n   - [ ] Ð¡Ð»Ð¾Ð²Ð¾ \"Ð¿Ð¾Ñ‡ÑƒÑ‚Ñ‚Ñ\" Ð¾Ð·Ð½Ð°Ñ‡Ð°Ñ” ÑÐ»ÑƒÑ…Ð°Ð½Ð½Ñ Ð° \"Ð²Ñ–Ð´Ñ‡ÑƒÑ‚Ñ‚Ñ\" Ð¾Ð·Ð½Ð°Ñ‡Ð°Ñ” Ð±Ð°Ñ‡ÐµÐ½Ð½Ñ\n\n## cloze: Story Comprehension\n\n> Complete based on the stories.\n\nÐ¢Ð°Ñ€Ð°Ñ [___:1] Ð´Ð¸Ð²Ð½Ñƒ Ñ€Ñ–Ñ‡. (saw)\nÐ’Ñ–Ð½ [___:2] Ð´Ð¸Ð²Ð½Ð¸Ð¹ Ð·Ð²ÑƒÐº. (heard)\nÐŸÑ‚Ð°ÑˆÐºÐ° [___:3] ÐºÐ¾Ð»Ð¸ Ð²Ñ–Ð½ Ð´Ð¸Ð²Ð¸Ð²ÑÑ. (was silent)\nÐŸÑ€Ð¾Ñ„ÐµÑÐ¾Ñ€ [___:4] Ð¿Ñ€Ð¾ Ð¼Ð¾Ð²Ñƒ. (speaks)\nÐ¡Ñ‚ÑƒÐ´ÐµÐ½Ñ‚Ð¸ ÑƒÐ²Ð°Ð¶Ð½Ð¾ [___:5]. (listen)\nÐœÐ°Ñ€Ñ–Ñ Ñ– ÑÑ‚ÑƒÐ´ÐµÐ½Ñ‚ Ð´Ð¾Ð¼Ð¾Ð²Ð¸Ð»Ð¸ÑÑŒ Ð¿Ñ€Ð¾ [___:6]. (meeting)\nÐ£ Ð¢Ð°Ñ€Ð°ÑÐ° Ð±ÑƒÐ»Ð¾ [___:7] ÑÐ¿Ð¾ÐºÐ¾ÑŽ. (feeling)\nÐžÐºÑÐ°Ð½Ð° Ð·Ñ€Ð¾Ð·ÑƒÐ¼Ñ–Ð»Ð° [___:8] ÑÐ²Ð¾Ð³Ð¾ Ð´Ñ€ÑƒÐ³Ð°. (vision)\nÐ’Ð¾Ð½Ð¸ Ð¿Ñ€Ð¾Ð´Ð¾Ð²Ð¶Ð¸Ð»Ð¸ [___:9] Ð¿Ñ€Ð¾ Ð¿Ñ€Ð¸Ñ€Ð¾Ð´Ñƒ. (conversation)\nÐ¡Ñ‚ÑƒÐ´ÐµÐ½Ñ‚ Ð¼Ð°Ð² Ð³Ð»Ð¸Ð±Ð¾ÐºÑ– [___:10] Ð¿Ñ€Ð¾ Ñ‚ÐµÐ¼Ñƒ. (feelings)\nÐœÐ°Ñ€Ñ–Ñ Ð·Ð°Ð¿Ð¸ÑÑƒÑ” Ð²Ð°Ð¶Ð»Ð¸Ð²Ñƒ [___:11]. (information)\nÐ’Ð¾Ð½Ð¸ Ð»ÑŽÐ±Ð»ÑÑ‚ÑŒ [___:12] Ñ‚Ð¸ÑˆÑƒ Ð² Ð»Ñ–ÑÑ–. (to listen to)\n\n1. Ð±Ð°Ñ‡Ð¸Ð² | Ñ‡ÑƒÐ² | ÑÐ»ÑƒÑ…Ð°Ð²\n   > [!answer] Ð±Ð°Ñ‡Ð¸Ð²\n\n2. Ð¿Ð¾Ñ‡ÑƒÐ² | Ð±Ð°Ñ‡Ð¸Ð² | ÑÐ»ÑƒÑ…Ð°Ð²\n   > [!answer] Ð¿Ð¾Ñ‡ÑƒÐ²\n\n3. Ð¼Ð¾Ð²Ñ‡Ð°Ð»Ð° | Ð³Ð¾Ð²Ð¾Ñ€Ð¸Ð»Ð° | ÑÐ»ÑƒÑ…Ð°Ð»Ð°\n   > [!answer] Ð¼Ð¾Ð²Ñ‡Ð°Ð»Ð°\n\n4. Ð³Ð¾Ð²Ð¾Ñ€Ð¸Ñ‚ÑŒ | ÑÐ»ÑƒÑ…Ð°Ñ” | Ð¼Ð¾Ð²Ñ‡Ð¸Ñ‚ÑŒ\n   > [!answer] Ð³Ð¾Ð²Ð¾Ñ€Ð¸Ñ‚ÑŒ\n\n5. ÑÐ»ÑƒÑ…Ð°ÑŽÑ‚ÑŒ | Ð³Ð¾Ð²Ð¾Ñ€ÑÑ‚ÑŒ | Ð¼Ð¾Ð²Ñ‡Ð°Ñ‚ÑŒ\n   > [!answer] ÑÐ»ÑƒÑ…Ð°ÑŽÑ‚ÑŒ\n\n6. Ð¿Ð¾Ð±Ð°Ñ‡ÐµÐ½Ð½Ñ | Ñ€Ð¾Ð·Ð¼Ð¾Ð²Ñƒ | Ð¼Ð¾Ð²Ñ‡Ð°Ð½Ð½Ñ\n   > [!answer] Ð¿Ð¾Ð±Ð°Ñ‡ÐµÐ½Ð½Ñ\n\n7. Ð¿Ð¾Ñ‡ÑƒÑ‚Ñ‚Ñ | Ð²Ñ–Ð´Ñ‡ÑƒÑ‚Ñ‚Ñ | Ð±Ð°Ñ‡ÐµÐ½Ð½Ñ\n   > [!answer] Ð¿Ð¾Ñ‡ÑƒÑ‚Ñ‚Ñ\n\n8. Ð±Ð°Ñ‡ÐµÐ½Ð½Ñ | Ð¿Ð¾Ð±Ð°Ñ‡ÐµÐ½Ð½Ñ | Ð´ÑƒÐ¼ÐºÑƒ\n   > [!answer] Ð±Ð°Ñ‡ÐµÐ½Ð½Ñ\n\n9. Ñ€Ð¾Ð·Ð¼Ð¾Ð²Ñƒ | Ð¼Ð¾Ð²Ñƒ | Ð¼Ð¾Ð²Ñ‡Ð°Ð½Ð½Ñ\n   > [!answer] Ñ€Ð¾Ð·Ð¼Ð¾Ð²Ñƒ\n\n10. Ð¿Ð¾Ñ‡ÑƒÑ‚Ñ‚Ñ | Ð²Ñ–Ð´Ñ‡ÑƒÑ‚Ñ‚Ñ | Ð´ÑƒÐ¼ÐºÐ¸\n   > [!answer] Ð¿Ð¾Ñ‡ÑƒÑ‚Ñ‚Ñ\n\n11. Ñ–Ð½Ñ„Ð¾Ñ€Ð¼Ð°Ñ†Ñ–ÑŽ | Ñ€Ð¾Ð·Ð¼Ð¾Ð²Ñƒ | Ð¼Ð¾Ð²Ñƒ\n   > [!answer] Ñ–Ð½Ñ„Ð¾Ñ€Ð¼Ð°Ñ†Ñ–ÑŽ\n\n12. ÑÐ»ÑƒÑ…Ð°Ñ‚Ð¸ | Ñ‡ÑƒÑ‚Ð¸ | Ð±Ð°Ñ‡Ð¸Ñ‚Ð¸\n   > [!answer] ÑÐ»ÑƒÑ…Ð°Ñ‚Ð¸\n\n## unjumble: Perception Sentences\n\n1. Ñ / Ð·Ð°Ñ€Ð°Ð· / Ð±Ð°Ñ‡Ñƒ / Ñ‚ÐµÐ±Ðµ / Ð´ÑƒÐ¶Ðµ / Ñ‡Ñ–Ñ‚ÐºÐ¾ / Ð¿ÐµÑ€ÐµÐ´ / ÑÐ¾Ð±Ð¾ÑŽ\n   > [!answer] Ð¯ Ð·Ð°Ñ€Ð°Ð· Ð±Ð°Ñ‡Ñƒ Ñ‚ÐµÐ±Ðµ Ð´ÑƒÐ¶Ðµ Ñ‡Ñ–Ñ‚ÐºÐ¾ Ð¿ÐµÑ€ÐµÐ´ ÑÐ¾Ð±Ð¾ÑŽ\n2. Ñ / Ñ‡ÑƒÑŽ / ÐºÑ€Ð°ÑÐ¸Ð²Ñƒ / Ð¼ÑƒÐ·Ð¸ÐºÑƒ / Ð·Ð´Ð°Ð»ÐµÐºÑƒ / Ð½Ð° / Ð²ÑƒÐ»Ð¸Ñ†Ñ– / Ð·Ð°Ñ€Ð°Ð·\n   > [!answer] Ð¯ Ñ‡ÑƒÑŽ ÐºÑ€Ð°ÑÐ¸Ð²Ñƒ Ð¼ÑƒÐ·Ð¸ÐºÑƒ Ð·Ð´Ð°Ð»ÐµÐºÑƒ Ð½Ð° Ð²ÑƒÐ»Ð¸Ñ†Ñ– Ð·Ð°Ñ€Ð°Ð·\n3. Ð±ÑƒÐ´ÑŒ / Ð»Ð°ÑÐºÐ° / ÑÐ»ÑƒÑ…Ð°Ð¹ / Ð¼ÐµÐ½Ðµ / Ð´ÑƒÐ¶Ðµ / ÑƒÐ²Ð°Ð¶Ð½Ð¾ / Ð·Ð°Ñ€Ð°Ð· / Ñ‚ÑƒÑ‚\n   > [!answer] Ð‘ÑƒÐ´ÑŒ Ð»Ð°ÑÐºÐ° ÑÐ»ÑƒÑ…Ð°Ð¹ Ð¼ÐµÐ½Ðµ Ð´ÑƒÐ¶Ðµ ÑƒÐ²Ð°Ð¶Ð½Ð¾ Ð·Ð°Ñ€Ð°Ð· Ñ‚ÑƒÑ‚\n4. Ñ†Ðµ / ÑÐ¿Ñ€Ð°Ð²Ð´Ñ– / Ð´ÑƒÐ¶Ðµ / Ð³Ð°Ñ€Ð½Ðµ / Ñ‡Ñ–Ñ‚ÐºÐµ / Ð¼Ð¾Ð²Ð»ÐµÐ½Ð½Ñ / Ð²Ñ–Ð´ / Ð¿Ñ€Ð¾Ñ„ÐµÑÐ¾Ñ€Ð°\n   > [!answer] Ð¦Ðµ ÑÐ¿Ñ€Ð°Ð²Ð´Ñ– Ð´ÑƒÐ¶Ðµ Ð³Ð°Ñ€Ð½Ðµ Ñ‡Ñ–Ñ‚ÐºÐµ Ð¼Ð¾Ð²Ð»ÐµÐ½Ð½Ñ Ð²Ñ–Ð´ Ð¿Ñ€Ð¾Ñ„ÐµÑÐ¾Ñ€Ð°\n5. Ñ†Ðµ / Ð±ÑƒÐ»Ð° / Ð´ÑƒÐ¶Ðµ / Ñ†Ñ–ÐºÐ°Ð²Ð° / Ð´Ð¾Ð²Ð³Ð° / Ñ€Ð¾Ð·Ð¼Ð¾Ð²Ð° / Ð¼Ñ–Ð¶ / Ð´Ñ€ÑƒÐ·ÑÐ¼Ð¸ / Ð²Ñ‡Ð¾Ñ€Ð°\n   > [!answer] Ð¦Ðµ Ð±ÑƒÐ»Ð° Ð´ÑƒÐ¶Ðµ Ñ†Ñ–ÐºÐ°Ð²Ð° Ð´Ð¾Ð²Ð³Ð° Ñ€Ð¾Ð·Ð¼Ð¾Ð²Ð° Ð¼Ñ–Ð¶ Ð´Ñ€ÑƒÐ·ÑÐ¼Ð¸ Ð²Ñ‡Ð¾Ñ€Ð°\n6. Ð²Ñ–Ð½ / Ð¼Ð¾Ð²Ñ‡Ð¸Ñ‚ÑŒ / ÑƒÐ²ÐµÑÑŒ / Ñ‡Ð°Ñ / Ð¿Ñ–Ð´ / Ñ‡Ð°Ñ / Ð»ÐµÐºÑ†Ñ–Ñ— / ÑÑŒÐ¾Ð³Ð¾Ð´Ð½Ñ–\n   > [!answer] Ð’Ñ–Ð½ Ð¼Ð¾Ð²Ñ‡Ð¸Ñ‚ÑŒ ÑƒÐ²ÐµÑÑŒ Ñ‡Ð°Ñ Ð¿Ñ–Ð´ Ñ‡Ð°Ñ Ð»ÐµÐºÑ†Ñ–Ñ— ÑÑŒÐ¾Ð³Ð¾Ð´Ð½Ñ–\n7. Ñ†Ðµ / ÑÐ¿Ñ€Ð°Ð²Ð´Ñ– / Ð´ÑƒÐ¶Ðµ / Ð³Ð»Ð¸Ð±Ð¾ÐºÑ– / ÑÐ¸Ð»ÑŒÐ½Ñ– / Ð¿Ð¾Ñ‡ÑƒÑ‚Ñ‚Ñ / Ð´Ð¾ / Ð½ÐµÑ—\n   > [!answer] Ð¦Ðµ ÑÐ¿Ñ€Ð°Ð²Ð´Ñ– Ð´ÑƒÐ¶Ðµ Ð³Ð»Ð¸Ð±Ð¾ÐºÑ– ÑÐ¸Ð»ÑŒÐ½Ñ– Ð¿Ð¾Ñ‡ÑƒÑ‚Ñ‚Ñ Ð´Ð¾ Ð½ÐµÑ—\n8. Ð²Ð¾Ð½Ð¸ / Ð·Ð°Ð²Ð¶Ð´Ð¸ / Ð´ÑƒÐ¶Ðµ / ÑƒÐ²Ð°Ð¶Ð½Ñ– / Ð´Ð¾Ð±Ñ€Ñ– / ÑÐ»ÑƒÑ…Ð°Ñ‡Ñ– / Ð½Ð° / Ð»ÐµÐºÑ†Ñ–ÑÑ…\n   > [!answer] Ð’Ð¾Ð½Ð¸ Ð·Ð°Ð²Ð¶Ð´Ð¸ Ð´ÑƒÐ¶Ðµ ÑƒÐ²Ð°Ð¶Ð½Ñ– Ð´Ð¾Ð±Ñ€Ñ– ÑÐ»ÑƒÑ…Ð°Ñ‡Ñ– Ð½Ð° Ð»ÐµÐºÑ†Ñ–ÑÑ…\n\n\n## error-correction: Root Usage\n\n1. Ð¯ **ÑÐ»ÑƒÑ…Ð°ÑŽ** ÑˆÑƒÐ¼ Ð¼Ð°ÑˆÐ¸Ð½ Ð½Ð° Ð²ÑƒÐ»Ð¸Ñ†Ñ–. (passive hearing)\n   > [!error] ÑÐ»ÑƒÑ…Ð°ÑŽ\n   > [!answer] Ñ‡ÑƒÑŽ\n   > [!explanation] Passive hearing = Ñ‡ÑƒÑ‚Ð¸, active listening = ÑÐ»ÑƒÑ…Ð°Ñ‚Ð¸.\n   > [!options] Ñ‡ÑƒÑŽ | ÑÐ»ÑƒÑ…Ð°ÑŽ\n\n2. Ð’Ñ–Ð½ Ð²Ñ‡Ð¸Ñ‚ÑŒ ÑƒÐºÑ€Ð°Ñ—Ð½ÑÑŒÐºÐµ **Ð¼Ð¾Ð²Ð»ÐµÐ½Ð½Ñ**. (the language system)\n   > [!error] Ð¼Ð¾Ð²Ð»ÐµÐ½Ð½Ñ\n   > [!answer] Ð¼Ð¾Ð²Ñƒ\n   > [!explanation] Language system = Ð¼Ð¾Ð²Ð°, speech act = Ð¼Ð¾Ð²Ð»ÐµÐ½Ð½Ñ.\n   > [!options] Ð¼Ð¾Ð²Ñƒ | Ð¼Ð¾Ð²Ð»ÐµÐ½Ð½Ñ\n\n3. Ð’Ð¾Ð½Ð° Ð¼Ð°Ñ” Ð´Ð¸Ð²Ð½Ðµ **Ð¿Ð¾Ñ‡ÑƒÑ‚Ñ‚Ñ** Ñƒ Ð¿Ð°Ð»ÑŒÑ†ÑÑ…. (physical)\n   > [!error] Ð¿Ð¾Ñ‡ÑƒÑ‚Ñ‚Ñ\n   > [!answer] Ð²Ñ–Ð´Ñ‡ÑƒÑ‚Ñ‚Ñ\n   > [!explanation] Physical sensation = Ð²Ñ–Ð´Ñ‡ÑƒÑ‚Ñ‚Ñ, emotion = Ð¿Ð¾Ñ‡ÑƒÑ‚Ñ‚Ñ.\n   > [!options] Ð²Ñ–Ð´Ñ‡ÑƒÑ‚Ñ‚Ñ | Ð¿Ð¾Ñ‡ÑƒÑ‚Ñ‚Ñ\n\n4. **Ð§ÑƒÐ¹** ÑƒÐ²Ð°Ð¶Ð½Ð¾, Ñ‰Ð¾ Ñ ÐºÐ°Ð¶Ñƒ! (active listening)\n   > [!error] Ð§ÑƒÐ¹\n   > [!answer] Ð¡Ð»ÑƒÑ…Ð°Ð¹\n   > [!explanation] Command to listen actively = ÑÐ»ÑƒÑ…Ð°Ð¹.\n   > [!options] Ð¡Ð»ÑƒÑ…Ð°Ð¹ | Ð§ÑƒÐ¹\n\n5. Ð¦Ðµ Ð¼Ð¾Ñ” Ñ…ÑƒÐ´Ð¾Ð¶Ð½Ñ” **Ð¿Ð¾Ð±Ð°Ñ‡ÐµÐ½Ð½Ñ** ÑÐ²Ñ–Ñ‚Ñƒ. (vision/perspective)\n   > [!error] Ð¿Ð¾Ð±Ð°Ñ‡ÐµÐ½Ð½Ñ\n   > [!answer] Ð±Ð°Ñ‡ÐµÐ½Ð½Ñ\n   > [!explanation] Vision/perspective = Ð±Ð°Ñ‡ÐµÐ½Ð½Ñ, meeting = Ð¿Ð¾Ð±Ð°Ñ‡ÐµÐ½Ð½Ñ.\n   > [!options] Ð±Ð°Ñ‡ÐµÐ½Ð½Ñ | Ð¿Ð¾Ð±Ð°Ñ‡ÐµÐ½Ð½Ñ\n\n6. Ð’Ð¾Ð½Ð¸ Ð¼Ð°ÑŽÑ‚ÑŒ **Ð±Ð°Ñ‡ÐµÐ½Ð½Ñ** Ð¾ Ñ‚Ñ€ÐµÑ‚Ñ–Ð¹ Ð³Ð¾Ð´Ð¸Ð½Ñ–. (meeting)\n   > [!error] Ð±Ð°Ñ‡ÐµÐ½Ð½Ñ\n   > [!answer] Ð¿Ð¾Ð±Ð°Ñ‡ÐµÐ½Ð½Ñ\n   > [!explanation] Meeting/date = Ð¿Ð¾Ð±Ð°Ñ‡ÐµÐ½Ð½Ñ, vision = Ð±Ð°Ñ‡ÐµÐ½Ð½Ñ.\n   > [!options] Ð¿Ð¾Ð±Ð°Ñ‡ÐµÐ½Ð½Ñ | Ð±Ð°Ñ‡ÐµÐ½Ð½Ñ\n\n## group-sort: Root Families\n\n> Sort words by root family.\n\n### Ð±Ð°Ñ‡- (see)\n- Ð±Ð°Ñ‡Ð¸Ñ‚Ð¸\n- Ð±Ð°Ñ‡ÐµÐ½Ð½Ñ\n- Ð¿Ð¾Ð±Ð°Ñ‡ÐµÐ½Ð½Ñ\n- Ð¿ÐµÑ€ÐµÐ´Ð±Ð°Ñ‡ÐµÐ½Ð½Ñ\n\n### ÑÐ»ÑƒÑ…-/Ñ‡ÑƒÑ‚- (hear/feel)\n- ÑÐ»ÑƒÑ…Ð°Ñ‚Ð¸\n- ÑÐ»ÑƒÑ…\n- ÑÐ»ÑƒÑ…Ð°Ñ‡\n- Ñ‡ÑƒÑ‚Ð¸\n- Ð¿Ð¾Ñ‡ÑƒÑ‚Ñ‚Ñ\n- Ð²Ñ–Ð´Ñ‡ÑƒÑ‚Ñ‚Ñ\n\n### Ð³Ð¾Ð²Ð¾Ñ€-/Ð¼Ð¾Ð²- (speak)\n- Ð³Ð¾Ð²Ð¾Ñ€Ð¸Ñ‚Ð¸\n- Ñ€Ð¾Ð·Ð¼Ð¾Ð²Ð°\n- Ð¼Ð¾Ð²Ð°\n- Ð¼Ð¾Ð²Ð»ÐµÐ½Ð½Ñ\n- Ð¼Ð¾Ð²Ñ‡Ð°Ñ‚Ð¸\n- Ð¼Ð¾Ð²Ñ‡Ð°Ð½Ð½Ñ\n\n## true-false: Root Rules\n\n> Mark true or false.\n\n- [x] \"Ð‘Ð°Ñ‡-\" = seeing/vision.\n- [x] \"Ð¡Ð»ÑƒÑ…-\" = active listening.\n- [ ] \"Ð§ÑƒÑ‚-\" = active listening.\n- [x] \"Ð§ÑƒÑ‚-\" = passive hearing.\n- [x] \"ÐœÐ¾Ð²-\" = speaking/language.\n- [ ] \"ÐœÐ¾Ð²-\" = seeing.\n- [x] \"ÐŸÐ¾Ð±Ð°Ñ‡ÐµÐ½Ð½Ñ\" = meeting/date.\n- [ ] \"ÐŸÐ¾Ð±Ð°Ñ‡ÐµÐ½Ð½Ñ\" = vision.\n- [x] \"ÐœÐ¾Ð²Ñ‡Ð°Ñ‚Ð¸\" = to be silent.\n- [ ] \"ÐœÐ¾Ð²Ñ‡Ð°Ñ‚Ð¸\" = to speak.\n- [x] \"Ð¡Ð»ÑƒÑ…Ð°Ñ‡\" = listener.\n- [ ] \"Ð¡Ð»ÑƒÑ…Ð°Ñ‡\" = speaker.\n\n## translate: English to Ukrainian\n\n1. To see\n   - [x] Ð±Ð°Ñ‡Ð¸Ñ‚Ð¸\n   - [ ] ÑÐ»ÑƒÑ…Ð°Ñ‚Ð¸\n   - [ ] Ñ‡ÑƒÑ‚Ð¸\n\n2. Vision (artistic)\n   - [x] Ð±Ð°Ñ‡ÐµÐ½Ð½Ñ\n   - [ ] Ð¿Ð¾Ð±Ð°Ñ‡ÐµÐ½Ð½Ñ\n   - [ ] ÑÐ»ÑƒÑ…\n\n3. Meeting/date\n   - [x] Ð¿Ð¾Ð±Ð°Ñ‡ÐµÐ½Ð½Ñ\n   - [ ] Ð±Ð°Ñ‡ÐµÐ½Ð½Ñ\n   - [ ] Ñ€Ð¾Ð·Ð¼Ð¾Ð²Ð°\n\n4. To listen\n   - [x] ÑÐ»ÑƒÑ…Ð°Ñ‚Ð¸\n   - [ ] Ñ‡ÑƒÑ‚Ð¸\n   - [ ] Ð±Ð°Ñ‡Ð¸Ñ‚Ð¸\n\n5. Listener\n   - [x] ÑÐ»ÑƒÑ…Ð°Ñ‡\n   - [ ] Ð¼Ð¾Ð²ÐµÑ†ÑŒ\n   - [ ] Ñ‡Ð¸Ñ‚Ð°Ñ‡\n\n6. To hear\n   - [x] Ñ‡ÑƒÑ‚Ð¸\n   - [ ] ÑÐ»ÑƒÑ…Ð°Ñ‚Ð¸\n   - [ ] Ð±Ð°Ñ‡Ð¸Ñ‚Ð¸\n\n7. Feeling (emotional)\n   - [x] Ð¿Ð¾Ñ‡ÑƒÑ‚Ñ‚Ñ\n   - [ ] Ð²Ñ–Ð´Ñ‡ÑƒÑ‚Ñ‚Ñ\n   - [ ] ÑÐ»ÑƒÑ…\n\n8. Language\n   - [x] Ð¼Ð¾Ð²Ð°\n   - [ ] Ð¼Ð¾Ð²Ð»ÐµÐ½Ð½Ñ\n   - [ ] Ñ€Ð¾Ð·Ð¼Ð¾Ð²Ð°\n\n---"
      },
      {
        "id": "section-3",
        "name": "Vocabulary",
        "nameEn": null,
        "type": "vocabulary",
        "content": "| Word | IPA | English | POS | Gender | Note |\n|------|-----|---------|-----|--------|------|\n| ÑÐ»ÑƒÑ… | /slux/ | hearing | noun | m | sense |\n| Ð¿Ð¾ÑÐ»ÑƒÑ… | /ËˆpÉ”slux/ | obedience | noun | m | abstract |\n| Ð¿Ð¾Ñ‡ÑƒÑ‚Ñ‚Ñ | /pÉ”ËˆtÍ¡ÊƒutÊ²É‘/ | feeling | noun | n | emotion |\n| Ð²Ñ–Ð´Ñ‡ÑƒÑ‚Ñ‚Ñ | /Ê‹idËˆtÍ¡ÊƒutÊ²É‘/ | sensation | noun | n | perception |\n| Ñ€Ð¾Ð·Ð¼Ð¾Ð²Ð° | /rÉ”zËˆmÉ”Ê‹É‘/ | conversation | noun | f | event |\n| Ð¼Ð¾Ð²Ð»ÐµÐ½Ð½Ñ | /ËˆmÉ”Ê‹lÉ›nÊ²É‘/ | speech | noun | n | activity |\n| Ð¼Ð¾Ð²ÐµÑ†ÑŒ | /mÉ”ËˆÊ‹É›tÍ¡sÊ²/ | speaker | noun | m | person |\n| Ð¼Ð¾Ð²Ñ‡Ð°Ñ‚Ð¸ | /mÉ”Ê‹ËˆtÍ¡ÊƒÉ‘tÉª/ | to be silent | verb | â€” | speech |\n| Ð¼Ð¾Ð²Ñ‡Ð°Ð½Ð½Ñ | /mÉ”Ê‹ËˆtÍ¡ÊƒÉ‘nÊ²É‘/ | silence | noun | n | state |\n| Ð¼Ð¾Ð²Ñ‡Ð°Ð·Ð½Ð¸Ð¹ | /mÉ”Ê‹ËˆtÍ¡ÊƒÉ‘znÉªj/ | silent (person) | adj | m | quality |\n| Ñ€Ð¾Ð·Ð´ÑƒÐ¼Ð¸ | /rÉ”zËˆdumÉª/ | reflections | noun | pl | abstract |"
      }
    ],
    "rawMarkdown": "---\nmodule: a2-41\ntitle: \"Root Families II\"\nsubtitle: \"Motion and Perception Roots\"\nversion: \"2.0\"\nphase: \"A2.4\"\npedagogy: \"PPP\"\nduration: \"60 min\"\ntransliteration: none\ntags:\n  - grammar\n  - word-formation\n  - roots\ngrammar:\n  - perception roots\n  - speaking roots\nobjectives:\n  - \"Learner knows perception root families\"\n  - \"Learner knows speaking root families\"\n  - \"Learner can recognize word connections\"\nvocabulary_count: 25\n---\n\n## Warm-up\n\nWelcome to more root families! This module covers **seeing** (Ð±Ð°Ñ‡-), **hearing** (ÑÐ»ÑƒÑ…-/Ñ‡ÑƒÑ‚-), and **speaking** (Ð³Ð¾Ð²Ð¾Ñ€-/Ð¼Ð¾Ð²-) roots.\n\nUnderstanding these roots unlocks dozens of related words. When you see the root, you instantly know the word's meaning. This is the power of morphological awareness in Ukrainian!\n\nRoot families are the building blocks of Ukrainian vocabulary. A single root generates many words through prefixes and suffixes. For example, from the root \"Ð±Ð°Ñ‡-\" we get \"Ð±Ð°Ñ‡Ð¸Ñ‚Ð¸\", \"Ð±Ð°Ñ‡ÐµÐ½Ð½Ñ\", \"Ð¿Ð¾Ð±Ð°Ñ‡ÐµÐ½Ð½Ñ\", and \"Ð¿ÐµÑ€ÐµÐ´Ð±Ð°Ñ‡ÐµÐ½Ð½Ñ\". Learning one root means learning four or more words automatically!\n\nThis approach to vocabulary learning is called morphological analysis. Instead of memorizing individual words in isolation, you learn the patterns that connect them. A root like \"Ð±Ð°Ñ‡-\" becomes a key that unlocks an entire family of related words.\n\nIn this module, we focus on three important root families: perception roots for seeing, roots for hearing and feeling, and roots for speaking and language. These are fundamental concepts that appear in everyday conversation.\n\nEnglish has similar patterns: \"see\" gives us \"sight\", \"seer\", \"foresee\", \"oversee\". Ukrainian's system is even more productive because of its rich prefixation and suffixation system.\n\n\n\n\n## Presentation\n\n## Ð±Ð°Ñ‡- Family (see)\n\nThe root **Ð±Ð°Ñ‡-** relates to seeing and visual perception.\n\n| Word | Meaning | Usage |\n|------|---------|-------|\n| Ð±Ð°Ñ‡Ð¸Ñ‚Ð¸ | to see | Ð¯ Ð±Ð°Ñ‡Ñƒ Ñ‚ÐµÐ±Ðµ! (I see you!) |\n| Ð±Ð°Ñ‡ÐµÐ½Ð½Ñ | vision | Ñ…ÑƒÐ´Ð¾Ð¶Ð½Ñ” Ð±Ð°Ñ‡ÐµÐ½Ð½Ñ (artistic vision) |\n| Ð¿Ð¾Ð±Ð°Ñ‡ÐµÐ½Ð½Ñ | meeting/date | Ñ€Ð¾Ð¼Ð°Ð½Ñ‚Ð¸Ñ‡Ð½Ðµ Ð¿Ð¾Ð±Ð°Ñ‡ÐµÐ½Ð½Ñ |\n| Ð¿ÐµÑ€ÐµÐ´Ð±Ð°Ñ‡ÐµÐ½Ð½Ñ | prediction | Ñ‚Ð¾Ñ‡Ð½Ðµ Ð¿ÐµÑ€ÐµÐ´Ð±Ð°Ñ‡ÐµÐ½Ð½Ñ |\n\n> [!tip] Ð¡Ð»Ð¾Ð²Ð¾Ñ‚Ð²Ñ–Ñ€: ÐŸÑ€Ð¸ÐºÐ»Ð°Ð´ ÐšÐ¾Ñ€ÐµÐ½Ñ Ð±Ð°Ñ‡-\n> ÐšÐ¾Ñ€Ñ–Ð½ÑŒ Ð±Ð°Ñ‡- Ð´Ð°Ñ” Ð´Ñ–Ñ”ÑÐ»Ð¾Ð²Ð¾ \"Ð±Ð°Ñ‡Ð¸Ñ‚Ð¸\".\n> Ð’Ñ–Ð´ Ð´Ñ–Ñ”ÑÐ»Ð¾Ð²Ð° ÑƒÑ‚Ð²Ð¾Ñ€ÑŽÑ”Ð¼Ð¾ \"Ð±Ð°Ñ‡ÐµÐ½Ð½Ñ\" (ÑÑƒÑ„Ñ–ÐºÑ -ÐµÐ½Ð½Ñ).\n> ÐŸÑ€ÐµÑ„Ñ–ÐºÑ \"Ð¿Ð¾-\" Ð´Ð¾Ð´Ð°Ñ” Ð·Ð½Ð°Ñ‡ÐµÐ½Ð½Ñ \"Ñ€Ð°Ð·\" â†’ Ð¿Ð¾Ð±Ð°Ñ‡ÐµÐ½Ð½Ñ.\n> ÐŸÑ€ÐµÑ„Ñ–ÐºÑ \"Ð¿ÐµÑ€ÐµÐ´-\" Ð´Ð¾Ð´Ð°Ñ” Ð·Ð½Ð°Ñ‡ÐµÐ½Ð½Ñ \"Ð·Ð°Ð·Ð´Ð°Ð»ÐµÐ³Ñ–Ð´ÑŒ\" â†’ Ð¿ÐµÑ€ÐµÐ´Ð±Ð°Ñ‡ÐµÐ½Ð½Ñ.\n\nThis pattern is highly productive. Once you know the root, you can predict word meanings even for words you have never seen before. This is why learning roots is more efficient than memorizing individual words. Each root family typically contains between four and ten related words, so mastering twenty roots gives you access to nearly one hundred words.\n\nThe perception roots in this module are particularly useful because they appear in many common expressions. For example, \"ÐŸÐ¾Ð±Ð°Ñ‡Ð¸Ð¼Ð¾!\" means \"We will see!\" and uses the Ð±Ð°Ñ‡- root. Similarly, \"Ð¯ Ñ‡ÑƒÑŽ\" means \"I hear\" and uses the Ñ‡ÑƒÑ‚- root.\n\n## ÑÐ»ÑƒÑ…-/Ñ‡ÑƒÑ‚- Family (hear)\n\nUkrainian has two related roots for hearing: **ÑÐ»ÑƒÑ…-** (active listening) and **Ñ‡ÑƒÑ‚-** (passive hearing/feeling).\n\n| Word | Meaning | Usage |\n|------|---------|-------|\n| ÑÐ»ÑƒÑ…Ð°Ñ‚Ð¸ | to listen | Ð¡Ð»ÑƒÑ…Ð°Ð¹ ÑƒÐ²Ð°Ð¶Ð½Ð¾! (Listen carefully!) |\n| ÑÐ»ÑƒÑ… | hearing | Ð’Ñ–Ð½ Ð¼Ð°Ñ” Ð³Ð°Ñ€Ð½Ð¸Ð¹ ÑÐ»ÑƒÑ…. (He has good hearing.) |\n| ÑÐ»ÑƒÑ…Ð°Ñ‡ | listener | Ñ€Ð°Ð´Ñ–Ð¾ÑÐ»ÑƒÑ…Ð°Ñ‡Ñ– (radio listeners) |\n| Ð¿Ð¾ÑÐ»ÑƒÑ… | obedience | Ð±ÐµÐ·Ð·Ð°Ð¿ÐµÑ€ÐµÑ‡Ð½Ð¸Ð¹ Ð¿Ð¾ÑÐ»ÑƒÑ… |\n\n| Word | Meaning | Usage |\n|------|---------|-------|\n| Ñ‡ÑƒÑ‚Ð¸ | to hear | Ð¯ Ñ‡ÑƒÑŽ Ð¼ÑƒÐ·Ð¸ÐºÑƒ. (I hear music.) |\n| Ð¿Ð¾Ñ‡ÑƒÑ‚Ñ‚Ñ | feeling | Ð³Ð»Ð¸Ð±Ð¾ÐºÑ– Ð¿Ð¾Ñ‡ÑƒÑ‚Ñ‚Ñ (deep feelings) |\n| Ð²Ñ–Ð´Ñ‡ÑƒÑ‚Ñ‚Ñ | sensation | Ð´Ð¸Ð²Ð½Ðµ Ð²Ñ–Ð´Ñ‡ÑƒÑ‚Ñ‚Ñ (strange sensation) |\n\n> [!cultural] Ð¡Ð»ÑƒÑ…Ð°Ñ‚Ð¸ vs Ð§ÑƒÑ‚Ð¸: Ð’Ð°Ð¶Ð»Ð¸Ð²Ð° Ð Ñ–Ð·Ð½Ð¸Ñ†Ñ\n> Ð£ÐºÑ€Ð°Ñ—Ð½ÑÑŒÐºÐ° Ð¼Ð¾Ð²Ð° Ñ€Ð¾Ð·Ñ€Ñ–Ð·Ð½ÑÑ” Ð°ÐºÑ‚Ð¸Ð²Ð½Ðµ ÑÐ»ÑƒÑ…Ð°Ð½Ð½Ñ Ñ– Ð¿Ð°ÑÐ¸Ð²Ð½Ðµ Ñ‡ÑƒÑ‚Ñ‚Ñ.\n> \"Ð¯ ÑÐ»ÑƒÑ…Ð°ÑŽ Ð¼ÑƒÐ·Ð¸ÐºÑƒ\" = active listening.\n> \"Ð¯ Ñ‡ÑƒÑŽ Ð¼ÑƒÐ·Ð¸ÐºÑƒ\" = passive hearing.\n> Ð¦Ðµ Ð²Ð°Ð¶Ð»Ð¸Ð²Ð¾ Ð´Ð»Ñ Ð¿Ñ€Ð°Ð²Ð¸Ð»ÑŒÐ½Ð¾Ð³Ð¾ Ð²Ð¸ÐºÐ¾Ñ€Ð¸ÑÑ‚Ð°Ð½Ð½Ñ!\n\n## Ð³Ð¾Ð²Ð¾Ñ€-/Ð¼Ð¾Ð²- Family (speak)\n\nThe **Ð³Ð¾Ð²Ð¾Ñ€-/Ð¼Ð¾Ð²-** roots relate to speech and language.\n\n| Word | Meaning | Usage |\n|------|---------|-------|\n| Ð³Ð¾Ð²Ð¾Ñ€Ð¸Ñ‚Ð¸ | to speak | Ð’Ð¾Ð½Ð° Ð³Ð°Ñ€Ð½Ð¾ Ð³Ð¾Ð²Ð¾Ñ€Ð¸Ñ‚ÑŒ. |\n| Ñ€Ð¾Ð·Ð¼Ð¾Ð²Ð° | conversation | Ñ†Ñ–ÐºÐ°Ð²Ð° Ñ€Ð¾Ð·Ð¼Ð¾Ð²Ð° |\n| Ð¼Ð¾Ð²Ð° | language | ÑƒÐºÑ€Ð°Ñ—Ð½ÑÑŒÐºÐ° Ð¼Ð¾Ð²Ð° |\n| Ð¼Ð¾Ð²Ð»ÐµÐ½Ð½Ñ | speech | Ñ‡Ñ–Ñ‚ÐºÐµ Ð¼Ð¾Ð²Ð»ÐµÐ½Ð½Ñ |\n| Ð¼Ð¾Ð²Ñ‡Ð°Ñ‚Ð¸ | to be silent | ÐœÐ¾Ð²Ñ‡Ð¸! Ð¡Ð»ÑƒÑ…Ð°Ð¹! |\n| Ð¼Ð¾Ð²Ñ‡Ð°Ð½Ð½Ñ | silence | Ð·Ð¾Ð»Ð¾Ñ‚Ðµ Ð¼Ð¾Ð²Ñ‡Ð°Ð½Ð½Ñ |\n\n> [!tip] Ð›Ð¾Ð³Ñ–ÐºÐ° ÐšÐ¾Ñ€ÐµÐ½Ñ Ð¼Ð¾Ð²-\n> - **Ð¼Ð¾Ð²-**: Ð¼Ð¾Ð²Ð°, Ð¼Ð¾Ð²Ð»ÐµÐ½Ð½Ñ (Ð³Ð¾Ð²Ð¾Ñ€Ñ–Ð½Ð½Ñ).\n> - **Ð¼Ð¾Ð²Ñ‡-**: Ð¼Ð¾Ð²Ñ‡Ð°Ñ‚Ð¸, Ð¼Ð¾Ð²Ñ‡Ð°Ð½Ð½Ñ (ÐÐ• Ð³Ð¾Ð²Ð¾Ñ€Ð¸Ñ‚Ð¸).\n> Ð¦Ñ–ÐºÐ°Ð²Ð¾: \"Ð¼Ð¾Ð²Ñ‡-\" = \"Ð¼Ð¾Ð²-\" + \"-Ñ‡-\" Ð¾Ð·Ð½Ð°Ñ‡Ð°Ñ” Ð²Ñ–Ð´ÑÑƒÑ‚Ð½Ñ–ÑÑ‚ÑŒ Ð¼Ð¾Ð²Ð¸!\n> \"ÐœÐ¾Ð²Ñ‡Ð°Ð·Ð½Ð¸Ð¹\" = Ñ‚Ð¾Ð¹, Ñ…Ñ‚Ð¾ Ð¼Ð°Ð»Ð¾ Ð³Ð¾Ð²Ð¾Ñ€Ð¸Ñ‚ÑŒ.\n\n---\n\n## Story Time: Ð Ð¾Ð·Ð¼Ð¾Ð²Ð° Ð¼Ñ–Ð¶ Ð´Ñ€ÑƒÐ·ÑÐ¼Ð¸\n\nÐžÐºÑÐ°Ð½Ð° Ñ– Ð¢Ð°Ñ€Ð°Ñ ÑÐ¸Ð´ÑÑ‚ÑŒ Ñƒ ÐºÐ°Ñ„Ðµ. Ð¢Ð°Ñ€Ð°Ñ Ñ€Ð¾Ð·Ð¿Ð¾Ð²Ñ–Ð´Ð°Ñ” Ð¿Ñ€Ð¾ ÑÐ²Ñ–Ð¹ Ð´ÐµÐ½ÑŒ.\n\nâ€” Ð¡ÑŒÐ¾Ð³Ð¾Ð´Ð½Ñ– Ñ **Ð±Ð°Ñ‡Ð¸Ð²** Ð´Ð¸Ð²Ð½Ñƒ Ñ€Ñ–Ñ‡, â€” ÐºÐ°Ð¶Ðµ Ð¢Ð°Ñ€Ð°Ñ.\nâ€” Ð©Ð¾ ÑÐ°Ð¼Ðµ? â€” Ð¿Ð¸Ñ‚Ð°Ñ” ÐžÐºÑÐ°Ð½Ð°. â€” **Ð Ð¾Ð·ÐºÐ°Ð¶Ð¸**!\nâ€” Ð¯ Ð¹ÑˆÐ¾Ð² Ð²ÑƒÐ»Ð¸Ñ†ÐµÑŽ Ñ– **Ð¿Ð¾Ñ‡ÑƒÐ²** Ð´Ð¸Ð²Ð½Ð¸Ð¹ Ð·Ð²ÑƒÐº. Ð¯ **ÑÐ»ÑƒÑ…Ð°Ð²** ÑƒÐ²Ð°Ð¶Ð½Ð¾. Ð¦Ðµ Ð±ÑƒÐ»Ð° Ð¿Ñ‚Ð°ÑˆÐºÐ°. ÐÐ»Ðµ Ð²Ð¾Ð½Ð° **Ð¼Ð¾Ð²Ñ‡Ð°Ð»Ð°** ÐºÐ¾Ð»Ð¸ Ñ **Ð´Ð¸Ð²Ð¸Ð²ÑÑ** Ð½Ð° Ð½ÐµÑ—.\nâ€” Ð¦Ñ–ÐºÐ°Ð²Ð¾! Ð ÑÐºÐµ Ñƒ Ñ‚ÐµÐ±Ðµ **Ð²Ñ–Ð´Ñ‡ÑƒÑ‚Ñ‚Ñ**?\nâ€” Ð¯ Ð¼Ð°Ð² **Ð¿Ð¾Ñ‡ÑƒÑ‚Ñ‚Ñ** ÑÐ¿Ð¾ÐºÐ¾ÑŽ. Ð¦Ðµ Ð±ÑƒÐ² Ñ‡ÑƒÐ´Ð¾Ð²Ð¸Ð¹ Ð¼Ð¾Ð¼ÐµÐ½Ñ‚.\nâ€” Ð¯ Ð»ÑŽÐ±Ð»ÑŽ Ñ‚Ð°ÐºÑ– Ñ–ÑÑ‚Ð¾Ñ€Ñ–Ñ—, â€” ÐºÐ°Ð¶Ðµ ÐžÐºÑÐ°Ð½Ð°. â€” Ð¢Ð¸ Ð¼Ð°Ñ”Ñˆ Ð³Ð°Ñ€Ð½Ðµ **Ð±Ð°Ñ‡ÐµÐ½Ð½Ñ** ÑÐ²Ñ–Ñ‚Ñƒ.\n\nÐ’Ð¾Ð½Ð¸ Ð¿Ñ€Ð¾Ð´Ð¾Ð²Ð¶Ð¸Ð»Ð¸ **Ñ€Ð¾Ð·Ð¼Ð¾Ð²Ñƒ** Ð¿Ñ€Ð¾ Ð¿Ñ€Ð¸Ñ€Ð¾Ð´Ñƒ Ñ‚Ð° **Ð¼Ð¾Ð²Ñ‡Ð°Ð½Ð½Ñ** Ð² Ð»Ñ–ÑÑ–.\n\nâ€” Ð¢Ð¸ Ñ‡Ð°ÑÑ‚Ð¾ Ñ…Ð¾Ð´Ð¸Ñˆ Ñƒ Ð»Ñ–Ñ? â€” Ð¿Ð¸Ñ‚Ð°Ñ” ÐžÐºÑÐ°Ð½Ð°.\nâ€” Ð¢Ð°Ðº, Ñ Ð»ÑŽÐ±Ð»ÑŽ **ÑÐ»ÑƒÑ…Ð°Ñ‚Ð¸** Ð·Ð²ÑƒÐºÐ¸ Ð¿Ñ€Ð¸Ñ€Ð¾Ð´Ð¸. Ð¢Ð°Ð¼ Ð¼Ð¾Ð¶Ð½Ð° **Ñ‡ÑƒÑ‚Ð¸** Ð¿Ñ‚Ð°ÑˆÐ¾Ðº, Ð²Ñ–Ñ‚ÐµÑ€, Ð²Ð¾Ð´Ñƒ. Ð¦Ðµ Ð´Ð¾Ð¿Ð¾Ð¼Ð°Ð³Ð°Ñ” Ð´ÑƒÐ¼Ð°Ñ‚Ð¸.\nâ€” Ð¯ Ñ€Ð¾Ð·ÑƒÐ¼Ñ–ÑŽ. ÐœÐ¸ Ð·Ð°Ð±ÑƒÐ²Ð°Ñ”Ð¼Ð¾ **ÑÐ»ÑƒÑ…Ð°Ñ‚Ð¸** Ñ‚Ð¸ÑˆÑƒ Ð² Ð¼Ñ–ÑÑ‚Ñ–.\nâ€” Ð¡Ð°Ð¼Ðµ Ñ‚Ð°Ðº! **ÐœÐ¾Ð²Ñ‡Ð°Ð½Ð½Ñ** â€” Ñ†Ðµ Ñ‚ÐµÐ¶ **Ð¼Ð¾Ð²Ð°**, Ñ‚Ñ–Ð»ÑŒÐºÐ¸ Ð±ÐµÐ· ÑÐ»Ñ–Ð².\n\nÐžÐºÑÐ°Ð½Ð° Ð¿Ð¾ÑÐ¼Ñ–Ñ…Ð½ÑƒÐ»Ð°ÑÑŒ. Ð’Ð¾Ð½Ð° Ð·Ñ€Ð¾Ð·ÑƒÐ¼Ñ–Ð»Ð° **Ð±Ð°Ñ‡ÐµÐ½Ð½Ñ** ÑÐ²Ð¾Ð³Ð¾ Ð´Ñ€ÑƒÐ³Ð°.\n\n> [!cultural] Ð£ÐºÑ€Ð°Ñ—Ð½ÑÑŒÐºÐµ Ð¡Ð»Ð¾Ð²Ð¾\n> Ð¡Ð»Ð¾Ð²Ð¾ \"Ð¼Ð¾Ð²Ð°\" Ñ” Ð´ÑƒÐ¶Ðµ Ð²Ð°Ð¶Ð»Ð¸Ð²Ð¸Ð¼ Ð´Ð»Ñ ÑƒÐºÑ€Ð°Ñ—Ð½Ñ†Ñ–Ð².\n> Ð£ÐºÑ€Ð°Ñ—Ð½ÑÑŒÐºÐ° Ð¼Ð¾Ð²Ð° â€” Ñ†Ðµ Ð½Ðµ Ð¿Ñ€Ð¾ÑÑ‚Ð¾ ÑÐ¿Ð¾ÑÑ–Ð± ÑÐ¿Ñ–Ð»ÐºÑƒÐ²Ð°Ð½Ð½Ñ.\n> Ð¦Ðµ ÑÐ¸Ð¼Ð²Ð¾Ð» Ð½Ð°Ñ†Ñ–Ð¾Ð½Ð°Ð»ÑŒÐ½Ð¾Ñ— Ñ–Ð´ÐµÐ½Ñ‚Ð¸Ñ‡Ð½Ð¾ÑÑ‚Ñ– Ñ‚Ð° ÐºÑƒÐ»ÑŒÑ‚ÑƒÑ€Ð¸.\n> Ð¢Ð¾Ð¼Ñƒ ÑÐ»Ð¾Ð²Ð¾Ñ‚Ð²Ñ–Ñ€ Ð²Ñ–Ð´ \"Ð¼Ð¾Ð²-\" Ñ‚Ð°ÐºÐ¸Ð¹ Ð±Ð°Ð³Ð°Ñ‚Ð¸Ð¹.\n\n---\n\n## Story Time Part 2: ÐÐ° Ð»ÐµÐºÑ†Ñ–Ñ—\n\nÐœÐ°Ñ€Ñ–Ñ â€” ÑÑ‚ÑƒÐ´ÐµÐ½Ñ‚ÐºÐ°. Ð¡ÑŒÐ¾Ð³Ð¾Ð´Ð½Ñ– Ð² Ð½ÐµÑ— Ð»ÐµÐºÑ†Ñ–Ñ Ð· Ð»Ñ–Ð½Ð³Ð²Ñ–ÑÑ‚Ð¸ÐºÐ¸.\n\nÐŸÑ€Ð¾Ñ„ÐµÑÐ¾Ñ€ **Ð³Ð¾Ð²Ð¾Ñ€Ð¸Ñ‚ÑŒ** Ð¿Ñ€Ð¾ Ñ–ÑÑ‚Ð¾Ñ€Ñ–ÑŽ ÑƒÐºÑ€Ð°Ñ—Ð½ÑÑŒÐºÐ¾Ñ— Ð¼Ð¾Ð²Ð¸. **Ð¡Ð»ÑƒÑ…Ð°Ñ‡Ñ–** ÑƒÐ²Ð°Ð¶Ð½Ð¾ **ÑÐ»ÑƒÑ…Ð°ÑŽÑ‚ÑŒ**. ÐœÐ°Ñ€Ñ–Ñ Ð·Ð°Ð¿Ð¸ÑÑƒÑ” Ð²Ð°Ð¶Ð»Ð¸Ð²Ñƒ Ñ–Ð½Ñ„Ð¾Ñ€Ð¼Ð°Ñ†Ñ–ÑŽ.\n\nâ€” Ð£ÐºÑ€Ð°Ñ—Ð½ÑÑŒÐºÐ° **Ð¼Ð¾Ð²Ð°** Ð¼Ð°Ñ” Ð´Ð°Ð²Ð½ÑŽ Ñ–ÑÑ‚Ð¾Ñ€Ñ–ÑŽ, â€” ÐºÐ°Ð¶Ðµ Ð¿Ñ€Ð¾Ñ„ÐµÑÐ¾Ñ€. â€” **ÐœÐ¾Ð²Ð»ÐµÐ½Ð½Ñ** Ð½Ð°ÑˆÐ¸Ñ… Ð¿Ñ€ÐµÐ´ÐºÑ–Ð² Ð²Ñ–Ð´Ñ€Ñ–Ð·Ð½ÑÐ»Ð¾ÑÑ Ð²Ñ–Ð´ ÑÑƒÑ‡Ð°ÑÐ½Ð¾Ñ— Ð¼Ð¾Ð²Ð¸.\n\nÐžÐ´Ð¸Ð½ ÑÑ‚ÑƒÐ´ÐµÐ½Ñ‚ **Ð¼Ð¾Ð²Ñ‡Ð¸Ñ‚ÑŒ** ÑƒÐ²ÐµÑÑŒ Ñ‡Ð°Ñ. Ð’Ñ–Ð½ Ñ‚Ñ–Ð»ÑŒÐºÐ¸ **ÑÐ»ÑƒÑ…Ð°Ñ”** Ñ– **Ð´Ð¸Ð²Ð¸Ñ‚ÑŒÑÑ** Ð½Ð° Ð¿Ñ€Ð¾Ñ„ÐµÑÐ¾Ñ€Ð°. ÐŸÑ–ÑÐ»Ñ Ð»ÐµÐºÑ†Ñ–Ñ— ÐœÐ°Ñ€Ñ–Ñ Ð¿Ð¸Ñ‚Ð°Ñ” Ð¹Ð¾Ð³Ð¾:\n\nâ€” Ð§Ð¾Ð¼Ñƒ Ñ‚Ð¸ **Ð¼Ð¾Ð²Ñ‡Ð°Ð²** Ð²ÐµÑÑŒ Ñ‡Ð°Ñ?\nâ€” Ð¯ Ð¼Ð°Ð² Ð³Ð»Ð¸Ð±Ð¾ÐºÑ– **Ð¿Ð¾Ñ‡ÑƒÑ‚Ñ‚Ñ** Ð¿Ñ€Ð¾ Ñ†ÑŽ Ñ‚ÐµÐ¼Ñƒ. ÐœÐµÐ½Ñ– Ð¿Ð¾Ñ‚Ñ€Ñ–Ð±ÐµÐ½ Ñ‡Ð°Ñ Ð´Ð»Ñ **Ñ€Ð¾Ð·Ð´ÑƒÐ¼Ñ–Ð²**.\nâ€” Ð¯ Ñ€Ð¾Ð·ÑƒÐ¼Ñ–ÑŽ, â€” ÐºÐ°Ð¶Ðµ ÐœÐ°Ñ€Ñ–Ñ. â€” Ð†Ð½Ð¾Ð´Ñ– **Ð¼Ð¾Ð²Ñ‡Ð°Ð½Ð½Ñ** â€” Ñ†Ðµ Ð½Ð°Ð¹ÐºÑ€Ð°Ñ‰Ð¸Ð¹ ÑÐ¿Ð¾ÑÑ–Ð± Ð²Ñ‡Ð¸Ñ‚Ð¸ÑÑ.\n\nÐ’Ð¾Ð½Ð¸ Ð´Ð¾Ð¼Ð¾Ð²Ð¸Ð»Ð¸ÑÑ Ð¿Ñ€Ð¾ **Ð¿Ð¾Ð±Ð°Ñ‡ÐµÐ½Ð½Ñ** Ð² Ð±Ñ–Ð±Ð»Ñ–Ð¾Ñ‚ÐµÑ†Ñ– Ð½Ð°ÑÑ‚ÑƒÐ¿Ð½Ð¾Ð³Ð¾ Ñ‚Ð¸Ð¶Ð½Ñ Ð´Ð»Ñ Ð¾Ð±Ð³Ð¾Ð²Ð¾Ñ€ÐµÐ½Ð½Ñ Ñ†Ñ–Ñ”Ñ— Ð²Ð°Ð¶Ð»Ð¸Ð²Ð¾Ñ— Ñ‚ÐµÐ¼Ð¸.\n\nâ€” Ð”Ð¾ **Ð¿Ð¾Ð±Ð°Ñ‡ÐµÐ½Ð½Ñ**! â€” ÑÐºÐ°Ð·Ð°Ð»Ð° ÐœÐ°Ñ€Ñ–Ñ.\nâ€” Ð”Ð¾ **Ð¿Ð¾Ð±Ð°Ñ‡ÐµÐ½Ð½Ñ**! **Ð¡Ð»ÑƒÑ…Ð°Ð¹** Ð»ÐµÐºÑ†Ñ–ÑŽ ÑƒÐ²Ð°Ð¶Ð½Ð¾! â€” Ð²Ñ–Ð´Ð¿Ð¾Ð²Ñ–Ð² ÑÑ‚ÑƒÐ´ÐµÐ½Ñ‚.\n\n---\n\n## Deep Dive: Related Roots\n\n## Ð³Ð»ÑÐ»-/Ð´Ð¸Ð²Ð»- (glance/look)\n\nRelated to Ð±Ð°Ñ‡- but emphasizing the action of looking:\n\n| Word | Meaning |\n|------|---------|\n| Ð¿Ð¾Ð³Ð»ÑÐ´ | look, view |\n| Ð¾Ð³Ð»ÑÐ´ | review |\n| Ð²Ð¸Ð³Ð»ÑÐ´ | appearance |\n| Ð´Ð¸Ð²Ð¸Ñ‚Ð¸ÑÑ | to look, to watch |\n\n## Ð´ÑƒÐ¼Ð»- (think)\n\nRelated to internal perception:\n\n| Word | Meaning |\n|------|---------|\n| Ð´ÑƒÐ¼Ð°Ñ‚Ð¸ | to think |\n| Ð´ÑƒÐ¼ÐºÐ° | thought |\n| Ñ€Ð¾Ð·Ð´ÑƒÐ¼Ð¸ | reflections |\n\n> [!tip] Ð—Ð²'ÑÐ·Ð¾Ðº ÐšÐ¾Ñ€ÐµÐ½Ñ–Ð²\n> **Ð±Ð°Ñ‡-** (Ð±Ð°Ñ‡Ð¸Ñ‚Ð¸) â€” ÑÐ¿Ñ€Ð¸Ð¹Ð½ÑÑ‚Ñ‚Ñ Ð¾Ñ‡Ð¸Ð¼Ð°\n> **ÑÐ»ÑƒÑ…-** (ÑÐ»ÑƒÑ…Ð°Ñ‚Ð¸) â€” ÑÐ¿Ñ€Ð¸Ð¹Ð½ÑÑ‚Ñ‚Ñ Ð²ÑƒÑ…Ð°Ð¼Ð¸\n> **Ñ‡ÑƒÑ‚-** (Ð¿Ð¾Ñ‡ÑƒÑ‚Ñ‚Ñ) â€” ÑÐ¿Ñ€Ð¸Ð¹Ð½ÑÑ‚Ñ‚Ñ ÐµÐ¼Ð¾Ñ†Ñ–Ð¹Ð½Ðµ\n> **Ð´ÑƒÐ¼Ð»-** (Ð´ÑƒÐ¼Ð°Ñ‚Ð¸) â€” Ð²Ð½ÑƒÑ‚Ñ€Ñ–ÑˆÐ½Ñ” ÑÐ¿Ñ€Ð¸Ð¹Ð½ÑÑ‚Ñ‚Ñ\n> Ð’ÑÑ– Ñ†Ñ– ÐºÐ¾Ñ€ÐµÐ½Ñ– Ð¾Ð¿Ð¸ÑÑƒÑŽÑ‚ÑŒ Ñ€Ñ–Ð·Ð½Ñ– Ñ‚Ð¸Ð¿Ð¸ ÑÐ¿Ñ€Ð¸Ð¹Ð½ÑÑ‚Ñ‚Ñ!\n\n### Learning Strategy: Mastering Perception Roots\n\nThe perception roots in this module (Ð±Ð°Ñ‡-, ÑÐ»ÑƒÑ…-, Ñ‡ÑƒÑ‚-, Ð¼Ð¾Ð²-) are among the most frequently used in Ukrainian. Mastering them gives you access to hundreds of everyday expressions and phrases.\n\n**Understanding Root-Based Learning:**\n\nRoot-based vocabulary acquisition is one of the most efficient strategies for language learning. Instead of memorizing each word individually, you learn the core meaning (the root) and then understand how prefixes and suffixes modify that meaning. This approach reduces cognitive load because you're learning patterns rather than isolated items.\n\nFor example, once you know that Ð±Ð°Ñ‡- means \"see,\" you can deduce:\n- Ð±Ð°Ñ‡Ð¸Ñ‚Ð¸ - the basic verb\n- Ð±Ð°Ñ‡ÐµÐ½Ð½Ñ - the abstract noun form\n- Ð¿Ð¾Ð±Ð°Ñ‡ÐµÐ½Ð½Ñ - the prefix Ð¿Ð¾- adds the meaning of \"a single instance\"\n- Ð¿ÐµÑ€ÐµÐ´Ð±Ð°Ñ‡ÐµÐ½Ð½Ñ - the prefix Ð¿ÐµÑ€ÐµÐ´- means \"before,\" so \"seeing before\" = prediction\n\nThis pattern repeats across all root families in Ukrainian, making it a highly systematic language for vocabulary building.\n\n**Why These Roots Matter:**\n\nThese roots appear in some of the most common Ukrainian expressions:\n- \"Ð”Ð¾ Ð¿Ð¾Ð±Ð°Ñ‡ÐµÐ½Ð½Ñ!\" (Goodbye!) - literally \"until seeing\"\n- \"Ð¡Ð»ÑƒÑ…Ð°Ð¹!\" (Listen!) - imperative form, very common\n- \"Ð¯ Ñ‡ÑƒÑŽ\" (I hear) - basic sensory expression\n- \"Ð£ÐºÑ€Ð°Ñ—Ð½ÑÑŒÐºÐ° Ð¼Ð¾Ð²Ð°\" (Ukrainian language) - national identity\n\n**Memory Techniques:**\n\n1. **Create Sensory Associations**: Link each root to a physical sensation. When you see Ð±Ð°Ñ‡-, imagine looking at something. When you see ÑÐ»ÑƒÑ…-, imagine listening to music. This creates stronger neural pathways.\n\n2. **Use the Contrast Method**: The distinction between ÑÐ»ÑƒÑ…Ð°Ñ‚Ð¸ (active listening) and Ñ‡ÑƒÑ‚Ð¸ (passive hearing) is crucial. Practice by categorizing situations: \"I'm listening to a lecture\" = ÑÐ»ÑƒÑ…Ð°ÑŽ. \"I hear birds outside\" = Ñ‡ÑƒÑŽ. This distinction exists in many languages (German: hÃ¶ren/zuhÃ¶ren, Spanish: oÃ­r/escuchar).\n\n3. **Build Word Families Visually**: Create a mind map with the root in the center and all related words branching out. For example:\n   - Center: Ð±Ð°Ñ‡-\n   - Branches: Ð±Ð°Ñ‡Ð¸Ñ‚Ð¸, Ð±Ð°Ñ‡ÐµÐ½Ð½Ñ, Ð¿Ð¾Ð±Ð°Ñ‡ÐµÐ½Ð½Ñ, Ð¿ÐµÑ€ÐµÐ´Ð±Ð°Ñ‡ÐµÐ½Ð½Ñ, Ð¾Ð³Ð»ÑÐ´, Ð¿Ð¾Ð³Ð»ÑÐ´, Ð²Ð¸Ð³Ð»ÑÐ´\n\n**Common Learner Challenges:**\n\nThese are the most frequent mistakes that learners make when working with perception roots. Understanding these distinctions early will save you from developing bad habits.\n\n- **Challenge 1**: Confusing Ð¼Ð¾Ð²Ð° with Ð¼Ð¾Ð²Ð»ÐµÐ½Ð½Ñ\n  - **The Problem**: Both words relate to language/speech, but they describe different aspects\n  - **The Solution**: Remember that Ð¼Ð¾Ð²Ð° is static (like a dictionary or language system), Ð¼Ð¾Ð²Ð»ÐµÐ½Ð½Ñ is dynamic (like the act of speaking or a conversation in progress)\n  - **Example**: \"Ð£ÐºÑ€Ð°Ñ—Ð½ÑÑŒÐºÐ° Ð¼Ð¾Ð²Ð°\" (the Ukrainian language as a system) vs \"Ð™Ð¾Ð³Ð¾ Ð¼Ð¾Ð²Ð»ÐµÐ½Ð½Ñ Ñ‡Ñ–Ñ‚ÐºÐµ\" (His speech/speaking is clear)\n  - **Linguistic Note**: This distinction exists in many languages. In English, we have \"language\" (system) vs \"speech\" (act). In French: \"langue\" vs \"parole\".\n\n- **Challenge 2**: Mixing up Ð¿Ð¾Ñ‡ÑƒÑ‚Ñ‚Ñ and Ð²Ñ–Ð´Ñ‡ÑƒÑ‚Ñ‚Ñ\n  - **The Problem**: Both come from the Ñ‡ÑƒÑ‚- root but refer to different types of perception\n  - **The Solution**: Think of Ð¿Ð¾Ñ‡ÑƒÑ‚Ñ‚Ñ as \"feelings of the heart\" (emotions) and Ð²Ñ–Ð´Ñ‡ÑƒÑ‚Ñ‚Ñ as \"feelings of the body\" (physical sensations)\n  - **Example**: \"Ð¯ Ð¼Ð°ÑŽ Ð¿Ð¾Ñ‡ÑƒÑ‚Ñ‚Ñ Ð»ÑŽÐ±Ð¾Ð²Ñ–\" (I have feelings of love - emotional) vs \"Ð¯ Ð¼Ð°ÑŽ Ð²Ñ–Ð´Ñ‡ÑƒÑ‚Ñ‚Ñ Ñ…Ð¾Ð»Ð¾Ð´Ñƒ\" (I have a sensation of cold - physical)\n  - **Memory Trick**: The prefix Ð²Ñ–Ð´- in Ð²Ñ–Ð´Ñ‡ÑƒÑ‚Ñ‚Ñ suggests \"from\" (something external affecting you physically)\n\n- **Challenge 3**: Forgetting when to use Ð¿Ð¾Ð±Ð°Ñ‡ÐµÐ½Ð½Ñ vs Ð±Ð°Ñ‡ÐµÐ½Ð½Ñ\n  - **The Problem**: These words look very similar but have completely different meanings\n  - **The Solution**: Ð¿Ð¾Ð±Ð°Ñ‡ÐµÐ½Ð½Ñ has the prefix Ð¿Ð¾- which often indicates a single event (like a meeting or date), while Ð±Ð°Ñ‡ÐµÐ½Ð½Ñ is abstract (like a vision, perspective, or way of seeing)\n  - **Example**: \"ÐœÐ¸ Ð¼Ð°Ñ”Ð¼Ð¾ Ð¿Ð¾Ð±Ð°Ñ‡ÐµÐ½Ð½Ñ Ð¾ 3-Ð¹\" (We have a meeting at 3) vs \"Ð™Ð¾Ð³Ð¾ Ñ…ÑƒÐ´Ð¾Ð¶Ð½Ñ” Ð±Ð°Ñ‡ÐµÐ½Ð½Ñ ÑƒÐ½Ñ–ÐºÐ°Ð»ÑŒÐ½Ðµ\" (His artistic vision is unique)\n  - **Grammar Note**: Ð¿Ð¾Ð±Ð°Ñ‡ÐµÐ½Ð½Ñ is countable (you can have one, two, three meetings), while Ð±Ð°Ñ‡ÐµÐ½Ð½Ñ is usually uncountable (it's an abstract concept)\n\n\n---\n\n## Common Mistakes\n\nUnderstanding the difference between related words is crucial for natural Ukrainian speech. Here are the most common mistakes learners make with perception roots.\n\n## Mistake 1: ÑÐ»ÑƒÑ…Ð°Ñ‚Ð¸ vs Ñ‡ÑƒÑ‚Ð¸\n\nThese two verbs both relate to hearing but have different meanings. Use Ñ‡ÑƒÑ‚Ð¸ for passive hearing (sounds reaching your ears) and ÑÐ»ÑƒÑ…Ð°Ñ‚Ð¸ for active listening (paying attention).\n\nâŒ Ð¯ ÑÐ»ÑƒÑ…Ð°ÑŽ ÑˆÑƒÐ¼ Ð¼Ð°ÑˆÐ¸Ð½. (passive)\nâœ… Ð¯ Ñ‡ÑƒÑŽ ÑˆÑƒÐ¼ Ð¼Ð°ÑˆÐ¸Ð½. (I hear car noise.)\n\nâŒ Ð§ÑƒÐ¹ ÑƒÐ²Ð°Ð¶Ð½Ð¾! (should be active)\nâœ… Ð¡Ð»ÑƒÑ…Ð°Ð¹ ÑƒÐ²Ð°Ð¶Ð½Ð¾! (Listen carefully!)\n\nThe same distinction exists in other languages. In German: hÃ¶ren vs zuhÃ¶ren. In Spanish: oÃ­r vs escuchar. Ukrainian makes this distinction consistently across all forms and tenses.\n\n## Mistake 2: Ð¼Ð¾Ð²Ð° vs Ð¼Ð¾Ð²Ð»ÐµÐ½Ð½Ñ\n\nBoth words relate to speech and come from the Ð¼Ð¾Ð²- root, but they describe different things. ÐœÐ¾Ð²Ð° means the language system itself. ÐœÐ¾Ð²Ð»ÐµÐ½Ð½Ñ means the act of speaking.\n\nâŒ Ð’Ñ–Ð½ Ð²Ñ‡Ð¸Ñ‚ÑŒ ÑƒÐºÑ€Ð°Ñ—Ð½ÑÑŒÐºÐµ Ð¼Ð¾Ð²Ð»ÐµÐ½Ð½Ñ.\nâœ… Ð’Ñ–Ð½ Ð²Ñ‡Ð¸Ñ‚ÑŒ ÑƒÐºÑ€Ð°Ñ—Ð½ÑÑŒÐºÑƒ Ð¼Ð¾Ð²Ñƒ. (the language system)\n\nâœ… Ð£ Ð½ÐµÑ— Ð³Ð°Ñ€Ð½Ðµ Ð¼Ð¾Ð²Ð»ÐµÐ½Ð½Ñ. (She has good speech.)\n\n**ÐœÐ¾Ð²Ð°** = language (system, grammar, vocabulary)\n**ÐœÐ¾Ð²Ð»ÐµÐ½Ð½Ñ** = speech (the act, delivery, pronunciation)\n\n## Mistake 3: Ð±Ð°Ñ‡ÐµÐ½Ð½Ñ vs Ð¿Ð¾Ð±Ð°Ñ‡ÐµÐ½Ð½Ñ\n\nThese words look similar but mean different things. Ð‘Ð°Ñ‡ÐµÐ½Ð½Ñ is vision or perspective. ÐŸÐ¾Ð±Ð°Ñ‡ÐµÐ½Ð½Ñ is a meeting or date.\n\nâŒ ÐœÐ¸ Ð¼Ð°Ð»Ð¸ Ð±Ð°Ñ‡ÐµÐ½Ð½Ñ Ð¾ Ñ‚Ñ€ÐµÑ‚Ñ–Ð¹.\nâœ… ÐœÐ¸ Ð¼Ð°Ð»Ð¸ Ð¿Ð¾Ð±Ð°Ñ‡ÐµÐ½Ð½Ñ Ð¾ Ñ‚Ñ€ÐµÑ‚Ñ–Ð¹. (We had a meeting at three.)\n\nâœ… Ð™Ð¾Ð³Ð¾ Ñ…ÑƒÐ´Ð¾Ð¶Ð½Ñ” Ð±Ð°Ñ‡ÐµÐ½Ð½Ñ Ñ†Ñ–ÐºÐ°Ð²Ðµ. (His artistic vision is interesting.)\n\n---\n\n# Summary\n\n**ÐšÐ¾Ñ€Ñ–Ð½ÑŒ Ð±Ð°Ñ‡-:**\n- Ð±Ð°Ñ‡Ð¸Ñ‚Ð¸\n- Ð±Ð°Ñ‡ÐµÐ½Ð½Ñ\n- Ð¿Ð¾Ð±Ð°Ñ‡ÐµÐ½Ð½Ñ\n- Ð¿ÐµÑ€ÐµÐ´Ð±Ð°Ñ‡ÐµÐ½Ð½Ñ\n\n**ÐšÐ¾Ñ€Ñ–Ð½ÑŒ ÑÐ»ÑƒÑ…-/Ñ‡ÑƒÑ‚-:**\n- ÑÐ»ÑƒÑ…Ð°Ñ‚Ð¸\n- ÑÐ»ÑƒÑ…\n- ÑÐ»ÑƒÑ…Ð°Ñ‡\n- Ñ‡ÑƒÑ‚Ð¸\n- Ð¿Ð¾Ñ‡ÑƒÑ‚Ñ‚Ñ\n- Ð²Ñ–Ð´Ñ‡ÑƒÑ‚Ñ‚Ñ\n\n**ÐšÐ¾Ñ€Ñ–Ð½ÑŒ Ð³Ð¾Ð²Ð¾Ñ€-/Ð¼Ð¾Ð²-:**\n- Ð³Ð¾Ð²Ð¾Ñ€Ð¸Ñ‚Ð¸\n- Ñ€Ð¾Ð·Ð¼Ð¾Ð²Ð°\n- Ð¼Ð¾Ð²Ð°\n- Ð¼Ð¾Ð²Ð»ÐµÐ½Ð½Ñ\n- Ð¼Ð¾Ð²Ñ‡Ð°Ñ‚Ð¸\n- Ð¼Ð¾Ð²Ñ‡Ð°Ð½Ð½Ñ\n\nÐ¦Ñ– ÐºÐ¾Ñ€ÐµÐ½Ñ– Ð´Ð¾Ð¿Ð¾Ð¼Ð°Ð³Ð°ÑŽÑ‚ÑŒ Ñ€Ð¾Ð·ÑƒÐ¼Ñ–Ñ‚Ð¸ Ð½Ð¾Ð²Ñ– ÑÐ»Ð¾Ð²Ð° Ð°Ð²Ñ‚Ð¾Ð¼Ð°Ñ‚Ð¸Ñ‡Ð½Ð¾!\n\n---\n\n\n\n> ðŸ’¡ **ÐœÐ¾Ð²Ð° ÑÐº Ð´ÐµÑ€ÐµÐ²Ð¾**\n>\n> Â«Ð¡Ð»Ð¾Ð²Ð¾ â€” Ð½Ðµ Ð³Ð¾Ñ€Ð¾Ð±ÐµÑ†ÑŒ, Ð²Ð¸Ð»ÐµÑ‚Ð¸Ñ‚ÑŒ â€” Ð½Ðµ ÑÐ¿Ñ–Ð¹Ð¼Ð°Ñ”Ñˆ.Â» (ÐšÐ¾Ñ€Ñ–Ð½ÑŒ ÑÐ»Ð¾Ð²Ð° â€” ÐºÐ»ÑŽÑ‡ Ð´Ð¾ Ð·Ð½Ð°Ñ‡ÐµÐ½Ð½Ñ!)\n>\n> *Translation: \"A word is not a sparrow â€” once spoken, you can't take it back.\"*\n\n> ðŸ‡ºðŸ‡¦ **Ð Ð¾Ð´Ð¸Ð½Ð¸ ÐºÐ¾Ñ€ÐµÐ½Ñ–Ð² â€” ÐºÐ»ÑŽÑ‡ Ð´Ð¾ Ñ€Ð¾Ð·ÑƒÐ¼Ñ–Ð½Ð½Ñ**\n>\n> ÐšÐ¾Ð»Ð¸ Ð²Ð¸ Ð·Ð½Ð°Ñ”Ñ‚Ðµ Ð¾Ð´Ð¸Ð½ ÐºÐ¾Ñ€Ñ–Ð½ÑŒ, Ð²Ð¸ Ð·Ð½Ð°Ñ”Ñ‚Ðµ Ð´ÐµÑÑÑ‚ÐºÐ¸ ÑÐ»Ñ–Ð²:\n> - **ÑƒÑ‡-**: Ð²Ñ‡Ð¸Ñ‚Ð¸, ÑƒÑ‡ÐµÐ½ÑŒ, ÑƒÑ‡Ð¸Ñ‚ÐµÐ»ÑŒ, Ð½Ð°Ð²Ñ‡Ð°Ð½Ð½Ñ, Ð²Ð¸Ð²Ñ‡Ð°Ñ‚Ð¸\n> - **Ð»ÑŽÐ±-**: Ð»ÑŽÐ±Ð¸Ñ‚Ð¸, Ð»ÑŽÐ±Ð¾Ð², Ð»ÑŽÐ±Ð¸Ð¹, Ð¿Ð¾Ð»ÑŽÐ±Ð¸Ñ‚Ð¸\n> - **Ð¿Ð¸Ñ-**: Ð¿Ð¸ÑÐ°Ñ‚Ð¸, Ð¿Ð¸ÑÑŒÐ¼Ð¾, Ð¿Ð¸ÑÑŒÐ¼ÐµÐ½Ð½Ð¸Ðº, Ð·Ð°Ð¿Ð¸ÑÐ°Ñ‚Ð¸\n>\n> Ð¨ÑƒÐºÐ°Ð¹Ñ‚Ðµ ÐºÐ¾Ñ€ÐµÐ½Ñ– Ñƒ Ð½Ð¾Ð²Ð¸Ñ… ÑÐ»Ð¾Ð²Ð°Ñ… â€” Ñ†Ðµ Ð½Ð°Ð¹ÐºÑ€Ð°Ñ‰Ð¸Ð¹ ÑÐ¿Ð¾ÑÑ–Ð± Ñ€Ð¾Ð·ÑˆÐ¸Ñ€Ð¸Ñ‚Ð¸ ÑÐ»Ð¾Ð²Ð½Ð¸Ðº!\n\n> [!resources] ðŸ”— External Resources\n>\n> **YouTube:** [25 COMMON UKRAINIAN PHRASES EVERY LEARNER MUST KNOW...](https://www.youtube.com/watch?v=aJ2Ldu2TaKA) â€” Speak Ukrainian\n>\n> **Grammar Guide:** [Ukrainian Grammar](https://www.ukrainianlessons.com/ukrainian-tenses/) â€” Grammar overview\n>\n> **Interactive:** [Talk Ukrainian](https://talkukrainian.com/) â€” Practice exercises\n\n---\n\n# Activities\n\n## match-up: Perception Roots\n\n> Match the word to its meaning.\n\n- Ð±Ð°Ñ‡Ð¸Ñ‚Ð¸ :: to see\n- Ð±Ð°Ñ‡ÐµÐ½Ð½Ñ :: vision\n- Ð¿Ð¾Ð±Ð°Ñ‡ÐµÐ½Ð½Ñ :: meeting/date\n- ÑÐ»ÑƒÑ…Ð°Ñ‚Ð¸ :: to listen\n- ÑÐ»ÑƒÑ… :: hearing\n- ÑÐ»ÑƒÑ…Ð°Ñ‡ :: listener\n- Ñ‡ÑƒÑ‚Ð¸ :: to hear\n- Ð¿Ð¾Ñ‡ÑƒÑ‚Ñ‚Ñ :: feeling\n\n## match-up: Speech Roots\n\n> Match the word to its meaning.\n\n- Ð³Ð¾Ð²Ð¾Ñ€Ð¸Ñ‚Ð¸ :: to speak\n- Ñ€Ð¾Ð·Ð¼Ð¾Ð²Ð° :: conversation\n- Ð¼Ð¾Ð²Ð° :: language\n- Ð¼Ð¾Ð²Ð»ÐµÐ½Ð½Ñ :: speech\n- Ð¼Ð¾Ð²Ñ‡Ð°Ñ‚Ð¸ :: to be silent\n- Ð¼Ð¾Ð²Ñ‡Ð°Ð½Ð½Ñ :: silence\n- Ð´ÑƒÐ¼Ð°Ñ‚Ð¸ :: to think\n- Ð´ÑƒÐ¼ÐºÐ° :: thought\n\n## fill-in: Root Families\n\n> Complete the sentences.\n\n1. Ð¯ Ñ…Ð¾Ñ‡Ñƒ [___] Ñ‚ÐµÐ±Ðµ. (see)\n   > [!answer] Ð±Ð°Ñ‡Ð¸Ñ‚Ð¸\n   > [!options] Ð±Ð°Ñ‡Ð¸Ñ‚Ð¸ | ÑÐ»ÑƒÑ…Ð°Ñ‚Ð¸ | Ð³Ð¾Ð²Ð¾Ñ€Ð¸Ñ‚Ð¸ | Ñ‡ÑƒÑ‚Ð¸\n\n2. [___] ÑƒÐ²Ð°Ð¶Ð½Ð¾! (Listen)\n   > [!answer] Ð¡Ð»ÑƒÑ…Ð°Ð¹\n   > [!options] Ð¡Ð»ÑƒÑ…Ð°Ð¹ | Ð‘Ð°Ñ‡ | Ð“Ð¾Ð²Ð¾Ñ€Ð¸ | ÐŸÐ¸ÑˆÐ¸\n\n3. Ð£ÐºÑ€Ð°Ñ—Ð½ÑÑŒÐºÐ° [___] ÐºÑ€Ð°ÑÐ¸Ð²Ð°. (language)\n   > [!answer] Ð¼Ð¾Ð²Ð°\n   > [!options] Ð¼Ð¾Ð²Ð° | Ñ€Ð¾Ð·Ð¼Ð¾Ð²Ð° | Ð¼Ð¾Ð²Ð»ÐµÐ½Ð½Ñ | ÑÐ»Ð¾Ð²Ð¾\n\n4. Ð¯ [___] Ð¼ÑƒÐ·Ð¸ÐºÑƒ Ð·Ð´Ð°Ð»ÐµÐºÑƒ. (hear)\n   > [!answer] Ñ‡ÑƒÑŽ\n   > [!options] Ñ‡ÑƒÑŽ | ÑÐ»ÑƒÑ…Ð°ÑŽ | Ð±Ð°Ñ‡Ñƒ | Ð³Ð¾Ð²Ð¾Ñ€ÑŽ\n\n5. ÐœÐ¸ Ð¼Ð°Ð»Ð¸ Ð³Ð°Ñ€Ð½Ñƒ [___]. (conversation)\n   > [!answer] Ñ€Ð¾Ð·Ð¼Ð¾Ð²Ñƒ\n   > [!options] Ñ€Ð¾Ð·Ð¼Ð¾Ð²Ñƒ | Ð¼Ð¾Ð²Ñƒ | ÑÐ»Ð¾Ð²Ð¾ | Ð±Ð°Ñ‡ÐµÐ½Ð½Ñ\n\n6. Ð’Ð¾Ð½Ð¸ Ð¼Ð°Ð»Ð¸ Ñ€Ð¾Ð¼Ð°Ð½Ñ‚Ð¸Ñ‡Ð½Ðµ [___]. (date)\n   > [!answer] Ð¿Ð¾Ð±Ð°Ñ‡ÐµÐ½Ð½Ñ\n   > [!options] Ð¿Ð¾Ð±Ð°Ñ‡ÐµÐ½Ð½Ñ | Ð±Ð°Ñ‡ÐµÐ½Ð½Ñ | Ñ€Ð¾Ð·Ð¼Ð¾Ð²Ð° | ÑÐ»ÑƒÑ…Ð°Ð½Ð½Ñ\n\n7. [___] Ð±ÑƒÐ»Ð¸ ÑƒÐ²Ð°Ð¶Ð½Ð¸Ð¼Ð¸. (listeners)\n   > [!answer] Ð¡Ð»ÑƒÑ…Ð°Ñ‡Ñ–\n   > [!options] Ð¡Ð»ÑƒÑ…Ð°Ñ‡Ñ– | ÐœÐ¾Ð²Ñ†Ñ– | Ð§Ð¸Ñ‚Ð°Ñ‡Ñ– | Ð“Ð»ÑÐ´Ð°Ñ‡Ñ–\n\n8. Ð‘ÑƒÐ´ÑŒ Ð»Ð°ÑÐºÐ°, [___]! (be silent)\n   > [!answer] Ð¼Ð¾Ð²Ñ‡Ð¸\n   > [!options] Ð¼Ð¾Ð²Ñ‡Ð¸ | Ð³Ð¾Ð²Ð¾Ñ€Ð¸ | ÑÐ»ÑƒÑ…Ð°Ð¹ | Ð´Ð¸Ð²Ð¸ÑÑŒ\n\n## quiz: Perception Roots\n\n1. Ð”Ð¾ ÑÐºÐ¾Ð³Ð¾ ÑÐ°Ð¼Ðµ Ñ‚Ð¸Ð¿Ñƒ ÑÐ¿Ñ€Ð¸Ð¹Ð½ÑÑ‚Ñ‚Ñ Ð²Ñ–Ð´Ð½Ð¾ÑÐ¸Ñ‚ÑŒÑÑ ÑƒÐºÑ€Ð°Ñ—Ð½ÑÑŒÐºÐ¸Ð¹ ÐºÐ¾Ñ€Ñ–Ð½ÑŒ \"Ð±Ð°Ñ‡-\" Ñƒ ÑÐ»Ð¾Ð²Ð°Ñ… \"Ð±Ð°Ñ‡Ð¸Ñ‚Ð¸\" Ñ‚Ð° \"Ð±Ð°Ñ‡ÐµÐ½Ð½Ñ\" Ð·Ð³Ñ–Ð´Ð½Ð¾ Ð· Ð»Ð¾Ð³Ñ–ÐºÐ¾ÑŽ Ð¼Ð¾Ð²Ð¸?\n   - [x] Ð¦ÐµÐ¹ ÐºÐ¾Ñ€Ñ–Ð½ÑŒ Ð±ÐµÐ·Ð¿Ð¾ÑÐµÑ€ÐµÐ´Ð½ÑŒÐ¾ Ð²Ñ–Ð´Ð½Ð¾ÑÐ¸Ñ‚ÑŒÑÑ Ð´Ð¾ Ð¿Ñ€Ð¾Ñ†ÐµÑÑƒ Ð±Ð°Ñ‡ÐµÐ½Ð½Ñ Ñ‚Ð° Ð·Ð¾Ñ€Ð¾Ð²Ð¾Ð³Ð¾ ÑÐ¿Ñ€Ð¸Ð¹Ð½ÑÑ‚Ñ‚Ñ ÑÐ²Ñ–Ñ‚Ñƒ\n   - [ ] Ð¦ÐµÐ¹ ÐºÐ¾Ñ€Ñ–Ð½ÑŒ Ð±ÐµÐ·Ð¿Ð¾ÑÐµÑ€ÐµÐ´Ð½ÑŒÐ¾ Ð²Ñ–Ð´Ð½Ð¾ÑÐ¸Ñ‚ÑŒÑÑ Ð´Ð¾ Ð¿Ñ€Ð¾Ñ†ÐµÑÑƒ ÑÐ»ÑƒÑ…Ð°Ð½Ð½Ñ Ñ‚Ð° Ð°ÑƒÐ´Ñ–Ð°Ð»ÑŒÐ½Ð¾Ð³Ð¾ ÑÐ¿Ñ€Ð¸Ð¹Ð½ÑÑ‚Ñ‚Ñ\n   - [ ] Ð¦ÐµÐ¹ ÐºÐ¾Ñ€Ñ–Ð½ÑŒ Ð±ÐµÐ·Ð¿Ð¾ÑÐµÑ€ÐµÐ´Ð½ÑŒÐ¾ Ð²Ñ–Ð´Ð½Ð¾ÑÐ¸Ñ‚ÑŒÑÑ Ð´Ð¾ Ð¿Ñ€Ð¾Ñ†ÐµÑÑƒ Ð³Ð¾Ð²Ð¾Ñ€Ñ–Ð½Ð½Ñ Ñ‚Ð° Ð¼Ð¾Ð²Ð»ÐµÐ½Ð½Ñ”Ð²Ð¾Ñ— Ð´Ñ–ÑÐ»ÑŒÐ½Ð¾ÑÑ‚Ñ–\n   - [ ] Ð¦ÐµÐ¹ ÐºÐ¾Ñ€Ñ–Ð½ÑŒ Ð±ÐµÐ·Ð¿Ð¾ÑÐµÑ€ÐµÐ´Ð½ÑŒÐ¾ Ð²Ñ–Ð´Ð½Ð¾ÑÐ¸Ñ‚ÑŒÑÑ Ð´Ð¾ Ð¿Ñ€Ð¾Ñ†ÐµÑÑƒ Ð´ÑƒÐ¼Ð°Ð½Ð½Ñ Ñ‚Ð° Ñ€Ð¾Ð·ÑƒÐ¼Ð¾Ð²Ð¾Ñ— Ð´Ñ–ÑÐ»ÑŒÐ½Ð¾ÑÑ‚Ñ–\n\n---\n\n2. Ð”Ð¾ ÑÐºÐ¾Ð³Ð¾ ÑÐ°Ð¼Ðµ Ñ‚Ð¸Ð¿Ñƒ ÑÐ¿Ñ€Ð¸Ð¹Ð½ÑÑ‚Ñ‚Ñ Ð²Ñ–Ð´Ð½Ð¾ÑÐ¸Ñ‚ÑŒÑÑ ÑƒÐºÑ€Ð°Ñ—Ð½ÑÑŒÐºÐ¸Ð¹ ÐºÐ¾Ñ€Ñ–Ð½ÑŒ \"ÑÐ»ÑƒÑ…-\" Ñƒ ÑÐ»Ð¾Ð²Ð°Ñ… \"ÑÐ»ÑƒÑ…Ð°Ñ‚Ð¸\" Ñ‚Ð° \"ÑÐ»ÑƒÑ…\" Ð·Ð³Ñ–Ð´Ð½Ð¾ Ð· Ð»Ð¾Ð³Ñ–ÐºÐ¾ÑŽ Ð¼Ð¾Ð²Ð¸?\n   - [x] Ð¦ÐµÐ¹ ÐºÐ¾Ñ€Ñ–Ð½ÑŒ Ð±ÐµÐ·Ð¿Ð¾ÑÐµÑ€ÐµÐ´Ð½ÑŒÐ¾ Ð²Ñ–Ð´Ð½Ð¾ÑÐ¸Ñ‚ÑŒÑÑ Ð´Ð¾ Ð¿Ñ€Ð¾Ñ†ÐµÑÑƒ Ð°ÐºÑ‚Ð¸Ð²Ð½Ð¾Ð³Ð¾ ÑÐ»ÑƒÑ…Ð°Ð½Ð½Ñ Ñ‚Ð° Ð°ÑƒÐ´Ñ–Ð°Ð»ÑŒÐ½Ð¾Ð³Ð¾ ÑÐ¿Ñ€Ð¸Ð¹Ð½ÑÑ‚Ñ‚Ñ\n   - [ ] Ð¦ÐµÐ¹ ÐºÐ¾Ñ€Ñ–Ð½ÑŒ Ð±ÐµÐ·Ð¿Ð¾ÑÐµÑ€ÐµÐ´Ð½ÑŒÐ¾ Ð²Ñ–Ð´Ð½Ð¾ÑÐ¸Ñ‚ÑŒÑÑ Ð´Ð¾ Ð¿Ñ€Ð¾Ñ†ÐµÑÑƒ Ð±Ð°Ñ‡ÐµÐ½Ð½Ñ Ñ‚Ð° Ð·Ð¾Ñ€Ð¾Ð²Ð¾Ð³Ð¾ ÑÐ¿Ñ€Ð¸Ð¹Ð½ÑÑ‚Ñ‚Ñ ÑÐ²Ñ–Ñ‚Ñƒ\n   - [ ] Ð¦ÐµÐ¹ ÐºÐ¾Ñ€Ñ–Ð½ÑŒ Ð±ÐµÐ·Ð¿Ð¾ÑÐµÑ€ÐµÐ´Ð½ÑŒÐ¾ Ð²Ñ–Ð´Ð½Ð¾ÑÐ¸Ñ‚ÑŒÑÑ Ð´Ð¾ Ð¿Ñ€Ð¾Ñ†ÐµÑÑƒ Ð´ÑƒÐ¼Ð°Ð½Ð½Ñ Ñ‚Ð° Ñ€Ð¾Ð·ÑƒÐ¼Ð¾Ð²Ð¾Ñ— Ð´Ñ–ÑÐ»ÑŒÐ½Ð¾ÑÑ‚Ñ– Ð»ÑŽÐ´Ð¸Ð½Ð¸\n   - [ ] Ð¦ÐµÐ¹ ÐºÐ¾Ñ€Ñ–Ð½ÑŒ Ð±ÐµÐ·Ð¿Ð¾ÑÐµÑ€ÐµÐ´Ð½ÑŒÐ¾ Ð²Ñ–Ð´Ð½Ð¾ÑÐ¸Ñ‚ÑŒÑÑ Ð´Ð¾ Ð¿Ñ€Ð¾Ñ†ÐµÑÑƒ Ð³Ð¾Ð²Ð¾Ñ€Ñ–Ð½Ð½Ñ Ñ‚Ð° Ð¼Ð¾Ð²Ð»ÐµÐ½Ð½Ñ”Ð²Ð¾Ñ— Ð´Ñ–ÑÐ»ÑŒÐ½Ð¾ÑÑ‚Ñ–\n\n---\n\n3. Ð”Ð¾ ÑÐºÐ¾Ñ— ÑÐ°Ð¼Ðµ ÑÑ„ÐµÑ€Ð¸ Ð´Ñ–ÑÐ»ÑŒÐ½Ð¾ÑÑ‚Ñ– Ð²Ñ–Ð´Ð½Ð¾ÑÑÑ‚ÑŒÑÑ ÑƒÐºÑ€Ð°Ñ—Ð½ÑÑŒÐºÑ– ÐºÐ¾Ñ€ÐµÐ½Ñ– \"Ð³Ð¾Ð²Ð¾Ñ€-\" Ñ‚Ð° \"Ð¼Ð¾Ð²-\" Ñƒ ÑÐ»Ð¾Ð²Ð°Ñ… \"Ð³Ð¾Ð²Ð¾Ñ€Ð¸Ñ‚Ð¸\" Ñ– \"Ð¼Ð¾Ð²Ð°\"?\n   - [x] Ð¦Ñ– ÐºÐ¾Ñ€ÐµÐ½Ñ– Ð±ÐµÐ·Ð¿Ð¾ÑÐµÑ€ÐµÐ´Ð½ÑŒÐ¾ Ð²Ñ–Ð´Ð½Ð¾ÑÑÑ‚ÑŒÑÑ Ð´Ð¾ ÑÑ„ÐµÑ€Ð¸ Ð³Ð¾Ð²Ð¾Ñ€Ñ–Ð½Ð½Ñ Ð¼Ð¾Ð²Ð»ÐµÐ½Ð½Ñ Ñ‚Ð° Ð¼Ð¾Ð²Ð½Ð¾Ñ— ÐºÐ¾Ð¼ÑƒÐ½Ñ–ÐºÐ°Ñ†Ñ–Ñ—\n   - [ ] Ð¦Ñ– ÐºÐ¾Ñ€ÐµÐ½Ñ– Ð±ÐµÐ·Ð¿Ð¾ÑÐµÑ€ÐµÐ´Ð½ÑŒÐ¾ Ð²Ñ–Ð´Ð½Ð¾ÑÑÑ‚ÑŒÑÑ Ð´Ð¾ ÑÑ„ÐµÑ€Ð¸ Ð±Ð°Ñ‡ÐµÐ½Ð½Ñ Ñ‚Ð° Ð·Ð¾Ñ€Ð¾Ð²Ð¾Ð³Ð¾ ÑÐ¿Ñ€Ð¸Ð¹Ð½ÑÑ‚Ñ‚Ñ\n   - [ ] Ð¦Ñ– ÐºÐ¾Ñ€ÐµÐ½Ñ– Ð±ÐµÐ·Ð¿Ð¾ÑÐµÑ€ÐµÐ´Ð½ÑŒÐ¾ Ð²Ñ–Ð´Ð½Ð¾ÑÑÑ‚ÑŒÑÑ Ð´Ð¾ ÑÑ„ÐµÑ€Ð¸ ÑÐ»ÑƒÑ…Ð°Ð½Ð½Ñ Ñ‚Ð° Ð°ÑƒÐ´Ñ–Ð°Ð»ÑŒÐ½Ð¾Ð³Ð¾ ÑÐ¿Ñ€Ð¸Ð¹Ð½ÑÑ‚Ñ‚Ñ\n   - [ ] Ð¦Ñ– ÐºÐ¾Ñ€ÐµÐ½Ñ– Ð±ÐµÐ·Ð¿Ð¾ÑÐµÑ€ÐµÐ´Ð½ÑŒÐ¾ Ð²Ñ–Ð´Ð½Ð¾ÑÑÑ‚ÑŒÑÑ Ð´Ð¾ ÑÑ„ÐµÑ€Ð¸ Ð´ÑƒÐ¼Ð°Ð½Ð½Ñ Ñ‚Ð° Ñ€Ð¾Ð·ÑƒÐ¼Ð¾Ð²Ð¾Ñ— Ð´Ñ–ÑÐ»ÑŒÐ½Ð¾ÑÑ‚Ñ–\n\n---\n\n4. Ð©Ð¾ ÑÐ°Ð¼Ðµ Ð¾Ð·Ð½Ð°Ñ‡Ð°Ñ” ÑƒÐºÑ€Ð°Ñ—Ð½ÑÑŒÐºÐµ ÑÐ»Ð¾Ð²Ð¾ \"Ð¿Ð¾Ð±Ð°Ñ‡ÐµÐ½Ð½Ñ\" ÑÐºÐµ ÑƒÑ‚Ð²Ð¾Ñ€ÐµÐ½Ðµ Ð²Ñ–Ð´ ÐºÐ¾Ñ€ÐµÐ½Ñ \"Ð±Ð°Ñ‡-\" Ð· Ð¿Ñ€ÐµÑ„Ñ–ÐºÑÐ¾Ð¼ \"Ð¿Ð¾-\" Ñƒ Ð¿Ð¾Ð²ÑÑÐºÐ´ÐµÐ½Ð½Ñ–Ð¹ Ð¼Ð¾Ð²Ñ–?\n   - [x] Ð¦Ðµ ÑÐ»Ð¾Ð²Ð¾ Ð¾Ð·Ð½Ð°Ñ‡Ð°Ñ” Ð·ÑƒÑÑ‚Ñ€Ñ–Ñ‡ Ð°Ð±Ð¾ Ð¿Ð¾Ð±Ð°Ñ‡ÐµÐ½Ð½Ñ Ð¼Ñ–Ð¶ Ð»ÑŽÐ´ÑŒÐ¼Ð¸ Ñƒ Ð¿ÐµÐ²Ð½Ð¸Ð¹ Ñ‡Ð°Ñ\n   - [ ] Ð¦Ðµ ÑÐ»Ð¾Ð²Ð¾ Ð¾Ð·Ð½Ð°Ñ‡Ð°Ñ” Ñ…ÑƒÐ´Ð¾Ð¶Ð½Ñ” Ð±Ð°Ñ‡ÐµÐ½Ð½Ñ Ð°Ð±Ð¾ Ð¿ÐµÑ€ÑÐ¿ÐµÐºÑ‚Ð¸Ð²Ñƒ Ð¼Ð¸Ñ‚Ñ†Ñ Ð½Ð° ÑÐ²Ñ–Ñ‚\n   - [ ] Ð¦Ðµ ÑÐ»Ð¾Ð²Ð¾ Ð¾Ð·Ð½Ð°Ñ‡Ð°Ñ” Ð¿ÐµÑ€ÐµÐ´Ð±Ð°Ñ‡ÐµÐ½Ð½Ñ Ð°Ð±Ð¾ Ð¿Ñ€Ð¾Ð³Ð½Ð¾Ð· Ð¼Ð°Ð¹Ð±ÑƒÑ‚Ð½Ñ–Ñ… Ð¿Ð¾Ð´Ñ–Ð¹\n   - [ ] Ð¦Ðµ ÑÐ»Ð¾Ð²Ð¾ Ð¾Ð·Ð½Ð°Ñ‡Ð°Ñ” Ð¿Ñ€Ð¾Ñ†ÐµÑ ÑÐ¿Ð¾ÑÑ‚ÐµÑ€ÐµÐ¶ÐµÐ½Ð½Ñ Ð°Ð±Ð¾ Ð´Ð¸Ð²Ð»ÐµÐ½Ð½Ñ Ð½Ð° Ñ‰Ð¾ÑÑŒ\n\n---\n\n5. Ð©Ð¾ ÑÐ°Ð¼Ðµ Ð¾Ð·Ð½Ð°Ñ‡Ð°Ñ” ÑƒÐºÑ€Ð°Ñ—Ð½ÑÑŒÐºÐµ ÑÐ»Ð¾Ð²Ð¾ \"ÑÐ»ÑƒÑ…Ð°Ñ‡\" ÑÐºÐµ ÑƒÑ‚Ð²Ð¾Ñ€ÐµÐ½Ðµ Ð²Ñ–Ð´ ÐºÐ¾Ñ€ÐµÐ½Ñ \"ÑÐ»ÑƒÑ…-\" Ð· ÑÑƒÑ„Ñ–ÐºÑÐ¾Ð¼ \"-Ð°Ñ‡\" Ñƒ ÐºÐ¾Ð½Ñ‚ÐµÐºÑÑ‚Ñ– Ð¾ÑÐ²Ñ–Ñ‚Ð¸?\n   - [x] Ð¦Ðµ ÑÐ»Ð¾Ð²Ð¾ Ð¾Ð·Ð½Ð°Ñ‡Ð°Ñ” Ð»ÑŽÐ´Ð¸Ð½Ñƒ ÑÐºÐ° ÑÐ»ÑƒÑ…Ð°Ñ” Ð»ÐµÐºÑ†Ñ–Ñ— Ð°Ð±Ð¾ Ñ€Ð°Ð´Ñ–Ð¾Ð¿ÐµÑ€ÐµÐ´Ð°Ñ‡Ñ– ÑƒÐ²Ð°Ð¶Ð½Ð¾\n   - [ ] Ð¦Ðµ ÑÐ»Ð¾Ð²Ð¾ Ð¾Ð·Ð½Ð°Ñ‡Ð°Ñ” Ð»ÑŽÐ´Ð¸Ð½Ñƒ ÑÐºÐ° Ð³Ð¾Ð²Ð¾Ñ€Ð¸Ñ‚ÑŒ Ð°Ð±Ð¾ Ð²Ð¸ÑÑ‚ÑƒÐ¿Ð°Ñ” Ð¿ÐµÑ€ÐµÐ´ Ð°ÑƒÐ´Ð¸Ñ‚Ð¾Ñ€Ñ–Ñ”ÑŽ Ð¿ÑƒÐ±Ð»Ñ–Ñ‡Ð½Ð¾\n   - [ ] Ð¦Ðµ ÑÐ»Ð¾Ð²Ð¾ Ð¾Ð·Ð½Ð°Ñ‡Ð°Ñ” Ð»ÑŽÐ´Ð¸Ð½Ñƒ ÑÐºÐ° Ð´Ð¸Ð²Ð¸Ñ‚ÑŒÑÑ Ð°Ð±Ð¾ ÑÐ¿Ð¾ÑÑ‚ÐµÑ€Ñ–Ð³Ð°Ñ” Ð·Ð° Ð¿Ð¾Ð´Ñ–ÑÐ¼Ð¸ Ð½Ð°Ð²ÐºÐ¾Ð»Ð¾\n   - [ ] Ð¦Ðµ ÑÐ»Ð¾Ð²Ð¾ Ð¾Ð·Ð½Ð°Ñ‡Ð°Ñ” Ð»ÑŽÐ´Ð¸Ð½Ñƒ ÑÐºÐ° Ð´ÑƒÐ¼Ð°Ñ” Ð°Ð±Ð¾ Ñ€Ð¾Ð·Ð´ÑƒÐ¼ÑƒÑ” Ð½Ð°Ð´ ÑÐºÐ»Ð°Ð´Ð½Ð¸Ð¼Ð¸ Ð¿Ð¸Ñ‚Ð°Ð½Ð½ÑÐ¼Ð¸\n\n---\n\n6. Ð¯ÐºÐ° ÑÐ°Ð¼Ðµ Ñ€Ñ–Ð·Ð½Ð¸Ñ†Ñ Ð¼Ñ–Ð¶ ÑƒÐºÑ€Ð°Ñ—Ð½ÑÑŒÐºÐ¸Ð¼Ð¸ ÑÐ»Ð¾Ð²Ð°Ð¼Ð¸ \"Ð¼Ð¾Ð²Ð°\" Ñ‚Ð° \"Ð¼Ð¾Ð²Ð»ÐµÐ½Ð½Ñ\" ÑÐºÑ– Ð¾Ð±Ð¸Ð´Ð²Ð° Ð¿Ð¾Ñ…Ð¾Ð´ÑÑ‚ÑŒ Ð²Ñ–Ð´ ÐºÐ¾Ñ€ÐµÐ½Ñ \"Ð¼Ð¾Ð²-\" Ñƒ Ð»Ñ–Ð½Ð³Ð²Ñ–ÑÑ‚Ð¸Ñ†Ñ–?\n   - [x] Ð¡Ð»Ð¾Ð²Ð¾ \"Ð¼Ð¾Ð²Ð°\" Ð¾Ð·Ð½Ð°Ñ‡Ð°Ñ” Ð¼Ð¾Ð²Ð½Ñƒ ÑÐ¸ÑÑ‚ÐµÐ¼Ñƒ Ð° \"Ð¼Ð¾Ð²Ð»ÐµÐ½Ð½Ñ\" Ð¾Ð·Ð½Ð°Ñ‡Ð°Ñ” Ð°ÐºÑ‚ Ð³Ð¾Ð²Ð¾Ñ€Ñ–Ð½Ð½Ñ\n   - [ ] Ð¡Ð»Ð¾Ð²Ð¾ \"Ð¼Ð¾Ð²Ð°\" Ð¾Ð·Ð½Ð°Ñ‡Ð°Ñ” Ð°ÐºÑ‚ Ð³Ð¾Ð²Ð¾Ñ€Ñ–Ð½Ð½Ñ Ð° \"Ð¼Ð¾Ð²Ð»ÐµÐ½Ð½Ñ\" Ð¾Ð·Ð½Ð°Ñ‡Ð°Ñ” Ð¼Ð¾Ð²Ð½Ñƒ ÑÐ¸ÑÑ‚ÐµÐ¼Ñƒ\n   - [ ] Ð¦Ñ– Ð´Ð²Ð° ÑÐ»Ð¾Ð²Ð° Ñ” Ð¿Ð¾Ð²Ð½Ð¸Ð¼Ð¸ ÑÐ¸Ð½Ð¾Ð½Ñ–Ð¼Ð°Ð¼Ð¸ Ñ– Ð¾Ð·Ð½Ð°Ñ‡Ð°ÑŽÑ‚ÑŒ Ð°Ð±ÑÐ¾Ð»ÑŽÑ‚Ð½Ð¾ Ð¾Ð´Ð½Ðµ Ð¹ Ñ‚Ðµ ÑÐ°Ð¼Ðµ\n   - [ ] Ð¡Ð»Ð¾Ð²Ð¾ \"Ð¼Ð¾Ð²Ð°\" Ð¾Ð·Ð½Ð°Ñ‡Ð°Ñ” Ð¿Ð¸ÑÑŒÐ¼Ð¾ Ð° \"Ð¼Ð¾Ð²Ð»ÐµÐ½Ð½Ñ\" Ð¾Ð·Ð½Ð°Ñ‡Ð°Ñ” ÑƒÑÐ½Ðµ ÑÐ¿Ñ–Ð»ÐºÑƒÐ²Ð°Ð½Ð½Ñ\n\n---\n\n7. Ð©Ð¾ ÑÐ°Ð¼Ðµ Ð¾Ð·Ð½Ð°Ñ‡Ð°Ñ” ÑƒÐºÑ€Ð°Ñ—Ð½ÑÑŒÐºÐµ Ð´Ñ–Ñ”ÑÐ»Ð¾Ð²Ð¾ \"Ð¼Ð¾Ð²Ñ‡Ð°Ñ‚Ð¸\" ÑÐºÐµ ÑƒÑ‚Ð²Ð¾Ñ€ÐµÐ½Ðµ Ð²Ñ–Ð´ ÐºÐ¾Ñ€ÐµÐ½Ñ \"Ð¼Ð¾Ð²-\" Ð· Ð´Ð¾Ð´Ð°Ñ‚ÐºÐ¾Ð²Ð¸Ð¼ ÐµÐ»ÐµÐ¼ÐµÐ½Ñ‚Ð¾Ð¼ \"-Ñ‡-\" Ñƒ Ð¿Ð¾Ð²ÑÑÐºÐ´ÐµÐ½Ð½Ñ–Ð¹ Ð¼Ð¾Ð²Ñ–?\n   - [x] Ð¦Ðµ Ð´Ñ–Ñ”ÑÐ»Ð¾Ð²Ð¾ Ð¾Ð·Ð½Ð°Ñ‡Ð°Ñ” Ð±ÑƒÑ‚Ð¸ Ð¼Ð¾Ð²Ñ‡Ð°Ð·Ð½Ð¸Ð¼ Ð°Ð±Ð¾ Ð½Ðµ Ð³Ð¾Ð²Ð¾Ñ€Ð¸Ñ‚Ð¸ Ð·Ð¾Ð²ÑÑ–Ð¼ Ñƒ Ð¿ÐµÐ²Ð½Ñ–Ð¹ ÑÐ¸Ñ‚ÑƒÐ°Ñ†Ñ–Ñ—\n   - [ ] Ð¦Ðµ Ð´Ñ–Ñ”ÑÐ»Ð¾Ð²Ð¾ Ð¾Ð·Ð½Ð°Ñ‡Ð°Ñ” Ð³Ð¾Ð²Ð¾Ñ€Ð¸Ñ‚Ð¸ Ð°Ð±Ð¾ Ñ€Ð¾Ð·Ð¼Ð¾Ð²Ð»ÑÑ‚Ð¸ Ð· Ñ–Ð½ÑˆÐ¸Ð¼Ð¸ Ð»ÑŽÐ´ÑŒÐ¼Ð¸ Ð°ÐºÑ‚Ð¸Ð²Ð½Ð¾\n   - [ ] Ð¦Ðµ Ð´Ñ–Ñ”ÑÐ»Ð¾Ð²Ð¾ Ð¾Ð·Ð½Ð°Ñ‡Ð°Ñ” ÑÐ»ÑƒÑ…Ð°Ñ‚Ð¸ Ð°Ð±Ð¾ ÑÐ¿Ñ€Ð¸Ð¹Ð¼Ð°Ñ‚Ð¸ Ð·Ð²ÑƒÐºÐ¸ Ð²ÑƒÑ…Ð°Ð¼Ð¸ ÑƒÐ²Ð°Ð¶Ð½Ð¾\n   - [ ] Ð¦Ðµ Ð´Ñ–Ñ”ÑÐ»Ð¾Ð²Ð¾ Ð¾Ð·Ð½Ð°Ñ‡Ð°Ñ” Ð´Ð¸Ð²Ð¸Ñ‚Ð¸ÑÑ Ð°Ð±Ð¾ ÑÐ¿Ð¾ÑÑ‚ÐµÑ€Ñ–Ð³Ð°Ñ‚Ð¸ Ð·Ð° Ð¿Ð¾Ð´Ñ–ÑÐ¼Ð¸ Ð¾Ñ‡Ð¸Ð¼Ð°\n\n---\n\n8. Ð¯ÐºÐ° ÑÐ°Ð¼Ðµ Ñ€Ñ–Ð·Ð½Ð¸Ñ†Ñ Ð¼Ñ–Ð¶ ÑƒÐºÑ€Ð°Ñ—Ð½ÑÑŒÐºÐ¸Ð¼Ð¸ ÑÐ»Ð¾Ð²Ð°Ð¼Ð¸ \"Ð¿Ð¾Ñ‡ÑƒÑ‚Ñ‚Ñ\" Ñ‚Ð° \"Ð²Ñ–Ð´Ñ‡ÑƒÑ‚Ñ‚Ñ\" ÑÐºÑ– Ð¾Ð±Ð¸Ð´Ð²Ð° Ð¿Ð¾Ñ…Ð¾Ð´ÑÑ‚ÑŒ Ð²Ñ–Ð´ ÐºÐ¾Ñ€ÐµÐ½Ñ \"Ñ‡ÑƒÑ‚-\" Ñƒ Ð¿ÑÐ¸Ñ…Ð¾Ð»Ð¾Ð³Ñ–Ñ—?\n   - [x] Ð¡Ð»Ð¾Ð²Ð¾ \"Ð¿Ð¾Ñ‡ÑƒÑ‚Ñ‚Ñ\" Ð¾Ð·Ð½Ð°Ñ‡Ð°Ñ” ÐµÐ¼Ð¾Ñ†Ñ–Ð¹Ð½Ñ– Ð¿ÐµÑ€ÐµÐ¶Ð¸Ð²Ð°Ð½Ð½Ñ Ð° \"Ð²Ñ–Ð´Ñ‡ÑƒÑ‚Ñ‚Ñ\" Ð¾Ð·Ð½Ð°Ñ‡Ð°Ñ” Ñ„Ñ–Ð·Ð¸Ñ‡Ð½Ñ– Ð²Ñ–Ð´Ñ‡ÑƒÑ‚Ñ‚Ñ\n   - [ ] Ð¡Ð»Ð¾Ð²Ð¾ \"Ð¿Ð¾Ñ‡ÑƒÑ‚Ñ‚Ñ\" Ð¾Ð·Ð½Ð°Ñ‡Ð°Ñ” Ñ„Ñ–Ð·Ð¸Ñ‡Ð½Ñ– Ð²Ñ–Ð´Ñ‡ÑƒÑ‚Ñ‚Ñ Ð° \"Ð²Ñ–Ð´Ñ‡ÑƒÑ‚Ñ‚Ñ\" Ð¾Ð·Ð½Ð°Ñ‡Ð°Ñ” ÐµÐ¼Ð¾Ñ†Ñ–Ð¹Ð½Ñ– Ð¿ÐµÑ€ÐµÐ¶Ð¸Ð²Ð°Ð½Ð½Ñ\n   - [ ] Ð¦Ñ– Ð´Ð²Ð° ÑÐ»Ð¾Ð²Ð° Ñ” Ð¿Ð¾Ð²Ð½Ð¸Ð¼Ð¸ ÑÐ¸Ð½Ð¾Ð½Ñ–Ð¼Ð°Ð¼Ð¸ Ñ– Ð¾Ð·Ð½Ð°Ñ‡Ð°ÑŽÑ‚ÑŒ Ð°Ð±ÑÐ¾Ð»ÑŽÑ‚Ð½Ð¾ Ð¾Ð´Ð½Ðµ Ð¹ Ñ‚Ðµ ÑÐ°Ð¼Ðµ\n   - [ ] Ð¡Ð»Ð¾Ð²Ð¾ \"Ð¿Ð¾Ñ‡ÑƒÑ‚Ñ‚Ñ\" Ð¾Ð·Ð½Ð°Ñ‡Ð°Ñ” ÑÐ»ÑƒÑ…Ð°Ð½Ð½Ñ Ð° \"Ð²Ñ–Ð´Ñ‡ÑƒÑ‚Ñ‚Ñ\" Ð¾Ð·Ð½Ð°Ñ‡Ð°Ñ” Ð±Ð°Ñ‡ÐµÐ½Ð½Ñ\n\n## cloze: Story Comprehension\n\n> Complete based on the stories.\n\nÐ¢Ð°Ñ€Ð°Ñ [___:1] Ð´Ð¸Ð²Ð½Ñƒ Ñ€Ñ–Ñ‡. (saw)\nÐ’Ñ–Ð½ [___:2] Ð´Ð¸Ð²Ð½Ð¸Ð¹ Ð·Ð²ÑƒÐº. (heard)\nÐŸÑ‚Ð°ÑˆÐºÐ° [___:3] ÐºÐ¾Ð»Ð¸ Ð²Ñ–Ð½ Ð´Ð¸Ð²Ð¸Ð²ÑÑ. (was silent)\nÐŸÑ€Ð¾Ñ„ÐµÑÐ¾Ñ€ [___:4] Ð¿Ñ€Ð¾ Ð¼Ð¾Ð²Ñƒ. (speaks)\nÐ¡Ñ‚ÑƒÐ´ÐµÐ½Ñ‚Ð¸ ÑƒÐ²Ð°Ð¶Ð½Ð¾ [___:5]. (listen)\nÐœÐ°Ñ€Ñ–Ñ Ñ– ÑÑ‚ÑƒÐ´ÐµÐ½Ñ‚ Ð´Ð¾Ð¼Ð¾Ð²Ð¸Ð»Ð¸ÑÑŒ Ð¿Ñ€Ð¾ [___:6]. (meeting)\nÐ£ Ð¢Ð°Ñ€Ð°ÑÐ° Ð±ÑƒÐ»Ð¾ [___:7] ÑÐ¿Ð¾ÐºÐ¾ÑŽ. (feeling)\nÐžÐºÑÐ°Ð½Ð° Ð·Ñ€Ð¾Ð·ÑƒÐ¼Ñ–Ð»Ð° [___:8] ÑÐ²Ð¾Ð³Ð¾ Ð´Ñ€ÑƒÐ³Ð°. (vision)\nÐ’Ð¾Ð½Ð¸ Ð¿Ñ€Ð¾Ð´Ð¾Ð²Ð¶Ð¸Ð»Ð¸ [___:9] Ð¿Ñ€Ð¾ Ð¿Ñ€Ð¸Ñ€Ð¾Ð´Ñƒ. (conversation)\nÐ¡Ñ‚ÑƒÐ´ÐµÐ½Ñ‚ Ð¼Ð°Ð² Ð³Ð»Ð¸Ð±Ð¾ÐºÑ– [___:10] Ð¿Ñ€Ð¾ Ñ‚ÐµÐ¼Ñƒ. (feelings)\nÐœÐ°Ñ€Ñ–Ñ Ð·Ð°Ð¿Ð¸ÑÑƒÑ” Ð²Ð°Ð¶Ð»Ð¸Ð²Ñƒ [___:11]. (information)\nÐ’Ð¾Ð½Ð¸ Ð»ÑŽÐ±Ð»ÑÑ‚ÑŒ [___:12] Ñ‚Ð¸ÑˆÑƒ Ð² Ð»Ñ–ÑÑ–. (to listen to)\n\n1. Ð±Ð°Ñ‡Ð¸Ð² | Ñ‡ÑƒÐ² | ÑÐ»ÑƒÑ…Ð°Ð²\n   > [!answer] Ð±Ð°Ñ‡Ð¸Ð²\n\n2. Ð¿Ð¾Ñ‡ÑƒÐ² | Ð±Ð°Ñ‡Ð¸Ð² | ÑÐ»ÑƒÑ…Ð°Ð²\n   > [!answer] Ð¿Ð¾Ñ‡ÑƒÐ²\n\n3. Ð¼Ð¾Ð²Ñ‡Ð°Ð»Ð° | Ð³Ð¾Ð²Ð¾Ñ€Ð¸Ð»Ð° | ÑÐ»ÑƒÑ…Ð°Ð»Ð°\n   > [!answer] Ð¼Ð¾Ð²Ñ‡Ð°Ð»Ð°\n\n4. Ð³Ð¾Ð²Ð¾Ñ€Ð¸Ñ‚ÑŒ | ÑÐ»ÑƒÑ…Ð°Ñ” | Ð¼Ð¾Ð²Ñ‡Ð¸Ñ‚ÑŒ\n   > [!answer] Ð³Ð¾Ð²Ð¾Ñ€Ð¸Ñ‚ÑŒ\n\n5. ÑÐ»ÑƒÑ…Ð°ÑŽÑ‚ÑŒ | Ð³Ð¾Ð²Ð¾Ñ€ÑÑ‚ÑŒ | Ð¼Ð¾Ð²Ñ‡Ð°Ñ‚ÑŒ\n   > [!answer] ÑÐ»ÑƒÑ…Ð°ÑŽÑ‚ÑŒ\n\n6. Ð¿Ð¾Ð±Ð°Ñ‡ÐµÐ½Ð½Ñ | Ñ€Ð¾Ð·Ð¼Ð¾Ð²Ñƒ | Ð¼Ð¾Ð²Ñ‡Ð°Ð½Ð½Ñ\n   > [!answer] Ð¿Ð¾Ð±Ð°Ñ‡ÐµÐ½Ð½Ñ\n\n7. Ð¿Ð¾Ñ‡ÑƒÑ‚Ñ‚Ñ | Ð²Ñ–Ð´Ñ‡ÑƒÑ‚Ñ‚Ñ | Ð±Ð°Ñ‡ÐµÐ½Ð½Ñ\n   > [!answer] Ð¿Ð¾Ñ‡ÑƒÑ‚Ñ‚Ñ\n\n8. Ð±Ð°Ñ‡ÐµÐ½Ð½Ñ | Ð¿Ð¾Ð±Ð°Ñ‡ÐµÐ½Ð½Ñ | Ð´ÑƒÐ¼ÐºÑƒ\n   > [!answer] Ð±Ð°Ñ‡ÐµÐ½Ð½Ñ\n\n9. Ñ€Ð¾Ð·Ð¼Ð¾Ð²Ñƒ | Ð¼Ð¾Ð²Ñƒ | Ð¼Ð¾Ð²Ñ‡Ð°Ð½Ð½Ñ\n   > [!answer] Ñ€Ð¾Ð·Ð¼Ð¾Ð²Ñƒ\n\n10. Ð¿Ð¾Ñ‡ÑƒÑ‚Ñ‚Ñ | Ð²Ñ–Ð´Ñ‡ÑƒÑ‚Ñ‚Ñ | Ð´ÑƒÐ¼ÐºÐ¸\n   > [!answer] Ð¿Ð¾Ñ‡ÑƒÑ‚Ñ‚Ñ\n\n11. Ñ–Ð½Ñ„Ð¾Ñ€Ð¼Ð°Ñ†Ñ–ÑŽ | Ñ€Ð¾Ð·Ð¼Ð¾Ð²Ñƒ | Ð¼Ð¾Ð²Ñƒ\n   > [!answer] Ñ–Ð½Ñ„Ð¾Ñ€Ð¼Ð°Ñ†Ñ–ÑŽ\n\n12. ÑÐ»ÑƒÑ…Ð°Ñ‚Ð¸ | Ñ‡ÑƒÑ‚Ð¸ | Ð±Ð°Ñ‡Ð¸Ñ‚Ð¸\n   > [!answer] ÑÐ»ÑƒÑ…Ð°Ñ‚Ð¸\n\n## unjumble: Perception Sentences\n\n1. Ñ / Ð·Ð°Ñ€Ð°Ð· / Ð±Ð°Ñ‡Ñƒ / Ñ‚ÐµÐ±Ðµ / Ð´ÑƒÐ¶Ðµ / Ñ‡Ñ–Ñ‚ÐºÐ¾ / Ð¿ÐµÑ€ÐµÐ´ / ÑÐ¾Ð±Ð¾ÑŽ\n   > [!answer] Ð¯ Ð·Ð°Ñ€Ð°Ð· Ð±Ð°Ñ‡Ñƒ Ñ‚ÐµÐ±Ðµ Ð´ÑƒÐ¶Ðµ Ñ‡Ñ–Ñ‚ÐºÐ¾ Ð¿ÐµÑ€ÐµÐ´ ÑÐ¾Ð±Ð¾ÑŽ\n2. Ñ / Ñ‡ÑƒÑŽ / ÐºÑ€Ð°ÑÐ¸Ð²Ñƒ / Ð¼ÑƒÐ·Ð¸ÐºÑƒ / Ð·Ð´Ð°Ð»ÐµÐºÑƒ / Ð½Ð° / Ð²ÑƒÐ»Ð¸Ñ†Ñ– / Ð·Ð°Ñ€Ð°Ð·\n   > [!answer] Ð¯ Ñ‡ÑƒÑŽ ÐºÑ€Ð°ÑÐ¸Ð²Ñƒ Ð¼ÑƒÐ·Ð¸ÐºÑƒ Ð·Ð´Ð°Ð»ÐµÐºÑƒ Ð½Ð° Ð²ÑƒÐ»Ð¸Ñ†Ñ– Ð·Ð°Ñ€Ð°Ð·\n3. Ð±ÑƒÐ´ÑŒ / Ð»Ð°ÑÐºÐ° / ÑÐ»ÑƒÑ…Ð°Ð¹ / Ð¼ÐµÐ½Ðµ / Ð´ÑƒÐ¶Ðµ / ÑƒÐ²Ð°Ð¶Ð½Ð¾ / Ð·Ð°Ñ€Ð°Ð· / Ñ‚ÑƒÑ‚\n   > [!answer] Ð‘ÑƒÐ´ÑŒ Ð»Ð°ÑÐºÐ° ÑÐ»ÑƒÑ…Ð°Ð¹ Ð¼ÐµÐ½Ðµ Ð´ÑƒÐ¶Ðµ ÑƒÐ²Ð°Ð¶Ð½Ð¾ Ð·Ð°Ñ€Ð°Ð· Ñ‚ÑƒÑ‚\n4. Ñ†Ðµ / ÑÐ¿Ñ€Ð°Ð²Ð´Ñ– / Ð´ÑƒÐ¶Ðµ / Ð³Ð°Ñ€Ð½Ðµ / Ñ‡Ñ–Ñ‚ÐºÐµ / Ð¼Ð¾Ð²Ð»ÐµÐ½Ð½Ñ / Ð²Ñ–Ð´ / Ð¿Ñ€Ð¾Ñ„ÐµÑÐ¾Ñ€Ð°\n   > [!answer] Ð¦Ðµ ÑÐ¿Ñ€Ð°Ð²Ð´Ñ– Ð´ÑƒÐ¶Ðµ Ð³Ð°Ñ€Ð½Ðµ Ñ‡Ñ–Ñ‚ÐºÐµ Ð¼Ð¾Ð²Ð»ÐµÐ½Ð½Ñ Ð²Ñ–Ð´ Ð¿Ñ€Ð¾Ñ„ÐµÑÐ¾Ñ€Ð°\n5. Ñ†Ðµ / Ð±ÑƒÐ»Ð° / Ð´ÑƒÐ¶Ðµ / Ñ†Ñ–ÐºÐ°Ð²Ð° / Ð´Ð¾Ð²Ð³Ð° / Ñ€Ð¾Ð·Ð¼Ð¾Ð²Ð° / Ð¼Ñ–Ð¶ / Ð´Ñ€ÑƒÐ·ÑÐ¼Ð¸ / Ð²Ñ‡Ð¾Ñ€Ð°\n   > [!answer] Ð¦Ðµ Ð±ÑƒÐ»Ð° Ð´ÑƒÐ¶Ðµ Ñ†Ñ–ÐºÐ°Ð²Ð° Ð´Ð¾Ð²Ð³Ð° Ñ€Ð¾Ð·Ð¼Ð¾Ð²Ð° Ð¼Ñ–Ð¶ Ð´Ñ€ÑƒÐ·ÑÐ¼Ð¸ Ð²Ñ‡Ð¾Ñ€Ð°\n6. Ð²Ñ–Ð½ / Ð¼Ð¾Ð²Ñ‡Ð¸Ñ‚ÑŒ / ÑƒÐ²ÐµÑÑŒ / Ñ‡Ð°Ñ / Ð¿Ñ–Ð´ / Ñ‡Ð°Ñ / Ð»ÐµÐºÑ†Ñ–Ñ— / ÑÑŒÐ¾Ð³Ð¾Ð´Ð½Ñ–\n   > [!answer] Ð’Ñ–Ð½ Ð¼Ð¾Ð²Ñ‡Ð¸Ñ‚ÑŒ ÑƒÐ²ÐµÑÑŒ Ñ‡Ð°Ñ Ð¿Ñ–Ð´ Ñ‡Ð°Ñ Ð»ÐµÐºÑ†Ñ–Ñ— ÑÑŒÐ¾Ð³Ð¾Ð´Ð½Ñ–\n7. Ñ†Ðµ / ÑÐ¿Ñ€Ð°Ð²Ð´Ñ– / Ð´ÑƒÐ¶Ðµ / Ð³Ð»Ð¸Ð±Ð¾ÐºÑ– / ÑÐ¸Ð»ÑŒÐ½Ñ– / Ð¿Ð¾Ñ‡ÑƒÑ‚Ñ‚Ñ / Ð´Ð¾ / Ð½ÐµÑ—\n   > [!answer] Ð¦Ðµ ÑÐ¿Ñ€Ð°Ð²Ð´Ñ– Ð´ÑƒÐ¶Ðµ Ð³Ð»Ð¸Ð±Ð¾ÐºÑ– ÑÐ¸Ð»ÑŒÐ½Ñ– Ð¿Ð¾Ñ‡ÑƒÑ‚Ñ‚Ñ Ð´Ð¾ Ð½ÐµÑ—\n8. Ð²Ð¾Ð½Ð¸ / Ð·Ð°Ð²Ð¶Ð´Ð¸ / Ð´ÑƒÐ¶Ðµ / ÑƒÐ²Ð°Ð¶Ð½Ñ– / Ð´Ð¾Ð±Ñ€Ñ– / ÑÐ»ÑƒÑ…Ð°Ñ‡Ñ– / Ð½Ð° / Ð»ÐµÐºÑ†Ñ–ÑÑ…\n   > [!answer] Ð’Ð¾Ð½Ð¸ Ð·Ð°Ð²Ð¶Ð´Ð¸ Ð´ÑƒÐ¶Ðµ ÑƒÐ²Ð°Ð¶Ð½Ñ– Ð´Ð¾Ð±Ñ€Ñ– ÑÐ»ÑƒÑ…Ð°Ñ‡Ñ– Ð½Ð° Ð»ÐµÐºÑ†Ñ–ÑÑ…\n\n\n## error-correction: Root Usage\n\n1. Ð¯ **ÑÐ»ÑƒÑ…Ð°ÑŽ** ÑˆÑƒÐ¼ Ð¼Ð°ÑˆÐ¸Ð½ Ð½Ð° Ð²ÑƒÐ»Ð¸Ñ†Ñ–. (passive hearing)\n   > [!error] ÑÐ»ÑƒÑ…Ð°ÑŽ\n   > [!answer] Ñ‡ÑƒÑŽ\n   > [!explanation] Passive hearing = Ñ‡ÑƒÑ‚Ð¸, active listening = ÑÐ»ÑƒÑ…Ð°Ñ‚Ð¸.\n   > [!options] Ñ‡ÑƒÑŽ | ÑÐ»ÑƒÑ…Ð°ÑŽ\n\n2. Ð’Ñ–Ð½ Ð²Ñ‡Ð¸Ñ‚ÑŒ ÑƒÐºÑ€Ð°Ñ—Ð½ÑÑŒÐºÐµ **Ð¼Ð¾Ð²Ð»ÐµÐ½Ð½Ñ**. (the language system)\n   > [!error] Ð¼Ð¾Ð²Ð»ÐµÐ½Ð½Ñ\n   > [!answer] Ð¼Ð¾Ð²Ñƒ\n   > [!explanation] Language system = Ð¼Ð¾Ð²Ð°, speech act = Ð¼Ð¾Ð²Ð»ÐµÐ½Ð½Ñ.\n   > [!options] Ð¼Ð¾Ð²Ñƒ | Ð¼Ð¾Ð²Ð»ÐµÐ½Ð½Ñ\n\n3. Ð’Ð¾Ð½Ð° Ð¼Ð°Ñ” Ð´Ð¸Ð²Ð½Ðµ **Ð¿Ð¾Ñ‡ÑƒÑ‚Ñ‚Ñ** Ñƒ Ð¿Ð°Ð»ÑŒÑ†ÑÑ…. (physical)\n   > [!error] Ð¿Ð¾Ñ‡ÑƒÑ‚Ñ‚Ñ\n   > [!answer] Ð²Ñ–Ð´Ñ‡ÑƒÑ‚Ñ‚Ñ\n   > [!explanation] Physical sensation = Ð²Ñ–Ð´Ñ‡ÑƒÑ‚Ñ‚Ñ, emotion = Ð¿Ð¾Ñ‡ÑƒÑ‚Ñ‚Ñ.\n   > [!options] Ð²Ñ–Ð´Ñ‡ÑƒÑ‚Ñ‚Ñ | Ð¿Ð¾Ñ‡ÑƒÑ‚Ñ‚Ñ\n\n4. **Ð§ÑƒÐ¹** ÑƒÐ²Ð°Ð¶Ð½Ð¾, Ñ‰Ð¾ Ñ ÐºÐ°Ð¶Ñƒ! (active listening)\n   > [!error] Ð§ÑƒÐ¹\n   > [!answer] Ð¡Ð»ÑƒÑ…Ð°Ð¹\n   > [!explanation] Command to listen actively = ÑÐ»ÑƒÑ…Ð°Ð¹.\n   > [!options] Ð¡Ð»ÑƒÑ…Ð°Ð¹ | Ð§ÑƒÐ¹\n\n5. Ð¦Ðµ Ð¼Ð¾Ñ” Ñ…ÑƒÐ´Ð¾Ð¶Ð½Ñ” **Ð¿Ð¾Ð±Ð°Ñ‡ÐµÐ½Ð½Ñ** ÑÐ²Ñ–Ñ‚Ñƒ. (vision/perspective)\n   > [!error] Ð¿Ð¾Ð±Ð°Ñ‡ÐµÐ½Ð½Ñ\n   > [!answer] Ð±Ð°Ñ‡ÐµÐ½Ð½Ñ\n   > [!explanation] Vision/perspective = Ð±Ð°Ñ‡ÐµÐ½Ð½Ñ, meeting = Ð¿Ð¾Ð±Ð°Ñ‡ÐµÐ½Ð½Ñ.\n   > [!options] Ð±Ð°Ñ‡ÐµÐ½Ð½Ñ | Ð¿Ð¾Ð±Ð°Ñ‡ÐµÐ½Ð½Ñ\n\n6. Ð’Ð¾Ð½Ð¸ Ð¼Ð°ÑŽÑ‚ÑŒ **Ð±Ð°Ñ‡ÐµÐ½Ð½Ñ** Ð¾ Ñ‚Ñ€ÐµÑ‚Ñ–Ð¹ Ð³Ð¾Ð´Ð¸Ð½Ñ–. (meeting)\n   > [!error] Ð±Ð°Ñ‡ÐµÐ½Ð½Ñ\n   > [!answer] Ð¿Ð¾Ð±Ð°Ñ‡ÐµÐ½Ð½Ñ\n   > [!explanation] Meeting/date = Ð¿Ð¾Ð±Ð°Ñ‡ÐµÐ½Ð½Ñ, vision = Ð±Ð°Ñ‡ÐµÐ½Ð½Ñ.\n   > [!options] Ð¿Ð¾Ð±Ð°Ñ‡ÐµÐ½Ð½Ñ | Ð±Ð°Ñ‡ÐµÐ½Ð½Ñ\n\n## group-sort: Root Families\n\n> Sort words by root family.\n\n### Ð±Ð°Ñ‡- (see)\n- Ð±Ð°Ñ‡Ð¸Ñ‚Ð¸\n- Ð±Ð°Ñ‡ÐµÐ½Ð½Ñ\n- Ð¿Ð¾Ð±Ð°Ñ‡ÐµÐ½Ð½Ñ\n- Ð¿ÐµÑ€ÐµÐ´Ð±Ð°Ñ‡ÐµÐ½Ð½Ñ\n\n### ÑÐ»ÑƒÑ…-/Ñ‡ÑƒÑ‚- (hear/feel)\n- ÑÐ»ÑƒÑ…Ð°Ñ‚Ð¸\n- ÑÐ»ÑƒÑ…\n- ÑÐ»ÑƒÑ…Ð°Ñ‡\n- Ñ‡ÑƒÑ‚Ð¸\n- Ð¿Ð¾Ñ‡ÑƒÑ‚Ñ‚Ñ\n- Ð²Ñ–Ð´Ñ‡ÑƒÑ‚Ñ‚Ñ\n\n### Ð³Ð¾Ð²Ð¾Ñ€-/Ð¼Ð¾Ð²- (speak)\n- Ð³Ð¾Ð²Ð¾Ñ€Ð¸Ñ‚Ð¸\n- Ñ€Ð¾Ð·Ð¼Ð¾Ð²Ð°\n- Ð¼Ð¾Ð²Ð°\n- Ð¼Ð¾Ð²Ð»ÐµÐ½Ð½Ñ\n- Ð¼Ð¾Ð²Ñ‡Ð°Ñ‚Ð¸\n- Ð¼Ð¾Ð²Ñ‡Ð°Ð½Ð½Ñ\n\n## true-false: Root Rules\n\n> Mark true or false.\n\n- [x] \"Ð‘Ð°Ñ‡-\" = seeing/vision.\n- [x] \"Ð¡Ð»ÑƒÑ…-\" = active listening.\n- [ ] \"Ð§ÑƒÑ‚-\" = active listening.\n- [x] \"Ð§ÑƒÑ‚-\" = passive hearing.\n- [x] \"ÐœÐ¾Ð²-\" = speaking/language.\n- [ ] \"ÐœÐ¾Ð²-\" = seeing.\n- [x] \"ÐŸÐ¾Ð±Ð°Ñ‡ÐµÐ½Ð½Ñ\" = meeting/date.\n- [ ] \"ÐŸÐ¾Ð±Ð°Ñ‡ÐµÐ½Ð½Ñ\" = vision.\n- [x] \"ÐœÐ¾Ð²Ñ‡Ð°Ñ‚Ð¸\" = to be silent.\n- [ ] \"ÐœÐ¾Ð²Ñ‡Ð°Ñ‚Ð¸\" = to speak.\n- [x] \"Ð¡Ð»ÑƒÑ…Ð°Ñ‡\" = listener.\n- [ ] \"Ð¡Ð»ÑƒÑ…Ð°Ñ‡\" = speaker.\n\n## translate: English to Ukrainian\n\n1. To see\n   - [x] Ð±Ð°Ñ‡Ð¸Ñ‚Ð¸\n   - [ ] ÑÐ»ÑƒÑ…Ð°Ñ‚Ð¸\n   - [ ] Ñ‡ÑƒÑ‚Ð¸\n\n2. Vision (artistic)\n   - [x] Ð±Ð°Ñ‡ÐµÐ½Ð½Ñ\n   - [ ] Ð¿Ð¾Ð±Ð°Ñ‡ÐµÐ½Ð½Ñ\n   - [ ] ÑÐ»ÑƒÑ…\n\n3. Meeting/date\n   - [x] Ð¿Ð¾Ð±Ð°Ñ‡ÐµÐ½Ð½Ñ\n   - [ ] Ð±Ð°Ñ‡ÐµÐ½Ð½Ñ\n   - [ ] Ñ€Ð¾Ð·Ð¼Ð¾Ð²Ð°\n\n4. To listen\n   - [x] ÑÐ»ÑƒÑ…Ð°Ñ‚Ð¸\n   - [ ] Ñ‡ÑƒÑ‚Ð¸\n   - [ ] Ð±Ð°Ñ‡Ð¸Ñ‚Ð¸\n\n5. Listener\n   - [x] ÑÐ»ÑƒÑ…Ð°Ñ‡\n   - [ ] Ð¼Ð¾Ð²ÐµÑ†ÑŒ\n   - [ ] Ñ‡Ð¸Ñ‚Ð°Ñ‡\n\n6. To hear\n   - [x] Ñ‡ÑƒÑ‚Ð¸\n   - [ ] ÑÐ»ÑƒÑ…Ð°Ñ‚Ð¸\n   - [ ] Ð±Ð°Ñ‡Ð¸Ñ‚Ð¸\n\n7. Feeling (emotional)\n   - [x] Ð¿Ð¾Ñ‡ÑƒÑ‚Ñ‚Ñ\n   - [ ] Ð²Ñ–Ð´Ñ‡ÑƒÑ‚Ñ‚Ñ\n   - [ ] ÑÐ»ÑƒÑ…\n\n8. Language\n   - [x] Ð¼Ð¾Ð²Ð°\n   - [ ] Ð¼Ð¾Ð²Ð»ÐµÐ½Ð½Ñ\n   - [ ] Ñ€Ð¾Ð·Ð¼Ð¾Ð²Ð°\n\n---\n\n# Vocabulary\n\n| Word | IPA | English | POS | Gender | Note |\n|------|-----|---------|-----|--------|------|\n| ÑÐ»ÑƒÑ… | /slux/ | hearing | noun | m | sense |\n| Ð¿Ð¾ÑÐ»ÑƒÑ… | /ËˆpÉ”slux/ | obedience | noun | m | abstract |\n| Ð¿Ð¾Ñ‡ÑƒÑ‚Ñ‚Ñ | /pÉ”ËˆtÍ¡ÊƒutÊ²É‘/ | feeling | noun | n | emotion |\n| Ð²Ñ–Ð´Ñ‡ÑƒÑ‚Ñ‚Ñ | /Ê‹idËˆtÍ¡ÊƒutÊ²É‘/ | sensation | noun | n | perception |\n| Ñ€Ð¾Ð·Ð¼Ð¾Ð²Ð° | /rÉ”zËˆmÉ”Ê‹É‘/ | conversation | noun | f | event |\n| Ð¼Ð¾Ð²Ð»ÐµÐ½Ð½Ñ | /ËˆmÉ”Ê‹lÉ›nÊ²É‘/ | speech | noun | n | activity |\n| Ð¼Ð¾Ð²ÐµÑ†ÑŒ | /mÉ”ËˆÊ‹É›tÍ¡sÊ²/ | speaker | noun | m | person |\n| Ð¼Ð¾Ð²Ñ‡Ð°Ñ‚Ð¸ | /mÉ”Ê‹ËˆtÍ¡ÊƒÉ‘tÉª/ | to be silent | verb | â€” | speech |\n| Ð¼Ð¾Ð²Ñ‡Ð°Ð½Ð½Ñ | /mÉ”Ê‹ËˆtÍ¡ÊƒÉ‘nÊ²É‘/ | silence | noun | n | state |\n| Ð¼Ð¾Ð²Ñ‡Ð°Ð·Ð½Ð¸Ð¹ | /mÉ”Ê‹ËˆtÍ¡ÊƒÉ‘znÉªj/ | silent (person) | adj | m | quality |\n| Ñ€Ð¾Ð·Ð´ÑƒÐ¼Ð¸ | /rÉ”zËˆdumÉª/ | reflections | noun | pl | abstract |\n",
    "createdAt": "2025-12-23T02:19:59.109135Z",
    "modifiedAt": "2025-12-23T02:19:59.109135Z",
    "version": 2
  },
  "activities": [],
  "vocabulary": {
    "moduleId": "mod-uk-A2-41",
    "level": "A2",
    "phase": "A2.4",
    "wordCount": 11,
    "newWordCount": 11,
    "reviewWordCount": 0,
    "transliterationMode": "none",
    "words": [
      {
        "id": "vocab-1",
        "uk": "ÑÐ»ÑƒÑ…",
        "ipa": "/slux/",
        "en": "hearing",
        "pos": "noun",
        "gender": "m",
        "note": "sense"
      },
      {
        "id": "vocab-2",
        "uk": "Ð¿Ð¾ÑÐ»ÑƒÑ…",
        "ipa": "/ËˆpÉ”slux/",
        "en": "obedience",
        "pos": "noun",
        "gender": "m",
        "note": "abstract"
      },
      {
        "id": "vocab-3",
        "uk": "Ð¿Ð¾Ñ‡ÑƒÑ‚Ñ‚Ñ",
        "ipa": "/pÉ”ËˆtÍ¡ÊƒutÊ²É‘/",
        "en": "feeling",
        "pos": "noun",
        "gender": "n",
        "note": "emotion"
      },
      {
        "id": "vocab-4",
        "uk": "Ð²Ñ–Ð´Ñ‡ÑƒÑ‚Ñ‚Ñ",
        "ipa": "/Ê‹idËˆtÍ¡ÊƒutÊ²É‘/",
        "en": "sensation",
        "pos": "noun",
        "gender": "n",
        "note": "perception"
      },
      {
        "id": "vocab-5",
        "uk": "Ñ€Ð¾Ð·Ð¼Ð¾Ð²Ð°",
        "ipa": "/rÉ”zËˆmÉ”Ê‹É‘/",
        "en": "conversation",
        "pos": "noun",
        "gender": "f",
        "note": "event"
      },
      {
        "id": "vocab-6",
        "uk": "Ð¼Ð¾Ð²Ð»ÐµÐ½Ð½Ñ",
        "ipa": "/ËˆmÉ”Ê‹lÉ›nÊ²É‘/",
        "en": "speech",
        "pos": "noun",
        "gender": "n",
        "note": "activity"
      },
      {
        "id": "vocab-7",
        "uk": "Ð¼Ð¾Ð²ÐµÑ†ÑŒ",
        "ipa": "/mÉ”ËˆÊ‹É›tÍ¡sÊ²/",
        "en": "speaker",
        "pos": "noun",
        "gender": "m",
        "note": "person"
      },
      {
        "id": "vocab-8",
        "uk": "Ð¼Ð¾Ð²Ñ‡Ð°Ñ‚Ð¸",
        "ipa": "/mÉ”Ê‹ËˆtÍ¡ÊƒÉ‘tÉª/",
        "en": "to be silent",
        "pos": "verb",
        "gender": null,
        "note": "speech"
      },
      {
        "id": "vocab-9",
        "uk": "Ð¼Ð¾Ð²Ñ‡Ð°Ð½Ð½Ñ",
        "ipa": "/mÉ”Ê‹ËˆtÍ¡ÊƒÉ‘nÊ²É‘/",
        "en": "silence",
        "pos": "noun",
        "gender": "n",
        "note": "state"
      },
      {
        "id": "vocab-10",
        "uk": "Ð¼Ð¾Ð²Ñ‡Ð°Ð·Ð½Ð¸Ð¹",
        "ipa": "/mÉ”Ê‹ËˆtÍ¡ÊƒÉ‘znÉªj/",
        "en": "silent (person)",
        "pos": "adj",
        "gender": "m",
        "note": "quality"
      },
      {
        "id": "vocab-11",
        "uk": "Ñ€Ð¾Ð·Ð´ÑƒÐ¼Ð¸",
        "ipa": "/rÉ”zËˆdumÉª/",
        "en": "reflections",
        "pos": "noun",
        "gender": null,
        "note": "abstract"
      }
    ],
    "reviewWords": []
  }
}