{
  "$schema": "../../../schemas/vibe-module.schema.json",
  "lesson": {
    "id": "lesson-uk-A2-06",
    "moduleId": "mod-uk-A2-06",
    "languagePair": "l2-uk-en",
    "subject": "language",
    "owner": "curricula-opus",
    "visibility": "public",
    "language": "uk",
    "targetLevel": "A2",
    "phase": "A2.1",
    "moduleNumber": 6,
    "moduleType": "grammar",
    "pedagogy": "PPP",
    "immersionLevel": 0.4,
    "title": "Being and Becoming",
    "titleUk": null,
    "subtitle": "Professions and States with Instrumental",
    "description": "Learner can use instrumental to express profession with –±—É—Ç–∏",
    "objectives": [
      "Learner can use instrumental to express profession with –±—É—Ç–∏",
      "Learner can use instrumental to describe becoming something with —Å—Ç–∞—Ç–∏",
      "Learner can use instrumental to express working as with –ø—Ä–∞—Ü—é–≤–∞—Ç–∏",
      "Learner can distinguish present (no copula) from past/future (–±—É—Ç–∏ + Instr)"
    ],
    "objectivesUk": null,
    "grammarFocus": [
      "instrumental with –±—É—Ç–∏",
      "instrumental with —Å—Ç–∞—Ç–∏",
      "instrumental with –ø—Ä–∞—Ü—é–≤–∞—Ç–∏"
    ],
    "tags": [
      "grammar",
      "cases",
      "instrumental",
      "professions",
      "–±—É—Ç–∏",
      "—Å—Ç–∞—Ç–∏"
    ],
    "totalDuration": "60 min",
    "transliterationMode": "none",
    "sections": [
      {
        "id": "section-1",
        "name": "Warm-up",
        "nameEn": null,
        "type": "content",
        "content": "In previous modules, you learned about the instrumental case: with the preposition **–∑** for accompaniment and without a preposition for transport and tools. Now it's time to discover another important use of the instrumental case ‚Äî with the verbs **–±—É—Ç–∏** (to be), **—Å—Ç–∞—Ç–∏** (to become), and **–ø—Ä–∞—Ü—é–≤–∞—Ç–∏** (to work as)!\n\nWhen you want to say \"He is a doctor,\" \"She became a teacher,\" or \"I work as a programmer,\" Ukrainian uses the instrumental case. This is one of the most practical uses of the instrumental ‚Äî talking about what people are and what they do!\n\n**Why is this important?** Talking about professions is a fundamental skill in any language. By the end of this module, you'll be able to describe your job, discuss career changes, and ask others about their work ‚Äî all using proper Ukrainian grammar.\n\n> [!resources] üîó External Resources\n>\n> **YouTube:** [Bandura: The traditional Ukrainian instrument that's also a symbol of ...](https://www.youtube.com/watch?v=AcrRlIR9_Ew) ‚Äî Instrumental\n>\n> **Grammar Guide:** [Ukrainian Cases Overview](https://www.ukrainianlessons.com/intro-cases/) ‚Äî All 7 cases explained\n>\n> **Interactive:** [Talk Ukrainian - Cases](https://talkukrainian.com/grammatical-cases/) ‚Äî Practice exercises\n\n---"
      },
      {
        "id": "section-2",
        "name": "Presentation",
        "nameEn": null,
        "type": "content",
        "content": "## –ë—É—Ç–∏ + Instrumental: Being Something\n\nIn Ukrainian, the present tense of \"to be\" is usually zero ‚Äî we don't use a verb: –í—ñ–Ω –ª—ñ–∫–∞—Ä. (He is a doctor.) But in the **past** and **future** tenses, we use **–±—É—Ç–∏** + **Instrumental**:\n\n| Tense | Pattern | Example |\n|-------|---------|---------|\n| Present | –í—ñ–Ω –ª—ñ–∫–∞—Ä. | He is a doctor. (no verb, nominative) |\n| Past | –í—ñ–Ω **–±—É–≤ –ª—ñ–∫–∞—Ä–µ–º**. | He was a doctor. (–±—É—Ç–∏ + instrumental) |\n| Future | –í—ñ–Ω **–±—É–¥–µ –ª—ñ–∫–∞—Ä–µ–º**. | He will be a doctor. (–±—É—Ç–∏ + instrumental) |\n\n### Past Tense: –±—É–≤/–±—É–ª–∞/–±—É–ª–æ/–±—É–ª–∏ + Instrumental\n\nWhen talking about what someone WAS in the past, you use the past tense of \"–±—É—Ç–∏\" followed by the instrumental case. The past tense agrees in gender with the subject: **–≤—ñ–Ω –±—É–≤** (masculine), **–≤–æ–Ω–∞ –±—É–ª–∞** (feminine), **–≤–æ–Ω–æ –±—É–ª–æ** (neuter), **–≤–æ–Ω–∏ –±—É–ª–∏** (plural).\n\n–í—ñ–Ω –±—É–≤ —Å—Ç—É–¥–µ–Ω—Ç–æ–º. (He was a student.)\n–í–æ–Ω–∞ –±—É–ª–∞ –≤—á–∏—Ç–µ–ª—å–∫–æ—é. (She was a teacher.)\n–ú–∏ –±—É–ª–∏ –¥—Ä—É–∑—è–º–∏. (We were friends.)\n\nNotice how the profession changes to instrumental: —Å—Ç—É–¥–µ–Ω—Ç ‚Üí —Å—Ç—É–¥–µ–Ω—Ç–æ–º, –≤—á–∏—Ç–µ–ª—å–∫–∞ ‚Üí –≤—á–∏—Ç–µ–ª—å–∫–æ—é.\n\n### Future Tense: –±—É–¥–µ/–±—É–¥—É—Ç—å + Instrumental\n\nFor the future tense, use **–±—É–¥–µ** for singular subjects or **–±—É–¥—É—Ç—å** for plural subjects, followed by the instrumental case. This is how you express what someone WILL BE:\n\n–í—ñ–Ω –±—É–¥–µ –ª—ñ–∫–∞—Ä–µ–º. (He will be a doctor.)\n–í–æ–Ω–∞ –±—É–¥–µ –∂—É—Ä–Ω–∞–ª—ñ—Å—Ç–∫–æ—é. (She will be a journalist.)\n–í–æ–Ω–∏ –±—É–¥—É—Ç—å —ñ–Ω–∂–µ–Ω–µ—Ä–∞–º–∏. (They will be engineers.)\n\nThe pattern is consistent: –±—É—Ç–∏ in past or future + noun in instrumental case.\n\n> üí° **Did You Know?**\n>\n> The present tense \"zero copula\" (no verb \"to be\") is a distinctive feature of Ukrainian and many Slavic languages. Russians use \"—ç—Ç–æ\" for \"this is,\" but Ukrainians simply say \"–¶–µ.\" When Ukrainians speak English, they sometimes forget \"is\" because their brain doesn't expect a copula in present tense!\n\n## –°—Ç–∞—Ç–∏ + Instrumental: Becoming Something\n\nThe verb **—Å—Ç–∞—Ç–∏** (to become) is one of the most important verbs in Ukrainian for talking about changes in profession or state. Unlike –±—É—Ç–∏, which uses instrumental only in past and future, —Å—Ç–∞—Ç–∏ ALWAYS takes the instrumental case, in all tenses:\n\n–í–æ–Ω–∞ —Å—Ç–∞–ª–∞ –≤—á–∏—Ç–µ–ª—å–∫–æ—é. (She became a teacher.)\n–í—ñ–Ω —Å—Ç–∞–≤ –ª—ñ–∫–∞—Ä–µ–º. (He became a doctor.)\n–ú–∏ —Å—Ç–∞–ª–∏ –¥—Ä—É–∑—è–º–∏. (We became friends.)\n\nThis verb is perfective (completed action), so it's typically used in past and future. The imperfective counterpart is —Å—Ç–∞–≤–∞—Ç–∏ (to be becoming).\n\n### Conjugation of —Å—Ç–∞—Ç–∏ (perfective, past + future)\n\n| Past | Future |\n|------|--------|\n| —è —Å—Ç–∞–≤ / —Å—Ç–∞–ª–∞ | —è —Å—Ç–∞–Ω—É |\n| —Ç–∏ —Å—Ç–∞–≤ / —Å—Ç–∞–ª–∞ | —Ç–∏ —Å—Ç–∞–Ω–µ—à |\n| –≤—ñ–Ω —Å—Ç–∞–≤ | –≤—ñ–Ω —Å—Ç–∞–Ω–µ |\n| –≤–æ–Ω–∞ —Å—Ç–∞–ª–∞ | –≤–æ–Ω–∞ —Å—Ç–∞–Ω–µ |\n| –º–∏ —Å—Ç–∞–ª–∏ | –º–∏ —Å—Ç–∞–Ω–µ–º–æ |\n| –≤–∏ —Å—Ç–∞–ª–∏ | –≤–∏ —Å—Ç–∞–Ω–µ—Ç–µ |\n| –≤–æ–Ω–∏ —Å—Ç–∞–ª–∏ | –≤–æ–Ω–∏ —Å—Ç–∞–Ω—É—Ç—å |\n\n–í–æ–Ω–∞ —Ö–æ—á–µ —Å—Ç–∞—Ç–∏ –ª—ñ–∫–∞—Ä–∫–æ—é. (She wants to become a doctor.)\n–í—ñ–Ω –º—Ä—ñ—î —Å—Ç–∞—Ç–∏ –ø–∏—Å—å–º–µ–Ω–Ω–∏–∫–æ–º. (He dreams of becoming a writer.)\n–ö–æ–ª–∏ —Ç–∏ —Å—Ç–∞–Ω–µ—à —ñ–Ω–∂–µ–Ω–µ—Ä–æ–º? (When will you become an engineer?)\n\n> üìú **History Bite**\n>\n> Many famous Ukrainians changed professions dramatically: –¢–∞—Ä–∞—Å –®–µ–≤—á–µ–Ω–∫–æ **–±—É–≤ –∫—Ä—ñ–ø–∞–∫–æ–º** (was a serf), –∞–ª–µ **—Å—Ç–∞–≤ –≤–µ–ª–∏–∫–∏–º –ø–æ–µ—Ç–æ–º** (became a great poet). –õ–µ—Å—è –£–∫—Ä–∞—ó–Ω–∫–∞ —Ö–æ—Ç—ñ–ª–∞ —Å—Ç–∞—Ç–∏ –º—É–∑–∏–∫–æ—é, –∞–ª–µ —Å—Ç–∞–ª–∞ –≥–µ–Ω—ñ–∞–ª—å–Ω–æ—é –ø–∏—Å—å–º–µ–Ω–Ω–∏—Ü–µ—é. Their stories of becoming are told in the instrumental case!\n\n## –ü—Ä–∞—Ü—é–≤–∞—Ç–∏ + Instrumental: Working As\n\nThe verb **–ø—Ä–∞—Ü—é–≤–∞—Ç–∏** (to work) is used with the instrumental case to express what profession someone works as. This is different from English, where we use \"as\" + profession. In Ukrainian, no preposition is needed ‚Äî just put the profession in instrumental:\n\n–Ø –ø—Ä–∞—Ü—é—é –ø—Ä–æ–≥—Ä–∞–º—ñ—Å—Ç–æ–º. (I work as a programmer.)\n–í–æ–Ω–∞ –ø—Ä–∞—Ü—é—î –∂—É—Ä–Ω–∞–ª—ñ—Å—Ç–∫–æ—é. (She works as a journalist.)\n–í—ñ–Ω –ø—Ä–∞—Ü—é—î –≤–æ–¥—ñ—î–º. (He works as a driver.)\n\nThe question word for \"as what\" is **–∫–∏–º?** ‚Äî the instrumental form of **—Ö—Ç–æ** (who).\n\nNote that you can also use **–∫–∏–º?** (as whom?) ‚Äî this is the instrumental of **—Ö—Ç–æ**:\n\n‚Äî –ö–∏–º —Ç–∏ –ø—Ä–∞—Ü—é—î—à? (What do you work as?)\n‚Äî –Ø –ø—Ä–∞—Ü—é—é –≤—á–∏—Ç–µ–ª–µ–º. (I work as a teacher.)\n\n### Common Profession Verbs with Instrumental\n\nHere are the most common verbs that take the instrumental case when followed by a profession or role. Learning these patterns will help you talk about careers fluently:\n\n| Verb | Meaning | Example |\n|------|---------|---------|\n| –±—É—Ç–∏ (past/future) | to be | –í—ñ–Ω –±—É–≤ —Å—Ç—É–¥–µ–Ω—Ç–æ–º. |\n| —Å—Ç–∞—Ç–∏ | to become | –í–æ–Ω–∞ —Å—Ç–∞–ª–∞ –ª—ñ–∫–∞—Ä–∫–æ—é. |\n| –ø—Ä–∞—Ü—é–≤–∞—Ç–∏ | to work as | –Ø –ø—Ä–∞—Ü—é—é —ñ–Ω–∂–µ–Ω–µ—Ä–æ–º. |\n| —Å–ª—É–∂–∏—Ç–∏ | to serve as | –í—ñ–Ω —Å–ª—É–∂–∏—Ç—å —Å–æ–ª–¥–∞—Ç–æ–º. |\n| –∑–∞–ª–∏—à–∞—Ç–∏—Å—è | to remain | –í–æ–Ω–∞ –∑–∞–ª–∏—à–∞—î—Ç—å—Å—è –¥–∏—Ä–µ–∫—Ç–æ—Ä–∫–æ—é. |\n\nNote that all these verbs follow the same pattern: verb + profession in instrumental case.\n\n> [!example] –£ –∫–∞—Ñ–µ\n> ‚Äî –ö–∏–º –ø—Ä–∞—Ü—é—î —Ç–≤—ñ–π –±—Ä–∞—Ç?\n> ‚Äî –í—ñ–Ω –ø—Ä–∞—Ü—é—î –ø—Ä–æ–≥—Ä–∞–º—ñ—Å—Ç–æ–º —É –≤–µ–ª–∏–∫—ñ–π –∫–æ–º–ø–∞–Ω—ñ—ó.\n> ‚Äî –ê —Ç–≤–æ—è —Å–µ—Å—Ç—Ä–∞?\n> ‚Äî –í–æ–Ω–∞ –±—É–ª–∞ —Å—Ç—É–¥–µ–Ω—Ç–∫–æ—é, –∞–ª–µ –∑–∞—Ä–∞–∑ —Å—Ç–∞–ª–∞ –∂—É—Ä–Ω–∞–ª—ñ—Å—Ç–∫–æ—é.\n> ‚Äî –ö—Ä—É—Ç–æ! –ê —Ç–∏?\n> ‚Äî –Ø –ø—Ä–∞—Ü—é—é –≤—á–∏—Ç–µ–ª–µ–º. –ú—Ä—ñ—é —Å—Ç–∞—Ç–∏ –¥–∏—Ä–µ–∫—Ç–æ—Ä–æ–º —à–∫–æ–ª–∏!\n\n---"
      },
      {
        "id": "section-3",
        "name": "Cultural Insight",
        "nameEn": null,
        "type": "content",
        "content": "## Ukrainian Professions: Gender Forms\n\nOne of the distinctive features of Ukrainian is that it has separate feminine forms for most professions. While English uses \"doctor\" for both men and women, Ukrainian distinguishes: **–ª—ñ–∫–∞—Ä** for a male doctor and **–ª—ñ–∫–∞—Ä–∫–∞** for a female doctor.\n\nThis is not a modern invention ‚Äî Ukrainian has always had productive suffixes like -–∫–∞, -–∏—Ü—è, and -–∏–Ω—è that form feminine nouns from masculine ones. Using the correct gender form is considered grammatically proper and respectful.\n\nThe main suffixes for feminine professions are:\n- **-–∫–∞**: –ª—ñ–∫–∞—Ä ‚Üí –ª—ñ–∫–∞—Ä–∫–∞, —ñ–Ω–∂–µ–Ω–µ—Ä ‚Üí —ñ–Ω–∂–µ–Ω–µ—Ä–∫–∞\n- **-–∏—Ü—è**: –ø–∏—Å—å–º–µ–Ω–Ω–∏–∫ ‚Üí –ø–∏—Å—å–º–µ–Ω–Ω–∏—Ü—è\n\nHere is a table of common professions with their masculine and feminine forms:\n\n| Masculine | Feminine | English |\n|-----------|----------|---------|\n| –ª—ñ–∫–∞—Ä | –ª—ñ–∫–∞—Ä–∫–∞ | doctor |\n| –≤—á–∏—Ç–µ–ª—å | –≤—á–∏—Ç–µ–ª—å–∫–∞ | teacher |\n| –∂—É—Ä–Ω–∞–ª—ñ—Å—Ç | –∂—É—Ä–Ω–∞–ª—ñ—Å—Ç–∫–∞ | journalist |\n| —ñ–Ω–∂–µ–Ω–µ—Ä | —ñ–Ω–∂–µ–Ω–µ—Ä–∫–∞ | engineer |\n| –ø—Ä–æ–≥—Ä–∞–º—ñ—Å—Ç | –ø—Ä–æ–≥—Ä–∞–º—ñ—Å—Ç–∫–∞ | programmer |\n| —é—Ä–∏—Å—Ç | —é—Ä–∏—Å—Ç–∫–∞ | lawyer |\n| –∞–∫—Ç–æ—Ä | –∞–∫—Ç–æ—Ä–∫–∞ | actor |\n| –ø–∏—Å—å–º–µ–Ω–Ω–∏–∫ | –ø–∏—Å—å–º–µ–Ω–Ω–∏—Ü—è | writer |\n\nWhen talking about a woman's profession, use the feminine form in both nominative and instrumental:\n\n–í–æ–Ω–∞ –ø—Ä–∞—Ü—é—î –ª—ñ–∫–∞—Ä–∫–æ—é. (She works as a doctor.)\nMaria —Å—Ç–∞–ª–∞ –ø–∏—Å—å–º–µ–Ω–Ω–∏—Ü–µ—é. (Maria became a writer.)\n\n> üîç **Myth Buster**\n>\n> Some people claim feminine profession forms like \"–ª—ñ–∫–∞—Ä–∫–∞\" or \"—ñ–Ω–∂–µ–Ω–µ—Ä–∫–∞\" are \"new\" or \"artificial.\" This is false! Ukrainian has always had productive feminine suffixes. What IS new is their official recognition ‚Äî the Ukrainian language was suppressed for centuries, so codification of natural forms was delayed. Using –ª—ñ–∫–∞—Ä–∫–∞ instead of –ª—ñ–∫–∞—Ä for a woman is grammatically correct and culturally authentic!\n\n## Famous Ukrainian Professionals\n\nUkraine has produced many outstanding professionals who changed the world. Here are some famous Ukrainians and their professions, demonstrating the instrumental case in action:\n\n| Name | Profession and Achievement |\n|------|------------|\n| –°–µ—Ä–≥—ñ–π –ö–æ—Ä–æ–ª—å–æ–≤ | He **was an engineer** (–±—É–≤ —ñ–Ω–∂–µ–Ω–µ—Ä–æ–º) who created the Soviet space program. |\n| –õ–µ—Å—è –£–∫—Ä–∞—ó–Ω–∫–∞ | She **became a writer** (—Å—Ç–∞–ª–∞ –ø–∏—Å—å–º–µ–Ω–Ω–∏—Ü–µ—é) and poet. |\n| –°–æ–ª–æ–º—ñ—è –ö—Ä—É—à–µ–ª—å–Ω–∏—Ü—å–∫–∞ | She **was an opera singer** (–±—É–ª–∞ —Å–ø—ñ–≤–∞—á–∫–æ—é) of world renown. |\n| –Ü–≥–æ—Ä –°—ñ–∫–æ—Ä—Å—å–∫–∏–π | He **worked as an engineer** (–ø—Ä–∞—Ü—é–≤–∞–≤ —ñ–Ω–∂–µ–Ω–µ—Ä–æ–º) and invented the helicopter. |\n\nNotice how each profession appears in the instrumental case after the verbs –±—É–≤, —Å—Ç–∞–ª–∞, –±—É–ª–∞, and –ø—Ä–∞—Ü—é–≤–∞–≤.\n\n> üåç **Real World**\n>\n> In modern Ukraine, IT professionals (–ø—Ä–æ–≥—Ä–∞–º—ñ—Å—Ç–∏) are one of the largest professional communities. Many Ukrainians say: \"–Ø –ø—Ä–∞—Ü—é—é –ø—Ä–æ–≥—Ä–∞–º—ñ—Å—Ç–æ–º\" or \"–ú–æ—è –º—Ä—ñ—è ‚Äî —Å—Ç–∞—Ç–∏ –ø—Ä–æ–≥—Ä–∞–º—ñ—Å—Ç–æ–º.\" The tech sector uses both masculine and feminine forms actively: –ø—Ä–æ–≥—Ä–∞–º—ñ—Å—Ç / –ø—Ä–æ–≥—Ä–∞–º—ñ—Å—Ç–∫–∞.\n\n> [!tip] Common Mistakes\n> English speakers often try to use \"—î\" (is) in present tense: \"–í—ñ–Ω —î –ª—ñ–∫–∞—Ä.\" While this is understood, native Ukrainian simply says \"–í—ñ–Ω –ª—ñ–∫–∞—Ä.\" The verb \"to be\" is invisible in present tense ‚Äî it appears only in past (–±—É–≤) and future (–±—É–¥–µ).\n\n> [!observe] Pattern Discovery\n> Notice that **—Å—Ç–∞—Ç–∏** always takes instrumental, regardless of tense. Whether you say \"–í—ñ–Ω —Å—Ç–∞–≤ –ª—ñ–∫–∞—Ä–µ–º\" (past), \"–í—ñ–Ω —Å—Ç–∞–Ω–µ –ª—ñ–∫–∞—Ä–µ–º\" (future), or \"–í—ñ–Ω —Ö–æ—á–µ —Å—Ç–∞—Ç–∏ –ª—ñ–∫–∞—Ä–µ–º\" (infinitive), the profession is always in instrumental!\n\n---"
      },
      {
        "id": "section-4",
        "name": "Practice",
        "nameEn": null,
        "type": "practice",
        "content": "## Present vs. Past/Future\n\nThis is the key distinction you need to master: in present tense, Ukrainian doesn't use any verb for \"to be\" with professions. You simply state the subject and profession in nominative case. But in past and future tenses, you use –±—É—Ç–∏ followed by the profession in instrumental case.\n\nRemember: Present tense = no verb, Nominative. Past/Future = –±—É—Ç–∏, Instrumental. This is a fundamental pattern in Ukrainian that differs from English where \"is\" appears in all tenses.\n\nStudy this table carefully to see the pattern across all three tenses:\n\n| Present (Nominative) | Past (Instrumental) | Future (Instrumental) |\n|---------|------|--------|\n| –í—ñ–Ω –ª—ñ–∫–∞—Ä. | –í—ñ–Ω **–±—É–≤ –ª—ñ–∫–∞—Ä–µ–º**. | –í—ñ–Ω **–±—É–¥–µ –ª—ñ–∫–∞—Ä–µ–º**. |\n| –í–æ–Ω–∞ —Å—Ç—É–¥–µ–Ω—Ç–∫–∞. | –í–æ–Ω–∞ **–±—É–ª–∞ —Å—Ç—É–¥–µ–Ω—Ç–∫–æ—é**. | –í–æ–Ω–∞ **–±—É–¥–µ —Å—Ç—É–¥–µ–Ω—Ç–∫–æ—é**. |\n| –ú–∏ –¥—Ä—É–∑—ñ. | –ú–∏ **–±—É–ª–∏ –¥—Ä—É–∑—è–º–∏**. | –ú–∏ **–±—É–¥–µ–º–æ –¥—Ä—É–∑—è–º–∏**. |\n\n## Form the Instrumental of Professions\n\nHere is a reference table showing how common professions change from nominative to instrumental case. Notice that masculine nouns typically add -–æ–º or -–µ–º, while feminine nouns add -–æ—é:\n\n| Nominative | Instrumental | Gender |\n|------------|--------------|--------|\n| –ª—ñ–∫–∞—Ä | –ª—ñ–∫–∞—Ä–µ–º | masc |\n| –≤—á–∏—Ç–µ–ª—å | –≤—á–∏—Ç–µ–ª–µ–º | masc |\n| —ñ–Ω–∂–µ–Ω–µ—Ä | —ñ–Ω–∂–µ–Ω–µ—Ä–æ–º | masc |\n| –ø—Ä–æ–≥—Ä–∞–º—ñ—Å—Ç | –ø—Ä–æ–≥—Ä–∞–º—ñ—Å—Ç–æ–º | masc |\n| –∂—É—Ä–Ω–∞–ª—ñ—Å—Ç | –∂—É—Ä–Ω–∞–ª—ñ—Å—Ç–æ–º | masc |\n| –≤—á–∏—Ç–µ–ª—å–∫–∞ | –≤—á–∏—Ç–µ–ª—å–∫–æ—é | fem |\n| –ª—ñ–∫–∞—Ä–∫–∞ | –ª—ñ–∫–∞—Ä–∫–æ—é | fem |\n\n## Mini-Dialogues\n\nPractice these conversations that demonstrate –±—É—Ç–∏, —Å—Ç–∞—Ç–∏, and –ø—Ä–∞—Ü—é–≤–∞—Ç–∏ with instrumental case. English translations are provided to help you understand the meaning.\n\n**–ù–∞ –≤–µ—á—ñ—Ä—Ü—ñ (At a party):**\n‚Äî –ö–∏–º —Ç–∏ –ø—Ä–∞—Ü—é—î—à? (What do you work as?)\n‚Äî –Ø –ø—Ä–∞—Ü—é—é –ø—Ä–æ–≥—Ä–∞–º—ñ—Å—Ç–æ–º. –ê —Ç–∏? (I work as a programmer. And you?)\n‚Äî –Ø –≤—á–∏—Ç–µ–ª—å–∫–∞. –ü—Ä–∞—Ü—é—é –≤ —à–∫–æ–ª—ñ. (I'm a teacher. I work at a school.)\n‚Äî –¶—ñ–∫–∞–≤–æ! –ê –∫–∏–º —Ç–∏ —Ö–æ—á–µ—à —Å—Ç–∞—Ç–∏ –≤ –º–∞–π–±—É—Ç–Ω—å–æ–º—É? (Interesting! What do you want to become in the future?)\n‚Äî –Ø —Ö–æ—á—É —Å—Ç–∞—Ç–∏ –¥–∏—Ä–µ–∫—Ç–æ—Ä–∫–æ—é —à–∫–æ–ª–∏. (I want to become a school principal.)\n\n**–£ —Ä–æ–¥–∏–Ω—ñ (In the family):**\n‚Äî –ö–∏–º –±—É–≤ —Ç–≤—ñ–π –¥—ñ–¥—É—Å—å? (What was your grandfather?)\n‚Äî –í—ñ–Ω –±—É–≤ –ª—ñ–∫–∞—Ä–µ–º. (He was a doctor.)\n‚Äî –ê –±–∞–±—É—Å—è? (And grandmother?)\n‚Äî –í–æ–Ω–∞ –±—É–ª–∞ –≤—á–∏—Ç–µ–ª—å–∫–æ—é –º—É–∑–∏–∫–∏. (She was a music teacher.)\n\n**–ù–∞ —Å–ø—ñ–≤–±–µ—Å—ñ–¥—ñ (At a job interview):**\n‚Äî –ö–∏–º –≤–∏ –ø—Ä–∞—Ü—é–≤–∞–ª–∏ —Ä–∞–Ω—ñ—à–µ? (What did you work as before?)\n‚Äî –Ø –ø—Ä–∞—Ü—é–≤–∞–≤ –∂—É—Ä–Ω–∞–ª—ñ—Å—Ç–æ–º —à—ñ—Å—Ç—å —Ä–æ–∫—ñ–≤. (I worked as a journalist for six years.)\n‚Äî –ê —á–æ–º—É —Ö–æ—á–µ—Ç–µ –∑–º—ñ–Ω–∏—Ç–∏ –ø—Ä–æ—Ñ–µ—Å—ñ—é? (Why do you want to change professions?)\n‚Äî –Ø —Ö–æ—á—É —Å—Ç–∞—Ç–∏ –ø—Ä–æ–≥—Ä–∞–º—ñ—Å—Ç–æ–º. (I want to become a programmer.)\n\n---"
      },
      {
        "id": "section-5",
        "name": "Reading Practice: –ú–æ—è —Ä–æ–¥–∏–Ω–∞ —ñ –ø—Ä–æ—Ñ–µ—Å—ñ—ó",
        "nameEn": null,
        "type": "practice",
        "content": "This reading passage demonstrates all three verbs (–±—É—Ç–∏, —Å—Ç–∞—Ç–∏, –ø—Ä–∞—Ü—é–≤–∞—Ç–∏) with professions in instrumental case. Pay attention to how the bolded phrases follow the pattern: verb + profession in instrumental.\n\n> –ú–æ—è —Ä–æ–¥–∏–Ω–∞ —Ü—ñ–∫–∞–≤–∞. –ú—ñ–π —Ç–∞—Ç–æ **–ø—Ä–∞—Ü—é—î —ñ–Ω–∂–µ–Ω–µ—Ä–æ–º** –Ω–∞ –∑–∞–≤–æ–¥—ñ. –†–∞–Ω—ñ—à–µ –≤—ñ–Ω **–±—É–≤ —Å—Ç—É–¥–µ–Ω—Ç–æ–º** –ø–æ–ª—ñ—Ç–µ—Ö–Ω—ñ—á–Ω–æ–≥–æ —ñ–Ω—Å—Ç–∏—Ç—É—Ç—É. –ú–æ—è –º–∞–º–∞ **—Å—Ç–∞–ª–∞ –ª—ñ–∫–∞—Ä–∫–æ—é** –ø—ñ—Å–ª—è —É–Ω—ñ–≤–µ—Ä—Å–∏—Ç–µ—Ç—É. –í–æ–Ω–∞ **–ø—Ä–∞—Ü—é—î –ª—ñ–∫–∞—Ä–∫–æ—é** –≤–∂–µ –¥–≤–∞–¥—Ü—è—Ç—å —Ä–æ–∫—ñ–≤.\n>\n> –ú—ñ–π —Å—Ç–∞—Ä—à–∏–π –±—Ä–∞—Ç **–º—Ä—ñ—è–≤ —Å—Ç–∞—Ç–∏ –º—É–∑–∏–∫–∞–Ω—Ç–æ–º**, –∞–ª–µ **—Å—Ç–∞–≤ –ø—Ä–æ–≥—Ä–∞–º—ñ—Å—Ç–æ–º**. –í—ñ–Ω –∫–∞–∂–µ, —â–æ —Ü–µ —Ç–µ–∂ —Ç–≤–æ—Ä—á–∞ –ø—Ä–æ—Ñ–µ—Å—ñ—è! –ú–æ—è —Å–µ—Å—Ç—Ä–∞ **–±—É–ª–∞ –∂—É—Ä–Ω–∞–ª—ñ—Å—Ç–∫–æ—é**, –∞–ª–µ –∑–∞—Ä–∞–∑ –≤–æ–Ω–∞ **—Å—Ç–∞–ª–∞ –ø–∏—Å—å–º–µ–Ω–Ω–∏—Ü–µ—é**. –í–æ–Ω–∞ –Ω–∞–ø–∏—Å–∞–ª–∞ —Ç—Ä–∏ –∫–Ω–∏–≥–∏.\n>\n> –ê —è? –Ø —â–µ —Å—Ç—É–¥–µ–Ω—Ç. –Ø **—Ö–æ—á—É —Å—Ç–∞—Ç–∏ –≤—á–∏—Ç–µ–ª–µ–º** —É–∫—Ä–∞—ó–Ω—Å—å–∫–æ—ó –º–æ–≤–∏. –ú–æ—ó –¥—Ä—É–∑—ñ –∫–∞–∂—É—Ç—å, —â–æ —è **–±—É–¥—É —Ö–æ—Ä–æ—à–∏–º –≤—á–∏—Ç–µ–ª–µ–º**, –±–æ —è –ª—é–±–ª—é –ø–æ—è—Å–Ω—é–≤–∞—Ç–∏.\n\n**Comprehension Questions:** Answer these questions about the reading above. Notice that the answers also use instrumental case.\n\n1. –ö–∏–º –ø—Ä–∞—Ü—é—î —Ç–∞—Ç–æ? ‚Äî –í—ñ–Ω –ø—Ä–∞—Ü—é—î —ñ–Ω–∂–µ–Ω–µ—Ä–æ–º.\n2. –ö–∏–º —Å—Ç–∞–ª–∞ –º–∞–º–∞? ‚Äî –í–æ–Ω–∞ —Å—Ç–∞–ª–∞ –ª—ñ–∫–∞—Ä–∫–æ—é.\n3. –ö–∏–º –º—Ä—ñ—è–≤ —Å—Ç–∞—Ç–∏ –±—Ä–∞—Ç? ‚Äî –í—ñ–Ω –º—Ä—ñ—è–≤ —Å—Ç–∞—Ç–∏ –º—É–∑–∏–∫–∞–Ω—Ç–æ–º.\n4. –ö–∏–º –±—É–ª–∞ —Å–µ—Å—Ç—Ä–∞? ‚Äî –í–æ–Ω–∞ –±—É–ª–∞ –∂—É—Ä–Ω–∞–ª—ñ—Å—Ç–∫–æ—é.\n5. –ö–∏–º —Ö–æ—á–µ —Å—Ç–∞—Ç–∏ –æ–ø–æ–≤—ñ–¥–∞—á? ‚Äî –í—ñ–Ω —Ö–æ—á–µ —Å—Ç–∞—Ç–∏ –≤—á–∏—Ç–µ–ª–µ–º.\n\n---"
      },
      {
        "id": "section-6",
        "name": "Summary",
        "nameEn": null,
        "type": "summary",
        "content": "In this module, you learned how to talk about professions using three key verbs that take the instrumental case: –±—É—Ç–∏ (to be), —Å—Ç–∞—Ç–∏ (to become), and –ø—Ä–∞—Ü—é–≤–∞—Ç–∏ (to work as). Here's a recap of the key patterns you mastered:\n\n**Key Pattern 1: –ë—É—Ç–∏ + Instrumental** for past and future tenses\n\nIn present tense, Ukrainian doesn't use a verb for \"to be\" with professions. But in past and future, you use –±—É—Ç–∏ followed by the instrumental case:\n- –í—ñ–Ω **–±—É–≤ —Å—Ç—É–¥–µ–Ω—Ç–æ–º**. (He was a student.)\n- –í–æ–Ω–∞ **–±—É–¥–µ –ª—ñ–∫–∞—Ä–∫–æ—é**. (She will be a doctor.)\n- Present tense: no –±—É—Ç–∏, use nominative (–í—ñ–Ω —Å—Ç—É–¥–µ–Ω—Ç.)\n\n**Key Pattern 2: –°—Ç–∞—Ç–∏ + Instrumental** for becoming\n\nThe verb —Å—Ç–∞—Ç–∏ always takes instrumental, regardless of tense:\n- –í–æ–Ω–∞ **—Å—Ç–∞–ª–∞ –≤—á–∏—Ç–µ–ª—å–∫–æ—é**. (She became a teacher.)\n- –í—ñ–Ω **—Ö–æ—á–µ —Å—Ç–∞—Ç–∏ –ø—Ä–æ–≥—Ä–∞–º—ñ—Å—Ç–æ–º**. (He wants to become a programmer.)\n\n**Key Pattern 3: –ü—Ä–∞—Ü—é–≤–∞—Ç–∏ + Instrumental** for working as\n\nNo preposition is needed ‚Äî just verb + profession in instrumental:\n- –Ø **–ø—Ä–∞—Ü—é—é —ñ–Ω–∂–µ–Ω–µ—Ä–æ–º**. (I work as an engineer.)\n- –ö–∏–º —Ç–∏ –ø—Ä–∞—Ü—é—î—à? (What do you work as?)\n\n**Gender Forms**: Remember that Ukrainian has separate masculine and feminine forms for most professions: –ª—ñ–∫–∞—Ä/–ª—ñ–∫–∞—Ä–∫–∞, –≤—á–∏—Ç–µ–ª—å/–≤—á–∏—Ç–µ–ª—å–∫–∞, –ø—Ä–æ–≥—Ä–∞–º—ñ—Å—Ç/–ø—Ä–æ–≥—Ä–∞–º—ñ—Å—Ç–∫–∞. Use the correct form based on the person's gender.\n\nNow you can talk about your profession with confidence! üë®‚Äç‚öïÔ∏èüë©‚Äçüè´üíª"
      },
      {
        "id": "section-7",
        "name": "Activities",
        "nameEn": null,
        "type": "activities",
        "content": "## match-up: Professions Masculine and Feminine\n\n- –ª—ñ–∫–∞—Ä :: –ª—ñ–∫–∞—Ä–∫–∞\n- –≤—á–∏—Ç–µ–ª—å :: –≤—á–∏—Ç–µ–ª—å–∫–∞\n- —ñ–Ω–∂–µ–Ω–µ—Ä :: —ñ–Ω–∂–µ–Ω–µ—Ä–∫–∞\n- –ø—Ä–æ–≥—Ä–∞–º—ñ—Å—Ç :: –ø—Ä–æ–≥—Ä–∞–º—ñ—Å—Ç–∫–∞\n- –∂—É—Ä–Ω–∞–ª—ñ—Å—Ç :: –∂—É—Ä–Ω–∞–ª—ñ—Å—Ç–∫–∞\n- —é—Ä–∏—Å—Ç :: —é—Ä–∏—Å—Ç–∫–∞\n- –∞–∫—Ç–æ—Ä :: –∞–∫—Ç–æ—Ä–∫–∞\n- –ø–∏—Å—å–º–µ–Ω–Ω–∏–∫ :: –ø–∏—Å—å–º–µ–Ω–Ω–∏—Ü—è\n- –º–µ–Ω–µ–¥–∂–µ—Ä :: –º–µ–Ω–µ–¥–∂–µ—Ä–∫–∞\n- –¥–∏—Ä–µ–∫—Ç–æ—Ä :: –¥–∏—Ä–µ–∫—Ç–æ—Ä–∫–∞\n- —Å–µ–∫—Ä–µ—Ç–∞—Ä :: —Å–µ–∫—Ä–µ—Ç–∞—Ä–∫–∞\n- –≤–æ–¥—ñ–π :: –≤–æ–¥—ñ–π–∫–∞\n\n## fill-in: –ë—É—Ç–∏/–°—Ç–∞—Ç–∏ + Instrumental\n\n> Complete each sentence with the correct instrumental form.\n\n1. –í—ñ–Ω —Ä–∞–Ω—ñ—à–µ –±—É–≤ ___.\n   > [!answer] —Å—Ç—É–¥–µ–Ω—Ç–æ–º\n   > [!options] —Å—Ç—É–¥–µ–Ω—Ç | —Å—Ç—É–¥–µ–Ω—Ç–æ–º | —Å—Ç—É–¥–µ–Ω—Ç–∞\n\n2. –í–æ–Ω–∞ —Ö–æ—á–µ —Å—Ç–∞—Ç–∏ ___.\n   > [!answer] –ª—ñ–∫–∞—Ä–∫–æ—é\n   > [!options] –ª—ñ–∫–∞—Ä–∫–∞ | –ª—ñ–∫–∞—Ä–∫–æ—é | –ª—ñ–∫–∞—Ä–∫—É\n\n3. –ú–∏ –±—É–¥–µ–º–æ ___.\n   > [!answer] –¥—Ä—É–∑—è–º–∏\n   > [!options] –¥—Ä—É–∑—ñ | –¥—Ä—É–∑—è–º–∏ | –¥—Ä—É–∑—ñ–≤\n\n4. –í—ñ–Ω –ø—Ä–∞—Ü—é—î ___.\n   > [!answer] –ø—Ä–æ–≥—Ä–∞–º—ñ—Å—Ç–æ–º\n   > [!options] –ø—Ä–æ–≥—Ä–∞–º—ñ—Å—Ç | –ø—Ä–æ–≥—Ä–∞–º—ñ—Å—Ç–æ–º | –ø—Ä–æ–≥—Ä–∞–º—ñ—Å—Ç–∞\n\n5. –í–æ–Ω–∞ —Å—Ç–∞–ª–∞ ___.\n   > [!answer] –≤—á–∏—Ç–µ–ª—å–∫–æ—é\n   > [!options] –≤—á–∏—Ç–µ–ª—å–∫–∞ | –≤—á–∏—Ç–µ–ª—å–∫–æ—é | –≤—á–∏—Ç–µ–ª—å–∫—É\n\n6. –í—ñ–Ω –±—É–≤ ___.\n   > [!answer] –¥–∏—Ä–µ–∫—Ç–æ—Ä–æ–º\n   > [!options] –¥–∏—Ä–µ–∫—Ç–æ—Ä | –¥–∏—Ä–µ–∫—Ç–æ—Ä–æ–º | –¥–∏—Ä–µ–∫—Ç–æ—Ä–∞\n\n7. –í–æ–Ω–∞ –±—É–¥–µ ___.\n   > [!answer] –∂—É—Ä–Ω–∞–ª—ñ—Å—Ç–∫–æ—é\n   > [!options] –∂—É—Ä–Ω–∞–ª—ñ—Å—Ç–∫–∞ | –∂—É—Ä–Ω–∞–ª—ñ—Å—Ç–∫–æ—é | –∂—É—Ä–Ω–∞–ª—ñ—Å—Ç–∫—É\n\n8. –í—ñ–Ω –º—Ä—ñ—î —Å—Ç–∞—Ç–∏ ___.\n   > [!answer] –ø–∏—Å—å–º–µ–Ω–Ω–∏–∫–æ–º\n   > [!options] –ø–∏—Å—å–º–µ–Ω–Ω–∏–∫ | –ø–∏—Å—å–º–µ–Ω–Ω–∏–∫–æ–º | –ø–∏—Å—å–º–µ–Ω–Ω–∏–∫–∞\n\n9. –í–æ–Ω–∞ –ø—Ä–∞—Ü—é—î ___.\n   > [!answer] —Å–µ–∫—Ä–µ—Ç–∞—Ä–∫–æ—é\n   > [!options] —Å–µ–∫—Ä–µ—Ç–∞—Ä–∫–∞ | —Å–µ–∫—Ä–µ—Ç–∞—Ä–∫–æ—é | —Å–µ–∫—Ä–µ—Ç–∞—Ä–∫—É\n\n10. –ú–∏ –±—É–ª–∏ ___.\n    > [!answer] —Å—Ç—É–¥–µ–Ω—Ç–∞–º–∏\n    > [!options] —Å—Ç—É–¥–µ–Ω—Ç–∏ | —Å—Ç—É–¥–µ–Ω—Ç–∞–º–∏ | —Å—Ç—É–¥–µ–Ω—Ç—ñ–≤\n\n11. –í—ñ–Ω —Ö–æ—á–µ —Å—Ç–∞—Ç–∏ ___.\n    > [!answer] —ñ–Ω–∂–µ–Ω–µ—Ä–æ–º\n    > [!options] —ñ–Ω–∂–µ–Ω–µ—Ä | —ñ–Ω–∂–µ–Ω–µ—Ä–æ–º | —ñ–Ω–∂–µ–Ω–µ—Ä–∞\n\n12. –í–æ–Ω–∞ –±—É–ª–∞ ___.\n    > [!answer] –∞–∫—Ç–æ—Ä–∫–æ—é\n    > [!options] –∞–∫—Ç–æ—Ä–∫–∞ | –∞–∫—Ç–æ—Ä–∫–æ—é | –∞–∫—Ç–æ—Ä–∫—É\n\n## quiz: When to Use Instrumental\n\n1. –Ø–∫–µ —Ä–µ—á–µ–Ω–Ω—è –ø—Ä–∞–≤–∏–ª—å–Ω–µ?\n\n- [x] –í—ñ–Ω –±—É–≤ —Å—Ç—É–¥–µ–Ω—Ç–æ–º.\n- [ ] –í—ñ–Ω –±—É–≤ —Å—Ç—É–¥–µ–Ω—Ç.\n- [ ] –í—ñ–Ω –±—É–≤ —Å—Ç—É–¥–µ–Ω—Ç–∞.\n\n---\n\n2. –Ø–∫ —Å–∫–∞–∑–∞—Ç–∏ \"She became a teacher\"?\n\n- [x] –í–æ–Ω–∞ —Å—Ç–∞–ª–∞ –≤—á–∏—Ç–µ–ª—å–∫–æ—é.\n- [ ] –í–æ–Ω–∞ —Å—Ç–∞–ª–∞ –≤—á–∏—Ç–µ–ª—å–∫–∞.\n- [ ] –í–æ–Ω–∞ —Å—Ç–∞–ª–∞ –≤—á–∏—Ç–µ–ª—å–∫—É.\n\n---\n\n3. –ö–æ–ª–∏ –≤–∏–∫–æ—Ä–∏—Å—Ç–æ–≤—É—î–º–æ –æ—Ä—É–¥–Ω–∏–π –∑ \"–±—É—Ç–∏\"?\n\n- [x] –£ –º–∏–Ω—É–ª–æ–º—É —Ç–∞ –º–∞–π–±—É—Ç–Ω—å–æ–º—É —á–∞—Å—ñ\n- [ ] –£ —Ç–µ–ø–µ—Ä—ñ—à–Ω—å–æ–º—É —á–∞—Å—ñ\n- [ ] –ù—ñ–∫–æ–ª–∏\n\n---\n\n4. –Ø–∫ —Å–∫–∞–∑–∞—Ç–∏ \"I work as a programmer\"?\n\n- [x] –Ø –ø—Ä–∞—Ü—é—é –ø—Ä–æ–≥—Ä–∞–º—ñ—Å—Ç–æ–º.\n- [ ] –Ø –ø—Ä–∞—Ü—é—é –ø—Ä–æ–≥—Ä–∞–º—ñ—Å—Ç.\n- [ ] –Ø –ø—Ä–∞—Ü—é—é –ø—Ä–æ–≥—Ä–∞–º—ñ—Å—Ç–∞.\n\n---\n\n5. –Ø–∫–µ —Ä–µ—á–µ–Ω–Ω—è –ø—Ä–∞–≤–∏–ª—å–Ω–µ –¥–ª—è —Ç–µ–ø–µ—Ä—ñ—à–Ω—å–æ–≥–æ —á–∞—Å—É?\n\n- [x] –í—ñ–Ω –ª—ñ–∫–∞—Ä.\n- [ ] –í—ñ–Ω —î –ª—ñ–∫–∞—Ä–µ–º.\n- [ ] –í—ñ–Ω –ª—ñ–∫–∞—Ä–µ–º.\n\n---\n\n6. –Ø–∫ –∑–∞–ø–∏—Ç–∞—Ç–∏ \"What do you work as\"?\n\n- [x] –ö–∏–º —Ç–∏ –ø—Ä–∞—Ü—é—î—à?\n- [ ] –©–æ —Ç–∏ –ø—Ä–∞—Ü—é—î—à?\n- [ ] –•—Ç–æ —Ç–∏ –ø—Ä–∞—Ü—é—î—à?\n\n---\n\n7. –Ø–∫–µ —Ä–µ—á–µ–Ω–Ω—è –ø—Ä–∞–≤–∏–ª—å–Ω–µ?\n\n- [x] –í—ñ–Ω –±—É–¥–µ —ñ–Ω–∂–µ–Ω–µ—Ä–æ–º.\n- [ ] –í—ñ–Ω –±—É–¥–µ —ñ–Ω–∂–µ–Ω–µ—Ä.\n- [ ] –í—ñ–Ω –±—É–¥–µ —ñ–Ω–∂–µ–Ω–µ—Ä–∞.\n\n---\n\n8. \"–°—Ç–∞—Ç–∏\" –≤–∏–º–∞–≥–∞—î —è–∫–æ–≥–æ –≤—ñ–¥–º—ñ–Ω–∫–∞?\n\n- [x] –û—Ä—É–¥–Ω–æ–≥–æ\n- [ ] –ó–Ω–∞—Ö—ñ–¥–Ω–æ–≥–æ\n- [ ] –ù–∞–∑–∏–≤–Ω–æ–≥–æ\n\n---\n\n9. –Ø–∫ —Å–∫–∞–∑–∞—Ç–∏ \"We were friends\"?\n\n- [x] –ú–∏ –±—É–ª–∏ –¥—Ä—É–∑—è–º–∏.\n- [ ] –ú–∏ –±—É–ª–∏ –¥—Ä—É–∑—ñ.\n- [ ] –ú–∏ –±—É–ª–∏ –¥—Ä—É–∑—ñ–≤.\n\n---\n\n10. –Ø–∫–∞ –∂—ñ–Ω–æ—á–∞ —Ñ–æ—Ä–º–∞ \"–ø—Ä–æ–≥—Ä–∞–º—ñ—Å—Ç\"?\n\n- [x] –ø—Ä–æ–≥—Ä–∞–º—ñ—Å—Ç–∫–∞\n- [ ] –ø—Ä–æ–≥—Ä–∞–º—ñ—Å—Ç–∏—Ü—è\n- [ ] –ø—Ä–æ–≥—Ä–∞–º—ñ—Å—Ç–µ—Å–∞\n\n---\n\n11. –Ø–∫–µ —Ä–µ—á–µ–Ω–Ω—è –ø—Ä–∞–≤–∏–ª—å–Ω–µ?\n\n- [x] –í–æ–Ω–∞ –ø—Ä–∞—Ü—é—î –∂—É—Ä–Ω–∞–ª—ñ—Å—Ç–∫–æ—é.\n- [ ] –í–æ–Ω–∞ –ø—Ä–∞—Ü—é—î –∂—É—Ä–Ω–∞–ª—ñ—Å—Ç–∫–∞.\n- [ ] –í–æ–Ω–∞ –ø—Ä–∞—Ü—é—î –∂—É—Ä–Ω–∞–ª—ñ—Å—Ç–∫—É.\n\n---\n\n12. –Ø–∫ —Å–∫–∞–∑–∞—Ç–∏ \"He wants to become a doctor\"?\n\n- [x] –í—ñ–Ω —Ö–æ—á–µ —Å—Ç–∞—Ç–∏ –ª—ñ–∫–∞—Ä–µ–º.\n- [ ] –í—ñ–Ω —Ö–æ—á–µ —Å—Ç–∞—Ç–∏ –ª—ñ–∫–∞—Ä.\n- [ ] –í—ñ–Ω —Ö–æ—á–µ —Å—Ç–∞—Ç–∏ –ª—ñ–∫–∞—Ä—è.\n\n## true-false: Instrumental with Professions\n\n> Decide if each statement is true or false.\n\n- [x] In present tense, we usually don't use \"–±—É—Ç–∏\" for professions.\n  > Correct! –í—ñ–Ω –ª—ñ–∫–∞—Ä. (not –í—ñ–Ω —î –ª—ñ–∫–∞—Ä–µ–º.)\n\n- [ ] \"–°—Ç–∞—Ç–∏\" takes the nominative case.\n  > False! –°—Ç–∞—Ç–∏ always takes instrumental: —Å—Ç–∞—Ç–∏ –ª—ñ–∫–∞—Ä–µ–º.\n\n- [x] \"–ü—Ä–∞—Ü—é–≤–∞—Ç–∏ + Instrumental\" expresses \"to work as.\"\n  > Yes! –Ø –ø—Ä–∞—Ü—é—é –≤—á–∏—Ç–µ–ª–µ–º = I work as a teacher.\n\n- [ ] \"–í—ñ–Ω —î –ª—ñ–∫–∞—Ä\" is the standard way to say \"He is a doctor.\"\n  > In standard Ukrainian, we say \"–í—ñ–Ω –ª—ñ–∫–∞—Ä\" (zero copula).\n\n- [x] Feminine profession forms like \"–ª—ñ–∫–∞—Ä–∫–∞\" are grammatically correct.\n  > Yes! Ukrainian has productive feminine suffixes.\n\n- [x] \"–ë—É–≤/–±—É–ª–∞ + Instrumental\" is used for past tense.\n  > Correct! –í—ñ–Ω –±—É–≤ —Å—Ç—É–¥–µ–Ω—Ç–æ–º. –í–æ–Ω–∞ –±—É–ª–∞ –ª—ñ–∫–∞—Ä–∫–æ—é.\n\n- [ ] \"–ö–∏–º?\" is the nominative of \"—Ö—Ç–æ.\"\n  > \"–ö–∏–º?\" is the instrumental of \"—Ö—Ç–æ.\"\n\n- [x] \"–í—ñ–Ω –±—É–¥–µ —ñ–Ω–∂–µ–Ω–µ—Ä–æ–º\" means \"He will be an engineer.\"\n  > Correct! Future tense uses –±—É–¥–µ + instrumental.\n\n- [ ] \"–í–æ–Ω–∞ –ª—ñ–∫–∞—Ä–æ–º\" is a complete sentence in present tense.\n  > In present tense, use nominative: –í–æ–Ω–∞ –ª—ñ–∫–∞—Ä–∫–∞.\n\n- [x] \"–ó–∞–ª–∏—à–∞—Ç–∏—Å—è\" can also take instrumental.\n  > Yes! –í–æ–Ω–∞ –∑–∞–ª–∏—à–∞—î—Ç—å—Å—è –¥–∏—Ä–µ–∫—Ç–æ—Ä–∫–æ—é.\n\n- [x] \"–°–ª—É–∂–∏—Ç–∏\" takes instrumental for role.\n  > Correct! –í—ñ–Ω —Å–ª—É–∂–∏—Ç—å —Å–æ–ª–¥–∞—Ç–æ–º.\n\n- [ ] The feminine of \"–ø–∏—Å—å–º–µ–Ω–Ω–∏–∫\" is \"–ø–∏—Å—å–º–µ–Ω–Ω–∏—Ü—è.\"\n  > Wait ‚Äî this IS true! –ü–∏—Å—å–º–µ–Ω–Ω–∏–∫ ‚Üí –ø–∏—Å—å–º–µ–Ω–Ω–∏—Ü—è.\n\n## group-sort: Masculine vs. Feminine Professions\n\n> Sort these profession forms into the correct category.\n\n### Masculine\n- –ª—ñ–∫–∞—Ä\n- –≤—á–∏—Ç–µ–ª—å\n- —ñ–Ω–∂–µ–Ω–µ—Ä\n- –ø—Ä–æ–≥—Ä–∞–º—ñ—Å—Ç\n- –∂—É—Ä–Ω–∞–ª—ñ—Å—Ç\n- –ø–∏—Å—å–º–µ–Ω–Ω–∏–∫\n\n### Feminine\n- –ª—ñ–∫–∞—Ä–∫–∞\n- –≤—á–∏—Ç–µ–ª—å–∫–∞\n- —ñ–Ω–∂–µ–Ω–µ—Ä–∫–∞\n- –ø—Ä–æ–≥—Ä–∞–º—ñ—Å—Ç–∫–∞\n- –∂—É—Ä–Ω–∞–ª—ñ—Å—Ç–∫–∞\n- –ø–∏—Å—å–º–µ–Ω–Ω–∏—Ü—è\n\n## unjumble: Profession Sentences\n\n> Put the words in the correct order.\n\n1. –≤—ñ–Ω / —Ä–∞–Ω—ñ—à–µ / –±—É–≤ / —Å—Ç—É–¥–µ–Ω—Ç–æ–º\n   > [!answer] –í—ñ–Ω —Ä–∞–Ω—ñ—à–µ –±—É–≤ —Å—Ç—É–¥–µ–Ω—Ç–æ–º.\n   > (He was a student before.)\n\n2. –≤–æ–Ω–∞ / —Å—Ç–∞–ª–∞ / –≤—á–∏—Ç–µ–ª—å–∫–æ—é / –ø—ñ—Å–ª—è / —É–Ω—ñ–≤–µ—Ä—Å–∏—Ç–µ—Ç—É\n   > [!answer] –í–æ–Ω–∞ —Å—Ç–∞–ª–∞ –≤—á–∏—Ç–µ–ª—å–∫–æ—é –ø—ñ—Å–ª—è —É–Ω—ñ–≤–µ—Ä—Å–∏—Ç–µ—Ç—É.\n   > (She became a teacher after university.)\n\n3. —è / –ø—Ä–∞—Ü—é—é / –ø—Ä–æ–≥—Ä–∞–º—ñ—Å—Ç–æ–º / —É / –∫–æ–º–ø–∞–Ω—ñ—ó\n   > [!answer] –Ø –ø—Ä–∞—Ü—é—é –ø—Ä–æ–≥—Ä–∞–º—ñ—Å—Ç–æ–º —É –∫–æ–º–ø–∞–Ω—ñ—ó.\n   > (I work as a programmer at a company.)\n\n4. –≤—ñ–Ω / —Ö–æ—á–µ / —Å—Ç–∞—Ç–∏ / –ª—ñ–∫–∞—Ä–µ–º\n   > [!answer] –í—ñ–Ω —Ö–æ—á–µ —Å—Ç–∞—Ç–∏ –ª—ñ–∫–∞—Ä–µ–º.\n   > (He wants to become a doctor.)\n\n5. –≤–æ–Ω–∞ / –±—É–¥–µ / –∂—É—Ä–Ω–∞–ª—ñ—Å—Ç–∫–æ—é\n   > [!answer] –í–æ–Ω–∞ –±—É–¥–µ –∂—É—Ä–Ω–∞–ª—ñ—Å—Ç–∫–æ—é.\n   > (She will be a journalist.)\n\n6. –º–∏ / –±—É–ª–∏ / –¥—Ä—É–∑—è–º–∏ / –±–∞–≥–∞—Ç–æ / —Ä–æ–∫—ñ–≤\n   > [!answer] –ú–∏ –±—É–ª–∏ –¥—Ä—É–∑—è–º–∏ –±–∞–≥–∞—Ç–æ —Ä–æ–∫—ñ–≤.\n   > (We were friends for many years.)\n\n7. –∫–∏–º / —Ç–∏ / –ø—Ä–∞—Ü—é—î—à\n   > [!answer] –ö–∏–º —Ç–∏ –ø—Ä–∞—Ü—é—î—à?\n   > (What do you work as?)\n\n8. –≤—ñ–Ω / –º—Ä—ñ—î / —Å—Ç–∞—Ç–∏ / –ø–∏—Å—å–º–µ–Ω–Ω–∏–∫–æ–º\n   > [!answer] –í—ñ–Ω –º—Ä—ñ—î —Å—Ç–∞—Ç–∏ –ø–∏—Å—å–º–µ–Ω–Ω–∏–∫–æ–º.\n   > (He dreams of becoming a writer.)\n\n9. –≤–æ–Ω–∞ / –ø—Ä–∞—Ü—é–≤–∞–ª–∞ / —Å–µ–∫—Ä–µ—Ç–∞—Ä–∫–æ—é / –ø'—è—Ç—å / —Ä–æ–∫—ñ–≤\n   > [!answer] –í–æ–Ω–∞ –ø—Ä–∞—Ü—é–≤–∞–ª–∞ —Å–µ–∫—Ä–µ—Ç–∞—Ä–∫–æ—é –ø'—è—Ç—å —Ä–æ–∫—ñ–≤.\n   > (She worked as a secretary for five years.)\n\n10. –≤–æ–Ω–∏ / —Å—Ç–∞–Ω—É—Ç—å / —ñ–Ω–∂–µ–Ω–µ—Ä–∞–º–∏\n    > [!answer] –í–æ–Ω–∏ —Å—Ç–∞–Ω—É—Ç—å —ñ–Ω–∂–µ–Ω–µ—Ä–∞–º–∏.\n    > (They will become engineers.)\n\n11. –≤—ñ–Ω / –±—É–≤ / –¥–∏—Ä–µ–∫—Ç–æ—Ä–æ–º / —à–∫–æ–ª–∏\n    > [!answer] –í—ñ–Ω –±—É–≤ –¥–∏—Ä–µ–∫—Ç–æ—Ä–æ–º —à–∫–æ–ª–∏.\n    > (He was the director of the school.)\n\n12. –≤–æ–Ω–∞ / —Ö–æ—Ç—ñ–ª–∞ / —Å—Ç–∞—Ç–∏ / –∞–∫—Ç–æ—Ä–∫–æ—é\n    > [!answer] –í–æ–Ω–∞ —Ö–æ—Ç—ñ–ª–∞ —Å—Ç–∞—Ç–∏ –∞–∫—Ç–æ—Ä–∫–æ—é.\n    > (She wanted to become an actress.)\n\n## error-correction: Fix the Instrumental\n\n> Each sentence has ONE error. Find and correct it.\n\n1. –í—ñ–Ω –±—É–≤ —Å—Ç—É–¥–µ–Ω—Ç.\n   > [!error] —Å—Ç—É–¥–µ–Ω—Ç\n   > [!answer] —Å—Ç—É–¥–µ–Ω—Ç–æ–º\n   > [!explanation] After \"–±—É–≤\" (was), professions take the instrumental case.\n   > [!options] —Å—Ç—É–¥–µ–Ω—Ç | —Å—Ç—É–¥–µ–Ω—Ç–æ–º | —Å—Ç—É–¥–µ–Ω—Ç–∞ | —Å—Ç—É–¥–µ–Ω—Ç—É\n\n2. –í–æ–Ω–∞ —Å—Ç–∞–ª–∞ –≤—á–∏—Ç–µ–ª—å–∫–∞.\n   > [!error] –≤—á–∏—Ç–µ–ª—å–∫–∞\n   > [!answer] –≤—á–∏—Ç–µ–ª—å–∫–æ—é\n   > [!explanation] \"–°—Ç–∞—Ç–∏\" always requires the instrumental case.\n   > [!options] –≤—á–∏—Ç–µ–ª—å–∫–∞ | –≤—á–∏—Ç–µ–ª—å–∫–æ—é | –≤—á–∏—Ç–µ–ª—å–∫—É | –≤—á–∏—Ç–µ–ª—å–∫–∏\n\n3. –Ø –ø—Ä–∞—Ü—é—é –ø—Ä–æ–≥—Ä–∞–º—ñ—Å—Ç.\n   > [!error] –ø—Ä–æ–≥—Ä–∞–º—ñ—Å—Ç\n   > [!answer] –ø—Ä–æ–≥—Ä–∞–º—ñ—Å—Ç–æ–º\n   > [!explanation] \"–ü—Ä–∞—Ü—é–≤–∞—Ç–∏\" + profession requires instrumental.\n   > [!options] –ø—Ä–æ–≥—Ä–∞–º—ñ—Å—Ç | –ø—Ä–æ–≥—Ä–∞–º—ñ—Å—Ç–æ–º | –ø—Ä–æ–≥—Ä–∞–º—ñ—Å—Ç–∞ | –ø—Ä–æ–≥—Ä–∞–º—ñ—Å—Ç—É\n\n4. –í—ñ–Ω –±—É–¥–µ –ª—ñ–∫–∞—Ä.\n   > [!error] –ª—ñ–∫–∞—Ä\n   > [!answer] –ª—ñ–∫–∞—Ä–µ–º\n   > [!explanation] Future \"–±—É–¥–µ\" + profession requires instrumental.\n   > [!options] –ª—ñ–∫–∞—Ä | –ª—ñ–∫–∞—Ä–µ–º | –ª—ñ–∫–∞—Ä—è | –ª—ñ–∫–∞—Ä—é\n\n5. –í–æ–Ω–∞ —Ö–æ—á–µ —Å—Ç–∞—Ç–∏ –∂—É—Ä–Ω–∞–ª—ñ—Å—Ç–∫–∞.\n   > [!error] –∂—É—Ä–Ω–∞–ª—ñ—Å—Ç–∫–∞\n   > [!answer] –∂—É—Ä–Ω–∞–ª—ñ—Å—Ç–∫–æ—é\n   > [!explanation] \"–°—Ç–∞—Ç–∏\" always requires the instrumental case.\n   > [!options] –∂—É—Ä–Ω–∞–ª—ñ—Å—Ç–∫–∞ | –∂—É—Ä–Ω–∞–ª—ñ—Å—Ç–∫–æ—é | –∂—É—Ä–Ω–∞–ª—ñ—Å—Ç–∫—É | –∂—É—Ä–Ω–∞–ª—ñ—Å—Ç–∫–∏\n\n6. –ú–∏ –±—É–ª–∏ –¥—Ä—É–∑—ñ.\n   > [!error] –¥—Ä—É–∑—ñ\n   > [!answer] –¥—Ä—É–∑—è–º–∏\n   > [!explanation] Past \"–±—É–ª–∏\" requires instrumental plural.\n   > [!options] –¥—Ä—É–∑—ñ | –¥—Ä—É–∑—è–º–∏ | –¥—Ä—É–∑—ñ–≤ | –¥—Ä—É–∑—è–º\n\n7. –í—ñ–Ω —Å—Ç–∞–ª–∞ —ñ–Ω–∂–µ–Ω–µ—Ä–æ–º.\n   > [!error] —Å—Ç–∞–ª–∞\n   > [!answer] —Å—Ç–∞–≤\n   > [!explanation] \"–í—ñ–Ω\" (he) requires masculine past form \"—Å—Ç–∞–≤.\"\n   > [!options] —Å—Ç–∞–ª–∞ | —Å—Ç–∞–≤ | —Å—Ç–∞–ª–æ | —Å—Ç–∞–ª–∏\n\n8. –í–æ–Ω–∞ –ø—Ä–∞—Ü—é—î –ª—ñ–∫–∞—Ä.\n   > [!error] –ª—ñ–∫–∞—Ä\n   > [!answer] –ª—ñ–∫–∞—Ä–∫–æ—é\n   > [!explanation] Use feminine \"–ª—ñ–∫–∞—Ä–∫–∞\" for woman + instrumental.\n   > [!options] –ª—ñ–∫–∞—Ä | –ª—ñ–∫–∞—Ä–∫–æ—é | –ª—ñ–∫–∞—Ä–∫—É | –ª—ñ–∫–∞—Ä–∫–∏\n\n9. –í—ñ–Ω –±—É–≤ –¥–∏—Ä–µ–∫—Ç–æ—Ä —à–∫–æ–ª–∏.\n   > [!error] –¥–∏—Ä–µ–∫—Ç–æ—Ä\n   > [!answer] –¥–∏—Ä–µ–∫—Ç–æ—Ä–æ–º\n   > [!explanation] Past \"–±—É–≤\" requires the instrumental case.\n   > [!options] –¥–∏—Ä–µ–∫—Ç–æ—Ä | –¥–∏—Ä–µ–∫—Ç–æ—Ä–æ–º | –¥–∏—Ä–µ–∫—Ç–æ—Ä–∞ | –¥–∏—Ä–µ–∫—Ç–æ—Ä—É\n\n10. –í–æ–Ω–∞ –±—É–¥–µ –ø–∏—Å—å–º–µ–Ω–Ω–∏–∫.\n    > [!error] –ø–∏—Å—å–º–µ–Ω–Ω–∏–∫\n    > [!answer] –ø–∏—Å—å–º–µ–Ω–Ω–∏—Ü–µ—é\n    > [!explanation] Use feminine \"–ø–∏—Å—å–º–µ–Ω–Ω–∏—Ü—è\" for woman + instrumental.\n    > [!options] –ø–∏—Å—å–º–µ–Ω–Ω–∏–∫ | –ø–∏—Å—å–º–µ–Ω–Ω–∏—Ü–µ—é | –ø–∏—Å—å–º–µ–Ω–Ω–∏—Ü—é | –ø–∏—Å—å–º–µ–Ω–Ω–∏—Ü—ñ\n\n11. –í—ñ–Ω –º—Ä—ñ—î —Å—Ç–∞—Ç–∏ –∞–∫—Ç–æ—Ä.\n    > [!error] –∞–∫—Ç–æ—Ä\n    > [!answer] –∞–∫—Ç–æ—Ä–æ–º\n    > [!explanation] \"–°—Ç–∞—Ç–∏\" always requires the instrumental case.\n    > [!options] –∞–∫—Ç–æ—Ä | –∞–∫—Ç–æ—Ä–æ–º | –∞–∫—Ç–æ—Ä–∞ | –∞–∫—Ç–æ—Ä—É\n\n12. –ú–∏ —Å—Ç–∞–Ω–µ–º–æ —ñ–Ω–∂–µ–Ω–µ—Ä–∏.\n    > [!error] —ñ–Ω–∂–µ–Ω–µ—Ä–∏\n    > [!answer] —ñ–Ω–∂–µ–Ω–µ—Ä–∞–º–∏\n    > [!explanation] Future of \"—Å—Ç–∞—Ç–∏\" requires instrumental plural.\n    > [!options] —ñ–Ω–∂–µ–Ω–µ—Ä–∏ | —ñ–Ω–∂–µ–Ω–µ—Ä–∞–º–∏ | —ñ–Ω–∂–µ–Ω–µ—Ä—ñ–≤ | —ñ–Ω–∂–µ–Ω–µ—Ä–∞–º\n\n## cloze: Complete the Story\n\n> Fill in the blanks with the correct words.\n\n–ú—ñ–π –¥—Ä—É–≥ –ê–Ω–¥—Ä—ñ–π —Ä–∞–Ω—ñ—à–µ [___:1]. –í—ñ–Ω –≤—á–∏–≤—Å—è –≤ —É–Ω—ñ–≤–µ—Ä—Å–∏—Ç–µ—Ç—ñ –ø'—è—Ç—å —Ä–æ–∫—ñ–≤. –ü—ñ—Å–ª—è —É–Ω—ñ–≤–µ—Ä—Å–∏—Ç–µ—Ç—É –≤—ñ–Ω [___:2]. –ó–∞—Ä–∞–∑ –≤—ñ–Ω [___:3] —É –≤–µ–ª–∏–∫—ñ–π –ª—ñ–∫–∞—Ä–Ω—ñ. –í—ñ–Ω –∫–∞–∂–µ, —â–æ –∑–∞–≤–∂–¥–∏ –º—Ä—ñ—è–≤ [___:4].\n\n1. –±—É–≤ —Å—Ç—É–¥–µ–Ω—Ç–æ–º | –±—É–≤ —Å—Ç—É–¥–µ–Ω—Ç | –±—É–≤ —Å—Ç—É–¥–µ–Ω—Ç–∞\n   > [!answer] –±—É–≤ —Å—Ç—É–¥–µ–Ω—Ç–æ–º\n\n2. —Å—Ç–∞–≤ –ª—ñ–∫–∞—Ä–µ–º | —Å—Ç–∞–≤ –ª—ñ–∫–∞—Ä | —Å—Ç–∞–≤ –ª—ñ–∫–∞—Ä—è\n   > [!answer] —Å—Ç–∞–≤ –ª—ñ–∫–∞—Ä–µ–º\n\n3. –ø—Ä–∞—Ü—é—î –ª—ñ–∫–∞—Ä–µ–º | –ø—Ä–∞—Ü—é—î –ª—ñ–∫–∞—Ä | –ø—Ä–∞—Ü—é—î –ª—ñ–∫–∞—Ä—è\n   > [!answer] –ø—Ä–∞—Ü—é—î –ª—ñ–∫–∞—Ä–µ–º\n\n4. —Å—Ç–∞—Ç–∏ –ª—ñ–∫–∞—Ä–µ–º | —Å—Ç–∞—Ç–∏ –ª—ñ–∫–∞—Ä | —Å—Ç–∞—Ç–∏ –ª—ñ–∫–∞—Ä—è\n   > [!answer] —Å—Ç–∞—Ç–∏ –ª—ñ–∫–∞—Ä–µ–º\n\n---\n\n–ú–æ—è —Å–µ—Å—Ç—Ä–∞ –û–∫—Å–∞–Ω–∞ [___:1] –≤ –∂—É—Ä–Ω–∞–ª—ñ –ø'—è—Ç—å —Ä–æ–∫—ñ–≤. –ü–æ—Ç—ñ–º –≤–æ–Ω–∞ [___:2]. –¢–µ–ø–µ—Ä –≤–æ–Ω–∞ [___:3]. –í–æ–Ω–∞ –Ω–∞–ø–∏—Å–∞–ª–∞ —Ç—Ä–∏ –∫–Ω–∏–≥–∏. –Ø –ø–∏—à–∞—é—Å—è, —â–æ –º–æ—è —Å–µ—Å—Ç—Ä–∞ [___:4]!\n\n1. –ø—Ä–∞—Ü—é–≤–∞–ª–∞ –∂—É—Ä–Ω–∞–ª—ñ—Å—Ç–∫–æ—é | –ø—Ä–∞—Ü—é–≤–∞–ª–∞ –∂—É—Ä–Ω–∞–ª—ñ—Å—Ç–∫–∞ | –ø—Ä–∞—Ü—é–≤–∞–ª–∞ –∂—É—Ä–Ω–∞–ª—ñ—Å—Ç–∫—É\n   > [!answer] –ø—Ä–∞—Ü—é–≤–∞–ª–∞ –∂—É—Ä–Ω–∞–ª—ñ—Å—Ç–∫–æ—é\n\n2. —Å—Ç–∞–ª–∞ –ø–∏—Å—å–º–µ–Ω–Ω–∏—Ü–µ—é | —Å—Ç–∞–ª–∞ –ø–∏—Å—å–º–µ–Ω–Ω–∏—Ü—è | —Å—Ç–∞–ª–∞ –ø–∏—Å—å–º–µ–Ω–Ω–∏—Ü—é\n   > [!answer] —Å—Ç–∞–ª–∞ –ø–∏—Å—å–º–µ–Ω–Ω–∏—Ü–µ—é\n\n3. –ø–∏—à–µ –∫–Ω–∏–≥–∏ | –ø–∏—à–µ –∫–Ω–∏–∂–∫–∏ | –ø–∏—à–µ —Ä–æ–º–∞–Ω–∏\n   > [!answer] –ø–∏—à–µ –∫–Ω–∏–≥–∏\n\n4. —Å—Ç–∞–ª–∞ –ø–∏—Å—å–º–µ–Ω–Ω–∏—Ü–µ—é | —Å—Ç–∞–ª–∞ –∂—É—Ä–Ω–∞–ª—ñ—Å—Ç–∫–æ—é | –ø—Ä–∞—Ü—é—î –ø–∏—Å—å–º–µ–Ω–Ω–∏—Ü–µ—é\n   > [!answer] —Å—Ç–∞–ª–∞ –ø–∏—Å—å–º–µ–Ω–Ω–∏—Ü–µ—é\n\n## dialogue-reorder: Job Interview\n\n- –Ø –±—É–≤ –∂—É—Ä–Ω–∞–ª—ñ—Å—Ç–æ–º –ø'—è—Ç—å —Ä–æ–∫—ñ–≤.\n- –î–æ–±—Ä–∏–π –¥–µ–Ω—å! –°—ñ–¥–∞–π—Ç–µ, –±—É–¥—å –ª–∞—Å–∫–∞.\n- –î—è–∫—É—é! –î–æ –ø–æ–±–∞—á–µ–Ω–Ω—è!\n- –ö–∏–º –≤–∏ –ø—Ä–∞—Ü—é–≤–∞–ª–∏ —Ä–∞–Ω—ñ—à–µ?\n- –î–æ–±—Ä–∏–π –¥–µ–Ω—å!\n- –ú–∏ –∑–∞—Ç–µ–ª–µ—Ñ–æ–Ω—É—î–º–æ –≤–∞–º –∑–∞–≤—Ç—Ä–∞.\n- –ß–æ–º—É —Ö–æ—á–µ—Ç–µ —Å—Ç–∞—Ç–∏ –ø—Ä–æ–≥—Ä–∞–º—ñ—Å—Ç–æ–º?\n- –ú–µ–Ω—ñ –ø–æ–¥–æ–±–∞—é—Ç—å—Å—è —Ç–µ—Ö–Ω–æ–ª–æ–≥—ñ—ó —ñ —è —Ö–æ—á—É –ø—Ä–∞—Ü—é–≤–∞—Ç–∏ –≤ IT.\n\n> [!answer]\n> 1. –î–æ–±—Ä–∏–π –¥–µ–Ω—å!\n> 2. –î–æ–±—Ä–∏–π –¥–µ–Ω—å! –°—ñ–¥–∞–π—Ç–µ, –±—É–¥—å –ª–∞—Å–∫–∞.\n> 3. –ö–∏–º –≤–∏ –ø—Ä–∞—Ü—é–≤–∞–ª–∏ —Ä–∞–Ω—ñ—à–µ?\n> 4. –Ø –±—É–≤ –∂—É—Ä–Ω–∞–ª—ñ—Å—Ç–æ–º –ø'—è—Ç—å —Ä–æ–∫—ñ–≤.\n> 5. –ß–æ–º—É —Ö–æ—á–µ—Ç–µ —Å—Ç–∞—Ç–∏ –ø—Ä–æ–≥—Ä–∞–º—ñ—Å—Ç–æ–º?\n> 6. –ú–µ–Ω—ñ –ø–æ–¥–æ–±–∞—é—Ç—å—Å—è —Ç–µ—Ö–Ω–æ–ª–æ–≥—ñ—ó —ñ —è —Ö–æ—á—É –ø—Ä–∞—Ü—é–≤–∞—Ç–∏ –≤ IT.\n> 7. –ú–∏ –∑–∞—Ç–µ–ª–µ—Ñ–æ–Ω—É—î–º–æ –≤–∞–º –∑–∞–≤—Ç—Ä–∞.\n> 8. –î—è–∫—É—é! –î–æ –ø–æ–±–∞—á–µ–Ω–Ω—è!\n\n---\n\n- –í—ñ–Ω –±—É–≤ —Å—Ç—É–¥–µ–Ω—Ç–æ–º –ø–æ–ª—ñ—Ç–µ—Ö–Ω—ñ–∫–∏.\n- –ö–∏–º –ø—Ä–∞—Ü—é—î —Ç–≤—ñ–π —Ç–∞—Ç–æ?\n- –í—ñ–Ω –ø—Ä–∞—Ü—é—î –ø—Ä–æ–≥—Ä–∞–º—ñ—Å—Ç–æ–º —É –∫–æ–º–ø–∞–Ω—ñ—ó.\n- –ö—Ä—É—Ç–æ! –ê –∫–∏–º –≤—ñ–Ω —Ö–æ—á–µ —Å—Ç–∞—Ç–∏?\n- –ö–∏–º –≤—ñ–Ω –±—É–≤ —Ä–∞–Ω—ñ—à–µ?\n- –í—ñ–Ω —Ö–æ—á–µ —Å—Ç–∞—Ç–∏ –¥–∏—Ä–µ–∫—Ç–æ—Ä–æ–º –∑–∞–≤–æ–¥—É!\n\n> [!answer]\n> 1. –ö–∏–º –ø—Ä–∞—Ü—é—î —Ç–≤—ñ–π —Ç–∞—Ç–æ?\n> 2. –í—ñ–Ω –ø—Ä–∞—Ü—é—î –ø—Ä–æ–≥—Ä–∞–º—ñ—Å—Ç–æ–º —É –∫–æ–º–ø–∞–Ω—ñ—ó.\n> 3. –ö–∏–º –≤—ñ–Ω –±—É–≤ —Ä–∞–Ω—ñ—à–µ?\n> 4. –í—ñ–Ω –±—É–≤ —Å—Ç—É–¥–µ–Ω—Ç–æ–º –ø–æ–ª—ñ—Ç–µ—Ö–Ω—ñ–∫–∏.\n> 5. –ö—Ä—É—Ç–æ! –ê –∫–∏–º –≤—ñ–Ω —Ö–æ—á–µ —Å—Ç–∞—Ç–∏?\n> 6. –í—ñ–Ω —Ö–æ—á–µ —Å—Ç–∞—Ç–∏ –¥–∏—Ä–µ–∫—Ç–æ—Ä–æ–º –∑–∞–≤–æ–¥—É!\n\n## mark-the-words: Find Instrumental Forms\n\nClick on instrumental forms used with –±—É—Ç–∏/—Å—Ç–∞—Ç–∏/–ø—Ä–∞—Ü—é–≤–∞—Ç–∏.\n\n–í—ñ–Ω —Ä–∞–Ω—ñ—à–µ [–±—É–≤ —Å—Ç—É–¥–µ–Ω—Ç–æ–º](correct). –ó–∞—Ä–∞–∑ –≤—ñ–Ω –ª—ñ–∫–∞—Ä. –í—ñ–Ω [–ø—Ä–∞—Ü—é—î –ª—ñ–∫–∞—Ä–µ–º](correct) —É –ª—ñ–∫–∞—Ä–Ω—ñ. –ô–æ–≥–æ —Å–µ—Å—Ç—Ä–∞ [—Å—Ç–∞–ª–∞ –≤—á–∏—Ç–µ–ª—å–∫–æ—é](correct).\n\n---\n\n–í–æ–Ω–∞ [–±—É–ª–∞ –∂—É—Ä–Ω–∞–ª—ñ—Å—Ç–∫–æ—é](correct) –ø'—è—Ç—å —Ä–æ–∫—ñ–≤. –ü–æ—Ç—ñ–º –≤–æ–Ω–∞ [—Å—Ç–∞–ª–∞ –ø–∏—Å—å–º–µ–Ω–Ω–∏—Ü–µ—é](correct). –ó–∞—Ä–∞–∑ –≤–æ–Ω–∞ –ø–∏—Å—å–º–µ–Ω–Ω–∏—Ü—è. –í–æ–Ω–∞ [–ø—Ä–∞—Ü—é—î –ø–∏—Å—å–º–µ–Ω–Ω–∏—Ü–µ—é](correct).\n\n---\n\n–ú—ñ–π –±—Ä–∞—Ç —ñ–Ω–∂–µ–Ω–µ—Ä. –†–∞–Ω—ñ—à–µ –≤—ñ–Ω [–±—É–≤ —Å—Ç—É–¥–µ–Ω—Ç–æ–º](correct). –í—ñ–Ω [—Ö–æ—á–µ —Å—Ç–∞—Ç–∏ –¥–∏—Ä–µ–∫—Ç–æ—Ä–æ–º](correct). –í—ñ–Ω [–ø—Ä–∞—Ü—é—î —ñ–Ω–∂–µ–Ω–µ—Ä–æ–º](correct) –Ω–∞ –∑–∞–≤–æ–¥—ñ.\n\n## translate: English to Ukrainian\n\nHe was a student.\n\n- [x] –í—ñ–Ω –±—É–≤ —Å—Ç—É–¥–µ–Ω—Ç–æ–º.\n- [ ] –í—ñ–Ω –±—É–≤ —Å—Ç—É–¥–µ–Ω—Ç.\n- [ ] –í—ñ–Ω –±—É–≤ —Å—Ç—É–¥–µ–Ω—Ç–∞.\n\n---\n\nShe became a teacher.\n\n- [x] –í–æ–Ω–∞ —Å—Ç–∞–ª–∞ –≤—á–∏—Ç–µ–ª—å–∫–æ—é.\n- [ ] –í–æ–Ω–∞ —Å—Ç–∞–ª–∞ –≤—á–∏—Ç–µ–ª—å–∫–∞.\n- [ ] –í–æ–Ω–∞ —Å—Ç–∞–ª–∞ –≤—á–∏—Ç–µ–ª—å–∫—É.\n\n---\n\nI work as a programmer.\n\n- [x] –Ø –ø—Ä–∞—Ü—é—é –ø—Ä–æ–≥—Ä–∞–º—ñ—Å—Ç–æ–º.\n- [ ] –Ø –ø—Ä–∞—Ü—é—é –ø—Ä–æ–≥—Ä–∞–º—ñ—Å—Ç.\n- [ ] –Ø –ø—Ä–∞—Ü—é—é –ø—Ä–æ–≥—Ä–∞–º—ñ—Å—Ç–∞.\n\n---\n\nHe will be a doctor.\n\n- [x] –í—ñ–Ω –±—É–¥–µ –ª—ñ–∫–∞—Ä–µ–º.\n- [ ] –í—ñ–Ω –±—É–¥–µ –ª—ñ–∫–∞—Ä.\n- [ ] –í—ñ–Ω –±—É–¥–µ –ª—ñ–∫–∞—Ä—è.\n\n---\n\nShe wants to become a journalist.\n\n- [x] –í–æ–Ω–∞ —Ö–æ—á–µ —Å—Ç–∞—Ç–∏ –∂—É—Ä–Ω–∞–ª—ñ—Å—Ç–∫–æ—é.\n- [ ] –í–æ–Ω–∞ —Ö–æ—á–µ —Å—Ç–∞—Ç–∏ –∂—É—Ä–Ω–∞–ª—ñ—Å—Ç–∫–∞.\n- [ ] –í–æ–Ω–∞ —Ö–æ—á–µ —Å—Ç–∞—Ç–∏ –∂—É—Ä–Ω–∞–ª—ñ—Å—Ç–∫—É.\n\n---\n\nWe were friends.\n\n- [x] –ú–∏ –±—É–ª–∏ –¥—Ä—É–∑—è–º–∏.\n- [ ] –ú–∏ –±—É–ª–∏ –¥—Ä—É–∑—ñ.\n- [ ] –ú–∏ –±—É–ª–∏ –¥—Ä—É–∑—ñ–≤.\n\n---\n\nWhat do you work as?\n\n- [x] –ö–∏–º —Ç–∏ –ø—Ä–∞—Ü—é—î—à?\n- [ ] –©–æ —Ç–∏ –ø—Ä–∞—Ü—é—î—à?\n- [ ] –•—Ç–æ —Ç–∏ –ø—Ä–∞—Ü—é—î—à?\n\n---\n\nHe dreams of becoming a writer.\n\n- [x] –í—ñ–Ω –º—Ä—ñ—î —Å—Ç–∞—Ç–∏ –ø–∏—Å—å–º–µ–Ω–Ω–∏–∫–æ–º.\n- [ ] –í—ñ–Ω –º—Ä—ñ—î —Å—Ç–∞—Ç–∏ –ø–∏—Å—å–º–µ–Ω–Ω–∏–∫.\n- [ ] –í—ñ–Ω –º—Ä—ñ—î —Å—Ç–∞—Ç–∏ –ø–∏—Å—å–º–µ–Ω–Ω–∏–∫–∞.\n\n---\n\nShe worked as a secretary.\n\n- [x] –í–æ–Ω–∞ –ø—Ä–∞—Ü—é–≤–∞–ª–∞ —Å–µ–∫—Ä–µ—Ç–∞—Ä–∫–æ—é.\n- [ ] –í–æ–Ω–∞ –ø—Ä–∞—Ü—é–≤–∞–ª–∞ —Å–µ–∫—Ä–µ—Ç–∞—Ä–∫–∞.\n- [ ] –í–æ–Ω–∞ –ø—Ä–∞—Ü—é–≤–∞–ª–∞ —Å–µ–∫—Ä–µ—Ç–∞—Ä–∫—É.\n\n---\n\nThey will become engineers.\n\n- [x] –í–æ–Ω–∏ —Å—Ç–∞–Ω—É—Ç—å —ñ–Ω–∂–µ–Ω–µ—Ä–∞–º–∏.\n- [ ] –í–æ–Ω–∏ —Å—Ç–∞–Ω—É—Ç—å —ñ–Ω–∂–µ–Ω–µ—Ä–∏.\n- [ ] –í–æ–Ω–∏ —Å—Ç–∞–Ω—É—Ç—å —ñ–Ω–∂–µ–Ω–µ—Ä—ñ–≤.\n\n---\n\nHe was the director of the school.\n\n- [x] –í—ñ–Ω –±—É–≤ –¥–∏—Ä–µ–∫—Ç–æ—Ä–æ–º —à–∫–æ–ª–∏.\n- [ ] –í—ñ–Ω –±—É–≤ –¥–∏—Ä–µ–∫—Ç–æ—Ä —à–∫–æ–ª–∏.\n- [ ] –í—ñ–Ω –±—É–≤ –¥–∏—Ä–µ–∫—Ç–æ—Ä–∞ —à–∫–æ–ª–∏.\n\n---\n\nShe wanted to become an actress.\n\n- [x] –í–æ–Ω–∞ —Ö–æ—Ç—ñ–ª–∞ —Å—Ç–∞—Ç–∏ –∞–∫—Ç–æ—Ä–∫–æ—é.\n- [ ] –í–æ–Ω–∞ —Ö–æ—Ç—ñ–ª–∞ —Å—Ç–∞—Ç–∏ –∞–∫—Ç–æ—Ä–∫–∞.\n- [ ] –í–æ–Ω–∞ —Ö–æ—Ç—ñ–ª–∞ —Å—Ç–∞—Ç–∏ –∞–∫—Ç–æ—Ä–∫—É.\n\n---"
      },
      {
        "id": "section-8",
        "name": "Vocabulary",
        "nameEn": null,
        "type": "vocabulary",
        "content": "| Word | IPA | English | POS | Gender | Note |\n|------|-----|---------|-----|--------|------|\n| –±—É—Ç–∏ | /Ààbut…™/ | to be | verb | ‚Äî | uses instrumental in past/future |\n| —Å—Ç–∞—Ç–∏ | /Ààst…ët…™/ | to become | verb | ‚Äî | perfective, always + instrumental |\n| —Å—Ç–∞–≤–∞—Ç–∏ | /st…ëÀà ã…ët…™/ | to become | verb | ‚Äî | imperfective of —Å—Ç–∞—Ç–∏ |\n| –ø—Ä–∞—Ü—é–≤–∞—Ç–∏ | /pr…ëÀàtÕ°s ≤u ã…ët…™/ | to work | verb | ‚Äî | + instr. for profession |\n| —Å–ª—É–∂–∏—Ç–∏ | /sluÀà í…™t…™/ | to serve | verb | ‚Äî | + instr. for role |\n| –∑–∞–ª–∏—à–∞—Ç–∏—Å—è | /z…ël…™Àà É…ët…™s ≤…ë/ | to remain | verb | ‚Äî | + instr. for state |\n| –≤–∏—è–≤–∏—Ç–∏—Å—è | / ã…™j…ëÀà ã…™t…™s ≤…ë/ | to turn out to be | verb | ‚Äî | + instr. |\n| –∑–¥–∞–≤–∞—Ç–∏—Å—è | /zd…ëÀà ã…ët…™s ≤…ë/ | to seem | verb | ‚Äî | + instr. |\n| –≤–≤–∞–∂–∞—Ç–∏—Å—è | /w…ëÀà í…ët…™s ≤…ë/ | to be considered | verb | ‚Äî | + instr. |\n| –Ω–∞–∑–∏–≤–∞—Ç–∏—Å—è | /n…ëz…™Àà ã…ët…™s ≤…ë/ | to be called | verb | ‚Äî | + instr. |\n| –ª—ñ–∫–∞—Ä | /Ààlik…ër/ | doctor (m) | noun | m | instr: –ª—ñ–∫–∞—Ä–µ–º |\n| –≤—á–∏—Ç–µ–ª—å | /Àà ãt É…™t…õl ≤/ | teacher (m) | noun | m | instr: –≤—á–∏—Ç–µ–ª–µ–º |\n| —ñ–Ω–∂–µ–Ω–µ—Ä | /in í…õÀàn…õr/ | engineer | noun | m | instr: —ñ–Ω–∂–µ–Ω–µ—Ä–æ–º |\n| –ø—Ä–æ–≥—Ä–∞–º—ñ—Å—Ç | /pr…î…¶r…ëÀàmist/ | programmer (m) | noun | m | instr: –ø—Ä–æ–≥—Ä–∞–º—ñ—Å—Ç–æ–º |\n| –∂—É—Ä–Ω–∞–ª—ñ—Å—Ç | / íurn…ëÀàlist/ | journalist (m) | noun | m | instr: –∂—É—Ä–Ω–∞–ª—ñ—Å—Ç–æ–º |\n| —é—Ä–∏—Å—Ç | /juÀàr…™st/ | lawyer | noun | m | instr: —é—Ä–∏—Å—Ç–æ–º |\n| –µ–∫–æ–Ω–æ–º—ñ—Å—Ç | /…õk…îÀàn…îmist/ | economist | noun | m | instr: –µ–∫–æ–Ω–æ–º—ñ—Å—Ç–æ–º |\n| —Ö—É–¥–æ–∂–Ω–∏–∫ | /xuÀàd…î ín…™k/ | artist | noun | m | instr: —Ö—É–¥–æ–∂–Ω–∏–∫–æ–º |\n| –º—É–∑–∏–∫–∞–Ω—Ç | /muz…™Ààk…ënt/ | musician | noun | m | instr: –º—É–∑–∏–∫–∞–Ω—Ç–æ–º |\n| –ø–∏—Å—å–º–µ–Ω–Ω–∏–∫ | /p…™s ≤Ààm…õnÀê…™k/ | writer (m) | noun | m | instr: –ø–∏—Å—å–º–µ–Ω–Ω–∏–∫–æ–º |\n| –∞–∫—Ç–æ—Ä | /Àà…ëkt…îr/ | actor (m) | noun | m | instr: –∞–∫—Ç–æ—Ä–æ–º |\n| –¥–∏—Ä–µ–∫—Ç–æ—Ä | /d…™Ààr…õkt…îr/ | director | noun | m | instr: –¥–∏—Ä–µ–∫—Ç–æ—Ä–æ–º |\n| –º–µ–Ω–µ–¥–∂–µ—Ä | /Ààm…õn…õd í…õr/ | manager | noun | m | instr: –º–µ–Ω–µ–¥–∂–µ—Ä–æ–º |\n| —Å–µ–∫—Ä–µ—Ç–∞—Ä | /s…õkr…õÀàt…ër/ | secretary (m) | noun | m | instr: —Å–µ–∫—Ä–µ—Ç–∞—Ä–µ–º |\n| –≤–æ–¥—ñ–π | / É…îÀàdij/ | driver | noun | m | instr: –≤–æ–¥—ñ—î–º |\n| –æ—Ä—É–¥–Ω–∏–π | /…îÀàrudn…™j/ | instrumental (case) | adj | m | grammar term |\n| –≤—ñ–¥–º—ñ–Ω–æ–∫ | / ÉidÀàmin…îk/ | grammatical case | noun | m | grammar term |\n| —á–∞—Å | /t É…ës/ | tense, time | noun | m | grammar term |\n\n---\n\n> [!tip] Remember the Key Verbs\n> Three verbs that take instrumental for professions: **–±—É—Ç–∏** (to be, past/future), **—Å—Ç–∞—Ç–∏** (to become), **–ø—Ä–∞—Ü—é–≤–∞—Ç–∏** (to work as). Master these and you can talk about any career!"
      }
    ],
    "rawMarkdown": "---\nmodule: a2-06\ntitle: \"Being and Becoming\"\nsubtitle: \"Professions and States with Instrumental\"\nversion: \"1.0\"\nphase: \"A2.1\"\npedagogy: \"PPP\"\nduration: \"60 min\"\ntransliteration: none\ntags:\n  - grammar\n  - cases\n  - instrumental\n  - professions\n  - –±—É—Ç–∏\n  - —Å—Ç–∞—Ç–∏\ngrammar:\n  - instrumental with –±—É—Ç–∏\n  - instrumental with —Å—Ç–∞—Ç–∏\n  - instrumental with –ø—Ä–∞—Ü—é–≤–∞—Ç–∏\nobjectives:\n  - \"Learner can use instrumental to express profession with –±—É—Ç–∏\"\n  - \"Learner can use instrumental to describe becoming something with —Å—Ç–∞—Ç–∏\"\n  - \"Learner can use instrumental to express working as with –ø—Ä–∞—Ü—é–≤–∞—Ç–∏\"\n  - \"Learner can distinguish present (no copula) from past/future (–±—É—Ç–∏ + Instr)\"\nvocabulary_count: 25\n---\n# Warm-up\n\nIn previous modules, you learned about the instrumental case: with the preposition **–∑** for accompaniment and without a preposition for transport and tools. Now it's time to discover another important use of the instrumental case ‚Äî with the verbs **–±—É—Ç–∏** (to be), **—Å—Ç–∞—Ç–∏** (to become), and **–ø—Ä–∞—Ü—é–≤–∞—Ç–∏** (to work as)!\n\nWhen you want to say \"He is a doctor,\" \"She became a teacher,\" or \"I work as a programmer,\" Ukrainian uses the instrumental case. This is one of the most practical uses of the instrumental ‚Äî talking about what people are and what they do!\n\n**Why is this important?** Talking about professions is a fundamental skill in any language. By the end of this module, you'll be able to describe your job, discuss career changes, and ask others about their work ‚Äî all using proper Ukrainian grammar.\n\n> [!resources] üîó External Resources\n>\n> **YouTube:** [Bandura: The traditional Ukrainian instrument that's also a symbol of ...](https://www.youtube.com/watch?v=AcrRlIR9_Ew) ‚Äî Instrumental\n>\n> **Grammar Guide:** [Ukrainian Cases Overview](https://www.ukrainianlessons.com/intro-cases/) ‚Äî All 7 cases explained\n>\n> **Interactive:** [Talk Ukrainian - Cases](https://talkukrainian.com/grammatical-cases/) ‚Äî Practice exercises\n\n---\n\n# Presentation\n\n## –ë—É—Ç–∏ + Instrumental: Being Something\n\nIn Ukrainian, the present tense of \"to be\" is usually zero ‚Äî we don't use a verb: –í—ñ–Ω –ª—ñ–∫–∞—Ä. (He is a doctor.) But in the **past** and **future** tenses, we use **–±—É—Ç–∏** + **Instrumental**:\n\n| Tense | Pattern | Example |\n|-------|---------|---------|\n| Present | –í—ñ–Ω –ª—ñ–∫–∞—Ä. | He is a doctor. (no verb, nominative) |\n| Past | –í—ñ–Ω **–±—É–≤ –ª—ñ–∫–∞—Ä–µ–º**. | He was a doctor. (–±—É—Ç–∏ + instrumental) |\n| Future | –í—ñ–Ω **–±—É–¥–µ –ª—ñ–∫–∞—Ä–µ–º**. | He will be a doctor. (–±—É—Ç–∏ + instrumental) |\n\n### Past Tense: –±—É–≤/–±—É–ª–∞/–±—É–ª–æ/–±—É–ª–∏ + Instrumental\n\nWhen talking about what someone WAS in the past, you use the past tense of \"–±—É—Ç–∏\" followed by the instrumental case. The past tense agrees in gender with the subject: **–≤—ñ–Ω –±—É–≤** (masculine), **–≤–æ–Ω–∞ –±—É–ª–∞** (feminine), **–≤–æ–Ω–æ –±—É–ª–æ** (neuter), **–≤–æ–Ω–∏ –±—É–ª–∏** (plural).\n\n–í—ñ–Ω –±—É–≤ —Å—Ç—É–¥–µ–Ω—Ç–æ–º. (He was a student.)\n–í–æ–Ω–∞ –±—É–ª–∞ –≤—á–∏—Ç–µ–ª—å–∫–æ—é. (She was a teacher.)\n–ú–∏ –±—É–ª–∏ –¥—Ä—É–∑—è–º–∏. (We were friends.)\n\nNotice how the profession changes to instrumental: —Å—Ç—É–¥–µ–Ω—Ç ‚Üí —Å—Ç—É–¥–µ–Ω—Ç–æ–º, –≤—á–∏—Ç–µ–ª—å–∫–∞ ‚Üí –≤—á–∏—Ç–µ–ª—å–∫–æ—é.\n\n### Future Tense: –±—É–¥–µ/–±—É–¥—É—Ç—å + Instrumental\n\nFor the future tense, use **–±—É–¥–µ** for singular subjects or **–±—É–¥—É—Ç—å** for plural subjects, followed by the instrumental case. This is how you express what someone WILL BE:\n\n–í—ñ–Ω –±—É–¥–µ –ª—ñ–∫–∞—Ä–µ–º. (He will be a doctor.)\n–í–æ–Ω–∞ –±—É–¥–µ –∂—É—Ä–Ω–∞–ª—ñ—Å—Ç–∫–æ—é. (She will be a journalist.)\n–í–æ–Ω–∏ –±—É–¥—É—Ç—å —ñ–Ω–∂–µ–Ω–µ—Ä–∞–º–∏. (They will be engineers.)\n\nThe pattern is consistent: –±—É—Ç–∏ in past or future + noun in instrumental case.\n\n> üí° **Did You Know?**\n>\n> The present tense \"zero copula\" (no verb \"to be\") is a distinctive feature of Ukrainian and many Slavic languages. Russians use \"—ç—Ç–æ\" for \"this is,\" but Ukrainians simply say \"–¶–µ.\" When Ukrainians speak English, they sometimes forget \"is\" because their brain doesn't expect a copula in present tense!\n\n## –°—Ç–∞—Ç–∏ + Instrumental: Becoming Something\n\nThe verb **—Å—Ç–∞—Ç–∏** (to become) is one of the most important verbs in Ukrainian for talking about changes in profession or state. Unlike –±—É—Ç–∏, which uses instrumental only in past and future, —Å—Ç–∞—Ç–∏ ALWAYS takes the instrumental case, in all tenses:\n\n–í–æ–Ω–∞ —Å—Ç–∞–ª–∞ –≤—á–∏—Ç–µ–ª—å–∫–æ—é. (She became a teacher.)\n–í—ñ–Ω —Å—Ç–∞–≤ –ª—ñ–∫–∞—Ä–µ–º. (He became a doctor.)\n–ú–∏ —Å—Ç–∞–ª–∏ –¥—Ä—É–∑—è–º–∏. (We became friends.)\n\nThis verb is perfective (completed action), so it's typically used in past and future. The imperfective counterpart is —Å—Ç–∞–≤–∞—Ç–∏ (to be becoming).\n\n### Conjugation of —Å—Ç–∞—Ç–∏ (perfective, past + future)\n\n| Past | Future |\n|------|--------|\n| —è —Å—Ç–∞–≤ / —Å—Ç–∞–ª–∞ | —è —Å—Ç–∞–Ω—É |\n| —Ç–∏ —Å—Ç–∞–≤ / —Å—Ç–∞–ª–∞ | —Ç–∏ —Å—Ç–∞–Ω–µ—à |\n| –≤—ñ–Ω —Å—Ç–∞–≤ | –≤—ñ–Ω —Å—Ç–∞–Ω–µ |\n| –≤–æ–Ω–∞ —Å—Ç–∞–ª–∞ | –≤–æ–Ω–∞ —Å—Ç–∞–Ω–µ |\n| –º–∏ —Å—Ç–∞–ª–∏ | –º–∏ —Å—Ç–∞–Ω–µ–º–æ |\n| –≤–∏ —Å—Ç–∞–ª–∏ | –≤–∏ —Å—Ç–∞–Ω–µ—Ç–µ |\n| –≤–æ–Ω–∏ —Å—Ç–∞–ª–∏ | –≤–æ–Ω–∏ —Å—Ç–∞–Ω—É—Ç—å |\n\n–í–æ–Ω–∞ —Ö–æ—á–µ —Å—Ç–∞—Ç–∏ –ª—ñ–∫–∞—Ä–∫–æ—é. (She wants to become a doctor.)\n–í—ñ–Ω –º—Ä—ñ—î —Å—Ç–∞—Ç–∏ –ø–∏—Å—å–º–µ–Ω–Ω–∏–∫–æ–º. (He dreams of becoming a writer.)\n–ö–æ–ª–∏ —Ç–∏ —Å—Ç–∞–Ω–µ—à —ñ–Ω–∂–µ–Ω–µ—Ä–æ–º? (When will you become an engineer?)\n\n> üìú **History Bite**\n>\n> Many famous Ukrainians changed professions dramatically: –¢–∞—Ä–∞—Å –®–µ–≤—á–µ–Ω–∫–æ **–±—É–≤ –∫—Ä—ñ–ø–∞–∫–æ–º** (was a serf), –∞–ª–µ **—Å—Ç–∞–≤ –≤–µ–ª–∏–∫–∏–º –ø–æ–µ—Ç–æ–º** (became a great poet). –õ–µ—Å—è –£–∫—Ä–∞—ó–Ω–∫–∞ —Ö–æ—Ç—ñ–ª–∞ —Å—Ç–∞—Ç–∏ –º—É–∑–∏–∫–æ—é, –∞–ª–µ —Å—Ç–∞–ª–∞ –≥–µ–Ω—ñ–∞–ª—å–Ω–æ—é –ø–∏—Å—å–º–µ–Ω–Ω–∏—Ü–µ—é. Their stories of becoming are told in the instrumental case!\n\n## –ü—Ä–∞—Ü—é–≤–∞—Ç–∏ + Instrumental: Working As\n\nThe verb **–ø—Ä–∞—Ü—é–≤–∞—Ç–∏** (to work) is used with the instrumental case to express what profession someone works as. This is different from English, where we use \"as\" + profession. In Ukrainian, no preposition is needed ‚Äî just put the profession in instrumental:\n\n–Ø –ø—Ä–∞—Ü—é—é –ø—Ä–æ–≥—Ä–∞–º—ñ—Å—Ç–æ–º. (I work as a programmer.)\n–í–æ–Ω–∞ –ø—Ä–∞—Ü—é—î –∂—É—Ä–Ω–∞–ª—ñ—Å—Ç–∫–æ—é. (She works as a journalist.)\n–í—ñ–Ω –ø—Ä–∞—Ü—é—î –≤–æ–¥—ñ—î–º. (He works as a driver.)\n\nThe question word for \"as what\" is **–∫–∏–º?** ‚Äî the instrumental form of **—Ö—Ç–æ** (who).\n\nNote that you can also use **–∫–∏–º?** (as whom?) ‚Äî this is the instrumental of **—Ö—Ç–æ**:\n\n‚Äî –ö–∏–º —Ç–∏ –ø—Ä–∞—Ü—é—î—à? (What do you work as?)\n‚Äî –Ø –ø—Ä–∞—Ü—é—é –≤—á–∏—Ç–µ–ª–µ–º. (I work as a teacher.)\n\n### Common Profession Verbs with Instrumental\n\nHere are the most common verbs that take the instrumental case when followed by a profession or role. Learning these patterns will help you talk about careers fluently:\n\n| Verb | Meaning | Example |\n|------|---------|---------|\n| –±—É—Ç–∏ (past/future) | to be | –í—ñ–Ω –±—É–≤ —Å—Ç—É–¥–µ–Ω—Ç–æ–º. |\n| —Å—Ç–∞—Ç–∏ | to become | –í–æ–Ω–∞ —Å—Ç–∞–ª–∞ –ª—ñ–∫–∞—Ä–∫–æ—é. |\n| –ø—Ä–∞—Ü—é–≤–∞—Ç–∏ | to work as | –Ø –ø—Ä–∞—Ü—é—é —ñ–Ω–∂–µ–Ω–µ—Ä–æ–º. |\n| —Å–ª—É–∂–∏—Ç–∏ | to serve as | –í—ñ–Ω —Å–ª—É–∂–∏—Ç—å —Å–æ–ª–¥–∞—Ç–æ–º. |\n| –∑–∞–ª–∏—à–∞—Ç–∏—Å—è | to remain | –í–æ–Ω–∞ –∑–∞–ª–∏—à–∞—î—Ç—å—Å—è –¥–∏—Ä–µ–∫—Ç–æ—Ä–∫–æ—é. |\n\nNote that all these verbs follow the same pattern: verb + profession in instrumental case.\n\n> [!example] –£ –∫–∞—Ñ–µ\n> ‚Äî –ö–∏–º –ø—Ä–∞—Ü—é—î —Ç–≤—ñ–π –±—Ä–∞—Ç?\n> ‚Äî –í—ñ–Ω –ø—Ä–∞—Ü—é—î –ø—Ä–æ–≥—Ä–∞–º—ñ—Å—Ç–æ–º —É –≤–µ–ª–∏–∫—ñ–π –∫–æ–º–ø–∞–Ω—ñ—ó.\n> ‚Äî –ê —Ç–≤–æ—è —Å–µ—Å—Ç—Ä–∞?\n> ‚Äî –í–æ–Ω–∞ –±—É–ª–∞ —Å—Ç—É–¥–µ–Ω—Ç–∫–æ—é, –∞–ª–µ –∑–∞—Ä–∞–∑ —Å—Ç–∞–ª–∞ –∂—É—Ä–Ω–∞–ª—ñ—Å—Ç–∫–æ—é.\n> ‚Äî –ö—Ä—É—Ç–æ! –ê —Ç–∏?\n> ‚Äî –Ø –ø—Ä–∞—Ü—é—é –≤—á–∏—Ç–µ–ª–µ–º. –ú—Ä—ñ—é —Å—Ç–∞—Ç–∏ –¥–∏—Ä–µ–∫—Ç–æ—Ä–æ–º —à–∫–æ–ª–∏!\n\n---\n\n# Cultural Insight\n\n## Ukrainian Professions: Gender Forms\n\nOne of the distinctive features of Ukrainian is that it has separate feminine forms for most professions. While English uses \"doctor\" for both men and women, Ukrainian distinguishes: **–ª—ñ–∫–∞—Ä** for a male doctor and **–ª—ñ–∫–∞—Ä–∫–∞** for a female doctor.\n\nThis is not a modern invention ‚Äî Ukrainian has always had productive suffixes like -–∫–∞, -–∏—Ü—è, and -–∏–Ω—è that form feminine nouns from masculine ones. Using the correct gender form is considered grammatically proper and respectful.\n\nThe main suffixes for feminine professions are:\n- **-–∫–∞**: –ª—ñ–∫–∞—Ä ‚Üí –ª—ñ–∫–∞—Ä–∫–∞, —ñ–Ω–∂–µ–Ω–µ—Ä ‚Üí —ñ–Ω–∂–µ–Ω–µ—Ä–∫–∞\n- **-–∏—Ü—è**: –ø–∏—Å—å–º–µ–Ω–Ω–∏–∫ ‚Üí –ø–∏—Å—å–º–µ–Ω–Ω–∏—Ü—è\n\nHere is a table of common professions with their masculine and feminine forms:\n\n| Masculine | Feminine | English |\n|-----------|----------|---------|\n| –ª—ñ–∫–∞—Ä | –ª—ñ–∫–∞—Ä–∫–∞ | doctor |\n| –≤—á–∏—Ç–µ–ª—å | –≤—á–∏—Ç–µ–ª—å–∫–∞ | teacher |\n| –∂—É—Ä–Ω–∞–ª—ñ—Å—Ç | –∂—É—Ä–Ω–∞–ª—ñ—Å—Ç–∫–∞ | journalist |\n| —ñ–Ω–∂–µ–Ω–µ—Ä | —ñ–Ω–∂–µ–Ω–µ—Ä–∫–∞ | engineer |\n| –ø—Ä–æ–≥—Ä–∞–º—ñ—Å—Ç | –ø—Ä–æ–≥—Ä–∞–º—ñ—Å—Ç–∫–∞ | programmer |\n| —é—Ä–∏—Å—Ç | —é—Ä–∏—Å—Ç–∫–∞ | lawyer |\n| –∞–∫—Ç–æ—Ä | –∞–∫—Ç–æ—Ä–∫–∞ | actor |\n| –ø–∏—Å—å–º–µ–Ω–Ω–∏–∫ | –ø–∏—Å—å–º–µ–Ω–Ω–∏—Ü—è | writer |\n\nWhen talking about a woman's profession, use the feminine form in both nominative and instrumental:\n\n–í–æ–Ω–∞ –ø—Ä–∞—Ü—é—î –ª—ñ–∫–∞—Ä–∫–æ—é. (She works as a doctor.)\nMaria —Å—Ç–∞–ª–∞ –ø–∏—Å—å–º–µ–Ω–Ω–∏—Ü–µ—é. (Maria became a writer.)\n\n> üîç **Myth Buster**\n>\n> Some people claim feminine profession forms like \"–ª—ñ–∫–∞—Ä–∫–∞\" or \"—ñ–Ω–∂–µ–Ω–µ—Ä–∫–∞\" are \"new\" or \"artificial.\" This is false! Ukrainian has always had productive feminine suffixes. What IS new is their official recognition ‚Äî the Ukrainian language was suppressed for centuries, so codification of natural forms was delayed. Using –ª—ñ–∫–∞—Ä–∫–∞ instead of –ª—ñ–∫–∞—Ä for a woman is grammatically correct and culturally authentic!\n\n## Famous Ukrainian Professionals\n\nUkraine has produced many outstanding professionals who changed the world. Here are some famous Ukrainians and their professions, demonstrating the instrumental case in action:\n\n| Name | Profession and Achievement |\n|------|------------|\n| –°–µ—Ä–≥—ñ–π –ö–æ—Ä–æ–ª—å–æ–≤ | He **was an engineer** (–±—É–≤ —ñ–Ω–∂–µ–Ω–µ—Ä–æ–º) who created the Soviet space program. |\n| –õ–µ—Å—è –£–∫—Ä–∞—ó–Ω–∫–∞ | She **became a writer** (—Å—Ç–∞–ª–∞ –ø–∏—Å—å–º–µ–Ω–Ω–∏—Ü–µ—é) and poet. |\n| –°–æ–ª–æ–º—ñ—è –ö—Ä—É—à–µ–ª—å–Ω–∏—Ü—å–∫–∞ | She **was an opera singer** (–±—É–ª–∞ —Å–ø—ñ–≤–∞—á–∫–æ—é) of world renown. |\n| –Ü–≥–æ—Ä –°—ñ–∫–æ—Ä—Å—å–∫–∏–π | He **worked as an engineer** (–ø—Ä–∞—Ü—é–≤–∞–≤ —ñ–Ω–∂–µ–Ω–µ—Ä–æ–º) and invented the helicopter. |\n\nNotice how each profession appears in the instrumental case after the verbs –±—É–≤, —Å—Ç–∞–ª–∞, –±—É–ª–∞, and –ø—Ä–∞—Ü—é–≤–∞–≤.\n\n> üåç **Real World**\n>\n> In modern Ukraine, IT professionals (–ø—Ä–æ–≥—Ä–∞–º—ñ—Å—Ç–∏) are one of the largest professional communities. Many Ukrainians say: \"–Ø –ø—Ä–∞—Ü—é—é –ø—Ä–æ–≥—Ä–∞–º—ñ—Å—Ç–æ–º\" or \"–ú–æ—è –º—Ä—ñ—è ‚Äî —Å—Ç–∞—Ç–∏ –ø—Ä–æ–≥—Ä–∞–º—ñ—Å—Ç–æ–º.\" The tech sector uses both masculine and feminine forms actively: –ø—Ä–æ–≥—Ä–∞–º—ñ—Å—Ç / –ø—Ä–æ–≥—Ä–∞–º—ñ—Å—Ç–∫–∞.\n\n> [!tip] Common Mistakes\n> English speakers often try to use \"—î\" (is) in present tense: \"–í—ñ–Ω —î –ª—ñ–∫–∞—Ä.\" While this is understood, native Ukrainian simply says \"–í—ñ–Ω –ª—ñ–∫–∞—Ä.\" The verb \"to be\" is invisible in present tense ‚Äî it appears only in past (–±—É–≤) and future (–±—É–¥–µ).\n\n> [!observe] Pattern Discovery\n> Notice that **—Å—Ç–∞—Ç–∏** always takes instrumental, regardless of tense. Whether you say \"–í—ñ–Ω —Å—Ç–∞–≤ –ª—ñ–∫–∞—Ä–µ–º\" (past), \"–í—ñ–Ω —Å—Ç–∞–Ω–µ –ª—ñ–∫–∞—Ä–µ–º\" (future), or \"–í—ñ–Ω —Ö–æ—á–µ —Å—Ç–∞—Ç–∏ –ª—ñ–∫–∞—Ä–µ–º\" (infinitive), the profession is always in instrumental!\n\n---\n\n# Practice\n\n## Present vs. Past/Future\n\nThis is the key distinction you need to master: in present tense, Ukrainian doesn't use any verb for \"to be\" with professions. You simply state the subject and profession in nominative case. But in past and future tenses, you use –±—É—Ç–∏ followed by the profession in instrumental case.\n\nRemember: Present tense = no verb, Nominative. Past/Future = –±—É—Ç–∏, Instrumental. This is a fundamental pattern in Ukrainian that differs from English where \"is\" appears in all tenses.\n\nStudy this table carefully to see the pattern across all three tenses:\n\n| Present (Nominative) | Past (Instrumental) | Future (Instrumental) |\n|---------|------|--------|\n| –í—ñ–Ω –ª—ñ–∫–∞—Ä. | –í—ñ–Ω **–±—É–≤ –ª—ñ–∫–∞—Ä–µ–º**. | –í—ñ–Ω **–±—É–¥–µ –ª—ñ–∫–∞—Ä–µ–º**. |\n| –í–æ–Ω–∞ —Å—Ç—É–¥–µ–Ω—Ç–∫–∞. | –í–æ–Ω–∞ **–±—É–ª–∞ —Å—Ç—É–¥–µ–Ω—Ç–∫–æ—é**. | –í–æ–Ω–∞ **–±—É–¥–µ —Å—Ç—É–¥–µ–Ω—Ç–∫–æ—é**. |\n| –ú–∏ –¥—Ä—É–∑—ñ. | –ú–∏ **–±—É–ª–∏ –¥—Ä—É–∑—è–º–∏**. | –ú–∏ **–±—É–¥–µ–º–æ –¥—Ä—É–∑—è–º–∏**. |\n\n## Form the Instrumental of Professions\n\nHere is a reference table showing how common professions change from nominative to instrumental case. Notice that masculine nouns typically add -–æ–º or -–µ–º, while feminine nouns add -–æ—é:\n\n| Nominative | Instrumental | Gender |\n|------------|--------------|--------|\n| –ª—ñ–∫–∞—Ä | –ª—ñ–∫–∞—Ä–µ–º | masc |\n| –≤—á–∏—Ç–µ–ª—å | –≤—á–∏—Ç–µ–ª–µ–º | masc |\n| —ñ–Ω–∂–µ–Ω–µ—Ä | —ñ–Ω–∂–µ–Ω–µ—Ä–æ–º | masc |\n| –ø—Ä–æ–≥—Ä–∞–º—ñ—Å—Ç | –ø—Ä–æ–≥—Ä–∞–º—ñ—Å—Ç–æ–º | masc |\n| –∂—É—Ä–Ω–∞–ª—ñ—Å—Ç | –∂—É—Ä–Ω–∞–ª—ñ—Å—Ç–æ–º | masc |\n| –≤—á–∏—Ç–µ–ª—å–∫–∞ | –≤—á–∏—Ç–µ–ª—å–∫–æ—é | fem |\n| –ª—ñ–∫–∞—Ä–∫–∞ | –ª—ñ–∫–∞—Ä–∫–æ—é | fem |\n\n## Mini-Dialogues\n\nPractice these conversations that demonstrate –±—É—Ç–∏, —Å—Ç–∞—Ç–∏, and –ø—Ä–∞—Ü—é–≤–∞—Ç–∏ with instrumental case. English translations are provided to help you understand the meaning.\n\n**–ù–∞ –≤–µ—á—ñ—Ä—Ü—ñ (At a party):**\n‚Äî –ö–∏–º —Ç–∏ –ø—Ä–∞—Ü—é—î—à? (What do you work as?)\n‚Äî –Ø –ø—Ä–∞—Ü—é—é –ø—Ä–æ–≥—Ä–∞–º—ñ—Å—Ç–æ–º. –ê —Ç–∏? (I work as a programmer. And you?)\n‚Äî –Ø –≤—á–∏—Ç–µ–ª—å–∫–∞. –ü—Ä–∞—Ü—é—é –≤ —à–∫–æ–ª—ñ. (I'm a teacher. I work at a school.)\n‚Äî –¶—ñ–∫–∞–≤–æ! –ê –∫–∏–º —Ç–∏ —Ö–æ—á–µ—à —Å—Ç–∞—Ç–∏ –≤ –º–∞–π–±—É—Ç–Ω—å–æ–º—É? (Interesting! What do you want to become in the future?)\n‚Äî –Ø —Ö–æ—á—É —Å—Ç–∞—Ç–∏ –¥–∏—Ä–µ–∫—Ç–æ—Ä–∫–æ—é —à–∫–æ–ª–∏. (I want to become a school principal.)\n\n**–£ —Ä–æ–¥–∏–Ω—ñ (In the family):**\n‚Äî –ö–∏–º –±—É–≤ —Ç–≤—ñ–π –¥—ñ–¥—É—Å—å? (What was your grandfather?)\n‚Äî –í—ñ–Ω –±—É–≤ –ª—ñ–∫–∞—Ä–µ–º. (He was a doctor.)\n‚Äî –ê –±–∞–±—É—Å—è? (And grandmother?)\n‚Äî –í–æ–Ω–∞ –±—É–ª–∞ –≤—á–∏—Ç–µ–ª—å–∫–æ—é –º—É–∑–∏–∫–∏. (She was a music teacher.)\n\n**–ù–∞ —Å–ø—ñ–≤–±–µ—Å—ñ–¥—ñ (At a job interview):**\n‚Äî –ö–∏–º –≤–∏ –ø—Ä–∞—Ü—é–≤–∞–ª–∏ —Ä–∞–Ω—ñ—à–µ? (What did you work as before?)\n‚Äî –Ø –ø—Ä–∞—Ü—é–≤–∞–≤ –∂—É—Ä–Ω–∞–ª—ñ—Å—Ç–æ–º —à—ñ—Å—Ç—å —Ä–æ–∫—ñ–≤. (I worked as a journalist for six years.)\n‚Äî –ê —á–æ–º—É —Ö–æ—á–µ—Ç–µ –∑–º—ñ–Ω–∏—Ç–∏ –ø—Ä–æ—Ñ–µ—Å—ñ—é? (Why do you want to change professions?)\n‚Äî –Ø —Ö–æ—á—É —Å—Ç–∞—Ç–∏ –ø—Ä–æ–≥—Ä–∞–º—ñ—Å—Ç–æ–º. (I want to become a programmer.)\n\n---\n\n# Reading Practice: –ú–æ—è —Ä–æ–¥–∏–Ω–∞ —ñ –ø—Ä–æ—Ñ–µ—Å—ñ—ó\n\nThis reading passage demonstrates all three verbs (–±—É—Ç–∏, —Å—Ç–∞—Ç–∏, –ø—Ä–∞—Ü—é–≤–∞—Ç–∏) with professions in instrumental case. Pay attention to how the bolded phrases follow the pattern: verb + profession in instrumental.\n\n> –ú–æ—è —Ä–æ–¥–∏–Ω–∞ —Ü—ñ–∫–∞–≤–∞. –ú—ñ–π —Ç–∞—Ç–æ **–ø—Ä–∞—Ü—é—î —ñ–Ω–∂–µ–Ω–µ—Ä–æ–º** –Ω–∞ –∑–∞–≤–æ–¥—ñ. –†–∞–Ω—ñ—à–µ –≤—ñ–Ω **–±—É–≤ —Å—Ç—É–¥–µ–Ω—Ç–æ–º** –ø–æ–ª—ñ—Ç–µ—Ö–Ω—ñ—á–Ω–æ–≥–æ —ñ–Ω—Å—Ç–∏—Ç—É—Ç—É. –ú–æ—è –º–∞–º–∞ **—Å—Ç–∞–ª–∞ –ª—ñ–∫–∞—Ä–∫–æ—é** –ø—ñ—Å–ª—è —É–Ω—ñ–≤–µ—Ä—Å–∏—Ç–µ—Ç—É. –í–æ–Ω–∞ **–ø—Ä–∞—Ü—é—î –ª—ñ–∫–∞—Ä–∫–æ—é** –≤–∂–µ –¥–≤–∞–¥—Ü—è—Ç—å —Ä–æ–∫—ñ–≤.\n>\n> –ú—ñ–π —Å—Ç–∞—Ä—à–∏–π –±—Ä–∞—Ç **–º—Ä—ñ—è–≤ —Å—Ç–∞—Ç–∏ –º—É–∑–∏–∫–∞–Ω—Ç–æ–º**, –∞–ª–µ **—Å—Ç–∞–≤ –ø—Ä–æ–≥—Ä–∞–º—ñ—Å—Ç–æ–º**. –í—ñ–Ω –∫–∞–∂–µ, —â–æ —Ü–µ —Ç–µ–∂ —Ç–≤–æ—Ä—á–∞ –ø—Ä–æ—Ñ–µ—Å—ñ—è! –ú–æ—è —Å–µ—Å—Ç—Ä–∞ **–±—É–ª–∞ –∂—É—Ä–Ω–∞–ª—ñ—Å—Ç–∫–æ—é**, –∞–ª–µ –∑–∞—Ä–∞–∑ –≤–æ–Ω–∞ **—Å—Ç–∞–ª–∞ –ø–∏—Å—å–º–µ–Ω–Ω–∏—Ü–µ—é**. –í–æ–Ω–∞ –Ω–∞–ø–∏—Å–∞–ª–∞ —Ç—Ä–∏ –∫–Ω–∏–≥–∏.\n>\n> –ê —è? –Ø —â–µ —Å—Ç—É–¥–µ–Ω—Ç. –Ø **—Ö–æ—á—É —Å—Ç–∞—Ç–∏ –≤—á–∏—Ç–µ–ª–µ–º** —É–∫—Ä–∞—ó–Ω—Å—å–∫–æ—ó –º–æ–≤–∏. –ú–æ—ó –¥—Ä—É–∑—ñ –∫–∞–∂—É—Ç—å, —â–æ —è **–±—É–¥—É —Ö–æ—Ä–æ—à–∏–º –≤—á–∏—Ç–µ–ª–µ–º**, –±–æ —è –ª—é–±–ª—é –ø–æ—è—Å–Ω—é–≤–∞—Ç–∏.\n\n**Comprehension Questions:** Answer these questions about the reading above. Notice that the answers also use instrumental case.\n\n1. –ö–∏–º –ø—Ä–∞—Ü—é—î —Ç–∞—Ç–æ? ‚Äî –í—ñ–Ω –ø—Ä–∞—Ü—é—î —ñ–Ω–∂–µ–Ω–µ—Ä–æ–º.\n2. –ö–∏–º —Å—Ç–∞–ª–∞ –º–∞–º–∞? ‚Äî –í–æ–Ω–∞ —Å—Ç–∞–ª–∞ –ª—ñ–∫–∞—Ä–∫–æ—é.\n3. –ö–∏–º –º—Ä—ñ—è–≤ —Å—Ç–∞—Ç–∏ –±—Ä–∞—Ç? ‚Äî –í—ñ–Ω –º—Ä—ñ—è–≤ —Å—Ç–∞—Ç–∏ –º—É–∑–∏–∫–∞–Ω—Ç–æ–º.\n4. –ö–∏–º –±—É–ª–∞ —Å–µ—Å—Ç—Ä–∞? ‚Äî –í–æ–Ω–∞ –±—É–ª–∞ –∂—É—Ä–Ω–∞–ª—ñ—Å—Ç–∫–æ—é.\n5. –ö–∏–º —Ö–æ—á–µ —Å—Ç–∞—Ç–∏ –æ–ø–æ–≤—ñ–¥–∞—á? ‚Äî –í—ñ–Ω —Ö–æ—á–µ —Å—Ç–∞—Ç–∏ –≤—á–∏—Ç–µ–ª–µ–º.\n\n---\n\n# Summary\n\nIn this module, you learned how to talk about professions using three key verbs that take the instrumental case: –±—É—Ç–∏ (to be), —Å—Ç–∞—Ç–∏ (to become), and –ø—Ä–∞—Ü—é–≤–∞—Ç–∏ (to work as). Here's a recap of the key patterns you mastered:\n\n**Key Pattern 1: –ë—É—Ç–∏ + Instrumental** for past and future tenses\n\nIn present tense, Ukrainian doesn't use a verb for \"to be\" with professions. But in past and future, you use –±—É—Ç–∏ followed by the instrumental case:\n- –í—ñ–Ω **–±—É–≤ —Å—Ç—É–¥–µ–Ω—Ç–æ–º**. (He was a student.)\n- –í–æ–Ω–∞ **–±—É–¥–µ –ª—ñ–∫–∞—Ä–∫–æ—é**. (She will be a doctor.)\n- Present tense: no –±—É—Ç–∏, use nominative (–í—ñ–Ω —Å—Ç—É–¥–µ–Ω—Ç.)\n\n**Key Pattern 2: –°—Ç–∞—Ç–∏ + Instrumental** for becoming\n\nThe verb —Å—Ç–∞—Ç–∏ always takes instrumental, regardless of tense:\n- –í–æ–Ω–∞ **—Å—Ç–∞–ª–∞ –≤—á–∏—Ç–µ–ª—å–∫–æ—é**. (She became a teacher.)\n- –í—ñ–Ω **—Ö–æ—á–µ —Å—Ç–∞—Ç–∏ –ø—Ä–æ–≥—Ä–∞–º—ñ—Å—Ç–æ–º**. (He wants to become a programmer.)\n\n**Key Pattern 3: –ü—Ä–∞—Ü—é–≤–∞—Ç–∏ + Instrumental** for working as\n\nNo preposition is needed ‚Äî just verb + profession in instrumental:\n- –Ø **–ø—Ä–∞—Ü—é—é —ñ–Ω–∂–µ–Ω–µ—Ä–æ–º**. (I work as an engineer.)\n- –ö–∏–º —Ç–∏ –ø—Ä–∞—Ü—é—î—à? (What do you work as?)\n\n**Gender Forms**: Remember that Ukrainian has separate masculine and feminine forms for most professions: –ª—ñ–∫–∞—Ä/–ª—ñ–∫–∞—Ä–∫–∞, –≤—á–∏—Ç–µ–ª—å/–≤—á–∏—Ç–µ–ª—å–∫–∞, –ø—Ä–æ–≥—Ä–∞–º—ñ—Å—Ç/–ø—Ä–æ–≥—Ä–∞–º—ñ—Å—Ç–∫–∞. Use the correct form based on the person's gender.\n\nNow you can talk about your profession with confidence! üë®‚Äç‚öïÔ∏èüë©‚Äçüè´üíª\n\n# Activities\n\n## match-up: Professions Masculine and Feminine\n\n- –ª—ñ–∫–∞—Ä :: –ª—ñ–∫–∞—Ä–∫–∞\n- –≤—á–∏—Ç–µ–ª—å :: –≤—á–∏—Ç–µ–ª—å–∫–∞\n- —ñ–Ω–∂–µ–Ω–µ—Ä :: —ñ–Ω–∂–µ–Ω–µ—Ä–∫–∞\n- –ø—Ä–æ–≥—Ä–∞–º—ñ—Å—Ç :: –ø—Ä–æ–≥—Ä–∞–º—ñ—Å—Ç–∫–∞\n- –∂—É—Ä–Ω–∞–ª—ñ—Å—Ç :: –∂—É—Ä–Ω–∞–ª—ñ—Å—Ç–∫–∞\n- —é—Ä–∏—Å—Ç :: —é—Ä–∏—Å—Ç–∫–∞\n- –∞–∫—Ç–æ—Ä :: –∞–∫—Ç–æ—Ä–∫–∞\n- –ø–∏—Å—å–º–µ–Ω–Ω–∏–∫ :: –ø–∏—Å—å–º–µ–Ω–Ω–∏—Ü—è\n- –º–µ–Ω–µ–¥–∂–µ—Ä :: –º–µ–Ω–µ–¥–∂–µ—Ä–∫–∞\n- –¥–∏—Ä–µ–∫—Ç–æ—Ä :: –¥–∏—Ä–µ–∫—Ç–æ—Ä–∫–∞\n- —Å–µ–∫—Ä–µ—Ç–∞—Ä :: —Å–µ–∫—Ä–µ—Ç–∞—Ä–∫–∞\n- –≤–æ–¥—ñ–π :: –≤–æ–¥—ñ–π–∫–∞\n\n## fill-in: –ë—É—Ç–∏/–°—Ç–∞—Ç–∏ + Instrumental\n\n> Complete each sentence with the correct instrumental form.\n\n1. –í—ñ–Ω —Ä–∞–Ω—ñ—à–µ –±—É–≤ ___.\n   > [!answer] —Å—Ç—É–¥–µ–Ω—Ç–æ–º\n   > [!options] —Å—Ç—É–¥–µ–Ω—Ç | —Å—Ç—É–¥–µ–Ω—Ç–æ–º | —Å—Ç—É–¥–µ–Ω—Ç–∞\n\n2. –í–æ–Ω–∞ —Ö–æ—á–µ —Å—Ç–∞—Ç–∏ ___.\n   > [!answer] –ª—ñ–∫–∞—Ä–∫–æ—é\n   > [!options] –ª—ñ–∫–∞—Ä–∫–∞ | –ª—ñ–∫–∞—Ä–∫–æ—é | –ª—ñ–∫–∞—Ä–∫—É\n\n3. –ú–∏ –±—É–¥–µ–º–æ ___.\n   > [!answer] –¥—Ä—É–∑—è–º–∏\n   > [!options] –¥—Ä—É–∑—ñ | –¥—Ä—É–∑—è–º–∏ | –¥—Ä—É–∑—ñ–≤\n\n4. –í—ñ–Ω –ø—Ä–∞—Ü—é—î ___.\n   > [!answer] –ø—Ä–æ–≥—Ä–∞–º—ñ—Å—Ç–æ–º\n   > [!options] –ø—Ä–æ–≥—Ä–∞–º—ñ—Å—Ç | –ø—Ä–æ–≥—Ä–∞–º—ñ—Å—Ç–æ–º | –ø—Ä–æ–≥—Ä–∞–º—ñ—Å—Ç–∞\n\n5. –í–æ–Ω–∞ —Å—Ç–∞–ª–∞ ___.\n   > [!answer] –≤—á–∏—Ç–µ–ª—å–∫–æ—é\n   > [!options] –≤—á–∏—Ç–µ–ª—å–∫–∞ | –≤—á–∏—Ç–µ–ª—å–∫–æ—é | –≤—á–∏—Ç–µ–ª—å–∫—É\n\n6. –í—ñ–Ω –±—É–≤ ___.\n   > [!answer] –¥–∏—Ä–µ–∫—Ç–æ—Ä–æ–º\n   > [!options] –¥–∏—Ä–µ–∫—Ç–æ—Ä | –¥–∏—Ä–µ–∫—Ç–æ—Ä–æ–º | –¥–∏—Ä–µ–∫—Ç–æ—Ä–∞\n\n7. –í–æ–Ω–∞ –±—É–¥–µ ___.\n   > [!answer] –∂—É—Ä–Ω–∞–ª—ñ—Å—Ç–∫–æ—é\n   > [!options] –∂—É—Ä–Ω–∞–ª—ñ—Å—Ç–∫–∞ | –∂—É—Ä–Ω–∞–ª—ñ—Å—Ç–∫–æ—é | –∂—É—Ä–Ω–∞–ª—ñ—Å—Ç–∫—É\n\n8. –í—ñ–Ω –º—Ä—ñ—î —Å—Ç–∞—Ç–∏ ___.\n   > [!answer] –ø–∏—Å—å–º–µ–Ω–Ω–∏–∫–æ–º\n   > [!options] –ø–∏—Å—å–º–µ–Ω–Ω–∏–∫ | –ø–∏—Å—å–º–µ–Ω–Ω–∏–∫–æ–º | –ø–∏—Å—å–º–µ–Ω–Ω–∏–∫–∞\n\n9. –í–æ–Ω–∞ –ø—Ä–∞—Ü—é—î ___.\n   > [!answer] —Å–µ–∫—Ä–µ—Ç–∞—Ä–∫–æ—é\n   > [!options] —Å–µ–∫—Ä–µ—Ç–∞—Ä–∫–∞ | —Å–µ–∫—Ä–µ—Ç–∞—Ä–∫–æ—é | —Å–µ–∫—Ä–µ—Ç–∞—Ä–∫—É\n\n10. –ú–∏ –±—É–ª–∏ ___.\n    > [!answer] —Å—Ç—É–¥–µ–Ω—Ç–∞–º–∏\n    > [!options] —Å—Ç—É–¥–µ–Ω—Ç–∏ | —Å—Ç—É–¥–µ–Ω—Ç–∞–º–∏ | —Å—Ç—É–¥–µ–Ω—Ç—ñ–≤\n\n11. –í—ñ–Ω —Ö–æ—á–µ —Å—Ç–∞—Ç–∏ ___.\n    > [!answer] —ñ–Ω–∂–µ–Ω–µ—Ä–æ–º\n    > [!options] —ñ–Ω–∂–µ–Ω–µ—Ä | —ñ–Ω–∂–µ–Ω–µ—Ä–æ–º | —ñ–Ω–∂–µ–Ω–µ—Ä–∞\n\n12. –í–æ–Ω–∞ –±—É–ª–∞ ___.\n    > [!answer] –∞–∫—Ç–æ—Ä–∫–æ—é\n    > [!options] –∞–∫—Ç–æ—Ä–∫–∞ | –∞–∫—Ç–æ—Ä–∫–æ—é | –∞–∫—Ç–æ—Ä–∫—É\n\n## quiz: When to Use Instrumental\n\n1. –Ø–∫–µ —Ä–µ—á–µ–Ω–Ω—è –ø—Ä–∞–≤–∏–ª—å–Ω–µ?\n\n- [x] –í—ñ–Ω –±—É–≤ —Å—Ç—É–¥–µ–Ω—Ç–æ–º.\n- [ ] –í—ñ–Ω –±—É–≤ —Å—Ç—É–¥–µ–Ω—Ç.\n- [ ] –í—ñ–Ω –±—É–≤ —Å—Ç—É–¥–µ–Ω—Ç–∞.\n\n---\n\n2. –Ø–∫ —Å–∫–∞–∑–∞—Ç–∏ \"She became a teacher\"?\n\n- [x] –í–æ–Ω–∞ —Å—Ç–∞–ª–∞ –≤—á–∏—Ç–µ–ª—å–∫–æ—é.\n- [ ] –í–æ–Ω–∞ —Å—Ç–∞–ª–∞ –≤—á–∏—Ç–µ–ª—å–∫–∞.\n- [ ] –í–æ–Ω–∞ —Å—Ç–∞–ª–∞ –≤—á–∏—Ç–µ–ª—å–∫—É.\n\n---\n\n3. –ö–æ–ª–∏ –≤–∏–∫–æ—Ä–∏—Å—Ç–æ–≤—É—î–º–æ –æ—Ä—É–¥–Ω–∏–π –∑ \"–±—É—Ç–∏\"?\n\n- [x] –£ –º–∏–Ω—É–ª–æ–º—É —Ç–∞ –º–∞–π–±—É—Ç–Ω—å–æ–º—É —á–∞—Å—ñ\n- [ ] –£ —Ç–µ–ø–µ—Ä—ñ—à–Ω—å–æ–º—É —á–∞—Å—ñ\n- [ ] –ù—ñ–∫–æ–ª–∏\n\n---\n\n4. –Ø–∫ —Å–∫–∞–∑–∞—Ç–∏ \"I work as a programmer\"?\n\n- [x] –Ø –ø—Ä–∞—Ü—é—é –ø—Ä–æ–≥—Ä–∞–º—ñ—Å—Ç–æ–º.\n- [ ] –Ø –ø—Ä–∞—Ü—é—é –ø—Ä–æ–≥—Ä–∞–º—ñ—Å—Ç.\n- [ ] –Ø –ø—Ä–∞—Ü—é—é –ø—Ä–æ–≥—Ä–∞–º—ñ—Å—Ç–∞.\n\n---\n\n5. –Ø–∫–µ —Ä–µ—á–µ–Ω–Ω—è –ø—Ä–∞–≤–∏–ª—å–Ω–µ –¥–ª—è —Ç–µ–ø–µ—Ä—ñ—à–Ω—å–æ–≥–æ —á–∞—Å—É?\n\n- [x] –í—ñ–Ω –ª—ñ–∫–∞—Ä.\n- [ ] –í—ñ–Ω —î –ª—ñ–∫–∞—Ä–µ–º.\n- [ ] –í—ñ–Ω –ª—ñ–∫–∞—Ä–µ–º.\n\n---\n\n6. –Ø–∫ –∑–∞–ø–∏—Ç–∞—Ç–∏ \"What do you work as\"?\n\n- [x] –ö–∏–º —Ç–∏ –ø—Ä–∞—Ü—é—î—à?\n- [ ] –©–æ —Ç–∏ –ø—Ä–∞—Ü—é—î—à?\n- [ ] –•—Ç–æ —Ç–∏ –ø—Ä–∞—Ü—é—î—à?\n\n---\n\n7. –Ø–∫–µ —Ä–µ—á–µ–Ω–Ω—è –ø—Ä–∞–≤–∏–ª—å–Ω–µ?\n\n- [x] –í—ñ–Ω –±—É–¥–µ —ñ–Ω–∂–µ–Ω–µ—Ä–æ–º.\n- [ ] –í—ñ–Ω –±—É–¥–µ —ñ–Ω–∂–µ–Ω–µ—Ä.\n- [ ] –í—ñ–Ω –±—É–¥–µ —ñ–Ω–∂–µ–Ω–µ—Ä–∞.\n\n---\n\n8. \"–°—Ç–∞—Ç–∏\" –≤–∏–º–∞–≥–∞—î —è–∫–æ–≥–æ –≤—ñ–¥–º—ñ–Ω–∫–∞?\n\n- [x] –û—Ä—É–¥–Ω–æ–≥–æ\n- [ ] –ó–Ω–∞—Ö—ñ–¥–Ω–æ–≥–æ\n- [ ] –ù–∞–∑–∏–≤–Ω–æ–≥–æ\n\n---\n\n9. –Ø–∫ —Å–∫–∞–∑–∞—Ç–∏ \"We were friends\"?\n\n- [x] –ú–∏ –±—É–ª–∏ –¥—Ä—É–∑—è–º–∏.\n- [ ] –ú–∏ –±—É–ª–∏ –¥—Ä—É–∑—ñ.\n- [ ] –ú–∏ –±—É–ª–∏ –¥—Ä—É–∑—ñ–≤.\n\n---\n\n10. –Ø–∫–∞ –∂—ñ–Ω–æ—á–∞ —Ñ–æ—Ä–º–∞ \"–ø—Ä–æ–≥—Ä–∞–º—ñ—Å—Ç\"?\n\n- [x] –ø—Ä–æ–≥—Ä–∞–º—ñ—Å—Ç–∫–∞\n- [ ] –ø—Ä–æ–≥—Ä–∞–º—ñ—Å—Ç–∏—Ü—è\n- [ ] –ø—Ä–æ–≥—Ä–∞–º—ñ—Å—Ç–µ—Å–∞\n\n---\n\n11. –Ø–∫–µ —Ä–µ—á–µ–Ω–Ω—è –ø—Ä–∞–≤–∏–ª—å–Ω–µ?\n\n- [x] –í–æ–Ω–∞ –ø—Ä–∞—Ü—é—î –∂—É—Ä–Ω–∞–ª—ñ—Å—Ç–∫–æ—é.\n- [ ] –í–æ–Ω–∞ –ø—Ä–∞—Ü—é—î –∂—É—Ä–Ω–∞–ª—ñ—Å—Ç–∫–∞.\n- [ ] –í–æ–Ω–∞ –ø—Ä–∞—Ü—é—î –∂—É—Ä–Ω–∞–ª—ñ—Å—Ç–∫—É.\n\n---\n\n12. –Ø–∫ —Å–∫–∞–∑–∞—Ç–∏ \"He wants to become a doctor\"?\n\n- [x] –í—ñ–Ω —Ö–æ—á–µ —Å—Ç–∞—Ç–∏ –ª—ñ–∫–∞—Ä–µ–º.\n- [ ] –í—ñ–Ω —Ö–æ—á–µ —Å—Ç–∞—Ç–∏ –ª—ñ–∫–∞—Ä.\n- [ ] –í—ñ–Ω —Ö–æ—á–µ —Å—Ç–∞—Ç–∏ –ª—ñ–∫–∞—Ä—è.\n\n## true-false: Instrumental with Professions\n\n> Decide if each statement is true or false.\n\n- [x] In present tense, we usually don't use \"–±—É—Ç–∏\" for professions.\n  > Correct! –í—ñ–Ω –ª—ñ–∫–∞—Ä. (not –í—ñ–Ω —î –ª—ñ–∫–∞—Ä–µ–º.)\n\n- [ ] \"–°—Ç–∞—Ç–∏\" takes the nominative case.\n  > False! –°—Ç–∞—Ç–∏ always takes instrumental: —Å—Ç–∞—Ç–∏ –ª—ñ–∫–∞—Ä–µ–º.\n\n- [x] \"–ü—Ä–∞—Ü—é–≤–∞—Ç–∏ + Instrumental\" expresses \"to work as.\"\n  > Yes! –Ø –ø—Ä–∞—Ü—é—é –≤—á–∏—Ç–µ–ª–µ–º = I work as a teacher.\n\n- [ ] \"–í—ñ–Ω —î –ª—ñ–∫–∞—Ä\" is the standard way to say \"He is a doctor.\"\n  > In standard Ukrainian, we say \"–í—ñ–Ω –ª—ñ–∫–∞—Ä\" (zero copula).\n\n- [x] Feminine profession forms like \"–ª—ñ–∫–∞—Ä–∫–∞\" are grammatically correct.\n  > Yes! Ukrainian has productive feminine suffixes.\n\n- [x] \"–ë—É–≤/–±—É–ª–∞ + Instrumental\" is used for past tense.\n  > Correct! –í—ñ–Ω –±—É–≤ —Å—Ç—É–¥–µ–Ω—Ç–æ–º. –í–æ–Ω–∞ –±—É–ª–∞ –ª—ñ–∫–∞—Ä–∫–æ—é.\n\n- [ ] \"–ö–∏–º?\" is the nominative of \"—Ö—Ç–æ.\"\n  > \"–ö–∏–º?\" is the instrumental of \"—Ö—Ç–æ.\"\n\n- [x] \"–í—ñ–Ω –±—É–¥–µ —ñ–Ω–∂–µ–Ω–µ—Ä–æ–º\" means \"He will be an engineer.\"\n  > Correct! Future tense uses –±—É–¥–µ + instrumental.\n\n- [ ] \"–í–æ–Ω–∞ –ª—ñ–∫–∞—Ä–æ–º\" is a complete sentence in present tense.\n  > In present tense, use nominative: –í–æ–Ω–∞ –ª—ñ–∫–∞—Ä–∫–∞.\n\n- [x] \"–ó–∞–ª–∏—à–∞—Ç–∏—Å—è\" can also take instrumental.\n  > Yes! –í–æ–Ω–∞ –∑–∞–ª–∏—à–∞—î—Ç—å—Å—è –¥–∏—Ä–µ–∫—Ç–æ—Ä–∫–æ—é.\n\n- [x] \"–°–ª—É–∂–∏—Ç–∏\" takes instrumental for role.\n  > Correct! –í—ñ–Ω —Å–ª—É–∂–∏—Ç—å —Å–æ–ª–¥–∞—Ç–æ–º.\n\n- [ ] The feminine of \"–ø–∏—Å—å–º–µ–Ω–Ω–∏–∫\" is \"–ø–∏—Å—å–º–µ–Ω–Ω–∏—Ü—è.\"\n  > Wait ‚Äî this IS true! –ü–∏—Å—å–º–µ–Ω–Ω–∏–∫ ‚Üí –ø–∏—Å—å–º–µ–Ω–Ω–∏—Ü—è.\n\n## group-sort: Masculine vs. Feminine Professions\n\n> Sort these profession forms into the correct category.\n\n### Masculine\n- –ª—ñ–∫–∞—Ä\n- –≤—á–∏—Ç–µ–ª—å\n- —ñ–Ω–∂–µ–Ω–µ—Ä\n- –ø—Ä–æ–≥—Ä–∞–º—ñ—Å—Ç\n- –∂—É—Ä–Ω–∞–ª—ñ—Å—Ç\n- –ø–∏—Å—å–º–µ–Ω–Ω–∏–∫\n\n### Feminine\n- –ª—ñ–∫–∞—Ä–∫–∞\n- –≤—á–∏—Ç–µ–ª—å–∫–∞\n- —ñ–Ω–∂–µ–Ω–µ—Ä–∫–∞\n- –ø—Ä–æ–≥—Ä–∞–º—ñ—Å—Ç–∫–∞\n- –∂—É—Ä–Ω–∞–ª—ñ—Å—Ç–∫–∞\n- –ø–∏—Å—å–º–µ–Ω–Ω–∏—Ü—è\n\n## unjumble: Profession Sentences\n\n> Put the words in the correct order.\n\n1. –≤—ñ–Ω / —Ä–∞–Ω—ñ—à–µ / –±—É–≤ / —Å—Ç—É–¥–µ–Ω—Ç–æ–º\n   > [!answer] –í—ñ–Ω —Ä–∞–Ω—ñ—à–µ –±—É–≤ —Å—Ç—É–¥–µ–Ω—Ç–æ–º.\n   > (He was a student before.)\n\n2. –≤–æ–Ω–∞ / —Å—Ç–∞–ª–∞ / –≤—á–∏—Ç–µ–ª—å–∫–æ—é / –ø—ñ—Å–ª—è / —É–Ω—ñ–≤–µ—Ä—Å–∏—Ç–µ—Ç—É\n   > [!answer] –í–æ–Ω–∞ —Å—Ç–∞–ª–∞ –≤—á–∏—Ç–µ–ª—å–∫–æ—é –ø—ñ—Å–ª—è —É–Ω—ñ–≤–µ—Ä—Å–∏—Ç–µ—Ç—É.\n   > (She became a teacher after university.)\n\n3. —è / –ø—Ä–∞—Ü—é—é / –ø—Ä–æ–≥—Ä–∞–º—ñ—Å—Ç–æ–º / —É / –∫–æ–º–ø–∞–Ω—ñ—ó\n   > [!answer] –Ø –ø—Ä–∞—Ü—é—é –ø—Ä–æ–≥—Ä–∞–º—ñ—Å—Ç–æ–º —É –∫–æ–º–ø–∞–Ω—ñ—ó.\n   > (I work as a programmer at a company.)\n\n4. –≤—ñ–Ω / —Ö–æ—á–µ / —Å—Ç–∞—Ç–∏ / –ª—ñ–∫–∞—Ä–µ–º\n   > [!answer] –í—ñ–Ω —Ö–æ—á–µ —Å—Ç–∞—Ç–∏ –ª—ñ–∫–∞—Ä–µ–º.\n   > (He wants to become a doctor.)\n\n5. –≤–æ–Ω–∞ / –±—É–¥–µ / –∂—É—Ä–Ω–∞–ª—ñ—Å—Ç–∫–æ—é\n   > [!answer] –í–æ–Ω–∞ –±—É–¥–µ –∂—É—Ä–Ω–∞–ª—ñ—Å—Ç–∫–æ—é.\n   > (She will be a journalist.)\n\n6. –º–∏ / –±—É–ª–∏ / –¥—Ä—É–∑—è–º–∏ / –±–∞–≥–∞—Ç–æ / —Ä–æ–∫—ñ–≤\n   > [!answer] –ú–∏ –±—É–ª–∏ –¥—Ä—É–∑—è–º–∏ –±–∞–≥–∞—Ç–æ —Ä–æ–∫—ñ–≤.\n   > (We were friends for many years.)\n\n7. –∫–∏–º / —Ç–∏ / –ø—Ä–∞—Ü—é—î—à\n   > [!answer] –ö–∏–º —Ç–∏ –ø—Ä–∞—Ü—é—î—à?\n   > (What do you work as?)\n\n8. –≤—ñ–Ω / –º—Ä—ñ—î / —Å—Ç–∞—Ç–∏ / –ø–∏—Å—å–º–µ–Ω–Ω–∏–∫–æ–º\n   > [!answer] –í—ñ–Ω –º—Ä—ñ—î —Å—Ç–∞—Ç–∏ –ø–∏—Å—å–º–µ–Ω–Ω–∏–∫–æ–º.\n   > (He dreams of becoming a writer.)\n\n9. –≤–æ–Ω–∞ / –ø—Ä–∞—Ü—é–≤–∞–ª–∞ / —Å–µ–∫—Ä–µ—Ç–∞—Ä–∫–æ—é / –ø'—è—Ç—å / —Ä–æ–∫—ñ–≤\n   > [!answer] –í–æ–Ω–∞ –ø—Ä–∞—Ü—é–≤–∞–ª–∞ —Å–µ–∫—Ä–µ—Ç–∞—Ä–∫–æ—é –ø'—è—Ç—å —Ä–æ–∫—ñ–≤.\n   > (She worked as a secretary for five years.)\n\n10. –≤–æ–Ω–∏ / —Å—Ç–∞–Ω—É—Ç—å / —ñ–Ω–∂–µ–Ω–µ—Ä–∞–º–∏\n    > [!answer] –í–æ–Ω–∏ —Å—Ç–∞–Ω—É—Ç—å —ñ–Ω–∂–µ–Ω–µ—Ä–∞–º–∏.\n    > (They will become engineers.)\n\n11. –≤—ñ–Ω / –±—É–≤ / –¥–∏—Ä–µ–∫—Ç–æ—Ä–æ–º / —à–∫–æ–ª–∏\n    > [!answer] –í—ñ–Ω –±—É–≤ –¥–∏—Ä–µ–∫—Ç–æ—Ä–æ–º —à–∫–æ–ª–∏.\n    > (He was the director of the school.)\n\n12. –≤–æ–Ω–∞ / —Ö–æ—Ç—ñ–ª–∞ / —Å—Ç–∞—Ç–∏ / –∞–∫—Ç–æ—Ä–∫–æ—é\n    > [!answer] –í–æ–Ω–∞ —Ö–æ—Ç—ñ–ª–∞ —Å—Ç–∞—Ç–∏ –∞–∫—Ç–æ—Ä–∫–æ—é.\n    > (She wanted to become an actress.)\n\n## error-correction: Fix the Instrumental\n\n> Each sentence has ONE error. Find and correct it.\n\n1. –í—ñ–Ω –±—É–≤ —Å—Ç—É–¥–µ–Ω—Ç.\n   > [!error] —Å—Ç—É–¥–µ–Ω—Ç\n   > [!answer] —Å—Ç—É–¥–µ–Ω—Ç–æ–º\n   > [!explanation] After \"–±—É–≤\" (was), professions take the instrumental case.\n   > [!options] —Å—Ç—É–¥–µ–Ω—Ç | —Å—Ç—É–¥–µ–Ω—Ç–æ–º | —Å—Ç—É–¥–µ–Ω—Ç–∞ | —Å—Ç—É–¥–µ–Ω—Ç—É\n\n2. –í–æ–Ω–∞ —Å—Ç–∞–ª–∞ –≤—á–∏—Ç–µ–ª—å–∫–∞.\n   > [!error] –≤—á–∏—Ç–µ–ª—å–∫–∞\n   > [!answer] –≤—á–∏—Ç–µ–ª—å–∫–æ—é\n   > [!explanation] \"–°—Ç–∞—Ç–∏\" always requires the instrumental case.\n   > [!options] –≤—á–∏—Ç–µ–ª—å–∫–∞ | –≤—á–∏—Ç–µ–ª—å–∫–æ—é | –≤—á–∏—Ç–µ–ª—å–∫—É | –≤—á–∏—Ç–µ–ª—å–∫–∏\n\n3. –Ø –ø—Ä–∞—Ü—é—é –ø—Ä–æ–≥—Ä–∞–º—ñ—Å—Ç.\n   > [!error] –ø—Ä–æ–≥—Ä–∞–º—ñ—Å—Ç\n   > [!answer] –ø—Ä–æ–≥—Ä–∞–º—ñ—Å—Ç–æ–º\n   > [!explanation] \"–ü—Ä–∞—Ü—é–≤–∞—Ç–∏\" + profession requires instrumental.\n   > [!options] –ø—Ä–æ–≥—Ä–∞–º—ñ—Å—Ç | –ø—Ä–æ–≥—Ä–∞–º—ñ—Å—Ç–æ–º | –ø—Ä–æ–≥—Ä–∞–º—ñ—Å—Ç–∞ | –ø—Ä–æ–≥—Ä–∞–º—ñ—Å—Ç—É\n\n4. –í—ñ–Ω –±—É–¥–µ –ª—ñ–∫–∞—Ä.\n   > [!error] –ª—ñ–∫–∞—Ä\n   > [!answer] –ª—ñ–∫–∞—Ä–µ–º\n   > [!explanation] Future \"–±—É–¥–µ\" + profession requires instrumental.\n   > [!options] –ª—ñ–∫–∞—Ä | –ª—ñ–∫–∞—Ä–µ–º | –ª—ñ–∫–∞—Ä—è | –ª—ñ–∫–∞—Ä—é\n\n5. –í–æ–Ω–∞ —Ö–æ—á–µ —Å—Ç–∞—Ç–∏ –∂—É—Ä–Ω–∞–ª—ñ—Å—Ç–∫–∞.\n   > [!error] –∂—É—Ä–Ω–∞–ª—ñ—Å—Ç–∫–∞\n   > [!answer] –∂—É—Ä–Ω–∞–ª—ñ—Å—Ç–∫–æ—é\n   > [!explanation] \"–°—Ç–∞—Ç–∏\" always requires the instrumental case.\n   > [!options] –∂—É—Ä–Ω–∞–ª—ñ—Å—Ç–∫–∞ | –∂—É—Ä–Ω–∞–ª—ñ—Å—Ç–∫–æ—é | –∂—É—Ä–Ω–∞–ª—ñ—Å—Ç–∫—É | –∂—É—Ä–Ω–∞–ª—ñ—Å—Ç–∫–∏\n\n6. –ú–∏ –±—É–ª–∏ –¥—Ä—É–∑—ñ.\n   > [!error] –¥—Ä—É–∑—ñ\n   > [!answer] –¥—Ä—É–∑—è–º–∏\n   > [!explanation] Past \"–±—É–ª–∏\" requires instrumental plural.\n   > [!options] –¥—Ä—É–∑—ñ | –¥—Ä—É–∑—è–º–∏ | –¥—Ä—É–∑—ñ–≤ | –¥—Ä—É–∑—è–º\n\n7. –í—ñ–Ω —Å—Ç–∞–ª–∞ —ñ–Ω–∂–µ–Ω–µ—Ä–æ–º.\n   > [!error] —Å—Ç–∞–ª–∞\n   > [!answer] —Å—Ç–∞–≤\n   > [!explanation] \"–í—ñ–Ω\" (he) requires masculine past form \"—Å—Ç–∞–≤.\"\n   > [!options] —Å—Ç–∞–ª–∞ | —Å—Ç–∞–≤ | —Å—Ç–∞–ª–æ | —Å—Ç–∞–ª–∏\n\n8. –í–æ–Ω–∞ –ø—Ä–∞—Ü—é—î –ª—ñ–∫–∞—Ä.\n   > [!error] –ª—ñ–∫–∞—Ä\n   > [!answer] –ª—ñ–∫–∞—Ä–∫–æ—é\n   > [!explanation] Use feminine \"–ª—ñ–∫–∞—Ä–∫–∞\" for woman + instrumental.\n   > [!options] –ª—ñ–∫–∞—Ä | –ª—ñ–∫–∞—Ä–∫–æ—é | –ª—ñ–∫–∞—Ä–∫—É | –ª—ñ–∫–∞—Ä–∫–∏\n\n9. –í—ñ–Ω –±—É–≤ –¥–∏—Ä–µ–∫—Ç–æ—Ä —à–∫–æ–ª–∏.\n   > [!error] –¥–∏—Ä–µ–∫—Ç–æ—Ä\n   > [!answer] –¥–∏—Ä–µ–∫—Ç–æ—Ä–æ–º\n   > [!explanation] Past \"–±—É–≤\" requires the instrumental case.\n   > [!options] –¥–∏—Ä–µ–∫—Ç–æ—Ä | –¥–∏—Ä–µ–∫—Ç–æ—Ä–æ–º | –¥–∏—Ä–µ–∫—Ç–æ—Ä–∞ | –¥–∏—Ä–µ–∫—Ç–æ—Ä—É\n\n10. –í–æ–Ω–∞ –±—É–¥–µ –ø–∏—Å—å–º–µ–Ω–Ω–∏–∫.\n    > [!error] –ø–∏—Å—å–º–µ–Ω–Ω–∏–∫\n    > [!answer] –ø–∏—Å—å–º–µ–Ω–Ω–∏—Ü–µ—é\n    > [!explanation] Use feminine \"–ø–∏—Å—å–º–µ–Ω–Ω–∏—Ü—è\" for woman + instrumental.\n    > [!options] –ø–∏—Å—å–º–µ–Ω–Ω–∏–∫ | –ø–∏—Å—å–º–µ–Ω–Ω–∏—Ü–µ—é | –ø–∏—Å—å–º–µ–Ω–Ω–∏—Ü—é | –ø–∏—Å—å–º–µ–Ω–Ω–∏—Ü—ñ\n\n11. –í—ñ–Ω –º—Ä—ñ—î —Å—Ç–∞—Ç–∏ –∞–∫—Ç–æ—Ä.\n    > [!error] –∞–∫—Ç–æ—Ä\n    > [!answer] –∞–∫—Ç–æ—Ä–æ–º\n    > [!explanation] \"–°—Ç–∞—Ç–∏\" always requires the instrumental case.\n    > [!options] –∞–∫—Ç–æ—Ä | –∞–∫—Ç–æ—Ä–æ–º | –∞–∫—Ç–æ—Ä–∞ | –∞–∫—Ç–æ—Ä—É\n\n12. –ú–∏ —Å—Ç–∞–Ω–µ–º–æ —ñ–Ω–∂–µ–Ω–µ—Ä–∏.\n    > [!error] —ñ–Ω–∂–µ–Ω–µ—Ä–∏\n    > [!answer] —ñ–Ω–∂–µ–Ω–µ—Ä–∞–º–∏\n    > [!explanation] Future of \"—Å—Ç–∞—Ç–∏\" requires instrumental plural.\n    > [!options] —ñ–Ω–∂–µ–Ω–µ—Ä–∏ | —ñ–Ω–∂–µ–Ω–µ—Ä–∞–º–∏ | —ñ–Ω–∂–µ–Ω–µ—Ä—ñ–≤ | —ñ–Ω–∂–µ–Ω–µ—Ä–∞–º\n\n## cloze: Complete the Story\n\n> Fill in the blanks with the correct words.\n\n–ú—ñ–π –¥—Ä—É–≥ –ê–Ω–¥—Ä—ñ–π —Ä–∞–Ω—ñ—à–µ [___:1]. –í—ñ–Ω –≤—á–∏–≤—Å—è –≤ —É–Ω—ñ–≤–µ—Ä—Å–∏—Ç–µ—Ç—ñ –ø'—è—Ç—å —Ä–æ–∫—ñ–≤. –ü—ñ—Å–ª—è —É–Ω—ñ–≤–µ—Ä—Å–∏—Ç–µ—Ç—É –≤—ñ–Ω [___:2]. –ó–∞—Ä–∞–∑ –≤—ñ–Ω [___:3] —É –≤–µ–ª–∏–∫—ñ–π –ª—ñ–∫–∞—Ä–Ω—ñ. –í—ñ–Ω –∫–∞–∂–µ, —â–æ –∑–∞–≤–∂–¥–∏ –º—Ä—ñ—è–≤ [___:4].\n\n1. –±—É–≤ —Å—Ç—É–¥–µ–Ω—Ç–æ–º | –±—É–≤ —Å—Ç—É–¥–µ–Ω—Ç | –±—É–≤ —Å—Ç—É–¥–µ–Ω—Ç–∞\n   > [!answer] –±—É–≤ —Å—Ç—É–¥–µ–Ω—Ç–æ–º\n\n2. —Å—Ç–∞–≤ –ª—ñ–∫–∞—Ä–µ–º | —Å—Ç–∞–≤ –ª—ñ–∫–∞—Ä | —Å—Ç–∞–≤ –ª—ñ–∫–∞—Ä—è\n   > [!answer] —Å—Ç–∞–≤ –ª—ñ–∫–∞—Ä–µ–º\n\n3. –ø—Ä–∞—Ü—é—î –ª—ñ–∫–∞—Ä–µ–º | –ø—Ä–∞—Ü—é—î –ª—ñ–∫–∞—Ä | –ø—Ä–∞—Ü—é—î –ª—ñ–∫–∞—Ä—è\n   > [!answer] –ø—Ä–∞—Ü—é—î –ª—ñ–∫–∞—Ä–µ–º\n\n4. —Å—Ç–∞—Ç–∏ –ª—ñ–∫–∞—Ä–µ–º | —Å—Ç–∞—Ç–∏ –ª—ñ–∫–∞—Ä | —Å—Ç–∞—Ç–∏ –ª—ñ–∫–∞—Ä—è\n   > [!answer] —Å—Ç–∞—Ç–∏ –ª—ñ–∫–∞—Ä–µ–º\n\n---\n\n–ú–æ—è —Å–µ—Å—Ç—Ä–∞ –û–∫—Å–∞–Ω–∞ [___:1] –≤ –∂—É—Ä–Ω–∞–ª—ñ –ø'—è—Ç—å —Ä–æ–∫—ñ–≤. –ü–æ—Ç—ñ–º –≤–æ–Ω–∞ [___:2]. –¢–µ–ø–µ—Ä –≤–æ–Ω–∞ [___:3]. –í–æ–Ω–∞ –Ω–∞–ø–∏—Å–∞–ª–∞ —Ç—Ä–∏ –∫–Ω–∏–≥–∏. –Ø –ø–∏—à–∞—é—Å—è, —â–æ –º–æ—è —Å–µ—Å—Ç—Ä–∞ [___:4]!\n\n1. –ø—Ä–∞—Ü—é–≤–∞–ª–∞ –∂—É—Ä–Ω–∞–ª—ñ—Å—Ç–∫–æ—é | –ø—Ä–∞—Ü—é–≤–∞–ª–∞ –∂—É—Ä–Ω–∞–ª—ñ—Å—Ç–∫–∞ | –ø—Ä–∞—Ü—é–≤–∞–ª–∞ –∂—É—Ä–Ω–∞–ª—ñ—Å—Ç–∫—É\n   > [!answer] –ø—Ä–∞—Ü—é–≤–∞–ª–∞ –∂—É—Ä–Ω–∞–ª—ñ—Å—Ç–∫–æ—é\n\n2. —Å—Ç–∞–ª–∞ –ø–∏—Å—å–º–µ–Ω–Ω–∏—Ü–µ—é | —Å—Ç–∞–ª–∞ –ø–∏—Å—å–º–µ–Ω–Ω–∏—Ü—è | —Å—Ç–∞–ª–∞ –ø–∏—Å—å–º–µ–Ω–Ω–∏—Ü—é\n   > [!answer] —Å—Ç–∞–ª–∞ –ø–∏—Å—å–º–µ–Ω–Ω–∏—Ü–µ—é\n\n3. –ø–∏—à–µ –∫–Ω–∏–≥–∏ | –ø–∏—à–µ –∫–Ω–∏–∂–∫–∏ | –ø–∏—à–µ —Ä–æ–º–∞–Ω–∏\n   > [!answer] –ø–∏—à–µ –∫–Ω–∏–≥–∏\n\n4. —Å—Ç–∞–ª–∞ –ø–∏—Å—å–º–µ–Ω–Ω–∏—Ü–µ—é | —Å—Ç–∞–ª–∞ –∂—É—Ä–Ω–∞–ª—ñ—Å—Ç–∫–æ—é | –ø—Ä–∞—Ü—é—î –ø–∏—Å—å–º–µ–Ω–Ω–∏—Ü–µ—é\n   > [!answer] —Å—Ç–∞–ª–∞ –ø–∏—Å—å–º–µ–Ω–Ω–∏—Ü–µ—é\n\n## dialogue-reorder: Job Interview\n\n- –Ø –±—É–≤ –∂—É—Ä–Ω–∞–ª—ñ—Å—Ç–æ–º –ø'—è—Ç—å —Ä–æ–∫—ñ–≤.\n- –î–æ–±—Ä–∏–π –¥–µ–Ω—å! –°—ñ–¥–∞–π—Ç–µ, –±—É–¥—å –ª–∞—Å–∫–∞.\n- –î—è–∫—É—é! –î–æ –ø–æ–±–∞—á–µ–Ω–Ω—è!\n- –ö–∏–º –≤–∏ –ø—Ä–∞—Ü—é–≤–∞–ª–∏ —Ä–∞–Ω—ñ—à–µ?\n- –î–æ–±—Ä–∏–π –¥–µ–Ω—å!\n- –ú–∏ –∑–∞—Ç–µ–ª–µ—Ñ–æ–Ω—É—î–º–æ –≤–∞–º –∑–∞–≤—Ç—Ä–∞.\n- –ß–æ–º—É —Ö–æ—á–µ—Ç–µ —Å—Ç–∞—Ç–∏ –ø—Ä–æ–≥—Ä–∞–º—ñ—Å—Ç–æ–º?\n- –ú–µ–Ω—ñ –ø–æ–¥–æ–±–∞—é—Ç—å—Å—è —Ç–µ—Ö–Ω–æ–ª–æ–≥—ñ—ó —ñ —è —Ö–æ—á—É –ø—Ä–∞—Ü—é–≤–∞—Ç–∏ –≤ IT.\n\n> [!answer]\n> 1. –î–æ–±—Ä–∏–π –¥–µ–Ω—å!\n> 2. –î–æ–±—Ä–∏–π –¥–µ–Ω—å! –°—ñ–¥–∞–π—Ç–µ, –±—É–¥—å –ª–∞—Å–∫–∞.\n> 3. –ö–∏–º –≤–∏ –ø—Ä–∞—Ü—é–≤–∞–ª–∏ —Ä–∞–Ω—ñ—à–µ?\n> 4. –Ø –±—É–≤ –∂—É—Ä–Ω–∞–ª—ñ—Å—Ç–æ–º –ø'—è—Ç—å —Ä–æ–∫—ñ–≤.\n> 5. –ß–æ–º—É —Ö–æ—á–µ—Ç–µ —Å—Ç–∞—Ç–∏ –ø—Ä–æ–≥—Ä–∞–º—ñ—Å—Ç–æ–º?\n> 6. –ú–µ–Ω—ñ –ø–æ–¥–æ–±–∞—é—Ç—å—Å—è —Ç–µ—Ö–Ω–æ–ª–æ–≥—ñ—ó —ñ —è —Ö–æ—á—É –ø—Ä–∞—Ü—é–≤–∞—Ç–∏ –≤ IT.\n> 7. –ú–∏ –∑–∞—Ç–µ–ª–µ—Ñ–æ–Ω—É—î–º–æ –≤–∞–º –∑–∞–≤—Ç—Ä–∞.\n> 8. –î—è–∫—É—é! –î–æ –ø–æ–±–∞—á–µ–Ω–Ω—è!\n\n---\n\n- –í—ñ–Ω –±—É–≤ —Å—Ç—É–¥–µ–Ω—Ç–æ–º –ø–æ–ª—ñ—Ç–µ—Ö–Ω—ñ–∫–∏.\n- –ö–∏–º –ø—Ä–∞—Ü—é—î —Ç–≤—ñ–π —Ç–∞—Ç–æ?\n- –í—ñ–Ω –ø—Ä–∞—Ü—é—î –ø—Ä–æ–≥—Ä–∞–º—ñ—Å—Ç–æ–º —É –∫–æ–º–ø–∞–Ω—ñ—ó.\n- –ö—Ä—É—Ç–æ! –ê –∫–∏–º –≤—ñ–Ω —Ö–æ—á–µ —Å—Ç–∞—Ç–∏?\n- –ö–∏–º –≤—ñ–Ω –±—É–≤ —Ä–∞–Ω—ñ—à–µ?\n- –í—ñ–Ω —Ö–æ—á–µ —Å—Ç–∞—Ç–∏ –¥–∏—Ä–µ–∫—Ç–æ—Ä–æ–º –∑–∞–≤–æ–¥—É!\n\n> [!answer]\n> 1. –ö–∏–º –ø—Ä–∞—Ü—é—î —Ç–≤—ñ–π —Ç–∞—Ç–æ?\n> 2. –í—ñ–Ω –ø—Ä–∞—Ü—é—î –ø—Ä–æ–≥—Ä–∞–º—ñ—Å—Ç–æ–º —É –∫–æ–º–ø–∞–Ω—ñ—ó.\n> 3. –ö–∏–º –≤—ñ–Ω –±—É–≤ —Ä–∞–Ω—ñ—à–µ?\n> 4. –í—ñ–Ω –±—É–≤ —Å—Ç—É–¥–µ–Ω—Ç–æ–º –ø–æ–ª—ñ—Ç–µ—Ö–Ω—ñ–∫–∏.\n> 5. –ö—Ä—É—Ç–æ! –ê –∫–∏–º –≤—ñ–Ω —Ö–æ—á–µ —Å—Ç–∞—Ç–∏?\n> 6. –í—ñ–Ω —Ö–æ—á–µ —Å—Ç–∞—Ç–∏ –¥–∏—Ä–µ–∫—Ç–æ—Ä–æ–º –∑–∞–≤–æ–¥—É!\n\n## mark-the-words: Find Instrumental Forms\n\nClick on instrumental forms used with –±—É—Ç–∏/—Å—Ç–∞—Ç–∏/–ø—Ä–∞—Ü—é–≤–∞—Ç–∏.\n\n–í—ñ–Ω —Ä–∞–Ω—ñ—à–µ [–±—É–≤ —Å—Ç—É–¥–µ–Ω—Ç–æ–º](correct). –ó–∞—Ä–∞–∑ –≤—ñ–Ω –ª—ñ–∫–∞—Ä. –í—ñ–Ω [–ø—Ä–∞—Ü—é—î –ª—ñ–∫–∞—Ä–µ–º](correct) —É –ª—ñ–∫–∞—Ä–Ω—ñ. –ô–æ–≥–æ —Å–µ—Å—Ç—Ä–∞ [—Å—Ç–∞–ª–∞ –≤—á–∏—Ç–µ–ª—å–∫–æ—é](correct).\n\n---\n\n–í–æ–Ω–∞ [–±—É–ª–∞ –∂—É—Ä–Ω–∞–ª—ñ—Å—Ç–∫–æ—é](correct) –ø'—è—Ç—å —Ä–æ–∫—ñ–≤. –ü–æ—Ç—ñ–º –≤–æ–Ω–∞ [—Å—Ç–∞–ª–∞ –ø–∏—Å—å–º–µ–Ω–Ω–∏—Ü–µ—é](correct). –ó–∞—Ä–∞–∑ –≤–æ–Ω–∞ –ø–∏—Å—å–º–µ–Ω–Ω–∏—Ü—è. –í–æ–Ω–∞ [–ø—Ä–∞—Ü—é—î –ø–∏—Å—å–º–µ–Ω–Ω–∏—Ü–µ—é](correct).\n\n---\n\n–ú—ñ–π –±—Ä–∞—Ç —ñ–Ω–∂–µ–Ω–µ—Ä. –†–∞–Ω—ñ—à–µ –≤—ñ–Ω [–±—É–≤ —Å—Ç—É–¥–µ–Ω—Ç–æ–º](correct). –í—ñ–Ω [—Ö–æ—á–µ —Å—Ç–∞—Ç–∏ –¥–∏—Ä–µ–∫—Ç–æ—Ä–æ–º](correct). –í—ñ–Ω [–ø—Ä–∞—Ü—é—î —ñ–Ω–∂–µ–Ω–µ—Ä–æ–º](correct) –Ω–∞ –∑–∞–≤–æ–¥—ñ.\n\n## translate: English to Ukrainian\n\nHe was a student.\n\n- [x] –í—ñ–Ω –±—É–≤ —Å—Ç—É–¥–µ–Ω—Ç–æ–º.\n- [ ] –í—ñ–Ω –±—É–≤ —Å—Ç—É–¥–µ–Ω—Ç.\n- [ ] –í—ñ–Ω –±—É–≤ —Å—Ç—É–¥–µ–Ω—Ç–∞.\n\n---\n\nShe became a teacher.\n\n- [x] –í–æ–Ω–∞ —Å—Ç–∞–ª–∞ –≤—á–∏—Ç–µ–ª—å–∫–æ—é.\n- [ ] –í–æ–Ω–∞ —Å—Ç–∞–ª–∞ –≤—á–∏—Ç–µ–ª—å–∫–∞.\n- [ ] –í–æ–Ω–∞ —Å—Ç–∞–ª–∞ –≤—á–∏—Ç–µ–ª—å–∫—É.\n\n---\n\nI work as a programmer.\n\n- [x] –Ø –ø—Ä–∞—Ü—é—é –ø—Ä–æ–≥—Ä–∞–º—ñ—Å—Ç–æ–º.\n- [ ] –Ø –ø—Ä–∞—Ü—é—é –ø—Ä–æ–≥—Ä–∞–º—ñ—Å—Ç.\n- [ ] –Ø –ø—Ä–∞—Ü—é—é –ø—Ä–æ–≥—Ä–∞–º—ñ—Å—Ç–∞.\n\n---\n\nHe will be a doctor.\n\n- [x] –í—ñ–Ω –±—É–¥–µ –ª—ñ–∫–∞—Ä–µ–º.\n- [ ] –í—ñ–Ω –±—É–¥–µ –ª—ñ–∫–∞—Ä.\n- [ ] –í—ñ–Ω –±—É–¥–µ –ª—ñ–∫–∞—Ä—è.\n\n---\n\nShe wants to become a journalist.\n\n- [x] –í–æ–Ω–∞ —Ö–æ—á–µ —Å—Ç–∞—Ç–∏ –∂—É—Ä–Ω–∞–ª—ñ—Å—Ç–∫–æ—é.\n- [ ] –í–æ–Ω–∞ —Ö–æ—á–µ —Å—Ç–∞—Ç–∏ –∂—É—Ä–Ω–∞–ª—ñ—Å—Ç–∫–∞.\n- [ ] –í–æ–Ω–∞ —Ö–æ—á–µ —Å—Ç–∞—Ç–∏ –∂—É—Ä–Ω–∞–ª—ñ—Å—Ç–∫—É.\n\n---\n\nWe were friends.\n\n- [x] –ú–∏ –±—É–ª–∏ –¥—Ä—É–∑—è–º–∏.\n- [ ] –ú–∏ –±—É–ª–∏ –¥—Ä—É–∑—ñ.\n- [ ] –ú–∏ –±—É–ª–∏ –¥—Ä—É–∑—ñ–≤.\n\n---\n\nWhat do you work as?\n\n- [x] –ö–∏–º —Ç–∏ –ø—Ä–∞—Ü—é—î—à?\n- [ ] –©–æ —Ç–∏ –ø—Ä–∞—Ü—é—î—à?\n- [ ] –•—Ç–æ —Ç–∏ –ø—Ä–∞—Ü—é—î—à?\n\n---\n\nHe dreams of becoming a writer.\n\n- [x] –í—ñ–Ω –º—Ä—ñ—î —Å—Ç–∞—Ç–∏ –ø–∏—Å—å–º–µ–Ω–Ω–∏–∫–æ–º.\n- [ ] –í—ñ–Ω –º—Ä—ñ—î —Å—Ç–∞—Ç–∏ –ø–∏—Å—å–º–µ–Ω–Ω–∏–∫.\n- [ ] –í—ñ–Ω –º—Ä—ñ—î —Å—Ç–∞—Ç–∏ –ø–∏—Å—å–º–µ–Ω–Ω–∏–∫–∞.\n\n---\n\nShe worked as a secretary.\n\n- [x] –í–æ–Ω–∞ –ø—Ä–∞—Ü—é–≤–∞–ª–∞ —Å–µ–∫—Ä–µ—Ç–∞—Ä–∫–æ—é.\n- [ ] –í–æ–Ω–∞ –ø—Ä–∞—Ü—é–≤–∞–ª–∞ —Å–µ–∫—Ä–µ—Ç–∞—Ä–∫–∞.\n- [ ] –í–æ–Ω–∞ –ø—Ä–∞—Ü—é–≤–∞–ª–∞ —Å–µ–∫—Ä–µ—Ç–∞—Ä–∫—É.\n\n---\n\nThey will become engineers.\n\n- [x] –í–æ–Ω–∏ —Å—Ç–∞–Ω—É—Ç—å —ñ–Ω–∂–µ–Ω–µ—Ä–∞–º–∏.\n- [ ] –í–æ–Ω–∏ —Å—Ç–∞–Ω—É—Ç—å —ñ–Ω–∂–µ–Ω–µ—Ä–∏.\n- [ ] –í–æ–Ω–∏ —Å—Ç–∞–Ω—É—Ç—å —ñ–Ω–∂–µ–Ω–µ—Ä—ñ–≤.\n\n---\n\nHe was the director of the school.\n\n- [x] –í—ñ–Ω –±—É–≤ –¥–∏—Ä–µ–∫—Ç–æ—Ä–æ–º —à–∫–æ–ª–∏.\n- [ ] –í—ñ–Ω –±—É–≤ –¥–∏—Ä–µ–∫—Ç–æ—Ä —à–∫–æ–ª–∏.\n- [ ] –í—ñ–Ω –±—É–≤ –¥–∏—Ä–µ–∫—Ç–æ—Ä–∞ —à–∫–æ–ª–∏.\n\n---\n\nShe wanted to become an actress.\n\n- [x] –í–æ–Ω–∞ —Ö–æ—Ç—ñ–ª–∞ —Å—Ç–∞—Ç–∏ –∞–∫—Ç–æ—Ä–∫–æ—é.\n- [ ] –í–æ–Ω–∞ —Ö–æ—Ç—ñ–ª–∞ —Å—Ç–∞—Ç–∏ –∞–∫—Ç–æ—Ä–∫–∞.\n- [ ] –í–æ–Ω–∞ —Ö–æ—Ç—ñ–ª–∞ —Å—Ç–∞—Ç–∏ –∞–∫—Ç–æ—Ä–∫—É.\n\n---\n\n# Vocabulary\n\n| Word | IPA | English | POS | Gender | Note |\n|------|-----|---------|-----|--------|------|\n| –±—É—Ç–∏ | /Ààbut…™/ | to be | verb | ‚Äî | uses instrumental in past/future |\n| —Å—Ç–∞—Ç–∏ | /Ààst…ët…™/ | to become | verb | ‚Äî | perfective, always + instrumental |\n| —Å—Ç–∞–≤–∞—Ç–∏ | /st…ëÀà ã…ët…™/ | to become | verb | ‚Äî | imperfective of —Å—Ç–∞—Ç–∏ |\n| –ø—Ä–∞—Ü—é–≤–∞—Ç–∏ | /pr…ëÀàtÕ°s ≤u ã…ët…™/ | to work | verb | ‚Äî | + instr. for profession |\n| —Å–ª—É–∂–∏—Ç–∏ | /sluÀà í…™t…™/ | to serve | verb | ‚Äî | + instr. for role |\n| –∑–∞–ª–∏—à–∞—Ç–∏—Å—è | /z…ël…™Àà É…ët…™s ≤…ë/ | to remain | verb | ‚Äî | + instr. for state |\n| –≤–∏—è–≤–∏—Ç–∏—Å—è | / ã…™j…ëÀà ã…™t…™s ≤…ë/ | to turn out to be | verb | ‚Äî | + instr. |\n| –∑–¥–∞–≤–∞—Ç–∏—Å—è | /zd…ëÀà ã…ët…™s ≤…ë/ | to seem | verb | ‚Äî | + instr. |\n| –≤–≤–∞–∂–∞—Ç–∏—Å—è | /w…ëÀà í…ët…™s ≤…ë/ | to be considered | verb | ‚Äî | + instr. |\n| –Ω–∞–∑–∏–≤–∞—Ç–∏—Å—è | /n…ëz…™Àà ã…ët…™s ≤…ë/ | to be called | verb | ‚Äî | + instr. |\n| –ª—ñ–∫–∞—Ä | /Ààlik…ër/ | doctor (m) | noun | m | instr: –ª—ñ–∫–∞—Ä–µ–º |\n| –≤—á–∏—Ç–µ–ª—å | /Àà ãt É…™t…õl ≤/ | teacher (m) | noun | m | instr: –≤—á–∏—Ç–µ–ª–µ–º |\n| —ñ–Ω–∂–µ–Ω–µ—Ä | /in í…õÀàn…õr/ | engineer | noun | m | instr: —ñ–Ω–∂–µ–Ω–µ—Ä–æ–º |\n| –ø—Ä–æ–≥—Ä–∞–º—ñ—Å—Ç | /pr…î…¶r…ëÀàmist/ | programmer (m) | noun | m | instr: –ø—Ä–æ–≥—Ä–∞–º—ñ—Å—Ç–æ–º |\n| –∂—É—Ä–Ω–∞–ª—ñ—Å—Ç | / íurn…ëÀàlist/ | journalist (m) | noun | m | instr: –∂—É—Ä–Ω–∞–ª—ñ—Å—Ç–æ–º |\n| —é—Ä–∏—Å—Ç | /juÀàr…™st/ | lawyer | noun | m | instr: —é—Ä–∏—Å—Ç–æ–º |\n| –µ–∫–æ–Ω–æ–º—ñ—Å—Ç | /…õk…îÀàn…îmist/ | economist | noun | m | instr: –µ–∫–æ–Ω–æ–º—ñ—Å—Ç–æ–º |\n| —Ö—É–¥–æ–∂–Ω–∏–∫ | /xuÀàd…î ín…™k/ | artist | noun | m | instr: —Ö—É–¥–æ–∂–Ω–∏–∫–æ–º |\n| –º—É–∑–∏–∫–∞–Ω—Ç | /muz…™Ààk…ënt/ | musician | noun | m | instr: –º—É–∑–∏–∫–∞–Ω—Ç–æ–º |\n| –ø–∏—Å—å–º–µ–Ω–Ω–∏–∫ | /p…™s ≤Ààm…õnÀê…™k/ | writer (m) | noun | m | instr: –ø–∏—Å—å–º–µ–Ω–Ω–∏–∫–æ–º |\n| –∞–∫—Ç–æ—Ä | /Àà…ëkt…îr/ | actor (m) | noun | m | instr: –∞–∫—Ç–æ—Ä–æ–º |\n| –¥–∏—Ä–µ–∫—Ç–æ—Ä | /d…™Ààr…õkt…îr/ | director | noun | m | instr: –¥–∏—Ä–µ–∫—Ç–æ—Ä–æ–º |\n| –º–µ–Ω–µ–¥–∂–µ—Ä | /Ààm…õn…õd í…õr/ | manager | noun | m | instr: –º–µ–Ω–µ–¥–∂–µ—Ä–æ–º |\n| —Å–µ–∫—Ä–µ—Ç–∞—Ä | /s…õkr…õÀàt…ër/ | secretary (m) | noun | m | instr: —Å–µ–∫—Ä–µ—Ç–∞—Ä–µ–º |\n| –≤–æ–¥—ñ–π | / É…îÀàdij/ | driver | noun | m | instr: –≤–æ–¥—ñ—î–º |\n| –æ—Ä—É–¥–Ω–∏–π | /…îÀàrudn…™j/ | instrumental (case) | adj | m | grammar term |\n| –≤—ñ–¥–º—ñ–Ω–æ–∫ | / ÉidÀàmin…îk/ | grammatical case | noun | m | grammar term |\n| —á–∞—Å | /t É…ës/ | tense, time | noun | m | grammar term |\n\n---\n\n> [!tip] Remember the Key Verbs\n> Three verbs that take instrumental for professions: **–±—É—Ç–∏** (to be, past/future), **—Å—Ç–∞—Ç–∏** (to become), **–ø—Ä–∞—Ü—é–≤–∞—Ç–∏** (to work as). Master these and you can talk about any career!\n",
    "createdAt": "2025-12-16T11:55:14.524264Z",
    "modifiedAt": "2025-12-16T11:55:14.524264Z",
    "version": 2
  },
  "activities": [],
  "vocabulary": {
    "moduleId": "mod-uk-A2-06",
    "level": "A2",
    "phase": "A2.1",
    "wordCount": 28,
    "newWordCount": 28,
    "reviewWordCount": 0,
    "transliterationMode": "none",
    "words": [
      {
        "id": "vocab-1",
        "uk": "–±—É—Ç–∏",
        "ipa": "/Ààbut…™/",
        "en": "to be",
        "pos": "verb",
        "gender": null,
        "note": "uses instrumental in past/future"
      },
      {
        "id": "vocab-2",
        "uk": "—Å—Ç–∞—Ç–∏",
        "ipa": "/Ààst…ët…™/",
        "en": "to become",
        "pos": "verb",
        "gender": null,
        "note": "perfective, always + instrumental"
      },
      {
        "id": "vocab-3",
        "uk": "—Å—Ç–∞–≤–∞—Ç–∏",
        "ipa": "/st…ëÀà ã…ët…™/",
        "en": "to become",
        "pos": "verb",
        "gender": null,
        "note": "imperfective of —Å—Ç–∞—Ç–∏"
      },
      {
        "id": "vocab-4",
        "uk": "–ø—Ä–∞—Ü—é–≤–∞—Ç–∏",
        "ipa": "/pr…ëÀàtÕ°s ≤u ã…ët…™/",
        "en": "to work",
        "pos": "verb",
        "gender": null,
        "note": "+ instr. for profession"
      },
      {
        "id": "vocab-5",
        "uk": "—Å–ª—É–∂–∏—Ç–∏",
        "ipa": "/sluÀà í…™t…™/",
        "en": "to serve",
        "pos": "verb",
        "gender": null,
        "note": "+ instr. for role"
      },
      {
        "id": "vocab-6",
        "uk": "–∑–∞–ª–∏—à–∞—Ç–∏—Å—è",
        "ipa": "/z…ël…™Àà É…ët…™s ≤…ë/",
        "en": "to remain",
        "pos": "verb",
        "gender": null,
        "note": "+ instr. for state"
      },
      {
        "id": "vocab-7",
        "uk": "–≤–∏—è–≤–∏—Ç–∏—Å—è",
        "ipa": "/ ã…™j…ëÀà ã…™t…™s ≤…ë/",
        "en": "to turn out to be",
        "pos": "verb",
        "gender": null,
        "note": "+ instr."
      },
      {
        "id": "vocab-8",
        "uk": "–∑–¥–∞–≤–∞—Ç–∏—Å—è",
        "ipa": "/zd…ëÀà ã…ët…™s ≤…ë/",
        "en": "to seem",
        "pos": "verb",
        "gender": null,
        "note": "+ instr."
      },
      {
        "id": "vocab-9",
        "uk": "–≤–≤–∞–∂–∞—Ç–∏—Å—è",
        "ipa": "/w…ëÀà í…ët…™s ≤…ë/",
        "en": "to be considered",
        "pos": "verb",
        "gender": null,
        "note": "+ instr."
      },
      {
        "id": "vocab-10",
        "uk": "–Ω–∞–∑–∏–≤–∞—Ç–∏—Å—è",
        "ipa": "/n…ëz…™Àà ã…ët…™s ≤…ë/",
        "en": "to be called",
        "pos": "verb",
        "gender": null,
        "note": "+ instr."
      },
      {
        "id": "vocab-11",
        "uk": "–ª—ñ–∫–∞—Ä",
        "ipa": "/Ààlik…ër/",
        "en": "doctor (m)",
        "pos": "noun",
        "gender": "m",
        "note": "instr: –ª—ñ–∫–∞—Ä–µ–º"
      },
      {
        "id": "vocab-12",
        "uk": "–≤—á–∏—Ç–µ–ª—å",
        "ipa": "/Àà ãt É…™t…õl ≤/",
        "en": "teacher (m)",
        "pos": "noun",
        "gender": "m",
        "note": "instr: –≤—á–∏—Ç–µ–ª–µ–º"
      },
      {
        "id": "vocab-13",
        "uk": "—ñ–Ω–∂–µ–Ω–µ—Ä",
        "ipa": "/in í…õÀàn…õr/",
        "en": "engineer",
        "pos": "noun",
        "gender": "m",
        "note": "instr: —ñ–Ω–∂–µ–Ω–µ—Ä–æ–º"
      },
      {
        "id": "vocab-14",
        "uk": "–ø—Ä–æ–≥—Ä–∞–º—ñ—Å—Ç",
        "ipa": "/pr…î…¶r…ëÀàmist/",
        "en": "programmer (m)",
        "pos": "noun",
        "gender": "m",
        "note": "instr: –ø—Ä–æ–≥—Ä–∞–º—ñ—Å—Ç–æ–º"
      },
      {
        "id": "vocab-15",
        "uk": "–∂—É—Ä–Ω–∞–ª—ñ—Å—Ç",
        "ipa": "/ íurn…ëÀàlist/",
        "en": "journalist (m)",
        "pos": "noun",
        "gender": "m",
        "note": "instr: –∂—É—Ä–Ω–∞–ª—ñ—Å—Ç–æ–º"
      },
      {
        "id": "vocab-16",
        "uk": "—é—Ä–∏—Å—Ç",
        "ipa": "/juÀàr…™st/",
        "en": "lawyer",
        "pos": "noun",
        "gender": "m",
        "note": "instr: —é—Ä–∏—Å—Ç–æ–º"
      },
      {
        "id": "vocab-17",
        "uk": "–µ–∫–æ–Ω–æ–º—ñ—Å—Ç",
        "ipa": "/…õk…îÀàn…îmist/",
        "en": "economist",
        "pos": "noun",
        "gender": "m",
        "note": "instr: –µ–∫–æ–Ω–æ–º—ñ—Å—Ç–æ–º"
      },
      {
        "id": "vocab-18",
        "uk": "—Ö—É–¥–æ–∂–Ω–∏–∫",
        "ipa": "/xuÀàd…î ín…™k/",
        "en": "artist",
        "pos": "noun",
        "gender": "m",
        "note": "instr: —Ö—É–¥–æ–∂–Ω–∏–∫–æ–º"
      },
      {
        "id": "vocab-19",
        "uk": "–º—É–∑–∏–∫–∞–Ω—Ç",
        "ipa": "/muz…™Ààk…ënt/",
        "en": "musician",
        "pos": "noun",
        "gender": "m",
        "note": "instr: –º—É–∑–∏–∫–∞–Ω—Ç–æ–º"
      },
      {
        "id": "vocab-20",
        "uk": "–ø–∏—Å—å–º–µ–Ω–Ω–∏–∫",
        "ipa": "/p…™s ≤Ààm…õnÀê…™k/",
        "en": "writer (m)",
        "pos": "noun",
        "gender": "m",
        "note": "instr: –ø–∏—Å—å–º–µ–Ω–Ω–∏–∫–æ–º"
      },
      {
        "id": "vocab-21",
        "uk": "–∞–∫—Ç–æ—Ä",
        "ipa": "/Àà…ëkt…îr/",
        "en": "actor (m)",
        "pos": "noun",
        "gender": "m",
        "note": "instr: –∞–∫—Ç–æ—Ä–æ–º"
      },
      {
        "id": "vocab-22",
        "uk": "–¥–∏—Ä–µ–∫—Ç–æ—Ä",
        "ipa": "/d…™Ààr…õkt…îr/",
        "en": "director",
        "pos": "noun",
        "gender": "m",
        "note": "instr: –¥–∏—Ä–µ–∫—Ç–æ—Ä–æ–º"
      },
      {
        "id": "vocab-23",
        "uk": "–º–µ–Ω–µ–¥–∂–µ—Ä",
        "ipa": "/Ààm…õn…õd í…õr/",
        "en": "manager",
        "pos": "noun",
        "gender": "m",
        "note": "instr: –º–µ–Ω–µ–¥–∂–µ—Ä–æ–º"
      },
      {
        "id": "vocab-24",
        "uk": "—Å–µ–∫—Ä–µ—Ç–∞—Ä",
        "ipa": "/s…õkr…õÀàt…ër/",
        "en": "secretary (m)",
        "pos": "noun",
        "gender": "m",
        "note": "instr: —Å–µ–∫—Ä–µ—Ç–∞—Ä–µ–º"
      },
      {
        "id": "vocab-25",
        "uk": "–≤–æ–¥—ñ–π",
        "ipa": "/ É…îÀàdij/",
        "en": "driver",
        "pos": "noun",
        "gender": "m",
        "note": "instr: –≤–æ–¥—ñ—î–º"
      },
      {
        "id": "vocab-26",
        "uk": "–æ—Ä—É–¥–Ω–∏–π",
        "ipa": "/…îÀàrudn…™j/",
        "en": "instrumental (case)",
        "pos": "adj",
        "gender": "m",
        "note": "grammar term"
      },
      {
        "id": "vocab-27",
        "uk": "–≤—ñ–¥–º—ñ–Ω–æ–∫",
        "ipa": "/ ÉidÀàmin…îk/",
        "en": "grammatical case",
        "pos": "noun",
        "gender": "m",
        "note": "grammar term"
      },
      {
        "id": "vocab-28",
        "uk": "—á–∞—Å",
        "ipa": "/t É…ës/",
        "en": "tense, time",
        "pos": "noun",
        "gender": "m",
        "note": "grammar term"
      }
    ],
    "reviewWords": []
  }
}