{
  "$schema": "../../../schemas/vibe-module.schema.json",
  "lesson": {
    "id": "lesson-uk-A2-28",
    "moduleId": "mod-uk-A2-28",
    "languagePair": "l2-uk-en",
    "subject": "language",
    "owner": "curricula-opus",
    "visibility": "public",
    "language": "uk",
    "targetLevel": "A2",
    "phase": "A2.3",
    "moduleNumber": 28,
    "moduleType": "grammar",
    "pedagogy": "Communicative",
    "immersionLevel": 0.4,
    "title": "I Think That...",
    "titleUk": null,
    "subtitle": "Expressing Opinions and Beliefs",
    "description": "Learner can express simple opinions",
    "objectives": [
      "Learner can express simple opinions",
      "Learner can agree and disagree politely",
      "Learner understands the contrast between Ð´ÑƒÐ¼Ð°Ñ‚Ð¸ and Ð²Ð²Ð°Ð¶Ð°Ñ‚Ð¸"
    ],
    "objectivesUk": null,
    "grammarFocus": [
      "opinion verbs",
      "that-clauses",
      "agreement forms"
    ],
    "tags": [
      "opinions",
      "thoughts",
      "agreement"
    ],
    "totalDuration": "60 min",
    "transliterationMode": "none",
    "sections": [
      {
        "id": "section-1",
        "name": "Summary",
        "nameEn": null,
        "type": "summary",
        "content": "## Warm-up\n\nWhat do you think about Ukrainian music? How do you feel about the weather today?\nExpressing opinions is the bridge between basic communication and real conversation. In this lesson, we move beyond just facts and start sharing our thoughts. We will learn how to agree, disagree, and open up our point of view to others in a respectful and culturally appropriate way.\n\n**In this module, we will explore:**\n- **I think that:** Ð¯ Ð´ÑƒÐ¼Ð°ÑŽ, Ñ‰Ð¾...\n- **I believe/consider:** Ð¯ Ð²Ð²Ð°Ð¶Ð°ÑŽ, Ñ‰Ð¾...\n- **In my opinion:** ÐÐ° Ð¼Ð¾ÑŽ Ð´ÑƒÐ¼ÐºÑƒ...\n- **From my point of view:** Ð— Ð¼Ð¾Ñ”Ñ— Ñ‚Ð¾Ñ‡ÐºÐ¸ Ð·Ð¾Ñ€Ñƒ...\n- **Agreement:** Ð¯ Ð·Ð³Ð¾Ð´ÐµÐ½ / Ð¯ Ð·Ð³Ð¾Ð´Ð½Ð°.\n- **Disagreement:** Ð¯ Ð½Ðµ Ð·Ð³Ð¾Ð´ÐµÐ½ / Ð¯ Ð½Ðµ Ð·Ð³Ð¾Ð´Ð½Ð°.\n\n> ðŸ’¡ **Cognitive Tip**\n> When you express an opinion in Ukrainian, you are often using the same **Ñ‰Ð¾** (that) connector we learned in the past. The logic is identical: you are reporting a thought or belief instead of a direct statement. This helps simplify the sentence structure because you don't need to learn a new grammar rule for every verb of thought.\n\n---\n\n## Presentation\n\n## 1. Expressing Your View\n\nThe most common way to start an opinion is with \"I think\". Depending on how formal or certain you are, you can choose different openers.\n\n| Ukrainian | Meaning | Usage |\n|-----------|---------|-------|\n| **Ð¯ Ð´ÑƒÐ¼Ð°ÑŽ, Ñ‰Ð¾...** | I think that... | General, everyday opinion |\n| **Ð¯ Ð²Ð²Ð°Ð¶Ð°ÑŽ, Ñ‰Ð¾...** | I consider/believe that... | More formal, serious, or argued |\n| **Ð¯ Ð³Ð°Ð´Ð°ÑŽ, Ñ‰Ð¾...** | I guess/think that... | Common in literature and songs |\n| **ÐÐ° Ð¼Ð¾ÑŽ Ð´ÑƒÐ¼ÐºÑƒ, ...** | In my opinion... | Classic opener for any setting |\n| **ÐÐ° Ð¼Ñ–Ð¹ Ð¿Ð¾Ð³Ð»ÑÐ´, ...** | From my point of view... | Focuses on your visual or ethical perspective |\n| **Ð— Ð¼Ð¾Ñ”Ñ— Ñ‚Ð¾Ñ‡ÐºÐ¸ Ð·Ð¾Ñ€Ñƒ, ...** | From my point of view... | Analytic and formal perspective |\n| **ÐœÐµÐ½Ñ– Ð·Ð´Ð°Ñ”Ñ‚ÑŒÑÑ, Ñ‰Ð¾...** | It seems to me that... | Softer, less categorical |\n\n### Examples:\n- **Ð¯ Ð´ÑƒÐ¼Ð°ÑŽ, Ñ‰Ð¾** ÑƒÐºÑ€Ð°Ñ—Ð½ÑÑŒÐºÐ° Ð¼Ð¾Ð²Ð° Ð´ÑƒÐ¶Ðµ Ð¼Ð¸Ð»Ð¾Ð·Ð²ÑƒÑ‡Ð½Ð°. (I think that Ukrainian is very melodic.)\n- **ÐÐ° Ð¼Ð¾ÑŽ Ð´ÑƒÐ¼ÐºÑƒ,** Ñ†Ðµ Ð¼Ñ–ÑÑ‚Ð¾ Ð½Ð°Ð¹ÐºÑ€Ð°Ñ‰Ðµ Ñƒ ÑÐ²Ñ–Ñ‚Ñ–. (In my opinion, this city is the best in the world.)\n- **Ð— Ð¼Ð¾Ñ”Ñ— Ñ‚Ð¾Ñ‡ÐºÐ¸ Ð·Ð¾Ñ€Ñƒ,** Ð¿Ñ€Ð¾ÐµÐºÑ‚ Ð¼Ð°Ñ” Ð²ÐµÐ»Ð¸ÐºÐ¸Ð¹ Ð¿Ð¾Ñ‚ÐµÐ½Ñ†Ñ–Ð°Ð». (From my point of view, the project has great potential.)\n\n> [!important] Grammar Note: Case with \"ÐÐ° Ð´ÑƒÐ¼ÐºÑƒ\"\n> The phrase **ÐÐ° Ð´ÑƒÐ¼ÐºÑƒ** requires the **Genitive** case for the possessor because \"opinion\" belongs to someone.\n> - ÐÐ° **Ð¼Ð¾ÑŽ** Ð´ÑƒÐ¼ÐºÑƒ (In my opinion)\n> - ÐÐ° Ð´ÑƒÐ¼ÐºÑƒ **Ð»Ñ–ÐºÐ°Ñ€Ñ** (In the doctor's opinion)\n> - ÐÐ° Ð´ÑƒÐ¼ÐºÑƒ **ÐµÐºÑÐ¿ÐµÑ€Ñ‚Ñ–Ð²** (In the experts' opinion)\n\n## 2. Agreement and Support\n\nWhen someone shares a view, you can support it or add to it. Being able to confirm someone else's idea is a key social skill in Ukraine.\n\n- **Ð¯ Ð·Ð³Ð¾Ð´ÐµÐ½.** (I agree - masculine)\n- **Ð¯ Ð·Ð³Ð¾Ð´Ð½Ð°.** (I agree - feminine)\n- **Ð¯ Ð¿Ð¾Ð³Ð¾Ð´Ð¶ÑƒÑŽÑÑ.** (I agree / I am agreeing - universal verb)\n- **Ð‘ÐµÐ·ÑƒÐ¼Ð¾Ð²Ð½Ð¾!** (Absolutely! / Undeniably!)\n- **ÐžÑ‡ÐµÐ²Ð¸Ð´Ð½Ð¾!** (Obviously!)\n- **Ð¦Ðµ Ð¿Ñ€Ð°Ð²Ð´Ð°.** (That is true.)\n- **Ð’Ð¸ Ð°Ð±ÑÐ¾Ð»ÑŽÑ‚Ð½Ð¾ Ð¿Ñ€Ð°Ð²Ñ–.** (You are absolutely right.)\n- **Ð¦Ðµ Ñ‚Ð¾Ñ‡Ð½Ð¾!** (That's for sure!)\n- **Ð¯ Ñ‚ÐµÐ¶ Ñ‚Ð°Ðº Ð´ÑƒÐ¼Ð°ÑŽ.** (I think so too.)\n\n## 3. Disagreement and Doubt\n\nUkrainians can be very direct when they disagree, but it's often more polite to soften it. Using \"I'm not sure\" is often better than \"You are wrong.\"\n\n- **Ð¯ Ð½Ðµ Ð·Ð³Ð¾Ð´ÐµÐ½.** (I don't agree - masculine)\n- **Ð¯ Ð½Ðµ Ð¿Ð¾Ð³Ð¾Ð´Ð¶ÑƒÑŽÑÑ.** (I don't agree / I disagree.)\n- **Ð¦Ðµ Ð½Ðµ Ñ‚Ð°Ðº.** (That's not so / That's not how it is.)\n- **Ð¦Ðµ Ð½ÐµÐ¿Ñ€Ð°Ð²Ð´Ð°.** (That's not true.)\n- **ÐœÐµÐ½Ñ– Ð²Ð°Ð¶ÐºÐ¾ ÑÐºÐ°Ð·Ð°Ñ‚Ð¸.** (It's hard for me to say / I'm not sure.)\n- **ÐÐ°Ð²Ñ€ÑÐ´ Ñ‡Ð¸.** (Hardly / I doubt it.)\n- **Ð¯ Ñ‚Ð°Ðº Ð½Ðµ Ð´ÑƒÐ¼Ð°ÑŽ.** (I don't think so.)\n- **Ð’Ð¸ Ð¿Ð¾Ð¼Ð¸Ð»ÑÑ”Ñ‚ÐµÑÑ.** (You are mistaken.)\n\n### The Art of Politeness\n\nIn Ukrainian culture, being \"honest\" is highly valued, but so is maintaining a good relationship. If you disagree, try to start with a \"softener\" before delivering your point. Phrases like **\"ÐœÐ¾Ð¶Ð»Ð¸Ð²Ð¾, Ð²Ð¸ Ð¼Ð°Ñ”Ñ‚Ðµ Ñ€Ð°Ñ†Ñ–ÑŽ, Ð°Ð»Ðµ...\"** (Maybe you are right, but...) or **\"Ð¯ Ñ€Ð¾Ð·ÑƒÐ¼Ñ–ÑŽ Ð²Ð°Ñˆ Ð¿Ð¾Ð³Ð»ÑÐ´, Ð¿Ñ€Ð¾Ñ‚Ðµ...\"** (I understand your view, however...) are perfect for this. These structures allow you to show that you are listening and respecting the other person's intellect, even if you ultimately reach a different conclusion. This balance between directness and hospitality is a hallmark of Ukrainian intellectual life.\n\n---\n\n## Theoretical Deep Dive: Choosing Your Verb\n\nWhile \"Ð´ÑƒÐ¼Ð°Ñ‚Ð¸\" is the most common verb of thought, Ukrainian distinguishes between the act of thinking (thinking process) and holding a firm belief (conviction).\n\n- **Ð”ÑƒÐ¼Ð°Ñ‚Ð¸** is a process. *Ð¯ Ð´ÑƒÐ¼Ð°ÑŽ Ð¿Ñ€Ð¾ Ñ‚ÐµÐ±Ðµ.* (I am thinking of you.)\n- **Ð’Ð²Ð°Ð¶Ð°Ñ‚Ð¸** is a result. *Ð’Ñ–Ð½ Ð²Ð²Ð°Ð¶Ð°Ñ” Ñ†Ðµ Ð¿Ð¾Ð¼Ð¸Ð»ÐºÐ¾ÑŽ.* (He considers this a mistake.)\n\nWhen you share an opinion, you can use both, but \"Ð²Ð²Ð°Ð¶Ð°Ñ‚Ð¸\" sounds more authoritative. If you are debating a topic in a business or academic setting, \"Ð²Ð²Ð°Ð¶Ð°Ñ‚Ð¸\" or \"Ð· Ð¼Ð¾Ñ”Ñ— Ñ‚Ð¾Ñ‡ÐºÐ¸ Ð·Ð¾Ñ€Ñƒ\" will make you sound more professional and prepared. On the other hand, in a casual conversation with a friend at a cafe, \"Ñ Ð´ÑƒÐ¼Ð°ÑŽ\" or \"Ð¼ÐµÐ½Ñ– Ð·Ð´Ð°Ñ”Ñ‚ÑŒÑÑ\" is more natural and friendly. This nuance is part of the \"intellectual hospitality\" that characterizes Ukrainian social life.\n\n---\n\n## The Philosophy of the Kitchen\n\nIn Ukraine, the kitchen is more than just a place to cook; it is the center of intellectual life. This phenomenon, often called \"Kitchen Philosophy\" (ÐºÑƒÑ…Ð¾Ð½Ð½Ð° Ñ„Ñ–Ð»Ð¾ÑÐ¾Ñ„Ñ–Ñ), dates back to the Soviet era when the kitchen was the only safe space to discuss forbidden ideas, politics, and literature. Even today, despite the abundance of modern cafes and open public spaces, the most profound and honest discussions often happen around a small kitchen table. This unique cultural setting creates an atmosphere of intimacy and trust that is rarely found in more formal environments.\n\nWhen you learn to say \"Ð¯ Ð´ÑƒÐ¼Ð°ÑŽ, Ñ‰Ð¾...\" or \"ÐœÐ¾Ð¶Ð»Ð¸Ð²Ð¾, Ð²Ð¸ Ð¿Ñ€Ð°Ð²Ñ–...\", you are not just learning grammar; you are learning the tools of this intellectual hospitality. Ukrainians appreciate when someone can sit for hours debating the future of democracy, the nuances of some historical event, or the best way to make borscht. Being able to articulate your point of view (Ñ‚Ð¾Ñ‡ÐºÐ° Ð·Ð¾Ñ€Ñƒ) and respect the points of others is considered a mark of a well-educated person in the Ukrainian social fabric. This cultural nuance of sharing thoughts and beliefs is a vital part of building deep, lasting trust between people.\n\n---\n\n> [!cultural] Intellectual Hospitality\n> Ukrainians value deep discussions, often late into the night. Discussing politics, history, or philosophy over tea is a national pastime. Don't be afraid to express a strong opinion; it's often seen as a sign of respect and engagement. If you are invited to a kitchen talk, be prepared to explain *why* you think what you think!\n\n> [!cultural] History Bite: The Tradition of Debate\n> Ukraine has a long history of intellectual debate. The Kyiv-Mohyla Academy, founded in the 17th century, was a center of philosophical thought where students were taught to argue and defend their positions in Latin and Ukrainian. This tradition of \"free speech\" and \"critical thinking\" survived even through times of intense censorship. Today, this manifest in the way Ukrainians participate in civil societyâ€”always ready to discuss, disagree, and ultimately find a common path for the country.\n\n> [!important] The \"Maybe\" Buffer\n> If you want to sound less categorical and more open to discussion, start your sentence with **\"ÐœÐ¾Ð¶Ð»Ð¸Ð²Ð¾...\"** (Maybe) or **\"ÐÐ°Ð¿ÐµÐ²Ð½Ð¾...\"** (Probably).\n> *ÐœÐ¾Ð¶Ð»Ð¸Ð²Ð¾, Ð²Ð¸ Ð¼Ð°Ñ”Ñ‚Ðµ Ñ€Ð°Ñ†Ñ–ÑŽ, Ð°Ð»Ðµ Ñ Ð½Ðµ Ð·Ð¾Ð²ÑÑ–Ð¼ Ð¿ÐµÐ²Ð½Ð¸Ð¹ Ñƒ Ñ†Ð¸Ñ„Ñ€Ð°Ñ….* (Maybe you are right, but I'm not entirely certain about the numbers.)\n\n---\n\n## Language in Action\n\n## Dialogue: The Best Coffee\n\nTwo friends, Petro and Maksym, are debating where to find the best atmosphere.\n\n**Petro:** Ð¡Ð»ÑƒÑ…Ð°Ð¹, ÐœÐ°ÐºÑÐ¸Ð¼Ðµ, Ñ Ð´ÑƒÐ¼Ð°ÑŽ, Ñ‰Ð¾ Ð½Ð°Ð¹ÐºÑ€Ð°Ñ‰Ð° ÐºÐ°Ð²Ð° Ð²ÑÐµ-Ñ‚Ð°ÐºÐ¸ Ñƒ Ð›ÑŒÐ²Ð¾Ð²Ñ–.\n**Maksym:** Ð¯ Ñ†Ñ–Ð»ÐºÐ¾Ð¼ Ð·Ð³Ð¾Ð´ÐµÐ½ Ð· Ñ‚Ð¾Ð±Ð¾ÑŽ! Ð¢Ð°Ð¼ Ð¾ÑÐ¾Ð±Ð»Ð¸Ð²Ð° Ð°Ñ‚Ð¼Ð¾ÑÑ„ÐµÑ€Ð° Ñ– ÑÑ‚Ð°Ñ€Ð° Ð°Ñ€Ñ…Ñ–Ñ‚ÐµÐºÑ‚ÑƒÑ€Ð°.\n**Petro:** Ð Ð½Ð° Ð¼Ð¾ÑŽ Ð´ÑƒÐ¼ÐºÑƒ, Ñ†Ñ–Ð½Ð° Ð½Ð° ÐºÐ°Ð²Ñƒ Ð² Ñ†ÐµÐ½Ñ‚Ñ€Ñ– Ð·Ð°Ñ€Ð°Ð· ÑÑ‚Ð°Ð»Ð° Ð·Ð°Ð½Ð°Ð´Ñ‚Ð¾ Ð²Ð¸ÑÐ¾ÐºÐ¾ÑŽ.\n**Maksym:** ÐÐ°Ð²Ñ€ÑÐ´ Ñ‡Ð¸ Ð²Ð¾Ð½Ð° Ð²Ð¸Ñ‰Ð°, Ð½Ñ–Ð¶ Ñƒ ÐšÐ¸Ñ”Ð²Ñ– Ñ‡Ð¸ Ð’Ð°Ñ€ÑˆÐ°Ð²Ñ–. Ð¦Ðµ Ð¶ Ñ‚ÑƒÑ€Ð¸ÑÑ‚Ð¸Ñ‡Ð½Ðµ Ð¼Ñ–ÑÑ‚Ð¾.\n**Petro:** ÐœÐ¾Ð¶Ð»Ð¸Ð²Ð¾, Ð°Ð»Ðµ Ñ Ð²Ð²Ð°Ð¶Ð°ÑŽ, Ñ‰Ð¾ Ñ‚Ñ€ÐµÐ±Ð° ÑˆÑƒÐºÐ°Ñ‚Ð¸ Ð¼Ð°Ð»ÐµÐ½ÑŒÐºÑ– ÐºÐ°Ð²â€™ÑÑ€Ð½Ñ– Ð±ÐµÐ· Ñ€ÐµÐºÐ»Ð°Ð¼Ð¸.\n**Maksym:** Ð¦Ðµ Ñ‚Ð¾Ñ‡Ð½Ð¾! Ð¢Ð°Ð¼ Ð·Ð°Ð²Ð¶Ð´Ð¸ ÑÐ¼Ð°Ñ‡Ð½Ñ–ÑˆÐµ, Ð´ÐµÑˆÐµÐ²ÑˆÐµ Ñ– Ð·Ð°Ñ‚Ð¸ÑˆÐ½Ñ–ÑˆÐµ.\n**Petro:** Ð— Ð¼Ð¾Ñ”Ñ— Ñ‚Ð¾Ñ‡ÐºÐ¸ Ð·Ð¾Ñ€Ñƒ, ÑÐ°Ð¼Ðµ Ñ‚Ð°ÐºÑ– Ð¼Ñ–ÑÑ†Ñ Ð·Ð±ÐµÑ€Ñ–Ð³Ð°ÑŽÑ‚ÑŒ ÑÐ¿Ñ€Ð°Ð²Ð¶Ð½Ñ–Ð¹ Ð´ÑƒÑ… Ð¼Ñ–ÑÑ‚Ð°.\n**Maksym:** Ð‘ÐµÐ·ÑƒÐ¼Ð¾Ð²Ð½Ð¾. Ð”Ð°Ð²Ð°Ð¹Ñ‚Ðµ Ð¿Ñ–Ð´ÐµÐ¼Ð¾ Ð² Ñ‚Ñƒ Ð½Ð¾Ð²Ñƒ ÐºÐ°Ð²â€™ÑÑ€Ð½ÑŽ Ð·Ð°Ð²Ñ‚Ñ€Ð°?\n\n## Dialogue: The Plan\n\nTwo colleagues, Olena and Ihor, are discussing a future trip.\n\n**Olena:** Ð†Ð³Ð¾Ñ€Ðµ, Ñ‚Ð¸ Ð²Ð¶Ðµ Ð´ÑƒÐ¼Ð°Ð² Ð¿Ñ€Ð¾ Ð½Ð°ÑˆÑƒ Ð²Ñ–Ð´Ð¿ÑƒÑÑ‚ÐºÑƒ Ð² ÐšÐ°Ñ€Ð¿Ð°Ñ‚Ð°Ñ…?\n**Ihor:** Ð¢Ð°Ðº, Ñ Ð²Ð²Ð°Ð¶Ð°ÑŽ, Ñ‰Ð¾ Ð½Ð°Ð¼ Ñ‚Ñ€ÐµÐ±Ð° Ð¿Ð¾Ñ—Ñ…Ð°Ñ‚Ð¸ Ð² Ñ‡ÐµÑ€Ð²Ð½Ñ–.\n**Olena:** ÐÐ° Ð¼Ð¾ÑŽ Ð´ÑƒÐ¼ÐºÑƒ, Ñƒ Ñ‡ÐµÑ€Ð²Ð½Ñ– Ñ‚Ð°Ð¼ Ð·Ð°Ð½Ð°Ð´Ñ‚Ð¾ Ñ‡Ð°ÑÑ‚Ð¾ Ð¹Ð´ÑƒÑ‚ÑŒ Ð´Ð¾Ñ‰Ñ–.\n**Ihor:** ÐÐ°Ð²Ñ€ÑÐ´ Ñ‡Ð¸. ÐœÐ¸Ð½ÑƒÐ»Ð¾Ð³Ð¾ Ñ€Ð¾ÐºÑƒ Ð¿Ð¾Ð³Ð¾Ð´Ð° Ð±ÑƒÐ»Ð° Ñ‡ÑƒÐ´Ð¾Ð²Ð°.\n**Olena:** Ð¯ Ð½Ðµ Ð¿Ð¾Ð³Ð¾Ð´Ð¶ÑƒÑŽÑÑ. Ð¯ Ð±Ð°Ñ‡Ð¸Ð»Ð° Ð¿Ñ€Ð¾Ð³Ð½Ð¾Ð·, Ñ– Ð²Ñ–Ð½ Ð½Ðµ Ð´ÑƒÐ¶Ðµ Ð´Ð¾Ð±Ñ€Ð¸Ð¹.\n**Ihor:** ÐœÐ¾Ð¶Ð»Ð¸Ð²Ð¾, Ð²Ð¸ Ð¿Ñ€Ð°Ð²Ñ–. ÐÐ»Ðµ Ñ Ð³Ð°Ð´Ð°ÑŽ, Ñ‰Ð¾ Ñ€Ð¸Ð·Ð¸ÐºÐ½ÑƒÑ‚Ð¸ Ð²Ð°Ñ€Ñ‚Ð¾.\n**Olena:** Ð¯ Ð½Ðµ Ð·Ð¾Ð²ÑÑ–Ð¼ Ð·Ð³Ð¾Ð´Ð½Ð°. Ð”Ð°Ð²Ð°Ð¹Ñ‚Ðµ ÐºÑ€Ð°Ñ‰Ðµ Ð¿Ð¾Ñ—Ð´ÐµÐ¼Ð¾ Ð² Ð†Ð²Ð°Ð½Ð¾-Ð¤Ñ€Ð°Ð½ÐºÑ–Ð²ÑÑŒÐº.\n**Ihor:** Ð¦Ðµ Ñ†Ñ–ÐºÐ°Ð²Ð¸Ð¹ Ð¿Ð¾Ð³Ð»ÑÐ´. Ð— Ð¼Ð¾Ñ”Ñ— Ñ‚Ð¾Ñ‡ÐºÐ¸ Ð·Ð¾Ñ€Ñƒ, Ñ†Ðµ Ð³Ð°Ñ€Ð½Ð° Ð°Ð»ÑŒÑ‚ÐµÑ€Ð½Ð°Ñ‚Ð¸Ð²Ð°.\n**Olena:** ÐžÑ‡ÐµÐ²Ð¸Ð´Ð½Ð¾, Ñ‰Ð¾ Ñ‚Ð°Ð¼ Ð±Ñ–Ð»ÑŒÑˆÐµ Ð¼ÑƒÐ·ÐµÑ—Ð² Ñ– ÐºÐ°Ð²'ÑÑ€ÐµÐ½ÑŒ Ð½Ð° Ð²Ð¸Ð¿Ð°Ð´Ð¾Ðº Ð´Ð¾Ñ‰Ñƒ.\n**Ihor:** Ð¦Ðµ Ñ‚Ð¾Ñ‡Ð½Ð¾! Ð¯ Ñ‚ÐµÐ¶ Ñ‚Ð°Ðº Ð´ÑƒÐ¼Ð°ÑŽ Ñ‚ÐµÐ¿ÐµÑ€. Ð’Ð¸ Ð¿ÐµÑ€ÐµÐºÐ¾Ð½Ð°Ð»Ð¸ Ð¼ÐµÐ½Ðµ.\n\n### Analysis of the Conversation\n1.  **Ð¯ Ð´ÑƒÐ¼Ð°ÑŽ, Ñ‰Ð¾...**: The most humble way to start a debate.\n2.  **Ð¯ Ñ†Ñ–Ð»ÐºÐ¾Ð¼ Ð·Ð³Ð¾Ð´ÐµÐ½**: \"I completely agree\" (adds emphasis).\n3.  **ÐÐ° Ð¼Ð¾ÑŽ Ð´ÑƒÐ¼ÐºÑƒ**: A parenthetical phrases that shifts the focus back to the speaker.\n4.  **ÐÐ°Ð²Ñ€ÑÐ´ Ñ‡Ð¸**: A gentle way to say \"I don't think so\" without being aggressive.\n5.  **Ð— Ð¼Ð¾Ñ”Ñ— Ñ‚Ð¾Ñ‡ÐºÐ¸ Ð·Ð¾Ñ€Ñƒ**: A more professional or structured way to summarize a position.\n\n---\n\n> [!important] Myth: \"Everyone thinks the same\"\n> **Myth:** Ukrainian culture is monolithic and everyone agrees on history and politics because of the war.\n> **Reality:** Ukraine is a vibrant democracy with a huge diversity of opinions. Debating historical memory and future direction is a core part of the modern Ukrainian identity. We value the right to disagree and discuss diverse perspectives openly.\n\n---\n\n> [!resources] ðŸ”— External Resources\n> - **YouTube:** [How to express your opinion in Ukrainian](https://www.youtube.com/results?search_query=express+opinion+ukrainian) â€” Various teachers\n> - **Article:** [Ukrainian Conversation Starters](https://www.ukrainianlessons.com/conversation/) â€” Ukrainian Lessons\n> - **Flashcards:** [Quizlet: Ukrainian Opinions](https://quizlet.com/) â€” Practice the vocabulary"
      },
      {
        "id": "section-2",
        "name": "Activities",
        "nameEn": null,
        "type": "activities",
        "content": "## match-up: Opinion Expressions (Concept: Semantic Pairing)\nMatch the Ukrainian expression to its English equivalent.\n\n- Ð¯ Ð´ÑƒÐ¼Ð°ÑŽ, Ñ‰Ð¾ :: I think that\n- Ð¯ Ð²Ð²Ð°Ð¶Ð°ÑŽ, Ñ‰Ð¾ :: I consider that\n- ÐÐ° Ð¼Ð¾ÑŽ Ð´ÑƒÐ¼ÐºÑƒ :: In my opinion\n- ÐÐ° Ð¼Ñ–Ð¹ Ð¿Ð¾Ð³Ð»ÑÐ´ :: From my view\n- Ð¯ Ð·Ð³Ð¾Ð´ÐµÐ½ :: I agree\n- Ð’Ð¸ Ð¿Ñ€Ð°Ð²Ñ– :: You are right\n- ÐÐ°Ð²Ñ€ÑÐ´ Ñ‡Ð¸ :: Hardly / I doubt it\n- Ð¯ Ð½Ðµ Ð²Ð¿ÐµÐ²Ð½ÐµÐ½Ð¸Ð¹ :: I am not sure\n\n## fill-in: Express Opinions (Concept: Contextual Usage)\nComplete the sentences with the correct opinion markers.\n\n1. Ð¯ [___:1], Ñ‰Ð¾ Ñ†Ðµ Ð¼Ñ–ÑÑ‚Ð¾ Ð´ÑƒÐ¶Ðµ ÐºÑ€Ð°ÑÐ¸Ð²Ðµ. (think)\n   > [!answer] Ð´ÑƒÐ¼Ð°ÑŽ\n   > [!options] Ð´ÑƒÐ¼Ð°ÑŽ | Ð±Ð°Ñ‡Ñƒ | ÑÐ¿Ð»ÑŽ | Ñ—Ð¼\n\n2. ÐÐ° [___:2] Ð´ÑƒÐ¼ÐºÑƒ, ÐºÐ²Ð¸Ñ‚ÐºÐ¸ Ð·Ð°Ð½Ð°Ð´Ñ‚Ð¾ Ð´Ð¾Ñ€Ð¾Ð³Ñ–. (my)\n   > [!answer] Ð¼Ð¾ÑŽ\n   > [!options] Ð¼Ð¾ÑŽ | Ð¼Ñ–Ð¹ | Ð¼Ð¾Ñ” | Ð¼Ð¾Ñ—\n\n3. ÐœÐµÐ½Ñ– [___:3], Ñ‰Ð¾ ÑÑŒÐ¾Ð³Ð¾Ð´Ð½Ñ– Ð±ÑƒÐ´Ðµ Ð´Ð¾Ñ‰. (seems)\n   > [!answer] Ð·Ð´Ð°Ñ”Ñ‚ÑŒÑÑ\n   > [!options] Ð·Ð´Ð°Ñ”Ñ‚ÑŒÑÑ | Ð¿Ð¾Ð´Ð¾Ð±Ð°Ñ”Ñ‚ÑŒÑÑ | Ñ…Ð¾Ñ‡ÐµÑ‚ÑŒÑÑ | Ð¿Ð¸ÑˆÐµÑ‚ÑŒÑÑ\n\n4. Ð¯ Ñ†Ñ–Ð»ÐºÐ¾Ð¼ [___:4] Ð· Ð²Ð°ÑˆÐ¾ÑŽ Ð¿Ñ€Ð¾Ð¿Ð¾Ð·Ð¸Ñ†Ñ–Ñ”ÑŽ. (agree - masc)\n   > [!answer] Ð·Ð³Ð¾Ð´ÐµÐ½\n   > [!options] Ð·Ð³Ð¾Ð´ÐµÐ½ | Ð·Ð³Ð¾Ð´Ð½Ð° | Ð·Ð³Ð¾Ð´Ð½Ñ– | Ð·Ð³Ð¾Ð´Ð½Ðµ\n\n5. Ð’Ð¸ [___:5], Ñ†Ðµ Ñ€Ñ–ÑˆÐµÐ½Ð½Ñ Ð½Ð°Ð¹ÐºÑ€Ð°Ñ‰Ðµ. (right)\n   > [!answer] Ð¿Ñ€Ð°Ð²Ñ–\n   > [!options] Ð¿Ñ€Ð°Ð²Ñ– | Ð»Ñ–Ð²Ñ– | ÑÑ‚Ð°Ñ€Ñ– | Ð¼Ð°Ð»Ñ–\n\n6. [___:6] Ñ‡Ð¸ Ð¼Ð¸ Ð²ÑÑ‚Ð¸Ð³Ð½ÐµÐ¼Ð¾ Ð½Ð° Ð¿Ð¾Ñ—Ð·Ð´. (hardly)\n   > [!answer] ÐÐ°Ð²Ñ€ÑÐ´\n   > [!options] ÐÐ°Ð²Ñ€ÑÐ´ | ÐœÐ°Ð¹Ð¶Ðµ | Ð—Ð¾Ð²ÑÑ–Ð¼ | Ð”ÑƒÐ¶Ðµ\n\n7. Ð¯ Ð²Ð²Ð°Ð¶Ð°ÑŽ, [___:7] Ñ‚Ñ€ÐµÐ±Ð° Ð±Ñ–Ð»ÑŒÑˆÐµ Ð¿Ñ€Ð°Ñ†ÑŽÐ²Ð°Ñ‚Ð¸. (that)\n   > [!answer] Ñ‰Ð¾\n   > [!options] Ñ‰Ð¾ | Ñ‡Ð¸ | ÑÐº | Ð´Ðµ\n\n8. Ð¯ Ð½Ðµ [___:8], Ñ‰Ð¾ Ñ†Ðµ Ð¿Ñ€Ð°Ð²Ð¸Ð»ÑŒÐ½Ð° Ð²Ñ–Ð´Ð¿Ð¾Ð²Ñ–Ð´ÑŒ. (sure - masc)\n   > [!answer] Ð²Ð¿ÐµÐ²Ð½ÐµÐ½Ð¸Ð¹\n   > [!options] Ð²Ð¿ÐµÐ²Ð½ÐµÐ½Ð¸Ð¹ | Ð²Ð¿ÐµÐ²Ð½ÐµÐ½Ð° | Ð²Ð¿ÐµÐ²Ð½ÐµÐ½Ñ– | Ð²Ð¿ÐµÐ²Ð½ÐµÐ½Ðµ\n\n## quiz: Understanding Opinions (Concept: Logical Deduction)\nAnswer questions about expressing thoughts in Ukrainian.\n\n1. Ð¯Ðº ÑÐ°Ð¼Ðµ Ð½Ð°Ð¹Ñ‡Ð°ÑÑ‚Ñ–ÑˆÐµ Ð¿Ð¾Ñ‡Ð¸Ð½Ð°ÑŽÑ‚ÑŒ Ð²Ð¸ÑÐ»Ð¾Ð²Ð»ÑŽÐ²Ð°Ñ‚Ð¸ ÑÐ²Ð¾ÑŽ Ð²Ð»Ð°ÑÐ½Ñƒ Ð´ÑƒÐ¼ÐºÑƒ Ð² ÑƒÐºÑ€Ð°Ñ—Ð½ÑÑŒÐºÑ–Ð¹ Ð¼Ð¾Ð²Ñ–, Ñ‰Ð¾Ð± Ñ†Ðµ Ð·Ð²ÑƒÑ‡Ð°Ð»Ð¾ Ð½ÐµÐ¹Ñ‚Ñ€Ð°Ð»ÑŒÐ½Ð¾ Ñ‚Ð° Ð·Ñ€Ð¾Ð·ÑƒÐ¼Ñ–Ð»Ð¾?\n- [x] Ð—Ð°Ð·Ð²Ð¸Ñ‡Ð°Ð¹ Ð²Ð¸ÐºÐ¾Ñ€Ð¸ÑÑ‚Ð¾Ð²ÑƒÑŽÑ‚ÑŒ Ð¿Ð¾Ð¿ÑƒÐ»ÑÑ€Ð½Ñƒ Ñ‚Ð° Ð¿Ñ€Ð¾ÑÑ‚Ñƒ Ñ„Ñ€Ð°Ð·Ñƒ \"Ð¯ Ð´ÑƒÐ¼Ð°ÑŽ, Ñ‰Ð¾...\"\n- [ ] Ð’Ð¸ÐºÐ¾Ñ€Ð¸ÑÑ‚Ð¾Ð²ÑƒÑŽÑ‚ÑŒ Ð´ÑƒÐ¶Ðµ Ð³ÑƒÑ‡Ð½Ð¸Ð¹ Ñ– Ð´Ð¾Ð²Ð³Ð¸Ð¹ ÐºÑ€Ð¸Ðº Ð½Ð° Ð¿Ð¾Ñ‡Ð°Ñ‚ÐºÑƒ ÐºÐ¾Ð¶Ð½Ð¾Ñ— Ñ€Ð¾Ð·Ð¼Ð¾Ð²Ð¸\n- [ ] Ð’Ð¸ÐºÐ¾Ñ€Ð¸ÑÑ‚Ð¾Ð²ÑƒÑŽÑ‚ÑŒ Ð»Ð¸ÑˆÐµ ÑÐºÐ»Ð°Ð´Ð½Ñ– Ð¼Ð°Ñ‚ÐµÐ¼Ð°Ñ‚Ð¸Ñ‡Ð½Ñ– Ñ„Ð¾Ñ€Ð¼ÑƒÐ»Ð¸ Ð´Ð»Ñ Ð¾Ð±Ò‘Ñ€ÑƒÐ½Ñ‚ÑƒÐ²Ð°Ð½Ð½Ñ ÑÐ»Ñ–Ð²\n- [ ] Ð’Ð¸ÐºÐ¾Ñ€Ð¸ÑÑ‚Ð¾Ð²ÑƒÑŽÑ‚ÑŒ Ð¿Ð¾Ð²Ð½Ðµ Ð¼Ð¾Ð²Ñ‡Ð°Ð½Ð½Ñ Ð¿Ñ€Ð¾Ñ‚ÑÐ³Ð¾Ð¼ Ñ‚Ñ€ÑŒÐ¾Ñ… Ñ…Ð²Ð¸Ð»Ð¸Ð½ Ð¿ÐµÑ€ÐµÐ´ ÐºÐ¾Ð¶Ð½Ð¸Ð¼ Ñ€ÐµÑ‡ÐµÐ½Ð½ÑÐ¼\n\n---\n\n2. Ð¯ÐºÐ¸Ð¹ ÑÐ°Ð¼Ðµ Ð³Ñ€Ð°Ð¼Ð°Ñ‚Ð¸Ñ‡Ð½Ð¸Ð¹ Ð²Ñ–Ð´Ð¼Ñ–Ð½Ð¾Ðº Ð¿Ð¾Ñ‚Ñ€Ñ–Ð±Ð½Ð¾ Ð¾Ð±Ð¾Ð²'ÑÐ·ÐºÐ¾Ð²Ð¾ Ð²Ð¸ÐºÐ¾Ñ€Ð¸ÑÑ‚Ð¾Ð²ÑƒÐ²Ð°Ñ‚Ð¸ Ð¿Ñ–ÑÐ»Ñ ÐºÐ¾Ð½ÑÑ‚Ñ€ÑƒÐºÑ†Ñ–Ñ— \"ÐÐ° Ð´ÑƒÐ¼ÐºÑƒ...\", Ñ‰Ð¾Ð± Ð²ÐºÐ°Ð·Ð°Ñ‚Ð¸ Ð½Ð° Ð²Ð»Ð°ÑÐ½Ð¸ÐºÐ° Ñ–Ð´ÐµÑ—?\n- [x] Ð”Ð»Ñ Ð¿Ð¾Ð·Ð½Ð°Ñ‡ÐµÐ½Ð½Ñ Ð²Ð»Ð°ÑÐ½Ð¸ÐºÐ° Ð´ÑƒÐ¼ÐºÐ¸ Ð²Ð¸ÐºÐ¾Ñ€Ð¸ÑÑ‚Ð¾Ð²ÑƒÑŽÑ‚ÑŒ Ð Ð¾Ð´Ð¾Ð²Ð¸Ð¹ Ð²Ñ–Ð´Ð¼Ñ–Ð½Ð¾Ðº (ÐºÐ¾Ð³Ð¾? Ñ‡Ð¾Ð³Ð¾?)\n- [ ] Ð”Ð»Ñ Ð¿Ð¾Ð·Ð½Ð°Ñ‡ÐµÐ½Ð½Ñ Ð²Ð»Ð°ÑÐ½Ð¸ÐºÐ° Ð´ÑƒÐ¼ÐºÐ¸ Ð²Ð¸ÐºÐ¾Ñ€Ð¸ÑÑ‚Ð¾Ð²ÑƒÑŽÑ‚ÑŒ Ð»Ð¸ÑˆÐµ ÐžÑ€ÑƒÐ´Ð½Ð¸Ð¹ Ð²Ñ–Ð´Ð¼Ñ–Ð½Ð¾Ðº\n- [ ] Ð”Ð»Ñ Ð¿Ð¾Ð·Ð½Ð°Ñ‡ÐµÐ½Ð½Ñ Ð²Ð»Ð°ÑÐ½Ð¸ÐºÐ° Ð´ÑƒÐ¼ÐºÐ¸ Ð²Ð¸ÐºÐ¾Ñ€Ð¸ÑÑ‚Ð¾Ð²ÑƒÑŽÑ‚ÑŒ ÐšÐ»Ð¸Ñ‡Ð½Ð¸Ð¹ Ð²Ñ–Ð´Ð¼Ñ–Ð½Ð¾Ðº Ð´Ð»Ñ Ð·Ð²ÐµÑ€Ñ‚Ð°Ð½Ð½Ñ\n- [ ] Ð”Ð»Ñ Ð¿Ð¾Ð·Ð½Ð°Ñ‡ÐµÐ½Ð½Ñ Ð²Ð»Ð°ÑÐ½Ð¸ÐºÐ° Ð´ÑƒÐ¼ÐºÐ¸ Ð²Ð¸ÐºÐ¾Ñ€Ð¸ÑÑ‚Ð¾Ð²ÑƒÑŽÑ‚ÑŒ ÐœÐ°Ð¹Ð±ÑƒÑ‚Ð½Ñ–Ð¹ Ñ‡Ð°Ñ Ð´Ñ–Ñ”ÑÐ»Ð¾Ð²Ð°\n\n---\n\n3. Ð©Ð¾ ÑÐ°Ð¼Ðµ Ð²Ð¸ Ð¼Ð°Ñ”Ñ‚Ðµ Ð½Ð° ÑƒÐ²Ð°Ð·Ñ–, ÐºÐ¾Ð»Ð¸ ÐºÐ°Ð¶ÐµÑ‚Ðµ ÑÐ²Ð¾Ñ”Ð¼Ñƒ ÑÐ¿Ñ–Ð²Ñ€Ð¾Ð·Ð¼Ð¾Ð²Ð½Ð¸ÐºÑƒ \"Ð’Ð¸ Ð°Ð±ÑÐ¾Ð»ÑŽÑ‚Ð½Ð¾ Ð¿Ñ€Ð°Ð²Ñ–\" Ð¿Ñ–Ð´ Ñ‡Ð°Ñ Ð´Ð¸ÑÐºÑƒÑÑ–Ñ—?\n- [x] Ð’Ð¸ Ð²Ð¸ÑÐ»Ð¾Ð²Ð»ÑŽÑ”Ñ‚Ðµ ÑÐ²Ð¾ÑŽ Ð¿Ð¾Ð²Ð½Ñƒ Ñ‚Ð° Ñ€Ñ–ÑˆÑƒÑ‡Ñƒ Ð·Ð³Ð¾Ð´Ñƒ Ð· Ð´ÑƒÐ¼ÐºÐ¾ÑŽ Ð°Ð±Ð¾ Ð¿Ð¾Ð·Ð¸Ñ†Ñ–Ñ”ÑŽ Ð»ÑŽÐ´Ð¸Ð½Ð¸\n- [ ] Ð’Ð¸ Ð²ÐºÐ°Ð·ÑƒÑ”Ñ‚Ðµ Ð»ÑŽÐ´Ð¸Ð½Ñ–, Ñ‰Ð¾ Ñ—Ð¹ Ñ‚Ñ€ÐµÐ±Ð° Ð¹Ñ‚Ð¸ Ñ‚Ñ–Ð»ÑŒÐºÐ¸ Ð¿Ñ€Ð°Ð²Ð¾Ñ€ÑƒÑ‡ Ð½Ð° Ð½Ð°ÑÑ‚ÑƒÐ¿Ð½Ð¾Ð¼Ñƒ Ð¿ÐµÑ€ÐµÑ…Ñ€ÐµÑÑ‚Ñ–\n- [ ] Ð’Ð¸ ÐºÑ€Ð¸Ñ‚Ð¸ÐºÑƒÑ”Ñ‚Ðµ Ð»ÑŽÐ´Ð¸Ð½Ñƒ Ð·Ð° Ñ—Ñ— Ð´ÑƒÐ¶Ðµ Ð¿Ð¾Ð³Ð°Ð½Ñƒ Ñ‚Ð° ÑÑ‚Ð°Ñ€Ñƒ Ð¿Ð¾Ð²ÐµÐ´Ñ–Ð½ÐºÑƒ Ð¼Ð¸Ð½ÑƒÐ»Ð¾Ð³Ð¾ Ñ‚Ð¸Ð¶Ð½Ñ\n- [ ] Ð’Ð¸ Ð¿Ñ€Ð¾ÑÐ¸Ñ‚Ðµ Ð»ÑŽÐ´Ð¸Ð½Ñƒ ÑˆÐ²Ð¸Ð´ÐºÐ¾ Ð¿Ñ€Ð¸Ð½ÐµÑÑ‚Ð¸ Ð²Ð°Ð¼ ÑÐºÐ»ÑÐ½ÐºÑƒ Ñ…Ð¾Ð»Ð¾Ð´Ð½Ð¾Ñ— Ñ‡Ð¸ÑÑ‚Ð¾Ñ— Ð²Ð¾Ð´Ð¸\n\n---\n\n4. Ð¯ÐºÐ¸Ð¹ ÑÐ°Ð¼Ðµ ÐµÐ¼Ð¾Ñ†Ñ–Ð¹Ð½Ð¸Ð¹ Ð²Ñ–Ð´Ñ‚Ñ–Ð½Ð¾Ðº Ð·Ð½Ð°Ñ‡ÐµÐ½Ð½Ñ Ð²Ð½Ð¾ÑÐ¸Ñ‚ÑŒ Ñƒ Ñ€Ð¾Ð·Ð¼Ð¾Ð²Ñƒ ÑƒÐºÑ€Ð°Ñ—Ð½ÑÑŒÐºÐ° ÐºÐ¾Ñ€Ð¸ÑÐ½Ð° Ñ„Ñ€Ð°Ð·Ð° ÑÑƒÐ¼Ð½Ñ–Ð²Ñƒ \"ÐÐ°Ð²Ñ€ÑÐ´ Ñ‡Ð¸\"?\n- [x] Ð¦Ñ Ñ„Ñ€Ð°Ð·Ð° Ð²Ð¸Ñ€Ð°Ð¶Ð°Ñ” ÑÐ¸Ð»ÑŒÐ½Ð¸Ð¹ ÑÑƒÐ¼Ð½Ñ–Ð² Ð°Ð±Ð¾ Ð²ÐµÐ»Ð¸ÐºÑƒ Ð½ÐµÐ¿ÐµÐ²Ð½Ñ–ÑÑ‚ÑŒ Ñƒ Ð¿ÐµÐ²Ð½Ð¾Ð¼Ñƒ Ñ„Ð°ÐºÑ‚Ñ–\n- [ ] Ð¦Ñ Ñ„Ñ€Ð°Ð·Ð° Ð²Ð¸Ñ€Ð°Ð¶Ð°Ñ” Ð¿Ð¾Ð²Ð½Ñƒ Ñ‚Ð° Ð°Ð±ÑÐ¾Ð»ÑŽÑ‚Ð½Ñƒ Ð²Ð¿ÐµÐ²Ð½ÐµÐ½Ñ–ÑÑ‚ÑŒ Ñƒ Ñ‰Ð°ÑÐ»Ð¸Ð²Ð¾Ð¼Ñƒ Ð¼Ð°Ð¹Ð±ÑƒÑ‚Ð½ÑŒÐ¾Ð¼Ñƒ\n- [ ] Ð¦Ñ Ñ„Ñ€Ð°Ð·Ð° Ð²ÐºÐ°Ð·ÑƒÑ” Ð½Ð° Ñ‚Ðµ, Ñ‰Ð¾ Ð·Ð°Ñ€Ð°Ð· Ð½Ð° Ð²ÑƒÐ»Ð¸Ñ†Ñ– Ð¹Ð´Ðµ Ð´ÑƒÐ¶Ðµ ÑÐ¸Ð»ÑŒÐ½Ð¸Ð¹ Ñ…Ð¾Ð»Ð¾Ð´Ð½Ð¸Ð¹ Ð´Ð¾Ñ‰\n- [ ] Ð¦Ñ Ñ„Ñ€Ð°Ð·Ð° Ð¾Ð·Ð½Ð°Ñ‡Ð°Ñ”, Ñ‰Ð¾ Ð²Ð¸ Ñ…Ð¾Ñ‡ÐµÑ‚Ðµ Ñ‚ÐµÑ€Ð¼Ñ–Ð½Ð¾Ð²Ð¾ ÐºÑƒÐ¿Ð¸Ñ‚Ð¸ ÑÐ¾Ð±Ñ– Ð½Ð¾Ð²Ð¸Ð¹ Ñ‚ÐµÐ¿Ð»Ð¸Ð¹ Ð¾Ð´ÑÐ³\n\n---\n\n5. Ð§Ð¸ Ð¿Ð¾Ñ‚Ñ€Ñ–Ð±Ð½Ð¾ Ð·Ð°Ð·Ð²Ð¸Ñ‡Ð°Ð¹ Ð·Ð¼Ñ–Ð½ÑŽÐ²Ð°Ñ‚Ð¸ Ñ‡Ð°Ñ Ð´Ñ–Ñ”ÑÐ»Ð¾Ð²Ð° Ð² Ñ€ÐµÑ‡ÐµÐ½Ð½Ñ–, ÐºÐ¾Ð»Ð¸ Ð²Ð¸ Ð¿Ñ€Ð¾ÑÑ‚Ð¾ Ð·Ð²Ñ–Ñ‚ÑƒÑ”Ñ‚Ðµ Ð¿Ñ€Ð¾ ÑÐ²Ð¾ÑŽ Ð²Ð»Ð°ÑÐ½Ñƒ Ð´ÑƒÐ¼ÐºÑƒ?\n- [x] ÐÑ–, Ñ‡Ð°Ñ Ð´Ñ–Ñ”ÑÐ»Ð¾Ð²Ð° Ð·Ð°Ð·Ð²Ð¸Ñ‡Ð°Ð¹ Ð·Ð°Ð»Ð¸ÑˆÐ°Ñ”Ñ‚ÑŒÑÑ Ñ‚Ð°ÐºÐ¸Ð¼ ÑÐ°Ð¼Ð¸Ð¼, ÑÐº Ð²Ñ–Ð½ Ð·Ð²ÑƒÑ‡Ð¸Ñ‚ÑŒ Ñƒ ÑÐ°Ð¼Ñ–Ð¹ Ð´ÑƒÐ¼Ñ†Ñ–\n- [ ] Ð¢Ð°Ðº, Ð¼Ð¸ Ð·Ð°Ð²Ð¶Ð´Ð¸ Ð¼Ð°Ñ”Ð¼Ð¾ Ð·Ð¼Ñ–Ð½ÑŽÐ²Ð°Ñ‚Ð¸ Ð°Ð±ÑÐ¾Ð»ÑŽÑ‚Ð½Ð¾ Ð²ÑÑ– Ñ‡Ð°ÑÐ¸ Ð´Ñ–Ñ”ÑÐ»Ñ–Ð² Ð½Ð° Ð¼Ð¸Ð½ÑƒÐ»Ð¸Ð¹ Ñ‡Ð°Ñ\n- [ ] Ð¢Ð°Ðº, Ð¼Ð¸ Ð¼Ð°Ñ”Ð¼Ð¾ Ð²Ð¸ÐºÐ¾Ñ€Ð¸ÑÑ‚Ð¾Ð²ÑƒÐ²Ð°Ñ‚Ð¸ Ñ‚Ñ–Ð»ÑŒÐºÐ¸ Ñ„Ð¾Ñ€Ð¼Ð¸ Ð¼Ð°Ð¹Ð±ÑƒÑ‚Ð½ÑŒÐ¾Ð³Ð¾ Ñ‡Ð°ÑÑƒ Ð´Ð»Ñ Ð²ÑÑ–Ñ… Ð´ÑƒÐ¼Ð¾Ðº\n- [ ] Ð¢Ð°Ðº, Ñ‡Ð°Ñ Ð´Ñ–Ñ”ÑÐ»Ð¾Ð²Ð° Ð·Ð¼Ñ–Ð½ÑŽÑ”Ñ‚ÑŒÑÑ Ñ‚Ñ–Ð»ÑŒÐºÐ¸ ÑÐºÑ‰Ð¾ Ð¼Ð¸ Ð´ÑƒÐ¶Ðµ Ð³Ð¾Ð»Ð¾ÑÐ½Ð¾ ÐºÑ€Ð¸Ñ‡Ð¸Ð¼Ð¾ Ð½Ð° Ð´Ñ€ÑƒÐ³Ð°\n\n---\n\n6. Ð©Ð¾ ÑÐ°Ð¼Ðµ Ð²Ð¸ Ñ…Ð¾Ñ‡ÐµÑ‚Ðµ Ð¿ÐµÑ€ÐµÐ´Ð°Ñ‚Ð¸ Ð±Ð»Ð¸Ð·ÑŒÐºÐ¾Ð¼Ñƒ Ð´Ñ€ÑƒÐ³Ñƒ, ÐºÐ¾Ð»Ð¸ Ð²Ð¶Ð¸Ð²Ð°Ñ”Ñ‚Ðµ Ð²ÑÑ‚ÑƒÐ¿Ð½Ñƒ Ñ„Ñ€Ð°Ð·Ñƒ \"ÐœÐµÐ½Ñ– Ð·Ð´Ð°Ñ”Ñ‚ÑŒÑÑ\"?\n- [x] Ð’Ð¸ Ð²Ð¸ÑÐ»Ð¾Ð²Ð»ÑŽÑ”Ñ‚Ðµ ÑÐ²Ð¾ÑŽ Ð´ÑƒÐ¼ÐºÑƒ Ð¾Ð±ÐµÑ€ÐµÐ¶Ð½Ð¾, ÑÐº Ð²Ð»Ð°ÑÐ½Ðµ ÑÑƒÐ±'Ñ”ÐºÑ‚Ð¸Ð²Ð½Ðµ Ð²Ñ€Ð°Ð¶ÐµÐ½Ð½Ñ Ñ‡Ð¸ Ð²Ñ–Ð´Ñ‡ÑƒÑ‚Ñ‚Ñ\n- [ ] Ð’Ð¸ Ð²Ð¸ÑÐ»Ð¾Ð²Ð»ÑŽÑ”Ñ‚Ðµ Ð´ÑƒÐ¶Ðµ Ñ‚Ð¾Ñ‡Ð½Ð¸Ð¹ Ñ‚Ð° Ð¿ÐµÑ€ÐµÐ²Ñ–Ñ€ÐµÐ½Ð¸Ð¹ Ñ‡Ð°ÑÐ¾Ð¼ Ð½Ð°ÑƒÐºÐ¾Ð²Ð¸Ð¹ Ñ„Ð°ÐºÑ‚ Ñ–Ð· Ð¿Ñ–Ð´Ñ€ÑƒÑ‡Ð½Ð¸ÐºÐ°\n- [ ] Ð’Ð¸ Ð¿Ñ€Ð¾ÑÐ¸Ñ‚Ðµ Ð´Ñ€ÑƒÐ³Ð° Ð½ÐµÐ³Ð°Ð¹Ð½Ð¾ Ð·Ð°Ñ‡Ð¸Ð½Ð¸Ñ‚Ð¸ Ð²ÑÑ– Ð²Ñ–ÐºÐ½Ð° Ð² Ñ†ÑŒÐ¾Ð¼Ñƒ Ð²ÐµÐ»Ð¸ÐºÐ¾Ð¼Ñƒ ÑÑ‚Ð°Ñ€Ð¾Ð¼Ñƒ Ð´Ð¾Ð¼Ñ–\n- [ ] Ð’Ð¸ ÐºÐ°Ð¶ÐµÑ‚Ðµ Ð´Ñ€ÑƒÐ³Ñƒ, Ñ‰Ð¾ Ð²Ð¸ Ð²Ð¶Ðµ Ð´ÑƒÐ¶Ðµ Ñ…Ð¾Ñ‡ÐµÑ‚Ðµ ÑˆÐ²Ð¸Ð´ÐºÐ¾ Ð¿Ñ–Ñ‚Ð¸ Ð´Ð¾Ð´Ð¾Ð¼Ñƒ Ñ– Ð²Ñ–Ð´Ð¿Ð¾Ñ‡Ð¸Ñ‚Ð¸\n\n---\n\n7. Ð¯ÐºÐ° Ñ„Ð¾Ñ€Ð¼Ð° Ð¿Ñ€Ð¸ÐºÐ¼ÐµÑ‚Ð½Ð¸ÐºÐ° \"Ð—Ð³Ð¾Ð´ÐµÐ½\" (Agree) Ñ” Ð³Ñ€Ð°Ð¼Ð°Ñ‚Ð¸Ñ‡Ð½Ð¾ Ð¿Ñ€Ð°Ð²Ð¸Ð»ÑŒÐ½Ð¾ÑŽ Ð´Ð»Ñ Ð¶Ñ–Ð½ÐºÐ¸, ÑÐºÐ° Ð²Ð¸ÑÐ»Ð¾Ð²Ð»ÑŽÑ” ÑÐ²Ð¾ÑŽ Ð·Ð³Ð¾Ð´Ñƒ?\n- [x] Ð”Ð»Ñ Ð¶Ñ–Ð½ÐºÐ¸ Ð¿Ñ€Ð°Ð²Ð¸Ð»ÑŒÐ½Ð¾ÑŽ Ñ” Ñ„Ð¾Ñ€Ð¼Ð° Ð¿Ñ€Ð¸ÐºÐ¼ÐµÑ‚Ð½Ð¸ÐºÐ° Ð°Ð±Ð¾ ÑÑ‚Ð°Ð½Ñƒ \"Ð¯ Ð·Ð³Ð¾Ð´Ð½Ð°\" Ð· Ð·Ð°ÐºÑ–Ð½Ñ‡ÐµÐ½Ð½ÑÐ¼ -Ð°\n- [ ] Ð”Ð»Ñ Ð¶Ñ–Ð½ÐºÐ¸ Ð¿Ñ€Ð°Ð²Ð¸Ð»ÑŒÐ½Ð¾ÑŽ Ñ” Ñ„Ð¾Ñ€Ð¼Ð° Ð¿Ñ€Ð¸ÐºÐ¼ÐµÑ‚Ð½Ð¸ÐºÐ° Ð°Ð±Ð¾ ÑÑ‚Ð°Ð½Ñƒ \"Ð¯ Ð·Ð³Ð¾Ð´ÐµÐ½\" Ð· Ð½ÑƒÐ»ÑŒÐ¾Ð²Ð¸Ð¼ Ð·Ð°ÐºÑ–Ð½Ñ‡ÐµÐ½Ð½ÑÐ¼\n- [ ] Ð”Ð»Ñ Ð¶Ñ–Ð½ÐºÐ¸ Ð¿Ñ€Ð°Ð²Ð¸Ð»ÑŒÐ½Ð¾ÑŽ Ñ” Ñ„Ð¾Ñ€Ð¼Ð° Ð¿Ñ€Ð¸ÐºÐ¼ÐµÑ‚Ð½Ð¸ÐºÐ° Ð°Ð±Ð¾ ÑÑ‚Ð°Ð½Ñƒ \"Ð¯ Ð·Ð³Ð¾Ð´Ð½Ðµ\" Ð· Ð·Ð°ÐºÑ–Ð½Ñ‡ÐµÐ½Ð½ÑÐ¼ -Ðµ\n- [ ] Ð”Ð»Ñ Ð¶Ñ–Ð½ÐºÐ¸ Ð¿Ñ€Ð°Ð²Ð¸Ð»ÑŒÐ½Ð¾ÑŽ Ñ” Ñ„Ð¾Ñ€Ð¼Ð° Ñ–Ð¼ÐµÐ½Ð½Ð¸ÐºÐ° \"Ð—Ð³Ð¾Ð´Ð°\" Ð² Ð½Ð°Ð·Ð¸Ð²Ð½Ð¾Ð¼Ñƒ Ð²Ñ–Ð´Ð¼Ñ–Ð½ÐºÑƒ Ð¾Ð´Ð½Ð¸Ð½Ð¸\n\n---\n\n8. Ð£ ÑÐºÑ–Ð¹ ÑÐ°Ð¼Ðµ Ð¶Ð¸Ñ‚Ñ‚Ñ”Ð²Ñ–Ð¹ ÑÐ¸Ñ‚ÑƒÐ°Ñ†Ñ–Ñ— Ð½Ð°Ð¹Ð±Ñ–Ð»ÑŒÑˆ Ð´Ð¾Ñ€ÐµÑ‡Ð½Ð¾ Ð²Ð¶Ð¸Ð²Ð°Ñ‚Ð¸ Ð¾Ñ„Ñ–Ñ†Ñ–Ð¹Ð½Ðµ Ð´Ñ–Ñ”ÑÐ»Ð¾Ð²Ð¾ \"Ð¯ Ð²Ð²Ð°Ð¶Ð°ÑŽ, Ñ‰Ð¾...\"?\n- [x] ÐšÐ¾Ð»Ð¸ Ð²Ð¸ Ð²Ð¸ÑÐ»Ð¾Ð²Ð»ÑŽÑ”Ñ‚Ðµ ÑÐµÑ€Ð¹Ð¾Ð·Ð½Ñƒ, Ð·Ð²Ð°Ð¶ÐµÐ½Ñƒ Ñ‚Ð° Ð´Ð¾Ð±Ñ€Ðµ Ð°Ñ€Ð³ÑƒÐ¼ÐµÐ½Ñ‚Ð¾Ð²Ð°Ð½Ñƒ Ð²Ð»Ð°ÑÐ½Ñƒ Ð¿Ð¾Ð·Ð¸Ñ†Ñ–ÑŽ\n- [ ] ÐšÐ¾Ð»Ð¸ Ð²Ð¸ Ð¿Ñ€Ð¾ÑÑ‚Ð¾ Ñ€Ð¾Ð·Ð¿Ð¾Ð²Ñ–Ð´Ð°Ñ”Ñ‚Ðµ Ð´Ñ€ÑƒÐ·ÑÐ¼ Ð½Ð¾Ð²Ð¸Ð¹ ÑÐ¼Ñ–ÑˆÐ½Ð¸Ð¹ Ð°Ð½ÐµÐºÐ´Ð¾Ñ‚ Ð¿Ñ€Ð¾ ÑÑ‚Ð°Ñ€Ð¾Ð³Ð¾ Ñ€Ð¸Ð±Ð°Ð»ÐºÑƒ\n- [ ] ÐšÐ¾Ð»Ð¸ Ð²Ð¸ Ð¿Ñ€Ð¾ÑÐ¸Ñ‚Ðµ Ð¿Ñ€Ð¾Ð´Ð°Ð²Ñ†Ñ Ð² Ð¼Ð°Ð³Ð°Ð·Ð¸Ð½Ñ– Ð¿Ñ€Ð¾Ð´Ð°Ñ‚Ð¸ Ð²Ð°Ð¼ Ñ‚Ñ€Ð¾Ñ…Ð¸ ÑÐ²Ñ–Ð¶Ð¾Ð³Ð¾ Ð±Ñ–Ð»Ð¾Ð³Ð¾ Ñ…Ð»Ñ–Ð±Ð°\n- [ ] ÐšÐ¾Ð»Ð¸ Ð²Ð¸ ÑˆÑƒÐºÐ°Ñ”Ñ‚Ðµ Ð¿Ñ€Ð°Ð²Ð¸Ð»ÑŒÐ½Ñƒ Ð´Ð¾Ñ€Ð¾Ð³Ñƒ Ð´Ð¾ Ñ†ÐµÐ½Ñ‚Ñ€Ð°Ð»ÑŒÐ½Ð¾Ð³Ð¾ Ð¿Ð°Ñ€ÐºÑƒ Ð² Ð½Ð¾Ð²Ð¾Ð¼Ñƒ Ð¼Ñ–ÑÑ‚Ñ–\n\n---\n\n9. Ð¯Ðº Ð¿Ñ€Ð°Ð²Ð¸Ð»ÑŒÐ½Ð¾ Ñ‚Ð° Ð¿Ñ€Ð¸Ñ€Ð¾Ð´Ð½Ð¾ ÑÐºÐ°Ð·Ð°Ñ‚Ð¸ \"I think so too\" ÑƒÐºÑ€Ð°Ñ—Ð½ÑÑŒÐºÐ¾ÑŽ Ð¼Ð¾Ð²Ð¾ÑŽ Ð² Ñ‰Ð¾Ð´ÐµÐ½Ð½Ñ–Ð¹ Ñ€Ð¾Ð·Ð¼Ð¾Ð²Ñ–?\n- [x] ÐÐ°Ð¹ÐºÑ€Ð°Ñ‰Ðµ ÑÐºÐ°Ð·Ð°Ñ‚Ð¸ Ñ„Ñ€Ð°Ð·Ñƒ \"Ð¯ Ñ‚ÐµÐ¶ Ñ‚Ð°Ðº Ð´ÑƒÐ¼Ð°ÑŽ\" ÑÐ²Ð¾Ñ”Ð¼Ñƒ Ð´Ñ€ÑƒÐ³Ñƒ Ð°Ð±Ð¾ ÐºÐ¾Ð»ÐµÐ·Ñ–\n- [ ] ÐÐ°Ð¹ÐºÑ€Ð°Ñ‰Ðµ ÑÐºÐ°Ð·Ð°Ñ‚Ð¸ Ñ„Ñ€Ð°Ð·Ñƒ \"Ð¯ Ñ‚ÐµÐ¶ Ñ‚Ð°Ðº Ð´Ð¸Ð²Ð»ÑŽÑÑ\" ÑÐ²Ð¾Ñ”Ð¼Ñƒ Ð´Ñ€ÑƒÐ³Ñƒ Ð°Ð±Ð¾ ÐºÐ¾Ð»ÐµÐ·Ñ–\n- [ ] ÐÐ°Ð¹ÐºÑ€Ð°Ñ‰Ðµ ÑÐºÐ°Ð·Ð°Ñ‚Ð¸ Ñ„Ñ€Ð°Ð·Ñƒ \"Ð¯ Ñ‚ÐµÐ¶ Ñ‚Ð°Ðº ÑÐ¿Ð»ÑŽ\" ÑÐ²Ð¾Ñ”Ð¼Ñƒ Ð´Ñ€ÑƒÐ³Ñƒ Ð°Ð±Ð¾ ÐºÐ¾Ð»ÐµÐ·Ñ–\n- [ ] ÐÐ°Ð¹ÐºÑ€Ð°Ñ‰Ðµ ÑÐºÐ°Ð·Ð°Ñ‚Ð¸ Ñ„Ñ€Ð°Ð·Ñƒ \"Ð¯ Ñ‚ÐµÐ¶ Ñ‚Ð°Ðº Ñ—Ð¼\" ÑÐ²Ð¾Ñ”Ð¼Ñƒ Ð´Ñ€ÑƒÐ³Ñƒ Ð°Ð±Ð¾ ÐºÐ¾Ð»ÐµÐ·Ñ–\n\n---\n\n10. Ð©Ð¾ ÑÐ°Ð¼Ðµ Ð²Ð¸ Ñ…Ð¾Ñ‡ÐµÑ‚Ðµ Ð¿Ð¾Ð²Ñ–Ð´Ð¾Ð¼Ð¸Ñ‚Ð¸, ÐºÐ¾Ð»Ð¸ ÐºÐ°Ð¶ÐµÑ‚Ðµ \"Ð’Ð¸ Ð¿Ð¾Ð¼Ð¸Ð»ÑÑ”Ñ‚ÐµÑÑ\" Ð¿Ñ–Ð´ Ñ‡Ð°Ñ Ð³Ð°Ñ€ÑÑ‡Ð¾Ñ— ÑÑƒÐ¿ÐµÑ€ÐµÑ‡ÐºÐ¸ Ð½Ð° Ñ€Ð¾Ð±Ð¾Ñ‚Ñ–?\n- [x] Ð’Ð¸ Ð²Ð²Ñ–Ñ‡Ð»Ð¸Ð²Ð¾ Ð²ÐºÐ°Ð·ÑƒÑ”Ñ‚Ðµ Ð»ÑŽÐ´Ð¸Ð½Ñ– Ð½Ð° Ñ‚Ðµ, Ñ‰Ð¾ Ð²Ð¾Ð½Ð° ÐºÐ°Ð¶Ðµ ÑÐºÑƒÑÑŒ Ð½ÐµÐ¿Ñ€Ð°Ð²Ð´Ñƒ Ð°Ð±Ð¾ Ð¿Ð¾Ð¼Ð¸Ð»ÑÑ”Ñ‚ÑŒÑÑ\n- [ ] Ð’Ð¸ ÐºÐ°Ð¶ÐµÑ‚Ðµ Ð»ÑŽÐ´Ð¸Ð½Ñ–, Ñ‰Ð¾ Ð²Ð¾Ð½Ð° Ð´ÑƒÐ¶Ðµ Ð³Ð°Ñ€Ð½Ð¾ Ñ‚Ð° Ð¼Ð¾Ð´Ð½Ð¾ ÑÑŒÐ¾Ð³Ð¾Ð´Ð½Ñ– Ð¾Ð´ÑÐ³Ð½ÐµÐ½Ð° Ð´Ð»Ñ Ð·ÑƒÑÑ‚Ñ€Ñ–Ñ‡Ñ–\n- [ ] Ð’Ð¸ Ð¿Ñ€Ð¾ÑÐ¸Ñ‚Ðµ Ð»ÑŽÐ´Ð¸Ð½Ñƒ Ð¿Ñ€Ð¸Ð½ÐµÑÑ‚Ð¸ Ð²Ð°Ð¼ Ð½Ð¾Ð²Ñƒ Ñ†Ñ–ÐºÐ°Ð²Ñƒ ÐºÐ½Ð¸Ð³Ñƒ Ð¿Ñ€Ð¾ Ñ–ÑÑ‚Ð¾Ñ€Ñ–ÑŽ Ð²Ð°ÑˆÐ¾Ñ— ÐºÑ€Ð°Ñ—Ð½Ð¸\n- [ ] Ð’Ð¸ ÐºÐ°Ð¶ÐµÑ‚Ðµ Ð»ÑŽÐ´Ð¸Ð½Ñ–, Ñ‰Ð¾ Ð·Ð°Ñ€Ð°Ð· ÑÐ°Ð¼Ðµ Ñ‡Ð°Ñ Ð´Ð»Ñ Ð´ÑƒÐ¶Ðµ ÑÐ¼Ð°Ñ‡Ð½Ð¾Ð³Ð¾ Ð¾Ð±Ñ–Ð´Ñƒ Ð² Ñ€ÐµÑÑ‚Ð¾Ñ€Ð°Ð½Ñ–\n\n---\n\n11. Ð§Ð¸ Ð¼Ð¾Ð¶Ð½Ð° Ñ‡Ð°ÑÑ‚Ð¾ Ð¿Ð¾Ñ‡Ð¸Ð½Ð°Ñ‚Ð¸ Ð²Ð»Ð°ÑÐ½Ñƒ Ð´ÑƒÐ¼ÐºÑƒ Ð·Ñ– ÑÐ»Ð¾Ð²Ð° \"ÐœÐ¾Ð¶Ð»Ð¸Ð²Ð¾...\" Ð´Ð»Ñ Ð¿Ð¾Ð¼'ÑÐºÑˆÐµÐ½Ð½Ñ Ð·Ð°Ð³Ð°Ð»ÑŒÐ½Ð¾Ð³Ð¾ Ñ‚Ð¾Ð½Ñƒ?\n- [x] Ð¢Ð°Ðº, Ñ†Ðµ Ñ‡ÑƒÐ´Ð¾Ð²Ð¸Ð¹ ÑÐ¿Ð¾ÑÑ–Ð± Ð·Ñ€Ð¾Ð±Ð¸Ñ‚Ð¸ Ð²Ð»Ð°ÑÐ½Ñƒ Ð·Ð°ÑÐ²Ñƒ Ð¼ÐµÐ½Ñˆ ÐºÐ°Ñ‚ÐµÐ³Ð¾Ñ€Ð¸Ñ‡Ð½Ð¾ÑŽ Ñ‚Ð° Ð°Ð³Ñ€ÐµÑÐ¸Ð²Ð½Ð¾ÑŽ\n- [ ] ÐÑ–, Ð² ÑƒÐºÑ€Ð°Ñ—Ð½ÑÑŒÐºÑ–Ð¹ Ð¼Ð¾Ð²Ñ– ÐºÐ°Ñ‚ÐµÐ³Ð¾Ñ€Ð¸Ñ‡Ð½Ð¾ Ð½Ðµ Ð¼Ð¾Ð¶Ð½Ð° Ð²Ð¶Ð¸Ð²Ð°Ñ‚Ð¸ Ñ†Ðµ ÑÐ»Ð¾Ð²Ð¾ Ð½Ð° Ð¿Ð¾Ñ‡Ð°Ñ‚ÐºÑƒ\n- [ ] Ð¢Ð°Ðº, Ð°Ð»Ðµ Ñ‚Ñ–Ð»ÑŒÐºÐ¸ ÑÐºÑ‰Ð¾ Ð²Ð¸ Ñ€Ð¾Ð·Ð¼Ð¾Ð²Ð»ÑÑ”Ñ‚Ðµ Ð· Ð´ÑƒÐ¶Ðµ Ð¼Ð°Ð»ÐµÐ½ÑŒÐºÐ¸Ð¼Ð¸ Ð´Ñ–Ñ‚ÑŒÐ¼Ð¸ Ð½Ð° Ð²ÑƒÐ»Ð¸Ñ†Ñ–\n- [ ] ÐÑ–, Ñ†Ðµ ÑÐ»Ð¾Ð²Ð¾ Ð²Ð¸ÐºÐ¾Ñ€Ð¸ÑÑ‚Ð¾Ð²ÑƒÑ”Ñ‚ÑŒÑÑ Ð²Ð¸ÐºÐ»ÑŽÑ‡Ð½Ð¾ Ð² Ð¿Ñ–Ð´Ñ€ÑƒÑ‡Ð½Ð¸ÐºÐ°Ñ… Ð· Ð´ÑƒÐ¶Ðµ Ð²Ð¸Ñ‰Ð¾Ñ— Ð¼Ð°Ñ‚ÐµÐ¼Ð°Ñ‚Ð¸ÐºÐ¸\n\n---\n\n12. Ð¯ÐºÐµ ÑÐ»Ð¾Ð²Ð¾ Ð½Ð°Ð¹ÐºÑ€Ð°Ñ‰Ðµ Ð¿ÐµÑ€ÐµÐºÐ»Ð°Ð´Ð°Ñ” Ñ‚ÐµÑ€Ð¼Ñ–Ð½ \"opinion\" Ñƒ Ñ„Ñ–ÐºÑÐ¾Ð²Ð°Ð½Ñ–Ð¹ ÐºÐ¾Ð½ÑÑ‚Ñ€ÑƒÐºÑ†Ñ–Ñ— \"Ð½Ð° Ð¼Ð¾ÑŽ Ð´ÑƒÐ¼ÐºÑƒ\"?\n- [x] Ð¦Ðµ ÑƒÐºÑ€Ð°Ñ—Ð½ÑÑŒÐºÐµ ÑÐ»Ð¾Ð²Ð¾ \"Ð´ÑƒÐ¼ÐºÐ°\", Ñ‰Ð¾ Ð²ÐºÐ°Ð·ÑƒÑ” Ð½Ð° Ð¿Ñ€Ð¾Ñ†ÐµÑ Ð¾ÑÐ¾Ð±Ð¸ÑÑ‚Ð¾Ð³Ð¾ Ð¼Ð¸ÑÐ»ÐµÐ½Ð½Ñ\n- [ ] Ð¦Ðµ ÑƒÐºÑ€Ð°Ñ—Ð½ÑÑŒÐºÐµ ÑÐ»Ð¾Ð²Ð¾ \"Ð³Ð¾Ð»Ð¾Ð²Ð°\", Ñ‰Ð¾ Ð²ÐºÐ°Ð·ÑƒÑ” Ð½Ð° Ñ‡Ð°ÑÑ‚Ð¸Ð½Ñƒ Ñ‚Ñ–Ð»Ð° Ð±ÑƒÐ´ÑŒ-ÑÐºÐ¾Ñ— Ð»ÑŽÐ´Ð¸Ð½Ð¸\n- [ ] Ð¦Ðµ ÑƒÐºÑ€Ð°Ñ—Ð½ÑÑŒÐºÐµ ÑÐ»Ð¾Ð²Ð¾ \"ÐºÐ½Ð¸Ð³Ð°\", Ñ‰Ð¾ Ð²ÐºÐ°Ð·ÑƒÑ” Ð½Ð° Ð´Ñ€ÑƒÐºÐ¾Ð²Ð°Ð½Ðµ Ð´Ð¶ÐµÑ€ÐµÐ»Ð¾ Ð½Ð¾Ð²Ð¸Ñ… Ð·Ð½Ð°Ð½ÑŒ\n- [ ] Ð¦Ðµ ÑƒÐºÑ€Ð°Ñ—Ð½ÑÑŒÐºÐµ ÑÐ»Ð¾Ð²Ð¾ \"ÑÐ»Ð¾Ð²Ð¾\", Ñ‰Ð¾ Ð²ÐºÐ°Ð·ÑƒÑ” Ð½Ð° Ð¾ÐºÑ€ÐµÐ¼Ñƒ Ð¾Ð´Ð¸Ð½Ð¸Ñ†ÑŽ Ð»ÑŽÐ´ÑÑŒÐºÐ¾Ð³Ð¾ Ð¼Ð¾Ð²Ð»ÐµÐ½Ð½Ñ\n\n## true-false: Opinion Rules (Concept: Concept Validation)\nValidate the rules of expressing opinions.\n\n1. \"Ð¯ Ð·Ð³Ð¾Ð´ÐµÐ½\" should be used by a woman.\n   - [ ] True\n   - [x] False\n   > Women say \"Ð¯ Ð·Ð³Ð¾Ð´Ð½Ð°\".\n\n2. \"Ð¯ Ð´ÑƒÐ¼Ð°ÑŽ, Ñ‰Ð¾\" means \"I think that\".\n   - [x] True\n   - [ ] False\n   > This is the direct translation.\n\n3. \"ÐÐ°Ð²Ñ€ÑÐ´ Ñ‡Ð¸\" expresses total certainty.\n   - [ ] True\n   - [x] False\n   > It expresses doubt.\n\n4. \"ÐÐ° Ð¼Ð¾ÑŽ Ð´ÑƒÐ¼ÐºÑƒ\" acts as a parenthetical phrase.\n   - [x] True\n   - [ ] False\n   > It adds perspective to the sentence.\n\n5. You should shift tenses to the past when sharing someone's opinion.\n   - [ ] True\n   - [x] False\n   > Usually keep the original tense.\n\n6. \"Ð’Ð²Ð°Ð¶Ð°Ñ‚Ð¸\" is more formal than \"Ð´ÑƒÐ¼Ð°Ñ‚Ð¸\".\n   - [x] True\n   - [ ] False\n   > Correct.\n\n7. \"Ð’Ð¸ Ð¿Ñ€Ð°Ð²Ñ–\" means \"You are left\".\n   - [ ] True\n   - [x] False\n   > It means \"You are right\".\n\n8. Opinions in Ukraine are often discussed deeply at night.\n   - [x] True\n   - [ ] False\n   > This is a cultural trait.\n\n## group-sort: Agree vs Disagree (Ð—Ð³Ð¾Ð´Ð° Ñ‡Ð¸ ÐÐµÐ·Ð³Ð¾Ð´Ð°) (Concept: Semantic Categorization)\nSort these expressions into agreement or disagreement.\n\n### Agreement (Ð—Ð³Ð¾Ð´Ð°)\n- Ð¯ Ð·Ð³Ð¾Ð´ÐµÐ½\n- Ð¯ Ð·Ð³Ð¾Ð´Ð½Ð°\n- Ð’Ð¸ Ð¿Ñ€Ð°Ð²Ñ–\n- Ð¦Ðµ Ñ‚Ð¾Ñ‡Ð½Ð¾!\n- Ð¯ Ñ‚ÐµÐ¶ Ñ‚Ð°Ðº Ð´ÑƒÐ¼Ð°ÑŽ\n- Ð—Ð²Ð¸Ñ‡Ð°Ð¹Ð½Ð¾!\n- Ð‘ÐµÐ·ÑƒÐ¼Ð¾Ð²Ð½Ð¾!\n- ÐžÑ‡ÐµÐ²Ð¸Ð´Ð½Ð¾!\n\n### Disagreement (ÐÐµÐ·Ð³Ð¾Ð´Ð°)\n- Ð¯ Ð½Ðµ Ð·Ð³Ð¾Ð´ÐµÐ½\n- Ð¯ Ð½Ðµ Ð·Ð³Ð¾Ð´Ð½Ð°\n- ÐÐ°Ð²Ñ€ÑÐ´ Ñ‡Ð¸\n- Ð’Ð¸ Ð¿Ð¾Ð¼Ð¸Ð»ÑÑ”Ñ‚ÐµÑÑ\n- Ð¯ Ñ‚Ð°Ðº Ð½Ðµ Ð´ÑƒÐ¼Ð°ÑŽ\n- Ð¦Ðµ Ð½ÐµÐ¿Ñ€Ð°Ð²Ð´Ð°\n- Ð¦Ðµ Ð½Ðµ Ñ‚Ð°Ðº\n- ÐœÐµÐ½Ñ– Ð²Ð°Ð¶ÐºÐ¾ ÑÐºÐ°Ð·Ð°Ñ‚Ð¸\n\n## unjumble: Opinion Sentences (Concept: Syntax Integrity)\nRearrange the words to form correct sentences expressing opinions.\n\n1. Ñ / Ð´ÑƒÐ¼Ð°ÑŽ / Ñ‰Ð¾ / ÑÑƒÑ‡Ð°ÑÐ½Ð° / ÑƒÐºÑ€Ð°Ñ—Ð½ÑÑŒÐºÐ° / Ð¼Ð¾Ð²Ð° / Ñ” / Ð´ÑƒÐ¶Ðµ / Ð¼Ð¸Ð»Ð¾Ð·Ð²ÑƒÑ‡Ð½Ð° / Ñ– / ÑÐ¿Ñ€Ð°Ð²Ð´Ñ– / ÐºÑ€Ð°ÑÐ¸Ð²Ð°\n   > [!answer] Ð¯ Ð´ÑƒÐ¼Ð°ÑŽ, Ñ‰Ð¾ ÑÑƒÑ‡Ð°ÑÐ½Ð° ÑƒÐºÑ€Ð°Ñ—Ð½ÑÑŒÐºÐ° Ð¼Ð¾Ð²Ð° Ñ” Ð´ÑƒÐ¶Ðµ Ð¼Ð¸Ð»Ð¾Ð·Ð²ÑƒÑ‡Ð½Ð° Ñ– ÑÐ¿Ñ€Ð°Ð²Ð´Ñ– ÐºÑ€Ð°ÑÐ¸Ð²Ð°\n\n2. Ð½Ð° / Ð¼Ð¾ÑŽ / Ð´ÑƒÐ¼ÐºÑƒ / Ñ†ÐµÐ¹ / Ð·Ð¾Ð²ÑÑ–Ð¼ / Ð½Ð¾Ð²Ð¸Ð¹ / Ñ„Ñ–Ð»ÑŒÐ¼ / ÑÐ¿Ñ€Ð°Ð²Ð´Ñ– / Ð²Ð°Ñ€Ñ‚Ð¸Ð¹ / Ð²Ð°ÑˆÐ¾Ñ— / Ð¾ÑÐ¾Ð±Ð»Ð¸Ð²Ð¾Ñ— / ÑƒÐ²Ð°Ð³Ð¸\n   > [!answer] ÐÐ° Ð¼Ð¾ÑŽ Ð´ÑƒÐ¼ÐºÑƒ, Ñ†ÐµÐ¹ Ð·Ð¾Ð²ÑÑ–Ð¼ Ð½Ð¾Ð²Ð¸Ð¹ Ñ„Ñ–Ð»ÑŒÐ¼ ÑÐ¿Ñ€Ð°Ð²Ð´Ñ– Ð²Ð°Ñ€Ñ‚Ð¸Ð¹ Ð²Ð°ÑˆÐ¾Ñ— Ð¾ÑÐ¾Ð±Ð»Ð¸Ð²Ð¾Ñ— ÑƒÐ²Ð°Ð³Ð¸\n\n3. Ð²Ñ–Ð½ / Ñ‚Ð²ÐµÑ€Ð´Ð¾ / ÑÑ‚Ð²ÐµÑ€Ð´Ð¶ÑƒÑ” / Ñ‰Ð¾ / Ñ†Ðµ / ÑÐºÐ»Ð°Ð´Ð½Ðµ / Ñ€Ñ–ÑˆÐµÐ½Ð½Ñ / Ñ” / Ñ”Ð´Ð¸Ð½Ð¾ / Ð¿Ñ€Ð°Ð²Ð¸Ð»ÑŒÐ½Ð¸Ð¼ / Ð´Ð»Ñ / Ð½Ð°Ñ\n   > [!answer] Ð’Ñ–Ð½ Ñ‚Ð²ÐµÑ€Ð´Ð¾ ÑÑ‚Ð²ÐµÑ€Ð´Ð¶ÑƒÑ”, Ñ‰Ð¾ Ñ†Ðµ ÑÐºÐ»Ð°Ð´Ð½Ðµ Ñ€Ñ–ÑˆÐµÐ½Ð½Ñ Ñ” Ñ”Ð´Ð¸Ð½Ð¾ Ð¿Ñ€Ð°Ð²Ð¸Ð»ÑŒÐ½Ð¸Ð¼ Ð´Ð»Ñ Ð½Ð°Ñ\n\n4. Ð»Ñ–ÐºÐ°Ñ€ / Ð²Ð²Ð°Ð¶Ð°Ñ” / Ñ‰Ð¾ / Ñ†ÐµÐ¹ / Ð¿Ð°Ñ†Ñ–Ñ”Ð½Ñ‚ / Ð¿Ð¾Ð²Ð¸Ð½ÐµÐ½ / Ñ‚Ñ€Ð¾Ñ…Ð¸ / Ð±Ñ–Ð»ÑŒÑˆÐµ / Ð²Ñ–Ð´Ð¿Ð¾Ñ‡Ð¸Ð²Ð°Ñ‚Ð¸ / Ñ‚Ð° / Ð±Ð°Ð³Ð°Ñ‚Ð¾ / ÑÐ¿Ð°Ñ‚Ð¸\n   > [!answer] Ð›Ñ–ÐºÐ°Ñ€ Ð²Ð²Ð°Ð¶Ð°Ñ”, Ñ‰Ð¾ Ñ†ÐµÐ¹ Ð¿Ð°Ñ†Ñ–Ñ”Ð½Ñ‚ Ð¿Ð¾Ð²Ð¸Ð½ÐµÐ½ Ñ‚Ñ€Ð¾Ñ…Ð¸ Ð±Ñ–Ð»ÑŒÑˆÐµ Ð²Ñ–Ð´Ð¿Ð¾Ñ‡Ð¸Ð²Ð°Ñ‚Ð¸ Ñ‚Ð° Ð±Ð°Ð³Ð°Ñ‚Ð¾ ÑÐ¿Ð°Ñ‚Ð¸\n\n5. Ñ / Ñ†Ñ–Ð»ÐºÐ¾Ð¼ / Ð·Ð³Ð¾Ð´ÐµÐ½ / Ñ‰Ð¾ / Ð½Ð°Ð¼ / Ñ‚Ñ€ÐµÐ±Ð° / ÑˆÐ²Ð¸Ð´ÑˆÐµ / Ñ†Ðµ / Ð·Ñ€Ð¾Ð±Ð¸Ñ‚Ð¸\n   > [!answer] Ð¯ Ñ†Ñ–Ð»ÐºÐ¾Ð¼ Ð·Ð³Ð¾Ð´ÐµÐ½, Ñ‰Ð¾ Ð½Ð°Ð¼ Ñ‚Ñ€ÐµÐ±Ð° ÑˆÐ²Ð¸Ð´ÑˆÐµ Ñ†Ðµ Ð·Ñ€Ð¾Ð±Ð¸Ñ‚Ð¸\n\n6. Ð²Ð¾Ð½Ð° / Ð½Ð°Ð²Ñ€ÑÐ´ / Ñ‡Ð¸ / Ð¿Ð¾Ð³Ð¾Ð´Ð¸Ñ‚ÑŒÑÑ / Ð½Ð° / Ñ‚Ð°ÐºÑƒ / Ð´ÑƒÐ¶Ðµ / Ð´Ð¸Ð²Ð½Ñƒ / Ñ– / Ñ€Ð¸Ð·Ð¸ÐºÐ¾Ð²Ð°Ð½Ñƒ / Ð½Ð¾Ð²Ñƒ / Ð¿Ñ€Ð¾Ð¿Ð¾Ð·Ð¸Ñ†Ñ–ÑŽ\n   > [!answer] Ð’Ð¾Ð½Ð° Ð½Ð°Ð²Ñ€ÑÐ´ Ñ‡Ð¸ Ð¿Ð¾Ð³Ð¾Ð´Ð¸Ñ‚ÑŒÑÑ Ð½Ð° Ñ‚Ð°ÐºÑƒ Ð´ÑƒÐ¶Ðµ Ð´Ð¸Ð²Ð½Ñƒ Ñ– Ñ€Ð¸Ð·Ð¸ÐºÐ¾Ð²Ð°Ð½Ñƒ Ð½Ð¾Ð²Ñƒ Ð¿Ñ€Ð¾Ð¿Ð¾Ð·Ð¸Ñ†Ñ–ÑŽ\n\n## error-correction: Fix the Expression (Concept: Critical Proofreading)\nIdentify and fix errors in these opinion sentences.\n\n1. Ð¯ **Ð·Ð³Ð¾Ð´Ð½Ð°** Ð· Ð±Ñ€Ð°Ñ‚Ð¾Ð¼.\n   > [!error] Ð·Ð³Ð¾Ð´Ð½Ð°\n   > [!answer] Ð·Ð³Ð¾Ð´ÐµÐ½\n   > [!explanation] Men use the masculine form Ð·Ð³Ð¾Ð´ÐµÐ½.\n   > [!options] Ð·Ð³Ð¾Ð´ÐµÐ½ | Ð·Ð³Ð¾Ð´Ð½Ð°\n\n2. ÐÐ° **Ð¼Ñ–Ð¹** Ð´ÑƒÐ¼ÐºÑƒ, Ñ†Ðµ Ð´Ð¾Ð±Ñ€Ðµ.\n   > [!error] Ð¼Ñ–Ð¹\n   > [!answer] Ð¼Ð¾ÑŽ\n   > [!explanation] Ð”ÑƒÐ¼ÐºÐ° is feminine, so use Ð¼Ð¾ÑŽ.\n   > [!options] Ð¼Ð¾ÑŽ | Ð¼Ñ–Ð¹\n\n3. Ð¯ **Ð´ÑƒÐ¼Ð°Ñ‚Ð¸**, Ñ‰Ð¾ Ð²Ñ–Ð½ Ð¿Ñ€Ð¸Ð¹Ð´Ðµ.\n   > [!error] Ð´ÑƒÐ¼Ð°Ñ‚Ð¸\n   > [!answer] Ð´ÑƒÐ¼Ð°ÑŽ\n   > [!explanation] Use the conjugated form Ð´ÑƒÐ¼Ð°ÑŽ.\n   > [!options] Ð´ÑƒÐ¼Ð°ÑŽ | Ð´ÑƒÐ¼Ð°Ñ‚Ð¸\n\n4. Ð¦Ðµ **Ð½Ð°Ð²Ñ€ÑÐ´**, Ñ‰Ð¾ Ð²Ñ–Ð½ Ð·Ð½Ð°Ñ”.\n   > [!error] Ð½Ð°Ð²Ñ€ÑÐ´\n   > [!answer] Ð½Ð°Ð²Ñ€ÑÐ´ Ñ‡Ð¸\n   > [!explanation] Use the full particle Ð½Ð°Ð²Ñ€ÑÐ´ Ñ‡Ð¸.\n   > [!options] Ð½Ð°Ð²Ñ€ÑÐ´ Ñ‡Ð¸ | Ð½Ð°Ð²Ñ€ÑÐ´\n\n5. Ð¯ Ð²Ð²Ð°Ð¶Ð°ÑŽ, **Ñ‡Ð¸** Ð²Ñ–Ð½ Ð¿Ñ€Ð°Ð²Ð¸Ð¹.\n   > [!error] Ñ‡Ð¸\n   > [!answer] Ñ‰Ð¾\n   > [!explanation] Use Ñ‰Ð¾ for belief statements.\n   > [!options] Ñ‰Ð¾ | Ñ‡Ð¸\n\n6. Ð’Ð¸ **Ð¿Ð¾Ð¼Ð¸Ð»ÐºÐ°**, Ñ†Ðµ Ð½Ðµ Ñ‚Ð°Ðº.\n   > [!error] Ð¿Ð¾Ð¼Ð¸Ð»ÐºÐ°\n   > [!answer] Ð¿Ð¾Ð¼Ð¸Ð»ÑÑ”Ñ‚ÐµÑÑ\n   > [!explanation] Use the verb Ð¿Ð¾Ð¼Ð¸Ð»ÑÑ”Ñ‚ÐµÑÑ.\n   > [!options] Ð¿Ð¾Ð¼Ð¸Ð»ÑÑ”Ñ‚ÐµÑÑ | Ð¿Ð¾Ð¼Ð¸Ð»ÐºÐ°\n\n## cloze: Opinion Exchange (Concept: Contextual Application)\nComplete the conversation about the new project.\n\n**ÐÐ½Ð½Ð°:** [___:1] Ð¼Ð¾ÑŽ Ð´ÑƒÐ¼ÐºÑƒ, Ñ†ÐµÐ¹ Ð¿Ñ€Ð¾ÐµÐºÑ‚ Ð´ÑƒÐ¶Ðµ Ð¿ÐµÑ€ÑÐ¿ÐµÐºÑ‚Ð¸Ð²Ð½Ð¸Ð¹.\n**Ð†Ð²Ð°Ð½:** Ð¯ Ð½Ðµ [___:2]. ÐœÐµÐ½Ñ– [___:3], Ñ‰Ð¾ Ð²Ñ–Ð½ Ð·Ð°Ð½Ð°Ð´Ñ‚Ð¾ Ð´Ð¾Ñ€Ð¾Ð³Ð¸Ð¹.\n**ÐÐ½Ð½Ð°:** ÐÐ»Ðµ Ð´Ð¸Ñ€ÐµÐºÑ‚Ð¾Ñ€ [___:4], Ñ‰Ð¾ Ð¼Ð¸ Ð¾Ñ‚Ñ€Ð¸Ð¼Ð°Ñ”Ð¼Ð¾ Ð¿Ñ€Ð¸Ð±ÑƒÑ‚Ð¾Ðº.\n**Ð†Ð²Ð°Ð½:** [___:5] Ñ‡Ð¸ Ñ†Ðµ ÑÑ‚Ð°Ð½ÐµÑ‚ÑŒÑÑ Ñ‚Ð°Ðº ÑˆÐ²Ð¸Ð´ÐºÐ¾.\n**ÐÐ½Ð½Ð°:** Ð’Ð¸ [___:6], Ð†Ð²Ð°Ð½Ðµ. ÐœÐ¸ Ð²Ð¶Ðµ Ð¿Ñ€Ð¾Ð²ÐµÐ»Ð¸ Ð°Ð½Ð°Ð»Ñ–Ð· Ñ€Ð¸Ð½ÐºÑƒ.\n**Ð†Ð²Ð°Ð½:** ÐœÐ¾Ð¶Ð»Ð¸Ð²Ð¾. ÐÐ»Ðµ Ñ Ð²ÑÐµ Ð¾Ð´Ð½Ð¾ [___:7], Ñ‰Ð¾ Ñ‚Ñ€ÐµÐ±Ð° Ð±ÑƒÑ‚Ð¸ Ð¾Ð±ÐµÑ€ÐµÐ¶Ð½Ð¸Ð¼Ð¸.\n**ÐÐ½Ð½Ð°:** Ð¯ [___:8] Ð· Ð²Ð°Ð¼Ð¸, Ñ‰Ð¾ Ñ€Ð¸Ð·Ð¸ÐºÐ¸ Ñ”. ÐÐ»Ðµ Ñ [___:9], Ñ‰Ð¾ Ð²Ð¾Ð½Ð¸ Ð¼Ñ–Ð½Ñ–Ð¼Ð°Ð»ÑŒÐ½Ñ–.\n**Ð†Ð²Ð°Ð½:** Ð¯ [___:10] Ñ‚Ð°Ðº Ð½Ðµ Ð´ÑƒÐ¼Ð°ÑŽ. ÐŸÑ€Ð¾Ñ‚Ðµ, [___:11] ÑÐ¿Ñ€Ð¾Ð±ÑƒÐ²Ð°Ñ‚Ð¸ Ð²Ð°Ñ€Ñ‚Ð¾.\n**ÐÐ½Ð½Ð°:** [___:12] Ñ‚Ð°Ðº! Ð”Ð°Ð²Ð°Ð¹Ñ‚Ðµ Ð¿Ð¾Ñ‡Ð½ÐµÐ¼Ð¾ Ñ€Ð¾Ð±Ð¾Ñ‚Ñƒ.\n\n1. ÐÐ° | Ð£\n> [!answer] ÐÐ°\n\n2. Ð·Ð³Ð¾Ð´ÐµÐ½ | Ð±Ð°Ñ‡Ñƒ\n> [!answer] Ð·Ð³Ð¾Ð´ÐµÐ½\n\n3. Ð·Ð´Ð°Ñ”Ñ‚ÑŒÑÑ | Ð¿Ð¾Ð´Ð¾Ð±Ð°Ñ”Ñ‚ÑŒÑÑ\n> [!answer] Ð·Ð´Ð°Ñ”Ñ‚ÑŒÑÑ\n\n4. Ð²Ð²Ð°Ð¶Ð°Ñ” | Ð·Ð½Ð°Ñ”\n> [!answer] Ð²Ð²Ð°Ð¶Ð°Ñ”\n\n5. ÐÐ°Ð²Ñ€ÑÐ´ | ÐœÐ°Ð¹Ð¶Ðµ\n> [!answer] ÐÐ°Ð²Ñ€ÑÐ´\n\n6. Ð¿Ð¾Ð¼Ð¸Ð»ÑÑ”Ñ‚ÐµÑÑ | Ð¿Ñ€Ð°Ð²Ñ–\n> [!answer] Ð¿Ð¾Ð¼Ð¸Ð»ÑÑ”Ñ‚ÐµÑÑ\n\n7. Ð´ÑƒÐ¼Ð°ÑŽ | ÑÐ¿Ð»ÑŽ\n> [!answer] Ð´ÑƒÐ¼Ð°ÑŽ\n\n8. Ð·Ð³Ð¾Ð´Ð½Ð° | Ð·Ð³Ð¾Ð´ÐµÐ½\n> [!answer] Ð·Ð³Ð¾Ð´Ð½Ð°\n\n9. Ð²Ð²Ð°Ð¶Ð°ÑŽ | Ð¿Ð¸ÑˆÑƒ\n> [!answer] Ð²Ð²Ð°Ð¶Ð°ÑŽ\n\n10. Ñ‚ÐµÐ¶ | Ð·Ð¾Ð²ÑÑ–Ð¼\n> [!answer] Ñ‚ÐµÐ¶\n\n11. Ð¼Ð¾Ð¶Ð»Ð¸Ð²Ð¾ | Ð½Ð°Ð²Ñ€ÑÐ´\n> [!answer] Ð¼Ð¾Ð¶Ð»Ð¸Ð²Ð¾\n\n12. Ð¡Ð°Ð¼Ðµ | Ð¥Ð¾Ñ‡Ð°\n> [!answer] Ð¡Ð°Ð¼Ðµ\n\n## dialogue-reorder: Discussing Views (Concept: Narrative Coherence)\nOrder the dialogue logically.\n\n- Ð¯Ðº Ñ‚Ð¾Ð±Ñ– Ñ†ÐµÐ¹ Ñ€ÐµÑÑ‚Ð¾Ñ€Ð°Ð½?\n- Ð¯ Ð´ÑƒÐ¼Ð°ÑŽ, Ñ‰Ð¾ Ñ—Ð¶Ð° Ñ‚ÑƒÑ‚ Ð´ÑƒÐ¶Ðµ ÑÐ¼Ð°Ñ‡Ð½Ð°.\n- Ð Ñ Ð½Ðµ Ð·Ð³Ð¾Ð´ÐµÐ½. ÐœÑ–Ð¹ ÑÑ‚ÐµÐ¹Ðº Ð±ÑƒÐ² ÑÑƒÑ…Ð¸Ð¹.\n- Ð¡Ð¿Ñ€Ð°Ð²Ð´Ñ–? ÐÐ° Ð¼Ð¾ÑŽ Ð´ÑƒÐ¼ÐºÑƒ, Ð²Ñ–Ð½ Ð²Ð¸Ð³Ð»ÑÐ´Ð°Ð² Ð´Ð¾Ð±Ñ€Ðµ.\n- Ð’Ð¸Ð³Ð»ÑÐ´ â€” Ñ†Ðµ Ñ‰Ðµ Ð½Ðµ Ð²ÑÐµ. Ð¯ Ð²Ð²Ð°Ð¶Ð°ÑŽ, Ñ‰Ð¾ ÑÐµÑ€Ð²Ñ–Ñ Ñ‚ÐµÐ¶ Ð¿Ð¾Ð²Ñ–Ð»ÑŒÐ½Ð¸Ð¹.\n- Ð’Ð¸ Ð¿Ñ€Ð°Ð²Ñ–, Ð¾Ñ„Ñ–Ñ†Ñ–Ð°Ð½Ñ‚Ð° Ð¼Ð¸ Ñ‡ÐµÐºÐ°Ð»Ð¸ Ð´Ð¾Ð²Ð³Ð¾.\n- Ð¯ Ð±Ñ–Ð»ÑŒÑˆÐµ ÑÑŽÐ´Ð¸ Ð½Ðµ Ð¿Ñ€Ð¸Ð¹Ð´Ñƒ.\n- Ð Ñ Ñ‚ÐµÐ¶ Ñ‚Ð°Ðº Ð´ÑƒÐ¼Ð°ÑŽ Ñ‚ÐµÐ¿ÐµÑ€.\n- ÐœÐ¾Ð¶Ðµ, Ð¿Ñ–Ð´ÐµÐ¼Ð¾ Ð² Ñ–Ð½ÑˆÐµ Ð¼Ñ–ÑÑ†Ðµ Ð·Ð°Ð²Ñ‚Ñ€Ð°?\n- ÐÐ°Ð²Ñ€ÑÐ´ Ñ‡Ð¸ Ñ Ð·Ð°Ñ…Ð¾Ñ‡Ñƒ Ñ—ÑÑ‚Ð¸ Ð² Ñ†ÑŒÐ¾Ð¼Ñƒ Ñ€Ð°Ð¹Ð¾Ð½Ñ– Ð·Ð½Ð¾Ð²Ñƒ.\n- Ð’Ð¸ Ð´ÑƒÐ¶Ðµ ÐºÑ€Ð¸Ñ‚Ð¸Ñ‡Ð½Ñ– ÑÑŒÐ¾Ð³Ð¾Ð´Ð½Ñ–!\n- ÐœÐ¾Ð¶Ð»Ð¸Ð²Ð¾, Ð°Ð»Ðµ Ñ Ð¿Ñ€Ð¾ÑÑ‚Ð¾ Ñ‡ÐµÑÐ½Ð¸Ð¹.\n\n> [!answer]\n> 1. Ð¯Ðº Ñ‚Ð¾Ð±Ñ– Ñ†ÐµÐ¹ Ñ€ÐµÑÑ‚Ð¾Ñ€Ð°Ð½?\n> 2. Ð¯ Ð´ÑƒÐ¼Ð°ÑŽ, Ñ‰Ð¾ Ñ—Ð¶Ð° Ñ‚ÑƒÑ‚ Ð´ÑƒÐ¶Ðµ ÑÐ¼Ð°Ñ‡Ð½Ð°.\n> 3. Ð Ñ Ð½Ðµ Ð·Ð³Ð¾Ð´ÐµÐ½. ÐœÑ–Ð¹ ÑÑ‚ÐµÐ¹Ðº Ð±ÑƒÐ² ÑÑƒÑ…Ð¸Ð¹.\n> 4. Ð¡Ð¿Ñ€Ð°Ð²Ð´Ñ–? ÐÐ° Ð¼Ð¾ÑŽ Ð´ÑƒÐ¼ÐºÑƒ, Ð²Ñ–Ð½ Ð²Ð¸Ð³Ð»ÑÐ´Ð°Ð² Ð´Ð¾Ð±Ñ€Ðµ.\n> 5. Ð’Ð¸Ð³Ð»ÑÐ´ â€” Ñ†Ðµ Ñ‰Ðµ Ð½Ðµ Ð²ÑÐµ. Ð¯ Ð²Ð²Ð°Ð¶Ð°ÑŽ, Ñ‰Ð¾ ÑÐµÑ€Ð²Ñ–Ñ Ñ‚ÐµÐ¶ Ð¿Ð¾Ð²Ñ–Ð»ÑŒÐ½Ð¸Ð¹.\n> 6. Ð’Ð¸ Ð¿Ñ€Ð°Ð²Ñ–, Ð¾Ñ„Ñ–Ñ†Ñ–Ð°Ð½Ñ‚Ð° Ð¼Ð¸ Ñ‡ÐµÐºÐ°Ð»Ð¸ Ð´Ð¾Ð²Ð³Ð¾.\n> 7. Ð¯ Ð±Ñ–Ð»ÑŒÑˆÐµ ÑÑŽÐ´Ð¸ Ð½Ðµ Ð¿Ñ€Ð¸Ð¹Ð´Ñƒ.\n> 8. Ð Ñ Ñ‚ÐµÐ¶ Ñ‚Ð°Ðº Ð´ÑƒÐ¼Ð°ÑŽ Ñ‚ÐµÐ¿ÐµÑ€.\n> 9. ÐœÐ¾Ð¶Ðµ, Ð¿Ñ–Ð´ÐµÐ¼Ð¾ Ð² Ñ–Ð½ÑˆÐµ Ð¼Ñ–ÑÑ†Ðµ Ð·Ð°Ð²Ñ‚Ñ€Ð°?\n> 10. ÐÐ°Ð²Ñ€ÑÐ´ Ñ‡Ð¸ Ñ Ð·Ð°Ñ…Ð¾Ñ‡Ñƒ Ñ—ÑÑ‚Ð¸ Ð² Ñ†ÑŒÐ¾Ð¼Ñƒ Ñ€Ð°Ð¹Ð¾Ð½Ñ– Ð·Ð½Ð¾Ð²Ñƒ.\n> 11. Ð’Ð¸ Ð´ÑƒÐ¶Ðµ ÐºÑ€Ð¸Ñ‚Ð¸Ñ‡Ð½Ñ– ÑÑŒÐ¾Ð³Ð¾Ð´Ð½Ñ–!\n> 12. ÐœÐ¾Ð¶Ð»Ð¸Ð²Ð¾, Ð°Ð»Ðµ Ñ Ð¿Ñ€Ð¾ÑÑ‚Ð¾ Ñ‡ÐµÑÐ½Ð¸Ð¹.\n\n## mark-the-words: Find Opinion Expressions (Concept: Pattern Recognition)\nIdentify the opinion-marking phrases in the text.\n\nÐ¯ [Ð´ÑƒÐ¼Ð°ÑŽ](correct), Ñ‰Ð¾ Ñ†Ðµ Ð´Ð¾Ð±Ñ€Ðµ. ÐÐ° [Ð¼Ð¾ÑŽ Ð´ÑƒÐ¼ÐºÑƒ](correct), Ñ†Ðµ Ð²Ð°Ð¶Ð»Ð¸Ð²Ð¾. ÐœÐµÐ½Ñ– [Ð·Ð´Ð°Ñ”Ñ‚ÑŒÑÑ](correct), Ð²Ð¸ Ð¿Ð¾Ð¼Ð¸Ð»ÑÑ”Ñ‚ÐµÑÑ. Ð¯ [Ð²Ð²Ð°Ð¶Ð°ÑŽ](correct), Ñ‰Ð¾ Ñ‡Ð°Ñ Ñ–Ñ‚Ð¸. Ð¯ Ð½Ðµ [Ð¿ÐµÐ²Ð½Ð¸Ð¹](correct) Ñƒ Ñ†ÑŒÐ¾Ð¼Ñƒ. Ð’Ð¸ [Ð¿Ñ€Ð°Ð²Ñ–](correct)! ÐÐ°Ð²Ñ€ÑÐ´ [Ñ‡Ð¸](correct) Ñ†Ðµ Ð´Ð¾Ð¿Ð¾Ð¼Ð¾Ð¶Ðµ. Ð¯ [Ð·Ð³Ð¾Ð´ÐµÐ½](correct) Ð· Ð²Ð°Ð¼Ð¸. Ð¯ [Ñ‚ÐµÐ¶](correct) Ñ‚Ð°Ðº Ð´ÑƒÐ¼Ð°ÑŽ.\n\n## translate: English to Ukrainian (Concept: Cross-Linguistic Transfer)\n\n1. I think that she is right.\n- [x] Ð¯ Ð´ÑƒÐ¼Ð°ÑŽ, Ñ‰Ð¾ Ð²Ð¾Ð½Ð° Ð¿Ñ€Ð°Ð²Ð°.\n- [ ] Ð¯ Ð´ÑƒÐ¼Ð°ÑŽ, Ñ‡Ð¸ Ð²Ð¾Ð½Ð° Ð¿Ñ€Ð°Ð²Ð°.\n\n2. In my opinion, it is too late.\n- [x] ÐÐ° Ð¼Ð¾ÑŽ Ð´ÑƒÐ¼ÐºÑƒ, Ð²Ð¶Ðµ Ð·Ð°Ð½Ð°Ð´Ñ‚Ð¾ Ð¿Ñ–Ð·Ð½Ð¾.\n- [ ] ÐÐ° Ð¼Ð¾ÑŽ Ð´ÑƒÐ¼ÐºÑƒ, Ð²Ð¶Ðµ Ð·Ð°Ð½Ð°Ð´Ñ‚Ð¾ ÑÐºÐ¾Ñ€Ð¾.\n\n3. I completely agree with you.\n- [x] Ð¯ Ñ†Ñ–Ð»ÐºÐ¾Ð¼ Ð·Ð³Ð¾Ð´ÐµÐ½ Ð· Ð²Ð°Ð¼Ð¸.\n- [ ] Ð¯ Ñ†Ñ–Ð»ÐºÐ¾Ð¼ Ð½Ðµ Ð¿ÐµÐ²Ð½Ð¸Ð¹ Ð· Ð²Ð°Ð¼Ð¸.\n\n4. It seems to me that it works.\n- [x] ÐœÐµÐ½Ñ– Ð·Ð´Ð°Ñ”Ñ‚ÑŒÑÑ, Ñ‰Ð¾ Ñ†Ðµ Ð¿Ñ€Ð°Ñ†ÑŽÑ”.\n- [ ] ÐœÐµÐ½Ñ– Ð·Ð´Ð°Ñ”Ñ‚ÑŒÑÑ, Ñ‰Ð¾ Ñ†Ðµ ÑÐ¿Ð¸Ñ‚ÑŒ.\n\n5. I doubt that it is true.\n- [x] ÐÐ°Ð²Ñ€ÑÐ´ Ñ‡Ð¸ Ñ†Ðµ Ð¿Ñ€Ð°Ð²Ð´Ð°.\n- [ ] Ð¦Ðµ Ñ‚Ð¾Ñ‡Ð½Ð¾ Ð¿Ñ€Ð°Ð²Ð´Ð°.\n\n6. What do you think about this?\n- [x] Ð©Ð¾ Ð²Ð¸ Ð¿Ñ€Ð¾ Ñ†Ðµ Ð´ÑƒÐ¼Ð°Ñ”Ñ‚Ðµ?\n- [ ] Ð”Ðµ Ð²Ð¸ Ð¿Ñ€Ð¾ Ñ†Ðµ Ð´ÑƒÐ¼Ð°Ñ”Ñ‚Ðµ?\n\n7. You are mistaken about this.\n- [x] Ð’Ð¸ Ð¿Ð¾Ð¼Ð¸Ð»ÑÑ”Ñ‚ÐµÑÑ Ñ‰Ð¾Ð´Ð¾ Ñ†ÑŒÐ¾Ð³Ð¾.\n- [ ] Ð’Ð¸ Ð¿Ñ€Ð°Ð²Ñ– Ñ‰Ð¾Ð´Ð¾ Ñ†ÑŒÐ¾Ð³Ð¾.\n\n8. I am not sure about the plan.\n- [x] Ð¯ Ð½Ðµ Ð·Ð½Ð°ÑŽ Ñ‚Ð¾Ñ‡Ð½Ð¾ Ñ‰Ð¾Ð´Ð¾ Ð¿Ð»Ð°Ð½Ñƒ.\n- [ ] Ð¯ Ð·Ð³Ð¾Ð´ÐµÐ½ Ñ‰Ð¾Ð´Ð¾ Ð¿Ð»Ð°Ð½Ñƒ.\n\n9. Probably we should stay.\n- [x] ÐÐ°Ð¿ÐµÐ²Ð½Ð¾, Ð½Ð°Ð¼ Ñ‚Ñ€ÐµÐ±Ð° Ð·Ð°Ð»Ð¸ÑˆÐ¸Ñ‚Ð¸ÑÑ.\n- [ ] ÐÐ°Ð¿ÐµÐ²Ð½Ð¾, Ð½Ð°Ð¼ Ñ‚Ñ€ÐµÐ±Ð° Ð¿Ñ–Ñ‚Ð¸.\n\n10. Maybe you have a point.\n- [x] ÐœÐ¾Ð¶Ð»Ð¸Ð²Ð¾, Ð²Ð¸ Ð¼Ð°Ñ”Ñ‚Ðµ Ñ€Ð°Ñ†Ñ–ÑŽ.\n- [ ] ÐœÐ¾Ð¶Ð»Ð¸Ð²Ð¾, Ð²Ð¸ Ð¼Ð°Ñ”Ñ‚Ðµ ÐºÐ½Ð¸Ð³Ñƒ.\n\n11. She considers this important.\n- [x] Ð’Ð¾Ð½Ð° Ð²Ð²Ð°Ð¶Ð°Ñ” Ñ†Ðµ Ð²Ð°Ð¶Ð»Ð¸Ð²Ð¸Ð¼.\n- [ ] Ð’Ð¾Ð½Ð° Ð´ÑƒÐ¼Ð°Ñ” Ñ†Ðµ Ð²Ð°Ð¶Ð»Ð¸Ð²Ð¸Ð¼.\n\n12. I think so too.\n- [x] Ð¯ Ñ‚ÐµÐ¶ Ñ‚Ð°Ðº Ð´ÑƒÐ¼Ð°ÑŽ.\n- [ ] Ð¯ Ñ‚ÐµÐ¶ Ñ‚Ð°Ðº Ð±Ð°Ñ‡Ñƒ."
      },
      {
        "id": "section-3",
        "name": "Vocabulary",
        "nameEn": null,
        "type": "vocabulary",
        "content": "| Word | IPA | English | POS | Gender | Note |\n|------|-----|---------|-----|--------|------|\n| Ð²Ð²Ð°Ð¶Ð°Ñ‚Ð¸ | /Ê‹Ê‹É‘ËˆÊ’É‘tÉª/ | to consider, believe | verb | â€” | formal |\n| Ð³Ð°Ð´Ð°Ñ‚Ð¸ | /É¦É‘ËˆdÉ‘tÉª/ | to guess, think | verb | â€” | poetic |\n| Ð·Ð´Ð°Ñ”Ñ‚ÑŒÑÑ | /ËˆzdÉ‘jÉ›tÍ¡sÊ²É‘/ | it seems | verb | â€” | 3rd sg |\n| Ð½Ð° Ð¼Ð¾ÑŽ Ð´ÑƒÐ¼ÐºÑƒ | /nÉ‘ ËˆmÉ”ju Ëˆdumku/ | in my opinion | phrase | â€” | opener |\n| Ð½Ð° Ð¼Ñ–Ð¹ Ð¿Ð¾Ð³Ð»ÑÐ´ | /nÉ‘ mij ËˆpÉ”É¦lÊ²É‘d/ | from my view | phrase | â€” | opener |\n| Ð· Ð¼Ð¾Ñ”Ñ— Ñ‚Ð¾Ñ‡ÐºÐ¸ Ð·Ð¾Ñ€Ñƒ | /z mÉ”ËˆjÉ›ji ËˆtÉ”tÍ¡ÊƒkÉª ËˆzÉ”ru/ | from my point of view | phrase | â€” | analytic |\n| Ð·Ð³Ð¾Ð´ÐµÐ½ | /ËˆzÉ¦É”dÉ›n/ | agree (masc) | adj | masc | state |\n| Ð·Ð³Ð¾Ð´Ð½Ð° | /ËˆzÉ¦É”dnÉ‘/ | agree (fem) | adj | fem | state |\n| Ð½Ðµ Ð·Ð³Ð¾Ð´ÐµÐ½ | /nÉ› ËˆzÉ¦É”dÉ›n/ | disagree (masc) | adj | masc | state |\n| Ð¿Ð¾Ð³Ð¾Ð´Ð¶ÑƒÐ²Ð°Ñ‚Ð¸ÑÑ | /pÉ”ËˆÉ¦É”dÊ’uÊ‹É‘tÉªsÊ²É‘/ | to agree | verb | â€” | process |\n| Ð½Ðµ Ð¿Ð¾Ð³Ð¾Ð´Ð¶ÑƒÐ²Ð°Ñ‚Ð¸ÑÑ | /nÉ› pÉ”ËˆÉ¦É”dÊ’uÊ‹É‘tÉªsÊ²É‘/ | to disagree | verb | â€” | process |\n| Ð¿Ñ€Ð°Ð²Ð´Ð° | /ËˆprÉ‘uÌ¯dÉ‘/ | truth | noun | fem | fact |\n| Ð½ÐµÐ¿Ñ€Ð°Ð²Ð´Ð° | /nÉ›ËˆprÉ‘uÌ¯dÉ‘/ | lie, untruth | noun | fem | fact |\n| Ð½Ðµ Ñ‚Ð°Ðº | /nÉ› tÉ‘k/ | not so | phrase | â€” | negative |\n| Ð±ÐµÐ·ÑƒÐ¼Ð¾Ð²Ð½Ð¾ | /bÉ›zuËˆmÉ”uÌ¯nÉ”/ | absolutely | adv | â€” | strong |\n| Ð¾Ñ‡ÐµÐ²Ð¸Ð´Ð½Ð¾ | /É”tÍ¡ÊƒÉ›ËˆÊ‹ÉªdnÉ”/ | obviously | adv | â€” | modal |\n| Ð½Ð°Ð²Ñ€ÑÐ´ Ñ‡Ð¸ | /nÉ‘uÌ¯ËˆrÊ²É‘d tÍ¡ÊƒÉª/ | hardly, doubtfully | part | â€” | doubt |\n| Ð¿Ð¾Ð¼Ð¸Ð»ÑÑ‚Ð¸ÑÑ | /pÉ”mÉªËˆlÊ²É‘tÉªsÊ²É‘/ | to be mistaken | verb | â€” | error |\n| Ð¿Ñ€Ð°Ð²Ð¸Ð¹ | /ËˆprÉ‘Ê‹Éªj/ | right, correct | adj | masc | state |\n| Ñ€Ð°Ñ†Ñ–Ñ | /ËˆrÉ‘tÍ¡sÊ²ijÉ‘/ | rightness (have reason) | noun | fem | idiom |\n| Ð¿Ð¾Ð³Ð¾Ð´Ð¸Ñ‚Ð¸ÑÑ | /pÉ”ËˆÉ¦É”dÉªtÉªsÊ²É‘/ | to agree | verb | â€” | perfective |\n| ÑÑƒÐ¿ÐµÑ€ÐµÑ‡ÐºÐ° | /supÉ›ËˆrÉ›tÍ¡ÊƒkÉ‘/ | argument, dispute | noun | fem | social |\n| Ñ†Ñ–Ð»ÐºÐ¾Ð¼ | /tÍ¡sÑ–lËˆkÉ”m/ | completely | adv | â€” | degree |\n| Ð¾Ð±Ð³Ð¾Ð²Ð¾Ñ€ÑŽÐ²Ð°Ñ‚Ð¸ | /É”bÉ¦É”ËˆÊ‹É”rÊ²uÊ‹É‘tÉª/ | to discuss | verb | â€” | activity |\n| Ð¿Ð¾Ð·Ð¸Ñ†Ñ–Ñ | /pÉ”ËˆzÉªtÍ¡sÊ²ijÉ‘/ | position, stance | noun | fem | formal |\n| Ð°Ñ€Ð³ÑƒÐ¼ÐµÐ½Ñ‚ | /É‘rÉ¦uËˆmÉ›nt/ | argument | noun | masc | formal |\n| Ð²Ð»Ð°ÑÐ½Ðµ | /ËˆÊ‹lÉ‘snÉ›/ | actually, properly | adv | â€” | filler |"
      }
    ],
    "rawMarkdown": "---\nmodule: a2-28\ntitle: I Think That...\nsubtitle: \"Expressing Opinions and Beliefs\"\nversion: \"1.0\"\nphase: \"A2.3\"\npedagogy: \"Communicative\"\nduration: \"60 min\"\ntransliteration: none\ntags:\n  - opinions\n  - thoughts\n  - agreement\ngrammar:\n  - opinion verbs\n  - that-clauses\n  - agreement forms\nobjectives:\n  - \"Learner can express simple opinions\"\n  - \"Learner can agree and disagree politely\"\n  - \"Learner understands the contrast between Ð´ÑƒÐ¼Ð°Ñ‚Ð¸ and Ð²Ð²Ð°Ð¶Ð°Ñ‚Ð¸\"\nvocabulary_count: 25\n---\n\n# Summary\n\n## Warm-up\n\nWhat do you think about Ukrainian music? How do you feel about the weather today?\nExpressing opinions is the bridge between basic communication and real conversation. In this lesson, we move beyond just facts and start sharing our thoughts. We will learn how to agree, disagree, and open up our point of view to others in a respectful and culturally appropriate way.\n\n**In this module, we will explore:**\n- **I think that:** Ð¯ Ð´ÑƒÐ¼Ð°ÑŽ, Ñ‰Ð¾...\n- **I believe/consider:** Ð¯ Ð²Ð²Ð°Ð¶Ð°ÑŽ, Ñ‰Ð¾...\n- **In my opinion:** ÐÐ° Ð¼Ð¾ÑŽ Ð´ÑƒÐ¼ÐºÑƒ...\n- **From my point of view:** Ð— Ð¼Ð¾Ñ”Ñ— Ñ‚Ð¾Ñ‡ÐºÐ¸ Ð·Ð¾Ñ€Ñƒ...\n- **Agreement:** Ð¯ Ð·Ð³Ð¾Ð´ÐµÐ½ / Ð¯ Ð·Ð³Ð¾Ð´Ð½Ð°.\n- **Disagreement:** Ð¯ Ð½Ðµ Ð·Ð³Ð¾Ð´ÐµÐ½ / Ð¯ Ð½Ðµ Ð·Ð³Ð¾Ð´Ð½Ð°.\n\n> ðŸ’¡ **Cognitive Tip**\n> When you express an opinion in Ukrainian, you are often using the same **Ñ‰Ð¾** (that) connector we learned in the past. The logic is identical: you are reporting a thought or belief instead of a direct statement. This helps simplify the sentence structure because you don't need to learn a new grammar rule for every verb of thought.\n\n---\n\n## Presentation\n\n## 1. Expressing Your View\n\nThe most common way to start an opinion is with \"I think\". Depending on how formal or certain you are, you can choose different openers.\n\n| Ukrainian | Meaning | Usage |\n|-----------|---------|-------|\n| **Ð¯ Ð´ÑƒÐ¼Ð°ÑŽ, Ñ‰Ð¾...** | I think that... | General, everyday opinion |\n| **Ð¯ Ð²Ð²Ð°Ð¶Ð°ÑŽ, Ñ‰Ð¾...** | I consider/believe that... | More formal, serious, or argued |\n| **Ð¯ Ð³Ð°Ð´Ð°ÑŽ, Ñ‰Ð¾...** | I guess/think that... | Common in literature and songs |\n| **ÐÐ° Ð¼Ð¾ÑŽ Ð´ÑƒÐ¼ÐºÑƒ, ...** | In my opinion... | Classic opener for any setting |\n| **ÐÐ° Ð¼Ñ–Ð¹ Ð¿Ð¾Ð³Ð»ÑÐ´, ...** | From my point of view... | Focuses on your visual or ethical perspective |\n| **Ð— Ð¼Ð¾Ñ”Ñ— Ñ‚Ð¾Ñ‡ÐºÐ¸ Ð·Ð¾Ñ€Ñƒ, ...** | From my point of view... | Analytic and formal perspective |\n| **ÐœÐµÐ½Ñ– Ð·Ð´Ð°Ñ”Ñ‚ÑŒÑÑ, Ñ‰Ð¾...** | It seems to me that... | Softer, less categorical |\n\n### Examples:\n- **Ð¯ Ð´ÑƒÐ¼Ð°ÑŽ, Ñ‰Ð¾** ÑƒÐºÑ€Ð°Ñ—Ð½ÑÑŒÐºÐ° Ð¼Ð¾Ð²Ð° Ð´ÑƒÐ¶Ðµ Ð¼Ð¸Ð»Ð¾Ð·Ð²ÑƒÑ‡Ð½Ð°. (I think that Ukrainian is very melodic.)\n- **ÐÐ° Ð¼Ð¾ÑŽ Ð´ÑƒÐ¼ÐºÑƒ,** Ñ†Ðµ Ð¼Ñ–ÑÑ‚Ð¾ Ð½Ð°Ð¹ÐºÑ€Ð°Ñ‰Ðµ Ñƒ ÑÐ²Ñ–Ñ‚Ñ–. (In my opinion, this city is the best in the world.)\n- **Ð— Ð¼Ð¾Ñ”Ñ— Ñ‚Ð¾Ñ‡ÐºÐ¸ Ð·Ð¾Ñ€Ñƒ,** Ð¿Ñ€Ð¾ÐµÐºÑ‚ Ð¼Ð°Ñ” Ð²ÐµÐ»Ð¸ÐºÐ¸Ð¹ Ð¿Ð¾Ñ‚ÐµÐ½Ñ†Ñ–Ð°Ð». (From my point of view, the project has great potential.)\n\n> [!important] Grammar Note: Case with \"ÐÐ° Ð´ÑƒÐ¼ÐºÑƒ\"\n> The phrase **ÐÐ° Ð´ÑƒÐ¼ÐºÑƒ** requires the **Genitive** case for the possessor because \"opinion\" belongs to someone.\n> - ÐÐ° **Ð¼Ð¾ÑŽ** Ð´ÑƒÐ¼ÐºÑƒ (In my opinion)\n> - ÐÐ° Ð´ÑƒÐ¼ÐºÑƒ **Ð»Ñ–ÐºÐ°Ñ€Ñ** (In the doctor's opinion)\n> - ÐÐ° Ð´ÑƒÐ¼ÐºÑƒ **ÐµÐºÑÐ¿ÐµÑ€Ñ‚Ñ–Ð²** (In the experts' opinion)\n\n## 2. Agreement and Support\n\nWhen someone shares a view, you can support it or add to it. Being able to confirm someone else's idea is a key social skill in Ukraine.\n\n- **Ð¯ Ð·Ð³Ð¾Ð´ÐµÐ½.** (I agree - masculine)\n- **Ð¯ Ð·Ð³Ð¾Ð´Ð½Ð°.** (I agree - feminine)\n- **Ð¯ Ð¿Ð¾Ð³Ð¾Ð´Ð¶ÑƒÑŽÑÑ.** (I agree / I am agreeing - universal verb)\n- **Ð‘ÐµÐ·ÑƒÐ¼Ð¾Ð²Ð½Ð¾!** (Absolutely! / Undeniably!)\n- **ÐžÑ‡ÐµÐ²Ð¸Ð´Ð½Ð¾!** (Obviously!)\n- **Ð¦Ðµ Ð¿Ñ€Ð°Ð²Ð´Ð°.** (That is true.)\n- **Ð’Ð¸ Ð°Ð±ÑÐ¾Ð»ÑŽÑ‚Ð½Ð¾ Ð¿Ñ€Ð°Ð²Ñ–.** (You are absolutely right.)\n- **Ð¦Ðµ Ñ‚Ð¾Ñ‡Ð½Ð¾!** (That's for sure!)\n- **Ð¯ Ñ‚ÐµÐ¶ Ñ‚Ð°Ðº Ð´ÑƒÐ¼Ð°ÑŽ.** (I think so too.)\n\n## 3. Disagreement and Doubt\n\nUkrainians can be very direct when they disagree, but it's often more polite to soften it. Using \"I'm not sure\" is often better than \"You are wrong.\"\n\n- **Ð¯ Ð½Ðµ Ð·Ð³Ð¾Ð´ÐµÐ½.** (I don't agree - masculine)\n- **Ð¯ Ð½Ðµ Ð¿Ð¾Ð³Ð¾Ð´Ð¶ÑƒÑŽÑÑ.** (I don't agree / I disagree.)\n- **Ð¦Ðµ Ð½Ðµ Ñ‚Ð°Ðº.** (That's not so / That's not how it is.)\n- **Ð¦Ðµ Ð½ÐµÐ¿Ñ€Ð°Ð²Ð´Ð°.** (That's not true.)\n- **ÐœÐµÐ½Ñ– Ð²Ð°Ð¶ÐºÐ¾ ÑÐºÐ°Ð·Ð°Ñ‚Ð¸.** (It's hard for me to say / I'm not sure.)\n- **ÐÐ°Ð²Ñ€ÑÐ´ Ñ‡Ð¸.** (Hardly / I doubt it.)\n- **Ð¯ Ñ‚Ð°Ðº Ð½Ðµ Ð´ÑƒÐ¼Ð°ÑŽ.** (I don't think so.)\n- **Ð’Ð¸ Ð¿Ð¾Ð¼Ð¸Ð»ÑÑ”Ñ‚ÐµÑÑ.** (You are mistaken.)\n\n### The Art of Politeness\n\nIn Ukrainian culture, being \"honest\" is highly valued, but so is maintaining a good relationship. If you disagree, try to start with a \"softener\" before delivering your point. Phrases like **\"ÐœÐ¾Ð¶Ð»Ð¸Ð²Ð¾, Ð²Ð¸ Ð¼Ð°Ñ”Ñ‚Ðµ Ñ€Ð°Ñ†Ñ–ÑŽ, Ð°Ð»Ðµ...\"** (Maybe you are right, but...) or **\"Ð¯ Ñ€Ð¾Ð·ÑƒÐ¼Ñ–ÑŽ Ð²Ð°Ñˆ Ð¿Ð¾Ð³Ð»ÑÐ´, Ð¿Ñ€Ð¾Ñ‚Ðµ...\"** (I understand your view, however...) are perfect for this. These structures allow you to show that you are listening and respecting the other person's intellect, even if you ultimately reach a different conclusion. This balance between directness and hospitality is a hallmark of Ukrainian intellectual life.\n\n---\n\n## Theoretical Deep Dive: Choosing Your Verb\n\nWhile \"Ð´ÑƒÐ¼Ð°Ñ‚Ð¸\" is the most common verb of thought, Ukrainian distinguishes between the act of thinking (thinking process) and holding a firm belief (conviction).\n\n- **Ð”ÑƒÐ¼Ð°Ñ‚Ð¸** is a process. *Ð¯ Ð´ÑƒÐ¼Ð°ÑŽ Ð¿Ñ€Ð¾ Ñ‚ÐµÐ±Ðµ.* (I am thinking of you.)\n- **Ð’Ð²Ð°Ð¶Ð°Ñ‚Ð¸** is a result. *Ð’Ñ–Ð½ Ð²Ð²Ð°Ð¶Ð°Ñ” Ñ†Ðµ Ð¿Ð¾Ð¼Ð¸Ð»ÐºÐ¾ÑŽ.* (He considers this a mistake.)\n\nWhen you share an opinion, you can use both, but \"Ð²Ð²Ð°Ð¶Ð°Ñ‚Ð¸\" sounds more authoritative. If you are debating a topic in a business or academic setting, \"Ð²Ð²Ð°Ð¶Ð°Ñ‚Ð¸\" or \"Ð· Ð¼Ð¾Ñ”Ñ— Ñ‚Ð¾Ñ‡ÐºÐ¸ Ð·Ð¾Ñ€Ñƒ\" will make you sound more professional and prepared. On the other hand, in a casual conversation with a friend at a cafe, \"Ñ Ð´ÑƒÐ¼Ð°ÑŽ\" or \"Ð¼ÐµÐ½Ñ– Ð·Ð´Ð°Ñ”Ñ‚ÑŒÑÑ\" is more natural and friendly. This nuance is part of the \"intellectual hospitality\" that characterizes Ukrainian social life.\n\n---\n\n## The Philosophy of the Kitchen\n\nIn Ukraine, the kitchen is more than just a place to cook; it is the center of intellectual life. This phenomenon, often called \"Kitchen Philosophy\" (ÐºÑƒÑ…Ð¾Ð½Ð½Ð° Ñ„Ñ–Ð»Ð¾ÑÐ¾Ñ„Ñ–Ñ), dates back to the Soviet era when the kitchen was the only safe space to discuss forbidden ideas, politics, and literature. Even today, despite the abundance of modern cafes and open public spaces, the most profound and honest discussions often happen around a small kitchen table. This unique cultural setting creates an atmosphere of intimacy and trust that is rarely found in more formal environments.\n\nWhen you learn to say \"Ð¯ Ð´ÑƒÐ¼Ð°ÑŽ, Ñ‰Ð¾...\" or \"ÐœÐ¾Ð¶Ð»Ð¸Ð²Ð¾, Ð²Ð¸ Ð¿Ñ€Ð°Ð²Ñ–...\", you are not just learning grammar; you are learning the tools of this intellectual hospitality. Ukrainians appreciate when someone can sit for hours debating the future of democracy, the nuances of some historical event, or the best way to make borscht. Being able to articulate your point of view (Ñ‚Ð¾Ñ‡ÐºÐ° Ð·Ð¾Ñ€Ñƒ) and respect the points of others is considered a mark of a well-educated person in the Ukrainian social fabric. This cultural nuance of sharing thoughts and beliefs is a vital part of building deep, lasting trust between people.\n\n---\n\n> [!cultural] Intellectual Hospitality\n> Ukrainians value deep discussions, often late into the night. Discussing politics, history, or philosophy over tea is a national pastime. Don't be afraid to express a strong opinion; it's often seen as a sign of respect and engagement. If you are invited to a kitchen talk, be prepared to explain *why* you think what you think!\n\n> [!cultural] History Bite: The Tradition of Debate\n> Ukraine has a long history of intellectual debate. The Kyiv-Mohyla Academy, founded in the 17th century, was a center of philosophical thought where students were taught to argue and defend their positions in Latin and Ukrainian. This tradition of \"free speech\" and \"critical thinking\" survived even through times of intense censorship. Today, this manifest in the way Ukrainians participate in civil societyâ€”always ready to discuss, disagree, and ultimately find a common path for the country.\n\n> [!important] The \"Maybe\" Buffer\n> If you want to sound less categorical and more open to discussion, start your sentence with **\"ÐœÐ¾Ð¶Ð»Ð¸Ð²Ð¾...\"** (Maybe) or **\"ÐÐ°Ð¿ÐµÐ²Ð½Ð¾...\"** (Probably).\n> *ÐœÐ¾Ð¶Ð»Ð¸Ð²Ð¾, Ð²Ð¸ Ð¼Ð°Ñ”Ñ‚Ðµ Ñ€Ð°Ñ†Ñ–ÑŽ, Ð°Ð»Ðµ Ñ Ð½Ðµ Ð·Ð¾Ð²ÑÑ–Ð¼ Ð¿ÐµÐ²Ð½Ð¸Ð¹ Ñƒ Ñ†Ð¸Ñ„Ñ€Ð°Ñ….* (Maybe you are right, but I'm not entirely certain about the numbers.)\n\n---\n\n## Language in Action\n\n## Dialogue: The Best Coffee\n\nTwo friends, Petro and Maksym, are debating where to find the best atmosphere.\n\n**Petro:** Ð¡Ð»ÑƒÑ…Ð°Ð¹, ÐœÐ°ÐºÑÐ¸Ð¼Ðµ, Ñ Ð´ÑƒÐ¼Ð°ÑŽ, Ñ‰Ð¾ Ð½Ð°Ð¹ÐºÑ€Ð°Ñ‰Ð° ÐºÐ°Ð²Ð° Ð²ÑÐµ-Ñ‚Ð°ÐºÐ¸ Ñƒ Ð›ÑŒÐ²Ð¾Ð²Ñ–.\n**Maksym:** Ð¯ Ñ†Ñ–Ð»ÐºÐ¾Ð¼ Ð·Ð³Ð¾Ð´ÐµÐ½ Ð· Ñ‚Ð¾Ð±Ð¾ÑŽ! Ð¢Ð°Ð¼ Ð¾ÑÐ¾Ð±Ð»Ð¸Ð²Ð° Ð°Ñ‚Ð¼Ð¾ÑÑ„ÐµÑ€Ð° Ñ– ÑÑ‚Ð°Ñ€Ð° Ð°Ñ€Ñ…Ñ–Ñ‚ÐµÐºÑ‚ÑƒÑ€Ð°.\n**Petro:** Ð Ð½Ð° Ð¼Ð¾ÑŽ Ð´ÑƒÐ¼ÐºÑƒ, Ñ†Ñ–Ð½Ð° Ð½Ð° ÐºÐ°Ð²Ñƒ Ð² Ñ†ÐµÐ½Ñ‚Ñ€Ñ– Ð·Ð°Ñ€Ð°Ð· ÑÑ‚Ð°Ð»Ð° Ð·Ð°Ð½Ð°Ð´Ñ‚Ð¾ Ð²Ð¸ÑÐ¾ÐºÐ¾ÑŽ.\n**Maksym:** ÐÐ°Ð²Ñ€ÑÐ´ Ñ‡Ð¸ Ð²Ð¾Ð½Ð° Ð²Ð¸Ñ‰Ð°, Ð½Ñ–Ð¶ Ñƒ ÐšÐ¸Ñ”Ð²Ñ– Ñ‡Ð¸ Ð’Ð°Ñ€ÑˆÐ°Ð²Ñ–. Ð¦Ðµ Ð¶ Ñ‚ÑƒÑ€Ð¸ÑÑ‚Ð¸Ñ‡Ð½Ðµ Ð¼Ñ–ÑÑ‚Ð¾.\n**Petro:** ÐœÐ¾Ð¶Ð»Ð¸Ð²Ð¾, Ð°Ð»Ðµ Ñ Ð²Ð²Ð°Ð¶Ð°ÑŽ, Ñ‰Ð¾ Ñ‚Ñ€ÐµÐ±Ð° ÑˆÑƒÐºÐ°Ñ‚Ð¸ Ð¼Ð°Ð»ÐµÐ½ÑŒÐºÑ– ÐºÐ°Ð²â€™ÑÑ€Ð½Ñ– Ð±ÐµÐ· Ñ€ÐµÐºÐ»Ð°Ð¼Ð¸.\n**Maksym:** Ð¦Ðµ Ñ‚Ð¾Ñ‡Ð½Ð¾! Ð¢Ð°Ð¼ Ð·Ð°Ð²Ð¶Ð´Ð¸ ÑÐ¼Ð°Ñ‡Ð½Ñ–ÑˆÐµ, Ð´ÐµÑˆÐµÐ²ÑˆÐµ Ñ– Ð·Ð°Ñ‚Ð¸ÑˆÐ½Ñ–ÑˆÐµ.\n**Petro:** Ð— Ð¼Ð¾Ñ”Ñ— Ñ‚Ð¾Ñ‡ÐºÐ¸ Ð·Ð¾Ñ€Ñƒ, ÑÐ°Ð¼Ðµ Ñ‚Ð°ÐºÑ– Ð¼Ñ–ÑÑ†Ñ Ð·Ð±ÐµÑ€Ñ–Ð³Ð°ÑŽÑ‚ÑŒ ÑÐ¿Ñ€Ð°Ð²Ð¶Ð½Ñ–Ð¹ Ð´ÑƒÑ… Ð¼Ñ–ÑÑ‚Ð°.\n**Maksym:** Ð‘ÐµÐ·ÑƒÐ¼Ð¾Ð²Ð½Ð¾. Ð”Ð°Ð²Ð°Ð¹Ñ‚Ðµ Ð¿Ñ–Ð´ÐµÐ¼Ð¾ Ð² Ñ‚Ñƒ Ð½Ð¾Ð²Ñƒ ÐºÐ°Ð²â€™ÑÑ€Ð½ÑŽ Ð·Ð°Ð²Ñ‚Ñ€Ð°?\n\n## Dialogue: The Plan\n\nTwo colleagues, Olena and Ihor, are discussing a future trip.\n\n**Olena:** Ð†Ð³Ð¾Ñ€Ðµ, Ñ‚Ð¸ Ð²Ð¶Ðµ Ð´ÑƒÐ¼Ð°Ð² Ð¿Ñ€Ð¾ Ð½Ð°ÑˆÑƒ Ð²Ñ–Ð´Ð¿ÑƒÑÑ‚ÐºÑƒ Ð² ÐšÐ°Ñ€Ð¿Ð°Ñ‚Ð°Ñ…?\n**Ihor:** Ð¢Ð°Ðº, Ñ Ð²Ð²Ð°Ð¶Ð°ÑŽ, Ñ‰Ð¾ Ð½Ð°Ð¼ Ñ‚Ñ€ÐµÐ±Ð° Ð¿Ð¾Ñ—Ñ…Ð°Ñ‚Ð¸ Ð² Ñ‡ÐµÑ€Ð²Ð½Ñ–.\n**Olena:** ÐÐ° Ð¼Ð¾ÑŽ Ð´ÑƒÐ¼ÐºÑƒ, Ñƒ Ñ‡ÐµÑ€Ð²Ð½Ñ– Ñ‚Ð°Ð¼ Ð·Ð°Ð½Ð°Ð´Ñ‚Ð¾ Ñ‡Ð°ÑÑ‚Ð¾ Ð¹Ð´ÑƒÑ‚ÑŒ Ð´Ð¾Ñ‰Ñ–.\n**Ihor:** ÐÐ°Ð²Ñ€ÑÐ´ Ñ‡Ð¸. ÐœÐ¸Ð½ÑƒÐ»Ð¾Ð³Ð¾ Ñ€Ð¾ÐºÑƒ Ð¿Ð¾Ð³Ð¾Ð´Ð° Ð±ÑƒÐ»Ð° Ñ‡ÑƒÐ´Ð¾Ð²Ð°.\n**Olena:** Ð¯ Ð½Ðµ Ð¿Ð¾Ð³Ð¾Ð´Ð¶ÑƒÑŽÑÑ. Ð¯ Ð±Ð°Ñ‡Ð¸Ð»Ð° Ð¿Ñ€Ð¾Ð³Ð½Ð¾Ð·, Ñ– Ð²Ñ–Ð½ Ð½Ðµ Ð´ÑƒÐ¶Ðµ Ð´Ð¾Ð±Ñ€Ð¸Ð¹.\n**Ihor:** ÐœÐ¾Ð¶Ð»Ð¸Ð²Ð¾, Ð²Ð¸ Ð¿Ñ€Ð°Ð²Ñ–. ÐÐ»Ðµ Ñ Ð³Ð°Ð´Ð°ÑŽ, Ñ‰Ð¾ Ñ€Ð¸Ð·Ð¸ÐºÐ½ÑƒÑ‚Ð¸ Ð²Ð°Ñ€Ñ‚Ð¾.\n**Olena:** Ð¯ Ð½Ðµ Ð·Ð¾Ð²ÑÑ–Ð¼ Ð·Ð³Ð¾Ð´Ð½Ð°. Ð”Ð°Ð²Ð°Ð¹Ñ‚Ðµ ÐºÑ€Ð°Ñ‰Ðµ Ð¿Ð¾Ñ—Ð´ÐµÐ¼Ð¾ Ð² Ð†Ð²Ð°Ð½Ð¾-Ð¤Ñ€Ð°Ð½ÐºÑ–Ð²ÑÑŒÐº.\n**Ihor:** Ð¦Ðµ Ñ†Ñ–ÐºÐ°Ð²Ð¸Ð¹ Ð¿Ð¾Ð³Ð»ÑÐ´. Ð— Ð¼Ð¾Ñ”Ñ— Ñ‚Ð¾Ñ‡ÐºÐ¸ Ð·Ð¾Ñ€Ñƒ, Ñ†Ðµ Ð³Ð°Ñ€Ð½Ð° Ð°Ð»ÑŒÑ‚ÐµÑ€Ð½Ð°Ñ‚Ð¸Ð²Ð°.\n**Olena:** ÐžÑ‡ÐµÐ²Ð¸Ð´Ð½Ð¾, Ñ‰Ð¾ Ñ‚Ð°Ð¼ Ð±Ñ–Ð»ÑŒÑˆÐµ Ð¼ÑƒÐ·ÐµÑ—Ð² Ñ– ÐºÐ°Ð²'ÑÑ€ÐµÐ½ÑŒ Ð½Ð° Ð²Ð¸Ð¿Ð°Ð´Ð¾Ðº Ð´Ð¾Ñ‰Ñƒ.\n**Ihor:** Ð¦Ðµ Ñ‚Ð¾Ñ‡Ð½Ð¾! Ð¯ Ñ‚ÐµÐ¶ Ñ‚Ð°Ðº Ð´ÑƒÐ¼Ð°ÑŽ Ñ‚ÐµÐ¿ÐµÑ€. Ð’Ð¸ Ð¿ÐµÑ€ÐµÐºÐ¾Ð½Ð°Ð»Ð¸ Ð¼ÐµÐ½Ðµ.\n\n### Analysis of the Conversation\n1.  **Ð¯ Ð´ÑƒÐ¼Ð°ÑŽ, Ñ‰Ð¾...**: The most humble way to start a debate.\n2.  **Ð¯ Ñ†Ñ–Ð»ÐºÐ¾Ð¼ Ð·Ð³Ð¾Ð´ÐµÐ½**: \"I completely agree\" (adds emphasis).\n3.  **ÐÐ° Ð¼Ð¾ÑŽ Ð´ÑƒÐ¼ÐºÑƒ**: A parenthetical phrases that shifts the focus back to the speaker.\n4.  **ÐÐ°Ð²Ñ€ÑÐ´ Ñ‡Ð¸**: A gentle way to say \"I don't think so\" without being aggressive.\n5.  **Ð— Ð¼Ð¾Ñ”Ñ— Ñ‚Ð¾Ñ‡ÐºÐ¸ Ð·Ð¾Ñ€Ñƒ**: A more professional or structured way to summarize a position.\n\n---\n\n> [!important] Myth: \"Everyone thinks the same\"\n> **Myth:** Ukrainian culture is monolithic and everyone agrees on history and politics because of the war.\n> **Reality:** Ukraine is a vibrant democracy with a huge diversity of opinions. Debating historical memory and future direction is a core part of the modern Ukrainian identity. We value the right to disagree and discuss diverse perspectives openly.\n\n---\n\n> [!resources] ðŸ”— External Resources\n> - **YouTube:** [How to express your opinion in Ukrainian](https://www.youtube.com/results?search_query=express+opinion+ukrainian) â€” Various teachers\n> - **Article:** [Ukrainian Conversation Starters](https://www.ukrainianlessons.com/conversation/) â€” Ukrainian Lessons\n> - **Flashcards:** [Quizlet: Ukrainian Opinions](https://quizlet.com/) â€” Practice the vocabulary\n\n# Activities\n\n## match-up: Opinion Expressions (Concept: Semantic Pairing)\nMatch the Ukrainian expression to its English equivalent.\n\n- Ð¯ Ð´ÑƒÐ¼Ð°ÑŽ, Ñ‰Ð¾ :: I think that\n- Ð¯ Ð²Ð²Ð°Ð¶Ð°ÑŽ, Ñ‰Ð¾ :: I consider that\n- ÐÐ° Ð¼Ð¾ÑŽ Ð´ÑƒÐ¼ÐºÑƒ :: In my opinion\n- ÐÐ° Ð¼Ñ–Ð¹ Ð¿Ð¾Ð³Ð»ÑÐ´ :: From my view\n- Ð¯ Ð·Ð³Ð¾Ð´ÐµÐ½ :: I agree\n- Ð’Ð¸ Ð¿Ñ€Ð°Ð²Ñ– :: You are right\n- ÐÐ°Ð²Ñ€ÑÐ´ Ñ‡Ð¸ :: Hardly / I doubt it\n- Ð¯ Ð½Ðµ Ð²Ð¿ÐµÐ²Ð½ÐµÐ½Ð¸Ð¹ :: I am not sure\n\n## fill-in: Express Opinions (Concept: Contextual Usage)\nComplete the sentences with the correct opinion markers.\n\n1. Ð¯ [___:1], Ñ‰Ð¾ Ñ†Ðµ Ð¼Ñ–ÑÑ‚Ð¾ Ð´ÑƒÐ¶Ðµ ÐºÑ€Ð°ÑÐ¸Ð²Ðµ. (think)\n   > [!answer] Ð´ÑƒÐ¼Ð°ÑŽ\n   > [!options] Ð´ÑƒÐ¼Ð°ÑŽ | Ð±Ð°Ñ‡Ñƒ | ÑÐ¿Ð»ÑŽ | Ñ—Ð¼\n\n2. ÐÐ° [___:2] Ð´ÑƒÐ¼ÐºÑƒ, ÐºÐ²Ð¸Ñ‚ÐºÐ¸ Ð·Ð°Ð½Ð°Ð´Ñ‚Ð¾ Ð´Ð¾Ñ€Ð¾Ð³Ñ–. (my)\n   > [!answer] Ð¼Ð¾ÑŽ\n   > [!options] Ð¼Ð¾ÑŽ | Ð¼Ñ–Ð¹ | Ð¼Ð¾Ñ” | Ð¼Ð¾Ñ—\n\n3. ÐœÐµÐ½Ñ– [___:3], Ñ‰Ð¾ ÑÑŒÐ¾Ð³Ð¾Ð´Ð½Ñ– Ð±ÑƒÐ´Ðµ Ð´Ð¾Ñ‰. (seems)\n   > [!answer] Ð·Ð´Ð°Ñ”Ñ‚ÑŒÑÑ\n   > [!options] Ð·Ð´Ð°Ñ”Ñ‚ÑŒÑÑ | Ð¿Ð¾Ð´Ð¾Ð±Ð°Ñ”Ñ‚ÑŒÑÑ | Ñ…Ð¾Ñ‡ÐµÑ‚ÑŒÑÑ | Ð¿Ð¸ÑˆÐµÑ‚ÑŒÑÑ\n\n4. Ð¯ Ñ†Ñ–Ð»ÐºÐ¾Ð¼ [___:4] Ð· Ð²Ð°ÑˆÐ¾ÑŽ Ð¿Ñ€Ð¾Ð¿Ð¾Ð·Ð¸Ñ†Ñ–Ñ”ÑŽ. (agree - masc)\n   > [!answer] Ð·Ð³Ð¾Ð´ÐµÐ½\n   > [!options] Ð·Ð³Ð¾Ð´ÐµÐ½ | Ð·Ð³Ð¾Ð´Ð½Ð° | Ð·Ð³Ð¾Ð´Ð½Ñ– | Ð·Ð³Ð¾Ð´Ð½Ðµ\n\n5. Ð’Ð¸ [___:5], Ñ†Ðµ Ñ€Ñ–ÑˆÐµÐ½Ð½Ñ Ð½Ð°Ð¹ÐºÑ€Ð°Ñ‰Ðµ. (right)\n   > [!answer] Ð¿Ñ€Ð°Ð²Ñ–\n   > [!options] Ð¿Ñ€Ð°Ð²Ñ– | Ð»Ñ–Ð²Ñ– | ÑÑ‚Ð°Ñ€Ñ– | Ð¼Ð°Ð»Ñ–\n\n6. [___:6] Ñ‡Ð¸ Ð¼Ð¸ Ð²ÑÑ‚Ð¸Ð³Ð½ÐµÐ¼Ð¾ Ð½Ð° Ð¿Ð¾Ñ—Ð·Ð´. (hardly)\n   > [!answer] ÐÐ°Ð²Ñ€ÑÐ´\n   > [!options] ÐÐ°Ð²Ñ€ÑÐ´ | ÐœÐ°Ð¹Ð¶Ðµ | Ð—Ð¾Ð²ÑÑ–Ð¼ | Ð”ÑƒÐ¶Ðµ\n\n7. Ð¯ Ð²Ð²Ð°Ð¶Ð°ÑŽ, [___:7] Ñ‚Ñ€ÐµÐ±Ð° Ð±Ñ–Ð»ÑŒÑˆÐµ Ð¿Ñ€Ð°Ñ†ÑŽÐ²Ð°Ñ‚Ð¸. (that)\n   > [!answer] Ñ‰Ð¾\n   > [!options] Ñ‰Ð¾ | Ñ‡Ð¸ | ÑÐº | Ð´Ðµ\n\n8. Ð¯ Ð½Ðµ [___:8], Ñ‰Ð¾ Ñ†Ðµ Ð¿Ñ€Ð°Ð²Ð¸Ð»ÑŒÐ½Ð° Ð²Ñ–Ð´Ð¿Ð¾Ð²Ñ–Ð´ÑŒ. (sure - masc)\n   > [!answer] Ð²Ð¿ÐµÐ²Ð½ÐµÐ½Ð¸Ð¹\n   > [!options] Ð²Ð¿ÐµÐ²Ð½ÐµÐ½Ð¸Ð¹ | Ð²Ð¿ÐµÐ²Ð½ÐµÐ½Ð° | Ð²Ð¿ÐµÐ²Ð½ÐµÐ½Ñ– | Ð²Ð¿ÐµÐ²Ð½ÐµÐ½Ðµ\n\n## quiz: Understanding Opinions (Concept: Logical Deduction)\nAnswer questions about expressing thoughts in Ukrainian.\n\n1. Ð¯Ðº ÑÐ°Ð¼Ðµ Ð½Ð°Ð¹Ñ‡Ð°ÑÑ‚Ñ–ÑˆÐµ Ð¿Ð¾Ñ‡Ð¸Ð½Ð°ÑŽÑ‚ÑŒ Ð²Ð¸ÑÐ»Ð¾Ð²Ð»ÑŽÐ²Ð°Ñ‚Ð¸ ÑÐ²Ð¾ÑŽ Ð²Ð»Ð°ÑÐ½Ñƒ Ð´ÑƒÐ¼ÐºÑƒ Ð² ÑƒÐºÑ€Ð°Ñ—Ð½ÑÑŒÐºÑ–Ð¹ Ð¼Ð¾Ð²Ñ–, Ñ‰Ð¾Ð± Ñ†Ðµ Ð·Ð²ÑƒÑ‡Ð°Ð»Ð¾ Ð½ÐµÐ¹Ñ‚Ñ€Ð°Ð»ÑŒÐ½Ð¾ Ñ‚Ð° Ð·Ñ€Ð¾Ð·ÑƒÐ¼Ñ–Ð»Ð¾?\n- [x] Ð—Ð°Ð·Ð²Ð¸Ñ‡Ð°Ð¹ Ð²Ð¸ÐºÐ¾Ñ€Ð¸ÑÑ‚Ð¾Ð²ÑƒÑŽÑ‚ÑŒ Ð¿Ð¾Ð¿ÑƒÐ»ÑÑ€Ð½Ñƒ Ñ‚Ð° Ð¿Ñ€Ð¾ÑÑ‚Ñƒ Ñ„Ñ€Ð°Ð·Ñƒ \"Ð¯ Ð´ÑƒÐ¼Ð°ÑŽ, Ñ‰Ð¾...\"\n- [ ] Ð’Ð¸ÐºÐ¾Ñ€Ð¸ÑÑ‚Ð¾Ð²ÑƒÑŽÑ‚ÑŒ Ð´ÑƒÐ¶Ðµ Ð³ÑƒÑ‡Ð½Ð¸Ð¹ Ñ– Ð´Ð¾Ð²Ð³Ð¸Ð¹ ÐºÑ€Ð¸Ðº Ð½Ð° Ð¿Ð¾Ñ‡Ð°Ñ‚ÐºÑƒ ÐºÐ¾Ð¶Ð½Ð¾Ñ— Ñ€Ð¾Ð·Ð¼Ð¾Ð²Ð¸\n- [ ] Ð’Ð¸ÐºÐ¾Ñ€Ð¸ÑÑ‚Ð¾Ð²ÑƒÑŽÑ‚ÑŒ Ð»Ð¸ÑˆÐµ ÑÐºÐ»Ð°Ð´Ð½Ñ– Ð¼Ð°Ñ‚ÐµÐ¼Ð°Ñ‚Ð¸Ñ‡Ð½Ñ– Ñ„Ð¾Ñ€Ð¼ÑƒÐ»Ð¸ Ð´Ð»Ñ Ð¾Ð±Ò‘Ñ€ÑƒÐ½Ñ‚ÑƒÐ²Ð°Ð½Ð½Ñ ÑÐ»Ñ–Ð²\n- [ ] Ð’Ð¸ÐºÐ¾Ñ€Ð¸ÑÑ‚Ð¾Ð²ÑƒÑŽÑ‚ÑŒ Ð¿Ð¾Ð²Ð½Ðµ Ð¼Ð¾Ð²Ñ‡Ð°Ð½Ð½Ñ Ð¿Ñ€Ð¾Ñ‚ÑÐ³Ð¾Ð¼ Ñ‚Ñ€ÑŒÐ¾Ñ… Ñ…Ð²Ð¸Ð»Ð¸Ð½ Ð¿ÐµÑ€ÐµÐ´ ÐºÐ¾Ð¶Ð½Ð¸Ð¼ Ñ€ÐµÑ‡ÐµÐ½Ð½ÑÐ¼\n\n---\n\n2. Ð¯ÐºÐ¸Ð¹ ÑÐ°Ð¼Ðµ Ð³Ñ€Ð°Ð¼Ð°Ñ‚Ð¸Ñ‡Ð½Ð¸Ð¹ Ð²Ñ–Ð´Ð¼Ñ–Ð½Ð¾Ðº Ð¿Ð¾Ñ‚Ñ€Ñ–Ð±Ð½Ð¾ Ð¾Ð±Ð¾Ð²'ÑÐ·ÐºÐ¾Ð²Ð¾ Ð²Ð¸ÐºÐ¾Ñ€Ð¸ÑÑ‚Ð¾Ð²ÑƒÐ²Ð°Ñ‚Ð¸ Ð¿Ñ–ÑÐ»Ñ ÐºÐ¾Ð½ÑÑ‚Ñ€ÑƒÐºÑ†Ñ–Ñ— \"ÐÐ° Ð´ÑƒÐ¼ÐºÑƒ...\", Ñ‰Ð¾Ð± Ð²ÐºÐ°Ð·Ð°Ñ‚Ð¸ Ð½Ð° Ð²Ð»Ð°ÑÐ½Ð¸ÐºÐ° Ñ–Ð´ÐµÑ—?\n- [x] Ð”Ð»Ñ Ð¿Ð¾Ð·Ð½Ð°Ñ‡ÐµÐ½Ð½Ñ Ð²Ð»Ð°ÑÐ½Ð¸ÐºÐ° Ð´ÑƒÐ¼ÐºÐ¸ Ð²Ð¸ÐºÐ¾Ñ€Ð¸ÑÑ‚Ð¾Ð²ÑƒÑŽÑ‚ÑŒ Ð Ð¾Ð´Ð¾Ð²Ð¸Ð¹ Ð²Ñ–Ð´Ð¼Ñ–Ð½Ð¾Ðº (ÐºÐ¾Ð³Ð¾? Ñ‡Ð¾Ð³Ð¾?)\n- [ ] Ð”Ð»Ñ Ð¿Ð¾Ð·Ð½Ð°Ñ‡ÐµÐ½Ð½Ñ Ð²Ð»Ð°ÑÐ½Ð¸ÐºÐ° Ð´ÑƒÐ¼ÐºÐ¸ Ð²Ð¸ÐºÐ¾Ñ€Ð¸ÑÑ‚Ð¾Ð²ÑƒÑŽÑ‚ÑŒ Ð»Ð¸ÑˆÐµ ÐžÑ€ÑƒÐ´Ð½Ð¸Ð¹ Ð²Ñ–Ð´Ð¼Ñ–Ð½Ð¾Ðº\n- [ ] Ð”Ð»Ñ Ð¿Ð¾Ð·Ð½Ð°Ñ‡ÐµÐ½Ð½Ñ Ð²Ð»Ð°ÑÐ½Ð¸ÐºÐ° Ð´ÑƒÐ¼ÐºÐ¸ Ð²Ð¸ÐºÐ¾Ñ€Ð¸ÑÑ‚Ð¾Ð²ÑƒÑŽÑ‚ÑŒ ÐšÐ»Ð¸Ñ‡Ð½Ð¸Ð¹ Ð²Ñ–Ð´Ð¼Ñ–Ð½Ð¾Ðº Ð´Ð»Ñ Ð·Ð²ÐµÑ€Ñ‚Ð°Ð½Ð½Ñ\n- [ ] Ð”Ð»Ñ Ð¿Ð¾Ð·Ð½Ð°Ñ‡ÐµÐ½Ð½Ñ Ð²Ð»Ð°ÑÐ½Ð¸ÐºÐ° Ð´ÑƒÐ¼ÐºÐ¸ Ð²Ð¸ÐºÐ¾Ñ€Ð¸ÑÑ‚Ð¾Ð²ÑƒÑŽÑ‚ÑŒ ÐœÐ°Ð¹Ð±ÑƒÑ‚Ð½Ñ–Ð¹ Ñ‡Ð°Ñ Ð´Ñ–Ñ”ÑÐ»Ð¾Ð²Ð°\n\n---\n\n3. Ð©Ð¾ ÑÐ°Ð¼Ðµ Ð²Ð¸ Ð¼Ð°Ñ”Ñ‚Ðµ Ð½Ð° ÑƒÐ²Ð°Ð·Ñ–, ÐºÐ¾Ð»Ð¸ ÐºÐ°Ð¶ÐµÑ‚Ðµ ÑÐ²Ð¾Ñ”Ð¼Ñƒ ÑÐ¿Ñ–Ð²Ñ€Ð¾Ð·Ð¼Ð¾Ð²Ð½Ð¸ÐºÑƒ \"Ð’Ð¸ Ð°Ð±ÑÐ¾Ð»ÑŽÑ‚Ð½Ð¾ Ð¿Ñ€Ð°Ð²Ñ–\" Ð¿Ñ–Ð´ Ñ‡Ð°Ñ Ð´Ð¸ÑÐºÑƒÑÑ–Ñ—?\n- [x] Ð’Ð¸ Ð²Ð¸ÑÐ»Ð¾Ð²Ð»ÑŽÑ”Ñ‚Ðµ ÑÐ²Ð¾ÑŽ Ð¿Ð¾Ð²Ð½Ñƒ Ñ‚Ð° Ñ€Ñ–ÑˆÑƒÑ‡Ñƒ Ð·Ð³Ð¾Ð´Ñƒ Ð· Ð´ÑƒÐ¼ÐºÐ¾ÑŽ Ð°Ð±Ð¾ Ð¿Ð¾Ð·Ð¸Ñ†Ñ–Ñ”ÑŽ Ð»ÑŽÐ´Ð¸Ð½Ð¸\n- [ ] Ð’Ð¸ Ð²ÐºÐ°Ð·ÑƒÑ”Ñ‚Ðµ Ð»ÑŽÐ´Ð¸Ð½Ñ–, Ñ‰Ð¾ Ñ—Ð¹ Ñ‚Ñ€ÐµÐ±Ð° Ð¹Ñ‚Ð¸ Ñ‚Ñ–Ð»ÑŒÐºÐ¸ Ð¿Ñ€Ð°Ð²Ð¾Ñ€ÑƒÑ‡ Ð½Ð° Ð½Ð°ÑÑ‚ÑƒÐ¿Ð½Ð¾Ð¼Ñƒ Ð¿ÐµÑ€ÐµÑ…Ñ€ÐµÑÑ‚Ñ–\n- [ ] Ð’Ð¸ ÐºÑ€Ð¸Ñ‚Ð¸ÐºÑƒÑ”Ñ‚Ðµ Ð»ÑŽÐ´Ð¸Ð½Ñƒ Ð·Ð° Ñ—Ñ— Ð´ÑƒÐ¶Ðµ Ð¿Ð¾Ð³Ð°Ð½Ñƒ Ñ‚Ð° ÑÑ‚Ð°Ñ€Ñƒ Ð¿Ð¾Ð²ÐµÐ´Ñ–Ð½ÐºÑƒ Ð¼Ð¸Ð½ÑƒÐ»Ð¾Ð³Ð¾ Ñ‚Ð¸Ð¶Ð½Ñ\n- [ ] Ð’Ð¸ Ð¿Ñ€Ð¾ÑÐ¸Ñ‚Ðµ Ð»ÑŽÐ´Ð¸Ð½Ñƒ ÑˆÐ²Ð¸Ð´ÐºÐ¾ Ð¿Ñ€Ð¸Ð½ÐµÑÑ‚Ð¸ Ð²Ð°Ð¼ ÑÐºÐ»ÑÐ½ÐºÑƒ Ñ…Ð¾Ð»Ð¾Ð´Ð½Ð¾Ñ— Ñ‡Ð¸ÑÑ‚Ð¾Ñ— Ð²Ð¾Ð´Ð¸\n\n---\n\n4. Ð¯ÐºÐ¸Ð¹ ÑÐ°Ð¼Ðµ ÐµÐ¼Ð¾Ñ†Ñ–Ð¹Ð½Ð¸Ð¹ Ð²Ñ–Ð´Ñ‚Ñ–Ð½Ð¾Ðº Ð·Ð½Ð°Ñ‡ÐµÐ½Ð½Ñ Ð²Ð½Ð¾ÑÐ¸Ñ‚ÑŒ Ñƒ Ñ€Ð¾Ð·Ð¼Ð¾Ð²Ñƒ ÑƒÐºÑ€Ð°Ñ—Ð½ÑÑŒÐºÐ° ÐºÐ¾Ñ€Ð¸ÑÐ½Ð° Ñ„Ñ€Ð°Ð·Ð° ÑÑƒÐ¼Ð½Ñ–Ð²Ñƒ \"ÐÐ°Ð²Ñ€ÑÐ´ Ñ‡Ð¸\"?\n- [x] Ð¦Ñ Ñ„Ñ€Ð°Ð·Ð° Ð²Ð¸Ñ€Ð°Ð¶Ð°Ñ” ÑÐ¸Ð»ÑŒÐ½Ð¸Ð¹ ÑÑƒÐ¼Ð½Ñ–Ð² Ð°Ð±Ð¾ Ð²ÐµÐ»Ð¸ÐºÑƒ Ð½ÐµÐ¿ÐµÐ²Ð½Ñ–ÑÑ‚ÑŒ Ñƒ Ð¿ÐµÐ²Ð½Ð¾Ð¼Ñƒ Ñ„Ð°ÐºÑ‚Ñ–\n- [ ] Ð¦Ñ Ñ„Ñ€Ð°Ð·Ð° Ð²Ð¸Ñ€Ð°Ð¶Ð°Ñ” Ð¿Ð¾Ð²Ð½Ñƒ Ñ‚Ð° Ð°Ð±ÑÐ¾Ð»ÑŽÑ‚Ð½Ñƒ Ð²Ð¿ÐµÐ²Ð½ÐµÐ½Ñ–ÑÑ‚ÑŒ Ñƒ Ñ‰Ð°ÑÐ»Ð¸Ð²Ð¾Ð¼Ñƒ Ð¼Ð°Ð¹Ð±ÑƒÑ‚Ð½ÑŒÐ¾Ð¼Ñƒ\n- [ ] Ð¦Ñ Ñ„Ñ€Ð°Ð·Ð° Ð²ÐºÐ°Ð·ÑƒÑ” Ð½Ð° Ñ‚Ðµ, Ñ‰Ð¾ Ð·Ð°Ñ€Ð°Ð· Ð½Ð° Ð²ÑƒÐ»Ð¸Ñ†Ñ– Ð¹Ð´Ðµ Ð´ÑƒÐ¶Ðµ ÑÐ¸Ð»ÑŒÐ½Ð¸Ð¹ Ñ…Ð¾Ð»Ð¾Ð´Ð½Ð¸Ð¹ Ð´Ð¾Ñ‰\n- [ ] Ð¦Ñ Ñ„Ñ€Ð°Ð·Ð° Ð¾Ð·Ð½Ð°Ñ‡Ð°Ñ”, Ñ‰Ð¾ Ð²Ð¸ Ñ…Ð¾Ñ‡ÐµÑ‚Ðµ Ñ‚ÐµÑ€Ð¼Ñ–Ð½Ð¾Ð²Ð¾ ÐºÑƒÐ¿Ð¸Ñ‚Ð¸ ÑÐ¾Ð±Ñ– Ð½Ð¾Ð²Ð¸Ð¹ Ñ‚ÐµÐ¿Ð»Ð¸Ð¹ Ð¾Ð´ÑÐ³\n\n---\n\n5. Ð§Ð¸ Ð¿Ð¾Ñ‚Ñ€Ñ–Ð±Ð½Ð¾ Ð·Ð°Ð·Ð²Ð¸Ñ‡Ð°Ð¹ Ð·Ð¼Ñ–Ð½ÑŽÐ²Ð°Ñ‚Ð¸ Ñ‡Ð°Ñ Ð´Ñ–Ñ”ÑÐ»Ð¾Ð²Ð° Ð² Ñ€ÐµÑ‡ÐµÐ½Ð½Ñ–, ÐºÐ¾Ð»Ð¸ Ð²Ð¸ Ð¿Ñ€Ð¾ÑÑ‚Ð¾ Ð·Ð²Ñ–Ñ‚ÑƒÑ”Ñ‚Ðµ Ð¿Ñ€Ð¾ ÑÐ²Ð¾ÑŽ Ð²Ð»Ð°ÑÐ½Ñƒ Ð´ÑƒÐ¼ÐºÑƒ?\n- [x] ÐÑ–, Ñ‡Ð°Ñ Ð´Ñ–Ñ”ÑÐ»Ð¾Ð²Ð° Ð·Ð°Ð·Ð²Ð¸Ñ‡Ð°Ð¹ Ð·Ð°Ð»Ð¸ÑˆÐ°Ñ”Ñ‚ÑŒÑÑ Ñ‚Ð°ÐºÐ¸Ð¼ ÑÐ°Ð¼Ð¸Ð¼, ÑÐº Ð²Ñ–Ð½ Ð·Ð²ÑƒÑ‡Ð¸Ñ‚ÑŒ Ñƒ ÑÐ°Ð¼Ñ–Ð¹ Ð´ÑƒÐ¼Ñ†Ñ–\n- [ ] Ð¢Ð°Ðº, Ð¼Ð¸ Ð·Ð°Ð²Ð¶Ð´Ð¸ Ð¼Ð°Ñ”Ð¼Ð¾ Ð·Ð¼Ñ–Ð½ÑŽÐ²Ð°Ñ‚Ð¸ Ð°Ð±ÑÐ¾Ð»ÑŽÑ‚Ð½Ð¾ Ð²ÑÑ– Ñ‡Ð°ÑÐ¸ Ð´Ñ–Ñ”ÑÐ»Ñ–Ð² Ð½Ð° Ð¼Ð¸Ð½ÑƒÐ»Ð¸Ð¹ Ñ‡Ð°Ñ\n- [ ] Ð¢Ð°Ðº, Ð¼Ð¸ Ð¼Ð°Ñ”Ð¼Ð¾ Ð²Ð¸ÐºÐ¾Ñ€Ð¸ÑÑ‚Ð¾Ð²ÑƒÐ²Ð°Ñ‚Ð¸ Ñ‚Ñ–Ð»ÑŒÐºÐ¸ Ñ„Ð¾Ñ€Ð¼Ð¸ Ð¼Ð°Ð¹Ð±ÑƒÑ‚Ð½ÑŒÐ¾Ð³Ð¾ Ñ‡Ð°ÑÑƒ Ð´Ð»Ñ Ð²ÑÑ–Ñ… Ð´ÑƒÐ¼Ð¾Ðº\n- [ ] Ð¢Ð°Ðº, Ñ‡Ð°Ñ Ð´Ñ–Ñ”ÑÐ»Ð¾Ð²Ð° Ð·Ð¼Ñ–Ð½ÑŽÑ”Ñ‚ÑŒÑÑ Ñ‚Ñ–Ð»ÑŒÐºÐ¸ ÑÐºÑ‰Ð¾ Ð¼Ð¸ Ð´ÑƒÐ¶Ðµ Ð³Ð¾Ð»Ð¾ÑÐ½Ð¾ ÐºÑ€Ð¸Ñ‡Ð¸Ð¼Ð¾ Ð½Ð° Ð´Ñ€ÑƒÐ³Ð°\n\n---\n\n6. Ð©Ð¾ ÑÐ°Ð¼Ðµ Ð²Ð¸ Ñ…Ð¾Ñ‡ÐµÑ‚Ðµ Ð¿ÐµÑ€ÐµÐ´Ð°Ñ‚Ð¸ Ð±Ð»Ð¸Ð·ÑŒÐºÐ¾Ð¼Ñƒ Ð´Ñ€ÑƒÐ³Ñƒ, ÐºÐ¾Ð»Ð¸ Ð²Ð¶Ð¸Ð²Ð°Ñ”Ñ‚Ðµ Ð²ÑÑ‚ÑƒÐ¿Ð½Ñƒ Ñ„Ñ€Ð°Ð·Ñƒ \"ÐœÐµÐ½Ñ– Ð·Ð´Ð°Ñ”Ñ‚ÑŒÑÑ\"?\n- [x] Ð’Ð¸ Ð²Ð¸ÑÐ»Ð¾Ð²Ð»ÑŽÑ”Ñ‚Ðµ ÑÐ²Ð¾ÑŽ Ð´ÑƒÐ¼ÐºÑƒ Ð¾Ð±ÐµÑ€ÐµÐ¶Ð½Ð¾, ÑÐº Ð²Ð»Ð°ÑÐ½Ðµ ÑÑƒÐ±'Ñ”ÐºÑ‚Ð¸Ð²Ð½Ðµ Ð²Ñ€Ð°Ð¶ÐµÐ½Ð½Ñ Ñ‡Ð¸ Ð²Ñ–Ð´Ñ‡ÑƒÑ‚Ñ‚Ñ\n- [ ] Ð’Ð¸ Ð²Ð¸ÑÐ»Ð¾Ð²Ð»ÑŽÑ”Ñ‚Ðµ Ð´ÑƒÐ¶Ðµ Ñ‚Ð¾Ñ‡Ð½Ð¸Ð¹ Ñ‚Ð° Ð¿ÐµÑ€ÐµÐ²Ñ–Ñ€ÐµÐ½Ð¸Ð¹ Ñ‡Ð°ÑÐ¾Ð¼ Ð½Ð°ÑƒÐºÐ¾Ð²Ð¸Ð¹ Ñ„Ð°ÐºÑ‚ Ñ–Ð· Ð¿Ñ–Ð´Ñ€ÑƒÑ‡Ð½Ð¸ÐºÐ°\n- [ ] Ð’Ð¸ Ð¿Ñ€Ð¾ÑÐ¸Ñ‚Ðµ Ð´Ñ€ÑƒÐ³Ð° Ð½ÐµÐ³Ð°Ð¹Ð½Ð¾ Ð·Ð°Ñ‡Ð¸Ð½Ð¸Ñ‚Ð¸ Ð²ÑÑ– Ð²Ñ–ÐºÐ½Ð° Ð² Ñ†ÑŒÐ¾Ð¼Ñƒ Ð²ÐµÐ»Ð¸ÐºÐ¾Ð¼Ñƒ ÑÑ‚Ð°Ñ€Ð¾Ð¼Ñƒ Ð´Ð¾Ð¼Ñ–\n- [ ] Ð’Ð¸ ÐºÐ°Ð¶ÐµÑ‚Ðµ Ð´Ñ€ÑƒÐ³Ñƒ, Ñ‰Ð¾ Ð²Ð¸ Ð²Ð¶Ðµ Ð´ÑƒÐ¶Ðµ Ñ…Ð¾Ñ‡ÐµÑ‚Ðµ ÑˆÐ²Ð¸Ð´ÐºÐ¾ Ð¿Ñ–Ñ‚Ð¸ Ð´Ð¾Ð´Ð¾Ð¼Ñƒ Ñ– Ð²Ñ–Ð´Ð¿Ð¾Ñ‡Ð¸Ñ‚Ð¸\n\n---\n\n7. Ð¯ÐºÐ° Ñ„Ð¾Ñ€Ð¼Ð° Ð¿Ñ€Ð¸ÐºÐ¼ÐµÑ‚Ð½Ð¸ÐºÐ° \"Ð—Ð³Ð¾Ð´ÐµÐ½\" (Agree) Ñ” Ð³Ñ€Ð°Ð¼Ð°Ñ‚Ð¸Ñ‡Ð½Ð¾ Ð¿Ñ€Ð°Ð²Ð¸Ð»ÑŒÐ½Ð¾ÑŽ Ð´Ð»Ñ Ð¶Ñ–Ð½ÐºÐ¸, ÑÐºÐ° Ð²Ð¸ÑÐ»Ð¾Ð²Ð»ÑŽÑ” ÑÐ²Ð¾ÑŽ Ð·Ð³Ð¾Ð´Ñƒ?\n- [x] Ð”Ð»Ñ Ð¶Ñ–Ð½ÐºÐ¸ Ð¿Ñ€Ð°Ð²Ð¸Ð»ÑŒÐ½Ð¾ÑŽ Ñ” Ñ„Ð¾Ñ€Ð¼Ð° Ð¿Ñ€Ð¸ÐºÐ¼ÐµÑ‚Ð½Ð¸ÐºÐ° Ð°Ð±Ð¾ ÑÑ‚Ð°Ð½Ñƒ \"Ð¯ Ð·Ð³Ð¾Ð´Ð½Ð°\" Ð· Ð·Ð°ÐºÑ–Ð½Ñ‡ÐµÐ½Ð½ÑÐ¼ -Ð°\n- [ ] Ð”Ð»Ñ Ð¶Ñ–Ð½ÐºÐ¸ Ð¿Ñ€Ð°Ð²Ð¸Ð»ÑŒÐ½Ð¾ÑŽ Ñ” Ñ„Ð¾Ñ€Ð¼Ð° Ð¿Ñ€Ð¸ÐºÐ¼ÐµÑ‚Ð½Ð¸ÐºÐ° Ð°Ð±Ð¾ ÑÑ‚Ð°Ð½Ñƒ \"Ð¯ Ð·Ð³Ð¾Ð´ÐµÐ½\" Ð· Ð½ÑƒÐ»ÑŒÐ¾Ð²Ð¸Ð¼ Ð·Ð°ÐºÑ–Ð½Ñ‡ÐµÐ½Ð½ÑÐ¼\n- [ ] Ð”Ð»Ñ Ð¶Ñ–Ð½ÐºÐ¸ Ð¿Ñ€Ð°Ð²Ð¸Ð»ÑŒÐ½Ð¾ÑŽ Ñ” Ñ„Ð¾Ñ€Ð¼Ð° Ð¿Ñ€Ð¸ÐºÐ¼ÐµÑ‚Ð½Ð¸ÐºÐ° Ð°Ð±Ð¾ ÑÑ‚Ð°Ð½Ñƒ \"Ð¯ Ð·Ð³Ð¾Ð´Ð½Ðµ\" Ð· Ð·Ð°ÐºÑ–Ð½Ñ‡ÐµÐ½Ð½ÑÐ¼ -Ðµ\n- [ ] Ð”Ð»Ñ Ð¶Ñ–Ð½ÐºÐ¸ Ð¿Ñ€Ð°Ð²Ð¸Ð»ÑŒÐ½Ð¾ÑŽ Ñ” Ñ„Ð¾Ñ€Ð¼Ð° Ñ–Ð¼ÐµÐ½Ð½Ð¸ÐºÐ° \"Ð—Ð³Ð¾Ð´Ð°\" Ð² Ð½Ð°Ð·Ð¸Ð²Ð½Ð¾Ð¼Ñƒ Ð²Ñ–Ð´Ð¼Ñ–Ð½ÐºÑƒ Ð¾Ð´Ð½Ð¸Ð½Ð¸\n\n---\n\n8. Ð£ ÑÐºÑ–Ð¹ ÑÐ°Ð¼Ðµ Ð¶Ð¸Ñ‚Ñ‚Ñ”Ð²Ñ–Ð¹ ÑÐ¸Ñ‚ÑƒÐ°Ñ†Ñ–Ñ— Ð½Ð°Ð¹Ð±Ñ–Ð»ÑŒÑˆ Ð´Ð¾Ñ€ÐµÑ‡Ð½Ð¾ Ð²Ð¶Ð¸Ð²Ð°Ñ‚Ð¸ Ð¾Ñ„Ñ–Ñ†Ñ–Ð¹Ð½Ðµ Ð´Ñ–Ñ”ÑÐ»Ð¾Ð²Ð¾ \"Ð¯ Ð²Ð²Ð°Ð¶Ð°ÑŽ, Ñ‰Ð¾...\"?\n- [x] ÐšÐ¾Ð»Ð¸ Ð²Ð¸ Ð²Ð¸ÑÐ»Ð¾Ð²Ð»ÑŽÑ”Ñ‚Ðµ ÑÐµÑ€Ð¹Ð¾Ð·Ð½Ñƒ, Ð·Ð²Ð°Ð¶ÐµÐ½Ñƒ Ñ‚Ð° Ð´Ð¾Ð±Ñ€Ðµ Ð°Ñ€Ð³ÑƒÐ¼ÐµÐ½Ñ‚Ð¾Ð²Ð°Ð½Ñƒ Ð²Ð»Ð°ÑÐ½Ñƒ Ð¿Ð¾Ð·Ð¸Ñ†Ñ–ÑŽ\n- [ ] ÐšÐ¾Ð»Ð¸ Ð²Ð¸ Ð¿Ñ€Ð¾ÑÑ‚Ð¾ Ñ€Ð¾Ð·Ð¿Ð¾Ð²Ñ–Ð´Ð°Ñ”Ñ‚Ðµ Ð´Ñ€ÑƒÐ·ÑÐ¼ Ð½Ð¾Ð²Ð¸Ð¹ ÑÐ¼Ñ–ÑˆÐ½Ð¸Ð¹ Ð°Ð½ÐµÐºÐ´Ð¾Ñ‚ Ð¿Ñ€Ð¾ ÑÑ‚Ð°Ñ€Ð¾Ð³Ð¾ Ñ€Ð¸Ð±Ð°Ð»ÐºÑƒ\n- [ ] ÐšÐ¾Ð»Ð¸ Ð²Ð¸ Ð¿Ñ€Ð¾ÑÐ¸Ñ‚Ðµ Ð¿Ñ€Ð¾Ð´Ð°Ð²Ñ†Ñ Ð² Ð¼Ð°Ð³Ð°Ð·Ð¸Ð½Ñ– Ð¿Ñ€Ð¾Ð´Ð°Ñ‚Ð¸ Ð²Ð°Ð¼ Ñ‚Ñ€Ð¾Ñ…Ð¸ ÑÐ²Ñ–Ð¶Ð¾Ð³Ð¾ Ð±Ñ–Ð»Ð¾Ð³Ð¾ Ñ…Ð»Ñ–Ð±Ð°\n- [ ] ÐšÐ¾Ð»Ð¸ Ð²Ð¸ ÑˆÑƒÐºÐ°Ñ”Ñ‚Ðµ Ð¿Ñ€Ð°Ð²Ð¸Ð»ÑŒÐ½Ñƒ Ð´Ð¾Ñ€Ð¾Ð³Ñƒ Ð´Ð¾ Ñ†ÐµÐ½Ñ‚Ñ€Ð°Ð»ÑŒÐ½Ð¾Ð³Ð¾ Ð¿Ð°Ñ€ÐºÑƒ Ð² Ð½Ð¾Ð²Ð¾Ð¼Ñƒ Ð¼Ñ–ÑÑ‚Ñ–\n\n---\n\n9. Ð¯Ðº Ð¿Ñ€Ð°Ð²Ð¸Ð»ÑŒÐ½Ð¾ Ñ‚Ð° Ð¿Ñ€Ð¸Ñ€Ð¾Ð´Ð½Ð¾ ÑÐºÐ°Ð·Ð°Ñ‚Ð¸ \"I think so too\" ÑƒÐºÑ€Ð°Ñ—Ð½ÑÑŒÐºÐ¾ÑŽ Ð¼Ð¾Ð²Ð¾ÑŽ Ð² Ñ‰Ð¾Ð´ÐµÐ½Ð½Ñ–Ð¹ Ñ€Ð¾Ð·Ð¼Ð¾Ð²Ñ–?\n- [x] ÐÐ°Ð¹ÐºÑ€Ð°Ñ‰Ðµ ÑÐºÐ°Ð·Ð°Ñ‚Ð¸ Ñ„Ñ€Ð°Ð·Ñƒ \"Ð¯ Ñ‚ÐµÐ¶ Ñ‚Ð°Ðº Ð´ÑƒÐ¼Ð°ÑŽ\" ÑÐ²Ð¾Ñ”Ð¼Ñƒ Ð´Ñ€ÑƒÐ³Ñƒ Ð°Ð±Ð¾ ÐºÐ¾Ð»ÐµÐ·Ñ–\n- [ ] ÐÐ°Ð¹ÐºÑ€Ð°Ñ‰Ðµ ÑÐºÐ°Ð·Ð°Ñ‚Ð¸ Ñ„Ñ€Ð°Ð·Ñƒ \"Ð¯ Ñ‚ÐµÐ¶ Ñ‚Ð°Ðº Ð´Ð¸Ð²Ð»ÑŽÑÑ\" ÑÐ²Ð¾Ñ”Ð¼Ñƒ Ð´Ñ€ÑƒÐ³Ñƒ Ð°Ð±Ð¾ ÐºÐ¾Ð»ÐµÐ·Ñ–\n- [ ] ÐÐ°Ð¹ÐºÑ€Ð°Ñ‰Ðµ ÑÐºÐ°Ð·Ð°Ñ‚Ð¸ Ñ„Ñ€Ð°Ð·Ñƒ \"Ð¯ Ñ‚ÐµÐ¶ Ñ‚Ð°Ðº ÑÐ¿Ð»ÑŽ\" ÑÐ²Ð¾Ñ”Ð¼Ñƒ Ð´Ñ€ÑƒÐ³Ñƒ Ð°Ð±Ð¾ ÐºÐ¾Ð»ÐµÐ·Ñ–\n- [ ] ÐÐ°Ð¹ÐºÑ€Ð°Ñ‰Ðµ ÑÐºÐ°Ð·Ð°Ñ‚Ð¸ Ñ„Ñ€Ð°Ð·Ñƒ \"Ð¯ Ñ‚ÐµÐ¶ Ñ‚Ð°Ðº Ñ—Ð¼\" ÑÐ²Ð¾Ñ”Ð¼Ñƒ Ð´Ñ€ÑƒÐ³Ñƒ Ð°Ð±Ð¾ ÐºÐ¾Ð»ÐµÐ·Ñ–\n\n---\n\n10. Ð©Ð¾ ÑÐ°Ð¼Ðµ Ð²Ð¸ Ñ…Ð¾Ñ‡ÐµÑ‚Ðµ Ð¿Ð¾Ð²Ñ–Ð´Ð¾Ð¼Ð¸Ñ‚Ð¸, ÐºÐ¾Ð»Ð¸ ÐºÐ°Ð¶ÐµÑ‚Ðµ \"Ð’Ð¸ Ð¿Ð¾Ð¼Ð¸Ð»ÑÑ”Ñ‚ÐµÑÑ\" Ð¿Ñ–Ð´ Ñ‡Ð°Ñ Ð³Ð°Ñ€ÑÑ‡Ð¾Ñ— ÑÑƒÐ¿ÐµÑ€ÐµÑ‡ÐºÐ¸ Ð½Ð° Ñ€Ð¾Ð±Ð¾Ñ‚Ñ–?\n- [x] Ð’Ð¸ Ð²Ð²Ñ–Ñ‡Ð»Ð¸Ð²Ð¾ Ð²ÐºÐ°Ð·ÑƒÑ”Ñ‚Ðµ Ð»ÑŽÐ´Ð¸Ð½Ñ– Ð½Ð° Ñ‚Ðµ, Ñ‰Ð¾ Ð²Ð¾Ð½Ð° ÐºÐ°Ð¶Ðµ ÑÐºÑƒÑÑŒ Ð½ÐµÐ¿Ñ€Ð°Ð²Ð´Ñƒ Ð°Ð±Ð¾ Ð¿Ð¾Ð¼Ð¸Ð»ÑÑ”Ñ‚ÑŒÑÑ\n- [ ] Ð’Ð¸ ÐºÐ°Ð¶ÐµÑ‚Ðµ Ð»ÑŽÐ´Ð¸Ð½Ñ–, Ñ‰Ð¾ Ð²Ð¾Ð½Ð° Ð´ÑƒÐ¶Ðµ Ð³Ð°Ñ€Ð½Ð¾ Ñ‚Ð° Ð¼Ð¾Ð´Ð½Ð¾ ÑÑŒÐ¾Ð³Ð¾Ð´Ð½Ñ– Ð¾Ð´ÑÐ³Ð½ÐµÐ½Ð° Ð´Ð»Ñ Ð·ÑƒÑÑ‚Ñ€Ñ–Ñ‡Ñ–\n- [ ] Ð’Ð¸ Ð¿Ñ€Ð¾ÑÐ¸Ñ‚Ðµ Ð»ÑŽÐ´Ð¸Ð½Ñƒ Ð¿Ñ€Ð¸Ð½ÐµÑÑ‚Ð¸ Ð²Ð°Ð¼ Ð½Ð¾Ð²Ñƒ Ñ†Ñ–ÐºÐ°Ð²Ñƒ ÐºÐ½Ð¸Ð³Ñƒ Ð¿Ñ€Ð¾ Ñ–ÑÑ‚Ð¾Ñ€Ñ–ÑŽ Ð²Ð°ÑˆÐ¾Ñ— ÐºÑ€Ð°Ñ—Ð½Ð¸\n- [ ] Ð’Ð¸ ÐºÐ°Ð¶ÐµÑ‚Ðµ Ð»ÑŽÐ´Ð¸Ð½Ñ–, Ñ‰Ð¾ Ð·Ð°Ñ€Ð°Ð· ÑÐ°Ð¼Ðµ Ñ‡Ð°Ñ Ð´Ð»Ñ Ð´ÑƒÐ¶Ðµ ÑÐ¼Ð°Ñ‡Ð½Ð¾Ð³Ð¾ Ð¾Ð±Ñ–Ð´Ñƒ Ð² Ñ€ÐµÑÑ‚Ð¾Ñ€Ð°Ð½Ñ–\n\n---\n\n11. Ð§Ð¸ Ð¼Ð¾Ð¶Ð½Ð° Ñ‡Ð°ÑÑ‚Ð¾ Ð¿Ð¾Ñ‡Ð¸Ð½Ð°Ñ‚Ð¸ Ð²Ð»Ð°ÑÐ½Ñƒ Ð´ÑƒÐ¼ÐºÑƒ Ð·Ñ– ÑÐ»Ð¾Ð²Ð° \"ÐœÐ¾Ð¶Ð»Ð¸Ð²Ð¾...\" Ð´Ð»Ñ Ð¿Ð¾Ð¼'ÑÐºÑˆÐµÐ½Ð½Ñ Ð·Ð°Ð³Ð°Ð»ÑŒÐ½Ð¾Ð³Ð¾ Ñ‚Ð¾Ð½Ñƒ?\n- [x] Ð¢Ð°Ðº, Ñ†Ðµ Ñ‡ÑƒÐ´Ð¾Ð²Ð¸Ð¹ ÑÐ¿Ð¾ÑÑ–Ð± Ð·Ñ€Ð¾Ð±Ð¸Ñ‚Ð¸ Ð²Ð»Ð°ÑÐ½Ñƒ Ð·Ð°ÑÐ²Ñƒ Ð¼ÐµÐ½Ñˆ ÐºÐ°Ñ‚ÐµÐ³Ð¾Ñ€Ð¸Ñ‡Ð½Ð¾ÑŽ Ñ‚Ð° Ð°Ð³Ñ€ÐµÑÐ¸Ð²Ð½Ð¾ÑŽ\n- [ ] ÐÑ–, Ð² ÑƒÐºÑ€Ð°Ñ—Ð½ÑÑŒÐºÑ–Ð¹ Ð¼Ð¾Ð²Ñ– ÐºÐ°Ñ‚ÐµÐ³Ð¾Ñ€Ð¸Ñ‡Ð½Ð¾ Ð½Ðµ Ð¼Ð¾Ð¶Ð½Ð° Ð²Ð¶Ð¸Ð²Ð°Ñ‚Ð¸ Ñ†Ðµ ÑÐ»Ð¾Ð²Ð¾ Ð½Ð° Ð¿Ð¾Ñ‡Ð°Ñ‚ÐºÑƒ\n- [ ] Ð¢Ð°Ðº, Ð°Ð»Ðµ Ñ‚Ñ–Ð»ÑŒÐºÐ¸ ÑÐºÑ‰Ð¾ Ð²Ð¸ Ñ€Ð¾Ð·Ð¼Ð¾Ð²Ð»ÑÑ”Ñ‚Ðµ Ð· Ð´ÑƒÐ¶Ðµ Ð¼Ð°Ð»ÐµÐ½ÑŒÐºÐ¸Ð¼Ð¸ Ð´Ñ–Ñ‚ÑŒÐ¼Ð¸ Ð½Ð° Ð²ÑƒÐ»Ð¸Ñ†Ñ–\n- [ ] ÐÑ–, Ñ†Ðµ ÑÐ»Ð¾Ð²Ð¾ Ð²Ð¸ÐºÐ¾Ñ€Ð¸ÑÑ‚Ð¾Ð²ÑƒÑ”Ñ‚ÑŒÑÑ Ð²Ð¸ÐºÐ»ÑŽÑ‡Ð½Ð¾ Ð² Ð¿Ñ–Ð´Ñ€ÑƒÑ‡Ð½Ð¸ÐºÐ°Ñ… Ð· Ð´ÑƒÐ¶Ðµ Ð²Ð¸Ñ‰Ð¾Ñ— Ð¼Ð°Ñ‚ÐµÐ¼Ð°Ñ‚Ð¸ÐºÐ¸\n\n---\n\n12. Ð¯ÐºÐµ ÑÐ»Ð¾Ð²Ð¾ Ð½Ð°Ð¹ÐºÑ€Ð°Ñ‰Ðµ Ð¿ÐµÑ€ÐµÐºÐ»Ð°Ð´Ð°Ñ” Ñ‚ÐµÑ€Ð¼Ñ–Ð½ \"opinion\" Ñƒ Ñ„Ñ–ÐºÑÐ¾Ð²Ð°Ð½Ñ–Ð¹ ÐºÐ¾Ð½ÑÑ‚Ñ€ÑƒÐºÑ†Ñ–Ñ— \"Ð½Ð° Ð¼Ð¾ÑŽ Ð´ÑƒÐ¼ÐºÑƒ\"?\n- [x] Ð¦Ðµ ÑƒÐºÑ€Ð°Ñ—Ð½ÑÑŒÐºÐµ ÑÐ»Ð¾Ð²Ð¾ \"Ð´ÑƒÐ¼ÐºÐ°\", Ñ‰Ð¾ Ð²ÐºÐ°Ð·ÑƒÑ” Ð½Ð° Ð¿Ñ€Ð¾Ñ†ÐµÑ Ð¾ÑÐ¾Ð±Ð¸ÑÑ‚Ð¾Ð³Ð¾ Ð¼Ð¸ÑÐ»ÐµÐ½Ð½Ñ\n- [ ] Ð¦Ðµ ÑƒÐºÑ€Ð°Ñ—Ð½ÑÑŒÐºÐµ ÑÐ»Ð¾Ð²Ð¾ \"Ð³Ð¾Ð»Ð¾Ð²Ð°\", Ñ‰Ð¾ Ð²ÐºÐ°Ð·ÑƒÑ” Ð½Ð° Ñ‡Ð°ÑÑ‚Ð¸Ð½Ñƒ Ñ‚Ñ–Ð»Ð° Ð±ÑƒÐ´ÑŒ-ÑÐºÐ¾Ñ— Ð»ÑŽÐ´Ð¸Ð½Ð¸\n- [ ] Ð¦Ðµ ÑƒÐºÑ€Ð°Ñ—Ð½ÑÑŒÐºÐµ ÑÐ»Ð¾Ð²Ð¾ \"ÐºÐ½Ð¸Ð³Ð°\", Ñ‰Ð¾ Ð²ÐºÐ°Ð·ÑƒÑ” Ð½Ð° Ð´Ñ€ÑƒÐºÐ¾Ð²Ð°Ð½Ðµ Ð´Ð¶ÐµÑ€ÐµÐ»Ð¾ Ð½Ð¾Ð²Ð¸Ñ… Ð·Ð½Ð°Ð½ÑŒ\n- [ ] Ð¦Ðµ ÑƒÐºÑ€Ð°Ñ—Ð½ÑÑŒÐºÐµ ÑÐ»Ð¾Ð²Ð¾ \"ÑÐ»Ð¾Ð²Ð¾\", Ñ‰Ð¾ Ð²ÐºÐ°Ð·ÑƒÑ” Ð½Ð° Ð¾ÐºÑ€ÐµÐ¼Ñƒ Ð¾Ð´Ð¸Ð½Ð¸Ñ†ÑŽ Ð»ÑŽÐ´ÑÑŒÐºÐ¾Ð³Ð¾ Ð¼Ð¾Ð²Ð»ÐµÐ½Ð½Ñ\n\n## true-false: Opinion Rules (Concept: Concept Validation)\nValidate the rules of expressing opinions.\n\n1. \"Ð¯ Ð·Ð³Ð¾Ð´ÐµÐ½\" should be used by a woman.\n   - [ ] True\n   - [x] False\n   > Women say \"Ð¯ Ð·Ð³Ð¾Ð´Ð½Ð°\".\n\n2. \"Ð¯ Ð´ÑƒÐ¼Ð°ÑŽ, Ñ‰Ð¾\" means \"I think that\".\n   - [x] True\n   - [ ] False\n   > This is the direct translation.\n\n3. \"ÐÐ°Ð²Ñ€ÑÐ´ Ñ‡Ð¸\" expresses total certainty.\n   - [ ] True\n   - [x] False\n   > It expresses doubt.\n\n4. \"ÐÐ° Ð¼Ð¾ÑŽ Ð´ÑƒÐ¼ÐºÑƒ\" acts as a parenthetical phrase.\n   - [x] True\n   - [ ] False\n   > It adds perspective to the sentence.\n\n5. You should shift tenses to the past when sharing someone's opinion.\n   - [ ] True\n   - [x] False\n   > Usually keep the original tense.\n\n6. \"Ð’Ð²Ð°Ð¶Ð°Ñ‚Ð¸\" is more formal than \"Ð´ÑƒÐ¼Ð°Ñ‚Ð¸\".\n   - [x] True\n   - [ ] False\n   > Correct.\n\n7. \"Ð’Ð¸ Ð¿Ñ€Ð°Ð²Ñ–\" means \"You are left\".\n   - [ ] True\n   - [x] False\n   > It means \"You are right\".\n\n8. Opinions in Ukraine are often discussed deeply at night.\n   - [x] True\n   - [ ] False\n   > This is a cultural trait.\n\n## group-sort: Agree vs Disagree (Ð—Ð³Ð¾Ð´Ð° Ñ‡Ð¸ ÐÐµÐ·Ð³Ð¾Ð´Ð°) (Concept: Semantic Categorization)\nSort these expressions into agreement or disagreement.\n\n### Agreement (Ð—Ð³Ð¾Ð´Ð°)\n- Ð¯ Ð·Ð³Ð¾Ð´ÐµÐ½\n- Ð¯ Ð·Ð³Ð¾Ð´Ð½Ð°\n- Ð’Ð¸ Ð¿Ñ€Ð°Ð²Ñ–\n- Ð¦Ðµ Ñ‚Ð¾Ñ‡Ð½Ð¾!\n- Ð¯ Ñ‚ÐµÐ¶ Ñ‚Ð°Ðº Ð´ÑƒÐ¼Ð°ÑŽ\n- Ð—Ð²Ð¸Ñ‡Ð°Ð¹Ð½Ð¾!\n- Ð‘ÐµÐ·ÑƒÐ¼Ð¾Ð²Ð½Ð¾!\n- ÐžÑ‡ÐµÐ²Ð¸Ð´Ð½Ð¾!\n\n### Disagreement (ÐÐµÐ·Ð³Ð¾Ð´Ð°)\n- Ð¯ Ð½Ðµ Ð·Ð³Ð¾Ð´ÐµÐ½\n- Ð¯ Ð½Ðµ Ð·Ð³Ð¾Ð´Ð½Ð°\n- ÐÐ°Ð²Ñ€ÑÐ´ Ñ‡Ð¸\n- Ð’Ð¸ Ð¿Ð¾Ð¼Ð¸Ð»ÑÑ”Ñ‚ÐµÑÑ\n- Ð¯ Ñ‚Ð°Ðº Ð½Ðµ Ð´ÑƒÐ¼Ð°ÑŽ\n- Ð¦Ðµ Ð½ÐµÐ¿Ñ€Ð°Ð²Ð´Ð°\n- Ð¦Ðµ Ð½Ðµ Ñ‚Ð°Ðº\n- ÐœÐµÐ½Ñ– Ð²Ð°Ð¶ÐºÐ¾ ÑÐºÐ°Ð·Ð°Ñ‚Ð¸\n\n## unjumble: Opinion Sentences (Concept: Syntax Integrity)\nRearrange the words to form correct sentences expressing opinions.\n\n1. Ñ / Ð´ÑƒÐ¼Ð°ÑŽ / Ñ‰Ð¾ / ÑÑƒÑ‡Ð°ÑÐ½Ð° / ÑƒÐºÑ€Ð°Ñ—Ð½ÑÑŒÐºÐ° / Ð¼Ð¾Ð²Ð° / Ñ” / Ð´ÑƒÐ¶Ðµ / Ð¼Ð¸Ð»Ð¾Ð·Ð²ÑƒÑ‡Ð½Ð° / Ñ– / ÑÐ¿Ñ€Ð°Ð²Ð´Ñ– / ÐºÑ€Ð°ÑÐ¸Ð²Ð°\n   > [!answer] Ð¯ Ð´ÑƒÐ¼Ð°ÑŽ, Ñ‰Ð¾ ÑÑƒÑ‡Ð°ÑÐ½Ð° ÑƒÐºÑ€Ð°Ñ—Ð½ÑÑŒÐºÐ° Ð¼Ð¾Ð²Ð° Ñ” Ð´ÑƒÐ¶Ðµ Ð¼Ð¸Ð»Ð¾Ð·Ð²ÑƒÑ‡Ð½Ð° Ñ– ÑÐ¿Ñ€Ð°Ð²Ð´Ñ– ÐºÑ€Ð°ÑÐ¸Ð²Ð°\n\n2. Ð½Ð° / Ð¼Ð¾ÑŽ / Ð´ÑƒÐ¼ÐºÑƒ / Ñ†ÐµÐ¹ / Ð·Ð¾Ð²ÑÑ–Ð¼ / Ð½Ð¾Ð²Ð¸Ð¹ / Ñ„Ñ–Ð»ÑŒÐ¼ / ÑÐ¿Ñ€Ð°Ð²Ð´Ñ– / Ð²Ð°Ñ€Ñ‚Ð¸Ð¹ / Ð²Ð°ÑˆÐ¾Ñ— / Ð¾ÑÐ¾Ð±Ð»Ð¸Ð²Ð¾Ñ— / ÑƒÐ²Ð°Ð³Ð¸\n   > [!answer] ÐÐ° Ð¼Ð¾ÑŽ Ð´ÑƒÐ¼ÐºÑƒ, Ñ†ÐµÐ¹ Ð·Ð¾Ð²ÑÑ–Ð¼ Ð½Ð¾Ð²Ð¸Ð¹ Ñ„Ñ–Ð»ÑŒÐ¼ ÑÐ¿Ñ€Ð°Ð²Ð´Ñ– Ð²Ð°Ñ€Ñ‚Ð¸Ð¹ Ð²Ð°ÑˆÐ¾Ñ— Ð¾ÑÐ¾Ð±Ð»Ð¸Ð²Ð¾Ñ— ÑƒÐ²Ð°Ð³Ð¸\n\n3. Ð²Ñ–Ð½ / Ñ‚Ð²ÐµÑ€Ð´Ð¾ / ÑÑ‚Ð²ÐµÑ€Ð´Ð¶ÑƒÑ” / Ñ‰Ð¾ / Ñ†Ðµ / ÑÐºÐ»Ð°Ð´Ð½Ðµ / Ñ€Ñ–ÑˆÐµÐ½Ð½Ñ / Ñ” / Ñ”Ð´Ð¸Ð½Ð¾ / Ð¿Ñ€Ð°Ð²Ð¸Ð»ÑŒÐ½Ð¸Ð¼ / Ð´Ð»Ñ / Ð½Ð°Ñ\n   > [!answer] Ð’Ñ–Ð½ Ñ‚Ð²ÐµÑ€Ð´Ð¾ ÑÑ‚Ð²ÐµÑ€Ð´Ð¶ÑƒÑ”, Ñ‰Ð¾ Ñ†Ðµ ÑÐºÐ»Ð°Ð´Ð½Ðµ Ñ€Ñ–ÑˆÐµÐ½Ð½Ñ Ñ” Ñ”Ð´Ð¸Ð½Ð¾ Ð¿Ñ€Ð°Ð²Ð¸Ð»ÑŒÐ½Ð¸Ð¼ Ð´Ð»Ñ Ð½Ð°Ñ\n\n4. Ð»Ñ–ÐºÐ°Ñ€ / Ð²Ð²Ð°Ð¶Ð°Ñ” / Ñ‰Ð¾ / Ñ†ÐµÐ¹ / Ð¿Ð°Ñ†Ñ–Ñ”Ð½Ñ‚ / Ð¿Ð¾Ð²Ð¸Ð½ÐµÐ½ / Ñ‚Ñ€Ð¾Ñ…Ð¸ / Ð±Ñ–Ð»ÑŒÑˆÐµ / Ð²Ñ–Ð´Ð¿Ð¾Ñ‡Ð¸Ð²Ð°Ñ‚Ð¸ / Ñ‚Ð° / Ð±Ð°Ð³Ð°Ñ‚Ð¾ / ÑÐ¿Ð°Ñ‚Ð¸\n   > [!answer] Ð›Ñ–ÐºÐ°Ñ€ Ð²Ð²Ð°Ð¶Ð°Ñ”, Ñ‰Ð¾ Ñ†ÐµÐ¹ Ð¿Ð°Ñ†Ñ–Ñ”Ð½Ñ‚ Ð¿Ð¾Ð²Ð¸Ð½ÐµÐ½ Ñ‚Ñ€Ð¾Ñ…Ð¸ Ð±Ñ–Ð»ÑŒÑˆÐµ Ð²Ñ–Ð´Ð¿Ð¾Ñ‡Ð¸Ð²Ð°Ñ‚Ð¸ Ñ‚Ð° Ð±Ð°Ð³Ð°Ñ‚Ð¾ ÑÐ¿Ð°Ñ‚Ð¸\n\n5. Ñ / Ñ†Ñ–Ð»ÐºÐ¾Ð¼ / Ð·Ð³Ð¾Ð´ÐµÐ½ / Ñ‰Ð¾ / Ð½Ð°Ð¼ / Ñ‚Ñ€ÐµÐ±Ð° / ÑˆÐ²Ð¸Ð´ÑˆÐµ / Ñ†Ðµ / Ð·Ñ€Ð¾Ð±Ð¸Ñ‚Ð¸\n   > [!answer] Ð¯ Ñ†Ñ–Ð»ÐºÐ¾Ð¼ Ð·Ð³Ð¾Ð´ÐµÐ½, Ñ‰Ð¾ Ð½Ð°Ð¼ Ñ‚Ñ€ÐµÐ±Ð° ÑˆÐ²Ð¸Ð´ÑˆÐµ Ñ†Ðµ Ð·Ñ€Ð¾Ð±Ð¸Ñ‚Ð¸\n\n6. Ð²Ð¾Ð½Ð° / Ð½Ð°Ð²Ñ€ÑÐ´ / Ñ‡Ð¸ / Ð¿Ð¾Ð³Ð¾Ð´Ð¸Ñ‚ÑŒÑÑ / Ð½Ð° / Ñ‚Ð°ÐºÑƒ / Ð´ÑƒÐ¶Ðµ / Ð´Ð¸Ð²Ð½Ñƒ / Ñ– / Ñ€Ð¸Ð·Ð¸ÐºÐ¾Ð²Ð°Ð½Ñƒ / Ð½Ð¾Ð²Ñƒ / Ð¿Ñ€Ð¾Ð¿Ð¾Ð·Ð¸Ñ†Ñ–ÑŽ\n   > [!answer] Ð’Ð¾Ð½Ð° Ð½Ð°Ð²Ñ€ÑÐ´ Ñ‡Ð¸ Ð¿Ð¾Ð³Ð¾Ð´Ð¸Ñ‚ÑŒÑÑ Ð½Ð° Ñ‚Ð°ÐºÑƒ Ð´ÑƒÐ¶Ðµ Ð´Ð¸Ð²Ð½Ñƒ Ñ– Ñ€Ð¸Ð·Ð¸ÐºÐ¾Ð²Ð°Ð½Ñƒ Ð½Ð¾Ð²Ñƒ Ð¿Ñ€Ð¾Ð¿Ð¾Ð·Ð¸Ñ†Ñ–ÑŽ\n\n## error-correction: Fix the Expression (Concept: Critical Proofreading)\nIdentify and fix errors in these opinion sentences.\n\n1. Ð¯ **Ð·Ð³Ð¾Ð´Ð½Ð°** Ð· Ð±Ñ€Ð°Ñ‚Ð¾Ð¼.\n   > [!error] Ð·Ð³Ð¾Ð´Ð½Ð°\n   > [!answer] Ð·Ð³Ð¾Ð´ÐµÐ½\n   > [!explanation] Men use the masculine form Ð·Ð³Ð¾Ð´ÐµÐ½.\n   > [!options] Ð·Ð³Ð¾Ð´ÐµÐ½ | Ð·Ð³Ð¾Ð´Ð½Ð°\n\n2. ÐÐ° **Ð¼Ñ–Ð¹** Ð´ÑƒÐ¼ÐºÑƒ, Ñ†Ðµ Ð´Ð¾Ð±Ñ€Ðµ.\n   > [!error] Ð¼Ñ–Ð¹\n   > [!answer] Ð¼Ð¾ÑŽ\n   > [!explanation] Ð”ÑƒÐ¼ÐºÐ° is feminine, so use Ð¼Ð¾ÑŽ.\n   > [!options] Ð¼Ð¾ÑŽ | Ð¼Ñ–Ð¹\n\n3. Ð¯ **Ð´ÑƒÐ¼Ð°Ñ‚Ð¸**, Ñ‰Ð¾ Ð²Ñ–Ð½ Ð¿Ñ€Ð¸Ð¹Ð´Ðµ.\n   > [!error] Ð´ÑƒÐ¼Ð°Ñ‚Ð¸\n   > [!answer] Ð´ÑƒÐ¼Ð°ÑŽ\n   > [!explanation] Use the conjugated form Ð´ÑƒÐ¼Ð°ÑŽ.\n   > [!options] Ð´ÑƒÐ¼Ð°ÑŽ | Ð´ÑƒÐ¼Ð°Ñ‚Ð¸\n\n4. Ð¦Ðµ **Ð½Ð°Ð²Ñ€ÑÐ´**, Ñ‰Ð¾ Ð²Ñ–Ð½ Ð·Ð½Ð°Ñ”.\n   > [!error] Ð½Ð°Ð²Ñ€ÑÐ´\n   > [!answer] Ð½Ð°Ð²Ñ€ÑÐ´ Ñ‡Ð¸\n   > [!explanation] Use the full particle Ð½Ð°Ð²Ñ€ÑÐ´ Ñ‡Ð¸.\n   > [!options] Ð½Ð°Ð²Ñ€ÑÐ´ Ñ‡Ð¸ | Ð½Ð°Ð²Ñ€ÑÐ´\n\n5. Ð¯ Ð²Ð²Ð°Ð¶Ð°ÑŽ, **Ñ‡Ð¸** Ð²Ñ–Ð½ Ð¿Ñ€Ð°Ð²Ð¸Ð¹.\n   > [!error] Ñ‡Ð¸\n   > [!answer] Ñ‰Ð¾\n   > [!explanation] Use Ñ‰Ð¾ for belief statements.\n   > [!options] Ñ‰Ð¾ | Ñ‡Ð¸\n\n6. Ð’Ð¸ **Ð¿Ð¾Ð¼Ð¸Ð»ÐºÐ°**, Ñ†Ðµ Ð½Ðµ Ñ‚Ð°Ðº.\n   > [!error] Ð¿Ð¾Ð¼Ð¸Ð»ÐºÐ°\n   > [!answer] Ð¿Ð¾Ð¼Ð¸Ð»ÑÑ”Ñ‚ÐµÑÑ\n   > [!explanation] Use the verb Ð¿Ð¾Ð¼Ð¸Ð»ÑÑ”Ñ‚ÐµÑÑ.\n   > [!options] Ð¿Ð¾Ð¼Ð¸Ð»ÑÑ”Ñ‚ÐµÑÑ | Ð¿Ð¾Ð¼Ð¸Ð»ÐºÐ°\n\n## cloze: Opinion Exchange (Concept: Contextual Application)\nComplete the conversation about the new project.\n\n**ÐÐ½Ð½Ð°:** [___:1] Ð¼Ð¾ÑŽ Ð´ÑƒÐ¼ÐºÑƒ, Ñ†ÐµÐ¹ Ð¿Ñ€Ð¾ÐµÐºÑ‚ Ð´ÑƒÐ¶Ðµ Ð¿ÐµÑ€ÑÐ¿ÐµÐºÑ‚Ð¸Ð²Ð½Ð¸Ð¹.\n**Ð†Ð²Ð°Ð½:** Ð¯ Ð½Ðµ [___:2]. ÐœÐµÐ½Ñ– [___:3], Ñ‰Ð¾ Ð²Ñ–Ð½ Ð·Ð°Ð½Ð°Ð´Ñ‚Ð¾ Ð´Ð¾Ñ€Ð¾Ð³Ð¸Ð¹.\n**ÐÐ½Ð½Ð°:** ÐÐ»Ðµ Ð´Ð¸Ñ€ÐµÐºÑ‚Ð¾Ñ€ [___:4], Ñ‰Ð¾ Ð¼Ð¸ Ð¾Ñ‚Ñ€Ð¸Ð¼Ð°Ñ”Ð¼Ð¾ Ð¿Ñ€Ð¸Ð±ÑƒÑ‚Ð¾Ðº.\n**Ð†Ð²Ð°Ð½:** [___:5] Ñ‡Ð¸ Ñ†Ðµ ÑÑ‚Ð°Ð½ÐµÑ‚ÑŒÑÑ Ñ‚Ð°Ðº ÑˆÐ²Ð¸Ð´ÐºÐ¾.\n**ÐÐ½Ð½Ð°:** Ð’Ð¸ [___:6], Ð†Ð²Ð°Ð½Ðµ. ÐœÐ¸ Ð²Ð¶Ðµ Ð¿Ñ€Ð¾Ð²ÐµÐ»Ð¸ Ð°Ð½Ð°Ð»Ñ–Ð· Ñ€Ð¸Ð½ÐºÑƒ.\n**Ð†Ð²Ð°Ð½:** ÐœÐ¾Ð¶Ð»Ð¸Ð²Ð¾. ÐÐ»Ðµ Ñ Ð²ÑÐµ Ð¾Ð´Ð½Ð¾ [___:7], Ñ‰Ð¾ Ñ‚Ñ€ÐµÐ±Ð° Ð±ÑƒÑ‚Ð¸ Ð¾Ð±ÐµÑ€ÐµÐ¶Ð½Ð¸Ð¼Ð¸.\n**ÐÐ½Ð½Ð°:** Ð¯ [___:8] Ð· Ð²Ð°Ð¼Ð¸, Ñ‰Ð¾ Ñ€Ð¸Ð·Ð¸ÐºÐ¸ Ñ”. ÐÐ»Ðµ Ñ [___:9], Ñ‰Ð¾ Ð²Ð¾Ð½Ð¸ Ð¼Ñ–Ð½Ñ–Ð¼Ð°Ð»ÑŒÐ½Ñ–.\n**Ð†Ð²Ð°Ð½:** Ð¯ [___:10] Ñ‚Ð°Ðº Ð½Ðµ Ð´ÑƒÐ¼Ð°ÑŽ. ÐŸÑ€Ð¾Ñ‚Ðµ, [___:11] ÑÐ¿Ñ€Ð¾Ð±ÑƒÐ²Ð°Ñ‚Ð¸ Ð²Ð°Ñ€Ñ‚Ð¾.\n**ÐÐ½Ð½Ð°:** [___:12] Ñ‚Ð°Ðº! Ð”Ð°Ð²Ð°Ð¹Ñ‚Ðµ Ð¿Ð¾Ñ‡Ð½ÐµÐ¼Ð¾ Ñ€Ð¾Ð±Ð¾Ñ‚Ñƒ.\n\n1. ÐÐ° | Ð£\n> [!answer] ÐÐ°\n\n2. Ð·Ð³Ð¾Ð´ÐµÐ½ | Ð±Ð°Ñ‡Ñƒ\n> [!answer] Ð·Ð³Ð¾Ð´ÐµÐ½\n\n3. Ð·Ð´Ð°Ñ”Ñ‚ÑŒÑÑ | Ð¿Ð¾Ð´Ð¾Ð±Ð°Ñ”Ñ‚ÑŒÑÑ\n> [!answer] Ð·Ð´Ð°Ñ”Ñ‚ÑŒÑÑ\n\n4. Ð²Ð²Ð°Ð¶Ð°Ñ” | Ð·Ð½Ð°Ñ”\n> [!answer] Ð²Ð²Ð°Ð¶Ð°Ñ”\n\n5. ÐÐ°Ð²Ñ€ÑÐ´ | ÐœÐ°Ð¹Ð¶Ðµ\n> [!answer] ÐÐ°Ð²Ñ€ÑÐ´\n\n6. Ð¿Ð¾Ð¼Ð¸Ð»ÑÑ”Ñ‚ÐµÑÑ | Ð¿Ñ€Ð°Ð²Ñ–\n> [!answer] Ð¿Ð¾Ð¼Ð¸Ð»ÑÑ”Ñ‚ÐµÑÑ\n\n7. Ð´ÑƒÐ¼Ð°ÑŽ | ÑÐ¿Ð»ÑŽ\n> [!answer] Ð´ÑƒÐ¼Ð°ÑŽ\n\n8. Ð·Ð³Ð¾Ð´Ð½Ð° | Ð·Ð³Ð¾Ð´ÐµÐ½\n> [!answer] Ð·Ð³Ð¾Ð´Ð½Ð°\n\n9. Ð²Ð²Ð°Ð¶Ð°ÑŽ | Ð¿Ð¸ÑˆÑƒ\n> [!answer] Ð²Ð²Ð°Ð¶Ð°ÑŽ\n\n10. Ñ‚ÐµÐ¶ | Ð·Ð¾Ð²ÑÑ–Ð¼\n> [!answer] Ñ‚ÐµÐ¶\n\n11. Ð¼Ð¾Ð¶Ð»Ð¸Ð²Ð¾ | Ð½Ð°Ð²Ñ€ÑÐ´\n> [!answer] Ð¼Ð¾Ð¶Ð»Ð¸Ð²Ð¾\n\n12. Ð¡Ð°Ð¼Ðµ | Ð¥Ð¾Ñ‡Ð°\n> [!answer] Ð¡Ð°Ð¼Ðµ\n\n## dialogue-reorder: Discussing Views (Concept: Narrative Coherence)\nOrder the dialogue logically.\n\n- Ð¯Ðº Ñ‚Ð¾Ð±Ñ– Ñ†ÐµÐ¹ Ñ€ÐµÑÑ‚Ð¾Ñ€Ð°Ð½?\n- Ð¯ Ð´ÑƒÐ¼Ð°ÑŽ, Ñ‰Ð¾ Ñ—Ð¶Ð° Ñ‚ÑƒÑ‚ Ð´ÑƒÐ¶Ðµ ÑÐ¼Ð°Ñ‡Ð½Ð°.\n- Ð Ñ Ð½Ðµ Ð·Ð³Ð¾Ð´ÐµÐ½. ÐœÑ–Ð¹ ÑÑ‚ÐµÐ¹Ðº Ð±ÑƒÐ² ÑÑƒÑ…Ð¸Ð¹.\n- Ð¡Ð¿Ñ€Ð°Ð²Ð´Ñ–? ÐÐ° Ð¼Ð¾ÑŽ Ð´ÑƒÐ¼ÐºÑƒ, Ð²Ñ–Ð½ Ð²Ð¸Ð³Ð»ÑÐ´Ð°Ð² Ð´Ð¾Ð±Ñ€Ðµ.\n- Ð’Ð¸Ð³Ð»ÑÐ´ â€” Ñ†Ðµ Ñ‰Ðµ Ð½Ðµ Ð²ÑÐµ. Ð¯ Ð²Ð²Ð°Ð¶Ð°ÑŽ, Ñ‰Ð¾ ÑÐµÑ€Ð²Ñ–Ñ Ñ‚ÐµÐ¶ Ð¿Ð¾Ð²Ñ–Ð»ÑŒÐ½Ð¸Ð¹.\n- Ð’Ð¸ Ð¿Ñ€Ð°Ð²Ñ–, Ð¾Ñ„Ñ–Ñ†Ñ–Ð°Ð½Ñ‚Ð° Ð¼Ð¸ Ñ‡ÐµÐºÐ°Ð»Ð¸ Ð´Ð¾Ð²Ð³Ð¾.\n- Ð¯ Ð±Ñ–Ð»ÑŒÑˆÐµ ÑÑŽÐ´Ð¸ Ð½Ðµ Ð¿Ñ€Ð¸Ð¹Ð´Ñƒ.\n- Ð Ñ Ñ‚ÐµÐ¶ Ñ‚Ð°Ðº Ð´ÑƒÐ¼Ð°ÑŽ Ñ‚ÐµÐ¿ÐµÑ€.\n- ÐœÐ¾Ð¶Ðµ, Ð¿Ñ–Ð´ÐµÐ¼Ð¾ Ð² Ñ–Ð½ÑˆÐµ Ð¼Ñ–ÑÑ†Ðµ Ð·Ð°Ð²Ñ‚Ñ€Ð°?\n- ÐÐ°Ð²Ñ€ÑÐ´ Ñ‡Ð¸ Ñ Ð·Ð°Ñ…Ð¾Ñ‡Ñƒ Ñ—ÑÑ‚Ð¸ Ð² Ñ†ÑŒÐ¾Ð¼Ñƒ Ñ€Ð°Ð¹Ð¾Ð½Ñ– Ð·Ð½Ð¾Ð²Ñƒ.\n- Ð’Ð¸ Ð´ÑƒÐ¶Ðµ ÐºÑ€Ð¸Ñ‚Ð¸Ñ‡Ð½Ñ– ÑÑŒÐ¾Ð³Ð¾Ð´Ð½Ñ–!\n- ÐœÐ¾Ð¶Ð»Ð¸Ð²Ð¾, Ð°Ð»Ðµ Ñ Ð¿Ñ€Ð¾ÑÑ‚Ð¾ Ñ‡ÐµÑÐ½Ð¸Ð¹.\n\n> [!answer]\n> 1. Ð¯Ðº Ñ‚Ð¾Ð±Ñ– Ñ†ÐµÐ¹ Ñ€ÐµÑÑ‚Ð¾Ñ€Ð°Ð½?\n> 2. Ð¯ Ð´ÑƒÐ¼Ð°ÑŽ, Ñ‰Ð¾ Ñ—Ð¶Ð° Ñ‚ÑƒÑ‚ Ð´ÑƒÐ¶Ðµ ÑÐ¼Ð°Ñ‡Ð½Ð°.\n> 3. Ð Ñ Ð½Ðµ Ð·Ð³Ð¾Ð´ÐµÐ½. ÐœÑ–Ð¹ ÑÑ‚ÐµÐ¹Ðº Ð±ÑƒÐ² ÑÑƒÑ…Ð¸Ð¹.\n> 4. Ð¡Ð¿Ñ€Ð°Ð²Ð´Ñ–? ÐÐ° Ð¼Ð¾ÑŽ Ð´ÑƒÐ¼ÐºÑƒ, Ð²Ñ–Ð½ Ð²Ð¸Ð³Ð»ÑÐ´Ð°Ð² Ð´Ð¾Ð±Ñ€Ðµ.\n> 5. Ð’Ð¸Ð³Ð»ÑÐ´ â€” Ñ†Ðµ Ñ‰Ðµ Ð½Ðµ Ð²ÑÐµ. Ð¯ Ð²Ð²Ð°Ð¶Ð°ÑŽ, Ñ‰Ð¾ ÑÐµÑ€Ð²Ñ–Ñ Ñ‚ÐµÐ¶ Ð¿Ð¾Ð²Ñ–Ð»ÑŒÐ½Ð¸Ð¹.\n> 6. Ð’Ð¸ Ð¿Ñ€Ð°Ð²Ñ–, Ð¾Ñ„Ñ–Ñ†Ñ–Ð°Ð½Ñ‚Ð° Ð¼Ð¸ Ñ‡ÐµÐºÐ°Ð»Ð¸ Ð´Ð¾Ð²Ð³Ð¾.\n> 7. Ð¯ Ð±Ñ–Ð»ÑŒÑˆÐµ ÑÑŽÐ´Ð¸ Ð½Ðµ Ð¿Ñ€Ð¸Ð¹Ð´Ñƒ.\n> 8. Ð Ñ Ñ‚ÐµÐ¶ Ñ‚Ð°Ðº Ð´ÑƒÐ¼Ð°ÑŽ Ñ‚ÐµÐ¿ÐµÑ€.\n> 9. ÐœÐ¾Ð¶Ðµ, Ð¿Ñ–Ð´ÐµÐ¼Ð¾ Ð² Ñ–Ð½ÑˆÐµ Ð¼Ñ–ÑÑ†Ðµ Ð·Ð°Ð²Ñ‚Ñ€Ð°?\n> 10. ÐÐ°Ð²Ñ€ÑÐ´ Ñ‡Ð¸ Ñ Ð·Ð°Ñ…Ð¾Ñ‡Ñƒ Ñ—ÑÑ‚Ð¸ Ð² Ñ†ÑŒÐ¾Ð¼Ñƒ Ñ€Ð°Ð¹Ð¾Ð½Ñ– Ð·Ð½Ð¾Ð²Ñƒ.\n> 11. Ð’Ð¸ Ð´ÑƒÐ¶Ðµ ÐºÑ€Ð¸Ñ‚Ð¸Ñ‡Ð½Ñ– ÑÑŒÐ¾Ð³Ð¾Ð´Ð½Ñ–!\n> 12. ÐœÐ¾Ð¶Ð»Ð¸Ð²Ð¾, Ð°Ð»Ðµ Ñ Ð¿Ñ€Ð¾ÑÑ‚Ð¾ Ñ‡ÐµÑÐ½Ð¸Ð¹.\n\n## mark-the-words: Find Opinion Expressions (Concept: Pattern Recognition)\nIdentify the opinion-marking phrases in the text.\n\nÐ¯ [Ð´ÑƒÐ¼Ð°ÑŽ](correct), Ñ‰Ð¾ Ñ†Ðµ Ð´Ð¾Ð±Ñ€Ðµ. ÐÐ° [Ð¼Ð¾ÑŽ Ð´ÑƒÐ¼ÐºÑƒ](correct), Ñ†Ðµ Ð²Ð°Ð¶Ð»Ð¸Ð²Ð¾. ÐœÐµÐ½Ñ– [Ð·Ð´Ð°Ñ”Ñ‚ÑŒÑÑ](correct), Ð²Ð¸ Ð¿Ð¾Ð¼Ð¸Ð»ÑÑ”Ñ‚ÐµÑÑ. Ð¯ [Ð²Ð²Ð°Ð¶Ð°ÑŽ](correct), Ñ‰Ð¾ Ñ‡Ð°Ñ Ñ–Ñ‚Ð¸. Ð¯ Ð½Ðµ [Ð¿ÐµÐ²Ð½Ð¸Ð¹](correct) Ñƒ Ñ†ÑŒÐ¾Ð¼Ñƒ. Ð’Ð¸ [Ð¿Ñ€Ð°Ð²Ñ–](correct)! ÐÐ°Ð²Ñ€ÑÐ´ [Ñ‡Ð¸](correct) Ñ†Ðµ Ð´Ð¾Ð¿Ð¾Ð¼Ð¾Ð¶Ðµ. Ð¯ [Ð·Ð³Ð¾Ð´ÐµÐ½](correct) Ð· Ð²Ð°Ð¼Ð¸. Ð¯ [Ñ‚ÐµÐ¶](correct) Ñ‚Ð°Ðº Ð´ÑƒÐ¼Ð°ÑŽ.\n\n## translate: English to Ukrainian (Concept: Cross-Linguistic Transfer)\n\n1. I think that she is right.\n- [x] Ð¯ Ð´ÑƒÐ¼Ð°ÑŽ, Ñ‰Ð¾ Ð²Ð¾Ð½Ð° Ð¿Ñ€Ð°Ð²Ð°.\n- [ ] Ð¯ Ð´ÑƒÐ¼Ð°ÑŽ, Ñ‡Ð¸ Ð²Ð¾Ð½Ð° Ð¿Ñ€Ð°Ð²Ð°.\n\n2. In my opinion, it is too late.\n- [x] ÐÐ° Ð¼Ð¾ÑŽ Ð´ÑƒÐ¼ÐºÑƒ, Ð²Ð¶Ðµ Ð·Ð°Ð½Ð°Ð´Ñ‚Ð¾ Ð¿Ñ–Ð·Ð½Ð¾.\n- [ ] ÐÐ° Ð¼Ð¾ÑŽ Ð´ÑƒÐ¼ÐºÑƒ, Ð²Ð¶Ðµ Ð·Ð°Ð½Ð°Ð´Ñ‚Ð¾ ÑÐºÐ¾Ñ€Ð¾.\n\n3. I completely agree with you.\n- [x] Ð¯ Ñ†Ñ–Ð»ÐºÐ¾Ð¼ Ð·Ð³Ð¾Ð´ÐµÐ½ Ð· Ð²Ð°Ð¼Ð¸.\n- [ ] Ð¯ Ñ†Ñ–Ð»ÐºÐ¾Ð¼ Ð½Ðµ Ð¿ÐµÐ²Ð½Ð¸Ð¹ Ð· Ð²Ð°Ð¼Ð¸.\n\n4. It seems to me that it works.\n- [x] ÐœÐµÐ½Ñ– Ð·Ð´Ð°Ñ”Ñ‚ÑŒÑÑ, Ñ‰Ð¾ Ñ†Ðµ Ð¿Ñ€Ð°Ñ†ÑŽÑ”.\n- [ ] ÐœÐµÐ½Ñ– Ð·Ð´Ð°Ñ”Ñ‚ÑŒÑÑ, Ñ‰Ð¾ Ñ†Ðµ ÑÐ¿Ð¸Ñ‚ÑŒ.\n\n5. I doubt that it is true.\n- [x] ÐÐ°Ð²Ñ€ÑÐ´ Ñ‡Ð¸ Ñ†Ðµ Ð¿Ñ€Ð°Ð²Ð´Ð°.\n- [ ] Ð¦Ðµ Ñ‚Ð¾Ñ‡Ð½Ð¾ Ð¿Ñ€Ð°Ð²Ð´Ð°.\n\n6. What do you think about this?\n- [x] Ð©Ð¾ Ð²Ð¸ Ð¿Ñ€Ð¾ Ñ†Ðµ Ð´ÑƒÐ¼Ð°Ñ”Ñ‚Ðµ?\n- [ ] Ð”Ðµ Ð²Ð¸ Ð¿Ñ€Ð¾ Ñ†Ðµ Ð´ÑƒÐ¼Ð°Ñ”Ñ‚Ðµ?\n\n7. You are mistaken about this.\n- [x] Ð’Ð¸ Ð¿Ð¾Ð¼Ð¸Ð»ÑÑ”Ñ‚ÐµÑÑ Ñ‰Ð¾Ð´Ð¾ Ñ†ÑŒÐ¾Ð³Ð¾.\n- [ ] Ð’Ð¸ Ð¿Ñ€Ð°Ð²Ñ– Ñ‰Ð¾Ð´Ð¾ Ñ†ÑŒÐ¾Ð³Ð¾.\n\n8. I am not sure about the plan.\n- [x] Ð¯ Ð½Ðµ Ð·Ð½Ð°ÑŽ Ñ‚Ð¾Ñ‡Ð½Ð¾ Ñ‰Ð¾Ð´Ð¾ Ð¿Ð»Ð°Ð½Ñƒ.\n- [ ] Ð¯ Ð·Ð³Ð¾Ð´ÐµÐ½ Ñ‰Ð¾Ð´Ð¾ Ð¿Ð»Ð°Ð½Ñƒ.\n\n9. Probably we should stay.\n- [x] ÐÐ°Ð¿ÐµÐ²Ð½Ð¾, Ð½Ð°Ð¼ Ñ‚Ñ€ÐµÐ±Ð° Ð·Ð°Ð»Ð¸ÑˆÐ¸Ñ‚Ð¸ÑÑ.\n- [ ] ÐÐ°Ð¿ÐµÐ²Ð½Ð¾, Ð½Ð°Ð¼ Ñ‚Ñ€ÐµÐ±Ð° Ð¿Ñ–Ñ‚Ð¸.\n\n10. Maybe you have a point.\n- [x] ÐœÐ¾Ð¶Ð»Ð¸Ð²Ð¾, Ð²Ð¸ Ð¼Ð°Ñ”Ñ‚Ðµ Ñ€Ð°Ñ†Ñ–ÑŽ.\n- [ ] ÐœÐ¾Ð¶Ð»Ð¸Ð²Ð¾, Ð²Ð¸ Ð¼Ð°Ñ”Ñ‚Ðµ ÐºÐ½Ð¸Ð³Ñƒ.\n\n11. She considers this important.\n- [x] Ð’Ð¾Ð½Ð° Ð²Ð²Ð°Ð¶Ð°Ñ” Ñ†Ðµ Ð²Ð°Ð¶Ð»Ð¸Ð²Ð¸Ð¼.\n- [ ] Ð’Ð¾Ð½Ð° Ð´ÑƒÐ¼Ð°Ñ” Ñ†Ðµ Ð²Ð°Ð¶Ð»Ð¸Ð²Ð¸Ð¼.\n\n12. I think so too.\n- [x] Ð¯ Ñ‚ÐµÐ¶ Ñ‚Ð°Ðº Ð´ÑƒÐ¼Ð°ÑŽ.\n- [ ] Ð¯ Ñ‚ÐµÐ¶ Ñ‚Ð°Ðº Ð±Ð°Ñ‡Ñƒ.\n\n# Vocabulary\n\n| Word | IPA | English | POS | Gender | Note |\n|------|-----|---------|-----|--------|------|\n| Ð²Ð²Ð°Ð¶Ð°Ñ‚Ð¸ | /Ê‹Ê‹É‘ËˆÊ’É‘tÉª/ | to consider, believe | verb | â€” | formal |\n| Ð³Ð°Ð´Ð°Ñ‚Ð¸ | /É¦É‘ËˆdÉ‘tÉª/ | to guess, think | verb | â€” | poetic |\n| Ð·Ð´Ð°Ñ”Ñ‚ÑŒÑÑ | /ËˆzdÉ‘jÉ›tÍ¡sÊ²É‘/ | it seems | verb | â€” | 3rd sg |\n| Ð½Ð° Ð¼Ð¾ÑŽ Ð´ÑƒÐ¼ÐºÑƒ | /nÉ‘ ËˆmÉ”ju Ëˆdumku/ | in my opinion | phrase | â€” | opener |\n| Ð½Ð° Ð¼Ñ–Ð¹ Ð¿Ð¾Ð³Ð»ÑÐ´ | /nÉ‘ mij ËˆpÉ”É¦lÊ²É‘d/ | from my view | phrase | â€” | opener |\n| Ð· Ð¼Ð¾Ñ”Ñ— Ñ‚Ð¾Ñ‡ÐºÐ¸ Ð·Ð¾Ñ€Ñƒ | /z mÉ”ËˆjÉ›ji ËˆtÉ”tÍ¡ÊƒkÉª ËˆzÉ”ru/ | from my point of view | phrase | â€” | analytic |\n| Ð·Ð³Ð¾Ð´ÐµÐ½ | /ËˆzÉ¦É”dÉ›n/ | agree (masc) | adj | masc | state |\n| Ð·Ð³Ð¾Ð´Ð½Ð° | /ËˆzÉ¦É”dnÉ‘/ | agree (fem) | adj | fem | state |\n| Ð½Ðµ Ð·Ð³Ð¾Ð´ÐµÐ½ | /nÉ› ËˆzÉ¦É”dÉ›n/ | disagree (masc) | adj | masc | state |\n| Ð¿Ð¾Ð³Ð¾Ð´Ð¶ÑƒÐ²Ð°Ñ‚Ð¸ÑÑ | /pÉ”ËˆÉ¦É”dÊ’uÊ‹É‘tÉªsÊ²É‘/ | to agree | verb | â€” | process |\n| Ð½Ðµ Ð¿Ð¾Ð³Ð¾Ð´Ð¶ÑƒÐ²Ð°Ñ‚Ð¸ÑÑ | /nÉ› pÉ”ËˆÉ¦É”dÊ’uÊ‹É‘tÉªsÊ²É‘/ | to disagree | verb | â€” | process |\n| Ð¿Ñ€Ð°Ð²Ð´Ð° | /ËˆprÉ‘uÌ¯dÉ‘/ | truth | noun | fem | fact |\n| Ð½ÐµÐ¿Ñ€Ð°Ð²Ð´Ð° | /nÉ›ËˆprÉ‘uÌ¯dÉ‘/ | lie, untruth | noun | fem | fact |\n| Ð½Ðµ Ñ‚Ð°Ðº | /nÉ› tÉ‘k/ | not so | phrase | â€” | negative |\n| Ð±ÐµÐ·ÑƒÐ¼Ð¾Ð²Ð½Ð¾ | /bÉ›zuËˆmÉ”uÌ¯nÉ”/ | absolutely | adv | â€” | strong |\n| Ð¾Ñ‡ÐµÐ²Ð¸Ð´Ð½Ð¾ | /É”tÍ¡ÊƒÉ›ËˆÊ‹ÉªdnÉ”/ | obviously | adv | â€” | modal |\n| Ð½Ð°Ð²Ñ€ÑÐ´ Ñ‡Ð¸ | /nÉ‘uÌ¯ËˆrÊ²É‘d tÍ¡ÊƒÉª/ | hardly, doubtfully | part | â€” | doubt |\n| Ð¿Ð¾Ð¼Ð¸Ð»ÑÑ‚Ð¸ÑÑ | /pÉ”mÉªËˆlÊ²É‘tÉªsÊ²É‘/ | to be mistaken | verb | â€” | error |\n| Ð¿Ñ€Ð°Ð²Ð¸Ð¹ | /ËˆprÉ‘Ê‹Éªj/ | right, correct | adj | masc | state |\n| Ñ€Ð°Ñ†Ñ–Ñ | /ËˆrÉ‘tÍ¡sÊ²ijÉ‘/ | rightness (have reason) | noun | fem | idiom |\n| Ð¿Ð¾Ð³Ð¾Ð´Ð¸Ñ‚Ð¸ÑÑ | /pÉ”ËˆÉ¦É”dÉªtÉªsÊ²É‘/ | to agree | verb | â€” | perfective |\n| ÑÑƒÐ¿ÐµÑ€ÐµÑ‡ÐºÐ° | /supÉ›ËˆrÉ›tÍ¡ÊƒkÉ‘/ | argument, dispute | noun | fem | social |\n| Ñ†Ñ–Ð»ÐºÐ¾Ð¼ | /tÍ¡sÑ–lËˆkÉ”m/ | completely | adv | â€” | degree |\n| Ð¾Ð±Ð³Ð¾Ð²Ð¾Ñ€ÑŽÐ²Ð°Ñ‚Ð¸ | /É”bÉ¦É”ËˆÊ‹É”rÊ²uÊ‹É‘tÉª/ | to discuss | verb | â€” | activity |\n| Ð¿Ð¾Ð·Ð¸Ñ†Ñ–Ñ | /pÉ”ËˆzÉªtÍ¡sÊ²ijÉ‘/ | position, stance | noun | fem | formal |\n| Ð°Ñ€Ð³ÑƒÐ¼ÐµÐ½Ñ‚ | /É‘rÉ¦uËˆmÉ›nt/ | argument | noun | masc | formal |\n| Ð²Ð»Ð°ÑÐ½Ðµ | /ËˆÊ‹lÉ‘snÉ›/ | actually, properly | adv | â€” | filler |\n",
    "createdAt": "2025-12-23T02:19:59.085584Z",
    "modifiedAt": "2025-12-23T02:19:59.085584Z",
    "version": 2
  },
  "activities": [],
  "vocabulary": {
    "moduleId": "mod-uk-A2-28",
    "level": "A2",
    "phase": "A2.3",
    "wordCount": 27,
    "newWordCount": 27,
    "reviewWordCount": 0,
    "transliterationMode": "none",
    "words": [
      {
        "id": "vocab-1",
        "uk": "Ð²Ð²Ð°Ð¶Ð°Ñ‚Ð¸",
        "ipa": "/Ê‹Ê‹É‘ËˆÊ’É‘tÉª/",
        "en": "to consider, believe",
        "pos": "verb",
        "gender": null,
        "note": "formal"
      },
      {
        "id": "vocab-2",
        "uk": "Ð³Ð°Ð´Ð°Ñ‚Ð¸",
        "ipa": "/É¦É‘ËˆdÉ‘tÉª/",
        "en": "to guess, think",
        "pos": "verb",
        "gender": null,
        "note": "poetic"
      },
      {
        "id": "vocab-3",
        "uk": "Ð·Ð´Ð°Ñ”Ñ‚ÑŒÑÑ",
        "ipa": "/ËˆzdÉ‘jÉ›tÍ¡sÊ²É‘/",
        "en": "it seems",
        "pos": "verb",
        "gender": null,
        "note": "3rd sg"
      },
      {
        "id": "vocab-4",
        "uk": "Ð½Ð° Ð¼Ð¾ÑŽ Ð´ÑƒÐ¼ÐºÑƒ",
        "ipa": "/nÉ‘ ËˆmÉ”ju Ëˆdumku/",
        "en": "in my opinion",
        "pos": "phrase",
        "gender": null,
        "note": "opener"
      },
      {
        "id": "vocab-5",
        "uk": "Ð½Ð° Ð¼Ñ–Ð¹ Ð¿Ð¾Ð³Ð»ÑÐ´",
        "ipa": "/nÉ‘ mij ËˆpÉ”É¦lÊ²É‘d/",
        "en": "from my view",
        "pos": "phrase",
        "gender": null,
        "note": "opener"
      },
      {
        "id": "vocab-6",
        "uk": "Ð· Ð¼Ð¾Ñ”Ñ— Ñ‚Ð¾Ñ‡ÐºÐ¸ Ð·Ð¾Ñ€Ñƒ",
        "ipa": "/z mÉ”ËˆjÉ›ji ËˆtÉ”tÍ¡ÊƒkÉª ËˆzÉ”ru/",
        "en": "from my point of view",
        "pos": "phrase",
        "gender": null,
        "note": "analytic"
      },
      {
        "id": "vocab-7",
        "uk": "Ð·Ð³Ð¾Ð´ÐµÐ½",
        "ipa": "/ËˆzÉ¦É”dÉ›n/",
        "en": "agree (masc)",
        "pos": "adj",
        "gender": null,
        "note": "state"
      },
      {
        "id": "vocab-8",
        "uk": "Ð·Ð³Ð¾Ð´Ð½Ð°",
        "ipa": "/ËˆzÉ¦É”dnÉ‘/",
        "en": "agree (fem)",
        "pos": "adj",
        "gender": null,
        "note": "state"
      },
      {
        "id": "vocab-9",
        "uk": "Ð½Ðµ Ð·Ð³Ð¾Ð´ÐµÐ½",
        "ipa": "/nÉ› ËˆzÉ¦É”dÉ›n/",
        "en": "disagree (masc)",
        "pos": "adj",
        "gender": null,
        "note": "state"
      },
      {
        "id": "vocab-10",
        "uk": "Ð¿Ð¾Ð³Ð¾Ð´Ð¶ÑƒÐ²Ð°Ñ‚Ð¸ÑÑ",
        "ipa": "/pÉ”ËˆÉ¦É”dÊ’uÊ‹É‘tÉªsÊ²É‘/",
        "en": "to agree",
        "pos": "verb",
        "gender": null,
        "note": "process"
      },
      {
        "id": "vocab-11",
        "uk": "Ð½Ðµ Ð¿Ð¾Ð³Ð¾Ð´Ð¶ÑƒÐ²Ð°Ñ‚Ð¸ÑÑ",
        "ipa": "/nÉ› pÉ”ËˆÉ¦É”dÊ’uÊ‹É‘tÉªsÊ²É‘/",
        "en": "to disagree",
        "pos": "verb",
        "gender": null,
        "note": "process"
      },
      {
        "id": "vocab-12",
        "uk": "Ð¿Ñ€Ð°Ð²Ð´Ð°",
        "ipa": "/ËˆprÉ‘uÌ¯dÉ‘/",
        "en": "truth",
        "pos": "noun",
        "gender": null,
        "note": "fact"
      },
      {
        "id": "vocab-13",
        "uk": "Ð½ÐµÐ¿Ñ€Ð°Ð²Ð´Ð°",
        "ipa": "/nÉ›ËˆprÉ‘uÌ¯dÉ‘/",
        "en": "lie, untruth",
        "pos": "noun",
        "gender": null,
        "note": "fact"
      },
      {
        "id": "vocab-14",
        "uk": "Ð½Ðµ Ñ‚Ð°Ðº",
        "ipa": "/nÉ› tÉ‘k/",
        "en": "not so",
        "pos": "phrase",
        "gender": null,
        "note": "negative"
      },
      {
        "id": "vocab-15",
        "uk": "Ð±ÐµÐ·ÑƒÐ¼Ð¾Ð²Ð½Ð¾",
        "ipa": "/bÉ›zuËˆmÉ”uÌ¯nÉ”/",
        "en": "absolutely",
        "pos": "adv",
        "gender": null,
        "note": "strong"
      },
      {
        "id": "vocab-16",
        "uk": "Ð¾Ñ‡ÐµÐ²Ð¸Ð´Ð½Ð¾",
        "ipa": "/É”tÍ¡ÊƒÉ›ËˆÊ‹ÉªdnÉ”/",
        "en": "obviously",
        "pos": "adv",
        "gender": null,
        "note": "modal"
      },
      {
        "id": "vocab-17",
        "uk": "Ð½Ð°Ð²Ñ€ÑÐ´ Ñ‡Ð¸",
        "ipa": "/nÉ‘uÌ¯ËˆrÊ²É‘d tÍ¡ÊƒÉª/",
        "en": "hardly, doubtfully",
        "pos": "part",
        "gender": null,
        "note": "doubt"
      },
      {
        "id": "vocab-18",
        "uk": "Ð¿Ð¾Ð¼Ð¸Ð»ÑÑ‚Ð¸ÑÑ",
        "ipa": "/pÉ”mÉªËˆlÊ²É‘tÉªsÊ²É‘/",
        "en": "to be mistaken",
        "pos": "verb",
        "gender": null,
        "note": "error"
      },
      {
        "id": "vocab-19",
        "uk": "Ð¿Ñ€Ð°Ð²Ð¸Ð¹",
        "ipa": "/ËˆprÉ‘Ê‹Éªj/",
        "en": "right, correct",
        "pos": "adj",
        "gender": null,
        "note": "state"
      },
      {
        "id": "vocab-20",
        "uk": "Ñ€Ð°Ñ†Ñ–Ñ",
        "ipa": "/ËˆrÉ‘tÍ¡sÊ²ijÉ‘/",
        "en": "rightness (have reason)",
        "pos": "noun",
        "gender": null,
        "note": "idiom"
      },
      {
        "id": "vocab-21",
        "uk": "Ð¿Ð¾Ð³Ð¾Ð´Ð¸Ñ‚Ð¸ÑÑ",
        "ipa": "/pÉ”ËˆÉ¦É”dÉªtÉªsÊ²É‘/",
        "en": "to agree",
        "pos": "verb",
        "gender": null,
        "note": "perfective"
      },
      {
        "id": "vocab-22",
        "uk": "ÑÑƒÐ¿ÐµÑ€ÐµÑ‡ÐºÐ°",
        "ipa": "/supÉ›ËˆrÉ›tÍ¡ÊƒkÉ‘/",
        "en": "argument, dispute",
        "pos": "noun",
        "gender": null,
        "note": "social"
      },
      {
        "id": "vocab-23",
        "uk": "Ñ†Ñ–Ð»ÐºÐ¾Ð¼",
        "ipa": "/tÍ¡sÑ–lËˆkÉ”m/",
        "en": "completely",
        "pos": "adv",
        "gender": null,
        "note": "degree"
      },
      {
        "id": "vocab-24",
        "uk": "Ð¾Ð±Ð³Ð¾Ð²Ð¾Ñ€ÑŽÐ²Ð°Ñ‚Ð¸",
        "ipa": "/É”bÉ¦É”ËˆÊ‹É”rÊ²uÊ‹É‘tÉª/",
        "en": "to discuss",
        "pos": "verb",
        "gender": null,
        "note": "activity"
      },
      {
        "id": "vocab-25",
        "uk": "Ð¿Ð¾Ð·Ð¸Ñ†Ñ–Ñ",
        "ipa": "/pÉ”ËˆzÉªtÍ¡sÊ²ijÉ‘/",
        "en": "position, stance",
        "pos": "noun",
        "gender": null,
        "note": "formal"
      },
      {
        "id": "vocab-26",
        "uk": "Ð°Ñ€Ð³ÑƒÐ¼ÐµÐ½Ñ‚",
        "ipa": "/É‘rÉ¦uËˆmÉ›nt/",
        "en": "argument",
        "pos": "noun",
        "gender": null,
        "note": "formal"
      },
      {
        "id": "vocab-27",
        "uk": "Ð²Ð»Ð°ÑÐ½Ðµ",
        "ipa": "/ËˆÊ‹lÉ‘snÉ›/",
        "en": "actually, properly",
        "pos": "adv",
        "gender": null,
        "note": "filler"
      }
    ],
    "reviewWords": []
  }
}