{
  "$schema": "../../../schemas/vibe-module.schema.json",
  "lesson": {
    "id": "lesson-uk-A2-03",
    "moduleId": "mod-uk-A2-03",
    "languagePair": "l2-uk-en",
    "subject": "language",
    "owner": "curricula-opus",
    "visibility": "public",
    "language": "uk",
    "targetLevel": "A2",
    "phase": "A2.1",
    "moduleNumber": 3,
    "moduleType": "grammar",
    "pedagogy": "PPP",
    "immersionLevel": 0.4,
    "title": "Dative Verbs",
    "titleUk": null,
    "subtitle": "Helping, Thanking, and Believing",
    "description": "Learner can identify verbs that require only dative objects",
    "objectives": [
      "Learner can identify verbs that require only dative objects",
      "Learner can use verbs with dative + accusative objects",
      "Learner can distinguish between dative-only and dative+accusative verbs",
      "Learner can express feelings and states using dative constructions"
    ],
    "objectivesUk": null,
    "grammarFocus": [
      "verbs with dative",
      "dative-only verbs",
      "dative + accusative verbs"
    ],
    "tags": [
      "grammar",
      "verbs",
      "dative",
      "case government"
    ],
    "totalDuration": "60 min",
    "transliterationMode": "none",
    "sections": [
      {
        "id": "section-1",
        "name": "Introduction",
        "nameEn": null,
        "type": "intro",
        "content": "In this module, you'll discover which Ukrainian verbs require the Dative case â€” these are verbs of helping, thanking, believing, and trusting. Understanding verb \"case government\" (which case a verb requires) is essential for speaking Ukrainian correctly.\n\n**What you'll learn:**\n- **Dative-only verbs** that always take Dative objects: Ð´Ð¾Ð¿Ð¾Ð¼Ð°Ð³Ð°Ñ‚Ð¸, Ð·Ð°Ð²Ð°Ð¶Ð°Ñ‚Ð¸, Ð¿Ð¾Ð´Ð¾Ð±Ð°Ñ‚Ð¸ÑÑ, Ð²Ñ–Ñ€Ð¸Ñ‚Ð¸, Ð´Ð¾Ð²Ñ–Ñ€ÑÑ‚Ð¸, Ð´ÑÐºÑƒÐ²Ð°Ñ‚Ð¸\n- **Dative + Accusative verbs** that need both a recipient and a thing: Ð´Ð°Ð²Ð°Ñ‚Ð¸, Ð¿Ð¾ÐºÐ°Ð·ÑƒÐ²Ð°Ñ‚Ð¸, Ð¿Ð¾ÑÑÐ½ÑŽÐ²Ð°Ñ‚Ð¸\n- **Dative + Infinitive patterns** for permission and prohibition: Ð´Ð¾Ð·Ð²Ð¾Ð»ÑÑ‚Ð¸, Ð·Ð°Ð±Ð¾Ñ€Ð¾Ð½ÑÑ‚Ð¸\n- The special structure of **Ð¿Ð¾Ð´Ð¾Ð±Ð°Ñ‚Ð¸ÑÑ** â€” where English says \"I like coffee,\" Ukrainian says \"Coffee pleases to me\"\n\n**Why this matters:**\nEnglish uses the same direct object for \"I help my mother\" and \"I see my mother.\" But Ukrainian distinguishes them by case: Ð¯ Ð´Ð¾Ð¿Ð¾Ð¼Ð°Ð³Ð°ÑŽ Ð¼Ð°Ð¼Ñ– (Dative â€” helping is directed TO someone) vs. Ð¯ Ð±Ð°Ñ‡Ñƒ Ð¼Ð°Ð¼Ñƒ (Accusative â€” seeing affects someone directly)."
      },
      {
        "id": "section-2",
        "name": "Warm-up",
        "nameEn": null,
        "type": "content",
        "content": "Ð’Ð¸ Ð²Ð¶Ðµ Ð·Ð½Ð°Ñ”Ñ‚Ðµ, ÑÐº ÑƒÑ‚Ð²Ð¾Ñ€ÑŽÐ²Ð°Ñ‚Ð¸ Ð´Ð°Ð²Ð°Ð»ÑŒÐ½Ð¸Ð¹ Ð²Ñ–Ð´Ð¼Ñ–Ð½Ð¾Ðº Ð·Ð°Ð¹Ð¼ÐµÐ½Ð½Ð¸ÐºÑ–Ð² Ñ– Ñ–Ð¼ÐµÐ½Ð½Ð¸ÐºÑ–Ð². Ð¢ÐµÐ¿ÐµÑ€ Ñ‡Ð°Ñ Ð´Ñ–Ð·Ð½Ð°Ñ‚Ð¸ÑÑ, ÑÐºÑ– Ð´Ñ–Ñ”ÑÐ»Ð¾Ð²Ð° \"Ð»ÑŽÐ±Ð»ÑÑ‚ÑŒ\" Ð´Ð°Ð²Ð°Ð»ÑŒÐ½Ð¸Ð¹ Ð²Ñ–Ð´Ð¼Ñ–Ð½Ð¾Ðº!\n\nSome verbs in Ukrainian are \"dative-hungry\" â€” they always need a dative object. When you help someone, you Ð´Ð¾Ð¿Ð¾Ð¼Ð°Ð³Ð°Ñ”Ñˆ **ÐºÐ¾Ð¼ÑƒÑÑŒ** (help *to someone*). When you believe someone, you Ð²Ñ–Ñ€Ð¸Ñˆ **ÐºÐ¾Ð¼ÑƒÑÑŒ** (believe *to someone*). The dative is built into how these verbs work.\n\nThink about English: \"I help my mother\" uses a direct object. But Ukrainian says \"I help *to* my mother\" â€” Ð¯ Ð´Ð¾Ð¿Ð¾Ð¼Ð°Ð³Ð°ÑŽ Ð¼Ð°Ð¼Ñ–.\n\n> [!resources] ðŸ”— External Resources\n>\n> **YouTube:** [10 Ukrainian Verbs that take Dative Case...](https://www.youtube.com/watch?v=pZvCMMjtAo0) â€” Let's Learn Ukrainian\n>\n> **Grammar Guide:** [Ukrainian Cases Overview](https://www.ukrainianlessons.com/intro-cases/) â€” All 7 cases explained\n>\n> **Interactive:** [Talk Ukrainian - Cases](https://talkukrainian.com/grammatical-cases/) â€” Practice exercises\n\n---"
      },
      {
        "id": "section-3",
        "name": "Presentation",
        "nameEn": null,
        "type": "content",
        "content": "## Dative-Only Verbs\n\nIn Ukrainian, certain verbs are fundamentally different from their English equivalents â€” they always require a dative object rather than a direct object. This is called \"case government\" and means the verb itself determines which case its object must take.\n\nFor English speakers, this requires a mental shift. You might think \"I help my mother\" has a direct object, but Ukrainian conceptualizes this as \"I help *to* my mother.\" The action is directed toward someone, making the dative case natural.\n\nThese verbs ALWAYS require a dative object â€” they cannot take an accusative:\n\n| Verb | Meaning | Example |\n|------|---------|---------|\n| Ð´Ð¾Ð¿Ð¾Ð¼Ð°Ð³Ð°Ñ‚Ð¸ | to help | Ð¯ Ð´Ð¾Ð¿Ð¾Ð¼Ð°Ð³Ð°ÑŽ Ð¼Ð°Ð¼Ñ–. |\n| Ð·Ð°Ð²Ð°Ð¶Ð°Ñ‚Ð¸ | to bother/disturb | ÐœÑƒÐ·Ð¸ÐºÐ° Ð·Ð°Ð²Ð°Ð¶Ð°Ñ” ÑÑƒÑÑ–Ð´Ð°Ð¼. |\n| Ð¿Ð¾Ð´Ð¾Ð±Ð°Ñ‚Ð¸ÑÑ | to please/be liked | ÐœÐµÐ½Ñ– Ð¿Ð¾Ð´Ð¾Ð±Ð°Ñ”Ñ‚ÑŒÑÑ Ñ†Ñ ÐºÐ½Ð¸Ð³Ð°. |\n| Ð²Ñ–Ñ€Ð¸Ñ‚Ð¸ | to believe | Ð¯ Ð²Ñ–Ñ€ÑŽ Ð´Ñ€ÑƒÐ³Ð¾Ð²Ñ–. |\n| Ð´Ð¾Ð²Ñ–Ñ€ÑÑ‚Ð¸ | to trust | ÐœÐ¸ Ð´Ð¾Ð²Ñ–Ñ€ÑÑ”Ð¼Ð¾ Ð»Ñ–ÐºÐ°Ñ€ÐµÐ²Ñ–. |\n| Ð´ÑÐºÑƒÐ²Ð°Ñ‚Ð¸ | to thank | Ð”ÑÐºÑƒÑŽ Ð²Ñ‡Ð¸Ñ‚ÐµÐ»ÐµÐ²Ñ–! |\n| Ð²Ð¸Ð±Ð°Ñ‡Ð°Ñ‚Ð¸ | to forgive | Ð¯ Ð²Ð¸Ð±Ð°Ñ‡Ð°ÑŽ Ñ‚Ð¾Ð±Ñ–. |\n| Ð·Ð°Ð·Ð´Ñ€Ð¸Ñ‚Ð¸ | to envy | Ð’Ð¾Ð½Ð° Ð·Ð°Ð·Ð´Ñ€Ð¸Ñ‚ÑŒ Ð¿Ð¾Ð´Ñ€ÑƒÐ·Ñ–. |\n| ÑÐ¸Ð¼Ð¿Ð°Ñ‚Ð¸Ð·ÑƒÐ²Ð°Ñ‚Ð¸ | to sympathize | Ð¯ ÑÐ¸Ð¼Ð¿Ð°Ñ‚Ð¸Ð·ÑƒÑŽ Ñ†Ñ–Ð¹ Ñ–Ð´ÐµÑ—. |\n| ÑÐ¿Ñ–Ð²Ñ‡ÑƒÐ²Ð°Ñ‚Ð¸ | to feel for | ÐœÐ¸ ÑÐ¿Ñ–Ð²Ñ‡ÑƒÐ²Ð°Ñ”Ð¼Ð¾ Ñ€Ð¾Ð´Ð¸Ð½Ñ–. |\n\n> [!tip] ÐŸÐ¾Ð´Ð¾Ð±Ð°Ñ‚Ð¸ÑÑ â€” A Special Verb That Flips the Sentence\n> In English, \"I like the book\" makes \"I\" the subject and \"book\" the object. Ukrainian flips this completely! \"The book pleases *to me*\" â€” ÐšÐ½Ð¸Ð³Ð° Ð¿Ð¾Ð´Ð¾Ð±Ð°Ñ”Ñ‚ÑŒÑÑ **Ð¼ÐµÐ½Ñ–**. The thing liked becomes the grammatical subject (nominative case), and the person experiencing the liking is in the dative case.\n>\n> **Think of it this way:** In Ukrainian, you don't actively \"do\" liking â€” rather, things please YOU. This passive experience is expressed with dative.\n\n### The ÐŸÐ¾Ð´Ð¾Ð±Ð°Ñ‚Ð¸ÑÑ Pattern\n\nThis verb deserves special attention because it flips the typical English sentence structure. Rather than saying \"I like coffee,\" Ukrainian says \"Coffee is pleasing to me.\" The experiencer (the person doing the liking) goes in the dative case, while the thing being liked becomes the grammatical subject.\n\n| English | Ukrainian | Word Order |\n|---------|-----------|------------|\n| I like coffee | ÐœÐµÐ½Ñ– Ð¿Ð¾Ð´Ð¾Ð±Ð°Ñ”Ñ‚ÑŒÑÑ ÐºÐ°Ð²Ð° | Dative + verb + subject |\n| You like music | Ð¢Ð¾Ð±Ñ– Ð¿Ð¾Ð´Ð¾Ð±Ð°Ñ”Ñ‚ÑŒÑÑ Ð¼ÑƒÐ·Ð¸ÐºÐ° | Dative + verb + subject |\n| He likes this film | Ð™Ð¾Ð¼Ñƒ Ð¿Ð¾Ð´Ð¾Ð±Ð°Ñ”Ñ‚ÑŒÑÑ Ñ†ÐµÐ¹ Ñ„Ñ–Ð»ÑŒÐ¼ | Dative + verb + subject |\n\nÐœÐµÐ½Ñ– Ð¿Ð¾Ð´Ð¾Ð±Ð°ÑŽÑ‚ÑŒÑÑ Ñ†Ñ– ÐºÐ½Ð¸Ð³Ð¸. (I like these books.)\nÐ‡Ð¹ Ð½Ðµ Ð¿Ð¾Ð´Ð¾Ð±Ð°Ñ”Ñ‚ÑŒÑÑ Ñ†Ñ Ñ–Ð´ÐµÑ. (She doesn't like this idea.)\nÐÐ°Ð¼ Ð¿Ð¾Ð´Ð¾Ð±Ð°Ñ”Ñ‚ÑŒÑÑ Ð£ÐºÑ€Ð°Ñ—Ð½Ð°! (We like Ukraine!)\n\n> [!example] Ð£ ÐºÑ–Ð½Ð¾Ñ‚ÐµÐ°Ñ‚Ñ€Ñ– Ð² ÐžÐ´ÐµÑÑ– (At the Cinema in Odesa)\n> â€” Ð¢Ð¾Ð±Ñ– ÑÐ¿Ð¾Ð´Ð¾Ð±Ð°Ð²ÑÑ Ñ„Ñ–Ð»ÑŒÐ¼? (Did you like the film?)\n> â€” Ð¢Ð°Ðº! ÐœÐµÐ½Ñ– Ð´ÑƒÐ¶Ðµ ÑÐ¿Ð¾Ð´Ð¾Ð±Ð°Ð»Ð°ÑÑ Ð³Ð¾Ð»Ð¾Ð²Ð½Ð° Ð³ÐµÑ€Ð¾Ñ—Ð½Ñ. (Yes! I really liked the main heroine.)\n> â€” Ð Ð¼ÐµÐ½Ñ– ÑÐ¿Ð¾Ð´Ð¾Ð±Ð°Ð»Ð°ÑÑŒ Ð¼ÑƒÐ·Ð¸ÐºÐ°. (And I liked the music.)\n> â€” ÐÐ°Ð¼ Ð¾Ð±Ð¾Ð¼ ÑÐ¿Ð¾Ð´Ð¾Ð±Ð°Ð²ÑÑ Ñ†ÐµÐ¹ Ð²ÐµÑ‡Ñ–Ñ€! (We both liked this evening!)\n\n## Verbs with Dative + Accusative\n\nMany Ukrainian verbs need two objects: something being transferred and someone receiving it. These follow the \"ditransitive\" pattern found in English sentences like \"I gave **her** a **book**.\" In Ukrainian, the recipient goes in the dative case, and the thing being transferred goes in the accusative case.\n\nThese verbs take TWO objects: a dative (recipient) and an accusative (thing):\n\n| Verb | Pattern | Example |\n|------|---------|---------|\n| Ð´Ð°Ð²Ð°Ñ‚Ð¸ | Dat + Acc | Ð¯ Ð´Ð°ÑŽ Ð¼Ð°Ð¼Ñ– ÐºÐ²Ñ–Ñ‚Ð¸. |\n| Ð´Ð°Ñ€ÑƒÐ²Ð°Ñ‚Ð¸ | Dat + Acc | Ð’Ñ–Ð½ Ð´Ð°Ñ€ÑƒÑ” Ð´Ñ–Ð²Ñ‡Ð¸Ð½Ñ– Ð¿Ð¾Ð´Ð°Ñ€ÑƒÐ½Ð¾Ðº. |\n| Ð¿Ð¾ÐºÐ°Ð·ÑƒÐ²Ð°Ñ‚Ð¸ | Dat + Acc | Ð’Ð¾Ð½Ð° Ð¿Ð¾ÐºÐ°Ð·ÑƒÑ” Ð´Ñ€ÑƒÐ·ÑÐ¼ Ñ„Ð¾Ñ‚Ð¾. |\n| Ð¿Ð¾ÑÑÐ½ÑŽÐ²Ð°Ñ‚Ð¸ | Dat + Acc | Ð’Ñ‡Ð¸Ñ‚ÐµÐ»ÑŒ Ð¿Ð¾ÑÑÐ½ÑŽÑ” ÑƒÑ‡Ð½ÑÐ¼ Ð¿Ñ€Ð°Ð²Ð¸Ð»Ð¾. |\n| Ñ€Ð¾Ð·Ð¿Ð¾Ð²Ñ–Ð´Ð°Ñ‚Ð¸ | Dat + Acc | Ð‘Ð°Ð±ÑƒÑÑ Ñ€Ð¾Ð·Ð¿Ð¾Ð²Ñ–Ð´Ð°Ñ” Ð´Ñ–Ñ‚ÑÐ¼ ÐºÐ°Ð·ÐºÑƒ. |\n| Ð¿Ð¾ÑÐ¸Ð»Ð°Ñ‚Ð¸ | Dat + Acc | ÐœÐ¸ Ð¿Ð¾ÑÐ¸Ð»Ð°Ñ”Ð¼Ð¾ Ð±Ð°Ñ‚ÑŒÐºÐ°Ð¼ Ð»Ð¸ÑÑ‚Ð°. |\n| Ð¿Ð¸ÑÐ°Ñ‚Ð¸ | Dat + Acc | Ð¯ Ð¿Ð¸ÑˆÑƒ Ð´Ñ€ÑƒÐ³Ð¾Ð²Ñ– Ð¿Ð¾Ð²Ñ–Ð´Ð¾Ð¼Ð»ÐµÐ½Ð½Ñ. |\n| Ñ€Ð°Ð´Ð¸Ñ‚Ð¸ | Dat + Acc | Ð›Ñ–ÐºÐ°Ñ€ Ñ€Ð°Ð´Ð¸Ñ‚ÑŒ Ð¿Ð°Ñ†Ñ–Ñ”Ð½Ñ‚Ð¾Ð²Ñ– Ð»Ñ–ÐºÐ¸. |\n\n> [!info] Word Order Flexibility â€” Cases Set You Free\n> In Ukrainian, word order is remarkably flexible because case endings do the work of showing grammatical relationships. You can emphasize different elements by moving them to sentence-initial position:\n> - **Ð¯ Ð´Ð°ÑŽ Ð¼Ð°Ð¼Ñ– ÐºÐ²Ñ–Ñ‚Ð¸.** (neutral statement)\n> - **ÐœÐ°Ð¼Ñ– Ñ Ð´Ð°ÑŽ ÐºÐ²Ñ–Ñ‚Ð¸.** (emphasis: it's specifically to MOM I give flowers)\n> - **ÐšÐ²Ñ–Ñ‚Ð¸ Ñ Ð´Ð°ÑŽ Ð¼Ð°Ð¼Ñ–.** (emphasis: FLOWERS are what I give to mom)\n>\n> In English, changing word order often changes meaning or creates ungrammatical sentences. In Ukrainian, the case endings (Ð¼Ð°Ð¼Ñ– = dative, ÐºÐ²Ñ–Ñ‚Ð¸ = accusative) guarantee clarity regardless of order. This flexibility is one of the beautiful features of Ukrainian grammar!\n\n### The Double Object Pattern\n\nThink of these as \"transfer\" verbs â€” something moves from one person to another:\n\n| Subject | Verb | Dative (recipient) | Accusative (thing) |\n|---------|------|-------------------|-------------------|\n| Ð¯ | Ð´Ð°ÑŽ | Ð¼Ð°Ð¼Ñ– | ÐºÐ½Ð¸Ð³Ñƒ |\n| Ð’Ñ–Ð½ | Ð¿Ð¾ÐºÐ°Ð·ÑƒÑ” | Ð´Ñ€ÑƒÐ³Ð¾Ð²Ñ– | Ñ„Ð¾Ñ‚Ð¾ |\n| ÐœÐ¸ | Ð¿Ð¾ÑÑÐ½ÑŽÑ”Ð¼Ð¾ | ÑƒÑ‡Ð½ÑÐ¼ | Ð¿Ñ€Ð°Ð²Ð¸Ð»Ð¾ |\n\nÐ‘Ð°Ñ‚ÑŒÐºÐ¾ Ñ‡Ð¸Ñ‚Ð°Ñ” Ð´Ñ–Ñ‚ÑÐ¼ ÐºÐ°Ð·ÐºÑƒ. (Father reads the children a story.)\nÐžÑ„Ñ–Ñ†Ñ–Ð°Ð½Ñ‚ Ð¿Ñ€Ð¸Ð½Ð¾ÑÐ¸Ñ‚ÑŒ Ð³Ð¾ÑÑ‚ÑÐ¼ Ð¼ÐµÐ½ÑŽ. (The waiter brings the guests a menu.)\nÐ¯ Ð¿Ð¸ÑˆÑƒ Ð±Ð°Ð±ÑƒÑÑ– Ð»Ð¸ÑÑ‚Ð° ÐºÐ¾Ð¶Ð½Ð¾Ð³Ð¾ Ñ‚Ð¸Ð¶Ð½Ñ. (I write grandma a letter every week.)\n\n## Verbs of Permission and Prohibition\n\nThese verbs take a dative person + infinitive action:\n\n| Verb | Meaning | Pattern |\n|------|---------|---------|\n| Ð´Ð¾Ð·Ð²Ð¾Ð»ÑÑ‚Ð¸ | to allow | Dat + Inf |\n| Ð·Ð°Ð±Ð¾Ñ€Ð¾Ð½ÑÑ‚Ð¸ | to forbid | Dat + Inf |\n| Ð·Ð°Ð²Ð°Ð¶Ð°Ñ‚Ð¸ | to prevent | Dat + Inf |\n| Ð´Ð¾Ð¿Ð¾Ð¼Ð°Ð³Ð°Ñ‚Ð¸ | to help | Dat + Inf |\n\nÐœÐ°Ð¼Ð° Ð´Ð¾Ð·Ð²Ð¾Ð»ÑÑ” Ð´Ñ–Ñ‚ÑÐ¼ Ð³Ñ€Ð°Ñ‚Ð¸ÑÑ. (Mom allows the children to play.)\nÐ›Ñ–ÐºÐ°Ñ€ Ð·Ð°Ð±Ð¾Ñ€Ð¾Ð½ÑÑ” Ð¿Ð°Ñ†Ñ–Ñ”Ð½Ñ‚Ð¾Ð²Ñ– ÐºÑƒÑ€Ð¸Ñ‚Ð¸. (The doctor forbids the patient to smoke.)\nÐ”Ð¾Ñ‰ Ð·Ð°Ð²Ð°Ð¶Ð°Ñ” Ð½Ð°Ð¼ Ð³ÑƒÐ»ÑÑ‚Ð¸. (Rain prevents us from walking.)\nÐ¯ Ð´Ð¾Ð¿Ð¾Ð¼Ð°Ð³Ð°ÑŽ Ð±Ñ€Ð°Ñ‚Ð¾Ð²Ñ– Ð²Ñ‡Ð¸Ñ‚Ð¸ÑÑ. (I help my brother study.)\n\n> [!warning] Common Mistake: Forgetting the Dative\n> A very common error for English speakers is using accusative instead of dative with these verbs. This happens because English uses direct objects (\"I help my mother\") where Ukrainian uses dative (\"I help to my mother\").\n>\n> **Watch out for this pattern:**\n> - âŒ Ð¯ Ð´Ð¾Ð¿Ð¾Ð¼Ð°Ð³Ð°ÑŽ Ð¼Ð°Ð¼Ñƒ. (wrong â€” accusative)\n> - âœ… Ð¯ Ð´Ð¾Ð¿Ð¾Ð¼Ð°Ð³Ð°ÑŽ Ð¼Ð°Ð¼Ñ–. (correct â€” dative)\n> - âŒ Ð¯ Ð²Ñ–Ñ€ÑŽ Ñ‚ÐµÐ±Ðµ. (wrong â€” accusative)\n> - âœ… Ð¯ Ð²Ñ–Ñ€ÑŽ Ñ‚Ð¾Ð±Ñ–. (correct â€” dative)\n>\n> The verb determines the case â€” these verbs ALWAYS require dative, no exceptions!\n\n---"
      },
      {
        "id": "section-4",
        "name": "Cultural Insight",
        "nameEn": null,
        "type": "content",
        "content": "Understanding how Ukrainians express gratitude and ask for forgiveness reveals deeper cultural values. The verbs in this section â€” Ð´ÑÐºÑƒÐ²Ð°Ñ‚Ð¸ (to thank), Ð²Ð¸Ð±Ð°Ñ‡Ð°Ñ‚Ð¸ (to excuse), and Ð¿Ñ€Ð¾Ð±Ð°Ñ‡Ð°Ñ‚Ð¸ (to forgive) â€” all take Dative objects, reflecting the idea that these acts are directed TO someone.\n\n## Ð”ÑÐºÑƒÐ²Ð°Ñ‚Ð¸ â€” The Art of Thanking\n\nUkrainians have a rich culture of expressing gratitude, and the language provides multiple ways to thank someone with varying levels of formality and warmth. The verb Ð´ÑÐºÑƒÐ²Ð°Ñ‚Ð¸ always takes a Dative object â€” the person being thanked.\n\nÐ”ÑÐºÑƒÐ²Ð°Ñ‚Ð¸ takes the dative:\n\n| Expression | Meaning | Formality |\n|------------|---------|-----------|\n| Ð”ÑÐºÑƒÑŽ! | Thanks! | neutral |\n| Ð”ÑÐºÑƒÑŽ Ñ‚Ð¾Ð±Ñ–! | Thank you! | informal |\n| Ð”ÑÐºÑƒÑŽ Ð²Ð°Ð¼! | Thank you! | formal/plural |\n| Ð©Ð¸Ñ€Ð¾ Ð´ÑÐºÑƒÑŽ! | Heartfelt thanks! | warm |\n| Ð”ÑƒÐ¶Ðµ Ð´ÑÐºÑƒÑŽ! | Thank you very much! | emphatic |\n\nÐ”ÑÐºÑƒÑŽ Ð»Ñ–ÐºÐ°Ñ€ÐµÐ²Ñ– Ð·Ð° Ð´Ð¾Ð¿Ð¾Ð¼Ð¾Ð³Ñƒ. (Thank the doctor for help.)\nÐ”ÑÐºÑƒÑ”Ð¼Ð¾ Ð²Ñ‡Ð¸Ñ‚ÐµÐ»ÐµÐ²Ñ– Ð·Ð° ÑƒÑ€Ð¾Ðº. (We thank the teacher for the lesson.)\n\n> [!tip] Ð”ÑÐºÑƒÑŽ vs. Ð¡Ð¿Ð°ÑÐ¸Ð±Ñ– â€” When to use each\n> Both words mean \"thank you,\" but they have different origins and connotations:\n> - **Ð”ÑÐºÑƒÑŽ** â€” the native Ukrainian word, derived from an ancient Slavic root meaning \"to give thanks.\" Preferred in formal contexts, written Ukrainian, and official speech.\n> - **Ð¡Ð¿Ð°ÑÐ¸Ð±Ñ–** â€” derived from the phrase \"ÑÐ¿Ð°ÑÐ¸ Ð‘Ð¾Ð¶Ðµ\" (may God save/bless you). More casual and commonly used in everyday conversation.\n>\n> In professional settings, academic environments, and when writing, Ukrainians tend to prefer Ð´ÑÐºÑƒÑŽ. Among friends and family, ÑÐ¿Ð°ÑÐ¸Ð±Ñ– is perfectly natural.\n\n## Ð’Ð¸Ð±Ð°Ñ‡Ð°Ñ‚Ð¸ Ñ– ÐŸÑ€Ð¾Ð±Ð°Ñ‡Ð°Ñ‚Ð¸ â€” Two Levels of Forgiveness\n\nUkrainian distinguishes between two levels of forgiveness, each with its own verb. Both take Dative objects â€” the person being forgiven. Understanding this distinction helps you choose the right word for the situation.\n\n- **Ð²Ð¸Ð±Ð°Ñ‡Ð°Ñ‚Ð¸** â€” to excuse, forgive (for minor things like bumping into someone, being late, or small mistakes)\n- **Ð¿Ñ€Ð¾Ð±Ð°Ñ‡Ð°Ñ‚Ð¸** â€” to forgive (for serious offenses that hurt someone deeply, betrayals, or major wrongdoing)\n\nÐ’Ð¸Ð±Ð°Ñ‡Ñ‚Ðµ Ð¼ÐµÐ½Ñ–! (Excuse me!)\nÐ¯ Ð²Ð¸Ð±Ð°Ñ‡Ð°ÑŽ Ñ‚Ð¾Ð±Ñ– Ñ†ÑŽ Ð¿Ð¾Ð¼Ð¸Ð»ÐºÑƒ. (I forgive you this mistake.)\nÐ§Ð¸ Ð¼Ð¾Ð¶ÐµÑˆ Ñ‚Ð¸ Ð¿Ñ€Ð¾Ð±Ð°Ñ‡Ð¸Ñ‚Ð¸ Ð¼ÐµÐ½Ñ–? (Can you forgive me?)\n\n> [!note] Language Evolution and Cultural Values\n> The distinction between Ð²Ð¸Ð±Ð°Ñ‡Ð°Ñ‚Ð¸ and Ð¿Ñ€Ð¾Ð±Ð°Ñ‡Ð°Ñ‚Ð¸ reflects deeper cultural values embedded in the Ukrainian language. Ukrainian traditionally reserves stronger, more emotionally weighted words for serious matters, while using lighter variants for everyday situations.\n>\n> This careful gradation of meaning shows how the language encourages thoughtful, measured communication about sensitive topics like forgiveness. You wouldn't use Ð¿Ñ€Ð¾Ð±Ð°Ñ‡Ð°Ñ‚Ð¸ for stepping on someone's toe â€” that would feel dramatically out of proportion. Conversely, using Ð²Ð¸Ð±Ð°Ñ‡Ð°Ñ‚Ð¸ for a serious betrayal would seem dismissive.\n>\n> Learning to choose the right word for the situation is part of developing cultural fluency, not just grammatical accuracy.\n\n> [!example] Ð Ð¾Ð´Ð¸Ð½Ð½Ð° ÑÑ†ÐµÐ½Ð° Ð² Ð¥Ð°Ñ€ÐºÐ¾Ð²Ñ– (Family Scene in Kharkiv)\n> â€” ÐœÐ°Ð¼Ð¾, Ð²Ð¸Ð±Ð°Ñ‡ Ð¼ÐµÐ½Ñ–. Ð¯ Ñ€Ð¾Ð·Ð±Ð¸Ð² Ñ‚Ð²Ð¾ÑŽ Ð²Ð°Ð·Ñƒ. (Mom, excuse me. I broke your vase.)\n> â€” Ð¢Ð¸ Ð·Ð½Ð°Ñ”Ñˆ, ÑÐº Ñ Ð»ÑŽÐ±Ð»ÑŽ Ñ†ÑŽ Ð²Ð°Ð·Ñƒ! (You know how I love that vase!)\n> â€” Ð¯ Ð´ÑƒÐ¶Ðµ ÑˆÐºÐ¾Ð´ÑƒÑŽ. Ð¢Ð¸ Ð¿Ñ€Ð¾Ð±Ð°Ñ‡Ð°Ñ”Ñˆ Ð¼ÐµÐ½Ñ–? (I'm very sorry. Do you forgive me?)\n> â€” Ð—Ð²Ð¸Ñ‡Ð°Ð¹Ð½Ð¾ Ð¿Ñ€Ð¾Ð±Ð°Ñ‡Ð°ÑŽ. Ð¢Ð¸ Ð¼Ñ–Ð¹ ÑÐ¸Ð½. (Of course I forgive you. You're my son.)\n\n---"
      },
      {
        "id": "section-5",
        "name": "Practice",
        "nameEn": null,
        "type": "practice",
        "content": "Now let's practice using Dative verbs in context. The key skill is identifying whether a verb takes Dative alone or needs both Dative and Accusative objects.\n\n**Quick reference:**\n- **Dative only:** Ð´Ð¾Ð¿Ð¾Ð¼Ð°Ð³Ð°Ñ‚Ð¸, Ð·Ð°Ð²Ð°Ð¶Ð°Ñ‚Ð¸, Ð¿Ð¾Ð´Ð¾Ð±Ð°Ñ‚Ð¸ÑÑ, Ð²Ñ–Ñ€Ð¸Ñ‚Ð¸, Ð´Ð¾Ð²Ñ–Ñ€ÑÑ‚Ð¸, Ð´ÑÐºÑƒÐ²Ð°Ñ‚Ð¸ â€” the verb only needs a recipient\n- **Dative + Accusative:** Ð´Ð°Ð²Ð°Ñ‚Ð¸, Ð¿Ð¾ÐºÐ°Ð·ÑƒÐ²Ð°Ñ‚Ð¸, Ð¿Ð¾ÑÑÐ½ÑŽÐ²Ð°Ñ‚Ð¸, Ñ€Ð¾Ð·Ð¿Ð¾Ð²Ñ–Ð´Ð°Ñ‚Ð¸ â€” the verb needs both a recipient AND a thing being transferred\n\n## Dative-Only or Dative + Accusative?\n\nClassify these verbs:\n\n| Verb | Type |\n|------|------|\n| Ð´Ð¾Ð¿Ð¾Ð¼Ð°Ð³Ð°Ñ‚Ð¸ | Dative only |\n| Ð´Ð°Ð²Ð°Ñ‚Ð¸ | Dative + Accusative |\n| Ð·Ð°Ð²Ð°Ð¶Ð°Ñ‚Ð¸ | Dative only |\n| Ð¿Ð¾ÐºÐ°Ð·ÑƒÐ²Ð°Ñ‚Ð¸ | Dative + Accusative |\n| Ð²Ñ–Ñ€Ð¸Ñ‚Ð¸ | Dative only |\n| Ð¿Ð¾ÑÑÐ½ÑŽÐ²Ð°Ñ‚Ð¸ | Dative + Accusative |\n\n## Complete the Pattern\n\n1. Ð¯ Ð´Ð¾Ð¿Ð¾Ð¼Ð°Ð³Ð°ÑŽ ___. (Ð±Ñ€Ð°Ñ‚) â†’ Ð±Ñ€Ð°Ñ‚Ð¾Ð²Ñ–\n2. Ð’Ð¾Ð½Ð° Ð´Ð°Ñ” ___ ÐºÐ½Ð¸Ð³Ñƒ. (ÑÐµÑÑ‚Ñ€Ð°) â†’ ÑÐµÑÑ‚Ñ€Ñ–\n3. ÐœÐµÐ½Ñ– Ð¿Ð¾Ð´Ð¾Ð±Ð°Ñ”Ñ‚ÑŒÑÑ ___. (Ñ†ÐµÐ¹ Ñ„Ñ–Ð»ÑŒÐ¼) â†’ Ñ†ÐµÐ¹ Ñ„Ñ–Ð»ÑŒÐ¼ (subject!)\n4. Ð’Ñ–Ð½ Ñ€Ð¾Ð·Ð¿Ð¾Ð²Ñ–Ð´Ð°Ñ” ___ ÐºÐ°Ð·ÐºÑƒ. (Ð´Ñ–Ñ‚Ð¸) â†’ Ð´Ñ–Ñ‚ÑÐ¼\n5. ÐœÐ¸ Ð´ÑÐºÑƒÑ”Ð¼Ð¾ ___. (Ð²Ñ‡Ð¸Ñ‚ÐµÐ»ÑŒ) â†’ Ð²Ñ‡Ð¸Ñ‚ÐµÐ»ÐµÐ²Ñ–\n\n## Mini-Dialogues\n\nThe following dialogues show Dative verbs in natural conversation. Notice how Ð´Ð¾Ð¿Ð¾Ð¼Ð°Ð³Ð°Ñ‚Ð¸, Ð¿Ð¾Ð´Ð¾Ð±Ð°Ñ‚Ð¸ÑÑ, Ð·Ð°Ð²Ð°Ð¶Ð°Ñ‚Ð¸, and Ñ€Ð°Ð´Ð¸Ñ‚Ð¸ all take Dative objects.\n\n**Dialogue 1: Ð£ Ð±Ñ–Ð±Ð»Ñ–Ð¾Ñ‚ÐµÑ†Ñ– (At the Library)**\n\nThis dialogue demonstrates Ð´Ð¾Ð¿Ð¾Ð¼Ð°Ð³Ð°Ñ‚Ð¸ (to help) with Dative â€” notice the librarian says \"Ð¯ Ð¿Ð¾ÐºÐ°Ð¶Ñƒ Ð²Ð°Ð¼\" (I'll show to you).\n\n**Ð£ Ð±Ñ–Ð±Ð»Ñ–Ð¾Ñ‚ÐµÑ†Ñ–:**\nâ€” Ð’Ð¸Ð±Ð°Ñ‡Ñ‚Ðµ, Ð²Ð¸ Ð¼Ð¾Ð¶ÐµÑ‚Ðµ Ð´Ð¾Ð¿Ð¾Ð¼Ð¾Ð³Ñ‚Ð¸ Ð¼ÐµÐ½Ñ–?\nâ€” Ð—Ð²Ð¸Ñ‡Ð°Ð¹Ð½Ð¾! Ð©Ð¾ Ð²Ð°Ð¼ Ð¿Ð¾Ñ‚Ñ€Ñ–Ð±Ð½Ð¾?\nâ€” Ð¯ ÑˆÑƒÐºÐ°ÑŽ ÐºÐ½Ð¸Ð³Ñƒ Ð¿Ñ€Ð¾ Ñ–ÑÑ‚Ð¾Ñ€Ñ–ÑŽ Ð£ÐºÑ€Ð°Ñ—Ð½Ð¸.\nâ€” Ð¯ Ð¿Ð¾ÐºÐ°Ð¶Ñƒ Ð²Ð°Ð¼, Ð´Ðµ Ð²Ð¾Ð½Ð° ÑÑ‚Ð¾Ñ—Ñ‚ÑŒ.\nâ€” Ð”ÑÐºÑƒÑŽ Ð²Ð°Ð¼!\n\n**Dialogue 2: ÐÐ° Ð²ÐµÑ‡Ñ–Ñ€Ñ†Ñ– (At the Party)**\n\nHere Ð·Ð°Ð²Ð°Ð¶Ð°Ñ‚Ð¸ (to bother) and Ð¿Ð¾Ð´Ð¾Ð±Ð°Ñ‚Ð¸ÑÑ (to please) both need Dative: Ñ‚Ð¾Ð±Ñ–, Ð¼ÐµÐ½Ñ–.\n\n**ÐÐ° Ð²ÐµÑ‡Ñ–Ñ€Ñ†Ñ–:**\nâ€” Ð¦Ñ Ð¼ÑƒÐ·Ð¸ÐºÐ° Ð·Ð°Ð²Ð°Ð¶Ð°Ñ” Ñ‚Ð¾Ð±Ñ–?\nâ€” ÐÑ–, Ð¼ÐµÐ½Ñ– Ð¿Ð¾Ð´Ð¾Ð±Ð°Ñ”Ñ‚ÑŒÑÑ Ñ†Ñ Ð¼ÑƒÐ·Ð¸ÐºÐ°!\nâ€” Ð¡Ð¿Ñ€Ð°Ð²Ð´Ñ–? ÐœÐµÐ½Ñ– Ð²Ð¾Ð½Ð° Ð½Ðµ Ð¿Ð¾Ð´Ð¾Ð±Ð°Ñ”Ñ‚ÑŒÑÑ.\nâ€” ÐšÐ¾Ð¶Ð½Ð¾Ð¼Ñƒ ÑÐ²Ð¾Ñ”!\n\n**Dialogue 3: Ð£ Ð»Ñ–ÐºÐ°Ñ€Ð½Ñ– (At the Hospital)**\n\nHere Ñ€Ð°Ð´Ð¸Ñ‚Ð¸ (to advise) takes Dat + Acc (recommending something TO someone), and Ð·Ð°Ð±Ð¾Ñ€Ð¾Ð½ÑÑ‚Ð¸ (to forbid) takes Dat + Inf.\n\n**Ð£ Ð»Ñ–ÐºÐ°Ñ€Ð½Ñ–:**\nâ€” Ð›Ñ–ÐºÐ°Ñ€ÑŽ, Ñ‰Ð¾ Ð²Ð¸ Ñ€Ð°Ð´Ð¸Ñ‚Ðµ Ð¼ÐµÐ½Ñ–?\nâ€” Ð¯ Ñ€Ð°Ð´Ð¶Ñƒ Ð²Ð°Ð¼ Ð²Ñ–Ð´Ð¿Ð¾Ñ‡Ð¸Ð²Ð°Ñ‚Ð¸.\nâ€” Ð’Ð¸ Ð·Ð°Ð±Ð¾Ñ€Ð¾Ð½ÑÑ”Ñ‚Ðµ Ð¼ÐµÐ½Ñ– Ð¿Ñ€Ð°Ñ†ÑŽÐ²Ð°Ñ‚Ð¸?\nâ€” Ð¢Ð°Ðº, Ñ Ð·Ð°Ð±Ð¾Ñ€Ð¾Ð½ÑÑŽ Ð²Ð°Ð¼ Ð¿Ñ€Ð°Ñ†ÑŽÐ²Ð°Ñ‚Ð¸ Ñ†ÑŒÐ¾Ð³Ð¾ Ñ‚Ð¸Ð¶Ð½Ñ.\n\n---"
      },
      {
        "id": "section-6",
        "name": "Reading Practice: Ð©Ð¾Ð´ÐµÐ½Ð½Ð¸Ðº Ð²Ñ‡Ð¸Ñ‚ÐµÐ»ÑŒÐºÐ¸",
        "nameEn": null,
        "type": "practice",
        "content": "This reading presents a teacher's diary entries over one week. Each entry uses multiple Dative verbs â€” Ð¿Ð¾ÑÑÐ½ÑŽÐ²Ð°Ñ‚Ð¸, Ð´Ð¾Ð¿Ð¾Ð¼Ð°Ð³Ð°Ñ‚Ð¸, Ð¿Ð¾ÐºÐ°Ð·ÑƒÐ²Ð°Ñ‚Ð¸, Ð´Ð¾Ð·Ð²Ð¾Ð»ÑÑ‚Ð¸, Ð·Ð°Ð±Ð¾Ñ€Ð¾Ð½ÑÑ‚Ð¸, Ð´ÑÐºÑƒÐ²Ð°Ñ‚Ð¸, Ð²Ñ–Ñ€Ð¸Ñ‚Ð¸.\n\n**Reading strategy:** As you read, underline every Dative object. Then answer the comprehension questions to verify you've found them all.\n\n**Vocabulary preview:**\n- Ð¼ÐµÑ‚Ð¾Ð´Ð¸ÐºÐ° â€” teaching method\n- Ð´Ð¸Ñ€ÐµÐºÑ‚Ð¾Ñ€ â€” principal\n- Ñ€ÐµÐ·ÑƒÐ»ÑŒÑ‚Ð°Ñ‚Ð¸ â€” results\n- ÑÑ‚Ð°Ñ€Ð°Ñ‚Ð¸ÑÑ â€” to try hard\n\n> ÐŸÐ¾Ð½ÐµÐ´Ñ–Ð»Ð¾Ðº\n> Ð¡ÑŒÐ¾Ð³Ð¾Ð´Ð½Ñ– Ñ Ð¿Ð¾ÑÑÐ½ÑŽÐ²Ð°Ð»Ð° ÑƒÑ‡Ð½ÑÐ¼ Ð½Ð¾Ð²Ñƒ Ñ‚ÐµÐ¼Ñƒ. Ð’Ð¾Ð½Ð° Ð²Ð°Ð¶ÐºÐ°, Ð°Ð»Ðµ Ñ Ð´Ð¾Ð¿Ð¾Ð¼Ð°Ð³Ð°Ð»Ð° ÐºÐ¾Ð¶Ð½Ð¾Ð¼Ñƒ ÑƒÑ‡Ð½ÐµÐ²Ñ–. ÐžÐ»ÐµÐ³ Ð½Ðµ Ñ€Ð¾Ð·ÑƒÐ¼Ñ–Ð² â€” Ñ Ð¿Ð¾ÐºÐ°Ð·ÑƒÐ²Ð°Ð»Ð° Ð¹Ð¾Ð¼Ñƒ Ð¿Ñ€Ð¸ÐºÐ»Ð°Ð´Ð¸. ÐœÐ°Ñ€Ñ–Ñ Ñ€Ð¾Ð·ÑƒÐ¼Ñ–Ð»Ð° ÑˆÐ²Ð¸Ð´ÐºÐ¾ â€” Ñ Ð´Ð¾Ð·Ð²Ð¾Ð»ÑÐ»Ð° Ñ—Ð¹ Ð´Ð¾Ð¿Ð¾Ð¼Ð°Ð³Ð°Ñ‚Ð¸ Ñ–Ð½ÑˆÐ¸Ð¼.\n>\n> Ð’Ñ–Ð²Ñ‚Ð¾Ñ€Ð¾Ðº\n> Ð‘Ð°Ñ‚ÑŒÐºÐ¸ ÐžÐ»ÐµÐ³Ð° Ñ‚ÐµÐ»ÐµÑ„Ð¾Ð½ÑƒÐ²Ð°Ð»Ð¸ Ð¼ÐµÐ½Ñ–. Ð’Ð¾Ð½Ð¸ Ð´ÑÐºÑƒÐ²Ð°Ð»Ð¸ Ð¼ÐµÐ½Ñ– Ð·Ð° Ð´Ð¾Ð¿Ð¾Ð¼Ð¾Ð³Ñƒ Ñ—Ñ…Ð½ÑŒÐ¾Ð¼Ñƒ ÑÐ¸Ð½Ð¾Ð²Ñ–. ÐœÐµÐ½Ñ– Ð¿Ñ€Ð¸Ñ”Ð¼Ð½Ð¾, ÐºÐ¾Ð»Ð¸ Ð±Ð°Ñ‚ÑŒÐºÐ¸ Ð´Ð¾Ð²Ñ–Ñ€ÑÑŽÑ‚ÑŒ Ð¼ÐµÐ½Ñ–.\n>\n> Ð¡ÐµÑ€ÐµÐ´Ð°\n> Ð¡ÑŒÐ¾Ð³Ð¾Ð´Ð½Ñ– Ñ Ð·Ð°Ð±Ð¾Ñ€Ð¾Ð½ÑÐ»Ð° ÑƒÑ‡Ð½ÑÐ¼ ÐºÐ¾Ñ€Ð¸ÑÑ‚ÑƒÐ²Ð°Ñ‚Ð¸ÑÑ Ñ‚ÐµÐ»ÐµÑ„Ð¾Ð½Ð°Ð¼Ð¸. ÐžÐ´Ð¸Ð½ ÑƒÑ‡ÐµÐ½ÑŒ Ð½Ðµ ÑÐ»ÑƒÑ…Ð°Ð² â€” Ñ†Ðµ Ð·Ð°Ð²Ð°Ð¶Ð°Ð»Ð¾ Ð²ÑÑŒÐ¾Ð¼Ñƒ ÐºÐ»Ð°ÑÑƒ. Ð¯ Ð¿Ð¾ÑÑÐ½ÑŽÐ²Ð°Ð»Ð° Ð¹Ð¾Ð¼Ñƒ Ð¿Ñ€Ð°Ð²Ð¸Ð»Ð°.\n>\n> Ð§ÐµÑ‚Ð²ÐµÑ€\n> Ð”Ð¸Ñ€ÐµÐºÑ‚Ð¾Ñ€ Ñ€Ð°Ð´Ð¸Ð² Ð¼ÐµÐ½Ñ– Ð½Ð¾Ð²Ñƒ Ð¼ÐµÑ‚Ð¾Ð´Ð¸ÐºÑƒ. Ð¯ Ð¿Ð¾ÐºÐ°Ð·ÑƒÐ²Ð°Ð»Ð° Ð¹Ð¾Ð¼Ñƒ Ñ€ÐµÐ·ÑƒÐ»ÑŒÑ‚Ð°Ñ‚Ð¸ ÑƒÑ‡Ð½Ñ–Ð². Ð’Ñ–Ð½ Ð´ÑÐºÑƒÐ²Ð°Ð² Ð¼ÐµÐ½Ñ– Ð·Ð° Ñ€Ð¾Ð±Ð¾Ñ‚Ñƒ.\n>\n> ÐŸ'ÑÑ‚Ð½Ð¸Ñ†Ñ\n> Ð£Ñ‡Ð½Ñ– Ð¿Ð¾Ð´Ð°Ñ€ÑƒÐ²Ð°Ð»Ð¸ Ð¼ÐµÐ½Ñ– ÐºÐ²Ñ–Ñ‚Ð¸! ÐœÐµÐ½Ñ– Ñ‚Ð°Ðº Ð¿Ð¾Ð´Ð¾Ð±Ð°ÑŽÑ‚ÑŒÑÑ Ð¼Ð¾Ñ— ÑƒÑ‡Ð½Ñ–! Ð¯ Ð²Ñ–Ñ€ÑŽ Ñ—Ð¼ â€” Ð²Ð¾Ð½Ð¸ ÑÑ‚Ð°Ñ€Ð°ÑŽÑ‚ÑŒÑÑ.\n\n**Questions:**\n1. ÐšÐ¾Ð¼Ñƒ Ð²Ñ‡Ð¸Ñ‚ÐµÐ»ÑŒÐºÐ° Ð¿Ð¾ÑÑÐ½ÑŽÐ²Ð°Ð»Ð° Ð½Ð¾Ð²Ñƒ Ñ‚ÐµÐ¼Ñƒ? â€” Ð£Ñ‡Ð½ÑÐ¼.\n2. ÐšÐ¾Ð¼Ñƒ Ð²Ð¾Ð½Ð° Ð´Ð¾Ð¿Ð¾Ð¼Ð°Ð³Ð°Ð»Ð°? â€” ÐšÐ¾Ð¶Ð½Ð¾Ð¼Ñƒ ÑƒÑ‡Ð½ÐµÐ²Ñ–.\n3. ÐšÐ¾Ð¼Ñƒ Ð±Ð°Ñ‚ÑŒÐºÐ¸ Ð´ÑÐºÑƒÐ²Ð°Ð»Ð¸? â€” Ð’Ñ‡Ð¸Ñ‚ÐµÐ»ÑŒÑ†Ñ–.\n4. Ð©Ð¾ Ð´Ð¸Ñ€ÐµÐºÑ‚Ð¾Ñ€ Ñ€Ð°Ð´Ð¸Ð² Ð²Ñ‡Ð¸Ñ‚ÐµÐ»ÑŒÑ†Ñ–? â€” ÐÐ¾Ð²Ñƒ Ð¼ÐµÑ‚Ð¾Ð´Ð¸ÐºÑƒ.\n5. Ð©Ð¾ ÑƒÑ‡Ð½Ñ– Ð¿Ð¾Ð´Ð°Ñ€ÑƒÐ²Ð°Ð»Ð¸ Ð²Ñ‡Ð¸Ñ‚ÐµÐ»ÑŒÑ†Ñ–? â€” ÐšÐ²Ñ–Ñ‚Ð¸.\n\n---"
      },
      {
        "id": "section-7",
        "name": "ÐŸÑ–Ð´ÑÑƒÐ¼Ð¾Ðº",
        "nameEn": null,
        "type": "summary",
        "content": "Ð£ Ñ†ÑŒÐ¾Ð¼Ñƒ Ð¼Ð¾Ð´ÑƒÐ»Ñ– Ð²Ð¸ Ð½Ð°Ð²Ñ‡Ð¸Ð»Ð¸ÑÑ:\n\n- **Dative-only verbs**: Ð´Ð¾Ð¿Ð¾Ð¼Ð°Ð³Ð°Ñ‚Ð¸, Ð·Ð°Ð²Ð°Ð¶Ð°Ñ‚Ð¸, Ð¿Ð¾Ð´Ð¾Ð±Ð°Ñ‚Ð¸ÑÑ, Ð²Ñ–Ñ€Ð¸Ñ‚Ð¸, Ð´Ð¾Ð²Ñ–Ñ€ÑÑ‚Ð¸, Ð´ÑÐºÑƒÐ²Ð°Ñ‚Ð¸, Ð²Ð¸Ð±Ð°Ñ‡Ð°Ñ‚Ð¸, Ð¿Ñ€Ð¾Ð±Ð°Ñ‡Ð°Ñ‚Ð¸, Ð·Ð°Ð·Ð´Ñ€Ð¸Ñ‚Ð¸, ÑÐ¸Ð¼Ð¿Ð°Ñ‚Ð¸Ð·ÑƒÐ²Ð°Ñ‚Ð¸, ÑÐ¿Ñ–Ð²Ñ‡ÑƒÐ²Ð°Ñ‚Ð¸\n\n- **Dative + Accusative verbs**: Ð´Ð°Ð²Ð°Ñ‚Ð¸, Ð´Ð°Ñ€ÑƒÐ²Ð°Ñ‚Ð¸, Ð¿Ð¾ÐºÐ°Ð·ÑƒÐ²Ð°Ñ‚Ð¸, Ð¿Ð¾ÑÑÐ½ÑŽÐ²Ð°Ñ‚Ð¸, Ñ€Ð¾Ð·Ð¿Ð¾Ð²Ñ–Ð´Ð°Ñ‚Ð¸, Ð¿Ð¾ÑÐ¸Ð»Ð°Ñ‚Ð¸, Ð¿Ð¸ÑÐ°Ñ‚Ð¸, Ñ€Ð°Ð´Ð¸Ñ‚Ð¸\n\n- **Dative + Infinitive verbs**: Ð´Ð¾Ð·Ð²Ð¾Ð»ÑÑ‚Ð¸, Ð·Ð°Ð±Ð¾Ñ€Ð¾Ð½ÑÑ‚Ð¸, Ð·Ð°Ð²Ð°Ð¶Ð°Ñ‚Ð¸, Ð´Ð¾Ð¿Ð¾Ð¼Ð°Ð³Ð°Ñ‚Ð¸\n\n- **The Ð¿Ð¾Ð´Ð¾Ð±Ð°Ñ‚Ð¸ÑÑ pattern**: ÐœÐµÐ½Ñ– Ð¿Ð¾Ð´Ð¾Ð±Ð°Ñ”Ñ‚ÑŒÑÑ ÐºÐ°Ð²Ð° (not \"Ð¯ Ð¿Ð¾Ð´Ð¾Ð±Ð°ÑŽ ÐºÐ°Ð²Ñƒ\")\n\n- **Expressing gratitude**: Ð”ÑÐºÑƒÑŽ Ñ‚Ð¾Ð±Ñ–! Ð”ÑÐºÑƒÑŽ Ð²Ð°Ð¼! Ð©Ð¸Ñ€Ð¾ Ð´ÑÐºÑƒÑŽ!\n\n- **Asking forgiveness**: Ð’Ð¸Ð±Ð°Ñ‡Ñ‚Ðµ Ð¼ÐµÐ½Ñ–! ÐŸÑ€Ð¾Ð±Ð°Ñ‡Ð°Ñ”Ñˆ Ð¼ÐµÐ½Ñ–?\n\nÐ¢ÐµÐ¿ÐµÑ€ Ð²Ð¸ Ð¼Ð¾Ð¶ÐµÑ‚Ðµ Ð´Ð¾Ð¿Ð¾Ð¼Ð°Ð³Ð°Ñ‚Ð¸, Ð´ÑÐºÑƒÐ²Ð°Ñ‚Ð¸, Ð´Ð¾Ð²Ñ–Ñ€ÑÑ‚Ð¸ Ñ– Ð²Ð¸Ð±Ð°Ñ‡Ð°Ñ‚Ð¸ â€” Ð²ÑÐµ Ð· Ð¿Ñ€Ð°Ð²Ð¸Ð»ÑŒÐ½Ð¸Ð¼ Ð´Ð°Ð²Ð°Ð»ÑŒÐ½Ð¸Ð¼ Ð²Ñ–Ð´Ð¼Ñ–Ð½ÐºÐ¾Ð¼!"
      },
      {
        "id": "section-8",
        "name": "Activities",
        "nameEn": null,
        "type": "activities",
        "content": "The following activities will help you master Dative verb patterns. Progress through matching (recognition), fill-in (controlled production), and translation (free production) to build your skills.\n\n**Success tip:** Before choosing an answer, identify whether the verb takes:\n- Dative only (Ð´Ð¾Ð¿Ð¾Ð¼Ð°Ð³Ð°Ñ‚Ð¸, Ð²Ñ–Ñ€Ð¸Ñ‚Ð¸, Ð´ÑÐºÑƒÐ²Ð°Ñ‚Ð¸)\n- Dative + Accusative (Ð´Ð°Ð²Ð°Ñ‚Ð¸, Ð¿Ð¾ÐºÐ°Ð·ÑƒÐ²Ð°Ñ‚Ð¸, Ð¿Ð¾ÑÑÐ½ÑŽÐ²Ð°Ñ‚Ð¸)\n- Dative + Infinitive (Ð´Ð¾Ð·Ð²Ð¾Ð»ÑÑ‚Ð¸, Ð·Ð°Ð±Ð¾Ñ€Ð¾Ð½ÑÑ‚Ð¸)\n\n## match-up: Verb + Dative Pattern\n\n- Ð´Ð¾Ð¿Ð¾Ð¼Ð°Ð³Ð°Ñ‚Ð¸ :: to help someone (Dat only)\n- Ð´Ð°Ð²Ð°Ñ‚Ð¸ :: to give something to someone (Dat + Acc)\n- Ð·Ð°Ð²Ð°Ð¶Ð°Ñ‚Ð¸ :: to bother someone (Dat only)\n- Ð¿Ð¾ÐºÐ°Ð·ÑƒÐ²Ð°Ñ‚Ð¸ :: to show something to someone (Dat + Acc)\n- Ð¿Ð¾Ð´Ð¾Ð±Ð°Ñ‚Ð¸ÑÑ :: to please someone (Dat only)\n- Ð¿Ð¾ÑÑÐ½ÑŽÐ²Ð°Ñ‚Ð¸ :: to explain something to someone (Dat + Acc)\n- Ð²Ñ–Ñ€Ð¸Ñ‚Ð¸ :: to believe someone (Dat only)\n- Ð´ÑÐºÑƒÐ²Ð°Ñ‚Ð¸ :: to thank someone (Dat only)\n- Ñ€Ð°Ð´Ð¸Ñ‚Ð¸ :: to advise someone something (Dat + Acc)\n- Ð´Ð¾Ð²Ñ–Ñ€ÑÑ‚Ð¸ :: to trust someone (Dat only)\n- Ð·Ð°Ð±Ð¾Ñ€Ð¾Ð½ÑÑ‚Ð¸ :: to forbid someone (Dat + Inf)\n- Ð´Ð¾Ð·Ð²Ð¾Ð»ÑÑ‚Ð¸ :: to allow someone (Dat + Inf)\n\n## fill-in: Choose the Correct Form\n\n> Complete each sentence with the correct verb form.\n\n1. Ð¯ ___ Ð¼Ð°Ð¼Ñ– Ð³Ð¾Ñ‚ÑƒÐ²Ð°Ñ‚Ð¸ Ð¾Ð±Ñ–Ð´.\n   > [!answer] Ð´Ð¾Ð¿Ð¾Ð¼Ð°Ð³Ð°ÑŽ\n   > [!options] Ð´Ð¾Ð¿Ð¾Ð¼Ð°Ð³Ð°ÑŽ | Ð´Ð¾Ð¿Ð¾Ð¼Ð°Ð³Ð°Ñ‚Ð¸ | Ð´Ð¾Ð¿Ð¾Ð¼Ð°Ð³Ð°Ñ”\n\n2. Ð¦Ñ Ð¼ÑƒÐ·Ð¸ÐºÐ° ___ Ð¼ÐµÐ½Ñ– ÑÐ¿Ð°Ñ‚Ð¸.\n   > [!answer] Ð·Ð°Ð²Ð°Ð¶Ð°Ñ”\n   > [!options] Ð·Ð°Ð²Ð°Ð¶Ð°Ñ” | Ð·Ð°Ð²Ð°Ð¶Ð°Ñ‚Ð¸ | Ð·Ð°Ð²Ð°Ð¶Ð°ÑŽ\n\n3. ÐœÐµÐ½Ñ– ___ Ñ†ÐµÐ¹ Ñ„Ñ–Ð»ÑŒÐ¼.\n   > [!answer] Ð¿Ð¾Ð´Ð¾Ð±Ð°Ñ”Ñ‚ÑŒÑÑ\n   > [!options] Ð¿Ð¾Ð´Ð¾Ð±Ð°Ñ”Ñ‚ÑŒÑÑ | Ð¿Ð¾Ð´Ð¾Ð±Ð°ÑŽÑÑŒ | Ð¿Ð¾Ð´Ð¾Ð±Ð°Ñ‚Ð¸ÑÑ\n\n4. Ð’Ñ–Ð½ ___ Ð´Ñ€ÑƒÐ³Ð¾Ð²Ñ– ÑÐ²Ð¾ÑŽ Ð¼Ð°ÑˆÐ¸Ð½Ñƒ.\n   > [!answer] Ð¿Ð¾ÐºÐ°Ð·ÑƒÑ”\n   > [!options] Ð¿Ð¾ÐºÐ°Ð·ÑƒÑ” | Ð¿Ð¾ÐºÐ°Ð·ÑƒÐ²Ð°Ñ‚Ð¸ | Ð¿Ð¾ÐºÐ°Ð·ÑƒÑŽÑÑŒ\n\n5. Ð’Ñ‡Ð¸Ñ‚ÐµÐ»ÑŒ ___ ÑƒÑ‡Ð½ÑÐ¼ Ð½Ð¾Ð²Ðµ Ð¿Ñ€Ð°Ð²Ð¸Ð»Ð¾.\n   > [!answer] Ð¿Ð¾ÑÑÐ½ÑŽÑ”\n   > [!options] Ð¿Ð¾ÑÑÐ½ÑŽÑ” | Ð¿Ð¾ÑÑÐ½ÑŽÐ²Ð°Ñ‚Ð¸ | Ð¿Ð¾ÑÑÐ½ÑŽÑ”Ñ‚ÑŒÑÑ\n\n6. Ð¯ ___ Ñ‚Ð¾Ð±Ñ– Ð·Ð° Ð´Ð¾Ð¿Ð¾Ð¼Ð¾Ð³Ñƒ!\n   > [!answer] Ð´ÑÐºÑƒÑŽ\n   > [!options] Ð´ÑÐºÑƒÑŽ | Ð´ÑÐºÑƒÐ²Ð°Ñ‚Ð¸ | Ð´ÑÐºÑƒÑŽÑÑŒ\n\n7. ÐœÐ¸ Ð½Ðµ ___ Ñ†Ñ–Ð¹ Ð»ÑŽÐ´Ð¸Ð½Ñ–.\n   > [!answer] Ð´Ð¾Ð²Ñ–Ñ€ÑÑ”Ð¼Ð¾\n   > [!options] Ð´Ð¾Ð²Ñ–Ñ€ÑÑ”Ð¼Ð¾ | Ð´Ð¾Ð²Ñ–Ñ€ÑÑ‚Ð¸ | Ð´Ð¾Ð²Ñ–Ñ€ÑÑ”Ñ‚ÑŒÑÑ\n\n8. Ð‘Ð°Ñ‚ÑŒÐºÐ¾ ___ ÑÐ¸Ð½Ð¾Ð²Ñ– Ð²Ñ‡Ð¸Ñ‚Ð¸ÑÑ ÐºÑ€Ð°Ñ‰Ðµ.\n   > [!answer] Ñ€Ð°Ð´Ð¸Ñ‚ÑŒ\n   > [!options] Ñ€Ð°Ð´Ð¸Ñ‚ÑŒ | Ñ€Ð°Ð´Ð¸Ñ‚Ð¸ | Ñ€Ð°Ð´Ð¸Ñ‚ÑŒÑÑ\n\n9. Ð›Ñ–ÐºÐ°Ñ€ ___ Ð¿Ð°Ñ†Ñ–Ñ”Ð½Ñ‚Ð¾Ð²Ñ– ÐºÑƒÑ€Ð¸Ñ‚Ð¸.\n   > [!answer] Ð·Ð°Ð±Ð¾Ñ€Ð¾Ð½ÑÑ”\n   > [!options] Ð·Ð°Ð±Ð¾Ñ€Ð¾Ð½ÑÑ” | Ð·Ð°Ð±Ð¾Ñ€Ð¾Ð½ÑÑ‚Ð¸ | Ð·Ð°Ð±Ð¾Ñ€Ð¾Ð½ÑÑ”Ñ‚ÑŒÑÑ\n\n10. Ð¯ ___ Ñ‚Ð¾Ð±Ñ– Ñ†ÑŽ Ð¿Ð¾Ð¼Ð¸Ð»ÐºÑƒ.\n    > [!answer] Ð²Ð¸Ð±Ð°Ñ‡Ð°ÑŽ\n    > [!options] Ð²Ð¸Ð±Ð°Ñ‡Ð°ÑŽ | Ð²Ð¸Ð±Ð°Ñ‡Ð°Ñ‚Ð¸ | Ð²Ð¸Ð±Ð°Ñ‡Ð°ÑŽÑÑŒ\n\n11. Ð’Ð¾Ð½Ð° ___ Ð¿Ð¾Ð´Ñ€ÑƒÐ·Ñ– Ð½Ð¾Ð²Ð¸Ð½Ñƒ.\n    > [!answer] Ñ€Ð¾Ð·Ð¿Ð¾Ð²Ñ–Ð´Ð°Ñ”\n    > [!options] Ñ€Ð¾Ð·Ð¿Ð¾Ð²Ñ–Ð´Ð°Ñ” | Ñ€Ð¾Ð·Ð¿Ð¾Ð²Ñ–Ð´Ð°Ñ‚Ð¸ | Ñ€Ð¾Ð·Ð¿Ð¾Ð²Ñ–Ð´Ð°Ñ”Ñ‚ÑŒÑÑ\n\n12. ÐœÐ°Ð¼Ð° ___ Ð´Ñ–Ñ‚ÑÐ¼ Ð³Ñ€Ð°Ñ‚Ð¸ÑÑ Ð½Ð°Ð´Ð²Ð¾Ñ€Ñ–.\n    > [!answer] Ð´Ð¾Ð·Ð²Ð¾Ð»ÑÑ”\n    > [!options] Ð´Ð¾Ð·Ð²Ð¾Ð»ÑÑ” | Ð´Ð¾Ð·Ð²Ð¾Ð»ÑÑ‚Ð¸ | Ð´Ð¾Ð·Ð²Ð¾Ð»ÑÑ”Ñ‚ÑŒÑÑ\n\n## quiz: Dative Verb Patterns\n\n1. Ð¯ÐºÐ¸Ð¹ Ð²Ñ–Ð´Ð¼Ñ–Ð½Ð¾Ðº Ð¿Ð¾Ñ‚Ñ€Ñ–Ð±ÐµÐ½ Ð¿Ñ–ÑÐ»Ñ \"Ð´Ð¾Ð¿Ð¾Ð¼Ð°Ð³Ð°Ñ‚Ð¸\"?\n\n- [ ] Accusative\n- [x] Dative\n- [ ] Genitive\n\n---\n\n2. \"ÐŸÐ¾Ð´Ð¾Ð±Ð°Ñ‚Ð¸ÑÑ\" â€” ÑÐºÐ° ÐºÐ¾Ð½ÑÑ‚Ñ€ÑƒÐºÑ†Ñ–Ñ Ð¿Ñ€Ð°Ð²Ð¸Ð»ÑŒÐ½Ð°?\n\n- [x] ÐœÐµÐ½Ñ– Ð¿Ð¾Ð´Ð¾Ð±Ð°Ñ”Ñ‚ÑŒÑÑ ÐºÐ°Ð²Ð°.\n- [ ] Ð¯ Ð¿Ð¾Ð´Ð¾Ð±Ð°ÑŽÑÑ ÐºÐ°Ð²Ð°.\n- [ ] Ð¯ Ð¿Ð¾Ð´Ð¾Ð±Ð°ÑŽ ÐºÐ°Ð²Ñƒ.\n\n---\n\n3. Ð¯ÐºÐµ Ñ€ÐµÑ‡ÐµÐ½Ð½Ñ Ð¿Ñ€Ð°Ð²Ð¸Ð»ÑŒÐ½Ðµ?\n\n- [ ] Ð¯ Ð²Ñ–Ñ€ÑŽ Ñ†ÐµÐ¹ Ð»ÑŽÐ´Ð¸Ð½Ð°.\n- [ ] Ð¯ Ð²Ñ–Ñ€ÑŽ Ñ†ÑŽ Ð»ÑŽÐ´Ð¸Ð½Ñƒ.\n- [x] Ð¯ Ð²Ñ–Ñ€ÑŽ Ñ†Ñ–Ð¹ Ð»ÑŽÐ´Ð¸Ð½Ñ–.\n\n---\n\n4. \"Ð”Ð°Ð²Ð°Ñ‚Ð¸\" Ð¿Ð¾Ñ‚Ñ€ÐµÐ±ÑƒÑ”...\n\n- [ ] Ñ‚Ñ–Ð»ÑŒÐºÐ¸ Ð´Ð°Ð²Ð°Ð»ÑŒÐ½Ð¾Ð³Ð¾ Ð²Ñ–Ð´Ð¼Ñ–Ð½ÐºÐ°\n- [ ] Ñ‚Ñ–Ð»ÑŒÐºÐ¸ Ð·Ð½Ð°Ñ…Ñ–Ð´Ð½Ð¾Ð³Ð¾ Ð²Ñ–Ð´Ð¼Ñ–Ð½ÐºÐ°\n- [x] Ð´Ð°Ð²Ð°Ð»ÑŒÐ½Ð¾Ð³Ð¾ + Ð·Ð½Ð°Ñ…Ñ–Ð´Ð½Ð¾Ð³Ð¾ Ð²Ñ–Ð´Ð¼Ñ–Ð½ÐºÐ°\n\n---\n\n5. Ð¯Ðº ÑÐºÐ°Ð·Ð°Ñ‚Ð¸ \"I thank the teacher\"?\n\n- [ ] Ð¯ Ð´ÑÐºÑƒÑŽ Ð²Ñ‡Ð¸Ñ‚ÐµÐ»ÑŒ.\n- [x] Ð¯ Ð´ÑÐºÑƒÑŽ Ð²Ñ‡Ð¸Ñ‚ÐµÐ»ÐµÐ²Ñ–.\n- [ ] Ð¯ Ð´ÑÐºÑƒÑŽ Ð²Ñ‡Ð¸Ñ‚ÐµÐ»Ñ.\n\n---\n\n6. Ð¯ÐºÐµ Ñ€ÐµÑ‡ÐµÐ½Ð½Ñ Ð¿Ñ€Ð°Ð²Ð¸Ð»ÑŒÐ½Ðµ?\n\n- [x] ÐœÐ°Ð¼Ð° Ð·Ð°Ð±Ð¾Ñ€Ð¾Ð½ÑÑ” Ð´Ñ–Ñ‚ÑÐ¼ Ñ—ÑÑ‚Ð¸ Ñ†ÑƒÐºÐµÑ€ÐºÐ¸.\n- [ ] ÐœÐ°Ð¼Ð° Ð·Ð°Ð±Ð¾Ñ€Ð¾Ð½ÑÑ” Ð´Ñ–Ñ‚ÐµÐ¹ Ñ—ÑÑ‚Ð¸ Ñ†ÑƒÐºÐµÑ€ÐºÐ¸.\n- [ ] ÐœÐ°Ð¼Ð° Ð·Ð°Ð±Ð¾Ñ€Ð¾Ð½ÑÑ” Ð´Ñ–Ñ‚Ð¸ Ñ—ÑÑ‚Ð¸ Ñ†ÑƒÐºÐµÑ€ÐºÐ¸.\n\n---\n\n7. \"Ð—Ð°Ð·Ð´Ñ€Ð¸Ñ‚Ð¸\" Ð¿Ð¾Ñ‚Ñ€ÐµÐ±ÑƒÑ”...\n\n- [x] Ð´Ð°Ð²Ð°Ð»ÑŒÐ½Ð¾Ð³Ð¾ Ð²Ñ–Ð´Ð¼Ñ–Ð½ÐºÐ°\n- [ ] Ð·Ð½Ð°Ñ…Ñ–Ð´Ð½Ð¾Ð³Ð¾ Ð²Ñ–Ð´Ð¼Ñ–Ð½ÐºÐ°\n- [ ] Ñ€Ð¾Ð´Ð¾Ð²Ð¾Ð³Ð¾ Ð²Ñ–Ð´Ð¼Ñ–Ð½ÐºÐ°\n\n---\n\n8. Ð¯Ðº ÑÐºÐ°Ð·Ð°Ñ‚Ð¸ \"The noise bothers me\"?\n\n- [x] Ð¨ÑƒÐ¼ Ð·Ð°Ð²Ð°Ð¶Ð°Ñ” Ð¼ÐµÐ½Ñ–.\n- [ ] Ð¨ÑƒÐ¼ Ð·Ð°Ð²Ð°Ð¶Ð°Ñ” Ð¼ÐµÐ½Ðµ.\n- [ ] Ð¨ÑƒÐ¼ Ð·Ð°Ð²Ð°Ð¶Ð°Ñ” Ñ.\n\n---\n\n9. Ð¯ÐºÐµ Ñ€ÐµÑ‡ÐµÐ½Ð½Ñ Ð¿Ñ€Ð°Ð²Ð¸Ð»ÑŒÐ½Ðµ?\n\n- [ ] Ð¯ Ð¿Ð¾ÑÑÐ½ÑŽÑŽ ÑƒÑ‡Ð½Ñ– Ð¿Ñ€Ð°Ð²Ð¸Ð»Ð¾.\n- [ ] Ð¯ Ð¿Ð¾ÑÑÐ½ÑŽÑŽ ÑƒÑ‡Ð½Ñ–Ð² Ð¿Ñ€Ð°Ð²Ð¸Ð»Ð¾.\n- [x] Ð¯ Ð¿Ð¾ÑÑÐ½ÑŽÑŽ ÑƒÑ‡Ð½ÑÐ¼ Ð¿Ñ€Ð°Ð²Ð¸Ð»Ð¾.\n\n---\n\n10. \"Ð¡Ð¿Ñ–Ð²Ñ‡ÑƒÐ²Ð°Ñ‚Ð¸\" Ð¿Ð¾Ñ‚Ñ€ÐµÐ±ÑƒÑ”...\n\n- [x] Ð´Ð°Ð²Ð°Ð»ÑŒÐ½Ð¾Ð³Ð¾ Ð²Ñ–Ð´Ð¼Ñ–Ð½ÐºÐ°\n- [ ] Ð·Ð½Ð°Ñ…Ñ–Ð´Ð½Ð¾Ð³Ð¾ Ð²Ñ–Ð´Ð¼Ñ–Ð½ÐºÐ°\n- [ ] Ð¾Ñ€ÑƒÐ´Ð½Ð¾Ð³Ð¾ Ð²Ñ–Ð´Ð¼Ñ–Ð½ÐºÐ°\n\n---\n\n11. Ð¯Ðº ÑÐºÐ°Ð·Ð°Ñ‚Ð¸ \"I forgive you\"?\n\n- [ ] Ð¯ Ð¿Ñ€Ð¾Ð±Ð°Ñ‡Ð°ÑŽ Ñ‚Ð¸.\n- [x] Ð¯ Ð¿Ñ€Ð¾Ð±Ð°Ñ‡Ð°ÑŽ Ñ‚Ð¾Ð±Ñ–.\n- [ ] Ð¯ Ð¿Ñ€Ð¾Ð±Ð°Ñ‡Ð°ÑŽ Ñ‚ÐµÐ±Ðµ.\n\n---\n\n12. Ð¯ÐºÐµ Ñ€ÐµÑ‡ÐµÐ½Ð½Ñ Ð¿Ñ€Ð°Ð²Ð¸Ð»ÑŒÐ½Ðµ?\n\n- [x] Ð’Ñ–Ð½ Ñ€Ð°Ð´Ð¸Ñ‚ÑŒ Ð¼ÐµÐ½Ñ– Ð²Ñ–Ð´Ð¿Ð¾Ñ‡Ð¸Ñ‚Ð¸.\n- [ ] Ð’Ñ–Ð½ Ñ€Ð°Ð´Ð¸Ñ‚ÑŒ Ð¼ÐµÐ½Ðµ Ð²Ñ–Ð´Ð¿Ð¾Ñ‡Ð¸Ñ‚Ð¸.\n- [ ] Ð’Ñ–Ð½ Ñ€Ð°Ð´Ð¸Ñ‚ÑŒ Ñ Ð²Ñ–Ð´Ð¿Ð¾Ñ‡Ð¸Ñ‚Ð¸.\n\n## true-false: Dative Verb Rules\n> Decide if each statement is true or false.\n\n- [ ] \"Ð”Ð¾Ð¿Ð¾Ð¼Ð°Ð³Ð°Ñ‚Ð¸\" requires the accusative case.\n  > Ð”Ð¾Ð¿Ð¾Ð¼Ð°Ð³Ð°Ñ‚Ð¸ requires the dative: Ð¯ Ð´Ð¾Ð¿Ð¾Ð¼Ð°Ð³Ð°ÑŽ Ð¼Ð°Ð¼Ñ–.\n\n- [x] \"ÐŸÐ¾Ð´Ð¾Ð±Ð°Ñ‚Ð¸ÑÑ\" makes the liked thing the grammatical subject.\n  > Yes! \"ÐœÐµÐ½Ñ– Ð¿Ð¾Ð´Ð¾Ð±Ð°Ñ”Ñ‚ÑŒÑÑ ÐºÐ°Ð²Ð°\" â€” ÐºÐ°Ð²Ð° is the subject, Ð¼ÐµÐ½Ñ– is dative.\n\n- [x] \"Ð”Ð°Ð²Ð°Ñ‚Ð¸\" requires both dative and accusative objects.\n  > Correct! Ð¯ Ð´Ð°ÑŽ Ð¼Ð°Ð¼Ñ– ÐºÐ½Ð¸Ð³Ñƒ.\n\n- [ ] \"Ð’Ñ–Ñ€Ð¸Ñ‚Ð¸\" can take an accusative object.\n  > Ð’Ñ–Ñ€Ð¸Ñ‚Ð¸ only takes dative: Ð¯ Ð²Ñ–Ñ€ÑŽ Ð´Ñ€ÑƒÐ³Ð¾Ð²Ñ–.\n\n- [x] \"Ð—Ð°Ð±Ð¾Ñ€Ð¾Ð½ÑÑ‚Ð¸\" takes dative + infinitive.\n  > Correct! ÐœÐ°Ð¼Ð° Ð·Ð°Ð±Ð¾Ñ€Ð¾Ð½ÑÑ” Ð´Ñ–Ñ‚ÑÐ¼ Ð³Ñ€Ð°Ñ‚Ð¸ÑÑ.\n\n- [ ] \"Ð—Ð°Ð·Ð´Ñ€Ð¸Ñ‚Ð¸\" means \"to help.\"\n  > Ð—Ð°Ð·Ð´Ñ€Ð¸Ñ‚Ð¸ means \"to envy.\" Ð”Ð¾Ð¿Ð¾Ð¼Ð°Ð³Ð°Ñ‚Ð¸ means \"to help.\"\n\n- [ ] In \"ÐœÐµÐ½Ñ– Ð¿Ð¾Ð´Ð¾Ð±Ð°Ñ”Ñ‚ÑŒÑÑ Ð¼ÑƒÐ·Ð¸ÐºÐ°,\" \"Ð¼ÐµÐ½Ñ–\" is the subject.\n  > ÐœÐµÐ½Ñ– is dative. ÐœÑƒÐ·Ð¸ÐºÐ° is the nominative subject.\n\n- [x] \"Ð”ÑÐºÑƒÑŽ Ñ‚Ð¾Ð±Ñ–\" and \"Ð”ÑÐºÑƒÑŽ Ð²Ð°Ð¼\" both use the dative case.\n  > Correct! Ð¢Ð¾Ð±Ñ– and Ð²Ð°Ð¼ are both dative forms.\n\n- [ ] \"ÐŸÐ¾ÐºÐ°Ð·ÑƒÐ²Ð°Ñ‚Ð¸\" is a dative-only verb.\n  > ÐŸÐ¾ÐºÐ°Ð·ÑƒÐ²Ð°Ñ‚Ð¸ takes Dat + Acc: Ð¯ Ð¿Ð¾ÐºÐ°Ð·ÑƒÑŽ Ð´Ñ€ÑƒÐ³Ð¾Ð²Ñ– Ñ„Ð¾Ñ‚Ð¾.\n\n- [x] \"Ð¡Ð¿Ñ–Ð²Ñ‡ÑƒÐ²Ð°Ñ‚Ð¸\" requires the dative case.\n  > Correct! Ð¯ ÑÐ¿Ñ–Ð²Ñ‡ÑƒÐ²Ð°ÑŽ Ñ€Ð¾Ð´Ð¸Ð½Ñ–.\n\n- [ ] \"ÐŸÐ¾ÑÑÐ½ÑŽÐ²Ð°Ñ‚Ð¸\" only needs an accusative object.\n  > ÐŸÐ¾ÑÑÐ½ÑŽÐ²Ð°Ñ‚Ð¸ takes Dat + Acc: Ð¯ Ð¿Ð¾ÑÑÐ½ÑŽÑŽ ÑƒÑ‡Ð½ÑÐ¼ Ð¿Ñ€Ð°Ð²Ð¸Ð»Ð¾.\n\n- [ ] Word order in Ukrainian sentences with dative is completely fixed.\n  > Word order is flexible! Case endings show grammatical roles.\n\n## group-sort: Verb Categories\n> Sort these verbs into the correct category.\n\n### Dative Only\n- Ð´Ð¾Ð¿Ð¾Ð¼Ð°Ð³Ð°Ñ‚Ð¸\n- Ð·Ð°Ð²Ð°Ð¶Ð°Ñ‚Ð¸\n- Ð¿Ð¾Ð´Ð¾Ð±Ð°Ñ‚Ð¸ÑÑ\n- Ð²Ñ–Ñ€Ð¸Ñ‚Ð¸\n- Ð´Ð¾Ð²Ñ–Ñ€ÑÑ‚Ð¸\n- Ð´ÑÐºÑƒÐ²Ð°Ñ‚Ð¸\n\n### Dative + Accusative\n- Ð´Ð°Ð²Ð°Ñ‚Ð¸\n- Ð¿Ð¾ÐºÐ°Ð·ÑƒÐ²Ð°Ñ‚Ð¸\n- Ð¿Ð¾ÑÑÐ½ÑŽÐ²Ð°Ñ‚Ð¸\n- Ñ€Ð¾Ð·Ð¿Ð¾Ð²Ñ–Ð´Ð°Ñ‚Ð¸\n- Ñ€Ð°Ð´Ð¸Ñ‚Ð¸\n- Ð¿Ð¸ÑÐ°Ñ‚Ð¸\n\n## unjumble: Dative Verb Sentences\n> Put the words in the correct order.\n\n1. Ñ / Ð´Ð¾Ð¿Ð¾Ð¼Ð°Ð³Ð°ÑŽ / Ð¼Ð°Ð¼Ñ– / Ð³Ð¾Ñ‚ÑƒÐ²Ð°Ñ‚Ð¸ / Ð¾Ð±Ñ–Ð´\n   > [!answer] Ð¯ Ð´Ð¾Ð¿Ð¾Ð¼Ð°Ð³Ð°ÑŽ Ð¼Ð°Ð¼Ñ– Ð³Ð¾Ñ‚ÑƒÐ²Ð°Ñ‚Ð¸ Ð¾Ð±Ñ–Ð´.\n   > (I help mom cook lunch.)\n\n2. Ð¼ÐµÐ½Ñ– / Ð¿Ð¾Ð´Ð¾Ð±Ð°Ñ”Ñ‚ÑŒÑÑ / Ñ†Ñ / Ð¼ÑƒÐ·Ð¸ÐºÐ°\n   > [!answer] ÐœÐµÐ½Ñ– Ð¿Ð¾Ð´Ð¾Ð±Ð°Ñ”Ñ‚ÑŒÑÑ Ñ†Ñ Ð¼ÑƒÐ·Ð¸ÐºÐ°.\n   > (I like this music.)\n\n3. Ð²Ñ–Ð½ / Ð¿Ð¾ÐºÐ°Ð·ÑƒÑ” / Ð´Ñ€ÑƒÐ³Ð¾Ð²Ñ– / Ð½Ð¾Ð²Ñƒ / Ð¼Ð°ÑˆÐ¸Ð½Ñƒ\n   > [!answer] Ð’Ñ–Ð½ Ð¿Ð¾ÐºÐ°Ð·ÑƒÑ” Ð´Ñ€ÑƒÐ³Ð¾Ð²Ñ– Ð½Ð¾Ð²Ñƒ Ð¼Ð°ÑˆÐ¸Ð½Ñƒ.\n   > (He shows his friend the new car.)\n\n4. Ð²Ñ‡Ð¸Ñ‚ÐµÐ»ÑŒ / Ð¿Ð¾ÑÑÐ½ÑŽÑ” / ÑƒÑ‡Ð½ÑÐ¼ / ÑÐºÐ»Ð°Ð´Ð½Ðµ / Ð¿Ñ€Ð°Ð²Ð¸Ð»Ð¾\n   > [!answer] Ð’Ñ‡Ð¸Ñ‚ÐµÐ»ÑŒ Ð¿Ð¾ÑÑÐ½ÑŽÑ” ÑƒÑ‡Ð½ÑÐ¼ ÑÐºÐ»Ð°Ð´Ð½Ðµ Ð¿Ñ€Ð°Ð²Ð¸Ð»Ð¾.\n   > (The teacher explains a complex rule to students.)\n\n5. Ñ / Ð´ÑÐºÑƒÑŽ / Ñ‚Ð¾Ð±Ñ– / Ð·Ð° / Ð´Ð¾Ð¿Ð¾Ð¼Ð¾Ð³Ñƒ\n   > [!answer] Ð¯ Ð´ÑÐºÑƒÑŽ Ñ‚Ð¾Ð±Ñ– Ð·Ð° Ð´Ð¾Ð¿Ð¾Ð¼Ð¾Ð³Ñƒ.\n   > (I thank you for the help.)\n\n6. Ñ†Ñ / Ð¼ÑƒÐ·Ð¸ÐºÐ° / Ð·Ð°Ð²Ð°Ð¶Ð°Ñ” / Ð¼ÐµÐ½Ñ– / ÑÐ¿Ð°Ñ‚Ð¸\n   > [!answer] Ð¦Ñ Ð¼ÑƒÐ·Ð¸ÐºÐ° Ð·Ð°Ð²Ð°Ð¶Ð°Ñ” Ð¼ÐµÐ½Ñ– ÑÐ¿Ð°Ñ‚Ð¸.\n   > (This music prevents me from sleeping.)\n\n## error-correction: Fix the Dative Errors\n> Each sentence has ONE error. Find and correct it.\n\n1. Ð¯ Ð´Ð¾Ð¿Ð¾Ð¼Ð°Ð³Ð°ÑŽ Ð¼Ð°Ð¼Ñƒ.\n   > [!error] Ð¼Ð°Ð¼Ñƒ\n   > [!answer] Ð¼Ð°Ð¼Ñ–\n   > [!options] Ð¼Ð°Ð¼Ñƒ | Ð¼Ð°Ð¼Ñ– | Ð¼Ð°Ð¼Ð¾ÑŽ | Ð¼Ð°Ð¼Ð°\n   > [!explanation] The verb Â«Ð´Ð¾Ð¿Ð¾Ð¼Ð°Ð³Ð°Ñ‚Ð¸Â» requires Dative case. Feminine nouns ending in -Ð° take -Ñ–: Ð¼Ð°Ð¼Ð° â†’ Ð¼Ð°Ð¼Ñ–.\n\n2. ÐœÐµÐ½Ðµ Ð¿Ð¾Ð´Ð¾Ð±Ð°Ñ”Ñ‚ÑŒÑÑ Ñ†Ñ ÐºÐ½Ð¸Ð³Ð°.\n   > [!error] ÐœÐµÐ½Ðµ\n   > [!answer] ÐœÐµÐ½Ñ–\n   > [!options] ÐœÐµÐ½Ðµ | ÐœÐµÐ½Ñ– | ÐœÑ–Ð¹ | ÐœÐ¾Ñ\n   > [!explanation] With Â«Ð¿Ð¾Ð´Ð¾Ð±Ð°Ñ‚Ð¸ÑÑÂ», the experiencer is in Dative. The pronoun Â«ÑÂ» becomes Â«Ð¼ÐµÐ½Ñ–Â» in Dative, not Â«Ð¼ÐµÐ½ÐµÂ» (Accusative).\n\n3. Ð’Ñ–Ð½ Ð¿Ð¾ÐºÐ°Ð·ÑƒÑ” Ð´Ñ€ÑƒÐ³ ÑÐ²Ð¾ÑŽ Ð¼Ð°ÑˆÐ¸Ð½Ñƒ.\n   > [!error] Ð´Ñ€ÑƒÐ³\n   > [!answer] Ð´Ñ€ÑƒÐ³Ð¾Ð²Ñ–\n   > [!options] Ð´Ñ€ÑƒÐ³ | Ð´Ñ€ÑƒÐ³Ð¾Ð²Ñ– | Ð´Ñ€ÑƒÐ³Ð° | Ð´Ñ€ÑƒÐ³Ð¾Ð¼\n   > [!explanation] The verb Â«Ð¿Ð¾ÐºÐ°Ð·ÑƒÐ²Ð°Ñ‚Ð¸Â» takes Dative + Accusative. The recipient needs Dative: Ð´Ñ€ÑƒÐ³ â†’ Ð´Ñ€ÑƒÐ³Ð¾Ð²Ñ–.\n\n4. Ð’Ñ‡Ð¸Ñ‚ÐµÐ»ÑŒ Ð¿Ð¾ÑÑÐ½ÑŽÑ” ÑƒÑ‡Ð½Ñ–Ð² Ð¿Ñ€Ð°Ð²Ð¸Ð»Ð¾.\n   > [!error] ÑƒÑ‡Ð½Ñ–Ð²\n   > [!answer] ÑƒÑ‡Ð½ÑÐ¼\n   > [!options] ÑƒÑ‡Ð½Ñ–Ð² | ÑƒÑ‡Ð½ÑÐ¼ | ÑƒÑ‡Ð½Ñ– | ÑƒÑ‡Ð½ÑÐ¼Ð¸\n   > [!explanation] The verb Â«Ð¿Ð¾ÑÑÐ½ÑŽÐ²Ð°Ñ‚Ð¸Â» takes Dative + Accusative. The Dative plural of Â«ÑƒÑ‡ÐµÐ½ÑŒÂ» is Â«ÑƒÑ‡Ð½ÑÐ¼Â», not Â«ÑƒÑ‡Ð½Ñ–Ð²Â» (Genitive).\n\n5. Ð¯ Ð´ÑÐºÑƒÑŽ Ñ‚ÐµÐ±Ðµ Ð·Ð° Ð´Ð¾Ð¿Ð¾Ð¼Ð¾Ð³Ñƒ.\n   > [!error] Ñ‚ÐµÐ±Ðµ\n   > [!answer] Ñ‚Ð¾Ð±Ñ–\n   > [!options] Ñ‚ÐµÐ±Ðµ | Ñ‚Ð¾Ð±Ñ– | Ñ‚Ð¾Ð±Ð¾ÑŽ | Ñ‚Ð¸\n   > [!explanation] The verb Â«Ð´ÑÐºÑƒÐ²Ð°Ñ‚Ð¸Â» requires Dative. The pronoun Â«Ñ‚Ð¸Â» becomes Â«Ñ‚Ð¾Ð±Ñ–Â» in Dative, not Â«Ñ‚ÐµÐ±ÐµÂ» (Accusative).\n\n6. ÐœÑƒÐ·Ð¸ÐºÐ° Ð·Ð°Ð²Ð°Ð¶Ð°Ñ” Ð¼ÐµÐ½Ðµ ÑÐ¿Ð°Ñ‚Ð¸.\n   > [!error] Ð¼ÐµÐ½Ðµ\n   > [!answer] Ð¼ÐµÐ½Ñ–\n   > [!options] Ð¼ÐµÐ½Ðµ | Ð¼ÐµÐ½Ñ– | Ð¼Ð½Ð¾ÑŽ | Ñ\n   > [!explanation] The verb Â«Ð·Ð°Ð²Ð°Ð¶Ð°Ñ‚Ð¸Â» requires Dative. The pronoun Â«ÑÂ» becomes Â«Ð¼ÐµÐ½Ñ–Â» in Dative, not Â«Ð¼ÐµÐ½ÐµÂ» (Accusative).\n\n## cloze: Complete the Story\n> Fill in the blanks with the correct words.\n\nÐœÐ°Ñ€Ñ–Ñ Ð¿Ñ€Ð°Ñ†ÑŽÑ” Ð²Ñ‡Ð¸Ñ‚ÐµÐ»ÑŒÐºÐ¾ÑŽ. Ð©Ð¾Ð´Ð½Ñ Ð²Ð¾Ð½Ð° [___:1] ÑƒÑ‡Ð½ÑÐ¼ Ð½Ð¾Ð²Ñ– Ñ‚ÐµÐ¼Ð¸. ÐšÐ¾Ð»Ð¸ ÑƒÑ‡ÐµÐ½ÑŒ Ð½Ðµ Ñ€Ð¾Ð·ÑƒÐ¼Ñ–Ñ”, Ð²Ð¾Ð½Ð° [___:2] Ð¹Ð¾Ð¼Ñƒ. ÐœÐ°Ñ€Ñ–Ñ [___:3] ÑÐ²Ð¾Ñ—Ð¼ ÑƒÑ‡Ð½ÑÐ¼ â€” Ð²Ð¾Ð½Ð¸ ÑÑ‚Ð°Ñ€Ð°Ð½Ð½Ñ–. Ð‘Ð°Ñ‚ÑŒÐºÐ¸ [___:4] ÐœÐ°Ñ€Ñ–Ñ— Ð·Ð° Ñ…Ð¾Ñ€Ð¾ÑˆÑƒ Ñ€Ð¾Ð±Ð¾Ñ‚Ñƒ.\n\n1. Ð¿Ð¾ÑÑÐ½ÑŽÑ” | Ð¿Ð¾ÑÑÐ½ÑŽÐ²Ð°Ñ‚Ð¸ | Ð¿Ð¾ÑÑÐ½ÑŽÑ”Ñ‚ÑŒÑÑ\n   > [!answer] Ð¿Ð¾ÑÑÐ½ÑŽÑ”\n\n2. Ð´Ð¾Ð¿Ð¾Ð¼Ð°Ð³Ð°Ñ” | Ð´Ð¾Ð¿Ð¾Ð¼Ð°Ð³Ð°Ñ‚Ð¸ | Ð´Ð¾Ð¿Ð¾Ð¼Ð°Ð³Ð°Ñ”Ñ‚ÑŒÑÑ\n   > [!answer] Ð´Ð¾Ð¿Ð¾Ð¼Ð°Ð³Ð°Ñ”\n\n3. Ð²Ñ–Ñ€Ð¸Ñ‚ÑŒ | Ð²Ñ–Ñ€Ð¸Ñ‚Ð¸ | Ð²Ñ–Ñ€Ð¸Ñ‚ÑŒÑÑ\n   > [!answer] Ð²Ñ–Ñ€Ð¸Ñ‚ÑŒ\n\n4. Ð´ÑÐºÑƒÑŽÑ‚ÑŒ | Ð´ÑÐºÑƒÐ²Ð°Ñ‚Ð¸ | Ð´ÑÐºÑƒÑŽÑ‚ÑŒÑÑ\n   > [!answer] Ð´ÑÐºÑƒÑŽÑ‚ÑŒ\n\n---\n\nÐœÑ–Ð¹ Ð±Ñ€Ð°Ñ‚ ÐžÐ»ÐµÐ³ Ð»ÑŽÐ±Ð¸Ñ‚ÑŒ Ð¼ÑƒÐ·Ð¸ÐºÑƒ. [___:1] Ð¿Ð¾Ð´Ð¾Ð±Ð°Ñ”Ñ‚ÑŒÑÑ Ñ€Ð¾Ðº. ÐÐ»Ðµ Ð½Ð°ÑˆÐ° Ð¼Ð°Ð¼Ð° ÐºÐ°Ð¶Ðµ, Ñ‰Ð¾ Ð¼ÑƒÐ·Ð¸ÐºÐ° [___:2] Ñ—Ð¹. ÐžÐ»ÐµÐ³ [___:3] Ð¼Ð°Ð¼Ñƒ â€” Ð²Ñ–Ð½ ÑÐ»ÑƒÑ…Ð°Ñ” Ð¼ÑƒÐ·Ð¸ÐºÑƒ Ð² Ð½Ð°Ð²ÑƒÑˆÐ½Ð¸ÐºÐ°Ñ…. Ð¢ÐµÐ¿ÐµÑ€ Ð¼Ð°Ð¼Ð° [___:4] ÐžÐ»ÐµÐ³Ð¾Ð²Ñ–, Ñ‰Ð¾ Ð²Ñ–Ð½ ÑƒÐ²Ð°Ð¶Ð½Ð¸Ð¹.\n\n1. Ð™Ð¾Ð¼Ñƒ | Ð™Ð¾Ð³Ð¾ | Ð’Ñ–Ð½\n   > [!answer] Ð™Ð¾Ð¼Ñƒ\n\n2. Ð·Ð°Ð²Ð°Ð¶Ð°Ñ” | Ð·Ð°Ð²Ð°Ð¶Ð°Ñ‚Ð¸ | Ð·Ð°Ð²Ð°Ð¶Ð°Ñ”Ñ‚ÑŒÑÑ\n   > [!answer] Ð·Ð°Ð²Ð°Ð¶Ð°Ñ”\n\n3. Ð¿Ñ€Ð¾Ð±Ð°Ñ‡Ð°Ñ” | Ñ€Ð¾Ð·ÑƒÐ¼Ñ–Ñ” | Ð»ÑŽÐ±Ð¸Ñ‚ÑŒ\n   > [!answer] Ñ€Ð¾Ð·ÑƒÐ¼Ñ–Ñ”\n\n4. ÐºÐ°Ð¶Ðµ | Ð³Ð¾Ð²Ð¾Ñ€Ð¸Ñ‚ÑŒ | Ñ€Ð¾Ð·Ð¿Ð¾Ð²Ñ–Ð´Ð°Ñ”\n   > [!answer] ÐºÐ°Ð¶Ðµ\n\n## dialogue-reorder: At the Doctor's Office\n\n- Ð”ÑÐºÑƒÑŽ Ð²Ð°Ð¼, Ð»Ñ–ÐºÐ°Ñ€ÑŽ!\n- Ð”Ð¾Ð±Ñ€Ð¸Ð¹ Ð´ÐµÐ½ÑŒ! Ð©Ð¾ Ð²Ð°Ñ Ñ‚ÑƒÑ€Ð±ÑƒÑ”?\n- Ð¯ Ñ€Ð°Ð´Ð¶Ñƒ Ð²Ð°Ð¼ Ð²Ñ–Ð´Ð¿Ð¾Ñ‡Ð¸Ð²Ð°Ñ‚Ð¸ Ñ– Ð¿Ð¸Ñ‚Ð¸ Ð±Ð°Ð³Ð°Ñ‚Ð¾ Ð²Ð¾Ð´Ð¸.\n- ÐœÐµÐ½Ñ– Ð±Ð¾Ð»ÑÑ‡Ðµ ÐºÐ¾Ð²Ñ‚Ð°Ñ‚Ð¸. Ð¯ Ð´ÑƒÐ¼Ð°ÑŽ, Ñ†Ðµ Ð°Ð½Ð³Ñ–Ð½Ð°.\n- Ð’Ð¸ Ð·Ð°Ð±Ð¾Ñ€Ð¾Ð½ÑÑ”Ñ‚Ðµ Ð¼ÐµÐ½Ñ– Ð¿Ñ€Ð°Ñ†ÑŽÐ²Ð°Ñ‚Ð¸?\n- Ð¢Ð°Ðº, Ñ†Ðµ Ð°Ð½Ð³Ñ–Ð½Ð°. Ð¯ Ð·Ð°Ð±Ð¾Ñ€Ð¾Ð½ÑÑŽ Ð²Ð°Ð¼ Ð¿Ñ€Ð°Ñ†ÑŽÐ²Ð°Ñ‚Ð¸ Ñ†ÑŒÐ¾Ð³Ð¾ Ñ‚Ð¸Ð¶Ð½Ñ.\n\n> [!answer]\n> 1. Ð”Ð¾Ð±Ñ€Ð¸Ð¹ Ð´ÐµÐ½ÑŒ! Ð©Ð¾ Ð²Ð°Ñ Ñ‚ÑƒÑ€Ð±ÑƒÑ”?\n> 2. ÐœÐµÐ½Ñ– Ð±Ð¾Ð»ÑÑ‡Ðµ ÐºÐ¾Ð²Ñ‚Ð°Ñ‚Ð¸. Ð¯ Ð´ÑƒÐ¼Ð°ÑŽ, Ñ†Ðµ Ð°Ð½Ð³Ñ–Ð½Ð°.\n> 3. Ð¢Ð°Ðº, Ñ†Ðµ Ð°Ð½Ð³Ñ–Ð½Ð°. Ð¯ Ð·Ð°Ð±Ð¾Ñ€Ð¾Ð½ÑÑŽ Ð²Ð°Ð¼ Ð¿Ñ€Ð°Ñ†ÑŽÐ²Ð°Ñ‚Ð¸ Ñ†ÑŒÐ¾Ð³Ð¾ Ñ‚Ð¸Ð¶Ð½Ñ.\n> 4. Ð’Ð¸ Ð·Ð°Ð±Ð¾Ñ€Ð¾Ð½ÑÑ”Ñ‚Ðµ Ð¼ÐµÐ½Ñ– Ð¿Ñ€Ð°Ñ†ÑŽÐ²Ð°Ñ‚Ð¸?\n> 5. Ð¯ Ñ€Ð°Ð´Ð¶Ñƒ Ð²Ð°Ð¼ Ð²Ñ–Ð´Ð¿Ð¾Ñ‡Ð¸Ð²Ð°Ñ‚Ð¸ Ñ– Ð¿Ð¸Ñ‚Ð¸ Ð±Ð°Ð³Ð°Ñ‚Ð¾ Ð²Ð¾Ð´Ð¸.\n> 6. Ð”ÑÐºÑƒÑŽ Ð²Ð°Ð¼, Ð»Ñ–ÐºÐ°Ñ€ÑŽ!\n\n---\n\n- Ð¢Ð°Ðº, Ð·Ð²Ð¸Ñ‡Ð°Ð¹Ð½Ð¾!\n- Ð¢Ð¸ Ð¼Ð¾Ð¶ÐµÑˆ Ð¿Ð¾ÐºÐ°Ð·Ð°Ñ‚Ð¸ Ð¼ÐµÐ½Ñ– Ñ†ÑŽ Ñ„Ð¾Ñ‚Ð¾Ð³Ñ€Ð°Ñ„Ñ–ÑŽ?\n- Ð”ÑÐºÑƒÑŽ! ÐœÐµÐ½Ñ– Ð´ÑƒÐ¶Ðµ Ð¿Ð¾Ð´Ð¾Ð±Ð°Ñ”Ñ‚ÑŒÑÑ Ñ†Ðµ Ð¼Ñ–ÑÑ†Ðµ.\n- Ð¦Ðµ ÐšÐ°Ñ€Ð¿Ð°Ñ‚Ð¸. Ð¯ Ð±ÑƒÐ² Ñ‚Ð°Ð¼ Ð¼Ð¸Ð½ÑƒÐ»Ð¾Ð³Ð¾ Ñ€Ð¾ÐºÑƒ.\n- Ð¯ÐºÐµ Ð³Ð°Ñ€Ð½Ðµ Ð¼Ñ–ÑÑ†Ðµ! Ð©Ð¾ Ñ†Ðµ?\n- Ð¢Ð¾Ð±Ñ– Ñ‚ÐµÐ¶ Ð²Ð°Ñ€Ñ‚Ð¾ Ð¿Ð¾Ñ—Ñ…Ð°Ñ‚Ð¸ Ñ‚ÑƒÐ´Ð¸!\n\n> [!answer]\n> 1. Ð¢Ð¸ Ð¼Ð¾Ð¶ÐµÑˆ Ð¿Ð¾ÐºÐ°Ð·Ð°Ñ‚Ð¸ Ð¼ÐµÐ½Ñ– Ñ†ÑŽ Ñ„Ð¾Ñ‚Ð¾Ð³Ñ€Ð°Ñ„Ñ–ÑŽ?\n> 2. Ð¢Ð°Ðº, Ð·Ð²Ð¸Ñ‡Ð°Ð¹Ð½Ð¾!\n> 3. Ð¯ÐºÐµ Ð³Ð°Ñ€Ð½Ðµ Ð¼Ñ–ÑÑ†Ðµ! Ð©Ð¾ Ñ†Ðµ?\n> 4. Ð¦Ðµ ÐšÐ°Ñ€Ð¿Ð°Ñ‚Ð¸. Ð¯ Ð±ÑƒÐ² Ñ‚Ð°Ð¼ Ð¼Ð¸Ð½ÑƒÐ»Ð¾Ð³Ð¾ Ñ€Ð¾ÐºÑƒ.\n> 5. Ð”ÑÐºÑƒÑŽ! ÐœÐµÐ½Ñ– Ð´ÑƒÐ¶Ðµ Ð¿Ð¾Ð´Ð¾Ð±Ð°Ñ”Ñ‚ÑŒÑÑ Ñ†Ðµ Ð¼Ñ–ÑÑ†Ðµ.\n> 6. Ð¢Ð¾Ð±Ñ– Ñ‚ÐµÐ¶ Ð²Ð°Ñ€Ñ‚Ð¾ Ð¿Ð¾Ñ—Ñ…Ð°Ñ‚Ð¸ Ñ‚ÑƒÐ´Ð¸!\n\n## mark-the-words: Find Dative Objects\n\nClick on the dative objects in these sentences.\n\nÐ¯ Ð´Ð¾Ð¿Ð¾Ð¼Ð°Ð³Ð°ÑŽ [Ð¼Ð°Ð¼Ñ–](correct) Ð³Ð¾Ñ‚ÑƒÐ²Ð°Ñ‚Ð¸ Ð¾Ð±Ñ–Ð´. Ð’Ð¾Ð½Ð° Ð´ÑÐºÑƒÑ” [Ð¼ÐµÐ½Ñ–](correct). [ÐœÑƒÐ·Ð¸ÐºÐ°](wrong) Ð·Ð°Ð²Ð°Ð¶Ð°Ñ” [ÑÑƒÑÑ–Ð´Ð°Ð¼](correct). Ð’Ñ‡Ð¸Ñ‚ÐµÐ»ÑŒ Ð¿Ð¾ÑÑÐ½ÑŽÑ” [ÑƒÑ‡Ð½ÑÐ¼](correct) [Ð¿Ñ€Ð°Ð²Ð¸Ð»Ð¾](wrong).\n\n---\n\n[ÐœÐµÐ½Ñ–](correct) Ð¿Ð¾Ð´Ð¾Ð±Ð°Ñ”Ñ‚ÑŒÑÑ [Ñ†Ñ ÐºÐ½Ð¸Ð³Ð°](wrong). Ð’Ñ–Ð½ Ð¿Ð¾ÐºÐ°Ð·ÑƒÑ” [Ð´Ñ€ÑƒÐ³Ð¾Ð²Ñ–](correct) [Ñ„Ð¾Ñ‚Ð¾](wrong). ÐœÐ¸ Ð´Ð¾Ð²Ñ–Ñ€ÑÑ”Ð¼Ð¾ [Ð»Ñ–ÐºÐ°Ñ€ÐµÐ²Ñ–](correct). Ð‘Ð°Ñ‚ÑŒÐºÐ¸ Ð·Ð°Ð±Ð¾Ñ€Ð¾Ð½ÑÑŽÑ‚ÑŒ [Ð´Ñ–Ñ‚ÑÐ¼](correct) [Ð³Ñ€Ð°Ñ‚Ð¸ÑÑ](wrong) Ð½Ð°Ð´Ð²Ð¾Ñ€Ñ–.\n\n---\n\nÐ‘Ð°Ð±ÑƒÑÑ Ñ€Ð¾Ð·Ð¿Ð¾Ð²Ñ–Ð´Ð°Ñ” [Ð¾Ð½ÑƒÐºÐ°Ð¼](correct) [ÐºÐ°Ð·ÐºÑƒ](wrong). Ð¯ Ð²Ñ–Ñ€ÑŽ [Ñ‚Ð¾Ð±Ñ–](correct). [Ð›Ñ–ÐºÐ°Ñ€](wrong) Ñ€Ð°Ð´Ð¸Ñ‚ÑŒ [Ð¿Ð°Ñ†Ñ–Ñ”Ð½Ñ‚Ð¾Ð²Ñ–](correct) Ð²Ñ–Ð´Ð¿Ð¾Ñ‡Ð¸Ð²Ð°Ñ‚Ð¸. Ð’Ð¾Ð½Ð° Ð·Ð°Ð·Ð´Ñ€Ð¸Ñ‚ÑŒ [Ð¿Ð¾Ð´Ñ€ÑƒÐ·Ñ–](correct).\n\n## translate: English to Ukrainian\n\nI help my brother.\n\n- [ ] Ð¯ Ð´Ð¾Ð¿Ð¾Ð¼Ð°Ð³Ð°ÑŽ Ð±Ñ€Ð°Ñ‚.\n- [x] Ð¯ Ð´Ð¾Ð¿Ð¾Ð¼Ð°Ð³Ð°ÑŽ Ð±Ñ€Ð°Ñ‚Ð¾Ð²Ñ–.\n- [ ] Ð¯ Ð´Ð¾Ð¿Ð¾Ð¼Ð°Ð³Ð°ÑŽ Ð±Ñ€Ð°Ñ‚Ð°.\n\n---\n\nShe shows her friend a photo.\n\n- [x] Ð’Ð¾Ð½Ð° Ð¿Ð¾ÐºÐ°Ð·ÑƒÑ” Ð¿Ð¾Ð´Ñ€ÑƒÐ·Ñ– Ñ„Ð¾Ñ‚Ð¾.\n- [ ] Ð’Ð¾Ð½Ð° Ð¿Ð¾ÐºÐ°Ð·ÑƒÑ” Ð¿Ð¾Ð´Ñ€ÑƒÐ³Ð° Ñ„Ð¾Ñ‚Ð¾.\n- [ ] Ð’Ð¾Ð½Ð° Ð¿Ð¾ÐºÐ°Ð·ÑƒÑ” Ð¿Ð¾Ð´Ñ€ÑƒÐ³Ñƒ Ñ„Ð¾Ñ‚Ð¾.\n\n---\n\nThe doctor forbids the patient to smoke.\n\n- [ ] Ð›Ñ–ÐºÐ°Ñ€ Ð·Ð°Ð±Ð¾Ñ€Ð¾Ð½ÑÑ” Ð¿Ð°Ñ†Ñ–Ñ”Ð½Ñ‚ ÐºÑƒÑ€Ð¸Ñ‚Ð¸.\n- [x] Ð›Ñ–ÐºÐ°Ñ€ Ð·Ð°Ð±Ð¾Ñ€Ð¾Ð½ÑÑ” Ð¿Ð°Ñ†Ñ–Ñ”Ð½Ñ‚Ð¾Ð²Ñ– ÐºÑƒÑ€Ð¸Ñ‚Ð¸.\n- [ ] Ð›Ñ–ÐºÐ°Ñ€ Ð·Ð°Ð±Ð¾Ñ€Ð¾Ð½ÑÑ” Ð¿Ð°Ñ†Ñ–Ñ”Ð½Ñ‚Ð° ÐºÑƒÑ€Ð¸Ñ‚Ð¸.\n\n---\n\nI thank you for the help.\n\n- [ ] Ð¯ Ð´ÑÐºÑƒÑŽ Ñ‚ÐµÐ±Ðµ Ð·Ð° Ð´Ð¾Ð¿Ð¾Ð¼Ð¾Ð³Ñƒ.\n- [x] Ð¯ Ð´ÑÐºÑƒÑŽ Ñ‚Ð¾Ð±Ñ– Ð·Ð° Ð´Ð¾Ð¿Ð¾Ð¼Ð¾Ð³Ñƒ.\n- [ ] Ð¯ Ð´ÑÐºÑƒÑŽ Ñ‚Ð¸ Ð·Ð° Ð´Ð¾Ð¿Ð¾Ð¼Ð¾Ð³Ñƒ.\n\n---\n\nThe music bothers the neighbors.\n\n- [x] ÐœÑƒÐ·Ð¸ÐºÐ° Ð·Ð°Ð²Ð°Ð¶Ð°Ñ” ÑÑƒÑÑ–Ð´Ð°Ð¼.\n- [ ] ÐœÑƒÐ·Ð¸ÐºÐ° Ð·Ð°Ð²Ð°Ð¶Ð°Ñ” ÑÑƒÑÑ–Ð´Ð¸.\n- [ ] ÐœÑƒÐ·Ð¸ÐºÐ° Ð·Ð°Ð²Ð°Ð¶Ð°Ñ” ÑÑƒÑÑ–Ð´Ñ–Ð².\n\n---\n\nI like this film.\n\n- [ ] Ð¯ Ð¿Ð¾Ð´Ð¾Ð±Ð°ÑŽÑÑ Ñ†ÐµÐ¹ Ñ„Ñ–Ð»ÑŒÐ¼.\n- [x] ÐœÐµÐ½Ñ– Ð¿Ð¾Ð´Ð¾Ð±Ð°Ñ”Ñ‚ÑŒÑÑ Ñ†ÐµÐ¹ Ñ„Ñ–Ð»ÑŒÐ¼.\n- [ ] Ð¯ Ð¿Ð¾Ð´Ð¾Ð±Ð°ÑŽ Ñ†ÐµÐ¹ Ñ„Ñ–Ð»ÑŒÐ¼.\n\n---\n\nThe teacher explains the rule to the students.\n\n- [x] Ð’Ñ‡Ð¸Ñ‚ÐµÐ»ÑŒ Ð¿Ð¾ÑÑÐ½ÑŽÑ” ÑƒÑ‡Ð½ÑÐ¼ Ð¿Ñ€Ð°Ð²Ð¸Ð»Ð¾.\n- [ ] Ð’Ñ‡Ð¸Ñ‚ÐµÐ»ÑŒ Ð¿Ð¾ÑÑÐ½ÑŽÑ” ÑƒÑ‡Ð½Ñ– Ð¿Ñ€Ð°Ð²Ð¸Ð»Ð¾.\n- [ ] Ð’Ñ‡Ð¸Ñ‚ÐµÐ»ÑŒ Ð¿Ð¾ÑÑÐ½ÑŽÑ” ÑƒÑ‡Ð½Ñ–Ð² Ð¿Ñ€Ð°Ð²Ð¸Ð»Ð¾.\n\n---\n\nI trust my friend.\n\n- [ ] Ð¯ Ð´Ð¾Ð²Ñ–Ñ€ÑÑŽ Ð´Ñ€ÑƒÐ³.\n- [x] Ð¯ Ð´Ð¾Ð²Ñ–Ñ€ÑÑŽ Ð´Ñ€ÑƒÐ³Ð¾Ð²Ñ–.\n- [ ] Ð¯ Ð´Ð¾Ð²Ñ–Ñ€ÑÑŽ Ð´Ñ€ÑƒÐ³Ð°.\n\n---\n\nMom allows the children to play.\n\n- [x] ÐœÐ°Ð¼Ð° Ð´Ð¾Ð·Ð²Ð¾Ð»ÑÑ” Ð´Ñ–Ñ‚ÑÐ¼ Ð³Ñ€Ð°Ñ‚Ð¸ÑÑ.\n- [ ] ÐœÐ°Ð¼Ð° Ð´Ð¾Ð·Ð²Ð¾Ð»ÑÑ” Ð´Ñ–Ñ‚Ð¸ Ð³Ñ€Ð°Ñ‚Ð¸ÑÑ.\n- [ ] ÐœÐ°Ð¼Ð° Ð´Ð¾Ð·Ð²Ð¾Ð»ÑÑ” Ð´Ñ–Ñ‚ÐµÐ¹ Ð³Ñ€Ð°Ñ‚Ð¸ÑÑ.\n\n---\n\nShe envies her friend.\n\n- [ ] Ð’Ð¾Ð½Ð° Ð·Ð°Ð·Ð´Ñ€Ð¸Ñ‚ÑŒ Ð¿Ð¾Ð´Ñ€ÑƒÐ³Ð°.\n- [x] Ð’Ð¾Ð½Ð° Ð·Ð°Ð·Ð´Ñ€Ð¸Ñ‚ÑŒ Ð¿Ð¾Ð´Ñ€ÑƒÐ·Ñ–.\n- [ ] Ð’Ð¾Ð½Ð° Ð·Ð°Ð·Ð´Ñ€Ð¸Ñ‚ÑŒ Ð¿Ð¾Ð´Ñ€ÑƒÐ³Ñƒ.\n\n---\n\nI believe you.\n\n- [ ] Ð¯ Ð²Ñ–Ñ€ÑŽ Ñ‚Ð¸.\n- [x] Ð¯ Ð²Ñ–Ñ€ÑŽ Ñ‚Ð¾Ð±Ñ–.\n- [ ] Ð¯ Ð²Ñ–Ñ€ÑŽ Ñ‚ÐµÐ±Ðµ.\n\n---\n\nGrandma tells the grandchildren a story.\n\n- [x] Ð‘Ð°Ð±ÑƒÑÑ Ñ€Ð¾Ð·Ð¿Ð¾Ð²Ñ–Ð´Ð°Ñ” Ð¾Ð½ÑƒÐºÐ°Ð¼ ÐºÐ°Ð·ÐºÑƒ.\n- [ ] Ð‘Ð°Ð±ÑƒÑÑ Ñ€Ð¾Ð·Ð¿Ð¾Ð²Ñ–Ð´Ð°Ñ” Ð¾Ð½ÑƒÐºÐ¸ ÐºÐ°Ð·ÐºÑƒ.\n- [ ] Ð‘Ð°Ð±ÑƒÑÑ Ñ€Ð¾Ð·Ð¿Ð¾Ð²Ñ–Ð´Ð°Ñ” Ð¾Ð½ÑƒÐºÑ–Ð² ÐºÐ°Ð·ÐºÑƒ.\n\n---"
      },
      {
        "id": "section-9",
        "name": "Vocabulary",
        "nameEn": null,
        "type": "vocabulary",
        "content": "| Word | IPA | English | POS | Gender | Note |\n|------|-----|---------|-----|--------|------|\n| Ð´Ð¾Ð¿Ð¾Ð¼Ð°Ð³Ð°Ñ‚Ð¸ | /dopoËˆmÉ‘É¦É‘tÉª/ | to help | verb | â€” | + Dat |\n| Ð·Ð°Ð²Ð°Ð¶Ð°Ñ‚Ð¸ | /zÉ‘Ê‹É‘ËˆÊ’É‘tÉª/ | to disturb, bother | verb | â€” | + Dat |\n| Ð¿Ð¾Ð´Ð¾Ð±Ð°Ñ‚Ð¸ÑÑ | /podoËˆbÉ‘tÉªsÊ²É‘/ | to please, be liked | verb | â€” | + Dat |\n| Ð²Ñ–Ñ€Ð¸Ñ‚Ð¸ | /ËˆÊ‹irÉªtÉª/ | to believe | verb | â€” | + Dat |\n| Ð´Ð¾Ð²Ñ–Ñ€ÑÑ‚Ð¸ | /doÊ‹iËˆrÊ²É‘tÉª/ | to trust | verb | â€” | + Dat |\n| Ð´ÑÐºÑƒÐ²Ð°Ñ‚Ð¸ | /dÊ²É‘ËˆkuÊ‹É‘tÉª/ | to thank | verb | â€” | + Dat |\n| Ð²Ð¸Ð±Ð°Ñ‡Ð°Ñ‚Ð¸ | /Ê‹ÉªbÉ‘ËˆtÊƒÉ‘tÉª/ | to excuse, forgive | verb | â€” | + Dat |\n| Ð¿Ñ€Ð¾Ð±Ð°Ñ‡Ð°Ñ‚Ð¸ | /probÉ‘ËˆtÊƒÉ‘tÉª/ | to forgive (serious) | verb | â€” | + Dat |\n| Ð·Ð°Ð·Ð´Ñ€Ð¸Ñ‚Ð¸ | /ËˆzÉ‘zdrÉªtÉª/ | to envy | verb | â€” | + Dat |\n| ÑÐ¸Ð¼Ð¿Ð°Ñ‚Ð¸Ð·ÑƒÐ²Ð°Ñ‚Ð¸ | /sÉªmpÉ‘tÉªËˆzuÊ‹É‘tÉª/ | to sympathize | verb | â€” | + Dat |\n| ÑÐ¿Ñ–Ð²Ñ‡ÑƒÐ²Ð°Ñ‚Ð¸ | /spiÊ‹tÊƒuËˆÊ‹É‘tÉª/ | to feel for, empathize | verb | â€” | + Dat |\n| Ð»Ð¸Ñ‡Ð¸Ñ‚Ð¸ | /lÉªËˆtÊƒÉªtÉª/ | to suit, become | verb | â€” | + Dat |\n| Ð¿Ñ–Ð´Ñ…Ð¾Ð´Ð¸Ñ‚Ð¸ | /pidxoËˆdÉªtÉª/ | to suit, fit | verb | â€” | + Dat |\n| Ð²Ð¸ÑÑ‚Ð°Ñ‡Ð°Ñ‚Ð¸ | /Ê‹ÉªstÉ‘ËˆtÊƒÉ‘tÉª/ | to be enough | verb | â€” | + Dat |\n| Ð±Ñ€Ð°ÐºÑƒÐ²Ð°Ñ‚Ð¸ | /brÉ‘ËˆkuÊ‹É‘tÉª/ | to lack, be short of | verb | â€” | + Dat |\n| ÑˆÐºÐ¾Ð´Ð¸Ñ‚Ð¸ | /ÊƒkoËˆdÉªtÉª/ | to harm | verb | â€” | + Dat |\n| ÑÐ»ÑƒÐ¶Ð¸Ñ‚Ð¸ | /sluËˆÊ’ÉªtÉª/ | to serve | verb | â€” | + Dat |\n| Ð½Ð°Ð»ÐµÐ¶Ð°Ñ‚Ð¸ | /nÉ‘leËˆÊ’É‘tÉª/ | to belong | verb | â€” | + Dat |\n| ÑÐ¿Ð¾Ð´Ð¾Ð±Ð°Ñ‚Ð¸ÑÑ | /spodoËˆbÉ‘tÉªsÊ²É‘/ | to come to like | verb | â€” | perfective of Ð¿Ð¾Ð´Ð¾Ð±Ð°Ñ‚Ð¸ÑÑ |\n| Ð·Ð°Ñ…Ð¾Ñ‚Ñ–Ñ‚Ð¸ÑÑ | /zÉ‘xoËˆtitÉªsÊ²É‘/ | to feel like, want | verb | â€” | + Dat; impersonal |\n| Ð´Ð¾Ð·Ð²Ð¾Ð»ÑÑ‚Ð¸ | /dozÊ‹oËˆlÊ²É‘tÉª/ | to allow, permit | verb | â€” | + Dat + Inf |\n| Ð·Ð°Ð±Ð¾Ñ€Ð¾Ð½ÑÑ‚Ð¸ | /zÉ‘boroËˆnÊ²É‘tÉª/ | to forbid | verb | â€” | + Dat + Inf |\n| Ñ€Ð°Ð´Ð¸Ñ‚Ð¸ | /ËˆrÉ‘dÉªtÉª/ | to advise | verb | â€” | + Dat + Acc |\n| Ð²Ñ–Ð´Ð¿Ð¾Ð²Ñ–Ð´Ð°Ñ‚Ð¸ | /Ê‹idpoÊ‹iËˆdÉ‘tÉª/ | to answer, reply | verb | â€” | + Dat |\n| Ñ‚ÐµÐ»ÐµÑ„Ð¾Ð½ÑƒÐ²Ð°Ñ‚Ð¸ | /telefoËˆnuÊ‹É‘tÉª/ | to phone, call | verb | â€” | + Dat |\n| Ð²Ñ–Ð´Ð¼Ñ–Ð½Ð¾Ðº | /vidËˆminÉ”k/ | grammatical case | noun | m | grammar term |\n| Ð´Ð°Ð²Ð°Ð»ÑŒÐ½Ð¸Ð¹ | /dÉ‘ËˆvÉ‘lÊ²nÉªj/ | Dative (case) | adj | m | ÐºÐ¾Ð¼Ñƒ? Ñ‡Ð¾Ð¼Ñƒ? |\n| Ñ‡Ð°Ñ | /tÍ¡ÊƒÉ‘s/ | time | noun | m | review from A1 |\n\n---"
      }
    ],
    "rawMarkdown": "---\nmodule: a2-03\ntitle: \"Dative Verbs\"\nsubtitle: \"Helping, Thanking, and Believing\"\nversion: \"1.0\"\nphase: \"A2.1\"\npedagogy: \"PPP\"\nduration: \"60 min\"\ntransliteration: none\ntags:\n  - grammar\n  - verbs\n  - dative\n  - case government\ngrammar:\n  - verbs with dative\n  - dative-only verbs\n  - dative + accusative verbs\nobjectives:\n  - \"Learner can identify verbs that require only dative objects\"\n  - \"Learner can use verbs with dative + accusative objects\"\n  - \"Learner can distinguish between dative-only and dative+accusative verbs\"\n  - \"Learner can express feelings and states using dative constructions\"\nvocabulary_count: 28\n---\n# Introduction\n\nIn this module, you'll discover which Ukrainian verbs require the Dative case â€” these are verbs of helping, thanking, believing, and trusting. Understanding verb \"case government\" (which case a verb requires) is essential for speaking Ukrainian correctly.\n\n**What you'll learn:**\n- **Dative-only verbs** that always take Dative objects: Ð´Ð¾Ð¿Ð¾Ð¼Ð°Ð³Ð°Ñ‚Ð¸, Ð·Ð°Ð²Ð°Ð¶Ð°Ñ‚Ð¸, Ð¿Ð¾Ð´Ð¾Ð±Ð°Ñ‚Ð¸ÑÑ, Ð²Ñ–Ñ€Ð¸Ñ‚Ð¸, Ð´Ð¾Ð²Ñ–Ñ€ÑÑ‚Ð¸, Ð´ÑÐºÑƒÐ²Ð°Ñ‚Ð¸\n- **Dative + Accusative verbs** that need both a recipient and a thing: Ð´Ð°Ð²Ð°Ñ‚Ð¸, Ð¿Ð¾ÐºÐ°Ð·ÑƒÐ²Ð°Ñ‚Ð¸, Ð¿Ð¾ÑÑÐ½ÑŽÐ²Ð°Ñ‚Ð¸\n- **Dative + Infinitive patterns** for permission and prohibition: Ð´Ð¾Ð·Ð²Ð¾Ð»ÑÑ‚Ð¸, Ð·Ð°Ð±Ð¾Ñ€Ð¾Ð½ÑÑ‚Ð¸\n- The special structure of **Ð¿Ð¾Ð´Ð¾Ð±Ð°Ñ‚Ð¸ÑÑ** â€” where English says \"I like coffee,\" Ukrainian says \"Coffee pleases to me\"\n\n**Why this matters:**\nEnglish uses the same direct object for \"I help my mother\" and \"I see my mother.\" But Ukrainian distinguishes them by case: Ð¯ Ð´Ð¾Ð¿Ð¾Ð¼Ð°Ð³Ð°ÑŽ Ð¼Ð°Ð¼Ñ– (Dative â€” helping is directed TO someone) vs. Ð¯ Ð±Ð°Ñ‡Ñƒ Ð¼Ð°Ð¼Ñƒ (Accusative â€” seeing affects someone directly).\n\n# Warm-up\n\nÐ’Ð¸ Ð²Ð¶Ðµ Ð·Ð½Ð°Ñ”Ñ‚Ðµ, ÑÐº ÑƒÑ‚Ð²Ð¾Ñ€ÑŽÐ²Ð°Ñ‚Ð¸ Ð´Ð°Ð²Ð°Ð»ÑŒÐ½Ð¸Ð¹ Ð²Ñ–Ð´Ð¼Ñ–Ð½Ð¾Ðº Ð·Ð°Ð¹Ð¼ÐµÐ½Ð½Ð¸ÐºÑ–Ð² Ñ– Ñ–Ð¼ÐµÐ½Ð½Ð¸ÐºÑ–Ð². Ð¢ÐµÐ¿ÐµÑ€ Ñ‡Ð°Ñ Ð´Ñ–Ð·Ð½Ð°Ñ‚Ð¸ÑÑ, ÑÐºÑ– Ð´Ñ–Ñ”ÑÐ»Ð¾Ð²Ð° \"Ð»ÑŽÐ±Ð»ÑÑ‚ÑŒ\" Ð´Ð°Ð²Ð°Ð»ÑŒÐ½Ð¸Ð¹ Ð²Ñ–Ð´Ð¼Ñ–Ð½Ð¾Ðº!\n\nSome verbs in Ukrainian are \"dative-hungry\" â€” they always need a dative object. When you help someone, you Ð´Ð¾Ð¿Ð¾Ð¼Ð°Ð³Ð°Ñ”Ñˆ **ÐºÐ¾Ð¼ÑƒÑÑŒ** (help *to someone*). When you believe someone, you Ð²Ñ–Ñ€Ð¸Ñˆ **ÐºÐ¾Ð¼ÑƒÑÑŒ** (believe *to someone*). The dative is built into how these verbs work.\n\nThink about English: \"I help my mother\" uses a direct object. But Ukrainian says \"I help *to* my mother\" â€” Ð¯ Ð´Ð¾Ð¿Ð¾Ð¼Ð°Ð³Ð°ÑŽ Ð¼Ð°Ð¼Ñ–.\n\n> [!resources] ðŸ”— External Resources\n>\n> **YouTube:** [10 Ukrainian Verbs that take Dative Case...](https://www.youtube.com/watch?v=pZvCMMjtAo0) â€” Let's Learn Ukrainian\n>\n> **Grammar Guide:** [Ukrainian Cases Overview](https://www.ukrainianlessons.com/intro-cases/) â€” All 7 cases explained\n>\n> **Interactive:** [Talk Ukrainian - Cases](https://talkukrainian.com/grammatical-cases/) â€” Practice exercises\n\n---\n\n# Presentation\n\n## Dative-Only Verbs\n\nIn Ukrainian, certain verbs are fundamentally different from their English equivalents â€” they always require a dative object rather than a direct object. This is called \"case government\" and means the verb itself determines which case its object must take.\n\nFor English speakers, this requires a mental shift. You might think \"I help my mother\" has a direct object, but Ukrainian conceptualizes this as \"I help *to* my mother.\" The action is directed toward someone, making the dative case natural.\n\nThese verbs ALWAYS require a dative object â€” they cannot take an accusative:\n\n| Verb | Meaning | Example |\n|------|---------|---------|\n| Ð´Ð¾Ð¿Ð¾Ð¼Ð°Ð³Ð°Ñ‚Ð¸ | to help | Ð¯ Ð´Ð¾Ð¿Ð¾Ð¼Ð°Ð³Ð°ÑŽ Ð¼Ð°Ð¼Ñ–. |\n| Ð·Ð°Ð²Ð°Ð¶Ð°Ñ‚Ð¸ | to bother/disturb | ÐœÑƒÐ·Ð¸ÐºÐ° Ð·Ð°Ð²Ð°Ð¶Ð°Ñ” ÑÑƒÑÑ–Ð´Ð°Ð¼. |\n| Ð¿Ð¾Ð´Ð¾Ð±Ð°Ñ‚Ð¸ÑÑ | to please/be liked | ÐœÐµÐ½Ñ– Ð¿Ð¾Ð´Ð¾Ð±Ð°Ñ”Ñ‚ÑŒÑÑ Ñ†Ñ ÐºÐ½Ð¸Ð³Ð°. |\n| Ð²Ñ–Ñ€Ð¸Ñ‚Ð¸ | to believe | Ð¯ Ð²Ñ–Ñ€ÑŽ Ð´Ñ€ÑƒÐ³Ð¾Ð²Ñ–. |\n| Ð´Ð¾Ð²Ñ–Ñ€ÑÑ‚Ð¸ | to trust | ÐœÐ¸ Ð´Ð¾Ð²Ñ–Ñ€ÑÑ”Ð¼Ð¾ Ð»Ñ–ÐºÐ°Ñ€ÐµÐ²Ñ–. |\n| Ð´ÑÐºÑƒÐ²Ð°Ñ‚Ð¸ | to thank | Ð”ÑÐºÑƒÑŽ Ð²Ñ‡Ð¸Ñ‚ÐµÐ»ÐµÐ²Ñ–! |\n| Ð²Ð¸Ð±Ð°Ñ‡Ð°Ñ‚Ð¸ | to forgive | Ð¯ Ð²Ð¸Ð±Ð°Ñ‡Ð°ÑŽ Ñ‚Ð¾Ð±Ñ–. |\n| Ð·Ð°Ð·Ð´Ñ€Ð¸Ñ‚Ð¸ | to envy | Ð’Ð¾Ð½Ð° Ð·Ð°Ð·Ð´Ñ€Ð¸Ñ‚ÑŒ Ð¿Ð¾Ð´Ñ€ÑƒÐ·Ñ–. |\n| ÑÐ¸Ð¼Ð¿Ð°Ñ‚Ð¸Ð·ÑƒÐ²Ð°Ñ‚Ð¸ | to sympathize | Ð¯ ÑÐ¸Ð¼Ð¿Ð°Ñ‚Ð¸Ð·ÑƒÑŽ Ñ†Ñ–Ð¹ Ñ–Ð´ÐµÑ—. |\n| ÑÐ¿Ñ–Ð²Ñ‡ÑƒÐ²Ð°Ñ‚Ð¸ | to feel for | ÐœÐ¸ ÑÐ¿Ñ–Ð²Ñ‡ÑƒÐ²Ð°Ñ”Ð¼Ð¾ Ñ€Ð¾Ð´Ð¸Ð½Ñ–. |\n\n> [!tip] ÐŸÐ¾Ð´Ð¾Ð±Ð°Ñ‚Ð¸ÑÑ â€” A Special Verb That Flips the Sentence\n> In English, \"I like the book\" makes \"I\" the subject and \"book\" the object. Ukrainian flips this completely! \"The book pleases *to me*\" â€” ÐšÐ½Ð¸Ð³Ð° Ð¿Ð¾Ð´Ð¾Ð±Ð°Ñ”Ñ‚ÑŒÑÑ **Ð¼ÐµÐ½Ñ–**. The thing liked becomes the grammatical subject (nominative case), and the person experiencing the liking is in the dative case.\n>\n> **Think of it this way:** In Ukrainian, you don't actively \"do\" liking â€” rather, things please YOU. This passive experience is expressed with dative.\n\n### The ÐŸÐ¾Ð´Ð¾Ð±Ð°Ñ‚Ð¸ÑÑ Pattern\n\nThis verb deserves special attention because it flips the typical English sentence structure. Rather than saying \"I like coffee,\" Ukrainian says \"Coffee is pleasing to me.\" The experiencer (the person doing the liking) goes in the dative case, while the thing being liked becomes the grammatical subject.\n\n| English | Ukrainian | Word Order |\n|---------|-----------|------------|\n| I like coffee | ÐœÐµÐ½Ñ– Ð¿Ð¾Ð´Ð¾Ð±Ð°Ñ”Ñ‚ÑŒÑÑ ÐºÐ°Ð²Ð° | Dative + verb + subject |\n| You like music | Ð¢Ð¾Ð±Ñ– Ð¿Ð¾Ð´Ð¾Ð±Ð°Ñ”Ñ‚ÑŒÑÑ Ð¼ÑƒÐ·Ð¸ÐºÐ° | Dative + verb + subject |\n| He likes this film | Ð™Ð¾Ð¼Ñƒ Ð¿Ð¾Ð´Ð¾Ð±Ð°Ñ”Ñ‚ÑŒÑÑ Ñ†ÐµÐ¹ Ñ„Ñ–Ð»ÑŒÐ¼ | Dative + verb + subject |\n\nÐœÐµÐ½Ñ– Ð¿Ð¾Ð´Ð¾Ð±Ð°ÑŽÑ‚ÑŒÑÑ Ñ†Ñ– ÐºÐ½Ð¸Ð³Ð¸. (I like these books.)\nÐ‡Ð¹ Ð½Ðµ Ð¿Ð¾Ð´Ð¾Ð±Ð°Ñ”Ñ‚ÑŒÑÑ Ñ†Ñ Ñ–Ð´ÐµÑ. (She doesn't like this idea.)\nÐÐ°Ð¼ Ð¿Ð¾Ð´Ð¾Ð±Ð°Ñ”Ñ‚ÑŒÑÑ Ð£ÐºÑ€Ð°Ñ—Ð½Ð°! (We like Ukraine!)\n\n> [!example] Ð£ ÐºÑ–Ð½Ð¾Ñ‚ÐµÐ°Ñ‚Ñ€Ñ– Ð² ÐžÐ´ÐµÑÑ– (At the Cinema in Odesa)\n> â€” Ð¢Ð¾Ð±Ñ– ÑÐ¿Ð¾Ð´Ð¾Ð±Ð°Ð²ÑÑ Ñ„Ñ–Ð»ÑŒÐ¼? (Did you like the film?)\n> â€” Ð¢Ð°Ðº! ÐœÐµÐ½Ñ– Ð´ÑƒÐ¶Ðµ ÑÐ¿Ð¾Ð´Ð¾Ð±Ð°Ð»Ð°ÑÑ Ð³Ð¾Ð»Ð¾Ð²Ð½Ð° Ð³ÐµÑ€Ð¾Ñ—Ð½Ñ. (Yes! I really liked the main heroine.)\n> â€” Ð Ð¼ÐµÐ½Ñ– ÑÐ¿Ð¾Ð´Ð¾Ð±Ð°Ð»Ð°ÑÑŒ Ð¼ÑƒÐ·Ð¸ÐºÐ°. (And I liked the music.)\n> â€” ÐÐ°Ð¼ Ð¾Ð±Ð¾Ð¼ ÑÐ¿Ð¾Ð´Ð¾Ð±Ð°Ð²ÑÑ Ñ†ÐµÐ¹ Ð²ÐµÑ‡Ñ–Ñ€! (We both liked this evening!)\n\n## Verbs with Dative + Accusative\n\nMany Ukrainian verbs need two objects: something being transferred and someone receiving it. These follow the \"ditransitive\" pattern found in English sentences like \"I gave **her** a **book**.\" In Ukrainian, the recipient goes in the dative case, and the thing being transferred goes in the accusative case.\n\nThese verbs take TWO objects: a dative (recipient) and an accusative (thing):\n\n| Verb | Pattern | Example |\n|------|---------|---------|\n| Ð´Ð°Ð²Ð°Ñ‚Ð¸ | Dat + Acc | Ð¯ Ð´Ð°ÑŽ Ð¼Ð°Ð¼Ñ– ÐºÐ²Ñ–Ñ‚Ð¸. |\n| Ð´Ð°Ñ€ÑƒÐ²Ð°Ñ‚Ð¸ | Dat + Acc | Ð’Ñ–Ð½ Ð´Ð°Ñ€ÑƒÑ” Ð´Ñ–Ð²Ñ‡Ð¸Ð½Ñ– Ð¿Ð¾Ð´Ð°Ñ€ÑƒÐ½Ð¾Ðº. |\n| Ð¿Ð¾ÐºÐ°Ð·ÑƒÐ²Ð°Ñ‚Ð¸ | Dat + Acc | Ð’Ð¾Ð½Ð° Ð¿Ð¾ÐºÐ°Ð·ÑƒÑ” Ð´Ñ€ÑƒÐ·ÑÐ¼ Ñ„Ð¾Ñ‚Ð¾. |\n| Ð¿Ð¾ÑÑÐ½ÑŽÐ²Ð°Ñ‚Ð¸ | Dat + Acc | Ð’Ñ‡Ð¸Ñ‚ÐµÐ»ÑŒ Ð¿Ð¾ÑÑÐ½ÑŽÑ” ÑƒÑ‡Ð½ÑÐ¼ Ð¿Ñ€Ð°Ð²Ð¸Ð»Ð¾. |\n| Ñ€Ð¾Ð·Ð¿Ð¾Ð²Ñ–Ð´Ð°Ñ‚Ð¸ | Dat + Acc | Ð‘Ð°Ð±ÑƒÑÑ Ñ€Ð¾Ð·Ð¿Ð¾Ð²Ñ–Ð´Ð°Ñ” Ð´Ñ–Ñ‚ÑÐ¼ ÐºÐ°Ð·ÐºÑƒ. |\n| Ð¿Ð¾ÑÐ¸Ð»Ð°Ñ‚Ð¸ | Dat + Acc | ÐœÐ¸ Ð¿Ð¾ÑÐ¸Ð»Ð°Ñ”Ð¼Ð¾ Ð±Ð°Ñ‚ÑŒÐºÐ°Ð¼ Ð»Ð¸ÑÑ‚Ð°. |\n| Ð¿Ð¸ÑÐ°Ñ‚Ð¸ | Dat + Acc | Ð¯ Ð¿Ð¸ÑˆÑƒ Ð´Ñ€ÑƒÐ³Ð¾Ð²Ñ– Ð¿Ð¾Ð²Ñ–Ð´Ð¾Ð¼Ð»ÐµÐ½Ð½Ñ. |\n| Ñ€Ð°Ð´Ð¸Ñ‚Ð¸ | Dat + Acc | Ð›Ñ–ÐºÐ°Ñ€ Ñ€Ð°Ð´Ð¸Ñ‚ÑŒ Ð¿Ð°Ñ†Ñ–Ñ”Ð½Ñ‚Ð¾Ð²Ñ– Ð»Ñ–ÐºÐ¸. |\n\n> [!info] Word Order Flexibility â€” Cases Set You Free\n> In Ukrainian, word order is remarkably flexible because case endings do the work of showing grammatical relationships. You can emphasize different elements by moving them to sentence-initial position:\n> - **Ð¯ Ð´Ð°ÑŽ Ð¼Ð°Ð¼Ñ– ÐºÐ²Ñ–Ñ‚Ð¸.** (neutral statement)\n> - **ÐœÐ°Ð¼Ñ– Ñ Ð´Ð°ÑŽ ÐºÐ²Ñ–Ñ‚Ð¸.** (emphasis: it's specifically to MOM I give flowers)\n> - **ÐšÐ²Ñ–Ñ‚Ð¸ Ñ Ð´Ð°ÑŽ Ð¼Ð°Ð¼Ñ–.** (emphasis: FLOWERS are what I give to mom)\n>\n> In English, changing word order often changes meaning or creates ungrammatical sentences. In Ukrainian, the case endings (Ð¼Ð°Ð¼Ñ– = dative, ÐºÐ²Ñ–Ñ‚Ð¸ = accusative) guarantee clarity regardless of order. This flexibility is one of the beautiful features of Ukrainian grammar!\n\n### The Double Object Pattern\n\nThink of these as \"transfer\" verbs â€” something moves from one person to another:\n\n| Subject | Verb | Dative (recipient) | Accusative (thing) |\n|---------|------|-------------------|-------------------|\n| Ð¯ | Ð´Ð°ÑŽ | Ð¼Ð°Ð¼Ñ– | ÐºÐ½Ð¸Ð³Ñƒ |\n| Ð’Ñ–Ð½ | Ð¿Ð¾ÐºÐ°Ð·ÑƒÑ” | Ð´Ñ€ÑƒÐ³Ð¾Ð²Ñ– | Ñ„Ð¾Ñ‚Ð¾ |\n| ÐœÐ¸ | Ð¿Ð¾ÑÑÐ½ÑŽÑ”Ð¼Ð¾ | ÑƒÑ‡Ð½ÑÐ¼ | Ð¿Ñ€Ð°Ð²Ð¸Ð»Ð¾ |\n\nÐ‘Ð°Ñ‚ÑŒÐºÐ¾ Ñ‡Ð¸Ñ‚Ð°Ñ” Ð´Ñ–Ñ‚ÑÐ¼ ÐºÐ°Ð·ÐºÑƒ. (Father reads the children a story.)\nÐžÑ„Ñ–Ñ†Ñ–Ð°Ð½Ñ‚ Ð¿Ñ€Ð¸Ð½Ð¾ÑÐ¸Ñ‚ÑŒ Ð³Ð¾ÑÑ‚ÑÐ¼ Ð¼ÐµÐ½ÑŽ. (The waiter brings the guests a menu.)\nÐ¯ Ð¿Ð¸ÑˆÑƒ Ð±Ð°Ð±ÑƒÑÑ– Ð»Ð¸ÑÑ‚Ð° ÐºÐ¾Ð¶Ð½Ð¾Ð³Ð¾ Ñ‚Ð¸Ð¶Ð½Ñ. (I write grandma a letter every week.)\n\n## Verbs of Permission and Prohibition\n\nThese verbs take a dative person + infinitive action:\n\n| Verb | Meaning | Pattern |\n|------|---------|---------|\n| Ð´Ð¾Ð·Ð²Ð¾Ð»ÑÑ‚Ð¸ | to allow | Dat + Inf |\n| Ð·Ð°Ð±Ð¾Ñ€Ð¾Ð½ÑÑ‚Ð¸ | to forbid | Dat + Inf |\n| Ð·Ð°Ð²Ð°Ð¶Ð°Ñ‚Ð¸ | to prevent | Dat + Inf |\n| Ð´Ð¾Ð¿Ð¾Ð¼Ð°Ð³Ð°Ñ‚Ð¸ | to help | Dat + Inf |\n\nÐœÐ°Ð¼Ð° Ð´Ð¾Ð·Ð²Ð¾Ð»ÑÑ” Ð´Ñ–Ñ‚ÑÐ¼ Ð³Ñ€Ð°Ñ‚Ð¸ÑÑ. (Mom allows the children to play.)\nÐ›Ñ–ÐºÐ°Ñ€ Ð·Ð°Ð±Ð¾Ñ€Ð¾Ð½ÑÑ” Ð¿Ð°Ñ†Ñ–Ñ”Ð½Ñ‚Ð¾Ð²Ñ– ÐºÑƒÑ€Ð¸Ñ‚Ð¸. (The doctor forbids the patient to smoke.)\nÐ”Ð¾Ñ‰ Ð·Ð°Ð²Ð°Ð¶Ð°Ñ” Ð½Ð°Ð¼ Ð³ÑƒÐ»ÑÑ‚Ð¸. (Rain prevents us from walking.)\nÐ¯ Ð´Ð¾Ð¿Ð¾Ð¼Ð°Ð³Ð°ÑŽ Ð±Ñ€Ð°Ñ‚Ð¾Ð²Ñ– Ð²Ñ‡Ð¸Ñ‚Ð¸ÑÑ. (I help my brother study.)\n\n> [!warning] Common Mistake: Forgetting the Dative\n> A very common error for English speakers is using accusative instead of dative with these verbs. This happens because English uses direct objects (\"I help my mother\") where Ukrainian uses dative (\"I help to my mother\").\n>\n> **Watch out for this pattern:**\n> - âŒ Ð¯ Ð´Ð¾Ð¿Ð¾Ð¼Ð°Ð³Ð°ÑŽ Ð¼Ð°Ð¼Ñƒ. (wrong â€” accusative)\n> - âœ… Ð¯ Ð´Ð¾Ð¿Ð¾Ð¼Ð°Ð³Ð°ÑŽ Ð¼Ð°Ð¼Ñ–. (correct â€” dative)\n> - âŒ Ð¯ Ð²Ñ–Ñ€ÑŽ Ñ‚ÐµÐ±Ðµ. (wrong â€” accusative)\n> - âœ… Ð¯ Ð²Ñ–Ñ€ÑŽ Ñ‚Ð¾Ð±Ñ–. (correct â€” dative)\n>\n> The verb determines the case â€” these verbs ALWAYS require dative, no exceptions!\n\n---\n\n# Cultural Insight\n\nUnderstanding how Ukrainians express gratitude and ask for forgiveness reveals deeper cultural values. The verbs in this section â€” Ð´ÑÐºÑƒÐ²Ð°Ñ‚Ð¸ (to thank), Ð²Ð¸Ð±Ð°Ñ‡Ð°Ñ‚Ð¸ (to excuse), and Ð¿Ñ€Ð¾Ð±Ð°Ñ‡Ð°Ñ‚Ð¸ (to forgive) â€” all take Dative objects, reflecting the idea that these acts are directed TO someone.\n\n## Ð”ÑÐºÑƒÐ²Ð°Ñ‚Ð¸ â€” The Art of Thanking\n\nUkrainians have a rich culture of expressing gratitude, and the language provides multiple ways to thank someone with varying levels of formality and warmth. The verb Ð´ÑÐºÑƒÐ²Ð°Ñ‚Ð¸ always takes a Dative object â€” the person being thanked.\n\nÐ”ÑÐºÑƒÐ²Ð°Ñ‚Ð¸ takes the dative:\n\n| Expression | Meaning | Formality |\n|------------|---------|-----------|\n| Ð”ÑÐºÑƒÑŽ! | Thanks! | neutral |\n| Ð”ÑÐºÑƒÑŽ Ñ‚Ð¾Ð±Ñ–! | Thank you! | informal |\n| Ð”ÑÐºÑƒÑŽ Ð²Ð°Ð¼! | Thank you! | formal/plural |\n| Ð©Ð¸Ñ€Ð¾ Ð´ÑÐºÑƒÑŽ! | Heartfelt thanks! | warm |\n| Ð”ÑƒÐ¶Ðµ Ð´ÑÐºÑƒÑŽ! | Thank you very much! | emphatic |\n\nÐ”ÑÐºÑƒÑŽ Ð»Ñ–ÐºÐ°Ñ€ÐµÐ²Ñ– Ð·Ð° Ð´Ð¾Ð¿Ð¾Ð¼Ð¾Ð³Ñƒ. (Thank the doctor for help.)\nÐ”ÑÐºÑƒÑ”Ð¼Ð¾ Ð²Ñ‡Ð¸Ñ‚ÐµÐ»ÐµÐ²Ñ– Ð·Ð° ÑƒÑ€Ð¾Ðº. (We thank the teacher for the lesson.)\n\n> [!tip] Ð”ÑÐºÑƒÑŽ vs. Ð¡Ð¿Ð°ÑÐ¸Ð±Ñ– â€” When to use each\n> Both words mean \"thank you,\" but they have different origins and connotations:\n> - **Ð”ÑÐºÑƒÑŽ** â€” the native Ukrainian word, derived from an ancient Slavic root meaning \"to give thanks.\" Preferred in formal contexts, written Ukrainian, and official speech.\n> - **Ð¡Ð¿Ð°ÑÐ¸Ð±Ñ–** â€” derived from the phrase \"ÑÐ¿Ð°ÑÐ¸ Ð‘Ð¾Ð¶Ðµ\" (may God save/bless you). More casual and commonly used in everyday conversation.\n>\n> In professional settings, academic environments, and when writing, Ukrainians tend to prefer Ð´ÑÐºÑƒÑŽ. Among friends and family, ÑÐ¿Ð°ÑÐ¸Ð±Ñ– is perfectly natural.\n\n## Ð’Ð¸Ð±Ð°Ñ‡Ð°Ñ‚Ð¸ Ñ– ÐŸÑ€Ð¾Ð±Ð°Ñ‡Ð°Ñ‚Ð¸ â€” Two Levels of Forgiveness\n\nUkrainian distinguishes between two levels of forgiveness, each with its own verb. Both take Dative objects â€” the person being forgiven. Understanding this distinction helps you choose the right word for the situation.\n\n- **Ð²Ð¸Ð±Ð°Ñ‡Ð°Ñ‚Ð¸** â€” to excuse, forgive (for minor things like bumping into someone, being late, or small mistakes)\n- **Ð¿Ñ€Ð¾Ð±Ð°Ñ‡Ð°Ñ‚Ð¸** â€” to forgive (for serious offenses that hurt someone deeply, betrayals, or major wrongdoing)\n\nÐ’Ð¸Ð±Ð°Ñ‡Ñ‚Ðµ Ð¼ÐµÐ½Ñ–! (Excuse me!)\nÐ¯ Ð²Ð¸Ð±Ð°Ñ‡Ð°ÑŽ Ñ‚Ð¾Ð±Ñ– Ñ†ÑŽ Ð¿Ð¾Ð¼Ð¸Ð»ÐºÑƒ. (I forgive you this mistake.)\nÐ§Ð¸ Ð¼Ð¾Ð¶ÐµÑˆ Ñ‚Ð¸ Ð¿Ñ€Ð¾Ð±Ð°Ñ‡Ð¸Ñ‚Ð¸ Ð¼ÐµÐ½Ñ–? (Can you forgive me?)\n\n> [!note] Language Evolution and Cultural Values\n> The distinction between Ð²Ð¸Ð±Ð°Ñ‡Ð°Ñ‚Ð¸ and Ð¿Ñ€Ð¾Ð±Ð°Ñ‡Ð°Ñ‚Ð¸ reflects deeper cultural values embedded in the Ukrainian language. Ukrainian traditionally reserves stronger, more emotionally weighted words for serious matters, while using lighter variants for everyday situations.\n>\n> This careful gradation of meaning shows how the language encourages thoughtful, measured communication about sensitive topics like forgiveness. You wouldn't use Ð¿Ñ€Ð¾Ð±Ð°Ñ‡Ð°Ñ‚Ð¸ for stepping on someone's toe â€” that would feel dramatically out of proportion. Conversely, using Ð²Ð¸Ð±Ð°Ñ‡Ð°Ñ‚Ð¸ for a serious betrayal would seem dismissive.\n>\n> Learning to choose the right word for the situation is part of developing cultural fluency, not just grammatical accuracy.\n\n> [!example] Ð Ð¾Ð´Ð¸Ð½Ð½Ð° ÑÑ†ÐµÐ½Ð° Ð² Ð¥Ð°Ñ€ÐºÐ¾Ð²Ñ– (Family Scene in Kharkiv)\n> â€” ÐœÐ°Ð¼Ð¾, Ð²Ð¸Ð±Ð°Ñ‡ Ð¼ÐµÐ½Ñ–. Ð¯ Ñ€Ð¾Ð·Ð±Ð¸Ð² Ñ‚Ð²Ð¾ÑŽ Ð²Ð°Ð·Ñƒ. (Mom, excuse me. I broke your vase.)\n> â€” Ð¢Ð¸ Ð·Ð½Ð°Ñ”Ñˆ, ÑÐº Ñ Ð»ÑŽÐ±Ð»ÑŽ Ñ†ÑŽ Ð²Ð°Ð·Ñƒ! (You know how I love that vase!)\n> â€” Ð¯ Ð´ÑƒÐ¶Ðµ ÑˆÐºÐ¾Ð´ÑƒÑŽ. Ð¢Ð¸ Ð¿Ñ€Ð¾Ð±Ð°Ñ‡Ð°Ñ”Ñˆ Ð¼ÐµÐ½Ñ–? (I'm very sorry. Do you forgive me?)\n> â€” Ð—Ð²Ð¸Ñ‡Ð°Ð¹Ð½Ð¾ Ð¿Ñ€Ð¾Ð±Ð°Ñ‡Ð°ÑŽ. Ð¢Ð¸ Ð¼Ñ–Ð¹ ÑÐ¸Ð½. (Of course I forgive you. You're my son.)\n\n---\n\n# Practice\n\nNow let's practice using Dative verbs in context. The key skill is identifying whether a verb takes Dative alone or needs both Dative and Accusative objects.\n\n**Quick reference:**\n- **Dative only:** Ð´Ð¾Ð¿Ð¾Ð¼Ð°Ð³Ð°Ñ‚Ð¸, Ð·Ð°Ð²Ð°Ð¶Ð°Ñ‚Ð¸, Ð¿Ð¾Ð´Ð¾Ð±Ð°Ñ‚Ð¸ÑÑ, Ð²Ñ–Ñ€Ð¸Ñ‚Ð¸, Ð´Ð¾Ð²Ñ–Ñ€ÑÑ‚Ð¸, Ð´ÑÐºÑƒÐ²Ð°Ñ‚Ð¸ â€” the verb only needs a recipient\n- **Dative + Accusative:** Ð´Ð°Ð²Ð°Ñ‚Ð¸, Ð¿Ð¾ÐºÐ°Ð·ÑƒÐ²Ð°Ñ‚Ð¸, Ð¿Ð¾ÑÑÐ½ÑŽÐ²Ð°Ñ‚Ð¸, Ñ€Ð¾Ð·Ð¿Ð¾Ð²Ñ–Ð´Ð°Ñ‚Ð¸ â€” the verb needs both a recipient AND a thing being transferred\n\n## Dative-Only or Dative + Accusative?\n\nClassify these verbs:\n\n| Verb | Type |\n|------|------|\n| Ð´Ð¾Ð¿Ð¾Ð¼Ð°Ð³Ð°Ñ‚Ð¸ | Dative only |\n| Ð´Ð°Ð²Ð°Ñ‚Ð¸ | Dative + Accusative |\n| Ð·Ð°Ð²Ð°Ð¶Ð°Ñ‚Ð¸ | Dative only |\n| Ð¿Ð¾ÐºÐ°Ð·ÑƒÐ²Ð°Ñ‚Ð¸ | Dative + Accusative |\n| Ð²Ñ–Ñ€Ð¸Ñ‚Ð¸ | Dative only |\n| Ð¿Ð¾ÑÑÐ½ÑŽÐ²Ð°Ñ‚Ð¸ | Dative + Accusative |\n\n## Complete the Pattern\n\n1. Ð¯ Ð´Ð¾Ð¿Ð¾Ð¼Ð°Ð³Ð°ÑŽ ___. (Ð±Ñ€Ð°Ñ‚) â†’ Ð±Ñ€Ð°Ñ‚Ð¾Ð²Ñ–\n2. Ð’Ð¾Ð½Ð° Ð´Ð°Ñ” ___ ÐºÐ½Ð¸Ð³Ñƒ. (ÑÐµÑÑ‚Ñ€Ð°) â†’ ÑÐµÑÑ‚Ñ€Ñ–\n3. ÐœÐµÐ½Ñ– Ð¿Ð¾Ð´Ð¾Ð±Ð°Ñ”Ñ‚ÑŒÑÑ ___. (Ñ†ÐµÐ¹ Ñ„Ñ–Ð»ÑŒÐ¼) â†’ Ñ†ÐµÐ¹ Ñ„Ñ–Ð»ÑŒÐ¼ (subject!)\n4. Ð’Ñ–Ð½ Ñ€Ð¾Ð·Ð¿Ð¾Ð²Ñ–Ð´Ð°Ñ” ___ ÐºÐ°Ð·ÐºÑƒ. (Ð´Ñ–Ñ‚Ð¸) â†’ Ð´Ñ–Ñ‚ÑÐ¼\n5. ÐœÐ¸ Ð´ÑÐºÑƒÑ”Ð¼Ð¾ ___. (Ð²Ñ‡Ð¸Ñ‚ÐµÐ»ÑŒ) â†’ Ð²Ñ‡Ð¸Ñ‚ÐµÐ»ÐµÐ²Ñ–\n\n## Mini-Dialogues\n\nThe following dialogues show Dative verbs in natural conversation. Notice how Ð´Ð¾Ð¿Ð¾Ð¼Ð°Ð³Ð°Ñ‚Ð¸, Ð¿Ð¾Ð´Ð¾Ð±Ð°Ñ‚Ð¸ÑÑ, Ð·Ð°Ð²Ð°Ð¶Ð°Ñ‚Ð¸, and Ñ€Ð°Ð´Ð¸Ñ‚Ð¸ all take Dative objects.\n\n**Dialogue 1: Ð£ Ð±Ñ–Ð±Ð»Ñ–Ð¾Ñ‚ÐµÑ†Ñ– (At the Library)**\n\nThis dialogue demonstrates Ð´Ð¾Ð¿Ð¾Ð¼Ð°Ð³Ð°Ñ‚Ð¸ (to help) with Dative â€” notice the librarian says \"Ð¯ Ð¿Ð¾ÐºÐ°Ð¶Ñƒ Ð²Ð°Ð¼\" (I'll show to you).\n\n**Ð£ Ð±Ñ–Ð±Ð»Ñ–Ð¾Ñ‚ÐµÑ†Ñ–:**\nâ€” Ð’Ð¸Ð±Ð°Ñ‡Ñ‚Ðµ, Ð²Ð¸ Ð¼Ð¾Ð¶ÐµÑ‚Ðµ Ð´Ð¾Ð¿Ð¾Ð¼Ð¾Ð³Ñ‚Ð¸ Ð¼ÐµÐ½Ñ–?\nâ€” Ð—Ð²Ð¸Ñ‡Ð°Ð¹Ð½Ð¾! Ð©Ð¾ Ð²Ð°Ð¼ Ð¿Ð¾Ñ‚Ñ€Ñ–Ð±Ð½Ð¾?\nâ€” Ð¯ ÑˆÑƒÐºÐ°ÑŽ ÐºÐ½Ð¸Ð³Ñƒ Ð¿Ñ€Ð¾ Ñ–ÑÑ‚Ð¾Ñ€Ñ–ÑŽ Ð£ÐºÑ€Ð°Ñ—Ð½Ð¸.\nâ€” Ð¯ Ð¿Ð¾ÐºÐ°Ð¶Ñƒ Ð²Ð°Ð¼, Ð´Ðµ Ð²Ð¾Ð½Ð° ÑÑ‚Ð¾Ñ—Ñ‚ÑŒ.\nâ€” Ð”ÑÐºÑƒÑŽ Ð²Ð°Ð¼!\n\n**Dialogue 2: ÐÐ° Ð²ÐµÑ‡Ñ–Ñ€Ñ†Ñ– (At the Party)**\n\nHere Ð·Ð°Ð²Ð°Ð¶Ð°Ñ‚Ð¸ (to bother) and Ð¿Ð¾Ð´Ð¾Ð±Ð°Ñ‚Ð¸ÑÑ (to please) both need Dative: Ñ‚Ð¾Ð±Ñ–, Ð¼ÐµÐ½Ñ–.\n\n**ÐÐ° Ð²ÐµÑ‡Ñ–Ñ€Ñ†Ñ–:**\nâ€” Ð¦Ñ Ð¼ÑƒÐ·Ð¸ÐºÐ° Ð·Ð°Ð²Ð°Ð¶Ð°Ñ” Ñ‚Ð¾Ð±Ñ–?\nâ€” ÐÑ–, Ð¼ÐµÐ½Ñ– Ð¿Ð¾Ð´Ð¾Ð±Ð°Ñ”Ñ‚ÑŒÑÑ Ñ†Ñ Ð¼ÑƒÐ·Ð¸ÐºÐ°!\nâ€” Ð¡Ð¿Ñ€Ð°Ð²Ð´Ñ–? ÐœÐµÐ½Ñ– Ð²Ð¾Ð½Ð° Ð½Ðµ Ð¿Ð¾Ð´Ð¾Ð±Ð°Ñ”Ñ‚ÑŒÑÑ.\nâ€” ÐšÐ¾Ð¶Ð½Ð¾Ð¼Ñƒ ÑÐ²Ð¾Ñ”!\n\n**Dialogue 3: Ð£ Ð»Ñ–ÐºÐ°Ñ€Ð½Ñ– (At the Hospital)**\n\nHere Ñ€Ð°Ð´Ð¸Ñ‚Ð¸ (to advise) takes Dat + Acc (recommending something TO someone), and Ð·Ð°Ð±Ð¾Ñ€Ð¾Ð½ÑÑ‚Ð¸ (to forbid) takes Dat + Inf.\n\n**Ð£ Ð»Ñ–ÐºÐ°Ñ€Ð½Ñ–:**\nâ€” Ð›Ñ–ÐºÐ°Ñ€ÑŽ, Ñ‰Ð¾ Ð²Ð¸ Ñ€Ð°Ð´Ð¸Ñ‚Ðµ Ð¼ÐµÐ½Ñ–?\nâ€” Ð¯ Ñ€Ð°Ð´Ð¶Ñƒ Ð²Ð°Ð¼ Ð²Ñ–Ð´Ð¿Ð¾Ñ‡Ð¸Ð²Ð°Ñ‚Ð¸.\nâ€” Ð’Ð¸ Ð·Ð°Ð±Ð¾Ñ€Ð¾Ð½ÑÑ”Ñ‚Ðµ Ð¼ÐµÐ½Ñ– Ð¿Ñ€Ð°Ñ†ÑŽÐ²Ð°Ñ‚Ð¸?\nâ€” Ð¢Ð°Ðº, Ñ Ð·Ð°Ð±Ð¾Ñ€Ð¾Ð½ÑÑŽ Ð²Ð°Ð¼ Ð¿Ñ€Ð°Ñ†ÑŽÐ²Ð°Ñ‚Ð¸ Ñ†ÑŒÐ¾Ð³Ð¾ Ñ‚Ð¸Ð¶Ð½Ñ.\n\n---\n\n# Reading Practice: Ð©Ð¾Ð´ÐµÐ½Ð½Ð¸Ðº Ð²Ñ‡Ð¸Ñ‚ÐµÐ»ÑŒÐºÐ¸\n\nThis reading presents a teacher's diary entries over one week. Each entry uses multiple Dative verbs â€” Ð¿Ð¾ÑÑÐ½ÑŽÐ²Ð°Ñ‚Ð¸, Ð´Ð¾Ð¿Ð¾Ð¼Ð°Ð³Ð°Ñ‚Ð¸, Ð¿Ð¾ÐºÐ°Ð·ÑƒÐ²Ð°Ñ‚Ð¸, Ð´Ð¾Ð·Ð²Ð¾Ð»ÑÑ‚Ð¸, Ð·Ð°Ð±Ð¾Ñ€Ð¾Ð½ÑÑ‚Ð¸, Ð´ÑÐºÑƒÐ²Ð°Ñ‚Ð¸, Ð²Ñ–Ñ€Ð¸Ñ‚Ð¸.\n\n**Reading strategy:** As you read, underline every Dative object. Then answer the comprehension questions to verify you've found them all.\n\n**Vocabulary preview:**\n- Ð¼ÐµÑ‚Ð¾Ð´Ð¸ÐºÐ° â€” teaching method\n- Ð´Ð¸Ñ€ÐµÐºÑ‚Ð¾Ñ€ â€” principal\n- Ñ€ÐµÐ·ÑƒÐ»ÑŒÑ‚Ð°Ñ‚Ð¸ â€” results\n- ÑÑ‚Ð°Ñ€Ð°Ñ‚Ð¸ÑÑ â€” to try hard\n\n> ÐŸÐ¾Ð½ÐµÐ´Ñ–Ð»Ð¾Ðº\n> Ð¡ÑŒÐ¾Ð³Ð¾Ð´Ð½Ñ– Ñ Ð¿Ð¾ÑÑÐ½ÑŽÐ²Ð°Ð»Ð° ÑƒÑ‡Ð½ÑÐ¼ Ð½Ð¾Ð²Ñƒ Ñ‚ÐµÐ¼Ñƒ. Ð’Ð¾Ð½Ð° Ð²Ð°Ð¶ÐºÐ°, Ð°Ð»Ðµ Ñ Ð´Ð¾Ð¿Ð¾Ð¼Ð°Ð³Ð°Ð»Ð° ÐºÐ¾Ð¶Ð½Ð¾Ð¼Ñƒ ÑƒÑ‡Ð½ÐµÐ²Ñ–. ÐžÐ»ÐµÐ³ Ð½Ðµ Ñ€Ð¾Ð·ÑƒÐ¼Ñ–Ð² â€” Ñ Ð¿Ð¾ÐºÐ°Ð·ÑƒÐ²Ð°Ð»Ð° Ð¹Ð¾Ð¼Ñƒ Ð¿Ñ€Ð¸ÐºÐ»Ð°Ð´Ð¸. ÐœÐ°Ñ€Ñ–Ñ Ñ€Ð¾Ð·ÑƒÐ¼Ñ–Ð»Ð° ÑˆÐ²Ð¸Ð´ÐºÐ¾ â€” Ñ Ð´Ð¾Ð·Ð²Ð¾Ð»ÑÐ»Ð° Ñ—Ð¹ Ð´Ð¾Ð¿Ð¾Ð¼Ð°Ð³Ð°Ñ‚Ð¸ Ñ–Ð½ÑˆÐ¸Ð¼.\n>\n> Ð’Ñ–Ð²Ñ‚Ð¾Ñ€Ð¾Ðº\n> Ð‘Ð°Ñ‚ÑŒÐºÐ¸ ÐžÐ»ÐµÐ³Ð° Ñ‚ÐµÐ»ÐµÑ„Ð¾Ð½ÑƒÐ²Ð°Ð»Ð¸ Ð¼ÐµÐ½Ñ–. Ð’Ð¾Ð½Ð¸ Ð´ÑÐºÑƒÐ²Ð°Ð»Ð¸ Ð¼ÐµÐ½Ñ– Ð·Ð° Ð´Ð¾Ð¿Ð¾Ð¼Ð¾Ð³Ñƒ Ñ—Ñ…Ð½ÑŒÐ¾Ð¼Ñƒ ÑÐ¸Ð½Ð¾Ð²Ñ–. ÐœÐµÐ½Ñ– Ð¿Ñ€Ð¸Ñ”Ð¼Ð½Ð¾, ÐºÐ¾Ð»Ð¸ Ð±Ð°Ñ‚ÑŒÐºÐ¸ Ð´Ð¾Ð²Ñ–Ñ€ÑÑŽÑ‚ÑŒ Ð¼ÐµÐ½Ñ–.\n>\n> Ð¡ÐµÑ€ÐµÐ´Ð°\n> Ð¡ÑŒÐ¾Ð³Ð¾Ð´Ð½Ñ– Ñ Ð·Ð°Ð±Ð¾Ñ€Ð¾Ð½ÑÐ»Ð° ÑƒÑ‡Ð½ÑÐ¼ ÐºÐ¾Ñ€Ð¸ÑÑ‚ÑƒÐ²Ð°Ñ‚Ð¸ÑÑ Ñ‚ÐµÐ»ÐµÑ„Ð¾Ð½Ð°Ð¼Ð¸. ÐžÐ´Ð¸Ð½ ÑƒÑ‡ÐµÐ½ÑŒ Ð½Ðµ ÑÐ»ÑƒÑ…Ð°Ð² â€” Ñ†Ðµ Ð·Ð°Ð²Ð°Ð¶Ð°Ð»Ð¾ Ð²ÑÑŒÐ¾Ð¼Ñƒ ÐºÐ»Ð°ÑÑƒ. Ð¯ Ð¿Ð¾ÑÑÐ½ÑŽÐ²Ð°Ð»Ð° Ð¹Ð¾Ð¼Ñƒ Ð¿Ñ€Ð°Ð²Ð¸Ð»Ð°.\n>\n> Ð§ÐµÑ‚Ð²ÐµÑ€\n> Ð”Ð¸Ñ€ÐµÐºÑ‚Ð¾Ñ€ Ñ€Ð°Ð´Ð¸Ð² Ð¼ÐµÐ½Ñ– Ð½Ð¾Ð²Ñƒ Ð¼ÐµÑ‚Ð¾Ð´Ð¸ÐºÑƒ. Ð¯ Ð¿Ð¾ÐºÐ°Ð·ÑƒÐ²Ð°Ð»Ð° Ð¹Ð¾Ð¼Ñƒ Ñ€ÐµÐ·ÑƒÐ»ÑŒÑ‚Ð°Ñ‚Ð¸ ÑƒÑ‡Ð½Ñ–Ð². Ð’Ñ–Ð½ Ð´ÑÐºÑƒÐ²Ð°Ð² Ð¼ÐµÐ½Ñ– Ð·Ð° Ñ€Ð¾Ð±Ð¾Ñ‚Ñƒ.\n>\n> ÐŸ'ÑÑ‚Ð½Ð¸Ñ†Ñ\n> Ð£Ñ‡Ð½Ñ– Ð¿Ð¾Ð´Ð°Ñ€ÑƒÐ²Ð°Ð»Ð¸ Ð¼ÐµÐ½Ñ– ÐºÐ²Ñ–Ñ‚Ð¸! ÐœÐµÐ½Ñ– Ñ‚Ð°Ðº Ð¿Ð¾Ð´Ð¾Ð±Ð°ÑŽÑ‚ÑŒÑÑ Ð¼Ð¾Ñ— ÑƒÑ‡Ð½Ñ–! Ð¯ Ð²Ñ–Ñ€ÑŽ Ñ—Ð¼ â€” Ð²Ð¾Ð½Ð¸ ÑÑ‚Ð°Ñ€Ð°ÑŽÑ‚ÑŒÑÑ.\n\n**Questions:**\n1. ÐšÐ¾Ð¼Ñƒ Ð²Ñ‡Ð¸Ñ‚ÐµÐ»ÑŒÐºÐ° Ð¿Ð¾ÑÑÐ½ÑŽÐ²Ð°Ð»Ð° Ð½Ð¾Ð²Ñƒ Ñ‚ÐµÐ¼Ñƒ? â€” Ð£Ñ‡Ð½ÑÐ¼.\n2. ÐšÐ¾Ð¼Ñƒ Ð²Ð¾Ð½Ð° Ð´Ð¾Ð¿Ð¾Ð¼Ð°Ð³Ð°Ð»Ð°? â€” ÐšÐ¾Ð¶Ð½Ð¾Ð¼Ñƒ ÑƒÑ‡Ð½ÐµÐ²Ñ–.\n3. ÐšÐ¾Ð¼Ñƒ Ð±Ð°Ñ‚ÑŒÐºÐ¸ Ð´ÑÐºÑƒÐ²Ð°Ð»Ð¸? â€” Ð’Ñ‡Ð¸Ñ‚ÐµÐ»ÑŒÑ†Ñ–.\n4. Ð©Ð¾ Ð´Ð¸Ñ€ÐµÐºÑ‚Ð¾Ñ€ Ñ€Ð°Ð´Ð¸Ð² Ð²Ñ‡Ð¸Ñ‚ÐµÐ»ÑŒÑ†Ñ–? â€” ÐÐ¾Ð²Ñƒ Ð¼ÐµÑ‚Ð¾Ð´Ð¸ÐºÑƒ.\n5. Ð©Ð¾ ÑƒÑ‡Ð½Ñ– Ð¿Ð¾Ð´Ð°Ñ€ÑƒÐ²Ð°Ð»Ð¸ Ð²Ñ‡Ð¸Ñ‚ÐµÐ»ÑŒÑ†Ñ–? â€” ÐšÐ²Ñ–Ñ‚Ð¸.\n\n---\n\n# ÐŸÑ–Ð´ÑÑƒÐ¼Ð¾Ðº\n\nÐ£ Ñ†ÑŒÐ¾Ð¼Ñƒ Ð¼Ð¾Ð´ÑƒÐ»Ñ– Ð²Ð¸ Ð½Ð°Ð²Ñ‡Ð¸Ð»Ð¸ÑÑ:\n\n- **Dative-only verbs**: Ð´Ð¾Ð¿Ð¾Ð¼Ð°Ð³Ð°Ñ‚Ð¸, Ð·Ð°Ð²Ð°Ð¶Ð°Ñ‚Ð¸, Ð¿Ð¾Ð´Ð¾Ð±Ð°Ñ‚Ð¸ÑÑ, Ð²Ñ–Ñ€Ð¸Ñ‚Ð¸, Ð´Ð¾Ð²Ñ–Ñ€ÑÑ‚Ð¸, Ð´ÑÐºÑƒÐ²Ð°Ñ‚Ð¸, Ð²Ð¸Ð±Ð°Ñ‡Ð°Ñ‚Ð¸, Ð¿Ñ€Ð¾Ð±Ð°Ñ‡Ð°Ñ‚Ð¸, Ð·Ð°Ð·Ð´Ñ€Ð¸Ñ‚Ð¸, ÑÐ¸Ð¼Ð¿Ð°Ñ‚Ð¸Ð·ÑƒÐ²Ð°Ñ‚Ð¸, ÑÐ¿Ñ–Ð²Ñ‡ÑƒÐ²Ð°Ñ‚Ð¸\n\n- **Dative + Accusative verbs**: Ð´Ð°Ð²Ð°Ñ‚Ð¸, Ð´Ð°Ñ€ÑƒÐ²Ð°Ñ‚Ð¸, Ð¿Ð¾ÐºÐ°Ð·ÑƒÐ²Ð°Ñ‚Ð¸, Ð¿Ð¾ÑÑÐ½ÑŽÐ²Ð°Ñ‚Ð¸, Ñ€Ð¾Ð·Ð¿Ð¾Ð²Ñ–Ð´Ð°Ñ‚Ð¸, Ð¿Ð¾ÑÐ¸Ð»Ð°Ñ‚Ð¸, Ð¿Ð¸ÑÐ°Ñ‚Ð¸, Ñ€Ð°Ð´Ð¸Ñ‚Ð¸\n\n- **Dative + Infinitive verbs**: Ð´Ð¾Ð·Ð²Ð¾Ð»ÑÑ‚Ð¸, Ð·Ð°Ð±Ð¾Ñ€Ð¾Ð½ÑÑ‚Ð¸, Ð·Ð°Ð²Ð°Ð¶Ð°Ñ‚Ð¸, Ð´Ð¾Ð¿Ð¾Ð¼Ð°Ð³Ð°Ñ‚Ð¸\n\n- **The Ð¿Ð¾Ð´Ð¾Ð±Ð°Ñ‚Ð¸ÑÑ pattern**: ÐœÐµÐ½Ñ– Ð¿Ð¾Ð´Ð¾Ð±Ð°Ñ”Ñ‚ÑŒÑÑ ÐºÐ°Ð²Ð° (not \"Ð¯ Ð¿Ð¾Ð´Ð¾Ð±Ð°ÑŽ ÐºÐ°Ð²Ñƒ\")\n\n- **Expressing gratitude**: Ð”ÑÐºÑƒÑŽ Ñ‚Ð¾Ð±Ñ–! Ð”ÑÐºÑƒÑŽ Ð²Ð°Ð¼! Ð©Ð¸Ñ€Ð¾ Ð´ÑÐºÑƒÑŽ!\n\n- **Asking forgiveness**: Ð’Ð¸Ð±Ð°Ñ‡Ñ‚Ðµ Ð¼ÐµÐ½Ñ–! ÐŸÑ€Ð¾Ð±Ð°Ñ‡Ð°Ñ”Ñˆ Ð¼ÐµÐ½Ñ–?\n\nÐ¢ÐµÐ¿ÐµÑ€ Ð²Ð¸ Ð¼Ð¾Ð¶ÐµÑ‚Ðµ Ð´Ð¾Ð¿Ð¾Ð¼Ð°Ð³Ð°Ñ‚Ð¸, Ð´ÑÐºÑƒÐ²Ð°Ñ‚Ð¸, Ð´Ð¾Ð²Ñ–Ñ€ÑÑ‚Ð¸ Ñ– Ð²Ð¸Ð±Ð°Ñ‡Ð°Ñ‚Ð¸ â€” Ð²ÑÐµ Ð· Ð¿Ñ€Ð°Ð²Ð¸Ð»ÑŒÐ½Ð¸Ð¼ Ð´Ð°Ð²Ð°Ð»ÑŒÐ½Ð¸Ð¼ Ð²Ñ–Ð´Ð¼Ñ–Ð½ÐºÐ¾Ð¼!\n\n# Activities\n\nThe following activities will help you master Dative verb patterns. Progress through matching (recognition), fill-in (controlled production), and translation (free production) to build your skills.\n\n**Success tip:** Before choosing an answer, identify whether the verb takes:\n- Dative only (Ð´Ð¾Ð¿Ð¾Ð¼Ð°Ð³Ð°Ñ‚Ð¸, Ð²Ñ–Ñ€Ð¸Ñ‚Ð¸, Ð´ÑÐºÑƒÐ²Ð°Ñ‚Ð¸)\n- Dative + Accusative (Ð´Ð°Ð²Ð°Ñ‚Ð¸, Ð¿Ð¾ÐºÐ°Ð·ÑƒÐ²Ð°Ñ‚Ð¸, Ð¿Ð¾ÑÑÐ½ÑŽÐ²Ð°Ñ‚Ð¸)\n- Dative + Infinitive (Ð´Ð¾Ð·Ð²Ð¾Ð»ÑÑ‚Ð¸, Ð·Ð°Ð±Ð¾Ñ€Ð¾Ð½ÑÑ‚Ð¸)\n\n## match-up: Verb + Dative Pattern\n\n- Ð´Ð¾Ð¿Ð¾Ð¼Ð°Ð³Ð°Ñ‚Ð¸ :: to help someone (Dat only)\n- Ð´Ð°Ð²Ð°Ñ‚Ð¸ :: to give something to someone (Dat + Acc)\n- Ð·Ð°Ð²Ð°Ð¶Ð°Ñ‚Ð¸ :: to bother someone (Dat only)\n- Ð¿Ð¾ÐºÐ°Ð·ÑƒÐ²Ð°Ñ‚Ð¸ :: to show something to someone (Dat + Acc)\n- Ð¿Ð¾Ð´Ð¾Ð±Ð°Ñ‚Ð¸ÑÑ :: to please someone (Dat only)\n- Ð¿Ð¾ÑÑÐ½ÑŽÐ²Ð°Ñ‚Ð¸ :: to explain something to someone (Dat + Acc)\n- Ð²Ñ–Ñ€Ð¸Ñ‚Ð¸ :: to believe someone (Dat only)\n- Ð´ÑÐºÑƒÐ²Ð°Ñ‚Ð¸ :: to thank someone (Dat only)\n- Ñ€Ð°Ð´Ð¸Ñ‚Ð¸ :: to advise someone something (Dat + Acc)\n- Ð´Ð¾Ð²Ñ–Ñ€ÑÑ‚Ð¸ :: to trust someone (Dat only)\n- Ð·Ð°Ð±Ð¾Ñ€Ð¾Ð½ÑÑ‚Ð¸ :: to forbid someone (Dat + Inf)\n- Ð´Ð¾Ð·Ð²Ð¾Ð»ÑÑ‚Ð¸ :: to allow someone (Dat + Inf)\n\n## fill-in: Choose the Correct Form\n\n> Complete each sentence with the correct verb form.\n\n1. Ð¯ ___ Ð¼Ð°Ð¼Ñ– Ð³Ð¾Ñ‚ÑƒÐ²Ð°Ñ‚Ð¸ Ð¾Ð±Ñ–Ð´.\n   > [!answer] Ð´Ð¾Ð¿Ð¾Ð¼Ð°Ð³Ð°ÑŽ\n   > [!options] Ð´Ð¾Ð¿Ð¾Ð¼Ð°Ð³Ð°ÑŽ | Ð´Ð¾Ð¿Ð¾Ð¼Ð°Ð³Ð°Ñ‚Ð¸ | Ð´Ð¾Ð¿Ð¾Ð¼Ð°Ð³Ð°Ñ”\n\n2. Ð¦Ñ Ð¼ÑƒÐ·Ð¸ÐºÐ° ___ Ð¼ÐµÐ½Ñ– ÑÐ¿Ð°Ñ‚Ð¸.\n   > [!answer] Ð·Ð°Ð²Ð°Ð¶Ð°Ñ”\n   > [!options] Ð·Ð°Ð²Ð°Ð¶Ð°Ñ” | Ð·Ð°Ð²Ð°Ð¶Ð°Ñ‚Ð¸ | Ð·Ð°Ð²Ð°Ð¶Ð°ÑŽ\n\n3. ÐœÐµÐ½Ñ– ___ Ñ†ÐµÐ¹ Ñ„Ñ–Ð»ÑŒÐ¼.\n   > [!answer] Ð¿Ð¾Ð´Ð¾Ð±Ð°Ñ”Ñ‚ÑŒÑÑ\n   > [!options] Ð¿Ð¾Ð´Ð¾Ð±Ð°Ñ”Ñ‚ÑŒÑÑ | Ð¿Ð¾Ð´Ð¾Ð±Ð°ÑŽÑÑŒ | Ð¿Ð¾Ð´Ð¾Ð±Ð°Ñ‚Ð¸ÑÑ\n\n4. Ð’Ñ–Ð½ ___ Ð´Ñ€ÑƒÐ³Ð¾Ð²Ñ– ÑÐ²Ð¾ÑŽ Ð¼Ð°ÑˆÐ¸Ð½Ñƒ.\n   > [!answer] Ð¿Ð¾ÐºÐ°Ð·ÑƒÑ”\n   > [!options] Ð¿Ð¾ÐºÐ°Ð·ÑƒÑ” | Ð¿Ð¾ÐºÐ°Ð·ÑƒÐ²Ð°Ñ‚Ð¸ | Ð¿Ð¾ÐºÐ°Ð·ÑƒÑŽÑÑŒ\n\n5. Ð’Ñ‡Ð¸Ñ‚ÐµÐ»ÑŒ ___ ÑƒÑ‡Ð½ÑÐ¼ Ð½Ð¾Ð²Ðµ Ð¿Ñ€Ð°Ð²Ð¸Ð»Ð¾.\n   > [!answer] Ð¿Ð¾ÑÑÐ½ÑŽÑ”\n   > [!options] Ð¿Ð¾ÑÑÐ½ÑŽÑ” | Ð¿Ð¾ÑÑÐ½ÑŽÐ²Ð°Ñ‚Ð¸ | Ð¿Ð¾ÑÑÐ½ÑŽÑ”Ñ‚ÑŒÑÑ\n\n6. Ð¯ ___ Ñ‚Ð¾Ð±Ñ– Ð·Ð° Ð´Ð¾Ð¿Ð¾Ð¼Ð¾Ð³Ñƒ!\n   > [!answer] Ð´ÑÐºÑƒÑŽ\n   > [!options] Ð´ÑÐºÑƒÑŽ | Ð´ÑÐºÑƒÐ²Ð°Ñ‚Ð¸ | Ð´ÑÐºÑƒÑŽÑÑŒ\n\n7. ÐœÐ¸ Ð½Ðµ ___ Ñ†Ñ–Ð¹ Ð»ÑŽÐ´Ð¸Ð½Ñ–.\n   > [!answer] Ð´Ð¾Ð²Ñ–Ñ€ÑÑ”Ð¼Ð¾\n   > [!options] Ð´Ð¾Ð²Ñ–Ñ€ÑÑ”Ð¼Ð¾ | Ð´Ð¾Ð²Ñ–Ñ€ÑÑ‚Ð¸ | Ð´Ð¾Ð²Ñ–Ñ€ÑÑ”Ñ‚ÑŒÑÑ\n\n8. Ð‘Ð°Ñ‚ÑŒÐºÐ¾ ___ ÑÐ¸Ð½Ð¾Ð²Ñ– Ð²Ñ‡Ð¸Ñ‚Ð¸ÑÑ ÐºÑ€Ð°Ñ‰Ðµ.\n   > [!answer] Ñ€Ð°Ð´Ð¸Ñ‚ÑŒ\n   > [!options] Ñ€Ð°Ð´Ð¸Ñ‚ÑŒ | Ñ€Ð°Ð´Ð¸Ñ‚Ð¸ | Ñ€Ð°Ð´Ð¸Ñ‚ÑŒÑÑ\n\n9. Ð›Ñ–ÐºÐ°Ñ€ ___ Ð¿Ð°Ñ†Ñ–Ñ”Ð½Ñ‚Ð¾Ð²Ñ– ÐºÑƒÑ€Ð¸Ñ‚Ð¸.\n   > [!answer] Ð·Ð°Ð±Ð¾Ñ€Ð¾Ð½ÑÑ”\n   > [!options] Ð·Ð°Ð±Ð¾Ñ€Ð¾Ð½ÑÑ” | Ð·Ð°Ð±Ð¾Ñ€Ð¾Ð½ÑÑ‚Ð¸ | Ð·Ð°Ð±Ð¾Ñ€Ð¾Ð½ÑÑ”Ñ‚ÑŒÑÑ\n\n10. Ð¯ ___ Ñ‚Ð¾Ð±Ñ– Ñ†ÑŽ Ð¿Ð¾Ð¼Ð¸Ð»ÐºÑƒ.\n    > [!answer] Ð²Ð¸Ð±Ð°Ñ‡Ð°ÑŽ\n    > [!options] Ð²Ð¸Ð±Ð°Ñ‡Ð°ÑŽ | Ð²Ð¸Ð±Ð°Ñ‡Ð°Ñ‚Ð¸ | Ð²Ð¸Ð±Ð°Ñ‡Ð°ÑŽÑÑŒ\n\n11. Ð’Ð¾Ð½Ð° ___ Ð¿Ð¾Ð´Ñ€ÑƒÐ·Ñ– Ð½Ð¾Ð²Ð¸Ð½Ñƒ.\n    > [!answer] Ñ€Ð¾Ð·Ð¿Ð¾Ð²Ñ–Ð´Ð°Ñ”\n    > [!options] Ñ€Ð¾Ð·Ð¿Ð¾Ð²Ñ–Ð´Ð°Ñ” | Ñ€Ð¾Ð·Ð¿Ð¾Ð²Ñ–Ð´Ð°Ñ‚Ð¸ | Ñ€Ð¾Ð·Ð¿Ð¾Ð²Ñ–Ð´Ð°Ñ”Ñ‚ÑŒÑÑ\n\n12. ÐœÐ°Ð¼Ð° ___ Ð´Ñ–Ñ‚ÑÐ¼ Ð³Ñ€Ð°Ñ‚Ð¸ÑÑ Ð½Ð°Ð´Ð²Ð¾Ñ€Ñ–.\n    > [!answer] Ð´Ð¾Ð·Ð²Ð¾Ð»ÑÑ”\n    > [!options] Ð´Ð¾Ð·Ð²Ð¾Ð»ÑÑ” | Ð´Ð¾Ð·Ð²Ð¾Ð»ÑÑ‚Ð¸ | Ð´Ð¾Ð·Ð²Ð¾Ð»ÑÑ”Ñ‚ÑŒÑÑ\n\n## quiz: Dative Verb Patterns\n\n1. Ð¯ÐºÐ¸Ð¹ Ð²Ñ–Ð´Ð¼Ñ–Ð½Ð¾Ðº Ð¿Ð¾Ñ‚Ñ€Ñ–Ð±ÐµÐ½ Ð¿Ñ–ÑÐ»Ñ \"Ð´Ð¾Ð¿Ð¾Ð¼Ð°Ð³Ð°Ñ‚Ð¸\"?\n\n- [ ] Accusative\n- [x] Dative\n- [ ] Genitive\n\n---\n\n2. \"ÐŸÐ¾Ð´Ð¾Ð±Ð°Ñ‚Ð¸ÑÑ\" â€” ÑÐºÐ° ÐºÐ¾Ð½ÑÑ‚Ñ€ÑƒÐºÑ†Ñ–Ñ Ð¿Ñ€Ð°Ð²Ð¸Ð»ÑŒÐ½Ð°?\n\n- [x] ÐœÐµÐ½Ñ– Ð¿Ð¾Ð´Ð¾Ð±Ð°Ñ”Ñ‚ÑŒÑÑ ÐºÐ°Ð²Ð°.\n- [ ] Ð¯ Ð¿Ð¾Ð´Ð¾Ð±Ð°ÑŽÑÑ ÐºÐ°Ð²Ð°.\n- [ ] Ð¯ Ð¿Ð¾Ð´Ð¾Ð±Ð°ÑŽ ÐºÐ°Ð²Ñƒ.\n\n---\n\n3. Ð¯ÐºÐµ Ñ€ÐµÑ‡ÐµÐ½Ð½Ñ Ð¿Ñ€Ð°Ð²Ð¸Ð»ÑŒÐ½Ðµ?\n\n- [ ] Ð¯ Ð²Ñ–Ñ€ÑŽ Ñ†ÐµÐ¹ Ð»ÑŽÐ´Ð¸Ð½Ð°.\n- [ ] Ð¯ Ð²Ñ–Ñ€ÑŽ Ñ†ÑŽ Ð»ÑŽÐ´Ð¸Ð½Ñƒ.\n- [x] Ð¯ Ð²Ñ–Ñ€ÑŽ Ñ†Ñ–Ð¹ Ð»ÑŽÐ´Ð¸Ð½Ñ–.\n\n---\n\n4. \"Ð”Ð°Ð²Ð°Ñ‚Ð¸\" Ð¿Ð¾Ñ‚Ñ€ÐµÐ±ÑƒÑ”...\n\n- [ ] Ñ‚Ñ–Ð»ÑŒÐºÐ¸ Ð´Ð°Ð²Ð°Ð»ÑŒÐ½Ð¾Ð³Ð¾ Ð²Ñ–Ð´Ð¼Ñ–Ð½ÐºÐ°\n- [ ] Ñ‚Ñ–Ð»ÑŒÐºÐ¸ Ð·Ð½Ð°Ñ…Ñ–Ð´Ð½Ð¾Ð³Ð¾ Ð²Ñ–Ð´Ð¼Ñ–Ð½ÐºÐ°\n- [x] Ð´Ð°Ð²Ð°Ð»ÑŒÐ½Ð¾Ð³Ð¾ + Ð·Ð½Ð°Ñ…Ñ–Ð´Ð½Ð¾Ð³Ð¾ Ð²Ñ–Ð´Ð¼Ñ–Ð½ÐºÐ°\n\n---\n\n5. Ð¯Ðº ÑÐºÐ°Ð·Ð°Ñ‚Ð¸ \"I thank the teacher\"?\n\n- [ ] Ð¯ Ð´ÑÐºÑƒÑŽ Ð²Ñ‡Ð¸Ñ‚ÐµÐ»ÑŒ.\n- [x] Ð¯ Ð´ÑÐºÑƒÑŽ Ð²Ñ‡Ð¸Ñ‚ÐµÐ»ÐµÐ²Ñ–.\n- [ ] Ð¯ Ð´ÑÐºÑƒÑŽ Ð²Ñ‡Ð¸Ñ‚ÐµÐ»Ñ.\n\n---\n\n6. Ð¯ÐºÐµ Ñ€ÐµÑ‡ÐµÐ½Ð½Ñ Ð¿Ñ€Ð°Ð²Ð¸Ð»ÑŒÐ½Ðµ?\n\n- [x] ÐœÐ°Ð¼Ð° Ð·Ð°Ð±Ð¾Ñ€Ð¾Ð½ÑÑ” Ð´Ñ–Ñ‚ÑÐ¼ Ñ—ÑÑ‚Ð¸ Ñ†ÑƒÐºÐµÑ€ÐºÐ¸.\n- [ ] ÐœÐ°Ð¼Ð° Ð·Ð°Ð±Ð¾Ñ€Ð¾Ð½ÑÑ” Ð´Ñ–Ñ‚ÐµÐ¹ Ñ—ÑÑ‚Ð¸ Ñ†ÑƒÐºÐµÑ€ÐºÐ¸.\n- [ ] ÐœÐ°Ð¼Ð° Ð·Ð°Ð±Ð¾Ñ€Ð¾Ð½ÑÑ” Ð´Ñ–Ñ‚Ð¸ Ñ—ÑÑ‚Ð¸ Ñ†ÑƒÐºÐµÑ€ÐºÐ¸.\n\n---\n\n7. \"Ð—Ð°Ð·Ð´Ñ€Ð¸Ñ‚Ð¸\" Ð¿Ð¾Ñ‚Ñ€ÐµÐ±ÑƒÑ”...\n\n- [x] Ð´Ð°Ð²Ð°Ð»ÑŒÐ½Ð¾Ð³Ð¾ Ð²Ñ–Ð´Ð¼Ñ–Ð½ÐºÐ°\n- [ ] Ð·Ð½Ð°Ñ…Ñ–Ð´Ð½Ð¾Ð³Ð¾ Ð²Ñ–Ð´Ð¼Ñ–Ð½ÐºÐ°\n- [ ] Ñ€Ð¾Ð´Ð¾Ð²Ð¾Ð³Ð¾ Ð²Ñ–Ð´Ð¼Ñ–Ð½ÐºÐ°\n\n---\n\n8. Ð¯Ðº ÑÐºÐ°Ð·Ð°Ñ‚Ð¸ \"The noise bothers me\"?\n\n- [x] Ð¨ÑƒÐ¼ Ð·Ð°Ð²Ð°Ð¶Ð°Ñ” Ð¼ÐµÐ½Ñ–.\n- [ ] Ð¨ÑƒÐ¼ Ð·Ð°Ð²Ð°Ð¶Ð°Ñ” Ð¼ÐµÐ½Ðµ.\n- [ ] Ð¨ÑƒÐ¼ Ð·Ð°Ð²Ð°Ð¶Ð°Ñ” Ñ.\n\n---\n\n9. Ð¯ÐºÐµ Ñ€ÐµÑ‡ÐµÐ½Ð½Ñ Ð¿Ñ€Ð°Ð²Ð¸Ð»ÑŒÐ½Ðµ?\n\n- [ ] Ð¯ Ð¿Ð¾ÑÑÐ½ÑŽÑŽ ÑƒÑ‡Ð½Ñ– Ð¿Ñ€Ð°Ð²Ð¸Ð»Ð¾.\n- [ ] Ð¯ Ð¿Ð¾ÑÑÐ½ÑŽÑŽ ÑƒÑ‡Ð½Ñ–Ð² Ð¿Ñ€Ð°Ð²Ð¸Ð»Ð¾.\n- [x] Ð¯ Ð¿Ð¾ÑÑÐ½ÑŽÑŽ ÑƒÑ‡Ð½ÑÐ¼ Ð¿Ñ€Ð°Ð²Ð¸Ð»Ð¾.\n\n---\n\n10. \"Ð¡Ð¿Ñ–Ð²Ñ‡ÑƒÐ²Ð°Ñ‚Ð¸\" Ð¿Ð¾Ñ‚Ñ€ÐµÐ±ÑƒÑ”...\n\n- [x] Ð´Ð°Ð²Ð°Ð»ÑŒÐ½Ð¾Ð³Ð¾ Ð²Ñ–Ð´Ð¼Ñ–Ð½ÐºÐ°\n- [ ] Ð·Ð½Ð°Ñ…Ñ–Ð´Ð½Ð¾Ð³Ð¾ Ð²Ñ–Ð´Ð¼Ñ–Ð½ÐºÐ°\n- [ ] Ð¾Ñ€ÑƒÐ´Ð½Ð¾Ð³Ð¾ Ð²Ñ–Ð´Ð¼Ñ–Ð½ÐºÐ°\n\n---\n\n11. Ð¯Ðº ÑÐºÐ°Ð·Ð°Ñ‚Ð¸ \"I forgive you\"?\n\n- [ ] Ð¯ Ð¿Ñ€Ð¾Ð±Ð°Ñ‡Ð°ÑŽ Ñ‚Ð¸.\n- [x] Ð¯ Ð¿Ñ€Ð¾Ð±Ð°Ñ‡Ð°ÑŽ Ñ‚Ð¾Ð±Ñ–.\n- [ ] Ð¯ Ð¿Ñ€Ð¾Ð±Ð°Ñ‡Ð°ÑŽ Ñ‚ÐµÐ±Ðµ.\n\n---\n\n12. Ð¯ÐºÐµ Ñ€ÐµÑ‡ÐµÐ½Ð½Ñ Ð¿Ñ€Ð°Ð²Ð¸Ð»ÑŒÐ½Ðµ?\n\n- [x] Ð’Ñ–Ð½ Ñ€Ð°Ð´Ð¸Ñ‚ÑŒ Ð¼ÐµÐ½Ñ– Ð²Ñ–Ð´Ð¿Ð¾Ñ‡Ð¸Ñ‚Ð¸.\n- [ ] Ð’Ñ–Ð½ Ñ€Ð°Ð´Ð¸Ñ‚ÑŒ Ð¼ÐµÐ½Ðµ Ð²Ñ–Ð´Ð¿Ð¾Ñ‡Ð¸Ñ‚Ð¸.\n- [ ] Ð’Ñ–Ð½ Ñ€Ð°Ð´Ð¸Ñ‚ÑŒ Ñ Ð²Ñ–Ð´Ð¿Ð¾Ñ‡Ð¸Ñ‚Ð¸.\n\n## true-false: Dative Verb Rules\n> Decide if each statement is true or false.\n\n- [ ] \"Ð”Ð¾Ð¿Ð¾Ð¼Ð°Ð³Ð°Ñ‚Ð¸\" requires the accusative case.\n  > Ð”Ð¾Ð¿Ð¾Ð¼Ð°Ð³Ð°Ñ‚Ð¸ requires the dative: Ð¯ Ð´Ð¾Ð¿Ð¾Ð¼Ð°Ð³Ð°ÑŽ Ð¼Ð°Ð¼Ñ–.\n\n- [x] \"ÐŸÐ¾Ð´Ð¾Ð±Ð°Ñ‚Ð¸ÑÑ\" makes the liked thing the grammatical subject.\n  > Yes! \"ÐœÐµÐ½Ñ– Ð¿Ð¾Ð´Ð¾Ð±Ð°Ñ”Ñ‚ÑŒÑÑ ÐºÐ°Ð²Ð°\" â€” ÐºÐ°Ð²Ð° is the subject, Ð¼ÐµÐ½Ñ– is dative.\n\n- [x] \"Ð”Ð°Ð²Ð°Ñ‚Ð¸\" requires both dative and accusative objects.\n  > Correct! Ð¯ Ð´Ð°ÑŽ Ð¼Ð°Ð¼Ñ– ÐºÐ½Ð¸Ð³Ñƒ.\n\n- [ ] \"Ð’Ñ–Ñ€Ð¸Ñ‚Ð¸\" can take an accusative object.\n  > Ð’Ñ–Ñ€Ð¸Ñ‚Ð¸ only takes dative: Ð¯ Ð²Ñ–Ñ€ÑŽ Ð´Ñ€ÑƒÐ³Ð¾Ð²Ñ–.\n\n- [x] \"Ð—Ð°Ð±Ð¾Ñ€Ð¾Ð½ÑÑ‚Ð¸\" takes dative + infinitive.\n  > Correct! ÐœÐ°Ð¼Ð° Ð·Ð°Ð±Ð¾Ñ€Ð¾Ð½ÑÑ” Ð´Ñ–Ñ‚ÑÐ¼ Ð³Ñ€Ð°Ñ‚Ð¸ÑÑ.\n\n- [ ] \"Ð—Ð°Ð·Ð´Ñ€Ð¸Ñ‚Ð¸\" means \"to help.\"\n  > Ð—Ð°Ð·Ð´Ñ€Ð¸Ñ‚Ð¸ means \"to envy.\" Ð”Ð¾Ð¿Ð¾Ð¼Ð°Ð³Ð°Ñ‚Ð¸ means \"to help.\"\n\n- [ ] In \"ÐœÐµÐ½Ñ– Ð¿Ð¾Ð´Ð¾Ð±Ð°Ñ”Ñ‚ÑŒÑÑ Ð¼ÑƒÐ·Ð¸ÐºÐ°,\" \"Ð¼ÐµÐ½Ñ–\" is the subject.\n  > ÐœÐµÐ½Ñ– is dative. ÐœÑƒÐ·Ð¸ÐºÐ° is the nominative subject.\n\n- [x] \"Ð”ÑÐºÑƒÑŽ Ñ‚Ð¾Ð±Ñ–\" and \"Ð”ÑÐºÑƒÑŽ Ð²Ð°Ð¼\" both use the dative case.\n  > Correct! Ð¢Ð¾Ð±Ñ– and Ð²Ð°Ð¼ are both dative forms.\n\n- [ ] \"ÐŸÐ¾ÐºÐ°Ð·ÑƒÐ²Ð°Ñ‚Ð¸\" is a dative-only verb.\n  > ÐŸÐ¾ÐºÐ°Ð·ÑƒÐ²Ð°Ñ‚Ð¸ takes Dat + Acc: Ð¯ Ð¿Ð¾ÐºÐ°Ð·ÑƒÑŽ Ð´Ñ€ÑƒÐ³Ð¾Ð²Ñ– Ñ„Ð¾Ñ‚Ð¾.\n\n- [x] \"Ð¡Ð¿Ñ–Ð²Ñ‡ÑƒÐ²Ð°Ñ‚Ð¸\" requires the dative case.\n  > Correct! Ð¯ ÑÐ¿Ñ–Ð²Ñ‡ÑƒÐ²Ð°ÑŽ Ñ€Ð¾Ð´Ð¸Ð½Ñ–.\n\n- [ ] \"ÐŸÐ¾ÑÑÐ½ÑŽÐ²Ð°Ñ‚Ð¸\" only needs an accusative object.\n  > ÐŸÐ¾ÑÑÐ½ÑŽÐ²Ð°Ñ‚Ð¸ takes Dat + Acc: Ð¯ Ð¿Ð¾ÑÑÐ½ÑŽÑŽ ÑƒÑ‡Ð½ÑÐ¼ Ð¿Ñ€Ð°Ð²Ð¸Ð»Ð¾.\n\n- [ ] Word order in Ukrainian sentences with dative is completely fixed.\n  > Word order is flexible! Case endings show grammatical roles.\n\n## group-sort: Verb Categories\n> Sort these verbs into the correct category.\n\n### Dative Only\n- Ð´Ð¾Ð¿Ð¾Ð¼Ð°Ð³Ð°Ñ‚Ð¸\n- Ð·Ð°Ð²Ð°Ð¶Ð°Ñ‚Ð¸\n- Ð¿Ð¾Ð´Ð¾Ð±Ð°Ñ‚Ð¸ÑÑ\n- Ð²Ñ–Ñ€Ð¸Ñ‚Ð¸\n- Ð´Ð¾Ð²Ñ–Ñ€ÑÑ‚Ð¸\n- Ð´ÑÐºÑƒÐ²Ð°Ñ‚Ð¸\n\n### Dative + Accusative\n- Ð´Ð°Ð²Ð°Ñ‚Ð¸\n- Ð¿Ð¾ÐºÐ°Ð·ÑƒÐ²Ð°Ñ‚Ð¸\n- Ð¿Ð¾ÑÑÐ½ÑŽÐ²Ð°Ñ‚Ð¸\n- Ñ€Ð¾Ð·Ð¿Ð¾Ð²Ñ–Ð´Ð°Ñ‚Ð¸\n- Ñ€Ð°Ð´Ð¸Ñ‚Ð¸\n- Ð¿Ð¸ÑÐ°Ñ‚Ð¸\n\n## unjumble: Dative Verb Sentences\n> Put the words in the correct order.\n\n1. Ñ / Ð´Ð¾Ð¿Ð¾Ð¼Ð°Ð³Ð°ÑŽ / Ð¼Ð°Ð¼Ñ– / Ð³Ð¾Ñ‚ÑƒÐ²Ð°Ñ‚Ð¸ / Ð¾Ð±Ñ–Ð´\n   > [!answer] Ð¯ Ð´Ð¾Ð¿Ð¾Ð¼Ð°Ð³Ð°ÑŽ Ð¼Ð°Ð¼Ñ– Ð³Ð¾Ñ‚ÑƒÐ²Ð°Ñ‚Ð¸ Ð¾Ð±Ñ–Ð´.\n   > (I help mom cook lunch.)\n\n2. Ð¼ÐµÐ½Ñ– / Ð¿Ð¾Ð´Ð¾Ð±Ð°Ñ”Ñ‚ÑŒÑÑ / Ñ†Ñ / Ð¼ÑƒÐ·Ð¸ÐºÐ°\n   > [!answer] ÐœÐµÐ½Ñ– Ð¿Ð¾Ð´Ð¾Ð±Ð°Ñ”Ñ‚ÑŒÑÑ Ñ†Ñ Ð¼ÑƒÐ·Ð¸ÐºÐ°.\n   > (I like this music.)\n\n3. Ð²Ñ–Ð½ / Ð¿Ð¾ÐºÐ°Ð·ÑƒÑ” / Ð´Ñ€ÑƒÐ³Ð¾Ð²Ñ– / Ð½Ð¾Ð²Ñƒ / Ð¼Ð°ÑˆÐ¸Ð½Ñƒ\n   > [!answer] Ð’Ñ–Ð½ Ð¿Ð¾ÐºÐ°Ð·ÑƒÑ” Ð´Ñ€ÑƒÐ³Ð¾Ð²Ñ– Ð½Ð¾Ð²Ñƒ Ð¼Ð°ÑˆÐ¸Ð½Ñƒ.\n   > (He shows his friend the new car.)\n\n4. Ð²Ñ‡Ð¸Ñ‚ÐµÐ»ÑŒ / Ð¿Ð¾ÑÑÐ½ÑŽÑ” / ÑƒÑ‡Ð½ÑÐ¼ / ÑÐºÐ»Ð°Ð´Ð½Ðµ / Ð¿Ñ€Ð°Ð²Ð¸Ð»Ð¾\n   > [!answer] Ð’Ñ‡Ð¸Ñ‚ÐµÐ»ÑŒ Ð¿Ð¾ÑÑÐ½ÑŽÑ” ÑƒÑ‡Ð½ÑÐ¼ ÑÐºÐ»Ð°Ð´Ð½Ðµ Ð¿Ñ€Ð°Ð²Ð¸Ð»Ð¾.\n   > (The teacher explains a complex rule to students.)\n\n5. Ñ / Ð´ÑÐºÑƒÑŽ / Ñ‚Ð¾Ð±Ñ– / Ð·Ð° / Ð´Ð¾Ð¿Ð¾Ð¼Ð¾Ð³Ñƒ\n   > [!answer] Ð¯ Ð´ÑÐºÑƒÑŽ Ñ‚Ð¾Ð±Ñ– Ð·Ð° Ð´Ð¾Ð¿Ð¾Ð¼Ð¾Ð³Ñƒ.\n   > (I thank you for the help.)\n\n6. Ñ†Ñ / Ð¼ÑƒÐ·Ð¸ÐºÐ° / Ð·Ð°Ð²Ð°Ð¶Ð°Ñ” / Ð¼ÐµÐ½Ñ– / ÑÐ¿Ð°Ñ‚Ð¸\n   > [!answer] Ð¦Ñ Ð¼ÑƒÐ·Ð¸ÐºÐ° Ð·Ð°Ð²Ð°Ð¶Ð°Ñ” Ð¼ÐµÐ½Ñ– ÑÐ¿Ð°Ñ‚Ð¸.\n   > (This music prevents me from sleeping.)\n\n## error-correction: Fix the Dative Errors\n> Each sentence has ONE error. Find and correct it.\n\n1. Ð¯ Ð´Ð¾Ð¿Ð¾Ð¼Ð°Ð³Ð°ÑŽ Ð¼Ð°Ð¼Ñƒ.\n   > [!error] Ð¼Ð°Ð¼Ñƒ\n   > [!answer] Ð¼Ð°Ð¼Ñ–\n   > [!options] Ð¼Ð°Ð¼Ñƒ | Ð¼Ð°Ð¼Ñ– | Ð¼Ð°Ð¼Ð¾ÑŽ | Ð¼Ð°Ð¼Ð°\n   > [!explanation] The verb Â«Ð´Ð¾Ð¿Ð¾Ð¼Ð°Ð³Ð°Ñ‚Ð¸Â» requires Dative case. Feminine nouns ending in -Ð° take -Ñ–: Ð¼Ð°Ð¼Ð° â†’ Ð¼Ð°Ð¼Ñ–.\n\n2. ÐœÐµÐ½Ðµ Ð¿Ð¾Ð´Ð¾Ð±Ð°Ñ”Ñ‚ÑŒÑÑ Ñ†Ñ ÐºÐ½Ð¸Ð³Ð°.\n   > [!error] ÐœÐµÐ½Ðµ\n   > [!answer] ÐœÐµÐ½Ñ–\n   > [!options] ÐœÐµÐ½Ðµ | ÐœÐµÐ½Ñ– | ÐœÑ–Ð¹ | ÐœÐ¾Ñ\n   > [!explanation] With Â«Ð¿Ð¾Ð´Ð¾Ð±Ð°Ñ‚Ð¸ÑÑÂ», the experiencer is in Dative. The pronoun Â«ÑÂ» becomes Â«Ð¼ÐµÐ½Ñ–Â» in Dative, not Â«Ð¼ÐµÐ½ÐµÂ» (Accusative).\n\n3. Ð’Ñ–Ð½ Ð¿Ð¾ÐºÐ°Ð·ÑƒÑ” Ð´Ñ€ÑƒÐ³ ÑÐ²Ð¾ÑŽ Ð¼Ð°ÑˆÐ¸Ð½Ñƒ.\n   > [!error] Ð´Ñ€ÑƒÐ³\n   > [!answer] Ð´Ñ€ÑƒÐ³Ð¾Ð²Ñ–\n   > [!options] Ð´Ñ€ÑƒÐ³ | Ð´Ñ€ÑƒÐ³Ð¾Ð²Ñ– | Ð´Ñ€ÑƒÐ³Ð° | Ð´Ñ€ÑƒÐ³Ð¾Ð¼\n   > [!explanation] The verb Â«Ð¿Ð¾ÐºÐ°Ð·ÑƒÐ²Ð°Ñ‚Ð¸Â» takes Dative + Accusative. The recipient needs Dative: Ð´Ñ€ÑƒÐ³ â†’ Ð´Ñ€ÑƒÐ³Ð¾Ð²Ñ–.\n\n4. Ð’Ñ‡Ð¸Ñ‚ÐµÐ»ÑŒ Ð¿Ð¾ÑÑÐ½ÑŽÑ” ÑƒÑ‡Ð½Ñ–Ð² Ð¿Ñ€Ð°Ð²Ð¸Ð»Ð¾.\n   > [!error] ÑƒÑ‡Ð½Ñ–Ð²\n   > [!answer] ÑƒÑ‡Ð½ÑÐ¼\n   > [!options] ÑƒÑ‡Ð½Ñ–Ð² | ÑƒÑ‡Ð½ÑÐ¼ | ÑƒÑ‡Ð½Ñ– | ÑƒÑ‡Ð½ÑÐ¼Ð¸\n   > [!explanation] The verb Â«Ð¿Ð¾ÑÑÐ½ÑŽÐ²Ð°Ñ‚Ð¸Â» takes Dative + Accusative. The Dative plural of Â«ÑƒÑ‡ÐµÐ½ÑŒÂ» is Â«ÑƒÑ‡Ð½ÑÐ¼Â», not Â«ÑƒÑ‡Ð½Ñ–Ð²Â» (Genitive).\n\n5. Ð¯ Ð´ÑÐºÑƒÑŽ Ñ‚ÐµÐ±Ðµ Ð·Ð° Ð´Ð¾Ð¿Ð¾Ð¼Ð¾Ð³Ñƒ.\n   > [!error] Ñ‚ÐµÐ±Ðµ\n   > [!answer] Ñ‚Ð¾Ð±Ñ–\n   > [!options] Ñ‚ÐµÐ±Ðµ | Ñ‚Ð¾Ð±Ñ– | Ñ‚Ð¾Ð±Ð¾ÑŽ | Ñ‚Ð¸\n   > [!explanation] The verb Â«Ð´ÑÐºÑƒÐ²Ð°Ñ‚Ð¸Â» requires Dative. The pronoun Â«Ñ‚Ð¸Â» becomes Â«Ñ‚Ð¾Ð±Ñ–Â» in Dative, not Â«Ñ‚ÐµÐ±ÐµÂ» (Accusative).\n\n6. ÐœÑƒÐ·Ð¸ÐºÐ° Ð·Ð°Ð²Ð°Ð¶Ð°Ñ” Ð¼ÐµÐ½Ðµ ÑÐ¿Ð°Ñ‚Ð¸.\n   > [!error] Ð¼ÐµÐ½Ðµ\n   > [!answer] Ð¼ÐµÐ½Ñ–\n   > [!options] Ð¼ÐµÐ½Ðµ | Ð¼ÐµÐ½Ñ– | Ð¼Ð½Ð¾ÑŽ | Ñ\n   > [!explanation] The verb Â«Ð·Ð°Ð²Ð°Ð¶Ð°Ñ‚Ð¸Â» requires Dative. The pronoun Â«ÑÂ» becomes Â«Ð¼ÐµÐ½Ñ–Â» in Dative, not Â«Ð¼ÐµÐ½ÐµÂ» (Accusative).\n\n## cloze: Complete the Story\n> Fill in the blanks with the correct words.\n\nÐœÐ°Ñ€Ñ–Ñ Ð¿Ñ€Ð°Ñ†ÑŽÑ” Ð²Ñ‡Ð¸Ñ‚ÐµÐ»ÑŒÐºÐ¾ÑŽ. Ð©Ð¾Ð´Ð½Ñ Ð²Ð¾Ð½Ð° [___:1] ÑƒÑ‡Ð½ÑÐ¼ Ð½Ð¾Ð²Ñ– Ñ‚ÐµÐ¼Ð¸. ÐšÐ¾Ð»Ð¸ ÑƒÑ‡ÐµÐ½ÑŒ Ð½Ðµ Ñ€Ð¾Ð·ÑƒÐ¼Ñ–Ñ”, Ð²Ð¾Ð½Ð° [___:2] Ð¹Ð¾Ð¼Ñƒ. ÐœÐ°Ñ€Ñ–Ñ [___:3] ÑÐ²Ð¾Ñ—Ð¼ ÑƒÑ‡Ð½ÑÐ¼ â€” Ð²Ð¾Ð½Ð¸ ÑÑ‚Ð°Ñ€Ð°Ð½Ð½Ñ–. Ð‘Ð°Ñ‚ÑŒÐºÐ¸ [___:4] ÐœÐ°Ñ€Ñ–Ñ— Ð·Ð° Ñ…Ð¾Ñ€Ð¾ÑˆÑƒ Ñ€Ð¾Ð±Ð¾Ñ‚Ñƒ.\n\n1. Ð¿Ð¾ÑÑÐ½ÑŽÑ” | Ð¿Ð¾ÑÑÐ½ÑŽÐ²Ð°Ñ‚Ð¸ | Ð¿Ð¾ÑÑÐ½ÑŽÑ”Ñ‚ÑŒÑÑ\n   > [!answer] Ð¿Ð¾ÑÑÐ½ÑŽÑ”\n\n2. Ð´Ð¾Ð¿Ð¾Ð¼Ð°Ð³Ð°Ñ” | Ð´Ð¾Ð¿Ð¾Ð¼Ð°Ð³Ð°Ñ‚Ð¸ | Ð´Ð¾Ð¿Ð¾Ð¼Ð°Ð³Ð°Ñ”Ñ‚ÑŒÑÑ\n   > [!answer] Ð´Ð¾Ð¿Ð¾Ð¼Ð°Ð³Ð°Ñ”\n\n3. Ð²Ñ–Ñ€Ð¸Ñ‚ÑŒ | Ð²Ñ–Ñ€Ð¸Ñ‚Ð¸ | Ð²Ñ–Ñ€Ð¸Ñ‚ÑŒÑÑ\n   > [!answer] Ð²Ñ–Ñ€Ð¸Ñ‚ÑŒ\n\n4. Ð´ÑÐºÑƒÑŽÑ‚ÑŒ | Ð´ÑÐºÑƒÐ²Ð°Ñ‚Ð¸ | Ð´ÑÐºÑƒÑŽÑ‚ÑŒÑÑ\n   > [!answer] Ð´ÑÐºÑƒÑŽÑ‚ÑŒ\n\n---\n\nÐœÑ–Ð¹ Ð±Ñ€Ð°Ñ‚ ÐžÐ»ÐµÐ³ Ð»ÑŽÐ±Ð¸Ñ‚ÑŒ Ð¼ÑƒÐ·Ð¸ÐºÑƒ. [___:1] Ð¿Ð¾Ð´Ð¾Ð±Ð°Ñ”Ñ‚ÑŒÑÑ Ñ€Ð¾Ðº. ÐÐ»Ðµ Ð½Ð°ÑˆÐ° Ð¼Ð°Ð¼Ð° ÐºÐ°Ð¶Ðµ, Ñ‰Ð¾ Ð¼ÑƒÐ·Ð¸ÐºÐ° [___:2] Ñ—Ð¹. ÐžÐ»ÐµÐ³ [___:3] Ð¼Ð°Ð¼Ñƒ â€” Ð²Ñ–Ð½ ÑÐ»ÑƒÑ…Ð°Ñ” Ð¼ÑƒÐ·Ð¸ÐºÑƒ Ð² Ð½Ð°Ð²ÑƒÑˆÐ½Ð¸ÐºÐ°Ñ…. Ð¢ÐµÐ¿ÐµÑ€ Ð¼Ð°Ð¼Ð° [___:4] ÐžÐ»ÐµÐ³Ð¾Ð²Ñ–, Ñ‰Ð¾ Ð²Ñ–Ð½ ÑƒÐ²Ð°Ð¶Ð½Ð¸Ð¹.\n\n1. Ð™Ð¾Ð¼Ñƒ | Ð™Ð¾Ð³Ð¾ | Ð’Ñ–Ð½\n   > [!answer] Ð™Ð¾Ð¼Ñƒ\n\n2. Ð·Ð°Ð²Ð°Ð¶Ð°Ñ” | Ð·Ð°Ð²Ð°Ð¶Ð°Ñ‚Ð¸ | Ð·Ð°Ð²Ð°Ð¶Ð°Ñ”Ñ‚ÑŒÑÑ\n   > [!answer] Ð·Ð°Ð²Ð°Ð¶Ð°Ñ”\n\n3. Ð¿Ñ€Ð¾Ð±Ð°Ñ‡Ð°Ñ” | Ñ€Ð¾Ð·ÑƒÐ¼Ñ–Ñ” | Ð»ÑŽÐ±Ð¸Ñ‚ÑŒ\n   > [!answer] Ñ€Ð¾Ð·ÑƒÐ¼Ñ–Ñ”\n\n4. ÐºÐ°Ð¶Ðµ | Ð³Ð¾Ð²Ð¾Ñ€Ð¸Ñ‚ÑŒ | Ñ€Ð¾Ð·Ð¿Ð¾Ð²Ñ–Ð´Ð°Ñ”\n   > [!answer] ÐºÐ°Ð¶Ðµ\n\n## dialogue-reorder: At the Doctor's Office\n\n- Ð”ÑÐºÑƒÑŽ Ð²Ð°Ð¼, Ð»Ñ–ÐºÐ°Ñ€ÑŽ!\n- Ð”Ð¾Ð±Ñ€Ð¸Ð¹ Ð´ÐµÐ½ÑŒ! Ð©Ð¾ Ð²Ð°Ñ Ñ‚ÑƒÑ€Ð±ÑƒÑ”?\n- Ð¯ Ñ€Ð°Ð´Ð¶Ñƒ Ð²Ð°Ð¼ Ð²Ñ–Ð´Ð¿Ð¾Ñ‡Ð¸Ð²Ð°Ñ‚Ð¸ Ñ– Ð¿Ð¸Ñ‚Ð¸ Ð±Ð°Ð³Ð°Ñ‚Ð¾ Ð²Ð¾Ð´Ð¸.\n- ÐœÐµÐ½Ñ– Ð±Ð¾Ð»ÑÑ‡Ðµ ÐºÐ¾Ð²Ñ‚Ð°Ñ‚Ð¸. Ð¯ Ð´ÑƒÐ¼Ð°ÑŽ, Ñ†Ðµ Ð°Ð½Ð³Ñ–Ð½Ð°.\n- Ð’Ð¸ Ð·Ð°Ð±Ð¾Ñ€Ð¾Ð½ÑÑ”Ñ‚Ðµ Ð¼ÐµÐ½Ñ– Ð¿Ñ€Ð°Ñ†ÑŽÐ²Ð°Ñ‚Ð¸?\n- Ð¢Ð°Ðº, Ñ†Ðµ Ð°Ð½Ð³Ñ–Ð½Ð°. Ð¯ Ð·Ð°Ð±Ð¾Ñ€Ð¾Ð½ÑÑŽ Ð²Ð°Ð¼ Ð¿Ñ€Ð°Ñ†ÑŽÐ²Ð°Ñ‚Ð¸ Ñ†ÑŒÐ¾Ð³Ð¾ Ñ‚Ð¸Ð¶Ð½Ñ.\n\n> [!answer]\n> 1. Ð”Ð¾Ð±Ñ€Ð¸Ð¹ Ð´ÐµÐ½ÑŒ! Ð©Ð¾ Ð²Ð°Ñ Ñ‚ÑƒÑ€Ð±ÑƒÑ”?\n> 2. ÐœÐµÐ½Ñ– Ð±Ð¾Ð»ÑÑ‡Ðµ ÐºÐ¾Ð²Ñ‚Ð°Ñ‚Ð¸. Ð¯ Ð´ÑƒÐ¼Ð°ÑŽ, Ñ†Ðµ Ð°Ð½Ð³Ñ–Ð½Ð°.\n> 3. Ð¢Ð°Ðº, Ñ†Ðµ Ð°Ð½Ð³Ñ–Ð½Ð°. Ð¯ Ð·Ð°Ð±Ð¾Ñ€Ð¾Ð½ÑÑŽ Ð²Ð°Ð¼ Ð¿Ñ€Ð°Ñ†ÑŽÐ²Ð°Ñ‚Ð¸ Ñ†ÑŒÐ¾Ð³Ð¾ Ñ‚Ð¸Ð¶Ð½Ñ.\n> 4. Ð’Ð¸ Ð·Ð°Ð±Ð¾Ñ€Ð¾Ð½ÑÑ”Ñ‚Ðµ Ð¼ÐµÐ½Ñ– Ð¿Ñ€Ð°Ñ†ÑŽÐ²Ð°Ñ‚Ð¸?\n> 5. Ð¯ Ñ€Ð°Ð´Ð¶Ñƒ Ð²Ð°Ð¼ Ð²Ñ–Ð´Ð¿Ð¾Ñ‡Ð¸Ð²Ð°Ñ‚Ð¸ Ñ– Ð¿Ð¸Ñ‚Ð¸ Ð±Ð°Ð³Ð°Ñ‚Ð¾ Ð²Ð¾Ð´Ð¸.\n> 6. Ð”ÑÐºÑƒÑŽ Ð²Ð°Ð¼, Ð»Ñ–ÐºÐ°Ñ€ÑŽ!\n\n---\n\n- Ð¢Ð°Ðº, Ð·Ð²Ð¸Ñ‡Ð°Ð¹Ð½Ð¾!\n- Ð¢Ð¸ Ð¼Ð¾Ð¶ÐµÑˆ Ð¿Ð¾ÐºÐ°Ð·Ð°Ñ‚Ð¸ Ð¼ÐµÐ½Ñ– Ñ†ÑŽ Ñ„Ð¾Ñ‚Ð¾Ð³Ñ€Ð°Ñ„Ñ–ÑŽ?\n- Ð”ÑÐºÑƒÑŽ! ÐœÐµÐ½Ñ– Ð´ÑƒÐ¶Ðµ Ð¿Ð¾Ð´Ð¾Ð±Ð°Ñ”Ñ‚ÑŒÑÑ Ñ†Ðµ Ð¼Ñ–ÑÑ†Ðµ.\n- Ð¦Ðµ ÐšÐ°Ñ€Ð¿Ð°Ñ‚Ð¸. Ð¯ Ð±ÑƒÐ² Ñ‚Ð°Ð¼ Ð¼Ð¸Ð½ÑƒÐ»Ð¾Ð³Ð¾ Ñ€Ð¾ÐºÑƒ.\n- Ð¯ÐºÐµ Ð³Ð°Ñ€Ð½Ðµ Ð¼Ñ–ÑÑ†Ðµ! Ð©Ð¾ Ñ†Ðµ?\n- Ð¢Ð¾Ð±Ñ– Ñ‚ÐµÐ¶ Ð²Ð°Ñ€Ñ‚Ð¾ Ð¿Ð¾Ñ—Ñ…Ð°Ñ‚Ð¸ Ñ‚ÑƒÐ´Ð¸!\n\n> [!answer]\n> 1. Ð¢Ð¸ Ð¼Ð¾Ð¶ÐµÑˆ Ð¿Ð¾ÐºÐ°Ð·Ð°Ñ‚Ð¸ Ð¼ÐµÐ½Ñ– Ñ†ÑŽ Ñ„Ð¾Ñ‚Ð¾Ð³Ñ€Ð°Ñ„Ñ–ÑŽ?\n> 2. Ð¢Ð°Ðº, Ð·Ð²Ð¸Ñ‡Ð°Ð¹Ð½Ð¾!\n> 3. Ð¯ÐºÐµ Ð³Ð°Ñ€Ð½Ðµ Ð¼Ñ–ÑÑ†Ðµ! Ð©Ð¾ Ñ†Ðµ?\n> 4. Ð¦Ðµ ÐšÐ°Ñ€Ð¿Ð°Ñ‚Ð¸. Ð¯ Ð±ÑƒÐ² Ñ‚Ð°Ð¼ Ð¼Ð¸Ð½ÑƒÐ»Ð¾Ð³Ð¾ Ñ€Ð¾ÐºÑƒ.\n> 5. Ð”ÑÐºÑƒÑŽ! ÐœÐµÐ½Ñ– Ð´ÑƒÐ¶Ðµ Ð¿Ð¾Ð´Ð¾Ð±Ð°Ñ”Ñ‚ÑŒÑÑ Ñ†Ðµ Ð¼Ñ–ÑÑ†Ðµ.\n> 6. Ð¢Ð¾Ð±Ñ– Ñ‚ÐµÐ¶ Ð²Ð°Ñ€Ñ‚Ð¾ Ð¿Ð¾Ñ—Ñ…Ð°Ñ‚Ð¸ Ñ‚ÑƒÐ´Ð¸!\n\n## mark-the-words: Find Dative Objects\n\nClick on the dative objects in these sentences.\n\nÐ¯ Ð´Ð¾Ð¿Ð¾Ð¼Ð°Ð³Ð°ÑŽ [Ð¼Ð°Ð¼Ñ–](correct) Ð³Ð¾Ñ‚ÑƒÐ²Ð°Ñ‚Ð¸ Ð¾Ð±Ñ–Ð´. Ð’Ð¾Ð½Ð° Ð´ÑÐºÑƒÑ” [Ð¼ÐµÐ½Ñ–](correct). [ÐœÑƒÐ·Ð¸ÐºÐ°](wrong) Ð·Ð°Ð²Ð°Ð¶Ð°Ñ” [ÑÑƒÑÑ–Ð´Ð°Ð¼](correct). Ð’Ñ‡Ð¸Ñ‚ÐµÐ»ÑŒ Ð¿Ð¾ÑÑÐ½ÑŽÑ” [ÑƒÑ‡Ð½ÑÐ¼](correct) [Ð¿Ñ€Ð°Ð²Ð¸Ð»Ð¾](wrong).\n\n---\n\n[ÐœÐµÐ½Ñ–](correct) Ð¿Ð¾Ð´Ð¾Ð±Ð°Ñ”Ñ‚ÑŒÑÑ [Ñ†Ñ ÐºÐ½Ð¸Ð³Ð°](wrong). Ð’Ñ–Ð½ Ð¿Ð¾ÐºÐ°Ð·ÑƒÑ” [Ð´Ñ€ÑƒÐ³Ð¾Ð²Ñ–](correct) [Ñ„Ð¾Ñ‚Ð¾](wrong). ÐœÐ¸ Ð´Ð¾Ð²Ñ–Ñ€ÑÑ”Ð¼Ð¾ [Ð»Ñ–ÐºÐ°Ñ€ÐµÐ²Ñ–](correct). Ð‘Ð°Ñ‚ÑŒÐºÐ¸ Ð·Ð°Ð±Ð¾Ñ€Ð¾Ð½ÑÑŽÑ‚ÑŒ [Ð´Ñ–Ñ‚ÑÐ¼](correct) [Ð³Ñ€Ð°Ñ‚Ð¸ÑÑ](wrong) Ð½Ð°Ð´Ð²Ð¾Ñ€Ñ–.\n\n---\n\nÐ‘Ð°Ð±ÑƒÑÑ Ñ€Ð¾Ð·Ð¿Ð¾Ð²Ñ–Ð´Ð°Ñ” [Ð¾Ð½ÑƒÐºÐ°Ð¼](correct) [ÐºÐ°Ð·ÐºÑƒ](wrong). Ð¯ Ð²Ñ–Ñ€ÑŽ [Ñ‚Ð¾Ð±Ñ–](correct). [Ð›Ñ–ÐºÐ°Ñ€](wrong) Ñ€Ð°Ð´Ð¸Ñ‚ÑŒ [Ð¿Ð°Ñ†Ñ–Ñ”Ð½Ñ‚Ð¾Ð²Ñ–](correct) Ð²Ñ–Ð´Ð¿Ð¾Ñ‡Ð¸Ð²Ð°Ñ‚Ð¸. Ð’Ð¾Ð½Ð° Ð·Ð°Ð·Ð´Ñ€Ð¸Ñ‚ÑŒ [Ð¿Ð¾Ð´Ñ€ÑƒÐ·Ñ–](correct).\n\n## translate: English to Ukrainian\n\nI help my brother.\n\n- [ ] Ð¯ Ð´Ð¾Ð¿Ð¾Ð¼Ð°Ð³Ð°ÑŽ Ð±Ñ€Ð°Ñ‚.\n- [x] Ð¯ Ð´Ð¾Ð¿Ð¾Ð¼Ð°Ð³Ð°ÑŽ Ð±Ñ€Ð°Ñ‚Ð¾Ð²Ñ–.\n- [ ] Ð¯ Ð´Ð¾Ð¿Ð¾Ð¼Ð°Ð³Ð°ÑŽ Ð±Ñ€Ð°Ñ‚Ð°.\n\n---\n\nShe shows her friend a photo.\n\n- [x] Ð’Ð¾Ð½Ð° Ð¿Ð¾ÐºÐ°Ð·ÑƒÑ” Ð¿Ð¾Ð´Ñ€ÑƒÐ·Ñ– Ñ„Ð¾Ñ‚Ð¾.\n- [ ] Ð’Ð¾Ð½Ð° Ð¿Ð¾ÐºÐ°Ð·ÑƒÑ” Ð¿Ð¾Ð´Ñ€ÑƒÐ³Ð° Ñ„Ð¾Ñ‚Ð¾.\n- [ ] Ð’Ð¾Ð½Ð° Ð¿Ð¾ÐºÐ°Ð·ÑƒÑ” Ð¿Ð¾Ð´Ñ€ÑƒÐ³Ñƒ Ñ„Ð¾Ñ‚Ð¾.\n\n---\n\nThe doctor forbids the patient to smoke.\n\n- [ ] Ð›Ñ–ÐºÐ°Ñ€ Ð·Ð°Ð±Ð¾Ñ€Ð¾Ð½ÑÑ” Ð¿Ð°Ñ†Ñ–Ñ”Ð½Ñ‚ ÐºÑƒÑ€Ð¸Ñ‚Ð¸.\n- [x] Ð›Ñ–ÐºÐ°Ñ€ Ð·Ð°Ð±Ð¾Ñ€Ð¾Ð½ÑÑ” Ð¿Ð°Ñ†Ñ–Ñ”Ð½Ñ‚Ð¾Ð²Ñ– ÐºÑƒÑ€Ð¸Ñ‚Ð¸.\n- [ ] Ð›Ñ–ÐºÐ°Ñ€ Ð·Ð°Ð±Ð¾Ñ€Ð¾Ð½ÑÑ” Ð¿Ð°Ñ†Ñ–Ñ”Ð½Ñ‚Ð° ÐºÑƒÑ€Ð¸Ñ‚Ð¸.\n\n---\n\nI thank you for the help.\n\n- [ ] Ð¯ Ð´ÑÐºÑƒÑŽ Ñ‚ÐµÐ±Ðµ Ð·Ð° Ð´Ð¾Ð¿Ð¾Ð¼Ð¾Ð³Ñƒ.\n- [x] Ð¯ Ð´ÑÐºÑƒÑŽ Ñ‚Ð¾Ð±Ñ– Ð·Ð° Ð´Ð¾Ð¿Ð¾Ð¼Ð¾Ð³Ñƒ.\n- [ ] Ð¯ Ð´ÑÐºÑƒÑŽ Ñ‚Ð¸ Ð·Ð° Ð´Ð¾Ð¿Ð¾Ð¼Ð¾Ð³Ñƒ.\n\n---\n\nThe music bothers the neighbors.\n\n- [x] ÐœÑƒÐ·Ð¸ÐºÐ° Ð·Ð°Ð²Ð°Ð¶Ð°Ñ” ÑÑƒÑÑ–Ð´Ð°Ð¼.\n- [ ] ÐœÑƒÐ·Ð¸ÐºÐ° Ð·Ð°Ð²Ð°Ð¶Ð°Ñ” ÑÑƒÑÑ–Ð´Ð¸.\n- [ ] ÐœÑƒÐ·Ð¸ÐºÐ° Ð·Ð°Ð²Ð°Ð¶Ð°Ñ” ÑÑƒÑÑ–Ð´Ñ–Ð².\n\n---\n\nI like this film.\n\n- [ ] Ð¯ Ð¿Ð¾Ð´Ð¾Ð±Ð°ÑŽÑÑ Ñ†ÐµÐ¹ Ñ„Ñ–Ð»ÑŒÐ¼.\n- [x] ÐœÐµÐ½Ñ– Ð¿Ð¾Ð´Ð¾Ð±Ð°Ñ”Ñ‚ÑŒÑÑ Ñ†ÐµÐ¹ Ñ„Ñ–Ð»ÑŒÐ¼.\n- [ ] Ð¯ Ð¿Ð¾Ð´Ð¾Ð±Ð°ÑŽ Ñ†ÐµÐ¹ Ñ„Ñ–Ð»ÑŒÐ¼.\n\n---\n\nThe teacher explains the rule to the students.\n\n- [x] Ð’Ñ‡Ð¸Ñ‚ÐµÐ»ÑŒ Ð¿Ð¾ÑÑÐ½ÑŽÑ” ÑƒÑ‡Ð½ÑÐ¼ Ð¿Ñ€Ð°Ð²Ð¸Ð»Ð¾.\n- [ ] Ð’Ñ‡Ð¸Ñ‚ÐµÐ»ÑŒ Ð¿Ð¾ÑÑÐ½ÑŽÑ” ÑƒÑ‡Ð½Ñ– Ð¿Ñ€Ð°Ð²Ð¸Ð»Ð¾.\n- [ ] Ð’Ñ‡Ð¸Ñ‚ÐµÐ»ÑŒ Ð¿Ð¾ÑÑÐ½ÑŽÑ” ÑƒÑ‡Ð½Ñ–Ð² Ð¿Ñ€Ð°Ð²Ð¸Ð»Ð¾.\n\n---\n\nI trust my friend.\n\n- [ ] Ð¯ Ð´Ð¾Ð²Ñ–Ñ€ÑÑŽ Ð´Ñ€ÑƒÐ³.\n- [x] Ð¯ Ð´Ð¾Ð²Ñ–Ñ€ÑÑŽ Ð´Ñ€ÑƒÐ³Ð¾Ð²Ñ–.\n- [ ] Ð¯ Ð´Ð¾Ð²Ñ–Ñ€ÑÑŽ Ð´Ñ€ÑƒÐ³Ð°.\n\n---\n\nMom allows the children to play.\n\n- [x] ÐœÐ°Ð¼Ð° Ð´Ð¾Ð·Ð²Ð¾Ð»ÑÑ” Ð´Ñ–Ñ‚ÑÐ¼ Ð³Ñ€Ð°Ñ‚Ð¸ÑÑ.\n- [ ] ÐœÐ°Ð¼Ð° Ð´Ð¾Ð·Ð²Ð¾Ð»ÑÑ” Ð´Ñ–Ñ‚Ð¸ Ð³Ñ€Ð°Ñ‚Ð¸ÑÑ.\n- [ ] ÐœÐ°Ð¼Ð° Ð´Ð¾Ð·Ð²Ð¾Ð»ÑÑ” Ð´Ñ–Ñ‚ÐµÐ¹ Ð³Ñ€Ð°Ñ‚Ð¸ÑÑ.\n\n---\n\nShe envies her friend.\n\n- [ ] Ð’Ð¾Ð½Ð° Ð·Ð°Ð·Ð´Ñ€Ð¸Ñ‚ÑŒ Ð¿Ð¾Ð´Ñ€ÑƒÐ³Ð°.\n- [x] Ð’Ð¾Ð½Ð° Ð·Ð°Ð·Ð´Ñ€Ð¸Ñ‚ÑŒ Ð¿Ð¾Ð´Ñ€ÑƒÐ·Ñ–.\n- [ ] Ð’Ð¾Ð½Ð° Ð·Ð°Ð·Ð´Ñ€Ð¸Ñ‚ÑŒ Ð¿Ð¾Ð´Ñ€ÑƒÐ³Ñƒ.\n\n---\n\nI believe you.\n\n- [ ] Ð¯ Ð²Ñ–Ñ€ÑŽ Ñ‚Ð¸.\n- [x] Ð¯ Ð²Ñ–Ñ€ÑŽ Ñ‚Ð¾Ð±Ñ–.\n- [ ] Ð¯ Ð²Ñ–Ñ€ÑŽ Ñ‚ÐµÐ±Ðµ.\n\n---\n\nGrandma tells the grandchildren a story.\n\n- [x] Ð‘Ð°Ð±ÑƒÑÑ Ñ€Ð¾Ð·Ð¿Ð¾Ð²Ñ–Ð´Ð°Ñ” Ð¾Ð½ÑƒÐºÐ°Ð¼ ÐºÐ°Ð·ÐºÑƒ.\n- [ ] Ð‘Ð°Ð±ÑƒÑÑ Ñ€Ð¾Ð·Ð¿Ð¾Ð²Ñ–Ð´Ð°Ñ” Ð¾Ð½ÑƒÐºÐ¸ ÐºÐ°Ð·ÐºÑƒ.\n- [ ] Ð‘Ð°Ð±ÑƒÑÑ Ñ€Ð¾Ð·Ð¿Ð¾Ð²Ñ–Ð´Ð°Ñ” Ð¾Ð½ÑƒÐºÑ–Ð² ÐºÐ°Ð·ÐºÑƒ.\n\n---\n\n# Vocabulary\n\n| Word | IPA | English | POS | Gender | Note |\n|------|-----|---------|-----|--------|------|\n| Ð´Ð¾Ð¿Ð¾Ð¼Ð°Ð³Ð°Ñ‚Ð¸ | /dopoËˆmÉ‘É¦É‘tÉª/ | to help | verb | â€” | + Dat |\n| Ð·Ð°Ð²Ð°Ð¶Ð°Ñ‚Ð¸ | /zÉ‘Ê‹É‘ËˆÊ’É‘tÉª/ | to disturb, bother | verb | â€” | + Dat |\n| Ð¿Ð¾Ð´Ð¾Ð±Ð°Ñ‚Ð¸ÑÑ | /podoËˆbÉ‘tÉªsÊ²É‘/ | to please, be liked | verb | â€” | + Dat |\n| Ð²Ñ–Ñ€Ð¸Ñ‚Ð¸ | /ËˆÊ‹irÉªtÉª/ | to believe | verb | â€” | + Dat |\n| Ð´Ð¾Ð²Ñ–Ñ€ÑÑ‚Ð¸ | /doÊ‹iËˆrÊ²É‘tÉª/ | to trust | verb | â€” | + Dat |\n| Ð´ÑÐºÑƒÐ²Ð°Ñ‚Ð¸ | /dÊ²É‘ËˆkuÊ‹É‘tÉª/ | to thank | verb | â€” | + Dat |\n| Ð²Ð¸Ð±Ð°Ñ‡Ð°Ñ‚Ð¸ | /Ê‹ÉªbÉ‘ËˆtÊƒÉ‘tÉª/ | to excuse, forgive | verb | â€” | + Dat |\n| Ð¿Ñ€Ð¾Ð±Ð°Ñ‡Ð°Ñ‚Ð¸ | /probÉ‘ËˆtÊƒÉ‘tÉª/ | to forgive (serious) | verb | â€” | + Dat |\n| Ð·Ð°Ð·Ð´Ñ€Ð¸Ñ‚Ð¸ | /ËˆzÉ‘zdrÉªtÉª/ | to envy | verb | â€” | + Dat |\n| ÑÐ¸Ð¼Ð¿Ð°Ñ‚Ð¸Ð·ÑƒÐ²Ð°Ñ‚Ð¸ | /sÉªmpÉ‘tÉªËˆzuÊ‹É‘tÉª/ | to sympathize | verb | â€” | + Dat |\n| ÑÐ¿Ñ–Ð²Ñ‡ÑƒÐ²Ð°Ñ‚Ð¸ | /spiÊ‹tÊƒuËˆÊ‹É‘tÉª/ | to feel for, empathize | verb | â€” | + Dat |\n| Ð»Ð¸Ñ‡Ð¸Ñ‚Ð¸ | /lÉªËˆtÊƒÉªtÉª/ | to suit, become | verb | â€” | + Dat |\n| Ð¿Ñ–Ð´Ñ…Ð¾Ð´Ð¸Ñ‚Ð¸ | /pidxoËˆdÉªtÉª/ | to suit, fit | verb | â€” | + Dat |\n| Ð²Ð¸ÑÑ‚Ð°Ñ‡Ð°Ñ‚Ð¸ | /Ê‹ÉªstÉ‘ËˆtÊƒÉ‘tÉª/ | to be enough | verb | â€” | + Dat |\n| Ð±Ñ€Ð°ÐºÑƒÐ²Ð°Ñ‚Ð¸ | /brÉ‘ËˆkuÊ‹É‘tÉª/ | to lack, be short of | verb | â€” | + Dat |\n| ÑˆÐºÐ¾Ð´Ð¸Ñ‚Ð¸ | /ÊƒkoËˆdÉªtÉª/ | to harm | verb | â€” | + Dat |\n| ÑÐ»ÑƒÐ¶Ð¸Ñ‚Ð¸ | /sluËˆÊ’ÉªtÉª/ | to serve | verb | â€” | + Dat |\n| Ð½Ð°Ð»ÐµÐ¶Ð°Ñ‚Ð¸ | /nÉ‘leËˆÊ’É‘tÉª/ | to belong | verb | â€” | + Dat |\n| ÑÐ¿Ð¾Ð´Ð¾Ð±Ð°Ñ‚Ð¸ÑÑ | /spodoËˆbÉ‘tÉªsÊ²É‘/ | to come to like | verb | â€” | perfective of Ð¿Ð¾Ð´Ð¾Ð±Ð°Ñ‚Ð¸ÑÑ |\n| Ð·Ð°Ñ…Ð¾Ñ‚Ñ–Ñ‚Ð¸ÑÑ | /zÉ‘xoËˆtitÉªsÊ²É‘/ | to feel like, want | verb | â€” | + Dat; impersonal |\n| Ð´Ð¾Ð·Ð²Ð¾Ð»ÑÑ‚Ð¸ | /dozÊ‹oËˆlÊ²É‘tÉª/ | to allow, permit | verb | â€” | + Dat + Inf |\n| Ð·Ð°Ð±Ð¾Ñ€Ð¾Ð½ÑÑ‚Ð¸ | /zÉ‘boroËˆnÊ²É‘tÉª/ | to forbid | verb | â€” | + Dat + Inf |\n| Ñ€Ð°Ð´Ð¸Ñ‚Ð¸ | /ËˆrÉ‘dÉªtÉª/ | to advise | verb | â€” | + Dat + Acc |\n| Ð²Ñ–Ð´Ð¿Ð¾Ð²Ñ–Ð´Ð°Ñ‚Ð¸ | /Ê‹idpoÊ‹iËˆdÉ‘tÉª/ | to answer, reply | verb | â€” | + Dat |\n| Ñ‚ÐµÐ»ÐµÑ„Ð¾Ð½ÑƒÐ²Ð°Ñ‚Ð¸ | /telefoËˆnuÊ‹É‘tÉª/ | to phone, call | verb | â€” | + Dat |\n| Ð²Ñ–Ð´Ð¼Ñ–Ð½Ð¾Ðº | /vidËˆminÉ”k/ | grammatical case | noun | m | grammar term |\n| Ð´Ð°Ð²Ð°Ð»ÑŒÐ½Ð¸Ð¹ | /dÉ‘ËˆvÉ‘lÊ²nÉªj/ | Dative (case) | adj | m | ÐºÐ¾Ð¼Ñƒ? Ñ‡Ð¾Ð¼Ñƒ? |\n| Ñ‡Ð°Ñ | /tÍ¡ÊƒÉ‘s/ | time | noun | m | review from A1 |\n\n---\n",
    "createdAt": "2025-12-16T11:55:14.517731Z",
    "modifiedAt": "2025-12-16T11:55:14.517731Z",
    "version": 2
  },
  "activities": [],
  "vocabulary": {
    "moduleId": "mod-uk-A2-03",
    "level": "A2",
    "phase": "A2.1",
    "wordCount": 28,
    "newWordCount": 28,
    "reviewWordCount": 0,
    "transliterationMode": "none",
    "words": [
      {
        "id": "vocab-1",
        "uk": "Ð´Ð¾Ð¿Ð¾Ð¼Ð°Ð³Ð°Ñ‚Ð¸",
        "ipa": "/dopoËˆmÉ‘É¦É‘tÉª/",
        "en": "to help",
        "pos": "verb",
        "gender": null,
        "note": "+ Dat"
      },
      {
        "id": "vocab-2",
        "uk": "Ð·Ð°Ð²Ð°Ð¶Ð°Ñ‚Ð¸",
        "ipa": "/zÉ‘Ê‹É‘ËˆÊ’É‘tÉª/",
        "en": "to disturb, bother",
        "pos": "verb",
        "gender": null,
        "note": "+ Dat"
      },
      {
        "id": "vocab-3",
        "uk": "Ð¿Ð¾Ð´Ð¾Ð±Ð°Ñ‚Ð¸ÑÑ",
        "ipa": "/podoËˆbÉ‘tÉªsÊ²É‘/",
        "en": "to please, be liked",
        "pos": "verb",
        "gender": null,
        "note": "+ Dat"
      },
      {
        "id": "vocab-4",
        "uk": "Ð²Ñ–Ñ€Ð¸Ñ‚Ð¸",
        "ipa": "/ËˆÊ‹irÉªtÉª/",
        "en": "to believe",
        "pos": "verb",
        "gender": null,
        "note": "+ Dat"
      },
      {
        "id": "vocab-5",
        "uk": "Ð´Ð¾Ð²Ñ–Ñ€ÑÑ‚Ð¸",
        "ipa": "/doÊ‹iËˆrÊ²É‘tÉª/",
        "en": "to trust",
        "pos": "verb",
        "gender": null,
        "note": "+ Dat"
      },
      {
        "id": "vocab-6",
        "uk": "Ð´ÑÐºÑƒÐ²Ð°Ñ‚Ð¸",
        "ipa": "/dÊ²É‘ËˆkuÊ‹É‘tÉª/",
        "en": "to thank",
        "pos": "verb",
        "gender": null,
        "note": "+ Dat"
      },
      {
        "id": "vocab-7",
        "uk": "Ð²Ð¸Ð±Ð°Ñ‡Ð°Ñ‚Ð¸",
        "ipa": "/Ê‹ÉªbÉ‘ËˆtÊƒÉ‘tÉª/",
        "en": "to excuse, forgive",
        "pos": "verb",
        "gender": null,
        "note": "+ Dat"
      },
      {
        "id": "vocab-8",
        "uk": "Ð¿Ñ€Ð¾Ð±Ð°Ñ‡Ð°Ñ‚Ð¸",
        "ipa": "/probÉ‘ËˆtÊƒÉ‘tÉª/",
        "en": "to forgive (serious)",
        "pos": "verb",
        "gender": null,
        "note": "+ Dat"
      },
      {
        "id": "vocab-9",
        "uk": "Ð·Ð°Ð·Ð´Ñ€Ð¸Ñ‚Ð¸",
        "ipa": "/ËˆzÉ‘zdrÉªtÉª/",
        "en": "to envy",
        "pos": "verb",
        "gender": null,
        "note": "+ Dat"
      },
      {
        "id": "vocab-10",
        "uk": "ÑÐ¸Ð¼Ð¿Ð°Ñ‚Ð¸Ð·ÑƒÐ²Ð°Ñ‚Ð¸",
        "ipa": "/sÉªmpÉ‘tÉªËˆzuÊ‹É‘tÉª/",
        "en": "to sympathize",
        "pos": "verb",
        "gender": null,
        "note": "+ Dat"
      },
      {
        "id": "vocab-11",
        "uk": "ÑÐ¿Ñ–Ð²Ñ‡ÑƒÐ²Ð°Ñ‚Ð¸",
        "ipa": "/spiÊ‹tÊƒuËˆÊ‹É‘tÉª/",
        "en": "to feel for, empathize",
        "pos": "verb",
        "gender": null,
        "note": "+ Dat"
      },
      {
        "id": "vocab-12",
        "uk": "Ð»Ð¸Ñ‡Ð¸Ñ‚Ð¸",
        "ipa": "/lÉªËˆtÊƒÉªtÉª/",
        "en": "to suit, become",
        "pos": "verb",
        "gender": null,
        "note": "+ Dat"
      },
      {
        "id": "vocab-13",
        "uk": "Ð¿Ñ–Ð´Ñ…Ð¾Ð´Ð¸Ñ‚Ð¸",
        "ipa": "/pidxoËˆdÉªtÉª/",
        "en": "to suit, fit",
        "pos": "verb",
        "gender": null,
        "note": "+ Dat"
      },
      {
        "id": "vocab-14",
        "uk": "Ð²Ð¸ÑÑ‚Ð°Ñ‡Ð°Ñ‚Ð¸",
        "ipa": "/Ê‹ÉªstÉ‘ËˆtÊƒÉ‘tÉª/",
        "en": "to be enough",
        "pos": "verb",
        "gender": null,
        "note": "+ Dat"
      },
      {
        "id": "vocab-15",
        "uk": "Ð±Ñ€Ð°ÐºÑƒÐ²Ð°Ñ‚Ð¸",
        "ipa": "/brÉ‘ËˆkuÊ‹É‘tÉª/",
        "en": "to lack, be short of",
        "pos": "verb",
        "gender": null,
        "note": "+ Dat"
      },
      {
        "id": "vocab-16",
        "uk": "ÑˆÐºÐ¾Ð´Ð¸Ñ‚Ð¸",
        "ipa": "/ÊƒkoËˆdÉªtÉª/",
        "en": "to harm",
        "pos": "verb",
        "gender": null,
        "note": "+ Dat"
      },
      {
        "id": "vocab-17",
        "uk": "ÑÐ»ÑƒÐ¶Ð¸Ñ‚Ð¸",
        "ipa": "/sluËˆÊ’ÉªtÉª/",
        "en": "to serve",
        "pos": "verb",
        "gender": null,
        "note": "+ Dat"
      },
      {
        "id": "vocab-18",
        "uk": "Ð½Ð°Ð»ÐµÐ¶Ð°Ñ‚Ð¸",
        "ipa": "/nÉ‘leËˆÊ’É‘tÉª/",
        "en": "to belong",
        "pos": "verb",
        "gender": null,
        "note": "+ Dat"
      },
      {
        "id": "vocab-19",
        "uk": "ÑÐ¿Ð¾Ð´Ð¾Ð±Ð°Ñ‚Ð¸ÑÑ",
        "ipa": "/spodoËˆbÉ‘tÉªsÊ²É‘/",
        "en": "to come to like",
        "pos": "verb",
        "gender": null,
        "note": "perfective of Ð¿Ð¾Ð´Ð¾Ð±Ð°Ñ‚Ð¸ÑÑ"
      },
      {
        "id": "vocab-20",
        "uk": "Ð·Ð°Ñ…Ð¾Ñ‚Ñ–Ñ‚Ð¸ÑÑ",
        "ipa": "/zÉ‘xoËˆtitÉªsÊ²É‘/",
        "en": "to feel like, want",
        "pos": "verb",
        "gender": null,
        "note": "+ Dat; impersonal"
      },
      {
        "id": "vocab-21",
        "uk": "Ð´Ð¾Ð·Ð²Ð¾Ð»ÑÑ‚Ð¸",
        "ipa": "/dozÊ‹oËˆlÊ²É‘tÉª/",
        "en": "to allow, permit",
        "pos": "verb",
        "gender": null,
        "note": "+ Dat + Inf"
      },
      {
        "id": "vocab-22",
        "uk": "Ð·Ð°Ð±Ð¾Ñ€Ð¾Ð½ÑÑ‚Ð¸",
        "ipa": "/zÉ‘boroËˆnÊ²É‘tÉª/",
        "en": "to forbid",
        "pos": "verb",
        "gender": null,
        "note": "+ Dat + Inf"
      },
      {
        "id": "vocab-23",
        "uk": "Ñ€Ð°Ð´Ð¸Ñ‚Ð¸",
        "ipa": "/ËˆrÉ‘dÉªtÉª/",
        "en": "to advise",
        "pos": "verb",
        "gender": null,
        "note": "+ Dat + Acc"
      },
      {
        "id": "vocab-24",
        "uk": "Ð²Ñ–Ð´Ð¿Ð¾Ð²Ñ–Ð´Ð°Ñ‚Ð¸",
        "ipa": "/Ê‹idpoÊ‹iËˆdÉ‘tÉª/",
        "en": "to answer, reply",
        "pos": "verb",
        "gender": null,
        "note": "+ Dat"
      },
      {
        "id": "vocab-25",
        "uk": "Ñ‚ÐµÐ»ÐµÑ„Ð¾Ð½ÑƒÐ²Ð°Ñ‚Ð¸",
        "ipa": "/telefoËˆnuÊ‹É‘tÉª/",
        "en": "to phone, call",
        "pos": "verb",
        "gender": null,
        "note": "+ Dat"
      },
      {
        "id": "vocab-26",
        "uk": "Ð²Ñ–Ð´Ð¼Ñ–Ð½Ð¾Ðº",
        "ipa": "/vidËˆminÉ”k/",
        "en": "grammatical case",
        "pos": "noun",
        "gender": "m",
        "note": "grammar term"
      },
      {
        "id": "vocab-27",
        "uk": "Ð´Ð°Ð²Ð°Ð»ÑŒÐ½Ð¸Ð¹",
        "ipa": "/dÉ‘ËˆvÉ‘lÊ²nÉªj/",
        "en": "Dative (case)",
        "pos": "adj",
        "gender": "m",
        "note": "ÐºÐ¾Ð¼Ñƒ? Ñ‡Ð¾Ð¼Ñƒ?"
      },
      {
        "id": "vocab-28",
        "uk": "Ñ‡Ð°Ñ",
        "ipa": "/tÍ¡ÊƒÉ‘s/",
        "en": "time",
        "pos": "noun",
        "gender": "m",
        "note": "review from A1"
      }
    ],
    "reviewWords": []
  }
}